,회사명,날짜,언론사,기사제목,링크,본문
17,삼성전자, 2020-01-1316:06,연합뉴스 ,"코스피, 외국인 매수에 1%대 급등…2,230선 육박(종합)",https://finance.naver.com/news/news_read.nhn?article_id=0011332044&office_id=001&mode=search&query=삼성전자&page=3,"['       코스피, 외국인 매수에 1%대 급등…2,230선 육박(종합)      기사입력2020-01-13 16:06기사원문좋아요훈훈해요좋아요 평가하기공감좋아요0훈훈해요0슬퍼요0화나요0후속기사 원해요0댓글 코스피 9개월 만에 최고…외국인, 유가증권시장서 2천579억원 순매수삼성전자 6만원·SK하이닉스 10만원 선 돌파  코스피 상승 (PG)[제작 최자윤] 일러스트(서울=연합뉴스) 김기훈 기자 = 코스피가 13일 1%대 급등세를 기록했다.    이날 코스피는 전 거래일보다 22.87포인트(1.04%) 오른 2,229.26에 거래를 마쳤다.     이는 종가 기준으로 지난해 4월 17일(2,245.89) 이후 약 9개월 만에 최고치다.     지수는 전장보다 1.90포인트(0.09%) 내린 2,204.49로 출발했다가 상승세로 돌아서 우상향 곡선을 그렸다. 장중 2,230.43까지 오르기도 했다.     유가증권시장에서는 외국인이 2천579억원어치의 주식을 순매수했다. 개인과 기관은 각각 492억원, 2천147억원을 순매도했다.    이영곤 하나금융투자 연구원은 ""미국과 이란의 갈등으로 불거진 중동 리스크가 완화 국면으로 전개되고 있고 이번 주 미중 1단계 무역 합의도 1차 서명을 앞두고 있어 위험자산 선호 현상이 이어지고 있다""며 ""삼성전자 등이 견조한 흐름을 보이고 한한령(限韓令) 해제 기대감에 면세·화장품주도 강세를 나타내는 등 전반적으로 투자심리가 개선된 모습""이라고 분석했다.    시가총액 10위권 종목 가운데는 현대모비스(-1.02%)만 내렸다.    삼성전자(0.84%), SK하이닉스(1.62%), 삼성바이오로직스(0.92%), 현대차(1.32%), LG화학(2.31%), 셀트리온(1.13%), LG생활건강(4.54%), 포스코(0.42%) 등은 올랐다.    이날 삼성전자는 전주말 종가보다 500원 오른 6만원, SK하이닉스는 1천600원 오른 10만500원으로 마감해 각각 6만원, 10만원 선을 넘어서면서 최고가 행진을 이어갔다.    업종별로는 화학(2.05%), 유통업(1.81%), 건설업(1.45%) 등 대부분이 강세였고 의료·정밀(-0.35%)만 약세였다.코스피 1%대 급등 마감…2,230선 육박(서울=연합뉴스) 류효림 기자 = 코스피가 13일 1%대 급등세를 기록해 전 거래일보다 22.87포인트(1.04%) 오른 2,229.26에 거래를 마쳤다. 사진은 이날 KEB 하나은행 딜링룸 모습. 2020.1.13 ryousanta@yna.co.kr주가가 오른 종목은 595개, 내린 종목은 248개였다. 보합은 65개 종목이었다.    프로그램 매매는 차익거래는 매도 우위, 비차익거래는 매수 우위로 전체적으로는 1천114억원의 순매수로 집계됐다.    유가증권시장의 거래량은 4억4천994만주, 거래대금은 6조1천억이었다.    코스닥지수는 전장보다 6.19포인트(0.92%) 오른 679.22로 마감했다.    지수는 전장보다 0.73포인트(0.11%) 오른 673.76으로 개장해 상승세를 유지했다. 코스닥시장에서는 개인이 1천157억원을 순매수했고, 외국인과 기관은 각각 262억원, 680억원을 순매도했다.    시총 상위주 중에 셀트리온헬스케어(1.55%), CJ ENM(5.68%), 펄어비스(3.66%), 스튜디오드래곤(3.08%), 케이엠더블유(0.89%), 메디톡스(8.27%), 파라다이스(1.65%) 등은 올랐다.    에이치엘비(-0.53%), 헬릭스미스(-1.75%), SK머티리얼즈 등은 내렸다.    코스닥시장의 거래량은 8억2천191만주, 거래대금은 4조7천12억원 수준이었다.    서울 외환시장에서 원/달러 환율은 전날보다 달러당 5.3원 내린 1,156.0원에 마감했다.    kihun@yna.co.kr▶확 달라진 연합뉴스 웹을 만나보세요▶네이버 [연합뉴스] 채널 구독   ▶뭐 하고 놀까? #흥연합뉴스 관련뉴스해당 언론사에서 선정하며 언론사 페이지(아웃링크)로 이동해 볼 수 있습니다.\xa0엑소 첸, \'아빠\' 된다…깜짝 결혼 발표\xa0\'5만원권 돈다발 8개\' 어떻게 주인 찾았나\xa0나다은 \'한국당 입당해 분탕치고 싶다\' 글때문에 결국...\xa0찬물 학대 사망 아동 부검해보니 멍자국이...\xa0살해당한 남편 몸에서 수면유도제…증거는 내연남이 버려좋아요0훈훈해요0슬퍼요0화나요0후속기사 원해요0기사제공 :']"
18,삼성전자, 2020-01-1316:04,조선비즈 ,"[마켓뷰] 삼성전자·SK하이닉스, 각각 6만원·10만원 뚫었다",https://finance.naver.com/news/news_read.nhn?article_id=0000465377&office_id=366&mode=search&query=삼성전자&page=3,"['       [마켓뷰] 삼성전자·SK하이닉스, 각각 6만원·10만원 뚫었다      기사입력2020-01-13 16:04기사원문좋아요훈훈해요좋아요 평가하기공감좋아요0훈훈해요0슬퍼요0화나요0후속기사 원해요0댓글 13일 삼성전자(005930)주가는 1969년 회사 설립 이래 처음으로 6만원을 찍었다. 6만원은 액면분할 전 가격으로 300만원이다. 삼성전자는 지난 9일과 10일 사상 최고가를 경신한 데 이어 이번에는 6만원을 터치했다.SK하이닉스(000660)도 이날 10만원을 돌파했다. 1, 2등주가 나란히 투자자들을 환호하게 했다.SK하이닉스 주가 10만원은 2002년 이후 가장 높은 가격이다. SK하이닉스는 현대전자 시절이던 1999년 1월 한때 기록한 최고가가 77만481원(수정주가 기준)이다. 당시 실제로는 최고가가 4만3400원이었는데, 2003년 실시한 21대 1 감자를 반영하면 당시 주가는 77만원대인 것으로 나타난다. 그래도 감자 직후 수정주가가 2400원대였음을 감안하면 드라마틱한 반등이다.코스피지수는 이날 전날보다 22.87포인트(1.04%) 상승해 2229.26에 마쳤다. 그러나 지수보다 관심을 끈 것이 반도체 주식 움직임이었다.삼성전자는 이날 500원(0.84%) 올라 6만원에 마감했다. SK하이닉스는 1600원(1.62%) 상승해 1만500원에 장을 마쳤다.두 종목 상승세는 외국인 투자자들의 매수세 때문이다. 이날 외국인은 심성전자는 848억원, SK하이닉스는 216억원 순매수했다. 눈에 띄는 부분은 이날 외국인은 유가증권시장에서 2580억원 순매수해 두 종목 외의 나머지 종목을 순매수했다는 점이다. SK텔레콤을 30억원 순매수했고, LG유플러스를 27억원, 한국가스공사를 10억원 순매수했다. 이재만 하나금융투자 애널리스트는 ""외국인 순매수가 삼성전자와 SK하이닉스 이외의 종목을 확산될 수 있다""면서 ""현재 고전을 면치 못하고 있는 자동차 업종에도 관심을 둘 필요가 있다""고 내다봤다.반도체 주식 외에는 중국 소비주와 한진칼, HDC현대산업개발 등이 눈에 띄었다. 중국주는 큰폭으로 올랐다. 시진핑 중국 주석 방한 기대감에 호텔신라(008770)와 아모레퍼시픽(090430), LG생활건강(051900), 애경산업(018250)등이 3~5% 상승했다. 한진칼(180640)은 주요주주인 반도건설이 보유 목적으로 경영참여로 변경하면서 한때 10% 가까이 올랐으나 결국 보합권에서 장을 마쳤다. HDC현대산업개발(294870)은 아시아나항공을 위한 4000억원 규모의 유상증자를 결정했다는 소식에 4.64% 내렸다.코스닥지수에도 훈풍이 불었다. 코스닥지수는 외국인과 기관이 각각 263억원, 681억원 순매도했지만 개인이 1158억원 순매수하면서 전날보다 6.19포인트(0.92%) 상승해 679.22를 기록했다. [안재만 기자 hoonpa@chosunbiz.com][조선비즈 창간 10주년 기획 \'다시쓰다 도시3.0\' 기사 보러가기][네이버 메인에서 조선비즈 받아보기][조선비즈 바로가기] chosunbiz.com 조선비즈 관련뉴스해당 언론사에서 선정하며 언론사 페이지(아웃링크)로 이동해 볼 수 있습니다.""반도 손잡는 쪽 이긴다""… 복잡해진 한진家 경영권 분쟁팔기 바빠 \'꼼수\'… 금융사들, 일 터져도 해외서 대우 못 받아삼성전자 6만원, 사상 최고가 달성… SK하이닉스도 10만원 돌파D램 가격 제자린데… 삼성·하이닉스 주가는 연일 오르는 이유이번엔 카메라 4개 \'인덕션 디자인\'… 갤럭시S20 추정 사진 유출좋아요0훈훈해요0슬퍼요0화나요0후속기사 원해요0기사제공 :']"
19,삼성전자, 2020-01-1316:02,이데일리 ,[코스피 마감]반도체 업황·어닝시즌 기대에 연중 최고,https://finance.naver.com/news/news_read.nhn?article_id=0004554119&office_id=018&mode=search&query=삼성전자&page=3,"['       [코스피 마감]반도체 업황·어닝시즌 기대에 연중 최고      기사입력2020-01-13 16:02기사원문좋아요훈훈해요좋아요 평가하기공감좋아요0훈훈해요0슬퍼요0화나요0후속기사 원해요0댓글외인 순매수세 짙어…화학·유통업↑삼성전자·SK하이닉스 등 시총 상위株 상승자료=마켓포인트[이데일리 박태진 기자] 코스피 지수가 3거래일 연속 상승마감하며 연중 최고치를 갈아치웠다. 지수는 미국 고용지표 부진에 장초반 강보합세로 출발했지만, 최근 삼성전자(005930) 실적을 통한 반도체 업황의 바닥이 확인됐다는 분석과 기업들의 어닝시즌을 맞아 실적에 대한 기대감이 커지고 있는 영향으로 풀이된다. 외국인이 순매수세에 나서면서 상승장을 이끌었다. 시가총액 상위 종목들도 상승 마감했다.13일 마켓포인트에 따르면 코스피 지수는 전 거래일보다 22.87포인트(1.04%) 오른 2229.26으로 마감했다. 이날 지수는 장 초반부터 강보합으로 출발한 후 상승폭을 키웠다. 종가 기준으로 지난해 4월 23일(2220.51) 이후 9개월 만에 2220선을 넘어서는 것이다. 장 후반에는 1%대 상승하며 2230선에 근접했다. 박석현 KTB투자증권 매크로팀장은 “국내 증시는 지금 반도체를 중심으로 어닝에 대한 기대감이 매우 높다”면서 “삼성전자 실적에서도 나왔듯이 반도체 업황이 바닥을 찍고 올라간다는 기대감이 높기 때문으로 풀이되는데 국내 시장만 놓고 보면 지수하락 요인이 없어 단기적으로는 이 같은 추세가 이어질 것”이라고 말했다.수급주체별는 외국인이 2580억원 순매수했다. 기관과 개인은 각각 2146억원, 493억원 순매도했다. 프로그램 매매는 차익과 비차익을 합쳐 1115억원 매수 우위를 기록했다.업종별로는 의료정밀을 제외한 모든 업종이 상승했다. 화학, 유통업, 건설업, 음식료품, 서비스업, 통신업, 비금속광물, 제조업 등 순으로 올랐다.시가총액 상위 종목들도 상승세로 마감했다. 대장주인 삼성전자를 비롯해 SK하이닉스(000660), 삼성전자우(005935), 삼성바이오로직스(207940), 현대차(005380), LG화학(051910) 등은 상승했다. 특히 삼성전자와 SK하이닉스는 반도체 업황 개선 기대감에 연중 신고가를 나란히 경신했다. 반면 현대모비스(012330)는 하락했고, 네이버(035420)는 변동이 없었다. 개별종목별로는 상한가를 기록한 서원(021050)과 화장품 업종 개선 기대감에 한국화장품(123690), 토니모리(214420) 등 화장품 업체들의 상승폭이 컸다. 반면 SK케미칼우(28513K), SK디스커버리우(006125), 엔케이물산(009810) 등은 하락폭이 컸다. 이날 거래량은 4억8021만주, 거래대금은 6조1398억원으로 집계됐다. 상한가 1개 종목을 포함해 총 594개 종목이 상승했고, 하한가 없이 248개 종목이 하락했다. 65개 종목은 보합권에서 거래를 마쳤다.박태진 (tjpark@edaily.co.kr)네이버 홈에서 ‘이데일리’ 뉴스 [구독하기▶]꿀잼가득 [영상보기▶] , 청춘뉘우스~ [스냅타임▶]＜ⓒ종합 경제정보 미디어 이데일리 - 무단전재 & 재배포 금지＞이데일리 관련뉴스해당 언론사에서 선정하며 언론사 페이지(아웃링크)로 이동해 볼 수 있습니다.[줌인]은마 96배 오를때 삼성전자 804배 뛰었다\'민주당 힘내요♥\' 한국당서 해촉된 나다은 누구?\'이상화♥\' 강남, 첫 수술 \'10년 동안 앓았던 고질병은?\'이미영, 친오빠 \'맹구\' 이창훈 근황? ""폐암 회복""음문석, \'미우새\' 새 아들 합류…첫 등장부터 팬티 바람좋아요0훈훈해요0슬퍼요0화나요0후속기사 원해요0기사제공 :']"
0,삼성전자, 2020-01-1316:01,헤럴드경제 ,삼성전자 6만원·SK하이닉스 10만500원…상승랠리 어디까지,https://finance.naver.com/news/news_read.nhn?article_id=0001623631&office_id=016&mode=search&query=삼성전자&page=4,"[""       삼성전자 6만원·SK하이닉스 10만500원…상승랠리 어디까지      기사입력2020-01-13 16:01기사원문좋아요훈훈해요좋아요 평가하기공감좋아요0훈훈해요0슬퍼요0화나요0후속기사 원해요0댓글13일 종가 기준 52주 신고가  또 경신증권사 목표주가>현재가…‘추가 상승’ 전망 계속13일 삼성전자 주가가 6만원으로 상승마감했다. 사진은 앞서 10일 삼성전자 주가는 반도체 업황 개선 기대감에 전 거래일보다 1.54% 오른 5만9천500원에 거래를 마감해 사상 최고 기록을 갈아치운 모습. 사진=연합뉴스[헤럴드경제=김유진 기자] 반도체 산업의 대장주인 삼성전자와 SK하이닉스의 주가가 각각 6만원과 10만원을 돌파하며 52주 신고가를 나란히 경신했다.14일 유가증권시장에서 삼성전자 종가는 전일 대비 500포인트 (0.84%) 상승한 6만원을 기록해 3거래일 연속 최고가 경신을 이어갔다.이날 SK하이닉스도 이날 전장보다 1600포인트(1.62%) 상승한 10만500원으로 장을 마감하며 52주 신고가를 경신했다. 지난 8~9일 이틀 연속 종가 기준 최고가를 경신한 데 이어 10만원대의 벽까지 무너뜨렸다. 장중 최고가는 10만1000원까지 치솟았다.코스피 대장주이자 반도체 업계를 이끌어가는 두 기업의 신고가 랠리는 당분간 지속될 것이란 전망이 나온다. 신한금융투자는 이날 보고서를 통해 삼성전자와 SK하이닉스의 목표주가를 각각 7만3000원, 13만5000원으로 상향 조정했다.최도연·나성준 신한금융투자 연구원은 “삼성전자의 D램 장비 발주 재개 시점(3~4분기)까지 반도체 주가 상승이 이어질 것”이라며 “올해는 비메모리보다 메모리(반도체) 업체의 주가 상승 폭이 클 것으로 전망한다”고 밝혔다.kacew@heraldcorp.com▶네이버에서 헤럴드경제 채널 구독하기▶제49회 헤럴드 전국 영어 말하기대회 ▶헤럴드경제 사이트 바로가기 - Copyrights ⓒ 헤럴드경제 & heraldbiz.com, 무단 전재 및 재배포 금지 -헤럴드경제 관련뉴스해당 언론사에서 선정하며 언론사 페이지(아웃링크)로 이동해 볼 수 있습니다.'조국 수호집회' 글 올린 나다은, 한국당서 3일만에 해촉15일 새벽 3시까지 윈도7 교체 안하면…경찰관 또 극단적 선택…자살률 일반 공무원 2배자동차 보험료 29일부터 3.5% 인상'모닝쇼 선구자' 아나운서 임택근씨 별세…상주는 가수 임재범좋아요0훈훈해요0슬퍼요0화나요0후속기사 원해요0기사제공 :""]"
1,삼성전자, 2020-01-1316:00,이데일리 ,삼성전자 6만원·SK하이닉스 10만원…역사 새로 썼다,https://finance.naver.com/news/news_read.nhn?article_id=0004554114&office_id=018&mode=search&query=삼성전자&page=4,"['       삼성전자 6만원·SK하이닉스 10만원…역사 새로 썼다      기사입력2020-01-13 16:00기사원문좋아요훈훈해요좋아요 평가하기공감좋아요0훈훈해요0슬퍼요0화나요0후속기사 원해요0댓글[이데일리 최정희 기자] 삼성전자(005930) 주가가 6만원을 넘어서면서 사상 최고가를 또 갈아치웠다. SK하이닉스(000660)는 10만원을 넘어서 19년만에 최고를 기록했다. 13일 마켓포인트에 따르면 삼성전자는 이날 전 거래일 대비 0.84% 오른 6만원으로 거래를 마쳤다. 지난 1975년 6월 한국거래소에 상장된 이후 45년래 최고가다. 최근 반도체 업황 개선과 실적호조 기대감에 연일 새 역사를 쓰고 있다. SK하이닉스는 1.62% 오른 10만500원을 기록했다. 종가를 기준으로 2001년 10만6000원을 기록한 후 근 19년 만에 최고다. 이날 외국인은 삼성전자를 순매수 상위 1위에 올려놨고 삼성SDI, SK하이닉스, 삼성전자우 등도 대거 매수하는 등 IT주를 대거 쓸어담았다.최정희 (jhid0201@edaily.co.kr)네이버 홈에서 ‘이데일리’ 뉴스 [구독하기▶]꿀잼가득 [영상보기▶] , 청춘뉘우스~ [스냅타임▶]＜ⓒ종합 경제정보 미디어 이데일리 - 무단전재 & 재배포 금지＞이데일리 관련뉴스해당 언론사에서 선정하며 언론사 페이지(아웃링크)로 이동해 볼 수 있습니다.[줌인]은마 96배 오를때 삼성전자 804배 뛰었다\'민주당 힘내요♥\' 한국당서 해촉된 나다은 누구?\'이상화♥\' 강남, 첫 수술 \'10년 동안 앓았던 고질병은?\'이미영, 친오빠 \'맹구\' 이창훈 근황? ""폐암 회복""음문석, \'미우새\' 새 아들 합류…첫 등장부터 팬티 바람좋아요0훈훈해요0슬퍼요0화나요0후속기사 원해요0기사제공 :']"
2,삼성전자, 2020-01-1315:59,한국경제 ,[종합]삼성전자 6만원 '터치'·SK하이닉스 10만원 '돌파'…반도체株 최고가 행...,https://finance.naver.com/news/news_read.nhn?article_id=0004272961&office_id=015&mode=search&query=삼성전자&page=4,"['       [종합]삼성전자 6만원 \'터치\'·SK하이닉스 10만원 \'돌파\'…반도체株 최고가 행진      기사입력2020-01-13 15:59기사원문좋아요훈훈해요좋아요 평가하기공감좋아요0훈훈해요0슬퍼요0화나요0후속기사 원해요0댓글삼성전자 0.84% 오른 6만원에 거래 마감SK하이닉스 1.62% 오른 10만500원…(사진=게티이미지뱅크)국내 증시 대표 기업인 삼성전자와 SK하이닉스가 반도체 경기 회복에 대한 기대감으로 최고가 행진을 이어가고 있다. 13일 한국거래소에 따르면 이날 삼성전자는 전거래일보다 0.84% 오른 6만원에 거래를 마쳤다. 액면분할 이후 사상 처음으로 6만원에 올라섰다. SK하이닉스도 이날 10만원을 돌파했다. SK하이닉스는 1.62% 오른 10만500원에 장을 마감했다. 두 종목 모두 수정주가 기준으로 사상 최고가다. 수정주가란 액면분할과 감자 등을 감안해 현 주가의 수준을 나타낸 것이다.  이들 기업의 최고가 행진을 이끈 것은 반도체 경기의 회복 기대감이다. 지난해 반도체업계는 \'D램 보릿고개\'에 부진한 실적을 냈을 것으로 예상된다. 삼성전자의 지난해 연간 영업이익 잠정치는 27조7000억원으로 전년 대비 52.9% 급감하면서 2015년(26조4000억원) 이후 최저 수준에 머물렀다.SK하이닉스 또한 지난해 영업이익 추정치가 2조9334억원에 그치며 전년(20조8438억원)과 비교해 85.9% 줄었을 것으로 집계됐다. 하지만 최근 삼성전자가 발표한 지난해 4분기 잠정실적이 시장의 예상치를 웃돌면서 반등에 대한 기대감이 커졌다. 삼성전자의 지난해 4분기 잠정 영업이익은 7조1000억원으로 증권사 전망치 평균(6조5000억원대)을 9% 가량 웃돌았다. SK하이닉스도 경우 아직 작년 4분기 영업이익이 공개되지는 않았으나, 시장 기대치 4400억원대를 웃돌 수 있을 것이란 관측이다.   시가총액 1,2위인 삼성전자와 SK하이닉스에 힘입어 이날 코스피는 전거래일보다 22.87포인트(1.04%) 오른 2229.26에 거래를 마쳤다.차은지 한경닷컴 기자 chachacha@hankyung.com▶ 네이버에서 한국경제 뉴스를 받아보세요▶ 한경닷컴 바로가기  ▶ 모바일한경 구독신청 ⓒ 한국경제 & hankyung.com, 무단전재 및 재배포 금지한국경제 관련뉴스해당 언론사에서 선정하며 언론사 페이지(아웃링크)로 이동해 볼 수 있습니다.유승민, 계속 아니라더니 창당 8일 만에…그랜저, 워낙 잘 팔리긴 하지만…""이 정도라니""""25배 더 내라""…건보료 \'충격 실체\'""한국당 입당해 분탕치고 싶다""…나다은 정체가""이럴거면 중소기업 가지""…대기업 임원 \'한탄\'좋아요0훈훈해요0슬퍼요0화나요0후속기사 원해요0기사제공 :']"
3,삼성전자, 2020-01-1315:59,국민일보 ,이젠 ‘6만전자’된 삼성전자… SK하이닉스도 ‘10만원’ 돌파,https://finance.naver.com/news/news_read.nhn?article_id=0001277729&office_id=005&mode=search&query=삼성전자&page=4,"['       이젠 ‘6만전자’된 삼성전자… SK하이닉스도 ‘10만원’ 돌파      기사입력2020-01-13 15:59기사원문좋아요훈훈해요좋아요 평가하기공감좋아요0훈훈해요0슬퍼요0화나요0후속기사 원해요0댓글한한령 해제 기대감에 엔터·화장품주도 급등삼성전자가 액면분할 이후 처음으로 6만원 고지에 올라서며 사상 최고가를 기록했다. 6만원은 액면분할 이전 기준으로 주당 300만원이다. SK하이닉스도 10만원을 돌파했다. 중국의 한한령(限韓令·한류 제한령)이 해제된다는 기대감에 엔터·화장품 주를 중심으로 한류 수혜주도 들썩였다.13일 코스피지수는 전 거래일보다 22.87포인트(1.04%) 오른 2229.26에 거래를 마쳤다. 외국인이 2580억원을 순매수했다. 삼성전자, SK하이닉스 등 시가총액 상위 종목이 골고루 오름세를 보였다. 삼성전자는 0.84% 뛴 6만원에 마감하면서 2018년 5월 4일 액면분할 이후 처음으로 6만원대에 올랐다. SK하이닉스는 1.62% 오른 10만500원으로 역대 최고가 기록을 갈아치웠다. 코스닥지수는 0.92% 상승한 679.22에 장을 마쳤다.한동안 침체됐던 엔터테인먼트 관련 종목도 강세를 보였다. 3대 기획사로 꼽히는 에스엠(8.98%), JYP Ent(10.85%), 와이지엔터테인먼트(9.29%)를 비롯해 판타지오(3.82%), 팬엔터테인먼트(4.16%), 스튜디오드래곤(3.08%) 등이 상승 흐름을 탔다. 시진핑 중국 국가주석의 방한과 더불어 한류 스타들의 중국 콘서트가 가능할 것이라는 관측이 불을 붙였다. 방탄소년단(BTS) 컴백 소식에 관련 수혜주로 꼽히는 키이스트(10.28%)와 넷마블(7.58%), 초록뱀(1.86%) 등도 상승 마감했다.화장품 관련 종목도 급등했다. 신고가를 경신한 한국화장품(23.48%)을 비롯해 한국콜마(8.61%), LG생활건강(4.54%), 아모레퍼시픽(5.22%), 애경산업(3.82%) 등 주요 화장품 기업이 줄줄이 올랐다. 한진칼의 3대 주주로 올라선 반도건설이 ‘경영 참가’를 전격 선언하면서 대한항공우(8.70%), 한진칼우(6.32%) 등 한진그룹 관련주도 큰 폭으로 뛰었다.외국인 매수세가 돌아온 것도 향후 전망을 밝히는 긍정적 신호로 꼽힌다. 금융감독원에 따르면 외국인은 지난해 12월 국내 상장주식 8100억원어치를 순매수한 것으로 집계됐다. 지난해 7월(2조470억원) 이후 5개월 만의 순매수다. 외국인의 국내 상장주식 보유액은 지난해 말 기준 593조2000억원으로 전체 시가총액의 33.3%가량을 차지한다.양민철 기자 listen@kmib.co.kr[국민일보 채널 구독하기][취향저격 뉴스는 여기] [의뢰하세요 취재대행소 왱]GoodNews paper ⓒ 국민일보(www.kmib.co.kr), 무단전재 및 재배포금지국민일보 관련뉴스해당 언론사에서 선정하며 언론사 페이지(아웃링크)로 이동해 볼 수 있습니다.도라에몽 표절한 식약처의 \'식약애몽\'… 日 ""한국 국제 망신""30대 음주운전자, 공원 계단에 걸쳐 검거""당신이 본 연관검색어 \'홍대 맛집 ○○○\', 조작일 수 있습니다""미국서 여성 노동인구가 남성을 추월했다… ""획기적인 사건""\'김정은 칭송, 이낙연은 이런 사람\' 가짜뉴스에 이낙연 반응좋아요0훈훈해요0슬퍼요0화나요0후속기사 원해요0기사제공 :']"
