,회사명,날짜,언론사,기사제목,링크,본문
5,삼성전자, 2020-12-1011:50,문화일보 ,‘反기업 쓰나미 입법’에… 재계 “팬데믹보다 더한 충격” 패닉,https://finance.naver.com/news/news_read.nhn?article_id=0002452512&office_id=021&mode=search&query=삼성전자&page=10,"['       ‘反기업 쓰나미 입법’에… 재계 “팬데믹보다 더한 충격” 패닉      기사입력2020-12-10 11:50기사원문좋아요훈훈해요좋아요 평가하기공감좋아요0훈훈해요0슬퍼요0화나요0후속기사 원해요0댓글巨與, 기업규제3법 등 통과 파장 외국계 투기자본 공격에 무방비 내년엔 집단소송제 등 ‘2차충격’ 경영계 “아무리 일자리 만들어도 기업 죄악시하는 정치에 자괴감”여당이 국회에서 상법·공정거래법, 노동조합 및 노동관계조정법(노조법) 등의 개정을 밀어붙인 가운데, 반(反)기업 법안 ‘쓰나미’가 몰려오면서 기업들이 ‘패닉’ 상태에 빠졌다. 기업들은 당장 내년 3월 주주총회 시즌부터 상법 개정에 따라 감사 분리선임 및 의결권 제한으로 외국계 투기자본 등의 공격이 몰아닥칠 것을 우려하고 있다. 이번에 처리된 규제 법안들이 신종 코로나바이러스 감염증(코로나19) 사태보다 더 기업을 어려움에 빠뜨린다는 지적을 받고 있다. 하지만 내년 초부터 집단소송제와 징벌적 손해배상제 등 추가적인 규제 법안도 쏟아질 전망이어서 국회 발(發) ‘2차 충격’이 불가피하다는 지적이 나온다. 재계에서는 “아무리 일자리를 만들고 사회공헌에 앞장서도, 기업을 죄악시하는 정서는 변하지 않는다”며 “자괴감이 든다”는 하소연이 빗발치고 있다.10일 경제계에 따르면 우선 개정된 상법에 따라 상장사가 감사위원 중 최소 1명을 이사와 별도로 선출해야 하고, 특히 사외이사인 감사위원을 선출할 때는 최대주주와 특수관계인 의결권이 ‘개별 3%’로 제한된다. 정부 원안의 ‘합산 3%’보다는 완화됐지만, 내년 3월 주주총회에서 새 감사위원을 선임해야 하는 기업 입장에서 발등에 불이 떨어진 것은 변함이 없다.한국경영자총협회(경총) 분석에 따르면, 지난달 2일 시가총액 상위 10대 기업의 최대주주와 특수관계인 지분율은 평균 30.41%였다. 그런데 여기에 상법 개정에 따라 ‘개별 3%룰’을 적용하면, 의결권 행사 가능 지분율의 평균은 5.52%로 뚝 떨어진다. 반면 외국인 지분율 평균은 38.12%에 달하는 것으로 분석됐다.구체적으로 삼성전자의 최대주주 및 특수관계인 지분율은 21.21%지만, 개별 3%룰을 적용하면 의결권은 12.52%로 내려간다. SK하이닉스와 네이버는 각각 21.36%와 13.05%인 최대주주 특수관계인 지분율이 3.00%로 하락하는 것으로 분석됐다. 현대차는 30.81%에서 8.49%로 의결권 지분율이 내려간다. LG화학은 34.18%가 3.04%가 되고, 삼성SDI는 21.60%가 4.06%가 된다. 그런데 외국인 지분율은 삼성전자가 56.00%에 달하고, SK하이닉스 48.76%, 네이버 55.92%, 현대차 31.02% 등으로 집계됐다.이런 와중에 내년 초가 되면 집단소송제와 징벌적 손해배상제 확대 법안 입법도 강행될 것이란 게 재계 관측이다. 법무부 등에 따르면 집단소송법, 징벌적 손해배상제가 포함된 상법 개정안 등이 이르면 내년 초 국회에 제출될 예정이기 때문이다. 전국경제인연합회(전경련)는 이날 ‘집단소송법 및 징벌적손해배상 도입의 문제점과 부작용’ 보고서를 통해 “기업들은 △과징금·과태료 등 행정제재 △징역이나 벌금 등 형사처벌 △집단소송 및 징벌적 손해배상제에 따른 민사적 제재 등 삼중(三重) 과잉처벌 위험에 직면하게 된다”고 지적했다.앞서 경총 등 경제단체들은 이번 상법 등 개정에 대해 보완 입법 및 시행 유보를 촉구했다. 경총은 “외국계 투기세력으로부터 우리 기업을 보호하기 위해 감사위원 분리선임 시 의결권 행사를 위한 주식 보유 기간을 최소 1년 이상으로 하는 보완장치를 이번 임시국회에서 입법해 달라”며 “기업들이 대비할 수 있도록 시행시기를 1년 이상 유예해달라”고 요청했다. 전경련도 “기업규제 3법 통과로 ‘기울어진 운동장’이 만들어진 상황이므로, 경영권 방어수단 도입을 조속히 추진해야 한다”며 개정 법률의 시행 시기를 1년 늦춰 달라고 요청했다. 김성훈·임대환 기자[ 문화닷컴 바로가기 | 문화일보가 직접 편집한 뉴스 채널 | 모바일 웹 ][Copyrightⓒmunhwa.com \'대한민국 오후를 여는 유일석간 문화일보\' 무단 전재 및 재배포 금지(구독신청:02)3701-5555)]문화일보 관련뉴스해당 언론사에서 선정하며 언론사 페이지(아웃링크)로 이동해 볼 수 있습니다.""韓, 기업 사회주의화 촉진… 노조 공화국 될 것""女 특수요원, 성추행당한 뒤 피살·2개월 후 시신 발견[속보]윤석열, 검사징계위 불출석…\'절차상 결함\' 반발文대통령 지지율 2주 연속 최저…與 소폭상승 재역전[속보]檢총장 징계위 5명만으로 열려… 尹, 2명 기피신청좋아요0훈훈해요0슬퍼요0화나요0후속기사 원해요0기사제공 :']"
6,삼성전자, 2020-12-1011:49,뉴시스 ,'네 마녀의 날' 코스피 약세…외인·기관 매도,https://finance.naver.com/news/news_read.nhn?article_id=0010234806&office_id=003&mode=search&query=삼성전자&page=10,"['       \'네 마녀의 날\' 코스피 약세…외인·기관 매도      기사입력2020-12-10 11:49기사원문좋아요훈훈해요좋아요 평가하기공감좋아요0훈훈해요0슬퍼요0화나요0후속기사 원해요0댓글장중 2710선 밀렸으나 이내 2750선 회복[서울=뉴시스] 유자비 기자 = \'네 마녀의 날(쿼드러플 위칭데이)\'을 맞은 10일 코스피가 약세를 보이고 있다. 이날 오전 11시17분 현재 코스피지수는 전거래일(2755.47)보다 4.16포인트(0.15%) 내린 2751.31을 기록 중이다. 이날 지수는 0.19% 내린 2750.34에 출발했다. 장중 한때 2710대로 밀리기도 했으나 이후 낙폭을 축소하며 2750선을 회복했다.  전날 코스피가 2755.47에 마감하며 사상 최고치를 갈아치운 지 하루 만에 약세를 나타내고 있다. 유가증권시장에서 외국인과 기관이 각각 2316억원, 4529억원어치 순매도 중이다.  시가총액 상위 기업들은 엇갈리고 있다. 대장주 삼성전자는 전거래일 대비 0.54% 내린 7만3500원에 거래 중이다. SK하이닉스(-2.07%), LG화학(-1.56%), 삼성바이오로직스(-0.73%), 네이버(-0.17%) 등이 내림세인 반면 셀트리온(1.7%), 현대차(0.26%), 카카오(0.4%), 기아차(0.94%)는 오름세를 보이고 있다. 코스닥지수는 전 거래일(913.81)보다 4.32포인트(0.47%) 오른 918.13을 기록 중이다. 지수는 이날 0.79포인트(0.09%) 내린 913.2에 출발했으나 오전 10시께 상승 전환했다.  지난 9일(현지시간) 뉴욕증시는 기술주 고전과 신종 코로나 바이러스 감염증(코로나19) 부양책 협상 부진에 대한 실망감으로 내림세로 마감했다.뉴욕주식거래소(NYSE)에서 다우존스 30 산업평균지수는 전장 대비 105.07포인트(0.35%) 하락한 3만68.81에 장을 마감했다. 스탠더드앤드푸어스(S&P) 500 지수는 전장 대비 29.43포인트(0.79%) 내린 3672.82에, 기술주 중심 나스닥지수는 243.82포인트(1.94%) 하락한 1만2338.95에 장을 마무리했다.☞공감언론 뉴시스 jabiu@newsis.com▶ 네이버에서 뉴시스 구독하기▶ K-Artpark, 미술품 구매의 즐거운 시작▶ 뉴시스 빅데이터 MSI 주가시세표 바로가기<ⓒ 공감언론 뉴시스통신사. 무단전재-재배포 금지>뉴시스 관련뉴스해당 언론사에서 선정하며 언론사 페이지(아웃링크)로 이동해 볼 수 있습니다.성폭행 당한 여고생 목격하고 또 성폭행한 군인""XX 확 찢어버릴라"" 위층 사는 여성에 막말""미친X아, 문 열어!"" 흉기 들고 모르는 여성집 \'쾅쾅\'몸무게 28㎏…지적장애 친누나 묶어놓고 방치해 숨져""부딪혔으니 너도 대"" 중요부위 손으로 쥐고…좋아요0훈훈해요0슬퍼요0화나요0후속기사 원해요0기사제공 :']"
7,삼성전자, 2020-12-1011:49,중앙일보 ,올해 반도체 투자 ‘파운드리’ 압도적...D램 투자 2년 연속 감소,https://finance.naver.com/news/news_read.nhn?article_id=0003059912&office_id=025&mode=search&query=삼성전자&page=10,"['       올해 반도체 투자 ‘파운드리’ 압도적...D램 투자 2년 연속 감소      기사입력2020-12-10 11:49기사원문좋아요훈훈해요좋아요 평가하기공감좋아요0훈훈해요0슬퍼요0화나요0후속기사 원해요0댓글  TSMC 공장 내부 모습. [사진제공=TSMC 홈페이지 캡처]           파운드리(반도체 위탁생산)가 올해 전 세계 반도체 설비투자를 주도한 것으로 나타났다. D램 설비 투자는 2년 연속 감소할 것으로 전망된다.       ━   반도체 설비투자 6% 증가한 1081억 달러        10일 IC인사이츠에 따르면, 올해 글로벌 반도체 설비투자액은 1081억 달러(약 117조4000억원)로 예상된다. 전년(1025억 달러) 대비 6% 증가한 수치다. IC인사이츠는 “신종 코로나바이러스 감염증(코로나19) 대유행으로 글로벌 디지털 전환이 가속하면서 반도체 자본 지출이 증가했다”고 분석했다.        올해 파운드리 설비 투자액은 363억 달러(약 39조4000억원)로 전년 대비 38% 증가할 것으로 보인다. 전체 반도체 설비투자액의 34% 규모다. 파운드리는 2014~1016년과 지난해에도 반도체 분야 중 설비투자 규모가 가장 컸다. IC인사이츠는 “7나노, 5나노 공정기술에 초점을 맞춘 TSMC가 파운드리 투자를 주도했다”고 밝혔다.       반도체 분야별 글로벌 설비투자액 현황 및 전망 〈IC인사이츠〉     ━   파운드리 38% 증가, D램 13% 감소        D램 설비투자액은 올해 166억 달러(약 18조원)로 추정된다. D램 설비투자는 2017년과 2018년에 각각 79%, 44% 증가했지만 올해는 전년 대비 13% 줄 것으로 보인다. 지난해(-17%)에 이어 2년 연속 감소세다. IC인사이츠는 “대규모 증설 투자가 완료되면서 D램 설비투자가 감소했다”며 “D램 지출 감소에도 삼성전자와 SK하이닉스·마이크론은 여전히 가장 많은 투자를 하는 업체 상위 5위 안에 들 것”이라고 분석했다.        낸드플래시를 포함한 비휘발성 메모리반도체 분야 설비투자액은 227억 달러(약 24조6500억원)로 파운드리에 이어 두 번째로 많은 투자가 집행될 것으로 보인다. 지난해(226억 달러)와 비슷한 규모다. 이 밖에 마이크로프로세서(MPU) 분야는 전년 대비 8% 감소한 155억 달러(약 16조8000억원), 아날로그 반도체는 같은 기간 10% 줄어든 82억 달러(약 8조9000억원)가 집행될 것으로 예상된다.       ━   올해 가장 많이 팔린 반도체는 D램        한편, 반도체 33개 제품군 중 올해 가장 많이 팔린 제품은 D램으로 나타났다. IC인사이츠는 최근 보고서에서 올해 D램 매출이 652억 달러(약 70조8500억원)를 기록할 것으로 예상했다. 다음은 낸드플래시로, 552억 달러(약 60조원)를 기록할 전망이다. IC인사이츠는 ""올해 D램 시장은 지난해의 침체를 뚫고 2017년 이후 최대 수익을 창출했다""며 ""내년에도 글로벌 반도체 시장에서 가장 큰 시장 규모를 차지할 것""이라고 밝혔다.       김태윤 기자 pin21@joongang.co.kr  ▶ 넌 뉴스를 찾아봐? 난 뉴스가 찾아와!▶ 네이버에서 중앙일보 받아보기▶ 검찰의 월성1호기 수사, 어떻게 생각하나요ⓒ중앙일보(https://joongang.co.kr), 무단 전재 및 재배포 금지중앙일보 관련뉴스해당 언론사에서 선정하며 언론사 페이지(아웃링크)로 이동해 볼 수 있습니다.서울대 출신·유학파도 산다, 20대들의 \'힙\'한 시골尹 불참한 초유의 징계위···법조계 ""중징계 가능성""지검장땐 반대, 이번엔 변호···尹절친 이완규 소신""尹 감옥 보낼것"" 말 나온날, 지지율 최고치 찍었다종이엔 힘 못 쓰는 코로나, 플라스틱 만나면 펄펄 왜좋아요0훈훈해요0슬퍼요0화나요0후속기사 원해요0기사제공 :']"
8,삼성전자, 2020-12-1011:46,서울경제 ,"삼성전자, 1.7억 '마이크로 LED TV' 공개···""화질 끝판왕""",https://finance.naver.com/news/news_read.nhn?article_id=0003839873&office_id=011&mode=search&query=삼성전자&page=10,"['       삼성전자, 1.7억 \'마이크로 LED TV\' 공개···""화질 끝판왕""      기사입력2020-12-10 11:46기사원문좋아요훈훈해요좋아요 평가하기공감좋아요0훈훈해요0슬퍼요0화나요0후속기사 원해요0댓글가정용 110인치 내년 3월 양산초소형 LED 스스로 빛·색 내고무기물 소재로 수명 10만 시간 유지삼성 마이크로 LED TV./사진제공=삼성전자[서울경제] “마이크로 LED는 기존 디스플레이의 한계를 극복한 궁극의 디스플레이입니다.”추종석 삼성전자(005930) 영상디스플레이(VD) 사업부 부사장은 10일 언론사를 대상으로 한 110인치형 마이크로 LED TV 공개 간담회에서 이같이 말했다. 삼성전자가 기업용으로 판매돼 온 마이크로 LED TV를 가정용으로 처음 선보인다. 가격은 1억 7,000만 원대로 초프리미엄 TV를 찾는 소비자층을 겨냥한다.삼성전자는 마이크로 LED TV를 두고 화질·크기·내구성 등의 한계를 극복한 디스플레이라는 점을 강조했다. 마이크로 LED TV는 빛의 3원색(RGB)을 내는 마이크로미터(㎛) 단위의 초소형 발광다이오드(LED)로 구성된 모듈을 이어붙여 만든다. 기존의 TV 디스플레이들과 다르게 RGB 소자들이 각각 스스로 빛과 색을 내 자연 그대로의 색상을 극대화된 명암비로 표현할 수 있다. 110인치형의 경우 각각 800만 개가 넘는 RGB 소자가 들어간다. 크기 면에서도 제약을 받지 않는다. 이음새를 나노 단위로 제어해 모듈을 이어붙이는 ‘실장’ 기술은 삼성전자의 반도체 제조 과정에서 축적된 미세 공정 노하우가 적용됐다. 사이즈가 작을수록 만들기 어려운데 110형보다 더 작은 크기의 제품을 만들 수 있는 기술도 이미 확보했다. 무기물 소재를 사용한 만큼 유기발광다이오드(OLED)보다 긴 10만 시간의 수명을 자랑한다. 화질 저하나 ‘번인’ 걱정 없이 오래 사용할 수 있다는 것이다.초프리미엄 제품이지만 해상도는 현존 최고인 8K보다 낮은 4K로 출시된다. 최용훈 VD사업부 개발팀장은 “마이크로 LED는 기존의 4K냐 8K냐의 해상도를 뛰어넘는 궁극적인 화질을 보여주는 혁신”이라며 “빛과 삼원색의 소자가 스스로 빛을 내는 ‘화질의 끝판왕’이며 매장에 가서 보고 직접 평가해달라”고 자신감을 드러냈다. 삼성전자는 이날 삼성디지털플라자 강남본점을 시작으로 일부 매장에 제품을 전시할 계획이다. 삼성전자는 이달부터 사전 주문을 받은 뒤 내년 3월 본격 양산에 들어갈 예정이다. 시장에서는 마이크로 LED TV가 지난 10월 출시한 LG전자의 세계 최초 롤러블 TV ‘LG 시그니처 올레드 R(출고가 1억 원)’과 치열한 경쟁을 벌일 것으로 예상하고 있다. 삼성전자는 내년 CES를 통해 미니 LED를 백라이트로 쓰는 업그레이드 된 QLED TV를 공개하고 마이크로 LED과 함께 ‘투트랙’ 전략으로 TV 1위를 수성할 계획이다./변수연기자 diver@sedaily.com쿼드뷰 기능이 적용된 삼성전자 마이크로 LED TV./사진=웨비나 캡처▶ 엄마 기자 취재수첩 [서지혜의 건강한 육아]▶ 中투자 알짜정보만 쏙쏙  [니하오 중국증시]▶ 네이버 채널에서 \'서울경제\' 구독해주세요!저작권자 ⓒ 서울경제, 무단 전재 및 재배포 금지서울경제 관련뉴스해당 언론사에서 선정하며 언론사 페이지(아웃링크)로 이동해 볼 수 있습니다.정세균 ""김대중 대통령님 오늘따라 사무치게 보고싶어""\'노도강\' 무려 7억···무섭게 치솟는 전세경비원 죽음 내몬 \'갑질\' 입주민, 1심서 징역 5년野 의원 ""뻔뻔한 XX"" 욕설에 몸싸움으로 번져환풍기서 쥐가 \'툭\'···족발쥐 파동업체 뒤늦은 공식사과좋아요0훈훈해요0슬퍼요0화나요0후속기사 원해요0기사제공 :']"
9,삼성전자, 2020-12-1011:43,서울경제 ,[주식 초고수는 지금]'셀트리온 삼형제'에 계속 쏠리는 매수·매도,https://finance.naver.com/news/news_read.nhn?article_id=0003839872&office_id=011&mode=search&query=삼성전자&page=10,"['       [주식 초고수는 지금]\'셀트리온 삼형제\'에 계속 쏠리는 매수·매도      기사입력2020-12-10 11:43기사원문좋아요훈훈해요좋아요 평가하기공감좋아요0훈훈해요0슬퍼요0화나요0후속기사 원해요0댓글신풍제약·삼성전자 등이 그 다음[서울경제] 미래에셋대우에서 거래하는 고수익 투자자들은 10일 오전 11시까지 셀트리온(068270)·셀트리온헬스케어(091990)·셀트리온제약(068760) 등 이른바 ‘셀트리온 3형제’를 집중적으로 매수·매도한 것으로 나타났다. 신풍제약(019170), 삼성전자(005930), 대웅제약(069620)도 매수 상위권에 이름을 올렸다.이날 미래에셋대우 엠클럽에 따르면 투자 수익률 상위 1%에 해당하는 ‘주식 초고수’들은 오전 11시까지 셀트리온헬스케어를 가장 많이 매수한 것으로 집계됐다. 2위는 셀트리온제약, 3위는 셀트리온이었다. 지난 25일 신종 코로나바이러스 감염증(코로나19) 항체 치료제인 ‘CT-P59(성분명: 레그단비맙)’의 글로벌 임상 2상 환자 모집과 투약을 완료했다고 밝힌 후 셀트리온 계열사들의 거래량이 급격히 늘어난 영향이다.매수 4위 종목은 신풍제약으로 조사됐다. 신풍제약은 자사의 말라리아 치료제 ‘피라맥스’를 코로나19 치료제로 만들기 위해 임상에 돌입했다는 소식이 알려진 이후 거래량이 몰리고 있다. 5위는 삼성전자로 나타났다. 삼성전자는 최근 반도체 시황 회복 기대감에 사상 최고가를 경신하는 등 강세를 이어가고 있다.매도 상위 1~3위 역시 모두 셀트리온 계열사였다. 셀트리온헬스케어가 1위, 셀트리온제약·셀트리온이 각각 2~3위를 차지했다. 마찬가지로 신풍제약이 매도 4위를 기록했고, 대웅제약은 매도 5위를 나타냈다.전날 ‘주식 초고수’가 가장 많이 매수한 종목 역시 셀트리온헬스케어였다. 셀트리온, 신풍제약이 그 뒤를 이었으며 셀트리온제약이 4위, 포스코케미칼(003670)이 5위로 집계됐다. 전일 매도 상위 종목 역시 셀트리온헬스케어, 셀트리온, 신풍제약, 셀트리온제약 순으로 나타났으며 엔투텍(227950), 에스티팜(237690)이 그 다음이었다.미래에셋대우는 자사 고객 중에서 지난 1개월간 수익률 상위 1% 투자자들의 매매 종목을 집계해 실시간·전일·최근 5일 기준으로 모바일트레이딩시스템(MTS)상에서 공개하고 있다. 이 통계데이터는 미래에셋대우의 의견과 무관한 단순 정보안내이며, 각각의 투자자 개인에게 맞는 투자 또는 수익달성을 보장하지 않는다. 또 테마주 관련 종목은 이상급등락 가능성이 있으므로 유의해야 한다./심우일기자 vita@sedaily.com▶ 엄마 기자 취재수첩 [서지혜의 건강한 육아]▶ 中투자 알짜정보만 쏙쏙  [니하오 중국증시]▶ 네이버 채널에서 \'서울경제\' 구독해주세요!저작권자 ⓒ 서울경제, 무단 전재 및 재배포 금지서울경제 관련뉴스해당 언론사에서 선정하며 언론사 페이지(아웃링크)로 이동해 볼 수 있습니다.배성우, 음주운전 적발···""변명의 여지 없다""1인당 술값 99만원···검사님 위한 불기소 세트?막 내리는 공인인증서 시대···무엇이 달라지나미친 \'지방 집값\'···이젠 서울이 더 싸다?코로나 백신 부자나라 잔치··· 북한 90% 무방비좋아요0훈훈해요0슬퍼요0화나요0후속기사 원해요0기사제공 :']"
