,회사명,날짜,언론사,기사제목,링크,본문
17,삼성전자, 2020-03-0909:52,데일리안 ,코스피 1980선도 위태…외국인·기관 매도 공세,https://finance.naver.com/news/news_read.nhn?article_id=0002387724&office_id=119&mode=search&query=삼성전자&page=7,"['       코스피 1980선도 위태…외국인·기관 매도 공세      기사입력2020-03-09 09:52기사원문좋아요훈훈해요좋아요 평가하기공감좋아요0훈훈해요0슬퍼요0화나요0후속기사 원해요0댓글시가총액 상위 종목 줄줄이 약세…3~4% 이상 하락ⓒ연합뉴스코스피 지수가 신종 코로나바이러스 감염증(코로나19)으로 인한 우려가 지속되면서 1980선까지 내려앉았다.9일 오전 9시 46분 현재 코스피 지수는 전거래일 대비 57.86포인트(2.84%) 하락한 1982.36을 기록중이다. 외국인과 기관이 각각 2914억원, 835억원을 동반 순매도한 가운데 개인이 홀로 3655억원을 순매수했다. 프로그램 매매는 전체 1305억원의 매도우위를 보였다.시가총액 상위종목들도 줄줄이 약세다. 삼성전자는 전장대비 -3.01% 하락한 5만4800원을 기록했고, SK하이닉스(-3.56%), 삼성바이오로직스(-2.21%), 네이버(-4.74%), LG화학(-4.75%), 현대차(-3.17%), 셀트리온(-0.56%), 삼성SDI(-4.58%) 등 -3~4%로 부진한 수익률을 기록했다.코스닥 지수는 전거래일 대비 15.65포인트(2.41%) 하랏한 627.15를 기록중이다. 코스피200지수는 전거래일대비 3.08% 하락한 266.61을 기록했다.미국의 고용지표 호조에도 코로나19 확산 우려로 미국 주요 지수가 하락세로 장을 마쳤다. 다우지수는 전장보다 0.98% 떨어진 2만5864.78 포인트에, 나스닥 지수는 1.87% 하락, 그리고 스탠다드 앤 푸어스(S&P) 500 지수는 1.71% 하락한 2972.37포인트에서 거래를 마쳤다.6일(현지 시간) 미국 뉴욕상업거래소(NYMEX)에서 4월 인도분 서부 텍사스산 원유(WTI)는 전 거래일보다 10.1% 떨어진 배럴당 41.28달러에서 거래를 마감했다. 런던 ICE 선물거래소의 5월 인도분 북해산 브렌트유도 9.5% 내린 45.27달러에서 마감했다.이날 서울 외환시장에서 원·달러 환율은 전 거래일보다 달러당 0.6원 오른 1192.9원에 개장했다. 현재 달러당 4.60원 상승한 1195.60원까지 올랐다.김훈길 하나금융투자 연구원은 ""전 세계적으로 코로나19의 확산 속도가 빨라지면서 경기 침체에 대한 우려가 확대됐다""며 ""미국 2월 고용지표가 시장 예상을 큰 폭으로 상회했음에도 증시가 하락했고, 미 국채 10 년물 금리 및 유가도 큰 폭으로 하락했다""고 말했다.데일리안 이미경 기자 (esit917@dailian.co.kr)ⓒ (주)데일리안 - 무단전재, 변형, 무단배포 금지데일리안 관련뉴스해당 언론사에서 선정하며 언론사 페이지(아웃링크)로 이동해 볼 수 있습니다.[코로나19] 코스피, 장중 2000선 붕괴…외인 4000억 \'팔자\'코스피, 나흘만에 장초반 반등…2130선 회복코스피, 1% 넘게 하락세…외국인·기관 쌍끌이 매도코스피, 나흘째 상승...외국인 \'팔자\'로 전환코스피, 1970선 \'털썩\'...외국인 6거래일 연속 \'팔자\'좋아요0훈훈해요0슬퍼요0화나요0후속기사 원해요0기사제공 :']"
18,삼성전자, 2020-03-0909:50,머니S ,"[특징주] 삼성전자, 화성공장 화재·외인 매도세에 '약세'",https://finance.naver.com/news/news_read.nhn?article_id=0000515127&office_id=417&mode=search&query=삼성전자&page=7,"['       [특징주] 삼성전자, 화성공장 화재·외인 매도세에 \'약세\'      기사입력2020-03-09 09:50기사원문좋아요훈훈해요좋아요 평가하기공감좋아요0훈훈해요0슬퍼요0화나요0후속기사 원해요0댓글/사진=뉴시스.삼성전자가 간밤 화성공장에서 화재가 발생했다는 소식에 약세다.9일 오전 9시 42분 현재 삼성전자는 전 거래일보다 3.01% 내린 5만4800원을 기록 중이다.소방당국 등에 따르면 지난 8일 오후 11시18분께 경기 화성시 삼성전자 반도체 공장 내 그린2동에서 화재가 발생했다. 인명피해는 없는 것으로 파악됐다. 소방당국은 펌프차 등 장비 30여대와 인원 80여명을 투입해 진화 작업을 벌여 이날 오전 1시50분께 불을 완전히 껐다고 밝혔다.한편 CS증권과 UBS 등 외국계 증권사 창구를 중심으로 매도 물량이 쏟아지고 있다.\xa0현재 삼성전자는 외국인 순매도 금액 1위 종목을 기록하고 있다.손희연 기자 son90@mt.co.kr▶ 고수들의 재테크 비법 영상▶ 이건희칼럼 ▶ 코로나19 속보 <저작권자 ⓒ \'성공을 꿈꾸는 사람들의 경제 뉴스\' 머니S, 무단전재 및 재배포 금지>머니S 관련뉴스해당 언론사에서 선정하며 언론사 페이지(아웃링크)로 이동해 볼 수 있습니다.뜨겁게 포옹한 홍상수♥김민희… ""여전히 내 사랑""화사, 이사한 집 최초 공개… ""잠수교 울면서 뛰어가""한지혜 남편 누구길래?… ""꽉 잡혀 산다""이시언 ""100만원 기부, 백시언 됐다… 좀 더 낼걸""신천지 \'집단 거주\' 아파트 미스터리… ""35세이하 여성만""좋아요0훈훈해요0슬퍼요0화나요0후속기사 원해요0기사제공 :']"
19,삼성전자, 2020-03-0909:45,KBS ,삼성전자 “반도체 공장 탈취 시설서 불…생산 차질 없어”,https://finance.naver.com/news/news_read.nhn?article_id=0010800739&office_id=056&mode=search&query=삼성전자&page=7,"['       삼성전자 “반도체 공장 탈취 시설서 불…생산 차질 없어”      기사입력2020-03-09 09:45기사원문좋아요훈훈해요좋아요 평가하기공감좋아요0훈훈해요0슬퍼요0화나요0후속기사 원해요0댓글 삼성전자는 어젯밤 경기도 화성시 반도체 사업장에서 난 불은 폐수 냄새를 처리하는 탈취시설에서 난 불이라고 밝혔습니다. 또, 탈취기능을 대체할 수 있는 시설이 있기 때문에 생산에는 차질이 없다고 설명했습니다. 앞서 어젯밤 11시 18분쯤 반도체 사업장에서 난 불은 2시간 반 만에 꺼졌습니다. 경기도 소방재난본부는 장비 48대와 124명을 투입해 진화작업을 벌였습니다. 경찰과 소방당국은 정확한 피해 규모와 화재 원인을 조사하고 있습니다.[사진 출처 : 김장수님 제보]박대기 기자 (waiting@kbs.co.kr)▶ 코로나19 함께 이겨냅시다! 응원 릴레이▶ ‘코로나19 팩트체크’ 제대로 알아야 이긴다▶ 더 빠르고 정확한 소식을 원하시면 KBS뉴스 구독!KBS 관련뉴스해당 언론사에서 선정하며 언론사 페이지(아웃링크)로 이동해 볼 수 있습니다.마스크 5부제, 오늘은 출생연도 끝자리 \'1·6\' 구매 가능日 입국 금지에 중국이 조용한 이유는?마스크 오래 쓰려면?…""꼭 필요할 때만 쓰세요""[전문가 인터뷰] 코로나19에 대한 오해와 진실5부제까지 등장한 \'마스크 대란\'…진 빠지는 약사들좋아요0훈훈해요0슬퍼요0화나요0후속기사 원해요0기사제공 :']"
0,삼성전자, 2020-03-0909:42,매경이코노미 ,LG그룹 품 떠나 승승장구…간판 바꾸고 실적 날개 단 SK실트론,https://finance.naver.com/news/news_read.nhn?article_id=0000064755&office_id=024&mode=search&query=삼성전자&page=8,"['       LG그룹 품 떠나 승승장구…간판 바꾸고 실적 날개 단 SK실트론      기사입력2020-03-09 09:42기사원문좋아요훈훈해요좋아요 평가하기공감좋아요0훈훈해요0슬퍼요0화나요0후속기사 원해요0댓글 ‘최태원 SK 회장의 선구안이 빛을 발했다’ ‘SK 반도체 수직계열화를 완성하는 역할을 맡았다’.반도체용 실리콘 웨이퍼 제조업체 SK실트론에 대한 재계 안팎 평가다.LG 품을 떠나 SK그룹에 안긴 지 2년여 만에 SK실트론 가치가 치솟고 있다. SK그룹이 인수한 이후 매년 실적이 상승세를 타면서 머지않아 기업공개(IPO)에 나설 것이라는 관측도 솔솔 나온다.  LG그룹 품을 떠나 SK그룹에 인수된 SK실트론 가치가 치솟고 있다. 사진은 경북 구미 SK실트론 공장과 장용호 SK실트론 사장.  ▶SK실트론 실적 매년 급증 ▷매출 1조원 돌파, 영업이익률 30%  금융권에 따르면 지난해 SK실트론 영업이익은 4000억원에 달할 전망이다. 지난해 3분기 누적 영업이익이 2809억원을 기록한 만큼 4분기 이변이 없는 한 2018년 영업이익(3804억원)을 훌쩍 넘어설 가능성이 높다. 대신증권은 2019년 SK실트론 매출이 1조6340억원, 영업이익은 3930억원을 기록할 것으로 예상했다.  사실 SK그룹이 2017년 LG실트론을 인수할 당시만 해도 기업가치를 높게 보는 시각이 많지 않았다. 2013년과 2014년 각각 영업손실 179억원, 348억원을 낼 정도로 매년 적자에 허덕였다. 2015년 겨우 흑자전환에 성공했지만 흑자폭이 54억원에 불과했고 이후에도 실적 부진은 이어졌다. LG그룹 입장에서는 2013년 이후 매년 700억원가량 자금을 LG실트론에 투입했지만 사정은 나아지지 않았다.급기야 LG그룹은 LG실트론을 SK그룹에 매각하는 결단을 내렸다. SK㈜는 2017년 8월 LG그룹 지주사 ㈜LG로부터 LG실트론 지분 51%를 6200억원에 인수했다. 이후 최태원 회장은 사재까지 털어 잔여 지분을 모조리 사들였다. SK㈜는 LG실트론 지분 19.6%를, 나머지 29.4% 지분은 최태원 회장이 총수익스와프(TRS) 방식으로 인수했다. LG실트론 지분 100%를 사는 데 1조원 넘는 자금이 소요됐다. SK그룹 품에 안긴 LG실트론은 분위기가 달라지기 시작했다. 간판을 SK실트론으로 바꾼 이후 실적이 날개를 달았다. 인수 이전인 2016년 SK실트론 매출은 8363억원, 영업이익 340억원에 불과했지만 2017년 한 해에만 영업이익이 1000억원가량 급증했다. 2017년 매출 9331억원, 영업이익 1327억원으로 매출과 영업이익이 동반 상승했다. 2018년 들어 반도체 시황이 둔화됐지만 실적 상승세는 꺾이지 않았다. 매출 1조3462억원, 영업이익 3804억원으로 꿈에 그리던 1조원 매출을 돌파한 데다 영업이익은 1년 새 3배가량 급등했다. 영업이익률만 30%에 달할 정도로 수익성 높은 효자 계열사로 탈바꿈했다. 이수빈 대신증권 애널리스트는 “SK실트론은 매출의 70%가 삼성전자, TSMC 등 글로벌 반도체 고객사와의 장기계약 거래라 실적이 안정적이다. SK 계열사로 편입된 후 연평균 성장률이 25%에 달할 정도로 성장세가 꾸준하다”고 분석했다. SK실트론 실적이 상승세를 탄 데는 대대적인 투자도 한몫했다. SK실트론은 2017년 3338억원, 2018년 6336억원을 설비투자와 생산 능력 강화에 투입한 데 이어 지난해부터 올해까지 9000억원 넘는 대규모 투자 계획까지 밝혔다. SK실트론 투자 확대는 글로벌 반도체 웨이퍼 선두권 업체인 일본 신에츠화학공업, 섬코를 따라잡겠다는 의지도 담겼다. 전 세계 반도체 웨이퍼 시장점유율을 보면 일본 신에츠화학공업(27%), 섬코(26%)가 1~2위 자리를 다투는 가운데 독일 실트로닉스(13%), 미국 선에디슨(10%), SK실트론(9%)이 바짝 뒤쫓는 모습이다. 시장 전망도 밝다. SEMI실리콘제조업체그룹에 따르면 지난해 세계 반도체 실리콘 웨이퍼 시장 규모는 113억8000만달러로 2017년(87억7000만달러)보다 30% 이상 증가하는 등 매년 커지는 중이다. 시장조사업체 가트너는 AI(인공지능), IoT(사물인터넷), 자율주행차 등 신기술 개발로 반도체 수요가 급증하면서 실리콘 웨이퍼 공급부족 현상이 당분간 이어질 것으로 내다봤다. SK실트론 인수 효과는 여기서 그치지 않는다. 최 회장이 추진해온 반도체 수직계열화 효과도 빼놓을 수 없다.SK그룹은 에너지·화학(SK이노베이션), 통신(SK텔레콤) 등 주로 내수 중심 기업이었지만 2012년 하이닉스를 품에 안으면서 그룹 체질이 달라졌다. 반도체 사업에서 재미를 본 최태원 회장은 반도체 사업 강화에 적극 나섰다. 일례로 2015년 반도체용 특수가스 제조업체 OCI머티리얼즈(현 SK머티리얼즈)를 사들이면서 반도체 소재산업에 진출했다. 이어 반도체 기초소재인 실리콘 웨이퍼를 생산하는 LG실트론까지 품에 안으면서 반도체 소재, 웨이퍼부터 생산까지 명실상부한 반도체 부문 수직계열화를 완성했다는 평가를 받는다. 반도체 계열사 실적이 동반 상승하면서 2015년 152조원이었던 SK그룹 자산은 지난해 217조원으로 40% 이상 늘었다.SK실트론이 글로벌 기업 인수합병(M&A)으로 덩치 키우기에 나선 점도 눈길을 끈다. SK실트론은 지난해 8월 미국 화학기업 듀폰의 실리콘 카바이드(SiC) 웨이퍼 사업부를 4억5000만달러에 인수해 미국·일본이 주도해온 전기차용 소재 시장에 뛰어들었다. SiC 웨이퍼는 전기차에 쓰이는 전력 반도체용 소재로 각광받는 중이다. 최근 미국 테슬라를 비롯한 글로벌 전기차 보급이 늘면서 SiC 웨이퍼 수요가 급증했지만 듀폰을 비롯한 일부 업체만 양산이 가능해 전 세계적으로 공급부족 현상을 겪는 중이다. 시장조사업체 IHS마킷과 욜디벨롭먼트에 따르면 SiC 웨이퍼 기반의 글로벌 전기차, 통신용 전력 반도체 시장 규모는 2019년 13억달러에서 2025년 52억달러로 4배가량 급증할 전망이다. 국내에서 유일하게 반도체용 웨이퍼를 제조·수출하는 SK실트론 입장에서는 듀폰의 연구개발(R&D), 생산 역량을 활용해 얼마든지 시너지를 높일 수 있는 기회다. 재계 관계자는 “SK이노베이션이 전기차 배터리 사업에 드라이브를 걸어온 만큼 SK그룹 입장에서는 SK실트론의 전기차 소재 시장을 키워 윈윈 효과를 기대하는 분위기”라고 내다봤다.     ▶IPO 추진할지 관심 ▷기업가치 3조원 전망도  여세를 몰아 SK실트론은 기업공개도 검토 중이다. 금융권에서는 SK실트론 기업가치가 3조원을 훌쩍 넘어설 것으로 내다본다. SK그룹이 1조원가량을 들여 회사를 인수한 만큼 2년 반 동안 기업가치가 3배 이상 뛰었다는 의미다. SK그룹은 지난해 말 인사에서 장용호 SK머티리얼즈 사장을 SK실트론 신임 사장으로 선임했다. 이를 두고 반도체 사업 경험이 풍부한 장 사장이 SK실트론 IPO를 진두지휘할 것이라는 관측이 나온다. 장 사장은 SK그룹 반도체 소재 사업 진출을 위해 OCI머티리얼즈 인수를 주도한 인물로 유명하다.“LG그룹 시절 LG실트론 IPO를 추진했다가 예상 공모가가 기대치를 밑돌아 IPO를 포기한 바 있다. 당시에는 실적 부진 영향이 컸지만 이번에는 SK실트론 실적이 워낙 좋아 IPO 성공 가능성이 높다.” 한 증권가 애널리스트 귀띔이다. SK실트론 관계자는 “아직 IPO 관련 추진 중인 사항은 없다”고 답했다. 물론 낙관적인 전망만 있는 것은 아니다. 경기 악화로 국내 IPO 시장이 침체돼 흥행 여부를 장담할 수 없는 데다 반도체 시황이 계속 부진하면 실적에도 악영향을 미칠 수밖에 없다. 듀폰 웨이퍼 사업 인수로 향후 재무 부담이 커질 우려도 배제할 수 없다. SK실트론의 듀폰 웨이퍼 사업부 인수금액은 4억5000만달러(약 5500억원)로 한 해 영업이익(2018년 기준 3804억원)을 훌쩍 넘는다. 강교진 한국신용평가 연구원은 “듀폰 웨이퍼 사업부 인수 이후 연구개발, 설비투자 부담이 늘어나면 신용도에 부정적 영향을 줄 수 있다”고 밝혔다. [김경민 기자  kmkim@mk.co.kr] [본 기사는 매경이코노미 제 2048호 (2020.03.04~2020.03.10일자) 기사입니다]▶기사공유하고 코인적립하세요 \'M코인\'▶네이버 메인에서 \'매일경제\'를 받아보세요\xa0▶뉴스레터 \'매콤달콤\' 구독[ⓒ 매일경제 & mk.co.kr, 무단전재 및 재배포 금지]매경이코노미 관련뉴스해당 언론사에서 선정하며 언론사 페이지(아웃링크)로 이동해 볼 수 있습니다.이승윤 前 매니저 강현석 ""빚투 논란 이후 난…""커지는 마스크 갈등…지자체 ""취약층 물량까지 정부가 싹쓸이""EXID LE, 아찔 수영복…요염한 볼륨 시선 강탈가수 박재범, UFC 선수 오르테가에 뺨 맞았다?故 조민기, 오늘 2주기…\'미투\' 성추행 사건 종결좋아요0훈훈해요0슬퍼요0화나요0후속기사 원해요0기사제공 :']"
1,삼성전자, 2020-03-0909:38,연합뉴스 ,"코스피 또 2.9% 급락 출발…장중 1,980선 붕괴(종합)",https://finance.naver.com/news/news_read.nhn?article_id=0011457936&office_id=001&mode=search&query=삼성전자&page=8,"['       코스피 또 2.9% 급락 출발…장중 1,980선 붕괴(종합)      기사입력2020-03-09 09:38기사원문좋아요훈훈해요좋아요 평가하기공감좋아요0훈훈해요0슬퍼요0화나요0후속기사 원해요0댓글 외국인투자자, 개장 직후부터 코스피 2천억원 이상 순매도 코스피 하락 (PG)[제작 조혜인](서울=연합뉴스) 김기훈 기자 = 신종 코로나바이러스 감염증(코로나19)의 확산 공포가 다시 부각되며 9일 코스피가 또 급락 출발했다.    이날 오전 9시 28분 현재 코스피는 전 거래일보다 55.41포인트(2.72%) 내린 1,984.81을 가리켰다.     지수는 전장보다 59.20포인트(2.90%) 내린 1,981.02에서 출발해 장중 한때 1,976.24까지 떨어져 1,980선이 무너지기도 했다.    이날 현재 유가증권시장에서 외국인과 기관은 2천73억원, 812억원을 순매도했다. 개인은 2천817억원을 순매수했다.    서상영 키움증권 연구원은 ""대체로 아시아 신규 확진자 증가세는 완만해진 가운데 유럽과 미국 위주로 확진자가 급증하고 있어 향후 추이에 따라 글로벌 주식시장의 변동성은 커질 수밖에 없다""고 분석했다.    서 연구원은 ""게다가 국제유가의 급락이 투자심리에 악영향을 미칠 수 있다""면서도 ""다만 낮아진 평가 가치(밸류에이션)를 기반으로 반발 매수세가 유입될 가능성은 있다""고 분석했다.    시가총액 상위 종목 가운데 삼성바이오로직스(1.63%)만 올랐다.    삼성전자(-2.28%), SK하이닉스(-3.67%), NAVER(-4.18%), LG화학(-4.13%), 현대차(-3.62%), 셀트리온(-1.41%), 삼성SDI(-3.79%), 삼성물산(-2.31%), LG생활건강(-1.17%) 등은 모두 내렸다.     업종별로는 은행(-3.80%), 운송장비(-3.43%), 철강·금속(-3.33%) 등 대부분 업종이 약세를 보였고 전기가스업(2.67%)은 강세를 보였다    같은 시각 코스닥지수는 전 거래일보다 11.08포인트(1.72%) 내린 631.64를 나타냈다.    지수는 전장보다 11.59포인트(1.80%) 내린 631.13으로 개장해 하락세를 이어가고 있다.    코스닥시장에서는 개인이 225억원을 순매수했다. 외국인과 기관은 각각 16억과 134억원을 순매도했다.    시총 상위주 중에는 에이치엘비(-3.03%), CJ ENM(-2.40%), 펄어비스(-3.37%), 스튜디오드래곤(-2.46^), 케이엠더블유(-1.17%), 에코프로비엠(-2.87%), SK머티리얼즈(-2.27%) 등이 내렸다.    셀트리온헬스케어(1.63%), 제넥신(0.30%) 등은 올랐다.    kihun@yna.co.kr▶ 코로나19 속보 확인은 네이버 연합뉴스에서 [구독 클릭]▶ 프리미엄 북한뉴스 [한반도&] 구독(클릭)▶제보하기연합뉴스 관련뉴스해당 언론사에서 선정하며 언론사 페이지(아웃링크)로 이동해 볼 수 있습니다.\xa0미 당국자 \'왜 한국만큼 검사못하냐\' 질문에…\xa0신천지 어떻게 될까…신흥종교 사례로 본 예상 시나리오\xa0치료제 없는 코로나19, \'이것\'으로 잡는다\xa0확진 신천지교인, 도주·간호사 폭행…왜 경찰 못나섰나\xa0이탈리아 코로나19 확진자 7천375명…""한국보다 많아""좋아요0훈훈해요0슬퍼요0화나요0후속기사 원해요0기사제공 :']"
2,삼성전자, 2020-03-0909:36,파이낸셜뉴스 ,"[fn오전시황] 코스피, 코로나19 확산 우려에 급락..1980선",https://finance.naver.com/news/news_read.nhn?article_id=0004386036&office_id=014&mode=search&query=삼성전자&page=8,"['       [fn오전시황] 코스피, 코로나19 확산 우려에 급락..1980선      기사입력2020-03-09 09:36기사원문좋아요훈훈해요좋아요 평가하기공감좋아요0훈훈해요0슬퍼요0화나요0후속기사 원해요0댓글/사진=뉴스1 [파이낸셜뉴스] 코스피가 외국인과 기관의 매도세에 큰폭으로 하락하고 있다. 미국 뉴욕에서 비상사태를 선언하는 등 코로나19의 전세계적 확산 공포에 힘입어 약세를 보이고 있는 것으로 풀이된다.   9일 오전 9시 35분 코스피는 전거래일 대비 2.84% 하락한 1982.31를 기록하고 있다.   이날 코스피는 전거래일 대비 2.90% 떨어진 1981.02로 개장했다.   개인은 3211억원을 순매수했다. 그러나 외국인, 기관이 각각 2442억원, 857억원 순매도하며 지수를 끌어내렸다.   규모별로 대형주(-2.82%), 중형주(-2.30%), 소형주(-1.96%) 모두 떨어졌다. 업종별로 은행(-3.80), 건설업(-3.34%) 등이 하락했다. 반면 전기가스업(3.19%)은 상승했다.   시가총액 상위종목별로 삼성전자(-3.01%), SK하이닉스(-3.67%), NAVER(-4.46%) 등이 하락세다. 반면 삼성바이오로직스(0.92%), 한국전력(5.21%) 등은 상승세다.   코스닥은 전거래일 대비 1.98% 떨어진 630.00을 기록하고 있다.    nvcess@fnnews.com 이정은 기자   ▶ 헉! 소리나는 스!토리 뉴스 [헉스]▶ 클릭해, 뉴스 들어간다 [뉴스쿨]   ※ 저작권자 ⓒ 파이낸셜뉴스. 무단 전재-재배포 금지파이낸셜뉴스 관련뉴스해당 언론사에서 선정하며 언론사 페이지(아웃링크)로 이동해 볼 수 있습니다.""이만희 지시로 한나라당 수천명 입당, 신천지 현금만..""\'윤석열 고발\' 시민, 뜻밖의 고백 ""추미애 장관의 요청에..""조합원만 따로 마스크 판매한 농협, 1장당 가격이..하천서 발견된 20대 남성 시신, 신고한 사람은..진중권, 이낙연에 의미심장한 한마디 ""친문한테 묻어가려고..""좋아요0훈훈해요0슬퍼요0화나요0후속기사 원해요0기사제공 :']"
