,회사명,날짜,언론사,기사제목,링크,본문
3,삼성전자, 2020-02-1613:00,아시아경제 ,'갤럭시S20·Z플립' 출시에 관련株 주목,https://finance.naver.com/news/news_read.nhn?article_id=0004625121&office_id=277&mode=search&query=삼성전자&page=3,"['       \'갤럭시S20·Z플립\' 출시에 관련株 주목      기사입력2020-02-16 13:00기사원문좋아요훈훈해요좋아요 평가하기공감좋아요0훈훈해요0슬퍼요0화나요0후속기사 원해요0댓글삼성전자의 갤럭시Z플립 언팩 행사장 (사진=아시아경제DB)[아시아경제 금보령 기자] 삼성전자의 갤럭시S20과 갤럭시Z플립이 새로 나오게 되면서 관련주들도 주목을 받고 있다.삼성전자는 지난 11일(현지시간) 미국 샌프란시스코에서 \'갤럭시 언팩 2020\'을 선보였다. 갤럭시S20 시리즈는 갤럭시S20(6.2인치), S20 플러스(6.7인치), S20 울트라(6.9인치) 등 3개 모델로 나왔고, 갤러시Z플립은 지난해 나온 갤럭시폴드 대비 낮은 가격으로 출시됐다.박강호 대신증권 연구원은 ""올해 갤럭시S20 시리즈는 약 3800만대로 추정한다. 갤럭시S10(2019년 3698만대) 판매량을 넘어설 것으로 예상한다. 다만 스마트폰 교체 주기 지연과 5세대(5G) 이동통신서비스 폰 시장에서 경쟁 심화를 감안하면 삼성전자의 IM 부문의 큰 폭의 매출, 이익 성장을 기대하는 데 한계가 있다고 판단한다""며 ""삼성전자는 갤럭시S20 시리즈 판매 증가도 중요하지만 폴더블폰 개화 시기에 선제적인 공략, 판매 증가로 평균판매단가(ASP) 상승을 통한 매출과 이익 개선에 초점을 맞춘 것으로 본다. 갤럭시S10(2019년) 대비 갤럭시S20 시리즈는 ASP 상승 속에 최고 프리미엄인 폴더블폰 판매가 전체 매출과 이익 개선에 기여 예상한다""고 설명했다.삼성전자는 물론 관련주들도 갤럭시S20과 갤럭시Z플립 덕을 볼 전망이다. 덕산네오룩스의 경우 갤럭시S20의 유기발광다이오드(OLED) 패널에 레드·그린프라임과 정공수송층(HTL)을 공급하고 있다. 소현철 신한금융투자 연구원은 ""올해 덕산네오룩스의 영업이익은 전년 대비 71% 성장한 305억원으로 예상한다. 미국과 중국의 5G 스마트폰용 OLED 패널 수요 증가를 고려해 목표주가는 3만8000원으로 18.8% 상향 조정한다""며 ""지난해 6월 삼성디스플레이의 QD OLED 투자 지연으로 주가가 1만3400원까지 하락했지만, 삼성의 스마트폰 판매 확대로 주가가 반등했다. 갤럭시 S20시리즈와 폴더블 스마트폰 대중화로 주가 리레이팅이 기대된다""고 말했다. 덕산네오룩스의 지난 14일 종가는 3만1750원이다.이 외에도 CPI, 커버렌즈 보호필름 등을 담당하는 관련주들이 수혜를 입을 전망이다. NH투자증권은 CPI에 코오롱인더, SK이노베이션을, 초박형유리(UTG)에 유티아이, 켐트로닉스를, 커버렌즈 보호필름에 세경하이테크 이름을 올렸다. 또 폴더블 공정소재에 SKC코오롱PI, 이녹스첨단소재, 힌지에 KH바텍 등을 수혜주로 꼽았다.금보령 기자 gold@asiae.co.kr▶ 2020년 신년운세·사주·무료 토정비결 보러가기▶ 네이버에서 아시아경제 뉴스를 확인하세요. ▶ 놀 준비 되었다면 드루와! 드링킷!<ⓒ경제를 보는 눈, 세계를 보는 창 아시아경제 무단전재 배포금지>아시아경제 관련뉴스해당 언론사에서 선정하며 언론사 페이지(아웃링크)로 이동해 볼 수 있습니다.아들 졸업식에 나타난 이부진, 학부모들과…\'눈길\'""좀 보이면 어때"" 당당히 속옷 벗어 던진 아나운서\'시신 8구\' 영상 몰래 찍었던 中 시민기자…또?""쓴웃음만 난다""는 안철수, 지지율 조사 결과…\'中 통계 보느니 차라리…\' 한국 자료 요청한 WHO좋아요0훈훈해요0슬퍼요0화나요0후속기사 원해요0기사제공 :']"
4,삼성전자, 2020-02-1612:49,SBS Biz ,갤럭시북 플렉스 NT930QCG-K58A G마켓 디지털빅세일 진행,https://finance.naver.com/news/news_read.nhn?article_id=0000205078&office_id=374&mode=search&query=삼성전자&page=3,"['       갤럭시북 플렉스 NT930QCG-K58A G마켓 디지털빅세일 진행      기사입력2020-02-16 12:49기사원문좋아요훈훈해요좋아요 평가하기공감좋아요0훈훈해요0슬퍼요0화나요0후속기사 원해요0댓글삼성전자 온라인 공식 판매점 코잇이 내일(17일)부터 9일간 진행되는 G마켓 디지털빅세일 행사기간 중 갤럭시 아카데미 신제품인 갤럭시북 플렉스 NT930QCG-K58A를 디지털 빅세일을 진행한다.신세계 상품권, C타입 USB 4포트 허브, 로지텍 블루투스 마우스, 한컴오피스, 공기청정기 등 다양한 사은품을 제공할 예정이다.삼성 정품 NVMe SSD업그레이드도 해당 행사기간에 특가로 업그레이드 진행이 가능하다.스마일 클럽 회원은 추가 할인 등을 받을 수 있다.코잇 측은 ""갤럭시북 플렉스 NT930QCG-K58A는 세계최초 QLED디스플레이를 탑재한 제품으로 컬러 볼륨 100%의 색상 표현이 가능하며, 최대 밝기 600니트(NIT)의 야외모드를 지원해 실제 사물을 노트북 디스플레이에서 보는 듯한 느낌을 받을 수 있다""고 설명했다.이어 ""국내 제조업체 최초로 아테나 인증을 받은 제품이다. 아테나 프로젝트란 신속, 정확, 안전 등 노트북을 사용하면서 가장 필요한 요소를 가능하게 한다는 프로젝트이다. 또한 인텔 10세대 CPU 아이스레이크 적용으로 빠른 속도감, 향상된 그래픽효과, 보안, Ai성능 등 다양한 플랫폼에서 매우 뛰어난 능력을 발휘하는 제품""이라고 강조했다.또 ""동작인식이 가능한 S펜으로 멀리서도 플렉스 제품 디스플레이를 컨트롤 할 수 있으며, 무선 충전 공유 시스템을 통하여 Qi디바이스를 지원하는 전자기기는 터치패드를 통하여 무선 충전이 가능하다""고 덧붙였다.온라인 뉴스팀 기자(sbscnbcnews@sbs.co.kr) ☞ SBSCNBC를 만나는 법 [홈][네이버구독]☞ 경제를 실험한다~ #머니랩[네이버 TV] 저작권자 SBS미디어넷 & SBS I&M 무단전재-재배포 금지SBS Biz 관련뉴스해당 언론사에서 선정하며 언론사 페이지(아웃링크)로 이동해 볼 수 있습니다.손보사 작년 순익 9500억 감소…車·실손보험 적자 탓코로나19·기생충 테마주까지…주가 급등락에 시장경보 27% 급증미국 ITC, \'영업비밀 침해\' SK이노베이션 조기패소 결정지난해 직장서 밀려난 40·50대 49만명…5년 만에 최대\'코로나19\' 경제 덮친다…중국發 \'셧다운\' 공포좋아요0훈훈해요0슬퍼요0화나요0후속기사 원해요0기사제공 :']"
5,삼성전자, 2020-02-1612:01,전자신문 ,"드림시큐리티, '안심지갑' 이달 론칭…산업계, 암호화폐 지갑 선점 나서",https://finance.naver.com/news/news_read.nhn?article_id=0002867553&office_id=030&mode=search&query=삼성전자&page=3,"['       드림시큐리티, \'안심지갑\' 이달 론칭…산업계, 암호화폐 지갑 선점 나서      기사입력2020-02-16 12:01기사원문좋아요훈훈해요좋아요 평가하기공감좋아요0훈훈해요0슬퍼요0화나요0후속기사 원해요0댓글블록체인 지갑 선점 경쟁이 치열한 가운데 통합보안 전문기업 드림시큐리티가 블록체인 기반 암호화폐 지갑 서비스를 내놓는다. 주말 서울 송파구 드림시큐리티에서 개발자들이 출시를 앞둔 블록체인 안심지갑 막바지 점검을 하고 있다. 이동근기자 foto@etnews.com블록체인 지갑 선점 경쟁이 치열하다. 보안업계, 암호화폐거래소, 정보통신기술(ICT) 업계가 앞다퉈 블록체인 지갑을 출시하고 있다. 네이버 카카오 삼성전자 등 대기업도 시장에 진입하면서 흥미진진한 경쟁이 예상된다.16일 업계에 따르면 드림시큐리티가 이달 블록체인 기반 암호화폐 지갑 서비스 \'안심지갑\'을 내놓는다. 암호화폐를 안전하게 보관하는 서비스다. 국내 주요 이동통신사와 협업했다. 소비자 인지도, 접근성을 높였다. 안심지갑에는 보안 전문기업 노하우를 적용했다. 유심 기반 하드웨어 보관, 소프트웨어 보관을 지원한다. 암호키 보호, 지갑 복구 기능도 갖췄다. 주소록을 기반으로 코인을 송금할 수 있다.드림시큐리티 관계자는 본지와 만나 “이달 내 출시를 목표로 하고 있다. 서비스를 최종 점검 중”이라며 “업계는 블록체인을 보안기술로 연구해 왔다. 블록체인 기술 노하우가 있다”고 말했다.블록체인 전자지갑 서비스에 뛰어든 곳은 드림시큐리티만이 아니다. ICT업계 대표주자인 네이버와 카카오도 암호화폐 지갑 사업에 나섰다. 네이버 자회사 라인은 일본에서 암호화폐 지갑 \'링크미\'를 지난해 10월 출시했다. 카카오는 블록체인 계열사 그라운드X를 앞세웠다. 카카오톡 기반 암호화폐 지갑 \'클립\' 출시를 예고했다.삼성전자도 갤럭시S10에 이어 갤럭시Z플립, 갤럭시S20에 삼성 블록체인 키스토어를 탑재했다. 일종의 암호화폐 지갑이다. 서비스는 암호화폐 거래, 디앱 서비스에 쓰이는 개인 키를 보관한다. 추가로 암호화폐를 보관하는 \'삼성 블록체인 월렛\' 기능을 제공한다.암호화폐거래소 역시 암호화폐 지갑은 놓칠 수 없다. 빗썸은 암호화폐 지갑 \'빗썸 월렛\'을 출시할 예정이다. 업비트를 운영하는 두나무의 자회사 루트원소프트는 암호화폐 지갑 \'비트베리\'를 운영했다. 다만, 비트베리는 운영난으로 서비스를 중단했다. 후오비는 \'후오비 월렛\'을 서비스한다.산업계 전반에서 블록체인 서비스에 뛰어드는 이유는 시장 선점에 있다. 특히 암호화폐 지갑은 블록체인 서비스 플랫폼 역할을 제공한다. 암호화폐, 여러 형태의 블록체인 자산, 블록체인 개인 키를 저장한다. 블록체인 서비스 활용에 기점이 된다. 블록체인이 본격화됐을 때 필수 기능으로 활용된다. 과거 암호화폐는 투기자산 이미지가 강했다. 그러나 세계 중앙은행 디지털 화폐(CBDC) 이슈가 대두하고, 지역화폐 사업이 이어지며 인식이 바뀌고 있다.블록체인 업계 고위 관계자는 “카카오톡이 좋은 사례다. 카카오톡 자체는 수익성이 떨어지지만, 1위 플랫폼으로 각종 서비스 출발점이 됐다”면서 “암호화폐 지갑은 돈을 벌어들이는 사업이 아니다. 암호화폐 시장을 선점하고 플랫폼 지위를 선점하려는 시도”라고 설명했다.【표】산업계 암호화폐 지갑 서비스이영호기자 youngtiger@etnews.com▶ 국내 RPA 전문가의 이슈와 사례 분석 - 코리아 RPA & 베스트프랙티스 빅콘서트 2020▶ 네이버 모바일에서 [전자신문] 채널 구독하기▶ 전자신문 바로가기 [Copyright ⓒ 전자신문 & 전자신문인터넷, 무단전재 및 재배포 금지]전자신문 관련뉴스해당 언론사에서 선정하며 언론사 페이지(아웃링크)로 이동해 볼 수 있습니다.\'메이드 인 코리아\' 뚝심, 산업계 \'코로나19 면역력\' 키웠다청년정치 아직 현실 벽 높아...21대 국회는 징검다리""라임 환매연기 펀드 총 1조6679억원, 19개 은행·증권서 판매""[대한민국 희망 프로젝트]<647>스마트팜타다 이후 택시업계 \'수입 늘고 이용건수 줄고\'...같은통계 두고 해석 분분좋아요0훈훈해요0슬퍼요0화나요0후속기사 원해요0기사제공 :']"
6,삼성전자, 2020-02-1612:01,YTN ,"중국 내 한국 공장, 이번 주 가동 재개",https://finance.naver.com/news/news_read.nhn?article_id=0001401605&office_id=052&mode=search&query=삼성전자&page=3,"['       중국 내 한국 공장, 이번 주 가동 재개      기사입력2020-02-16 12:01기사원문좋아요훈훈해요좋아요 평가하기공감좋아요0훈훈해요0슬퍼요0화나요0후속기사 원해요0댓글삼성전자 톈진 TV공장, 오는 19일 생산 재개LG전자 중국내 10개 공장, 톈진 공장 제외 생산 재개우한 SK공장 근무 한국인, 중국 복귀 시점 아직 미정[앵커]코로나 19 사태로 멈춰섰던 국내 기업들의 중국내 공장들이 이번 주 대부분 가동을 재개합니다.하지만 부품을 공급하는 전후방 업체들의 가동 여부가 불투명해 생산 차질이 우려되고 있습니다.경제부를 연결해 자세한 소식을 알아보겠습니다. 박병한 기자!중국내 코로나 19 사태가 아직 확산되는 듯 한데 일단 우리 공장들은 가동이 재개되는군요[기자]중국 20여개 성·시가 코로나 19 사태로 춘제 연휴를 9일까지 연장해 한국 기업들의 중국내 공장들이 생산 차질을 빚었으나, 지난 10일 대부분 가동을 재개했습니다.일부 공장 가동 일정이 지연된 공장들도 이번 주 대부분 가동을 재개할 예정입니다.하지만 코로나19 잠복기 격리 등에 따라 인력이 100% 투입되는 완전 정상화에는 시간이 더 걸릴 것으로 보입니다.삼성전자 톈진 TV 공장이 오는 19일 생산을 재개합니다. 톈진 공장은 당초 지난 10일 재가동할 예정이었으나 지방정부의 지침에 따라 연기됐습니다.SK하이닉스 우시 반도체 공장은 코로나19 사태 속에서도 최소 인력으로 가동됐고 지난 10일부터 평일 근무 기준으로 인력을 배치했습니다.LG전자 중국내 10개 공장은 톈진 공장을 제외하고 모두 생산을 재개했으나 톈진 공장은 지방정부 지침에 따라 이번 주에도 아직 재가동 시점이 정해지지 않았습니다.코로나19 발원지인 후베이 성 우한에 있는 SK종합화학 공장은 코로나19 사태 이후로도 인력을 최소화한 채 가동됐습니다.다만 한국으로 일시적으로 들어와 있는 중국 주재원들의 중국 복귀 시점은 아직 정해지지 않은 상태입니다.하지만 중국내 코로나19 사태가 여전히 확산 중에 있고 공장이 가동되더라도 부품을 공급하는 전후방 업체 공장들의 상황이 불분명해 기업들의 생산 차질이 예상되고 있습니다.지금까지 경제부에서 전해드렸습니다. ▶ 대한민국 24시간 뉴스 채널 YTN 생방송보기  ▶ 네이버에서 YTN 뉴스 채널 구독하기 [저작권자(c) YTN & YTN PLUS 무단전재 및 재배포 금지]YTN 관련뉴스해당 언론사에서 선정하며 언론사 페이지(아웃링크)로 이동해 볼 수 있습니다.대법원 ""타인 험담, 퍼질 염려 없다면 명예훼손 아냐""임현주 아나운서, \'노브라\' 생방송 악플에…클럽서 만난 남성 성추행범으로 몬 여성 실형LH, 청년·신혼부부 임대주택 입주자 모집LTE보다 빠르다더니…불통 5G에 \'분통\'좋아요0훈훈해요0슬퍼요0화나요0후속기사 원해요0기사제공 :']"
7,삼성전자, 2020-02-1612:00,서울경제 ,"[르포] 애플 심장부서 5G체험...""Z플립 만져보니 사고 싶어요""",https://finance.naver.com/news/news_read.nhn?article_id=0003694878&office_id=011&mode=search&query=삼성전자&page=3,"['       [르포] 애플 심장부서 5G체험...""Z플립 만져보니 사고 싶어요""      기사입력2020-02-16 12:00기사원문좋아요훈훈해요좋아요 평가하기공감좋아요0훈훈해요0슬퍼요0화나요0후속기사 원해요0댓글실리콘밸리 위치 ‘삼성 익스피리언스 스토어’ 가보니40여명 전문인력 상주 제품 판매신작 공개 후 방문객 80% 늘어미국 팔로알토에 위치한 삼성 익스피리언스 스토어 전경/사진제공=삼성전자[서울경제] “갤럭시 S20·갤럭시Z플립이 공개된 뒤 방문자가 80%나 늘었습니다. IT 기업에 종사하는 직장인과 스탠퍼드 대학 학생들이 많이 오고 있습니다”지난 13일(현지시간) 미국 실리콘밸리의 중심인 팔로알토 ‘삼성 익스피리언스 스토어’엔 제품을 체험해보고 싶어하는 방문객들의 발길이 이어졌다. 이 곳은 미국 휴스턴·롱아일랜드·로스앤젤레스에 이어 삼성전자(005930)가 지난해 12월 12일 4번째로 연 체험 중심 매장이다. 특히 애플 본사가 위치한 실리콘밸리에 처음 문을 연 매장이어서 개장 전부터 큰 관심을 받았다. 실제로 삼성 익스피리언스 스토어에서 걸어서 5분도 되지 않는 거리엔 애플 매장이 자리 잡고 있었다.삼성 익스피리언스 스토어는 갤럭시 5G 제품 체험부터 고객 서비스, 제품 수리 등을 한 곳에서 누릴 수 있는 공간이다. 삼성전자 관계자는 “40여명의 전문 인력이 제품 판매와 체험 등을 제공하고 있다”고 밝혔다. 아직 5G 단말기를 내놓지 않은 애플과 달리 삼성 익스피리언스 스토어에선 5G 단말기와 이를 활용한 게임 콘텐츠 등도 체험해 볼 수 있다. 실리콘밸리에 위치하고 있는 만큼 방문객들의 상당수는 IT 기업의 2030 직장인과 인근 스탠퍼드 대학생들이다. 매장에서 체험을 돕는 관계자는 “주변에서 일하는 20~30대 직장인들에겐 5G, 사물인터넷(IoT)와 같은 새로운 서비스를 직접 느껴볼 수 있도록 소개한다”고 설명했다. 한 방문객이 미국 팔로알토에 위치한 삼성 익스피리언스 스토어에서 갤럭시 S20 울트라를 체험해보고 있다./사진제공=삼성전자최근 가장 관심이 높은 제품은 단연 플래그십폰 갤럭시 S20 시리즈와 폴더블폰 갤럭시Z플립이다. 갤럭시 S20 시리즈는 매장 가장 앞쪽에 진열돼 방문객들의 이목을 집중시켰다. 직접 갤럭시 S20 시리즈를 들고 100배 줌(스페이즈 줌) 등 카메라 기능도 체험해 볼 수 있었다. 갤럭시Z플립은 유리관 속에 들어 있지만 방문객이 요청할 경우 꺼내서 체험해볼 수 있도록 하고 있다. 삼성전자 관계자는 “갤럭시 S20 시리즈는 방문객들이 100배 줌을 체험할 때 굉장히 놀라워했다”고 전했다. 이어서 “갤럭시Z플립은 휴대성이 높아 젊은층이 열광하는 모델”이라며 “휴대가 간편해 구매하고 싶다는 반응이 많았다”고 덧붙였다. 삼성전자는 미국 내 체험 공간을 앞으로 더 확장해나갈 계획이다. 경제문 삼성전자 미국법인 리테일 담당은 “소비자들이 갤럭시 제품과 쉽게 상호작용할 수 있도록 삼성 익스피리언스 스토어를 더 확장하는 방향으로 시장 반응을 지속 확인하고 있다”고 밝혔다./팔로알토=권경원기자 nahere@sedaily.com[서울경제 바로가기]▶ \'한 눈에 쏙\' 새로워진 서울경제 모바일 페이지를 만나보세요. GO~▶ 네이버 채널에서 \'서울경제\' 채널 구독해주세요! 저작권자 ⓒ 서울경제, 무단 전재 및 재배포 금지서울경제 관련뉴스해당 언론사에서 선정하며 언론사 페이지(아웃링크)로 이동해 볼 수 있습니다.[르포]""100배줌 카메라 신기해요""...애플 본고장도 놀란 갤S20·갤Z플립[영상]갤S20 써보니...대충 찍어도 \'인생샷\' 건진다노태문 ""갤S20, 사람들 소통방식 바꿀 것""1억화소 \'인간의 눈\' 갤S20...손안에 쏙 \'콤팩트\'한 갤Z플립갤S20 흥행에 폴더블폰 대중화까지...두 마리 토끼 노리는 삼성좋아요0훈훈해요0슬퍼요0화나요0후속기사 원해요0기사제공 :']"
8,삼성전자, 2020-02-1611:38,아시아경제 ,"삼성전자, 웨이퍼 생산능력 세계 1위…SK하이닉스 4위",https://finance.naver.com/news/news_read.nhn?article_id=0004625094&office_id=277&mode=search&query=삼성전자&page=3,"['       삼성전자, 웨이퍼 생산능력 세계 1위…SK하이닉스 4위      기사입력2020-02-16 11:38기사원문좋아요훈훈해요좋아요 평가하기공감좋아요0훈훈해요0슬퍼요0화나요0후속기사 원해요0댓글자료=IC인사이츠[아시아경제 이창환 기자] 삼성전자의 지난해 웨이퍼(200mm 기준) 생산능력이 전세계 1위였던 것으로 조사됐다. SK하이닉스는 4위였다.16일 시장조사업체 IC인사이츠에 따르면 삼성전자는 지난해 월 293만5000장의 웨이퍼를 생산해 세계 1위를 기록했다. 이는 전 세계 웨이퍼 생산량의 15% 수준이다. 웨이퍼는 반도체를 만드는 토대가 되는 얇은 실리콘 판이다.삼성전자의 뒤를 이어 대만의 파운드리 전문 기업 TSMC가 월간 250만 장으로 12.8%의 점유율을 차지했다.마이크론이 월 184만장으로 점유율 9.4%, 3위였다. SK하이닉스는 월 174만3000장으로 점유율 8.9%, 4위였다.IC인사이츠는 삼성전자가 생산한 웨이퍼의 3분의2가 D램과 낸드플래시 등 메모리반도체 제조에 사용됐다고 분석했다. SK하이닉스 역시 80% 이상을 메모리반도체를 만드는 데 썼다.또한 지난해 삼성전자와 SK하이닉스를 비롯해 월 100만장 이상 웨이퍼를 생산한 상위 5개 메모리 반도체업체의 웨이퍼 생산능력 점유율은 53%였다. 이는 10년 전인 2009년의 점유율 36%에 비해 17%포인트 오른 수치다.이창환 기자 goldfish@asiae.co.kr▶ 2020년 신년운세·사주·무료 토정비결 보러가기▶ 네이버에서 아시아경제 뉴스를 확인하세요. ▶ 놀 준비 되었다면 드루와! 드링킷!<ⓒ경제를 보는 눈, 세계를 보는 창 아시아경제 무단전재 배포금지>아시아경제 관련뉴스해당 언론사에서 선정하며 언론사 페이지(아웃링크)로 이동해 볼 수 있습니다.아들 졸업식에 나타난 이부진, 학부모들과…\'눈길\'""좀 보이면 어때"" 당당히 속옷 벗어 던진 아나운서\'시신 8구\' 영상 몰래 찍었던 中 시민기자…또?""쓴웃음만 난다""는 안철수, 지지율 조사 결과…\'中 통계 보느니 차라리…\' 한국 자료 요청한 WHO좋아요0훈훈해요0슬퍼요0화나요0후속기사 원해요0기사제공 :']"
