,회사명,날짜,언론사,기사제목,링크,본문
0,삼성전자, 2020-03-0923:30,MBN ,"레고코리아, 국내 8번째 공식 레고스토어 수원 광교에 개장",https://finance.naver.com/news/news_read.nhn?article_id=0001430113&office_id=057&mode=search&query=삼성전자&page=1,"['       레고코리아, 국내 8번째 공식 레고스토어 수원 광교에 개장      기사입력2020-03-09 23:30기사원문좋아요훈훈해요좋아요 평가하기공감좋아요0훈훈해요0슬퍼요0화나요0후속기사 원해요0댓글 레고코리아가 갤러리아백화점 광교점 6층에 레고그룹 본사가 인증한 공식 레고스토어 국내 8호점을 열었습니다.  레고스토어는 레고그룹 본사의 가이드라인에 따라 레고만의 특별한 경험을 느낄 수 있도록 디자인된 직영 매장입니다.  필요한 브릭을 용기에 담아 개별로 구매할 수 있는 픽어브릭(Pick-A-Brick)존, 원하는 스타일대로 미니피겨를 꾸밀 수 있는 나만의 맞춤 미니피겨(Build-A-Minifigure)존이 운영되며 각양각색 레고 전시품도 즐길 수 있습니다.  이와 함께 6층에 레고스토어 매장 옆에 마련된 삼성전자 전시관에서는 레고와 삼성전자의 IT기기를 결합해 드로잉을 체험하는 ‘키즈존’이 상시 운영됩니다.  [ 이상범 기자 / boomsang@daum.net ]▶네이버 메인에서 MBN뉴스를 만나보세요!▶MBN 무료 고화질 온에어 서비스 GO!< Copyright ⓒ MBN(www.mbn.co.kr) 무단전재 및 재배포 금지 >MBN 관련뉴스해당 언론사에서 선정하며 언론사 페이지(아웃링크)로 이동해 볼 수 있습니다.코로나19 확진자 수 줄었지만 ""여름 와도 끝난다는 보장 없어""\'체력 고갈\' 대구 의료진 ""코로나19 전원 완치까지 버틴다""공영쇼핑 ""\'지오영-최창희 부부 루머\' 사실 아냐""코로나19 확진자 통계, 매일 오전 10시 발표승리 입대, \'버닝썬 논란\'은 묵묵부답→재판 군사법원 이관좋아요0훈훈해요0슬퍼요0화나요0후속기사 원해요0기사제공 :']"
1,삼성전자, 2020-03-0920:51,세계일보 ,삼성디스플레이 700여명의 엔지니어 '코로나19' 사태로 발목 묶였다,https://finance.naver.com/news/news_read.nhn?article_id=0003445506&office_id=022&mode=search&query=삼성전자&page=1,"['       삼성디스플레이 700여명의 엔지니어 \'코로나19\' 사태로 발목 묶였다      기사입력2020-03-09 20:51기사원문좋아요훈훈해요좋아요 평가하기공감좋아요0훈훈해요0슬퍼요0화나요0후속기사 원해요0댓글삼성디스플레이, 베트남 정부에 현지 출장 인력 입국 제한 문제 해결 호소    지난 28일 인천에서 베트남 하노이로 입국한 한국민 11명이 강제로 격리돼 있는 하노이 외곽의 한 군부대 여성 기숙사. 한국민들은 신종 코로나바이러스 감염증(코로나19)이 급증한 대구·경북과 무관해 자가격리 대상이지만, 이틀째 강제격리된 상태다. 연합뉴스    삼성디스플레이가 베트남 정부에 현지 출장 인력의 입국 제한 문제를 해결해달라고 호소하고 있는 것으로 알려졌다.   9일 업계에 따르면 삼성디스플레이는 700여명의 엔지니어를 베트남 플렉서블 유기발광다이오드(OLED) 모듈 생산라인 개조에 투입해야 하지만, 신종 코로나바이러스 감염증(코로나19)에 발목이 묶인 상황이다.   업계 관계자는 ""베트남 비자 발급과 14일 격리 등 문제로 설비 개조가 지연될 수 있다""며 ""현지법인이 베트남 정부를 상대로 차질 없이 출장이 가능하게 해달라고 요청하고 있다""고 설명했다.   베트남 온라인 매체 VN익스프레스에 따르면 박노완 주베트남 한국대사도 6일 현지 언론사 기자들과 만나 ""삼성이 생산라인 가동을 위해 전문가 1천명을 베트남으로 데려올 필요가 있다""면서 ""전문가와 엔지니어들이 14일간 격리되면 큰 손실이 발생할 수 있다""고 지적했다.   박 대사는 또 ""한국 보건 당국으로부터 증명서를 발급받은 사람은 정상적으로 베트남에 입국할 수 있어야 한다""는 입장을 밝혔다.   베트남 당국은 지난달 29일부터 한국민에 대한 무비자 입국을 임시 불허하고 있으며 신규 노동비자 발급을 사실상 중단한 것으로 알려졌다.   삼성디스플레이의 현지 인력 투입이 늦어질 경우 앞으로 출시될 삼성전자 스마트폰 신제품을 비롯한 삼성디스플레이의 글로벌 고객사 제품 생산에도 차질이 빚어질 수 있다. 다만 삼성 갤럭시S20에 납품될 OLED 모듈 설비의 경우 이미 개조가 완료된 것으로 알려졌다.   김현주 기자 hjk@segye.comⓒ 세상을 보는 눈, 세계일보세계일보 관련뉴스해당 언론사에서 선정하며 언론사 페이지(아웃링크)로 이동해 볼 수 있습니다.""文대통령님, 하야해주세요""…고교생 청와대 청원 화제""없다던 마스크가 쏟아졌다""""韓 고마워서"" 中, N95 포함 마스크 110만장 보내기로이재용 ""마땅히 나눠야""…\'300억 긴급지원\'""재벌인 줄 알고 결혼했으나 빈털터리"" 정가은 파경 이유 \'재조명\'좋아요0훈훈해요0슬퍼요0화나요0후속기사 원해요0기사제공 :']"
2,삼성전자, 2020-03-0919:45,한국일보 ,"코로나 입국제한 피해 현실화… 삼성디스플레이, 베트남에 “설비 인력 출장 허용해달...",https://finance.naver.com/news/news_read.nhn?article_id=0000475445&office_id=469&mode=search&query=삼성전자&page=1,"['       코로나 입국제한 피해 현실화… 삼성디스플레이, 베트남에 “설비 인력 출장 허용해달라”      기사입력2020-03-09 19:45기사원문좋아요훈훈해요좋아요 평가하기공감좋아요0훈훈해요0슬퍼요0화나요0후속기사 원해요0댓글신종 코로나바이러스 감염증(코로나19) 사태와 관련해 한국발 여객기 착륙을 임시 불허한 베트남 하노이 국제공항 입국장이 5일 텅 비어 있다. 연합뉴스삼성디스플레이가 베트남 정부에 현지 공장 설비 개조를 위한 출장 인력의 입국을 제한하지 말아달라고 요청하고 있는 것으로 밝혀졌다. 베트남은 신종 코로나바이러스 감염증(코로나19) 방역을 명분으로 지난달 29일부터 한국인의 무비자 입국을 불허하고 입국자는 14일간 격리하는 조치를 시행 중이다. 9일 업계에 따르면 삼성디스플레이는 지난달 말부터 임직원과 설비 협력업체 직원 등 700명가량을 베트남 박닌성에 있는 공장에 보낼 계획이었지만 베트남의 입국 제한 조치로 출장길이 막힌 상황이다. 이 공장은 디스플레이 패널에 회로 등을 붙여 세트업체(완제품 제조사)에 공급하기 적합한 형태로 만드는 모듈공장으로, 특히 한국에서 만든 스마트폰용 플렉서블 유기발광다이오드(OLED) 패널을 가공해 현지 삼성전자 공장이나 화웨이, 애플 등에 공급하고 있다. 삼성디스플레이는 하반기 납품 계획에 맞춘 생산설비 개조를 위해 인력 파견이 필요하다는 입장이다. 삼성디스플레이는 베트남 박닌성 정부에 출장 인력에 대한 입국 제한 예외를 적용해달라고 요청했다. 현지 한국대사관도 지원에 나섰다. 박노완 주베트남 대사는 지난주 현지 매체 기자들을 만나 “삼성이 생산라인 가동을 위해 전문가와 엔지니어를 베트남에 데려올 필요가 있는데 이들이 14일간 격리되면 큰 손실이 발생할 수 있다”며 한국 의료기관의 코로나19 음성 진단서를 소지한 출장자는 격리 대상에서 제외해달라고 호소했다. 삼성전자, LG전자 등 국내 주요 기업들이 베트남을 ‘포스트 중국’ 생산기지로 점찍고 생산설비를 늘려온 상황이다. 삼성전자는 최근 경북 구미사업장이 코로나19 확진 직원 속출로 가동 중단되는 일이 반복되자 이곳에서 생산하던 최신 스마트폰 갤럭시S20 생산물량을 베트남 공장으로 이관하기도 했다. 이렇다 보니 베트남 정부의 입국 제한 조치는 현지 진출한 우리나라 기업에 즉각적 타격이 되고 있다. 삼성디스플레이는 다만 이번 출장 지연과 갤럭시S20용 패널 생산은 무관하다고 밝혔다.이훈성 기자 hs0213@hankookilbo.com\xa0▶네이버에서 한국일보 뉴스를 받아보세요\xa0▶뉴;잼을 보면 뉴스가 재밌다 [뉴스레터 구독하기]\xa0▶한국일보닷컴 바로가기한국일보 관련뉴스해당 언론사에서 선정하며 언론사 페이지(아웃링크)로 이동해 볼 수 있습니다.""대구서 구급현장 23년 지금이 가장 힘들다""정부의 섣부른 낙관론 되풀이 \'2월 확진자 급증\' 잊었나""한국인 입국 금지 100여 곳…일본이 호흡기 뗐다""폄훼에 몰상식…코로나에 또 드러난 \'외교 패착\'""TK 주민은 어디로 가야 합니까"" 절박함이 부른 거주지 거짓말좋아요0훈훈해요0슬퍼요0화나요0후속기사 원해요0기사제공 :']"
