,회사명,날짜,언론사,기사제목,링크,본문
0,삼성전자, 2020-11-0221:10,일간스포츠 ,"롯데하이마트온라인쇼핑몰, ‘빅 하트세일’",https://finance.naver.com/news/news_read.nhn?article_id=0003065004&office_id=241&mode=search&query=삼성전자&page=1,"['       롯데하이마트온라인쇼핑몰, ‘빅 하트세일’      기사입력2020-11-02 21:10기사원문좋아요훈훈해요좋아요 평가하기공감좋아요0훈훈해요0슬퍼요0화나요0후속기사 원해요0댓글 [일간스포츠 서지영]   롯데하이마트(대표 황영근)가 온라인쇼핑몰에서 2일부터 8일까지 역대급 ‘빅(BIG) 하트 세일’을 진행한다. 연말 쇼핑 수요가 많을 것을 예상해 연중 최대 규모로 행사 상품을 기획하고, 혜택도 역대급으로 준비했다. 카드 청구할인을 최대 11%까지 해주고, 매일 1만 명에게 주는 쿠폰 지원금도 110억원 물량으로 마련했다.      롯데하이마트(대표 황영근)가온라인쇼핑몰에서 오는 8일까지 역대급 ‘빅(BIG) 하트 세일’을 진행한다. 연말 쇼핑 수요가 많을 것을 예상해 연중 최대 규모로 행사 상품을 기획하고, 혜택도 역대급으로 준비했다. 카드 청구할인을 최대 11%까지 해주고,  매일 1만 명에게 주는 쿠폰 지원금도 110억원 물량으로 마련했다. 엘포인트(L.POINT)도 최대 100만 포인트까지 준다. 참여만 해도 경품을 주는 ‘행운의 룰렛’  이벤트도 준비했다.    인기 가전 제품을 한정 수량 할인 판매하는 ‘하트비트 특가’ 기획전에서는 매일 30가지 상품을 최대 50% (카드혜택 등을 포함한 최대 혜택가) 할인 판매한다. 행사 시작 당일인 2일에는 오전 10시 정각 오픈하고, 3일부터는 자정(오전 12시)에 오픈한다. 삼성전자 김치냉장고(202L), 삼성전자 양문형 냉장고(635L), LG전자 드럼세탁기(21KG), 다이슨 V10 청소기 등을 혜택가로 선보인다.    혜택도 역대급이다. 행사 카드로 결제하면 최대 11%를 12만원까지 청구할인 해준다. 쿠폰 지원금도 110억 물량으로 준비했다.  구매 금액대에 따라 최대 10%를 5만원까지 할인해준다. 5천원 이상 구매하면 쓸 수 있는 무료배송 쿠폰도 회원 전원 증정한다. 엘포인트 혜택도 커졌다. 하이마트 모바일 앱에서 2가지 품목 이상을 동시에 구매하면주는 엘포인트를 최대 100만 포인트로 늘렸다. 평소 제공했던 엘포인트가 최대 50만 포인트였던 것과 비교하면 2배 더 주는 셈이다. 상품 구매 후 이벤트에 페이지에서 응모하면 된다.    참여 인원 모두에게 혜택을 주는 ‘행운의 룰렛’ 이벤트도 한다. 롯데하이마트온라인쇼핑몰 회원이라면 누구나 참여할 수 있다. 하이마트 모바일 앱에서 사용할 수 있는 5% 할인 쿠폰, 엘포인트 최대 1만 포인트 등을 경품으로 준다. ‘룰렛 랜덤 하트’도 한다. 모바일 앱에서 룰렛을 돌리면 ’하트’를 최대 5개까지 지급한다. 모은 ‘하트’ 개수에 따라 엔제리너스 아메리카노,  크리스피크림 도넛 기프티콘을 추첨을 통해 지급한다. 이벤트는 매일 1인 1회 참여할 수 있다.    롯데하이마트김진호 상품본부장은 “이번 빅 하트세일은 롯데하이마트온라인쇼핑몰 연중 최대 쇼핑 행사로, 차별화된 가격과 역대급 혜택을 준비했다”며, ”다양한 행사와 풍성한 이벤트를 함께 진행할 예정이니 많은 기대 바란다”고 말했다.    한편, 롯데하이마트온라인쇼핑몰은 콘텐츠 강화에도 힘쓰고 있다. ‘선물하기’ 서비스에 ‘기념일 등록 서비스’를 오픈했다. 생일, 결혼기념일 등 기념일을 등록해두면 기념일에 맞춰 5%를 최대 3만원까지 할인해주는 쿠폰도 발송한다. ‘AS 화상 상담 서비스’도 론칭했다. 모바일 앱에서 AS 접수할때 화상 상담 서비스를 신청하면 롯데하이마트 수리 전문 기사가 고장 원인과 수리 범위를 화상으로 설명해 이해를 돕는다.    서지영 기자 seo.jiyeong@joongang.co.kr   ▶\xa0[오늘의 운세 바로가기] [만화 바로가기]▶\xa0[일간스포츠 바로가기] \xa0 \xa0 ⓒ일간스포츠(https://isplus.joins.com) 무단 전재 및 재배포 금지""일간스포츠 관련뉴스해당 언론사에서 선정하며 언론사 페이지(아웃링크)로 이동해 볼 수 있습니다.""멋쟁이 희극인과의 작별 "" 故박지선, 유서 발견·빈소 마련(종합)만인에게 웃음 주던 박지선, 사망 비보…동료·팬들 \'충격 애도\'(종합)故 박지선, 생일 하루 앞두고 전해진 비보 \'애통\'맥심 모델 출신 강인경, ""아줌마가 야하고..."" 악플에에바 포비엘, 바디 프로필 공개..과감한 상의 탈의좋아요0훈훈해요0슬퍼요0화나요0후속기사 원해요0기사제공 :']"
1,삼성전자, 2020-11-0220:56,연합뉴스 ,"삼성전자, 반도체 '소부장' 협력사 4곳에 740억여원 투자",https://finance.naver.com/news/news_read.nhn?article_id=0011987765&office_id=001&mode=search&query=삼성전자&page=1,"['       삼성전자, 반도체 \'소부장\' 협력사 4곳에 740억여원 투자      기사입력2020-11-02 20:56기사원문좋아요훈훈해요좋아요 평가하기공감좋아요0훈훈해요0슬퍼요0화나요0후속기사 원해요0댓글삼성 51주년 창립기념식 오늘 개최(서울=연합뉴스) 홍해인 기자 = 삼성전자가 1일 창립 51주년을 맞이했다. 삼성전자에 따르면 전날 창립기념일이 휴일이고, 이건희 회장 장례 후 삼우제 등을 고려해 기념 행사가 2일 진행된다. 이번 창립기념일은 이건희 회장 별세 이후 처음 맞는 창립기념일이어서 삼성이 어떤 메시지를 내놓을지 주목된다. 사진은 2일 서울 삼성전자 서초사옥 모습. 2020.11.2 hihong@yna.co.kr    (서울=연합뉴스) 김철선 기자 = 삼성전자가 반도체 소재·부품·장비(소부장) 협력사 4곳에 유상증자 참여를 통해 약 740억원을 투자했다.    삼성전자는 2일 제3자 배정 유상증자 방식으로 반도체 장비용 세라믹 부품 제조사인 미코세라믹스에 216억7천만원, 반도체·디스플레이 공정에 사용되는 전공정 장비 제조사 케이씨텍에 207억2천만원을 투자했다.    아울러 반도체용 진공펌프 제조사 엘오티베큠에 189억9천만원, 반도체·디스플레이 공정 부품 제조사 뉴파워프라즈마에 127억4천만원 등을 투자했다.    삼성전자 관계자는 ""투자에 특별한 배경이 있는 것은 아니고 기존 협력사에 대한 협력 강화 차원의 투자""라고 설명했다.    앞서 삼성전자는 지난 7월에도 소재·부품·장비 중소기업 2곳에 유상증자 참여로 1천133억원을 투자하기도 했다.    kcs@yna.co.kr▶코로나19 속보는 네이버 연합뉴스[구독 클릭]▶[팩트체크]민정수석 국감 불출석이 원칙?▶제보하기<저작권자(c) 연합뉴스(https://www.yna.co.kr/), 무단 전재-재배포 금지>연합뉴스 관련뉴스해당 언론사에서 선정하며 언론사 페이지(아웃링크)로 이동해 볼 수 있습니다.\xa0생방송 중단·SNS 추모…박지선 비보에 연예계 \'충격\'\xa0박지선 어머니 작성 추정 유서성 메모 발견…노트 1장 분량\xa0자동차 엔진 이상해 열어보니 3ｍ뱀이 똬리 틀고\xa0""머리 나쁘니 점령당해"" 도쿄서 한국인에 혐한 발언 퍼부어\xa0\'살인의 추억\' 증언한 이춘재 ""마주친 대상 순간적으로…""좋아요0훈훈해요0슬퍼요0화나요0후속기사 원해요0기사제공 :']"
2,삼성전자, 2020-11-0220:36,서울신문 ,‘이재용의 뉴삼성’이 집중하게 될 4가지 신사업,https://finance.naver.com/news/news_read.nhn?article_id=0003136240&office_id=081&mode=search&query=삼성전자&page=1,"['       ‘이재용의 뉴삼성’이 집중하게 될 4가지 신사업      기사입력2020-11-02 20:36기사원문좋아요훈훈해요좋아요 평가하기공감좋아요0훈훈해요0슬퍼요0화나요0후속기사 원해요0댓글삼성의 ‘미래엔진’ AI·5G·바이오·전장이재용 삼성전자 부회장이 23일 오전 서울 강서구 김포비지니스항공센터(SGBAC)를 통해 입국하고 있다. 이 부회장은 2년만에 베트남을 찾아 응우옌 쑤언 푹 총리와 면담한 뒤 스마트폰, TV, 디스플레이 등 주요 사업 현황을 점검했다. 2020.10.23뉴스1“도전과 혁신의 DNA를 계승 발전시키자.”김기남 삼성전자 대표이사(부회장)가 2일 경기 수원 삼성디지털시티에서 열린 삼성전자 창립 51주년 기념식을 통해 강조한 메시지다. 이번 행사는 지난달 25일 이건희 삼성전자 회장이 별세한 직후 열리다 보니 그를 추모하고 향후 ‘지속가능한 100년 기업’을 만들자는 다짐을 나누는 자리가 됐다. 김 부회장은 “이 회장님의 타계는 코로나19, 불확실한 경영 환경 등으로 어느 때보다 힘든 시간을 보내고 있는 우리 임직원 모두에게 또 하나의 충격과 슬픔이었다”면서 “우리에게 내재된 도전과 혁신의 DNA를 계승 발전시키고 지혜와 힘을 하나로 모으기 위해 이 회장님이 남기신 도전과 열정을 이어받아 업계의 판도를 바꿔 나가는 창조적인 기업으로 진화하자”고 말했다. 또 “사회적 책임을 다하고 미래 사회에 공헌하는 ‘지속가능한 100년 기업’의 기반을 만들자”고도 했다.지난해 행사에서 영상을 통해 등장했던 이 부회장은 올해 불참했으며 별도의 메시지도 없었다. 그는 이 회장의 영결식이 끝난 이튿날(지난달 29일) 곧바로 일터로 복귀해 현안을 챙긴 것으로 알려졌다. 이 부회장의 ‘뉴삼성’은 그가 2018년 2월 ‘국정농단 항소심’에서 집행유예를 받고 출소한 뒤 6개월 만에 발표한 ‘4대 신성장동력’(인공지능(AI)·5세대(5G) 이동통신, 바이오, 자동차 전자장비)을 중심으로 ‘미래 엔진’ 모색에 나설 전망이다.AI 부문은 삼성전자가 현재 잘하고 있는 반도체·스마트폰·가전과 시너지 효과가 크다. 이미 삼성전자는 메모리반도체 글로벌 1위에 자리했지만 향후에는 AI 반도체에 ‘큰 시장’이 열릴 전망이다. 스마트폰·가전기기에는 지금도 초기 단계의 AI가 접목돼 있는데 앞으로 이를 얼마나 더 고도화하느냐가 시장을 주도하는 주요 변수가 될 것으로 전망된다. 지난 6월 뇌 기반 AI 연구 분야에서 최고 석학인 세바스천 승(승현준) 미국 프린스턴대 교수를 삼성리서치 소장(사장)으로 영입한 것도 이런 맥락에서 이뤄진 결정이다.삼성전자 서초사옥 전경. 연합뉴스5G에서는 성과가 나오고 있다. 시장조사기관 IHS에 따르면 지난해 글로벌 5G 통신장비 점유율은 화웨이(26.18%)와 에릭슨(23.41%)에 이어 삼성전자가 23.33%로 3위에 자리했다. 중국 화웨이에 대한 미국 정부의 제재가 올해 들어 더 거세지고 있기 때문에 삼성전자의 반사이익이 예상된다. 통신 장비는 앞선 세대와 같은 업체의 것을 써야 호환성이 좋은데 5G 점유율이 높아지면 향후 6G에서도 유리한 고지를 점할 수 있다.2차 전지를 포함한 자동차 전장 사업 또한 ‘미래 먹거리’로 꼽힌다. 이 부회장은 지난 5월 삼성SDI 충남 천안 배터리 공장을 방문한 정의선 현대자동차그룹 회장을 직접 만나 사업 확대 가능성을 보여 줬고, 2016년에는 국내 기업의 해외 인수합병(M&A)으로는 당시까지의 최대 금액인 80억 달러에 미국 전장기업 하만을 인수하며 오래전부터 해당 사업에 공을 들여 왔다.바이오 사업은 2010년 5월 이 회장도 ‘5대 신수종사업’(태양전지·자동차전지·LED·의료기기·바이오제약) 중 하나로 꼽았던 분야다. 이 부회장으로선 아버지가 다 이루지 못한 부분을 완성한다는 의미가 있다. 이와 관련, 삼성바이오로직스는 9월 말까지 1조 8127억원을 수주해 지난해 전체 수주액(3084억원)의 6배에 가까운 실적을 내놓으며 가파른 성장세를 보이고 있다.신진영 연세대 경영대학 교수는 “이 부회장은 4대 사업 분야가 이미 굉장히 심한 경쟁 상태에 직면해 있다는 점에서 1987년 이 회장이 취임할 때보다 경영 환경이 쉽지 않다”면서 “이 부회장의 어깨가 더 무거워질 수밖에 없어 보인다”고 말했다.한재희 기자 jh@seoul.co.kr▶ 네이버에서 서울신문 구독하기 클릭! ▶ 세상에 이런 일이 ▶ [연예계 뒷얘기] 클릭!ⓒ 서울신문(www.seoul.co.kr), 무단전재 및 재배포금지서울신문 관련뉴스해당 언론사에서 선정하며 언론사 페이지(아웃링크)로 이동해 볼 수 있습니다.""개 구충제까지 먹었지만…"" 김철민, 마지막 여행""건포도 여기 있잖아"" 손가락으로 의붓딸 가슴을…\'희대의 살인마\' 이춘재 ""손 예쁜 여자가 좋아"" 황당\'빨간 마후라\' 영상 구하려는 어른들…삐뚤어진 호기심살해한 뒤 시신 사진까지 찍었다…검은 반지의 비밀좋아요0훈훈해요0슬퍼요0화나요0후속기사 원해요0기사제공 :']"
3,삼성전자, 2020-11-0219:07,SBS Biz ,“이건희 도전·열정 이어받자”…이재용 ‘뉴삼성’ 속도,https://finance.naver.com/news/news_read.nhn?article_id=0000224428&office_id=374&mode=search&query=삼성전자&page=1,"['       “이건희 도전·열정 이어받자”…이재용 ‘뉴삼성’ 속도      기사입력2020-11-02 19:07기사원문좋아요훈훈해요좋아요 평가하기공감좋아요0훈훈해요0슬퍼요0화나요0후속기사 원해요0댓글 [앵커]삼성전자가 고 이건희 회장 별세 이후 처음으로 창립 51주년을 맞았습니다.이재용 부회장은 오늘(2일) 기념식에 참석하진 않았지만 곧 해외 출장 등 활발한 경영활동을 재개할 것으로 보입니다.김동우 기자의 보도입니다.[기자]올해 삼성전자 51주년 기념식은 임직원들을 대상으로 온라인으로 진행됐습니다.기념식장에는 일부 주요 경영진들만 참석했습니다.김기남 부회장은 기념사에서 ""이건희 회장이 남긴 도전과 열정을 이어받아 지속가능한 100년 기업의 기반을 구축하자""고 말했습니다.영상을 통해 코로나19를 극복하고 사상 최대 실적을 달성한 성과를 되돌아보는 시간도 가졌습니다.관심을 끌었던 이재용 부회장의 별도 메시지는 나오지 않았습니다.이 부회장은 지난해 영상을 통해 격려 메시지를 내놨습니다.창립 기념식에는 모습을 비추지 않았지만 이 부회장은 조만간 활발한 경영행보를 재개할 것이라는 관측이 나오고 있습니다.지난달 베트남 출장에서 돌아온 이 부회장은 ""일본 고객들도 만나러 가야 한다""며 연내 추가 해외 출장을 예고했습니다.이 부회장이 2년 전 지목한 4대 성장사업과 관련한 대규모 투자와 M&A에 가능성도 점쳐지고 있습니다.4대 성장사업은 AI와 5G, 바이오와 전장분야입니다.삼성전자는 4년 전부터 열어온 글로벌 AI 포럼을 올해도 이어갔습니다.[김기남 / 삼성전자 DS부문 대표이사 : 삼성전자는 AI 생태계 핵심 기술 회사로서 전세계의 연구자들과 적극적으로 협력하고 있습니다.]이밖에 연말 정기인사와 함께 내년 사업준비까지 이재용의 \'뉴삼성\' 만들기에 더욱 속도가 붙을 것으로 전망됩니다.SBSCNBC 김동우입니다.  김동우 기자(eastright@sbs.co.kr) ▶ 돈 세는 남자의 기업분석 \'카운트머니\' [네이버TV]▶ 경제를 실험한다~ \'머니랩\' [네이버TV]저작권자 SBS미디어넷 & SBS I&M 무단전재-재배포 금지SBS Biz 관련뉴스해당 언론사에서 선정하며 언론사 페이지(아웃링크)로 이동해 볼 수 있습니다.[단독] 지분 적립형 주택…\'용산·태릉\'에는 안 짓는다[단독] 불완전판매 소지 보험 안내장… 금감원 전수조사""이건희 도전·열정 이어받자""…이재용 \'뉴삼성\' 속도임대차법에 전세 뛰자 같이 뛰는 월세…속타는 세입자""전세난 내년 더 무섭다""…건산연, 내년 전셋값 5% 급등좋아요0훈훈해요0슬퍼요0화나요0후속기사 원해요0기사제공 :']"
4,삼성전자, 2020-11-0218:58,디지털타임스 ,"""도전·혁신 DNA 계승 … 100년 기업 나아가자""",https://finance.naver.com/news/news_read.nhn?article_id=0002633942&office_id=029&mode=search&query=삼성전자&page=1,"['       ""도전·혁신 DNA 계승 … 100년 기업 나아가자""      기사입력2020-11-02 18:58기사원문좋아요훈훈해요좋아요 평가하기공감좋아요0훈훈해요0슬퍼요0화나요0후속기사 원해요0댓글이재용 불참 … 조촐하게 진행2일 수원 삼성 디지털시티에서 삼성전자 창립 51주년을 맞아 열린 기념식 행사에서 김기남(가운데) 삼성전자 대표이사 부회장이 기념사를 하고 있다.    삼성전자 제공삼성 창립 51주년 기념식삼성전자 임직원들이 창립 51주년을 맞아 고(故) 이건희 회장을 추모하고, \'도전과 혁신의 DNA\'를 계승 발전시켜 지속가능한 100년 기업으로 나아갈 것을 다짐했다. 이재용 부회장은 이날 기념식에는 참석하지 않았다. 삼성전자는 2일 수원 삼성 디지털시티에서 김기남 대표이사 부회장, 김현석 대표이사 사장, 고동진 대표이사 사장 등 경영진과 임직원이 참석한 가운데 창립 51주년 기념식을 열었다고 밝혔다. 회사는 코로나19 상황을 감안해 기념식 참석자를 최소화하는 등 행사를 엄숙하고 조촐하게 진행했다고 전했다.김기남 부회장은 창립기념사에서 ""이건희 회장님의 타계는 코로나19, 불확실한 경영 환경 등으로 어느 때보다 힘든 시간을 보내고 있는 우리 임직원 모두에게 또 하나의 큰 충격과 슬픔이었다""며 ""회장님의 영원한 안식을 기원합니다""라고 추모했다. 김 부회장은 이어 ""우리에게 내재된 \'도전과 혁신의 DNA\'를 계승 발전시키고 지혜와 힘을 하나로 모으기 위해 회장님이 남기신 도전과 열정을 이어받아 업계의 판도를 바꿔 나가는 창조적인 기업으로 진화하자. 사회적 책임을 다하고 미래 사회에 공헌하는 \'지속가능한 100년 기업\'의 기반을 구축하자""고 당부했다.삼성전자는 1969년 1월13일 삼성전자공업으로 출발했지만, 1988년 11월1일 삼성반도체통신을 합병한 이후 창립기념일을 이날로 바꿨다. 삼성전자는 이날 창립 기념 영상으로 한해 동안 코로나19를 극복하고, 견조한 실적을 달성한 성과를 되돌아봤다. 영상에는 사내 곳곳에서 방역을 위해 노력하는 임직원들의 모습, 마스크 제조기업 스마트공장 구축을 지원하고 생활치료센터로 영덕연수원을 제공하는 등 우리 사회와 함께 했던 활동들이 소개됐다.박정일기자 comja77@dt.co.kr 디지털타임스 채널 구독 / 뉴스스탠드 구독디지털타임스 홈페이지 바로가기디지털타임스 관련뉴스해당 언론사에서 선정하며 언론사 페이지(아웃링크)로 이동해 볼 수 있습니다.3m 버마왕뱀 왜 거기서 나와…자동차 보닛 열어보니 \'놀라운 광경\'문정부 총리실 공직자들…가만히 앉아서 \'5억\' 벌었다이유리, 한때 키스했던 사이인 류수영을 다시 만나면?생닭 두 마리 먹여 키우는 7m·5m 비단뱀…""나의 애완뱀, 사랑해""10살짜리 뱃속서 \'머리카락 한무더기\'…수술한 의료진 ""이럴수가…""좋아요0훈훈해요0슬퍼요0화나요0후속기사 원해요0기사제공 :']"
