,회사명,날짜,언론사,기사제목,링크,본문
16,삼성전자, 2020-05-2509:16,한국경제 ,"'유진테크' 52주 신고가 경신, 수확의 시기가 오고 있다 - DB금융투자, BU...",https://finance.naver.com/news/news_read.nhn?article_id=0004346592&office_id=015&mode=search&query=삼성전자&page=7,"['       \'유진테크\' 52주 신고가 경신, 수확의 시기가 오고 있다 - DB금융투자, BUY(유지)      기사입력2020-05-25 09:16기사원문좋아요훈훈해요좋아요 평가하기공감좋아요0훈훈해요0슬퍼요0화나요0후속기사 원해요0댓글◆ 최근 애널리스트 분석의견- 수확의 시기가 오고 있다 - DB금융투자, BUY(유지)05월 15일 DB금융투자의 어규진 애널리스트는 유진테크에 대해 ""2021년은 삼성전자 평택 2기, SK하이닉스 M16 및 해외 반도체 업체의 투자가 증가하며 본업이 성장. 2019년 메모리업체 투자 축소와 2020년 NAND 중심의 신규투자로 유진테크의 매출이 단기간에 크게 성장하기는 어려움. 반면 종속회사 유진어스의 정상화와 유진테크머트리얼즈의 매출증가로 수익성은 지속 개선되고 있음. 최근 준비하고 있는 신규장비 공급은 DRAM 투자가 재개되는 2020년 하반기 이후 동사의 실적 성장에 크게 기여할 전망.""이라고 분석하며, 투자의견 \'BUY(유지)\', 목표주가 \'23,000원\'을 제시했다.한경로보뉴스이 기사는 한국경제신문과 금융 AI 전문기업 씽크풀이 공동 개발한 기사 자동생성 알고리즘에 의해 실시간으로 작성된 것입니다.▶ 네이버에서 한국경제 뉴스를 받아보세요▶ 한경닷컴 바로가기  ▶ 모바일한경 구독신청 ⓒ 한국경제 & hankyung.com, 무단전재 및 재배포 금지한국경제 관련뉴스해당 언론사에서 선정하며 언론사 페이지(아웃링크)로 이동해 볼 수 있습니다.""문대통령, 답해야""…트럼프 \'심상찮은 움직임\'""미국, 일본, 독일까지 제친 한국""…깜짝 발표유니클로, 갑자기 이제와서…파격 행보코로나로 최악인데…""더 큰 충격온다"" 경고난데없는 8월 임시공휴일 지정설…왜?좋아요0훈훈해요0슬퍼요0화나요0후속기사 원해요0기사제공 :']"
17,삼성전자, 2020-05-2509:14,이데일리 ,"오이솔루션, 5G 해외 매출 증가 하반기부터-하이",https://finance.naver.com/news/news_read.nhn?article_id=0004647630&office_id=018&mode=search&query=삼성전자&page=7,"['       오이솔루션, 5G 해외 매출 증가 하반기부터-하이      기사입력2020-05-25 09:14기사원문좋아요훈훈해요좋아요 평가하기공감좋아요0훈훈해요0슬퍼요0화나요0후속기사 원해요0댓글 [이데일리 유준하 기자] 하이투자증권은 25일 오이솔루션(138080)에 대해 올해 하반기부터 해외 주요 국가들의 5G 투자가 시작되면서 삼성전자(005930)향 매출이 증가할 것으로 판단해 투자의견 ‘매수’와 목표주가 5만3000원을 제시하며 종목 분석을 개시했다.오이솔루션의 올해 1분기 매출액은 189억원으로 전년 동기 대비 56.4% 감소했으며 영업손실은 14억원으로 적자 전환했다. 이승웅 하이투자증권 연구원은 “올해 실적은 뚜렷한 상저하고 흐름을 보일 것”이라며 “일반적으로 통신사는 상반기 장비와 단말 조달에 투자 계획을 수립한 뒤 이를 바탕으로 장비사에 발주를 진행하기 때문에 연간 자본적 지출(CAPEX)의 60% 이상이 하반기에 집중된다”고 설명했다.이 연구원은 “올해 하반기부터는 해외 주요국가들의 5G 투자가 시작됨에 따라 삼성전자향 매출이 증가할 것”이라면서 “삼성전자는 현재 미국 Verizon, AT&T, 일본 NTT Docomo 등을 신규 고객사로 확보하고 5G 장비 공급 계약을 체결했는데 일본은 신종 코로나 바이러스 감염증(코로나19)으로 예정보다 5G 상용화를 앞당겼으며 미국은 Sprint와 T-Mobile 합병이 완료되면서 본격적인 투자에 나설 것으로 보인다”고 말했다.그는 “이 회사의 지난해 실적은 통신 3사의 공격적인 투자 집행으로 큰 폭으로 성장한 바 있다”면서 “올해 상반기 통신 3사의 투자는 인빌딩(건물내) 커버리지를 중심으로 이루어지고 있는 것으로 파악되기 때문에 상반기 실적은 보수적인 접근이 필요하다”고 덧붙였다. 한편 하이투자증권이 추정한 올해 오이솔루션의 매출액과 영업이익은 1686억원, 343억원으로 지난해보다 각각 19.8%, 41.1%씩 감소한 수치다. 이 연구원은 “올해 하반기부터 미국, 일본 중심의 해외 통신사향 매출이 본격적으로 발생할 것”이라면서 “베트남, 인도, 뉴질랜드 등이 5G 상용화를 준비 중이기 때문에 해외 통신사향 매출 기여도는 2022년까지 지속적으로 확대될 것”이라고 내다봤다.유준하 (xylitol@edaily.co.kr)네이버에서 ‘이데일리’ 구독하기▶청춘뉘우스~ 스냅타임▶＜ⓒ종합 경제정보 미디어 이데일리 - 무단전재 & 재배포 금지＞이데일리 관련뉴스해당 언론사에서 선정하며 언론사 페이지(아웃링크)로 이동해 볼 수 있습니다.보물 지키려 보물 내놓는 아이러니...\'간송\'의 고뇌아내·자녀 부탁 최신종 유서 녹음…3일 뒤 또 살인""저는 그렇게 조용히 지나갈 거다""…약쿠르트 근황길, 아내 공개 10살 차이.. 순박한 친구강서구 미술학원 강사 확진…초등·유아 등 수강생 100명좋아요0훈훈해요0슬퍼요0화나요0후속기사 원해요0기사제공 :']"
18,삼성전자, 2020-05-2509:14,이데일리 ,"코스피, 개인·기관 매수세에 상승 출발…1970선",https://finance.naver.com/news/news_read.nhn?article_id=0004647629&office_id=018&mode=search&query=삼성전자&page=7,"['       코스피, 개인·기관 매수세에 상승 출발…1970선      기사입력2020-05-25 09:14기사원문좋아요훈훈해요좋아요 평가하기공감좋아요0훈훈해요0슬퍼요0화나요0후속기사 원해요0댓글개인 3거래일 연속 ‘사자’…전기가스업·통신업↑시총 상위주 일제히 혼조세[이데일리 김윤지 기자] 18일 코스피지수가 상승 출발했다. 개인과 기관의 동반 매수세가 지수 상승을 이끌고 있다.이날 마켓포인트에 따르면 오전 9시9분 현재 코스피지수는 전 거래일 대비 4.29포인트(0.22%) 오른 1974.42를 기록 중이다.서상영 키움증권 연구원은 “한국 증시는 코로나19 진정 이후 점진적인 경제 재개와 회복 기대감이 유지될 것으로 예상하나 미-중간 갈등 고조 등은 변수”라고 짚었다. 유가증권시장에서 개인은 193억원, 기관은 202억원을 순매수 중이다. 외국인은 379억원을 순매도 중이다. 프로그램 매매는 차익과 비차익을 합쳐 95억원 순매도 우위를 기록하고 있다.업종별로는 상승 우위를 보이고 있다. 전가기스업, 통신업, 서비스업이 1% 넘게 상승하고 있고, 섬유의복, 운수장비 등도 1% 미만으로 상승 중이다. 보험과 전기전자가 소폭 하락 중이다. 시가총액 상위 종목은 혼조세다. NAVER(035420)와 카카오(035720)가 2% 안팎 오름세로, 삼성바이오로직스(207940), LG생활건강(051900)이 1% 미만으로 상승 중이다. 삼성SDI(006400), LG화학(051910)이 보합권인 가운데 삼성전자(005930) SK하이닉스(000660)가 소폭 하락 중이다. 지난 22일(이하 미 동부 시각) 뉴욕증권거래소(NYSE)에서 다우존스 30 산업평균지수는 전장보다 8.96포인트(0.04%) 하락한 2만4465.16에 거래를 마쳤다. 스탠더드앤드푸어스(S&P) 500 지수는 전장보다 6.94포인트(0.24%) 오른 2955.45에, 기술주 중심의 나스닥 지수는 39.71포인트(0.43%) 상승한 9324.59에 장을 마감했다.김윤지 (jay3@edaily.co.kr)네이버에서 ‘이데일리’ 구독하기▶청춘뉘우스~ 스냅타임▶＜ⓒ종합 경제정보 미디어 이데일리 - 무단전재 & 재배포 금지＞이데일리 관련뉴스해당 언론사에서 선정하며 언론사 페이지(아웃링크)로 이동해 볼 수 있습니다.보물 지키려 보물 내놓는 아이러니...\'간송\'의 고뇌아내·자녀 부탁 최신종 유서 녹음…3일 뒤 또 살인""저는 그렇게 조용히 지나갈 거다""…약쿠르트 근황길, 아내 공개 10살 차이.. 순박한 친구강서구 미술학원 강사 확진…초등·유아 등 수강생 100명좋아요0훈훈해요0슬퍼요0화나요0후속기사 원해요0기사제공 :']"
19,삼성전자, 2020-05-2509:14,매경이코노미 ,이재용 선언 핵심은 ‘소유·경영 분리’…“승계 없다” 못 박은 李…재계 트렌드 되...,https://finance.naver.com/news/news_read.nhn?article_id=0000065459&office_id=024&mode=search&query=삼성전자&page=7,"['       이재용 선언 핵심은 ‘소유·경영 분리’…“승계 없다” 못 박은 李…재계 트렌드 되나      기사입력2020-05-25 09:14기사원문좋아요훈훈해요좋아요 평가하기공감좋아요0훈훈해요0슬퍼요0화나요0후속기사 원해요0댓글 이재용 삼성전자 부회장이 5월 6일 대국민 사과를 발표한 이후 달라질 ‘뉴 삼성’에 대한 관심이 쏟아진다. 이 부회장이 직접 대국민 사과에 나선 것은 지난 3월 10일 삼성준법감시위원회가 경영권 승계·노조 와해 논란 등과 관련해 사과를 권고한 때문이다. 이 부회장의 대국민 사과는 그간 세습 논란에 대한 반성인 동시에 소유와 경영을 분리한 삼성그룹 새 비전으로 평가받는다.  이재용 삼성전자 부회장이 지난 5월 6일 사과문을 발표하며 자녀에게 경영권을 물려주지 않겠다고 밝혔다. 소유와 경영 분리 선언이 재계의 새로운 트렌드로 자리 잡을지 관심이 모아진다.  <연합뉴스>  ▶전문경영인 체제 구체적 언급 ▷스웨덴 발렌베리家 모델 따를 수 “저는 제 아이들에게 회사 경영권을 물려주지 않을 생각입니다.”이번 사과문에서 가장 주목받은 멘트였다. 자녀에게 경영권을 물려주지 않겠다는 내용은 삼성준법감시위원회 권고안에 포함돼 있지 않았다. 그만큼 이 부회장이 솔직하게 자신의 생각을 공식화한 것이다. 그간 이 부회장은 오랜 기간 승계 문제로 논란에 휩싸였다. 삼성에버랜드와 삼성SDS 등을 통해 증여세를 제대로 납부하지 않고 편법 승계를 받았다는 게 요지다. 또한 승계와 관련해 뇌물 혐의로 재판이 진행 중이기도 하다. 대법원은 지난해 8월 삼성이 최서원 씨 딸 정유라 씨에게 준 34억원 상당의 말 등을 뇌물로 인정하며 경영권 승계를 위한 대가성이 있다고 판단했고, 현재 파기환송심이 진행 중이다. 이 부회장이 4세 승계 문제를 직접 거론한 이유는 이 같은 상황이 직접적인 배경이 됐다. 삼성그룹은 앞으로 전문경영인 체제로 갈 가능성이 높다. 이 부회장이 직접 전문경영인 체제를 언급했다는 점에서 그렇다. 그는 “삼성전자는 기업 규모로 보나 IT업 특성으로 보나 전문성과 통찰력을 갖춘 최고 수준의 경영만이 생존을 담보할 수 있다”며 “삼성은 성별과 학벌, 나아가 국적을 불문하고 훌륭한 인재를 모셔와야 한다. 그 인재들이 주인의식과 사명감을 갖고 치열하게 일하며 저보다 중요한 위치에서 사업을 이끌어가도록 해야 한다”고 말했다.이는 글로벌 IT기업 지배구조 트렌드와 맥을 함께한다. 구글은 지난해 창업자가 경영 전면에서 물러나 전문경영인에게 전권을 맡겼다. 애플 역시 2011년 스티브 잡스 작고 이후 팀 쿡 최고경영자가 이끌고 있다. 재계와 증권가에서는 삼성그룹 오너가 롤모델로 삼았던 스웨덴 발렌베리그룹 승계 방식을 유력하게 꼽는다. 160년을 이어온 발렌베리가(家)는 스웨덴 국내총생산(GDP) 30%를 차지한다. 통신장비 업체 에릭슨, 가전 기업 일렉트로룩스, 중공업 기업 ABB 등 100여개 기업을 갖고 있다. ‘소유하지만 지배하지 않는다’는 원칙 아래 능력 중심 후계자 선정 방식을 따른다. 발렌베리 가문은 그룹을 지주회사인 인베스터를 통해 지배한다. 인베스터가 자회사를 지배하지만 경영은 전문경영인을 통해 이뤄진다. 인베스터는 발렌베리 가문 재단 소유로 마르쿠스 발렌베리 스톡홀름엔스킬다은행(SEB) 회장이 5대 총수를 맡고 있다. 자회사 경영수익이 재단에 배당으로 지급되면 일부는 회사 성장을 지원하고 일부는 사회 환원한다.   ▶승계 불가는 어쩔 수 없는 선택?  ▷세금 감안하면 오너 지분 희석 불가피 삼성그룹의 소유와 경영 분리는 자연스러운 과정이라는 시각이 있다. 삼성전자 시가총액은 이미 300조원을 넘겼다. 이 부회장 일가가 지분을 늘려 지배력을 확대하는 것은 사실상 불가능하다. 게다가 상속·증여세 등을 감안하면 오너 지분이 크게 줄어들 수밖에 없다. 장기적으로 봤을 때 국내 재벌 소유와 경영 분리가 이어질 것이라는 전망이 나오는 이유다.이 부회장이 이건희 삼성 회장 지분을 물려받으려 해도 엄청난 세금을 내야 한다. 증권가에서는 이 부회장이 15조원 상당 이건희 회장의 삼성전자·삼성생명 지분을 상속받으려면 9조원 이상 세금을 납부해야 할 것으로 예상한다.4세 승계도 현실적으로 쉽지 않다. 이 부회장은 2009년 이혼한 대상그룹 장녀 임세령 대상 전무 사이에서 1남 1녀를 뒀다. 자녀의 보유 지분은 알려지지 않았다. 다만 지금 같은 지배구조에서 자녀에게 지분을 물려주려면 수십조원에 달하는 증여세를 내야 한다. 또한 이 부회장 지분을 전부 물려준다고 해도 최대 주주로 올라설 수 있을지 장담하기 어렵다.  이 부회장이 소유·경영 분리를 언급했다고 해도 삼성 지배구조에 당장 변화가 있을 것 같지는 않다. 삼성그룹 주력 회사인 삼성전자는 삼성생명이 지분 8.5%를 보유한 최대 주주다. 삼성물산은 삼성생명 지분 19.3%를 보유해 삼성그룹의 실질적 지주사 역할을 한다. 삼성물산 최대 주주는 지분 17.1%를 보유한 이재용 부회장을 포함한 이건희 회장 일가다. 다시 말해 이재용 부회장-삼성물산-삼성생명-삼성전자로 이어지는 구조다. 총수 일가의 삼성전자 지분이 5%에 불과하지만 실질적인 지배가 가능한 이유다.  현행 금산법(금융산업의 구조 개선에 관한 법률)에 따르면 대기업 계열 금융사가 비금융 계열사 지분 10%만 넘지 않으면 문제가 되지 않는다. 하지만 지주사 체제로 전환하면 얘기가 달라진다. ‘금산분리(금융자본과 산업자본의 분리)’ 원칙에 따라야 해 삼성생명이 삼성전자 대주주 지위를 누릴 수 없게 된다.최근 금융사의 ‘간접지배’ 구조를 개선해야 한다는 규제당국의 암묵적 압박이 이어지는 만큼 향후 삼성의 ‘금산분리’는 골치 아픈 과제로 꼽힌다. 지배구조 개선 방안 중 하나는 삼성물산이 삼성생명·삼성화재가 보유한 삼성전자 지분을 인수하는 것이다. 하지만 두 회사 지분가치를 금액으로 환산하면 30조원 상당 막대한 현금이 필요하다. 그렇다고 삼성생명이 보유한 삼성전자 지분을 시장에 팔 수는 없는 상황이라 당장 지배구조에 변화가 없을 듯 보인다. ▶이재용 新선언 재계 파장은  ▷사회적 가치 내세운 SK그룹 영향 줄까 이 부회장의 삼성 총수경영 체제 마침표 선언은 다른 대기업에도 영향을 줄 듯 보인다. 오너가 있는 10대 그룹 가운데 경영권 승계를 하지 않겠다고 밝힌 것은 삼성이 처음이다. SK그룹이 승계 과정에서 과도기적으로 전문경영인 체제를 유지한 적 있고, 지난해 이웅열 전 코오롱그룹 회장이 비교적 젊은 나이에 은퇴를 발표하기도 했다. 하지만 자녀 승계를 하지 않겠다고 공개 선언한 건 이 부회장이 처음이다. 한 재계 관계자는 “한국식 오너경영이 바뀌는 계기가 될 것”이라고 평가했다. 일각에서는 그룹 순위 2위를 노리는 최태원 SK그룹 회장에게 영향을 줄 가능성이 있다는 분석이 나온다. 사회적 가치 추구를 그룹 모토로 삼고 있는 만큼 어떤 방식으로든 오너 중심 경영 체제에 변화를 줄 것이라는 판단에서다. 아울러 각종 위법으로 지탄받는 2~4세가 오너 일가라는 이유로 무조건 가족 세습을 받는 현상이 줄어들 것이라는 의견도 나온다. 이 부회장의 이례적 선언에 재계의 당황하는 모습도 엿보인다. 소유·경영 분리 방침이 오너경영은 나쁘고 전문경영인 체제가 무조건 옳다는 편견을 줄 수 있다는 것. 한 재계 관계자는 “전문경영인이 뛰어난 경영 능력을 보일 수 있겠지만 과감한 신성장동력 투자나 위기 돌파 능력에서는 오너경영이 강할 수 있다”며 “오너 승계는 무조건 안 된다는 인식이 퍼질까 걱정”이라고 말했다. 한편, 당장 현안이 아닌 4세 승계를 내세워 이 부회장 편법 승계 논란을 벗어나려 한다는 비판도 대두된다. 첫째인 아들은 올해 스물한 살이고 둘째인 딸은 고등학생이다. 올해 이 부회장 나이가 만 52세인 점을 고려하면 삼성의 4세 경영 시대는 적어도 30년 이후 도래한다. 삼성전자에 밝은 한 애널리스트는 “이 부회장 자녀가 정상적으로 세금을 납부해 지분을 물려받고 최대 주주로 경영권을 행사한다면 자본주의 국가에서 누구도 뭐라 할 사람은 없다”며 “지금 이 시점에서, 불명확한 개념이라고 할 수 있는 경영권 문제를 사과의 최일선에 내세우는 게 맞는지 모르겠다”고 말했다. [명순영 기자  msy@mk.co.kr] [본 기사는 매경이코노미 제2059호 (2020.05.20~05.26일자) 기사입니다] ▶네이버 메인에서 \'매일경제\'를 받아보세요▶매부리TV 구독하고 에어팟프로 득템!!\xa0▶뉴스레터 \'매콤달콤\' 구독[ⓒ 매일경제 & mk.co.kr, 무단전재 및 재배포 금지]매경이코노미 관련뉴스해당 언론사에서 선정하며 언론사 페이지(아웃링크)로 이동해 볼 수 있습니다.이태성 ""軍복무 중 생활고…카드론으로 돌려막아""[단독] 메르스 때처럼…8월 14일 임시공휴일 지정 검토비키니 챔피언 신새롬, 로드걸 변신…섹시미 뽐내BJ철구, 軍 제대 후 복귀 방송에 시청자가 무려…민우혁 ""이세미, 출산후 다시 수술실行…너무 무서웠다""좋아요0훈훈해요0슬퍼요0화나요0후속기사 원해요0기사제공 :']"
0,삼성전자, 2020-05-2509:12,한국경제 ,"'코미코' 52주 신고가 경신, 고래싸움에 웃음짓는 새우 - NH투자증권, BUY...",https://finance.naver.com/news/news_read.nhn?article_id=0004346582&office_id=015&mode=search&query=삼성전자&page=8,"['       \'코미코\' 52주 신고가 경신, 고래싸움에 웃음짓는 새우 - NH투자증권, BUY(유지)      기사입력2020-05-25 09:12기사원문좋아요훈훈해요좋아요 평가하기공감좋아요0훈훈해요0슬퍼요0화나요0후속기사 원해요0댓글◆ 최근 애널리스트 분석의견- 고래싸움에 웃음짓는 새우 - NH투자증권, BUY(유지)05월 22일 NH투자증권의 손세훈  애널리스트는 코미코에 대해 ""최근 TSMC가 미국 애리조나 주에 5nm팹을 건설하기로 발표.  신규 팹은월 2만장으로 추정되며 2024년에 생산개시 예정. 뒤이어 21일 삼성전자는평택에 5nm이하 EUV 파운드리 팹을 구축하기로 발표하였고 가동 시점은2021년 하반기로 예상. 인텔 역시 미국에 추가 투자를 할 것으로 전망. 동사는 각 법인을 통해 글로벌 반도체 업체들과 거래하고 있기에 전방위적으로 확대되고 있는 파운드리 경쟁은 동사의 수혜. ""라고 분석하며, 투자의견 \'BUY(유지)\', 목표주가 \'40,000원\'을 제시했다.한경로보뉴스이 기사는 한국경제신문과 금융 AI 전문기업 씽크풀이 공동 개발한 기사 자동생성 알고리즘에 의해 실시간으로 작성된 것입니다.▶ 네이버에서 한국경제 뉴스를 받아보세요▶ 한경닷컴 바로가기  ▶ 모바일한경 구독신청 ⓒ 한국경제 & hankyung.com, 무단전재 및 재배포 금지한국경제 관련뉴스해당 언론사에서 선정하며 언론사 페이지(아웃링크)로 이동해 볼 수 있습니다.""문대통령, 답해야""…트럼프 \'심상찮은 움직임\'난데없는 8월 임시공휴일 지정설…왜?유니클로, 갑자기 이제와서…파격 행보코로나로 최악인데…""더 큰 충격온다"" 경고""미국, 일본, 독일까지 제친 한국""…깜짝 발표좋아요0훈훈해요0슬퍼요0화나요0후속기사 원해요0기사제공 :']"
1,삼성전자, 2020-05-2509:05,뉴시스 ,"솔젠트, 코로나19 진단키트 美FDA 긴급사용승인",https://finance.naver.com/news/news_read.nhn?article_id=0009878528&office_id=003&mode=search&query=삼성전자&page=8,"['       솔젠트, 코로나19 진단키트 美FDA 긴급사용승인      기사입력2020-05-25 09:05기사원문좋아요훈훈해요좋아요 평가하기공감좋아요0훈훈해요0슬퍼요0화나요0후속기사 원해요0댓글국내 업체 중 9번째 긴급승인자동화를 통한 생산량 증산계획[서울=뉴시스] 송연주 기자 = 이원다이애그노믹스(EDGC)는 계열사 솔젠트가 미국 식품의약국(FDA)으로부터 코로나19 진단키트에 대한 긴급사용승인(EUA)를 획득했다고 25일 밝혔다. 국내와 미국의 긴급사용승인을 동시에 획득한 세 번째 기업이 됐다. 승인받은 제품은 ‘DiaPlexQ Novel Coronavirus(2019-nCoV) Detection Kit’다. 호흡기감염병 의심환자의 검체(객담, 구인두 및 비인두 가검물)에서 코로나19 바이러스의 유전자를 정성 검출하는 실시간 유전자 증폭(RT-PCR) 방식이다. 이미 미국, 러시아, 브라질 등 코로나19 감염 상위 국가를 포함한 50여 개국 이상의 국가에 공급됐다. 국내 최초로 미국연방재난관리청(FEMA)에 공급한 바 있다. EDGC 측은 ”이번 FDA의 긴급사용승인으로 연방정부는 물론 주정부 및 모든 의료기관에 어떠한 제한 없이 솔젠트 제품을 공급할 수 있다”고 말했다. 솔젠트는 지난 3월 주당 30만명 테스트를 제조 공급한 후, 점차 생산량을 늘려 현재 주당 100만명 분을 생산하고 있다. 나아가 중소기업벤처부와 삼성전자의 사회공헌사업인 ‘스마트공장 구축사업’의 지원을 받아 6월 내 주당 300만~500만명 분의 테스트 키트 생산을 목표로 자동화시스템을 구축 중이다.☞공감언론 뉴시스 songyj@newsis.com▶ 네이버에서 뉴시스 구독하기▶ K-Artprice, 유명 미술작품 가격 공개▶ 뉴시스 빅데이터 MSI 주가시세표 바로가기<ⓒ 공감언론 뉴시스통신사. 무단전재-재배포 금지>뉴시스 관련뉴스해당 언론사에서 선정하며 언론사 페이지(아웃링크)로 이동해 볼 수 있습니다.프랑스 참전용사들 한국마스크 받더니 ""우릴 안잊고…""""확진"" 거짓말한 30대 직장인…폐쇄된 회사 1억원 피해""나가서 1시간만 놀자""…편의점 여종업원 성희롱위조 서류로 청년창업 2000만원 대출…1심 집행유예한번도 못본 환자에 전화로 처방한 의사…대법 ""유죄""좋아요0훈훈해요0슬퍼요0화나요0후속기사 원해요0기사제공 :']"
