,회사명,날짜,언론사,기사제목,링크,본문
2,삼성전자, 2020-12-1016:04,SBS Biz ,"[집중진단] 국회 떠난 여의도, 홍콩 같은 금융경제 허브 될 수 있나",https://finance.naver.com/news/news_read.nhn?article_id=0000227391&office_id=374&mode=search&query=삼성전자&page=5,"[""       [집중진단] 국회 떠난 여의도, 홍콩 같은 금융경제 허브 될 수 있나      기사입력2020-12-10 16:04기사원문좋아요훈훈해요좋아요 평가하기공감좋아요0훈훈해요0슬퍼요0화나요0후속기사 원해요0댓글■ 경제현장 오늘 '집중진단' - 김인만 부동산연구소장, 김수민 시사평론가더불어민주당이 11개 상임위를 시작으로 국회 세종의사당 이전을 추진하겠다 밝혔습니다. 국회사무처와 예산정책처, 입법조사처 일부도 이전 대상에 포함됐는데요. 여론은 집권 여당이 행정수도 이전을 들고 온 배경에 주목합니다. 균형발전을 위한 장기적 해법일까요? 급등한 집값과 다가오는 선거를 모두 잡기 위한 정치적 판단일까요? 관련 사안 토론합니다. # 국회 이전, 국가균형발전? 부동산 대책?Q. 시장에선 민주당이 행정수도 이전을 제기한 배경을 어떻게 평가하나요? '서울 편중' 부동산을 해결하기 위해 내놓은 해법이란 인식도 있어요?Q. 민주당은 행정 비효율 극복 취지도 있을 텐데요. 내년에는 서울시장 보궐, 내후년엔 대선. 정치 공학적 판단에 따른 거란 분석도 있습니다. 어떻게 보시나요?Q. 국회가 세종으로 가면 서울은 어떻게 되는 겁니까? 글로벌 경제금융수도로 육성되나요? 윤희숙 국민의힘 의원은 여의도 국회 부지에 아파트 설립 필요성 주장했는데요. 타당성 평가가 궁금합니다.Q. 민주당 반응 살펴볼까요. 여의도 국회라는 공간이 대한민국의 상징 아니겠습니까? 아파트 지을 수 있는 땅은 부지가 10만 평이면 얼마든 구할 수 있다는 의견, 동의하십니까?Q. 지금이 여의도 국회 부지를 어떻게 활용할질 논할 시점이라고 보시나요? 단순히 11개의 상임위만 이전, 실효성 논란 또한 지속되고 있죠?Q. 또 여의도 국회를 세종으로 옮긴다면요. 이미 노무현 전 대통령 시절 위헌판정 받은 만큼 여전히 실현 가능성에 대해 여론은 반신반의하지 않겠습니까?Q. 설사 국회를 지금 당장 세종으로 옮겼다고 해도요. 단순히 공급이 아닌 수요를 축소시켜 급등한 강남 집값 하락이 가능할까요?Q. 일각에선 오히려 국회의원-공무원 중심으로 '서세원' 현상이 확대돼 강남 집값의 상승을 부추길 수도 있다는 지적, 어떻게 보십니까?# 공공기관 추가 이전 가능성Q. 행정수도 이전 얘기가 나올 때마다 빠지지 않는 내용이 공공기관 추가 이전입니다. 이번엔 관련 내용이 아예 없는데 추진 가능성은 여전한가요?Q, 공공기관 이전, 국가균형발전에 얼마나 도움 될까요?Q. 일각에선 국가 균형발전의 근본적 취지를 재확인할 시점이란 지적입니다. 국회-공공기관 이전을 기업 생산라인 이전 효과와 비교한다면요?Q. 당장 구미는 LG가 TV 생산라인 6개 중 2개를 인도네시아로 이전한단 소식에 침통한 분위기입니다. 공장 이전은 지역경제에 치명타기 때문인가요?Q. 반대로 평택은 함박웃음입니다. 삼성전자가 21일 평택캠퍼스에 극자외선을 활용한 파운드리 생산라인을 구축한다고 발표했기 때문이죠?Q. 삼성-LG 결정이 부동산-지역경제에 미친 영향도 주목 필요성이 있죠. 균형발전-부동산 동시에 잡을 해법은 뭘까요? 또 시장이 원하는 해법 첨언한다면요?(자세한 내용은 동영상을 시청하시기 바랍니다.)   #관련기사 이어보기[집중진단] 우리도 제2의 강남?…세종시 아파트값 17억 넘었다[https://cnbc.sbs.co.kr/article/10001005256]윤선영 기자(anable@sbs.co.kr) ▶ 돈 세는 남자의 기업분석 '카운트머니' [네이버TV]▶ 경제를 실험한다~ '머니랩' [네이버TV]저작권자 SBS미디어넷 & SBS I&M 무단전재-재배포 금지SBS Biz 관련뉴스해당 언론사에서 선정하며 언론사 페이지(아웃링크)로 이동해 볼 수 있습니다.코로나19 백신 접종, 이르면 2월 국내 시작…부작용은?21년 만에 공인인증서 폐지…민간인증서 보안 대책은?'손댄 사업마다 부진' 농심3남 신동익, 140억 대출…왜?지난달 서울 전세거래 올해 최저…11월 전셋값 더 뛰어카카오·네이버, 금융 감독 안 받는다…형평성 논란↑좋아요0훈훈해요0슬퍼요0화나요0후속기사 원해요0기사제공 :""]"
3,삼성전자, 2020-12-1016:00,문화일보 ,"삼성·LG전자 콜센터, 서비스 품질 우수 기업 선정",https://finance.naver.com/news/news_read.nhn?article_id=0002452613&office_id=021&mode=search&query=삼성전자&page=5,"['       삼성·LG전자 콜센터, 서비스 품질 우수 기업 선정      기사입력2020-12-10 16:00기사원문좋아요훈훈해요좋아요 평가하기공감좋아요0훈훈해요0슬퍼요0화나요0후속기사 원해요0댓글친절 응대 등 다수 평가 항목서 높은 점수 받아삼성전자서비스와 LG전자가 한국표준협회 주관으로 진행된 ‘2020 콜센터품질지수(KS-CQI)’ 조사에서 가전과 휴대전화서비스 부문 우수기업으로 선정됐다. KS-CQI 조사는 ‘전문가의 전화 모니터링’과 ‘고객의 콜센터 이용 만족도 평가’를 통해 콜센터의 상담 서비스 품질을 측정하는 지표다.삼성전자서비스와 LG전자는 친절한 응대, 다양한 방식의 서비스 등 다수 평가 항목에서 높은 점수를 받아 우수 기업으로 선정됐다고 10일 밝혔다.삼성전자서비스는 365일·24시간 상담 서비스를 제공하고 있다. 서비스센터 위치, 수리 비용 등 단순 문의는 물론 전문 기술 상담사의 원격 점검도 가능하다. 최근에는 고객 편의를 높이기 위해 인공지능 채팅 상담 ‘챗봇’을 도입했다. 사물인터넷(IoT)을 기반으로 제품 상태·정보를 원격 관리하는 ‘HRM 원격 점검’도 삼성전자서비스의 대표적인 시스템이다. 이 외에도 상담사의 전문 역량 강화를 위해 정기적인 교육·평가를 하고, 관련 전문 자격 취득을 적극적으로 지원하고 있다고 삼성전자서비스는 소개했다.LG전자는 음성인식 ARS, 보이는 ARS, 인공지능 챗봇 등 다양한 방식으로 서비스를 제공 중이다. 챗봇을 이용하면 365일·24시간 어디서나 제품 증상에 대한 원인과 해결 방법을 확인할 수 있다. 챗봇은 제품 문의 등 각종 정보를 수집해 빅데이터 분석을 기반으로 답변한다. 또 고객의 불편(페인 포인트·Pain Point) 관리 체계를 강화하고, 전문 상담사를 육성하고 있다. 상위 10% 전문 상담사는 ‘상담 명장’으로 선발돼 동료들에게 상담 노하우를 전파한다.  장병철 기자 [ 문화닷컴 바로가기 | 문화일보가 직접 편집한 뉴스 채널 | 모바일 웹 ][Copyrightⓒmunhwa.com \'대한민국 오후를 여는 유일석간 문화일보\' 무단 전재 및 재배포 금지(구독신청:02)3701-5555)]문화일보 관련뉴스해당 언론사에서 선정하며 언론사 페이지(아웃링크)로 이동해 볼 수 있습니다.[속보]5명으로 열린 檢총장 징계위, 시작부터 파행女 특수요원, 성추행당한 뒤 피살·2개월 후 시신 발견[속보]윤석열, 검사징계위 불출석…\'절차상 결함\' 반발文대통령 지지율 2주 연속 최저…與 소폭상승 재역전""공수처법 최대 피해자는 퇴임 후 문대통령 될 것""좋아요0훈훈해요0슬퍼요0화나요0후속기사 원해요0기사제공 :']"
4,삼성전자, 2020-12-1015:59,연합뉴스 ,이건희 주식 재산 22조원으로 역대 최고…상속세 11조원 이를 듯,https://finance.naver.com/news/news_read.nhn?article_id=0012073279&office_id=001&mode=search&query=삼성전자&page=5,"['       이건희 주식 재산 22조원으로 역대 최고…상속세 11조원 이를 듯      기사입력2020-12-10 15:59기사원문좋아요훈훈해요좋아요 평가하기공감좋아요0훈훈해요0슬퍼요0화나요0후속기사 원해요0댓글삼성전자 최근 연일 신고가…이 회장 지분 가치 22조1천500억원(서울=연합뉴스) 김영신 기자 = 삼성전자 주가가 연일 최고가를 새로 쓰면서 고(故) 이건희 회장이 보유한 주식 재산도 역대 최고치를 기록했다.       이에 따라 이재용 부회장 등 유족이 부담해야 할 상속세가 11조원에 육박할 것이란 전망이 나온다.     10일 기업분석 전문 한국CXO연구소(소장 오일선) 분석에 따르면 이건희 회장의 주식 가치는 9일 종가 기준으로 22조1천542억원이었다.    이 회장은 삼성전자, 삼성물산, 삼성생명, 삼성SDS 보통주 주식과 삼성전자 우선주 주식을 보유했다.삼성 이건희 회장·이재용 부회장·상속세 (PG)[제작 최자윤] 일러스트    이 회장이 보유한 삼성전자 주식은 2억4천927만3천200주로, 9일 종가(7만3천900원) 기준으로 주식 가치가 18조4천212억원으로 평가됐다.    여기에 삼성생명(4천151만9천180주) 3조142억원, 삼성물산(523만5천733주) 6천755억원, 삼성전자 우선주(61만9천900주) 414억원, 삼성SDS(9천701주) 17억원까지 합쳐 이 회장의 지분가치가 22조원을 넘긴 것이다.    9일 기준 이 회장의 주식 평가액은 이달 1일(20조6천105억원)과 비교하면 1조5천437억원 늘었다.    이재용 부회장 등 유족이 부담해야 할 이 회장 주식 재산에 대한 상속세는 사망 전후 2개월의 시가 평균 금액을 적용해 계산된다.    최대주주였던 고인의 주식이기 때문에 주식 평가액의 20%를 할증한 뒤, 최고 상속세율인 50%와 자진신고 공제율인 3%를 적용한다. 이렇게 하면 상속인들의 상속세액은 주식 평가액의 약 60%에 이른다.    8월24일부터 이달 9일까지 평균 주식 평가액이 18조5천757억원이어서, 상속세는 10조8천억원 상당일 것이라고 CXO연구소는 설명했다.    shiny@yna.co.kr▶네이버에서도 뉴스는 연합뉴스[구독 클릭]▶[팩트체크]코로나 백신 \'부작용 면책\'은 국제공통?▶제보하기<저작권자(c) 연합뉴스(https://www.yna.co.kr/), 무단 전재-재배포 금지>연합뉴스 관련뉴스해당 언론사에서 선정하며 언론사 페이지(아웃링크)로 이동해 볼 수 있습니다.\xa0뾰루지 짰다가 얼굴에 온통 혹으로 뒤덮여\xa0힙합가수 아이언, 야구방망이로 룸메이트 폭행\xa0대도시 식당 쥐들의 습격으로 문닫아…직원 물리고 전기끊겨\xa0수족관서 사라진 물범, 6개월만에 돌아와…사연은\xa0\'날아라 개천용\' 배성우 음주운전 적발…""깊이 반성""좋아요0훈훈해요0슬퍼요0화나요0후속기사 원해요0기사제공 :']"
5,삼성전자, 2020-12-1015:57,디지털타임스 ,"`네 마녀의 날` 코스피, 소폭 하락 마감",https://finance.naver.com/news/news_read.nhn?article_id=0002642277&office_id=029&mode=search&query=삼성전자&page=5,"['       `네 마녀의 날` 코스피, 소폭 하락 마감      기사입력2020-12-10 15:57기사원문좋아요훈훈해요좋아요 평가하기공감좋아요0훈훈해요0슬퍼요0화나요0후속기사 원해요0댓글 10일 코스피가 소폭 하락 마감했다. 증시 변동성이 커지는 \'네 마녀의 날(쿼드러플 위칭데이·지수 및 개별주식 선물·옵션 동시 만기일)\'을 맞았지만 개인투자자들이 외국인투자자와 기관투자자의 물량을 받아내면서 증시 하락을 방어했다.이날 코스피는 전날보다 9.01포인트(0.33%) 하락한 2746.46으로 장을 끝냈다. \'네 마녀의 날\'이라고 불리는 이날은 주가지수 선물과 옵션, 개별 주식 선물과 옵션 등 네 가지 파생상품 만기일이 겹치는 날을 뜻한다. 이들 파생상품에 대한 정리 매물이 쏟아져 변동성이 커질 가능성이 높다. 이날 지수는 5.13포인트(0.19%) 내린 2750.34에 출발해 한때 낙폭이 확대됐다. 이후 개인 매수세로 상승 전환한 뒤 보합권에서 움직이다 하락세로 장을 마쳤다. 우려와는 달리 개인들의 투자심리가 살아나면서 외국인과 기관의 물량을 받아며 변동성을 완화했다는 분석이다.개인들은 이날 7621억원을 사들였다. 기관 역시 이날 2329억원을 매수했다. 반면 외국인은 1조2820억원 팔아치웠다. 프로그램 매매는 차익거래가 613억원, 비차익거래가 113억원 순매도로, 총 727억원 매도 우위를 나타냈다. 시가총액 상위 종목 중에는 셀트리온을 제외한 대부분 종목이 하락 마감했다. 삼성전자는 는 전날보다 1000원(1.35%) 내린 7만2900원에 거래를 마쳤고, SK하이닉스도 4000원(3.32%) 떨어진 11만6500원을 기록했다. LG화학과 삼성SDI도  1~2%대 하락세를 나타냈다. 코스닥은 7.89포인트(0.86%) 오른 921.70에 마감했다. 지수는 0.79포인트(0.09%) 내린 913.02에 시작했으나, 강세로 마감했다. 이미정기자 lmj0919@dt.co.kr연합뉴스     디지털타임스 채널 구독 / 뉴스스탠드 구독디지털타임스 홈페이지 바로가기디지털타임스 관련뉴스해당 언론사에서 선정하며 언론사 페이지(아웃링크)로 이동해 볼 수 있습니다.안선영, \'애로부부\' 출격…입담 \'후끈\'사나, \'코로나19 확진\' 청하와 접촉→트와이스 전원 검사\'임신 10주차\' 조민아, 복근 자랑트랜스젠더 BJ 꽃자, 열애 상대 \'♥트리가\' 누구?\'아침마당\' 성원이(슬리피) ""트로트 시작, 돈 때문이야~""좋아요0훈훈해요0슬퍼요0화나요0후속기사 원해요0기사제공 :']"
6,삼성전자, 2020-12-1015:57,국민일보 ,“투기자본 놀이터될 것” vs “감시 어려워”…모두 불만인 ‘3%룰’,https://finance.naver.com/news/news_read.nhn?article_id=0001389612&office_id=005&mode=search&query=삼성전자&page=5,"['       “투기자본 놀이터될 것” vs “감시 어려워”…모두 불만인 ‘3%룰’      기사입력2020-12-10 15:57기사원문좋아요훈훈해요좋아요 평가하기공감좋아요0훈훈해요0슬퍼요0화나요0후속기사 원해요0댓글상법 개정안 등 이른바 ‘공정경제 3법’이 지난 9일 국회 본회의를 통과하면서 앞으로 우리나라 기업이 헤지펀드의 공략 대상이 될 것이라는 불안감이 기업들 사이에 커지고 있다.상법 개정안의 핵심은 ‘독립적인 감사위원’ 선임이었다. 기존 상법은 이사회 구성원 중에서 감사위원을 뽑게 돼 있다. 그 때문에 제대로 감사를 하기 어렵다는 문제점이 제기돼 법개정에 속도가 붙었다.애초에 사외이사에서 감사위원을 뽑을 때 최대주주와 특수관계인을 포함해 의결권을 3%로 제한키로 했던 정부안은 국회 의결 과정에서 최대주주와 특수관계인의 의결권을 각각 3%까지 인정하는 것으로 ‘완화’됐다. 이른바 ‘3%룰’이다.하지만 재계에서는 완화된 안도 헤지펀드 공격에 무방비로 노출되는 것은 달라질 게 없다고 입을 모은다.경영권을 가지고 있는 최대주주는 의결권이 제한되는 반면, 투기 자본들은 의결권을 확대할 수 있는 방법이 얼마든지 있기 때문이다.예를 들어 삼성전자 경우 최대주주와 특수관계인의 지분은 21.21%인데 3%룰을 적용하면 의결권은 12.52%로 낮아진다. 최대주주인 고(故) 이건희 회장(4.18%)을 비롯해 특수관계인 삼성물산(5.01%), 삼성생명보험(8.51%) 등의 의결권이 3%로 제한되기 때문이다.반면 외국인 보유 지분은 56%는 그대로 의결권이 살아있을 가능성이 높다. 지분을 3%씩 쪼갠 헤지펀드 여러 곳이 합심해서 주주총회에서 표대결에 나설 수 있다는 것이다.특히 단기 차익을 노리는 헤지펀드가 기업의 ‘곳간’을 노리고 덤벼들면 5~10년을 내다보고 장기 투자를 하는 게 어려워질 것이라는 우려가 나온다. 한 대기업 관계자는 10일 “당장 돈이 안 되는 사업을 무슨 근거로 하냐고 투제 제한을 요구할 가능성이 높다”면서 “인수합병이나 미래먹거리를 위해 보유하고 있는 현금도 배당으로 내놓으라는 일이 많아질 것”이라고 한숨을 쉬었다.반대로 시민단체들도 3%룰이 본래 취지에서 벗어났다며 불만을 드러내고 있다. 재계의 반대로 법안이 후퇴하면서 경영권 감시라는 개정안 본래의 목적을 달성할 수 없게 됐다는 것이다.경제개혁연대는 성명을 내고 “3%룰 완화, 다중대표소송제 요건 강화 등이 급작스럽게 변경·후퇴해 확정되는 등 혼란을 초래했다”면서 “경제개혁입법 완성 기회를 제대로 살리지 못했다”고 지적했다.더불어민주당에서도 ‘공정경제 3법’을 두고 당초 입법 취지에서 크게 후퇴했다는 비판이 나오고 있다.이재명 경기지사는 이날 페이스북을 통해 “경제의 공정성과 민주성을 높이기 위한 (공정경제 3법의) 취지가 다소 무색해진 후퇴”라고 비판했다.그는 “사외이사 감사위원 분리 선출제도가 대주주·특수관계인 ‘합산’이 아닌 ‘개별’ 3%로 완화돼 대주주의 영향력 차단이 어려워졌다”고 했다.민주당 소속 한 정무위원은 국민일보와의 통화에서 “충분히 논의해야 할 법안을 지나치게 빨리 통과시킨 측면이 있다. 수정해야 할 부분은 수정해야 한다”고 했다. 김준엽 박재현 기자 snoopy@kmib.co.kr▶ 네이버에서 국민일보를 구독하세요(클릭)▶ 국민일보 홈페이지 바로가기GoodNews paper ⓒ 국민일보(www.kmib.co.kr), 무단전재 및 재배포금지국민일보 관련뉴스해당 언론사에서 선정하며 언론사 페이지(아웃링크)로 이동해 볼 수 있습니다.[포착] 국회에 등장한 상복…\'민주주의는 죽었다\'라면 안끓였다…\'인천 라면형제\' 경찰이 밝힌 실제 화재 원인어깨 환자인데…\'9cm 장침\'으로 폐 뚫은 한의사""내가 해결한다""…친구 복수한다고 사람 죽인 20대 중형\'옥중 극단선택\' 억만장자, 100여명 성범죄 배상액 325억좋아요0훈훈해요0슬퍼요0화나요0후속기사 원해요0기사제공 :']"
7,삼성전자, 2020-12-1015:56,뉴스1 ,"[시황종합]'네 마녀의 날' 코스피, 소폭 하락 2740선…코스닥 0.8%↑",https://finance.naver.com/news/news_read.nhn?article_id=0005043632&office_id=421&mode=search&query=삼성전자&page=5,"['       [시황종합]\'네 마녀의 날\' 코스피, 소폭 하락 2740선…코스닥 0.8%↑      기사입력2020-12-10 15:56기사원문좋아요훈훈해요좋아요 평가하기공감좋아요0훈훈해요0슬퍼요0화나요0후속기사 원해요0댓글선물·옵션 동시 만기일, 변동성↑…외국인 매도세에 하락 셀트리온 3형제 ↑…SK하이닉스·LG화학·삼전 ↓(자료사진) © News1 임세영 기자(서울=뉴스1) 권혜정 기자 = \'네 마녀의 날(선물·옵션 동시 만기일)\'인 10일 코스피 지수가 등락을 거듭하다 결국 소폭 하락해 2740선으로 마감했다. 이날 하락 출발한 코스피 지수는 장중 한때 1% 넘게 오르기도 했으나 장 막판 변동성을 키우며 하락 마감했다. 코스피 지수는 전일 대비 9.01p(0.33%) 내린 2746.46에 거래를 마쳤다. 전날 2755.47로 마감하며 사상 최고치를 기록한 코스피 지수는 장중 한때 1% 넘게 오르며 2760선까지 올랐으나 외국인의 매도세에 하락 전환했다. \'네 마녀의 날\'엔 주가지수 선물과 옵션, 개별 주식 선물과 옵션 등 네 가지 파생상품 만기일이 겹쳐 변동성이 높아진다. 장 막판 주가가 요동칠 때가 많아 \'마녀가 심술을 부린다\'고도 한다.개인과 기관이 각각 8913억원, 4426억원을 순매수했고 외국인은 홀로 1조3612억원을 순매도했다. 시가총액 상위 10위 종목은 셀트리온(1.84%), 삼성전자우(1.35%), 현대차(보합)을 제외하고 하락했다. SK하이닉스(-3.32%), LG화학(-2.27%), 삼성전자(-1.35%), 카카오(-1.20%), 삼성SDI(-1.06%) 순으로 하락폭이 컸다.코스닥 지수는 전일 대비 7.89p(0.86%) 오른 921.70에 거래를 마쳤다. 개인이 1468억원을 순매수한 가운데 외국인과 기관은 각각 60억원, 709억원을 순매도했다. 시가총액 상위 10위 종목은 대부분 올랐다. 카카오게임즈(-3.37%)과 에이치엘비(보합)를 제외하고 셀트리온제약(7.53%), 제넥신(6.95%), 셀트리온헬스케어(4.60%), 펄어비스(1.99%), 케이엠더블유(1.56%) 등이 떨어졌다.  업종별로는 전기유틸리티(5.73%), 무역회사와판매업체(4.52%), 해운사(4.44%), 건설(3.77%), 디스플레이패널(3.40%) 순으로 오름폭이 컸다. 간밤 뉴욕 증시는 일제히 하락했다. 추가 부양안 협상 난항 소식에 반독점 소송 우려까지 겹쳐 대형 기술주가 급락했다. 다우지수는 전장 대비 105.07포인트(0.35%) 내린 3만68.81를 기록했다. 스탠다드앤푸어스(S&P)500 지수는 29.43포인트(0.79%) 밀린 3672.82, 나스닥 지수는 243.82포인트(1.94%) 떨어진 1만2338.95를 나타냈다.서울외환시장에서 원/달러 환율은 전일 대비 2.9원 오른 1087.7원으로 마감했다.jung9079@news1.kr▶ 네이버 메인에서 [뉴스1] 구독하기!▶  뉴스1 바로가기 ▶  코로나19 뉴스 © 뉴스1코리아(news1.kr), 무단 전재 및 재배포 금지뉴스1 관련뉴스해당 언론사에서 선정하며 언론사 페이지(아웃링크)로 이동해 볼 수 있습니다.가세연 ""송강호 만취행패…이병헌 피하자 전도연에 술잔 던져""""승리 집에서 성매매 했다""…법정서 여성들 증언 잇따라송소희 ""스무살때 필름 끊길 때까지 술마셔""화이자 백신 맞아보니…""몸이 부들부들 떨려 치아 부러졌다""김혜선, 세번째 이혼설…""사업가 남편과 파경""좋아요0훈훈해요0슬퍼요0화나요0후속기사 원해요0기사제공 :']"
8,삼성전자, 2020-12-1015:53,연합뉴스 ,마이크로 LED의 세계,https://finance.naver.com/news/news_read.nhn?article_id=0012073248&office_id=001&mode=search&query=삼성전자&page=5,"['       마이크로 LED의 세계      기사입력2020-12-10 15:53기사원문좋아요훈훈해요좋아요 평가하기공감좋아요0훈훈해요0슬퍼요0화나요0후속기사 원해요0댓글    (서울=연합뉴스) 진연수 기자 = 10일 오후 서울 강남구 삼성디지털프라자 강남본점에서 \'마이크로 LED TV\' 신제품이 공개되고 있다. 이날 삼성전자가 공개한 차세대 디스플레이 기술인 마이크로 발광다이오드(LED) TV 110형 신제품은 4K급 해상도를 구현하는 가정용 신제품으로 출고가는 1억 7천만 원이다. 2020.12.10    jin90@yna.co.kr▶네이버에서도 뉴스는 연합뉴스[구독 클릭]▶[팩트체크]코로나 백신 \'부작용 면책\'은 국제공통?▶제보하기<저작권자(c) 연합뉴스(https://www.yna.co.kr/), 무단 전재-재배포 금지>연합뉴스 관련뉴스해당 언론사에서 선정하며 언론사 페이지(아웃링크)로 이동해 볼 수 있습니다.\xa0뾰루지 짰다가 얼굴에 온통 혹으로 뒤덮여\xa0힙합가수 아이언, 야구방망이로 룸메이트 폭행\xa0대도시 식당 쥐들의 습격으로 문닫아…직원 물리고 전기끊겨\xa0수족관서 사라진 물범, 6개월만에 돌아와…사연은\xa0\'날아라 개천용\' 배성우 음주운전 적발…""깊이 반성""좋아요0훈훈해요0슬퍼요0화나요0후속기사 원해요0기사제공 :']"
