,회사명,날짜,언론사,기사제목,링크,본문
6,삼성전자, 2020-10-1516:05,한국경제 ,"CS ""삼성전자·현대차·기아차·KB금융·포스코 유망 종목""",https://finance.naver.com/news/news_read.nhn?article_id=0004432309&office_id=015&mode=search&query=삼성전자&page=3,"['       CS ""삼성전자·현대차·기아차·KB금융·포스코 유망 종목""      기사입력2020-10-15 16:05기사원문좋아요훈훈해요좋아요 평가하기공감좋아요0훈훈해요0슬퍼요0화나요0후속기사 원해요0댓글 스위스 투자은행 크레디트스위스(CS)가 아시아 최선호 투자국으로 대한민국을 꼽으며 삼성전자, 현대자동차, 기아자동차, KB금융, 포스코를 유망 종목으로 제시했다.15일 크레디트스위스는 ‘아시아 투자전략’ 보고서에서 한국이 올해와 내년에 걸쳐 아시아 지역에서 실적 회복폭이 가장 클 것이라며 한국의 정보기술(IT), 자동차, 은행 업종이 유망하다고 짚었다. 댄 파인만 크레디트스위스 아시아태평양지역 주식전략 대표는 “D램 평균판매가격(ASP)이 내년 1분기에 바닥을 찍고 점차 상승하면서 수익성이 구조적으로 개선될 것”이라고 전망했다.그는 삼성전자를 아시아태평양 지역 기술주 중 최선호주로 선정했다. 이어 “자동차는 전세계적으로 소비 지표가 회복되면서 수혜가 예상되지만 은행업종은 경기둔화에 따라 영업이익 감소, 대손비용 증가 우려로 주가가 지나치게 할인된 가격에 거래중”이라고 판단했다.바이든이 대선에서 승기를 잡으면 한국이 아시아에서 가장 큰 수혜자 중 하나가 될 수 있다고도 분석했다. 파인만 대표는 “한국은 중국과 홍콩 다음으로 무역전쟁에 민감한 시장”이라며 “바이든은 중국에 대해 관세철회까지는 아니어도 중국과 상호 양보를 추구하는 등 세계무역기구(WTO) 시스템을 따를 것”이라고 봤다.한경제 기자 hankyung@hankyung.com▶ 애플·테슬라 지금 사도 될까? 궁금하면 \'해주라\'▶ 네이버에서 한국경제 뉴스를 받아보세요▶ 모바일한경 구독신청 ⓒ 한국경제 & hankyung.com, 무단전재 및 재배포 금지한국경제 관련뉴스해당 언론사에서 선정하며 언론사 페이지(아웃링크)로 이동해 볼 수 있습니다.[속보] 또 터졌다…비상 걸린 쿠팡 ""캠프 폐쇄""아반떼 ""나 떨고 있니""…2000만원대 \'제타\' 출격""술 파는 게 뭐가 문제냐"" 구청 유리 깬 노점상인들""100억원 벌어들인 \'펭수\'를 뺏겼습니다""아직도 안샀어?…""테슬라 시총 5배로 뛸 것""좋아요0훈훈해요0슬퍼요0화나요0후속기사 원해요0기사제공 :']"
7,삼성전자, 2020-10-1516:05,이데일리 ,[코스피 마감]3일째 하락해 '2360선'…빅히트는 호된 신고식,https://finance.naver.com/news/news_read.nhn?article_id=0004760311&office_id=018&mode=search&query=삼성전자&page=3,"['       [코스피 마감]3일째 하락해 \'2360선\'…빅히트는 호된 신고식      기사입력2020-10-15 16:05기사원문좋아요훈훈해요좋아요 평가하기공감좋아요0훈훈해요0슬퍼요0화나요0후속기사 원해요0댓글개인 이틀째 \'사자\'시가총액 상위종목은 내림세[이데일리 유현욱 기자] 15일 코스피 지수는 종일 약세를 보이며 하락했다. 전날 속절없이 2400선에서 밀린 데 이어 이날은 장중 한때 2350선까지 추락하기도 했다. 하락장 속 개인이 이틀 연속 ‘줍줍(줍고 줍는다를 줄인 말로 싼값에 알짜배기를 사들였다는 의미로 확장했다)’에 나서고 있다. ‘따상(시초가가 공모가의 2배로 결정된 후 상한가)’으로 출발했던 빅히트는 내리막을 타더니 결국 4.44% 하락 마감하며 호된 신고식을 치렀다.마켓포인트에 따르면 코스피는 전거래일보다 19.27포인트(0.81%) 내린 2361.21로 정규 장을 닫았다. 이날 지수는 전날보다 4.57포인트(0.19%) 하락한 2375.91에 장을 열었으나 낙폭을 키웠다. 이로써 코스피는 3거래일 연속 하락장을 연출했다.투자자별로 보면 개인(3325억원)이 나홀로 ‘사자’에 나선 형국이었다. 외국인(-210억원)과 기관(-1172억원)은 각각 ‘팔자’였다. 기관 중에는 금융투자(-367억원) 연기금 등(-257억원)이 많은 물량을 밀어냈다. 프로그램은 차익(47억원)과 비차익(-216억원) 등 전체적으로 -168억원 매도 우위였다.업종별로 보면 철강및금속 운수창고 전기가스업 의료정밀 건설업 종이목재 등이 1% 이상 통신업 화학이 1% 미만 상승했다. 서비스업은 2%대 의약품 섬유의복 비금속광물 전기전자 보험 기계는 1%대 상승했다. 유통업 제조업 금융업 증권 운수장비 음식료품 은행도 0%~1% 사이 올랐다.시가총액 규모가 작은 소형주(-1.49%)가 죽을 쑨 가운데 하락률은 대형주(-0.78%) 중형주(-0.73%) 순이었다.시가총액 상위 10종목은 대부분 하락했다. LG화학(051910)이 1.43% SK하이닉스가 0.69% LG생활건강(051900) 1.49% 상승했다. 삼성전자(005930)(-1.48%) 네이버(035420)(-2.01%) 삼성바이오로직스(207940)(-0.42%) 현대차(-1.12%) 셀트리온(068270)(-2.67%) 카카오(035720)(-1.76%) 삼성SDI(-2.17%) 등은 하락했다.유가증권 시장 상장 첫날인 빅히트는 시초가인 27만원보다 1만2000원(-4.44%) 내린 25만8000원을 기록했다. 이날 가격제한폭(30%)까지 오른 35만1000원에 거래를 시작했으나 5분을 버티지 못했다. 빅히트 주식을 대량으로 보유하고 있는 넷마블도 -9.87%나 하락했다.한편 이날 거래량은 11억4826만주, 거래대금은 12조7599억원으로 집계됐다. 상한가 5개 종목을 포함해 274개 종목이 올랐고 하한가 없이 583개 종목이 내렸다. 48개 종목은 보합권에 머물렀다.유현욱 (fourleaf@edaily.co.kr)▶ #24시간 빠른 #미리보는 뉴스 #eNews+▶ 네이버에서 \'이데일리 뉴스\'를 만나보세요▶ 빡침해소, 청춘뉘우스 \'스냅타임\'＜ⓒ종합 경제정보 미디어 이데일리 - 무단전재 & 재배포 금지＞이데일리 관련뉴스해당 언론사에서 선정하며 언론사 페이지(아웃링크)로 이동해 볼 수 있습니다.[단독] 손예진, \'160억\' 신사동 빌딩 건물주 됐다정은주, 불법 퇴폐업소 출입? 오해다..소방본부 \'감찰 착수\'임지안 \'목포 살인 피해자\' 동생 언급 ""몇 년간 노래 못해""진중권 ""약 드셨나, 삼국지 만화로 읽었나"" 맹비난욕심이 과했나…빅히트 \'따상\'은 커녕 하락 전환좋아요0훈훈해요0슬퍼요0화나요0후속기사 원해요0기사제공 :']"
8,삼성전자, 2020-10-1516:04,머니S ,"[마감] 코스피, 외인 기관 동반 매도에 힘없이 하락… 2360선 '털썩'",https://finance.naver.com/news/news_read.nhn?article_id=0000605528&office_id=417&mode=search&query=삼성전자&page=3,"['       [마감] 코스피, 외인 기관 동반 매도에 힘없이 하락… 2360선 \'털썩\'      기사입력2020-10-15 16:04기사원문좋아요훈훈해요좋아요 평가하기공감좋아요0훈훈해요0슬퍼요0화나요0후속기사 원해요0댓글사진=뉴시스코스피가 미국의 추가 부양책 지연 소식 등으로 외국인과 기관이 매도세를 보며 0.8% 하락해 2360선으로 내려왔다.15일 코스피 지수는 전 거래일보다 19.27포인트(0.81%) 하락한 2361.21에 마감했다. 개인은 3325억원을 순매수했고 외국인과 기관이 각각 210억원, 1172억원을 순매도했다.코스피 시가총액 상위 종목은 대부분 하락했다. SK하이닉스(0.69%), LG화학(1.43%)은 상승했다. 삼성전자(-1.48%), 네이버(-2.01%), 삼성바이오로직스(-0.42%), 삼성전자우(-0.75%), 현대차(-1.12%), 셀트리온(-2.67%), 카카오(-1.76%), 삼성SDI(-2.17%)는 하락 마감했다.이날 상장한 방탄소년단(BTS) 소속사인 빅히트엔터테인먼트는 상장 직후 \'따상\'(공모가 2배에서 시초가가 형성된 후 상한가 직행)으로 거래를 시작했지만 하락세로 돌아서 시초가 대비 4.44%(1만2000원) 하락한 25만8000원에 거래를 마감했다.코스닥 지수는 전 거래일보다 17.04포인트(1.98%) 하락한 844.44에 장을 마감했다. 개인이 2587억원을 순매수했고 외국인과 기관은 각각 211억원, 2202억원을 순매도했다.코스닥 시총 상위 종목은 펄어비스(0.10%)를 제외하고 하락했다. 셀트리온헬스케어(-0.90%), 씨젠(-0.38%), 알테오젠(-5.29%), 에이치엘비(-3.74%), 셀트리온제약(-3.03%), 카카오게임즈(-4.04%), 제넥신(-6.01%), CJENM(-3.72%), 케이엠더블유(-4.03%)는 하락했다.서상영 키움증권 연구원은 ""한국 증시는 미국의 추가 부양책 지연 및 미국의 대 중국 기업 규제 소식, 유럽의 봉쇄 정책 확대 등은 투자 심리 위축을 불러와 낙폭이 확대됐다""며 ""그동안 상승폭이 컸던 일부 제약, 바이오 및 온라인 기반 기업들의 부진이 높았다""고 말했다.윤경진 기자 youn1@mt.co.kr▶고수들의 재테크 비법 영상 ▶거품 뺀 솔직 시승기 ▶머니S기사, 네이버 메인에서 보세요<저작권자 ⓒ \'성공을 꿈꾸는 사람들의 경제 뉴스\' 머니S, 무단전재 및 재배포 금지>머니S 관련뉴스해당 언론사에서 선정하며 언론사 페이지(아웃링크)로 이동해 볼 수 있습니다.""네 남편과 난 뜨겁다"" 폭로하려다 참변""12일만에 이혼"" 파멜라 앤더슨, 성폭행도?""걸그룹 시켜줄게""… 10대 3명과 성관계 후 촬영까지로꼬, 전소미 차 \'람보르기니\' 구매… 가격이 후덜덜손예진 160억 건물주 됐다… 신사동 빌딩 어디?좋아요0훈훈해요0슬퍼요0화나요0후속기사 원해요0기사제공 :']"
9,삼성전자, 2020-10-1516:02,조선비즈 ,롤러코스터 빅히트... 방시혁 지분가치 하루 새 1조2000억원 변동,https://finance.naver.com/news/news_read.nhn?article_id=0000603936&office_id=366&mode=search&query=삼성전자&page=3,"['       롤러코스터 빅히트... 방시혁 지분가치 하루 새 1조2000억원 변동      기사입력2020-10-15 16:02기사원문좋아요훈훈해요좋아요 평가하기공감좋아요0훈훈해요0슬퍼요0화나요0후속기사 원해요0댓글정의선 현대차 회장 제치고 국내주식부자 8위 방탄소년단(BTS) 소속사 빅히트의 주가가 15일 유가증권시장 상장 첫날 급등락하면서 최대주주인 방시혁 빅히트 의장의 지분가치도 ‘롤러코스터’를 탔다. 방 의장의 빅히트 지분가치는 하루에만 1조1500억가량이 변동됐다. 그럼에도 방 의장은 정의선 현대차 회장을 제치고 국내 주식부자 8위에 이름을 올렸다. 이날 빅히트는 시초가(27만원) 대비 4.44%(1만2000원) 내린 25만8000원에 거래를 마쳤다. 공모가인 13만5000원보다는 10만3000원 오른 가격이지만 장 초반 기록한 상한가보다는 30% 가까이 낮은 가격이다. 앞서 빅히트는 오전 9시 유가증권시장에 상장하자 마자 시초가가 27만원으로 정해진 다음 상승제한폭(30.00%)까지 치솟으면서 35만1000원으로 ‘따상(공모가의 2배로 시초가가 형성된 뒤 상한가 기록)’에 성공했다. 그러나 곧 매도 물량이 나오면서 오전 11시쯤에는 29만원대로 떨어졌다.  그룹 방탄소년단(BTS)의 소속사 빅히트엔터테인먼트가 유가증권시장에 상장한 첫날인 15일 서울 여의도 한국거래소에서 열린 상장기념식에서 방시혁 빅히트엔터테인먼트 의장이 기념사 하고 있다. /연합뉴스빅히트 주가는 오후 들어 시초가 대비 하락 전환하며 장중에는 25만3500원까지 떨어지기도 했다. 빅히트는 하락 폭을 좁히거나 상승 전환하지 못하고 그대로 하락 마감했다. 빅히트 주가가 급등락하면서 빅히트 지분 34.74%(1237만7337주)를 보유하고 있는 방 의장의 지분 가치는 이날 종가 기준으로 3조1933억원이 됐다. 장 초반 상한가를 기록했을 때는 4조3444억원에 달했는데, 약 1조1511억원이 증발한 것이다. 방 의장의 주식 가치는 국내 연예계 최고 수준이다. 빅히트 상장으로 방 의장은 이건희 삼성 회장, 이재용 삼성전자(005930)부회장, 서정진 셀트리온(068270)회장, 김범수 카카오(035720)의장, 정몽구 현대차그룹 명예회장, 홍라의 전 삼성미술관 리움 관장, 서경배 아모레퍼시픽그룹 회장 다음가는 주식 부자 명단에 올랐다.정 명예회장은 올해 6월 말 기준으로 현대차(005380)1139만5859주, 현대모비스(012330)677만8966주, 현대제철(004020)1576만1674주, 현대글로비스(086280)251만7701주를 갖고 있는데 이날 종가 기준으로 이들 주식의 가치는 총 4조5153억8775만원이다. 삼성전자 주식 5415만3600주를 가진 홍라희 전 관장의 주식 가치는 3조2492억1600만원, 아모레G(002790)4444만3620주, 아모레퍼시픽(090430)주식 626만4450주, 아모레G우(002795)375만5121주를 가진 서경배 회장의 주식 가치는 총 3조2439억6120만원 수준이다.빅히트의 상장으로 방탄소년단 멤버 7명도 나란히 돈방석에 앉았다. 앞서 방 의장은 빅히트 상장에 앞서 지난달 3일 방탄소년단 멤버 각자에게 보통주 47만8695주를 인당 6만8385주씩 균등하게 증여했다. 현 주가 기준 멤버 각자의 빅히트 주식 가치는 약 176억4300만원에 달한다.[이다비 기자 dabee@chosunbiz.com] ▶네이버에서 조선비즈를 구독 하세요 ▶\'명품 경제뉴스\' 조선비즈 바로 가기 ▶올해 \'이 기업들\' 투자 안하면 영영 기회 없다 저작권자 ⓒ 조선비즈, 무단 전재 및 재배포 금지 조선비즈 관련뉴스해당 언론사에서 선정하며 언론사 페이지(아웃링크)로 이동해 볼 수 있습니다.\'재테크 고수\' 영화배우 손예진, 120억 대출, 왜?""2000만원대 수입 세단 타세요""… 폴크스바겐의 파격임영웅 신곡과 함께 공개된다는 SUV, 대체 어떻길래…\'진짜 5G\'는 못한다고요? 부끄러운 \'세계 최초\' 타이틀그 어렵다는 QLED \'마지막 퍼즐\'… 삼성전자가 맞췄다좋아요0훈훈해요0슬퍼요0화나요0후속기사 원해요0기사제공 :']"
10,삼성전자, 2020-10-1516:00,아시아경제 ,"코스피, 외국인·기관 동반 매도에 2360선 턱걸이",https://finance.naver.com/news/news_read.nhn?article_id=0004773105&office_id=277&mode=search&query=삼성전자&page=3,"['       코스피, 외국인·기관 동반 매도에 2360선 턱걸이      기사입력2020-10-15 16:00기사원문좋아요훈훈해요좋아요 평가하기공감좋아요0훈훈해요0슬퍼요0화나요0후속기사 원해요0댓글빅히트 4.44% 하락마감[아시아경제 이민지 기자] 외국인과 기관의 동반 매도세에 코스피와 코스닥지수가 하락 마감했다.15일 코스피는 전 장보다 0.81%(19.27포인트) 내린 2361.21로 장을 끝냈다. 이날 코스피는 전 장보다 0.19%(4.57포인트) 내린 2375.91로 출발해 낙폭을 키웠다. 투자주체별로 보면 개인은 3324억원어치 주식을 샀고, 외국인과 기관은 각각 209억원, 1172억원어치 주식을 팔았다.[이미지출처=연합뉴스]시가총액 상위종목을 보면 삼성전자는 전 장보다 1.48% 내린 6만원으로 장을 마감했다. 네이버(-2.01%), 삼성바이오로직스(-0.42%), 현대차(-1.12%), 셀트리온(-2.67%)도 하락했다. 빅히트는 4.44% 하락 마감했다. 반면 SK하이닉스는 전 장보다 0.69% 올랐고, LG화학도 1.43% 상승했다.이날 코스닥지수는 전 장보다 1.98%(17.04포인트) 내린 844.44로 장을 끝마쳤다. 코스닥지수는 이날 전 장보다 0.01%(0.11포인트) 하락한 861.37로 출발해 장중 3% 넘게 떨어지기도 했다. 투자주체별로 보면 개인이 2586억원어치 주식을 샀고 외국인과 기관은 각각 211억원, 2202억원어치 주식을 팔았다.이날 코스닥지수 상위종목들은 대부분 하락했다. 셀트리온헬스케어(-0.90%), 씨젠(-0.38%), 알테오젠(-5.29%), 에이치엘비(-3.74%), 셀트리온제약(-3.03%)도 내렸다.이경민 대신증권 연구원은 “코로나19 이슈들이 차익실현을 자극한 가운데 미국과 유럽 중심으로 코로나19 재확산세가 보이면서 투자심리를 위축시켰다”며 “코스닥시장에선 JYP엔터테인먼트(-7.23%), 와이지엔터테인먼트(-9.66%)가 하락하는 등 엔터테인먼트 관련주들이 약세를 보였다”고 분석했다.이어 이 연구원은 “당분간 코스피를 비롯한 글로벌 증시의 매물 소화 과정은 계속 이어질 것”이라며 “코스피의 적절 밸류이션은 2200선 이하로 아직은 경계 심리를 유지해야 할 것”이라고 말했다.이민지 기자 ming@asiae.co.kr▶ 2020년 하반기, 재물운·연애운·건강운 체크!▶ 네이버에서 아시아경제 뉴스를 받아보세요▶ 요즘 트렌드 모아보고 싶을 땐 \'드링킷\'<ⓒ경제를 보는 눈, 세계를 보는 창 아시아경제 무단전재 배포금지>아시아경제 관련뉴스해당 언론사에서 선정하며 언론사 페이지(아웃링크)로 이동해 볼 수 있습니다.""7년간 성폭행한 선배는 대학에…아들 인생 쑥대밭""집안 곳곳 카메라…자매 샤워장면 지켜본 새아버지""文, 대통령되면 나라 위태롭다"" 2년전 했던 말이…美·日서는 돈 되는 사업이 한국에선…""쓰레기 취급""""오렌지주스 가득이요"" 이상준, 소개팅녀 호감 \'한도초과\'좋아요0훈훈해요0슬퍼요0화나요0후속기사 원해요0기사제공 :']"
11,삼성전자, 2020-10-1515:59,조세일보 ,"삼성전자, 시각장애인 TV 접근성 기능 강화 위한 MOU",https://finance.naver.com/news/news_read.nhn?article_id=0002232423&office_id=123&mode=search&query=삼성전자&page=3,"[""       삼성전자, 시각장애인 TV 접근성 기능 강화 위한 MOU      기사입력2020-10-15 15:59기사원문좋아요훈훈해요좋아요 평가하기공감좋아요0훈훈해요0슬퍼요0화나요0후속기사 원해요0댓글◆…사진제공:삼성전자삼성전자가 지난 12일 한국시각장애인연합회와 TV 접근성 기능 향상을 위한 업무협약을 체결했다고 15일 밝혔다.세계 흰지팡이의 날(10월 15일)을 기념한 것으로 1980년에 세계시각장애인연합회(World Blind Union)가 시각장애인들의 권리를 보호하고 사회적 관심을 이끌어내기 위해 제정한 것이다. 한국방송통신위원회의 2020년 시청각 장애인용 TV 보급 사업 공급자로 선정된 삼성전자는, 영국 왕립 시각장애인협회로부터 시각장애인 접근성 인증(RNIB)을 최초로 획득하는 등 TV의 접근성 기능을 강화해 왔다.이번 협약을 통해 양사는 삼성 TV의 접근성 기능 개발과 사용성 개선을 위해 협력하고 시각장애인의 다양한 의견을 청취해 반영할 계획이다.▶ 조세일보 홈페이지 / 정회원 가입▶ 조세일보 네이버 뉴스스탠드 구독(종합/경제)백성원(peacetech@joseilbo.com)저작권자 ⓒ 조세일보(http://www.joseilbo.com). 무단전재 및 재배포 금지조세일보 관련뉴스해당 언론사에서 선정하며 언론사 페이지(아웃링크)로 이동해 볼 수 있습니다.'세계 손씻기의 날' 코로나19 이기는 가장 쉬운 6단계는?거리두기 1단계의 역설…감염위험은 더 커졌다아동 성착취 '텔레그램 n번방'서 초등 교사 등 유료결제'코로나19' 신규확진 110명…국내 95명·해외 15명수도권 종사자 16만 명 선제적 전수검사…해뜨락 요양병원 52명 확진좋아요0훈훈해요0슬퍼요0화나요0후속기사 원해요0기사제공 :""]"
12,삼성전자, 2020-10-1515:58,뉴스1 ,[시황종합] 코스피 0.8% 하락 2360선…빅히트 첫날 4% 하락,https://finance.naver.com/news/news_read.nhn?article_id=0004929394&office_id=421&mode=search&query=삼성전자&page=3,"['       [시황종합] 코스피 0.8% 하락 2360선…빅히트 첫날 4% 하락      기사입력2020-10-15 15:58기사원문좋아요훈훈해요좋아요 평가하기공감좋아요0훈훈해요0슬퍼요0화나요0후속기사 원해요0댓글美 증시 약세·코로나19 급증…셀트리온·삼성SDI·네이버 ↓\'따상\' 찍고 내려온 빅히트, 4%대 하락…시초가 밑으로(자료사진) © News1 성동훈 기자(서울=뉴스1) 권혜정 기자 = 15일 코스피 지수가 0.8% 하락해 2360선으로 마감했다. 코스닥 지수도 2% 가까이 빠졌다. 이틀 연속 약세를 보인 뉴욕 증시와 부산 지역을 중심으로 급증한 신종 코로나바이러스 감염증(코로나19) 신규 확진자, 시간외 뉴욕 증시 선물 하락 등이 영향을 미친 것으로 풀이된다.이날 코스피 지수는 전일 대비 19.27p(0.81%) 내린 2361.21에 거래를 마쳤다. 개인이 3325억원을 순매수했고 외국인과 기관은 각각 210억원, 1172억원을 순매도했다. 시가총액 상위 10위 종목은 대부분 내렸다. LG화학(1.43%), SK하이닉스(0.69%)를 제외하고 셀트리온(-2.67%), 삼성SDI(-2.17%), 네이버(-2.01%), 카카오(-1.76%), 삼성전자(-1.48%) 등은 하락했다. 이날 코스피 시장에 상장한 빅히트엔터테인먼트(-4.44%)는 \'따상(공모가 2배에서 시초가 형성 후 상한가 직행)\'으로 거래를 시작했으나 곧바로 상한가에서 내려앉아 시초가 밑으로 거래를 마쳤다. 종가 기준 시총 순위는 32위(우선주 제외)다. 코스닥 지수는 전일 대비 17.04p(1.98%) 내린 844.44에 거래를 마쳤다. 개인이 2587억원을 순매수했고 외국인과 기관은 각각 211억원, 2202억원을 순매도했다. 시가총액 상위 10위 종목 중 펄어비스(0.10%)을 제외하고 모두 하락했다. 제넥신(-6.01%), 알테오젠(-5.29%), 카카오게임즈(-4.04%), 케이엠더블유(-4.03%), 에이치엘비(-3.74%) 순으로 하락폭이 컸다. 업종별로는 가스유틸리티(5.21%), 항공화물운송과물류(3.83%), 철강(2.46%), 판매업체(1.38%), 문구류(1.35%) 순으로 오름폭이 컸다. 간밤 뉴욕 증시는 이틀 연속 내렸다. 스티븐 므누신 재무장관이 다음달 3일 대통령 선거 이전에 추가 부양협상을 타결하기 힘들다고 인정하며 투자심리가 위축됐다.다우지수는 전장 대비 165.81포인트(0.58%) 내린 2만8514.00을 기록했다. 스탠다드앤푸어스(S&P)500 지수는 23.26포인트(0.66%) 밀린 3488.67, 나스닥 지수는 95.17포인트(0.80%) 하락한 1만1768.73으로 거래를 마쳤다. 서상영 키움증권 연구원은 ""미 증시는 대형 기술주가 투자의견 또는 목표주가 상향 조정에 힘입어 강세를 보이자 상승 출발했으나 일부 기업들의 실적 발표 후 매물이 출회했고 리처드 클라리다 연준 부의장이 경기 회복 지연을 언급하면서 상승이 제한됐다""며 ""코로나19 신규 확진자 수 증가와 추가 부양책에 대한 불확실성이 높아지자 매물 출회로 결국 하락전환했다""고 분석했다. 서울외환시장에서 원/달러 환율은 전일 대비 3.7원 내린 1143.2원으로 마감했다.jung9079@news1.kr▶ 네이버 메인에서 [뉴스1] 구독하기!▶  뉴스1 바로가기 ▶  코로나19 뉴스 © 뉴스1코리아(news1.kr), 무단 전재 및 재배포 금지뉴스1 관련뉴스해당 언론사에서 선정하며 언론사 페이지(아웃링크)로 이동해 볼 수 있습니다.손예진, 신사동 160억 건물주 됐다…현금 40억에 대출 120억조정래 ""진중권 사죄안하면 法에…유시민 \'이영훈\'엔 말렸다""양치승 ""내 인생 오점…죽이고 싶은놈 있다""윤혜진 ""17대1로 싸워 이긴 강남짱에 찜당해""진중권 ""민주당, 내 목줄 끊어 놓겠다는 협박""좋아요0훈훈해요0슬퍼요0화나요0후속기사 원해요0기사제공 :']"
