,회사명,날짜,언론사,기사제목,링크,본문
0,삼성전자, 2020-09-2420:49,부산일보 ,혈액 한 방울로 바이러스 감염 여부 즉석에서 알아낸다,https://finance.naver.com/news/news_read.nhn?article_id=0001031652&office_id=082&mode=search&query=삼성전자&page=1,"['       혈액 한 방울로 바이러스 감염 여부 즉석에서 알아낸다      기사입력2020-09-24 20:49기사원문좋아요훈훈해요좋아요 평가하기공감좋아요0훈훈해요0슬퍼요0화나요0후속기사 원해요0댓글UNIST 강주헌 교수팀, 인체 혈관 모방한 감염 조기·신속 진단기술 개발다양한 감염원 적용 가능·저렴한 현장 진단기술미세 유체 칩의 구조와 유체 관에 부착된 백혈구. (A) 개발된 미세 유체 칩(좌)과 유체 칩을 측면에서 본 구조(우). (B) 미세 유체 칩의 사진과 백혈구의 부착(rolling)현상을 관찰한 사진. 건강한 사람의 경우 부착된 백혈구 숫자가 적다. UNIST 제공미세 유체 칩의 원리. 감염된 사람은 백혈구 표면에 발현되는 특정 단백질의 양과 이 단백질을 발현하는 백혈구 숫자(비율) 자체가 증가한다. 혈관 내피에서는 백혈구가 부착 할 수 있는 단백질이 발현된다. 연구진은 혈관 내피 단백질을 미세 유체 칩에 코팅해 감염여부를 진단 할 수 있는 진단 장치를 개발했다. UNIST 제공 인체의 면역반응을 모방한 ‘인공 혈관 칩’에 혈액 한 방울을 떨어뜨려 바이러스나 세균 감염 여부를 즉석에서 진단하는 기술이 나왔다. 열과 같은 증상이 나타나기 전에 감염 여부를 알 수 있을 뿐만 아니라 복잡한 검사기가 필요 없어 현장에서 바로 쓸 수 있다.울산과학기술원(UNIST, 총장 이용훈)은 바이오메디컬공학과(BME)의 강주헌 교수팀이 병원균(세균, 바이러스 등) 감염 여부를 조기에 판별 할 수 있는 미세 유체 칩을 개발했다고 24일 밝혔다.머리카락 수준으로 가느다란 관으로 이뤄진 칩에 감염된 혈액(유체)을 넣으면 혈액 속 백혈구가 유체 관(인공 혈관) 벽면에 달라붙는다. 감염된 사람은 벽에 달라붙는 백혈구 숫자가 건강한 사람에 비해 눈에 띄게 많기 때문에 저배율의 광학현미경만으로 감염여부를 쉽게 판독 할 수 있다.검사에 소요되는 시간은 10분 내외로 짧다. 또 감염 극초기(감염된지 1시간)에도 감염여부를 알아 낼 수 있어 열과 같은 증상이 없는 잠복기 환자를 조기에 선별할 수 있다. 문진이나 체온 검진에 의존하고 있는 코로나 환자 선별방식을 획기적으로 바꿀 수 있을 것으로 기대된다.(우측부터) 강주헌 교수, 이민석 연구원, 권세용 연구조교수. UNIST 제공 연구팀은 면역세포(백혈구)가 감염이 발생된 부위로 이동하기 위해 혈관 내벽을 통과(혈관외유출)하는 과정에서 혈관 내벽에 붙는 현상을 모방했다. 개발한 칩의 유체 관 벽면에는 감염 시 혈관 내피세포가 발현하는 단백질이 코팅돼 있다. 이 단백질은 혈액 속을 떠다니는 백혈구를 붙잡는 역할을 한다.환자의 백혈구 표면에서도 혈관 내벽 단백질과 짝을 이루는 단백질 발현이 증가할 뿐만 아니라 이러한 백혈구의 비율이 높아진다. 이 때문에 환자의 혈액을 미세 유체 관에 흘렸을 경우, 유체 관 벽면에 달라붙는 백혈구 숫자가 건강한 사람에 비해 훨씬 많다.제1저자인 권세용 UNIST 바이오메디컬공학과 연구교수는 “감염시 혈관 내벽 세포의 특정 단백질의 발현량이 증가 한다는 사실은 익히 알려졌지만, 백혈구 표면의 단백질 발현량 증가와 그 단백질을 발현 하는 백혈구 비율의 증가는 이번 연구로 새롭게 밝혀진 사실”이라고 밝혔다.공동 1저자인 아만졸 커마쉐브 (Amanzhol Kurmashev) 연구원은 “면역반응은 원인균에 상관없이 동일하게 일어나기 때문에 모든 종류의 세균, 바이러스 감염여부 진단에 쓸 수 있고, 감염병 뿐만 아니라 암 조기 진단에도 응용 할 수 있다고” 설명했다.연구팀은 항생제 저항성 세균에 감염된 쥐로 개발된 미세 유체 칩의 성능을 테스트했다.감염된 쥐의 혈액 한 방울 (50마이크로 리터)을 미세유체 소자에 흘려주었을 때 감염되지 않는 쥐보다 더 많은 양의 백혈구가 유체 관 벽면에 붙어 있는 것을 확인할 수 있었다. 또 감염 된지 1시간 밖에 지나지 않은 초기에도 정상쥐와 비교해 더 많은 양의 백혈구가 붙어 있었다. 감염 환자 조기 선별이 가능한 대목이다.강주헌 교수는 “기존의 혈액배양이나 PCR검사 방법보다 더 빠른 시간 안에 진단 결과를 알 수 있고, 진단에 필요한 광학현미경도 이미지 확대에 필요한 배율이 낮아 스마트폰에 장착이 가능한 수준”이라며 “궁극적으로 5~10분 내에 감염여부를 진단하는 저렴한 휴대용 진단 시스템을 완성하는 것이 목표”라고 말했다.강 교수는 이어 “인체에도 동일한 면역 시스템이 있고, 인간의 백혈구는 실험에 사용된 쥐보다 수천 배 더 민감한 반응을 보이기 때문에 상용화 가능성이 높다”며 “병원과의 공동연구를 통해 환자를 선별하는 임상 연구를 계획 중”이라고 밝혔다.이번 연구 결과는 엘스비어(Elsevier) 출판사에서 발간하는 세계적인 학술지인 ‘Biosensors and Bioelectronics’에 8월 29일자로 온라인 공개돼 출판을 앞두고 있다. 이번 연구는 과학기술정보통신부, 삼성전자미래육성센터, 교육부 등의 지원을 받아 수행됐다. 논문명: An inflammatory vascular endothelium-mimicking microfluidic device to enable leukocyte rolling and adhesion for rapid infection diagnosis송현수 기자 songh@busan.com▶ 네이버에서 부산일보 구독하기 클릭!▶ \'터치 부산\' 앱 출시, 부산일보 지면을 내 손 안에!▶ 부산일보 홈 바로가기부산일보 관련뉴스해당 언론사에서 선정하며 언론사 페이지(아웃링크)로 이동해 볼 수 있습니다.[SNS:판] ""코로나 때문에 시댁 안 간다는 아내가 밉네요""[SNS:판] ""층간흡연, 윗집서 흉기 들고 찾아왔어요""…법적 책임은?펭수가 알려준 번호로 로또 샀더니…""번호 4개나 적중""[SNS:판] ""만지고 더듬고… 골프장서 성추행 당했어요""여성이 남성 혀 깨물어 절단… 정당방어일까?좋아요0훈훈해요0슬퍼요0화나요0후속기사 원해요0기사제공 :']"
1,삼성전자, 2020-09-2420:15,이데일리 ,언택트시대에 협업 강조한 삼성전자 CEO 3인방,https://finance.naver.com/news/news_read.nhn?article_id=0004745392&office_id=018&mode=search&query=삼성전자&page=1,"['       언택트시대에 협업 강조한 삼성전자 CEO 3인방      기사입력2020-09-24 20:15기사원문좋아요훈훈해요좋아요 평가하기공감좋아요0훈훈해요0슬퍼요0화나요0후속기사 원해요0댓글김기남. ·김현석. ·고동진 특별메시지통해 임직원 격려[이데일리 신민준 배진솔 기자] 삼성전자(005930) 최고경영자(CEO) 3명이 코로나19(신종 코로나바이러스 감염증) 경제 위기 극복을 위한 메시지를 통해 고군분투(孤軍奮鬪)하고 있는 임직원들을 격려했다. 이들은 언택트(비대면) 시대를 맞이해 협업 강화과 함께 위기 속에서 기회를 찾아달라고 당부했다.24일 전자업계에 따르면 김기남 삼성전자 부회장(DS부문장, 반도체)과 김현석 사장(CE부문장, TV·가전), 고동진 사장(IM부문장, 휴대폰·통신장비) 최고경영자 3명은 최근 사내 통신망을 통해 직원들에게 특별 메시지를 전달했다. 매년 상·하반기 직원들에게 경영 메시지를 전달했던 것에 비춰봤을 때 이례적이다. 코로나19와 더불어 미국과 중국의 무역 전쟁 심화 등으로 글로벌 경제 상황이 급격하게 변화하는 만큼 임직원들을 격려하는 차원으로 풀이된다. 김기남 부회장은 따듯한 조직 문화 조성을 당부했다. 그는 “경제성장이 둔화되고 바이러스가 우리 생활에 일부가 돼 모든 삶의 양식이 새롭게 변화하는 뉴노멀 시대”라며 “백신 완성은 아직 요원하고 생활 속에서 여러 제약으로 장기적 스트레스가 불가피한 상황”이라고 전했다. 그러면서 “임직원의 노력과 헌신으로 위기를 잘 헤쳐나가고 있다”며 “마음의 거리는 줄이도록 노력하면서 함께 케어(Care)하는 따뜻한 조직문화를 만들어 가자”고 밝혔다.김현석 사장은 근무 환경 변화에 따른 협업 시너지를 강조했다. 삼성전자는 TV, 가전, 휴대폰 부문 등에서 근무하는 직원들을 대상으로 9월 한 달간 시범적으로 재택근무를 시행 중이다. 그는 “앞으로 개인의 책임이 늘고 비대면 소통·협업과 업무 효율이 더 중요해질 것”이라며 “사내에 건설적·목표지향적 토론 문화를 정착해 비대면 협업 시너지가 새 문화로 정착되도록 노력하자”고 말했다. 고동진 사장은 개방과 협력 확대를 통한 시련 극복에 방점을 찍었다. 그는 “코로나19로 인해 온라인 중심 사업 모델 전환과 5G, 사물인터넷(IoT), 인공지능(AI), 모바일 혁신을 앞당겼다”며 “위기와 기회는 늘 공존하고 개방과 협력을 확대해 시련을 기회로 만들어야 한다”고 전했다.신민준 (adonis@edaily.co.kr)▶ #24시간 빠른 #미리보는 뉴스 #eNews+▶ 네이버에서 \'이데일리 뉴스\'를 만나보세요▶ 빡침해소, 청춘뉘우스 \'스냅타임\'＜ⓒ종합 경제정보 미디어 이데일리 - 무단전재 & 재배포 금지＞이데일리 관련뉴스해당 언론사에서 선정하며 언론사 페이지(아웃링크)로 이동해 볼 수 있습니다.文 \'종전선언\' 고민할 때, 北은 사살·훼손軍 ""실종 공무원, 월북 추정""…유족 ""근거 있나?""최수종, 미모의 딸과 \'찰칵\'…하희라 도플갱어 수준이낙연 ""\'드라이브 스루\' 집회? 국민 조롱하나"" 분노고대 교수들, 유흥업소서 수천만원 \'펑펑\'좋아요0훈훈해요0슬퍼요0화나요0후속기사 원해요0기사제공 :']"
2,삼성전자, 2020-09-2419:34,경향신문 ,"삼성전자-코로나19 병상 제공, 집중호우 성금 기탁…국가적 재난 위기 극복에 앞장",https://finance.naver.com/news/news_read.nhn?article_id=0003034280&office_id=032&mode=search&query=삼성전자&page=1,"['       삼성전자-코로나19 병상 제공, 집중호우 성금 기탁…국가적 재난 위기 극복에 앞장      기사입력2020-09-24 19:34기사원문좋아요훈훈해요좋아요 평가하기공감좋아요0훈훈해요0슬퍼요0화나요0후속기사 원해요0댓글 [경향신문] 삼성이 코로나19 재확산으로 인한 수도권 지역의 병상 부족 문제 해소를 위해 생활치료센터로 제공한 용인시 소재 삼성물산 국제경영연구소에서 의료진이 감염자 치료를 준비하고 있다(왼쪽 사진). 지난달 13일부터 19일까지 삼성전자를 비롯한 수해지역 인근에 있는 4개 삼성 관계사의 직원 450명이 현장을 찾아가 피해 주민들과 함께 수해 복구에 땀을 흘렸다.삼성이 집중호우·코로나19 등 국가적 재난 위기 상황 극복을 위해 앞장서서 지원하고 있다.삼성은 최근 코로나19 재확산으로 인한 수도권 지역의 병상 부족 문제를 해결하기 위해 사내 연수원 두 곳을 생활치료센터로 제공했다. 지난 7일에는 장기간 이어진 집중호우로 피해를 입은 지역의 복구를 돕기 위해 대한적십자사에 성금 30억원을 기탁했다.삼성은 성금 이외에도 △침수 전자제품 무상점검 특별 서비스 △이동식 세탁 차량 지원 △사랑의 밥차 지원 △카드이용금액 청구 유예 등 금융 지원 △수해지역 복구용 건설 중장비 지원 등을 병행 실시했다.봉사단체 관계자는 “코로나19 때문에 수해복구 지원이 더 힘든 상황이었는데, 기업의 도움이 현장에서 큰 힘이 됐다”고 말했다.지난달 13일부터 19일까지 삼성전자를 비롯한 수해지역 인근에 있는 4개 삼성 관계사의 직원 450명이 현장을 찾아가 피해 주민들과 함께 수해 복구에 땀을 흘렸다.삼성전자 임직원들은 철원 이길리를 찾아 세탁 지원과 농경지 정리 등의 봉사활동을 펼쳤고, 삼성디스플레이 임직원들은 아산사업장 인근 탕정면을 찾아 포도밭 피해 복구 지원을 했다.삼성중공업 임직원들도 특히 피해가 컸던 화개장터를 찾아 수해 복구를 도왔다. 삼성전자서비스 엔지니어들은 경남 합천군과 하동군, 전남 구례군과 곡성군 등을 찾아 침수 가전 세척과 수리를 하는 특별 서비스를 제공했다.경남 하동군 화개면 김명식씨(63)는 “예상치 못한 수해로 주민들이 정말 힘들어했는데 삼성전자서비스에서 찾아와 삼성 제품뿐만 아니라 AS를 받기 힘든 회사 제품들까지 점검해줘서 마을 주민들이 모두 감사하게 생각하고 있다”고 말했다.또 삼성전자는 피해 지역에 이동식 세탁·건조 차량인 ‘온정나눔 세탁소’ 13대를 운영했고 ‘사랑의 밥차’ 10대를 제공해 피해 주민들과 자원봉사자들에게 식사를 제공했다.삼성은 코로나19로 인한 고통을 분담하고 사태 극복을 위한 사회적 노력에 동참하기 위해 다양한 지원활동을 펼쳤다.이재용 삼성전자 부회장은 “국민의 성원으로 성장한 삼성은 지금과 같은 때에 마땅히 우리 사회와 같이 나누고 함께해야 한다. 이번 일로 고통 받거나 위기 극복에 헌신하시는 분들을 위해 미력하나마 모든 노력을 다하자”고 말했다.삼성은 코로나19 재확산 상황에서 수도권 지역 환자들을 위해 경기 고양시에 위치한 삼성화재 글로벌캠퍼스와 용인시에 위치한 삼성물산 국제경영연구소를 생활치료센터로 제공하고 삼성의료원 의료진도 파견했다. 앞서 삼성은 지난 3월에도 삼성인력개발원 영덕연수원을 생활치료센터로 제공했다.운영 첫날 210명의 환자를 받은 영덕 생활치료센터는 4월29일 마지막 환자가 퇴소하며 30일 종료했다. 영덕 생활치료센터에는 총 254명의 환자가 입소했고 완치 225명, 타 병원 등으로 이송된 환자가 29명으로 완치율 88.6%를 보였다.삼성은 지난 2월 의료용품, 취약계층을 위한 생필품 키트, 건강식품세트 등의 구호 물품과 구호 성금을 포함해 총 300억원을 전국재해구호협회에 기부했다.국내 경기 활성화를 위해서는 전통시장에서 사용 가능한 300억원 규모의 온누리상품권을 구입해 각 사업장 내 협력회사 등에 지급해 내수 진작으로 이어지도록 했다. 조업 중단·부품 조달 등 애로를 겪고 있는 협력회사를 지원하기 위해 2조6000억원의 자금을 지원한다고 밝힌 바 있다.올해 초 코로나19로 마스크 품귀현상이 발생하자 국내 마스크 공급 확대를 위해 긴급 지원에도 나섰다. 삼성은 해외에서 확보한 마스크 33만장을 기부했고, 마스크 필터용 부직포 구매 대행에도 나선 바 있다.추가로 마스크 업체를 대상으로는 스마트공장 구축을 통해 생산성 향상에 나섰다. 삼성전자는 현장에 평균 25년 경력의 생산설비 전문가들로 구성된 멘토단을 파견해 생산 공정 개선·효율화 기술지도 등을 지원했다.지원을 받은 E&W·레스텍·에버그린·화진산업 등 4개사 합계 일일 생산량이 기존 92만장에서 139만장으로 51% 증가한 바 있다.또 삼성전자는 코로나19 진단키트 생산업체인 솔젠트, 코젠바이오텍, SD바이오센서 등에 생산성 향상을 위해 지난 4월부터 스마트공장 구축을 지원했다.대전에 사업장이 있는 솔젠트의 경우 0생산공정 전반에 스마트 시스템을 적용해 생산성이 주당 1만1900키트에서 2만571키트로 73%가량 큰 폭으로 증가했다.삼성전자는 코로나19 사태로 어려움이 발생한 청소년 교육 현장에 도움이 되기 위해 ‘온택트(화상 대면)’ 방식으로 사회공헌활동을 이어나가고 있다.삼성전자는 지난 9월부터 화성·오산·평택 등 반도체 사업장 인근지역 청소년들을 위해 온라인으로 반도체과학교실을 운영해 나갈 계획이다.2013년에 시작한 삼성전자 반도체과학교실은 최근 오프라인 강의가 불가능해짐에 따라 임직원들이 온라인 강사가 돼 비대면 동영상 강의를 진행한다.또 지난 7월에 입과한 ‘삼성 청년 소프트웨어 아카데미’ 전국 500명의 교육생들은 입학식을 온라인으로 한 데 이어 교육도 온라인을 실시하며 수업을 이어나가고 있다.삼성전자는 CSR 비전 ‘함께 가요 미래로! Enabling People’ 아래 삼성 주니어·청년 소프트웨어 아카데미·삼성드림클래스·삼성스마트스쿨 등 청소년 교육 중심의 사회공헌 활동과 상생 활동을 펼치고 있다.▶ 장도리 | 그림마당 보기▶ 경향신문 바로가기▶ 경향신문 구독신청하기©경향신문(www.khan.co.kr), 무단전재 및 재배포 금지경향신문 관련뉴스해당 언론사에서 선정하며 언론사 페이지(아웃링크)로 이동해 볼 수 있습니다.일본 기업에 \'대법원장\' 언급한 김앤장 ""프로젝트 잘 알고 계시다""""내 나이 구십에 이렇게 지독한 놈은 처음이라오""\'부모 빚투 논란\' 마이크로닷, 연예계 복귀하나28시간 표류 후 발견, 6시간 방치 후 사살···6년 키우기도 힘든데 11년 된 인삼이 나타났다고?좋아요0훈훈해요0슬퍼요0화나요0후속기사 원해요0기사제공 :']"
3,삼성전자, 2020-09-2419:34,경향신문 ,이웃의 눈물을 말리는…‘함께’의 힘!,https://finance.naver.com/news/news_read.nhn?article_id=0003034279&office_id=032&mode=search&query=삼성전자&page=1,"['       이웃의 눈물을 말리는…‘함께’의 힘!      기사입력2020-09-24 19:34기사원문좋아요훈훈해요좋아요 평가하기공감좋아요0훈훈해요0슬퍼요0화나요0후속기사 원해요0댓글 [경향신문] “국민의 성원으로 성장한 삼성은 지금과 같은 때에 마땅히 우리 사회와 같이 나누고 함께해야 한다. 이번 일(수해와 코로나19)로 고통 받거나 위기 극복에 헌신하시는 분들을 위해 미력하나마 모든 노력을 다하자.”(이재용 삼성전자 부회장)“코로나19로 인한 어려움이 가중되는 것을 보면서 그동안 SK가 짜놓은 안전망이 더 이상 유효하지 않다는 것을 목격하고 있다. 잘 버텨보자는 식의 태도를 버리고 완전히 새로운 씨줄과 날줄로 안전망을 짜야 할 시간이다.”(최태원 SK회장)“고객도, 협력사도 우리의 동반자라는 인식을 갖고 함께 도전하고 성공을 나누는 ‘함께 멀리’의 가치를 지켜가자.”(김승연 한화그룹 회장)국가적 재난의 해다. 올 초부터 전국을 덮친 코로나19가 확산·재확산의 위기 상황이 반복되고 있고 지난 8월에는 ‘역대급’ 수해가 잇따랐다. 이런 국가적 재난이 한 해에 동시에 발생한 적은 극히 드물다. 코로나19는 아직도 국민을 공포 속에서 벗어나지 못하게 만들고 있다. 수해로 인한 피해자의 고통은 지금도 가슴속에 멍에처럼 굳어져 있다. 복구 작업은 지금도 진행 중이다. 국가·정부의 역할이 어느 때보다도 강조되는 시기다. 이에 못지않게 드러나지 않으면서도 큰 역할을 하고 있는 것이 바로 기업의 나눔 경영이다. 코로나19 발생 지역에는 마스크 제공과 방역활동으로, 수해 현장에는 기업 고유의 기술 등을 활용한 이재민 지원 활동으로 피해 당사자들과 아픔을 함께 나누고 있다. 삼성은 지난달 7일 장기간 이어진 집중호우로 피해를 입은 지역의 복구를 돕기 위해 대한적십자사에 성금 30억원을 기탁한 것과 함께 침수 전자제품 무상점검 특별 서비스, 이동식 세탁 차량 지원, 사랑의 밥차 지원사업을 함께했다. 봉사단체 관계자는 “코로나19 때문에 수해복구 지원이 더 힘든 상황이었는데 기업의 도움이 현장에서 큰 힘이 됐다”고 말했다. 삼성은 코로나19 재확산으로 경기 고양시 삼성화재 글로벌캠퍼스와 용인시 삼성물산 국제경영연구소를 수도권 지역 환자들을 위해 생활치료센터로 선뜻 제공하고 삼성의료원 의료진도 파견했다. 앞서 삼성은 3월에도 삼성인력개발원 영덕연수원을 생활치료센터로 제공한 바 있다. SK그룹도 전사적인 대응을 강화하고 있다. SK그룹은 지난달 9일 집중호우로 피해를 입은 주민들이 신속히 일상으로 복귀할 수 있도록 성금 20억원을 전국재해구호협회에 기탁한 데 이어 그룹사별로 제품과 서비스를 활용한 수해복구 지원활동에 나섰다. 한국수출입은행은 올 초부터 코로나19의 급격한 확산에 따라 국내외 취약 계층을 대상으로 긴급 지원을 하고 있다. 쪽방촌 주민을 위한 생필품·방역물품, 취약계층 아동을 위한 방역물품, 탈북청소년 온라인 수업용 노트북 등을 지원했다. 일부 기업은 추석을 앞두고 협력회사들을 위해 자금을 지원했다. 한화그룹 주요 제조·화학 계열사들은 해마다 추석 명절을 앞두고 협력사 물품 및 용역 대금을 현금으로 조기 지급하고 있다. 대금 조기 지급을 통해 협력사의 자금 운용 부담을 덜어주고 있는 것이다. 롯데는 추석 명절을 앞두고 파트너사들의 자금 운용에 도움을 주기 위해 납품대금 6000억원을 조기 지급하기로 하는 등 수해와 코로나19 등으로 자금 부족에 허덕이고 있는 중소 협력사들을 위해 나눔 경영을 실천하고 있다.최병태 기획위원 cbtae@kyunghyang.com▶ 장도리 | 그림마당 보기▶ 경향신문 바로가기▶ 경향신문 구독신청하기©경향신문(www.khan.co.kr), 무단전재 및 재배포 금지경향신문 관련뉴스해당 언론사에서 선정하며 언론사 페이지(아웃링크)로 이동해 볼 수 있습니다.일본 기업에 \'대법원장\' 언급한 김앤장 ""프로젝트 잘 알고 계시다""""내 나이 구십에 이렇게 지독한 놈은 처음이라오""\'부모 빚투 논란\' 마이크로닷, 연예계 복귀하나28시간 표류 후 발견, 6시간 방치 후 사살···6년 키우기도 힘든데 11년 된 인삼이 나타났다고?좋아요0훈훈해요0슬퍼요0화나요0후속기사 원해요0기사제공 :']"
