,회사명,날짜,언론사,기사제목,링크,본문
0,삼성전자, 2020-05-2522:48,중앙일보 ,이재용 집 앞에서 '삼겹살 폭식·음주가무 투쟁'···그들은 누구,https://finance.naver.com/news/news_read.nhn?article_id=0003003500&office_id=025&mode=search&query=삼성전자&page=1,"['       이재용 집 앞에서 \'삼겹살 폭식·음주가무 투쟁\'···그들은 누구      기사입력2020-05-25 22:48기사원문좋아요훈훈해요좋아요 평가하기공감좋아요0훈훈해요0슬퍼요0화나요0후속기사 원해요0댓글  삼성 해고노동자 고공농성 공동대책위원회가 지난 24일 서울 한남동 이재용 삼성전자 부회장 자택 앞에서 삼겹살을 구워 먹으며 \'음주가무\' 집회를 벌이고 있다. 공대위 유튜브 채널 \'연대TV\' 동영상 캡처           삼성 해고노동자들의 피해 보상 등을 요구하기 위해 조직된 시민단체가 이재용 삼성전자 부회장 집 앞에서 음주가무를 곁들인 \'삼겹살 폭식 투쟁\'을 벌여 논란이 일었다.       25일 삼성 해고노동자 고공농성 공동대책위원회(공대위)에 따르면 이 단체 소속 10여명은 지난 24일 오후 서울 용산구 한남동 이 부회장 자택 앞에서 집회를 열었다. 이달 초까지 삼성 서초사옥 인근에서 집회를 개최한 이들은 최근 이 부회장 자택 쪽으로 장소를 옮겨 삼성 해고자 복직·보상을 요구하고 있다.       이들은 전날 \'연대TV\'라는 유튜브 채널에 \'삼겹살 폭식 투쟁\'이라는 제목의 게시물도 올리며 이 부회장 집 앞에서 \'음주가무\' 집회를 벌였다고 소개했다. 영상 속 집회 참가자들은 이 부회장 집 앞에서 돗자리를 깔고 앉아 삼겹살을 구워 먹었다. 이들은 가스버너와 불판, 상추, 쌈장을 늘어놓고 식사를 했으며 소주와 맥주 등 주류도 눈에 띄었다.       삼성 해고노동자 고공농성 공동대책위원회가 지난 24일 서울 한남동 이재용 삼성전자 부회장 자택 앞에서 \'음주가무\' 집회를 벌였다고 소개하고 있는 유튜브 채널 \'연대TV\'의 동영상 속 장면. 유튜브 캡처           영상에는 주민 신고를 받고 출동한 공무원의 모습도 담겼다. 시위대는 공무원을 향해 ""우리는 신고 후 집회를 하고 있으니 걱정 안해도 된다""고 말했다. 이들은 지난 21일부터 한 달간 이 장소에서 집회를 하겠다고 경찰에 미리 신고한 것으로 알려졌다. 이들은 ""압수수색 영장을 보여달라""거나 ""우린 대학에서 학생들 가르치는 사람들이니까 (집회를) 무리하게 안 한다""고 맞받아치기도 했다.       공대위 대표인 임미리 고려대 교수는 인근 주민들이 피해를 입을 수 있다는 구청 관계자의 설명을 들은 뒤 ""항의하고 있는 것""이라며 ""피해 정도가 심하다면 저에게 개인적으로 소송을 걸라고 하라""고 말했다. 임 교수는 지난 23일 오후 이곳에서 1인용 텐트를 치고 야영농성에 돌입했다.       하지만 일각에서는 이같은 시위에 대한 비판이 나왔다. 시위·집회의 자유는 보장돼야 하지만 다른 이들의 권리를 침해하는 경우 적절한 규제도 필요하다는 의견이 제기됐다. 논란이 불거지자 동영상은 삭제됐다.       김지혜 기자 kim.jihye6@joongang.co.kr   ▶ 그래서, 팩트가 뭐야? 궁금하면 \'팩플\'▶ 세상 쉬운 내 돈 관리 \'그게머니\'▶ 중앙일보 홈페이지 바로가기ⓒ중앙일보(https://joongang.co.kr), 무단 전재 및 재배포 금지중앙일보 관련뉴스해당 언론사에서 선정하며 언론사 페이지(아웃링크)로 이동해 볼 수 있습니다.윤미향 나흘뒤 불체포특권···檢, 세갈래 수사 속도전與당선 51명과 만찬···재판 급한 이재명의 \'딴 걱정\'""눈가리고 와인테스트하듯···"" 렘데시비르 임상 그날비명에 ""폰 봐"" 웃으며 폭행, 전부 여중생이었다""10·26 전 3차례 암살 시도"" 김재규 그때 그 목소리좋아요0훈훈해요0슬퍼요0화나요0후속기사 원해요0기사제공 :']"
1,삼성전자, 2020-05-2522:47,한국일보 ,이재용 집앞에서 삼겹살 굽고 술 마신 시민단체,https://finance.naver.com/news/news_read.nhn?article_id=0000499559&office_id=469&mode=search&query=삼성전자&page=1,"['       이재용 집앞에서 삼겹살 굽고 술 마신 시민단체      기사입력2020-05-25 22:47기사원문좋아요훈훈해요좋아요 평가하기공감좋아요0훈훈해요0슬퍼요0화나요0후속기사 원해요0댓글지난 7일 오후 서울 서초동 삼성생명 사옥 앞에서 \'삼성해고노동자 고공농성 공대위\', \'보험사에 대응하는 암환우 모임\' 등이 기습 시위를 벌이고 있다. 배우한 기자삼성 해고노동자의 피해 보상 등을 요구하는 ‘삼성 해고노동자 고공농성 공동대책위원회(공대위)’와 이에 연대한 시민 모임이 이재용 삼성전자 부회장 자택 앞에서 삼겹살을 구워 먹고 음주를 하며 점거시위를 벌인 것으로 25일 알려졌다.이날 공대위가 유튜브 채널 ‘연대TV’에 공개한 영상에는 전날인 24일 서울 용산구 한남동 이 부회장 자택 앞에서 시위대가 장시간 머물면서 삼겹살을 굽고 술을 마시고 노래를 부르는 장면 등이 담겼다. 현재 이들 영상은 부정적인 덧글과 영상에 노출된 개인 신상 보호 등의 문제로 삭제된 상태다.영상 안에서 이들은 인근 주민 민원이 들어왔다며 현장을 방문한 공무원에게 “압수수색 영장을 보여달라”“피해 정도가 심하다고 하면 저에게 개인적으로 소송을 거시라고 하라”고 밝히기도 했다. 해당 집회는 사전 신고가 된 집회다.공대위는 지난해 6월부터 삼성 서초사옥 근처에 있는 강남역사거리 폐쇄회로(CC)TV 철탑에서 고공 농성 중인 해고노동자 김용희씨를 대리하기 위해 구성된 단체다. 이들은 이달 초까지 삼성전자 서초사옥 인근에서 집회를 개최해 오다 최근 이 부회장 자택 앞으로 장소를 옮겨 집회를 이어갈 예정이다.앞서 지난 22일 공대위 측은 언론에 배포한 보도자료를 통해 “김씨가 삼성 측이 제안한 합의를 수용했음에도 불구하고 지난 15일 합의문 작성을 일방적으로 미룬 후 어떠한 연락도 하지 않았다”며 “삼성과의 협상 중단을 선언한다”고 주장했다.인현우 기자 inhyw@hankookilbo.com\xa0▶[이벤트]한국일보 채널 구독하면 네이버 웹툰 쿠키 최대 1000개 지급!\xa0▶뉴;잼을 보면 뉴스가 재밌다 [뉴스레터 구독하기]\xa0▶한국일보닷컴 바로가기한국일보 관련뉴스해당 언론사에서 선정하며 언론사 페이지(아웃링크)로 이동해 볼 수 있습니다.이용수 할머니 기자회견 뒤 일각에선 ""돈 욕심의 화신""이용수 할머니 2차 회견에 與 ""사실규명이 우선""이재용 집앞에서 삼겹살 굽고 술 마신 시민단체진중권 ""여성단체, 할머니 편에 서는 게 맞지 않나""이수진 ""국립현충원에서 \'친일파 무덤\' 파묘 추진""좋아요0훈훈해요0슬퍼요0화나요0후속기사 원해요0기사제공 :']"
2,삼성전자, 2020-05-2520:24,세계일보 ,코로나 쇼크에… 글로벌 TV 시장 ‘Turn Off’,https://finance.naver.com/news/news_read.nhn?article_id=0003468475&office_id=022&mode=search&query=삼성전자&page=1,"['       코로나 쇼크에… 글로벌 TV 시장 ‘Turn Off’      기사입력2020-05-25 20:24기사원문좋아요훈훈해요좋아요 평가하기공감좋아요0훈훈해요0슬퍼요0화나요0후속기사 원해요0댓글국내 기업도 실적 악화 / 中 1분기 938만대… 2019년보다 24%p 줄어 / 공장 가동·유통 차질… 삼성·LG도 부진 / 올림픽 특수 사라져 2분기도 악화 전망 / 업계, ‘美 메모리얼 데이’ 할인 총력전 / LG, 구미 생산라인 일부 인도네시아 이전신종 코로나바이러스 감염증(코로나19) 여파로 삼성전자와 LG전자의 TV사업 부문 2분기 실적이 크게 부진할 것으로 보인다. 앞서 1분기 실적에서도 TV사업 부문의 감소폭이 드러났는데, 2분기에는 더 떨어질 것이란 전망이다. 도쿄 올림픽 연기로 2분기 TV시장의 특수마저 사라져 당분간 반등을 기대하기 어렵다는 분석도 나온다.  25일 시장조사업체 옴디아에 따르면 세계 최대 TV시장인 중국의 지난 1분기 TV시장 규모는 938만7600대로 전년 동기 대비 23.6%포인트 감소했다. 중국의 TV시장 규모가 1000만대 밑으로 떨어진 것은 2011년 2분기(962만1000대) 이후 9년여 만이다. 감소폭도 서유럽(-13.6%)과 북미(-8.5%) 시장을 크게 압도했다.    중국의 1분기 TV시장 규모 급감은 코로나19 쇼크를 가장 먼저 받았기 때문으로 보인다. 그 여파는 삼성전자와 LG전자의 지난 1분기 실적에서도 드러났다. 삼성전자는 1분기 실적 발표 후 콘퍼런스 콜에서 “1분기 TV 판매량이 20% 후반대 감소했다”며 “2분기에도 10%대 감소가 예상된다”고 언급했다.  시장에서 더 우려하는 것은 2분기 실적이다. 지난 3월 세계보건기구(WHO)의 코로나19 팬데믹(세계적 대유행) 선언을 기점으로 세계 시장의 코로나19 영향이 본격화됐다. 중국에 이어 TV시장 규모가 큰 북미와 유럽의 유통과 소비가 3월 들어 마비된 점을 고려하면, 2분기 실적의 낙폭이 시장 전망치를 웃돌 수 있다.  업계 관계자는 “2분기부터 세계가 코로나19 영향권에 들어 공장 가동과 유통 등의 차질을 빚어 시장이 위축될 것”이라며 “2분기 시장의 타격이 1분기보다 크다는 게 업계의 중론”이라고 전했다. 다른 업계 관계자는 “TV의 경우 주로 선박으로 운송하기 때문에 항공편을 이용할 수 있는 스마트폰보다 물류 환경의 영향을 크게 받는다”고 설명했다.  당분간 시장의 반등을 기대할 요인이 없는 점도 불안을 부추긴다. 올해 TV시장의 특수로 기대했던 도쿄 올림픽과 유로 2020 등 대형 스포츠 이벤트가 모두 연기된 만큼 얼어붙은 소비심리 회복이 쉽지 않다는 관측이다. 유럽 최대 가전 행사인 ‘IFA 2020’의 축소 소식으로 기업의 제품 경쟁력을 드러낼 자리가 줄어든 점도 어려움 중 하나다.  업계에서는 5월 들어 북미 시장의 유통망 복구를 근거로 수요 회복을 기대하는 분위기다. 미국에서는 상반기 최대 할인기간으로 꼽히는 메모리얼 데이가 있는 5월 전후로 베스트바이 등 유통매장이 영업을 재개했다. 삼성전자와 LG전자는 이 기간에 맞춰 TV 등 가전 할인에 나서며 소비심리를 자극하고 있다.  위기 상황에서 체질 개선에 나서는 기업의 움직임도 포착된다. LG전자는 최근 경북 구미의 생산라인 일부를 인도네시아로 이전한다고 발표했다. 이는 세계 TV시장의 침체 국면에서 가격경쟁력을 높이려는 LG전자의 전략으로 풀이된다. LG전자는 구미 사업장을 TV 생산 및 연구개발(R&D)의 거점으로 활용한다는 계획이다. 삼성전자도 2018년 경기 수원의 TV 생산라인을 베트남으로 이전하고 R&D 거점으로 전환했다.   권구성 기자 ks@segye.comⓒ 세상을 보는 눈, 세계일보세계일보 관련뉴스해당 언론사에서 선정하며 언론사 페이지(아웃링크)로 이동해 볼 수 있습니다.동료 성폭행 하고 ""잠자리 했다"" 자랑한 경찰관하루 20번 이상 뽀뽀한다는 10년차 연예인 부부, 등산 중에도 애정행각 \'쪽∼\'""구하라 친모, 조문 와서 인증샷 찍으려고…""조현 ""\'움짤\' 본 아버지 졸도""쌍둥이가 태어났는데 아버지가 다르다니좋아요0훈훈해요0슬퍼요0화나요0후속기사 원해요0기사제공 :']"
3,삼성전자, 2020-05-2520:20,채널A ,코로나로 달라진 회사 생활…주 1회 재택·온라인 회의,https://finance.naver.com/news/news_read.nhn?article_id=0000192253&office_id=449&mode=search&query=삼성전자&page=1,"['       코로나로 달라진 회사 생활…주 1회 재택·온라인 회의      기사입력2020-05-25 20:20기사원문좋아요훈훈해요좋아요 평가하기공감좋아요0훈훈해요0슬퍼요0화나요0후속기사 원해요0댓글 아직 포스트 코로나19 시대가 아니지만, 대기업 문화는 벌써 달라지고 있습니다.   일주일에 한 번 집에서 일하는 것이 의무가 되기도 하고, 온라인 회의는 일상이 됐습니다.   조현선 기자가 취재했습니다.  [리포트] [조현선 기자]  ""코로나19가 장기화되면서 우리 기업 문화가 빠르게 바뀌고 있습니다.   롯데지주는 오늘부터 신동빈 회장을 포함한 모든 임직원이 일주일에 한 번 재택근무를 시작하는데요.   직원들의 반응은 어떤지 직접 들어보겠습니다.""   [이경수 / 롯데지주 직원]  ""매주 수요일마다 출퇴근 시간을 활용할 계획을 세우고 있는데 자기계발 시간으로 많이 기대되고 있습니다.""   [김민진 / 롯데지주 직원]  ""출퇴근 시간이 없다보니까 1분이면 되니까. 직장인 모드에서 엄마로 전환되는 모드가 좀 더 빨리 가동될 것 같습니다.""   이번 결정은 신 회장이 재택근무 경험에 대한 긍정적 평가를 듣고 \'일하는 방식의 변화\'를 주문한 데 따른 겁니다.   직원이 원하는 요일 가운데 하루를 선택해 집에서 일하는 문화는 계열사로 확산될 전망입니다.   SK그룹은 온라인 소통을 강화하고 있습니다.   2015년부터 착한 일을 하는 기업에 현금 인센티브를 지급해온 \'사회성과 인센티브\' 행사를 온라인으로 진행했습니다.   [최태원 / SK 회장]  ""예년 같았으면 대면하고 인사드렸겠지만 코로나19 여파로 올해는 영상으로 인사 드립니다.""   사회적 성과를 창출한 기업 200곳에 인센티브 106억 원을 전달하는데, 올해는 시상식을 여는 대신 Sk측이 해당 기업에 깜짝 방문한 모습을 영상으로 공개한 겁니다.   [현장음]  ""안녕하세요. 축하드립니다.""   이밖에도 삼성전자는 코로나19 장기화로 육아에 어려움을 겪는 직원들을 대상으로 주 4일 근무제를  시행 중입니다.   코로나19가 기업의 근무 방식까지 변화시키고 있습니다.   채널A뉴스 조현선입니다.   chs0721@donga.com  영상취재 : 장명석  영상편집 : 이혜리▶ \'채널A\' LIVE 무료 보기▶ 네이버에서 \'채널A\' 구독하기▶[기사 보기]“윤미향, 사리사욕 채우려 총선 출마…용서 안 해”꿈을 담는 캔버스 채널A  ⓒCHANNEL A(www.ichannela.com), 무단 전재 및 재배포 금지채널A 관련뉴스해당 언론사에서 선정하며 언론사 페이지(아웃링크)로 이동해 볼 수 있습니다.마스크 안 쓰면 버스·택시 못 탄다…""실효성 약해"" 지적도서울 강서구 유치원생도 확진…인근 지역 \'등교 중지\' 고심[팩트맨]탈세하는 유튜버, 적발 어렵다?[여랑야랑]벼랑 끝에서 \'절박한\' 이재명 / 청와대 초청 제외에 서운한 정의당\'노태우 정부\' 현승종 전 국무총리 별세…향년 101세좋아요0훈훈해요0슬퍼요0화나요0후속기사 원해요0기사제공 :']"
