,회사명,날짜,언론사,기사제목,링크,본문
0,삼성전자, 2020-03-2521:48,경향신문 ,손발 묶인 ‘전자·자동차’…올해 실적 반토막 날 수도 [‘코로나19’ 확산 비상],https://finance.naver.com/news/news_read.nhn?article_id=0002999993&office_id=032&mode=search&query=삼성전자&page=1,"['       손발 묶인 ‘전자·자동차’…올해 실적 반토막 날 수도 [‘코로나19’ 확산 비상]      기사입력2020-03-25 21:48기사원문좋아요훈훈해요좋아요 평가하기공감좋아요0훈훈해요0슬퍼요0화나요0후속기사 원해요0댓글ㆍ해외 공장 폐쇄·출장 금지…글로벌 사업 ‘올스톱’ 위기이틀 연속 주식시장 상승세…코스피 ‘1700선’ 회복 25일 오후 서울 중구 하나은행 딜링룸 모니터에 주가지수와 환율이 표시돼 있다. 이날 코스피는 전 거래일보다 94.79포인트(5.89%) 급등한 1704.76으로 장을 마쳤다. 코스피 종가가 1700을 넘은 것은 지난 16일 이후 7거래일 만이다. 원·달러 환율은 전날보다 19.7원 하락한 1229.9원으로 장을 마감했다. 연합뉴스코로나19의 세계적 확산세가 격화되면서 삼성전자가 당분간 모든 임직원들의 해외 출장을 금지했다. 이미 인도와 브라질, 슬로바키아 공장의 가동을 멈춘 삼성전자의 해외사업은 더욱 타격을 받을 전망이다. 현대·기아자동차도 가동을 재개한 중국을 제외하면 미국과 유럽 등 해외 상당수 공장이 셧다운된 상태다. 이에 따라 국내 완성차 업체의 해외 생산 500만대 중 현재 60만대 정도만 정상 생산되고 있다. 주력 산업인 전자·자동차업계의 해외사업이 ‘올스톱’ 위기에 빠지면서 한국 경제 전체에 큰 충격이 예상된다. 중소협력업체의 줄도산과 산업생태계 붕괴도 우려된다.산업 주축 삼성·현대·기아 등 협력업체부터 ‘줄도산’ 우려‘공황 수준의 침체 오나’ 긴장25일 전자업계에 따르면 삼성전자 코로나19 대응 태스크포스(TF)는 사내에 “정부가 ‘특별여행주의보’를 발표함에 따라 모든 임직원들의 해외 출장을 제한한다”고 공지했다. 개인적 사유에 따른 불가피한 국외 이동은 부서장이나 소속 사업부 인사팀에 사전신고하도록 했는데, 사실상 ‘출국금지령’이나 다름없다. SK하이닉스도 정부가 모든 국가를 상대로 해외여행 취소 또는 연기를 권고하고 있다는 점을 구성원들에게 알렸다.기업들이 임직원들의 ‘출국 통제’에 나선 것은 해외에서 유입되는 코로나19 확진자로 인해 국내 공장이 가동을 멈추는 사태를 막기 위해서다. 최근 코로나19 감염이 확인된 삼성전자 직원도 브라질 출장 후 자택에서 대기하다 확진 통보를 받았다.주력 업종의 해외 사업장 상황은 나날이 악화되고 있다. 기아차는 오는 30일부터 2주일간 미국 조지아 공장의 생산을 중단한다고 이날 밝혔다. 이미 현대차 미국 앨라배마 공장은 직원의 코로나19 확진으로 오는 31일까지 가동이 중단된 상태다. 현대차 체코 공장과 기아차 슬로바키아 공장, 현대차 인도 첸나이 공장도 지난 23일부터 차량 생산을 중지했다. 아직은 현대차 터키와 러시아 공장, 기아차 멕시코 공장이 정상 가동되고 있지만 코로나19가 확산 중이어서 언제 가동 중단 사태가 발생할지 알 수 없다. 현대차의 한 임원은 “올 초 중국을 비롯해 아시아를 중심으로 코로나19가 확산됐을 때만 해도 북미와 유럽 시장을 공략해 헤징(위험회피)하려고 했는데 전 세계로 병세가 확산되면서 상황이 어렵게 됐다”고 말했다.삼성전자는 현재 인도 노이다의 스마트폰 공장과 슬로바키아의 TV 공장, 브라질 아마조나스주 공장 등의 가동이 중단된 상태다. LG전자는 이달 23일부터 29일까지 폴란드 므와바 공장의 TV 생산량 축소에 나섰다. LG화학과 삼성SDI의 미국 배터리 공장도 주 정부 지침에 따라 3주간 휴업에 돌입했다.유럽과 북미, 남미의 거점지역 영업망도 타격을 받고 있다. 코로나19 누적 사망자 수가 중국보다 많은 이탈리아에 진출한 국내 기업 주재원들은 이미 한국으로 귀국했거나 복귀를 서두르고 있다. 삼성전자는 미국과 캐나다에 이어 브라질에 있는 오프라인 매장을 폐쇄했다.이에 따라 전자·자동차업계의 올해 실적은 크게 악화될 전망이다. 정만기 자동차산업연합회장은 이날 ‘코로나19에 따른 글로벌 영향 및 대응’을 주제로 한 제2회 산업발전포럼에서 “유럽과 미국의 코로나19 감염 확산은 세계 경제를 공황 수준으로 침체시킬 우려가 있다”며 “지난달 중국의 자동차 판매량이 90% 감소한 데 이어 미국도 향후 3개월간 차 판매가 90% 감소할 전망”이라고 밝혔다. 정 회장은 “국내 자동차 기업의 해외공장도 인도, 미국, 유럽, 남미 등에서 연쇄적으로 폐쇄돼 500만대 생산 공장 중 겨우 60만대 수준만 정상 생산되는 상황”이라고 말했다. 지난해 영업이익이 전년보다 52.84% 감소한 삼성전자도 올해 실적 반등이 긴요하지만 코로나19 사태가 장기화되면 실적 하락이 불가피해 보인다.전자업계 관계자는 “동유럽에 체류 중인 한 직원이 ‘올해 실적이 반토막 날 것 같다’는 말을 했다”고 전했다. 자동차업계 관계자는 “소비심리 위축으로 수요 급감까지 겹쳐지면 2008년 금융위기를 능가하는 상황이 도래할 수 있다”고 말했다.구교형 기자·김준 선임기자 assup01@kyunghyang.com▶ 장도리 | 그림마당 보기▶ 경향신문 바로가기▶ 경향신문 구독신청하기©경향신문(www.khan.co.kr), 무단전재 및 재배포 금지경향신문 관련뉴스해당 언론사에서 선정하며 언론사 페이지(아웃링크)로 이동해 볼 수 있습니다.유럽 일부 국가, 특수고용직·프리랜서·예술인도 생계지원금\'혈세\'지원 받는 기업, 해고 일시적 금지를…코로나19, 새로운 대타협으로 넘자노동부 ""중소기업 모든 업종에 휴업수당 90% 지원""좋아요0훈훈해요0슬퍼요0화나요0후속기사 원해요0기사제공 :']"
1,삼성전자, 2020-03-2521:21,TV조선 ,"""퍼펙트 스톰 한가운데""…규제완화·특별법 등 대책 요구 '봇물'",https://finance.naver.com/news/news_read.nhn?article_id=0000294514&office_id=448&mode=search&query=삼성전자&page=1,"['       ""퍼펙트 스톰 한가운데""…규제완화·특별법 등 대책 요구 \'봇물\'      기사입력2020-03-25 21:21기사원문좋아요훈훈해요좋아요 평가하기공감좋아요0훈훈해요0슬퍼요0화나요0후속기사 원해요0댓글[앵커]어려운 사정은 소상공인들에게  국한된 일이 아닙니다. 대기업 더 나아가  전 세계를  상대로 하는 글로벌 기업들까지 코로나 19 충격에 속수무책입니다. 규제를 완화하고 특별법을 만들어서  기업들을 살려 달라는 비명이  점점 커지고 있습니다.  김지아 기자가 취재했습니다.[리포트]하나투어는 경영난을 이기지 못한 서울시내 SM면세점 문을 닫기로 했습니다. 코로나19 확진자가 방문한 신세계백화점 강남점은 네번째 조기 폐점했습니다. 삼성전자 인도 스마트폰 공장 가동 중단 기간은 3주로 연장됐고, 삼성과 LG의 미국 배터리 공장, 한국타이어 유럽 공장도 셧다운 대열에 합류했습니다. 재계의 위기감은 어느 때보다 심각합니다.허창수 / 전국경제인연합회 회장""실물과 금융의 복합위기, 퍼펙트 스톰의 한가운데 우리 경제가 놓여 있습니다.""전경련은 특약 처방으로 각종 규제를 최소 2년간 유예해달라며, 대형마트 휴일 영업 허용, 주 52시간 근로 예외 확대 등 54개 과제를 긴급 제안했습니다. 코로나 사태 이후 수요 급증을 대비한 특별노동조치법이 필요하다는 주장도 나왔습니다.정만기 / 한국자동차산업협회장""(재난 기간에는) 주당 52시간 근로 규정 적용을 배제하고 노사가 원할 때 충분하게 얼마든지 일을 할 수 있게끔 자유에 맡기자는"" 노동계에선 실직자들의 생존권 보장 요구가 나왔습니다. 김태정 / 금속노조 정책국장 ""한시적으로 모든 해고를 금지해야 한다고 생각합니다. 고용유지를 위한 조업 단축 및 휴업에 대한 임금 보존이 필요하고"" 박복영 청와대 경제보좌관은 삼성전자, 현대차 등 해외진출 대표기업들과 간담회를 열고, ""전례 없는 대책을 과감하게 결정하고 신속하게 행동할 것""이라고 밝혔습니다. TV조선 김지아입니다.김지아 기자(kimjiah@chosun.com)☞ 네이버 메인에서 TV조선 구독하기☞ 더 많은 TV조선 뉴스 보기* 뉴스제보 : 이메일(tvchosun@chosun.com), 카카오톡(tv조선제보), 전화(1661-0190)- Copyrights ⓒ TV조선. 무단전재 및 재배포 금지 -TV조선 관련뉴스해당 언론사에서 선정하며 언론사 페이지(아웃링크)로 이동해 볼 수 있습니다.조주빈 변호사 돌연 사임…조사일정 \'불투명\'[단독] ""텔레그램방에 현직 고위 경찰 있었다""손석희 ""조주빈 \'가족 위협\' 사기에 금품 건넸다""…""조주빈, 손석희와 호형호제 사이라고 말해""n번방 가담자이자 최초 신고자 ""회원들 모두 적극 가담자""증시 이틀째 급반등…코스피 1700·코스닥 500 회복좋아요0훈훈해요0슬퍼요0화나요0후속기사 원해요0기사제공 :']"
2,삼성전자, 2020-03-2521:13,노컷뉴스 ,전자·자동차·배터리·철강까지…해외공장 셧다운 잇따라,https://finance.naver.com/news/news_read.nhn?article_id=0003340975&office_id=079&mode=search&query=삼성전자&page=1,"['       전자·자동차·배터리·철강까지…해외공장 셧다운 잇따라      기사입력2020-03-25 21:13기사원문좋아요훈훈해요좋아요 평가하기공감좋아요0훈훈해요0슬퍼요0화나요0후속기사 원해요0댓글[CBS노컷뉴스 최인수 기자]기아차 조지아 공장. (사진=자료사진)코로나19의 글로벌 확산으로 한국 기업들의 전자·자동차·배터리·철강의 해외 공장까지 셧다운이 속출하고 있다.25일 업계에 따르면, 기아차는 조지아 공장의 가동을 오는 30일부터 다음 달 10일까지 중단한다. 앞서 기아차 조지아 공장은 지난 19~20일 사이 생산이 중단됐다. 현대차의 미국 앨라배마 공장에서 직원 한명이 코로나19 양상반응을 보이면서 31일까지 공장 가동을 전면 중단한 데 따른 여파다. 유럽에 있는 현대차 체코 공장과 기아차 슬로바키아 공장도 정부 지침에 따라 23일부터 2주간 문을 닫고, 현대차 브라질 상파울루 공장도 내달 9일까지 문을 닫는다. 유럽의 주요 자동차 공장이 문을 닫으면서 한국타이어의 헝가리 공장도 30일부터 내달 7일까지 가동을 멈춘다. LG전자의 차량용 조명 자회사 ZKW는 완성차 업체 셧다운 문제로 오스트리아 현지 생산량 감축을 발표했다.인도로 진출한 기업들 사정도 마찬가지다. LG전자는 인도 노이다와 푸네에 위치한 가전과 스마트폰 생산공장 가동을 이달 말까지 중단했다. 삼성전자도 현지 정부 지침에 맞춰 스마트폰을 생산하는 노이다 공장과 생활가전을 생산하는 첸나이 공장 가동을 중단했다. 이들 업체는 현지 정부의 지침에 따라 셧다운 기간을 연장할 수 있어 보인다. 현대차의 첸나이 공장, 기아차 안드라프라데시 공장은 일단 이달 31일까지 가동을 중단한다.이밖에 삼성전자는 유럽 슬로바키아와 헝가리의 TV 공장 가동을 중단했다. 브라질에 있는 스마트폰, TV 공장도 오는 29일까지 가동을 멈춘다.배터리 업계도 이번 주부터 셧다운 사례가 나왔다. 미국 미시간주가 3주간 자택 대기 명령을 내리면서 LG화학의 배터리 셀 공장, 삼성SDI의 배터리 팩 공장이 문을 닫았다.철강업계도 포스코는 이탈리아, 말레이시아, 필리핀 가공센터가 줄줄이 문을 닫았다. 현대제철은 현대·기아차 공장 셧다운 영향으로 인도 타밀나두주 공장 가동을 이달 말까지 중단한다. 건설 업계는 삼성물산이 말레이시아에서 진행 중인 5개 공사 현장을 오는 31일까지 멈춘다. 대림산업은 말레이시아 정유공장 건설 공사를 이달 말까지 잠정 중단한다.▶ 코로나19 대유행 관련기사 모음▶ 클릭 한 번이면 노컷뉴스 구독!▶ 보다 나은 세상, 노컷브이와 함께apple@cbs.co.kr저작권자 © CBS 노컷뉴스 무단전재 및 재배포 금지노컷뉴스 관련뉴스해당 언론사에서 선정하며 언론사 페이지(아웃링크)로 이동해 볼 수 있습니다.통합당 공관위 민경욱 공천 무효…민현주 재공천""12살 고아에 소송이라니""…한화손보 \'구상권 청구\' 논란조주빈 포토라인서 뜬금없이 언급된 3人…""수천만원 사기쳤다""[칼럼]비례대표를 방공호 삼은 일부 의원들의 파렴치[속보]민경욱 또 \'공천 탈락\' 위기…공관위 재요구좋아요0훈훈해요0슬퍼요0화나요0후속기사 원해요0기사제공 :']"
3,삼성전자, 2020-03-2520:11,국민일보 ,초유의 코로나 불황… 나눔·연대로 뚫는다,https://finance.naver.com/news/news_read.nhn?article_id=0001303877&office_id=005&mode=search&query=삼성전자&page=1,"['       초유의 코로나 불황… 나눔·연대로 뚫는다      기사입력2020-03-25 20:11기사원문좋아요훈훈해요좋아요 평가하기공감좋아요0훈훈해요0슬퍼요0화나요0후속기사 원해요0댓글사진=게티이미지뱅크신종 코로나바이러스감염증(코로나19) 사태는 1997년 외환위기나 2008년 금융위기와 차원이 다른 복합위기다. 이전 위기는 국지적 금융 체제 붕괴에서 왔지만 코로나19는 전 세계 실물경제와 금융 시장을 일시에 무너뜨리고 있다. 사회적 연대와 신뢰에 기반한 우리 기업들의 따듯한 나눔과 상생은 우리가 전대미문의 코로나 위기를 헤쳐나가는 데 큰 동력이 되고 있다.삼성전자는 코로나19로 부족한 마스크 공급을 위해 국내 마스크 제조업체들이 생산량을 늘릴 수 있도록 제조전문가를 파견했다. 이 전문가들은 설비 추가 없이 단기간에 생산량을 늘릴 수 있도록 현장 제조공정 개선과 기술 전수 등을 하고 있다. 기술 공유로 마스크 대란 극복에 참여한 것이다. 삼성전자는 스마트팩토리, 상생펀드 지원을 통해 상시적으로 중소기업과 협력사들을 돕고 있다.현대차 정몽구 재단은 미래 인재 육성으로 상생에 기여하고 있다. ‘온드림스쿨’이라는 교육 프로그램을 통해 아동·청소년들의 창의·인성 함양하고 있다. 아모레퍼시픽그룹은 코로나19 극복을 위해 파트너사에 80여억원을 직접 지원했다. LS그룹은 동반성장 공동근로복지기금을 운영하고 있다.기업들은 코로나19 극복을 위해 앞다퉈 성금을 기탁하고 연수원을 치료 시설로 제공하고 있다. 현대차는 50억원을 기부했다. LG그룹은 기숙사와 연수원을 생활치료센터로 제공했고 성금 50억원을 기탁했다. 포스코그룹은 코로나19 극복을 위해 50억원을 냈다. GS그룹은 성금 10억원을 사회복지공동모금회에 기탁했다.한화그룹은 한화생명 라이프파크 연수원을 치료센터로 제공했다. 효성은 코로나19 극복을 위해 대한적십자사에 성금 5억원과 의료용품을 전달했다. 롯데는 돌봄 공백과 결식 위기에 처한 어린이와 노인 등을 위해 먹거리를 제공한다. KT는 소상공인들을 돕기 위해 ‘사랑나눔 도시락’을 광화문사옥 구내식당에서 판매한다.소상공인들을 위해 ‘착한 임대인 운동’에 동참하는 기업도 많다. 포스코그룹은 포항, 광양 지역의 복지시설 및 상업시설 내 임대매장 135곳의 임대료를 인하했다. 대방그룹은 계열사 사업장에 입주한 소상공인을 위해 2개월간 업종별로 30%에서 최대 50%까지 임대료를 인하한다.네이버는 코로나19 위기 극복을 위해 다양한 플랫폼 기능을 강화했다. 야외활동을 꺼리는 이용자들을 위해 네이버TV의 라이브 권한을 4000개의 채널로 확대했다. SK브로드밴드는 한글 떼기 등 약 1300여 편의 VOD를 모두 무료로 제공하고 있다. LG유플러스는 지난 2일 대구·경북 의료진에게 휴대폰 100대를 지원했다.강주화 기자 rula@kmib.co.kr▶ 네이버에서 국민일보를 구독하세요(클릭)▶ 국민일보 홈페이지 바로가기GoodNews paper ⓒ 국민일보(www.kmib.co.kr), 무단전재 및 재배포금지국민일보 관련뉴스해당 언론사에서 선정하며 언론사 페이지(아웃링크)로 이동해 볼 수 있습니다.""아기울음소리보다 곡소리""…3개월 연속 인구 자연감소美 교도소, 코로나19에 씁슬한 석방…성폭력범은 제외""조주빈, \'연변 사람 쓰겠다\'며 손석희 살해 협박했다""빌게이츠 ""시신 쌓아둔 채 식당 가고 집 사라 할거냐""\'원팀 추진력\' 고민정과 \'일 좀 한다\'는 오세훈 [찐심리포트]좋아요0훈훈해요0슬퍼요0화나요0후속기사 원해요0기사제공 :']"
4,삼성전자, 2020-03-2519:26,더팩트 ,"외인, 코스피 3천억 원 순매도…삼성 팔고 SK하이닉스 샀다",https://finance.naver.com/news/news_read.nhn?article_id=0000020171&office_id=629&mode=search&query=삼성전자&page=1,"['       외인, 코스피 3천억 원 순매도…삼성 팔고 SK하이닉스 샀다      기사입력2020-03-25 19:26기사원문좋아요훈훈해요좋아요 평가하기공감좋아요0훈훈해요0슬퍼요0화나요0후속기사 원해요0댓글25일 외국인투자자 매매동향 (단위:천주, 백만원), 순매수(왼쪽) 및 순매도 수량 및 금액. / 네이버증권 캡처외국인, SK하이닉스 781억 여원, 셀트리온 282억여 원 \'매수\'[더팩트ㅣ박경현 기자] 국내 증시가 5%대 강세로 마감한 가운데 유가증권시장에서 개인은 매수, 외인과 기관은 매도 포지션으로 장을 마쳤다.25일 개인은 4499억 원을 사들인 반면 외국인과 기관은 각각 3328억 원, 1043억 원을 매도했다.이날 코스피 시장 대표주자인 SK하이닉스가 7%대 큰 폭으로 오르며 장을 마친 가운데 외국인은 이날 SK하이닉스 781억 여원, 셀트리온 282억여 원, SK이노베이션 265억 여원을 사들였다. 반면 삼성전자 1332억 여원, LG생활건강 368억 여원을 팔았다.코스닥 시장에서는 다나와(73억 원), 펄어비스(54억 원), 씨젠(44억 원)을 순매수하고 메디톡스(72억 원), 원익IPS(65억 원), 네페스(61억 원)를 순매도했다.기관은 코스피 시장에서 하나금융지주에 204억 여원, 기아차에 121억 여원, 신한지주 113억 여원을 사들인 반면 삼성전자 861억 여원, 셀트리온 292억 여원, 카카오는 254억여 원을 팔았다.pkh@tf.co.kr- 더팩트 뮤직어워즈는 언제? [알림받기▶]  - 내 아이돌 응원하기 [팬앤스타▶]  저작권자 ⓒ 특종에 강한 더팩트 & tf.co.kr 무단 전재 및 재배포 금지더팩트 관련뉴스해당 언론사에서 선정하며 언론사 페이지(아웃링크)로 이동해 볼 수 있습니다.[TF현장] \'박사방\' 조주빈, 왜 손석희·윤장현 언급했나경찰, \'성폭행 의혹\' 김건모 기소의견 검찰 송치[TF이슈] \'신림동 CCTV 사건\' 강간미수 무죄 이유는손석희 ""조주빈 금품 요구, 증거 확보 위해 응했다""트와이스·강다니엘, \'더팩트 뮤직 어워즈\' 수상...""팬들 덕분""좋아요0훈훈해요0슬퍼요0화나요0후속기사 원해요0기사제공 :']"
5,삼성전자, 2020-03-2519:18,경향신문 ,주식시장 1일 최대 거래액…두드러진 ‘동학개미운동’,https://finance.naver.com/news/news_read.nhn?article_id=0002999924&office_id=032&mode=search&query=삼성전자&page=1,"['       주식시장 1일 최대 거래액…두드러진 ‘동학개미운동’      기사입력2020-03-25 19:18기사원문좋아요훈훈해요좋아요 평가하기공감좋아요0훈훈해요0슬퍼요0화나요0후속기사 원해요0댓글25일 오후 여의도 KB국민은행 딜링룸 전광판에 종가 지수가 표시돼 있다. 코스피는 전 거래일보다 94.79포인트(5.89%) 오른 1,704.76으로,  원·달러 환율은 19.7원 하락한 1,229,9원으로 장을 마감했다. 연합뉴스코로나19 확산 여파로 하락세가 끊이질 않던 국내 주식시장이 연이틀 상승한 가운데, 저점에서 주식을 사들여 향후 상승을 노리는 개인투자자들의 주식시장 대거 참여가 눈에 띈다.25일 코스피지수는 전날보다 94.79포인트(5.89%)가 오른 1704.76을 기록했다. 이날 외국인 투자자가 시가총액 기준 3360억어치, 기관이 1053억원어치를 순매도한 반면 개인 투자자들은 이날 하루만 4519억원어치를 순매수했다. 이날 유가증권시장 및 코스닥시장의 총 거래대금은 22조2989억원으로 1996년 코스닥시장이 개장한 이래 최대이기도 했다.한국거래소에 따르면 이달 1일부터 25일까지의 개인투자자 코스피 누적 순매수액은 9조7351억원(잠정치)에 이른다. 이는 거래소가 1999년 이후 집계한 월간 개인 누적 순매수액중 최대다. 지난달 순매수익(4조8973억원)의 2배에 이른다.그 외 지표들로도 개인 투자자들의 주식시장 참여 증가세를 확인할 수 있다. 금융투자협회에 따르면 지난 24일 기준 투자예탁금은 40조9912억원으로 사상 최대치를 기록했다. 투자자예탁금은 투자자가 주식을 사기 위해 증권사에 맡겨두거나 주식을 판 뒤 찾지 않은 돈으로, 개인 투자자들의 주식시장 참여도와 비례한다.같은날 기준 주식거래활동계좌수 역시 3053만4668개로 최다치를 경신했다. 주식거래활동계좌는 예탁자산이 10만원 이상이고 6개월간 한차례 이상 거래한 기록이 있는 증권계좌로 대부분이 개인투자자가 증권사에 개설하는 계좌다. 지난 6일 3000만개를 돌파한 이후 그 수가 연일 오르고 있다.전 세계적인 코로나19 확산 여파로 경제 전반이 얼어붙은 가운데, 개인 투자자들은 하락장에서 주식을 사들이면 장기적으로 투자 이익을 볼 수 있다는 생각에 상승장에서 사기 어려웠던 ‘대장주’를 중심으로 투자하고 있다. 이달 1일부터 25일까지 개인 투자자들은 대표적인 ‘대장주’인 삼성전자를 4조5459억원어치나 순매수했다. 외국인 투자자들이 같은 기간 삼성전자 주식 4조7664억원어치를 순매도한 것과 대조를 이룬다.외국인 투자자들의 대규모 순매도에 맞서 국내 개인투자자들이 삼성전자 등 대장주를 대거 사들이는 현상이 ‘동학 개미 운동’으로까지 불리고 있다. 다만 세계 경제상황이 전례없는 상황을 맞이하고 있어 개인투자자들이 보다 조심스레 대응해야한다는 지적 또한 많다. 김학균 신영증권 리서치센터장은 “전세계적으로 주식시장 변동성이 큰 만큼 자신이 감내할 수 있는 한도내의 금액에서 투자를 신중하게 해야 한다”고 말했다.윤승민 기자 mean@kyunghyang.com▶ 장도리 | 그림마당 보기▶ 경향신문 바로가기▶ 경향신문 구독신청하기©경향신문(www.khan.co.kr), 무단전재 및 재배포 금지경향신문 관련뉴스해당 언론사에서 선정하며 언론사 페이지(아웃링크)로 이동해 볼 수 있습니다.""컴퓨터 보며 검사님들이 \'조국 폴더다\' 말해"" 동양대 조교 증언일본 시민 ""일 정부가 조선학교엔 마스크 안 준다기에···""""억울하다""던 김건모 기소의견으로 검찰 송치…범죄 혐의 상당 부분 인정된 듯대구 \'김부겸 캠프\'에 문 대통령 \'코로나19\' 비난 쪽지, 계란 투척""신천지 교인이세요? 퇴사 부탁드립니다""좋아요0훈훈해요0슬퍼요0화나요0후속기사 원해요0기사제공 :']"
