,회사명,날짜,언론사,기사제목,링크,본문
0,삼성전자, 2020-02-1623:02,세계일보 ,코로나 악재에도… 반도체·2차전지株 상승장 계속된다 [마이머니],https://finance.naver.com/news/news_read.nhn?article_id=0003439035&office_id=022&mode=search&query=삼성전자&page=1,"['       코로나 악재에도… 반도체·2차전지株 상승장 계속된다 [마이머니]      기사입력2020-02-16 23:02기사원문좋아요훈훈해요좋아요 평가하기공감좋아요0훈훈해요0슬퍼요0화나요0후속기사 원해요0댓글국내 증시 2200선 회복 / 中 반도체 공장 지속가동·수요 확대 기대 / 삼성전자·하이닉스, 6만∼10만원선 ‘고공’ / 중장기적 관점서 상승세 큰 변함 없을 듯 / 전기차 시장 확대… 2차전지 업체 주가 ↑ / 배터리 소재·부품 기업도 10%이상 올라   올해 국내 증시가 반도체주 실적 기대감 등으로 상승세로 접어들었다가 신종 코로나바이러스 감염증(코로나19)이라는 복병을 맞았다.    코로나19 쇼크가 한창이던 지난달 31일 코스피는 2119.01까지 하락했지만, 이달 들어 회복세를 보이며 지난 14일 2243.59로 거래를 마쳤다.     특히 반도체주의 선방이 기대 이상이었다. 코로나19의 발병지가 중국 대도시면서, 국내 반도체 기업의 중국 공장 가동이 중단될지도 모른다는 위기감이 커지기도 했다. 하지만 코로나19 창궐이라는 악재에도 올해 반도체 수요 상승 기대감과 중국 현지 반도체 공장의 지속적인 가동 등으로 반도체주는 위기를 극복해 나가는 모습이다.  16일 한국거래소에 따르면 국내 반도체종목 ‘대장주’인 삼성전자의 주가는 지난 14일 기준 6만1800원으로 나타났다. SK하이닉스도 같은 날 10만4500원으로 거래를 마쳤다.    올해 반도체 경기가 살아난다는 기대감으로 반도체 종목 주가는 상승장이었다. 특히 삼성전자 주가는 지난달 20일 사상 최고치인 6만2800원을 기록하면서 주식 역사를 새로 썼다. SK하이닉스도 지난해 12월 2일 8만500원이었던 주가가 한 달여 만에 28.6%나 뛰기도 했다.  코로나19 공포가 한창이던 지난달 30일 삼성전자와 SK하이닉스 주가는 각각 -3.21%, -3.98% 급락하기도 했으나, 다시 회복세에 접어들어 최고가를 새로 쓰기 위해 박차를 가하고 있다.  ◆‘코로나19’에도 빠지지 않는 반도체주  코로나19가 반도체주에 미치는 영향은 미미한 것으로 나타났다. 우선 국내 반도체 기업들의 중국 내 반도체 공장이 코로나19에도 불구하고 가동 중단되지 않은 것이 꼽힌다.  삼성전자의 시안 반도체 공장과 D램을 만드는 SK하이닉스의 우시 반도체 공장은 현재 24시간 돌아가고 있다.  중국 정부는 많은 제조업체에 공장 가동 중단을 권고했으나 반도체 공장은 가동을 허용했다. 반도체 제조라인 특성상 한번 가동을 중단하면 설비 재점검을 포함해 재가동까지 두 달 이상 소요되기 때문이다.  또 중장기적으로 반도체 가격이 상승세를 탈 것이라는 기대감이 코로나19의 악재를 누르는 것으로 분석된다.    D램익스체인지에 따르면 PC용 D램(DDR4 8Gb 기준) 현물가격은 올해 초인 지난달 2일 3.03달러에서 한 달 만인 이달 4일 3.48달러로 올랐다. 지난해 12월 9일 2.73달러에서 27.5% 오른 수치다.  D램 현물가격은 매달 발표되는 D램 고정가격의 선행지표로 반도체 가격 추이를 알 수 있게 해준다. D램 가격은 지난해 말부터 수요 증가에 대한 기대로 꾸준히 상승한 바 있다.  코로나19가 한창인 지난 10일 무렵에는 전자제품 수요가 줄어들지도 모른다는 우려 등으로 D램 가격이 3.41달러로 잠시 주춤했으나, 5세대(5G) 이동통신 보급 확산과 클라우드 사업자들의 서버 투자 증대에 따른 수요가 반도체 경기를 견인한다는 전망이 지배적이다.  이승우 유진투자증권 연구원은 “현재 D램과 낸드의 재고 레벨이 지난해 대비 많이 낮아진 상황이기 때문에 메모리 반도체 가격의 상승 추세는 계속 이어질 것”이라며 “수요 둔화와 공급망 혼란으로 불확실성이 높아진 것은 사실이나, 중장기적 관점에서 보면 메모리 사이클의 상승세는 큰 변화없이 계속 이어질 것”이라고 전망했다.  ◆‘2차전지주’도 전염병 영향 미미  반도체주뿐만 아니라 ‘2차전지주’도 코로나19 확산에 아랑곳하지 않고 상승세를 이어가고 있다. 특히 미국 나스닥의 테슬라 주가가 반년 사이 300% 이상 상승하는 ‘대박’을 내는 등 전기차 시장 확대에 따른 성장 기대감이 2차전지 업체의 주가를 끌어올리고 있다.    이날 한국거래소에 따르면 지난 14일 기준 삼성SDI 주가는 전 거래일보다 0.15% 오른 33만7000원에 거래를 마쳤다. 올해 초인 지난달 3일 1주당 22만9000원이었던 삼성SDI 주가는 무려 47.1% 상승했다.  삼성SDI의 강세는 2차전지 양극재 제조업체인 에코프로비엠과 차세대 양극재 생산을 위한 합작법인 ‘에코프로이엠’을 설립한다는 소식이 호재로 작용했다.  배터리 소재·부품 기업도 초강세를 보이고 있다. 양극재 기업인 엘앤에프는 이달 들어 11.52% 상승했고, 전해질 기업인 천보는 14.78% 오르는 등 배터리 소재·부품 기업들이 10% 이상 높은 상승률을 기록했다.  또한 코로나19 확산에 따라 증시의 불확실성이 커지면서 개별 종목 장세가 강화되고 있는 것도 2차전지주 강세의 한 요인으로 분석된다. 반도체주를 대체할 만한 종목들이 나타나지 않으면서 투자자들이 상대적으로 안정적이고 수익을 기대할 수 있는 2차전지 종목에 관심을 집중시키고 있다는 것이다.  일례로 증권 어플리케이션인 ‘증권플러스’에 따르면 지난달 모바일 주식 투자자의 인기를 얻은 분야별 트렌드를 분석한 결과 △전염병 △반도체 △2차전지 △안전자산 등이 상위에 오르기도 했다.   김범수 기자 sway@segye.comⓒ 세상을 보는 눈, 세계일보세계일보 관련뉴스해당 언론사에서 선정하며 언론사 페이지(아웃링크)로 이동해 볼 수 있습니다.임현주 \'노브라\' 생방송…""용기 응원"" VS ""왜 굳이?""""기생충, 왜 한국어로 찍었나"" 봉준호에게 황당 질문한 美abc방송고유정 ""몸뚱아리 내줬더라면"" 최후진술… 우발적 살인 주장우한 중국인 가족 오는데, 日크루즈선 한국인 못 오는 이유는?아내가 출산할 때 똑같은 진통을 느끼는 남성이 있다?좋아요0훈훈해요0슬퍼요0화나요0후속기사 원해요0기사제공 :']"
1,삼성전자, 2020-02-1623:02,세계일보 ,‘에어팟’ 독주 막는다… 삼성·구글·MS 고성능 신제품 향연,https://finance.naver.com/news/news_read.nhn?article_id=0003439039&office_id=022&mode=search&query=삼성전자&page=1,"['       ‘에어팟’ 독주 막는다… 삼성·구글·MS 고성능 신제품 향연      기사입력2020-02-16 23:02기사원문좋아요훈훈해요좋아요 평가하기공감좋아요0훈훈해요0슬퍼요0화나요0후속기사 원해요0댓글뜨거워지는 무선이어폰 시장 / 2019년 애플 점유율 47% 압도적 1위 / 삼성, 11시간 재생 ‘갤럭시버즈+’ 공개 / AI 비서와 연동 실시간 번역 등 ‘뚝딱’ / 구글·MS 등 ICT기업 상반기 제품 출시 / 스마트폰·스마트워치와 패키지 판매 / 삼성·톰브라운 함께한 한정모델 내놔 / 애플, 워치5 나이키·에르메스와 협업 / “웨어러블 시장 내년 630억달러 전망”    삼성 갤럭시버즈+    삼성전자가 갤럭시버즈+를 출시하며 무선이어폰 시장이 더욱 뜨거워지고 있다. 애플과 삼성 등 주요 기업 위주의 경쟁 구도에 구글·마이크로소프트(MS) 등의 글로벌 ICT(정보통신기술) 기업까지 뛰어들며 제품 성능도 계속 업그레이드되는 모습이다.  16일 글로벌 시장조사업체 카운터포인트 리서치에 따르면 글로벌 무선이어폰 시장은 지난해 1억3000만대에서 올해 2억3000만대 규모로 90% 성장할 것으로 전망된다.     애플 에어팟 프로    지난해 점유율은 애플이 47%로 압도적인 1위를 지켰다. 이어 샤오미와 삼성이 각각 6%에 가까운 성적으로 2위와 3위에 올랐다. 100달러 이상의 제품만으로 보면 삼성의 점유율이 확대돼 2위로 올라간다. 이 부문 상위 3대 업체인 애플·삼성·자브라의 점유율 합계가 80%대 중반에 이른다. 100달러 미만 제품만 놓고 보면 상위 3개 브랜드인 샤오미·큐씨와이·제이랩의 점유율이 30%대 중반으로 경쟁이 훨씬 치열한 것으로 나타났다.  올해는 아마존과 구글, 마이크로소프트(MS) 등 ICT 기업들이 시장에 진입하고, 삼성·샤오미·화웨이 등 기존 업체의 공세도 강화될 것인 만큼 애플의 독주체제에 변화가 생길 개연성도 있다. 중국 업체들의 경우 화웨이와 샤오미, 리얼미 등 글로벌 브랜드뿐 아니라 저가 보급형 제품군에서의 중국 신흥 로컬 브랜드도 등장하고 있다. 시장조사업체 스트래티지 애널리틱스는 최근 보고서에서 “애플의 무선이어폰 시장 점유율은 올해 42.4%, 2021년 31.9%, 2022년 26.2%, 2024년 19.3% 등으로 떨어질 것”이라고 밝혔다.  삼성전자는 최근 언팩(공개) 행사에서 갤럭시S20 시리즈를 발표하며 갤럭시버즈+를 함께 선보였다. 갤럭시버즈의 후속작인 이 제품은 배터리 성능과 통화품질 향상이 대표적인 개선점이다. 58㎃h 배터리의 전작이 6시간 재생이었는데, 85㎃h 배터리를 장착한 갤럭시버즈+는 11시간 동안 음악을 들을 수 있다. 케이스 충전까지 포함하면 22시간이다. 통화품질을 높이기 위해 마이크는 기존 2개(내부 1개·외부 1개)에서 3개(내부 1개·외부 2개)로 늘렸다. 갤럭시버즈는 아이폰에서도 이용이 가능했는데, 여기에 애플 iOS 전용 앱을 선보이며 아이폰과의 호환성도 늘렸다.     LG 톤플러스 프리    LG전자는 지난해 10월 프리미엄 무선이어폰 ‘LG 톤플러스 프리’를 출시했다. 5분 충전으로 1시간을 이용할 수 있도록 고속 충전을 지원하고, 소음 제거 마이크를 추가해 향상된 통화품질을 제공한다. 또 ‘IPX4’ 등급의 방수 기능, 터치패드 조작 등도 추가됐다. LG전자는 올해 초 미국에 이어 유럽과 아시아 지역 등으로 시장을 확장해 나갈 계획이다.  애플은 지난해 3월 ‘에어팟 2세대’에 헤드폰과 이어폰 전용으로 개발된 ‘H1 칩’을 탑재해 연결 시간 단축, 통화 시간 연장, 인공지능(AI) 비서 시리의 음성 호출 기능을 제공했다. 10월 출시된 에어팟 프로에서도 노이즈 캔슬링(소음 제가) 기능 추가 등 개선이 이어졌다.  글로벌 ICT 기업들은 자사의 AI 비서 등 기존 기술과의 호환을 무기로 내세운다. 구글은 올해 상반기에 머신러닝 칩을 내장한 ‘픽셀 버즈 2’를 출시한다. AI 비서 구글 어시스턴트를 활용해 음성 명령으로 길을 찾거나 실시간 외국어 번역을 하는 등의 조작이 가능하다. 음성 통화 시 턱뼈 진동을 통해 음성을 감지하는 기술을 바탕으로 통화 성능도 끌어 올렸다.  MS 역시 올 상반기 새 무선이어폰 ‘서피스 이어버즈’를 선보인다. 자사 소프트웨어인 MS 오피스, AI 비서 코타나와 연동한 제품이다. 아마존은 지난해 AI 비서 알렉사와 노이즈 캔슬링, 생활방수 기능을 탑재한 ‘에코버즈’를 시장에 내놓았다. 이밖에 소니도 내부와 외부에 2개의 노이즈 캔슬링 센서를 탑재한 제품을 내놓았고, 국내 중소기업들도 시장에 가세하는 모습이다.     갤럭시 Z 플립 톰 브라운 에디션    애플과 삼성 등 주요 스마트폰 제조업체들은 스마트폰과 무선이어폰, 스마트워치 등을 패키지화하며 각자의 생태계 구축에 힘쓰고 있다. 고객 충성도를 기반으로 제품군 다양화에 나서는 셈이다. 삼성전자는 최근 언팩 행사에서 명품 패션 브랜드 ‘톰 브라운’과 협업해 프리미엄 패키지 ‘갤럭시 Z 플립 톰 브라운 에디션’을 선보였다. 갤럭시 Z 플립와 스마트워치인 ‘갤럭시 워치 액티브2’와 ‘갤럭시버즈+’가 한 세트다. 이 제품은 한국 등 일부 국가에서 한정 판매된다.  LG전자의 경우 스마트폰 사업에 내실을 기하는 모습이다. 최근 일부 해외 언론에 유출된 LG전자의 차기작 ‘LG V60 씽큐’의 이미지를 살펴보면 아직 이어폰 잭이 남아 있는 것을 확인할 수 있었다.  웨어러블 기기로 분류되는 스마트워치 시장의 대결도 주목할 만하다. 삼성전자는 지난해 갤럭시 워치 액티브2를 출시하며 달리기 마니아를 위해 LTE(4G) 모델과 ‘언더아머 에디션’을 추가로 출시했다. 애플 또한 애플워치5에서 나이키 및 에르메스와의 협업 아이템을 선보였다.  시장조사업체 가트너에 따르면 스마트워치를 포함한 웨어러블 기기의 글로벌 시장은 내년에 630억달러(약 74조5000억원)에 육박할 것으로 예상된다. 업계 관계자는 “건강에 대한 관심이 커지는 가운데 기업들이 적극적으로 웨어러블 기기와 의료의 결합을 꾀하면서 관련 시장은 더욱 커질 것”이라고 예상했다.   김준영 기자 papenique@segye.comⓒ 세상을 보는 눈, 세계일보세계일보 관련뉴스해당 언론사에서 선정하며 언론사 페이지(아웃링크)로 이동해 볼 수 있습니다.임현주 \'노브라\' 생방송…""용기 응원"" VS ""왜 굳이?""""기생충, 왜 한국어로 찍었나"" 봉준호에게 황당 질문한 美abc방송고유정 ""몸뚱아리 내줬더라면"" 최후진술… 우발적 살인 주장우한 중국인 가족 오는데, 日크루즈선 한국인 못 오는 이유는?아내가 출산할 때 똑같은 진통을 느끼는 남성이 있다?좋아요0훈훈해요0슬퍼요0화나요0후속기사 원해요0기사제공 :']"
2,삼성전자, 2020-02-1621:54,한국경제TV ,삼성 톈진 공장 19일 생산 재개…중국공장 대부분 재가동,https://finance.naver.com/news/news_read.nhn?article_id=0000848474&office_id=215&mode=search&query=삼성전자&page=1,"['       삼성 톈진 공장 19일 생산 재개…중국공장 대부분 재가동      기사입력2020-02-16 21:54기사원문좋아요훈훈해요좋아요 평가하기공감좋아요0훈훈해요0슬퍼요0화나요0후속기사 원해요0댓글[한국경제TV 신동호 기자]코로나 19 사태로 멈춰섰던 국내 기업들의 나머지 중국 공장들도 이번 주 재가동을 시작한다.중국 20여개 성·시가 춘제(春節·중국의 설) 연휴를 9일까지 연장하며 한국 기업들의 공장들도 생산 차질을 빚었으나, 10일부터 대부분 가동을 재개했다.일부 재개 일정이 지연된 공장들도 이번 주 재개할 예정이다. 그러나 가동 중단에 따른 매출 감소 등 피해가 남고, 코로나19 잠복기 격리 등에 따라 인력을 100% 투입하는 완전 정상화에는 시일이 더 걸릴 전망이다.16일 업계에 따르면 삼성전자 톈진(天津) TV 공장이 19일 생산을 재개한다. 톈진 공장은 애초 10일 재가동할 예정이었으나 지방정부의 지침에 따라 연기됐다.쑤저우(蘇州) 가전 공장은 지난 10일부터 재가동 중이며, 쑤저우 반도체 후공정 공장과 시안(西安) 반도체 공장은 코로나19 사태 속에서도 멈추지 않고 가동했다.SK하이닉스 우시(無錫) 반도체 공장 코로나19 사태 속에서도 최소 인력으로 정상 가동했으며, 지난 10일부터는 평일 근무 기준으로 인력을 배치했다.LG전자는 중국 10개 공장 중 톈진 공장을 재개한 공장이 모두 생산을 재개했다. 그러나 톈진 공장은 지방정부 지침에 따라 이번 주에도 아직 재가동 시점이 정해지지 않았다.신동호기자 dhshin@wowtv.co.kr▶ 네이버 홈에서 [한국경제TV] 채널 구독하기 [생방송보기]▶ 대한민국 재테크 총집결! - [증권 / 주식상담 / 부동산]ⓒ 한국경제TV, 무단 전재 및 재배포 금지한국경제TV 관련뉴스해당 언론사에서 선정하며 언론사 페이지(아웃링크)로 이동해 볼 수 있습니다.""심한 독감 수준""...베일 벗는 \'코로나19\' 실체\'고작 3일분\' 코로나19로 혈액 수급 비상…위기대응 가동이재용 삼성 부회장, 프로포폴 투약?...""안했다""29번째 환자, 해외여행·접촉력 없어…\'수퍼전파자?\'""선 넘으면 침범"" 아이유 \'경고\' 날린 이유는?좋아요0훈훈해요0슬퍼요0화나요0후속기사 원해요0기사제공 :']"
3,삼성전자, 2020-02-1621:38,아시아경제 ,올해 카메라 모듈 시장 호평 받는 삼성전기…맞수 LG이노텍 전략은?,https://finance.naver.com/news/news_read.nhn?article_id=0004625281&office_id=277&mode=search&query=삼성전자&page=1,"['       올해 카메라 모듈 시장 호평 받는 삼성전기…맞수 LG이노텍 전략은?      기사입력2020-02-16 21:38기사원문좋아요훈훈해요좋아요 평가하기공감좋아요0훈훈해요0슬퍼요0화나요0후속기사 원해요0댓글 [아시아경제 이기민 기자] 삼성전자가 최근 출시한 스마트폰 신제품 ‘갤럭시S20 울트라’에 역대 최고 화소의 후면카메라가 장착되면서 이를 뒷받침하는 카메라 모듈의 제조사 삼성전기도 함께 주목을 받고 있다.삼성전기의 맞수이자 애플 등에 카메라 모듈을 공급하고 있는 LG이노텍도 올해 초고성능 카메라 모듈을 선보일 것으로 예상된다.삼성전자가 최근 출시한 갤럭시S20의 최상위 버전인 갤럭시S20 울트라에는 1억800만 화소 광각카메라, 4800만 화소 망원 카메라, 1200만 화소 초광각 카메라, 3D 뎁스비전 카메라를 적용한 후면 쿼드라플 카메라가 적용됐다.갤럭시S20 울트라의 1억800만 화소 초고화소 이미지센서를 지원하기 위해 삼성전기는 완전히 바뀐 카메라 모듈 구조와 10배 광학줌이 첫 탑재됐다. 카메라 모듈은 이미지센서와 통해 들어온 이미지를 디지털신호로 변환시키는 부품으로 휴대폰, 스마트폰 등에서 사진 및 동영상 촬영 용도로 주로 사용된다. 기본적으로 카메라 렌즈를 구동시켜주고 흔들림과 충격을 방지해 촬영한 이미지를 구현할 수 있게 도와주는 역할을 한다.삼성전기는 삼성전자 외에도 중국업체인 샤오미, 오포 등에도 카메라 모듈을 공급한다. 이번 샤오미가 5G 플래그십으로 내놓은 ‘Mi10’에도 1억800만 화소 광각 카메라가 탑재됐다. 이에 따라 카메라 모듈의 단가가 상승할 것으로 전망되고 삼성전기의 2020년 1분기 실적에도 반영될 것으로 전망된다.카메라모듈 부분에서 삼성전기의 맞수로 꼽히는 LG이노텍도 광학솔루션 사업부에 대규모 투자하면서 시장경쟁력을 높인다는 방침이다. 이에 따라 고부가 카메라 모듈 개발과 생산에 박차를 가할 것으로 보인다.LG이노텍은 이달 13일 광학솔루션 사업 경쟁력 지속 강화와 시장 수요 대응을 위해 올해 4798억원을 신규 시설 투자할 계획이라고 공시한 바 있다. LG이노텍은 애플, 화웨이, LG전자에 카메라모듈 등 광학 부품을 납품한다.LG이노텍 광학솔루션 사업부의 매출 비중 65%가량을 차지하는 고객사 애플이 이례적으로 올해 상·하반기에 각각 아이폰 신제품을 출시할 계획하고 있다. 올해 애플이 새로운 기술이 포함된 아이폰을 출시할 가능성이 거론됨에 따라 LG이노텍도 이에 맞는 카메라 모듈 개발과 생산을 할 가능성이 높은 상황이다.우선 시장에서는 증강현실(AR), 가상현실(VR) 기능이 올해 출시될 아이폰과 아이패드에 적용될 전망이 나온다. 이를 구현하는 기술로는 ToF(Time of Flight, 비행시간 거리측정)이 꼽힌다. ToF는 사진이나 동영상을 촬영할 때 피사체를 향해 발사한 빛이 반사돼 돌아오는 시간을 계산해 이미지의 입체감 등을 높이는 기술이다. LG이노텍은 이를 구현할 ToF 카메라 모듈 공급량을 확대한다는 계획이다. 또한 안정감 있는 이미지 구현을 위해 손떨림 방지 기능이 강화된 카메라 모듈 제품 개발에 박차를 가할 것으로 보인다.이기민 기자 victor.lee@asiae.co.kr▶ 2020년 신년운세·사주·무료 토정비결 보러가기▶ 네이버에서 아시아경제 뉴스를 확인하세요. ▶ 놀 준비 되었다면 드루와! 드링킷!<ⓒ경제를 보는 눈, 세계를 보는 창 아시아경제 무단전재 배포금지>아시아경제 관련뉴스해당 언론사에서 선정하며 언론사 페이지(아웃링크)로 이동해 볼 수 있습니다.아들 졸업식에 나타난 이부진, 학부모들과…\'눈길\'""좀 보이면 어때"" 당당히 속옷 벗어 던진 아나운서""韓 내전 일어나 몰락할 수도"" 안철수, 또 예언\'시신 8구\' 영상 몰래 찍었던 中 시민기자…또?\'中 통계 보느니 차라리…\' 한국 자료 요청한 WHO좋아요0훈훈해요0슬퍼요0화나요0후속기사 원해요0기사제공 :']"
4,삼성전자, 2020-02-1621:30,세계일보 ,"정의선, 현대차 의장직 물려받나…삼성전자 차기 의장직엔 누가?",https://finance.naver.com/news/news_read.nhn?article_id=0003439015&office_id=022&mode=search&query=삼성전자&page=1,"['       정의선, 현대차 의장직 물려받나…삼성전자 차기 의장직엔 누가?      기사입력2020-02-16 21:30기사원문좋아요훈훈해요좋아요 평가하기공감좋아요0훈훈해요0슬퍼요0화나요0후속기사 원해요0댓글정몽구 현대차 회장, 이사회 의장 임기 내달 만료    현대자동차 정의선 수석부회장. 현대자동차그룹 제공     현대자동차와 삼성전자 이사회 의장이 누가 될지 주목된다.    우선 현대자동차의 경우 정몽구 현대차그룹 회장 겸 이사회 의장이 재선임될지, 아들인 정의선 수석부회장이 의장직까지 넘겨받아 명실상부 최고경영자(CEO)로 자리잡을지가 관건이다.   16일 현대차그룹에 따르면 정몽구 회장의 현대차 사내이사 임기는 다음 달 16일 만료된다. 재선임 여부는 이달 이사회와 다음 달 18일로 예상되는 주총에서 결정된다.   정 회장은 1999년 3월부터 현대차 이사회 의장을 맡아 현대차그룹을 세계적인 자동차 회사로 키워냈지만 근래에는 바깥에 목소리를 내지 않고 있다.   정 회장이 현대차 이사회 의장에서 물러나고 정의선 수석부회장이 후임 의장에 오르면 명실상부 ‘원톱’ 경영자로 자리매김하게 된다.    정의선 수석부회장은 2018년 9월 현대차 부회장에서 현대차그룹 수석부회장으로 승진했고, 지난해 주총에서 현대차와 현대모비스 대표이사로 선임된 뒤 사실상 그룹 경영을 진두지휘하고 있다.   한편 삼성의 경우 이상훈 삼성전자 이사회 의장이 사임하면서 차기 의장이 누가 될지 관심이 쏠린다.   지난 14일 삼성전자는 이상훈 의장이 이사회에 사내이사를 포함한 이사회 의장직에서 사임하겠다는 의사를 전달했다고 밝혔다.   앞서 이 의장은 지난해 12월 서울중앙지법 형사합의23부 1심에서 삼성전자서비스 노조 와해 의혹으로 1년 6개월 형을 선고받고 법정 구속됐다.   이에 따라 선임일이 가장 빠른 박재완 사외이사가 의장직을 대행해 이사회를 진행해왔다.   재계 일각의 김기남 부회장이나 박재완 전 장관이 후임 이사회 의장으로 선임될 가능성이 거론된다.   양봉식 기자 yangbs@segye.comⓒ 세상을 보는 눈, 세계일보세계일보 관련뉴스해당 언론사에서 선정하며 언론사 페이지(아웃링크)로 이동해 볼 수 있습니다.임현주 \'노브라\' 생방송…""용기 응원"" VS ""왜 굳이?""""기생충, 왜 한국어로 찍었나"" 봉준호에게 황당 질문한 美abc방송고유정 ""몸뚱아리 내줬더라면"" 최후진술… 우발적 살인 주장우한 중국인 가족 오는데, 日크루즈선 한국인 못 오는 이유는?아내가 출산할 때 똑같은 진통을 느끼는 남성이 있다?좋아요0훈훈해요0슬퍼요0화나요0후속기사 원해요0기사제공 :']"
