,회사명,날짜,언론사,기사제목,링크,본문
1,삼성전자, 2020-01-1309:52,SBS Biz ,LG전자 올레드 TV 6년 연속 ‘CES 최고 TV’ 선정,https://finance.naver.com/news/news_read.nhn?article_id=0000202576&office_id=374&mode=search&query=삼성전자&page=10,"['       LG전자 올레드 TV 6년 연속 ‘CES 최고 TV’ 선정      기사입력2020-01-13 09:52기사원문좋아요훈훈해요좋아요 평가하기공감좋아요0훈훈해요0슬퍼요0화나요0후속기사 원해요0댓글■ 경제와이드 이슈& \'기업 이슈\'◇ \'최고가 경신\' 삼성전자, 세계 시총 18위로삼성전자가 글로벌 시가총액 순위 20위권 안으로 진입했습니다.블룸버그에 따르면 삼성전자는 지난 9일 종가 기준으로 글로벌 시가총액 순위 18위에 오르며 지난해 초 28위에서 10계단 상승했습니다.삼성전자의 시가총액은 약 1년 만에 950억 8천만 달러우리 돈 118조 5002억 원 늘었습니다.삼성전자는 1년 새 미국 인텔을 비롯해 AT&T와 버라이즌을 제치고 업계의 덩치를 키워가고 있습니다증권가에선 이대로 실적 개선 흐름이 이어진다면 추가 주가 상승이 가능할 것으로 전망합니다.삼성전자 연일 사상 최고가 기록을 세워가고 있는데요.지난주 금요일 장에서는 1.54% 오르며 5만 9500원에 마감됐습니다.◇ LG전자, CES서 최고 혁신상 등 119개 수상LG전자는 미국 라스베이거스에서 열린 세계 최대 가전·IT 전시회 \'CES 2020\'에서 혁신상을 대거 수상했습니다LG전자는 CES에서 주관사인 미국 소비자기술협회(CTA)가 주는 \'CES 최고 혁신상\'과 \'CES 혁신상\' 등 16개를 포함해 모두 119개의 어워드를 받았습니다.특히 TV제품의 수상이 눈에 띄었는데요.LG 올레드 TV는 \'CES 2020 최고상\'을 받으며 6년 연속 CES 최고 TV에 선정됐습니다.기술력을 인정받은 LG전자 상승 마감했습니다 종가 0.3% 오르며 6만 6800원이었습니다.◇ SK텔레콤, 美 현지 디지털 방송시장 공략SK텔레콤이 미국 최대 지상파 방송사 싱클레어 방송그룹과 함께 미국 디지털TV 방송 시장을 공략합니다.SK텔레콤은  ""싱클레어와의 합작 회사 이름을 \'캐스트닷에라(Cast.era)\'로 정하고 이달 초 미국 버지니아주 알링턴에 사무소를 마련했다""고 밝혔습니다.SK텔레콤과 싱클레어의 합작회사는 올해 상반기 중으로 미국 최초의 ‘통신-방송 기반 고화질 방송 서비스’ 제공을 목표로 하고 있는데요.SK텔레콤은 차세대 방송 표준 규격인 ATSC 3.0 기반의 솔루션과 장비를 현지 방송국에 공급하는 방식으로미디어 사업 영역을 확대해나갈 예정입니다.전 장에서는 0.43% 하락 마감했습니다.종가는 23만 천 원입니다.◇ 롯데마트, 외국인 겨냥 \'허니버터아몬드\' 전문점 열어롯데마트는 업계 최초로 서울역점과 김포공항점에 \'허니버터아몬드\' 전문 매장을 엽니다.롯데마트가 전문매장을 여는 것은 2018∼2019년 외국인이 구매한 간식 상품 가운데허니버터아몬드의 매출이 가장 높았기 때문인데요.허니버터아몬드는지난 2018년 서울역점에서 중국인이 가장 많이 구매한 상품에 선정됐고지난해 5월에는 아랍에미리트 만수르 왕자가 허니버터아몬드와 함께 사진을 찍어 중동에서도 관심이 높아진 바 있습니다.롯데마트는 외국인 방문 비중이 높은 서울역과 김포공항점에서 56개 종류의 허니버터아몬드를 선보이고 공책과 연필, 인형 등 관련 굿즈도 함께 판매할 예정입니다.롯데마트의 법인인 모기업인 롯데 쇼핑입니다.1.15% 하락하며 종가 12만 8천 5백 원에 마무리됐습니다.      ☞ SBSCNBC를 만나는 법 [홈][네이버구독]☞ 경제를 실험한다~ #머니랩[네이버 TV] 저작권자 SBS미디어넷 & SBS I&M 무단전재-재배포 금지SBS Biz 관련뉴스해당 언론사에서 선정하며 언론사 페이지(아웃링크)로 이동해 볼 수 있습니다.[픽] 필리핀 \'탈 화산 폭발\' 8천명 대피…마닐라 공항 폐쇄""전세금 안주면 대신 돌려줘요""…공적보증상품 6월 출시\'사상 최고치\' 삼성전자 주식…1년새 51% 급등 배경은피해자도 판매사도 ""억울하다""…라임사태 소송전 본격화[내 집 가치] 새해 반드시 알아야 할 \'무주택자 행동강령\'좋아요0훈훈해요0슬퍼요0화나요0후속기사 원해요0기사제공 :']"
2,삼성전자, 2020-01-1309:51,MBN ,"코스피, 상승세 이어가기…장중 2,210선 돌파하며 강세 흐름",https://finance.naver.com/news/news_read.nhn?article_id=0001411393&office_id=057&mode=search&query=삼성전자&page=10,"['       코스피, 상승세 이어가기…장중 2,210선 돌파하며 강세 흐름      기사입력2020-01-13 09:51기사원문좋아요훈훈해요좋아요 평가하기공감좋아요0훈훈해요0슬퍼요0화나요0후속기사 원해요0댓글 코스피가 오늘(13일) 하락세로 출발한 후 상승세로 돌아섰습니다.이날 오전 9시 21분 기준 코스피는 전 거래일보다 0.32포인트(0.01%) 오른 2,206.71을 가리켰습니다.지수는 전장보다 1.90포인트(0.09%) 내린 2,204.49로 출발했다가 상승세로 돌아섰습니다. 장 한때 2,210선을 돌파하는 등 대체로 강세 흐름을 이어가고 있습니다.유가증권시장에서는 개인과 외국인이 각각 373억 원, 262억 원을 순매수했습니다. 기관은 594억 원어치를 순매도했습니다.이경민 대신증권 연구원은 ""미국 고용 지표 부진과 이란의 여객기 격추 사건이 투자심리를 위축시키는 요소""라며 ""2,200선에서 추가 상승 동력을 확보하기가 쉽지 않아 보인다""고 분석했습니다.서상영 키움증권 연구원은 ""지난주 금요일 미국 주식시장에서는 시장조사업체 팩트셋이 4분기 기업 실적 전망치를 하향 조정했고 높은 평가 가치(밸류에이션) 부담에 차익 매물이 나온 게 부담이 됐다""며 ""한국 주식시장에도 이런 점이 부담으로 작용해 매물 소화 과정을 겪을 수 있다""고 분석했습니다.시가총액 상위 종목 가운데 삼성전자(0.17%), 현대차(0.44%), LG화학(1.85%), 셀트리온(1.41%), LG생활건강(2.16%) 등은 올랐습니다.SK하이닉스(-0.40%), 네이버(-0.27%), 포스코(-1.26%) 등은 내렸습니다.업종별로는 운수·창고(1.15%), 화학(0.91%), 섬유·의복(0.62%) 등은 올랐고, 보험(-0.82%), 금융업(-0.60%), 철강·금속(-0.66%) 등은 내렸습니다.같은 시각 코스닥지수는 전장보다 0.78포인트(0.12%) 오른 673.81을 나타냈습니다.지수는 전장보다 0.73포인트(0.11%) 오른 673.76으로 개장해 상승세를 유지하고 있습니다.코스닥시장에서는 개인이 352억 원을 순매수하고, 외국인과 기관은 각각 237억 원, 36억 원을 순매도했습니다.시총 상위주 중에는 셀트리온헬스케어(0.58%), 스튜디오드래곤(0.95%), 메디톡스(1.19%), 헬릭스미스(0.87%), 파라다이스(1.65%) 등은 올랐습니다.에이치엘비(-0.71%), CJ ENM(-0.26%), 펄어비스(-0.99%), 케이엠더블유(-1.24%), SK머티리얼즈(-1.55%) 등은 내렸습니다.[MBN 온라인뉴스팀]▶네이버 메인에서 MBN뉴스를 만나보세요!▶MBN 무료 고화질 온에어 서비스 GO!▶파격 특가 비디오! 재미를 팝니다! 오세요 \'ㅋㅋ마켙\'< Copyright ⓒ MBN(www.mbn.co.kr) 무단전재 및 재배포 금지 >MBN 관련뉴스해당 언론사에서 선정하며 언론사 페이지(아웃링크)로 이동해 볼 수 있습니다.황교안, 불교계 설선물로 \'육포\' 보내…긴급 회수 소동심재철 대검 부장 ""조국 불기소""… 후배들 ""당신이 검사냐"" 질타연세와인·고대참기름…입소문에 인기 명절선물 된 \'대학 굿즈\'윤석열 ""대검 중간간부 모두 남겨달라"" 법무부에 \'의견\'태연·샤이니 키, SM대표 훈훈한 남매…변함없는 우정좋아요0훈훈해요0슬퍼요0화나요0후속기사 원해요0기사제공 :']"
3,삼성전자, 2020-01-1309:46,아시아경제 ,"[특징주]엔텔스, 최대주주 변경 소식에 상한가",https://finance.naver.com/news/news_read.nhn?article_id=0004604587&office_id=277&mode=search&query=삼성전자&page=10,"['       [특징주]엔텔스, 최대주주 변경 소식에 상한가      기사입력2020-01-13 09:46기사원문좋아요훈훈해요좋아요 평가하기공감좋아요0훈훈해요0슬퍼요0화나요0후속기사 원해요0댓글 [아시아경제 구은모 기자] 엔텔스가 최대주주 변경 소식에 상한가를 기록했다.13일 오전 9시40분 현재 엔텔스는 전 거래일 대비 29.63%(2800원) 오른 1만2250원에 거래됐다.엔텔스는 지난 10일 최대주주 심재희씨가 에치에프알에 회사 주식 19.43%(134만주)를 265억원에 매각했다고 공시를 통해 밝혔다. 엔텔스는 2000년 SK텔레콤 사내벤처팀에서 분사된 회사로 국내 이동통신3사와 삼성전자, 노키아 등 글로벌 네트워크장비사가 주요 고객사로 두고 있다.구은모 기자 gooeunmo@asiae.co.kr▶ 2020년 경자년(庚子年), 나의 신년운세와 토정비결은?▶ 네이버에서 아시아경제 뉴스를 확인하세요. ▶ 놀 준비 되었다면 드루와! 드링킷!<ⓒ경제를 보는 눈, 세계를 보는 창 아시아경제 무단전재 배포금지>아시아경제 관련뉴스해당 언론사에서 선정하며 언론사 페이지(아웃링크)로 이동해 볼 수 있습니다.강용석 \'가세연\', 최태원 \'다른 내연녀\' 언급했다가…손석희 ""조국 정국, 나로서는…"" 담담히 밝힌 속내""조국 눈물난다"" 나다은, 한국당 입당 3일만에 \'아웃\'\'우르르\' 몰려든 中관광객…순식간에 물건 \'싹쓸이\'""김정은, 생일 가지고 장난 친다 생각…격한 반응""좋아요0훈훈해요0슬퍼요0화나요0후속기사 원해요0기사제공 :']"
4,삼성전자, 2020-01-1309:45,스포츠서울 ,"삼성전자, 전 임원 '준법실천' 서약식…준법감시위, 다음달부터 본격 진행",https://finance.naver.com/news/news_read.nhn?article_id=0000614614&office_id=468&mode=search&query=삼성전자&page=10,"[""       삼성전자, 전 임원 '준법실천' 서약식…준법감시위, 다음달부터 본격 진행      기사입력2020-01-13 09:45기사원문좋아요훈훈해요좋아요 평가하기공감좋아요0훈훈해요0슬퍼요0화나요0후속기사 원해요0댓글13일 수원 ‘삼성 디지털시티’에서 열린 ‘삼성전자 준법실천 서약식’에 참석한 삼성전자 대표이사들이 서약서에 서명하고 있다. 제공|삼성전자[스포츠서울 이선율기자]삼성전자가 13일 ‘준법실천 서약식’을 열고 준법경영에 대한 실천 의지를 드러냈다.삼성전자에 따르면 김기남 부회장, 김현석 사장, 고동진 사장 등은 이날 오전 경기 수원 ‘삼성 디지털시티’에서 열린 행사에서 준법실천 서약서에 직접 서명했다. 나머지 임원들은 전자서명으로 동참했다.삼성전자는 ‘법과 원칙의 준수’가 조직문화로 확실하게 자리잡을 수 있도록 하기 위해 준법경영 서약식을 마련했다고 밝혔다. 사장단과 전 임원이 서약한 것은 조직의 책임자는 법·원칙에 저촉되는 어떤 의사결정이나 행위를 해서는 안된다는 내부 통제를 강화한 것이라는 설명이다.준법실천 서약의 주요 내용은 ▲국내·외 제반 법규와 회사 규정을 준수하고 ▲위법 행위를 지시하거나 인지한 경우 묵과하지 않으며 ▲사내 준법문화 구축을 위해 솔선수범하겠다는 것이다.이날 삼성전자를 비롯해 삼성전기, 삼성SDS, 삼성물산도 회사별로 준법실천 서약식을 열었다. 삼성SDI, 삼성생명, 삼성화재도 순차적으로 서약에 동참할 예정이다.한편 김지형 전 대법관이 위원장을 맡은 독립적인 외부 감시기구로 출범하는 삼성준법감시위원회는 다음 달부터 본격적인 활동에 들어간다.삼성전자를 비롯한 7개 계열사가 이달 중 이사회를 거쳐 준법감시위원회 설립·운영에 관한 협약을 체결할 예정이다. 협약을 맺는 7개 계열사는 준법감시위원회로부터 감독을 받게 된다. 준법감시위는 최고경영진의 준법위반 리스크를 파악하고 직접 조사 등을 통해 의견을 제시한다. melody@sportsseoul.com[기사제보 news@sportsseoul.com]  Copyright ⓒ 스포츠서울&sportsseoul.com스포츠서울 관련뉴스해당 언론사에서 선정하며 언론사 페이지(아웃링크)로 이동해 볼 수 있습니다.고등학교 미술 교사였던 그녀, 돌연 링에서…김학범호 조기 8강 확정 이끈 최고 별들'버닝썬 사태' 승리, 오늘 다시 구속 갈림길강소라, '셀카 바보' 질문에 폭소한 사연고소영, '♥장동건' 카톡 논란에 SNS 상황좋아요0훈훈해요0슬퍼요0화나요0후속기사 원해요0기사제공 :""]"
5,삼성전자, 2020-01-1309:40,한국경제 ,"삼성전자 사장단, 준법 실천 서약…""법·원칙 준수 조직문화로""",https://finance.naver.com/news/news_read.nhn?article_id=0004272591&office_id=015&mode=search&query=삼성전자&page=10,"['       삼성전자 사장단, 준법 실천 서약…""법·원칙 준수 조직문화로""      기사입력2020-01-13 09:40기사원문좋아요훈훈해요좋아요 평가하기공감좋아요0훈훈해요0슬퍼요0화나요0후속기사 원해요0댓글독립적 외부 감시기구 다음 달부터 본격적 활동13일 수원 \'삼성 디지털시티\'에서 열린 \'삼성전자 준법실천 서약식\'에 참석한 삼성전자 대표이사들이 서약서에 서명하고 있다. 왼쪽부터 김현석 삼성전자 사장, 김기남 부회장, 고동진 사장/사진제공=삼성전자삼성이 준법감시위원회를 출범시킨 데 이어 전사 차원의 준법실천서약을 체결해 준법경영 의지를 다졌다.김기남 삼성전자 부회장, 김현석 삼성전자 사장, 고동진 삼성전자 사장은 13일 오전 경기 수원 삼성 디지털시티에서 \'준법실천 서약식\'을 열고 서약서에 직접 서명했다. 나머지 임원들도 전자서명 방식으로 동참했다.준법실천 서약의 주요 내용은 △국내외 제반 법규와 회사 규정을 준수하며 △위법 행위를 지시하거나 인지한 경우 묵과하지 않고 △사내 준법문화 구축을 위해 솔선수범하겠다는 것이다.삼성전자는 \'법과 원칙 준수\'가 조직 문화로 자리잡을 수 있도록 이같은 서약을 체결했다고 전했다.삼성전자 외에 삼성전기, 삼성SDS, 삼성물산도 회사별로 서약식을 열었다. 향후 삼성 SDI, 삼성생명, 삼성화재 역시 순차적으로 서약에 동참한다.지난 9일 김지형 전 대법관이 위원장을 맡아 출범한 독립적 외부 감시기구 삼성준법감시위원회는 다음달부터 본격 활동에 들어간다.삼성전자를 비롯한 7개 계열사는 이달 중 이사회를 거쳐 준법감시위 설립 및 운영에 관한 협약을 체결할 방침이다.협약을 체결한 7개 계열사는 준법감시위로부터 준법감시 및 통제 업무가 실효적으로 이뤄질 수 있도록 감독을 받게 된다.준법감시위는 △최고경영진의 준법의무 위반 리스크 파악 △대외후원금 지출 및 내부거래 등 준법의무 위반 리스크가 높은 사안 검토 등을 통해 각사 이사회에 의견을 제시할 예정이다.배성수 한경닷컴 기자 baebae@hankyung.com▶ 네이버에서 한국경제 뉴스를 받아보세요▶ 한경닷컴 바로가기  ▶ 모바일한경 구독신청 ⓒ 한국경제 & hankyung.com, 무단전재 및 재배포 금지한국경제 관련뉴스해당 언론사에서 선정하며 언론사 페이지(아웃링크)로 이동해 볼 수 있습니다.""아파트에 붙박이장 만들면…"" 풍수전문가 경고트럼프 또…""부자나라 한국이 뺏어갔다""5억 9000만원 용인아파트…한 달 만에일본, 망신 당했다 ""개최국 아니었으면…""""일본서 고객들 넘어온다""…깜짝 놀랄 사실좋아요0훈훈해요0슬퍼요0화나요0후속기사 원해요0기사제공 :']"
6,삼성전자, 2020-01-1309:40,이데일리 ,[이데일리N] 아름다운 하모니 '이데일리 신년음악회' 성황 外,https://finance.naver.com/news/news_read.nhn?article_id=0004553772&office_id=018&mode=search&query=삼성전자&page=10,"['       [이데일리N] 아름다운 하모니 \'이데일리 신년음악회\' 성황 外      기사입력2020-01-13 09:40기사원문좋아요훈훈해요좋아요 평가하기공감좋아요0훈훈해요0슬퍼요0화나요0후속기사 원해요0댓글 [이데일리N]1. 한은 “인구 고령화가 23년간 실질금리 3%포인트 떨어뜨려”2. 외국인, 지난달 주식 8천억 순매수…5개월 만에 매수3. 12·16대책 한 달, 서울 고가아파트 거래비중 반토막4. 현대차, 5년 내 북미에서 100만대 판매5. K바이오, 中서 잇따른 임상 3상 본격화6. 삼성전자, 기업가치 세계 18위…1년새 10계단↑7. 아름다운 하모니 ‘이데일리 신년음악회’ 성황간추린 소식-LG전자, CES서 최고 혁신상 등 119개 수상-강경화, 오늘 한미외교장관회담 위해 미국행-SUV 10대 중 1대 ‘전기·수소차’-현대硏 “글로벌 기업부채, 부채 산사태 겪을 수도”김태완 (wani07@edaily.co.kr)네이버 홈에서 ‘이데일리’ 뉴스 [구독하기▶]꿀잼가득 [영상보기▶] , 청춘뉘우스~ [스냅타임▶]＜ⓒ종합 경제정보 미디어 이데일리 - 무단전재 & 재배포 금지＞이데일리 관련뉴스해당 언론사에서 선정하며 언론사 페이지(아웃링크)로 이동해 볼 수 있습니다.[줌인]은마 96배 오를때 삼성전자 804배 뛰었다[단독]이세돌 은퇴 부른 한국기원 \'정관\', 조사 받는다수업 중 아동에게 \'신체 훼손\' 영상 보여준 강사진중권 ""민주당 영입인재? 일회용 껌..단물 빠지면 끝""음문석, \'미우새\' 새 아들 합류…첫 등장부터 팬티 바람좋아요0훈훈해요0슬퍼요0화나요0후속기사 원해요0기사제공 :']"
7,삼성전자, 2020-01-1309:40,YTN ,삼성전자 '준법실천 서약식' 개최,https://finance.naver.com/news/news_read.nhn?article_id=0001387662&office_id=052&mode=search&query=삼성전자&page=10,"['       삼성전자 \'준법실천 서약식\' 개최      기사입력2020-01-13 09:40기사원문좋아요훈훈해요좋아요 평가하기공감좋아요0훈훈해요0슬퍼요0화나요0후속기사 원해요0댓글 삼성전자가 전사 차원의 \'준법실천 서약식\'을 열고 준법경영 실천을 강조했습니다.삼성전자는 오늘 오전 경기도 수원 \'삼성 디지털시티\'에서 김기남 부회장 등 주요 임직원들이 참석한 가운데 준법실천 서약식 행사를 열었습니다.서약의 주요 내용은 법규와 회사 규정을 준수하고 위법 행위를 알게 된 경우 그냥 넘어가지 않으며 준법 문화를 위해 솔선수범하겠다는 다짐 등입니다.같은 취지로 추진되는 삼성의 외부감시기구 \'삼성 준법감시위원회\'는 위원장을 맡은 김지형 전 대법관 등 7명의 위원을 내정하고 다음 달부터 본격적인 활동에 돌입합니다.김태민 [tmkim@ytn.co.kr] ▶ 대한민국 24시간 뉴스 채널 YTN 생방송보기  ▶ 네이버에서 YTN 뉴스 채널 구독하기  ▶ YTN 뉴스레터 구독하면 2020년 토정비결 전원 당첨! [저작권자(c) YTN & YTN PLUS 무단전재 및 재배포 금지]YTN 관련뉴스해당 언론사에서 선정하며 언론사 페이지(아웃링크)로 이동해 볼 수 있습니다.""에어팟, 이모티콘 금지""…모 대학 \'군기 잡기\' 논란아베 ""아빠는 애인·엄마는 옛애인과 투표""수도권 아파트서 연쇄절도…범인이 노린 차는?현직 부장판사 \'추미애 비판\' 하며 SNS에 올린 글원어민 강사, 유치원생에게 엽기적인 영상 틀어 논란좋아요0훈훈해요0슬퍼요0화나요0후속기사 원해요0기사제공 :']"
8,삼성전자, 2020-01-1309:35,연합뉴스 ,"코스피, 상승 동력 이어가기…장중 2,210선 돌파(종합)",https://finance.naver.com/news/news_read.nhn?article_id=0011330586&office_id=001&mode=search&query=삼성전자&page=10,"['       코스피, 상승 동력 이어가기…장중 2,210선 돌파(종합)      기사입력2020-01-13 09:35기사원문좋아요훈훈해요좋아요 평가하기공감좋아요0훈훈해요0슬퍼요0화나요0후속기사 원해요0댓글코스피 상승 (PG)[제작 최자윤] 일러스트(서울=연합뉴스) 김기훈 기자 = 코스피가 13일 하락세로 출발한 후 상승세로 돌아섰다.    이날 오전 9시 21분 현재 코스피는 전 거래일보다 0.32포인트(0.01%) 오른 2,206.71을 가리켰다.    지수는 전장보다 1.90포인트(0.09%) 내린 2,204.49로 출발했다가 상승세로 돌아섰다. 장 한때 2,210선을 돌파하는 등 대체로 강세 흐름을 이어가고 있다.    유가증권시장에서는 개인과 외국인이 각각 373억원, 262억원을 순매수했다. 기관은 594억원어치를 순매도했다.    이경민 대신증권 연구원은 ""미국 고용 지표 부진과 이란의 여객기 격추 사건이 투자심리를 위축시키는 요소""라며 ""2,200선에서 추가 상승 동력을 확보하기가 쉽지 않아 보인다""고 분석했다.    서상영 키움증권 연구원은 ""지난주 금요일 미국 주식시장에서는 시장조사업체 팩트셋이 4분기 기업 실적 전망치를 하향 조정했고 높은 평가 가치(밸류에이션) 부담에 차익 매물이 나온 게 부담이 됐다""며 ""한국 주식시장에도 이런 점이 부담으로 작용해 매물 소화 과정을 겪을 수 있다""고 분석했다.    시가총액 상위 종목 가운데 삼성전자(0.17%), 현대차(0.44%), LG화학(1.85%), 셀트리온(1.41%), LG생활건강(2.16%) 등은 올랐다.    SK하이닉스(-0.40%), 네이버(-0.27%), 포스코(-1.26%) 등은 내렸다.    업종별로는 운수·창고(1.15%), 화학(0.91%), 섬유·의복(0.62%) 등은 올랐고, 보험(-0.82%), 금융업(-0.60%), 철강·금속(-0.66%) 등은 내렸다.    같은 시각 코스닥지수는 전장보다 0.78포인트(0.12%) 오른 673.81을 나타냈다.    지수는 전장보다 0.73포인트(0.11%) 오른 673.76으로 개장해 상승세를 유지하고 있다.    코스닥시장에서는 개인이 352억원을 순매수하고, 외국인과 기관은 각각 237억원, 36억원을 순매도했다.        시총 상위주 중에는 셀트리온헬스케어(0.58%), 스튜디오드래곤(0.95%), 메디톡스(1.19%), 헬릭스미스(0.87%), 파라다이스(1.65%) 등은 올랐다.    에이치엘비(-0.71%), CJ ENM(-0.26%), 펄어비스(-0.99%), 케이엠더블유(-1.24%), SK머티리얼즈(-1.55%) 등은 내렸다.    kihun@yna.co.kr▶확 달라진 연합뉴스 웹을 만나보세요▶네이버 [연합뉴스] 채널 구독   ▶뭐 하고 놀까? #흥연합뉴스 관련뉴스해당 언론사에서 선정하며 언론사 페이지(아웃링크)로 이동해 볼 수 있습니다.\xa0남한에 산타가 있다면 북한엔 \'00 할아버지\'가 있다\xa0KB손보 29일 자동차보험료 인상…다른 손보사는?\xa0임택근 빈소에 임재범·손지창…복잡한 가족사 재조명\xa0김연경, 복근 찢어진 상태서 진통제 투혼\xa0가수 승리, 작년엔 구속 피했지만 오늘은?좋아요0훈훈해요0슬퍼요0화나요0후속기사 원해요0기사제공 :']"
