,회사명,날짜,언론사,기사제목,링크,본문
4,삼성전자, 2020-05-2512:20,머니투데이 ,카카오↑삼성전자↓…요즘 증시 '가치투자' 상식이 안 통한다,https://finance.naver.com/news/news_read.nhn?article_id=0004414120&office_id=008&mode=search&query=삼성전자&page=5,"['       카카오↑삼성전자↓…요즘 증시 \'가치투자\' 상식이 안 통한다      기사입력2020-05-25 12:20기사원문좋아요훈훈해요좋아요 평가하기공감좋아요0훈훈해요0슬퍼요0화나요0후속기사 원해요0댓글 [머니투데이 김사무엘 기자] [[오늘의 포인트]] (성남=뉴스1) 조태형 기자 = \'이태원 클럽발\' 신종 코로나바이러스 감염증 (코로나19) 확진자가 급증함에 따라 정상 출근을 계획했던 카카오와 네이버가 순환근무제 연장을 결정했다. 지난 11일 오전 경기도 성남시 카카오 판교오피스의 모습. 2020.5.11/뉴스1고평가된 종목의 주가는 더 오르고 저평가 종목은 부진한 현상이 이어진다. 불확실성이 클수록 저평가주에 투자해야 한다는 \'가치투자\'의 상식이 통하지 않는 상황인 것이다. 국내뿐 아니라 글로벌 증시에서도 가치주보단 성장주로 투자금이 쏠린다. 유동성이 만들어낸 상승장으로 인해 당분간 성장성이 높은 종목의 주가 상승은 계속될 것이란 분석이다.25일 증권업계에 따르면 최근 한 달 간 시가총액 상위 종목 중에서 주가 수익률이 높은 종목 대부분은 밸류에이션(기초체력 대비 주가 수준)이 높은 종목들이었다. 반대로 밸류이에션이 낮은 저평가 종목들은 한 달 동안 주가가 떨어지거나 기초지수 대비 낮은 성과를 보였다.통상 밸류에이션이 높으면 주가 조정이 이뤄지고, 밸류에이션이 낮은 종목에는 자금이 몰리면서 주가가 오르는 것과는 반대 양상이 벌어지고 있는 것이다.증권가에서는 종목의 펀더멘털(기초체력)과 주가와의 관계를 종종 주인과 개의 관계에 비유하곤 한다. 산책을 나갈 때 개(주가)가 주인(펀더멘털)보다 앞서나갈 순 있어도 산책이 끝나면 결국 개는 주인에게로 돌아올 수밖에 없다는 것이다. 주가는 결국 펀더멘털에 수렴할 수밖에 없다는 것이 \'가치투자\'의 기본원리고, 벤저민 그레이엄 이후 100여년간 증권가의 상식으로 통했다.하지만 최근 증시는 오히려 고평가 종목들의 주가가 더 오르는 기현상이 벌어진다. 주가의 적정 수준을 측정하는 대표적 지표가 PER(주가순수익비율) 인데, 통상 코스피 시장에선 PER 10배를 기준으로 고평가 주식과 저평가 주식을 나눈다.현재 코스피에서 고평가 주식 중 가장 시장의 관심을 끄는 건 카카오다. 에프앤가이드에 따르면 카카오의 12개월 전망 PER는 58배에 달하지만 이달 들어 주가는 34%나 급등했다. 지난 22일 기준 시가총액은 21조5062억원으로 현대차(20조1916억원)를 제치고 시총 9위에 올랐다. 현재 카카오 주가는 전일 대비 1만5000원(6.07%) 오른 26만2000원을 기록하며 시총 순위도 LG생활건강을 제치고 한단계 위로 더 올라섰다.(서울=뉴스1) 유승관 기자 = 지난해 10월 29일 서울 강남구 코엑스에서 열린 2019 제18회 IEEE(전기전자공학자협회)/CVF(컴퓨터비전재단) 국제컴퓨터비전학술대회(ICCV 2019)에서 참가자들이 네이버 부스에서 업무를 보고 있다.  올해로 18회를 맞는 2019 IEEE/CVF 국제컴퓨터비전학술대회는 시각지능, 인공지능 분야 세계에서 가장 권위있는 학회로, 총 1,077편의 논문이 발표되고 전세계 70여개의 인공지능 관련 기업의 제품과 기술이 전시된다. 2019.10.29/뉴스1NAVER도 마찬가지다. PER 37.15배인 NAVER는 이달 들어 주가가 16.7% 오르며 연일 신고가 행진을 이어가고 있다. 지난해 실적 기준으로 PER이 201.52배에 달하는 삼성바이오로직스는 이달 주가가 6.4% 올랐고, PER 49배의 셀트리온헬스케어도 7.3% 상승했다.바이오시밀러(복제약) 업체 알테오젠은 피하주하 제형 변형 플랫폼인 \'하이브로자임\'(Hybrozyme)에 대한 기대감에 이달 들어 주가는 2배 이상 급등했다. 올해 예상 실적 기준 PER 341.8배에 달하지만 주가 상승세는 이어지고 있다.반면 PER이 낮은 시총 상위 종목 대부분은 이달 주가 하락을 경험했다. 개미(개인투자자)들이 가장 사랑하는 삼성전자의 PER는 11.15배에 불과하지만 이달 주가는 2.5% 하락했다. 같은 반도체 업종인 SK하이닉스 역시 PER 8.81배인 저평가 상태임에도 주가 수익률은 마이너스 2.9%를 기록했다.신한지주(4.62배)와 KB금융(4.3배) 등 금융주들은 역대급 저평가가 이어지고 있지만 이달에도 주가는 5~10% 하락했다. 전통적 제조업으로 분류되는 POSCO는 PER 8.45배임에도 이달 주가는 6.8% 떨어졌다. PER 11.13배인 한국전력도 10% 이상 주가가 하락했다.이는 국내뿐 아니라 해외에서도 마찬가지다. 미국 대형가치주 지수인 \'스탠다드앤드푸어스 500 퓨어 밸류\'(S&P 500 Pure Value) 지수는 이달 2.2% 하락한 반면 대형성장주 지수인 \'스탠다드앤드푸어스 500 퓨어 그로쓰\'(S&P 500 Pure Growth) 지수는 5.1% 올랐다. 중형주와 소형주에서 가치주·성장주 차이를 비교해 봐도 같은 결과가 나온다. 저평가된 가치주는 덜 오르고 고평가된 성장주은 더 오른 것이다.\'포스트 코로나\'(코로나 이후) 시대의 수혜주와 유동성 장세가 만나 성장주로의 쏠림 현상은 더 가속화하고 있다는 분석이다. 비대면, 온라인, 헬스케어 등으로 대표되는 코로나19 이후 시대에서 관련 수혜주들이 주목받는 가운데 각국 정부의 양적완화와 경기부양으로 이들 종목으로 자금은 더 몰릴 수밖에 없다는 것이다.최근 해외 주식 중 가장 주목받고 있는 캐나다 온라인 쇼핑몰 플랫폼 업체 \'쇼피파이\'(Shopify)가 대표적이다. 쇼피파이는 창업자가 온라인 쇼핑몰을 만들고 관리할 수 있게 도와주는 플랫폼인데, 적자가 이어지고 있음에도 주가는 올 들어 2배 이상 뛰어 캐나다 시총 1위 기업으로 올라섰다.이효석 SK증권 연구원은 ""1969년부터 1973년까지 미국 기관투자자가 선호했던 50개 종목의 평균 PER는 42배로 당시 S&P500 평균이었던 19배보다 2배 이상 높았다""며 ""현재도 성장과 확실성이 있는 종목으로 쏠림현상은 더 심화할 것""이라고 분석했다.그는 ""거시 관점에서 성장주의 질주를 막을 수 있는 것은 금리 상승뿐인데 당분간 금리가 오를 가능성은 낮다""며 ""오는 28일 한국은행의 금융통화위원회에서 기준금리가 0.5%로 낮아질 가능성이 높다""고 전망했다.김사무엘 기자 samuel@mt.co.kr▶줄리아 투자노트▶조 변호사의 가정상담소 ▶머니투데이 구독하기 <저작권자 ⓒ \'돈이 보이는 리얼타임 뉴스\' 머니투데이, 무단전재 및 재배포 금지>머니투데이 관련뉴스해당 언론사에서 선정하며 언론사 페이지(아웃링크)로 이동해 볼 수 있습니다.年300억 번 \'보람튜브\' 내사하고…허 찔린 국세청정의당 이끄는 33살 장혜영, 9년 전 연세대 자퇴하며 남긴 글 보니안 찾아간 세금 환급금 \'1434억\'에 내 돈도? 확인하는 법코로나로 뜻밖의 횡재, 할머니집에서 1㎏ 금괴 2개 찾았다연쇄살인범 최신종, 가족에겐 애틋…""잘 좀 챙겨줘. 부탁해""좋아요0훈훈해요0슬퍼요0화나요0후속기사 원해요0기사제공 :']"
5,삼성전자, 2020-05-2512:09,SBS Biz ,"KT·LG전자·LG유플러스, 인공지능 분야 협력 시작",https://finance.naver.com/news/news_read.nhn?article_id=0000212237&office_id=374&mode=search&query=삼성전자&page=5,"[""       KT·LG전자·LG유플러스, 인공지능 분야 협력 시작      기사입력2020-05-25 12:09기사원문좋아요훈훈해요좋아요 평가하기공감좋아요0훈훈해요0슬퍼요0화나요0후속기사 원해요0댓글KT와 LG전자, LG유플러스가 인공지능 스피커 등 AI 분야 협력을 시작할 것으로 알려졌습니다.통신업계에 따르면 이들 업체들은 각 사가 보유한 인공지능 기술과 인력 등을 공유하고 제품에도 탑재를 추진하는 업무협약을 이달 중 체결할 예정입니다.앞서 지난 1월부터, SK텔레콤과 삼성전자, 카카오도 인공지능 연합체를 구성해 협력을 진행하고 있습니다. 김동우 기자(eastright@sbs.co.kr) ▶ 언제어디서나 SBSCNBC  [온에어click]▶ 경제를 실험한다~ 머니랩 [네이버TV]저작권자 SBS미디어넷 & SBS I&M 무단전재-재배포 금지SBS Biz 관련뉴스해당 언론사에서 선정하며 언론사 페이지(아웃링크)로 이동해 볼 수 있습니다.서울시 자영업자 생존자금 접수시작…신청대상·방법은?文, 오늘 최고위 국가재정결정회의…국채비율 46% 육박LG전자 선 넘은 스마트폰 홍보영상 '뭇매'…결국 사과코로나19 신규 확진자 16명 증가…이태원 N차감염 우려'경제활동 재개' 美, 연휴에 코로나19 확산 우려 커져좋아요0훈훈해요0슬퍼요0화나요0후속기사 원해요0기사제공 :""]"
6,삼성전자, 2020-05-2512:02,SBS Biz ,"[who] 이재용, ’뉴 삼성’ 가속…동분서주 속 검찰 소환 임박",https://finance.naver.com/news/news_read.nhn?article_id=0000212234&office_id=374&mode=search&query=삼성전자&page=5,"['       [who] 이재용, ’뉴 삼성’ 가속…동분서주 속 검찰 소환 임박      기사입력2020-05-25 12:02기사원문좋아요훈훈해요좋아요 평가하기공감좋아요0훈훈해요0슬퍼요0화나요0후속기사 원해요0댓글 [앵커]뉴스 중심에 있는 재계 인물과 이슈를 짚어보는 비즈 & who 시간입니다.포스트 코로나 이후의 대비에 나선 총수들 소식 알아보겠습니다.권세욱 기자, 이재용 삼성전자 부회장이 최근 국내외에서 활발한 경영 행보에 나섰죠?[기자]네, 이재용 부회장은 지난 6일에 ""과거의 잘못과 단절하고 \'새로운 삼성\'으로 거듭나겠다""며 활발한 경영 행보를 예고했는데요.바로 일주일 뒤 정의선 현대차그룹 수석부회장과 차세대 먹거리 사업인 전기차 배터리를 논의했습니다.이어 닷새 뒤에는 중국 시안 반도체 공장을 방문했고, 또 사흘 뒤에는 10조 원가량의 국내 투자 계획을 내놨습니다.대국민 사과 후 보름여 동안 코로나19와 미·중 반도체 패권전쟁이라는 복합 위기 속에서 \'뉴 삼성\'에 박차를 가한 모습입니다.[앵커]이재용 부회장이 미래를 강조하고 있지만, 사법 리스크도 지속하고 있죠?[기자]네, 이재용 부회장은 조만간 검찰에 출석할 것으로 관측됩니다.삼성물산과 제일모직의 합병 의혹을 수사하는 검찰은 최지성 전 삼성그룹 미래전략실장을 최근 잇달아 소환해 의사결정 과정 등을 조사한 것으로 알려졌습니다.검찰은 두 회사 합병의 최대 수혜자이자 각종 의혹의 최종 의사결정권자로 지목된 이 부회장 측과 일정을 조율하는 것으로 전해졌습니다.[앵커]다른 소식 짚어보죠.최태원 SK그룹 회장은 사회적 가치를 창출하는 데 집중하고 있다고요?[기자]SK는 지난해 200개 기업이 사회적 가치를 창출한 것으로 측정돼 106억 원의 인센티브를 지급했다고 어제(24일) 밝혔습니다.기업들의 사회성과를 금액으로 측정해 이에 따른 지원금을 주는 \'사회성과인센티브\' 프로그램에 따른 것인데요.대표적으로 \'스타스테크\'의 경우 불가사리 추출 성분을 활용해 친환경 제설제를 만들어 쓰레기로 환경을 개선하는 사회적 가치를 창출했습니다.최태원 회장은 ""앞으로 정책화 방안을 연구하고 해외로 확산하는 노력을 기울이겠다""라고 말했습니다.[앵커]한 가지 소식 더 살펴보죠.신동빈 롯데그룹 회장은 현장 경영에 나섰다고요?[기자]네, 지난 3월 일본으로 출국했다가 이달 초 귀국한 신동빈 회장은 지난 주말에 롯데월드몰 등을 방문했는데요.국내 경영 복귀 뒤 찾은 첫 현장으로 유통사업장을 택한 것은 코로나19로 유통계열사들이 어려움을 겪는 데 따른 것으로 풀이됩니다.신 회장은 지난 19일 임원 회의에서 \'포스트 코로나19\'를 위한 전략 수립을 주문한 바 있는데요.실적 부진에 시달리는 롯데쇼핑은 구조조정에 속도를 내고 롯데지주는 대기업 최초로  주 1회 재택근무를 정례화하며 변화에 속도를 내고 있습니다.권세욱 기자(sukwon@sbs.co.kr) ▶ 언제어디서나 SBSCNBC  [온에어click]▶ 경제를 실험한다~ 머니랩 [네이버TV]저작권자 SBS미디어넷 & SBS I&M 무단전재-재배포 금지SBS Biz 관련뉴스해당 언론사에서 선정하며 언론사 페이지(아웃링크)로 이동해 볼 수 있습니다.서울시 자영업자 생존자금 접수시작…신청대상·방법은?文, 오늘 최고위 국가재정결정회의…국채비율 46% 육박LG전자 선 넘은 스마트폰 홍보영상 \'뭇매\'…결국 사과코로나19 신규 확진자 16명 증가…이태원 N차감염 우려\'경제활동 재개\' 美, 연휴에 코로나19 확산 우려 커져좋아요0훈훈해요0슬퍼요0화나요0후속기사 원해요0기사제공 :']"
7,삼성전자, 2020-05-2511:56,뉴시스 ,"KT-LG전자-LGU+, 'AI 동맹' 추진…SKT-삼성-카카오 연합에 '반격'",https://finance.naver.com/news/news_read.nhn?article_id=0009879156&office_id=003&mode=search&query=삼성전자&page=5,"['       KT-LG전자-LGU+, \'AI 동맹\' 추진…SKT-삼성-카카오 연합에 \'반격\'      기사입력2020-05-25 11:56기사원문좋아요훈훈해요좋아요 평가하기공감좋아요0훈훈해요0슬퍼요0화나요0후속기사 원해요0댓글▲KT 구현모 사장(왼쪽)·LG전자 권봉석 사장(가운데)·하현회 LG유플러스 부회장(오른쪽)[서울=뉴시스] 이진영 기자 = KT, LG전자, LG유플러스 등 3사가 인공지능(AI) 협력 추진에 나섰다. 올 초 SK텔레콤, 삼성전자, 카카오가 AI 연합체를 꾸린 데 이어 종합통신기술(ICT) 기업이 주도하는 두 번째 AI 동맹이 나올 것으로 전망된다. 25일 이동통신과 전자업계에 따르면 KT, LG전자, LG유플러스는 3사간 AI 협력을 위한 업무협약(MOU) 체결안을 논의 중이다.  각사가 보유한 AI 기술, 인력 등을 공유하고 제품군에도 서로의 AI 서비스를 탑재하는 등의 방안을 고려하고 있다. 가령 KT AI 플랫폼 \'기가지니\'를 LG유플러스 고객이 이용하거나 LG전자 \'씽큐\' 제품군에 기가지니를 탑재하는 방식이다. 지난 3월 말 정식 취임한 구현모 신임 사장과 하현회 LG유플러스 부회장 간의 회동을 계기로  3사간의 협력이 급물살을 탄 것으로 알려졌다. KT 관계자는 ""LG전자, LG유플러스와 AI 협력을 위한 업무협약 체결을 검토하고 있다""며 ""구체적인 시기와 내용은 미정이다""라고 밝혔다. LG유플러스 관계자는 ""LG전자, KT와 AI 협력을 논의하고 있으며 아직 일정과 구체적인 협업 내용은 정해지지 않았다""라고 말했다.이번 3사간의 AI 연합이 SK텔레콤-삼성전자-카카오와의 연합과 어떤 경쟁구도를 이룰지 주목된다. 앞서 박정호 SK텔레콤 사장은 지난 1월 미국 라스베이거스에서 열린 세계 최대 가전정보기술 전시회 \'CES 2020\'에서 삼성전자와 카카오를 포함한 3사간 AI 초협력 계획을 밝힌 바 있다. SK텔레콤은 향후 AI 초협력에 국내 기업을 지속 추가할 계획이며 현재 삼성전자, 카카오와 AI 협력 방안과 비즈니스 모델 등을 마련하기 위한 AI 협의체 구성 노력에 박차를 가하고 있다. 구글, 아마존, 페이스북, 애플 등 글로벌 기업들이 AI 분야에서 연합전선을 구축하는 등 글로벌 기업들이 AI 시장을 선점하기 위해 합종연횡을 활발히 하는 가운데 국내는 종합통신기술(ICT) 기업을 중심으로 AI 연합이 진행되고 있다는 분석이다. 이통통신업계 관계자는 ""KT와 LG유플러스는 경쟁사지만 그간 다양한 분야에서 협력을 해왔다""며 ""AI가 4차 산업혁명 시대의 핵심 기술인 상황에서 SK텔레콤, 삼성전자, 카카오의 AI 연합체에 대항하기 위해 양사가 이번에도 힘을 합치려는 것으로 보인다""라고 말했다.☞공감언론 뉴시스 mint@newsis.com▶ 네이버에서 뉴시스 구독하기▶ K-Artprice, 유명 미술작품 가격 공개▶ 뉴시스 빅데이터 MSI 주가시세표 바로가기<ⓒ 공감언론 뉴시스통신사. 무단전재-재배포 금지>뉴시스 관련뉴스해당 언론사에서 선정하며 언론사 페이지(아웃링크)로 이동해 볼 수 있습니다.진중권 ""윤미향 옹호 여성단체 민주어용상 만들어 기리자""민경욱 총선 조작 의혹에 선관위 급기야…폭스바겐, 백인 손이 흑인 튕겨내는 인종차별 광고최전선 뚫고 태안 침투한 괴선박, 선원 6명 행방은?""남자는 물뿌리개, 여자는 꽃"" 성차별 발언 과제 낸 교수좋아요0훈훈해요0슬퍼요0화나요0후속기사 원해요0기사제공 :']"
8,삼성전자, 2020-05-2511:48,더팩트 ,"[TF시황] 코스피, 개인 매수 유지에 소폭 상승",https://finance.naver.com/news/news_read.nhn?article_id=0000026936&office_id=629&mode=search&query=삼성전자&page=5,"['       [TF시황] 코스피, 개인 매수 유지에 소폭 상승      기사입력2020-05-25 11:48기사원문좋아요훈훈해요좋아요 평가하기공감좋아요0훈훈해요0슬퍼요0화나요0후속기사 원해요0댓글25일 오전 11시 36분 현재 코스피는 전장대비 10.53포인트(+0.53%) 오른 1980.66에 거래 중이다. /이선화 기자코스피, 0.53% 오른 1980.66에 거래 중[더팩트ㅣ박경현 기자] 코스피가 장 초반 잠시 하락했다가 개인 매수에 힘입어 반등에 성공했다.25일 오전 11시 36분 현재 코스피는 전장대비 10.53포인트(+0.53%) 오른 1980.66에 거래 중이다.현재까지 개인은 1300억 원 가량 사들인 반면 외국인과 기관은 각각 789억 원, 478억 원을 팔아치우고 있다.같은시각 코스닥은 전장대비 5.98포인트(+0.84%) 오른 714.56을 나타내고 있다.코스닥은 외국인이 오전 중 매수세로 전향했다. 이에 개인과 외국인은 각각 18억 원, 204억 원을 사들인 반면 기관 홀로 161억 원을 순매도 중이다.시가총액 상위종목 주가 등락은 엇갈리고 있다. 삼성전자(-0.10%), SK하이닉스(-0.86%)가 하락세인 반면 삼성바이오로직스(+2.10%), 네이버(+3.47%)는 상승세다. 한편 카카오는 장중 시가총액 순위 8위로 올라섰다.현재까지 업종은 양방향미디어와 서비스, 소프트웨어, 조선, 담배가 3~4% 오르며 강세다. 반면 항공사, 전자제품, 사무용전자제품은 1%대 하락하고 있다.pkh@tf.co.kr- 더팩트 뮤직어워즈는 언제? [알림받기▶]  - 내 아이돌 응원하기 [팬앤스타▶]  저작권자 ⓒ 특종에 강한 더팩트 & tf.co.kr 무단 전재 및 재배포 금지더팩트 관련뉴스해당 언론사에서 선정하며 언론사 페이지(아웃링크)로 이동해 볼 수 있습니다.[단독포착] \'삼중고\' 조국 정경심 부부의 \'재충전\' 휴일 외식[TF이슈] 스타벅스 굿즈 \'갑론을박\'…성공 마케팅vs주객전도 상술[스페셜인터뷰90-임기홍] \'개그맨 웃기는 작가\' 40년, ""은퇴 아닌 조퇴""\'아빠본색\' 길, 가족공개와 자숙기간 고백에 극과 극 반응손흥민, 몸값 866억 원으로 아시아 1위…이강인 4위 안착좋아요0훈훈해요0슬퍼요0화나요0후속기사 원해요0기사제공 :']"
9,삼성전자, 2020-05-2511:47,헤럴드경제 ,호암상 시상식 30년만에 첫 취소,https://finance.naver.com/news/news_read.nhn?article_id=0001677688&office_id=016&mode=search&query=삼성전자&page=5,"['       호암상 시상식 30년만에 첫 취소      기사입력2020-05-25 11:47기사원문좋아요훈훈해요좋아요 평가하기공감좋아요0훈훈해요0슬퍼요0화나요0후속기사 원해요0댓글코로나 여파…수상자별 개인 전달2019년 열린 호암상 시상식에서 올로브 아멜린 스웨덴 노벨상박물관 부회장이 축사를 하고 있는 모습. [호암재단 제공]삼성그룹 창업자 호암(湖巖) 이병철 회장의 뜻을 기리기 위해 제정된 호암상의 시상식이 올해는 열리지 않는다. 호암상 시상식이 개최되지 못하는 것은 이 상이 제정된 이후 30년 만에 처음이다.호암재단은 코로나19 확산 우려에 따라 30주년을 맞은 호암상 시상식을 개최하지 않기로 결정했다고 25일 밝혔다. 호암재단은 “시상식은 대규모 인원이 모이는 행사여서 취소가 불가피했다”며 “조만간 수상자에게는 별도로 상을 전달할 예정”이라고 밝혔다.호암상 시상식은 삼성그룹 사장단을 비롯한 각계 인사들이 참여한 가운데 매년 6월 1일 중구 서소문로 호암아트홀에서 열리는 행사다. 특히 올해는 상이 만들어진 지 30주년이 되는 해여서 이재용 삼성전자 부회장 등 총수 일가의 참석 가능성도 제기됐다.과거 호암상 시상식에는 이건희 회장과 부인 홍라희 전 리움미술관장을 비롯해 세 자녀인 이재용 부회장, 이부진 호텔신라 사장, 이서현 삼성복지재단 이사장 등이 함께했다.그러나 2016년 시상식에는 총수 일가중 이재용 부회장만 참석했고, 2017년부터 지난해까지는 이 부회장도 불참한 채 시상식이 치러졌다.호암재단은 올해 시상식은 취소했지만 매년 각계 주요 인사 500여명이 참석했던 의미 있는 행사인 만큼 앞으로도 수상자 위주의 행사로 진행할 계획이다. 올해 호암상 수상자는 과학상 김수봉 성균관대 기초과학연구소 수석연구원, 공학상 임재수 미국 MIT 교수, 의학상 박승정 울산대 석좌교수, 예술상 김민기 극단 학전 대표, 사회봉사상 김성수 우리마을 촌장 등이다. 정세희 기자▶[디;콘] 여론조사를 조사하다!▶채널 구독하면 LED마스크, 공기청정기가 내손에 ▶농수축산물 소비캠페인 - Copyrights ⓒ 헤럴드경제 & heraldbiz.com, 무단 전재 및 재배포 금지 -헤럴드경제 관련뉴스해당 언론사에서 선정하며 언론사 페이지(아웃링크)로 이동해 볼 수 있습니다.軍 전역 철구 ""돌아왔습니다""…복귀 방송 37만명 몰려 \'접속 오류\'통합당 의원들, 연말까지 세비 30% 기부…1인당 1600만원코로나19 아랑곳…美, 연휴 맞아 해변·공원 북새통최신종 두번 째 살인전 휴대전화에 \'음성유서\'…""심신미약 주장 전략""日, 오늘 긴급사태 전면해제할 듯…어제 코로나 신규 확진 42명좋아요0훈훈해요0슬퍼요0화나요0후속기사 원해요0기사제공 :']"
