,회사명,날짜,언론사,기사제목,링크,본문
6,삼성전자, 2020-03-2516:24,한겨레 ,코스피 1700선 회복…환율은 1220원대로,https://finance.naver.com/news/news_read.nhn?article_id=0002490794&office_id=028&mode=search&query=삼성전자&page=4,"['       코스피 1700선 회복…환율은 1220원대로      기사입력2020-03-25 16:24기사원문좋아요훈훈해요좋아요 평가하기공감좋아요0훈훈해요0슬퍼요0화나요0후속기사 원해요0댓글채권금리는 상승세 반전한국거래소 서울 여의도 사옥  코스피가 1700선을 탈환하고 원-달러 환율은 1230원 밑으로 내려갔다. 25일 유가증권시장에서 코스피는 5.89%(94.79) 급등한 1704.76으로 장을 마감했다. 지난 16일(1714.86) 이후 다시 1700선으로 올라선 것이다. 하지만 외국인 투자자의 매도세는 다시 강해지고 있다. 이날 외국인은 코스피 시장에서 3328억원어치의 주식을 순매도했다. 삼성전자 주식은 1317억원 팔아 하룻만에 순매도로 돌아섰다. 서울외환시장에서 원-달러 환율은 19.7원 급락(원화가치 급등)한 1229.9원으로 마감했다. 원화 환율이 1230원 아래로 내려간 것도 지난 16일(1226원) 이후 처음이다. 하지만 채권시장은 냉기가 가시지 않고 있다. 국고채 금리는 3년물이 오후 들어 반등(국채값 하락)세로 돌아섰다. 회사채 3년 만기 금리는 AA-와 BBB- 등급 모두 올랐고 기업어음(CP) 금리도 상승했다. 한광덕 선임기자 kdhan@hani.co.kr▶[연속보도] n번방 성착취 파문▶신문 구독신청▶삐딱한 뉴스 B딱[ⓒ한겨레신문 : 무단전재 및 재배포 금지]한겨레 관련뉴스해당 언론사에서 선정하며 언론사 페이지(아웃링크)로 이동해 볼 수 있습니다.\'n번방\' 조주빈은 왜 손석희·김웅·윤장현에게 사과했을까[단독] 이재명 ""\'재난기본소득\' 반대 지자체 지원 대상서 제외""n번방 핵심 운영자 \'켈리\' 징역 1년 \'솜방망이 처벌\' 논란\'성폭행 혐의\' 가수 김건모, 기소 의견으로 검찰 송치[2020총선] 황교안 ""총선 목표는 미래한국당과 합쳐 과반""좋아요0훈훈해요0슬퍼요0화나요0후속기사 원해요0기사제공 :']"
7,삼성전자, 2020-03-2516:22,아이뉴스24 ,[코로나19] 상반기 박람회 잇따른 연기·취소…하반기 IFA까지 이어지나,https://finance.naver.com/news/news_read.nhn?article_id=0000531311&office_id=031&mode=search&query=삼성전자&page=4,"['       [코로나19] 상반기 박람회 잇따른 연기·취소…하반기 IFA까지 이어지나      기사입력2020-03-25 16:22기사원문좋아요훈훈해요좋아요 평가하기공감좋아요0훈훈해요0슬퍼요0화나요0후속기사 원해요0댓글전자업계, 잇따른 행사 취소·연기에 글로벌 비즈니스 차질 우려[아이뉴스24 윤선훈 기자] 코로나19가 장기화되면서 상반기 예정이었던 글로벌 전시회가 대부분 연기·취소되고 있다. 해외 전시회를 판로 확대와 신제품 홍보 등의 수단으로 활용하던 전자업계로써는 뼈아프다. 벌써부터 하반기 개최 예정인 전시회의 연기·취소설도 제기되는 상황이다.25일 업계에 따르면 지난 2월 스페인 바르셀로나에서 열릴 예정이었던 세계 최대 IT박람회 \'MWC 2020\'이 취소된 이후, 상반기 예정된 관련 전시회들이 줄줄 연기 혹은 취소되고 있다.지난해 9월 열린 \'IFA 2019\'의 모습. [출처=삼성전자]3월에 열릴 계획이었던 전시회들은 대부분 열리지 못했다. 미국 최대 가정용품 박람회 \'시카고 국제 가정용품 박람회(IHHS 2020)\'과 북미 최대 콘텐츠·기술박람회 \'SXSW 2020\'이 모두 취소됐다. 중국 최대 가전박람회 \'AWE 2020\'도 연기됐으며 상업용 디스플레이 박람회인 \'인포콤 차이나\' 역시 9월로 미뤄졌다. 인포콤 차이나가 미뤄지면서 5월 방콕 개최 예정이었던 \'인포콤 동남아\'도 7월로 연기됐다.이후에도 4월로 예정됐던 \'밀라노 가구박람회\'가 6월로 연기됐고, 세계 최대 산업박람회인 \'하노버 메쎄\'도 7월로 미뤄졌다. 지난해 삼성전자와 LG전자는 밀라노 가구박람회에 참가해 빌트인 가전 등 프리미엄 제품을 선보였으며 하노버 메쎄에는 LG전자가 나서 산업용 자율주행 로봇 등을 전시한 바 있다.6월 예정이던 행사도 연기 수순을 밟고 있다. 6월 대만 타이베이에서 개최 예정이었던 아시아 최대 IT박람회 \'컴퓨텍스 2020\'가 9월 28일로 개최를 미룬다. 최근 대만에서 코로나19 확진자가 급격히 늘어나면서 취소를 결정했다. 중국 상하이에서 6월 열릴 예정이었던 \'CES 아시아\'도 취소됐다.6월 7일부터 개최 예정인 디스플레이 업계 최대 학회인 \'디스플레이 위크 2020\'와 같은 달 13일 개최되는 \'인포콤 2020\' 북미 행사는 아직 일정 변동이 없다. 다만 주최 측이 코로나19 상황 변화에 따른 유동적인 상황 대응을 언급해 연기나 취소 가능성도 열려 있다. \'디스플레이 위크\'를 주최하는 국제정보디스플레이학회(SID) 측은 ""바이러스 확산을 제한하고 전시업체, 참석자 및 업계 관계자들에게 안전한 환경을 제공하기 위해 지역, 주, 연방 지침을 준수할 것""이라고 언급했다.업계 일각에서는 오는 9월 열리는 유럽 최대 가전박람회인 IFA 2020이 연기 혹은 취소될 수 있다는 우려도 나온다. IFA는 미국에서 열리는 CES, 스페인에서 열리는 MWC와 함께 전자업계 3대 전시회로 꼽힌다. 실제로 오는 4월 유럽 키프로스에서 열릴 예정이었던 사전 행사인 \'IFA 글로벌 프레스 콘퍼런스\'가 이미 취소됐다.IFA 주최측인 메세베를린은 신중한 태도다. 최근 홈페이지에 올린 공지에서 주최 측은 ""상황이 계속 변화하기 때문에 명확한 결론을 내리기가 어렵다""며 ""연방 및 주 차원의 권장 사항을 따르고 있으며 해당 지침을 이행할 것""이라고 언급했다. 행사가 열리는 메세베를린은 오는 4월 19일까지 일부 부지를 코로나19 임시 치료센터로 활용한다. 주최 측은 ""이로 인해 4월 19일 이후 개최될 행사가 받게 될 영향은 없다""고 선을 그었다.IFA 2020에 참가하는 업체들도 아직 행사 연기나 취소에 대해 공지받지는 않았다. 다만 현지 상황이 심각한 만큼 꾸준히 상황을 주시하고 있다. 한 국내 참가업체 고위 관계자는 ""행사까지는 시간이 꽤 남았기 때문인지 주최측으로부터 별다른 공지는 없었다""며 ""일단은 예정대로 행사를 준비하고 있다""고 말했다.매년 IFA에 국내 벤처기업들을 이끌고 한국관 부스를 차리는 KEA(한국전자정보통신산업진흥회) 측도 일단 당초 계획대로 준비 중이다. KEA 관계자는 ""예정대로 다음주부터 한국관에 들어갈 국내 기업들을 모집할 계획""이라며 ""주최 측으로부터 아직 언질이 없는 만큼 예정대로 준비하고 있지만, 동시에 상황을 꾸준히 모니터링하고 있다""고 언급했다.만일 MWC에 이어 IFA까지 취소될 경우, 상반기는 물론 하반기까지 전세계를 대상으로 하는 판로 확보 창구가 닫히는 셈이라 업계는 상황 변화를 예의주시하고 있다. 한 전자업계 관계자는 ""취소가 현실화된다면 올해 세워둔 글로벌 비즈니스 전략을 상당 부분 수정하는 것이 불가피하다""고 우려했다.윤선훈기자 krel@inews24.com▶네이버 채널에서 \'아이뉴스24\'를 구독해주세요.▶홍성택과 함께하는 희망찾기 등산·트레킹 교실 ▶아이뉴스24 바로가기[ⓒ 아이뉴스24 무단전재 및 재배포 금지]아이뉴스24 관련뉴스해당 언론사에서 선정하며 언론사 페이지(아웃링크)로 이동해 볼 수 있습니다.[주총] 탄력 받은 빙그레 ""올해 혁신 통한 사업 확장 목표""패싱 당한 전경련 ""과감한 규제유예…정부서 부르면 협력""김부겸 사무실, 한밤중 계란 투척 사건…""증오 정치와 맞설 것""\'성폭행 의혹\' 김건모, 기소의견 검찰 송치…수사 시작 108일만[종합] 현장찾고 머리맞댄 재계 총수…코로나 위기극복 총력전좋아요0훈훈해요0슬퍼요0화나요0후속기사 원해요0기사제공 :']"
8,삼성전자, 2020-03-2516:20,조세일보 ,"코스피, 美 2조달러 경기부양책 합의에 1700선…5.89%↑",https://finance.naver.com/news/news_read.nhn?article_id=0002221094&office_id=123&mode=search&query=삼성전자&page=4,"[""       코스피, 美 2조달러 경기부양책 합의에 1700선…5.89%↑      기사입력2020-03-25 16:20기사원문좋아요훈훈해요좋아요 평가하기공감좋아요0훈훈해요0슬퍼요0화나요0후속기사 원해요0댓글◆…25일 코스피 지수는 전날보다 94.79포인트(5.89%) 상승한 1704.76에 장을 마감했다. 사진=한국거래소코스피가 이틀 연속 5%가 넘는 급등세를 기록했다. 미국 트럼프 행정부가 코로나19로 촉발된 경제침체에 대응하기 위해 추진한 2조 달러 규모의 경기부양 패키지 법안을 미국 상원과 합의를 이뤘다는 소식이 전해지며 장막판에는 1700선을 회복했다.25일 코스피 지수는 전날보다 94.79포인트(5.89%) 상승한 1704.76에 장을 마감했다. 지수가 종가기준으로 1700선을 회복한 것은 지난 16일 이후 6거래일 만이다.이날 지수는 전날보다 58.22포인트(3.61%) 상승한 1668.19로 거래를 시작한 후 상승폭을 키워나갔다. 한국을 비롯한 전세계 주요국들이 코로나19로 촉발된 경제침체를 타개하기 위해 대규모 경기부양책을 내놓고 있는데다 간밤에 미국 다우지수가 87년만에 최대폭인 11.37% 상승했다는 소식이 전해지며 시장이 긍정적으로 반응했다.이후 1660~1690선에서 등락을 반복하던 코스피는 미국 트럼프 행정부와 상원이 25일 새벽(현지시간) 최대 2조 달러(약 2500억원) 규모의 경기부양책 법안에 합의했다는 소식이 전해지며 상승폭을 확대, 장막판 1700선을 회복했다.증시는 이틀 연속 급등했지만 외국인은 3360억원의 주식을 팔아치우며 15거래일 연속 '팔자' 행진을 이어나갔다. 기관도 1053억원 순매도에 나섰다. 개인만 4519억원 순매수했다.외국인과 기관이 어제와 오늘 주식시장 급등에 따른 단기 차익을 실현하고 있는 것으로 보인다. 기관은 오전 한때 4000억원 넘게 순매도세를 보이기도 했지만 장막판으로 갈수록 매수세가 크게 유입되며 순매도폭은 오전보다 줄었다.모든 업종이 상승세를 보인 가운데 금융관련 업종이 10% 넘게 폭등하며 지수상승을 이끌었다. 증권 업종은 14.56% 올라 전체 업종 중 상승폭이 가장 컸다. 보험과 은행업종도 각각 11.58%, 10.28% 크게 올랐다.운수장비와 철강금속 업종도 각각 12.51%, 9.25% 급등했다.시가총액 1, 2위인 삼성전자, SK하이닉스의 주가도 전날에 이어 큰 폭 상승했다.삼성전자는 전날보다 1700원(3.62%) 상승한 4만8650원에 장을 마감했다. SK하이닉스는 5800원(7.37%)나 오른 8만4500원을 기록했다.코스닥 지수는 전날보다 25.28포인트(5.26%) 상승한 505.68에 거래를 종료했다. 종가기준으로 지난 17일 이후 5거래일만에 500선을 회복했다.▶ 조세일보 홈페이지 / 정회원 가입▶ 조세일보 네이버 뉴스스탠드 구독(종합/경제)태기원(tae@joseilbo.com)저작권자 ⓒ 조세일보(http://www.joseilbo.com). 무단전재 및 재배포 금지조세일보 관련뉴스해당 언론사에서 선정하며 언론사 페이지(아웃링크)로 이동해 볼 수 있습니다.경찰, 김건모 성폭행 혐의 인정?…기소의견으로 검찰 송치중국서 '코로나19'이어 '한타바이러스' 사망자 발생'남해고속도로 실종사건'이 뭐지?[속보] '코로나19' 국내 현황…확진자 총 9137명, 사망 126명조주빈, 손석희·김웅·윤장현 언급하며 사죄…왜?좋아요0훈훈해요0슬퍼요0화나요0후속기사 원해요0기사제공 :""]"
9,삼성전자, 2020-03-2516:19,데일리안 ,"코스피, 7일만에 1700 회복…5.9% '껑충'",https://finance.naver.com/news/news_read.nhn?article_id=0002391397&office_id=119&mode=search&query=삼성전자&page=4,"['       코스피, 7일만에 1700 회복…5.9% \'껑충\'      기사입력2020-03-25 16:19기사원문좋아요훈훈해요좋아요 평가하기공감좋아요0훈훈해요0슬퍼요0화나요0후속기사 원해요0댓글개인 홀로 \'사자\', 외국인과 기관 동반 순매도25일 코스피 지수는 전장대비 94.79포인트(5.89%) 상승한 1704.76에 거래를 마쳤다.ⓒ데일리안 코스피 지수가 7거래일만에 1700에서 거래를 마쳤다. 외국인은 15거래일 연속 팔자세를 유지하고 있는데 개인은 순매수 행진을 이어갔다.25일 코스피 지수는 전장대비 94.79포인트(5.89%) 상승한 1704.76에 거래를 마쳤다. 개인이 홀로 4496억원을 순매수한 가운데 외국인과 기관이 각각 3359억원 1041억원을 동반 순매도 했다.업종별 지수등락에 따르면 음식료품(5.59%), 섬유·의복(5.82%), 종이·목재(4.45%), 화학(7.27%), 의약품(0.88%), 비금속광물(5.83%), 철강·금속(9.26%), 기계(6%), 전기·전자(4.45%), 의료정밀(6.96%), 운송장비(12.51%) 등 줄줄이 상승세로 장을 마쳤다.시가총액 상위종목들은 등락이 엇갈렸다. 삼성전자가 3.62% 오른 4만8650원에 거래를 마쳤고, SK하이닉스(7.37%), LG화학(6.77%), 현대차(12.97%), 삼성SDI(4.46%), 삼성물산(7.53%), 현대모비스(17.30%) 등이 급등세를 보였다. 이 가운데 삼성바이오로직스(-0.21%), 셀트리온(-0.54%), LG생활건강(-2.10%) 등이 하락했다.코스닥 지수는 전장대비 25.28포인트(5.26%) 상승한 505.68에서 거래를 마쳤다.전날 대통령이 주관한 2차 비상경제회의에서 기업구호긴급자금으로 100조원을 투입한다는 소식이 주가 급등에 영향을 미친 것으로 풀이된다. 정부는 채권안정펀드로 20조원을 늘려 회사채를 매입하고 증권안정펀드로는 10조7000억원을 조성한다는 계획이다.김동영 삼성증권 연구원은 ""실물 경기침체, 경기부양책 등 여러가지 변수가 혼재해 있는 현재 상황에서 증시 저점을 논하기에는 아직 이른감이 있다""며 ""다만 2008년 글로벌 금융위기 사례를 감안해 증시 바닥을 가늠해볼 수 있을 것""이라고 말했다.데일리안 이미경 기자 (esit917@dailian.co.kr)ⓒ (주)데일리안 - 무단전재, 변형, 무단배포 금지데일리안 관련뉴스해당 언론사에서 선정하며 언론사 페이지(아웃링크)로 이동해 볼 수 있습니다.코스피, 외인·기관 동반 \'팔자\'…美 파격 금리인하 효과 \'미미\'코스피, 2220선 회복…기관 홀로 \'사자\'코스피 2200선 진입…2% 넘게 상승신종 코로나 감염증 확산…코스피 2120선도 붕괴연초 \'개미 왕따\' 없었다...외인과 호흡 맞춰 함박웃음좋아요0훈훈해요0슬퍼요0화나요0후속기사 원해요0기사제공 :']"
10,삼성전자, 2020-03-2516:19,뉴시스 ,"삼성전자, 코로나19에 브라질 전역 오프라인 매장 패쇄",https://finance.naver.com/news/news_read.nhn?article_id=0009777386&office_id=003&mode=search&query=삼성전자&page=4,"['       삼성전자, 코로나19에 브라질 전역 오프라인 매장 패쇄      기사입력2020-03-25 16:19기사원문좋아요훈훈해요좋아요 평가하기공감좋아요0훈훈해요0슬퍼요0화나요0후속기사 원해요0댓글온라인 판매는 유지브라질 북부 마나우스 공장 29일까지 가동 중단[서울=뉴시스]브라질을 방문중인 이재용 삼성전자 부회장이 27일(현지시간) 삼성전자 마나우스 공장 생산라인 내 스마트폰과 TV조립 공정을 살펴보고 있다. (사진=삼성전자 제공) 2020.01.28. photo@newsis.com[서울=뉴시스] 김혜경 기자 = 삼성전자가 신종 코로나바이러스 감염증(코로나19) 여파로 브라질 전역의 오프라인 매장을 잠정 폐쇄한다. 24일(현지시간) 삼성전자 브라질 뉴스룸에 따르면 코로나19 확산을 최소화하기 위해 현지 전역에 있는 삼성 오프라인 매장을 폐쇄한다. 이는 코로나19 확산을 막기 위해 오프라인 매장을 폐쇄하는 현지 정부 방침에 따른 것으로, 현지 상황에 따라 재개 시점을 공지할 계획이다. 온라인을 통한 제품 판매는 계속된다. 브라질에서는 현재까지 2200여명이 코로나19 확진 판정을 받았으며 46명이 사망했다. 앞서 삼성전자는 북부 아마조나스주 마나우스에 있는 가전제품과 스마트폰 제조공장 가동을 24일부터 29일까지 중단하기로 결정했다. 동남부 상파울루주 캄피나스에 위치한 삼성전자 휴대전화 공장은 계속 가동한다. 이 밖에도 삼성전자는 인도 노이다에 위치한 스마트폰 공장도 23일부터 25일까지, 유럽 슬로바키아 TV공장도 23일부터 29일까지 폐쇄하기로 했다. 미국과 캐나다 전역의 오프라인 매장은 지난주부터 폐쇄된 상태다.☞공감언론 뉴시스 chkim@newsis.com▶ 선택 2020, 제21대 총선의 모든 것▶ K-Artprice, 유명 미술작품 가격 공개▶ 뉴시스 빅데이터 MSI 주가시세표 바로가기 <ⓒ 공감언론 뉴시스통신사. 무단전재-재배포 금지>뉴시스 관련뉴스해당 언론사에서 선정하며 언론사 페이지(아웃링크)로 이동해 볼 수 있습니다.협박당한 손석희 ""조주빈, 청부받아 가족 해친다고 공갈""진단시약 업체 씨젠, 文 방문하자마자 주가가 갑자기…여의도서 30대 투신 사망…극단 선택에 n번방 소문도조국 임명 찬성하던 정의당 청년 후보들 ""이제는…""조주빈이 입은 옷…휠라 ""당혹·유감…모자이크 요청""좋아요0훈훈해요0슬퍼요0화나요0후속기사 원해요0기사제공 :']"
11,삼성전자, 2020-03-2516:17,뉴스1 ,[시황종합] '이틀째 급등' 코스피 1700-코스닥 500 회복 마감,https://finance.naver.com/news/news_read.nhn?article_id=0004543720&office_id=421&mode=search&query=삼성전자&page=4,"['       [시황종합] \'이틀째 급등\' 코스피 1700-코스닥 500 회복 마감      기사입력2020-03-25 16:17기사원문좋아요훈훈해요좋아요 평가하기공감좋아요0훈훈해요0슬퍼요0화나요0후속기사 원해요0댓글코스피, 94.79p(5.89%)↑ 1704.76…코스닥, 25.28p(5.26%)↑ 505.68달러/원 환율, 19.7원 내린 1229.9원25일 오전 서울 중구 하나은행 명동점 딜링룸 전광판에 코스피 지수가 전일 대비 66.31포인트(4.12%) 상승한 1,676.28을, 코스닥은 16.00포인트(3.33%) 상승한 496.40을, 원·달러환율은 17.30원 하락한 1,232.30원을 나타내고 있다. 2020.3.25/뉴스1 © News1 민경석 기자(서울=뉴스1) 양새롬 기자 = 25일 코스피 지수가 약 6% 급등해 1700선을 넘어서며 마감했다. 종가 기준 1700선을 회복한 것은 지난 16일 이후 7거래일만이다. 코스닥 지수도 5% 올라 500선에 올라섰다. 달러/원 환율은 19원 가량 급락했다.(원화 강세)미국 정부의 대규모 경기부양책 의회 통과가 임박했다는 기대감에 간밤 미국 증시가 폭등하면서 국내 증시도 이틀 연속 상승세를 탄 것으로 풀이된다. 정부가 코로나19 사태로 인한 돈가뭄에 100조원을 투입하기로 한 것도 호재로 작용하고 있다.  이날 코스피 지수는 전일대비 94.79포인트(5.89%) 급등한 1704.76로 마감했다. 코스피 시장에서 개인은 홀로 4488억원 순매수했고, 외국인과 기관은 각각 3328억원, 1033억원 순매도했다. 시가총액 상위 종목 중 삼성전자(3.62%), SK하이닉스(7.37%), 삼성전자우(5.87%), LG화학(6.77%), 현대차(12.97%), 삼성SDI(4.46%) 등이 올랐다. 삼성전자는 장중 4만9600원까지 오르며 5만원 재진입을 시도하기도 했다.  삼성바이오로직스(-0.21%), 셀트리온(-0.54%), LG생활건강(-2.10%)은 내렸고 네이버는 보합 마감했다.코스닥 지수도 전일 대비 25.28포인트(5.26%) 오른 505.68로 마쳤다. 시총 상위 종목 중에선 문재인 대통령이 이날 사업잘 찾은 씨젠(29.94%)이 상한가에 올랐다. 이외에 에이치엘비(3.96%), 펄어비스(1.39%), CJ ENM(9.22%), 셀트리온제약(5.24%), 케이엠더블유(1.78%), 휴젤(3.12%), SK머티리얼즈(2.85%)가 올랐고, 셀트리온헬스케어(-1.47%), 스튜디온드래곤(-2.14%)가 내렸다. 노동길 NH투자증권 연구원은 ""주식시장, 채권시장, 단기 금융시장이 안정세에 접어들고 있다""면서도 ""외국인 순매도는 지속중이다. 외국인 순매수 전환이 아직까지 요원한 상황에서 변동성 감소 여부를 지켜볼 필요가 있다""고 분석했다. 서울외환시장에서 달러/원 환율은 전날보다 19.7원 내린 1229.9원으로 거래를 마쳤다.flyhighrom@news1.kr▶ 네이버 메인에서 [뉴스1] 구독하기!▶  4.15총선 관련뉴스 ▶ 크립토허브 © 뉴스1코리아(news1.kr), 무단 전재 및 재배포 금지뉴스1 관련뉴스해당 언론사에서 선정하며 언론사 페이지(아웃링크)로 이동해 볼 수 있습니다.중국 이번엔 \'한타바이러스\' 공포…버스 탔던 직장인 사망이재명 ""30만원 없어 온가족이 죽는 나라…그게 적은 돈인가""부천시장 ""이재명 10만원 반대, 소상공인 줘""강예빈·이연화·최지현…조주빈 인기 女스타 줄줄이 팔로우고승민 전연인 ""18살에 유산·낙태…수술 뒤 관계 맺으려 연락""좋아요0훈훈해요0슬퍼요0화나요0후속기사 원해요0기사제공 :']"
12,삼성전자, 2020-03-2516:16,한국경제TV ,코스피 9일 만에 1700선 탈환…美 2조 달러 부양책에 6% 급등,https://finance.naver.com/news/news_read.nhn?article_id=0000859084&office_id=215&mode=search&query=삼성전자&page=4,"['       코스피 9일 만에 1700선 탈환…美 2조 달러 부양책에 6% 급등      기사입력2020-03-25 16:16기사원문좋아요훈훈해요좋아요 평가하기공감좋아요0훈훈해요0슬퍼요0화나요0후속기사 원해요0댓글[한국경제TV 박준식 기자]국내 증시가 이틀 연속 급등세를 보였다.25일 코스피는 전날보다 94.79포인트(5.89%) 상승한 1704.76에 장을 마쳤다.지난 16일 이후 7거래일 만에 1,700선을 회복한 것이다.정부의 대규모 경기부양책에 기대감이 여전한 가운데 오후 들어 미국 행정부와 상원이 최대 2조 달러에 달하는 경기 부양 법안을 합의했다는 소식에 상승폭이 커졌다.이날 코스피에서 개인이 4,537억원 순매수한 가운데, 외국인과 기관은 각각 3,331억, 1,053억원 순매도했다.올해 들어 투자자예탁금이 9조원 가까이 증가하고 있어서 개인의 매수세가 이어질 전망이다.모든 업종이 상승한 가운데 정부의 자금 지원으로 유동성 위기에서 벗어난 증권의 오름세가 두드러졌다.시가총액 상위 종목 중에는 삼성전자(3.62%), SK하이닉스(7.37%), LG화학(6.77%), 현대차(12.97%), 삼성SDI(4.46%), 삼성물산(7.53%) 등이 상승 마감했다.코스닥 지수도 모처럼 만에 500선을 회복했다. 전 거래일 대비 25.28포인트(5.26%) 오른 505.68로 마감했다.개인과 기관이 각각 839억원, 23억원 순매수했고 외국인은 843억원 순매도했다.한편 서울 외환시장에서 원/달러 환율은 전날보다 19.7원 내린 1,229.9원에 거래를 마쳤다.(사진=연합뉴스)박준식기자 parkjs@wowtv.co.kr▶ 네이버 홈에서 [한국경제TV] 채널 구독하기 [생방송보기]▶ 대한민국 재테크 총집결! - [증권 / 주식상담 / 부동산]ⓒ 한국경제TV, 무단 전재 및 재배포 금지한국경제TV 관련뉴스해당 언론사에서 선정하며 언론사 페이지(아웃링크)로 이동해 볼 수 있습니다.[속보] 손석희 ""조주빈에 돈 줬다...위협에 속아""\'40조원\' 사상 최대 실탄 준비… 애국개미 승리할까""코로나19로 돈 벌지 않겠다""…특허권 내놓는 기업들""왜 하필""…자사 티셔츠 입은 조주빈, 이 회사 \'난감\'롯데 고승민, 사생활 논란…전 여친 ""두 번 유산"" 폭로좋아요0훈훈해요0슬퍼요0화나요0후속기사 원해요0기사제공 :']"
