,회사명,날짜,언론사,기사제목,링크,본문
5,삼성전자, 2020-09-2415:40,한국경제TV ,[공진단]9월 24일 공시진단 리뷰...화일약품,https://finance.naver.com/news/news_read.nhn?article_id=0000903680&office_id=215&mode=search&query=삼성전자&page=3,"['       [공진단]9월 24일 공시진단 리뷰...화일약품      기사입력2020-09-24 15:40기사원문좋아요훈훈해요좋아요 평가하기공감좋아요0훈훈해요0슬퍼요0화나요0후속기사 원해요0댓글[한국경제TV 정연국 기자]9월 23일자 공시를 기반으로 9월 24일에 방송했습니다.대표이사가 지분 전량을 매각하고 사표낸다면, 시장은 긴장합니다. 대표이사가 교체되기에 경영의 연속성이 깨지고, 매출전반을 예상하지 못하기 때문입니다. 일종의 안 좋은 신호로 해석됩니다. 다만, 대표이사 교체가 업종 전환에 따른불가피한 선택이었거나, M&A 등으로 지배 주주가 교체됐다면 일반적인 대표 이사 교체로 분류할 수 없습니다. 예단보다는 추이를 지켜봐야 합니다.△화일약품 [박필준 대표이사 지분 전량 매도, 약 308억3306만 매도(0918, 11.10→0%)]=화일약품은 약품 원료를 제조하는 기업입니다. 3년 연속 1000억원대의 매출을 기록하고 있습니다. 동시에 해외 영업에전문성을 보유한 기업입니다.=박필준 대표는 사임했고, 조중명·조경숙 각자 대표체제로 전환합니다. 조중명 대표는 크리스탈지노믹스 대표이기도 합니다. 조경숙 대표는 에스맥, 금호HT, 다이나노 등의 대표를 맡고 있습니다.크리스탈지노믹스는 코로나 치료제로 임상 2상을 진행 중이라고 밝혔습니다. 다이나노는 코로나 바이러스 차단 방법을연구합니다. 포괄적으로 제약 사업에 분류됩니다. 신약이 개발되면 화일약품에 해당 약품을 생산을 담당할 가능성이있습니다.=화일약품과 네 곳의 회사들은 경영진 외에도 지분으로 얽혀 있습니다.=위의 기업 중에서 다이노나만 비상장 회사입니다. 때문에 이번 대표이사교체의 목적에 다이노나의 우회 상장 가능성도 거론됩니다. 다이노나는 2018년에도 우회 상장을 시도한 적이 있습니다.△씨젠 [천경준 회장 105억7185만원 증여, (0916, 3.85% →3.67%%)]=씨젠은 코로나 진단 키트 업체입니다. 코로나 사태 초기 세계적인 유명세를 탔습니다. 천경준(사진) 씨젠 회장은 천종윤씨젠 대표의 삼촌입니다. 천 회장은 삼성전자 연구원으로 국내 최초 팩시밀리 개발, 휴대폰 개발에 공헌을 했습니다. 이런성과를 인정 받아 연봉이 100억원에 달하기도 했습니다. 부사장(CTO)을 끝으로 삼성전자에서 퇴사했습니다. 천 회장은천종윤 교수에게 창업을 권유하고 창업 자금으로 3억원을 줬다고 알려졌습니다.=천 회장은 지분 일부를 모교인 한양대에 기부했습니다. 기부 총액은 100억7863만원입니다. 증여를 받으면 증여세를내야 합니다. 증여세는 증여 발표일 전후(前後) 2개월간의 주가를 평균낸 금액을 기준으로 합니다. 따라서 증여 시점을결정할 때, 2개월간은 주가가 오르지 않을지에 대해서 숙고했을 가능성이 높습니다.=하지만, 천 회장의 이번 증여는 회사 경영권과 무관한 곳에 기부한 것이어서 그런 요인이 고려됐는지는 미지수입니다.=참고로 법인의 증여세는 개인의 증여세보다 낮습니다. 최대 세율이 절반에 불과하기도 합니다. 때문에 재벌들의 절세수단으로 오용되기도 합니다. 경영권에 영향을 끼치는 주식을 법인에 증여합니다. 해당 증여는 개인에 대한 증여보다 세율이 낮습니다. 의결권 행사가 필요한 경우는 해당 법인의 이사회가 재벌 총수의 뜻대로 행사를 하면 되기에 총수 입장에서는경영권 행사에 지장이 없습니다.△셀트리온헬스케어 [김성진 상무 등 8인의 특수 관계자 거래,  총액 54억2725만원]=임원이나 친인척은 회사 동향에 대한 정보와 정확성이 높습니다. 때문에 이들은 특수 관계인에 해당합니다. 특수 관계인이주가를 예측할 수 있는 정보를 미리 알 수 있다는 취지로, 금감원은 한 주만 거래를 해도 공시를 해야 하는 의무를부과했습니다.=셀트리온헬스케어의 김성진 상무 등의 거래가 포착됐습니다. 임원들도 있고, 친인척도 있습니다.=세부 사항을 보면, 김 상무는 매도이지만, 실제 장중에 매도를 한 것이 아닙니다. 임원들은 주식 보유 상황에서 퇴임을하면 보유 현황과 퇴임 일자를 공시하도록 합니다. 퇴임한 임원들의 보유 주식이 시장을 교란할 수 있기에 최소한 주식보유 현황을 공개하도록 한 것입니다.=김 상무는 퇴사했기에 매도로 표시됐을 뿐이지, 실제 매도한 것은 아닙니다. 다른 임원인 문광영·유헌영씨 역시동일합니다. 이들이 주식을 실제로 매수한 것이 아니고 스톡옵션을 행사한 것입니다.=따라서 이번 셀트리온헬스케어의 특수 관계인 공시는 주가의 방향을 가늠하기에는 적절하지 않아 보입니다.(자료제공 : 타키온 뉴스)정연국 기자 ykjeong@wowtv.co.kr▶ 네이버 홈에서 [한국경제TV] 채널 구독하기 [생방송보기]▶ 대한민국 재테크 총집결! - [증권 / 주식상담 / 부동산]ⓒ 한국경제TV, 무단 전재 및 재배포 금지한국경제TV 관련뉴스해당 언론사에서 선정하며 언론사 페이지(아웃링크)로 이동해 볼 수 있습니다.[속보] 북한 ""시신 없고 혈흔만...부유물만 태웠다""안혜경 42세 맞나…개미허리 관리 ""눈바디 체크중""\'커프\' 공유·윤은혜, 설레는 재회…""뽀뽀도 많이 했지""부모 \'빚투\' 마이크로닷, 자숙 끝 복귀…""용기 냈다""김정은 ""대단히 미안하다""…北 \'피격 사과\' 통지문 [전문]좋아요0훈훈해요0슬퍼요0화나요0후속기사 원해요0기사제공 :']"
6,삼성전자, 2020-09-2415:38,파이낸셜뉴스 ,"[fn마감시황]코스피, 개인 매수에도 2270선까지 밀려",https://finance.naver.com/news/news_read.nhn?article_id=0004500698&office_id=014&mode=search&query=삼성전자&page=3,"['       [fn마감시황]코스피, 개인 매수에도 2270선까지 밀려      기사입력2020-09-24 15:38기사원문좋아요훈훈해요좋아요 평가하기공감좋아요0훈훈해요0슬퍼요0화나요0후속기사 원해요0댓글   [파이낸셜뉴스] 코스피가 개인의 매수에도 2270선까지 밀렸다.   24일 코스피는 전거래일 대비 60.54포인트 내린 2272.70에 마감했다.   이날 코스피는 37.62포인트(1.61%) 내린 2295.62로 출발했다.   개인은 3534억원을 순매수했다.   하지만 외국인, 기관, 금융투자, 연기금 등은 각각 1950억원, 1538억원, 657억원, 471억원을 순매도하며 지수를 끌어내렸다.   규모별로 대형주(-2.36%), 중형주(-3.83%), 소형주(-3.54%) 모두 하락세다.   업종별로 비금속광물(-5.61%) 등 대부분이 하락세다.   시가총액 상위종목별로 삼성전자(-1.37%) 등 대부분이 하락세다.   반면 SK하이닉스(0.84%)는 상승세다.   코스닥은 전거래일 대비 36.50포인트 떨어진 806.95에 마감했다.  ggg@fnnews.com 강구귀 기자   ▶ 헉! 소리나는 스!토리 뉴스 [헉스]▶ \'아는 척\'하고 싶은 당신을 위한 [두유노우]▶ 날로먹고 구워먹는 금융이슈 [파인애플]  ※ 저작권자 ⓒ 파이낸셜뉴스. 무단 전재-재배포 금지파이낸셜뉴스 관련뉴스해당 언론사에서 선정하며 언론사 페이지(아웃링크)로 이동해 볼 수 있습니다.강남 ""이상화 내 벌이를 우습게 본다""제주에서 발견된 부부 시신, 현장 살펴보니..부부관계 기피하는 前걸그룹 멤버 남편 ""옷을..""코스닥 상장 후 수백억 번 주병진 반전 ""결혼도..""\'아들·딸 의혹\' 압수수색 영장에 나경원 반전 고백 ""추미애가..""좋아요0훈훈해요0슬퍼요0화나요0후속기사 원해요0기사제공 :']"
7,삼성전자, 2020-09-2415:34,조선비즈 ,"[마켓뷰] 코스피 2.59%, 코스닥 4.33% 급락(종합)",https://finance.naver.com/news/news_read.nhn?article_id=0000595178&office_id=366&mode=search&query=삼성전자&page=3,"['       [마켓뷰] 코스피 2.59%, 코스닥 4.33% 급락(종합)      기사입력2020-09-24 15:34기사원문좋아요훈훈해요좋아요 평가하기공감좋아요0훈훈해요0슬퍼요0화나요0후속기사 원해요0댓글 24일 코스피 지수가 전날보다 60.54포인트(2.59%) 하락한 2272.70으로 거래를 마쳤다. 지난 달 3일 이후 최저치다. 900선을 넘보던 코스닥 지수는 4.33% 하락하며 800선을 위협받고 있다. 전날 미국 뉴욕증시가 급락한 여파에 원·달러 환율도 강세로 돌아선 결과다. 미국 정치권과 연방준비제도의 추가 부양책이 단기간 나오지 않을 것이라는 우려에 달러 강세가 계속될 수 있는 상황에서 기간 조정으로 접어들면서 코스피 2200선도 내줄 수 있다는 전망이 나온다. 24일 오후 서울 중구 을지로 하나은행 본점 딜링룸 현황판에 코스피, 원·달러 환율이 표시되고 있다. /연합뉴스이날 유가증권시장에서 외국인과 기관은 각각 1950억원, 1538억원을 순매도했고 개인이 3534억원을 순매수했다. 개장 당시 순매도세로 출발한 개인들이 매수세로 돌아섰지만 증시 전반 분위기를 바꾸지는 못했다.이날 코스피 지수는 전날 미국 증시가 하락한 영향으로 2300선을 내주면서 출발했다. 특히 유럽에서 신종 코로나 바이러스 감염증(코로나19)이 재확산되면서 2차 봉쇄 조치에 대한 우려가 커졌고 미국 증시를 주도한 대형 기술주의 추가 조정 등의 악재가 이어진 점이 투자자들을 불안하게 했다. 전날 미국 연방준비제도 주요 인사들이 연준의 정책보다는 재정 부양책이 필요하다고 강조하면서 유동성과 정책에 대한 기대감이 실망으로 바뀐 점도 악재였다.업종별로 보면 운송장비(3.79%), 철강금속(3.56%), 건설(3.56%), 화학(3.42%), 증권(3.28%) 등의 낙폭이 컸다. 종목별로 보면 삼성전자(005930)를 비롯한 831개 종목이 하락했다. 테슬라의 배터리데이에 대한 실망감으로 SK이노베이션(096770), 삼성SDI(006400), 포스코케미칼 등 배터리 관련주들의 하락폭이 컸다. 현대차(005380), 기아차(000270)등 자동차 업종, 셀트리온(068270), 삼성바이오로직스(207940)등 제약바이오 업종, 넷마블(251270), 카카오(035720)등 인터넷커뮤니케이션 및 게임 업종 등도 큰 폭으로 하락했다. 상승 종목은 SK하이닉스(000660)등 68개에 그쳤다. 코스닥 지수는 36.59포인트(4.33%) 하락한 806.95로 거래를 마쳤다. 코스닥 시장에서는 외국인과 기관이 각각 425억원, 1211억원을 순매도했고 개인은 1851억원을 순매수했다. 금융투자업계에서는 증시의 조정세가 계속될 수 있다는 전망도 내놓고 있다. 이경민 대신증권 연구원은 ""코스피 직전 저점인 2270선에서 지지력을 테스트하고 있지만 이 지수대를 하향 이탈할 경우 2200선을 밑돌 가능성도 염두에 두어야 한다""며 ""2270선에서 지지력을 확보할 경우 기간 조정 양상을 거칠 수 있지만, 그렇지 않을 경우 2차 가격 조정 가능성이 있다""고 말했다. 그러면서 이경민 연구원은 ""미국의 증시 하락세가 지속되고 있고 원·달러 환율 반등은 코스피의 하방 압력을 높이는 변수다. 이로 인한 외환시장 변동성이 높아지고 있다""면서 ""유럽의 코로나19 재확산 여파로 유로 약세, 달러 강세의 압력이 커지고 있어서 당분간 환율 변동성 확대가 글로벌 금융 시장의 등락을 좌우할 가능성이 높다""고 말했다.[박정엽 기자 parkjeongyeop@chosunbiz.com] ▶네이버에서 조선비즈를 구독 하세요 ▶\'명품 경제뉴스\' 조선비즈 바로 가기 ▶올해 \'이 기업들\' 투자 안하면 영영 기회 없다 저작권자 ⓒ 조선비즈, 무단 전재 및 재배포 금지 조선비즈 관련뉴스해당 언론사에서 선정하며 언론사 페이지(아웃링크)로 이동해 볼 수 있습니다.햄버거에서 아예 뺀다고?… 금값 된 \'이 채소\'LG화학 직원들 ""다 키워놓으니 집 나간 꼴"" 분통\'몸값 30조\' IPO 최대어… 드디어 상장 나선다""플라이강원, 결국…"" LCC 연쇄 도산 현실화되나?""1년 넘게 집에 못 가"" 전 세계 20만명은 바다에 갇혔다좋아요0훈훈해요0슬퍼요0화나요0후속기사 원해요0기사제공 :']"
8,삼성전자, 2020-09-2415:27,파이낸셜뉴스 ,"삼성전자, '무선 충전 트리오'·'PD 배터리팩 2만mAh' 출시",https://finance.naver.com/news/news_read.nhn?article_id=0004500684&office_id=014&mode=search&query=삼성전자&page=3,"['       삼성전자, \'무선 충전 트리오\'·\'PD 배터리팩 2만mAh\' 출시      기사입력2020-09-24 15:27기사원문좋아요훈훈해요좋아요 평가하기공감좋아요0훈훈해요0슬퍼요0화나요0후속기사 원해요0댓글무선 충전 트리오[파이낸셜뉴스] 삼성전자가 스마트 기기 배터리 걱정을 줄여 줄 액세서리 2종을 24일 출시한다고 24일 밝혔다.   \'무선 충전 트리오\'는 스마트폰·무선 이어폰·스마트 워치 등 최대 3개 기기의 동시 무선 충전이 가능하다. 충전기 내부가 6개의 코일로 이루어져 있어 충전 위치도 자유롭다.   \'무선 충전 트리오\'는 슬림하고 컴팩트한 디자인으로 뛰어난 휴대성을 제공하며, 심플한 아이콘의 LED 알림 기능도 지원한다. \'무선 충전 트리오\'는 블랙·화이트 2가지 색상으로 출시되며, 가격은 9만 9000원이다.   또 역대 최대 용량의 \'PD 배터리팩 2만mAh\'도 출시한다. \'PD 배터리팩 2만mAh\'은 25W 초고속 충전 기능을 지원하며, 한 번에 3개 스마트 기기의 동시 충전도 가능하다. 특히 과충전·합선·온도 변화·충격 등으로 부터 배터리를 보호하는 안전 기능이 내장되어 있어 안심하고 사용할 수 있으며, 갤럭시 스마트 기기 외에 다양한 기기와도 자유롭게 호환이 가능하다. \'PD 배터리팩 2만mAh\'는 다크 그레이 색상으로 출시되며, 가격은 7만 7000원이다.   \'무선 충전 트리오\'와 \'PD 배터리팩 2만mAh\'은 삼성전자 홈페이지와 전국 삼성디지털프라자, 쿠팡·11번가·G마켓 등 온라인 오픈마켓 등에서 구입할 수 있다.  2만mAh 대용량 배터리팩  true@fnnews.com 김아름 기자   ▶ 헉! 소리나는 스!토리 뉴스 [헉스]▶ \'아는 척\'하고 싶은 당신을 위한 [두유노우]▶ 날로먹고 구워먹는 금융이슈 [파인애플]  ※ 저작권자 ⓒ 파이낸셜뉴스. 무단 전재-재배포 금지파이낸셜뉴스 관련뉴스해당 언론사에서 선정하며 언론사 페이지(아웃링크)로 이동해 볼 수 있습니다.강남 ""이상화 내 벌이를 우습게 본다""제주에서 발견된 부부 시신, 현장 살펴보니..부부관계 기피하는 前걸그룹 멤버 남편 ""옷을..""\'아들·딸 의혹\' 압수수색 영장에 나경원 반전 고백 ""추미애가..""코스닥 상장 후 수백억 번 주병진 반전 ""결혼도..""좋아요0훈훈해요0슬퍼요0화나요0후속기사 원해요0기사제공 :']"
9,삼성전자, 2020-09-2415:27,머니S ,"다가온 국감, 또 ‘기업인 때리기’ 되풀이 하나… 재계 ‘초긴장’",https://finance.naver.com/news/news_read.nhn?article_id=0000598049&office_id=417&mode=search&query=삼성전자&page=3,"['       다가온 국감, 또 ‘기업인 때리기’ 되풀이 하나… 재계 ‘초긴장’      기사입력2020-09-24 15:27기사원문좋아요훈훈해요좋아요 평가하기공감좋아요0훈훈해요0슬퍼요0화나요0후속기사 원해요0댓글21대 국정감사가 2주 앞으로 다가오면서 기업인 증인신청에 대한 우려가 커진다. /사진=뉴시스 21대 국회의 첫 국정감사가 2주 앞으로 다가오면서 재계의 긴장감이 높아진다. 또다시 기업인을 줄소환해 망신주기식 호통국감을 되풀이할 것이란 우려에서다.24일 재계에 따르면 국회는 다음달 7일부터 3주간의 일정으로 국감을 진행한다. 21대 국회들어 처음으로 진행하는 국감인 만큼 여야 모두 국정전반에 걸쳐 ‘현미경 감사’를 하겠다며 날을 세우는 분위기다. 재계는 이 같은 불똥이 기업으로 튈까 전전긍긍하는 분위기다. 벌써 이재용 삼성전자 부회장을 비롯한 5대그룹 총수들을 증인으로신청한 상임위도 있다. 국회 농림축산식품해양수산위원회 증인 신청 명단에 이재용 부회장과 정의선 현대차그룹 수석부회장, 최태원 SK그룹 회장, 구광모 LG그룹 회장, 신동빈 롯데그룹 회장 등 5대그룹 총수 이름이 올라간 것. 위원회는 대기업 총수들을 직접 불러 농어촌 상생협력기금 조성이 지지부진한 이유를 집중적으로 따져물을 계획인 것으로 알려졌다.과방위에서는 한성숙 네이버 대표, 여민수 카카오 대표 등의 증인 신청 여부를 검토 중인 것으로 알려졌으며 정무위는 복합쇼핑몰 입점 문제로 정용진 신세계 부회장을 증인 명단에 올렸다. 국감 일정이 다가올 수록 기업인을 증인으로 신청하는 사례는 더욱 늘어날 것으로 예상된다.\xa0그동안 국감에서는 매년 각 상임위 의원들이 기업인들을 증인으로 불러 공격적으로 질문을 쏟아내면서 정작 답변 기회조차 제대로 주지 않아 ‘호통 국감’, ‘망신주기 국감’ 논란을 되풀이 해왔다.재계 관계자는 “국감은 기업인 감사가 아니라 국정운영 실태 전반을 점검하는 자리”라며 “기업 경영에 차질일 줄 수있는 무분별한 기업인 소환을 반복하지 말아야 한다”고 말했다. 이한듬 기자 mumford@mt.co.kr▶고수들의 재테크 비법 영상 ▶거품 뺀 솔직 시승기 ▶머니S기사, 네이버 메인에서 보세요<저작권자 ⓒ \'성공을 꿈꾸는 사람들의 경제 뉴스\' 머니S, 무단전재 및 재배포 금지>머니S 관련뉴스해당 언론사에서 선정하며 언론사 페이지(아웃링크)로 이동해 볼 수 있습니다.안희정 전치 30주 교통사고 ""끝났다 생각""블랙핑크 제니, 검정 생머리 \'매혹적\' 입술48층 아파트서 불… 아기 안고 칸막이 뚫었다""꽃도령이 따로없네"" 임영웅 한복美도 \'찰떡\'인천대교에 모닝 차량만 덩그러니… 운전자는?좋아요0훈훈해요0슬퍼요0화나요0후속기사 원해요0기사제공 :']"
10,삼성전자, 2020-09-2415:26,스포츠조선 ,"삼성전자, '갤럭시 S20 FE' 공개…소비자 선호 기능 확대",https://finance.naver.com/news/news_read.nhn?article_id=0003635058&office_id=076&mode=search&query=삼성전자&page=3,"['       삼성전자, \'갤럭시 S20 FE\' 공개…소비자 선호 기능 확대      기사입력2020-09-24 15:26기사원문좋아요훈훈해요좋아요 평가하기공감좋아요0훈훈해요0슬퍼요0화나요0후속기사 원해요0댓글삼성전자가 23일 온라인을 통해 \'Samsung Galaxy Unpacked for Every Fan(모든 팬들을 위한 삼성 갤럭시 언팩)\'을 열고, 갤럭시 팬들이 가장 선호하는 기능들을 모두 탑재한 \'갤럭시 S20 팬 에디션(갤럭시 S20 FE)\'을 공개했다. 갤럭시 S20 FE는 갤럭시S20 이용자들이 선호하는 기능은 살리면서도 가격을 낮춘 보급형 스마트폰이다. 출고가는 80만~90만원 사이가 될 것으로 알려졌다.  노태문 삼성전자 사장(무선사업부장)은 ""지속적으로 팬들의 피드백을 듣고 소통하고 있으며 \'갤럭시 S20\' 출시 후 가장 선호하는 부분과 가장 자주 사용하는 기능, 새 스마트폰에 기대하고 있는 점 등에 귀를 기울였다""며 ""\'갤럭시 S20 FE\'는 의미 있는 혁신이 담긴 \'갤럭시 S20\'시리즈의 확장 모델로 최고의 갤럭시 스마트폰 경험을 더 많은 소비자들이 누릴 수 있게 할 것""이라고 말했다.갤럭시 S20 FE는 3200만 고화소의 전면 카메라와 갤럭시 스마트폰 중 가장 큰 듀얼 픽셀 이미지 센서를 후면에 탑재, 언제 어디서나 선명한 사진과 동영상 촬영이 가능하다. 사용자는 3200만 화소의 테트라 비닝(Tetra binning) 기술이 적용된 전면 카메라를 활용해 저조도 환경에서도 또렷하고 생생한 셀피 촬영을 할 수 있다. 라이브 포커스 기능을 활용해 배경을 감각적으로 흐릿하게 처리한 셀피 촬영도 가능하다.후면에는 갤럭시 스마트폰 중 가장 큰 듀얼 픽셀 이미지 센서를 탑재해 어떤 상황에서도 밝고 선명한 사진 촬영이 가능하다. AI 기반의 멀티 프레임 프로세싱(multi-frame processing)으로 여러 프레임 정보를 빠르게 파악해 배경의 노이즈나 흔들림을 줄여줌으로써 어두운 레스토랑이나 별을 촬영하는 등 저조도 환경에서도 선명한 사진 촬영을 지원한다. 갤럭시 S20 FE는 멀리 있는 피사체도 또렷하게 촬영할 수 있는 스페이스 줌(Space Zoom) 기능을 지원한다. 광학 줌을 통해 화질의 손상 없이 최대 3배까지, AI 기반의 슈퍼 레졸루션 줌 기능을 결합해 최대 30배까지 줌 촬영이 가능하다.이밖에 한 번의 촬영으로 일상의 순간을 다양하고 특별하게 기록할 수 있는 싱글 테이크(Single take) 기능, 역동적인 스포츠를 즐길 때처럼 움직임이 많은 동작을 촬영할 때 흔들림을 최소화해 안정적인 영상 촬영이 가능한 \'슈퍼 스테디(Super steady)\' 기능도 탑재했다. 6.5형의 인피니티-O 슈퍼 아몰레드(Infinity-O Super AMOLED) 디스플레이를 탑재하고, 120Hz 주사율을 지원해 영상이나 고사양 게임, 인터넷 브라우징 등 사용자가 어떤 콘텐츠를 보더라도 보다 부드럽고 쾌적한 화면을 즐길 수 있다.갤럭시 S20 FE는 5G 이동통신과 엑스박스 게임 패스 얼티밋(Xbox Game Pass Ultimate)을 통해 진일보한 게임 경험도 제공한다. 사용자는 \'갤럭시 S20 FE\'를 이용해 이동 중에도 마인크래프트 던전(Minecraft Dungeons), 포르자 호라이즌4(Forza Horizon 4) 등 100여 개의 엑스박스 인기 게임을 즐길 수 있다. 무선 충전이 가능하며, 무선 배터리 공유 기능을 지원해 Qi 인증을 받은 스마트폰과 갤럭시 웨어러블 기기도 충전할 수 있다.삼성전자는 \'갤럭시 S20 FE\'에 대해 3세대 안드로이드 운영체제(OS) 업그레이드를 보장해 항상 사용자들이 안전한 환경에서 최신 모바일 기능을 사용할 수 있도록 할 계획이다.김세형 기자 fax123@sportschosun.com▶무료로 보는 오늘의 운세▶""아직 대어는 없다"" 7파전 신인왕 경합...팀성적도 고려대상?- Copyrightsⓒ 스포츠조선(http://sports.chosun.com/), 무단 전재 및 재배포 금지좋아요0훈훈해요0슬퍼요0화나요0후속기사 원해요0기사제공 :']"
