,회사명,날짜,언론사,기사제목,링크,본문
4,삼성전자, 2020-12-1009:31,머니투데이 ,"삼성전자서비스, '2020 콜센터품질지수' 가전·휴대폰 상담 우수기업 선정",https://finance.naver.com/news/news_read.nhn?article_id=0004512379&office_id=008&mode=search&query=삼성전자&page=14,"['       삼성전자서비스, \'2020 콜센터품질지수\' 가전·휴대폰 상담 우수기업 선정      기사입력2020-12-10 09:31기사원문좋아요훈훈해요좋아요 평가하기공감좋아요0훈훈해요0슬퍼요0화나요0후속기사 원해요0댓글 [머니투데이 심재현 기자] 삼성전자서비스 상담사가 상담 서비스를 하고 있다. /사진제공=삼성전자서비스삼성전자서비스가 \'2020 콜센터품질지수\'에서 \'가전 및 휴대폰 상담 서비스\' 부문 우수 기업으로 선정됐다고 10일 밝혔다. 한국표준협회에서 주관하는 \'2020 콜센터품질지수\' 조사는 전문가의 전화 모니터링과 고객의 콜센터 이용 만족도 평가를 통해 콜센터의 상담 서비스 품질을 측정하는 지표다. 이번 조사에서 삼성전자서비스는 △친절한 응대 △적극적인 설명 △차별화된 서비스 제공 등 다수 평가 항목에서 높은 점수를 받아 우수 기업으로 선정됐다.삼성전자서비스는 고객이 언제 어디서나 신속 정확한 상담을 받을 수 있도록 365일 24시간 상담 서비스를 제공한다. 센터 위치, 수리 비용과 같은 고객의 단순 문의 해결은 물론 제품별 기술 상담사가 원격 점검 등 수준 높은 전문 기술 상담도 제공한다. 삼성전자서비스는 최근 고객의 상담 이용 편의를 높이기 위해 인공지능 채팅 상담 \'챗봇\' 서비스를 도입했다. 챗봇은 고객이 로봇과 문자 채팅을 통해 365일 24시간 상담을 받을 수 있도록 구현된 인공지능 상담 플랫폼이다. 고객은 챗봇을 활용해 제품 관련 기술 상담, 서비스 접수 등 원하는 서비스를 시간과 장소에 상관없이 이용할 수 있다. IoT(사물인터넷) 기반으로 제품의 상태와 정보를 원격 관리하는 \'HRM(홈어플라이언스 리모트 매니지먼트) 원격 점검\'도 삼성전자서비스의 대표적인 상담 시스템으로 손꼽힌다. 상담사는 HRM 서버를 통해 분석된 내용을 바탕으로 제품을 진단하고 필요할 경우 제품을 원격으로 제어해 고객의 불편을 신속 정확하게 해결한다. 스마트폰 화면을 보면서 센터 찾기, 서비스 예약 등을 할 수 있는 \'보이는 ARS\'도 도입해 고객이 상담원과의 통화 연결을 기다릴 필요 없이 빠르고 편리하게 원하는 상담 메뉴를 선택할 수 있도록 했다. 삼성전자서비스는 상담사의 역량 강화에도 노력을 기울였다. 고객과 소통하고 공감하는 상담 서비스 제공을 위해 정기적으로 \'상담 기법 교육\'과 \'상담 능력 평가\'를 실시하고소비자상담사, CS리더스, 심리상담사 등 관련 전문자격 취득도 지원해 상담사의 전문성 향상을 꾀했다. 윤석한 삼성전자서비스 고객상담팀장(상무)는 ""앞으로도 고객 감동의 상담 서비스 실천을 위해 끊임없는 혁신 활동을 추진해 고객이 원하는 그 이상의 상담 서비스를 제공할 것""이라고 말했다.심재현 기자 urme@mt.co.kr▶부동산 투자는 [부릿지]▶조 변호사의 가정상담소▶줄리아 투자노트 <저작권자 ⓒ \'돈이 보이는 리얼타임 뉴스\' 머니투데이, 무단전재 및 재배포 금지>머니투데이 관련뉴스해당 언론사에서 선정하며 언론사 페이지(아웃링크)로 이동해 볼 수 있습니다.\'킹덤\' 김은희 작가, \'도깨비\' 김은숙에 ""왜 키스를 시켜""트럼프, 백악관 남을 묘수 고민…멜라니아는 짐 싼다""필름 끊길 때까지 마셔""…송소희 술버릇 고백""손혜원, 대통령에 XXXX라고"" 개국본 대표 폭로\'배용준♥\' 박수진, 특혜 논란 이후 3년만에 근황좋아요0훈훈해요0슬퍼요0화나요0후속기사 원해요0기사제공 :']"
5,삼성전자, 2020-12-1009:30,머니S ,"삼성전자서비스, 2020 콜센터 품질지수 우수 기업 선정",https://finance.naver.com/news/news_read.nhn?article_id=0000630014&office_id=417&mode=search&query=삼성전자&page=14,"['       삼성전자서비스, 2020 콜센터 품질지수 우수 기업 선정      기사입력2020-12-10 09:30기사원문좋아요훈훈해요좋아요 평가하기공감좋아요0훈훈해요0슬퍼요0화나요0후속기사 원해요0댓글삼성전자서비스가 2020 콜센터 품질지수 우수 기업에 선정됐다. / 사진=삼성전자서비스삼성전자서비스는 \'2020 KS-CQI(콜센터 품질지수)\' 조사에서 \'가전 및 휴대폰 상담 서비스\' 부문 우수 기업으로 선정됐다고 10일 밝혔다. 한국표준협회에서 주관하는 \'KS-CQI\' 조사는 \'전문가의 전화 모니터링\'과 \'고객의 콜센터 이용 만족도 평가\'를 통해 콜센터의 상담 서비스 품질을 측정하는 지표이다.이번 조사에서 삼성전자서비스는 ▲친절한 응대 ▲적극적인 설명 ▲차별화된 서비스 제공 등 다수 평가 항목에서 높은 점수를 받아 우수 기업으로 선정됐다.\xa0삼성전자서비스는 고객이 언제 어디서나 신속 정확한 상담을 받을 수 있도록 365일 24시간 상담 서비스를 제공하고 있다. 센터 위치, 수리 비용과 같은 고객의 단순 문의 해결은 물론 제품별 기술 상담사가 원격 점검 등 수준 높은 전문 기술 상담도 제공하고 있다.최근에는 고객의 상담 이용 편의를 높이기 위해 인공지능 채팅 상담 \'챗봇\' 서비스를 도입했다. 챗봇은 고객이 로봇과의 문자 채팅을 통해 365일 24시간 상담을 받을 수 있도록 구현된 인공지능 상담 플랫폼이다. 고객은 챗봇을 활용해 제품 관련 기술 상담, 서비스 접수 등 원하는 서비스를 시간과 장소에 상관없이 이용할 수 있다.사물인터넷(IoT) 기반으로 제품의 상태와 정보를 원격 관리하는 \'HRM 원격 점검\'도 삼성전자서비스의 대표적인 상담 시스템으로 손꼽힌다. 상담사는 HRM 서버를 통해 분석된 내용을 바탕으로 제품을 진단하고 필요시 제품을 원격으로 제어하여 고객의 불편을 신속 정확하게 해결한다.또한 스마트폰 화면을 보면서 센터 찾기, 서비스 예약 등의 작업이 가능한 \'보이는 ARS\'도 도입해 고객이 상담원과의 통화 연결을 기다릴 필요 없이 빠르고 편리하게 원하는 상담 메뉴를 선택할 수 있도록 했다.삼성전자서비스는 상담사의 역량 강화에도 노력을 기울이고 있다. 고객과 소통하고 공감하는 상담 서비스 제공을 위해 정기적으로 \'상담 기법 교육\'과 \'상담 능력 평가\'를 실시하고 있다. 또한 소비자상담사, CS리더스, 심리상담사 등 관련 전문자격 취득도 적극 지원하여 상담사의 전문성 향상을 위해 노력하고 있다.윤석한 삼성전자서비스 고객상담팀장(상무)은 ""앞으로도 고객 감동의 상담 서비스 실천을 위해 끊임없는 혁신 활동을 추진해 고객이 원하는 그 이상의 상담 서비스를 제공할 것""이라고 전했다.이한듬 기자 mumford@mt.co.kr▶뜨거운 증시, 오늘의 특징주는?  ▶거품 뺀 솔직 시승기▶머니S, 네이버 메인에서 보세요 <저작권자 ⓒ \'성공을 꿈꾸는 사람들의 경제 뉴스\' 머니S, 무단전재 및 재배포 금지>머니S 관련뉴스해당 언론사에서 선정하며 언론사 페이지(아웃링크)로 이동해 볼 수 있습니다.\'야한 타투\' 다 벗은 뒤태… 앞모습은 아찔고기 깻잎 이혼사유… 부부관계가 문제?한혜진, 브라탑과 레깅스 입고 뽐낸 \'감탄 몸매\'헉! 엉덩이 다 보여… ""교복이 너무 짧아요""""궁금해? 다 보여줄게""… 황승언, 과감히 벗었다좋아요0훈훈해요0슬퍼요0화나요0후속기사 원해요0기사제공 :']"
6,삼성전자, 2020-12-1009:30,한국경제TV ,"코스피, 급락 출발후 회복 시도…동학개미 매수세 '확대'",https://finance.naver.com/news/news_read.nhn?article_id=0000921602&office_id=215&mode=search&query=삼성전자&page=14,"['       코스피, 급락 출발후 회복 시도…동학개미 매수세 \'확대\'      기사입력2020-12-10 09:30기사원문좋아요훈훈해요좋아요 평가하기공감좋아요0훈훈해요0슬퍼요0화나요0후속기사 원해요0댓글[한국경제TV 오민지 기자]지난 밤 뉴욕 증시가 줄줄이 하락한 가운데, 코스피도 급락하며 장을 출발하고 있다.10일 코스피는 오전 9시 10분 현재 기준 전날보다 34,76포인트(-1.26%) 떨어진 2,720.71에 거래되고 있다.외국인과 기관이 각각 1,045억원, 431억원 순매도하며 하락세를 이끌고 있고 개인이 1,490억원 순매수했다.시총 상위 종목으로는 삼성전자(-1.62%), SK하이닉스(-3.32%), LG화학(-2.15%), 삼성전자우(-0.60%), 삼성바이오로직스(-1.70%), 셀트리온(-1.84%), NAVER(-0.87%), 현대차(-1.31%), 삼성SDI(-1.94%), 카카오(-1.33%), 기아차(-1.10%) 등 모두 하락세다.코스닥 역시 하락하고 있다.코스닥은 전날보다 4.51포인트(-0.49%) 떨어진 909.30에 거래되고 있다.외국인과 개인이 각각 168억원과 492억원 순매수한 반면 기관은 500억원 순매도했다.시총 상위 종목으로는 셀트리온헬스케어(-0.07%), 카카오게임즈(-2.35%), 에코프로비엠(-0.98%), 펄어비스(-0.93%), CJ ENM(-0.44%) 등이 하락세다.셀트리온제약(2.43%), 에이치엘비(0.51%), 씨젠(1.75%), 알테오젠(1.05%), 제넥신(0.39%), 케이엠더블유(1.82%) 등은 상승세다.원·달러 환율은 소폭 올랐다.서울 외환시장에서 원·달러 환율은 전날보다 1.20원(0.11%) 올라 1,086.00원에 거래되고 있다.오민지기자 omg@wowtv.co.kr▶ 네이버 홈에서 [한국경제TV] 채널 구독하기 [생방송보기]▶ 대한민국 재테크 총집결! - [증권 / 주식상담 / 부동산]ⓒ 한국경제TV, 무단 전재 및 재배포 금지한국경제TV 관련뉴스해당 언론사에서 선정하며 언론사 페이지(아웃링크)로 이동해 볼 수 있습니다.김혜선, 세 번째 파경?…""혼인신고도 안 해""소율, 남편 문희준과 무슨 일?…""남편 없어요""김현숙, 결혼 6년 만에 파경…""이혼 조정 중""영탁, 확진 이찬원에 ""몸짱 돼서 나오거라""금비, 12년 만에 거북이 완전체 무대 ""잊지 않을 것""좋아요0훈훈해요0슬퍼요0화나요0후속기사 원해요0기사제공 :']"
7,삼성전자, 2020-12-1009:26,파이낸셜뉴스 ,"삼성전자서비스, '2020 KS-CQI' 우수 기업 선정",https://finance.naver.com/news/news_read.nhn?article_id=0004544431&office_id=014&mode=search&query=삼성전자&page=14,"['       삼성전자서비스, \'2020 KS-CQI\' 우수 기업 선정      기사입력2020-12-10 09:26기사원문좋아요훈훈해요좋아요 평가하기공감좋아요0훈훈해요0슬퍼요0화나요0후속기사 원해요0댓글삼성전자서비스 임직원이 KS-CQI 우수 기업 선정 기념 사진을 촬영하고 있다. [파이낸셜뉴스] 삼성전자서비스가 \'2020 KS-CQI(콜센터 품질지수)\' 조사에서 \'가전 및 휴대폰 상담 서비스\' 부문 우수 기업으로 선정됐다고 10일 밝혔다.   한국표준협회에서 주관하는 \'KS-CQI\' 조사는 \'전문가의 전화 모니터링\'과 \'고객의 콜센터 이용 만족도 평가\'를 통해 콜센터의 상담 서비스 품질을 측정하는 지표이다.   이번 조사에서 삼성전자서비스는 △친절한 응대 △적극적인 설명 △차별화된 서비스 제공 등 다수 평가 항목에서 높은 점수를 받아 우수 기업으로 선정됐다.   이 회사는 고객이 언제 어디서나 신속 정확한 상담을 받을 수 있도록 365일 24시간 상담 서비스를 제공하고 있다.   센터 위치, 수리 비용과 같은 고객의 단순 문의 해결은 물론 제품별 기술 상담사가 원격 점검 등 수준 높은 전문 기술 상담도 제공하고 있다.   최근에는 고객의 상담 이용 편의를 높이기 위해 인공지능 채팅 상담 \'챗봇\' 서비스를 도입했다.   챗봇은 고객이 로봇과의 문자 채팅을 통해 365일 24시간 상담을 받을 수 있도록 구현된 인공지능 상담 플랫폼이다. 고객은 챗봇을 활용해 제품 관련 기술 상담, 서비스 접수 등 원하는 서비스를 시간과 장소에 상관없이 이용할 수 있다.   사물인터넷(IoT) 기반으로 제품의 상태와 정보를 원격 관리하는 \'HRM 원격 점검\'도 삼성전자서비스의 대표적인 상담 시스템으로 손꼽힌다.   상담사는 HRM 서버를 통해 분석된 내용을 바탕으로 제품을 진단하고 필요시 제품을 원격으로 제어하여 고객의 불편을 신속 정확하게 해결한다.   또 스마트폰 화면을 보면서 센터 찾기, 서비스 예약 등의 작업이 가능한 \'보이는 ARS\'도 도입해, 고객이 상담원과의 통화 연결을 기다릴 필요 없이 빠르고 편리하게 원하는 상담 메뉴를 선택할 수 있도록 했다.   삼성전자서비스는 상담사의 역량 강화에도 노력을 기울이고 있다.   고객과 소통하고 공감하는 상담 서비스 제공을 위해 정기적으로 \'상담 기법 교육\'과 \'상담 능력 평가\'를 실시하고 있다. 소비자상담사, CS리더스, 심리상담사 등 관련 전문자격 취득도 적극 지원해 상담사의 전문성 향상을 위해 노력하고 있다.   윤석한 삼성전자서비스 고객상담팀장 상무는 ""앞으로도 고객 감동의 상담 서비스 실천을 위해 끊임없는 혁신 활동을 추진하여, 고객이 원하는 그 이상의 상담 서비스를 제공할 것""이라고 전했다.    seo1@fnnews.com 김서원 기자   ▶ 헉! 소리나는 스!토리 뉴스 [헉스]▶ \'아는 척\'하고 싶은 당신을 위한 [두유노우]▶ 날로먹고 구워먹는 금융이슈 [파인애플]  ※ 저작권자 ⓒ 파이낸셜뉴스. 무단 전재-재배포 금지파이낸셜뉴스 관련뉴스해당 언론사에서 선정하며 언론사 페이지(아웃링크)로 이동해 볼 수 있습니다.""새벽 3시 자꾸 남편이 관계를.. 하고 나면.."" 아내의 고민""40년 동안 가발 안 벗은 이덕화가..."" 가발 벗더니 폭탄 발언김태희 아버지 H통운 회장이었다.. 연매출이 무려김다솜 충격고백 ""롱치마 입었는데 남편이 치마를 확..""손혜원 동생 죽음에 의문의 글 ""죽이고 싶은..""좋아요0훈훈해요0슬퍼요0화나요0후속기사 원해요0기사제공 :']"
8,삼성전자, 2020-12-1009:23,연합뉴스 ,"코스피 장 초반 하락 흐름…2,720선 등락(종합)",https://finance.naver.com/news/news_read.nhn?article_id=0012071316&office_id=001&mode=search&query=삼성전자&page=14,"['       코스피 장 초반 하락 흐름…2,720선 등락(종합)      기사입력2020-12-10 09:23기사원문좋아요훈훈해요좋아요 평가하기공감좋아요0훈훈해요0슬퍼요0화나요0후속기사 원해요0댓글 (서울=연합뉴스) 김태종 기자 = 9일 사상 최고가를 경신했던 코스피가 10일 하락세로 출발했다.코스피 장 초반 하락 흐름…2,720선 등락 (GIF)[제작 남궁선. 게티이미지뱅크 제공]    이날 오전 9시 6분 코스피는 전날보다 36.77포인트(-1.33%) 내린 2,718.70을 나타냈다.     지수는 5.13포인트(0.19%) 내린 2,750.34에 출발해 낙폭이 확대됐다.    개인이 1천207억원을 순매수하고 있지만, 외국인과 기관이 각각 878억원과 310억원을 순매도하고 있다.     지난 9일(현지시간) 뉴욕증시가 미국의 부양책 협상 난항 등으로 하락한 것이 장 초반 영향을 끼치고 있다.     다우존스30 산업평균지수는 전장보다 105.07포인트(0.35%), 스탠더드앤드푸어스(S&P)500 지수는 29.43포인트(0.79%) 각각 내렸다. 기술주 중심의 나스닥 지수는 243.82포인트(1.94%) 급락 마감했다.    미국 부양책과 관련해 민주당과 공화당이 모두 상대측이 올바른 계획과 접근법을 가지고 있지 않다고 비난하면서 난항이 지속되고 있다.     전일 미국의 신종 코로나바이러스 감염증(코로나19) 확진자는 21만명을 넘어서는 등 코로나19 확산세가 진정될 조짐이 없는 점도 부담으로 작용했다.     서상영 키움증권 연구원은 ""미 증시는 추가 부양책에 대한 기대로 상승 출발했으나, 대부분의 종목에 대한 차익 매물이 출회되며 하락 전환했다""며 ""특히 일부 고평가 논란이 일고 있는 종목군에 대한 투자의견 하향 조정이 속속 발표되자 기술주 중심으로 매물이 쏟아졌다""고 분석했다.     시가총액 상위 종목 가운데에는 삼성전자(-1.49%)와 SK하이닉스(-3.32%), LG화학(-2.39%), 삼성바이오로직스(-1.95%), 현대차(-1.04%) 등 시총 10위 이내 전 종목이 약세를 보이고 있다.     업종별로는 종이·목재(1.34%), 건설업(1.09%), 전기가스업(1.63%) 등은 상승하고 있고, 전기·전자(-1.82%)와 기계(-1.29%), 의약품(-1.09%), 운송장비(-1.00%), 금융업(-0.91%) 등은 하락하고 있다.     같은 시간 코스닥은 5.56포인트(0.61%) 하락한 908.25를 가리켰다.     지수는 0.79포인트(0.09%) 내린 913.02에 시작해 910선을 내줬다.     개인과 외국인이 344억원과 258억원 순매수에 나섰고, 기관이 442억원을 순매도하고 있다.     시가총액 상위 주 가운데에는 에이치엘비(0.61%)와 씨젠(1.85%)이 소폭 상승한 반면, 셀트리온헬스케어(-2.60%)와 셀트리온제약(-2.15%), 카카오게임즈(-3.06%) 등은 하락 중이다.     taejong75@yna.co.kr▶네이버에서도 뉴스는 연합뉴스[구독 클릭]▶[팩트체크]코로나 백신 \'부작용 면책\'은 국제공통?▶제보하기<저작권자(c) 연합뉴스(https://www.yna.co.kr/), 무단 전재-재배포 금지>연합뉴스 관련뉴스해당 언론사에서 선정하며 언론사 페이지(아웃링크)로 이동해 볼 수 있습니다.\xa0\'극단선택\' 억만장자, 유산 중 성범죄로 325억원 지불\xa0대형 연 날리던 소년 하늘로 끌려 올라갔다 추락\xa0아들과 뺨 때리기 놀이하다 아빠 사망\xa0반크 ""EBS 수능교재도 파오차이를 김치로 오역""\xa0추미애, 본회의장서 \'내가 검찰을 떠난 이유\' 탐독좋아요0훈훈해요0슬퍼요0화나요0후속기사 원해요0기사제공 :']"
9,삼성전자, 2020-12-1009:21,머니투데이 ,'네 마녀의 날' 코스피 하락 출발에…시총 상위주 '우수수',https://finance.naver.com/news/news_read.nhn?article_id=0004512351&office_id=008&mode=search&query=삼성전자&page=14,"['       \'네 마녀의 날\' 코스피 하락 출발에…시총 상위주 \'우수수\'      기사입력2020-12-10 09:21기사원문좋아요훈훈해요좋아요 평가하기공감좋아요0훈훈해요0슬퍼요0화나요0후속기사 원해요0댓글 [머니투데이 강민수 기자] [[특징주]]코스피가 하락 출발한 가운데 시가총액 상위주가 약세를 보인다.10일 오전 9시 19분 현재 삼성전자는 전 거래일 대비 900원(1.22%) 내린 7만3000원을 나타내고 있다. SK하이닉스는 3000원(2.49%) 하락한 11만7500원을 보인다. 이외 LG화학(-1.79%), 삼성바이오로직스(-0.12%), NAVER(-1.04%), 현대차(-0.26%) 등 시총 상위 10개주가 대부분 내림세다. 셀트리온(0.28%)만 홀로 강보합세다.이날 코스피는 미국 경기부양책 난항 소식에 선물옵션 동시만기일까지 겹치면서 약세 출발했다. 이 시각 현재 코스피는 27.29포인트(0.99%) 내린 2728.18을 보인다. 외국인과 기관은 각각 1212억원, 1876억원을 순매도 중이고, 개인은 홀로 3119억원을 사들이고 있다. 강민수 기자 fullwater7@mt.co.kr▶부동산 투자는 [부릿지]▶조 변호사의 가정상담소▶줄리아 투자노트 <저작권자 ⓒ \'돈이 보이는 리얼타임 뉴스\' 머니투데이, 무단전재 및 재배포 금지>머니투데이 관련뉴스해당 언론사에서 선정하며 언론사 페이지(아웃링크)로 이동해 볼 수 있습니다.""손혜원, 대통령에 XXXX라고"" 개국본 대표 폭로\'킹덤\' 김은희 작가, \'도깨비\' 김은숙에 ""왜 키스를 시켜""트럼프, 백악관 남을 묘수 고민…멜라니아는 짐 싼다""필름 끊길 때까지 마셔""…송소희 술버릇 고백\'배용준♥\' 박수진, 특혜 논란 이후 3년만에 근황좋아요0훈훈해요0슬퍼요0화나요0후속기사 원해요0기사제공 :']"
10,삼성전자, 2020-12-1009:19,아이뉴스24 ,"삼성전자서비스, 콜센터 품질지수 조사서 우수 기업 선정",https://finance.naver.com/news/news_read.nhn?article_id=0000573306&office_id=031&mode=search&query=삼성전자&page=14,"['       삼성전자서비스, 콜센터 품질지수 조사서 우수 기업 선정      기사입력2020-12-10 09:19기사원문좋아요훈훈해요좋아요 평가하기공감좋아요0훈훈해요0슬퍼요0화나요0후속기사 원해요0댓글업계 최고 수준 상담 인프라 구축…상담사 역량 강화도 주력 [사진=삼성전자서비스 ][아이뉴스24 장유미 기자] 삼성전자서비스가 챗봇, HRM 원격진단 등을 도입해 고객 맞춤형 상담을 제공한 점을 인정 받았다.삼성전자서비스는 \'2020 KS-CQI(콜센터 품질지수)\' 조사에서 \'가전 및 휴대폰 상담 서비스\' 부문 우수 기업으로 선정됐다고 10일 밝혔다.한국표준협회에서 주관하는 \'KS-CQI(Korean Standard Contact Service Quality Index)\' 조사는 \'전문가의 전화 모니터링\'과 \'고객의 콜센터 이용 만족도 평가\'를 통해 콜센터의 상담 서비스 품질을 측정하는 지표다.이번 조사에서 삼성전자서비스는 ▲친절한 응대 ▲적극적인 설명 ▲차별화된 서비스 제공 등 다수 평가 항목에서 높은 점수를 받아 우수 기업으로 선정됐다. 이는 \'고객이 원하는 그 이상의 상담 서비스\'를 제공하기 위해 다양한 노력을 기울여왔던 점이 인정됐다.삼성전자서비스는 고객이 언제 어디서나 신속 정확한 상담을 받을 수 있도록 365일 24시간 상담 서비스를 제공하고 있다. 센터 위치, 수리 비용과 같은 고객의 단순 문의 해결은 물론 제품별 기술 상담사가 원격 점검 등 수준 높은 전문 기술 상담도 제공하고 있다.최근에는 고객의 상담 이용 편의를 높이기 위해 인공지능 채팅 상담 \'챗봇\' 서비스를 도입했다. 챗봇은 고객이 로봇과의 문자 채팅을 통해 365일 24시간 상담을 받을 수 있도록 구현된 인공지능 상담 플랫폼이다. 고객은 챗봇을 활용해 제품 관련 기술 상담, 서비스 접수 등 원하는 서비스를 시간과 장소에 상관없이 이용할 수 있다.IoT 기반으로 제품의 상태와 정보를 원격 관리하는 \'HRM(Home appliance Remote Management) 원격 점검\'도 삼성전자서비스의 대표적인 상담 시스템으로 손꼽힌다. 상담사는 HRM 서버를 통해 분석된 내용을 바탕으로 제품을 진단하고 필요 시 제품을 원격으로 제어해 고객의 불편을 신속 정확하게 해결한다.또 스마트폰 화면을 보면서 센터 찾기, 서비스 예약 등의 작업이 가능한 \'보이는 ARS\'도 도입해 고객이 상담원과의 통화 연결을 기다릴 필요 없이 빠르고 편리하게 원하는 상담 메뉴를 선택할 수 있도록 했다.삼성전자서비스는 상담사의 역량 강화에도 노력을 기울이고 있다. 고객과 소통하고 공감하는 상담 서비스 제공을 위해 정기적으로 \'상담 기법 교육\'과 \'상담 능력 평가\'를 실시하고 있다. 또 소비자상담사, CS리더스, 심리상담사 등 관련 전문자격 취득도 적극 지원해 상담사의 전문성 향상을 위해 노력하고 있다.윤석한 삼성전자서비스 고객상담팀 상무는 ""앞으로도 고객 감동의 상담 서비스 실천을 위해 끊임없는 혁신 활동을 추진할 것""이라며 ""고객이 원하는 그 이상의 상담 서비스를 제공할 것""이라고 말했다.장유미기자 sweet@inews24.com▶네이버 채널에서 \'아이뉴스24\'를 구독해주세요.▶재밌는 아이뉴스TV 영상보기 ▶아이뉴스24 바로가기[ⓒ 아이뉴스24 무단전재 및 재배포 금지]아이뉴스24 관련뉴스해당 언론사에서 선정하며 언론사 페이지(아웃링크)로 이동해 볼 수 있습니다.달라진 재계 결혼 풍속도…재벌家 며느리, \'아나운서\' 전성시대박휘순·천예지 결혼, 엄용수 축하 영상보니…""나처럼 살지 마세요""[종합] 고성 오간 이재용 \'국정농단\' 재판…""응석받이"" vs ""무슨 표현이냐""구광모 LG 회장, 코로나19 병상 부족 해결사로 나섰다정유경, \'코로나19 위기 돌파\' 승부수…5년 만에 색깔내기 본궤도좋아요0훈훈해요0슬퍼요0화나요0후속기사 원해요0기사제공 :']"
