,회사명,날짜,언론사,기사제목,링크,본문
9,삼성전자, 2020-03-2806:12,머니투데이 ,폭락장에 돈 몰린 KODEX레버리지펀드,https://finance.naver.com/news/news_read.nhn?article_id=0004384817&office_id=008&mode=search&query=삼성전자&page=2,"['       폭락장에 돈 몰린 KODEX레버리지펀드      기사입력2020-03-28 06:12기사원문좋아요훈훈해요좋아요 평가하기공감좋아요0훈훈해요0슬퍼요0화나요0후속기사 원해요0댓글 [머니투데이 김태현 기자] [[펀드 읽어주는 남자]삼성KODEX레버리지증권상장지수투자신탁[주식-파생형]]/그래픽=유정수 디자인기자요즘 주식 시장을 보다보면 개인들의 힘이 얼마나 대단한지 새삼 느끼게 됩니다. 주가가 뚝뚝 떨어지는 폭락장세에도 개인 투자자들은 뚝심있게 순매수를 이어가고 있습니다. 개인들은 이번 달 들어서 코스피 시장에서만 10조원 넘게 사들였습니다.국내 주식형 펀드도 예외는 아니었습니다. 수익률은 바닥인데도 한달 동안 6조원이 넘는 돈이 몰렸습니다. 그 중에서도 가장 많은 자금이 순유입된 \'삼성KODEX레버리지증권상장지수투자신탁\'(이하 KODEX레버리지펀드)에 대해 알아봤습니다. ━어디에 투자하나요?━KODEX레버리지펀드는 상장지수펀드(ETF)로 기초지수인 코스피200지수의 일간 변동률의 2배와 유사하도록 투자 운영하는 상품입니다. 예를 들어 코스피200지수가 4%가 올랐다고 하면 이 펀드는 일별 수익률이 8% 되는 걸 목표로 운영합니다.투자 종목은 때에 따라 다르지만, 가장 기본이 되는 종목은 코덱스200입니다. 코덱스200은 삼성자산운용에서 만든 ETF로 코스피200지수의 일간 변동률의 1배 수익률을 추종합니다. 투자 비중은 전체 종묵 중 약 30% 수준으로 가장 규모가 큽니다.그 다음은 삼성전자입니다. 약 20% 가랑 담고 있습니다. 코덱스200 다음 투자 비중이 큽니다. 이외 SK하이닉스와 현대차 등 시가총액 상위주에도 투자 중입니다.━위험등급은 어떻죠?━위험등급은 매우 높은 위험을 뜻하는 1등급입니다. 우선 가장 큰 위험은 레버리지라는 점입니다. 레버리지의 경우 주가 흐름이 계속 우상향을 한다면 오르는 주가 만큼 수익률도 커지겠지만, 등락이 계속된다면 손해만 커질 수 있습니다.복리 효과 때문입니다. 레버리지 수익률은 기초지수의 일간 수익률을 반영합니다. 예컨대 기초지수가 100일 때 15% 하락했다가 그 다음 날 20% 올랐다고 가정해봅시다. 이 때 일반 ETF의 수익률은 2%이지만, 2배 레버리지 ETF의 수익률은 -16%가 됩니다.이 때문에 전문가들은 레버리지 상품을 오래 들고 있으면 안 된다고 경고합니다. 어떤 이는 24시간 이상 가지고 있는 것도 손실을 키울 수 있다고 경고 합니다.━어떻게 살 수 있나요?━1주 단위로 장중에 매수할 수 있습니다. 적은 자금으로도 투자가 가능합니다. XX일 종가 기준 KODEX레버리지 펀드의  가격은 1주당 X만XXXX원.한국거래소에서 주식처럼 사고 팔 수 있기 때문에 바로 환매가 가능합니다. 가입이나 환매 혹은 전환 과정에서 발생하는 수수료도 없습니다.김태현 기자 thkim124@mt.co.kr▶줄리아 투자노트▶조 변호사의 가정상담소 ▶머니투데이 구독하기 <저작권자 ⓒ \'돈이 보이는 리얼타임 뉴스\' 머니투데이, 무단전재 및 재배포 금지>머니투데이 관련뉴스해당 언론사에서 선정하며 언론사 페이지(아웃링크)로 이동해 볼 수 있습니다.""한국은 이런 나라"" 외국인 눈에 비친 우리 모습은""자기야, 한인마트 가자. 두들겨 맞기 싫어""\'45분 만에 확인\' 美 진단키트…전문가들 우려하는 이유는\'원룸 세입자\' 조주빈, 32억 벌었다기엔 의아한 생활\'트럼프도 엄지척\' 韓 진단키트 주목하는 이유 있었네좋아요0훈훈해요0슬퍼요0화나요0후속기사 원해요0기사제공 :']"
10,삼성전자, 2020-03-2806:01,아이뉴스24 ,[1Q 실적] 삼성·LG전자 생활가전·TV 견조…2Q '가시밭길',https://finance.naver.com/news/news_read.nhn?article_id=0000531737&office_id=031&mode=search&query=삼성전자&page=2,"['       [1Q 실적] 삼성·LG전자 생활가전·TV 견조…2Q \'가시밭길\'      기사입력2020-03-28 06:01기사원문좋아요훈훈해요좋아요 평가하기공감좋아요0훈훈해요0슬퍼요0화나요0후속기사 원해요0댓글2분기엔 코로나 직격탄…경기회복 지연 우려[아이뉴스24 이연춘 기자] 삼성전자와 LG전자가 올 1분기 신종 코로나바이러스 감염증(코로나19) 글로벌 확산 여파에도 예상보다 견조한 실적을 기록할 것이라는 전망이 나왔다. 다만 실적 추정치가 하향 조정되는가 하면 코로나19 글로벌 확산과 장기화에 대한 우려가 증폭되고 있는 모양새다.삼성전자와 LG전자는 다음달 초 1분기 잠정실적을 발표할 예정이다.29일 증권가에 따르면 삼성전자는 전년 동기 대비 소폭 늘어난 6조원 초중반대 영업이익을, LG전자는 같은 기간 소폭 하락한 8천억원 중후반대 영업이익을 기록할 전망이다.삼성전자는 1분기 전년 동기 대비 소폭 늘어난 6조원 초중반대 영업이익을, 같은기간 LG전자는 같은 기간 소폭 하락한 8천억원 중후반대 영업이익을 기록할 전망이다.삼성전자의 소비자가전(CE) 부문은 전년 동기(5천400억원)보다 하락한 5천억원 초반대 영업이익을 기록할 것으로 예상된다. 소비 둔화로 생활가전과 TV 판매 부진이 불가피한 것으로 보인다. 도쿄올림픽 등 각종 스포츠 행사 개최가 불투명해진 점도 올해 우려 요소로 꼽힌다. 코로나19로 인해 올해 스마트폰과 TV 수요 시장 성장률이 전년 대비 각각 3.9%, 4.6% 감소할 것이라는 전망이다.김경민 하나금융투자 연구원은 ""CE(가전)부문에서 출하량이 사업계획에 미치지 못할 수 있다""며 ""올해 삼성전자 TV 출하량 전망을 4천740만대에서 4천510만대로 하향 조정한다""고 했다.LG전자의 올 1분기 실적 컨센서스는 매출액 15조5천352억원과 영업이익 8천422억원이다. 이는 지난해 같은 기간 영업이익(9천6억원)보다 1천억원 이상 줄어든 수준이다.노경탁 유진투자증권 연구원은 ""LG전자는 1분기 전기전자 업종 내 코로나19 영향이 가장 적을 것""이라며 ""중국 노출도가 상대적으로 낮아 가전과 TV 출하량에 타격이 크지 않았고 프리미엄 판매 호조를 이뤘다고 평가했다. 코로나19로 인해 공기청정기 수요가 늘어나고 TV의 경우 중국 업체 공장가동 중단이 이어지면서 반사수혜가 있었다고 분석했다.생활가전 사업을 담당하는 홈어플라이언스&에어솔루션(H&A)과 TV 사업을 맡고 있는 홈엔터테인먼트(HE) 사업부는 각각 전년 동기와 비슷한 수준인 7천억원대와 3천억원대 초반대 영업이익을 기록할 전망이다. 코로나19 사태 속에서 프리미엄 비중 확대, 비용 절감 노력이 통했다는 분석이다.삼성전자는 1분기 전년 동기 대비 소폭 늘어난 6조원 초중반대 영업이익을, 같은 기간 LG전자는 같은 기간 소폭 하락한 8천억원 중후반대 영업이익을 기록할 전망이다.박강호 대신증권 연구원은 ""H&A 사업부는 건조기, 공기청정기, 스타일러를 비롯한 신성장 제품군 매출 증가와 비중 확대로 12.8%의 높은 영업이익률을 기록할 것으로 예상된다""며 ""HE 사업부는 코로나19에 따른 경쟁 완화 속에 OLED TV, 대형 제품이 확대되면서 약 8.5% 영업이익률이 예상된다""고 설명했다.반면 코로나19 여파로 2분기에는 직접적인 영향이 불가피해 보인다. 당초 주요 기업들의 실적에 대한 코로나19 충격이 1분기에 그치고 이후에는 반등세에 접어들 것으로 예상했지만, 사태 장기화와 글로벌 확산에 따라 경기 회복 시점이 지연되면서 기대치가 낮아지고 있다.실제로 삼성전자와 LG전자의 글로벌 생산시설도 잇따라 중단되고 있다. 삼성전자는 이날부터 슬로바키아 TV 공장과 함께 인도 노이다 스마트폰·가전 공장 가동을 일시 중단한다. LG전자도 마찬가지로 인도 주정부 지침에 따라 TV·세탁기와 일부 스마트폰을 생산하는 인도 노이다·푸네 공장 가동을 3월 말까지 중단키로 했다.이연춘기자 staykit@inews24.com▶네이버 채널에서 \'아이뉴스24\'를 구독해주세요.▶홍성택과 함께하는 희망찾기 등산·트레킹 교실 ▶아이뉴스24 바로가기[ⓒ 아이뉴스24 무단전재 및 재배포 금지]아이뉴스24 관련뉴스해당 언론사에서 선정하며 언론사 페이지(아웃링크)로 이동해 볼 수 있습니다.[부고] 김상완 현대해상화재보험 전무 부친상[특징주] \'코로나19 수혜\' 파미셀 6일째 상승…시총 1조 돌파정운호 네이처리퍼블릭 창업주, 경영일선 복귀…왜[주총] 김선희 매일유업 대표 ""중장기 성장전략 정비""\'코로나19 직격탄\' 인터파크, 정규·임시직 유급휴일 차별 논란좋아요0훈훈해요0슬퍼요0화나요0후속기사 원해요0기사제공 :']"
11,삼성전자, 2020-03-2806:00,뉴시스 ,부동산 '강남 맘' 이제 주식 산다,https://finance.naver.com/news/news_read.nhn?article_id=0009782374&office_id=003&mode=search&query=삼성전자&page=2,"['       부동산 \'강남 맘\' 이제 주식 산다      기사입력2020-03-28 06:00기사원문좋아요훈훈해요좋아요 평가하기공감좋아요0훈훈해요0슬퍼요0화나요0후속기사 원해요0댓글맘카페 중심으로 자녀 명의 주식 계좌 개설 문의 증가증권사들 ""강남 등 특정 지역서 문의 더 활발하기도 해""[서울=뉴시스] 김제이 기자 = #서울 서초구에 거주 중인 A씨(35)는 요즘 스마트폰으로 주식시세를 확인하는 게 취미가 됐다. 최근 엄마들 사이에서 아이들 위해 저축 대신 주식을 하는 게 유행처럼 번지다 보니 이에 동참한 것이다. A씨는 집안일을 하면서 틈틈이 아이 명의로 개설한 증권계좌로 주식 거래에 열을 올리고 있다.코스피가 올해 고점 대비 저점이 36% 하락하면서 이를 저가 매수의 기회로 삼는 개인 투자자들이 증가하고 있다. 특히, 낮은 은행 금리와 강력한 부동산 규제 등으로 마땅한 투자처를 찾지 못한 부모들이 아이에게 목돈을 증여하는 방식으로 적금에서 주식으로 넘어가고 있다.환율 시세 차이를 이용해 환차익을 내는 \'김씨 부인\'들이 주식시장으로 번져간 것이다. 김씨 부인은 글로벌 시장에서 재테크를 하는 국내 가정주부를 가리킨다. 이는 글로벌 외환 시장에 투자하는 일본의 \'와타나베 부인\'에 빗댄 말로 와타나베(渡邊)와 김(金)은 각각 일본과 한국에서 제일 흔한 성씨(姓氏) 중의 하나다.재테크와 자녀들을 위한 목돈 마련 수단으로 주식을 선택하는 엄마들이 늘어나면서, 최근 온라인 커뮤니티에서는 관련 게시글도 부쩍 눈에 띄었다. 이들은 ""아이들 주식 사주는 분 있냐"" ""중학생 주식은 어디에 하냐"" ""아이들 이름으로 10년 후 20년 후 바라보고 삼성전자 주식을 사놨다"" 등 지역 맘 커뮤니티, 주식 커뮤니티 등에 주식 관련 글이 증가했다.[서울=뉴시스] 네이버 카페 갈무리송파구 지역 맘 커뮤니티의 한 회원은 ""아이 둘 이름으로 태어나자마자 청약 통장을 만들어 몇백만 원을 넣었는데 해지 전까지는 꺼내 쓸 수가 없는 데다 이율이 연 3% 될까 말까 하다""면서 ""차라리 적금들 듯이 아이들 이름으로 주식계좌를 만들어 폭락장 때마다 돈을 넣어볼까 생각한다""고 글을 올렸다.해당 카페 회원들은 글쓴이의 의견에 ""같은 생각""이라며 동조했다. 한 회원은 ""다들 비슷한 생각을 하는 것 같다""며 ""요즘 은행에 아이 주식계좌를 개설하러 많이들 온다고 한다""고 공감을 표시했다.실제로 은행뿐 아니라 증권사 영업지점에도 많은 신규 계좌 개설과 관련 문의가 급증하는 추세다.한 국내 증권사 직원은 ""최근에 증시가 많이 떨어지면서 \'싼 값에 미리 사두자\'라는 생각에 본인 및 미성년 자녀들의 계좌 개설도 늘고 있다""면서 ""강남쪽 지점들 거래가 좀 더 활발한 편""이라고 언급했다.또다른 관계자 역시 ""대면·비대면을 포함한 신규 계좌 개설 수가 이달에만 12만건을 기록했다""며 ""올해 오프라인 지점과 온라인 양쪽 모두 문의가 상당히 활발하게 이뤄지는 편""이라고 설명했다.☞공감언론 뉴시스 jey@newsis.com▶ 선택 2020, 제21대 총선의 모든 것▶ K-Artprice, 유명 미술작품 가격 공개▶ 뉴시스 빅데이터 MSI 주가시세표 바로가기 <ⓒ 공감언론 뉴시스통신사. 무단전재-재배포 금지>뉴시스 관련뉴스해당 언론사에서 선정하며 언론사 페이지(아웃링크)로 이동해 볼 수 있습니다.임대주택 살던 뚜벅이 조주빈…그많던 수익은 어디로?이은재, 기독당서 \'불자 논란\'에 출마 어렵자 이번엔…제주 모녀, 1억원대 손배소 청구되자 항변하며 한 말은?수업재개 고3학생 200여명 코로나 의심증세 \'화들짝\'40대 남성, 한강 투신…""박사방에 입금했는데"" 유서좋아요0훈훈해요0슬퍼요0화나요0후속기사 원해요0기사제공 :']"
12,삼성전자, 2020-03-2806:00,머니투데이 ,'셧다운' 이어지지만…'코로나 이후' 바라보기 시작한 재계,https://finance.naver.com/news/news_read.nhn?article_id=0004384809&office_id=008&mode=search&query=삼성전자&page=2,"['       \'셧다운\' 이어지지만…\'코로나 이후\' 바라보기 시작한 재계      기사입력2020-03-28 06:00기사원문좋아요훈훈해요좋아요 평가하기공감좋아요0훈훈해요0슬퍼요0화나요0후속기사 원해요0댓글 [머니투데이 유영호 기자, 이정혁 기자, 안정준 기자]  신종 코로나바이러스 감염증(코로나19) 확산 여파로 국내 대기업들의 해외 생산거점이 잇따라 ‘셧다운’(일시폐쇄) 되고 있다. 현대·기아차는 중국과 멕시코를 제외한 모든 글로벌 공장들이 모두 문을 닫는 비상 상황에 처했고, 삼성전자와 LG전자도 슬로바키아·헝가리·미국 등 해외 가전공장이 셧다운 되거나 감산에 돌입한 모습이다.재계는 현재 진행 중인 위기 대응에 총력을 다하지만, 동시에 위기 후 성장 동력 마련에도 만전을 가하기 시작했다. 총수들은 ""철저한 미래 준비""를 언급하기 시작했다. ━14개 해외공장 중 9곳 셧다운… 생산력 75%↓━28일 관련 업계에 따르면 현대·기아차는 전 세계 9개 국가에 14개 생산기지를 가동하고 있다. 이 중 코로나19 사태로 가동을 멈췄거나 멈출 예정인 곳은 모두 9곳이다. 현재 정상 가동 중인 현대·기아차 해외 생산기지는 중국 베이징·충칭·쓰촨·옌청 공장과 멕시코 페스케리아 공장 등 단 5곳에 그친다. 이 때문에 현대차의 글로벌 생산능력은 국내공장(236만대)을 제외하면 314만대 수준인데 잇단 셧다운으로 이 규모가 121만대로 줄었다. 기아차도 국내공장(180만대)을 뺀 글로벌 생산능력이 202만대이지만 공장 가동 중단 사태로 105만대 생산에 그치고 있다. 사실상 해외공장의 75%가 놀고 있는 셈이다.삼성전자와 LG전자도 해외 가전공장이 셧다운되거나 감산에 돌입했다.삼성전자는 최근 슬로바키아 공장에 이어 헝가리 TV 공장도 가동을 일시 중단했다. 유럽은 북미와 함께 글로벌 프리미엄 TV 양대 시장인 만큼 공장 가동 중단 사태가 장기화 될 경우 실적 타격이 불가피하다. 유럽에서 판매되는 삼성전자 TV는 전량 슬로바키아와 헝가리 공장에서 생산된다.또 브라질 소재 마나우스와 캄피나스의 생산공장 2곳도 셧다운 상태다. 이재용 부회장이 올 초 방문한 이 공장들은 스마트폰과 TV를 만드는 남미의 생산거점이다.LG전자도 이미 폴란드 TV 공장 일시 감산에 돌입한데 이어 미국 테네시 세탁기 공장도 가동 중단했다.대지면적 125만㎡에 건물 연면적 7만7000㎡에 규모의 현지 공장은 약 600여 명이 근무하고 있으며, 월 10만대의 드럼세탁기와 통돌이세탁기를 생산하고 있다. 현재 테네시주 클락스빌은 시민 비상사태를 선포하는 등 이동 제한 등의 조치를 선포한 상태다.LG전자는 이에 앞서 인도  노이다·푸네 가전·스마트폰 생산공장도 다음 달 14일까지 가동 중단하기로 했다. ━""위기 후 성장 준비하라""━위기 극복에 나선 재계지만, 총수들은 동시에 미래도 내다본다. 삼성과 SK, LG 등 대기업 리더들은 연이어 ""철저한 미래 대비""를 강조하기 시작했다. 구광모 ㈜LG 대표는 지난 27일 서울 여의도 LG 트윈타워에서 열린 ㈜LG 주주총회에서 ""모든 어려움에도 기회가 있는 만큼 슬기롭게 대처하고 위기 이후의 성장을 준비하겠다""고 강조했다.이어 ""리스크 관리에 집중하면서 흔들림 없이 고객 가치를 가장 최우선에 두고 멈춤 없는 도전을 이어나가겠다""고 강조했다. 그는 ""전 세계적인 코로나19의 확산으로 인해 불확실한 경영 환경이 이어지고 있다""며 ""사업포트폴리오 고도화와 성장동력의 발굴∙육성을 통해 미래를 준비하며 기업 가치를 높이겠다""고 설명했다. 앞서 이재용 삼성전자 부회장과 최태원 SK 회장도 코로나19 이후 미래에 대한 고민이 있어야 한다는 점을 강조했다. 이 부회장은 지난 25일 수원의 삼성종합기술원을 찾아 ""어렵고 힘들 때일수록 미래를 철저히 준비해야 한다""며 ""(코로나 사태로) 한계에 부딪쳤다고 생각될 때 다시 한번 힘을 내 벽을 넘자""고 말했다. 최 회장은 지난 24일 그룹 경영협의기구 \'수펙스추구협의회\' 회의에서 ""어려운 시기일수록 소외된 조직이나 개인이 발생하지 않도록 기업이 더욱 단단하고 체계적인 안전망을 구축해야 한다""며 ""이를 위해 모든 관계사들이 기존 관행과 시스템 등을 원점에서 냉정하게 재검토해 달라""고 강조했다. 유영호 기자 yhryu@mt.co.kr, 이정혁 기자 utopia@mt.co.kr, 안정준 기자 7up@mt.co.kr▶줄리아 투자노트▶조 변호사의 가정상담소 ▶머니투데이 구독하기 <저작권자 ⓒ \'돈이 보이는 리얼타임 뉴스\' 머니투데이, 무단전재 및 재배포 금지>머니투데이 관련뉴스해당 언론사에서 선정하며 언론사 페이지(아웃링크)로 이동해 볼 수 있습니다.""한국은 이런 나라"" 외국인 눈에 비친 우리 모습은""자기야, 한인마트 가자. 두들겨 맞기 싫어""\'45분 만에 확인\' 美 진단키트…전문가들 우려하는 이유는\'원룸 세입자\' 조주빈, 32억 벌었다기엔 의아한 생활\'트럼프도 엄지척\' 韓 진단키트 주목하는 이유 있었네좋아요0훈훈해요0슬퍼요0화나요0후속기사 원해요0기사제공 :']"
13,삼성전자, 2020-03-2806:00,데일리안 ,'대기업 인근 분양단지' 인기…임대수요 풍부,https://finance.naver.com/news/news_read.nhn?article_id=0002391968&office_id=119&mode=search&query=삼성전자&page=2,"[""       '대기업 인근 분양단지' 인기…임대수요 풍부      기사입력2020-03-28 06:00기사원문좋아요훈훈해요좋아요 평가하기공감좋아요0훈훈해요0슬퍼요0화나요0후속기사 원해요0댓글시세 상승 긍정적 영향현대 테라타워 영통 투시도 ⓒ현대엔지니어링대기업 인근 분양단지가 투자자들에게 인기를 끌고 있다. 대기업을 기반으로 하는 협력업체들이 대기업 인근으로 모여들면서 임대수요가 풍부해지기 때문이다. 임대수요가 풍부한 만큼 안정적인 임대수익과 매매가 상승으로 인한 시세차익까지 기대할 수 있다는 분석이다.28일 부동산 업계에 따르면 삼성, LG 등 대기업 본사나 공장, 연구 단지가 들어선 지역의 주변 부동산은 연일 상승세를 누리고 있다.삼성전자 본사가 들어선 수원 삼성디지털시티와 인접한 매탄동의 경우 1985년 10월 입주한 ‘매탄주공4단지’가 매교동에서 2004년 2월 입주한 ‘연향예스빌’ 보다 2배 이상 높은 시세를 형성하고 있다. ‘매탄주공4단지’는 삼성디지털시티와 인접해 있지만, ‘연향예스빌’은 약 4km가량 떨어진 위치에 입지해 있다.오피스텔이나 지식산업센터 등 수익형 상품도 대기업 후광효과를 누리고 있다. 직주근접으로 거주 여건이 좋아 공실률이 낮기 때문이다. 특히 기업입장에서는 대기업과의 접근성이 뛰어나 비즈니스 최적지로 꼽히기도 하는 등 관심이 높아지는 추세다.실제로 현대엔지니어링이 서울 송파구 문정동 법조타운에 선보인 ‘문정역 테라타워’는 분양 당시 단기간에 완판된 바 있다. 완판 이후 지식산업센터에서는 드물게 억대 프리미엄이 형성됐다.인근 공인중개업소에 따르면 ‘문정역 테라타워’는 전용 198㎡ 기준으로 2014년 6월 5억4000만원 가량이었지만 지난 2월 9억6000만원에 실거래되기도 했다. 분양 당시 3.3㎡당 평균 분양가가 900만원 대였지만 현재는 1600만원 대에 형성돼 있다.부동산 전문가는 “대기업 인근 입지는 직주근접이 가능해 꾸준한 인기가 이어지고 있다”며, “중소기업 입장에선 인재 확보는 물론 업무 협력도 수월하고, 투자자 입장에서는 임대수요가 풍부하기 때문에 안정적인 수익을 기대할 수 있어 흥행요인으로 꼽힌다”고 말했다.이런 가운데 상반기 대기업, 대규모 산업단지 등을 품은 신규 단지의 분양이 예정돼 수요자들의 관심을 끌고 있다.제일건설은 3월 고덕신도시 A41블록에 '고덕신도시 제일풍경채 2차 Edu'를 분양할 계획이다. 단지는 지하 1층~지상 25층, 9개 동, 총 877가구며 수요자에게 선호도가 높은 중소형 평면위주로 구성됐다. 단지와 멀지 않은 위치에 세계 최대규모의 반도체 생산공장인 삼성전자 평택캠퍼스가 있고, 대규모 첨단 산업단지로 조성되는 평택 브레인시티와 고덕신도시 내 들어서는 행정타운까지 가까이에서 누릴 수 있다.GS건설은 오는 4월 경기도 고양시 덕양구 덕은지구에서 ‘DMC리버파크자이’와 ‘DMC리버포레자이’를 분양할 예정이다. A4블록에 들어서는 ‘리버파크자이’는 지하 2층~지상 24층, 6개 동, 전용면적 84~99㎡ 702가구이며, A7블록에 들어서는 ‘리버포레자이’는 지하 2층~지상 24층, 5개 동, 전용면적 84㎡ 318가구 규모다. 서울 상암과 접근성이 우수하다. 상암DMC 내에는 MBC본사, KBS미디어센터, JTBC, CJ E&M센터 등 각종 언론·방송기업이 위치해 직주근접 입지를 갖추고 있다.신영은 울산 동구 서부동 일원에 ‘울산 지웰시티 자이’를 5월 분양할 예정이다. 현대중공업이 단지 바로 맞은 편에 있는 것을 비롯해 현대미포조선, 현대자동차, 현대제철 울산공장, KCC울산공장, 현대모비스 울산염포동공장 등 대규모 산업단지들까지 차량으로 20분 이내에 이동 가능해 직주근접 주거지로 꼽힌다. 총 2개 단지로, 1단지는 지하 3층~지상 35층 9개 동 59~84㎡ 1371가구, 2단지는 지하 5층~지상 37층 9개 동 전용면적 84~107㎡ 1316가구 규모로 조성된다.수원 삼성디지털시티 인근에서는 현대엔지니어링이 ‘현대 테라타워 영통’을 선보인다. 단지는 지하 2층~지상 15층, 3개 동, 연면적 약 9만 6946㎡ 규모로 지어진다. 단지 일대는 삼성디지털시티를 비롯해 다수의 협력업체가 위치해 비즈니스 최적지로 꼽힌다.데일리안 김희정 기자 (hjkim0510@dailian.co.kr)ⓒ (주)데일리안 - 무단전재, 변형, 무단배포 금지데일리안 관련뉴스해당 언론사에서 선정하며 언론사 페이지(아웃링크)로 이동해 볼 수 있습니다.[주간부동산시황] 서울 아파트값 0.01%↓…10개월 만에 하락4월 수도권 아파트, 6238가구 집들이…3년만에 최저정세균 '도쿄 확진자 많아지면 日비자제한 유지 가능성'[코로나19] 농협, 비상경영대책 위원회 개최'갑상선암 회복' 차지연, 모노극 '그라운디드'로 컴백좋아요0훈훈해요0슬퍼요0화나요0후속기사 원해요0기사제공 :""]"
