,회사명,날짜,언론사,기사제목,링크,본문
11,삼성전자, 2020-03-2512:43,TV조선 ,"이재용 ""다시 힘내 벽을 넘자""…종합기술원 찾아 '초격차' 강조",https://finance.naver.com/news/news_read.nhn?article_id=0000294490&office_id=448&mode=search&query=삼성전자&page=7,"['       이재용 ""다시 힘내 벽을 넘자""…종합기술원 찾아 \'초격차\' 강조      기사입력2020-03-25 12:43기사원문좋아요훈훈해요좋아요 평가하기공감좋아요0훈훈해요0슬퍼요0화나요0후속기사 원해요0댓글이재용 삼성전자 부회장 / 조선일보 DB이재용 삼성전자 부회장이 25일 오전 경기도 수원에 있는 삼성종합기술원(이하 종기원)을 찾아 차세대 미래 기술 전략과 삼성의 성장 동력을 점검했다. 이 부회장은 이날 종기원에서 열린 간담회에 참석해 신기술 연구개발 현황을 보고 받고, 연구원들을 독려했다. 종기원은 17개 연구실, 연구원 1200여명이 차세대 기술 연구를 진행하고 있는 핵심 사업장이다. 간담회에서는 차세대 AI(인공지능) 반도체 및 소프트웨어 알고리즘,양자 컴퓨팅 기술, 미래 보안기술, 반도체·디스플레이·전자 등의 혁신 소재 등 선행 기술에 대한 논의가 이뤄졌다. 또 사회적 난제인 미세먼지 문제 해결을 위해 작년 설립한 미세먼지 연구소의 추진 전략 등도 살펴봤다. 이 부회장은 ""어렵고 힘들 때일수록 미래를 철저히 준비해야한다""며 ""한계에 부딪혔다고 생각될 때 다시 한번 힘을 내 벽을 넘자""고 말했다. 이 부회장의 현장경영은 이달 들어서만 세번째로, 코로나19 확산 사태로 어려운 상황에 처해 있는 임직원들을 격려하고 미래를 철저하게 준비하기 위해서라는 분석이다. / 김자민 기자김자민 기자(ben@chosun.com)☞ 네이버 메인에서 TV조선 구독하기☞ 더 많은 TV조선 뉴스 보기* 뉴스제보 : 이메일(tvchosun@chosun.com), 카카오톡(tv조선제보), 전화(1661-0190)- Copyrights ⓒ TV조선. 무단전재 및 재배포 금지 -TV조선 관련뉴스해당 언론사에서 선정하며 언론사 페이지(아웃링크)로 이동해 볼 수 있습니다.조주빈 얼굴 공개…""악마의 삶 멈출수 있게 해줘서 감사""메시·호날두도 연봉 삭감 바람…국내 스포츠는 무풍지대김부겸 대구 선거사무실에 계란 투척…金 ""나한테 던져라""마스크 대란에 \'면마스크\' 썼는데…성조숙증 유발 물질 범벅 2종 리콜3개월 연속 출생아보다 사망자↑…인구자연증가율도 마이너스좋아요0훈훈해요0슬퍼요0화나요0후속기사 원해요0기사제공 :']"
12,삼성전자, 2020-03-2512:39,이데일리 ,[이데일리N] 홍남기 “고용유지지원금 4천억 늘려 5천억 규모로 확대” 外,https://finance.naver.com/news/news_read.nhn?article_id=0004605390&office_id=018&mode=search&query=삼성전자&page=7,"['       [이데일리N] 홍남기 “고용유지지원금 4천억 늘려 5천억 규모로 확대” 外      기사입력2020-03-25 12:39기사원문좋아요훈훈해요좋아요 평가하기공감좋아요0훈훈해요0슬퍼요0화나요0후속기사 원해요0댓글 [이데일리N]1. 홍남기 “고용유지지원금 4천억 늘려 5천억 규모로 확대”2. 정부, 수출입은행 통해 수출입·해외진출기업에 20조 긴급수혈 3. 대기자금성격 투자자예탁금 40조 육박4. 한은 “한미 통화스와프 금주 본계약…내주 자금공급 목표”5. 삼성전자, D램에도 EUV 공정 적용…“미세공정 한계 돌파”간추린뉴스-기아차 美조지아공장 30일부터 2주간 가동 중단-금감원, 이번 주중 ‘손태승 DLF 제재 효력 정지’에 즉시항고-르노삼성차 “XM3 누적계약 1만6천대 넘어”-G7 “유동성·재정확장 등 성장·심리회복 위해 모든 조치할 것”김태완 (wani07@edaily.co.kr)네이버에서 ‘이데일리’ 구독하기▶청춘뉘우스~ 스냅타임▶＜ⓒ종합 경제정보 미디어 이데일리 - 무단전재 & 재배포 금지＞이데일리 관련뉴스해당 언론사에서 선정하며 언론사 페이지(아웃링크)로 이동해 볼 수 있습니다.[단독] 이낙연·황교안 토론, 4월6일 열린다\'32억\' 조주빈 범죄 수익 어디에 있나\'로또 1등의 비극\' 동생 살해한 형, 징역 15년형 선고조주빈 \'휠라\' 맨투맨 착용…휠라 ""모자이크 좀""황교안 ""이낙연에 지면 정치 그만두냐""는 질문에…좋아요0훈훈해요0슬퍼요0화나요0후속기사 원해요0기사제공 :']"
13,삼성전자, 2020-03-2512:35,한국경제TV ,상장사 현금확보 '비상'…삼성전자·SK '현금왕',https://finance.naver.com/news/news_read.nhn?article_id=0000859024&office_id=215&mode=search&query=삼성전자&page=7,"['       상장사 현금확보 \'비상\'…삼성전자·SK \'현금왕\'      기사입력2020-03-25 12:35기사원문좋아요훈훈해요좋아요 평가하기공감좋아요0훈훈해요0슬퍼요0화나요0후속기사 원해요0댓글[한국경제TV 정경준 기자]다음달 6.5조 회사채 만기유동성 비상...현금이 \'최고\'<앵커>금융시장 변동성 확대에 따른 자금시장 경색 우려와 맞물려 현금성자산을 다량 보유한 상장사들이 주목받고 있습니다.당장 다음달에는 연중 최대 물량의 회사채 만기까지 예고돼 있는데요, 정경준 기자가 전해드립니다.<기자>다음달부터 올해 말까지 만기가 돌아오는 회사채 물량은 42조원.특히, 다음달에는 올해 최대 물량인 6조5천억원 어치의 회사채 만기가 돌아옵니다.통상 만기 도래시 기업들은 차환 발행 방식을 통하는데, 최근 코로나 사태 여파로 새 회사채 발행이 여의치 않게 되면서 우려감이 커지고 있습니다.정부 당국이 채권시장안정펀드 조성 등 선제적 위기 대응에 나섰지만, 현금에 대한 시장의 수요 급증은 당분간 불가피해 보입니다.현금확보가 당장 발등의 불로 떨어지면서, 이런 상황과 맞물려 현금과 예금, 그리고 단기금융상품 등 현금성자산을 많이 보유한 상장사에 대한 관심이 일고 있습니다.코스피 상장사 가운데서는 삼성전자가 26조6천억원으로 가장 많은 현금성자산을 보유중이며, 그 다음으로는 SK가 9조2천억원, LG전자가 4조7천억원을 갖고 있습니다.기아차, 현대모비스, 네이버도 4조원대 안팎의 현금성자산을 보유중입니다.특히, 1년내 갚아야 하는 단기차입금을 제외한 현금성자산을 따져보면 삼성전자가 14조2천억원으로 가장 많았으며, 그 다음으로는 SK, LG전자, 기아차, 네이버 순으로 나타났습니다.코스닥시장에선 셀트리온헬스케어가 4,300억원의 현금성자산을 보유중이며, GS홈쇼핑과 솔브레인 등도 3천억원대의 현금성자산을 갖고 있습니다.한국경제TV 정경준입니다.정경준 기자 jkj@wowtv.co.kr▶ 네이버 홈에서 [한국경제TV] 채널 구독하기 [생방송보기]▶ 대한민국 재테크 총집결! - [증권 / 주식상담 / 부동산]ⓒ 한국경제TV, 무단 전재 및 재배포 금지한국경제TV 관련뉴스해당 언론사에서 선정하며 언론사 페이지(아웃링크)로 이동해 볼 수 있습니다.\'목 깁스\' 조주빈, 자해…""코로나 환자"" 주장도\'40조원\' 사상 최대 실탄 준비… 애국개미 승리할까""코로나19로 돈 벌지 않겠다""…특허권 내놓는 기업들""코로나19 확진 3천여명 중 15%, 후각·미각 상실""롯데 고승민, 사생활 논란…전 여친 ""두 번 유산"" 폭로좋아요0훈훈해요0슬퍼요0화나요0후속기사 원해요0기사제공 :']"
14,삼성전자, 2020-03-2512:30,한국경제TV ,"삼성전자, 브라질 공장 '셧다운' 이어 오프라인 매장도 폐쇄",https://finance.naver.com/news/news_read.nhn?article_id=0000859016&office_id=215&mode=search&query=삼성전자&page=7,"['       삼성전자, 브라질 공장 \'셧다운\' 이어 오프라인 매장도 폐쇄      기사입력2020-03-25 12:30기사원문좋아요훈훈해요좋아요 평가하기공감좋아요0훈훈해요0슬퍼요0화나요0후속기사 원해요0댓글[한국경제TV 신동호 기자]삼성전자가 브라질 공장 가동 중단에 이어 현지 오프라인 매장도 폐쇄키로 결정했다.25일 삼성전자 브라질 뉴스룸에 따르면 회사는 24일(현지시간) 코로나19 확산을 최소화하기 위해 현지 전역의 오프라인 매장을 일시 폐쇄한다고 밝혔다.이에 따라 제품 판매는 모두 온라인으로 전환하고 현지 상황에 따라 재개 시점을 공지할 계획이다.앞서 삼성전자는 브라질 북부 아마조나스주 마나우스 공장의 가동을 오는 29일까지 중단한다고 밝힌 바 있다.삼성전자는 인도 노이다 스마트폰 공장도 사흘간의 폐쇄 지침을 내렸고 유럽 슬로바키아 TV 공장도 29일까지 가동을 중단하기로 한 상황이다.미국과 캐나다 전역의 오프라인 매장은 이미 지난주부터 폐쇄됐고, 이외 지역에도 정부 지침에 따른 영업 중단 조치가 취해진 것으로 알려졌다.신동호기자 dhshin@wowtv.co.kr▶ 네이버 홈에서 [한국경제TV] 채널 구독하기 [생방송보기]▶ 대한민국 재테크 총집결! - [증권 / 주식상담 / 부동산]ⓒ 한국경제TV, 무단 전재 및 재배포 금지한국경제TV 관련뉴스해당 언론사에서 선정하며 언론사 페이지(아웃링크)로 이동해 볼 수 있습니다.조주빈 포토라인...\'손석희·윤장현·김웅\' 언급 왜?\'40조원\' 사상 최대 실탄 준비… 애국개미 승리할까""코로나19로 돈 벌지 않겠다""…특허권 내놓는 기업들""코로나19 확진 3천여명 중 15%, 후각·미각 상실""롯데 고승민, 사생활 논란…전 여친 ""두 번 유산"" 폭로좋아요0훈훈해요0슬퍼요0화나요0후속기사 원해요0기사제공 :']"
15,삼성전자, 2020-03-2512:26,조세일보 ,코스피 낮 12시 4.43% 상승…외국인·기관은 6900억 ‘팔자’,https://finance.naver.com/news/news_read.nhn?article_id=0002221062&office_id=123&mode=search&query=삼성전자&page=7,"[""       코스피 낮 12시 4.43% 상승…외국인·기관은 6900억 ‘팔자’      기사입력2020-03-25 12:26기사원문좋아요훈훈해요좋아요 평가하기공감좋아요0훈훈해요0슬퍼요0화나요0후속기사 원해요0댓글◆…25일 코스피지수 변동 현황. 자료=미래에셋대우코스피가 장중 4% 넘게 오르고 있다. 증시 상승에도 불구 외국인과 기관은 둘이 합쳐 약 6900억원의 순매도에 나서고 있다. 25일 낮 12시 현재 코스피 지수는 전날보다 71.34포인트(4.43%) 오른 1681.31에 거래되고 있다. 이날 지수는 전날보다 58.22포인트(3.61%) 상승한 1668.19로 거래를 시작 후, 1660~1690선에서 오르내리고 있다. 한국을 비롯한 전세계 주요국들이 코로나19로 촉발된 경제침체를 타개하기 위해 대규모 경기부양책을 내놓고 있는데다 간밤에 미국 다우지수가 87년만에 최대폭인 11.37% 상승했다는 소식이 전해지며 시장에서 긍정적으로 반응하고 있는 모습이다. 증시는 상승하고 있지만 외국인은 2747억원의 주식을 팔아치우며 15거래일 연속 '팔자' 행진을 이어나가고 있다. 기관도 4138억원 순매도에 나서고 있다. 어제와 오늘 주식시장 급등에 따른 단기 차익을 실현하고 있는 것으로 보인다. 개인만 6952억원 순매수에 나서고 있다. 시가총액 1, 2위인 삼성전자, SK하이닉스도 오르고 있다.낮 12시 삼성전자는 전장보다 1350원(2.88%) 상승한 4만8300원에 거래되고 있다. SK하이닉스는 3700원(4.70%) 오른 8만2400원을 기록하고 있다. 코스닥 지수는 19.92포인트(4.14%) 상승한 500.32를 기록하고 있다.▶ 조세일보 홈페이지 / 정회원 가입▶ 조세일보 네이버 뉴스스탠드 구독(종합/경제)태기원(tae@joseilbo.com)저작권자 ⓒ 조세일보(http://www.joseilbo.com). 무단전재 및 재배포 금지조세일보 관련뉴스해당 언론사에서 선정하며 언론사 페이지(아웃링크)로 이동해 볼 수 있습니다.[속보] '코로나19' 국내 현황…확진자 총 9137명, 사망 126명조주빈, 손석희·김웅·윤장현 언급하며 사죄…왜?'민식이법' 시행 첫날…운전자가 꼭 알아야 할 사항의정부 송산1동 거주 '코로나19' 확진자…동선 공개중랑구 '코로나19' 확진자 2명 동선 공개…LG유플러스 먹골역점 등좋아요0훈훈해요0슬퍼요0화나요0후속기사 원해요0기사제공 :""]"
16,삼성전자, 2020-03-2512:20,MBC ,경기 부양책에 '안정화' 흐름…오후장도 상승세,https://finance.naver.com/news/news_read.nhn?article_id=0001025625&office_id=214&mode=search&query=삼성전자&page=7,"['       경기 부양책에 \'안정화\' 흐름…오후장도 상승세      기사입력2020-03-25 12:20기사원문좋아요훈훈해요좋아요 평가하기공감좋아요0훈훈해요0슬퍼요0화나요0후속기사 원해요0댓글 [정오뉴스]미국과 한국 등 각국의 경기 부양책에 힘입어 국내 증시가 단기적으로 안정화 흐름을 찾아가는 모습입니다.원-달러 환율도 20원 가까이 하락하면서 코스피, 코스닥 모두 오후 들어서도 상승세를 이어가고 있습니다.이 시각 현재 코스피는 69.9포인트 상승한 1679.87포인트로, 코스닥은 20.31포인트 오른 500.71포인트로 거래되고 있습니다.투자주체별 매매 동향을 보면 거래소 시장에서는 어제 팔자로 돌아섰던 개인이 홀로 매수에 나서고 있습니다.지난밤 뉴욕 증시는 미국 정부가 추진 중인 대규모 재정 부양책의 의회 통과 기대감에 폭등하며 다우지수는 87년 만에 최대 상승률로 장을 마쳤습니다.시가총액 상위 종목 살펴보면 오르는 종목이 우세한 가운데 삼성전자가 오늘도 오르면서 주가가 5만 원을 향해 가고 있고 한진칼은 행동주의 사모펀드 KCGI 등 3자 연합이 동사의 주식을 추가로 취득했다는 소식에 반등에 나서고 있습니다.한편 코스닥 시장에서 메디톡스는 대표이사의 구속영장 청구 소식에 급락하고 있습니다.이 시각 현재 중국 증시는 상승하고 있고 일본 증시 또한 오르고 있습니다.지금까지 삼성증권이었습니다.김민재/삼성증권 기자 [저작권자(c) MBC (https://imnews.imbc.com) 무단복제-재배포 금지]▶ 네이버 홈에서 [MBC뉴스] 채널 구독하기▶ 새로움을 탐험하다. ""엠빅뉴스""▶ MBC 14층 사람들이 만든 뉴스 ""14F""Copyright(c) Since 1996, MBC&iMBC All rights reserved.MBC 관련뉴스해당 언론사에서 선정하며 언론사 페이지(아웃링크)로 이동해 볼 수 있습니다.\'악마의 삶 멈춰줘서 감사\'…조주빈, 검찰 송치확진자 100명 추가 확인…\'51%가 해외 유입\'확진자 동선 10분 내 파악…역학조사 지원시스템 운영정부, 고용유지지원금 5천억 원 규모로 확대정 총리 \'미국발 입국자 강화조치, 늦어도 27일 0시 시행\'좋아요0훈훈해요0슬퍼요0화나요0후속기사 원해요0기사제공 :']"
17,삼성전자, 2020-03-2512:13,SBS Biz ,"삼성전자, D램 EUV 공정 첫 적용…양산 체제 구축",https://finance.naver.com/news/news_read.nhn?article_id=0000208045&office_id=374&mode=search&query=삼성전자&page=7,"['       삼성전자, D램 EUV 공정 첫 적용…양산 체제 구축      기사입력2020-03-25 12:13기사원문좋아요훈훈해요좋아요 평가하기공감좋아요0훈훈해요0슬퍼요0화나요0후속기사 원해요0댓글삼성전자가 업계 최초로 극초자외선, EUV 노광기술을 적용한 D램 반도체 양산 체제를 갖췄습니다.삼성전자는 EUV 공정을 적용해 첫 생산한 1세대 10나노급 DDR4 D램 모듈 100만개 이상을 글로벌 고객사에 공급했다고 오늘 밝혔습니다.EUV 기술을 적용하면 정확도가 높아져 성능과 수율이 향상되고 제품 개발기간도 단축되는 것으로 알려졌습니다.김동우 기자(eastright@sbs.co.kr) ▶ 아침을 여는 뉴스 모닝벨 [#오늘의키워드]▶ 경제를 실험한다~ 머니랩 [네이버TV]저작권자 SBS미디어넷 & SBS I&M 무단전재-재배포 금지SBS Biz 관련뉴스해당 언론사에서 선정하며 언론사 페이지(아웃링크)로 이동해 볼 수 있습니다.목 보호대 찬 조주빈 ""악마의 삶 멈추게 해줘서 감사""금감원, 내달 라임 현장검사…참다못한 투자자 직접 소송손태승, 우리금융 3년 더 이끈다…금감원 \'즉시 항고\' 변수뉴욕증시 폭등에 코스피 4% 급등…원화값은 1230원대국내 확진자 총 9137명…신규 확진자 51% \'해외 유입\'좋아요0훈훈해요0슬퍼요0화나요0후속기사 원해요0기사제공 :']"
18,삼성전자, 2020-03-2512:08,SBS Biz ,경영전략 재검토 나선 총수들…이재용 “한계의 벽을 넘자”,https://finance.naver.com/news/news_read.nhn?article_id=0000208043&office_id=374&mode=search&query=삼성전자&page=7,"['       경영전략 재검토 나선 총수들…이재용 “한계의 벽을 넘자”      기사입력2020-03-25 12:08기사원문좋아요훈훈해요좋아요 평가하기공감좋아요0훈훈해요0슬퍼요0화나요0후속기사 원해요0댓글최태원, 새 안전망 구축 강조[앵커]재계 총수들이 비상경영 사태를 맞아 경영 전략 재검토에 나섰습니다.이재용 삼성전자 부회장은 미래와 혁신을, 최태원 SK그룹 회장은 새로운 안전망을 강조했습니다.권세욱 기자, 이재용 삼성전자 부회장의 현장경영 행보가 이어졌군요?[기자]네, 삼성전자에 따르면 이재용 부회장은 오늘(25일) 신기술 연구개발이 이뤄지는 삼성종합기술원을 찾아 간담회를 가졌는데요.이 부회장은 ""어렵고 힘들 때일수록 미래를 철저히 준비해야 한다""고 밝혔습니다.특히 혁신을 강조하며 ""한계에 부딪쳤다 생각될 때 다시 한번 힘을 내 벽을 넘자""고 말했습니다.이 자리에서는 차세대 AI 반도체와 소프트웨어 알고리즘, 양자 컴퓨팅 기술을 비롯한 선행 기술에 대한 논의가 이뤄졌습니다.[앵커]최태원 SK그룹 회장은 새로운 안전망의 필요성을 제기했다고요?[기자]네, SK그룹에 따르면 최태원 회장은 어제(24일) 화상회의로 열린 수펙스추구협의회에 참석했는데요.이 자리에서 ""그동안 SK가 짜놓은 안전망이 유효하지 않다는 것을 목격하고 있다""며 ""완전히 새로운 안전망을 짜야 할 시간""이라고 밝혔습니다.이를 위해 ""모든 관계사들이 기존 관행과 시스템 등을 원점에서 냉정하게 재검토해 달라""고 당부했습니다.최 회장은 또 ""각 관계사가 스스로 생존할 수 있는 자원과 역량을 확보해야 한다""고 강조했습니다.SBSCNBC 권세욱입니다.   권세욱 기자(sukwon@sbs.co.kr) ▶ 아침을 여는 뉴스 모닝벨 [#오늘의키워드]▶ 경제를 실험한다~ 머니랩 [네이버TV]저작권자 SBS미디어넷 & SBS I&M 무단전재-재배포 금지SBS Biz 관련뉴스해당 언론사에서 선정하며 언론사 페이지(아웃링크)로 이동해 볼 수 있습니다.목 보호대 찬 조주빈 ""악마의 삶 멈추게 해줘서 감사""금감원, 내달 라임 현장검사…참다못한 투자자 직접 소송손태승, 우리금융 3년 더 이끈다…금감원 \'즉시 항고\' 변수뉴욕증시 폭등에 코스피 4% 급등…원화값은 1230원대국내 확진자 총 9137명…신규 확진자 51% \'해외 유입\'좋아요0훈훈해요0슬퍼요0화나요0후속기사 원해요0기사제공 :']"
