,회사명,날짜,언론사,기사제목,링크,본문
18,삼성전자, 2020-05-2516:37,뉴스1 ,"'삼성 해고' 시위자들 이재용 집 앞에서 ""삼겹살에 소주""",https://finance.naver.com/news/news_read.nhn?article_id=0004657159&office_id=421&mode=search&query=삼성전자&page=2,"['       \'삼성 해고\' 시위자들 이재용 집 앞에서 ""삼겹살에 소주""      기사입력2020-05-25 16:37기사원문좋아요훈훈해요좋아요 평가하기공감좋아요0훈훈해요0슬퍼요0화나요0후속기사 원해요0댓글\'해고자 공대위\' 지난 24일 이 부회장 집 앞 \'폭식 투쟁\'주민 민원에 ""소송 걸라""…경찰 ""제재 근거 딱히 없다""서울 강남구 강남역사거리에서 300일 넘게 고공농성을 진행 중인 삼성해고노동자 김용희 씨가 연대집회 참석자들을 향해 손인사를 하고 있다./뉴스1 © News1(서울=뉴스1) 주성호 기자,박종홍 기자 = 삼성 해고노동자들의 피해 보상 등을 요구하기 위해 조직된 시민단체가 이재용 삼성전자 부회장 자택 앞에서 음주가무를 포함해 이른바 \'폭식투쟁\'을 벌였던 것으로 확인됐다.이들은 당국에 \'집회 신고\'를 한 뒤 이 부회장 집 앞에서 삼겹살을 구워먹고 소주와 맥주를 마시는 모습을 동영상으로 촬영해 유튜브에 공개하기도 했다.집회 참가자들은 신고를 받고 출동한 공무원에게 ""압수수색 영장을 보여달라""거나 ""피해가 심한 주민들에겐 개인적으로 소송을 걸라고 하라""고 말하기도 했다.25일 삼성해고노동자고공농성 공대위에 따르면 이들은 지난 24일 오후 서울 용산구 한남동에 위치한 이 부회장 자택 앞에서 집회를 열었다.집회에 앞서 공대위 대표인 임미리 고려대 교수는 전날 오후부터 이 부회장 자택 앞에 1인용 텐트를 펼쳐놓고 야영농성에 돌입한 것으로 전해졌다.삼성해고노동자고공농성 공대위가 지난 24일 서울 한남동 이재용 삼성전자 부회장 자택 앞에서 \'음주가무\' 집회를 벌였다고 소개하고 있는 유튜브 채널 \'연대TV\'의 동영상 한 장면(사진=유튜브 갈무리) © 뉴스1이같은 모습은 \'연대TV\'라는 유튜브 채널에 업로드된 동영상에 담겼다. 경찰에 따르면 이들은 지난 21일부터 한달간 동일한 장소에서의 \'집회 신고\'를 마친 것으로 알려졌다.집회 참석 인원은 10여명 안팎으로 많지 않았지만 이들은 지난 24일 이 부회장 자택 앞에 돗자리를 깔고 둘러앉아 미리 준비해둔 삼겹살을 구워먹기도 했다. 영상에 등장하는 사람들 주위에는 소주병과 캔맥주도 발견됐다. 동영상을 업로드한 연대TV 측도 영상 제목에 \'삼겹살 폭식투쟁\'이나 \'음주가무\' 같은 단어를 쓴 것으로 보아 일부 참가자들이 술을 마신 것으로 추정된다. 이와 관련해 업로드된 영상 5개 중 1개에는 주민 신고를 받고 출동한 것으로 보이는 공무원의 모습도 등장한다. 영상 속 공무원으로 추정되는 인물이 ""주변에서 민원이 신고돼서 나온 것""이라고 설명하자 이들은 ""걱정 안해도 된다""면서 ""우리는 지금 집회 신고하고 집회를 하는 중""이라고 설명했다. 어떤 참가자는 ""압수수색 영장을 갖고 오라""고 했고, 또 다른 이는 ""우린 대학에서 학생들 가르치는 사람들이니까 (집회를) 무리하게 안 한다""고 강조했다. 삼성해고노동자고공농성 공대위가 지난 24일 서울 한남동 이재용 삼성전자 부회장 자택 앞에서 \'음주가무\' 집회를 벌였다고 소개하고 있는 유튜브 채널 \'연대TV\'의 동영상 한 장면(사진=유튜브 갈무리) © 뉴스1근처 주민들이 피해를 입을 수 있다는 구청 관계자의 설명을 들은 임미리 공대위 대표는 ""피해 정도가 심하다고 하면 저에게 개인적으로 소송을 거시라고 하라""고 말하기도 했다.이같은 \'폭식투쟁\'을 벌인 공대위는 삼성 서초사옥 앞에서 고공농성 중인 김용희씨의 복직을 위해 구성된 단체다. 이들은 이달초까진 서초사옥 인근에서 보통의 집회를 개최했다. 그러다가 최근들어 이 부회장 자택 앞을 \'집회 장소\'로 신고한 뒤 모여서 삼겹살을 구워먹고 음주를 곁들인 것으로 알려졌다.일각에선 이같은 모습을 지켜보기 불편하다는 지적도 나오고 있으나 법적으로 제재할 수 있는 방안은 딱히 없는 것으로 전해졌다. 집회 및 시위에 관한 법률 제16조(주최자의 준수 사항)에 따르면 집회 또는 시위의 주최자는 \'신고한 목적, 일시, 장소, 방법 등의 범위를 뚜렷이 벗어나는 행위\'를 해서는 안 된다고 나와 있다.경찰도 지난 24일 집회 내용을 파악했지만 별다른 조치를 하지 않은 것으로 나타났다. 경찰 관계자는 ""집회 신고를 낸 것이라 법적으로 막을 근거는 없다""고 설명했다.이어 ""남의 집 앞에서 삼겹살을 구워먹는 것이 보기엔 안 좋지만 이를 막을 근거가 없다""면서도 ""만약 소음 기준치가 넘어간다면 경고 조치를 내고 관리하고 있다""고 말했다.서울 강남구 강남역사거리에서 고공농성 중인 삼성해고노동자 김용희 씨가 깃발을 흔들고 있다./뉴스1 © News1 이동해 기자sho218@news1.kr▶ 네이버 메인에서 [뉴스1] 구독하기!▶  뉴스1 바로가기 ▶  코로나19 뉴스 © 뉴스1코리아(news1.kr), 무단 전재 및 재배포 금지뉴스1 관련뉴스해당 언론사에서 선정하며 언론사 페이지(아웃링크)로 이동해 볼 수 있습니다.\'불륜 여배우탓 이혼\' 선우은숙, 재회 이영하에 ""자기야"" 스킨십김영민 ""김희애와의 오뚝이 베드신, 육체적 욕구 잘 담겼다""투구쓰고 비키니입은 샤론 스톤 \'완벽 라인\'안영미, 파격 세미 누드 공개 ""흥청망청 막 살지않고 운동""진중권 ""유시민·이해찬 초치는걸 보니 노무현재단 뭔가 터져""좋아요0훈훈해요0슬퍼요0화나요0후속기사 원해요0기사제공 :']"
19,삼성전자, 2020-05-2516:34,한경비즈니스 ,"[CEO24시] 이재용, 사과 회견 이후 현장 행보…깊어지는 미래 고민",https://finance.naver.com/news/news_read.nhn?article_id=0000053748&office_id=050&mode=search&query=삼성전자&page=2,"[""       [CEO24시] 이재용, 사과 회견 이후 현장 행보…깊어지는 미래 고민      기사입력2020-05-25 16:34기사원문좋아요훈훈해요좋아요 평가하기공감좋아요0훈훈해요0슬퍼요0화나요0후속기사 원해요0댓글 [CEO 24시] 이재용 삼성전자 부회장[한경비즈니스 = 이홍표 기자] 이재용 삼성전자 부회장이 공격적인 경영 행보에 나서고 있다. 5월 6일 과거의 잘못과 단절하고 ‘새로운 삼성’으로 거듭나겠다고 선언한 후 확연히 달라진 모습이다.이 부회장은 연일 ‘뉴스 메이커’가 되고 있다. 이 부회장은 기자 회견 1주일 만인 5월 13일 현대차그룹 정의선 총괄수석부회장을 만나 차세대 전기차 배터리 협업을 논의했다. 또 신종 코로나바이러스 감염증(코로나19)을 뚫고 5월 17일부터 2박 3일간 중국 시안의 삼성반도체 공장을 찾았다. 3일 동안 6시간 이상 걸리는 코로나19 검사를 3번이나 받는 불편을 감수하면서 위기 돌파 의지를 보여 줬다.삼성전자가 5월 21일 평택캠퍼스에 파운드리(반도체 위탁 생산) 시설을 짓겠다고 발표한 것도 대국민 사과 이후 이어지는 공격 경영 행보의 일환으로 보인다. 이날 투자 발표와 관련해 이 부회장이 “어려울 때일수록 미래에 대한 투자를 멈춰서는 안 된다”고 강조한 것은 이런 해석에 힘을 실어주고 있다.평택 파운드리 라인 공사는 이미 시작됐고 2021년 하반기부터 본격 가동할 계획이다. 이번 투자는 삼성전자가 작년 4월 발표한 ‘반도체 비전 2030’ 관련 후속 조치의 일환이다. 삼성전자는 평택캠퍼스 파운드리 시설에 투자할 금액을 밝히지는 않았다. 증권가와 업계에서는 10조원 안팎의 투자가 이뤄질 것으로 보고 있다. 양산이 시작되면 올해 2월 극자외선(EUV) 전용인 화성 ‘V1 라인’과 시너지를 내며 파운드리 1위 업체인 TSMC와의 경쟁이 본격화될 것으로 예상된다. 재계에서는 이 부회장의 과감한 경영 행보가 계속 이어질 것으로 관측한다. 추가 투자 발표와 인수·합병(M&A) 등이 있을 것이라는 기대도 강하다. 사진은 중국 출장을 마친 이 부회장이 5월 19일 서울 김포비즈니스항공센터(SGBAC)를 통해 귀국, 차량에 탑승하고 있는 모습이다. hawlling@hankyung.com / 사진 = 김영우 한국경제 기자 youngwoo@hankyung.com[본 기사는 한경비즈니스 제 1278호(2020.05.23 ~ 2020.05.29) 기사입니다.]▶ 한경비즈니스 네이버 뉴스에서 [구독 클릭]▶ '한경비즈니스' 바로가기 ▶ 잡지 정기구독 신청  당사의 허락 없이 본 글과 사진의 무단 전재 및 재배포를 금합니다.좋아요0훈훈해요0슬퍼요0화나요0후속기사 원해요0기사제공 :""]"
0,삼성전자, 2020-05-2516:33,한경비즈니스 ,"삼성전자, 평택에 10조원 규모의 파운드리 생산 시설 구축",https://finance.naver.com/news/news_read.nhn?article_id=0000053744&office_id=050&mode=search&query=삼성전자&page=3,"[""       삼성전자, 평택에 10조원 규모의 파운드리 생산 시설 구축      기사입력2020-05-25 16:33기사원문좋아요훈훈해요좋아요 평가하기공감좋아요0훈훈해요0슬퍼요0화나요0후속기사 원해요0댓글 [위클리 이슈=기업] [한경비즈니스=이현주 기자] 삼성전자가 평택에 대규모의 파운드리(반도체 위탁 생산) 생산 시설 투자 계획을 발표했다. 삼성전자는 5월 21일 경기도 평택사업장에 2021년 가동을 목표로 초미세 극자외선(EUV) 기반의 첨단 제품 수요에 대응하는 파운드리 생산 시설 구축에 나선다고 밝혔다. 이번 투자는 삼성전자가 작년 4월 발표한 ‘반도체 비전 2030’ 관련 후속 조치의 일환이다. 삼성전자는 시스템 반도체 분야에서 글로벌 1위를 달성하기 위한 세부 전략을 실행하고 있다. 삼성전자는 5월 평택 파운드리 라인 공사에 착수했고 2021년 하반기부터 본격 가동에 들어갈 계획이다. 삼성이 이번 투자 규모를 공개하지 않았지만 증권업계에서는 10조원에 달하는 대규모 투자가 이뤄질 것으로 보고 있다. 삼성전자는 2019년 화성 S3 라인에서 업계 최초로 EUV 기반 7나노 양산을 시작한 이후 2020년 V1 라인을 통해 초미세 공정 생산 규모를 지속 확대해 왔다. 여기에 2021년 평택 라인이 가동되면 7나노 이하 초미세 공정 기반 제품의 생산 규모는 더욱 가파르게 증가할 것으로 전망된다.또한 삼성전자는 생산성을 더욱 극대화한 5나노 제품을 올해 하반기에 화성에서 먼저 양산한 뒤 평택 파운드리 라인에서도 주력 생산할 예정이다.정은승 삼성전자 DS부문 파운드리사업부 사장은 “5나노 이하 공정 제품의 생산 규모를 확대해 EUV 기반의 초미세 시장 수요 증가에 적극 대응해 나갈 것”이라며 “전략적 투자와 지속적인 인력 채용을 통해 파운드리 사업의 탄탄한 성장을 이어 나갈 것”이라고 밝혔다.charis@hankyung.com I 사진 한국경제신문[본 기사는 한경비즈니스 제 1278호(2020.05.23 ~ 2020.05.29) 기사입니다.]▶ 한경비즈니스 네이버 뉴스에서 [구독 클릭]▶ '한경비즈니스' 바로가기 ▶ 잡지 정기구독 신청  당사의 허락 없이 본 글과 사진의 무단 전재 및 재배포를 금합니다.좋아요0훈훈해요0슬퍼요0화나요0후속기사 원해요0기사제공 :""]"
1,삼성전자, 2020-05-2516:33,더팩트 ,"[TF시황] 코스피, 미·중 갈등에도 강세 마감",https://finance.naver.com/news/news_read.nhn?article_id=0000026978&office_id=629&mode=search&query=삼성전자&page=3,"['       [TF시황] 코스피, 미·중 갈등에도 강세 마감      기사입력2020-05-25 16:33기사원문좋아요훈훈해요좋아요 평가하기공감좋아요0훈훈해요0슬퍼요0화나요0후속기사 원해요0댓글25일 코스피는 전장 대비 24.47포인트(+1.24%) 오른 1994.60에 장을 마쳤다. /이선화 기자코스피 강세…1.24% 오른 1994.60 마감[더팩트ㅣ박경현 기자] 25일 미국과 중국의 갈등이 지속되는 외부 환경 속 국내증시는 강세 마감했다. 코스피는 전장에서 1970선까지 후퇴했다가 이날 다시 2000선 턱끝까지 올라왔다.코스피는 이날 전장 대비 24.47포인트(+1.24%) 오른 1994.60에 장을 마쳤다. 기관의 매수세 전환에 개인과 기관은 각각 957억 원, 354억 원을 사들였다. 반면 외국인은 홀로 1421억 원을 순매도했다.시가총액 상위종목은 대부분 올랐다. 삼성전자(+0.21%), SK하이닉스(+0.12%), 삼성바이오로직스(+2.27%), 네이버(+4.56%), 삼성전자우(+1.77%), LG화학(+3.32%), 삼성SDI(+3.57%), 카카오(+8.50%), LG생활건강(+0.21%)이 줄줄이 오른 가운데 셀트리온(-0.46%)은 소폭 내렸다. 이날 장중 카카오는 LG생활건강의 시가총액을 앞서며 시총 8위(우선주 제외)에 안착했다.업종은 양방향미디어와 서비스, IT서비스, 소프트웨어, 담배, 전기제품이 4~6%가량 올랐다. 반면 항공사, 생명보험, 사무용전자제품이 1%가량 내렸다.코스닥은 전장대비 11.31포인트(+1.60%) 오른 719.89에 장을 마쳤다. /네이버 캡처코스닥은 전장대비 11.31포인트(+1.60%) 오른 719.89에 장을 마쳤다.코스닥에서는 외국인 홀로 985억 원을 사들인 가운데 개인과 기관이 각각 867억 원, 65억 원을 팔아치웠다.이날 코스닥 시가총액 상위종목 역시 대부분 올랐다. 셀트리온헬스케어(+0.33%), 에이치엘비(+2.15%), 셀트리온제약(+2.09%), 씨젠(+4.28%), 알테오젠(+3.15%), CJ ENM(+0.25%), 에코프로비엠(+13.50%), 스튜디오드래곤(+0.92%)이 오른 가운데 케이엠더블유(-0.51%)는 하락하며 장을 마쳤다.pkh@tf.co.kr- 더팩트 뮤직어워즈는 언제? [알림받기▶]  - 내 아이돌 응원하기 [팬앤스타▶]  저작권자 ⓒ 특종에 강한 더팩트 & tf.co.kr 무단 전재 및 재배포 금지더팩트 관련뉴스해당 언론사에서 선정하며 언론사 페이지(아웃링크)로 이동해 볼 수 있습니다.[단독포착] \'삼중고\' 조국 정경심 부부의 \'재충전\' 휴일 외식[TF포토] 이용수 할머니, \'윤미향 용서하지 않았다\'[스페셜인터뷰90-임기홍] \'개그맨 웃기는 작가\' 40년, ""은퇴 아닌 조퇴""\'아빠본색\' 길, 가족공개와 자숙기간 고백에 극과 극 반응손흥민, 몸값 866억 원으로 아시아 1위…이강인 4위 안착좋아요0훈훈해요0슬퍼요0화나요0후속기사 원해요0기사제공 :']"
2,삼성전자, 2020-05-2516:12,서울경제 ,미래 탐색·규제 철폐·기술선도···'R&D 팀플레이'가 초격차 열쇠 [서울포럼 2...,https://finance.naver.com/news/news_read.nhn?article_id=0003742455&office_id=011&mode=search&query=삼성전자&page=3,"['       미래 탐색·규제 철폐·기술선도···\'R&D 팀플레이\'가 초격차 열쇠 [서울포럼 2020]      기사입력2020-05-25 16:12기사원문좋아요훈훈해요좋아요 평가하기공감좋아요0훈훈해요0슬퍼요0화나요0후속기사 원해요0댓글■포스트 코로나 시대, 과학기술 초격차가 답이다<4>기초과학 강국의 조건국가 R&D예산 늘지만···성과내려면 시장이 방향 설정5G·자율차 등 성장산업, 산학연 유기적 협업에 달려AI 인력 부족률 60%···인재육성 시스템 구축도 시급지난해 5월 서울 그랜드&비스타워커힐호텔에서 열린 ‘서울포럼 2019’ 라운드테이블에서 이스라엘 테크니온 공대 페레츠 라비 총장과 참석자들이 기념촬영을 하고 있다. /성형주기자[서울경제] 인공지능(AI)의 기반 알고리즘인 딥러닝(심층신경망기술)의 요람이자 자율주행차의 메카로 떠오르고 있는 캐나다 ‘메이플밸리’. 이 성공 사례는 국가 차원의 연구개발(R&D) 전략이 왜 중요한지를 잘 보여준다. 캐나다는 지난 2000년대 초반부터 정부 주도로 AI에 대한 R&D 투자를 이어갔고, 그 결과 2006년 제프리 힌턴 토론토대 교수가 딥러닝의 개념을 처음으로 제시하는 등 성과도 냈다. 2017년에는 범국가 차원의 AI 전략을 수립해 몬트리올과 토론토·앨버타 등에 AI연구소를 설립하고 자율주행차 기술 개발을 위해 데이터 수집과 관련한 규제를 완화했다. 인재 유치를 위한 별도의 취업비자 간소화 프로그램도 만들었다. 미래 산업 기술의 방향을 꿰뚫어보고 기술 개발에 필요한 인재 수혈, 상업화 기술을 위한 규제 완화, 산학연의 유기적 시스템 구축에 나선 것이다. 이 같은 노력은 기업과 인력 유입으로 이어졌다. 구글(알파벳)의 자율주행차 자회사 사이드워크랩스가 토론토에 스마트시티를 건설해 자율주행택시를 운영하며 자율주행차에 필요한 데이터를 수집할 예정이고, 우버는 토론토에 위치한 자사 연구소에 2억캐나다달러(약 1,600억원)를 투자하기로 했다. 권오경 한국공학한림원 회장은 “기업과 학계·연구기관이 따로 노는 방식으로는 연구개발의 성과를 더는 기대할 수 없는 환경”이라며 “연구개발의 기획 단계부터 기업과 학계·연구기관이 문제의식을 공유하고 연구 및 중간점검을 같이하는 전 주기 협업 연구가 많아져야 한다”고 강조했다. ■‘단독 플레이 시대’ 끝나···유기적 협업 절실전문가들은 무엇보다 유기적인 R&D 시스템 구축이 중요하다고 입을 모은다. 특히 AI와 5세대 이동통신(5G), 자율주행차 같은 미래 성장 산업은 전략적인 투자 분야 설정, 대규모 투자 연계, 단계별 전문화된 세부연구 등이 필수적이다. 기업 입장에서는 미래 성장동력에 대한 탐색, 정부는 규제·세제·인재육성 등의 지원 정책, 학계는 사업화로 접목 가능한 기술을 선도할 R&D가 이뤄져야 한다. 이런 유기적 연결이 없으면 새로운 산업에서 먹거리를 창출하기 어려워진다는 뜻이다. 유환익 전국경제인연합회 기업정책실장은 “과거만 해도 기업은 대형 장치 산업에서 약간의 개선을 추구하고, 학계는 점수 따기 논문에만 집착하고, 정부는 정책의 틀 안에서 우물 안 개구리처럼 움직여도 선두권에 오를 수 있었지만 이제 이런 시대는 끝났다”며 “자율주행만 해도 학계·기업·정부가 하나의 목표로 혼연일체가 되지 않으면 초격차를 만들 수 없다”고 꼬집었다. 주력산업 중 경쟁력이 그나마 제일 낫다는 반도체만 해도 그렇다. 메모리는 최고라지만 비메모리 분야는 반도체 강국이라는 명성에 어울리지 않을 만큼 생태계가 빈약하다. 가령 칩을 설계하는 팹리스의 경우 세계 시장 점유율이 1%(지난해 기준, IC인사이츠)도 안 된다. 반면 중소 부품업체가 탄탄한 대만 점유율은 17%에 이른다. 도널드 트럼프 미국 대통령이 대만의 팹리스 TSMC를 미국에 유치하기 위해 그렇게 공을 들이는 데는 그만한 이유가 있는 것이다. 안기현 한국반도체산업협회 상무는 “비메모리는 대기업의 전유물이 아니라는 점을 인식해야 한다”며 “중소중견기업 중심의 생태계가 없으면 한계가 불가피하기 때문에 국가 차원의 전략적 육성이 중요하다”고 지적했다.■시장성 갖춘 기술·전문인력 육성 나서야올해 국가 R&D 예산은 전년보다 18% 증가한 24조원이 책정됐다. 하지만 부처별로 나뉘어 사업을 선정하고 예산을 뿌려주는 지금 같은 톱다운 방식의 기술사업화가 시장의 수요에 초점을 맞추는 방식으로 바뀌지 않고서는 신기술 확보는 여전히 요원하다는 평가다. ‘포노 사피엔스’의 저자 최재붕 성균관대 교수는 “혁신기술 여부는 구현기술의 난이도가 아니라 소비자의 선택을 받느냐가 결정한다”며 “신종 코로나바이러스 감염증(코로나19)으로 사회 변화가 더 빨라지는 만큼 R&D도 시장의 선택을 받을 수 있는 기술을 위한 방법론 도입이 필요하다”고 말했다. 인재 육성 시스템 구축도 시급하다. 위구연 미국 하버드대 교수와 세바스찬 승 프린스턴대, 다니엘 리 펜실베이니아대 교수 등을 영입한 삼성전자를 비롯해 SK하이닉스(김영한 UCSD 교수), LG전자(조셉 림 USC 교수), 네이버(성 킴 홍콩과기대 교수), 넷마블(이준영 IBM왓슨연구소) 등 기업들이 해외 인재 확보에 총력을 기울이는 모습은 역설적으로 국내 관련 인력의 현주소를 보여준다. 소프트웨어정책연구소 분석에 따르면 오는 2022년까지 5년간 한국에 부족한 AI 인력은 9,986명, 이 중 석·박사급 인력은 7,268명에 달할 것으로 전망된다. 지난해 12월 전경련 산하 한국경제연구원이 국내 AI 전문가 30명을 대상으로 진행한 설문조사에서도 AI 인력 부족률은 60.6%로 나타났다.전문가들은 올해로 종료되는 ‘제3차 과학기술인재 육성지원 기본계획’에 이어 내년부터 5년간 시행되는 ‘제4차 과학기술인재 육성지원 기본계획’에 산업 변화에 따른 관련 인재 육성에 대한 밑그림이 나와야 한다고 지적한다. 4차 기본계획 기획총괄위원장을 맡은 오명숙 홍익대 교수는 “바뀐 산업 수요에 맞게 대학과 대학원에서 좀 더 실질적인 교육이 이뤄질 수 있는 인재 육성 방향이 필요하다”고 말했다.            /양사록·김창영·이재명기자 kcy@sedaily.com[서울경제 바로가기]▶ 네이버 채널에서 \'서울경제\' 구독해주세요!▶ 세상 모든 것에 대해 던지는 질문, 왜(WHY)?저작권자 ⓒ 서울경제, 무단 전재 및 재배포 금지서울경제 관련뉴스해당 언론사에서 선정하며 언론사 페이지(아웃링크)로 이동해 볼 수 있습니다.""윤미향, 생전에 할머니 이용해 먹고 장례때 거짓 눈물""안영미 \'세미누드\' 화보 공개, 웃음 뒤에 가려졌던 섹시 매력 발산""그동안 고마웠다""···\'연쇄살인\' 최신종, 가족에게 \'음성 유서\' 남긴 진짜 이유는\'여성단체 직격탄\' 진중권 ""스크럼 짜고 윤미향 옹호···할머니 편 서는 게 맞지 않나""이해찬, \'윤미향 엄호\' 나서 ""개별 의견 분출 말라""···민주당 ""사실확인부터""좋아요0훈훈해요0슬퍼요0화나요0후속기사 원해요0기사제공 :']"
