,회사명,날짜,언론사,기사제목,링크,본문
0,삼성전자, 2020-10-1520:14,세계일보 ,5G 가입자 연내 1000만 고지 넘을까,https://finance.naver.com/news/news_read.nhn?article_id=0003513082&office_id=022&mode=search&query=삼성전자&page=1,"['       5G 가입자 연내 1000만 고지 넘을까      기사입력2020-10-15 20:14기사원문좋아요훈훈해요좋아요 평가하기공감좋아요0훈훈해요0슬퍼요0화나요0후속기사 원해요0댓글2020년 8월 말기준 866만명 달해아이폰12 출시로 가능성 높아져    애플이 오는 30일 출시하는 ‘아이폰12’. 애플코리아 제공    삼성전자와 LG전자, 애플 등 주요 제조사들이 플래그십 5G폰을 잇달아 선보이며 5G 시장 경쟁에 불이 붙고 있다. 시장에서는 5G 커버리지 부족과 코로나19 여파로 부진했던 5G 시장이 신제품 출시로 연내 가입자 1000만명을 넘을 수 있을지 기대하고 있다.  15일 애플코리아에 따르면 국내에서는 첫 5G 아이폰인 ‘아이폰12’ 시리즈가 오는 23일부터 사전예약에 돌입한다. 애플이 5G폰 경쟁에 합류하면서 국내 시장은 삼성전자와 LG전자, 애플 모두 5G폰으로 플래그십폰 경쟁을 벌이게 됐다.  시장에서는 새 5G 아이폰이 기존의 4G 가입자 상당수를 끌어올 것으로 보고 있다. 아이폰은 삼성전자나 LG전자의 안드로이드OS와 다른 OS시장을 개척하고 있어, 기존의 5G폰 가입자를 흡수하기보다 새로운 5G 가입자를 유인할 것이란 전망이다. 아이폰은 갤럭시와 함께 고객 충성도가 높은 브랜드로 꼽힌다.  업계에서는 5G 아이폰 출시로 연내 5G 가입자가 1000만명을 넘어설 것으로 기대하고 있다. 과학기술정보통신부에 따르면 지난 8월 말 기준 국내 5G 가입자 수는 865만8222명으로 집계됐다. 수백만 명의 국내 아이폰 사용자가 현재까지 모두 4G를 사용 중인 점을 감안할 때, 교체수요에 따라 1000만명을 넘을 수 있다는 기대도 나온다.  더구나 과거에는 단말기 가격이나 요금제가 모두 비싼 것으로 여겨졌던 5G폰 시장에 최근 들어 가격 경쟁으로 소비자 부담이 줄고 있다. 단말기 시장에서는 삼성전자의 ‘갤럭시FE’, LG전자의 ‘윙’, 애플의 ‘아이폰12’가 100만원 안팎의 가격대에서 매스 프리미엄 제품군을 형성했다. 통신업계에서는 KT가 4만원대의 저가 5G 요금제를 내놓았고, SKT와 LG유플러스도 연내 저가 5G 요금제 출시를 예고했다.   권구성 기자 ks@segye.comⓒ 세상을 보는 눈, 세계일보세계일보 관련뉴스해당 언론사에서 선정하며 언론사 페이지(아웃링크)로 이동해 볼 수 있습니다.유승준 ""약속 못 지킨 게 위법이냐""독신으로 살다 80대에 첫사랑과 결혼한 이수영 광원산업 회장, KAIST에 총 766억 기부전노민·김보연, 이혼 후 첫 드라마 동반 출연…임성한 작가 \'결혼작가 이혼작곡\'서성관계 후 ""강간""…수천만원 뜯은 30대 여성들결혼 후 6년간 매일 함께 샤워했다는 10년차 연예인 부부 ""28㎏ 쪘는데도 이뻐해주더라""좋아요0훈훈해요0슬퍼요0화나요0후속기사 원해요0기사제공 :']"
1,삼성전자, 2020-10-1520:00,중앙일보 ,"통신사 SK텔레콤, 미래성장 위해 모빌리티 사업 분사 결정했다",https://finance.naver.com/news/news_read.nhn?article_id=0003043690&office_id=025&mode=search&query=삼성전자&page=1,"['       통신사 SK텔레콤, 미래성장 위해 모빌리티 사업 분사 결정했다      기사입력2020-10-15 20:00기사원문좋아요훈훈해요좋아요 평가하기공감좋아요0훈훈해요0슬퍼요0화나요0후속기사 원해요0댓글 SK텔레콤이 미래 성장 잠재력이 큰 모빌리티 사업을 따로 떼 독립 법인을 만든다. 통신업계와 증권업계에 따르면 SK텔레콤은 15일 오후 이사회를 열고 모빌리티 사업의 물적분할을 결정했다. SK텔레콤이 신설법인의 지분 100%를 보유해 자회사로 편입하는 방식이다. SK텔레콤은 지난해 250명 규모의 모빌리티사업단을 출범해 사업화 방안을 모색해 왔다.       SK텔레콤의 T맵 서비스.      ━   1289만명 사용하는 티맵 기반 신산업 육성         이동통신 회사인 SK텔레콤이 모빌리티 분야를 집중적으로 육성하겠다고 팔을 걷어붙인 이유는 뭘까. 신설 법인은 우선 스마트폰 내비게이션 서비스인 ‘T맵’을 중심으로 신규 비즈니스를 발굴할 것으로 전망된다. 기존 모빌리티 사업단은 스마트폰 내비게이션인 T맵에서 파생된 티맵 택시, 티맵 주차, 티맵 대중교통, 티맵 API(응용프로그램 인터페이스) 등을 서비스하고 있다. T맵은 올해 8월 기준 월간 순사용 자(MAU)가 1289만명에 달하는 국내 1위 스마트폰 내비게이션이다.       차두원 차두원모빌리티연구소장은 “시장 잠재력이 큰 모빌리티 시장에서 몸집을 가볍게 해서 빠른 변화에 밀접하게 대응하고, 투자ㆍ제휴 등 외부와의 협력을 강화하기 위한 것”이라고 분석했다.        ━   ""자율주행 시대 차량의 지배자 되겠다는 것""       SK텔레콤은 미국 방송기업 씽클레어와 손잡고 세계 최초로 5G 기반 차세대 방송 시연에 성공했다. [사진 SK텔레콤]              전문가들은 신설 법인이 이런 티맵 기반의 서비스를 토대로 SK텔레콤이 보유한 인공지능(AI) 기술과 자율주행·쇼핑·결제 등을 접목해 신규 서비스를 발굴할 것으로 전망하고 있다. 이승웅 하이투자증권 연구원은 “티맵을 중심으로 SK텔레콤의 다양한 서비스를 결합하고, 이를 통해 축적되는 소비자 데이터를 기반으로 새로운 비즈니스를 발굴할 것으로 보인다”고 말했다. 이미 T맵에 적용된 SK텔레콤의 AI 플랫폼인 ‘누구’, 음악 플랫폼인 ‘플로’외에 SK텔레콤의 자회사인 11번가, 결제서비스인 SK페이 등을 접목하는 것도 가능하다. 예를들어 현재 T맵은 경로 주변 맛집 검색 기능을 제공하는데 여기에 SK페이를 통한 결제까지 한번에 되는 방식으로 새로운 비즈니스 모델을 창출할 수 있게 된다. 김홍식 하나금융투자 연구원은 “자율주행 시대가 되면 차량 내에서 엔터테인먼트를 즐기는 것은 물론, 쇼핑과 결제까지 한번에 이뤄진다”며 “SK텔레콤의 전략은 한마디로 자율 주행 시대의 차량안의 지배자가 되겠다는 것”이라고 분석했다.       ━   우버, 신설법인에 1000억원대 투자 전망        SK텔레콤은 올 1월 미국 라스베이거스에서 열린 CES 2020의 전시 부스에서 차량용 인포테인먼트 등 자율주행 관련 기술과 서비스를 선보였다. [사진 SK텔레콤]             글로벌 협력도 강화될 것으로 전망된다. 업계에 따르면 신설된 법인은 미국의 차량공유 업체인 우버로부터 1000억원대 규모의 투자를 받는다. SK텔레콤은 그동안 BMWㆍ볼보ㆍ재규어 등에 차량용 인포테인먼트(인포메이션+엔터테인먼트) 등을 공급해 왔다. 또 미국 방송 기업인 씽클레어, 삼성전자가 인수한 세계 최대 전장 기업인 하만 등과 손잡고 차세대 차량용 인포테인먼트 플랫폼을 개발 중이다.        모빌리티를 둘러싼 이같은 광폭 행보에는 미래 성장 산업인 모빌리티 영역에서 기술력을 축적함으로써 종합 정보통신기술(ICT) 회사로 거듭나기 위한 SK텔레콤의 ‘큰 그림’이 깔려있다. SK텔레콤은 올 초 미국 라스베이거스에서 열린 ‘CES 2020’의 전시 부스에 차량용 통합 인포테인먼트(통합 IVI), HD맵 기술을 적용한 로드러너, 차세대 단일 광자 라이다 등 다양한 자율주행 관련 기술을 선보인 바 있다.       차두원 소장은 “모빌리티 분야는 인공지능, 빅데이터, 자율주행, 차량용인포테인먼트 등 미래 기술의 총체”라며 “이 분야에서 기술력을 축적함으로써 향후 ICT 분야 전반에서 경쟁력을 확보하려는 것”이라고 말했다.        김경진 기자 kjink@joongang.co.kr  ▶ 넌 뉴스를 찾아봐? 난 뉴스가 찾아와!▶ 네이버에서 중앙일보 받아보기▶ [영상]코로나 이후 전세계에 닥칠 재앙은?ⓒ중앙일보(https://joongang.co.kr), 무단 전재 및 재배포 금지중앙일보 관련뉴스해당 언론사에서 선정하며 언론사 페이지(아웃링크)로 이동해 볼 수 있습니다.[단독] \'노영민 후임 우윤근\' 이달 교체설 급부상김종철 ""진보 금기 깬다, 공무원·국민연금 합치자""옵티머스 1조 주무른 세쌍 남녀, 그들 다 부부였다강경화 시아버지 별세로 가족장···남편 귀국 못한듯규제 역설···강남주택 4채중 1채 \'지방큰손\'이 샀다좋아요0훈훈해요0슬퍼요0화나요0후속기사 원해요0기사제공 :']"
2,삼성전자, 2020-10-1519:10,한겨레 ,카카오페이·삼성페이 시장에 뛰어든 KB페이,https://finance.naver.com/news/news_read.nhn?article_id=0002516491&office_id=028&mode=search&query=삼성전자&page=1,"['       카카오페이·삼성페이 시장에 뛰어든 KB페이      기사입력2020-10-15 19:10기사원문좋아요훈훈해요좋아요 평가하기공감좋아요0훈훈해요0슬퍼요0화나요0후속기사 원해요0댓글간편결제서비스 시장…빅테크·스마트폰·금융권 대결아이티(IT) 기반 기업과 휴대전화 제조사 등이 주도하고 있는 국내 간편결제(페이)시장에 케이비(KB)국민카드가 도전장을 내밀었다. 국민카드는 15일 “앱카드의 기능 개선을 통해 결제 편의성과 확장성을 높이고, 송금·환전 등 다양한 서비스를 추가한 ‘케이비(KB)페이’를 출시했다”고 밝혔다. 케이비페이는 신용카드와 체크카드 뿐만 아니라 은행계좌·상품권·포인트 등 카드 이외 결제수단을 등록해 사용할 수 있다고 국민카드는 설명했다. 다만 케이비페이는 국민은행 계좌와 국민카드 등만 일단 등록이 가능하다. 간편결제서비스는 신용카드·체크카드를 연결하거나, 결제계좌에 미리 돈을 충전해 온오프라인에서 쉽게 결제하는 것을 말한다. 현재 이른바 ‘빅테크’ 업체가 만든 ‘카카오페이’와 ‘네이버페이’, 휴대전화 제조사인 삼성전자가 만든 ‘삼성페이’가 선점하고 있는 시장이다. 금융감독원이 지난해 2018년 간편결제금액을 분석한 결과를 보면, 네이버페이와 카카오페이 등 전자금융업자(30조9천억원)의 비중이 가장 높았고 카드사(27조1천억원)와 휴대전화 제조사(20조7천억원), 은행(1조4천억원) 순이었다.  ※ 이미지를 누르면 크게 볼 수 있습니다.카드사는 국민카드 외에 신한과 하나·비씨(BC) 등 여러 카드사들을 합한 결과여서, 개별 카드사 ‘페이’ 점유율은 이보다 떨어지는 것으로 보인다. 반면 휴대전화 제조사 ‘페이’의 대부분을 차지하는 삼성페이는 올해 8월 현재 가입자가 1900만명이며 누적 결제금액은 80조원을 기록했다. 카드사들은 온라인과 간편결제 시장이 커짐에 따라 ‘페이’에 대한 투자를 키우고 있다. 간편결제서비스가 체크카드를 대체하기 시작하면서, 체크카드 매출 비중이 높은 은행계 카드사들의 긴장감은 커지고 있다. 더구나 카드사 ‘페이’는 같은 금융그룹 계열사 카드와 계좌만 아직 연결이 가능하다는 한계가 있어 카카오페이나 삼성페이의 확장성을 따라가기 힘들다. 국민카드 관계자는 “다른 금융회사 계좌와 카드까지 등록 가능한 결제수단을 확대할 예정”이라고 말했다.이완 기자 wani@hani.co.kr▶더불어 행복한 세상을 만드는 언론, 한겨레 구독하세요!▶네이버 채널 한겨레21 구독▶2005년 이전 <한겨레> 기사 보기[ⓒ한겨레신문 : 무단전재 및 재배포 금지]한겨레 관련뉴스해당 언론사에서 선정하며 언론사 페이지(아웃링크)로 이동해 볼 수 있습니다.여야 의원 24명 법정 간다…국민의힘 10명·민주당 7명일 언론 ""정부, 후쿠시마 오염수 바다 방류 방침 굳혀""과제 내랬더니 19금 영상 업로드…원격수업하자 \'교사 성희롱\' 늘었다총선 부정 논란 키르기스스탄 대통령 자진 사퇴임대인 세금 4억8250만원 대 1714만원, 공평과세에 맞나요?좋아요0훈훈해요0슬퍼요0화나요0후속기사 원해요0기사제공 :']"
3,삼성전자, 2020-10-1519:08,뉴시스 ,"'분식회계 의혹' 삼바 대표·회계임원, 횡령 혐의 추가기소(종합)",https://finance.naver.com/news/news_read.nhn?article_id=0010129319&office_id=003&mode=search&query=삼성전자&page=1,"['       \'분식회계 의혹\' 삼바 대표·회계임원, 횡령 혐의 추가기소(종합)      기사입력2020-10-15 19:08기사원문좋아요훈훈해요좋아요 평가하기공감좋아요0훈훈해요0슬퍼요0화나요0후속기사 원해요0댓글횡령 및 증거인멸 교사 혐의 적용회사자금 약 47억원 위법사용 의혹바이오로직스 증거인멸 지시 혐의도이재용 기소때도 외감법 위반 기소[서울=뉴시스]홍효식 기자 = 4조5000억원대 분식회계 의혹을 받고 있는 김태한 삼성바이오로직스 대표가 지난해 7월5일 오전 서울 서초구 서울중앙지검에 피의자 신분으로 출석하고 있다. 2019.07.05. yesphoto@newsis.com[서울=뉴시스] 이윤희 김가윤 기자 = 검찰이 김태한 삼성바이오로직스 대표를 횡령 등 혐의로 최근 추가기소한 것으로 파악됐다. 앞서 검찰은 삼성그룹 불법 경영승계 의혹과 관련해 이재용 삼성전자 부회장 등을 재판에 넘겼는데, 당시 김 대표도 외부감사법 위반 혐의로 함께 기소했다. 이후 추가 수사를 진행해 김 대표를 재차 재판에 넘긴 것이다.15일 검찰에 따르면 서울중앙지검 특별공판2팀(팀장 김영철)은 지난 12일 김 대표와 최고재무책임자(CFO) 김동중 전무를 특정경제범죄가중처벌등에관한법률 위반(횡령), 증거인멸 은닉 교사 혐의로 불구속 기소했다. 또 안모 사업지원TF 부사장도 증거인멸 은닉 교사 혐의로 재판에 넘겼다. 삼성바이오로직스도 이날 금융감독원 전자공시시스템에 이같은 사실을 공시하고 ""당사는 본 건과 관련하여 제반 과정에 대해 적법한 절차에 따라 조치를 취할 계획이다""고 밝혔다.김 대표 등은 바이오로직스 상장 과정에서 이사회 결의 등 적법한 절차를 거치지 않고 회삿돈 수십억원을 챙긴 혐의를 받고 있다. 검찰은 이들이 지난 2016년말 바이오로직스가 상장한 이후 회사 주식을 수차례 사들이면서 우리사주 공모가와의 차액을 현금으로 챙긴 것으로 의심하고 있다.검찰은 공소장에 김 대표 등이 약 47억원의 회사 자금을 횡령했다고 적시했다. 횡령 의심 금액은 김 대표가 30억대, 김 전무가 10억대 수준으로 보고있다.   아울러 김 대표 등은 바이오로직스의 분식회계 과정을 숨기기 위해 조직적인 증거인멸을 벌이는데 가담한 혐의를 받는다.검찰은 이미 지난해 5월 4조5000억원대의 분식회계 의혹 수사 과정에서 바이오로직스 임직원들을 증거인멸 등 혐의로 구속기소했다. 이와 관련해 김 대표 등이 실질적으로 지시하거나 공모했다고 검찰은 판단했다. 앞서 검찰은 김 대표의 증거인멸 가담 의혹과 관련해 지난해 5월, 횡령 혐의와 관련해 같은해 7월 각각 구속영장을 청구했다. 하지만 법원은 증거인멸 교사 의혹 등에 대해 ""공동정범 성립 여부에 다툴 여지가 있다"", 횡령 의혹에 대해 ""주요 범죄 성부(성립 여부)에 다툼의 여지가 있다""며 영장을 모두 기각했다. 구속영장이 기각되면서 김 대표를 향한 검찰 수사에도 제동이 걸렸다. 이후 검찰은 1년여 이상 보강 수사를 거쳐 김 대표 등을 재판에 넘긴 셈이다.한편 서울중앙지검 경제범죄형사부(부장검사 이복현)는 지난달 1일 \'삼성그룹 불법합병 및 회계부정 의혹 사건\'과 관련해 이 부회장을 자본시장법 위반(부정거래·시세조종), 업무상 배임, 외부감사법 위반 등 혐의로 불구속 기소했다. 당시 김 대표와 김 전무도 외부감사법 위반 혐의로 재판에 넘겨졌다.☞공감언론 뉴시스 sympathy@newsis.com, yoon@newsis.com▶ 네이버에서 뉴시스 구독하기▶ K-Artprice, 유명 미술작품 가격 공개▶ 뉴시스 빅데이터 MSI 주가시세표 바로가기<ⓒ 공감언론 뉴시스통신사. 무단전재-재배포 금지>뉴시스 관련뉴스해당 언론사에서 선정하며 언론사 페이지(아웃링크)로 이동해 볼 수 있습니다.존 볼턴 ""北 김정은 눈물의 비밀은 주머니속 그것""""서울대 교수, 제자 성관계후 1억 줬다더라""만날 때마다 3천만원… 女연예인에 \'고급 알바\' 제안20대女, QR 찍어달라는 남직원 급소 무릎으로 찍어""야한말 해줘"" 여경 번호 뿌린 경찰…법정서 질질 끌려나가좋아요0훈훈해요0슬퍼요0화나요0후속기사 원해요0기사제공 :']"
4,삼성전자, 2020-10-1518:58,디지털타임스 ,美 최대 주방·욕실 전시회도 대면행사 결국 취소,https://finance.naver.com/news/news_read.nhn?article_id=0002630410&office_id=029&mode=search&query=삼성전자&page=1,"['       美 최대 주방·욕실 전시회도 대면행사 결국 취소      기사입력2020-10-15 18:58기사원문좋아요훈훈해요좋아요 평가하기공감좋아요0훈훈해요0슬퍼요0화나요0후속기사 원해요0댓글소비자가전쇼 이어 온라인 개최삼성·LG, 북미 공략 차질 우려코로나19 여파로 매년 초 미국에서 열리는 북미 최대 주방·욕실 전시회인 KBIS가 온라인으로 열린다. 작년 1월 21일부터 23일(현지시간)까지 미국 라스베이거스에서 열린 \'KBIS 2020\'에서 삼성전자 모델이 \'패밀리허브\' 냉장고를 중심으로 가전을 소개하고 있다.     삼성전자 제공LG전자가 지난 1월 21일부터 23일(현지시간)까지 미국 라스베이거스에서 열린 미국 최대 주방·욕실 전시회 \'KBIS 2020\' 전시부스에서 프리미엄 빌트인 \'시그니처 키친 스위트\'를 선보이고 있다.     LG전자 제공[디지털타임스 박정일 기자] 코로나19 여파로 내년 초 미국 라스베이거스에서 열릴 예정이었던 북미 최대 주방·욕실 전시회 KBIS(The Kitchen & Bath Industry Show) 2021이 온라인 개최된다. 북미 시장 공략의 무대인 CES(소비자가전쇼)에 이어 KBIS까지 오프라인 행사가 취소되면서 삼성전자와 LG전자는 \'언택트(비대면)\' 마케팅을 한층 강화할 것으로 보인다. 14일 업계에 따르면 KBIS 주최측 NAHB(National Association of Home Builders)는 코로나19 상황을 고려해 당초 내년 2월 9일부터 11일까지 미국 올랜도의 오렌지카운티 컨벤션센터에서 개최할 계획이었던 오프라인 행사를 취소한다고 밝혔다. 이들은 대신 내년 2월 둘째 주 쯤 온라인으로 행사를 개최한다는 방침이다. 처크 포크 NAHB 회장은 ""전시자와 참석자, 파트너, 그리고 직원의 건강과 안전이 최우선 과제라고 생각한다""며 ""역동적인 가상 무역 박람회를 제작해 업계의 선례를 만들 수 있는 기회""라며 온라인 개최 결정의 배경을 설명했다. 이 행사는 CES와 함께 북미에서 열리는 대규모 가전 전시회 중 하나로 올 초에는 미국 라스베이거스에서 열려 약 9만명의 관람객이 참석했고, 600여개의 글로벌 기업들이 전시했다. 삼성전자와 LG전자 역시 각각 420평, 278평 규모의 대형 전시장을 마련해 현지 시장을 공략했다.업계에서는 CES에 이어 이 행사까지 취소되면서 삼성전자와 LG전자는 빌트인 등 북미 생활가전 시장 공략에 차질이 빚어질 것으로 우려하고 있다. 올 초 열린 행사에서 두 회사는 사물인터넷(IoT)과 인공지능(AI)을 적용한 생활가전 패키지를 대거 전시했고, 특히 LG전자의 경우 프리미엄 빌트인 \'시그니처 키친 스위트\'로 최고상인 \'2020 미국주방욕실협회(NKBA) 회장상\'을 받기도 했다.이에 삼성·LG전자는 온라인과 현지 영업인력을 최대한 활용해 북미 시장 개척을 이어간다는 방침이다. 업계 관계자는 ""온라인 신제품 마케팅을 한층 강화하면서 동시에 현지 영업인력을 활용해 전략제품 판매를 늘려갈 방침""이라고 말했다. 박정일기자 comja77@dt.co.kr 디지털타임스 채널 구독 / 뉴스스탠드 구독디지털타임스 홈페이지 바로가기디지털타임스 관련뉴스해당 언론사에서 선정하며 언론사 페이지(아웃링크)로 이동해 볼 수 있습니다.""우리 부총리님 같은 안타까운 전세난민 없도록""…김현미, 세입자 계약갱신청구권 급히 수정\'라스\' 박휘순, 예비신부 나이가…\'현아♥\' 던과 동갑?\'엉터리\' 집값 통계 어디까지 믿어야 하나…문정부, 이명박·박근혜 정부보다 오차 너무 커공매도 금지 기간에도 외국인 불법 시도 만연""실거주 안하면 소송할 겁니다""…점점 더 \'배짱\' 부리는 세입자들좋아요0훈훈해요0슬퍼요0화나요0후속기사 원해요0기사제공 :']"
