,회사명,날짜,언론사,기사제목,링크,본문
0,삼성전자, 2020-03-2819:30,서울경제 ,마스크는 밀폐 보관부터 옷 살균까지···코로나19 예방 ‘디테일’,https://finance.naver.com/news/news_read.nhn?article_id=0003716327&office_id=011&mode=search&query=삼성전자&page=1,"['       마스크는 밀폐 보관부터 옷 살균까지···코로나19 예방 ‘디테일’      기사입력2020-03-28 19:30기사원문좋아요훈훈해요좋아요 평가하기공감좋아요0훈훈해요0슬퍼요0화나요0후속기사 원해요0댓글마스크를 보관할 수 있는 코멕스 NEW바이오킵스 /사진제공=코멕스[서울경제] 신종 코로나바이러스 감염증(코로나19) 사태가 길어지면서 일상생활에서 감염을 예방하는 방법이 주목받고 있다. 마스크와 손 소독제가 필수가 된 요즘, 이를 어떻게 보관하고 효과적으로 쓰는지가 관건이 됐다. 뿐만 아니라 외출에서 바이러스와 접촉할 가능성이 있는 옷도 의류 청정기 등을 통해 살균하는 게 안전하다.일주일에 2개까지만 마스크를 새로 살 수 있게 돼 대다수에 사람은 한 마스크를 수일씩 사용한다. 당연히 보건용 마스크의 적절한 사용법과 관리, 보관 방법에도 관심이 높다. 일회용 마스크는 한번 오염되면 계속 사용할 수 없기 때문에 앞쪽을 손으로 만지지 말고 끈을 잡아 벗어야 한다. 마스크의 개별 포장지 없이 구매한 경우 외부 공기가 차단되는 밀폐용기에 넣어 보관하는 것이 좋다. 코멕스의 NEW바이오킵스는 4면을 균일하게 눌러주는 실리콘 패킹으로 완전 밀폐가 가능해 위생적인 보관이 가능하다. 특히 NEW바이오킵스는 99.9% 항균 효과가 있는 항균 실리콘이 적용된 뚜껑을 사용하고 있어 마스크를 더욱 위생적으로 보관할 수 있다.호흡기는 마스크로 가리더라도 손으로부터 옮길 수 있는 바이러스도 걱정이다. 손을 통해 휴대전화, 마우스, 키보드 등으로 코로나19가 옮을 수 있어 이를 수시로 소독하는 것이 안전하다. 여러 물건을 소독하기 위해서는 분무형 소독제가 편리하다. 소독을 원하는 곳에 뿌린 후 초극세사 천이나 헝겊으로 물체의 표면을 문지르고 닦아내야 한다. 코멕스 분무기 PP는 800mL와 1.1L로 구성되어 소독제를 넉넉히 담아 비치해두기 알맞다. 당연히 수시로 흐르는 물에 비누를 이용해 손을 씻는 게 가장 좋은 예방법 중 하나다. 무엇보다 손바닥과 손가락 사이까지 30초 이상 충분히 씻는 게 중요하다. 애경산업의 위생 전문 브랜드 랩신은 30초 올바른 손 씻기 습관을 위해 V3 컬러체인징 포밍 핸드워시를 선보였다. V3 컬러체인징 포밍 핸드워시는 세균이 제거되는 손 씻기 적정시간 30초 동안 거품 색이 분홍색에서 흰색으로 변하는 인디케이터 기술을 적용했다. 마스크뿐 아니라 외출복도 코로나19에 하루종일 노출돼 있다. 하지만 겉옷의 경우 매일 세탁하기 어려운 게 현실이다. 삼성전자의 에어드레서는 외출 후 돌아와서 의류를 넣어두기만 하면 간편하게 살균이 가능하다. 살균코스 집먼지 진드기는 100% 박멸하고 인플루엔자(A virus), 아데노(ICHV), 헤르페스(IBRV) 등 바이러스와 황색포도상구균, 대장균을 99.9% 제거해 준다.속옷이나 양말 등 가볍게 빨 수 있는 의류는 소형 세탁기를 이용하면 된다. 매일 대용량 일반 세탁기는 돌릴 수 없지만 삶은 기능이 있는 파세코(037070) 미니 클린(2.8㎏)을 활용하면 편리하다. 20분 만에 탈수까지 끝내는 쾌속모드와 공간 효율성을 높인 아담한 크기(405㎜×725㎜×385㎜)가 돋보인다. 큰 세탁기로는 번거로운 아기 옷이나 속옷 등을 삶아 살균 효과를 볼 수 있다. /이재명기자 nowlight@sedaily.com‘아기 옷 전용 세탁기’로 유명한 파세코 미니 클린 소형 세탁기 /사진제공=파세코[서울경제 바로가기]▶ 새로워진 서울경제 모바일을 만나보세요.▶ 네이버 채널에서 \'서울경제\' 구독해주세요!저작권자 ⓒ 서울경제, 무단 전재 및 재배포 금지서울경제 관련뉴스해당 언론사에서 선정하며 언론사 페이지(아웃링크)로 이동해 볼 수 있습니다.""김세의, 부산서 성매매""···檢 고발에 가세연 측 ""말도 안 되는 소리"" 일축서우, 깜짝 놀랄만큼 예쁘고 섹시해졌네···화보 통해 공개된 근황조현병 앓는 30대, 어머니 얼굴 흉기로 찔러···테이저건 쏴 검거박기량, 백설공주보다 더 예쁠걸···눈이 떨어지지 않는 미모""죄책감 들어""···\'박사방\' 입금 추정 40대, 한강서 극단적 선택좋아요0훈훈해요0슬퍼요0화나요0후속기사 원해요0기사제공 :']"
1,삼성전자, 2020-03-2818:22,한국경제 ,[전·기·시] 삼성전자 갤럭시S20과 엑시노스(Exynos),https://finance.naver.com/news/news_read.nhn?article_id=0004314734&office_id=015&mode=search&query=삼성전자&page=1,"['       [전·기·시] 삼성전자 갤럭시S20과 엑시노스(Exynos)      기사입력2020-03-28 18:22기사원문좋아요훈훈해요좋아요 평가하기공감좋아요0훈훈해요0슬퍼요0화나요0후속기사 원해요0댓글전자적 기자 시점갤럭시S20 국내 모델에서 배제된 삼성 엑시노스 통합칩셋퀄컴 스냅드래곤에 밀렸다는 평가 우세중국 비보 등엔 순조롭게 납품삼성전자 엑시노스 포기 안 하고 기술개발 더욱 주력할 듯\'전자적 기자 시점(전·기·시)\'은 한국경제신문 산업부 전자팀 기자들이 약간은 가볍게 쓰는 온라인 기사 코너입니다. 전자업계에서 벌어지는 다양한 일들에 대해 형식이나 분량에 구애 받지 않고 전달하겠습니다.삼성전자 무선사업부가 스마트폰을 출시할 때마다 관심을 끄는 사안이 있습니다. 어떤 회사의 통합칩셋이 내장됐는지 입니다. 통합칩셋(SoC, System on Chip)은 이름대로 통신을 담당하는 모뎀칩에 두뇌 역할을 하는 AP(애플리케이션프로세서) 그래픽프로세서(GPU) 등을 한 칩으로 만든 반도체입니다. 스마트폰의 성능을 좌지우지하기 때문에 소비자들의 관심이 큽니다.전 세계 통합칩셋 시장의 강자는 단연 미국 퀄컴(Qualcomm)입니다. 2000년대 초반 판매됐던 휴대폰에 \'digital by Qualcomm\'이란 스티커가 붙어 있었던 것을 기억하시는 분도 계실텐데요. 바로 그 회사입니다. 퀄컴은 기술력을 앞세워 통신칩 표준을 만든 글로벌 정보기술(IT)기업입니다. 스마트폰을 만드려면 퀄컴 특허기술이 꼭 필요하기 때문에 삼성전자, LG전자, 샤오미, 화웨이 등 스마트폰 제조업체들은 회사마다 차이가 있지만 매년 스마트폰 매출의 약 5% 정도를 \'로열티\' 명목으로 퀄컴에 지급합니다. 퀄컴의 통합칩셋 브랜드는 \'스냅드래곤(Snapdragon·사진)\'입니다. 스냅드래곤은 \'금어초\'라는 식물을 뜻하는 단어입니다. 전 세계 통신칩 시장의 33.4%(2019년 카운터포인트리서치)를 장악하고 있습니다.퀄컴 스냅드래곤 반도체삼성전자는 프리미엄 스마트폰에 어떤 통합칩셋을 쓸까요. 물론 퀄컴의 스냅드래곤을 씁니다. 삼성 모든 스마트폰에 스냅드래곤이 들어가는 건 아닙니다. 삼성전자는 전 세계에서 자체적으로 통합칩셋을 개발·판매하고 있는 몇 안 되는 회사입니다. 삼성전자 시스템반도체(D램, 낸드플래시를 제외한 비메모리반도체)를 담당하는 시스템LSI사업부가 2011년 2월 출시한 \'엑시노스\'(Exynos)입니다. 삼성전자를 제외하곤 \'기린\'이란 통합칩셋을 생산하고 있는 중국 화웨이, \'헬리오\'란 이름을 붙인 SoC를 판매하는 대만 미디어텍 정도를 꼽을 수 있겠네요.삼성전자 엑시노스. 한경DB삼성전자 뉴스룸에 따르면 엑시노스(Exynos)는 그리스어로 \'Smart(Exypnos)\'와 \'Green(Prasinos)\'의 의미를 담고 있다고 합니다. 삼성전자는 엑시노스 런칭 시점에 배포한 보도자료에서 ""삼성전자는 지난 2009년부터 추진하고 있는 모바일 사업 전략인 \'삼성 Smart & Green\' 전략을 적극 계승하여, 한층 향상된 고성능·저전력 반도체로 모바일 반도체 시장을 주도해 나가기 위해 이번 브랜드 런칭을 시작하게 됐다""고 설명했습니다.이후 10년 동안 엑시노스는 나름대로 승승장구했습니다. 삼성전자 프리미엄 스마트폰의 국내, 유럽, 남미 등의 판매 모델엔 항상 탑재가 됐습니다. 물론 미국과 중국에서 판매되는 제품엔 퀄컴 스냅드래곤을 넣었지만요. 품질도 \'나쁘지 않다\', \'대등하다\'는 평가를 받았습니다. 삼성전자는 엑시노스를 통해 전 세계 통신칩 시장을 사실상 지배했던 퀄컴에 대한 \'가격협상력\'을 갖게 된 것이죠.퀄컴과 삼성전자는 기술경쟁도 치열하게 벌였습니다. 세계 최초 5세대 이동통신(5G) 통합칩셋 출시 레이스에선 삼성전자가 퀄컴보다 약 4개월 정도 앞서기도 했습니다. 작년 하반기엔 삼성전자 시스템LSI사업부가 현안으로 삼았던 타사 \'대규모 납품\'도 성사시킵니다. 세계 5위권 스마트폰업체 중국 비보는 자사 5세대 이동통신 스마트폰에 삼성전자 엑시노스 통합칩셋을 넣는다고 발표했습니다. 잘 나가던 엑시노스가 \'이상 조짐\'을 보이기 시작한 건 갤럭시S20(사진) 출시 때부터입니다. 삼성전자 무선사업부가 갤럭시S20 국내 모델에도 \'스냅드래곤865\' 통합칩셋을 탑재했기 때문입니다. 삼성전자 프리미엄 스마트폰 국내 모델에 엑시노스가 빠진 건 사실상 처음 있는 일이라고 합니다. 삼성은 유럽과 남미에 출시한 갤럭시S20에만 \'엑시노스 990\'을 넣었습니다. 업계에선 전혀 예상치 못했던 일이라고 합니다. 한국 퀄컴 고위 관계자도 기자와의 통화에서 ""한국은 물론 미국 본사에서도 예상치 못했던 일""이라고 얘기했을 정도니까요. 갤럭시S20 언팩. 한경DB이 사건을 놓고 삼성 안팎에선 다양한 얘기가 흘러나옵니다. 기본적으론 이번 \'엑시노스990\'의 성능이 기대에 못 미쳤다는 평가가 많이 나옵니다. 시스템LSI사업부 임직원들이 \'굴욕적\'이라고 느낄만한 소문도 쏟아집니다. \'삼성전자 시스템LSI사업부 관계자들이 무선사업부에 찾아가서 읍소했지만 결정을 뒤집을 수 없었다\', \'시스템LSI사업부가 당연히 사줄 줄 알고 안이하게 대처하다가 망신을 당했다\' 류의 얘기입니다. 최근엔 \'삼성전자가 결국 엑시노스를 접을 것이다\'라는 극단적인 예상이 나오기도 합니다.통합칩셋 개발과 판매에 공들여온 삼성전자의 행보를 감안할 때 삼성이 엑시노스를 접을 가능성은 극히 작다는 게 업계 전문가들의 관측입니다. 실제 삼성전자는 특허권을 무기로 통합칩셋 외부 판매를 막았던 퀄컴과 법원에서 다툼을 벌일 정도로 통합칩셋 사업에 애착이 큽니다. 이제 비보 등 중국 스마트폰 업체에 \'외부 판매\'를 시작하고 수익을 내기 위해 노력하고 있는 상황에서 사업을 접는다는 게 말이 안 된다는 얘기도 나옵니다.만약 엑시노스를 접게 되면 퀄컴과의 \'가격협상\'도 포기해야합니다. 당연한 얘기지만 엑시노스는 삼성전자와 퀄컴 간 가격협상 때 \'무시할 수 없는 지렛대\'가 된다는 게 반도체업계 사람들의 공통된 얘기입니다. 삼성전자가 정말 엑시노스 사업에서 철수를 한다면, 무서워질 게 없는 퀄컴은 당연히 가격 인상 등 더 큰 요구를 던지지 않을까요.세계적인 통신칩 강자 퀄컴과 어깨를 나란히 할만큼 성장한 것에 대해선 많은 업계 관계자들이 삼성전자 시스템LSI사업부에 박수를 보내고 있습니다. 다만 \'철수설\' 같은 굴욕적인 루머를 누르고 뛰어오르기 위해선 지금까지 해왔던 것보다 더 큰 노력이 필요할 듯 합니다. 회사도 직원들의 얘기에 귀 기울일 필요가 있다고 봅니다. 삼성전자 시스템LSI사업부 직원들 사이에선 \'R&D 인력 보강\', \'중장기적 관점의 대규모 투자\' 등에 대한 요구가 크다고 합니다. 퀄컴 화웨이의 5분의 1, 10분의 1 수준 인력과 투자를 감안할 때 이정도까지 올라온 게 \'기적\'이란 얘기입니다. 문재인 대통령(오른쪽 세번째)과 이재용 삼성전자 부회장(오른쪽 두번째) 등이 작년 4월30일 경기도 화성 삼성전자 DSR에서 열린 시스템반도체 비전 선포식을 마친 후 EUV동 건설현장을 방문하고 있다. 청와대사진기자단D램, 낸드 같은 \'메모리반도체\'의 가격 변동에 삼성 반도체사업이 흔들리지 않기 위해선 시스템반도체(비메모리반도체)에 대한 투자가 필수적입니다. 삼성 역시 이를 잘 알고 있습니다. 이재용 삼성전자 부회장이 지난해 4월 \'시스템반도체 비전 2030\'을 발표하고 2030년까지 통합칩셋, 이미지센서, 파운드리 같은 시스템반도체 사업에 133조를 투자한다고 발표했을 정도니까요. 이제 1년이 지났습니다. 쉽지 않은 \'장기전\'이 될테지만 삼성전자가 선전하길 기대해봅니다.황정수 기자 hjs@hankyung.com▶ 네이버에서 한국경제 뉴스를 받아보세요▶ 한경닷컴 바로가기  ▶ 모바일한경 구독신청 ⓒ 한국경제 & hankyung.com, 무단전재 및 재배포 금지한국경제 관련뉴스해당 언론사에서 선정하며 언론사 페이지(아웃링크)로 이동해 볼 수 있습니다.손석희, 조주빈 신고못한 이유 ""배후에…"" 충격은행에 \'1억\' 맡겼더니…벌어진 일물로만 손 씻으면…\'반전 사실\'외국인들 ""한국 가면 코로나 검사 공짜"" 발칵""전 세계 콘돔이 없어질지도""…날벼락좋아요0훈훈해요0슬퍼요0화나요0후속기사 원해요0기사제공 :']"
2,삼성전자, 2020-03-2814:34,이데일리 ,"[여의도TMI]전직원 유급 연차휴가 쓰라는데…""강제해도 되나요""",https://finance.naver.com/news/news_read.nhn?article_id=0004607818&office_id=018&mode=search&query=삼성전자&page=1,"['       [여의도TMI]전직원 유급 연차휴가 쓰라는데…""강제해도 되나요""      기사입력2020-03-28 14:34기사원문좋아요훈훈해요좋아요 평가하기공감좋아요0훈훈해요0슬퍼요0화나요0후속기사 원해요0댓글딜로이트안진, 다음주 일주일간 연차휴가 지침""코로나19 확산막자"" 사회적 거리두기 강화 적극 동참근로기준법 위반 가능성 제기돼 고용노동부 진정 예고여의도 증권가는 돈 벌기 위한 정보 싸움이 치열한 곳입니다. 하루에도 수많은 쪽지와 지라시가 도는 그야말로 정보의 홍수인 곳입니다. 너무 정보가 많아서 굳이 알고 싶지 않거나 달갑지 않은 내용까지 알게 되는 TMI(Too Much Information)라는 신조어도 있는데요. TMI일 수도 있지만 돈이 될 수도 있는 정보, [여의도 TMI]로 풀어봅니다.[이데일리 유현욱 기자] 4대 회계법인 중 하나인 딜로이트 안진이 전 임직원들에게 유급 연차휴가 사용을 사실상 강제해 논란이 일고 있습니다. 창립기념일인 4월 1일을 전후해 나흘을 ‘블록 홀리데이’ (Block Holiday) 휴무일로 명명하고 특별한 사정이 없는 한 일주일간 재택에서 휴식을 취하라고 했다죠. 정부가 오는 4월 5일까지를 신종 코로나 바이러스 감염증(코로나19) 확산을 막기 위한 ‘사회적 거리 두기 강화 기간’으로 지정한 데 적극적으로 동참한다는 차원에서 내려진 결정이라고 합니다.언뜻 보면 임직원들이 환영할 일로 보입니다. 기말 감사로 축낸 몸을 회복할 시간이 생겼고, 한 주간 쉬는 동안에도 정상 급여를 준다니까요. 아시아나항공과 같은 기업이 무급휴직을 확대하는 것에 비하면 나은 상황입니다. 하지만 반대 여론이 만만치 않습니다. 근로기준법 제60조에 따라 근로자에게 주어진 연차 유급휴가를 소진하라고 일방적으로 통보한 셈이기 때문입니다. 다가오는 여름과 겨울 장기간 휴가계획을 세웠다면 예기치 않게 수정해야 할 판이니까요. 법상 가산휴가를 포함한 휴가 일수는 최장 25일입니다.딜로이트 안진 측은 권고에 불과할 뿐 강제력이 없다고 해명하지만, 직원들은 ‘반강제적이다’ ‘심리적 압박이 크다’고 반박합니다. 딜로이트 안진에 딜로이트 컨설팅을 포함하면 한국 딜로이트 그룹 전체 임직원은 2500명가량입니다. 원칙적으로는 이들 전원이 블록 홀리데이 적용 대상자입니다. 딜로이트 안진은 예정된 업무가 있거나 긴급한 업무가 있는 경우 예외를 뒀다고 부연합니다. 이들에게도 차후 대체휴가를 쓰도록 안내했다는 설명과 함께이죠. 다만 그 규모에 대해서는 파악하기 어렵다는 말만 반복합니다.통상 12월 말 결산법인은 3월 31일까지 법인세를 신고해야 하는데, 이 과정에 회계사들이 기업회계와 세무회계 간 차이를 조정하는 업무가 긴박하게 이뤄집니다. 이런 일을 주로 하는 세무자문본부 인력 일부는 예외를 인정받을 것으로 보입니다. 상장법인 재감사에 투입되는 회계감사본부 회계사들 역시 정상 업무가 불가피하다는 관측입니다.창립기념일을 전후해 블록 홀리데이를 두는 것은 딜로이트 안진만의 전통으로, 지난해까지는 하루에 불과했습니다. 애초 올해에도 유사한 일정을 계획했었으나 막판에 기간이 확 늘어난 것인데, 이를 일방적으로 통보한 데 따른 절차상 하자 등 논란이 걷잡을 수 없이 커지고 있습니다. 삼일PwC·삼정KPMG·EY한영 등 나머지 빅4 회계법인들 역시 내심 강화된 사회적 거리 두기 정책에 발맞춰 필수 인력이 아니라면 유급 연차휴가를 활용했으면 바라지만, 종국에는 자율에 맡긴다고 합니다. 전례나 동종 업계에 비춰봐도 이례적이라는 거죠.일부 딜로이트 안진 직원들은 코로나19를 빌미로 부당 노동행위가 끊이지 않는다고 판단, 고용노동부에 진정을 제기할 계획으로 전해졌습니다. 고용노동부는 “양측 의견을 충분히 들어보고 판단하겠다”는 입장입니다. 다만 지난 9일 ‘코로나19 관련 노동관계법 주요 Q&A’를 배포하며 “연차 유급휴가는 근로자가 청구한 시기에 줘야 하므로 근로자의 의지와 관계없이 강제로 사용하도록 할 수 없다”고 못 박은 바 있죠. 이를 위반한 자는 2년 이하의 징역 또는 2000만원 이하의 벌금에 처합니다.고용노동부가 진정을 접수해 특별근로감독에 나선다면 노사 양측에 얼마나 사전교감이 있었는지가 관건이 될 전망입니다. 근로기준법 제62조를 보면 사용자는 근로자 대표와 서면 합의에 따라 연차 유급휴가일을 갈음해 특정한 근로일에 근로자를 휴무시킬 수 있는데, 블록 홀리데이가 이에 해당하는 걸로 추정됩니다. 문제는 블록 홀리데이가 하루에서 나흘로 연장됐는데, 추가로 이를 문서에 기록했느냐겠지요. 딜로이트 안진은 이와 관련 명확한 대답을 하지는 않고 있습니다.딜로이트 안진이 코로나19로 달라진 근무환경 속에서 직원들과 갈등을 겪은 것은 이번만이 아닙니다. 주말이나 휴가기간에도 매일 법인 홈페이지에 건강상태를 작성케 하고 이를 누락하면 인사평가에 반영해 불이익이 준다는 지침을 일부 파트너(임원)가 전달하자, 지나치다는 비판을 받았습니다. 코로나19 대응에 전력을 기울이자는 취지는 좋지만, 인사고과를 운운한 것이 반발을 부른 것이죠.그럼 딜로이트 안진이 유독 구설에 오르는 이유는 뭘까요. 회계 업계에서는 결국 인건비 부담을 이기지 못해 연이어 무리수를 던지고 있다고 평가합니다. 딜로이트 안진은 지난해 경력직 회계사를 대거 채용했습니다. 주기적 감사인 지정제 시행을 앞두고 회계법인 역량을 평가하는 가장 중요한 요소인 등록 회계사 숫자를 늘리기 위해서였다죠. 그런데 삼성전자를 수임한 것 외에 생각보다 감사인 지정 효과를 보지 못한 것으로 전해집니다. 회계법인 덩치는 한껏 불렸는데, 수익이 그만큼 늘지 않을 것이 불 보듯 하니 비용을 줄일 수밖에 없는 상황인 겁니다. 유급 연차휴가를 소진하지 못하면 지급해야 할 수당조차 절감하려는 눈물겨운 노력이라는 얘기죠.유현욱 (fourleaf@edaily.co.kr)네이버에서 ‘이데일리’ 구독하기▶청춘뉘우스~ 스냅타임▶＜ⓒ종합 경제정보 미디어 이데일리 - 무단전재 & 재배포 금지＞이데일리 관련뉴스해당 언론사에서 선정하며 언론사 페이지(아웃링크)로 이동해 볼 수 있습니다.안산도 10억 클럽?…교통호재에 집값 \'들썩\'구자원 LIG그룹 명예회장 별세…향년 86세\'치료센터 탈출\' 신천지 확진자, 펜션서 춤추는 모습 \'포착\'초등생 성폭행→영상 유포 협박한 고2…처벌대신 \'보호처분\'\'무도\' 출연 의사 김현철 사망…""코로나19로 조문 사양""좋아요0훈훈해요0슬퍼요0화나요0후속기사 원해요0기사제공 :']"
