,회사명,날짜,언론사,기사제목,링크,본문
0,삼성전자, 2020-11-1420:06,헤럴드경제 ,200만원→ 90만원 반값된 '갤럭시폴드’…‘구입 전쟁’ [IT선빵!],https://finance.naver.com/news/news_read.nhn?article_id=0001751786&office_id=016&mode=search&query=삼성전자&page=1,"['       200만원→ 90만원 반값된 \'갤럭시폴드’…‘구입 전쟁’ [IT선빵!]      기사입력2020-11-14 20:06기사원문좋아요훈훈해요좋아요 평가하기공감좋아요0훈훈해요0슬퍼요0화나요0후속기사 원해요0댓글[헤럴드경제=박혜림 기자] “귀족폰 몸값 크게 낮췄습니다”삼성전자가 지난해 첫 출시한 폴더블(접는) 스마트폰 ‘갤럭시폴드’의 실구매 가격이 90만원대까지 떨어졌다. 출고 가격도 내렸다. 199만8700원에서 170만5000원으로 29만원 더 저렴해졌다.여기에 KT가 모든 요금제 구간에서 공시지원금을 70만원까지 올리면서 실구매가가 90만원으로 뚝 떨어졌다. 초고가의 폴더폰 가격이 크게 낮아지면서 구매 수요도 크게 늘고 있다.저렴한 가격에 폴더블폰을 구입하려는 고객들이 크게 늘고 있다.갤럭시폴드의 출시가는 239만8000원으로 유례없는 ‘초고가’였다. 공시지원금도 ‘짠물’ 이었다. 이통사 최고가 요금제 기준 공시지원금이 최대 19만원에 불과했다. 이에 실 구매가도 200만원에 달했다.이후 공시지원금을 40만~50만원 수준으로 높여 실구매가를 190만원대로 낮추더니 후속모델인 갤럭시Z폴드2의 출시와 함께 ‘몸값’도 낮췄다. 공시지원금도 더욱 확대됐다.이는 재고 소진 및 폴더블폰 대중화 일환으로 풀이된다.한편 삼성전자는 앞서 위 아래로 여닫는 클램셸(조개껍질) 폴더블폰 ‘갤럭시Z플립’의 출고가도 15만원 가량 낮췄다. 올해 2월 165만원에 출시됐지만, 9월 들어 134만2000원으로 낮췄고, 불과 한 달 만에 118만8000원으로 한 차례 더 인하했다. 이에 따라 경쟁모델인 LG전자의 LG윙(109만8900원)은 물론 아이폰12(기본 모델 기준 109만원)와도 가격 차이가 10만원 안팎으로 좁혀졌다.rim@heraldcorp.com▶환경적 대화기구 \'헤럴드에코\'▶밀리터리 전문 콘텐츠 ‘헤밀’▶헤럴드경제 네이버 채널 구독- Copyrights ⓒ 헤럴드경제 & heraldbiz.com, 무단 전재 및 재배포 금지 -헤럴드경제 관련뉴스해당 언론사에서 선정하며 언론사 페이지(아웃링크)로 이동해 볼 수 있습니다.""조두순 아들인데""…조회수에 눈먼 철없는 아이들! [IT선빵!]""트럼프 머리카락에 무슨 일이 생긴거야""日코미디언 ""연하남 좋아…BTS 지민과 결혼하고파"" 고백 화제""자숙했어요 ㅠㅠ"" 사고친 유명 유튜버 \'슬금 슬금\' 복귀! [IT선빵!]진중권, \'전태일 정신\' 발언 논란 윤희숙에 ""이쯤되면 광신""좋아요0훈훈해요0슬퍼요0화나요0후속기사 원해요0기사제공 :']"
1,삼성전자, 2020-11-1418:26,아시아경제 ,"[주간증시 리뷰]호재에 민감한 증시, 코스피 2500선까지 '껑충'",https://finance.naver.com/news/news_read.nhn?article_id=0004791919&office_id=277&mode=search&query=삼성전자&page=1,"['       [주간증시 리뷰]호재에 민감한 증시, 코스피 2500선까지 \'껑충\'      기사입력2020-11-14 18:26기사원문좋아요훈훈해요좋아요 평가하기공감좋아요0훈훈해요0슬퍼요0화나요0후속기사 원해요0댓글 [아시아경제 오주연 기자] 11월 2주 국내 증시가 미국 대선 결과와 신종 코로나바이러스감염증(코로나19) 백신 개발 이슈 등의 호재에 민감하게 반응하면서 상승 마감했다. 코스피는 2500선 근처까지 오르며 연고점을 경신했다. 그동안 강세를 보여왔던 비대면(언택트) 관련주들은 백신 개발 소식에 상대적으로 부침을 겪었지만, 개인 투자자들은 오히려 주가가 떨어진 NAVER와 카카오, 엔씨소프트, 씨젠 등을 쓸어담으며 저점매수했다.14일 한국거래소에 따르면 코스피는 지난 9일 2447.20에서 13일 2493.87로 1.91% 상승했다. 주초에는 미국 대선 결과의 호재에 반응하며 친환경 관련주들이 지수를 끌어올렸고 이후에는 백신 개발 소식에 반응해 지난 상승장에서 소외됐던 컨택트 관련주들이 반등하며 지수를 견인했다.단기간에 오른만큼 조정을 보일 것이라는 예상과는 달리 시장은 여전히 호재에 더욱 반응하며 상승세를 이어갔다. 11월 첫째주, KODEX 200선물인버스2X와 KODEX인버스 등 지수 하락에 대거 베팅했던 개인들은 언택트에서 컨택트로 돌아선 장에서 주가가 상대적으로 하락한 NAVER, 카카오 등을 집중 매수했다.개인이 가장 많이 순매수한 종목은 NAVER로 지난 9일부터 13일까지 총 4905억원어치를 사들였다. 이어 카카오(1507억원), 씨젠(1507억원), 씨젠(1246억원), 엔씨소프트(1126억원) 등이 뒤를 이었다.순매도 1위에는 삼성전자가 차지했다. 개인은 이 기간동안 삼성전자를 1조4451억원어치 팔아치웠다. 삼성전자는 9일 6만200원이었던 주가가 13일 6만3200원으로 4.98% 상승해 52주 신고가를 경신했다.차주에는 미국 대선 불확실성 완화에 따른 랠리가 이어질 수 있다는 기대감과 코로나19 재확산에 따른 봉쇄조치로 지수 상승이 제한될 수 있다는 우려가 혼재한다.노동길 NH투자증권 연구원은 ""대선결과 안도에 따른 외국인 투자자 자금 유입이 국내 주식시장 상승을 견인했다""며 ""외국인과 금융투자 중심의 기관 매수세는 코스피200을 중심으로 한 대형주 수급에 긍정적으로 작용할 전망""이라고 내다봤다.이어 ""부분 봉쇄 우려에도 백신 기대감이 지속될 수 있는 환경은 당분간 민감주 중심의 가치주에 유리하게 작용할 것""이라며 ""화학, 운송 등 경기 관련 업종에 우호적인 환경""이라고 분석했다.노 연구원은 ""안도랠리와 백신 기대감에 무게 중심을 두는 가운데 미국 주별 봉쇄 확산 여부에 주목하는 한 주가 될 전망""이라고 예상했다.오주연 기자 moon170@asiae.co.kr▶ 2021년 신축년(辛丑年) 신년운세와 토정비결은?▶ 발 빠른 최신 뉴스, 네이버 메인에서 바로 보기▶ 요즘 트렌드 모아보고 싶을 땐 \'드링킷\'<ⓒ경제를 보는 눈, 세계를 보는 창 아시아경제 무단전재 배포금지>아시아경제 관련뉴스해당 언론사에서 선정하며 언론사 페이지(아웃링크)로 이동해 볼 수 있습니다.안선영 ""남편 은퇴 희망에 이혼 요구했다""강연 나선 안철수에 ""朴탄핵부터 사과해""…진땀""사실 조두순이 제 아빠 입니다""…유튜버 논란\'659억원\' 최연소 로또 당첨자의 기구한 삶尹장모 ""녹취록 제출"" 또다른 변수 등장 \'반전\'좋아요0훈훈해요0슬퍼요0화나요0후속기사 원해요0기사제공 :']"
2,삼성전자, 2020-11-1416:41,매일경제 ,"[주간증시전망] ""美대선 안도랠리와 코로나19 부분 봉쇄 우려 교차""",https://finance.naver.com/news/news_read.nhn?article_id=0004695549&office_id=009&mode=search&query=삼성전자&page=1,"['       [주간증시전망] ""美대선 안도랠리와 코로나19 부분 봉쇄 우려 교차""      기사입력2020-11-14 16:41기사원문좋아요훈훈해요좋아요 평가하기공감좋아요0훈훈해요0슬퍼요0화나요0후속기사 원해요0댓글[자료 제공 = NH투자증권] 다음주 국내 증시(11월16~20일)는 미국 대선 결과를 확인한 후 불확실성이 해소되며 안도랠리를 지속할 전망이다. 여기에 다국적 제약회사 화이자가 미국 식품의약국(FDA)에 신종 코로나바이러스 감염증(코로나19) 백신 긴급사용신청에 나설 것으로 예상되며, 백신 기대감이 투자심리를 개선할 것으로 보인다.노동길 NH투자증권 연구원은 ""주식시장 투자자들은 미국 대선 결과를 확인한 후 자신감을 갖기 시작한 모양새""라며 ""VIX(S&P500 변동성 지수)는 대선 전 40%를 웃돌기도 했으나 대선 후 25% 이하로 급락했다""고 설명했다.NH투자증권에 따르면 바이든 시대의 개막을 앞두고 비달러 자산이 새로운 유망 투자처로 부상하고 있다. 한국 주식시장과 관련 있는 글로벌 ETF(상장주식펀드)에서는 소규모 설정액 증가가 확인됐다. 그동안 외국인 자금 유입에 걸림돌로 작용했던 신흥국과 선진국 간 경기 모멘텀 격차가 축소되고 있다는 점도 긍정적으로 작용했다.노 연구원은 ""화이자에 이어 다른 백신 후보를 임상 실험하던 모더나도 11월 말 임상 결과를 발표할 전망""이라며 ""코로나19 백신 개발 기대감은 위험자산 투자심리 개선을 지속시킬 변수""라고 분석했다.지난주 국내 증시는 상승랠리를 지속했다. 그 결과 코스피 지수는 지난 13일 장중 2495.77까지 오르며 연고점을 새로 썼다.노 연구원은 ""11월 이후 외국인 자금은 삼성전자, SK하이닉스 등 IT와 LG화학, 삼성SDI 등 2차전지 종목에 집중됐다""며 ""외국인과 금융투자현물 순매수도 국내 주식시장 상승세에 일조했다""고 분석했다.그는 다음주 코스피 주간 예상 밴드로 2400~2500선을 제시했다.노 연구원은 ""금융투자는 연말까지 배당 수익을 겨냥한 현물 순매수를 이어갈 것으로 판단한다""며 ""외국인과 금융투자 중심 기관 매수세는 코스피200을 중심으로 한 대형주 수급에 긍정적으로 작용할 전망""이라고 말했다. 반도체 등 IT 중심 대형주 포트폴리오 전략이 유효하다는 설명이다.다만 코로나19에 따른 미국 주별 재봉쇄 조치는 낙관론의 일부를 상쇄할 것으로 보인다. 앤드류 쿠오모 뉴욕주지사는 오는 13일부터 주내 식당과 주점 등 요식업소들의 실내·옥외영업과 체육관 영업을 오후 10시까지로 제한하는 행정명령을 11일(현지시간) 발표했다. 네바다주, 위스콘신주는 자발적 부분 봉쇄 조치 중으로, 미국 일간 확진자 수가 10만명을 웃돌면서 부분적 봉쇄에 대한 우려도 부상하고 있다.이에 대해 노 연구원은 ""부분 봉쇄 우려에도 백신 기대감이 지속될 수 있는 환경은 당분간 민감주 중심 가치주에 유리하게 작용할 전망""이라며 ""화학, 운송 등 경기 관련 업종에 우호적인 환경""이라고 덧붙였다.[김현정 기자 hjk@mkinternet.com]▶ 네이버 메인에서 \'매일경제\'를 받아보세요▶ 궁금한 제조과정 영상으로 보세요. \'이렇게 만들죠\'▶ 매일매일 색다른 뉴스레터 \'매콤달콤\' 구독하세요[ⓒ 매일경제 & mk.co.kr, 무단전재 및 재배포 금지]매일경제 관련뉴스해당 언론사에서 선정하며 언론사 페이지(아웃링크)로 이동해 볼 수 있습니다.진중권, ""유시민 \'자유론\'으로 또 사기쳐…개념 몰라""바람 잘 날 없는 檢 특활비, 이대로 사라질까민주노총 서울 곳곳서 동시다발 \'99명\' 집회영옥·은주·순자 등 한국계 4명 美하원 입성조현우·황인범·권창훈·이동준 코로나 양성좋아요0훈훈해요0슬퍼요0화나요0후속기사 원해요0기사제공 :']"
3,삼성전자, 2020-11-1415:53,한국경제 ,"""삼성이 6위 마이크론에 따라잡혔다""…반도체 업계 '발칵' [황정수의 반도체 이슈...",https://finance.naver.com/news/news_read.nhn?article_id=0004449691&office_id=015&mode=search&query=삼성전자&page=1,"['       ""삼성이 6위 마이크론에 따라잡혔다""…반도체 업계 \'발칵\' [황정수의 반도체 이슈 짚어보기]      기사입력2020-11-14 15:53기사원문좋아요훈훈해요좋아요 평가하기공감좋아요0훈훈해요0슬퍼요0화나요0후속기사 원해요0댓글반도체 전문가 황철성 서울대 석좌교수 인터뷰마이크론 세계 최초 176단 낸드플래시 양산삼성전자 SK하이닉스는 \'아직 개발 중\'D램 기술 격차도 \'3년\'에서 \'6개월\'로 좁혀져황 교수 ""세 걸음 뒤에서 따라오던마이크론이 반 걸음 뒤에 있는 것""황철성 서울대 석좌교수. 한경DB지난 10일 한국 반도체 업계에 충격적인 소식이 전해졌다. 미국 메모리반도체 업체 마이크론이 ""세계 최초로 176단 낸드플래시(전원이 꺼져도 데이터를 저장하는 반도체) 메모리를 생산해 고객사에 납품했다""고 발표한 것이다.최근 낸드플래시 업체들은 데이터 저장공간인 \'셀\'을 수직으로 높게 쌓아 저장 용량이 큰 제품을 만드는 경쟁을 벌이고 있다. 삼성전자와 SK하이닉스는 128단 제품이 주력이고 176단 제품을 개발 중이다. 빌딩으로 비유하면 삼성전자와 SK하이닉스는 최고 128층 빌딩을 짓고 있는데 마이크론은 세계에서 처음으로 176층 빌딩을 완공해 분양한 것이다. 반도체업계에선 ""방심하고 있다가 한 방 먹었다""는 반응이 나온다. 마이크론은 D램(전원을 끄면 데이터가 없어지는 반도체) 시장에선 2분기 기준 삼성전자(점유율 42.1%) SK하이닉스(30.2%)에 이어 세계 3위(22.2%)로 \'3강\'으로 꼽히지만 낸드플래시 시장에선 삼성전자(33.8%), 일본 키옥시아(17.3%), 미국 웨스턴디지털(15.0%), 인텔(11.5%), SK하이닉스(11.4%)이은 6위(10.2%)를 기록하고 있기 때문이다.미국 마이크론의 176단 낸드플래시 소개 자료. 기존 제품과 176단 제품의 성능 차이를 두바이 부르즈칼리파(828m)와 파리 에펠탑(300m)과 비교해 강조하고 있다. 마이크론 홈페이지마이크론의 176단 낸드플래시 양산의 의미와 파장을 지난 13일 오후 황철성 서울대 석좌교수(사진)에게 들어봤다. 황 교수는 서울대 재료공학부 교수, 반도체공동연구소장 등을 역임했다. 과학기술한림원 정회원으로 630편이 넘는 과학기술인용색인(SCI) 논문을 발표한 반도체 분야 전문가다. 교수 임용 전 삼성전자 R&D 연구소에서도 근무해 연구와 교육 뿐만 아니라 산업에도 정통하다는 평가를 받는다. 황 교수는 ""낸드플래시 분야에서 마이크론의 기술력이 삼성전자를 앞질렀거나 최소한 대등해졌다고 볼 수 있다""고 말했다. D램 시장과 관련해서도 ""과거 삼성전자와 마이크론의 기술격차가 \'3년\' 수준이었는데, 최근 \'반 년\' 정도로 좁혀졌다""며 ""세 발걸음 뒤에서 걷던 마이크론이 반 걸음 뒤로 바짝 붙은 것""이라고 설명했다. 아래는 질의응답을 정리한 것이다. ▶마이크론이 정말 176단 낸드 양산에 성공한걸까요.""일단 대량 양산은 아니고 시제품이 나온 정도로 보고 있습니다."" (참고로 마이크론은 자신들이 \'양산에 성공했다\'는 표현을 썼다.)▶마이크론의 기술력이 생각보다 상당하네요.""낸드플래시는 (다른 반도체 대비) 동작의 원리 등이 특별할 게 없습니다.""▶삼성전자는 왜 못 만들까요.""셀을 쌓고 가운데 구멍을 뚫어야하는데, 단수가 올라가면 구멍 뚫는 게 점점 더 어려워집니다. 삼성전자는 세계에서 유일하게 128단까지는 구멍을 한 번에 뚫었습니다(싱글스택). 기술력이 뛰어났던거죠. 그런데 176단부터는 삼성전자도 한 번에 뚫는 게 기술적으로 불가능해졌기 때문에 두 번 뚫어야할 상황이 됐습니다(더블스택). 안 하던 걸 하려다보니 시간이 걸리는거죠. 세계 최초 128단 낸드 양산도 SK하이닉스보단 늦었습니다. "" ▶SK하이닉스는 어떤 상황일까요.""SK하이닉스는 원래 구멍을 두 번 뚫습니다. 예를 들어 삼성전자는 100층짜리 건물을 한 번에 올렸다면 SK하이닉스는 50층 먼저 짓고 그 위에 50층을 또 올린거죠. 128단 낸드를 SK하이닉스가 세계 최초로 양산할 때, 이 때도 구멍을 두 번 뚫는 방식(더블스택)으로 만들었습니다. SK하이닉스도 현재 176단 제품을 열심히 개발 중일겁니다.""▶마이크론은 구멍을 몇 번 뚫을까요.""진작부터 두 번 뚫었습니다.""▶지금 삼성전자나 SK하이닉스 분위기는 어떨까요.""삼성전자는 여러가지로 낸드 분야에서 SK하이닉스의 인텔 낸드사업부 인수 때문에 곤란했을텐데, 한 방 또 맞은 것이다. 기술적 어려움을 극복할 수 있겠죠. 사실 큰 차이는 아닐 것으로 봅니다. 삼성전자와 SK하이닉스도 준비 중이고 아마 올 연말이나 내년 초에 발표할텐데요.""▶그렇다면 크게 걱정할 건 아닌건가요.""문제는 단 한 달이라도 마이크론이 먼저 내놓은 게 중요한 것입니다.""▶마이크론이 그 동안 기술력으로 치고 나오는 회사는 아니었던 것 같은데요.""전 격세지감을 느꼈습니다. 사실 마이크론은 보수적인 기업입니다. D램 만드는 것봐도 삼성전자는 좋은 장비를 써서 좋은 제품을 대량으로 먼저 만들고 있죠. 마이크론은 삼성전자가 앞서나가면 \'우리는 퍼스트무버의 과실을 테이크하겠다\', \'과실을 따먹겠다\' 이 전략이었습니다.""▶전략이 바뀐걸까요.""그렇죠. \'돈을 덜 먹어도 천천히 가자\' 이런 작전이었는데  제품을 먼저 내놓은 것을 보면 \'공격적\'으로 바뀌었다고 볼 수 있는거죠. 우리나라가 걱정하던 상황이 온 것입니다.""▶마이크론이 왜 바뀌었을까요.""6개월만 먼제 제품을 내놓으면 시장 선점해서 돈을 버는 효과가 큽니다. 지금까지 삼성전자가 \'먼저\' 개발하고 출시해서 새로운 시장에서 나오는 과실을 따먹으면 세컨티어로 SK하이닉스가 먹고, 나중에 마이크론이 먹고 이런 구조였는데요. 걱정입니다.""▶마이크론이 치고 나올 수 있었던 원동력은 뭐라고 보십니까.""일본 D램업체 엘피다 인수의 긍정적인 효과가 지금 나오는 겁니다. 마이크론이 엘피다를 인수하고 재무적인 어려움을 많이 겪었죠. 이제 조직이 안정화된거죠. 특히 엘피다의 R&D 인력을 흡수하고 규모가 커지니까 기술력에서 지금 효과가 나오는 겁니다.""(2013년 당시 D램 시장 세계 4위였던 마이크론은 세계 3위 일본 엘피다를 인수했다. 3위와 4위의 결합에도 D램 시장에서 2위 자리에 오르지 못하자 시장에선 \'마이크론의 엘피다 인수 결정은 판단 실수\'라는 평가가 나왔다. 하지만 황 교수는 R&D 측면에선 잘 인수했다고 보고 있는 것이다.)▶한국 반도체업체들은 어떻게 대응해야할까요.""결국 인력인데요. R&D 인력 키우는 게 쉽지 않습니다. 마이크론이 엘피다를 인수한 것 중에 가장 큰 게 엘피다의 숙련된 R&D 인력을 가져간 겁니다.""▶D램도 마이크론이 치고 나올까요.""예전에 삼성전자와 마이크론의 기술 격차는 \'3년\'이었습니다. 삼성전자가 1세대 10nm(나노미터, 10억분의 1m) D램을 만들면 한참 후에 마이크론이 따라왔죠. 그런데 지금보면 격차는 \'반 년\'(6개월)으로 줄었습니다. 이제 이것도 언제 바뀔 지 모르겠습니다.""(실제 삼성전자, SK하이닉스, 마이크론은 3세대 10nm 제품으로 불리는 1z 제품을 양산 중이다)▶미국 정부의 역할도 있었을까요.""메모리반도체 시장이 점점 커지고 있죠. 전체 반도체 시장에서 메모리반도체 비중이 약 15%에서 30%까지 확대됐습니다. 시장 덩치에 걸맞게 미국 정부에서 자국 반도체 업체들에 대한 지원도 늘렸습니다. 도널드 트럼프 행정부가 \'어메리카 그레이트 어게인\'을 부르짖으며 자국 제조업 지원했습니다. 그런 것들도 등에 업고 빠른 속도로 따라온 것입니다.""▶EUV는 D램 시장의 게임체인저가 될까요.""EUV 장비를 D램 생산에 투입하는 건 \'먼저 시장을 차지해서 달려나가겠다\'는 전략이죠. D램은 CPU 등에 비해서 가격이 싸기 때문에 그런 비싼 설비를 쓰는 게 부담스러운 게 사실입니다. 결국 원가싸움인데요, 비싼 장비를 써서 원가가 올라가면 가격경쟁력을 못 맞춥니다. 비싼 EUV 장비를 쓴다는 건 공정 효율을 올려 원가 상승을 상쇄하고도 남을 정도로 남는 메리트가 있기 때문이겠죠.""▶D램 시장은 앞으로 어떻게 보십니까.""예전에 선폭 40nm에서 30nm, 20nm로 갈 땐 금방금방 10nm씩 좁혔죠. 그런데 10nm로 접어들면서 D램에선 1nm 줄이기 어려워지고 있습니다. 마이크론이 D램에서도 삼성전자나 SK하이닉스보다 빨리 풀 수 있느냐, 그건 모르겠습니다. 삼성전자는 지금까지 규모의 우위를 바탕으로 선제적 투자를 해서 수익을 끌어올렸습니다. EUV를 D램에 쓴다는 건 획기적인 변화입니다.  EUV 장비 비싸기 때문에 장비도 비싸지만 그 장비를 유지하고 돌리는 데 돈이 엄청 듭니다. 삼성전자가 치고 나가니까 SK하이닉스도 따라가고 있습니다. 앞으로 큰 변곡점이 될 겁니다.""황 교수는 예전부터 기자에게 ""한국 메모리반도체 업체들과 미국 마이크론, 일본 키옥시아 등의 기술 격차가 점점 좁혀지고 있다""며 ""중국도 낸드플래시는 금방 따라잡을 수 있어 방심하면 안 된다""고 여러차례 얘기했었다. 인터뷰를 정리하며 그는 다시 한 번 ""마이크론이 삼성전자를 따라오는 모습이 D램은 \'세 걸음 뒤에서 반 걸음\'으로 좁혀졌고 낸드는 \'이미 뒤집어 진 것\'""이라고 강조했다.삼성전자, SK하이닉스 등 한국 반도체 기업들이 현재 세계 D램과 낸드플래시 시장에서 높은 점유율을 유지하고 있다고해서 마냥 안심하고 있을 상황이 아니라는 지적이 나오는 이유다. 삼성전자가 어려운 경영 환경에도 매년 20~30조원을 경기 평택 반도체 라인 등에 투자하고 SK하이닉스가 10조원을 들여 인텔 낸드사업부를 인수하는 것도 다 이유가 있는 것이다.황정수 기자 hjs@hankyung.com▶ 애플·테슬라 지금 사도 될까? 궁금하면 \'해주라\'▶ 네이버에서 한국경제 뉴스를 받아보세요▶ 모바일한경 구독신청 ⓒ 한국경제 & hankyung.com, 무단전재 및 재배포 금지한국경제 관련뉴스해당 언론사에서 선정하며 언론사 페이지(아웃링크)로 이동해 볼 수 있습니다.""4억씩 내려도 안 온다""…과천에 무슨 일이""지지율 아무리 올라도…"" 이재명 탈당설 이유韓서 천덕꾸러기 취급받더니… 테슬라가 \'인정\'\'659억원 로또 당첨\' 슈퍼카 즐기던 청년, 근황진중권 ""유시민, 무식한 소리…사기치지 마라""좋아요0훈훈해요0슬퍼요0화나요0후속기사 원해요0기사제공 :']"
