,회사명,날짜,언론사,기사제목,링크,본문
3,삼성전자, 2020-03-0916:40,서울경제 ,"[마감시황]외국인, 일간 역대 최대 1.3조 팔아치워···코스피 4.2% 하락",https://finance.naver.com/news/news_read.nhn?article_id=0003706864&office_id=011&mode=search&query=삼성전자&page=3,"['       [마감시황]외국인, 일간 역대 최대 1.3조 팔아치워···코스피 4.2% 하락      기사입력2020-03-09 16:40기사원문좋아요훈훈해요좋아요 평가하기공감좋아요0훈훈해요0슬퍼요0화나요0후속기사 원해요0댓글외국인 집계 이후 하루 최대 순매도 기록코스닥도 외국인·기관 매도에 4%대 급락[서울경제] 신종 코로나바이러스 감염증(코로나19)의 확산 우려로 9일 국내 증시가 4% 넘게 폭락했다. 유가증권시장에서는 외국인이 국내 주식을 1조3,000억원 넘게 팔아치우며 일간 기준 역대 최대 순매도액을 기록했다. 이날 코스피는 전 거래일보다 4.19%(85.45포인트) 내린 1,954.77포인트로 마감했다. 이는 종가기준으로 2019년 8월 29일(1,933.41포인트) 이후 최저 수준이다.지수는 전장보다 2.90%(59.20포인트) 내린 1,981.02포인트에서 출발해 낙폭을 키웠다. 장중 한때는 증권가가 하방 지지선으로 여겼던 1,950선이 붕괴되기도 했다.유가증권시장에서 개인이 1조2,744억원을 순매수했으나, 외국인과 기관이 각각 1조3,121억원, 407억원을 순매도했다. 이중 외국인 순매도액 1조3,121억원은 관련 기록 집계를 시작한 지난 1999년 이후 사상 최대 규모다. 외국인의 지난 3일간 누적 순매도 금액은 2조235억원에 달했다. 반면 개인은 1조2,752억원어치를 순매수하며 외국인과는 반대로 2011년 8월 10일(1조5,559억원) 이후 8년 7개월 만의 하루 최대 순매수를 기록했다. 코로나19의 글로벌 확산에 따른 우려로 투자심리가 급격히 위축됨에 따라 외국인이 매물을 쏟아내는 가운데 개인은 ‘사자’를 이어가면서 지수를 지탱하고 있는 모습이다. 특히 이날은 지수가 4.2% 폭락해 1,960선 아래로 떨어지면서 향후 주가 반등을 노린 개인 투자자들이 대거 저가매수에 들어간 것으로 풀이된다.시가총액 상위 10개 종목 모두 하락 마감했다. 특히 삼성전자(-4.07%), SK하이닉스(-6.16%), 네이버(-6.41%), LG화학(-6.50%), 셀트리온(-1.97%), 현대차(-5.88%), 삼성SDI(-6.79%), 삼성물산(-4.17%) 등 대부분이 내렸고, 삼성바이오로직스(0.61%)만 올랐다. 코스닥지수는 전 거래일보다 4.38%(28.12포인트) 내린 614.60으로 종료했다. 지수는 전장보다 1.80%(11.59포인트) 내린 631.13으로 개장해 우하향 곡선을 그렸다.코스닥시장에서는 개인이 2,155억원을 순매수했으나, 외국인과 기관이 각각 1,392억원, 599억원을 순매도했다.한편, 이날 서울 외환시장에서 원달러 환율은 전일 대비 11.9원 오른 달러당 1,204.2원에 거래를 마쳤다./양사록기자 sarok@sedaily.com[서울경제 바로가기]▶ 새로워진 서울경제 모바일을 만나보세요.▶ 네이버 채널에서 \'서울경제\' 구독해주세요!저작권자 ⓒ 서울경제, 무단 전재 및 재배포 금지서울경제 관련뉴스해당 언론사에서 선정하며 언론사 페이지(아웃링크)로 이동해 볼 수 있습니다.\'부산 남구을 전략공천\' 이언주 ""文정권 심판 선봉···\'보수의 여전사\' 굉장히 좋은 평가""김희선 \'일상이 화보\' 봄 오기 전에 미모가 꽃폈네 ""눈을 뗄 수 없어""\'양산을 컷오프\' 홍준표 ""공천이 아닌 \'막천\'···정치 이전에 인간이 할 도리가 아냐""[전문]홍진영, 요염한 자태(?) 포즈에 한번·의상에 두번 반해버렸네대구 주택 화재로 30대 남성 사망···범인은 술취한 60대 아버지좋아요0훈훈해요0슬퍼요0화나요0후속기사 원해요0기사제공 :']"
4,삼성전자, 2020-03-0916:34,연합뉴스 ,"코스피, '코로나19 팬데믹 공포'에 4% 폭락…1,960도 붕괴(종합)",https://finance.naver.com/news/news_read.nhn?article_id=0011459891&office_id=001&mode=search&query=삼성전자&page=3,"['       코스피, \'코로나19 팬데믹 공포\'에 4% 폭락…1,960도 붕괴(종합)      기사입력2020-03-09 16:34기사원문좋아요훈훈해요좋아요 평가하기공감좋아요0훈훈해요0슬퍼요0화나요0후속기사 원해요0댓글 외국인, 코스피 1.3조 팔아 역대 최대코스피 급락 (PG)[제작 최자윤] 일러스트(서울=연합뉴스) 김기훈 기자 = 신종코로나 바이러스 감염증(코로나19) 팬데믹(세계적 대유행) 공포가 다시 부각하며 코스피가 9일 4% 넘게 폭락했다.    이날 코스피는 전 거래일보다 85.45포인트(4.19%) 내린 1,954.77로 마감했다.    이는 종가기준으로 2019년 8월 29일(1,933.41) 이후 6개월여 만에 최저 수준이다.    지수는 전장보다 59.20포인트(2.90%) 내린 1,981.02에서 출발해 낙폭을 키웠다. 장 한때 1,950선이 붕괴해 1,946.90까지 하락했다.    이날 코스피는 지난 2018년 10월 11일(-98.94포인트·-4.44%) 이후 1년 5개월 만에 최대 낙폭을 기록했다.    유가증권시장에서 외국인은 1조3천122억원, 기관은 430억원을 순매도했다. 개인은 1조2천765억원을 순매도했다.    이날 외국인 순매도액은 1999년 거래소가 일별 순매도액을 집계한 이후 최대를 기록했다.    증시에서는 미국과 유럽을 중심으로 코로나19 확진자가 급증하며 팬데믹 공포가 다시 부상하고 있다.    서상영 키움증권 연구원은 ""미국과 유럽의 코로나19 확진자 수 급증에 따른 우려가 부각하며 지수가 급락했다""며 ""특히 미국 내 확진자 수는 급증할 여지가 있어 주목할 필요가 있다""고 지적했다.    이어 서 연구원은 ""나아가 국제유가가 급락하면서 금융시장의 변동성이 커진 점도 투자심리 위축 요인으로 작용했다""고 분석했다.    한편 중앙방역대책본부는 이날 0시 기준 국내 코로나19 확진자가 전날(8일) 0시에 비해 248명 증가했다고 밝혔다. 하루 동안 발생한 신규 확진자가 200명대로 떨어진 건 지난달 26일 이후 12일 만이다.    하지만 미국과 유럽을 중심으로 코로나19 확진자가 급증하며 팬데믹 공포도 다시 부상하고 있다.    시가총액 상위 종목 가운데 삼성바이오로직스(0.61%)만 올랐다.    삼성전자(-4.07%), SK하이닉스(-6.16%), 네이버(NAVER)(-6.41%), LG화학(-6.50%), 현대차(-5.88%), 셀트리온(-1.97%), 삼성SDI(-6.79%), 삼성물산(-4.17%), LG생활건강(-2.57%) 등은 모두 내렸다.     업종별로는 의료정밀(-6.06%), 운송장비(-5.89%), 은행(-5.52%) 등 대부분이 약세였고 전기가스업(5.14%)만 강세였다.    주가가 오른 종목은 33개, 내린 종목은 866개였다. 보합은 5개 종목이었다.    프로그램 매매는 차익거래와 비차익거래 모두 매도 우위로 전체적으로는 4천709억원의 순매도로 집계됐다.    유가증권시장의 거래량은 6억1천17만주, 거래대금은 8조6천679억원이었다.    코스닥지수는 전 거래일보다 28.12포인트(4.38%) 내린 614.60으로 종료했다.     지수는 전장보다 11.59포인트(1.80%) 내린 631.13으로 개장해 우하향 곡선을 그렸다.    코스닥시장에서는 외국인과 기관이 각각 1천392억원, 426억원을 순매도했다. 개인이 2천161억원을 순매수했다.    이날 낙폭은 포인트 기준으로 지난달 24일(-28.70포인트) 이후 최대이고, 하락률은 지난해 8월 5일(-7.46%) 이후 최대다.    종가 기준으로 코스닥 지수는 지난달 28일(610.73) 이후 최저 수준이다.    시총 상위주 중에는 셀트리온헬스케어(-1.18%), 에이치엘비(-7.42%), CJ ENM(-6.87%), 펄어비스(-5.28%), 스튜디오드래곤(-3.37%), 케이엠더블유(-5.05%), 에코프로비엠(-7.30%), SK머티리얼즈(-3.21%) 등이 내렸다.    코로나19 진단키트 제조업체 씨젠(29.89%)은 상한가를 기록하며 시총 10위권에 이름을 올렸다.    코스닥시장의 거래량은 12억4천7만주, 거래대금은 8억3천210억원 수준이었다.    서울 외환시장에서 원/달러 환율은 전날보다 달러당 11.9원 오른 1,204.2원에 마감했다.    kihun@yna.co.kr▶ 코로나19 속보 확인은 네이버 연합뉴스에서 [구독 클릭]▶ 프리미엄 북한뉴스 [한반도&] 구독(클릭)▶제보하기연합뉴스 관련뉴스해당 언론사에서 선정하며 언론사 페이지(아웃링크)로 이동해 볼 수 있습니다.\xa0신천지 ""서울시가 법인 취소한다고 신천지 해체안돼""\xa0격리호텔 온 \'위로 떡볶이 100인분\'…하나로 뭉친 재중 한인들\xa0日 도착 한국인 ""대중교통 이용"" 답변했다 저지당해\xa0미 당국자 \'왜 한국만큼 검사못하냐\' 질문에…\xa0치료제 없는 코로나19, \'이것\'으로 잡는다좋아요0훈훈해요0슬퍼요0화나요0후속기사 원해요0기사제공 :']"
5,삼성전자, 2020-03-0916:27,파이낸셜뉴스 ,"[fn마감시황] 코스피·코스닥 4%대 급락..""외국인 사상최대 순매도""",https://finance.naver.com/news/news_read.nhn?article_id=0004386517&office_id=014&mode=search&query=삼성전자&page=3,"['       [fn마감시황] 코스피·코스닥 4%대 급락..""외국인 사상최대 순매도""      기사입력2020-03-09 16:27기사원문좋아요훈훈해요좋아요 평가하기공감좋아요0훈훈해요0슬퍼요0화나요0후속기사 원해요0댓글외국인\xa01조3122억원\xa0매도..""사상\xa0최대"" 코스피.코스닥지수 (사진=한국거래소) [파이낸셜뉴스] 국내 증시가 코로나19로 인한 판데믹(세계적 대유행) 공포와 유가 급락으로 4%대 하락률을 기록했다. 특히 외국인이 사상최대 규모로 순매도하면서 주가 하락을 견인했다.   9일 한국거래소에 따르면 이날 코스피는 전거래일 대비 85.45포인트(4.19%) 하락한 1954.77로 장을 마감했다. 코스피가 4% 넘게 떨어진 건 2018년 10월 11일 이후 처음이다.   코스피는 전거래일 대비 2.90% 떨어진 1981.02로 개장한 후 낙폭을 점차 키웠다. 특히 외국인이 사상 최대 규모인 1조3125억원의 순매도 우위를 보이며 지수를 강하게 끌어내렸다. 이는 한국거래소가 전산 데이터를 보관하고 있는 1999년 이후 최대 순매도 금액이다. 종전 역대 최대치는 2010년 11월 11일 도이치옵션 사태 당시 1조 3094억원이다.   이날 개미들(개인 투자자)도 1조2799억원을 순매수했다. 이는 역대 두 번째로 큰 순매수 금액이다.   업종별로는 의료정밀(-6.06%), 운수장비(-5.89%), 건설업(-5.27%) 등에서 큰폭으로 하락했다. 시가총액 상위 종목인 삼성전자(-4.07%)와 SK하이닉스(-6.16%)를 비롯 NAVER(-6.41%), LG화학(-6.50%), 삼성SDI(-6.79%) 등도 급락했다.   코스닥은 전 거래일대비 28.12포인트(-4.38%) 빠진 614.60에 장을 마감했다. 코스피와 마찬가지로 개인만 순매수세를 유지했고, 기관과 외국인은 매도하며 주가하락을 견인했다.   서상영 키움증권 연구원은 ""한국 증시는 미국과 유럽에서의 코로나 확진자 수 급증에 대한 우려가 부각돼 하락했다""며 ""더 나아가 국제유가 급락 등 금융시장 변동성 확대는 투자심리 위축 요인""이라고 풀이했다.    nvcess@fnnews.com 이정은 기자   ▶ 헉! 소리나는 스!토리 뉴스 [헉스]▶ 클릭해, 뉴스 들어간다 [뉴스쿨]   ※ 저작권자 ⓒ 파이낸셜뉴스. 무단 전재-재배포 금지파이낸셜뉴스 관련뉴스해당 언론사에서 선정하며 언론사 페이지(아웃링크)로 이동해 볼 수 있습니다.""이만희 지시로 한나라당 수천명 입당, 신천지 현금만..""""이재명은 신천지. 자기 명단 없애려.."" 여성이 남긴 댓글 보니조합원만 따로 마스크 판매한 농협, 1장당 가격이..\'윤석열 고발\' 시민, 뜻밖의 고백 ""추미애 장관의 요청에..""하천서 발견된 20대 남성 시신, 신고한 사람은..좋아요0훈훈해요0슬퍼요0화나요0후속기사 원해요0기사제공 :']"
6,삼성전자, 2020-03-0916:24,조선비즈 ,"[마켓뷰] 코스피, 코로나 팬데믹 공포에 1960선 뚫려",https://finance.naver.com/news/news_read.nhn?article_id=0000483805&office_id=366&mode=search&query=삼성전자&page=3,"['       [마켓뷰] 코스피, 코로나 팬데믹 공포에 1960선 뚫려      기사입력2020-03-09 16:24기사원문좋아요훈훈해요좋아요 평가하기공감좋아요0훈훈해요0슬퍼요0화나요0후속기사 원해요0댓글 우한 코로나(코로나19) ‘팬데믹(세계적 대유행) 공포’로 한국 증시가 급락했다. 9일 코스피지수는 4% 넘게 하락하며 1950선으로 후퇴했다. 1960선이 무너진 건 지난해 8월 29일 이후 처음이다.이날 코스피지수는 전 거래일 대비 85.45포인트(4.19%) 내린 1954.77로 장을 마쳤다. 외국인은 이날 1조3122억원을 순매도했다. 외국인 순매도 규모로는 역대 최대치다. 기존 역대 최대치는 2010년 11월 11일 1조3099억원이었다. 외국인은 최근 한달간 유가증권시장에서 총 7조980억원을 팔았다. 코스피가 전 거래일보다 85.45포인트(4.19%) 내린 1954.77로 마감한 9일 오후 서울 명동 하나은행 딜링룸에서 직원이 업무를 보고 있다. /연합뉴스한국거래소에 따르면 이날 외국인은 유가증권시장에서 5397억원에 달하는 삼성전자(005930)물량을 시장에 쏟아냈다. 그다음 SK하이닉스(000660)·삼성전자우(005935)·LG화학(051910)·NAVER(035420)·현대차(005380)·삼성SDI(006400)·POSCO(005490)·SK이노베이션(096770)·카카오(035720)순으로 순매도했다. 한진칼(180640)은 334억원어치 사들였다. 삼성바이오로직스(207940)와 일진머티리얼즈(020150)등도 각각 75억원, 63억원어치 순매수했다. 이경민 대신증권 연구원은 ""외국인이 SK하이닉스를 10거래일 연속 순매도하는 등 시가총액 상위 종목을 집중 매도하며 증시 하락을 주도했다""고 말했다.개인은 1조2754억원을 순매수했다. 증시가 연일 하락하자 저점 매수에 나선 것으로 보인다. 이날 유가증권시장에서 개인은 ‘대장주’ 위주로 많이 사들였다. 개인은 삼성전자를 5275억원어치 사들이며 가장 많이 순매수했다. 그다음으로 SK하이닉스(1545억원)·LG화학(685억원)·삼성전자우(592억원)·삼성SDI(492억원)·삼성중공업(010140)(398억원)·한국조선해양(361억원)·POSCO(312억원)·삼성전기(009150)(310억원)·NAVER(242억원) 순이었다. 코스닥지수는 전거래일 대비 28.12포인트(4.38%) 내린 614.60으로 장을 종료했다. 개인이 2161억원 사들였지만 외국인과 기관은 각각 1392억원, 607억원어치 물량을 시장에 쏟아냈다.앞서 지난 7일(현지 시각) 뉴욕증시는 1% 이상 하락했다. 뉴욕증시의 3대 지수는 장중 한때 3% 넘게 폭락했다가 장 막판 낙폭을 줄이며 거래를 마쳤다. 유럽 주요국 증시는 3~4% 하락했다. 이 연구원은 ""지난주 미 증시는 도널드 트럼프 대통령의 긴급 예산안 서명에도 불구하고 펜데믹 공포심리가 극대화하며 주요 지수가 일제히 하락했다""고 했다.우한 코로나 사태로 투자심리가 위축된 상황에서 주요 산유국들의 추가 감산 합의까지 불발되며 원유 가격이 급락했다. 지난 6일(현지 시각) 뉴욕상업거래소(NYMEX)에서 4월 인도분 서부 텍사스산 원유(WTI)는 배럴당 10.1%(4.62달러) 떨어진 41.28달러에 거래를 마쳤다. 이는 2016년 8월 이후 최저치이며 2014년 11월 28일 이후 최대 하루 낙폭이다.[이다비 기자 dabee@chosunbiz.com][조선비즈 창간 10주년 기획 \'남극은 전쟁 중\' 기사 보러가기][네이버 메인에서 조선비즈 받아보기][조선비즈 바로가기] chosunbiz.com 조선비즈 관련뉴스해당 언론사에서 선정하며 언론사 페이지(아웃링크)로 이동해 볼 수 있습니다.[비즈톡톡] 정부 마스크 대책, 연이어 뒷북 치는 이유는을지면옥 ""철거 동의한 적 없어… 서울시, 고를것 없는 선택지 내밀어""""中企 면세점만 임대료 인하? 대기업도 낮춰달라"" 협력사의 호소올해 산 주식 벌써 15조… 개미들, 코로나 끝나면 웃는다?[단독] 마스크 원자재 \'탈중국\'… 터키·인도産 필터 샘플검사좋아요0훈훈해요0슬퍼요0화나요0후속기사 원해요0기사제공 :']"
7,삼성전자, 2020-03-0916:20,한국경제 ,"아시아 금융시장 '블랙먼데이'…코스피, 外人 1조3000억원 팔자에 4% 폭락[종...",https://finance.naver.com/news/news_read.nhn?article_id=0004303580&office_id=015&mode=search&query=삼성전자&page=3,"['       아시아 금융시장 \'블랙먼데이\'…코스피, 外人 1조3000억원 팔자에 4% 폭락[종합]      기사입력2020-03-09 16:20기사원문좋아요훈훈해요좋아요 평가하기공감좋아요0훈훈해요0슬퍼요0화나요0후속기사 원해요0댓글美·유럽 코로나19 확산에 유가 폭락까지외국인 순매도 규모 9년만에 최대사진=한국거래소.한국을 포함한 아시아 금융시장이 \'블랙먼데이\'를 맞았다. 신종 코로나바이러스 감염증(코로나19) 확진자가 늘면서 팬데믹(세계적 대유행) 우려가 커지고 국제유가도 급락하면서 투자심리가 얼어붙었다.◆코스피, 1년5개월 만에 최대 낙폭 기록9일 코스피지수는 전거래일보다 85.45포인트(4.19%) 급락한 1954.77에 장을 마쳤다. 4%대 폭락으로 코스피는 여러가지 최악의 기록들을 다시 썼다.코스피가 1950선에서 마감한 건 미중 무역분쟁 우려가 컸던 지난해 8월29일(종가 1933.41) 이후 약 7개월여 만이다. 이날 코스피지수의 낙폭은 2018년 10월11일 4.44% 이후 1년5개월 만에 최대다.지수 하락을 이끈 건 외국인과 기관이었다. 특히 외국인은 유가증권시장에서 1조원 넘게 팔아치우며 위축된 투자심리를 고스란히 드러냈다. 이날 외국인은 1조3122억원 순매도했다. 이는 2011년 8월10일(1조2759억원) 이후 약 9년 만의 최대 매도폭이다. 기관도 415억원 순매도했다. 개인은 1조2751억원을 순매수했다.시가총액 상위 종목은 대부분 울상이었다. 대장주 삼성전자는 4% 넘게 하락했다. SK하이닉스 네이버 LG화학 현대차 삼성SDI 포스코 등은 5~6% 급락했다. 국제 유가 급락에 정유주와 조선주가 하락했다. S-Oil SK이노베이션이 8~9% 급락했다. 현대미포조선 삼성중공업은 10~12% 폭락했다.중소형주 중심의 코스닥도 하락했다. 전날보다 28.12포인트(4.38%) 내린 614.60에 거래를 마쳤다. 지난 달 28일 이후 6거래일만에 다시 610선으로 주저앉은 것이다. 외국인 기관이 각각 1393억원 605억원 순매도했고 개인은 2161억원 순매수했다.◆일본 닛케이, 중국 상해지수도 급락국내 증시 뿐 아니라 중국과 일본 등 아시아 증시도 패닉이었다. 오후 2시40분 현재 중국 상하이종합지수는 낙폭을 키워 2.9% 내린 2940선에서 거래 중이고, 홍콩 항셍지수는 3.5% 내린 2만5231.37을 기록하고 있다.일본 도쿄증시는 급락 마감했다. 닛케이225지수는 전 거래일 대비 5.07% 폭락한 1만9698.76에 장을 마쳤다. 닛케이지수가 장중 2만선 밑으로 떨어진 건 지난해 1월7일 이후 1년2개월 만이다.시장 참가자들의 안전자산 선호 심리가 강화되면서 원·달러 환율은 12원 가까이 급등했다. 안전자산인 미 달러화가 강세를 보이고 상대적 위험자산인 원화가 약세를 보인 것이다. 서울 외환시장에서 원·달러 환율은 전 거래일보다 11.9원 오른 1204.20원에 마감했다. 지난 달 28일 이후 6거래일 만에 1200원선에 재진입했다.박상현 하이투자증권 연구원은 ""코로나19 확산에 이은 유가 급락으로 글로벌 금융시장이 극심한 혼돈 양상을 보여줬다""며 ""유가를 둘러싼 치킨게임은 글로벌 신용 위험을 높이고 금융시장에도 큰 위험이 될 수 있다""고 전망했다.박 연구원은 ""미국과 유럽에서의 코로나19 확산 우려가 커지는 점도 문제""라며 ""미국, 유럽의 신규 확진자 수가 당분간 글로벌 경기와 금융시장 흐름의 주요 잣대 역할을 할 것""이라고 말했다.채선희/차은지 한경닷컴 기자 csun00@hankyung.com▶ 네이버에서 한국경제 뉴스를 받아보세요▶ 한경닷컴 바로가기  ▶ 모바일한경 구독신청 ⓒ 한국경제 & hankyung.com, 무단전재 및 재배포 금지한국경제 관련뉴스해당 언론사에서 선정하며 언론사 페이지(아웃링크)로 이동해 볼 수 있습니다.집값 폭락 신호?…충격 몰고 올 시그널 포착""신천지 신도 3~5명씩…"" 충격 휩싸인 시민들""한국인 없다""는 일본행 여객기엔…""이게 무슨 공적 마스크냐""…몰랐던 사실 \'충격\'\'日특허\' 코로나 차단 목걸이 주성분이…발칵좋아요0훈훈해요0슬퍼요0화나요0후속기사 원해요0기사제공 :']"
