,회사명,날짜,언론사,기사제목,링크,본문
7,삼성전자, 2020-03-0914:23,여성신문 ,국내 200대 상장사 여성 등기임원 2.7% 그쳐…이부진·김선희·한성숙 뿐,https://finance.naver.com/news/news_read.nhn?article_id=0000077181&office_id=310&mode=search&query=삼성전자&page=5,"['       국내 200대 상장사 여성 등기임원 2.7% 그쳐…이부진·김선희·한성숙 뿐      기사입력2020-03-09 14:23기사원문좋아요훈훈해요좋아요 평가하기공감좋아요0훈훈해요0슬퍼요0화나요0후속기사 원해요0댓글美 포브스 미국 200대 기업(28.4%) 대비 국내 200대 기업과 약 8배 이상 격차168개사, 여성 등기 임원 0ⓒCEO스코어·뉴시스국내 200대 상장사의 등기임원 중 여성 임원은 100명 가운데 3명에 불과한 것으로 나타났다. 미국 200대 기업의 등기임원은 4명 중 1명인 것과 비교하면 턱없이 모자란 수준이다.8일 세계 여성의 날을 맞아 기업 경영성과 평가사이트 CEO스코어가 조사한 결과에 따르면 지난해 9월 말 기준 국내 200대 상장사의 등기임원 1444명 중 여성은 39명으로 전체 2.7%로 집계된 것으로 나타났다. 반면 미국 200대 기업의 등기임원 2410명 중 여성 등기임원 비중은 28.4%(684명)으로 약8배 이상 차이가 났다.국내 200대 상장사 중 여성 등기임원이 단 1명도 없는 기업은 168개사로 전체 84%를 차지했다. 나머지 32개사(16%)도 여성 등기임원이 3명 이상인 곳은 공기업 한국지역난방공사가 유일했다. 기업 중에는 삼성전자 등 5개사가 2명, 나머지 26개사는 각 1명이었다. 이같은 한국 여성 임원 수는 200대 기업 모두 여성 등기임원을 1명 이상 둔 미국에 비해 크게 뒤처진 결과다.여성 대표이사도 미국과 차이가 컸다. 국내 등기임원 중 여성 대표이사는 이부진 호텔신라 사장과 김선희 매일유업 사장, 한성숙 네이버 사장 등 3명이다. 이 중 이 사장과 김 사장 등 오너 일가를 제외하면 여성 CEO는 한성숙 사장이 유일하다.하지만 미국은 9개 업종에 12명 여성 대표이사가 맹활약하고 있다. 자동차,에너지,철강 등 업종에서도 메리 바라 제너럴모터스 회장, 린 굿 듀크에너지 회장 등 여성 최고경영자가 활동 중이다.유럽연합(EU)이 올해까지 이사회 여성 비율을 40%까지 높이도록 권고하는 상황에서 국내 기업은 이러한 흐름을 따라가기는커녕 한자릿 수를 넘지 못해 역부족이란 평가다.더구나 국내 자산총액 2조원 이상 상장사는 여성 등기임원을 최소 1명 이상 의무화한 자본시장법 개정안이 지난달 국회를 통과해 오는 8월 시행을 앞두고 있으나 기업이 위반해도 이행을 강제하는 수단이 무용지물이라는 지적이 나오고 있다.[여신 후원자 되기]조혜승 기자 chohs1021@womennews.co.kr▶ 여성신문 후원자가 되주세요▶ 여성신문 \'홈페이지\'▶ 기사제보, 투고<Copyright ⓒ 여성신문. 무단전재 및 재배포 금지>여성신문 관련뉴스해당 언론사에서 선정하며 언론사 페이지(아웃링크)로 이동해 볼 수 있습니다.10세 이하, 80세 이상\xa0마스크 대리구매 허용... 주민등록등본 챙겨야세계 여성의 날 \'여성의당\' 닻 올렸다… ""남성 중심 정치는 가라""[신지예의 W정치 인사이드] \'스토킹 범죄\' 공약 \'반의사불벌죄\' 모든 당 그대로[『김지은입니다』를 읽고] 재난 속에 쓰고 보내온 연대의 편지2030 여성들, 커뮤니티-네트워킹에 빠지다좋아요0훈훈해요0슬퍼요0화나요0후속기사 원해요0기사제공 :']"
8,삼성전자, 2020-03-0914:23,파이낸셜뉴스 ,"[fn오후시황] 코스피, 코로나19 우려에 1950선 추락..4.17%↓",https://finance.naver.com/news/news_read.nhn?article_id=0004386390&office_id=014&mode=search&query=삼성전자&page=5,"['       [fn오후시황] 코스피, 코로나19 우려에 1950선 추락..4.17%↓      기사입력2020-03-09 14:23기사원문좋아요훈훈해요좋아요 평가하기공감좋아요0훈훈해요0슬퍼요0화나요0후속기사 원해요0댓글   [파이낸셜뉴스] 코스피가 코로나19의 전세계적인 확산 공포에 힘입어 큰폭으로 떨어졌다.   9일 오후 2시 18분 코스피는 전거래일 대비 4.17% 하락한 1955.18을 기록하고 있다.   이날 코스피는 전거래일 대비 2.90% 떨어진 1981.02로 개장한 후 낙폭을 점차 키워갔다.   개인은 1조1811억원을 \'나홀로\' 순매수하고 있는 반면, 외국인과 기관이 각각 1조730억원, 1675억원 순매도하며 지수를 끌어내렸다.   규모별로 대형주(-4.19%), 중형주(-3.87%), 소형주(-3.86%) 모두 떨어졌다. 업종별로 의료정밀(-6.55%), 섬유의복(-5.06%), 철강금속(-4.90%) 등이 하락했다. 반면 전기가스업(5.35%)은 홀로 상승했다.   시가총액 상위종목별로 삼성전자(-4.25%), SK하이닉스(-5.83%), NAVER(-5.85%) 등이 하락세다. 반면 삼성바이오로직스(0.10%), 한국전력(8.06%) 등은 상승세다.   코스닥은 전거래일 대비 3.95% 떨어진 617.35을 기록하고 있다. 투자자별로 개인은 1897억원을 순매수하고 있는 반면, 외국인과 기관이 각각 1317억원, 490억원 순매도 중이다.   코스닥 시가총액 1위인 셀트리온헬스케어(1.33%)는 오르고 있는 반면 에이치엘비(-6.40%), CJ ENM(-6.23%), 펄어비스(-5.45%) 등은 큰폭의 하락세를 보이고 있다.   서상영 키움증권 연구원은 ""한국 증시는 미국과 유럽에서의 코로나 확진자 수 급증에 대한 우려가 부각되며 하락 중""이라며 ""더 나아가 국제유가가 30% 급락하며 30달러를 하회하는 등 금융시장 변동성 확대는 투자심리 위축 요인""이라고 풀이했다.    nvcess@fnnews.com 이정은 기자   ▶ 헉! 소리나는 스!토리 뉴스 [헉스]▶ 클릭해, 뉴스 들어간다 [뉴스쿨]   ※ 저작권자 ⓒ 파이낸셜뉴스. 무단 전재-재배포 금지파이낸셜뉴스 관련뉴스해당 언론사에서 선정하며 언론사 페이지(아웃링크)로 이동해 볼 수 있습니다.""이만희 지시로 한나라당 수천명 입당, 신천지 현금만..""\'윤석열 고발\' 시민, 뜻밖의 고백 ""추미애 장관의 요청에..""조합원만 따로 마스크 판매한 농협, 1장당 가격이..하천서 발견된 20대 남성 시신, 신고한 사람은..진중권, 이낙연에 의미심장한 한마디 ""친문한테 묻어가려고..""좋아요0훈훈해요0슬퍼요0화나요0후속기사 원해요0기사제공 :']"
9,삼성전자, 2020-03-0914:20,머니S ,"[시황] '블랙 먼데이' 코스피, 코로나19·국제유가 폭락에 4% 하락",https://finance.naver.com/news/news_read.nhn?article_id=0000515289&office_id=417&mode=search&query=삼성전자&page=5,"['       [시황] \'블랙 먼데이\' 코스피, 코로나19·국제유가 폭락에 4% 하락      기사입력2020-03-09 14:20기사원문좋아요훈훈해요좋아요 평가하기공감좋아요0훈훈해요0슬퍼요0화나요0후속기사 원해요0댓글/사진=이미지투데이.신종 코로나바이러스감염증(코로나19)이 세계적인 \'팬데믹(대유행)\' 영향과 국제유가 폭락에 국내 증시가 얼어붙었다.9일 오후 2시 2분 현재 코스피 지수는 전 거래일보다 82.66포인트(-4.03%) 하락한 1957.53에 거래 중이다.\xa0특히 외국인 투자자들은 1조원 넘게 매도 행진을 이어가고 있다. 외국인과 기관은 각각 1조437억원, 1713억원을 팔아치우고 있다. 개인은 나홀로 1조1583억원을 순매수 중이다.시가총액 상위 종목에서는 삼성바이오로직스만 홀로 0.20%의 상승세를 보이고 있다. 삼성전자(-4.25%), SK하이닉스(-5.94%), 삼성전자우(-3.37%), NAVER(-6.13%), LG화학(-5.87%), 셀트리온(-0.85%), 현대차(-5.88%), 삼성SDI(-6.64%) 등은 하락세다.\xa0코스닥 지수는 24.18(-3.77%) 내린 618.50에 거래 중이다. 개인은 1805억원을 순매수 중이며 외국인과 기관은 각각1264억원, 456억원을 순매도하고 있다.셀트리온헬스케어(1.63%)와 씨젠(29.89%)은 강세를 보이고 있다. 반면 에이치엘비(-6.07%), CJ ENM(-6.31%), 펄어비스(-5.51%), 스튜데오드래곤(-2.72%), 케이엠더블유(-4.56%), 에코프로비엠(-6.58%) 등은 약세다.\xa0서상영 키움증권 연구원은 ""미국과 이탈리아 등 유럽에서 코로나19 확진자 수가 크게 늘면서 증시 변동성이 확대됐다""며 ""러시아가 석유수출국기구(OPEC)의 감산을 거부해 국제유가 급락이 나타난 점도 투자심리를 위축시킨 것으로 판단된다""고 설명했다.이날 뉴욕증시에서 다우존수30산업평균 선물지수는 4.00%(1032포인트) 하락했다. 안전자산 선호 현상 속에 미국 10년물 국채 수익률도 0.248%포인트 내린 0.519%까지 하락하며 사상 최저치 행진을 이어갔다. 코로나19 확산 우려로\xa0최근 미국 국채 금리는 연일 사상 최저치를 경신해왔다. 코로나19 쇼크로 석유수출국기구(OPEC)와 비회원국 연합체인 OPEC+가 감산 합의에 실패하면서 유가 전면전이 벌어진게 시장을 충격으로 내몰았다는 분석이다. 채권수익률 하락은 채권값 상승을 의미한다.손희연 기자 son90@mt.co.kr▶ 고수들의 재테크 비법 영상▶ 이건희칼럼 ▶ 코로나19 속보 <저작권자 ⓒ \'성공을 꿈꾸는 사람들의 경제 뉴스\' 머니S, 무단전재 및 재배포 금지>머니S 관련뉴스해당 언론사에서 선정하며 언론사 페이지(아웃링크)로 이동해 볼 수 있습니다.뜨겁게 포옹한 홍상수♥김민희… ""여전히 내 사랑""화사, 이사한 집 최초 공개… ""잠수교 울면서 뛰어가""한지혜 남편 누구길래?… ""꽉 잡혀 산다""이시언 ""100만원 기부, 백시언 됐다… 좀 더 낼걸""신천지 \'집단 거주\' 아파트 미스터리… ""35세이하 여성만""좋아요0훈훈해요0슬퍼요0화나요0후속기사 원해요0기사제공 :']"
10,삼성전자, 2020-03-0914:15,한국경제TV ,"""칼로 긁고 불로 지져도 살아남은 갤럭시S20 울트라""",https://finance.naver.com/news/news_read.nhn?article_id=0000854029&office_id=215&mode=search&query=삼성전자&page=5,"['       ""칼로 긁고 불로 지져도 살아남은 갤럭시S20 울트라""      기사입력2020-03-09 14:15기사원문좋아요훈훈해요좋아요 평가하기공감좋아요0훈훈해요0슬퍼요0화나요0후속기사 원해요0댓글[한국경제TV 이지효 기자]출처=유튜브 \'제리릭에브리씽\'삼성전자의 상반기 플래그십 스마트폰 \'갤럭시S20 울트라\'가 유튜버의 혹독한 내구성 테스트를 모두 통과하며 합격점을 받았다.현지시간 8일 유튜브 채널 제리릭에브리씽을 운영하는 잭 넬슨은 갤럭시S20 울트라에 내구성 테스트를 진행한 영상을 게재했다.잭 넬슨은 ""갤럭시S20 울트라는 내구성 테스트에서 살아남았다""며 ""어디에도 균열, 구부러짐, 영구적인 손상이 없다""고 밝혔다.이 영상에서 넬슨은 갤럭시S20 울트라의 디스플레이를 모스 경도계와 칼로 긁고, 라이터를 이용해 화면에 열을 가하는 등의 내구성 테스트를 진행했다.갤럭시S20 울트라는 모스 경도계로 긁었을 때 레벨 6에서 흠집이 생겨났고, 7에서부터는 홈이 파이기 시작했다.모스 경도 6~7 수준은 손톱이나 일상적인 물건으로 긁어도 화면에 긂힘이 생기지 않는다는 것을 의미한다.넬슨에 따르면 플라스틱 소재 디스플레이는 경도 2~3에서, 유리 소재는 5~6에서, 사파이어 글라스는 8~9 수준에서 흠집이 생긴다.앞서 갤럭시Z플립은 초박형 유리를 적용했지만 경도 2에서부터 긁힘이 생기면서 내구성에 대한 지적을 받았다.갤럭시S20 울트라 모델은 전면과 후면에 내구성을 높인 \'고릴라 글라스 6\'을 적용했다.그 결과 후면 카메라를 긁거나, 화면 내장 지문 스캐너가 있는 부분에 흡집을 내도 정상적으로 작동했다는 설명이다.출처=유튜브 \'제리릭에브리씽\'또 화면에 라이터로 열을 가하거나 기기를 구부리는 테스트도 진행했지만 화면에 그을음은 남지 않았으며 기기도 그대로였다.다만 기기 측면은 칼로 긁었을 때 쉽게 긁히고 전원 및 볼륨 버튼이 손상되는 모습을 보여줬다.앞서 미국의 IT전문매체 씨넷은 갤럭시S20 울트라를 3피트(약 91㎝) 및 5피트(152㎝)의 높이에서 여러 차례 떨어뜨리는 등 내구성 테스트를 진행했다.그 결과 디스플레이에는 금이 갔지만 카메라는 파손되지 않았으며, 작동에도 이상이 없었다.유튜브 채널 폰버프의 갤럭시S20 울트라와 아이폰11 프로맥스 낙하 테스트 결과에서도 갤럭시S20 울트라가 보다 견고한 모습을 보였다.출처=유튜브 \'폰버프\'이지효기자 jhlee@wowtv.co.kr▶ 네이버 홈에서 [한국경제TV] 채널 구독하기 [생방송보기]▶ 대한민국 재테크 총집결! - [증권 / 주식상담 / 부동산]ⓒ 한국경제TV, 무단 전재 및 재배포 금지한국경제TV 관련뉴스해당 언론사에서 선정하며 언론사 페이지(아웃링크)로 이동해 볼 수 있습니다.""전국민에 1인당 100만원씩""…김경수 재난기본소득 제안한국인 입국 전면금지한 日 아베, 조기 하야까지[단독] 배달원 마스크 60만장 취소된 사연""약국, 마스크 1장에 400원 남는다""...지오영 특혜설 왜?故 최진실 유족, 재산권 분쟁 중…재산 얼마길래?좋아요0훈훈해요0슬퍼요0화나요0후속기사 원해요0기사제공 :']"
11,삼성전자, 2020-03-0914:09,머니투데이 ,코로나에 화재까지…간밤 화재에 간담 쓸어내린 삼성 반도체,https://finance.naver.com/news/news_read.nhn?article_id=0004372236&office_id=008&mode=search&query=삼성전자&page=5,"['       코로나에 화재까지…간밤 화재에 간담 쓸어내린 삼성 반도체      기사입력2020-03-09 14:09기사원문좋아요훈훈해요좋아요 평가하기공감좋아요0훈훈해요0슬퍼요0화나요0후속기사 원해요0댓글 [머니투데이 심재현 기자] 8일 밤 삼성전자 화성 반도체 공장에서 화재가 발생해 불길이 치솟고 있다. /독자제공=뉴스1삼성전자 화성 반도체 공장에서 한밤중 화재가 발생해 업계가 밤새 바짝 긴장했다. 불이 난 곳이 폐수 탈취를 위한 부대 시설이라서 일단 생산 차질은 없다고 삼성전자는 밝혔다9일 삼성전자와 소방당국에 따르면 전날 밤 11시18분 화성 반도체 공장에서 불길이 치솟았다. 붉은 화염과 검은 연기가 수십미터 위로 솟아오르면서 인근 주민들의 신고가 잇따랐던 것으로 알려졌다.반도체 공장 화재라는 점을 감안해 살수차와 화학차 등 48대가 출동해 화재 발생 2시간30분여만인 이날 새벽 1시50분쯤 진화가 마무리됐다. 소방인력은 140여명이 투입됐다.화재 지점은 반도체 생산과정에서 사용한 뒤 버려지는 폐수의 악취를 처리하는 무인(無人) 시설로 반도체 생산시설에서 상당히 떨어진 것으로 전해졌다. 소방당국은 이 시설의 옥상에 있던 냉각탑에서 화재가 시작된 것으로 보고 조사 중이다.무인시설인 데다 주말 밤중이라 인명 피해는 없었다. 삼성전자는 ""생산시설이 아닌 부대시설이고 대체 시설도 작동하고 있어 생산 차질은 발생하지 않았다""고 밝혔다.화재 소식이 전해지자 업계는 한때 초긴장했다. 삼성전자 반도체 경영진도 긴급보고를 받고 거의 뜬눈으로 밤을 지샌 것으로 전해졌다. 삼성전자 화성사업장 파운드리 생산라인. /사진제공=삼성전자삼성전자 화성 반도체사업장은 주력 반도체 제품인 D램과 낸드플래시뿐 아니라 CIS 이미지센서 등 시스템반도체도 위탁생산하는 곳이다. 특히 파운드리(위탁생산) 사업 면에서는 이재용 삼성전자 부회장이 추진하는 2030년 시스템반도체 세계 1위 달성의 전초기지 격이다.삼성전자는 지난해부터 화성사업장에 최신 공정인 EUV(극자외선) 노광장비를 투입, 3나노(㎚, 1나노는 10억분의 1m) 공정기술을 개발했다. 반도체 제조공정에서 첨단공법인 EUV 장비를 도입한 곳은 삼성전자 외에 전세계 파운드리업계 1위의 대만 TSMC뿐이다.업계 관계자는 ""그나마 생산차질이 없다고 하니 삼성전자에서도 간담을 쓸어내렸을 것""이라며 ""가뜩이나 코로나19 감염증 사태로 방역에 온 신경을 기울이는 와중에 화재 소식까지 들리면서 업계 전반에서 긴장감이 높아질대로 높아졌다""고 말했다.반도체 제조공정은 실리콘웨이퍼 투입부터 완제품 생산까지 한달여 동안 600여개 작업이 순차적으로 이어지기 때문에 공정이 하나라도 차질을 빚으면 다른 공정에도 줄줄이 영향을 미치게 된다. 또 공정 자체가 나노미터 단위에서 이뤄지기 때문에 화재나 정전 등 예상치 못한 사고로 가동이 중단되면 작업 전체를 재설정하는 과정에서 투입됐던 웨이퍼를 대부분 폐기해야 해 피해 규모가 크다.지난해 12월31일에도 화성 반도체 공장에서 전력공급이 1분여 동안 중단되면서 수십억원의 피해가 발생했다. 투입된 웨이퍼를 폐기하고 생산률을 복구하는 데도 2~3일가량이 걸린 것으로 알려졌다.삼성전자 관계자는 ""화재사고와 관련해 정확한 사고 원인 등은 당국에서 조사를 통해 밝혀질 것""이라며 ""사고 수습에 만전을 기하겠다""고 말했다.심재현 기자 urme@mt.co.kr▶줄리아 투자노트▶조 변호사의 가정상담소 ▶머니투데이 구독하기 <저작권자 ⓒ \'돈이 보이는 리얼타임 뉴스\' 머니투데이, 무단전재 및 재배포 금지> 머니투데이 관련뉴스해당 언론사에서 선정하며 언론사 페이지(아웃링크)로 이동해 볼 수 있습니다.국내 확진자 0명일 때, \'이 회사\'는 진단키트 만들었다""왜 한국만큼 검사 못하냐"" 질문에 미 보건당국자 답변은\'코로나19\'에 7억 기부한 육군, 알고보니 ""금액 맞춰오라"" 강요""대구 한마음아파트, 입주 심사 담당자 신천지인지 조사 필요""음주운전 적발 \'면허 취소 수준\'…배우 홍기준 누구?좋아요0훈훈해요0슬퍼요0화나요0후속기사 원해요0기사제공 :']"
12,삼성전자, 2020-03-0913:51,한국경제TV ,전세계 홀린 삼성 '갤럭시Z플립'…20여개국에서 '완판',https://finance.naver.com/news/news_read.nhn?article_id=0000854015&office_id=215&mode=search&query=삼성전자&page=5,"['       전세계 홀린 삼성 \'갤럭시Z플립\'…20여개국에서 \'완판\'      기사입력2020-03-09 13:51기사원문좋아요훈훈해요좋아요 평가하기공감좋아요0훈훈해요0슬퍼요0화나요0후속기사 원해요0댓글[한국경제TV 이지효 기자]삼성전자의 두번째 폴더블 스마트폰인 \'갤럭시Z플립\'이 20여개국에서 완판 행진을 이어가고 있다.9일 삼성전자에 따르면 갤럭시Z플립은 지난달 14일부터 한국을 비롯해 미국, 프랑스, 스페인, 싱가포르 등 전 세계 40여개국에서 출시됐다.초도 물량이 완판된 국가는 한국, 미국, 프랑스, 독일 스페인, 러시아, 아랍에미레이트, 사우디아라비아, 중국, 인도, 일본, 태국, 싱가포르 등 20여개국이다.특히 중국의 경우 1차 판매는 9분 만에, 2차 판매는 30분 만에 모든 물량이 동났다.삼성전자는 오는 11일부터는 브라질에서도 갤럭시Z플립이 판매를 시작한다.브라질에서 정식 출시를 앞두고 삼성전자는 5일부터 전국 10여개 매장에서 갤럭시Z플립 전시를 시작했다.미러 퍼플 모델은 당일 판매가 완료됐으며, 미러 블랙 모델도 대부분이 팔렸다고 삼성전자 측은 밝혔다.한편 국내에서도 6일 삼성전자 홈페이지에 갤럭시Z플립의 추가 물량 판매를 시작했다.이지효기자 jhlee@wowtv.co.kr▶ 네이버 홈에서 [한국경제TV] 채널 구독하기 [생방송보기]▶ 대한민국 재테크 총집결! - [증권 / 주식상담 / 부동산]ⓒ 한국경제TV, 무단 전재 및 재배포 금지한국경제TV 관련뉴스해당 언론사에서 선정하며 언론사 페이지(아웃링크)로 이동해 볼 수 있습니다.""전국민에 1인당 100만원씩""…김경수 재난기본소득 제안한국인 입국 전면금지한 日 아베, 조기 하야까지[단독] 배달원 마스크 60만장 취소된 사연""약국, 마스크 1장에 400원 남는다""...일평균 마진은?故 최진실 유족, 재산권 분쟁 중…재산 얼마길래?좋아요0훈훈해요0슬퍼요0화나요0후속기사 원해요0기사제공 :']"
