,회사명,날짜,언론사,기사제목,링크,본문
3,삼성전자, 2020-03-2509:29,매일경제 ,"코스피, 글로벌 부양정책 기대감에 이틀째 급반등…1700선 턱밑 추격",https://finance.naver.com/news/news_read.nhn?article_id=0004543579&office_id=009&mode=search&query=삼성전자&page=11,"['       코스피, 글로벌 부양정책 기대감에 이틀째 급반등…1700선 턱밑 추격      기사입력2020-03-25 09:29기사원문좋아요훈훈해요좋아요 평가하기공감좋아요0훈훈해요0슬퍼요0화나요0후속기사 원해요0댓글[사진 = 연합뉴스] 코로나19 패닉장에서 600포인트에 가까운 폭락을 겪었던 코스피가 이틀째 강한 반등을 나타내고 있다. 25일 오전 9시 5분 현재 코스피는 전일 대비 86.11포인트(5.35%) 오른 1696.08을 기록 중이다.코로나19가 미국, 유럽 등 전세계적으로 확산하면서 팬데믹 공포가 커지면서 글로벌 증시는 사상 초유의 폭락세를 보였다. 이달초 2100선을 노리던 코스피는 지난 19일 1450선까지 폭락했다. 하지만 각국의 경기 부양을 위한 정책적 대응이 본격화하면서 증시가 패닉장세에서 빠르게 빠져나오는 모습이다. 지난밤 뉴욕증시에서 다우존스 30 산업평균지수는 11.37%, 스탠더드앤드푸어스(S&P) 500 지수는 9.38%, 나스닥 지수도 8.12% 폭등했다. 다우지수는 1933년 약 87년 만에 이후 최대 상승률을 기록했다.코로나19로 인한 글로벌 경기 침체 우려에 맞설 미국 재정부양책의 국회 통과가 임박했다는 소식에 투자심리가 급격히 살아나고 있다. 도널드 트럼프 대통령이 신속한 처리를 촉구해온 가운데 여야는 이르면 이날 오후 최대 2조 달러(약 2500조 원)대에 이르는 법안 처리를 시도할 가능성이 제기된다. 공화당과 스티븐 므누신 재무장관, 민주당은 이날까지 이어진 협상에서 주된 걸림돌이었던 항목에서 의견 일치를 이뤘다. 특히 기업 대출 및 대출 보증을 위해 5000억 달러를 지원하는 방안과 관련, 더 많은 감독 장치를 두는 쪽으로 합의했다. G7 재무장관과 중앙은행 총재들은 지난밤 콘퍼런스콜(전화 회의)을 가진 후 공동성명을 통해 ""일자리와 기업, 금융 시스템을 보호하고 경제 성장과 심리를 회복하기 위해 필요한 모든 조치를 취할 것""이라고 말했다.이어 ""신속한 경제 회복을 돕고, 보다 강력하고 지속가능한 성장의 길을 재개하기 위해 필요한 재정적 노력에 전념하고 있다""면서 ""필요한 기간만큼 확장적 정책을 유지할 것을 약속하고 전방위적 수단을 통해 추가 조치를 취할 준비가 돼 있다""고 강조했다.특히 이들은 산유국들에 글로벌 경제 안정을 위한 국제적인 노력을 지원할 것을 촉구한다고 강조했다. 이는 최근 원유 감산 합의 실패 후 인위적 가격 인하와 증산 등을 통해 \'유가 전쟁\'을 벌이고 있는 사우디아라비아와 러시아를 겨냥한 것으로 풀이된다.이경민 대신증권 연구원은 ""통화정책에 이은 재정정책 확대가 정책 믹스 기대를 높일 수 있어 미국 경기부양법안의 의회 통과 시점이 단기 변곡점이 될 수 있다""라며 ""이번주 목요일 발표 예정인 신규실업수당 청구건수도 주목한다. 현재 시장 컨센서스는 150만건에 달하는데 \'고용 충격=소비 충격=미국 경기침체\'라는 연결고리의 첫 시작""이라고 말했다.이어 ""당분간 글로벌 금융시장은 정책 기대감을 바탕으로 한 정상화와 되돌림 과정이 전개될 전망""이라며 ""글로벌 금융시장의 방향성은 3월말~4월초 이후 좀 더 명확해질 전망인데 현재로서는 추가 하락보다는 상승 가능성을 높게 본다""고 덧붙였다. 업종별로 전업종이 상승하는 가운데 운송장비, 운수창고, 은행, 증권 등이 7~8% 급등하고 있다. 매매주체별로 외국인과 기관이 각각 437억원, 2888억원을 순매도하고 있고 개인은 3333억원을 순매수하고 있다. 프로그램 매매는 1413억원 매도 우위다.시가총액 상위 종목들은 일제히 강세다. 삼성전자, SK하이닉스, LG화학, 삼성SDI, 현대차 등이 3~7% 오르고 있다. 이날 유가증권시장에서는 873개 종목이 상승하고 있고 12개 종목이 하락하고 있다.코스닥은 전일 대비 22.37포인트(4.66%) 오른 502.77을 기록 중이다.[디지털뉴스국 고득관 기자]▶네이버 메인에서 \'매일경제\'를 받아보세요▶뉴스레터 \'매콤달콤\' 구독\xa0▶\'매일경제\' 바로가기[ⓒ 매일경제 & mk.co.kr, 무단전재 및 재배포 금지]매일경제 관련뉴스해당 언론사에서 선정하며 언론사 페이지(아웃링크)로 이동해 볼 수 있습니다.한강하구에 나타난 생명체에 어민들 \'초긴장\'…뭐길래?중국 전문가들 경고 ""코로나19 다음달이면 미국은…""걸그룹 출신 신지수, 레깅스+브라톱 완벽 몸매현대차 \'올 뉴 아반떼\' 가격 공개…1531만원부터혜진이 ""앨범 발매하고 군 부대서 공연…이게 다""좋아요0훈훈해요0슬퍼요0화나요0후속기사 원해요0기사제공 :']"
4,삼성전자, 2020-03-2509:28,SBS Biz ,"반도체주, 외국인 매수에 강세…삼성·SK하이닉스 급등",https://finance.naver.com/news/news_read.nhn?article_id=0000208012&office_id=374&mode=search&query=삼성전자&page=11,"['       반도체주, 외국인 매수에 강세…삼성·SK하이닉스 급등      기사입력2020-03-25 09:28기사원문좋아요훈훈해요좋아요 평가하기공감좋아요0훈훈해요0슬퍼요0화나요0후속기사 원해요0댓글■ 경제와이드 이슈& \'기업 이슈\' 어제(24일) 코스피 1600선을 탈환했습니다.이대로 쭉 올라가주기만 하면 좋을 텐데요.전 장에서 상승, 하락했던 종목들 모아봤습니다.◇ 반도체 관련주반도체 업종이 시장의 반등을 주도했습니다.연준이 무제한 양적완화를 하겠다는 등 긍정적인 소식들이 전해지며, 필라델피아 반도체지수가 현지시간 월요일 3.36% 반등했죠.실적 발표를 앞둔 마이크론테크놀로지를 필두로 인텔, 마이크로칩테크놀로지 등이 동반 강세를 보였습니다.이러한 소식에 외국인 투자가들이 모처럼 코스피 전기전자 업종을 중심으로 매수세를 보였는데요.외국인 사자세에 삼성전자, SK하이닉스가 급등했고 반도체 업종 전반적으로 상승 마감했습니다.◇ 온라인 교육주코로나19 사태로 개학이 연기되자 교육당국이 온라인 개학을 검토하고 있습니다.이 소식에 온라인 교육주가 강세를 보여줬는데요.교육당국에 따르면 교육부와 지역 교육청은 초중고생들의 개학을 더 이상 미루지 못하는 상황에 대비, 학교에 가지 않고 학생들이 수업을 듣는 장기적인 대응책에 대한 협의를 진행하고 있습니다.초중고생을 대상으로 한 온라인 강의는 EBS 플랫폼이 활용될 전망입니다. 한편 유은혜 교육부 장관은 개학 연기와 관련해 확진자 발생 추이와 학교 내 통제 가능성 등 학교의 개학 준비 상황을 판단해 적절한 시점에 최종 결정할 것이라고 밝혔습니다.◇ 전자 결제 관련주지난해 간편 결제·송금 서비스 이용 실적이 50% 급등한 것으로 나타났습니다.한국은행이 24일 발표한 \'2019년 중 전자 지급 서비스 이용 현황\'에 따르면 지난해 카드 기반 간편결제 서비스 이용 실적은 일평균 602만 건으로 전년 대비 56.6% 증가했습니다.이용 금액은 1745억 원으로 44.0% 늘었습니다.아울러 온라인 쇼핑몰을 통한 결제가 늘어나면서 전자 지급 결제대행(PG)은 전년보다 26.2% 증가했습니다.서비스 이용 실적 급증에 따라 관련주 상승 마감했습니다.◇ 한진그룹 관련주한진그룹 경영권 다툼과 관련 반도건설이 한진 칼을 상대로 낸 의결권 행사 허용 가처분 신청에서 법원이 한진 칼의 손을 들어주자 한진 칼 주가가 급락했습니다.앞서 이달 초 반도건설은 주주명부 폐쇄 전에 취득한 한진 칼 주식 485만 2천 주(지분율 8.2%)에 대해 오는 27일 정기 주총에서 의결권을 행사할 수 있도록 허용해달라며 서울중앙지법에 가처분 신청을 냈는데요.한진 칼은 반도건설이 올해 1월에야 주식 보유 목적을 경영참가로 변경한 건 허위공시라고 주장했습니다.법원은 반도건설이 의무를 위반했다고 봤고 반도건설 의결권은 5%로 제한됐는데요.이 소식에 상승세를 보이던 한진 칼이 급락했고 한진 역시 하락 마감했습니다.       ▶ 아침을 여는 뉴스 모닝벨 [#오늘의키워드]▶ 경제를 실험한다~ 머니랩 [네이버TV]저작권자 SBS미디어넷 & SBS I&M 무단전재-재배포 금지SBS Biz 관련뉴스해당 언론사에서 선정하며 언론사 페이지(아웃링크)로 이동해 볼 수 있습니다.목 보호대 찬 조주빈 ""악마의 삶 멈추게 해줘서 감사""트럼프 ""韓 의료 장비 보내달라""…미 수출 기대감 고조한진칼 주총 D-2, 지분율 격차 확대…조원태 승기 잡나""수수료 무료라더니""…유관기관 비용 떠넘긴 증권사들한남3구역 수주전 재과열?…\'마스크 무상제공\' 수사 의뢰좋아요0훈훈해요0슬퍼요0화나요0후속기사 원해요0기사제공 :']"
5,삼성전자, 2020-03-2509:27,연합뉴스 ,"코스피 장중 5.5% 급등…1,690선 회복(종합)",https://finance.naver.com/news/news_read.nhn?article_id=0011496823&office_id=001&mode=search&query=삼성전자&page=11,"['       코스피 장중 5.5% 급등…1,690선 회복(종합)      기사입력2020-03-25 09:27기사원문좋아요훈훈해요좋아요 평가하기공감좋아요0훈훈해요0슬퍼요0화나요0후속기사 원해요0댓글 코스닥은 장중 500선 회복코스피 상승 (PG)[제작 최자윤] 일러스트(서울=연합뉴스) 황재하 기자 = 코스피가 25일도 전날에 이어 급등세로 출발했다.    이날 오전 9시 15분 현재 코스피는 전 거래일보다 64.16포인트(3.99%) 오른 1,674.13을 가리켰다.    지수는 58.22포인트(3.62%) 오른 1,668.19로 출발해 상승세를 이어가고 있다. 장중 한때는 최대 88.05포인트(5.47%) 오른 1,698.02를 기록했다.    유가증권시장에서는 개인이 3천811억원어치를 순매수하며 지수 상승을 이끌고 있다.    전날까지 14거래일 연속 순매도한 외국인은 이날도 424억원을 순매도하고 있고, 기관도 3천385억원을 순매도했다.    간밤 뉴욕증시에서는 다우존스30 산업평균지수(11.37%), 스탠더드앤드푸어스(S&P)500 지수(9.38%), 나스닥 지수 (8.12%)가 일제히 폭등했다.    이는 미국 스티븐 므누신 재무장관과 낸시 펠로시 하원의장(민주당) 등이 미국 정부가 추진 중인 대규모 부양책의 의회 합의가 임박했다는 발언을 내놓은 영향으로 풀이된다.    서상영 키움증권 연구원은 ""미국 재정 지출 합의가 임박했다는 기대가 나오면서 위험자산 선호 심리가 높아진 것으로 보인다""고 설명했다.    이어 ""아시아 시장에서 코로나19 확산 우려가 완화되며 공급망 정상화 가능성이 커진 점도 한국 증시에 긍정적""이라며 ""중국 확진자 증가세가 완만해지면서 중국 내 소비가 증가하고 있다는 언론 보도가 나오는 등 주변 환경이 우호적""이라고 설명했다.    시가총액 상위 종목은 LG화학(9.38%), 삼성SDI(9.13%), 현대차(8.02%), 삼성전자(5.22%), SK하이닉스(4.96%), 삼성물산(4.66%), NAVER(3.53%), 삼성바이오로직스(2.42%), 셀트리온(1.63%), LG생활건강(0.79%) 등 10위 이내 모든 종목이 올랐다.    업종별로도 운수·장비(8.71%), 은행(7.42%), 운수·창고(7.31%), 증권(6.66%), 철강·금속(6.25%), 의료정밀(6.09%), 전기·전자(5.78%) 등 모든 업종이 강세다.    같은 시각 코스닥지수는 전 거래일보다 16.56포인트(3.45%) 오른 496.96을 나타냈다.    지수는 15.92포인트(3.31%) 오른 496.32로 개장해 강세를 이어가고 있다. 장중 한때는 23.25포인트(4.84%) 오른 503.65까지 올라 지난 19일(장중 최고가 502.12) 이후 처음 장중 500선을 회복했다.    코스닥시장에서는 개인이 762억원어치를 순매수했다. 외국인은 373억원, 기관은 406억원을 순매도했다.    시총 상위 종목은 셀트리온제약(21.12%), 씨젠(20.35%)이 급등했고, CJ ENM(6.48%), 휴젤(3.88%), SK머티리얼즈(3.53%), 케이엠더블유(2.97%), 펄어비스(1.99%), 셀트리온헬스케어(1.91%), 스튜디오드래곤(1.64%), 에이치엘비(1.52%) 등도 올랐다.    jaeh@yna.co.kr▶코로나19 속보는 네이버 연합뉴스에서 [구독 클릭]▶[팩트체크] \'변종 코로나19\' 사실은▶제보하기연합뉴스 관련뉴스해당 언론사에서 선정하며 언론사 페이지(아웃링크)로 이동해 볼 수 있습니다.\xa0얼굴 공개 조주빈 ""손석희 사장님…"" 뜬금없는 발언?\xa0""스마트폰만 붙잡고 산다""…고3 담임교사의 한숨\xa0코로나19로 인적 줄자 도심에 퓨마·여우 어슬렁\xa0""n번방 미성년자 영상 있어요.…60만원"" 성착취물 유통\xa0마돈나, 우유 푼 욕조 앉아 ""코로나19가 모두 평등하게""좋아요0훈훈해요0슬퍼요0화나요0후속기사 원해요0기사제공 :']"
6,삼성전자, 2020-03-2509:26,연합뉴스 ,"삼성전자, 브라질 공장 '셧다운' 이어 오프라인 매장도 폐쇄",https://finance.naver.com/news/news_read.nhn?article_id=0011496818&office_id=001&mode=search&query=삼성전자&page=11,"['       삼성전자, 브라질 공장 \'셧다운\' 이어 오프라인 매장도 폐쇄      기사입력2020-03-25 09:26기사원문좋아요훈훈해요좋아요 평가하기공감좋아요0훈훈해요0슬퍼요0화나요0후속기사 원해요0댓글 (서울=연합뉴스) 최재서 기자 = 삼성전자가 브라질 공장 가동을 중단한 데 이어 현지 오프라인 매장도 폐쇄키로 결정했다.    25일 삼성전자 브라질 뉴스룸에 따르면 회사는 24일(현지시간) 신종 코로나바이러스 감염증(코로나19) 확산을 최소화하기 위해 현지 전역의 오프라인 매장을 일시 폐쇄한다고 밝혔다.    이에 따라 제품 판매는 모두 온라인으로 전환하고 현지 상황에 따라 재개 시점을 공지할 계획이다.    앞서 삼성전자는 브라질 북부 아마조나스주 마나우스 공장의 가동을 오는 29일까지 중단한다고 밝힌 바 있다. 코로나19 확산에 따른 선제 조치다.지난 1월 삼성전자 브라질 공장 둘러보는 이재용 [삼성전자 제공. 재판매 및 DB 금지]     삼성전자는 인도 노이다 스마트폰 공장도 사흘간의 폐쇄 지침을 내렸고 유럽 슬로바키아 TV 공장도 29일까지 가동을 중단하기로 한 상황이다.    미국과 캐나다 전역의 오프라인 매장은 이미 지난주부터 폐쇄됐고, 이외 지역에도 정부 지침에 따른 영업 중단 조치가 취해진 것으로 알려졌다.    한편 삼성전자는 휴교령 연장으로 어려움을 겪는 이탈리아 학생들을 위해 온라인 교육에 나서는 등 코로나19를 위한 글로벌 지원 활동도 진행하고 있다.    acui721@yna.co.kr▶코로나19 속보는 네이버 연합뉴스에서 [구독 클릭]▶[팩트체크] \'변종 코로나19\' 사실은▶제보하기연합뉴스 관련뉴스해당 언론사에서 선정하며 언론사 페이지(아웃링크)로 이동해 볼 수 있습니다.\xa0얼굴 공개 조주빈 ""손석희 사장님…"" 뜬금없는 발언?\xa0""스마트폰만 붙잡고 산다""…고3 담임교사의 한숨\xa0코로나19로 인적 줄자 도심에 퓨마·여우 어슬렁\xa0""n번방 미성년자 영상 있어요.…60만원"" 성착취물 유통\xa0마돈나, 우유 푼 욕조 앉아 ""코로나19가 모두 평등하게""좋아요0훈훈해요0슬퍼요0화나요0후속기사 원해요0기사제공 :']"
7,삼성전자, 2020-03-2509:24,연합뉴스 ,"삼성전자, D램에도 EUV 공정 적용…""미세공정 한계 돌파""",https://finance.naver.com/news/news_read.nhn?article_id=0011496806&office_id=001&mode=search&query=삼성전자&page=11,"['       삼성전자, D램에도 EUV 공정 적용…""미세공정 한계 돌파""      기사입력2020-03-25 09:24기사원문좋아요훈훈해요좋아요 평가하기공감좋아요0훈훈해요0슬퍼요0화나요0후속기사 원해요0댓글    (서울=연합뉴스) 삼성전자가 25일 업계 최초로 EUV 공정을 적용, 생산한 1세대 10나노급(1x) DDR4(Double Data Rate 4) D램 모듈 100만개 이상을 공급해 고객 평가를 완료했다고 밝혔다. 2020.3.25 [삼성전자 제공. 재판매 및 DB 금지]    photo@yna.co.kr▶코로나19 속보는 네이버 연합뉴스에서 [구독 클릭]▶[팩트체크] \'변종 코로나19\' 사실은▶제보하기연합뉴스 관련뉴스해당 언론사에서 선정하며 언론사 페이지(아웃링크)로 이동해 볼 수 있습니다.\xa0얼굴 공개 조주빈 ""손석희 사장님…"" 뜬금없는 발언?\xa0""스마트폰만 붙잡고 산다""…고3 담임교사의 한숨\xa0코로나19로 인적 줄자 도심에 퓨마·여우 어슬렁\xa0""n번방 미성년자 영상 있어요.…60만원"" 성착취물 유통\xa0마돈나, 우유 푼 욕조 앉아 ""코로나19가 모두 평등하게""좋아요0훈훈해요0슬퍼요0화나요0후속기사 원해요0기사제공 :']"
8,삼성전자, 2020-03-2509:24,서울경제 ,"삼성전자, D램에 EUV 첫 적용···미세공정 한계 돌파",https://finance.naver.com/news/news_read.nhn?article_id=0003714654&office_id=011&mode=search&query=삼성전자&page=11,"['       삼성전자, D램에 EUV 첫 적용···미세공정 한계 돌파      기사입력2020-03-25 09:24기사원문좋아요훈훈해요좋아요 평가하기공감좋아요0훈훈해요0슬퍼요0화나요0후속기사 원해요0댓글삼성전자 EUV 전용 V1라인 전경. /사진제공=삼성전자[서울경제] 삼성전자가 업계 최초로 D램에 극자외선(EUV) 공정을 적용해 양산 체제를 갖췄다.삼성전자는 EUV 공정을 적용해 생산한 1세대(1x) 10나노급 DDR4 D램 모듈 100만개 이상을 공급해 글로벌 고객의 평가를 완료했다고 25일 밝혔다. 이로써 삼성전자는 메모리 업계 최초로 차세대 D램 제품부터 EUV 공정을 전면 적용해 반도체 미세공정의 한계를 돌파할 채비를 갖추고 D램의 새로운 패러다임을 제시했다. EUV 노광 기술을 적용하면 회로를 새기는 작업을 반복하는 멀티 패터닝 공정을 줄이면서 패터닝 정확도를 높여 성능과 수율을 향상시키고 제품 개발 기간을 단축할 수 있다. 삼성전자는 현재 EUV 공정으로 14나노 초반대 ‘4세대 10나노급(1a) D램 양산 기술’을 개발하고 있다. 향후 차세대 제품의 품질과 수율도 기존 공정 제품 이상으로 향상시킬 예정이다.EUV를 이용해 만든 4세대 10나노급(1a) D램은 1세대 10나노급(1x) D램보다도 12인치 웨이퍼당 생산성을 2배 높여 사업 경쟁력을 더욱 강화할 수 있다. 삼성전자 D램 모듈. /사진제공=삼성전자삼성전자는 내년에 성능과 용량을 더욱 높인 4세대 10나노급(1a) D램(DDR5·LPDDR5)을 양산하고 5세대·6세대 D램도 선행 개발해 프리미엄 메모리 시장에서의 기술 리더십을 더욱 강화해 나간다는 전략이다. 이정배 삼성전자 메모리사업부 DRAM개발실 부사장은 “업계 최초로 EUV 공정을 D램 양산에 적용해 글로벌 고객들에게 더욱 차별화된 솔루션을 한발 앞서 제공할 수 있게 됐다”며 “내년에도 혁신적인 메모리 기술로 차세대 제품을 선행 개발해 글로벌 정보기술(IT) 시장이 지속적으로 성장하는데 기여할 것”이라고 밝혔다.한편 삼성전자는 내년부터 DDR5·LPDDR5 D램 시장의 본격 확대에 맞춰 글로벌 IT 고객과 기술협력을 강화하고 업체간 다양한 표준화 활동을 추진해 차세대 시스템에서 신제품 탑재 비중을 지속적으로 높여 나갈 예정이다. 또 삼성전자는 올 하반기 평택 신규 라인을 가동함으로써 증가하는 차세대 프리미엄 D램 수요에 안정적으로 대응할 수 있는 양산 체제를 구축할 계획이다./이재용기자 jylee@sedaily.com[서울경제 바로가기]▶ 새로워진 서울경제 모바일을 만나보세요.▶ 네이버 채널에서 \'서울경제\' 구독해주세요!저작권자 ⓒ 서울경제, 무단 전재 및 재배포 금지서울경제 관련뉴스해당 언론사에서 선정하며 언론사 페이지(아웃링크)로 이동해 볼 수 있습니다.마스크 내리고 포토라인 선 조주빈 ""악마의 삶을 멈출 수 있어서 감사""(종합)서우, 깜짝 놀랄만큼 예쁘고 섹시해졌네···화보 통해 공개된 근황오거돈 ""자영업자 18만6,000명에 현금 100만 원씩 지원""레드벨벳 조이, 소녀 아닌 숙녀로···S라인 섹시 폭발 화보 대공개\'조국 영입 시도\' 손혜원 ""웃으며 \'잘 버티시라\' 덕담···15명까지 충분히 당선 자신""좋아요0훈훈해요0슬퍼요0화나요0후속기사 원해요0기사제공 :']"
9,삼성전자, 2020-03-2509:22,머니투데이 ,코스피 상승에 시총 상위주 강세…삼성전자 4%·현대차 7%↑,https://finance.naver.com/news/news_read.nhn?article_id=0004382694&office_id=008&mode=search&query=삼성전자&page=11,"['       코스피 상승에 시총 상위주 강세…삼성전자 4%·현대차 7%↑      기사입력2020-03-25 09:22기사원문좋아요훈훈해요좋아요 평가하기공감좋아요0훈훈해요0슬퍼요0화나요0후속기사 원해요0댓글 [머니투데이 강민수 기자] 글로벌 증시 폭등에 힘입어 국내 증시가 상승 출발한 가운데 시가총액 상위주가 이틀째 연이어 강세다. 25일 오전 9시 13분 현재 유가증권시장에서 삼성전자는 전 거래일 대비 4.79% 오른 4만9200원에 거래되고 있다. 같은 시간 SK하이닉스는 4.83% 오른 8만2500원을 기록 중이다. 이밖에 삼성바이오로직스(1.68%), NAVER(1.60%), 셀트리온(1.36%), LG화학(7.64%), 삼성SDI(7.10%), 현대차(7.09%) 등이 강세를 보인다. 같은 시간 코스피지수는 전날보다 4.31% 오른 1679.39를 나타내고 있다. 이는 간밤의 글로벌 증시 폭등과 이탈리아의 코로나19 신규 확진자 수 감소, 미국 \'슈퍼부양책\' 통과 임박 소식 등이 국내 증시에 호재로 작용한 것으로 풀이된다. 24일(현지시간) 뉴욕 다우 지수는 11.37% 급등해 1933년 이후 87년만에 최대 상승률을 보였고, S&P(스탠다드앤푸어스)500 지수는 9.38%, 나스닥 지수도 8.12% 상승했다. 강민수 기자 fullwater7@mt.co.kr▶줄리아 투자노트▶조 변호사의 가정상담소 ▶머니투데이 구독하기 <저작권자 ⓒ \'돈이 보이는 리얼타임 뉴스\' 머니투데이, 무단전재 및 재배포 금지>머니투데이 관련뉴스해당 언론사에서 선정하며 언론사 페이지(아웃링크)로 이동해 볼 수 있습니다.""쓰레기보다 못한…"" 조주빈이 졸업한 학교 가봤더니조주빈 ""손석희· 김웅에 사죄"" 왜?…사기 혐의에 \'눈길\'가인, 조주빈 인스타 차단 인증 후 분노 ""이런 XXXXX!""마스크 벗은 \'박사방\' 조주빈, 손석희와 김웅에 사과…왜?한국은 나은 편...미주·유럽 \'마스크 대란\' 더 심한 이유좋아요0훈훈해요0슬퍼요0화나요0후속기사 원해요0기사제공 :']"
