,회사명,날짜,언론사,기사제목,링크,본문
0,삼성전자, 2020-01-1322:26,이데일리 ,"[미리보는 이데일리신문]기업 10곳 중 8곳 “올 투자·고용, 줄이거나 동결”",https://finance.naver.com/news/news_read.nhn?article_id=0004554323&office_id=018&mode=search&query=삼성전자&page=1,"['       [미리보는 이데일리신문]기업 10곳 중 8곳 “올 투자·고용, 줄이거나 동결”      기사입력2020-01-13 22:26기사원문좋아요훈훈해요좋아요 평가하기공감좋아요0훈훈해요0슬퍼요0화나요0후속기사 원해요0댓글 [이데일리 박기주 기자] 다음은 14일자 이데일리 신문 주요 뉴스다. △1면-기업 10곳 중 8곳 “올 투자·고용, 줄이거나 동결”-검·경 수사권조정법, ‘4+1’ 공조 속 통과-물가 22% 뛸 때 등록금 제자리…대학들 “교육투자 엄두도 못내”-[사설]교실이 선거판으로 변하는 것은 막아야 한다-[사설]저소득층 빈곤 부추긴 소득주도성장의 역설△줌인&-종로 집 구한 이낙연…4·15 총선 넘어야 대권 보인다-靑 고민정·유송화 총선 출마 가닥…이르면 내일 거취 표명-저출산위 부위원장 서형수, 권익위 부위원장 김기표△300대 기업 설문-“신성장동력 부재로 저성장 고착화…경제정책 대전환 통해 활력 제고를”-“부동산·소득주도성장 정책, 현실과 가장 안 맞아”-경제법안 통과 하세월…CEO가 본 성장 최대 장애물은 ‘국회’△검·경 수사권조정법 국회 통과-검사 수사지휘권 66년 만에 폐지…경찰에 자체 수사종결권 부여-자치경찰제 도입 등 경찰권력 비대화 막을 조치 따라야-檢 “국회 결정 존중할 것”…警 “책임수사 원년 삼겠다”△대학등록금 12년째 동결 부작용-‘교수 연구비, 실험 실습비’까지 줄여야 할 판…교육 질 저하 우려-기숙사·강의동 지을 때 써야 하는데…눈 녹듯 사라지는 적립금-“신입생 안 올까 봐 올리라고 해도 못 올려”…‘진퇴양난’ 지방대△에너지 전환 정책 대진단-이익 나누는 협동조합 띄우니…반대하던 풍력·태양광 전환 일사천리-獨 에너지 전문가 600명, 전국 돌며 상담 서비스-한국, 정부 주도 에너지 전환 한계…“주민 자발적 참여 환경 만들어줘야”△정치-정세균 총리 인준 ‘4+1 공조’ 이변 없었다…유치원 3법도 처리-한국당·새보수당 통합 물꼬…친박 ‘유승민 거부감’ 넘을까-‘비례자유한국당’ 못쓴다…선관위 “유권자 혼란”-文대통령 남북관계·檢개혁 메시지 주목-“南, 美의 51번째 주”…북한 매체 또 맹비난-‘한국당 영입 3호’ 극지 탐험가 남영호씨△경제-공직사회 임금개편 지지부진한데…민간에 ‘직무급제’ 재촉하는 정부-‘경제 체온계’ 근원물가지수, OECD 5→29위로 떨어져-韓 수소차·충전소 보급 속도, 전 세계서 가장 빨라△국제·경제-“부채 파도 덮친다” 줄 잇는 경고…韓도 사정권-지식재산권·무역 확대…미·중 합의문에 쏠린 눈-곤 탈출에…닛산, 르노와 결별 준비하나△금융-車 보험료 이달 말부터 최대 3.5% 줄줄이 오른다-쌓인 보험금 10.7조 찾아가세요-윤종원, 취임 후 첫 임원회의…경영 공백 최소화 의지-비자카드 “빅데이터 활용 서비스 강화할 것”-한화생명 ‘노사 화합 선포식’ 개최△산업&기업-실탄 풍부, M&A 전문가 중용…허태수式 ‘미래 사냥’ 시동-“위법행위 지시, 묵과 않겠다” 삼성 임원진들 준법실천 서약-음향 달인 20명, 무음의 공간서 ‘초격차 사운드’ 찾아내-덩치 커진 넷마블, 권영식·이승원 투톱 체제-르노삼성 이어…기아차도 파업△산업·소비자생활-갤럭시S20·클램셸 폴더블폰…넘사벽 스마트폰 뜬다-구현모 KT CEO 후보 첫 인사키워드는 ‘고객중심’-맞춤 매칭부터 마케팅까지…‘인플루언서 플랫폼’ 인기-‘오! 그래놀라바’ 같은 가격에 16.7% 증량…오리온 ‘착한 포장 프로젝트’ 맞춰 리뉴얼△중소기업·바이오-‘세계 2위’ 中 잡아라…삼성바이오·셀트리온 임상 3상 활발-박영선 중기부 장관 ‘다보스 포럼’ 참석-최창희 공영쇼핑 대표 “흑자 원년의 해로 만들겠다”-中企 둘 중 한 곳 “설 앞두고 자금 사정 어려워”△이데일리가 만났습니다-보수 통합 못하면 총선 필패…사심 내려놓고 공천권 행사해야-“박근혜 전 대통령 이미 죗값 치러…인권 차원에서 석방해야”△증권&마켓-삼성전자·하이닉스만 독주하나…IT·中 관련주도 순환매 선택-‘유커 귀환’ 조짐에…면세점·화장품株 새해부터 ‘화색도네’-닥터 코퍼 강세에 ‘구리 ETF’ 들썩△증권-반도체·스마트폰 낙수효과…장비·부품주 주목-무리한 바이오 진출, 대규모 감자…동양네트웍스 ‘동전주’로 전락-불공정거래 여전…증권범죄합수단 존폐에 당국 촉각-분식회계 논란 휩싸인 덴티움…주가 요동△문화-103년 만에 공개된 쌍릉 목관…무왕 잠들었었나-“국내 유일 ‘유물 밀착형’ 박물관…전시 유물·출토 현장 한눈에”-무비컬 ‘영웅본색’ 향수를 자극하다△스포츠-고국 호주에 기쁨 전한 캐머런 스미스 “산불에도 관심을”-도쿄행 티켓 사냥 박인비, 4년 만에 1월 개막전 나서-16번홀 트리플 보기 뼈아픈 실수…임성재 소니오픈 공동 21위로 마무리-복근 찢어졌지만 진통제 투혼…김연경 “후배들 차린 밥상에 숟가락 얹어”△피플-유럽서 한국 전통악기 알려…여성·동양인 첫 수상 영예-“독창성 갖춘 세계적 음악가 총출동”-인권위 상임위원 박찬운 교수, 비상임위원에 양정숙 변호사-서부발전, 청년봉사단과 라오스서 ‘사랑 나눔’-‘김연아·엑소 기념메달’ 히트, 조폐공사 매출 5000억 돌파△오피니언-[목멱칼럼]금융완화에 중독된 세계경제-[생생확대경]서울 부동산규제 유탄맞은 대전 서민-[기자수첩]20대 국회 “다시 뽑아달라” 말할 자격 있나-[e갤러리]감만지 ‘옥수수밭에서 비밀스런 데이트’△부동산-‘신안산선 복선전철’ 착공 효과, 이중 규제에도 뛰는 광명 집값-추가분담금 폭탄…송파 ‘헬리오시티’ 조합장 해임-올해 강남권 첫 분양…‘개포프레지던스자이’ 청약 가점 최고 79점-부영, 창원 월영동 ‘마린애시앙’ 16일부터 선착순 계약△사회-이성윤의 취임 일성 “절제된 검사권 행사”…동기 윤석열과 대립각 세우나-부산 주는데, 경남 안 주고…위장전입까지 부른 전기車 보조금-‘사법농단 첫 판결’ 유해용 1심 무죄-김기수 변호사, 세월호 특조위원 사퇴-펭수 ‘가로채기 상표권’ 등록 안 받아-‘아빠 육아휴직 장려금’ 서초구 월 30만원 지원박기주 (kjpark85@edaily.co.kr)네이버 홈에서 ‘이데일리’ 뉴스 [구독하기▶]꿀잼가득 [영상보기▶] , 청춘뉘우스~ [스냅타임▶]＜ⓒ종합 경제정보 미디어 이데일리 - 무단전재 & 재배포 금지＞이데일리 관련뉴스해당 언론사에서 선정하며 언론사 페이지(아웃링크)로 이동해 볼 수 있습니다.조국 ""쓰리고 뿌듯한 경험, 수사권 조정 감회 남달라""\'엽기토끼 살인사건\' 재수사...경찰 새 첩보 확인 중수사권 조정안 통과…표정관리 나선 警 vs 무거운 침묵 檢\'엑소\' 첸, 깜짝 결혼 소식 ""축복 찾아와""…임신\'민주당 힘내요♥\' 한국당서 해촉된 나다은 누구?좋아요0훈훈해요0슬퍼요0화나요0후속기사 원해요0기사제공 :']"
1,삼성전자, 2020-01-1321:03,경향신문 ,“총수 집유 판결 때 실형보다 주가 더 떨어졌다”,https://finance.naver.com/news/news_read.nhn?article_id=0002985900&office_id=032&mode=search&query=삼성전자&page=1,"['       “총수 집유 판결 때 실형보다 주가 더 떨어졌다”      기사입력2020-01-13 21:03기사원문좋아요훈훈해요좋아요 평가하기공감좋아요0훈훈해요0슬퍼요0화나요0후속기사 원해요0댓글ㆍ이창민·최한수 교수팀 연구 보고횡령·배임 등 경제범죄 혐의로 재판에 넘겨진 재벌 총수가 실형을 선고받았을 때보다 집행유예 판결을 받았을 때 계열사의 기업가치가 더 크게 하락한 것으로 분석됐다. 법원이 ‘국가경제 기여’ 등을 이유로 이른바 ‘3·5 법칙(징역 3년·집행유예 5년)’에 따라 집행유예를 선고하는 것이 오히려 기업의 위험요인을 키운다는 지적이 나온다.경제개혁연구소 소속 이창민 한양대 교수와 최한수 경북대 교수는 13일 이런 내용의 ‘재벌 총수에 대한 사법처리는 기업가치에 부정적 영향을 미치는가’라는 보고서를 발표했다. 2000~2018년 횡령·배임 등 특정경제범죄가중처벌법 위반으로 유죄 선고된 총수 11명의 1~3심 각 판결 전후 15일간 해당 그룹 계열사들의 주가 변화를 분석했다. 총 319개 상장 계열사(중복 포함)가 분석 대상에 포함됐다.연구소 분석 결과 총수가 유죄 판결을 받았을 때 계열사 주식의 실제 수익률은 예상 수익률보다 1.0~1.6%포인트 낮았다. 유죄 판결 중 실형 판결 시에는 0.01~0.6%포인트 낮았던 반면, 집행유예 선고 시에는 1.4~3.0%포인트 낮았다. 총수에 대한 판결 강도가 약해질수록 총수가 지배하는 기업의 가치가 더 떨어졌다는 뜻으로 풀이된다.연구소에 따르면 2017년 이재용 삼성전자 부회장이 ‘국정농단 사건’ 1심에서 징역 5년의 실형을 선고받았을 때 삼성전자 주식 수익률은 예상치보다 5.5%포인트 높았다. 이듬해 2심에서 징역 2년6월에 집행유예 4년 판결을 받았을 때는 예상치보다 0.7%포인트 낮았다.연구소는 “총수의 횡령·배임 등 사적 이익추구에 대한 엄정한 처벌이 계열사에 ‘리더십 공백’ 같은 부정적 충격을 준다고 보기 어렵다”며 “오히려 집행유예 같은 관대한 판결이 시장에 ‘총수 리스크’ 등 부정적 신호를 줄 가능성이 있다”고 분석했다.박광연 기자 lightyear@kyunghyang.com▶ 장도리 | 그림마당 보기▶ 경향신문 최신기사▶ 기사 제보하기©경향신문(www.khan.co.kr), 무단전재 및 재배포 금지경향신문 관련뉴스해당 언론사에서 선정하며 언론사 페이지(아웃링크)로 이동해 볼 수 있습니다.""주진모씨, 세상이 바뀌었습니다""···피해 여성 강경 대응 예고대검 부장검사, \'추미애 인사\' 비판···""윤석열 허수아비로 만들어""계단을 도로로 착각한 음주 운전자, 오도 가도 못하고…정봉주 ""빨간 점퍼 민주당?""···금태섭 지역구 출마 시사\'조국백서\' 만든다···\'진보 장사\' 논란에도 나흘 만에 3억 모금좋아요0훈훈해요0슬퍼요0화나요0후속기사 원해요0기사제공 :']"
2,삼성전자, 2020-01-1321:00,뉴시스 ,[기자수첩]'소문난 잔치' CES가 남긴 것은,https://finance.naver.com/news/news_read.nhn?article_id=0009652180&office_id=003&mode=search&query=삼성전자&page=1,"['       [기자수첩]\'소문난 잔치\' CES가 남긴 것은      기사입력2020-01-13 21:00기사원문좋아요훈훈해요좋아요 평가하기공감좋아요0훈훈해요0슬퍼요0화나요0후속기사 원해요0댓글[서울=뉴시스] 이종희 기자 = 지난 7일(현지시간)부터 나흘간 미국 라스베이거스에서 열린 세계 최대 가전·IT 전시회 \'CES 2020\'이 마무리됐다. CES는 새해 가장 먼저 기술 트렌드를 엿볼 수 있는 자리인 만큼 기업인들 사이에서는 1년 농사에 비유되기도 한다. 올해 한국 기업들은 CES에서 가장 큰 주목을 받았다. 미중 무역분쟁으로 CES를 점령해온 중국이 주춤한 사이에 그 빈자리를 국내 대기업이 메웠다는 평가가 적지않았기 때문이다. 실제 삼성전자와 LG전자가 전시한 제품들은 CES 혁신상을 휩쓸 정도로 여타 업체들을 압도했다. 현대차는 개인용 비행체를 전시하며 이목을 집중시켰고 SK, 두산 등 한국을 대표하는 대기업들이 나란히 참가해 세계 최고 수준의 기술력을 과시했다.  하지만 \'소문난 잔치에 먹을 것이 없다\'는 말도 있듯이 비전과 계획은 거창했지만 첨단제품의 완성도는 미흡한 수준인게 아쉬움으로 남는다. 기자가 방문한 모 업체 산하 연구소가 개발한 인공 인간(Artificial Human) 네온이 대표적이다.전시된 네온을 볼때는 영화속 터미네이터가 현실화한 듯한 감탄이 나왔다. 실제 사람과 겉모습은 거의 흡사했다. 그러나 막상 시연을 해보니 자연스러운 소통이나 대화는 거의 불가능했다. 화면을 두드렸다가 대화할 수 없다는 사실을 알고 부스를 떠나는 방문객도 있었다.국내 기업만의 문제는 아니다. 이름만 들어도 아는 글로벌 대기업 역시 \'전시를 위한 전시\'에 가까운 내용이 많았다. CES에 참가하기 위해 설익은 제품을 부라부랴 내놓았다는 인상을 지울수 없었다. 자동차 등 다른 분야도 크게 다르지 않았다.0.1초 차이를 만들기 위해, 0.1% 순도를 높이기 위해. 0.1mm를 줄이기 위해 뼈를 깎는 노력을 하는 기업에게 세상을 놀라게 하는 아이디어를 매년 내놓는 것은 어려운 일임이 분명하다. 하지만 먼 곳까지 세계 최고 수준의 기술을 확인하기 위해 찾아간 부스에 많은 이들이 실망감을 안고 돌아가게 한다면, 그건 CES 행사의 존속에 의문을 갖게 하는것에 다름아니다. 물론 미래 첨단기술을 선보이다보니 다소 설익은 결과물이 전시될수는 있다. 그래도 다음 세대를 준비하고 조망하는 세계 최고의 행사라면 좀 달라야한다. 전시를 위한 전시는 영화속에서 익히 감상하고 있기 때문이다.☞공감언론 뉴시스 2papers@newsis.com▶ K-Artprice 모바일 오픈! 미술작품 가격을 공개합니다▶ 뉴시스 채널 구독하고 에어팟 프로 받아가세요▶ 뉴시스 빅데이터 MSI 주가시세표 바로가기 <저작권자ⓒ 공감언론 뉴시스통신사. 무단전재-재배포 금지.>뉴시스 관련뉴스해당 언론사에서 선정하며 언론사 페이지(아웃링크)로 이동해 볼 수 있습니다.92년생 엑소 첸 ""여자친구 임신했다…곧 결혼식""\'여성 장관 나체 합성 현수막\' 조사 착수아내 성매매 시키고 촬영…딸들에게 영상 보여줘한국계 여성 美대사 첫 탄생…서울서도 일했던 유리 킴\'휴대폰에 왜 전 남친 사진\' 항의하는 남친 칼로 찔러좋아요0훈훈해요0슬퍼요0화나요0후속기사 원해요0기사제공 :']"
3,삼성전자, 2020-01-1320:49,세계일보 ,"삼성전자, 준법경영 실천 첫걸음",https://finance.naver.com/news/news_read.nhn?article_id=0003429996&office_id=022&mode=search&query=삼성전자&page=1,"['       삼성전자, 준법경영 실천 첫걸음      기사입력2020-01-13 20:49기사원문좋아요훈훈해요좋아요 평가하기공감좋아요0훈훈해요0슬퍼요0화나요0후속기사 원해요0댓글김기남 부회장 등 서약식   삼성전자가 13일 ‘준법실천 서약식’(사진)을 열고 준법경영에 대한 실천 의지를 드러냈다.  삼성전자가 이날 오전 경기 수원 삼성디지털시티에서 개최한 서약식에는 김기남 부회장, 김현석 사장, 고동진 사장 등이 참석해 준법실천 서약서에 직접 서명했다. 나머지 임원들은 전자서명으로 동참했다. 준법실천 서약에는 국내외 제반 법규와 회사규정을 준수하고, 위법행위를 지시하거나 인지한 경우 묵과하지 않으며, 사내 준법문화 구축을 위해 솔선수범하겠다는 내용이 담겼다.  삼성전자는 ‘법과 원칙의 준수’가 조직문화로 확실하게 자리 잡도록 하기 위해 이번 행사를 마련했다고 밝혔다. 사장단과 전 임원의 서약은 조직의 책임자가 법·원칙에 저촉되는 어떠한 의사결정이나 행위도 하지 못하도록 내부 통제를 강화하겠다는 의미라는 설명이다.  이날 삼성전자 외에 삼성전기, 삼성SDS, 삼성물산도 회사별로 준법실천 서약식을 열었다. 삼성SDI, 삼성생명, 삼성화재도 순차적으로 서약에 동참할 예정이다.  한편 김지형 전 대법관이 위원장을 맡은 독립적인 외부 감시기구로 출범하는 삼성준법감시위원회는 다음 달부터 본격적인 활동에 들어간다. 준법감시위는 최고경영진의 준법위반 리스크를 파악하고 직접 조사 등을 통해 의견을 제시한다.   박세준 기자 3jun@segye.comⓒ 세상을 보는 눈, 세계일보세계일보 관련뉴스해당 언론사에서 선정하며 언론사 페이지(아웃링크)로 이동해 볼 수 있습니다.""여성정책 퍼부으면서 하는 말이 공정한 사회""주진모 향한 조롱, 위기 극복 할까?장지연 ""김건모 주선해준 이들 중 한명은 강용석 아내""예쁘다고 \'플라워 입술\' 했다가 큰일 날 수 있다?""재벌인 줄 알고 결혼했으나 빈털터리"" 정가은 파경 이유 \'재조명\'좋아요0훈훈해요0슬퍼요0화나요0후속기사 원해요0기사제공 :']"
4,삼성전자, 2020-01-1320:47,세계일보 ,삼성전자 주가 액분후 첫 6만원 고지 올라,https://finance.naver.com/news/news_read.nhn?article_id=0003429991&office_id=022&mode=search&query=삼성전자&page=1,"['       삼성전자 주가 액분후 첫 6만원 고지 올라      기사입력2020-01-13 20:47기사원문좋아요훈훈해요좋아요 평가하기공감좋아요0훈훈해요0슬퍼요0화나요0후속기사 원해요0댓글SK하이닉스는 10만원 돌파국내 시가총액 1위인 삼성전자와 2위인 SK하이닉스가 나란히 주가 최고치를 달성했다.  13일 한국거래소에 따르면 삼성전자는 전 거래일보다 0.84% 오른 6만원에 거래를 마쳤다. 지난 9일과 10일에 이어 3거래일 연속 사상 최고가를 경신했다. 2018년 5월 4일 액면분할 이후 처음으로 주당 6만원 고지에 올라선 것이다. 게다가 수정주가 기준으로 1975년 6월 11일 상장 이후 약 45년 만의 최고 기록이다.  SK하이닉스 역시 전 거래일보다 1.62% 올라 10만500원에 거래를 마쳤다. 2012년 3월 SK하이닉스가 공식 출범한 이후 주가가 10만원 선을 넘어선 것은 이번이 처음이다. 이로써 SK하이닉스는 종가 기준 지난 9일 9만9000원 이후 2거래일 만에 다시 최고가를 경신했다.  이날 외국인 투자자도 반도체 순매수 행렬을 이어갔다. 외국인은 이날 장 마감 기준으로 삼성전자 주식을 848억원, SK하이닉스 주식을 216억원어치 각각 순매수했다. 외국인 투자자는 올해 들어서만 삼성전자와 SK하이닉스 주식을 각각 7102억원, 130억원을 사들였다.  이 같은 배경으로는 반도체 경기 회복에 대한 기대감이 반영된 것으로 풀이된다. 앞선 지난 8일 삼성전자는 지난해 4분기 영업이익이 7조1000억원으로 잠정 집계됐다고 공시했다. 이는 증권사 전망치 평균(6조5000억원대)을 9%가량 웃도는 수준이다.  SK하이닉스의 경우 아직 지난해 4분기 영업이익을 공개하지 않았으나 역시 증권사 전망치 평균인 4400억원대를 웃돌 수 있다는 기대감이 크다.   김범수 기자 sway@segye.comⓒ 세상을 보는 눈, 세계일보세계일보 관련뉴스해당 언론사에서 선정하며 언론사 페이지(아웃링크)로 이동해 볼 수 있습니다.""여성정책 퍼부으면서 하는 말이 공정한 사회""주진모 향한 조롱, 위기 극복 할까?장지연 ""김건모 주선해준 이들 중 한명은 강용석 아내""예쁘다고 \'플라워 입술\' 했다가 큰일 날 수 있다?""재벌인 줄 알고 결혼했으나 빈털터리"" 정가은 파경 이유 \'재조명\'좋아요0훈훈해요0슬퍼요0화나요0후속기사 원해요0기사제공 :']"
5,삼성전자, 2020-01-1320:39,SBS ,애플도 스타도 당한 '클라우드 해킹'…막을 방법 없나,https://finance.naver.com/news/news_read.nhn?article_id=0000785224&office_id=055&mode=search&query=삼성전자&page=1,"['       애플도 스타도 당한 \'클라우드 해킹\'…막을 방법 없나      기사입력2020-01-13 20:39기사원문좋아요훈훈해요좋아요 평가하기공감좋아요0훈훈해요0슬퍼요0화나요0후속기사 원해요0댓글 <앵커>며칠 전 배우 주진모 씨가 휴대전화를 해킹당해서 협박까지 받았다는 사실이 알려지면서 파장이 커지고 있습니다. 경찰도 조사에 나선 가운데 확인되지 않은 연예인들의 SNS 대화 내용까지 인터넷에 퍼지면서 2차 피해 우려도 커지고 있습니다. 전문가들도 여러 분석을 내놓고 있는데 해킹이 의심되는 곳 가운데 하나가 바로 온라인 저장공간, 클라우드입니다. 휴대전화에 있던 자료들이 클라우드로 자동 전송됐을 경우에는 휴대전화뿐 아니라 클라우드도 해킹 대상이 될 수 있습니다.많은 사람들이 자신도 모르게 쓰고 있다는 클라우드가 그럼 과연 안전한 건지 노동규 기자가 살펴봤습니다.<기자>지난주 CES에서 주목받은 애플의 대형 광고입니다.""당신 아이폰에서 일어난 일은 당신 아이폰에 머물러 있다."" 수사당국 요구에도 피의자 아이폰 비밀번호를 풀어주지 않는 강력한 프라이버시 보호를 강조했습니다.이런 애플도 지난 2014년 클라우드 보안 문제로 곤욕을 치렀습니다.누군가 할리우드 유명 배우들의 애플 클라우드 계정에 접속해 은밀한 사생활을 담은 사진과 영상을 빼 간 겁니다.배우들이 아이디와 비밀번호 관리를 잘못한 것으로 드러났지만, 애플은 보안 강화 조치를 내놨습니다.2중 비밀번호를 통한 접속방식이나 안 쓰던 기기를 통한 접속 때 알림 메일을 보내는 등 지금은 기본이 된 개선이 이뤄진 겁니다.논란을 빚고 있는 삼성전자 클라우드 역시 접속 과정에 애플 수준의 보안 기능을 갖추고 있지만 이용자의 선택에 맡겼습니다.[임종인 교수/고려대 정보보호대학원 : (애플 사건이) 5년 전 일인데 어떤 교훈도 얻지 못했다고 하면 글로벌 마인드도 부족한 거고요. 2차 인증을 기본으로 하는 걸 동의를 구할 게 아니라 정책만 바꾸면 되는 거거든요?]4차 산업혁명이 고도화될수록 각종 디지털 기록의 클라우드 집중과 활용은 늘어날 수밖에 없어 이용자 스스로도 자구책을 마련해야 합니다.우선 번거롭더라도 사이트마다 다른 비밀번호를 쓰고 그마저도 수시로 바꾸는 게 안전합니다.클라우드에 접속할 때는 스마트폰 문자로 본인 인증을 한 번 더 거치도록 이중 인증 기능을 사용하는 게 좋습니다.무엇보다 잠재적 해킹 가능성으로부터 완전히 자유로운 클라우드 서비스는 없는 만큼 민감한 정보라면 애초에 클라우드를 활용하지 말라고 전문가들은 조언합니다.(영상취재 : 김흥식·정상보, 영상편집 : 박지인, CG : 이경문·김민영)\xa0노동규 기자(laborstar@sbs.co.kr)▶ [마부작침] 대한민국 음주살인 보고서 Ⅱ▶ SBS가 고른 뉴스, 네이버에서 받아보세요※ ⓒ SBS & SBS Digital News Lab. : 무단복제 및 재배포 금지SBS 관련뉴스해당 언론사에서 선정하며 언론사 페이지(아웃링크)로 이동해 볼 수 있습니다.[현지 연결] ""숨쉬기 힘들어""…여진 공포에 집도 떠났다\'아이 온몸 피멍\' 확인하고도 무혐의…반년 뒤 시신으로본인 수입보다 큰 포상금 \'전액 기부\'…가슴 따뜻한 사연[영상] \'와장창\' 갑자기 날아든 유리 파편…위기의 현장숨은 돈 10조 찾는 법, 알려드립니다좋아요0훈훈해요0슬퍼요0화나요0후속기사 원해요0기사제공 :']"
