,회사명,날짜,언론사,기사제목,링크,본문
15,삼성전자, 2020-10-1511:18,조선비즈 ,빅히트 급등에 주식부자 6위 오른 방시혁… BTS도 돈방석(종합),https://finance.naver.com/news/news_read.nhn?article_id=0000603606&office_id=366&mode=search&query=삼성전자&page=5,"['       빅히트 급등에 주식부자 6위 오른 방시혁… BTS도 돈방석(종합)      기사입력2020-10-15 11:18기사원문좋아요훈훈해요좋아요 평가하기공감좋아요0훈훈해요0슬퍼요0화나요0후속기사 원해요0댓글 방탄소년단(BTS)의 소속사 빅히트엔터테인먼트가 15일 유가증권시장 상장 첫날 급등하고 있다. 장 초반 ‘따상(공모가의 두 배로 시초가가 결정된 뒤 상한가 상승)’을 기록한 뒤 상한가는 풀렸지만, 여전히 공모가(13만5000원)를 크게 웃도는 수준이다. 빅히트 주가 급등으로 최대주주인 방시혁 빅히트 의장은 한때 국내 주식부자 6위에 올랐다. 빅히트 지분을 증여받은 방탄소년단 멤버들도 돈방석에 오르게 됐다. 이날 빅히트 주가는 시초가가 27만원(공모가의 2배)으로 정해진 다음 상승제한폭(30.00%)까지 치솟으면서 35만1000원이 됐다. 이후 매도 물량이 나오면서 오전 11시 12분 현재 29만7500원으로 다소 떨어졌다.그룹 방탄소년단(BTS)의 소속사 빅히트엔터테인먼트가 코스피에 상장한 첫날인 15일 방시혁 빅히트엔터테인먼트 의장이 서울 여의도 한국거래소에서 열린 상장기념식에 참석해 있다. /연합뉴스빅히트 주가가 급등하면서 빅히트 지분 34.74%(1237만7337주)를 보유하고 있는 방 의장의 지분 가치는 현재 3조6000억원 수준이다. 장 초반 상한가를 기록했을 때는 4조3444억원에 달했다. 이는 국내 연예계 최고 수준으로 이건희 삼성 회장, 이재용 삼성전자(005930)부회장, 서정진 셀트리온(068270)회장, 김범수 카카오(035720)의장, 정몽구 현대자동차그룹 명예회장 다음이다. 정몽구 명예회장은 올해 6월말 기준으로 현대차(005380)1139만5859주, 현대모비스(012330)677만8966주, 현대제철(004020)1576만1674주, 현대글로비스(086280)251만7701주를 갖고 있는데 전날 종가 기준으로 이들 주식의 가치는 총 4조4594억1260만원이다. 넷마블(251270)주식 2072만9472주를 가진 방준혁 의장의 지분 가치는 현재 약 2조8814억원이다. 방탄소년단 멤버 7명도 나란히 돈방석에 앉았다. 앞서 방 의장은 빅히트 상장에 앞서 지난달 3일 방탄소년단 멤버 각자에게 보통주 47만8695주를 인당 6만8385주씩 균등하게 증여했다. 현 주가 기준 멤버 각자의 빅히트 주식 가치는 약 200억원에 달한다. [이다비 기자 dabee@chosunbiz.com] ▶네이버에서 조선비즈를 구독 하세요 ▶\'명품 경제뉴스\' 조선비즈 바로 가기 ▶올해 \'이 기업들\' 투자 안하면 영영 기회 없다 저작권자 ⓒ 조선비즈, 무단 전재 및 재배포 금지 조선비즈 관련뉴스해당 언론사에서 선정하며 언론사 페이지(아웃링크)로 이동해 볼 수 있습니다.\'재테크 고수\' 영화배우 손예진, 120억 대출, 왜?""2000만원대 수입 세단 타세요""… 폴크스바겐의 파격임영웅 신곡과 함께 공개된다는 SUV, 대체 어떻길래…\'진짜 5G\'는 못한다고요? 부끄러운 \'세계 최초\' 타이틀그 어렵다는 QLED \'마지막 퍼즐\'… 삼성전자가 맞췄다좋아요0훈훈해요0슬퍼요0화나요0후속기사 원해요0기사제공 :']"
16,삼성전자, 2020-10-1511:13,뉴스1 ,"코스피, 0.8% 하락 2360선 등락…'따상' 풀린 빅히트",https://finance.naver.com/news/news_read.nhn?article_id=0004928155&office_id=421&mode=search&query=삼성전자&page=5,"['       코스피, 0.8% 하락 2360선 등락…\'따상\' 풀린 빅히트      기사입력2020-10-15 11:13기사원문좋아요훈훈해요좋아요 평가하기공감좋아요0훈훈해요0슬퍼요0화나요0후속기사 원해요0댓글美 추가 부양책 실망감에 뉴욕증시 이틀 연속 약세빅히트, \'따상\' 찍고 상한가서 내려와…10%대 ↑(자료사진) © News1 성동훈 기자(서울=뉴스1) 권혜정 기자 = 15일 코스피 지수가 이틀 연속 약세를 보인 뉴욕 증시 영향에 0.8% 하락해 2360선에서 등락을 거듭하고 있다. 코스닥 지수도 1.7% 떨어졌다. 이날 오전 11시 2분 기준 코스피 지수는 전일 대비 18.89p(0.79%) 내린 2361.59에 거래 중이다. 개인이 2487억원을 순매수한 가운데 외국인과 기관은 각각 593억원, 410억원을 순매도하고 있다. 시가총액 상위 10위 종목은 LG화학(1.75%)와 삼성바이오로직스(0.42%)를 제외하고 모두 하락세다. 카카오(-1.90%), 네이버(-1.84%), 셀트리온(-1.72%), 삼성SDI(--1.60%), 삼성전자(-1.48%) 순으로 하락폭이 크다.  이날 코스피 시장에 상장한 빅히트엔터테인먼트(10.93%)는 \'따상(공모가 2배에서 시초가 형성 후 상한가 직행)\'으로 거래를 시작했으나 곧바로 상한가에서 내려 앉아 30만원선 공방을 벌이고 있다. 이날 오전 11시2분 기준 코스닥 지수는 전일 대비 14.88p(1.73%) 내린 846.60에 거래 중이다. 개인이 1205억원을 순매수했고 외국인과 기관은 각각 340억원, 744억원을 순매도 중이다. 시가총액 상위 10위 종목은 대부분 하락세다. 셀트리온헬스케어(0.11%)만이 올랐고 알테오젠(-4.96%), 제넥신(-4.42%), 카카오게임즈(-3.52%), CJENM(-3.37%) 등은 내렸다. 간밤 뉴욕 증시는 이틀 연속 내렸다. 스티븐 므누신 재무장관이 다음달 3일 대통령 선거 이전에 추가 부양협상을 타결하기 힘들다고 인정하며 투자심리가 위축됐다.다우지수는 전장 대비 165.81포인트(0.58%) 내린 2만8514.00을 기록했다. 스탠다드앤푸어스(S&P)500 지수는 23.26포인트(0.66%) 밀린 3488.67, 나스닥 지수는 95.17포인트(0.80%) 하락한 1만1768.73으로 거래를 마쳤다.서울외환시장에서 원/달러 환율은 전일 대비 1.45원 내린 1145.45원에 거래 중이다.jung9079@news1.kr▶ 네이버 메인에서 [뉴스1] 구독하기!▶  뉴스1 바로가기 ▶  코로나19 뉴스 © 뉴스1코리아(news1.kr), 무단 전재 및 재배포 금지뉴스1 관련뉴스해당 언론사에서 선정하며 언론사 페이지(아웃링크)로 이동해 볼 수 있습니다.조정래 ""진중권 사죄안하면 法에…유시민 \'이영훈\'엔 말렸다""서민 ""역시 대깨문의 나라, 내강의 취소"" 노혜경 \'머리 아파\'양치승 ""내 인생 오점…죽이고 싶은놈 있다""윤혜진 ""17대1로 싸워 이긴 강남짱에 찜당해""진중권 ""민주당, 내 목줄 끊어 놓겠다는 협박""좋아요0훈훈해요0슬퍼요0화나요0후속기사 원해요0기사제공 :']"
17,삼성전자, 2020-10-1511:01,전자신문 ,"""열흘간 쇼핑 지원금 119억""...롯데홈쇼핑, '대한민국 광클절' 개최",https://finance.naver.com/news/news_read.nhn?article_id=0002907548&office_id=030&mode=search&query=삼성전자&page=5,"['       ""열흘간 쇼핑 지원금 119억""...롯데홈쇼핑, \'대한민국 광클절\' 개최      기사입력2020-10-15 11:01기사원문좋아요훈훈해요좋아요 평가하기공감좋아요0훈훈해요0슬퍼요0화나요0후속기사 원해요0댓글롯데홈쇼핑 대한민국 광클절롯데홈쇼핑(대표 이완신)은 16일부터 25일까지 10일간 119억원의 쇼핑 지원금을 제공하고 총 3000억원의 물량을 할인 판매하는 초대형 쇼핑 축제 \'대한민국 광클절\'을 진행한다.TV홈쇼핑업계 최초·최대 규모로 진행되는 쇼핑 행사로, TV, 온라인, 모바일 등 전 채널에 걸쳐 총 2200개 인기 브랜드가 참여한다. 코로나19로 힘든 시기를 겪고 있는 국민에게 희망 메시지를 전달하고 국내 경기 활성화에도 도움이 되고자 기획했다.롯데홈쇼핑은 행사 기간 동안 총 119억원의 \'광클 지원금\'을 제공한다. 매일 선착순 6만명에게 1만원 상당의 할인 쿠폰 2장을 지급한다.쿠폰은 5만원 이상 주문 시 1매씩 사용 가능하다. 카드 할인 최대 10%, 엘클럽 회원에게는 일반 고객의 100배인 10% 적립, 모바일 애플리케이션(앱)으로 상품 구매 시 최대 20% 적립 등 파격 혜택을 제공한다.매일 인기 상품을 한정 수량으로 초특가에 선보이는 타임세일 이벤트 \'광클타임\'을 진행한다. \'에어팟 프로\' \'다이슨 청소기\' \'구찌 마몬트 미니백\' 등을 최대 36% 저렴하게 구매할 수 있다. 롯데월드타워 \'서울스카이+아쿠아리움 패키지 이용권\'은 48% 할인된 가격에, 롯데리아, 엔제리너스 등 계열사 신제품 이용권을 30% 이상 할인 판매한다. 단독 패션 가을·겨울(FW) 상품을 최대 78% 할인된 가격으로 선보이는 \'패션 특집전\'을 비롯해 삼성전자, 다이슨 등 \'가전 브랜드 특집전\', 명품 가방, 향수 등을 선보이는 \'명품 잡화 특집전\' 등을 요일별로 준비했다.롯데홈쇼핑 TV 프로그램도 총출동한다. 17일 오전 8시부터 \'최유라쇼\'를 시작으로 \'영스타일\' \'찐뷰티\' \'유난희쇼\' \'조윤주쇼\' \'엘쇼\' 등 대표 프로그램을 최초로 10시간동안 연이어 방송하며 광클절 특집으로 꾸민다. 모바일 라이브 방송 \'몰리브\'에서는 에르메스, 페라가모 등 명품 시계를 최저가로 선보이며, 잠실 롯데백화점 매장에서 \'설화수\'를 판매하는 방송도 진행한다.홍보 모델로는 국민영웅이자 골프스타 박세리를 선정했다. 행사에 앞서 지난 12일 공개한 광클절 홍보 영상은 공개 이틀 만에 200만뷰를 넘어섰다. 응원 댓글 달기, 나만의 쇼핑 비법 인증하기 등 사전 이벤트도 현재까지 총 5000명이 참여하는 등 행사 시작 전부터 뜨거운 관심을 받고 있다.김인호 롯데홈쇼핑 DT본부장은 “롯데홈쇼핑의 모든 채널과 역량을 투입해 준비한 역대 최대 쇼핑 행사”라고 말했다.김정희기자 jhakim@etnews.com▶ ""2020 뉴노멀 시대의 클라우드 전방위 보안 전략” 무료 온라인 컨퍼런스 개최▶ 네이버 홈에서 [전자신문] 구독하기 [Copyright ⓒ 전자신문 & 전자신문인터넷, 무단전재 및 재배포 금지]전자신문 관련뉴스해당 언론사에서 선정하며 언론사 페이지(아웃링크)로 이동해 볼 수 있습니다.KT, 구리선 전화망 \'광케이블\'로 바꾼다3분기 내수가전유통, 실적 날았다…코로나19가 가전 수요 높여은행發 간편결제 \'KB페이\' 출격…빅테크에 반격[국정감사]김종갑 한전 사장 ""연료비 연동제 도입 동의""문 대통령 ""코로나19 백신 개발, 끝까지 지원""…SK바이오사이언스 연구소 찾아좋아요0훈훈해요0슬퍼요0화나요0후속기사 원해요0기사제공 :']"
18,삼성전자, 2020-10-1510:57,파이낸셜뉴스 ,주택규제 강화에 '지식산업센터' 반사이익,https://finance.naver.com/news/news_read.nhn?article_id=0004510999&office_id=014&mode=search&query=삼성전자&page=5,"['       주택규제 강화에  \'지식산업센터\' 반사이익      기사입력2020-10-15 10:57기사원문좋아요훈훈해요좋아요 평가하기공감좋아요0훈훈해요0슬퍼요0화나요0후속기사 원해요0댓글1가구\xa02주택\xa0산정대상에서\xa0제외양도소득세\xa0중과\xa0대상서도\xa0빠져선호도\xa0높아지며\xa0신규분양\xa0관심 동탄 우미 뉴브 투시도  [파이낸셜뉴스] 정부의 강도 높은 주택 규제로 지식산업센터가 반사이익을 누리고 있다. 아파트에만 적용되던 규제가 오피스텔에까지 번지면서, 세금 부담이 커진 것이다. 1가구 2주택 산정대상에 빠진 지식산업센터는 양도소득세 중과 대상 제외 등으로 선호도가 높아지며 향후 분양에 관심이 집중되고 있다.   15일 분양업계에 따르면 2006년 751건을 기록했던 지식산업센터 거래량은 2016년 4987건으로 10년새 7배 가량 증가했다. 최근엔 정부의 강도 높은 주택 규제가 이어지며 세금 부담이 없고 1가구 2주택 산정 대상에서 제외된 지식산업센터가 더욱 각광을 받고 있다.   부동산 전문가는 ""오피스텔도 주택 수에 포함돼 지난 7.13부동산대책의 큰 영향을 받게 됐고, 비교적 규제가 없는 지식산업센터로 부동자금이 몰리는 추세""라며 ""지식산업센터라도 옥석가리기가 중요해진 상황이며, 우수한 교통망과 산업 연계성을 갖췄는지 확인하고 투자할 필요가 있다""라고 말했다.   지식산업센터 선호도가 높아지면서 분양승인도 역대 최대치를 기록했다. 최근 상가정보연구소가 한국산업단지공단 자료를 분석한 결과 올 상반기 신설·변경 승인을 받은 지식산업센터 수는 80곳으로 역대 최대치를 기록했으며, 건축 면적만 359만2583㎡를 예상하고 있다. 지역별로는 △경기 45곳 △서울 13곳 △인천 10곳 △충북 3곳 순으로 많았다.   이에 따라 지식산업센터의 투자가 눈길을 끌고 있다.   반도체, IT 등 지식기반산업의 거점인 동탄테크노밸리에서는 우미건설의 \'동탄 우미 뉴브\'가 분양 준비 중이다. SRT동탄역 인근이며 도보권 내 트램2호선도 개발될 예정이다. 삼성전자NANOCITY, 한국 3M, 두산중공업원자력I&C 등 대기업과 가깝고 수원, 용인 권역으로 1만3000여 기업이 위치해 풍부한 배후수요도 기대할 수 있다.   현대엔지니어링은 광명시 하안동 일원에 \'현대 테라타워 광명\' 지식산업센터와 상업시설을 분양 중이다. 단지는 편리한 교통환경으로 우수한 직주근접성을 자랑한다. 사업지 바로 앞에는 우체국 사거리 신설역(예정)이 추진되고 있으며, 지하철 1호선 독산역과 7호선 철산역도 가깝다.    hoya0222@fnnews.com 김동호 기자   ▶ 헉! 소리나는 스!토리 뉴스 [헉스]▶ \'아는 척\'하고 싶은 당신을 위한 [두유노우]▶ 날로먹고 구워먹는 금융이슈 [파인애플]  ※ 저작권자 ⓒ 파이낸셜뉴스. 무단 전재-재배포 금지파이낸셜뉴스 관련뉴스해당 언론사에서 선정하며 언론사 페이지(아웃링크)로 이동해 볼 수 있습니다.관계 거부하는 남편, 아내 폭탄 발언 ""남편이 동영상 보면서..""\'성추행 인정\' 이근 대위, 뜻밖의 고백 ""여성분 남친이 당시..""17 대 1로 싸워 이긴 강남 짱에게 찜 당한 女, 무서워서 결국..21살 연하 아내 버리려는 남편의 사연 들어보니..누리꾼들 비판에 참지 못한 스티브 유 ""한국 가면 누가..""좋아요0훈훈해요0슬퍼요0화나요0후속기사 원해요0기사제공 :']"
19,삼성전자, 2020-10-1510:52,국민일보 ,"삼성전자, 한국시각장애인연합회와 TV 접근성 위한 업무 협약 체결",https://finance.naver.com/news/news_read.nhn?article_id=0001371090&office_id=005&mode=search&query=삼성전자&page=5,"['       삼성전자, 한국시각장애인연합회와 TV 접근성 위한 업무 협약 체결      기사입력2020-10-15 10:52기사원문좋아요훈훈해요좋아요 평가하기공감좋아요0훈훈해요0슬퍼요0화나요0후속기사 원해요0댓글삼성전자가 한국시각장애인연합회와 TV 접근성 기능 향상을 위한 업무 협약을 체결했다. 왼쪽은 천강욱 삼성전자 영상디스플레이사업부 부사장, 오른쪽은 박종운 한국시각장애인연합회 회장 직무대행. 삼성전자 제공삼성전자가 지난 12일 한국시각장애인연합회와 TV 접근성 기능 향상을 위해 업무 협약을 체결했다고 15일 밝혔다. 세계 흰 지팡이의 날을 기념해 맺은 이번 협약으로 양사는 삼성 TV의 접근성 기능 개발과 사용성 개선을 위해 협력할 예정이다. 세계 흰 지팡이의 날은 세계시각장애인연합회가 시각장애인들의 권리를 보호하고 사회적 관심을 이끌어내기 위해 제정한 것이다. 권민지 기자 10000g@kmib.co.kr▶ 네이버에서 국민일보를 구독하세요(클릭)▶ 국민일보 홈페이지 바로가기GoodNews paper ⓒ 국민일보(www.kmib.co.kr), 무단전재 및 재배포금지국민일보 관련뉴스해당 언론사에서 선정하며 언론사 페이지(아웃링크)로 이동해 볼 수 있습니다.[아살세] 불길 피해 내달린 맨발, 그 앞에 놓인 건""아파트 앞 카메라, 사생활 침해""라면서 기자 사진 찍은 추미애해바라기 몰카 범인은 새아빠…20대 두딸 샤워 훔쳐봤다부총리는 \'전세 제비뽑기\' 모르나… 대책 없이 ""안정적"" 자평\'덮죽덮죽\' 혼나고 \'감자빵\' 위로받고… 표절과 아류 사이좋아요0훈훈해요0슬퍼요0화나요0후속기사 원해요0기사제공 :']"
0,삼성전자, 2020-10-1510:49,아이뉴스24 ,"삼성전자, 시각 장애인 TV 접근성 기능 향상에 앞장선다",https://finance.naver.com/news/news_read.nhn?article_id=0000562649&office_id=031&mode=search&query=삼성전자&page=6,"['       삼성전자, 시각 장애인 TV 접근성 기능 향상에 앞장선다      기사입력2020-10-15 10:49기사원문좋아요훈훈해요좋아요 평가하기공감좋아요0훈훈해요0슬퍼요0화나요0후속기사 원해요0댓글\'세계 흰지팡이의 날\' 맞아 한국시각장애인연합회와 업무 협약 체결 [사진=삼성전자][아이뉴스24 장유미 기자] 삼성전자가 시각 장애인의 TV 접근성을 높이기 위해 적극 나선다.삼성전자는 지난 12일 한국시각장애인연합회와 TV 접근성 기능 향상을 위한 업무 협약을 체결했다고 15일 밝혔다.이번 협약은 \'세계 흰지팡이의 날(10월 15일)\'을 기념해 맺은 것으로, 세계 흰지팡이의 날은 1980년에 세계시각장애인연합회(World Blind Union)가 시각장애인들의 권리를 보호하고 사회적 관심을 이끌어내기 위해 제정한 것이다.삼성전자는 한국방송통신위원회의 \'2020년 시청각 장애인용 TV 보급 사업\' 공급자로 선정됐다. 영국 왕립 시각장애인협회(Royal National Institute of Blind People)로부터 \'시각장애인 접근성 인증(RNIB Tried and Tested Accreditation)\'을 최초로 획득하는 등 TV의 접근성 기능을 강화해 왔다.삼성전자 관계자는 ""이번 업무 협약을 통해 삼성 TV의 접근성 기능 개발과 사용성 개선을 위해 한국시각장애인연합회와 협력할 것""이라며 ""시각 장애인의 다양한 의견을 청취할 예정""이라고 말했다.장유미기자 sweet@inews24.com▶네이버 채널에서 \'아이뉴스24\'를 구독해주세요.▶재밌는 아이뉴스TV 영상보기 ▶아이뉴스24 바로가기[ⓒ 아이뉴스24 무단전재 및 재배포 금지]아이뉴스24 관련뉴스해당 언론사에서 선정하며 언론사 페이지(아웃링크)로 이동해 볼 수 있습니다.삼성전자, 맥도날드 매장서 친환경 디지털 매장 구축 앞장김경준 삼성전자 부사장 ""UWB, 차세대 게임 체인저…혁신 선보일 것""좋아요0훈훈해요0슬퍼요0화나요0후속기사 원해요0기사제공 :']"
1,삼성전자, 2020-10-1510:46,MBN ,"빅히트 방시혁, 주식 재산 4조 '돈방석'…현대차 정몽구에 버금",https://finance.naver.com/news/news_read.nhn?article_id=0001509217&office_id=057&mode=search&query=삼성전자&page=6,"['       빅히트 방시혁, 주식 재산 4조 \'돈방석\'…현대차 정몽구에 버금      기사입력2020-10-15 10:46기사원문좋아요훈훈해요좋아요 평가하기공감좋아요0훈훈해요0슬퍼요0화나요0후속기사 원해요0댓글빅히트엔터테인먼트가 오늘(15일) 상장돼 시초가가 공모가의 2배로 결정된 뒤 급등세를 보이면서 이 회사 방시혁 대표의 주식 재산이 정몽구 전 현대차그룹 회장에 버금가는 수준에 이르렀습니다.이날 오전 9시 15분 기준 빅히트엔터테인먼트는 공모가 대비 19만2000원(142.22%) 오른 32만7000원에 거래되고 있습니다. 방 대표는 빅히트 주식 1237만7337주(지분율 34.74%)를 보유해 지분 가치는 4조474억원에 이릅니다.이 같은 방 대표의 주식재산 규모는 재계 주식부자 순위 6위인 정몽구 전 현대차그룹 회장과 맞먹는 수준입니다. 한국CXO연구소에 따르면 정몽구 전 회장의 주식 재산 규모는 지난달 29일 종가를 기준으로 4조3436억원입니다.특히 빅히트엔터테인먼트의 주가가 이날 \'따상(공모가의 2배로 시초가가 형성된 뒤 상한가를 기록)\'을 보인 뒤 하락하고 있어, 앞서 상장해 흥행몰이를 한 SK바이오팜이나 카카오케임즈처럼 추가로 상한가를 기록할 가능성도 없지 않습니다.빅히트엔터테인먼트가 이날 상한가로 마감한 뒤 다음날 한 번 더 상한가를 기록하게 되면 방 대표의 주식 재산 규모는 김범수 카카오 이사회 의장(4조5565억원)과 서정진 셀트리온 회장(4조7295억원)마저 제쳐, 이건희 삼성전자 회장(17조6117억원)과 이재용 삼성전자 부회장(7조1299억원)에 이어 재계 3위 주식 부자 자리에 이름을 올리게 됩니다.방 대표 외 빅히트엔터테인먼트의 주요 주주들도 조 단위 지분 가치를 기록하게 됐습니다. 넷마블은 빅히트 주식 708만7569주(2조3174억원·지분율 19.90%))를, 스틱스페셜시츄에이션사모투자 합자회사는 346만2880주(1조1324억원·지분율 9.72%)를 각각 보유하고 있습니다.지난 8월 방 대표로부터 모두 47만8695주(1565억원)를 증여받은 그룹 방탄소년단(BTS) 멤버들도 돈방석에 올랐습니다. 멤버 한 명당 주식 재산 규모는 224억원입니다.스톡옵션과 우리사주를 받은 빅히트 임직원들의 재산도 크게 불어납니다. 12만주를 보유한 윤석준 최고경영자(CEO)의 지분가치는 392억원을, 8만8000주를 보유한 김신규 이사는 288억원을, 12만8000주를 보유한 또 다른 직원은 419억원을 각각 기록하고 있습니다. 또 142만6000주가 배정된 우리사주를 빅히트 전체 직원 313명이 고르게 나눠 가졌다고 가정하면 직원 한 명당 지분가치는 14억8978만원으로 공모가 대비 8억7473만원씩 차익을 얻었습니다.다만 빅히트엔터테인먼트의 주가가 장기적으로 고공행진을 할지는 미지수입니다. 앞서 상장한 SK바이오팜과 카카오게임즈는 각각 \'따상상상\'과 \'따상상\'을 기록한 뒤 지지부진한 주가 흐름을 보이고 있습니다. 카카오게임즈의 전일 종가가 4만8250원으로 상장 당일 시초가 수준에 머물고 있습니다. SK바이오팜은 `따상상`을 기록한 상장 이튿날 종가인 16만5000원보다 7.27% 낮은 15만3000원에 전일 거래를 마쳤습니다.[MBN 온라인뉴스팀]▶ 네이버에서 \'MBN뉴스\'를 만나보세요!▶ MBN 무료 고화질 온에어 서비스 GO!< Copyright ⓒ MBN(www.mbn.co.kr) 무단전재 및 재배포 금지 >MBN 관련뉴스해당 언론사에서 선정하며 언론사 페이지(아웃링크)로 이동해 볼 수 있습니다.[단독] 성폭력 의혹 목사 육성파일 그 후…""저도 당했어요""\'보수단체 불법지원\' 김기춘, 재상고심서 징역 1년 확정[속보] \'고 구하라 폭행·협박\' 최종범, 징역 1년 확정빅히트 엔터테인먼트 상장 첫날 \'따상\' 성공故 설리 1주기…여전히 미소가 아름다운 별[M+이슈]좋아요0훈훈해요0슬퍼요0화나요0후속기사 원해요0기사제공 :']"
