,회사명,날짜,언론사,기사제목,링크,본문
2,삼성전자, 2020-02-1609:56,조선비즈 ,'반도체 불황'에 100대 기업 영업익 2년새 32% 감소,https://finance.naver.com/news/news_read.nhn?article_id=0000475470&office_id=366&mode=search&query=삼성전자&page=4,"['       \'반도체 불황\'에 100대 기업 영업익 2년새 32% 감소      기사입력2020-02-16 09:56기사원문좋아요훈훈해요좋아요 평가하기공감좋아요0훈훈해요0슬퍼요0화나요0후속기사 원해요0댓글시총 100대 기업 영업이익 2년새 32.1% 감소‘반도체 불황’에 삼성전자, SK하이닉스 이익 뒷걸음글로벌 경제의 저성장 국면이 길어지면서 지난해 국내 대기업들의 영업이익이 뒷걸음질 친 것으로 나타났다. 시가총액 100대 기업의 영업이익과 순이익은 2년 전보다 각각 32.1%, 46.2% 감소했다.16일 기업평가사이트 CEO스코어가 국내 시가총액 100대 기업 가운데 지난 14일까지 잠정실적을 발표한 87개 기업의 실적을 조사한 결과 매출액은 1608조9788억원, 영업이익과 순이익은 각각 101조9442억원, 64조9154억원으로 집계됐다.영업이익은 전년 대비 35.9% 급감했고 2년 전과 비교해도 32.1% 감소했다. 순이익도 1년 새 46.2% 줄었다.조선일보DB반도체 불황에 삼성전자(005930)와 SK하이닉스 이익이 크게 감소한 것이 가장 큰 원인으로 분석됐다. 전체 이익에서 큰 비중을 차지하고 있는 두 기업을 제외하면 시총 100대 기업의 영업이익과 순이익 감소폭은 각각 -13.6%, -39.3%로 줄어든다.업종별로는 삼성전자와 SK하이닉스(000660)가 포함된 IT전기전자는 2017년 73조161억원에서 지난해 33조1572억원으로 54.6% 줄었다. 2017년 반도체 호황에 삼성전자와 SK하이닉스의 영업이익이 어닝서프라이즈를 기록한 기저효과 탓에 감소 규모가 두드러졌다.이어 석유화학업종(-61.4%), 서비스(-23.1%), 철강(-27.3%), 지주(-23.4%), 보험(-27.5%) 등도 영업이익이 1조원 이상 줄었다. 통신(-21.2%), 운송(-24.0%), 여신금융(-11.1%), 공기업(-5.4%) 등도 영업이익이 감소했다.반면 은행(지주 포함)은 영업이익 13조2567억원에서 15조8676억원으로 2년새 19.7% 늘었다. 조선·기계·설비도 영업손실 6714억원에서 영업이익 3343억원으로 1조58억원 늘며 흑자전환에 성공했다.기업별로는 86곳 중 절반이 넘는 45곳의 영업이익이 줄었으며 삼성전자와 SK하이닉스의 감소액이 가장 컸다.삼성전자의 지난해 영업이익은 27조7685억원으로 2년 전보다 25조8765억원(-48.2%) 감소했다. SK하이닉스도 같은 기간 11조86억원(-80.2%) 감소한 2조7127억원이었다. 전체 86개 기업 중 영업이익이 10조원 이상 감소한 곳은 2곳뿐이었다.나머지 기업 중 1조원 이상 줄어든 곳은 LG디스플레이 3조8210억원(-155.2%), LG화학 2조328억원(-69.4%), SK이노베이션 1조9651억원(-60.8%), SK 1조8929억원(-32.3%), 롯데케미칼 1조8221억원(-62.2%), (주)LG 1조1,617억원(-53.1%), 현대제철 1조363억원(-75.8%) 등이었다.[이재은 기자 jaeeunlee@chosunbiz.com][조선비즈 창간 10주년 기획 \'남극은 전쟁 중\' 기사 보러가기][네이버 메인에서 조선비즈 받아보기][조선비즈 바로가기] chosunbiz.com 조선비즈 관련뉴스해당 언론사에서 선정하며 언론사 페이지(아웃링크)로 이동해 볼 수 있습니다.집 갇힌 중국인들, 스마트폰만 봐… 때아닌 게임산업 호황?덩치 줄이는 대형 백화점·마트… 격변의 유통업계우리 국적 항공사 기내선 \'기생충\' 못 본다… 왜?""물량 하루 10마리?""… 이마트 반값 킹크랩에 소비자 분노한화·OCI도 무너졌다… 中 저가공세에 韓태양광 고사 위기좋아요0훈훈해요0슬퍼요0화나요0후속기사 원해요0기사제공 :']"
3,삼성전자, 2020-02-1609:48,이데일리 ,`반도체 불황`국내 시총 100대 기업..2년새 영업益 32.1% 감소,https://finance.naver.com/news/news_read.nhn?article_id=0004576388&office_id=018&mode=search&query=삼성전자&page=4,"['       `반도체 불황`국내 시총 100대 기업..2년새 영업益 32.1% 감소      기사입력2020-02-16 09:48기사원문좋아요훈훈해요좋아요 평가하기공감좋아요0훈훈해요0슬퍼요0화나요0후속기사 원해요0댓글19개 업종 중 절반 이상 줄어삼성전자, SK하이닉스 36조 이상 감소전체 감소액의 76.6% 차지[이데일리 양희동 기자] 지난해 미·중 무역 분쟁 등 세계 경제의 불확실성 확대 등으로 국내 대기업들의 수익 뒷걸음질 친 것으로 나타났다. 시가총액 100대 기업의 영업이익과 순이익은 1년새 각각 35.9%, 45.2% 줄었고, 2년 전과 비교해도 32.1%, 46.2%씩 감소했다. 특히 삼성전자(005930)와 SK하이닉스(000660) 등 반도체 기업들이 메모리 값 급락 등 업황 악화로 인해 이익이 크게 감소했다.16일 기업평가사이트 CEO스코어가 국내 시총 100대 기업 중 지난 14일까지 잠정실적을 발표한 87개 기업의 실적을 조사한 결과, 매출액은 1608조 9788억원, 영업이익과 순이익은 각각 101조 9442억원, 64조 9154억원 등으로 집계됐다. 영업이익은 전년(159조 815억원) 대비 35.9%(57조 1373억원) 급감했고 2년 전과 비교해도 32.1%(48조 1427억원) 감소했다.메모리 가격이 반값 이하로 떨어지는 극심한 반도체 업황 부진으로 삼성전자와 SK하이닉스 등의 영업이익이 큰 폭 감소한 것이 가장 큰 원인으로 분석된다. 또 미·중 무역 분쟁 등으로 인한 글로벌 경기 악화가 기업들의 이익 감소로 이어진 것으로 풀이된다.업종별로는 IT·전기·전자가 33조 1572억원으로 전년(73조 161억원) 대비 39조 8589억 원(54.6%)이나 줄었다. 이어 석유·화학도 6조 6528억 원(61.4%) 감소했고, 서비스 2조 2449억 원(-23.1%), 철강 1조 8787억 원(-27.3%), 지주 1조 4837억원(-23.4%), 보험 1조 1400억원(-27.5%) 등도 1조원 이상 영업이익이 줄었다. 반면 은행(지주 포함)은 13조 2567억원에서 15조 8676억원으로 2조 6109억원(19.7%)으로 영업이익이 가장 많이 증가했다. 또 조선·기계·설비도 -6714억원에서 3343억원으로 1조 58억원 늘며 흑자전환에 성공했다.기업별로는 86곳 중 절반이 넘는 45곳의 영업이익이 줄었고 삼성전자와 SK하이닉스의 감소액이 가장 컸다. 삼성전자가 27조 7685억원으로 전년(58조 8870억원)대비 52.8%감소했고, SK하이닉스도 20조 8440억원에서 2조 7127억원으로 86.9% 줄었다.양희동 (eastsun@edaily.co.kr)네이버 홈에서 ‘이데일리’ 뉴스 [구독하기▶] , 청춘뉘우스~ [스냅타임▶]이데일리 기자들의 비밀공간 [기자뉴스룸▶]＜ⓒ종합 경제정보 미디어 이데일리 - 무단전재 & 재배포 금지＞이데일리 관련뉴스해당 언론사에서 선정하며 언론사 페이지(아웃링크)로 이동해 볼 수 있습니다.\'전교 꼴찌→의대 합격\'…역전 스토리 쓴 수능 만점자들 비결은""프로포폴 연예인 누구냐""...이니셜 나돌아 파장 예상로또 898회 1등 26억씩 받는다…\'대박집\'은 여기""애증의 브라여, 안녕""…임현주 아나, \'노브라\' 생방송 화제살해에 성기 절단까지…끔찍한 泰 불륜 복수극좋아요0훈훈해요0슬퍼요0화나요0후속기사 원해요0기사제공 :']"
4,삼성전자, 2020-02-1609:27,YTN ,중국내 한국 공장들 이번 주 재가동 시작,https://finance.naver.com/news/news_read.nhn?article_id=0001401558&office_id=052&mode=search&query=삼성전자&page=4,"['       중국내 한국 공장들 이번 주 재가동 시작      기사입력2020-02-16 09:27기사원문좋아요훈훈해요좋아요 평가하기공감좋아요0훈훈해요0슬퍼요0화나요0후속기사 원해요0댓글 코로나 19 사태로 멈춰섰던 국내 기업들의 중국 공장들이 이번 주 재가동을 시작합니다.중국 20여개 성과 시가 춘제 연휴를 9일까지 연장하며 한국 기업들의 공장들도 생산 차질을 빚었으나, 10일부터 대부분 가동을 재개했습니다.삼성전자 톈진 TV 공장은 오는 19일 생산을 재개합니다. 톈진 공장은 애초 10일 재가동할 예정이었으나 지방정부의 지침에 따라 연기됐습니다.SK하이닉스 우시 반도체 공장은 코로나19 사태 속에서도 최소 인력으로 정상 가동했고 지난 10일부터 평일 근무 기준으로 인력을 배치했습니다.LG전자는 중국 10개 공장 중 9개 공장이 재개됐으나  톈진 공장은 지방정부 지침에 따라 이번 주에도 아직 재가동 시점이 정해지지 않았습니다. ▶ 대한민국 24시간 뉴스 채널 YTN 생방송보기  ▶ 네이버에서 YTN 뉴스 채널 구독하기 [저작권자(c) YTN & YTN PLUS 무단전재 및 재배포 금지]YTN 관련뉴스해당 언론사에서 선정하며 언론사 페이지(아웃링크)로 이동해 볼 수 있습니다.\'코로나 확진자가 다녀간 곳\' 다시 가도 될까?""1년 전 주문에 웃돈 요구""…해도 해도 너무해""영화는 보고 숟가락 얹나?""…기생충 패러디 \'남발\'학부모들이 가장 받고 싶어하는 교육 1위는?LTE보다 빠르다더니…불통 5G에 \'분통\'좋아요0훈훈해요0슬퍼요0화나요0후속기사 원해요0기사제공 :']"
5,삼성전자, 2020-02-1609:25,SBS ,'코로나19'로 1분기 상장사 실적 10%↓ 전망,https://finance.naver.com/news/news_read.nhn?article_id=0000793071&office_id=055&mode=search&query=삼성전자&page=4,"['       \'코로나19\'로 1분기 상장사 실적 10%↓ 전망      기사입력2020-02-16 09:25기사원문좋아요훈훈해요좋아요 평가하기공감좋아요0훈훈해요0슬퍼요0화나요0후속기사 원해요0댓글 코로나19 영향으로 1분기 주요 기업 영업이익 전망치가 한 달 새 10% 넘게 줄어들며 지난해 대비 감소세로 돌아선 것으로 조사됐습니다.금융정보업체 인포맥스가 증권사 3곳 이상의 실적 추정치가 있는 국내 상장 기업 63곳의 1분기 영업이익 전망치를 집계한 결과 지난 12일 기준으로 14조45억원으로 나타났습니다.국내에서 코로나19 확진자가 발생하기 전인 지난달 12일 기준 전망치 15조6천77억 원과 비교했을 때 10.27% 내려간 수치입니다.이는 또 지난해 같은 기간 영업이익 14조3천747억 원과 비교해도 2.58% 적은 수준입니다.애초 한 달 전까지만 해도 기업 실적 전망치는 지난해 같은 기간 대비 8.58% 증가할 것으로 예상됐지만 다시 감소세로 돌아선 것입니다.기업별로 보면 조사 대상 기업 가운데 영업이익 전망치가 줄어든 곳은 43곳이었고 영업이익이 늘어난 기업은 17곳에 그쳤습니다.3곳은 영업이익 전망치가 한 달 전과 같았습니다.10곳 가운데 7곳은 1분기 실적에 대한 눈높이가 낮아진 셈입니다.이 가운데 실적에 가장 크게 타격을 받을 것으로 전망된 기업은 정유 업체인 에쓰오일과 SK이노베이션으로, 올해 1분기 영업이익 전망치가 한 달 전보다 각각 82.38%, 71.12%씩 하향 조정됐습니다.또, 롯데케미칼이 39.14%, LG화학 38.85%, SKC 21.38% 감소했고, 현대제철과 포스코도 철강기업 등 52.75%, 15.45% 등 철강 기업들도 실적 눈높이가 단기간에 크게 내려갔습니다.이는 코로나19 영향으로 관련 수요가 감소한 데 따른 것으로 풀이됩니다.정유·화학·철강 등 업종 기업은 대개 다른 업종과 비교해 경기 변동 영향을 많이 받는 경기민감주로 분류되는데, 이번에도 코로나19 사태에 따른 타격을 가장 먼저 반영한 것입니다.그 외 코로나19 영향으로 항공 이용자 수가 줄며 \'직격타\'를 맞고 있는 대한항공 역시 1분기 영업이익 전망치가 한 달 새 10.30% 줄었고, 대표적인 중국 소비주로 꼽히는 화장품 기업 아모레퍼시픽 19.79% 영업이익 전망치가 급감했습니다.또 올해 반도체 업황 회복에 대한 기대감으로 최근 잇따라 실적 전망치가 상향 조정됐던 삼성전자 역시 최근에는 숨 고르기에 들어간 모습입니다.한세현 기자(vetman@sbs.co.kr)▶ [뉴스레터] 데이터로 보는 뉴스의 맥락! 마부뉴스 구독해주세요!▶ 코로나19 속보 한눈에 보기※ ⓒ SBS & SBS Digital News Lab. : 무단복제 및 재배포 금지SBS 관련뉴스해당 언론사에서 선정하며 언론사 페이지(아웃링크)로 이동해 볼 수 있습니다.[단독] 대신-라임, 펀드 기획부터 한통속…녹음파일 확보[단독] 방역 수위 더 올린다…폐렴 환자 전수조사 검토""펭수 성대모사로 즐겁게""…퇴소 교민들이 전한 \'헌신\'번지는 불길 속 고립된 60대…창문 뜯고 구조한 시민류현진 ""작년보다 몸 상태 좋아""…최고 성적 기대감좋아요0훈훈해요0슬퍼요0화나요0후속기사 원해요0기사제공 :']"
6,삼성전자, 2020-02-1609:10,한국일보 ,시총 100대 기업 영업익 2년 새 32% 줄었다,https://finance.naver.com/news/news_read.nhn?article_id=0000467358&office_id=469&mode=search&query=삼성전자&page=4,"['       시총 100대 기업 영업익 2년 새 32% 줄었다      기사입력2020-02-16 09:10기사원문좋아요훈훈해요좋아요 평가하기공감좋아요0훈훈해요0슬퍼요0화나요0후속기사 원해요0댓글전체 86개 기업 중 45곳 영업익 줄어… 삼성, SK하이닉스 감소폭 가장 커 반도체 불황에 삼성전자와 SK하이닉스의 지난 해 영업이익이 크게 감소했다. 세계 경제의 저성장으로 국내 대기업들의 이익도 줄어든 것으로 나타났다. 사진은 서울 서초구 삼성전자 사옥 모습. 배우한 기자세계 경제의 저성장 국면이 길어지면서 지난 해 국내 대기업들의 이익도 뒷걸음질을 친 것으로 분석됐다.16일 기업평가사이트 CEO스코어가 국내 시가총액 100대 기업 중 지난 14일까지 잠정실적을 발표한 87개 기업의 실적을 조사한 결과, 매출액은 1,608조9,788억원, 영업이익과 순이익은 각각 101조9,442억원, 64조9,154억원으로 집계됐다. 영업이익은 전년 159조815억원에서 101조9,442억원으로 35.9% 급감했고 2년 전과 비교해도 32.1% 감소했다. 순이익 역시 1년만에 45.2% 줄었다.기업별로는 86곳 중 절반이 넘는 45곳의 영업이익이 줄었는데 반도체 불황으로 삼성전자와 SK하이닉스 이익이 크게 감소했다. 삼성전자의 경우엔 2017년 53조6,450억원에서 27조7,685억원으로 25조8,765억원(48.2%) 감소했고 SK하이닉스는 13조7,213억원에서 2조7,127억 원으로 11조86억원(80.2%) 줄었다. 전체 86개 기업 중 영업이익이 10조원 이상 감소한 곳은 삼성전자와 하이닉스 뿐이었다. 두 기업을 제외하면 시총 100대 기업의 영업이익과 순이익 감소폭은 각각 -13.6%, -39.3%로 줄어든다.나머지 기업 중 1조원 이상 줄어든 곳은 LG디스플레이 -3조8,210억원(-155.2%), LG화학 -2조328억원(-69.4%), SK이노베이션 -1조9,651억원(-60.8%), SK(주) -1조8,929억원(-32.3%), 롯데케미칼 -1조8,221억원(-62.2%), (주)LG -1조1,617억원(-53.1%), 현대제철 -1조363억원(-75.8%) 등이었다. 업종별로는 삼성전자와 SK하이닉스가 포함된 정보기술(IT)전기전자가 73조161억원에서 33조1,572억원으로 54.6%나 줄었고 석유화학업종 또한 61.4% 감소했다. 반면 은행(지주 포함)은 13조2,567억원에서 15조8,676억원으로 2조6,109억원(19.7%) 늘어나면서 증가액이 가장 많았다. 윤태석 기자 sportic@hankookilbo.com \xa0▶네이버에서 한국일보 뉴스를 받아보세요\xa0▶뉴\'잼을 보면 뉴스가 재밌다 [뉴스레터 구독하기]\xa0▶한국일보닷컴 바로가기한국일보 관련뉴스해당 언론사에서 선정하며 언론사 페이지(아웃링크)로 이동해 볼 수 있습니다.中교수가 올렸다 삭제된 논문 ""신종 코로나는 실험실서 유출""정부 ""日 크루즈선 한국인 19일 이전이라도 이송 추진""29번째 확진자는 종로구 주민 어디서 감염됐는지 모른다""신종코로나 확산 와중에?"" 일본 \'알몸 축제\' 1만명 운집엘리베이터서 만난 여고생 끌고 가려던 아랫집 남성좋아요0훈훈해요0슬퍼요0화나요0후속기사 원해요0기사제공 :']"
7,삼성전자, 2020-02-1609:05,매일경제 ,"‘코로나19’ 충격에 기업 실적 ‘빨간불’…상장사 1분기 실적전망, 10%↓",https://finance.naver.com/news/news_read.nhn?article_id=0004518310&office_id=009&mode=search&query=삼성전자&page=4,"['       ‘코로나19’ 충격에 기업 실적 ‘빨간불’…상장사 1분기 실적전망, 10%↓      기사입력2020-02-16 09:05기사원문좋아요훈훈해요좋아요 평가하기공감좋아요0훈훈해요0슬퍼요0화나요0후속기사 원해요0댓글[사진 출처=연합뉴스] 신종 코로나바이러스 감염증(코로나19) 여파로 주요 기업의 1분기 영업이익 전망치가 한 달 사이 10% 넘게 줄어들면서 지난해 대비 감소세로 돌아선 것으로 나타났다. 덩달아 코로나19 발생 이전에 1분기를 기점으로 반등할 것으로 전망되던 기업 실적 회복에도 비상이 걸렸다.16일 금융정보업체 인포맥스에 따르면 증권사 3곳 이상의 실적 추정치가 있는 국내 상장 기업 63곳의 1분기 영업이익 전망치(컨센서스)는 지난 12일 기준 14조45억원으로 집계됐다. 국내 코로나19 확진자가 발생하기 이전인 지난달 12일 기준 전망치(15조6077억원)와 비교하면 1조6032억원(10.27%) 하향 조정됐다. 지난해 같은 기간 영업이익(14조3747억원)과 비교해도 2.58% 적다.한 달 전까지만 해도 작년 동기 대비 8.58% 증가할 것으로 예상됐던 기업 실적 전망치는 다시 감소세로 돌아섰다.실적에 가장 크게 타격을 받을 것으로 전망된 기업은 정유 업체인 S-Oil, SK이노베이션이다. 올해 1분기 영업이익 전망치가 한 달 전보다 각각 82.38%, 71.12%씩 하향 조정됐다.롯데케미칼(-39.14%), LG화학(-38.85%), SKC(-21.38%) 등 화학 업체와 현대제철(-52.75%), 포스코(-15.45%) 등 철강 기업도 실적 눈높이가 내려갔다.정유·화학·철강 등은 다른 업종과 비교해 경기 변동 영향을 많이 받는 경기 민감주로 분류된다. 이번에도 코로나19 사태에 따른 타격을 가장 먼저 반영한 것이다.코로나19의 영향으로 항공 이용자 수가 줄어든 대한항공도 1분기 영업이익 전망치가 한 달 새 10.30% 감소했다.올해 반도체 업황 회복에 대한 기대감으로 최근 잇따라 실적 전망치가 상향 조정됐던 삼성전자와 SK하이닉스도 숨 고르기에 들어갔다.[디지털뉴스국 최기성 기자]▶기사공유하고 코인적립하세요 \'M코인\'▶네이버 메인에서 \'매일경제\'를 받아보세요\xa0▶뉴스레터 \'매콤달콤\' 구독[ⓒ 매일경제 & mk.co.kr, 무단전재 및 재배포 금지]매일경제 관련뉴스해당 언론사에서 선정하며 언론사 페이지(아웃링크)로 이동해 볼 수 있습니다.""삶 팍팍해져""…취업·사업·결혼 이민행렬5G폰 존재감 드러낸 삼성…글로벌 점유율 1위 \'굳건\'안지현 치어리더 비키니 공개…청순글래머 정석\'기생충\' 3초 등장···숟가락 얹으려던 칠레와인 역풍\'노브라 생방\' 임현주 아나운서, 누구?좋아요0훈훈해요0슬퍼요0화나요0후속기사 원해요0기사제공 :']"
8,삼성전자, 2020-02-1609:02,아시아경제 ,'코로나19'에 중단된 국내기업 중국공장 대부분 재가동,https://finance.naver.com/news/news_read.nhn?article_id=0004625028&office_id=277&mode=search&query=삼성전자&page=4,"['       \'코로나19\'에 중단된 국내기업 중국공장 대부분 재가동      기사입력2020-02-16 09:02기사원문좋아요훈훈해요좋아요 평가하기공감좋아요0훈훈해요0슬퍼요0화나요0후속기사 원해요0댓글지난 15일 코로나19가 시작된 중국 후베이성 우한의 모습 (사진=AP연합뉴스)[아시아경제 금보령 기자] 신종 코로나바이러스감염증(코로나19) 사태로 인해 가동을 중단했던 국내 기업들의 일부 중국 공장들도 이번 주 생산을 재개한다.중국 내 20여개 성·시가 춘절 연휴를 지난 9일까지 연장하면서 한국 기업들의 공장도 생산 차질을 빚었으나, 10일부터 대부분 재가동을 시작했다.16일 업계에 따르면 삼성전자 톈진 TV 공장은 오는 19일 생산 재개에 들어간다. 톈진 공장은 당초 10일에 재가동을 앞뒀으나 지방정부 지침에 따라 미뤄졌다.쑤저우 가전 공장은 지난 10일부터 이미 가동을 시작했다. 쑤저우 반도체 후공정 공장 및 시안 반도체 공장은 코로나19에 영향 받지 않고 계속 생산을 이어왔다.SK하이닉스 우시 반도체 공장 또한 코로나19에도 불구하고 최소 인력으로 정상 가동했다. 지난 10일을 기점으로 평일 근무 기준 인력을 배치했다.코로나19가 시작된 후베이성 우한에 위치한 SK종합화학 공장은 최소한의 인력으로 가동하고 있다. 다만 한국에 들어와 있는 중국 주재원들의 중국 복귀 시점은 미정이다.이처럼 국내 기업의 중국 공장들이 하나둘씩 가동을 재개하고 있지만 모든 인원이 복귀하지는 못하는 등 일부 차질은 지속되고 있다.한화솔루션의 경우 중국 춘절 연장 때문에 부품 조달이 어려워지면서 큐셀 부문 진천공장을 오는 20일까지 부분 가동할 예정이다.금보령 기자 gold@asiae.co.kr▶ 2020년 신년운세·사주·무료 토정비결 보러가기▶ 네이버에서 아시아경제 뉴스를 확인하세요. ▶ 놀 준비 되었다면 드루와! 드링킷!<ⓒ경제를 보는 눈, 세계를 보는 창 아시아경제 무단전재 배포금지>아시아경제 관련뉴스해당 언론사에서 선정하며 언론사 페이지(아웃링크)로 이동해 볼 수 있습니다.아들 졸업식에 나타난 이부진, 학부모들과…\'눈길\'""좀 보이면 어때"" 당당히 속옷 벗어 던진 아나운서\'시신 8구\' 영상 몰래 찍었던 中 시민기자…또?""쓴웃음만 난다""는 안철수, 지지율 조사 결과…\'中 통계 보느니 차라리…\' 한국 자료 요청한 WHO좋아요0훈훈해요0슬퍼요0화나요0후속기사 원해요0기사제공 :']"
