,회사명,날짜,언론사,기사제목,링크,본문
7,삼성전자, 2020-09-2409:00,연합뉴스 ,"삼성전자, '무선 충전 트리오'·'PD 배터리팩 20,000mAh' 2종 출시",https://finance.naver.com/news/news_read.nhn?article_id=0011902699&office_id=001&mode=search&query=삼성전자&page=8,"['       삼성전자, \'무선 충전 트리오\'·\'PD 배터리팩 20,000mAh\' 2종 출시      기사입력2020-09-24 09:00기사원문좋아요훈훈해요좋아요 평가하기공감좋아요0훈훈해요0슬퍼요0화나요0후속기사 원해요0댓글    (서울=연합뉴스) 삼성전자가 스마트 기기 배터리 걱정을 줄여 줄 액세서리 2종을 24일 출시한다.\'무선 충전 트리오\'는 스마트폰·무선 이어폰·스마트 워치 등 최대 3개 기기의 동시 무선 충전이 가능하다.     \'PD 배터리팩 20,000mAh\'은 25W 초고속 충전 기능을 지원하며, 한 번에 3개 스마트 기기의 동시 충전도 가능하다.     사진은 삼성 무선 충전 트리오 제품 이미지. 2020.9.24    [삼성전자 제공. 재판매 및 DB 금지]    photo@yna.co.kr▶코로나19 속보는 네이버 연합뉴스[구독 클릭]▶[팩트체크] 김수로의 하소연…코로나로 취소됐는데▶제보하기 연합뉴스 관련뉴스해당 언론사에서 선정하며 언론사 페이지(아웃링크)로 이동해 볼 수 있습니다.\xa0\'집단 성폭행\' 정준영·최종훈 오늘 최종형량 결정된다\xa0""수업은 비대면인데 캠퍼스에선 \'소맥 파티\'라니…""\xa0곽현화 상반신 노출 무단공개한 감독…법원 ""2천만원 배상""\xa0사용한 콘돔 32만개 재활용하려던 업자 적발\xa0캐릭터명이 \'박원순의너란비서\'… \'2차 가해 놀이터\' 된 게임좋아요0훈훈해요0슬퍼요0화나요0후속기사 원해요0기사제공 :']"
8,삼성전자, 2020-09-2408:49,이데일리 ,[오늘장 미리보기]포트 조정 필요…IT·자동차 비중 확대,https://finance.naver.com/news/news_read.nhn?article_id=0004744333&office_id=018&mode=search&query=삼성전자&page=8,"['       [오늘장 미리보기]포트 조정 필요…IT·자동차 비중 확대      기사입력2020-09-24 08:49기사원문좋아요훈훈해요좋아요 평가하기공감좋아요0훈훈해요0슬퍼요0화나요0후속기사 원해요0댓글오전 7시 이데일리TV 굿머니 방송DB금융투자 김현겸 과장 전화연결이데일리TV 굿머니 9월24일 방송[이데일리TV 성주원 기자] 24일 이데일리TV 굿머니는 오늘 장 미리보기 코너에서 김현겸 DB금융투자 과장과 함께 오늘 우리 장 대응 포인트를 정리했다. 삼성전자(005930)는 전거래일 5만8600원에 , 현대차(005380)는 17만9500원에 거래를 마쳤다.성주원 (sjw1@edaily.co.kr)▶ #24시간 빠른 #미리보는 뉴스 #eNews+▶ 네이버에서 \'이데일리 뉴스\'를 만나보세요▶ 빡침해소, 청춘뉘우스 \'스냅타임\'＜ⓒ종합 경제정보 미디어 이데일리 - 무단전재 & 재배포 금지＞이데일리 관련뉴스해당 언론사에서 선정하며 언론사 페이지(아웃링크)로 이동해 볼 수 있습니다.연평도 실종 공무원, 北총격 사망 추정…""월북 시도한 듯""오늘부터 지급되는 \'2차 재난지원금\'…일찍 받는 방법은?김연자 오열..임지안 누구? \'목포 살인사건 유가족\'곽현화, 노출신 무단공개 손배소 일부 승소 응원 감사트럼프-문재인 사이서 식사한 군인 ""시공간 떠난 느낌""좋아요0훈훈해요0슬퍼요0화나요0후속기사 원해요0기사제공 :']"
9,삼성전자, 2020-09-2408:47,뉴시스 ,"삼성전자, 브라질에 무풍에어컨 출시",https://finance.naver.com/news/news_read.nhn?article_id=0010093726&office_id=003&mode=search&query=삼성전자&page=8,"['       삼성전자, 브라질에 무풍에어컨 출시      기사입력2020-09-24 08:47기사원문좋아요훈훈해요좋아요 평가하기공감좋아요0훈훈해요0슬퍼요0화나요0후속기사 원해요0댓글[서울=뉴시스]삼성전자는 24일 브라질에 2020년 무풍에어컨 신모델을 출시했다고 밝혔다. (사진=삼성전자 제공) 2020.09.24.photo@newsis.com[사진 영상 제보받습니다] 공감언론 뉴시스가 독자 여러분의 소중한 제보를 기다립니다. 뉴스 가치나 화제성이 있다고 판단되는 사진 또는 영상을 뉴시스 사진영상부(n-photo@newsis.com)로 보내주시면 적극 반영하겠습니다.<ⓒ 공감언론 뉴시스통신사. 무단전재-재배포 금지>뉴시스 관련뉴스해당 언론사에서 선정하며 언론사 페이지(아웃링크)로 이동해 볼 수 있습니다.옆마을 女 2명 성폭행범 출소 직후 이장으로 뽑혀그제밤 충청도에 떨어진 달 만한 별똥별 정체는조두순, 출소후 안산으로… 결국 나영이 가족이 떠난다44층 아파트서 불…30대母, 아기 안은채 벽 뚫고 대피""나랑 하는게 신의 뜻"" 미성년자 수차례 성폭행좋아요0훈훈해요0슬퍼요0화나요0후속기사 원해요0기사제공 :']"
10,삼성전자, 2020-09-2408:47,뉴시스 ,"삼성전자, 브라질에 무풍에어컨 출시",https://finance.naver.com/news/news_read.nhn?article_id=0010093725&office_id=003&mode=search&query=삼성전자&page=8,"['       삼성전자, 브라질에 무풍에어컨 출시      기사입력2020-09-24 08:47기사원문좋아요훈훈해요좋아요 평가하기공감좋아요0훈훈해요0슬퍼요0화나요0후속기사 원해요0댓글[서울=뉴시스]삼성전자는 24일 브라질에 2020년 무풍에어컨 신모델을 출시했다고 밝혔다. (사진=삼성전자 제공) 2020.09.24.photo@newsis.com[사진 영상 제보받습니다] 공감언론 뉴시스가 독자 여러분의 소중한 제보를 기다립니다. 뉴스 가치나 화제성이 있다고 판단되는 사진 또는 영상을 뉴시스 사진영상부(n-photo@newsis.com)로 보내주시면 적극 반영하겠습니다.<ⓒ 공감언론 뉴시스통신사. 무단전재-재배포 금지>뉴시스 관련뉴스해당 언론사에서 선정하며 언론사 페이지(아웃링크)로 이동해 볼 수 있습니다.옆마을 女 2명 성폭행범 출소 직후 이장으로 뽑혀그제밤 충청도에 떨어진 달 만한 별똥별 정체는조두순, 출소후 안산으로… 결국 나영이 가족이 떠난다44층 아파트서 불…30대母, 아기 안은채 벽 뚫고 대피""나랑 하는게 신의 뜻"" 미성년자 수차례 성폭행좋아요0훈훈해요0슬퍼요0화나요0후속기사 원해요0기사제공 :']"
11,삼성전자, 2020-09-2408:47,뉴시스 ,"삼성전자, 브라질에 무풍에어컨 출시",https://finance.naver.com/news/news_read.nhn?article_id=0010093724&office_id=003&mode=search&query=삼성전자&page=8,"['       삼성전자, 브라질에 무풍에어컨 출시      기사입력2020-09-24 08:47기사원문좋아요훈훈해요좋아요 평가하기공감좋아요0훈훈해요0슬퍼요0화나요0후속기사 원해요0댓글[서울=뉴시스]삼성전자는 24일 브라질에 2020년 무풍에어컨 신모델을 출시했다고 밝혔다. (사진=삼성전자 제공) 2020.09.24.photo@newsis.com[사진 영상 제보받습니다] 공감언론 뉴시스가 독자 여러분의 소중한 제보를 기다립니다. 뉴스 가치나 화제성이 있다고 판단되는 사진 또는 영상을 뉴시스 사진영상부(n-photo@newsis.com)로 보내주시면 적극 반영하겠습니다.<ⓒ 공감언론 뉴시스통신사. 무단전재-재배포 금지>뉴시스 관련뉴스해당 언론사에서 선정하며 언론사 페이지(아웃링크)로 이동해 볼 수 있습니다.옆마을 女 2명 성폭행범 출소 직후 이장으로 뽑혀그제밤 충청도에 떨어진 달 만한 별똥별 정체는조두순, 출소후 안산으로… 결국 나영이 가족이 떠난다44층 아파트서 불…30대母, 아기 안은채 벽 뚫고 대피""나랑 하는게 신의 뜻"" 미성년자 수차례 성폭행좋아요0훈훈해요0슬퍼요0화나요0후속기사 원해요0기사제공 :']"
12,삼성전자, 2020-09-2408:45,파이낸셜뉴스 ,"삼성전자, 브라질서 무풍에어컨 신제품 선봬",https://finance.naver.com/news/news_read.nhn?article_id=0004500228&office_id=014&mode=search&query=삼성전자&page=8,"['       삼성전자, 브라질서 무풍에어컨 신제품 선봬      기사입력2020-09-24 08:45기사원문좋아요훈훈해요좋아요 평가하기공감좋아요0훈훈해요0슬퍼요0화나요0후속기사 원해요0댓글삼성전자 브라질 법인 직원이 무풍에어컨 신제품을 소개하고 있다. [파이낸셜뉴스] 삼성전자가 브라질에서 2020년 무풍에어컨 신모델을 선보였다.   삼성전자는 22~23일(현지시간) 양일간 미디어, 거래선 등 3000여명을 대상으로 온라인 신제품 발표회를 진행했다.   이 행사에서는 벽걸이형·카세트형(천장형 실내기) 등 무풍에어컨 신제품과 시스템에어컨 360, 대형 상업용 멀티(DVM) 등 다양한 가정용∙상업용 공조 솔루션이 소개됐다.   남반구에 위치한 브라질은 4·4분기부터 에어컨 여름 성수기에 접어 든다.   삼성전자는 브라질 시장에서 2017년부터 무풍에어컨을 판매해 왔다. 올해는 무풍 냉방 기능을 적용한 라인업을 대폭 늘려 현지 프리미엄 시장 공략을 본격화할 계획이다. 삼성전자는 가정용뿐 아니라 대형 병원, 쇼핑몰 등 기업간거래(B2B) 시장에서도 무풍 에어컨 판매를 확대하고 있다.    km@fnnews.com 김경민 기자   ▶ 헉! 소리나는 스!토리 뉴스 [헉스]▶ \'아는 척\'하고 싶은 당신을 위한 [두유노우]▶ 날로먹고 구워먹는 금융이슈 [파인애플]  ※ 저작권자 ⓒ 파이낸셜뉴스. 무단 전재-재배포 금지파이낸셜뉴스 관련뉴스해당 언론사에서 선정하며 언론사 페이지(아웃링크)로 이동해 볼 수 있습니다.강남 ""이상화 내 벌이를 우습게 본다""부부관계 기피하는 前걸그룹 멤버 남편 ""옷을..""1년前 박원순 생일 영상 공개, 여성이..놀라운 반전옥중서신 계속 보내는 전광훈, 의미심장 고백 ""내년 3월..""호텔서 숨진 채 발견된 개신교단 직원, 시신 보니좋아요0훈훈해요0슬퍼요0화나요0후속기사 원해요0기사제공 :']"
13,삼성전자, 2020-09-2408:45,이데일리 ,[객장의시선]오늘 장 '하락' 전망…조정 후 반등 기대 종목 주목,https://finance.naver.com/news/news_read.nhn?article_id=0004744323&office_id=018&mode=search&query=삼성전자&page=8,"['       [객장의시선]오늘 장 \'하락\' 전망…조정 후 반등 기대 종목 주목      기사입력2020-09-24 08:45기사원문좋아요훈훈해요좋아요 평가하기공감좋아요0훈훈해요0슬퍼요0화나요0후속기사 원해요0댓글오전 7시 이데일리TV 굿머니 방송유안타증권 백인범 과장 전화연결이데일리TV 굿머니 9월24일 방송[이데일리TV 성주원 기자] 24일 이데일리TV 굿머니는 객장의 시선 코너를 통해 오늘 장 하락 흐름을 예측했다. 백인범 유안타증권 과장은 조정 이후 반등이 강할 종목군을 주목해야 한다고 조언했다.2차전지주의 경우 전날 테슬라 배터리데이 이벤트 이후 실망매물이 출회됐지만 모멘텀 보유 종목 위주로 옥석가리기가 중요하다며 에코프로비엠(247540), 대주전자재료(078600), 동화기업(025900) 등을 눈여겨 볼 필요가 있다고 말했다.삼성전자(005930)가 새로운 모멘텀으로 반도체 파운드리 사업에 힘을 싣고 있는 가운데 비메모리 관련주에 주목하는 것도 유효하다고 백 과장은 덧붙였다. 에이디테크놀로지(200710), 에스앤에스텍(101490), 에프에스티(036810) 등 관련 공정 및 소재 부품 관련주를 관심있게 지켜볼 것을 조언했다.   성주원 (sjw1@edaily.co.kr)▶ #24시간 빠른 #미리보는 뉴스 #eNews+▶ 네이버에서 \'이데일리 뉴스\'를 만나보세요▶ 빡침해소, 청춘뉘우스 \'스냅타임\'＜ⓒ종합 경제정보 미디어 이데일리 - 무단전재 & 재배포 금지＞이데일리 관련뉴스해당 언론사에서 선정하며 언론사 페이지(아웃링크)로 이동해 볼 수 있습니다.연평도 실종 공무원, 北총격 사망 추정…""월북 시도한 듯""오늘부터 지급되는 \'2차 재난지원금\'…일찍 받는 방법은?김연자 오열..임지안 누구? \'목포 살인사건 유가족\'곽현화, 노출신 무단공개 손배소 일부 승소 응원 감사트럼프-문재인 사이서 식사한 군인 ""시공간 떠난 느낌""좋아요0훈훈해요0슬퍼요0화나요0후속기사 원해요0기사제공 :']"
14,삼성전자, 2020-09-2408:35,매일경제 ,"삼성, 브라질에 무풍에어컨 신모델 출시…""현지 공략 강화""",https://finance.naver.com/news/news_read.nhn?article_id=0004662312&office_id=009&mode=search&query=삼성전자&page=8,"['       삼성, 브라질에 무풍에어컨 신모델 출시…""현지 공략 강화""      기사입력2020-09-24 08:35기사원문좋아요훈훈해요좋아요 평가하기공감좋아요0훈훈해요0슬퍼요0화나요0후속기사 원해요0댓글삼성전자 브라질 법인 직원이 무풍에어컨 신제품을 소개하고 있다. [사진 제공 = 삼성전자] 삼성전자가 브라질에서 2020년 무풍에어컨 신모델을 출시하고 현지 시장 공략에 나선다.삼성전자는 22~23일 이틀간 미디어, 거래선 등 3000여명을 대상으로 온라인 신제품 발표회를 진행했다고 24일 밝혔다.이 행사에서는 벽걸이·카세트형(천장형 실내기) 등 무풍에어컨 신제품과 시스템에어컨 360, 대형 상업용 멀티(DVM) 등 다양한 가정용·상업용 공조 솔루션이 소개됐다.남반구에 위치한 브라질은 4분기부터 에어컨 여름 성수기에 접어든다.삼성전자는 브라질 시장에서 2017년부터 무풍에어컨을 판매해 왔으며, 올해는 무풍 냉방 기능을 적용한 라인업을 대폭 늘린다는 계획이다.삼성전자는 가정용뿐만 아니라 대형 병원, 쇼핑몰 등 B2B 시장에서도 무풍 에어컨 판매를 확대해 프리미엄 시장에서의 입지를 강화하고 있다.삼성전자 브라질 법인 김재훈 상무는 ""무풍에어컨 판매 확대를 통해 브라질 에어컨 시장에서 혁신 기술과 디자인으로 시장 트렌드를 주도해 나갈 것""이라고 말했다.[김승한 기자 winone@mkinternet.com]▶ 네이버 메인에서 \'매일경제\'를 받아보세요▶ 궁금한 제조과정 영상으로 보세요. \'이렇게 만들죠\'▶ 매일매일 색다른 뉴스레터 \'매콤달콤\' 구독하세요[ⓒ 매일경제 & mk.co.kr, 무단전재 및 재배포 금지]매일경제 관련뉴스해당 언론사에서 선정하며 언론사 페이지(아웃링크)로 이동해 볼 수 있습니다.""공시가發 세금폭탄 허리휘는데 월세도 못받나""…상가주인 \'부글부글\'갤S20 뺨치는데 보급형폰?…팬 에디션 출격김민형 SBS아나운서 퇴사…호반그룹 대표와 교제경남도, 해검Ⅱ 운항 등 \'무인선박\' 실증 성공아이비 ""주원과 키스신 후 100번 넘게 사과""…왜?좋아요0훈훈해요0슬퍼요0화나요0후속기사 원해요0기사제공 :']"
15,삼성전자, 2020-09-2408:35,MBN ,"""스펙 유지하고 가격 낮췄다""…갤럭시S20 FE, 10월 전세계 출시",https://finance.naver.com/news/news_read.nhn?article_id=0001502853&office_id=057&mode=search&query=삼성전자&page=8,"['       ""스펙 유지하고 가격 낮췄다""…갤럭시S20 FE, 10월 전세계 출시      기사입력2020-09-24 08:35기사원문좋아요훈훈해요좋아요 평가하기공감좋아요0훈훈해요0슬퍼요0화나요0후속기사 원해요0댓글국내 출시되는 갤럭시S20 FE 5종 제품 이미지 / 사진=삼성전자 제공삼성전자가 어제(23일) 온라인을 통해 갤럭시 언팩을 열고 \'갤럭시S20 FE\'를 공개했습니다.이 제품은 올 상반기 출시된 갤럭시S20의 보급형 버전입니다. 이용자 선호도가 높은 기능을 그대로 유지하되 가격을 대폭 낮췄습니다.갤럭시S20 FE는 10월 2일 전세계 시장에 출시되며, 제품 사양과 색상은 국가별로 상이할 수 있습니다. 국내는 10월 6일부터 사전 예약을 받으며 공식출시는 10월 중순입니다.국내 출고가는 아직 확정되지 않았으나 80~90만 원으로 예상됩니다. 갤럭시S20(124만8500원) 대비 최대 40만 원가량 저렴해집니다. 미국 출시 가격은 699달러(약 81만3000원)입니다.9월 23일 온라인으로 진행된 `삼성 갤럭시 언팩`에서 삼성전자 글로벌전략실 마이클 랜돌프가 \'갤럭시S20 FE\'를 소개하는 모습 / 사진=삼성전자 제공이 제품은 갤럭시S20의 디스플레이·인공지능(AI) 카메라·고사양 칩셋·대용량 배터리 등 소비자들이 가장 선호하는 기능과 성능을 그대로 제공합니다.갤럭시S20 FE는 3200만 고화소의 전면 카메라와 갤럭시 스마트폰 중 가장 큰 듀얼 픽셀 이미지 센서를 후면에 탑재했습니다.사용자는 3200만 화소의 테트라 비닝(Tetra binning) 기술이 적용된 전면 카메라를 활용해 저조도 환경에서도 또렷한 셀피 촬영이 가능합니다. 라이브 포커스 기능을 활용해 배경을 감각적으로 흐릿하게 처리한 셀피 촬영도 할 수 있습니다.갤럭시S20 FE는 후면에 갤럭시 스마트폰 중 가장 큰 듀얼 픽셀 이미지 센서를 탑재해 어떤 상황에서도 밝고 선명한 사진 촬영이 가능합니다. 특히, AI 기반의 멀티 프레임 프로세싱으로 여러 프레임 정보를 빠르게 파악해 배경의 노이즈나 흔들림을 줄여줍니다.또 멀리 있는 피사체도 또렷하게 촬영할 수 있는 스페이스 줌 기능을 지원합니다. 광학 줌을 통해 화질의 손상 없이 최대 3배까지, AI 기반의 슈퍼 레졸루션 줌 기능을 결합해 최대 30배까지 줌 촬영이 가능합니다.후면에는1200만(기본), 1200만(초광각), 800만(망원) 화소의 트리플 카메라를 탑재했습니다.삼성 갤럭시S20 FE_6종 / 사진=삼성전자 제공갤럭시S20 FE는 6.5형의 인피니티-O 슈퍼 아몰레드 디스플레이와 4500mAh의 대용량 배터리가 장착되고 최대 25W 초고속 충전을 지원합니다.더불어 IP68 등급의 방수방진 지원하며 마이크로SD 카드 슬롯을 탑재해 추가로 최대 1TB 용량의 메모리를 확장할 수도 있습니다.삼성전자는 갤럭시S20 FE에 대해 3세대 안드로이드 운영체제(OS) 업그레이드를 보장해 항상 사용자들이 안전한 환경에서 최신 모바일 기능을 사용할 수 있도록 할 계획입니다.갤럭시S20 FE는 클라우드 레드·오렌지·라벤더·민트·네이비·화이트 총 6가지 색상으로 출시됩니다. 국내에서는 클라우드 레드·라벤더·민트·네이비·화이트 5가지 색상의 5G 모델로 출시됩니다.노태문 삼성전자 무선사업부장(사장)은 ""삼성전자는 지속적으로 팬들의 피드백을 듣고 소통하고 있으며, 갤럭시S20 출시 후, 가장 선호하는 부분과 가장 자주 사용하는 기능, 새 스마트폰에 기대하고 있는 점 등에 귀를 기울였다""며 ""갤럭시S20 FE는 의미 있는 혁신이 담긴 갤럭시S20 시리즈의 확장 모델로 최고의 갤럭시 스마트폰 경험을 더 많은 소비자들이 누릴 수 있게 할 것""이라고 말했습니다.[MBN 온라인뉴스팀]▶ 네이버에서 \'MBN뉴스\'를 만나보세요!▶ MBN 무료 고화질 온에어 서비스 GO!< Copyright ⓒ MBN(www.mbn.co.kr) 무단전재 및 재배포 금지 >MBN 관련뉴스해당 언론사에서 선정하며 언론사 페이지(아웃링크)로 이동해 볼 수 있습니다.""연평도 실종 공무원, 북에서 피격 사망한 듯""가해자 대신 피해자가 이사…조두순 피해자 가족 ""떠난다""\'집단 성폭행\' 정준영·최종훈 오늘 최종 선고무허가 체온계 판 업체 무더기 적발…불량제품도 상당수정은지 지각 \'어제 잠을 못 자...변명 없이 늦지 않도록 할 터\'(가요광장)좋아요0훈훈해요0슬퍼요0화나요0후속기사 원해요0기사제공 :']"
16,삼성전자, 2020-09-2408:33,파이낸셜뉴스 ,"""삼성전자, 반도체 영업이익률 하락폭 제한적""-KB증권",https://finance.naver.com/news/news_read.nhn?article_id=0004500222&office_id=014&mode=search&query=삼성전자&page=8,"['       ""삼성전자, 반도체 영업이익률 하락폭 제한적""-KB증권      기사입력2020-09-24 08:33기사원문좋아요훈훈해요좋아요 평가하기공감좋아요0훈훈해요0슬퍼요0화나요0후속기사 원해요0댓글   [파이낸셜뉴스] KB증권은 삼성전자에 대해 ""올해 4·4분기 삼성전자 영업이익의 67%인 반도체 부문의 가격이 바닥을 칠 전망이지만 원가구조 개선으로 반도체 영업이익률 하락 폭이 제한적""이라며 목표주가 8만원, 투자의견 \'매수\'를 유지한다고 24일 밝혔다.   김동원 연구원은 ""반도체 부문 가격 하락, D램 가격 하락에도 1y(10나노미터 중후반) 나노 비중 확대와 생산수율 향상에 따라 원가 구조가 개선될 전망""이라며 이같이 말했다.   이어 ""삼성전자의 3·4분기 영업이익은 작년 동기 대비 43% 증가한 11조1000억원으로 추정된다""면서 ""최근 높아진 컨센서스(9조9000억원)를 12% 상회할 것""이라고 예상했다.   그러면서 ""삼성전자 주가는 반도체 가격 하락에 따른 실적 악화, 보험업법 개정안에 의한 오버행 이슈 우려 등으로 연초 대비 6% 상승에 그치고 있다""면서 ""그러나 내년 삼성전자는 분기 평균 11조원의 영업이익 창출이 예상돼 과거와 달라진 실적 체력을 나타낼 전망""이라고 덧붙였다.    khj91@fnnews.com 김현정 기자   ▶ 헉! 소리나는 스!토리 뉴스 [헉스]▶ \'아는 척\'하고 싶은 당신을 위한 [두유노우]▶ 날로먹고 구워먹는 금융이슈 [파인애플]  ※ 저작권자 ⓒ 파이낸셜뉴스. 무단 전재-재배포 금지파이낸셜뉴스 관련뉴스해당 언론사에서 선정하며 언론사 페이지(아웃링크)로 이동해 볼 수 있습니다.강남 ""이상화 내 벌이를 우습게 본다""부부관계 기피하는 前걸그룹 멤버 남편 ""옷을..""1년前 박원순 생일 영상 공개, 여성이..놀라운 반전호텔서 숨진 채 발견된 개신교단 직원, 시신 보니옥중서신 계속 보내는 전광훈, 의미심장 고백 ""내년 3월..""좋아요0훈훈해요0슬퍼요0화나요0후속기사 원해요0기사제공 :']"
