,회사명,날짜,언론사,기사제목,링크,본문
0,삼성전자, 2020-11-0215:54,이데일리 ,[코스피 마감]개인 순매도에도 1% 넘게 올라…2300선 재돌파,https://finance.naver.com/news/news_read.nhn?article_id=0004775497&office_id=018&mode=search&query=삼성전자&page=4,"['       [코스피 마감]개인 순매도에도 1% 넘게 올라…2300선 재돌파      기사입력2020-11-02 15:54기사원문좋아요훈훈해요좋아요 평가하기공감좋아요0훈훈해요0슬퍼요0화나요0후속기사 원해요0댓글개인 나홀로 팔자…1076억원 순매도업종별 전부 오름세…은행 3%↑시총상위종목 대부분 상승…KB금융·신한지주 4%↑[이데일리 유준하 기자] 2일 코스피가 3거래일 만에 상승세로 전환하며 상승 마감했다. 지난달 30일 2% 넘게 내렸으나 이날 다시 1% 넘게 오르며 2300선을 하루 만에 회복했다. (자료=신한HTS)2일 한국거래소에 따르면 코스피 지수는 전 거래일보다 1.46%(33.01포인트) 오른 2300.16을 기록했다. 지난 주말 뉴욕 증시는 대선 불확실성과 코로나 재확산 우려에 하락마감했지만 국내 증시는 견조한 모습을 보였다. 김용구 삼성증권 연구원은 “대선이 막바지에 다다른 만큼 어그러졌던 투자 심리가 정리가 된 양상”이라면서 “미국 대선과 관련해서는 조심스럽지만 사전투표와 우편투표 비중이 상당한 만큼 막판 뒤집기보다 여론조사 추이대로 바이든이 우세해 보인다”고 말했다.코로나19 재확산과 이에 따른 봉쇄 여파도 국내 증시에 큰 걸림돌이 되지는 않았다. 윤지호 이베스트투자증권 센터장 역시 “시장은 지난 3월과 다르게 지금은 많은 것이 준비돼 있다”면서 “대선이 누가 되는지 여부를 떠나 글로벌 경기가 내년에 더 회복될 가능성이 높아지고 있기 때문에 연말에 변동성 클 때 주식을 나눠서 매수하고 내년 상반기에 매도하는 게 이 시점에서는 가장 좋은 전략이라고 본다”고 조언했다.수급별로는 외국인과 기관이 각각 490억원, 488억원 어치를 순매수했다. 반면 개인은 1076억원 어치를 순매도했다. 프로그램 매매는 차익이 123억원, 비차익이 172억원 순매수로 295억원 순매수를 기록했다. 업종별로는 전부 상승했다. 은행이 3% 넘게 올랐고 철강및금속, 운수창고, 금융업, 기계, 보험, 운수장비가 2% 넘는 상승세를 보였다. 증권과 전기가스업, 화학, 의약품, 유통업, 종이목재 등은 1% 대 올랐다.시가총액 상위종목은 대부분 올랐다. KB금융(105560)과 신한지주(055550)는 이날 4% 대 급등했다. 현대차(005380)와 POSCO(005490)는 3%대 상승했으며 삼성바이오로직스(207940)와 삼성전자우(005935), LG생활건강(051900)은 2% 대 올랐다. 대장주 삼성전자(005930)와 LG화학(051910), 셀트리온(068270), 카카오(035720)는 1% 대 상승했다.반면 삼성바이오로직스(207940)는 1% 넘게 내렸으며 SK하이닉스(000660)와 삼성SDI(006400)는 1% 미만 소폭 하락했따.종목별로는 만도(204320)가 아마존의 배송차량에 핵심 부품을 공급한다는 소식에 5% 넘게 올랐다. 세종공업(033530)은 자회사 모비어스앤벨류체인과 LG CNS가 스마트 물류 구축 사업에 관한 업무협약(MOU)을 체결했다는 소식에 3% 대 상승했다.한편 이날 거래량은 6억6456만9000주, 거래대금은 8조4136억500만원으로 집계됐다. 상한가 4개 종목을 포함해 679개 종목이 올랐고, 하한가 없이 165개 종목이 내렸다. 보합권에 머문 종목은 62개였다.유준하 (xylitol@edaily.co.kr)▶ #24시간 빠른 #미리보는 뉴스 #eNews+▶ 네이버에서 \'이데일리 뉴스\'를 만나보세요▶ 빡침해소, 청춘뉘우스 \'스냅타임\'＜ⓒ종합 경제정보 미디어 이데일리 - 무단전재 & 재배포 금지＞이데일리 관련뉴스해당 언론사에서 선정하며 언론사 페이지(아웃링크)로 이동해 볼 수 있습니다.이춘재 ""용의선상에 오르지 않았던 것 이해 안 돼""""이제 가면 언제"", ""사실상 종신형"" MB 재수감檢출신 변호사, 조국 일가 수사가 진짜 검란 아닌가함소원♥진화, 둘째 임신 성공?..산부인과 검진 결과는이춘재 ""진실만을 말하겠다..연쇄살인 진범은 나""좋아요0훈훈해요0슬퍼요0화나요0후속기사 원해요0기사제공 :']"
1,삼성전자, 2020-11-0215:52,한국경제TV ,"코스피, 반발매수세 유입에 2,300선 탈환",https://finance.naver.com/news/news_read.nhn?article_id=0000912276&office_id=215&mode=search&query=삼성전자&page=4,"['       코스피, 반발매수세 유입에 2,300선 탈환      기사입력2020-11-02 15:52기사원문좋아요훈훈해요좋아요 평가하기공감좋아요0훈훈해요0슬퍼요0화나요0후속기사 원해요0댓글[한국경제TV 신재근 기자]코스피가 하루 만에 2,300선을 탈환했다.2일 코스피는 전 거래일 대비 33.01포인트(1.46%) 오른 2,300.16에 거래를 마쳤다.지난달 30일 지수 하락을 주도한 외국인과 기관이 모두 순매수로 돌아서며 지수를 이끌었다.외국인은 유가증권시장에서 476억원을, 기관은 487억원을 각각 순매수했다.노동길 NH투자증권 연구원은 ""지난주 지수 낙폭이 컸기 때문에 일부 되돌림 정도로 보고 있다""고 말했다.미국 대선이 눈앞으로 다가오는 등 시장 변동성은 언제든 확대될 수 있다는 것이다.코스피 시가총액 상위 종목은 현대차(3.65%)를 필두로 삼성전자(1.41%), 삼성바이오로직스(2.35%), LG화학(1.96%), 셀트리온(1.45%), 카카오(1.36%), LG생활건강(2.07%) 등이 모두 올랐다.SK하이닉스(-0.38%), NAVER(-1.55%), 삼성SDI(-0.45%)는 하락했다.코스닥도 1%대 반등했다.코스닥지수는 전장 대비 10.30포인트(1.30%) 오른 802.95에 장을 마감했다.외국인(1,206억원 순매수)의 순매수 속에 기관(89억원 순매수)도 매수에 가담했다.반면 개인(1,147억원 순매도)은 IT업종을 중심으로 매도했다.코스닥 시총 상위 종목은 CJ ENM(-0.23%), 에이치엘비(보합)를 제외하고 모두 상승했다.카카오게임즈(2.44%)와 제넥신(3.55%), 셀트리온제약(1.75%), 에코프로비엠(1.69%)의 상승폭이 두드러졌다.달러·원 환율은 소폭 내렸다.서울 외환시장에서 달러·원 환율은 전장보다 1.5원 내린 달러당 1,133.6원에 종가가 결정됐다.신재근기자 jkluv@wowtv.co.kr▶ 네이버 홈에서 [한국경제TV] 채널 구독하기 [생방송보기]▶ 대한민국 재테크 총집결! - [증권 / 주식상담 / 부동산]ⓒ 한국경제TV, 무단 전재 및 재배포 금지한국경제TV 관련뉴스해당 언론사에서 선정하며 언론사 페이지(아웃링크)로 이동해 볼 수 있습니다.[속보] 개그우먼 박지선, 모친과 숨진 채 발견...극단선택 추정""이효리, 임신했나""…5년 후 방송복귀 선언홍탁집 아들 결혼 골인…""초심 잃지않게 도와준 아내""결혼 앞둔 양준혁, 전 연인에 피소…""정면돌파 할 것""오뚜기 딸 함연지 ""수입? 남편 카드+회장님 찬스""좋아요0훈훈해요0슬퍼요0화나요0후속기사 원해요0기사제공 :']"
2,삼성전자, 2020-11-0215:52,뉴스1 ,[시황종합] 코스피 1.5% 상승 2300선 회복…코스닥도 800선 올라,https://finance.naver.com/news/news_read.nhn?article_id=0004965727&office_id=421&mode=search&query=삼성전자&page=4,"['       [시황종합] 코스피 1.5% 상승 2300선 회복…코스닥도 800선 올라      기사입력2020-11-02 15:52기사원문좋아요훈훈해요좋아요 평가하기공감좋아요0훈훈해요0슬퍼요0화나요0후속기사 원해요0댓글기관·외국인 순매수…하락 출발 삼전·LG화학 상승 마감코스닥 10.30p 오른 802.95…환율은 1.5원 내린 1133.6원29일 서울 중구 KEB 하나은행 명동점 딜링룸 전광판에 코스피 지수가 전 거래일 대비 18.59p(0.79%) 하락한 2,326.67을 나타내고 있다. 2020.10.29/뉴스1 © News1 이승배 기자(서울=뉴스1) 정은지 기자 = 2일 코스피 지수가 1% 넘게 상승하며 2300선을 회복했다. 이날 코스피 지수는 전일 대비 33.01p(1.46%) 오른 2300.16에 거래를 마쳤다. 2270선으로 출발한 코스피 지수는 삼성전자 등 대형주 반등에 상승 전환한 뒤 오름폭을 확대했다. 외국인과 기관이 각각 490억원과 487억원을 순매수한 반면 개인은 1076억원을 순매도했다. 외국인과 기관의 순매수 전환은 각각 3일과 5일 만이다. 시가총액 상위 종목 중 현대차가 6000원(3.65%) 오른 17만500원으로 거래를 마쳤고 삼성바이오로직스(2.35%), 삼성전자우(2.20%), LG화학(1.96%), 셀트리온(1.45%), 삼성전자(1.41%), 카카오(1.36%) 등도 상승 마감했다. 이 중 삼성전자는 장 초반 1% 넘게 하락하며 5만6000원선까지 밀렸으나 결국 1% 상승 마감했다. 코스닥 지수는 10.30p(1.30%) 상승한 802.95로 마감하며 800선을 넘어섰다. 외국인이 1198억원과 기관이 89억원을 순매수한 가운데 개인은 1146억원을 팔았다. 시총 상위 종목 중에선 제넥신(3.55%), 카카오게임즈(2.44%), 셀트리온제약(1.75%), 에코프로비엠(1.69%), 씨젠(1.10%) 등이 올랐다. 서울외환시장에서 달러/원 환율은 1.5원 내린 1133.6원으로 마감했다.ejjung@news1.kr▶ 네이버 메인에서 [뉴스1] 구독하기!▶  뉴스1 바로가기 ▶  코로나19 뉴스 © 뉴스1코리아(news1.kr), 무단 전재 및 재배포 금지뉴스1 관련뉴스해당 언론사에서 선정하며 언론사 페이지(아웃링크)로 이동해 볼 수 있습니다.김지혜 ""여성들 평균 12분? 박준형과 4분이면 돼"" 폭탄발언""5년후 만나요"" 이효리, 의미심장 선언…""혹시 임신?"" 궁금증↑이도현 측 \'럽스타그램\' 부인 ""여친 아니다""홍석천 ""나한테 돈 안갚은 연예인, 방송국서 마주칠때도 있어""이효리 ""5년 후에 만나자""…작별인사 \'깜짝\'좋아요0훈훈해요0슬퍼요0화나요0후속기사 원해요0기사제공 :']"
3,삼성전자, 2020-11-0215:49,매일경제 ,증시 불확실성 걷히나…코스피 1% 대 강세 마감,https://finance.naver.com/news/news_read.nhn?article_id=0004687072&office_id=009&mode=search&query=삼성전자&page=4,"['       증시 불확실성 걷히나…코스피 1% 대 강세 마감      기사입력2020-11-02 15:49기사원문좋아요훈훈해요좋아요 평가하기공감좋아요0훈훈해요0슬퍼요0화나요0후속기사 원해요0댓글美 대선·코로나 백신 등 줄줄이 증시 모멘텀 올해 최대 빅이벤트 미국 대선을 앞두고 시장이 꿈틀거리고 있다. 코스피 1% 이상 급등하며 2300선을 회복했다.2일 코스피는 전일대비 33.01포인트(1.46%) 오른 2300.16에 장을 마쳤다.이날 11.78포인트(0.52%) 오른 2278,93에 출발한 지수는 장 초반 강보합권에 머물고 있다. 미국 대선을 앞두고 약세장이 펼쳐졌던 증시는 이날 2280선까지 오르면서 회복 조짐이 나타나고 있다.지난달에는 미국 대선과 신종 코로나바이러스 감염증(코로나19) 변수 그리고 국내에서는 대주주 양도세 이슈가 동시에 맞물리며 증시 압박을 받았다. 신승진 삼성증권 연구원은 ""11월은 이러한 불확실성들이 하나씩 해소되면서 미국 대선이 끝나면 추가 부양책은 속도가 오히려 빨라질 가능성이 높다""며 ""국내에서는 주식 양도세 대주주 이슈가 이달 중 결론이 날 것으로 기대를 모으면서 시장의 변동성이 완화될 것""이라고 설명했다.또 이은택 KB증권 연구원은 ""이번주 미국 대선을 앞두고 사전투표율 증가 등으로 당선인 확정이 지연되고, 트럼프가 불복하는 상황이 나올 가능성도 높다는 점이 시장이 가장 우려하는 부분""이라며 ""추가부양책, 대선 이후 정국, 코로나 확산 등을 볼 때 대선 불확실성이 해소되면 반등 후 연말까지 완만한 추세가 나타날 것""으로 예상했다.이날 유가증권시장에서는 전 업종 강세를 나타냈다. 은행, 철강·금속, 운수창고, 금융업, 기계, 보험, 운송장비 등이 올랐다.매매주체별로 개인이 1076억원 순매도 하고 외국인과 기관이 각각 477억원, 488억원 순매도했다. 프로그램 매매는 294억원 매수우위를 나타냈다.시가총액 상위 종목들은 업종별로 대부부 올랐다. SK하이닉스, NAVER, 삼성SDI가 떨어진 것을 제외하면 삼성전자, 삼성바이오로직스, LG화학, 현대타, 셀트리온, 카카오 등은 올랐다.이날 유가증권시장에서는 943개 종목이 오르고 321개 종목이 내렸다.코스닥은 전일 대비 10.30포인트(1.30%) 오른 802.95에 마쳤다.[김규리 기자 wizkim61@mkinternet.com]▶ 네이버 메인에서 \'매일경제\'를 받아보세요▶ 궁금한 제조과정 영상으로 보세요. \'이렇게 만들죠\'▶ 매일매일 색다른 뉴스레터 \'매콤달콤\' 구독하세요[ⓒ 매일경제 & mk.co.kr, 무단전재 및 재배포 금지]매일경제 관련뉴스해당 언론사에서 선정하며 언론사 페이지(아웃링크)로 이동해 볼 수 있습니다.이명박 ""나를 구속할 순 있어도 진실 가둘 수 없어""이춘재 ""화성연쇄살인 14건 진범 내가 맞다""내 월급, 국세청이 파악한다?…전담조직 신설""내년 전국 집값 0.5% 떨어지고 전셋값 5.0% 오를 것""배슬기♥심리섭 웨딩화보 공개…13일 결혼좋아요0훈훈해요0슬퍼요0화나요0후속기사 원해요0기사제공 :']"
4,삼성전자, 2020-11-0215:47,머니투데이 ,3분기 실적 시즌 막바지...삼성전자 빼면 '평범',https://finance.naver.com/news/news_read.nhn?article_id=0004493602&office_id=008&mode=search&query=삼성전자&page=4,"['       3분기 실적 시즌 막바지...삼성전자 빼면 \'평범\'      기사입력2020-11-02 15:47기사원문좋아요훈훈해요좋아요 평가하기공감좋아요0훈훈해요0슬퍼요0화나요0후속기사 원해요0댓글 [머니투데이 정인지 기자, 황국상 기자]  임종철 디자이너 / 사진=임종철 디자이너3분기 실적 시즌이 양호한 성적으로 마무리되고 있다. 실적을 발표한 상장사 중 절반이 영업이익이 컨센서스(평균 예상치)를 10% 이상 웃돌았다. 다만 정유, 조선 등 중후장대 업종들의 실적이 예상보다 부진해 종합 평가로는 \'무난했다\'는 정도도 정리된다. 2일 FN가이드와 금융감독원 공시에 따르면 지난달 말까지 컨센서스가 있는 상장사 235곳 중 120곳이 3분기 실적 발표를 완료했다. 대기업들은 주로 실적 시즌 초반에 발표해 주요 기업들의 성적표는 대부분 공개된 상태다.  3분기 실적은 언뜻보면 성공적이다. 은행 8곳을 제외한 112곳의 총 영업이익(연결 기준)은 21조3405억원으로, 컨센서스 대비 평균 10.13%가 높았다. 이중 컨센서스를 10% 웃돈 기업은 50곳(적자기업 제외)으로 전체의 약 45%에 달한다. 3분기 실적을 발표한 기업 중 약 절반이 \'깜짝실적\'을 발표한 것이다. 업종별로는 기계업종 기업들이 컨센서스를 29.3%, 철강이 27.1%, 화학이 21.1%, 반도체가 18.7% 웃돌았다. 철강, 화학, 반도체의 경우 대장주인 POSCO, LG화학, 삼성전자의 영업이익이 각각 34.7%, 26.8%, 18.8% 오른 영향이 컸다. 은행업종의 순이익도 15.2%를 웃돌았다. 그러나 우수한 성적으로 보긴 어렵다. 삼성전자의 이익을 제외한 111곳의 영업이익은 8조9872억원으로, 예상치 8조9790억원을 소폭 웃도는 데 그쳤기 때문이다. 깜짝 실적만큼 어닝쇼크를 낸 기업도 많았다는 얘기다. S-Oil, SK이노베이션, 현대중공업지주 등 대형 기업들이 실적 부진에 시달렸다. 품질 비용 반영에 따른 현대차 적자도 함된다. 현대차는 3분기에 세타 엔진 결함 관련 보상 비용 등 충당금을 쌓으면서 3100억원 영업적자를 기록했다. 시장예상치는 영업이익 4968억원이었다. 정유업종인 S-Oil과 SK이노베이션은 각각 93억원, 289억원의 적자를 기록했다. 시장 예상치는 영업이익 1106억원, 856억원이었다. 코로나19(COVID-19) 사태가 장기화되면서 석유 제품 수요가 크게 개선되지 못했다.  최유준 신한금융투자 연구원은 ""실적이 대체로 낮아진 눈높이를 충족시켰다는 점은 긍정적""이라며 ""3분기 실물 경기 회복세가 기업 실적에 영향을 미쳤다""고 말했다. 그는 다만 ""코로나19 사태가 장기화되면서 4분기에 제조업이 타격을 받을 수 있다""며 ""화웨이의 긴급발주 수혜가 사라진 점도 전체 실적에 영향을 미칠 것""이라고 예상했다. 최 연구원은 ""이달 중에 코로나19 재확산이 정점을 확인한다면 타격은 제한적이겠지만, 연말까지 의료 시스템이 지탱될 지 지켜볼 필요가 있다""고 조언했다. 정인지 기자 injee@mt.co.kr, 황국상 기자 gshwang@mt.co.kr▶부동산 투자는 [부릿지]▶조 변호사의 가정상담소▶줄리아 투자노트 <저작권자 ⓒ \'돈이 보이는 리얼타임 뉴스\' 머니투데이, 무단전재 및 재배포 금지> 머니투데이 관련뉴스해당 언론사에서 선정하며 언론사 페이지(아웃링크)로 이동해 볼 수 있습니다.""가장 잘 맞는 파트너"" 박성광, 故 박지선 빈소 달려왔다가세연, 썸네일에 故 박지선 사진…제목은 ""화장 못하는 박지선""故 박지선, 최근 방송가 섭외 연락에…""몸 안좋다"" 발언박정민, 故 박지선 빈소에 가장 먼저 도착…사진 보며 \'눈물\'박하선 ""♥류수영, 사귀기 전 뽀뽀 시도…안해준 사람 내가 처음인듯""좋아요0훈훈해요0슬퍼요0화나요0후속기사 원해요0기사제공 :']"
5,삼성전자, 2020-11-0215:46,이데일리 ,"[이데일리N] 셀트리온, 2천100억원 규모 코로나19 신속진단키트 미국 공급 外",https://finance.naver.com/news/news_read.nhn?article_id=0004775486&office_id=018&mode=search&query=삼성전자&page=4,"['       [이데일리N] 셀트리온, 2천100억원 규모 코로나19 신속진단키트 미국 공급 外      기사입력2020-11-02 15:46기사원문좋아요훈훈해요좋아요 평가하기공감좋아요0훈훈해요0슬퍼요0화나요0후속기사 원해요0댓글1.이주열 “미 대선 결과에 따라 시장 안정화 조치 실시”2. 10월 한국 제조업 PMI 51.2…올해 첫 확장국면3. KG이니시스, 3분기 영업이익 268억원…역대 최대 실적 달성4 셀트리온, 2천100억원 규모 코로나19 신속진단키트 미국 공급5. 진에어, LCC 최초 미국 본토 운항…여객기로 화물 운송(간추린 소식)-“증권거래세 인하로 세수 2.4조 감소…공매도 세금 도입해야”-삼성전자 창립 51주년 기념식…“회장님의 도전과 열정 이어받자”-네이버페이로 이제 오프라인 결제 가능-보령·GC녹십자, 호중구감소증약 뉴라펙 공동판매후 매출 230%강상원 (won3191@edaily.co.kr)▶ #24시간 빠른 #미리보는 뉴스 #eNews+▶ 네이버에서 \'이데일리 뉴스\'를 만나보세요▶ 빡침해소, 청춘뉘우스 \'스냅타임\'＜ⓒ종합 경제정보 미디어 이데일리 - 무단전재 & 재배포 금지＞이데일리 관련뉴스해당 언론사에서 선정하며 언론사 페이지(아웃링크)로 이동해 볼 수 있습니다.이춘재 ""용의선상에 오르지 않았던 것 이해 안 돼""""이제 가면 언제"", ""사실상 종신형"" MB 재수감檢출신 변호사, 조국 일가 수사가 진짜 검란 아닌가함소원♥진화, 둘째 임신 성공?..산부인과 검진 결과는이춘재 ""진실만을 말하겠다..연쇄살인 진범은 나""좋아요0훈훈해요0슬퍼요0화나요0후속기사 원해요0기사제공 :']"
