,회사명,날짜,언론사,기사제목,링크,본문
7,삼성전자, 2017-05-0209:57,파이낸셜뉴스 ,"LG이노텍, 북미 최대 조명전시회 참가",https://finance.naver.com/news/news_read.nhn?article_id=0003810076&office_id=014&mode=search&query=LG이노텍&page=1,"['       LG이노텍, 북미 최대 조명전시회 참가      기사입력2017-05-02 09:57기사원문좋아요훈훈해요좋아요 평가하기공감좋아요0훈훈해요0슬퍼요0화나요0후속기사 원해요0댓글""세계 최고 성능과 품질 확보…차별화 경쟁력 적극 알릴 것""              LG이노텍(대표 박종석)이 오는 9일부터 11일까지 미국 필라델피아에서 열리는 \'국제조명전시회(LFI, Light Fair International) 2017\'에 참가한다고 2일 밝혔다.  LG이노텍은 이번 북미 최대 조명전시회에서 고출력, 고신뢰성 제품을 앞세워 글로벌 조명업체들의 이목을 사로잡는다는 계획이다. 독자 기술로 개발한 UV(ultraviolet rays) LED와 조명용, 차량용 LED, 특히 경화 및 살균용으로 사용할 수 있는 UV LED를 선보인다. LG이노텍의 광출력 70밀리와트(mW) UV-C LED는 전시회 전부터 많은 관심을 받고 있다. 280나노미터(nm) 파장 제품 중 세계 최고 성능이다. UV-C LED는 흐르는 물이나 공기까지 살균하는 강력한 자외선을 방출한다. 칫솔 살균용보다 70배 강한 자외선을 방출해 정수·정화·경화용 등으로 사용하기 좋다. 자외선 출력이 강해 경화(硬化) 장치 성능을 높인다.  이와 함께 LG이노텍은 하이파워 LED 패키지와 컬러 LED 패키지 등 조명용 고출력 LED를 내놓는다.  이 회사의 대표적인 하이파워 LED 패키지인 \'3535 Gen4-X\'는 광효율이 171루멘퍼와트(lm/W)로 높다. 독자적인 수직형 칩 기술을 적용한 덕분이다. 조명 내부에 장착하기 용이한 슬림형으로 디자이너들에게 인기다.  LG이노텍의 컬러 LED 패키지는 레드, 그린, 블루 등 다양한 색을 구현한다. 빌딩 및 경기장 등의 고급 조명부터 특수 조명까지 활용도가 높다. 특히 이 제품은 광출력이 8W에 달하는 고출력 모델로서 조명의 가격경쟁력을 높인다. 적은 수의 LED로 밝은 빛을 낼 수 있어서다.  또한 LG이노텍은 혁신적인 디자인과 품질 신뢰성을 확보한 차량용 LED 풀 라인업을 전시한다. 이 회사는 헤드램프부터 주간주행등(DRL), 방향지시등, 후미등, 룸램프, 계기판까지 각 용도에 최적화한 LED 패키지와 모듈을 모두 보유하고 있다.  회사 관계자는 ""이번에 전시하는 LED는 성능과 품질 측면에서 세계 최고 수준에 올라선 제품들""이라며 ""신규 고객을 확보하는 한편 기존 고객과의 관계를 한층 탄탄히 다질 수 있도록 차별화된 제품 경쟁력을 적극 알릴 것""이라고 말했다.   courage@fnnews.com 전용기 기자   ▶ 세상의 모든 골 때리는 이야기 \'fn파스\'▶ 속보이는 연예뉴스 fn스타  ※ 저작권자 ⓒ  파이낸셜뉴스. 무단 전재-재배포 금지파이낸셜뉴스 관련뉴스해당 언론사에서 선정하며 언론사 페이지(아웃링크)로 이동해 볼 수 있습니다.이해찬 돌직구 \'유치한 후보 있는데..\'토론후 홍준표의 손석희 평가 \'오늘 손박사가..\'박채윤 \'외로운 박근혜 전 대통령, 침실까지 데려가..\'최순실, 검사 나가자 다급하게 장시호에 한말 \'그 돈으로..\'순찰차에서 29세 女순경과 애정행각 벌인 남자의 정체좋아요0훈훈해요0슬퍼요0화나요0후속기사 원해요0기사제공 :']"
8,삼성전자, 2017-05-0209:55,아시아경제 ,"LG이노텍, 북미 최대 조명 전시회 참가",https://finance.naver.com/news/news_read.nhn?article_id=0003986664&office_id=277&mode=search&query=LG이노텍&page=1,"['       LG이노텍, 북미 최대 조명 전시회 참가      기사입력2017-05-02 09:55기사원문좋아요훈훈해요좋아요 평가하기공감좋아요0훈훈해요0슬퍼요0화나요0후속기사 원해요0댓글 [아시아경제 강희종 기자]LG이노텍은 오는 9일부터 11일까지 미국 필라델피아에서 열리는 \'국제조명전시회(LFI) 2017\'에 참가한다고 2일 밝혔다.이번 전시회는 약 550여개 조명 관련 업체가 참가하며 업계 종사자만 약 3만명이 관람하는 행사로 글로벌 LED시장 공략에 속도를 낼 수 있는 무대다.LG이노텍은 독자 기술로 개발한 UV(ultraviolet rays) LED와 조명용, 차량용 LED 등 고출력, 고신뢰성 제품을 앞세워 글로벌 조명업체들의 이목을 사로잡는다는 계획이다.LG이노텍의 광출력 70밀리와트(mW) UV-C LED는 280나노미터(nm) 파장 제품 중 세계 최고 성능을 뽐낸다. 이 제품은 흐르는 물이나 공기까지 살균하는 강력한 자외선을 방출한다. 칫솔 살균용보다 70배 강한 자외선을 방출해 정수 ·정화 ·경화용 등으로 적합하다.하이파워 LED 패키지인 \'3535 Gen4-X\'는 독자적인 수직형 칩 기술을 적용해 광효율 171루멘퍼와트(lm/W)를 달성했다. LG이노텍의 컬러 LED 패키지는 레드, 그린, 블루 등 다양한 색을 구현해 빌딩 및 경기장 등의 고급 조명부터 특수 조명까지 다양하게 활용할 수 있다.LG이노텍은 혁신적인 디자인과 품질 신뢰성을 확보한 차량용 LED 풀 라인업을 전시한다. 이 회사는 헤드램프부터 주간주행등(DRL), 방향지시등, 후미등, 룸램프, 계기판까지 각 용도에 최적화한 LED 패키지와 모듈을 보유하고 있다고 설명했다.강희종 기자 mindle@asiae.co.kr▶ 뉴스가 재밌다! 세상의 모든 재미 [티잼]▶ 인기최신만화  ▶ 오늘의 띠별, 별자리 운세아시아경제 관련뉴스해당 언론사에서 선정하며 언론사 페이지(아웃링크)로 이동해 볼 수 있습니다.[속보]광주 간 홍준표, 이번엔 또…\'충격 고백\'[속보]""큰일났다"" 심상정 지지율 오르자 전격…[속보]""5월 5일을 기점으로…"" 홍준표의 대예언김부겸 대구 유세 중 외친 한마디에 ""난리났다""""손석희 일냈다"" 대선토론 끝나자마자…좋아요0훈훈해요0슬퍼요0화나요0후속기사 원해요0기사제공 :']"
9,삼성전자, 2017-05-0209:53,아이뉴스24 ,"LG이노텍, 美 LED 공략…국제조명전시회 참가",https://finance.naver.com/news/news_read.nhn?article_id=0000410063&office_id=031&mode=search&query=LG이노텍&page=1,"['       LG이노텍, 美 LED 공략…국제조명전시회 참가      기사입력2017-05-02 09:53기사원문좋아요훈훈해요좋아요 평가하기공감좋아요0훈훈해요0슬퍼요0화나요0후속기사 원해요0댓글[아이뉴스24 김문기기자] LG이노텍(대표 박종석)은 오는 9일부터 11일까지 미국 필라델피아에서 열리는 국제조명전시회(LFI, Light Fair International) 2017에 참가한다고 2일 밝혔다.전시회는 글로벌 LED시장 공략에 속도를 낼 수 있는 주요 무대다. 약 550여개 조명 관련 업체가 참가하며업계 종사자만 약 3만명이 관람한다. 최신 조명 트렌드를 알 수 있는 장이다.LG이노텍은 고출력, 고신뢰성 제품을 앞세워 글로벌 조명업체들의 이목을 사로잡는다는 계획이다. 이 회사가독자 기술로 개발한 UV(ultraviolet rays) LED와 조명용, 차량용 LED가 핵심이다.주목할 부분은 경화 및 살균용으로 사용할 수 있는 UV LED다. LG이노텍의 광출력 70밀리와트(mW) UV-C LED는 전시회 전부터 많은 관심을 받고 있다. 280나노미터(nm) 파장 제품 중 최고 성능이다. UV-C LED는 흐르는 물이나 공기까지 살균하는 강력한 자외선을 방출한다. 칫솔 살균용보다 70배 강한자외선을 방출해 정수·정화·경화용 등으로 사용한다.탁월한 광출력을 구현한 하이파워 LED 패키지와 컬러 LED 패키지 등조명용 고출력 LED를 선보인다. 대표적인 하이파워 LED 패키지인 ‘3535 Gen4-X’는 광효율이 171루멘퍼와트(lm/W)로 높다.독자적인 수직형 칩 기술을 적용했다.LG이노텍의 컬러 LED 패키지는 레드, 그린, 블루 등 다양한 색을 구현한다. 빌딩 및 경기장 등의 고급조명부터 특수 조명까지 활용도가 높다. 광출력이 8W에 달하는 고출력 모델로서 조명의가격경쟁력을 높인다. 적은 수의 LED로 밝은 빛을 낼 수 있어서다.차량용 LED 풀 라인업도 전시한다. 이 회사는헤드램프부터 주간주행등(DRL), 방향지시등, 후미등, 룸램프, 계기판까지 각 용도에 최적화한 LED 패키지와 모듈이 공개된다. 후미등용 LED 면광원 모듈은 3.5밀리미터(mm) 두께를 갖췄다. 차량의 콘셉트에 맞춰 가느다란 선이나 면으로 후미등을 다양하게 디자인할 수 있다.LG이노텍 관계자는 ""이번에 전시하는 LED는 성능과 품질 측면에서 세계 최고 수준에 올라선 제품들""이라며 ""신규고객을 확보하는 한편 기존 고객과의 관계를 한층 탄탄히 다질 수 있도록 차별화된 제품 경쟁력을 적극 알릴 것""이라고 말했다./김문기기자 moon@inews24.com▶프리미엄 뉴스서비스 아이뉴스24▶연예스포츠 조이뉴스24, 생생한 라이브캐스트[ⓒ 아이뉴스24 무단전재 및 재배포 금지]아이뉴스24 관련뉴스해당 언론사에서 선정하며 언론사 페이지(아웃링크)로 이동해 볼 수 있습니다.유승민, 서울 대학가 돌며 청년층 표심 공략홍준표, 경북-충북-강원까지 보수 결집 대장정[스타1]윤용태, 강력한 찌르기로 정윤종 꺾어문재인 ""압도적 정권 교체로 세월호 7시간 밝힐 것""[스타1]이재호, \'전진 2팩토리\'로 최호선 격파좋아요0훈훈해요0슬퍼요0화나요0후속기사 원해요0기사제공 :']"
10,삼성전자, 2017-05-0209:28,뉴스1 ,"LG이노텍, 북미 최대 조명 전시회 참가… 시장공략 박차",https://finance.naver.com/news/news_read.nhn?article_id=0002709004&office_id=421&mode=search&query=LG이노텍&page=1,"['       LG이노텍, 북미 최대 조명 전시회 참가… 시장공략 박차      기사입력2017-05-02 09:28기사원문좋아요훈훈해요좋아요 평가하기공감좋아요0훈훈해요0슬퍼요0화나요0후속기사 원해요0댓글LG이노텍이 양산하고 있는 UV(자외선) LED모듈. (LG이노텍 제공) 2017.4.10/뉴스19~11일 미국 필라델피아 국제조명전시회 참석…UV LED 등 대표 제품 대거 선보여(서울=뉴스1) 이헌일 기자 = LG이노텍이 북미 최대 규모의 조명 전시회에 참여해 글로벌 LED 조명시장 공략에 박차를 가한다.LG이노텍은 오는 9일부터 11일(현지시각)까지 미국 필라델피아에서 열리는 \'국제조명전시회(LFI, Light Fair International) 2017\'에 참여한다고 2일 밝혔다. 이 전시회는 약 550개 조명 관련 업체가 참가하고 업계 종사자 3만명이 관람할 예정이다. 글로벌 조명시장의 최신 트렌드를 엿볼 수 있는 장이자 기업간 거래도 활발하게 이뤄진다. LG이노텍은 이번 전시회에서 고출력, 고신뢰성 제품을 앞세워 글로벌 조명업체들의 이목을 사로잡는다는 계획이다. 독자 기술로 개발한 UV(자외선) LED와 조명용, 차량용 LED 등을 집중적으로 알린다.UV LED는 살균 및 경화(硬化)용으로 사용되는 제품으로 LG이노텍의 광출력 70㎽(밀리와트) \'UV-C LED\'는 전시회 전부터 많은 관심을 받고 있다. 280㎚(나노미터) 파장의 제품 중 세계 최고 성능을 갖췄다. 이 제품은 흐르는 물이나 공기까지 살균하는 강력한 자외선을 방출한다. 칫솔 살균용 제품보다 70배 강한 자외선을 방출해 정수 및 정화 등 용도로 사용하기 적합하다. 또 자외선 출력이 강해 경화 장치의 성능을 높여 준다.LG이노텍은 전시회에서 하이파워 LED 패키지와 컬러 LED 패키지 등 조명용 고출력 LED도 선보인다. 회사의 대표 하이파워 LED 패키지인 \'3535 Gen4-X\'는 독자적인 수직형 칩 기술이 적용돼 171lm/W(루멘/와트)의 높은 광효율을 자랑한다. 컬러 LED 패키지는 레드와 그린, 블루 등 다양한 색을 구현할 수 있어 빌딩, 경기장 등의 고급 조명부터 특수 조명까지 활용도가 높다. 적은 수의 LED로 밝은 빛을 낼 수 있어 광출력도 8W(와트)로 높다.차량용 LED 라인업도 전시한다. LG이노텍은 헤드램프, 주간주행등(DRL), 방향지시등, 후미등, 룸램프, 계기판 등 용도에 최적화한 LED 패키지와 모듈을 모두 보유하고 있다. 특히 후미등용 LED 면광원 모듈은 두께가 3.5㎜(밀리미터) 밖에 되지 않아 차량의 컨셉에 맞춘 연출이 가능하다.LG이노텍 관계자는 ""이번에 전시하는 LED 제품들은 성능과 품질 측면에서 세계 최고 수준""이라며 ""신규 고객을 확보하는 한편 기존 고객과의 관계를 한층 탄탄히 다질 수 있도록 차별화된 제품의 경쟁력을 적극 알릴 것""이라고 밝혔다.honey@▶ 놓치면 후회! 최신 만화 보기 / 2017년 나의 운세 보기▶ 여러분의 제보를 기다립니다. 제보하기(클릭!)[© 뉴스1코리아(news1.kr), 무단 전재 및 재배포 금지]뉴스1 관련뉴스해당 언론사에서 선정하며 언론사 페이지(아웃링크)로 이동해 볼 수 있습니다.이준석, 바른정당 탈탕파 겨냥 ""배신자도 과분…쫄보가 적절""""카톡으로 ○○에게 늦는다고 보내줘""…\'갤S8 빅스비\' 알아서 척척찜질방 금품털이 20대 목욕하러 온 경찰관에 덜미\'해병대 왜 비하해\'…술마시다 과도로 협박한 40대여경인줄 모르고…바지 지퍼 내리고 \'변태짓\'좋아요0훈훈해요0슬퍼요0화나요0후속기사 원해요0기사제공 :']"
11,삼성전자, 2017-05-0209:17,서울경제 ,"한국자산신탁, 오산 '르마레시티' 5월 분양예정",https://finance.naver.com/news/news_read.nhn?article_id=0003025560&office_id=011&mode=search&query=LG이노텍&page=1,"['       한국자산신탁, 오산 \'르마레시티\' 5월 분양예정      기사입력2017-05-02 09:17기사원문좋아요훈훈해요좋아요 평가하기공감좋아요0훈훈해요0슬퍼요0화나요0후속기사 원해요0댓글 - 1호선 오산역과 오산버스터미널, 오산IC와 용인-서울고속도로 인접한 교통의 요충지- 인근에 산업단지 위치해 배후수요 ‘풍부’ .. 관공서, 대형쇼핑시설 등 편의시설 가까워- 지하 5층~지상 15층 1개동, 오피스텔 전용 22~46㎡ 456실 규모[서울경제] 오는 5월 한국자산신탁이 경기도 오산시에 ‘르마레시티’를 선보일 예정이다.경기도 오산시 원동 350-5번지에 들어설 ‘르마레시티’ 오피스텔은 지하 5층~지상 15층 1개동 △전용 22㎡ 253실 △전용 24㎡ 170실 △전용 46㎡ 33실 등 총 456실 규모로 구성된다.‘르마레시티’가 들어서는 오산시 원동은 동탄생활권을 가까이에서 누릴 수 있어 우수한 생활인프라를 갖춘데다 LG이노텍 등 13개의 산업단지와 오산대가 인접해 배후수요가 풍부한 지역이다.또한 접근성이 뛰어난 스트리트형 상가로 구성되며 오산 최초로 CGV 입점이 확정되었고 뽀로로테마파크도 들어설 예정으로 높은 수익성이 기대된다.◆ 교통과 편의시설, 풍부한 임대수요까지 갖춰 실수요자뿐 아니라 투자자까지 ‘눈길’‘르마레시티’는 편리한 교통여건과 풍부한 생활편의시설, 풍부한 임대수요 등 인기 수익형부동산의 3박자 요건을 모두 갖췄다.먼저 ‘르마레시티’의 우수한 교통인프라가 눈에 띈다. 1호선 오산역과 오산버스터미널이 가까이에 위치해 대중교통 이용이 수월하며 오산 IC, 용인-서울고속도로도 인접해 수도권 및 화성, 평택, 용인 등으로 편리하게 이동 가능하다.‘르마레시티’는 동탄 생활권을 누림과 동시에 단지 인근에 이마트와 롯데마트, 오산시청이 위치해 생활 편의시설을 가까이에서 이용할 수 있다. 또한 주변은 아파트 단지들이 밀집해 있는 주거지역이고 원일초, 원일중학교도 인접해 유해시설이 없는 안전한 지역이다.‘르마레시티’는 오산의 다양한 산업단지의 대표 배후주거단지로 자리매김할 것으로 기대된다. LG이노텍 오산공장, LG전자 디지털파크, 진위일반산업단지와 동탄일반산업단지 등 13개의 산업단지와 438개 업체가 단지 주변에 위치해 있어 직주근접 프리미엄을 누리기 원하는 종사자들의 관심이 쏠릴 것으로 예상되기 때문이다. 이 외에도 오산대학교도 인접하여 인근의 노후 원룸 대기 수요까지 갖춰 수익성이 기대된다.◆ 복합 테마쇼핑단지로 거듭날 ‘르마레시티’‘르마레시티’는 오피스텔 뿐 아니라 단지 내에 복합테마쇼핑단지도 함께 들어서 오피스텔 거주자들은 원스톱라이프를 실현할 수 있다. 또한 오산 최초로 CGV 영화관의 입점이 확정됐으며 가족 단위 방문객을 노린 뽀로로테마파크도 입정이 예정되어 있다.\xa0특히 상가는 유동인구의 체류시간이 높은 스트리트형 상가로 구성된다. 스트리트형 상가는 보행로 양쪽에 연이어 배치되어 유동인구의 체류시간이 늘어 뛰어난 상권이 형성되는 장점이 있다.\xa0단지 내 입주민 뿐 아니라 인근에 위치한 원동 이편한세상 등 대단위 아파트 단지의 입주민까지 상가를 이용할 수 있어 상가의 배후수요도 풍부하다.한편 ‘르마레시티’ 견본주택은 경기도 화성시 능동 696-2번지에 마련될 예정이다./김동호기자 dongho@sedaily.com[서울경제 바로가기]\'장미전쟁\'의 승자는...5월 대선 실황중계 [바로가기]서울경제의 모든 연재물!... 서경Cube [바로가기▶]저작권자 ⓒ 서울경제, 무단 전재 및 재배포 금지서울경제 관련뉴스해당 언론사에서 선정하며 언론사 페이지(아웃링크)로 이동해 볼 수 있습니다.""안철수 다 잡았다"" 무서운 \'홍준표 지지율\' 이러다가""안철수를 뽑아야···"" 눈물 흘린 \'이언주\' 했다는 그 말""한달에 \'877만원\' 벌어요"" 한 치킨집의 \'불편한\' 진실""쏘자마자 펑"" 北 탄도미사일 어쩐지 좀 이상하더니만""文, 43년을 살아보니···"" 아내 김정숙 여사의 한마디좋아요0훈훈해요0슬퍼요0화나요0후속기사 원해요0기사제공 :']"
12,삼성전자, 2017-05-0209:16,이데일리 ,"LG이노텍, 북미 최대 조명전시회서 LED 기술력 선보인다",https://finance.naver.com/news/news_read.nhn?article_id=0003815029&office_id=018&mode=search&query=LG이노텍&page=1,"['       LG이노텍, 북미 최대 조명전시회서 LED 기술력 선보인다      기사입력2017-05-02 09:16기사원문좋아요훈훈해요좋아요 평가하기공감좋아요0훈훈해요0슬퍼요0화나요0후속기사 원해요0댓글- UV-조명용-차량용 제품 대거 전시- 살균-경화, 최대 광출력 등 강조LG이노텍이 양산을 시작한 정수기 코크 살균용 UV LED모듈은 자외선으로 코크 내부를 직접 살균할 수 있다. 사진=LG이노텍[이데일리 이재운 기자] LG이노텍(011070)은 오는 9일부터 11일까지 미국 필라델피아에서 열리는 ‘국제조명전시회(LFI, Light Fair International) 2017’에 참가한다고 2일 밝혔다.이 전시회는 550여개 조명 관련 업체가 참가하며 3만여명의 관람객이 방문할 전망이다.LG이노텍은 북미 최대 규모의 이 전시회에서 차별화된 기술력으로 해외 시장 공략에 박차를 가하겠다고 설명했다. 특히 고출력, 고신뢰성 제품을 앞세워 글로벌 조명업체들의 이목을 사로잡겠다는 계획이다. 주요 전시품은 독자 기술로 개발한 UV(자외선) LED(발광다이오드)와 조명용·차량용 LED다.UV LED는 70mW(밀리와트) 광출력으로 부드럽게 가공하는 경화(硬化) 장치 성능을 높여주거나, 정수·정화 용도로도 사용할 수 있다. 흐르는 물이나 공기도 살균할 수 있다는 점을 강조한다.세계 최고 수준의 광출력을 구현한 하이파워 LED 패키지와 컬러 LED 패키지 등 조명용 고출력 LED도 선보인다. 하이파워 LED 패키지 ‘3535 Gen4-X’는 독자적인 수직형 칩 기술을 적용해 광효율이 171루멘퍼와트(lm/W)로 높다. 또 조명 내부에 장착하기 쉬운 형태(슬림형)로 제품 디자이너들의 선호도도 높은 편이다. 컬러 LED 패키지는 빨강, 녹색, 파랑 등 다양한 색을 표현할 수 있으며, 빌딩이나 경기장 등에서 고급 혹은 특수조명으로 활용할 수 있다. 광출력이 8W로, 적은 수의 LED로 밝은 빛을 낼 수 있는 고출력 제품이다.차량용 LED도 전체 제품군을 모두 전시한다. 헤드램프부터 주간주행등(DRL), 방향지시등, 후미등, 룸램프, 계기판까지 각 용도에 최적화한 LED 패키지와 모듈을 모두 갖추고 있다는 점을 적극 알릴 계획이다.LG이노텍 관계자는 “이번에 전시하는 LED는 성능과 품질 측면에서 세계 최고 수준에 올라선 제품들”이라며 “신규 고객을 확보하는 한편 기존 고객과의 관계를 한층 탄탄히 다질 수 있도록 차별화된 제품 경쟁력을 적극 알릴 것”이라고 말했다.이재운 (jwlee@edaily.co.kr)＜ⓒ종합 경제정보 미디어 이데일리 - 무단전재 & 재배포 금지＞이데일리 관련뉴스해당 언론사에서 선정하며 언론사 페이지(아웃링크)로 이동해 볼 수 있습니다.최저임금 1만원 딜레마…\'빈곤 탈피\' Vs \'일자리 감소\'기름값의 비밀..SK는 왜 싸게 넘겨서 비싸게 팔았을까이준석 ""바른정당 유세장서 장제원·김성태 찾는 젊은이들..자유한국당은 없어[화통토크]① 김홍신 정치판 더 재밌는데 소설이 먹히겠나놀러 못간 \'퐁당 퐁당\' 연휴...알레르기 주범 집먼지진드기 잡아볼까좋아요0훈훈해요0슬퍼요0화나요0후속기사 원해요0기사제공 :']"
