,회사명,날짜,언론사,기사제목,링크,본문
13,삼성전자, 2017-05-0209:14,뉴시스 ,"LG이노텍, 북미 최대 조명전시회 참가…글로벌 LED시장 공략 박차",https://finance.naver.com/news/news_read.nhn?article_id=0007929697&office_id=003&mode=search&query=LG이노텍&page=1,"['       LG이노텍, 북미 최대 조명전시회 참가…글로벌 LED시장 공략 박차      기사입력2017-05-02 09:14기사원문좋아요훈훈해요좋아요 평가하기공감좋아요0훈훈해요0슬퍼요0화나요0후속기사 원해요0댓글【서울=뉴시스】최현 기자 = LG이노텍은 오는 9~11일 미국 필라델피아에서 열리는 \'국제조명전시회(LFI) 2017\'에 참가한다고 2일 밝혔다.  LFI는 글로벌 LED시장 공략에 속도를 낼 수 있는 주요 무대다. 약 550여개 조명 관련 업체가 참가하며, 약 3만명의 업계 종사자가 방문한다. 최신 조명 트렌드를 알 수 있고 기업간 거래도 활발히 이뤄지는 비즈니스 현장이다. LG이노텍은 독자 기술로 개발한 UV(자외선) LED와 조명용 및 차량용 LED 등 고출력, 고신뢰성 제품을 앞세워 글로벌 조명업체들의 이목을 사로잡는다는 계획이다. 경화 및 살균용으로 사용할 수 있는 LG이노텍의 광출력 70밀리와트(mW) UV-C LED는 280나노미터(nm) 파장 제품 중 세계 최고 성능을 자랑한다. 흐르는 물이나 공기까지 살균하는 강력한 자외선을 방출한다. 칫솔 살균용보다 70배 강한 자외선으로 정수·정화·경화용 등으로 사용하기 좋다. LG이노텍은 이와 함께 세계 최고 수준의 광출력을 구현한 하이파워 LED 패키지와 컬러 LED 패키지 등 조명용 고출력 LED를 선보인다. 대표적인 하이파워 LED 패키지인 \'3535 Gen4-X\'는 광효율이 171루멘퍼와트(lm/W)로 높다. 독자적인 수직형 칩 기술을 적용한 덕분이다. 조명 내부에 장착하기 용이한 슬림형으로 디자이너들에게 인기다. LG이노텍의 컬러 LED 패키지는 레드, 그린, 블루 등 다양한 색을 구현한다. 빌딩 및 경기장 등의 고급 조명부터 특수 조명까지 활용도가 높다. 특히 이 제품은 광출력이 8W에 달하는 고출력 모델로 조명의 가격경쟁력을 높였다. 아울러 LG이노텍은 차량용 LED 풀라인업을 전시할 계획이다. 후미등용 LED 면광원 모듈은 3.5㎜ 두께의 초슬림 혁신 제품이다. 차량의 컨셉에 맞춰 가느다란 선이나 면으로 후미등을 다양하게 디자인할 수 있다. LG이노텍 관계자는 ""이번에 전시하는 LED는 성능과 품질 측면에서 세계 최고 수준에 올라선 제품""이라며 ""신규 고객을 확보하는 한편 기존 고객과의 관계를 한층 탄탄히 다질 수 있도록 차별화된 제품 경쟁력을 적극 알릴 것""이라고 말했다. forgetmenot@newsis.com 뉴시스 뉴스, 네이버 뉴스 스탠드에서도 만나세요뉴시스 SNS [페이스북] [트위터]뉴시스 관련뉴스해당 언론사에서 선정하며 언론사 페이지(아웃링크)로 이동해 볼 수 있습니다.생후 11개월 딸과 동반자살 페북 생중계 \'충격\'재소자 일주일간 물 안줘 사망…교도관 7명 구속여승무원 성폭행 시도…항공사 부기장 구속기소트럼프 ""상황 적절하면 김정은 만날 수 있다""미국 당국자 ""한국 배치 사드, 운용 가능한 상태""좋아요0훈훈해요0슬퍼요0화나요0후속기사 원해요0기사제공 :']"
14,삼성전자, 2017-05-0209:08,연합뉴스 ,"LG이노텍, 북미 최대 조명전시회 참가",https://finance.naver.com/news/news_read.nhn?article_id=0009234652&office_id=001&mode=search&query=LG이노텍&page=1,"['       LG이노텍, 북미 최대 조명전시회 참가      기사입력2017-05-02 09:08기사원문좋아요훈훈해요좋아요 평가하기공감좋아요0훈훈해요0슬퍼요0화나요0후속기사 원해요0댓글 (서울=연합뉴스) 고웅석 기자 = LG이노텍은 오는 9일부터 11일까지 미국 필라델피아에서 열리는 \'국제조명전시회(LFI) 2017\'에 참가한다고 2일 밝혔다.    LG이노텍에 따르면 이 전시회에는 550여개 조명 관련 업체가 참가하며 업계 종사자만 약 3만명이 관람한다.     LG이노텍은 전시회에서 독자 기술로 개발한 UV(자외선) LED와 차량용 LED 등을 선보일 예정이다.     이중 UV-C LED는 칫솔 살균용보다 70배 강한 자외선을 방출해 정수·정화용 등으로 사용할 수 있는 제품이라고 LG이노텍은 전했다.    이와 함께 LG이노텍은 세계 최고 수준의 광출력을 구현한 하이파워 LED 패키지와 컬러 LED 패키지 등 조명용 고출력 LED도 전시할 계획이다.LG이노텍 \'코크 살균\' UV LED모듈 자료사진    freemong@yna.co.kr최신 유행 트렌드 총집결 #흥(클릭!)연합뉴스 관련뉴스해당 언론사에서 선정하며 언론사 페이지(아웃링크)로 이동해 볼 수 있습니다.\xa0집 나간 지적장애 아내 1㎞ 떨어진 곳에서 찾고보니…\xa0美 라스베이거스 섹시 레스토랑 \'후터스\' 문 닫는다\xa0안철수의 딸 영상편지…""아버지가 열 한국 미래""\xa02살 생일 맞은 영국 샬럿 공주 사진 공개\xa0또 시끄러운 항공사…이번엔 조종사가 승객 폭행좋아요0훈훈해요0슬퍼요0화나요0후속기사 원해요0기사제공 :']"
15,삼성전자, 2017-05-0209:02,헤럴드경제 ,"LG이노텍, 북미 최대 조명전시회 참가",https://finance.naver.com/news/news_read.nhn?article_id=0001232354&office_id=016&mode=search&query=LG이노텍&page=1,"['       LG이노텍, 북미 최대 조명전시회 참가      기사입력2017-05-02 09:02기사원문좋아요훈훈해요좋아요 평가하기공감좋아요0훈훈해요0슬퍼요0화나요0후속기사 원해요0댓글- 9~11일 美 ‘국제조명전시회 2017’서 차별화 기술력 선뵈- UV LED, 조명용, 차량용 등 고출력·고신뢰성 혁신 제품 주목- “세계 최고 성능과 품질 확보…차별화 경쟁력 적극 알릴 것”[헤럴드경제] LG이노텍(대표 박종석)이 오는 9일부터 11일까지 미국 필라델피아에서 열리는 ‘국제조명전시회(LFI, Light Fair International) 2017’에 참가한다. 북미 최대 규모 조명 전시회에서 이 회사만의 차별화된 LED 기술력을 뽐내며 글로벌 시장 공략에 박차를 가한다.이 전시회는 글로벌 LED시장 공략에 속도를 낼 수 있는 주요 무대다. 약 550여개 조명 관련 업체가 참가하며 업계 종사자만 약 3만명이 관람한다. 최신 조명 트렌드를 알 수 있고 기업간 거래도 활발히 이뤄지는 비즈니스 현장이다.LG이노텍은 고출력, 고신뢰성 제품을 앞세워 글로벌 조명업체들의 이목을 사로잡는다는 계획이다. 이 회사가 독자 기술로 개발한 UV(ultraviolet rays) LED와 조명용, 차량용 LED가 핵심이다.가장 주목할 부분은 경화 및 살균용으로 사용할 수 있는 UV LED다. LG이노텍의 광출력 70밀리와트(mW) UV-C LED는 전시회 전부터 많은 관심을 받고 있다. 280나노미터(nm) 파장 제품 중 세계 최고 성능이다.이 UV-C LED는 흐르는 물이나 공기까지 살균하는 강력한 자외선을 방출한다. 칫솔 살균용보다 70배 강한 자외선을 방출해 정수·정화·경화용 등으로 사용하기 좋다. 자외선 출력이 강해 경화(硬化) 장치 성능을 높인다.이와 함께 LG이노텍은 세계 최고 수준의 광출력을 구현한 하이파워 LED 패키지와 컬러 LED 패키지 등 조명용 고출력 LED를 선보인다.이 회사의 대표적인 하이파워 LED 패키지인 ‘3535 Gen4-X’는 광효율이 171루멘퍼와트(lm/W)로 높다. 독자적인 수직형 칩 기술을 적용한 덕분이다. 조명 내부에 장착하기 용이한 슬림형으로 디자이너들에게 인기다.LG이노텍의 컬러 LED 패키지는 레드, 그린, 블루 등 다양한 색을 구현한다. 빌딩 및 경기장 등의 고급 조명부터 특수 조명까지 활용도가 높다. 특히 이 제품은 광출력이 8W에 달하는 고출력 모델로서 조명의 가격경쟁력을 높인다. 적은 수의 LED로 밝은 빛을 낼 수 있어서다.또한 LG이노텍은 혁신적인 디자인과 품질 신뢰성을 확보한 차량용 LED 풀 라인업을 전시한다. 이 회사는 헤드램프부터 주간주행등(DRL), 방향지시등, 후미등, 룸램프, 계기판까지 각 용도에 최적화한 LED 패키지와 모듈을 모두 보유하고 있다.특히 이 회사의 후미등용 LED 면광원 모듈은 독보적인 디자인과 3.5밀리미터 두께의 초슬림 혁신 제품이다. 차량의 컨셉에 맞춰 가느다란 선이나 면으로 후미등을 다양하게 디자인할 수 있다.회사 관계자는 “이번에 전시하는 LED는 성능과 품질 측면에서 세계 최고 수준에 올라선 제품들”이라며 “신규 고객을 확보하는 한편 기존 고객과의 관계를 한층 탄탄히 다질 수 있도록 차별화된 제품 경쟁력을 적극 알릴 것”이라고 말했다./namkang@heraldcorp.com▶영감이란 불꽃에 타오르게할 스토리(INSPIRE)▶인기 무료 만화 ▶나만의 변호사 찾기 - Copyrights ⓒ 헤럴드경제 & heraldbiz.com, 무단 전재 및 재배포 금지 -헤럴드경제 관련뉴스해당 언론사에서 선정하며 언론사 페이지(아웃링크)로 이동해 볼 수 있습니다.장제원도 김성태도 한국당行…바른정당 14명 남았다""안철수 딸 월세 1500만원?""…국민의당 발끈박근령, 洪 지지 표명…""언니 살릴 유일한 후보""대역전 노리는 홍준표, \'상왕론\'으로 文-安 흠집내기나경원 ""홍준표, 고상하진 않지만 화끈해"" 지지 호소좋아요0훈훈해요0슬퍼요0화나요0후속기사 원해요0기사제공 :']"
16,삼성전자, 2017-05-0208:04,서울경제 ,LG그룹주 보면 시장 주도주 보인다,https://finance.naver.com/news/news_read.nhn?article_id=0003025512&office_id=011&mode=search&query=LG이노텍&page=1,"['       LG그룹주 보면 시장 주도주 보인다      기사입력2017-05-02 08:04기사원문좋아요훈훈해요좋아요 평가하기공감좋아요0훈훈해요0슬퍼요0화나요0후속기사 원해요0댓글 전자 부문 상승세 힘입어계열사 11곳 시총 80조올 16% 늘어 코스피 2배유플러스도 가파른 상승생활건강·화학 등은 주춤[서울경제] 올 들어 LG그룹주가 실적개선과 외국인 수급을 바탕으로 뜨겁게 달아오르면서 사업별로 고루 분산된 계열사 포트폴리오가 주목받고 있다. LG그룹은 전자·화학·통신·화장품 수출에서부터 내수까지 다양한 계열사를 보유하고 있어 LG그룹주의 주도주를 살펴보면 시장을 이끄는 종목을 확인할 수 있다는 분석도 나온다.1일 한국거래소에 따르면 지난달 28일 기준 LG그룹 계열 상장사 11곳(LG·LG디스플레이(034220)·LG전자(066570)·LG이노텍(011070)·LG화학(051910)·LG생활건강(051900)·LG하우시스(108670)·LG유플러스(032640)·LG상사(001120)·실리콘웍스(108320)·지투알(035000))의 시가총액은 78조5,800억원(우선주 제외)으로 연초(69조1,334억원) 대비 16.66%(9조4,466억원) 증가했다. 같은 기간 연일 최고치를 경신하며 역사적 고점 돌파를 눈앞에 두고 있는 코스피 상승률(8.84%)을 두 배가량 웃도는 수치다. 그동안 LG그룹이 국내 산업에서 차지하는 위상과 실적에 비해 주가가 따라오질 못해 국내 주식시장에서 투자자들의 외면을 받았던 것에 비하면 괄목한 만한 변화다. LG그룹주 상승세를 이끌고 있는 계열사는 전자 부문이다. 지난해 하반기부터 외국인이 정보기술(IT) 업종을 대거 사들이며 지수를 이끄는 흐름이 LG그룹주에도 영향을 미친 것으로 분석된다. LG전자는 지난달 28일 4.43% 하락한 6만9,100원에 장을 마감했지만 연초 대비로는 33.91%의 높은 상승률을 기록하고 있다. LG전자는 지난 3월23일 7만2,000원으로 거래를 마치며 2014년 9월 이후 처음으로 7만원대를 탈환했고 다음날 장중 7만3,900원까지 오르며 52주 신고가를 경신했다. LG전자는 지난해 하반기 전략스마트폰 ‘G5’의 부진 여파로 주가가 4만~5만원대에 머물렀지만 올해는 ‘G6’의 성공으로 모바일 사업부의 실적이 안정되고 프리미엄 가전 판매 호조 등으로 영업이익이 큰 폭으로 개선될 것으로 전망된다. LG전자는 올 1·4분기에 전년 대비 82% 늘어난 9,215억원의 영업이익을 달성하며 분기 기준으로 역대 두 번째 높은 기록을 세웠다. LG이노텍도 카메라모듈과 전장부품 판매 호조 기대감에 올 들어 주가가 53.62% 급등했다. 지난 3개월간 LG전자(7,410억원)와 LG이노텍(3,170억원)에 몰린 외국인 순매수액은 1조원을 넘는다. 반면 LG디스플레이는 LG 계열사 중 유일하게 연초 대비 주가가 하락(-5.62%)했고 반도체 팹리스 업체인 실리콘웍스도 연초 대비 2.99% 오르는 데 그쳤다. 대표적인 내수 계열사인 LG유플러스는 최근 상승세가 두드러지고 있다. 국내 소비심리가 3월부터 회복세로 돌아서면서 내수 업종이 주목받을 것이라는 전망 속에 가파른 상승세를 타는 모습이다. 연초 대비 지난달 28일 기준 LG유플러스는 23.5% 올랐다. 건축 자재업체인 LG하우시스도 4.71%의 준수한 수익률을 기록했다. 최근 3개월 LG유플러스에는 1,283억원, LG하우시스에는 35억원의 외국인 자금이 순유입됐다. 김홍식 하나금융투자 연구원은 “LG유플러스는 내수주로 경기 방어적 성격이 강하고 자율주행 자동차·가상현실(VR) 등 5세대(5G) 통신 산업을 주도할 핵심 서비스로 장기 이익성장 기대감도 높다”고 말했다. 시장의 주도주가 바뀌면서 뒤로 밀려난 계열사도 있다. 아모레퍼시픽과 함께 화장품 대장주로 꼽혔던 LG생활건강은 고고도미사일방어체계(THAAD·사드) 악재 이후 LG그룹주 내에서 영향력이 눈에 띄게 줄었다. LG생활건강은 화장품이 시장을 주도한 지난해 상반기까지만 하더라도 120만원 직전까지 오르며 기대주로 떠올랐다. 하지만 같은 해 7월 정부의 사드 배치 결정과 중국의 경제 보복 등 악재가 잇따르며 고점 대비 주가가 40% 가까이 하락했다. 올 초 대비 주가가 6% 오르며 반등을 모색하고 있지만 LG그룹주 상승의 주도권은 이미 LG전자에 내준 상태다. LG전자와 함께 그룹의 양대 축인 LG화학 주가도 좀처럼 반등하지 못하고 있다. LG화학은 올 초 LG그룹의 제약 바이오 계열사였던 LG생명과학을 흡수 합병했다. 주력인 배터리 사업 외에 바이오 분야를 신성장동력으로 내세우고 있지만 전 고점(30만3,500원)을 돌파하기 위해서는 가시적인 성과가 필요하다는 지적이다. 이밖에 LG그룹 계열 광고회사인 지투알은 연초 대비 주가가 23.67% 올랐고 LG상사 역시 자원·인프라 사업 실적 개선 기대감에 9.98% 상승했다. /서민우기자 ingaghi@sedaily.com[서울경제 바로가기]\'장미전쟁\'의 승자는...5월 대선 실황중계 [바로가기]서울경제의 모든 연재물!... 서경Cube [바로가기▶]저작권자 ⓒ 서울경제, 무단 전재 및 재배포 금지서울경제 관련뉴스해당 언론사에서 선정하며 언론사 페이지(아웃링크)로 이동해 볼 수 있습니다.""안철수 다 잡았다"" 무서운 \'홍준표 지지율\' 이러다가""안철수를 뽑아야···"" 눈물 흘린 \'이언주\' 했다는 그 말""한달에 \'877만원\' 벌어요"" 한 치킨집의 \'불편한\' 진실""文, 43년을 살아보니···"" 아내 김정숙 여사의 한마디""쏘자마자 펑"" 北 탄도미사일 어쩐지 좀 이상하더니만좋아요0훈훈해요0슬퍼요0화나요0후속기사 원해요0기사제공 :']"
17,삼성전자, 2017-05-0206:10,연합뉴스 ,'실적 따로 주가 따로 왜'…부진기업이 더 올라,https://finance.naver.com/news/news_read.nhn?article_id=0009234433&office_id=001&mode=search&query=LG이노텍&page=1,"['       \'실적 따로 주가 따로 왜\'…부진기업이 더 올라      기사입력2017-05-02 06:10기사원문좋아요훈훈해요좋아요 평가하기공감좋아요0훈훈해요0슬퍼요0화나요0후속기사 원해요0댓글 ""주가는 확정된 실적보다 미래 기업가치에 더 민감"" 게임빌 예상 밖 영업손실에도 4월 53% 급등(서울=연합뉴스) 조민정 기자 = 실적이 오르면 주가도 함께 올라갈까?     올해 1분기엔 실적이 예상보다 부진했던 기업이 오히려 주가가 더 오른 것으로 나타났다.    이는 미리 알려지거나 이미 확정된 실적보다 앞으로 업황이나 실적개선 가능성 등이 주가에 더 큰 영향을 미치기 때문으로 풀이됐다. 주가가 종종 현재의 기업가치뿐만 아니라 미래가치를 반영하기 때문이다.    2일 금융정보업체 에프앤가이드에 따르면 증권사 3곳 이상의 실적 추정치가 있는 코스피 상장사 중 실적 추정치 또는 잠정 실적이 상향된 상장사의 주가 상승률이 하향된 상장사보다 오히려 낮았다.    코스피 상장사 중 영업이익을 기준으로 연초 추정치보다 최근 추정치나 발표된 잠정실적이 상향된 기업 상위 20곳의 평균 주가 상승률은 9.20%였다.     반면 추정치가 하향되거나 적자전환 또는 적자가 확대된 기업 상위 20곳의 평균 주가 상승률은 11.04%였다.    삼성SDI의 경우 연초 시장 추정 영업손실이 193억원이었으나 최근 673억원의 영업손실을 기록한 것으로 잠정 집계됐다.    그럼에도 삼성SDI의 주가는 작년 말 10만9천원에서 지난달 27일 13만6천원으로 24.77%가량 뛰었다.    삼성SDI의 경우 실적 부진이 삼성전자의 갤럭시S8 출시지연과 비수기 진입이라고 설명할 수 있는 이유가 있는 데다 2분기 이후 수익성 개선 등이 예상되기 때문으로 풀이된다.    게임빌의 경우 연초 24억원의 영업이익을 낼 것으로 점쳐졌다가 최근들어 2억원의 영업손실을 낼 것으로 추정됐지만, 게임업종에 대한 관심이 커지면서 주가는 오히려 4만8천700원에서 7만4천300원으로 52.57% 상승했다.    실적이 하향된 기업 20곳 중 주가가 하락한 기업은 7곳에 불과했다.코스피 이익 하향 상위 20개 종목 주가 등락률[자료=에프앤가이드]반대로 연초 5천389억원의 영업이익을 낼 것으로 예상됐으나 실제로는 두 배에 가까운 1천27억원의 영업이익을 낸 LG디스플레이는 주가가 오히려 5.09% 떨어졌다.    패널 가격 고점 논란과 중국발 증설 우려에 따른 업황 악화 우려가 영향을 미쳤다.    대한유화도 연초 추정치보다 46.3% 증가한 영업이익을 냈지만, 주가는 27만5천500원에서 24만2천원으로 12.16% 하락했다.    풍산(-0.86%), 삼성생명(-2.22%), 동원산업(-7.70%), 롯데케미칼(-4.74%)도 실적이 예상보다 좋았음에도 주가가 하락했다.    연초 추정치보다 영업이익이 175.5%로 증가한 LG전자는 40.12%, 실적이 예상보다 44.4% 개선된 LG이노텍은 47.62%, 실적 증가율이 95.6%인 SK하이닉스는 19.91%의 주가 상승률로 실적 개선의 덕을 봤다.코스피 이익 상향 상위 20개 종목 주가 등락률[자료=에프앤가이드]    chomj@yna.co.kr최신 유행 트렌드 총집결 #흥(클릭!)연합뉴스 관련뉴스해당 언론사에서 선정하며 언론사 페이지(아웃링크)로 이동해 볼 수 있습니다.\xa0주민등록상 146세 \'사상 최장수\' 노인 사망\xa0안철수의 딸 영상편지…""아버지가 열 한국 미래""\xa02살 생일 맞은 영국 샬럿 공주 사진 공개\xa0여경인줄 모르고 변태짓 50대…체포술에 팔 꺾이며 제압돼\xa0또 시끄러운 항공사…이번엔 조종사가 승객 폭행좋아요0훈훈해요0슬퍼요0화나요0후속기사 원해요0기사제공 :']"
