,회사명,날짜,언론사,기사제목,링크,본문
0,삼성전자, 2017-05-0218:55,파이낸셜뉴스 ,LG이노텍 오는 9일부터 美국제조명전시회 참가,https://finance.naver.com/news/news_read.nhn?article_id=0003810386&office_id=014&mode=search&query=LG이노텍&page=1,"[""       LG이노텍 오는 9일부터 美국제조명전시회 참가      기사입력2017-05-02 18:55기사원문좋아요훈훈해요좋아요 평가하기공감좋아요0훈훈해요0슬퍼요0화나요0후속기사 원해요0댓글  LG이노텍(대표 박종석)이 오는 9일부터 11일까지 미국 필라델피아에서 열리는 '국제조명전시회(LFI) 2017'에 참가한다고 2일 밝혔다.LG이노텍은 이번 북미 최대 조명전시회에서 고출력, 고신뢰성 제품을 앞세워 글로벌 조명업체들의 이목을 사로잡는다는 계획이다. 독자 기술로 개발한 UV LED와 조명용, 차량용 LED, 특히 경화 및 살균용으로 사용할 수 있는 UV LED를 선보인다. LG이노텍의 광출력 70mW UV-C LED는 전시회 전부터 많은 관심을 받고 있다. 280nm 파장 제품 중 세계 최고 성능이다. UV-C LED는 흐르는 물이나 공기까지 살균하는 강력한 자외선을 방출한다. 칫솔 살균용보다 70배 강한 자외선을 방출해 정수.정화.경화용 등으로 사용하기 좋다. 자외선 출력이 강해 경화 장치 성능을 높인다.courage@fnnews.com 전용기 기자     ▶ 세상의 모든 골 때리는 이야기 'fn파스'▶ 속보이는 연예뉴스 fn스타  ※ 저작권자 ⓒ  파이낸셜뉴스. 무단 전재-재배포 금지파이낸셜뉴스 관련뉴스해당 언론사에서 선정하며 언론사 페이지(아웃링크)로 이동해 볼 수 있습니다.박지원 대표, '홍준표 2위' 여론조사에 대뜸..안철수 딸, 미국서 월세 1600만원 고급 아파트 거주 폭로에 돌연..[영상] 태극권·격투기 고수 대결, 20초 만에..순찰차에서 29세 女순경과 애정행각 벌인 남자의 정체[영상] 1년 묵은 거대 여드름 짜보니 '충격의 도가니'좋아요0훈훈해요0슬퍼요0화나요0후속기사 원해요0기사제공 :""]"
1,삼성전자, 2017-05-0217:51,매일경제 ,대형주 장세에 개미는 `쓴맛`,https://finance.naver.com/news/news_read.nhn?article_id=0003934427&office_id=009&mode=search&query=LG이노텍&page=1,"['       대형주 장세에 개미는 `쓴맛`      기사입력2017-05-02 17:51기사원문좋아요훈훈해요좋아요 평가하기공감좋아요0훈훈해요0슬퍼요0화나요0후속기사 원해요0댓글 ◆ 코스피 사상최고치 근접 ◆코스피가 사상 최고치를 향해 치솟고 있는 가운데 외국인과 개인투자자의 희비는 엇갈렸다. 외국인은 코스피 상승세에 올라타며 장을 주도한 반면 개인투자자는 상승장에서도 소외되는 모습이었다. 2일 한국거래소와 에프앤가이드에 따르면 3월 31일부터 4월 28일까지 4월 한 달 동안 투자 주체별 유가증권시장 순매수 상위 10개 종목의 수익률을 분석한 결과 외국인의 순매수 상위 10개 종목 가운데 7개가 오른 것으로 나타났다. 반면 개인투자자의 순매수 상위 10개 종목은 주가가 모두 하락했다. 외국인이 가장 많이 사들인 SK하이닉스(2015억원)는 이 기간에 6.93% 올랐다. 2일 SK하이닉스 주가는 실적 개선 기대감에 전 거래일 대비 2.59% 오른 5만5400원에 거래를 마쳤다. 장중 한때 5만5900원을 찍으며 52주 신고가를 갈아치웠다. 역시 외국인 선호 종목이었던 한국항공우주(10.76%), 한화테크윈(10.4%), KT&G(4.1%) 등 주가도 크게 상승한 것으로 나타났다. 외국인 순매수 상위 10개 종목 가운데 한국전력, LG이노텍, 현대모비스 등 세 곳만 마이너스 수익률을 거둔 것으로 집계됐다. 반면 4월 한 달간 개인투자자가 순매수한 상위 10개 종목은 모두 마이너스 수익률을 기록했다. 이 기간 중에 개인이 가장 많이 사들인 종목인 포스코(1619억원)는 8.07% 하락했다. 현대차, 현대모비스, LG화학, 롯데케미칼, NAVER, 기아차, LG디스플레이, 삼성물산 등 개인이 주로 사들인 종목의 주가도 역시 2~8%가량 떨어졌다. 같은 기간 코스피가 종가 기준으로 2.09% 오른 것을 감안하면 상승장에서 외국인은 양호한 수익을 거둔 반면 개인은 시장 수익률을 밑도는 손실을 낸 것이다. 코스피가 사상 최고치를 돌파할 것이란 전망에 주식 거래대금이 연초 대비 늘어난 것으로 나타났다. 지난 4월에만 하루 평균 4조3798억원으로 올해 1월 대비 7% 증가했다. 3월 하루 평균 거래대금에 비해서는 다소 줄어들었지만 코스피 상승세에 힘입어 양호한 거래 흐름을 이어나가고 있는 모습이다. 한편 삼성전자는 이날도 지난달 21일 이후 7거래일 연속 상승세를 이어가면서 사상 최고가를 기록했다. 이날 유가증권시장에서 삼성전자 주가는 전 거래일 대비 0.63% 오른 224만5000원에 거래를 마쳤다.[김대기 기자][매일경제 공식 페이스북] [오늘의 인기뉴스] [매경 프리미엄][ⓒ 매일경제 & mk.co.kr, 무단전재 및 재배포 금지]매일경제 관련뉴스해당 언론사에서 선정하며 언론사 페이지(아웃링크)로 이동해 볼 수 있습니다.섹시미 절정의 엄상미, 이 정도는 돼야 미스맥심[현장 인터뷰] 로버츠 ""류현진, 슬라이딩하다 부상...한 차례 등판 거를 것""이동건-조윤희 결혼과 임신, 공식입장 ""부부가 됐다""차 막히면 수직이륙 \'하늘을 나는 자동차\'\'50대\' 전인화, 세월 역주행하는 넘사벽 미모좋아요0훈훈해요0슬퍼요0화나요0후속기사 원해요0기사제공 :']"
2,삼성전자, 2017-05-0213:39,디지털타임스 ,"LG이노텍, 북미 조명전시회 참가…UV LED 선봬",https://finance.naver.com/news/news_read.nhn?article_id=0002400682&office_id=029&mode=search&query=LG이노텍&page=1,"['       LG이노텍, 북미 조명전시회 참가…UV LED 선봬      기사입력2017-05-02 13:39기사원문좋아요훈훈해요좋아요 평가하기공감좋아요0훈훈해요0슬퍼요0화나요0후속기사 원해요0댓글 [디지털타임스 박슬기 기자] LG이노텍은 오는 9일부터 11일까지 미국 필라델피아에서 열리는 \'국제조명전시회(LFI) 2017\'에 참가한다고 2일 밝혔다. 이 전시회에는 약 550여개 조명 업체가 참가하며 약 3만명이 관람한다.LG이노텍은 자외선(UV) LED와 조명용, 차량용 LED 등 제품을 앞세울 계획이다. 이 가운데 70㎽ UV-C LED는 칫솔 살균용보다 70배 강한 자외선을 방출해 정수·정화·경화용으로 사용한다. LG이노텍의 컬러 LED 패키지는 적·녹·청 등 다양한 색을 구현한다.또 이 회사는 헤드램프, 주간주행등(DRL), 방향지시등, 후미등, 룸램프, 계기판 등 차량용 LED 패키지와 모듈을 전시한다.LG이노텍 관계자는 ""이번에 전시하는 LED는 성능과 품질 측면에서 높은 수준에 올라선 제품""이라며 ""신규 고객을 확보하고, 기존 고객과의 관계를 탄탄히 다질 수 있도록 차별화한 제품 경쟁력을 적극적으로 알릴 것""이라고 말했다.박슬기기자 seul@dt.co.kr디지털타임스 홈페이지 바로가기/SNS 바로가기확바뀐 디지털타임스 연예·스포츠 섹션 바로가기< Copyrights ⓒ 디지털타임스 & dt.co.kr, 무단 전재 및 재배포 금지 >박슬기 seul@디지털타임스 관련뉴스해당 언론사에서 선정하며 언론사 페이지(아웃링크)로 이동해 볼 수 있습니다.\xa0모터 회전속도 항공기 엔진의 16배… LG 핸드스틱 무선청소기의 비밀\xa0삼성전자 \'하만 효과\'… 자동차 전장부품 시장 단숨에 8위\xa0ICT 분야 공공기관장 최고연봉 KISA… 직원 평균연봉 1위는?\xa0암 전이·재발 원인 국내서 첫 규명… 항암치료 새 \'전기\'\xa05G 상용화 되기전 4G LTE 최대속도 얼마까지 가능할까?좋아요0훈훈해요0슬퍼요0화나요0후속기사 원해요0기사제공 :']"
3,삼성전자, 2017-05-0213:36,YTN ,"[기업] LG이노텍, 북미 최대 조명전시회 참가",https://finance.naver.com/news/news_read.nhn?article_id=0001005517&office_id=052&mode=search&query=LG이노텍&page=1,"['       [기업] LG이노텍, 북미 최대 조명전시회 참가      기사입력2017-05-02 13:36기사원문좋아요훈훈해요좋아요 평가하기공감좋아요0훈훈해요0슬퍼요0화나요0후속기사 원해요0댓글 LG이노텍은 오는 9일부터 11일까지 미국 필라델피아에서 열리는 \'국제조명전시회 2017\'에 참가한다고 밝혔습니다.이 전시회에는 550여 개 조명 관련 업체가 참가하며, 업계 종사자만 3만여 명이 관람합니다.LG이노텍은 전시회에서 독자 기술로 개발한 UV, 즉 자외선 LED와 차량용 LED 등을 선보일 예정입니다.임승환[shlim@ytn.co.kr]▶뉴스 덕후들의 YTN페이스북 ▶""대한민국을 구할 대통령을 찾아라"" 2017 대선! 안드로메다[저작권자(c) YTN(Yes! Top News) 무단전재 및 재배포 금지]YTN 관련뉴스해당 언론사에서 선정하며 언론사 페이지(아웃링크)로 이동해 볼 수 있습니다.""네가 뭔데 의심해"" 검표 KTX 승무원 무차별 폭행홍대 앞 쓰레기 문제 해결한 23cm 환경미화원바른정당 13명 탈당...대선에 미치는 변수는?""스승의날 카네이션, 개인적으로 달아드리면 위법?""[영상] 삼성중공업 크레인 사고 현장 공개좋아요0훈훈해요0슬퍼요0화나요0후속기사 원해요0기사제공 :']"
4,삼성전자, 2017-05-0210:43,데일리안 ,"LG이노텍, 북미 최대 조명전시회 참가",https://finance.naver.com/news/news_read.nhn?article_id=0002183314&office_id=119&mode=search&query=LG이노텍&page=1,"['       LG이노텍, 북미 최대 조명전시회 참가      기사입력2017-05-02 10:43기사원문좋아요훈훈해요좋아요 평가하기공감좋아요0훈훈해요0슬퍼요0화나요0후속기사 원해요0댓글LG이노텍 기업이미지통합(CI).ⓒLG이노텍LG이노텍(대표 박종석)은 오는 9일부터 11일까지 미국 필라델피아에서 열리는 ‘국제조명전시회(LFI·Light Fair International) 2017’에 참가한다. 이번 전시회는 약 550여개 조명 관련 업체가 참가하며 업계 종사자만 약 3만명이 참관하는 북미 최대 행사로 최신 조명 트렌드를 알 수 있고 기업간 거래도 활발히 이뤄진다.LG이노텍은 고출력·고신뢰성 제품을 앞세워 글로벌 조명업체들의 이목을 사로잡는다는 계획이다. 이 회사가 독자 기술로 개발한 UV(ultraviolet rays) 발광다이오드(LED)와 조명용·차량용 LED가 핵심이다.가장 주목할 부분은 경화 및 살균용으로 사용할 수 있는 UV LED다. LG이노텍의 광출력 70밀리와트(mW) UV-C LED는 전시회 전부터 많은 관심을 받고 있다. 280나노미터(nm) 파장 제품 중 세계 최고 성능이다.이 UV-C LED는 흐르는 물이나 공기까지 살균하는 강력한 자외선을 방출한다. 칫솔 살균용보다 70배 강한 자외선을 방출해 정수·정화·경화용 등으로 사용하기 좋다. 자외선 출력이 강해 경화 장치 성능을 높인다.이와 함께 LG이노텍은 세계 최고 수준의 광출력을 구현한 하이파워 LED 패키지와 컬러 LED 패키지 등 조명용 고출력 LED를 선보인다.이 회사의 대표적인 하이파워 LED 패키지인 ‘3535 Gen4-X’는 광효율이 171루멘퍼와트(lm/W)로 높다. 독자적인 수직형 칩 기술을 적용한 덕분이다. 조명 내부에 장착하기 용이한 슬림형으로 디자이너들에게 인기다.LG이노텍의 컬러 LED 패키지는 레드·그린·블루 등 다양한 색을 구현한다. 빌딩 및 경기장 등의 고급 조명부터 특수 조명까지 활용도가 높다. 특히 이 제품은 광출력이 8W에 달하는 고출력 모델로서 조명의 가격경쟁력을 높인다. 적은 수의 LED로 밝은 빛을 낼 수 있어서다.또 LG이노텍은 혁신적인 디자인과 품질 신뢰성을 확보한 차량용 LED 풀 라인업을 전시한다. 이 회사는 헤드램프부터 주간주행등(DRL)·방향지시등·후미등·룸램프·계기판까지 각 용도에 최적화한 LED 패키지와 모듈을 모두 보유하고 있다.특히 후미등용 LED 면광원 모듈은 독보적인 디자인과 3.5밀리미터 두께의 초슬림 혁신 제품이다. 차량의 컨셉에 맞춰 가느다란 선이나 면으로 후미등을 다양하게 디자인할 수 있다.회사측은 북미 최대 규모 조명 전시회에서 차별화된 LED 기술력을 뽐내며 글로벌 시장 공략에 박차를 가한다는 계획이다. 회사 관계자는 “이번에 전시하는 LED는 성능과 품질 측면에서 세계 최고 수준에 올라선 제품들”이라며 “신규 고객을 확보하는 한편 기존 고객과의 관계를 한층 탄탄히 다질 수 있도록 차별화된 제품 경쟁력을 적극 알릴 것”이라고 말했다.데일리안 이홍석 기자ⓒ (주)데일리안 - 무단전재, 변형, 무단배포 금지좋아요0훈훈해요0슬퍼요0화나요0후속기사 원해요0기사제공 :']"
5,삼성전자, 2017-05-0210:17,머니투데이 ,"LG이노텍, 북미 LED 시장 공략…국제조명전시회 참가",https://finance.naver.com/news/news_read.nhn?article_id=0003866536&office_id=008&mode=search&query=LG이노텍&page=1,"['       LG이노텍, 북미 LED 시장 공략…국제조명전시회 참가      기사입력2017-05-02 10:17기사원문좋아요훈훈해요좋아요 평가하기공감좋아요0훈훈해요0슬퍼요0화나요0후속기사 원해요0댓글 [머니투데이 심재현 기자] [차별화된 LED 기술력 공개…""성능·품질 최고 제품으로 경쟁력 알릴 것""]LG이노텍이 양산에 돌입한 정수기 코크 살균용 UV LED모듈. /사진제공=LG이노텍LG이노텍이 오는 9일부터 11일까지 미국 필라델피아에서 열리는 \'국제조명전시회(LFI) 2017\'에 참가한다고 2일 밝혔다. 550여개 조명 관련 업체에서 업계 종사자만 3만여명이 관람하는 북미 최대 규모 조명 전시회에서 차별화된 LED 기술력을 내세워 글로벌 시장 공략에 박차를 가한다는 계획이다.LG이노텍은 전시회에서 독자 기술로 개발한 UV(자외선) LED(발광다이오드)와 조명용, 차량용 LED를 핵심제품으로 선보일 예정이다.광출력 70㎽(밀리와트) UV-C LED는 칫솔 살균용보다 70배 강한 자외선으로 흐르는 물이나 공기까지 살균할 수 있다. 280㎚(나노미터) 파장 제품 중 세계 최고 성능을 갖춰 정수·정화용 제품으로 사용할 수 있다고 LG이노텍은 설명했다.LG이노텍은 세계 최고 수준의 광출력을 구현한 하이파워 LED 패키지와 컬러 LED 패키지 등 조명용 고출력 LED도 전시한다.하이파워 LED 패키지 \'3535 Gen4-X\'는 독자적인 수직형 칩 기술을 적용해 광효율을 171 ㏐/W(루멘퍼와트)까지 높인 제품으로 조명 내부에 장착하기 용이한 슬림형 디자인으로도 인기를 끌고 있다는 설명이다.LG이노텍이 선보이는 차량용 LED 풀 라인업 중 후미등용 LED 면광원 모듈은 독보적인 디자인과 3.5밀리미터 두께의 초슬림 혁신 제품이다. 차량의 컨셉에 맞춰 가느다란 선이나 면으로 후미등을 다양하게 디자인할 수 있다.LG이노텍은 헤드램프부터 주간주행등(DRL), 방향지시등, 후미등, 룸램프, 계기판까지 용도별로 최적화한 LED 패키지와 모듈을 보유하고 있다.회사 관계자는 ""이번에 전시하는 LED는 성능과 품질 면에서 세계 최고 수준에 올라선 제품""이라며 ""신규 고객을 확보하는 한편 기존 고객과의 관계를 한층 탄탄히 다질 수 있도록 차별화된 제품 경쟁력을 적극 알릴 것""이라고 말했다.[▶깊이있는 투자정보 \'TOM칼럼\'][▶트렌드 리더의 스타일 지침서 \'스타일M\'][▶빵빵한 차&레이싱걸]심재현 기자 urme@mt.co.kr머니투데이 관련뉴스해당 언론사에서 선정하며 언론사 페이지(아웃링크)로 이동해 볼 수 있습니다.[★화보]한채아 \'물오른 미모의 민폐하객\'유승민 딸 유담, 걸그룹 댄스로 깜찍 유세…""장인 응원"" 열풍[★화보]명동 마비시킨 지드래곤의 인기아들 결혼식 못간 홍준표 ""손주 5명 낳으면 다 키워준다""해수욕장서 상어 공격, 물놀이 하던 女허벅지 물어뜯어좋아요0훈훈해요0슬퍼요0화나요0후속기사 원해요0기사제공 :']"
