,회사명,날짜,언론사,기사제목,링크,본문
0,삼성전자, 2017-07-1216:24,아이뉴스24 ,[마감시황]코스피 하락…삼성전자 장중 250만원 돌파,https://finance.naver.com/news/news_read.nhn?article_id=0000417430&office_id=031&mode=search&query=LG이노텍&page=1,"['       [마감시황]코스피 하락…삼성전자 장중 250만원 돌파      기사입력2017-07-12 16:24기사원문좋아요훈훈해요좋아요 평가하기공감좋아요0훈훈해요0슬퍼요0화나요0후속기사 원해요0댓글[아이뉴스24 김나리기자] 전날 사상 최고가로 마감했던 코스피가 기관 매도세에 소폭 하락했다. 반면 시총 대장주인 삼성전자는 3일 연속 사상 최고가를 경신했다.12일 코스피는 전날보다 0.18%(4.23포인트) 내린 2391.77에 장을 마쳤다. 이날 코스피는 2399.28까지 상승하며 2400선에 다시 다가서기도 했지만 기관 매도세를 이기지 못하고 소폭 하락한 채 마감했다.코스피시장에서는 개인이 1천801억원, 외국인이 884억원어치를 샀지만, 기관이 3천214억원어치 \'팔자\'에 나서면서 지수를 끌어내렸다.시가총액 상위 10종목에서는 시총 대장주인 삼성전자가 1.80% 오른 가운데 삼성전자우(0.67%), 현대차(0.68%), KB금융(0.35%) 등이 상승했다.SK하이닉스는 0.14% 내렸고, 네이버는 1.08%, 삼성물산은 2.06%, 한국전력은 1.06%, 포스코는 0.65%, 삼성생명은 1.62% 하락했다.이날 삼성전자는 장중 250만원까지 치솟으며 3일 연속 사상 최고가를 갈아치웠다.삼성전자가 지난 7일 시장의 예상치를 상회하는 사상 최대 분기 실적을 발표한 가운데, 하반기에도 실적이 증가할 것이라는 증권가의 예상이 나오면서 주가가 상승세를 보이는 것으로 풀이된다.최근 한 달 간 증권사들이 추정한 삼성전자의 적정주가 평균치는 약 290만9천원으로, SK증권은 삼성전자의 주가가 최대 320만원까지 오를 것이라고 전망했다.삼성전자는 올랐지만 IT주들은 약세를 보였다. SK하이닉스가 내린 가운데 LG전자(-0.98%), LG디스플레이(-1.76%), LG이노텍(-4.08%), 삼성SDS(-1.62%), 삼성전기(-1.96%) 등은 모두 하락했다.면세점 특혜 파문이 나온 가운데 한화갤러리아타임월드는 전일보다 3.38% 하락한 3만원에 마감했다. 개장 직후에는 2만9천550원까지 떨어지며 52주 신저가도 기록했다.전날 감사원은 관세청에 대한 면세점 특허심사를 감사한 결과, 2015년 1,2차 면세점 신규 사업자 선정과 2016년 신규특허 추가발급 방침 결정 등에서 총 13건의 위법·부당 사항을 확인했다고 발표했다.감사원에 따르면 관세청은 지난 2015년 1, 2차 면세점 사업자 선정 과정에서 롯데 대신 한화·두산이 신규 사업자로 선정될 수 있도록 특혜를 준 것으로 나타났다.현대차 3인방은 횡보장세에서도 저가매수세가 나타나면서 나란히 강세를 보였다.현대차는 전일보다 0.68%, 기아차는 0.54%, 현대모비스는 0.41% 상승했다.업종별로는 전기전자(1.09%), 운수창고(0.61%), 제조업(0.33%) 등이 상승했으며 유통업(-1.26%), 전기가스업(-1.14%), 건설업(-1.51%), 은행(-1.44%), 증권(-1.44%) 등이 하락했다.코스닥도 전일보다 0.75%(4.91포인트) 하락한 651.10에 마감했다.코스닥시장에서도 개인이 589억원, 외국인이 38억원 샀지만 기관이 나홀로 440억원어치 매도우위를 보였다.한편 서울 외환시장에서 원/달러 환율은 전일보다 6.00원(0.52%) 내린 1145.10원을 기록했다./김나리기자 lily@inews24.com▶프리미엄 뉴스서비스 아이뉴스24▶연예스포츠 조이뉴스24, 생생한 라이브캐스트[ⓒ 아이뉴스24 무단전재 및 재배포 금지]아이뉴스24 관련뉴스해당 언론사에서 선정하며 언론사 페이지(아웃링크)로 이동해 볼 수 있습니다.사조동아원 ""한국제분 합병 통해 자체경쟁력 확보""\'홀로서기 4년\' bhc치킨, \'상생\' 덕에 업계 2위 \'우뚝\'상반기 유튜브 휩쓴 인기 동영상과 채널은?안철수 대국민 사과 ""대선후보로서 책임 통감""송·조 임명 미뤘지만…靑 ""文 대통령 원칙적 입장""좋아요0훈훈해요0슬퍼요0화나요0후속기사 원해요0기사제공 :']"
1,삼성전자, 2017-07-1216:17,이데일리 ,대기업 계열사 사옥 이전·재배치 활발.. 서울 오피스빌딩 공실 희비,https://finance.naver.com/news/news_read.nhn?article_id=0003872351&office_id=018&mode=search&query=LG이노텍&page=1,"['       대기업 계열사 사옥 이전·재배치 활발.. 서울 오피스빌딩 공실 희비      기사입력2017-07-12 16:17기사원문좋아요훈훈해요좋아요 평가하기공감좋아요0훈훈해요0슬퍼요0화나요0후속기사 원해요0댓글- 도심 파인애비뉴·서울스퀘어 빌딩 새 입주자 공실 해소- 여의도 LG계열사 마곡 이전.. 전경련빌딩 공실 발생할 듯[이데일리 이진철 기자] 대기업 계열사의 사옥 재배치와 이전이 활발하면서 서울 대형 오피스시장의 공실률에도 영향을 끼치고 있다. 12일 글로벌 부동산 컨설팅사인 쿠시먼앤드웨이크필드 코리아의 ‘올 2분기 오피스시장 보고서’에 따르면 도심권역(CBD) 공실률은 주요 대기업 계열사의 재배치로 인해 지난분기 대비 상승했다.SK 건설은 최근 수평증축과 리모델링을 통해 신규 공급된 수송스퀘어로 이전하고, SK건설이 임차했던 파인애비뉴A 빌딩의 전체 면적이 임대차 시장에 공급됐다. 하지만 신한카드가 파인애비뉴A 빌딩으로 본사 이전을 결정함에 따라 상당부분 공실을 해소할 것으로 기대된다. 서울스퀘어 빌딩은 페르노리카코리아와 한국MSD 등의 계약으로 공실을 다소 해소했다.CJ 올리브네트웍스는 트윈시티남산으로 5개층을 추가로 임차하며 본사 이전을 계획하고 있다. 반면 LG전자, LG이노텍등 LG그룹 계열사가 서울스퀘어빌딩에서 LG서울역빌딩으로 이전했다. 이로 인해 발생하는 공실면적은 SK플래닛과 합병한 11번가가 신대방동 빌딩에서 이전하기로 결정하면서 해소됐다. SK커뮤니케이션즈는 NH농협생명빌딩(임광빌딩)에서 T타워로 이전을 완료했다.강남권역(GBD)은 다른권역과 비교해 한정된 프라임급 오피스 공급면적과 공유 오피스 공급의 확장세로 안정적인 임차흐름을 보이고 있다. 강남권역의 공실률은 타권역과 달리6.6%로 하락했다.특히 이번 분기 파르나스타워의 잔여공실 면적 해소가 두드러졌다. 블리자드엔터테인먼트, 신세계프로퍼티, 카카오프렌즈가 임차계약을 체결했다. 추가로 남아있는 공실은 현재 섬유센터 면적의 대부분을 사용하고 있는 법무법인 율촌이 유력한 임차인으로, 임차를 결정할 경우 모두 해소될 것으로 전망된다.여의도권역(YBD)은 임차인 이동이 대규모로 예정돼 있어 공실률이 상승할 전망이다. 특히 내년 국내 최대 규모의 연구개발(R&D) 단지인 마곡LG사이언스파크가 준공 예정이어서 현재 전경련회관 빌딩에 입주하고 있는 LG CNS가 마곡지구로 이탈할 경우에는14개층, 약 7,000여평 규모의 공실 면적이 발생할 것이라고 쿠시먼앤드웨이크필드측은 예상했다. 쿠시먼앤드웨이크필드 코리아 제공이진철 (cheol@edaily.co.kr)▶심쿵유발 스타 화보 [핫포토]▶한 눈에 보는 이슈 트렌드 [카드뉴스]▶이데일리 [페이스북] | [카카오 친구 맺기~♥]＜ⓒ종합 경제정보 미디어 이데일리 - 무단전재 & 재배포 금지＞이데일리 관련뉴스해당 언론사에서 선정하며 언론사 페이지(아웃링크)로 이동해 볼 수 있습니다.\'제보조작\' 이준서 구속…국민의당 윗선 수사 급물살[하반기 재테크 기상도]③""1달러=1100원 초반대에 틈틈이 사라""복날엔 삼계탕···찰떡궁합 재료는?GTX 착공·리모델링 탄력…두달 새 7000만원 뛴 분당 집값안철수, 오늘 \'제보 조작\' 관련 첫 입장표명..정치적 책임 언급 \'주목\'좋아요0훈훈해요0슬퍼요0화나요0후속기사 원해요0기사제공 :']"
2,삼성전자, 2017-07-1213:47,뉴시스 ,"재계 ""협력사 경쟁력이 우리 경쟁력""···'동반성장' 방안 마련 분주",https://finance.naver.com/news/news_read.nhn?article_id=0008063793&office_id=003&mode=search&query=LG이노텍&page=1,"['       재계 ""협력사 경쟁력이 우리 경쟁력""···\'동반성장\' 방안 마련 분주       기사입력2017-07-12 13:47기사원문좋아요훈훈해요좋아요 평가하기공감좋아요0훈훈해요0슬퍼요0화나요0후속기사 원해요0댓글협력사 경쟁력 향상 지원 강화·고용확대 등 방안 준비할 듯 삼성,  1~3차 협력업체에 펀드 조성해 지원하는 등 다양한 \'상생\' 전개 현대차·SK·LG 등 협력사 지원 프로그램 지속적으로 펼쳐와  【서울=뉴시스】이연춘 유자비 김지은 기자 = 재계가 동반성장방안 마련에 고심하고 있다. 대기업들은 주로 그동안 해오고 있는 협력사의 경쟁력 향상을 위한 지원책을 대폭 강화하고 고용확대 등의 동반성장책을 추진할 것으로 예상되고 있다.  12일 재계에 따르면 삼성전자 현대기아차 등 15대 그룹은 지난 11일 상의에서 회동을 가진뒤 ""기업에 대한 사회적 요구에 대해 기업별로 형편에 맞게 자발적으로 솔선하겠다""는데 뜻을 밝힌데 따라 구체적 실행방안 마련을 위해 분주한 모습 대기업들은 다음달 하순께 이뤄질 예정인 문재인 대통령과의 첫 회동에 맞춰 각 기업별 상황에 맞는 동반성장 내용들을 내놓을 것으로 예상되고 있다.  재계 한 고위 관계자는 ""지난 11일 대한상의와 대기업 그룹사의 간담회는 대기업들의 사회적 책임을 강화하는 문제에 대해 논의됐다""며 ""과거와 같이 투자나 고용 계획을 일괄적으로 받아 발표하는 형식은 하지 않기로 한만큼 개별기업별로 적절한 실행방안을 준비하고 있다""고 설명했다.  또다른 재계 관계자는 ""새 정부 국정과제 1순위는 일자리, 공정거래""라며 ""대기업과 중소기업 간 상생협력 사례를 적극적으로 홍보하고, 이와 관련된 계획을 발굴해 실천하는 방안을 모색해 나갈 것""이라고 전했다. 특히 문재인 정부의 경제정책 방향인 \'동반성장론\'과 관련해 상생협력 방안을 확대하고 그 사례를 적극적으로 홍보하는 작업도 병행해 나간다는 방침이다.  이동근 대한상의 상근부회장은 전날 회동에서 ""삼성의 경우 1차 뿐 아니라 2차, 3차 협력 업체들에게도 공정거래 관계가 유지되도록 펀드를 조성해서 지원하는 좋은 사례가 준비돼 있어 발표할 수 있을 것""이라며 ""이처럼 좋은 사례를 먼저 발표하면 전 대기업에 확산될 수 있도록 하는 게 필요하다는 의견이 모아졌다""고 전했다. 실제로 삼성전자는 전 협력사들이 함께 공생 할 수 있는 생태계 구축과 확대에 앞장서고 있다. 협력사의 발전이 곧 삼성전자의 경쟁력 향상으로 이어진다는 경영 철학이 반영됐다는 것이 회사측 설명이다.  삼성전자는 ""상생 전략을 강화해 나갈 것이다. 협력사의 경쟁력을 제고하고 파트너십을 구축하는 등 지속 가능한 상생협력 체제를 구축하는데 역점을 두고 있다""며 ""협력사가 글로벌 경쟁력을 갖춰 성장할 수 있도록 인적 역량 개발 지원, 경쟁력 제고 지원 등 다양한 상생협력 프로그램을 운영하고 있다""고 말했다.  삼성전자는 자금 조달에 어려움을 겪고 있는 중소기업의 자금 유동성 확보를 지원하기 위해 다양한 자금 지원 프로그램을 운영하고 있다. 2005년부터 국내 최초로 거래대금을 전액 현금으로 지급하고, 2011년부터는 대금지급 횟수를 월 2회에서 4회로 변경하는 등 대금지급 조건을 개선했다.  2010년부터 기업은행, 산업은행, 우리은행과 함께 1조 원 규모의 상생펀드를 조성하여 자금이 필요한 협력사에게 기술개발, 설비투자, 운전자금 등을 업체별로 최대 90억 원까지 저리로 대출해 주고 있다. 2011년부터는 1차 협력사뿐만 아니라 2차 협력사까지 지원대상을 확대해 지난해 모두 461개사에 8232억원을 지원했다.  또한 삼성전자는 2017년 6월부터 1차 협력사가 2차 협력사에게 물품대금을 전액 현금으로 30일 이내 지급하도록 하는 혁신적 물품 대금 지급 프로세스를 실시하고 있다. 이를 위해 삼성전자는 하나, 신한, 국민은행과 총 5000억원 규모의 \'물대지원펀드\'를 조성해 1차 협력사가 현금으로 대금을 지급하는데 어려움이 없도록 무이자 대출 지원에 힘쓰고 있다.  삼성전자는 아이디어와 기술력은 있지만 자금여력이 부족한 국내 중소기업의 기술개발 활성화를 위해 중소기업청에서 추진하고 있는 민관공동투자 기술개발사업에 2013년 11월부터 참여하고 있다. 삼성전자와 중소기업청은 각 100억 원씩 총 200억 원의 개발기금을 공동으로 조성하여 중소기업 R&D 과제의 개발비를 지원하고 있으며, 중소기업은 총 개발비의 75% 이내에서 최대 10억 원까지 지원받을 수 있다.  아울러 협력사 맞춤형 교육 프로그램도 진행하고 있다. 교육센터는 협력사 임직원의 역량강화를 위해 협력사에서 필요한 다양한 맞춤형 교육과정을 개발하여 무상으로 지원하고 있다. 2016년에는 교육에 대한 협력사 니즈를 반영하여, 총 310여 개의 다양한 온오프라인 과정을 개설하여 운영했다.   또한 컨설팅센터는 경영관리, 제조, 개발, 품질 등 해당 전문분야에서 20년 이상의 노하우를 가진 삼성전자 임원과 부장급 100여 명으로 상생컨설팅팀을 구성, 협력사 현장의 맞춤형 혁신활동을 지원하고 있다. 현대기아차, SK, LG 등도 협력회사와 함께 동반성장에 팔을 걷어부치고 있다. 이들은 \'협력회사의 경쟁력이 우리의 경쟁력\'이라는 상생철학을 바탕으로 협력회사 기술 경쟁력 지원 활동에 적극적이다. 현대기아차는 2012년부터 협력사 채용박람회를 진행하고 있다. 이는 협력사에 우수 인재를 채용할 가능성을 높여주고 있다는 평가를 받고 있다.  현대기아차는 협력사에 장소 제공은 물론 행사 기획, 운영, 재정 지원을 책임지고 있다. 이에 힘입어 현대기아차 1차 협력사들은 대졸 및 고졸 신입사원과 생산직 등을 포함해 매년 평균 1만6000여명을 신규 채용하고 있다.  SK 역시 동반 상생의 노력을 강화해 나가고 있다. SK는 2007년부터 10년 동안 꾸준히 \'동반성장 CEO 세미나\'를 개최해왔다. 이를 통해 협력업체 CEO들에게 경영전략, 재무, 마케팅, 리더십 등 기업 경영 전반에 대한 노하우를 교육하며 강의료는 그룹 측에서 부담한다.  특히 2013년 동반성장 분야를 특화시킨 \'사회공헌위원회\'를 발족한 바 있어 이를 전파하며 협력업체와의 상생경영을 체계적으로 지원할 계획이다. 이런 활동들은 앞으로 더욱 강화해 나갈 예정이다.  LG 계열사는 사내 컨설팅 전문인력을 협력사에 파견해 2016년 한해 동안 5200여건의 기술을 지원했고, 1000개 이상의 협력사에 도움을 줬다. 장비∙부품의 국산화 개발, 시제품 제작 무상지원, 특허 및 성과공유 등 생산성과 품질 경쟁력 향상을 위한 실질적인 지원을 병행했다. LG전자는 2011년부터 \'LG전자 경영컨설팅 프로그램\'을 운영하며, 지난해 250명이 넘는 사내 기술인력을 협력사에 파견해 협력사의 생산성 향상과 신기술 개발, 품질 경쟁력 제고를 위한 실질적인 지원을 하고 있다. LG디스플레이, LG이노텍, LG화학, LG생활건강 등 계열사들도 협력회사의 역량 강화를 직접 지원한다는 취지에서 각 분야별 컨설팅 전문인력을 파견해 지원하고 있다.  재계 관계자는 ""대통령과 대기업 총수와의 간담회에서는 대기업의 사회적 책임을 강화하는 문제와 동반성장·상생협력과 관련된 그룹별 사례를 전파하는 쪽으로 의제를 준비하게 될 것""이라고 말했다. lyc@newsis.com뉴시스 뉴스, 네이버 뉴스 스탠드에서도 만나세요뉴시스 SNS [페이스북] [트위터]뉴시스 관련뉴스해당 언론사에서 선정하며 언론사 페이지(아웃링크)로 이동해 볼 수 있습니다.정유라 ""최순실, 삼성 소유 말 \'내 것처럼 타라\' 했다""""왜 마음 안받아줘?"" 여성 직장동료 살해 20대 \'징역 35년\'\'형부 성폭행으로 낳은 아들 살해\' 20대女 징역4년, 형부는…\'제보 조작\' 이준서 구속…검찰, 국민의당 지도부 \'타깃\'대구서 중학생이 여교사 성추행…경찰 수사좋아요0훈훈해요0슬퍼요0화나요0후속기사 원해요0기사제공 :']"
