,회사명,날짜,언론사,기사제목,링크,본문
6,삼성전자, 2018-07-2608:59,전자신문 ,"[ET투자뉴스]LG이노텍, ""호실적을 앞두고 …"" HOLD-삼성증권",https://finance.naver.com/news/news_read.nhn?article_id=0002727059&office_id=030&mode=search&query=LG이노텍&page=2,"['       [ET투자뉴스]LG이노텍, ""호실적을 앞두고 …"" HOLD-삼성증권      기사입력2018-07-26 08:59기사원문좋아요훈훈해요좋아요 평가하기공감좋아요0훈훈해요0슬퍼요0화나요0후속기사 원해요0댓글삼성증권에서 26일 LG이노텍(011070)에 대해 ""호실적을 앞두고 ""라며 투자의견을 \'HOLD\'로 제시하였고, 아울러 목표주가로는 180,000원을 내놓았다. 삼성증권 이종욱, 이경호 애널리스트가 동종목에 대하여 이번에 제시한 \'HOLD\'의견은 삼성증권의 직전 매매의견에서 큰 변화없이 그대로 유지되는 것이고  올해 초반의 매매의견을 기준으로  볼때도 역시 \'중립\'의견이 계속 유지되고 있는 상태이다. 그리고 최근 분기내 발표된 전체 증권사 리포트의 컨센서스와 비교를 해볼 경우에 오늘 발표된 투자의견은 전체의견을 소폭 하회하는 수준으로 평가되는데, 이는 동종목에 대한 기대감을 다소 약하게 표현한 것으로 분석되고 있다. 목표주가의 추이를 살펴보면 이번에 다시 목표가가 같은 수준을 유지하면서 최근 흐름은 목표가의 계단식 상승이 진행되는 모습이다. 또한 전일 종가 기준으로 볼때 동종목의 현주가는 이번에 제시된 목표가 대비 10.8%의 저평가 요인이 존재한다는 해석이 제시되고 있다. ◆ Report briefing삼성증권에서 LG이노텍(011070)에 대해 "" 단기 트레이딩 아이디어는 누군가에게는 의미가 있겠지만, 다수에게는 리스크 요인이다. 3Q18의 영업이익 컨센서스의 상향 조정 가능성이 크고, 환율 변화가 우호적이며 9월 신제품 출시 이전의 기대감 반영 기회가 있다는 점이 매력적이라는 것을 인정한다. 그러나 장기적 시각으로 보면 올해의 신제품 스펙은 평이하며, 기대되는내년 신제품 까지는 아직 오랜 시간이 남았다""라고 분석했다.  또한 삼성증권에서 ""2Q18 매출액 1.7조원에 영업이익 134억원을 기록하였다. 2Q 영업이익 흑자를 예상했음에도 규모가 당사 추정치(83억원) 대비 컸다. 물론 이익률로 보면 오차 수준에서 큰 의미를 부여하기는 어렵다. 다만 전방 고객사들이 모두 부진한상황 속에서 동사의 이익 창출 역량을 검증 받았다는 점에서 의미를 찾는다""라고 밝혔다. ◆ Report statistics삼성증권의 동종목에 대한 최근 1년동안의 투자의견은 전체적으로 조금 하향조정되고 있다. 목표주가는 2017년10월 200,000원까지 높아졌다가 2018년4월 135,000원을 최저점으로 목표가가 제시된 이후 최근에 180,000원으로 새롭게 조정되고 있다. 한편 증권정보제공 업체인 씽크풀에 따르면 동사에 대한 컨센서스는 \'매수\'이고 목표주가의 추이를 살펴보면 최근 2회연속 목표가가 낮아지다 이번에는 직전목표가보다 높은 수준으로 크게 상향반전하는 추세이다. \xa0컨센서스최고최저투자의견매수매수HOLD목표주가190,412220,000163,000*최근 분기기준오늘 삼성증권에서 발표된 \'HOLD\'의견 및 목표주가 180,000원은 전체의견을 소폭 하회하는 수준으로 동종목에 대한 기대감을 다소 약하게 표현한 것으로 풀이되며 목표가평균 대비 5.5%정도 미달하고 있는 것으로 집계되었다.  참고로 최근에 목표주가를 가장 공격적으로 제시한 한화투자증권에서 투자의견 \'BUY(유지)\'에 목표주가 220,000원을 제일 보수적인 의견을 제시한 하나금융투자에서 투자의견 \'매수\'에 목표주가 163,000원을 제시한 바 있다. \xa0의견제시일자투자의견목표가격20180726HOLD180,00020180719HOLD180,00020180425HOLD135,00020180412HOLD135,00020180124HOLD145,000의견제시일자증권사투자의견목표가20180726삼성증권HOLD180,00020180726현대차투자증권BUY200,00020180725KB증권BUY(유지)185,00020180723신한금융투자매수(유지)200,000(씽크풀에서 제공하는 컨센서스는 국내 전증권사에서 발표되는 기업분석 리포트 및 코멘트를 실시간으로 통계/분석처리되고 있습니다.)증시분석 전문기자 로봇 ET etbot@etnews.com전자신문과 씽크풀의 증시분석 전문기자 로봇 ET가 쓴 기사입니다▶ 전자신문 바로가기 [Copyright ⓒ 전자신문 & 전자신문인터넷, 무단전재 및 재배포 금지]전자신문 관련뉴스해당 언론사에서 선정하며 언론사 페이지(아웃링크)로 이동해 볼 수 있습니다.[단독]中텐센트·알리바바 \'QR\' 굴기 막자...정부, 한국 통합 \'QR페이\' 개발 착수차이나머니, 韓 장비기업 사냥...\'한스레이저\' 경쟁사 인수 추진삼성, 업계 최초 7.1채널 음향에 천장 4채널 덧붙인 사운드바 내놓는다아우디 A3, 40% 할인 판매 진실은…""현금 \'No\', 리스만""[국제]""전기차가 대세""…日, 2050년엔 엔진 전용차 퇴출한다좋아요0훈훈해요0슬퍼요0화나요0후속기사 원해요0기사제공 :']"
7,삼성전자, 2018-07-2608:57,이데일리 ,"LG이노텍, 2분기 실적 양호에 목표가↑-하나",https://finance.naver.com/news/news_read.nhn?article_id=0004158986&office_id=018&mode=search&query=LG이노텍&page=2,"['       LG이노텍, 2분기 실적 양호에 목표가↑-하나      기사입력2018-07-26 08:57기사원문좋아요훈훈해요좋아요 평가하기공감좋아요0훈훈해요0슬퍼요0화나요0후속기사 원해요0댓글 [이데일리 박태진 기자] 하나금융투자는 26일 LG이노텍(011070)에 대해 기판(전기회로가 있는 판)소재 사업부의 수익성 개선으로 2분기 양호한 실적을 기록했다고 밝혔다. 이에 따라 목표주가는 16만2500원에서 19만원으로 상향 조정했고, 투자의견은 매수(Buy)를 유지했다. 김록호 하나금융투자 연구원은 이날 보고서에서 “2분기 매출액은 1조5178억원으로 전년동기대비 13% 증가했고, 영업이익은 136억원으로 전년대비 58% 감소했다”며 “다만 영업이익은 시장 기대치(36억원 적자)를 상회했다”고 분석했다.김 연구원은 “기판소재 사업부에서 고수익성인 디스플레이 관련 부품의 실적이 견조한 가운데 반도체 패키징 기판 매출액 등이 증가했다”며 “3분기에는 북미 고객사의 신제품 출시로 인해 듀얼(전·후면)카메라와 3D 센싱 카메라 공급이 증가해 광학솔루션 사업부의 매출액이 늘어날 것”이라고 전망했다.박태진 (tjpark@edaily.co.kr)2030을 위한 알짜 정보가 가득 [스냅타임▶]네이버 홈에서 ‘이데일리’ [구독하기▶]최신 웹툰이 매일 공짜. \'웹툰\' [감상하기▶]＜ⓒ종합 경제정보 미디어 이데일리 - 무단전재 & 재배포 금지＞이데일리 관련뉴스해당 언론사에서 선정하며 언론사 페이지(아웃링크)로 이동해 볼 수 있습니다.섹시한 몸매, 남다른 파워…내 심장 뛰게하는 \'4車 혁명\'누진제 사태에도 1600만호 전기요금 \'깜깜이 부과\'김어준 ""주진우, 누구 사주 봐주고 이익 챙겨주는 인간 아냐""부끄러울 일 없었다…고은, \'성추행 폭로\' 최영미 등에 10억대 손배소[타봤어요]균형감 갖춘 패밀리 SUV, 쉐보레 \'이쿼녹스\'좋아요0훈훈해요0슬퍼요0화나요0후속기사 원해요0기사제공 :']"
8,삼성전자, 2018-07-2608:56,매일경제 ,"LG이노텍, 美 UV네일드라이어 업체에 특허침해 소송",https://finance.naver.com/news/news_read.nhn?article_id=0004191278&office_id=009&mode=search&query=LG이노텍&page=2,"['       LG이노텍, 美 UV네일드라이어 업체에 특허침해 소송      기사입력2018-07-26 08:56기사원문좋아요훈훈해요좋아요 평가하기공감좋아요0훈훈해요0슬퍼요0화나요0후속기사 원해요0댓글 LG이노텍은 25일(현지시간) 미국 자외선(UV) 네일드라이어 제조업체 에버그레이트(Evergreat) 회사를 상대로 캘리포니아 북부 연방지방법원과 캘리포니아 중부 연방지방법원에 UV 발광다이오드(LED) 특허침해 소송을 제기했다고 밝혔다. 이번 소송은 에버그레이트가 판매하는 UV 네일드라이어 10개 모델에 LG이노텍의 LED 칩 설계 특허가 무단 사용된 데 따른 것이라고 LG이노텍은 설명했다.LG이노텍이 UV LED 제품에 대해 특허 소송을 제기한 건 이번이 처음이다. 김진현 특허담당 상무는 ""LG이노텍은 수년간의 연구 개발을 통해 독자적인 UV LED 핵심 기술을 확보해 왔다""며 ""경쟁 업체들의 부당한 특허침해에 엄정히 대처해 나갈 것""이라고 말했다.[디지털뉴스국 김제이 기자]▶뉴스 이상의 무궁무진한 프리미엄 읽을거리 ▶아나운서가 직접 읽어주는 오늘의 주요 뉴스[ⓒ 매일경제 & mk.co.kr, 무단전재 및 재배포 금지]매일경제 관련뉴스해당 언론사에서 선정하며 언론사 페이지(아웃링크)로 이동해 볼 수 있습니다.\'故 노회찬 부인\' 김지선씨 끌어안고 위로하는 심상정박원순 옥탑방살이 3일 ""보여주기로 끝나지 않길…""신세경 청순 글래머 대명사다운 운동 모습\'도시 모험가\'를 위한 야생마…지프 컴패스홍수현, \'12세 연하\' 마이크로닷 홀린 \'美친 육감몸매\'좋아요0훈훈해요0슬퍼요0화나요0후속기사 원해요0기사제공 :']"
9,삼성전자, 2018-07-2608:54,아이뉴스24 ,"LG이노텍, 美 UV 네일드라이어 제조업체 상대 특허침해 소송",https://finance.naver.com/news/news_read.nhn?article_id=0000456006&office_id=031&mode=search&query=LG이노텍&page=2,"['       LG이노텍, 美 UV 네일드라이어 제조업체 상대 특허침해 소송      기사입력2018-07-26 08:54기사원문좋아요훈훈해요좋아요 평가하기공감좋아요0훈훈해요0슬퍼요0화나요0후속기사 원해요0댓글[아이뉴스24 윤선훈 기자] LG이노텍이 미국의 UV(자외선) 네일드라이어(Nail Dryer) 제조업체를 상대로 특허 침해 소송을 제기하며 UV LED 기술 보호 강화에 나섰다. LG이노텍은 25일(현지시간) 미국 에버그레이트(Evergreat)사를 대상으로 캘리포니아 북부 연방지방법원과 캘리포니아 중부 연방지방법원에 UV LED 특허 침해 소송을 제기했다. LG이노텍이 UV LED 제품에 대해 특허 소송을 제기한 것은 이번이 처음이다.UV 네일드라이어는 손·발톱에 젤(gel) 타입의 매니큐어를 바른 후 자외선 빛을 쬐어 빠르게 건조시키는 기기다. 특수 물질과 화학 반응하는 자외선의 특성을 활용한다. 성능과 안전성이 뛰어난 UV LED가 수은램프를 대신해 자외선 광원으로 많이 사용되고 있다.에버그레이트는 미국 캘리포니아 소재의 UV 네일드라이어 제조· 판매업체다. 미국 네일아트 시장에서는 \'멜로디수지(MelodySusie)\'라는 브랜드로 잘 알려져 있다.이번 소송은 에버그레이트가 판매하는 UV 네일드라이어 10개 모델에 LG이노텍의 LED 칩 설계 특허가 무단 사용된 데 따른 것이다. LG이노텍은 이 제품들에 대해 판매금지 및 손해배상 청구 소송을 제기했다.LG이노텍은 지난 1월 에버그레이트에 특허 침해 경고장을 보내고 라이선스 계약을 요구한 바 있다. 하지만 에버그레이트가 협상 요구에 응하지 않아 이번 소송을 제기했다.LG이노텍 관계자는 ""UV LED 특허 침해 모니터링을 한층 강화하며 지적재산권을 철저하게 보호해 나갈 방침""이라며 ""LG이노텍이 글로벌 UV LED 시장에서 앞서 나가면서 경쟁업체들이 핵심 기술을 모방하는 사례가 늘어날 수 있기 때문""이라고 말했다.LG이노텍은 경화·노광용, 살균용, 식물생장용 등 다양한 파장의 고품질 UV LED를 선보이며 시장에서 두각을 나타내고 있다. 지난해에는 세계 최고 광출력 100밀리와트 살균용 UV LED를 개발했다.시장조사업체 욜디벨롭먼트에 따르면 글로벌 UV LED 시장은 2016년 1억5천190만달러에서 2021년 11억1천780만달러로 7배 이상 커질 전망이다.김진현 LG이노텍 특허담당(상무)은 ""수년간의 연구개발을 통해 독자적인 UV LED 핵심 기술을 확보해 왔다""며 ""경쟁 업체들의 부당한 특허 침해에 엄정히 대처해 나갈 것""이라고 말했다./윤선훈기자 krel@inews24.com▶네이버 채널에서 \'아이뉴스24\'를 구독해주세요.▶아이뉴스TV에서 부동산 고수를 만나보세요.[ⓒ 아이뉴스24 무단전재 및 재배포 금지]아이뉴스24 관련뉴스해당 언론사에서 선정하며 언론사 페이지(아웃링크)로 이동해 볼 수 있습니다.\'이재명 스캔들\' 주진우 기자 ""나는 제3자…남녀관계 언급은 부적절""진에어 직원들 ""수천명 생존권 위협하는 면허 취소 중단하라""故 정미홍 누구? KBS 전 아나운서·루푸스 투병·박근혜 무죄석방 주장\'정미홍 남편\' 국제변호사 ""훨씬 더 그리워하겠소"" 그녀의 마지막 말은?경찰 고위직 인사…경찰청 차장 임호선·서울청장 이주민 유임좋아요0훈훈해요0슬퍼요0화나요0후속기사 원해요0기사제공 :']"
10,삼성전자, 2018-07-2608:54,헤럴드경제 ,"LG이노텍, 美 UV 네일드라이어 업체 상대 ‘UV LED’ 특허 침해 소송 제기",https://finance.naver.com/news/news_read.nhn?article_id=0001422246&office_id=016&mode=search&query=LG이노텍&page=2,"['       LG이노텍, 美 UV 네일드라이어 업체 상대 ‘UV LED’ 특허 침해 소송 제기      기사입력2018-07-26 08:54기사원문좋아요훈훈해요좋아요 평가하기공감좋아요0훈훈해요0슬퍼요0화나요0후속기사 원해요0댓글LG이노텍 연구원이 자외선을 방출하는 첨단 반도체 광원 UV LED 패키지를 선보이고 있다. [제공=LG이노텍]- UV LED 기술 보호 강화- LG이노텍 “지적재산권 철저히 보호해 나갈 방침”[헤럴드경제=손미정 기자] LG이노텍은 지난 25일(현지시간) 미국 UV(자외선) 네일드라이어(Nail Dryer) 제조업체인 에버그레이트(Evergreat)사를 상대로 캘리포니아 북부 연방지방법원과 캘리포니아 중부 연방지방법원에 UV LED 특허 침해 소송을 제기했다고 26일 밝혔다. LG이노텍이 UV LED 제품에 대해 특허 소송을 제기한 것은 이번이 처음이다.에버그레이트는 미국 캘리포니아 소재의 UV 네일드라이어 제조 및 판매업체다. ‘멜로디수지(MelodySusie)’라는 브랜드로 잘 알려져 있다. UV 네일드라이어는 손ㆍ발톱에 젤(gel) 타입의 매니큐어를 바른 후 자외선 빛을 쬐어 건조시키는 기기다. 이번 소송은 에버그레이트가 판매하는 UV 네일드라이어 10개 모델에 LG이노텍의 LED 칩 설계 특허가 무단 사용된 데 따른 것이다. LG이노텍은 이 제품들에 대해 판매금지 및 손해배상 청구 소송을 제기했다.앞서 지난 1월 LG이노텍은 에버그레이트에 특허 침해 경고장을 보내고 라이선스 계약을 요구한 바 있다. LG이노텍 측은 “에버그레이트가 협상 요구에 응하지 않아 이번 소송을 제기했다”고 밝혀다. LG이노텍은 향후 UV LED 특허 침해 모니터링을 한층 강화, 지적재산권을 철저하게 보호해 나간다는 방침이다. 경쟁업체들이 핵심 기술을 모방하는 사례를 차단함으로써 고성장세를 보이고 있는 UV LED 시장의 주도권을 잡겠다는 전략이다. 실제 시장조사업체 욜디벨롭먼트에 따르면 글로벌 UV LED 시장은 2016년 1억5190만 달러에서 2021년 11억1780만 달러로 확대될 전망이다. 한편 LG이노텍은 경화ㆍ노광용, 살균용, 식물생장용 등 다양한 파장의 UV LED를 선보이며 관련 시장에서 두각을 보이고 있다. 지난해는 세계 최고 광출력 100밀리와트 살균용 UV LED를 개발해 기술력을 입증한 바 있다. 김진현 LG이노텍 특허담당 상무는 “수년간의 연구개발을 통해 독자적인 UV LED 핵심 기술을 확보해 왔다”며 “경쟁 업체들의 부당한 특허 침해에 엄정히 대처해 나갈 것”이라고 말했다.balme@heraldcorp.com▶생생한 리뷰보고 최저가로 산다 헤럴드 리얼라이프▶리얼라이프 카카오플러스 친구맺기 ▶한입뉴스 ‘타파스’ 페이스북 친구맺기 - Copyrights ⓒ 헤럴드경제 & heraldbiz.com, 무단 전재 및 재배포 금지 -헤럴드경제 관련뉴스해당 언론사에서 선정하며 언론사 페이지(아웃링크)로 이동해 볼 수 있습니다.이재명 ""내가 조폭배후면, 경찰ㆍ정부도 조폭배후""태풍 종다리, 폭염 꺾는 효자태풍?…동해상 진출 가능성 \'예의주시\'최영미, 고은에 재반격…성추행 진실공방정봉주, 檢 송칡""성추행 의혹 허위로 보기 어려워""\'내란음모 혐의\' 한민구 출국금지…수사단 오늘부터 본격 수사좋아요0훈훈해요0슬퍼요0화나요0후속기사 원해요0기사제공 :']"
11,삼성전자, 2018-07-2608:50,머니S ,"[STOCK] LG이노텍, 비수기 실적 선방 예상",https://finance.naver.com/news/news_read.nhn?article_id=0000331785&office_id=417&mode=search&query=LG이노텍&page=2,"['       [STOCK] LG이노텍, 비수기 실적 선방 예상      기사입력2018-07-26 08:50기사원문좋아요훈훈해요좋아요 평가하기공감좋아요0훈훈해요0슬퍼요0화나요0후속기사 원해요0댓글 유진투자증권은 26일 LG이노텍에 대해 비수기에도 실적을 선방할 것이라고 예상하며 투자의견 ‘매수’, 목표주가 18만5000원을 유지했다.LG이노텍의 올 2분기 매출액은 전년동기 대비 13.3% 늘어난 1조5200억원, 영업이익은 같은기간 58.8% 감소한 134억원으로 시장예상치를 상회했다. 우호적인 환율, 해외 전략고객향 부품조기 공급, 고부가 제품군 매출확대 등이 실적을 견인했다.유진투자증권은 LG이노텍의 3분기 매출액을 전년동기 대비 33.4% 늘어난 2조3800억원, 영업이익은 같은기간 120% 증가한 1230억원으로 전망했다.노경탁 유진투자증권 애널리스트는 “3분기는 해외 전략고객사의 플래그십 스마트폰 출시에 따른 카메라모듈 및 3D센싱 모듈 공급의 본격화로 큰 폭의 실적성장이 예상된다”며 “올해 하반기 영업이익은 아이폰 기대감이 높았던 2017년과 비교해 높은 성장세가 가능할 것으로 판단된다”고 설명했다.홍승우 기자 ▶ 머니S 페이스북 ▶ 최신 웹툰이 매일 공짜 머니S 관련뉴스해당 언론사에서 선정하며 언론사 페이지(아웃링크)로 이동해 볼 수 있습니다.손병호, 평창동 저택 공개… ""너무 넓어 전화로 대화해""성추행 피해자 ""이경실 부부, 날 꽃뱀으로 몰았다""일베, \'박카스 할머니\' 나체 사진에 조롱글… 너무해이소라, 몸매관리 비결 공개… ""얼굴에 뭐 넣지 말라""조현아, 입 열었다 ""속옷·왕게임 아니었다""좋아요0훈훈해요0슬퍼요0화나요0후속기사 원해요0기사제공 :']"
12,삼성전자, 2018-07-2608:49,뉴스1 ,"LG이노텍, 美 UV 네일드라이어 업체에 특허침해소송 제기",https://finance.naver.com/news/news_read.nhn?article_id=0003503199&office_id=421&mode=search&query=LG이노텍&page=2,"['        LG이노텍, 美 UV 네일드라이어 업체에 특허침해소송 제기      기사입력2018-07-26 08:49기사원문좋아요훈훈해요좋아요 평가하기공감좋아요0훈훈해요0슬퍼요0화나요0후속기사 원해요0댓글LG이노텍 LED 패키지. (LG이노텍 제공)© News1(서울=뉴스1) 장은지 기자 = LG이노텍이 미국의 UV(자외선) 네일드라이어(Nail Dryer) 제조업체를 상대로 특허 침해 소송을 제기했다. UV LED 기술 보호 강화를 위한 첫 소송이다.   LG이노텍은 미국 현지시간 25일 \'에버그레이트(Evergreat)\'를 상대로 캘리포니아 북부 연방지방법원과 캘리포니아 중부 연방지방법원에 UV LED 특허 침해 소송을 제기했다. LG이노텍이 UV LED 제품에 특허 소송을 제기한 것은 이번이 처음이다. \'에버그레이트\'는 미국 캘리포니아 소재의 UV 네일드라이어 제조·판매업체다.UV 네일드라이어는 손·발톱에 젤(gel) 타입의 매니큐어를 바른 후 자외선 빛을 쬐어 빠르게 건조시키는 기기다. 특수 물질과 화학 반응하는 자외선의 특성을 활용한다. 성능과 안전성이 뛰어난 UV LED는 수은램프를 대신해 자외선 광원으로 많이 사용된다. LG이노텍은 미국 네일아트 시장에서 \'멜로디수지(MelodySusie)\'라는 브랜드로 잘 알려진 \'에버그레이트\'가 판매하는 UV 네일드라이어 10개 모델에 LED 칩 설계 특허가 무단 사용됐다고 설명했다. LG이노텍은 이 제품들에 대해 판매금지 및 손해배상 청구 소송을 제기했다. 앞서 LG이노텍은 지난 1월 \'에버그레이트\'에 특허 침해 경고장을 보내고 라이선스 계약을 요구한 바 있다. 하지만 이 회사가 협상 요구에 응하지 않아 소송을 제기했다고 LG이노텍 측은 설명했다. LG이노텍은 UV LED 특허 침해 모니터링을 한층 강화하고 지적재산권을 철저하게 보호해 나갈 방침이다.김진현 특허담당(상무)은 ""수년간의 연구개발을 통해 독자적인 UV LED 핵심 기술을 확보해 왔다""며 ""경쟁 업체들의 부당한 특허 침해에 엄정히 대처해 나갈 것""이라고 말했다. 한편 시장조사업체 \'욜디벨롭먼트\'에 따르면 글로벌 UV LED 시장은 2016년 1억5190만 달러에서 2021년 11억1780만 달러로 7배 이상 커질 전망이다.seeit@news1.kr▶ [뉴스1] 채널설정하기 ▶ 제보하기▶ [페이스북] 바로가기![© 뉴스1코리아(news1.kr), 무단 전재 및 재배포 금지]뉴스1 관련뉴스해당 언론사에서 선정하며 언론사 페이지(아웃링크)로 이동해 볼 수 있습니다.\'조합 내분\' 위기의 잠실5단지…\'50층 재건축\' 포기하나故노회찬, 오늘 지역구 경남 창원서 \'마지막 영정 인사\'피서 온 소방관들이 물에 빠진 고교생 구해불법체류 외국인 추적중…3명이 3명에 칼부림술값 받아 계산하지 않은 일행 무차별 폭행좋아요0훈훈해요0슬퍼요0화나요0후속기사 원해요0기사제공 :']"
