,회사명,날짜,언론사,기사제목,링크,본문
11,삼성전자, 2018-07-2611:20,전자신문 ,"[ET투자뉴스]LG이노텍, ""선방 …"" BUY (MAINTAIN)-이베스트투자증권",https://finance.naver.com/news/news_read.nhn?article_id=0002727235&office_id=030&mode=search&query=LG이노텍&page=1,"['       [ET투자뉴스]LG이노텍, ""선방 …"" BUY (MAINTAIN)-이베스트투자증권      기사입력2018-07-26 11:20기사원문좋아요훈훈해요좋아요 평가하기공감좋아요0훈훈해요0슬퍼요0화나요0후속기사 원해요0댓글이베스트투자증권에서 26일 LG이노텍(011070)에 대해 ""선방 ""라며 투자의견을 \'BUY (MAINTAIN)\'로 제시하였고, 아울러 목표주가로는 200,000원을 내놓았다. 이베스트투자증권 어규진 애널리스트가 동종목에 대하여 이번에 제시한 \'BUY (MAINTAIN)\'의견은 이베스트투자증권의 직전 매매의견에서 큰 변화없이 그대로 유지되는 것이고  올해 초반의 매매의견을 기준으로  볼때도 역시 \'매수\'의견이 계속 유지되고 있는 상태이다. 그리고 최근 분기내 발표된 전체 증권사 리포트의 컨센서스와 비교를 해볼 경우에 오늘 발표된 투자의견은 전체의견에 수렴하고 있어, 이번 의견은 시장의 평균적인 기대감이 객관적으로 표현된 것으로 분석되고 있다. 목표주가의 추이를 살펴보면 정체구간을 한동안 보낸 후에 최근 2회 연속 목표가가 높아지면서 상승추세가 진행되는 모습이다. 또한 전일 종가 기준으로 볼때 동종목의 현주가는 이번에 제시된 목표가 대비 23.1%의 저평가 요인이 존재한다는 해석이 제시되고 있다. ◆ Report briefing이베스트투자증권에서 LG이노텍(011070)에 대해 ""LG이노텍의 2분기 실적은 매출액 1.52조원(+13.3%, YoY), 영업이익 134억원(-58.8%, YoY)으로 시장기대치(영업이익 53억원)을 상회하며 선방했다. 2분기는 하반기북미 주요 거래선의 신규 스마트폰 출시 전 기존 제품의 재고 조정에 따른 비수기 구간으로 동사의 카메라 모듈 및 3D 센싱 모듈, RFPCB 등의 고부가가치 부품 판매가감소하는 가운데서도 특히 광학솔루션 부분의 원가개선 및 비용절감 노력으로 흑자 기조를 유지할 수 있었다""라고 분석했다.  또한 이베스트투자증권에서 ""LG이노텍의 2018년 3분기 실적은 매출액 2.32조원(+29.6%, YoY/ +52.6%, QoQ),영업이익 1,078억원(+92.7%, YoY)으로 본격적인 개선이 기대된다. 북미 주요 거래선의 신규 메이저 스마트폰 출시가 전작대비 빨라지는 효과와 3D 센싱 모듈 채택 확대로카메라모듈 중심의 실적 호조가 기대되기 때문이다""라고 밝혔다. ◆ Report statistics이베스트투자증권의 동종목에 대한 최근 1년동안의 투자의견은 전체적으로 큰 변화없이 유지되고 있다. 목표주가는 2018년3월 160,000원까지 내려갔다가 2017년9월 230,000원을 최고점으로 목표가가 제시된 이후 최근에 200,000원으로 한단계 하향조정되고 있다. 한편 증권정보제공 업체인 씽크풀에 따르면 동사에 대한 컨센서스는 \'매수\'이고 목표주가의 추이를 살펴보면 최근 2회연속 목표가가 낮아지다 이번에는 직전목표가보다 높은 수준으로 크게 상향반전하는 추세이다. \xa0컨센서스최고최저투자의견매수매수HOLD목표주가197,222220,000180,000*최근 분기기준오늘 이베스트투자증권에서 발표된 \'BUY (MAINTAIN)\'의견 및 목표주가 200,000원은 전체의견에 수렴하면서 시장의 평균적인 기대감이 비교적 객관적으로 표현된 것으로 풀이되며 목표가평균과 대비해서 미미한 차이가 나는 것으로 집계되었다.  참고로 최근에 목표주가를 가장 공격적으로 제시한 한화투자증권에서 투자의견 \'BUY(유지)\'에 목표주가 220,000원을 제일 보수적인 의견을 제시한 유안타증권에서 투자의견 \'매수\'에 목표주가 180,000원을 제시한 바 있다. \xa0의견제시일자투자의견목표가격20180726BUY (MAINTAIN)200,00020180626BUY (MAINTAIN)180,00020180425매수(유지)160,00020180329매수(유지)160,00020180124매수(유지)170,000의견제시일자증권사투자의견목표가20180726한국투자증권매수(유지)190,00020180726미래에셋대우매수210,00020180726메리츠종금증권BUY210,00020180726DB금융투자BUY(유지)220,000(씽크풀에서 제공하는 컨센서스는 국내 전증권사에서 발표되는 기업분석 리포트 및 코멘트를 실시간으로 통계/분석처리되고 있습니다.)증시분석 전문기자 로봇 ET etbot@etnews.com전자신문과 씽크풀의 증시분석 전문기자 로봇 ET가 쓴 기사입니다▶ 전자신문 바로가기 [Copyright ⓒ 전자신문 & 전자신문인터넷, 무단전재 및 재배포 금지]전자신문 관련뉴스해당 언론사에서 선정하며 언론사 페이지(아웃링크)로 이동해 볼 수 있습니다.[단독]中텐센트·알리바바 \'QR\' 굴기 막자...정부, 한국 통합 \'QR페이\' 개발 착수차이나머니, 韓 장비기업 사냥...\'한스레이저\' 경쟁사 인수 추진삼성, 업계 최초 7.1채널 음향에 천장 4채널 덧붙인 사운드바 내놓는다협동로봇 시장 활성화 계기 마련했다. KIRIA 협동로봇 설치 작업장 안전인증제도 시행아우디 A3, 40% 할인 판매 진실은…""현금 \'No\', 리스만""좋아요0훈훈해요0슬퍼요0화나요0후속기사 원해요0기사제공 :']"
12,삼성전자, 2018-07-2611:12,전자신문 ,"[ET투자뉴스]LG이노텍, ""하반기 고공 비행 …"" BUY(MAINTAIN)-키움...",https://finance.naver.com/news/news_read.nhn?article_id=0002727224&office_id=030&mode=search&query=LG이노텍&page=1,"['       [ET투자뉴스]LG이노텍, ""하반기 고공 비행 …"" BUY(MAINTAIN)-키움증권      기사입력2018-07-26 11:12기사원문좋아요훈훈해요좋아요 평가하기공감좋아요0훈훈해요0슬퍼요0화나요0후속기사 원해요0댓글키움증권에서 26일 LG이노텍(011070)에 대해 ""하반기 고공 비행 ""라며 투자의견을 \'BUY(MAINTAIN)\'로 제시하였고, 아울러 목표주가로는 210,000원을 내놓았다. 키움증권 김지산 애널리스트가 동종목에 대하여 이번에 제시한 \'BUY(MAINTAIN)\'의견은 키움증권의 직전 매매의견을 그대로 유지하는 것이고 올해 초반의 매매의견을 기준으로  볼때도 역시 \'매수\'의견이 계속 유지되고 있는 상태이다. 그리고 최근 분기내 발표된 전체 증권사 리포트의 컨센서스와 비교를 해볼 경우에 오늘 발표된 투자의견은 대체적으로 평균치에 해당하는 수준으로, 이번 의견은 동종목에 대한 전체적인 흐름에서 크게 벗어나지 않은 것으로 분석되고 있다. 목표주가의 추이를 살펴보면 최근 두차례 연속 상향조정되다가 이번에는 직전 목표가와 동일한 수준을 유지하는 모습이다. 또한 전일 종가 기준으로 볼때 동종목의 현주가는 이번에 제시된 목표가 대비 29.2%의 추가상승여력이 있다는 해석이 제시되고 있다. ◆ Report briefing키움증권에서 LG이노텍(011070)에 대해 ""2분기 영업이익은 당초 적자 예상과 달리 134억원의 깜짝 흑자를 달성했다.해외 전략 고객 신모델향 부품 출하 시기가 앞당겨진 상황에서 1) 광학솔루션은 공정 개선, 투자 효율화 등을 통해 원가 부담을 줄였고, 2) 2Metal COF와 반도체 기판의 선전으로 기판소재 사업부의 수익성이 크게 향상됐으며, 3) 환율 여건이 우호적으로 변화했다""라고 분석했다.  또한 키움증권에서 ""광학솔루션 주도로 하반기 실적 개선폭은 기대 이상일 전망이다. 3분기와 4분기 영업이익은 각각 1,118억원(QoQ 734%, YoY 100%)과 1,751억원(QoQ 57%, YoY 24%)으로 추정된다.3분기 광학솔루션 매출은 전분기보다 2배 급증할 것으로 예상되는데, 고객사차별화 전략의 핵심으로서 3D 센싱 모듈의 출하량이 지난해보다 3배로 늘어 나고, 3D 센싱 모듈과 듀얼 카메라의 판가 전망도 양호할 것이다""라고 밝혔다. ◆ Report statistics키움증권의 동종목에 대한 최근 1년동안의 투자의견은 전체적으로 큰 변화없이 유지되고 있다. 목표주가는 2018년4월 180,000원까지 내려갔다가 2017년9월 220,000원을 최고점으로 목표가가 제시된 이후 최근에 210,000원으로 한단계 하향조정되고 있다. 한편 증권정보제공 업체인 씽크풀에 따르면 동사에 대한 컨센서스는 \'매수\'이고 목표주가의 추이를 살펴보면 최근 2회연속 목표가가 낮아지다 이번에는 직전목표가보다 높은 수준으로 크게 상향반전하는 추세이다. \xa0컨센서스최고최저투자의견매수매수HOLD목표주가197,222220,000180,000*최근 분기기준오늘 키움증권에서 발표된 \'BUY(MAINTAIN)\'의견 및 목표주가 210,000원은 전체 컨센서스 대비해서 대체적으로 평균치에 해당하는 수준으로, 이번 의견은 동종목에 대한 전체적인 흐름에서 크게 벗어나지 않은 것으로 파악되며 목표가평균 대비 6.5% 초과하고 있는 것으로 집계되었다.  참고로 최근에 목표주가를 가장 공격적으로 제시한 한화투자증권에서 투자의견 \'BUY(유지)\'에 목표주가 220,000원을 제일 보수적인 의견을 제시한 유안타증권에서 투자의견 \'매수\'에 목표주가 180,000원을 제시한 바 있다. \xa0의견제시일자투자의견목표가격20180726BUY(MAINTAIN)210,00020180709BUY(MAINTAIN)210,00020180607매수(유지)200,00020180521매수(유지)180,00020180425매수(유지)180,000의견제시일자증권사투자의견목표가20180726한국투자증권매수(유지)190,00020180726미래에셋대우매수210,00020180726메리츠종금증권BUY210,00020180726DB금융투자BUY(유지)220,000(씽크풀에서 제공하는 컨센서스는 국내 전증권사에서 발표되는 기업분석 리포트 및 코멘트를 실시간으로 통계/분석처리되고 있습니다.)증시분석 전문기자 로봇 ET etbot@etnews.com전자신문과 씽크풀의 증시분석 전문기자 로봇 ET가 쓴 기사입니다▶ 전자신문 바로가기 [Copyright ⓒ 전자신문 & 전자신문인터넷, 무단전재 및 재배포 금지]전자신문 관련뉴스해당 언론사에서 선정하며 언론사 페이지(아웃링크)로 이동해 볼 수 있습니다.[단독]中텐센트·알리바바 \'QR\' 굴기 막자...정부, 한국 통합 \'QR페이\' 개발 착수차이나머니, 韓 장비기업 사냥...\'한스레이저\' 경쟁사 인수 추진삼성, 업계 최초 7.1채널 음향에 천장 4채널 덧붙인 사운드바 내놓는다협동로봇 시장 활성화 계기 마련했다. KIRIA 협동로봇 설치 작업장 안전인증제도 시행아우디 A3, 40% 할인 판매 진실은…""현금 \'No\', 리스만""좋아요0훈훈해요0슬퍼요0화나요0후속기사 원해요0기사제공 :']"
13,삼성전자, 2018-07-2611:03,전자신문 ,"[ET투자뉴스]LG이노텍, ""양호한 2분기, 돌…"" 매수(유지)-한국투자증권",https://finance.naver.com/news/news_read.nhn?article_id=0002727209&office_id=030&mode=search&query=LG이노텍&page=1,"['       [ET투자뉴스]LG이노텍, ""양호한 2분기, 돌…"" 매수(유지)-한국투자증권      기사입력2018-07-26 11:03기사원문좋아요훈훈해요좋아요 평가하기공감좋아요0훈훈해요0슬퍼요0화나요0후속기사 원해요0댓글한국투자증권에서 26일 LG이노텍(011070)에 대해 ""양호한 2분기, 돌아온 아이폰의 계절 ""라며 투자의견을 \'매수(유지)\'로 제시하였고, 아울러 목표주가로는 190,000원을 내놓았다. 한국투자증권 조철희 애널리스트가 동종목에 대하여 이번에 제시한 \'매수(유지)\'의견은 한국투자증권의 직전 매매의견에서 큰 변화없이 그대로 유지되는 것이고  올해 초반의 시장컨센서스에 비추어 본다면 \'매수\'의견에서 \'매수(유지)로\' 상향조정된 것이다. 그리고 최근 분기내 발표된 전체 증권사 리포트의 컨센서스와 비교를 해볼 경우에 오늘 발표된 투자의견은 전체의견에 수렴하고 있어, 이번 의견은 시장의 평균적인 기대감이 객관적으로 표현된 것으로 분석되고 있다. 목표주가의 추이를 살펴보면 과거 목표가가 하향조정된 후에 지금까지 두차례 같은 수준을 지속하면서 뚜렷한 변화요인을 모색하지 못하는 모습이다. 또한 전일 종가 기준으로 볼때 동종목의 현주가는 이번에 제시된 목표가 대비 16.9%의 저평가 요인이 존재한다는 해석이 제시되고 있다. ◆ Report briefing한국투자증권에서 LG이노텍(011070)에 대해 ""2분기 실적은 낮아진 눈높이를 소폭 상회했다. 매출액은 1조 5,179억원, 영업이익은 134억원을 기록했다. 전년대비 매출액은 13.3% 늘었지만, 영업이익은 58.8%줄었다. 영업이익의 컨센서스는 36억원 적자였지만 최근 컨센서스가 빠르게 상향된 점을 감안하면 무난한 실적이었다. 세전이익은 200억원을 기록했다. 세전이익이 영업이익 대비 많은 이유는 보유중인 일부 자산을 매각해 250억원의 일회성 이익을 인식했기 때문이다""라고 분석했다.  또한 한국투자증권에서 ""2분기에도 주력사업부인 광학사업부의 실적이 영업적자를 기록한 것으로 추정된다. 주요 고객사인 북미A사의 17년 4분기 출시 제품 판매가 부진하기 때문이다.그러나 북미A사는 올해 9월부터 신모델 3종(OLED 2종, LCD 1종)을 출시할 예정이어서 매출액과 이익이 빠르게 늘어날 것이다. 특히 카메라신기술모듈 탑재가지난해 1종(11월 출시)에서 올해는 3종으로 늘어나고 출시 시기도 빨라져 광학사업부 매출액 및 이익 증가를 견인할 것이다""라고 밝혔다. ◆ Report statistics한국투자증권의 동종목에 대한 최근 1년동안의 투자의견은 전체적으로 큰 변화없이 유지되고 있다. 목표주가는 2017년7월 178,000원이 저점으로 제시된 이후 2017년9월 197,000원을 최고점으로 목표가가 제시되었고 최근에는 190,000원으로 다소 하향조정되고 있다. 한편 증권정보제공 업체인 씽크풀에 따르면 동사에 대한 컨센서스는 \'매수\'이고 목표주가의 추이를 살펴보면 최근 2회연속 목표가가 낮아지다 이번에는 직전목표가보다 높은 수준으로 크게 상향반전하는 추세이다. \xa0컨센서스최고최저투자의견매수매수HOLD목표주가197,222220,000180,000*최근 분기기준오늘 한국투자증권에서 발표된 \'매수(유지)\'의견 및 목표주가 190,000원은 전체의견에 수렴하면서 시장의 평균적인 기대감이 비교적 객관적으로 표현된 것으로 풀이되며 목표가평균 대비 3.7%정도 미달하고 있는 것으로 집계되었다.  참고로 최근에 목표주가를 가장 공격적으로 제시한 한화투자증권에서 투자의견 \'BUY(유지)\'에 목표주가 220,000원을 제일 보수적인 의견을 제시한 유안타증권에서 투자의견 \'매수\'에 목표주가 180,000원을 제시한 바 있다. \xa0의견제시일자투자의견목표가격20180726매수(유지)190,00020180425매수(유지)190,00020180412매수(분석재개)190,00020170913매수197,00020170727매수(유지)178,000의견제시일자증권사투자의견목표가20180726한국투자증권매수(유지)190,00020180726미래에셋대우매수210,00020180726메리츠종금증권BUY210,00020180726DB금융투자BUY(유지)220,000(씽크풀에서 제공하는 컨센서스는 국내 전증권사에서 발표되는 기업분석 리포트 및 코멘트를 실시간으로 통계/분석처리되고 있습니다.)증시분석 전문기자 로봇 ET etbot@etnews.com전자신문과 씽크풀의 증시분석 전문기자 로봇 ET가 쓴 기사입니다▶ 전자신문 바로가기 [Copyright ⓒ 전자신문 & 전자신문인터넷, 무단전재 및 재배포 금지]전자신문 관련뉴스해당 언론사에서 선정하며 언론사 페이지(아웃링크)로 이동해 볼 수 있습니다.[단독]中텐센트·알리바바 \'QR\' 굴기 막자...정부, 한국 통합 \'QR페이\' 개발 착수차이나머니, 韓 장비기업 사냥...\'한스레이저\' 경쟁사 인수 추진삼성, 업계 최초 7.1채널 음향에 천장 4채널 덧붙인 사운드바 내놓는다협동로봇 시장 활성화 계기 마련했다. KIRIA 협동로봇 설치 작업장 안전인증제도 시행아우디 A3, 40% 할인 판매 진실은…""현금 \'No\', 리스만""좋아요0훈훈해요0슬퍼요0화나요0후속기사 원해요0기사제공 :']"
14,삼성전자, 2018-07-2610:43,전자신문 ,"[ET투자뉴스]LG이노텍, ""이제 막 좋아지기 …"" 매수-미래에셋대우",https://finance.naver.com/news/news_read.nhn?article_id=0002727186&office_id=030&mode=search&query=LG이노텍&page=1,"['       [ET투자뉴스]LG이노텍, ""이제 막 좋아지기 …"" 매수-미래에셋대우      기사입력2018-07-26 10:43기사원문좋아요훈훈해요좋아요 평가하기공감좋아요0훈훈해요0슬퍼요0화나요0후속기사 원해요0댓글미래에셋대우에서 26일 LG이노텍(011070)에 대해 ""이제 막 좋아지기 시작했다""라며 투자의견을 \'매수\'로 제시하였고, 아울러 목표주가로는 210,000원을 내놓았다. 미래에셋대우 박원재, 유승호 애널리스트가 동종목에 대하여 이번에 제시한 \'매수\'의견은 미래에셋대우의 직전 매매의견에서 큰 변화없이 그대로 유지되는 것이고  올해 초반의 매매의견을 기준으로  볼때도 역시 \'매수\'의견이 계속 유지되고 있는 상태이다. 그리고 최근 분기내 발표된 전체 증권사 리포트의 컨센서스와 비교를 해볼 경우에 오늘 발표된 투자의견은 전체의견에 수렴하고 있어, 이번 의견은 시장의 평균적인 기대감이 객관적으로 표현된 것으로 분석되고 있다. 목표주가의 추이를 살펴보면 과거 상향조정되어오던 패턴이 한차례 정체구간을 보낸 후에 이번에 다시 상향조정되는 모습이다. 또한 전일 종가 기준으로 볼때 동종목의 현주가는 이번에 제시된 목표가 대비 29.2%의 저평가 요인이 존재한다는 해석이 제시되고 있다. ◆ Report briefing미래에셋대우에서 LG이노텍(011070)에 대해 ""LG이노텍의 2Q18 실적은 매출액 1조 5,179억원(+13.3% YoY, -11.8% QoQ), 영업이익134억원(-58.8% YoY, -20.4% QoQ)을 기록하였다. 당사 추정 매출액 1조 5,637억원에는 소폭 미달하였으나, 영업적자 -122억원 보다는 개선된 수치이다. 시장 기대치는 매출액 1조 5,264억원, 영업적자 -36억원이었다""라고 분석했다.  또한 미래에셋대우에서 ""점유율 확대와 높은 수율도 긍정적이다. 현재 듀얼 카메라와 3D 센싱 모듈에서 경쟁사 대비 높은 점유율과 수율을 확보하고 있다. LED 부문의 실적 개선도 기대할 만 하다. LG그룹의 자동차 부품 사업 M&A(LG전자의 ZKW 인수)도 장기적으로 수혜가 예상된다. 수익성이 좋은 자동차 LED 판매가 확대될 것이기 때문이다. 제품 및 고객사 편중 해소 측면에서 긍정적이다""라고 밝혔다. ◆ Report statistics미래에셋대우의 동종목에 대한 최근 1년동안의 투자의견은 전체적으로 큰 변화없이 유지되고 있다. 목표주가는 2018년4월 162,000원까지 내려갔다가 2017년10월 232,000원을 최고점으로 목표가가 제시된 이후 최근에 210,000원으로 한단계 하향조정되고 있다. 한편 증권정보제공 업체인 씽크풀에 따르면 동사에 대한 컨센서스는 \'매수\'이고 목표주가의 추이를 살펴보면 최근 2회연속 목표가가 낮아지다 이번에는 직전목표가보다 높은 수준으로 크게 상향반전하는 추세이다. \xa0컨센서스최고최저투자의견매수매수HOLD목표주가197,647220,000180,000*최근 분기기준오늘 미래에셋대우에서 발표된 \'매수\'의견 및 목표주가 210,000원은 전체의견에 수렴하면서 시장의 평균적인 기대감이 비교적 객관적으로 표현된 것으로 풀이되며 목표가평균 대비 6.2% 초과하고 있는 것으로 집계되었다.  참고로 최근에 목표주가를 가장 공격적으로 제시한 한화투자증권에서 투자의견 \'BUY(유지)\'에 목표주가 220,000원을 제일 보수적인 의견을 제시한 유안타증권에서 투자의견 \'매수\'에 목표주가 180,000원을 제시한 바 있다. \xa0의견제시일자투자의견목표가격20180726매수210,00020180702매수184,00020180612매수(유지)184,00020180601매수(유지)180,00020180425매수(유지)162,000의견제시일자증권사투자의견목표가20180726미래에셋대우매수210,00020180726메리츠종금증권BUY210,00020180726DB금융투자BUY(유지)220,00020180726대신증권BUY190,000(씽크풀에서 제공하는 컨센서스는 국내 전증권사에서 발표되는 기업분석 리포트 및 코멘트를 실시간으로 통계/분석처리되고 있습니다.)증시분석 전문기자 로봇 ET etbot@etnews.com전자신문과 씽크풀의 증시분석 전문기자 로봇 ET가 쓴 기사입니다▶ 전자신문 바로가기 [Copyright ⓒ 전자신문 & 전자신문인터넷, 무단전재 및 재배포 금지]전자신문 관련뉴스해당 언론사에서 선정하며 언론사 페이지(아웃링크)로 이동해 볼 수 있습니다.[단독]中텐센트·알리바바 \'QR\' 굴기 막자...정부, 한국 통합 \'QR페이\' 개발 착수차이나머니, 韓 장비기업 사냥...\'한스레이저\' 경쟁사 인수 추진삼성, 업계 최초 7.1채널 음향에 천장 4채널 덧붙인 사운드바 내놓는다협동로봇 시장 활성화 계기 마련했다. KIRIA 협동로봇 설치 작업장 안전인증제도 시행아우디 A3, 40% 할인 판매 진실은…""현금 \'No\', 리스만""좋아요0훈훈해요0슬퍼요0화나요0후속기사 원해요0기사제공 :']"
15,삼성전자, 2018-07-2610:40,디지털타임스 ,"LG이노텍, 미국 네일드라이어 회사 상대 UV LED 특허 침해 소송 제기",https://finance.naver.com/news/news_read.nhn?article_id=0002474334&office_id=029&mode=search&query=LG이노텍&page=1,"['       LG이노텍, 미국 네일드라이어 회사 상대 UV LED 특허 침해 소송 제기      기사입력2018-07-26 10:40기사원문좋아요훈훈해요좋아요 평가하기공감좋아요0훈훈해요0슬퍼요0화나요0후속기사 원해요0댓글 [디지털타임스 강해령 기자] LG이노텍이 미국의 UV(자외선) 네일드라이어 제조업체를 상대로 UV LED(자외선 발광 다이오드) 특허 침해 소송을 제기했다.LG이노텍은 미국 에버그레이트사를 대상으로 캘리포니아 북부 연방지방법원과 캘리포니아 중부 연방지방법원에 UV LED 특허 침해 소송을 제기했다고 26일 밝혔다. LG이노텍이 UV LED 제품에 대해 특허 소송을 제기한 것은 이번이 처음이다.에버그레이트사는 미국 캘리포니아 소재의 UV 네일드라이어 제조· 판매업체다. 이번 소송은 에버그레이트사가 판매하는 UV 네일드라이어 10개 모델에 LG이노텍의 LED 칩 설계 특허가 무단 사용된 데 따른 것이다. LG이노텍은 이 제품들에 대해 판매금지 및 손해배상 청구 소송을 제기했다.LG이노텍은 지난 1월 에버그레이트사에 특허 침해 경고장을 보내고 라이선스 계약을 요구한 바 있으나, 에버그레이트사가 협상 요구에 응하지 않아 이번 소송을 제기했다고 밝혔다.LG이노텍은 UV LED 특허 침해 모니터링을 한층 강화하며 지적재산권을 철저하게 보호해 나갈 방침이다. 김진현 LG이노텍 특허담당 상무는 ""수년간의 연구개발로 UV LED 핵심 기술을 확보해 왔다""며 ""경쟁 업체들의 부당한 특허 침해에 엄정히 대처해 나갈 것""이라고 말했다.강해령기자 strong@dt.co.krLG이노텍 UV LED 패키지      디지털타임스 홈페이지 바로가기 / 디지털타임스 뉴스 더보기네이버 채널에서 \'디지털타임스\'를 구독해주세요.디지털타임스 관련뉴스해당 언론사에서 선정하며 언론사 페이지(아웃링크)로 이동해 볼 수 있습니다.폭염이 낳은 진풍경…베란다에 둔 계란서 병아리가\'바이아웃 천억\' 이강인 1군 데뷔...발렌시아 ""환상적이었다""인도네시아에 \'금융한류\'… 4년새 순익 3배 대박난 은행40개국서 데이터 무제한… KT, 신규 로밍 요금제 2종\'섹시 워너비\' 문가비, 이기적인 탄탄몸매 화보 공개좋아요0훈훈해요0슬퍼요0화나요0후속기사 원해요0기사제공 :']"
