,회사명,날짜,언론사,기사제목,링크,본문
11,삼성전자, 2018-01-2215:53,연합뉴스 ,[특징주] 아이폰X '조기 단종설'에 부품주 급락(종합),https://finance.naver.com/news/news_read.nhn?article_id=0009828929&office_id=001&mode=search&query=LG이노텍&page=1,"['       [특징주] 아이폰X \'조기 단종설\'에 부품주 급락(종합)      기사입력2018-01-22 15:53기사원문좋아요훈훈해요좋아요 평가하기공감좋아요0훈훈해요0슬퍼요0화나요0후속기사 원해요0댓글 (서울=연합뉴스) 전명훈 기자 = 애플의 아이폰 10주년 기념 스마트폰인 아이폰X(텐)의 생산량이 줄면서 조기 단종설까지 제기되자 국내 관련 부품주가 급락했다.    터치스크린 패널 생산업체 인터플렉스는 22일 주식시장에서 전 거래일보다 18.11% 떨어진 3만2천100원에 장을 마쳤다.    연성회로기판(FPCB)을 만드는 비에이치도 5.56% 급락했고 아이폰X용 카메라 모듈을 공급하는 LG이노텍은 2.64% 하락했다.     앞서 해외 언론들은 아이폰X이 기대에 미치지 못하는 판매량 때문에 조기에 단종될 수 있다는 관측을 내놓았다.     애플 소식에 정통한 KGI증권 궈밍치 애널리스트는 최근 보고서에서 ""1분기와 2분기 아이폰X 출하량이 각 1천800만대와 1천300만대에 그칠 것""이라며 ""이는 1분기 2천만∼3천만대, 2분기 1천500만∼2천만대의 시장 컨센서스에 못 미치는 수준으로, 아이폰X은 올해 중반에 단종될 것""이라고 전망했다.     이종욱 삼성증권 연구원은 ""아이폰X의 제품 사이클은 충성도 강한 고객의 초기 수요가 줄어든 이후 빠르게 끝났다""며 ""주요 부품사들의 상반기 주문량 하향 추세가 추가적으로 일어날 것""이라고 예상했다.    도현우 NH투자증권 연구원은 ""신형 아이폰의 판매량이 부진한 이유는 소비자들이 높은 가격에 거부감이 있기 때문""이라며 ""국내 아이폰X 관련 업체의 실적과 주가도 판매 부진과 관련해 부정적 영향이 불가피하다""고 분석했다.    id@yna.co.kr▶기사제보 및 문의▶기자와 1:1 채팅\xa0\xa0▶평창동계올림픽 영상 공모전연합뉴스 관련뉴스해당 언론사에서 선정하며 언론사 페이지(아웃링크)로 이동해 볼 수 있습니다.\xa0""北현송월 \'왜 이렇게 마스크 쓰는 사람이 많으냐\' 물어""\xa0""교통사고나 방화로 친모 죽여달라니""···아들 맞나\xa0커피 한잔에 5만3천원…비싸도 손님들로 \'와글와글\'\xa0""北 현송월 일행, 13만원짜리 양식코스 음식 안 남겨""\xa0양양 펜션서 여성 1명 숨지고 남성 3명 쓰러진 채 발견좋아요0훈훈해요0슬퍼요0화나요0후속기사 원해요0기사제공 :']"
12,삼성전자, 2018-01-2215:45,매일경제 ,"코스피, 대형 IT주 약세에 하락…2500선 턱걸이",https://finance.naver.com/news/news_read.nhn?article_id=0004087436&office_id=009&mode=search&query=LG이노텍&page=1,"['       코스피, 대형 IT주 약세에 하락…2500선 턱걸이      기사입력2018-01-22 15:45기사원문좋아요훈훈해요좋아요 평가하기공감좋아요0훈훈해요0슬퍼요0화나요0후속기사 원해요0댓글 코스피 투톱인 삼성전자와 SK하이닉스가 하락하면서 코스피가 약세를 보였다. 지수는 2500선을 간신히 지켜냈다.22일 코스피는 전일 대비 18.15포인트(0.72%) 내린 2502.11에 거래를 마쳤다.  코스피는 지난해 연말 2411선까지 밀렸다가 연초 이후 100포인트 가량 올랐다. 지난 18일 장중 2532.08까지 올랐지만 이후 주춤하는 모습을 보이고 있다. 미국 연방정부의 셧다운(일시 업무정지)은 글로벌 증시에 별다른 영향을 주지 않고 있다. 지난 19일(현지시간) 미국 상원에서 임시예산안이 부결됨에 따라, 20일 0시부로 연방정부 셧다운이 발생했다. 2013년 9월 30일이후 약 4년 4개월 만에 발생한 일로 국방, 교통, 보건 등 필수업무를 제외한 연방정부의 업무는 재협상이 완료되기 전까지 중지된다. 연방정부 셧다운은 1976년 이후 총 18차례 발생했는데 셧다운 기간 동안 S&P500지수는 평균 0.6% 하락했고, KOSPI는 평균 0.2% 상승하는 등 증시에 미치는 영향이 제한적이었다. 가장 최근인 2013년 9월 30일에서 10월 17일까지 국내주식시장에서 외국인이 약 3조원 순매수를 기록하면서 코스피가 2.2% 오르기도 했다. 하지만 일부에서는 미국 증시가 연이은 사상 최고치 경신에 따른 부담감이 존재한 상황에서 이번 셧다운 사태가 차익실현의 빌미가 될 수도 있다는 목소리도 나오고 있다. 국내 증시는 이번주부터 본격적인 어닝 시즌에 진입한다. 23일 LG디스플레이, LG생활건강, LG이노텍, LG하우시스, 삼성 SDI 등이 예정돼 있고, 24일 POSCO, 25일 LG전자, NAVER, SK하이닉스, 현대차 등 시가총액 상위 주요 종목들의 4분기 실적 발표가 기다리고 있다. 서보익 유진투자증권 연구원은 ""4분기 실적 악화를 주도했던 업종과 종목들이 반등한 점은 어닝시즌이 본격화된 코스피의 상승 추세회복에도 긍정적""이라며 ""특히 이번 주 예정된 시가총액 상위 종목들의 실적 전망은 부정적이지 않아, 코스피는 사상최고치 2561의 탈환을 시도할 것""이라고 말했다. 업종별로 의료정밀, 전기·전자, 통신업 등이 2% 안팎으로 떨어졌고 섬유·의복, 화학, 운송장비 등은 오르고 있다.매매주체별로 외국인과 기관이 각각 1756억원, 720억원을 순매도했고 개인은 1928억원을 순매수했다. 프로그램 매매는 505억원 매수 우위를 나타냈다. 시가총액 상위 종목들은 대체로 약세를 보였다. 시총 1, 2위인 삼성전자와 SK하이닉스가 2~3% 하락했고 POSCO, LG화학, KB금융 등도 떨어졌다. 반면 현대차, NAVER, 현대모비스 등은 올랐다. 이날 유가증권시장에서는 416개 종목이 상승했고 385개 종목이 하락했다.코스닥은 전일 대비 6.90포인트(0.78%) 내린 873.09를 기록 중이다. 외국계 증권사의 잇따른 매도 보고서 발표로 셀트리온, 셀트리온헬스케어, 셀트리온제약 등 셀트리온 3인방의 주가가 크게 하락하면서 코스닥 약세를 이끌고 있다. 이날도 셀트리온은 -2.50%, 셀트리온헬스케어는 -4.84%, 셀트리온제약이 -5.94% 하락했다.[디지털뉴스국 고득관 기자]▶뉴스 이상의 무궁무진한 프리미엄 읽을거리 ▶아나운서가 직접 읽어주는 오늘의 주요 뉴스[ⓒ 매일경제 & mk.co.kr, 무단전재 및 재배포 금지]매일경제 관련뉴스해당 언론사에서 선정하며 언론사 페이지(아웃링크)로 이동해 볼 수 있습니다.\'48세\' 이일화, 20대도 울고 갈 \'美친 몸매\' 드러내다튀는 털목도리 가격 얼마?…최신유행 앵클부츠 \'눈길\'케이시 \'망사 스타킹+미모\' 남심 저격 그 자체대만, 고등훈련기 독자 개발…2020년 첫 비행\'임신\' 박한별, 볼륨감 넘치는 \'완벽 속옷 몸매\' 자랑좋아요0훈훈해요0슬퍼요0화나요0후속기사 원해요0기사제공 :']"
13,삼성전자, 2018-01-2215:40,연합뉴스 ,"[특징주] 삼성전자·SK하이닉스, 외국인·기관 매도에 하락(종합)",https://finance.naver.com/news/news_read.nhn?article_id=0009828888&office_id=001&mode=search&query=LG이노텍&page=1,"['       [특징주] 삼성전자·SK하이닉스, 외국인·기관 매도에 하락(종합)      기사입력2018-01-22 15:40기사원문좋아요훈훈해요좋아요 평가하기공감좋아요0훈훈해요0슬퍼요0화나요0후속기사 원해요0댓글 (서울=연합뉴스) 권수현 기자 = 시가총액 1∼2위 삼성전자와 SK하이닉스가 22일 나란히 큰 폭으로 하락했다.     이날 유가증권시장에서 삼성전자는 전 거래일 대비 2.19% 떨어진 241만2천원에 장을 마쳤다.     SK하이닉스도 3.00% 하락한 7만1천100원에 장을 마감했다.     두 종목은 외국인과 기관의 동반 매도세에 밀려 이날까지 2거래일 연속 하락세를 이었다.     외국인은 삼성전자를 1천129억원, SK하이닉스를 110억원어치 각각 팔았다.     기관도 삼성전자를 587억원, SK하이닉스를 801억원 규모로 순매도했다.    이들 정보기술(IT) 대형주는 반도체 업황에 대한 논란과 원/달러 환율, 시장 기대치에 못 미친 삼성전자의 작년 4분기 잠정 실적 등의 영향으로 최근 부진한 흐름을 이어가고 있다.     이경민 대신증권 연구원은 ""한국 IT기업의 약세는 작년 4분기 원화 강세 여파가 실적 불확실성을 자극하고 있기 때문""이라며 ""SK하이닉스와 삼성SDI, LG이노텍 등 이번 주 주요 IT기업의 실적 발표 결과에 따라 이익 신뢰 회복 시점이 결정될 것으로 보인다""고 말했다.    그러면서 ""이들 기업의 작년 4분기 실적이 기대치를 웃돌면 환율 변화와 맞물려 분위기가 빠르게 반전될 수 있으나 반대의 경우는 이익 신뢰도 회복까지 시간이 더 걸릴 수 있다""고 말했다.    inishmore@yna.co.kr▶기사제보 및 문의▶기자와 1:1 채팅\xa0\xa0▶평창동계올림픽 영상 공모전연합뉴스 관련뉴스해당 언론사에서 선정하며 언론사 페이지(아웃링크)로 이동해 볼 수 있습니다.\xa0""北현송월 \'왜 이렇게 마스크 쓰는 사람이 많으냐\' 물어""\xa0""교통사고나 방화로 친모 죽여달라니""···아들 맞나\xa0커피 한잔에 5만3천원…비싸도 손님들로 \'와글와글\'\xa0""北 현송월 일행, 13만원짜리 양식코스 음식 안 남겨""\xa0양양 펜션서 여성 1명 숨지고 남성 3명 쓰러진 채 발견좋아요0훈훈해요0슬퍼요0화나요0후속기사 원해요0기사제공 :']"
14,삼성전자, 2018-01-2215:38,전자신문 ,"[ET투자뉴스]장중 낙폭 확대, 일제히 소폭 하락세 마감",https://finance.naver.com/news/news_read.nhn?article_id=0002676854&office_id=030&mode=search&query=LG이노텍&page=1,"['       [ET투자뉴스]장중 낙폭 확대, 일제히 소폭 하락세 마감      기사입력2018-01-22 15:38기사원문좋아요훈훈해요좋아요 평가하기공감좋아요0훈훈해요0슬퍼요0화나요0후속기사 원해요0댓글 ▣ 당일 장마감(1월 22일 오후 3:37)◈ 지수동향 KOSPI 2502.11p-18.15(-0.72%)선물 326.9p-3.20(-0.97%)KOSDAQ 873.09p-6.90(-0.78%)◈ KOSPI 투자자별 매매동향 -외국인 -1992억/기관 -581억/개인 2051억/ 프로그램 41억- 뉴욕증시는 지난 금요일 미국 연방정부 폐쇄 우려에도 S&P500과 나스닥이 소폭 상승세로 사상최고치 경신. 기업 실적 개선 기대가 작용했으며 다우는 강보합세 마감- 코스피 약보합세, 코스닥 소폭 하락세 출발한 국내증시는 장중 낙폭이 확대되었는데, 코스피와 코스닥 모두 소폭 하락세 마감- 코스피는 오전중 순매도를 확대하던 프로그램 매매가 오후들어 순매수로 돌아선 가운데 외국인, 기관 일제히 순매도 마감. 오전중 낙폭 확대 후 오후들어 낙폭을 축소함- 코스닥은 기관 순매수, 외국인 순매도 마감. 상대적으로 변동폭이 컸는데, 플러스권에 머물기도 했으나 11시부터 다시 낙폭이 확대되었으며 오후들어 낙폭을 축소함- 중소형주가 상대적으로 견조했으며 섬유의복, 화학, 운수장비 등이 상승세를 나타냈으며 의료정밀, 전기전자, 통신업 등이 하락세로 마감◈ 아이폰X 판매부진, 애플 부품주 하락세LG이노텍(-2.64%),인터플렉스(-18.11%),비에이치(-5.56%),덕우전자(-10.20%)◈ 양호한 시황 분석, 정유주 전반적 상승세S-Oil(+4.42%),GS(+1.86%),SK이노베이션(+0.26%)◈ 외국계 매도 보고서 등 영향, 셀트리온관련주 하락세셀트리온(-2.50%),셀트리온제약(-5.94%),셀트리온헬스케어(-4.84%)증시분석 전문기자 로봇 ET etbot@etnews.com전자신문과 씽크풀의 증시분석 전문기자 로봇 ET가 쓴 기사입니다▶ 전자신문 데이터 인사이트 마케팅▶ 전자신문 채널 구독 이벤트 가즈아~!▶ 전자신문 바로가기 [Copyright ⓒ 전자신문 & 전자신문인터넷, 무단전재 및 재배포 금지]전자신문 관련뉴스해당 언론사에서 선정하며 언론사 페이지(아웃링크)로 이동해 볼 수 있습니다.2019년 5G 스마트폰 시장 개화… 모뎀칩 퀄컴 독주서 전국시대로OLED만큼 \'완벽한 블랙\' 구현한 2018 QLED TV...비결은 \'퀀텀블랙필터\'""10년 만에 온 호재인데""…1년째 중국판호 제재 속타는 게임업체\'아이폰X\' 단종설 확산… ""판매 부진 탓""블록체인 기술 활용한 \'농산물 거래\' 시험 완료좋아요0훈훈해요0슬퍼요0화나요0후속기사 원해요0기사제공 :']"
15,삼성전자, 2018-01-2215:25,한국경제 ,"엇갈리는 스마트폰 판매 전망에…웃는 갤럭시株, 우는 아이폰株",https://finance.naver.com/news/news_read.nhn?article_id=0003882405&office_id=015&mode=search&query=LG이노텍&page=1,"['       엇갈리는 스마트폰 판매 전망에…웃는 갤럭시株, 우는 아이폰株      기사입력2018-01-22 15:25기사원문좋아요훈훈해요좋아요 평가하기공감좋아요0훈훈해요0슬퍼요0화나요0후속기사 원해요0댓글애플 아이폰X. 애플 홈페이지연초부터 애플과 삼성전자의 희비가 엇갈리고 있다. 애플이 ‘배터리 게이트’로 몸살을 앓고 있는 가운데 삼성전자는 차기작 갤럭시S9 출시를 앞두고 소비자들의 기대감을 한몸에 받고 있는 상황이다. 관련 부품주들의 주가 전망도 엇갈리고 있다, 증권업계 전문가들은 올 1분기에는 아이폰 부품주보다는 갤럭시 부품주에 주목할 것을 권했다. ◆ 기대감 높이는 \'갤럭시S9\'·실망 커지는 \'아이폰\'22일 관련 업계에 따르면 삼성전자는 오는 2월 말 스페인 바르셀로나에서 개막하는 ‘모바일월드콩그레스(MWC) 2018’에서 신작 프리미엄폰 갤럭시S9을 공개한다. 증권업계에서는 차기작 갤럭시S9의 흥행을 예상하고 있다. 박강호 대신증권 연구원은 “삼성전자는 1분기 갤럭시S9 출시로 영업이익이 증가할 것으로 예상한다”고 말했다.특히 경쟁사인 애플이 배터리 게이트로 위기를 겪고 있다는 점이 삼성전자에는 호재다. 애플은 배터리 성능 저하에 따른 갑작스러운 꺼짐 현상을 막기 위해 지난해 2월 iOS 업데이트로 아이폰6 아이폰6플러스, 아이폰6s, 아이폰6s플러스 등 구형 아이폰의 성능을 낮추는 기능을 도입했다가 논란을 일으켰다.아이폰 판매 감소가 불가피하다는 전망이다. 특히 애플이 배터리 게이트의 보상대책으로 내놓은 배터리 교체비용 할인으로 소비자들의 실망감이 커진 상태다. 아이폰X의 수요 일부가 갤럭시S9로 옯겨올 수 있다는 관측도 나온다는 상황이다.박 연구원은 “아이폰X의 높은 가격 부담. 출시 시기 지연 및 일부 부품의 수율 부진, 배터리 이슈 등으로 아이폰X의 판매 둔화가 가시화되고 있다”고 분석했다.이종욱 삼성증권 연구원도 “새해를 넘기자마자 아이폰X 판매를 경고하는 이야기들이 나타나고 있다”며 “소비자들의 가격 저항, 부품 주문 하향으로 인한 가동률 악화 등으로 조기 생산 중단과 같은 극단적인 이슈도 제기되는 상황”이라고 전했다.◆ 삼성전기·자화전자·대덕GDS 추천스마트폰의 판매 전망이 엇갈리면서 관련 부품주들의 주가 전망도 다른 방향성을 보이고 있다. 아이폰 부품주의 목표주가는 하향 조정되는 모양새다. 반면 갤럭시 부품 업종을 추천하는 목소리가 높다.이날 대신증권은 대표적인 애플 부품주인 LG이노텍과 인터플렉스의 2018년 1분기 및 연간 실적을 하향하면서 목표주가를 종전 대비 각각 12%, 20%씩 낮춰 잡았다. 박 연구원은 “애플 부품업체의 2018년 1분기 영업이익은 2017년 4분기대비 낮아질 전망”이라고 예상했다.이미 애플의 주요 부품사들의 상반기 주문량은 감소하는 모양새다. 이 연구원은 “1분기의 아이폰X 부품 주문량은 3개월 전 예상했던 4000만대 수준에서 현재 20% 정도 감소한 것으로 파악된다”며 “2분기 역시 1분기의 절반 수준으로 감소될 가능성이 높다”고 우려했다. 아이폰 부품 업체들에 대해 보수적인 접근 전략을 유지하라고 당부했다.반면 갤럭시S9에 부품을 공급하는 업체들은 추천주로 꼽히고 있다. 전문가들은 삼성전기, 자화전자, 대덕GDS 등을 권했다.박 연구원은 “삼성전자 부품 업체 중 삼성전기는 갤럭시S9 출시 수혜, 듀얼 카메라 적용 등의 영향을 받아 전체 평균공급가격은 종전 대비 오를 것으로 보인다”며 “1분기에는 역대 최고 실적 수준인 매출 1조9700억원과 영업이익 1562억원을 올릴 것으로 예상된다”고 기대했다. 이어 “자화전자, 대덕GDS도 갤럭시S9향 부품 공급 증가 및 가격 상승으로 실적이 호조세를 보일 것으로 보인다”고 덧붙였다.안혜원 한경닷컴 기자 anhw@hankyung.com[한경닷컴 바로가기] [글방] [모바일한경 구독신청] ⓒ 한국경제 & hankyung.com, 무단전재 및 재배포 금지한국경제 관련뉴스해당 언론사에서 선정하며 언론사 페이지(아웃링크)로 이동해 볼 수 있습니다.무선청소기 LG전자, 다이슨, 테팔 \'3강 구도\'삼성전자, 납품 단가에 최저임금 인상분 반영한다""주식 1억 팔면 무조건 1100만원 원천징수"" 초비상""경쟁국 중 한국 같은 나라는 없다""…이러다간 \'재앙\'1년 100억 버는데 300억 들여 美에…""좀 살려달라""좋아요0훈훈해요0슬퍼요0화나요0후속기사 원해요0기사제공 :']"
