,회사명,날짜,언론사,기사제목,링크,본문
0,삼성전자, 2018-07-1220:09,매일신문 ,"장세용 구미시장 기업 현장 중심 소통 행보 시작, LG전자 구미사업장을 시작으로 ...",https://finance.naver.com/news/news_read.nhn?article_id=0000544327&office_id=088&mode=search&query=LG이노텍&page=1,"['       장세용 구미시장 기업 현장 중심 소통 행보 시작, LG전자 구미사업장을 시작으로 기업체 잇단 방문      기사입력2018-07-12 20:09기사원문좋아요훈훈해요좋아요 평가하기공감좋아요0훈훈해요0슬퍼요0화나요0후속기사 원해요0댓글구미산단 내 삼성전자 스마트시티에 대해선 5G사업 관련 대규모 투자 요청 장세용 구미시장(앞줄 오른쪽 첫번째)이 구미국가산업단지 내 LG전자 구미사업장을 찾아 생산라인을 둘러 보고 있다. 구미시 제공 장세용 구미시장(앞줄 가운데)이 구미국가산업단지 내 LG전자 구미사업장을 찾아 생산라인을 둘러 보고 있다. 구미시 제공 장세용 구미시장이 기업 현장 중심의 소통 행보를 시작했다.장 시장은 12일 구미국가산업단지 내 LG전자 구미사업장을 찾아 생산라인을 둘러 보고 기업의 다양한 의견을 들었다.장 시장은 또 LG디스플레이㈜ 구미사업장, 삼성전자 스마트시티, LG이노텍, SK실트론, 인탑스, 남선알미늄 등 대기업과 중견·중소기업을 연이어 찾아 기업현장의 목소리를 직접 듣고, 지역경제 활성화 방안을 모색할 계획이다.특히 최근 사업부 일부 기능의 수원 이전으로 여론이 뒤숭숭한 삼성전자 구미 스마트시티에 대해선 삼성의 5G사업 확대 전략에 발맞춰 구미 5산단에 대규모 투자를 요청하는 한편 중앙정부·경북도와 공조해 투자 유치 활동을 극대화할 계획이다.장세용 구미시장은 ""구미산단의 경쟁력 강화가 무엇보다 중요한 시점이다. 기업의 다양한 의견과 애로사항을 듣고 새로운 발전 방안을 마련하겠다""고 밝혔다.또 ""기업 지원 통합 플랫폼 구축, 완제품 지역기업 육성 및 구매 촉진, 기업 현장 소통협의회 운영 등 신규 기업지원시책을 적극 발굴해 지역경제 살리기에 총력을 쏟겠다""고 덧붙였다.이창희 기자 lch888@msnet.co.krⓒ매일신문 - www.imaeil.com좋아요0훈훈해요0슬퍼요0화나요0후속기사 원해요0기사제공 :']"
1,삼성전자, 2018-07-1215:25,한국경제 ,"[한경로보뉴스] '한성기업' 상한가↑ 도달, 전일 보다 거래량 급증, 거래 폭발....",https://finance.naver.com/news/news_read.nhn?article_id=0003978267&office_id=015&mode=search&query=LG이노텍&page=1,"['       [한경로보뉴스] \'한성기업\' 상한가↑ 도달, 전일 보다 거래량 급증, 거래 폭발. 271.8만주 거래중      기사입력2018-07-12 15:25기사원문좋아요훈훈해요좋아요 평가하기공감좋아요0훈훈해요0슬퍼요0화나요0후속기사 원해요0댓글12일 한성기업은 장중 상한가에 진입해서, 오후 15시 14분 현재 전 거래일보다 29.68% 오른 10,050원에 거래되고 있다. 주가의 흐름을 살펴보면 8,060원으로 개장해서 장중 한때 7,650원(-1.29%)까지 살짝 밀렸지만, 다시 큰 폭으로 올라서 현재 10,050원(+29.68%)까지 상승하고 있다.◆ 거래량 분석- 전일 보다 거래량 급증, 거래 폭발. 271.8만주 거래중이 종목의 현재 거래량은 전일 거래량의 500%를 초과한 수준으로 271.8만주가 거래되고 있다.[표]한성기업 거래량 분석◆ 거래원 동향- 이 시간 매수 창구 상위 - 삼성증권, 키움증권 등이 시각 주요 거래원은 삼성증권, 키움증권, 미래에셋 등이 매수 상위 창구에 자리하고 있다.이 시간 미래에셋이 매수창구상위에 올라있는 종목은 이 종목 이외에도 대우부품, LG이노텍 등이 있다.[표]한성기업 거래원 동향한경로보뉴스이 기사는 한국경제신문과 씽크풀이 공동 개발한 기사 자동생성 알고리즘에 의해 실시간으로 작성된 것입니다.  - 기사오류문의 02-3277-9940[한경닷컴 바로가기] [글방] [모바일한경 구독신청] ⓒ 한국경제 & hankyung.com, 무단전재 및 재배포 금지한국경제 관련뉴스해당 언론사에서 선정하며 언론사 페이지(아웃링크)로 이동해 볼 수 있습니다.""한국에서 할 수 있는 게 없다"" SK하이닉스 \'비상\'혼자 사는 20대女 ""집주인이 제 방을 뒤졌어요""""4천억 이자도 못 갚아""…\'좀비기업\'으로 전락한 곳""중고 갤럭시노트8 73만원 주고 샀더니…""""이것 만은 안돼"" 칼 빼든 한국당…靑, 발칵한 일이좋아요0훈훈해요0슬퍼요0화나요0후속기사 원해요0기사제공 :']"
2,삼성전자, 2018-07-1213:36,전자신문 ,"[ET투자뉴스]LG이노텍, ""입지강화로 하반기 …"" BUY(유지)-NH투자증권",https://finance.naver.com/news/news_read.nhn?article_id=0002723572&office_id=030&mode=search&query=LG이노텍&page=1,"['       [ET투자뉴스]LG이노텍, ""입지강화로 하반기 …"" BUY(유지)-NH투자증권      기사입력2018-07-12 13:36기사원문좋아요훈훈해요좋아요 평가하기공감좋아요0훈훈해요0슬퍼요0화나요0후속기사 원해요0댓글NH투자증권에서 12일 LG이노텍(011070)에 대해 ""입지강화로 하반기 시장 기대치 상회 전망""라며 투자의견을 \'BUY(유지)\'로 제시하였고, 아울러 목표주가로는 200,000원을 내놓았다. NH투자증권 이규하 애널리스트가 동종목에 대하여 이번에 제시한 \'BUY(유지)\'의견은 NH투자증권에서 12개월만에 매매의견을 새롭게 조정하는 것으로 직전 매매의견에서 큰 변화없이 그대로 유지되는 것이다. 그리고 최근 분기내 발표된 전체 증권사 리포트의 컨센서스와 비교를 해볼 경우에 오늘 발표된 투자의견은 전체의견에 수렴하고 있어, 이번 의견은 시장의 평균적인 기대감이 객관적으로 표현된 것으로 분석되고 있다. 목표주가의 추이를 살펴보면 한동안 같은 수준을 유지하다가 이번에 목표가가 하향조정되는 모습이다. 또한 전일 종가 기준으로 볼때 동종목의 현주가는 이번에 제시된 목표가 대비 28.2%의 저평가 요인이 존재한다는 해석이 제시되고 있다. ◆ Report briefingNH투자증권에서 LG이노텍(011070)에 대해 ""3분기부터는 본격적인 실적 확대가 전망되는데 이는 1) 북미 고객사 내에서의 최근 입지 강화, 2) 베트남 공장 가동 확대에 따른 비용 (인건비 및 법인세) 절감 효과, 3) 3D Sensing 부품 수율 안정화 및 출하량 확대 등으로 외형 성장 및 마진 개선이 예상되기 때문""라고 분석했다.  또한 NH투자증권에서 ""2분기 매출액은 1조4,774억원(+10.3% y-y, -14.1% q-q), 영업이익은 102억원(-68.8% y-y, -39.6% q-q)을 기록할 것으로 추정. 2분기 실적은 기존 당사 추정치 및 컨센서스를 상회하는 수준. 북미 고객사의 물량 감소에 따른 재고 조정이 실적 둔화의 주된 요인이나 비용 절감, 기판소재 부문의 호조세 등이 시장 기대치보다 상회하는 배경이라고 판단""라고 밝혔다.  한편 ""최근 신규 경쟁사 진입 및 판가 인하에 대한 우려도 과도하다고 판단. 신규 경쟁사의 경우 Low-end 모델에 치중할 것으로 보이며 판가도 마이너한 스펙 상향으로 안정적인 수준을 유지할 것으로 예상되기 때문""라고 전망했다. ◆ Report statisticsNH투자증권의 동종목에 대한 최근 1년동안의 투자의견은 전체적으로 큰 변화없이 유지되고 있다. 한편 증권정보제공 업체인 씽크풀에 따르면 동사에 대한 컨센서스는 \'매수\'이고 목표주가의 추이를 살펴보면 최근 2회연속 목표가가 낮아지다 이번에는 직전목표가보다 높은 수준으로 크게 상향반전하는 추세이다. \xa0컨센서스최고최저투자의견매수매수(유지)HOLD목표주가179,053210,000135,000*최근 분기기준오늘 NH투자증권에서 발표된 \'BUY(유지)\'의견 및 목표주가 200,000원은 전체의견에 수렴하면서 시장의 평균적인 기대감이 비교적 객관적으로 표현된 것으로 풀이되며 목표가평균 대비 11.7% 초과하고 있는 것으로 집계되었다.  참고로 최근에 목표주가를 가장 공격적으로 제시한 키움증권에서 투자의견 \'BUY(MAINTAIN)\'에 목표주가 210,000원을 제일 보수적인 의견을 제시한 삼성증권에서 투자의견 \'HOLD\'에 목표주가 135,000원을 제시한 바 있다. \xa0의견제시일자투자의견목표가격20180712BUY(유지)200,00020170727매수(유지)210,00020170627매수(유지)210,000의견제시일자증권사투자의견목표가20180712NH투자증권BUY(유지)200,00020180712IBK투자증권매수190,00020180711신한금융투자매수(유지)200,00020180709키움증권BUY(MAINTAIN)210,000(씽크풀에서 제공하는 컨센서스는 국내 전증권사에서 발표되는 기업분석 리포트 및 코멘트를 실시간으로 통계/분석처리되고 있습니다.)증시분석 전문기자 로봇 ET etbot@etnews.com전자신문과 씽크풀의 증시분석 전문기자 로봇 ET가 쓴 기사입니다▶ 전자신문 바로가기 [Copyright ⓒ 전자신문 & 전자신문인터넷, 무단전재 및 재배포 금지]전자신문 관련뉴스해당 언론사에서 선정하며 언론사 페이지(아웃링크)로 이동해 볼 수 있습니다.서울시, 클라우드 시스템 전환서 脫 오라클 행보 시작....공공 클라우드 확산 주목하반기 8K·마이크로LED TV등 신기술 등장\'갤럭시노트9\' 8월 24일 국내 출시SBA, 오는 19일 네트워킹 플랫폼 \'SPARK@DMC\' 개최[단독]KB저축은행, 20조원 중고거래 \'안전이체 신기술\' 개발, 서비스좋아요0훈훈해요0슬퍼요0화나요0후속기사 원해요0기사제공 :']"
3,삼성전자, 2018-07-1213:30,SBS Biz ,리테일&이커머스 쇼 ‘K SHOP’ 참가 기업 공개,https://finance.naver.com/news/news_read.nhn?article_id=0000162017&office_id=374&mode=search&query=LG이노텍&page=1,"['       리테일&이커머스 쇼 ‘K SHOP’ 참가 기업 공개      기사입력2018-07-12 13:30기사원문좋아요훈훈해요좋아요 평가하기공감좋아요0훈훈해요0슬퍼요0화나요0후속기사 원해요0댓글 오는 8월 29일부터 31일까지 3일간 킨텍스(대표 임창열)에서 개최하는 리테일&이커머스 쇼 \'K SHOP\'의 컨퍼런스 연사진 및 참가기업이 공개되어 화제다.6회차를 맞이하는 본 행사는 빠르게 변화하는 유통산업 트렌드와 각광받는 기술을 조망하고, 국내외 전문가를 초청하여 국가별 소비자 특성과 진출전략을 소개하는 행사다.3일간 개최되는 전시회는 디지털 리테일, 인스토어 마케팅, 물류/포장, 자동인식 4개관으로 구성된다. 올해 행사에는 오프라인 고객경험 혁신을 위한 매장 디지털 솔루션 및 설비, 이커머스 특화 솔루션, 옴니채널 풀필먼트 환경 구축을 위한 물류/포장 솔루션이 중점적으로 소개된다.IoT기술을 기반으로 국내 매장에서 빠르게 적용되고 있는 LG이노텍의 전자가격표(ESL)를 비롯해 고객 신체데이터를 이용하여 최적의 의류 사이즈를 추천해주는 롯데홈쇼핑의 유니사이즈(unisize) 솔루션, 오프라인 매장 디지털화를 통해 고객분석 및 마케팅 효율화를 제공하는 코오롱베니트의 스마트매장 솔루션 등 고객에게 더 편리한 경험을 제공하기 위한 다양한 기술들이 출품된다.최근 결제 트렌드를 반영한 솔루션들도 돋보인다. 글로벌 결제 선도기업 베리폰(Verifone)에서는 현금사용이 축소되는 한국 시장의 특성을 반영하여 다양한 결제수단을 연결할 수 있고 데이터 보안이 강화되었으며 고객 리워드 프로그램까지 손쉽게 운영할 수 있는 통합 POS솔루션을 선보인다. 또한 지폐계수 특허 기술로 높은 시장 점유율을 보유한 기산전자는 기존의 제품을 무인매장 등 변화하는 리테일 환경에 접목시켜 운영할 수 있는 방안을 제안할 에정이다.8월 29일~30일 양일간 진행되는 국제컨퍼런스는 ‘리테일 혁신(Retail Innovation)’과 ‘크로스보더 리테일(Cross-border Retail)’을 주제로 두 개의 트랙으로 나누어 진행된다. 리테일 혁신 트랙의 1일차 세션은 고객의 관점에서 제품을 개발하고 채널을 운영하여 성공을 거둔 온, 오프라인 매장과 브랜드 기업 사례를 중심으로 구성되며, 최근 독보적인 비디오 커머스 콘텐츠로 화제를 모으고 있는 티몬, 경리단길 구석진 골목에서도 프리미엄 전통주와 메뉴의 차별화로 단기간에 성장한 안씨막걸리 등의 사례가 발표된다.리테일 혁신 트랙의 2일차 세션은 업계에서 주목받는 신기술을 소개하는 자리다. 증강현실(AR) 기술로 다양한 브랜드 캐릭터와의 콜라보레이션을 진행중인 애니펜과 식품 유통이력관리에 적용되는 블록체인 기술을 개발 운영중인 삼성SDS, 자체 어플리케이션을 통해 온오프라인 고객을 성공적으로 통합 관리하는 일본의 나노유니버스(nano？universe) 등이 발표를 진행한다.크로스보더 리테일 트랙 1일차 세션에서는 국내 이커머스 시장 선도주자인 이베이코리아를 비롯해 동남아 시장을 대표하는 라자다(Lazada)와 쇼피(Shopee), 중국의 징동닷컴(JD.com), 일본의 라쿠텐(Rakuten)이 시장별 온라인 쇼핑 트렌드와 소비자 특성, 한국기업이 이커머스를 통해 각 시장에 진출하기 위한 전략을 제시하며, 브랜드 제조사의 성공적인 쇼핑몰 구축사례를 보유한 티쿤글로벌에서는 독립몰 구축의 필요성과 주의점에 대한 인사이트를 전한다.2일차 세션에서는 소비재 분야의 대표 시장조사기관 닐슨과 직구 피해사례 접수 및 대응업무를 담당하는 한국소비자원, 크로스보더 물류 플랫폼 첼로스퀘어를 운영중인 삼성SDS 등 직구, 역직구와 관련된 이커머스 사업 진행 시 주의해야 할 점들과 신시장 개척 및 진출 전략에 대해 사례 중심의 발표를 진행한다.8월 31일에는 앞서 2일간 국제컨퍼런스가 진행되었던 동 행사장에서 글로벌셀러 세미나가 진행되며, 국내 브랜드 제조사, 유통사 등 다양한 규모의 크로스보더 사업자들을 위해 해외 주요 이커머스 플랫폼별 특성, 입점 및 운영전략을 다루는 14개 세션이 마련된다.특히 올해 행사에서는 비즈니스 네트워킹 플랫폼을 주목할만하다. 참가기업 관계자, 컨퍼런스 연사, 컨퍼런스 등록자 등 전시회 참관등록을 온라인에서 사전에 완료한 주요 기업을 대상으로 선별적으로 제공되는 매칭 플랫폼을 통해 행사장을 방문하는 참가자들은 사전에 행사장에서의 미팅 스케줄을 잡을 수 있으며, 다양한 협력사와 고객사를 발굴할 수 있는 현장 네트워킹 기회를 누릴 수 있다.참가기업 모집 마감은 7월 말일까지며, 국제컨퍼런스 및 글로벌셀러 세미나 티켓판매는 7월 중순 오픈된다. 행사 관련 주요 정보 확인 및 참가신청은 K SHOP 공식 홈페이지에서 가능하며, 관련 문의는 K SHOP 사무국으로 하면 된다.온라인 뉴스팀 기자(sbscnbcnews@sbs.co.kr) ☞ 의견 있는 경제채널 SBSCNBC [홈페이지] [뉴스스탠드]☞ 공식 SNS [페이스북] 저작권자 SBS플러스 & SBS I&M 무단전재-재배포 금지SBS Biz 관련뉴스해당 언론사에서 선정하며 언론사 페이지(아웃링크)로 이동해 볼 수 있습니다.\'11년만에 최저치\' 위안화 약세 장기화…""中 무기는 환율""美 추가관세 발표에 증시 \'휘청\'…오늘장 전망은?전국 350만 소상공인 ""최저임금 인상 수용하지 않겠다""[손안에신문] 자영업자 ""임차료·최저임금·재료비 오르는데 매출만 감소""잘못 없는데 내 비율 20%?…車사고 억울한 쌍방과실 판정 줄인다좋아요0훈훈해요0슬퍼요0화나요0후속기사 원해요0기사제공 :']"
