,회사명,날짜,언론사,기사제목,링크,본문
0,삼성전자, 2018-07-2617:58,서울경제 ,[스톡인사이드]3분기 '아이폰 효과'가 더 기대되는 LG이노텍,https://finance.naver.com/news/news_read.nhn?article_id=0003358597&office_id=011&mode=search&query=LG이노텍&page=1,"[""       [스톡인사이드]3분기 '아이폰 효과'가 더 기대되는 LG이노텍      기사입력2018-07-26 17:58기사원문좋아요훈훈해요좋아요 평가하기공감좋아요0훈훈해요0슬퍼요0화나요0후속기사 원해요0댓글부품 조기공급 등 비수기 깜짝실적주가 4월 11만원→15만원 상승세스마트폰 고급화로 중장기 수혜3분기 영업익도 91% 급증할듯[서울경제] LG이노텍(011070)이 시장의 예상을 뒤엎는 ‘깜짝 흑자’를 발표하며 주목을 받고 있다. 아이폰 효과가 기대되는 3·4분기 이후 실적 개선에 박차를 가할 것으로 전망된다. 1·4분기 지지부진했던 주가도 지난 4월부터 상승세를 이어오며 부진에 빠진 국내 증시와 거꾸로 가고 있다. 올 4월 11만원으로 하락했던 주가는 최근 15만원대를 회복했다. LG이노텍은 이달 25일 2·4분기 매출액이 1조5,178억원, 영업이익이 134억원으로 집계됐다고 발표했다. 매출액은 전년보다 13.3% 늘고 영업이익은 58.8%나 감소했지만 증권사의 예상치를 웃도는 수치다. 에프앤가이드에 따르면 증권사들은 LG이노텍이 2·4분기에 64억원의 영업손실을 기록할 것으로 전망했다. 2·4분기는 스마트폰 제조사들이 신제품을 출시하기 전 재고 조정에 나서면서 부품 공급을 줄이기 때문에 통상 LG이노텍에는 비수기로 통한다. 하지만 올해는 일부 고객사로의 부품 조기 공급이 이뤄졌고 고부가 제품군의 매출이 늘면서 시장의 기대를 웃도는 실적을 기록했다. 환율도 유리하게 움직였다. 업계에 따르면 원·달러 환율이 10원 오를 때 LG이노텍의 영업이익은 약 50억원 증가하는 것으로 추정된다. 시장은 3·4분기 실적을 기대하고 있다. 증권사들의 전망치를 종합하면 3·4분기 LG이노텍의 영업이익은 1,067억원으로 전년 대비 90.88% 급증할 것으로 전망된다. LG이노텍의 올해 매출액·영업이익 전망치는 각각 8조4,469억원, 3,087억원이다. 지난해보다 각각 10.5%, 3.4% 성장한 수치다. 박형우 신한금융투자 연구원은 “2·4분기 실적에서 바닥을 확인했고 3·4분기부터는 실적 반등 구간에 접어들 것”이라고 예상했다. 베트남 공장 가동 확대에 따른 인건비 등 비용절감 효과도 3·4분기부터 본격화될 것으로 관측된다. 중장기적으로도 LG이노텍에 기대를 걸 만한 근거는 스마트폰의 고사양화다. 주요 고객사인 애플은 내년부터 아이폰 중저가 모델에 듀얼카메라를, 고가 모델에 트리플카메라를 탑재할 것으로 예상된다. 이미 화웨이가 주력 모델에 트리플카메라를 도입한 만큼 주요 스마트폰 제조사들도 잇따라 고급화에 나설 것으로 보인다. 이 때문에 글로벌 카메라모듈 시장 1위인 LG이노텍이 구조적으로 수혜를 볼 수밖에 없다는 분석이다. 얼굴인식 등에 필요해 스마트폰 적용이 확대되고 있는 3차원(3D) 센싱 모듈도 LG이노텍의 주력 제품이다. 노경탁 유진투자증권 연구원은 “글로벌 스마트폰 제조사들의 고가 스마트폰 판매 부진이 이어지는 가운데 듀얼·트리플 카메라, 3D 센싱 카메라 등 하드웨어 측면의 차별화를 위한 고성능 카메라 모듈 수요가 증가하고 있다”며 “이는 하이엔드급 부품 제조사에 대한 스마트폰 제조사들의 의존도가 높아진다는 의미이며 시장이 부품 공급자에 유리한 구조로 바뀔 것”이라고 관측했다. 다만 주가 상승세가 오는 9월 아이폰 출시 전후, 3·4분기 실적 발표 전후까지만 이어질 것이라는 경계론도 제기된다. 이종욱 삼성증권 연구원은 이달 19일 LG이노텍의 3·4분기 영업이익을 증권가 추정치보다 많은 1,441억원으로 추정하고 목표주가를 18만원으로 상향 조정하면서도 중장기가 아닌 “단기적인 매수 기회”라고 평가했다. 아이폰 신제품의 성적을 보수적으로 본다는 점, 내년 하반기에나 본격화될 트리플카메라에 대한 기대감이 이미 주가에 반영되면서 정작 내년에는 차익실현이 일어나 주가가 변동성을 보일 것이라는 점 등이 근거다. LG이노텍의 주가는 올해 4월부터 약 27% 오른 상태다. /유주희기자 ginger@sedaily.com[서울경제 바로가기]이제 주식시세도 서울경제에서 확인하세요 [바로가기▶]블록체인의 모든 것, 서울경제 Decenter [바로가기▶]저작권자 ⓒ 서울경제, 무단 전재 및 재배포 금지서울경제 관련뉴스해당 언론사에서 선정하며 언론사 페이지(아웃링크)로 이동해 볼 수 있습니다.[스톡인사이드] 가마솥 더위에 전력 수요 급증...LS산전 '상승 스파크'[스톡인사이드] 미디어 커머스 도전 CJ ENM '기대반 우려반'[스톡인사이드]쑥쑥 크는 이커머스 타고...카페24 주가도 '훨훨'[스톡인사이드]KAI '수리온 수출' 날개 달고 다시 비상하나[스톡인사이드]'실적의 힘'...삼화콘덴서 하락장서 최고가 행진좋아요0훈훈해요0슬퍼요0화나요0후속기사 원해요0기사제공 :""]"
1,삼성전자, 2018-07-2617:29,매일경제 ,"LG이노텍, 美업체에 UV기술 특허訴",https://finance.naver.com/news/news_read.nhn?article_id=0004191690&office_id=009&mode=search&query=LG이노텍&page=1,"['       LG이노텍, 美업체에 UV기술 특허訴      기사입력2018-07-26 17:29기사원문좋아요훈훈해요좋아요 평가하기공감좋아요0훈훈해요0슬퍼요0화나요0후속기사 원해요0댓글 LG이노텍이 미국 자외선(UV) 네일드라이어 제조업체를 상대로 특허 침해 소송을 제기했다. 공격적 투자를 이어가며 전 세계 UV 발광다이오드(LED) 시장을 선도하고 있는 LG이노텍이 기술 보호 강화에 본격적으로 나선 것이다.LG이노텍은 지난 25일 미국 에버그레이트를 대상으로 캘리포니아 북부 연방지방법원과 캘리포니아 중부 연방지방법원에 UV LED 특허 침해 소송을 제기했다고 26일 밝혔다. LG이노텍이 UV LED 제품에 대해 특허 소송을 제기한 것은 이번이 처음이다. UV 네일드라이어는 손발톱에 바른 젤 형태 제품을 자외선 빛을 통해 빠르게 건조시키는 기기로 특수 물질과 화학 반응하는 자외선 특성을 활용한다. 수은램프를 대신해 성능과 안전성이 뛰어난 UV LED가 광원으로 많이 사용되고 있다.김진현 LG이노텍 특허담당 상무는 ""수년간 연구개발해 독자적인 UV LED 핵심 기술을 확보했다""며 ""경쟁사의 부당한 특허 침해에 대해 엄정 대처할 것""이라고 말했다.  [전경운 기자]▶뉴스 이상의 무궁무진한 프리미엄 읽을거리 ▶아나운서가 직접 읽어주는 오늘의 주요 뉴스[ⓒ 매일경제 & mk.co.kr, 무단전재 및 재배포 금지]매일경제 관련뉴스해당 언론사에서 선정하며 언론사 페이지(아웃링크)로 이동해 볼 수 있습니다.\'故 노회찬 부인\' 김지선씨 끌어안고 위로하는 심상정아우디 A3를 아반떼 가격에 산다고?보라 글래머+각선미 완벽 조화…섹시 종결자신라 창고 대형 항아리에 어떤 음식을 담았을까홍수현, \'12세 연하\' 마이크로닷 홀린 \'美친 육감몸매\'좋아요0훈훈해요0슬퍼요0화나요0후속기사 원해요0기사제공 :']"
2,삼성전자, 2018-07-2616:20,머니투데이 ,"코스피, 외인+기관 매수세에 2230선 눈앞… 코스닥 2% 반등",https://finance.naver.com/news/news_read.nhn?article_id=0004083729&office_id=008&mode=search&query=LG이노텍&page=1,"['       코스피, 외인+기관 매수세에 2230선 눈앞… 코스닥 2% 반등      기사입력2018-07-26 16:20기사원문좋아요훈훈해요좋아요 평가하기공감좋아요0훈훈해요0슬퍼요0화나요0후속기사 원해요0댓글 [머니투데이 하세린 기자] [[시황종합] 주요기업 실적 따라 주가 희비… 코스닥 바이오주 등 시총 상위종목 강세]코스피가 외국인과 기관 순매수세에 2230선 탈환을 눈앞에 뒀다. 코스닥도 외인과 기관의 동반 매수에 2% 반등했다. 주요 기업들이 지난 2분기 실적을 속속 발표하고 있는 가운데 실적과 이익성장 전망에 따라 개별 종목들의 주가 희비도 엇갈렸다. ◇막 오른 실적시즌… 실적 따라 주가 희비=코스피 지수는 전일대비 16.03p(0.71%) 오른 2289.06 마감으로 마감했다.이날 코스피 시장에서는 외국인이 1247억원, 기관이 127억원을 순매수다. 반면 개인은 1354억원을 순매도다. 프로그램 매매는 차익거래 238억원 순매도, 비차익거래 255억원 순매수 등 전체 17억원 매수 우위다.지수선물 시장에서는 외국인과 기관이 각각 832계약, 2290계약 순매도다. 반면 개인은 3376계약 순매수다.  업종별로는 등락이 엇갈렸다. 섬유의복 비금속광물이 2%대 강세를 보였다. 종이목재 철강금속 기계 전기전자 의료정밀 운수창고 증권 제조업이 1%대 올랐다. 반면 보험이 1% 넘게 하락했다. 음식료품 전기가스업 건설업 통신업 금융업 은행이 약세를 보였다.  시가총액 상위종목 가운데 SK하이닉스와 LG화학이 3% 넘게 올랐다. 삼성전자와 셀트리온 삼성물산은 1%대 강세를 보였다. SK하이닉스는 올 2분기 매출액, 영업이익, 당기순이익 등에서 모두 사상 최대·최고 기록 하면서 주가가 강세를 보였다. 다만 개장 직후엔 2% 넘게 하락하기도 했다. 반면 삼성바이오로직스가 3% 넘게 하락했고 KB금융 현대모비스 한국전력 신한지주 LG생활건강은 1%대 약세를 보였다. 5년 만에 분기 최대 실적을 거둔 삼성전기는 이날 개장 직후 52주 신고가를 경신했다. 결국 2.84% 강세로 장을 마쳤다. 영업이익이 전년동기 대비 흑자전환한 대한유화도 8%대 강세로 거래를 끝냈다. 반면 3분기 연속 영업이익이 줄어든 NAVER는 이날 개장 직후 주가가 4% 넘게 빠졌지만 오전중 반등해 0.67% 강세로 장을 마쳤다. 영업적자를 간신히 면한 LG이노텍도 2%대 약세로 거래를 끝냈다. 현대차는 올 2분기 영업이익은 지난해 같은 기간보다 29.3% 감소한 9508억원을 기록했다는 소식에 0.38% 약세로 마감했다. 다만 이는 올 1분기와 비교하면 39.6% 늘어난 수준이었다. 아모레퍼시픽은 올 2분기 영업이익이 전년동기 대비 43.5% 증가한 1458억원을 기록했다고 공시했다. 그러나 기저효과를 제외하면 실적 증가세가 시장 기대를 밑돌았다는 분석에 4%대 약세로 마감했다. 남광토건과 조비가 상한가를 기록했다. 이날 상승, 하락 종목은 각각 638개, 198개다. ◇코스닥, 시총상위 바이오주 반등=코스닥 지수는 전일대비 16.26p(2.17%) 오른 765.15으로 장을 마쳤다. 전날 연중 최저점을 기록했지만 외인과 기관 순매수세에 하루 만에 반등한 것이다.  코스닥 시장에서는 외국인이 593억원, 기관이 694억원을 순매수다. 개인은 1183억원을 순매도다. 업종 가운데 대다수가 상승했다. 방송서비스가 5% 이상 올랐고, 오락문화 통신방송서비스 건설이 3~4% 강세를 보였다. IT종합 IT하드웨어 정보기기 반도체 섬유의류 종이목재 화학 제약 금속 기계장비가 2% 넘게 올랐다. 반면 출판매체복제가 소폭 하락했다. 시가총액 상위 종목 대다수가 상승했다. CJ ENM이 7%대 급등한 가운데 신라젠이 5%대 올랐다. 셀트리온헬스케어 메디톡스 바이로메드 스튜디오드래곤 펄어비스 포스코켐텍 셀트리온제약 에이치엘비 컴투스 등이 상승했다. 반면 나노스와 카카오M이 소폭 하락했다. \'보물선 인양\'으로 관심을 끈 신일그룹이 돈스코이호 미디어간담회에서 제일제강은 보물선 사업과 일절 관계가 없다고 밝히면서 제일제강이 0.86% 약세로 장을 마쳤다. 오전중에는 19% 넘게 급등하기도 했다. 토필드가 상한가를 기록했다. 이날 상승, 하락 종목은 각각 968개, 198개다. 한편 원/달러 환율은 서울 외국환 시장에서 전일대비 7.0원(0.62%) 내린 1119.3원으로 마감했다. 코스피200 지수선물 9월물은 지수선물 시장에서 2.00포인트(0.68%) 오른 297.50을 기록했다.▶더 많은 머니투데이 기사보기▶실시간 급상승 기사 ▶\'MT리포트\'가 새로 발행되었습니다 하세린 기자 iwrite@mt.co.kr 머니투데이 관련뉴스해당 언론사에서 선정하며 언론사 페이지(아웃링크)로 이동해 볼 수 있습니다.보물선 간담회, 도망치고 아수라장 \'3시간만 종료\'이낙연 국무총리 ""저희는 노회찬 의원께 빚을 졌습니다""""김지은, \'안희정 수행비서 계속 하고 싶다\' 요청""이찬진 ""노회찬 추모… 정의당 당원 가입할 것""""커피매장서 플라스틱 빨대 사라진다""…환경부 규제강화 검토좋아요0훈훈해요0슬퍼요0화나요0후속기사 원해요0기사제공 :']"
3,삼성전자, 2018-07-2613:42,전자신문 ,"[ET투자뉴스]LG이노텍, ""잘 버텨낸 최대 비…"" BUY-KTB투자증권",https://finance.naver.com/news/news_read.nhn?article_id=0002727308&office_id=030&mode=search&query=LG이노텍&page=1,"['       [ET투자뉴스]LG이노텍, ""잘 버텨낸 최대 비…"" BUY-KTB투자증권      기사입력2018-07-26 13:42기사원문좋아요훈훈해요좋아요 평가하기공감좋아요0훈훈해요0슬퍼요0화나요0후속기사 원해요0댓글KTB투자증권에서 26일 LG이노텍(011070)에 대해 ""잘 버텨낸 최대 비수기""라며 투자의견을 \'BUY\'로 제시하였고, 아울러 목표주가로는 180,000원을 내놓았다. KTB투자증권 이동주 애널리스트가 동종목에 대하여 이번에 제시한 \'BUY\'의견은 KTB투자증권의 직전 매매의견을 그대로 유지하는 것이고 올해 초반의 매매의견을 기준으로  볼때도 역시 \'매수\'의견이 계속 유지되고 있는 상태이다. 그리고 최근 분기내 발표된 전체 증권사 리포트의 컨센서스와 비교를 해볼 경우에 오늘 발표된 투자의견은 대체적으로 평균치에 해당하는 수준으로, 이번 의견은 동종목에 대한 전체적인 흐름에서 크게 벗어나지 않은 것으로 분석되고 있다. 목표주가의 추이를 살펴보면 최근 2회연속 목표가가 낮아지다가 이번에는 직전 목표가까지 상향반전되는 모습이다. 또한 전일 종가 기준으로 볼때 동종목의 현주가는 이번에 제시된 목표가 대비 10.8%의 추가상승여력이 있다는 해석이 제시되고 있다. ◆ Report briefingKTB투자증권에서 LG이노텍(011070)에 대해 ""2Q18 영업이익 134억원으로 당사 추정치 및 시장 컨센서스 상회. 우호적으로 바뀐환율 및 예년보다 당겨진 북미 고객사향 부품 출하로 최대 비수기임에도 선방한실적 기록. 3분기 아이폰 신작 출시를 앞둔 가운데 동사의 3D Sensing 점유율은 경쟁사 이슈로 더욱 견고. 2019년 트리플 카메라 채용시 내년 실적 전망도 긍정적""라고 분석했다.  또한 KTB투자증권에서 ""2Q18 실적은 매출액 1조 5,179억원(-11.8% QoQ, +13.3% YoY), 영업이익 134억원(-20.3% QoQ, -58.8% YoY) 기록. 호실적은 원달러 환율이 우호적으로 바뀌었고 전년 대비 1개월 이상 빨라진아이폰 신작 부품 출하에 기인. 기판소재 사업부도 2M COF 매출 증가로 호실적에 일조""라고 밝혔다. ◆ Report statisticsKTB투자증권의 동종목에 대한 최근 1년동안의 투자의견은 전체적으로 큰 변화없이 유지되고 있다. 목표주가는 2017년8월 210,000원까지 높아졌다가 2018년4월 170,000원을 최저점으로 목표가가 제시된 이후 최근에 180,000원으로 새롭게 조정되고 있다. 한편 증권정보제공 업체인 씽크풀에 따르면 동사에 대한 컨센서스는 \'매수\'이고 목표주가의 추이를 살펴보면 최근 2회연속 목표가가 낮아지다 이번에는 직전목표가보다 높은 수준으로 크게 상향반전하는 추세이다. \xa0컨센서스최고최저투자의견매수매수HOLD목표주가197,895220,000180,000*최근 분기기준오늘 KTB투자증권에서 발표된 \'BUY\'의견 및 목표주가 180,000원은 전체 컨센서스 대비해서 대체적으로 평균치에 해당하는 수준으로, 이번 의견은 동종목에 대한 전체적인 흐름에서 크게 벗어나지 않은 것으로 파악되며 목표가평균 대비 9%정도 미달하고 있는 것으로 집계되었다.  참고로 최근에 목표주가를 가장 공격적으로 제시한 한화투자증권에서 투자의견 \'BUY(유지)\'에 목표주가 220,000원을 제일 보수적인 의견을 제시한 유안타증권에서 투자의견 \'매수\'에 목표주가 180,000원을 제시한 바 있다. \xa0의견제시일자투자의견목표가격20180726BUY180,00020180425매수170,00020180124매수180,00020180102매수200,00020171026매수(유지)210,000의견제시일자증권사투자의견목표가20180726KTB투자증권BUY180,00020180726IBK투자증권매수(유지)220,00020180726한국투자증권매수(유지)190,00020180726미래에셋대우매수210,000(씽크풀에서 제공하는 컨센서스는 국내 전증권사에서 발표되는 기업분석 리포트 및 코멘트를 실시간으로 통계/분석처리되고 있습니다.)증시분석 전문기자 로봇 ET etbot@etnews.com전자신문과 씽크풀의 증시분석 전문기자 로봇 ET가 쓴 기사입니다▶ 전자신문 바로가기 [Copyright ⓒ 전자신문 & 전자신문인터넷, 무단전재 및 재배포 금지]전자신문 관련뉴스해당 언론사에서 선정하며 언론사 페이지(아웃링크)로 이동해 볼 수 있습니다.[단독]中텐센트·알리바바 \'QR\' 굴기 막자...정부, 한국 통합 \'QR페이\' 개발 착수차이나머니, 韓 장비기업 사냥...\'한스레이저\' 경쟁사 인수 추진삼성, 업계 최초 7.1채널 음향에 천장 4채널 덧붙인 사운드바 내놓는다협동로봇 시장 활성화 계기 마련했다. KIRIA 협동로봇 설치 작업장 안전인증제도 시행아우디 A3, 40% 할인 판매 진실은…""현금 \'No\', 리스만""좋아요0훈훈해요0슬퍼요0화나요0후속기사 원해요0기사제공 :']"
4,삼성전자, 2018-07-2613:32,전자신문 ,"[ET투자뉴스]LG이노텍, ""3분기 飛上!…"" 매수(유지)-IBK투자증권",https://finance.naver.com/news/news_read.nhn?article_id=0002727299&office_id=030&mode=search&query=LG이노텍&page=1,"['       [ET투자뉴스]LG이노텍, ""3분기 飛上!…"" 매수(유지)-IBK투자증권      기사입력2018-07-26 13:32기사원문좋아요훈훈해요좋아요 평가하기공감좋아요0훈훈해요0슬퍼요0화나요0후속기사 원해요0댓글IBK투자증권에서 26일 LG이노텍(011070)에 대해 ""3분기 飛上!""라며 투자의견을 \'매수(유지)\'로 제시하였고, 아울러 목표주가로는 220,000원을 내놓았다. IBK투자증권 김운호, 신우철 애널리스트가 동종목에 대하여 이번에 제시한 \'매수(유지)\'의견은 IBK투자증권의 직전 매매의견을 그대로 유지하는 것이고 올해 초반의 매매의견을 기준으로  볼때도 역시 \'매수\'의견이 계속 유지되고 있는 상태이다. 그리고 최근 분기내 발표된 전체 증권사 리포트의 컨센서스와 비교를 해볼 경우에 오늘 발표된 투자의견은 대체적으로 평균치에 해당하는 수준으로, 이번 의견은 동종목에 대한 전체적인 흐름에서 크게 벗어나지 않은 것으로 분석되고 있다. 목표주가의 추이를 살펴보면 정체구간을 한동안 보낸 후에 최근 2회 연속 목표가가 높아졌고 또한 목표가의 상승폭도 더욱 커진 모습이다. 또한 전일 종가 기준으로 볼때 동종목의 현주가는 이번에 제시된 목표가 대비 35.4%의 추가상승여력이 있다는 해석이 제시되고 있다. ◆ Report briefingIBK투자증권에서 LG이노텍(011070)에 대해 ""LG이노텍의 2018년 2분기 매출액은 1분기 대비 11.8% 감소한 1조 5,179억 원이다.이전 전망에 비해서 감소한 규모이다. 기판소재를 제외한 전 사업부 매출액이 1분기대비 감소하였다. 2018년 2분기 영업이익은 1분기 20.4% 감소한 134억원이다. 영업적자를 예상한 것에 비해서 개선된 수준이다. 광학솔루션 사업부 영업적자 규모가 예상보다 크지 않은 것이 주요 원인으로 추정한다""라고 분석했다.  또한 IBK투자증권에서 ""LG이노텍의 2018년 3분기 매출액은 2분기 대비 68.2% 증가한 2조 5,524억 원으로예상한다. 매출액 증가는 광학솔루션 사업부가 주도할 전망이다. 광학솔루션 사업부매출액은 2분기 대비 2배 이상 증가한 1조 7,785억원으로 예상한다. 매출액이 급증하는 것은 해외 거래선 신제품 출시에 따른 영향으로 분석된다. 지난 해에 1개 모델에 채택된 3D Sensing은 3개 모델에 채택될 것으로 예상되고 점유율도 지난 해 대비 개선될 것으로 기대된다""라고 밝혔다. ◆ Report statisticsIBK투자증권의 동종목에 대한 최근 1년동안의 투자의견은 전체적으로 큰 변화없이 유지되고 있다. 목표주가는 215,000원이 고점으로, 반대로 170,000원이 저점으로 제시된 이후 이번에 220,000수준으로 새롭게 조정되고 있다. 한편 증권정보제공 업체인 씽크풀에 따르면 동사에 대한 컨센서스는 \'매수\'이고 목표주가의 추이를 살펴보면 최근 2회연속 목표가가 낮아지다 이번에는 직전목표가보다 높은 수준으로 크게 상향반전하는 추세이다. \xa0컨센서스최고최저투자의견매수매수HOLD목표주가198,889220,000180,000*최근 분기기준오늘 IBK투자증권에서 발표된 \'매수(유지)\'의견 및 목표주가 220,000원은 전체 컨센서스 대비해서 대체적으로 평균치에 해당하는 수준으로, 이번 의견은 동종목에 대한 전체적인 흐름에서 크게 벗어나지 않은 것으로 파악되며 목표가평균 대비 10.6% 초과하고 있는 것으로 집계되었다.  참고로 최근에 목표주가를 가장 공격적으로 제시한 한화투자증권에서 투자의견 \'BUY(유지)\'에 목표주가 220,000원을 제일 보수적인 의견을 제시한 유안타증권에서 투자의견 \'매수\'에 목표주가 180,000원을 제시한 바 있다. \xa0의견제시일자투자의견목표가격20180726매수(유지)220,00020180712매수190,00020180425매수(유지)170,00020180227매수(유지)170,00020180124매수(유지)170,000의견제시일자증권사투자의견목표가20180726IBK투자증권매수(유지)220,00020180726한국투자증권매수(유지)190,00020180726미래에셋대우매수210,00020180726메리츠종금증권BUY210,000(씽크풀에서 제공하는 컨센서스는 국내 전증권사에서 발표되는 기업분석 리포트 및 코멘트를 실시간으로 통계/분석처리되고 있습니다.)증시분석 전문기자 로봇 ET etbot@etnews.com전자신문과 씽크풀의 증시분석 전문기자 로봇 ET가 쓴 기사입니다▶ 전자신문 바로가기 [Copyright ⓒ 전자신문 & 전자신문인터넷, 무단전재 및 재배포 금지]전자신문 관련뉴스해당 언론사에서 선정하며 언론사 페이지(아웃링크)로 이동해 볼 수 있습니다.[단독]中텐센트·알리바바 \'QR\' 굴기 막자...정부, 한국 통합 \'QR페이\' 개발 착수차이나머니, 韓 장비기업 사냥...\'한스레이저\' 경쟁사 인수 추진삼성, 업계 최초 7.1채널 음향에 천장 4채널 덧붙인 사운드바 내놓는다협동로봇 시장 활성화 계기 마련했다. KIRIA 협동로봇 설치 작업장 안전인증제도 시행아우디 A3, 40% 할인 판매 진실은…""현금 \'No\', 리스만""좋아요0훈훈해요0슬퍼요0화나요0후속기사 원해요0기사제공 :']"
