,회사명,날짜,언론사,기사제목,링크,본문
0,삼성전자, 2018-01-2220:44,매일경제 ,4분기 실적시즌 본격화…은행·레저·화장품 `주목`,https://finance.naver.com/news/news_read.nhn?article_id=0004087666&office_id=009&mode=search&query=LG이노텍&page=1,"['       4분기 실적시즌 본격화…은행·레저·화장품 `주목`      기사입력2018-01-22 20:44기사원문좋아요훈훈해요좋아요 평가하기공감좋아요0훈훈해요0슬퍼요0화나요0후속기사 원해요0댓글소매유통株 깜짝실적 예상 국내 상장사들의 작년 4분기 실적 발표가 본격화하면서 금융·소매유통 업종이 투자 유망주로 떠오르고 있다. 통상적으로 12월 법인의 4분기 실적엔 기업의 영업외비용 회계 처리와 판매관리비 반영이 한꺼번에 몰리기 때문에 이익 규모가 시장 기대치보다 낮게 나타나는 경향이 있다. 자칫 \'어닝쇼크\'가 발생하면 주가 하락이 불가피한 만큼 이익 예상치가 시간이 갈수록 상향되는 종목에 관심을 기울여야 한다는 조언이 나온다. 22일 안진아 BNK투자증권 연구원은 ""일반적으로 1개월 전 영업이익 전망치 대비 현시점 전망치 증가율이 3개월 전 대비 증가율보다 높으면 실제 실적이 예상치를 밑돌 가능성이 낮다""며 ""3개월 전 컨센서스보다 큰 폭으로 상향 조정된 업종을 찾아보는 것을 추천한다""고 말했다. 신한금융투자도 ""컨센서스가 상향 조정된 업종에서 어닝서프라이즈가 나타날 확률이 높다""는 내용의 보고서를 냈다. 이와 관련해 BNK투자증권은 4분기 영업이익 기준 최근 1개월 컨센서스 변화율이 3개월 컨센서스 변화율보다 상향된 업종을 추려본 결과 은행, IT하드웨어, 화장품·의류·완구, 호텔·레저, 에너지 업종이 이름을 올렸다고 밝혔다. 이 가운데 은행을 비롯한 금융 업종은 여러 증권사가 입을 모아 수혜 업종으로 지목했다. 최근 글로벌 금리 인상기와 맞물려 실적 전망치 역시 크게 개선됐다. 삼성증권도 금융주를 어닝시즌 투자 유망주로 꼽았다. 박성현 삼성증권 연구원은 ""장기금리에 상승 압력이 커지고 있는데 단기금리로 차입하여 장기로 빌려주는 은행 입장에서는 마진이 확대될 수 있는 환경""이라고 설명했다.이밖에 화장품·의류·완구·호텔·레저 등을 아우르는 소매·유통 업종은 지난해 9월 이후 소비 심리가 회복되면서 상승세가 기대되는 업종이다. 특히 작년 4분기는 갑작스런 한파로 의류 매출이 급증하는 등 백화점을 중심으로 소매·유통업체들의 약진이 두드러졌다. 한편 IT하드웨어는 4분기 실적 기준 컨센서스 개선이 두드러졌지만 아직 추천하기에 조심스럽다는 의견이 나왔다. 안진아 연구원은 ""실적은 나쁘지 않지만 작년 동안 많이 오른 데다 기관과 외국인 수급 측면에서 긍정적으로 보기 힘들다""고 밝혔다. 이번주에는 23일 LG이노텍, LG디스플레이, LG생활건강, 삼성SDI, 24일은 포스코, 25일은 SK하이닉스, 현대차, 네이버, LG전자, 26일은 이노션, 현대제철, 현대건설 등 21개 기업이 실적을 발표할 예정이다. [정슬기 기자]▶뉴스 이상의 무궁무진한 프리미엄 읽을거리 ▶아나운서가 직접 읽어주는 오늘의 주요 뉴스[ⓒ 매일경제 & mk.co.kr, 무단전재 및 재배포 금지]매일경제 관련뉴스해당 언론사에서 선정하며 언론사 페이지(아웃링크)로 이동해 볼 수 있습니다.\'52세\' 김희애, 우아함 벗은 파격 \'하의실종\'…입이 쩍튀는 털목도리 가격 얼마?…최신유행 앵클부츠 \'눈길\'케이시 \'망사 스타킹+미모\' 남심 저격 그 자체대만, 고등훈련기 독자 개발…2020년 첫 비행\'美친\' 손예진, ""이 몸매 실화? 반전 볼륨감 드러내다""좋아요0훈훈해요0슬퍼요0화나요0후속기사 원해요0기사제공 :']"
1,삼성전자, 2018-01-2218:55,머니투데이 ,"한겨울 특히 추운 IT, 실적 발표로 반전할까",https://finance.naver.com/news/news_read.nhn?article_id=0003996456&office_id=008&mode=search&query=LG이노텍&page=1,"['       한겨울 특히 추운 IT, 실적 발표로 반전할까      기사입력2018-01-22 18:55기사원문좋아요훈훈해요좋아요 평가하기공감좋아요0훈훈해요0슬퍼요0화나요0후속기사 원해요0댓글 [머니투데이 김훈남 기자] [지난해 11월 업황고점 논란이후 꾸준히 약세, 삼성전자·LG전자 잠정실적이후 투심 냉각…월말 실적발표·상반기 전망 반등계기 주목]지난해 코스피 사상 최고치 달성을 이끈 IT(정보통신) 업종의 부진이 길어지고 있다. 2018년 초 업종 대표 종목인 삼성전자와 LG전자가 잇따라 시장 기대에 못 미치는 실적을 발표하면서 달러 약세와 일회성 비용 악영향이 부각된 탓이다. 잇따른 IT 대형주의 약세로 투자금이 화학과 철강, 레저 등 다른 업종으로 옮겨간 상황. 구체적인 실적 발표와 2018년 전망 제시를 앞둔 IT 업종이 얼어붙은 투자심리를 녹일 수 있을지 관심이 모인다.22일 코스피 시장에서 전기·전자 업종지수는 전 거래일 대비 1.97% 하락한 17949.83에 거래를 마쳤다. 시가총액 1·2위인 삼성전자와 SK하이닉스가 각각 2.19%(5만4000원), 3%(2200원)씩 약세로 지수하락을 이끌었고, 아이폰X(텐) 조기 단종설 바람을 맞은 LG이노텍 역시 전거래일 대비 2.64%(3500원) 약세를 보였다.전기·전자 업종지수는 지난해 11월 초 최고치를 찍은 이후 꾸준한 약세를 보이고 있다. 지난해 11월 2일 2만781.17로 최고점에 오르며 코스피 사상 최고치를 견인했으나, 이후 반도체 고점 논란이 불거지며 약세로 돌아섰다. 이어 인텔의 CPU 멜트다운 스캔들 등 IT 업종에 악재가 잇따른 데다 연말 본격화 된 달러 약세로 수익성 전망도 어두워지며 등락을 반복 중이다. 연초 잠정실적을 발표한 삼성전자와 LG전자 역시 국내 증권업계 컨센서스(추정치)에 못 미치는 영업이익을 밝혀 우려를 키웠다는 분석이 나온다. 이 때문에 전기·전자 업종 지수는 지난해 말 종가 18795.89와 비교해도 4.5% 약세에 머물러 있다. 같은 기간 1.4% 상승한 코스피 지수는 물론, 8.4%, 3.7%씩 상승세로 IT 업종 대신 코스피 지수를 이끈 철강, 화학 업종과도 대조적인 모양새다.증권업계는 23일부터 시작되는 실적발표를 계기 삼아 IT 업종이 부진에서 탈출할 가능성에 주목하고 있다. 오는 23일 지난해 실적을 공시하는 삼성SDI와 LG이노텍을 시작으로 SK하이닉스와 LG전자가 25일, 삼성전자가 31일 컨퍼런스콜을 진행할 예정이다.단순한 매출과 영업이익 수치뿐만 아니라 실적 상세 설명을 통해 시장 우려를 일정 부분 해소할 것이란 기대다. 특히 삼성전자와 SK하이닉스 등 컨퍼런스콜에서는 시장과의 질의응답을 통해 지난해 일회성 비용 규모와 환율효과, 2018년 상반기 전망을 가늠할 수 있다고 업계 전문가들은 설명했다. 실적에 대한 원인 분석과 전망이 확인되면 최근 주가를 주춤케 한 투자심리도 어느 정도 회복될 것이란 기대감이 형성됐다. 아울러 삼성전자의 배당규모 등 주주환원책을 내놓는 시점 역시 컨퍼런스콜이라는 점에서 주가반등 계기가 될 수 있다고 한다.노근창 현대차투자증권 연구원은 ""최근 삼성전자와 SK하이닉스 등 IT 업종 부진은 업황하고는 큰 상관이 없다""며 ""수급상 쏠림 현상과 부정적인 투자심리 영향은 삼성전자 등 분기실적 발표 이후 해소될 수 있을 것""이라고 설명했다.이경민 대신증권 연구원도 ""주요 IT 기업 실적발표 결과에 따라 이익에 대한 신뢰회복 시점이 결정될 것""이라며 삼성SDI와 LG이노텍, SK하이닉스 등 대표 IT기업 실적이 시장 기대를 넘어서면 빠른 분위기 반전을 기대할 수 있다""고 말했다.▶지금 옆사람이 보는 기사들▶무료 만화 보고 선물도 받고~ ▶치어리더 vs 레이싱걸 김훈남 기자 hoo13@mt.co.kr 머니투데이 관련뉴스해당 언론사에서 선정하며 언론사 페이지(아웃링크)로 이동해 볼 수 있습니다.비트코인 창시자 \'사토시\' 사망?…16조 상속재산 행방은\'바람의 딸\' 한비야, 지난해 네덜란드 긴급구호 전문가와 결혼기아차, 초대형 SUV 내년에 낸다[MT리포트] 타워팰리스, 이젠 강남 달동네? 인근 급등 탓 \'싼 집\' 됐다김희애 김연아, 같은 옷 다른 느낌…""고혹미 대결""좋아요0훈훈해요0슬퍼요0화나요0후속기사 원해요0기사제공 :']"
2,삼성전자, 2018-01-2217:34,한국경제 ,외국인 매도 공세에 길 잃은 IT·바이오주,https://finance.naver.com/news/news_read.nhn?article_id=0003882521&office_id=015&mode=search&query=LG이노텍&page=1,"['       외국인 매도 공세에 길 잃은 IT·바이오주      기사입력2018-01-22 17:34기사원문좋아요훈훈해요좋아요 평가하기공감좋아요0훈훈해요0슬퍼요0화나요0후속기사 원해요0댓글코스피 18P 하락 2500 \'턱걸이\'세법 개정안에 외국인 우려 커져아이폰X 단종설로 부품주 급락4분기 실적시즌 본격 개막""개별종목 실적 따라 대응해야""[ 윤정현/조진형 기자  ] 외국인 투자자가 시가총액 규모가 큰 정보기술(IT) 및 바이오주를 집중적으로 팔아치우면서 코스피와 코스닥지수가 동시에 출렁거렸다. 한국 증시가 최근 며칠간 아이폰X 판매부진 우려, 바이오주 고평가 논란 등으로 갈지(之)자 흐름을 보이던 와중에 매각차익에 대해 양도소득세를 내야 하는 외국인 범위를 확대하는 내용을 골자로 한 세법 개정안에 외국인 투자자가 우려를 나타낸 게 ‘강펀치’를 날린 것으로 증권업계는 분석했다.◆외국인 매도에 출렁22일 코스피지수는 18.15포인트(0.72%) 하락한 2502.11에 장을 마쳤다. 장중 1% 넘게 빠지며 2488.44까지 떨어지기도 했지만 오후 들어 안정을 찾으며 2500선은 지켜냈다. 외국인(1756억원)과 기관(721억원)의 동시 순매도가 지수를 끌어내렸다.시가총액 1, 2위인 삼성전자와 SK하이닉스가 각각 2.19%, 3.00% 떨어지면서 전기전자업종(1.97%) 하락폭이 두드러졌다. 삼성전자에 대한 외국인의 ‘팔자’ 공세가 거셌다. 이날 1129억원을 순매도한 것을 포함해 올 들어 총 9374억원어치를 내다 팔았다.판매 부진에 허덕이는 애플 아이폰X의 조기 단종설까지 흘러나오면서 중소형 IT주도 대거 하락했다. 애플의 주요 부품사인 LG이노텍(-2.64%) 비에이치(-5.56%) 인터플렉스(-18.11%) 등이 일제히 하락했다.코스닥지수도 외국인 순매도(720억원)에 6.90포인트(0.78%) 떨어진 873.09에 거래를 마감했다. 셀트리온(-2.50%) 셀트리온헬스케어(-4.84% ) 셀트리온제약(-5.94%) 등 ‘셀트리온 삼형제’를 비롯해 티슈진(-1.84%) 메디톡스(-1.10%) 등 시가총액 상위 바이오주가 내림세를 보였다. 이날 외국인은 셀트리온을 425억원어치 팔아치웠다. 유가증권시장과 코스닥시장을 통틀어 순매도 2위다.◆혼란에 빠진 외국인전문가들은 외국인 순매도 상위 종목에 시총 상위 종목이 대거 포함된 것에 “시총 비중에 맞춰 수동적으로 투자하는 인덱스펀드가 자금을 뺀 것으로 추정된다”고 설명했다. 지난 21일 미국 모건스탠리캐피털인터내셔널(MSCI)이 한국 정부의 세법개정안이 외국인 자금 유입에 영향을 미칠 가능성이 있다는 성명을 발표하면서 일부 인덱스펀드에서 돈이 빠졌고, 시총 상위 종목의 하락폭이 컸을 것이란 분석이다.이날 주요 증권사엔 외국인 투자자의 문의가 쏟아졌다. 한 증권사 애널리스트는 “홍콩 싱가포르 등에서 국내 상장기업 지분 5% 이상을 보유한 외국인 양도소득 과세 기준을 묻는 전화가 쇄도했다”고 말했다.이중과세방지 국제조약을 맺은 국가 투자자도 해당하는 것인지, 해외 펀드를 합산해 특정 종목 지분 5%가 넘으면 과세 대상이 되는지 등이 분명하지 않아 외국인이 대혼란에 빠졌다는 게 증권업게 관계자의 공통된 설명이다. 기획재정부 관계자는 “조세피난처 등 조세조약 미체결국, 또는 조세조약상 과세 가능한 비거주자에만 적용된다”며 “펀드가 아니라 5% 이상 지분을 보유한 실제 투자자에 한해 과세하기 때문에 공모펀드 등에는 큰 영향이 없을 것”이라고 해명했다.◆종목 장세 대비해야윤지호 이베스트투자증권 리서치센터장은 “작년부터 이어진 유가증권시장의 삼성전자, 바이오의 셀트리온 위주 장세에서 벗어나 업종·종목별 순환매 장세가 시작될 것”이라며 “지수를 좇는 인덱스 투자보다 실적개선 여부, 밸류에이션(실적 대비 주가 수준) 등까지 고려한 종목 발굴이 중요해지는 시점”이라고 말했다. 김유겸 케이프투자증권 리서치센터장은 “이번주 4분기 실적시즌이 본격적으로 시작되면 투자자의 눈길도 테마보다는 개별 종목의 실적개선 여부로 옮겨갈 것”이라고 설명했다.한국 증시는 23일 LG디스플레이와 삼성SDI를 시작으로 24일 포스코, 25일 네이버와 SK하이닉스 현대자동차 등 주요 기업의 작년 4분기 실적 발표가 줄줄이 이어진다.윤정현/조진형 기자 hit@hankyung.com[한경닷컴 바로가기] [글방] [모바일한경 구독신청] ⓒ 한국경제 & hankyung.com, 무단전재 및 재배포 금지한국경제 관련뉴스해당 언론사에서 선정하며 언론사 페이지(아웃링크)로 이동해 볼 수 있습니다.IT주, 원화 강세 여파에 \'약세\'…삼성전자 이틀째 하락춤추는 바이오주… 적정 가치 평가 \'고민되네\'""주식 1억 팔면 무조건 1100만원 원천징수"" 초비상""경쟁국 중 한국 같은 나라는 없다""…이러다간 \'재앙\'""억울하다""…상계동 아파트 집주인들 \'분노 폭발\'좋아요0훈훈해요0슬퍼요0화나요0후속기사 원해요0기사제공 :']"
3,삼성전자, 2018-01-2216:44,한국경제 ,"[기업이 뛴다] LG, 근본적 R&D 혁신 위해 올해 19兆 '통큰 투자'",https://finance.naver.com/news/news_read.nhn?article_id=0003882473&office_id=015&mode=search&query=LG이노텍&page=1,"['       [기업이 뛴다] LG, 근본적 R&D 혁신 위해 올해 19兆 \'통큰 투자\'      기사입력2018-01-22 16:44기사원문좋아요훈훈해요좋아요 평가하기공감좋아요0훈훈해요0슬퍼요0화나요0후속기사 원해요0댓글 [ 고재연 기자  ] LG전자는 CES 2018 전시장 입구에 곡면 55형 OLED 246장을 이용한 초대형 \'OLED 협곡\'을 설치했다.  LG전자 제공LG는 올해 연구개발(R&D)을 근본적으로 혁신하고 제조 역량을 세계 최고 수준으로 높이는 데 목표를 맞췄다. 구본준 LG 부회장은 지난 2일 낸 신년사에서 △근본적인 R&D 혁신 △세계 최고 수준의 제조 역량 확보 △사업 방식의 철저한 변화 △국민과 사회로부터 더욱 신뢰받는 기업 등 4가지 경영 방향을 제시했다. 구 부회장은 “정치·경제 환경은 시간이 지날수록 예측 자체가 어려울 정도로 변동성이 커지고, 4차 산업혁명과 기술 융복합의 빠른 진화는 기업 간의 경쟁 구도를 근본적으로 바꿔가고 있다”며 “익숙했던 기존 고정관념을 과감히 버려 사업하는 방식을 근본적으로 바꾸고, 철저하게 우리 사업구조를 고도화해야 한다”고 강조했다.LG는 올해 가전, OLED, 기초소재 등 주력사업 본연의 경쟁력을 강화하고 자동차 부품, 에너지, 인공지능·5G, 바이오 등 성장사업 추진에 역량을 집중한다. 이를 위해 올해 전년 대비 8% 증가한 19조원을 국내에 투자할 예정이다. R&D 확대, 고부가 일자리 창출을 강화하기 위해 1만 명 규모의 인력을 신규 채용한다.먼저 LG전자는 OLED TV 등 프리미엄 제품 중심으로 수익성을 높이고 인공지능(AI), 로봇, 자동차부품 등 성장 사업 분야에서 성과를 낼 예정이다. 올해 OLED TV 판매량 목표를 지난해 대비 2배 이상으로 세웠다. AI 브랜드 ‘씽큐(ThinQ)’를 탑재한 TV, 냉장고, 세탁기, 에어컨, 스피커 등의 제품을 지속적으로 출시해 인공지능 선도기업 이미지 강화할 계획이다.B2B(기업 대 기업) 사업은 주력 사업 수준으로 육성한다. 올해 정기 임원인사에서 B2B사업본부, 융복합사업개발센터를 신설하는 등 미래 준비를 가속하기 위한 조직개편을 단행했다. B2B사업본부는 인포메이션 디스플레이, 에너지 등 B2B 사업의 수주 기회를 적극 확보하는 역할을 한다.LG디스플레이는 글로벌 디스플레이업계 1위 자리를 굳힌다는 계획이다. 대형 OLED 분야에서는 기존 라인업을 한 단계 향상시키고 롤러블과 투명 등 OLED만의 독보적인 혁신 제품으로 새로운 가능성을 제시하며 신규 시장을 창출해 나갈 예정이다.LG이노텍은 모바일용 카메라모듈, 차량부품, 기판소재, LED 등 핵심 사업영역에서 차별화된 신기술과 신공법을 기반으로 시장 경쟁력을 강화해 나간다. 특히 고출력·초경량 차량용 모터, 고효율 파워부품 등 혁신 제품을 한발 앞서 선보이는 등 전기차·자율주행차 시장 성장에 적극 대응한다.LG화학은 기초소재, 전지, 정보전자소재 분야 등 기존사업의 역량 강화 및 사업구조 고도화에 집중하고, 에너지, 물, 바이오 등 성장사업을 집중 육성해 균형 있는 사업 포트폴리오를 구축한다는 전략이다. 전지사업본부는 가격, 성능, 안전성 측면에서 경쟁 우위를 지속 확보해 한 번 충전으로 500㎞ 이상 주행할 수 있는 3세대 전기차 프로젝트 수주에서도 확실한 1위를 수성해 나간다는 전략이다.고재연 기자 yeon@hankyung.com[한경닷컴 바로가기] [글방] [모바일한경 구독신청] ⓒ 한국경제 & hankyung.com, 무단전재 및 재배포 금지한국경제 관련뉴스해당 언론사에서 선정하며 언론사 페이지(아웃링크)로 이동해 볼 수 있습니다.[기업이 뛴다] 금호아시아나그룹, 새 노선 개발·항공기 도입 늘려 \'아름다운 비상\'에쓰오일, 신규 고도화 설비 가동… 안정적 수익구조 구축""주식 1억 팔면 무조건 1100만원 원천징수"" 초비상""경쟁국 중 한국 같은 나라는 없다""…이러다간 \'재앙\'1년 100억 버는데 300억 들여 美에…""좀 살려달라""좋아요0훈훈해요0슬퍼요0화나요0후속기사 원해요0기사제공 :']"
4,삼성전자, 2018-01-2216:37,부산일보 ,"[특징주] 삼성전자·SK하이닉스, 외국인·기관 동반 매도 '하락'",https://finance.naver.com/news/news_read.nhn?article_id=0000773648&office_id=082&mode=search&query=LG이노텍&page=1,"['       [특징주] 삼성전자·SK하이닉스, 외국인·기관 동반 매도 \'하락\'      기사입력2018-01-22 16:37기사원문좋아요훈훈해요좋아요 평가하기공감좋아요0훈훈해요0슬퍼요0화나요0후속기사 원해요0댓글    삼성전자 · SK하이닉스. 시가총액 1∼2위 삼성전자와 SK하이닉스가 22일 나란히 큰 폭으로 하락했다.이날 유가증권시장에서 삼성전자는 전 거래일 대비 2.19% 떨어진 241만2000원에 장을 마쳤다.SK하이닉스도 3.00% 하락한 7만1100원에 장을 마감했다.두 종목은 외국인과 기관의 동반 매도세에 밀려 이날까지 2거래일 연속 하락세를 이었다.외국인은 삼성전자를 1129억원, SK하이닉스를 110억원어치 각각 팔았다.기관도 삼성전자를 587억원, SK하이닉스를 801억원 규모로 순매도했다.이들 정보기술(IT) 대형주는 반도체 업황에 대한 논란과 원/달러 환율, 시장 기대치에 못 미친 삼성전자의 작년 4분기 잠정 실적 등의 영향으로 최근 부진한 흐름을 이어가고 있다.이경민 대신증권 연구원은 ""한국 IT기업의 약세는 작년 4분기 원화 강세 여파가 실적 불확실성을 자극하고 있기 때문""이라며 ""SK하이닉스와 삼성SDI, LG이노텍 등 이번 주 주요 IT기업의 실적 발표 결과에 따라 이익 신뢰 회복 시점이 결정될 것으로 보인다""고 말했다.그러면서 ""이들 기업의 작년 4분기 실적이 기대치를 웃돌면 환율 변화와 맞물려 분위기가 빠르게 반전될 수 있으나 반대의 경우는 이익 신뢰도 회복까지 시간이 더 걸릴 수 있다""고 말했다.박철중 기자 cjpark@ 부산일보 관련뉴스해당 언론사에서 선정하며 언론사 페이지(아웃링크)로 이동해 볼 수 있습니다.[특징주] 아이폰X 조기 단종설에 부품주 급락[특징주] 셀트리온 3형제, 하락세 이어져 \'외국계 보고서 여파\'개그맨 김준호, 아내와 합의 이혼 ""성격차...잘 사는 모습 못 보여드려 죄송""XtvN 개국, 장및빛 미래를 향한 기대와 우려의 공존(종합)소액 결제 업종, 신용카드 가맹점 수수료 7월부터 인하좋아요0훈훈해요0슬퍼요0화나요0후속기사 원해요0기사제공 :']"
