,회사명,날짜,언론사,기사제목,링크,본문
0,삼성전자, 2018-05-1819:01,한국경제 ,"구광모, 다음주 (주)LG 출근… 오너 경영자로 연착륙 때까지 '6人'이 보좌",https://finance.naver.com/news/news_read.nhn?article_id=0003942824&office_id=015&mode=search&query=LG이노텍&page=1,"['       구광모, 다음주 (주)LG 출근… 오너 경영자로 연착륙 때까지 \'6人\'이 보좌      기사입력2018-05-18 19:01기사원문좋아요훈훈해요좋아요 평가하기공감좋아요0훈훈해요0슬퍼요0화나요0후속기사 원해요0댓글구광모의 LG 어떻게 바뀌나구본준 부회장, 큰그림 그리고계열사들 이끄는 스타일 ZKW도 M&A 전과정 총괄6인 전문경영인 보좌 체제일단 계열사 자율 경영에 무게경영 부담 덜고 그룹 현안 파악경영보폭 넓혀가며 역할 확대할 듯[ 노경목 기자  ] 다음달 29일 LG그룹 지주회사인 (주)LG의 사내이사로 선임될 구광모 LG전자 상무는 18일에도 서울 여의도 트윈타워로 출근했다. 이날은 LG전자가 있는 서관으로 나왔지만 다음주부터는 (주)LG가 있는 동관으로 발걸음을 옮긴다.한 관계자는 “아직 LG전자 상무 직함을 달고 있지만 실질적으로 LG그룹을 이끌어야 하는 만큼 파악할 현안이 많을 것”이라며 “LG전자에서 하던 B2B사업본부 업무는 정리하고 있다”고 말했다. 구 상무의 구체적인 직급과 역할은 다음달 (주)LG 임시주주총회 뒤 열리는 이사회에서 결정될 예정이다.구 상무가 사실상 경영 전면에 나서면서 그룹 운영의 핵심인 (주)LG 역할이 어떻게 바뀔지에 관심이 쏠린다. 2003년 지주사 체제로 전환한 LG에서는 (주)LG가 계열사 대부분의 최대주주로서 그룹을 이끌고 있다. 와병 중인 구본무 LG그룹 회장을 대신해 (주)LG 사령탑을 맡은 구본준 LG그룹 부회장은 과단성 있는 결단력으로 빠른 판단을 내리고, 먼저 큰 그림을 제시해 계열사들을 이끄는 스타일로 알려져 있다.LG그룹 인수합병(M&A) 역사상 최대 규모인 1조4000억원을 들여 지난달 인수한 오스트리아 헤드램프 제조업체 ZKW가 대표적인 사례로 꼽힌다. 구 부회장은 (주)LG의 관련 조직을 통해 ZKW 인수작업 초기부터 매입 가격 협상에 이르기까지 M&A 과정 전반을 이끌었다.이 같은 (주)LG 역할은 ‘구광모 시대’를 맞아 달라질 것이라는 전망이 많다. 구 상무는 계열사들의 신사업을 관할하는 (주)LG 시너지팀에서 2014년부터 4년간 근무했지만 일상적인 경영 활동까지 파악할 기회는 없었다. LG전자와 LG디스플레이를 이끈 경험이 있는 구 부회장과 대비되는 부분이다. 구 상무가 당분간 (주)LG의 역할을 줄이면서 계열사 자율 경영에 무게를 실을 것이라는 관측이 나오는 이유다. 필요할 때는 의사 결정을 하겠지만, 각 계열사의 경영 활동을 진단하고 지원하는 업무에 집중할 가능성이 크다는 게 LG 안팎의 시각이다.전날 발표된 전문경영인 보좌체제는 이런 전망에 힘을 실어주고 있다. LG그룹은 구 상무를 중심으로 하현회 (주)LG 부회장, 박진수 LG화학 부회장, 한상범 LG디스플레이 부회장, 차석용 LG생활건강 부회장, 권영수 LG유플러스 부회장, 조성진 LG전자 부회장 등이 책임 경영을 할 것이라고 밝혔다. 6인의 전문경영인에게 더 큰 책임과 권한이 주어진다는 얘기다. LG이노텍 등 전자계열사는 한 부회장과 조 부회장, LG하우시스 등 화학 계열사는 박 부회장과 차부회장이 관련 조언을 할 것으로 전해졌다. 구 상무가 수년간에 걸쳐 경영 보폭을 점차 넓혀 가면서 계열사들에 대한 (주)LG 역할은 자연스럽게 다시 확대될 것이라는 예상이 나온다.노경목 기자 autonomy@hankyung.com[한경닷컴 바로가기] [글방] [모바일한경 구독신청] ⓒ 한국경제 & hankyung.com, 무단전재 및 재배포 금지한국경제 관련뉴스해당 언론사에서 선정하며 언론사 페이지(아웃링크)로 이동해 볼 수 있습니다.30대女 ""임신 때 되면 되겠지""하다…\'충격 눈물\'""文 정부 갈등 심상치 않더니…"" 흉흉한 소문 왜?투싼 불티나더니…현대차 ""41년 만에 이런 일 처음""""주식으로 돈 버는 시대 끝났다"" 특급 경고 날린 곳LG 스마트폰 사은품 헐값으로 팔리더니 결국…좋아요0훈훈해요0슬퍼요0화나요0후속기사 원해요0기사제공 :']"
1,삼성전자, 2018-05-1817:33,SBS Biz ,"[이슈진단] “구본준 부회장, 계열분리 하지 않을까 예측”",https://finance.naver.com/news/news_read.nhn?article_id=0000158226&office_id=374&mode=search&query=LG이노텍&page=1,"['       [이슈진단] “구본준 부회장, 계열분리 하지 않을까 예측”      기사입력2018-05-18 17:33기사원문좋아요훈훈해요좋아요 평가하기공감좋아요0훈훈해요0슬퍼요0화나요0후속기사 원해요0댓글LG 4세 경영승계…구 부회장, 지흥 등 통해 계열분리 관측도■ 경제와이드 이슈& \'이슈진단\' - 박주근 CEO스코어 대표Q. 그렇다면 당분간은 구본준 부회장 체제가 이어질 가능성이 짙은데, 어찌됐건 이것은 한시적인 것이고 결국 LG는 계열분리 될 것이다, 이렇게 봐야 할까요?네, 그렇습니다. LG는 전통적으로 형제가 어느정도 성장을 하면, 계열분리를 해왔던 게 관례이기 때문에 구본준 부회장도 계열분리를 하지 않을까라는 예측을 할 수 있습니다. 구본준 부회장의 지금까지 이력을 보면, LG반도체를 이끌었고, LG정보통신을 이끌었고, LG디스플레이를 이끌었습니다. 그리고 아들인 구형모 씨가 있는데, 현재 부장이죠. 구형모 씨가 가지고 있는 기업은 \'지흥\'이라는 작은 계열사입니다. 100% 지분을 가지고 있는 계열사인데 이 지흥이라는 기업도 잘 살펴보면, LG디스플레이나 LG이노텍 같은 계열사의 일감을 받아서 성장한 기업입니다. 만약 분리한다면, 저는 LG디스플레이나 지흥을 통해서 구본준 부회장이 자신의 하나의 그룹을 만들어서, 아들인 구형모 씨가 가지고 있는 지흥, 그리고 LG, 자신이 지금까지 걸어온 길이 LG디스플레이, 반도체 쪽이었기 때문에 그쪽을 통해서 계열 분리를 하지 않을까, 이런 조심스러운 생각이 듭니다.(자세한 내용은 동영상을 시청하시기 바랍니다.)       ☞ 의견 있는 경제채널 SBSCNBC [홈페이지] [뉴스스탠드]☞ 공식 SNS [페이스북] 저작권자 SBS플러스 & SBS I&M 무단전재-재배포 금지SBS Biz 관련뉴스해당 언론사에서 선정하며 언론사 페이지(아웃링크)로 이동해 볼 수 있습니다.[이슈진단] 반포현대 후폭풍…재건축 부담금이 쏘아올린 공?[이슈진단] LG 4세 경영 시동…재계 지각변동 오나""3초 만에 완성""…크기도 다양한 옷정리 끝판왕은?""나도 아이언맨처럼""…손의 움직임으로 조작하는 증강현실\'삼성바이오로 감리위\' 첫날 마라톤 회의…2차는 대심제로 진행좋아요0훈훈해요0슬퍼요0화나요0후속기사 원해요0기사제공 :']"
2,삼성전자, 2018-05-1816:06,매일경제 ,LG 전장인력만 2만명…공격적 조직 확대,https://finance.naver.com/news/news_read.nhn?article_id=0004153425&office_id=009&mode=search&query=LG이노텍&page=1,"['       LG 전장인력만 2만명…공격적 조직 확대      기사입력2018-05-18 16:06기사원문좋아요훈훈해요좋아요 평가하기공감좋아요0훈훈해요0슬퍼요0화나요0후속기사 원해요0댓글구광모 시대 성장동력 `전장사업` LG그룹이 구광모 LG전자 상무(사진)의 (주)LG 등기이사 선임으로 4세 경영에 시동을 걸면서 LG그룹의 신성장 분야인 자동차 전장산업이 주목받고 있다. 최근 오스트리아 헤드램프 제조사 ZKW를 인수하는 등 과감한 투자를 한 데 이어 공격적인 경영목표를 제시하면서 전장사업이 LG그룹의 핵심 사업으로 떠오를 전망이다. 18일 LG그룹에 따르면 주력사인 LG화학, LG전자, LG이노텍, LG디스플레이, LG하우시스가 자동차 전장사업을 올해 대대적으로 확대하고 나선 것으로 전해졌다. LG전자의 전장(VC)사업본부나 LG하우시스의 자동차소재부문과 같이 계열사들은 자동차 전장 관련 사업부를 별도로 운영하고 있다. ZKW를 포함한 LG그룹 전체 전장사업 매출액 규모는 10조원  수준으로 2017년 그룹 전체 매출액 160조원의 10% 수준이다. ZKW(9200명), LG화학 전지사업부문(5143명), LG전자 VC사업본부(4002명) 등 전장사업 관련 직원만 약 2만명으로 대군단을 꾸리고 있다. LG그룹 전장사업 성장의 핵심 중 하나는 LG화학의 전기차용 배터리다. LG화학은 현재 전기차용 배터리 수주잔액이 42조원으로 2020년 전지부문 매출액이 7조원까지 급증할 것으로 전망하고 있다. 30여 개 글로벌 완성차 업체와 거래 중인 LG화학은 전기차용 배터리의 폭발적 수요에 대응하기 위해 현재 18GWh 수준인 배터리 생산 능력을 2020년 70GWh까지 끌어올린다는 계획이다. 박진수 LG화학 부회장은 최근 기자간담회에서 ""연평균 15%씩 성장해 2020년 매출액을 36조원대로 끌어올리겠다""며 공격적인 경영 목표를 밝혔는데 그 중심에 전기차용 배터리가 있다. 그는 2020년까지 늘어날 매출액 10조원 중 절반이 전지부문에서 발생할 것으로 내다봤다.  2013년 신설된 LG전자 VC사업본부는 차량용 인포테인먼트 제품과 전기자동차 구동부품, 첨단운전자지원시스템(ADAS) 등을 만들고 있다. LG전자는 VC사업본부가 영업손실을 면치 못하고 있음에도 미래 사업을 위해 투자를 아끼지 않고 있다. 지난해 1069억원의 영업손실을 기록했지만 매출액은 3조3300억원으로 전년 대비 24%나 증가했다.ZKW 인수 효과에 따라 올해 VC사업본부 투자 규모는 LG전자 사업본부 가운데 가장 클 전망이다. LG전자 분기보고서에 따르면 VC사업본부는 올해 1조6400억원을 신규 투자할 계획이다. 이는 지난해보다 3배 늘어난 금액이다.ZKW는 LG그룹과의 시너지 확대를 위해 추가 공장 건립에 나선다. 오스트리아 신문 디 프레세에 따르면 올리버 슈베르트 ZKW 최고경영책임자(CEO)는 최근  APA통신과 인터뷰하면서 ""LG그룹과의 시너지를 위해 유럽 및 중국에서 신규 생산공장 후보지를 물색 중""이라고 밝혔다.LG그룹은 ZKW 인수로 글로벌 상위 자동차 전장기업 입지를 굳혀 나갈 수 있게 됐다. LG그룹은 글로벌 사업 네트워크를 활용해 프리미엄 시장에 집중돼 있는 ZKW의 헤드램프 사업을 전 세계 완성차 업계로 확대할 계획이다. LG디스플레이는 모바일사업부 내 오토(Auto)사업담당을 통해 자동차용 디스플레이 사업을 펼치고 있다. LG디스플레이는 자동차용 디스플레이가 점점 확대 적용되는 추세에서 이를 신성장 동력 중 하나로 보고 있다. [전경운 기자]▶뉴스 이상의 무궁무진한 프리미엄 읽을거리 ▶아나운서가 직접 읽어주는 오늘의 주요 뉴스[ⓒ 매일경제 & mk.co.kr, 무단전재 및 재배포 금지]매일경제 관련뉴스해당 언론사에서 선정하며 언론사 페이지(아웃링크)로 이동해 볼 수 있습니다.\'美친\' 손예진, ""이 몸매 실화? 반전 볼륨감 자랑하다""트럼프, 北돌변에 \'시진핑 배후론\' 불쑥 꺼내…""김정은에 영향""이효리 볼륨감 넘치는 화보…육감적인 몸매우산비닐 없앤 지하철역, 시민들 ""워터파크냐"" 성토설리, 시선올킬 파격의상…\'가슴 깊게 파인 브라톱\'만!좋아요0훈훈해요0슬퍼요0화나요0후속기사 원해요0기사제공 :']"
3,삼성전자, 2018-05-1812:50,데일리안 ,"[포스트 구본무] 구광모 경영 승계...조직·인력 ‘안정’ , 자금 ‘부담’",https://finance.naver.com/news/news_read.nhn?article_id=0002258817&office_id=119&mode=search&query=LG이노텍&page=1,"['       [포스트 구본무] 구광모 경영 승계...조직·인력 ‘안정’ , 자금 ‘부담’      기사입력2018-05-18 12:50기사원문좋아요훈훈해요좋아요 평가하기공감좋아요0훈훈해요0슬퍼요0화나요0후속기사 원해요0댓글서울 여의도 LG트윈타워 전경.ⓒLG전자선진적 지배구조 구축...구본준 부회장 등 인력도 풍부지분 확보 위한 비용 마련 관건...상속·증여세 고민구본무 LG그룹 회장의 와병으로 구광모 LG전자 상무로의 4세 경영 승계가 본격화되면서 안정적 승계 과정에 촉각이 쏠리고 있다. LG그룹은 이미 안정적인 지배구조를 구축한 상태여서 체제 변화가 크지 않을 것으로 예상된다. 허지만 구본무 회장 보유 지분 승계로 인한 증여세나 상속세 금액은 다소 부담으로 작용할 전망이다.  18일 재계와 LG 등에 따르면 LG그룹의 지배구조는 지주회사인 (주)LG가 주요 계열사들을 지배하는 형태로 이뤄져 있어 (주)LG 최대주주가 그룹 전체를 형태로 이뤄져 있다.◆(주)LG가 모든 계열사 지배하는 구조...안정성·투명성 갖춰(주)LG는 LG화학(30%)·LG전자(34%)·LG생활건강(34%)·LG유플러스(36%) 등 주력 계열사들의 지분을 보유하고 있고 자회사들이 각 분야별 사업에 따라 자회사를 두는 지주회사-자회사-손자회사로 이어지는 수직계열화 체제를 갖추고 있다.예를 들면 LG전자의 경우, LG디스플레이(37.90%)와 LG이노텍(40.79%) 등을 자회사로 두고 지분을 보유하고 있다. 이는 LG전자의 최대주주인 (주)LG가 이들 양 손자회사까지 지배할 수 있는 구조인 것이다.LG는 지난 2003년 국내 대기업 최초로 이러한 지주회사 체제로 전환해 지배구조 구축과 투명 경영에서 모범 기업으로 일컫어져 왔다. 지난해에는 지주회사 체제 밖 계열사인 LG상사를 계열사 내로 편입하면서 다시 한번 호평을 받았고 이는 이미 재계 뿐만 아니라 정부에서도 인정을 받고 있다.김상조 공정거래위원장은 LG의 선제적 지배구조 개선 작업에 대해 ""지배구조와 관련해 긍정적 변화의 신호를 줘서 감사하게 생각한다""고 밝힌 바 있다. 또 지난해 12월 대기업들 증 가장 먼저 LG를 방문한 김동연 경제부총리 겸 기획재정부 장관은 “""LG는 지배구조 개선이나 상생에서 여러 모범을 보인 기업”이라고 강조한 바 있다.이미 그룹이 안정적인 지배구조 체제를 갖춘 터라 구 상무로의 경영 승계에 있어서 긍정적 요인이 됐으면 됐지 부정적 요인으로 작용하지는 않을 것이라는 분석이다. 인력 구성도 잘 갖춰져 있다는 것이 중론이다. 구본준 부회장이 지난해부터 사실상 총수 역할을 해 온데다 LG화학(박진수)·LG전자(조성진)··LG디스플레이(한상범) 등 주요 계열사들에서 부회장급 최고경영자(CEO)들이 포진하고 있어 4세로의 경영 승계과정에서 경영차질은 빚지 않을 것이라는 전망이 지배적이다.(주)LG 최대주주 및 특수관계인의 주식소유 현황.ⓒ데일리안◆구본무 회장 지분 확보에 9000억 이상 들 듯하지만 지분확보와 상속에 따른 자금은 부담 요인으로 작용할 것으로 보인다. 안정적인 그룹 경영권 확보를 위해서는 지주회사인 (주)LG의 지분 확대가 필수적이기 때문이다. 현재 구광모 상무는 6.24%(1분기 말 기준)의 지분을 보유해 구본무 회장(11.28%)과 구본준 LG 부회장(7.72%)에 이어 오너 일가 중 세 번째로 많은 지분을 갖고 있다. 7.99%를 보유한 국민연금이 2대주주여서 주주 기준으로는 4대 주주다.지난 2006년 지분이 2.75%에 불과했던 구 상무는 그동안 지분을 지속적으로 늘려왔지만 아직 부족한 상황이다. 물론 (주)LG는 최대주주 및 특수관계인의 보유지분이 46.68%에 달해 경영권이 안정적이라는 것이 그룹의 설명이다. 또 오너가 중 구 회장의 지분과 친부인 구본능 희성그룹 회장의 지분(3.45%)만 더해도 20%를 넘기기 때문에 불안감은 크지 않다. 하지만 와병 중인 구본무 회장의 건강상태에 따라 그가 소유한 (주)LG 주식 1945만8169주(17일 종가기준 금액 약 1조9069억원)를 상속받아야 해 상속·증여세 납부를 위한 자금 마련은 다소 부담이다.현재 30억원 이상에 적용되는 상속·증여세율 50%를 적용하면 세금만으로 약 9000억원 이상 납부해야 하는 상황이기 때문이다. 다만 이를 주식으로 납부하면 자금 확보 부담을 덜을 수 있다. 구본무 회장 지분 중 절반 가량을 세금으로 납부해도 약 11.88%의 지분을 확보해 현재 최대 주주인 구 회장의 지분보다 많이 확보할 수 있게 돼 안정성을 담보할 수 있게될 것이라는 설명이다.이밖에 LG상사의 지주회사 체제 내 편입 과정에서 불거진 탈세혐의에 대한 수사도 잠재적 부담이다. 이미 지난해 말 이뤄진 사안이라 구 상무의 경영권 승계에 직접적인 영향을 미치지는 않을 전망이지만 향후 수사 확대 가능성을 배제할 수 없기 때문이다.재계 한 관계자는 “LG는 지배구조와 보좌 인력 등이 잘 갖춰져 있어 4세로의 경영 승계도 큰 무리없이 진행될 것으로 보고 있다”며 “4세 경영체제에 따른 변화가 더 주목되는 상황”이라고 말했다.데일리안 이홍석 기자 (redstone@dailian.co.kr)ⓒ (주)데일리안 - 무단전재, 변형, 무단배포 금지데일리안 관련뉴스해당 언론사에서 선정하며 언론사 페이지(아웃링크)로 이동해 볼 수 있습니다.[포스트 구본무] LG 구광모 상무 \'4세 경영\' 본격화LG가 \'4세\' 후계자 구광모 상무는 누구?구광모 LG전자 상무, (주)LG 등기이사 선임....경영후계 잇는다구본무 LG 회장, 병원 입원 치료...구광모, 등기이사 선임구광모 상무 신사업분야 발령, LG의 전통은 계속된다좋아요0훈훈해요0슬퍼요0화나요0후속기사 원해요0기사제공 :']"
4,삼성전자, 2018-05-1811:46,뉴스1 ,"박종석 LG이노텍 사장, 자사주 1000주 장내매수",https://finance.naver.com/news/news_read.nhn?article_id=0003379046&office_id=421&mode=search&query=LG이노텍&page=1,"['       박종석 LG이노텍 사장, 자사주 1000주 장내매수      기사입력2018-05-18 11:46기사원문좋아요훈훈해요좋아요 평가하기공감좋아요0훈훈해요0슬퍼요0화나요0후속기사 원해요0댓글 (서울=뉴스1) 주성호 기자 = LG이노텍은 박종석 대표이사 사장이 자사주 1000주를 장내매수했다고 18일 공시했다. 그간 자사주를 갖고 있지 않았던 박 사장은 지난 17일 1주당 13만원에 1000주를 사들였다.sho218@news1.kr▶ [뉴스1] 채널설정하기 ▶ 제보하기▶ ‘6·13지방선거’ 뉴스보기[© 뉴스1코리아(news1.kr), 무단 전재 및 재배포 금지]뉴스1 관련뉴스해당 언론사에서 선정하며 언론사 페이지(아웃링크)로 이동해 볼 수 있습니다.김경수 ""조선일보는 드루킹과 한팀인가 묻고 싶다""""김정은 방중후 돌변, 시진핑이 시킨 듯""-트럼프지적장애 여성 6년간 일 시키고 임금 떼먹어출소 일주일만에…ATM기 부수다 잡힌 50대장례식장서 노잣돈 \'슬쩍\' 한 장례지도사좋아요0훈훈해요0슬퍼요0화나요0후속기사 원해요0기사제공 :']"
