,회사명,날짜,언론사,기사제목,링크,본문
0,삼성전자, 2018-08-1017:04,한국경제 ,"[지분 UP] 美 피델리티, LG이노텍 신규 매수... 왜?",https://finance.naver.com/news/news_read.nhn?article_id=0003993913&office_id=015&mode=search&query=LG이노텍&page=1,"['       [지분 UP] 美 피델리티, LG이노텍 신규 매수... 왜?      기사입력2018-08-10 17:04기사원문좋아요훈훈해요좋아요 평가하기공감좋아요0훈훈해요0슬퍼요0화나요0후속기사 원해요0댓글 [한경탐사봇] 세계적 명성의 글로벌 자산운용사인 피델리티 매니지먼트 앤 리서치 컴퍼니가 LG이노텍(011070) 지분을 신규 매수해 3대 주주로 등극한 것이 한경탐사봇에 포착됐다.\xa09일\xa0금융감독원 전자공시시스템에 따르면\xa0피델리티 매니지먼트 앤 리서치 컴퍼니는 LG이노텍의 주식 124만2168주를 신규 매수했다고 공시했다. 이번 지분 인수로 피델리티는 LG(003550)(40.79%)와 국민연금(12.89%)에 이어 3대주주로 올라섰다. 피델리티는 경영참가목적은 없다고 밝혔으며, 지난달 30일 이후로 장내매수를 통해 지분을 꾸준히 늘리고 있다.LG이노텍 지분◆\xa02Q18 실적 양호...광학솔루션 선전LG이노텍은 지난달 25일 2분기 연결기준 영업이익이 전년 동기 대비 58.8% 감소한 134억원을 기록했다고 공시했다. 같은 기간 매출액은 13.3% 증가한 1조5179억원을 기록했으며, 당기순이익은 6.8% 줄어든 159억원으로 잠정 집계됐다.지난해 같은 기간보다 매출액은 증가했으나, 수익성은 악화됐다. 그럼에도 불구하고 시장 전망치(매출액 1조5264억원, 영업손실 36억원)를 상회했다.\xa0원/달러 환율 흐름이 당초 기대보다 우호적으로 전환됐다. LG이노텍은 원/달러 환율이 10원 변동될 때마다 영업이익 40~50억원의 변동이 발생한다. 또 비수기인 2분기에 북미 고객사향 부품 출하가 예년보다 앞당겨지면서 양호한 실적을 낸 것으로 풀이된다.\xa0특히 LG이노텍의 광학솔루션 사업부문이 예상보다 선전한 실적을 기록했다. 당초 아이폰X 판매 부진으로 실적 악화 우려감으로 300억원대의 영업손실을 기록할 것으로 예상됐다. 그러나 광학솔루션 사업부문이 시장점유율 확대 등으로 적자폭을 축소된 것으로 추정된다.LG이노텍의 광학솔루션 사업은\xa0LG 계열사뿐 아니라 글로벌 전략고객과의 파트너십도 지속 강화하고 있으며, 급성장하고 있는 중국 시장에서도 신규 고객을 확보하여 매출 증대를 추진하고 있다.\xa0핵심역량을 기반으로\xa0드론용, 스마트TV용, 보안용과 같은 타 Application 분야로도 사업영역을 확대해 가고 있다.LG이노텍 모듈◆ 하반기 실적 기대감↑, 애플향 모듈 공급 본격화LG이노텍의 하반기 실적에 대한 기대감이 점점 커지고 있다. 애플이 올해 하반기 출시하는 신제품 3개 가운데 2개 모델에 듀얼 카메라 모듈을 채택할 것으로 예상된다. 3D 센싱 모듈은 기존 1개 모델에서 3개 모델로 확대될 전망이다. 경쟁사의 수율 이슈로 LG이노텍의 3D 센싱 모듈 관련 점유율은 점차 확대될 것으로 보인다.또 베트남 공장 가동 확대로 인건비 등 비용 절감 효과가 3분기부터 본격화될 것으로 예상되며, 우호적인 환율 흐름이 하반기에도 이어질 전망이다. LG이노텍의 3분기 영업이익이 1067억원으로 전년 동기 대비 90.88% 증가할 것으로 전망된다.내년 이후로 스마트폰 업체들이 트리플카메라를 도입할 것으로 보여, 글로벌 카메라 모듈 시장 1위인 LG이노텍의 수혜가 가능하다. 특히 애플이 트리플 카메라 채용이 이뤄질 경우 애플향 모듈 매출액이 약 23% 성장할 것으로 기대된다.\xa0발광다이오드(LED)부문의 실적 개선도 예상된다. LG전자가 오스트리아 차량용 조명업체인 ZKW를 인수했는데 수익성이 좋은 자동차 LED 판매가 늘어 제품과 고객사 편중을 줄일 수 있게 됐다.한경탐사봇이 기사는 한경닷컴과 버핏연구소가 공동 개발한 탐사봇 알고리즘에 기반해 작성된 것입니다.  - 기사오류문의 02-6071-1112▶ 네이버에서 한국경제 뉴스를 받아보세요▶ 한경닷컴 바로가기  ▶ 모바일한경 구독신청 ⓒ 한국경제 & hankyung.com, 무단전재 및 재배포 금지한국경제 관련뉴스해당 언론사에서 선정하며 언론사 페이지(아웃링크)로 이동해 볼 수 있습니다.""좋은 시절 다 갔다""…삼성전자 직원들 \'비상\'""서울대 나오면 뭐하나, 기대에 못 미치는데…"" 저격""정책 실패해놓고 이제 와서 우리 탓""…불만 폭발강남서 경찰관, 조사 대상 女와…""합의 하에 했다""""40년 기업 운영했지만 지금이 최악이다"" 분통좋아요0훈훈해요0슬퍼요0화나요0후속기사 원해요0기사제공 :']"
1,삼성전자, 2018-08-1016:20,머니투데이 ,또 고개든 슈퍼사이클 논쟁…'동네북' IT株 운명은,https://finance.naver.com/news/news_read.nhn?article_id=0004090282&office_id=008&mode=search&query=LG이노텍&page=1,"['       또 고개든 슈퍼사이클 논쟁…\'동네북\' IT株 운명은      기사입력2018-08-10 16:20기사원문좋아요훈훈해요좋아요 평가하기공감좋아요0훈훈해요0슬퍼요0화나요0후속기사 원해요0댓글 [머니투데이 오정은 기자] [[내일의전략]모간스탠리·골드만삭스 반도체 투자의견 하향..삼성電·SK하이닉스 급락 ]잠잠했던 반도체 슈퍼사이클 고점 논쟁이 다시 고개를 들고 있다. 삼성전자와 SK하이닉스의 실적과 주가가 정점에 다다른 것인지에 시장이 주목하고 있다.모간스탠리와 골드만삭스의 글로벌 반도체 업종에 대한 투자의견 하향으로 한국 증시의 대장주인 삼성전자와 SK하이닉스가 동반 급락했다. 반도체 슈퍼사이클 논쟁이 또 다시 본격 점화된 것이다. 10일 코스피 시장에서 삼성전자는 전일대비 1500원(3.20%) 하락한 4만5400원에 거래를 마감했다. SK하이닉스도 3.72% 하락했고 삼성SDI가 6.56%, 삼성전기 5.74%, LG이노텍 4.18% 내리는 등 코스피 주요 IT주가 줄줄이 급락했다. 4차산업혁명으로 인한 메모리 반도체의 구조적 수요 증가와 공급 부족이 반도체 업체의 이익 급증으로 나타난 이번 \'반도체 슈퍼사이클\'은 2014년 시작됐다. 올해가 2018년이므로 5년째 반도체 호황이 계속됐다. 반도체 슈퍼사이클 고점 논쟁은 2016년 말부터 발화되기 시작했으며 2017년 초 투자은행 UBS의 ""올해 1분기가 고점""이라는 주장으로 한국 시장에서 화제가 됐다. 2017년 2월 UBS는 D램 고점이 도래했다는 내용의 보고서로 SK하이닉스 투자의견을 하향했고 그 충격에 SK하이닉스는 급락했다. 2017년 당시를 회고하면 UBS는 D램 고점이 1분기라고 주장했고 JP모간도 1분기에 고점을 찍은 뒤 1분기 말부터 가격하락이 시작될 거라고 전망했다. 당시 반도체 업종에 대한 긍정적 입장을 가졌던 노무라조차 3분기에 업황이 고점에 달할 것으로 전망했다. 하지만 그 해 9월 니콜라 고도와 UBS 연구원은 ""메모리 반도체의 초신성은 당분간 밝게 빛날 것""이라며 D램 슈퍼사이클 고점을 잘못 계산한 점을 인정했다. 그 해 하반기에도 역대 최장 메모리 호황은 계속됐으며 D램 가격은 결국 2018년 상반기까지도 전혀 흔들리지 않았다. 2017년 하반기 모간스탠리는 2018년 공급 과잉에 의한 낸드 가격 하락을 전망했는데 올 들어 낸드 가격은 실제로 하락했다. 하지만 D램은 견조했으며 삼성전자 메모리 사업부와 SK하이닉스의 실적은 2분기까지도 탄탄했다. 이런 상황에서 또 다시 ""하반기에는 슬슬 꺾일 것""이라는 모간스탠리의 업황 전망이 시장과 주가를 강타한 것이다. 반도체 슈퍼사이클 논쟁의 핵심은 ""언젠가 고점이 올 것""이라는 점이다. 언젠가 고점이 올 것이기 때문에 ""고점이 오고 주가가 내린다""는 전망도 언젠가는 맞게 된다. 이런 상황에서는 결국 누가 \'적기에\' 비관론을 내놓느냐가 관건이 된다. JP모간의 경우 2017년 초부터 이미 SK하이닉스에 대한 투자의견이 중립이었다. 그만큼 SK하이닉스같은 주식의 경기민감적 성격(업황과 가격에 따라 실적이 좌우되는 성격)을 평가절하한 것이다. 물론 작년 초 5만원대였던 SK하이닉스는 극심한 비관론에도 불구, 결국 9만원대까지 오르기도 했다. 하지만 4차산업혁명과 메모리 반도체 업계의 변화를 믿는 애널리스트들은 ""반도체가 경기민감 업종이라는 과거의 시각은 이제 틀렸다""고 말한다. 4차산업혁명의 \'쌀\'인 메모리 반도체 수요는 급격하게 증가하지는 않아도 줄지도 않을 거란 분석이다. 실적이 급감하는 것이 아니라 유지되는 새로운 국면이 열린다는 전망이다. 지난해 반도체 슈퍼사이클 고점을 주장한 애널리스트들은 모두 틀렸다. 이번엔 어떤 결과가 나올까.▶더 많은 머니투데이 기사보기▶실시간 급상승 기사 ▶\'MT리포트\'가 새로 발행되었습니다 오정은 기자 agentlittle@mt.co.kr<저작권자 ⓒ \'돈이 보이는 리얼타임 뉴스\' 머니투데이, 무단전재 및 재배포 금지> 머니투데이 관련뉴스해당 언론사에서 선정하며 언론사 페이지(아웃링크)로 이동해 볼 수 있습니다.""김지은, \'안희정 수행비서 계속 하고 싶다\' 요청""모간스탠리 쇼크에 IT株 급락…신흥국 불안에 환율도 \'껑충\'역대 최고 스펙 \'갤노트9\'…어떤 부품 들어갔나 보니폭염보다 무서운 전기요금…에어컨 현명하게 쓰려면덕신하우징의 통큰 출산장려금…셋째 2000만원좋아요0훈훈해요0슬퍼요0화나요0후속기사 원해요0기사제공 :']"
2,삼성전자, 2018-08-1014:03,한국경제TV ,"LG이노텍, 전일 대비 약 -4% 하락한 149,000원",https://finance.naver.com/news/news_read.nhn?article_id=0000670625&office_id=215&mode=search&query=LG이노텍&page=1,"['       LG이노텍, 전일 대비 약 -4% 하락한 149,000원      기사입력2018-08-10 14:03기사원문좋아요훈훈해요좋아요 평가하기공감좋아요0훈훈해요0슬퍼요0화나요0후속기사 원해요0댓글[한국경제TV 라이온봇 기자][그림 1] 최근 3개월 간 주가 추세 및 기간별 수익률LG이노텍은 8월 10일 14시 2분 전일 대비 약 -4% 하락한 149,000원에 거래되고 있다. LG이노텍은 코스피 상장 기업으로 전기,전자 업종에 속해 있다. 시가총액은 3조6,802억원으로 코스피 상장기업 중 67위에 위치 해 있다.[종목 성향 진단][그림 2] 종목 성향 진단LG이노텍의 투자 스타일은 모호한 측면이 있으나 성장주라고 볼 수 있다. 주가 고평가 우려가 공존하지만 높은 성장성이 기대되는 기업이다.주가 모멘텀은 부진한 편이었다. 최근 1개월 수익률은 -3.12%의 하락폭을 기록했다. LG이노텍 종목에 대한 투자자의 관심도는 굉장히 높은 편이다.[투자 점수 진단][그림 3] 투자 점수 진단LG이노텍은 어느 측면에서 투자 매력도가 높은 종목일까?AI 인공지능 종목 분석 시스템을 이용해 성장성, 수익성, 효율성, 안전성, 저평가성, 추세 등 주가 수익률에 영향을 줄 수 있는 6가지 핵심 투자 지표를 점수화하여 종목의 투자 매력도를 계산해보았다.  그 결과 LG이노텍은 상대적으로 추세지표 측면에서 두각을 드러내고 있었다.추세 점수는 주가의 상승 모멘텀이 어느정도 인가를 나타낸다.LG이노텍은 특히 중기추세 측면에서 가장 높은 점수는 기록했는데, 전체 시장 내 109위를 기록하며 상위 5.44%에 위치했다. 업종별로는 51위를 기록하며 상위 8.56%에 위치했다.그러나 재무건전성을 나타내는 재무안정성 측면에서는 아쉬운 점을 나타냈다.(위의 AI인공지능 점수는 재무 데이터를 기반으로 전체 상장 종목과 비교/분석하여 도출한 점수로 높은 점수가 반드시 높은 수익률을 보장하지 않습니다. 위의 자료는 당사의 추천 종목이 아니며, 투자 시 참고용으로 제시해드리는 것입니다. 핵심투자지표를 결합해 종목의 투자매력도를 종합 계산한 ""인공지능 투자점수""는 ""거장들의 투자공식"" 앱에서 확인하실 수 있습니다.)라이온봇 기자 -한국경제TV※ 본 기사는 한국경제TV와 \'거장들의 투자공식이\'자체 개발한 \'라이온봇 기자\'가 실시간으로 작성한 기사입니다.라이온봇기자 ▶ No1. 경제/증권방송 보며 채팅하기 [유튜브][페이스북]▶ 대한민국 재테크 총집결 [한국경제TV 사이트 바로가기]ⓒ 한국경제TV, 무단 전재 및 재배포 금지한국경제TV 관련뉴스해당 언론사에서 선정하며 언론사 페이지(아웃링크)로 이동해 볼 수 있습니다.태풍 \'야기\'오면 ""폭염 몰아낼 수 있다""\'판도라의 상자 열었다\'...국민연금 더 낸다\'아파트 뒤덮은 거미떼\'...도대체 어디서 왔나""반도체 주식 투자 신중하라""...모건스탠리 또 경고이영자X최화정 의외의 수영복 자태 ""당당하다""좋아요0훈훈해요0슬퍼요0화나요0후속기사 원해요0기사제공 :']"
3,삼성전자, 2018-08-1011:33,아시아경제 ,"정규직 늘리라지만...'고용 모범 기업' LG 부품사, 계약직 매년 2배 증가",https://finance.naver.com/news/news_read.nhn?article_id=0004293368&office_id=277&mode=search&query=LG이노텍&page=1,"['       정규직 늘리라지만...\'고용 모범 기업\' LG 부품사, 계약직 매년 2배 증가      기사입력2018-08-10 11:33기사원문좋아요훈훈해요좋아요 평가하기공감좋아요0훈훈해요0슬퍼요0화나요0후속기사 원해요0댓글1년단위 쪼개기 계약으로 최대 3~6개월 단위 계약...물량 변동 고려하면 불가피한 선택[아시아경제 원다라 기자] LG그룹 계열사로 카메라모듈 등 전자부품을 생산하는 LG이노텍은 최근 수년간 계약직 직원을 크게 늘렸다. 최대 고객사인 애플의 발주물량이 들쭉날쭉하다보니 정규직 직원을 채용하는 데 따른 부담이 커 단기 계약직 위주로 채용할 수 밖에 없다는 게 회사측 설명이다.LG이노텍의 분기보고서에 따르면 이 회사의 계약직 직원은 2016년 120명(전체직원 대비 비중 1.43%)에서 2017년 330명(4.15%), 올 1분 856명(10.63%)으로 매년 두배 이상 증가했다. 이젠 직원 10명중 1명은 계약직이다.특히 계약직이 크게 늘어난 사업부는 카메라 모듈 사업을 담당하는 광학솔루션 사업부다. 이 사업부의 계약직 직원은 2016년 22명에서 올해 612명으로 30배 가까이 늘어났다. LG이노텍은 단순 계약직 뿐 아니라 1개월 단위로 계약을 갱신하고 최대 6개월까지 일하도록 하는 단기 계약직 채용도 지속하고 있다.이 회사가 계약직 비중을 늘릴 수 밖에 없는 가장 큰 이유는 애플 때문이다. 광학솔루션사업부는 LG이노텍 전체 매출로의 60%를 담당하고 있다. 광학솔루션 사업부의 전체 매출의 80% 가량은 애플과의 거래에서 나온다. 그렇다보니 LG이노텍의 실적은 애플의 실적, 납품 물량에 따라 실적이 크게 좌우된다. 2분기 LG이노텍의 영업이익은 광학솔루션사업부의 적자전환으로 전년 동기 대비 58.8% 감소한 133억9600만원을 기록했다. LG이노텍 관계자는 계약직 직원 비중이 늘어난데 대해 ""급격한 물동 변화에 대비해 계약직 직원들을 채용한 것""이라며 ""1개월 단위 단기 계약직 직원들의 경우 형식상 계약기간을 1개월 단위로 해놓은 것이고 지난해 기준 대부분의 인원이 3개월 이상 근무한다""고 설명했다.카메라모듈 제품 특성상 후공정 검사 과정 특성상 자동화에 한계가 있기 때문이기도 하다. 업계 관계자는 ""카메라모듈이 제조공정은 자동화 공정이지만 타사업에 비해 완성후 검사 공정이 많은 제품""이라며 ""검사 공정은 단순 작업이기 때문에 물량이 크게 줄었을 경우에도 검사 공정을 담당하는 직원들의 고용을 지속하기에는 부담이 큰 것이 사실""이라고 말했다.정부는 대기업들이 양질의 정규직 일자리를 창출해줄 것을 요청하고 있다. 하지만 치열한 원가경쟁을 펼쳐야 하는 부품사 등은 이러한 요구를 무작정 수용할 수 없는 게 현실이라는 것을 LG이노텍이 보여주고 있는 셈이다.원다라 기자 supermoon@asiae.co.kr▶ 네이버 홈에서 \'아시아경제\' 뉴스 확인하기▶ 재미와 신기 \'과학을읽다\' ▶ 놀라운 \'군사이야기\'<ⓒ세계를 보는 창 경제를 보는 눈, 아시아경제 무단전재 배포금지>아시아경제 관련뉴스해당 언론사에서 선정하며 언론사 페이지(아웃링크)로 이동해 볼 수 있습니다.""그 놈이 그 놈"" 北주민들, 험악해지는 분위기北 병력 심상찮은 대이동…도발 가능성도\'김경수 폭행\' 50대, 경찰에 검거되자 돌연…이방카 잤던 호텔, 객실 1000개 넘는데…\'어이없어\'낯뜨거운 섹스돌 열풍에…""일본인 멸종 위기"" 경고좋아요0훈훈해요0슬퍼요0화나요0후속기사 원해요0기사제공 :']"
4,삼성전자, 2018-08-1011:27,아시아경제 ,"대기업 계약직 증가·중소기업 공장 내놓고 해외로...""고통이 된 고용정책""",https://finance.naver.com/news/news_read.nhn?article_id=0004293361&office_id=277&mode=search&query=LG이노텍&page=1,"['       대기업 계약직 증가·중소기업 공장 내놓고 해외로...""고통이 된 고용정책""      기사입력2018-08-10 11:27기사원문좋아요훈훈해요좋아요 평가하기공감좋아요0훈훈해요0슬퍼요0화나요0후속기사 원해요0댓글정규직화·최저임금·주52시간 삼면초가 정책, 기업들 ""해외 나가야 산다""취업자 수 증가폭이 글로벌 금융위기 이후 처음으로 5개월 연속 10만명대 이하에 머물렀다. 실업자는 6개월 연속 100만명을 웃돌았다. 11일 통계청이 발표한 \'6월 고용동향\'에 따르면 지난달 취업자 수는 2712만6000명으로 1년 전보다 10만6000명 증가하는데 그쳤다. 이날 서울 시내 한 대학교 도서관에서 학생들이 방학을 반납하고 취업 준비에 구슬땀을 흘리고 있다. /문호남 기자 munonam@[아시아경제 원다라 기자] 문재인 정부의 고용정책이 산업현장에서 겉돌고 있다. 지난 1년여동안 정부는 비정규직의 정규직화, 근로시간 단축, 최저임금 인상 등 친노동 성향의 고용정책을 펼쳐왔지만, 중소기업은 물론 대기업에서도 부작용을 호소하는 목소리가 갈수록 커지고 있다.  ▶관련기사 3면LG그룹 주력 부품회사인 LG이노텍의 경우, 지난 2016년 1.43%였던 계약직 직원의 비중이 올 1분기에는 10.63%로 높아졌다. 이 회사는 고도의 숙련이 요구되지 않는 생산직 직원들의 상당수를 1~3개월 단위의 계약직으로 채용 하고있다. 주문 물량의 변동 폭이 워낙 큰 탓에 정규직 채용을 늘릴 수 없다는 게 이 업체의 설명이다. 정부는 근로시간 단축 등을 통해 대기업들에서 양질의 정규직 일자리가 창출 될 것으로 기대하고 있지만, 기업들은 현실적인 어려움을 토로하고 있다.하반기 정기 보수를 해야하는 정유ㆍ석유화학 업계도 걱정이 태산이다. 하루라도 보수기간을 줄여 재가동을 해야 하는데, 주 52시간 근무제 시행으로 지난해보다 보수시간이 30% 이상 늘어날 것으로 분석된 다는 게 업계 관계자의 설명이다.경기도 화성시 마도 공단, 인천시 남동공단 등 국내 주요 공단 지역 공장 매매 전문 부동산에는 공장 매도 문의가 크게 늘어나고 있다. 최저임금 인상, 주 52시간 등으로 국내기업환경이 악화되자 아예 한국을 떠나 베트남 등으로 이전하려는 기업들이 매물을 내놓고 있는 것이다.시행된지 한달을 넘은 주 52시간 근무제를 둘러싼 현장의 혼선도 여전하다. 국회 예산정책처의 \'연장근로 시간제한의 임금 및 고용에 대한 효과 분석\' 보고서에 따르면 초과 근로시간 감소에 따라 근로자의 월 임금은 평균 37만7000원(-11.5%) 감소하는 것으로 나타났다. 52시간 대응 일환으로 오후 7시에 \'PC 셧다운제\'를 실시하는 기업들 사이에선 PC를 켤 수 있는 새벽에 출근해 업무를 한다는 웃지 못할 일도 벌어지고 있다.통계청이 발표한 6월 \'경제활동인구조사 고용동향\'에 따르면 올해 6월 취업자수는 2712만6000명으로 지난해 같은달 보다 10만6000명(0.4%) 늘어나는 데 그쳤다. 월별로는 올해 2월 10만4000명을 기록한 뒤 3개월 연속 10만 명대를 기록하다 5월에는 7만2000명까지 추락했다.정조원 한경연 고용복지팀장은 ""문 정부의 고용정책은 친노동쪽에 치우친 탓에 기업현장에서 제대로 작동을 하지 않고 있다""며 ""정규직, 비정규직 문제만 하더라도 이분법으로 볼 게 아니라 업무 특성, 기업 환경 등을 고려해 탄력성을 보장해줘야 할 것""이라고 말했다.원다라 기자 supermoon@asiae.co.kr▶ 네이버 홈에서 \'아시아경제\' 뉴스 확인하기▶ 재미와 신기 \'과학을읽다\' ▶ 놀라운 \'군사이야기\'<ⓒ세계를 보는 창 경제를 보는 눈, 아시아경제 무단전재 배포금지>아시아경제 관련뉴스해당 언론사에서 선정하며 언론사 페이지(아웃링크)로 이동해 볼 수 있습니다.""그 놈이 그 놈"" 北주민들, 험악해지는 분위기北 병력 심상찮은 대이동…도발 가능성도\'김경수 폭행\' 50대, 경찰에 검거되자 돌연…이방카 잤던 호텔, 객실 1000개 넘는데…\'어이없어\'낯뜨거운 섹스돌 열풍에…""일본인 멸종 위기"" 경고좋아요0훈훈해요0슬퍼요0화나요0후속기사 원해요0기사제공 :']"
