,회사명,날짜,언론사,기사제목,링크,본문
4,삼성전자, 2018-09-1110:39,경향신문 ,"“아이폰 미국서 만들면 220만원”···트럼프, 애플 국내생산 압박하지만 ‘가격’...",https://finance.naver.com/news/news_read.nhn?article_id=0002892986&office_id=032&mode=search&query=LG이노텍&page=1,"[""       “아이폰 미국서 만들면 220만원”···트럼프, 애플 국내생산 압박하지만 ‘가격’ 논란      기사입력2018-09-11 10:39기사원문좋아요훈훈해요좋아요 평가하기공감좋아요0훈훈해요0슬퍼요0화나요0후속기사 원해요0댓글 “간단하다. 아이폰을 미국서 만들면 돼!”“아이폰을 지금보다 2배에 살 의향이 있나”도널드 트럼프 미국 대통령이 애플 아이폰을 국내에서 생산하라고 압박하자, 국산화 가능한지 논란이 일고 있다고 외신들이 전했다.미중 무역분쟁으로 중국산 부품 수입가격 상승을 걱정하는 애플에게 트럼프는 “쉬운 해결책이 있다. 제품을 중국이 아닌 미국에서 만들면 된다”고 말했다. 반면 정보기술(IT) 분야 유력 애널리스트인 팀 바자린이 USA 투데이와 인터뷰에서 “당신은 아이폰을 지금 가격의 2배인 2000달러(약 220만원)에 살 의향이 있느냐”고 말했다.애플 아이폰을 위탁생산하는 세계 최대 전자제조업체 폭스콘(대만 훙하이 정밀)의 궈타이밍 회장(오른쪽 두번째)이 지난해 7월26일(현지시간) 미국 백악관에서 도널드 트럼프 대통령과 악수하고 있다. 폭스콘은 이날 위스콘신주 남동부에 액정표시장치(LCD) 패널 제조 공장 단지를 조성한다고 밝혔다. 폭스콘의 첫 미국 내 공장으로 100억달러(11조원)가 투자된다.  로이터연합아이폰에 탑재되는 메모리 반도체, 올레드(OLED·유기발광다이오드) 디스플레이 패널, 인쇄회로기판(PCB), 듀얼카메라 모듈 등은 모두 한국을 비롯한 아시아 국가에서 생산된다.아이폰에 들어간 부품별로 보면, 낸드플래시는 세계 시장점유율이 올 1분기 기준으로 37.0%인 삼성전자와 4위 점유율(9.8%) SK하이닉스에서 상당 부분 조달하는 것으로 알려졌다. 스마트폰용 올레드 패널의 경우 삼성디스플레이가 사실상 시장을 독점하고 있다.듀얼카메라 모듈은 LG이노텍에서 상당 부분 생산하는 것으로 전해졌고, 삼성전기와 국내 중소업체들이 만드는 스마트폰용 PCB 등도 쓰인다.특히 중요한 건 생산단가다. 노동자의 주당 급여가 100달러인 중국에서 생산되고 있는데, 모두 미국산으로 바꿀 경우 아이폰은 대당 최소 2000달러에 달할 것이란 추산이 제기됐다. 세금 혜택을 주더라도 인건비 등을 감안하면 아이폰의 미국내 생산은 어렵다는 주요 근거다.다만 일각에서는 애플이 막대한 자금력을 바탕으로 고사양 제품을 앞세워 장처 해외 의존도를 낮출 수 있다는 견해도 나오고 있다.전병역 기자 junby@kyunghyang.com▶ [경향비즈 바로가기], 경향비즈 SNS [페이스북]  ▶ [인기 무료만화 보기][©경향신문(www.khan.co.kr), 무단전재 및 재배포 금지]경향신문 관련뉴스해당 언론사에서 선정하며 언론사 페이지(아웃링크)로 이동해 볼 수 있습니다.2006년, 그때도 그랬다···미친 집값 만든 '부동산 투기와의 전쟁'[김민아 칼럼]'들어라, 문재인 정부여'[단독] 원더걸스 출신 예은, 목사 아버지와 함께 사기 혐의 피소삼겹살 기름으로 '깨끗한 전기' 만든다[단독]아파트 따라 가격 뛰는 다가구주택 '세금 사각'좋아요0훈훈해요0슬퍼요0화나요0후속기사 원해요0기사제공 :""]"
5,삼성전자, 2018-09-1110:14,이데일리 ,"아이폰 신작 공개하는데..LG이노텍, 닷새째 하락",https://finance.naver.com/news/news_read.nhn?article_id=0004196657&office_id=018&mode=search&query=LG이노텍&page=1,"['       아이폰 신작 공개하는데..LG이노텍, 닷새째 하락      기사입력2018-09-11 10:14기사원문좋아요훈훈해요좋아요 평가하기공감좋아요0훈훈해요0슬퍼요0화나요0후속기사 원해요0댓글 [이데일리 윤종성 기자] 애플에 카메라 모듈 등을 공급해 대표적인 아이폰 수혜주(株)로 분류되는 LG이노텍(011070) 주가가 신작 공개를 코앞에 두고도 힘을 내지 못하고 있다. 11일 오전 10시 현재 LG이노텍은 전거래일대비 1500원(1.06%) 하락한 13만9500원에 거래되고 있다. 지난 5일부터 5거래일 연속 하락세다. 이 같은 LG이노텍의 주가 흐름은 과거와는 다른 양상을 띠고 있다는 것이 증권가 분석이다. 주민우 메리츠종금증권 연구원은 “지난해까지만 해도 스마트폰 부품주들은 신작 출시 전날까지 지속적으로 오르다 출시후 차익실현 매물이 나오는 패턴을 보였지만, 올해는 벌써 투자자들이 차익 실현에 들어간 것으로 파악된다”고 말했다. 아이폰 신제품이 시장 예상을 뛰어넘지 못할 것으로 확신하는 분위기가 팽배해 신작 공개 전에 주식을 털어내고 있다는 분석이다. 주 연구원은 “비단 애플의 아이폰 뿐만 아니라, 삼성전자 갤럭시S, 갤럭시노트 등도 더 이상 시장에 센세이션을 일으키지 못하고 있다”라며 “LG이노텍의 주가 하락은 스마트폰 신제품에 대한 시장의 기대감이 거의 바닥 수준으로 떨어졌다는 걸 보여주는 단적인 사례”라고 부연했다. 한편, 애플은 지난달 30일 언론과 주요 거래선에 신제품 발표회 초청장을 보냈다. 발표회는 오는 12일 오전 10시(한국시각 13일 오전 2시) 미 캘리포니아주 쿠퍼티노에 위치한 스티브 잡스 극장에서 열린다.애플이 배포한 ‘미디어 초청장’윤종성 (jsyoon@edaily.co.kr)네이버에서 ‘이데일리’ 구독하면 \'공기청정기\' 드려요~ [구독하기▶]20~30 세대를 위한 꿀팁! 정보 [스냅타임▶]꿀잼 \'웹툰\'이 매일 매일 공짜...[웹툰보기▶]＜ⓒ종합 경제정보 미디어 이데일리 - 무단전재 & 재배포 금지＞이데일리 관련뉴스해당 언론사에서 선정하며 언론사 페이지(아웃링크)로 이동해 볼 수 있습니다.한달째 납기 못지켜…산단中企, 구인난에 \'허덕\'문희상 의장, 靑 평양行 제안 거절...생소하다vs지당하다그럼에도 편의점?…수익성 논란에도 재계약률 높은 이유강용석 징역 2년 무죄 확신 - 도도맘 징역 1년 집행유예 \'확정\'배현진 ""삼겹살 구워 전기 쓰자는 文정부, 지나가던 돼지도 웃겠다""좋아요0훈훈해요0슬퍼요0화나요0후속기사 원해요0기사제공 :']"
6,삼성전자, 2018-09-1109:48,조선비즈 ,"코스피, 이틀째 상승 출발…메르스 우려감은 하루만에 끝",https://finance.naver.com/news/news_read.nhn?article_id=0000415223&office_id=366&mode=search&query=LG이노텍&page=1,"['       코스피, 이틀째 상승 출발…메르스 우려감은 하루만에 끝      기사입력2018-09-11 09:48기사원문좋아요훈훈해요좋아요 평가하기공감좋아요0훈훈해요0슬퍼요0화나요0후속기사 원해요0댓글 코스피지수가 개인과 기관의 쌍끌이 매수에 힘입어 2거래일 연속 상승세를 보이며 2290선을 터치했다. 코스닥지수 역시 외국인의 ‘사자’로 820선에 올라섰다.11일 오전 9시 10분 현재 코스피지수는 전날보다 5.72포인트(0.24%) 오른 2294.13을 기록하고 있다. 외국인이 239억원 팔아치우고 있으나 개인과 기관이 각각 209억원, 14억원 사들이며 지수 상승을 견인하고 있다.코스피200선물은 개인만 844계약 순매도하고 있다. 외국인과 기관은 각각 207계약, 699계약 순매수하는 중이다. 프로그램 매매는 차익거래와 비차익거래가 각각 27억원, 37억원 매도로 총 64억원의 매도 우위를 나타내고 있다.같은 시각 코스닥지수는 전장보다 4.04포인트(0.50%) 오른 820.20를 나타내고 있다. 외국인이 65억원 사자에 나섰으나 개인과 기관이 각각 43억원, 27억원 순매도하는 중이다.전날 미국 증시는 상승 출발했으나 미국과 중국의 무역분쟁으로 인한 불확실성으로 방향성을 잃었다. 애플(-1.34%)은 도널드 트럼프 미국 대통령이 중국 생산을 중단하고 미국으로 공장을 옮기라고 압박한 이후 하락했다. 미국의 대 중국 관세 부과 시 제품 가격이 상승하며 수요가 감소할 가능성이 있다는 우려가 제기됐기 때문이다. 다만 이탈리아 재정위기 리스크가 완화되고 미셸 바르니에 유럽연합(EU) 협상단 대표가 ""향후 6~8주 내에 브렉시트 협상을 타결지을 수 있을 것""이라고 언급하며 브렉시트 협상 기대감이 높아지는 등 유럽에서 긍정적인 이슈가 나오며 투자심리가 개선됐다. 다우존스산업평균지수(-0.23%)가 하락했고 나스닥지수(0.27%)와 스탠더드앤드푸어스(S&P)지수(0.19%)가 상승하며 혼조세를 보였다. 서상영 키움증권 연구원은 ""유로존 리스크가 완화되며 위험자산 선호심리가 높아진 가운데 개별 종목 이슈에 따라 등락을 보인다""고 했다.유가증권시장에서는 전날 메르스 여파로 떨어졌던 기업들이 오르고 있다. 호텔신라(008770)(1.73%), 아모레퍼시픽(090430)(0.97%), 신세계(004170)(0.81%), LG생활건강(051900)(0.75%)이 상승세다. 서 연구원은 ""메르스 사태가 3년 전과 달리 확산될 가능성이 현재까지 높지 않기 때문에 관련 이슈는 단기적으로 끝날 여지가 높다""고 했다.그 외 시가총액 상위종목 중에서는 삼성SDI(006400)(2.66%),  삼성전자(005930)(0.55%), SK하이닉스(000660)(0.52%), 유한양행(000100)(0.42%), LG이노텍(011070)(0.35%) 등이 오르고 있다. 현대중공업(009540)(-2.00%), 코웨이(021240)(-1.59%), 현대차(005380)(-1.53%), GS리테일(007070)(-1.46%), 만도(204320)(-1.23%)는 하락하는 중이다.업종 중에서는 비금속광물(1.14%)이 오름세를 보이고 있다. 건설(0.72%), 전기전자(0.68%), 종이목재(0.43%), 섬유의복(0.27%), 제조(0.17%) 등도 상승하고 있다. 반면 운송장비(-1.10%), 전기가스(-0.94%), 보험(-0.56%), 의료정밀(-0.28%) 등은 지지부진한 흐름을 이어가고 있다.코스닥시장에서는 나노스(151910)(-7.41%)가 하락하는중이다. 에이치엘비(028300)(-1.70%), 포스코켐텍(003670)(-0.88%), 셀트리온제약(068760)(-0.50%), 메디톡스(086900)(-0.42%) 등도 내림세를 보이고 있다. 스튜디오드래곤(253450)(0.78%), 셀트리온헬스케어(091990)(0.54%), CJ ENM(035760)(0.34%), 펄어비스(0.16%) 등은 오르는 중이다.업종 중에서는 종이목재(1.02%), 오락문화(0.81%), 음식료담배(0.44%), 유통(0.38%) 등이 오름세를 보이고 있다. 다만 IT부품(-1.18%), 섬유의류(-0.85%), 통신서비스(-0.20%), 제약(-0.13%) 등은 지지부진한 흐름을 이어가고 있다.[홍다영 기자 hdy@chosunbiz.com]chosunbiz.com조선비즈 관련뉴스해당 언론사에서 선정하며 언론사 페이지(아웃링크)로 이동해 볼 수 있습니다.수도권 그린벨트 주택공급 후폭풍…""주민 반발에 실효성 논란도""한은, 성장률·물가·고용 전망 또 낮출 듯기업 94% ""한국 경제, 침체국면 들어섰다""서울 \'노·도·강\' 실종되는 4억 이하 소형 아파트지방의 복수… ""서울 매물 나왔어요? 지금 돈 부쳐요""좋아요0훈훈해요0슬퍼요0화나요0후속기사 원해요0기사제공 :']"
7,삼성전자, 2018-09-1108:59,뉴시스 ,"[빅데이터MSI]시장심리 톱5, LG이노텍·LG디스플레이·LS산전·한국토지신탁·S...",https://finance.naver.com/news/news_read.nhn?article_id=0008800918&office_id=003&mode=search&query=LG이노텍&page=1,"['       [빅데이터MSI]시장심리 톱5, LG이노텍·LG디스플레이·LS산전·한국토지신탁·SK이노베이션      기사입력2018-09-11 08:59기사원문좋아요훈훈해요좋아요 평가하기공감좋아요0훈훈해요0슬퍼요0화나요0후속기사 원해요0댓글시장심리 워스트5, 롯데제과·현대차·오리온·한샘·대한항공【서울=뉴시스】 김정호 기자 = 11일 빅데이터 시장심리지수(MSI)가 가장 높은 \'톱5\'에 LG이노텍(011070), LG디스플레이(034220), LS산전(010120), 한국토지신탁(034830), SK이노베이션(096770)이 선정됐다. 반면 시장심리가 저조한 워스트 5로는 롯데제과, 현대차, 오리온, 한샘, 대한항공이 꼽혔다.이는 뉴시스와 코스콤이 주요 상장기업 250곳에 대해 공동 분석해 산출해 낸 빅데이터 MSI(http://m.newsis.com/stock.html, 모바일 전용)로 전 거래일 오후 4시부터 이날 오전 8시까지 데이터를 취합한 결과다.LG이노텍의 MSI 레벨은 전 거래일보다 2단계 높은 \'매우 좋음\'을 기록했다. 관련 키워드로는 품질, 부품, 직류, 전기차, 생산, 차량, 차량부품, 라인업, 전장, 품질우수상, 경쟁력, 전기차용, 차량부품사업, 통신, 컨트롤러, 충전용, 자리, 자동차, 안전, 우수상, 표준, 컨버터, 지속, 전자장치, 수여, 신뢰성, 안전성, 엄격, 완벽, 요금, 자율주행차 등이 뽑혔다.LG디스플레이의 MSI 레벨은 전 거래일보다 3단계 상승한 7단계에 올랐다. 연관 키워드로는 긍정적, 트레이딩매수, 공격적, 요인, 패널가, 직전, 상회, 공급, 비교, 지속적, 완화, 참고, 현주가, 최저점, 최저, 증권정보제공, 추정치, 하락폭, 하이라이트, 한화투자증권, 해석, 현대차증권, 중장기적, 종가, 전환, 목표가격 등이 꼽혔다.LS산전의 MSI 레벨은 전 거래일과 같은 7단계 \'매우 좋음\'을 유지했다. 온라인에서는 전지, 태양광, 우리나라, 이사, 진출, 향후, 중전기, 사업부, 노하우, 부품별, 삼성SDI, 상태, 생산, 수혜, 스마트에너지사업부장, 부문, 발생, 마이크로그리드용, 내년, 기술경쟁력, 긍정적, 국가별, 객관적, 스마트그리드, 시스템, 시장점유율, 역할 등이 주로 검색됐다.한국토지신탁의 MSI 레벨도 전 거래일과 동일한 7단계를 나타냈다. 부동산, 개발, 당기, 신탁, 이익, 신탁사, 공급, 수익, 참여, 추가, 토지, 토지신탁, 한국자산신탁, 해제, 지정, 주택 등이 관련 검색어로 선정됐다.SK이노베이션의 MSI 레벨은 같은 기간 4계단 상승해 7단계 \'매우 좋음\'을 나타냈다. 연관 키워드로는 SK종합화학, 접착제, SK이노베이션, 한국투자증권, 생산, 가치, 라이온켐텍, 원료, 사회적, 협력사, 개발, 창출, 동반성장, 배터리, 중장기, 소재, 핵심, 모멘텀, 건설업종, 기술, 냄새, 비금속광물업종, 설비, 신설, 시행, 최초, 경제적, 가능, 수요 등이 뽑혔다.반면 시장심리 워스트 5에는 롯데제과(004990), 현대차(005380), 오리온(001800), 한샘(009240), 대한항공(003490)등이 선정됐다.롯데제과의 MSI 레벨은 전 거래일과 같은 1단계 \'매우 나쁨\'을 유지했다. 관련 키워드로는 롯데지주, 유상증자, 지분율, 법인, 롯데, 인도, 신주, 베트남, 연결, 방식, 주당, 손익, 비비카, 전략, 이관, 위주, 예견, 스크랩, 수익성, 비용, 부담, 발행, 발생, 내용 등이 뽑혔다.현대차의 MSI 레벨은 전 거래일보다 3계단 하락해 1단계를 기록했다. 연관 키워드로는 페스티벌, 세계적, 가치, 차량, 공작기계, 반도체, 미디어아트, 일렉트로니카, 아르스, 현대자동차, 일렉트릭, 세계, 행사,  기술, 공식, 알리바바, 가공, 개최, 린츠, 오스트리아, 축제, 강세, 관세, 부과, 아이오닉 등이 꼽혔다.오리온의 MSI 레벨도 1단계 \'매우 나쁨\'을 나타냈다. 온라인에서는 법인, 오리온홀딩스, 회복, 아래, 비용, 고전, 경쟁력, 기대, 러시아, 마케팅, 베트남, 혐의, 횡령, 검찰, 조사, 효과, 소환, 출시, 축소, 초기, 오너, 강력, 장기적, 종가 등이 주로 검색됐다.한샘의 MSI 레벨은 1단계로 전 거래일과 같았다. 주요 키워드로는 반도체, 온라인, 거래량, 연관, 수요, 모바일, 현대차그룹, 코스콤, 추석, 주택거래량, 주식시장, 전용, 주당, 업황, 시각, 산출, 본격, 반등 등이 뽑혔다.대한항공의 MSI 레벨은 전 거래일보다 4계단 주저앉은 1단계 \'매우 나쁨\'을 기록했다. 3년 만에 국내에서 중동호흡기증후군(메르스) 환자가 발생하면서 전날 대한항공 등 항공주 주가가 일제히 하락했다. 질병관리본부에 따르면 쿠웨이트에 출장을 다녀온 A(61)씨는 귀국 이튿날인 8일 메르스 확진 판정을 받고 격리 치료를 받고 있다.환자, 확진, 백신, 마스크, 세정제, 여행, 관련주, 노선, 확산, 테마주, 발생, 중동호흡기증후군, 항공사, 수요, 남성, 자연재해, 타격, 하나투어, 질병관리본부, 모두투어, 진원생명과학, 접촉, 국제선, 여객수, 격리, 소식, 대응, 관광객 등이 연관 키워드로 선정됐다.MSI는 총 7단계로 나뉜다. 1단계 \'매우 나쁨\', 2단계 \'나쁨\', 3단계 \'약간 나쁨\', 4단계 \'보통\', 5단계 \'약간 좋음\', 6단계 \'좋음\', 7단계 \'매우 좋음\' 등으로 분류된다.MSI 레벨이 가장 낮은 수준인 1단계에서 가장 높은 수준인 7단계 쪽으로 바뀌면 해당 종목에 대해 온라인상에서의 반응이 부정에서 긍정으로 바뀌고 있다는 뜻으로 풀이할 수 있다.한편 지난해 8월1일부터 선보인 빅데이터 MSI 모바일 전용 버전은 구글플레이 또는 애플 앱스토어에서 \'뉴시스\' 앱을 내려받거나 뉴시스 모바일 홈페이지(m.newsis.com)에 접속한 뒤 메인화면의 \'빅데이터 MSI\'를 클릭해 이용하면 된다.map@newsis.com※ 빅데이터MSI는 투자 참고용이며, 투자 결과에 책임을 지지 않습니다. 주식시장에서는 다양한 국내외 변수가 존재하기 때문에 한 지표로만 판단하면 뜻하지 않은 결과를 초래할 수 있습니다.▶ 뉴시스 빅데이터 MSI 주가시세표 바로가기 ▶ 뉴시스 SNS [페이스북] [트위터]<저작권자ⓒ 공감언론 뉴시스통신사. 무단전재-재배포 금지.>뉴시스 관련뉴스해당 언론사에서 선정하며 언론사 페이지(아웃링크)로 이동해 볼 수 있습니다.[빅데이터MSI]11일 오전 주식시장 심리 1단계 \'매우나쁨\'[증시초점]활력 잃은 증시…코스피 거래대금 석달새 \'반토막\'""메르스 테마주, 단기 상승에 그칠 것…中소비 관련주는 약세""은행권 중소기업 대출 연체율 상승…전월比 0.8%↑국내 주식형펀드, 3거래일 연속 자금 순유출좋아요0훈훈해요0슬퍼요0화나요0후속기사 원해요0기사제공 :']"
8,삼성전자, 2018-09-1108:31,한국경제 ,"[한경로보뉴스] 전일, 거래소 외국인 순매도상위에 화학 업종 5종목",https://finance.naver.com/news/news_read.nhn?article_id=0004009283&office_id=015&mode=search&query=LG이노텍&page=1,"['       [한경로보뉴스] 전일, 거래소 외국인 순매도상위에 화학 업종 5종목      기사입력2018-09-11 08:31기사원문좋아요훈훈해요좋아요 평가하기공감좋아요0훈훈해요0슬퍼요0화나요0후속기사 원해요0댓글 외국인 투자자는 10일 거래소에서 KODEX 200, 셀트리온, POSCO 등을 중점적으로 매도한 것으로 나타났다.외국인 투자자의 순매도 상위 20개 종목은 KODEX 200, 셀트리온, POSCO, 삼성전기, 삼성전자우, LG이노텍, CJ대한통운, 현대모비스, 호텔신라, 롯데케미칼등이다.이중에 화학 업종에 속한 종목이 5개 포함되어 있다.KODEX 200, 삼성전자우, CJ대한통운 등은 전일 대비 주가가 상승했고, 셀트리온, POSCO, 삼성전기 등은 주가가 하락했다.[09월10일]거래소 외국인 순매도 상위 종목  .img_style {    max-width: 100%;    height: auto;    border: 1px solid black;  }한경로보뉴스이 기사는 한국경제신문과 씽크풀이 공동 개발한 기사 자동생성 알고리즘에 의해 실시간으로 작성된 것입니다.  - 기사오류문의 02-3277-9940[한경닷컴 바로가기] [글방] [모바일한경 구독신청] ⓒ 한국경제 & hankyung.com, 무단전재 및 재배포 금지한국경제 관련뉴스해당 언론사에서 선정하며 언론사 페이지(아웃링크)로 이동해 볼 수 있습니다.""햇반, 자주 먹었는데…"" 소비자들 몰랐던 사실김포신도시 주민들 ""말 그대로 지옥, 떠나고 싶다""""남편이 지나가는 女엉덩이를""…아내 \'울컥\'""입소문에 불티나게 팔렸다""…제대로 뜬 가전제품반려견에 미안해서 회사 차렸다가…3년 만에 \'대박\'좋아요0훈훈해요0슬퍼요0화나요0후속기사 원해요0기사제공 :이 기사는 뉴스제휴평가위원회 \'뉴스제휴 및 제재 심사 규정\'에 따라노출 중단된 기사입니다.이전페이지목록보기인쇄하기목록보기증시 주요뉴스[Asia오전]인플레 경계감 속 혼조…닛케이 ..[오전시황]코스피 \'인플레 불안감\' 외인 투매..[원자재시황] 국제유가 송유관 가동중단 사태에..[굿모닝 증시]인플레이션 공포 불안감…경계 심..[외환브리핑]백악관도 \'인플레 가능성\' 예의주..美인플레 우려에 약세…""국내 증시, 대형주 중..인플레 우려에 출렁, 공포지수 급등…다우 1...[일일펀드동향] 韓 주식형펀드 하루새 584억..이전 페이지로 돌아가기|맨위로']"
