,회사명,날짜,언론사,기사제목,링크,본문
6,삼성전자, 2018-11-2615:10,한국경제 ,"[한경로보뉴스] 'LG이노텍' 5% 이상 상승, 2018.3Q, 매출액 2,313...",https://finance.naver.com/news/news_read.nhn?article_id=0004051365&office_id=015&mode=search&query=LG이노텍&page=1,"['       [한경로보뉴스] \'LG이노텍\' 5% 이상 상승, 2018.3Q, 매출액 2,313십억(+29.4%), 영업이익 130십억(+131.9%)      기사입력2018-11-26 15:10기사원문좋아요훈훈해요좋아요 평가하기공감좋아요0훈훈해요0슬퍼요0화나요0후속기사 원해요0댓글26일 오후 15시 07분 현재 LG이노텍은 전 거래일보다 5.0% 오른 98,700원에 거래되고 있다. 주가의 흐름을 살펴보면 94,200원으로 개장해서 장중에 밀리지 않고 계속 상승해서 98,700원(+5.0%)까지 큰 폭으로 상승하고 있다.◆ 최근 분기 실적- 2018.3Q, 매출액 2,313십억(+29.4%), 영업이익 130십억(+131.9%)LG이노텍의 2018년 3사분기 매출액은 2,313십억으로 전년동기 대비 29.43% 상승했고, 영업이익은 130십억으로 전년동기 대비 131.9% 증가했다.이번 분기의 매출액은 지난 3년 평균 분기 매출액을 140% 상회하는 수준이고, 영업이익은 지난 3년 평균 분기 영업이익을 290% 상회하는 수준이다.이 회사의 매출액 증가율과 영업이익 증가율은 각각 코스피 상위 10%, 상위 12%에 랭킹되고 있다.[표]LG이노텍 분기실적◆ 최근 애널리스트 분석의견- 아쉬운 고객  - 이베스트투자증권, Buy (maintain)11월 22일 이베스트투자증권의 어규진 애널리스트는 LG이노텍에 대해 ""LG이노텍의 4분기 실적은 매출액 2.61조원(-8.9%, YoY/ +13.1%, QoQ), 영업이익1,305억원(-7.6%, YoY/ +0.6%, QoQ)으로 시장기대치 1,650억원을 하회할 전망이다. 최근 출시된 북미 주요 거래선의 신규 로우엔드 스마트폰이 다소 어중간한 가격과 스펙으로 판매가 부진하며 해당 제품에 공급되는 싱글카메라 및 3D 센싱 모듈의 출하가 감소하여 동사의 광학솔루션 사업부 실적이 당초 기대에 미치지 못할 것으로 판단되기 때문이다""라고 분석하며, 투자의견 \'Buy (maintain)\', 목표주가 \'130,000원\'을 제시했다.한경로보뉴스이 기사는 한국경제신문과 씽크풀이 공동 개발한 기사 자동생성 알고리즘에 의해 실시간으로 작성된 것입니다.  - 기사오류문의 02-3277-9940[한경닷컴 바로가기] [모바일한경 구독신청] 전문가들의 내년 투자전략이 알고 싶다면? <자세히 보기> ⓒ 한국경제 & hankyung.com, 무단전재 및 재배포 금지한국경제 관련뉴스해당 언론사에서 선정하며 언론사 페이지(아웃링크)로 이동해 볼 수 있습니다.기아차 · 농심 · 남양유업 · 효성도 \'나 떨고 있니?\'8억5000만원이던 옥수동 아파트, 한달새 집값이""1조5000억 수출길 막히자…"" 중국 대신 급부상""단종시킬 이유 없다"" 모하비, \'초긴장\' 시킨 車""북한 욕 80%는 ○○서 배웠다""…北 정세 힌트좋아요0훈훈해요0슬퍼요0화나요0후속기사 원해요0기사제공 :']"
7,삼성전자, 2018-11-2614:04,이데일리 ,"[이데일리N] 삼성·LG전자, ′의료용 영상기기′로 미국 시장 공략 外",https://finance.naver.com/news/news_read.nhn?article_id=0004260306&office_id=018&mode=search&query=LG이노텍&page=1,"['       [이데일리N] 삼성·LG전자, ′의료용 영상기기′로 미국 시장 공략 外      기사입력2018-11-26 14:04기사원문좋아요훈훈해요좋아요 평가하기공감좋아요0훈훈해요0슬퍼요0화나요0후속기사 원해요0댓글 [이데일리N]1. 중소상인 카드수수료율↓…“차상위 年214만원 절감” 2. 한국은행 금통위 D-4…기준금리 1년 만에 인상 ‘유력’3. KT “통신장애 피해 유·무선 고객에 1개월 요금 감면”4. SK 독자개발 뇌전증 신약, 국내 최초 FDA 허가 신청5. 삼성·LG전자, ‘의료용 영상기기’로 미국 시장 공략 6. LG디스플레이, 3D 계기판 세계 첫 양산…현대차 공급7. 코스피 상장사 부채비율 106.6%…올들어 1.85%p 하락 <간추린 소식>- LG이노텍, 車 초슬림 라인조명 ‘넥슬라이드-L’ - 한국특수형강, 390억원 3자배정 유상증자 결정 - 오뚜기 ‘쇠고기미역국 라면’ 1천만개 판매 돌파- 씨젠, 항생제 내성 확인 분자진단 제품 개발강상원 (won3191@edaily.co.kr)선착순 \'5만명\' 한정, KFC 쿠폰이 공짜~ [오만한 이벤트▶]빡침해소! 청춘뉘우스~ [스냅타임▶]총 경품 1억원! 당첨인원 5만명![경품 타가세요▶]＜ⓒ종합 경제정보 미디어 이데일리 - 무단전재 & 재배포 금지＞이데일리 관련뉴스해당 언론사에서 선정하며 언론사 페이지(아웃링크)로 이동해 볼 수 있습니다.\'삼촌패키지\' 350만원…학교폭력 해결사 찾는 부모들하태경 ""이재명, 탈당할 준비 끝났다…반문 야당선언""이정렬, 혜경궁 김씨 소송 계속 맡는다 ""다시 신발끈 동여매고""청와대 국민청원 제도 폐지를 청원합니다MBC 장인수 기자 ""조선일보 손녀 막말 논란, 갑질 넘어선 계급질""좋아요0훈훈해요0슬퍼요0화나요0후속기사 원해요0기사제공 :']"
8,삼성전자, 2018-11-2613:31,연합뉴스 ,"LG이노텍, 車 초슬림 라인조명 '넥슬라이드-L' 개발",https://finance.naver.com/news/news_read.nhn?article_id=0010489676&office_id=001&mode=search&query=LG이노텍&page=1,"[""       LG이노텍, 車 초슬림 라인조명 '넥슬라이드-L' 개발      기사입력2018-11-26 13:31기사원문좋아요훈훈해요좋아요 평가하기공감좋아요0훈훈해요0슬퍼요0화나요0후속기사 원해요0댓글    (서울=연합뉴스) LG이노텍은 광선폭 3mm의 차량용 초슬림 라인조명모듈 '넥슬라이드-L'을 개발했다고 26일 전했다.     이 같은 광선폭은 차량 외장용 발광다이오드(LED) 조명 중 가장 얇다고 회사는 소개했다. 2018.11.26 [LG이노텍 제공]    photo@yna.co.kr▶놓치면 아쉬운 '핫뉴스'  ▶뉴스가 보여요 - 연합뉴스 유튜브 ▶네이버 홈에서 [연합뉴스] 채널 구독하기연합뉴스 관련뉴스해당 언론사에서 선정하며 언론사 페이지(아웃링크)로 이동해 볼 수 있습니다.\xa0아들에게 맞은 아버지 사망했는데 징역 1년6월\xa0명품매장 피팅룸서 도난방지태그 자르고 상습절도\xa0세 살배기 원생 학대 의혹 학원교사…무혐의 이유는\xa0'사귀자' 문자 반복전송…'스팸 차단' 됐어도 처벌\xa0'박항서 매직'…베트남, 조 1위로 스즈키컵 4강 진출좋아요0훈훈해요0슬퍼요0화나요0후속기사 원해요0기사제공 :""]"
9,삼성전자, 2018-11-2612:02,한국경제 ,"10대 그룹 시가총액 832조원대로 '뚝'…""현대차·한화그룹 주가하락""",https://finance.naver.com/news/news_read.nhn?article_id=0004051229&office_id=015&mode=search&query=LG이노텍&page=1,"['       10대 그룹 시가총액 832조원대로 \'뚝\'…""현대차·한화그룹 주가하락""      기사입력2018-11-26 12:02기사원문좋아요훈훈해요좋아요 평가하기공감좋아요0훈훈해요0슬퍼요0화나요0후속기사 원해요0댓글 [ 고은빛 기자  ] 10대 그룹 시가총액 현황. (자료 = 한국거래소)올해 10대 그룹 시가총액이 200조원 가까이 증발하면서 1년새 832조원대로 뚝 떨어졌다.26일 한국거래소에 따르면 지난 23일 기준 10대그룹 전체 시가총액은 832조3150억원으로 작년(17년 11월23일)보다 19.2%나 감소했다. 이는 시장 전체 수익률(-16.7%)을 밑도는 수준이다. 올해 미중 무역분쟁 여파로 주가 조정이 장기화한 데 따른 여파다. 10대 그룹에 속한 기업들의 주가수익률이 시장수익률을 하회하면서 전체 시장에서 차지하는 비중도 지난해보다 1.6%포인트 하락해 51.3%를 기록했다. 특히, 그룹별로는 한화 및 현대차 그룹의 시가총액 감소 폭이 두드러졌다. 국내 주식시장에 11개 기업이 상장된 한화그룹의 시가총액 감소율은 -34.8%에 달했다. 현대차그룹(16개 종목)의시총 감소분도 -29.4%를 기록했다. 삼성그룹(23개)과 LG그룹(17개)의 시가총액도 각각 -29.4%, -20.6% 줄었다. 10대 그룹 내 주가하락률 상위 종목엔 현대차 및 현대중공업 그룹이 대다수를 차지했다. 현대일렉트릭은 -62.6%로 가장 큰 하락 폭을 기록했다. 현대위아와 현대건설기계도 각각 -53.7%, -49.2%였다. 현대차2우B도 -43.7%나 빠졌다.LG그룹에선 LG디스플레이(-46.1%), LG이노텍(-45.7%), LG하우시스우(-42.3%), LG하우시스(-42%)가 주가 하락 폭이 컸다. 한화생명도 -41.4%의 하락률을 기록했다. 반면 주가상승률 상위 10개 종목도 현대차 종목이 가장 많았다. 현대건설우는 주가가 245.2% 급등했다. 주가 상승 폭이 가장 컸던 종목이다. 현대건설과 현대로템도 각각 49.9%, 43.6%의 주가상승률을 기록했다. 신세계 그룹에선 신세계인터내셔날(163.8%), 신세계I&C(54.2%)가 주가상승률이 높았다. 포스코그룹의 포스코엠텍(160.5%), 포스코켐텍(92.3%)도 주가상승률로는 각각 3, 4위를 꿰찼다.고은빛 한경닷컴 기자 silverlight@hankyung.com[한경닷컴 바로가기] [모바일한경 구독신청] 전문가들의 내년 투자전략이 알고 싶다면? <자세히 보기> ⓒ 한국경제 & hankyung.com, 무단전재 및 재배포 금지한국경제 관련뉴스해당 언론사에서 선정하며 언론사 페이지(아웃링크)로 이동해 볼 수 있습니다.8억5000만원이던 옥수동 아파트, 한달새 집값이""집값 위기 온다는데…"" 중산층 돈버는 방법은""카카오T로 택시 불렀더니…"" 택시기사들 \'파격\' 발언""내년부터 어쩌라고…"" 서민들 경악! 이유가""전액 환불해줄것""…이마트24, \'파격 실험\' 뭐길래좋아요0훈훈해요0슬퍼요0화나요0후속기사 원해요0기사제공 :']"
10,삼성전자, 2018-11-2612:01,아시아경제 ,10대 그룹 시총 지난해보다 20% 감소했다,https://finance.naver.com/news/news_read.nhn?article_id=0004363753&office_id=277&mode=search&query=LG이노텍&page=1,"['       10대 그룹 시총 지난해보다 20% 감소했다      기사입력2018-11-26 12:01기사원문좋아요훈훈해요좋아요 평가하기공감좋아요0훈훈해요0슬퍼요0화나요0후속기사 원해요0댓글전체 주식시장서 차지 비율 51%…전년비 1.6%p 감소[아시아경제 유현석 기자] 10대 그룹의 시가총액이 지난해 대비 20% 가까이 감소한 것으로 나타났다.26일 한국거래소에 따르면 지난 23일 기준 삼성, 현대차, SK, LG, 롯데, 포스코, GS 등 10대 그룹의 전체 시가총액은 823조3150억원을 기록했다. 지난해 11월23일 1018조7490억원 대비 19.2% 감소다. 이로인해 10대 그룹이 주식시장 전체 시총에서 차지하는 비중도 52.9%에서 51.3%로 1.6%포인트 감소했다. 거래소는 그룹 대표주인 삼성전자, 현대차, SK하이닉스 등의 주가 하락 등으로 10대 그룹의 시총이 감소한 것으로 분석했다.그룹별로는 현대중공업을 제외한 9대 그룹의 시가총액이 전부 감소했다. 현대중공업은 17조7190억원에서 18조4150억원으로 3.9% 증가했다. 반면 시가총액이 가장 많이 감소한 그룹은 한화다. 18조5540억원에서 12조930억원으로 감소, 전년 동기 대비 34.8% 줄었다. 이어 현대차가 101조7220억원에서 71조7820억원으로 29.4% 감소했다. 이와함께 삼성과 LG도 각각 21.2%와 20.6% 줄어든 435조9920억원과 85조3540억원을 기록했다. 이들은 각각 21.2%, 20.6% 줄었다.10대 그룹에 속한 종목 중 현대중공업에 속한 현대일렉트릭과 현대건설기계의 주가 하락이 가장 두드러졌다. 주가 하락률 1위는 현대일렉트릭으로 지난해 11월23일 5만9198원에서 지난 23일 2만2150원을 기록하며 62.6% 하락했다. 또 현대건설기계는 8만3554원에서 4만2450원으로 49.2% 빠지면서 하락률 3위를 차지했다. 2위는 현대차에 속한 현대위아로 6만4800원에서 3만원으로 주가가 하락, 53.7% 빠졌다. 이 밖에 LG그룹에 속한 LG디스플레이, LG이노텍, LG하우시스우, LG하우스와 SK의 SKC 솔믹스 및 현대차의 현대차2우B도 주가 하락이 두드러졌다.반면 상승률 상위 10개 종목에서는 현대차의 현대건설우가 5만400원에서 17만4000원으로 오르며 245.2%의 주가 상승률을 기록했다. 이어 신세계의 신세계인터내셔날과 포스코의 포스코엠텍도 각각 163.8%, 160.5% 뛰었다. 이 밖에 포스코켐텍, 신세계 I&C, 현대건설, GS건설, 현대로템 등도 지난해 대비 주가가 올랐다.유현석 기자 guspower@asiae.co.kr▶ 아시아경제 친구 맺고 \'휴대폰, LED마스크\' 받자▶ 재미와 신기 \'과학을읽다\' ▶ 놀라운 \'군사이야기\'<ⓒ경제를 보는 눈, 세계를 보는 창 아시아경제 무단전재 배포금지>아시아경제 관련뉴스해당 언론사에서 선정하며 언론사 페이지(아웃링크)로 이동해 볼 수 있습니다.""서열1위가 패딩 입으라고 시켰다""…조폭 저리가라[단독]""한미동맹 균열 알고도…"" 靑 결국 실토""또 나서는 임종석… \'호들갑\'\' 지나치다""마이크로닷 큰아버지 ""형이니 돈 갚아 달라고""文아들 걸고넘어진 이재명…""역린 건드렸다""좋아요0훈훈해요0슬퍼요0화나요0후속기사 원해요0기사제공 :']"
11,삼성전자, 2018-11-2612:01,이데일리 ,10대 그룹 시총 전년比 19.2%↓…그룹 대표주 주가부진 여파,https://finance.naver.com/news/news_read.nhn?article_id=0004260231&office_id=018&mode=search&query=LG이노텍&page=1,"['       10대 그룹 시총 전년比 19.2%↓…그룹 대표주 주가부진 여파      기사입력2018-11-26 12:01기사원문좋아요훈훈해요좋아요 평가하기공감좋아요0훈훈해요0슬퍼요0화나요0후속기사 원해요0댓글자산총액 상위 10개 기업집단 시가총액·주가등락 분석한화 시총 34.8%↓…10사 중 현대중공업만 3.9%↑[이데일리 이슬기 기자] 우리나라 10대 그룹의 시가총액이 지난해 대비 19.2% 감소한 것으로 나타났다. 특히 한화(000880)와 현대차(005380) 그룹의 시가총액 감소폭이 두드러졌다.한국거래소가 상호출자제한 기업집단(자산 10조원 이상) 중 2017~2018년 자산총액 상위 10개 기업집단의 시가총액과 주가등락을 조사한 결과, 10대 그룹의 시가총액이 19.2% 감소한 것으로 집계됐다. 각 그룹 대표주로 꼽힌 삼성전자(005930) 현대차(005380) SK하이닉스(000660) 등의 주가가 하락하면서 시가총액도 줄어들었기 때문이다. 10대 그룹에 속한 기업들의 수익률이 시장 수익률을 하회함에 따라 이들이 시장에서 차지하는 비중 역시 51.3%(23일 기준)로 전년 동기 대비 1.6%p 낮아졌다.그룹별로 살펴보면 현대중공업(009540)을 제외한 9개 그룹의 시가총액이 전년대비 모두 감소했다. 특히 한화(000880)가 전년 동기 대비 34.8% 감소했고, 현대차(005380)가 29.4% 감소해 그 뒤를 이었다. △삼성(-21.2%) △LG(003550)(-20.6%) △POSCO(005490)(-13.4%)등의 시가총액도 큰폭으로 줄었다.10대 그룹 소속 종목 중 주가 하락률이 가장 컸던 종목은 현대일렉트릭(267260)으로 전년 대비 62.6%나 하락했다. 그 뒤를 △현대위아(011210)(-53.7%) △현대건설기계(267270)(-49.2%)가 이었다. △LG디스플레이(034220)(-46.1%) △LG이노텍(011070)(-45.7%) △SKC 솔믹스(057500)(-45.5%) 등의 성적도 좋지 않았다.반대로 현대건설우(000725)는 전년 대비 245.2%나 주가가 상승해 가장 큰 폭의 상승을 보였고, 신세계인터내셔날(031430)과 포스코엠텍(009520)도 각각 전년 대비 163.8%, 160.5% 상승하면서 세자리 수 상승률을 보였다.이슬기 (surugi@edaily.co.kr)선착순 \'5만명\' 한정, KFC 쿠폰이 공짜~ [오만한 이벤트▶]빡침해소! 청춘뉘우스~ [스냅타임▶]총 경품 1억원! 당첨인원 5만명![경품 타가세요▶]＜ⓒ종합 경제정보 미디어 이데일리 - 무단전재 & 재배포 금지＞이데일리 관련뉴스해당 언론사에서 선정하며 언론사 페이지(아웃링크)로 이동해 볼 수 있습니다.\'삼촌패키지\' 350만원…학교폭력 해결사 찾는 부모들하태경 ""이재명, 탈당할 준비 끝났다…반문 야당선언""이정렬, 혜경궁 김씨 소송 계속 맡는다 ""다시 신발끈 동여매고""청와대 국민청원 제도 폐지를 청원합니다MBC 장인수 기자 ""조선일보 손녀 막말 논란, 갑질 넘어선 계급질""좋아요0훈훈해요0슬퍼요0화나요0후속기사 원해요0기사제공 :']"
12,삼성전자, 2018-11-2612:01,노컷뉴스 ,증시 부진에 1년새 10대그룹 시가총액 1/5 날아가,https://finance.naver.com/news/news_read.nhn?article_id=0003169271&office_id=079&mode=search&query=LG이노텍&page=1,"['       증시 부진에 1년새 10대그룹 시가총액 1/5 날아가      기사입력2018-11-26 12:01기사원문좋아요훈훈해요좋아요 평가하기공감좋아요0훈훈해요0슬퍼요0화나요0후속기사 원해요0댓글한화 -34.8%, 현대차 -29.4%, 삼성 -21.2%등 평균 -19.2%[CBS노컷뉴스 임진수 기자]10대 그룹별 시가총액 현황(자료= 한국거래소)국내 증시의 부진으로 삼성과 SK 등 자산총액 상위 10개 기업집단 소속 기업들의 올해 시가총액이 지난해 같은 기간 대비 20% 가까이 줄어든 것으로 나타났다.한국거래소는 26일 상호출자제한 기업집단 가운데 지난해와 올해 기준 자산총액 상위 10개 기업집단 소속 상장법인의 시가총액과 주가등락 현황을 조사해 발표했다. 10개 기업집단은 삼성, 현대차, SK, LG, 롯데, 포스코, GS, 한화, 현대중공업, 신세계 그룹이다.조사결과 삼성전자, 현대차, SK하이닉스 등 그룹 대표주의 주가 하락 등으로 올해 11월 23일 기준 10대 그룹의 시가총액은 전년 동기 대비 19.2% 감소했다.전체 시가총액 대비 비중도 10대 그룹에 속한 기업들의 수익률이 시장수익률을 하회함에 따라 전체 시장에서 차지하는 비중은 51.3%로 전년 동기 대비 1.6%p 낮아졌다.그룹별로는 현대중공업(+3.9%)을 제외한 9개 그룹의 시가총액이 전년동기 대비 감소했고 특히, 한화(-34.8%)와 현대차(-29.4%) 그룹의 감소 폭이 컸다. 종목별로는 현대건설(우)은 무려 +245.2%의 주가상승률을 기록했고 신세계 인터내셔날(+163.8%), 포스코엠텍(+160.5%) 등이 그 뒤를 이었다.반면, 현대일렉트릭은 -62.6%의 주가상승률을 기록해 낙폭이 가장 컸고 현대위아(-53.7%), 현대건설기계(-49.2%), LG디스플레이(-46.1%), LG이노텍(-45.7%) 등도 낙폭이 컸다.▶ 확 달라진 노컷뉴스▶ 정의로운 노컷뉴스 구독하기▶ 화끈한 노컷V 감상하기jslim@cbs.co.kr저작권자 © CBS 노컷뉴스 무단전재 및 재배포 금지노컷뉴스 관련뉴스해당 언론사에서 선정하며 언론사 페이지(아웃링크)로 이동해 볼 수 있습니다.해고·실직자도 노조한다? 해외에선 \'오래된 상식\'장사익 ""다들 장례식 때 노래해달라고...예약 1순위는 손숙""\'KT 통신대란\' 5G 전파 송출 앞두고 재난 무방비 \'들통\'野性은 극언?…""박정희 없었으면 필리핀… 이재명 탈당""카드수수료, 연매출 30억원 이하 모두 우대…0.8조 원 인하좋아요0훈훈해요0슬퍼요0화나요0후속기사 원해요0기사제공 :']"
13,삼성전자, 2018-11-2612:00,머니투데이 ,글로벌 무역분쟁에 10대그룹 시총 '휘청'…전년比 19.2%↓,https://finance.naver.com/news/news_read.nhn?article_id=0004137563&office_id=008&mode=search&query=LG이노텍&page=1,"['       글로벌 무역분쟁에 10대그룹 시총 \'휘청\'…전년比 19.2%↓      기사입력2018-11-26 12:00기사원문좋아요훈훈해요좋아요 평가하기공감좋아요0훈훈해요0슬퍼요0화나요0후속기사 원해요0댓글 [머니투데이 김소연 기자] [23일 기준 10대그룹 시총 195조 증발…한화·현대차·삼성 등 수출기업 감소 폭 커 ]10대 그룹 시가총액이 글로벌 무역분쟁 여파로 크게 줄어든 것으로 나타났다. 특히 수출 비중이 큰 한화, 현대차, 삼성그룹의 타격이 컸다. 26일 한국거래소는 상호출자제한 기업집단 중 자산총액 상위 10개 기업집단(삼성, 현대차, SK, LG, 롯데, 포스코, GS, 한화, 현대중공업, 신세계) 소속 상장사들의 2018년 시가총액을 전년 동기와 비교한 결과, 시총이 19.2% 줄었다고 밝혔다. 구체적으로 10대 그룹 시총은 지난 23일 기준 823조3150억원을 기록해 1년 전 대비 195조4340억원이 증발했다. 그룹 대표주인 삼성전자, 현대차, SK하이닉스 등의 주가가 큰 폭으로 하락한데 따른 것이다. 이에 따라 10대 그룹 소속 기업들이 전체 증시에서 차지하는 비중도 23일 현재 51.3%로 전년 동기 대비 1.6%포인트 줄었다. 그룹별로 살펴보면 현대중공업이 홀로 시총이 3.9% 늘었고, 나머지 9개 그룹 시총은 모두 전년 동기 대비 감소했다. 특히 한화(-34.8%), 현대차(-29.4%), 삼성(-21.2%) 순으로 감소 폭이 컸다. 한화그룹은 주력인 화학사업이 주요 수출처인 중국의 내수 부진으로 큰 타격을 입고, 태양광도 중국 태양광 보조금 축소, 저가경쟁 등으로 어려움을 겪으면서 시총이 줄었다. 한화케미칼 주가가 올 들어 40% 이상 하락했고, 한화도 20% 이상 낙폭을 기록했다. 현대차그룹 역시 현대차가 신흥국 통화 약세, 노조와의 갈등 속 어닝 쇼크를 내면서 주가가 9년 전 수준으로 떨어진 영향을 받았다. 현대위아, 현대모비스, 현대글로비스도 마찬가지다. 삼성그룹은 삼성전자가 반도체 고점 논란 속 부진했다. 10대그룹 시총이 대부분 줄어든 가운데 현대중공업그룹은 홀로 시총이 3.9% 증가했다. 내수 비중이 높은 GS(-0.1%), 롯데(-2.4%), 신세계(-6.3%) 등은 시총이 줄긴 했지만 감소 폭이 상대적으로 적은 편이었다. 종목별 주가 등락을 살펴보면 지난 23일 기준 현대중공업 소속 현대일렉트릭 낙폭이 가장 커 1년 전보다 62.6% 떨어졌다. 이어 현대차그룹의 현대위아가 53.7% 하락했고 현대건설기계(-49.2%), LG디스플레이(-46.1%), LG이노텍(-45.7%) 순이었다. 10대 그룹 상장사 중 해당 기간 주가가 가장 많이 오른 종목은 현대건설우로 245.2% 급등했다. 이어 신세계인터내셔날이 163.8% 뛰었고 포스코엠텍(160.5%), 포스코켐텍(92.3%), 신세계 I&C(54.2%), 현대건설(49.9%) 순이었다. ▶\'이수역 폭행사건\'의 본질은▶\'혜경궁 김씨\'는 누구? ▶바람 피운 남편이... 김소연 기자 nicksy@mt.co.kr<저작권자 ⓒ \'돈이 보이는 리얼타임 뉴스\' 머니투데이, 무단전재 및 재배포 금지> 머니투데이 관련뉴스해당 언론사에서 선정하며 언론사 페이지(아웃링크)로 이동해 볼 수 있습니다.손흥민, \'50m 질주 원더골\' 넣고도 사과한 이유영하 4도, 아기가 \'쓰레기더미\'에 버려졌다\'신과의 약속\' 오윤아, 싸이하이부츠 신고…각선미 \'감탄\'""허위정보로 200억 부당이득"" 반도체 상장사 회장 구속한국산 \'글로벌 블록버스터 신약\' 줄줄이 쏟아진다좋아요0훈훈해요0슬퍼요0화나요0후속기사 원해요0기사제공 :']"
