,회사명,날짜,언론사,기사제목,링크,본문
0,삼성전자, 2018-09-1116:38,머니투데이 ,"테스토닉, 신발 먼지 흡입하는 ‘에어맥스’로 실내 미세먼지 차단",https://finance.naver.com/news/news_read.nhn?article_id=0004103984&office_id=008&mode=search&query=LG이노텍&page=1,"['       테스토닉, 신발 먼지 흡입하는 ‘에어맥스’로 실내 미세먼지 차단       기사입력2018-09-11 16:38기사원문좋아요훈훈해요좋아요 평가하기공감좋아요0훈훈해요0슬퍼요0화나요0후속기사 원해요0댓글 [머니투데이 중기&창업팀 이상연 기자] “출입구 신발 먼지 흡입장치인 ‘에어맥스’는 삼성, LG, 하이닉스 등 국내 굴지의 반도체 회사들을 시작으로 관공서, 학교, 병원, 어린이집 등 다양한 곳에 납품되고 있습니다. 공기오염이나 미세먼지의 위험성에 대한 대중의 인식이 정착돼 가고 있어 앞으로의 시장 전망은 밝습니다.” ㈜테스토닉 강옥남 대표의 말이다.강옥남 대표/사진제공=테스토닉테스토닉(대표 강옥남)은 신발 먼지를 공기 흡입식으로 제거하는 에어매트인 ‘에어맥스 클린매트(Air Max Clean Mat)’를 제조해 판매하고 있다. 테스토닉이 녹색산업의 일환으로 R&D를 거쳐 개발한 에어맥스는 신발의 미세먼지를 청소기처럼 빨아들이는 클리닝 매트로, 반도체 기업 등 산업현장은 물론 사람이 드나드는 곳이라면 어디든 출입구에 설치, 밟고 지나가는 순간 먼지를 빨아들인다.강옥남 대표는 “먼지에 민감한 반도체 분야에서 처음 에어맥스 도입 후 공중의 먼지가 1/3 수준으로 줄어드는 것을 보고 삼성, LG, 기아 등에서 계속해 인정을 받기 시작했으며, 이를 발판 삼아 베트남, 인도, 브라질 등의 법인과 중국 기업들에까지 빠르게 도입되기 시작했다”고 전했다.국내 최초로 개발된 에어맥스 클린매트는 특허 등록이 완료된 상태다. 일반용, 게이트용, 악세스플로어용, 에어샤워 등 다양한 형태로 설치가 가능하며 신발의 미세먼지는 물론 눈이나 빗물도 제거가 가능하고 조작이 간편하다. 집진기에 의해 모여진 흙먼지, 미세먼지는 포집봉투로 처리가 용이하게 만들어져 사용과 관리에도 어려움이 없다.최근 테스토닉은 롯데시네마 건대입구점에 에어맥스를 시범 설치, 2주간 93g의 먼지를 포집하며 사람이 많이 드나드는 영화관과 같은 실내 공간에서의 대기질 관리 중요성을 밝힌 바 있다. 업체 측은 향후 영화관, 지하철 등 유동인구가 많은 공간의 공기질 개선을 위해 에어맥스를 적극 알릴 계획이다.현재 국내에서는 삼성, LG이노텍, CJ 제일제당, 현대 모비스, 혼다, KT, 기아, 할리스커피, 아모레퍼시픽, 오리온 등 기업은 물론 경기지방중소벤처기업청, 국립국악원, 국립고궁박물관 등에도 납품 계약을 체결한 바 있으며, 싱가포르와 태국 등지에서는 에이전트를 통해 사업을 확장하고 있다.▶더 많은 머니투데이 기사보기▶실시간 급상승 ▶\'MT리포트\'가 새로 발행되었습니다 중기&창업팀 이상연 기자 pond2580@<저작권자 ⓒ \'돈이 보이는 리얼타임 뉴스\' 머니투데이, 무단전재 및 재배포 금지> 머니투데이 관련뉴스해당 언론사에서 선정하며 언론사 페이지(아웃링크)로 이동해 볼 수 있습니다.""죽은 남편이 남긴 예금, 왜 못 찾나요?""""결혼 안하니?"" ""아들, 용돈 좀""…추석이 두렵다모델 한혜진, 속옷 화보 공개…""군살 제로""도보치기·부축빼기·흔들이…술 취한 \'홍대의 밤\'청도용암온천 화재…40분만에 진화했지만 59명 병원행좋아요0훈훈해요0슬퍼요0화나요0후속기사 원해요0기사제공 :']"
1,삼성전자, 2018-09-1115:26,한경비즈니스 ,"스마트 공장의 두뇌, ‘플랫폼’을 선점하라",https://finance.naver.com/news/news_read.nhn?article_id=0000048514&office_id=050&mode=search&query=LG이노텍&page=1,"['       스마트 공장의 두뇌, ‘플랫폼’을 선점하라      기사입력2018-09-11 15:26기사원문좋아요훈훈해요좋아요 평가하기공감좋아요0훈훈해요0슬퍼요0화나요0후속기사 원해요0댓글[커버스토리 : 제조업 재도약의 열쇠, 스마트 공장이 답이다]-주요 그룹 IT 계열사 ‘도전장’…제조 공장에서 확보한 데이터가 성장 동력홍원표 삼성SDS 대표./삼성SDS 제공 [한경비즈니스=이명지 기자] 전 세계 스마트 공장 시장은 2015년 1200억 달러에서 2020년 1700억 달러로 연평균 8%씩 성장할 것으로 전망된다. 한국의 스마트 공장 시장은 올해 기준 5조원에서 2020년 6조원 이상으로 성장할 것으로 예측된다. 이 가운데 소프트웨어가 무려 3조원을 차지할 것으로 보인다. 절반에 가까운 수치다. 미국의 제너럴일렉트릭(GE), 독일의 지멘스가 이끌던 이 시장에 삼성SDS와 LG CNS 등 국내 시스템 통합(SI) 기업들이 도전장을 내밀었다. 초고집적 메모리, 플렉서블 디스플레이 등 만들어야 하는 제품이 날이 갈수록 고사양화되고 복합적으로 진화한다. 동시에 공정 설비 또한 미세화되고 고도화된다. 데이터는 폭발적으로 증가하며 사람이 해결할 수 없는 이슈도 늘었다. 이러한 산업 현장의 고민은 스마트 공장의 두뇌 역할을 맡은 ‘플랫폼’이 해결해 줄 수 있다. ◆스마트보다 진화한 ‘인텔리전트 팩토리’ 삼성SDS는 8월 28일 기존 스마트 공장보다 한 단계 더 진화한 ‘인텔리전트 팩토리’ 사업 강화를 선언했다. 인텔리전트 팩토리는 스마트 공장에 비해 한 단계 더 진화한 개념이다. 오류를 발견하는 데 그치는 것이 아니라 오류를 예측하고 예방하는 단계까지 가능한 솔루션을 말한다.삼성SDS는 제조 업종 전문 역량과 정보기술(IT)이 집약된 ‘넥스플랜트(Nexplant)’ 플랫폼으로 설비·공정·검사·자재물류 등 제조 4대 핵심 영역에서 고객사의 인텔리전트 팩토리를 실현하고 있다. 넥스플랜트 플랫폼은 설비에 장착된 사물인터넷(IoT) 센서로 수집된 대용량 빅데이터를 인공지능(AI)으로 분석해 실시간 이상 감지는 물론 장애 시점을 예측해 설비와 가동률을 높였다. 특히 넥스플랜트 플랫폼은 AI 기반의 검사 예측 모델을 적용해 불량 검출률을 극대화했다. 불량 유형을 딥러닝으로 학습해 불량 분류 정확도를 32% 증가시켰다. 삼성SDS의 ‘스마트 공장’ 사업은 클라우드 사업과 함께 2017년 이후 IT 서비스 실적 개선을 주도한 4대 전략 사업이다. 김동양 NH투자증권 애널리스트는 삼성SDS의 스마트 공장 부문 매출액이 전년 대비 53% 성장해 삼성SDS의 사업 중 가장 큰 성장을 기록할 것이라고 전망했다. 특히 삼성SDS는 삼성전자 등 계열사 외에도 현대모비스·아모레퍼시픽·빙그레 등 다양한 산업군에서 고객을 보유해 지속적인 성장과 고객층 확대가 기대된다. 김소혜 한화투자증권 애널리스트는 “삼성전자의 제조 공장으로부터 반도체·디스플레이·2차전지 등 다양한 제품의 공정 데이터를 확보할 수 있어 매우 유리한 위치”라고 말했다. 또 “카테고리별 애플리케이션 프로그래밍 인터페이스(API)가 늘어날수록 고객의 다양한 니즈에 부합할 수 있는 솔루션을 제공하기 용이해 삼성SDS의 고객 수는 기하급수적으로 늘어날 수 있다”고 전망했다. ◆LG 제조사의 20여 년 역량 ‘집대성’ 경쟁사들 또한 플랫폼 구축에 적극적으로 나서고 있다. 특히 LG그룹의 IT 계열사인 LG CNS의 활약이 눈에 띈다. 삼성과 LG가 가전에 이어 스마트 공장 플랫폼에서도 경쟁을 이어 갈지 주목된다.지난 4월 LG CNS는 통합 스마트 공장 플랫폼 ‘팩토바(FACTOVA)’를 출시했다. 팩토바는 AI·빅데이터·IoT 등 최신 IT를 적용해 ‘자동화’에서 ‘지능화’로의 업그레이드를 추구한다. AI와 빅데이터 기술을 적용해 시장조사와 설계, 시제품 제작에 통상 6개월 이상이 걸리던 상품 기획 기간을 2~3개월로 단축한다. 기존에는 수작업으로 하루 이상 걸리던 설비 데이터 수집을 산업 IoT 기술을 적용해 실시간으로 파악한다. LG CNS의 AI 빅데이터 플랫폼 ‘DAP’의 딥러닝을 통해 품질 검사 정확도를 99.7%까지 개선하는 등 생산의 효율성을 극대화했다. 물류도 최상의 상태로 유지한다. 실시간 위치 추적, 무선인식(RFID) 등 IoT 기술로 배송 지연·누락 등 배송 리스크에 대처할 수 있다.LG CNS 팩토바의 가장 큰 특징은 LG 제조 계열사들이 20여 년간 쌓은 제조 역량을 집대성한 ‘제조 정보통신기술(ICT) 플랫폼’이라는 점이다. 소재(LG화학), 부품(LG디스플레이·LG이노텍), 완성품(LG전자) 등 다양한 제품과 사업군에서 검증된 공장 지능화 성공 사례를 적용해 ‘완성도 높은 스마트 공장’을 구현한다. 팩토바의 또 다른 장점은 ‘통신망 인프라’다. 스마트 공장은 제조 ICT 플랫폼뿐만 아니라 데이터 전송을 담당하는 통신망 인프라와 제조 공정까지 연계돼야 구현할 수 있다. ‘팩토바’는 △LG CNS의 소프트웨어 플랫폼 기술 △LG전자 소재·생산 기술원의 공장 구축 경험에 기반한 제조 공정과 장비 설계 역량 △데이터 전송을 담당하는 LG유플러스 통신망 인프라 등 계열사 간 협업 체계를 통해 스마트 공장 환경을 제공한다. SK(주) C&C는 2016년 스마트 공장 종합 솔루션 브랜드 ‘스칼라(Scala)’를 출시했다. 스칼라는 IoT·빅데이터·클라우드·AI 등 ICT를 활용해 모든 생산과 제조 과정을 제어할 수 있는 시스템이다. 제조·생산 현장을 사이버 세계에서 검증하는 ‘시뮬레이션’, 공장 시스템과 장비 간 유기적 연계를 지원하는 ‘스마트 공장 플랫폼’, AI를 통한 ‘빅데이터 분석’, 생산 라인 통제를 맡은 ‘스마트 컨트롤’로 구성된다. 올해 6월에는 아시아나IDT와 스마트 공장 사업 협력을 위한 업무 협약을 체결했다. SK(주) C&C의 스마트 공장 솔루션(스칼라 2.0)과 아시아나IDT의 RFID 솔루션 노하우를 공유한다. 이를 통해 제조 공정에서 LOT ID 관리부터 빅데이터·IoT를 연결하는 통합 시스템을 구축하고 중국 내 스마트 공장 사업을 확대한다는 계획을 세웠다.포스코의 IT 자회사 포스코ICT도 스마트 공장 플랫폼 구축에 한창이다. 포스코그룹 차원의 스마트 인더스트리 플랫폼 ‘포스프레임(PosFrame)’을 기반으로 스마트 공장, 스마트빌딩·시티, 스마트 에너지 등의 사업을 활발하게 추진 중이다. 포스프레임은 다양한 현장의 데이터를 실시간으로 수집해 분석하고 AI를 활용한 최적의 시스템 운영 방안을 적용하는 포스코그룹의 스마트 인더스트리 표준 플랫폼이다. mjlee@hankyung.com[커버스토리 : ‘제조업 재도약의 열쇠, 스마트 공장이 답이다’ 기사 인덱스]-“IoT 센서로 쇳물 상태 실시간 파악”...스마트 공장으로 진화하는 포스코-‘스마트 공장’을 움직이는 9가지 핵심기술-스마트 공장의 두뇌, ‘플랫폼’을 선점하라-‘모노즈쿠리(장인 정신)의 나라’ 일본도 스마트 공장 도입 ‘봇물’-“아디다스, 동남아 하청 접고 독일로 ‘유턴’...스마트 공장이 일자리 늘렸죠”-스마트 공장, 이렇게 시작하라[본 기사는 한경비즈니스 제 1189호(2018.09.10 ~ 2018.09.16) 기사입니다.][정기구독] [한국경제매거진] [한경비즈니스]  당사의 허락 없이 본 글과 사진의 무단 전재 및 재배포를 금합니다.한경비즈니스 관련뉴스해당 언론사에서 선정하며 언론사 페이지(아웃링크)로 이동해 볼 수 있습니다.\'모노즈쿠리의 나라\' 일본도 스마트 공장 도입 \'봇물\'버니 샌더스 미국 연방 상원의원 ""\'베조스 저지 법안\', 미국 기업에 방향 제시할 것""""밀레니얼 세대가 \'임팩트 혁명 시대\' 이끌 것""\'단순해서 강하다\' 비트코인의 마력복잡한 맨해튼 투어,이젠 \'씨티 바이크\'로 여유있게좋아요0훈훈해요0슬퍼요0화나요0후속기사 원해요0기사제공 :']"
2,삼성전자, 2018-09-1114:14,전자신문 ,[ET투자뉴스]철강금속업종의 하락폭 확대,https://finance.naver.com/news/news_read.nhn?article_id=0002740380&office_id=030&mode=search&query=LG이노텍&page=1,"[""       [ET투자뉴스]철강금속업종의  하락폭 확대      기사입력2018-09-11 14:14기사원문좋아요훈훈해요좋아요 평가하기공감좋아요0훈훈해요0슬퍼요0화나요0후속기사 원해요0댓글 \xa0코스피지수가 시가대비 소폭의 하락세가 나타나면서 하락폭이 다소 커지는 가운데(2282.38p/-6.28p) 철강금속업종의  하락폭이 커지는 모습이다. 11일 오후 2시10분 현재 코스피시장에서 업종별 등락현황을 살펴보면, 철강금속업종(-2.75%)과 운수장비업종(-1.45%)등이 하락폭이 큰 것으로 나타났고 반대로 통신업종(1.49%)과 섬유의복업종(1.49%)등은 상승률이 큰 것으로 집계되었다. 상승률이 가장 큰 통신업종지수는 전일에 이어 오늘도 상승하면서 또한번 연중최고치를 갈아치우는 모습인데, 향후 추가적인 강세트렌드가 진행될 가능성을 보여주고 있다. 동업종에 대해서 외국인은 최근 매수세를 지속하고 있는데, 최근 일주일동안 외국인이 순매수한 금액은 169억원에 이른다. 기관 또한 매수에 치중한 것으로 나타났다. 동업종지수의 패턴을 분석해보면 현재위치는 전형적인 정배열 구간에서 60일, 120일, 240일 이동평균선을 상향돌파해내고 있는 모습이다.통신업종내 주요 종목동향을 보면 SK텔레콤이 2.45%의 상승률로 오늘 업종내에서 움직임이 활발한모습인데, 최근 해당종목에 대한 외국인의 순매도세가 나타나고 있다. 그리고 KT는 0.53%, 인스코비는 0.1%의 오름세를 보이고 있다. 한편 장중 기준으로 지금은 철강금속업종의 하락폭이 가장 커지는 것으로 나타나고 있고(-0.67%), 상대적으로 의약품업종은 상승폭이 커지고 있는 것으로 나타났다.(+0.88%) 전반적으로 코스피 지수관련 주요업종들은 하락우위를 보이고 있다. 전기전자업종은 (-0.59)% 하락중이고 통신업종이 (1.49)%, 금융업종이 (0.23)% 오른 반면에 운수장비업종(-1.45%),철강금속(-2.75%)은 하락했다. 이시각 현재, 외국인은 코스피시장에서 -1818억원의 순매도를 보이고 있다.  철강금속업종과 전기전자업종을 주로 매도하고 있고 통신업종과 의약품업종 등에서는 매수우위를 보이고 있다. 이에 따라 통신업종내  SK텔레콤(017670)은 2.45% 오른 272,000원을 기록하고 있으며 KT(030200)는 0.53% 오른 28,600원에 거래되고 있다.  한편 의약품업종내에서  제일약품(271980)과 종근당바이오(063160)도 각각 3.3%, 3.19%의 등락폭을 보이고 있다. 상대적으로 외국인이 매도우위를 보이는 전기전자업종에서는 LG디스플레이(034220)가 전날보다 -4.48% 낮아진 20,250원을 기록하고 있으며 LG이노텍(011070)과 폴루스바이오팜(007630)은 각각 -3.19%,-2.19% 보이고 있다. 증시분석 전문기자 로봇 ET etbot@etnews.com전자신문과 씽크풀의 증시분석 전문기자 로봇 ET가 쓴 기사입니다▶ 전자신문 바로가기 [Copyright ⓒ 전자신문 & 전자신문인터넷, 무단전재 및 재배포 금지]전자신문 관련뉴스해당 언론사에서 선정하며 언론사 페이지(아웃링크)로 이동해 볼 수 있습니다.삼성SDI, 폴더블 핵심 소재 개발...폴더블폰에 적용'화재 사태' 부른 BMW '고압 EGR'…벤츠·폭스바겐 '저압 EGR' 병행디지털세 초안 마련됐다...3% 부과 법률 근거 마련한-인니, 자동차·ICT 등 실질협력 강화…4차 산업혁명 공동 대응中 BOE, 10.5세대 LCD 안정화...65·75인치 가격 하락 빌미좋아요0훈훈해요0슬퍼요0화나요0후속기사 원해요0기사제공 :""]"
