,회사명,날짜,언론사,기사제목,링크,본문
0,삼성전자, 2018-11-2621:01,서울경제 ,경영 기반 다지면서 변화 유도 실적 중심 CEO교체 폭은 클듯,https://finance.naver.com/news/news_read.nhn?article_id=0003452027&office_id=011&mode=search&query=LG이노텍&page=1,"['       경영 기반 다지면서 변화 유도 실적 중심 CEO교체 폭은 클듯      기사입력2018-11-26 21:01기사원문좋아요훈훈해요좋아요 평가하기공감좋아요0훈훈해요0슬퍼요0화나요0후속기사 원해요0댓글LG 내일 인사... 부회장단 유임[서울경제] 구광모 LG 회장의 첫 인사는 ‘안정 속 변화’와 ‘파격적 선택’이라는 두 개의 방향을 두고 고심 끝에 ‘안정 속 변화’를 선택할 것으로 보인다. LG디스플레이의 경우 그간 주력이었던 액정표시장치(LCD)사업의 부진으로 유기발광다이오드(OLED) 사업으로 전환을 꾀하고 있어 최고경영자(CEO) 교체 가능성이 있다는 관측도 있었다. 하지만 이달 사업보고회에서 인사권자가 한상범 부회장에게 ‘유임’을 시사했다는 후문이다. 차석용 LG생활건강 부회장은 실적 등 경영성과가 뛰어나 본인이 사의를 표명하지 않는 이상 살아남을 것이라는 관측이 우세했다. LG전자도 스마트폰의 부진이 장기화되고 있음에도 경영 실적은 전반적으로 괜찮아 조성진 부회장의 유임이 점쳐져 왔다. 재계의 한 인사는 “신학철 부회장 영입 등으로 구광모호가 파격적 교체를 통한 변화에 나설 것이라는 전망이 있었지만 비즈니스 환경의 불확실성이 커지고 있는 점을 고려한 듯 보인다”며 “이번 인사를 통해 검증된 리더십을 바탕으로 초기 경영 기반을 안정적으로 다지면서 조직 변화도 유인할 것으로 예상된다”고 말했다. 그는 “특히 부회장급에서 교체가 없는 만큼 사업본부장이나 사업부장 중심의 변화 가능성은 상대적으로 커졌다”고 짚었다. 다른 관계자는 “현재 상황에서 보면 부회장이 모두 유임된 것이지만 이미 지난 7월 권영수 부회장과 하현회 부회장을 맞바꾸는 ‘원포인트’ 인사를 했고 신 부회장도 영입한 만큼 변화의 폭이 작다고 볼 수도 없다”며 “상대적으로 보수적인 LG의 기업문화, 글로벌 외부 변수 등을 고려해 적정 수준의 교체를 한 것 같다”고 평가했다. 계열사는 안정에 주안점을 뒀다면 지주사의 변화 폭은 상대적으로 클 것이라는 전망도 나온다. 시장에서는 ㈜LG의 팀장 중 상당수가 교체될 것이라는 관측이 나오는 상황이다. 앞서 7월에도 ㈜LG는 이명관 LG화학 최고인사책임자(CHO·부사장)를 인사팀장으로 선임한 바 있다. 재계 고위관계자는 “CEO급 인사일수록 막판 변수를 예단할 수 없다”면서도 “과거 구 회장과 같이 호흡을 맞추며 일해봤던 인물, 뛰어난 실적으로 리더십 검증을 받은 브레인 중심으로 발탁될 것”이라고 말했다. 차세대 ‘CEO 풀’에 대한 관심도 이어지고 있다. ㈜LG와 주요 계열사에서 잔뼈가 굵고 성과를 낸 인물들이 요직을 맡을 것으로 예상된다. 이와 관련해 정철동 LG화학 정보전자소재사업본부장 사장이 중용될 것이라는 전망도 나온다. 정 사장은 권영수 부회장과 한 부회장의 뒤를 이어 LG디스플레이에서 중책을 맡았던 인물이다. 구 회장과 손발을 맞춰본 권봉석 LG전자 HE사업본부장 사장, 백상엽 LG CNS 미래전략사업부장 사장, 권일근 LG이노텍 최고기술책임자(CTO) 전무, 김동춘 LG화학 광학소재사업부장 상무 등도 주목받고 있다.LG그룹 전체 임원 인사폭도 예상보다 커질 것이라는 예측도 나온다. 고(故) 구본무 LG그룹 회장도 취임 첫해인 1995년 사상 최대 규모인 354명을 임원으로 승진시켰다. 올해 인사에서도 계열사별로 실적에 따라 임원 승진과 교체가 대폭 이뤄질 것이라는 예상이 나온다. 업계의 한 관계자는 “임원 승진 규모는 계열사 실적에 따라 좌우될 공산이 크다”며 “구 회장이 인사를 통해 상대적으로 보수적인 LG의 기업문화를 도전적인 분위기로 바꾸자는 메시지를 담을 수도 있다”고 말했다./박효정기자 jpark@sedaily.com[서울경제 바로가기]서울경제 네이버 채널 구독하면 풍성한 선물이 펑펑! [바로가기▶]프리미엄 미디어 Signal이 투자의 바른 길을 안내합니다 [바로가기▶]저작권자 ⓒ 서울경제, 무단 전재 및 재배포 금지좋아요0훈훈해요0슬퍼요0화나요0후속기사 원해요0기사제공 :']"
1,삼성전자, 2018-11-2618:46,국민일보 ,"LG이노텍, 차량용 초슬림 라인조명 모듈 개발",https://finance.naver.com/news/news_read.nhn?article_id=0001152232&office_id=005&mode=search&query=LG이노텍&page=1,"['       LG이노텍, 차량용 초슬림 라인조명 모듈 개발      기사입력2018-11-26 18:46기사원문좋아요훈훈해요좋아요 평가하기공감좋아요0훈훈해요0슬퍼요0화나요0후속기사 원해요0댓글‘넥슬라이드-L’ 색상·밝기 맞춤 설계 가능LG이노텍 직원이 26일 차량용 초슬림 라인조명 모듈 ‘넥슬라이드-L’을 살펴보고 있다. LG이노텍 제공LG이노텍이 광선 폭 3㎜의 차량용 초슬림 라인조명 모듈을 개발했다. 자동차 조명을 보다 다양하게 설계할 수 있을 것으로 기대된다. LG이노텍은 26일 “기존 제품들의 최소 광선 폭은 8㎜”라며 “넥슬라이드-L로 이름 붙인 이번 신제품의 광선 폭은 차량 외장용 발광다이오드(LED) 조명 중 가장 얇다”고 강조했다. LG이노텍은 독자 개발한 LED 발광 구조설계 기술을 신제품에 적용했다. LED를 이용해 얇고 긴 선을 만들면서도 라인의 처음부터 끝까지 고르게 빛나도록 하는 기술이다. 넥슬라이드-L은 조명의 용도와 장착 위치에 따라 색상과 밝기를 맞춤 설계할 수도 있다. 제동등과 보조제동등은 빨간색, 방향지시등과 사이드미러 램프는 노란색, 포지션 램프는 흰색으로 각각 제작하는 것이 가능하다. 표면 밝기는 최대 7500니트에 달해 브레이크 작동을 나타내는 제동등에 적용할 수도 있다. LG이노텍은 넥슬라이드-L 관련 총 200여건의 기술 특허를 보유했다. 회사 관계자는 “넥슬라이드-L은 차량의 디자인·품질·안전성을 모두 높일 수 있는 혁신적인 조명 모듈”이라며 “자동차 제조사와 운전자 모두 만족하게 될 것으로 기대한다”고 말했다.유성열 기자[네이버 메인에서 채널 구독하기][취향저격 뉴스는 여기] [의뢰하세요 취재대행소 왱]GoodNews paper ⓒ 국민일보(www.kmib.co.kr), 무단전재 및 재배포금지국민일보 관련뉴스해당 언론사에서 선정하며 언론사 페이지(아웃링크)로 이동해 볼 수 있습니다.""도끼 엄마 돈 안 갚아"" 주장에 도끼 형이 한 말""돈 더 드릴테니 후라이 좀…진상 손님인가요""윤장현이 권양숙인줄 알고 보낸 4억5천 출처는?스프링클러 없이 소화기 달랑… \'火\'난 통신구KT 화재 보고 자리서… ""세월호 얼마나 우려먹었나""좋아요0훈훈해요0슬퍼요0화나요0후속기사 원해요0기사제공 :']"
2,삼성전자, 2018-11-2617:56,한국경제 ,"LG이노텍, 초슬림 LED조명 모듈 개발",https://finance.naver.com/news/news_read.nhn?article_id=0004051547&office_id=015&mode=search&query=LG이노텍&page=1,"['       LG이노텍, 초슬림 LED조명 모듈 개발      기사입력2018-11-26 17:56기사원문좋아요훈훈해요좋아요 평가하기공감좋아요0훈훈해요0슬퍼요0화나요0후속기사 원해요0댓글車 외장용…광선 폭 3㎜ 불과[ 고재연 기자  ] LG이노텍은 광선 폭이 3㎜로 얇은 차량용 LED(발광다이오드) 조명 모듈 ‘넥슬라이드-L’(사진)을 개발했다고 26일 발표했다. 기존 제품의 최소 광선 폭은 8㎜가량으로, 이 신제품의 광선 폭은 차량 외장용 LED 조명 중 가장 얇다고 회사 측은 설명했다.LG이노텍은 독자 개발한 LED 발광 구조설계 기술을 적용해 넥슬라이드-L을 개발했다. 점 광원인 LED를 이용해 얇고 긴 선을 구현하되, 라인의 처음부터 끝까지 고르게 빛나도록 하는 기술이다. 기존 제품보다 라인이 얇아지기 때문에 차별화된 자동차 디자인이 가능하다는 게 회사 측 설명이다. 조명의 용도와 장착 위치에 따라 색상과 밝기를 맞춤 설계할 수 있다. 제동등과 보조제동등은 빨간색, 방향지시등과 사이드미러 램프는 노란색, 포지션 램프는 흰색 등 다양한 색상으로 제작이 가능하다. 표면 밝기는 최대 7500니트에 달해 브레이크 작동을 나타내는 제동등에 적용할 수도 있다.LG이노텍은 넥슬라이드-L 등 차별화 제품을 앞세워 글로벌 차량용 LED 시장 공략에 속도를 낼 방침이다. 이번 제품을 생산하면서 회사는 차량 외장용·내장용을 포함해 총 20여 종의 차량용 LED 패키지와 모듈을 보유하게 됐다. 이 회사 관계자는 “넥슬라이드-L은 차량의 디자인, 품질, 안전성을 모두 높일 수 있는 조명 모듈”이라며 “자동차 제조사와 운전자 모두 만족하게 될 것으로 기대한다”고 말했다.고재연 기자 yeon@hankyung.com[한경닷컴 바로가기] [모바일한경 구독신청] 전문가들의 내년 투자전략이 알고 싶다면? <자세히 보기> ⓒ 한국경제 & hankyung.com, 무단전재 및 재배포 금지한국경제 관련뉴스해당 언론사에서 선정하며 언론사 페이지(아웃링크)로 이동해 볼 수 있습니다.8억5000만원이던 옥수동 아파트, 한달새 집값이""1조5000억 수출길 막히자…"" 중국 대신 급부상기아차 · 농심 · 남양유업 · 효성도 \'나 떨고 있니?\'""단종시킬 이유 없다"" 모하비, \'초긴장\' 시킨 車""이재명, 기껏 도와줬더니…"" 홍준표가 떠올린 악연좋아요0훈훈해요0슬퍼요0화나요0후속기사 원해요0기사제공 :']"
3,삼성전자, 2018-11-2617:15,서울경제 ,"더 슬림하게... 더 빛나게... LG이노텍, 車 LED 개발",https://finance.naver.com/news/news_read.nhn?article_id=0003451840&office_id=011&mode=search&query=LG이노텍&page=1,"['       더 슬림하게... 더 빛나게... LG이노텍, 車 LED 개발      기사입력2018-11-26 17:15기사원문좋아요훈훈해요좋아요 평가하기공감좋아요0훈훈해요0슬퍼요0화나요0후속기사 원해요0댓글자동차 컨셉 따른 디자인 차별화에 유리LG이노텍 직원이 26일 차량용 초슬림 라인조명모듈 ‘넥슬라이드-L’을 살펴보고 있다. /사진제공=LG이노텍[서울경제] LG이노텍(011070)은 광선폭 3㎜의 차량용 초슬림 라인조명모듈 ‘넥슬라이드-L’을 개발했다고 26일 밝혔다. 차량 외장용 발광다이오드(LED) 조명 중 가장 얇은 이 제품은 자동차 디자인을 차별화하는 데 유리하다.LG이노텍은 독자 개발한 ‘LED 발광 구조설계 기술’을 적용해 넥슬라이드-L을 개발했다. 점 광원인 LED를 이용해 얇고 긴 선을 구현하되 라인의 처음부터 끝까지 고르게 빛나도록 하는 기술이다. 기존 제품들의 최소 광선폭은 8㎜ 정도에 불과하다.넥슬라이드-L은 차량 콘셉트에 따라 조명을 직선·곡선·물결 등 여러 모양으로 만들 수 있기 때문에 자동차 디자인을 차별화하기에 좋다. 동시에 조명을 1m 이상으로 길게 만들어도 밝기 차이에 따른 얼룩이나 끊김이 없다.특히 넥슬라이드-L은 조명의 용도와 장착 위치에 따라 색상과 밝기를 맞춤 설계할 수 있도록 했다. 제동등과 보조제동등(CHMSL)은 빨간색, 방향지시등과 사이드미러 램프는 노란색, 포지션 램프는 흰색 등으로 다양한 제작이 가능하다.넥슬라이드-L은 표면 밝기가 최대 7,500니트에 달해 브레이크 작동을 나타내는 제동등에 적용할 수도 있다. 이는 1㎡에 촛불 7,500개를 켜놓은 정도로 밝다는 의미다. LG이노텍 관계자는 “넥슬라이드-L은 차량의 디자인·품질·안전성을 모두 높일 수 있는 혁신적인 조명 모듈”이라며 “자동차 제조사와 운전자 모두 만족하게 될 것으로 기대한다”고 말했다./박효정기자 jpark@sedaily.com[서울경제 바로가기]서울경제 네이버 채널 구독하면 풍성한 선물이 펑펑! [바로가기▶]프리미엄 미디어 Signal이 투자의 바른 길을 안내합니다 [바로가기▶]저작권자 ⓒ 서울경제, 무단 전재 및 재배포 금지서울경제 관련뉴스해당 언론사에서 선정하며 언론사 페이지(아웃링크)로 이동해 볼 수 있습니다.""30년 살았는데···"" 공시가만 올려도 터진 \'종부세 폭탄\'불경기가 웬 말? 백화점서 \'수억원\' 쓰는 큰손들 이야기[단독] 한국당 \'사립유치원=사유재산\' 법안 추진한다김정은 연내 답방 물 건너갔다? 靑 낙관론 힘 빠진 이유러시아, 우크라 군함에 포격···다시 전운 덮친 크림반도좋아요0훈훈해요0슬퍼요0화나요0후속기사 원해요0기사제공 :']"
4,삼성전자, 2018-11-2616:02,데일리안 ,"LG이노텍, 차량용 초슬림 라인조명 '넥슬라이드-L' 개발",https://finance.naver.com/news/news_read.nhn?article_id=0002295781&office_id=119&mode=search&query=LG이노텍&page=1,"[""       LG이노텍, 차량용 초슬림 라인조명 '넥슬라이드-L' 개발      기사입력2018-11-26 16:02기사원문좋아요훈훈해요좋아요 평가하기공감좋아요0훈훈해요0슬퍼요0화나요0후속기사 원해요0댓글차량용 초슬림 라인조명 넥슬라이드(Nexlide)-L.ⓒLG이노텍광 선폭 3mm의 얇고 균일한 LED 빛조명 용도 따라 모양·색상·밝기 맞춤 가능LG이노텍이 자동차 외관을 한층 돋보이게 하는 신개념 발광다이오드(LED) 조명모듈을 개발했다. 후미등과 방향지시등 같은 차량 외장 조명을 휴대폰 충전케이블 수준의 얇고 날렵한 선 모양으로 디자인 할 수 있는 혁신 제품이다.LG이노텍(대표 박종석)은 광 선폭 3밀리미터(mm)의 가느다란 라인에서 밝고 고른 빛을 내는 차량용 초슬림 라인조명모듈 ‘넥슬라이드(Nexlide)-L’을 개발했다고 26일 밝혔다. 차량 외장용 LED 조명 중 가장 얇은 라인을 구현하는 것으로 기존 제품은 최소 광선폭이 8mm 정도였다.차량 조명은 자동차의 정체성을 드러내고 첫 인상을 결정짓는 중요한 장치다. 신차 개발 시 빠짐없이 새로 디자인 하는 곳이 바로 조명이다. 최근 광원 기술 발전으로 한층 다양한 디자인의 조명이 차량에 적용되고 있다.LG이노텍은 독자 개발한 ‘LED 발광 구조설계 기술’을 적용해 ‘넥슬라이드-L’을 구현했다. 본래 점 광원인 LED를 이용해 얇고 긴 선을 구현하되 라인 처음부터 끝까지 고르게 빛나도록 하는 정교한 기술이다. ‘넥슬라이드-L’은 자동차 디자인을 차별화하고 완성도를 높이는 데 좋다는 것이 회사측의 설명이다. 차량 컨셉에 따라 조명을 직선·곡선·물결 등 여러 모양으로 슬림하고 매끄럽게 만들 수 있어서다. 조명을 1미터(m) 이상 길게 만들어도 밝기 차이에 따른 얼룩이나 끊김이 없을 만큼 고품질이다.특히 ‘넥슬라이드-L’은 조명의 용도와 장착 위치에 따라 컬러와 밝기를 맞춤 설계할 수 있다. 제동등과  보조제동등(CHMSL·Center High Mounted Stop Lamp)은  레드와 방향지시등과 사이드미러 램프는 옐로우, 포지션 램프는 화이트와 같이 다양하게 제작할 수 있다.또 ‘넥슬라이드-L’은 표면 밝기가 최대 7500니트(nit·cd/㎡)에 달해 브레이크 작동을 나타내는 제동등에 사용해도 손색 없다. 이는 1제곱미터(m2) 면적에 촛불 7500개를 켜놓은 정도로 매우 밝다는 의미다. LCD TV 화면 밝기가 1000~2000니트 수준이다.LG이노텍은 ‘넥슬라이드-L’ 등 차별화 제품을 앞세워 글로벌 차량용 LED 시장 공략에 더욱 속도를 낸다는 방침이다. 고객 요구에 따라 안정적으로 공급할 준비를 이미 마쳤다. 이 제품 관련 총 200여 건에 이르는 기술 특허를 보유했고 생산 설비 및 품질 관리 기반도 갖췄다.아울러 LG이노텍은 이번 ‘넥슬라이드-L’ 개발로 차량용 LED 라인업을 한층 강화했다. 이로써 회사는 전조등과 주간주행등(DRL·Daytime Running Lights), 포지션 램프, 방향지시등, 사이드미러 램프, 차폭등, 제동등, 보도제동등과 같은 외장용뿐만 아니라 룸 램프, 계기판 조명 등 내장용까지 총 20여 종의 차량용 LED 패키지·모듈을 보유하게 됐다.LG이노텍 관계자는 “넥슬라이드-L은 차량의 디자인과 품질, 안전성을 모두 높일 수 있는 혁신적인 조명모듈”이라며 “완성도 높은 차량 조명으로 자동차 제조사와 운전자 모두 만족하게 될 것으로 기대한다”고 말했다.데일리안 이홍석 기자 (redstone@dailian.co.kr)ⓒ (주)데일리안 - 무단전재, 변형, 무단배포 금지데일리안 관련뉴스해당 언론사에서 선정하며 언론사 페이지(아웃링크)로 이동해 볼 수 있습니다.LG이노텍, '이웃사랑 김장나눔' 전국 릴레이 봉사LG이노텍, '열전 반도체 기술' 협탁 냉장고 적용LG이노텍, '일렉트로니카 2018' 참가…유럽시장 공략 박차LG이노텍, 차량용 'C-V2X 모듈' 개발LG이노텍 '중국 열전 반도체 테크 포럼' 성료좋아요0훈훈해요0슬퍼요0화나요0후속기사 원해요0기사제공 :""]"
5,삼성전자, 2018-11-2615:18,매일경제 ,LG그룹 정기인사 임박…떠나는 구본준 `계열분리`에 쏠린 눈,https://finance.naver.com/news/news_read.nhn?article_id=0004260254&office_id=009&mode=search&query=LG이노텍&page=1,"[""       LG그룹 정기인사 임박…떠나는 구본준 `계열분리`에 쏠린 눈      기사입력2018-11-26 15:18기사원문좋아요훈훈해요좋아요 평가하기공감좋아요0훈훈해요0슬퍼요0화나요0후속기사 원해요0댓글희성그룹 스와이프 등 다양한 시나리오 거론연내까지 독립보다 그룹에 남을 가능성도 커구광모 LG 회장(왼쪽)과 구본준 LG 부회장. [사진제공 = LG] 구광모 LG 회장의 첫 정기인사가 오는 28일 예정된 가운데 작은 아버지인 구본준 부회장의 거취를 놓고 의견이 분분하다. 지난 6월 구광모 회장이 LG 대표이사 회장에 선임되자 구본준 부회장은 경영일선에서 즉각 물러나고 연말인사에서 퇴임한다는 뜻을 밝혔다. 그룹을 떠나면서 구본준 부회장은 비주력 계열사 1~2곳을 떼어내 계열분리를 추진한다.이는 그룹 전통인 '장자승계', '형제독립' 원칙 때문이다. LG는 가족 간 경영권 다툼을 사전에 방지하기 위해 승계 대상을 '장자'로 기정하고 계열분리를 통한 투명한 지배구조를 확립했다. 이 원칙은 LG의 순조로운 경영권 승계를 이끌어 온 원동력으로 평가받는다.구인회 LG 창업주 동생 구철회 명예회장 자손들이 1999년 LG화재를 만들어 그룹에서 독립시킨 뒤 LIG그룹을 만든 것이 좋은 예다. 2대 구자경 회장 동생 구자학 회장이 LG유통(현 GS리테일)의 FS사업부를 분리해 아워홈으로 독립했으며, LG그룹의 전선·금속 부문과 에너지·유통·건설 부문을 분리해 LS그룹과 GS그룹을 탄생시킨 것도 마찬가지다.계열분리가 올해 안으로 이뤄질지는 미지수지만 다양한 추측이 거론된다. 우선 희성그룹을 활용한 계열분리다. 구본능 회장의 희성전자 지분과 스와이프(맞교환)해 희성전자를 가져간다는 시나리오다.희성그룹은 구광모 회장의 친부 구본능 회장이 지난 1970년대 LG그룹에서 분리해서 나온 곳이다. 구본능 회장이 희성전자 지분 42.1%를, 구본식 부회장이 16.7%를 보유 중이다.지분 교환이 이뤄지면 구본준 부회장은 희성그룹 내 전자부품 부문, 구본식 부회장이 건설 부문을 각자 맡게 돼 계열 분리가 이뤄진다. 구본준 부회장의 ㈜LG 지분은 7.72%, 약 1조원인데 인수가격도 거의 맞아 떨어진다. 비상장사라 주주총회 걸림돌도 없다. 구본준 부회장이 보유하고 있는 LG 지분과 경영 스타일을 고려했을 때 자동차 자동차부품(VC) 사업을 가져간다는 관측도 제기된다. VC사업은 구 부회장이 LG전자 대표이사에 올라 신설한 조직인 만큼 애착도 크다. 다만 최근 구광모 회장이 ICT·전자에서 미래 먹거리를 찾겠다고 주장한 만큼 가능성은 희박하다는 반론도 있다. 또 전장사업 특성상 미래 성장 가능성이 높고 전후방 시너지가 남달라 떼어주기 부담스러울 것으로 보인다.LG상사나 LG이노텍을 계열 분리할 수 있다. 구본준 부회장 지분을 매각해 최대주주에 오를 수 있는 기업으로 이 두 계열사가 자주 꼽혔다. 하지만 이들 사업이 그룹의 핵심 사업과 깊숙이 연관돼 있다는 점, 계열분리로 그룹 규모가 축소된다는 점에서 가능성은 낮다는 게 재계 관측이다.일각에선 구본준 부회장의 지분이 큰 규모인 만큼 당분간 ㈜LG의 우호 주주로 남을 가능성도 점친다. 4세 경영을 안착시킨 후 계열분리 한다는 분석이다. [디지털뉴스국 김승한 기자]▶'지킬앤하이드' 조승우 공연 티켓 경품 이벤트 ▶매경 뉴스레터 '매콤달콤'을 지금 구독하세요▶뉴스 이상의 무궁무진한 프리미엄 읽을거리[ⓒ 매일경제 & mk.co.kr, 무단전재 및 재배포 금지]매일경제 관련뉴스해당 언론사에서 선정하며 언론사 페이지(아웃링크)로 이동해 볼 수 있습니다.한채영, 가슴 깊게 파인 드레스에 드러난 美친 볼륨감분양가보다 10억 '껑충'…현실된 개포 로또이주영, 연기파 배우의 파격적 뒤태일본 온천 왜 가나요 국내 온천 이렇게 좋은데'48세' 김남주, 20대도 울고 갈 우월 각선미 '입이 쩍'좋아요0훈훈해요0슬퍼요0화나요0후속기사 원해요0기사제공 :""]"
