,회사명,날짜,언론사,기사제목,링크,본문
0,삼성전자, 2018-07-2610:11,전자신문 ,"[ET투자뉴스]LG이노텍, ""수확의 시기가 온다…"" BUY-하나금융투자",https://finance.naver.com/news/news_read.nhn?article_id=0002727133&office_id=030&mode=search&query=LG이노텍&page=2,"['       [ET투자뉴스]LG이노텍, ""수확의 시기가 온다…"" BUY-하나금융투자      기사입력2018-07-26 10:11기사원문좋아요훈훈해요좋아요 평가하기공감좋아요0훈훈해요0슬퍼요0화나요0후속기사 원해요0댓글하나금융투자에서 26일 LG이노텍(011070)에 대해 ""수확의 시기가 온다""라며 투자의견을 \'BUY\'로 제시하였고, 아울러 목표주가로는 190,000원을 내놓았다. 하나금융투자 김록호, 이진우 애널리스트가 동종목에 대하여 이번에 제시한 \'BUY\'의견은 하나금융투자의 직전 매매의견을 그대로 유지하는 것이고 올해 초반의 매매의견을 기준으로  볼때도 역시 \'매수\'의견이 계속 유지되고 있는 상태이다. 그리고 최근 분기내 발표된 전체 증권사 리포트의 컨센서스와 비교를 해볼 경우에 오늘 발표된 투자의견은 대체적으로 평균치에 해당하는 수준으로, 이번 의견은 동종목에 대한 전체적인 흐름에서 크게 벗어나지 않은 것으로 분석되고 있다. 목표주가의 추이를 살펴보면 한동안 정체구간을 보낸 후 이번에 오랜만에 목표가가 상향조정된 모습이다. 또한 전일 종가 기준으로 볼때 동종목의 현주가는 이번에 제시된 목표가 대비 16.9%의 추가상승여력이 있다는 해석이 제시되고 있다. ◆ Report statistics하나금융투자의 동종목에 대한 최근 1년동안의 투자의견은 전체적으로 큰 변화없이 유지되고 있다. 목표주가는 2018년4월 163,000원까지 내려갔다가 2017년10월 200,000원을 최고점으로 목표가가 제시된 이후 최근에 190,000원으로 한단계 하향조정되고 있다. 한편 증권정보제공 업체인 씽크풀에 따르면 동사에 대한 컨센서스는 \'매수\'이고 목표주가의 추이를 살펴보면 최근 2회연속 목표가가 낮아지다 이번에는 직전목표가보다 높은 수준으로 크게 상향반전하는 추세이다. \xa0컨센서스최고최저투자의견매수매수HOLD목표주가193,176220,000170,000*최근 분기기준오늘 하나금융투자에서 발표된 \'BUY\'의견 및 목표주가 190,000원은 전체 컨센서스 대비해서 대체적으로 평균치에 해당하는 수준으로, 이번 의견은 동종목에 대한 전체적인 흐름에서 크게 벗어나지 않은 것으로 파악되며 목표가평균과 대비해서 미미한 차이가 나는 것으로 집계되었다.  참고로 최근에 목표주가를 가장 공격적으로 제시한 한화투자증권에서 투자의견 \'BUY(유지)\'에 목표주가 220,000원을 제일 보수적인 의견을 제시한 DB금융투자에서 투자의견 \'BUY(유지)\'에 목표주가 170,000원을 제시한 바 있다. \xa0의견제시일자투자의견목표가격20180726BUY190,00020180528매수163,00020180521매수163,00020180425매수163,00020180316매수173,000의견제시일자증권사투자의견목표가20180726하이투자증권BUY(MAINTAIN)190,00020180726하나금융투자BUY190,00020180726키움증권BUY(MAINTAIN)210,00020180726이베스트투자증권BUY (MAINTAIN)200,000(씽크풀에서 제공하는 컨센서스는 국내 전증권사에서 발표되는 기업분석 리포트 및 코멘트를 실시간으로 통계/분석처리되고 있습니다.)증시분석 전문기자 로봇 ET etbot@etnews.com전자신문과 씽크풀의 증시분석 전문기자 로봇 ET가 쓴 기사입니다▶ 전자신문 바로가기 [Copyright ⓒ 전자신문 & 전자신문인터넷, 무단전재 및 재배포 금지]전자신문 관련뉴스해당 언론사에서 선정하며 언론사 페이지(아웃링크)로 이동해 볼 수 있습니다.[단독]中텐센트·알리바바 \'QR\' 굴기 막자...정부, 한국 통합 \'QR페이\' 개발 착수차이나머니, 韓 장비기업 사냥...\'한스레이저\' 경쟁사 인수 추진삼성, 업계 최초 7.1채널 음향에 천장 4채널 덧붙인 사운드바 내놓는다협동로봇 시장 활성화 계기 마련했다. KIRIA 협동로봇 설치 작업장 안전인증제도 시행아우디 A3, 40% 할인 판매 진실은…""현금 \'No\', 리스만""좋아요0훈훈해요0슬퍼요0화나요0후속기사 원해요0기사제공 :']"
1,삼성전자, 2018-07-2610:00,전자신문 ,"[ET투자뉴스]LG이노텍, ""극대화될 3분기 계…"" BUY(MAINTAIN)-하이...",https://finance.naver.com/news/news_read.nhn?article_id=0002727126&office_id=030&mode=search&query=LG이노텍&page=2,"['       [ET투자뉴스]LG이노텍, ""극대화될 3분기 계…"" BUY(MAINTAIN)-하이투자증권      기사입력2018-07-26 10:00기사원문좋아요훈훈해요좋아요 평가하기공감좋아요0훈훈해요0슬퍼요0화나요0후속기사 원해요0댓글하이투자증권에서 26일 LG이노텍(011070)에 대해 ""극대화될 3분기 계절성""라며 투자의견을 \'BUY(MAINTAIN)\'로 제시하였고, 아울러 목표주가로는 190,000원을 내놓았다. 하이투자증권 고의영 애널리스트가 동종목에 대하여 이번에 제시한 \'BUY(MAINTAIN)\'의견은 하이투자증권의 직전 매매의견에서 큰 변화없이 그대로 유지되는 것이고  올해 초반의 매매의견을 기준으로  볼때도 역시 \'매수\'의견이 계속 유지되고 있는 상태이다. 그리고 최근 분기내 발표된 전체 증권사 리포트의 컨센서스와 비교를 해볼 경우에 오늘 발표된 투자의견은 전체의견에 수렴하고 있어, 이번 의견은 시장의 평균적인 기대감이 객관적으로 표현된 것으로 분석되고 있다. 목표주가의 추이를 살펴보면 과거 상향/하향조정을 각각 한차례씩 격은 후에 이번에는 직전과 같은 수준을 유지하고 있는 모습이다. 또한 전일 종가 기준으로 볼때 동종목의 현주가는 이번에 제시된 목표가 대비 16.9%의 저평가 요인이 존재한다는 해석이 제시되고 있다. ◆ Report briefing하이투자증권에서 LG이노텍(011070)에 대해 ""연결 기준 2Q18 실적은 매출액 1.52조원 (+13.3%YoY), 영업이익 133억원(-58.8%YoY, 영업이익률 0.8%)으로, 당사 추정치 및 컨센서스를 상회했다. 광학솔루션 사업부의 영업이익률이 -1.1%로 추정되어 예상 대비 선방한것이 주요하다. 이는 1) 2H18 북미거래선 신규 플래그십 스마트폰향 모듈 양산 일정이 전년 대비 앞당겨진 것으로 판단되는 가운데, 2) 전년과같은 수율 이슈가 없어 초도 물량부터 수익성을 확보했으며, 3) 환율 환경도 우호적으로 작용했기 때문으로 판단된다""라고 분석했다.  또한 하이투자증권에서 ""3Q18 실적은 매출액 2.57조원 (+44.0%YoY), 영업이익 1,260억원 (- 125.2%YoY, 영업이익률 4.9%)으로 전망된다. 북미거래선향 모듈 공급이 본격적으로 실적에 반영되기 시작하는 시기다. 특히 올해 3분기는 OLED 채용 스마트폰의 대량 양산 일정이 앞당겨진 것으로 추정된다. 이에 따라3Q18 광학솔루션 사업부의 전분기 대비 외형성장률은 +120% (vs. 3Q1763.1%)로 전년동기 대비 계절성이 더욱 뚜렷하게 나타날 것으로 전망된다""라고 밝혔다. ◆ Report statistics하이투자증권의 동종목에 대한 최근 9개월 동안의 투자의견은 전체적으로 큰 변화없이 유지되고 있다. 목표주가는 2017년10월 225,000원까지 높아졌다가 2018년4월 160,000원을 최저점으로 목표가가 제시된 이후 최근에 190,000원으로 새롭게 조정되고 있다. 한편 증권정보제공 업체인 씽크풀에 따르면 동사에 대한 컨센서스는 \'매수\'이고 목표주가의 추이를 살펴보면 최근 2회연속 목표가가 낮아지다 이번에는 직전목표가보다 높은 수준으로 크게 상향반전하는 추세이다. \xa0컨센서스최고최저투자의견매수매수HOLD목표주가193,176220,000170,000*최근 분기기준오늘 하이투자증권에서 발표된 \'BUY(MAINTAIN)\'의견 및 목표주가 190,000원은 전체의견에 수렴하면서 시장의 평균적인 기대감이 비교적 객관적으로 표현된 것으로 풀이되며 목표가평균과 대비해서 미미한 차이가 나는 것으로 집계되었다.  참고로 최근에 목표주가를 가장 공격적으로 제시한 한화투자증권에서 투자의견 \'BUY(유지)\'에 목표주가 220,000원을 제일 보수적인 의견을 제시한 DB금융투자에서 투자의견 \'BUY(유지)\'에 목표주가 170,000원을 제시한 바 있다. \xa0의견제시일자투자의견목표가격20180726BUY(MAINTAIN)190,00020180718BUY(MAINTAIN)190,00020180425매수(유지)160,00020180313매수(유지)200,00020180124매수(유지)200,000의견제시일자증권사투자의견목표가20180726하이투자증권BUY(MAINTAIN)190,00020180726하나금융투자BUY190,00020180726키움증권BUY(MAINTAIN)210,00020180726이베스트투자증권BUY (MAINTAIN)200,000(씽크풀에서 제공하는 컨센서스는 국내 전증권사에서 발표되는 기업분석 리포트 및 코멘트를 실시간으로 통계/분석처리되고 있습니다.)증시분석 전문기자 로봇 ET etbot@etnews.com전자신문과 씽크풀의 증시분석 전문기자 로봇 ET가 쓴 기사입니다▶ 전자신문 바로가기 [Copyright ⓒ 전자신문 & 전자신문인터넷, 무단전재 및 재배포 금지]전자신문 관련뉴스해당 언론사에서 선정하며 언론사 페이지(아웃링크)로 이동해 볼 수 있습니다.[단독]中텐센트·알리바바 \'QR\' 굴기 막자...정부, 한국 통합 \'QR페이\' 개발 착수차이나머니, 韓 장비기업 사냥...\'한스레이저\' 경쟁사 인수 추진삼성, 업계 최초 7.1채널 음향에 천장 4채널 덧붙인 사운드바 내놓는다협동로봇 시장 활성화 계기 마련했다. KIRIA 협동로봇 설치 작업장 안전인증제도 시행아우디 A3, 40% 할인 판매 진실은…""현금 \'No\', 리스만""좋아요0훈훈해요0슬퍼요0화나요0후속기사 원해요0기사제공 :']"
2,삼성전자, 2018-07-2609:40,전자신문 ,"[ET투자뉴스]LG이노텍, ""하반기 고공 비행…"" BUY(MAINTAIN)-키움증...",https://finance.naver.com/news/news_read.nhn?article_id=0002727106&office_id=030&mode=search&query=LG이노텍&page=2,"['       [ET투자뉴스]LG이노텍, ""하반기 고공 비행…"" BUY(MAINTAIN)-키움증권      기사입력2018-07-26 09:40기사원문좋아요훈훈해요좋아요 평가하기공감좋아요0훈훈해요0슬퍼요0화나요0후속기사 원해요0댓글키움증권에서 26일 LG이노텍(011070)에 대해 ""하반기 고공 비행""라며 투자의견을 \'BUY(MAINTAIN)\'로 제시하였고, 아울러 목표주가로는 210,000원을 내놓았다. 키움증권 김지산 애널리스트가 동종목에 대하여 이번에 제시한 \'BUY(MAINTAIN)\'의견은 키움증권의 직전 매매의견에서 큰 변화없이 그대로 유지되는 것이고  올해 초반의 매매의견을 기준으로  볼때도 역시 \'매수\'의견이 계속 유지되고 있는 상태이다. 그리고 최근 분기내 발표된 전체 증권사 리포트의 컨센서스와 비교를 해볼 경우에 오늘 발표된 투자의견은 전체의견에 수렴하고 있어, 이번 의견은 시장의 평균적인 기대감이 객관적으로 표현된 것으로 분석되고 있다. 목표주가의 추이를 살펴보면 최근 두차례 연속 상향조정되다가 이번에는 직전 목표가와 동일한 수준을 유지하는 모습이다. 또한 전일 종가 기준으로 볼때 동종목의 현주가는 이번에 제시된 목표가 대비 29.2%의 저평가 요인이 존재한다는 해석이 제시되고 있다. ◆ Report statistics키움증권의 동종목에 대한 최근 1년동안의 투자의견은 전체적으로 큰 변화없이 유지되고 있다. 목표주가는 2018년4월 180,000원까지 내려갔다가 2017년9월 220,000원을 최고점으로 목표가가 제시된 이후 최근에 210,000원으로 한단계 하향조정되고 있다. 한편 증권정보제공 업체인 씽크풀에 따르면 동사에 대한 컨센서스는 \'매수\'이고 목표주가의 추이를 살펴보면 최근 2회연속 목표가가 낮아지다 이번에는 직전목표가보다 높은 수준으로 크게 상향반전하는 추세이다. \xa0컨센서스최고최저투자의견매수매수HOLD목표주가191,588220,000163,000*최근 분기기준오늘 키움증권에서 발표된 \'BUY(MAINTAIN)\'의견 및 목표주가 210,000원은 전체의견에 수렴하면서 시장의 평균적인 기대감이 비교적 객관적으로 표현된 것으로 풀이되며 목표가평균 대비 9.6% 초과하고 있는 것으로 집계되었다.  참고로 최근에 목표주가를 가장 공격적으로 제시한 한화투자증권에서 투자의견 \'BUY(유지)\'에 목표주가 220,000원을 제일 보수적인 의견을 제시한 하나금융투자에서 투자의견 \'매수\'에 목표주가 163,000원을 제시한 바 있다. \xa0의견제시일자투자의견목표가격20180726BUY(MAINTAIN)210,00020180709BUY(MAINTAIN)210,00020180607매수(유지)200,00020180521매수(유지)180,00020180425매수(유지)180,000의견제시일자증권사투자의견목표가20180726키움증권BUY(MAINTAIN)210,00020180726이베스트투자증권BUY (MAINTAIN)200,00020180726NH투자증권BUY(유지)200,00020180726유진투자증권BUY(유지)185,000(씽크풀에서 제공하는 컨센서스는 국내 전증권사에서 발표되는 기업분석 리포트 및 코멘트를 실시간으로 통계/분석처리되고 있습니다.)증시분석 전문기자 로봇 ET etbot@etnews.com전자신문과 씽크풀의 증시분석 전문기자 로봇 ET가 쓴 기사입니다▶ 전자신문 바로가기 [Copyright ⓒ 전자신문 & 전자신문인터넷, 무단전재 및 재배포 금지]전자신문 관련뉴스해당 언론사에서 선정하며 언론사 페이지(아웃링크)로 이동해 볼 수 있습니다.[단독]中텐센트·알리바바 \'QR\' 굴기 막자...정부, 한국 통합 \'QR페이\' 개발 착수차이나머니, 韓 장비기업 사냥...\'한스레이저\' 경쟁사 인수 추진삼성, 업계 최초 7.1채널 음향에 천장 4채널 덧붙인 사운드바 내놓는다협동로봇 시장 활성화 계기 마련했다. KIRIA 협동로봇 설치 작업장 안전인증제도 시행아우디 A3, 40% 할인 판매 진실은…""현금 \'No\', 리스만""좋아요0훈훈해요0슬퍼요0화나요0후속기사 원해요0기사제공 :']"
3,삼성전자, 2018-07-2609:37,뉴시스 ,"LG이노텍, 美 네일드라이어 업체에 'UV LED' 특허 침해 소송 제기",https://finance.naver.com/news/news_read.nhn?article_id=0008726451&office_id=003&mode=search&query=LG이노텍&page=2,"['       LG이노텍, 美 네일드라이어 업체에 \'UV LED\' 특허 침해 소송 제기      기사입력2018-07-26 09:37기사원문좋아요훈훈해요좋아요 평가하기공감좋아요0훈훈해요0슬퍼요0화나요0후속기사 원해요0댓글네일드라이어 10종에 UV LED 칩 설계 특허 무단 사용""경쟁 업체의 부당한 특허 침해에 엄정히 대처해 나갈 것""【서울=뉴시스】김지은 기자 = LG이노텍이 미국 UV(Ultra Violet rays·자외선) 네일드라이어 제조업체를 상대로 특허 침해 소송을 제기했다. LG이노텍은 25일(현지시간) 네일드라이어 제조업체 \'에버그레이트\'를 상대로 캘리포니아 북부 연방지방법원과 캘리포니아 중부 연방지방법원에 UV LED 특허 침해 소송을 제기했다고 26일 밝혔다. LG이노텍이 UV LED 제품에 대해 특허 소송을 제기한 것은 이번이 처음이다.UV 네일드라이어는 손·발톱에 젤(gel) 타입의 매니큐어를 바른 후 자외선 빛을 쬐어 빠르게 건조시키는 기기다. 특수 물질과 화학 반응하는 자외선의 특성을 활용하는데 성능과 안전성이 뛰어난 UV LED가 수은램프를 대신해 자외선 광원으로 많이 사용되고 있다.에버그레이트는 미국 캘리포니아 소재의 UV 네일드라이어 제조· 판매업체로 미국 네일아트 시장에서는 \'멜로디수지\'라는 브랜드로 잘 알려져 있다.회사 측은 에버그레이트가 판매하는 UV 네일드라이어 10개 모델에 LG이노텍의 LED 칩 설계 특허가 무단 사용해 소송을 제기했다고 설명했다. 판매금지 및 손해배상 청구 소송이다. LG이노텍은 ""지난 1월 에버그레이트에 특허 침해 경고장을 보내고 라이선스 계약을 요구했지만 에버그레이트가 협상 요구에 응하지 않아 이번 소송을 제기했다""고 말했다. LG이노텍은 UV LED 특허 침해 모니터링을 강화하며 지적재산권을 보호해 나갈 방침이다. 이 회사는 경화·노광용, 살균용, 식물생장용 등 다양한 파장의 UV LED를 선보이고 있다. 지난해에는 세계 최고 광출력 100밀리와트 살균용 UV LED 개발로 기술력을 입증했다.UV LED는 초기 시장으로 시장조사업체 \'욜디벨롭먼트\'에 따르면 글로벌 UV LED 시장은 2016년 1억5190만달러(약 1698억원)에서 2021년 11억1780만달러(1조2497억원)로 7배 이상 커질 전망이다. 김진현 LG이노넥 특허담당(상무)은 ""경쟁 업체들의 부당한 특허 침해에 엄정히 대처해 나갈 것""이라 말했다.kje1321@newsis.com▶ 뉴시스 빅데이터 MSI 주가시세표 바로가기 ▶ 뉴시스 SNS [페이스북] [트위터]뉴시스 관련뉴스해당 언론사에서 선정하며 언론사 페이지(아웃링크)로 이동해 볼 수 있습니다.10대 며느리 친구 강제추행 50대 시아버지 징역 1년군부대에 피자 배달 갔다 체포된 불법체류자…법원 석방명령찜질방서 20대男 추행한 여성…잡고 보니 여장한 50대男일탈 넘어 범죄로 \'적대적 공생\'…일베·워마드 놔둬야 하나""짜증 난다"" 이유로…남의 고양이 벽돌로 때려 죽인 50대 구속좋아요0훈훈해요0슬퍼요0화나요0후속기사 원해요0기사제공 :']"
4,삼성전자, 2018-07-2609:22,파이낸셜뉴스 ,"LG이노텍, UV LED 기술 베낀 美 업체에 특허소송 제기",https://finance.naver.com/news/news_read.nhn?article_id=0004064737&office_id=014&mode=search&query=LG이노텍&page=2,"['       LG이노텍, UV LED 기술 베낀 美 업체에 특허소송 제기      기사입력2018-07-26 09:22기사원문좋아요훈훈해요좋아요 평가하기공감좋아요0훈훈해요0슬퍼요0화나요0후속기사 원해요0댓글      LG이노텍 연구원이 자외선을 방출하는 첨단 반도체 광원 UV LED 패키지를 선보이고 있다.   LG이노텍이 자외선 발광다이오드(UV LED) 기술 보호에 나섰다.  LG이노텍은 25일(현지시간) 미국의 UV 네일드라이어 제조업체 \'에버그레이트\'를 상대로 캘리포니아 북부 연방지방법원과 캘리포니아 중부 연방지방법원에 특허 침해 소송을 제기했다. 에버그레이트는 미국 네일아트 시장에서 \'멜로디수지(MelodySusie\'라는 브랜드로 잘 알려져 있다.  LG이노텍에 따르면 에버그레이트는 UV네일드라이버 10개 모델에 LG이노텍의 LED칩 설계 특허를 무단 사용했다. UV네일드라이어는 손톱과 발톱에 젤 타입의 매니큐어를 바른 후 자외선 빛을 쬐어 빠르게 건조시키는 기기다.  LG이노텍은 이들 제품에 대해 판매금지 및 손해배상 청구 소송을 제기했다. LG이노텍은 지난 1월 에버그레이트에 특허 침해 경고장을 보내고 라이선스 계약을 요구했지만 에버그레이트가 응하지 않으면서 이번 소송을 제기했다.  LG이노텍 관계자는 ""UV LED 특허 침해 모니터링을 한층 강화하며 지적재산권을 철저하게 보호해 나갈 방침""이라고 전했다.   ktop@fnnews.com 권승현 기자   ▶ 세상의 모든 골 때리는 이야기 \'fn파스\'▶ 속보이는 연예뉴스 fn스타  ※ 저작권자 ⓒ 파이낸셜뉴스. 무단 전재-재배포 금지파이낸셜뉴스 관련뉴스해당 언론사에서 선정하며 언론사 페이지(아웃링크)로 이동해 볼 수 있습니다.2천만원 뽑고 천만원 더.. 수상한 낌채 눈치 챈 은행원의 순발력실험 때문에 비아그라 성분 섭취한 임산부에 닥친 비극교도소에 담배 밀반입.. 불 붙이기 위한 기상천외 방법""위수령 잘못된 것 아니다"" 송영무 발언 적힌 보고서 확인\'성추문 폭로\' 최영미 시인, 고은 시인에 거액 손배소 당해좋아요0훈훈해요0슬퍼요0화나요0후속기사 원해요0기사제공 :']"
5,삼성전자, 2018-07-2609:10,전자신문 ,"[ET투자뉴스]LG이노텍, ""실적 : 바닥 확인…"" 매수(유지)-신한금융투자",https://finance.naver.com/news/news_read.nhn?article_id=0002727070&office_id=030&mode=search&query=LG이노텍&page=2,"['       [ET투자뉴스]LG이노텍, ""실적 : 바닥 확인…"" 매수(유지)-신한금융투자      기사입력2018-07-26 09:10기사원문좋아요훈훈해요좋아요 평가하기공감좋아요0훈훈해요0슬퍼요0화나요0후속기사 원해요0댓글신한금융투자에서 26일 LG이노텍(011070)에 대해 ""실적 : 바닥 확인, 3Q부터 가파른 반등 구간 진입""라며 투자의견을 \'매수(유지)\'로 제시하였고, 아울러 목표주가로는 200,000원을 내놓았다. 신한금융투자 박형우, 김현욱 애널리스트가 동종목에 대하여 이번에 제시한 \'매수(유지)\'의견은 신한금융투자의 직전 매매의견에서 큰 변화없이 그대로 유지되는 것이고  올해 초반의 매매의견을 기준으로  볼때도 역시 \'매수\'의견이 계속 유지되고 있는 상태이다. 그리고 최근 분기내 발표된 전체 증권사 리포트의 컨센서스와 비교를 해볼 경우에 오늘 발표된 투자의견은 전체의견에 수렴하고 있어, 이번 의견은 시장의 평균적인 기대감이 객관적으로 표현된 것으로 분석되고 있다. 목표주가의 추이를 살펴보면 과거 상향조정되어오던 패턴이 최근 두차례 연속 같은 수준에 머물고 있는 모습이다. 또한 전일 종가 기준으로 볼때 동종목의 현주가는 이번에 제시된 목표가 대비 23.1%의 저평가 요인이 존재한다는 해석이 제시되고 있다. ◆ Report statistics신한금융투자의 동종목에 대한 최근 1년동안의 투자의견은 전체적으로 큰 변화없이 유지되고 있다. 목표주가는 2018년1월 175,000원까지 내려갔다가 2017년11월 215,000원을 최고점으로 목표가가 제시된 이후 최근에 200,000원으로 한단계 하향조정되고 있다. 한편 증권정보제공 업체인 씽크풀에 따르면 동사에 대한 컨센서스는 \'매수\'이고 목표주가의 추이를 살펴보면 최근 2회연속 목표가가 낮아지다 이번에는 직전목표가보다 높은 수준으로 크게 상향반전하는 추세이다. \xa0컨센서스최고최저투자의견매수매수HOLD목표주가190,412220,000163,000*최근 분기기준오늘 신한금융투자에서 발표된 \'매수(유지)\'의견 및 목표주가 200,000원은 전체의견에 수렴하면서 시장의 평균적인 기대감이 비교적 객관적으로 표현된 것으로 풀이되며 목표가평균 대비 5% 초과하고 있는 것으로 집계되었다.  참고로 최근에 목표주가를 가장 공격적으로 제시한 한화투자증권에서 투자의견 \'BUY(유지)\'에 목표주가 220,000원을 제일 보수적인 의견을 제시한 하나금융투자에서 투자의견 \'매수\'에 목표주가 163,000원을 제시한 바 있다. \xa0의견제시일자투자의견목표가격20180726매수(유지)200,00020180723매수(유지)200,00020180711매수(유지)200,00020180425매수(유지)175,00020180416매수(유지)175,000의견제시일자증권사투자의견목표가20180726신한금융투자매수(유지)200,00020180726삼성증권HOLD180,00020180726현대차투자증권BUY200,00020180725KB증권BUY(유지)185,000(씽크풀에서 제공하는 컨센서스는 국내 전증권사에서 발표되는 기업분석 리포트 및 코멘트를 실시간으로 통계/분석처리되고 있습니다.)증시분석 전문기자 로봇 ET etbot@etnews.com전자신문과 씽크풀의 증시분석 전문기자 로봇 ET가 쓴 기사입니다▶ 전자신문 바로가기 [Copyright ⓒ 전자신문 & 전자신문인터넷, 무단전재 및 재배포 금지]전자신문 관련뉴스해당 언론사에서 선정하며 언론사 페이지(아웃링크)로 이동해 볼 수 있습니다.[단독]中텐센트·알리바바 \'QR\' 굴기 막자...정부, 한국 통합 \'QR페이\' 개발 착수차이나머니, 韓 장비기업 사냥...\'한스레이저\' 경쟁사 인수 추진삼성, 업계 최초 7.1채널 음향에 천장 4채널 덧붙인 사운드바 내놓는다협동로봇 시장 활성화 계기 마련했다. KIRIA 협동로봇 설치 작업장 안전인증제도 시행아우디 A3, 40% 할인 판매 진실은…""현금 \'No\', 리스만""좋아요0훈훈해요0슬퍼요0화나요0후속기사 원해요0기사제공 :']"
