,회사명,날짜,언론사,기사제목,링크,본문
14,삼성전자, 2018-11-2611:50,한국일보 ,LG이노텍 차량용 LED ‘넥슬라이드-L’ 개발,https://finance.naver.com/news/news_read.nhn?article_id=0000344816&office_id=469&mode=search&query=LG이노텍&page=1,"['       LG이노텍 차량용 LED ‘넥슬라이드-L’ 개발      기사입력2018-11-26 11:50기사원문좋아요훈훈해요좋아요 평가하기공감좋아요0훈훈해요0슬퍼요0화나요0후속기사 원해요0댓글디자인 완성도 높이는 신개념 초슬림 라인조명 모듈LG이노텍 직원이 광선폭은 3㎜에 불과하면서 고른 빛을 내는 차량 외장용 초슬림 라인조명 모듈 넥슬라이드-L을 살펴보고 있다. LG이노텍 제공LG이노텍이 자동차의 외관을 돋보이게 하는 신개념 발광다이오드(LED) 조명 ‘넥슬라이드(Nexlide)-L’을 개발했다고 26일 밝혔다. 이 제품은 후미등과 방향지시등 같은 외장 조명을 스마트폰 충전케이블 두께의 날렵한 선(線) 모양으로 디자인할 수 있는 초슬림 라인조명 모듈이다.넥슬라이드-L은 광(光)선폭이 3㎜로, 차량의 외장용 LED 조명 중 가장 얇다. 기존 제품 중에서는 8㎜가 최소 광선폭이었다.LG이노텍은 독자 개발한 ‘LED 발광 구조설계 기술’을 적용해 넥슬라이드-L을 완성했다. 점(點) 광원인 LED를 1m 이상의 선으로 구현하면서 처음부터 끝까지 고르게 빛나도록 하는 정교한 기술이다.넥슬라이드-L은 차량 디자인에 따라 조명을 매끄러운 직선, 곡선, 물결 등 여러 모양으로 적용할 수 있다. 조명 용도와 장착 위치에 따라 색과 밝기 맞춤 설계도 가능하다.표면 밝기가 최대 7,500니트라 브레이크 작동을 나타내는 제동등에 사용해도 손색이 없다. 7,500니트는 1㎡ 면적에 촛불 7,500개를 켜놓았을 때의 밝기를 의미한다. LG이노텍은 전조등, 주간주행등(DRL), 포지션 램프, 방향지시등, 사이드미러 램프, 차폭등, 제동등 같은 외장용뿐 아니라 룸 램프, 계기판 조명 등 내장용까지 총 20여 종의 차량용 LED 패키지ㆍ모듈을 보유했다. 여기에 새로 추가한 넥슬라이드-L을 앞세워 글로벌 차량용 LED 시장 공략에 속도를 낼 계획이다. LG이노텍은 완성차 업체들의 요구에 따라 넥슬라이드-L을 안정적으로 공급할 준비도 마쳤다.김창훈 기자 chkim@hankookilbo.com ▶한국일보 [페이스북] [카카오 친구맺기]▶네이버 채널에서 한국일보를 구독하세요!한국일보 관련뉴스해당 언론사에서 선정하며 언론사 페이지(아웃링크)로 이동해 볼 수 있습니다.흡연 제지했다고… 호텔 직원 뺨 때린 태국 기업가\'하얀 옷 맞춰 입고\' 동성 결혼 공개한 배우 성룡 딸""홍준표, 왜 바퀴벌레처럼 스멀스멀 기어 나오나""싸늘해진 이·영·자 민심 ""일자리커녕 알바도 힘들어""임원 감금 폭행한 민주노총 40분간 손놓은 경찰좋아요0훈훈해요0슬퍼요0화나요0후속기사 원해요0기사제공 :']"
15,삼성전자, 2018-11-2611:31,헤럴드경제 ,"LG이노텍, 차량용 초슬림 라인조명 개발",https://finance.naver.com/news/news_read.nhn?article_id=0001468951&office_id=016&mode=search&query=LG이노텍&page=1,"['       LG이노텍, 차량용 초슬림 라인조명 개발      기사입력2018-11-26 11:31기사원문좋아요훈훈해요좋아요 평가하기공감좋아요0훈훈해요0슬퍼요0화나요0후속기사 원해요0댓글광선폭 3㎜ 넥슬라이드-L 구현LG이노텍은 광(光)선폭 3㎜의 라인에서 밝고 고른 빛을 내는 차량용 초슬림 라인조명모듈 ‘넥슬라이드(Nexlide)-L’을 개발했다고 26일 밝혔다. 차량 외장용 LED 조명 중 라인이 가장 얇다. LG이노텍은 독자 개발한 ‘LED 발광 구조설계 기술’을 적용해 ‘넥슬라이드-L’을 구현했다. 점 광원인 LED를 이용해 얇고 긴 선을 구현하되, 라인 처음부터 끝까지 고르게 빛나도록 하는 기술이다.‘넥슬라이드-L’은 후미등, 방향지시등 같은 차량 외장 조명을 휴대폰 충전케이블 수준의 얇고 날렵한 선 모양으로 디자인 할 수 있어 자동차 외관을 한층 돋보이게 해준다. 조명의 용도와 장착 위치에 따라 컬러와 밝기도 맞춤 설계할 수 있다. 특히 표면 밝기가 최대 7500니트(nit)에 달해 브레이크 작동을 나타내는 제동등에도 적합하다. LG이노텍은 ‘넥슬라이드-L’ 등 차별화 제품을 앞세워 글로벌 차량용 LED 시장 공략에 더욱 속도를 낸다는 방침이다. 20여종의 차량용 LED 패키지·모듈을 보유하게 돼 차량용 LED 라인업도 강화됐다. LG이노텍 관계자는 “넥슬라이드-L은 차량의 디자인과 품질, 안전성을 모두 높일 수 있는 혁신적인 조명모듈”이라고 설명했다.\xa0손미정 기자/balme@▶헤럴드경제 채널 구독하고 신세계상품권 50만원 받자!▶생생한 리뷰 최저가 쇼핑 헤럴드 리얼라이프 ▶헤럴드경제 사이트 바로가기 - Copyrights ⓒ 헤럴드경제 & heraldbiz.com, 무단 전재 및 재배포 금지 -헤럴드경제 관련뉴스해당 언론사에서 선정하며 언론사 페이지(아웃링크)로 이동해 볼 수 있습니다.\'한때 연인\' 김혜수·유해진, 스킨십 \'쿨내 진동\'조국 마저 ""경제문제 해결, 부족함 많아…결과 책임을 져야""이언주 ""文 대통령 현실인식 심각한 수준, 대안 없이 거꾸로""""고생한 값, 꼭 받아라""…마이크로닷 부모에 돈 떼인 피해자 어머니의 유언""손흥민 골, 월드 클래스·아시아의 자랑""…일본도 반했다좋아요0훈훈해요0슬퍼요0화나요0후속기사 원해요0기사제공 :']"
16,삼성전자, 2018-11-2610:34,이데일리 ,"[특징주]LG이노텍, 트리플 카메라 비중 증가에 상승세",https://finance.naver.com/news/news_read.nhn?article_id=0004260085&office_id=018&mode=search&query=LG이노텍&page=1,"['       [특징주]LG이노텍, 트리플 카메라 비중 증가에 상승세      기사입력2018-11-26 10:34기사원문좋아요훈훈해요좋아요 평가하기공감좋아요0훈훈해요0슬퍼요0화나요0후속기사 원해요0댓글 [이데일리 박태진 기자] LG이노텍(011070)이 스마트폰에서 트리플 카메라 채택 비중이 높아지면서 상승세를 나타내고 있다.26일 오전 10시 32분 현재 LG이노텍 주가는 전일대비 3.30% 오른 9만7100원을 기록 중이다. 스마트폰 카메라가 듀얼에서 트리플로 진화하는 속도가 예상보다 빠른 만큼 카메라모듈 업체들의 실적 모멘텀도 클 것이라는 증권가 분석이 영향을 미친 것으로 풀이된다.김지산 키움증권 기업분석팀장은 “카메라모듈 업체들은 트리플 카메라 시대를 맞아 특히 판가 상승 효과가 클 것이고, 가동률 상승에도 긍정적일 것”이라며 “아이폰향 트리플 카메라 공급을 주도할 LG이노텍은 아이폰 판매 부진 우려에도 내년에 광학솔루션이 큰 폭으로 도약하는 확실한 계기가 될 것”이라고 분석했다.박태진 (tjpark@edaily.co.kr)선착순 \'5만명\' 한정, KFC 쿠폰이 공짜~ [오만한 이벤트▶]빡침해소! 청춘뉘우스~ [스냅타임▶]총 경품 1억원! 당첨인원 5만명![경품 타가세요▶]＜ⓒ종합 경제정보 미디어 이데일리 - 무단전재 & 재배포 금지＞이데일리 관련뉴스해당 언론사에서 선정하며 언론사 페이지(아웃링크)로 이동해 볼 수 있습니다.\'삼촌패키지\' 350만원…학교폭력 해결사 찾는 부모들하태경 ""이재명, 탈당할 준비 끝났다…반문 야당선언""이정렬, 혜경궁 김씨 소송 계속 맡는다 ""다시 신발끈 동여매고""청와대 국민청원 제도 폐지를 청원합니다MBC 장인수 기자 ""조선일보 손녀 막말 논란, 갑질 넘어선 계급질""좋아요0훈훈해요0슬퍼요0화나요0후속기사 원해요0기사제공 :']"
17,삼성전자, 2018-11-2609:49,한국경제TV ,"LG이노텍, 차량용 초슬림 라인조명 개발",https://finance.naver.com/news/news_read.nhn?article_id=0000708089&office_id=215&mode=search&query=LG이노텍&page=1,"['       LG이노텍, 차량용 초슬림 라인조명 개발      기사입력2018-11-26 09:49기사원문좋아요훈훈해요좋아요 평가하기공감좋아요0훈훈해요0슬퍼요0화나요0후속기사 원해요0댓글[한국경제TV 김치형 기자]LG이노텍(대표 박종석)은 광(光)선폭 3밀리미터(mm)의 가느다란 라인(line)에서 밝고 고른 빛을 내는 차량용 초슬림 라인조명모듈 ‘넥슬라이드(Nexlide)-L’을 개발했다고 26일 밝혔습니다.차량 외장용 LED 조명 중 가장 얇은 라인을 구현한 것으로, 기존 제품은 최소 광선폭이 8mm 정도였습니다.LG이노텍은 독자 개발한 ‘LED 발광 구조설계 기술’을 적용해 ‘넥슬라이드-L’을 구현했다며 본래 점(點) 광원인 LED를 이용해 얇고 긴 선을 구현하되, 라인 처음부터 끝까지 고르게 빛나도록 하는 정교한 기술이라고 설명했습니다.LG이노텍은 ‘넥슬라이드-L’은 차량 컨셉에 따라 조명을 직선, 곡선, 물결 등 여러 모양으로 슬림하고 매끄럽게 만들 수 있어 자동차 디자인을 차별화하고 완성도를 높이는 데 활용도가 높을 것으로 예상했습니다.또한 조명의 용도와 장착 위치에 따라 컬러와 밝기를 맞춤 설계할 수 있어 제동등과 보조제동등(CHMSL, Center High Mounted Stop Lamp)은 레드, 방향지시등과 사이드미러 램프는 옐로우, 포지션 램프는 화이트와 같이 다양하게 제작할 수 있는 길도 열어줄 것이라고 말했습니다.LG이노텍은 이로써 전조등, 주간주행등(DRL, Daytime Running Lights), 포지션 램프, 방향지시등, 사이드미러 램프, 차폭등, 제동등, 보도제동등과 같은 외장용뿐만 아니라 룸 램프, 계기판 조명 등 내장용까지 총 20여 종의 차량용 LED 패키지·모듈을 보유하게 됐습니다.김치형기자 chkim@wowtv.co.kr▶ No1. 경제/증권방송 보며 채팅하기 [유튜브][페이스북]▶ 대한민국 재테크 총집결 [한국경제TV 사이트 바로가기]ⓒ 한국경제TV, 무단 전재 및 재배포 금지한국경제TV 관련뉴스해당 언론사에서 선정하며 언론사 페이지(아웃링크)로 이동해 볼 수 있습니다.문 대통령 지지도 취임 후 최저…""이영자 때문""임종석, 첫 눈 보며 \'만주와 대륙\' 떠올린 이유입소문 난 5.5% 적금…""줄서도 못 사요""""학교 올 때 비싼 패딩 입지마"" 고교 금지령…사연은이재명의 위기...""역린을 건드린 대가""좋아요0훈훈해요0슬퍼요0화나요0후속기사 원해요0기사제공 :']"
18,삼성전자, 2018-11-2609:45,노컷뉴스 ,車 후미등 정교하게 꾸밀수 있는 LED 조명 개발됐다,https://finance.naver.com/news/news_read.nhn?article_id=0003169178&office_id=079&mode=search&query=LG이노텍&page=1,"['       車 후미등 정교하게 꾸밀수 있는 LED 조명 개발됐다      기사입력2018-11-26 09:45기사원문좋아요훈훈해요좋아요 평가하기공감좋아요0훈훈해요0슬퍼요0화나요0후속기사 원해요0댓글광선폭 3mm로 기존 8mm의 절반 이하[CBS노컷뉴스 이용문 기자](사진=LG이노텍)자동차 후미등과 방향지시등을 휴대폰 충전케이블 수준의 얇고 날렵한 선 모양으로 디자인할 수 있는 LED 조명이 나온다.LG이노텍은 광 선폭 3밀리미터(mm)의 가느다란 라인(line)에서 밝고 고른 빛을 내는 차량용 초슬림 라인조명모듈 \'넥슬라이드(Nexlide)-L\'을 개발했다고 26일밝혔다. 넥슬라이드는 차량 외장용 LED 조명 중 가장 얇은 라인을 구현한다고 이노텍은 설명했다.기존 차량용 LED 라인은 최소 광선폭이 8mm 정도였다.차량 조명은 자동차의 정체성을 드러내고 첫 인상을 결정짓는 중요한장치로 자동차 제조업체들이 신차를 개발할대 빠짐없이 새로 디자인 하는 곳이다. LG이노텍은 \'넥슬라이드-L\'은 차량 컨셉에 따라 조명을 직선과 곡선, 물결 등 여러 모양으로 만들수 있어 자동차 디자인을 차별화하고 완성도를 높이는 데 좋다고 소개했다. ▶ 확 달라진 노컷뉴스▶ 정의로운 노컷뉴스 구독하기▶ 화끈한 노컷V 감상하기mun8510@cbs.co.kr저작권자 © CBS 노컷뉴스 무단전재 및 재배포 금지노컷뉴스 관련뉴스해당 언론사에서 선정하며 언론사 페이지(아웃링크)로 이동해 볼 수 있습니다.주판알만 튕기는 선거제도...與 \'변심\'에 개혁 후퇴 우려文대통령, 집권후 \'최저 지지율\'…8주째 하락해 52%로\'이재명 제명시위\'와 이재명의 \'이간계 주장\'하태경 ""이재명 반문선언"" vs 이재명측 ""하태경 이간질 당사자""해고·실직자도 노조한다? 해외에선 \'오래된 상식\'좋아요0훈훈해요0슬퍼요0화나요0후속기사 원해요0기사제공 :']"
19,삼성전자, 2018-11-2609:36,뉴시스 ,"LG이노텍, 차량용 초슬림 라인조명 '넥슬라이드-L' 개발",https://finance.naver.com/news/news_read.nhn?article_id=0008929487&office_id=003&mode=search&query=LG이노텍&page=1,"['       LG이노텍, 차량용 초슬림 라인조명 \'넥슬라이드-L\' 개발      기사입력2018-11-26 09:36기사원문좋아요훈훈해요좋아요 평가하기공감좋아요0훈훈해요0슬퍼요0화나요0후속기사 원해요0댓글광선폭 3mm의 얇고 균일한 LED 빛조명 용도 따라 모양, 컬러, 밝기 맞춤 가능【서울=뉴시스】LG이노텍은 광(光)선폭 3밀리미터(mm)의 가느다란 라인(line)에서 밝고 고른 빛을 내는 차량용 초슬림 라인조명모듈 \'넥슬라이드(Nexlide)-L\'을 개발했다고 26일 밝혔다. 사진은 LG이노텍 직원이 차량용 초슬림 라인조명모듈 ‘넥슬라이드-L’을 살펴보고 있는 모습. 2018.11.26 (사진 = LG이노텍 제공) photo@newsis.com【서울=뉴시스】이종희 기자 = LG이노텍이 자동차 외관을 한층 돋보이게 하는 신개념 LED 조명모듈을 공개했다. 이 제품은 후미등, 방향지시등 같은 차량 외장 조명을 휴대폰 충전케이블 수준의 얇고 날렵한 선(線) 모양으로 디자인됐다. LG이노텍은 광(光)선폭 3밀리미터(mm)의 가느다란 라인(line)에서 밝고 고른 빛을 내는 차량용 초슬림 라인조명모듈 \'넥슬라이드(Nexlide)-L\'을 개발했다고 26일 밝혔다. 이번에 개발된 라인조명모듈은 차량 외장용 LED 조명 중 가장 얇은 라인을 구현한다. 기존 제품은 최소 광선폭이 8mm 정도였다.LG이노텍은 독자 개발한 \'LED 발광 구조설계 기술\'을 적용해 \'넥슬라이드-L\'을 구현했다. 본래 점(點) 광원인 LED를 이용해 얇고 긴 선을 구현하되, 라인 처음부터 끝까지 고르게 빛나도록 하는 정교한 기술이다.LG이노텍 \'넥슬라이드-L\'은 자동차 디자인을 차별화하고 완성도를 높이는 데 좋다. 차량 컨셉에 따라 조명을 직선, 곡선, 물결 등 여러 모양으로 슬림하고 매끄럽게 만들 수 있어서다. 조명을 1미터(m) 이상 길게 만들어도 밝기 차이에 따른 얼룩이나 끊김이 없을 만큼 고품질이다.특히 \'넥슬라이드-L\'은 조명의 용도와 장착 위치에 따라 컬러와 밝기를 맞춤 설계할 수 있다. 제동등과 보조제동등(CHMSL)은 레드, 방향지시등과 사이드미러 램프는 옐로우, 포지션 램프는 화이트와 같이 다양하게 제작할 수 있다.또한 \'넥슬라이드-L\'은 표면 밝기가 최대 7500니트(nit)에 달해 브레이크 작동을 나타내는 제동등에 사용해도 손색 없다. 이는 1제곱미터(m2) 면적에 촛불 7500개를 켜놓은 정도로 매우 밝다는 의미다. LCD TV 화면 밝기가 1000~2000nit 수준이다.LG이노텍은 \'넥슬라이드-L\' 등 차별화 제품을 앞세워 글로벌 차량용 LED 시장 공략에 더욱 속도를 낸다는 방침이다. 고객 요구에 따라 안정적으로 공급할 준비를 이미 마쳤다. 이 제품 관련 총 200여건에 이르는 기술 특허를 보유했고 생산 설비 및 품질 관리 기반도 갖췄다.아울러 LG이노텍은 이번 \'넥슬라이드-L\' 개발로 차량용 LED 라인업을 한층 강화했다. 이 회사는 전조등, 주간주행등(DRL), 포지션 램프, 방향지시등, 사이드미러 램프, 차폭등, 제동등, 보도제동등과 같은 외장용뿐만 아니라 룸 램프, 계기판 조명 등 내장용까지 총 20여 종의 차량용 LED 패키지·모듈을 보유하게 됐다.시장 전망도 밝다. 시장조사기관 스트레티지스 언리미티드(Strategies Unlimited)에 따르면 차량용 LED 시장은 지난해 20억 8000만달러에서 2020년 31억 7000만 달러로 52% 확대될 전망이다.LG이노텍 관계자는 ""넥슬라이드-L은 차량의 디자인과 품질, 안전성을 모두 높일 수 있는 혁신적인 조명모듈""이라며 ""완성도 높은 차량 조명으로 자동차 제조사와 운전자 모두 만족하게 될 것으로 기대한다""고 말했다.2papers@newsis.com▶ 뉴시스 빅데이터 MSI 주가시세표 바로가기 ▶ 뉴시스 SNS [페이스북] [트위터]<저작권자ⓒ 공감언론 뉴시스통신사. 무단전재-재배포 금지.>뉴시스 관련뉴스해당 언론사에서 선정하며 언론사 페이지(아웃링크)로 이동해 볼 수 있습니다.\'직원 성추행\' 대학교수, 집행유예…역고소도 유죄\'유흥탐정\' 보고 따라해 18일 간 2000만원 번 30대교제 요구하며 5일 동안 200회 문자 보낸 30대여성 유죄 확정홍준표 ""이재명 \'문준용\' 언급은 막장드라마…朴정권때 같아""동거남에게 숨기려고 몰래 애낳은 뒤 신생아 방치해 죽게한 산모좋아요0훈훈해요0슬퍼요0화나요0후속기사 원해요0기사제공 :']"
0,삼성전자, 2018-11-2609:26,뉴스1 ,"'3mm 초슬림'…LG이노텍, 차량용 라인조명 개발",https://finance.naver.com/news/news_read.nhn?article_id=0003709594&office_id=421&mode=search&query=LG이노텍&page=2,"['       \'3mm 초슬림\'…LG이노텍, 차량용 라인조명 개발      기사입력2018-11-26 09:26기사원문좋아요훈훈해요좋아요 평가하기공감좋아요0훈훈해요0슬퍼요0화나요0후속기사 원해요0댓글""차량 외장용 LED 조명 중 가장 얇은 라인 구현""차량용 초스림 라인조명모듈 \'넥슬라이드-L\'(LG이노텍 제공) © News1(서울=뉴스1) 류석우 기자 = LG이노텍이 광(光)선폭 3밀리미터(mm)의 가느다란 라인에서 밝고 고른 빛을 내는 차량용 초슬림 라인조명모듈 \'넥슬라이드(Nexlide)-L\'을 개발했다고 26일 밝혔다. 차량 외장용 LED 조명 중 가장 얇은 라인을 구현한다. LG이노텍은 독자 개발한 \'LED 발광 구조설계 기술\'을 적용해 \'넥슬라이드-L\'을 개발했다. 본래 점(點) 광원인 LED를 이용해 얇고 긴 선을 구현하되, 라인 처음부터 끝까지 고르게 빛나도록 하는 정교한 기술이다.특히 \'넥슬라이드-L\'은 조명의 용도와 장착 위치에 따라 컬러와 밝기를 맞춤 설계할 수 있다. 제동등과 보조제동등은 레드, 방향지시등과 사이드미러 램프는 옐로우, 포지션 램프는 화이트와 같이 다양하게 제작할 수 있다.\'넥슬라이드-L\'은 표면 밝기가 최대 7500니트(nit, cd/㎡)다. 브레이크 작동을 나타내는 제동등에 사용할 수 있다. 7500니트 밝기는 1제곱미터(m2) 면적에 촛불 7500개를 켜놓은 정도의 밝기를 의미한다. LCD TV 화면 밝기가 1000~2000nit 수준이다.LG이노텍은 \'넥슬라이드-L\' 등 차별화 제품을 앞세워 글로벌 차량용 LED 시장 공략에 더욱 속도를 낸다는 계획이다. 고객 요구에 따라 안정적으로 공급할 준비도 이미 마쳤다. LG이노텍 관계자는 ""넥슬라이드-L은 차량의 디자인과 품질, 안전성을 모두 높일 수 있는 혁신적인 조명 모듈""이라며 ""완성도 높은 차량 조명으로 자동차 제조사와 운전자 모두 만족하게 될 것으로 기대한다""고 말했다.sewryu@news1.kr▶ 진짜 블록체인을 만나는 곳 \'크립토허브\' 오픈! ▶ [페이스북] 바로가기! ▶ 갤럭시워치행운&기프티콘 무조건 받기![© 뉴스1코리아(news1.kr), 무단 전재 및 재배포 금지]뉴스1 관련뉴스해당 언론사에서 선정하며 언론사 페이지(아웃링크)로 이동해 볼 수 있습니다.이정렬, 혜경궁 김씨 사건 다시 맡아…""신발끈 동여맬것""北전문여행사, 첫 남한 관광 개시…\'김일성 별장\' 투어도인천 조폭, 연장 챙겨 광주로 보복 원정…왜?명품매장 피팅룸서 보안태그 떼고 가방에 \'쏙\'""생활비 없어서""…금은방 털어간 우즈벡 부부좋아요0훈훈해요0슬퍼요0화나요0후속기사 원해요0기사제공 :']"
1,삼성전자, 2018-11-2609:14,아이뉴스24 ,"LG이노텍, 차량용 초슬림 라인조명모듈 '넥슬라이드-L' 개발",https://finance.naver.com/news/news_read.nhn?article_id=0000473330&office_id=031&mode=search&query=LG이노텍&page=2,"['       LG이노텍, 차량용 초슬림 라인조명모듈 \'넥슬라이드-L\' 개발      기사입력2018-11-26 09:14기사원문좋아요훈훈해요좋아요 평가하기공감좋아요0훈훈해요0슬퍼요0화나요0후속기사 원해요0댓글 <아이뉴스24>[아이뉴스24 윤선훈 기자] LG이노텍이 광(光)선폭 3밀리미터(mm)의 가느다란 라인에서 밝고 고른 빛을 내는 차량용 초슬림 라인조명모듈 \'넥슬라이드(Nexlide)-L\'을 개발했다고 26일 밝혔다.이 제품은 차량 외장용 LED 조명 중 가장 얇은 라인을 구현한다. 기존 제품은 최소 광선폭이 8mm 정도였다.넥슬라이드-L에는 독자 개발한 \'LED 발광 구조설계 기술\'을 적용했다. 본래 점(點) 광원인 LED를 이용해 얇고 긴 선을 구현하되, 라인 처음부터 끝까지 고르게 빛나도록 하는 정교한 기술이다.최근 광원 기술 발전으로 한층 다양한 디자인의 조명이 차량에 적용되고 있다. LG이노텍은 이 제품을 통해 후미등, 방향지시등 같은 차량 외장 조명을 휴대폰 충전케이블 수준의 얇고 날렵한 선(線) 모양으로 디자인할 수 있다고 강조했다.차량 컨셉에 따라 조명을 직선, 곡선, 물결 등 여러 모양으로 슬림하고 매끄럽게 만들 수 있다. 조명을 1미터(m) 이상 길게 만들어도 밝기 차이에 따른 얼룩이나 끊김이 없다는 것이 회사 측의 설명이다.특히 조명의 용도와 장착 위치에 따라 컬러와 밝기를 맞춤 설계할 수 있다. 예를 들면 제동등과 보조제동등(Center High Mounted Stop Lamp)은 레드, 방향지시등과 사이드미러 램프는 옐로우, 포지션 램프는 화이트와 같이 제작하는 식이다.표면 밝기는 최대 7천500니트(nit, cd/㎡)에 달해 브레이크 작동을 나타내는 제동등에 사용해도 손색없다. 1㎡ 면적에 촛불 7천500개를 켜 놓은 정도다.LG이노텍은 \'넥슬라이드-L\' 등 차별화 제품을 앞세워 글로벌 차량용 LED 시장 공략에 더욱 속도를 낸다는 방침이다. 고객 요구에 따라 안정적인 양산 준비도 마쳤다. 제품 관련 총 200여건에 이르는 기술 특허를 보유했고 생산 설비 및 품질 관리 기반도 갖췄다.LG이노텍은 또 \'넥슬라이드-L\'을 통해 전조등, 주간주행등(Daytime Running Lights), 포지션 램프, 방향지시등, 사이드미러 램프, 차폭등, 제동등, 보도제동등과 같은 외장용뿐만 아니라 룸 램프, 계기판 조명 등 내장용까지 총 20여종의 차량용 LED 패키지·모듈을 보유하게 됐다.LG이노텍 관계자는 ""넥슬라이드-L은 차량의 디자인과 품질, 안전성을 모두 높일 수 있는 혁신적인 조명모듈""이라며 ""완성도 높은 차량 조명으로 자동차 제조사와 운전자 모두 만족하게 될 것으로 기대한다""고 말했다.시장조사기관 스트레티지스 언리미티드(Strategies Unlimited)에 따르면 차량용 LED 시장은 지난해 20억8천만달러에서 2020년 31억7천만달러로 52% 확대될 전망이다./윤선훈기자 krel@inews24.com▶네이버 채널에서 \'아이뉴스24\'를 구독해주세요.▶아이뉴스TV에서 부동산 고수를 만나보세요.[ⓒ 아이뉴스24 무단전재 및 재배포 금지]아이뉴스24 관련뉴스해당 언론사에서 선정하며 언론사 페이지(아웃링크)로 이동해 볼 수 있습니다.황교안 ""文정부, 멀쩡한 경제 망가뜨리는 정책실험 계속해.. 정말 걱정""한국, 수출 경쟁력우위 주력업종 3년 뒤 中에 밀려…조선만 남아[종합] KT ""소상공인에 라우터 지급, 보상안 마련""""다음은 내 차례"" …\'로아\' 흥행 이을 온라인 게임은?좋아요0훈훈해요0슬퍼요0화나요0후속기사 원해요0기사제공 :']"
