,회사명,날짜,언론사,기사제목,링크,본문
2,삼성전자, 2018-11-2609:06,파이낸셜뉴스 ,"LG이노텍, '넥슬라이드-L'로 더 날렵한 자동차 조명 만든다",https://finance.naver.com/news/news_read.nhn?article_id=0004133064&office_id=014&mode=search&query=LG이노텍&page=2,"['       LG이노텍, \'넥슬라이드-L\'로 더 날렵한 자동차 조명 만든다      기사입력2018-11-26 09:06기사원문좋아요훈훈해요좋아요 평가하기공감좋아요0훈훈해요0슬퍼요0화나요0후속기사 원해요0댓글      LG이노텍 직원이 차량용 초슬림 라인조명모듈 ‘넥슬라이드-L’을 살펴보고 있다.   LG이노텍이 전장 제품 개발에 가속도를 내고 있다. LG이노텍이 이번에 선보인 제품은 광(光) 선폭을 획기적으로 줄인 발광다이오드(LED) 조명모듈이다. 이 제품은 후미등, 방향지시등 같은 차량 외장 조명을 휴대폰 충전케이블 수준으로 얇고 날렵하게 설치할 수 있게 해준다.  LG이노텍은 폭 3㎜의 가느다란 선에서 밝고 고른 빛을 내는 차량용 라인조명모듈 ‘넥슬라이드(Nexlide)-L’을 개발했다고 26일 밝혔다. 이 제품은 차량 외장용 LED 조명 중 가장 얇다. 기존 제품은 광선폭이 최소 8㎜ 정도였다.  차량 조명은 자동차의 정체성을 드러내고 첫 인상을 결정짓는 중요한 장치다. 신차 개발 시 빠짐없이 새로 디자인 하는 곳이 바로 조명이다. 신제품은 자동차 디자인을 차별화하는 데 유용하다. 조명을 직선, 곡선, 물결 등 여러 모양으로 얇고 매끄럽게 만들 수 있어서다. 조명을 1m 이상 길게 만들어도 밝기가 고르다.  넥슬라이드-L은 조명의 용도와 장착 위치에 따라 색깔와 밝기를 맞춤 설계할 수 있다. 예컨대 제동등과 보조제동등(CHMSL)은 적색, 방향지시등과 사이드미러 램프는 황색, 포지션 램프는 흰색으로 다양하게 제작할 수 있다.  이 제품은 표면 밝기가 최대 7500nit에 달한다. 1㎡ 면적에 촛불 7500개를 켜놓은 정도로 밝다는 의미다. 일반적인 액정표시장치(LCD) TV 화면 밝기가 1000~2000nit 수준이라는 점을 고려해보면, 매우 밝은 빛을 내뿜는다는 것을 알 수 있다. 따라서 이 제품은 브레이크 작동을 나타내는 제동등에도 사용될 수 있다.  LG이노텍은 이번 신제품으로 차량용 LED 라인업을 한층 강화할 수 있게 됐다. 전조등, 주간주행등(DRL), 포지션 램프, 방향지시등, 사이드미러 램프, 차폭등, 제동등, 보도제동등과 같은 외장용뿐만 아니라 룸 램프, 계기판 조명 등 내장용까지 총 20여종의 차량용 LED 패키지·모듈을 보유하고 있다.  LG이노텍은 이번 신제품을 앞세워 시장 선점에 적극 나서겠다는 방침이다. LG이노텍은 고객 요구에 따라 안정적으로 넥슬라이드-L을 공급할 준비를 마쳤다. 총 200여건에 이르는 기술 특허를 보유했고 생산 설비 및 품질 관리 기반도 갖췄다. 시장조사기관 스트레티지스 언리미티드(Strategies Unlimited)에 따르면 차량용 LED시장은 지난해 20억8000만달러에 달했다. 오는 2020년이면 31억7000만달러로 52% 확대될 전망이다.   ktop@fnnews.com 권승현 기자   ▶ 세상의 모든 골 때리는 이야기 \'fn파스\'▶ 속보이는 연예뉴스 fn스타  ※ 저작권자 ⓒ 파이낸셜뉴스. 무단 전재-재배포 금지파이낸셜뉴스 관련뉴스해당 언론사에서 선정하며 언론사 페이지(아웃링크)로 이동해 볼 수 있습니다.모텔에 있던 조폭, 완전무장한 형사 60명이 쳐들어오자..실내흡연 말리는 호텔직원 뺨따귀.. 상상초월 갑질男의 정체\'사귀어 달라\' 236회 문자 보낸 사람에 내려진 형벌조국 민정수석, 文지지율 떨어지자 SNS에 남긴 말문준용 언급한 이재명 대한 하태경의 예언 ""이 지사는..""좋아요0훈훈해요0슬퍼요0화나요0후속기사 원해요0기사제공 :']"
3,삼성전자, 2018-11-2608:57,이데일리 ,"LG이노텍, 차량용 초슬림 라인조명 ‘넥슬라이드-L’ 개발",https://finance.naver.com/news/news_read.nhn?article_id=0004259952&office_id=018&mode=search&query=LG이노텍&page=2,"['       LG이노텍, 차량용 초슬림 라인조명 ‘넥슬라이드-L’ 개발      기사입력2018-11-26 08:57기사원문좋아요훈훈해요좋아요 평가하기공감좋아요0훈훈해요0슬퍼요0화나요0후속기사 원해요0댓글- 3mm의 광선폭으로 자동차 외관 한층 돋보이는 효과- 독자 개발한 \'\'LED 발광 구조설계 기술\'\' 적용해- ""디자인과 품질, 안전성 모두 높일 수 있는 제품""LG이노텍 직원이 차량용 초슬림 라인조명모듈 ‘넥슬라이드-L’을 살펴보고 있다. 이 제품은 광(光)선폭 3mm의 슬림 라인에 고른 빛을 내 자동차 디자인완성도를 높일 수 있다. [사진=LG이노텍 제공][이데일리 김종호 기자] LG이노텍(011070)은 광(光)선폭 3mm의 가느다란 라인(line)에서 밝고 고른 빛을 내는 차량용 초슬림 라인조명모듈 ‘넥슬라이드(Nexlide)-L’을 개발했다고 26일 밝혔다. 이 제품은 자동차 외관을 한층 돋보이게 하는 신개념 LED 조명모듈로, 후미등과 방향지시등 같은 차량 외장 조명을 휴대폰 충전케이블 수준의 얇고 날렵한 선(線) 모양으로 디자인 할 수 있는 혁신 제품이다.LG이노텍은 독자 개발한 ‘LED 발광 구조설계 기술’을 적용해 넥슬라이드-L을 구현했다. LED 발광 구조설계 기술은 본래 점(點) 광원인 LED를 이용해 얇고 긴 선을 구현하되, 라인 처음부터 끝까지 고르게 빛나도록 하는 정교한 기술이다. 넥슬라이드(Nexlide)-L은 기존 제품의 최소 광선폭(8mm)을 3mm까지 줄인 가장 얇은 라인으로 차량 컨셉에 따라 조명을 직선과 곡선, 물결 등 여러 모양으로 만들어 디자인을 차별화 시킬 수 있다. 조명을 1미터(m) 이상 길게 만들어도 밝기 차이에 따른 얼룩이나 끊김이 없을 만큼 고품질을 자랑한다.특히 넥슬라이드-L은 조명 용도와 장착 위치에 따라 컬러와 밝기를 맞춤 설계할 수 있다. 제동등과 보조제동등은 레드, 방향지시등과 사이드미러 램프는 옐로우, 포지션 램프는 화이트와 같이 다양하게 제작할 수 있다.LG이노텍은 이번에 개발한 넥슬라이드-L 등 차별화 제품을 앞세워 글로벌 차량용 LED 시장 공략에 더욱 속도를 낸다는 방침이다. 고객 요구에 따라 안정적으로 공급할 준비를 이미 마쳤다. 이 제품 관련 총 200여 건에 이르는 기술 특허를 보유했고 생산 설비 및 품질 관리 기반도 갖췄다. LG이노텍의 한 관계자는 “넥슬라이드-L은 차량의 디자인과 품질, 안전성을 모두 높일 수 있는 혁신적인 조명모듈”이라며 “완성도 높은 차량 조명으로 자동차 제조사와 운전자 모두 만족하게 될 것으로 기대한다”고 말했다.김종호 (kona@edaily.co.kr)＜ⓒ종합 경제정보 미디어 이데일리 - 무단전재 & 재배포 금지＞이데일리 관련뉴스해당 언론사에서 선정하며 언론사 페이지(아웃링크)로 이동해 볼 수 있습니다.수도권 이어 서울도 \'입주 폭탄\'..전셋값 두달새 1억~2억원 \'뚝\'도끼 ""1천만원이면 한 달 밥값 해명 논란""...母 ""아들 돈 맘대로 못해""성폭력 피해자답지 않았다 1심 무죄 안희정…2심서 뒤집히나""혜경궁 김씨=하태경?"" 가짜뉴스 수사 의뢰한 하태경확 꺾인 부동산 심리…집값 하락 응답 최대폭 급증좋아요0훈훈해요0슬퍼요0화나요0후속기사 원해요0기사제공 :']"
4,삼성전자, 2018-11-2608:38,아시아경제 ,"LG이노텍, 차량용 초슬림 LED 조명 ‘넥슬라이드-L’ 개발",https://finance.naver.com/news/news_read.nhn?article_id=0004363409&office_id=277&mode=search&query=LG이노텍&page=2,"['       LG이노텍, 차량용 초슬림 LED 조명 ‘넥슬라이드-L’ 개발      기사입력2018-11-26 08:38기사원문좋아요훈훈해요좋아요 평가하기공감좋아요0훈훈해요0슬퍼요0화나요0후속기사 원해요0댓글LG이노텍, 차량용 초슬림 라인조명 ‘넥슬라이드-L’[아시아경제 이정민 기자] LG이노텍은 광(光)선폭 3mm의 차량용 라인조명 모듈 ‘넥슬라이드(Nexlide)-L’을 개발했다고 26일 밝혔다. LG이노텍은 독자 개발한 LED 발광 구조설계 기술을 적용해 ‘넥슬라이드-L’을 구현했다. 본래 점(點) 광원인 LED를 이용해 얇고 긴 선을 구현하면서 라인 처음부터 끝까지 고르게 빛을 내도록 했다. 회사 관계자는 ""차량 외장용 LED 조명 중 가장 얇은 라인을 구현한다. 기존 제품은 최소 광선폭이 8mm 정도다""라고 설명했다.넥슬라이드-L은 차량 콘셉트에 따라 조명을 직선, 곡선, 물결 등 여러 모양으로 만들 수 있다. 조명을 1m 이상 길게 만들어도 밝기 차이에 따른 얼룩이나 끊김이 없다. 조명의 용도와 장착 위치에 따라 컬러와 밝기도 맞춤 설계할 수 있다. 제동등과 보조제동등은 적색, 방향지시등과 사이드미러 램프는 황색, 포지션 램프는 백색과 같이 다양하게 제작할 수 있다.LG이노텍은 넥슬라이드-L까지 총 20여종의 차량용 LED 패키지·모듈을 보유하게 됐다. 경쟁력 있는 제품을 앞세워 글로벌 차량용 LED 시장을 공략한다는 방침이다. 시장조사기관 스트레티지스 언리미티드에 따르면 차량용 LED 시장은 지난해 20억8000만달러에서 2020년 31억7000만달러로 52% 확대될 전망이다.LG이노텍 관계자는 “넥슬라이드-L은 차량의 디자인과 품질, 안전성을 모두 높일 수 있는 혁신적인 조명모듈”이라며 “완성도 높은 차량 조명으로 자동차 제조사와 운전자 모두 만족하게 될 것으로 기대한다”고 말했다.이정민 기자 ljm1011@asiae.co.kr▶ 아시아경제 친구 맺고 \'휴대폰, LED마스크\' 받자▶ 재미와 신기 \'과학을읽다\' ▶ 놀라운 \'군사이야기\'<ⓒ경제를 보는 눈, 세계를 보는 창 아시아경제 무단전재 배포금지>아시아경제 관련뉴스해당 언론사에서 선정하며 언론사 페이지(아웃링크)로 이동해 볼 수 있습니다.""또 나서는 임종석… \'호들갑\'\' 지나치다""""안희정·이재명 다음엔 박원순? 천만의 말씀""北 \'김정은 참수작전\' 내용 해킹, 軍 긴급히…""다시 한다"" 13시간 만에 말 바꾼 이정렬, 이유가18세 소녀 감방으로 불러서…\'잔혹한 범죄\'좋아요0훈훈해요0슬퍼요0화나요0후속기사 원해요0기사제공 :']"
5,삼성전자, 2018-11-2608:36,헤럴드경제 ,"LG이노텍, 차량용 초슬림 라인조명 ‘넥슬라이드(Nexlide)-L’ 개발",https://finance.naver.com/news/news_read.nhn?article_id=0001468732&office_id=016&mode=search&query=LG이노텍&page=2,"['       LG이노텍, 차량용 초슬림 라인조명 ‘넥슬라이드(Nexlide)-L’ 개발      기사입력2018-11-26 08:36기사원문좋아요훈훈해요좋아요 평가하기공감좋아요0훈훈해요0슬퍼요0화나요0후속기사 원해요0댓글 LG이노텍 직원이 차량용 초슬림 라인조명모듈 ‘넥슬라이드-L’을 살펴보고 있다. 이 제품은 광(光)선폭 3mm의 슬림 라인에 고른 빛을 내 자동차 디자인 완성도를 높일 수 있다. 또한 조명 용도에 따라 컬러와 모양, 밝기를 맞춤 제작할 수 있다.[제공=LG이노텍]- 차량용 LED 시장 공략 박차- “차량의 디자인과 품질, 안전성을 모두 높일 수 있는 혁신적인 조명모듈”[헤럴드경제=손미정 기자] LG이노텍은 광(光)선폭 3mm의 라인에서 밝고 고른 빛을 내는 차량용 초슬림 라인조명모듈 ‘넥슬라이드(Nexlide)-L’을 개발했다고 26일 밝혔다. 차량 외장용 LED 조명 중 라인이 가장 얇다. LG이노텍은 독자 개발한 ‘LED 발광 구조설계 기술’을 적용해 ‘넥슬라이드-L’을 구현했다. 점 광원인 LED를 이용해 얇고 긴 선을 구현하되, 라인 처음부터 끝까지 고르게 빛나도록 하는 기술이다.‘넥슬라이드-L’은 후미등, 방향지시등 같은 차량 외장 조명을 휴대폰 충전케이블 수준의 얇고 날렵한 선 모양으로 디자인 할 수 있어 자동차 외관을 한층 돋보이게 해준다. 차량 콘셉트에 따라 조명을 직선, 곡선, 물결 등 여러 모양으로 만들 수 있으며, 조명을 1m 이상 길게 만들어도 밝기 차이에 따른 얼룩이나 끊김이 없다. 조명의 용도와 장착 위치에 따라 컬러와 밝기도 맞춤 설계할 수 있다. 특히 표면 밝기가 최대 7500니트(nit)에 달해 브레이크 작동을 나타내는 제동등에도 적합하다. LG이노텍은 ‘넥슬라이드-L’ 등 차별화 제품을 앞세워 글로벌 차량용 LED 시장 공략에 더욱 속도를 낸다는 방침이다. LG이노텍은 이 제품과 관련해 200여건의 기술 특허를 보유했고, 생산 설비 및 품질 관리 기반도 갖췄다.차량용 LED 라인업도 강화됐다. LG이노텍은 ‘넥슬라이드-L’ 개발로 전조등, 주간주행등(DRL), 포지션 램프, 방향지시등, 사이드미러 램프, 차폭등, 제동등, 보도제동등과 같은 외장용뿐만 아니라 룸 램프, 계기판 조명 등 내장용까지 20여종의 차량용 LED 패키지·모듈을 보유하게 됐다.LG이노텍 관계자는 “넥슬라이드-L은 차량의 디자인과 품질, 안전성을 모두 높일 수 있는 혁신적인 조명모듈”이라며 “완성도 높은 차량 조명으로 자동차 제조사와 운전자 모두 만족하게 될 것으로 기대한다”고 말했다.balme@heraldcorp.com▶헤럴드경제 채널 구독하고 신세계상품권 50만원 받자!▶생생한 리뷰 최저가 쇼핑 헤럴드 리얼라이프 ▶헤럴드경제 사이트 바로가기 - Copyrights ⓒ 헤럴드경제 & heraldbiz.com, 무단 전재 및 재배포 금지 -헤럴드경제 관련뉴스해당 언론사에서 선정하며 언론사 페이지(아웃링크)로 이동해 볼 수 있습니다.이언주 ""文 대통령 현실인식 심각한 수준, 대안 없이 거꾸로""하태경 ""문준용 언급 이재명, 반문 선언…탈당 준비 낢조국 마저 ""경제문제 해결, 부족함 많아…결과 책임을 져야""이민정 ""이병헌과 생리현상 거의 다 터""KT ""통신장애 인터넷 97% 복구…무선 회선은 63%""좋아요0훈훈해요0슬퍼요0화나요0후속기사 원해요0기사제공 :']"
6,삼성전자, 2018-11-2608:34,연합뉴스 ,"LG이노텍, 車 초슬림 라인조명 '넥슬라이드-L' 개발",https://finance.naver.com/news/news_read.nhn?article_id=0010488891&office_id=001&mode=search&query=LG이노텍&page=2,"['       LG이노텍, 車 초슬림 라인조명 \'넥슬라이드-L\' 개발      기사입력2018-11-26 08:34기사원문좋아요훈훈해요좋아요 평가하기공감좋아요0훈훈해요0슬퍼요0화나요0후속기사 원해요0댓글 (서울=연합뉴스) 배영경 기자 = LG이노텍은 광선폭 3mm의 차량용 초슬림 라인조명모듈 \'넥슬라이드-L\'을 개발했다고 26일 밝혔다.    기존 제품들의 최소 광선폭이 8mm 정도임을 고려하면 이번 신제품의 광선폭은 차량 외장용 발광다이오드(LED) 조명 중 가장 얇다고 회사는 소개했다.    LG이노텍은 독자 개발한 \'LED 발광 구조설계 기술\'을 적용해 넥슬라이드-L을 개발했다. 이는 점 광원인 LED를 이용해 얇고 긴 선을 구현하되 라인의 처음부터 끝까지 고르게 빛나도록 하는 기술이다.    기존 제품보다 라인이 한층 얇아진 넥슬라이드-L을 적용하면, 자동차 디자인을 차별화하는 데 유리하다는 것이 LG이노텍이 내세우는 제품의 강점이다.    특히 넥슬라이드-L은 조명의 용도와 장착 위치에 따라 색상과 밝기를 맞춤 설계할 수 있다.     제동등과 보조제동등(CHMSL)은 빨간색, 방향지시등과 사이드미러 램프는 노란색, 포지션 램프는 흰색과 같이 다양한 색상으로 제작이 가능하다.    또 넥슬라이드-L은 표면 밝기가 최대 7천500니트에 달해 브레이크 작동을 나타내는 제동등에 적용할 수도 있다.    LG이노텍은 넥슬라이드-L 관련 총 200여 건에 이르는 기술 특허를 보유했다.    회사 관계자는 ""넥슬라이드-L은 차량의 디자인·품질·안전성을 모두 높일 수 있는 혁신적인 조명 모듈""이라며 자동차 제조사와 운전자 모두 만족하게 될 것으로 기대한다""고 말했다.LG이노텍, 車 초슬림 라인조명 \'넥슬라이드-L\' 개발 (서울=연합뉴스) LG이노텍은 광선폭 3mm의 차량용 초슬림 라인조명모듈 \'넥슬라이드-L\'을 개발했다. 이 같은 광선폭은 차량 외장용 발광다이오드(LED) 조명 중 가장 얇다고 회사는 소개했다. 2018.11.26 [LG이노텍 제공]ykbae@yna.co.kr▶놓치면 아쉬운 \'핫뉴스\'  ▶뉴스가 보여요 - 연합뉴스 유튜브 ▶네이버 홈에서 [연합뉴스] 채널 구독하기연합뉴스 관련뉴스해당 언론사에서 선정하며 언론사 페이지(아웃링크)로 이동해 볼 수 있습니다.\xa0\'사귀자\' 문자 반복전송…\'스팸 차단\' 됐어도 처벌\xa0명품매장 피팅룸서 도난방지태그 자르고 상습절도\xa0기름은 바닥, 내비는 먹통…겨우 도착한 주유소 ""카드 안돼요""\xa04천394명 야광막대 동시 점등 세계 신기록 이룬 이유\xa0\'박항서 매직\'…베트남, 조 1위로 스즈키컵 4강 진출좋아요0훈훈해요0슬퍼요0화나요0후속기사 원해요0기사제공 :']"
7,삼성전자, 2018-11-2608:25,한국경제 ,"LG이노텍, 차량용 초슬림 라인조명 '넥슬라이드-L' 내놔",https://finance.naver.com/news/news_read.nhn?article_id=0004050995&office_id=015&mode=search&query=LG이노텍&page=2,"['       LG이노텍, 차량용 초슬림 라인조명 \'넥슬라이드-L\' 내놔      기사입력2018-11-26 08:25기사원문좋아요훈훈해요좋아요 평가하기공감좋아요0훈훈해요0슬퍼요0화나요0후속기사 원해요0댓글3mm 얇고 균일한 LED 조명용도 따라 모양·컬러·밝기 조절 가능[ 윤진우 기자  ] LG이노텍이 차량용 초슬림 라인조명모듈 \'넥슬라이드(Nexlide)-L\'을 개발했다고 26일 밝혔다. 신제품은 자동차 외관을 한층 돋보이게 하는 신개념 LED 조명모듈로 후미등, 방향지시등 등의 차량 외장 조명을 날렵한 선(線) 모양으로 디자인 할 수 있다.LG이노텍은 독자 개발한 LED 발광 구조설계 기술을 적용해 넥슬라이드-L을 완성했다. 점(點) 광원인 LED를 이용해 얇고 긴 선을 구현하면서도 처음부터 끝까지 고르게 빛나도록 하는 정교한 기술이다. 기존 제품은 최소 광선폭이 8mm 정도인데 반해 신제품은 3mm로 제작됐다.넥슬라이드-L은 차량 컨셉에 따라 직선, 곡선, 물결 등 여러 모양으로 슬림하고 매끄럽게 만들 수 있다. 조명을 1m 이상 길게 만들어도 밝기 차이에 따른 얼룩이나 끊김이 없다.조명의 용도와 장착 위치에 따라 컬러와 밝기를 맞춤 설계할 수 있다. 제동등과 보조제동등은 빨강, 방향지시등과 사이드미러 램프는 노랑, 포지션 램프는 하얀색으로 제작 가능하다. 표면 밝기는 최대 7500니트에 달해 제동등에 사용해도 손색 없다.  LG이노텍은 넥슬라이드-L 등을 앞세워 글로벌 차량용 LED 시장 공략에 속도를 낸다. 고객 요구에 따라 안정적으로 공급할 준비도 마쳤다. 200건에 이르는 기술 특허와 생산 설비, 품질 관리 기반도 갖췄다.LG이노텍 관계자는 ""넥슬라이드-L은 차량의 디자인과 품질, 안전성을 모두 높일 수 있는 혁신적인 조명모듈""이라며 ""완성도 높은 차량 조명으로 자동차 제조사와 운전자 모두 만족하게 될 것으로 기대한다""고 말했다.시장조사기관 스트레티지스 언리미티드에 따르면 차량용 LED 시장은 지난해 20억8000만달러에서 2020년 31억7000만 달러로 52% 확대될 전망이다.윤진우 한경닷컴 기자 jiinwoo@hankyung.com기사제보 및 보도자료 open@hankyung.com[한경닷컴 바로가기] [모바일한경 구독신청] 전문가들의 내년 투자전략이 알고 싶다면? <자세히 보기> ⓒ 한국경제 & hankyung.com, 무단전재 및 재배포 금지한국경제 관련뉴스해당 언론사에서 선정하며 언론사 페이지(아웃링크)로 이동해 볼 수 있습니다.""이재명, 탈당 준비 끝났다"" 폭탄 발언""내년부터 어쩌라고…"" 서민들 경악! 이유가日 대학생 ""성행위 해본 적 있나"" 질문에…\'충격\'文정부, 벤치마킹한 \'대만 탈원전\' 정책 폐기한다경찰 상황조회실 \'폴리폰\'도 마비…IT강국의 민낯좋아요0훈훈해요0슬퍼요0화나요0후속기사 원해요0기사제공 :']"
