,회사명,날짜,언론사,기사제목,링크,본문
0,삼성전자, 2019-06-1918:36,한국경제 ,"19일, 거래소 외국인 순매도상위에 전기,전자 업종 4종목",https://finance.naver.com/news/news_read.nhn?article_id=0004162212&office_id=015&mode=search&query=LG이노텍&page=1,"['       19일, 거래소 외국인 순매도상위에 전기,전자 업종 4종목      기사입력2019-06-19 18:36기사원문좋아요훈훈해요좋아요 평가하기공감좋아요0훈훈해요0슬퍼요0화나요0후속기사 원해요0댓글 외국인 투자자는 19일 거래소에서 하나금융지주, 넷마블, 아모레퍼시픽 등을 중점적으로 매도한 것으로 나타났다.외국인 투자자의 순매도 상위 20개 종목은 하나금융지주, 넷마블, 아모레퍼시픽, 기아차, LG디스플레이, LG이노텍, DB하이텍, SK이노베이션, 웅진코웨이, NHN등이다.이중에 전기,전자 업종에 속한 종목이 4개 포함되어 있다.아모레퍼시픽, LG디스플레이, LG이노텍 등은 전일 대비 주가가 상승했고, 하나금융지주, 넷마블, 기아차 등은 주가가 하락했다.[06월19일]거래소 외국인 순매도 상위 종목한경로보뉴스이 기사는 한국경제신문과 금융 AI 전문기업 씽크풀이 공동 개발한 기사 자동생성 알고리즘에 의해 실시간으로 작성된 것입니다.▶ 네이버에서 한국경제 뉴스를 받아보세요▶ 한경닷컴 바로가기  ▶ 모바일한경 구독신청 ⓒ 한국경제 & hankyung.com, 무단전재 및 재배포 금지한국경제 관련뉴스해당 언론사에서 선정하며 언론사 페이지(아웃링크)로 이동해 볼 수 있습니다.""\'스타렉스\' 신차 내달라""…끊임없는 요구에 결국\'알짜노선\' 줄줄이 착공 · 개통…집값 최대 수혜지는?""대형 M&A 가능성 있다""…삼성전자 \'초강수\'""너도나도 돈 빌리겠다고""…1천억 몰린 대출 상품""상사에 이모티콘 보냈다가 해고 당했어요""좋아요0훈훈해요0슬퍼요0화나요0후속기사 원해요0기사제공 :']"
1,삼성전자, 2019-06-1918:36,한국경제 ,"19일, 거래소 기관 순매수상위에 전기,전자 업종 2종목",https://finance.naver.com/news/news_read.nhn?article_id=0004162213&office_id=015&mode=search&query=LG이노텍&page=1,"['       19일, 거래소 기관 순매수상위에 전기,전자 업종 2종목      기사입력2019-06-19 18:36기사원문좋아요훈훈해요좋아요 평가하기공감좋아요0훈훈해요0슬퍼요0화나요0후속기사 원해요0댓글 기관 투자자는 19일 거래소에서 KODEX 레버리지, SK하이닉스, 삼성전자 등을 중점적으로 사들인 것으로 나타났다.기관 투자자의 순매수 상위 20개 종목은 KODEX 레버리지, SK하이닉스, 삼성전자, 하나금융지주, 한화케미칼, LG이노텍, 현대건설, 셀트리온, KODEX 코스닥150선물인버스, 삼성전기등이다.이중에 전기,전자 업종에 속한 종목이 5개 포함되어 있다.KODEX 레버리지, SK하이닉스, 삼성전자 등은 전일 대비 주가가 상승했고, 하나금융지주, KODEX 코스닥150선물인버스, 기아차 등은 주가가 하락했다.[06월19일]거래소 기관 순매수 상위 종목한경로보뉴스이 기사는 한국경제신문과 금융 AI 전문기업 씽크풀이 공동 개발한 기사 자동생성 알고리즘에 의해 실시간으로 작성된 것입니다.▶ 네이버에서 한국경제 뉴스를 받아보세요▶ 한경닷컴 바로가기  ▶ 모바일한경 구독신청 ⓒ 한국경제 & hankyung.com, 무단전재 및 재배포 금지한국경제 관련뉴스해당 언론사에서 선정하며 언론사 페이지(아웃링크)로 이동해 볼 수 있습니다.""\'스타렉스\' 신차 내달라""…끊임없는 요구에 결국\'알짜노선\' 줄줄이 착공 · 개통…집값 최대 수혜지는?""대형 M&A 가능성 있다""…삼성전자 \'초강수\'""너도나도 돈 빌리겠다고""…1천억 몰린 대출 상품""상사에 이모티콘 보냈다가 해고 당했어요""좋아요0훈훈해요0슬퍼요0화나요0후속기사 원해요0기사제공 :']"
