,회사명,날짜,언론사,기사제목,링크,본문
0,삼성전자, 2019-06-2816:07,아이뉴스24 ,중국 이어 베트남 겨냥한 트럼프…韓 기업에도 '불똥',https://finance.naver.com/news/news_read.nhn?article_id=0000498873&office_id=031&mode=search&query=LG이노텍&page=1,"['       중국 이어 베트남 겨냥한 트럼프…韓 기업에도 \'불똥\'      기사입력2019-06-28 16:07기사원문좋아요훈훈해요좋아요 평가하기공감좋아요0훈훈해요0슬퍼요0화나요0후속기사 원해요0댓글삼성 갤럭시폰 절반이 \'메이드 인 베트남\' 국내 대기업 대부분 진출[아이뉴스24 조석근 기자] G20 정상회담을 앞두고 미국 트럼프 대통령이 베트남을 겨냥 \'가장 나쁜 착취자(the single worst abuser)\'로 거론하면서 국내 재계를 긴장시키고 있다. 중국과 마찬가지로 미국과의 무역불균형 해소를 위한 베트남 제재조치를 시사한 것이기 때문이다.트럼프 대통령은 현지시간 26일 일본 G20 정상회담 출국 전 폭스 비즈니스 뉴스와 인터뷰에서 ""많은 기업들이 베트남으로 이동하고 있다. 베트남이 중국보다 훨씬 더 미국을 이용하고 있다""며 ""매우 흥미로운 일들이 벌어지고 있다""고 말했다.베트남은 중국에 이어 국내 제조업계의 핵심 파트너다. 삼성전자의 경우 연간 판매 스마트폰 3억대 중 절반이 베트남에서 만들어진다. 전방위 보호무역에 나선 트럼프의 발언으로 국내 업체들의 속이 바짝 타들어가는 이유다.1도널드 트럼프 미 대통령이 현지시간 26일 미 언론과의 인터뷰에서 베트남을 \'가장 나쁜 착취자\'로 지칭하며 보호무역 조치 가능성을 시사했다.  [사진=뉴시스]트럼프 대통령은 ""베트남에도 관세를 부과할 것인가""라는 질문에 구체적 답변을 내놓진 않았다. 다만 ""베트남과 논의 중(we\'re in dicussions with Vietnam)""이라며 ""베트남은 가장 나쁜 착취자""라고 말했다. 미중 무역전쟁이 이번 G20 정상회담과 미중 단독 정상회담의 핵심 의제가 될 전망인 가운데 미국의 다음 제재 대상이 베트남일 가능성을 강하게 시사하는 한편, 베트남 정부와 논의가 진행되고 있음을 내비친 것이다.베트남의 지난해 대미 무역흑자는 395억달러(약 45조원)에 달했으며, 올해 들어 5월까지 대미 수출은 40% 증가한 것으로 추산된다. 올 5월까지 베트남의 대미 흑자는 전년 같은 기간보다 30% 증가한 170억달러(약 19조원)가량이다. 트럼프 정부가 주목하는 부분은 이같은 대미 흑자의 급증이 중국의 대미 수출 우회로일 가능성이라는 점이다.중국 기업들이 미국의 보복관세를 피하기 위해 베트남으로 수출 후 미국으로 재수출한 것 아니냐는 것이다. 미국은 지난해부터 500억달러 규모 중국 수입품에 대한 25% 보복관세를 부과한 가운데 6월 들어 2천억달러 수입품에 대해 동일한 관세를 부과했다. 미국은 이번 G20 정상회담에서 만족할 만한 협상이 이뤄지지 않을 경우 3천억달러 규모 추가 관세 프로그램을 가동할 계획이다.실제 베트남의 대중국 수입도 올해 들어 5월까지 20% 이상 증가한 것으로 추산된다. 대미 수출 핵심 품목인 전자제품, 기계류의 수입은 각각 80%, 30% 증가했다는 게 미국 정부 인식이다. 대중국 제재를 위해 베트남에 대한 고삐를 조이겠다는 것으로 해석된다.문제는 베트남이 아세안 국가들 중에서도 한국의 핵심 교역국이라는 점이다. 베트남은 수출의 70%를 현지 진출 해외기업에 의존한다. 그 중 한국 기업들의 위상이 절대적이다. 삼성전자의 경우 베트남법인의 지난해 수출액이 68조원으로 베트남 전체 수출의 3분의 1에 해당된다.지난 3월 베트남 호찌민에서 오픈한 삼성전자 쇼케이스 전시관 [사진=뉴시스]삼성전자는 베트남 하노이에선 스마트폰 공장을, 호치민에선 TV·세탁기 등 가전제품 공장을 운영 중이다. 삼성전자 관계자는 ""하노이 공장에서만 10만명이 근무하면서 삼성전자의 전 세계 스마트폰 판매량 중 절반을 생산한다""고 설명했다.LG전자의 경우 하이퐁 공장에서 스마트폰, 생활가전 제품을 생산한다. LG디스플레이, LG이노텍도 함께 진출해 스마트폰용 디스플레이, 카메라 등 부품을 공급한다. LG경제연구원 심형순 선임연구원은 ""지분투자 등 간접투자까지 포함하면 국내 주요 대기업 대부분이 어떤 형식으로든 진출한 상황""이라며 ""인건비 수준, 인프라 유무를 고려하면 다른 아세안 국가들은 아직 베트남을 대체하기 어렵다""고 설명했다.트럼프 정부가 중국처럼 베트남에 보복관세를 물릴지는 현재로선 미지수다. 그러나 이달 초 불법이민 문제를 두고 자유무역협정(FTA) 체결국인 멕시코에 중국과 동일한 25% 보복관세 부과를 갑작스레 예고하기도 했다. 멕시코의 경우 중국에 이은 미국의 최대 적자국이다. 베트남은 멕시코 다음으로 미국의 3위 적자국이다.국제무역연구원 문병기 수석연구원은 ""트럼프 정부가 무역불균형을 이슈로 삼으면서 개별 국가들과 협상을 확대하고 있다""며 ""베트남 당국만이 아니라 현지 진출 다국적 기업들도 매우 신경이 쓰이는 상황""이라고 말했다.조석근기자 mysun@inews24.com▶네이버 채널에서 \'아이뉴스24\'를 구독해주세요.▶아이뉴스TV에서 부동산 고수를 만나보세요.[ⓒ 아이뉴스24 무단전재 및 재배포 금지]아이뉴스24 관련뉴스해당 언론사에서 선정하며 언론사 페이지(아웃링크)로 이동해 볼 수 있습니다.글로벌에서 종횡무진…진격의 펄어비스[초점] 상반기 IPO 시장 \'대어\' 부재에도 1兆 공모 선방[G20 정상회의]문대통령, 무역마찰등 개혁 필요성 강조넥슨, \'문화로서의 게임\' 인식 제고 나선다[G20 정상회의]문대통령, 한·인도 정상회담 개최좋아요0훈훈해요0슬퍼요0화나요0후속기사 원해요0기사제공 :']"
1,삼성전자, 2019-06-2811:21,헤럴드경제 ,[신남방 프로젝트] 포스트 차이나·동남아 진출 교두보…‘베트남 러시’는 진행형,https://finance.naver.com/news/news_read.nhn?article_id=0001551782&office_id=016&mode=search&query=LG이노텍&page=1,"['       [신남방 프로젝트] 포스트 차이나·동남아 진출 교두보…‘베트남 러시’는 진행형      기사입력2019-06-28 11:21기사원문좋아요훈훈해요좋아요 평가하기공감좋아요0훈훈해요0슬퍼요0화나요0후속기사 원해요0댓글미중 무역갈등 등으로 수출 불확실성 고조판매법인 시작한 베트남, 세계 전초기지 격상삼성전자·LG·SK·현대차·한화 등 주요 그룹현지 재투자 등 ‘베트남 인사이더’ 전략 구상최근 미중 무역갈등과 글로벌 교역 감소 등으로 수출시장 불확실성을 체감하고 있는 국내 주요 그룹은 베트남 등 동남아시아 시장을 돌파구로 삼고 있다. 동남아는 인구와 경제 규모, 성장 속도 면에서 ‘포스트 차이나’를 찾고 있는 기업들에게 더할 수 없이 매력적인 시장이다. 그 중에서도 ‘대장’ 격인 베트남에 진출하지 않은 기업을 찾기 힘들 정도로 ‘베트남 러시’는 현재 진행형이다.삼성전자는 우리나라 기업의 베트남 수출액 중 25%에 해당하는 600억달러(69조4200억원)를 가져갈 만큼 베트남이 주요 시장이다.삼성전자는 1995년 호치민에 베트남 판매법인을 설립하고 TV와 생활가전, 휴대폰 등을 판매해 왔다. 현지 접점을 생산 법인으로 확장해 2009년부터 하노이 인근 박닌성 옌퐁공단에 휴대폰 공장을, 2014년부터 역시 하노이 인근 타이응웬성 옌빙공단 휴대폰 공장을 운영 중이다. 이어 2016년 상반기부터는 호치민 사이공 하이테크 파크에서 TV와 생활가전 생산공장 가동을 시작하면서 제품 라인을 확장해 현지 시장에 유연하게 대응할 수 있는 틀을 마련했다.LG그룹도 베트남 시장의 성장성을 높게 평가하고 주요 계열사의 생산시설을 집결시키는 등 현지에서의 시너지 효과를 기대하고 있다.LG전자는 1995년 베트남 흥이옌에 첫 공장을 설립하며 현지 진출을 본격화하고, 2015년에는 하이퐁에 40만㎡ 규모의 ‘LG전자 베트남 하이퐁 캠퍼스’를 준공했다. 2013년부터 2028년까지 15억달러(1조7300억원)를 투자한다는 계획이다.최근 LG전자는 경기도 평택의 스마트폰 생산라인을 하이퐁 캠퍼스로 재배치하겠다고 밝히는 등 현지 라인을 강화하는 비전을 밝히기도 했다. LG디스플레이는 2017년 하이퐁에 OLED 패널 모듈 조립 공장을 준공했고, 2016년 9월에는 LG이노텍이 하이퐁에 생산법인을 설립하고 2017년부터 스마트폰용 카메라 모듈 본격 생산에 들어갔다.\xa0SK그룹은 동남아 사업 강화를 위해 2017년부터 베트남을 핵심 거점국가로 선정하고 사업 기회를 모색해 왔다. SK그룹은 지난 5월 베트남 1위 민영기업인 빈그룹 지주회사 지분 6.1%를 1조1800억원에 매입해 전략적 파트너십을 구축했다. 앞서 2018년 9월에는 마산그룹 지주회사 지분 9.5%를 5300억원에 매입했다. SK는 베트남 1,2위 민영기업과의 파트너십을 바탕으로 현지 시장에서 신규사업을 발굴하고, 전략적 인수합병 등을 공동 추진한다는 계획이다. 장기적으로는 베트남 지역사회 아젠다에 기여할 수 있는 영역도 적극 발굴한다는 계획이다. 현대자동차는 지난 1월 베트남 탄콩그룹과 판매 합작법인 설립을 발표하며 자동차 10만대 판매 체제를 구축키로 했다. 2011년 탄콩그룹에 생산을 위탁하는 방식(CKD)으로 베트남에서 자동차 생산을 시작한 현대차는 2017년 생산 합작법인 설립에 이어 판매 합작법인 설립을 통해 베트남 현지 대응력을 한층 강화한다는 전략이다. 한화그룹도 베트남에 생산기지를 건설하고 ‘지역사회 일원’으로 거듭난다는 전략이다.한화에어로스페이스는 작년 12월 하노이 인근 화락 하이테크단지에 10만㎡ 규모의 항공기 엔진부품 신공장을 준공했다. 베트남에 최초로 들어서는 대규모 항공엔진 부품 공장으로, 동종업계 세계 최고 수준의 원가경쟁력을 갖추게 될 것으로 한화 측은 기대하고 있다. 한화에너지는 올해 6월 완공을 목표로 베트남 남부지역에 100MW 규모의 태양광 발전소 개발사업을 추진하는 등 친환경 에너지 사업에도 나서고 있다.\xa0두산중공업은 지난 2009년 5월 베트남 꽝응아이성 중꾸엇 경제특구 내 발전설비 제조업체인 두산비나를 준공하고 베트남 진출을 본격화했다. 2010년부터 두산중공업은 두산비나 등을 통해 베트남에서 7개 프로젝트, 총 7조원 가량을 수주하는 기록을 세웠다. 산업섹션/jinlee@▶헤럴드경제 구독하고 휴가지원금 100만원 지원 받기▶더위를 식혀 줄 COOL푸드 특가, 헤럴드 리얼라이프 ▶헤럴드경제 사이트 바로가기 - Copyrights ⓒ 헤럴드경제 & heraldbiz.com, 무단 전재 및 재배포 금지 -헤럴드경제 관련뉴스해당 언론사에서 선정하며 언론사 페이지(아웃링크)로 이동해 볼 수 있습니다.고유정 ""생각보다 빨리 찾았다, 내가 죽였다""…체포되면서 한 말12kg 감량 홍선영, \'알라딘\' 자스민 미모생방 노출 구하라 ""끝까지 버텼다""""박보검, 송혜교와…"" 이혼 지라시 속 내용 보니박효신 또 먹튀, ""4억 먹고 나몰라라""좋아요0훈훈해요0슬퍼요0화나요0후속기사 원해요0기사제공 :']"
