,회사명,날짜,언론사,기사제목,링크,본문
5,삼성전자, 2020-04-2916:42,더팩트 ,"구광모 LG 회장 '상생경영' 속도 ""협력사가 살아야 우리가 산다""",https://finance.naver.com/news/news_read.nhn?article_id=0000024468&office_id=629&mode=search&query=LG이노텍&page=1,"['       구광모 LG 회장 \'상생경영\' 속도 ""협력사가 살아야 우리가 산다""      기사입력2020-04-29 16:42기사원문좋아요훈훈해요좋아요 평가하기공감좋아요0훈훈해요0슬퍼요0화나요0후속기사 원해요0댓글신종 코로나바이러스 감염증(코로나19) 사태가 확산되는 가운데 LG가 협력사와 상생에 속도를 높이고 있다. /LG 제공LG그룹, 대출 규모 확대 및 스마트 팩토리 구축 등 폭넓은 지원 나서[더팩트│최수진 기자] 신종 코로나바이러스 감염증(코로나19) 사태가 확산되는 가운데 LG가 협력사와의 상생에 박차를 가한다. 금융 지원뿐 아니라 제조 경쟁력과 생산성을 높이기 위한 스마트 팩토리 구축 등 폭넓은 지원에 나섰다.LG전자는 지난 2018년부터 국내외 협력사가 생산라인을 자동화하고 정보화 시스템을 구축할 수 있도록 지원해 왔다.올해는 2차 협력사까지 지원 대상을 확대해 약 100개 협력사에 인공지능, 빅데이터 등을 활용해 스마트 팩토리 솔루션과 자동화 시스템을 구축하는데 지원한다. 생산기술 전문가를 협력사에 파견해 노하우를 전수하고, 협력사 직원을 위해 신설한 로봇 자동화 교육과정을 통해 로봇 조작과 운영, 생산라인 적용사례 학습 등 맞춤형 실습교육을 제공한다.LG전자는 자금 운영에 어려움을 겪는 협력사들이 안정적으로 운영될 수 있도록 협력사 대상 무이자 대출 규모를 당초 400억 원에서 550억 원으로 확대했으며, 자금 지원 일정도 4개월을 앞당겨 협력사가 설비 투자, 부품 개발 등을 차질 없이 이어가며 경영 안정성을 높일 수 있도록 했다. 저금리 대출을 위한 2000억 원 규모의 상생협력 펀드도 운영하고 있다.또 코로나19 영향으로 해외에 있는 협력사가 국내로 돌아오거나 국내 생산을 확대할 경우 생산성 향상을 위해 컨설팅, 무이자 자금 등을 지원하고 구매 물량을 보장하기로 했다. 지금까지 국내외 협력사에 마스크 12만 장과 손세정제 등을 전달하며 협력사가 긴박하게 필요로 하는 분야에 신속하게 지원을 이어가고 있다.LG화학은 코로나 확산 장기화로 자금난을 겪고 있는 협력사를 대상으로 1000억 원 규모의 상생 펀드 및 혁신성장 펀드 등 금융지원을 조기 집행한다. 코로나 이슈로 긴급하게 자금이 필요한 협력업체들에 심사를 최대한 간소화하는 등 상반기 중 금융지원이 이뤄질 수 있도록 조치할 계획이다.공익성 및 지속가능성이 높은 친환경 분야 사회적 창업·벤처기업을 발굴하고 성장을 돕기 위해 LG전자와 함께 \'LG소셜캠퍼스\'도 운영 중이다. 특히 여러 친환경 분야의 사회적 창업·벤처기업들이 성장기반을 다질 수 있도록 자금지원, 무이자 대출, 사무공간 대여, 인재육성 등의 프로그램을 운영하고 있다. 2011년 시작 이래 9년간 150여 개 기업에 총 140억 원을 지원하고 있다.LG생활건강은 코로나19 확산으로 운영에 어려움을 겪는 지역사회와 협력사, 가맹점 등을 돕기 위해 전방위 지원에 나섰다. 화장품 가맹점 500여 곳의 한 달 치 월세의 50%를 본사에서 지원했다. 지원 대상은 LG생활건강이 운영 중인 화장품 가맹점인 전국 네이처컬렉션, 더페이스샵 매장 등 약 500곳이다.LG생활건강은 협력사에 대한 운영 자금도 지원한다. 자금난을 겪고 있는 방문판매화장품대리점, 생활용품대리점, 음료대리점 등 전국 대리점의 직원 인건비도 일부 지원한다.LG이노텍은 코로나19로 어려움을 겪는 중소 협력사들을 위해 총 1500억 원 규모의 상생 금융 지원에 나섰다. 먼저 협력회사 자금 지원을 위해 운용중인 630억 원 규모의 동반성장펀드를 협력사들이 긴급히 활용할 수 있도록 4월부터 조기 집행하고, 거래규모, 신용도 등의 심사 기준 완화, 자금 지급 절차 간소화할 예정이다.이와 함께 4월부터 2개월간 협력사에 약 850억 원 규모의 납품 대금과 금형비도 조기 지급한다. 협력사들은 비용 마감 후 5일 이내 납품 대금을 현금으로 받을 수 있게 돼 현금 흐름 개선에 도움이 될 전망이다.상생 금융 지원 외에 협력사의 경쟁력 제고를 위해 기술, 경영, 교육 분야 지원도 지속해 나갈 방침으로 협력사와 생산·기술 혁신과제를 함께 추진하고 경영컨설팅, 온·오프라인 교육을 무상 지원한다.LG유플러스는 코로나19로 어려움을 겪고 있는 중소 협력회사와 소상공인 등을 위해 850억 원 규모의 상생 지원책을 마련해 긴급 시행하고 있다. 먼저 협력회사 자금 지원을 위해 운용중인 동반성장펀드를 기존보다 250억 원을 늘린 750억 원으로 확대했다. 또 자금난을 겪는 중소 협력사에는 최대 500억 원 규모로 납품 대금 조기 지급 결제를 시행하고, 중소 협력사를 통한 모든 구매 및 공사대금 정산도 월 4회로 늘려 진행하고 있다.아울러 5000만 원 이상 계약 체결 시 필수 요건이었던 보증보험 발행의 면제 대상 범위를 확대해 중소 협력사의 보험 발행 비용 부담도 줄여주고 있다. 기존 협력사 외에 추가로 350여 개 중소 협력사가 혜택을 받을 것으로 전망된다.이와 함께 소규모 자영업자 지원을 위한 골목상권 상생 프로젝트인 \'U+로드\' 확대 및 전국 대리점 운영자금 지원 등에도 약 100억 원 규모를 투입한다. U+로드는 LG유플러스 모바일 고객들에게 최대 50% 할인, 1+1 혜택, 경품 이벤트 등을 제공하는 제휴 프로그램으로, LG유플러스는 코로나19로 내방 고객이 감소해 어려움을 겪는 전통시장과 구시가지 상권 등을 중심으로 이 프로그램을 대폭 확대해 나갈 계획이다.또 코로나19 확산이 한창이던 2월 말 대구·경북 지역 비롯해 전국 2천 개 대리점 매장에 지원한 운영자금을 25억 원에서 34억 원으로 늘리고, 14억 원 상당의 마스크 세정제 등 방역 물품도 지원하고 있다. 아울러 오프라인 채널의 판매 감소로 경영에 어려움을 겪고 있는 알뜰폰 사업자들을 위해서도 미니공청기, 무선충전기, 손세정제 등 온라인 판촉물을 지원하고 있다.jinny0618@tf.co.kr- 더팩트 뮤직어워즈는 언제? [알림받기▶]  - 내 아이돌 응원하기 [팬앤스타▶]  저작권자 ⓒ 특종에 강한 더팩트 & tf.co.kr 무단 전재 및 재배포 금지더팩트 관련뉴스해당 언론사에서 선정하며 언론사 페이지(아웃링크)로 이동해 볼 수 있습니다.엑소 첸, 아빠 됐다…29일 득녀\'유튜브 1등\' GS건설, 야심차게 준비한 \'예능 분양\' 방송 실패?[TF기획-머나먼 장애인 참정권④] 김예지 ""공감 부재, 누구에게 답을 찾고 있나요?""검찰, \'부따\' 강훈 등 조주빈 공범 주거지 압수수색[TF현장] 아이폰SE 韓 상륙…집단상가 ""\'갤럭시S20\'때보다 상황 낫다""좋아요0훈훈해요0슬퍼요0화나요0후속기사 원해요0기사제공 :']"
6,삼성전자, 2020-04-2913:07,파이낸셜뉴스 ,새로운 투자처로 부상하는 수도권 지식산업센터,https://finance.naver.com/news/news_read.nhn?article_id=0004416782&office_id=014&mode=search&query=LG이노텍&page=1,"['       새로운 투자처로 부상하는 수도권 지식산업센터      기사입력2020-04-29 13:07기사원문좋아요훈훈해요좋아요 평가하기공감좋아요0훈훈해요0슬퍼요0화나요0후속기사 원해요0댓글 수도권 지식산업센터 규제에서 자유로워 대체 투자상품으로 인기  특화시설 다양화로 도심 오피스의 대체할 대안으로 급부상   수도권에서 분양을 앞두고 있는 지식산업센터들에 관심이 높아지고 있다. 최근 정부의 규제가 수도권 아파트에 집중되며 규제에서 자유로운 지식산업센터와 같은 대체 투자상품으로 수요자들의 눈길이 쏠리고 이는데다 최근 지식산업센터들은 다양한 특화시설들이 들어서 서울 도심 오피스 못지않은 시설을 갖추고 있기 때문이다.   한국감정원의 오피스 지역별 임대료 현황을 보면, 2019년 4분기 서울의 1㎡당 임대료는 2만2300원으로 나타났다. 특히 종로, 광화문 등 도심권 임대료는 1㎡당 2만7900원이었다. 높게 나타났다. 반면 경기도의 1㎡당 임대료 1만2400원 인천은 8800원으로 나타나 각각 2배, 3배에 가까운 격차를 보였다.   최근 지식산업센터들이 오피스와 다름 없는 혹은 그 이상의 특화시설을 선보이고 있어 서울 도심 오피스의 비싼 임대료를 피해 수도권 오피스 또는 지식산업센터로 둥지를 트는 사업체들을 어렵지 않게 찾아볼 수 있다.   특히 지식산업센터는 아파트, 오피스텔, 상가와 달리 분양권 전매에 제한이 없고, 분양금액의 최대 80%까지 저리로 대출도 가능해 투자가치도 높다. 여기에 입주기업은 다양한 세제 혜택까지 받을 수 있다. 행정안전부가 지식산업센터 입주 기업의 세금 감면 혜택 기간을 2022년까지로 연장하면서 지방세 특례 제한법에 의거해 지식산업센터 최초 입주업체는 취득세 50%감면, 재산세 37.5% 감면 혜택을 받을 수 있다.   더불어 수도권 과밀억제권역(서울, 수원, 성남, 안양, 의왕 등)에서 비과밀억제권역으로 이전시 조세특례제한법에 의거 법인세는 4년간 100% 전액 감면되며 이후 2년간은 50%감면된다. 취득세 또한 전액 감면되며 재산세도 4년간 100% 면제 이후 3년간 50% 감면된다.   이에 오산, 김포, 구리 등 수도권 각지에서 분양을 앞두고 있는 지식산업센터에 투자자들의 관심이 높아지고 있다.   현대엔지니어링은 옛 LG이노텍 부지(경기도 오산시 가수동 329-4번지 일원)에 국내 최대 규모 지식산업센터 ‘현대 테라타워 CMC’를 분양 중이다. 이 단지는 지하 2층~지상 29층 규모 지식산업센터 2개동과 지하 2층~지상 17층 규모 기숙사동, 지하 1층~지상 10층 규모 물류센터동을 포함한 총 4개동, 연면적 35만7,637㎡의 대규모로 조성된다. 현대 테라타워 CMC는 국내에서 보기 드문 초대형 규모로 높은 희소성을 갖추고 있어 지역 내 랜드마크 지식산업센터로 자리매김할 수 있을 전망이다.   현대 테라타워 CMC의 저층부(지하 2층~지상 6층)는 제조형 특화 지식산업센터로 드라이브 인(Drive-in)과 도어 투 도어(Door-to-door) 시스템을 적용해 업무 효율성을 극대화했다. 상층부는 섹션 오피스형으로 전용면적 50㎡ 안팎의 중·소형 위주로 구성되며, 호실 조합을 통해 필요한 만큼 사무공간을 선택할 수 있어 1인 창업자부터 대규모 기업까지 다양한 규모의 업체를 수용할 수 있다.   태영건설은 4월 구리갈매 자족유통 시설용지에 ‘구리갈매 아너시티’를 분양한다. 이 단지는 지하 5층~지상 10층, 연면적 10만5068㎡ 규모로 조성된다. 단지가 들어서는 구리갈매지구는 경기도 구리시 일대 약 143만㎡ 규모로 조성된 주거지역으로 서울에서 1km만 이동하면 닿을 수 있다. 구리갈매 아너시티는 신내IC와 갈매IC 등이 가까워 서울외곽순환도로, 북구간선도로, 동부간선도로, 서울양양고속도로 등 교통망 이용이 쉬우며, 향후 제2외곽순환도로, 구리~세종고속도로, GTX-B노선 등이 계획돼 있다.   구리갈매 아너시티는 드라이브 인과 도어 투 도어 시스템을 갖춰 업무 효율성을 높였으며, 복층 공간 활용이 가능한 사무공간 및 개방감 높은 테라스를 갖춘 업무형 오피스(9~10층 일부호실) 등 특화설계가 적용됐다.   시행사 디허브플러스는 4월 경기도 김포시 한강신도시에서 한라가 시공하는 ‘디원시티 시그니처’를 분양한다. 이 단지는 지하 3층~지상 10층, 연면적 6만5012㎡ 규모로 조성된다. 디원시티 시그니처는 김포도시철도 양촌역까지 약 350m 거리로 초역세권 입지에 조성된다. 아울러 이마트, 호수공원, 복합환승센터 등이 들어선 중심상업지구 바로 앞에 위치해 있다.   디원시티 시그니처는 단지 내 미팅룸, 힐링룸, 파우더룸(샤워시설 포함) 등 편의시설도 갖춰져 있어 입주기업의 만족도가 클 전망이다. 아울러 채광과 환기가 우수한 발코니 제공으로 공간 활용도가 높은 쾌적한 업무환경이 조성될 예정이다.  ▶ 헉! 소리나는 [헉스]\xa0▶ \'너 그거 아니?\' [두유노우]▶ 지금 파이낸셜뉴스 채널 구독하고 경품 GET!  ※ 저작권자 ⓒ 파이낸셜뉴스. 무단 전재-재배포 금지파이낸셜뉴스 관련뉴스해당 언론사에서 선정하며 언론사 페이지(아웃링크)로 이동해 볼 수 있습니다.진중권 ""뇌가 없는 정당. 쫄딱 망한 집구석의.."" 통합당에..김종인 염두에 입 연 김세연 뜻밖의 발언 ""너무..""허은아 미래한국당 당선자 뜻밖의 발언 ""지금은 능력도 없고..""여성이 기대하는 남성의 결혼 적정연봉 액수, 얼만가 봤더니..송윤아, 불륜 질문에 직접 단 댓글 ""절대로 해서는..""좋아요0훈훈해요0슬퍼요0화나요0후속기사 원해요0기사제공 :']"
7,삼성전자, 2020-04-2908:53,데일리안 ,"“LG이노텍, 중장기 실적 증가세...적극적 비중 확대 권고”-NH투자증권",https://finance.naver.com/news/news_read.nhn?article_id=0002399031&office_id=119&mode=search&query=LG이노텍&page=1,"['       “LG이노텍, 중장기 실적 증가세...적극적 비중 확대 권고”-NH투자증권      기사입력2020-04-29 08:53기사원문좋아요훈훈해요좋아요 평가하기공감좋아요0훈훈해요0슬퍼요0화나요0후속기사 원해요0댓글NH투자증권 로고ⓒNH투자증권NH투자증권은 29일 LG이노텍에 대해 “실적 대폭 개선에도 주가는 여전히 저평가 상태로, 적극적 비중 확대를 권고한다”면서 목표주가를 기존 16만원에서 18만원으로 상향 조정했다. 투자의견 ‘매수’도 유지했다.이규하 연구원은 “목표주가 상향 배경은 광학솔루션 사업부와 기판소재 사업부의 이익률 개선세를 반영해 2020년 주당순이익을 기존 전망치대비 12.9% 상향했기 때문”이라고 설명했다.이 연구원은 “단기적으로는 신종 코로나바이러스 감염증(코로나19) 영향에 따른 글로벌 스마트폰 수요 둔화로 북미고객사 스마트폰 출하량 감소가 예상돼 주가 변동성이 확대될 가능성이 존재한다”면서도 “하지만 최근 빠르게 회복하고 있는 중국 스마트폰 판매, 하반기 신형 5G 스마트폰 출시, 2021년 스마트폰 수요 본격회복 가능성 감안 시 현재 주가는 매력적인 수준”이라고 평가했다.그는 “추가적으로 여전히 LG이노텍 주가수익비율(PER) 밸류에이션이 글로벌 동종업체들 대비 약 40% 할인되어 거래 중이고 밸류에이션 밴드상으로도 저점에 위치하고 있어 수요 둔화를 감안해도 현저히 저평가되어있는 구간”이라고 판단했다.또 단기 실적보다는 중장기 실적 증가세에 주목해야 한다고 조언했다.LG이노텍은 올해 1분기 영업이익 1380억원을 기록하며 시장 전망치를 대폭 상회했다. 고객사 신모델 출시에 따른 카메라 모듈 출하량 확대, 적자사업인 스마트폰 메인기판(HDI 기판) 사업정리로 인한 기판사업부 이익률 개선, 양호한 원·달러 효과 등에 따른 것이다.이 연구원은 “2분기는 고객사 출하량 감소로 예상을 하회하는 적자 기록 가능성이 높다”면서 “그러나 하반기 5G 신모델 출시에 힘입은 실적 성장세를 고려하면 큰 의미는 없다고 판단한다”고 말했다. 이어 “오히려 2020년 연간 최대 실적 달성과 2021년까지 이어질 중장기 이익 성장 사이클을 감안한 적극적인 비중 확대를 권고한다”고 덧붙였다.데일리안 백서원 기자 (sw100@dailian.co.kr)ⓒ (주)데일리안 - 무단전재, 변형, 무단배포 금지데일리안 관련뉴스해당 언론사에서 선정하며 언론사 페이지(아웃링크)로 이동해 볼 수 있습니다.삼성전기·LG이노텍, 코로나 악재 뚫고 1Q 선방...2분기가 관건LG이노텍, 1Q 영업익 1380억원...흑자전환""키움증권 원유선물 거래 오류, 평판 일부 훼손 불가피""-NH투자증권NH투자증권, 나무 전용 ELS 모집 안내NH투자증권, 신용등급 안정적 평가 받아좋아요0훈훈해요0슬퍼요0화나요0후속기사 원해요0기사제공 :']"
8,삼성전자, 2020-04-2908:22,뉴시스 ,"NH證 ""LG이노텍, 저평가된 주가…적극적 매수 권고""",https://finance.naver.com/news/news_read.nhn?article_id=0009839282&office_id=003&mode=search&query=LG이노텍&page=1,"['       NH證 ""LG이노텍, 저평가된 주가…적극적 매수 권고""      기사입력2020-04-29 08:22기사원문좋아요훈훈해요좋아요 평가하기공감좋아요0훈훈해요0슬퍼요0화나요0후속기사 원해요0댓글[서울=뉴시스] 김동현 기자 = NH투자증권은 29일 LG이노텍(011070)에 대해 ""단기 수요 부진에 대한 우려보다는 하반기 및 중장기 성장성에 주목해야 한다. 실적이 대폭 개선됐음에도 주가는 여전히 저평가 돼 있어 적극적 비중 확대를 권고한다""며 투자의견을 매수, 목표주가를 18만원으로 상향 조정했다. 이규하 NH투자증권 연구원은 ""1분기 영업이익은 1380억원을 기록하며 시장 기대치를 크게 상회했다""며 ""고객사 신모델 출시에 따른 카메라 모듈 출하량이 확대됐고 적자 사업인 스마트폰 메인기판(HDI기판) 사업 정리로 인한 기판사업부 이익률 개선 등으로 실적이 개선됐다""고 분석했다. 이어 ""2분기는 고객사 출하량 감소로 예상을 하회하는 적자를 기록할 가능성이 높다. 하지만 하반기 5G 신모델 출시에 힘입은 실적 성장세를 고려하면 큰 의미는 없다""며 ""오히려 올해 연간 최대 실적 달성과 내년까지 이어질 중장기 이익 성장 사이클을 감안한 적극적인 비중 확대를 권고한다""고 강조했다. 특히 ""단기적으로는 코로나19 영향에 따른 글로벌 스마트폰 수요 둔화로 북미고객사 스마트폰 출하량 감소가 예상됨에 따라 주가 변동성이 확대될 가능성 존재하지만 최근 빠르게 회복하고 있는 중국 스마트폰 판매, 하반기 신형 5G 스마트폰 출시, 2021년 스마트폰 수요 본격 회복 가능성 등을 감안할 때 현재 주가는 매력적인 수준""이라고 평가했다. 이와함께 ""여전히 주가수익비율(PER) 밸류에이션이 글로벌 동종업체들 대비 약 40% 할인되어 거래되고 있고 밸류에이션 밴드상으로도 저점에 위치하고 있다""며 ""수요 둔화 감안해도 현저히 저평가 돼 있는 구간이라고 판단한다""고 의견을 말했다.☞공감언론 뉴시스 oj1001@newsis.com▶ 네이버에서 뉴시스TV 구독하기▶ K-Artprice, 유명 미술작품 가격 공개▶ 뉴시스 빅데이터 MSI 주가시세표 바로가기 <ⓒ 공감언론 뉴시스통신사. 무단전재-재배포 금지>뉴시스 관련뉴스해당 언론사에서 선정하며 언론사 페이지(아웃링크)로 이동해 볼 수 있습니다.신생아를 여행가방에 넣은 엄마, 모텔 들어선 뒤\'섹시팬티\' 교사, 일상이 성희롱…평소엔 초6 여학생을""임신하면 대우 못 받으니 그냥 가라""…여경 끝내 유산""오빠랑 같이 놀래?"" 50대 남성, 7세 여아 유인미수의대생 강간 추가폭로…""고등학생 때 성폭행 당했다""좋아요0훈훈해요0슬퍼요0화나요0후속기사 원해요0기사제공 :']"
9,삼성전자, 2020-04-2908:18,아이뉴스24 ,"[I-리포트] LG이노텍, 깜짝 실적 하반기도 지속 – 대신증권",https://finance.naver.com/news/news_read.nhn?article_id=0000536310&office_id=031&mode=search&query=LG이노텍&page=1,"[""       [I-리포트] LG이노텍, 깜짝 실적 하반기도 지속 – 대신증권      기사입력2020-04-29 08:18기사원문좋아요훈훈해요좋아요 평가하기공감좋아요0훈훈해요0슬퍼요0화나요0후속기사 원해요0댓글투자의견 매수, 목표가 19만원 유지[아이뉴스24 한상연 기자] 대신증권은 29일 LG이노텍의 1분기 깜짝 실적이 하반기도 지속될 것으로 내다봤다.금융투자업계에 따르면 LG이노텍은 1분기에 매출은 전년 동기 대비 46.9% 증가한 2조109억원, 영업이익은 흑자전환 한 1천380억원을 기록하며 시장전망치를 상회했다.박강호 대신증권 연구원은 1분기 깜짝 실적 요인으로 광학솔루션의 믹스 효과와 가동률 상향에 따른 수익성 개선, 적자사업 소멸, 반도체 기판 매출 증가, 환율 효과 등을 꼽았다.박 연구원은 제한적인 코로나19 영향에 따른 광학솔루션 매출 증가와 적자사업인 LED의 경영효율화의 본격화 등을 통해 하반기에도 이같은 기조를 이어갈 수 있을 것으로 전망했다.그는 이런 관점에서 투자의견 매수, 목표주가 19만원을 유지했다.한상연기자 hhch1113@inews24.com▶네이버 채널에서 '아이뉴스24'를 구독해주세요.▶재밌는 아이뉴스TV 영상보기  ▶아이뉴스24 바로가기[ⓒ 아이뉴스24 무단전재 및 재배포 금지]아이뉴스24 관련뉴스해당 언론사에서 선정하며 언론사 페이지(아웃링크)로 이동해 볼 수 있습니다.'아이폰SE' 출시에 이커머스도 '들썩'…사전예약 경쟁삼성전자, 인도 스마트폰 시장서 3위로 전락JB금융 올 1분기 순이익 1016억원…JB우리캐피탈 32% 폭풍성장세븐일레븐, 무인화 실험 박차…골프장에 자판기 편의점 열어김종인 '4개월짜리 비대위원장' 거부…통합당 '대혼란'좋아요0훈훈해요0슬퍼요0화나요0후속기사 원해요0기사제공 :""]"
