,회사명,날짜,언론사,기사제목,링크,본문
13,삼성전자, 2020-06-2309:14,뉴시스 ,"""의료진, 고맙습니다"" LG이노텍, '덕분에챌린지' 동참",https://finance.naver.com/news/news_read.nhn?article_id=0009928570&office_id=003&mode=search&query=LG이노텍&page=1,"['       ""의료진, 고맙습니다"" LG이노텍, \'덕분에챌린지\' 동참      기사입력2020-06-23 09:14기사원문좋아요훈훈해요좋아요 평가하기공감좋아요0훈훈해요0슬퍼요0화나요0후속기사 원해요0댓글[서울=뉴시스] 최희정 기자 = LG이노텍은 정철동 사장과 임직원들이 코로나19 의료진에게 감사와 응원의 마음을 전하기 위해 \'#덕분에 챌린지\' 캠페인에 동참했다고 23일 밝혔다. #덕분에 챌린지는 코로나19 의료진과 방역인원들을 응원하기 위해 중앙재난안전대책본부가 시작한 참여형 릴레이 캠페인이다. \'존경\'을 의미하는 수어 동작(왼손바닥 위에 오른손 주먹을 올리고 엄지 손가락을 세움)을 촬영해 \'#덕분에 챌린지\', \'#의료진 덕분에\' 등 해시태그를 달아 SNS에 게시한다. 이 캠페인은 참여자가 다음 참여자 3명을 지명하는 방식으로 이어진다.정철동 LG이노텍 사장은 이석희 SK하이닉스 사장의 지명으로 캠페인에 참여했다. 정 사장을 포함한 15명의 LG이노텍 임직원들은 회사를 대표해 의료진을 향한 감사를 표했다. 정 사장은 다음 동참자로 경계현 삼성전기 사장과 전해상 도레이첨단소재 사장, 협력사인 이재현 오알켐 사장을 지명했다.정 사장은 ""코로나 사태 장기화에도 의료진의 희생과 노고가 있었기에 우리 모두가 코로나19를 슬기롭게 극복해 나가고 있는 것""이라며 ""이번 캠페인 참여를 통해 이분들께 깊은 감사와 응원의 마음을 전한다""고 말했다. 한편 LG이노텍은 코로나19 위기 극복을 위한 다양한 활동을 벌이고 있다. 지난 3월 코로나19 확산 방지 및 피해 복구 지원을 위해 총 6억원 상당의 성금과 방호복 등 방역 물품을 사회복지공동모금회에 기부했다. 4월에는 코로나19로 어려움을 겪는 중소 협력사들을 위해 총 1500억원 규모의 동반성장펀드와 납품 대금을 앞당겨 지급했다.같은 달 LG이노텍은 구미시와 구미시 금오종합사회복지관에 홀몸 어르신, 장애인 등 취약계층을 위한 마스크 총 2만4000장을 지원했다. LG이노텍 노조도 4월부터 한 달여간 전국 4개 사업장에서 코로나19 지역사회 확산 방지를 위한 방역 활동에 앞장선 바 있다.☞공감언론 뉴시스 dazzling@newsis.com▶ 네이버에서 뉴시스 구독하기▶ K-Artprice, 유명 미술작품 가격 공개▶ 뉴시스 빅데이터 MSI 주가시세표 바로가기<ⓒ 공감언론 뉴시스통신사. 무단전재-재배포 금지>뉴시스 관련뉴스해당 언론사에서 선정하며 언론사 페이지(아웃링크)로 이동해 볼 수 있습니다.""ㅁㅁ씨가 거기를 보여줬대"" 교회 성추문 전말""아저씨 커터칼 좀 빌려주실래요?"" 20대여성 돌변""대학생 아들이 남한에 복수하러 나간다고 윽윽""한강서 발견된 부패한 영아 시신…용의자 유전자 검사중태진아 ""성진우는 배신자…나가더니 쫄딱 망해""좋아요0훈훈해요0슬퍼요0화나요0후속기사 원해요0기사제공 :']"
14,삼성전자, 2020-06-2309:13,머니투데이 ,"""코로나 의료진 고맙습니다"" LG이노텍 '#덕분에 챌린지' 동참",https://finance.naver.com/news/news_read.nhn?article_id=0004428942&office_id=008&mode=search&query=LG이노텍&page=1,"['       ""코로나 의료진 고맙습니다"" LG이노텍 \'#덕분에 챌린지\' 동참      기사입력2020-06-23 09:13기사원문좋아요훈훈해요좋아요 평가하기공감좋아요0훈훈해요0슬퍼요0화나요0후속기사 원해요0댓글 [머니투데이 심재현 기자] 정철동 LG이노텍 사장과 임직원들이 코로나19 의료진에게 감사와 응원의 마음을 전하기 위해 \'#덕분에 챌린지\' 캠페인에 동참했다. /사진제공=LG전자LG이노텍이 코로나19 의료진에 감사와 응원의 마음을 전하기 위해 \'#덕분에 챌린지\' 캠페인에 동참했다고 23일 밝혔다.\'#덕분에 챌린지\'는 코로나19 의료진과 방역인력을 응원하기 위해 중앙재난안전대책본부가 시작한 참여형 릴레이 캠페인이다. \'존경\'을 의미하는 수어 동작으로 왼손바닥 위에 오른손 주먹을 올리고 엄지 손가락을 세우는 모습을 촬영해 \'#덕분에 챌린지\', \'#의료진 덕분에\' 등의 해시태그를 달아 SNS(소셜네트워크서비스)에 게시하는 방식이다. 이 캠페인은 참여자가 다음 참여자 3명을 지명하는 방식으로 이어진다.정철동 LG이노텍 사장은 이석희 SK하이닉스 사장의 지명으로 캠페인에 참여했다. 정 사장을 포함한 15명의 LG이노텍 임직원은 회사를 대표해 의료진을 향한 감사를 표했다. 정 사장은 다음 동참자로 경계현 삼성전기 사장과 전해상 도레이첨단소재 사장, 협력사 대표인 이재현 오알켐 사장을 지명했다.정 사장은 ""코로나 사태 장기화에도 의료진의 희생과 노고가 있었기에 우리 모두가 코로나19를 슬기롭게 극복해 나가고 있는 것""이라며 ""캠페인 참여를 통해 이분들께 깊은 감사와 응원의 마음을 전한다""고 말했다. LG이노텍은 지난 3월 코로나19 확산 방지 및 피해 복구 지원을 위해 총 6억원 상당의 성금과 방호복 등 방역 물품을 사회복지공동모금회에 기부하는 등 코로나19 위기 극복을 위한 다양한 활동을 추진해왔다. 지난 4월에도 코로나19로 어려움을 겪는 중소 협력사를 위해 총 1500억원 규모의 동반성장펀드와 납품 대금을 앞당겨 지급했다.LG이노텍은 같은 달 구미시와 구미시 금오종합사회복지관에 홀몸 어르신, 장애인 등 취약계층을 위한 마스크 총 2만4000장을 지원했다. LG이노텍 노조도 4월부터 한달여 동안 전국 4개 사업장에서 코로나19 지역사회 확산 방지를 위한 방역 활동에 앞장섰다. 심재현 기자 urme@mt.co.kr▶줄리아 투자노트▶조 변호사의 가정상담소 ▶머니투데이 구독하기 <저작권자 ⓒ \'돈이 보이는 리얼타임 뉴스\' 머니투데이, 무단전재 및 재배포 금지>머니투데이 관련뉴스해당 언론사에서 선정하며 언론사 페이지(아웃링크)로 이동해 볼 수 있습니다.""이혼 후에도 연락해""…하리수-미키정, 갈라선 사연강형욱, 무릎 꿇고 ""미안해요""…훈련 중단 이유는?""입 안 보이면…"" 서양인이 마스크 꺼린 이유하리수, 10시간의 성전환 수술 ""아래를 망치로 세게 맞은 느낌""송윤아, 검은 원피스 입고 근황 공개…""자기관리 끝판왕""좋아요0훈훈해요0슬퍼요0화나요0후속기사 원해요0기사제공 :']"
15,삼성전자, 2020-06-2309:06,뉴스1 ,"LG이노텍, ‘덕분에 챌린지’ 동참",https://finance.naver.com/news/news_read.nhn?article_id=0004711422&office_id=421&mode=search&query=LG이노텍&page=1,"['       LG이노텍, ‘덕분에 챌린지’ 동참      기사입력2020-06-23 09:06기사원문좋아요훈훈해요좋아요 평가하기공감좋아요0훈훈해요0슬퍼요0화나요0후속기사 원해요0댓글(서울=뉴스1) = LG이노텍은 정철동 사장과 임직원이 코로나19 의료진에게 감사와 응원의 마음을 전하기 위해 ‘#덕분에 챌린지’ 캠페인에 동참했다고 23일 밝혔다. 서울 강서구 마곡 LG사이언스파크에 위치한 본사에서 정철동 사장과 임직원이 \'덕분에 챌린지’에 참여하며 기념촬영을 하고 있다. (LG이노텍 제공) 2020.6.23/뉴스1photo@news1.kr▶ 네이버 메인에서 [뉴스1] 구독하기!▶  뉴스1 바로가기 ▶  코로나19 뉴스 © 뉴스1코리아(news1.kr), 무단 전재 및 재배포 금지뉴스1 관련뉴스해당 언론사에서 선정하며 언론사 페이지(아웃링크)로 이동해 볼 수 있습니다.태진아 ""성진우는 배신자…돈 까먹고 나가더니 쫄딱 망했다""진중권 ""썩지 않은 인물 찾기 힘든 與, \'盧 예언\' 부메랑 됐다""41㎝ 장어 항문에 넣은 男…""변비에 좋다길래""김철민 ""간암, 세군데서 사라져 펜벤다졸 효과도 분명 있다""유아인의 자율주행 테슬라…국내 \'1호고객\' 정용진 차값은 2억좋아요0훈훈해요0슬퍼요0화나요0후속기사 원해요0기사제공 :']"
16,삼성전자, 2020-06-2308:47,아시아경제 ,"""의료진 감사합니다""…정철동 LG이노텍 사장 '덕분에 챌린지' 동참",https://finance.naver.com/news/news_read.nhn?article_id=0004703770&office_id=277&mode=search&query=LG이노텍&page=1,"['       ""의료진 감사합니다""…정철동 LG이노텍 사장 \'덕분에 챌린지\' 동참      기사입력2020-06-23 08:47기사원문좋아요훈훈해요좋아요 평가하기공감좋아요0훈훈해요0슬퍼요0화나요0후속기사 원해요0댓글서울 강서구 마곡 LG사이언스파크에 위치한 LG이노텍 본사에서 정철동 LG이노텍 사장을 비롯한 임직원 15명이 회사를 대표해 코로나19 의료진에게 감사와 응원의 마음을 전하기 위한 ‘#덕분에 챌린지’에 참여하고 있다. (사진 맨 앞줄 가운데 정철동 사장)[아시아경제 이기민 기자] 정철동 LG이노텍 사장과 임직원들이 신종 코로나바이러스감염증(코로나19) 의료진에게 감사와 응원의 마음을 전하기 위해 ‘#덕분에 챌린지’ 캠페인에 동참했다고 LG이노텍은 23일 밝혔다.#덕분에 챌린지는 코로나19 의료진과 방역인원들을 응원하기 위해 중앙재난안전대책본부가 시작한 참여형 릴레이 캠페인이다. 존경을 뜻하는 수어 동작(왼손바닥 위에 오른손 주먹을 올리고 엄지 손가락을 세움)을 촬영해 ‘#덕분에 챌린지’, ‘#의료진 덕분에’ 등 해시태그를 달아 SNS에 게시한다. 이 캠페인은 참여자가 다음 참여자 3명을 지명하는 방식으로 이어진다.정 사장은 이석희 SK하이닉스 사장의 지명으로 캠페인에 참여했다. 정 사장을 포함한 15명의 LG이노텍 임직원들은 회사를 대표해 의료진을 향한 감사를 표했다. 정 사장은 “코로나 사태 장기화에도 의료진의 희생과 노고가 있었기에 우리 모두가 코로나19를 슬기롭게 극복해 나가고 있는 것”이라며 “이번 캠페인 참여를 통해 이분들께 깊은 감사와 응원의 마음을 전한다”고 말했다.정 사장은 다음 동참자로 경계현 삼성전기 사장과 전해상 도레이첨단소재 사장, 협력사인 이재현 오알켐 사장을 지명했다.한편 LG이노텍은 코로나19 위기 극복을 위한 다양한 활동을 추진하고 있다. LG이노텍은 지난 3월 코로나19 확산 방지 및 피해 복구 지원을 위해 총 6억원 상당의 성금과 방호복 등 방역 물품을 사회복지공동모금회에 기부한 바 있다. 이어 4월에는 코로나19로 어려움을 겪는 중소 협력사들을 위해 총 1500억원 규모의 동반성장펀드와 납품 대금을 앞당겨 지급했다.이기민 기자 victor.lee@asiae.co.kr▶ 2020년 하반기, 재물운·연애운·건강운 체크!▶ 네이버에서 아시아경제 뉴스를 받아보세요 ▶ 놀 준비 되었다면 드루와!  드링킷!<ⓒ경제를 보는 눈, 세계를 보는 창 아시아경제 무단전재 배포금지>아시아경제 관련뉴스해당 언론사에서 선정하며 언론사 페이지(아웃링크)로 이동해 볼 수 있습니다.하리수 ""이혼 후 2년째 열애 중, 전 남편과는…""유재석, 이광수의 \'백상\' 수상에 ""논란이 될 수도""""한국 못 가""…인도 경찰에 붙잡힌 LG화학 지원단올여름 \'극한강수\' 온다…막대한 피해 생길수도\'强强强\' 이재명의 초강수 행정…민심이 반응했다좋아요0훈훈해요0슬퍼요0화나요0후속기사 원해요0기사제공 :']"
17,삼성전자, 2020-06-2308:30,뉴스1 ,"정철동 LG이노텍 사장, '덕분에 챌린지' 동참…""의료진 고맙습니다""",https://finance.naver.com/news/news_read.nhn?article_id=0004711335&office_id=421&mode=search&query=LG이노텍&page=1,"['       정철동 LG이노텍 사장, \'덕분에 챌린지\' 동참…""의료진 고맙습니다""      기사입력2020-06-23 08:30기사원문좋아요훈훈해요좋아요 평가하기공감좋아요0훈훈해요0슬퍼요0화나요0후속기사 원해요0댓글이석희 SK하이닉스 사장 지명으로 참여삼성전기·도레이첨단소재·오알켐 지목서울 강서구 마곡 LG사이언스파크에 위치한 LG이노텍 본사에서 정철동 LG이노텍 사장(사진 맨 앞줄 가운데)을 비롯한 임직원 15명이 회사를 대표해 코로나19 의료진에게 감사와 응원의 마음을 전하기 위한 \'#덕분에 챌린지\'에 참여하고 있다. (LG이노텍 제공)© 뉴스1(서울=뉴스1) 정상훈 기자 = 정철동 LG이노텍 사장과 임직원들은 23일 \'코로나19\'(신종 코로나바이러스 감염증) 의료진에게 감사와 응원의 마음을 전하는 \'#덕분에 챌린지\' 캠페인에 동참했다.\'#덕분에 챌린지\'는 코로나19 의료진과 방역인원들을 응원하기 위해 중앙재난안전대책본부가 시작한 참여형 릴레이 캠페인이다.\'존경\'을 의미하는 수어 동작(왼손바닥 위에 오른손 주먹을 올리고 엄지손가락을 세움)을 촬영해 \'#덕분에 챌린지\', \'#의료진 덕분에\' 등 해시태그를 달아 SNS에 게시한다. 이 캠페인은 참여자가 다음 참여자 3명을 지명하는 방식으로 이어진다.정철동 LG이노텍 사장은 전날(22일) 이석희 SK하이닉스 사장에게 지명을 받았다. 이에 정 사장을 포함한 15명의 LG이노텍 임직원들은 회사를 대표해 의료진을 향한 감사를 표했다.정 사장은 다음 동참자로 경계현 삼성전기 사장과 전해상 도레이첨단소재 사장, 협력사인 이재현 오알켐 사장을 지목했다.정 사장은 ""코로나 사태 장기화에도 의료진의 희생과 노고가 있었기에 우리 모두가 코로나19를 슬기롭게 극복해 나가고 있는 것""이라며 ""이번 캠페인 참여를 통해 이분들께 깊은 감사와 응원의 마음을 전한다""고 말했다.LG이노텍은 코로나19 위기 극복을 위한 다양한 활동을 적극 추진해왔다. 지난 3월에는 코로나19 확산 방지 및 피해 복구 지원을 위해 총 6억원 상당의 성금과 방호복 등 방역 물품을 사회복지공동모금회에 기부했다.4월에는 코로나19로 어려움을 겪는 중소 협력사들을 위해 총 1500억원 규모의 동반성장펀드와 납품 대금을 앞당겨 지급했다. 또한 구미시와 구미시 금오종합사회복지관에 홀몸 어르신, 장애인 등 취약계층을 위한 마스크 총 2만4000장을 지원하기도 했다.LG이노텍 노조도 4월부터 한달여 간 전국 4개 사업장에서 코로나19 지역사회 확산 방지를 위한 방역 활동에 앞장섰다.sesang222@news1.kr▶ 네이버 메인에서 [뉴스1] 구독하기!▶  뉴스1 바로가기 ▶  코로나19 뉴스 © 뉴스1코리아(news1.kr), 무단 전재 및 재배포 금지뉴스1 관련뉴스해당 언론사에서 선정하며 언론사 페이지(아웃링크)로 이동해 볼 수 있습니다.태진아 ""성진우는 배신자…돈 까먹고 나가더니 쫄딱 망했다""김철민 ""간암, 세군데서 사라져 펜벤다졸 효과도 분명 있다""41㎝ 장어 항문에 넣은 男…""변비에 좋다길래""유아인의 자율주행 테슬라…국내 \'1호고객\' 정용진 차값은 2억정청래 ""\'김종인 대망론\'이 속셈…주호영 이용해 洪, 黃 처리""좋아요0훈훈해요0슬퍼요0화나요0후속기사 원해요0기사제공 :']"
18,삼성전자, 2020-06-2308:20,연합뉴스 ,"LG이노텍, '덕분에 챌린지' 동참",https://finance.naver.com/news/news_read.nhn?article_id=0011696138&office_id=001&mode=search&query=LG이노텍&page=1,"['       LG이노텍, \'덕분에 챌린지\' 동참      기사입력2020-06-23 08:20기사원문좋아요훈훈해요좋아요 평가하기공감좋아요0훈훈해요0슬퍼요0화나요0후속기사 원해요0댓글    (서울=연합뉴스) LG이노텍이 정철동 사장과 임직원들이 코로나19 의료진에게 감사와 응원의 마음을 전하기 위해 \'#덕분에 챌린지\' 캠페인에 동참했다고 23일 밝혔다.    사진은 서울 강서구 마곡 LG사이언스파크에 위치한 LG이노텍 본사에서 정철동 LG이노텍 사장(가운데)을 비롯한 임직원들이 코로나19 의료진에게 감사와 응원의 마음을 전하기 위한 \'#덕분에 챌린지\'에 참여하는 모습. 2020.6.23    [LG이노텍 제공. 재판매 및 DB 금지]    photo@yna.co.kr▶코로나19 속보는 네이버 연합뉴스에서 [구독 클릭]▶[팩트체크] 한국은행이 5만원권 발행 중단?▶제보하기 연합뉴스 관련뉴스해당 언론사에서 선정하며 언론사 페이지(아웃링크)로 이동해 볼 수 있습니다.\xa0악명 높은 조직 두목, 엄마 체포되자 눈물로 보복 위협\xa0볼턴, 일본에 ""조현병 앓는다""…회고록 내용보니\xa090대 노인, 8차례 음성 9번째 검사서 양성 나온 원인은\xa0이 시국에 설마 \'전기세\' 까지 오를까?\xa057만 마리 살처분...밍크가 무슨 죄?좋아요0훈훈해요0슬퍼요0화나요0후속기사 원해요0기사제공 :']"
19,삼성전자, 2020-06-2303:05,세계일보 ,“의료진을 응원합니다”…SK하이닉스도 ‘#덕분에챌린지’ 동참,https://finance.naver.com/news/news_read.nhn?article_id=0003477428&office_id=022&mode=search&query=LG이노텍&page=1,"['       “의료진을 응원합니다”…SK하이닉스도 ‘#덕분에챌린지’ 동참      기사입력2020-06-23 03:05기사원문좋아요훈훈해요좋아요 평가하기공감좋아요0훈훈해요0슬퍼요0화나요0후속기사 원해요0댓글    사진=SK하이닉스    SK하이닉스 이석희 대표이사와 임직원들이 신종 코로나바이러스 감염증(코로나19)으로 고군분투하는 의료진을 응원하는 ‘덕분에 챌린지’ 캠페인에 동참했다.   22일 SK하이닉스 뉴스룸에 따르면 이 대표는 대한전자공학회 임혜숙 교수의 지명으로 임직원들과 함께 캠페인에 참여했다.   ‘덕분에 챌린지’는 코로나19 확산 방지와 환자들의 치료에 헌신하는 의료진을 격려하기 위해 중앙재난안전대책본부에서 시작한 캠페인이다. 참여는 사회관계망서비스(SNS)에 존경을 의미하는 수어를 표현한 모습을 찍은 사진과 관련 해시태그(#덕분에챌린지 #의료진덕분에 등)를 함께 게시하고 다음 참여자를 지목하는 방식으로 진행한다.   이 대표는 다음 주자로 정철동 LG이노텍 대표이사, 황철주 주성엔지니어링 대표이사, 문재균 카이스트(KAIST) 전기·전자공학부장 등을 지명했다.   캠페인에 앞서 SK하이닉스는 코로나19와 관련해 중소 협력사에 대한 경제적 지원을 확대했다. 중소 협력사에 대한 납품 대금 지급 횟수를 월 4회로 늘려 자금 유동성을 높이고 협력사 상생펀드 가용금액 1300억원을 피해가 큰 협력사에 우선 지원했다. 의료진과 구호인력 1만명에게 5억원 규모의 방호용품 등을 제공했고 사업장이 있는 이천과 청주에서는 취약계층에게 물품을 지원했다. 이외에 매출 하락으로 어려움을 겪는 소상공인을 위해 회사 구내식당을 닫고 주변 음식점을 이용해 지역상권 살리기에 동참했다.   권구성 기자 ks@segye.comⓒ 세상을 보는 눈, 세계일보세계일보 관련뉴스해당 언론사에서 선정하며 언론사 페이지(아웃링크)로 이동해 볼 수 있습니다.벽 뜯으니 \'폐기물\' 잔뜩…인테리어 \'날벼락\'이상화, 파격 단발에 볼륨감까지 자랑하며 강남에게? ""오빠 나 어떰""쌍둥이가 태어났는데 아버지가 다르다니""진돗개 2마리 입양보냈더니 개소주 해 먹어""\'오뚜기 장녀\' 함연지 ""대학 룸메이트는 농심 회장 손녀.. 나중에 정체 알았다""좋아요0훈훈해요0슬퍼요0화나요0후속기사 원해요0기사제공 :']"
