,회사명,날짜,언론사,기사제목,링크,본문
6,삼성전자, 2020-06-2310:01,서울경제 ,"""의료진 여러분 감사합니다"" 정철동 LG이노텍 사장, '덕분에 챌린지' 완료",https://finance.naver.com/news/news_read.nhn?article_id=0003757527&office_id=011&mode=search&query=LG이노텍&page=1,"['       ""의료진 여러분 감사합니다"" 정철동 LG이노텍 사장, \'덕분에 챌린지\' 완료      기사입력2020-06-23 10:01기사원문좋아요훈훈해요좋아요 평가하기공감좋아요0훈훈해요0슬퍼요0화나요0후속기사 원해요0댓글바통은 경계현 삼성전기 사장 등으로 전달정철동(첫번째 줄 가운데) LG이노텍 사장과 임직원들이 코로나19에 맞서 싸우는 의료진을 위해 존경과 감사의 마음을 수어로 표현하고 있다./사진제공=LG이노텍[서울경제] LG이노텍(011070)이 신종 코로나 바이러스 감염증(코로나19)에 맞서 싸우는 의료진에게 감사와 응원을 전하는 ‘#덕분에 챌린지’ 캠페인에 힘을 보탰다.23일 LG이노텍에 따르면 정철동 사장과 임직원들은 존경을 뜻하는 수어 동작을 취한 뒤 이 모습을 촬영한 영상이나 사진을 지정된 해시태그를 달아 소셜네트워크서비스(SNS)에 게시했다. ‘#덕분에 챌린지’는 코로나19 의료진과 방역인원들을 응원하기 위해 중앙재난안전대책본부가 시작한 참여형 릴레이 캠페인이다. 이 캠페인은 참여자가 다음 참여자 3명을 지명하는 방식으로 이어진다.정철동 LG이노텍 사장은 지난 21일 이석희 SK하이닉스 사장이 지명해 이 캠페인에 참가하게 됐다. 정 사장을 포함한 15명의 LG이노텍 임직원들은 회사를 대표해 의료진을 향한 감사를 표했다. 정 사장은 다음 동참자로 경계현 삼성전기(009150) 사장과 전해상 도레이첨단소재 사장, 협력사인 이재현 오알켐 사장을 지명했다. 정 사장은 “코로나 사태 장기화에도 의료진의 희생과 노고가 있었기에 우리 모두가 코로나19를 슬기롭게 극복해 나가고 있는 것”이라며 “이번 캠페인 참여를 통해 이분들께 깊은 감사와 응원의 마음을 전한다”고 말했다.  한편 LG이노텍은 코로나19 위기 극복을 위한 다양한 활동을 적극 추진해왔다. 지난 3월에는 코로나19 확산 방지 및 피해 복구 지원을 위해 총 6억원 상당의 성금과 방호복 등 방역 물품을 사회복지공동모금회에 기부했다. 이어 4월에는 코로나19로 어려움을 겪는 중소 협력사들을 위해 총 1,500억원 규모의 동반성장펀드와 납품 대금을 앞당겨 지급했다. 또한 같은 달 LG이노텍은 구미시와 구미시 금오종합사회복지관에 홀몸 어르신, 장애인 등 취약계층을 위한 마스크 총 2만 4,000장을 지원했다. LG이노텍 노조도 4월부터 한 달여간 전국 4개 사업장에서 코로나19 지역사회 확산 방지를 위한 방역 활동에 앞장섰다. /이수민기자 noenemy@sedaily.com[서울경제 바로가기]▶ 네이버 채널에서 \'서울경제\' 구독해주세요!▶ [서울포럼 2020] 과학기술 초격차가 답이다저작권자 ⓒ 서울경제, 무단 전재 및 재배포 금지서울경제 관련뉴스해당 언론사에서 선정하며 언론사 페이지(아웃링크)로 이동해 볼 수 있습니다.文대통령, 추미애·윤석열 향해 ""서로 협력하면서 과감한 개혁""""문재인 정부 들어 집값 천정부지로"" 심상정, 6·17 부동산 대책 연일 \'맹비난\'文정부 규제가 부른 후분양···\'강남불패\' 더 굳건해지나오정세 \'동화에서 튀어나온 요정세\' 권경민, 노규태 아냐 ""귀염둥이야""이재명 \'지분 쪼개기\' 기획부동산 손발 묶는다좋아요0훈훈해요0슬퍼요0화나요0후속기사 원해요0기사제공 :']"
7,삼성전자, 2020-06-2309:54,머니S ,"“코로나19 의료진 고맙습니다”… LG이노텍, ‘덕분에 챌린지’ 동참",https://finance.naver.com/news/news_read.nhn?article_id=0000558852&office_id=417&mode=search&query=LG이노텍&page=1,"['       “코로나19 의료진 고맙습니다”… LG이노텍, ‘덕분에 챌린지’ 동참      기사입력2020-06-23 09:54기사원문좋아요훈훈해요좋아요 평가하기공감좋아요0훈훈해요0슬퍼요0화나요0후속기사 원해요0댓글서울 강서구 마곡 LG사이언스파크에 위치한 LG이노텍 본사에서 정철동 LG이노텍 사장(맨 앞줄 가운데)을 비롯한 임직원 15명이 회사를 대표해 코로나19 의료진에게 감사와 응원의 마음을 전하기 위한 ‘#덕분에 챌린지’에 참여하고 있다. / 사진=LG이노텍LG이노텍은 정철동 사장과 임직원들이 코로나19 의료진에게 감사와 응원의 마음을 전하기 위해 ‘#덕분에 챌린지’ 캠페인에 동참했다고 23일 밝혔다.‘#덕분에 챌린지’는 코로나19 의료진과 방역인원들을 응원하기 위해 중앙재난안전대책본부가 시작한 참여형 릴레이 캠페인이다. ‘존경’을 의미하는 수어 동작(왼손바닥 위에 오른손 주먹을 올리고 엄지 손가락을 세움)을 촬영해 ‘#덕분에 챌린지’, ‘#의료진 덕분에’ 등 해시태그를 달아 SNS에 게시한다. 이 캠페인은 참여자가 다음 참여자 3명을 지명하는 방식으로 이어진다.정철동 LG이노텍 사장은 이석희 SK하이닉스 사장의 지명으로 캠페인에 참여했다. 정 사장을 포함한 15명의 LG이노텍 임직원들은 회사를 대표해 의료진을 향한 감사를 표했다. 정 사장은 다음 동참자로 경계현 삼성전기 사장과 전해상 도레이첨단소재 사장, 협력사인 이재현 오알켐 사장을 지명했다.정 사장은 “코로나 사태 장기화에도 의료진의 희생과 노고가 있었기에 우리 모두가 코로나19를 슬기롭게 극복해 나가고 있는 것”이라며 “이번 캠페인 참여를 통해 이분들께 깊은 감사와 응원의 마음을 전한다”고 말했다.이한듬 기자 mumford@mt.co.kr▶ 고수들의 재테크 비법 영상▶거품 뺀 솔직 시승기 ▶ 코로나19 속보 <저작권자 ⓒ \'성공을 꿈꾸는 사람들의 경제 뉴스\' 머니S, 무단전재 및 재배포 금지>머니S 관련뉴스해당 언론사에서 선정하며 언론사 페이지(아웃링크)로 이동해 볼 수 있습니다.\'펜벤다졸 복용\' 김철민, 간에 퍼진 암 사라졌다?""둘이 뭐하는 거야?""… 뒤엉킨 두 모델 \'야릇해\'박신혜, 연인 최태준과 애정전선에 입 열었다\'반지의 제왕\' 배우 이안 홈 별세… 그는 누구?53세 엄정화 다이어트 비법 \'키토제닉 식단\' 무엇?좋아요0훈훈해요0슬퍼요0화나요0후속기사 원해요0기사제공 :']"
8,삼성전자, 2020-06-2309:31,아이뉴스24 ,정철동 LG이노텍 사장도 '덕분에 챌린지' 캠페인 동참,https://finance.naver.com/news/news_read.nhn?article_id=0000544085&office_id=031&mode=search&query=LG이노텍&page=1,"['       정철동 LG이노텍 사장도 \'덕분에 챌린지\' 캠페인 동참      기사입력2020-06-23 09:31기사원문좋아요훈훈해요좋아요 평가하기공감좋아요0훈훈해요0슬퍼요0화나요0후속기사 원해요0댓글다음 동참자로 경계현 삼성전기 사장 지목[아이뉴스24 윤선훈 기자] LG이노텍은 정철동 사장과 임직원들이 코로나19 의료진에게 감사와 응원의 마음을 전하기 위해 \'#덕분에 챌린지\' 캠페인에 동참했다고 23일 밝혔다.\'#덕분에 챌린지\'는 코로나19 의료진과 방역 인원들을 응원하기 위해 중앙재난안전대책본부가 시작한 참여형 릴레이 캠페인이다. 존경을 의미하는 수어 동작(왼손바닥 위에 오른손 주먹을 올리고 엄지 손가락을 세움)을 촬영해 \'#덕분에 챌린지\', \'#의료진 덕분에\' 등 해시태그를 달아 SNS에 게시한다. 이 캠페인은 참여자가 다음 참여자 3명을 지명하는 방식으로 이어진다.서울 강서구 마곡 LG사이언스파크에 위치한 LG이노텍 본사에서 정철동 LG이노텍 사장을 비롯한 임직원 15명이 회사를 대표해 코로나19 의료진에게 감사와 응원의 마음을 전하기 위한 \'#덕분에 챌린지\'에 참여하고 있다. [LG이노텍]정철동 LG이노텍 사장은 이석희 SK하이닉스 사장의 지명으로 캠페인에 참여했다. 정 사장을 포함한 15명의 LG이노텍 임직원들은 회사를 대표해 의료진을 향한 감사를 표했다. 정 사장은 다음 동참자로 경계현 삼성전기 사장과 전해상 도레이첨단소재 사장, 협력사인 이재현 오알켐 사장을 지명했다.정 사장은 ""코로나 사태 장기화에도 의료진의 희생과 노고가 있었기에 우리 모두가 코로나19를 슬기롭게 극복해 나가고 있는 것""이라며 ""이번 캠페인 참여를 통해 이분들께 깊은 감사와 응원의 마음을 전한다""고 말했다.윤선훈기자 krel@inews24.com▶네이버 채널에서 \'아이뉴스24\'를 구독해주세요.▶재밌는 아이뉴스TV 영상보기  ▶아이뉴스24 바로가기[ⓒ 아이뉴스24 무단전재 및 재배포 금지]아이뉴스24 관련뉴스해당 언론사에서 선정하며 언론사 페이지(아웃링크)로 이동해 볼 수 있습니다.정찬성 감정 폭발 ""결혼 전으로 돌아가고 싶다""…아내 박선영 당혹은평서 관악까지 \'단 20분\'…서울 서부선 경전철 2028년 개통구글·페이스북, 韓 쇼핑 대전 참전애플, 2년내 커스텀칩 탑재 초고성능 맥 공급클라우드 시장, AWS-MS 누가 웃을까좋아요0훈훈해요0슬퍼요0화나요0후속기사 원해요0기사제공 :']"
9,삼성전자, 2020-06-2309:22,데일리안 ,"LG이노텍, ‘덕분에 챌린지’ 동참...의료진 노고에 감사",https://finance.naver.com/news/news_read.nhn?article_id=0002409926&office_id=119&mode=search&query=LG이노텍&page=1,"['       LG이노텍, ‘덕분에 챌린지’ 동참...의료진 노고에 감사      기사입력2020-06-23 09:22기사원문좋아요훈훈해요좋아요 평가하기공감좋아요0훈훈해요0슬퍼요0화나요0후속기사 원해요0댓글중앙재난안전대책본부가 시작한 참여형 릴레이 캠페인정철동 LG이노텍 사장(맨 앞줄 가운데)이 서울 강서구 마곡 LG사이언스파크 내에 위치한 본사에서 정철동 사장을 비롯한 임직원 15명이 회사를 대표해 코로나19 의료진에게 감사와 응원의 마음을 전하기 위한 ‘#덕분에 챌린지’에 참여하고 있다.ⓒLG이노텍LG이노텍은 정철동 사장과 임직원들이 신종 코로나바이러스 감염증(코로나19) 의료진에게 감사와 응원의 마음을 전하기 위해 ‘#덕분에 챌린지’ 캠페인에 동참했다고 23일 밝혔다.‘#덕분에 챌린지’는 코로나19 의료진과 방역인원들을 응원하기 위해 중앙재난안전대책본부가 시작한 참여형 릴레이 캠페인이다.‘존경’을 의미하는 수어 동작(왼손바닥 위에 오른손 주먹을 올리고 엄지 손가락을 세움)을 촬영해 ‘#덕분에 챌린지’, ‘#의료진 덕분에’ 등 해시태그를 달아 사회관계망서비스(SNS)에 게시한다. 이 캠페인은 참여자가 다음 참여자 3명을 지명하는 방식으로 이어진다.정철동 사장은 이석희 SK하이닉스 사장의 지명으로 캠페인에 참여했다. 정 사장을 포함한 15명의 LG이노텍 임직원들은 회사를 대표해 의료진을 향한 감사를 표했다. 정 사장은 다음 동참자로 경계현 삼성전기 사장과 전해상 도레이첨단소재 사장, 협력사인 이재현 오알켐 사장을 지명했다.정 사장은 “코로나 사태 장기화에도 의료진의 희생과 노고가 있었기에 우리 모두가 코로나19를 슬기롭게 극복해 나가고 있는 것”이라며 “이번 캠페인 참여를 통해 이분들께 깊은 감사와 응원의 마음을 전한다”고 말했다.한편 LG이노텍은 코로나19 위기 극복을 위한 다양한 활동을 적극 추진해왔다. 지난 3월에는 코로나19 확산 방지 및 피해 복구 지원을 위해 총 6억원 상당의 성금과 방호복 등 방역 물품을 사회복지공동모금회에 기부했다. 이어 4월에는 코로나19로 어려움을 겪는 중소 협력사들을 위해 총 1,500억원 규모의 동반성장펀드와 납품 대금을 앞당겨 지급했다.같은 달 LG이노텍은 구미시와 구미시 금오종합사회복지관에 홀몸 어르신과 장애인 등 취약계층을 위한 마스크 총 2만4000장을 지원했다. LG이노텍 노조도 4월부터 한 달여간 전국 4개 사업장에서 코로나19 지역사회 확산 방지를 위한 방역 활동에 앞장선 바 있다.데일리안 이홍석 기자 (redstone@dailian.co.kr)ⓒ (주)데일리안 - 무단전재, 변형, 무단배포 금지데일리안 관련뉴스해당 언론사에서 선정하며 언론사 페이지(아웃링크)로 이동해 볼 수 있습니다.""LG이노텍, 실적 확대·주가 재평가 기대...목표가↑""-NH투자증권\'LG이노텍, 광확솔루션 사업부 호조에 실적 확대 전망…목표가↑\'-하이투자증권\'LG이노텍, 1분기 실적 컨센서스 상회...적극적 매수 대응\'-메리츠증권LG이노텍, 애플 \'꽉\' 붙잡는다…아이폰·아이패드에 TOF 공급 유력""LG이노텍, 올해 TOF 빅 사이클 주목···목표가↑""-신한금융투자좋아요0훈훈해요0슬퍼요0화나요0후속기사 원해요0기사제공 :']"
10,삼성전자, 2020-06-2309:22,한국경제 ,"'LG이노텍' 5% 이상 상승, 긴 호흡도 좋다 - 대신증권, BUY(유지)",https://finance.naver.com/news/news_read.nhn?article_id=0004365653&office_id=015&mode=search&query=LG이노텍&page=1,"['       \'LG이노텍\' 5% 이상 상승, 긴 호흡도 좋다 - 대신증권, BUY(유지)      기사입력2020-06-23 09:22기사원문좋아요훈훈해요좋아요 평가하기공감좋아요0훈훈해요0슬퍼요0화나요0후속기사 원해요0댓글◆ 최근 애널리스트 분석의견- 긴 호흡도 좋다 - 대신증권, BUY(유지)06월 17일 대신증권의 박강호 애널리스트는 LG이노텍에 대해 ""1) 2020년 하반기 매출과 영업이익 증가는 전략 고객사 신스마트폰에 추가로 ToF 카메라를 공급 예정. 스마트폰의 차별화는 카메라모듈과 ToF에 의존, 중국 경쟁업체와 비교하면 생산 안정화, 기술 경쟁 우위를 바탕으로 고객사내 높은 점유율은 2020년 하반기 유지 전망. 2) 2020년 하반기에 LED와 전자부품 및 전장부품 중심으로 일부 경영효율화 진행, 저수익 사업 축소를 추진하여 2021년 수익성 개선 전망, 긍정적으로 평가.""이라고 분석하며, 투자의견 \'BUY(유지)\', 목표주가 \'190,000원\'을 제시했다.한경로보뉴스이 기사는 한국경제신문과 금융 AI 전문기업 씽크풀이 공동 개발한 기사 자동생성 알고리즘에 의해 실시간으로 작성된 것입니다.▶ 네이버에서 한국경제 뉴스를 받아보세요▶ 한경닷컴 바로가기  ▶ 모바일한경 구독신청 ⓒ 한국경제 & hankyung.com, 무단전재 및 재배포 금지한국경제 관련뉴스해당 언론사에서 선정하며 언론사 페이지(아웃링크)로 이동해 볼 수 있습니다.""文대통령 약속대로""…인천공항 또 터졌다\'전염력 10배\' 변종 바이러스 출현…전세계 비상""우린 이제 글렀다""…폐업 준비하는 회사들""한국에 곧 엄청난 기회 온다"" 파격 전망""14억대 강남 아파트, 지금은…"" 집주인들 흥분좋아요0훈훈해요0슬퍼요0화나요0후속기사 원해요0기사제공 :']"
11,삼성전자, 2020-06-2309:21,연합뉴스 ,"LG이노텍 정철동 사장, 코로나19 '덕분에 챌린지'",https://finance.naver.com/news/news_read.nhn?article_id=0011696262&office_id=001&mode=search&query=LG이노텍&page=1,"['       LG이노텍 정철동 사장, 코로나19 \'덕분에 챌린지\'      기사입력2020-06-23 09:21기사원문좋아요훈훈해요좋아요 평가하기공감좋아요0훈훈해요0슬퍼요0화나요0후속기사 원해요0댓글 (서울=연합뉴스) 서미숙 기자 = LG이노텍은 정철동 사장과 임직원들이 신종 코로나바이러스 감염증(코로나19) 의료진에게 감사와 응원의 마음을 전하기 위해 \'#덕분에 챌린지\' 캠페인에 동참했다고 23일 밝혔다.    덕분에 챌린지는 코로나19 의료진과 방역인원을 응원하기 위해 중앙재난안전대책본부가 시작한 참여형 릴레이 캠페인이다. 서울 강서구 마곡 LG사이언스파크에 위치한 LG이노텍 본사에서 정철동 LG이노텍 사장을 비롯한 임직원 15명이 회사를 대표해 코로나19 의료진에게 감사와 응원의 마음을 전하기 위한 \'#덕분에 챌린지\'에 참여하고 있다. 사진 맨 앞줄 가운데 정철동 LG이노텍 사장. [LG이노텍 제공]정철동 LG이노텍 사장은 이석희 SK하이닉스 사장의 지명으로 캠페인에 참여했다. 정 사장을 포함한 15명의 LG이노텍 임직원들도 회사를 대표해 의료진을 향한 감사 인사를 전했다.     정 사장은 ""코로나 사태 장기화에도 의료진의 희생과 노고가 있었기에 어려움을 슬기롭게 극복해 나가고 있는 것""이라며 ""이번 캠페인 참여를 통해 의료진 등에게 깊은 감사와 응원의 마음을 전한다""고 말했다.    정철동 사장은 다음 동참자로 경계현 삼성전기 사장과 전해상 도레이첨단소재 사장, 협력사인 이재현 오알켐 사장을 지명했다.     sms@yna.co.kr▶코로나19 속보는 네이버 연합뉴스에서 [구독 클릭]▶[팩트체크] 한국은행이 5만원권 발행 중단?▶제보하기 연합뉴스 관련뉴스해당 언론사에서 선정하며 언론사 페이지(아웃링크)로 이동해 볼 수 있습니다.\xa0악명 높은 조직 두목, 엄마 체포되자 눈물로 보복 위협\xa0볼턴, 일본에 ""조현병 앓는다""…회고록 내용보니\xa090대 노인, 8차례 음성 9번째 검사서 양성 나온 원인은\xa0이 시국에 설마 \'전기세\' 까지 오를까?\xa057만 마리 살처분…밍크가 무슨 죄?좋아요0훈훈해요0슬퍼요0화나요0후속기사 원해요0기사제공 :']"
12,삼성전자, 2020-06-2309:16,이데일리 ,"LG이노텍, '덕분에 챌린지' 동참…""코로나 19 의료진에 감사""",https://finance.naver.com/news/news_read.nhn?article_id=0004671336&office_id=018&mode=search&query=LG이노텍&page=1,"['       LG이노텍, \'덕분에 챌린지\' 동참…""코로나 19 의료진에 감사""      기사입력2020-06-23 09:16기사원문좋아요훈훈해요좋아요 평가하기공감좋아요0훈훈해요0슬퍼요0화나요0후속기사 원해요0댓글LG이노텍, 정철동 사장 및 임직원 \'덕분에 챌린지\'동참코로나 19 위기 극복 위한 다양한 활동 추진해…[이데일리 배진솔 기자] LG이노텍(011070)은 정철동 LG이노텍 사장과 임직원들이 신종 코로나바이러스 감염증(코로나 19) 의료진에게 감사와 응원의 마음을 전하기 위해 ‘덕분에 챌린지’ 캠페인에 동참했다고 23일 밝혔다.덕분에 챌린지는 코로나 19 의료진과 방역인원들을 응원하기 위해 중앙재난안전대책본부가 시작한 참여형 릴레이 캠페인이다. 존경을 의미하는 수어 동작(왼손바닥 위에 오른손 주먹을 올리고 엄지 손가락을 세움)을 촬영해 덕분에 챌린지, 의료진 덕분에 등 해시태그를 달아 사회관계망서비스(SNS)에 게시한다. 이 캠페인은 참여자가 다음 참여자 3명을 지명하는 방식으로 이어진다.정철동 사장은 이석희 SK하이닉스(000660) 사장의 지명으로 캠페인에 참여했다. 정 사장을 포함한 15명의 LG이노텍 임직원들은 회사를 대표해 의료진을 향한 감사를 표했다. 정 사장은 다음 동참자로 경계현 삼성전기(009150) 사장과 전해상 도레이첨단소재 사장, 협력사인 이재현 오알켐 사장을 지명했다. 정 사장은 “코로나 사태 장기화에도 의료진의 희생과 노고가 있었기에 우리 모두가 코로나 19를 슬기롭게 극복해 나가고 있는 것”이라며 “이번 캠페인 참여를 통해 이분들께 깊은 감사와 응원의 마음을 전한다”고 말했다.  한편 LG이노텍은 코로나 19 위기 극복을 위한 다양한 활동을 적극 추진해왔다. 지난 3월에는 코로나 19 확산 방지 및 피해 복구 지원을 위해 총 6억 원 상당의 성금과 방호복 등 방역 물품을 사회복지공동모금회에 기부했다. 이어 4월에는 코로나 19로 어려움을 겪는 중소 협력사들을 위해 총 1500억 원 규모의 동반성장펀드와 납품 대금을 앞당겨 지급했다.같은 달 LG이노텍은 구미시와 구미시 금오 종합사회복지관에 홀몸 어르신, 장애인 등 취약계층을 위한 마스크 총 2만 4000장을 지원했다. LG이노텍 노조도 4월부터 한 달여간 전국 4개 사업장에서 코로나 19 지역사회 확산 방지를 위한 방역 활동에 앞장선 바 있다. 서울 강서구 마곡 LG사이언스파크에 위치한 LG이노텍 본사에서 정철동 LG이노텍 사장을 비롯한 임직원 15명이 회사를 대표해 코로나19 의료진에게 감사와 응원의 마음을 전하기 위한 ‘덕분에 챌린지’에 참여하고 있다. (사진 맨 앞줄 가운데 정철동 LG이노텍 사장) (사진=LG이노텍)배진솔 (sincere1@edaily.co.kr)네이버에서 ‘이데일리’ 구독하기▶청춘뉘우스~ 스냅타임▶＜ⓒ종합 경제정보 미디어 이데일리 - 무단전재 & 재배포 금지＞이데일리 관련뉴스해당 언론사에서 선정하며 언론사 페이지(아웃링크)로 이동해 볼 수 있습니다.곧 2분기 어닝시즌…실적 눈높이 높아진 종목은""역할 분담해 74명 성착취한 조주빈 일당, 최대 무기징역""술 취한 女 부축하는 척 추행한 소방관…""직업의식 발휘한 것""하리수 ""아이 원해 자궁 이식 수술 고려"" 남친 있다\'5선\' 정진석-\'590억\' 박덕흠, 사돈 맺었다좋아요0훈훈해요0슬퍼요0화나요0후속기사 원해요0기사제공 :']"
