,회사명,날짜,언론사,기사제목,링크,본문
10,삼성전자, 2020-04-2908:07,이데일리 ,"LG이노텍, 코로나19 진정 관건…여전한 경쟁 우위 주목-삼성",https://finance.naver.com/news/news_read.nhn?article_id=0004630102&office_id=018&mode=search&query=LG이노텍&page=1,"[""       LG이노텍, 코로나19 진정 관건…여전한 경쟁 우위 주목-삼성      기사입력2020-04-29 08:07기사원문좋아요훈훈해요좋아요 평가하기공감좋아요0훈훈해요0슬퍼요0화나요0후속기사 원해요0댓글 [이데일리 문승관 기자] 삼성증권은 29일 LG이노텍(011070)에 대해 고객사가 스마트폰 카메라에 대한 예산을 늘리고 있고 경쟁사보다 경쟁 우위를 유지하고 있어 코로나19사태의 진정 여부가 앞으로 관건이라고 평가했다. 목표주가 16만원과 투자의견 매수를 기존대로 유지했다.이종욱 삼성증권 연구원은 “1분기 매출액 2조원과 영업이익 1380억원은 기존 추정치를 웃도는 실적이다”며 “고객사의 공급 안정성 확보를 위해 2분기 주문이 1분기로 유입된 영향이 가장 크다”고 판단했다.이에 따라 이익전망 변경 비수기인 2분기 이익을 419억원으로 조정하나 하반기의 최대 이익 트렌드는 유지할 것으로 내다봤다. 올해 연간 영업이익도 5822억원으로 소폭 상향 조정했다.이 연구원은 “중요한 것은 고객사가 스마트폰 카메라 예산을 늘리고 있고 LG이노텍이 고객사 내 경쟁 우위를 유지하고 있다”며 “코로나19의 진정과 모바일 수요의 회복 시기를 예측이 어렵지만 방향에 대한 개연성은 크다”고 예상했다.이어 그는 “따라서 비수기인 2분기 실적 우려감이나 한 달 정도 차이의 하반기 플래그십 출시 시기는 현재로선 크게 중요하지 않다”며 “카메라모듈은 높은 이익 창출 능력을 보여줬고 기판소재사업부는 스마트폰 메인기판(HDI기판) 사업 종료 이후 이익 개선세가 뚜렷해지고 있다. LED의 효율화 전략의 강도가 커지는 점에 주목해야 한다”고 설명했다.문승관 (ms7306@edaily.co.kr)네이버에서 ‘이데일리’ 구독하기▶청춘뉘우스~ 스냅타임▶＜ⓒ종합 경제정보 미디어 이데일리 - 무단전재 & 재배포 금지＞이데일리 관련뉴스해당 언론사에서 선정하며 언론사 페이지(아웃링크)로 이동해 볼 수 있습니다.인사라며 6학년생 껴안기..울산 교사 심장으로 말해2등은 없다…슈퍼스타 기업만 살아남는다韓키트 평가 운운 日, 국민은 검사도 못받고 '고독사'강훈은 '출금'·이원호는 '홍보'…조주빈, 월급 주며 관리율희 최민환 입대로 독박 육아? 밤새워 논다 이중생활 공개좋아요0훈훈해요0슬퍼요0화나요0후속기사 원해요0기사제공 :""]"
11,삼성전자, 2020-04-2908:05,머니투데이 ,"LG이노텍, 코로나19에도 실적 성장 가능성-이베스트투자증권",https://finance.naver.com/news/news_read.nhn?article_id=0004401812&office_id=008&mode=search&query=LG이노텍&page=1,"['       LG이노텍, 코로나19에도 실적 성장 가능성-이베스트투자증권      기사입력2020-04-29 08:05기사원문좋아요훈훈해요좋아요 평가하기공감좋아요0훈훈해요0슬퍼요0화나요0후속기사 원해요0댓글 [머니투데이 김사무엘 기자] 이베스트투자증권은 IT부품 업체 LG이노텍이 코로나19(COVID-19)에도 1분기 깜짝 실적을 기록했다고 29일 분석했다. 투자의견 \'매수\'를 유지하고 목표주가는 기존 15만원에서 17만6000원으로 상향했다.이왕진 이베스트투자증권 연구원은 ""LG이노텍의 1분기 실적은 전년 동기대비 46.9% 늘어난 2조원, 영업이익은 흑자전환한 1379억원을 기록했다""며 ""코로나19로 인한 스마트폰 부품 공급 우려로 고객사의 주문 수요가 폭발했기 때문""이라고 분석했다.그는 ""현재 스마트폰 밸류체인이 직면한 문제에도 LG이노텍은 모듈 가격상승이 공급량 하락분을 상쇄하며 올해 실적이 오히려 성장할 가능성이 크다""며 ""실질적으로 리스크가 상존하는 구간이지만 내년 성장엔 이견이 없기 때문에 분할 매수가 유효하단 판단""이라고 설명했다.김사무엘 기자 samuel@mt.co.kr▶줄리아 투자노트▶조 변호사의 가정상담소 ▶머니투데이 구독하기 <저작권자 ⓒ \'돈이 보이는 리얼타임 뉴스\' 머니투데이, 무단전재 및 재배포 금지>머니투데이 관련뉴스해당 언론사에서 선정하며 언론사 페이지(아웃링크)로 이동해 볼 수 있습니다.아베의 \'한국 때리기\' 동조하던 日언론, 갑자기 ""한국 배우자""삼성 도움으로 살아난 기업들, 코로나 닥치자…수급 붕괴된 원유 ETN…\'슈퍼개미\' 20억 베팅이 시작이었다적자에도 ""사자""… 정유株는 왜 70% 폭등할까?아사히신문, BBC…앞다퉈 \'대구\' 취재하는 해외 언론들, 왜?좋아요0훈훈해요0슬퍼요0화나요0후속기사 원해요0기사제공 :']"
12,삼성전자, 2020-04-2907:30,아시아경제 ,[e공시 눈에 띄네]코스피-28일,https://finance.naver.com/news/news_read.nhn?article_id=0004669820&office_id=277&mode=search&query=LG이노텍&page=1,"['       [e공시 눈에 띄네]코스피-28일      기사입력2020-04-29 07:30기사원문좋아요훈훈해요좋아요 평가하기공감좋아요0훈훈해요0슬퍼요0화나요0후속기사 원해요0댓글 <장 마감 후 주요공시>◆미래에셋대우=1분기 영업익 1387억원…전년비 2.4%감소◆JB금융지주=1분기 영업익 1364억원…전년비 11.1% 증가◆LG이노텍=1분기 영업익 1380억원...흑자전환◆현대에너지솔루션=1분기 영업익 36억원…전년비 67.8% 증가◆유나이티드제약=1분기 영업익 93억…전년비 11.3%증가◆SK이노베이션=미국 배터리 2공장에 8900억원 투자오주연 기자 moon170@asiae.co.kr▶ 소름 쫙! 2020년 내 대운 시기 확인하기▶ 네이버에서 아시아경제 뉴스를 받아보세요 ▶ 놀 준비 되었다면 드루와!  드링킷!<ⓒ경제를 보는 눈, 세계를 보는 창 아시아경제 무단전재 배포금지>아시아경제 관련뉴스해당 언론사에서 선정하며 언론사 페이지(아웃링크)로 이동해 볼 수 있습니다.""韓 진단키트 줄 생각 없는데""…김칫국 들이키는 日송윤아, ""배우님 진짜 불륜 아니에요?"" 질문에…대출 끼고 7억짜리 아파트 샀는데…\'의외의 결과\'학생들에 \'첫경험 이야기\' 강요한 교사, 알고 보니…""원로의원들 월120만원씩 주자"" 법개정 추진 논란좋아요0훈훈해요0슬퍼요0화나요0후속기사 원해요0기사제공 :']"
13,삼성전자, 2020-04-2906:01,아이뉴스24 ,생활가전이 살린 LG전자 1분기…2분기 코로나19 영향권,https://finance.naver.com/news/news_read.nhn?article_id=0000536304&office_id=031&mode=search&query=LG이노텍&page=1,"['       생활가전이 살린 LG전자 1분기…2분기 코로나19 영향권      기사입력2020-04-29 06:01기사원문좋아요훈훈해요좋아요 평가하기공감좋아요0훈훈해요0슬퍼요0화나요0후속기사 원해요0댓글코로나19 여파 본격화되면서 2분기 실적 \'반토막\' 우려[아이뉴스24 윤선훈 기자] LG전자가 29일 오후 1분기 사업부문별 실적 발표를 한다. 앞서 LG전자는 당초 시장 전망보다 다소 높은 잠정실적을 받아들었다. 코로나19가 아직 실적에 본격적으로 영향을 미치지 않았기 때문이다. 하지만 사업부문별로 1분기 실적을 대하는 태도에는 다소 온도차가 엿보인다.LG전자는 지난 7일 공시를 통해 1분기 1조904억원의 영업이익을 기록했다고 잠정 공시했다. 전년 동기 대비 21.1% 증가한 액수다. 당시 사업부문별 실적을 발표하지는 않았지만 업계에서는 가전사업을 담당하는 H&A사업본부와 연결 기준 실적에 반영되는 계열사인 LG이노텍이 실적 상승을 견인했다고 보고 있다.LG전자가 최근 출시한 세탁건조기 \'워시타워\'의 모습. [출처=LG전자]H&A사업본부는 성수기인 1분기를 맞아 7천억원 중반대의 영업이익을 냈을 것으로 파악된다. 코로나19로 의류관리기를 비롯해 건조기, 식기세척기 등 \'신가전\'에 대한 수요가 늘어나면서 전반적인 가전 시장 불황 속에서도 성과를 거두는 데 성공한 것으로 보인다.노근창 현대차증권 연구원은 ""코로나19 이후 위생에 대한 중요성이 커지면서 신성장 제품인 스타일러, 공기청정기, 건조기 등의 출하량이 내수·수출 시장 모두 증가하고 있다""며 ""미세먼지에서 특수를 누렸던 신성장 가전이 코로나19로 수요 저변이 확대되고 있다""고 설명했다.지난해 1분기 114억원의 적자에 머물렀던 LG이노텍도 올해 1분기 1천380억원의 영업이익을 거두며 LG전자의 실적 개선에 기여했다. 지난해 하반기 아이폰11 시리즈가 기대 이상의 출하량을 달성했고, 올해 상반기에는 아이폰SE 시리즈와 태블릿PC인 \'아이패드 프로 4세대\'도 내놓았다. 이들 제품에 카메라모듈을 공급하는 LG이노텍도 자연스럽게 영업이익이 흑자 전환된 것이다.TV사업을 담당하는 HE사업본부는 지난해 1분기와 비슷한 수준인 3천억원 중반대의 실적을 거뒀을 것으로 보인다. 중국 TV업체들의 생산 차질과 마케팅비 감소 등으로 기대 이상의 수익성을 낼 것으로 보인다. MC사업본부는 20분기 연속 적자를 이어갈 것으로 보이며 적자 규모는 2천억원 초중반대로 예상된다. 특이할 만한 실적 반등 사항이 없었다는 것이 시장의 평가다.이처럼 1분기 좋은 실적에도, LG전자는 \'어닝 서프라이즈\'라는 일각의 시선에 대해 손사래를 친다. 2분기 코로나19 여파가 더욱 커지면서 실적 저하가 본격화될 것으로 예상하고 있기 때문이다.증권가에서는 LG전자의 2분기 영업이익을 4천~5천억원 선으로 예상한다. 전망대로라면 전 분기 대비 실적이 반토막나는 셈이다. TV와 스마트폰은 물론 가전 쪽에서도 영업이익이 상당 부분 빠질 것으로 보인다.특히 LG전자는 북미·유럽 지역의 매출 의존도가 높아, 코로나19로 인한 영향을 더욱 크게 받을 것으로 시장에서는 판단하고 있다. 북미와 유럽 지역의 가전·TV 생산을 담당하는 핵심 생산기지들이 코로나19로 인해 간헐적으로 가동 중단된 데다가, 북미 베스트바이 등 주요 가전 판매점들도 오프라인 매장 문을 닫은 상황이다.이동주 SK증권 연구원은 ""LG전자의 주요 사업은 세트 위주로 코로나19의 직접적인 영향권에 든다""며 ""스마트폰 ODM을 담당하는 중화권 업체의 가동이 원활치 않은 상황이며, 가전 및 TV 해외 생산기지인 인도, 미국, 러시아, 브라질 등에서 일시적 셧다운이 발생하고 있다""며 ""미주와 유럽 지역의 이동 제한으로 수요 침체 우려도 커지고 있다""고 설명했다.윤선훈기자 krel@inews24.com▶네이버 채널에서 \'아이뉴스24\'를 구독해주세요.▶재밌는 아이뉴스TV 영상보기  ▶아이뉴스24 바로가기[ⓒ 아이뉴스24 무단전재 및 재배포 금지]아이뉴스24 관련뉴스해당 언론사에서 선정하며 언론사 페이지(아웃링크)로 이동해 볼 수 있습니다.\'사람이 좋다\' 대한미국인 타일러, \'코로나19\' 미국 상황에 분노\'아이폰SE\' 출시에 이커머스도 \'들썩\'…사전예약 경쟁삼성전자, 인도 스마트폰 시장서 3위로 전락JB금융 올 1분기 순이익 1016억원…JB우리캐피탈 32% 폭풍성장세븐일레븐, 무인화 실험 박차…골프장에 자판기 편의점 열어좋아요0훈훈해요0슬퍼요0화나요0후속기사 원해요0기사제공 :']"
14,삼성전자, 2020-04-2904:03,매일경제 ,"LG, 국내 복귀 협력사 안착 위해 무이자 대출·구매물량 보장",https://finance.naver.com/news/news_read.nhn?article_id=0004566004&office_id=009&mode=search&query=LG이노텍&page=1,"['       LG, 국내 복귀 협력사 안착 위해 무이자 대출·구매물량 보장      기사입력2020-04-29 04:03기사원문좋아요훈훈해요좋아요 평가하기공감좋아요0훈훈해요0슬퍼요0화나요0후속기사 원해요0댓글 ◆ 코로나 극복 상생 ◆ LG생활건강 직원이 충북 청주 중앙물류센터에서 코로나19 위기 극복을 위한 기부 물품을 차량에 싣고 있다. [사진 제공 = LG] LG는 지주회사 ㈜LG 및 계열사 CSR팀으로 상시지원TF(태스크포스)를 구성해 운영하며, 코로나19로 우리 사회가 겪고 있는 어려움을 나누고 함께 이겨내기 위한 지원 방안을 마련해 총력 실행하고 있다. 최근 LG전자, LG화학, LG이노텍, LG상사 등 LG그룹 4개사는 지난달 인도네시아 정부에 5만회 검사 분량의 코로나19 진단키트를 기부키로 하고, 지난 6일 인도네시아 정부에 전달 완료했다. 이번 기부는 코로나19 확산으로 진단키트가 부족한 인도네시아 정부의 지원 요청으로 현지에 진출한 LG는 인도네시아 병원들이 기존에 보유한 기계 4종으로 분석 가능한 한국산 PCR 키트를 찾아낸 뒤 5만회 분량을 항공기를 이용해 자카르타로 보냈다.LG는 대구·경북 지역 의료 현장을 중점 지원하고 있다. 먼저 LG는 대구·경북 지역 병상 부족 사태 해결에 힘을 보태기 위해 550실 규모의 경북 지역 기숙사와 연수원 등을 생활치료센터로 제공했다. 이와 함께 LG는 최일선에서 대구·경북 지역 의료진을 위해  의료용 방호복 1만벌과 방호용 고글 2000개, 의료용 마스크 10만장 등을 대구·경북 지역 의료진에게 지원했다.LG는 코로나19로 어려움을 겪고 있는 우리 국민과 지역사회의 피해 회복에도 최선을 다하고 있다. LG는 지난달 26일 코로나19 확산 방지 및 피해 지원을 위해 50억원을 사회복지공동모금회에 기탁했다. 성금은 확진자 지원, 지역사회 감염 확산 예방을 위한 방역 물품 지원과 함께 피해가 큰 대구·경북 지역을 중심으로 재난 취약계층과 경제활동 위축으로 피해를 본 저소득층 지원 등에 사용될 예정이다. 이와는 별도로 LG생할건강은 같은 날 10억원 상당의 핸드워시 제품을 현물 지원했다. 특히 LG는 협력사 자금 지원 및 가맹점 월세 지원 등 폭넓은 상생 지원을 통해 코로나19로 인한 피해 회복에도 최선을 다하고 있다. LG전자는 자금 운영에 어려움을 겪는 협력사들이 안정적으로 운영될 수 있도록 협력사 대상 무이자 대출 규모를 당초 400억원에서 550억원으로 확대했으며, 자금 지원 일정도 4개월을 앞당겨 지난 2월에 진행했다. 또 코로나19 영향으로 해외에 있는 협력사가 국내로 돌아오거나 국내 생산을 확대할 경우 생산성 향상을 위해 컨설팅, 무이자 자금 등을 지원하고 구매 물량을 보장키로 했다.LG이노텍은 코로나19로 어려움을 겪는 중소 협력사들을 위해 총 1500억원 규모의 상생 금융 지원에 나섰다. 먼저 협력회사 자금 지원을 위해 운용 중인 630억원 규모의 동반성장펀드를 협력사들이 긴급히 활용할 수 있도록 4월부터 조기 집행하고, 거래 규모, 신용도 등의 심사 기준을 완화하고, 자금 지급 절차도 간소화할 예정이다. 이와 함께 4월부터 2개월간 협력사에 약 850억원 규모의 납품 대금과 금형비도 조기 지급할 계획이다.LG생활건강은 코로나19 확산으로 운영에 어려움을 겪는 화장품 가맹점들의 3월 한 달치 월세의 50%를 본사에서 지원키로 했다. 지원 대상은 LG생활건강이 운영 중인 화장품 가맹점인 전국 네이처컬렉션, 더페이스샵 매장 등 약 500곳이다. LG유플러스는 코로나19로 어려움을 겪고 있는 중소 협력회사와 소상공인 등을 위해 850억원 규모의 상생 지원책을 마련해 긴급 시행하고 있다.[기획취재팀 = 이호승 기자 / 김기정 기자 / 김태성 기자 / 임영신 기자 / 원호섭 기자 / 전경운 기자 / 이종혁 기자 / 황순민 기자 / 박대의 기자 / 박윤구 기자 / 심희진 기자 / 임형준 기자 / 최근도 기자]▶네이버 메인에서 \'매일경제\'를 받아보세요▶뉴스레터 \'매콤달콤\' 구독\xa0▶\'매일경제\' 바로가기[ⓒ 매일경제 & mk.co.kr, 무단전재 및 재배포 금지]매일경제 관련뉴스해당 언론사에서 선정하며 언론사 페이지(아웃링크)로 이동해 볼 수 있습니다.""내가 어떤일을 당했는데"" 내연남과 성관계 영상을…[단독] 윤지오 출국·해외 체류 1년째…첫 폭로 김수민 작가 ""윤씨 반성·후회 바라지도 않는다""심으뜸, 레깅스 패션 완성한 국보급 애플힙美국방부, \'UFO 영상\' 3건 공식 배포…왜?\'하트시그널\' 이가흔 학폭 주장 A씨 ""세탁된 이미지""좋아요0훈훈해요0슬퍼요0화나요0후속기사 원해요0기사제공 :']"
