,회사명,날짜,언론사,기사제목,링크,본문
0,삼성전자, 2020-04-1718:36,한국경제 ,"17일, 거래소 기관 순매수상위에 금융업 업종 4종목",https://finance.naver.com/news/news_read.nhn?article_id=0004326317&office_id=015&mode=search&query=LG이노텍&page=1,"['       17일, 거래소 기관 순매수상위에 금융업 업종 4종목      기사입력2020-04-17 18:36기사원문좋아요훈훈해요좋아요 평가하기공감좋아요0훈훈해요0슬퍼요0화나요0후속기사 원해요0댓글 기관 투자자는 17일 거래소에서 삼성전자, KODEX 레버리지, SK하이닉스 등을 중점적으로 사들인 것으로 나타났다.기관 투자자의 순매수 상위 20개 종목은 삼성전자, KODEX 레버리지, SK하이닉스, KODEX 코스닥150선물인버스, KODEX 코스닥150 레버리지, 삼성전기, NAVER, 아모레퍼시픽, 호텔신라, LG이노텍등이다.이중에 금융업 업종에 속한 종목이 6개 포함되어 있다.삼성전자, KODEX 레버리지, SK하이닉스 등은 전일 대비 주가가 상승했고, KODEX 코스닥150선물인버스, LG 등은 주가가 하락했다.[04월17일]거래소 기관 순매수 상위 종목한경로보뉴스이 기사는 한국경제신문과 금융 AI 전문기업 씽크풀이 공동 개발한 기사 자동생성 알고리즘에 의해 실시간으로 작성된 것입니다.▶ 네이버에서 한국경제 뉴스를 받아보세요▶ 한경닷컴 바로가기  ▶ 모바일한경 구독신청 ⓒ 한국경제 & hankyung.com, 무단전재 및 재배포 금지한국경제 관련뉴스해당 언론사에서 선정하며 언론사 페이지(아웃링크)로 이동해 볼 수 있습니다.""13억 가까이 떨어져""…해운대 아파트 \'패닉\'이번에도 31번 환자…논산훈련소 \'초비상\'""오래된 일이 왜…"" 女배우 불륜 들통 \'파장\'중국도 쓰러졌다…""생각보다 심각한 상황""""이미 너무 늦었다""…日 붕괴 조짐까지좋아요0훈훈해요0슬퍼요0화나요0후속기사 원해요0기사제공 :']"
1,삼성전자, 2020-04-1717:37,매일경제 ,"LG이노텍 노조, 구미·광주·평택·파주서 코로나 방역",https://finance.naver.com/news/news_read.nhn?article_id=0004559109&office_id=009&mode=search&query=LG이노텍&page=1,"['       LG이노텍 노조, 구미·광주·평택·파주서 코로나 방역      기사입력2020-04-17 17:37기사원문좋아요훈훈해요좋아요 평가하기공감좋아요0훈훈해요0슬퍼요0화나요0후속기사 원해요0댓글 LG이노텍 노동조합이 코로나19 극복을 위해 팔을 걷었다. LG이노텍 노조는 구미, 광주, 평택, 파주 등 총 4개 사업장에서 코로나19 방역 활동을 실시한다고 17일 밝혔다. 이번 활동은 지난 13일을 시작으로 다음달 11일까지 한 달간 진행된다. 이는 노조의 사회적 책임(USR) 차원에서 추진하는 것이다. 자체 사업장 방역을 통해 코로나19의 지역사회 확산 방지에 기여하겠다는 취지다. LG이노텍은 노조의 방역 활동을 올해 1월부터 진행해 온 전사 일일 사업장 방역과 병행한다는 방침이다. 노조원들 참여로 방역 범위가 확대되고 횟수가 늘어 더욱 철저한 방역이 이뤄질 수 있게 됐다. 방역 활동은 노조 간부, 현장직 사원 등 총 900여 명이 참여하며 사업장별로 20~80명씩 조를 편성해 주 1회 진행한다.  [황순민 기자]▶네이버 메인에서 \'매일경제\'를 받아보세요▶뉴스레터 \'매콤달콤\' 구독\xa0▶\'매일경제\' 바로가기[ⓒ 매일경제 & mk.co.kr, 무단전재 및 재배포 금지]매일경제 관련뉴스해당 언론사에서 선정하며 언론사 페이지(아웃링크)로 이동해 볼 수 있습니다.\'주광덕\'도 \'김태우\'도…짐 싸는 \'조국 저격수\'들총선 당선인 중 피고인 17명…""나 떨고 있니?""\'미스맥심\' 한나나, 폭발적 볼륨감+섹시미호랑이 박제 공개한 서울대공원, 그 모습이…김창숙 ""조카 김정균, 폭행 사건 뒤 안보여서...""좋아요0훈훈해요0슬퍼요0화나요0후속기사 원해요0기사제공 :']"
2,삼성전자, 2020-04-1712:10,아시아경제 ,애플 신상에 中출하량도 반등…스마트폰 관련株 들썩,https://finance.naver.com/news/news_read.nhn?article_id=0004663286&office_id=277&mode=search&query=LG이노텍&page=1,"['       애플 신상에 中출하량도 반등…스마트폰 관련株 들썩      기사입력2020-04-17 12:10기사원문좋아요훈훈해요좋아요 평가하기공감좋아요0훈훈해요0슬퍼요0화나요0후속기사 원해요0댓글LG이노텍·아이티엠반도체·비에이치 등 수혜 예상애플의 아이폰SE 2세대(사진=아시아경제DB)[아시아경제 금보령 기자] 신종 코로나바이러스감염증(코로나19) 영향을 받던 스마트폰 관련주들이 애플의 아이폰SE 공개, 중국 스마트폰 출하량 증가 등에 힘입어 실적·주가 회복에 나설 수 있을지 주목된다.17일 관련업계에 따르면 애플은 지난 15일(현지시간) 보급형폰 아이폰SE 2세대를 발표했다. 이 모델은 17일부터 사전 예약이 개시되고 오는 24일 미국을 비롯한 40개 이상의 국가·지역에서 출시될 예정이다.아이폰SE는 2분기 비수기 공백을 메우는 데 중점을 둘 것으로 보인다. 당초 올해 1분기에 출시될 것으로 예상됐던 아이폰SE는 코로나19 때문에 출시가 늦어졌다. 시장에서는 이번 2세대 제품이 월 평균 200만~400만대 판매될 것으로 기대하고 있다. 2016년에 출시된 아이폰SE 1세대도 출시 첫 해에는 월 평균 230만대 팔렸다.지난달 중국 스마트폰 출하량은 V자 모양의 반등세를 보이고 있다. 중국정보통신기술연구원(CAICT)에서 발표한 자료를 보면 3월 스마트폰 출하량은 2100만대로 전월 대비 233% 증가했다. 2월(630만대)에 보여준 부진으로 많은 투자자들이 수요를 우려했지만 3월 출하량은 1월 출하량(2040만대)을 상회했다.중국의 사례를 봤을 때 2분기 내 미국과 유럽에서 코로나19 영향이 진정되면 스마트폰 관련주들의 하반기 신제품 모멘텀은 강해질 것이란 전망이 제기된다. 애플향 공급업체들의 신제품 부품 공급 실적은 하반기에 반영된다.이종욱 삼성증권 연구원은 ""2분기 실적 악화 우려가 주식시장을 지배하고 있는 상황에서 첫 수요 반등의 시그널은 긍정적""이라며 ""투자자들의 의심을 조금씩 지워나가며 주가 할인도 더불어 해소되기 시작할 것""이라고 말했다. 그는 ""회복의 방향성이 명확해지면 주가는 회복의 속도보다 더 빠르게 반응할 가능성이 높다""고 덧붙였다.아이폰의 주요 부품 공급업체인 LG이노텍은 벌써부터 주가 상승세를 나타내고 있다. 지난 13일 11만7500원이었던 주가는 16일 12만6000원으로 이틀 새 7.23%가 올랐다. 비에이치도 같은 기간 1만6000원에서 1만6650원으로 4.06% 상승했다. 이창민 KB증권 연구원은 ""스마트폰 관련주인 LG이노텍, 아이티엠반도체, 비에이치 수혜를 예상하며 이들에 대한 긍정적인 시각을 유지한다""고 말했다.금보령 기자 gold@asiae.co.kr▶ 소름 쫙! 2020년 내 대운 시기 확인하기▶ 네이버에서 아시아경제 뉴스를 받아보세요 ▶ 놀 준비 되었다면 드루와!  드링킷!<ⓒ경제를 보는 눈, 세계를 보는 창 아시아경제 무단전재 배포금지>아시아경제 관련뉴스해당 언론사에서 선정하며 언론사 페이지(아웃링크)로 이동해 볼 수 있습니다.北 \'불경스러운 사건\'…김정은 \'신변이상설\' 확산이수진·나경원 개표 방송에 뜬금없이 ""언니, 저…""여신도들에 ""이래야 천국 가""…목사의 추악한 범죄北 ""최순실도…"" 태영호 당선 후 하는 말이""친일파, 민주당이 더 많아"" 말했다가…사과한 스타좋아요0훈훈해요0슬퍼요0화나요0후속기사 원해요0기사제공 :']"
3,삼성전자, 2020-04-1711:29,아이뉴스24 ,"LG이노텍, 1Q 어닝 서프라이즈 모락모락…기대감 높아진 이유는",https://finance.naver.com/news/news_read.nhn?article_id=0000534659&office_id=031&mode=search&query=LG이노텍&page=1,"['       LG이노텍, 1Q 어닝 서프라이즈 모락모락…기대감 높아진 이유는      기사입력2020-04-17 11:29기사원문좋아요훈훈해요좋아요 평가하기공감좋아요0훈훈해요0슬퍼요0화나요0후속기사 원해요0댓글실적 전망치 한 달새 77% \'껑충\'…영업이익 709억원 전망[아이뉴스24 서민지 기자] LG이노텍이 신종 코로나바이러스 감염증(코로나19) 여파에도 1분기 \'깜짝 실적\'을 기록할 것이라는 전망이 나오고 있다. 당초 최대 고객사인 애플이 코로나19로 공장과 유통망을 \'셧다운\' 함에 따라 타격이 불가피하다는 관측이 나왔지만, 애플의 신제품 효과 등으로 기대감이 새어 나오는 분위기다.17일 금융정보업체 에프앤가이드에 따르면 증권가에서 예상한 LG이노텍의 1분기 영업이익은 709억 원이다. 지난해 114억 원이 영업손실을 기록했는데, 전년 대비 흑자 전환할 것이라는 전망이다.실적 전망치는 한 달새 77%가량 올랐다. 지난달만 해도 LG이노텍의 1분기 실적 컨센서스는 400억 원 수준이었다. 현재 일부 증권사의 경우 영업이익 추정치를 1천억 원대까지 올려잡고 있기도 하다.17일 금융정보업체 에프앤가이드에 따르면 증권가에서 예상한 LG이노텍의 1분기 영업이익은 709억 원이다. [사진=아이뉴스24 포토 DB]LG이노텍의 호실적 전망이 나오기 시작한 것은 지난달 말부터다. 특히 LG전자가 이달 초 시장 예상치를 상회하는 잠정 실적을 발표하면서 LG이노텍에 대한 실적 기대감이 커졌다.LG전자의 1분기 영업이익은 전년 대비 21.1% 증가한 1조904억 원으로 잠정 집계됐다. LG전자 연결 기준 실적에는 LG이노텍의 실적이 반영된다. 이에 따라 LG이노텍이 호실적에 힘을 보탰을 것이라는 해석이 나왔다.LG이노텍의 실적 개선의 주요인으로는 광학솔루션 사업부의 회복세가 꼽힌다. LG이노텍 매출에서 광학솔루션 사업부가 차지하는 비중은 65%에 달한다. 2016년만 해도 50%가 안 됐지만, 매출 쏠림현상이 점차 심화되며 지난해에는 65% 이상으로 늘었다.광학솔루션 사업부는 실적의 60~70%를 애플에 의존하고 있다. 애플은 오는 24일 2세대 아이폰SE를 출시하는데, 이에 따른 초도 생산 물량이 반영되고, 아이패드 프로 4세대 대당 매출액 증가하면서 긍정적인 영향을 미쳤을 것이라는 분석이다. 환율 환경도 우호적이다.기판소재 사업부도 성장세를 꾸준히 이어나갈 전망이다. LG이노텍 기판소재 사업부의 1분기 영업이익은 300억 원 초반에서 400억 원 중반으로 전년 대비 40%에서 많게는 100%의 성장세를 나타낼 것으로 관측되고 있다.기판소재 사업부에서는 포토마스크, 반도체 기판 등을 생산하고 있는데, 광학솔루션 사업부가 업황에 따라 큰 기복을 보이는 것과 달리 비교적 안정적인 흐름을 나타내고 있다. 실제 지난해 1~4분기에 광학솔루션의 영업이익은 666억 원에서 2천247억 원으로 분기마다 큰 차이를 보였지만, 기판소재는 257억 원에서 306억 원으로 완만한 흐름을 보였다.LG이노텍의 실적 개선의 주요인으로는 광학솔루션 사업부의 회복세가 꼽힌다. [사진=LG이노텍]박강호 대신증권 연구원은 ""전략 고객사향 보급형 스마트폰과 프리미엄 태블릿PC 신모델 생산이 3월에 집중됐고, 카메라모듈과 ToF 부품의 매출 증가에 기인해 깜짝 실적을 낼 것으로 보인다""며 ""반도체 PCB 고수익성 유지, 반도체 경기 회복과 출하량 증가 속 제품의 사양 상향 추세로 평균공급단가 상승, 공급능력의 제한적인 증가로 수익성은 추가적으로 개선했을 것""이라고 분석했다.다만 1분기 이후를 바라보는 시각은 엇갈린다. 안정적인 실적 흐름을 이어갈 것이라는 전망이 나오는 반면 2분기에 코로나19 영향이 본격화될 것이라는 우려도 제기된다.김운호 IBK투자증권 연구원은 ""상저하고의 전형적 계절성이 나타날 것으로 보여 올해 안정적인 실적 개선을 기대한다""며 ""상반기 실적은 예년에 비해 크게 개선될 것이며, 모바일 솔루션은 아직도 성장 모멘텀을 보유하고 있다""고 봤다.반면 김준환 한화투자증권 연구원은 ""코로나19 사태 영향으로 2분기 실적에 대해서는 보수적인 접근이 필요하다""며 ""북미 고객사의 주요 시장 내 수요 둔화와 제품 믹스 악화 때문에 2분기 영업이익을 이전 추정치 431억 원에서 270억 원으로 약 37.4% 하향 조정했다""고 말했다.서민지기자 jisseo@inews24.com▶네이버 채널에서 \'아이뉴스24\'를 구독해주세요.▶재밌는 아이뉴스TV 영상보기  ▶아이뉴스24 바로가기[ⓒ 아이뉴스24 무단전재 및 재배포 금지]아이뉴스24 관련뉴스해당 언론사에서 선정하며 언론사 페이지(아웃링크)로 이동해 볼 수 있습니다.칼 빼든 검찰, 21대 총선 당선자 90명 \'선거법 위반 의혹\' 수사 중카카오뱅크 대표·PC방 사장도 \'금배지\'…경제·금융계 출신 19명 여의도 입성경기도 재난기본소득 \'삐걱\'…신용카드로 긁었는데 결제안돼 낭패 사례 발생\'적자 개선\' 쿠팡, 진정한 \'한국판 아마존\' 실현할까[절치부심 애플 ㊥] 4년 만에 등판한 아이폰SE…소비자 반응은좋아요0훈훈해요0슬퍼요0화나요0후속기사 원해요0기사제공 :']"
4,삼성전자, 2020-04-1710:51,한국경제TV ,"LG이노텍, 상승흐름 전일대비 +5.56%... 이 시각 거래량 25만310주",https://finance.naver.com/news/news_read.nhn?article_id=0000864851&office_id=215&mode=search&query=LG이노텍&page=1,"['       LG이노텍, 상승흐름 전일대비 +5.56%... 이 시각 거래량 25만310주      기사입력2020-04-17 10:51기사원문좋아요훈훈해요좋아요 평가하기공감좋아요0훈훈해요0슬퍼요0화나요0후속기사 원해요0댓글[한국경제TV 라이온봇 기자]LG이노텍17일 오전 LG이노텍(011070)이 급등세를 보이고 있다. LG이노텍은 LG전자 계열의 종합 전자부품 제조기업로 알려져 있다.2.38% 상승출발한 주가는 꾸준히 올라 오전 10시 50분 현재 전일대비 5.56% 수준인 13만3000원을 기록하고 있다.차트를 살펴보면 단기간에 골든크로스를 만들고 주가가 60일선까지 뚫고 가는 모습이다.거래량은 25만310주로 전거래일 대비 100.84% 수준이다.이는 LG이노텍 전체 주식수의 1.06%에 해당하는 물량이다.[그래프]LG이노텍 일봉 차트10시 00분 잠정집계에 따르면, 외국인이 LG이노텍을 9,250주 순매수 중이다.[표] 거래원 상위(10:50 기준)LG이노텍이 시각 거래소에서 LG이노텍 이외에도 코스나인(6.89%), 마크로젠(5.8%), TIGER 미국S &P500레버리지(합성 H)(5.78%), EG(10.8%), 두올(5.87%) 등이 상승세를 보이고 있다.라이온봇 기자 -한국경제TV※ 본 기사는 한국경제TV와 `금융 AI 전문기업 씽크풀`이 실시간으로 작성한 기사입니다.라이온봇기자 ▶ 네이버 홈에서 [한국경제TV] 채널 구독하기 [생방송보기]▶ 대한민국 재테크 총집결! - [증권 / 주식상담 / 부동산]ⓒ 한국경제TV, 무단 전재 및 재배포 금지한국경제TV 관련뉴스해당 언론사에서 선정하며 언론사 페이지(아웃링크)로 이동해 볼 수 있습니다.이동국 딸 재시, \'연예인 포스\'에 모두 \'깜짝\'[단독] ""생활방역 시기상조""…사회적 거리두기 5월3일까지[속보] 조주빈 공범 \'부따\' 강훈 얼굴 공개""곧 망한다더니""...매출 7조 \'한국의 아마존\' 현실로\'9천조\' 굴리는 사나이의 예언...""코로나가 모든걸 바꾼다""좋아요0훈훈해요0슬퍼요0화나요0후속기사 원해요0기사제공 :']"
5,삼성전자, 2020-04-1708:51,문화일보 ,"LG이노텍, 코로나 19 방역 노조가 동참",https://finance.naver.com/news/news_read.nhn?article_id=0002424796&office_id=021&mode=search&query=LG이노텍&page=1,"['       LG이노텍, 코로나 19 방역 노조가 동참      기사입력2020-04-17 08:51기사원문좋아요훈훈해요좋아요 평가하기공감좋아요0훈훈해요0슬퍼요0화나요0후속기사 원해요0댓글LG이노텍 노조 한 달간 사업장 자발적 방역LG그룹의 소재 부품전문기업인 LG이노텍 노동조합이 신종 코로나바이러스 감염증(코로나19) 극복을 위해 자발적으로 사업장 방역활동(사진)에 들어가 주목을 받고 있다.17일 LG이노텍에 따르면 노조는 경북 구미, 광주, 경기 평택, 파주 등 4개 사업장에서 지난 13일부터 코로나19 방역활동에 착수했다. 5월 11일까지 한 달여간 진행되는 이번 방역은 앞서 1월부터 이어온 전사 차원의 일일 사업장 방역과 병행하는 것으로, 노조 간부와 현장직 사원 등 900여 명이 참여한다. 사업장별로 20~80명씩 조를 편성해 주 1회 진행하는 방역은 사전 교육 후, 임직원들의 사용이 잦은 사업장 공용공간인 휴게실, 출입문, 식당, 화장실 등 소독은 물론, 출입문, 계단 손잡이, 신발장, 의자 등 세세한 부분까지 빠짐없이 포함된다. 또 임직원 대상 체온 측정, 방역 강화 필요 공간 등을 점검하는 ‘에너지·환경·안전·건강(EESH)) 순찰’, 마스크 착용과 식사 시 일정 거리 두기 등의 코로나19 대응 캠페인도 함께 진행된다.김동의 LG이노텍 노조위원장은 “노조가 솔선해 지역 사회의 코로나19 극복 노력에 힘을 보태기로 했다”며 “노조원들의 참여로 방역 범위가 확대되고 횟수가 늘어 더욱 철저한 방역이 이뤄질 수 있게 됐다”고 말했다. LG이노텍은 지난 2012년 국내 부품업계 최초로 ‘노조의 사회적 책임 이행’을 선포하고 사회 이슈 해결에 적극적으로 동참해왔다.  이민종 기자  horizon@munhwa.com[ 문화닷컴 바로가기 | 문화일보가 직접 편집한 뉴스 채널 | 모바일 웹 ][Copyrightⓒmunhwa.com \'대한민국 오후를 여는 유일석간 문화일보\' 무단 전재 및 재배포 금지(구독신청:02)3701-5555)]문화일보 관련뉴스해당 언론사에서 선정하며 언론사 페이지(아웃링크)로 이동해 볼 수 있습니다.""참패가 내 막말 탓? 형준아, 시민아 참 매정하구나""<4·15 총선-180석 ‘超 巨與 시대’>사퇴압박 거세지는 윤석열총장…울산시장 선거 등 수사 차질 우려\'합의 성관계 후 수차례 성폭행 허위 신고\' 방송인 A씨 실형홍준표 ""통합당 참패…정치 초보자의 대권 욕심 때문""\'발리 바닷가 사진\' 가희 ""귀국 후 서울 외곽서 자가격리""좋아요0훈훈해요0슬퍼요0화나요0후속기사 원해요0기사제공 :']"
