,회사명,날짜,언론사,기사제목,링크,본문
0,삼성전자, 2020-04-2918:36,한국경제 ,"29일, 거래소 외국인 순매도상위에 금융업 업종 5종목",https://finance.naver.com/news/news_read.nhn?article_id=0004333089&office_id=015&mode=search&query=LG이노텍&page=1,"['       29일, 거래소 외국인 순매도상위에 금융업 업종 5종목      기사입력2020-04-29 18:36기사원문좋아요훈훈해요좋아요 평가하기공감좋아요0훈훈해요0슬퍼요0화나요0후속기사 원해요0댓글 외국인 투자자는 29일 거래소에서 삼성생명, KODEX 200, 삼성전자우 등을 중점적으로 매도한 것으로 나타났다.외국인 투자자의 순매도 상위 20개 종목은 삼성생명, KODEX 200, 삼성전자우, 한국전력, 아모레퍼시픽, S-Oil, 신한지주, LG이노텍, SK텔레콤, 휠라홀딩스등이다.이중에 금융업 업종에 속한 종목이 5개 포함되어 있다.KODEX 200, 한국전력, 아모레퍼시픽 등은 전일 대비 주가가 상승했고, 삼성생명, 삼성전자우, LG이노텍 등은 주가가 하락했다.[04월29일]거래소 외국인 순매도 상위 종목한경로보뉴스이 기사는 한국경제신문과 금융 AI 전문기업 씽크풀이 공동 개발한 기사 자동생성 알고리즘에 의해 실시간으로 작성된 것입니다.▶ 네이버에서 한국경제 뉴스를 받아보세요▶ 한경닷컴 바로가기  ▶ 모바일한경 구독신청 ⓒ 한국경제 & hankyung.com, 무단전재 및 재배포 금지한국경제 관련뉴스해당 언론사에서 선정하며 언론사 페이지(아웃링크)로 이동해 볼 수 있습니다.공무원 박봉이라더니…올해 연봉이 무려한국 떠난다며 40명 해고하더니…커지는 의혹""근간이 무너질 수 있다"" 심각해진 중국""15분내 확인""…日 코로나 키트 개발하더니""매년 93만원 아낄 수 있다"" 전문가의 조언좋아요0훈훈해요0슬퍼요0화나요0후속기사 원해요0기사제공 :']"
1,삼성전자, 2020-04-2918:36,한국경제 ,"29일, 기관 거래소에서 KODEX WTI원유선물(H)(+8.15%), KODEX...",https://finance.naver.com/news/news_read.nhn?article_id=0004333090&office_id=015&mode=search&query=LG이노텍&page=1,"['       29일, 기관 거래소에서 KODEX WTI원유선물(H)(+8.15%), KODEX 200선물인버스2X(-1.57%) 등 순매도      기사입력2020-04-29 18:36기사원문좋아요훈훈해요좋아요 평가하기공감좋아요0훈훈해요0슬퍼요0화나요0후속기사 원해요0댓글 기관 투자자는 29일 거래소에서 KODEX WTI원유선물(H), KODEX 200선물인버스2X, NAVER 등을 중점적으로 매도한 것으로 나타났다.기관 투자자의 순매도 상위 20개 종목은 KODEX WTI원유선물(H), KODEX 200선물인버스2X, NAVER, 카카오, 롯데지주, TIGER 원유선물Enhanced(H), LG이노텍, 삼성전자우, 삼성 인버스 2X WTI원유 선물 ETN, KODEX 인버스등이다.이중에 서비스업 업종에 속한 종목이 3개 포함되어 있다.KODEX WTI원유선물(H), 롯데지주, TIGER 원유선물Enhanced(H) 등은 전일 대비 주가가 상승했고, KODEX 200선물인버스2X, NAVER, 카카오 등은 주가가 하락했다.[04월29일]거래소 기관 순매도 상위 종목한경로보뉴스이 기사는 한국경제신문과 금융 AI 전문기업 씽크풀이 공동 개발한 기사 자동생성 알고리즘에 의해 실시간으로 작성된 것입니다.▶ 네이버에서 한국경제 뉴스를 받아보세요▶ 한경닷컴 바로가기  ▶ 모바일한경 구독신청 ⓒ 한국경제 & hankyung.com, 무단전재 및 재배포 금지한국경제 관련뉴스해당 언론사에서 선정하며 언론사 페이지(아웃링크)로 이동해 볼 수 있습니다.공무원 박봉이라더니…올해 연봉이 무려한국 떠난다며 40명 해고하더니…커지는 의혹""근간이 무너질 수 있다"" 심각해진 중국""15분내 확인""…日 코로나 키트 개발하더니""매년 93만원 아낄 수 있다"" 전문가의 조언좋아요0훈훈해요0슬퍼요0화나요0후속기사 원해요0기사제공 :']"
2,삼성전자, 2020-04-2917:41,머니S ,‘포스트 코로나’ 대비나선 LG… 구광모 “위기 이후 성장 준비하자”,https://finance.naver.com/news/news_read.nhn?article_id=0000537430&office_id=417&mode=search&query=LG이노텍&page=1,"['       ‘포스트 코로나’ 대비나선 LG… 구광모 “위기 이후 성장 준비하자”      기사입력2020-04-29 17:41기사원문좋아요훈훈해요좋아요 평가하기공감좋아요0훈훈해요0슬퍼요0화나요0후속기사 원해요0댓글구광모 LG그룹 회장 / 사진=LGLG그룹이 ‘포스트 코로나’에 대비한다. 코로나19 팬데믹(세계적 대유행) 이후 벌어질 경제적 충격을 최소화하고 새로운 시장을 모색하는 한편 경기가 반등하는 시점을 대비해 R&D 체질개선에 적극 나선다.구광모 LG그룹 회장은 최근 LG 정기 주주총회에서 인사말을 통해 “모든 어려움에도 기회가 있기에 LG는 슬기롭게 대처하며 위기 이후의 성장을 준비하겠다”며 ‘위기 이후의 성장’을 강조했다.LG는 코로나19의 확산 억제를 위한 사회적 거리두기에 적극 동참하고 비대면(언택트) 시대에 맞게 재택근무, 유연 출퇴근제 확대 등 일하는 방식을 변화시켜가고 있다.  불필요한 업무 관행을 없애고 업무의 효율성과 생산성을 높일 수 있도록 디지털 전환 가속화에도 힘을 쏟는 등 변화하는 환경에 민첩하게 대응할 수 있는 조직을 만드는데 주력한다.  ‘고객 가치’ 창출을 위한 노력은 위기 속에서도 계속된다. 특히 디지털 기술을 활용해 고객의 페인 포인트를 빠르게 읽어내고 고객에게 감동을 줄 수 있는 과감하고 새로운 시도와 멈춤 없는 도전으로 위기를 극복해간다는 계획이다. ━계열사별 코로나19 이후 준비━계열사별로 코로나19의 글로벌 확산 및 장기화에 대비하고 있다. LG화학은 3세대 전기차(500km 이상) 중심의 대형 프로젝트 수주를 적극 공략해 확실한 1위를 달성한다는 계획이며 올해 말까지 배터리 생산 능력을 고성능 순수 전기차 기준 170만대(100GWh)로 확대할 계획이다.지난해 12월 미국 1위 자동차 업체인 GM과 설립 예정인 전기차 배터리셀 합작법인 가동을 통해 향후 30Gwh 이상의 추가 생산 능력도 확보하게 된다. LG화학은 빠르게 증가하고 있는 전기차 배터리 수주 물량을 차질 없이 공급하기 위해 올해 시설투자 6조원 중 3조원을 배터리 사업분야에 투자했다. 안정적인 제품 공급과 원재료 수급에도 만전을 기울이고 있으며 R&D 투자도 멈추지 않고 있다. 또한 고객들에게 차별화된 가치를 제공할 수 있는 다양한 사업 모델을 지속적으로 발굴해 제공하고 그간 축적한 지적재산권 역시 철저하게 보호할 방침이다.LG전자는 가전 제품 본연의 차별화된 성능에 빅데이터가 연계된 인공지능을 더한 스마트 가전을 지속적으로 개발해 출시하고 인공지능 솔루션을 구축해 고객에게 차별화된 경험을 제공한다는 계획이다. 최근 코로나19로 관심이 더욱 높아진 스타일러, 의류건조기, 공기청정기, 식기세척기, 무선청소기 등 국내 가전 트렌드를 이끌어가고 있는 위생가전의 해외 진출에도 박차를 가한다. 로봇을 미래 성장동력의 한 축으로 삼고 산업용부터 서비스용에 이르기까지 다양한 분야에서 로봇 관련 솔루션도 지속 개발하고 있다. 앞으로는 사업장의 데이터를 수집해 클라우드를 통해 분석하고 필요한 정보를 제공하는 고객 중심의 맞춤형 서비스가 가능한 데이터 솔루션도 개발해 제공할 계획이다. LG이노텍은 혁신기술로 디스플레이용 핵심부품을 생산하는 기판소재사업 부문에서 차세대 디스플레이인 OLED시장 확대에 따른 수요 증가에 맞춰 시장을 주도해나갈 계획이다. 광학솔루션사업은 카메라모듈 및 3D센싱모듈로 글로벌 일등 지위를 확고히 하는 동시에 자동차, AR∙VR, IoT 등으로 적용 영역을 빠르게 확대해 나가고 있다.  차량전장사업은 고효율, 고신뢰성, 친환경제품을 앞세워 전기차, 커넥티트 카, 자율주행차 등에 탑재될 차세대 전장부품 시장 공략을 가속화한다.━차질없는 투자 및 R&D로 미래경쟁력 확보━/사진=LGLG디스플레이는 프리미엄 TV 시장에서 급성장하고 있는 OLED 시장 수요에 적극 대응하기 위해 기존 파주에서만 생산하던 대형 OLED를 중국에서도 생산하는 투트랙 생산체제를 구축한다. OLED의 기술 진입장벽이 높아 한국을 제외한 다른 업체들이 양산단계에 진입하지 못하고 있는 만큼, LG디스플레이는 광저우 OLED 공장 가동을 계기로 OLED로 경쟁사들과 격차를 확실히 벌릴 계획이다.광저우 공장과 파주 10.5세대 OLED 공장인 P10 공장까지 가동하면 LG디스플레이의 대형 OLED 생산량은 더욱 늘어나 생산성과 수익성을 확보하는 한편 프리미엄 TV 시장에서 입지를 확고히 하게된다.LG유플러스는 비대면 문화가 확산됨에 따라 5G로 미래 성장동력을 발굴해 성장을 이끌어간다는 계획이다. 라이프 스타일 변화에 따른 통신서비스 수요 증가에 대응하기 위해 적극적인 투자로 서비스와 네트워크 경쟁력을 강화하고 상반기 중 5G를 기반으로 클라우드와 AR(증강현실) 및 VR(가상현실)을 결합한 새로운 서비스인 U+5G 서비스 3.0을 선보여 고객들에게 색다른 경험과 가치를 제공할 계획이다.기업 분야에서는 커넥티드 카, 스마트 팩토리, 스마트 원격제어, 스마트 스쿨에 이어 스마트 폴리스, 스마트 병원, 스마트 팜, 스마트 항만 등 다양한 산업 영역에서 5G 비즈니스 모델을 구체화하고 레퍼런스를 확대한다. LG헬로비전 출범으로 두 배로 확대된 825만 유료방송 가입자를 기반으로 유무선 시장 경쟁 구조를 재편하고 고객 기대를 뛰어넘는 다양한 융복합 서비스를 발굴하고, 방송 시장에서의 규모의 경제 효과는 물론 5G 등 다른 사업과의 시너지 효과를 통해 수익성을 높여갈 계획이다. LG CNS는 IT신기술 바탕으로 비대면 사업 분야에서 새로운 기회를 발굴한다. 집에서도 인터넷을 통해 회사와 동일한 업무환경으로 원활한 원격근무가 가능한 재택 근무 클라우드 PC 서비스도 진행하고 있다. 올해 초부터는 비대면 영어교육 툴인 ‘AI튜터’를 선보이였으며, 현재까지 700여명의 임직원인 모바일 앱을 통해 교육을 진행하고 있다. 이 밖에도 사내 검증을 거쳐 높은 성과를 보인 다양한 언택트 관련 IT 서비스들을 통해 사업 역량을 강화해나갈 계획이다.이한듬 기자 mumford@mt.co.kr▶ 고수들의 재테크 비법 영상▶거품 뺀 솔직 시승기 ▶ 코로나19 속보 <저작권자 ⓒ \'성공을 꿈꾸는 사람들의 경제 뉴스\' 머니S, 무단전재 및 재배포 금지>머니S 관련뉴스해당 언론사에서 선정하며 언론사 페이지(아웃링크)로 이동해 볼 수 있습니다.\'지강헌 사건\' 뭐길래… 500만원 훔치고 17년형 선고?박미선, 악플 ""애쓴다""에 보인 반응 \'OOOO\'장민호, ""임영웅, 영탁 중 누가 좋냐면요…""김호중 ""임영웅, 내가 여자라면 사귀고파""김동현, 혜은이에게 먼저 이혼 재촉… 이유는?좋아요0훈훈해요0슬퍼요0화나요0후속기사 원해요0기사제공 :']"
3,삼성전자, 2020-04-2917:39,한국경제 ,"LG전자, 新가전·TV로 '활짝 웃은' 1분기…영업이익 1조 탈환",https://finance.naver.com/news/news_read.nhn?article_id=0004333050&office_id=015&mode=search&query=LG이노텍&page=1,"['       LG전자, 新가전·TV로 \'활짝 웃은\' 1분기…영업이익 1조 탈환      기사입력2020-04-29 17:39기사원문좋아요훈훈해요좋아요 평가하기공감좋아요0훈훈해요0슬퍼요0화나요0후속기사 원해요0댓글스마트폰은 적자 탈출 못해2분기는 \'실적절벽\' 우려LG전자의 1분기 실적이 발표되자 회사 안팎에서 ‘이보다 더 좋을 수 있을까’라는 우려 섞인 말이 나오고 있다. 분기 영업이익률은 7.4%로 역대 1분기 중 최고치를 찍었다. TV와 가전 부문이 실적을 견인했다. 프리미엄급 제품 비중이 늘면서 수익성이 크게 좋아졌다. 문제는 2분기다. 신종 코로나바이러스 감염증(코로나19) 여파로 LG전자도 ‘실적 절벽’에 맞닥뜨릴 것이란 예상이 나온다.LG전자는 29일 1분기 실적을 발표했다. LG이노텍을 포함한 연결 기준으로 14조7278억원의 매출과 1조904억원의 영업이익을 기록했다. 매출은 지난해 같은 기간보다 1.3% 줄었지만 영업이익은 21.1% 증가했다. 분기 영업이익이 1조원을 넘은 것은 2018년 1분기 이후 2년 만이다.가전제품을 담당하는 H&A사업본부가 1분기 실적의 일등공신이다. 전체 영업이익의 70%에 달하는 7535억원을 H&A사업본부에서 달성했다. 건강과 위생에 관심이 높아지면서 건강관리와 관련한 가전 판매가 늘어났다는 설명이다.TV가 주력인 HE사업본부도 3258억원의 영업이익을 올리며 분기 영업이익 ‘1조원 클럽’ 재가입에 힘을 보탰다. 크기가 큰 TV가 인기를 얻으면서 이익지표가 개선됐다.스마트폰을 맡고 있는 MC사업본부는 이번에도 적자에서 벗어나지 못했다. 분기 영업손실이 2378억원이었다. 전장사업을 하는 VS사업부문 역시 968억원의 영업적자를 냈다.LG전자는 2분기 분위기가 1분기와 완전히 달라졌다고 설명했다. 코로나19 여파로 미국, 유럽 등 주요 소비시장이 꽁꽁 얼어붙은 데다 세계 곳곳의 공장이 가동과 생산 중단을 반복하고 있어서다. 업계에선 LG전자가 반도체와 같은 기업 간 거래(B2B) 제품이 많지 않아 코로나19 후폭풍을 더 강하게 맞을 것으로 관측한다. 회사 관계자는 “2분기에는 1분기는 물론 지난해 2분기보다도 실적 지표가 악화할 것”이라고 전망했다.송형석 기자 click@hankyung.com▶ 네이버에서 한국경제 뉴스를 받아보세요▶ 한경닷컴 바로가기  ▶ 모바일한경 구독신청 ⓒ 한국경제 & hankyung.com, 무단전재 및 재배포 금지한국경제 관련뉴스해당 언론사에서 선정하며 언론사 페이지(아웃링크)로 이동해 볼 수 있습니다.공무원 박봉이라더니…올해 연봉이 무려한국 떠난다며 40명 해고하더니…커지는 의혹""근간이 무너질 수 있다"" 심각해진 중국""15분내 확인""…日 코로나 키트 개발하더니""매년 93만원 아낄 수 있다"" 전문가의 조언좋아요0훈훈해요0슬퍼요0화나요0후속기사 원해요0기사제공 :']"
4,삼성전자, 2020-04-2917:03,더팩트 ,"[TF매매동향] 외인, LG화학 사고 삼성생명 팔았다",https://finance.naver.com/news/news_read.nhn?article_id=0000024473&office_id=629&mode=search&query=LG이노텍&page=1,"['       [TF매매동향] 외인, LG화학 사고 삼성생명 팔았다      기사입력2020-04-29 17:03기사원문좋아요훈훈해요좋아요 평가하기공감좋아요0훈훈해요0슬퍼요0화나요0후속기사 원해요0댓글29일 코스피시장에서 개인투자자는 홀로 4830억 원을 팔아치운 반면 외국인과 기관은 각각 2337억 원, 2500억 원을 사들였다. 이에 코스피지수는 사흘 연속 오르며 장중 한때 1950선을 회복했다. /더팩트 DB외국인, LG화학 최대매수…796억 원 샀다[더팩트ㅣ박경현 기자] 29일 코스피는 외인과 기관의 매수물량 유입으로 강보합 마감했다. 개인은 홀로 4830억 원을 팔아치운 반면 외국인과 기관이 매도물량을 받아 각각 2337억 원, 2500억 원을 사들였다. 이에 코스피지수는 사흘 연속 오르며 장중 한때 1950선을 회복했다.이날 외국인투자자의 코스피시장 최대 매수는 LG화학으로 향했다. 외인은 LG화학에 796억 원을 사들이고 이어 삼성전기에 350억 원, 삼성SDI에 236억 원, 네이버(NAVER)에 192억 원, 호텔신라 182억 원 순으로 사들였다.반면 삼성생명 140억 원, 삼성전자우 95억 원, 한국전력 80억 원, 아모레퍼시픽 75억 원 순으로 팔아치웠다.코스닥시장에서는 NHN한국사이버결제(92억 원), 안랩(43억 원), 네이처셀(33억 원)을 사들이고, 메디톡스(84억 원), 파라다이스(35억 원), 셀트리온헬스케어(28억 원)는 매도했다.기관투자자는 SK하이닉스 638억 원가량을 사들였다. 이어 삼성전자 204억 원, 호텔신라 186억 원, 신한지주 172억 원을 매수했다. /한국거래소 제공이날 기관투자자는 SK하이닉스 638억 원가량을 사들였다. 이어 삼성전자 204억 원, 호텔신라 186억 원, 신한지주 172억 원을 매수했다.반면 네이버(NAVER)는 200억 원가량 팔아치웠다. 또 카카오 188억 원, 롯데지주 152억 원, LG이노텍 105억 원을 순매도했다.시가총액 상위종목 등락은 엇갈렸다. 삼성전자(-0.20%), 삼성바이오로직스(-1.19%), 삼성전자우(-0.35%), 네이버(-0.25%)는 내린 반면 SK하이닉스(+0.36%), 셀트리온(+0.72%), LG화학(+3.86%), LG생활건강(+1.09%), 삼성물산(+3.41%), 현대차(+0.43%)는 오름세로 장을 마감했다.pkh@tf.co.kr- 더팩트 뮤직어워즈는 언제? [알림받기▶]  - 내 아이돌 응원하기 [팬앤스타▶]  저작권자 ⓒ 특종에 강한 더팩트 & tf.co.kr 무단 전재 및 재배포 금지더팩트 관련뉴스해당 언론사에서 선정하며 언론사 페이지(아웃링크)로 이동해 볼 수 있습니다.[단독] \'낙선·당대표 사퇴\' 황교안, 10일 만의 \'교회\' 외출(영상)성폭행 피해자 이웃에 가해자가 …""소년법 개정해 접근금지 시켜야""신동빈 \'롯데온\' VS 정용진 \'쓱닷컴\'…한국판 아마존 내건 유통맞수戰[TF확대경] 임기 말 \'열일\' 해도 모자를 20대 국회, \'추문·내홍\'[TF기획-머나먼 장애인 참정권③] 이종성 ""법 한 줄, 그게 그렇게 힘든가""좋아요0훈훈해요0슬퍼요0화나요0후속기사 원해요0기사제공 :']"
