,회사명,날짜,언론사,기사제목,링크,본문
0,삼성전자, 2020-06-2319:10,매일경제 ,"LG이노텍, ’덕분에 챌린지` 동참",https://finance.naver.com/news/news_read.nhn?article_id=0004601228&office_id=009&mode=search&query=LG이노텍&page=1,"['       LG이노텍, ’덕분에 챌린지` 동참      기사입력2020-06-23 19:10기사원문좋아요훈훈해요좋아요 평가하기공감좋아요0훈훈해요0슬퍼요0화나요0후속기사 원해요0댓글정철동 LG이노텍 사장 정철동 LG이노텍 사장과 임직원들이 코로나 19의료진에게 감사와 응원의 마음을 전하는 \'덕분에 챌린지\' 캠페인에 동참했다.23일 LG이노텍은 정 사장을 포함한 임직원 15명이 회사를 대표해 \'덕분에 챌린지\'에 참여했다고 23일 밝혔다. \'덕분에 챌린지\'는 코로나19 의료진을 위해 존경을 의미하는 수어 동작을 촬영해 관련 해시태그를 달아 SNS에 게재하는 릴레이 캠페인이다.이석희 SK하이닉스 사장의 지명으로 캠페인에 동참한 정 사장은 다음 참가자로 경계현 삼성전기 사장, 전해상 도레이첨단소재 사장, 협력사 대표인 이재현 오알켐 사장을 지목했다.정 사장은 ""코로나 사태 장기화에도 의료진의 희생과 노고가 있었기에 우리 모두가 코로나19를 슬기롭게 극복해 나가고 있는 것""이라며 ""이번 캠페인 참여를 통해 깊은 감사와 응원의 마음을 전한다""고 말했다. LG이노텍은 코로나19 극복을 위한 다양한 활동을 적극 추진해왔다. 지난 3월에는 코로나19 확산 방지 및 피해 복구 지원을 위해 총 6억원 상당의 성금과 방호복 등 방역 물품을 사회복지공동모금회에 기부했다. 이어 4월에는 코로나19로 어려움을 겪는 중소 협력사들을 위해 총 1500억원 규모의 동반성장펀드와 납품 대금을 앞당겨 지급했다. [전경운 기자]▶네이버 메인에서 \'매일경제\'를 받아보세요▶\'매일경제\' 바로가기\xa0▶뉴스레터 \'매콤달콤\' 구독[ⓒ 매일경제 & mk.co.kr, 무단전재 및 재배포 금지]매일경제 관련뉴스해당 언론사에서 선정하며 언론사 페이지(아웃링크)로 이동해 볼 수 있습니다.[단독] \'6성급\' 시그니엘호텔 알고봤더니 등급이 없다고?!""이시국에 바가지를?""…뿔난 원희룡 도지사, 페북에 \'제주 바가지와 전쟁 선포\'이솔이 폴댄스 사진 공개…시선 강탈 자태동생 죽이고 왕위에 오른 \'백제의 세조\' 무령왕[직격인터뷰] 백종원, 대선 주자 언급에 반응이…좋아요0훈훈해요0슬퍼요0화나요0후속기사 원해요0기사제공 :']"
1,삼성전자, 2020-06-2318:09,파이낸셜뉴스 ,"정철동 LG이노텍 사장, 임직원과 ‘덕분에 챌린지’",https://finance.naver.com/news/news_read.nhn?article_id=0004448594&office_id=014&mode=search&query=LG이노텍&page=1,"['       정철동 LG이노텍 사장, 임직원과 ‘덕분에 챌린지’      기사입력2020-06-23 18:09기사원문좋아요훈훈해요좋아요 평가하기공감좋아요0훈훈해요0슬퍼요0화나요0후속기사 원해요0댓글정철동 사장(중앙) 등 LG이노텍 임직원들이 서울 마곡 LG사이언스파크 본사에서 코로나19 의료진에게 감사와 응원의 마음을 전하기 위한 \'#덕분에 챌린지\'에 참여하고 있다. LG이노텍 제공 LG이노텍은 정철동 사장과 임직원이 코로나19 의료진에게 감사와 응원의 마음을 전하는 \'#덕분에 챌린지\' 캠페인에 동참했다고 23일 밝혔다.   \'#덕분에 챌린지\'는 코로나19 의료진과 방역인력을 응원하기 위해 중앙재난안전대책본부가 시작한 참여형 릴레이 캠페인이다.   정철동 사장은 이석희 SK하이닉스 사장의 지명으로 캠페인에 참여했다. 정 사장을 포함한 15명의 LG이노텍 임직원들은 회사를 대표해 의료진을 향한 감사를 표했다. 정 사장은 다음 동참자로 경계현 삼성전기 사장, 전해상 도레이첨단소재 사장, 협력사인 이재현 오알켐 사장을 지명했다.   정 사장은 ""의료진의 희생과 노고가 있었기에 우리 모두가 코로나19를 슬기롭게 극복해나가고 있는 것""이라며 ""이번 캠페인 참여를 통해 이분들께 깊은 감사와 응원의 마음을 전한다""고 말했다.    cgapc@fnnews.com 최갑천 기자 ▶ 헉! 소리나는 스!토리 뉴스 [헉스]▶ \'아는 척\'하고 싶은 당신을 위한 [두유노우]  ※ 저작권자 ⓒ 파이낸셜뉴스. 무단 전재-재배포 금지파이낸셜뉴스 관련뉴스해당 언론사에서 선정하며 언론사 페이지(아웃링크)로 이동해 볼 수 있습니다.양준일 전부인 주장 女의 충격 폭로 ""3년 정도 결혼 생활을..""술취해 로스쿨 女후배집에서 나체 취침, 뜻밖의 결말은..소변에 거품이 나온다면 의심되는 병, 완치 힘들지만..\'46억 건물주\' 방송인의 놀라운 과거 봤더니..유아인 \'2억\' 테슬라 공개…\'1호 고객\' 재벌 회장님은 누구?좋아요0훈훈해요0슬퍼요0화나요0후속기사 원해요0기사제공 :']"
2,삼성전자, 2020-06-2313:46,파이낸셜뉴스 ,"LG이노텍 사장, '#덕분에 챌린지'에 경쟁사 대표 지명한 까닭은",https://finance.naver.com/news/news_read.nhn?article_id=0004448294&office_id=014&mode=search&query=LG이노텍&page=1,"['       LG이노텍 사장, \'#덕분에 챌린지\'에 경쟁사 대표 지명한 까닭은      기사입력2020-06-23 13:46기사원문좋아요훈훈해요좋아요 평가하기공감좋아요0훈훈해요0슬퍼요0화나요0후속기사 원해요0댓글정철동 사장(맨 앞쪽) 등 LG이노텍 임직원들이 서울 마곡 LG사이언스파크 본사에서 코로나19 의료진에게 감사와 응원의 마음을 전하기 위한 ‘#덕분에 챌린지’에 참여하고 있다. /LG이노텍 제공[파이낸셜뉴스]LG이노텍은 정철동 대표와 임직원이 코로나19 의료진에게 감사와 응원의 마음을 전하는 ‘#덕분에 챌린지’ 캠페인에 동참했다고 23일 밝혔다.   ‘#덕분에 챌린지’는 코로나19 의료진과 방역 인력을 응원하기 위해 중앙재난안전대책본부가 시작한 참여형 릴레이 캠페인이다.   정철동 사장은 이석희 SK하이닉스 사장의 지명으로 캠페인에 참여했다. 정 사장을 포함한 15명의 LG이노텍 임직원들은 회사를 대표해 의료진을 향한 감사를 표했다. 정 사장은 다음 동참자로 경계현 삼성전기 사장, 전해상 도레이첨단소재 사장, 협력사인 이재현 오알켐 사장을 지명했다. 삼성전기는 LG이노텍과 카메라 모듈, 기판소재 분야 등에서 각축을 벌이는 경쟁사지만 업계를 초월해 코로나19 극복에 힘을 보태자는 의미로 풀이된다.   정 사장은 “의료진의 희생과 노고가 있었기에 우리 모두가 코로나19를 슬기롭게 극복해 나가고 있는 것”이라며 “이번 캠페인 참여를 통해 이분들께 깊은 감사와 응원의 마음을 전한다”고 말했다.    cgapc@fnnews.com 최갑천 기자   ▶ 헉! 소리나는 스!토리 뉴스 [헉스]▶ \'아는 척\'하고 싶은 당신을 위한 [두유노우]  ※ 저작권자 ⓒ 파이낸셜뉴스. 무단 전재-재배포 금지파이낸셜뉴스 관련뉴스해당 언론사에서 선정하며 언론사 페이지(아웃링크)로 이동해 볼 수 있습니다.양준일 전부인 주장 女의 충격 폭로 ""3년 정도 결혼 생활을..""술취해 로스쿨 女후배집에서 나체 취침, 뜻밖의 결말은..소변에 거품이 나온다면 의심되는 병, 완치 힘들지만..유아인 \'2억\' 테슬라 공개…\'1호 고객\' 재벌 회장님은 누구?\'부부는 같은 방, 아들은..\' 가족 3명 숨진 채 발견, 알고보니좋아요0훈훈해요0슬퍼요0화나요0후속기사 원해요0기사제공 :']"
3,삼성전자, 2020-06-2313:44,헤럴드경제 ,“코로나 의료진에 감사” 정철동 LG이노텍 사장 ‘덕분에 챌린지’ 동참,https://finance.naver.com/news/news_read.nhn?article_id=0001690109&office_id=016&mode=search&query=LG이노텍&page=1,"['       “코로나 의료진에 감사” 정철동 LG이노텍 사장 ‘덕분에 챌린지’ 동참      기사입력2020-06-23 13:44기사원문좋아요훈훈해요좋아요 평가하기공감좋아요0훈훈해요0슬퍼요0화나요0후속기사 원해요0댓글다음 동참자로 경계현 삼성전기 사장 등 지명서울 강서구 마곡 LG사이언스파크에 위치한 LG이노텍 본사에서 정철동(앞줄 가운데) LG이노텍 사장을 비롯한 임직원 15명이 회사를 대표해 코로나19 의료진에게 감사와 응원의 마음을 전하기 위한 ‘#덕분에 챌린지’에 참여하고 있다. [LG이노텍 제공][헤럴드경제 천예선 기자] LG이노텍 정철동 사장과 임직원들이 코로나19 의료진에게 감사와 응원의 마음을 전하기 위해 ‘#덕분에 챌린지’ 캠페인에 동참했다.23일 LG이노텍에 따르면, 정 사장을 포함한 15명의 LG이노텍 임직원들은 회사를 대표해 의료진을 향한 감사를 표했다.정 사장은 “코로나 사태 장기화에도 의료진의 희생과 노고가 있었기에 우리 모두가 코로나19를 슬기롭게 극복해 나가고 있는 것”이라며 “이번 캠페인 참여를 통해 이분들께 깊은 감사와 응원의 마음을 전한다”고 말했다.‘#덕분에 챌린지’는 코로나19 의료진과 방역인원들을 응원하기 위해 중앙재난안전대책본부가 시작한 참여형 릴레이 캠페인이다.‘존경’을 의미하는 수어 동작(왼손바닥 위에 오른손 주먹을 올리고 엄지 손가락을 세움)을 촬영해 ‘#덕분에 챌린지’, ‘#의료진 덕분에’ 등 해시태그를 달아 SNS에 게시한다. 이 캠페인은 참여자가 다음 참여자 3명을 지명하는 방식으로 이어진다.정철동 사장은 이석희 SK하이닉스 사장의 지명으로 캠페인에 참여했다. 정 사장은 다음 동참자로 경계현 삼성전기 사장과 전해상 도레이첨단소재 사장, 협력사인 이재현 오알켐 사장을 지명했다.한편 LG이노텍은 코로나19 위기 극복을 위한 다양한 활동을 적극 추진해왔다. 지난 3월에는 코로나19 확산 방지 및 피해 복구 지원을 위해 총 6억원 상당의 성금과 방호복 등 방역 물품을 사회복지공동모금회에 기부했다. 이어 4월에는 코로나19로 어려움을 겪는 중소 협력사들을 위해 총 1,500억원 규모의 동반성장펀드와 납품 대금을 앞당겨 지급했다.같은 달 LG이노텍은 구미시와 구미시 금오종합사회복지관에 홀몸 어르신, 장애인 등 취약계층을 위한 마스크 총 2만 4,000장을 지원했다. LG이노텍 노조도 4월부터 한 달여간 전국 4개 사업장에서 코로나19 지역사회 확산 방지를 위한 방역 활동에 앞장선 바 있다.▶[디;콘] 여론조사를 조사하다!▶채널 구독하면 LED마스크, 공기청정기가 내손에 ▶농수축산물 소비캠페인 - Copyrights ⓒ 헤럴드경제 & heraldbiz.com, 무단 전재 및 재배포 금지 -헤럴드경제 관련뉴스해당 언론사에서 선정하며 언론사 페이지(아웃링크)로 이동해 볼 수 있습니다.""니들 5년 버릴 때 난 정규직""…하태경 ""노력하면 \'호구\'되는 세상""윤상현 ""정의용, 자신 있으면 볼턴 고소하라""\'고 노무 핑계\'…SBS플러스 "" \'일베\'용어 자막, 고개숙여 사과""김어준 ""北 확성기·전단, 미사일 발사도 아닌데…관리 가능한 긴장""""집값 하위 10%도 자금 출처 내라""…걷어 차인 주거 사다리좋아요0훈훈해요0슬퍼요0화나요0후속기사 원해요0기사제공 :']"
4,삼성전자, 2020-06-2311:10,서울경제 ,경쟁하던 LG·SK·삼성 대표 3인방 함께 '엄지척' 들어올린 사연,https://finance.naver.com/news/news_read.nhn?article_id=0003757624&office_id=011&mode=search&query=LG이노텍&page=1,"['       경쟁하던 LG·SK·삼성 대표 3인방 함께 \'엄지척\' 들어올린 사연      기사입력2020-06-23 11:10기사원문좋아요훈훈해요좋아요 평가하기공감좋아요0훈훈해요0슬퍼요0화나요0후속기사 원해요0댓글전자업계 핵심인사들 잇따라 \'덕분에 챌린지\'이석희·정철동·경계현으로 이어지는 바통3인 \'1960년대생 공학도\'라는 공통점 눈길경쟁사·협력사 가리지 않는 지명에 ""고무적""정철동(첫번째 줄 가운데) LG이노텍 사장이 ‘존경’을 의미하는 수어를 하고 있다. 정 사장 뒤의 직원들은 손 하트를 그리고 있다./사진제공=LG이노텍[서울경제] 한국 경제의 핵심 축인 전자업계가 신종 코로나 바이러스 감염증(코로나19)에 맞서 싸우는 의료진에 대한 존경과 감사를 적극 표현하고 나섰다. 지난 4월 중앙재난안전대책본부가 현장서 사투를 벌이는 의료진을 응원하기 위해 시작한 국민참여형 응원캠페인이 인연을 타고 넘어 재계 핵심인사들에 닿았다. 23일 전자업계에 따르면 이석희 SK하이닉스(000660) 사장과 정철동 LG이노텍(011070) 사장, 경계현 삼성전기(009150) 사장 등 전자업계를 대표하는 인사들이 잇따라 ‘덕분에 챌린지’에 참여했다. 전자업계에 ‘덕분에 챌린지’ 불꽃을 전달한 이는 전자공학회장을 맡고 있는 임혜숙 이화여대 엘텍공과대학 전기전자공학 교수다. 학계서 넘어온 공은 전자업계 전반으로 퍼져나가는 모습이다. 앞서 4, 5월에는 유통이나 금융 등 소비자와 친숙한 기업들이 연달아 챌린지에 참여했던 것처럼, 개인적 친분이나 업무 연관성이 있는 기업들로 확산될 것으로 전망된다.재계는 전자업계로 넘어온 챌린지 열풍이 어떤 지형도를 그려낼지 주목하고 있다. 스타트를 끊은 이 사장은 SK하이닉스에 오기 전, 인텔에서 근무했으며 KAIST 교수로 후학을 양성하는 일을 하기도 했다. 그런 이유로 그가 지목한 대상 3명 가운데 전기전자공학부 학부장을 맡고 있는 문재균 KAIST 교수가 있는 것이 어색하지 않다. 또한 이 사장이 지명한 명단에는 반도체 장비업체이자 오랜 협력사인 주성엔지니어링의 황철주 사장도 있었다. 이들 모두 이 사장과 맺은 일터에서의 인연이 지명의 이유였음을 짐작할 수 있는 부분이기도 하다. 이석희(가운데) SK하이닉스 사장이 임직원들과 함께 ‘존경’의 의미를 담은 수어를 하며 덕분에 챌린지에 동참했다./사진제공=SK하이닉스/이미지투데이그러나 이 사장이 SK그룹 계열사도 아닌 LG이노텍의 정 사장을, 다시 정 사장이 경쟁사인 삼성전기의 경 사장을 지목한 흐름에 대해서는 전자업계서도 추측이 난무하고 있다. 특히 LG이노텍과 삼성전기는 생산하는 부품 가운데 일부가 같은 시장을 두고 치열하게 경쟁하는 관계라는 점에서, 두 사장의 교류가 주목받고 있다. 각 사에서는 ‘덕분에 챌린지’ 지명이유에 대해 공식적으로 “대표이사 사장의 개인적 결정이기에 지명된 분과 어떤 사이인지는 알지 못한다”고 말하고 있어 궁금증을 더 하고 있다. 재계에서는 세 명의 사장이 모두 한국 전자업계의 발전을 현장에서 경험하고 이끌어 온 산업역군이라는 공통점으로 이번 챌린지 배경을 설명한다. 이 사장은 1965년생, 정 사장은 1961년생, 경 사장은 1963년생으로 나이 차가 크지 않다. 1960년대 초중반에 태어나 1980년대 고도 성장을 이끌었던 전자업계서 활발하게 뛰었다는 경력도 동일하다. 특히 이들의 이력을 설명하는 핵심 키워드가 ‘엔지니어’라는 점도 이번 챌린지를 계기로 부각되고 있다. 각각 미래기술연구원장이나 생산 최고책임자(CPO), 메모리 반도체 설계 전문가로서 현업전선에서 겪는 노고를 잘 이해하는 사장이라는 것이 업계의 평이다. 재계 관계자는 “(이 사장·정 사장 등이) 단순히 개인적 친분이 있는 인사에 순서를 넘기는 것에 머물지 않고 임직원과 업계 전반에 ‘덕분에 챌린지’에 대한 관심을 높일 수 있는 대상을 고심해 지명한 것 같다”며 “특히 협력사도 함께 언급하며 언론이나 사회의 시선을 중견·중소기업으로 가게 한 것도 고무적”이라고 말했다. /이수민기자 noenemy@sedaily.com[서울경제 바로가기]▶ 네이버 채널에서 \'서울경제\' 구독해주세요!▶ [서울포럼 2020] 과학기술 초격차가 답이다저작권자 ⓒ 서울경제, 무단 전재 및 재배포 금지서울경제 관련뉴스해당 언론사에서 선정하며 언론사 페이지(아웃링크)로 이동해 볼 수 있습니다.동부센트레빌 35억에 팔려···대치동 무더기 \'신고가\'김종인, \'대선주자\' 언급에 백종원 ""너무 당황스런 이야기···지금 일이 좋아""대구시 1,000억 손배 제기 하루만에···신천지 ""4,200여명 혈장 공여""""고 노무 핑계?"" SBS 또 일베논란···\'왈가닥뷰티\'가 \'왈가닥자막\' 했네박상학 ""대북전단 50만장 보냈다, 수소가스 구입못해 17배 비싼 헬륨가스로""좋아요0훈훈해요0슬퍼요0화나요0후속기사 원해요0기사제공 :']"
5,삼성전자, 2020-06-2310:10,머니S ,'현대 테라타워 CMC' 최초와 최대 지식산업센터로 눈길,https://finance.naver.com/news/news_read.nhn?article_id=0000558867&office_id=417&mode=search&query=LG이노텍&page=1,"['       \'현대 테라타워 CMC\' 최초와 최대 지식산업센터로 눈길      기사입력2020-06-23 10:10기사원문좋아요훈훈해요좋아요 평가하기공감좋아요0훈훈해요0슬퍼요0화나요0후속기사 원해요0댓글━처음이라는 희소성 및 상징성 기업 유치 수월, 가격 상승 큰 영향 오산시 최초 \'현대 테라타워\' 브랜드 지식산업센터 최대 규모로 분양━\'최초\' 타이틀을 건 부동산이 수요자들의 관심을 끌고 있다. 수요자들의 눈도장을 받기 위한 건설사간 \'퍼스트 마케팅\' 경쟁이 치열해지고 있는 것이다. 건설사들은 그간 주변에서 볼 수 없었던 브랜드, 특화설계 등을 선보이며 시장선점과 고객확보라는 두마리 토끼를 잡겠다는 전략이다.  건설사들이 지역 최초로 공급하는 부동산들은 사업장이 가지는 희소성 및 상징성이 높아 타 사업장에 비해 상품에 공을 들이는 경우가 많다. 때문에 수요자들 입장에서도 만족도가 높고 임차인 유지에도 수월하다는 장점이 있으며 수요가 많아 지역 내 랜드마크로 성장하기도 한다. 실제로 부동산 인기지역이나 몇 년 동안 신규 공급이 없었던 지역에서 최초를 내세운 상품들이 잇따라 분양하면서 높은 청약 성적을 기록하고 있다.먼저 전남 여수시에서 공급된 레지던스인 여수 웅천 디 아일랜드 생활형 숙박시설은 345실 모집에 평균 80.3대 1 경쟁률을 기록, 3일만에 완판됐다. 주거, 생활, 휴양 등이 모두 가능한 복합단지면서, 여수 최초 레지던스다. 또, 현대엔지니어링이 처음으로 지산 브랜드 테라타워 론칭 후 서울 송파구 문정지구에서 선을 보인 지식산업센터 \'송파 테라타워\'(2016년 10월 입주)도 성공적인 분양을 한 후 이어 \'송파 테라타워2\'까지 연속으로 선보이고 있다.업계관계자는 ""최초 타이틀을 갖춘 상품은 수요자들에게 호기심과 흥미를 유발하기 때문에 수요자들의 입소문을 통한 효과도 기대 할 수 있다""며 ""또, 새롭고 긍정적인 이미지로 지역 내 랜드마크로 성장하는 경우가 있어 배후수요를 확보할 수 있으며 가격 상승 여력도 높다""고 설명했다.  현대엔지니어링이 오산시 세교택지지구 인근에서 지식산업센터 분양하고 있어 눈길을 모으고 있다. 현대엔지니어링은 옛 LG이노텍 부지(경기도 오산시 가수동 일원)에 국내 최대 규모 지식산업센터 \'현대 테라타워 CMC\'를 분양 중이다.현대 테라타워 CMC는 지하 2층~지상 29층 규모 지식산업센터 2개동과 지하 2층~지상 17층 규모 기숙사동, 지하 1층~지상 10층 규모 물류센터동을 포함한 총 4개동, 연면적 35만7,637㎡의 대규모로 조성된다. 지식산업센터는 지하 2층~지상 6층 제조형과 지상 7층~지상 29층 섹션 오피스형으로 구성되고 지하 1층~지상 2층 일부에 상업시설이 들어선다.현대 테라타워 CMC는 차별화된 테마를 갖춘 지식산업센터로 분양 전부터 주목을 받고 있다. 국내에서 보기 드문 초대형 규모로 희소성이 있는데다, 단지 내에서 업무와 주거, 편의 모두를 누리는 원스톱 생활이 가능해 분양 전부터 문의를 받고 있다는 것이 관계자의 설명이다. 지식산업센터동 지하 2층~지하 1층에는 호텔급라운지, 프라이빗 미팅룸, 컨벤션 홀, 휘트니스센터, 리조트식 수영장(어린이, 유아풀, 온수풀 포함) 등 특화 시설이 들어서며 23층에는 지식산업센터 2개동을 연결하는 스카이 갤러리가 조성돼 미팅룸 및 스튜디오로 활용할 계획이다.특히 초대형 지식산업센터는 희소성이 높아 수요자들에게 인기 부동산으로 손꼽히고 있다. 실제로 한국산업단지공단에 등록된 지식산업센터 1119개소 중 연면적 20만㎡를 넘는 초대형 지식산업센터는 1%(14개소)에 불과하다.강인귀 기자 ▶ 고수들의 재테크 비법 영상▶거품 뺀 솔직 시승기 ▶ 코로나19 속보 <저작권자 ⓒ \'성공을 꿈꾸는 사람들의 경제 뉴스\' 머니S, 무단전재 및 재배포 금지>머니S 관련뉴스해당 언론사에서 선정하며 언론사 페이지(아웃링크)로 이동해 볼 수 있습니다.\'펜벤다졸 복용\' 김철민, 간에 퍼진 암 사라졌다?""둘이 뭐하는 거야?""… 뒤엉킨 두 모델 \'야릇해\'박신혜, 연인 최태준과 애정전선에 입 열었다\'반지의 제왕\' 배우 이안 홈 별세… 그는 누구?53세 엄정화 다이어트 비법 \'키토제닉 식단\' 무엇?좋아요0훈훈해요0슬퍼요0화나요0후속기사 원해요0기사제공 :']"
