,회사명,날짜,언론사,기사제목,링크,본문
0,삼성전자, 2020-07-2918:41,서울신문 ,‘구광모의 뉴LG’ 시총 100조 복귀…더 뾰족해진 미래먹거리 ‘삼지창’,https://finance.naver.com/news/news_read.nhn?article_id=0003111439&office_id=081&mode=search&query=LG이노텍&page=1,"['       ‘구광모의 뉴LG’ 시총 100조 복귀…더 뾰족해진 미래먹거리 ‘삼지창’      기사입력2020-07-29 18:41기사원문좋아요훈훈해요좋아요 평가하기공감좋아요0훈훈해요0슬퍼요0화나요0후속기사 원해요0댓글전자, 배터리, 통신 ‘삼지창’ 앞세워 도약중인 LG그룹LG그룹의 13개 상장사가 최근 시가총액 100조원대를 기록하며 역대 최고치인 110조원대(2018년 1월)를 넘보고 있다. 2018년 6월 29일 구광모 LG그룹 회장이 취임한 이후 지난달 19일에 처음 시총 100조원을 넘긴 뒤 상승세를 이어 가고 있다. 2011년과 2017~2018년에 시총 100조원을 넘겼던 LG그룹은 구 회장 취임 직전인 2018년 6월 18일 100조원 아래로 떨어졌지만 코로나19로 어려운 국면임에도 2년 만에 다시 100조원대를 회복했다. 지난 5월에는 현대자동차그룹을 제치고 10대 그룹 시총 순위 3위에 등극했으며 29일에는 종가 기준으로 103조 2000억원을 기록했다.그룹의 상승세를 이끄는 것은 LG의 ‘삼지창’이라고 할 수 있는 전자, 배터리, 통신 부문이다. ‘선택과 집중’을 중시하는 구 회장은 LG전자, LG디스플레이, LG화학, LG유플러스, LG이노텍 등 ‘삼지창’에 속하는 5개 주요 계열사에 ‘미래 먹거리’를 키우고 비핵심 사업은 과감히 정리하는 최고전략책임자(CSO)와 경영전략 부문을 둬 공을 들이고 있다. ‘구광모 체제’의 핵심 인물인 권영수 LG 부회장도 LG전자, LG화학, LG디스플레이, LG유플러스 등 4곳의 이사회 의장을 도맡아 힘을 실어 주고 있다. 반면 전자결제, 액정표시장치(LCD) 편광판 등 ‘삼지창’ 계열사들의 비핵심 사업은 과감하게 정리했다.LG전자, LG디스플레이, LG이노텍이 이끄는 전자 분야에서는 LG가 전통적으로 강했던 ‘생활가전’이 성장을 주도하고 있다. 스타일러(의류관리기), 의류건조기, 식기세척기 등 고부가가치 ‘신(新)가전’을 내놔 소비자를 끌어들였다. ‘코로나 불황’이 계속되는 와중에도 생활가전 부문은 올해 상반기에 월풀(매출 10조 2045억원)을 제치고 ‘글로벌 가전 1위’를 재탈환할 것으로 보인다. 지난 1분기 5조 4180억원의 매출을 기록한 LG전자 생활가전은 2분기 추정치(5조 3000억원)를 더해 상반기에 10조 7180억원의 성적표를 받아 들 것으로 전망된다.구광모 LG 회장최근 주춤했던 LG디스플레이도 국내 LCD TV 패널 생산을 과감히 정리하고 중국 광저우 공장도 본격 양산에 들어가면서 하반기 실적 반등이 예상된다.‘제2의 반도체’로 불리는 전기차 배터리 분야에서는 LG화학이 올해 1~5월 글로벌 누적점유율(SNE리서치)에서 24.2%로 1위를 차지했다. 지난해 1분기에는 4위였다. 2000년 처음 전기차 배터리 사업에 뛰어든 이후 지속적인 투자로 시장 주도권을 쥐었다. 2분기 자동차 전지 사업 부문에서도 1000억원대 영업이익을 거둬 ‘국내 배터리 3사’ 중 유일하게 적자를 면할 것으로 보인다.통신 분야를 이끄는 LG유플러스도 ‘만년 3위’라는 꼬리표를 벗기 위해 콘텐츠 개발과 해외 수출에 애쓰고 있다. 이전에는 통신 3사가 5:3:2 비율로 시장을 가져가는 것이 고착화됐는데 LG유플러스는 지난 5월 기준으로 5세대(5G) 이동통신 점유율 24.5%를 기록하며 2위 KT(30.3%)를 바짝 쫓고 있다. 유료방송 시장에서는 LG헬로비전을 인수한 LG유플러스가 점유율 24.91%로 2위 자리를 지키고 있다.홍기용 인천대 경영학부 교수는 “반도체 사업이 없어 아쉽던 LG가 특화된 분야를 잘 발전시키고 있다”며 “앞으로 바이오 분야에도 한번 도전해 봤으면 좋겠다”고 말했다.한재희 기자 jh@seoul.co.kr▶ 네이버에서 서울신문 구독하기 클릭! ▶ 세상에 이런 일이 ▶ [연예계 뒷얘기] 클릭!ⓒ 서울신문(www.seoul.co.kr), 무단전재 및 재배포금지서울신문 관련뉴스해당 언론사에서 선정하며 언론사 페이지(아웃링크)로 이동해 볼 수 있습니다.[단독] 박원순 또다른 여비서 2명도 ""이런 일 못해""""아내 무섭게 생겼네"" 험담하다 \'중상\'…또 반전120억 로또 당첨자, \'살인범\' 된 기구한 사연""생리 때까지"" 中회사 대형 성폭행 스캔들""조건만남 왔는데요"" 초인종 누른 낯선 남자들좋아요0훈훈해요0슬퍼요0화나요0후속기사 원해요0기사제공 :']"
1,삼성전자, 2020-07-2916:24,전자신문 ,"코로나19 이후 5개월, 대기업 직원 1만2000명 감소",https://finance.naver.com/news/news_read.nhn?article_id=0002895786&office_id=030&mode=search&query=LG이노텍&page=1,"[""       코로나19 이후 5개월, 대기업 직원 1만2000명 감소      기사입력2020-07-29 16:24기사원문좋아요훈훈해요좋아요 평가하기공감좋아요0훈훈해요0슬퍼요0화나요0후속기사 원해요0댓글ⓒ게티이미지뱅크코로나19가 본격화된 2월부터 6월까지 국내 500대 기업 직원이 1만1800명 이상 줄어든 것으로 나타났다.29일 CEO스코어(대표 박주근)가 국내 500대 기업 중 국민연금 가입 여부를 알 수 있는 498개 사의 국민연금 가입자 추이를 조사한 결과, 6월 말 현재 국민연금 가입자는 165만345명으로 코로나19가 본격 확산된 2월(최초 확진자 1월20일)부터 6월까지 5개월간 1만1880명이 줄어든 것으로 집계됐다.지난해 같은 기간 국민연금 가입자가 3747명 늘어난 것과 상반된 결과로, 코로나19로 인한 기업의 고용 감소로 해석된다.업종별로는 22개 업종 중 절반이 넘는 15개 업종에서 국민연금 가입자가 감소했다. 유통을 비롯해 식음료, 생활용품, 서비스 등 B2C 업체들의 감소가 두드러졌다. 자동차·부품과 조선·기계·설비 등 공장 가동 중단 등으로 제품 생산에 차질을 빚은 제조업도 눈에 띄었다.유통업종의 경우 2월부터 6월까지 2만4294명이 국민연금을 신규 취득한 반면 2만6813명이 상실해 실질 감소 인원은 2519명에 달했다. 이어 △건설 및 건자재(-1947명) △식음료(-1729명) △공기업(-1701명) △생활용품(-1486명) △서비스(-1428명) △자동차·부품(-1049명) 등이 1000명 이상 줄었다.반면 석유화학업종은 순증가 인원이 2016명으로 전체 업종 중 유일하게 1000명 이상 증가했다. 월별로 보면 2월 3594명이 순증했지만 3월부터 6월까지 매월 순감하는 추세로, 6월에는 1351명이 줄었다.기업별로는 국내 최대 멀티플렉스 CJ CGV 감소 인원이 2508명으로 가장 많았다. 500대 기업 중 유일하게 2000명 이상 줄었는데, 코로나19로 극장 관객이 급감하면서 일부 극장을 폐쇄하고 정상 영업점도 상영회차를 줄였다. 지난 3월에는 창사 이래 첫 희망퇴직을 실시했다.다음으로 롯데쇼핑(-1601명), 아성다이소(-1259명), GS리테일(-1121명)이 1000명 이상 줄었고, 두산중공업(-899명), 스타벅스커피코리아(-769명), 에프알엘코리아(-752명), LG이노텍(-717명), 아워홈(-598명) 등이 뒤를 이었다.대부분 기업의 고용이 줄어든 가운데, 국민연금 가입자 수가 오히려 늘어난 곳은 201곳이었다.이 중 쿠팡이 3521명 늘어 증가인원 1위를 기록했다. 코로나19로 배송 물량이 급증하면서 배송직원을 대거 채용했기 때문이다. 2019년 말 5000여명이었던 배송직원은 현재 1만 명을 넘어선 것으로 알려졌다.쿠팡을 제외하고 1000명 이상 고용이 늘어난 곳은 한화큐셀앤드첨단소재를 흡수합병한 한화솔루션(3130명)과 삼성전자(1153명) 2곳이다.권건호기자 wingh1@etnews.com▶ '플랫폼으로서의 오프라인 리테일 이노베이션 2020' 8월 21일 개최▶ 네이버 홈에서 [전자신문] 구독하기 [Copyright ⓒ 전자신문 & 전자신문인터넷, 무단전재 및 재배포 금지]전자신문 관련뉴스해당 언론사에서 선정하며 언론사 페이지(아웃링크)로 이동해 볼 수 있습니다.카카오, 빅데이터 조회 서비스 '카카오데이터트렌드' 오픈3강 구도 깨진 배달앱 시장…'쩐의전쟁' 춘추전국시대로1800억 규모 '가상 국토정보 R&D' 시동법 개정에 비대면 바람까지…전자문서 시대 전환 가속한수원, '30㎿급 대형 수력 발전 설비' 국산화 착수좋아요0훈훈해요0슬퍼요0화나요0후속기사 원해요0기사제공 :""]"
2,삼성전자, 2020-07-2914:21,문화일보 ,‘코로나 5개월’ 대기업 직원 1만명 이상 줄었다,https://finance.naver.com/news/news_read.nhn?article_id=0002437006&office_id=021&mode=search&query=LG이노텍&page=1,"['       ‘코로나 5개월’ 대기업 직원 1만명 이상 줄었다      기사입력2020-07-29 14:21기사원문좋아요훈훈해요좋아요 평가하기공감좋아요0훈훈해요0슬퍼요0화나요0후속기사 원해요0댓글CEO스코어 498곳 조사 국민연금 가입 추이 분석 결과 유통·건설·식음료 업종 많아신종 코로나바이러스 감염증(코로나19) 확산 이후 5개월 동안 대기업 직원 1만 명 이상이 줄어든 것으로 나타났다.기업평가사이트 CEO스코어는 국내 500대 기업 중 국민연금 가입 여부를 알 수 있는 498개 사의 국민연금 가입자 추이를 조사한 결과, 이같이 파악됐다고 29일 밝혔다. 지난 6월 말 기준 국민연금 가입자는 165만345명으로 코로나19가 본격 확산된 2월(최초 확진자 1월 20일)부터 5개월간 1만1880명이 감소해 코로나19로 대기업 고용시장이 타격을 입은 것으로 분석됐다.업종별로는 22개 업종 중 절반이 넘는 15개 업종에서 국민연금 가입자가 감소했다. 특히 유통업종의 경우 2월부터 6월까지 2만4294명이 국민연금을 신규취득한 반면 2만6813명이 상실해 실질 감소 인원은 2519명에 달했다. 이어 △건설 및 건자재(-1947명) △식음료(-1729명) △공기업(-1701명) △생활용품(-1486명) △서비스(-1428명) △자동차·부품(-1049명) 등에서 1000명 이상 줄었다. 기업별로는 CJ CGV의 감소 인원이 2508명으로 가장 많았다. 이는 500대 기업 중 유일하게 2000명 이상 줄어든 것이다. 롯데쇼핑(-1601명), 아성다이소(-1259명), GS리테일(-1121명)이 1000명 이상 줄었고, 두산중공업(-899명), 스타벅스커피코리아(-769명), 에프알엘코리아(-752명), LG이노텍(-717명), 아워홈(-598명) 등이 뒤를 이었다. 대부분 기업의 고용이 줄었지만 201개 기업은 국민연금 가입자 수가 오히려 늘어났다. 그중 쿠팡이 3521명 늘어 증가 인원 1위를 기록했다. 코로나19로 배송 물량이 급증하면서 배송직원을 대규모로 채용한 영향이 반영됐다.김온유 기자 kimonu@munhwa.com[ 문화닷컴 바로가기 | 문화일보가 직접 편집한 뉴스 채널 | 모바일 웹 ][Copyrightⓒmunhwa.com \'대한민국 오후를 여는 유일석간 문화일보\' 무단 전재 및 재배포 금지(구독신청:02)3701-5555)]문화일보 관련뉴스해당 언론사에서 선정하며 언론사 페이지(아웃링크)로 이동해 볼 수 있습니다.<10문10답>전세계 \'코로나 백신 개발\' 현황·전망또래인 척 접근해 하루 12번·보름간 150번 \'성 착취\'40대 유명 싱어송라이터, 팬들과 성관계 불법촬영 수사\'정액없는 성폭행\' 2심도 유죄…법원 ""피해진술 일관돼""SBS 김민형 아나운서, 김대헌 호반건설 대표와 교제좋아요0훈훈해요0슬퍼요0화나요0후속기사 원해요0기사제공 :']"
3,삼성전자, 2020-07-2911:01,한국일보 ,"코로나로 일자리 희비교차... CGV 2500명 감소, 쿠팡 3500명 증가",https://finance.naver.com/news/news_read.nhn?article_id=0000520451&office_id=469&mode=search&query=LG이노텍&page=1,"['       코로나로 일자리 희비교차... CGV 2500명 감소, 쿠팡 3500명 증가      기사입력2020-07-29 11:01기사원문좋아요훈훈해요좋아요 평가하기공감좋아요0훈훈해요0슬퍼요0화나요0후속기사 원해요0댓글코로나19 이후 일자리 감소 현실로5개월 동안 대기업 직원 1만명 줄어코로나19가 본격화한 2월부터 6월까지 국내 500대 기업 직원이 1만명 이상 줄어든 것으로 나타났다. 사진은 서울 중구 서울고용복지플러스센터를 찾은 구직자들이 실업급여 설명회 시작을 기다리며 자리에 앉아 있는 모습. 뉴스1신종 코로나바이러스 감염증(코로나19) 장기화로 인한 일자리 감축이 현실화하고 있다. 코로나19가 본격화한 2월부터 6월까지 5개월 간 국내 500대 기업 직원이 1만명 이상 줄어든 것으로 나타났다. 업종별, 기업별 희비도 엇갈렸다. 관람객이 뚝 떨어진 CJ CGV의 경우 2,500명 이상의 직원이 일자리를 잃은 반면 택배 등 비대면 서비스 이용 증가로 인해 쿠팡 직원은 3,500명 넘게 늘었다.29일 기업평가사이트 CEO스코어가 국내 500대 기업 중 국민연금 가입 여부를 알 수 있는 498개사의 국민연금 가입자 추이를 조사한 결과 코로나19가 확산한 2월(최초 확진자 1월 20일)부터 지난 달까지 순고용(취득자수-상실자수)은 1만1,880명 줄었다. 지난 해 같은 기간 3,747명 늘어난 것과 대조적이다. 업종별로는 22개 업종 중 절반이 넘는 15개 업종에서 순고용이 감소했다. 유통(-2,519명)을 비롯해 건설 및 건자재(-1,947명), 식음료(-1,729명), 공기업(-1,701명), 생활용품(-1,486명), 서비스(-1,428명), 자동차ㆍ부품(-1,049명) 등이 1,000명 이상 줄었다.기업별로는 국내 최대 멀티플렉스 CJ CGV의 순고용 감소가 2,508명으로 가장 많았다. 500대 기업 중 유일하게 2,000명 이상 줄었는데 코로나19로 관객이 급감하면서 일부 극장을 폐쇄하고 정상 영업점도 상영 회차를 줄인 탓이다. 지난 3월에는 창사 이래 첫 희망퇴직을 실시하기도 했다.다음으로 롯데쇼핑(-1,601명), 아성다이소(-1,259명), GS리테일(-1,121명)이 1,000명 이상 줄었고 두산중공업(-899명), 스타벅스커피코리아(-769명), 에프알엘코리아(-752명), LG이노텍(-717명), 아워홈(-598명) 등이 뒤를 이었다.순고용이 늘어난 기업은 201곳이었는데 이 가운데 쿠팡(3,521명)의 증가폭이 가장 높았다. 코로나19로 배송 물량이 급증하면서 배송 직원을 대거 채용했기 때문이다. 지난 해 말 5,000여 명이었던 배송 직원은 현재 1만명을 넘어선 것으로 알려졌다. 쿠팡을 제외하고 1,000명 이상 순고용이 늘어난 곳은  한화솔루션(3,130명)과 삼성전자(1,153명)였다.윤태석 기자 sportic@hankookilbo.com▶ 네이버 채널에서 한국일보를 구독하세요!▶ [정치채널X] [뉴스보야쥬] [넷따잡] [뷰잉] 영상보기▶ 한국일보닷컴 바로가기한국일보 관련뉴스해당 언론사에서 선정하며 언론사 페이지(아웃링크)로 이동해 볼 수 있습니다.\'소설 쓰시네\' 추미애 거친 행보에 통합당은 웃는다?176석 슈퍼 여당의 \'위력\' 막아세울 방법 없었다\'한강 몸통살인\' 장대호 무기징역 확정존경할 만한 어른은 어디있을까 유일한 해독제 ""라떼는 말야""김창렬 원장 \'사죄 남성 아베 아냐.. 철거 계획 없다\'좋아요0훈훈해요0슬퍼요0화나요0후속기사 원해요0기사제공 :']"
4,삼성전자, 2020-07-2909:35,머니S ,코로나19 쇼크에 대기업 직원 1만명 이상 줄었다,https://finance.naver.com/news/news_read.nhn?article_id=0000574182&office_id=417&mode=search&query=LG이노텍&page=1,"['       코로나19 쇼크에 대기업 직원 1만명 이상 줄었다      기사입력2020-07-29 09:35기사원문좋아요훈훈해요좋아요 평가하기공감좋아요0훈훈해요0슬퍼요0화나요0후속기사 원해요0댓글신종 코로나바이러스 감염증(코로나19) 여파로 국내 500대 기업 직원이 1만명 이상 감소한 것으로 나타났다. / 사진=뉴시스신종 코로나바이러스 감염증(코로나19) 여파로 국내 500대 기업 직원이 1만명 이상 감소한 것으로 나타났다.29일 기업평가사이트 CEO스코어가 국내 500대 기업 중 국민연금 가입 여부를 알 수 있는 498개 사의 국민연금 가입자 추이를 조사한 결과 6월 말 기준 국민연금 가입자는 165만345명으로 집계됐다.코로나19가 본격 확산된 2월(최초 확진자 1월20일)부터 6월까지 5개월간 1만1880명이 줄어든 것이다.지난해 같은 기간 국민연금 가입자가 3747명 늘어난 것과 대조적인 것으로 코로나19가 기업의 고용에까지 타격을 준 것으로 해석된다.업종별로는 22개 업종 중 절반이 넘는 15개 업종에서 국민연금 가입자가 감소했다. 유통을 비롯해 식음료, 생활용품, 서비스 등 B2C 업체들의 감소가 두드러졌다. 유통업종의 경우 2월부터 6월까지 2만4294명이 국민연금을 신규 취득한 반면 2만6813명이 상실해 실질 감소 인원은 2519명에 달했다.이어 ▲건설 및 건자재(-1947명) ▲식음료(-1729명) ▲공기업(-1701명) ▲생활용품(-1486명) ▲서비스(-1428명) ▲자동차‧부품(-1049명) 등이 1000명 이상 줄었다.반면 석유화학업종은 순증가 인원이 2016명으로 전체 업종 중 유일하게 1000명 이상 증가했다. 기업별로는 국내 최대 멀티플렉스 CJ CGV의 인원이 2508명 감소해 가장 많이 줄었다. 이어 ▲롯데쇼핑(-1601명) ▲아성다이소(-1259명) ▲GS리테일(-1121명)이 1000명 이상 줄었다. ▲두산중공업(-899명) ▲스타벅스커피코리아(-769명) ▲에프알엘코리아(-752명) ▲LG이노텍(-717명) ▲아워홈(-598명) 등이 뒤를 이었다.국민연금 가입자 수가 오히려 늘어난 곳은 201곳이었다. 쿠팡이 3521명 늘어 증가인원 1위를 기록했다. 코로나19로 배송 물량이 급증하면서 배송직원을 대거 채용했기 때문이다.이 외에 한화큐셀앤드첨단소재를 흡수합병한 한화솔루션(3130명)과 삼성전자(1153명)도 고용이 1000명 이상 늘었다.이한듬 기자 mumford@mt.co.kr▶ 고수들의 재테크 비법 영상▶거품 뺀 솔직 시승기 ▶ 코로나19 속보 <저작권자 ⓒ \'성공을 꿈꾸는 사람들의 경제 뉴스\' 머니S, 무단전재 및 재배포 금지>머니S 관련뉴스해당 언론사에서 선정하며 언론사 페이지(아웃링크)로 이동해 볼 수 있습니다.가수 김정민, 생활고 어땠길래… ""슬프고 울적""김혜수 어머니 \'빚투\'… ""채무가 무려 13억?""김민형, 재벌2세와 \'열애\'… 호반건설 대표?김종민 ""아들 문제 가만 있겠냐""에 장제원 \'얼음\'\'중독·환각\' 에토미데이트 구입한 아이돌… 누구?좋아요0훈훈해요0슬퍼요0화나요0후속기사 원해요0기사제공 :']"
5,삼성전자, 2020-07-2909:16,조선일보 ,"코로나로 직원 2500명 줄인 CGV, 반대로 직원 늘어난 곳은?",https://finance.naver.com/news/news_read.nhn?article_id=0003550106&office_id=023&mode=search&query=LG이노텍&page=1,"['       코로나로 직원 2500명 줄인 CGV, 반대로 직원 늘어난 곳은?      기사입력2020-07-29 09:16기사원문좋아요훈훈해요좋아요 평가하기공감좋아요0훈훈해요0슬퍼요0화나요0후속기사 원해요0댓글2020년 3월 16일 코로나 바이러스 사태 여파로 관객이 급감한 서울 CGV 용산아이파크몰. 전국 영화관 하루 관객이 3만명대로 떨어지면서 신작 개봉은 줄줄이 연기되고, 재개봉 영화로 상영 시간을 채우고 있다./김지호 기자신종 코로나바이러스 감염증이 본격화된 2월부터 6월까지 국내 500대 기업 직원이 1만1800명 이상 줄어든 것으로 나타났다. 고용시장이 경색됨에 따라 국민연금 신규 취득자가 작년보다 큰 폭으로 줄었다.29일 기업평가사이트 CEO스코어(대표 박주근)가 국내 500대 기업 중 국민연금 가입 여부를 알 수 있는 498개 사의 국민연금 가입자 추이를 조사한 결과, 6월 말 현재 국민연금 가입자는 165만345명으로 코로나19가 본격 확산된 2월(최초 확진자 1월20일)부터 6월까지 5개월간 1만1880명이 줄어든 것으로 집계됐다. 지난해 같은 기간 국민연금 가입자가 3747명 늘어난 것과 상반된 결과로, 코로나 사태로 인한 기업의 고용 감소로 해석된다.업종별로는 22개 업종 중 절반이 넘는 15개 업종에서 국민연금 가입자가 감소했다. 유통을 비롯해 식음료, 생활용품, 서비스 등 B2C 업체들의 감소가 두드러졌다. 자동차·부품과 조선·기계·설비 등 공장 가동 중단 등으로 제품 생산에 차질을 빚은 제조업도 눈에 띄었다. 유통업종의 경우 2월부터 6월까지 2만4294명이 국민연금을 신규 취득한 반면 2만6813명이 상실해 실질 감소 인원은 2519명에 달했다. 이어 ▲건설 및 건자재(-1947명) ▲식음료(-1729명) ▲공기업(-1701명) ▲생활용품(-1486명) ▲서비스(-1428명) ▲자동차·부품(-1049명) 등이 1000명 이상 줄었다.기업별로는 국내 최대 멀티플렉스 CJ CGV의 감소 인원이 2508명으로 가장 많았다. 500대 기업 중 유일하게 2000명 이상 줄었는데, 코로나사태로 극장 관객이 급감하면서 일부 극장을 폐쇄하고 정상 영업점도 상영회차를 줄였다. 지난 3월에는 창사 이래 첫 희망퇴직을 실시했다. 다음으로 롯데쇼핑(-1601명), 아성다이소(-1259명), GS리테일(-1121명)이 1000명 이상 줄었다. 두산중공업(-899명), 스타벅스커피코리아(-769명), 에프알엘코리아(-752명), LG이노텍(-717명), 아워홈(-598명) 등이 뒤를 이었다.대부분 기업의 고용이 줄어든 가운데, 국민연금 가입자 수가 오히려 늘어난 곳은 201곳이었다. 쿠팡이 3521명 늘어 증가인원 1위를 기록했다. 코로나 사태로 배송 물량이 급증하면서 배송직원을 대거 채용했기 때문이다. 2019년 말 5000여명이었던 배송직원은 현재 1만 명을 넘어선 것으로 알려졌다. 쿠팡을 제외하고 1000명 이상 고용이 늘어난 곳은 한화큐셀앤드첨단소재를 흡수합병한 한화솔루션(3130명)과 삼성전자(1153명) 2곳이다.[신은진 기자 momof@chosun.com] ▶ 유용원 군사전문기자의 밀리터리시크릿 \'밀톡\' ▶ 과학이 이렇게 재밌을수가~ \'사이언스카페\' ▶ TOP7의 비하인드 스토리 \'트롯맨 열전\' 받으세요- Copyrights ⓒ 조선일보 & chosun.com, 무단 전재 및 재배포 금지 - 조선일보 관련뉴스해당 언론사에서 선정하며 언론사 페이지(아웃링크)로 이동해 볼 수 있습니다.靑, 감사위원에 김오수 임명 요구… 최재형 감사원장이 2차례 거부文대통령, 뉴질랜드 총리에 韓외교관 성추행 의혹 언급[선우정 칼럼] 이것은 대한민국 법이 아니다\'문재인을 파면한다\' 급상승 검색어, 이튿날에도 상위권에""진성준이 맞는 말 했네""...주택가격전망지수 급등, 역대 최고치 근접좋아요0훈훈해요0슬퍼요0화나요0후속기사 원해요0기사제공 :']"
