,회사명,날짜,언론사,기사제목,링크,본문
13,삼성전자, 2017-08-2911:41,헤럴드경제 ,다리미 하나에 400만원…차별화? 프리미엄전략?,https://finance.naver.com/news/news_read.nhn?article_id=0001283225&office_id=016&mode=search&query=삼성전자&page=6,"['       다리미 하나에 400만원…차별화? 프리미엄전략?      기사입력2017-08-29 11:41기사원문좋아요훈훈해요좋아요 평가하기공감좋아요0훈훈해요0슬퍼요0화나요0후속기사 원해요0댓글- 초고가 가전 속속 등장[헤럴드경제=홍석희 기자] 100만원대 청소기와 4000만원대 TV에 이어 400만원대 다리미까지 등장했다. ‘싸고 질좋은 제품’이 좋은 제품이란 통념을 깬 제품들이다. 가전 시장에 초프리미엄 열풍이 불고 있다.명품가전 유통업체 얼티메이트드림은 29일 서울 청담 드레스가든에서 스위스 프리미엄 스팀다리미 ‘로라스타’ 국내 출시 행사를 진행했다. 행사에는 주한 스위스 부대사 다니엘 데르지치와 로라스타 CEO 장 몬니가 참여했다.국내에선 생소한 ‘로라스타’는 유럽 고급 다리미 시장점유율 60%가 넘는 브랜드다. 제품은 모두 4가지 종류로 최저 119만원에서 최고 449만원까지 다양하다. 저가형은 다리미만, 고가형은 다림판까지 포함된 것이 특징이다. 다림판에선 바람이 나오고, 다리미는 불룩한 홈이 있어 한번의 다림질로 구김이 모두 지워진다는 것이 회사측 설명이다.초고가형 다리미 출시에 대한 시장의 반응은 엇갈린다. 1만원이면 살 수 있는 다리미를 400만원 넘게 주고살 사람이 있겠느냐는 반응부터, 비싼 만큼 제 값을 할 것이란 반응까지 극과 극이다. 회사 관계자는 “100만원짜리 청소기가 출시됐을 때 반응도 유사했다. 그런데 지금은 없어서 못판다. 충분한 시장조사와 가능성을 체크했다”고 자신했다.실제로 영국의 명품 청소기 제조사 다이슨은 독자적인 모터 경쟁력을 바탕으로 국내에 120만원짜리 무선 청소기를 내놨고, 날개돋힌 듯 팔려 나갔다. LG전자는 이와 유사한 제품을 지난 6월 선보여 4만대 넘게 팔았고, 삼성전자는 9월 1일부터 시작하는 독일 가전행사(IFA)에서 상중심 무선청소기를 선보일 예정이다.초고가 가전은 국내 업체들도 이미 선보인 바 있다. 삼성전자는 지난 5월 냉장고 내부에 도자기를 입힌 ‘셰프컬렉션 포슬린’을 내놨다. 가격은 1449만원이다. LG전자는 2015년 초프리미엄 브랜드 ‘LG 시그니처’를 선보이면서 고가 시장 선점에 나서기도 했다. LG 올레드 TV W 최상위 모델 가격은 4000만원대를 넘나든다.초고가 가전시장의 주요 타깃은 ‘상위 5%’다. 글로벌 가전시장 규모는 약 350조원 가량으로 추산되는데, 이 가운데 초고가 가전 시장은 약 5%(17조원)를 차지한다. 초고가 가전에 업체들이 눈독을 들이는 것은 가격에 덜 민감하기 때문이다. 특히 최근 글로벌 경기 활황세와 맞물려 시장 성장성은 더 커질 것으로 전망된다.가전업계 관계자는 “비싸도 질 좋은 제품을 사려는 소비자층은 항상 있다. 한국 기업들 역시 이들을 타깃으로 한 고가 제품을 다수 내놓고 있다”고 말했다.hong@heraldcorp.com▶영감이란 불꽃에 타오르게할 스토리(INSPIRE)▶앞서가는 젊은 경제신문 친구맺기 ▶오늘의 운세 날씨 - Copyrights ⓒ 헤럴드경제 & heraldbiz.com, 무단 전재 및 재배포 금지 -헤럴드경제 관련뉴스해당 언론사에서 선정하며 언론사 페이지(아웃링크)로 이동해 볼 수 있습니다.심판에 뇌물 준 기아 \'충격\'…\'최규순 리스트\' 전모[단독]한명숙, 1억5000만원 전세금 놓고 추징 소송 재개30대 女교사, 초등 6학년 제자 유혹 9차례 성관계 \'충격\'조선족들의 성토…""대림동이 범죄소굴입니까?""현대차 노사 잠정합의 불발…교섭 장기화 우려좋아요0훈훈해요0슬퍼요0화나요0후속기사 원해요0기사제공 :']"
14,삼성전자, 2017-08-2911:37,머니투데이 ,"'착한기업'에 투자하는 ESG ETF, 31일 국내 첫 상장",https://finance.naver.com/news/news_read.nhn?article_id=0003926310&office_id=008&mode=search&query=삼성전자&page=6,"['       \'착한기업\'에 투자하는 ESG ETF, 31일 국내 첫 상장      기사입력2017-08-29 11:37기사원문좋아요훈훈해요좋아요 평가하기공감좋아요0훈훈해요0슬퍼요0화나요0후속기사 원해요0댓글 [머니투데이 김주현 기자] 한국거래소는 한화자산운용의 \'ARIRANG ESG 우수기업 ETF\'를 오는 31일 코스피시장에 상장한다고 29일 밝혔다. 이 상품은 비재무적(ESG) 요소와 재무적(스마트베타) 요소를 접목시킨 국내 첫 \'ESG ETF\'(상장지수펀드)다. ESG는 환경, 사회, 지배구조 등 비재무적 평가결과를 기반으로 투자하는 사회책임투자(SRI)의 한 종류다. 해당 ETF는 ESG평가 우수기업 가운데 상위등급 선정 후 기업가치와 수익률, 재무건전성, 저변동성에서 높은 평가를 받은 종목으로 구성된다. 사회공헌 투자처 제공을 목적으로 장기적 관점에서 시장수익률을 상회하는 성과를 추구하는 것이 특징이다. 기초지수는 WISE ESG우수기업 지수이며, 태영건설, 삼성전자, 현대홈쇼핑 등 50개 종목으로 구성돼있다. 거래소 관계자는 ""기업의 사회적.환경적 책임이 높아지고 있어 향후 높은 성장가능성이 예상된다""며 ""매일 납부자산구성 내역을 체크단말기와 거래소, 자산운용사 ETF 홈페이지에 제공할 예정""이라고 밝혔다. TOM칼럼-깊이있는 투자정보▶무료 만화 즐기고~ 선물타자!▶ 빵빵한 차&레이싱걸▶ 김주현 기자 naro@머니투데이 관련뉴스해당 언론사에서 선정하며 언론사 페이지(아웃링크)로 이동해 볼 수 있습니다.""텀블러 반값""…스타벅스, 온라인몰 폐쇄 앞두고 \'파이널 세일\'""못 살겠다"" 청운효자동 엑소더스…전세물량↑평택 국제대교 붕괴, 그 옆으론 수상스키 탄 시민文대통령, SNS에 박용진 옹호..靑 곰탕 반찬투정 논란 종결?박지원, 安 당대표 소식에 ""충격이 이만저만 아니다"" 해프닝좋아요0훈훈해요0슬퍼요0화나요0후속기사 원해요0기사제공 :']"
15,삼성전자, 2017-08-2911:37,뉴시스 ,스마트폰 시장 삼성·애플 구도에 中업체 추격 거세져,https://finance.naver.com/news/news_read.nhn?article_id=0008146143&office_id=003&mode=search&query=삼성전자&page=6,"['       스마트폰 시장 삼성·애플 구도에 中업체 추격 거세져       기사입력2017-08-29 11:37기사원문좋아요훈훈해요좋아요 평가하기공감좋아요0훈훈해요0슬퍼요0화나요0후속기사 원해요0댓글【서울=뉴시스】추상철 기자 =삼성전자 갤럭시노트8 체험존 운영이 시작된 28일 오후 서울 영등포구 타임스퀘어에 마련된 체험존에서 고객들이 출시를 앞둔 갤럭시노트8을 체험하고 있다.  갤럭시노트8은 내달 15일 출시예정이다. 2017.08.28. scchoo@newsis.com빈익빈 부익부···삼성·애플 선두에 中 4개 업체 뒤쫓아업체별 정체성 강화와 한계 뛰어넘기에 향후 재편 달려【서울=뉴시스】김지은 기자 = 올해 상반기까지 글로벌 스마트폰 출하량 집계에서 시장의 2강 4중 체제가 한층 더 공고해진 것으로 드러났다. 애플과 삼성의 강세 하에 중국 4개 업체가 상승하고 있는 모양새다. 29일 유진투자증권에 따르면 지난 2분기 상위 23개 스마트폰 업체들 중 전년 동기 대비 출하량이 증가한 기업은 양강인 삼성(1%)과 애플(2%)을 비롯해 3,4,5위인 화웨이(20%)와 오포(23%), 비보(28%)인 것으로 알려졌다. 7위인 샤오미 역시 60% 증가세를 기록하며 4대 중국 업체에 포함됐다. 6위를 기록한 LG는 지난해와 올해 스마트폰 사업 부진으로 출하량이 4% 감소한 것으로 알려졌다. 이처럼 삼성과 애플 양대산맥에 중국 기업들이 가격 경쟁력 등으로 중저가 점유율을 높이는 상황은 점점 더 굳어지고 있다는 분석이다.  이승우 유진투자증권 연구원은 ""1년 전과 비교해 6위부터 23위의 18개 업체들 중 출하량이 늘어난 업체가 샤오미를 포함해 단 5개 업체 밖에 없다는 점에 주목해야 한다""며 ""스마트폰 업체들 간의 부익부 빈익빈이 심화되고 있는 것""이라고 지적했다. 이에 기존에 유리한 포지션을 차지하고 있던 업체들의 점유율과 실적은 더욱 좋아지고 그렇지 못한 업체들은 시장에서 도태되는 흐름이 계속될 것이라는 전망이다. 하지만 차후 정체성 강화와 한계를 뛰어넘느냐에 따라 판도를 뒤집을 수는 있다는 설명이다. 유진투자증권은 삼성전자의 경우 중국 시장에서 고전이 계속되고 있으며 기대를 모았던 갤럭시S8도 중국에서는 부진했다고 지적하며 하반기에 IM 사업부의 수익성은 상반기 대비 하락할 것으로 내다봤다. 업계는 이번에 출하량이 감소한 LG전자의 경우 전략적인 제품의 정체성 강화가 필요한 상황이라고 진단했다. 이 연구원은 ""다만 LG전자는 가전과 프리미엄 TV라는 확실한 전략을 보유해 중장기적인 시각에서 MC사업부의 부활 가능성을 기대해 볼 수 있다""고 예상했다. whynot82@newsis.com▶ 뉴시스 빅데이터 MSI 주가시세표 바로가기 ▶ 뉴시스 SNS [페이스북] [트위터]뉴시스 관련뉴스해당 언론사에서 선정하며 언론사 페이지(아웃링크)로 이동해 볼 수 있습니다.초등학생 제자와 수차례 성관계 가진 30대 여교사8500억원 복권 당첨 여성, 32년간 근무한 병원 사직北, 일본 상공 통과 미사일 발사 의도는?…전문가 분석3억원 유산 상속받은 고양이 2마리 \'묘생역전\'이별통보 여친 때리고 성폭행에 동영상까지…좋아요0훈훈해요0슬퍼요0화나요0후속기사 원해요0기사제공 :']"
16,삼성전자, 2017-08-2911:35,아시아경제 ,"[IFA 2017]'40분 세탁' '고급 빌트인'…삼성·LG, 유럽 시장 공략",https://finance.naver.com/news/news_read.nhn?article_id=0004063963&office_id=277&mode=search&query=삼성전자&page=6,"['       [IFA 2017]\'40분 세탁\' \'고급 빌트인\'…삼성·LG, 유럽 시장 공략      기사입력2017-08-29 11:35기사원문좋아요훈훈해요좋아요 평가하기공감좋아요0훈훈해요0슬퍼요0화나요0후속기사 원해요0댓글IFA2017서 퀵드라이브 드럼 세탁기 ·블랙 스테인리스 소재 공개삼성전자 퀵드라이브 세탁기[아시아경제 강희종 기자]세탁 시간을 반으로 줄인 인공지능(AI)세탁기부터 고급스러운 블랙 스테인리스 빌트인까지. 삼성전자와 LG전자가 내달 1일부터 6일(현지시간)까지 독일 베를린에서 열리는 유럽 최대 국제가전전시회 \'IFA2017\'에서 현지인들의 생활 스타일에 적합한 가전 신제품을 출시하고 현지 유럽 시장 공략에 나선다. 삼성전자는 IFA2017에서 세탁시간을 반으로 줄이면서도 다양한 스마트 기능을  적용한 드럼 세탁기 \'퀵드라이브\'를 공개한다고 29일 밝혔다.퀵드라이브는  기존 드럼세탁기의 상하 낙차 방식에 전자동 세탁기의 회전판 방식을 결합해 세탁 성능은 유지하면서 세탁시간은 절반 가까이 줄인 신제품이다. 삼성전자 관계자는 ""유럽 소비자들을 대상으로 시행한 조사 결과 세탁 시간 절감을 가장 중요시한다는 점을 반영해 개발했다""고 설명했다.퀵드라이브는 세탁 드럼통 안쪽 후면에 독자적으로 움직이는 회전판을 결합한 신기술 \'큐드럼(Q-Drum)\'을 적용했다. 큐드럼은 드럼통이 물레방아처럼 돌면서 상하로 떨어지는 낙차로 세탁되는 드럼세탁기 방식과 회전판이 돌면서 발생하는 물살의 힘으로 세탁되는 전자동 세탁기 방식을 동시에 구현했다.가장 빠른 세탁 코스인 슈퍼스피드 코스를 사용할 경우 40분 이내로 세탁 시간이 대폭 단축되며 전력소비도 최대 20%까지 절감할 수 있다고 회사 측은 설명했다. 이 제품은 세계적인 테스트 기관 인터텍과 유럽 최고 섬유연구소 호헨스타인을 통해 세탁 성능과 옷감손상 방지 정도가 기존 세탁기와 동등한 수준으로 유지 됨을 인정받았다.LG 스튜디오 빌트인LG전자는 IFA2017 전시관내 빌트인 가전 전시면적(84㎡)을 전년 대비 2배 이상 늘리고 프리미엄 빌트인 LG 스튜디오 제품 라인업을 대거 선보인다. IFA 2017에 전시할 LG 스튜디오 전 제품은 블랙 스테인리스 스틸 소재를 적용했다. LG전자 관계자는 ""블랙 스테인리스 스틸은 스테인리스 재질에 블랙 코팅을 더해 은은하면서도 고급스러운 느낌을 준다""며 ""기존 스테인리스 제품과 비교해 지문이 남지 않고 소스나 오일 등의 이물질도 쉽게 닦여 관리도 쉽다""고 설명했다.LG전자는 30인치 월오븐, 36인치 쿡탑, 42인치 냉장고 등 기존에 유럽에 출시한 제품 대비 1.5~2배 가량 큰 대형 제품부터 다소 좁은 유럽식 주방에 최적화된 24인치 냉장고까지 다양한 LG 스튜디오 제품을 전시할 계획이다.이 중 24인치 인덕션 쿡탑과 30인치 가스 쿡탑 신제품은 유럽 소비자들에게 처음 공개되는 제품이다. 강희종 기자 mindle@asiae.co.kr▶ 뉴스가 재밌다! 세상의 모든 재미 [티잼]▶ 많이 본 기사아시아경제 관련뉴스해당 언론사에서 선정하며 언론사 페이지(아웃링크)로 이동해 볼 수 있습니다.[속보]\'청와대 밥\' 논란에 전여옥의 직격탄[속보]안철수 대표 당선되자 박지원 갑자기…""큰일났다"" 北으로 들어간 군용물품이…""이재용 1심 5년, 결국 석방으로…"" 대예언화난 손석희, 정부에 결정적인 한방 날렸다좋아요0훈훈해요0슬퍼요0화나요0후속기사 원해요0기사제공 :']"
17,삼성전자, 2017-08-2911:34,뉴시스 ,"삼성전자, '복잡미묘' 도시바 사태 속 홀로 '승승장구'",https://finance.naver.com/news/news_read.nhn?article_id=0008146133&office_id=003&mode=search&query=삼성전자&page=6,"['       삼성전자, \'복잡미묘\' 도시바 사태 속 홀로 \'승승장구\'      기사입력2017-08-29 11:34기사원문좋아요훈훈해요좋아요 평가하기공감좋아요0훈훈해요0슬퍼요0화나요0후속기사 원해요0댓글D램 글로벌 점유율 45.1% 차지한 삼성, 낸드 독주 체제 가속혼전 거듭하는 도시바 사태와 관계없이 \'나홀로 승승장구\'【서울=뉴시스】최현 기자 = 일본 도시바의 메모리 사업부 매각을 둘러싸고 반도체 업계의 희비가 엇갈리고 있는 가운데 삼성전자가 나홀로 승승장구를 거듭하고 있다. 29일 시장조사기관 IHS마킷에 따르면 삼성은 글로벌 반도체 시장에서 매출 기준으로 D램은 45.1%, 낸드플래시는 38.3%의 점유율을 기록하며 독주했다. D램 시장의 점유율을 보면 SK하이닉스는 2위(26.8%), 마이크론은 3위(22.8%), 난야는 4위(2.5%), 윈본드는 5위(1.0%)에 포진됐고, 낸드의 경우 웨스턴디지털(2위·15.8%), 도시바(3위·16.1%), 마이크론(4위·11.6%), SK하이닉스(5위·10.6%) 순이다. 삼성은 올해 2분기에 D램 시장에서만 75억2800만 달러의 매출을 올렸다. 점유율도 1분기에 비해 1.6%p 올랐다. 2위인 SK하이닉스와의 격차는 18.3%p다. 따지고 보면 글로벌 무대에서 팔린 D램 10개 중 7개가 한국 제품이다. 낸드 시장도 삼성의 독주 체제가 확고해지고 있는 형국이다. 올해 2분기 낸드 시장 매출 규모는 전 분기 대비 6.8% 증가한 125억 달러를 기록했다. 반도체 업계에서는 2분기가 일반적인 비수기지만 성장세를 거듭한 것이다. 이 가운데 삼성은 47억9500만 달러에 달하는 낸드를 팔면서 점유율을 더욱 끌어올렸다. 앞서 삼성은 지난 1분기에 36.7%의 낸드 점유율을 기록한 바 있다. 반면 도시바의 경우 1분기에 17.2%의 점유율을 기록했지만 2분기에는 16.1%로 축소됐다. SK하이닉스 역시 11.5%에서 10.6%로 점유율이 줄어들면서 마이크론에 4위 자리를 뺏겼다. SK하이닉스는 도시바 메모리 사업부 인수를 통해 도시바와의 제휴 가능성을 높이는 등 낸드 시장에서의 저변을 확대하려 했지만 웨스턴디지털이 인수자로 바뀌면서 전략이 차질이 빚어지게 됐다.  도시바 매각작업은 \'3국 연합\'이 우선협상자로 선정되면서 순항하는 듯 했다. 3국 연합에는 일본 관민펀드인 산업혁신기구(INCJ)와 국책은행인 정책투자은행, 복수의 일본기업, 미국 사모펀드 베인캐피털, 한국 SK하이닉스 등이 포함됐다.    하지만 도시바의 핵심 낸드 생산거점인 일본 욧카이치 반도체 공장을 공동운영하고 있는 웨스턴디지털이 몽니를 부리면서 사태는 소송까지 번지게 됐고, 도시바는 계속되는 자금 압박으로 웨스턴디지털의 요구에 굴복한 것으로 알려졌다. 현지언론에 따르면 도시바는 미국의 투자펀드 콜버그크래비스로버츠(KKR), 일본 산업혁신기구·일본정책투자은행이 결성한 신(新) 미·일 연합과 마무리 협상을 진행할 계획이다.  기존 우선협상대상자였던 한·미·일 연합에서 SK하이닉스, 베인캐피털이 빠지고 WD와 KKR이 합류한 셈이다. 이에 SK하이닉스는 자체적으로 낸드 역량을 강화하는 차선책을 선택할 수밖에 없는 상황이다. 막판 뒤집기에 성공한 웨스턴디지털은 낸드 시장에서 SK하이닉스, 마이크론 등에 우위를 점하게 됐지만 도시바 메모리 사업부에 대한 의결권이 없는 형태의 인수를 하게 됨으로써 업계에 큰 영향은 없을 전망이다. 독주를 하고 있는 삼성전자의 입장에서는 천문학적인 자본을 무기로 삼고 있는 중국 진영에 도시바가 넘어가지 않은 것이 긍정적인 요소로 작용할 전망이다.  웨스턴디지털은 불과 1년 전인 작년 5월 샌디스크를 인수하며 170억 달러(약 19조3100억원)를 쏟아 부었고, 이번 도시바 인수에는 1500억엔을 투입할 것으로 알려졌다. 들어가는 자금도 부담이지만 시너지 효과를 일으킬만한 협력에도 적지 않은 시간이 소요될 것이라는 게 업계의 시각이다.  삼성은 중장기 낸드플래시 수요 증가에 대응하기 위해 향후 3년간 중국 낸드플래시 공장 증설에 70억 달러(약 7조8500억원)를 투입한다.  2014년 완공된 삼성전자의 시안 반도체 공장 1라인에서는 월 12만장 규모의 3D 낸드가 생산되고 있다. 오는 4분기부터 착공되는 2라인에서는 월 10만장 규모가 추가로 생산되며 2019년부터 가동이 시작될 예정이다. 2020년부터 2라인의 풀가동 생산체제가 완성되면 세계 최고 기술을 확보하고 있는 삼성의 낸드 시장 지배력도 더욱 확고해질 전망이다.  업계 관계자는 ""웨스턴디지털이 도시바 인수전의 승자가 된다고 해도 어떤 효과를 얻을지는 뚜껑을 열어봐야 한다""며 ""당초 독과점으로 인해 이번 인수전에 참여할 수 없었던 삼성 입장에서는 최상의 시나리오 중 하나""라고 설명했다. forgetmenot@newsis.com▶ 뉴시스 빅데이터 MSI 주가시세표 바로가기 ▶ 뉴시스 SNS [페이스북] [트위터]뉴시스 관련뉴스해당 언론사에서 선정하며 언론사 페이지(아웃링크)로 이동해 볼 수 있습니다.초등학생 제자와 수차례 성관계 가진 30대 여교사8500억원 복권 당첨 여성, 32년간 근무한 병원 사직北, 일본 상공 통과 미사일 발사 의도는?…전문가 분석3억원 유산 상속받은 고양이 2마리 \'묘생역전\'이별통보 여친 때리고 성폭행에 동영상까지…좋아요0훈훈해요0슬퍼요0화나요0후속기사 원해요0기사제공 :']"
18,삼성전자, 2017-08-2911:31,뉴시스 ,"[종합]코스피, 北미사일 도발에 장중 2330선까지 후퇴",https://finance.naver.com/news/news_read.nhn?article_id=0008146125&office_id=003&mode=search&query=삼성전자&page=6,"['       [종합]코스피, 北미사일 도발에 장중 2330선까지 후퇴      기사입력2017-08-29 11:31기사원문좋아요훈훈해요좋아요 평가하기공감좋아요0훈훈해요0슬퍼요0화나요0후속기사 원해요0댓글 【서울=뉴시스】김형섭 기자 = 29일 북한의 탄도미사일 발사로 지정학적 리스크가 재부각되면서 코스피가 불과 하루 만에 2370선에서 2330선까지 후퇴했다.  이날 코스피 지수는 전 거래일(2370.30)보다 14.1포인트(0.59%) 내린 2356.20로 출발했다. 이후 꾸준히 낙폭을 확대해 2332.85까지 떨어졌으며 오전 11시25분 현재 2338.76을 가리키고 있다. 코스피가 장중에 2330선까지 떨어진 것은 지난 14일 이후 10거래일 만이다. 북한이 이날 새벽 일본 상공 쪽으로 탄도미사일을 발사함에 따라 한반도를 둘러싼 지정학적 리스크가 다시 부각되면서 투자심리가 급속히 얼어붙은 것으로 풀이된다.  북한의 이번 미사일 도발은 지난 26일 동해상으로 단거리 탄도미사일을 쏜 지 불과 사흘 만이며 북한 탄도미사일이 일본 상공을 통과한 것은 이번이 처음이다.  서상영 키움증권 연구원은 ""새벽에 일본의 북동쪽을 통과한 북한의 미사일 발사 여파를 주목해야 할 것으로 판단한다""며 ""발사 직후 엔화가 달러대비 0.3% 강세로 전환하는 등 안전자산 선호심리가 강화됐다""고 분석했다. 외국인이 1788억원을 순매도하면서 지수 하락을 이끌고 있다. 지난 25일부터 3거래일째 \'팔자\' 기조다. 장 초반 매수 우위를 기록했던 기관도 순매도세로 돌아서 312억원을 팔아치웠다. 개인(1891억원)만 홀로 매수 우위를 지키고 있지만 지수 하락을 막기에는 역부족으로 보인다. 업종별로는 22개 업종이 일제히 하락세다. 은행(-2.98%)과 증권(--2.13%)의 하락세가 특히 크다. 전기전자(-1.93%), 금융업(--1.8%), 운수창고(-1.73%), 운수장비(-1.65%), 기계(-1.59%), 유통업(-1.58%), 통신업(-1.56%), 제조업(-1.54%), 섬유의복(-1.44%), 서비스업(-1.44%), 건설업(-1.38%), 화학(-1.34%), 보험(-1.33%), 전기가스업(-1.27%), 종이목재(-1.25%), 의료정밀(-1.06%) 등이 1%대의 하락세를 기록 중이다. 이밖에 의약품(-0.89%), 음식료업(-0.84%), 철강금속(-0.5%), 비금속광물(-0.17%) 등도 모두 하락세다. 코스피 시가총액 상위 20개 종목도 보합세인 KT&G를 제외하고 전부 하락세다. \'대장주\' 삼성전자는 전일보다 4만3000원(1.87%) 내린 226만2000원에 거래되고 있다.  SK하이닉스(-2.06%), 삼성전자우(-0.75%), 현대차(-1.04%), 포스코(-0.15%), 한국전력(-1.35%), LG화학(-1.76%), 네이버(-2.04%), 신한지주(-3.18%), 삼성물산(-0.39%), 현대모비스(-2.99%), 삼성생명(-1.27%), KB금융(-2.63%), SK텔레콤(-1.53%), SK(-0.93%), 삼성바이오로직스(-0.54%), 아모레퍼시픽(-1.02%), SK이노베이션(-1.91%), LG생활건강(-1.04%) 등도 내림세다. 코스닥도 나흘만에 하락세를 나타내고 있다. 전 거래일(652.92)보다 3.96포인트(0.61%) 내린 648.96을 기록 중이다. 한편 이날 뉴욕증시는 초강력 허리케인 \'하비\'의 영향으로 혼조세로 마감했다. 미국 뉴욕증권거래소(NYSE)에서 우량주 중심의 다우존스 30 산업평균지수는 전장보다 5.27포인트(0.02%) 낮은 2만1808.40으로 마감했다. 대형주 중심의 스탠더드앤드푸어스(S&P)500 지수는 전장보다 1.19포인트(0.05%) 높은 2444.24에 거래를 마쳤다. 기술주 중심의 나스닥 지수는 17.38포인트(0.28%) 오른 6283.02에 마감했다. ephites@newsis.com▶ 뉴시스 빅데이터 MSI 주가시세표 바로가기 ▶ 뉴시스 SNS [페이스북] [트위터]뉴시스 관련뉴스해당 언론사에서 선정하며 언론사 페이지(아웃링크)로 이동해 볼 수 있습니다.[빅데이터MSI]오전 10시 주식시장 심리 1→1단계 \'매우 나쁨\'[빅데이터MSI]오전 10시 시장심리 톱5···SK·KB금융·세아베스틸·기아차·두산[빅데이터MSI]29일 빅데이터 \'핫 키워드\'…시장·주가·서비스·기술·기업출렁이는 韓 증시 ···北 리스크 장기화 가능성에 \'촉각\'文정부 첫 나라살림 429조 \'슈퍼예산\'···올해보다 7.1% 늘어좋아요0훈훈해요0슬퍼요0화나요0후속기사 원해요0기사제공 :']"
