,회사명,날짜,언론사,기사제목,링크,본문
8,삼성전자, 2017-08-2916:59,뉴시스 ,'삼성 직업병' 대법 첫 인정···하급소송에도 영향 전망,https://finance.naver.com/news/news_read.nhn?article_id=0008147242&office_id=003&mode=search&query=삼성전자&page=3,"['       \'삼성 직업병\' 대법 첫 인정···하급소송에도 영향 전망      기사입력2017-08-29 16:59기사원문좋아요훈훈해요좋아요 평가하기공감좋아요0훈훈해요0슬퍼요0화나요0후속기사 원해요0댓글【서울=뉴시스】홍효식 기자 = 20일 오전 서울 여의도 국회 정론관에서 더불어민주당 강병원(가운데) 의원과 반도체노동자의 건강과 인권지킴이 반올림이 삼성전자 희귀질환 피해자 산재 인정 촉구 기자회견을 하고 있다. 2017.06.20. yesphoto@newsis.com대법원 ""희귀질환과 업무상 인과관계, 전향적 인정""최근 행정법원·고법 사건서도 산재 인정···승소 확정【서울=뉴시스】오제일 기자 = 법원이 삼성전자 노동자들이 앓고 있는 희귀질환과 업무상 인과관계를 인정하는 판결을 잇따라 내놓고 있다. 최근 항소심 재판부가 원고 승소 판결을 내린 데 이어 대법원도 처음으로 노동자 손을 들어주는 판결을 내렸다.  대법원은 특히 희귀질환과 업무상 인과관계를 보다 전향적으로 인정해야 한다고 결론내렸다. 진행 중인 소송 등에 미칠 영향이 적지 않을 것이라는 전망이 나온다.  29일 반도체 노동자의 건강과 인권지킴이 반올림 및 법원 등에 따르면 그간 명확한 발병 원인이 드러나지 않은 희귀질환의 경우 \'증거 불충분\' 등을 이유로 원고 패소 판결 등이 이어져 왔다.  이날 대법원으로부터 인과관계를 인정 받은 이모씨 역시 하급심에서는 ""발병 원인 물질에 일정 기간 노출됐을 수도 있다는 막연한 개연성만을 주장하고 있을 뿐""이라는 판단을 받은 바 있다.  하지만 최근 법원은 삼성전자 노동자들의 희귀질병과 근무 환경 사이의 인과 관계를 인정하는 판결을 잇따라 내리고 있다. 산재 인정 범위를 보다 폭 넓게 보는 모양새다.  앞서 서울행정법원은 지난 2월 삼성전자 기흥공장에서 엘시디(LCD) 생산직 노동자로 일하다 다발성경화증 진단을 받은 김모씨에 대해 요양급여를 지급해야 한다고 판단했다. 해당 사건은 삼성 LCD 공장 노동자가 희귀질환을 산업재해로 인정받은 첫 사례로 기록됐다. 지난달 열린 항소심도 같은 판단을 내렸고, 공단이 상고를 제기하지 않아 원고 승소 판결이 확정됐다. 지난 5월에는 서울고법이 같은 병을 앓고 있는 이모씨의 업무상 재해를 인정했다. 공단과 1심이 업무 연관성을 인정하기 어렵다며 받아들이지 않은 요양급여불승인 처분을 취소하라고 주문한 것이다. 이 사건도 상고가 이뤄지지 않아 확정됐다.  대법원 역시 이날 삼성전자 LCD공장 노동자 이모씨가 앓고 있는 다발성경화증이 업무상 재해에 해당한다고 판단했다. 공단 또는 하급심에서 병과 업무 환경 사이 인과 관계가 인정된 바는 있지만 대법원이 같은 판단을 내린 건 이번이 처음이다.   일련의 판결들은 희귀질환의 발병원인을 알 수 없다고 해서 인과관계를 부정할 수 없다고 판시한다. 업무와 재해 사이 인과관계는 이를 주장하는 측에서 증명해야 하지만, 그 기준을 너무 엄격하게 봐서는 안 된다는 것이다.  같은 맥락에서 대법원은 입사 전 건강에 별다른 이상이 없는 이씨가 근무 중 다발성경화증이 발병한 만큼 인과관계를 인정할 여지가 상당하다고 봤다. 상시적으로 유해화학물질에 노출되는 노동자에게 발병원인을 정확하게 알 수 없는 희귀질환이 발병한 경우 전향적으로 업무와 인과관계를 인정해야 한다는 취지다.  아울러 사업주의 협조거부 등을 이유로 작업 환경상 유해요소를 구체적으로 특정할 수 없을 경우 노동자에게 유리하게 고려해야 한다며 사업주에게 책임을 보다 무겁게 명시하기도 했다.   대법원 관계자는 ""작업장에서 발생할 수 있는 산업안전보건상의 위험을 사업주나 근로자 어느 일방에 전가하는 것이 아니라 산업과 사회 전체가 이를 분담하고자 하는 산업재해보험보상제도의 본래 목적과 기능에 따른 것임을 강조한 판결""이라고 말했다. 대법 판단은 진행 중인 소송 등에 상당한 영향을 미칠 예정이다. 반올림에 따르면 2007년 황유미씨 유족급여신청 사건을 시작으로 지난 5월 기준 근로복지공단에 83명이 산재 신청을 했다. 이 가운데 공단과 법원의 판결을 거쳐 산재인정이 확정된 사람은 모두 21명이다.  kafka@newsis.com▶ 뉴시스 빅데이터 MSI 주가시세표 바로가기 ▶ 뉴시스 SNS [페이스북] [트위터]뉴시스 관련뉴스해당 언론사에서 선정하며 언론사 페이지(아웃링크)로 이동해 볼 수 있습니다.초등학생 제자와 수차례 성관계 가진 30대 여교사\'환자 2명 약물 살인\' 간호사, 알고보니 적어도 90명 죽여文대통령 ""강력한 대북응징 능력 보여줘라""…F15K 폭탄투하훈련8500억원 복권 당첨 여성, 32년간 근무한 병원 사직이별통보 여친 때리고 성폭행에 동영상까지…좋아요0훈훈해요0슬퍼요0화나요0후속기사 원해요0기사제공 :']"
9,삼성전자, 2017-08-2916:56,한겨레 ,"북 미사일 발사, 금융시장 충격 크지 않았다",https://finance.naver.com/news/news_read.nhn?article_id=0002377734&office_id=028&mode=search&query=삼성전자&page=3,"['        북 미사일 발사, 금융시장 충격 크지 않았다       기사입력2017-08-29 16:56기사원문좋아요훈훈해요좋아요 평가하기공감좋아요0훈훈해요0슬퍼요0화나요0후속기사 원해요0댓글  [한겨레] 코스피 장 막판 하락폭 크게 줄어엔화·금 등 안전자산 가격은 강세 서울 여의도의 한 증권사 객장. 신소영 기자  북한의 새벽 미사일 발사로 금융시장이 개장 직후 출렁였지만 시간이 흐르면서 안정을 되찾았다.   29일 코스피는 외국인의 2600억원이 넘는 순매도로 오전 한때 2330선을 위협받았지만 장 막판 하락폭을 크게 줄이며 0.23%(5.56) 내린 2364.74로 장을 마쳤다. 삼성전자(-0.04%), 현대자동차(-0.35%) 등 시가총액 상위종목의 주가도 후반으로 갈수록 낙폭을 만회했다. 이날 외국인의 순매도 규모는 지정학적 위기감이 고조됐던 지난 11일(5862억원)과 견줘 많지 않았다.   서울 외환시장에서 오전 중 1128원을 넘어서기도 했던 원-달러 환율은 6.3원 오른 1126.4원으로 장을 마감했다. 국고채 장단기 금리는 한국은행이 31일 기준금리를 동결할 것이라는 전망에도 일제히 올랐다.   아시아 증시에서는 일본 닛케이지수(-0.45%)와 대만 자취안지수(-0.28%)의 하락폭이 크지 않았고 중국 상하이지수는 소폭 올랐다. 위험회피 심리로 안전자산 가격은 강세를 보였다. 엔화는 지난 4월 이후 가장 낮은 수준인 달러당 108.8엔까지 하락(엔화 가치 상승)하며 대표적 안전통화의 면모를 과시했다. 금 선물 가격도 전날 달러 약세에 힘입어 트로이온스당 1310달러를 돌파한 기세를 몰아 오름세를 이어갔다. 한광덕 선임기자 kdhan@hani.co.kr◎ Weconomy 홈페이지 바로가기: http://www.hani.co.kr/arti/economy◎ Weconomy 페이스북 바로가기: https://www.facebook.com/econohani  ▶ 한겨레 절친이 되어 주세요! [신문구독] [▶ 페이스북] [카카오톡][ⓒ한겨레신문 : 무단전재 및 재배포 금지] 한겨레 관련뉴스해당 언론사에서 선정하며 언론사 페이지(아웃링크)로 이동해 볼 수 있습니다.문 대통령 국방부 질타…11년 전 노무현 전 대통령과 \'데자뷔\'[단독] 원세훈 지시로 \'다음\'에 올린 글엔…""김대중 조국은 북한""\'영감\'이 말했다…""내겐 기혼남성 보좌진이 필요해""""SBS 윤세영 회장, 4대강 비판 보도한 기자 직접 불러 압력""이불킥과 광클 끝 이별…\'허세\' 기자의 싸이월드 탈퇴기좋아요0훈훈해요0슬퍼요0화나요0후속기사 원해요0기사제공 :']"
10,삼성전자, 2017-08-2916:51,머니투데이 ,"전자진흥회 ""美 세탁기 세이프가드 부당""…국제공조 나서",https://finance.naver.com/news/news_read.nhn?article_id=0003926581&office_id=008&mode=search&query=삼성전자&page=3,"['       전자진흥회 ""美 세탁기 세이프가드 부당""…국제공조 나서      기사입력2017-08-29 16:51기사원문좋아요훈훈해요좋아요 평가하기공감좋아요0훈훈해요0슬퍼요0화나요0후속기사 원해요0댓글 [머니투데이 김성은 기자] [삼성·LG전자 등과 함께 9월7일 美 공청회 참석…""산업 전반 피해 우려""]세탁기 자료사진으로 본 기사와는 무관합니다/사진=머니투데이DB한국전자정보통신산업진흥회(KEA·회장 권오현)가 미국의 세탁기 세이프가드(긴급수입제한) 조치 부당성에 대해 국제공조에 나선다. 오는 9월7일에는 삼성전자, LG전자 관계자들과 함께 미국에서 열리는 공청회에 참석할 예정인 것으로 알려졌다. KEA는 중국의 CCCME(기계전자 수출입상공회의소)와 함께 미국의 세탁기 세이프가드 조치가 부당하다는 서한을 작성해 미국 국제무역위원회(ITC)에 발송했다고 29일 밝혔다. 지난 5월31일, 미국 월풀사가 ITC에 세탁기 세이프가드 청원서를 접수한데 따른 움직임이다. KEA는 서신에서 이번 월풀 세탁기 세이프가드 청원서는 일방적인 무역구제 조치 남용으로 간주해 실질 조치가 불필요하다는 것을 주장했다. 미국 세탁기 시장은 지난해 960만대 규모로 올해에는 1000만대에 이를 것이란 전망이다. 미국 월풀이 35%의 시장점유를 보이고 있고 삼성전자와 LG전자가 각각 18.7%, 16.5%의 점유율을 기록중이다. KEA 관계자는 ""세이프가드 조사는 예상치 못한 수입제품의 급격한 증가와 미국 국내 산업 전반적으로 심각한 피해가 발생, 이러한 피해가 수입품으로 인한 명확한 인과관계가 성립해야만 가능하다""고 설명했다. 이어 ""월풀은 수입물량의 급격한 증가로 피해를 주장하지만 현재 미국 현지 산업은 주택경기 활황 등으로 세탁기 신제품 및 교체수요가 증가하는 추세""라며 ""또 산업 전반적으로 심각한 피해가 발생한다고 볼 수 없는 상태""라고 말했다. 또 ""이번 세이프가드 조사는 수입 세탁기에 대한 무역장벽으로 작용해 세탁기 가격을 높이고 소비자·유통업체에 피해를 줄 뿐만 아니라 결국 소비심리 감소로 이어질 것""이라며 ""이는 관련 산업 전반에 피해가 확산되고 미국 경제에도 부정적 요소로 작용할 것""이라고 덧붙였다. 한편 KEA는 미국 가전제품생산자협회(AHAM)과 소비자기술협회(CTA)를 방문해 이번 미국 세탁기 세이프가드 조치가 부당하다는 점을 전달할 예정이다. 또 다음달 7일 미국에서 개최되는 \'세탁기 세이프가드 산업피해판정 공청회\'에 참석, 입장도 전달할 계획이다. 아울러 향후 태국상공회의소(FTI), 베트남 전자협회(VEIA) 등과 함께 공동명의의 세이프가드 조치의 부당성에 대한 서한을 미국 측 관계기관에도 보낸다. TOM칼럼-깊이있는 투자정보▶무료 만화 즐기고~ 선물타자!▶ 빵빵한 차&레이싱걸▶ 김성은 기자 gttsw@mt.co.kr머니투데이 관련뉴스해당 언론사에서 선정하며 언론사 페이지(아웃링크)로 이동해 볼 수 있습니다.""못 살겠다"" 청운효자동 엑소더스…전세물량↑평택 국제대교 붕괴, 그 옆으론 수상스키 탄 시민박지원, 安 당대표 소식에 ""충격이 이만저만 아니다"" 해프닝대신증권, 한남동 외인아파트 개발 잭팟 터지나?""영수증 버려주세요""…개인정보도 같이 버린다좋아요0훈훈해요0슬퍼요0화나요0후속기사 원해요0기사제공 :']"
11,삼성전자, 2017-08-2916:46,KBS ,"코스피, 북한 미사일 발사 여파에 2,360대로 마감",https://finance.naver.com/news/news_read.nhn?article_id=0010499680&office_id=056&mode=search&query=삼성전자&page=3,"['       코스피, 북한 미사일 발사 여파에 2,360대로 마감      기사입력2017-08-29 16:46기사원문좋아요훈훈해요좋아요 평가하기공감좋아요0훈훈해요0슬퍼요0화나요0후속기사 원해요0댓글 코스피가 북한의 탄도미사일 발사 실험의 여파로 약세 흐름을 이틀째 이어가며 2,360대로 물러섰다. 오늘(29일) 코스피는 전 거래일보다 5.56포인트(0.23%) 내린 2,364.74로 마감했다. 유가증권시장에서 외국인은 2천633억원 매도 우위로 3거래일째 \'팔자\' 행진을 이어가며 지수 하락을 이끌었다. 개인과 기관이 각각 2천121억원, 252억원어치를 사들이며 방어에 나섰다. 업종별로는 철강·금속(0.81%), 비금속광물(0.47%)은 올랐고, 은행(-1.51%)과 전기가스업(-1.01%)의 약세가 두드러졌다. 시가총액 상위주 중에선 대장주인 삼성전자(-0.04%)가 사흘째 내림세를 이어가는 등 상당수가 하락했다. 코스닥지수는 전 거래일보다 1.04포인트(0.16%) 오른 653.96으로 나흘째 상승 흐름을 이어갔다. 서울 외환시장에서 원/달러 환율은 1달러에 6.3원 오른 1,126.4원을 기록했다.김병용기자 (kby@kbs.co.kr)▶ [저작권자ⓒ KBS 무단복제-재배포 금지]KBS 관련뉴스해당 언론사에서 선정하며 언론사 페이지(아웃링크)로 이동해 볼 수 있습니다.""좋아서 그랬다""…초등생 제자와 성관계 30대 여교사 구속""고생들 많으세요""…청와대 SNS에 댓글 남긴 배우6년 만에 KBS 복귀하는 박시후가 전한 말?설경구 ""설현은 백치미""…발언 하루 만에 사과[고현장] 벽 뚫고 침입해 26억 가량 훔친 간 큰 \'도둑들\'좋아요0훈훈해요0슬퍼요0화나요0후속기사 원해요0기사제공 :']"
12,삼성전자, 2017-08-2916:43,서울경제 ,[서울경제TV ‘해외선물 신세계’] AG시스템 “한 눈에 보는 경제”,https://finance.naver.com/news/news_read.nhn?article_id=0003101142&office_id=011&mode=search&query=삼성전자&page=3,"['       [서울경제TV ‘해외선물 신세계’] AG시스템 “한 눈에 보는 경제”      기사입력2017-08-29 16:43기사원문좋아요훈훈해요좋아요 평가하기공감좋아요0훈훈해요0슬퍼요0화나요0후속기사 원해요0댓글 [서울경제TV] [서울경제TV ‘해외선물 신세계’] AG시스템 “한 눈에 보는 경제”[국내시황]중국 증시 기지개. 0.93% 상승. 3362.65에 마감. 국내 철강·금속주도 상승세. 중국 증시와 관련된 파생상품도 관십 급증. 홍콩 ELS 부활 조짐. ETF 시장 급성장. 하루평균 거래대금 전체 상장사 주식 거래 대금의 10% 이상. 일본 도시바, 도시바 메모리 ‘신(新)미일연합’에 매각 위해 최종 협상 중. 중국 완다(萬達)그룹, 왕 회장 출국금지설로 주식·채권 값 급락.코스피, 차익실현 매물에 5거래일 만에 하락 마감. IT업종 위주 매도세. 2370.30에 마감. 외국인, 보름 새 코스닥서 3100억 이상 순매수. 반도체 장비 관련주 중심. 외국인, 이 부회장 판결 이후 삼성 핵심 계열사에서 자금 이탈 조짐. 삼성전자, 삼성물산 등 대거 조정.하반기 영업이익 상승하던 한국전력. 주가는 하락세. 정부의 에너지 정책과 정체된 사업구조 영향.이마트, IT 기술을 접목한 ‘미래형 마트’ 위해 삼성전자와 MOU 체결. 제2원양선사 SM상선, 공격적인 선대 확장 계획 발표. 국내 컨테이너 선사 선복량, 한진해운 붕괴 후 42% 감소.  [ 해외시황 ] 뉴욕증시 혼조세. 허리케인 하비의 피해 주시 영향. 다우지수 -0.02%하비로 인한 피해로 보험청구 증가 예상, 보험주들 하락달러 약세. 정유시설 피해와 경제지표 부진 영향.  달러 인덱스,  92.27(- 0.1%) 기록잭슨홀 미팅, 향후 긴축정책 및 금리 등 미발언. 연준 의장, 금융규제 당위성을 강조.국제유가 하락. ‘하비’로 멕시코만 지역 정유시설 폐쇄하며 공급과일 예상. 10월 분 WTI, 전일대비 배럴당 1.30달러(2.7%) 하락. 46.57달러 마감. 금값 온스당 1300달러 선을 돌파. 달러 2015년 이후 최저치 영향. 12월물 금값, 전일대비 온스당 17.40달러(1.3%) 오른 1315.30달러 마감.  ***긴급*** [북한 탄도미사일 홋카이도 상공 통과 오전 태평양 낙하.] 클리블랜드 연은 총재, 물가 상승률 저조 속 추가 금리인상 필요 시사 7월 상품수지 651억 달러. 전월비 1.78% 증가  미국 실업률,  4.3%.  4개월 연속 역대 평균구간 하회. 추가 증가 소지. 부재한도 증액, 시한임박으로 연방정부 셧다운 가능성. 트럼프 대통령 핵심 참모들 대통령 비판 분위기 확산  은행권, 대출 감소와 카드 연체율 증가로 경기 둔화 시사. 7월 유로존 M3 증가율, 4.5%. 6월보다 둔화독일중앙은행 이사,  ECB 자산매입 종료 주장.영국 정부, 일본과 무역협정 타결 상당 시간 필요 전망 EU,  영국에 진지한 브렉시트 협상 요구  독일, 영국의 불명확한 상태로 영국 내 투자 축소 가능성.  3차 브렉시트 협상, EU와 영국의 입장 차로 불투명. 브렉시트,  타 EU 가입국에 영향. EU 통합 저해 금일 위험종목 : CB소비자신뢰지수 발표시 금융전종목잭슨홀에서 연준의장, 드라기총재 통화정책안이 없었던  여파가 금일까지 이어지는 것으로 분석연준내 올해 금리인상주장이 아직 죽지 않은 것으로 볼때 12월 가능성은 아직 남아있는 상황이나 옐런발언으로 볼때 물가부분 확실히 보여줘야만 인상 진행할 것으로 분석.* 본 기사는 전문가의 개인적인 의견이 반영되어 있을 수 있으므로 투자에 유의하시기 바랍니다.[서울경제 바로가기]1997년 이래 대한민국 최고의 과학자 DB [바로가기]서울경제의 모든 연재물!... 서경Cube [바로가기▶]저작권자 ⓒ 서울경제, 무단 전재 및 재배포 금지서울경제 관련뉴스해당 언론사에서 선정하며 언론사 페이지(아웃링크)로 이동해 볼 수 있습니다.靑 ""우리 軍, 북한 이상동향 감지해 새벽 2시부터 움직여 ""靑 NSC 상임위 개최, 40분간 어떤 말 오갔나 \'北 탄도미사일 논의?\'상용차까지···너무 안 팔리는 \'현대차\' 정말 이러다가만취해 고속도로 역주행한 \'30대 여성\' 사건의 전말점령 가상훈련 참관한 \'北 김정은\' 무시무시한 협박좋아요0훈훈해요0슬퍼요0화나요0후속기사 원해요0기사제공 :']"
13,삼성전자, 2017-08-2916:39,뉴스1 ,"특검, 이재용 사건 항소 ""징역 5년 지나치게 가볍다""",https://finance.naver.com/news/news_read.nhn?article_id=0002915198&office_id=421&mode=search&query=삼성전자&page=3,"['       특검, 이재용 사건 항소 ""징역 5년 지나치게 가볍다""      기사입력2017-08-29 16:39기사원문좋아요훈훈해요좋아요 평가하기공감좋아요0훈훈해요0슬퍼요0화나요0후속기사 원해요0댓글이재용 삼성전자 부회장이 25일 서울 서초구 중앙지법에서 열린 뇌물공여 등 1심 선고공판을 마친 후 호송차로 이동하고 있다.  2017.8.25/뉴스1 © News1 성동훈 기자혐의 중 인정 안된 부분 ""사실오인 및 법리오해""이재용 측 이미 항소…2라운드 본격적으로 돌입(서울=뉴스1) 김일창 기자 = 박영수 특별검사팀이 29일 이재용 삼성전자 부회장 등 삼성 전·현직 임원 5명에 대한 1심 판결에 불복해 항소했다.특검팀은 이날 ""이 부회장 등 삼성그룹 관계자 5명의 1심 판결에 대해 사실오인과 법리오해, 양형부당을 사유로 전부 항소했다""고 밝혔다. 항소장은 이 부회장 등의 1심 공판을 맡은 서울중앙지법 형사합의27부(부장판사 김진동)에 냈다.특검팀은 1심 재판부가 인정하지 않은 최순실씨(61)의 딸 정유라씨(21)에 대한 이 부회장과 박근혜 전 대통령 사이의 뇌물 약속, 특정경제가중처벌법상 횡령과 재산국외도피 중 무죄 부분, 미르·K스포츠재단 지원 관련 뇌물공여(전부 무죄) 등이 \'사실오인 및 법리오해\'에 해당한다고 주장했다.아울러 이 부회장에게 선고된 징역 5년의 형이 지나치게 가볍다고 주장했다. 특검팀은 ""본건은 박 전 대통령과 최씨 등에 의한 국정농단 범행 중 핵심적인 범죄""라며 ""범행 과정에서 이 부회장 등의 역할과 횡령 피해금이 변제되지 않은 점, 범행을 부인하고 반성하지 않은 점 등에 비춰 5명 모두 지나치게 가벼운 형이 선고됐다""고 설명했다.항소이유서는 추후 제출할 예정이지만 특검팀은 항소심에서 피고인들의 혐의 중 인정되지 않은 이같은 부분을 집중적으로 입증할 방침으로 보인다.이 부회장의 변호인단은 전날 재판부에 항소장을 제출했다. 25일 1심 판결 직후 변호인단의 송우철 변호사는 ""선고 결과를 법률가로서 도저히 수긍할 수 없다""며 즉각 항소하겠단 뜻을 밝혔었다.변호인단은 항소심에서 무죄를 주장하면서 상황에 따라 양형 부당도 주장할 것으로 예상된다.ickim@news1.kr▶ 여러분의 제보를 기다립니다. 제보하기(클릭!)[© 뉴스1코리아(news1.kr), 무단 전재 및 재배포 금지]뉴스1 관련뉴스해당 언론사에서 선정하며 언론사 페이지(아웃링크)로 이동해 볼 수 있습니다.""이창준 수석과 다릅니다""…靑, 조국 민정수석실 공개초등생 제자와 교실서 부적절한 관계…여교사 구속시골도로에서 아이에게 운전시킨 아버지상가 女화장실서 \'찰칵찰칵\'…잡고보니 공무원""전화 왜 안받아""…여친 집에 돌 던진 40대좋아요0훈훈해요0슬퍼요0화나요0후속기사 원해요0기사제공 :']"
