,회사명,날짜,언론사,기사제목,링크,본문
0,삼성전자, 2017-08-0521:17,헤럴드경제 ,"첫주부터 흔들리는 8월 주식시장, 외국인의 향방은?",https://finance.naver.com/news/news_read.nhn?article_id=0001273787&office_id=016&mode=search&query=삼성전자&page=1,"['       첫주부터 흔들리는 8월 주식시장, 외국인의 향방은?      기사입력2017-08-05 21:17기사원문좋아요훈훈해요좋아요 평가하기공감좋아요0훈훈해요0슬퍼요0화나요0후속기사 원해요0댓글-외국인 매도, 당분간 추가 상승보다는 단기조정 가능성-IT업종 집중 매도후 철강·화학 등 매수[헤럴드경제=김나래 기자] 8월 첫 주 증시가 마감됐다. 외국인의 강한 매도가 있었던 만큼 일단은 상승 가능성보다는 조정 가능성에 무게중심이 옮겨졌다. 달러가 약세를 보이면서 수출주의 추가 상승을 제한할 것으로 예상하고 있다. 4일 한국증권거래소에 따르면 코스피와 코스닥지수가 각각 오름세와 내림세로 장을 마쳤다. 이날 코스피는 전 거래일보다 8.60포인트 오른 2395.45에 마감했으며, 코스닥은 1.51포인트 내린 641.58로 장을 마무리했다.외국인 투자자들의 주식 순매도가 2주째 이어지고 있다. 외국인들이 유가증권시장에서 이번주 순매도한 규모가 7000억원을 웃돈다. 지난주까지 합하면 2조3500억원 이상이다. 새 정부가 출범한 뒤 증시가 꾸준히 활황세를 보인 만큼, 일부 이익을 실현하려는 것으로 볼 수도 있다.\xa0그렇지만 최근의 외국인 매도세가 과도하다는 얘기도 나온다. 특히, 코스피시장에서 외국인이 지난 3일 장중 한때 2% 넘는 하락세를 보이자 세법개정안이 외국인의 매도세에 영향을 줬다는 분석이 나오면서 시장이 크게 요동쳤다. 하지만 세법개정안의 파급효과에 대한 오해에서 비롯된 급락과 과매도라는 진단이다. 외국인의 집중 매도에도 불구하고 같은 기간 사들인 업종과 종목은 있다. 업종별로는 철강 금속 금융 등이고 종목별로는 포스코 호텔신라 한국전력 현대중공업 등이다. 반면 외국인은 삼성전자를 불과 2주 새 1조원 이상 팔아 치웠다. SK하이닉스 LG디스플레이 네이버 LG전자 등 정보기술(IT)주가 일제히 외국인 순매도 10위권에 포함됐다. 류용석 KB증권 시장전략팀장은 “기관과 외국인의 매매패턴을 분석해 보면 그동안 크게 상승했던 IT업종 대표주와 화학·철강 업종 대표주 사이의 수익률 스프레드 차이가 역사적으로 굉장히 벌어졌다”며 “주요 주체들은 더 많이 상승할 여력이 있는 업종으로 갈아타고 있다”고 분석했다. 시장에서 당분간 조정 가능성이 높아진 만큼 3분기 실적에 대한 체크도 필수다. 2분기 실적에 대한 기대감이 점차 약화되고 있고 실적 전망치도 하향 조정되고 있다. 이에 3분기에도 실적이 가시화될 수 있는 업종에 대한 옥석가리기가 필요하다는 분석이다. 이경민 대신증권 마켓전략실 팀장은 “외국인과 기관이 매수가 겹치는 종목이 앞으로 좋아진다는 보장이 없기 때문에 3분기 실적까지도 체크해야 한다”며 “금융업종은 3분기에도 긍정적인 실적이 예상되고 있지만 유가 최근 반등하고 있지만 여전히 불확실성이 있는 만큼 화학업종에 대해서는 단기적인 관점으로 보는 것이 맞다“고 밝혔다.ticktock@heraldcorp.com▶영감이란 불꽃에 타오르게할 스토리(INSPIRE)▶앞서가는 젊은 경제신문 친구맺기 ▶오늘의 운세 날씨 - Copyrights ⓒ 헤럴드경제 & heraldbiz.com, 무단 전재 및 재배포 금지 -헤럴드경제 관련뉴스해당 언론사에서 선정하며 언론사 페이지(아웃링크)로 이동해 볼 수 있습니다.태풍 노루, 일본 강타…제주도·남해안도 영향권김광수 국민의당 의원 ""가정폭력 혐의로 조사 받은 적 없다""박지성 ""퍼거슨에게 욕했다""…왜?기성용, 월드컵예선 이란·우즈벡전 못 뛴다文대통령 휴가중 읽은 책은?…""명견만리 권한다""좋아요0훈훈해요0슬퍼요0화나요0후속기사 원해요0기사제공 :']"
1,삼성전자, 2017-08-0516:00,뉴스1 ,특검 공소장 변경 왜?…朴-이재용 3차면담 '미스터리',https://finance.naver.com/news/news_read.nhn?article_id=0002876643&office_id=421&mode=search&query=삼성전자&page=1,"['       특검 공소장 변경 왜?…朴-이재용 3차면담 \'미스터리\'      기사입력2017-08-05 16:00기사원문좋아요훈훈해요좋아요 평가하기공감좋아요0훈훈해요0슬퍼요0화나요0후속기사 원해요0댓글이재용 삼성전자 부회장이 4일 오후 서울 서초구 서울중앙지방법원에서 열린 \'최순실 뇌물\' 관련 52차 공판에 출석하고 있다. 2017.8.4/뉴스1 © News1 허경 기자이재용 공소장서 특검 \'오류\'…3차 독대 시기 결국 수정(서울=뉴스1) 장은지 기자 = 2016년 2월15일 서울 삼청동 청와대 안가에서 있었던 박근혜 전 대통령과 이재용 삼성전자 부회장의 이른바 \'3차 독대\' 마지막 퍼즐이 풀렸다. 지난 4일 열린 사실상 마지막이었던 52차 공판에서다. 박영수 특별검사팀은 7일(월요일) 결심공판을 남겨둔 이날 오후 2시 재판부에 이부분 공소장 일부 변경을 구한다고 밝혔다. 재판부는 공소장 내용의 오류를 인정, 변경을 허가했다.이날 특검이 바로잡은 오류 중 가장 큰 것은 \'3차 독대\'의 시간이다. 특검은 공소장에는 물론 지난 50차례 넘는 공판에서 3차 독대의 시간을 \'오후\'라고 주장해왔다. 이날 현대차그룹과 LG그룹 등 다른 대기업 총수들도 대통령과 단독면담을 가졌다. 이에 대해 삼성 측은 이 부회장의 기억을 근거로 당시 독대는 오전 10시30분에 이뤄졌다고 주장해 독대 시점을 두고 특검과 삼성 양측의 주장이 엇갈렸다.삼성 변호인단이 \'오류\'라고 꾸준히 지적해 왔던 부분이 결국 수정된 셈이다. 이날 서울중앙지방법원 형사합의 27부(부장판사 김진동) 심리로 열린 공판에서 재판부는 특검 측이 제출한 공소장 변경 신청서를 받아들였다. 이날 특검 측은 ""(박 전 대통령과 이 부회장의 3차 독대 시간과 관련) \'2016년 2월15일 오후\'로 기재된 부분에서 \'오후\'를 삭제하려는 취지""라고 밝혔다. 이어 ""또한 공소장의 \'대통령이 최순실로부터 건네받은 동계스포츠영재센터 사업 계획안을 직접 (이 부회장에게)전달하였고\'라는 부분에서도 \'직접\'을 삭제한다""고 밝혔다. 공소장에서 삼성 측이 코어스포츠 측에 지급하기로 약속했던 금액도 213억원에서 실제 지급됐던 돈(77억9735만원)을 제외한 135억265만원으로 수정됐다.특검 측은 Δ승마지원 Δ미르·K스포츠재단 출연금 Δ한국동계스포츠영재센터(이하 영재센터) 후원금 등 크게 세 가지를 삼성이 박 전 대통령에게 건넨 뇌물로 보고 있다. 박 전 대통령과 이 부회장이 3차 독대한 자리에서 영재센터 사업계획안을 직접 건넸다고 보고 이를 뇌물수수 합의과정이라 주장했다.이 부회장이 대통령으로부터 계획안이 든 서류봉투를 직접 받았는지 여부는 이 부회장이 영재센터 설립에 관여한 정도를 판단하는데 중요 쟁점이다.실제 만남은 오전에 이뤄졌음에도 불구하고 공소장에는 오후로 기재됐다는 부분은 이 부회장에 대한 구속영장실질심사 때부터 논란이 돼 왔던 사안이다. 이번 재판 과정에서 변호인단은 이 부회장의 삼성 서초사옥 출차기록과 삼성이 두 차례 청와대에 정보공개를 청구해 받은 청와대 안가 출입기록을 재판부에 제출, 독대 시간을 오후가 아닌 오전 10시30분으로 바로잡는데 성공했다.또한 특검 측은 공소장에서 대통령이 최순실로부터 건네받은 영재센터 사업계획서를 이 부회장에게 직접 전달하며 \'후원해 달라고 말했다\'고 기재한 부분을 \'말했다\'에서 \'요구했다\'로 변경했다.변호인단은  기초사실인 \'시간\'조차 특검이 틀렸다는 사실을 토대로 이 부회장이 서류봉투를 직접 받지 않았고 따라서 이는 곧 뇌물수수 합의 과정도 없었음을 뒷받침한다고 주장했다. 7일 오후 서울 강남구 도곡동의 최순득씨 자택 앞에서 국회 경위가 동행명령장을 들고 최씨를 기다리고 있다. 이들은 최순득씨가 집에 없어 동행명령장을 전달하는 데 난항을 겪고 있다.  2016.12.7/뉴스1 © News1 박지혜 기자◇朴이 이재용에 줬다는 영재센터 서류…10분만에 강남→삼청동 도착?시간 오류는 이 부회장이 대통령으로부터 영재센터 서류를 받았다는 특검의 공소사실을 약화시키는 역할을 했다.변호인단이 확보한 출차 기록에 따르면, 이 부회장의 차량이 대통령 안가에서 나온 시간은 독대 당일 오전 11시8분이다.또 그동안 서증조사에서 나온 진술과 통화기록 등을 종합하면, 3차 독대 당일 오전 9시55분 최순실의 조카인 장시호가 서울 도곡동 자택에서 영재센터 사업계획서를 출력한다. 이후 퀵서비스를 통해 이 서류는 최순실 측에 보낸다. 계획안이 처음 출력됐고 이후 퀵서비스를 통해 계획안은 서울 강남구 신사동에 있는 최씨 측에 전달됐다. 특검은 그동안 재판에서 장시호가 퀵서비스로 보낸 서류를 최순실의 운전기사 방모씨가 신사동 미승빌딩 근처에서 이영선 청와대 행정관에게 전달했다고 했다. 그 시간은 오전 10시59분. 이는 특검이 제시한 통화기록으로도 확인되는 사실이다. 이후 서류는 정호성 전 대통령부속비서관에게 전달, 다시 박 전 대통령에게 건네졌을 것으로 보인다. 그 시각은 이미 이 부회장이 오전 10시30분 삼청동 안가에서 면담을 시작했을 때다. 이 부회장은 당시 독대가 30~40분간 진행됐다고 진술했다. 이 부회장의 차가 안가를 빠져나온 시간은 오전 11시8분. 오전 10시59분에 서울 강남구 신사동에 있었던 서류가 10여분만에 청와대 근처까지 도착한다는 것은 물리적으로 불가능하다. 이 때문에 삼성 측은 이 부회장이 대통령으로부터 서류봉투를 받은적이 없으며, 영재센터 후원에 관여할 가능성이 애초부터 없었다고 주장하고 있다.당초 특검팀은 이 부회장과 박 전 대통령이 오후 2시쯤 독대한 것으로 추정했다. 특검팀은 ""누구도 독대시각을 기억하지 못해 우리도 궁금하다""며 ""안종범 전 청와대 정책조정수석에게 물으니 \'오후 3시에 정몽구 현대차 회장을 독대했으니 오후 2시일 가능성이 크다\'고 말했다""고 밝혔다.시간오류를 인정한 특검은 서류봉투를 이 부회장이 대통령으로부터 전달받았다는 주장은 굽히지 않았다. 다만 \'직접\'전달했다는 부분에서 \'직접\'이라는 단어를 들어냈다. 시간을 따져보면 봉투 전달이 물리적으로 불가능하지만 삼성 측 주장을 받아들이지는 않았다. 특검 측은 ""오전 11시8분에 안가를 빠져 나왔다는 삼성 주장을 받아들이기 어렵고 출차기록 또한 신빙성이 부족하다""며 ""다만 공소장에서 \'직접\'이라는 단어를 빼 전달됐다는 사실만 남겨뒀다""고 설명했다.이에 재판부는 ""공소장 변경취지를 사업계획서가 든 봉투를 대통령이 안가에서 이재용에 직접 전달했거나 혹은 독대 후 안종범 전 수석이 이재용에 전달했을 가능성을 포함하는 의미라고 보면 되겠냐""라고 공방을 정리했다.한편 이 부회장은 전날 피고인신문에서 3차 독대 당시 박 전 대통령이 굉장히 짜증을 내 무언가를 말하거나 부탁하는 분위기가 전혀 아니었다고 진술했다. 독대에서 부정한 청탁을 했다는 박영수 특별검사팀의 주장이 애초부터 성립할 수 없음을 강조했다.이 부회장은 대통령이 JTBC의 배후에 삼성이 있다는 의심을 하는 것 같아 매우 당황했고, 괜한 정치적 오해를 받을까 위기감을 느꼈다고 했다. 박 전 대통령이 \'이적단체\' 와 같은 격한 표현을 써가며 JTBC와 홍석현 중앙일보 회장에 대해 비판해 뭐라 대꾸할 말도 없었다는 취지로 진술했다. 물리적으로도 3차 독대가 무언가를 부탁하는 자리가 될 수 없었다는 점도 분명히 했다. 삼성 측은 당시 대화의 30분 가운데 10분은 JTBC에 대한 박 전 대통령의 질책이었는데 그렇다면 남은 20분 동안 특검이 주장하는 나머지 12개 현안에 대한 청탁이 물리적으로 오고갈 수 있느냐고 의심했다. 안종범 수첩에 적혀있다는 사실만으로 이 부회장에게 박 전 대통령이 수첩 내용을 모두 이야기했다는 특검 측 주장은 \'추측\'에 불과하다는 것이다. 20분 동안 10개 넘는 주제에 대해 대통령과 이 부회장 양측이 얘기를 주고받았다는 것은 사실상 불가능하다는 반박이다.seeit@▶ 놓치면 후회! 최신 만화 보기 / 2017년 나의 운세 보기▶ 생생한 Real-Time 영상뉴스, 눈TV(바로가기!)▶ 여러분의 제보를 기다립니다. 제보하기(클릭!)[© 뉴스1코리아(news1.kr), 무단 전재 및 재배포 금지]뉴스1 관련뉴스해당 언론사에서 선정하며 언론사 페이지(아웃링크)로 이동해 볼 수 있습니다.故 최진실 측근이 밝힌 #최준희·외조모 갈등 #이모할머니故최진실 딸 최준희 2차심경 ""흉터가 증거…홍진경 이모도 안다""금 50돈 슬쩍…금은방 주인 피해 건물에 숨었지만현역 A 국회의원 가정폭력 혐의로 경찰 조사최진실 딸, 외할머니와 크게 다퉈 경찰 출동좋아요0훈훈해요0슬퍼요0화나요0후속기사 원해요0기사제공 :']"
2,삼성전자, 2017-08-0515:17,머니투데이 ,"외인·기관의 IT매도, 조정맞은 코스피 2400 내줘",https://finance.naver.com/news/news_read.nhn?article_id=0003915264&office_id=008&mode=search&query=삼성전자&page=1,"['       외인·기관의 IT매도, 조정맞은 코스피 2400 내줘      기사입력2017-08-05 15:17기사원문좋아요훈훈해요좋아요 평가하기공감좋아요0훈훈해요0슬퍼요0화나요0후속기사 원해요0댓글 [머니투데이 김훈남 기자] 8월 첫째주(7월31일~8월4일) 코스피 지수는 기관과 외인의 IT(정보통신) 대형주 매도세에 몰리며 2400선을 내줬다. 코스피 지수가 2400 밑으로 내려온 것은 7월13일 이후 3주만으로 8개월 연속 상승세를 보이던 지수가 조정장세로 들어섰다.5일 한국거래소에 따르면 지난 4일 코스피 지수는 전주 대비 5.54포인트(0.23%) 하락한 2395.45로 마감했다. 정부의 세법개정안이 발표된 다음날인 3일에는 하루만에 40.78포인트가 빠지며 가장 큰 낙폭을 보였다.외국인이 7198억원어치를 내다팔며 조정장세를 연출했다. 개인도 1654억원어치 순매도로 차익실현에 나섰다. 기관은 7206억원어치를 순매수하며 외인과 개인이 내놓은 매물을 흡수했다.외국인은 롯데케미칼과 삼성SDI를 각각 538억원, 402억원어치를 사들였다. 순매수 상위목록에 엔씨소프트와 우리은행, 고려아연 등이 이름을 올렸다. 가장 많이 판 종목은 1820억원어치가 시장에 나온 삼성전자다.기관은 LG화학을 가장 많이 사들였다. 857억원어치를 사들이며 순매수 상위에 이름을 올렸다. 외인과 마찬가지로 엔씨소프트에 67억원치 매수세가 몰려 가장 많이 산 종목 중 하나로 꼽혔다. 2분기 부진한 실적을 발표했던 LG전자와 현대차, 현대모비스 역시 상위 매수 종목이다.기관은 SK하이닉스를 가장 많이 판 것으로 집계됐다. 그 뒤를 삼성전자가 자리해  IT 대형주 팔자세를 이끌었다.이번주 코스피 시장에서 가장 많이 오른 종목은 서울식품우선주로 169.97%가 올랐다. 그 뒤를 노루페인트우선주, 남선알미우선주 등이 자리했다. 상승률 상위종목 1~4위가 모두 우선주로 나타나 눈길을 끌었다.가장 큰 낙폭을 보인 종목은 녹십자홀딩스1우선주다. 53.89%가 하락했다. 분식회계 의혹에 휩싸인 한국항공우주도 23.33% 하락했다.[▶깊이있는 투자정보 \'TOM칼럼\'][▶트렌드 리더의 스타일 지침서 \'스타일M\'][▶빵빵한 차&레이싱걸]김훈남 기자 hoo13@mt.co.kr머니투데이 관련뉴스해당 언론사에서 선정하며 언론사 페이지(아웃링크)로 이동해 볼 수 있습니다.송일준 MBC PD협회장 ""신동호·배현진, \'배신 남매\'라 불려""\'용가리 과자\' 먹고 위에 구멍 난 12세 아이… ""액화질소 치명적""임세령♡이정재, 커플룩 입고 영화 데이트\'8·2 직격탄\'에 서울은 \'적막\'… 세종은 \'화들짝\'맨홀 작업 근로자1명 사망·1명 중태…""저산소증 추정""좋아요0훈훈해요0슬퍼요0화나요0후속기사 원해요0기사제공 :']"
