,회사명,날짜,언론사,기사제목,링크,본문
9,삼성전자, 2017-11-0111:29,매일경제 ,찬바람 불면 배당주 투자…배당주펀드 들어볼까,https://finance.naver.com/news/news_read.nhn?article_id=0004040261&office_id=009&mode=search&query=삼성전자&page=10,"['       찬바람 불면 배당주 투자…배당주펀드 들어볼까      기사입력2017-11-01 11:29기사원문좋아요훈훈해요좋아요 평가하기공감좋아요0훈훈해요0슬퍼요0화나요0후속기사 원해요0댓글HDC운용 `현대히어로-알짜배당펀드` 1년 수익률 30% 육박자료 제공 = KG제로인 증권가에는 찬바람이 불어오면 배당주에 투자하라는 투자격언이 있다. 연말이 다가올수록 배당투자에 대한 관심을 가져야한다는 조언이다. 만일 개별 주식 투자가 어렵다면 높은 배당을 기대할 수 있는 종목에 투자하는 배당주 펀드에 가입하면 된다.1일 펀드평가사 KG제로인에 따르면 상장지수펀드(ETF)를 제외한 국내 배당주식형펀드에서 10월 한달 간 1024억원의 자금이 빠져나갔음. 지난 6월 이후 꾸준히 순유입세를 보여왔지만 다섯달 만에 순유출로 돌아선 것. 당초 연말이 다가올수록 배당주펀드에 자금이 유입되기 마련인데 지수가 연일 고공행진하면서 투자자들이 펀드보다는 개별 주식에 집중하는 것으로 풀이된다. 또 지수가 크게 상승한 탓에 목표전환형펀드 등을 중심으로 환매 물량이 나오고 있다는 분석이다.다만 배당주펀드에 대한 관심은 꾸준히 높아질 전망이다. 전날 대장주인 삼성전자가 올해 배당을 대폭 확대하기로 하면서 이를 필두로 주요 상장사들의 주주환원 정책 강화가 예상되기 때문이다. 아울러 대부분의 배당주펀드는 삼성전자 편입비중이 높기도 하다.개별 배당주펀드 중에서는 HDC자산운용의 HDC현대히어로-알짜배당[주식]이 1년 수익률 28.14%로 가장 우수했다. 2005년 6월에 설정된 이 펀드는 순자산이 25억원에 불과하지만 연초 이후 24.51%의 수익률을 올리는 등 괄목할만한 성과를 거두고 있다.아울러 마이다스블루칩배당 1(주식), KB액티브배당자(주식) 흥국배당성장자(주식), NH-Amundi퇴진연금고배당주자 1[주식], NH-Amundi대한민국고배당주연금전환자[주식] 등도 1년 수익률 26~27% 가량을 거두면서 양호했다. 이외 대표 배당펀드로 꼽히는 신영밸류고배당(주식)은 1년 수익률 21.05%, 연초 이후 17.75%의 수익을 올리고 있다. 이 펀드의 운용규모는 2조8600억원에 달한다. HDC자산운용 관계자는 ""현대히어로-알짜배당 펀드에는 당사의 \'좋은지배구조펀드\'에 편입된 종목에 고배당이 예상되는 블루칩 종목을 추가한 것""이라면서 ""삼성전자 비중은 20% 안팎을 기록하고 있으며 현대차, POSCO 등 고배당 종목에 집중하고 있다""고 말했다.[디지털뉴스국 김경택 기자]▶뉴스 이상의 무궁무진한 프리미엄 읽을거리 ▶아나운서가 직접 읽어주는 오늘의 주요 뉴스[ⓒ 매일경제 & mk.co.kr, 무단전재 및 재배포 금지]매일경제 관련뉴스해당 언론사에서 선정하며 언론사 페이지(아웃링크)로 이동해 볼 수 있습니다.\'美친 볼륨\' 살린 송혜교, \'송송커플 결혼식\' 현장 가니[MK인터뷰] 한용덕 한화 감독 ""두 마리 토끼 잡겠다""김주혁 사인은 두부손상…조직검사 결과는 1주 후테슬라, 모델 3 생산 차질 주주 집단 소송 위기서정희, 발레리나로 변신…""56세 맞아?"" 보디라인 甲좋아요0훈훈해요0슬퍼요0화나요0후속기사 원해요0기사제공 :']"
10,삼성전자, 2017-11-0111:28,아시아경제 ,반도체 수출호황 그 이면…지표·체감경기 '괴리',https://finance.naver.com/news/news_read.nhn?article_id=0004108443&office_id=277&mode=search&query=삼성전자&page=10,"['       반도체 수출호황 그 이면…지표·체감경기 \'괴리\'      기사입력2017-11-01 11:28기사원문좋아요훈훈해요좋아요 평가하기공감좋아요0훈훈해요0슬퍼요0화나요0후속기사 원해요0댓글10월 수출 12개월 연속 증가세 …반도체 수출 역대 2위 기록삼성전자 ·SK하이닉스 好실적 …주가 \'고공행진\'고용, 반도체 호황 못따라가 …코스피 최고치에 \'개미\' 수익률은 마이너스 아시아경제DB[아시아경제 조은임 기자]수출 증가세가 12개월째 지속되고 있다. 삼성전자, SK하이닉스 등이 이끄는 \'반도체발(發) 수출 호황\'이다. 이들 기업은 3분기 사상 최고치의 실적을 내면서 주가 역시 고공행진을 거듭하고 있다. 지표만 보면 눈부신 경기호황이 어이지고 있는 모습이다. 하지만 곳곳에선 \'경기호전을 체감할 수 없다\'는 목소리가 나온다. 반도체가 이끄는 수출호황이 고용으로 이어지지 않아서다. 역대 가장 높은 코스피 지수에도 개인투자자들의 수익률과는 동떨어져있다. 숫자로만 확인할 수 있는 성장에 더이상 \'낙수효과\'가 없다는 지적도 나오고 있다. 1일 산업통상자원부에 따르면 지난 10월 수출은 449억8000만 달러로 잠정 집계됐다. 전년 동기보다 7.1% 증가한 수치로 12개월 연속 오름세다. 한 자릿수로 줄었지만, 열흘 간의 추석 연휴로 인한 조업일수 감소를 감안하면 선방했다는 평가다. 수출호조를 이끈 품목은 단연 반도체였다. 반도체 수출은 69.6% 증가하며 역대 2위인 94억8000만 달러를 기록했다.백운규 산업부 장관은 ""10월 큰 폭의 조업일수 감소에도 불구하고, 양호한 수출 증가세를 이어나고 있다""며 ""큰 변수가 없는 한 올해 12월 중순 이후 무역 1조 달러가 달성돼 2014년 이후 3년 만에 무역 1조 달러 회복이 가능할 것""이라고 전망했다. 삼성전자는 지난 3분기에 반도체 사업에서만 9조9600억원의 영업이익을 올렸다. 영업이익률은 무려 50%로 역대 최고치다. SK하이닉스 역시 올 3분기 역대 가장 높은 3조7372억원의 영업이익을 냈다.\'최고치 경신\'이 이어지는 반도체 호황에도 여전히 체감경기는 싸늘하다. 한국은행에 따르면 올 3분기 민간소비는 0.7% 증가하는 데 그쳤다. 전분기 대비 0.3%포인트 떨어진 수치다. 3분기 성장률이 무려 1.4%에 이르지만 성장의 단물이 아래로는 퍼지지 못하고 있는 것이다. 민간소비는 가계소득, 고용 등에 크게 영향을 받는다. 고용부진이 핵심이다. 한은은 최근 보고서 발표하며 올해 상반기 반도체 제조업의 전년 동기대비 취업자수 증가는 약 4000명으로 같은 기간 전체 취업자수 증가(36만명)의 1% 수준에 그친다고 밝혔다. 반도체가 대규모 장치 산업인 만큼 투자 증가에 따른 일자리 창출 효과가 미미하다는 것이다. \'코스피 2500\'시대 개인투자자 수익률이 마이너스라는 점도 체감 경기를 어둡게 하는 요인이다. 한국거래소와 코스콤에 따르면 추석 연휴 이후 지난달 10∼31일 유가증권시장(코스피)에서 개인투자자의 순매수 상위 10개 종목(기간 중 분할ㆍ합병 상장 종목 제외)을 분석한 결과 평균 수익률이 -0.58%로 집계됐다. 같은 기간 코스피지수는 5.38% 상승했다. 지수 상승의 단물은 기관과 외국인의 몫이었다. 황세운 자본시장연구원 연구실장은 ""지금 상황에서는 성장지속가능성 측면에서 우려가 커질 수밖에 없다. 반도체 산업은 고용을 창출하는데 한계가 있고 IT산업의 특성상 고용량이 많다고 보기도 어렵다""며 ""대규모 수익을 벌어들이는 건 분명하지만 서민들의 생활수준 향상과는 괴리감이 생길 수밖에 없다""고 말했다. 이어 ""새로운 벤처기업들을 키워내고 지원하는 것이 근본적인 해결책""이라고 덧붙였다.조은임 기자 goodnim@asiae.co.kr▶ 양낙규의 \'군사이야기\'▶ 2017아시아여성리더스포럼 ▶ #아시아경제 페이스북아시아경제 관련뉴스해당 언론사에서 선정하며 언론사 페이지(아웃링크)로 이동해 볼 수 있습니다.北김정은, 이 와중에 김한솔 암살을…\'딱 걸렸다\'[속보]""美, 北 공격때 한국과 상의 안 할수도""…\'이럴수가\'\'터질게 터졌다\' 北핵실험장 붕괴에…대충격성관계를… 피해 남성만 4000여명 \'발칵\'이영학 아내 유서 ""성폭행, 시아버지뿐 아니라…""좋아요0훈훈해요0슬퍼요0화나요0후속기사 원해요0기사제공 :']"
11,삼성전자, 2017-11-0111:27,데일리안 ,"삼성전자, 공기청정기 신제품 2018년형 블루스카이 출시",https://finance.naver.com/news/news_read.nhn?article_id=0002219447&office_id=119&mode=search&query=삼성전자&page=10,"['       삼성전자, 공기청정기 신제품 2018년형 블루스카이 출시      기사입력2017-11-01 11:27기사원문좋아요훈훈해요좋아요 평가하기공감좋아요0훈훈해요0슬퍼요0화나요0후속기사 원해요0댓글삼성전자 공기청정기 신제품 2018년형 \'블루스카이 5000\'.ⓒ삼성전자레이저 광원으로 미세한 먼지 입자까지 감지해 공기 상태 정밀측정4단계 색상 청정 라이팅으로 실내 공기 상태 직관적 확인삼성전자가 전문 계측장비 수준의 ‘레이저 PM 1.0센서’를 적용해 지름 0.3㎛(마이크로미터) 미세먼지까지 정밀 측정 해주는 공기청정기 신제품 2018년형 ‘블루스카이’를 출시한다고 1일 밝혔다.마이크로미터는 미터법 단위로 1미터의 백만분의 1 크기로 먼지의 지름 크기에 따라 PM1.0(1㎛이하)·PM2.5(2.5㎛이하)·PM10(10㎛이하)으로 표현한다.2018년형 블루스카이 공기청정기는 레이저 광원을 이용해 지름 0.3㎛ 크기의 미세한 입자까지 실시간으로 감지해 실내 공기 상태를 보다 정밀하게 측정한다. 또 강력한 \'파워팬(Power Fan)\'으로 오염된 공기를 제품 전면으로 흡입해 양쪽 측면과 위로 정화된 공기를 내보내는 \'3방향 입체 청정\'으로 실내 공기를 쾌적하게 만들어준다.특히, 블루스카이 7000은 더 강력한 공기 흐름을 만드는 ‘듀얼 파워 팬’을 탑재해 거실부터 주방까지 최대 90㎡의 넓은 실내 공간을 보다 빠르게 청정할 수 있다.블루스카이 제품 상단부에는 미세먼지와 유해가스 수준 등을 수치와 아이콘으로 알려 주는 \'에어내비게이터\' 뿐만 아니라 4단계 색상으로 표현해 실내 공기 상태를 알려 주는 ‘청정 라이팅’ 기능이 이번에 새롭게 추가돼 집안 공기 상태를 한 눈에 쉽게 확인할 수 있다.삼성전자만의 ‘필터세이빙 7중 청정시스템’을 적용, 큰 먼지나 머리카락, 동물의 털 등을 극세필터로 걸러낸 후 탈취필터로 각종 냄새와 악취, 유해가스를 제거해 준다.또 정전기 원리를 응용한 ‘필터세이버’ 기능이 탑재돼 먼지를 효율적으로 제거함으로써 필터 수명을 두 배 가량 연장할 수 있어 더욱 경제적이다.회사측은 ""와이파이 연결을 통한 스마트홈 IoT 기능도 탑재돼 스마트폰용 ‘삼성 커넥트’ 앱(애플리케이션)으로 외출 중에도 언제 어디서든 실내 공기 상태를 확인할 수 있다""며 ""원격 제어 조작, 예약 설정, 필터 교체 주기 확인과 필터 구매도 간편하게 할 수 있다""고 강조했다.이번 신제품은 청정 면적과 필터 세이버 기능 유무에 따라 총 7가지 모델에 다크그레이 ·골드·블랙 3종 색상으로 출시되며 출고가는 블루스카이 7000(80㎡·90㎡)이 79만9000원~99만9000원, 5000(50㎡·60㎡)이 54만9000원~69만9000원이다.데일리안 이홍석 기자 (redstone@dailian.co.kr)ⓒ (주)데일리안 - 무단전재, 변형, 무단배포 금지좋아요0훈훈해요0슬퍼요0화나요0후속기사 원해요0기사제공 :']"
12,삼성전자, 2017-11-0111:24,헤럴드경제 ,"2일 공정위원장 면담재계 ‘개혁선물’ 고민삼성, 참석자 고민중 5대그룹 대한 상의...",https://finance.naver.com/news/news_read.nhn?article_id=0001309646&office_id=016&mode=search&query=삼성전자&page=10,"['       2일 공정위원장 면담재계 ‘개혁선물’ 고민삼성, 참석자 고민중 5대그룹 대한 상의서 간담회      기사입력2017-11-01 11:24기사원문좋아요훈훈해요좋아요 평가하기공감좋아요0훈훈해요0슬퍼요0화나요0후속기사 원해요0댓글5대그룹 대한 상의서 간담회김상조 공정거래위원장과 2차 간담회를 하루 앞둔 5대 그룹의 고민이 깊어지고 있다. 첫 간담회가 상견례 차원이었다면 이번 만남에서는 재벌개혁과 관련한 구체적인 논의가 오갈 가능성이 높아서다. 김 위원장이 대기업을 향해 ‘자발적인 변화’를 강조해온 만큼 5대 그룹은 각사의 현안에 맞춘 자구책을 마련하는 데 전력을 쏟고 있다. 1일 재계에 따르면 김 위원장과 삼성, 현대차, SK, LG, 롯데 등 5대 그룹과의 간담회가 2일 오전 대한상의회관에서 열린다. 현대차와 SK, LG는 지난 6월 1차 간담회에 참석했던 정진행 사장, 박정호 SK텔레콤 사장, 하현회 사장이, 롯데그룹에서는 황각규 롯데지주 사장이 참석할 예정이다. 삼성의 경우 아직 참석자가 확정되지 않았다. 삼성전자 관계자는 “오늘 중 참석자를 결정할 것”이라며 “첫 간담회에 참석했던 권오현 부회장이 내년 3월까지 대표이사직을 맡는 상황에서 아직 누가 참석할지 결정되지 않았다”고 말했다. 일각에서 삼성전자 이사회 의장으로 내정된 이상훈 사장의 참석을 점친다.5대 그룹은 이른바 ‘선물 보따리’ 준비에 바쁜 모습이다. 지배구조 개선, 일감 몰아주기 근절 등 재벌개혁 정책과 관련해 공정위와 보조를 맞추고 있음을 적극 어필해야할 처지다. 5대 그룹 고위 관계자는 “기업들은 칼자루를 쥐고 있는 공정위의 정책 기조에 맞춰 대응 방침이나 방향성을 정할 수 밖에 없는 입장”이라며 “각 그룹은 이번 간담회를 앞두고 김 위원장과 논의할 이슈를 각각 준비하고 있는 중”이라고 말했다. 삼성전자는 지배구조 개선 방안을 설명하는데 주력할 것으로 알려졌다. 전날 이사회를 통해 3개 부문장 인사를 단행한 삼성전자는 향후 사장단 인사 및 조직 개편 등을 통해 지배구조를 더욱 투명하게 만드는 작업을 진행할 전망이다. 현대차의 경우 기술탈취 문제가 당면 과제다. 공정위는 최근 현대차의 중소 하도급업체 기술탈취 재조사에 착수했다. SK와 LG는 이동통신사의 시장 독과점 문제에 직면해 있다. 특히 무약정폰 가격 담합 문제를 공정위가 들여다보고 있다는 점이 부담이다. 두 그룹은 공통적으로 브랜드 수수료가 부적절하다는 지적도 받고 있다. 롯데는 공항 면세점 담합 혐의로 공정위 조사망에 오른 상황이다. 재계 관계자는 “이번 간담회에서는 재벌개혁 정책에 대해 어느정도 구체 논의가 이뤄질 것으로 보인다”며 “각 그룹이 어떤 대책을 준비했는지가 핵심이 될 것”이라고 말했다. 이승환 기자/nice@heraldcorp.com▶ 생활용품 알뜰하게 사는 법 럭비(LUCK BE)▶앞서가는 젊은 경제신문 친구맺기 ▶오늘의 운세 날씨 - Copyrights ⓒ 헤럴드경제 & heraldbiz.com, 무단 전재 및 재배포 금지 -헤럴드경제 관련뉴스해당 언론사에서 선정하며 언론사 페이지(아웃링크)로 이동해 볼 수 있습니다.\'핼러윈 테러\' 뉴욕 맨해튼서 트럭 돌진…최소 8명 사망김주혁 사고, 약물 부작용 가능성 ""한달전부터 투약""한국나이 52세 강문영, 김정균에 ""딱 내 취향"" 적극 대시故 김주혁, 연예계 조문 행렬…팬 분향소 마련 논의임대사업자등록 \'자율\' 가닥…다주택자 탈출구?좋아요0훈훈해요0슬퍼요0화나요0후속기사 원해요0기사제공 :']"
13,삼성전자, 2017-11-0111:23,한국경제 ,"'최고가' 코스피, 2550선에서 상승폭 확대…외국인 '사자'",https://finance.naver.com/news/news_read.nhn?article_id=0003844278&office_id=015&mode=search&query=삼성전자&page=10,"['       \'최고가\' 코스피, 2550선에서 상승폭 확대…외국인 \'사자\'      기사입력2017-11-01 11:23기사원문좋아요훈훈해요좋아요 평가하기공감좋아요0훈훈해요0슬퍼요0화나요0후속기사 원해요0댓글 코스피가 사상 최고치를 기록하며 2550선을 돌파했다. 지수는 상승폭을 계속해서 넓히고 있다.   1일 오전 11시15분 현재 코스피 지수는 전날보다 28.00포인트(1.11%) 오른 2551.43을 나타내고 있다. 코스피는 연일 최고치를 경신하고 있다. 장 중 2554.13까지 올랐다.양기인 신한금융투자 리서치센터장은 ""삼성전자의 주주환원정책과 반도체 경기 호조 등이 지수를 이끌고 있다""고 분석했다.  간밤 미국 증시 상승도 코스피 상승에 긍정적인 영향을 끼쳤다. 뉴욕증권거래소(NYSE)에서 다우존스 30 산업평균지수는 전날보다 28.5포인트(0.12%) 상승한 23,377.24에 거래를 마쳤다. 스탠더드 앤드 푸어스(S&P) 500 지수와 나스닥 지수는 각각 0.09%와 0.43% 올랐다.외국인이 2441억원 순매수다. 개인과 기관이 각각 973억원과 1699억원 어치의 주식을 팔고있다. 프로그램 매매로는 차익거래 1557억원 순매도, 비차익거래 1446억원 순매수로 111억원의 자금이 빠져나가고 있다.   업종별로는 전기가스업 음식료품 보험 서비스업 등을 제외하고 대부분이 상승세다. 시가총액 상위종목 중 SK하이닉스, 삼성바이오로직스, 삼성전자는 3%대 상승세를 보이고 있다.삼성전자는 장 중 280만원을 찍으며 사상 최고가를 새로 썼다. 전날 발표한 3분기 실적과 주주환원정책 확대 방안 등이 투자심리를 자극한 것으로 보인다. 삼성SDI는 3분기 깜짝실적과 4분기 실적 성장 기대감에 7% 이상 급등하고 있다. 코스닥 지수는 전날보다 1.35포인트(0.19%) 오른 695.55를 기록하고 있다. 개인이 727억원 순매수다. 외국인과 기관이 각각 305억원과 394억원 매도 우위다.원·달러 환율은 사흘 연속 하락세다. 이날 오전 9시14분 현재 서울 외환시장에서 원·달러 환율은 전날보다 2.8원 내린 1117.70원에 거래되고 있다.김근희 한경닷컴 기자 tkfcka7@hankyung.com[한경닷컴 바로가기] [글방] [모바일한경 구독신청] ⓒ 한국경제 & hankyung.com, 무단전재 및 재배포 금지한국경제 관련뉴스해당 언론사에서 선정하며 언론사 페이지(아웃링크)로 이동해 볼 수 있습니다.""코스피, 강세장 진입…내년 \'2900\' 주식 팔지마라""양기인 센터장 ""삼성전자가 이끄는 코스피…주도株 전략 짜야""""한국, 이대로 가다간 \'재앙\' 온다""… 충격 경고포스코대우, 인도 진출 30년 만에… ""이럴 수가""이랜드, 자체 생산했더니 \'경쟁사\' 롯데百 반응이좋아요0훈훈해요0슬퍼요0화나요0후속기사 원해요0기사제공 :']"
14,삼성전자, 2017-11-0111:20,헤럴드경제 ,[삼성전자 인사 배경·의미] 세대교체로 젊어진 삼성…미래공략 ‘트로이카 편대’ 뜬...,https://finance.naver.com/news/news_read.nhn?article_id=0001309626&office_id=016&mode=search&query=삼성전자&page=10,"['       [삼성전자 인사 배경·의미] 세대교체로 젊어진 삼성…미래공략 ‘트로이카 편대’ 뜬다      기사입력2017-11-01 11:20기사원문좋아요훈훈해요좋아요 평가하기공감좋아요0훈훈해요0슬퍼요0화나요0후속기사 원해요0댓글-CE·IM담당 부문으로 격상 DS와 어깨 나란히-1세대 용퇴 그룹내 유일 부회장 JY체제 가속화-CFO 맡아온 이상훈 사장 이사회의장 중책맡아-사업 연속성·조직안정화 ‘두토끼 잡기’ 포석인듯삼성전자가 사내 세 부문(DSㆍIMㆍCE) 부문장(사장)을 50대로 일괄 교체했다. 이전 대비 평균 6살이 젊어졌다. 3개 부문 사장들이 모두 내부 승진 사례라는 점에서 세대교체와 조직 안정을 동시에 꾀했다는 평가가 나온다. 차기 이사회 의장에 이상훈 경영지원실장(사장)이 낙점된 것은 사업의 연속성을 도모한 결단이란 해석도 따라 붙는다. 일각에선 대단위 조직개편 가능성도 있다는 분석이 나왔으나 일단은 ‘현행 체제’로 가기로 했다.삼성전자는 이번 부문장 인사에서 김기남 사장을 신임DS 부문장으로, 김현석 사장을 CE부문장으로, 고동진 사장을 IM부문장으로 각각 선임했다. 부회장 승진자가 없었다는 점에서 이재용 부회장은 삼성전자 내 유일 부회장 직함을 가진 인사가 됐다. 이 부회장 체제가 강화됐다는 분석이 나온다.김기남 신임 DS부문장은 1981년 삼성전자에 입사한 이후 삼성 종합기술원장과 메모리 사업부장, 시스템 LSI 사업부장, 삼성디스플레이 사장, DS 부문 반도체 총괄 사장 등을 두루 역임한 반도체 분야 최고 권위자로 꼽힌다.김현석 CE 부문장은 삼성전자가 11년 연속 글로벌 TV 시장 1위를 유지하는 데 주도적 역할을 하는 등 디스플레이 제품 분야의 최고 개발 전문가로 평가된다.고동진 IM 부문장은 무선사업부 개발실 팀장과 실장을 역임하면서 이른바 ‘갤럭시 신화’를 일구며 모바일 사업 일류화를 선도해온 인물이다. 3명의 신임 부문장의 평균 연령은 57세다. 이전 대비 수장들의 연령은 6살 가량 낮아졌다.3인 CEO체제는 2012년 12월 도입이 발표된뒤 2013년 1월부터 운영돼 왔다. 이전에는 CE 담당과 IT 담당으로 편재돼 있었으나 두 분야를 모두 ‘부문’으로 격상시켜 DSㆍCEㆍIM 각 부문이 대표이사 사장 체제로 운영되도록 한 것이다. 1세대 3인 CEO체제의 인사들은 권오현-신종균-윤부근 체제였다. 이번 인사로 5년간 이어졌던 이 체제에 처음으로 변화가 가해졌다.2012년부터 경영지원실장(CFO)직을 맡아온 이상훈 사장은 이사회 의장을 맡게 된다. 권오현 부회장의 임기가 끝나면 이 사장이 의장직을 수행하게 된다. 공석이 된 CFO 직과 부문장 교체로 공석이 된 후속 인사도 빠르게 진행될 전망이다.이번 인사는 세대교체 가속화의 신호탄으로 해석된다. 이재용 부회장(50세)과 같은 50대 인사들이 전진배치되면서 이재용 세대로의 교체가 시작됐다는 평가다. 이건희 회장의 와병이 장기화되고 이재용 부회장의 부재 상태가 길어지면서 떨어진 조직 내 활력을 끌어올리기 위한 방편이다. 권오현 부회장의 용퇴 선언은 그 신호탄이었다. 권 부회장은 “지금이 바로 후배 경영진이 나서 비상한 각오로 경영을 쇄신해 새 출발할 때라고 믿는다”고 밝힌 바 있다.미래전략실 해체 여파로 과거와 같은 일괄적인 사장단 교체는 없을 것이란 전망이 우세하다. 삼성전자 안팎에선 이번주 중으로 삼성전자의 연쇄 인사가 시작되고 이후 계열사로 인사가 실시될 것이란 전망이 나오고 있다.삼성전자 관계자는 “후속 인사는 12월 이전까지 모두 마무리 될 것으로 보인다. 실적과 업무 전문성 등이 고려돼 승진자들도 선별된다”며 “후속 인사는 각 회사의 이사회가 중심이 돼 결정될 것”이라고 설명했다.\xa0홍석희 기자/hong@heraldcorp.com▶ 생활용품 알뜰하게 사는 법 럭비(LUCK BE)▶앞서가는 젊은 경제신문 친구맺기 ▶오늘의 운세 날씨 - Copyrights ⓒ 헤럴드경제 & heraldbiz.com, 무단 전재 및 재배포 금지 -헤럴드경제 관련뉴스해당 언론사에서 선정하며 언론사 페이지(아웃링크)로 이동해 볼 수 있습니다.\'핼러윈 테러\' 뉴욕 맨해튼서 트럭 돌진…최소 8명 사망김주혁 사고, 약물 부작용 가능성 ""한달전부터 투약""한국나이 52세 강문영, 김정균에 ""딱 내 취향"" 적극 대시故 김주혁, 연예계 조문 행렬…팬 분향소 마련 논의임대사업자등록 \'자율\' 가닥…다주택자 탈출구?좋아요0훈훈해요0슬퍼요0화나요0후속기사 원해요0기사제공 :']"
