,회사명,날짜,언론사,기사제목,링크,본문
6,삼성전자, 2017-03-1917:38,한국경제 ,[반도체·디스플레이 '낙수 효과'] 반도체·디스플레이 투자효과 2~3년 더 간다,https://finance.naver.com/news/news_read.nhn?article_id=0003742852&office_id=015&mode=search&query=삼성전자&page=2,"['       [반도체·디스플레이 \'낙수 효과\'] 반도체·디스플레이 투자효과 2~3년 더 간다      기사입력2017-03-19 17:38기사원문좋아요훈훈해요좋아요 평가하기공감좋아요0훈훈해요0슬퍼요0화나요0후속기사 원해요0댓글현 공사 마무리에만 2년 걸려삼성, 화성 10조 D램공장설[ 노경목 기자  ] 반도체와 디스플레이 업계의 투자효과는 앞으로 2~3년은 이어질 것으로 전망된다.일단 현재 예정된 공사를 마무리하는 데에만 2년 이상 걸린다. SK하이닉스의 청주 반도체공장이 2019년 6월 준공을 계획하고 있어서다. 축구장 10개 크기를 훌쩍 넘어가는 거대 공장은 골조 작업에만 8개월에서 1년이 소요된다. 건물 공사가 마무리되려면 여기에 3~8개월이 추가된다. 주문한 장비를 설치하고 본격 양산에 나설 수 있도록 준비하는 데에는 다시 6개월 이상이 필요하다. 전자업계 관계자는 “반도체·디스플레이 공장은 빨리 완공될수록 수익성이 높아져 공기를 최대한 앞당기고 있지만 워낙 큰 공장이어서 이 정도 시간은 걸린다”고 설명했다.공장이 1차 준공된 뒤에도 시장 상황에 따라 증설 공사가 계속된다. 2015년 준공된 SK하이닉스의 이천 반도체공장이 이달 말까지 2차 증설을 하는 것이 대표적인 예다. 삼성전자는 평택 반도체공장 인근에 지금과 같은 규모의 공장 2개를 더 지을 수 있는 부지를 확보하고 여차하면 투자에 나설 계획이다.화성공장에도 10조원을 들여 D램 공장을 추가한다는 이야기가 나온다. 대형 크레인 임대업체 신우개발 관계자는 “삼성전자 평택공장에 있는 대형 크레인들이 완공과 함께 바로 SK하이닉스 청주공장으로 넘어가는 등 앞으로 2~3년은 바쁠 전망”이라고 말했다.노경목 기자 autonomy@hankyung.com[한경닷컴 바로가기] [스내커] [모바일한경 구독신청] ⓒ 한국경제 & hankyung.com, 무단전재 및 재배포 금지한국경제 관련뉴스해당 언론사에서 선정하며 언론사 페이지(아웃링크)로 이동해 볼 수 있습니다.세계 1등 \'반도체·디스플레이의 축복\'…평택·파주·아산 춤춘다공장 건설 인력만 2만명…""일당 25만원까지 뛰고 안되는 장사 없다""기아차 영업사원, 차량 한 대 팔고 받는 돈이발기부전 치료제 먹은 50대 男, 온몸에…\'발칵\'강원랜드서 돈 벌었다는 사람 못 본 이유좋아요0훈훈해요0슬퍼요0화나요0후속기사 원해요0기사제공 :']"
7,삼성전자, 2017-03-1917:38,한국경제 ,[반도체·디스플레이 '낙수 효과'] 평택·파주·화성 등 아파트 건설도 러시,https://finance.naver.com/news/news_read.nhn?article_id=0003742853&office_id=015&mode=search&query=삼성전자&page=2,"['       [반도체·디스플레이 \'낙수 효과\'] 평택·파주·화성 등 아파트 건설도 러시      기사입력2017-03-19 17:38기사원문좋아요훈훈해요좋아요 평가하기공감좋아요0훈훈해요0슬퍼요0화나요0후속기사 원해요0댓글거대 직주근접 타운 기대감반도체공장 인근 아파트 완판[ 문혜정 기자  ] 지난 15일 당첨자가 발표된 경기 평택시의 고덕 파라곤(752가구) 아파트는 1순위에서 평균 49 대 1의 높은 청약경쟁률을 기록했다. 올 들어 수도권에서 공급된 아파트 중 가장 높은 경쟁률이다. 소형 주택(전용면적 71㎡) 143가구 모집엔 1만7646명이 몰려 경쟁률이 123 대 1에 달했다. 지난 16일 청약을 받은 고덕 자연앤자이 아파트도 평균 28.8 대 1의 경쟁률을 기록했다.고덕국제신도시에서 공급된 이들 단지의 인기 비결은 오는 6월께 가동될 삼성전자 평택 반도체공장(고덕첨단산업단지) 인근에 자리 잡고 있다는 점이다.삼성·LG그룹과 SK하이닉스 등이 투자하는 반도체·디스플레이 공장 주변은 아파트 분양시장에서 가장 인기 있는 지역이다. 대기업 공장에서 일하는 직원들이 멀지 않은 곳에 거주하길 원하기 때문에 자연스럽게 거대한 ‘직주근접(職住近接)’형 주거타운이 형성된다. 협력 업체 공장과 종사자도 대거 유입돼 주택 수요가 늘어난다.평택은 수도권에서 미분양 문제가 심각한 지역 중 하나다. 지난 1월 말 기준 평택의 미분양 주택(2532가구)은 경기도에서 용인(5285가구) 다음으로 많은 것으로 집계됐다. 그럼에도 건설사들은 큰 걱정을 하지 않는다.삼성전자 반도체 공장이 6월께 가동되면 상황이 호전될 것으로 확신하고 있다. 수도권 곳곳의 미군 부대도 올해부터 평택으로 이전한다.SK하이닉스가 반도체 공장을 짓고 있는 경기 이천과 충북 청주, 삼성디스플레이가 OLED(유기발광다이오드) 생산시설을 증설 중인 충남 아산, LG디스플레이가 있는 경기 파주, 삼성전자 반도체 공장이 자리 잡은 경기 화성 등도 건설사가 눈여겨보는 지역이다.문혜정 기자 selenmoon@hankyung.com[한경닷컴 바로가기] [스내커] [모바일한경 구독신청] ⓒ 한국경제 & hankyung.com, 무단전재 및 재배포 금지한국경제 관련뉴스해당 언론사에서 선정하며 언론사 페이지(아웃링크)로 이동해 볼 수 있습니다.세계 1등 \'반도체·디스플레이의 축복\'…평택·파주·아산 춤춘다공장 건설 인력만 2만명…""일당 25만원까지 뛰고 안되는 장사 없다""기아차 영업사원, 차량 한 대 팔고 받는 돈이발기부전 치료제 먹은 50대 男, 온몸에…\'발칵\'강원랜드서 돈 벌었다는 사람 못 본 이유좋아요0훈훈해요0슬퍼요0화나요0후속기사 원해요0기사제공 :']"
8,삼성전자, 2017-03-1917:36,한국일보 ,끝나지 않는 LG vs 삼성 ‘TV 전쟁’ 올해도 점화,https://finance.naver.com/news/news_read.nhn?article_id=0000193386&office_id=469&mode=search&query=삼성전자&page=2,"['       끝나지 않는 LG vs 삼성 ‘TV 전쟁’ 올해도 점화      기사입력2017-03-19 17:36기사원문좋아요훈훈해요좋아요 평가하기공감좋아요0훈훈해요0슬퍼요0화나요0후속기사 원해요0댓글 나노셀 TV 앞세운 LG전자 선전 포고, 삼성도 이번 주 신제품 국내 출시 맞불2017-03-19(한국일보)“시트는 광량(밝기)을 조절하는 소재가 아닌 필터링 소재인데, 시트 하나 붙여놓고 왜 QLED(양자점발광다이오드)라고 하는지 모르겠다. 학계에서도 말이 안 된다고 한다.”지난 17일 경기 파주시 LG디스플레이 파주사업장에서 진행된 나노셀 TV 생산라인 언론 공개 행사에서 LG전자의 한 연구원은 이렇게 말했다. QLED는 별도의 광원(백라이트)이 필요한 액정표시장치(LCD) 패널 기반 TV로, 백라이트 없이 자체 발광하는 자사의 유기발광다이오드(OLED) TV와는 다르다는 의미다. 제조사를 언급하진 않았지만 QLED TV는 삼성전자가 곧 국내에 출시할 신제품이라 LG전자가 겨냥한 ‘상대’는 명확했다.십 수년을 이어 온 양대 가전회사의 ‘TV 전쟁’이 올해도 불이 붙었다. 포문은 나노셀 기술을 적용한 LCD TV 신제품을 앞세운 LG전자가 먼저 열었다.LG전자에 따르면 나노셀 기술은 유리기판 2장 사이에 들어가는 편광판에 1나노m(10억분의 1m) 크기의 흡광성 물질을 덧입힌 것이다. 색 재현율과 정확도를 개선했고, 빛 반사율은 기존 LCD TV에 비해 30% 향상됐다. 1나노m급 물질로는 꽃이나 나무 열매 등 천연재료에서 채취한 친환경 염료가 사용됐다.LG전자 TV 상품기획팀 이희영 부장은 “60도 각도에서도 또렷한 화면을 감상할 수 있다”며 “나노셀 TV는 LCD TV의 가장 진화한 형태이지만 자발광 측면에서는 그래도 OLED가 우위에 있는 소재”라고 밝혔다. LG전자가 주도하는 OLED TV가 현재까지 나온 최고 TV임을 은연중 내비친 셈이다.TV화질팀 강경진 연구위원은 QLED TV가 독일에서 받은 컬러볼륨(색조) 100% 인증에 대해 “LCD는 입력 신호에 상관없이 색조가 일정하게 나오는데 OLED는 기준에 따라 최고 측정치가 다르다""며 ""아주 좁은 범위를 기준으로 하는 국제표준 개정이 논의 중”이라고 설명했다.이날 LG전자는 나노셀 기술에 대한 자부심을 드러냈지만 행사명과 달리 정작 언론에는 2006년 준공된 파주사업장의 P7 공장에서 TFT 공정 일부만 공개했다. TFT 공정은 박막 트랜지스터를 증착하는 단계로, 나노셀 공정이 아니다. LG디스플레이가 소개한 파주사업장 쇼룸에도 나노셀 기술이 적용된 TV는 보이지 않아 ‘TV 시장 이슈 선점을 위해 너무 서두른 것 아니냐’는 의혹의 눈길도 쏟아졌다.삼성전자는 21일 QLED TV 국내 출시 행사를 열어 고급 TV 시장 수성에 나선다. QLED TV는 나노m급 발광형 반도체 결정체(퀀텀닷) 시트를 백라이트 앞에 적용해 화질을 개선한 올해 야심작이다. 공개적으로 밝히진 않았지만 QLED TV의 상대는 LG의 OLED TV다. 삼성은 지난 1월 미국 라스베이거스에서 열린 세계 최대 가전전시회 ‘CES 2017’에서 QLED TV를 최초로 공개할 때도 OLED TV를 비교 대상으로 삼았다. 삼성전자는 LG전자 나노셀 TV의 대항마로는 QLED 아래의 실속형 프리미엄 TV ‘뮤(MU)’ 시리즈를 새로 내놓는다.삼성전자는 QLED와 뮤 시리즈로 올해도 세계 TV시장 점유율 1위를 지킬 계획이다. 시장조사기관 IHS에 따르면 지난해 매출액 기준 삼성전자의 TV 점유율은 27.7%로 11년 연속 세계 1위를 차지했다. LG전자는 13.9%로 2위였다.업계 관계자는 “OLED TV 글로벌 점유율은 지난해 0.3%에 그쳤고, 2020년에도 2%대로 예상돼 아직은 주류가 아니다”며 “가장 큰 LCD TV 시장을 놓고 양사 간 경쟁이 갈수록 치열해질 것”이라고 내다봤다.김창훈 기자 chkim@hankookilbo.com▶한국일보 [페이스북] [카카오 친구맺기]▶자동차의 모든 것! [모클][ⓒ 한국일보(hankookilbo.com), 무단 전재 및 재배포 금지]한국일보 관련뉴스해당 언론사에서 선정하며 언론사 페이지(아웃링크)로 이동해 볼 수 있습니다.[삶과 문화] ""새 보일러 놓아 드려야겠어요!""정의당 심상정 ""동물복지법 제정하고 동물의료보험 도입""세월호 시험 인양, 인양줄 꼬이며 실패문재인이 받았다는 \'전두환 표창장\'의 진실은영구 피임 난관수술, 미혼은 왜 못하나요좋아요0훈훈해요0슬퍼요0화나요0후속기사 원해요0기사제공 :']"
9,삼성전자, 2017-03-1917:28,매일경제 ,대신금융 `한국형 ISS` 만든다,https://finance.naver.com/news/news_read.nhn?article_id=0003907335&office_id=009&mode=search&query=삼성전자&page=2,"['       대신금융 `한국형 ISS` 만든다      기사입력2017-03-19 17:28기사원문좋아요훈훈해요좋아요 평가하기공감좋아요0훈훈해요0슬퍼요0화나요0후속기사 원해요0댓글지배구조연구소 설립해 의결권 자문컨설팅 진출변호사·회계사 대거 확충 대신금융그룹이 기관투자가들을 위한 의결권 자문업에 뛰어든다.19일 금융투자업계에 따르면 대신금융그룹은 지난달 대신경제연구소 산하에 있던 \'지배구조연구실\'을 \'대신지배구조연구소\'로 승격시키고 인력 충원에 나섰다. 기존 기관투자가들을 상대로 한 의결권 자문 컨설팅 사업을 확대하겠다는 구상이다. 대신지배구조연구소를 세계 최대 의결권 자문사인 미국 ISS(Institutional Shareholder Services)처럼 만들어 토종 의결권 자문기구가 되겠다는 것.대신지배구조연구소를 이끌 김호준 소장은 ""스튜어드십코드 도입 등으로 적극적인 주주권 행사에 대한 사회적 분위기가 무르익었음에도 국내 기관투자가들은 여전히 의결권 행사를 위한 내부 조직이 부족한 상태""라고 말했다.현재 국내 기관투자가들은 투자 포트폴리오가 다양해지고 편입 기업이 늘어나면서 투자 기업들의 주주총회 의안조차 분석이 어렵다. 예를 들어 삼성전자, 현대자동차 등 총 924개사 주총이 몰려 있는 오는 24일의 경우 각 사 주총 안건이 3개씩만 된다고 가정해도 거의 3000개에 달하는 의안을 분석해야 한다. 대부분 기관투자가가 의안 분석용 전문인력을 두고 있지 않다는 점을 감안하면 기관투자가들은 안건에 대한 심층 분석은커녕 대부분 주총 안건에 수동적으로 찬성할 수밖에 없다. 기관투자가들에게 적극적인 경영 감시자로서의 역할을 기대하는 스튜어드십코드 실행이 어려운 것도 같은 맥락이다.이에 따라 김 소장은 ""연구소에 변호사, 회계사 등 전문인력들을 충원하고 있다""며 ""기업지배구조 컨설팅은 단순 의결권 행사보다 더욱 복잡하게 얽혀 있는 문제가 많아 법, 회계 등 관련 전문가들의 서비스가 필요하다""고 덧붙였다. 대신지배구조연구소는 애널리스트, 투자은행가, 컨설턴트 등 다양한 경력의 연구인력을 17여 명 확충했다. 대신증권은 3년 전인 2014년 연구소 산하에 지배구조연구실을 설치하고 주총 의안 분석을 시작했다. 2015년에는 400개 기업을 분석한 데 이어 지난해에는 분석 영역을 600개 기업까지 확대했고, 의결권 자문 서비스가 필요한 기관투자가 고객층을 만들어둬야 지속적인 서비스가 가능하기 때문이다.글로벌 의결권 자문업계는 현재 미국계 ISS와 글라스루이스가 시장 점유율 80% 이상을 차지하고 있다. 대부분의 대형 글로벌 기관투자가가 이용하는 ISS는 특히 의결권 행사를 지원하기 위해 주총 의안을 분석하는 것뿐만 아니라 의결권 행사까지 대행해주는 서비스(프락시 어드바이저)를 제공하면서 자본시장에 영향력이 막강하다. 삼성물산·제일모직 합병 등 국내에서도 굵직한 딜이 있을 때마다 ISS가 의견을 피력하면서 시장을 좌지우지했다. 그러나 김 소장은 ""ISS 등 글로벌 의결권 자문사들은 외국계 투자자들이 애용하고 있는 만큼 아무래도 그쪽 자본시장의 입맛에 맞는 분석을 하게 된다""며 ""하지만 대신은 연구인력들이 한국의 기업 현실을 잘 알고 있기 때문에 한국판 ISS로 성장해 나가기에 충분할 것""이라고 강조했다. 현재 국내에서 의결권 자문업을 하고 있는 곳은 한국기업지배구조원, 서스틴베스트 등 4~5개사에 불과하다. [한예경 기자][매일경제 공식 페이스북] [오늘의 인기뉴스] [매경 프리미엄][ⓒ 매일경제 & mk.co.kr, 무단전재 및 재배포 금지]매일경제 관련뉴스해당 언론사에서 선정하며 언론사 페이지(아웃링크)로 이동해 볼 수 있습니다.최양락, 하차 후 근황…이제 본업이 식당 주차요원?""학교를 안 나가겠습니다"" 수능 대신 세계여행을 떠나다골로프킨, 스토리 가득했던 복싱빅매치 판정승동이족 중미대륙 진출? ""상왕조 갑골문자 발견""비♥김태희, 결혼 후 첫 커플화보 \'꿀 떨어지네\'좋아요0훈훈해요0슬퍼요0화나요0후속기사 원해요0기사제공 :']"
10,삼성전자, 2017-03-1917:27,매일경제 ,24일은 `슈퍼 주총데이`…삼성전자 등 924곳 몰려,https://finance.naver.com/news/news_read.nhn?article_id=0003907332&office_id=009&mode=search&query=삼성전자&page=2,"['       24일은 `슈퍼 주총데이`…삼성전자 등 924곳 몰려      기사입력2017-03-19 17:27기사원문좋아요훈훈해요좋아요 평가하기공감좋아요0훈훈해요0슬퍼요0화나요0후속기사 원해요0댓글 오는 24일은 삼성전자를 비롯해 SK텔레콤 등 924개사의 주주총회가 집중된 \'슈퍼주총데이\'가 될 예정이다.19일 한국예탁결제원에 따르면 이번주(20~24일)에는 삼성그룹 계열사와 SK그룹 계열사, 롯데그룹 계열사 등 1017개사가 정기 주주총회를 개최할 계획이다. 특히 이번주 열리는 주주총회의 90%가량이 24일에 몰려 있는데 삼성전자, 우리은행, 미래에셋대우, SK텔레콤 등이 이날 주총을 개최할 예정이다.우선 이재용 삼성전자 부회장이 구속된 이후 24일 열리는 삼성전자 주주총회에서는 작년 11월 삼성 측이 공식화한 지주회사 전환 검토를 비롯해 여타 주주가치 제고 방안과 관련된 언급이 있을 것으로 전망된다. 현재 이 부회장은 삼성전자 등기이사직을 유지하고 있다. 이어 삼성SDI의 경우 지난달 이사회를 통해 사내이사로 내정한 전영현 사장을 이날 주총에서 정식 선임할 예정이다.이 밖에도 SK텔레콤, SK이노베이션, SK하이닉스 등 SK그룹 계열사들은 최태원 SK 회장의 경영철학인 \'딥 체인지(Deep Change)\'를 바탕으로 이윤보다는 행복과 사회적 책임을 강조하는 내용으로 정관을 변경할 계획이다. [이용건 기자][매일경제 공식 페이스북] [오늘의 인기뉴스] [매경 프리미엄][ⓒ 매일경제 & mk.co.kr, 무단전재 및 재배포 금지]매일경제 관련뉴스해당 언론사에서 선정하며 언론사 페이지(아웃링크)로 이동해 볼 수 있습니다.최양락, 하차 후 근황…이제 본업이 식당 주차요원?""학교를 안 나가겠습니다"" 수능 대신 세계여행을 떠나다골로프킨, 스토리 가득했던 복싱빅매치 판정승펠레 서명 덕분에 대박난 월드컵 앨범비♥김태희, 결혼 후 첫 커플화보 \'꿀 떨어지네\'좋아요0훈훈해요0슬퍼요0화나요0후속기사 원해요0기사제공 :']"
11,삼성전자, 2017-03-1917:25,MBN ,24일 슈퍼 주총데이…삼성 비롯해 1017개사 정기 주주총회,https://finance.naver.com/news/news_read.nhn?article_id=0001100766&office_id=057&mode=search&query=삼성전자&page=2,"['       24일 슈퍼 주총데이…삼성 비롯해 1017개사 정기 주주총회      기사입력2017-03-19 17:25기사원문좋아요훈훈해요좋아요 평가하기공감좋아요0훈훈해요0슬퍼요0화나요0후속기사 원해요0댓글24일 슈퍼 주총데이/사진=연합뉴스한국예탁결제원은 이번 주(20∼24일)에 삼성전자 등 삼성그룹 계열사와 SK텔레콤 등 SK그룹 계열사 등 총 1천17개사가 정기 주주총회를 한다고 19일 밝혔습니다.특히 24일은 코스피 416개사, 코스닥 498개사, 코넥스 10개사 등 924개사가 몰려 \'슈퍼주총데이\'가 될 예정입니다.이재용 부회장이 구속된 이후 처음 열리는 삼성전자의 24일 주주총회에서는 작년 11월 공식화한 지주회사 전환 검토를 포함해 \'주주가치 제고 방안\'에 관한 주주들의 질의와 회사의 언급이 있을 것으로 보입니다.이 부회장은 등기이사직을 그대로 유지합니다.삼성SDI는 지난달 이사회에서 사내이사로 내정한 전영현 사장을 24일 주총에서 정식 선임합니다.SK이노베이션, SK하이닉스, SK텔레콤 등 SK그룹 계열사들은 최태원 회장의 경영철학인 \'딥 체인지(Deep Change)\' 정신을 담아 이윤보다 행복과 사회적 책임을 강조하는 내용으로 정관을 변경할 계획입니다.롯데케미칼은 신동빈 롯데그룹 회장을 등기이사로 재선임 안을 안건으로 올렸습니다. 신 회장은 롯데칠성음료 사내이사에도 오를 전망입니다.이번 주 주총을 여는 코스피 상장사는 삼성전자와 삼성SDI, 호텔신라, LG디스플레이, 신한금융, 현대중공업, SK텔레콤, 롯데쇼핑등 451개사입니다.코스닥에서는 손오공, 안국약품, 네이처셀, 코리아나화장품 등 552개사가 주주총회를 개최하고 코넥스 상장법인 14곳도 주총을 엽니다.12월 결산 2천70개 상장법인 가운데 현대자동차 등 253개사가 이미 주주총회를 마쳤고 782개사는 3월 다섯째 주 이후로 정기주총 개최를 예정하고 있습니다.[MBN 뉴스센터 / mbnreporter01@mbn.co.kr]< Copyright ⓒ MBN(www.mbn.co.kr) 무단전재 및 재배포 금지 >MBN 관련뉴스해당 언론사에서 선정하며 언론사 페이지(아웃링크)로 이동해 볼 수 있습니다.중년男, 여장 후 꽃뱀 행세 \'모텔로 가자더니…\'""주술로 北 막겠다"" 말레이 주술사 체포 위기10년간 병원서 일한 의사, 알고보니 사기꾼?숯불에 독주 쏟아 \'화르륵\'…3살 배기 아이 숨져비 김태희 부부 화보, \'눈부신 선남선녀\' …포즈까지 판박이좋아요0훈훈해요0슬퍼요0화나요0후속기사 원해요0기사제공 :']"
