,회사명,날짜,언론사,기사제목,링크,본문
0,삼성전자, 2017-08-2922:32,세계일보 ,세탁시간 절반 줄인 세탁기,https://finance.naver.com/news/news_read.nhn?article_id=0003204841&office_id=022&mode=search&query=삼성전자&page=1,"['       세탁시간 절반 줄인 세탁기      기사입력2017-08-29 22:32기사원문좋아요훈훈해요좋아요 평가하기공감좋아요0훈훈해요0슬퍼요0화나요0후속기사 원해요0댓글삼성전자가 다음달 1∼6일(현지시간) 독일 베를린에서 열리는 ‘IFA 2017’에서 선보일 드럼세탁기 ‘퀵드라이브’ 이미지를 29일 공개했다. 기존 드럼세탁기의 상하 낙차 방식에 전자동세탁기의 회전판 방식을 결합해 세탁시간을 절반 가까이 줄인 제품이다.삼성전자 제공ⓒ 세상을 보는 눈, 글로벌 미디어 세계일보세계일보 관련뉴스해당 언론사에서 선정하며 언론사 페이지(아웃링크)로 이동해 볼 수 있습니다.환경미화원 아들 산재 다투는 법정서 눈물 떨군 父情장모 고깃집서 매주 공짜 회식…무개념사위 논란1살 아들 품에 안고 숨진 임신부 ""당신 사랑한 걸 잊지 마""친일파 후손 ""文대통령이 과거 정권 뒤지는 게 싫어요""""남의 남자친구 뺏는 게 뭐가 문제인가요?""좋아요0훈훈해요0슬퍼요0화나요0후속기사 원해요0기사제공 :']"
1,삼성전자, 2017-08-2921:14,스포츠경향 ,"대법원, 삼성전자 LCD공장 노동자 다발성경화증 산재 인정",https://finance.naver.com/news/news_read.nhn?article_id=0000509722&office_id=144&mode=search&query=삼성전자&page=1,"['       대법원, 삼성전자 LCD공장 노동자 다발성경화증 산재 인정      기사입력2017-08-29 21:14기사원문좋아요훈훈해요좋아요 평가하기공감좋아요0훈훈해요0슬퍼요0화나요0후속기사 원해요0댓글 노동 환경 때문에 희귀병인 ‘다발성 경화증’을 얻었다고 주장한 근로자에 대해 대법원이 1·2심 판단을 뒤집고 산업재해를 인정했다. 대법원은 의학적으로 원인이 확실히 밝혀지지 않은 희귀성 질환이이라 하더라도 업무와 인과관계를 쉽게 부정해선 안 된다고 판단했다.대법원 3부(주심 김재형)는 29일 삼성전자 LCD 사업부 천안사업장에서 일했던 이희진씨(33)가 근로복지공단을 상대로 “다발성경화증에 대한 산재를 인정해달라”며 낸 소송에서 원고 패소로 판결한 1·2심을 깨고 서울고법으로 사건을 돌려보냈다. 삼성그룹 산재노동자와 가족들이  연대한 모임인 반올림은 “이씨는 삼성전자 LCD 천안공장(현 삼성디스플레이 천안사업장)에서 모듈과의 맨 마지막 단계인 불량 화질검사 업무를 하다가 건강상 이유로 퇴사한 뒤 다발성경화증을 진단받았다”고 밝혔다.또 “ 희귀질환인 다발성경화증으로 현재 한쪽 눈의 시력을 잃었고, 뛰거나 빨리 걷지 못하며, 자주 넘어진다”며  “스트레스를 받으면 재발되는 병의 특성상 제대로 취업하기도 힘들어 다른 다발성경화증 피해자들과 마찬가지로 경제적으로도 어려움을 겪으며 살고 있다”고 전했다.이희진씨는 2010년 7월 반올림과 함께 산재신청을 준비하여 근로복지공단에 산업재해보상보험 (요양급여)신청을 제기했으나 2011년에 2월에 불승인 된 후 그 해 4월 행정소송을 제기하였으나 1심과 2심에서 모두 기각되었다가 이날 대법원에서 산업재해 인정취지의 판결을 받은 것이다.  이는 산재신청을 제기한 후 7년 만에 대법원에서 처음으로 산재인정이 된 것이다.  반올림은 “삼성전자는 그간 피해자들에게 개인질병이라며 몇몇 피해자에게 일방적으로 정한 위로금 형태의 금전으로 무마하고 직업병을 부인하며 은폐해 왔다”며 “더 이상 꼼수부리지 말고, 이희진씨 바람처럼 이번 대법원 판결을 계기로 직업병 피해자들에게 진실된 사과, 정당한 보상을 실시하기 바란다”고 당부했다. 법원 상고심에서 다발성경화증에 대한 산재 인정 여부가 논의되고 인정된 것은 이번이 처음이다.▶ [스포츠경향 인기 무료만화 보기]▶ [핫&스타포토]©스포츠경향(sports.khan.co.kr), 무단전재 및 재배포 금지스포츠경향 관련뉴스해당 언론사에서 선정하며 언론사 페이지(아웃링크)로 이동해 볼 수 있습니다.\'1억 팔로워\' 셀레나 고메즈 인스타그램에 저스틴 비버 알몸 사진이?…해킹 소동\'욕설·음주 방송 논란\' 마마무 휘인, 그날 어떤 일이 있었나손수현, \'외모·인종 비하\' 비판 ""잘못된 것에 잘못됐다고 말할 수 있어야""\'뇌섹몸짱\' 이연화, 한국판 플레이보이지 창간호에 국내1호 \'플레이메이트\' 선정[단독] JBJ, 내달 데뷔 쇼케이스…김태동 합류는 미정좋아요0훈훈해요0슬퍼요0화나요0후속기사 원해요0기사제공 :']"
2,삼성전자, 2017-08-2920:39,매일경제 ,통신비 25% 인하 확정,https://finance.naver.com/news/news_read.nhn?article_id=0004004914&office_id=009&mode=search&query=삼성전자&page=1,"['       통신비 25% 인하 확정      기사입력2017-08-29 20:39기사원문좋아요훈훈해요좋아요 평가하기공감좋아요0훈훈해요0슬퍼요0화나요0후속기사 원해요0댓글이통사 소송제기 않기로…9월 15일부터 시행 예정유영민 장관 ""소급적용 어려워"" 다음달 15일부터 소비자가 휴대폰 개통 시 선택약정할인을 선택하면 통신요금의 25%를 할인받게 된다. 그동안 통신비 할인을 이행하지 못하겠다며 소송을 불사하겠다던 이동통신사들은 사실상 백기투항했다. 과학기술정보통신부는 29일  ""이동통신 3사는 지원금에 상응하는 요금할인율 25% 상향 적용을 차질 없이 이행하겠다고 알려왔다""고 밝혔다.선택약정할인은 2014년 단통법(이동통신 단말장치 유통구조 개선에 관한 법률) 시행과 함께 도입됐다. 일정 기간 사용 약정을 맺으면 그 기간 통신비를 할인해주는 제도다. 단말기 보조금을 받지 않은 가입자는 이통사 약정만 맺으면 누구나 지원금에 상응하는 요금 할인을 받을 수 있다. 9월 15일에 새로 휴대폰을 구입하거나 중고폰으로 기기를 변경하면서 새로 약정할인에 가입하면 기존보다 5%포인트 높은 25% 할인율이 적용되는 것이다. 기존에 SK텔레콤에서 \'데이터 6.5요금제\'에 가입했던 사람들은 월 요금이 5만6100원이었다. 이를 약정할인으로 가입한 소비자는 매월 4만4880원(20% 할인)의 요금을 냈다. 하지만 앞으로는 4만2075원(25% 할인가)만 내면 된다. KT LTE DATA선택109 요금제에 가입해 선택약정할인을 받아 8만7912원의 요금을 냈던 고객은 8만2417원만 지불하면 된다. 소비자는 휴대전화를 구입할 때 지원금과 선택약정할인 둘 중에 하나를 선택할 수 있기 때문에 지원금을 선택할 경우 약정할인은 적용되지 않는다.9월 15일부터 삼성전자와 LG전자가 하반기 전략 스마트폰인 갤럭시노트8과 V30의 판매를 시작하기 때문에 신제품을 구매하려는 고객 중 아직 약정할인 기간이 남아 있는 고객은 위약금을 물고 구입할지 여부 등을 따져봐야 한다. 위약금은 처음에 약정한 가입기간과 실제 가입기간에 따라 위약금이 다 다르다. 예를 들어 1년 약정했을 경우 가입한 지 3개월까지는 해지 시 할인반환금을 100% 돌려줘야 한다. 9개월까지는 절반을, 10개월부터는 위약금이 없다. 2년 약정 시에는 6개월까지 100%, 1년까지 60%, 20개월까지는 35%를 토해내야 한다. 다만 이 할인반환금은 할인받았던 금액의 범위를 넘어서지 않는다. 앞서 정부는 통신비 절감대책 일환으로 지난 18일, 9월 15일 신규 약정자부터 요금할인율을 현행 20%에서 25%로 올리도록 하는 행정처분을 이통 3사에 통지했다. 정부의 행정처분에 맞서 소송을 검토하던 SK텔레콤, KT, LG유플러스 등 이통 3사는 이날 소송을 제기하지 않기로 결정했다. 회사 이익에 심각한 타격이 우려되지만, 가계통신비 인하라는 취지를 고려해 수용한다는 입장이다SK텔레콤은 ""심각한 재무적 부담 및 향후 투자여력 훼손 등이 예상되나 할인율 상향 건에 대해서는 소송을 진행하지 않기로 결정했다""고 설명했다.  그러나 공정거래위원회, 방송통신위원회 등 정부의 다양한 압박 수단 때문에 백기투항한 것이나 다름없어서 사실상 정부가 민간 사업자들을 강제한 것이라는 불만은 남아있다. 익명을 요구한 한 이통사 관계자는 ""법리로만 보면 충분히 다퉈볼 만했지만 공정위, 방통위 조사 등에 상당한 압박을 느꼈다""면서 ""3사 가운데 어느 한 회사라도 25% 선택약정할인율을 수용한다면 가입자 쏠림 현상이 발생할 것이라는 현실 판단도 고려했다""고 설명했다.다만 기존 가입자들에게도 소급해서 선택약정할인율을 적용하는 것은 어려울 것으로 보인다. 이통 3사가 강하게 반발하고 있는 데다 유영민 과기정통부 장관이 이날 정부과천청사에서 열린 출입기자단과의 정책간담회에서 기존 가입자들에게도 선택약정할인율을 적용하는 것과 관련해서는 \'어렵다\'고 선을 그었기 때문이다.  한편 유 장관은 이날 정책간담회에서 최근 논란이 된 4차 산업혁명위원회의 부처 참여 축소에 대해 ""내가 문제를 제기했다""고 말했다. 그는 ""위원회에 부처 장관들이 10여 명 들어가면서 조직이 무거워져 조정 역할이나 자문을 잘할 수 없다고 생각했다""며 ""예를 들어 스마트시티 관련 사안에 대해서는 4차 산업혁명 주관 부처인 과기정통부가 국토교통부, 행정안전부 등에 과제를 던져주고 자원을 배분해야 하지 않겠느냐""고 말했다. 정부는 4차 산업혁명위원회에 정부 부처로는 과기정통부 정도만 참여하고 민간에서 실질적 자문 역할을 하는 게 맞지 않느냐는 논리다. 이날 과기정통부는 내년부터 출시되는 삼성전자·LG전자 스마트폰을 통해 FM라디오 방송 수신이 가능해진다고 밝혔다. 그동안 판매됐던 삼성전자·LG전자 스마트폰은 일부 보급형 스마트폰을 제외하고는 FM 라디오 방송을 직접 수신하는 것이 불가능했다. 내년부터 출시되는 삼성전자·LG전자 모든 스마트폰에는 FM라디오 수신 기능이 활성화될 예정이다.  [서동철 기자 / 원호섭 기자 / 오찬종 기자][매일경제 공식 페이스북] [오늘의 인기뉴스] [매경 프리미엄][ⓒ 매일경제 & mk.co.kr, 무단전재 및 재배포 금지]매일경제 관련뉴스해당 언론사에서 선정하며 언론사 페이지(아웃링크)로 이동해 볼 수 있습니다.\'51살\' 니콜 키드먼, 20대도 울고갈 \'美친몸매\' 뽐내다세계 최강 레이저시설 한국에 있었네KIA, 최규순 리스트 중 하나였다…검찰 소환 조사허리케인으로 실종된 父 찾아 헤맨 아들 극적으로…\'男心저격\' 클라라, 시선집중 하의실종 패션 \'입이 쩍\'좋아요0훈훈해요0슬퍼요0화나요0후속기사 원해요0기사제공 :']"
3,삼성전자, 2017-08-2920:15,한국경제 ,"삼성전자, 40분이면 세탁 끝~",https://finance.naver.com/news/news_read.nhn?article_id=0003816207&office_id=015&mode=search&query=삼성전자&page=1,"['       삼성전자, 40분이면 세탁 끝~      기사입력2017-08-29 20:15기사원문좋아요훈훈해요좋아요 평가하기공감좋아요0훈훈해요0슬퍼요0화나요0후속기사 원해요0댓글베를린 IFA서 데뷔합니다드럼세탁기 \'퀵드라이브\'[ 노경목 기자  ] 적어도 한 시간 이상 걸리는 세탁 시간을 40분 이내로 줄인 세탁기를 삼성전자가 내놓는다.삼성전자는 다음달 1일(현지시간)부터 독일 베를린에서 열리는 유럽 최대 가전박람회 ‘IFA 2017’에서 드럼세탁기 ‘퀵드라이브’를 선보인다고 29일 발표했다. 세탁물을 위로 올렸다 떨어뜨리는 드럼세탁기와 세탁통 내부에 회오리를 일으키는 수직통 세탁기의 세탁 방식을 결합해 세탁 강도를 높인 것이 특징이다. 세탁 시간이 줄면서 소비전력도 20% 감소했다. 세탁 성능은 높아졌지만 옷감 손상은 기존 세탁기와 큰 차이가 없다. 세탁 성능 테스트 기관 인터텍과 유럽 최고의 섬유연구소인 호헨스타인 등의 조사에 따르면 퀵드라이브를 사용하는 데 따른 옷감 손상 정도가 기존 세탁기와 비슷한 것으로 나타났다.노경목 기자 autonomy@hankyung.com[한경닷컴 바로가기] [글방] [모바일한경 구독신청] ⓒ 한국경제 & hankyung.com, 무단전재 및 재배포 금지한국경제 관련뉴스해당 언론사에서 선정하며 언론사 페이지(아웃링크)로 이동해 볼 수 있습니다.\'영업비밀\' 논리 더는 안 통해… 산재환자 눈물 닦아준 대법원삼성전자 LCD 노동자 희귀병 \'산재\'버렸던 \'브랜드\', 4년 만에 재사용…1900억 \'대박\'""아무도 몰라줘 서운""…\'강남 거지\' 직장인의 고백""한국, 호황 누리는데…"" 미국, 찬물 준비하나좋아요0훈훈해요0슬퍼요0화나요0후속기사 원해요0기사제공 :']"
4,삼성전자, 2017-08-2920:04,한국경제 ,국내 첫 '태양광 스마트공장' 신성이엔지 용인공장 가보니,https://finance.naver.com/news/news_read.nhn?article_id=0003816188&office_id=015&mode=search&query=삼성전자&page=1,"['       국내 첫 \'태양광 스마트공장\' 신성이엔지 용인공장 가보니      기사입력2017-08-29 20:04기사원문좋아요훈훈해요좋아요 평가하기공감좋아요0훈훈해요0슬퍼요0화나요0후속기사 원해요0댓글무인 생산라인서 로봇이 스스로 제품 찾아 운반공장 곳곳에 있는 화면에서 생산라인 현황 초단위 확인클린룸용 팬필터 유닛 생산 전년보다 생산성 2.5배 올라매출 2000억에 생산직 40명공장옥상 등에서 태양광발전 자체 충당하고 연간 1억원 수익[ 조아란 기자  ] 오동훈 신성이엔지 상무가 작업 상황과 태양광에너지 생산 현황 등을 한눈에 확인할 수 있는 스마트공장 모니터링 화면을 보여주고 있다.  조아란 기자연면적 약 6000㎡의 넓은 공장 안에는 사람이 거의 보이지 않았다. 알루미늄 접합기가 소리 없이 부품을 생산하고, 자동운반장치(AGV)가 스스로 부품을 발견해 지정된 장소로 실어나르는 과정을 반복했다. 작업장 문앞, 공장 입구 등 곳곳에 설치된 디스플레이 화면에서는 생산라인별 현황을 초 단위로 확인할 수 있었다. 이곳은 신성이엔지가 고효율 청정시스템 부품인 팬필터유닛(FFU)을 생산하는 용인공장. 국내 처음으로 태양광만으로 가동되는 스마트공장이다. 세 개 생산라인 중 2라인만 사람이 근무하고 1, 3라인은 기계가 모든 제품을 생산한다. 공정자동화율이 78%에 달한다.오동훈 상무는 “작년 한 해 이곳에서 나온 매출만 2000억원가량이지만 일하는 생산직 근로자는 40여 명에 불과하다”며 “내년까지 빅데이터 기반의 클린에너지 운영시스템 개발을 마치면 공장이 더 효율화될 것”이라고 설명했다.◆“1인당 생산성 2.5배 높아져”회사 측은 스마트공장 가동 후 가장 큰 변화로 1인당 생산성이 비약적으로 늘어났다는 점을 꼽았다. 신성이엔지가 생산하는 FFU는 반도체, 디스플레이 공장에서 클린룸을 조성하는 용도로 사용된다. 주요 납품처는 삼성전자 LG디스플레이 등이다. 충북 음성공장에서 작업을 하던 작년 상반기까지 연간 FFU 생산량은 6만 대에 불과했다. 자동화가 덜 이뤄져 생산라인에도 사람이 필요했고, 부품 운반을 사람이 도맡아 해야 해 생산직으로만 60여 명이 근무했다. 지난해 6월부터 용인사업장을 가동하자 작년 FFU 생산량은 17만 대에 달했다. 생산직 인원을 3분의 2(40여 명)로 줄이고도 생산량은 2.5배 늘어난 셈이다. 오 상무는 “올해 국내 반도체산업이 호황을 맞으면서 장비 주문이 밀려들었는데 스마트공장이 아니었다면 주문을 감당할 수 없었을 것”이라고 말했다. 회사 측은 올해 용인공장 FFU 생산량이 17만5000여 대에 달할 것으로 보고 있다.◆태양광 공장 가동·연 1억원 수익태양광으로 자체 전력을 생산하고 남은 전력을 팔아 연간 1억원의 수익을 얻는다는 점도 경쟁력이다. 공장 옥상과 가로등, 앞마당 등 곳곳에 2000여 개의 태양광 패널이 설치돼 있다. 생산한 전력을 1㎿ 규모 에너지저장장치(ESS)에 저장해뒀다가 약 70%는 공장 전력으로 쓰고 나머지는 한국전력에 판다. 지난해 1억7000만원어치를 팔아 7000만원(공장 전력의 30%)가량의 전력을 한전에서 받아 썼는데도 수익이 1억원 났다. 이완근 신성이엔지 회장은 “해외에서는 구글, 테슬라 등이 사옥에 설치된 태양광과 ESS를 주요 전력 공급원으로 사용하는 경우가 있지만 국내에서는 신성이엔지가 유일하다”고 설명했다.용인공장은 이달 빅데이터 기반의 지능형 에너지 관리 시스템 개발에도 들어갔다. 내년 7월까지 생산 계획에 따른 라인별 전력 수요와 기상 정보를 통한 전력 공급 계획을 확인한 뒤 에너지를 종합적으로 관리하는 알고리즘을 개발할 계획이다. 다음날 전력 수요가 많을 계획이지만 비가 오고 구름이 끼어 태양광 발전이 어려우면 한전 심야전기를 활용할 수 있도록 미리 계획해두는 식이다. 이 회장은 “개발을 마치면 태양광 에너지로 스마트그리드를 달성하는 국내 유일한 공장이 된다”며 “국내 중소·중견기업에 노하우를 전달할 수 있는 스마트공장의 표준을 확립할 것”이라고 말했다.용인=조아란 기자 archo@hankyung.com[한경닷컴 바로가기] [글방] [모바일한경 구독신청] ⓒ 한국경제 & hankyung.com, 무단전재 및 재배포 금지한국경제 관련뉴스해당 언론사에서 선정하며 언론사 페이지(아웃링크)로 이동해 볼 수 있습니다.신성이엔지, 캐나다 실팹솔라와 114억원 수출 계약신성이엔지, 114억원 태양전지 수출 계약(상보)버렸던 \'브랜드\', 4년 만에 재사용…1900억 \'대박\'""아무도 몰라줘 서운""…\'강남 거지\' 직장인의 고백""한국, 호황 누리는데…"" 미국, 찬물 준비하나좋아요0훈훈해요0슬퍼요0화나요0후속기사 원해요0기사제공 :']"
5,삼성전자, 2017-08-2919:29,파이낸셜뉴스 ,"삼성, 올 2분기 프리미엄 TV시장 '왕좌'… 소니와 24.8%P차",https://finance.naver.com/news/news_read.nhn?article_id=0003865888&office_id=014&mode=search&query=삼성전자&page=1,"['       삼성, 올 2분기 프리미엄 TV시장 \'왕좌\'… 소니와 24.8%P차      기사입력2017-08-29 19:29기사원문좋아요훈훈해요좋아요 평가하기공감좋아요0훈훈해요0슬퍼요0화나요0후속기사 원해요0댓글판매가 1500弗이상 시장서 삼성 43.9% 점유율 1위일부 해외 시장조사기관 고무줄식 조사에 신뢰성↓                  올해로 11년째 세계 TV 1위를 지키고 있는 삼성전자가 올 2·4분기 누적기준 세계 프리미엄 TV시장에서 소니와 24.8% 포인트 격차를 보이면서 1위를 굳건히 하고 있는 것으로 확인됐다.    지난 2006년 삼성전자에게 세계 TV 1위 자리를 내준 후 몰락의 길을 걸어온 일본 소니는 올 2·4분기에도 세계 TV시장에서 3위에 그치면서 과거의 영광을 되찾지 못하고 있는 것으로 조사됐다.    29일 글로벌시장조사업체인 Gfk에 따르면 삼성전자는 올해 2·4분기까지 판매가격 1500달러 이상 프리미엄 TV시장에서 43.9%의 점유율로 1위를 기록했다. 이어 LG전자가 24.2%로 2위, 소니가 19.1%로 3위, 파나소닉이 2.2%로 4위를 각각 차지했다.    같은 시기 삼성전자는 판매가격 2500달러 이상 프리미엄TV시장에서도 35.5%로 1위를 지켰다. 이어 LG전자가 30%로 2위, 소니가 23.1%로 3위, 파나소닉이 1.3% 등순이었다.    삼성전자는 전체 TV판매실적에서도 34.4%로 부동의 1위를 유지했다. 이어 LG 18.2%, 소니 10.4%, 파나소닉 3.3% 등이 뒤를 이었다.    즉, 삼성전자는 프리미엄TV 판매실적은 물론 전체 TV판매실적에서도 모두 선두를 차지하면서 부동의 TV 지존의 자리를 고수하고 있는 것이다.    그러나 해외 TV시장조사기관에 따라 삼성전자를 비롯한 국내외 TV기업별 시장점율 분석이 상반된 결과를 내놓으면서 신뢰성에 의문을 갖게 하고 있다.    실제, 지난 28일 일부 언론은 글로벌 시장조사업체 IHS의 자료를 인용해 소니가 올해 2·4분기 판매가격 1500달러 이상 프리미엄 TV 시장에서 36.1%의 점유율을 기록하면서 삼성전자를 추월해 1위를 차지했다는 내용을 골자로 하는 분석결과를 공개했다.    이는 같은 기간 글로벌 시장조사업체인 Gfk의 시장분석결과와 극명하게 달라서 논란을 불러일으키고 있다.    이와 관련, TV업계 관계자는 ""IHS와 Gfk의 시장조사결과가 너무 상반돼 이해할 수 없다""면서 ""54개국의 조사대상으로 삼은 Gfk의 시장조사결과에 따르면 삼성은 소니와 프리미엄 TV판매실적은 물론 전체 TV판매실적에서 격차를 보이면서 세계 1위라는 사실에 변함이 없다""고 전했다.    courage@fnnews.com 전용기 기자       ▶ 세상의 모든 골 때리는 이야기 \'fn파스\'▶ 속보이는 연예뉴스 fn스타  ※ 저작권자 ⓒ  파이낸셜뉴스. 무단 전재-재배포 금지파이낸셜뉴스 관련뉴스해당 언론사에서 선정하며 언론사 페이지(아웃링크)로 이동해 볼 수 있습니다.별장에서 벌거벗은 男 웃는 사진, 꽃뱀의 최후불에 탄 주택서 남녀 숨진 채 발견, 이웃주민 하는말이..한국당 결국 폭발, 文 대통령 향해 ""5년 뒤에..""불륜녀로 찍힌 걸그룹 출신 여성의 최후배고플 때 호두를 먹으면 생기는 놀라운 변화좋아요0훈훈해요0슬퍼요0화나요0후속기사 원해요0기사제공 :']"
