,회사명,날짜,언론사,기사제목,링크,본문
3,삼성전자, 2017-03-1107:58,뉴시스 ,[하만 삼킨 삼성]이재용 부회장 '책임경영' 첫 M&A…신성장엔진 '가동',https://finance.naver.com/news/news_read.nhn?article_id=0007821800&office_id=003&mode=search&query=삼성전자&page=3,"['       [하만 삼킨 삼성]이재용 부회장 \'책임경영\' 첫 M&A…신성장엔진 \'가동\'      기사입력2017-03-11 07:58기사원문좋아요훈훈해요좋아요 평가하기공감좋아요0훈훈해요0슬퍼요0화나요0후속기사 원해요0댓글【서울=뉴시스】삼성전자 손영권 사장과 하만 디네쉬 팔리월 CEO가 5일(현지시간) 미국 라스베이거스의 하드락 호텔(Hard Rock Hotel)에 마련된 약 440평 규모의 하만 전시장에서 하만의 JBL 사운드 바를 설치한 데모차량을 둘러보고 있다. 2017.01.06. (사진=삼성전자 제공)    photo@newsis.com【서울=뉴시스】이연춘 기자 = 총수부재로 어수선한 삼성전자가 신성장 엔진에 다시 시동을 걸었다.  삼성전자는 11일(미국 현지시간 10일) 하만 인수를 최종 마무리했다고 밝혔다..  삼성전자는 지난해 11월 14일 하만과 인수 계약을 체결한 이후, 하만 주주총회 승인, 미국을 비롯한 10개 반독점 심사 대상국의 승인 등 인수에 필요한 모든 절차를 마쳤다.  재계에 따르면 하만 인수 작업은 이재용 삼성전자 부회장이 진두지휘하며 깊숙이 개입한 빅딜이었다.  그는 하만 인수 이전에 열린 삼성전자 임시 주주총회에서의 등기이사 선임을 앞두고 미국으로 출장을 떠나 하만 인수합병(M&A)을 담판지은 것으로 알려졌다. 이후 이 부회장이 등기이사에 올라 책임경영 전면에 나서면서 하만인수 작업은 급물살을 탔다.   투트랙 전략으로 지시를 받은 삼성전자 M&A 담당팀은 하만 측과 지속적으로 접촉하면서 하만 인수를 위한 가격 협상에 본격적으로 나섰다.    최초 하만 측이 인수 금액으로 내건 금액은 15조원에 달하는 것으로 알려졌지만 삼성전자 M&A 담당팀과의 협상 과정에서 인수대금 규모는 9조3000억원 규모로 최종 합의됐다.  이후 하만의 디네쉬 팔리월 최고경영자(CEO)가 한국을 방문, 이 부회장과 만나 하만을 통해 삼성전자가 구상하는 구체적인 사업계획을 교환했다.  지난달 하만의 소액주주들이 삼성전자와의 합병을 추진하는 과정에서 \'신의성실의 의무\'를 위반했다고 집단 소송을 내는 등 적지 않은 난항도 있었지만 회사는 주주들을 만나 설득하는 작업을 펼쳤고, 일부 소액주주들을 대상으로 합병에 대한 당위성을 설명하는데 총력을 기울였다.  이를 통해 반독점 심사 대상 10개국 합병 승인 완료로 인수 절차는 마무리됐고 하만의 주주들은 보유주식 1주당 112달러의 현금을 지급받게 되며, 삼성전자는 미국법인(SEA)이 하만의 지분 100%를 보유하게 된다. 업계는 반도체와 디스플레이 등을 중심으로 전장사업을 준비해 온 삼성전자가 하만을 인수함으로써, 전장사업분야 토탈 솔루션 기업으로 도약할 수 있는 발판을 마련했다는 평가를 내놨다. 손영권 삼성전자 전략혁신센터(SSIC) 사장 겸 하만 이사회 의장은 ""삼성전자와 하만은 오디오, 가전, 스마트폰 등 다양한 분야에서 기술과 경험을 공유함으로써 고객들에게 혁신적이고 독창적인 제품과 차별화된 경험을 제공하고, 커넥티드카 분야의 기술혁신을 선도해 완성차 업체에게 최고의 파트너가 될 것""이라고 말했다. 한편 하만은 디네쉬 사장을 비롯한 현재의 경영진에 의해 독립적으로 경영되며, 임직원과 본사, 해외사업장은 물론 하만이 보유한 브랜드도 그대로 유지할 계획이다. lyc@newsis.com 뉴시스 뉴스, 네이버 뉴스 스탠드에서도 만나세요뉴시스 SNS [페이스북] [트위터]뉴시스 관련뉴스해당 언론사에서 선정하며 언론사 페이지(아웃링크)로 이동해 볼 수 있습니다.""피임약 먹어!""…10대 동거녀 성매매 강요\'입술서 DNA 검출\' 투숙객 성폭행 시도 종업원 구속엄지손가락 5개 갖고 태어난 아기…""수술 성공적""朴 전 대통령, 삼성동 사저 시설보완뒤 주말께 갈듯장시호 ""최순실 \'박근혜 파면\'에 대성통곡"" 법정증언좋아요0훈훈해요0슬퍼요0화나요0후속기사 원해요0기사제공 :']"
4,삼성전자, 2017-03-1107:58,뉴시스 ,"[하만 삼킨 삼성]新성장동력 확보…""커넥티드카 혁신기술 선도하겠다""",https://finance.naver.com/news/news_read.nhn?article_id=0007821799&office_id=003&mode=search&query=삼성전자&page=3,"['       [하만 삼킨 삼성]新성장동력 확보…""커넥티드카 혁신기술 선도하겠다""      기사입력2017-03-11 07:58기사원문좋아요훈훈해요좋아요 평가하기공감좋아요0훈훈해요0슬퍼요0화나요0후속기사 원해요0댓글【서울=뉴시스】하만 디네쉬 팔리월 CEO와 삼성전자 손영권 사장이 5일(현지시간) 미국 라스베이거스의 하드락 호텔(Hard Rock Hotel)에 마련된 약 440평 규모의 하만 전시장 앞에서 기념 촬영을 하고 있다. 2017.01.06. (사진=삼성전자 제공)    photo@newsis.com【서울=뉴시스】이연춘 기자 = 삼성전자가 11일(미국 현지시간 10일) 하만 인수를 최종 마무리했다.  삼성전자는 지난해 11월 14일 하만과 인수 계약을 체결한 이후, 하만 주주총회 승인, 미국을 비롯한 10개 반독점 심사 대상국의 승인 등 인수에 필요한 모든 절차를 마쳤다고 밝혔다.  인수 절차가 마무리됨에 따라, 삼성전자 전장사업팀은 삼성이 보유한 혁신적인 기술들을 하만의 전장 제품에 접목하고, 구매, 물류, 마케팅 등 여러 분야에서 시너지를 낼 수 있도록 하만과 협력을 확대해 나갈 방침이다. 삼성전자가 하만을 인수한 이유로는 하만의 높은 기술력 등이 꼽힌다.  기존 전장업체를 통해 선도 업체와의 경쟁력 차이를 단기간내에 좁히고 새로운 제품을 개발하는 한편 업계 지배력을 높여나가겠다는 의도 아래 하만 인수를 추진했다.  하만의 경험과 삼성의 5G, 디스플레이 기술 등이 융합될 경우 미래 주요사업으로 꼽히는 자율주행차 업계에서 두각을 나타낼 수 있다는 자신감도 인수 배경이다.  하만 인수에 대한 중요도를 반영하 듯 삼성전자는 80억 달러를 인수 금액으로 배팅했다. 우리나라 돈으로 환산하면 9조3000억원에 이르는 초대형 계약이다.  삼성은 하만 인수를 통해 그룹 계열사 내 시너지 효과도 극대화 될 전망이다.  당장 삼성전자와 삼성SDI, 삼성전기, 삼성디스플레이 등 전자 계열사들은 차량용 부품 사업 분야를 확대할 수 있는 모멘텀을 얻을 것으로 기대된다.  세부적으로 삼성전자의 커넥티드 카 시스템 분야, 텔레매틱스, 보안 등 소프트웨어를 포함한 포괄적인 차량용 인포테인먼트 시스템 사업에 대한 진출이 급물살을 탈 전망이다.  시장 일각에서는 삼성전자의 하만 인수에 대해 기존 사업과의 시너지가 예상된다고 보고 있다.  이세철 NH투자증권 연구원은 ""삼성전자는 자율주행과 인포테인먼트 연구 개발을 추진해왔다""며 ""하만 인수로 인포테인먼트 분야에서 단숨에 시장 1위로 진입할 수 있다""고 평가했다. 자율주행 등 추가 전장 사업에 진입하면 삼성전자는 전장의 양대 축인 안전과 편의 기술 사업을 완성하게 된다고 이 연구원은 내다봤다.  하만의 디네쉬 팔리월(Dinesh Paliwal) CEO(사장)는 ""삼성은 하만이 보유한 고객과의 신뢰관계는 물론 스피드와 혁신을 중시하는 문화를 공유할 수 있는 가장 이상적인 주주이자 파트너""라며 ""이번 인수합병을 통해 주주, 고객, 임직원 모두에게 새로운 가치와 기회를 제공하고, 자동차 전장과 오디오 등의 분야에서 성장을 가속화해 글로벌 리더십을 강화할 것""이라고 밝혔다. lyc@newsis.com뉴시스 뉴스, 네이버 뉴스 스탠드에서도 만나세요뉴시스 SNS [페이스북] [트위터]뉴시스 관련뉴스해당 언론사에서 선정하며 언론사 페이지(아웃링크)로 이동해 볼 수 있습니다.""피임약 먹어!""…10대 동거녀 성매매 강요\'입술서 DNA 검출\' 투숙객 성폭행 시도 종업원 구속47층서 떨어졌는데…창문 청소부 기적의 생존朴 전 대통령, 삼성동 사저 시설보완뒤 주말께 갈듯장시호 ""최순실 \'박근혜 파면\'에 대성통곡"" 법정증언좋아요0훈훈해요0슬퍼요0화나요0후속기사 원해요0기사제공 :']"
5,삼성전자, 2017-03-1107:51,머니투데이 ,"삼성전자, 美 하만 인수 완료..""혁신기술 접목, 시너지 모색""",https://finance.naver.com/news/news_read.nhn?article_id=0003836638&office_id=008&mode=search&query=삼성전자&page=3,"['       삼성전자, 美 하만 인수 완료..""혁신기술 접목, 시너지 모색""      기사입력2017-03-11 07:51기사원문좋아요훈훈해요좋아요 평가하기공감좋아요0훈훈해요0슬퍼요0화나요0후속기사 원해요0댓글 [머니투데이 임동욱 기자] [現 경영진 독립경영·브랜드 유지, ""기술과 경험 공유..글로벌 리더십 강화""]디네쉬 팔리월 하만(Harman) 최고경영자가 21일 오후 서울 서초구 삼성전자 사옥에서 열린 미디어 간담회에서 삼성전자 전략혁신센터 손영권 사장(왼쪽), 전장사업팀 박종환 부사장(오른쪽)과 함께 손을 잡고 있다.삼성전자가 11일(미국 현지시간 10일) 하만 인수를 완료했다고 공식 발표했다.  삼성전자는 지난해 11월 14일 하만과 인수 계약을 체결한 이후, 하만 주주총회 승인, 미국을 비롯한 10개 반독점 심사 대상국의 승인 등 인수에 필요한 모든 절차를 마쳤다. 하만의 주주들은 보유주식 1주당 112달러의 현금을 지급받게 되며, 삼성전자 미국법인(SEA)이 하만의 지분 100%를 보유하게 된다. 손영권 삼성전자 전략혁신센터(SSIC) 사장 겸 하만 이사회 의장은 ""삼성전자와 하만은 오디오, 가전, 스마트폰 등 다양한 분야에서 기술과 경험을 공유함으로써 고객들에게 혁신적이고 독창적인 제품과 차별화된 경험을 제공하고, 커넥티드카 분야의 기술혁신을 선도해 완성차 업체에게 최고의 파트너가 될 것""이라고 말했다. 디네쉬 팔리월 하만 CEO(사장)는 ""삼성은 하만이 보유한 고객과의 신뢰관계는 물론 스피드와 혁신을 중시하는 문화를 공유할 수 있는 가장 이상적인 주주이자 파트너""라며 ""이번 인수합병을 통해 주주, 고객, 임직원 모두에게 새로운 가치와 기회를 제공하고, 자동차 전장과 오디오 등의 분야에서 성장을 가속화해 글로벌 리더십을 강화할 것""이라고 밝혔다. 삼성전자 전장사업팀은 삼성이 보유한 혁신 기술들을 하만의 전장 제품에 접목하고, 구매, 물류, 마케팅 등 여러 분야에서 시너지를 낼 수 있도록 하만과 협력을 확대해 나갈 방침이다. 하만은 디네쉬 사장을 비롯한 현재의 경영진에 의해 독립적으로 경영되며, 임직원과 본사, 해외사업장은 물론 하만이 보유한 브랜드도 그대로 유지할 계획이다.[▶깊이있는 투자정보 \'TOM칼럼\'][▶트렌드 리더의 스타일 지침서 \'스타일M\'][▶빵빵한 차&레이싱걸]임동욱 기자 dwlim@mt.co.kr머니투데이 관련뉴스해당 언론사에서 선정하며 언론사 페이지(아웃링크)로 이동해 볼 수 있습니다.정미홍 ""누구 좋으라고 죽나?""…\'목숨\' 발언 해명포항서 지하 200m 암반 뚫다 천연가스 불길 계속 치솟아탄핵 확정에 삼성동 사저도 초비상, ""큰일났다""탄핵 반대 시위현장서 2명 사망·2명 중환자실[포토is…]""대통령이 탄핵됐다""…20170310 광화문 학교 서울역좋아요0훈훈해요0슬퍼요0화나요0후속기사 원해요0기사제공 :']"
6,삼성전자, 2017-03-1107:45,연합뉴스 ,"삼성전자, 하만 인수 완료…단숨에 글로벌 전장업체로",https://finance.naver.com/news/news_read.nhn?article_id=0009099363&office_id=001&mode=search&query=삼성전자&page=3,"['       삼성전자, 하만 인수 완료…단숨에 글로벌 전장업체로      기사입력2017-03-11 07:45기사원문좋아요훈훈해요좋아요 평가하기공감좋아요0훈훈해요0슬퍼요0화나요0후속기사 원해요0댓글삼성전자, 하만 인수 완료…단숨에 글로벌 전장업체로 (CG)[연합뉴스TV 제공](서울=연합뉴스) 정성호 기자 = 삼성전자가 미국의 자동차 전장(전자장비) 업체 하만(Harman)을 결국 품에 안았다.    삼성전자는 11일(현지시간 10일) 미국을 비롯한 10개 반독점 심사 대상국의 승인 등 인수에 필요한 모든 절차를 마치고 하만을 인수했다고 밝혔다.    지난해 11월 14일 하만과 인수 계약을 체결한 지 약 4개월 만이다. 지난달 18일에는 하만이 주주총회를 열어 승인을 받아냈다.    이에 따라 삼성전자는 총수인 이재용 부회장의 구속이라는 비상상황 속에서도 9조 원대 \'빅 딜\'을 안정적으로 성사시켰다.    미래 성장동력으로 지목해 진출을 추진해온 전장 사업 분야에서 확고한 사업 기반을 마련하며 단숨에 글로벌 메이저 전장업체로 이름을 올리게 됐다.    인수 완료에 따라 하만의 주주들은 보유주식 1주당 112달러의 현금을 받는다. 삼성전자는 미국법인(SEA)을 통해 하만의 지분을 100% 보유하게 된다.    다만 하만의 경영은 디네쉬 팔리월(Paliwal) 하만 사장(CEO)을 비롯한 현재의 경영진에 의해 독립적으로 이뤄진다.    또 임직원과 본사, 해외사업장은 물론 하만이 보유한 브랜드도 그대로 유지된다.    손영권 삼성전자 전략혁신센터(SSIC) 사장 겸 하만 이사회 의장은 ""삼성전자와 하만은 오디오, 가전, 스마트폰 등 다양한 분야에서 기술과 경험을 공유함으로써 고객들에게 혁신적이고 독창적인 제품과 차별화된 경험을 제공하고, 커넥티드카 분야의 기술 혁신을 선도해 완성차 업체에 최고의 파트너가 될 것""이라고 말했다.    하만의 디네쉬 팔리월(Paliwal) CEO(사장)는 ""삼성은 하만이 보유한 고객과의 신뢰관계는 물론 스피드와 혁신을 중시하는 문화를 공유할 수 있는 가장 이상적인 주주이자 파트너""라고 말했다.    그는 또 ""이번 인수합병을 통해 주주, 고객, 임직원 모두에게 새로운 가치와 기회를 제공하고, 자동차 전장과 오디오 등의 분야에서 성장을 가속화해 글로벌 리더십을 강화할 것""이라고 강조했다.    삼성전자 전장사업팀은 삼성이 보유한 혁신적 기술들을 하만의 전장 제품에 접목하고, 구매, 물류, 마케팅 등 여러 분야에서 시너지를 낼 수 있도록 하만과 협력을 확대해 나갈 방침이다.    sisyphe@yna.co.kr최신 유행 트렌드 총집결 #흥(클릭!)연합뉴스 관련뉴스해당 언론사에서 선정하며 언론사 페이지(아웃링크)로 이동해 볼 수 있습니다.\xa0장시호 ""최순실, 朴대통령 탄핵된 것 알고 대성통곡""\xa0탄핵시 자살예고한 탄핵반대 가수 이광필 ""못하겠다""\xa0朴 탄핵 BBC 인터뷰 생방송 사고(?) 낸 英 교수\xa0알래스카서 거대 유전 발견…美육지 유전으로는 30년 만에 최대\xa0美국방부 ""사드 한국 배치 위해 장비 계속 보낼 것""좋아요0훈훈해요0슬퍼요0화나요0후속기사 원해요0기사제공 :']"
7,삼성전자, 2017-03-1107:34,머니S ,[머니S톡] 갤럭시S8에 쏠린 눈… 미리 담을 종목은?,https://finance.naver.com/news/news_read.nhn?article_id=0000237077&office_id=417&mode=search&query=삼성전자&page=3,"[""       [머니S톡] 갤럭시S8에 쏠린 눈… 미리 담을 종목은?      기사입력2017-03-11 07:34기사원문좋아요훈훈해요좋아요 평가하기공감좋아요0훈훈해요0슬퍼요0화나요0후속기사 원해요0댓글본문 이미지 영역삼성전자 갤럭시 언팩 초청장. /사진제공=삼성전자갤럭시S8 출시가 임박했다. 삼성전자가 갤럭시노트7의 실패를 만회하기 위해 이번 갤럭시S8에 심혈을 기울였다는 소식이 전해지면서 기대감이 더 커졌다. 이에 주식시장에서는 삼성전자의 호실적을 예상하며 주가가 강세를 보인다. 예상대로 갤럭시S8이 잘 팔리면 관련부품주의 실적도 양호할 것으로 전망된다.◆갤S8 기대감에 삼성전자 ‘203만원’ 기록삼성전자는 오는 29일 미국 뉴욕 링컨센터에서 ‘삼성 갤럭시 언팩’ 행사를 열고 갤럭시S8을 공개한다고 밝혔다. 삼성전자는 이번 갤럭시S8에서 브랜드 가치를 높이고 삼성의 혁신적 이미지를 공고히 하겠다는 전략이다.현재까지 알려진 갤럭시S8의 주요 사양은 다음과 같다. AP는 스냅드래곤 835와 엑시노스9 칩이 출시지역에 따라 탑재될 것으로 전망되며 쿼드 HD 슈퍼 아몰레드 디스플레이, 64GB 내장 메모리, 4GB램, 1200만화소 듀얼 픽셀 후면 카메라와 800만화소 전면 카메라, 홍채인식 스캐너 등이다.이 같은 기존 갤럭시 시리즈와의 차별화된 성능이 갤럭시S8의 기대감을 높인다. 벌써부터 소비자 사이에서는 갤럭시S8의 유출 사진이 돌고 있고 성능과 관련한 토론이 진행되는 중이다. 따라서 업계에서는 갤럭시S8의 올해 판매량을 6000만대로 추산하며 역대 최고기록을 예상한다.특히 삼성전자는 이번 신제품으로 지난해 갤럭시노트7 발화사고로 잃은 신뢰를 되찾겠다는 각오다. 노경탁 유진투자증권 애널리스트는 “갤럭시S8의 성공적인 출시로 삼성전자 스마트폰사업의 실적확대는 올 2분기부터 본격화할 것”이라며 “2분기 영업이익 12조1000억원으로 사상 최고를 기록할 가능성도 있다”고 전망했다.이 같은 갤럭시S8에 대한 기대감은 삼성전자의 주가 상승을 견인했다. 지난 8일 삼성전자는 장중 203만1000원을 기록하며 역대 최고수준을 경신했다. 수급별로는 외국인이 이달 들어 6거래일 중 단 하루 빼고 전부 순매수세를 보이며 주가 상승동력으로 작용했다.◆실적 반영되는 시기 노려라갤럭시S8의 성공적인 판매의 과실은 관련 부품주도 함께 누릴 것으로 예상된다. 갤럭시S8 관련 부품주는 삼성전기, 제일기획, 세코닉스 등이다. 다만 지난해 말부터 삼성전자와 함께 부품주에 대한 관심도 높았던 터라 갤럭시S8이 공개되면 주가가 조정받을 수 있다. 이에 본격적으로 갤럭시S8의 실적이 가시화되는 시점에 매수 기회를 노리라는 의견이다.삼성전기는 갤럭시S8에 탑재되는 카메라 모듈과 MLCC(적층세라믹콘덴서) 등 고부가가치 제품 수주 효과를 누릴 것으로 예상된다. 박원재 미래에셋대우 애널리스트는 “갤럭시S8 출시가 4월이라면 삼성전기의 실적은 2분기부터 본격 개선될 것”이라고 분석했다.제일기획은 주요 광고주인 삼성전자가 대규모의 갤럭시S8 광고를 집행할 것으로 기대됨에 따라 수혜를 입을 전망이다. 홍세종 신한금융투자 애널리스트는 “주요 광고주인 삼성전자의 갤럭시S8 출시에 따른 광고물량 인식은 2분기부터 이뤄질 것”이라며 “갤럭시S8 효과로 2분기 해외 매출총이익은 유럽과 인도, 동남아 성장 주도로 10% 증가한 1962억원을 기록할 것”이라고 분석했다.카메라렌즈업체 세코닉스는 갤럭시S8뿐 아니라 LG G6에도 모바일용 렌즈를 공급 중이어서 동시 수혜가 가능하다는 분석이다. 박종선 유진투자증권 애널리스트는 “세코닉스 매출에서 모바일용 렌즈가 차지하는 비중이 57.1%”라며 “신제품 출시 초기에 제품을 공급할 역량을 가져 고수익을 얻을 수 있다”고 분석했다.하준두 신한금융투자 애널리스트는 “삼성전자의 갤럭시S8 본격 생산이 3월로 예정됐기 때문에 부품 공급은 2~3월에 대부분 시작된다”며 “이들 업체는 1분기에서 2분기까지 차례로 실적이 개선될 것”이라고 내다봤다.실시간 재테크 경제뉴스│창업정보의 모든 것장효원 기자 머니S 관련뉴스해당 언론사에서 선정하며 언론사 페이지(아웃링크)로 이동해 볼 수 있습니다.[머니S톡] LG전자, 'G6' 타고 훨훨 날까미래에셋대우, 애플-텐센트홀딩스 ELS 판매NH투자증권, 김원규 사장 재선임 결의금값, 닷새 연속 하락… 미국 금리인상 전망↑미국 국채수익률 소폭 상승… 물량 부담↑좋아요0훈훈해요0슬퍼요0화나요0후속기사 원해요0기사제공 :""]"
8,삼성전자, 2017-03-1107:33,뉴스1 ,"삼성전자, 美 전장기업 '하만' 인수 완료",https://finance.naver.com/news/news_read.nhn?article_id=0002604909&office_id=421&mode=search&query=삼성전자&page=3,"['       삼성전자, 美 전장기업 \'하만\' 인수 완료      기사입력2017-03-11 07:33기사원문좋아요훈훈해요좋아요 평가하기공감좋아요0훈훈해요0슬퍼요0화나요0후속기사 원해요0댓글삼성전자 손영권 사장과 하만 디네쉬 팔리월 CEO가 5일(현지시간) 미국 라스베이거스 하드락 호텔(Hard Rock Hotel)에 마련된 약 440평 규모의 하만 전시장에서 자율주행용 사용자경험(user experience)을 구현한 오아시스 컨셉차량을 소개하고 있다. (삼성전자 제공) 2017.1.6/뉴스1 (상보)반독점 심사 대상 10개국 합병 승인 완료(서울=뉴스1) 장은지 기자 = 삼성전자가 11일(현지시간 10일) 미국 전장기업 \'하만\' 인수를 완료했다. 삼성전자는 지난해 11월 14일 하만과 인수 계약을 체결한 이후, 하만 주주총회 승인 및 미국을 비롯한 10개 반독점 심사 대상국의 승인 등 인수에 필요한 모든 절차를 마쳤다. 인수가 완료됨에 따라 하만의 주주들은 보유주식 1주당 112달러의 현금을 지급받게 된다. 삼성전자는 미국법인(SEA)이 하만의 지분 100%를 보유하게 된다.  손영권 삼성전자 전략혁신센터(SSIC) 사장 겸 하만 이사회 의장은 ""삼성전자와 하만은 오디오, 가전, 스마트폰 등 다양한 분야에서 기술과 경험을 공유함으로써 고객들에게 혁신적이고 독창적인 제품과 차별화된 경험을 제공하고, 커넥티드카 분야의 기술혁신을 선도해 완성차 업체에게 최고의 파트너가 될 것""이라고 말했다.  하만의 디네쉬 팔리월(Dinesh Paliwal) CEO(사장)는 ""삼성은 하만이 보유한 고객과의 신뢰관계는 물론 스피드와 혁신을 중시하는 문화를 공유할 수 있는 가장 이상적인 주주이자 파트너""라며 ""이번 인수합병을 통해 주주, 고객, 임직원 모두에게 새로운 가치와 기회를 제공하고, 자동차 전장과 오디오 등의 분야에서 성장을 가속화해 글로벌 리더십을 강화할 것""이라고 밝혔다. 인수 절차가 마무리됨에 따라 삼성전자 전장사업팀은 삼성이 보유한 혁신적인 기술들을 하만의 전장 제품에 접목하고, 구매, 물류, 마케팅 등 여러 분야에서 시너지를 낼 수 있도록 하만과 협력을 확대한다.   하만은 디네쉬 사장을 비롯한 현재의 경영진에 의해 독립적으로 경영되며 임직원과 본사, 해외사업장은 물론 하만이 보유한 브랜드도 그대로 유지할 계획이다.seeit@▶ 놓치면 후회! 최신 만화 보기 / 2017년 나의 운세 보기▶ 여러분의 제보를 기다립니다. 제보하기(클릭!)[© 뉴스1코리아(news1.kr), 무단 전재 및 재배포 금지]뉴스1 관련뉴스해당 언론사에서 선정하며 언론사 페이지(아웃링크)로 이동해 볼 수 있습니다.탄핵선고일 긴장했나…이정미 대행 뒷머리에 헤어 롤 두개가장시호 ""최순실, 박근혜 대통령 파면 알고 대성통곡""해외출장 중 여비서 방에 들어가 강제추행 회장님55일 된 아들 모르는 여성에게 넘긴 아버지소 15마리 축사 집단탈출…5마리 화물차와 충돌좋아요0훈훈해요0슬퍼요0화나요0후속기사 원해요0기사제공 :']"
