,회사명,날짜,언론사,기사제목,링크,본문
5,삼성전자, 2017-09-2815:49,뉴스1 ,[시황종합] 외인·기관 동반 '팔자'에도 하락세 끊은 코스피,https://finance.naver.com/news/news_read.nhn?article_id=0002970464&office_id=421&mode=search&query=삼성전자&page=3,"['       [시황종합] 외인·기관 동반 \'팔자\'에도 하락세 끊은 코스피      기사입력2017-09-28 15:49기사원문좋아요훈훈해요좋아요 평가하기공감좋아요0훈훈해요0슬퍼요0화나요0후속기사 원해요0댓글외국인 1365억·기관 421억 순매도…8일만에 반등달러/원 환율 7월11일 이후 최고…1149.1원 마감(서울=뉴스1) 김태헌 기자 = 외국인과 기관이 동반 매도에 나선 가운데서도 코스피가 8거래일 만에 반등해 2370선을 지켰다. 달러/원 환율은 1150원선 턱밑까지 올랐다. 지난 7월11일 이후 두달 반 만에 최고치다. 전날보다 8.4원 오른 1149.1원에 마쳤다.28일 코스피는 전날보다 0.57포인트(0.02%) 오른 2373.14로 장을 마쳤다. 지난 18일 이후 7거래일 연속 하락 곡선을 그리던 지수가 8거래일 만에 상승했다.이날 개인은 홀로 1191억원을 순매수했다. 외국인과 기관은 각각 1365억원, 421억원씩 순매도했다. 외국인은 지난 25일 이후 4거래일 연속 순매도다. 장 시작 이후 외국인은 매도 폭을 계속 키웠고, 기관은 장 마감 직전 매도 폭을 약 1000억원에서 600억원 이상을 줄였다.시가총액 상위종목 등락은 엇갈렸다. 삼성전자는 전날보다 2만1000원(0.81%) 내린 256만3000원에 거래를 마쳤다. 현대차와 삼성물산이 약보합세 마감했다. SK하이닉스와 포스코, LG화학, 신한지주 등은 올랐다.코스닥은 전날보다 1.15포인트(0.18%) 떨어진 648.09로 거래를 마감했다. 개인과 기관이 각각 102억원, 128억원을 순매수한 반면 외국인이 190억원을 순매도했다. 외국인은 지난 20일(441억원 순매수) 이후 7거래일 만에 코스닥을 순매도했다.시총 상위주 대부분 하락 마감했다. 셀트리온과 셀트리온헬스케어, 메디톡스, 신라젠, 휴젤, 바이로메드가 내렸다. 로엔과 코미팜, SK머티리얼즈가 약간 상승했다.달러/원 환율은 지난 7월11일(1151.1원) 이후 최고치를 기록했다. 28일 달러/원 환율은 전거래일보다 8.4원 오른 1149.1원에 장을 마쳤다. 지난 25일(1131.8원) 이후 사흘 만에 17.3원이나 올랐다. 미국의 트럼프 감세안으로 달러가 뛰고 국채가 급락하는 등 주요 시장이 급격하게 방향을 튼 영향을 받았다. 달러와 금리 기대감이 뛰어 오르면서 ‘변곡점’ 혹은 ‘유턴’이 일어났다고 블룸버그는 표현했다.solidarite4u@▶ 뉴스1 [Book] 오픈! 실천 핀테크!▶ 뉴스1 공채 수습기자 모집 중(~10/15)▶ 여러분의 제보를 기다립니다.제보하기![© 뉴스1코리아(news1.kr), 무단 전재 및 재배포 금지]뉴스1 관련뉴스해당 언론사에서 선정하며 언론사 페이지(아웃링크)로 이동해 볼 수 있습니다.200명 탄 아시아나 조종석에선…""물병 던지며 싸웠다""홍준표, 문정인 겨냥 ""王특보 마구잡이 발언 소름끼쳐""女속옷 192점 훔친 초등교사…왜 그랬을까아내 불륜남 상대 1억3500만원 뜯은 경찰전기 흐르는 쇠꼬챙이로 개 도살…2심도 무죄좋아요0훈훈해요0슬퍼요0화나요0후속기사 원해요0기사제공 :']"
6,삼성전자, 2017-09-2815:47,서울경제 ,"[마감시황]코스피, 8거래일 만에 상승 마감",https://finance.naver.com/news/news_read.nhn?article_id=0003122274&office_id=011&mode=search&query=삼성전자&page=3,"['       [마감시황]코스피, 8거래일 만에 상승 마감      기사입력2017-09-28 15:47기사원문좋아요훈훈해요좋아요 평가하기공감좋아요0훈훈해요0슬퍼요0화나요0후속기사 원해요0댓글 [서울경제] 코스피 지수가 28일 8거래일 만에 상승 마감했다. 다만 2,370대 초반에 머무르며 상승 동력을 나타내지는 못했다. 이날 코스피 지수는 전날보다 0.57포인트(0.02%) 오른 2373.14에 장을 마쳤다. 전날 대비 1.53포인트(0.06%) 오른 2,374.10에 출발한 이날 지수는 뚜렷한 상승 동력을 찾지 못하고 횡보했다. 이날 개인 투자자만 순매수를 보이고 외국인과 기관투자자는 모두 ‘팔자’에 나선 것이 지수 보합세의 원인이다. 이날 외국인은 총 1,366억원어치의 국내 상장 주식을 팔았고, 기관은 421억원어치의 주식을 역시 순매도했다. 개인만 1,192억어치 주식을 사들였다. 최근 한반도 군사 위험이 계속되고 있고, 열흘에 가까운 추석 연휴까지 앞두고 있어 투자 심리가 당분간은 큰 폭으로 회복되지 않을 가능성이 크다. 코스피 시가총액 상위 종목을 보면 삼성전자(-0.81%), 삼성전자우(-0.34%), 현대차(-0.34%), 삼성물산(-1.11%), NAVER(-0.14%)는 약세를 나타낸 반면 SK하이닉스(0.97%), POSCO(1.28%), LG화학(2.12%), 한국전력(0.39%)은 강세를 나타냈다. 업종별로 살펴보면 사무용 전자제품(5.51%), 창업투자(4.53%), 화장품(2.88%) 등이 상승세였고 전기제품(-4.01%), 해운사(-2.95%), 생물공학(-1.69%) 등은 하락세였다. 코스닥 지수는 이날 전 거래일 대비 1.15포인트(0.18%) 내린 648.09에 장을 마쳤다. 이날 지수는 전 거래일 대비 2.68포인트(0.41%) 오른 651.92에 출발했다. 최근 코스피 조정 기간 동안 코스닥에 투자를 집중했던 외국인들은 이날은 순매도(187억원)했다.   이날 달러 대비 원화는 전 거래일보다 8원40전 오른 1,149원10전에 마감했다. /조양준기자 mryesandno@sedaily.com[서울경제 바로가기]1997년 이래 대한민국 최고의 과학자 DB [바로가기]서울경제의 모든 연재물!... 서경Cube [바로가기▶]저작권자 ⓒ 서울경제, 무단 전재 및 재배포 금지서울경제 관련뉴스해당 언론사에서 선정하며 언론사 페이지(아웃링크)로 이동해 볼 수 있습니다.차주혁 과거 힘 과시? ""맘에 안 들면 한판 붙든지"" 판사 ""상당히 마약에 중독돼""\'당신이 잠든 사이에\' 수지, 남다른 고혹적 미모···""첫방송이라니!""라이머♥안현모, 웨딩 촬영 영상 공개···""행복한 가정 꾸리겠습니다""[시청률NOW] \'당신이 잠든 사이에\' 수목극 2위···\'병원선\' 바짝 추적\'서해순 인터뷰\' 거짓이었다? 이미 사망했는데 ""서연이 공부하고 있다"" 소름좋아요0훈훈해요0슬퍼요0화나요0후속기사 원해요0기사제공 :']"
7,삼성전자, 2017-09-2815:46,매일경제 ,"코스피, 장기 휴장 앞두고 나흘째 보합세",https://finance.naver.com/news/news_read.nhn?article_id=0004023069&office_id=009&mode=search&query=삼성전자&page=3,"['       코스피, 장기 휴장 앞두고 나흘째 보합세      기사입력2017-09-28 15:46기사원문좋아요훈훈해요좋아요 평가하기공감좋아요0훈훈해요0슬퍼요0화나요0후속기사 원해요0댓글 10일간의 추석 연휴 휴장을 앞둔 코스피가 나흘째 약보합세를 보였다. 코스피 시장 거래량이 이틀 연속 연중 최저치를 기록하는 등 관망세가 뚜렷했다. 28일 코스피는 전일 대비 0.57포인트(0.02%) 내린 2373.14에 거래를 마쳤다.이날 코스피는 1.53포인트 오른 2374.10에 개장한 뒤 장중 2370선 부근에서 지지부진한 흐름을 보였다. 지수는 이날을 포함해 4거래일 연속 보합권에 머물고 있다. 특히 이날 유가증권시장 거래량은 1억9073만주로, 전날에 이어 이틀째 연중 최저치를 찍었다. 장기 휴장을 앞두고 투자자들의 관망심리가 확산하는 모습이다.지난밤 트럼프 행정부의 세제 개편안이 발표됐지만 투자심리에는 별다른 영향을 미치지 못하고 있다. 미국 행정부와 공화당은 지난밤 감세를 골자로 한 세제개편안을 발표했다. 세제 개혁안은 법인세를 현행 35%에서 20%로 낮췄으며, 최고소득세율도 35%로 낮추는 등의 내용을 담았다. 또 현행 7단계로 나누어져 있는 개인소득 과세구간을 3단계로 단순화하고 자녀세액공제 혜택 대상도 늘리도록 했다. 트럼프 세제개편안 기대감에 지난밤 뉴욕증시는 상승 마감했다. 국내증시는 10일 휴장 이후 본격적인 3분기 어닝 시즌에 돌입한다. 3분기 어닝시즌의 포문을 열 삼성전자의 잠정실적 발표는 내달 13일로 예정돼 있다. 김병연 NH투자증권 연구원은 ""지정학적 리스크, 추석전 관망심리, 긴 휴장에 대한 불확실성 등으로 연휴 이전 지수의 변동성은 높지만 추석 연휴 이후에는 줄였던 주식비중을 다시 채워가는 과정이 진행되기 때문에 코스피는 안정적 흐름을 기록했다""라며 ""특히 이번에는 추석 연휴 이후 바로 실적 시즌에 진입하므로 연휴 이후 시장의 초점은 대내외 리스크에서 실적 펀더멘털로 옮겨갈 것""이라고 말했다. 이어 ""연휴 이후 주식시장의 키 드라이버가 3분기 기업 이익이라면 포트폴리오는 IT 업종을 중심으로 은행, 소재·산업재, 게임·미디어 등의 비중을 확대하는 전략이 유효하다""라고 덧붙였다.업종별로 의료정밀, 섬유·의복, 화학 등이 1~2% 올랐고 운수창고, 의약품, 전기·전자 등은 떨어졌다. 매매주체별로 외국인과 기관이 각각 1365억원, 421억원을 순매도했고 개인은 1191억원을 순매수했다. 프로그램 매매는 919억원 매도 우위를 나타냈다.시가총액 상위 종목들은 혼조세를 보였다. 삼성전자, 삼성물산, 삼성생명 등이 하락했고 SK하이닉스, POSCO, LG화학, 신한지주 등은 강세로 마감했다. 이날 유가증권시장에서는 1개 상한가를 포함해 515개 종목이 상승했고 296개 종목이 하락했다.코스닥은 전일 대비 1.15포인트(0.18%) 오른 648.09에 마감했다. [디지털뉴스국 고득관 기자][매일경제 공식 페이스북] [오늘의 인기뉴스] [매경 프리미엄][ⓒ 매일경제 & mk.co.kr, 무단전재 및 재배포 금지]매일경제 관련뉴스해당 언론사에서 선정하며 언론사 페이지(아웃링크)로 이동해 볼 수 있습니다.\'美친\' 이하늬, 초밀착 의상에 \'명품 글래머 몸매\' 뽐내[단독] 북한에 빌려준 1조원 다 떼일판한채영 \'바비인형의 환생\' [MK화보]\'수중 신대륙\' 질랜디아 해수면 가까이 있었다\'파격\' 손연재, 재킷 딱 한장만 걸친채…\'아슬아슬하게\'좋아요0훈훈해요0슬퍼요0화나요0후속기사 원해요0기사제공 :']"
8,삼성전자, 2017-09-2815:46,디지털타임스 ,내달 12일 이재용 항소심… 박근혜·최순실 증인 채택,https://finance.naver.com/news/news_read.nhn?article_id=0002425035&office_id=029&mode=search&query=삼성전자&page=3,"['       내달 12일 이재용 항소심… 박근혜·최순실 증인 채택      기사입력2017-09-28 15:46기사원문좋아요훈훈해요좋아요 평가하기공감좋아요0훈훈해요0슬퍼요0화나요0후속기사 원해요0댓글 이재용 삼성전자 부회장의 항소심 심리가 내달 12일부터 시작한다. 박근혜 전 대통령과 최순실씨를 증인으로 채택한 가운데 박영수 특별검사팀과 변호인 측은 전초전부터 날 선 공방을 예고했다.이재용 부회장 등 삼성 관계자들의 항소심을 맡은 서울고등법원 형사13부(정형식 부장판사)는 28일 오전 서울 서초동 서울중앙지방법원에서 첫 공판준비기일을 열고 재판 일정 등을 정리했다. 공판준비기일은 정식재판에 앞서 일정이나 쟁점 등을 정리하는 자리여서 이 부회장 등은 모두 재판에 나오지 않았다. 이 부회장은 박 전 대통령과 최씨에게 뇌물을 제공한 혐의 등으로 1심에서 징역 5년을 선고받았다. 재판부는 내달 12일 첫 공판기일을 열기로 하고 세 차례에 걸쳐 주제별로 항소 이유를 듣기로 했다. 그다음 기일부터는 본격적인 서류 증거 조사와 증인 신문을 시작한다.재판부는 또 많은 증인을 부르진 않겠다는 원칙을 내놓으며 특검과 변호인 측의 의견을 취합해 박 전 대통령과 최씨, 덴마크 말 중개인 등 총 6명을 증인으로 채택했다. 변호인 측이 신청한 박원호 전 대한승마협회 전무와 김종 전 문화체육관광부 차관 등에 대해선 증인채택을 보류했다. 재판부는 다만 박 전 대통령과 최씨에 대해선 두 사람의 1심 재판에서 이뤄질 피고인 신문 조서를 증거로 제출하는 방안을 특검에 제안했다. 만약 이 부회장의 항소심 재판이 끝날 때까지 박 전 대통령 재판이 끝나지 않으면 그때 가서 두 사람을 증인으로 부르겠다는 것이다.이런 가운데 특검과 변호인측은 증인 채택을 두고 시작부터 날 선 공방을 했다. 특검 측은 변호인측이 증인으로 요청한 박 전 전무와 김 전 차관에 대해 ""이미 장시간 신문이 이뤄졌다""고 거부했고, 이에 변호인측은 ""특검에서 의견서를 제때 내줬다면 반박하는 데 도움이 됐을 텐데 당황스럽다""며 반박했다.이어 박 전 대통령이 증인 소환에 불응하고 최씨가 증언을 거부한 경위를 두고도 설전을 했다. 변호인 측은 ""특검이 (최씨 딸인)정유라를 \'보쌈 증언\' 시킨 것 때문에 최씨가 증언을 거부했다""고 지적했고, 이에 특검 측은 ""변호인이 모욕적인 언어를 쓰면서 \'보쌈\' 같은 표현을 썼는데, 이는 굉장히 유감""이라고 지적했다.박정일기자 comja77@dt.co.kr                                                                                                                                                                                                                                                                                                                                                                                                                                                                                                                                                                                                                                                                                                                                                                                                 디지털타임스 홈페이지 바로가기/SNS 바로가기확바뀐 디지털타임스 연예·스포츠 섹션 바로가기박정일디지털타임스 관련뉴스해당 언론사에서 선정하며 언론사 페이지(아웃링크)로 이동해 볼 수 있습니다.""진짜 LCC가 온다?""… 한국 노리는 \'중국 저가항공 주의보\'깡통TV가 순식간에 \'스마트TV\'로… 월 3300원 비밀이제는 \'우주산업화\' 시대… 위성영상으로 주목받는 산업은?중환자 간병까지 척척… 인간과 교감 AI로봇 \'페퍼\' 내달 상륙신산업 국내기업 자유무역지역 임대료 감면좋아요0훈훈해요0슬퍼요0화나요0후속기사 원해요0기사제공 :']"
9,삼성전자, 2017-09-2815:46,연합뉴스 ,[특징주] SK하이닉스 美훈풍·'도시바 효과'에 이틀째 상승(종합),https://finance.naver.com/news/news_read.nhn?article_id=0009580491&office_id=001&mode=search&query=삼성전자&page=3,"['       [특징주] SK하이닉스 美훈풍·\'도시바 효과\'에 이틀째 상승(종합)      기사입력2017-09-28 15:46기사원문좋아요훈훈해요좋아요 평가하기공감좋아요0훈훈해요0슬퍼요0화나요0후속기사 원해요0댓글 삼성전자는 장중 하락 전환(서울=연합뉴스) 권수현 기자 = SK하이닉스가 미국 증시의 정보기술(IT) 업종 온기와 도시바 반도체 사업부문 인수 기대감에 힘입어 28일 이틀 연속 상승했다.     이날 유가증권시장에서 SK하이닉스는 전 거래일보다 0.97% 오른 8만3천200원에 거래를 마쳤다.    미국과 북한 간의 대치로 지난 26일 급락했던 SK하이닉스는 전날에 이어 이틀째 오름세를 이었다.    미국 정부의 세제개편안 발표와 주요 IT기업 호실적에 힘입어 뉴욕 증시의 기술주들이 일제히 상승한 게 \'훈풍\'으로 작용한 것으로 보인다.     또 SK하이닉스가 전날 일본 도시바(東芝)의 반도체 사업 부문(도시바메모리)에 대한 투자를 공식화한 사실도 상승 요인이 됐다.     SK하이닉스는 전날 이사회를 열어 도시바메모리에 총 4조원을 투자하는 안건을 의결했다고 공시했다.     김경민 대신증권 연구원은 ""이사회의 이번 결정은 장기적으로 SK하이닉스의 낸드 사업가치를 키울 것""이라고 전망했다.     김 연구원은 ""도시바 메모리 매각이 지연되면서 SK하이닉스의 자금 부담이 커질 것이라는 우려가 일부 존재했으나 이번에 공시된 투자금액은 시장의 기존 예상치에 부합하는 수준으로 판단된다""고 덧붙였다.    한편 \'대장주\' 삼성전자는 장 초반 상승세를 타다가 하락세로 돌아서 0.81% 떨어진 256만3천원에 마감했다.    외국인이 사흘 연속 팔았고 기관도 이틀째 매도 우위를 보였다.     inishmore@yna.co.kr기자가 기다려요. 기사 문의 및 제보는 여기로(클릭!)최신 유행 트렌드 총집결(클릭!)연합뉴스 관련뉴스해당 언론사에서 선정하며 언론사 페이지(아웃링크)로 이동해 볼 수 있습니다.\xa0남편 사망 직전 이혼 50억대 재산분할…법원 판단은?\xa0남교사 여학생에 \'사적만남\'·\'입맞춤\' 강요하더니…\xa0야구장서 파울 볼에 다치면 누구 책임일까\xa0300만원 돈 봉투 발견한 택시기사…어떻게 했을까\xa0\'플레이보이 제국\' 만들어 性혁명 이끈 휴 헤프너 별세좋아요0훈훈해요0슬퍼요0화나요0후속기사 원해요0기사제공 :']"
10,삼성전자, 2017-09-2815:46,디지털타임스 ,3D낸드 기술력 향상·증설 경쟁 치열해진다,https://finance.naver.com/news/news_read.nhn?article_id=0002425036&office_id=029&mode=search&query=삼성전자&page=3,"['       3D낸드 기술력 향상·증설 경쟁 치열해진다      기사입력2017-09-28 15:46기사원문좋아요훈훈해요좋아요 평가하기공감좋아요0훈훈해요0슬퍼요0화나요0후속기사 원해요0댓글IoT·자율차 핵심부품 수요 급증도시바, 메모리 매각계약 체결설비 투자·생산량 확대 나설듯삼성 5세대 3D낸드 내년 양산SK하이닉스도 생산 대거 확대WD 96단 QLC 내년 시험생산[디지털타임스 박슬기 기자] SK하이닉스가 포함된 한미일 연합 컨소시엄의 도시바메모리(TMC) 인수가 마무리됨에 따라 반도체 업계에 3D 낸드플래시를 중심으로 기술·증설 경쟁이 한층 치열해질 전망이다. 사물인터넷(IoT), 자율주행자, 빅데이터 등 4차 산업혁명 기술을 구현하는 핵심 부품으로 3D 낸드플래시의 수요가 급증하고 있기 때문이다.28일 도시바는 베인캐피털, SK하이닉스가 주도하는 한미일 연합과 도시바메모리 매각계약을 체결했다고 발표했다. 도시바메모리 매각 계약 금액은 2조엔(약 20조3256억원)이다. SK하이닉스는 3950억엔(약 4조143억원),  베인캐피털이 2120억엔을 투자고, 도시바가 3505억엔을 재출자한다. 애플, 델, 시게이트, 킹스턴 등 미국 4곳은 4155억엔을 투자하기로 했다. 다만 SK하이닉스는 향후 10년간 의결권 15%를 초과할 수 없고, 도시바메모리 기밀정보 접근을 금지하는 조건이다. 지난 27일 박정호 SK텔레콤 사장과 함께 일본으로 건너간 최태원 SK 회장은 도시바와 최종 매각 계약을 체결하고, 28일 오전 10시 40분 미국 뉴욕행 비행기에 올랐다.TMC 인수 마무리에 따라 내년부터 3D 낸드플래시 생산능력과 기술력 증대 경쟁이 본격적으로 펼쳐질 전망이다.도시바는 TMC 매각 등을 통해 채무 초과 상태를 해소하면 향후 낸드플래시 기술·생산력을 끌어올리는 데 더 집중할 것이라는 관측이다. 도시바가 요카이치 공장에 건설하고 있는 팹6는 내년 3분기부터 월 1만5000장 규모의 3D 낸드플래시 양산을 시작할 계획이다.3D 낸드플래시를 업계 최초로 양산한 삼성전자는 4세대(64단) 3D 낸드를 양산하고 있으며, 5세대 제품 개발을 이미 완료, 내년 초 양산을 계획하고 있다. 이 회사는 평택공장과 시안 공장의 3D 낸드 생산능력을 확대하기 위해 각각 14조4000억원, 7조8000억원을 투자하며 증설에 한창이다. 지난 7월부터 4세대 3D 낸드플래시 양산에 들어간 SK하이닉스도 이천 M14 공장과 청주 M15 공장서 3D 낸드 생산능력을 늘리고 있다.도시바와 웨스턴디지털도 3D 낸드 경쟁력을 끌어올리고 있다. 도시바는 96단 QLC(쿼드레벨셀) 낸드를 내년부터 생산할 계획이며, 도시바와 제휴 관계인 웨스턴디지털도 내년부터 96단 QLC 낸드를 시험 생산할 예정이다.특히 TMC 인수전에 애플·킹스톤·시게이트·델 등이 참여해 낸드플래시 수급에 총력을 기울이는 만큼 향후 TMC의 설비 증설 가능성이 높다고 업계는 분석하고 있다. 이들은 주주로서 TMC 설비 투자 규모와 생산량 확대를 요구할 수 있는 명분이 있다는 해석이다.이처럼 3D 낸드플래시 시장을 둘러싸고 경쟁 구도가 치열해지는 것은 SSD(솔리드스테이트드라이브)와 고사양 스마트폰 중심으로 수요가 늘고 있기 때문으로 분석된다. 또 빅데이터 등으로 데이터 수가 폭증하면서 SSD를 중심으로 한 데이터센터 투자도 늘고 있다. 특히 평면형(2D)보다 3D 제품은 적층 단수가 높아질수록 저장용량과 전력 효율을 크게 늘릴 수 있고, 수익성도 높은 제품으로 꼽힌다. 업계 관계자는 ""도시바 인수전 종료에 따라 앞으론 낸드플래시 기술력과 생산능력 확대가 중요해진 상황""이라고 말했다. 박슬기기자 seul@dt.co.kr                                                                                                                                                                                                                                                                                                                                                                                                                                                                                                                                                                                                                                                                                                                                                                                                                                                                                                                                                                                                                                                                                                                                           디지털타임스 홈페이지 바로가기/SNS 바로가기확바뀐 디지털타임스 연예·스포츠 섹션 바로가기박슬기디지털타임스 관련뉴스해당 언론사에서 선정하며 언론사 페이지(아웃링크)로 이동해 볼 수 있습니다.""진짜 LCC가 온다?""… 한국 노리는 \'중국 저가항공 주의보\'깡통TV가 순식간에 \'스마트TV\'로… 월 3300원 비밀이제는 \'우주산업화\' 시대… 위성영상으로 주목받는 산업은?중환자 간병까지 척척… 인간과 교감 AI로봇 \'페퍼\' 내달 상륙신산업 국내기업 자유무역지역 임대료 감면좋아요0훈훈해요0슬퍼요0화나요0후속기사 원해요0기사제공 :']"
