,회사명,날짜,언론사,기사제목,링크,본문
7,삼성전자, 2017-06-0411:02,데일리안 ,"삼성 ‘플렉스워시’, 인간공학 디자인상 그랑프리 수상",https://finance.naver.com/news/news_read.nhn?article_id=0002189684&office_id=119&mode=search&query=삼성전자&page=3,"['       삼성 ‘플렉스워시’, 인간공학 디자인상 그랑프리 수상      기사입력2017-06-04 11:02기사원문좋아요훈훈해요좋아요 평가하기공감좋아요0훈훈해요0슬퍼요0화나요0후속기사 원해요0댓글삼성전자의 인간공학 세탁기 시리즈 ‘플렉스워시’, ‘애드워시’, ‘액티브워시’가 3일 일본 도쿄 니혼대학교에서 개최된 아시아인간공학회(ACED) 주관 ‘2017년 인간공학 디자인상’에서 가전부문 그랑프리를 수상했다. (왼쪽부터) 삼성전자 생활가전사업부 차세대개발 정영주 연구원, 디자인그룹장 송현주 상무, 차세대개발 양혜순 그룹장. ⓒ삼성전자삼성전자의 인간공학 세탁기 시리즈 ‘플렉스워시’ ‘애드워시’ ‘액티브워시’가 해외에서 뛰어난 디자인을 인정받았다.삼성전자는 3일 일본 도쿄 니혼대학교에서 열린 아시아인간공학회(ACED) 주관 ‘2017년 인간공학 디자인상’에서 ‘플렉스워시’ ‘애드워시’ ‘액티브워시’가 가전부문 그랑프리를 수상했다고  4일 밝혔다. 이번에 그랑프리를 수상한 삼성 세탁기는 ▲상부 소용량 전자동세탁기와 하부 대용량 드럼세탁기를 결합한 세계 최초의 올인원 세탁기 ‘플렉스워시’ ▲세탁기 도어에 달린 애드윈도우로 세탁 도중 언제든지 세탁물을 추가할 수 있는 ‘애드워시’ ▲상부 빌트인싱크 탑재로 허리를 굽히지 않고 애벌빨래가 가능한 ‘액티브워시’ 등 총 3종이다.삼성전자는 해당 제품들이 모두 사용자 행동 분석에 기반한 인간공학 디자인의 혁신성을 지속적으로 이끌어온 점을 인정받아 수상의 영예를 안았다고 설명했다.ACED는 “삼성 세탁기는 제품 설계과정에서 사용자가 편안하게 사용할 수 있도록 인간공학 연구방법론을 널리 적용하고 인간공학 설계 원리를 실제 제품의 기능으로 완벽하게 구현해 사용편의성을 극대화했다”고 평가했다.특히 지난 3월 출시한 ‘플렉스워시’는 같은 달 대한인간공학회가 주관한 제17회 인간공학 디자인상에서 ‘베스트 오브 베스트’를 수상한데 이어, 해외에서도 그랑프리에 선정되며 특별한 디자인 가치를 다시 한 번 입증했다.‘플렉스워시’는 상·하부 동시 세탁과 탈수가 가능하고 독보적인 진동·소음 저감 기술이 적용됐다. 또한 사용 빈도가 높은 소용량 세탁기를 상부에 위치시킨 창의적인 설계와 세탁 상황 점검이 가능한 투명창 등 사용자 배려와 편의성을 극대화했다는 평이다. 송현주 삼성전자 생활가전사업부 디자인그룹장 상무는 “이번 수상은 삼성전자가 오랜 기간 쌓아온 사용자 분석과 연구가 축적돼 만들어진 성과”라며 “앞으로도 사용자 일상의 작은 불편까지 해결해줄 수 있는 세심한 배려와 혁신이 담긴 제품을 지속 선보이겠다”고 말했다.  데일리안 고수정 기자ⓒ (주)데일리안 - 무단전재, 변형, 무단배포 금지데일리안 관련뉴스해당 언론사에서 선정하며 언론사 페이지(아웃링크)로 이동해 볼 수 있습니다.KT-케이웨더, \'미세먼지로부터 안전한 학교 만들기\' 앞장LGU+, 영국 보다폰과 맞손잡고 신규 사업 개척SKT, IoT 보안 통합 가이드라인 수립 착수""직원이 최우선"" 박정호 SKT 사장, 조직 문화 혁신 행보SKT, 5일부터 \'4.5G\' 서비스 개시좋아요0훈훈해요0슬퍼요0화나요0후속기사 원해요0기사제공 :']"
8,삼성전자, 2017-06-0411:02,파이낸셜뉴스 ,"삼성 세탁기, '2017년 인간공학 디자인상' 수상",https://finance.naver.com/news/news_read.nhn?article_id=0003824230&office_id=014&mode=search&query=삼성전자&page=3,"[""       삼성 세탁기, '2017년 인간공학 디자인상' 수상      기사입력2017-06-04 11:02기사원문좋아요훈훈해요좋아요 평가하기공감좋아요0훈훈해요0슬퍼요0화나요0후속기사 원해요0댓글      정영주 삼성전자 생활가전사업부 차세대개발 연구원(왼쪽부터), 송현주 디자인그룹장 상무, 양혜순 차세대개발 그룹장이 ACED로부터 2017년 인간공학 디자인상을 수상하고 기념촬영을 하고 있다.    삼성전자는 자사 세탁기 제품인 ‘플렉스워시’, ‘애드워시’, ‘액티브워시’가 지난 3일 일본 도쿄 니혼대학교에서 열린 아시아인간공학회(ACED) 주관 '2017년 인간공학 디자인상'에서 가전부문 그랑프리를 수상했다고 4일 밝혔다.  ACED는 2014년 결성된 아시아 최초의 국제 인간공학 학회 연합이다. 올해 ‘ACED 인간공학 디자인상’을 신설했고 삼성전자 세탁기가 첫 그랑프리 수상의 주인공이 됐다.  이번에 그랑프리를 수상한 삼성 세탁기는 상부 소용량 전자동세탁기와 하부 대용량 드럼세탁기를 결합한 ‘플렉스워시’, 세탁기 도어에 달린 애드윈도우로 세탁 도중 언제든지 세탁물을 추가할 수 있는 ‘애드워시’, 상부 빌트인싱크 탑재로 허리를 굽히지 않고 애벌빨래가 가능한 ‘액티브워시’ 등 총 3종이다. 해당 제품들은 모두 사용자 행동 분석에 기반한 인간공학 디자인의 혁신성을 지속적으로 이끌어온 점을 인정받아 수상의 영예를 안았다.  송현주 삼성전자 생활가전사업부 디자인그룹장(상무)는 “이번 수상은 삼성전자가 오랜 기간 쌓아온 사용자 분석과 연구가 축적돼 만들어진 성과”라며 “앞으로도 사용자 일상의 작은 불편까지 해결해줄 수 있는 세심한 배려와 혁신이 담긴 제품을 지속 선보이겠다”고 말했다.   km@fnnews.com 김경민 기자   ▶ 세상의 모든 골 때리는 이야기 'fn파스'▶ 속보이는 연예뉴스 fn스타  ※ 저작권자 ⓒ  파이낸셜뉴스. 무단 전재-재배포 금지파이낸셜뉴스 관련뉴스해당 언론사에서 선정하며 언론사 페이지(아웃링크)로 이동해 볼 수 있습니다.벤츠 앞에 드러누운 주차요원, 운전자 엑셀 밟더니..JTBC 뉴스룸 굴욕, '노룩취재' 패러디 당하며 뭇매 맞더니 결국..웃는 모습 보이던 정유라, 수갑 채우자 하는 말이..SNS '관심집중' 女 간호사 사표.. 딱 붙는 유니폼 때문에?폭발 직전 한국당, '그만큼 해먹었으면..' 발언까지 나오더니 급기야좋아요0훈훈해요0슬퍼요0화나요0후속기사 원해요0기사제공 :""]"
9,삼성전자, 2017-06-0411:01,이데일리 ,[주간추천주]테크윙 등 반도체 중소형주 주목..여행주도 관심,https://finance.naver.com/news/news_read.nhn?article_id=0003842052&office_id=018&mode=search&query=삼성전자&page=3,"['       [주간추천주]테크윙 등 반도체 중소형주 주목..여행주도 관심      기사입력2017-06-04 11:01기사원문좋아요훈훈해요좋아요 평가하기공감좋아요0훈훈해요0슬퍼요0화나요0후속기사 원해요0댓글[이데일리 최정희 기자] #삼성전자 등 대형 반도체주에 대한 관심이 중소형주로 옮겨붙었다. #테크윙 등의 주가 상승이 기대된다. 또 본격적인 여름철을 앞두고 해외로 나가는 여행객이 증가할 것이란 전망에 항공사와 여행사 등을 추천하는 증권사도 있었다.4일 금융투자업계에 따르면 대신증권과 유안타증권은 테크윙의 주가 상승이 기대된다고 밝혔다. 테크윙은 2011년 코스닥에 상장한 반도체 후공정 검사장비업체로 메모리와 비메모리 핸들러 부문에 경쟁력을 갖춘 업체다. 대신증권은 #SK하이닉스와 SK하이닉스의 하청업체인 테크윙을 추천하면서 ""SK하이닉스, 마이크론, 샌디스크, 인텔 등의 주요 고객사들이 최근 3D 낸드 증설 투자를 확대해 수혜를 받을 것으로 전망했다""고 말했다. 모듈 공정에서 자동화 장비 사용이 미비했으나 테스트 핸들러 투자가 늘면서 모듈 공정용 테스트 핸들러의 매출 증가가 기대된다고 설명했다. 유안타증권은 테크윙에 대해 ""중국이 반도체 전공정 투자 이후 내년부턴 후공정 투자가 예상된다""며 ""내년부터 본업 성장 모멘텀이 부각될 것""이라고 설명했다. 올해도 나쁘지 않다. 올해 자회사 이엔씨테크놀로지가 유기발광다이오드(OLED) 검사장비를 공급하면서 실적 성장을 이끌 것으로 기대된다. 하나금융투자는 #솔브레인을 추천주로 꼽았다. 반도체 소재 업체 중 밸류에이션 매력이 가장 높은 데다 올 1분기 영업이익이 263억원으로 시장예상치를 뛰어넘었다. 2분기에도 반도체 식각액(에천트·Etchant, 반도체 제조 과정에서 실리콘 산화막 두께를 줄이거나 불순물을 제거하는데 사용되는 화학물질) 매출이 증가할 것으로 예측됐다. 이차전지 등 축전지 제조업체인 #에코프로는 SK증권의 추천을 받았다. NCA 전지재료에 대한 수요가 타이트해 제품 가격 상승 가능성이 있는데다 제5공장 증설이 올해 2분기 완공돼 월간 생산이 970톤으로 대폭 확대될 것으로 예상됐다. 본격적인 여름 휴가를 앞두고 해외 여행객이 증가할 것이란 전망에 #아시아나항공과 #모두투어도 추천주 명단에 올랐다. SK증권은 아시아나항공에 대해 ""9월과 10월 연휴에 따른 여객 증가 기대감이 있다""며 ""중국 노선이 차지하는 비중이 경쟁사 대비 높은 편인데 사드(THAAD, 고고도미사일방어체계) 문제가 완화될 경우 실적 회복 기대감이 크다""고 설명했다. 신한금융투자는 모두투어와 관련 ""올해 출국자가 지난해보다 12% 증가할 것으로 예상돼 직접적인 수혜가 기대된다""며 ""자유투어를 비롯한 자회사 적자 규모도 축소될 것""이라고 전했다. 현대미포조선은 신한금투와 하나금투의 러브콜을 받았다. 석유제품 운반선, LPG운반선 등 주력 선종의 물동량이 증가할 것이란 기대감 때문이다. 원화 강세에 따른 수혜가 예상되는데다 올해 예상 실적 기준 주가순자산비율(PBR)이 0.9배 수준으로 주가 재평가가 기대된다. 한화그룹주도 추천주로 등록됐다. 유안타증권은 #한화생명에 대해 ""견조한 고마진 보장성 연납화보험료(APE) 성장 및 투자이익 호조로 2분기 실적이 양호할 전망""이라며 ""연내 지속적인 금리 상승이 예상돼 변액 보증준비금 추가적립 축소 및 규제 부담 완화가 예상된다""고 설명했다. 신한금투는 #한화의 올해 매출액과 영업이익이 각각 49조6000억원, 2조1000억원으로 추정되는데 이는 지난해보다 각각 5.2%, 24.4% 증가할 것으로 예상됐다. 이는 한화생명과 #한화케미칼 등 주요 자회사 실적 호조에 따른 것이다. #SK텔레콤은 요금인하 등에 대한 정부 규제가 구체화되지 않은 상황에서 주가 낙폭이 과대하다는 이유로, #GS건설은 주택시장의 브랜드파워를 바탕으로 내년까지 최대 실적을 달성할 것이란 전망에 추천주로 꼽혔다. #고려아연과 #현대제철은 주가가 저평가돼 매수하기 적합한 시기란 평가를 받았다.\xa0최정희(jhid0201@edaily.co.kr)▶심쿵유발 스타 화보 [핫포토]▶이데일리 [페이스북] | [포스트]▶한 눈에 보는 이슈 트렌드 [카드뉴스]＜ⓒ종합 경제정보 미디어 이데일리 - 무단전재 & 재배포 금지＞이데일리 관련뉴스해당 언론사에서 선정하며 언론사 페이지(아웃링크)로 이동해 볼 수 있습니다.최재원 부회장, SK그룹 배터리 드라이브 건다카드 수수료 인하 후폭풍 논란.. 4000억원 수익 감소 vs \'공포 마케팅\'미혼男 41% ""동거경험 있어도 이상형이면 결혼 가능""돌싱, 냉전 중 부부간 의사소통 男 \'카톡\' vs 女 \'뚱\'페이스북 메신저 거짓 알람 논란..\'기망\'여부 판단이 핵심좋아요0훈훈해요0슬퍼요0화나요0후속기사 원해요0기사제공 :']"
10,삼성전자, 2017-06-0411:01,스포츠경향 ,"삼성 ‘플렉스워시’, 아시아인간공학 디자인상 그랑프리 수상",https://finance.naver.com/news/news_read.nhn?article_id=0000495608&office_id=144&mode=search&query=삼성전자&page=3,"['       삼성 ‘플렉스워시’, 아시아인간공학 디자인상 그랑프리 수상      기사입력2017-06-04 11:01기사원문좋아요훈훈해요좋아요 평가하기공감좋아요0훈훈해요0슬퍼요0화나요0후속기사 원해요0댓글 삼성전자는 세탁기 시리즈 ‘플렉스워시’ ‘애드워시’ ‘액티브워시’가 3일 일본 도쿄 니혼대학교에서 개최된 아시아인간공학회(ACED) 주관 ‘2017년 인간공학 디자인상’에서 가전부문 그랑프리를 수상했다고 4일 밝혔다. 삼성 플렉스워시특히 ‘플렉스워시’는 지난 3월 대한인간공학회가 주관한 제17회 인간공학 디자인상에서 ‘Best of Best’를 수상한데 이어, 해외에서도 그랑프리에 선정되며 특별한 디자인 가치를 다시 한 번 입증했다고 설명했다.삼성전자는 ‘애드워시’ ‘액티브워시’를 통해 글로벌 세탁기의 새로운 표준을 제시해왔다. 특히 지난 3월 출시한 ‘플렉스워시’는 상·하부 동시 세탁과 탈수가 가능하고 독보적인 진동·소음 저감 기술이 적용됐다. 이 제품은 사용 빈도가 높은 소용량 세탁기를 상부에 위치시킨 창의적인 설계와 세탁 상황 점검이가능한 투명창 등 사용자 배려와 편의성을 극대화해 세탁기 시장에서 새로운 기준을 만들며 돌풍을 일으키고 있다.아시아인간공학회는 “삼성 세탁기는 제품 설계과정에서 사용자가 편안하게 사용할 수 있도록 인간공학 연구방법론을 널리 적용하고 인간공학 설계 원리를 실제 제품의 기능으로 완벽하게 구현해 사용편의성을 극대화했다”고 평가했다.▶ [스포츠경향 인기 무료만화 보기]▶ [스포츠경향 핫&스타포토] [따라해 보세요! 다이어트 영상]©스포츠경향(sports.khan.co.kr), 무단전재 및 재배포 금지스포츠경향 관련뉴스해당 언론사에서 선정하며 언론사 페이지(아웃링크)로 이동해 볼 수 있습니다.[종합] \'대마초 혐의\' 탑, 몰래 강남서 복귀…양현석은 탑 팔로우 취소성동일, 설리에 \'핵직구\' 날렸다…""뇌가 날아다녀"" ""이 옷 때문에 지각?""누리꾼들이 지디&탑 \'하이 하이(HIGH HIGH)\'에 주목하는 이유는?\'파리의 연인\' 김은숙, ""결말 아직도 반성중""…후회하게 된 계기는?""장근석씨 성형하셨어요?"" 日 걸그룹, 면전에서 막말 논란좋아요0훈훈해요0슬퍼요0화나요0후속기사 원해요0기사제공 :']"
11,삼성전자, 2017-06-0411:01,헤럴드경제 ,"삼성 ‘플렉스워시’, 아시아인간공학회 ‘인간공학 디자인상’ 그랑프리 수상",https://finance.naver.com/news/news_read.nhn?article_id=0001246459&office_id=016&mode=search&query=삼성전자&page=3,"['       삼성 ‘플렉스워시’, 아시아인간공학회 ‘인간공학 디자인상’ 그랑프리 수상      기사입력2017-06-04 11:01기사원문좋아요훈훈해요좋아요 평가하기공감좋아요0훈훈해요0슬퍼요0화나요0후속기사 원해요0댓글- 플렉스워시, 애드워시, 액티브워시 등 인간공학 세탁기3종 그랑프리 수상- 사용자 행동에 기반한 인간공학 디자인 혁신성 해외서도 인정받아[헤럴드경제]삼성전자의 인간공학 세탁기 시리즈 ‘플렉스워시’, ‘애드워시’, ‘액티브워시’가 3일 일본 도쿄 니혼대학교에서 개최된 아시아인간공학회(ACED; Asian Conference on Ergonomics and Design) 주관 ‘2017년 인간공학 디자인상’에서 가전부문 그랑프리를 수상했다.삼성전자의 인간공학 세탁기 시리즈 ‘플렉스워시’, ‘애드워시’, ‘액티브워시’가 3일 일본 도쿄 니혼대학교에서 개최된 아시아인간공학회(ACED; Asian Conference on Ergonomics and Design) 주관 ‘2017년 인간공학 디자인상’에서 가전부문 그랑프리를 수상했다. 왼쪽부터 삼성전자 생활가전사업부 차세대개발 정영주 연구원, 디자인그룹장 송현주 상무, 차세대개발 양혜순 그룹장특히 삼성 ‘플렉스워시’는 지난 3월 대한인간공학회가 주관한 제17회 인간공학 디자인상에서 ‘Best of Best’를 수상한데 이어, 해외에서도 그랑프리에 선정되며 특별한 디자인 가치를 다시 한 번 입증했다.아시아인간공학회는 2014년 결성된 아시아 최초의 국제 인간공학 학회 연합으로 올해 ‘ACED 인간공학 디자인상’을 신설했으며, 삼성전자 세탁기가 첫 그랑프리 수상의 주인공이 됐다.이번에 그랑프리를 수상한 삼성 세탁기는 ▲상부 소용량 전자동세탁기와 하부 대용량 드럼세탁기를 결합한 세계 최초의 올인원 세탁기 ‘플렉스워시’, ▲세탁기 도어에 달린 애드윈도우로 세탁 도중 언제든지 세탁물을 추가할 수 있는 ‘애드워시’, ▲상부 빌트인싱크 탑재로 허리를 굽히지 않고 애벌빨래가 가능한 ‘액티브워시’ 등 총 3종이며, 해당 제품들은 모두 사용자 행동 분석에 기반한 인간공학 디자인의 혁신성을 지속적으로 이끌어온 점을 인정받아 수상의 영예를 안았다.삼성전자는 ‘애드워시’, ‘액티브워시’를 통해 글로벌 세탁기의 새로운 표준을 제시해왔으며, 특히 지난 3월 출시한 ‘플렉스워시’는 상·하부 동시 세탁과 탈수가 가능하고 독보적인 진동·소음 저감 기술이 적용됐다.또한 사용 빈도가 높은 소용량 세탁기를 상부에 위치시킨 창의적인 설계와 세탁 상황 점검이 가능한 투명창 등 사용자 배려와 편의성을 극대화해 세탁기 시장에서 새로운 기준을 만들며 돌풍을 일으키고 있다.아시아인간공학회는 “삼성 세탁기는 제품 설계과정에서 사용자가 편안하게 사용할 수 있도록 인간공학 연구방법론을 널리 적용하고 인간공학 설계 원리를 실제 제품의 기능으로 완벽하게 구현해 사용편의성을 극대화했다”고 평가했다.삼성전자 생활가전사업부 디자인그룹장 송현주 상무는 “이번 수상은 삼성전자가 오랜 기간 쌓아온 사용자 분석과 연구가 축적돼 만들어진 성과”라며 “앞으로도 사용자 일상의 작은 불편까지 해결해줄 수 있는 세심한 배려와 혁신이 담긴 제품을 지속 선보이겠다”고 말했다. /namkang@heraldcorp.com▶영감이란 불꽃에 타오르게할 스토리(INSPIRE)▶인기 무료 만화 ▶나만의 변호사 찾기 - Copyrights ⓒ 헤럴드경제 & heraldbiz.com, 무단 전재 및 재배포 금지 -헤럴드경제 관련뉴스해당 언론사에서 선정하며 언론사 페이지(아웃링크)로 이동해 볼 수 있습니다.\'정유라 집어넣어야 수사 쉽다\'…檢, 영장재청구 방침강경화 文정부 첫 낙마 희생자 될까…7일 청문회 결판홍준표 외유 마치고 귀국…당권 정조준""노약자석 앉냐""며 중년남에 드롭킥한 할배TK가 움직인다?…한국당ㆍ바른정당 지지율 역전좋아요0훈훈해요0슬퍼요0화나요0후속기사 원해요0기사제공 :']"
12,삼성전자, 2017-06-0411:01,매일경제 ,"삼성전자 세탁기, `인간공학 디자인상` 그랑프리 수상",https://finance.naver.com/news/news_read.nhn?article_id=0003953779&office_id=009&mode=search&query=삼성전자&page=3,"['       삼성전자 세탁기, `인간공학 디자인상` 그랑프리 수상      기사입력2017-06-04 11:01기사원문좋아요훈훈해요좋아요 평가하기공감좋아요0훈훈해요0슬퍼요0화나요0후속기사 원해요0댓글[사진제공 : 삼성전자]삼성전자는 자사 인간공학 세탁기 시리즈 \'플렉스워시\', \'애드워시\', \'액티브워시\'가 3일 일본 도쿄 니혼대학교에서 개최된 아시아인간공학회(ACED; Asian Conference on Ergonomics and Design) 주관 \'2017년 인간공학 디자인상\'에서 가전부문 그랑프리를 수상했다고 4일 밝혔다.특히 삼성 \'플렉스워시\'는 지난 3월 대한인간공학회가 주관한 제17회 인간공학 디자인상에서 \'Best of Best\'를 수상한데 이어, 해외에서도 그랑프리에 선정되며 특별한 디자인 가치를 다시 한 번 입증했다.아시아인간공학회는 2014년 결성된 아시아 최초의 국제 인간공학 학회 연합으로 올해 \'ACED 인간공학 디자인상\'을 신설했으며, 삼성전자 세탁기가 첫 그랑프리 수상의 주인공이 됐다.이번에 그랑프리를 수상한 삼성 세탁기는 ▲상부 소용량 전자동세탁기와 하부 대용량 드럼세탁기를 결합한 세계 최초의 올인원 세탁기 \'플렉스워시\', ▲세탁기 도어에 달린 애드윈도우로 세탁 도중 언제든지 세탁물을 추가할 수 있는 \'애드워시\', ▲상부 빌트인싱크 탑재로 허리를 굽히지 않고 애벌빨래가 가능한 \'액티브워시\' 등 총 3종이다.삼성전자 생활가전사업부 디자인그룹장 송현주 상무는 ""이번 수상은 삼성전자가 오랜 기간 쌓아온 사용자 분석과 연구가 축적돼 만들어진 성과""라며 ""앞으로도 사용자 일상의 작은 불편까지 해결해줄 수 있는 세심한 배려와 혁신이 담긴 제품을 지속 선보이겠다""고 말했다.  [디지털뉴스국 이상규 기자][매일경제 공식 페이스북] [오늘의 인기뉴스] [매경 프리미엄][ⓒ 매일경제 & mk.co.kr, 무단전재 및 재배포 금지]매일경제 관련뉴스해당 언론사에서 선정하며 언론사 페이지(아웃링크)로 이동해 볼 수 있습니다.이일화, 47세 맞아? 20대 못지않은 \'볼륨 몸매\' 뽐내다한혜진♥차우찬 열애, 사진만 올려도 이목 집중...\'서로 반한 뒤태\'호날두, 11·12호골 폭죽...발롱도르 수상 정조준문재인 대통령, 청와대 관람객에게 90도 폴더 인사안신애, 日 뜨겁게 달군 섹시 골퍼의 핫보디 \'입이 쩍\'좋아요0훈훈해요0슬퍼요0화나요0후속기사 원해요0기사제공 :']"
