,회사명,날짜,언론사,기사제목,링크,본문
1,삼성전자, 2017-04-2110:59,전자신문 ,"[ET투자뉴스]제일기획_거래비중 기관 28.48%, 외국인 37.81%",https://finance.naver.com/news/news_read.nhn?article_id=0002602697&office_id=030&mode=search&query=삼성전자&page=7,"['       [ET투자뉴스]제일기획_거래비중 기관 28.48%, 외국인 37.81%      기사입력2017-04-21 10:59기사원문좋아요훈훈해요좋아요 평가하기공감좋아요0훈훈해요0슬퍼요0화나요0후속기사 원해요0댓글     관련종목들 가운데서 변동폭은 높지만 수익률은 작아 21일 오전 10시5분 현재 전일대비 2.47% 하락하면서 17,800원을 기록하고 있는 제일기획은 지난 1개월간 4.81% 하락했다.  동기간 동안에 주가움직임의 위험지표인 표준편차는 1.7%를 기록했다.  이는 코스피 업종내에서 주요종목들과 비교해볼 때 제일기획의 월간 변동성이 상대적으로 커짐과 함께 주가도 마이너스를 보이며 낮은 수준을 유지했다는 뜻이다.  최근 1개월을 기준으로 제일기획의 위험을 고려한 수익률은 -2.8을 기록했는데, 변동성이 높고 주가는 약세를 기록하면서 위험대비 수익률은 가장 저조한 모습을 보였다.  게다가 코스피업종의 위험대비수익률 -1.0보다도 낮기 때문에 업종대비 성과도 좋지 않았다고 할 수 있다. 다음으로 업종과 시장을 비교해보면 제일기획이 속해 있는 코스피업종은 서비스업지수보다 변동성과 수익률이 모두 낮은 모습을 보여주고 있다.  다시 말해서 동업종의 탄력은 약한 반면 하락시에도 지수보다 낙폭이 작다는 의미이다.      \xa0 표준편차 수익율  위험대비 수익율   삼성엔지니어링 1.7% -1.2% -0.6   제일기획 1.7% -4.8% -2.8   LS 1.6% -0.6% -0.3   두산 1.1% -2.4% -2.1   에스원 1.1% 6.6% 5.9   서비스업 0.7% 2.6% 3.7   코스피 0.4% -0.4% -1.0    관련종목들 혼조세, 서비스업업종 보합권 유지   이 시각 현재 관련종목들이 혼조세를 보이고 있는 가운데 서비스업업종은 전일과 같은 (업종지수)pt를 유지하고 있다.  삼성엔지니어링 12,850원0 (0.00%) 두산 94,900원▼700(-0.73%)  에스원 93,800원▼500(-0.53%) LS 63,700원▲300(+0.47%)    증권사 목표주가 24,000원, 현재주가 대비 34% 추가 상승여력    최근 한달간 제시된 증권사 투자의견을 종합해보면 제일기획의 평균 목표주가는 24,000원이다.  현재 주가는 17,800원으로 6,200원(34%)까지 추가상승 여력이 존재한다.  증권사별로 보면  BNK투자증권의 신건식 에널리스트가 "" 의미있는 비계열 확장, 삼성전자 모바일 매출과 제일기획 사이의 괴리 발생, 캡티브에 연동되는 수익 사이클이 비계열 물량이 확대되면서 탈 동조화. 삼성전자의 물량 변동성이 크지 않은 상황에서 긍정적인 포인트로 판단된다…"" (이)라며 투자의견 매수(유지)에 목표주가:      23,000원을 제시했고, 신한금융투자의 홍세종, 오경석 에널리스트가 "" 보릿고개 통과 중, 1Q17 연결 매출총이익은 2,199억원(-2.7% YoY), 영업이익은 212억원(-5.5% YoY)을 전망한다. 컨센서스인 영업이익 246억원에 하회할 가능성이 높다. 본사 매출총이익은 3.0% YoY 감소한 535억원이 예상된다. 대내외 불확실성 확대로 국내 광고 경기가 악화됐다…"" (이)라며 투자의견 매수(유지)에 목표주가:      24,000원을 제시했다.   2월2일에 제일기획 4/4분기(2016년10월~12월)실적 발표됨   매출액 영업이익 당기순이익   4/4분기 9,725.0억 545.0억 221.0억   직전분기 대비 24.5% 증가 89.4% 증가 13.2% 감소   전년동기 대비 20.8% 증가 61.1% 증가 81.0% 증가    [재무분석 특징]  영업이익률 현재 4.2%로 업종평균 수준.PER은 25.63으로 업종평균보다 높으며, PBR은 2.62임.     업종내 시가총액 규모가 가장 비슷한 4개 종목과 비교해보면 제일기획이 순이익대비 현재의 주가수준을 보여주는 PER은 상대적으로 낮은 수준이지만, 반대로 자산가치대비 현재의 주가수준을 나타내는 PBR은 상대적으로 높은 수준이라고 할 수 있다.     제일기획 LS 에스원 두산 삼성엔지니어링   ROE 10.2 6.0 12.3 -9.8 2.7   PER 25.6 10.8 27.4 - 87.9   PBR 2.6 0.6 3.4 0.3 2.4   기준년월 2016년12월 2016년12월 2016년12월 2016년12월 2016년12월 외국인/개인 순매수, 기관은 순매도(한달누적)전일 외국인과 기관이 각각 44,839주, 10,972주를 순매수 했다.  4주간을 기준으로 보면 외국인이 초반에 동종목을 순매수한 이후에 기세를 이어가며 853,945주를 순매수했고, 개인들도 순매수량을 늘리며 202,985주를 순매수했다.  하지만 기관은 매도 관점으로 접근하면서  1,056,930주를 순매도했다.   투자주체별 누적순매수  상장주식수 대비 거래량은 0.24%로 적정수준최근 한달간 제일기획의 상장주식수 대비 거래량을 비교해보니 일별 매매회전율이 0.24%로 집계됐다.  그리고 동기간 장중 저점과 고점의 차이인 일평균 주가변동률을 1.64%를 나타내고 있다. 거래비중 기관 28.48%, 외국인 37.81%최근 한달간 주체별 거래비중을 살펴보면 외국인이 37.81%로 가장 높은 참여율을 보였고, 개인이 33.69%를 보였으며 기관은 28.48%를 나타냈다.  그리고 최근 5일간 거래비중은 외국인 비중이 38.95%로 가장 높았고, 개인이 32.27%로 그 뒤를 이었다.  기관은 28.76%를 나타냈다.   투자주체별 매매비중  ＊기관과 외국인을 제외한 개인 및 기타법인 등의 주체는 모두 개인으로 간주하였음   투심 약세 ,거래량 침체, 현재주가는 보통   현주가를 최근의 주가변화폭을 기준으로 본다면 특정 방향으로의 추세는 확인되지 않고, 거래량 지표로 볼 때는 침체국면에 머물러 있다.  실리적인 측면에서는 약세흐름에 투자자들은 불안감을 느끼고 있고 이동평균선들의 배열도를 분석을 해보면 최근 지속된 주가 약세로 역배열 구간에 들어오면서 중기적 상승추세가 꺽이고 있다.      주요 매물구간인 16,600원선이 지지대로 작용.   최근 세달동안의 매물대 분포를 살펴보면, 현주가 아래로 16,600원대의 대형매물대가 눈에 뜨이고, 이중에서 16,600원대는 전체 거래의 15.8%선으로 가격대에서 뚜렷하게 크게 발생한 것은 아니지만 상대적으로 거래규모가 큰 구간이 되고 향후 주가가 조정받을때 수급적인 강력한 지지대가 될 가능성을 고려할 필요가 있고, 그리고 16,300원대의 매물대 또한 규모가 약하기는하지만 향후 주가조정시에 지지매물대로 작용할 수 있다.  따라서 주가가 단기적인 조정을 받고있는 현재 상황에서는, 제1매물대인 16,600원대의 지지가능성에 보다 더 큰 비중을 두는 시각이 합리적이고, 아직은 제1매물가격대까지는 거리가 꽤 남아있고, 당분간 물량적인 부담이 없기 때문에 추가상승시에 큰 걸림돌은 없을듯 하고, 16,600원대의 지지대 역할은 좀더 기다릴 필요가 있다.       [포인트검색]   4월20일 :(주)제일기획 결산실적공시 예고(안내공시)3월24일 :(주)제일기획 정기주주총회결과 증시분석 전문기자 로봇 ET etbot@etnews.com전자신문과 씽크풀의 증시분석 전문기자 로봇 ET가 쓴 기사입니다▶ 전자신문 인기 포스트▶ 전자신문 공식 페이스북▶ 전자신문 바로가기 [Copyright ⓒ 전자신문 & 전자신문인터넷, 무단전재 및 재배포 금지]전자신문 관련뉴스해당 언론사에서 선정하며 언론사 페이지(아웃링크)로 이동해 볼 수 있습니다.유공자급 과학기술자도 사기 떨어져…과기인 기살리기 나서자분실 신고해도 이틀간 사용가능한 후불교통카드\'아이폰8\' 전작과 달라지는 3가지7000여 초·중교에 와이파이 설치···2기 스마트스쿨 가동순금·다이아 박힌 \'갤럭시S8\' 등장… 가격은?좋아요0훈훈해요0슬퍼요0화나요0후속기사 원해요0기사제공 :이 기사는 뉴스제휴평가위원회 \'뉴스제휴 및 제재 심사 규정\'에 따라노출 중단된 기사입니다.이전페이지목록보기인쇄하기목록보기증시 주요뉴스[유럽개장]일제히 상승 출발…英 0.33%↑[Asia마감] 코로나 4차 확산 불안감에 눌..[마켓뷰] 코스피, 6거래일 연속 상승…외국인..[시황종합] 코스피 6일째 상승 3140선 마..[코스닥 마감]이틀째 올라 980선 회복…씨젠..[마감시황]코스피, 개인·외인 매수에 상승…3..[외환마감]환율, 사흘만에 강보합..""미 국채..[Asia오전]어닝시즌 앞두고 혼조…日↓·홍콩..이전 페이지로 돌아가기|맨위로더보기대신증권 센터장 ""올해 코스피 3630 간다""…주목할 기업 12곳일주일새 3배 폭등… 우선주 ‘묻지마 투자’ 주의보코스피 실적잔치…기저효과 뺀 알짜배기 종목은?""코스피 최고점 간다""…돌아온 외국인, 장바구니에 뭐 담길까옵션 만기일 맞은 코스피…증권가 ""외국인에 주목하라""주가 최고가 찍은 카카오, 액면분할 하면 어떻게 될까8일 장 마감 후 주요 종목뉴스장 마감 후 기업공시[4월 8일]더보기인기검색어삼성전자84,700카카오548,000벽산3,795SK바이오사이언스125,500씨젠167,000이용약관금융게시판 운영원칙개인정보처리방침책임의 한계와 법적고지금융 고객센터네이버(주)가 제공하는 금융 정보는 각 콘텐츠 제공업체로부터 받는 투자 참고사항이며, 오류가 발생하거나 지연될 수 있습니다.네이버(주)와 콘텐츠 제공업체는 제공된 정보에 의한 투자 결과에 법적인 책임을 지지 않습니다. 게시된 정보는 무단으로 배포할 수 없습니다.콘텐츠 제공업체코스콤 : 실시간 주가정보 및 국내시세정보에프앤가이드 : 기업 및 재무정보KG제로인 : 해외 시세, 시장지표 및 펀드 정보한국예탁결제원 : 주주총회일 및 전자투표 정보인포스탁 : 국내 테마 정보Copyright ©NAVER Corp.All Rights Reserved.']"
2,삼성전자, 2017-04-2110:57,머니S ,"삼성증권 모바일앱 '엠팝(mPOP)', 홍채인증 시대 연다",https://finance.naver.com/news/news_read.nhn?article_id=0000246169&office_id=417&mode=search&query=삼성전자&page=7,"['       삼성증권 모바일앱 \'엠팝(mPOP)\', 홍채인증 시대 연다      기사입력2017-04-21 10:57기사원문좋아요훈훈해요좋아요 평가하기공감좋아요0훈훈해요0슬퍼요0화나요0후속기사 원해요0댓글본문 이미지 영역삼성증권은 21일부터 공인인증서나 보안카드없이 홍채인증만으로 모바일앱 \'엠팝(mPOP)\'의 금융거래가 가능하도록 해주는 홍채인증 서비스를 제공한다고 밝혔다.삼성증권의 홍채인증 서비스는 홍채인증기능이 탑재된 삼성전자 갤럭시 S8을 통해 이용할 수 있다.삼성증권이 제공하는 홍채인증 서비스는 삼성전자의 \'삼성 패스\'에 적용된 첨단 생체 인증 기술을 기반으로 한 안전한 보안체계를 갖추고 있다.이번 홍채인증 서비스 도입으로 삼성증권 고객은 기존 공인인증서, 간편비밀번호 인증 외에도 홍채인증을 통해 모바일 금융거래를 더욱 안전하고 편리하게 이용할 수 있게 되었다. 특히 고객들이 모바일앱에서 자주 이용하는 이체 거래시 보안카드, OTP 없이 홍채인증만으로 One Stop 거래가 가능해진 것이 가장 큰 장점이다.삼성증권 관계자는 ""홍채·지문 등 바이오인증을 통한 모바일 금융거래는 편리성과 보안성을 모두 갖추고 있어, 고객들의 관심이 높다.""고 말하고, ""홍채인증 도입으로 모바일 거래 고객의 만족도를 획기적으로 높일 수 것으로 기대된다.""고 설명했다.삼성증권은 지난해 8월 지문인증/간편비밀번호 서비스를 시작한데 이어 이번에 삼성 패스의 홍채인증 서비스를 도입하는 등 생체인증 서비스 부문을 선도하고 있으며, 앞으로도 다양한 신기술 기반의 편리하고 안전한 모바일 자산관리 서비스를 지속적으로 확대해 나갈 계획이다.실시간 재테크 경제뉴스│창업정보의 모든 것장효원 기자 specialjhw@mt.co.kr머니S 관련뉴스해당 언론사에서 선정하며 언론사 페이지(아웃링크)로 이동해 볼 수 있습니다.[대선 TV 토론] 심상정, 문재인 비판 ""증세계획 아무 것도 없다""누군 게워내고 누군 돌려받고… \'건보료 폭탄\' 희비[불황민국] 뽑기방·로또·드러그스토어의 공통점[대선 TV 토론] 심상정, 안철수 \'최저임금 공약\' 평가 ""아무것도 안하겠다는 얘기""동전없는 사회 출발, \'거스름 적립가능\' 매장 전국 2만3000곳좋아요0훈훈해요0슬퍼요0화나요0후속기사 원해요0기사제공 :']"
3,삼성전자, 2017-04-2110:54,이데일리 ,"삼성증권, 모바일앱에 홍채인증 도입",https://finance.naver.com/news/news_read.nhn?article_id=0003805458&office_id=018&mode=search&query=삼성전자&page=7,"['       삼성증권, 모바일앱에 홍채인증 도입      기사입력2017-04-21 10:54기사원문좋아요훈훈해요좋아요 평가하기공감좋아요0훈훈해요0슬퍼요0화나요0후속기사 원해요0댓글- “스마트폰만 쳐다보면 원스톱으로 주식거래·뱅킹 가능”[이데일리 유재희 기자] 삼성증권이 모바일앱에 홍채인증을 도입한다. 삼성증권은 21일부터 공인인증서나 보안카드없이 홍채인증만으로 모바일앱 ‘엠팝(mPOP)’의 금융거래가 가능하도록 해주는 홍채인증 서비스를 제공한다고 밝혔다. 삼성증권의 홍채인증 서비스는 홍채인증기능이 탑재된 삼성전자 갤럭시 S8을 통해 이용할 수 있다.이번 홍채인증 서비스 도입으로 삼성증권 고객은 모바일 금융거래를 더욱 안전하고 편리하게 이용할 수 있게 됐다. 특히 모바일앱에서 자주 이용하는 이체 거래시 보안카드, OTP 없이 홍채인증만으로 원스톱 거래가 가능해진 것이 가장 큰 장점으로 꼽힌다.삼성증권 관계자는 “홍채·지문 등 바이오인증을 통한 모바일 금융거래는 편리성과 보안성을 모두 갖추고 있어 고객들의 관심이 높다”며 “홍채인증 도입으로 모바일 거래 고객의 만족도를 획기적으로 높일 수 있을 것”이라고 말했다. 앞서 작년 8월 삼성증권은 지문인증·간편비밀번호 서비스도 도입한 바 있다. 유재희 (jhyoo76@edaily.co.kr)＜ⓒ종합 경제정보 미디어 이데일리 - 무단전재 & 재배포 금지＞이데일리 관련뉴스해당 언론사에서 선정하며 언론사 페이지(아웃링크)로 이동해 볼 수 있습니다.\'직주근접\' 서대문·광진 아파트, 경매시장서도 콧대 세[재벌공약 분석]너도나도 \'재벌개혁\'..총수일가 견제 강화조국 ""대통령이 \'북한주적\' 말하면 한반도 위기 고조""송민순, \'쪽지\' 공개..\'썰전\' 문재인 주장으로 내가 거짓말 한 게 돼변희재 ""문재인 나팔수 김어준, 홍준표 낙마할까 조바심""좋아요0훈훈해요0슬퍼요0화나요0후속기사 원해요0기사제공 :']"
4,삼성전자, 2017-04-2110:54,SBS ,"삼성, 갤S8 '붉은 화면' 논란에 소프트웨어 업데이트",https://finance.naver.com/news/news_read.nhn?article_id=0000523767&office_id=055&mode=search&query=삼성전자&page=7,"['       삼성, 갤S8 \'붉은 화면\' 논란에 소프트웨어 업데이트      기사입력2017-04-21 10:54기사원문좋아요훈훈해요좋아요 평가하기공감좋아요0훈훈해요0슬퍼요0화나요0후속기사 원해요0댓글삼성전자는 갤럭시S8 시리즈 일부 제품의 화면이 붉은빛을 띤다는 소비자 불만과 관련해 소프트웨어 업데이트를 시행한다고 밝혔습니다.삼성전자 관계자는 ""다음 주 소프트웨어 업데이트로 \'색상 최적화\' 기능을 보완할 예정""이라며 ""기존 색상 최적화를 하고도 여전히 화면이 빨갛다고 느끼는 이용자를 위해 색상 조정의 범위를 넓히려는 것""이라고 설명했습니다.이 관계자는 ""이번 소프트웨어 업데이트는 갤럭시S8 시리즈를 개통한 모든 고객을 대상으로 한다""며 ""기존 소프트웨어에 문제가 있다는 것을 인정하는 취지는 아니다""라고 덧붙였습니다.삼성전자는 그간 갤럭시S8 시리즈의 붉은 화면이 제품 불량 때문은 아니며, 색상 최적화와 컬러밸런스 테스트로 해결할 수 있는 문제라는 입장을 고수해왔습니다.(사진=뽐뿌 캡쳐, 연합뉴스)\xa0\xa0정호선 기자(hosun@sbs.co.kr)☞ 생생하게 듣는다! 대선후보 가상정책배틀\u200b☞ [Focus] 대선주자 페이스북을 통해 본 숨은 표심 ※ ⓒ SBS & SBS콘텐츠허브 : 무단복제 및 재배포 금지SBS 관련뉴스해당 언론사에서 선정하며 언론사 페이지(아웃링크)로 이동해 볼 수 있습니다.송민순 ""거짓말 아니다"" 문건 공개…문재인 ""북풍 조작""[영상] ""톤 바뀌었는데 목 상태 괜찮나?"" 묻자…안철수 답변朴, 삼성동 자택 매각 후 내곡동에 새집…""감정가 70억""노회찬 ""홍준표, 성범죄 모의 논란?…사퇴 후 격리 조치해야""日 대낮 40억 강도 사건…공항서 한국인 용의자로 검거좋아요0훈훈해요0슬퍼요0화나요0후속기사 원해요0기사제공 :']"
5,삼성전자, 2017-04-2110:53,아이뉴스24 ,"삼성증권, 모바일앱 '엠팝'에서 홍채인증 시작",https://finance.naver.com/news/news_read.nhn?article_id=0000408846&office_id=031&mode=search&query=삼성전자&page=7,"['       삼성증권, 모바일앱 \'엠팝\'에서 홍채인증 시작      기사입력2017-04-21 10:53기사원문좋아요훈훈해요좋아요 평가하기공감좋아요0훈훈해요0슬퍼요0화나요0후속기사 원해요0댓글[아이뉴스24 김다운기자] 삼성증권은 21일부터 공인인증서나 보안카드없이 홍채인증만으로 모바일앱 \'엠팝(mPOP)\'의 금융거래가 가능하도록 해주는 홍채인증 서비스를 제공한다고 발표했다.삼성증권의 홍채인증 서비스는 홍채인증기능이 탑재된 삼성전자 \'갤럭시 S8\'을 통해 이용할 수 있다.삼성증권이 제공하는 홍채인증 서비스는 삼성전자의 \'삼성 패스\'에 적용된 첨단 생체 인증 기술을 기반으로 한 안전한 보안체계를 갖추고 있다.이번 홍채인증 서비스 도입으로 삼성증권 고객은 기존 공인인증서, 간편비밀번호 인증 외에도 홍채인증을 통해 모바일 금융거래를 이용할 수 있게 됐다.삼성증권은 지난해 8월 지문인증·간편비밀번호 서비스를 시작한데 이어 이번에 삼성 패스의 홍채인증 서비스를 도입했다.특히 고객들이 모바일앱에서 자주 이용하는 이체 거래시 보안카드, 일회용비밀번호(OTP) 없이 홍채인증만으로 원스톱 거래가 가능하다.삼성증권 관계자는 ""홍채·지문 등 바이오인증을 통한 모바일 금융거래는 편리성과 보안성을 모두 갖추고 있어, 고객들의 관심이 높다""며 ""홍채인증 도입으로 모바일 거래 고객의 만족도를 획기적으로 높일 수 것으로 기대된다""고 말했다./김다운기자 kdw@inews24.com▶프리미엄 뉴스서비스 아이뉴스24▶연예스포츠 조이뉴스24, 생생한 라이브캐스트[ⓒ 아이뉴스24 무단전재 및 재배포 금지]아이뉴스24 관련뉴스해당 언론사에서 선정하며 언론사 페이지(아웃링크)로 이동해 볼 수 있습니다.펀드슈퍼마켓, 연수익률 7% 목표전환형 펀드 판매드래곤플라이, \'스타일 피.오.피\' 플레이 영상 공개우리은행, \'갤럭시 S8\' 홍채인증 서비스 출시대신증권 AI챗봇 \'벤자민\' 카카오톡에서도 대화한다신한은행, 아름다운 은퇴이야기 공모 이벤트좋아요0훈훈해요0슬퍼요0화나요0후속기사 원해요0기사제공 :']"
6,삼성전자, 2017-04-2110:53,머니투데이 ,"추미애, 변재일·정장선 손 덥썩 잡고 ""짝사랑 아니었다""",https://finance.naver.com/news/news_read.nhn?article_id=0003860809&office_id=008&mode=search&query=삼성전자&page=7,"['       추미애, 변재일·정장선 손 덥썩 잡고 ""짝사랑 아니었다""      기사입력2017-04-21 10:53기사원문좋아요훈훈해요좋아요 평가하기공감좋아요0훈훈해요0슬퍼요0화나요0후속기사 원해요0댓글 [머니투데이 최경민 김유진  기자] [[the300]당내 \'통합\' 과시…변재일 ""文과 4차산업혁명 성공 이어갈 수 있다""]21일 서울 여의도 더불어민주당 당사에서 진행된 4차산업혁명 및 신성장 전문가 지지선언식에서 추미애 상임선대위원장(가운데)과 변재일 의원(추 위원장 오른쪽), 정장선 전 의원이 손을 맞잡고 있다./사진=최경민 기자.더불어민주당 4차산업혁명 신산업전문가 지지선언 및 정책제안 전달식이 21일 서울 여의도 민주당사에서 열렸다. 식을 진행하던 추미애 상임선대위원장이 갑자기 오른쪽에 서 있던 변재일 의원의 손을 덥썩 잡았다. 추 위원장은 ""제가 사모해 마지 않던 변 의원""이라고 소개했다. 그리고 구석에 있던 정장선 전 의원도 호명했다. ""거기 있지 말로 여기로 오세요""라고 말하며 자신의 왼쪽으로 정 전 의원을 불렀다. 세 사람은 손을 마주잡고 활짝 웃었다.\'당내 통합\'의 모습을 과시한 셈이다. 변 의원과 정 전 의원은 당내 비주류 인사들이다. 특히 변 의원을 둘러싸고는 공식선거운동이 시작되기 직전까지 \'탈당설\'이 불거졌었다. 막바지에 박영선 공동선대위원장 등과 함께 선대위 합류를 극적으로 선언했던 변 의원이다. 정 전 의원은 손학규계로 \'김종인 비상대책위원회\' 시절 총무본부장(현 사무총장격)을 지냈었다.변 의원은 선대위에서 4차산업혁명추진위원장을, 정 전 의원은 4차산업혁명신성장위원장을 맡았다. ""문재인 화이팅, 민주당 화이팅, 대선승리 화이팅""도 추 대표와 함께 힘차게 외쳤다. 추 대표는 ""추미애도, 변재일도, 정장선도 변하지 않는다""며 \'통합\'을 거듭 강조했다. 변 의원에게는 ""원래 짝사랑만 했는데, 손을 만져보니 나만의 짝사랑이 아니라, 이분도 나를 사랑하는 것 같다""고 말하기도 했다.변 의원은 ""국민 여러분들의 적극적인 지지 속에 문재인 후보와 정부를 출범시키면 과거 민주정부가 해낸 4차산업혁명의 성공을 이어갈 수 있지 않을까 생각한다""며 ""다시 한 번 전세계 4차산업혁명과 지능정보사회를 선도하는 그런 나라가 될 수 있도록 최선을 다하겠다""고 말했다.한편 이날 206명에 달하는 4차산업혁명 전문가들이 문 후보와 민주당에 대한 지지를 선언하며 정책제안서를 전달했다. 고진 한국무선인터넷산업연합회 회장, 김창현 포스텍 교수, 김정호 KAIST 교수, 김헌배 전 삼성전자 무선사업부 부사장, 노규성 한국디지털정책학회 회장, 정선종 전 전자통신연구원 원장 등이 지지자 명단에 이름을 올렸다.이들은 지지 선언문을 통해 ""문 후보는 그동안 4차산업혁명을 일자리 창출과 신산업 육성을 위한 기회로 만들기 위한 공약들을 제시했다. 참단산업에서 전통산업까지 산업의 융·복합을 통해 4차산업혁명의 비전을 달성하는데 매우 적절한 정책""이라며 ""문 후보의 정책을 통해서 기존 산업을 혁신하고 미래산업을 새롭게 육성해 지속가능한 경제와 일자리 문제를 해결할 수 있다고 생각한다""고 밝혔다.[▶깊이있는 투자정보 \'TOM칼럼\'][▶트렌드 리더의 스타일 지침서 \'스타일M\'][▶빵빵한 차&레이싱걸]최경민 김유진  기자 brown@mt.co.kr머니투데이 관련뉴스해당 언론사에서 선정하며 언론사 페이지(아웃링크)로 이동해 볼 수 있습니다.서지혜, 모노키니 입고 뽐낸 바디라인…우아함이 \'물씬\'[단독] 최태원 회장 보러온 \'딸\' 최민정 중위…사회적기업에 \'관심\'""14년 7월생-15년 9월생이 친구"" 安 학제개편 논란문재인 ""가만 서있는데 스탠딩 무슨 의미…답변시간도 부족""김성근 감독 ""최근 트레이드 보면 대단, 우리도 준비중""좋아요0훈훈해요0슬퍼요0화나요0후속기사 원해요0기사제공 :']"
