,회사명,날짜,언론사,기사제목,링크,본문
10,삼성전자, 2017-03-1113:24,부산일보 ,삼성전자 하만 인수 완료…9조원에 美자동차 전장기업 품어,https://finance.naver.com/news/news_read.nhn?article_id=0000686166&office_id=082&mode=search&query=삼성전자&page=1,"['       삼성전자 하만 인수 완료…9조원에 美자동차 전장기업 품어      기사입력2017-03-11 13:24기사원문좋아요훈훈해요좋아요 평가하기공감좋아요0훈훈해요0슬퍼요0화나요0후속기사 원해요0댓글삼성전자 하만 인수 완료. 사진=삼성전자 제공삼성전자가 미국 자동차 전장 업체인 하만(Harman) 인수를 완료했다.\xa0삼성전자는 10일(현지시간) 미국을 비롯한 10개 반독점 심사 대상국의 승인 등 인수에 필요한 모든 절차를 마치고 하만을 인수했다고 밝혔다. \xa0지난해 11월 14일 하만과 인수 계약을 체결한 지 약 4개월 만이다. 지난달 18일에는 하만이 주주총회를 열어 승인을 받아냈다.\xa0 하만의 주주들은 보유주식 1주당 112달러의 현금을 지급받게 되며, 삼성전자 미국법인(SEA)이 하만의 지분 100%를 보유하게 된다.\xa0 \xa0다만 하만의 경영은 디네쉬 팔리월 하만 사장(CEO)을 비롯한 현재의 경영진에 의해 독립적으로 이뤄진다. 또 임직원과 본사, 해외사업장은 물론 하만이 보유한 브랜드도 그대로 유지된다.\xa0이에 따라 삼성전자는 총수인 이재용 부회장의 구속이라는 비상상황 속에서도 9조 원대 ‘빅 딜’을 안정적으로 성사시켰다. 미래 성장동력으로 지목했던 전장 사업 분야에서 확고한 사업 기반을 마련, 단숨에 글로벌 메이저 전장업체로 이름을 올리게 됐다.\xa0손영권 삼성전자 전략혁신센터(SSIC) 사장 겸 하만 이사회 의장은 “삼성전자와 하만은 오디오, 가전, 스마트폰 등 다양한 분야에서 기술과 경험을 공유함으로써 고객들에게 혁신적이고 독창적인 제품과 차별화된 경험을 제공하고, 커넥티드카 분야의 기술 혁신을 선도해 완성차 업체에 최고의 파트너가 될 것”이라고 말했다. \xa0하만의 디네쉬 팔리월 CEO는 “삼성은 하만이 보유한 고객과의 신뢰관계는 물론 스피드와 혁신을 중시하는 문화를 공유할 수 있는 가장 이상적인 주주이자 파트너”라며 “이번 인수합병을 통해 주주, 고객, 임직원 모두에게 새로운 가치와 기회를 제공하고, 자동차 전장과 오디오 등의 분야에서 성장을 가속화해 글로벌 리더십을 강화할 것”이라고 강조했다.\xa0삼성전자 전장사업팀은 삼성이 보유한 혁신적 기술들을 하만의 전장 제품에 접목하고 구매·물류·마케팅 등 여러 분야에서 시너지를 낼 수 있도록 하만과 협력을 확대해 나갈 방침이다.\xa0김상록 기자\xa04067park@< 저작권자 ⓒ 부산일보(www.busan.com) 무단 전재 및 재배포 금지 >부산일보 관련뉴스해당 언론사에서 선정하며 언론사 페이지(아웃링크)로 이동해 볼 수 있습니다.도봉순 지수 \'츤데레 매력폭발\'vs형식 \'치명적 매력남\'...누굴 고르지신혼일기 종영 구혜선, 남편 안재현 옛 여친 사진 발견 ""못 볼 것 봤다""사망자 3명으로 늘어...탄핵여파 어디까지, 또 다른 1명도 \'위중\'쇼 음악중심, 탄핵 여파로 11일 결방...\'반지의 여왕\' 재방송 대체성훈, 속았다...\'가짜\' 화보촬영 위해 불꽃 트레이닝, 명품복근 \'시선 확\'좋아요0훈훈해요0슬퍼요0화나요0후속기사 원해요0기사제공 :']"
11,삼성전자, 2017-03-1113:00,연합뉴스 ,[주간 주요공시] 코스피·코스닥-10일,https://finance.naver.com/news/news_read.nhn?article_id=0009099760&office_id=001&mode=search&query=삼성전자&page=1,"['       [주간 주요공시] 코스피·코스닥-10일      기사입력2017-03-11 13:00기사원문좋아요훈훈해요좋아요 평가하기공감좋아요0훈훈해요0슬퍼요0화나요0후속기사 원해요0댓글 ▲ 이노와이어리스, 회사 분할 결정     ▲ CJ대한통운, 대한통운에스비 주식 전량 계열사에 매각     ▲ 거래소, 이엠넷·케이씨에스에 급등 조회공시 요구     ▲ 우리들휴브레인 ""문재인 전 대표와 이해관계 없어""     ▲ 우성사료 ""문재인·안철수와 무관""     ▲ 오스템임플란트 ""대표이사 엄태관씨로 변경""     ▲ 넥솔론, 자본금 전액 잠식…""주권 상장폐지 우려""     ▲ 위노바 ""문재인 전 대표와 연관성 없다""     ▲ 포스코 ""대표이사 사장 오인환·최정우씨로 변경""     ▲ 바른손 ""문재인 전 대표와 사업성 관련성 없다""     ▲ STX 채권금융기관, 3천600억원 출자전환 결정     ▲ 동원개발, 경기도 화성 670억원 규모 공사 수주     ▲ 아바코, 中업체와 160억원 규모 LCD제조장비 공급계약     ▲ 경동나비엔 ""손연호·홍준기 대표체제로 변경""     ▲ 신세계건설 ""대표이사 윤명규씨로 변경""     ▲ 기가레인, 사업부문 분할…2개 회사 신설     ▲ ""분할상장 이녹스첨단소재, 재상장 심사요건 충족""     ▲ 인텍플러스, 삼성전자에 반도체패키치 검사장비 공급     ▲ 제노포커스, 성운바이오 지분 65.35% 인수     (서울=연합뉴스)최신 유행 트렌드 총집결 #흥(클릭!)연합뉴스 관련뉴스해당 언론사에서 선정하며 언론사 페이지(아웃링크)로 이동해 볼 수 있습니다.\xa0문재인, NYT와 인터뷰…""미국에 \'No\' 라 할 수 있어야""\xa0朴 탄핵 BBC 인터뷰 생방송 사고(?) 낸 英 교수\xa0이집트 빈민촌서 람세스 2세 추정 거대 석상 발견\xa0서울고법, \'면회 금지 풀어달라\' 최순실 요청 또 기각\xa0알래스카서 거대 유전 발견…美육지 유전으로는 30년 만에 최대좋아요0훈훈해요0슬퍼요0화나요0후속기사 원해요0기사제공 :']"
12,삼성전자, 2017-03-1112:52,한국일보 ,총수 없어도 착착… 삼성전자 ‘하만’ 인수 완료,https://finance.naver.com/news/news_read.nhn?article_id=0000192134&office_id=469&mode=search&query=삼성전자&page=1,"['       총수 없어도 착착… 삼성전자 ‘하만’ 인수 완료      기사입력2017-03-11 12:52기사원문좋아요훈훈해요좋아요 평가하기공감좋아요0훈훈해요0슬퍼요0화나요0후속기사 원해요0댓글지난달 17일 서울 서초구 삼성전자 사옥에서 직원들이 식사하기 위해 이동하고 있다. 류효진 기자 사상 첫 총수 구속이라는 악재 속에서도 삼성전자가 세계 최대 전장사업 전문기업인 하만을 성공적으로 품에 안았다. 삼성전자는 10일(현지시간) 미국에서 하만 인수를 완료했다고 11일 밝혔다. 삼성전자는 지난해 11월 14일 하만과 인수 계약을 체결한 이후 하만 주주총회 승인, 미국을 비롯한 10개 반독점 심사 대상국의 승인 등 인수에 필요한 모든 절차를 마쳤다. 인수 완료로 하만 주주들은 보유주식 1주당 112달러의 현금을 지급받게 된다. 인수 총액은 80억달러(약 9조4,000억원)로 국내 기업의 해외 인수합병(M&A) 사상 최대 규모다. 삼성전자 미국법인(SEA)이 하만의 지분 100%를 보유하게 된다. 손영권 삼성전자 전략혁신센터(SSIC) 사장이자 하만 이사회 의장은 ""삼성전자와 하만은 오디오, 가전, 스마트폰 등 다양한 분야에서 기술과 경험을 공유함으로써 고객들에게 혁신적이고 독창적인 제품과 차별화된 경험을 제공하고, 커넥티드카 분야의 기술혁신을 선도해 완성차 업체에게 최고의 파트너가 될 것""이라고 말했다.  하만의 디네쉬 팔리월(Dinesh Paliwal) 최고경영자(CEO)는 ""삼성은 하만이 보유한 고객과의 신뢰관계는 물론 스피드와 혁신을 중시하는 문화를 공유할 수 있는 가장 이상적인 주주이자 파트너""라며 ""이번 인수합병을 통해 주주, 고객, 임직원 모두에게 새로운 가치와 기회를 제공하고, 자동차 전장과 오디오 등의 분야에서 성장을 가속화해 글로벌 리더십을 강화할 것""이라고 밝혔다.인수 절차가 마무리됨에 따라 삼성전자 전장사업팀은 삼성이 보유한 혁신적인 기술들을 하만의 전장 제품에 접목하고, 구매, 물류, 마케팅 등 여러 분야에서 시너지를 낼 수 있도록 하만과 협력을 확대해 나갈 방침이다.하만은 디네쉬 CEO를 비롯한 현재의 경영진에 의해 독립적으로 경영되며, 임직원과 본사, 해외사업장은 물론 하만이 보유한 브랜드도 그대로 유지할 계획이다.맹하경 기자 hkm07@hankookilbo.com▶한국일보 [페이스북] [카카오 친구맺기]▶자동차의 모든 것! [모클][ⓒ 한국일보(hankookilbo.com), 무단 전재 및 재배포 금지]한국일보 관련뉴스해당 언론사에서 선정하며 언론사 페이지(아웃링크)로 이동해 볼 수 있습니다.박근혜 정부를 파멸로 몬 결정적 10장면휴일 반납하고 구내식당 이용… 3개월간 수도승 같은 삶김이수ㆍ이진성 ""朴, 세월호 7시간 지나치게 불성실""2명 사망 \'유혈사태\'… 과격성 더해가는 \'친박단체 집회\'박근혜 정부 실패 조연 10인좋아요0훈훈해요0슬퍼요0화나요0후속기사 원해요0기사제공 :']"
13,삼성전자, 2017-03-1112:50,한국경제 ,"삼성전자, 이재용 부회장 구속 상황에서도 하만 인수 완료",https://finance.naver.com/news/news_read.nhn?article_id=0003739466&office_id=015&mode=search&query=삼성전자&page=1,"['       삼성전자, 이재용 부회장 구속 상황에서도 하만 인수 완료      기사입력2017-03-11 12:50기사원문좋아요훈훈해요좋아요 평가하기공감좋아요0훈훈해요0슬퍼요0화나요0후속기사 원해요0댓글사진=방송화면삼성전자가 미국의 자동차 전자장비 업체 하만 인수에 성공했다. 삼성전자는 11일(현지시간 10일) 미국을 비롯한 10개 반독점 심사 대상국의 승인 등 인수에 필요한 모든 절차를 마치고 하만을 인수했다고 밝혔다.지난해 11월 14일 하만과 인수 계약을 체결한 지 약 4개월 만이다.지난달 18일에는 하만이 주주총회를 열어 승인을 받아냈다.이에 따라 삼성전자는 총수인 이재용 부회장의 구속이라는 비상상황 속에서도 9조 원대 \'빅 딜\'을 안정적으로 성사시켰다.미래 성장동력으로 지목해 진출을 추진해온 전장 사업 분야에서 확고한 사업 기반을 마련하며 단숨에 글로벌 메이저 전장업체로 이름을 올리게 됐다.인수 완료에 따라 하만의 주주들은 보유주식 1주당 112달러의 현금을 받는다.삼성전자는 미국법인(SEA)을 통해 하만의 지분을 100% 보유하게 된다.다만 하만의 경영은 디네쉬 팔리월(Paliwal) 하만 사장(CEO)을 비롯한 현재의 경영진에 의해 독립적으로 이뤄진다. 또 임직원과 본사, 해외사업장은 물론 하만이 보유한 브랜드도 그대로 유지된다.손영권 삼성전자 전략혁신센터(SSIC) 사장 겸 하만 이사회 의장은 ""삼성전자와 하만은 오디오, 가전, 스마트폰 등 다양한 분야에서 기술과 경험을 공유함으로써 고객들에게 혁신적이고 독창적인 제품과 차별화된 경험을 제공하고, 커넥티드카 분야의 기술 혁신을 선도해 완성차 업체에 최고의 파트너가 될 것""이라고 말했다.하만의 디네쉬 팔리월(Paliwal) CEO(사장)는 ""삼성은 하만이 보유한 고객과의 신뢰관계는 물론 스피드와 혁신을 중시하는 문화를 공유할 수 있는 가장 이상적인 주주이자 파트너""라고 말했다.그는 또 ""이번 인수합병을 통해 주주, 고객, 임직원 모두에게 새로운 가치와 기회를 제공하고, 자동차 전장과 오디오 등의 분야에서 성장을 가속화해 글로벌 리더십을 강화할 것""이라고 강조했다.한경닷컴 스포츠연예팀 newsinfo@hankyung.com[한경닷컴 바로가기] [스내커] [모바일한경 구독신청] ⓒ 한국경제 & hankyung.com, 무단전재 및 재배포 금지한국경제 관련뉴스해당 언론사에서 선정하며 언론사 페이지(아웃링크)로 이동해 볼 수 있습니다.아들과 \'대화\' 못하는 아버지…이유 알고보니""우리나라 최고의 전통미인은…""페이팔에 550억 투자받은 \'한국인\' 정체가…[화보] 박시연, 목걸이가 미워요[화보] 팔로우美의 각선美좋아요0훈훈해요0슬퍼요0화나요0후속기사 원해요0기사제공 :']"
14,삼성전자, 2017-03-1112:30,연합뉴스 ,[주간 주요공시] 코스피·코스닥-9일,https://finance.naver.com/news/news_read.nhn?article_id=0009099717&office_id=001&mode=search&query=삼성전자&page=1,"['       [주간 주요공시] 코스피·코스닥-9일      기사입력2017-03-11 12:30기사원문좋아요훈훈해요좋아요 평가하기공감좋아요0훈훈해요0슬퍼요0화나요0후속기사 원해요0댓글 ▲ 나이스 ""나이스인프라, 작년 흑자전환""     ▲ 토비스, \'이중 카메라 플래시\' 이동통신단말기 특허     ▲ 에스폴리텍 작년 연결 영업익 28억원…흑자전환     ▲ 로체시스템즈, 주주배정 유상증자 청약률 112.92%     ▲ 테스, 134억원 반도체 제조장비 공급계약     ▲ 인베니아, 중국에 309억원 디스플레이 제조장비 공급     ▲ KG ETS, 작년 영업이익 11% 감소…100원씩 배당     ▲ 삼성증권, 주주배정 유상증자 청약률 108.4%     ▲ 케이피엠테크, 삼성전자 베트남법인에 설비 공급     ▲ 피제이메탈, 작년 영업이익 15억원…81% 감소     ▲ 에스엠, 작년 연결 영업익 207억원…43%↓     ▲ 이엔쓰리, 10억원 3자배정 증자 결정     ▲ 화신테크, 작년 영업손실 122억원…적자확대     ▲ 삼지전자, 작년 연결 영업익 313억원…24% 증가     ▲ 대성합동지주, 작년 연결 영업손실 198억원…적자축소     ▲ 대성산업, 50% 이상 자본잠식…매매거래 정지     ▲ 아리온, 작년 연결 영업손실 89억원…적자전환     ▲ 포티스, 50억원 3자배정 증자 결정     ▲ 재영솔루텍, 60억원 3자배정 증자 결정     ▲ 이녹스, 장경호·김필영 각자 대표체제로 변경     ▲ 포티스, 정상훈 단독 대표이사 체제로 변경     ▲ 롯데칠성, 보통주 1주당 1만원 현금배당 결정     ▲ 에임하이, 74억원 3자배정 증자 결정     ▲ 원림, 작년 연결 영업이익 105억원…50% 증가     ▲ 코아크로스, 보통주 10대 1 감자 결정     ▲ 이건산업, 작년 연결 영업익 174억원…6% 감소     ▲ 세동, 주주배정 유상증자 청약률 107.71%     ▲ 한진 ""미국 롱비치터미널 지분 인수 추진 안 해""     ▲ 제이앤케이히터, 작년 연결 영업익 26억원…72%↓     ▲ 나노, 54억원 플레이트 촉매 공급계약     ▲ KG케미칼, 작년 연결 영업익 539억원…19% 증가     ▲ 평화홀딩스, 작년 연결 영업익 161억원…202%↑     ▲ 가스공사, 13개 건설사에 2천억원 규모 손배소 제기     ▲ 옵트론텍, 작년 연결 영업익 169억원…671% 증가     ▲ 거래소 ""CS, 상장적격성 실질심사 대상서 제외""    (서울=연합뉴스)최신 유행 트렌드 총집결 #흥(클릭!)연합뉴스 관련뉴스해당 언론사에서 선정하며 언론사 페이지(아웃링크)로 이동해 볼 수 있습니다.\xa0문재인, NYT와 인터뷰…""미국에 \'No\' 라 할 수 있어야""\xa0朴 탄핵 BBC 인터뷰 생방송 사고(?) 낸 英 교수\xa0이집트 빈민촌서 람세스 2세 추정 거대 석상 발견\xa0서울고법, \'면회 금지 풀어달라\' 최순실 요청 또 기각\xa0알래스카서 거대 유전 발견…美육지 유전으로는 30년 만에 최대좋아요0훈훈해요0슬퍼요0화나요0후속기사 원해요0기사제공 :']"
15,삼성전자, 2017-03-1112:06,이데일리 ,[주간추천주]유안타증권,https://finance.naver.com/news/news_read.nhn?article_id=0003769898&office_id=018&mode=search&query=삼성전자&page=1,"['       [주간추천주]유안타증권      기사입력2017-03-11 12:06기사원문좋아요훈훈해요좋아요 평가하기공감좋아요0훈훈해요0슬퍼요0화나요0후속기사 원해요0댓글 [이데일리 이후섭 기자]◇코스피△삼성전기(009150)-올해 1분기부터 경영효율화 효과 나타나며 정상화 국면 진입 기대.-중국 스마트폰 업체들이 듀얼카메라를 경쟁적으로 채용하고 있다는 점이 긍정적으로 작용할 전망.-지난달부터 삼성전자의 신규 제품인 갤럭시 S8 대상 부품공급 본격화 예상.△이수페타시스(007660)-2018년부터 본격화될 5G 관련 투자 사이클에 따른 다층인쇄회로기판(MLB) 사업 수혜 집중.-스마트폰 주기판(HDI) 부문은 최근 중화권 고객 확보로 성장 가시성 부각.-중국법인은 가동률 상승과 제품믹스 개선으로 적자 규모 대폭 감소할 전망.-연성인쇄회로기판(FPCB) 부문은 업계 구조조정에 따른 수혜 및 인원감축에 따른 고정비 부담 완화로 흑자전환에 성공할 전망.◇코스닥△컴투스(078340)-지난해 4분기 패키지 판매에 따른 서머너즈워 실적 개선.-올해 1분기 서머너즈워 실시간 대전모드 게임 업데이트에 따른 유료아이템 매출 증가 기대.이후섭 (dlgntjq@edaily.co.kr)＜ⓒ종합 경제정보 미디어 이데일리 - 무단전재 & 재배포 금지＞이데일리 관련뉴스해당 언론사에서 선정하며 언론사 페이지(아웃링크)로 이동해 볼 수 있습니다.촛불 朴퇴진은 시작일 뿐 VS 태극기 불복종 운동 전개[박근혜 파면] 美 ""한국에 사드 장비 계속 보낸다""(종합)촛불 ""지금 당장 박근혜 구속하라""男, 재혼 후 원만한 부부관계 유지 요건 2위 \'성적취향\' 1위는?솔로탈출 촉진제 1위 男 \'옥외 애정행위\' 女 \'연인 기념일\'좋아요0훈훈해요0슬퍼요0화나요0후속기사 원해요0기사제공 :']"
16,삼성전자, 2017-03-1112:00,연합뉴스 ,"[증권가 주간화제] 외국인, 사드·탄핵 혼돈속 韓주식 샀다",https://finance.naver.com/news/news_read.nhn?article_id=0009099667&office_id=001&mode=search&query=삼성전자&page=1,"['       [증권가 주간화제] 외국인, 사드·탄핵 혼돈속 韓주식 샀다      기사입력2017-03-11 12:00기사원문좋아요훈훈해요좋아요 평가하기공감좋아요0훈훈해요0슬퍼요0화나요0후속기사 원해요0댓글 지난주 4억5천만달러…9개 주요 신흥국 중 가장 많아(서울=연합뉴스) 박상돈 기자 = 탄핵 정국에 주한미군의 고고도미사일방어체계(THAAD·사드)배치를 겨냥한 중국의 보복 공세와 미국 금리인상 우려까지 겹친 상황에서 외국인투자자들이 최근 한국 주식을 계속 사 관심을 모았다.    외국인들의 한국 순매수 행진은 작년 12월이후 4개월째 계속되고 있다.    특히 지난주 한국 증시에서의 외국인 순매수 규모는 인도, 베트남, 브라질 등 주요 신흥국 9개국 가운데 규모가 가장 컸다.    이번 주에도 외국인은 한국 증시에서 \'사자\' 행진을 이어갔다.     11일 유안타증권과 국제금융센터에 따르면 지난주 한국 증시에서 외국인의 순매수 규모는 4억5천120만달러에 달했다.    이는 다른 신흥국에 비해 월등히 컸다.     같은 기간 외국인 순매수 규모는 인도 1억2천230만달러, 베트남 1천270만달러, 인도네시아 910만달러 등이었다. 외국인의 한국증시 순매수 금액이 인도 등 순매수 3개국을 모두 합한 1억4천410만달러보다 3억1천달러 가량 많았다.     반면에 대만에서는 외국인이 가장 많은 1억7천270만달러 순매도했다. 이어 태국(1억5천220만달러), 필리핀(4천910만달러), 브라질(3천550만달러), 파키스탄(2천880만달러) 등에서도 순매도했다.    지난주 국내에서는 중국의 사드 보복 조치와 미국 연방준비제도(Fed·연준)의 3월 금리 인상 가능성으로 원/달러 환율이 상승했지만, 외국인의 한국 증시 선호 현상은 멈추지 않았다.    외국인의 대규모 순매수는 한국 주가 상승률이 저조한 상황에서도 진행됐다.    지난주 한국의 증시는 0.73% 하락해 대만(-1.05%)을 제외하면 주요 신흥국 중 하락률이 높았다. 파키스탄 주가는 1.26% 올라 상승률이 가장 높았다.     원/달러 환율은 미국 연준의 3월 금리 인상이 기정사실로 되면서 지난달 24일 1,131.5원에서 이달 3일 1,156.1원으로 2.2% 올랐다.    이처럼 각종 대내외 불안요인이 상존하지만, 한국 증시가 외국인에게 매력적인 것은 우선 기초여건이 탄탄하다는 점을 인정받고 있기 때문으로 보인다.    지난달 국제 신용평가기관인 무디스가 국회의 대통령 탄핵안 가결과 북한의 미사일 발사 사태에도 한국의 신용등급을 \'Aa2\' 현행 등급으로 유지했다.    삼성전자와 SK하이닉스 등 기업들의 실적이 꾸준히 좋은 모습을 보이는 것도 한국 증시의 매력을 키우는 요소로 꼽힌다.    외국인은 이번 주에도 사진 행진을 이어가 유가증권시장에서 6~10일 1조1천43억원을 순매수했고 코스닥시장에서도 750억원을 순매수했다.     올해 들어 전날까지 유가증권시장에서 외국인의 누적 순매수 규모는 3조7천55억원에 달했다. 코스닥시장은 781억원으로 집계됐다.     민병규 유안타증권 연구원은 ""한국은 이익과 가치평가 측면에서 신흥국 중 가장 매력적인 증시 중 하나""라며 ""외국인은 여전히 이것에 반응하고 있다""고 진단했다.    kaka@yna.co.kr최신 유행 트렌드 총집결 #흥(클릭!)연합뉴스 관련뉴스해당 언론사에서 선정하며 언론사 페이지(아웃링크)로 이동해 볼 수 있습니다.\xa0朴 탄핵 BBC 인터뷰 생방송 사고(?) 낸 英 교수\xa0이집트 빈민촌서 람세스 2세 추정 거대 석상 발견\xa0서울고법, \'면회 금지 풀어달라\' 최순실 요청 또 기각\xa0알래스카서 거대 유전 발견…美육지 유전으로는 30년 만에 최대\xa0남친 힘으로 제압하고 표백제 먹인 美20대, 살인혐의 기소좋아요0훈훈해요0슬퍼요0화나요0후속기사 원해요0기사제공 :']"
