,회사명,날짜,언론사,기사제목,링크,본문
9,삼성전자, 2017-08-0409:53,전자신문 ,[ET투자뉴스]SK하이닉스_상대적인 하락폭 더욱 커 현재 -2.14%,https://finance.naver.com/news/news_read.nhn?article_id=0002630897&office_id=030&mode=search&query=삼성전자&page=5,"['       [ET투자뉴스]SK하이닉스_상대적인 하락폭 더욱 커 현재 -2.14%      기사입력2017-08-04 09:53기사원문좋아요훈훈해요좋아요 평가하기공감좋아요0훈훈해요0슬퍼요0화나요0후속기사 원해요0댓글 코스피 대형주지수가 상승하고 있지만 SK하이닉스는 상대적으로 약세를 유지하고 있다.  4일 오전 9시 48분 현재 1400원(2.14%) 내려 64,100원을 기록중인 SK하이닉스는 강세장에서의 약세가 더욱 눈에 띄는 모습이다.    [포인트검색]     7월25일 :에스케이하이닉스(주) 연결재무제표기준영업(잠정)실적(공정공시)    [주가/수급동향]     8월1일부터 전일까지 기관이 3거래일 연속 순매도를 보였다. 최근 한달간 SK하이닉스의 상장주식수 대비 거래량을 비교해보니 일별 매매회전율이 0.56%로 집계됐다.  그리고 동기간 장중 저점과 고점의 차이인 일평균 주가변동률을 4.12%를 나타내고 있다.  그리고 최근 5일간 거래비중은 개인이 50.42%로 가장 높은 참여율을 보였고, 기관이 24.91%를 보였으며 외국인은 24.66%를 나타냈다.     [투자의견]     최근 한달간 제시된 증권사 투자의견을 종합해보면  SK하이닉스의 평균 목표주가는 85,400원이다. 현재 주가는 64,100원으로 21,300원(33%)까지 추가상승 여력이 존재한다.   [업종내 종목흐름]     이 시각 현재 관련종목들은 혼조세를 보이고 있고 전기전자업종은    0.06% 하락하고 있다. 삼성전자 2,392,000원▲3000(+0.13%) LG전자 70,000원▲1600(+2.34%)  삼성전기 92,100원▼600(-0.65%) 삼성SDI 180,500원▲5000(+2.85%)    [재무특징]     영업이익률 현재 26.13%로 업종평균 상회. PER은 11.22로 업종평균보다 낮으며, PBR은 1.97임.  증시분석 전문기자 로봇 ET etbot@etnews.com전자신문과 씽크풀의 증시분석 전문기자 로봇 ET가 쓴 기사입니다▶ 전자신문 인기 포스트▶ 전자신문 공식 페이스북▶ 전자신문 바로가기 [Copyright ⓒ 전자신문 & 전자신문인터넷, 무단전재 및 재배포 금지]전자신문 관련뉴스해당 언론사에서 선정하며 언론사 페이지(아웃링크)로 이동해 볼 수 있습니다.車 안에서 모든 게 이뤄진다…전 세계가 \'카 페이\' 전쟁으로개인소유 전기차 충전기 ""공유하면 돈 벌어요""삼성디스플레이, 애플용 OLED 라인 이달 \'풀가동\'…7배 증산단말기 완전자급제 도입 추진···과제도 적지 않다직수형 정수기, 점유율 50%로 높아졌다...기존 저수조 정수기도 기술력 \'맞불\'좋아요0훈훈해요0슬퍼요0화나요0후속기사 원해요0기사제공 :이 기사는 뉴스제휴평가위원회 \'뉴스제휴 및 제재 심사 규정\'에 따라노출 중단된 기사입니다.이전페이지목록보기인쇄하기목록보기증시 주요뉴스[유럽개장]일제히 상승 출발…英 0.33%↑[Asia마감] 코로나 4차 확산 불안감에 눌..[마켓뷰] 코스피, 6거래일 연속 상승…외국인..[시황종합] 코스피 6일째 상승 3140선 마..[코스닥 마감]이틀째 올라 980선 회복…씨젠..[마감시황]코스피, 개인·외인 매수에 상승…3..[외환마감]환율, 사흘만에 강보합..""미 국채..[Asia오전]어닝시즌 앞두고 혼조…日↓·홍콩..이전 페이지로 돌아가기|맨위로더보기대신증권 센터장 ""올해 코스피 3630 간다""…주목할 기업 12곳일주일새 3배 폭등… 우선주 ‘묻지마 투자’ 주의보""코스피 최고점 간다""…돌아온 외국인, 장바구니에 뭐 담길까코스피 실적잔치…기저효과 뺀 알짜배기 종목은?옵션 만기일 맞은 코스피…증권가 ""외국인에 주목하라""160% 폭등하다 상장폐지, 가상화폐 상폐빔 아십니까주가 최고가 찍은 카카오, 액면분할 하면 어떻게 될까8일 장 마감 후 주요 종목뉴스더보기인기검색어삼성전자84,700씨젠167,000카카오548,000벽산3,795현대차231,500이용약관금융게시판 운영원칙개인정보처리방침책임의 한계와 법적고지금융 고객센터네이버(주)가 제공하는 금융 정보는 각 콘텐츠 제공업체로부터 받는 투자 참고사항이며, 오류가 발생하거나 지연될 수 있습니다.네이버(주)와 콘텐츠 제공업체는 제공된 정보에 의한 투자 결과에 법적인 책임을 지지 않습니다. 게시된 정보는 무단으로 배포할 수 없습니다.콘텐츠 제공업체코스콤 : 실시간 주가정보 및 국내시세정보에프앤가이드 : 기업 및 재무정보KG제로인 : 해외 시세, 시장지표 및 펀드 정보한국예탁결제원 : 주주총회일 및 전자투표 정보인포스탁 : 국내 테마 정보Copyright ©NAVER Corp.All Rights Reserved.']"
10,삼성전자, 2017-08-0409:31,아시아경제 ,"코스피, 외국인 매수에 상승…2400선은 못넘어",https://finance.naver.com/news/news_read.nhn?article_id=0004048645&office_id=277&mode=search&query=삼성전자&page=5,"['       코스피, 외국인 매수에 상승…2400선은 못넘어      기사입력2017-08-04 09:31기사원문좋아요훈훈해요좋아요 평가하기공감좋아요0훈훈해요0슬퍼요0화나요0후속기사 원해요0댓글 [아시아경제 박미주 기자]코스피가 외국인 매수세로 소폭 상승하며 전날 급락한 것을 일부 회복하고 있다. 다만 2400선은 아직 넘지 못하고 있다.4일 오전 9시13분 현재 코스피는 전 거래일보다 13.00포인트(0.54%) 오른 2399.85를 기록하고 있다. 2.89포인트(0.12%) 오른 2389.74에 출발해 상승 폭을 키우는 중이다.간밤 뉴욕 증시는 혼조세로 마감한 가운데, 다우존스산업평균지수는 7거래일 연속 사상 최고치를 경신했다. 다우지수는 전날대비 0.04%(9.80포인트) 상승한 2만2026.04로 장을 마감했다. S&P 500 지수는 0.22%(5.41포인트) 내린 2472.16으로 마감했고, 기술주 중심의 나스닥 지수도 0.35%(22.30포인트) 하락한 6340.34로 거래를 마쳤다.코스피는 외국인들이 229억원어치를 사들이며 상승 중이다. 개인과 기관은 각각 224억원, 4억원어치를 팔고 있다.업종별로는 통신업(-0.44%)을 제외한 전 업종이 강세다. 운수창고(1.74%), 기계(1.10%), 화학(0.97%), 철강금속(0.88%), 건설업(0.96%), 음식료업(0.75%), 증권(0.74%), 제조업(0.64%) 등이 비교적 크게 오르는 중이다.시가총액 상위 9위까지의 종목이 모두 오르는 중이다. 삼성전자(0.50%), SK하이닉스(0.15%), 삼성전자우(0.69%), 현대차(0.34%), POSCO(0.61%), 한국전력(0.11%), 삼성물산(0.72%), NAVER(0.13%), 신한지주(0.56%) 등이다. SK텔레콤(-0.71%), 삼성생명(-0.40%), 현대모비스(-0.80%) 등은 하락하고 있다.같은 시각 코스닥지수는 전 거래일보다 4.99포인트(0.78%) 오른 648.08을 기록하고 있다.박미주 기자 beyond@asiae.co.kr▶ 뉴스가 재밌다! 세상의 모든 재미 [티잼]▶ #아시아경제, #오늘의 많이 본 뉴스(클릭!)아시아경제 관련뉴스해당 언론사에서 선정하며 언론사 페이지(아웃링크)로 이동해 볼 수 있습니다.""김기덕, 여배우에게 성기 잡도록 강요…영상 있다"" 충격문대통령 휴가중인데…""북한과 전쟁"" 긴급 선언안철수 부인 김미경, 서울 노원병 재보궐 선거에…""섹스로봇 사용자는 강간을…"" 충격 보고서""나이 들어 자주하면…"" 충격적 섹스 연구결과좋아요0훈훈해요0슬퍼요0화나요0후속기사 원해요0기사제공 :']"
11,삼성전자, 2017-08-0409:28,한국경제 ,"코스피, 외인 '사자' 힘입어 반등…2400선 안착 시도",https://finance.naver.com/news/news_read.nhn?article_id=0003805571&office_id=015&mode=search&query=삼성전자&page=5,"['       코스피, 외인 \'사자\' 힘입어 반등…2400선 안착 시도      기사입력2017-08-04 09:28기사원문좋아요훈훈해요좋아요 평가하기공감좋아요0훈훈해요0슬퍼요0화나요0후속기사 원해요0댓글코스피지수가 외국인의 매수세에 유입에 힘입어 2400선 안착을 타진하고 있다.4일 오전 9시15분 현재 코스피지수는 전날보다 6.31포인트(0.26%) 오른 2393.16을 기록 중이다. 하루 만의 반등이다. 전날 미국 뉴욕 증시에서 미국 다우존스 30 산업평균지수는 헬스케어 업종이 호조를 보이며 7거래일 연속 사상 최고치를 경신했다. 반면 국제유가 하락과 반도체 등 기술주의 부진 탓에 스탠더드앤드푸어스(S&P) 500 지수와 나스닥 지수는 내렸다. 다우지수 호조 소식에 코스피지수도 상승 출발했다. 코스피는 2380선에서 장을 시작한 후 상승폭을 키우며 2400선 안팍에서 움직이고 있다.유가증권시장에서 외국인은 249억원어치 주식을 사들였다. 외국인은 하루만에 사자세로 전환했다. 기관과 개인은 각각 52억원, 196억원어치 주식을 순매도 중이다.프로그램 매매를 통해서도 매수세가 유입되고 있다. 차익 순매도(79억원)와 비차익 순매수(284억원)를 합해 205억원 가량 매수 우위다. 업종별로 기계, 운수창고가 1% 넘게 오르는 중이다. 건설업, 철강금속, 화학 등도 상승세다. 반면 통신업은 소폭 하락세를 보이고 있다. 시가총액 상위 종목은 혼조세다. 삼성전자와 SK하이닉스, 현대차, 포스코, 한국전력, 삼성물산 등이 오르고 있다. 삼성생명, 현대모비스 등은 상승세다.IT주가 외국인의 매수세에 상승하면서 대장주인 삼성전자는 하루만에 반등에 나섰다. 현재 0.50% 오르는 중이다. 삼성SDI도 2%대 강세를 보이고 있다.코스닥 지수도 상승했다. 현재 코스닥은 2.51포인트(0.39%) 오른 645.60을 기록하고 있다. 코스닥시장에서 외국인과 개인은 각각 61억원, 40억원어치 주식을 순매수하고 있다. 기관은 88억원 매수 우위다. 시총 상위 종목 대부분이 오름세다. 원·달러 환율은 내리고 있다. 서울 외환시장에서 원·달러 환율은 1.60원(0.14%) 하락한 1127.20원을 기록 중이다.안혜원 한경닷컴 기자 anhw@hankyung.com[한경닷컴 바로가기] [글방] [모바일한경 구독신청] ⓒ 한국경제 & hankyung.com, 무단전재 및 재배포 금지한국경제 관련뉴스해당 언론사에서 선정하며 언론사 페이지(아웃링크)로 이동해 볼 수 있습니다.(출발)코스닥, 1.71p 오른 644.80""외국인 매도 확대 움직임에…국내 증시 조정세 이어진다""-유화\'28억\' 반포 아파트, 대책 발표 당일 거래된 가격이""12년 만에 가장 센 대책""…전문가 집값 전망롯데 임원 사무실, 중앙에 배치했더니…당황좋아요0훈훈해요0슬퍼요0화나요0후속기사 원해요0기사제공 :']"
12,삼성전자, 2017-08-0409:25,매일경제 ,"코스피, 외국인 순매수 전환에 하루만에 반등 시도",https://finance.naver.com/news/news_read.nhn?article_id=0003991262&office_id=009&mode=search&query=삼성전자&page=5,"['       코스피, 외국인 순매수 전환에 하루만에 반등 시도      기사입력2017-08-04 09:25기사원문좋아요훈훈해요좋아요 평가하기공감좋아요0훈훈해요0슬퍼요0화나요0후속기사 원해요0댓글 급락세를 맞은 코스피가 반등을 시도하고 있다. 장 초반 외국인이 \'사자\'로 나서면서 지수를 견인, 2400선 회복을 넘보고 있다.4일 오전 9시4분 현재 코스피는 전일 대비 12.40포인트(0.52%) 오른 2399.25를 기록 중이다. 지수는 2.89포인트 상승 출발해 장 초반 2400선 아래쪽을 맴돌고 있다.전날 코스피는 아시아 증시가 일제히 약세를 보인 가운데 세법개정안과 8.2 부동산 규제 등 정책적 우려에 따른 외국인 대규모 차익매물 출회 등으로 1.7% 급락했다.지수가 크게 하락했지만 전문가들은 일시적인 조정에 그칠 것이라고 분석하고 있다. 이은택 KB증권 투자전략팀장은 ""과세표준 2000억원 이상 법인의 최고세율 인상안(22%→25%)과 대주주(15억원 이상→3억원 이상) 주식 양도세 인상, 외국법인의 주식 양도소득 과세(25%→5%) 등이 증시에 부정적인 영향을 줬다""면서도 ""다만 과거 사례로 봤을 때 부동산정책··법인세 영향은 단기에 그칠 것""이라고 설명했다.문제는 \'외국법인 주식 양도소득 과세\'인데, 이 역시 단기에 그칠 것으로 보인다. 실제 외국인 주주가 5% 이상 보유한 대형주는 S-Oil 등 극히 일부에 불과하고 삼성전자, 현대차, POSCO, NAVER, 신한지주 등도 5% 이상이지만, 다수의 특수관계인 (펀드 등)의 지분을 합한 것으로 하나의 법인·개인은 아니기 때문이다. 이 연구원은 ""중소형주에서는 외국인의 세금 회피를 위한 매도 사례가 나타날 수 있겠지만, 외국인의 코스피 대량 매도를 설명하기는 다소 어려워 보인다""며 ""아울러 아람코(S-Oil)나 텐센트(카카오) 등이 양도소득 과세 때문에 당장 지분 매도를 결정할 것이라고 생각하기는 어려우며 한국증시를 사는 주요 외국인은 조세조약을 맺은 국가라는 점도 고려해야 한다""고 부연했다.지난밤 뉴욕증시는 애플이 하락하며 혼조세를 보인 가운데 다우지수는 7거래일 연속 사상 최고치 흐름을 이어갔다.이날 유가증권시장에서는 대체로 오르는 업종이 많다. 기계, 운수창고, 증권, 전기전자 등이 강세다. 매매주체별로 외국인은 170억원 순매수로 나선 반면 개인 기관은 각각 100억원, 64억원 순매도하고 있다. 프로그램 매매는 100억원 매수 우위다.시가총액 상위 종목들 역시 대체로 오름세다. 삼성전자, SK하이닉스, 현대차, POSCO, 한국전력, 삼성물산, NAVER, 신한지주, 삼성생명, KB금융, LG화학, 삼성바이오로직스 등 주요 시총 상위종목들이 일제히 상승하고 있다.이날 코스피시장에는 상한가를 기록 중인 노루페인트우를 포함해 532개 종목이 오르고 있고 155개 종목은 내리고 있다. 하한가 종목은 없다.코스닥은 전일 대비 4.11포인트(0.64%) 오른 647.20을 기록 중이다.[디지털뉴스국 김경택 기자][매일경제 공식 페이스북] [오늘의 인기뉴스] [매경 프리미엄][ⓒ 매일경제 & mk.co.kr, 무단전재 및 재배포 금지]매일경제 관련뉴스해당 언론사에서 선정하며 언론사 페이지(아웃링크)로 이동해 볼 수 있습니다.한밤중 집안에 들이닥친 거대 불청객…\'오싹\'전세계 돌풍 테슬라 \'모델3\', 내년 韓서 2천만원대에 산다김기덕 ""고소 여배우와 친구…상처받았다면 미안""깨어나니 사라진 머리카락 \'유령 이발사\' 공포배현진 아나, 졸업사진과 사뭇 다른 외모?좋아요0훈훈해요0슬퍼요0화나요0후속기사 원해요0기사제공 :']"
13,삼성전자, 2017-08-0409:23,뉴시스 ,"[개장시황]코스피, 外人 ‘사자’에 상승 출발…2390대 약보합",https://finance.naver.com/news/news_read.nhn?article_id=0008104768&office_id=003&mode=search&query=삼성전자&page=5,"['       [개장시황]코스피, 外人 ‘사자’에 상승 출발…2390대 약보합      기사입력2017-08-04 09:23기사원문좋아요훈훈해요좋아요 평가하기공감좋아요0훈훈해요0슬퍼요0화나요0후속기사 원해요0댓글 【서울=뉴시스】김경원 기자 = 코스피가 전날 4거래일 만에 하락 마감했으나 4일 외국인의 매수세에 힘입어 상승세를 보이고 있다. 이날 코스피 지수는 전 거래일(2386.85)보다 2.89포인트(0.12%) 오른 2389.74에 장을 열었다. 이후 9시17분 현재 2393.16에서 거래되고 있다.유가증권시장에서 외국인(150억원) 순매수하고 있고 개인(-83억원)과 기관(-62억원)은 순매도하고 있다. 코스피를 업종별로 보면 통신업(-0.16%) 만 내림세를 보이고 나머지 업종은 모두 상승세를 보이고 있다. 구체적으로 기계(1.39%), 운수창고(1.38%), 증권(0.85%), 의약품(0.71%), 화학(0.75%), 의료정밀(0.69%), 건설업(0.67%), 제조업(0.55%), 음식료업(0.51%), 철강금속(0.49%), 유통업(0.62%), 보험(0.46%), 서비스업(0.47%), 전기전자(0.57%), 금융업(0.42%), 섬유의복(0.34%), 전기가스업(0.3%), 운수장비(0.18%), 은행(0.31%), 종이목재(0.14%), 비금속광물(0.16%) 등이 오름세다. 코스피 시가총액 상위종목 중 \'대장주\' 삼성전자는 전일(238만9000원)보다 9000원(0.38%) 오른 239만8000원에 거래되고 있다. SK하이닉스(0.15%), 삼성전자우(0.48%), 현대차(0.34%), POSCO(0.76%), 한국전력(0.23%), 삼성물산(0.72%), NAVER(0.13%), 신한지주(0.94%), KB금융(0.87%), LG화학(2.13%), SK(1.14%), 삼성바이오로직스(0.72%), 아모레퍼시픽(0.35%), SK이노베이션(1.16%), KT&G(0.88%), LG생활건강(0.20%) 등은 상승하고 있다.  반면 삼성생명(-0.40%), 현대모비스(-0.60%), SK텔레콤(-0.53%) 등은 하락하고 있다. 코스닥은 이날 전 거래일(643.09)보다 1.71포인트(0.27%) 오른 644.8에 장을 시작했다. 이은택 KB증권 연구원은 ""한국증시가 하락한 이유는 북한 이슈가 외국인 매도에 영향을 줬을 가능성이 있다""며 ""예전보다 강경한 트럼프의 발언이나 최근 중국과 미국이 화해모드를 깨고 다시 긴장으로 가는 듯한 모습은 외국인 차익실현 욕구를 키웠을 것""이라고 분석했다. 박춘영 대신증권 연구원은 ""차익실현 욕구가 높아진 시점에서 정부의 세법개정안, 부동산대책에 대한 우려가 불거지며 낙폭이 확대됐다""며 ""주가가 하락하면 배당수익률이 높아져 배당주의 이익 안정성이 부각될 가능성이 커진다""고 조언했다. 한편 3일(현지시간) 미국 증시는 미 기업들의 실적 발표가 기대에 못 미치는 것으로 나타나면서 혼조세로 마감했다. 다우존스 지수는 이날 전장 대비 9.86포인트(0.04%) 오른 2만2026.10에 거래를 마감했다. 대형주 중심의 스탠더드앤드푸어스(S&P) 500 지수는 5.41포인트(0.22%) 떨어진 2472.16에, 기술주 중심의 나스닥 지수는 22.30포인트(0.35%) 하락한 6340.34로 거래를 마쳤다. kimkw@newsis.com뉴시스 뉴스, 네이버 뉴스 스탠드에서도 만나세요뉴시스 SNS [페이스북] [트위터]뉴시스 관련뉴스해당 언론사에서 선정하며 언론사 페이지(아웃링크)로 이동해 볼 수 있습니다.\'성관계 동영상\' 협박해 헤어진 연인 성폭행한 50대 남성열살때 성폭행 당한 소녀…13년만에 가해자에 죗값 물리다학교 수업서 흉기 만들어 온 딸…아버지가 경찰에 신고\'갑질\' 박사령관 부부 어떻게 했길래 공관병이 자살 시도까지한국 연구진 \'돌연사 유발\' 유전자 교정 성공에 전세계 극찬좋아요0훈훈해요0슬퍼요0화나요0후속기사 원해요0기사제공 :']"
14,삼성전자, 2017-08-0409:22,머니투데이 ,"증시, 반등출발…저점매수·경계매물 공방",https://finance.naver.com/news/news_read.nhn?article_id=0003914880&office_id=008&mode=search&query=삼성전자&page=5,"['       증시, 반등출발…저점매수·경계매물 공방      기사입력2017-08-04 09:22기사원문좋아요훈훈해요좋아요 평가하기공감좋아요0훈훈해요0슬퍼요0화나요0후속기사 원해요0댓글 [머니투데이 반준환 기자] 증시가 전날 급락을 딛고 반등하는 모습이다. 낙폭이 지나쳤다는 인식과 함께 외국인 매수세가 장 초반 유입되는 것도 영향을 미치고 있다. 불안한 투자심리는 일단 진정이 되는 모습인데 아직 상황을 지켜볼 필요도 있어 보인다. 4일 코스피지수는 전날보다 0.12% 오른 2389.74로 출발, 9시16분 현재는 2394를 기록하고 있다. 한 때 2400선을 터치하기도 했다. 외국인들은 코스피에서 167억원을 순매수하고 있으며 기관은 70억원 순매도로 집계됐다. 외국인 자금은 매수와 매도가 번갈아가고 있어 오전 추이를 좀 더 지켜봐야 방향성이 나올 수 있어 보인다. 다만 지수선물에서 매수 포지션을 취하고 있다는 점이 긍정적으로 보인다. 삼성전자와 포스코, 삼성물산, 네이버, 신한지주, KB금융, LG화학 등 전날 낙폭이 컸던 대형주 중심으로 매수세가 유입되면서 강세를 보이고 있으며 현대차와 SK하이닉스, 삼성생명 등은 소폭 약세를 기록중이다. 코스닥시장도 나쁘지 않은 출발을 보였다. 현재 지수는 645를 기록하고 있다. 이날 시가는 전날보다 0.27% 오른 644.80이다. 역시 전날 하락에 따른 반발 매수세가 빠르게 유입되는 모습이다. 셀트리온, 메디톡스, 휴젤, 코미팜, 바이로메드, 신라젠 등 시가총액 상위 종목들의 시세도 나쁘지는 않은 편이다. 다만 경계매물과 저점매수세가 치열한 공방을 벌이고 있어 시장 추이는 좀 더 지켜볼 필요가 있다는 지적이다. 현재 서울외환시장에서 원/달러 환율은 전날보다 2.25원 내린 1126.55원을 기록중이다. [▶깊이있는 투자정보 \'TOM칼럼\'][▶트렌드 리더의 스타일 지침서 \'스타일M\'][▶빵빵한 차&레이싱걸]반준환 기자 abcd@머니투데이 관련뉴스해당 언론사에서 선정하며 언론사 페이지(아웃링크)로 이동해 볼 수 있습니다.40억원 빚 안 갚으려…""30대처럼 성형해달라""""어쩐지 싸더라""…명품 싸게 판다 속여 2500만원 가로챈 20대송일준 MBC PD협회장 ""신동호·배현진, \'배신 남매\'라 불려""발톱 청소에 골프공 줍기까지…\'군대판 머슴\' 공관병 논란""공관병이 자살까지 시도""…박찬주 甲질 추가폭로좋아요0훈훈해요0슬퍼요0화나요0후속기사 원해요0기사제공 :']"
15,삼성전자, 2017-08-0409:22,파이낸셜뉴스 ,"[fn 오전시황] 코스피, 2400선에서 '오르락내리락'",https://finance.naver.com/news/news_read.nhn?article_id=0003854218&office_id=014&mode=search&query=삼성전자&page=5,"[""       [fn 오전시황] 코스피, 2400선에서 '오르락내리락'      기사입력2017-08-04 09:22기사원문좋아요훈훈해요좋아요 평가하기공감좋아요0훈훈해요0슬퍼요0화나요0후속기사 원해요0댓글  코스피지수가 2400선에서 등락을 반복하고 있다.  4일 오전 9시 12분 현재 코스피지수는 전거래일보다 12.94포인트 오른 2399.79를 기록하고 있다. 이날 전거래일과 비교해 2.89포인트 오른 2389.74로 출발한 코스피지수는 줄곧 10포인트 넘는 상승세를 나타내고 있다.  오름세는 외국인이 이끌고 있다. 외국인은 241억원 사들이고 있다. 외국인은 전날 4025억원 순매도하며 지수를 끌어내렸지만 이날 매수세로 전환했다. 개인과 기관은 각각 233억원, 5억원 팔아치우고 있다.  코스피 시가총액 상위 종목은 상승세다. 삼성전자(0.29%), SK하이닉스(0.76%), 현대차(0.67%), POSCO(0.61%), 한국전력(0.34%), 삼성물산(1.09%), NAVER(0.26%), 신한지주(0.75%), 삼성생명(0.40%)이 오르고 있다.  코스피의 대형주, 중형주, 소형주는 모두 오름세다. 업종별로는 운수창고(1.72%), 기계(1.49%), 철강·금속(0.96%), 화학(0.92%)의 상승이 두드러진다.   ethica@fnnews.com 남건우 기자   ▶ 세상의 모든 골 때리는 이야기 'fn파스'▶ 속보이는 연예뉴스 fn스타  ※ 저작권자 ⓒ  파이낸셜뉴스. 무단 전재-재배포 금지파이낸셜뉴스 관련뉴스해당 언론사에서 선정하며 언론사 페이지(아웃링크)로 이동해 볼 수 있습니다.화장실 성폭행 위기 벗어난 21세女의 번뜩이는 한마디모기 물려 가려울 때 30초 만에 해결법30세여성에게 왁싱받은 남성, 시술 끝나자 돌변월 매출 7천만원 편의점 주인, 실제 가져가는 수입 공개'모텔 감금' 탈출해 경찰서 온 22세女에 1만원 주며 한 막말좋아요0훈훈해요0슬퍼요0화나요0후속기사 원해요0기사제공 :""]"
