,회사명,날짜,언론사,기사제목,링크,본문
7,삼성전자, 2017-04-2908:30,연합뉴스 ,[주간시황] 코스피 '승승장구'…사상 최고치 눈앞,https://finance.naver.com/news/news_read.nhn?article_id=0009228016&office_id=001&mode=search&query=삼성전자&page=2,"['       [주간시황] 코스피 \'승승장구\'…사상 최고치 눈앞      기사입력2017-04-29 08:30기사원문좋아요훈훈해요좋아요 평가하기공감좋아요0훈훈해요0슬퍼요0화나요0후속기사 원해요0댓글코스피 상승 (PG)[제작 최자윤] 일러스트주간상승률 1위 삼성전자 9.47%코스닥지수는 하락, 대형우량주 중심 장세에 중소형주 \'울상\'(서울=연합뉴스) 박상돈 기자 = 코스피는 이번 주(24~28일) 외국인의 대규모 순매수와 삼성전자 사상 최고가 행진에 힘입어 연중 최고치를 잇따라 경신했다.    지수는 2,200선까지 뚫어 역대 최고치 기록까지는 23포인트만을 남겨두고 있다.    29일 한국거래소에 따르면 코스피는 한 주간 40.40포인트(1.87%) 오른 2,205.44에 마쳤다.    첫 거래일인 24일 코스피는 외국인의 대규모 순매수에 힘입어 2,170선을 한 달 만에 회복했다.    유럽연합(EU) 잔류파인 에마뉘엘 마크롱 후보가 프랑스 대통령 선거 결선투표에 진출하며 프랑스 대선 관련 불확실성이 완화됐고 외국인은 3천억원 넘게 순매수했다.    코스피는 25일엔 외국인 \'사자\' 지속에 2,190선까지 회복하며 연중 최고치를 경신했다. 코스피 종가가 2,190선을 넘은 것은 2011년 5월 이후 거의 6년 만이다.    26일에는 외국인과 기관이 동반 매수에 나서 지수는 2,200선도 넘어섰다. 장중에는 2,210선도 돌파했다.     삼성전자는 214만원에 장을 마치며 이틀 연속 사상 최고가 행진을 이어갔다.    삼성전자의 사상 최고가 행진과 엿새째 이어진 외국인 매수로 코스피는 27일 연중 최고치를 또 갈아치웠다.    지수는 2,209.46으로 마감하며 2,210선에 바짝 다가섰다. 종가는 역대 3번째로 높은 수준이다.    삼성전자는 지수 상승에 결정적 역할을 했다. 지주사 전환을 포기하는 대신 보유 자사주를 소각하는 주주환원 정책을 발표하자 삼성전자는 장중 한때 220만원을 돌파하며 코스피를 끌어올렸다.     롯데그룹의 지주회사 전환 추진 소식에 롯데쇼핑과 롯데칠성도 강세를 보였다.    코스피는 28일에는 숨고르기를 하며 7거래일 만에 하락 마감했다. 주식형펀드 환매와 차익실현 매물이 쏟아졌고 외국인도 장중 매도 우위로 돌아섰다.     그러나 삼성전자는 나흘째 사상 최고가 행진을 이어가 223만1천원까지 상승했다. 장중에는 229만원까지 치솟았다.     코스피 대형주 중 주간 상승률 1위 종목은 삼성전자(9.47%)였다.    뒤이어 효성(8.27%), NH투자증권(7.75%), 롯데쇼핑(7.14%), 한국금융지주(6.43%), BGF리테일(6.31%) 순이었다.    코스닥지수는 한 주간 6.72포인트(1.06%) 내린 628.24에 마쳤다.     ◇ 코스피 대형주 주간(24∼28일) 상승률 10위    kaka@yna.co.kr최신 유행 트렌드 총집결 #흥(클릭!)연합뉴스 관련뉴스해당 언론사에서 선정하며 언론사 페이지(아웃링크)로 이동해 볼 수 있습니다.\xa0최정윤 남편이자 이랜드 부회장 장남 구속…주가조작\xa0심상정 ""말 안 섞으려 했는데"", 홍준표 ""나도 얘기하기 싫다""\xa0PGA 투어 \'느림보 골퍼\'에 패널티…22년 만에 처음\xa0""30 넘은 여자가 스스로 싱싱한 줄 안다""…폭언 교수\xa0\'엄태웅 성폭행 무고\' 여성, 반성 않더니 결국…좋아요0훈훈해요0슬퍼요0화나요0후속기사 원해요0기사제공 :']"
8,삼성전자, 2017-04-2908:11,연합뉴스 ,[증권가 주간화제] 삼성전자 자사주 소각에 증시 '후끈',https://finance.naver.com/news/news_read.nhn?article_id=0009228005&office_id=001&mode=search&query=삼성전자&page=2,"['       [증권가 주간화제] 삼성전자 자사주 소각에 증시 \'후끈\'      기사입력2017-04-29 08:11기사원문좋아요훈훈해요좋아요 평가하기공감좋아요0훈훈해요0슬퍼요0화나요0후속기사 원해요0댓글 노무라證 목표주가 330만원, 유안타·KTB證 300만원 제시(서울=연합뉴스) 윤선희 기자 = 이번 주 증시는 삼성전자로 뜨겁게 달아올랐다. 대규모 자사주 소각 발표에 삼성전자는 사상최고가를 몇 번이나 갈아치웠다. 코스피도 연중 최고치를 연일 경신했다.       삼성전자는 지난 27일 이재용 삼성전자 부회장의 경영권 승계를 위해 검토해온 지주회사 전환을 하지 않기로 했다며 50조원에 육박하는 자사주 소각 계획을 발표했다.         삼성전자의 지주회사 전환 방안은 지난해 11월 ""지주회사 전환 가능성 등 주주가치 최적화 방안을 검토 중""이라고 발표하면서부터 증권가에서 주목을 받아왔다.     증권사들도 지배구조 개편과 경영 승계를 위해선 삼성전자의 지주회사 전환 시나리오가 유력한 대안이라는 분석을 내놨다. 총수 일가가 보유 자사주를 활용하면 상대적으로 적은 비용으로 지배력을 훨씬 강화할 수 있다는 분석에 따른 것이다.     그러나 삼성전자는 ""지주회사 전환이 사업경쟁력 강화에 별다른 도움이 되지 않고, 오히려 경영 역량의 분산 등 사업에 부담을 줄 우려가 있다""며 전격적으로 지주사 전환 중단을 발표했다.    이 소식이 전해진 27일 증시 참여자들은 지주회사 전환 철회 결정에 당황하는 듯했으나, 자사주 소각 결정에 즉각적으로 반응했다.     삼성전자 주가는 하루 동안 2.43% 뛰었다.    지난 21일부터 28일까지 6일 연속 상승세를 타면서 종가 기준으로 10% 상승했다. 주가는 사상최고가 행진을 벌여 장중 229만원까지 치솟았다.     삼성전자는 현재 보유한 13.3%의 자사주를 내년까지 전량 소각하기로 했으며 앞으로 추가 매입분도 처분하겠다고 밝혔다.     소각 규모는 무려 49조원에 이른다.    주식 소각은 전체 발행 주식 수가 줄어들기 때문에 주당 가치가 높아져 대표적인 주주환원 정책으로 꼽힌다.     증시 전문가들은 실적 호조와 자사주 소각, 분기배당 등 주주 친화적인 방안을 고려해 삼성전자 목표주가를 최고 300만원 넘게 제시했다.    노무라증권은 삼성전자의 목표주가를 300만원에서 330만원으로 상향 조정했다. 이는 자사주 소각 등 주주환원 정책으로 주가가 오를 가능성이 크다는 분석을 반영했다.    유안타증권과 KTB투자증권은 삼성전자의 목표가를 기존 270만원에서 300만원으로 올려 잡았고 신한금융투자와 NH투자증권은 290만원으로 올렸다.    김양재 KTB증권 연구원은 29일 ""자사주 소각으로 올해 삼성전자의 주식은 주당 7%의 가치 상승효과를 보게 됐다""며 ""지주사 전환은 철회했지만, 이는 본질적인 기초여건 평가로 회귀하는 기회로 판단된다""고 평가했다.     최도연 신한금융투자 연구원은 ""삼성전자는 2분기 매출액이 전 분기보다 14.2% 늘어난 57조7천100억원, 영업이익은 32.7% 늘어난 13조1천300억원으로 사상 최대 실적을 낼 것""이라고 전망했다. 삼성전자의 1분기 매출은 50조5천500억원, 영업이익은 9조9천억원으로 분기별 역대 2번째로 많았다.     김선우 메리츠종금증권 연구원은 ""자사주 소각, 지주사 전환 불가 등으로 배당 등 주주친화 정책이 필연적으로 강화될 것""이라고 전망했다.indigo@yna.co.kr최신 유행 트렌드 총집결 #흥(클릭!)연합뉴스 관련뉴스해당 언론사에서 선정하며 언론사 페이지(아웃링크)로 이동해 볼 수 있습니다.\xa0최정윤 남편이자 이랜드 부회장 장남 구속…주가조작\xa0심상정 ""말 안 섞으려 했는데"", 홍준표 ""나도 얘기하기 싫다""\xa0\'성추문\' 시달린 방송사 ""여성 CEO 물색 중""\xa0""30 넘은 여자가 스스로 싱싱한 줄 안다""…폭언 교수\xa0\'엄태웅 성폭행 무고\' 여성, 반성 않더니 결국…좋아요0훈훈해요0슬퍼요0화나요0후속기사 원해요0기사제공 :']"
9,삼성전자, 2017-04-2907:38,KBS ,경기 회복 기대감…생산·투자 상승,https://finance.naver.com/news/news_read.nhn?article_id=0010450276&office_id=056&mode=search&query=삼성전자&page=2,"['       경기 회복 기대감…생산·투자 상승      기사입력2017-04-29 07:38기사원문좋아요훈훈해요좋아요 평가하기공감좋아요0훈훈해요0슬퍼요0화나요0후속기사 원해요0댓글  경기가 본격적인 회복 국면에 들어섰다는 기대감이 확산되고 있습니다. 수출이 호조세를 보이면서 경기 회복을 이끌고 있는 가운데,  그동안 엇박자를 보이던 생산과 투자와 소비 지표도 모두 좋게 나왔습니다. 홍희정 기자의 보도입니다.  최근들어 이 공장은 주말도 없이 연일 가동되고 있습니다. 주문이 밀려들면서  품절 사태를 막기 위해 잠시도 쉴 틈이 없습니다.   이계복(삼성전자 제조그룹장) : ""에어컨, 공기청정기 라인은 밀려드는 주문에 쉴 새 없이 (공장을) 풀가동하고 있으며."" 전자제품과 자동차 시장이 활기를 찾으면서 지난달 전체 산업 생산 1.2% 증가해 4개월 만에 최대폭으로 증가했습니다. 2월에는 주춤했던 투자도 크게 늘어전달보다 12.9% 증가했습니다. 3년 5개월 만에 최대치입니다. 국내 경기가 반등 조짐을 보이면서 기업들의 체감 경기도  약 5년 만에 최고 수준을 보였습니다. 그동안 좀처럼 나아질 기미를 보이지 않았던 소비도 기지개를 켜는 듯합니다. 승용차 판매 등 내구재 판매가 늘어 전달과 비슷한 수준을 유지했습니다.   안형준(통계청 경제통계국장)  : ""소비자심리지수도 좋아지면서 전체적으로 내구재 쪽의 판매가 늘고 그래서 의외로 저희는 선방했다고 보고 있습니다."" 그러나 앞으로 경기를 예고하는 지수는 하락하며 불안감을 완전히 떨쳐내지는 못했습니다. 정부는 경기 회복세가 경제 전반에 확산될 수 있도록 적극적인 거시 정책을 펴나가겠다고 밝혔습니다. KBS 뉴스 홍희정입니다. 홍희정기자 (hjhong@kbs.co.kr)▶ [저작권자ⓒ KBS 무단복제-재배포 금지]KBS 관련뉴스해당 언론사에서 선정하며 언론사 페이지(아웃링크)로 이동해 볼 수 있습니다.2만 관중 몰고온 고교 괴물 타자!""수표밖에 없어서"", 교수님이라던 그분 알고 보니…학생에게 모욕감 준 교수, 시의회 파면 건의안 가결[영상] 외신 \'로이터\'의 한국인 인터뷰 ""트럼프는…""[영상] 6층서 떨어질 뻔한 男…바지 잡아 극적 구조좋아요0훈훈해요0슬퍼요0화나요0후속기사 원해요0기사제공 :']"
10,삼성전자, 2017-04-2906:03,이데일리 ,가전 맞수 삼성·LG전자…올 1분기 `조성진 매직` 勝,https://finance.naver.com/news/news_read.nhn?article_id=0003812771&office_id=018&mode=search&query=삼성전자&page=2,"['       가전 맞수 삼성·LG전자…올 1분기 `조성진 매직` 勝      기사입력2017-04-29 06:03기사원문좋아요훈훈해요좋아요 평가하기공감좋아요0훈훈해요0슬퍼요0화나요0후속기사 원해요0댓글- 프리미엄제품 투자 빛보는 LG전자- 가전 영업이익률 사상 최초 10%대 진입- 조성진 부회장 첫 경영 성과 주목- 삼성은 패널가격 상승 등 어려움 지속LG전자의 ‘LG시그니처 올레드 TV W’(왼쪽)와 삼성전자의 ‘QLED TV’(오른쪽). [이데일리 DB][이데일리 양희동 기자] 가전업계의 영원한 맞수인 삼성전자(005930)와 LG전자(066570)가 올해 1분기 나란히 사상 최대 실적을 기록하며 ‘어닝 서프라이즈’를 달성했다. 회사 전체 수익 측면에선 삼성전자가 LG전자를 압도했다. 글로벌 메모리시장의 ‘슈퍼사이클’에 올라탄 삼성전자가 반도체 부분에서만 역대 최고인 6조 3100억원의 영업이익을 올리는 10조원에 가까운 수익을 거뒀기 때문이다. 이는 LG전자가 거둔 영업이익(9215억원)의 10배가 넘는 수준이다.하지만 양사가 치열한 경쟁을 벌이고 있는 TV·냉장고·세탁기 등 가전부분에선 LG전자가 오히려 삼성전자를 크게 앞서는 성적을 거뒀다. ‘Mr.세탁기’로 불리며 LG전자의 프리미엄 가전을 세계 1위에 올려놨고 올해 들어 1인 CEO(최고경영자)로서 지휘봉을 잡은 조성진(사진) 부회장의 ‘매직’이 통했다는 평이 나오는 이유다.29일 업계에 따르면 삼성전자(CE부문)와 LG전자(H&A·HE사업부)는 올 1분기 TV 및 생활가전 부문에서 매출은 각각 10조 3400억원과 8조 9648억원, 영업이익은 각각 3800억원과 9030억원을 기록했다. 영업이익률은 삼성전자가 3.68%, LG전자가 10.06% 수준이었다. 삼성전자가 제품은 더 많이 팔았지만 실제 돈은 LG전자가 3배 가까이 더 벌었다는 얘기다.삼성전자와 LG전자의 올 1분기 가전부문 매출 및 영업이익 비교. [자료=각 사·단위=억원]LG전자는 올 1분기 실적에서 세탁기·냉장고 등 생활가전과 TV 등 모든 가전 부문에서 두각을 나타냈다.조성진 부회장이 4년간 맡아 키운 LG전자 H&A사업본부는 올 1분기 사상 처음으로 영업이익률(11.2%)이 두자릿수를 기록했다. 업계에선 생활가전 영업이익률이 3~5%선인 점을 감안할 때 이례적인 성과로 평가하고 있다. H&A사업본부는 ‘트윈워시’와 ‘트롬 스타일러’, ‘퓨리케어 공기청정기’ 등 프리미엄 제품의 판매가 크게 늘며 매출과 수익을 동시에 잡았다는 평가다. 특히 2015년 세계 최초로 두 개 세탁기를 합친 형태로 선보인 트윈워시는 올해 출시 국가를 전년 대비 두 배인 80개국으로 늘리며 글로벌시장 확대에 나서고 있다. 또 미국 테네시주 클락스빌에 짓는 세탁기 공장에서도 트윈워시를 생산해 현지 시장을 공략할 계획이다.‘올레드(OLED) TV’를 앞세운 HE사업본부도 ‘LG 시그니처 올레드 TV W’와 ‘나노셀 TV’ 등 프리미엄 제품을 중심으로 원가 구조를 개선, 영업이익률이 1분기 기준 최고치인 8.8%에 달했다.노경탁 유진투자증권 연구원은 “LG전자는 가전시장의 트렌드로 자리잡은 프리미엄 제품의 판매호조로 높은 수익성은 지속될 것으로 판단된다”며 “HE사업부 역시 LCD 패널 가격 상승에도 불구하고 올레드 TV 판매량 확대로 수익성과 시장지배력을 더욱 견고히 할 것으로 확신한다”고 말했다.삼성전자도 올해 초 미국 라스베이거스에서 열린 ‘CES 2017’에서 공개한 ‘QLED TV’와 세탁기 두 대를 결합한 형태인 ‘플렉스워시’, 음성인식 냉장고인 ‘패밀리허브’ 등 프리미엄 혁신 제품들을 1분기부터 본격적으로 시장에 내놓았다. 그러나 TV를 담당하는 VD(영상디스플레이)부분의 경우 샤프의 LCD(액정표시장치) 패널 공급 중단과 가격 상승 등으로 어려운 시기를 보냈다. 또 세탁기와 냉장고 등 나머지 가전도 계절적 비수기 영향과 북미 B2B(기업 간 거래) 투자 등의 영향으로 전년 수준에 머물렀다.업계 한 관계자는 “시장 점유율 자체는 삼성이 더 높지만 프리미엄제품군에선 LG가 꾸준한 투자를 이어오면서 영업이익률은 역전되는 결과가 나오고 있다”며 “TV부문에서도 삼성이 10년 연속 글로벌 1위를 이어왔지만 전 제품이 LCD 기반이란 점에서 LG에 비해 패널 수급 및 가격에 민감할 수 밖에 없다”고 말했다.양희동 (eastsun@edaily.co.kr)＜ⓒ종합 경제정보 미디어 이데일리 - 무단전재 & 재배포 금지＞이데일리 관련뉴스해당 언론사에서 선정하며 언론사 페이지(아웃링크)로 이동해 볼 수 있습니다.문재인 아들 준용씨, 파견근무 안 했는데 왜 파견명령?[영상] 귀여운 소형 SUV 피아트500X 시승기고진영 ""비거리 달려서 눈물 날 뻔했어요""\'썰전\' 유시민 안철수 \'갑철수\' 발언 실수.. 참모 해고해야홍준표 ""트럼프 10억불 요구, 셰일가스 대폭 수입해 해결""좋아요0훈훈해요0슬퍼요0화나요0후속기사 원해요0기사제공 :']"
11,삼성전자, 2017-04-2905:01,YTN ,[중점] 세계 가전 트렌드...끝없는 '영역 파괴',https://finance.naver.com/news/news_read.nhn?article_id=0001004347&office_id=052&mode=search&query=삼성전자&page=2,"['       [중점] 세계 가전 트렌드...끝없는 \'영역 파괴\'      기사입력2017-04-29 05:01기사원문좋아요훈훈해요좋아요 평가하기공감좋아요0훈훈해요0슬퍼요0화나요0후속기사 원해요0댓글 [앵커]세계 3대 전자 전시회 가운데 하나로 오는 9월에 열리는 \'베를린 국제가전박람회\' IFA를 미리 소개하는 행사가 열렸습니다.최첨단 기능을 넘어 가전제품과 생활용품이 기존의 영역을 넘어 연결되고 확장하면서, 진화의 속도는 더 빨라지고 있습니다.포르투갈 현지를 임승환 기자가 다녀왔습니다.[기자]2017년 베를린 국제가전박람회, IFA를 넉 달여 앞두고 열린 글로벌 프레스 컨퍼런스!전 세계에서 300명이 넘는 취재진이 몰렸습니다.삼성전자는 지난 3월에 공개한 신개념 TV \'더 프레임\'으로 다시 한 번 주목을 받았습니다.평범한 액자 같지만, 초고화질 QLED TV로, TV가 꺼지면 예술 작품이나 사진을 화면에 띄울 수 있습니다.거실이 미술관으로 바뀌는 셈인데, TV의 영역이 예술로 확대되는 겁니다.다음 달 말부터는 유럽을 시작으로 판매에 돌입합니다.[마이클 죌러 / 삼성전자 유럽 디스플레이 부사장 : 우리는 이제 화질에 대해서는 조금 덜 언급하고 라이프 스타일(생활 방식)을 더 많이 얘기하기 시작했습니다.]지난 1970년대부터 시계, 신발, 스마트폰 등에 스포츠카 디자인을 적용해온 포르쉐!이번에는 노트북 컴퓨터를 선택했습니다.정교한 기어의 톱니바퀴를 장착해 360도로 꺾이고, 모니터를 분리해 태블릿 PC로 사용할 수도 있습니다.[마이클 나겔 / 포르쉐 디자인 : 우리는 소비자에게 좋은 특성을 제공하는데, 디자인과 최신 기술의 결합입니다.]필립스는 스마트폰과 인공지능 전동칫솔을 연결해 실시간으로 치아 상태를 알려주는 것은 물론, 외부에서 집 안의 공기 상태를 최적의 수준으로 조절하는 등 헬스케어의 혁신을 제시했습니다.인공지능 비서에게 명령해 조명을 선택하고, 일반적인 거울을 손쉽게 컴퓨터로 바꿔 사용하기도 합니다.[옌스 하이테커 / IFA 사장 : 소비자들은 새로운 기술과 콘텐츠가 자신의 여러 기기에 통합되기를 기대하고 있습니다.]전 세계 디지털 시장 규모는 해마다 커지면서 올해 9,450억 달러에서 내년에는 9,540억 달러, 우리 돈 1,078조 원을 넘을 것으로 전망됩니다.특히 스마트 가전 시장은 최근 2년 동안 2배씩 성장하고 있습니다.첨단 기술의 발전은 가전제품과 생활용품을 가리지 않고 모든 분야에서 기존의 틀을 깨면서 연결되고 융합하고 있습니다.오늘 9월에 열리는 베를린 국제가전박람회, IFA 본 행사가 더욱 주목되는 이유입니다.포르투갈 리스본에서 YTN 임승환[shlim@ytn.co.kr]입니다.▶뉴스 덕후들의 YTN페이스북 ▶""대한민국을 구할 대통령을 찾아라"" 2017 대선! 안드로메다[저작권자(c) YTN(Yes! Top News) 무단전재 및 재배포 금지]YTN 관련뉴스해당 언론사에서 선정하며 언론사 페이지(아웃링크)로 이동해 볼 수 있습니다.엄태웅 성폭행 고소인, 실형 선고…""엄중 처벌 불가피""황 권한대행, 이규철 특검보 사표수리CJ그룹 임원, 교통사고로 음주운전 들통\'머리가 2개?\'...실험 쥐에 머리 이식 수술 성공취업준비생 울린 감동의 불합격 통지서좋아요0훈훈해요0슬퍼요0화나요0후속기사 원해요0기사제공 :']"
