,회사명,날짜,언론사,기사제목,링크,본문
6,삼성전자, 2017-11-0109:30,뉴스1 ,"KT, 비용증가가 '발목'…영업익 6.1% 줄어 3773억(상보)",https://finance.naver.com/news/news_read.nhn?article_id=0003023445&office_id=421&mode=search&query=삼성전자&page=15,"['       KT, 비용증가가 \'발목\'…영업익 6.1% 줄어 3773억(상보)      기사입력2017-11-01 09:30기사원문좋아요훈훈해요좋아요 평가하기공감좋아요0훈훈해요0슬퍼요0화나요0후속기사 원해요0댓글KT의 연결기준 2017년 3분기 영업실적 © News13Q 매출은 5조8266억원…전년 동기 대비 5.4% 증가(서울=뉴스1) 주성호 기자 = KT가 인터넷(IP)TV 사업의 매출 증가와 유무선 사업의 안정세에도 불구하고 비용 증가에 발목잡혀 수익성이 악화됐다. 1일 KT는 연결기준으로 2017년 3분기 영업이익이 3773억원으로 전년 동기 대비 6.1% 감소했다고 밝혔다. 같은 기간 매출액은 5조8266억원으로 5.4% 증가했으나 당기순이익은 2026억원으로 13.6% 감소했다. 매출이 늘었음에도 불구하고 영업이익이 감소한 것은 비용 증가가 원인이다. 올 3분기 KT의 영업비용은 5조4493억원으로 전년 동기 대비 6.3% 늘었다.특히 판매관리비와 상품구입비가 크게 증가했다. 올 3분기 판매관리비는 5921억원으로 전년보다 23.6% 증가했다. 상품구입비는 9244억원으로 지난해 같은 기간보다 38.2% 증가했다. 이는 지난해 3분기가 삼성전자 \'갤럭시노트7\' 리콜 사태로 인해 단말 구입이 크게 감소했던 시기였기 때문이다. 아울러 올 3분기 출시된 삼성전자 갤럭시노트8 등 프리미엄 단말 확대에 따른 단말 구입이 늘어난 것도 영향을 미친 것으로 분석된다. 마케팅비용은 6777억원으로 전분기 대비 2.1%, 전년 동기 대비 2% 증가했다. 사업부문별로 무선사업 매출은 1조8166억원으로 전년 동기보다 3.6% 줄었다. 회계처리 기준 변경에 따라 단말보험 서비스 등이 매출에서 제외됐기 때문이다. 3분기말 기준 무선 가입자는 27만4000명 순증하며 1979만명을 기록했다. 전체 가입자에서 LTE 고객 비중은 76.7% 수준이다. 수익성 지표인 가입자당월평균매출(ARPU)은 3만4608원으로 전년 동기보다 2.2% 감소했다. 유선 사업 매출은 1조2180억원으로 지난해 같은 기간보다 2.9% 줄었다. 유선전화가 4520억원으로 10.5%나 감소했지만 \'기가인터넷\'을 앞세운 초고속인터넷 매출이 5033억원으로 3.9% 늘어나며 큰폭의 하락을 막았다는 분석이다. 기가인터넷 가입자는 350만명으로 전체 인터넷 가입자의 41.4% 수준이다. 미디어·콘텐츠 부문 매출은 5726억원으로 전년 동기보다 15.8% 증가했다. 인공지능 IPTV 셋톱박스 \'기가지니\' 30만 돌파 등 우량가입자 확보와 플랫폼 수익 증가 덕분이라고 KT는 설명했다. 금융 및 기타 사업 매출은 8739억원으로 전분기 대비 4.5% 감소했으나 전년 동기보다 0.9% 증가했다. KT는 설비 투자지출(CAPEX) 비용은 3분기까지 누적으로 1조3365억원이 집행됐다고 밝혔다. 이는 올초 발표했던 전망치(가이던스) 2조4000억원 대비 55.7% 달성한 수치다. 신광석 KT 최고재무책임자(CFO)는 ""가계통신비 인하 정책으로 인해 당분간 매출 감소는 불가피할 것으로 예상하지만 주요 사업에서 새로운 기회를 발굴해 성장세를 이어갈 계획이다""고 말했다.sho218@▶ 뉴스1 [Book] 오픈! 실천 핀테크!▶ 여러분의 제보를 기다립니다.제보하기![© 뉴스1코리아(news1.kr), 무단 전재 및 재배포 금지]뉴스1 관련뉴스해당 언론사에서 선정하며 언론사 페이지(아웃링크)로 이동해 볼 수 있습니다.추미애 ""朴정권 특활비 상납, 단군 이래 최악 도적질""이외수, 군수에 폭언논란…""사과하고 화천군 떠나라""장애인 아들 살해한 엄마…4년 집행유예 왜?""차 빼""…경적 울렸다고 흉기로 찌른 택시기사원룸 홀몸 20대 여성 숨진 지 사흘 뒤 발견좋아요0훈훈해요0슬퍼요0화나요0후속기사 원해요0기사제공 :']"
7,삼성전자, 2017-11-0109:29,머니투데이 ,"코스피, 2540선 돌파… 삼성전자 등 IT주 상승 견인",https://finance.naver.com/news/news_read.nhn?article_id=0003956922&office_id=008&mode=search&query=삼성전자&page=15,"['       코스피, 2540선 돌파… 삼성전자 등 IT주 상승 견인      기사입력2017-11-01 09:29기사원문좋아요훈훈해요좋아요 평가하기공감좋아요0훈훈해요0슬퍼요0화나요0후속기사 원해요0댓글 [머니투데이 하세린 기자] [\'실적호조+배당확대\' 삼성전자 한때 287만원, SK하이닉스도 3%↑]코스피 지수가 전 거래일 보다 12.54포인트(0.50%) 오른 2535.97로 상승 개장한 1일 오전 서울 중구 KEB하나은행 딜링룸에서 딜러들이 업무를 보고 있다./사진=뉴시스코스피가 1일 개장 직후 또 다시 사상 최고치를 경신했다. 전날 사상 최대 실적을 발표한 삼성전자 등 대형 IT(정보기술)주가 크게 오르고 있다. 이날 오전 9시28분 현재 코스피 지수는 전날대비 20.97포인트(0.83%) 오른 2544.40에 거래되고 있다. 개장 직후 사상 최고가를 고쳐쓴 후 계속 상승중이다.간밤 뉴욕증시는 일제히 올랐다. 기업실적 호조가 이어지는 가운데 투자자들은 차기 연방준비제도(연준) 의장 지명과 세제개혁 방향에 주목했다. 31일(현지시간) 다우존스산업평균지수는 전일대비 28.50포인트(0.1%) 오른 2만3377.24로 거래를 마쳤다. S&P500지수는 전일대비 2.43포인트(0.1%) 상승한 2575.26으로 장을 끝냈다. 나스닥종합지수는 전일대비 28.71포인트(0.4%) 오르며 종가기준 사상 최고가인 6727.67로 마감했다. 코스피 시장에서는 개인과 외국인이 각각 60억원, 1397억원 순매수다. 기관은 1469억원 순매도다. 프로그램 매매는 차익거래 955억원 순매도, 비차익거래 249억원 순매수 등 전체 707억원 매도 우위다. 지수선물 시장에서는 개인과 기관은 각각 270계약, 1726계약 순매수다. 외국인은 1979계약 순매도다. 업종별로는 등락이 엇갈리고 있다. 전기전자가 3% 가까이 오르는 가운데 의약품 화학 종이목재 의료정밀 증권 등이 오름세다. 반면 음식료품과 은행이 1% 이상 내리고 있다. 시가총액 상위 종목 가운데선 삼성전자가 전일 컨퍼런스콜에서 2018년에도 메모리 반도체 수급이 타이트할 거란 전망을 밝히며 삼성전자와 SK하이닉스가 3%대 강세를 보이고 있다. 전날 분기기준 매출액·영업이익 모두 사상 최대 실적을 기록하고 배당규모를 확대한 삼성전자는 한때 287만5000원까지 올랐다. 현재는 283만원을 기록중이다. 호실적을 발표한 삼성SDI와 한미약품, 금호석유가 모두 5% 이상 오르고 있다. LG화학이 한중관계 개선 기대감을 타고 52주 신고가를 새로 썼다. 한중관계가 해빙기에 접어들면서 그동안 중국 배터리 시장에서 보조금 지원대상에서 제외되는 등 불이익을 받은 LG화학 제품이 중국에서 판매회복세를 보일 것이란 관측이 나온다.한진중공업은 필리핀 현지법인 출자 소식에 5% 이상 내리고 있다. 한진중공업은 전날 필리핀 현지법인(HHIC-P hil Inc.)에 1125억원(1억달러) 규모의 자금을 출자하기로 결정했다고 공시했다. 이번 출자를 위해 필리핀 법인은 주주배정 유상증자를 단행한다. 출자 이후 필 리핀 법인에 대한 한진중공업의 지분율은 99.9%가된다. 코스닥 지수는 1.62포인트(0.23%) 상승한 695.82를 기록하고 있다. 코스닥 시장에서는 개인이 272억원 순매수다. 외국인과 기관은 각각 143억원, 129억원 순매도다. 업종별로는 등락이 엇갈리고 있다. 비금속이 1% 이상 오르는 가운데 유통 운송 금융 기계장비 일반전지전자 등이 오르고 있다. 반면 IT종합 오락문화 통신방송서비스 등이 내리고 있다. 시가총액 상위 종목 중에선 셀트리온과 셀트리온헬스케어가 각각 1% 이상 강세다. 반면 파라다이스가 1% 넘게 빠지고 있고 기타 바이오주도 소폭 약세다. 한편 원/달러 환율은 서울 외국환시장에서 전장대비 2.10원(0.19%) 내린 1118.30원을 기록하고 있다. ▶옆사람이 지금 보는 기사들▶무료만화 즐기고~선물타자! ▶치어리더 vs 레이싱걸 하세린 기자 iwrite@mt.co.kr머니투데이 관련뉴스해당 언론사에서 선정하며 언론사 페이지(아웃링크)로 이동해 볼 수 있습니다.이영학 아내 성관계男 13명…9명 ""성매매 시인""배우 김주혁 교통사고로 사망, 삼성동 인근 (1보)故김주혁 부검, ""심근경색 아냐…사인, 머리 손상""송중기·송혜교 결혼식, 절친 ★총출동…축가·편지낭독배우 김주혁 사망, 대낮 서울 강남대로서 왜?좋아요0훈훈해요0슬퍼요0화나요0후속기사 원해요0기사제공 :']"
8,삼성전자, 2017-11-0109:28,이데일리 ,"'거실 천정 높이고, 주차장 더 넓게' 특화설계 분양단지 '주목'",https://finance.naver.com/news/news_read.nhn?article_id=0003959163&office_id=018&mode=search&query=삼성전자&page=15,"['       \'거실 천정 높이고, 주차장 더 넓게\' 특화설계 분양단지 \'주목\'      기사입력2017-11-01 09:28기사원문좋아요훈훈해요좋아요 평가하기공감좋아요0훈훈해요0슬퍼요0화나요0후속기사 원해요0댓글- 천정 높이고 알파공간 제공… 청약시장 흥행- 이달 ‘북한산 두산위브 2차’ 등 공급 잇따라[이데일리 김기덕 기자] 특화설계를 적용한 아파트가 분양시장에서 인기 상종가를 치고 있다. 개방감을 극대화하고 공간 효율성을 높인 특화설계 단지가 연내 잇따라 분양될 예정이어서 내 집 마련 실수요자들은 관심을 가져볼 만 하다. 업계에 따르면 지난 7월 대림산업이 부산 수영구에서 분양한 ‘e편한세상 오션테라스’는 테라스 특화설계를 적용해 큰 인기를 끌었다. 이 아파트는 1순위 청약 결과 718가구 모집에 16만3787명(중복청약 포함)이 몰려 평균 228대 1의 높은 청약경쟁률을 기록했다. 같은 달 현대산업개발이 서울 강동구 상일동에서 공급한 ‘고덕 센트럴 아이파크’도 층고를 법정 기준보다 10㎝ 높인 2.4m로 설계했다. 이 단지는 539가구 모집에 1만2734명이 접수해 평균 23.63대 1의 높은 청약경쟁률로 1순위 마감했다.한화건설은 지난달 서울 영등포구 영등포뉴타운 1-3구역에서 ‘영등포뉴타운 꿈에그린’ 분양에 나섰다. 이 단지는 기존 아파트보다 10㎝ 높은 2.4m의 천정고에 거실에는 우물천정을 설계해 2.53m까지 천정고를 끌어올리는 등 개방감을 극대화했다. 그 결과 지난 24일 진행한 아파트 1순위 청약에서 최고 39.06대 1의 청약경쟁률을 기록했다.한정적으로 주어진 공간을 건설사가 어떻게 설계하느냐에 따라 그 활용도는 천차만별이다. 건설사들은 서비스 면적을 제공해 테라스 공간을 만들거나, 알파공간을 만들어 다양하게 활용할 수 있게 하는 등의 특화설계를 적용하고 있다. 또 거실 층고를 법정 기준보다 높여 개방감을 극대화하고, 수납공간을 추가로 제공해 공간 효율성을 높이고 있다. 광폭 싱크대와 광폭 주차공간 등 세부적인 부분에서도 세심하게 신경을 쓰고 있는 상황이다.연내에도 수요자들의 주거 만족도를 높일 특화설계를 적용한 단지들이 잇따라 분양될 예정이다. 두산건설은 이달 서울 서대문구 홍은1동 13-25번지 일대에 홍은6구역을 재건축한 ‘북한산 두산위브 2차’를 분양한다. 296가구(전용면적 56·59㎡ ) 중 202가구가 일반분양된다. 단지는 서울에서 보기 드문 테라스 설계를 전용면적 56㎡타입(46가구)에 적용할 예정이다. 신안이 이달 경기 평택시 고덕면 고덕국제신도시에서 분양할 ‘평택고덕 A-16블록 신안인스빌 시그니처’(전용면적 84~96㎡ 613가구)는 틈새공간을 확대해 주거만족도를 높일 계획이다. 이 단지는 전체 가구가 기존 아파트 천정고 높이인 2.3m 보다 5㎝ 높은 2.35m로 개방감을 극대화했다. 또 전체 주차대수의 80.7%를 확장형 주차공간(2.5m X 5.1m)으로 설계, 기본 주차공간(2.3m X 5.0m)보다 주차 편의성도 뛰어나다. 고덕산업단지 내 삼성전자 반도채라인이 단지와 가깝고, 주변으로 LG디지털파크 및 진위2일반산업단지, 장당일반산업단지 등 산업단지가 몰려 있다. 김기덕 (kiduk@edaily.co.kr)▶이데일리 개편기념 이벤트 - 갤럭시 노트8 쏩니다▶[카카오톡] 플친 맺으면 스타벅스 쿠폰 팡팡~♥＜ⓒ종합 경제정보 미디어 이데일리 - 무단전재 & 재배포 금지＞이데일리 관련뉴스해당 언론사에서 선정하며 언론사 페이지(아웃링크)로 이동해 볼 수 있습니다.최치훈 삼성물산 사장, 美뉴욕 출장 간 이유는?[영상]제 신체사이즈는 3114입니다...미스 페루 이상한 자기소개, 왜?[단독]""송중기·송혜교 결혼식 드론, 명백한 위법""용인 일가족 살해범 아내 자진 귀국, 남편 범행 몰랐을까딱 12대만 나온다…애스턴 마틴의 톰 브래디 \'시그니처 에디션\'좋아요0훈훈해요0슬퍼요0화나요0후속기사 원해요0기사제공 :']"
9,삼성전자, 2017-11-0109:27,아시아경제 ,코스피 2540선 터치…2600 향해 질주,https://finance.naver.com/news/news_read.nhn?article_id=0004108131&office_id=277&mode=search&query=삼성전자&page=15,"['       코스피 2540선 터치…2600 향해 질주      기사입력2017-11-01 09:27기사원문좋아요훈훈해요좋아요 평가하기공감좋아요0훈훈해요0슬퍼요0화나요0후속기사 원해요0댓글 [아시아경제 박선미 기자]코스피가 연일 사상 최고치 기록을 갈아치우고 있다.1일 오전 9시19분 현재 코스피는 전일 대비 16.82포인트(0.67%) 오른 2540.25를 기록 중이다.지난달 30일 종가 기준 처음으로 2500을 넘어선 코스피는 연일 상승 행진을 이어가며 2540선도 넘었다. 개인이 74억원, 외국인이 1244억원 순매수 중이다. 반면 기관은 1327억원 순매도 하고 있다.IT업종이 코스피 상승의 주도주 역할을 하고 있다.시가총액 1위 종목인 삼성전자는 2.83% 오른 283만2000원을 기록, 또 사상 최고치를 경신했다.SK하이닉스 역시 2.80% 오른 8만4500원에 거래되고 있다.LG화학(2.23%), 삼성생명(0.37%), 현대모비스(1.50%), 삼성바이오로직스(1.43%) 등도 상승 중이다. 반면 현대차(-0.62%), NAVER(-2.46%), POSCO(-1.38%) 등은 상승세에 동참하지 못하고 있다.연내 코스피가 2600을 터치하는 것은 물론, 내년에는 3000대 진입도 가능할 것이란 낙관론이 확산되고 있다.이경민 대신증권 연구원은 내년 코스피 상승목표를 3000으로 제시하고 ""밸류에이션 정상화 만으로도 3000은 도달 가능한 지수대""라고 말했다. 상반기 중 코스피의 고점형성이 가능하다고 진단했다.박선미 기자 psm82@asiae.co.kr▶ 양낙규의 \'군사이야기\'▶ 2017아시아여성리더스포럼 ▶ #아시아경제 페이스북아시아경제 관련뉴스해당 언론사에서 선정하며 언론사 페이지(아웃링크)로 이동해 볼 수 있습니다.[속보]\'터질게 터졌다\' 北핵실험장 붕괴에…발칵北김정은, 이 와중에 김한솔 암살을…\'딱 걸렸다\'성관계를… 피해 남성만 4000여명 \'발칵\'이영학 아내 유서 ""성폭행, 시아버지뿐 아니라…""""北 공격하면 인구 90% 사망""…엄청난 무기가좋아요0훈훈해요0슬퍼요0화나요0후속기사 원해요0기사제공 :']"
10,삼성전자, 2017-11-0109:26,연합뉴스 ,"[특징주] 삼성생명, 전자가 효자…최고가",https://finance.naver.com/news/news_read.nhn?article_id=0009651076&office_id=001&mode=search&query=삼성전자&page=15,"['       [특징주] 삼성생명, 전자가 효자…최고가      기사입력2017-11-01 09:26기사원문좋아요훈훈해요좋아요 평가하기공감좋아요0훈훈해요0슬퍼요0화나요0후속기사 원해요0댓글 (서울=연합뉴스) 윤선희 기자 = 삼성생명이 삼성전자의 주주환원 정책 수혜로 관심을 끌면서 최고가를 기록했다.    1일 오전 9시 25분 현재 유가증권시장에서 삼성생명은 전날보다 0.37% 오른 13만5천500원에 거래 중이다. 장중에는 13만6천500원까지 올라 사상 최고가를 썼다.     이는 삼성전자가 전날 실적을 발표하면서 주주환원 규모를 확대하겠다고 밝힌 데 따른 것이다.     삼성생명은 삼성전자 보통주 1천62만주(8.23%) 보유한 최대주주다.    SK증권은 삼성전자의 연간 배당규모 확대와 자사주 추가매입, 소각을 고려할 때 삼성생명의 배당수익은 내년과 2019년 이후 각각 5천950억원, 7천500억원 수준으로 추정했다.    유안타증권은 삼성생명 목표주가를 16만2천원으로 14.2% 상향 조정했다.     정준섭 유안타증권 연구원은 ""삼성생명의 내년 예상 삼성전자 배당수익은 올해보다 13% 늘어난 5천843억원, 순이익은 1조7천959억원으로 늘어날 것""이라고 전망했다.    indigo@yna.co.kr기사 문의(기사 제목을 꼭 알려주세요) 및 제보는 여기로(클릭!)최신 유행 트렌드 총집결(클릭!)연합뉴스 관련뉴스해당 언론사에서 선정하며 언론사 페이지(아웃링크)로 이동해 볼 수 있습니다.\xa0평창올림픽 금메달 총 몇개일까\xa0라스베이거스 총격범 객실서 실수로 총 쏜 경찰관 있었다\xa0알바생이 미래 자녀에게 추천하는 알바 직종 1위는?\xa0가짜몰카 영상 올렸더니 2주간 무려 2만6천건 내려받아\xa0송혜교 송중기 결혼, 장쯔이 박보검도…""축하""좋아요0훈훈해요0슬퍼요0화나요0후속기사 원해요0기사제공 :']"
11,삼성전자, 2017-11-0109:25,서울경제 ,"삼성생명, 삼성전자 효과에 장초반 신고가 경신",https://finance.naver.com/news/news_read.nhn?article_id=0003142902&office_id=011&mode=search&query=삼성전자&page=15,"['       삼성생명, 삼성전자 효과에 장초반 신고가 경신      기사입력2017-11-01 09:25기사원문좋아요훈훈해요좋아요 평가하기공감좋아요0훈훈해요0슬퍼요0화나요0후속기사 원해요0댓글 [서울경제] 삼성생명(032830)이 삼성전자(005930) 효과에 1일 장초반 52주 신고가를 경신했다이날 삼성생명은 유가증권시장에서 9시 21분 현재 전거래일 대비 0.37% 오른 13만 5,500원에 거래 중이다. 장초반에는 13만 6,500원까지 오르며 신고가도 경신했다. 삼성전자가 전날 자사주 소각, 배당 확대 등을 발표하면서 지분을 갖고 있는 삼성생명에 긍정적으로 작용한 것으로 분석된다./이경운기자 cloud@sedaily.com[서울경제 바로가기]1997년 이래 대한민국 최고의 과학자 DB [바로가기]서울경제의 모든 연재물!... 서경Cube [바로가기▶]저작권자 ⓒ 서울경제, 무단 전재 및 재배포 금지서울경제 관련뉴스해당 언론사에서 선정하며 언론사 페이지(아웃링크)로 이동해 볼 수 있습니다.배우 김주혁 믿기 힘든 사망소식에 할말 잃은 사람들노트8·갤럭시J 효과···삼성, 스마트폰으로 번 돈 무려송중기, 송혜교와 결혼 직전 \'새신랑 미소\'..하객 장쯔이와 셀카[SE★이슈] 정찬우, 선미가 남긴 김주혁 애도 글에 ""꽃 예쁘네""김주혁 빈소, 데프콘 울먹거리며 찾아 \'안타까워\'좋아요0훈훈해요0슬퍼요0화나요0후속기사 원해요0기사제공 :']"
12,삼성전자, 2017-11-0109:23,한국경제 ,"[특징주]삼성전자·SK하이닉스, 동반 강세…""내년도 반도체 호황""",https://finance.naver.com/news/news_read.nhn?article_id=0003844204&office_id=015&mode=search&query=삼성전자&page=15,"['       [특징주]삼성전자·SK하이닉스, 동반 강세…""내년도 반도체 호황""      기사입력2017-11-01 09:23기사원문좋아요훈훈해요좋아요 평가하기공감좋아요0훈훈해요0슬퍼요0화나요0후속기사 원해요0댓글 시가총액 1, 2위인 삼성전자와 SK하이닉스가 반도체 호황이 지속될 것이라는 기대감에 힘입어 강세를 보이고 있다.11일 오전 9시16분 현재 대장주 삼성전자는 전날보다 8만3000원(3.001%) 오른 283만7000원에 거래되고 있다. 장 초반 287만5000원까지 올라 사상 최고가를 경신했다.SK하이닉스는 2400원(2.92%) 오른 8만4600원에 거래 중이다.금융투자업계에서는 \'반도체 슈퍼호황\'이 당분간 이어질 것이라는 기대감이 삼성전자와 SK하이닉스 등 반도체주 주가를 끌어올리고 있다고 분석했다. 삼성전자는 전일 컨퍼런스콜에서 2018년에도 메모리 반도체 수급이 타이트할 거란 전망을 밝힌 바 있다.안혜원 한경닷컴 기자 anhw@hankyung.com[한경닷컴 바로가기] [글방] [모바일한경 구독신청] ⓒ 한국경제 & hankyung.com, 무단전재 및 재배포 금지한국경제 관련뉴스해당 언론사에서 선정하며 언론사 페이지(아웃링크)로 이동해 볼 수 있습니다.삼성전자, \'또\' 사상 최고가…""호실적·주주환원책 호재""(출발)삼성전자 287만5000원…4.39%↑""한국, 이대로 가다간 \'재앙\' 온다""… 충격 경고시험 삼아 만든 선글라스, 100만개 \'대박\' 난 회사신형 그랜저, 출시 10개월 만에… 예상치 못한 결과좋아요0훈훈해요0슬퍼요0화나요0후속기사 원해요0기사제공 :']"
13,삼성전자, 2017-11-0109:23,한국경제 ,"코스피, '또' 사상 최고가 경신…2540선 돌파",https://finance.naver.com/news/news_read.nhn?article_id=0003844203&office_id=015&mode=search&query=삼성전자&page=15,"['       코스피, \'또\' 사상 최고가 경신…2540선 돌파      기사입력2017-11-01 09:23기사원문좋아요훈훈해요좋아요 평가하기공감좋아요0훈훈해요0슬퍼요0화나요0후속기사 원해요0댓글 코스피가 고공행진을 이어가고 있다. 장 중 2540선을 돌파하며 최고치를 또 갈아치웠다.  1일 오전 9시15분 현재 코스피 지수는 전날보다 16.43(0.65%) 오른 2539.86을 나타내고 있다.전날 2523.43으로 장을 마치며 최고가를 기록한 코스피는 이날도 상승세를 지속했다. 장 중 2542.75까지 오르며 장 중 최고치를 다시썼다.간밤 미국 증시도 미국 중앙은행(Fed)의 통화정책 결정을 앞두고 올랐다. 뉴욕증권거래소(NYSE)에서 다우존스 30 산업평균지수는 전날보다 28.5포인트(0.12%) 상승한 23,377.24에 거래를 마쳤다. 스탠더드 앤드 푸어스(S&P) 500 지수와 나스닥 지수는 각각 0.09%와 0.43% 올랐다.외국인과 개인이 각각 1145억원과 100억원 어치의 주식을 사들이고 있다. 기관이 1252억원 순매도다. 프로그램 매매로는 차익거래 914억원 순매도, 비차익거래 211억원 순매수로 전체 703억원 매도우위다.  업종별로는 제조업 의약품 증권 등이 상승세다. 반면 은행 운송장비 전기가스업 등은 하락하고 있다. 시가총액 상위종목 중 LG전자 롯데케미칼 삼성전기 등은 1%대 상승세를 보이고 있다.삼성전자는 장 중 280만원을 찍으며 사상 최고가를 새로 썼다. 전날 발표한 3분기 실적과 주주환원정책 확대 방안 등이 투자심리를 자극한 것으로 보인다.삼성SDI는 3분기 깜짝실적과 4분기 실적 성장 기대감에 6% 이상 급등하고 있다. 코스닥 지수는 전날보다 1.47포인트(0.21%) 오른 695.67을 기록하고 있다. 개인이 206억원 순매수다. 외국인과 기관이 각각 122억원과 81억원 매도 우위다.코스닥 시가총액 1위와 2위인 셀트리온과 셀츠리온헬스케어는 나란히 상승 중이다.원·달러 환율은 사흘 연속 하락세다. 이날 오전 9시13분 현재 서울 외환시장에서 원·달러 환율은 전날보다 1.9원 내린 1118.50원에 거래되고 있다.김근희 한경닷컴 기자 tkfcka7@hankyung.com[한경닷컴 바로가기] [글방] [모바일한경 구독신청] ⓒ 한국경제 & hankyung.com, 무단전재 및 재배포 금지한국경제 관련뉴스해당 언론사에서 선정하며 언론사 페이지(아웃링크)로 이동해 볼 수 있습니다.코스피, 사상 최고치 또 경신…장중 2540선 돌파(속보)(출발)코스피, 12.54p 상승 2535.97""한국, 이대로 가다간 \'재앙\' 온다""… 충격 경고시험 삼아 만든 선글라스, 100만개 \'대박\' 난 회사신형 그랜저, 출시 10개월 만에… 예상치 못한 결과좋아요0훈훈해요0슬퍼요0화나요0후속기사 원해요0기사제공 :']"
