,회사명,날짜,언론사,기사제목,링크,본문
0,삼성전자, 2017-04-2922:23,YTN ,[중점] 세계 가전 트렌드...끝없는 '영역 파괴',https://finance.naver.com/news/news_read.nhn?article_id=0001004600&office_id=052&mode=search&query=삼성전자&page=1,"['       [중점] 세계 가전 트렌드...끝없는 \'영역 파괴\'      기사입력2017-04-29 22:23기사원문좋아요훈훈해요좋아요 평가하기공감좋아요0훈훈해요0슬퍼요0화나요0후속기사 원해요0댓글 [앵커]세계 3대 전자 전시회 가운데 하나로 오는 9월에 열리는 \'베를린 국제가전박람회\', IFA(이파)를 미리 소개하는 행사가 열렸습니다.최첨단 기능을 통해 가전제품과 생활용품이 기존의 영역을 넘어 연결되고 확장하면서, 진화의 속도는 더 빨라지고 있습니다.포르투갈 현지를 임승환 기자가 다녀왔습니다.[기자]2017년 베를린 국제가전박람회, IFA를 넉 달여 앞두고 열린 글로벌 프레스 컨퍼런스!전 세계에서 300명이 넘는 취재진이 몰렸습니다.삼성전자는 지난 3월에 공개한 신개념 TV \'더 프레임\'으로 다시 한 번 주목을 받았습니다.평범한 액자 같지만, 초고화질 QLED TV로, TV가 꺼지면 예술 작품이나 사진을 화면에 띄울 수 있습니다.거실이 미술관으로 바뀌는 셈인데, TV의 영역이 예술로 확대되는 겁니다.다음 달 말부터는 유럽을 시작으로 판매에 돌입합니다.[마이클 죌러 / 삼성전자 유럽 디스플레이 부사장 : 우리는 이제 화질에 대해서는 조금 덜 언급하고 라이프 스타일(생활 방식)을 더 많이 얘기하기 시작했습니다.]지난 1970년대부터 시계, 신발, 스마트폰 등에 스포츠카 디자인을 적용해온 포르쉐!이번에는 노트북 컴퓨터를 선택했습니다.정교한 기어의 톱니바퀴를 장착해 360도로 꺾이고, 모니터를 분리해 태블릿 PC로 사용할 수도 있습니다.[마이클 나겔 / 포르쉐 디자인 : 우리는 소비자에게 좋은 특성을 제공하는데, 디자인과 최신 기술의 결합입니다.]필립스는 스마트폰과 인공지능 전동칫솔을 연결해 실시간으로 치아 상태를 알려주는 것은 물론, 외부에서 집 안의 공기 상태를 최적의 수준으로 조절하는 등 헬스케어의 혁신을 제시했습니다.인공지능 비서에게 명령해 조명을 선택하고, 일반적인 거울을 손쉽게 컴퓨터로 바꿔 사용하기도 합니다.[옌스 하이테커 / IFA 사장 : 소비자들은 새로운 기술과 콘텐츠가 자신의 여러 기기에 통합되기를 기대하고 있습니다.]전 세계 디지털 시장 규모는 해마다 커지면서 올해 9,450억 달러에서 내년에는 9,540억 달러, 우리 돈 1,078조 원을 넘을 것으로 전망됩니다.특히 스마트 가전 시장은 최근 2년 동안 2배씩 성장하고 있습니다.첨단 기술의 발전은 가전제품과 생활용품을 가리지 않고 모든 분야에서 기존의 틀을 깨면서 연결되고 융합하고 있습니다.오늘 9월에 열리는 베를린 국제가전박람회, IFA 본 행사가 더욱 주목되는 이유입니다.포르투갈 리스본에서 YTN 임승환[shlim@ytn.co.kr]입니다.▶뉴스 덕후들의 YTN페이스북 ▶""대한민국을 구할 대통령을 찾아라"" 2017 대선! 안드로메다[저작권자(c) YTN(Yes! Top News) 무단전재 및 재배포 금지]YTN 관련뉴스해당 언론사에서 선정하며 언론사 페이지(아웃링크)로 이동해 볼 수 있습니다.박 前 대통령 \'단식설\'에 대한 구치소의 입장정유라 ""한국가면 아들 뺏길까 두렵다""불륜 폭로 협박에 ""같이 죽자"" 끌고 투신했다가…오토바이 탈 때 반드시 헬멧을 써야하는 이유아이가 낙서한 명품 가방을 본 엄마의 반응좋아요0훈훈해요0슬퍼요0화나요0후속기사 원해요0기사제공 :']"
1,삼성전자, 2017-04-2921:45,오마이뉴스 ,"민간에 채용 맡겼더니... 대기업, 6년간 25만 명 줄었다",https://finance.naver.com/news/news_read.nhn?article_id=0002149212&office_id=047&mode=search&query=삼성전자&page=1,"['       민간에 채용 맡겼더니... 대기업, 6년간 25만 명 줄었다      기사입력2017-04-29 21:45기사원문좋아요훈훈해요좋아요 평가하기공감좋아요0훈훈해요0슬퍼요0화나요0후속기사 원해요0댓글[분석] 2010년~2016년 고용노동부 통계, 300인 이상 대기업 채용 24% 감소[오마이뉴스신상호 기자] ▲ \xa0래퍼곡선. 가로축이 세율, 세로축이 세수다. 오른 쪽으로 갈수록 세율은 높아진다. 세율이 100%면 세수는 0가 된다는 것이 래퍼곡선의 이론이다. ⓒ 프레이져인스티튜\'래퍼곡선\'은 음식점에 있는 냅킨에 처음 그려졌다. 래퍼 교수는 지난 1974년 미국 워싱턴의 한 음식점에서 도널드 레이건 당시 대통령 후보 쪽 관계자들과 만났다. 세수와 세율에 대해 설명하던 그는 냅킨을 집어 역 \'U\'자형 곡선을 그렸다. 세율이 100%면 세수는 \'0\'. 가령 100만원을 버는 사람이 100만원을 모두 세금으로 내면 일을 안 한다는 것이다. 세금 높이면 투자와 근로 의욕 저하로 세수도 줄어든다는 게 래퍼 곡선의 \'논리\'였다. 냅킨 위 곡선은 ""세금 깎아주면, 일자리 늘고, 경기 살아난다""는 강력한 우파 논리로 발전했고, 도널드 레이건 정부의 세금 인하 정책으로 이어졌다. ""새누리당 정권 10년 동안\xa0민간에게 모든 걸 맡기고 전경련 해달라는 대로 세금 깎아줬는데 고용이 됐는가 성장이 됐는가?"" (28일 밤 TV토론에서 심상정 정의당 후보)""기업 투자를 많이 하고, 일자리를 만들게 하고, 일자리가 많아지면, 서민복지 자연스럽게 된다."" (홍준표 자유한국당 후보)래퍼곡선 따라 세금 깎아준 우리나라, 대기업 채용 \'후퇴\'그동안 우리나라 정부도 래퍼곡선의 논리를 따랐다. 역대 정부는 법인세를 지속적으로 깎아줬다. 국회 예산정책처 재정통계에 따르면, 지난 2002년 법인세 최고세율은 27%였다. 노무현 정부 시절인 2005년에는 25%로 내려갔고, 이명박 정부 시절에는 22%까지 내려갔다. 박근혜 정부는 최고세율 22%를 유지했다. 비과세 감면을 빼면 법인세 실효세율은 10% 중반 수준이다. 2016년 기준 명목법인세율이 30%대 수준인 프랑스와 독일, 이탈리아, 멕시코보다 낮고, 최근 기업 규제 완화로 경기가 살아나는 일본(23.4%)보다 낮다. 이 정도면, 기업들에게 나쁜 환경은 아니다. 그런데 좀처럼 효과가 없다. 세금을 깎아줬지만 대기업들은 채용을 줄였다. 대기업이 돈 벌면, 중소기업도 그 효과를 누린다는 낙수효과는 사실상 미미했다. 대선후보들의 경제 부문 토론에서 유권자들이\xa0살펴야 할 지점이다.  ▲ \xa02010~2016년 300인 이상 사업장(초록색 선) 채용 변화 추이 ⓒ 고용노동부지난 2010년 105만 명이었던\xa0300인 이상 사업장의\xa0채용은 지난해 80만 명 수준까지 떨어졌다. 고용노동부 고용노동통계(고용부문 년고용통계)에 따르면,\xa0근로자 300인 이상 사업장의 지난 2010년 채용 인원은 모두 105만2208명이다.채용 인원은 2011년을 정점으로 내리막길을 걷는다. 2011년에는 111만1539명이 채용됐고, 2012년 106만2182명으로 줄었다. 2013년에는 87만9986명으로 감소했고, 2014년 87만2974명, 2015년에는 79만1799명까지 낮아졌다. 2016년 80만3011명으로 전년보다는 다소 높아졌지만, 여전히 80만 명 수준에 머물고 있다. 2010년에 비하면 채용 인원이 25만명 감소한 것이다. 게다가 이중 절반(36만2136명) 가량은 계약기간이 1년 미만인 임시직이다.\xa0\xa0 고용노동부 관계자는 와 전화통화에서 ""기존 고용 계약이 만료된 뒤 다시 재계약하는 사람도 포함돼 있고, 중복된 수치가 있을 수 있다""면서 ""신규 채용과 중복 채용은 명확히 구분할 수 없는데, 중복 채용을 빼면 신규 채용 수는 더 줄어들 수 있다""라고 설명했다.\xa0 삼성, 포스코 등 대기업은? 낙수 효과 미미 ▲ 선관위 주최 TV토론 참석한 대선후보들\xa0중앙선관위 주최 제19대 대통령선거 후보자 합동토론회가 지난 28일 오후 서울 마포구 상암동 MBC스튜디오에서 열린 가운데, (왼쪽부터) 더불어민주당 문재인, 정의당 심상정, 바른정당 유승민, 국민의당 안철수, 자유한국당 홍준표 후보가 토론을 준비하고 있다. ⓒ 국회사진취재단30대 대기업으로 좁혀보자. CEO스코어 자료에 따르면, 30대 그룹 대기업 계열사 253개사 근로자 수는 지난해 93만124명이었다. 지난 2015년(95만27명)에 비해 1만9903명, 2.1% 줄었다. 삼성은 희망퇴직과 사업부 매각 등으로 1만3006명 줄였고, 현대중공업 그룹도 4912명, 포스코도 1456명 감소했다. 30대 그룹 중 신세계 그룹이 고용을 가장 많이 늘렸는데, 증가 규모는 1천명대(1199명) 수준에 불과했다.\xa0 2015년에도 30대 그룹 272개 계열사에 101만3142명이 고용됐는데, 2014년(101만7661명)에 비하면 5000명(4959명) 가량 줄어든 것이다. 2014년에도 30대 그룹 계열사들의 고용은 전년 대비 1.3%p 증가하는 데 그쳤다. 대기업들은 세금 등 정부 정책보다는 경기 변동에 민감하게 움직였다. 윤정혜 한국고용정보원 책임연구원은 지난 2013년 보고서에서 ""경기침체기인 2011년 1월 이후 대규모 사업체 채용인원은 급감하고, 중소사업체는 둔화됐다""면서 ""경기변동이 중소 사업체보다 대규모 사업체 채용 변동에 더 큰 영향을 미치고 있다""라고 분석했다. 대기업이 돈 벌면 중소기업도 덕을 본다는 낙수 효과도 미미했다. \'수출의 국민경제 파급효과 분석\' 보고서(중소기업연구원)를 보면, 삼성전자의 매출이 1% 증가할 때, 2차 협력업체의 매출 증가 효과는 0.07%, 3차 협력업체는 0.005%에 불과했다. 현대자동차의 매출이 1% 증가하면, 1차 협력업체는 0.43% 올라가고, 2차 협력업체는 0.05%, 3차 협력업체는 0.004% 매출 효과가 있는 것으로 나타났다. 1.5리터 물 한통 부으면, 3차 협력업체에는 물 한 방울 찔끔 떨어지는 셈이다. 대기업과 중소기업 동조관계 약화중소기업연구원은 \'낙수효과에 관한 통계분석이 주는 시사점\' 보고서에서 ""1차와 2차, 3차로 내려갈수록 파급효과의 크기는 줄어들고, 1차 협력업체 중심으로 대형화되고 있다""며 ""대기업과 중소기업간 동조 관계는 약화되고 있다""라고 결론지었다. 대기업이 돈 벌어 중소기업에도 파급돼 모두가 부유해지는 인과관계가\xa0약해졌다는 분석이다.연구원은 또 ""고도 성장과정에서 대기업이 주도적인 역할을 해왔고, 앞으로도 경제 성장에 큰 기여를 할 것이지만, 소프트웨어가 중요해지는 시대에 대기업 위상 약화는 불가피하다""면서 ""대기업 중심 사고에서 벗어나야 한다""라고 지적했다.래퍼곡선은 두 극단이 있다. 세율이 100%면 세수가 \'0\', 세율이 0%여도 세수는 \'0\'이다. 대기업들은 세금을 더 깎아야 한다고 주장한다. 그들의 주장을 받아 아예 세율을 \'0\'으로 만들면 일자리가 늘어날 수 있을까? 최소한 지금 결과를 보면, 마냥 세율을 내리는 게 효과적인 결과를 낳을 거라고 장담할 수 없다. 단순히\xa0볼 때 래퍼곡선의 최적 효율점은 역 \'U\'자 곡선의 정점인 세율 50% 구간이다. 세금 수입도 극대화되는 지점이다. 저작권자(c) 오마이뉴스(시민기자), 무단 전재 및 재배포 금지☞ 이 기사 응원! 자발적 유료 구독 [10만인클럽]☞ 모든 시민은 기자다! [오마이뉴스 기사 더보기]☞ 페이지 좋아요! 공식 [페이스북]오마이뉴스 관련뉴스해당 언론사에서 선정하며 언론사 페이지(아웃링크)로 이동해 볼 수 있습니다.""\'밥이 곧 법이다\', 국민은 절박"" ""제2의 벤처붐, 일자리 115만개""나영석과 유재석의 성공 비결, 이 남자는 안다문재인 아들 특혜 입막음 인사? 의문점 5가지레즈비언 커플이 만든 \'사랑과 연대의 요리\'한국 최초 \'예술로 먹고 사는 섬\' 탄생한다좋아요0훈훈해요0슬퍼요0화나요0후속기사 원해요0기사제공 :']"
2,삼성전자, 2017-04-2918:52,YTN ,[중점] 세계 가전 트렌드...끝없는 '영역 파괴',https://finance.naver.com/news/news_read.nhn?article_id=0001004563&office_id=052&mode=search&query=삼성전자&page=1,"['       [중점] 세계 가전 트렌드...끝없는 \'영역 파괴\'      기사입력2017-04-29 18:52기사원문좋아요훈훈해요좋아요 평가하기공감좋아요0훈훈해요0슬퍼요0화나요0후속기사 원해요0댓글 [앵커]세계 3대 전자 전시회 가운데 하나로 오는 9월에 열리는 \'베를린 국제가전박람회\', IFA(이파)를 미리 소개하는 행사가 열렸습니다.최첨단 기능을 통해 가전제품과 생활용품이 기존의 영역을 넘어 연결되고 확장하면서, 진화의 속도는 더 빨라지고 있습니다.포르투갈 현지를 임승환 기자가 다녀왔습니다.[기자]2017년 베를린 국제가전박람회, IFA를 넉 달여 앞두고 열린 글로벌 프레스 컨퍼런스!전 세계에서 300명이 넘는 취재진이 몰렸습니다.삼성전자는 지난 3월에 공개한 신개념 TV \'더 프레임\'으로 다시 한 번 주목을 받았습니다.평범한 액자 같지만, 초고화질 QLED TV로, TV가 꺼지면 예술 작품이나 사진을 화면에 띄울 수 있습니다.거실이 미술관으로 바뀌는 셈인데, TV의 영역이 예술로 확대되는 겁니다.다음 달 말부터는 유럽을 시작으로 판매에 돌입합니다.[마이클 죌러 / 삼성전자 유럽 디스플레이 부사장 : 우리는 이제 화질에 대해서는 조금 덜 언급하고 라이프 스타일(생활 방식)을 더 많이 얘기하기 시작했습니다.]지난 1970년대부터 시계, 신발, 스마트폰 등에 스포츠카 디자인을 적용해온 포르쉐!이번에는 노트북 컴퓨터를 선택했습니다.정교한 기어의 톱니바퀴를 장착해 360도로 꺾이고, 모니터를 분리해 태블릿 PC로 사용할 수도 있습니다.[마이클 나겔 / 포르쉐 디자인 : 우리는 소비자에게 좋은 특성을 제공하는데, 디자인과 최신 기술의 결합입니다.]필립스는 스마트폰과 인공지능 전동칫솔을 연결해 실시간으로 치아 상태를 알려주는 것은 물론, 외부에서 집 안의 공기 상태를 최적의 수준으로 조절하는 등 헬스케어의 혁신을 제시했습니다.인공지능 비서에게 명령해 조명을 선택하고, 일반적인 거울을 손쉽게 컴퓨터로 바꿔 사용하기도 합니다.[옌스 하이테커 / IFA 사장 : 소비자들은 새로운 기술과 콘텐츠가 자신의 여러 기기에 통합되기를 기대하고 있습니다.]전 세계 디지털 시장 규모는 해마다 커지면서 올해 9,450억 달러에서 내년에는 9,540억 달러, 우리 돈 1,078조 원을 넘을 것으로 전망됩니다.특히 스마트 가전 시장은 최근 2년 동안 2배씩 성장하고 있습니다.첨단 기술의 발전은 가전제품과 생활용품을 가리지 않고 모든 분야에서 기존의 틀을 깨면서 연결되고 융합하고 있습니다.오늘 9월에 열리는 베를린 국제가전박람회, IFA 본 행사가 더욱 주목되는 이유입니다.포르투갈 리스본에서 YTN 임승환[shlim@ytn.co.kr]입니다.▶뉴스 덕후들의 YTN페이스북 ▶""대한민국을 구할 대통령을 찾아라"" 2017 대선! 안드로메다[저작권자(c) YTN(Yes! Top News) 무단전재 및 재배포 금지]YTN 관련뉴스해당 언론사에서 선정하며 언론사 페이지(아웃링크)로 이동해 볼 수 있습니다.박 前 대통령 \'단식설\'에 대한 구치소의 입장정유라 ""한국가면 아들 뺏길까 두렵다""불륜 폭로 협박에 ""같이 죽자"" 끌고 투신했다가…오토바이 탈 때 반드시 헬멧을 써야하는 이유아이가 낙서한 명품 가방을 본 엄마의 반응좋아요0훈훈해요0슬퍼요0화나요0후속기사 원해요0기사제공 :']"
3,삼성전자, 2017-04-2916:57,머니투데이 ,불황에도 '영업이익 1조' 2배 증가…비결은 선구안과 기술력,https://finance.naver.com/news/news_read.nhn?article_id=0003865551&office_id=008&mode=search&query=삼성전자&page=1,"['       불황에도 \'영업이익 1조\' 2배 증가…비결은 선구안과 기술력      기사입력2017-04-29 16:57기사원문좋아요훈훈해요좋아요 평가하기공감좋아요0훈훈해요0슬퍼요0화나요0후속기사 원해요0댓글 [머니투데이 심재현 기자, 임동욱 기자] [\'1조 클럽\' 영업이익 합계 규모도 1년새 40%↑…작년 4개사에서 올해 9개사로, 연간 전망도 \'화창\']올해 1분기 영업이익 1조원의 벽을 뚫은 \'1조 클럽\' 상장법인이 지난해 같은 기간보다 2배 이상 늘었다. 이들 기업의 영업이익 합계는 지난해 같은 기간보다 40% 이상 증가했다.불황에도 한발 앞서 차별화를 준비한 선구안과 글로벌 시장경쟁에서 밀리지 않는 기술력의 결실이라는 평가가 나온다.28일 머니투데이가 올 1분기 실적을 발표한 상장법인을 전수조사한 결과 영업이익 1조원을 넘긴 기업(공기업·금융회사 포함)은 7개사로 집계됐다.삼성전자(9조8984억원), SK하이닉스(2조4675억원), 포스코(1조3650억원), 신한지주(1조2982억원), 현대차(1조2508억원), LG디스플레이(1조268억원), SK이노베이션(1조42억원)이 분기 영업이익 1조 클럽에 이름을 올렸다.증권사들의 국내 상장법인 1분기 실적 추정치를 바탕으로 아직 실적을 발표하지 않은 곳까지 감안하면 한국전력과 SK가 추가될 것으로 보인다. 한국전력은 1분기 영업이익 2조4560억원, SK는 1조4970억원이 예상된다. LG전자(9215억원), 롯데케미칼(8151억원)은 1조 클럽 문턱에서 탈락했다.삼성전자와 한국전력, SK, 포스코, 현대차, 신한지주, SK이노베이션 등 7개사는 매출액까지 10조원을 뛰어넘으면서 \'10-1 클럽\' 명단에도 포함될 전망이다.지난해와 비교하면 영업이익 1조원 이상을 달성한 상장법인이 9개사로 2배 이상 늘었다. 지난해 1분기 영업이익 1조 클럽은 삼성전자(6조6758억원), 한국전력(3조6053억원), SK(1조5128억원), 현대차(1조3424억원) 등 4곳에 그쳤다.올 1분기 \'1조 클럽\' 상장법인의 영업이익 합계는 22조2639억원으로 지난해 같은 기간(15조8974억원)보다 40.1% 늘었다. 지난해 1분기 영업이익 1조 클럽 4개사 기준(13조1363억원)으로는 70% 가까이 증가했다.시장에선 1분기 실적을 고려할 때 올해 연간 1조원 이상의 영업이익을 낼 것으로 예상되는 상장법인이 사상 최대였던 지난해 수준(37곳)을 보일 것이라는 데 무게를 싣는다.글로벌 경기불황이 장기화되는 와중에도 국내 대표 기업들의 수익 규모가 최소한 현상태를 유지할 것이라는 얘기다. 연간 기준으로 영업이익 1조원 클럽에 이름을 올린 기업은 2015년 27곳에 그쳤다.산업별로 반도체 시장 호황의 수혜를 입은 IT 업종의 실적이 큰 폭으로 늘었다. 삼성전자는 반도체 부문에서만 6조3100억원으로 사상 최대 수익을 올렸다. SK하이닉스도 1분기 영업이익 2조4676억원으로 사상 최대 기록을 갈아치웠다.분기 영업이익 1조원의 성적표의 비결로 시장을 앞서 내다본 오너십을 꼽는 분석도 나온다. 최태원 SK그룹 회장은 2012년 하이닉스를 인수하면서 정유와 통신으로 성장한 SK그룹에 반도체를 끼워넣는 밑그림을 그렸다. SK이노베이션이 석유 수익 감소에도 불구하고 올 1분기 영업이익 1조원을 돌파할 수 있었던 것도 2011년부터 5조원을 투자하면서 비정유사업을 키운 체질 개선의 성과라는 평가다.삼성전자와 LG디스플레이는 대체 불가능한 글로벌 기술력의 사례로 꼽힌다. 삼성전자의 1분기 영업이익률이 20%에 육박하는 최고 성적을 낸 직접적인 이유다. LG디스플레이는 대형 디스플레이 패널 기술력을 발판으로 지난 분기에 세운 사상 최대 영업이익 기록(9043억원)을 한 분기만에 갈아치웠다.[▶깊이있는 투자정보 \'TOM칼럼\'][▶트렌드 리더의 스타일 지침서 \'스타일M\'][▶빵빵한 차&레이싱걸]심재현 기자 urme@mt.co.kr, 임동욱 기자 dwlim@mt.co.kr머니투데이 관련뉴스해당 언론사에서 선정하며 언론사 페이지(아웃링크)로 이동해 볼 수 있습니다.도로 위 섬…""매연은 일상, 화장실 안가려 안간힘""20대 女경리, 나랏돈 3.2억 \'꿀꺽\' 어디 썼나보니…경남 통영서 토막난 여성 변사체 발견""달달한 투샷"" 차예련♥주상욱, 하와이 사진 공개7세 딸 학대해 사망 이르게 한 엄마 징역 10년 확정좋아요0훈훈해요0슬퍼요0화나요0후속기사 원해요0기사제공 :']"
4,삼성전자, 2017-04-2915:48,데일리안 ,'삼성 취업' 베트남 취준생도 '우르르'…지원자만 2만명,https://finance.naver.com/news/news_read.nhn?article_id=0002182800&office_id=119&mode=search&query=삼성전자&page=1,"['       \'삼성 취업\' 베트남 취준생도 \'우르르\'…지원자만 2만명      기사입력2017-04-29 15:48기사원문좋아요훈훈해요좋아요 평가하기공감좋아요0훈훈해요0슬퍼요0화나요0후속기사 원해요0댓글GSAT 현지 합격자 대상 5월 면접 뒤 6월 최종 합격자 발표국내 최대 기업 삼성에 입사하려는 취업준비생의 열기가 베트남에서도 뜨겁다. 사진은 서울 서초동 삼성서초사옥에 깃발이 펄럭이는 모습.ⓒ데일리안국내 최대 기업 삼성에 입사하려는 취업준비생의 열기가 베트남에서도 뜨겁다.삼성그룹은 29일 베트남 수도 하노이와 남부도시 호치민에서 현지 대학졸업자 8200명을 대상으로 직무적성검사(GSAT)를 실시했다.이는 삼성전자와 삼성전기, 삼성디스플레이, 삼성SDI, 삼성SDS의 베트남법인 신입사원 공채를 위한 시험으로 1차 서류전형을 통과한 총 7000여 명이 해당 시험을 치렀다.1차 서류전형에는 베트남 전역에서 약 2만여 명이 지원서를 냈다. 삼성은 지난 2011년부터 지난해까지 베트남에서 GSAT를 통해 인재 9500여 명을 채용한 바 있다.삼성 한 관계자는 ""베트남에서 매년 정기적으로 대규모 신입사원 공채를 하는 것은 베트남 기업이나 외국인 기업을 통틀어 삼성이 유일하다""고 자부심을 드러냈다.삼성은 이번 GSAT 합격자를 대상으로 5월 면접을 진행한 뒤 6월 최종 합격자를 발표한다는 방침이다.데일리안 스팟뉴스팀 ⓒ (주)데일리안 - 무단전재, 변형, 무단배포 금지데일리안 관련뉴스해당 언론사에서 선정하며 언론사 페이지(아웃링크)로 이동해 볼 수 있습니다.북 유엔 차석대사 ""어떤 제재로도 핵무기 굴복 못시켜""정유라 ""귀국하면 아들 뺏길까봐 겁나""박은주 전 김영사 사장, 횡령·배임 혐의로 구속토요일 날씨, 맑은 초여름날씨…미세먼지 한때 \'나쁨\'필리핀서 규모 7.2 지진 발생…쓰나미 발생 가능성 경고좋아요0훈훈해요0슬퍼요0화나요0후속기사 원해요0기사제공 :']"
