,회사명,날짜,언론사,기사제목,링크,본문
0,삼성전자, 2017-03-1121:30,연합뉴스 ,"[주간시황] 코스피, 산적한 악재에도 '2,100선' 재도전",https://finance.naver.com/news/news_read.nhn?article_id=0009100530&office_id=001&mode=search&query=삼성전자&page=1,"['       [주간시황] 코스피, 산적한 악재에도 \'2,100선\' 재도전      기사입력2017-03-11 21:30기사원문좋아요훈훈해요좋아요 평가하기공감좋아요0훈훈해요0슬퍼요0화나요0후속기사 원해요0댓글 (서울=연합뉴스) 박상돈 기자 = 코스피가 이번 주(6∼10일) 미국 금리 인상 우려와 중국의 고고도미사일방어체계(THAAD·사드) 보복 공세, 탄핵 정국에도 외국인 투자자의 \'사자\' 행진에 2,100에 다시 도전했다.     전날 헌법재판소의 박근혜 전 대통령 탄핵심판에서 파면 결정으로 정치 불확실성이 해소되면서 추가 상승 기대감도 커졌다.     11일 한국거래소에 따르면 코스피는 한 주간 18.60포인트(0.89%) 오른 2,097.35에 장을 마쳤다.     첫 거래일인 6일 코스피는 외국인 매수세에 힘입어 2,080선을 회복하면서 시작했다.    재닛 옐런 미국 연방준비제도(Fed·연준) 의장이 3월 기준금리 인상을 시사한 것이 장 초반 부담으로 작용했지만, 외국인의 사자 행진이 지수를 끌어올렸다.    삼성전자는 신작 스마트폰 갤럭시S8에 대한 기대로 200만4천원에 마감하며 사상 최고가를 경신했다.    코스피 상승세는 7일에도 이어졌다.    중국의 사드 보복 공세에도 외국인과 기관이 쌍끌이 매수에 나서 지수는 2,090선으로 올라섰다. 삼성전자는 201만원으로 마감하며 이틀째 최고치 경신 행진을 이어갔다.     외국인의 순매수가 사흘 연속 지속하며 코스피는 8일에도 소폭 상승 마감했다.    외국인이 1천520억원 순매수하며 지수를 홀로 떠받쳤고 장중에는 2,100선을 회복하기도 했다.    그러나 9일 박 전 대통령의 탄핵심판 선고를 하루 앞두고 기관의 강한 매도 탓에 지수는 2,090선 초반으로 밀려났다.    외국인이 나흘째 사자 행진을 이어갔지만, 기관이 6천억원 넘는 물량을 쏟아내 지수를 끌어내렸다.    하지만 정작 헌법재판소의 탄핵심판 결정이 내려진 10일에는 정치 불확실성이 해소됐다는 분석에 코스피는 소폭 올라 2,100선에 근접했다. 외국인은 이날도 주식을 순매수했다. 외국인은 6∼10일 유가증권시장에서 1조1천43억원을 순매수했다.     코스피 대형주 중 주간 상승률 1위 종목은 엔씨소프트(10.05%)였다.     뒤이어 SK텔레콤(7.62%), 삼성바이오로직스(5.88%), 삼성중공업(4.82%), KT(4.71%), LG전자(4.05%), 한국항공우주(3.87%) 등의 순이었다.    코스닥지수는 한 주간 11.53포인트(1.92%) 오른 612.26에 마감했다. 외국인은 코스닥시장에서도 750억원을 순매수했다. ◇ 코스피 대형주 주간(6∼10일) 상승률 10위    kaka@yna.co.kr최신 유행 트렌드 총집결 #흥(클릭!)연합뉴스 관련뉴스해당 언론사에서 선정하며 언론사 페이지(아웃링크)로 이동해 볼 수 있습니다.\xa0BBC \'朴탄핵\' 한국 인터뷰 중 \'아이들 출몰\'…동영상 \'인기\'\xa0문재인, NYT와 인터뷰…""미국에 \'No\' 라 할 수 있어야""\xa0김평우 변호사 또 신문광고 ""충격적 판결…원천 무효""\xa0남친 힘으로 제압하고 표백제 먹인 美20대, 살인혐의 기소\xa0中 초등생 ""롯데 불매"" 선서 조회…""세뇌교육"" 비판좋아요0훈훈해요0슬퍼요0화나요0후속기사 원해요0기사제공 :']"
1,삼성전자, 2017-03-1120:30,연합뉴스 ,"[증권가 주간화제] 외국인, 韓주식 4개월째 사들여",https://finance.naver.com/news/news_read.nhn?article_id=0009100483&office_id=001&mode=search&query=삼성전자&page=1,"['       [증권가 주간화제] 외국인, 韓주식 4개월째 사들여      기사입력2017-03-11 20:30기사원문좋아요훈훈해요좋아요 평가하기공감좋아요0훈훈해요0슬퍼요0화나요0후속기사 원해요0댓글 지난주 4억5천만달러…9개 신흥국 중 최대(서울=연합뉴스) 박상돈 기자 = 탄핵 정국과 주한미군의 고고도미사일방어체계(THAAD·사드) 배치를 겨냥한 중국의 보복 공세와 미국 금리 인상 우려에도 외국인투자자들은 작년 12월 이후 4개월째 한국 주식을 사들인 것으로 확인됐다.     특히 지난주 한국 증시에서의 외국인 순매수 규모는 인도, 베트남, 브라질 등 주요 신흥국 9개국 가운데 규모가 가장 컸다.    이번 주에도 외국인은 한국 증시에서 \'사자\' 행진을 이어갔다.     11일 유안타증권과 국제금융센터에 따르면 지난주 한국 증시에서 외국인의 순매수 규모는 4억5천120만달러에 달했다.    이는 다른 신흥국에 비해 월등히 컸다.     같은 기간 외국인 순매수 규모는 인도 1억2천230만달러, 베트남 1천270만달러, 인도네시아 910만달러 등이었다. 외국인의 한국 증시 순매수 금액이 인도 등 순매수 3개국을 모두 합한 1억4천410만달러보다 3억1천달러 가량 많았다.     반면에 대만에서는 외국인이 가장 많은 1억7천270만달러 순매도했다. 이어 태국(1억5천220만달러), 필리핀(4천910만달러), 브라질(3천550만달러), 파키스탄(2천880만달러) 등에서도 순매도했다.    지난주 국내에서는 중국의 사드 보복 조치와 미국 연방준비제도(Fed·연준)의 3월 금리 인상 가능성으로 원/달러 환율이 상승했지만, 외국인의 한국 증시 선호 현상은 멈추지 않았다.    외국인의 대규모 순매수는 한국 주가 상승률이 저조한 상황에서도 진행됐다.    지난주 한국의 증시는 0.73% 하락해 대만(-1.05%)을 제외하면 주요 신흥국 중 하락률이 높았다. 파키스탄 주가는 1.26% 올라 상승률이 가장 높았다.     원/달러 환율은 미국 연준의 3월 금리 인상이 기정사실로 되면서 지난달 24일 1,131.5원에서 이달 3일 1,156.1원으로 2.2% 올랐다.    이처럼 각종 대내외 불안요인이 상존하지만, 한국 증시가 외국인에게 매력적인 것은 우선 기초여건이 탄탄하다는 점을 인정받고 있기 때문으로 보인다.    지난달 국제 신용평가기관인 무디스가 국회의 대통령 탄핵안 가결과 북한의 미사일 발사 사태에도 한국의 신용등급을 \'Aa2\' 현행 등급으로 유지했다.    삼성전자와 SK하이닉스 등 기업들의 실적이 꾸준히 좋은 모습을 보이는 것도 한국 증시의 매력을 키우는 요소로 꼽힌다.    외국인은 이번 주에도 사진 행진을 이어가 유가증권시장에서 6~10일 1조1천43억원을 순매수했고 코스닥시장에서도 750억원을 순매수했다. 외국인은 대통령 탄핵 결정이 내려진 10일에도 유가증권시장에서 주식을 사들였다.      올해 들어 전날까지 유가증권시장에서 외국인의 누적 순매수 규모는 3조7천55억원에 달했다. 코스닥시장은 781억원으로 집계됐다.     민병규 유안타증권 연구원은 ""한국은 이익과 가치평가 측면에서 신흥국 중 가장 매력적인 증시 중 하나""라며 ""외국인은 여전히 이것에 반응하고 있다""고 진단했다.    kaka@yna.co.kr최신 유행 트렌드 총집결 #흥(클릭!)연합뉴스 관련뉴스해당 언론사에서 선정하며 언론사 페이지(아웃링크)로 이동해 볼 수 있습니다.\xa0BBC \'朴탄핵\' 한국 인터뷰 중 \'아이들 출몰\'…동영상 \'인기\'\xa0문재인, NYT와 인터뷰…""미국에 \'No\' 라 할 수 있어야""\xa0김평우 변호사 또 신문광고 ""충격적 판결…원천 무효""\xa0남친 힘으로 제압하고 표백제 먹인 美20대, 살인혐의 기소\xa0中 초등생 ""롯데 불매"" 선서 조회…""세뇌교육"" 비판좋아요0훈훈해요0슬퍼요0화나요0후속기사 원해요0기사제공 :']"
2,삼성전자, 2017-03-1120:02,연합뉴스TV ,하만 인수 끝낸 삼성…총수 부재에도 사업 '착착',https://finance.naver.com/news/news_read.nhn?article_id=0000246403&office_id=422&mode=search&query=삼성전자&page=1,"['       하만 인수 끝낸 삼성…총수 부재에도 사업 \'착착\'      기사입력2017-03-11 20:02기사원문좋아요훈훈해요좋아요 평가하기공감좋아요0훈훈해요0슬퍼요0화나요0후속기사 원해요0댓글 하만 인수 끝낸 삼성…총수 부재에도 사업 \'착착\' [앵커]삼성그룹의 핵심 삼성전자가 초유의 총수 부재상황에서도 회사의 미래를 바꿀 사업들을 속속 진행하고 있습니다. 세계 최대 전장업체 하만 인수를 마무리해 스마트카 산업 진입에 고삐를 죄는 동시에 미국 가전 공장 건립에도 속도를 낼 태세입니다. 정주희 기자입니다.[기자] 삼성전자가 미국 등 10개국의 반독점 심사 승인을 받아내면서 9조원의 빅딜, 하만 인수를 마무리했습니다.반도체와 가전 외 미래 먹거리를 찾던 삼성전자로서는 미래차 산업 선두주자로 발돋움할 수 있는 주춧돌을 마련한 셈입니다. ""하만의 전장사업 노하우와 삼성의 IT모바일기술, 그리고 부품사업 역량이 결합되면 미래 커넥티드카 분야의 새 플랫폼을…""삼성전자는 스마트폰 \'갤럭시\'시리즈와 가전을 중심으로 한 B2C사업 뿐만 아니라 하만 인수로 상대적으로 경기를 덜 타는 기업고객들을 대상으로 한 사업역량을 확보하게 됐습니다. ""저희는 솔직히 B2B 시장은 많이 못하고 있습니다. 이런 좋은 솔루션(하만)을 가지고 있으면 새로운 시장을 가질 수 있다는 것…""삼성은 또 트럼프 미 행정부의 보호무역주의 노골화에 대처하기 위해 현지에 새 가전제품 공장 부지를 물색하고 있습니다.미국시장을 겨냥해 중국, 베트남, 멕시코공장에서 생산하던 제품을 바로 미국에서 만들게 되면 운영 전략도 달라질 수밖에 없습니다.회사의 얼굴 격인 전략 신제품 출시도 이어집니다.최근 신형 세탁기 제품을 선보인데 이어, 이달 중 스마트폰 사업의 명운이 걸린 갤럭시S8을 내놓고 무너진 자존심 회복에 나설 계획입니다. 연합뉴스TV 정주희입니다.연합뉴스TV : 02-398-4441(기사문의) 4409(제보), 카톡/라인 jebo23 ▶ 연합뉴스TV 생방송 시청하기 ▶ 대한민국 뉴스의 시작, 연합뉴스TV 앱 다운받기연합뉴스TV 관련뉴스해당 언론사에서 선정하며 언론사 페이지(아웃링크)로 이동해 볼 수 있습니다.\xa0말레이 ""사망자 김정남 맞다""…얼굴 점 21개로 확인?\xa0북한 사상최대 핵실험 준비정황…""5차보다 14배 폭발력""\xa0추방된 북한 리정철, 영사와 수상한 대화 공개\xa0서석구 작성 추정 글 논란…""태극기 전투 시작""\xa0장시호 ""최순실, 대통령 파면 소식에 대성통곡""좋아요0훈훈해요0슬퍼요0화나요0후속기사 원해요0기사제공 :']"
3,삼성전자, 2017-03-1118:00,연합뉴스 ,"삼성전자, 美기업 '하만' 인수 완료…""새로운 가치 제공""(종합)",https://finance.naver.com/news/news_read.nhn?article_id=0009100261&office_id=001&mode=search&query=삼성전자&page=1,"['       삼성전자, 美기업 \'하만\' 인수 완료…""새로운 가치 제공""(종합)      기사입력2017-03-11 18:00기사원문좋아요훈훈해요좋아요 평가하기공감좋아요0훈훈해요0슬퍼요0화나요0후속기사 원해요0댓글삼성전자, 하만 인수 완료…단숨에 글로벌 전장업체로 (CG)[연합뉴스TV 제공](서울=연합뉴스) 정성호 기자 = 삼성전자가 미국의 자동차 전장(전자장비) 업체 하만(Harman)을 결국 품에 안았다.    삼성전자는 11일(현지시간 10일) 미국을 비롯한 10개 반독점 심사 대상국의 승인 등 인수에 필요한 모든 절차를 마치고 하만을 인수했다고 밝혔다.    지난해 11월 14일 하만과 인수 계약을 체결한 지 약 4개월 만이다. 지난달 18일에는 하만이 주주총회를 열어 승인을 받아냈다.    이에 따라 삼성전자는 총수인 이재용 부회장의 구속이라는 비상상황 속에서도 9조 원대 \'빅 딜\'을 안정적으로 성사시켰다.    하만의 인수대금은 총 80억 달러(9조2천억원)로, 국내 기업의 해외 인수합병(M&A) 사례로는 최대 금액이다.     이로써 삼성전자는 미래 성장동력으로 지목해 진출을 추진해온 전장 사업 분야에서 확고한 사업 기반을 마련하며 단숨에 글로벌 메이저 전장업체로 이름을 올리게 됐다.    인수 완료에 따라 하만의 주주들은 보유주식 1주당 112달러의 현금을 받는다. 삼성전자는 미국법인(SEA)을 통해 하만의 지분을 100% 보유하게 된다.    다만 하만의 경영은 디네쉬 팔리월(Paliwal) 하만 사장(CEO)을 비롯한 현재의 경영진에 의해 독립적으로 이뤄진다.    또 임직원과 본사, 해외사업장은 물론 하만이 보유한 브랜드도 그대로 유지된다.    손영권 삼성전자 전략혁신센터(SSIC) 사장 겸 하만 이사회 의장은 ""삼성전자와 하만은 오디오, 가전, 스마트폰 등 다양한 분야에서 기술과 경험을 공유함으로써 고객들에게 혁신적이고 독창적인 제품과 차별화된 경험을 제공하고, 커넥티드카 분야의 기술 혁신을 선도해 완성차 업체에 최고의 파트너가 될 것""이라고 말했다.    하만의 디네쉬 팔리월(Paliwal) CEO(사장)는 ""삼성은 하만이 보유한 고객과의 신뢰관계는 물론 스피드와 혁신을 중시하는 문화를 공유할 수 있는 가장 이상적인 주주이자 파트너""라고 말했다.    그는 또 ""이번 인수합병을 통해 주주, 고객, 임직원 모두에게 새로운 가치와 기회를 제공하고, 자동차 전장과 오디오 등의 분야에서 성장을 가속화해 글로벌 리더십을 강화할 것""이라고 강조했다.    하만은 1956년 오디오 기업으로 출발해 1995년 독일의 베커 사가 인수하면서 전장부품 사업에 본격적으로 진출했다.    2015년 매출은 69억1천 달러, 영업이익은 6억8천 달러에 이르며 매출의 65%는 전장사업에서 얻고 있다.     전장사업의 연평균 성장률은 9%에 이른다. 2025년에는 1천29억 달러로 스마트카 전장 시장의 55%를 차지할 것으로 점쳐진다.     삼성전자 전장사업팀은 삼성이 보유한 혁신적 기술들을 하만의 전장 제품에 접목하고, 구매, 물류, 마케팅 등 여러 분야에서 시너지를 낼 수 있도록 하만과 협력을 확대해 나갈 방침이다.    sisyphe@yna.co.kr최신 유행 트렌드 총집결 #흥(클릭!)연합뉴스 관련뉴스해당 언론사에서 선정하며 언론사 페이지(아웃링크)로 이동해 볼 수 있습니다.\xa0BBC \'朴탄핵\' 한국 인터뷰 중 \'아이들 출몰\'…동영상 \'인기\'\xa0문재인, NYT와 인터뷰…""미국에 \'No\' 라 할 수 있어야""\xa0김평우 변호사 또 신문광고 ""충격적 판결…원천 무효""\xa0남친 힘으로 제압하고 표백제 먹인 美20대, 살인혐의 기소\xa0中 초등생 ""롯데 불매"" 선서 조회…""세뇌교육"" 비판좋아요0훈훈해요0슬퍼요0화나요0후속기사 원해요0기사제공 :']"
4,삼성전자, 2017-03-1116:03,전자신문 ,[취업스토리]<201>제일기획 현직자가 밝히는 취업 노하우,https://finance.naver.com/news/news_read.nhn?article_id=0002591321&office_id=030&mode=search&query=삼성전자&page=1,"[""       [취업스토리]<201>제일기획 현직자가 밝히는 취업 노하우      기사입력2017-03-11 16:03기사원문좋아요훈훈해요좋아요 평가하기공감좋아요0훈훈해요0슬퍼요0화나요0후속기사 원해요0댓글제일기획에서 광고기획을 담당하는 황명연씨 인터뷰 모습작년 제일기획에 입사한 황명연씨를 만나 취업 노하우를 들어봤다. 황씨는 현재 삼성전자 글로벌 마케팅 광고기획(AE)을 맡고 있다.-광고 기획에 관심을 가진 동기나 배경이 있나.▲대학 전공이 광고홍보학과였고, 공연과 미디어 쪽에 관심이 많았다. 즉각적으로 소비자 반응을 볼 수 있고, 재미있는 일을 찾다 광고 기획에 발을 들여놓게 됐다.-제일기획에 입사한 이유는 무엇인가.▲국내 시장보다 글로벌 시장에서 일해보고 싶었다. 글로벌 시장에 많이 나가고, 배움과 기회가 많은 곳이 제일기획이라고 생각했다. 기반이 탄탄하고 따를 만한 선배도 많이 있다.-광고 기획자(AE)란 어떤 사람인가.▲관리 감독(Overseeing)을 하는 관리자(Management)다. 캠페인을 하면서 영상 하나를 찍더라도 영상에 필요한 전반적 콘셉트를 잡고, 클라이언트에게 이 콘셉트를 설득시켜서 진행해야 한다. 진행을 하면서 제작팀, 촬영감독 등 많은 조직이 유기적으로 잘 돌아갈 수 있도록 관리한다. 또 클라이언트와 어떻게 진행되는지 커뮤니케이션을 계속한다. 정리하면 `큰 숲을 보는 사람`이다.-기획자로서 갖춰야 할 역량은.▲큰 그림을 볼 수 있는 부분과 세심한 곳을 볼 수 있는 능력을 동시에 가져야 한다. 전체 숲을 볼 때 큰 그림만 보면 세세한 부분을 놓치는 때가 있다. 큰 숲을 보면서 옳은 방향으로 가는지 항상 세심하게 관찰해야 한다. 작은 점을 놓치면 결국 마지막에 잘못된 점이 발생한다. 여러 사람을 만나다 보니 그들과 커뮤니케이션 하는 것도 중요하다.-일을 하면서 어려웠던 점과 극복 방법은.▲입사하자마자 10개국에서 진행하는 캠페인에 참여했다. 신입이라 업무가 어떻게 돌아가는지 뭘 해야 되는지 감도 안 잡힌 상태에서 바로 현장에 투입되니 혼란스러웠다. 부족한 역량을 메우기 위해 시간을 들여가며 배웠다. 모르는 부분이 있으면 바로 선배에게 물어봤다. 궁금한 것을 그냥 넘어가버리면 나중에 큰 일이 벌어질 수 있다. 모른다고 부끄럽고 혼내거나 하지 않으니 그 자리에서 궁금증을 해결하는 것이 중요하다.-입사하기 전 어떤 활동을 하면서 능력을 키웠나.▲`인액터스(Enactus)`라는 비영리조직(NGO) 활동과 해외봉사조직인 `IICD`라는 곳을 통해 브라질에서 봉사활동을 했다. 광고홍보학과에 다녀서 그런지 광고 쪽에만 치우쳐서 생각하는 경향이 있다는 것을 깨달았다. 여러 사람을 만나고 새로운 가치와 다양한 경험을 얻기 위해 활동했다. 외국에 나가 경험을 쌓고 싶었지만 남들과 같은 절차를 밟기보다 새로운 측면에서 도전하고 싶었다. 나만의 스토리를 만들어보자는 생각으로 해외로 나갔다. 그 곳에서 많은 사람과 만나며 커뮤니케이션 능력도 쌓았다. 제가 만든 프로젝트를 스스로 실행해가는 과정에서 결단력을 얻을 수 있었다.-마케팅과 광고 서적을 읽으면 좋은가.▲마케팅이나 광고 서적을 많이 읽지는 않았다. 대신 디지털과 미디어에 관련된 책을 많이 읽었다. 앞으로 할 일에 관련된 책도 많이 읽었다. 모든 책들이 그렇듯 읽지 않는 것보다 읽는 것이 좋다. 자신이 하고자하는 일에 관련이 있는 책이면 더 좋다. 나중에 면접 때 효자 노릇을 할 것이다.-제일기획에 지원할 때 팁이 있다면.▲인턴은 양날의 검이다. 하지 말라는 뜻은 아니다. 인턴을 하는 목적과 자신이 하고 싶은 일이 일관성이 있어야 한다. 무작정 인턴만하면 많은 스펙을 가진 것처럼 보이지만 실무자 입장에서는 일관성과 실속이 없는 것처럼 보인다.두 번째, 서류전형은 자신이 지금까지 해왔던 일들로 스토리를 만들어 내는 것이다. 거짓으로 쓰거나 자신을 과도하게 포장하지 않아야 한다. NGO에서 6개월간 있으면서 여러 가지 경험을 했고, 그 때 배웠던 점을 어필해서 서류전형에 합격했다.세 번째, `대한민국 광고회사 취업 패스워드`라는 책에서 취업 관련 실용 정보를 많이 얻고 준비하는 것도 좋다. 한 번 읽어보는 것을 권한다.마지막으로 자신이 하고자 하는 일에 확신을 가지고 면접을 봐라. 면접장에서 떨지 않고 대화하듯이 자신의 이야기를 하면 좋은 결과를 얻을 수 있다. 저도 첫 번째 지원했을 때는 떨어지고, 두 번째 붙었다. 나중에 왜 떨어지고 붙었는지 생각해봤다. 자기가 하고 싶은 일에 대한 확신이 있고 없고의 차이 때문이다. 두 번째 면접을 볼 때 제가 하고 싶은 일이란 확신을 가지고 면접관들과 대화하듯이 면접을 봤다.▶ 전자신문 인기 포스트▶ 전자신문 공식 페이스북▶ 전자신문 바로가기 [Copyright ⓒ 전자신문 & 전자신문인터넷, 무단전재 및 재배포 금지]전자신문 관련뉴스해당 언론사에서 선정하며 언론사 페이지(아웃링크)로 이동해 볼 수 있습니다.[朴대통령 파면]이젠, 조기 대선이다···5월 9일 유력접었다 펴는 '폴더블 스마트폰' 시대 성큼... 난제 기술 '플렉시블 하드코팅' 국산화첨단운전자보조시스템(ADAS) 장착 택시회사 車 유지비 절반 줄었다[사이언스 인 미디어]물 없는 바다… '틱장애'에 대하여[과학 핫이슈]'땀으로 혈당을 측정한다' 피부부착 신형 당뇨패치 개발좋아요0훈훈해요0슬퍼요0화나요0후속기사 원해요0기사제공 :""]"
