,회사명,날짜,언론사,기사제목,링크,본문
0,삼성전자, 2017-09-2821:37,이데일리 ,국감 증인채택 선방한 금융권…인터넷뱅크 핫이슈,https://finance.naver.com/news/news_read.nhn?article_id=0003935017&office_id=018&mode=search&query=삼성전자&page=1,"['       국감 증인채택 선방한 금융권…인터넷뱅크 핫이슈      기사입력2017-09-28 21:37기사원문좋아요훈훈해요좋아요 평가하기공감좋아요0훈훈해요0슬퍼요0화나요0후속기사 원해요0댓글- 다음달 중순 금융위 등 국감서 증인·참고인 잠정 합의- 예상보다 적은 증인신청에 금융권 안도[이데일리 권소현 기자] 함영주 KEB하나은행장, 심성훈 케이뱅크 행장, 윤호영 카카오뱅크 대표, 방영민 삼성생명 부사장, 하영구 은행연합회장 등이 다음 달 열리는 국회 국정감사에 증인으로 출석할 것으로 보인다. 국정농단 주역인 최순실씨의 인사청탁 진위에서부터 인터넷전문은행 인가·운영 문제점, 은산분리 규제 완화 필요성, 유배당보험 계약자 이익배분 등이 금융권 핫이슈가 될 전망이다. 28일 금융권에 따르면 국회 정무위원회는 다음 달 16일 진행되는 금융위원회, 금융감독원, 산업은행 등에 대한 국감 증인과 참고인 명단에 잠정 합의했다. 아직 최종 확정되지는 않았지만, 합의안대로 총 21명의 증인과 참고인이 출석을 요청받을 가능성이 높다. 시중은행장 중에서는 함영주 KEB하나은행장이 유일하게 명단에 포함됐다. 최순실씨의 독일 금고지기로 알려진 이상화 전 KEB하나은행 프랑크푸르트 법인장을 본부장으로 승진시킨 과정과 배경을 묻기 위해 더불어민주당 이학영 의원이 증인으로 신청했다. 당초 정의당 심상정 의원실에서 최고위층의 증인출석을 강하게 밀어붙였지만 하나은행에서 이뤄진 인사인 만큼 함 행장만 부르는 선에서 합의를 본 것으로 알려졌다. 인터넷전문은행 대표가 모두 출석을 요구받은 점도 주목할만 하다. 심성훈 케이뱅크 행장은 심장정 의원과 제윤경 의원, 김한표 의원이 동시에 신청했다. 인터넷전문은행 인가를 받을때 특혜가 있었는지와 운영 현황에 대해 질문이 집중될 것으로 보인다. 케이뱅크 예비인가 심사 당시 최대주주인 우리은행의 재무건전성이 요건을 충족하지 못했는데도 금융위가 은행법에서 관련 조항을 삭제하면서 인가를 내준 것은 특혜라는 주장이 제기된 상태다. 특히 제윤경 의원은 KT가 케이뱅크를 사실상 지배하는 대주주인지 판단할 수 있도록 주주계약서를 공개하라고 요구하고 있다. 김한표 의원은 윤호영 카카오뱅크 대표까지 증인신청을 했다. 인터넷전문은행의 현안인 은산분리 완화와 운영관련 문제에 대해 전반적인 의견을 듣기 위해서다. 인터넷전문은행의 보안문제나 건전성, 깡통계좌 문제 등에 대한 질문도 나올 수 있다.이밖에 하영구 은행연합회 회장은 정태옥 의원의 요청으로 국감에 출석하게 될 전망이다. 증권사의 법인지급결제에 대해 반대한다는 목소리를 높여온 만큼 이 사안에 대한 은행권 입장을 들어보겠다는 것이다. 보험업계에서는 방영민 삼성생명 부사장이 명단에 포함됐다. 유배당보험 계약자 이익배분과 암보험이 이슈다. 방 부사장을 증인으로 요청한 박용진 의원은 삼성생명이 삼성전자를 처분하지 않아 이익배분을 받지 못했던 삼성생명의 유배당보험계약자에게 매각차익 중 일부를 되돌려주도록 하는 자본시장법 개정안을 발의해 놓은 상태다. 김승유 한국투자금융지주 고문은 KTB경영권 분쟁과 관련해, 이동걸 전 산업은행 회장은 GM대우에 대한 대출거절과 관련해 증인요청을 받았다. 한편 이번 국감 증인 및 참고인 잠정 합의 명단이 나오자 금융권은 다소 안도하는 분위기다. 증인과 참고인 명단이 예상보다 크게 줄었기 때문이다. 당초 야당을 중심으로 은행은 물론이고 저축은행과 생보사, 손보사 대표들이 대거 증인채택 후보로 거론됐다. 일부 의원은 수십명의 증인신청을 추진했던 것으로 알려졌다. 하지만 국감때마다 기업 대표를 무더기로 부르는 것은 갑질이 될 수 있다는 자성의 목소리가 나오면서 증인신청을 최소화한 것으로 보인다. 정세균 국회의장이 지난 6일 상임위원장단에 과도한 증인 채택을 자제해달라고 요청한 데 이어 초선인 최운열 더불어민주당 의원 역시 “누가 봐도 납득할 만한 사람으로 증인 채택을 최소화해야 한다”고 지적한 바 있다.권소현 (juddie@edaily.co.kr)▶사진으로 보는 핫이슈▶[페이스북] 보러가기~♥ | [카카오톡] 플친 맺기~♥＜ⓒ종합 경제정보 미디어 이데일리 - 무단전재 & 재배포 금지＞이데일리 관련뉴스해당 언론사에서 선정하며 언론사 페이지(아웃링크)로 이동해 볼 수 있습니다.[가보지 않은 길, 美연준 자산축소] ①재앙인가 기우인가""강남 랜드마크는 나야 나""…호텔 뺨치는 재건축 \'럭셔리 경쟁\'철원 총기 사고 \'도비탄\' 미스터리..X-ray 탄두 모양 멀쩡[기자수첩] \'반포 혈전\'이 남긴 건설업계 숙제\'총수 부재\' 삼성電 AI 전략..\'자체 역량 강화\' 무게좋아요0훈훈해요0슬퍼요0화나요0후속기사 원해요0기사제공 :']"
1,삼성전자, 2017-09-2821:37,파이낸셜뉴스 ,"삼성 QLED TV, 美서 'No.1' 소비자 시청환경 뛰어나",https://finance.naver.com/news/news_read.nhn?article_id=0003882374&office_id=014&mode=search&query=삼성전자&page=1,"['       삼성 QLED TV, 美서 \'No.1\' 소비자 시청환경 뛰어나      기사입력2017-09-28 21:37기사원문좋아요훈훈해요좋아요 평가하기공감좋아요0훈훈해요0슬퍼요0화나요0후속기사 원해요0댓글국내 기업들의 \'글로벌 브랜드 파워\' 승승장구     삼성전자 퀀텀닷발광다이오드(QLED) TV가 미국에서 소비자 시청 환경이 가장 뛰어난 TV로 평가받았다.지난 27일(현지시간) 디스플레이 전문가 그룹인 디스플레이메이트는 홈페이지에 \'실제 일반 시청 환경에서 최고의 화질을 구현하는 삼성 65형 Q9 QLED TV\'라는 제목의 제품 테스트 결과를 게재했다.디스플레이메이트는 ""대다수의 소비자들이 실험실 환경처럼 어두운 장소에서 TV를 시청하지 않는다""며 거실처럼 주변 환경의 밝기가 높을 때에도 빛에 의해 TV 화면의 색상이나 화질이 영향을 받지 않아야 한다는 것에 초점을 두었다.디스플레이메이트는 이 실험 결과를 토대로 ""삼성 QLED TV(65형 Q9모델)가 실제 소비자 시청 환경에서 액정표시장치(LCD), 유기발광다이오드(OLED) 등을 포함해 지금까지 테스트한 TV 중 가장 높은 성능을 보였다""고 밝혔다.삼성 QLED TV가 높은 평가를 받은 주 원인은 다른 제품과 비교해 월등히 높은 화면 밝기를 갖고 있어 주변의 빛에 의해 화면이 흐려지지 않으며 화면 빛 반사율도 현저히 낮아 빛 반사로 인한 화면의 왜곡이나 변형이 거의 없다고 설명했다.km@fnnews.com 김경민 기자     ▶ 세상의 모든 골 때리는 이야기 \'fn파스\'▶ 속보이는 연예뉴스 fn스타  ※ 저작권자 ⓒ  파이낸셜뉴스. 무단 전재-재배포 금지파이낸셜뉴스 관련뉴스해당 언론사에서 선정하며 언론사 페이지(아웃링크)로 이동해 볼 수 있습니다.관사서 아내 불륜 목격한 남편, 참지 못하고 내연남에게..남성 2명과 모텔 갔다가 딱걸린 여자친구.. 최후의 선택흰머리 많은 남성이 조심해야 하는 질환남편 살해한 아내, 다음날 새벽 내연남과 공터에서..교통 법규위반하다 BMW와 접촉사고낸 SM5..뜻밖의 반전좋아요0훈훈해요0슬퍼요0화나요0후속기사 원해요0기사제공 :']"
2,삼성전자, 2017-09-2821:37,디지털타임스 ,"삼성전자 - SKT, 세계 첫 4G·5G 연동 시연",https://finance.naver.com/news/news_read.nhn?article_id=0002425206&office_id=029&mode=search&query=삼성전자&page=1,"['       삼성전자 - SKT, 세계 첫 4G·5G 연동 시연      기사입력2017-09-28 21:37기사원문좋아요훈훈해요좋아요 평가하기공감좋아요0훈훈해요0슬퍼요0화나요0후속기사 원해요0댓글주행중에 끊김없이 통신 서비스이종통신·주파수대역 연동 확인[디지털타임스 김지영 기자]삼성전자와 SK텔레콤이 5G 시대에 한 발 다가설 수 있는 핵심 기술을 확보했다.삼성전자와 SK텔레콤은 세계 최초로 기존 4세대(4G) LTE 이동통신과 현재 개발 중인 5세대(5G) 이동통신 연동 시연에 성공했다고 28일 밝혔다.양사는 최근 서울 을지로에 서로 다른 주파수 대역을 지원하는 4G, 5G 기지국과 차세대 가상화 코어 네트워크를 구축하고, 4G와 5G를 동시에 지원하는 통합 단말기를 차량에 설치해 연동 시연에 성공했다. 차량 주행 중에도 기지국과 단말기 사이에 끊김 없이 통신 서비스가 이뤄졌다는 것이 양사의 설명이다. 이번 시험에 사용한 주파수 대역은 4G는 2.6㎓대, 5G는 28㎓대와 3.5㎓대다. 양사는 주행 중인 차량과 SK텔레콤 본사 회의실 사이에서 360도 가상현실 라이브 스트리밍을 시연했고, 실제 차량에서 4G와 5G 통신기술과 주파수 대역이 변경돼도 선명하고 깨끗한 스트리밍이 가능하다는 점을 확인했다. 이를 통해 5G 기술 상용화에 필수적인 이종 통신기술과 주파수 대역 사이의 연동이 실제 네트워크에 적용 가능함을 확인했다는 게 양사의 설명이다.4G와 5G 사이에 이종 기술간 연동이 가능해지면 5G 네트워크의 전국 구축이 완료되지 않은 상황에서도 사용자들은 4G와 5G 네트워크를 오가며 고속의 데이터 통신 서비스를 이용할 수 있다.또 다양한 5G 주파수 대역 간의 연동이 가능해지면, 주파수 도달 거리가 짧은 밀리미터파 대역(30∼300㎓ 주파수 대역)과 넓은 도달 거리로 네트워크 구축에 유리한 6㎓ 이하 대역을 5G 기술에 동시에 활용할 수 있다. 밀리미터파 대역은 초당 수십Gb의 대량 데이터 전송이 필요한 증강현실(AR)이나 가상현실(VR), 홀로그램 등에 활용하고, 6㎓ 이하 대역은 커넥티드 카, 차량통신(V2X) 등에 활용할 수 있다.박진효 SK텔레콤 네트워크기술원장은 ""전국망이 이미 확보된 4G와 새로 도입될 5G를 연동해 어디에서나 끊김 없는 최고의 통신 서비스를 제공하겠다""며 5G 상용화 기술 개발에 매진하겠다고 밝혔다.삼성전자 네트워크사업부 박동수 부사장은 ""새로운 이동통신 서비스와 현재 이동통신 서비스의 연동은 서비스 연속성과 신규 통신 서비스 출현에 필수적""이라며 ""SK텔레콤과 진행한 이번 시연의 성공으로 5G 이동통신 도입에 더욱 가속도가 붙을 것""이라고 말했다. 김지영기자 kjy@                                                                                                                                                                                                                                                                                                                                                                                                                                                                                                                                                                                                                                                                                                                                                                                                                               디지털타임스 홈페이지 바로가기/SNS 바로가기확바뀐 디지털타임스 연예·스포츠 섹션 바로가기김지영디지털타임스 관련뉴스해당 언론사에서 선정하며 언론사 페이지(아웃링크)로 이동해 볼 수 있습니다.""진짜 LCC가 온다?""… 한국 노리는 \'중국 저가항공 주의보\'깡통TV가 순식간에 \'스마트TV\'로… 월 3300원 비밀이제는 \'우주산업화\' 시대… 위성영상으로 주목받는 산업은?중환자 간병까지 척척… 인간과 교감 AI로봇 \'페퍼\' 내달 상륙신산업 국내기업 자유무역지역 임대료 감면좋아요0훈훈해요0슬퍼요0화나요0후속기사 원해요0기사제공 :']"
3,삼성전자, 2017-09-2821:36,부산일보 ,삼성 SKT 4G 5G 이동통신 세계 최초 연동 성공,https://finance.naver.com/news/news_read.nhn?article_id=0000742982&office_id=082&mode=search&query=삼성전자&page=1,"['       삼성 SKT 4G 5G 이동통신 세계 최초 연동 성공      기사입력2017-09-28 21:36기사원문좋아요훈훈해요좋아요 평가하기공감좋아요0훈훈해요0슬퍼요0화나요0후속기사 원해요0댓글       삼성전자와 SK텔레콤은 기존의 4세대(4G) LTE 이동통신과 개발중인 5세대(5G) 이동통신 연동 시연에 세계 최초로 성공했다고 28일 밝혔다.양사는 최근 서울 을지로에 서로 다른 주파수 대역을 지원하는 4G, 5G 기지국과 차세대 가상화 코어 네트워크를 구축하고, 4G와 5G를 동시에 지원하는 통합 단말기를 차량에 설치해 연동 시연을 해냈다.차량 주행 중에도 기지국과 단말기 사이에 끊김 없이 통신 서비스가 이뤄졌다는 것이 양사의 설명이다. 사용된 주파수 대역은 4G는 2.6㎓대, 5G는 28㎓대와 3.5㎓대였다.양사는 주행 중인 차량과 SK텔레콤 본사 회의실 사이에서 360도 가상현실 라이브 스트리밍을 시연했으며, 실제 차량에서 4G와 5G 통신기술과 주파수 대역이 변경돼도 선명하고 깨끗한 스트리밍이 가능함을 확인했다.이를 통해 5G 기술 상용화에 필수적인 이종 통신기술과 주파수 대역 사이의 연동이 실제 네트워크에 적용 가능함을 확인했다는 게 양사의 설명이다.4G와 5G 사이에 이종 기술간 연동이 가능해지면 5G 네트워크의 전국 구축이 완료되지 않은 상황에서도 사용자들은 4G와 5G 네트워크를 오가며 고속의 데이터 통신 서비스를 이용할 수 있다.또 다양한 5G 주파수 대역 간의 연동이 가능해지면, 주파수 도달 거리가 짧은 밀리미터파 대역(30∼300㎓ 주파수 대역)과 넓은 도달 거리로 네트워크 구축에 유리한 6㎓ 이하 대역을 5G 기술에 동시에 활용할 수 있다.예를 들어 밀리미터파 대역은 초당 수십 기가비트의 대량 데이터 전송이 필요한 증강현실(AR)이나 가상현실(VR), 홀로그램 등에 활용하고, 6㎓ 이하 대역은 커넥티드 카, 차량통신(V2X) 등에 활용이 가능하다.SK텔레콤 박진효 네트워크 기술원장은 ""전국망이 이미 확보된 4G와 새로 도입될 5G를 연동해 어디에서나 끊김 없는 최고의 통신 서비스를 제공하겠다""며 5G 상용화 기술 개발에 매진하겠다고 밝혔다.삼성전자 네트워크사업부 박동수 부사장은 ""새로운 이동통신 서비스와 현재 이동통신 서비스의 연동은 서비스 연속성과 신규 통신 서비스 출현에 필수적""이라며 ""SK텔레콤과 진행한 이번 시연의 성공으로 5G 이동통신 도입에 더욱 가속도가 붙을 것""이라고 전망했다. 배동진 기자 djbae@좋아요0훈훈해요0슬퍼요0화나요0후속기사 원해요0기사제공 :']"
4,삼성전자, 2017-09-2821:36,부산일보 ,"삼성전자,올 하반기 미래기술육성사업 지원과제 선정",https://finance.naver.com/news/news_read.nhn?article_id=0000742978&office_id=082&mode=search&query=삼성전자&page=1,"[""       삼성전자,올 하반기 미래기술육성사업 지원과제 선정      기사입력2017-09-28 21:36기사원문좋아요훈훈해요좋아요 평가하기공감좋아요0훈훈해요0슬퍼요0화나요0후속기사 원해요0댓글       삼성전자는 '미래기술육성사업'의 2017년 하반기 지원과제로 37개를 선정, 총 531억 원의 연구비를 지원키로 했다고 28일 밝혔다.미래기술육성사업은 삼성전자가 연구비를 출연해 지원하는 연구사업으로 기초과학과 소재기술, ICT(정보통신기술) 등 3개 분야에서 매년 세 차례 지원과제를 선정한다. 이번에 기초과학 분야에서는 '비선형 쌍곡 방정식의 특이점 및 장기적 행태 연구'(오성진 고등과학원 교수) 등 14개 과제가 선정됐다.또 소재기술 분야에서는 '초저전력 자성체를 이용한 테라헤르츠 발진 및 검출 소자 관련 연구'(이경진 고려대 교수) 등 8개, ICT 분야에서는 '머신 러닝을 이용한 감성적 음악 연주 생성 시스템 개발'(남주한 KAIST 교수·박종화 서울대 음대 교수) 등 15개가 선정됐다.삼성전자는 37개 연구과제에 총 531억 원의 연구비를 지원한다.특히 ICT와 음악을 융합해 딥 러닝 알고리즘을 바탕으로 전문가 수준의 음악 연주 시스템을 개발하는 과제, ICT와 의학을 접목해 의료 빅데이터를 기반으로 슈퍼 박테리아의 발생 기전을 연구하는 과제(양은호 KAIST 교수·김광준 연세대 세브란스병원 교수) 등 기존의 틀을 깨는 새로운 융합 연구과제가 선정됐다고 삼성전자는 밝혔다.삼성전자는 2013년 8월 이 프로그램을 시작하면서 10년간 1조 5000억 원을 지원하겠다고 밝혔다. 지금까지 367개 과제를 선정해 이 가운데 4646억 원의 연구비를 지원했다.삼성전자는 수행 과제 중 해외 핵심특허를 확보하거나 세계 최고 수준의 논문이 될 만한 과제, 산업계의 큰 반향이 기대되는 과제는 별도로 심사해 후속지원도 하고 있다. 올해 3분기 후속지원 과제로는 2014년 지원 과제로 선정됐던 '마찰전기 활용 고출력 발전기 및 응용 재료 개발'(백정민 UNIST 교수) 등 4개가 선정됐다.삼성전자는 연중 수시로 자유공모 과제를 접수한 뒤 석학과 전문가로 구성된 심사위원회를 통해 매년 상·하반기 '자유공모 지원 과제'를, 연 1회 '지정테마 지원 과제'를 선정한다.한편 내년 상반기 지원과제는 오는 12월 15일까지 소재기술과 ICT 분야는 삼성전자 미래기술육성센터 홈페이지(www.samsungftf.com)를 통해, 기초과학 분야는 삼성미래기술육성재단(www.samsungstf.or.kr)을 통해 접수할 수 있다. 선정 결과는 내년 4월 5일에 발표될 예정이다.\xa0배동진 기자 djbae@좋아요0훈훈해요0슬퍼요0화나요0후속기사 원해요0기사제공 :""]"
5,삼성전자, 2017-09-2820:27,한국경제 ,삼성디스플레이와 꿀조합…쇳가루·불꽃 튀던 태경연주가 달라졌다,https://finance.naver.com/news/news_read.nhn?article_id=0003830358&office_id=015&mode=search&query=삼성전자&page=1,"['       삼성디스플레이와 꿀조합…쇳가루·불꽃 튀던 태경연주가 달라졌다      기사입력2017-09-28 20:27기사원문좋아요훈훈해요좋아요 평가하기공감좋아요0훈훈해요0슬퍼요0화나요0후속기사 원해요0댓글대기업-중소기업 상생의 현장 (2) 설비투자 지원국내 유일 주물 연속주조기업밀도 일정한 연주봉 제작으로…반도체 등 클린룸에 \'최적화\'해외주문 늘자 삼성에 SOS전문가 파견해 3개월간 컨설팅…증설 없이 연간 영업익 만큼 아껴작업환경 개선 위해 비용 지원도[ 노경목 기자  ] 태경연주는 세계에서도 손꼽히는 연속주조 기술을 보유한 업체다. 주물을 동그란 봉 형태로 뽑아내 연주봉을 제작하면 엘오티베큠 등 진공펌프 제조사들이 펌프에 들어가는 핵심 부품(왼쪽)으로 가공한다.  /태경연주 제공인천 경인주물단지에 있는 태경연주는 연매출 108억원의 작은 기업이지만 국내 유일의 주물 연속주조 기술을 보유한 업체다. 연속주조는 제철소에서처럼 주물을 원형이나 사각형으로 길게 뽑아내는 것으로, 철강과 달리 뚝뚝 끊어지는 성질을 지닌 주물로는 좀처럼 구현하기 힘든 기술이다. 남다른 기술력이 해외에서도 인정받았지만 설비투자 확대가 급선무였다. 결국 2차 협력회사로서 관계를 맺고 있던 삼성디스플레이에 도움을 요청했고 이는 기대를 뛰어넘는 결과로 이어졌다.투자비 어떻게 아꼈나태경연주가 제작한 연주봉은 엘오티베큠과 에드워드펌프 등 삼성 1차 협력사들에 공급돼 진공펌프의 핵심 부품으로 가공된다. 반도체와 디스플레이 생산을 위해서는 공기를 뽑아내 클린룸을 유지하는 것이 필수적이다. 여기에 진공펌프 역할이 중요하다. 보통 주물업체들이 거푸집에 넣어 식혀 만든 연주봉은 내부 밀도가 일정하지 않아 진공펌프용으로 적합하지 않다. 해외에서 연주봉을 수입해 쓰던 에드워드펌프 등은 2011년 태경연주의 기술력을 인정해 연주봉을 공급받기로 했다. 삼성과 한 다리 건너 2차 협력사가 된 것이다.해외에 제품을 홍보하는 영어 홈페이지를 개설해 호주와 쿠웨이트 등 해외에서도 주문이 잇따르자 태경연주는 설비 증설을 추진하기 위해 삼성디스플레이에 컨설팅을 요청했다. 전문가를 파견해 2·3차 협력사 생산 혁신을 도와주는 삼성의 ‘산업혁신 컨설팅’ 프로그램에 지원한 것이다. 삼성디스플레이는 지난해 8월 삼성전자에서 20년간 휴대폰 생산관리 전문가로 일한 손상호 전문위원을 파견했다.세계적인 기술력을 갖추고 있지만 직원 32명에 불과한 태경연주로서는 어느 정도 투자를 늘려야 최적의 효율을 낼지 가늠하기가 어려웠다. 생산현장을 살펴본 손 위원은 다른 부문의 증설 필요성을 인정하면서도 생산된 연주봉을 고객사가 요구하는 굵기로 가공하는 절삭 공정을 꼼꼼히 들여다봤다. 직원들의 생산활동과 휴식 시간, 기계에 걸리는 부담, 설비 및 정비시간을 살펴본 뒤 설비를 늘리지 않고도 생산성을 1.8배 끌어올릴 수 있다는 결론을 내놨다. 태경연주는 이를 바탕으로 연간 영업이익에 맞먹는 15억원을 아낄 수 있었다. 손 위원은 “태경연주 측의 적극적인 개선 의지가 있었기 때문에 컨설팅이 빛을 봤다”며 “지난 4년간 산업혁신 전문위원으로 활동하며 가장 보람있는 사례”라고 말했다.“내년부터 고속성장 시작”작업환경도 획기적으로 개선됐다. 과거 근로자는 연주봉의 뜨거운 열기 때문에 절삭 작업에 큰 애로를 겪었다. 전기톱을 댈 때마다 튀는 불꽃과 쇳가루도 괴로움을 줬다. 손 위원은 타 컨설턴트들과 해결 방법을 고민해 다른 산업현장에서 비슷한 작업에 이용되는 기계를 태경연주의 여건에 맞게 개조하도록 했다. 이를 통해 근로자는 연주봉과 충분한 거리를 유지하며 쇳가루와 불꽃도 피할 수 있었다. 기계 도입비용 1400만원 중 900만원은 삼성디스플레이가 지원했다.또 내년 상반기 마칠 예정인 생산설비 증설(절삭공정 제외)에는 삼성디스플레이의 상생협력펀드가 나선다. 주문량이 계속 늘어나는 상황인 만큼 증설이 성공적으로 완료되면 수년째 100억원 안팎에 머물러 있는 태경연주의 매출과 영업이익도 크게 늘어날 것으로 예상된다. 지난해 이 회사의 영업이익률은 18.5%였다.한혁수 태경연주 경영전략담당 상무는 “가장 절실하던 시점에 삼성 도움을 받아 고속성장의 발판을 마련할 수 있게 됐다”며 “삼성디스플레이의 물대지원 펀드를 통해 납품대금도 현금으로 받게 됐다”고 말했다.노경목 기자 autonomy@hankyung.com[한경닷컴 바로가기] [글방] [모바일한경 구독신청] ⓒ 한국경제 & hankyung.com, 무단전재 및 재배포 금지한국경제 관련뉴스해당 언론사에서 선정하며 언론사 페이지(아웃링크)로 이동해 볼 수 있습니다.LG전자 연구원들과 2년 \'사투\'… 플라스틱에 디자인 입힌 이코리아산업삼성, 하반기 채용 오늘 마감""서울대 교수 강연료 30만원인데 개그맨은 무려…""日 ""불가능"" 난색…LG 연구원과 2년 사투 벌인 회사백화점, 추석 파격 세일 …""최대 80% 할인 판매""좋아요0훈훈해요0슬퍼요0화나요0후속기사 원해요0기사제공 :']"
