,회사명,날짜,언론사,기사제목,링크,본문
9,삼성전자, 2017-11-0116:17,서울경제 ,[서울경제TV ‘해외선물 신세계’] AG시스템 “한 눈에 보는 경제”,https://finance.naver.com/news/news_read.nhn?article_id=0003143341&office_id=011&mode=search&query=삼성전자&page=5,"[""       [서울경제TV ‘해외선물 신세계’] AG시스템 “한 눈에 보는 경제”      기사입력2017-11-01 16:17기사원문좋아요훈훈해요좋아요 평가하기공감좋아요0훈훈해요0슬퍼요0화나요0후속기사 원해요0댓글 [서울경제TV] [서울경제TV ‘해외선물 신세계’] AG시스템 “한 눈에 보는 경제”[AG시스템 기관 데일리 시황] 2017.11.01 시황 [국내시황]코스피, 10월 말일 ‘사상 최고치’ 행진. 장중 역대 최고치 기록(2528.32포인트) 경신. 9월 산업생산?소비?설비투자 3가지 지표, 전년 6월 이후 15개월 만에 사상 첫 동반 상승 삼성전자 최고 경영진 세대교체. 주요 임원들 경영 일선 후퇴. 금주 이번주 사장단 인사?조직개편 아시아미국 연결 태평양 해저 광케이블 건설에 아마존, 페이스북, 소프트뱅크 공룡들 합류 중국과의 긴장 완화 기대감으로 31일, 사드 관련주들(여행?항공주?화장품?면세점주 등) 상승. 사드관련주들 과열 경고. 호텔신라, 전일 대비 1700원(2.22%) 오른 7만8300원에 장 마감. 한달 새 주가 34.5% 급등삼성전자, 내년부터 3년 동안 최대 80조원에 가까운 주주환원 정책 시작. 향후 3년 순익 총 160조 예상.현대중공업에서 분사한 현대중공업, 현대로보틱스, 현대일렉트릭, 현대건설기계 등 4개사, 2분기 연속 영업이익 흑자 기록 [해외시황]뉴욕증시 주요지수, 연준의 통화정책 결정을 앞두고 상승 (다우 0.12% ↑) 연준이 이달 통화정책 회의서 기준금리 동결 예상. 최근 발표되는 기업들 실적 호조세로 지수 상승세연준은 이날부터 이틀간 연방공개시장위원회(FOMC) 정례회의 개최트럼프 대통령, 2일 연준 차기 의장 지명 예상. 통화 긴축에 우호적인 테일러 스탠퍼드대 교수 임명 시 시장 조정 가능성. 3분기 고용비용지수(ECI), 0.7% 상승. WSJ 시장조사치 일치. 전문가들, 고용비용지수의 상승이 연준의 연말 기준금리 인상 뒷받침 가능성 시사. 8월 전미주택가격지수, 전월 대비 0.5, 전년 대비 6.1% 상승.10월 시카고 구매관리자지수(PMI), 전월 65.2 -> 66.2로 상승. 10월 소비자신뢰지수, 전월 120.6에서 오른 125.9 기록 달러인덱스, 유로존의 9월 인플레이션 부진과 3/4분기 고용비용지수와 소비자신뢰지수 호조로 0.01%(94.56) 상승WTI, 배럴당 54.38달러, 0.4% 상승 [세계경제 전반]세계은행 조사, 사업용이성 국가 뉴질랜드 1위, 한국은 4위 차지 < 미국 > * 핵심이슈행정부, 중국 시장경제로 이행속도 둔화 평가 CME 그룹, 비트코인 선물 연내 상장 계획 8월 S&P/케이스 실러 주택가격 지수, 전년동월비 5.9% 상승* 이슈분석 차기 연준 의장 성향, 시장 방향성 예측은 불가 공화당, 금주 내 세제개혁안 공개, 초고소득층 세금 축소에 대한 반발 직면 정부 출산 촉진 정책 국가별 상이. 출산율 촉진 노력 필요 < 유럽 >*핵심이슈3/4분기 유로존 GDP 성장률, 전년동기비 2.5%. 시장예상 상회3/4분기 프랑스 성장률, 전년동기비 2.2% 상승. 2011년 이후 최고치.스페인 카탈루냐 수반, 12월 의회선거 실시 수용 잉글랜드 은행, EU 이탈로 금융계 최대 7만 5천명 실직 예상 * 이슈분석 영국의 통화·재정 정책, 경기부양 고려 필요성. 향후 정책 향방에 우려 목소리. 유로존, 정치 불안 요인에도 경기상승 기대 고조 금일 위험종목 : 오일(원유재고), 통화(영국PMI, ISM PMI)* 본 기사는 전문가의 개인적인 의견이 반영되어 있을 수 있으므로 투자에 유의하시기 바랍니다.[서울경제 바로가기]1997년 이래 대한민국 최고의 과학자 DB [바로가기]서울경제의 모든 연재물!... 서경Cube [바로가기▶]저작권자 ⓒ 서울경제, 무단 전재 및 재배포 금지서울경제 관련뉴스해당 언론사에서 선정하며 언론사 페이지(아웃링크)로 이동해 볼 수 있습니다.'피로물든 할로윈' 뉴욕 트럭테러 용의자 잡고보니수억짜리 집 갖고도 기초연금 타는 노인 8만명김주혁 조문 '차태현' 송송커플 결혼식 참석 후 다시 빈소 지켜, 퉁퉁 부은 눈 안타까움↑송중기, 송혜교와 결혼 직전 '새신랑 미소'..하객 장쯔이와 셀카김주혁 빈소, 데프콘 울먹거리며 찾아 '안타까워'좋아요0훈훈해요0슬퍼요0화나요0후속기사 원해요0기사제공 :""]"
10,삼성전자, 2017-11-0116:17,연합뉴스 ,"코스피 단숨에 33p '점프'…나흘째 사상최고 '2,556.47'(종합)",https://finance.naver.com/news/news_read.nhn?article_id=0009653174&office_id=001&mode=search&query=삼성전자&page=5,"['       코스피 단숨에 33p \'점프\'…나흘째 사상최고 \'2,556.47\'(종합)      기사입력2017-11-01 16:17기사원문좋아요훈훈해요좋아요 평가하기공감좋아요0훈훈해요0슬퍼요0화나요0후속기사 원해요0댓글코스피 \'점프 또 점프\'(서울=연합뉴스) 한종찬 기자 = 코스피가 1일 정보기술(IT) 대형주 랠리와 외국인 매수세에 힘입어 단숨에 2,550선으로 뛰어오르며 나흘째 종가 최고치 경신 행진을 이었다. 이날 코스피는 전날보다 33.04포인트(1.31%) 오른 2,556.47에 거래를 마쳤다. 종가는 물론 장중 기준으로도 최고치 신기록이다. 이날 오후 서울 여의도 한국거래소에서 직원들이 주가를 확인하고 있다.     saba@yna.co.kr외국인 3천억원 \'사자\'…\'주주환원\' 삼성전자 첫 280만원대 진입(서울=연합뉴스) 권수현 기자 = 코스피가 1일 정보기술(IT) 대형주 랠리와 외국인 매수세에 힘입어 단숨에 2,550선으로 뛰어오르며 나흘째 종가 최고치 경신 행진을 이었다.     이날 코스피는 전날보다 33.04포인트(1.31%) 오른 2,556.47에 거래를 마쳤다.     종가는 물론 장중 기준으로도 최고치 신기록이다.     전날 세운 종가 최고치 기록(2,523.43)과 장중 최고치 기록(2,528.32)을 30포인트가량 끌어올렸다.     코스피는 이날까지 나흘 연속 종가 기준 역대 최고치를 다시 쓰고 있다. 지난 26일 하루를 제외하고 지난 20일부터 이날까지 매일 기록을 갈아치웠다.     전날 장중 및 종가 기준 모두 신기록을 내며 2,520대에 안착한 지수는 이날도 전장보다 12.54포인트(0.50%) 상승한 2,535.97로 장을 열었다.     이후 외국인 매수세가 거세지면서 상승 폭을 키워 곧장 2,540선을 넘어 2,550선마저 뚫었고 장 마감 때까지 상승세를 이어갔다.    이날 마감 기준 코스피 상장사 전체 시가총액은 1천664조9천10억원으로 역시 전날 나온 기존 최대치(1천642조2천850억원) 기록을 경신했다.    전날 미국 뉴욕 증시에서 기업 실적 호조와 미국 연방준비제도(연준·Fed)의 기준금리 동결 기대감에 주요 지수가 일제히 상승한 것이 한껏 달아오른 코스피에 훈풍을 더했다.    이영곤 하나금융투자 연구원은 ""실적시즌 랠리와 수출지표 호조, 한중관계 개선 기대감 등 호재 속에 IT 대형주가 크게 상승하면서 코스피가 2,550선을 넘었다""며 ""외국인 매수세가 유입되면서 시총 상위종목들의 상승세가 두드러졌다""고 분석했다.    이날 유가증권시장에서 외국인이 3천72억원어치를 사들이는 등 나흘 연속 \'사자\'에 나서며 상승 동력을 제공했다.     개인과 기관은 각각 2천358억원과 1천117억원어치를 순매도했다. 코스피 \'점프 또 점프\'(서울=연합뉴스) 한종찬 기자 = 코스피가 1일 정보기술(IT) 대형주 랠리와 외국인 매수세에 힘입어 단숨에 2,550선으로 뛰어오르며 나흘째 종가 최고치 경신 행진을 이었다. 이날 코스피는 전날보다 33.04포인트(1.31%) 오른 2,556.47에 거래를 마쳤다. 종가는 물론 장중 기준으로도 최고치 신기록이다. 이날 오후 서울 여의도 한국거래소에서 직원들이 주가를 확인하고 있다.     saba@yna.co.kr    시가총액 1·2위 삼성전자(3.85%)와 SK하이닉스(3.77%)가 나란히 3% 넘게 올랐다.     전날 배당 확대 등 주주환원 정책을 발표한 \'대장주\' 삼성전자는 사상 처음으로 주당 280만원대에 진입했다.    다른 시총 상위주 가운데 삼성바이오로직스(5.73%)와 LG화학(2.73%), 삼성생명(1.85%), KB금융(1.03%), 삼성물산(1.01%) 등도 오름세를 탔다.     반면 NAVER(-3.80%), 한국전력(-1.66%), 현대모비스(-0.56%), POSCO(-0.46%) 등은 내렸다.     업종별로는 정보기술(IT)·반도체 대형주 상승에 힘입어 전기·전자가 3.70% 상승했고 코스피 상승 덕에 증권도 2.40% 올랐다.     의약품(4.16%), 제조(2.16%), 은행(1.27%), 종이·목재(1.13%), 화학(0.96%), 섬유·의복(0.78%), 금융(0.70%)도 강세를 보였다.     이에 비해 전기가스(-1.36%), 음식료품(-1.32%), 운수창고(-1.10%), 서비스(-0.89%), 운송장비(-0.40%) 등은 하락했다.     코스닥 지수도 전장보다 1.57포인트(0.23%) 오른 695.77로 마감해 연중 최고치 행진을 이어갔다.     지수는 전 거래일보다 2.45포인트(0.35%) 오른 696.65로 출발해 강보합세를 유지했다.    코스닥 시총 상위주 중에서 포스코켐텍(4.09%), 신라젠(1.93%), 바이로메드(1.55%), 컴투스(0.52%) 등이 올랐고 코미팜(-1.75%), 로엔(-1.60%), 파라다이스(-1.49%) 등은 떨어졌다.     inishmore@yna.co.kr기사 문의(기사 제목을 꼭 알려주세요) 및 제보는 여기로(클릭!)최신 유행 트렌드 총집결(클릭!)연합뉴스 관련뉴스해당 언론사에서 선정하며 언론사 페이지(아웃링크)로 이동해 볼 수 있습니다.\xa0文대통령 ""오늘은 오셨네요"" 인사에 洪대표 ""국회니까요""\xa0檢 ""이영학은 변태성욕 장애"" 사형·무기징역 구속기소\xa0생리대 광고에 첫 등장한 붉은 색…\'현실적 vs 역겹다\'\xa0낚싯줄 걸려 해변에 쓸려온 아기 돌고래…피서객 반응은?\xa0박보검 반주에 박형식 노래…송중기-송혜교 웨딩피로연좋아요0훈훈해요0슬퍼요0화나요0후속기사 원해요0기사제공 :']"
11,삼성전자, 2017-11-0116:11,머니투데이 ,"삼성전자, 시총 500조원-주가 400만원 시대 열린다",https://finance.naver.com/news/news_read.nhn?article_id=0003957375&office_id=008&mode=search&query=삼성전자&page=5,"['       삼성전자, 시총 500조원-주가 400만원 시대 열린다       기사입력2017-11-01 16:11기사원문좋아요훈훈해요좋아요 평가하기공감좋아요0훈훈해요0슬퍼요0화나요0후속기사 원해요0댓글 [머니투데이 오정은 기자] [다이와, 삼성전자 목표가 350만원→410만원 파격 상향… 글로벌 IB 목표가 줄상향]/사진=삼성반도체이야기파격적인 배당 증액과 메모리 슈퍼사이클을 등에 업은 삼성전자가 \'시가총액 500조원 시대\'를 맞이할 전망이다. 외국계 증권사인 다이와증권은 업계 최초로 400만원대 목표가를 제시하며 시가총액 500조원 시대의 포문을 열었다. 1일 코스피 시장에서 삼성전자는 전일대비 10만7000원(3.89%) 오른 286만1000원에 거래를 마쳤다. 장중 287만5000원의 사상 최고가를 경신하며 장중·장 마감 기준 신고가를 모두 새로 썼다. 종가 기준 시가총액은 371조원을 기록했다. 이날 다이와증권은 삼성전자 목표가를 기존 350만원에서 410만원으로 파격 상향했다. 410만원이면 현재 주식 수 기준 삼성전자 보통주의 시가총액은 531조원에 달하게 된다. 김성규 다이와증권 상무는 ""삼성전자의 강화된 주주환원 정책은 배당에 중점을 두고 변동성을 낮췄다는 점에서 주가에 큰 호재""라며 ""메모리 시장에 대한 낙관적 전망을 바탕으로 목표가 410만원을 제시한다""고 밝혔다.  다이와증권은 삼성전자의 2017년~2019년 주당순이익 추정치를 시장 평균(컨센서스)보다 10~20% 정도 높게 추정했다. 2018년 삼성전자의 영업이익은 67조원에 달할 것으로 예상했다. 같은 날 노무라금융투자도 삼성전자 목표가를 기존 340만원에서 370만원으로 올렸다. 노무라는 삼성전자의 2018년 영업이익이 2017년보다 28% 증가한 71조5000억원에 달할 거란 파격적 수치를 제시했다. 정창원 노무라금융투자 한국법인 리서치센터장은 ""진행 중인 메모리 슈퍼사이클과 OLED(유기발광다이오드) 디스플레이 매출 증대로 2018년도 영업이익이 급증할 것""이라며 ""시장 우려와 달리 대규모 설비 투자에도 메모리 공급이 크게 늘지 않아, 2018년에도 메모리 슈퍼사이클이 계속되겠다""고 전망했다. 지난 2월 \'메모리 슈퍼사이클 고점\' 논쟁을 촉발시키며 SK하이닉스 투자의견을 \'비중축소\'로 꺾었던 UBS조차 이날 삼성전자 목표가를 기존 310만원에서 335만원으로 상향 조정했다. 니콜라 고도와 UBS 애널리스트는 ""이번 주주환원 정책 확대로 배당 규모가 예측 가능해졌고 향후 3년간의 배당 규모도 확정됐다""며 ""삼성전자의 2018년~2020년 3년간 누적 잉여현금흐름(FCF)이 90조원을 기록할 것으로 예상돼 총 45조원 규모 주주환원이 향후 3년에 걸쳐 지급될 것""이라고 분석했다. 국내 증권사 중에는 유안타증권이 380만원으로 가장 높은 목표가를 제시했다. 유안타증권은 380만원의 목표가도 2018년 예상 실적 기준 PER(주가수익비율) 9.9배에 불과하다며 현 주가 대비 추가상승 여력이 충분하다고 판단했다. 이재윤 유안타증권 연구원은 ""2018년 삼성전자의 연간 영업이익은 66조원에 달하며 사상 최대 실적을 경신할 전망""이라며 ""삼성전자 양대 부품사업인 반도체와 디스플레이가 독보적인 기술력을 기반으로 실적 성장이 가시화돼 조만간 시가총액 500조원 시대를 맞이할 것""이라고 예상했다. ▶옆사람이 지금 보는 기사들▶무료만화 즐기고~선물타자! ▶치어리더 vs 레이싱걸 오정은 기자 agentlittle@mt.co.kr머니투데이 관련뉴스해당 언론사에서 선정하며 언론사 페이지(아웃링크)로 이동해 볼 수 있습니다.배우 김주혁 교통사고로 사망, 삼성동 인근 (1보)故김주혁 부검, ""심근경색 아냐…사인, 머리 손상""배우 김주혁 사망, 대낮 서울 강남대로서 왜?샤워할때 어디부터 씻으시나요? 피부 망치는 습관들김주혁 사망 추정 \'심근경색\'…골든타임은 90분좋아요0훈훈해요0슬퍼요0화나요0후속기사 원해요0기사제공 :']"
12,삼성전자, 2017-11-0116:10,아시아경제 ,[파죽지세 코스피]삼성전자·SK하이닉스 나란히 고공행진,https://finance.naver.com/news/news_read.nhn?article_id=0004108732&office_id=277&mode=search&query=삼성전자&page=5,"['       [파죽지세 코스피]삼성전자·SK하이닉스 나란히 고공행진      기사입력2017-11-01 16:10기사원문좋아요훈훈해요좋아요 평가하기공감좋아요0훈훈해요0슬퍼요0화나요0후속기사 원해요0댓글 [아시아경제 박나영 기자]1일 코스피가 2500선 중반으로 점프하며 또 다시 사상 최고치를 경신했다. 삼성전자와 SK하이닉스가 4% 가까운 상승률을 보이며 지수 상승을 이끌었다. 이날 코스피는 전 거래일 대비 33.04포인트(1.31%) 상승한 2556.47에 거래를 마쳤다. 4거래일 연이은 상승세다.  삼성전자는 전 거래일 대비 10만7000원(3.89%) 오른 286만1000원에 거래를 마감했다. 장중 287만5000원까지 오르며 사상 최고가를 새로 썼다. SK하이닉스는 3100원(3.77%) 오른 8만5300원에 거래를 마감했다. 지난달 말 7만원 후반대로 떨어졌었으나 최근 3거래일 7% 이상 급등, 단숨에 8만원대 중반으로 회복했다.  외국인의 집중 매수에 따른 상승세로 풀이된다. 외국인은 이날 삼성전자 1087억, SK하이닉스는 404억원을 각각 순매수한 것으로 잠정 집계됐다. 박나영 기자 bohena@asiae.co.kr▶ 양낙규의 \'군사이야기\'▶ 2017아시아여성리더스포럼 ▶ #아시아경제 페이스북아시아경제 관련뉴스해당 언론사에서 선정하며 언론사 페이지(아웃링크)로 이동해 볼 수 있습니다.""12월에 인류 절반 사망하거나 전체 멸망"" 대예언[단독]여군병사 결국…군 \'들고 일어날 일\' 온다北김정은, 이 와중에 김한솔 암살을…\'딱 걸렸다\'성관계를… 피해 남성만 4000여명 \'발칵\'\'터질게 터졌다\' 北핵실험장 붕괴에…대충격좋아요0훈훈해요0슬퍼요0화나요0후속기사 원해요0기사제공 :']"
13,삼성전자, 2017-11-0116:09,매일경제 ,"코스피, 4거래일 연속 역대 최고치 마감…2556.47",https://finance.naver.com/news/news_read.nhn?article_id=0004040526&office_id=009&mode=search&query=삼성전자&page=5,"['       코스피, 4거래일 연속 역대 최고치 마감…2556.47      기사입력2017-11-01 16:09기사원문좋아요훈훈해요좋아요 평가하기공감좋아요0훈훈해요0슬퍼요0화나요0후속기사 원해요0댓글 코스피가 4거래일 연속 역대 최고치로 마감했다. 지난달 30일 2500선을 돌파한 지수는 상승폭을 키워가고 있다.1일 코스피는 전일 대비 33.04포인트(1.31%) 오른 2556.47에 거래를 마쳤다. 이날 지수는 12.54포인트 오른 2535.97에 출발해 장 초반부터 상승폭을 키웠다. 전날 삼성전자가 주주환원정책, 설비투자계획 등에 대해 발표한 영향으로 전기·전자 업종이 이날도 강세를 보였다. 외국인과 기관은 전기전자 업종을 팔았고 개인은 2482억원 순매수했다. SK하이닉스는 외국인과 기관의 순매수 종목 1위에 올랐다.이경민 대신증권 연구원은 ""3분기 실적 시즌이 정점을 통과하는 가운데 양호한 실적 개선이 확인되고 있다""면서 ""삼성전자의 주주환원정책 강화로 향후 코스피 기업들의 주주환원정책에 대한 기대는 높아질 수 있을 것""이라고 설명했다.업종별로 의약품이 4.16% 올라 가장 큰 상승폭을 보였고 전기전자가 3.70%로 뒤를 이었다. 증권과 제조업은 2% 이상, 비금속광물과 은행, 종이목재는 1% 이상 상승했다. 전기가스업과 운수창고는 1% 이상 내렸고 서비스업도 빠졌다.매매주체별로 외국인이 3060억원 순매수했고 기관과 개인이 각각 1115억원과 2346억원 순매도했다. 외국인은 4거래인 연속 샀고 기관은 같은 기간 팔았다. 개인은 2거래일 연속 순매도했다. 프로그램 매매는 551억원 매도 우위다.시가총액 상위 종목 중에서는 삼성SDI가 8.98% 올랐고 삼성바이오로직스가 5.73% 강세로 마감했다. 삼성전자와 SK하이닉스는 각각 3.89%와 3.77% 상승했다. LG화학 SK도 2% 이상 강세를 보였고 LG전자, LG, 삼성물산 등도 1% 이상 오른 채 거래를 마쳤다. 네이버는 3.80%, 아모레퍼시픽은 2.07% 각각 하락했다. 한국전력, LG생활건강, 넷마블게임즈는 1% 이상 약세를 보였다.이날 유가증권시장에서는 3개 상한가를 포함해 452개 종목이 올랐고 355개 종목이 떨어졌다.코스닥은 전일 대비 1.57포인트(0.23%) 오른 695.77에 마감했다.[디지털뉴스국 박진형 기자]▶뉴스 이상의 무궁무진한 프리미엄 읽을거리 ▶아나운서가 직접 읽어주는 오늘의 주요 뉴스[ⓒ 매일경제 & mk.co.kr, 무단전재 및 재배포 금지]매일경제 관련뉴스해당 언론사에서 선정하며 언론사 페이지(아웃링크)로 이동해 볼 수 있습니다.\'원조 섹시스타\' 강문영, 신이 내린 \'美친 볼륨\' 드러내[WS] 39번째 \'끝장 승부\' 이번에는 누가 웃을까송선미 남편 살해범, ""청부 살인 인정""\'15분 초급속 충전\'으로 250㎞ 달리는 전기차\'볼륨 몸매\' 살린 송혜교, \'송송커플 결혼식\' 현장 가니좋아요0훈훈해요0슬퍼요0화나요0후속기사 원해요0기사제공 :']"
14,삼성전자, 2017-11-0116:08,헤럴드경제 ,"[마감시황] 코스피, 상승폭 키우며 2556.47 장 마감…나흘 연속 최고치",https://finance.naver.com/news/news_read.nhn?article_id=0001309850&office_id=016&mode=search&query=삼성전자&page=5,"['       [마감시황] 코스피, 상승폭 키우며 2556.47 장 마감…나흘 연속 최고치      기사입력2017-11-01 16:08기사원문좋아요훈훈해요좋아요 평가하기공감좋아요0훈훈해요0슬퍼요0화나요0후속기사 원해요0댓글 [헤럴드경제=최준선 기자] 코스피가 나흘 연속 종가 기준 최대치를 경신했다. 삼성전자, SK하이닉스 등 시가총액 1~2위 종목 모두 강세를 보이며 지수 상승폭도 커졌다.1일 코스피는 전일보다 33.04포인트(1.31%) 높은 2556.47에 장을 마쳤다.장이 열림과 동시에 2530선을 상회한 지수는 장이 끝나는 순간까지 꾸준히 우상향 곡선을 그렸다. 종가 기준 2500선을 넘어선지 이틀만에 2600 고지를 향한 5부 능선을 넘어선 것이다. 지수 상승폭 역시 30일(5.30포인트), 31일(21.50포인트) 보다 커졌다.[사진=게티이미지]오늘의 지수 상승을 견인한 것은 역시나 3060억원어치 주식을 사들인 외국인이었다.반면 개인과 기관은 각각 2347억원, 1113억원을 순매도했다.업종도 상승 업종이 더 많았다.4.16% 오른 의약품 업종을 비롯해 전기ㆍ전자(3.70%), 증권(2.40%), 제조업(2.16%), 은행(1.27%) 등이 강세를 보였다.전기가스업(-1.36%), 음식료품(-1.32%), 운수창고(-1.10%), 서비스업(-0.89%), 운송장비(-0.40%) 등 업종은 하락 마감했다.시가총액 상위 종목 가운데서는 52주 최고가를 경신한 삼성전자(3.89%), SK하이닉스(3.77%) 등 1~2위 종목이 동반 강세를 나타냈다.LG화학(2.73%), 삼성생명(1.85%)도 52주 신고가를 갈아치우며 지수 상승에 기여했다.이밖에도 삼성물산(1.01%), 삼성바이오로직스(5.73%) 등이 강세를 나타냈다.반면 전 거래일 강세를 나타냈던 현대차(-0.31%)와 네이버(-3.80%), 포스코(-0.46%), 현대모비스(-0.56%) 등은 하락 마감했다.코스닥 지수도 이틀 연속 종가 기준 역대 최고치를 새로 썼다.장 초반 696.93까지 치솟는 등 강세를 보였던 지수는 이후 상승과 하락을 오가며 전일보다 1.57포인트(0.23%) 오른 695.77에 장을 마감했다.기관과 외국인이 각각 273억원, 572억원을 순매도했으나, 개인이 873억원어치 주식을 사들이며 지수 상승을 이끌었다.다만 시가총액 상위 업종 대부분은 약세를 나타냈다.전일 52주 신고가를 새로 쓴 바이로메드(1.55%)와 함께 신라젠(1.93%), 메디톡스(0.35%)등은 강세를 보였으나, 그 외 셀트리온(-0.69%), 셀트리온헬스케어(-0.68%), CJ E&M(-0.83%), 로엔(-1.60%), 코미팜(-1.75%), SK머티리얼즈(-0.75%), 휴젤(-0.35%) 모두 약세를 보이며 장을 마쳤다.이날 서울 외환시장에서 원ㆍ달러 환율은 전날보다 5.9원 내린 1114.5원에 거래를 마쳤다.human@heraldcorp.com▶ 생활용품 알뜰하게 사는 법 럭비(LUCK BE)▶앞서가는 젊은 경제신문 친구맺기 ▶오늘의 운세 날씨 - Copyrights ⓒ 헤럴드경제 & heraldbiz.com, 무단 전재 및 재배포 금지 -헤럴드경제 관련뉴스해당 언론사에서 선정하며 언론사 페이지(아웃링크)로 이동해 볼 수 있습니다.주현미, 문희옥에 대노…""고양이에 생선 맡긴 꼴""신혼여행 직전 김주혁 빈소 방문한 송중기 \'어려운 결정\'헬맷 벗은 구리엘…타석에서 다르빗슈에 사과엄정화 ""우리 주혁이, 안아주고파…너무 눈물이 난다""삼바ㆍ신라젠, 1년만에 거품株→바이오대장株좋아요0훈훈해요0슬퍼요0화나요0후속기사 원해요0기사제공 :']"
