,회사명,날짜,언론사,기사제목,링크,본문
13,삼성전자, 2017-08-0414:48,아시아경제 ,하반기 분양시장 블루칩 평택.. 새아파트 인기 '상승',https://finance.naver.com/news/news_read.nhn?article_id=0004048906&office_id=277&mode=search&query=삼성전자&page=3,"['       하반기 분양시장 블루칩 평택.. 새아파트 인기 \'상승\'      기사입력2017-08-04 14:48기사원문좋아요훈훈해요좋아요 평가하기공감좋아요0훈훈해요0슬퍼요0화나요0후속기사 원해요0댓글-삼성반도체 공장,삼성브레인시티 개발 등 대형호재로 부동산 시장 들썩-올해 상반기 아파트 거래량 지난해 比 41% 급등..역대 최고점 기록-실수요 및 투자수요 몰리며 힐스테이트 평택 등 관심도 꾸준히 증가힐스테이트 평택 3차 투시도주택시장의 조용한 강자 평택시가 최근 수도권 분양시장에서 핫플레이스로 자리잡고 있다. 평택시는 아시아 최대규모 삼성반도체 공장 가동, SRT 개통에 따른 서울 접근성 향상 외에도 미 육군 해외 기지 중 최대규모의 주한미군 이전, 삼성브레인시티 개발 등 대형호재가 풍부하다. 상황이 이렇다보니 실수요자는 물론 외부 투자수요들까지 유입되며 부동산 시장이 들썩이고 있는 모습이다.실제로 평택시는 지난 2010년부터 집값이 무섭게 뛰고 있다. 부동산정보업체 부동산114 자료를 살펴보면 평택시의 현재(7월) 3.3㎡당 평균 아파트값은 711만원으로 지난 2010년 7월(535만원) 보다 약 33% 상승했다. 같은 기간 경기도 평균인 약 10%(950만→1037만원)의 3배를 웃도는 수치다. 올해 들어 아파트 거래도 급등세를 타고 있다. 올해 평택시의 상반기 아파트 거래량은 9783건으로 분기별 거래건수로는 2000년 조사 이래 최고치를 기록하고 있다. 지난해 상반기(6945건) 거래량과 비교해도 약 41% 가량 수직 상승했다. 세교동의 D공인중개업자 관계자는 “최근 삼성반도체 공장이 본격 가동한데다 지난해 SRT 개통으로 서울 출퇴근까지 편리해지면서 평택 부동산 시장이 살아나고 있다”면서 “특히 삼성반도체 공장을 중심으로 출퇴근이 편리한 세교지구로의 새 아파트 문의 건수가 눈에 띄게 늘고 있다”고 말했다. 특히 관심을 끄는 대목은 외부지역에서 평택에 집을 사는 사례도 크게 증가했다는 점이다. 한국감정원에 따르면 2012년 6월~2017년 6월까지 최근 5년간 평택시 외부지역에서 평택 내 아파트를 구입한 건수는 총 1만2609건으로 이전 5년간(2007년 5월~2012년 5월)간 구입한 7177건보다 대폭 상승했다. 단순한 실수요자뿐만 아니라 투자수요들의 유입도 늘고 있는 것이다. 이 때문에 실제로 최근 평택시의 분양 성적은 호조를 기록하고 있다. 실제로 올해 고덕국제신도시 내 택지지구에서 올해 3월 분양했던 ‘고덕국제신도시제일풍경채센트럴(A17블록)’은 평균 84.09대 1, ‘평택고덕파라곤(A8블록)은 49.39대 1, ’고덕신도시자연&자이(A9블록)‘는 28.77대 1의 청약경쟁률을 기록했다.최근 입주를 앞둔 단지의 경우 분양권에 웃돈도 적지 않다. 실제로 국토교통부 실거래가 자료에 따르면 평택 소사벌지구 B7블록에 위치한 ‘평택소사벌지구반도유보라아이파크’ 전용84㎡B 주택형의 경우 분양가(기준층 기준 2억7970만원) 대비 2000만원 가량 오른 3억290만원(12층)에 실거래 됐다. 비전동의 H공인중개사 실장은 “최근 평택시에 대한 관심이 높아지면서 서울 및 수도권 분들은 물론 부산, 울산 등 지방에서도 임대를 목적으로 투자를 하시겠다는 분들이 찾아오기도 한다”며 “이러한 호재들은 앞으로 6~7년 이상 평택 부동산 시장에 영향을 끼칠 것으로 예상된다”고 덧붙였다.대형 호재와 맞물려 기 분양 단지들의 소진 속도도 빨라지고 있는 모습이다. 현대건설이 경기도 평택시 세교지구 일대에서 분양 중인 ‘힐스테이트 평택’은 삼성 반도체 공장으로의 접근성이 좋아 직주근접 수요가 몰리고 있는 상황이다. 실제로 힐스테이트 평택은 인근으로는 평택 도심을 가로지르고 수원을 거쳐 서울까지 이어지는 1번 국도와 45번 국도가 인근에 있어 도로 교통망이 편리하다. 특히 고덕산업단지와 1번 국도를 연결하는 기반시설인 고덕산단 진입도로 사업도 2018년 완공 예정에 있어 삼성전자 반도체 공장 관련 종사자들의 출퇴근도 더욱 편리해질 것으로 기대를 모으고 있다. 고덕산단 진입도로는 총 2.79km의 왕복 4차선으로 계획되어 있으며, 삼성전자 진입로와 바로 연결될 예정이다. 수도권으로의 접근성도 편리하다. 이 단지 인근에 위치한 SRT 지제역을 이용하면 서울 수서역까지 20분 정도면 이동이 가능해 서울 강남권을 비롯해 동탄과 판교, 분당 등 수도권 교통 편의성도 높다.힐스테이트 평택 분양관계자는 “최근 고덕산업단지 내 삼성 반도체 공장이 본격 가동하면서 출퇴근하려는 관련 업계 종사자들의 문의가 꾸준히 증가하고 있는 상황”이라며 “1차에서 3차로 이어지는 총 2807가구 규모의 힐스테이트 브랜드 타운이라는 프리미엄에다 SRT 지제역 수혜단지로서의 수도권 교통 편의성 증대로 미래가치도 높다”고 말했다. 힐스테이트 평택 모델하우스는 현장인근인 경기도 평택시 세교동 14-4번지 일원에 위치해 있다. 이용수 기자 mark@asiae.co.kr▶ 뉴스가 재밌다! 세상의 모든 재미 [티잼]▶ #아시아경제, #오늘의 많이 본 뉴스(클릭!)아시아경제 관련뉴스해당 언론사에서 선정하며 언론사 페이지(아웃링크)로 이동해 볼 수 있습니다.""국정원 사태 난리났다"" 이명박 결국 검찰에…""김기덕, 여배우에게 성기 잡도록 강요…영상 있다"" 충격문대통령 휴가중인데…""북한과 전쟁"" 긴급 선언안철수 부인 김미경, 서울 노원병 재보궐 선거에…""나이 들어 자주하면…"" 충격적 섹스 연구결과좋아요0훈훈해요0슬퍼요0화나요0후속기사 원해요0기사제공 :']"
14,삼성전자, 2017-08-0414:42,헤럴드경제 ,"[생생코스닥]에스티아이, 삼성전자와 440.7억 규모 공급계약 체결",https://finance.naver.com/news/news_read.nhn?article_id=0001273591&office_id=016&mode=search&query=삼성전자&page=3,"['       [생생코스닥]에스티아이, 삼성전자와 440.7억 규모 공급계약 체결      기사입력2017-08-04 14:42기사원문좋아요훈훈해요좋아요 평가하기공감좋아요0훈훈해요0슬퍼요0화나요0후속기사 원해요0댓글 [헤럴드경제=증권팀] 에스티아이는 삼성전자와 반도체 제조장비 공급계약을 체결했다고 4일 공시했다.계약금액은 440억7379만원이며 이는 2016년 매출액 대비 24.4%에 해당하는 규모이다.계약기간은 오는 12월 15일까지다.park@heraldcorp.com▶영감이란 불꽃에 타오르게할 스토리(INSPIRE)▶앞서가는 젊은 경제신문 친구맺기 ▶오늘의 운세 날씨 - Copyrights ⓒ 헤럴드경제 & heraldbiz.com, 무단 전재 및 재배포 금지 -헤럴드경제 관련뉴스해당 언론사에서 선정하며 언론사 페이지(아웃링크)로 이동해 볼 수 있습니다.유시민 ""갓뚜기 아닌데…靑 초청 개운찮아"" 뒤끝\'용가리 과자\' 파문 확산…이번엔 질소 포비아?박찬주 妻 갑질, 한민구는 알았다…사전 경고\'믿을맨\' 日 마구같은 싱커…태풍 노루 큐슈로 급선회유시민 ""조윤선 부끄러운 줄""…박형준도 ""정치적 유죄""좋아요0훈훈해요0슬퍼요0화나요0후속기사 원해요0기사제공 :']"
15,삼성전자, 2017-08-0414:36,아시아경제 ,"에스티아이, 삼성전자와 440억 규모 반도체장비 공급 계약",https://finance.naver.com/news/news_read.nhn?article_id=0004048893&office_id=277&mode=search&query=삼성전자&page=3,"['       에스티아이, 삼성전자와 440억 규모 반도체장비 공급 계약      기사입력2017-08-04 14:36기사원문좋아요훈훈해요좋아요 평가하기공감좋아요0훈훈해요0슬퍼요0화나요0후속기사 원해요0댓글 [아시아경제 임혜선 기자]에스티아이는 삼성전자와 440억원 규모의 반도체 제조장비공급 계약을 체결했다고 4일 공시했다. 이는 지난해 매출액의 24.4%에 해당하는 규모다. 임혜선 기자 lhsro@asiae.co.kr▶ 뉴스가 재밌다! 세상의 모든 재미 [티잼]▶ #아시아경제, #오늘의 많이 본 뉴스(클릭!)아시아경제 관련뉴스해당 언론사에서 선정하며 언론사 페이지(아웃링크)로 이동해 볼 수 있습니다.""국정원 사태 난리났다"" 이명박 결국 검찰에…""김기덕, 여배우에게 성기 잡도록 강요…영상 있다"" 충격문대통령 휴가중인데…""북한과 전쟁"" 긴급 선언안철수 부인 김미경, 서울 노원병 재보궐 선거에…""나이 들어 자주하면…"" 충격적 섹스 연구결과좋아요0훈훈해요0슬퍼요0화나요0후속기사 원해요0기사제공 :']"
16,삼성전자, 2017-08-0414:29,연합뉴스 ,"에스티아이, 441억원 반도체 제조장비 공급계약",https://finance.naver.com/news/news_read.nhn?article_id=0009454714&office_id=001&mode=search&query=삼성전자&page=3,"[""       에스티아이, 441억원 반도체 제조장비 공급계약      기사입력2017-08-04 14:29기사원문좋아요훈훈해요좋아요 평가하기공감좋아요0훈훈해요0슬퍼요0화나요0후속기사 원해요0댓글 (서울=연합뉴스) 임은진 기자 = 에스티아이는 삼성전자와 441억원 규모의 반도체 제조장비 공급계약을 맺었다고 4일 공시했다.    작년 연결기준 매출액의 24.4%에 해당한다.    계약 기간은 12월 15일까지다.    engine@yna.co.kr최신 유행 트렌드 총집결(클릭!)연합뉴스 관련뉴스해당 언론사에서 선정하며 언론사 페이지(아웃링크)로 이동해 볼 수 있습니다.\xa050일 근무 연봉 6천600만원…20여년 '꿀보직' 운전사\xa0여신도 폭행·살해하고 암매장 사이비 교주 구속\xa0백악관서 열흘 일하고 짤렸는데 세금 85억 내야할 판\xa0심상찮은 대전 조폭 움직임…잇단 세력·이권 다툼\xa0경찰서 주차장 잘못 들어가 음주사고 낸 '황당 초보'좋아요0훈훈해요0슬퍼요0화나요0후속기사 원해요0기사제공 :""]"
17,삼성전자, 2017-08-0414:28,머니투데이 ,"에스티아이, 441억원 규모 반도체장비 공급계약",https://finance.naver.com/news/news_read.nhn?article_id=0003915016&office_id=008&mode=search&query=삼성전자&page=3,"['       에스티아이, 441억원 규모 반도체장비 공급계약      기사입력2017-08-04 14:28기사원문좋아요훈훈해요좋아요 평가하기공감좋아요0훈훈해요0슬퍼요0화나요0후속기사 원해요0댓글 [머니투데이 오정은 기자] 에스티아이는 4일 삼성전자에 441억원 규모 반도체 제조장비 공급계약을 체결했다고 공시했다. 지난해 매출액 대비 24.4%에 해당하는 규모다. [▶깊이있는 투자정보 \'TOM칼럼\'][▶트렌드 리더의 스타일 지침서 \'스타일M\'][▶빵빵한 차&레이싱걸]오정은 기자 agentlittle@mt.co.kr머니투데이 관련뉴스해당 언론사에서 선정하며 언론사 페이지(아웃링크)로 이동해 볼 수 있습니다.40억원 빚 안 갚으려…""30대처럼 성형해달라""송일준 MBC PD협회장 ""신동호·배현진, \'배신 남매\'라 불려""이 10개 뺀 文대통령 따라…비서실장도 \'임플란트\'""공관병이 자살까지 시도""…박찬주 甲질 추가폭로이재용 ""여자분에게 싫은 소리 들은 건 처음..너무 당황""좋아요0훈훈해요0슬퍼요0화나요0후속기사 원해요0기사제공 :']"
18,삼성전자, 2017-08-0414:10,파이낸셜뉴스 ,[fn 오후시황] 코스피 강보합…2390선,https://finance.naver.com/news/news_read.nhn?article_id=0003854376&office_id=014&mode=search&query=삼성전자&page=3,"[""       [fn 오후시황] 코스피 강보합…2390선      기사입력2017-08-04 14:10기사원문좋아요훈훈해요좋아요 평가하기공감좋아요0훈훈해요0슬퍼요0화나요0후속기사 원해요0댓글  코스피지수가 2390선에서 강보합세를 보이고 있다.  4일 오후 2시 1분 현재 코스피지수는 전거래일보다 5.44포인트 오른 2392.29를 기록하고 있다. 이날 전거래일과 비교해 2.89포인트 오른 2389.74로 출발한 코스피지수는 장중 한때 2400.33을 보이며 2400선을 돌파하기도 했으나 오후 들어 줄곧 2390선에 머물고 있다.  기관이 사들이고 있지만 개인과 외국인의 동반 매도로 인해 코스피지수의 상승폭이 제한적인 것으로 풀이된다. 기관은 1002억원 순매수 중이다. 개인과 외국인은 각각 497억원, 859억원 팔아치우고 있다.  코스피 시가총액 상위 종목은 오름세다. 삼성전자(0.29%), SK하이닉스(0.76%), 현대차(0.67%), POSCO(0.61%), 한국전력(0.34%), 삼성물산(1.09%), NAVER(0.26%), 신한지주(0.75%), 삼성생명(0.40%)이 오르고 있다.  코스피의 대형주와 중형주는 상승 중이지만 소형주는 내림세다. 업종별로는 혼조세를 보이는 가운데 운수창고(2.41%), 철강·금속(1.25%), 건설업(1.24%), 화학(1.20%)의 상승세가 두드러진다. 통신업(-1.96%)과 의료정밀(-1.54%)은 하락 중이다.   ethica@fnnews.com 남건우 기자   ▶ 세상의 모든 골 때리는 이야기 'fn파스'▶ 속보이는 연예뉴스 fn스타  ※ 저작권자 ⓒ  파이낸셜뉴스. 무단 전재-재배포 금지파이낸셜뉴스 관련뉴스해당 언론사에서 선정하며 언론사 페이지(아웃링크)로 이동해 볼 수 있습니다.화장실 성폭행 위기 벗어난 21세女의 번뜩이는 한마디모기 물려 가려울 때 30초 만에 해결법딸 셋 태운 38세 엄마, 의문의 19초 역주행.. 끝내 참변30세여성에게 왁싱받은 남성, 시술 끝나자 돌변'모텔 감금' 탈출해 경찰서 온 22세女에 1만원 주며 한 막말좋아요0훈훈해요0슬퍼요0화나요0후속기사 원해요0기사제공 :""]"
19,삼성전자, 2017-08-0413:59,파이낸셜뉴스 ,"심텍, 성수기 진입 단계..주식 사모을 시기-교보증권",https://finance.naver.com/news/news_read.nhn?article_id=0003854366&office_id=014&mode=search&query=삼성전자&page=3,"['       심텍, 성수기 진입 단계..주식 사모을 시기-교보증권      기사입력2017-08-04 13:59기사원문좋아요훈훈해요좋아요 평가하기공감좋아요0훈훈해요0슬퍼요0화나요0후속기사 원해요0댓글  교보증권은 4일 심텍에 대해 실적과 주가 면에서 성수기에 진입하는 단계라고 판단했다.  김갑호 연구원은 ""심텍의 실적은 하반기 영업이익이 연간 영업이익의 70%를 차지하는 상저하고의 전형적인 계절성을 나타내고 있다""며 ""당연히 주가도 하반기 및 차년도 연초에 강세를 보이고 있다""며 이같이 분석했다.  2·4분기 심텍의 연결기준 매출액 1994억원(+6.8%YoY), 영업이익 79억원(+31.7%YoY, opm4.0%)을 기록했다.  김 연구원은 ""3·4분기 매출액은 2120억원(+6.3%YoY), 영업이익 132억원(+15.0%YoY, opm6.2%)으로 전망된다""며 ""연간 매출액 8,256억원(+4.2%YoY), 영업이익 460억원(+14.4%YoY, opm5.6%)을 달성할 것""으로 내다봤다.  특히 현재 진행중인 삼성전자의 평택, 시안공장 낸드 캐파증설의 직간접적인 수혜를 입을 것이라는 점도 긍정적이다.  심텍의 낸드용 MCP매출액이 모바일D램용 MCP 매출액을 넘어서는 등 낸드제품 수요가 급증하고 있다.  김 연구원은 ""심텍은 삼성전자, 도시바, 하이닉스 등 메이저 낸드 생산회사가 모두 고객""이라며 ""향후 폴더블 스마트폰에 필수적으로 탑재될 것으로 예상되는 것이 SLP(Substrate-Like PCB)이며 심텍은 FCCSP 양산경험을 통해 기술적으로 한발 앞서가고 있어 향후 폴더블 스마트폰 출시가 강한 주가 모멘텀이 될 수 있을 것""으로 전망했다. kjw@fnnews.com 강재웅 기자   ▶ 세상의 모든 골 때리는 이야기 \'fn파스\'▶ 속보이는 연예뉴스 fn스타  ※ 저작권자 ⓒ  파이낸셜뉴스. 무단 전재-재배포 금지파이낸셜뉴스 관련뉴스해당 언론사에서 선정하며 언론사 페이지(아웃링크)로 이동해 볼 수 있습니다.화장실 성폭행 위기 벗어난 21세女의 번뜩이는 한마디모기 물려 가려울 때 30초 만에 해결법딸 셋 태운 38세 엄마, 의문의 19초 역주행.. 끝내 참변30세여성에게 왁싱받은 남성, 시술 끝나자 돌변\'모텔 감금\' 탈출해 경찰서 온 22세女에 1만원 주며 한 막말좋아요0훈훈해요0슬퍼요0화나요0후속기사 원해요0기사제공 :']"
0,삼성전자, 2017-08-0413:46,한국경제 ,"코스피, 기관 '사자' 힘입어 상승 지속…LG전자 4%↑",https://finance.naver.com/news/news_read.nhn?article_id=0003805715&office_id=015&mode=search&query=삼성전자&page=4,"[""       코스피, 기관 '사자' 힘입어 상승 지속…LG전자 4%↑      기사입력2017-08-04 13:46기사원문좋아요훈훈해요좋아요 평가하기공감좋아요0훈훈해요0슬퍼요0화나요0후속기사 원해요0댓글코스피지수가 기관 매수세에 힘입어 오후장 상승 기조를 이어가고 있다. 4일 오후 1시28분 현재 코스피지수는 전날보다 3.97포인트(0.17%) 오른 2390.82를 기록 중이다. 전날 미국 뉴욕 증시에서 다우존스 30 산업평균지수가 7거래일 연속 사상 최고치를 경신한 가운데 코스피는 이날 소폭 상승 출발했다. 이후 2400선을 회복하기도 했으나 외국인이 매도세로 돌아서면서 하락 전환했고, 등락을 거듭했다. 현재는 '사자'로 돌아선 기관이 지수를 방어하며 소폭 상승세를 이어가고 있는 중이다.유가증권시장에서 외국인과 개인은 각각 620억원, 491억원어치 주식을 순매도 중이다. 기관은 현재 780억원어치 주식을 사들이고 있다. 프로그램 매매를 통해 매수세가 유입되고 있다. 차익 거래(216억원 순매수), 비차익 거래(106억원 순매수)를 합해 총 322억원 매수 우위로 집계됐다. 업종별로는 운수창고가 2% 넘게 뛰고 있다. 건설업, 철강금속, 화학, 유통업은 1%대 상승 중이다. 운송장비, 섬유의복도 소폭 오르고 있다. 반면 통신업, 보험, 의료정밀 등은 하락하고 있다. 시총 상위 종목 중 현대차와 포스코, 한국전력, 삼성물산, 네이버, 신한지주 등이 상승세다. 삼성전자, SK하이닉스, 삼성생명 등은 약세를 보이고 있다.LG전자가 4%대 상승세다. 기관과 외국인이 동반 순매수하며 주가를 끌어올렸다. LG전자가 이날 제품을 개발하고 생산하는 단계에서부터 인체에 유해한 살균물질을 가려낼 수 있는 공인시험소로 인증을 받았다고 발표했기 때문이다.코스닥지수는 외국인과 기관의 매도 공세 속 하락세를 이어가고 있는 모습이다. 현재 코스닥은 2.73포인트(0.42%) 내린 640.36을 기록 중이다. 외국인과 기관이 각각 132억원, 359억원어치 주식을 순매도하고 있는 반면 개인은 522억원 순매수 중이다. 시총 상위 종목은 혼조세다. 휴젤이 6%대 약세다. 메디톡스, 코미팜은 3%대 내리고 있다. 로엔, 셀트리온, 셀트리온헬스케어도 하락세다. CJ E&M과 바이로메드, 신라젠, 포스코컴텍 등은 오르고 있다. 한편, 서울 외환시장에서 원·달러 환율은 현재 4.60원(0.41%) 내린 1124.20원에 거래되고 있다.안혜원 한경닷컴 기자 anhw@hankyung.com[한경닷컴 바로가기] [글방] [모바일한경 구독신청] ⓒ 한국경제 & hankyung.com, 무단전재 및 재배포 금지한국경제 관련뉴스해당 언론사에서 선정하며 언론사 페이지(아웃링크)로 이동해 볼 수 있습니다.원·달러 환율 하락…원1125.5(-3.3원)코스피, 기관 '사자'에 소폭 상승…철강·건설株 강세사기꾼으로 몰린 '천재의 눈물'… 서울대 '발칵''제천 누드펜션' 연회비 얼마인가 봤더니'투기과열지구' 서울 덕분에 반사이익 보는 지역이좋아요0훈훈해요0슬퍼요0화나요0후속기사 원해요0기사제공 :""]"
1,삼성전자, 2017-08-0413:32,서울경제 ,[오후시황]상승 출발했지만... 코스피 약보합,https://finance.naver.com/news/news_read.nhn?article_id=0003085782&office_id=011&mode=search&query=삼성전자&page=4,"['       [오후시황]상승 출발했지만... 코스피 약보합      기사입력2017-08-04 13:32기사원문좋아요훈훈해요좋아요 평가하기공감좋아요0훈훈해요0슬퍼요0화나요0후속기사 원해요0댓글 [서울경제] 전날 40포인트나 폭락했던 코스피 지수가 하루 만인 4일에는 상승 전환해 출발했다. 하지만 2,390선에서 더는 오르지 못하고 약보합세를 연출하고 있다. 코스피 지수는 이날 오후 1시22분 현재 전일보다 4.44포인트 오른 2,391.29를 기록하고 있다. 이날 지수는 전일 대비 2.89포인트(0.12%) 오른 2,389.74 출발에 출발해 장 초반 한 때 2,400.33을 기록했다. 전날 4,000억원 넘게 팔아치운 외국인이 이날 오전 동안에는 ’사자’로 돌아서며 투자심리가 일부 개선되는 듯했지만, 시간이 지나며 다시 매도우위를 보였다. 현재 외국인은 675억원을 팔아치웠다. 반면 기관은 783억원 매수 우위다. 코스피 시가총액 상위 기업을 보면 1위인 삼성전자(0.17% 하락)와 2위 SK하이닉스(2,9%)가 외국인의 차익 실현 등의 영향으로 약세장을 연출하고 있다. 반면 현대차, 포스코, 한국전력, 삼성물산, NAVER 등은 강세장으로 돌아섰다. 업종별로 살펴보면 운송 인프라(6.66%), 항공화물운송과 물류(4.05%), 인터넷과 카탈로그 소매(3.7%), 전자제품(3.52%) 등이 상승세인 반면 무선통신서비스(-2.51%), 게임소프트웨어와 서비스(-2.28%), 생물공학(-1.7%), 화장품(-1.68%) 등은 약세다.   코스닥 지수는 같은 시각 현재 전날보다 2.78포인트(0.43%) 내린 640.26을 기록하고 있다. 이날 지수는 전일 대비 1.71포인트(0.27%) 오른 644.80에 출발했다. /조양준기자 mryesandno@sedaily.com[서울경제 바로가기]1997년 이래 대한민국 최고의 과학자 DB [바로가기]서울경제의 모든 연재물!... 서경Cube [바로가기▶]저작권자 ⓒ 서울경제, 무단 전재 및 재배포 금지서울경제 관련뉴스해당 언론사에서 선정하며 언론사 페이지(아웃링크)로 이동해 볼 수 있습니다.文대통령 직무수행 \'긍정평가\' 77%...지난주와 동률文 대통령 휴가 마치고 내일 靑 복귀...산적한 과제 산더미설현 취미는 \'텀블러 덕질\' 한정판에 판매 종료된 상품까지···수입에 비해 소소해?유이와 결별한 강남 ""한 달 만에 15kg 빠졌다""특검, \'블랙리스트 재판\' 1심 판결에 항소좋아요0훈훈해요0슬퍼요0화나요0후속기사 원해요0기사제공 :']"
