,회사명,날짜,언론사,기사제목,링크,본문
11,삼성전자, 2017-03-1910:51,파이낸셜뉴스 ,"에버랜드, 신개념 어트랙션 '로봇 VR' 오픈...4D 가상현실 체험",https://finance.naver.com/news/news_read.nhn?article_id=0003790887&office_id=014&mode=search&query=삼성전자&page=5,"[""       에버랜드, 신개념 어트랙션 '로봇 VR' 오픈...4D 가상현실 체험      기사입력2017-03-19 10:51기사원문좋아요훈훈해요좋아요 평가하기공감좋아요0훈훈해요0슬퍼요0화나요0후속기사 원해요0댓글      삼성에버랜드가 IT 테마파크로의 변신을 가속화하고 있다. 에버랜드에서 오는 24일부터 선보이는 로봇과 VR 컨텐츠를 결합한 신개념 어트랙션 '로봇 VR'을 관람객들이 미리 탑승해 체험하고 있다.      삼성물산 리조트부문이 운영하는 에버랜드가 국내 유망 스타트업 기업과 손잡고 정보기술(IT) 테마파크로의 변신을 가속화한다.  에버랜드는 가상현실(VR) 혁신기술을 보유한 '상화'와 함께 로봇과 VR 컨텐츠를 결합한 신개념 어트랙션 '로봇 VR'을 국내 최초 도입하고 오는 24일부터 운영에 들어간다고 19일 밝혔다.  현재 에버랜드는 국내 유일의 첨단 IT 판다월드를 비롯해 티익스프레스, 호러메이즈 등 인기 어트랙션을 가상현실 공간에서 실감나게 체험하는 '4D VR 어드벤처', 스마트예약·비콘·웨어러블 앱 등 고객 서비스 증진을 위한 다양한 IT 시스템을 구축해 운영 중이다.  이번에 선보이는 로봇 VR은 로봇팔에 탑승해 삼성전자 기어VR을 쓰면 인기 애니메이션 태권브이의 주인공 훈이와 영희처럼 로봇을 탑승·조종하는 듯한 4D 가상현실 체험 시설이다. 높이 6ｍ의 거대한 로봇팔 2대에 6인승 의자를 장착, 총 12명이 약 3분간 체험하는 시설로, 360도 자유자재로 움직이는 로봇팔에 높은 건물을 뛰어 내리거나 상대 로봇의 로켓 공격을 피하는 VR 영상 신호를 일치시켜 탑승객의 몰입감을 높였다.  에버랜드 내 아메리칸어드벤처 지역에 위치해 있는 로봇 VR은 무인발권기에서 현장 예약 후 체험 가능하며, 21일부터 23일까지 시범운영을 거쳐 24일 일반 이용이 가능하다. 로봇 VR 오픈 기념 이벤트도 진행해 24일부터 내달 13일까지 삼성전자 기어 S3 에버랜드 앱을 다운로드 받은 고객에게 하루 100명씩 무료 탑승 기회를 제공한다.  한편, 에버랜드와 상화와의 만남은 국내를 대표하는 테마파크와 유망 스타트업 기업과의 윈-윈 사례라는 점에서 새로운 상생모델을 제시했다는 평가다. 상화는 대부분의 스타트업 기업들과 마찬가지로 굵직한 전시회 등을 통해 기술력은 인정받고 있었으나 낮은 인지도와 상용화에 어려움을 겪고 있었다.  두 회사는 이러한 상호간 니즈를 반영해 작년 하반기 에버랜드 내 로봇 VR을 도입하기로 결정하고, 테마파크에 적합한 로봇 구조와 설계, 제어시스템, 안전기준 등을 확보했으며, 로봇팔의 역동적인 움직임에 어울리는 VR 영상도 개발해 오픈을 앞두고 있다.   courage@fnnews.com 전용기 기자   ▶ 세상의 모든 골 때리는 이야기 'fn파스'▶ 속보이는 연예뉴스 fn스타  ※ 저작권자 ⓒ  파이낸셜뉴스. 무단 전재-재배포 금지파이낸셜뉴스 관련뉴스해당 언론사에서 선정하며 언론사 페이지(아웃링크)로 이동해 볼 수 있습니다.박근혜 변호인 김평우, 朴 사저에서 문전박대 당하자 하는 말이..아기 태어났는데 혈액형이.. 아내의 뒤늦은 고백'양아치 친박이..' 박근혜 전 대통령 탄핵에 입 연 홍준표승무원이 기내에서 비키니쇼..대박난 사장님'누가 봐도 성행위 묘사'.. 카카오의 묘한 '이모티콘'좋아요0훈훈해요0슬퍼요0화나요0후속기사 원해요0기사제공 :""]"
12,삼성전자, 2017-03-1910:46,한국경제 ,"10대그룹 상장사, 5곳 중 2곳 법인세 줄어…'실적 부진' 여파",https://finance.naver.com/news/news_read.nhn?article_id=0003742748&office_id=015&mode=search&query=삼성전자&page=5,"[""       10대그룹 상장사, 5곳 중 2곳 법인세 줄어…'실적 부진' 여파      기사입력2017-03-19 10:46기사원문좋아요훈훈해요좋아요 평가하기공감좋아요0훈훈해요0슬퍼요0화나요0후속기사 원해요0댓글 10대그룹 상장사 5곳 중 2곳 이상은 실적 부진으로 법인세 비용이 줄어든 것으로 조사됐다. 다만 '삼성전자 효과'로 10대그룹 상장사 전체 법인세 비용은 늘었다.19일 재벌닷컴에 따르면 10대그룹 소속 87개 상장 계열사의 2016회계연도 별도기준 법인세 비용은 9조8200억원으로 집계됐다. 지난해(9조5810억원)보다 2.5%(2390억원) 증가한 것이다.그룹별로 보면 삼성그룹이 4조원으로 1년새 39.1% 늘었다. GS그룹은 1630억원으로 203.5% 늘었고 한화그룹은 2230억원으로 68.6% 증가했다. 롯데그룹과 포스코그룹 법인세 비용도 각각 7000억원, 4680억원으로 25.3%, 23.7% 늘었다. 반면 SK그룹 법인세 비용은 8200억원으로 63.8% 줄었고 현대차그룹도 2조3430억원으로 19.4% 감소했다. 10대그룹 상장사 전체 법인세 비용이 늘어난 것은 '삼성전자 효과' 때문이다. 지난해 삼성전자는 14조7250억원의 세전이익을 내면서 법인세 비용도 3조1450억원으로 1조원 이상 늘었다. 그러나 상장사 87곳 중 세전이익 감소로 법인세 비용이 없거나 감소한 곳은 37개사로 43%에 이른다. 현대자동차, 기아자동차, SK하이닉스, SK텔레콤, 롯데쇼핑, 롯데제과 등의 대기업은 세전이익 감소로 법인세 비용이 큰 폭으로 줄었다. 대한항공, 삼성SDI, 삼성중공업 등 14개사는 적자로 법인세 비용이 아예 없었다.한경닷컴 뉴스룸 open@hankyung.com[한경닷컴 바로가기] [스내커] [모바일한경 구독신청] ⓒ 한국경제 & hankyung.com, 무단전재 및 재배포 금지한국경제 관련뉴스해당 언론사에서 선정하며 언론사 페이지(아웃링크)로 이동해 볼 수 있습니다.돈 많이 줘도 중국엔 안팔아…'일본'의 속내'비아그라 삽니다' 중고나라에 올렸더니…기아차 13년 판매왕의 '영업비밀' 알고보니나만 들리는 삐~소리 방치했다가 '충격'은밀한 데이트, SNS에 올리는 그 여자의 심리좋아요0훈훈해요0슬퍼요0화나요0후속기사 원해요0기사제공 :""]"
13,삼성전자, 2017-03-1910:41,파이낸셜뉴스 ,"[르포]LG전자, OLED TV 이어 LCD TV도 ‘나노셀' 내세워 장악나서",https://finance.naver.com/news/news_read.nhn?article_id=0003790876&office_id=014&mode=search&query=삼성전자&page=5,"['       [르포]LG전자, OLED TV 이어 LCD TV도 ‘나노셀\' 내세워 장악나서      기사입력2017-03-19 10:41기사원문좋아요훈훈해요좋아요 평가하기공감좋아요0훈훈해요0슬퍼요0화나요0후속기사 원해요0댓글나노셀 TV 비밀 담긴 \'LG디스플레이 파주 사업장\'        경기도 파주 LG디스플레이 공장에서 연구원들이 나노셀 TV에 적용되는 편광판을 살펴보고 있다. 나노셀 TV는 LG전자가 TV시장의 95% 이상을 차지하는 액정표시장치(LCD) TV 시장을 공략하기 위해 내놓는 슈퍼 울트라HD TV이다.      LG전자가 TV시장의 95% 이상을 차지하는 액정표시장치(LCD) TV 시장을 공략하기 위해 내놓은 \'나노셀 TV\'의 비밀을 보여주기 위해 경기도 파주시에 위치한 \'LG디스플레이 파주 사업장\'에 기자들을 초청했다. \'나노셀\'은 LCD 패널 위에 약 1나노미터(nm) 크기의 미세 분자구조를 덧입힌 기술이다. 색의 파장을 나노 단위로 더욱 정교하게 조정해 보다 많은 색은 한층 정확하게 표현할 수 있다. 나노셀 기술을 TV에 적용하기 위해 LG전자와 LG디스플레이가 5년의 연구개발 과정이 걸렸다. LG디스플레이 파주 사업장에서 올레드(OLED) TV와 나노셀 LCD TV로 국내 프리미엄 TV 시장을 쌍끌이 하겠다는 LG전자의 욕심을 확인할 수 있었다.  ■ 한 층이 아파트 5층, 무인화는 90%. 지난 17일 찾은 대형 TV용 LCD 및 올레드 디스플레이를 주로 생산하는 LG디스플레이 파주 사업장은 165만 5000㎡(51.3만평) 크기다. 정문에 들어서면 그 규모에 일단 압도를 당한다. 현재 LCD 생산라인인 7세대 공장(P7), 8.5세대 공장(P8, P9)을 비롯해 올레드 생산라인(E3, E4)과 모듈 공장을 운영하고 있으며, 지속적인 연구 개 발을 위한 연구개발(R&D) 센터가 입지하고 있다.  특히 액정표시장치(LCD) 패널 생산라인인 \'P9\' 공장은 길이 265m, 높이 86m에 달한다. 아파트 30층 높이의 이 건물 내부는 단 6개의 층으로 이뤄져 있다. LCD 패널을 제조하는 각종 설비의 높이가 십여 미터에 달하기 때문에 한 층의 높이가 일반 아파트 4~5개 층과 비슷하다. P9 공장은 무인화 공정률이 80% 수준이다. \'P9\' 공장 내부를 둘러보는 동안 단 한명의 작업자만 목격할 수 있었다. 이론적으로는 현재 LG 디스플레이 공장에서 생산하는 모든 디스플레이를 나노셀 디스플레이로 생산할 수 있다.  기존 편광판 대신 나노셀이 적용된 편광판을 사용하기 때문에 별도로 공정을 추가하거나 제품의 설계를 변경할 필요 없다. 그만큼 양산성이 뛰어나다는 것이다.  LG디스플레이 관계자는 ""나노셀 TV는 퀀텀닷 필름을 사용하는 것과 비교해 원가 측면에서도 유리하다""면서 ""중국의 TV 제조업체 스카이워스, 콩카 등으로부터 나노셀 디스플레이의 주문이 밀려들고 있다""고 전했다.   ■LG전자 LCD TV, 50% 이상 \'나노셀\' LG전자는 올해 출시하는 30여 모델의 슈퍼 울트라HD TV 가운데 절반 이상에 나노셀을 적용할 계획이다. 그만큼 올해 프리미엄 LCD TV에서는 나노셀 진영과 삼성전자를 중심으로 한 퀀텀닷 진영이 치열한 화질 경쟁을 펼칠 것으로 예상된다.  LG전자는 기존 LCD TV는 빨간색의 고유한 색 파장에 노란색이나 주황색 등 다른 색의 파장이 미세하게 섞여, 실제와 다른 빨간색으로 표현될 수 있다고 설명한다. 반면 \'나노셀\'은 이런 노란색과 주황색의 파장을 흡수해 실제와 가장 가까운 빨간색으로 만들어 준다.  일반적으로 LCD TV에서 색재현력을 높이는 방식은 기술이 적용되는 위치에 따라 세대를 구분할 수 있다는 게 LG전자측의 설명이다. 우선 1세대는 백라이트 유닛에 적용 되는 방식으로, 광원 자체를 개선해 순도 높은 색을 낼 수 있도록 해준다. 2세대는 백라이트 유닛과 패널 사이에 광학필름을 추가로 끼워 넣는 방식이다. 3세대는 패널을 개선해 색재현력을 높이는 방식이다. 나노셀은 패널에 직접 적용되는 3세대 기술이다.  LG전자 관계자는 ""나노셀 TV는 화면을 정면에서 볼 때와 60˚옆에서 볼 때 색재현력과 색 정확도의 차이가 없다""면서 ""나노셀 기술로 TV 화면에 반사되는 빛의 양도 기존제품 보다 30% 이상 줄였다""고 설명했다.   courage@fnnews.com 전용기 기자   ▶ 세상의 모든 골 때리는 이야기 \'fn파스\'▶ 속보이는 연예뉴스 fn스타  ※ 저작권자 ⓒ  파이낸셜뉴스. 무단 전재-재배포 금지파이낸셜뉴스 관련뉴스해당 언론사에서 선정하며 언론사 페이지(아웃링크)로 이동해 볼 수 있습니다.박근혜 변호인 김평우, 朴 사저에서 문전박대 당하자 하는 말이..아기 태어났는데 혈액형이.. 아내의 뒤늦은 고백\'양아치 친박이..\' 박근혜 전 대통령 탄핵에 입 연 홍준표승무원이 기내에서 비키니쇼..대박난 사장님\'누가 봐도 성행위 묘사\'.. 카카오의 묘한 \'이모티콘\'좋아요0훈훈해요0슬퍼요0화나요0후속기사 원해요0기사제공 :']"
14,삼성전자, 2017-03-1910:36,이데일리 ,이번주(3월20~24일) 재테크 캘린더,https://finance.naver.com/news/news_read.nhn?article_id=0003775738&office_id=018&mode=search&query=삼성전자&page=5,"[""       이번주(3월20~24일) 재테크 캘린더      기사입력2017-03-19 10:36기사원문좋아요훈훈해요좋아요 평가하기공감좋아요0훈훈해요0슬퍼요0화나요0후속기사 원해요0댓글 [이데일리 윤필호 기자] 다음은 이번주(3월20~24일) 재테크 캘린더입니다. ◇3월20일(월)△경제지표한국, 2월 생산자물가△주요일정미국, 에반스 시카고 연은 총재 연설유로존, 재무장관회의(~21일)△주주총회 일정샘표식품(248170), 삼익THK(004380), 케이프(064820), 우림기계(101170), 씨케이컴퍼니, 케이씨아이(036670) 등◇3월21일(화)△경제지표미국, 4분기 경상수지△주요일정미국, 더들리 뉴욕 연은 총재 연설미국, 메스터 클리블랜드 연은 총재 연설미국, 조지 캔사스시티 연은 총재 연설△주주총회 일정금호전기(001210), 한국전력(015760)공사, 금호에이치티(214330), 신일산업(002700), 티제이미디어, 미래테크놀로지(213090), 에치디프로(214870) 등◇3월22일(수)△경제지표미국, 2월 기존주택매매미국, 1월 FHFA 주택가격지수유로존, 1월 경상수지일본, 2월 수출일본, 2월 수입△주주총회 일정팬오션(028670), 오씨아이, 제주은행(006220), 동일고무벨트(163560), 동성화인텍(033500), 율촌화학(008730), 에이티넘인베스트(021080)먼트, 새로닉스(042600), 딜리(131180), 티비씨(033830), 성우테크론(045300) 등◇3월23일(목)△경제지표미국, 2월 신규주택매매유로존, 3월 소비자기대지수(잠정)△주요일정미국, 옐런 연준 의장 연설미국, 카시카리 미니애폴리스 연은 총재 연설미국, 카플란 댈러스 연은 총재 연설△주주총회 일정신한금융지주(055550)회사, 경방(000050), 무림피앤피, 광주은행(192530), 파워로직스, 화신, 동국S&C, KH바텍(060720), 동성화학(005190), 흥국(010240), 아모텍(052710), 세하(027970), 에스지충방, 심팩, 지엔코(065060), 메가스터디교육(215200) 등◇3월24일(금)△경제지표한국, 3월 소비자심리지수미국, 2월 내구재주문(잠정)미국, 2월 비국방&비항공 자본재수주(잠정)유로존, 3월 마킷 제조업 PMI(확정)유로존, 3월 마킷 서비스업 PMI(확정)일본, 닛케이 제조업 PMI(잠정)△주요일정미국, 에반스 시카고 연은 총재 연설미국, 불라드 세인트루이스 연은 총재 연설△주주총회 일정삼성전자(005930), 삼성물산(028260), LG(003550), 한화(000880), 현대종합상사(011760), SKC(011790), 기아자동차(000270), 코오롱(002020), 동부(012030), 한진중공업(097230), 빙그레(005180), 대한항공(003490), 넥센(005720), 동부건설(005960), 만도(204320), 롯데쇼핑(023530), 엔씨소프트(036570), 유한양행(000100), 한국석유(004090)공업, 미래에셋대우(006800), 롯데하이마트(071840), YG엔터테인먼트(122870), 웅진(016880), 녹십자(006280) 등윤필호 (nothing@edaily.co.kr)＜ⓒ종합 경제정보 미디어 이데일리 - 무단전재 & 재배포 금지＞이데일리 관련뉴스해당 언론사에서 선정하며 언론사 페이지(아웃링크)로 이동해 볼 수 있습니다.알뜰폰으로 'G6' 쓴다.. 얼마나 쌀 까[강경훈의 萬藥에]마늘주사, 백옥주사 근거 없어도 꾸준히 쓰는 이유는?韓 미래 위해 힘 보탤 것…홍석현 중앙일보·JTBC 회장 사임미혼男 78.3% 나중에 이혼하더라도 결혼은 한다[카드뉴스]&amp;nbsp;오늘의 별자리 운세(3월 19일)좋아요0훈훈해요0슬퍼요0화나요0후속기사 원해요0기사제공 :""]"
15,삼성전자, 2017-03-1910:33,데일리안 ,"에버랜드, 신개념 어트랙션 '로봇 VR' 도입...24일 오픈",https://finance.naver.com/news/news_read.nhn?article_id=0002173413&office_id=119&mode=search&query=삼성전자&page=5,"['       에버랜드, 신개념 어트랙션 \'로봇 VR\' 도입...24일 오픈      기사입력2017-03-19 10:33기사원문좋아요훈훈해요좋아요 평가하기공감좋아요0훈훈해요0슬퍼요0화나요0후속기사 원해요0댓글에버랜드 이용객들이 4일부터 선보이는 \'로봇 VR\'을 탑승하고 있다. ⓒ삼성물산 에버랜드는 로봇과 가상현실(VR) 콘텐츠를 결합한 신개념 어트랙션 \'로봇 VR\'을 도입하고 오는24일부터 운영에 들어간다고 19일 밝혔다. 가상현실(VR) 혁신기술을 보유한 \'상화\'와 함께 운영하는 로봇 VR은 로봇 팔에 탑승해 삼성전자 기어VR을 쓰면 애니메이션 태권브이의 주인공 훈이와 영희처럼 로봇을 탑승·조종하는 듯한 4D 가상현실 체험 시설이다. 높이 6ｍ의 거대한 로봇 팔 2대에 6인승 의자를 장착 총 12명이 약 3분간 체험하는 시설로, 360도 자유자재로 움직이는 로봇 팔에 높은 건물을 뛰어 내리거나 상대 로봇의 로켓 공격을 피하는 VR 영상 신호를 일치시켜 탑승객의 몰입을 높였다.또 로봇팔의 움직임과는 별도로 승용물이 빙글빙글 회전하는 기능도 추가해, 탑승객이 느끼는 중력과 가속도를 최대한 살려 더욱 실감나게 체험하도록 구성했다. 로봇 VR은 무인발권기에서 현장 예약 후 체험 가능하며 21일부터 23일까지 시범운영을 거쳐 24일 일반 이용이 가능하다. 로봇 VR 도입 기념 이벤트도 진행한다. 24일부터 내달 13일까지 ‘삼성전자 기어 S3 에버랜드 앱’을 다운로드 받은 고객에게 하루 무료 탑승 기회를 제공한다.한편 에버랜드는 다양한 IT 기업과의 협업 등을 통해 첨단 IT 기술이 가미된 재미 요소를 더욱 확대하고 에버랜드만의 새로운 경험을 제공하는 IT 테마파크로 발전시켜 나갈 예정이다.데일리안 한성안 기자ⓒ (주)데일리안 - 무단전재, 변형, 무단배포 금지데일리안 관련뉴스해당 언론사에서 선정하며 언론사 페이지(아웃링크)로 이동해 볼 수 있습니다.에버랜드, 희귀동물 \'황금머리사자 타마린\' 공개에버랜드 \'판다 봉사단\' 창단 20주년...재능기부활동 진행삼성물산 리조트부문, 희귀 ·난치성질환 어린이에 \'희망 선물\'삼성 ""박상진, 삼성물산 합병 전 안종범 만난적 없다"" 반박삼성물산, 지난해 영업이익 1400억원...흑자전환좋아요0훈훈해요0슬퍼요0화나요0후속기사 원해요0기사제공 :']"
16,삼성전자, 2017-03-1910:23,연합뉴스 ,"에버랜드, 로봇과 VR 결합한 새 놀이기구 도입",https://finance.naver.com/news/news_read.nhn?article_id=0009118366&office_id=001&mode=search&query=삼성전자&page=5,"['       에버랜드, 로봇과 VR 결합한 새 놀이기구 도입      기사입력2017-03-19 10:23기사원문좋아요훈훈해요좋아요 평가하기공감좋아요0훈훈해요0슬퍼요0화나요0후속기사 원해요0댓글 (서울=연합뉴스) 정성호 기자 = 에버랜드에 로봇과 VR(가상현실) 콘텐츠를 결합한 신개념 어트랙션(명물)이 생긴다.    에버랜드를 운영하는 삼성물산 리조트부문(사장 김봉영)은 19일 국내 유망 스타트업(신생 벤처기업) \'상화\'와 손잡고 \'로봇 VR\'을 국내 최초로 도입해 24일부터 운영한다고 밝혔다.    로봇 VR은 로봇팔에 탑승해 삼성전자 \'기어VR\'을 쓰면 인기 애니메이션 \'태권브이\'의 주인공 훈이와 영희처럼 로봇에 탑승해 조종하는 듯한 경험을 할 수 있는 4D(4차원) VR 체험시설이다.    높이 6m의 거대한 로봇팔 2대에 6인승 의자를 장착해 모두 12명이 약 3분간 체험할 수 있다.360도 자유자재로 움직이는 로봇팔에, 높은 건물에서 뛰어내리거나 상대 로봇의 로켓 공격을 피하는 VR 영상신호를 일치시켜 탑승객의 몰입감을 높였다는 설명이다.    수 m 상공에서 현란하게 움직이는 로봇팔을 이용해 다른 VR 체험시설보다 한층 강화된 스릴과 재미를 준다고 에버랜드는 밝혔다.    또 로봇팔과는 독립적으로 좌석이 360도 회전하는 기능을 추가해 스릴을 극대화했다.    삼성물산은 또 로봇 VR이 국내 대표 테마파크와 유망 스타트업의 윈윈 사례로 새로운 상생모델을 제시했다고 밝혔다.상화는 다른 스타트업들과 마찬가지로 기술력은 인정받고 있었지만 낮은 인지도와 판로 확보에 어려움을 겪고 있었다.    작년부터 IT와 문화가 가미된 독창적인 테마파크로의 변신을 추진하던 에버랜드는 이런 상화를 파트너로 점찍고 로봇 VR 도입을 함께 준비했다.    테마파크에 적합한 로봇 구조를 설계하고 제어 시스템과 안전기준 등을 마련하는 한편 로봇팔의 움직임에 최적화한 VR 영상을 함께 개발했다.    로봇 VR의 운영수익은 상화의 기술개발 지원을 위해 사용될 예정이다.    에버랜드 관계자는 ""로봇 VR을 통해 에버랜드는 다른 놀이공원과 차별화된 새로운 경험을 제공하고, 상화는 VR 기술의 상용화를 앞당기게 됐다""고 말했다.    sisyphe@yna.co.kr최신 유행 트렌드 총집결 #흥(클릭!)연합뉴스 관련뉴스해당 언론사에서 선정하며 언론사 페이지(아웃링크)로 이동해 볼 수 있습니다.\xa0숯불에 독주 쏟았다가…3세 아이 숨지게 한 식당직원 집유\xa0해병 누드사진 파문 확산…남성군인 성행위 사진까지\xa0다이어트 약이라며 10대에 필로폰 투약후…\xa0\'심봤다\'…금화 무더기 발견·10대소년 다이아몬드 횡재\xa0[블랙박스] 사고 유발하는 갑작스런 불법 유턴좋아요0훈훈해요0슬퍼요0화나요0후속기사 원해요0기사제공 :']"
17,삼성전자, 2017-03-1910:03,SBS ,10대 그룹 상장사 5곳 중 2곳 법인세 감소,https://finance.naver.com/news/news_read.nhn?article_id=0000514306&office_id=055&mode=search&query=삼성전자&page=5,"['       10대 그룹 상장사 5곳 중 2곳 법인세 감소      기사입력2017-03-19 10:03기사원문좋아요훈훈해요좋아요 평가하기공감좋아요0훈훈해요0슬퍼요0화나요0후속기사 원해요0댓글 10대그룹 상장사 5곳 중 2곳 이상은 실적 부진으로 법인세 비용이 줄어든 것으로 조사됐습니다.그러나 \'삼성전자 효과\'로 10대그룹 상장사 전체 법인세 비용은 늘었습니다.재벌닷컴에 따르면 10대그룹 소속 87개 상장 계열사의 2016회계연도 별도기준 법인세 비용이 9조8천200억원으로 집계됐습니다.이는 1년 전 9조5천810억원보다 2.5% 증가한 것입니다.그룹별로 보면 삼성그룹이 4조원으로 1년새 39.1% 늘었고, GS그룹은 1천630억원, 203.5%, 한화그룹은 2천230억원, 68.6%, 롯데그룹과 포스코그룹 법인세 비용도 각각 7천억원와 4천680억원으로 25.3%, 23.7% 늘었습니다.반면 SK그룹 법인세 비용은 8천200억원으로 63.8% 줄었고 현대차그룹도 2조3천430억원으로 19.4% 감소했습니다.10대그룹 상장사 전체 법인세 비용이 늘어난 것은 \'삼성전자 효과\' 때문으로, 지난해 삼성전자는 14조7천250억원의 세전이익을 내면서 법인세 비용도 3조1천450억원으로 1조원 이상 늘었습니다.그러나 상장사 87곳 중 세전이익 감소로 법인세 비용이 없거나 감소한 곳은 37개사로 43%에 이릅니다.현대자동차, 기아자동차, SK하이닉스, SK텔레콤, 롯데쇼핑, 롯데제과 등의 대기업은 세전이익 감소로 법인세 비용이 큰 폭으로 줄었습니다.10대그룹 상장사 중 대한항공, 삼성SDI, 삼성중공업 등 14개사는 적자로 법인세 비용 지출이 아예 없었습니다.\xa0심영구 기자(so5what@sbs.co.kr)☞ [19대 대선 특집] 선거 주요 뉴스를 한눈에!\u200b☞ 미혼모 후원 바로가기※ ⓒ SBS & SBS콘텐츠허브 : 무단복제 및 재배포 금지SBS 관련뉴스해당 언론사에서 선정하며 언론사 페이지(아웃링크)로 이동해 볼 수 있습니다.朴, 독대 자리서 ""도와달라""…달라진 면세점 승인?세월호 인양 최종점검…해저면에서 1∼2m 들어 올린다최순실 뇌물 적용, 박 전 대통령 조사 후 가닥 전망혐의 부인하는 朴, 안종범·정호성과 \'대질신문\' 할 수도?[영상] 시장 뒤덮은 시뻘건 불길…잿더미 된 소래포구좋아요0훈훈해요0슬퍼요0화나요0후속기사 원해요0기사제공 :']"
