,회사명,날짜,언론사,기사제목,링크,본문
0,삼성전자, 2017-04-2123:41,프레시안 ,"감사원 출신 삼성 고문, 메르스 사태 당시 역할은?",https://finance.naver.com/news/news_read.nhn?article_id=0002030013&office_id=002&mode=search&query=삼성전자&page=1,"['       감사원 출신 삼성 고문, 메르스 사태 당시 역할은?      기사입력2017-04-21 23:41기사원문좋아요훈훈해요좋아요 평가하기공감좋아요0훈훈해요0슬퍼요0화나요0후속기사 원해요0댓글특검 ""삼성의 깨알 같은 로비""\xa0[성현석 기자]\xa02015년 메르스 사태 당시, 삼성이 정부를 상대로 \'로비\'를 했다는 증언이 나왔다. 감사원 고위 간부 출신인 박의명 전 삼성증권 고문의 증언이다. 박영수 특별검사팀은 ""삼성은 직급에 맞춰 \'깨알 같은 로비\'를 한다""고 설명했다.\xa0그리고 메르스가 확산된 2015년 여름은, 삼성이 최순실 씨 일가를 지원하던 시기와 거의 겹친다. 삼성물산과 제일모직의 합병 역시 비슷한 시기였다. 따라서 메르스 사태 당시에 대한 증언은, 비슷한 시기 삼성의 로비 행태를 보여주는 근거가 된다.\xa0고위 공무원 출신으로 삼성에 영입된 이들이 하는 일?21일 서울중앙지방법원 형사합의 27부(재판장 김진동) 심리로 열린 이재용 삼성전자 부회장 등에 대한 뇌물 사건 6차 공판에서 박 전 고문의 진술조서가 공개됐다. 조서에 따르면, 박 전 고문은 ""고위 공무원 출신으로 삼성 계열사에 고문 또는 감사로 영입된 이들의 역할""에 대한 질문에 대해 ""자기 출신 부서의 인사 동향, 규제 강화 동향 등을 파악해 장충기 전 삼성 미래전략실 차장(사장)에게 보고하는 것""이라고 대답했다. 아울러 박 전 고문은 ""출근만 삼성증권 사무실로 했을 뿐, 실제로 담당했던 일은 대부분 삼성 미래전략실 업무였다""고 밝혔다. 박 전 고문은 ""(자신이 속했던) 삼성증권에서 요청받아 처리한 업무는 없었다""라고 진술했다. 박 전 고문의 상사 역할은, 장충기 전 삼성 미래전략실사장이 했다. 장 전 사장은 삼성에서 오랫동안 대관업무를 맡았었다. 관공서 및 정치권을 상대로 로비하는 일이다. 박 전 고문은 ""장충기 전 사장이 감사원 관련 현안에 대해 알아봐달라고 하거나, 삼성 입장을 감사원에 전달해달라고 했다. 그러면 그걸 실행하고서, 장 전 사장에게 문자 메시지나 전화로 결과를 보고했다""고 말했다.감사원 출신 삼성 고문에게 ""감사원 국장급을 맡으라""이 같은 행태가 전형적으로 드러난 게 2015년 메르스 사태였다. 삼성서울병원에서 메르스가 확산됐다. 삼성서울병원에 대한 감사원 감사가 시작되자, 삼성의 전방위 로비가 시작됐다. 이수형 전 삼성 미래전략실 기획팀장이\xa0TF팀을 구성해서\xa0\'역할 분담\'에 대한 기획을 했다. 각자 직급에 맞춰 밀착 로비를 하는 계획이다.\xa0박 전 고문에겐 ""감사원 국장급을 맡으라""고 했다.\xa0이런 요구에 따라 박 전 고문은 감사원 국장급들의 동태를 파악해서 장충기 전 사장에게 보고했다. 특검팀은 박 전 고문이 장 전 사장에게 보고한 문자 메시지를 확보했다. 특검팀은 해당 문자 메시지가 ""감사원 내부 자료로 보인다""라고 했다. 감사원의 감사 계획, 담당 부서 등이 구체적으로 담겨있다는 게다. 특검팀이 공개한 문자 메시지 가운데는 박 전 고문의 \'로비\'가 성공한 정황을 보여주는 것도 있다. \'감사원이 박 전 고문의 입장을 고려해서 삼성서울병원에 대한 형사처벌이 가능한 감염병관리법이 아닌, 행정처분만 하도록 한 의료법 등을 적용하기로 수정했다\'라는 취지의 내용이다. 그러나 박 전 고문은 이 대목에서 입장이 달랐다. 해당 문자 메시지는 자신이 과장해서 적은 내용이라는 게다. 그는 ""삼성증권 고문 계약이 만료되는 시점에서 재계약을 위해 과장한 면이 있다""고 밝혔다. 그는 \'감사원의 결정을 외부인의 로비로 수정하는 것은 불가능하다. 장충기 전 사장이 감사원 내부 업무 체계를 잘 모른다는 점을 이용해서 과장된 보고를 했다\'라는 취지로 진술했다. 물론,\xa0문자 메시지가 온전히 사실이라고 인정하면, 박 전 고문 역시 법적 책임을 지기 때문이라는 해석도 가능하다.\xa0박의명 전 고문 ""미전실은 총수가 지휘"" vs 최지성 ""이재용에게 보고해서 뭐하나""\xa0삼성서울병원에 대한 감사인데, 왜 삼성 미래전략실이 나서서 로비를 했나. 이에 대해 박 전 고문은 ""삼성서울병원은 이재용 부회장이 이사장으로 있는 삼성생명공익재단 소속이다. 이 부회장이 병원을 총괄하고 있기 때문""이라고 설명했다.아울러 그는 삼성 미래전략실에 대해 ""그룹 회장 외에 다른 사람 지시를 받아 업무를 처리하는 일은 없다. 회장 뜻과 달리 업무를 처리하는 것은 상상하기 어렵다""고 말했다. 2015년 메르스 사태 당시에는 이 부회장이 사실상 회장 역할을 하고 있었다. 한해 전인 2014년 5월, 이건희 회장이 급성 심근경색으로 쓰러졌기 때문이다. 박 전 고문의 이런 진술은, 앞서 최지성 삼성미래전략실장(부회장)이 한 이야기와 배치된다. 특검이 지난 14일 공개한 최 부회장의 진술조서에서, 최 부회장은 자신이 ""그룹 경영의 전반적인 책임""을 지고 있다고 밝혔다. 최순실 씨 일가에 대한 지원 역시 자신이 결정했으며, 이재용 부회장에겐 제대로 보고하지 않았다고 밝혔다. 그는 ""이 부회장에게 보고해서 뭐하나""라고도 했다. 그런데 최순실 씨의 딸인 정유라 씨에 대한 삼성의 지원이 이뤄진 2015년 당시, 장충기 전 삼성 미래전략실 사장의 지시를 받으면서 일했던 박 전 고문은 ""(삼성 미래전략실이) 그룹 회장 외에 다른 사람 지시를 받아 업무를 처리하는 일은 없다""고 밝혔다. 최 부회장과 박 전 고문 가운데 한 명은 거짓말을 한 셈이다. ""삼성의 깨알 같은 로비""한편 특검팀은 박 전 고문의 진술을 바탕으로 삼성의 로비 행태를 설명했다. 메르스 사태 정도 사안은 방금 소개한 박 전 고문의 진술처럼 대응한다. 그게 아니면, 미래전략실 고위급이 직접 나선다. 그보다 중요한 사안이 있으면, 대통령과 이 부회장의 독대가 이뤄진다. 이에 대해 특검팀은 ""삼성의 깨알 같은 로비""라고 표현했다. 이에 대해 이 부회장 측 변호인은 ""주요 현안에 대한 동향 파악은 기업이 당연히 해야 할 업무""라며 ""그게 왜 불법 로비냐""라고 따졌다. 또 삼성 미래전략실이 이 부회장의 지시에 따라 움직인다는 주장에 대해서도 반박했다. 이 부회장의 공식 직함은 삼성그룹 부회장이 아닌 삼성전자 부회장이라는 게다. 이 부회장은 미래전략실 소속이 아니라고도 했다.\xa0한편 특검팀은 삼성의 로비 및 경영권 승계 등에 대해 설명하며 김상조 한성대학교 교수의 진술을 자주 인용했다. 김 교수는 최근까지 경제개혁연대 소장으로 활동하면서 재벌 개혁 운동을 했다.\xa0이에 대해 재판부는 ""김상조 교수 언급은 불필요하다""고 밝혔다. 이 부회장 측 변호인 역시 ""김 교수의 논평을 사실처럼 인용하는 것은 잘못""이라고 했다. 아울러 이 부회장 측은 ""특검은 계속해서 \'로비\'라는 단어를 사용해 의도적으로 혼란을 야기하고 있다""면서 ""특검이 주장하는 \'로비\'의 실체는 민원인 자격으로서의 요구사항을 전달하는 일련의 과정으로 적법한 행위다. 그것을 마치 불법인 것처럼 매도하고 있다""고 지적했다.성현석 기자 (mendrami@pressian.com)▶독자가 프레시안을 지킵니다 [프레시안 조합원 가입하기][프레시안 페이스북][프레시안 모바일 웹]Copyrightsⓒ PRESSian.com 무단전재 및 재배포금지기사제보 jebo.pressian.com프레시안 관련뉴스해당 언론사에서 선정하며 언론사 페이지(아웃링크)로 이동해 볼 수 있습니다.\'사드 기지\'된 성주, 대선까지 마을 지킨다송민순 문서 공개는 위법, 진본이라면 더 큰 문제다최순득, 박근혜에 ""동생 최순실을 죽일 수 없지 않나""""중립적인 조사? 그게 말이 되나""6자 대결, 문재인 43.3%, 안철수 31.3%좋아요0훈훈해요0슬퍼요0화나요0후속기사 원해요0기사제공 :']"
1,삼성전자, 2017-04-2120:14,매일경제 ,`갤럭시S8` 제조원가는 오르고 출고가는 낮아지고…경쟁심화?,https://finance.naver.com/news/news_read.nhn?article_id=0003928444&office_id=009&mode=search&query=삼성전자&page=1,"['       `갤럭시S8` 제조원가는 오르고 출고가는 낮아지고…경쟁심화?      기사입력2017-04-21 20:14기사원문좋아요훈훈해요좋아요 평가하기공감좋아요0훈훈해요0슬퍼요0화나요0후속기사 원해요0댓글제조원가, 갤S7 엣지比 4만1000원↑출고가, 갤S7 엣지比 3만3000원↓[사진 제공 : 삼성전자] 삼성전자의 프리미엄 스마트폰 \'갤럭시S8\' 1대의 제조원가가 약 34만9000원이라는 분석 결과가 나왔다. 이를 감안하면 갤럭시S8의 제조원가가 전작보다 올랐지만 출고가는 오히려 낮아진 셈이다.시장조사기관 IHS 마킷은 21일 보고서에서 ""갤럭시S8 64GB 모델의 원가는 307.5달러(약 34만9000원)로 추정된다""며 ""이는 부품 원가 301.6달러에 기본 생산비 5.9달러를 합한 가격""이라고 밝혔다. IHS 마킷은 ""갤럭시S8의 원가는 전작 갤럭시S7보다 43.34달러(약 4만9000원), 갤럭시S7엣지보다 36.29달러(약 4만1000원) 정도 비싼 것으로 보인다""고 부연했다.또 ""갤럭시S8의 원가 상승은 삼성전자와 애플, 기타 제조사 간의 \'군비 경쟁\'을 반영한다""며 ""모두가 새롭고 유별난 하드웨어 특징을 추가하려 노력하고 있다""고 분석했다.제조원가는 올랐지만 갤럭시S 시리즈의 출고가는 매년 하락하고 있다. 갤럭시S7 엣지 64GB 모델과 갤럭시S6 엣지 64GB 모델의 초기 출고가는 각각 96만8000원과 105만6000원이었다. 삼성전자 갤럭시S8 64GB 모델의 출고가는 이보다 낮은 93만5000원이다. 이는 스마트폰 시장이 포화되면서 제조사간 경쟁이 심화된 영향으로 보인다. 세계 스마트폰 시장 성장률은 지난 2015년 14%에서 지난해 2%로 급감했다. 당초 갤럭시S8이 베젤리스 디자인과 인공지능(AI) 기능 탑재 등으로 인해 모델들의 전반적인 출고가가 100만원을 웃돌 것으로 예상되기도 했지만 삼성전자는 올리지 않았다.아울러 갤럭시S8 1대를 판매할 때 제조사에 남는 이윤은 약 10만원 수준이라고 알려졌다. 출고가에 제조원가를 빼 단순 계산하면 58만6000원이지만 제품 개발비, 물류비, 마케팅비, 제조사 몫의 지원금 등을 고려해야 한다는 것이다.삼성전자 IM부문 무선사업부의 지난해 영업이익률 10.8%를 대입해 계산하면 9만원가량의 수익이 난다는 계산도 나온다. 물론 이는 정확한 계산 방법이 아니며 이윤을 추정하기 위한 방법에 불과하다.한편, 삼성전자는 갤럭시S8 시리즈부터 평판 모델을 출시하지 않기로 했다. 갤럭시S8, 갤럭시S8 플러스에 모두 좌우 가장자리가 휜 엣지디스플레이를 적용했다는 설명이다. 제조원가에서 가장 많은 부품이 디스플레이기에 갤럭시S8과 전작들의 엣지 모델이 대칭된다고 볼 수 있다.[디지털뉴스국 박진형 기자][매일경제 공식 페이스북] [오늘의 인기뉴스] [매경 프리미엄][ⓒ 매일경제 & mk.co.kr, 무단전재 및 재배포 금지]매일경제 관련뉴스해당 언론사에서 선정하며 언론사 페이지(아웃링크)로 이동해 볼 수 있습니다.효린, 비키니로 해변에 누워…육감 몸매에 \'입이 쩍\'""현대차 몇대씩 산 단골들도 발길 끊어""창원 LG, 현주엽 감독 선임…3년 계약제2의 천안문 탱크맨? 무장트럭에 맞선 여성김사랑, 군살하나 없는 무결점 여신몸매 자랑 \'탄탄\'좋아요0훈훈해요0슬퍼요0화나요0후속기사 원해요0기사제공 :']"
2,삼성전자, 2017-04-2119:10,서울경제 ,B2B 여행사업 속도내는 호텔신라 '훨훨',https://finance.naver.com/news/news_read.nhn?article_id=0003019801&office_id=011&mode=search&query=삼성전자&page=1,"['       B2B 여행사업 속도내는 호텔신라 \'훨훨\'      기사입력2017-04-21 19:10기사원문좋아요훈훈해요좋아요 평가하기공감좋아요0훈훈해요0슬퍼요0화나요0후속기사 원해요0댓글 기업전문여행사 독립 법인화내달 출범 소식에 이틀째 상승삼성 계열사-세중나모여행30년이상 인연도 끊어질 듯[서울경제] 호텔신라가 기업전문여행사업(BTM·Business Travel Management)의 독립법인화를 본격화하며 주가도 상승세를 타고 있다. 지난 19일 열린 인천공항 제2터미널(T2) 면세점 사업자 선정 프레젠테이션에서도 좋은 반응을 얻은 것으로 알려지고 있다.  21일 호텔신라의 주가는 이틀째 상승세를 이어가며 지난해 11월4일 이후 5개월여 만에 장중 5만5,000원을 넘어서기도 했다. 이날 주가는 4.59% 오른 5만4,700원을 기록했다. 이 같은 상승세는 호텔신라가 기업전문여행사를 늦어도 다음달 말까지는 출범시킬 것이라는 소식이 호재로 작용했다. 앞서 지난 7일 호텔신라는 2004년부터 운영해오고 있는 ‘기업 출장예약 서비스 사업(BTMㆍBusiness Travel Management)’에 대해 전문성을 강화하고 신속한 의사결정 시스템을 갖추기 위해 독립법인화하는 방안을 검토하고 있다고 밝혔다. ‘BTM 사업’은 삼성 계열사나 타 기업의 해외 출장 시 필요한 항공권·호텔숙박 예약을 포함한 기업체 해외출장 관련 제반 총무업무를 대행한다. 호텔신라는 ‘BTM’에 최근 대규모 투자를 통해 모바일·인터넷 예약 등 세계적인 수준의 실시간 예약 시스템인 ‘출장예약 시스템’을 개발해 운영하고 있으며 주요 9개국에 12개 거점별 해외지사망을 구축하고 있다.  호텔신라가 기업전문여행사를 설립하며 30년 이상 지속된 세중나모여행과 삼성과의 인연도 끊어질 것으로 보인다. 1982년 설립된 세중여행사(현 세중나모여행)는 창업자인 천신일 회장과 고 이병철, 이건희 삼성 회장과의 인연으로 삼성 계열사들의 기업여행 업무를 독점했다. 세간에는 ‘삼성이 망하지 않는 한 세중은 망하지 않는다’라는 말도 나왔다. 하지만 최근 실질적으로 계열사 컨트롤타워 역할을 하던 미래전략실이 없어지면서 계열사들이 세중과의 계약을 해지하고 있다. 최대 고객인 삼성전자도 기업 여행 관련 계약을 해지하고 호텔신라가 설립하는 여행사 등과 계약을 체결할 예정이다.  한편 호텔신라는 19일 인천공항 T2 면세점 사업자 프레젠테이션에 한화갤러리아·롯데면세점·신세계DF와 함께 참여했다. 인천공항공사는 진행된 심사에서 사업제안 60％와 입찰가격 40％를 기준으로 사업자를 선정할 예정이다. 인천공항공사는 6개의 사업 구역에서 2개 사업자를 선정해 관세청에 제출하면 관세청이 다시 평가한다. 공항공사 프레젠테이션과는 별도로 오는 29일 관세청의 프레젠테이션을 거쳐 최종 사업자를 선정할 예정이다./이경운기자 cloud@sedaily.com[서울경제 바로가기]\'장미전쟁\'의 승자는...5월 대선 실황중계 [바로가기]서울경제의 모든 연재물!... 서경Cube [바로가기▶]저작권자 ⓒ 서울경제, 무단 전재 및 재배포 금지서울경제 관련뉴스해당 언론사에서 선정하며 언론사 페이지(아웃링크)로 이동해 볼 수 있습니다.윤식당, 구인글 열정페이 논란 ""상품으로 앞치마"" 결국 해명 글까지? ""변역비 제공할 예정""[시청률NOW] \'해피투게더3\' 설현 게스트 출연에도 ↓..4.4% 기록쿨 유리 셋째 임신, \'절친\' 백지영-이지혜와 여전한 훈훈샷 ""사랑해""\'택시\' 함소원, 누드 파문 입 열까 ""올 누드 제약 없을 때 진정 행복""""박 전 대통령 \'삼성동 집\' 왜 팔았을까?"" 이유가 설마좋아요0훈훈해요0슬퍼요0화나요0후속기사 원해요0기사제공 :']"
3,삼성전자, 2017-04-2118:57,뉴스1 ,'바이코리아' 외국인 주식보유액 500조 시대 '명과 암',https://finance.naver.com/news/news_read.nhn?article_id=0002688758&office_id=421&mode=search&query=삼성전자&page=1,"['       \'바이코리아\' 외국인 주식보유액 500조 시대 \'명과 암\'      기사입력2017-04-21 18:57기사원문좋아요훈훈해요좋아요 평가하기공감좋아요0훈훈해요0슬퍼요0화나요0후속기사 원해요0댓글국내 증시 신뢰도 상승 긍정 vs 대형주 쏠림 위험요인(세종=뉴스1) 이훈철 기자 = 국내주식시장에서 외국인이 보유한 주식잔액이 사상 처음으로 500조원을 돌파했다. 한국증시에 대한 신뢰도 측면에서 보면 긍정적인 평가를 내릴 수 있지만 동시에 외국자금이 대부분 대형주에 몰리면서 국내주식시장에 미치는 영향이 커짐에 따라 위험요인도 존재한다는 분석이다.21일 국제금융센터가 발표한 \'외국인 국내주식 500조원 보유의 영향\' 분석보고서에 따르면 지난 19일 기준 외국인투자자의 국내주식 보유액은 502조원을 기록했다.지난 3월15일 사상 처음으로 500조원을 돌파한 뒤 한달 넘게 500조원대가 유지되고 있다.외국인 주식보유잔액은 2008년 리만사태가 터졌을 당시 141조원으로 감소했다. 외국 자금이 썰물처럼 빠져나가면서 코스피지수는 큰 폭으로 떨어졌다.이후 외국인 주식보유잔액은 다시 늘어 2011년 4월 400조원으로 규모가 커진 데 이어 6년만에 500조원을 넘어서게 됐다. 국내주식시장에서 외국인 보유비중도 36.2%로 증가했다.지난해에도 400조원대를 기록했던 외국인 주식보유잔액이 1년새 이처럼 증가한 이유는 20조원의 순매수 영향도 있었지만 코스피지수가 상승하면서 기존에 외국인들이 보유하고 있던 주식가치가 상승했기 때문이다.지난해 2월말 코스피지수 1910선에서 현재 2100선대로 14% 상승했다. 지수 상승으로 인한 외국인 주식보유액 증가규모는 101조원으로 추산됐다.이같은 국내주식시장의 외국인 자금유입을 어떻게 봐야 할까.일단 국내 증시에 대한 해외투자자의 신뢰가 반영됐다는 측면에서는 긍정적 평가를 내릴 수 있다. 500조원을 달러로 환산하면 4500억달러로, 이는 전세계 외국인 주식보유액 중에서 11번째로 큰 규모다. 신흥국 중에서는 중국에 이어 두번째다. 비슷한 규모의 홍콩이나 캐나다 주식시장보다 우리나라 증시에 더 많이 투자하고 있다는 의미다.하지만 위험요소도 있다. 보고서는 외국인 주식보유액이 200조원대에서 500조원대로 늘어나면서 월평균 순매도 규모가 2009년에 비해 2배가 넘는 3조~4조원이 되는 상황이 자주 발생할 것으로 전망했다.또 외국인 자금이 대부분 대형주에 쏠려 있다는 점도 우려가 제기됐다. 외국인 보유액이 200조원이던 2009년 5월 당시 외국인 보유 상위 5대 종목이 전체 보유액에서 차지하는 비율은 28.8%였으나 현재는 43.1%로 증가했다.상위 10대 종목 비중은 같은 기간 47.3%에서 54.7%로 늘었다. 특히 외국인의 삼성전자 주식 보유 비율은 2009년 5월 20%대 초반에서 현재 30%대 중반에 육박할 정도로 상승했다.보고서는 이에 대해 ""외국인의 국내주식 보유액이 빠르게 증가한 가운데 투자금액이 상위 대형 종목에 집중되면서 외국인 쏠림 현상이 가중됐다""며 ""단일종목 악재가 발생할 경우 외국인의 매도에 따른 시장 영향력이 확대될 것""이라고 지적했다.실제 지난 북한의 미사일 발사 이후 이달 들어서만 외국인들이 8000억원 넘게 주식을 팔아치우면서 코스피지수가 2100선 초반으로 떨어지기도 했다.안남기 국제금융센터 주식팀장은 ""외국인의 비중이 증가하면서 외국인 거래에 따른 내국인의 거래 쏠림이나 대형주에 대한 투자 집중 등의 위험이 커질 수 있다""며 ""이에 대비해 대항세력인 국내 기관투자자의 비중을 확대하고 개별 기업의 시장영향력 축소 등을 위한 대책을 마련해야 한다""고 밝혔다.boazhoon@▶ 놓치면 후회! 최신 만화 보기 / 2017년 나의 운세 보기▶ 여러분의 제보를 기다립니다. 제보하기(클릭!)[© 뉴스1코리아(news1.kr), 무단 전재 및 재배포 금지]뉴스1 관련뉴스해당 언론사에서 선정하며 언론사 페이지(아웃링크)로 이동해 볼 수 있습니다.문재인 41% vs 안철수 30%…安 7%p 급락 왜?김병기 ""송민순 쪽지 목적있다면 국정원 문 닫을 각오해야""무엇에 쓰는 물건?…부지깽이로 파마하는 이발사초등생 강제추행범은 \'침\'을 남겼다…7년만에 덜미""황소개구리인줄 알고""…두꺼비 먹은 50대 사망좋아요0훈훈해요0슬퍼요0화나요0후속기사 원해요0기사제공 :']"
4,삼성전자, 2017-04-2118:36,국민일보 ,[여의도 stock] 경기 회복 기대감에 코스피 2160선 탈환,https://finance.naver.com/news/news_read.nhn?article_id=0000986184&office_id=005&mode=search&query=삼성전자&page=1,"['       [여의도 stock] 경기 회복 기대감에 코스피 2160선 탈환      기사입력2017-04-21 18:36기사원문좋아요훈훈해요좋아요 평가하기공감좋아요0훈훈해요0슬퍼요0화나요0후속기사 원해요0댓글코스피지수가 지난 5일(2160.85) 이후 11거래일 만에 2160선 고지를 탈환했다. 이달 수출 호조세와 삼성전자 주가 상승이 힘을 보탰다. 코스피지수는 21일 전 거래일보다 15.89포인트 오른 2165.04로 거래를 마쳤다. 종일 상승 흐름을 보이면서 장중 한때 2170선에 육박하기도 했다. 외국인과 기관은 이틀째 동반 매수세를 보이며 오름세를 이끌었다. 외국인은 2414억원, 기관은 908억원을 순매수했다. 개인은 3131억원을 순매도했다. 상승 동력은 경기 회복, 기업 실적 개선에 대한 기대감이다. 전문가들은 대우조선해양 채무재조정, 미국의 환율조작국 지정 등 불확실성이 하나씩 해소되면서 얼어붙은 투자심리를 녹이고 있다고 봤다. 다만 대통령 선거, 북한 리스크 등 변수가 여전히 남아 있어 상승세를 계속 이어갈지는 미지수다. 5거래일 연속 하락했던 ‘시가총액 1위’ 삼성전자는 1.19% 반등하면서 203만8000원으로 장을 마감했다. 외국인은 7거래일 만에 삼성전자를 순매수했다. 아모레퍼시픽(3.59%) 포스코(2.47%) 네이버(2.14%) 삼성물산(1.56%) SK하이닉스(1.17%) 등 사가총액 상위 종목 대부분이 오름세를 보였다. 롯데그룹의 상장계열사 주가는 지주회사로 지배구조를 바꾼다는 소식에 상승했다. 롯데칠성(4.35%) 롯데쇼핑(4.48%) 롯데제과(1.20%) 롯데푸드(2.52%) 등이 일제히 올랐다. 코스닥지수는 0.84포인트 내린 634.96으로 거래를 마치며 이틀째 하락했다. 서울 외환시장에서 원·달러 환율은 5.4원 떨어진 1134.4원에 마감했다.김찬희 기자 chkim@kmib.co.kr[국민일보 홈페이지] [페이스북] [트위터][취재대행소 왱!(클릭)]GoodNews paper ⓒ 국민일보(www.kmib.co.kr), 무단전재 및 재배포금지국민일보 관련뉴스해당 언론사에서 선정하며 언론사 페이지(아웃링크)로 이동해 볼 수 있습니다.박근혜 \'삼성동 집\' 팔고 신소미 살던 집 28억에 샀다킨더 초콜릿 안에 바늘이… 페레로 자체조사 나서""홍준표 성범죄 모의 자백…후보 자격 없다"" 비판 나선 국민의당\'화면 먹통\' 갤S8 원인은?…""허용 오차범위 안의 불량""또 기부… 빌 게이츠, 열대성 질병 퇴치에 3800억원좋아요0훈훈해요0슬퍼요0화나요0후속기사 원해요0기사제공 :']"
