,회사명,날짜,언론사,기사제목,링크,본문
0,삼성전자, 2017-11-0123:56,조선비즈 ,"한국투자증권, '초대형IB' 첫 타이틀 단다",https://finance.naver.com/news/news_read.nhn?article_id=0000387664&office_id=366&mode=search&query=삼성전자&page=1,"['       한국투자증권, \'초대형IB\' 첫 타이틀 단다      기사입력2017-11-01 23:56기사원문좋아요훈훈해요좋아요 평가하기공감좋아요0훈훈해요0슬퍼요0화나요0후속기사 원해요0댓글 한국투자증권이 초대형IB(투자은행) 첫 주자로 스타트를 끊는다.1일 금융당국에 따르면 증권선물위원회(이하 증선위)는 이날 오후 정례회의를 열고 초대형 IB의 핵심업무라고 볼 수 있는 단기금융업 인가안 심의에 한국투자증권을 상정했다.단기금융업은 자기자본의 200% 한도 안에서 자기 어음을 발행할 수 있는 발행어음 사업을 말한다. 이를 통해 증권사들은 자금을 조달, 기업금융 등에 나설 수 있게 된다.현재 초대형 IB를 신청한 증권사는 자기자본 4조원 이상의 요건을 갖춘 미래에셋대우, NH투자증권, KB증권, 삼성증권, 한국투자증권 등 5곳이다. 하지만 미래에셋대우와 NH투자증권, KB증권은 금감원이 인적·물적 요건과 대주주 적격성 등에 대해 심사를 진행하고 있어 이날 안건에 오르지 못했다.특히 미래에셋대우의 경우 유로에셋투자자문 상품을 불완전판매했던 것에 대해 금융감독원의 검사가 진행중이다. 금감원 측의 제재심의위원회 등을 거쳐 징계 수위가 확정된 이후에나 초대형IB 인가 여부가 결정될 전망이다.삼성증권의 경우 대주주격인 이재용 삼성전자 부회장의 재판으로 지난 8월 심사가 보류된 상태다.증선위를 통과한 한국투자증권의 단기금융업 인가안은 오는 8일 열릴 금융위 정례회의로 넘어가 의결을 거칠 전망이다.강승건 대신증권 연구원은 “한국투자증권은 ‘종합금융투자실’이라는 별도의 운용부서를 신설하여 신사업 준비를 하고 있었으며 초기 단계에서도 1조원 규모까지는 사업을 빠르게 확대할 수 있을 것”이라며 “발행어음 운용을 위한 자금 조달 과정에서 IB 부서의 전사 이익 기여도는 확대될 여지가 있으며 IB 및 트레이딩 영역에서의 대형사 집중 현상을 주도할 수 있을 것”이라고 분석했다.[김유정 기자 kyj@chosunbiz.com]chosunbiz.com조선비즈 관련뉴스해당 언론사에서 선정하며 언론사 페이지(아웃링크)로 이동해 볼 수 있습니다.""중국에 질려버렸다""…칼같이 자른 롯데마트""전쟁 나면 어쩌려고…"" 비상 걸린 아파트들""한국인 또다시 촛불 들 수도""…美 전문가 \'경고\'""웃돈 드릴께요""…한국산 안 쓴다던 中, 결국50억 대출…\'월드스타\' 강수연, 무슨 일이좋아요0훈훈해요0슬퍼요0화나요0후속기사 원해요0기사제공 :']"
1,삼성전자, 2017-11-0123:06,이데일리 ,"""한투가 먼저 웃었다""…금융위, 초대형IB 한투증권 단독 상정",https://finance.naver.com/news/news_read.nhn?article_id=0003960044&office_id=018&mode=search&query=삼성전자&page=1,"['       ""한투가 먼저 웃었다""…금융위, 초대형IB 한투증권 단독 상정      기사입력2017-11-01 23:06기사원문좋아요훈훈해요좋아요 평가하기공감좋아요0훈훈해요0슬퍼요0화나요0후속기사 원해요0댓글 [이데일리 문승관 기자] 금융위원회 증권선물위원회는 1일 초대형 투자은행(IB)의 핵심인 발행어음 업무를 한국투자증권만 우선 허용했다. 자기자본 4조원 이상으로 발행어음 인가를 신청한 곳은 모두 5곳이지만 한투증권이 가장 먼저 인가를 받았다.증선위는 이날 회의를 열고 초대형 IB 5곳에 대한 지정 안과 단기금융업 인가 안을 회의에 부쳤다. 초대형 IB 신청사는 미래에셋대우, NH투자증권, KB증권, 삼성증권, 한국투자증권 등 5곳이다.한투증권을 제외한 나머지 초대형 IB는 발행어음 취급은 할 수 없지만 초대형 IB 지정으로 기업고객을 상대로 외화환전 업무는 할 수 있다. 자기자본 200%까지 발행어음을 조달할 수 있는 단기금융업 인가 안은 한국투자증권 한 곳만 우선 상정됐다. 삼성증권은 대주주 격인 이재용 삼성전자 부회장 재판으로 단기금융업 심사가 보류됐고, 나머지 증권사 3곳은 금융감독원이 단기금융업 심사를 계속하고 있다. 증선위 관계자는 “한투증권이 가장 먼저 금융감독원의 검토가 끝난 것일 뿐”이라며 “삼성을 제외한 나머지 증권사도 검토를 마치는 대로 증선위에 올려 발행어음 인가 여부를 논의할 것”이라고 말했다. 이날 증선위를 거친 초대형 IB 지정 안과 발행어음 인가 안은 이르면 오는 8일에 열릴 금융위 정례회의로 넘어가 의결을 거칠 전망이다.한국투자증권 단기금융업 인가 및 증권사 5곳의 초대형 IB 지정 건이 증선위를 거쳐 이르면 내주 금융위 정례회의를 통과하면 초대형 IB가 이달 내 출범하게 된다. 금융위는 지난해 ‘한국판 골드만삭스’를 육성하고 중소·중견기업에 모험자본을 투자해 혁신성장에 이바지할 수 있도록 초대형 IB 육성안을 발표했다. 자기자본 4조원 이상 증권사는 자기자본의 200%까지 발행어음을 조달할 수 있어 수십조 원의 자금이 기업금융 시장에 투입하면 자본시장 활성화에 이바지할 수 있을 것으로 기대하고 있다.문승관 (ms7306@edaily.co.kr)▶이데일리 개편기념 이벤트 - 갤럭시 노트8 쏩니다▶[카카오톡] 플친 맺으면 스타벅스 쿠폰 팡팡~♥＜ⓒ종합 경제정보 미디어 이데일리 - 무단전재 & 재배포 금지＞이데일리 관련뉴스해당 언론사에서 선정하며 언론사 페이지(아웃링크)로 이동해 볼 수 있습니다.[단독]목격자 진술·블랙박스 영상으로 본 故 김주혁 \'사고의 재구성\'[단독]\'송중기♥송혜교\' 결혼식, 150억 거절했더니 中 불법 생중계\'이니템\' 들어올 때 노 젓자..프로스펙스 文대통령 워킹화 단종됐지만..故 김주혁 사고 현장서 발견된 한 장의 편지…\'가슴 먹먹\'文대통령 오늘은 오셨네요 인사에 홍준표 여기는 국회니까요좋아요0훈훈해요0슬퍼요0화나요0후속기사 원해요0기사제공 :']"
2,삼성전자, 2017-11-0122:37,뉴스1 ,"한국투자증권, 초대형IB 단기금융업 인가 받을 듯",https://finance.naver.com/news/news_read.nhn?article_id=0003025516&office_id=421&mode=search&query=삼성전자&page=1,"['       한국투자증권, 초대형IB 단기금융업 인가 받을 듯      기사입력2017-11-01 22:37기사원문좋아요훈훈해요좋아요 평가하기공감좋아요0훈훈해요0슬퍼요0화나요0후속기사 원해요0댓글© News1발행어음 인가 신청 5곳 중 유일하게 증선위 상정초대형 IB 지정은 5곳 모두 상정(서울=뉴스1) 온다예 기자,김태헌 기자 = 한국투자증권이 초대형 투자은행(IB)의 핵심 사업인 발행어음을 국내 증권사 중 처음으로 취급하게 될 전망이다. 금융위원회 증권선물위원회가 자기자본 4조원 이상 대형 증권사 중 한국투자증권의 단기금융업 인가안을 가장 먼저 상정했다.1일 금융당국에 따르면 증선위는 이날 오후 회의를 열고 한국투자증권의 단기금융업 인가 안을 상정했다. 또 대형 증권사 5곳(미래에셋대우·NH투자증권·KB증권·삼성증권·한국투자증권)의 초대형 IB 지정안도 함께 상정했다.금융당국 관계자는 ""신사업 인가 심사를 마친 한국투자증권을 먼저 안건으로 상정했다""며 ""나머지 증권사는 아직 더 살펴보고 있다""고 밝혔다.앞서 금융감독원은 삼성증권의 단기금융업 인가 심사를 이재용 삼성전자 부회장의 재판(뇌물공여 혐의 등) 결과가 최종 확정될 때까지 보류하겠다고 밝혔다. 이 관계자는 ""나머지 3곳에 대해 인가 심사가 진행 중이다""고 말했다.금융당국에 따르면 이날 상정한 초대형 IB 인가안과 단기금융업 인가안은 다음주 금융위 정례회의에서 처리된다. 한국투자증권은 발행어음 인가안이 금융위에서 통과되면 그날부터 바로 관련 업무를 시작할 수 있다.hahaha8288@▶ \'평창2018\' 관련 뉴스·포토 보기▶ 한국바이오포럼(11/30) 참가 신청!▶ 뉴스1 [BOOK] 오픈! 실천 핀테크![© 뉴스1코리아(news1.kr), 무단 전재 및 재배포 금지]뉴스1 관련뉴스해당 언론사에서 선정하며 언론사 페이지(아웃링크)로 이동해 볼 수 있습니다.文대통령 ""오늘은 오셨네요""…홍준표 ""국회니까요""차은택 ""이미 사회에서 사형선고…반성한다""밥 주는 주인까지 \'\'덥석\'…고성서 \'개물림 사고\'장애인 아들 살해한 엄마…4년 집행유예 왜?""담배 안 피우나요? 그렇다면 보상휴가를!""좋아요0훈훈해요0슬퍼요0화나요0후속기사 원해요0기사제공 :']"
3,삼성전자, 2017-11-0122:30,이데일리 ,"김상조, 2일 주요 그룹 경영진과 2차 면담 '삼성은 참석 미정'",https://finance.naver.com/news/news_read.nhn?article_id=0003960041&office_id=018&mode=search&query=삼성전자&page=1,"[""       김상조, 2일 주요 그룹 경영진과 2차 면담 '삼성은 참석 미정'      기사입력2017-11-01 22:30기사원문좋아요훈훈해요좋아요 평가하기공감좋아요0훈훈해요0슬퍼요0화나요0후속기사 원해요0댓글김상조 공정거래위원장. 사진=연합뉴스[이데일리 e뉴스팀] 김상조 공정거래위원장이 2일 주요 대기업 경영진과 두 번째 면담을 가진다.1일 관계 당국에 따르면 김 위원장은 2일 오전 대한상공회의소에서 현대차·SK·LG·롯데 등 그룹 전문 경영진과 만난다. 삼성도 참가 대상이었으나, 권오현 삼성전자 대표이사 부회장이 경영일선에서 퇴진을 선언하는 등 상황으로 참석이 확정되지 않았다.김 위원장은 6월 권 삼성전자 부회장, 정진행 현대차 사장, 박정호 SK텔레콤 사장, 하현회 LG 사장 등 4대 그룹 대표들과 정책 간담회를 하고 자발적인 모범 사례를 만들어 달라고 전한 바 있다. 한편 이번 2차 회동에는 1차 회동 때 참석했던 삼성·현대차·LG·SK 등 4대 기업과 함께, 롯데그룹이 추가된 것으로 알려졌다.e뉴스팀 (bodo@edaily.co.kr)▶이데일리 개편기념 이벤트 - 갤럭시 노트8 쏩니다▶[카카오톡] 플친 맺으면 스타벅스 쿠폰 팡팡~♥＜ⓒ종합 경제정보 미디어 이데일리 - 무단전재 & 재배포 금지＞이데일리 관련뉴스해당 언론사에서 선정하며 언론사 페이지(아웃링크)로 이동해 볼 수 있습니다.[단독]목격자 진술·블랙박스 영상으로 본 故 김주혁 '사고의 재구성'[단독]'송중기♥송혜교' 결혼식, 150억 거절했더니 中 불법 생중계'이니템' 들어올 때 노 젓자..프로스펙스 文대통령 워킹화 단종됐지만..故 김주혁 사고 현장서 발견된 한 장의 편지…'가슴 먹먹'文대통령 오늘은 오셨네요 인사에 홍준표 여기는 국회니까요좋아요0훈훈해요0슬퍼요0화나요0후속기사 원해요0기사제공 :""]"
4,삼성전자, 2017-11-0122:25,경향신문 ,삼성전자 주가 고공행진에 눈길 쏠리는 ‘삼성물산’,https://finance.naver.com/news/news_read.nhn?article_id=0002829256&office_id=032&mode=search&query=삼성전자&page=1,"[""       삼성전자 주가 고공행진에 눈길 쏠리는 ‘삼성물산’      기사입력2017-11-01 22:25기사원문좋아요훈훈해요좋아요 평가하기공감좋아요0훈훈해요0슬퍼요0화나요0후속기사 원해요0댓글ㆍ전자 지분 4.6% 보유…업계 “주가 저평가, 지주사 역할 프리미엄도”삼성전자의 주가 고공행진에 투자자의 눈길이 삼성물산으로 쏠리고 있다. 삼성그룹의 실질적인 지주사 역할을 하는 삼성물산은 삼성전자와 삼성바이로직스, 삼성생명, 삼성SDS 등 그룹 계열사 지분을 골고루 갖고 있다. 지분 가치가 높아지면서 현재 주가가 저평가돼 있다는 분석도 나온다. 그만큼 주가가 오를 여지가 있다는 뜻이다.삼성전자는 1일 주식시장에서 전 거래일보다 10만7000원(3.89%) 오른 286만1000원에 거래를 마쳤다. 사상 처음 주당 280만원대 진입이다. 전날 분기 사상 최대 실적 발표 호재에 힘입어 수직 상승했다. 삼성바이오로직스도 2만2000원(5.73%) 상승한 40만6000원을 기록했다. 삼성생명도 13만7500원으로 2500원(1.85%) 올랐다.같은 날 삼성물산은 다른 계열사에 비해 소폭인 1500원(1.01%) 오른 14만9500원에 거래를 마쳤지만 지분 가치 상승이 호재로 부각되고 있다. 삼성물산이 지분 4.61%를 보유한 삼성전자의 주가는 연초 대비 약 60% 올랐다. 지분율이 43.44%인 삼성바이오로직스 주가는 같은 기간 160% 급등했다. 삼성물산의 영업가치 못지않게 지분가치가 주목받는 이유다.증권업계는 지분가치에 비해 삼성물산 주가가 저평가돼 있다고 분석한다. 지난 7월 이후 삼성물산 시가총액은 거의 변화가 없다. 조윤호 동부증권 연구원은 “올해 전체로 보면 삼성물산 시가총액은 3조6000억원 늘어난 반면 4개사 지분가치는 13조3000억원 증가했다”면서 “지분가치 상승분이 시가총액에 제대로 반영되지 못하고 있다”고 분석했다.삼성물산에 대한 관심이 높아지고 있는 또 다른 이유는 삼성그룹 지배구조 개편의 핵심이기 때문이다. 증권가에서는 총수 일가 지분율이 높고 실질적인 지주사 역할을 하는 삼성물산을 중심으로 그룹이 개편될 가능성이 높다고 보고 있다.▶ [경향비즈 바로가기], 경향비즈 SNS [페이스북]  ▶ [인기 무료만화 보기][©경향신문(www.khan.co.kr), 무단전재 및 재배포 금지]경향신문 관련뉴스해당 언론사에서 선정하며 언론사 페이지(아웃링크)로 이동해 볼 수 있습니다.MBC 김장겸 '퇴진 수순'···방문진 이사 5명, 해임안 제출장애인단체 대표, 경찰서 화장실서 점거농성 벌인 까닭은[경향의 눈] 근혜별곡(槿惠別曲)[기자메모]네이버, 재벌의 '애국심 마케팅' 구태 닮아가나[단독] '성추행 피해 주장' 여배우가 반기문 조카?좋아요0훈훈해요0슬퍼요0화나요0후속기사 원해요0기사제공 :""]"
5,삼성전자, 2017-11-0122:25,경향신문 ,삼성전자 창립 48돌…권오현 “1위 달성한 지금이 위기 시작점일지도”,https://finance.naver.com/news/news_read.nhn?article_id=0002829257&office_id=032&mode=search&query=삼성전자&page=1,"[""       삼성전자 창립 48돌…권오현 “1위 달성한 지금이 위기 시작점일지도”      기사입력2017-11-01 22:25기사원문좋아요훈훈해요좋아요 평가하기공감좋아요0훈훈해요0슬퍼요0화나요0후속기사 원해요0댓글 경영 은퇴를 선언한 삼성전자 권오현 부회장이 “어쩌면 1위를 달성한 지금이 위기의 시작점일지도 모른다”고 밝혔다.권 부회장은 1일 경기 수원시 ‘삼성디지털시티’에서 사장단과 임직원 400여명이 참석한 가운데 열린 창립 48주년 기념식에서 “어려운 환경 속에서도 우리 회사가 사상 최대의 실적을 달성한 것은 임직원 여러분의 노력의 결실”이라면서도 “일부 사업의 성장 둔화, 신성장 동력 확보 지연 등 여전히 많은 불안요소를 가지고 있으며, 어쩌면 1위를 달성한 지금이 위기의 시작점일지도 모른다”고 말했다.권 부회장은 “과거 수많은 1위 기업들이 현실에 안주하며 한순간에 무너졌고, 우리도 사업재편, 경영시스템 변화 등 해결해야 할 구조적 문제가 산적해 있다”고 강조했다. 그는 “다가올 10년은 사회 및 인구구조, 기술혁신 등에서 엄청난 변화가 예상되며 인공지능(AI), 사물인터넷(IoT) 등으로 산업은 급변하고 경쟁은 치열해질 것이며, 고객의 요구도 더욱 다양해질 것”이라며 “이런 시기에 기존의 방식으로 열심히 일하는 것만으로는 한계가 명확하다”고 말했다.▶ [경향비즈 바로가기], 경향비즈 SNS [페이스북]  ▶ [인기 무료만화 보기][©경향신문(www.khan.co.kr), 무단전재 및 재배포 금지]경향신문 관련뉴스해당 언론사에서 선정하며 언론사 페이지(아웃링크)로 이동해 볼 수 있습니다.MBC 김장겸 '퇴진 수순'···방문진 이사 5명, 해임안 제출장애인단체 대표, 경찰서 화장실서 점거농성 벌인 까닭은[경향의 눈] 근혜별곡(槿惠別曲)[기자메모]네이버, 재벌의 '애국심 마케팅' 구태 닮아가나[단독] '성추행 피해 주장' 여배우가 반기문 조카?좋아요0훈훈해요0슬퍼요0화나요0후속기사 원해요0기사제공 :""]"
6,삼성전자, 2017-11-0122:23,경향신문 ,SK이노베이션 ‘주총 전자투표제’ 대기업 첫 도입,https://finance.naver.com/news/news_read.nhn?article_id=0002829253&office_id=032&mode=search&query=삼성전자&page=1,"[""       SK이노베이션 ‘주총 전자투표제’ 대기업 첫 도입      기사입력2017-11-01 22:23기사원문좋아요훈훈해요좋아요 평가하기공감좋아요0훈훈해요0슬퍼요0화나요0후속기사 원해요0댓글ㆍ의결권 포기 부작용 막는 효과…삼성·현대차그룹 등 가세 가능성ㆍ경제민주화 기조 맞추기냐 M&A 먹잇감 경험 작용이냐 해석 갈려ㆍ회사 측 “주주 권익 강화로 주주 가치 제고 위해 선제적 조치한 것”SK이노베이션이 대기업집단 계열사 중 최초로 주주총회에 전자투표제를 도입한다. 주총에 가지 않아도 권리를 행사할 수 있도록 주주권을 강화하겠다는 것이다. 소액주주 등 금융약자 보호를 앞세우는 정부의 경제민주화 기조와도 부합한다.SK이노베이션은 1일 이사회를 열고 전자투표제 도입을 의결했다고 밝혔다. 전자투표제는 내년 개최하는 제11차 정기주총부터 시행한다.전자투표제는 회사 온라인 투표 시스템에 주주명부와 주총 의안 등을 등록하면 주주가 주총에 직접 참석하지 않고도 투표할 수 있는 방식이다. 수백개 기업이 같은 날 주총을 여는 ‘슈퍼 주총데이’의 부작용을 막는 효과가 있다. 동시다발적으로 열리는 주총에 직접 참석하기 어려운 주주가 의결권을 포기할 수밖에 없는 상황을 피할 수 있다.전자투표에 따른 소액주주의 활발한 소수의견 개진은 경영진을 압박할 수 있는 수단이다. 전자투표제가 2010년 도입됐음에도 주요 대기업이 선뜻 채택하지 못하는 이유다. 코스피 시가총액 상위 100대 기업 중 삼성, 현대차, SK, LG, 롯데 등 5대 그룹 계열사에서 지금까지 전자투표제를 도입한 사례는 없었다. 전날 배당 규모 확대 등 주주친화 정책을 내놓은 삼성전자도 전자투표제 도입에 대해서는 ‘검토’ 수준에 머물고 있다.문재인 정부는 기업지배구조 개선 관련 공약으로 기관투자가가 기업 의사결정에 적극 참여하도록 ‘스튜어드십 코드’ 도입을 제시하는 등 금융시장 약자 보호, 기업경영 투명성 강화를 강조하고 있다. 국회에서도 소액 주주의 주총 참여를 높이기 위해 일정 규모 이상 상장회사에 전자투표제를 의무화하는 방안을 담은 상법개정안이 다수 발의돼 있다.주요 그룹 중 SK가 가장 먼저 전자투표제를 도입한 것은 ‘주주권 강화’라는 홍보효과를 기대한 측면이 있다. 전자투표가 경영진을 압박할 수는 있어도 실제 대주주의 의결권 행사에 큰 걸림돌이 되기는 어렵기 때문이다.전자투표제는 일몰을 앞둔 기존 ‘섀도보팅’을 대체하는 수단이 될 수도 있다. 섀도보팅은 의결정족수 미달로 주총이 무산되지 않게 하려고 불참 주주의 투표권을 대신 행사할 수 있는 일종의 의결권 대리행사 제도다. 다만 다른 주주의 찬성·반대표 비율만큼 찬반 의사를 반영하기 때문에 의결에 영향을 미치지는 않는다. 황세운 자본시장연구원 자본시장실장은 “SK로서는 의결정족수를 채우는 데 전자투표가 도움이 되리라는 계산도 분명히 했을 것”이라고 분석했다. SK그룹이 과거 헤지펀드 소버린에 적대적 인수·합병(M&A) 대상이 됐던 경험에 따른 조치로 보는 시각도 있다. 김학균 미래에셋대우 투자전략부장은 “기업지배구조가 안 좋으면 주가가 떨어지고 기업사냥꾼 입장에서는 매력적인 먹잇감이 된다”며 “당장 위험에 노출된다고 볼 수는 없지만 과거 쓰라린 경험에 따른 교훈이라는 맥락도 있다”고 말했다. 전자투표로 하면 유사시 애국심에 호소해 참석이 어려운 소액 주주의 우호 지분을 확보하기 쉽다. 잃는 것보다 얻을 게 커 보인다면 삼성, 현대차 등 다른 대기업집단도 도입에 가세할 가능성이 있다. SK이노베이션 측은 “주주의 권익 강화를 통한 실질적 주주가치 제고를 위해 전자투표제의 선제적인 도입을 결정했다”며 “지난 7월 창사 이래 처음 중간배당을 시행하며 적극적인 주주환원 정책을 통한 주주가치 높이기에 나선 바 있다”고 강조했다.▶ [경향비즈 바로가기], 경향비즈 SNS [페이스북]  ▶ [인기 무료만화 보기][©경향신문(www.khan.co.kr), 무단전재 및 재배포 금지]경향신문 관련뉴스해당 언론사에서 선정하며 언론사 페이지(아웃링크)로 이동해 볼 수 있습니다.MBC 김장겸 '퇴진 수순'···방문진 이사 5명, 해임안 제출장애인단체 대표, 경찰서 화장실서 점거농성 벌인 까닭은[경향의 눈] 근혜별곡(槿惠別曲)[기자메모]네이버, 재벌의 '애국심 마케팅' 구태 닮아가나[단독] '성추행 피해 주장' 여배우가 반기문 조카?좋아요0훈훈해요0슬퍼요0화나요0후속기사 원해요0기사제공 :""]"
