,회사명,날짜,언론사,기사제목,링크,본문
6,삼성전자, 2017-08-2909:00,머니투데이 ,"[스팟]삼성전자, 2만4000원(-1.04%) 내린 228만1000원 출발",https://finance.naver.com/news/news_read.nhn?article_id=0003926109&office_id=008&mode=search&query=삼성전자&page=10,"['       [스팟]삼성전자, 2만4000원(-1.04%) 내린 228만1000원 출발      기사입력2017-08-29 09:00기사원문좋아요훈훈해요좋아요 평가하기공감좋아요0훈훈해요0슬퍼요0화나요0후속기사 원해요0댓글 [머니투데이 진경진 기자] 29일 삼성전자 출발.TOM칼럼-깊이있는 투자정보▶무료 만화 즐기고~ 선물타자!▶ 빵빵한 차&레이싱걸▶ 진경진 기자 jkjin@mt.co.kr머니투데이 관련뉴스해당 언론사에서 선정하며 언론사 페이지(아웃링크)로 이동해 볼 수 있습니다.""텀블러 반값""…스타벅스, 온라인몰 폐쇄 앞두고 \'파이널 세일\'""못 살겠다"" 청운효자동 엑소더스…전세물량↑평택 국제대교 붕괴, 그 옆으론 수상스키 탄 시민文대통령, SNS에 박용진 옹호..靑 곰탕 반찬투정 논란 종결?박지원, 安 당대표 소식에 ""충격이 이만저만 아니다"" 해프닝좋아요0훈훈해요0슬퍼요0화나요0후속기사 원해요0기사제공 :']"
7,삼성전자, 2017-08-2908:57,한국경제TV ,운용사도 정부 코드 맞추기…사회책임투자펀드 ‘봇물’,https://finance.naver.com/news/news_read.nhn?article_id=0000570492&office_id=215&mode=search&query=삼성전자&page=10,"['       운용사도 정부 코드 맞추기…사회책임투자펀드 ‘봇물’      기사입력2017-08-29 08:57기사원문좋아요훈훈해요좋아요 평가하기공감좋아요0훈훈해요0슬퍼요0화나요0후속기사 원해요0댓글[한국경제TV 김보미 기자]최근 2년간 출시가 전무했던 사회책임투자펀드가 올해 들어 다시 시장에 모습을 드러내고 있습니다.하지만 과거 일반 공모펀드들과 큰 차별성 없는 운용으로 사양길에 접어들었던 사회책임투자펀드의 잇단 출시를 바라보는 시선은 곱지 않은데요.심지어 정부의 정책에 운용사 마저 코드를 맞추는 것 아니냐는 우려도 나옵니다.자세한 내용, 김보미 기자가 보도합니다.사회책임투자펀드는 환경, 사회, 지배구조 측면에서 사회적 책임을 다하는 기업들을 선별해 투자하는 상품입니다.국내에서는 2003년에 처음 출시됐지만, 차별성 없는 포트폴리오 구성과 저조한 수익률로 인해 2014년 출시를 마지막으로 자취를 감췄던 상품이기도 합니다.하지만 올해 들어 운용사들이 다시 너도나도 사회책임투자펀드를 출시하고 있습니다.하이자산운용과 삼성액티브자산운용이 지난 5월과 8월 상품을 내놓은 데 이어 한화자산운용 역시 ESG ETF 상장을 앞두고 있습니다.문재인 정부가 대기업의 지배구조개편에 초점을 맞추고 스튜어드십코드 도입 역시 추진력을 얻으면서 이른바 ‘착한 기업’이 시장에서 주목받고 있기 때문인데, 상품 출시를 바라보는 시선은 곱지 않습니다.과거에 출시됐던 사회책임투자펀드가 일반주식형펀드 대비 별다른 차별성을 보이지 못했기 때문입니다.실제로 과거 출시됐던 사회책임투자펀드들의 포트폴리오를 살펴보면 삼성전자 편입이 압도적인 데다 SK하이닉스, SK텔레콤, 롯데케미칼 등 대형주 쏠림이 심각했습니다.포트폴리오에 담는 종목이 일반 주식형펀드와 다르지 않다보니 수익률 역시 비슷하기는 마찬가지.운용사들은 이러한 점을 보완해 기업지배구조원, 서스틴베스트 등 의결권자문기관들과 협력해 종목을 선정할 계획이라지만삼성전자 등 몇몇 대기업을 빼고 운용했을 때 변동성이 확대되고 수익률이 저하되는 문제점이 해결될 수 있을지는 여전히 미지수입니다.상황이 이렇다 보니 일각에서는 문재인 정부 기조와의 코드맞추기가 아니냐는 지적도 나옵니다.익명을 요구한 한 운용사 관계자는 ”코스피 200종목 내 사회책임투자 요소를 만족하는 기업이 30개가 채 되지 않다는 이유로 최근 MSCI가 관련 지수를 만드는 데 거절 의사를 표한 사례가 있었다”며 “정경유착이 심한 우리나라의 경우 현실적으로 제대로 된 사회책임투자펀드를 만들기는 어렵다”고 전하기도 했습니다.이렇듯 운용사들이 시장과 사회 분위기에 쏠려 우후죽순 상품을 내놓으면서 결국 손해는 투자자들의 몫이 될 수 있다는 우려의 목소리가 커지고 있습니다.한국경제TV 김보미입니다.김보미 기자 bm0626@wowtv.co.krⓒ 한국경제TV, 무단 전재 및 재배포 금지한국경제TV 관련뉴스해당 언론사에서 선정하며 언론사 페이지(아웃링크)로 이동해 볼 수 있습니다.추자현 ""우효광, 용돈 올려줬더니 주식으로 다 잃었다""김태희, 서울대 시절 학생식당 몰카…세상 혼자사는 미모서태지 아내 이은성, 부내나는 근황 셀카…출산 후 물오른 미모이장우, 공일오비 발탁된 이유는 윤종신 때문?신은경, \'가짜 모성애\' 논란 딛고 컴백…2년 만에 안방 복귀좋아요0훈훈해요0슬퍼요0화나요0후속기사 원해요0기사제공 :']"
8,삼성전자, 2017-08-2908:57,한국경제TV ,"코스피 2,360선 후퇴 하반기 주요 이슈 점검(Ⅰ)",https://finance.naver.com/news/news_read.nhn?article_id=0000570493&office_id=215&mode=search&query=삼성전자&page=10,"['       코스피 2,360선 후퇴 하반기 주요 이슈 점검(Ⅰ)      기사입력2017-08-29 08:57기사원문좋아요훈훈해요좋아요 평가하기공감좋아요0훈훈해요0슬퍼요0화나요0후속기사 원해요0댓글[한국경제TV 박두나 PD][증시 라인 11]- 앵커 : 김동환 / 경제 칼럼니스트 / 경희대학교 국제지역연구원 객원연구위원- 출연 : 노근창 / 현대차투자증권 리서치센터장정원석 / 하이투자 과장조용찬 / 미중경제연구소 소장Q> 이재용 부회장 실형 선고와 갤럭시 노트8 발표로 인한 삼성전자 경영방향, 주가 영향을 전망해달라.노근창 :실형에도 불구하고 설비투자 등은 예정대로 진행될 것으로 보인다.다만, 인수·합병 등 총수의 판단이 중요한 분야는 일정 기간 보류될 가능성도 높아 보인다.Note8에 제품의 영속성 관점에서 긍정적이지만 3분기는 노트8 출시에도 불구하고 S8 출하량 감소 및 아이폰과의 경쟁을 감안시 무선 부문 실적은 2분기 대비 악화될 것으로 예상된다.정원석 :삼성전자 플래그쉽 스마트폰 중 갤럭시 노트8에 처음으로 듀얼 카메라 채택되면서 카메라 부품 업체들의 수혜로 실적 개선세가 전망된다.향후 갤럭시 S, 중저가 스마트폰까지 듀얼 카메라 채택될 경우 중장기적인 수혜가 예상된다.Q> 지난 주말 북한 도발로 지정학적 리스크 다시 불거졌다. 앞으로 전망과 한국 경제와 증시에 미칠 영향력 점검해달라.조용찬 :북한이 한미 연합훈련인 을지 프리덤 가디언(UFG) 연습 엿새째인 26일 강원도에서 동해상으로 단거리 발사체를 3발 쏘며 무역시위를 했다.UFG 연습을 하는 데 대한 반발 차원의 도발로 해석되지만, 도발 강도가 ICBM이나 북극성 시리즈의 SLBM 실험이 아니었다는 점에서 한국 경제와 증시에 미칠 영향을 미미하다고 생각된다.박두나 PD rockmind@wowtv.co.krⓒ 한국경제TV, 무단 전재 및 재배포 금지한국경제TV 관련뉴스해당 언론사에서 선정하며 언론사 페이지(아웃링크)로 이동해 볼 수 있습니다.추자현 ""우효광, 용돈 올려줬더니 주식으로 다 잃었다""김태희, 서울대 시절 학생식당 몰카…세상 혼자사는 미모서태지 아내 이은성, 부내나는 근황 셀카…출산 후 물오른 미모이장우, 공일오비 발탁된 이유는 윤종신 때문?신은경, \'가짜 모성애\' 논란 딛고 컴백…2년 만에 안방 복귀좋아요0훈훈해요0슬퍼요0화나요0후속기사 원해요0기사제공 :']"
9,삼성전자, 2017-08-2908:56,한국경제TV ,초대형IB 심사 착수..어음 발행업무는 글쎄,https://finance.naver.com/news/news_read.nhn?article_id=0000570489&office_id=215&mode=search&query=삼성전자&page=10,"['       초대형IB 심사 착수..어음 발행업무는 글쎄      기사입력2017-08-29 08:56기사원문좋아요훈훈해요좋아요 평가하기공감좋아요0훈훈해요0슬퍼요0화나요0후속기사 원해요0댓글[한국경제TV 한창율 기자]초대형 투자은행 도입을 앞두고 감독당국의 발걸음이 빨라지고 있습니다.하지만, 핵심 부분인 발행어음 신규 인가를 두고는 장담할 수 없는 분위기입니다.보도에 한창율 기자입니다.금융당국이 초대형 투자은행 지정을 앞두고 국내 대형 5개 증권사에 대한 현장실사를 실시합니다.자기자본 규모에 따라 미래에셋대우, NH투자증권, KB증권 등으로 순으로 다음달 1일까지 진행합니다.현재 금융감독원은 각사의 발행어음 관련 IT체계와 조직 인력 현황, 사업계획 등을 집중 점검할 계획입니다.발행 어음 사업은 자기자본 200% 한도 안에서 자금 조달을 통해, 기업금융 등에 나설 수 있는 초대형 투자은행의 핵심입니다.다만 삼성증권이 이번 이재용 삼성전자 부회장 유죄 판결로 발행어음 업무 인가 심사가 보류되면서 다른 증권사들도 장담할 수는 없는 상황입니다.금감원 고위 관계자도 ""대주주 요건은 심사대상자들한테 외부 또는 내부에 사실관계를 조회하고 있는 단계""라며 앞으로 종합적인 판단을 할 것이라고 설명했습니다.이런 분위기는 나머지 증권사들에게도 영향을 미치고 있습니다.직간접적으로 자본시장법 위반 사례가 있어, 사실관계 조회에 따라 결론이 달라질 수 있기 때문입니다.초대형 투자은행을 준비하는 담당자들은 일단 금융당국의 눈치를 보며 판단을 기다리는 모습입니다. A증권사 초대형IB 사업 담당자""기대를 가지고 열심히 문의해 오는 부분에 대해 대응하고 있고, 요청자료에 대해 잘 설명하고 있습니다""하지만 초대형IB 육성을 내걸고 자기자본 확충을 부채질했던 금융당국이 갑작스레 신규업무 허용에 깐깐한 잣대를 들이대는 모습에는 당혹스러워하는 모습입니다.특히 금융사들에 대한 징계와 이에 따른 신규업무 제한과 관련된 규정이 명확치 않아  4년간 초대형IB를 준비한 증권사들은 이번 인허가에 들이 댈 금융당국의 잣대의 길이를 우려하고 있습니다.한국경제TV 한창율입니다.한창율 기자 crh2090@wowtv.co.krⓒ 한국경제TV, 무단 전재 및 재배포 금지한국경제TV 관련뉴스해당 언론사에서 선정하며 언론사 페이지(아웃링크)로 이동해 볼 수 있습니다.추자현 ""우효광, 용돈 올려줬더니 주식으로 다 잃었다""김태희, 서울대 시절 학생식당 몰카…세상 혼자사는 미모서태지 아내 이은성, 부내나는 근황 셀카…출산 후 물오른 미모이장우, 공일오비 발탁된 이유는 윤종신 때문?신은경, \'가짜 모성애\' 논란 딛고 컴백…2년 만에 안방 복귀좋아요0훈훈해요0슬퍼요0화나요0후속기사 원해요0기사제공 :']"
10,삼성전자, 2017-08-2908:53,연합뉴스 ,"KB증권 ""삼성전자, 시안 낸드공장 증설…적절한 결정""",https://finance.naver.com/news/news_read.nhn?article_id=0009504931&office_id=001&mode=search&query=삼성전자&page=10,"['       KB증권 ""삼성전자, 시안 낸드공장 증설…적절한 결정""      기사입력2017-08-29 08:53기사원문좋아요훈훈해요좋아요 평가하기공감좋아요0훈훈해요0슬퍼요0화나요0후속기사 원해요0댓글 (서울=연합뉴스) 경수현 기자 = KB증권은 29일 삼성전자가 중국 시안(西安)에서 낸드 플래시 메모리 공장을 증설하기로 한 데 대해 ""적절한 의사결정""이라며 \'매수\' 투자의견과 목표주가 280만원을 유지했다.     김동원 연구원은 ""삼성전자가 낸드 플래시 부문에서 공격적인 투자전략을 지속하는 것은 현재의 경쟁 구도를 볼 때 당연한 결정""이라며 ""올해와 내년이 경쟁사와 격차를 벌리며 점유율을 확보할 수 있는 최적의 기회""라고 말했다.    앞서 삼성전자는 \'삼성 중국 반도체\'(SCS) 법인 낸드플래시 메모리 공장 증설에 3년간 70억 달러(약 7조8천억원)를 투자하는 방안을 추진 중이라고 28일 공시했다.    evan@yna.co.kr최신 유행 트렌드 총집결(클릭!)연합뉴스 관련뉴스해당 언론사에서 선정하며 언론사 페이지(아웃링크)로 이동해 볼 수 있습니다.\xa0""불가리아 결혼식 비용이 北 김정은 주머니로""\xa0국정원 ""리설주, 올해 2월 셋째 출산…성별은 미확인""\xa0초등학생과 수차례 성관계한 30대 교사 구속\xa0발랄·관능의 \'아이콘\' 佛 여배우 미레유 다르크 별세\xa0침 뱉은 개사료 먹여…가출 10대에 성매매 강요·학대좋아요0훈훈해요0슬퍼요0화나요0후속기사 원해요0기사제공 :']"
11,삼성전자, 2017-08-2908:52,헤럴드경제 ,더 정교해진 ‘소비자 타깃팅’…유통업계 빅데이터 승부수,https://finance.naver.com/news/news_read.nhn?article_id=0001282939&office_id=016&mode=search&query=삼성전자&page=10,"['       더 정교해진 ‘소비자 타깃팅’…유통업계 빅데이터 승부수      기사입력2017-08-29 08:52기사원문좋아요훈훈해요좋아요 평가하기공감좋아요0훈훈해요0슬퍼요0화나요0후속기사 원해요0댓글-마트ㆍ백화점, 빅데이터 활용한 서비스 앞다퉈 개발 -방대한 데이터베이스 기반으로 개인 최적화 정보 제공 -아직 규모나 속도 면에서 글로벌 유통업체에 뒤쳐져 [헤럴드경제=박로명 기자] 최근 유통업계가 빅데이터를 활용해 고객에게 최적화된 쇼핑정보ㆍ광고를 제공하는 방식으로 진화하고 있다. 정보의 홍수 속에서 고객의 구매기록ㆍ선호ㆍ연령ㆍ지역 등을 종합해 분석하고 고객이 원하는 것을 정확히 예측하는 것이 매출로 직결된다는 판단에서다. 실제로 빅데이터 활용은 제조업ㆍ금융ㆍ교통 산업 등에서도 필수로 자리잡고 있다. 경제협력개발기구(OECD)의 2015년 연구에 따르면 데이터를 사업에 활용하는 기업은 활용하지 않는 기업보다 노동 생산성 증가가 5~10%가량 더 빠른 것으로 조사됐다.유통업계도 온ㆍ오프라인을 망라하고 빅데이터를 분석해 가치 있는 정보를 추출하고, 이를 바탕으로 변화를 예측하는 것이 미래 경쟁력이 될 것이라고 전망하고 있다. 유통업계가 가격, 배송을 넘어 빅데이터에 기반한 기술 경쟁에 속도를 내고 있는 이유다. 이마트는 지난 28일 삼성전자와 ‘디지털 사이니지’를 구축해 쇼핑 패턴 분석 기술 등을 공동 개발, 유통과 정보기술(IT)을 결합한 미래형 유통을 선보인다는 계획을 내놨다. 디지털 사이니지는 관제센터에서 통신망을 통해 광고 내용을 제어 할 수 있다. 매장 곳곳의 종이 광고판과 현수막이 디지털 사이니지로 교체되면 빅데이터 분석, 안면인식 기술 등을 접목해 소비자 밀착형 광고가 가능해진다. 이마트가 오는 10월 죽전점에 도입하는 ‘디지털 사이니지’ 시스템을 현재 마트 디스플레이 광고판에 합성한 모습. [사진 제공=이마트]기존 마트 광고가 매장 내 모든 소비자에게 노출돼 정교하지 못하고 소비자의 피로가 컸다면 디지털 광고는 시간대마다 고객이 찾는 제품을 적시에 띄우는 ‘타깃팅 광고’에 최적화돼있다. 이마트는 중장기적으로는 고객의 성별, 연령대에 따라 가장 적절한 광고를 찾아내 노출하는 ‘고객 안면인식 프로파일링’기술도 선보일 예정이다. 롯데마트도 ‘타깃 마케팅’ 전략을 수립하기 위해 정보를 종합하고 매출을 분석하는 ‘원투원 마케팅 팀’을 운영하고 있다. 원투원 마케팅 팀은 지난 2015년 연간 1000만 부 이상 발행하던 종이쿠폰을 없애고 옴니채널 쿠폰 서비스인 ‘M쿠폰 앱’을 도입했다. 올해 3월부터는 고객들의 장바구니를 분석해 재구매율이 높은 상품을 중심으로 할인 쿠폰을 제공하는 ‘개인화 쿠폰 서비스’를 확대 시행했다. 획일적 쿠폰 발급 방식에서 벗어나 고객별 맞춤형 쿠폰을 제공해 효율성을 높이고 추가 매출 발생을 노린 것이다. 실제로 롯데마트가 10개월 동안 해당 서비스를 시범 진행한 결과 사용 횟수가 일반 쿠폰에 비해 10% 정도 늘었다. 신세계 백화점도 지난 2011년 업계 최초로 종이 전단지를 없앴다. 불특정 다수에게 배포하는 전단지는 효율성이 떨어진다고 판단한 것이다. 신세계는 통계학과 교수, 데이터 분석업체 등과 4년 가량을 매달린 끝에 올해 초 인공지능 ‘S마인드’를 개발했다. S마인드는 방대한 양의 빅데이터를 분석해 세일 등 쇼핑 정보를 개인에게 맞춤형으로 전달한다. 롯데백화점은 최근 ‘AI 태스크포스(TF)팀’을 신설하고, 올 12월 상용화를 목표로 인공지능 기술에 기반한 ‘추천봇’ 개발을 추진하고 있다. 추천봇은 고객의 구매정보ㆍ온라인 행동정보ㆍ기타 성향 등을 파악하고, 시장의 흐름과 트렌드 등을 종합적으로 분석해 유행하는 패션상품을 제안한다. 이처럼 국내 유통기업들은 신기술 개발에 힘쓰고 있지만 일각에서는 아직 규모나 속도 면에서 글로벌 유통기업에 뒤쳐져 있다고 지적하고 있다. 산업통상자원부에 따르면 지난 1998년부터 2015년까지 AI·빅데이터ㆍ가상현실(VR) 등 4차 산업 관련 특허는 아마존이 4891건, 알리바바가 3374건, 월마트가 669건 등인 반면 국내에서는 전체 117건에 불과하다. 한 유통업계 관계자는 “현재 유통업계는 이미 앞서가고 있는 글로벌 유통기업의 트렌드를 따라가고 있는 것”이라며 “IT 기술이 발전하고 모바일 비중이 높아지고 있는 만큼, 고객에게 최적화된 정보를 제공하는 방안을 연구해 장기적으로 매출을 끌어올리려는 것”이라고 강조했다. dodo@heraldcorp.com▶영감이란 불꽃에 타오르게할 스토리(INSPIRE)▶앞서가는 젊은 경제신문 친구맺기 ▶오늘의 운세 날씨 - Copyrights ⓒ 헤럴드경제 & heraldbiz.com, 무단 전재 및 재배포 금지 -헤럴드경제 관련뉴스해당 언론사에서 선정하며 언론사 페이지(아웃링크)로 이동해 볼 수 있습니다.자유한국당 의원, 취임 100일 넘긴 文대통령 \'탄핵\' 거론박지원 ""안철수, 차라리 부산시장 나가는 게 바람직""비·김태희, 이탈리아로 태교여행…시아버지 동반""정겨운, 20대 일반인과 9월 결혼""…예비신부 피아노 전공 미모의 재원국정원 ""北, 내달 9일 미사일 추가도발 가능…핵실험 준비도 완료""좋아요0훈훈해요0슬퍼요0화나요0후속기사 원해요0기사제공 :']"
