,회사명,날짜,언론사,기사제목,링크,본문
4,삼성전자, 2017-03-1110:00,연합뉴스 ,[주간CEO] 아들 구속 뒤 삼성미술관장 사퇴한 홍라희,https://finance.naver.com/news/news_read.nhn?article_id=0009099482&office_id=001&mode=search&query=삼성전자&page=2,"['       [주간CEO] 아들 구속 뒤 삼성미술관장 사퇴한 홍라희      기사입력2017-03-11 10:00기사원문좋아요훈훈해요좋아요 평가하기공감좋아요0훈훈해요0슬퍼요0화나요0후속기사 원해요0댓글홍라희리움 관장 [연합뉴스 자료사진](서울=연합뉴스) 김연숙 기자 = 홍라희 삼성미술관 리움·호암미술관장이 지난 6일 관장직에서 전격 사퇴했다.     홍 전 관장은 홍진기 전 중앙일보 회장의 장녀로 1967년 이건희 삼성전자 회장과 결혼했다. 이재용 삼성전자 부회장, 이부진 호텔신라 대표이사 사장, 이서현 삼성물산 사장이 자녀다.    그는 지난달 이재용 부회장이 구속되자 ""참담한 심정에 모든 것을 내려놓고 싶다""는 뜻을 주위에 밝혀온 것으로 전해졌다.    서울대 응용미술학과를 졸업한 홍 전 관장은 국내 미술계에서 영향력이 가장 큰 인물로 꼽힌다. 재력, 인맥과 함께 미술품을 보는 안목을 갖췄다는 평가를 받아왔다.    1995년 호암미술관장에 취임한 그는 2004년 삼성미술관 리움이 개관하면서 두 미술관의 관장직을 맡았다.     2008년 \'삼성 비자금 특검\' 사태의 여파로 두 관장직과 삼성문화재단 이사직에서 사퇴했다가 2011년 3월 복귀한 그는 6년 만에 다시 자리에서 물러나게 됐다.    nomad@yna.co.kr최신 유행 트렌드 총집결 #흥(클릭!)연합뉴스 관련뉴스해당 언론사에서 선정하며 언론사 페이지(아웃링크)로 이동해 볼 수 있습니다.\xa0BBC \'朴탄핵\' 한국 인터뷰 중 \'아이들 출몰\'…동영상 \'인기\'\xa0문재인, NYT와 인터뷰…""미국에 \'No\' 라 할 수 있어야""\xa0이집트 빈민촌서 람세스 2세 추정 거대 석상 발견\xa0서울고법, \'면회 금지 풀어달라\' 최순실 요청 또 기각\xa0알래스카서 거대 유전 발견…美육지 유전으로는 30년 만에 최대좋아요0훈훈해요0슬퍼요0화나요0후속기사 원해요0기사제공 :']"
5,삼성전자, 2017-03-1109:53,서울경제 ,"[朴대통령 탄핵] 헌재 ""대통령이 기업의 재산권 침해""...재계 '뇌물죄 혐의' ...",https://finance.naver.com/news/news_read.nhn?article_id=0002990585&office_id=011&mode=search&query=삼성전자&page=2,"['       [朴대통령 탄핵] 헌재 ""대통령이 기업의 재산권 침해""...재계 \'뇌물죄 혐의\' 벗어날까      기사입력2017-03-11 09:53기사원문좋아요훈훈해요좋아요 평가하기공감좋아요0훈훈해요0슬퍼요0화나요0후속기사 원해요0댓글 출연금 뇌물여부 판단안해향후 수사·재판 추이 관심[서울경제] 헌법재판소가 10일 박근혜 대통령 탄핵을 인용하면서도 ‘뇌물수수 혐의’에 대한 판단은 내놓지 않으면서 향후 대기업 수사와 재판이 어떻게 진행될지 재계의 관심이 쏠리고 있다. 이재용 삼성전자 부회장의 뇌물죄에 대한 1심 재판은 이미 시작됐으며 검찰은 다른 대기업들로의 수사 확대를 고민하고 있다. 헌재는 이날 “대통령이 미르·K스포츠재단 설립 등에 관여한 것은 기업의 재산권을 침해하고 기업 경영의 자유를 침해한 것”이라고 지적했다. 대통령의 권한 남용에 초점을 맞추되 대기업의 재단 출연금이 뇌물인지에 대해서는 직접적으로 언급하지 않은 것이다. 이는 헌재가 뇌물죄 등 나머지 사안들은 검찰 수사와 형사 재판을 통해 진실이 가려질 부분이 남아 있다는 점을 고려한 것으로 보인다. 헌재가 뇌물 혐의에 대한 판단을 내놓지 않으면서 재판에 대응하는 삼성도 부담을 다소 덜게 됐다는 분석이 나온다. 삼성은 줄곧 “대통령의 강요에 따른 피해자일 뿐”이라는 주장을 고수해왔다.앞서 이 부회장의 변호인들은 전날 서울중앙지법 형사합의33부(부장판사 이영훈)에서 열린 공판준비기일에서도 “피고인 전원은 공소사실 모두에 대해 부인한다”며 뇌물공여·횡령·위증과 재산 국외 도피, 범죄수익 은닉 등 이 부회장의 다섯 가지 혐의를 전면 부정했다. 재단 기금 출연과 승마 지원은 대통령의 강요와 압박으로 불가피하게 이뤄진 것일 뿐 대가를 바란 뇌물이 아니었다는 것이 변호인의 핵심 주장이다. 재계에서는 헌재가 탄핵 선고에서 ‘대통령이 기업 재산권과 기업 경영의 자유를 침해한 것’이라고 지적한 부분을 두고 삼성이 주장하는 ‘피해자’ 구도가 법정에서 설득력을 발휘할 수 있다는 분석도 나오고 있다. 특검에 앞서 수사를 진행했던 검찰의 1차 특수본도 “기업은 피해자”라는 수사결과를 냈다. /윤홍우기자 seoulbird@sedaily.com[서울경제 바로가기]빨라진 \'대선시계\'... 이미 시작된 19대 대선 [바로가기]서울경제와 친해지는 가장 확실한 방법 [페이스북]저작권자 ⓒ 서울경제, 무단 전재 및 재배포 금지서울경제 관련뉴스해당 언론사에서 선정하며 언론사 페이지(아웃링크)로 이동해 볼 수 있습니다.임창정, 만삭 아내 대리운전 논란에 ""아내 떠받들고 살 것"" 해명임창정 만삭 아내 대리운전 논란, ""술 끊은 기념으로 찍은 사진"" 해명 전해···별걸 가지고 난리?설리, 최자 결별 시기에 올라온 남자 사진, 어깨 손 두른 스킨십까지 그는 누구?\'불타는 청춘\' 이연수♥최성국 ""연애 세포 깨어나""···과거 이혼? 결혼한 적도 없어!\'박사모\' 가수 이광필 ""국회에서 자결 분신"" 의지 밝혀···박사모 가입.등업 신청 폭주?좋아요0훈훈해요0슬퍼요0화나요0후속기사 원해요0기사제공 :']"
6,삼성전자, 2017-03-1109:52,서울경제 ,"탄핵 정국 일단락···현안 해결 목소리 내는 산업계 ""G2 통상압력 대비, 경제·...",https://finance.naver.com/news/news_read.nhn?article_id=0002990584&office_id=011&mode=search&query=삼성전자&page=2,"['       탄핵 정국 일단락···현안 해결 목소리 내는 산업계 ""G2 통상압력 대비, 경제·외교 컨트롤타워 바로 세워야""      기사입력2017-03-11 09:52기사원문좋아요훈훈해요좋아요 평가하기공감좋아요0훈훈해요0슬퍼요0화나요0후속기사 원해요0댓글 4차산업혁명 준비는 정부-기업 합심신성장동력 M&A에도 적극 역할 필요[서울경제] 석 달 이상 탄핵 정국이 진행되면서 사실상 ‘시계 제로’ 상태였던 재계와 산업계에서도 정치적 불확실성이 제거된 만큼 산적한 현안부터 해결해야 한다는 요구가 높아지고 있다. 당장 미국과 중국의 통상 압력에 우리 기업의 보호막이 될 수 있도록 외교·경제 컨트롤타워를 바로 세우는 것이 가장 시급하다는 지적이다. 아울러 그동안 중단되다시피 한 ‘4차 산업혁명’ 등 국가 신성장동력과 경제살리기, 일자리 창출 등에 대한 실질적인 논의도 필요하다는 견해다. 10일 재계와 산업계에 따르면 박근혜 대통령의 파면으로 정치 혼란이 일단락된 만큼 관심을 경제와 산업 분야로 돌려 이에 대한 정부의 적극적인 대응이 필요하다는 목소리가 높다. 재계의 한 관계자는 “지금까지 경제와 기업의 산적한 과제는 탄핵에 밀려 제대로 논의되지도 관심받지도 못했다”며 “탄핵 정국이 일단락된 만큼 정부와 정치권은 시급한 현안 해결을 위해 지혜를 모아야 한다”고 말했다. 현재 산업계에서는 당장 직면한 문제부터 장기적 관점에서 정부와 함께 해결해가야 하는 과제가 산적해 있다. 가장 대표적인 것이 독일과 일본 등 선진국은 저 멀리 질주하고 있는 ‘4차 산업혁명’에 대한 준비다. 지난해부터 국내에서도 뒤늦게 논의가 시작되기는 했지만 최순실 국정농단 사태로 이마저도 중단된 모습이다. 그동안 기업들이 4차 산업혁명과 관련한 준비를 조금씩 해오고 있지만 기업별로 대응하기에는 힘이 부친다. 박병원 과학기술정책연구원 박사는 “지금까지 정부와 기업들의 대응은 너무 단기적이고 조급한 모습이었다”며 “호들갑 떨기보다는 4차 산업혁명은 지금부터라도 장기적 관점에서 정부와 기업이 차분히 준비해나가야 한다”고 말했다. 고고도미사일방어체계(THAAD·사드) 배치 결정으로 강화되는 중국의 보복조치와 한미 자유무역협정(FTA) 재협상 등이 걸려 있는 미국의 보호무역주의 확대에 대해서도 정부와 정치권이 책임 있는 자세로 실마리를 풀어야 한다는 목소리가 비등하다. 롯데그룹은 중국 정부의 보복으로 엄청난 손실을 입고 있고 현대차는 반한 감정이 커지는 중국과 도널드 트럼프 대통령의 압박이 거센 미국에서 판매 감소에 직면했다. 삼성전자의 반도체와 스마트폰 사업도 중국의 거센 추격에 위기감이 커지고 있다.철강과 석유화학업계는 보호무역주의가 강화되면서 빨간불이 켜졌다. 미국은 지난해 열연과 냉연 등 국내 기업의 철강재에 대한 관세 폭탄을 부과한 바 있고 국내 기업의 합성고무 제품 등에 대해서도 반덤핑 조사를 진행 중이다. 해운과 조선업계는 상황이 더 심각하다. 세계 10대 수출국의 유일한 대형 선사인 현대상선은 글로벌 선사들과의 저운임 경쟁에서 고군분투하고 있으며 조선업계는 극심한 수주 가뭄으로 올해가 최대 고비다. 조선업계 한 관계자는 “대우조선해양의 존폐가 사실상 조선업계의 최대 현안”이라며 “신규 수주가 제한된 상황에서 기존 수주한 선박 건조를 위한 운영비도 필요하다”고 설명했다. 글로벌 산업 영토 확대를 위한 기업들의 움직임에도 힘을 실어줘야 한다는 지적도 나온다. 국내 대기업들은 미래의 새로운 먹거리와 지속 성장을 위해 적극적인 인수합병(M&A)을 추진하고 있는데 대통령 탄핵 등 정치 혼란이 이어지면서 정부의 우회 지원은 꿈도 꾸지 못하는 상황이다. 재계의 한 관계자는 “최순실 국정농단 사태로 글로벌 경영에 나서고 외국 기업에 신뢰와 의지를 보여줘야 할 기업 총수들이 발목이 잡혀 있는 상황”이라며 “당장 문제가 되지 않는다면 기업의 경영 활동에 숨통을 틔워줘야 한다”고 말했다. 국내에서 풀어야 할 현안도 만만찮다. 석유화학업계와 제조업계의 경우 탄소배출권 할당량의 재조정이 필요하고 정유업계와 에너지업계는 석유와 가스 부담이 높은 수송용 에너지에 대한 과세 문제를 해결해야 한다. 정유업계의 한 관계자는 “탄핵 정국에 휘말려 업계마다 첨예하게 대립 중인 사안들이 적지 않다”며 “정부의 조정 능력이 어느 때보다 절실하다”고 전했다. /박성호·강도원·한재영기자 junpark@sedaily.com[서울경제 바로가기]빨라진 \'대선시계\'... 이미 시작된 19대 대선 [바로가기]서울경제와 친해지는 가장 확실한 방법 [페이스북]저작권자 ⓒ 서울경제, 무단 전재 및 재배포 금지서울경제 관련뉴스해당 언론사에서 선정하며 언론사 페이지(아웃링크)로 이동해 볼 수 있습니다.[박대통령 탄핵-새 정부 출범시나리오] 취임 첫 인사는 靑 인선...청와대팀이 사실상 인수위 역할[朴대통령 탄핵]산업부, 긴급 회의···\'朴 대통령 파면\' 실물경제 파장 논의[朴대통령 탄핵] 떡, 꽃 나눠주며 축제의 장 된 광화문광장[朴대통령 탄핵]종교계 ""갈등 봉합하고 국민 통합해야""[朴대통령 탄핵]검찰, 박前대통령 수사에 박차 가하나좋아요0훈훈해요0슬퍼요0화나요0후속기사 원해요0기사제공 :']"
7,삼성전자, 2017-03-1109:42,노컷뉴스 ,"삼성전자, 10개국 반독점 승인…美 하만 인수절차 마무리",https://finance.naver.com/news/news_read.nhn?article_id=0002940263&office_id=079&mode=search&query=삼성전자&page=2,"['       삼성전자, 10개국 반독점 승인…美 하만 인수절차 마무리      기사입력2017-03-11 09:42기사원문좋아요훈훈해요좋아요 평가하기공감좋아요0훈훈해요0슬퍼요0화나요0후속기사 원해요0댓글브랜드와 임직원은 유지하며 삼성과 독립경영[CBS노컷뉴스 이용문 기자]삼성전자 서초사옥. (사진=황진환 기자/자료사진)삼성전자가 미국 등 10개 나라 반독점 당국의 승인을 획득함에 따라 인수를 위한 모든 절차를 마무리했다.삼성전자는 하만 주주총회를 거쳐 정부당국의 승인을 받음으로써 미국 현지시간으로 10일자로 하만 인수를 완료했다고 11일 밝혔다.인수절차가 마무리됨에 따라 하만의 주주들은 보유주식 1주당 112달러의 현금을 지급받게 됐고 삼성전자 미국법인(SEA)은 하만의 지분 100%를 보유하게 됐다.손영권 삼성전자 전략혁신센터(SSIC) 사장 겸 하만 이사회 의장은 ""삼성전자와 하만은 오디오, 가전, 스마트폰 등 다양한 분야에서 기술과 경험을 공유함으로써 고객들에게 혁신적이고 독창적인 제품과 차별화된 경험을 제공하고, 커넥티드카 분야의 기술혁신을 선도해 완성차 업체에게 최고의 파트너가 될 것""이라고 밝혔다.디네쉬 팔리월(Dinesh Paliwal) 하만 CEO(사장)는 ""삼성은 하만이 보유한 고객과의 신뢰관계는 물론 스피드와 혁신을 중시하는 문화를 공유할 수 있는 가장 이상적인 주주이자 파트너""라면서 ""이번 인수합병을 통해 주주, 고객, 임직원 모두에게 새로운 가치와 기회를 제공하고, 자동차 전장과 오디오 등의 분야에서 성장을 가속화해 글로벌 리더십을 강화할 것""이라고 말했다.인수 절차가 마무리됨에 따라, 삼성전자 전장사업팀은 삼성이 보유한 혁신적인 기술들을 하만의 전장 제품에 접목하고, 구매, 물류, 마케팅 등 여러 분야에서 시너지를 낼 수 있도록 하만과 협력을 확대해 나갈 방침이다.하만은 디네쉬 사장을 비롯한 현재의 경영진에 의해 독립적으로 경영되며, 임직원과 본사, 해외사업장은 물론 하만이 보유한 브랜드도 그대로 유지할 계획이라고 삼성은 밝혔다.mun8510@cbs.co.kr저작권자 © CBS 노컷뉴스(www.nocutnews.co.kr) 무단전재 및 재배포 금지 노컷뉴스 관련뉴스해당 언론사에서 선정하며 언론사 페이지(아웃링크)로 이동해 볼 수 있습니다.[박근혜 파면] 윤종신, 이정미 헤어롤에 ""짠하고 뭉클""\'썰전\' 유시민 ""새누리당 당명 확보는 탄핵인용 대비한 것""[탄핵 심판] 헌법재판관 전원출근…급했던 이정미 대행[박근혜 파면] 최순실은 대성통곡…장시호 눈물은 왜?\'朴 탄핵\' 뉴스에 미국인들 ""그런데 트럼프는?""좋아요0훈훈해요0슬퍼요0화나요0후속기사 원해요0기사제공 :']"
8,삼성전자, 2017-03-1109:30,이데일리 ,"삼성전자, 드디어 美하만 품에 안다",https://finance.naver.com/news/news_read.nhn?article_id=0003769852&office_id=018&mode=search&query=삼성전자&page=2,"['       삼성전자, 드디어 美하만 품에 안다      기사입력2017-03-11 09:30기사원문좋아요훈훈해요좋아요 평가하기공감좋아요0훈훈해요0슬퍼요0화나요0후속기사 원해요0댓글- 삼성전자, 10일 반독점 심사대상국 승인 등 모든 절차 마무리디네쉬 팔리월 하만(Harman) 최고경영자(가운데)가 지난해 11월21일 서울 서초구 삼성전자 사옥에서 열린 미디어 간담회에서 삼성전자 전략혁신센터 손영권 사장(왼쪽), 전장사업팀 박종환 부사장과 취재진을 위한 포즈를 취했다. (사진=연합뉴스)[이데일리 성세희 기자] 삼성전자(005930)가 세계적인 오디오 전문 업체이자 자동차 전장(전자장비) 업체 인수를 완료했다.삼성전자는 10일(현지시간) 미국을 비롯한 반독점 심사대상국 10개국 승인을 마치는 등 모든 하만(Harman) 인수 절차를 마무리했다. 삼성은 지난해 11월14일(현지시간) 하만과 인수 계약을 체결하고 지난달 17일(현지시간) 하만 주주총회에서 합병 승인을 받았다. 삼성전자 미국법인(SEA)은 앞으로 하만 지분 100%를 보유한다. 기존 하만 주주는 삼성전자로부터 보유주식 1주당 112달러를 지급받는다. 인수 절차를 마무리한 삼성전자 전장사업팀은 삼성이 보유한 혁신적인 기술을 하만의 전장 제품에 접목할 예정이다. 또 구매와 물류, 마케팅 등 여러 분야에서 시너지를 낼 수 있도록 하만과 협력하기로 했다. 인수 후에도 디네쉬 팔리월(Dinesh Paliwal) 하만 사장을 비롯한 현재 경영진이 지금처럼 하만을 독립적으로 경영한다. 삼성전자는 하만 임직원과 본사, 국외 사업장과 하만 산하 브랜드도 그대로 유지할 계획이다. 디네쉬 사장은 “삼성이 하만의 고객과 신뢰관계를 유지하며 속도와 혁신을 중시하는 문화를 공유할 수 있는 가장 이상적인 주주이자 동반자”라며 “이번 인수합병(M&A)으로 주주와 고객, 임직원 모두에게 새로운 가치와 기회를 제공해 자동차 전장과 오디오 등의 분야에서 가속 성장하겠다” 라고 말했다.손영권 삼성전자 전략혁신센터(SSIC) 사장 겸 하만 이사회 의장도 “삼성전자와 하만이 오디오, 가전, 스마트폰 등 다양한 분야에서 기술과 경험을 공유해 고객에게 혁신적이고 독창적인 제품과 차별화된 경험을 제공하겠다”라며 “커넥티드카 분야에서 기술혁신을 선도해 완성차 업체의 최고의 파트너가 되겠다”라고 말했다.성세희 (lucia@edaily.co.kr)＜ⓒ종합 경제정보 미디어 이데일리 - 무단전재 & 재배포 금지＞이데일리 관련뉴스해당 언론사에서 선정하며 언론사 페이지(아웃링크)로 이동해 볼 수 있습니다.촛불 朴퇴진은 시작일 뿐 VS 태극기 불복종 운동 전개[박근혜 파면] 美 ""한국에 사드 장비 계속 보낸다""(종합)촛불 ""지금 당장 박근혜 구속하라""男, 재혼 후 원만한 부부관계 유지 요건 2위 \'성적취향\' 1위는?솔로탈출 촉진제 1위 男 \'옥외 애정행위\' 女 \'연인 기념일\'좋아요0훈훈해요0슬퍼요0화나요0후속기사 원해요0기사제공 :']"
9,삼성전자, 2017-03-1109:25,SBS ,"삼성전자, 하만 인수 완료…단숨에 글로벌 전장 업체로",https://finance.naver.com/news/news_read.nhn?article_id=0000512059&office_id=055&mode=search&query=삼성전자&page=2,"['       삼성전자, 하만 인수 완료…단숨에 글로벌 전장 업체로      기사입력2017-03-11 09:25기사원문좋아요훈훈해요좋아요 평가하기공감좋아요0훈훈해요0슬퍼요0화나요0후속기사 원해요0댓글삼성전자가 미국의 자동차 전장 업체 하만 인수를 완료했습니다.삼성전자는 현지시간으로 어제(10일) 미국을 비롯한 10개 반독점 심사 대상국의 승인 등 인수에 필요한 모든 절차를 마치고 하만을 인수했다고 밝혔습니다.지난해 11월 14일 하만과 인수 계약을 체결한 지 약 4개월 만입니다.지난달 18일에는 하만이 주주총회를 열어 승인을 받아냈습니다.삼성전자는 총수인 이재용 부회장 구속이라는 비상 상황 속에서도 9조 원대 \'빅딜\'을 안정적으로 성사시켰습니다.미래 성장동력으로 지목해 진출을 추진해온 전장 사업 분야에서 삼성은 확고한 사업 기반을 마련하며 단숨에 글로벌 메이저 전장업체로 이름을 올리게 됐습니다.인수 완료에 따라 하만의 주주들은 보유주식 1주당 112달러의 현금을 받게 됩니다.삼성전자는 미국법인 SEA를 통해 하만의 지분을 100% 보유하게 됩니다.하만의 경영은 디네쉬 팔리월 하만 CEO을 비롯한 현재 경영진이 독립적으로 계속합니다.임직원과 본사, 해외사업장은 물론 하만이 보유한 브랜드도 그대로 유지됩니다.\xa0정혜진 기자(hjin@sbs.co.kr)☞ [SBS LIVE] 박근혜 대통령 탄핵… 파면 결정※ ⓒ SBS & SBS콘텐츠허브 : 무단복제 및 재배포 금지SBS 관련뉴스해당 언론사에서 선정하며 언론사 페이지(아웃링크)로 이동해 볼 수 있습니다.만장일치 결정에 \'충격\'…박 전 대통령, 아직도 청와대에헌재가 본 파면 사유는 하나…""최순실 위해 권한 남용""인터넷망 설치하며 준비…박 전 대통령, 사저 복귀 언제?담담한 척했던 최순실…장시호 ""이모, 대성통곡했다""""VIP가…"" 박 전 대통령 운명 가른 결정적 증언들좋아요0훈훈해요0슬퍼요0화나요0후속기사 원해요0기사제공 :']"
10,삼성전자, 2017-03-1109:17,아시아경제 ,"삼성전자 '전장사업' 탄력, 하만 인수 완료",https://finance.naver.com/news/news_read.nhn?article_id=0003950637&office_id=277&mode=search&query=삼성전자&page=2,"['       삼성전자 \'전장사업\' 탄력, 하만 인수 완료      기사입력2017-03-11 09:17기사원문좋아요훈훈해요좋아요 평가하기공감좋아요0훈훈해요0슬퍼요0화나요0후속기사 원해요0댓글삼성전자 미국법인이 하만 지분 100% 확보…오디오, 가전, 스마트폰 등 시너지 효과 기대 [아시아경제 류정민 기자] 삼성전자가 세계적인 전장기업인 하만 인수를 완료했다.  삼성전자는 지난해 11월14일 하만과 인수 계약을 체결한 이후, 하만 주주총회 승인, 미국을 비롯한 10개 반독점 심사 대상국의 승인 등 인수에 필요한 모든 절차를 마쳤다고 11일 밝혔다. 삼성전자의 인수가 마무리되면서 하만 주주들은 보유주식 1주당 112달러의 현금을 지급받게 됐다. 삼성전자 미국법인(SEA)은 하만의 지분 100%를 보유하게 된다.삼성전자 손영권 사장과 하만 디네쉬 팔리월 CEO가 1월5일(현지시간) 미국 라스베이거스의 하드락 호텔(Hard Rock Hotel)에 마련된 약 440평 규모의 하만 전시장에서 자율주행용 사용자경험(user experience)을 구현한 오아시스 컨셉차량을 소개하고 있다.삼성전자 전장사업팀은 삼성이 보유한 혁신적인 기술들을 하만의 전장 제품에 접목하고, 구매, 물류, 마케팅 등 여러 분야에서 시너지를 낼 수 있도록 하만과 협력을 확대해 나갈 방침이다.하만은 현재의 경영진에 의해 독립적으로 경영된다. 임직원과 본사, 해외사업장, 하만이 보유한 브랜드도 그대로 유지할 계획이다.손영권 삼성전자 전략혁신센터(SSIC) 사장 겸 하만 이사회 의장은 ""삼성전자와 하만은 오디오, 가전, 스마트폰 등 다양한 분야에서 기술과 경험을 공유함으로써 고객들에게 혁신적이고 독창적인 제품과 차별화된 경험을 제공하고, 커넥티드카 분야의 기술혁신을 선도해 완성차 업체에게 최고의 파트너가 될 것""이라고 말했다.디네시 팔리웰 하만 CEO(사장)는 ""삼성은 하만이 보유한 고객과의 신뢰관계는 물론 스피드와 혁신을 중시하는 문화를 공유할 수 있는 가장 이상적인 주주이자 파트너""라고 말했다. 디네시 사장은 ""이번 인수합병을 통해 주주, 고객, 임직원 모두에게 새로운 가치와 기회를 제공하고, 자동차 전장과 오디오 등의 분야에서 성장을 가속화해 글로벌 리더십을 강화할 것""이라고 밝혔다.류정민 기자 jmryu@asiae.co.kr▶ 세상의 모든 재미 [티잼]▶ 카드뉴스 ▶ 오늘의 운세아시아경제 관련뉴스해당 언론사에서 선정하며 언론사 페이지(아웃링크)로 이동해 볼 수 있습니다.[속보]삼성동 간다던 박근혜, 알고봤더니…대반전[속보]""큰일났다"" 박근혜 파면되자 2차 탈당 러시가…[속보]""문재인, 대통령 돼도…"" 충격 보도박근혜 탄핵 경정되자 청와대 참모진 전격…박근혜 파면 발표되는 순간 일본 언론은…좋아요0훈훈해요0슬퍼요0화나요0후속기사 원해요0기사제공 :']"
