,회사명,날짜,언론사,기사제목,링크,본문
17,삼성전자, 2017-08-0417:06,세계일보 ,"섬성전자 스마트폰 2분기 판매, 마이너스 뒷걸음",https://finance.naver.com/news/news_read.nhn?article_id=0003197871&office_id=022&mode=search&query=삼성전자&page=1,"['       섬성전자 스마트폰 2분기 판매, 마이너스 뒷걸음      기사입력2017-08-04 17:06기사원문좋아요훈훈해요좋아요 평가하기공감좋아요0훈훈해요0슬퍼요0화나요0후속기사 원해요0댓글세계시장 4% 성장에도 불구하고 높은 가격에 실적 저조애플 2% 성장, 중국 스마트폰 3사는 두 자릿수 약진출처=캐널리스지난 2분기 전세계 스마트폰 판매가 전년 동기대비 4%대 성장세를 나타난 가운데 삼성전자의 스마트폰 판매 성장률이 마이너스를 기록했다는 통계가 나와 주목된다.이에 비해 애플은 2%대, 화웨이와 오포 등 중국 스마트폰제조업체들은 두 자릿수 성장률을 보이며 대약진한 것으로 집계됐다.3일(현지시간) IT 시장조사업체인 캐널리스(Canalys)의 리포트에 따르면 삼성 전자는 2 분기에 7900 만 대의 스마트 폰을 판매, 세계 1위 자리를 지켰다. 하지만 이는 ??작년 같은 기간의 8000 만대 판매에 비해 약간 줄어든 것이다.같은 기간 중 애플의 경우는 4100만대를 팔아 판매량이 전년 대비 2% 늘어났다. 이는 신제품이 없는 상황에 이뤄낸 결과여서 상당히 선전한 것으로 평가된다.그 뒤를 이어 중국의 화웨이가 같은 기간 중 20% 늘어난 3300만대를 기록했고 4위 오포와 5위 샤오미는 각각 44%, 52%의 판매증가율을 보였다.팀 코울링 캐널리스사 수석애널리스트는 이에 대해 ""갤럭시 S8의 판매는 일부 지역에서 강세를 보였으나 이는 유럽지역의 재고 축적이 원인이었던 것으로 파악됐다""고 밝혔다.특히 그는 ""삼성전자의 신제품 갤럭시 S8의 높은 단가가 판매부진의 원인""이라며 ""이는 안드로이드 스마트폰 가격 책정의 한계를 시험해본 것과 같다""고 평가했다.코울링은 또 애플의 10주년 기념폰 아이폰8과 관련해서도 ""애플이 아이폰8의 가격을 높게 책정한다면 기능과 디자인 모두에서 가시적인 개선이 있어야 할 것""이라고 주장했다.한편 화웨이와 오포, 샤오미 등 중국의 스마트폰 3총사는 고기능에도 불구하고 비교적 낮은 가격으로 북미를 제외한 세계시장을 잠식하고 있는 것으로 분석됐다.임정빈 선임기자 jblim@segye.comⓒ 세상을 보는 눈, 글로벌 미디어 세계일보세계일보 관련뉴스해당 언론사에서 선정하며 언론사 페이지(아웃링크)로 이동해 볼 수 있습니다.""카페컵에 아이가 소변을…"" \'맘충\' 논란분만실에 들어와 며느리 출산과정 구경한 시어머니두달째 점심 사달라고 하는 여직원에 폭발한 상사""국민 머릿속 바꿔라"" 국정원 선거여론 조작 깊숙이\'이혼\' 하리수 ""과거 자궁이식도 고민했지만…""좋아요0훈훈해요0슬퍼요0화나요0후속기사 원해요0기사제공 :']"
18,삼성전자, 2017-08-0416:51,아시아경제 ,"DVRC 반영민 방한 미국투자이민 세미나… 12일 1시, ‘PTC-2차’ 프로젝트...",https://finance.naver.com/news/news_read.nhn?article_id=0004049010&office_id=277&mode=search&query=삼성전자&page=1,"['       DVRC 반영민 방한 미국투자이민 세미나… 12일 1시, ‘PTC-2차’ 프로젝트 소개      기사입력2017-08-04 16:51기사원문좋아요훈훈해요좋아요 평가하기공감좋아요0훈훈해요0슬퍼요0화나요0후속기사 원해요0댓글미국투자이민 DVRC의 ‘SEPTA-2차’ 프로젝트 이민 청원 승인 기간이 평균 10.41개월로 빠른 진행을 보이고 있으며 가장 짧은 승인 기록은 9.1개월, 가장 긴 기간은 12.9개월로 나타났다.DVRC 반영민 이사는 오는 12일 1시 국민이주 초청, ‘미국투자이민’ 세미나 참석 차 방한한다. 반 이사는 델라웨어밸리 리저널센터(이하 DVRC)가 올해부터 모집 중인 미국투자이민 ‘PTC-2차’ 프로젝트 정보를 투자자에게 직접 설명할 예정이다. 리저널센터 미국투자이민 프로그램은 미국에 50만 불 투자하고 고용을 창출하는 외국인에게 영주권을 부여하는 제도로 트럼프 행정부 출범 이후, 오는 9월까지 임시 연장된 바 있다. ▶보기 드문 주정부 미국투자이민 프로젝트DVRC는 2015년 미국투자이민 ‘PTC-1차’ 프로젝트에 400명의 투자자를 조기 모집한데 이어 올해 ‘PTC-2차’ 프로젝트 투자자를 모집 중이다. 펜실베이니아 유료고속도로(Pennsylvania Turnpike)는 미국에서 두 번째로 큰 규모의 유료고속도로로 확장 공사 자금으로 미국투자이민자금을 활용할 예정이다. 1940년에 개통한 PA 유료고속도로는 통행량 증가에 따른 시설 확장 필요성과 쾌적한 운전환경을 제공하고자 2014년부터 공사가 진행 중이며 공사는 2020년에 마무리될 예정이다.  ▶DVRC 빠른 이민 수속 기록 2015년부터 이민 청원이 이뤄진 ‘PTC1차’ 프로젝트는 400건 중 380건 이상이 이민 승인을 받았다. 또한 DVRC의 다른 프로젝트인 ‘SEPTA-2차’ 프로젝트 이민 청원 승인 기간이 평균 10.41개월로 빠른 진행을 보이고 있으며 가장 짧은 승인 기록은 9.1개월, 가장 긴 기간은 12.9개월로 나타났다. 미 이민국이 밝힌 이민청원(I-526) 승인 소요 기간은 평균 19개월(5월 31일 발표)에 비해 무려 9개월 짧은 것으로 나타났다.    ▶2014년 착공, 공공기관 자금 22% 집행한 ‘PTC-2차’‘펜실베이니아 유료고속도로 확장공사(PTC-2)’ 프로젝트는 미국투자이민 프로그램으로는 보기 드문 100% 주정부 프로젝트로 주정부 기관인 펜실베이니아 유료 고속도로 위원회(PTC)가 직접 관리한다. PTC는 17억5천1백만달러 공사자금의 54%를 충당하고 원금상환도 직접 담당한다. 이 프로젝트는 지난 3월 미 이민국 사전승인(exemplar)을 받았으며 5월 현재, PTC가 충당해야 할 자금의 40%를 집행한 상태다. 현재 4차선 도로를 갓길이 있는 6차선으로 확장하고 도로의 조명, 방음벽, 축대벽과 육교와 터널 등도 새로 설치하게 된다. 투자 기간은 5년이며 원금은 현금이나 주정부 지방채권으로 상환하게 된다. PTC가 발행하는 채권은 A/A+ 등급으로 대한민국 국채, 삼성전자 회사채 등급과 비슷한 등급이다.    세미나 참석은 국민이주㈜ 홈페이지나 전화를 이용, 사전예약제로 운영하고 있다. 박진우 기자 takerap@aisae.co.kr▶ 뉴스가 재밌다! 세상의 모든 재미 [티잼]▶ #아시아경제, #오늘의 많이 본 뉴스(클릭!)아시아경제 관련뉴스해당 언론사에서 선정하며 언론사 페이지(아웃링크)로 이동해 볼 수 있습니다.사드보복 중국에…정부의 강력한 한방""국정원 사태 난리났다"" 이명박 결국 검찰에…""김기덕, 여배우에게 성기 잡도록 강요…영상 있다"" 충격문대통령 휴가중인데…""북한과 전쟁"" 긴급 선언""나이 들어 자주하면…"" 충격적 섹스 연구결과좋아요0훈훈해요0슬퍼요0화나요0후속기사 원해요0기사제공 :']"
19,삼성전자, 2017-08-0416:26,조선비즈 ,"[마켓뷰] 코스피, 너무 예민했나…조정 우려 견디고 반등",https://finance.naver.com/news/news_read.nhn?article_id=0000378757&office_id=366&mode=search&query=삼성전자&page=1,"['       [마켓뷰] 코스피, 너무 예민했나…조정 우려 견디고 반등      기사입력2017-08-04 16:26기사원문좋아요훈훈해요좋아요 평가하기공감좋아요0훈훈해요0슬퍼요0화나요0후속기사 원해요0댓글 코스피지수가 조정국면에 대한 우려가 나오고 있지만 반등에 성공했다. 외국인은 이틀 연속 매도세를 이어갔다.4일 코스피지수는 전날보다 0.36%(8.60포인트) 오른 2395.45에 마감했다.전날인 3일 코스피지수는 2390선 아래로 떨어지며 지난 7월 초 수준으로 회귀했다. 외국인은 유가증권시장에서 현물과 선물을 모두 대량으로 매도했다. 이에 증권업계는 당분간 조정국면이 지속될 수 있다는 우려를 제기했다.하지만 걱정했던 바와 달리 코스피지수는 이날 상승 마감했다. 앞서 투자 심리를 얼어 붙게 만들었던 요인들이 필요 이상으로 반영됐다는 시각이 영향을 미친 것으로 보인다.다음주는 관망세가 이어질 것으로 예상된다. 다만 전문가들은 달러화 약세가 지속될 가능성이 높고, 3분기 실적 개선세를 따져봤을 때 소재와 산업재 부문이 투자 전략으로 유망하다고 제시했다.코스닥 지수는 전날보다 0.23%(1.51포인트) 하락한 641.58에 마쳤다. 코스닥 하락에는 휴젤(145020), 메디톡스(086900), 코미팜(041960), 셀트리온헬스케어(091990)등 바이오·헬스케어 관련주의 부진이 영향을 미쳤다.◆ 외국인 순매도, 기관은 순매수…“전날 우려 과도했다”이날 외국인은 여전히 순매도를 했지만 기관이 그 이상으로 순매수를 하며 코스피지수를 끌어올렸다. 외국인은 1633억원 순매도했고, 기관은 2145억원 순매수했다.기관 중에서도 특히 연기금이 530억원 순매수해 두드러진 매수세를 보였다.박성현 삼성증권 연구원은 “전날 지정학적 리스크, 부동산 대책, 세법 개정안 등 복합적인 이유가 촉매제가 돼서 코스피지수를 끌어내렸다”며 “다만 각종 정부 대책들을 침소봉대하고 여기에 지정학적 리스크까지 갖다 붙이며 코스피가 과도하게 빠진 측면이 있다”고 지적했다.이어서 그는 “투자자들은 시간이 지나 확대 해석한 부분에 대해 시각을 다시 조정하게 됐다”며 “결과적으로 추가로 빠진 부분들이 오늘 장에서 다시 되돌아 온 것”이라고 진단했다.정다이 메리츠종금증권 연구원은 “외국인이 1000억원 이상 팔았지만 전날 4000억원 순매도한 것과 비교하면 부담이 되지 않는 수준”이라며 “기관 자금 중심으로 저가 매수세가 유입되며 지수를 받쳐줬다”고 평가했다.서상영 키움증권 연구원은 “전날 하락에 따른 반발 매수세가 유입됐다”며 “기관, 특히 기금과 정부 등의 적극적인 순매수에 힘입어 상승할 수 있었다”고 전했다.◆ 화학·철강 등 소재 업종에 수급 몰려…“IT 부담에 대안 찾아가는 과정”수급에서 기관이 장을 주도했다면, 업종으로는 정유와 화학, 철강 등 소재가 증시를 끌어올렸다. 전문가들은 장이 쉬어가는 흐름 속에서 투자자들이 IT에 대한 대안을 찾는 과정이라고 해석했다.LG화학(051910)과 SK이노베이션(096770), S-Oil(010950), 롯데케미칼(011170)등이 모두 4% 넘게 올랐고, SK(034730)도 2% 넘게 상승했다. POSCO(005490)는 1.21% 올랐다.또 이들 업종은 외국인과 기관이 모두 순매수했다. 화학은 외국인이 522억원, 기관이 566억원 순매수했다. 철강은 외국인이 135억원, 기관이 135억원 순매수했다.반면 국내 주도업종인 IT에서 삼성전자(005930)와 SK하이닉스(000660)는 여전히 부진했고, LG전자(066570)는 5% 가까이 오르며 선방했다.박성현 연구원은 “IT가 국내 주식시장에서 여전히 펀더멘털(체력)이 가장 좋은 업종이지만 글로벌 IT조정으로부터 완전히 자유롭다고 볼 수는 없다”며 “이에 대한 대안으로 최근 회복세를 보이기 시작한 화학과 철강 등 소재 산업 위주로 수급이 몰리는 것”이라고 설명했다.정다이 연구원도 “코스피지수가 주춤하자 지금까지 빠졌던 종목 위주로 회복하는 모습을 보이고 있다”며 “화학 등 소재도 마찬가지지만 IT도 삼성전자와 SK하이닉스를 제외하면 LG전자나, 삼성전기(009150), 삼성SDI(006400)등이 반등했다”고 말했다.◆ 다음주, 2분기 실적이 미치는 영향은 제한…소재·산업재 유망다음주는 실적 시즌이 끝나가는 만큼 기업실적 발표가 미치는 영향력은 약해질 전망이다. 또 여전히 정부 정책과 환율에 대한 불확실성이 남아있는 만큼 관망세가 이어질 것으로 보인다.김한진 KTB투자증권 연구원은 “주택시장 규제책과 환율변동 위험으로 관망 분위기가 예상된다”며 “일부 종목의 차익실현 욕구가 증대되고 실적 재료의 공백, 국내 주택시장 규제책으로 전체 지수는 보합세를 이어갈 것”이라고 내다봤다.김병연 NH투자증권 연구원은 “포트폴리오 관점에 있어서 달러 가치의 지표인 달러인덱스의 향방이 중요해졌다”며 “현재 달러 인덱스는 최근 2년 사이 박스권 하단에 위치해 있어 기술적인 반등은 가능하지만 추세적으로 달러 강세를 촉발시킬 요인은 많지 않다”고 지적했다.이어서 그는 “결국 달러화 가치는 박스권 하단에서 횡보하거나 소폭 약세가 지속될 것으로 판단된다”며 “달러화 약세는 원자재 가격 상승으로 이어지는 등 소재와 산업재 업종의 우세가 지속될 것으로 보인다”고 기대했다.김유겸 케이프투자증권 연구원은 “정부 정책에 따른 시장 조정이 추가적으로 진행될 가능성은 높지 않을 것”이라며 “2분기 실적 발표는 마무리돼가고 있기 때문에 정유나 화학, 철강, 은행 등 2분기 대비 3분기 이익 증가가 예상되는 업종을 중심으로 주식 비중을 확대하는 전략이 유효하다”고 전했다.[박현익 기자 beepark@chosunbiz.com]chosunbiz.com조선비즈 관련뉴스해당 언론사에서 선정하며 언론사 페이지(아웃링크)로 이동해 볼 수 있습니다.""한국 가지 말라니깐…"" 골치 아픈 중국결국 터질게 터졌다…또다시 보복 퍼붓는 중국현대차 부진 속 약진하는 \'효자 중의 효자\'中 ""이제 쓰레기 수입 안해""…당장 한국 비상베트남 제사상에 떡…한국 사랑, 이 정도 일 줄좋아요0훈훈해요0슬퍼요0화나요0후속기사 원해요0기사제공 :']"
0,삼성전자, 2017-08-0416:24,아이뉴스24 ,[마감시황]코스피 반등…기관 매수세에 2390선 회복,https://finance.naver.com/news/news_read.nhn?article_id=0000419881&office_id=031&mode=search&query=삼성전자&page=2,"['       [마감시황]코스피 반등…기관 매수세에 2390선 회복      기사입력2017-08-04 16:24기사원문좋아요훈훈해요좋아요 평가하기공감좋아요0훈훈해요0슬퍼요0화나요0후속기사 원해요0댓글[아이뉴스24 김나리기자] 전날 급락했던 코스피가 기관 매수세에 힘입어 하루만에 반등에 성공했다.4일 코스피지수는 전날보다 0.36%(8.60포인트) 상승한 2395.45에 마감했다. 코스피는 장중 한때 2400.33까지 오르며 2400선을 다시 회복하기도 했다.코스피를 끌어올린 것은 기관이었다. 개인이 945억원, 외국인이 1천634억원어치를 순매도한 가운데 기관은 나홀로 2천145억원어치를 순매수했다. 하나금융투자는 ""낙폭이 과대하다는 인식과 세법개정안 등의 규제 자체가 증시에 직접적인 영향이 크지 않을 것이라는 분석 등이 나오면서 투자심리가 진정돼 코스피가 반등한 것으로 보인다""고 풀이했다.시가총액 상위 10종목은 혼조였다. 시총 대장주인 삼성전자가 전날보다 0.17% 하락했고 SK하이닉스와 네이버도 각각 2.29%, 0.26% 내렸다. 반면 삼성전자우는 0.11% 상승했고, 현대차(1.01%), 포스코(1.21%), 한국전력(0.57%), 삼성물산(1.45%), 신한지주(2.26%), 현대모비스(1.80%)는 올랐다.IT대형주도 혼조를 보였다. 삼성전자, SK하이닉스가 하락한 가운데, LG이노텍은 -0.31%, LG디스플레이는 -0.80% 내렸지만 삼성전기는 1.08%, 삼성에스디에스는 0.56%, 삼성SDI는 3.42%, LG전자는 4.97 올랐다. 정부의 8.2 부동산 대책이 발표되면서 급락했던 건설주들은 이날 반등했다. 대우건설은 2.74%, GS건설은 2.50%, 두산건설은 1.17%, 삼성물산은 1.45%, 현대건설은 1.31%, 대림산업은 1.37%, 금호산업은 0.47% 올랐다. 이에 코스피 건설업 지수는 1.16% 상승했다.업종별로는 등락이 엇갈렸다. 운수창고가 2%대 상승한 가운데 철강금속, 운수장비, 유통업 등이 1%대 상승했다. 의료정밀, 통신업은 1%대 약세를 보였다. 보험(0.87%), 서비스업(-0.83%), 비금속광물(-0.71%) 등도 내렸다.코스닥지수는 전날보다 0.23%(1.51포인트) 하락한 641.58에 마감했다.코스닥시장에서는 개인이 790억원어치 샀고 외국인은 330억원어치, 기관은 396억원어치를 팔았다.한편 서울 외환시장에서 원/달러 환율은 전 거래일보다 3.80원(0.34%) 내린 1125.00원을 기록했다./김나리기자 lily@inews24.com▶프리미엄 뉴스서비스 아이뉴스24▶연예스포츠 조이뉴스24, 생생한 라이브캐스트[ⓒ 아이뉴스24 무단전재 및 재배포 금지]아이뉴스24 관련뉴스해당 언론사에서 선정하며 언론사 페이지(아웃링크)로 이동해 볼 수 있습니다.CJ제일제당, 원재료 가격 하락에 2Q 영업익 21.9% 감소수입식품 중량·유통기한 위조시 \'원스트라이크 아웃\'""믿을 건 신차 뿐""…하반기 달굴 뉴페이스는?\'발등에 불\' 도시바, 가장 큰 난관 WD \'흔들기\'구글, 스냅에 러브콜…작년 300억달러 제안좋아요0훈훈해요0슬퍼요0화나요0후속기사 원해요0기사제공 :']"
1,삼성전자, 2017-08-0416:24,매일경제 ,오늘의 레이더M 뉴스 (8월 5일),https://finance.naver.com/news/news_read.nhn?article_id=0003991628&office_id=009&mode=search&query=삼성전자&page=2,"['       오늘의 레이더M 뉴스 (8월 5일)      기사입력2017-08-04 16:24기사원문좋아요훈훈해요좋아요 평가하기공감좋아요0훈훈해요0슬퍼요0화나요0후속기사 원해요0댓글 ● 무디스, 삼성전자 등급전망 \'긍정적\' 상향● 8700억 벤처지원 예산은 그림의 떡?[매일경제 공식 페이스북] [오늘의 인기뉴스] [매경 프리미엄][ⓒ 매일경제 & mk.co.kr, 무단전재 및 재배포 금지]매일경제 관련뉴스해당 언론사에서 선정하며 언론사 페이지(아웃링크)로 이동해 볼 수 있습니다.조수향, 고혹미 넘치는 자태…이런 섹시美 처음이야전세계 돌풍 테슬라 \'모델3\', 내년 韓서 2천만원대에 산다박명수, ""내 말실수는 계산 된 것""집에 쓰레기 20t 두고 주차장서 거주…왜?이상인, \'11살 연하\' 아내와 행복한 키스 포착좋아요0훈훈해요0슬퍼요0화나요0후속기사 원해요0기사제공 :']"
