,회사명,날짜,언론사,기사제목,링크,본문
0,삼성전자, 2017-03-1921:12,한국경제TV ,[2017 부동산 로드쇼 in 부산] 박관식 한국토지개발원 대표 “평택 삼성전자 ...,https://finance.naver.com/news/news_read.nhn?article_id=0000536384&office_id=215&mode=search&query=삼성전자&page=1,"['       [2017 부동산 로드쇼 in 부산] 박관식 한국토지개발원 대표 “평택 삼성전자 주변 땅을 사야”      기사입력2017-03-19 21:12기사원문좋아요훈훈해요좋아요 평가하기공감좋아요0훈훈해요0슬퍼요0화나요0후속기사 원해요0댓글[한국경제TV 고영욱 기자]박관식 한국토지개발원 대표가 “평택 삼성전자 공장이 들어서는 곳을 주목해야 한다”고 말했습니다.박관식 대표는 18일 한국경제TV가 부산에서 주최한 ‘2017 부동산 로드쇼’에서 “수원 영통과 화성 동탄, 평택 등 삼성전자가 들어선 곳은 개발로 주변 땅 값이 급등했다”며 이 같이 말했습니다.박 대표는 “평택은 올해 정규직 만 명이 채용될 예정인데 이들을 수용하기 위해 판교신도시의 2배 크기 신도시가 생긴다”며 “평택 삼성전자 주변 쓸만 한 땅은 이미 평당 1천만 원을 넘은 상태”라고 말했습니다.박 대표는 이어 “개발지역에 투자 할 때는 보상이 이뤄질 때나 공장이 착공에 들어갈 때 사야 안전하다”고 덧붙였습니다.고영욱기자 yyko@wowtv.co.kr▶으시시한 웹툰  보러가기 ⓒ 한국경제TV, 무단 전재 및 재배포 금지한국경제TV 관련뉴스해당 언론사에서 선정하며 언론사 페이지(아웃링크)로 이동해 볼 수 있습니다.박명수 여의도 접촉사고 현장 포착\'··2억원 레인지로버에서 내리면서 한 말이?홍상수-김민희 행복, 세 번 멍든 홍상수 아내 ""지금 죽을 맛이다""\'설현\' 50kg 넘어 혼나는 모습 재조명...""살쪄서 죄송합니다""""시 쓰려면 성경험 있어야"" 여고생 제자 성폭행, 배용제 시인 구속서유리 ""남자친구에게 차이고 2달 만에 20kg 감량"" 비법은?좋아요0훈훈해요0슬퍼요0화나요0후속기사 원해요0기사제공 :']"
1,삼성전자, 2017-03-1921:00,연합뉴스 ,삼성전자 법인세만 3조원…10대그룹 5곳중 2곳 감소,https://finance.naver.com/news/news_read.nhn?article_id=0009119630&office_id=001&mode=search&query=삼성전자&page=1,"['       삼성전자 법인세만 3조원…10대그룹 5곳중 2곳 감소      기사입력2017-03-19 21:00기사원문좋아요훈훈해요좋아요 평가하기공감좋아요0훈훈해요0슬퍼요0화나요0후속기사 원해요0댓글 삼성전자 효과로 10대그룹 전체는 2.5% 증가(서울=연합뉴스) 윤선희 기자 = 10대그룹 상장사 5곳 중 2곳 이상은 실적 부진으로 법인세 비용이 줄어든 것으로 조사됐다.    그러나 1년새 법인세가 1조원 넘게 늘어난 \'삼성전자 효과\'로 10대그룹 상장사 전체 법인세 비용은 늘었다.     19일 재벌닷컴에 따르면 10대그룹 소속 87개 상장 계열사의 2016회계연도 별도기준 법인세 비용이 9조8천200억원으로 집계됐다.    이는 1년 전(9조5천810억원)보다 2.5%(2천390억원) 증가한 것이다.    그룹별로 보면 삼성그룹이 4조원으로 1년새 39.1% 늘었다.     GS그룹은 1천630억원으로 203.5% 늘었고 한화그룹은 2천230억원으로 68.6% 증가했다. 롯데그룹과 포스코그룹 법인세 비용도 각각 7천억원와 4천680억원으로 25.3%, 23.7% 늘었다.     반면 SK그룹 법인세 비용은 8천200억원으로 63.8% 줄었고 현대차그룹도 2조3천430억원으로 19.4% 감소했다.     10대그룹 상장사 전체 법인세 비용이 늘어난 것은 \'삼성전자 효과\' 때문이다.      지난해 삼성전자는 14조7천250억원의 세전이익을 내면서 법인세 비용도 3조1천450억원으로 1조원 이상 늘었다.     그러나 상장사 87곳 중 세전이익 감소로 법인세 비용이 없거나 감소한 곳은 37개사로 43%에 이른다.     현대자동차, 기아자동차, SK하이닉스, SK텔레콤, 롯데쇼핑, 롯데제과 등의 대기업은 세전이익 감소로 법인세 비용이 큰 폭으로 줄었다.    현대차가 8천410억원으로 32.4% 줄었고 기아차도 3천810억원으로 26.7% 감소했다.     또 SK하이닉스와 SK텔레콤도 3천70억원과 3천460억원으로 각각 68.8%, 4.7% 축소됐다. 롯데쇼핑은 1천10억원으로 16.5%, 롯데제과는 170억원으로 23.7% 각각 감소했다.     10대그룹 상장사 중 대한항공, 삼성SDI, 삼성중공업 등 14개사는 적자로 법인세 비용이 아예 없다.     법인세 비용이 늘어난 상장사 중에선 현대제철이 2천550억원으로 25.6%, 롯데케미칼이 4천840억원으로 57.3% 각각 늘었다. LG전자와 LG화학도 1천20억원과 3천640억원으로 각각 19.1%, 13.0% 증가했다. ◇ 10대그룹 상장사 법인세 비용                                                      (단위: 십억원, %, %P)  ※ 감사보고서(별도기준). 법인세 비용 ( - )는 법인세 수익         ※ 한진그룹은 세전적자로 유효세율 없음             indigo@yna.co.kr최신 유행 트렌드 총집결 #흥(클릭!)연합뉴스 관련뉴스해당 언론사에서 선정하며 언론사 페이지(아웃링크)로 이동해 볼 수 있습니다.\xa0""탈북여성 20대 4천달러, 40대 2천달러에 팔려""\xa0엄효섭 ""조성하와 30년지기…배추 장사도 함께해 봤죠""\xa0숯불에 독주 쏟았다가…3세 아이 숨지게 한 식당직원 집유\xa0해병 누드사진 파문 확산…남성군인 성행위 사진까지\xa0[블랙박스] 사고 유발하는 갑작스런 불법 유턴좋아요0훈훈해요0슬퍼요0화나요0후속기사 원해요0기사제공 :']"
2,삼성전자, 2017-03-1920:58,세계일보 ,에버랜드 ‘로봇 VR’ 국내 최초 도입,https://finance.naver.com/news/news_read.nhn?article_id=0003156398&office_id=022&mode=search&query=삼성전자&page=1,"['       에버랜드 ‘로봇 VR’ 국내 최초 도입      기사입력2017-03-19 20:58기사원문좋아요훈훈해요좋아요 평가하기공감좋아요0훈훈해요0슬퍼요0화나요0후속기사 원해요0댓글에버랜드를 운영하는 삼성물산 리조트부문이 국내 유망 스타트업 ‘상화’와 손잡고 신개념 탑승기구인 ‘로봇 VR’를 국내 최초로 도입해 24일부터 운영한다. 로봇 VR(가상현실)는 삼성전자 ‘기어VR’를 쓰고 로봇 팔에 탑승하면 인기 애니메이션 ‘태권브이’의 주인공 훈이와 영희처럼 로봇을 조종하는 듯한 경험을 할 수 있는 4D(4차원) VR 체험시설이다. 높이 6m의 거대한 로봇팔 2대에 6인승 의자를 장착해 모두 12명이 약 3분간 체험할 수 있다. 360도 자유자재로 움직이는 로봇팔에, 높은 건물에서 뛰어내리거나 상대 로봇의 로켓 공격을 피하는 VR 영상신호를 일치시켜 탑승객의 몰입감을 높였다.삼성물산 제공ⓒ 세상을 보는 눈, 글로벌 미디어 세계일보세계일보 관련뉴스해당 언론사에서 선정하며 언론사 페이지(아웃링크)로 이동해 볼 수 있습니다.""참 나쁜 대통령""…그 때는 맞고 지금은 틀리다?""시집가니 미인대회 사진 지워달라고?""최순실, 대통령과 통화후 ""아직도 지가 공주인 줄…""홍상수·김민희, 떳떳한 사랑 고백 그저 뻔뻔할 수밖에\'1억 별풍선\' 주고 BJ와 관계 맺은 남성의 결말좋아요0훈훈해요0슬퍼요0화나요0후속기사 원해요0기사제공 :']"
3,삼성전자, 2017-03-1920:43,헤럴드경제 ,코스피 연중 최고치… 상장사 순익 100조원 안착 ‘시동’,https://finance.naver.com/news/news_read.nhn?article_id=0001212143&office_id=016&mode=search&query=삼성전자&page=1,"['       코스피 연중 최고치… 상장사 순익 100조원 안착 ‘시동’      기사입력2017-03-19 20:43기사원문좋아요훈훈해요좋아요 평가하기공감좋아요0훈훈해요0슬퍼요0화나요0후속기사 원해요0댓글 - 올해 코스피 상장사 순익 137조원… 전년比 32.86%↑- 반도체 섹터 순익 40조원 육박… 삼성전자 31조- 올해 1분기 영업이익 40조 ‘기대’… 반도체+디스플레이 ‘주도’[헤럴드경제=이은지 기자] 안팎으로 악재가 엎친 데 덮친 가운데서도 코스피가 연중 최고치를 찍으면서 2150선을 돌파했다. 박근혜 전 대통령 탄핵으로 정치적 불확실성이 걷히자, 곧바로 상장사 주가가 고개를 들면서 올해 코스피 상장사 순이익이 100조원에 안착할 것이란 기대감이 그 어느 때보다 커지고 있다.그동안 재계에 산적한 위기를 타개해 왔던 건 결국 기초체력과 실력이었다. 기업으로 말하면 ‘펀더멘털’과 ‘실적’이다. 이에 올해 ‘순익 100조원 시대’를 여는 첫 분수령으로 코스피 상장사의 1분기 실적에 관심이 모아지고 있다.▶순익 100조원 안착 ‘눈앞’... 반도체 ‘주도’= 19일 금융정보업체 와이즈에프엔에 따르면, 올해 코스피 상장사 당기순이익 컨센서스(추정기관 3곳 이상)는 136조9206억원에 달할 것으로 예상된다.지난해 코스피 상장사의 순이익은 전년대비 9.15% 증가한 103조538억원으로 ‘순익 100조원 시대’를 가까스로 열었지만, 올해는 이보다 32.86% 증가해 100조원에 안착할 것으로 기대되고 있다.특히, 이 중 반도체 섹터의 순이익은 39조3112억원으로, 전체 상장사 순이익의 30%에 육박할 것으로 내다보고 있다. 뒤를 이어 자동차(14조9340억원), 은행(11조3772억원), 화장품(4조930억원), 디스플레이(2조3967억원) 등이 상위에 올랐다.지난해 순익 100조원 돌파에도 반도체(26조4350억원)와 자동차(13조6734억원)의 성장이 주효했다.이 중 일등공신은 대장주 삼성전자로, 순이익 22조7261억원을 기록하면서 전년동기(19조601억원) 대비 19.23% 성장했다. 올해는 작년보다 39.87% 증가한 31조7864억원의 순이익을 기록할 것으로 예측되면서 전체 순익의 25%에 육박할 것으로 보인다.▶1분기 영업익 40조원...반도체+디스플레이만 20조= 올해가 순이익 100조 시대 안착을 가르는 주요한 기점으로 꼽히는 가운데, 1분기 영업이익부터 시동을 걸 예정이다.와이즈에프엔에 따르면, 올해 1분기 코스피 상장사들의 영업이익도 전년대비 18.78% 증가한 40조원에 이를 것으로 집계됐다.3개월 전만 해도 37조원으로 예상됐지만, 7.33% 상향조정되면서 시장의 기대감도 부풀고 있다.올해 1분기 실적을 주도할 분야로는 반도체와 디스플레이가 꼽힌다. 반도체와 디스플레이는 도합 20조원에 육박하는 영업이익을 내면서 순이익 증가에도 큰 기여를 할 것으로 보인다. 반도체와 디스플레이 섹터는 올해 1분기 전년동기대비 각각 50.81%, 1670% 불어난 약 11조원, 8조원의 영업이익을 낼 것으로 기대되고 있다.반도체 대표주자 삼성전자와 SK하이닉스는 올해 1분기 영업이익이 전년동기대비 각각 32.94%, 263.18% 불어날 것으로 보인다.LG디스플레이는 올해 1분기 영업이익이 1902% 증가할 것으로 예상돼 주요 상장사 중 가장 높은 성장세가 기대되고 있다.이재만 하나금융투자 투자전략팀장은 “탄핵이라는 큰 정치적 이슈가 있었지만, 정치적 불확실성이 코스피 상장사의 펀더멘털이나 실적에 영향을 미친 건 아니기 때문에 외국인들의 ‘바이 코리아’도 이어진 것”이라며 “불확실성이 걷혔기 때문에 앞으로는 코스피 상장사들의 실적에 따라 박스피 탈출도 가능할 것으로 보인다”고 말했다.leunj@heraldcorp.com▶영감이란 불꽃에 타오르게할 스토리(INSPIRE)▶인기 무료 만화 ▶나만의 변호사 찾기 - Copyrights ⓒ 헤럴드경제 & heraldbiz.com, 무단 전재 및 재배포 금지 -헤럴드경제 관련뉴스해당 언론사에서 선정하며 언론사 페이지(아웃링크)로 이동해 볼 수 있습니다.홍석현 JTBC 회장 사의…대선출마설 제기대통령 된다면…\'문재인→소통, 안희정→대화, 이재명→청산\'김진태 ""검토보고서 1안 자살, 2안 자살미수...무서워서 국민하겠나""민주당 ""盧 서거는 MB의 기획보복탓, 洪 인륜 저버려""\'불면의 이틀밤\'…소환 앞둔 朴 전 대통령은 무슨 생각할까좋아요0훈훈해요0슬퍼요0화나요0후속기사 원해요0기사제공 :']"
4,삼성전자, 2017-03-1920:02,매일경제 ,"홍석현 ""홍라희, 이재용 구속에 가슴 찢어진다고 해""",https://finance.naver.com/news/news_read.nhn?article_id=0003907465&office_id=009&mode=search&query=삼성전자&page=1,"['       홍석현 ""홍라희, 이재용 구속에 가슴 찢어진다고 해""      기사입력2017-03-19 20:02기사원문좋아요훈훈해요좋아요 평가하기공감좋아요0훈훈해요0슬퍼요0화나요0후속기사 원해요0댓글 홍라희 여사가 이재용 삼성전자 부회장 구속 후 오빠인 홍석현 중앙일보·JTBC 전 회장에게 \'가슴이 찢어진다\'는 말을 한 것으로 알려졌다.홍 전 회장은 19일 중앙선데이와의 인터뷰에서 ""누이가 카톡(사회관계망서비스 일종)을 보내 가슴이 찢어진다고 하더라""라며 ""그게 모성""이라고 전했다.이는 최순실 씨가 검찰에서 \'이 부회장 구속 후 홍 여사와 홍 전 회장이 삼성의 실권을 잡으려 했다\'고 진술한 것에 대한 것이다.홍 전 회장은 ""확인해 봤더니 최씨가 그런 얘기한 것은 사실이더라""라며 ""그런 사람이 대통령 옆에서 (국정 개입을) 했다는 게 슬픈 일""이라고 말했다.또 ""아들이 후계자이기 때문에 더 혹독하게 훈련시킨다""면서 ""(하지만) 이건희 회장도 홍 여사도 아들에 대한 사랑은 끔찍하다""고 설명했다.자신이 언급된 이유는 ""유명세""라고 밝혔다.홍 전 회장은 삼성가 문제와 관련해 자주 거론돼 왔다.일각에서는 삼성 내부에서 지난해 10월부터 JTBC가 삼성·최씨 간 특혜거래를 보도하자 이 부회장이 외가에 크게 서운해했다는 의혹이 있어왔다.홍 전 회장은 또 ""(홍 여사의 리움미술관 관장 사퇴는) 이 부회장이 자신의 경영 공백이 길어질 가능성에 대비해 외가의 영향력을 차단하기 위한 사전단속용이라는 분석도 나온다""고 밝혔다.또 삼성전자는 자체 블로그인 \'삼성 뉴스룸\'을 통해 보도 내용을 강력히 부인하면서 ""삼성전자와 삼성문화재단은 사실무근인 내용을 기사화한 한겨레의 보도에 대해 강한 유감을 표한다""고 말했다.홍 전 회장은 ""(이 부회장의 구속은) 피가 통한 조카인데 당연히 가슴이 아프다""면서 ""진행 중인 사건에 대해 얘기하는 건 조심스럽지만 그 상황에서 (청와대의) 강요가 됐건 아니건 거절하기는 한국 문화와 정부와 기업 간의 관계 등 여태까지의 풍토에서 힘들지 않았을까 하는 생각이 든다""고 말했다.홍 전 회장은 전일 중앙일보·JTBC 회장직에서 사임했으며, 인터뷰는 사임 전 이뤄졌다.[디지털뉴스국][매일경제 공식 페이스북] [오늘의 인기뉴스] [매경 프리미엄][ⓒ 매일경제 & mk.co.kr, 무단전재 및 재배포 금지]매일경제 관련뉴스해당 언론사에서 선정하며 언론사 페이지(아웃링크)로 이동해 볼 수 있습니다.최양락, 하차 후 근황…이제 본업이 식당 주차요원?""학교를 안 나가겠습니다"" 수능 대신 세계여행을 떠나다골로프킨, 스토리 가득했던 복싱빅매치 판정승동이족 중미대륙 진출? ""상왕조 갑골문자 발견""비♥김태희, 결혼 후 첫 커플화보 \'꿀 떨어지네\'좋아요0훈훈해요0슬퍼요0화나요0후속기사 원해요0기사제공 :']"
5,삼성전자, 2017-03-1919:59,한국경제 ,24일 '슈퍼 주총데이',https://finance.naver.com/news/news_read.nhn?article_id=0003742946&office_id=015&mode=search&query=삼성전자&page=1,"['       24일 \'슈퍼 주총데이\'      기사입력2017-03-19 19:59기사원문좋아요훈훈해요좋아요 평가하기공감좋아요0훈훈해요0슬퍼요0화나요0후속기사 원해요0댓글12월 법인 절반 924개사 열어[ 나수지 기자  ] 삼성전자 SK텔레콤 등 12월 결산 상장법인 1017곳이 이번주에 정기 주주총회를 연다. 금요일인 24일에는 전체 12월 결산 상장법인의 절반가량이 동시에 주총을 개최한다. 이른바 ‘슈퍼 주총데이’다.19일 한국예탁결제원에 따르면 12월 결산 상장법인(2070개사)의 44.6%에 해당하는 924개 기업이 24일에 정기 주총을 연다. 유가증권시장에서는 삼성전자 등 416개사, 코스닥시장에서는 손오공 등 498개사, 코넥스 시장에서는 10개사가 이날 주총을 개최한다.이날 주총을 여는 기업 중 가장 주목받는 회사는 삼성전자다. 삼성전자는 이번 주총에서 이사 보수한도를 390억원에서 550억원으로 끌어올리는 방안을 확정한다. 공식 안건은 아니지만 지난해 11월 공식화한 지주회사 전환 방안을 포함한 주주가치 제고 방안을 놓고 주주들과 질의응답도 할 것으로 알려졌다. 같은 날 주총을 여는 호텔신라는 이부진 사장을 사내이사로 재선임하는 안건을 처리할 예정이다.SK그룹 계열사들은 경영철학을 담은 정관의 전문(前文)에 ‘사회와 더불어 성장한다’는 내용을 넣기로 했다. SK그룹이 지난해 10월 경영관리체계인 SKMS(SK Management System)를 개정한 데 따른 것이다. 롯데칠성은 신동빈 롯데그룹 회장을 사내이사로 신규 선임하는 방안을 주총 안건으로 올렸다.나수지 기자 suji@hankyung.com[한경닷컴 바로가기] [스내커] [모바일한경 구독신청] ⓒ 한국경제 & hankyung.com, 무단전재 및 재배포 금지한국경제 관련뉴스해당 언론사에서 선정하며 언론사 페이지(아웃링크)로 이동해 볼 수 있습니다.기아차 영업사원, 차량 한 대 팔고 받는 돈이발기부전 치료제 먹은 50대 男, 온몸에…\'발칵\'강원랜드서 돈 벌었다는 사람 못 본 이유""학생회장 하면 차 한 대 뽑는다""…충격 실상가수 비 군 복무 시절 캐더니 이젠 박근혜를…좋아요0훈훈해요0슬퍼요0화나요0후속기사 원해요0기사제공 :']"
6,삼성전자, 2017-03-1919:44,한국경제 ,[한경매물마당] 동대문구 역 출구 앞 사옥 및 투자용 빌딩 등 16건,https://finance.naver.com/news/news_read.nhn?article_id=0003742926&office_id=015&mode=search&query=삼성전자&page=1,"['       [한경매물마당] 동대문구 역 출구 앞 사옥 및 투자용 빌딩 등 16건      기사입력2017-03-19 19:44기사원문좋아요훈훈해요좋아요 평가하기공감좋아요0훈훈해요0슬퍼요0화나요0후속기사 원해요0댓글◆서울 영등포구 수익형 근린생활시설 빌딩=대로변 코너 역 출구 2분. 매물 귀한 지역 대지 1490㎡, 연면적 8020㎡의 10층 건물. 유동인구 풍부하고 보증금 45억원, 월 1억2000만원에 전 층 근생시설 입점. 급매가 275억원. (02)519-3010 서초 제이에스 차상혁◆전남 무안국제공항 인근 해양리조트·별장·펜션 개발 분양 단독 섬=서해안고속도로 20분 거리 요트마리나·레저 가능한 식생섬. 식수와 접안시설 가능. 5㎾ 태양광 시설, 희귀 동식물·수석·갯벌·염전체험장 조성 위해 200억원 투자. 급매가 150억원. 010-8758-7389 강남 뉴탑중개 김정안◆서울 동대문구 역 출구 앞 사옥 및 투자용 빌딩=대로변 대지 860㎡, 연면적 5000㎡. 유동인구 풍부한 상권으로 안정적인 임차 구성. 연 수익률 6%(관리비 별도). 120억원. (02)6011-5304 강남 JS포시즌 배정의◆서울 마포구 합정동 초역세권 신축 임대수익형 빌딩=합정역(2·6호선) 도보 1분 거리. 가시성 뛰어난 코너 대지 450㎡, 연면적 1750㎡. 2017년 3월 준공. 주차 15대. 보증금 4억5000만원, 월 4800만원(관리비 별도). 매가 118억원. (02)511-3390 강남 리얼티코리아 유진석◆서울 강남구 삼성동 인근 수익형 빌딩=테헤란로 역세권 코너 대지 450㎡, 연면적 2200㎡의 9층 건물. 외관이 수려하고 코너 입지로 공실 염려 적음. 월 4500만원에 임대 중. 105억원. 010-8707-6010 서초 코리아공인 이기운◆서울 압구정동 수익형 빌딩=도로 12m 접한 초역세권 대지 365㎡, 연면적 1485㎡. 보증금 3억5000만원, 월 3500만원. 임차 업종 우수. 유동인구 풍부하고 내·외관 수려해 병원 및 임대수익형 적합. 100억원. (02)519-3020 서초 제이에스 차상혁◆서울 종로구 중심상권 수익형 근생 빌딩=대지 220㎡, 연면적 1150㎡의 6층 건물. 전 층 근생시설로 임대 중. 유동인구·임차 수요 풍부해 공실 염려 적음. 안정성 뛰어나고 5대 상권 내 있어 향후 시세 차익 기대. 수익률 5%. 전속 중개. 90억원. (02)511-0554 강남 리얼티코리아 유진석◆서울 강남구 테헤란로 수익형 빌딩=역세권 도보 2분. 상업지역 대지 350㎡, 연면적 1050㎡의 6층 건물. 보증금 6억원, 월 5000만원(관리비 별도). 관리 편리하고 투자성·환금성 우수해 수익형으로 적합. 수익률 8%. 급매가 75억원. (02)519-3040 서초 제이에스 차상혁◆서울 강남구 대로변 코너 신축 빌딩=준주거지역 대지 590㎡, 연면적 2500㎡의 6층 건물. 보증금 8억5000만원, 월 3400만원. 1층 프랜차이즈 입점. 유동인구 풍부해 임대 및 투자용 적합. 급매가 67억원. (02)534-8878 서초 스카이 이기종경기 평택시 신도시 신축 상가주택◆경기 평택시 신도시 신축 상가주택=삼성전자 396만6960㎡ 100조원 투자 지역. 대지 223㎡, 연면적 460㎡의 4층 건물. 1층 상가 2개. 엘리베이터 설치. 융자 5억5000만원, 보증금 4억5000만원, 월 405만원. 실투자 5억3000만원. 매가 15억3000만원. (031)655-5599 평택 태양공인 김중식◆서울 강남구 더블역세권 빌딩=오피스, 먹자복합상권 코너 대지 475㎡, 연면적 2050㎡의 7층 건물. 주차 17대. 보증금 4억원, 월 2800만원에 전 층 근생시설 입점. 유동인구 풍부해 임대수익형으로 적합. 급매가 70억원. (02)511-9467. 강남 리얼티코리아 유진석◆경기 동탄신도시 중심지 수익형 빌딩=상업지 대지 700㎡, 연면적 4700㎡의 10층 건물. 보증금 4억원, 월 5000만원에 전 층 근생으로 공실 없이 임대 중. 상권 활발하고 공실 염려 적음. 노후 대비 임대수익형 적합. 수익률 9.3%. 사정상 급매. 65억원. (02)535-6709 강남 스카이 허봉환◆서울 강남구 신논현역 역세권 수익형 빌딩=코너 대지 266㎡, 연면적 512㎡. 보증금 4억7000만원, 월 2300만원. 유동인구 풍부해 임대 및 투자용 적합. 수익률 6%. 구조조정 급매물. 52억원. (02)511-2081 강남 리얼티코리아 유진석◆서울 강남구 병의원 근생 빌딩=역세권 이면 접한 대지 263㎡, 연면적 670㎡의 지하 1층~지상 4층 건물. 보증금 1억5000만원, 월 1300만원. 병원, 피부클리닉, 한의원 등 적합. 강남 부촌 배후로 업무·주거 결합된 지가 급등 지역. 급매가 41억원. (02)543-2588 서초 두바이 이세연◆경기 평택시 안중역세권 신축 상가주택=대지 432㎡, 연면적 659㎡의 4층 코너 건물. 엘리베이터 설치, 1층 상가. 융자 7억2000만원, 보증금 4억7000만원, 월 780만원. 임대 완료. 시세 차익 기대. 18억5000만원. (031)682-1131 리치공인 이환숙◆경기 광교신도시 유명 프랜차이즈 대기업 직영 소매점 상가=광교역세권 아파트 밀집지역 대로변 중심상업지 1층 출입구 코너 점포 201㎡. 보증금 8000만원, 월 680만원(VAT 별도). 2년마다 임대료 5% 인상. 융자 9억원, 실투자 8억4000만원. 수익률 6.5%. 18억2000만원 010-5305-9797 수지 동문114 이창수[한경닷컴 바로가기] [스내커] [모바일한경 구독신청] ⓒ 한국경제 & hankyung.com, 무단전재 및 재배포 금지한국경제 관련뉴스해당 언론사에서 선정하며 언론사 페이지(아웃링크)로 이동해 볼 수 있습니다.기아차 영업사원, 차량 한 대 팔고 받는 돈이발기부전 치료제 먹은 50대 男, 온몸에…\'발칵\'강원랜드서 돈 벌었다는 사람 못 본 이유""학생회장 하면 차 한 대 뽑는다""…충격 실상가수 비 군 복무 시절 캐더니 이젠 박근혜를…좋아요0훈훈해요0슬퍼요0화나요0후속기사 원해요0기사제공 :']"
