,회사명,날짜,언론사,기사제목,링크,본문
14,삼성전자, 2017-03-1914:59,한국경제 ,정치 불확실성 걷힌 증시…'실적 잔치'열리나…IT·디스플레이·화학 1분기 어닝시즌...,https://finance.naver.com/news/news_read.nhn?article_id=0003742802&office_id=015&mode=search&query=삼성전자&page=3,"['       정치 불확실성 걷힌 증시…\'실적 잔치\'열리나…IT·디스플레이·화학 1분기 어닝시즌 빛낼 \'빅3\'      기사입력2017-03-19 14:59기사원문좋아요훈훈해요좋아요 평가하기공감좋아요0훈훈해요0슬퍼요0화나요0후속기사 원해요0댓글삼성전자 1분기 영업이익 처음 9조원대 넘을 수도삼성전기·파트론 등 유망주롯데케미칼·SK이노베이션 실적 개선 종목 상승 여력[ 나수지 기자  ] Getty Imaes Bank대통령 탄핵 인용 등 국내 주식시장을 짓누르던 정치적인 불확실성이 해소되면서 실적 개선 종목이 장을 주도하는 ‘실적 시즌’에 대한 기대감이 커지고 있다. 국내 상장사들이 내놓을 올해 첫 ‘성적표’에 관심이 모아지는 이유다. 1분기 실적 개선이 기대되는 업종은 정보기술(IT), 디스플레이, 화학 등이다.○IT·화학·디스플레이 주목실적 개선세가 두드러지는 대표적인 부문은 IT 업종이다. 신한금융투자에 따르면 IT 업종의 올해 영업이익 전망치는 57조1002억원이다. 지난 1월 전망치인 53조6249억원보다 6%가량 늘었다.IT 업종의 실적 개선은 대장주인 삼성전자가 이끌고 있다. 삼성전자의 올 1분기 영업이익 전망치 평균은 8조8906억원으로 3개월 전에 비해 17%가량 높아졌다. 김경민 대신증권 연구원은 “반도체 제품 가격이 빠르게 올라가면서 해당 사업부문의 영업이익 추정치가 기존 예상을 뛰어넘을 전망”이라며 “삼성전자가 올 1분기에 사상 처음으로 9조원대 영업이익을 달성할 가능성이 높다”고 내다봤다. 이 증권사는 삼성전자의 1분기 영업이익 전망치를 기존 8조9760억원에서 9조2720억원으로 높여 잡았다.IT 부품주에 대한 기대감도 높다. 한상오 한국경제TV 와우넷 파트너는 “삼성전자의 갤럭시S8, LG전자의 G6 등 신제품 출시가 이어지면서 부품업체의 실적 향상이 기대된다”며 LG이노텍 삼성전기 파트론을 추천 종목으로 꼽았다. LG이노텍은 애플과 LG전자에, 삼성전기와 파트론은 삼성전자에 주로 부품을 납품하고 있다.화학 등 소재주의 실적 개선도 돋보인다. 증권사들이 예상한 롯데케미칼의 1분기 영업이익은 평균 8344억원으로 3개월 전에 비해 46%가량 실적 기대치가 높아졌다. 이상엽 파트너는 “올해 롯데케미칼은 사상 최대 영업이익을 기록할 것”이라며 “3분기에는 자회사인 타이탄이 말레이시아 증시에 상장할 예정인 만큼 주가 상승 여력이 크다”고 분석했다.한동훈 파트너는 화학업종 중 SK이노베이션을 추천했다. 그는 “1분기 유가 상승으로 나프타 등 석유제품 가격이 인상되면서 SK이노베이션의 수익 폭이 확대됐다”고 설명했다. 12개월 선행 주가순자산비율(PBR)이 0.8배에 불과해 주가가 저평가돼 있다는 점도 투자 포인트다.시장 전문가들은 IT와 소재 업종의 실적 약진이 한국 증시 전체의 실적 개선세를 이끌 것으로 전망하고 있다. 이상욱 키움증권 연구원은 “IT와 소재 업종이 코스피200 종목의 영업이익에서 차지하는 비중은 44.89%에 이른다”며 “이들 업종의 실적 전망치가 높아지는 것은 국내 주가 상승으로 이어질 것”이라고 내다봤다.디스플레이 업종의 실적 개선세가 올해도 이어질 것이란 분석도 나온다. LG디스플레이가 대표적이다. LG디스플레이의 1분기 평균 영업이익 전망치는 8001억원으로 창사 이후 최대 영업이익을 기록할 전망이다. 김양재 KTB투자증권 연구원은 “LG디스플레이 실적은 사상 최대를 기록할 전망인 데 반해 업황 둔화 우려로 주가는 약세를 보이고 있다”며 “과도한 우려로 주가가 하락한 만큼 가격 매력이 돋보인다”고 분석했다.○‘사드 보복’ 관련주 실적 전망치↓반면 실적 ‘눈높이’가 낮아지는 종목도 있다. 중국 정부가 사드(고고도 미사일방어체계) 보복을 본격화하면서 실적이 타격을 받을 것으로 예상되는 게임·면세점·레저 업종 종목들이다. 게임빌은 3개월 전만 해도 영업이익이 25억원을 달성할 것으로 예상됐지만 최근에는 영업이익 전망치가 7억원 수준으로 내려앉았다. 지난해 1분기 46억원의 15% 수준에 불과하다. 파라다이스는 3개월 전에 비해 영업이익 전망치가 39%가량 하향 조정됐다. 호텔신라(-25%) 인터파크(-20.3%) 하나투어(-18.0%) 등도 실적 전망치가 내려간 종목으로 꼽혔다.나수지 기자 suji@hankyung.com[한경닷컴 바로가기] [스내커] [모바일한경 구독신청] ⓒ 한국경제 & hankyung.com, 무단전재 및 재배포 금지한국경제 관련뉴스해당 언론사에서 선정하며 언론사 페이지(아웃링크)로 이동해 볼 수 있습니다.기아차 영업사원, 차량 한 대 팔고 받는 돈이가수 비 군 복무 시절 캐더니 이젠 박근혜를…발기부전 치료제 먹은 50대 男, 온몸에…\'발칵\'강원랜드서 10만원 걸고 잃는 금액 따져보니""학생회장 하면 차 한 대 뽑는다""…충격 실상좋아요0훈훈해요0슬퍼요0화나요0후속기사 원해요0기사제공 :']"
15,삼성전자, 2017-03-1914:57,연합뉴스 ,"검찰, 박 前대통령 조사후 최태원 신병처리 결정 방침",https://finance.naver.com/news/news_read.nhn?article_id=0009118885&office_id=001&mode=search&query=삼성전자&page=3,"['       검찰, 박 前대통령 조사후 최태원 신병처리 결정 방침      기사입력2017-03-19 14:57기사원문좋아요훈훈해요좋아요 평가하기공감좋아요0훈훈해요0슬퍼요0화나요0후속기사 원해요0댓글 SK 111억 뇌물공여 + \'80억 뇌물공여 약속\' 혐의 처벌 검토朴 ""미르·K재단 앞으로도 잘 부탁""…檢 \'강요성 뇌물\' 가능성 주목검찰 소환조사받은 최태원 회장(오른쪽)(서울=연합뉴스) 차대운 이지헌 기자 = 박근혜 전 대통령의 뇌물수수 등 의혹을 수사 중인 검찰 특별수사본부(본부장 이영렬 서울중앙지검장)가 21일로 예정된 박 전 대통령 소환조사 이후 최태원 SK그룹 회장의 신병처리 및 기소 여부를 결정할 방침이다.    19일 법조계에 따르면 검찰은 이번 수사의 최대 고비가 될 박 전 대통령의 소환조사일이 이틀 앞으로 다가옴에 따라 최 회장의 신병처리 및 기소 여부 결정을 박 전 대통령 조사 뒤에 내리기로 했다.    검찰 관계자는 ""현재 박 전 대통령 조사에 모든 역량을 쏟아붓고 있는 것으로 생각하면 된다""고 밝혔다.    검찰은 박 전 대통령의 뇌물 혐의를 다지는 차원에서 최 회장을 불러 18일 오후 2시부터 이날 오전 3시 30분까지 13시간이 넘게 강도 높게 조사했다.    특수본은 최 회장이 2015년 광복절 특별사면, CJ헬로비전 인수·합병 등 여러 경영 현안에 박 전 대통령의 도움을 받는 대가로 미르·K스포츠재단에 111억원의 거액을 출연했을 가능성에 주목하고 있다.    앞서 박영수 특별검사팀은 삼성그룹이 미르·K재단에 출연한 204억원을 \'제3자 뇌물\'로 규정한 바 있는데 같은 맥락에서 SK와 롯데그룹의 두 재단 출연금도 제3자 뇌물로 볼 가능성을 검토 중인 것이다.    아울러 검찰은 \'비선 실세\' 최순실(61·구속기소)씨가 운영과 설립에 깊숙이 개입한 K스포츠재단·비덱스포츠(코레스포츠의 후신)가 SK그룹과 80억원의 별도 지원 문제를 성사 직전 단계까지 논의한 사실에도 주목하고 있다.    검찰은 지급 방식 등 세부 조율 과정에서 최종 합의에 이르지는 못했지만, SK가 기본적으로 박 전 대통령의 요구에 따라 80억원을 지원하는 큰 틀의 의사 결정을 내리고 구체적인 협의에 들어간 점에 주목하고 있다.    형법상 뇌물수수죄는 부정한 돈을 주기로 약속한 것만으로도 성립한다.    따라서 검찰은 \'뇌물공여의 약속\'이 있었다고 볼 여지가 있다고 보고 최 회장을 상대로 지난해 2월 박 전 대통령과의 청와대 인근 안가 독대 당시 대화 내용, 이후 실무진에게 추가 지원을 지시한 사실이 있는지 등을 집중적으로 추궁한 것으로 전해졌다.    이런 가운데 검찰은 박 전 대통령이 최 회장과 독대에서 ""앞으로도 미르·K재단을 잘 부탁한다""는 취지로 언급한 것으로 파악하고 박 전 대통령이 뇌물을 사실상 강요한 것으로 볼 수 있는지를 면밀히 검토하는 것으로 전해졌다.    대법원 판례는 공무원이 강요나 협박에 가까운 방식으로 요구를 해 상대방으로부터 금품을 받아도 이를 뇌물로 인정한다.    검찰은 이번에 최 회장을 참고인 신분으로 조사하고 진술조서를 작성한 것으로 확인됐다. 그러면서도 향후 입건 및 형사처분 가능성까지 염두에 두고 진술거부권 및 변호인의 도움을 받을 권리 등을 고지하고 자필 확인서를 받은 것으로 전해졌다.    다만 법조계에서는 SK그룹이 재계 차원에서 53개 대기업이 동시에 참여한 미르·K스포츠재단 출연금 외에는 결과적으로 박 전 대통령이나 최씨 측에 돈을 건넨 적은 없는 만큼 이재용 삼성전자 부회장의 사례와는 달리 볼 측면이 있다는 견해도 있다.    이에 따라 검찰이 설사 최 회장을 기소하는 방향으로 방침을 굳히더라도 신병처리에는 신중한 결정을 할 것이라는 관측도 나온다.    cha@yna.co.kr최신 유행 트렌드 총집결 #흥(클릭!)연합뉴스 관련뉴스해당 언론사에서 선정하며 언론사 페이지(아웃링크)로 이동해 볼 수 있습니다.\xa0엄효섭 ""조성하와 30년지기…배추 장사도 함께해 봤죠""\xa0숯불에 독주 쏟았다가…3세 아이 숨지게 한 식당직원 집유\xa0경찰에게 ""짭X"" 욕설한 50대 결국 \'벌금 폭탄\'\xa0해병 누드사진 파문 확산…남성군인 성행위 사진까지\xa0[블랙박스] 사고 유발하는 갑작스런 불법 유턴좋아요0훈훈해요0슬퍼요0화나요0후속기사 원해요0기사제공 :']"
16,삼성전자, 2017-03-1914:54,한국경제 ,[나영호의 투자 자산 10%는 ELW 병행하자] (5) ELW의 '행사·시간 가치...,https://finance.naver.com/news/news_read.nhn?article_id=0003742797&office_id=015&mode=search&query=삼성전자&page=3,"['       [나영호의 투자 자산 10%는 ELW 병행하자] (5) ELW의 \'행사·시간 가치\' 개념 잘 이해해야      기사입력2017-03-19 14:54기사원문좋아요훈훈해요좋아요 평가하기공감좋아요0훈훈해요0슬퍼요0화나요0후속기사 원해요0댓글주식워런트증권(ELW) 가격을 구성하는 요인인 ‘행사 가치’와 ‘시간 가치’의 개념을 잘 이해해야 다양한 투자 전략을 세울 수 있다. ELW 가격에 영향을 미치는 요인들은 기초자산 가격, 권리행사 가격, 기초자산의 변동성, 만기까지의 잔존기간, 금리, 배당 이렇게 여섯 가지가 있다.무엇보다 ELW 가격에 가장 큰 영향을 미치는 것은 기초자산 가격이다. 콜은 기초자산 가격이 상승하면 상승할수록 ELW 가치도 상승한다. 풋은 기초자산 가격이 하락할수록 ELW 가치가 상승한다.두 번째로 권리행사 가격이다. 권리행사 가격은 현재 가격과 많이 차이가 나는 행사가를 지닐수록 가격이 낮다. 행사가 일어날 가능성이 낮기 때문이다. 예를 들어 현재 삼성전자의 주가가 200만원인데 300만원이 넘을 때 차익을 지급하는 ELW와 210만원을 넘을 때 차익을 지급하는 ELW가 있다면 행사가격이 현재 가격과 근접한 ELW가 행사될 가능성이 높기에 더 높은 가격에 거래된다.세 번째는 기초자산의 가격 변동성이다. 현재가 200만원인 삼성전자가 250만원이 넘어설 때 행사가 진행되는 ELW가 있다고 할 때, 삼성전자 주가가 하루 200만원 기준으로 상하 30만원씩 움직일 때와 하루 상하 3만원씩 가격 변화가 생길 때 어떤 경우 250만원을 넘어설 가능성이 높을까. 당연히 하루 30만원씩 변화가 생길 때 더욱 유리하다. 다른 내용이 같을 경우 기초자산의 상하 변동폭이 커지는 흐름을 보일 때 ELW 가격은 더욱 상승하게 된다.네 번째는 만기까지의 잔존기간이다. 시간 가치는 항상 감소하게 된다는 점을 명심해야 한다. 다섯 번째는 금리다. 자주 변동되는 것이 아니어서 사실상 고려하지 않아도 되는 사전적 개념이다. 마지막으로 배당이 있는데 배당으로 인한 기초자산의 가격 변동이 더욱 중요하다.[한경닷컴 바로가기] [스내커] [모바일한경 구독신청] ⓒ 한국경제 & hankyung.com, 무단전재 및 재배포 금지한국경제 관련뉴스해당 언론사에서 선정하며 언론사 페이지(아웃링크)로 이동해 볼 수 있습니다.기아차 영업사원, 차량 한 대 팔고 받는 돈이가수 비 군 복무 시절 캐더니 이젠 박근혜를…발기부전 치료제 먹은 50대 男, 온몸에…\'발칵\'강원랜드서 10만원 걸고 잃는 금액 따져보니""학생회장 하면 차 한 대 뽑는다""…충격 실상좋아요0훈훈해요0슬퍼요0화나요0후속기사 원해요0기사제공 :']"
17,삼성전자, 2017-03-1914:52,SBS ,삼성전자 등 924개사 주총 24일에 몰려,https://finance.naver.com/news/news_read.nhn?article_id=0000514387&office_id=055&mode=search&query=삼성전자&page=3,"['       삼성전자 등 924개사 주총 24일에 몰려      기사입력2017-03-19 14:52기사원문좋아요훈훈해요좋아요 평가하기공감좋아요0훈훈해요0슬퍼요0화나요0후속기사 원해요0댓글 한국예탁결제원은 이번 주에 삼성전자 등 삼성그룹 계열사와 SK텔레콤 등 SK그룹 계열사 등 모두 1천17개사가 정기 주주총회를 한다고 밝혔습니다.특히 24일은 코스피 416개사, 코스닥 498개사, 코넥스 10개사 등 924개사가 몰려 \'슈퍼주총데이\'가 될 전망입니다.이번 주 주총을 여는 코스피 상장사는 삼성전자와 삼성SDI, 호텔신라, LG디스플레이, 신한금융, 현대중공업, SK텔레콤, 롯데쇼핑 등 451개사입니다.이재용 부회장이 구속된 이후 처음 열리는 삼성전자의 24일 주주총회에서는 작년 11월 공식화한 지주회사 전환 검토를 포함해 \'주주가치 제고 방안\'에 관한 주주들의 질의와 회사의 언급이 있을 것으로 보입니다.코스닥에서는 손오공, 안국약품, 네이처셀, 코리아나화장품 등 552개사가 주주총회를 개최하고 코넥스 상장법인 14곳도 주총을 엽니다.12월 결산 2천70개 상장법인 가운데 현대자동차 등 253개사가 이미 주주총회를 마쳤고 782개사는 3월 다섯째 주 이후로 정기주총 개최를 예정하고 있습니다.\xa0송욱 기자(songxu@sbs.co.kr)☞ [19대 대선 특집] 선거 주요 뉴스를 한눈에!\u200b☞ 미혼모 후원 바로가기※ ⓒ SBS & SBS콘텐츠허브 : 무단복제 및 재배포 금지SBS 관련뉴스해당 언론사에서 선정하며 언론사 페이지(아웃링크)로 이동해 볼 수 있습니다.최태원 회장 13시간 조사…\'부당거래\' 집중 추궁또 임명권자 수사하게 된 검찰…김수남 총장 선택 \'주목\'세월호 인양 점검…해저면에서 1∼2m 들어 올린다안철수·손학규 오늘 공식 대선출마 선언세월호 오늘 본 인양 시도 취소…""시험인양 문제 파악""좋아요0훈훈해요0슬퍼요0화나요0후속기사 원해요0기사제공 :']"
18,삼성전자, 2017-03-1914:50,연합뉴스 ,"[주간증시전망] 코스피 더 오른다…2,180선 시도 전망",https://finance.naver.com/news/news_read.nhn?article_id=0009118879&office_id=001&mode=search&query=삼성전자&page=3,"['       [주간증시전망] 코스피 더 오른다…2,180선 시도 전망      기사입력2017-03-19 14:50기사원문좋아요훈훈해요좋아요 평가하기공감좋아요0훈훈해요0슬퍼요0화나요0후속기사 원해요0댓글코스피 2,160선도 돌파(서울=연합뉴스) 정하종 기자 = 코스피가 14.49포인트 올라 연중최고치인 2,164.57로 장을 종료한 지난 17일 오후 서울 중구 을지로 KEB하나은행 본점 딜링룸에서 딜러들이 업무를 보고 있다. [연합뉴스 자료사진]3월수출·1분기실적에 주목…""차익시현 매물 횡보할 수도""(서울=연합뉴스) 조민정 기자 = 이번 주(20∼24일) 증시는 양호한 경제 지표와 유럽 정치의 불확실성 완화에 따라 다시 한 번 상승을 시도할 것으로 보인다.    20일로 예정된 3월 수출 실적 발표와 1분기 실적 전망에 대한 기대감도 지수 상승을 이끌 요인으로 꼽힌다.    다만 최근 지수 상승에 따른 단기 차익 시현 매물 출회가 지수 상승을 제한할 가능성이 있다.    또 도널드 트럼프 미국 행정부의 예산안 초안과 관련한 갈등 발생 여부도 시장에 영향을 미칠 수 있다.    지난주 코스피는 한 주간 67.23포인트(3.21%) 오른 2,164.58에 마감했다.     16일(한국시간) 미국 중앙은행은 3월 연방공개시장위원회(FOMC) 회의에서 기준금리를 기존 0.50∼0.75%에서 0.75∼1.00%로 0.25%포인트 인상했다.    점도표상 금리 인상은 연 3회로 기존과 동일했지만, 금리 인상을 통해 미국 경제에 대한 자신감을 내비친 점이 증시에 호재로 작용했다.     김용구 하나투자증권 연구원은 19일 ""이번 주 코스피는 2015년 지수 고점인 2,180선 접근을 시도할 것으로 예상된다""며 ""글로벌 거시 경제 동반 회복과 한국 수출 턴어라운드, 중국의 한계산업 구조조정 및 재정투자 등은 국내 증시의 환골탈태 가능성을 암시하는 긍정요인""이라고 강조했다.    여기에 미국이 3월 연방공개시장위원회(FOMC)를 통해 고압경제를 시사하면서 한국 증시에 긍정적인 기운을 추가로 불어넣었다고 분석했다.    김 연구원은 ""신흥국 시장 중에서도 거시건전성 안전지대인 한국 증시에 대한 글로벌 투자가 강화될 수 있다""고 전망했다.        배성영 KB증권 연구원은 ""현재 국내 증시는 지수 레벨업의 변곡점에 있다""라며 ""레벨업 지연은 글로벌 저성장의 장기화와 그로 인한 매출 성장의 불확실성 때문으로, 1분기 실적에서 이익 증가의 신뢰성과 연관도가 높은 매출액의 회복 여부를 주목해야 한다""고 말했다.    김병연 NH투자증권 연구원은 ""3월에 예정돼있던 주요 이벤트들이 하나씩 지나가고 있는데, 실제 우려보다는 주식 시장에 긍정적인 영향을 미치는 방향으로 진행되고 있다""고 평가했다.    다만 ""단기 차익 시현 욕구가 높아질 시점이어서 주가가 횡보할 수 있다""고 예상했다.    그러면서 ""1분기 실적 추정치가 주가 재평가의 변곡점이 될 수 있다는 점에서 1분기 실적에 더욱 관심이 쏠린다""고 말했다.    김윤서 KTB투자증권 연구원은 ""20일 발표되는 한국 수출 발표를 통해 중국의 3월 수출과 제조업 체감경기, 여타 글로벌 경기동행지표의 회복 여부를 판단할 수 있을 것""이라며 수출실적 발표에 관심을 기울일 것을 권유했다.    그는 추천업종으로 삼성전자, GS건설, KB금융, 미래에셋대우, 엔씨소프트, 코스메카코리아를 꼽았다.    김병연 연구원은 IT와 소재·산업재 업종의 강세를 예상하면서 ""통상 시장 주도주의 주도력은 지수 고점 형성 시점까지 지속된다""며 ""상승 피로가 주도자의 단기 숨 고르기를 자극할 수 있으나 시장 주도주로서 관련주의 위치는 확고부동하다""고 강조했다.    그는 국내 증시가 본격적으로 강세에 진입할 것으로 예상하면서 시장 거래대금의 저점 반등 여부, 도드 프랭크법 폐지 등 미국의 금융제도 개편에 따라 수혜가 기대되는 증권주 바닥 통과 여부에도 주목할 것을 조언했다.    하나금융투자와 KTB투자증권은 이번 주 코스피 예상 등락 범위를 2,120∼2,180선으로 제시했고 NH투자증권은 2,120∼2,170선을 예상했다.    chomj@yna.co.kr최신 유행 트렌드 총집결 #흥(클릭!)연합뉴스 관련뉴스해당 언론사에서 선정하며 언론사 페이지(아웃링크)로 이동해 볼 수 있습니다.\xa0엄효섭 ""조성하와 30년지기…배추 장사도 함께해 봤죠""\xa0숯불에 독주 쏟았다가…3세 아이 숨지게 한 식당직원 집유\xa0경찰에게 ""짭X"" 욕설한 50대 결국 \'벌금 폭탄\'\xa0해병 누드사진 파문 확산…남성군인 성행위 사진까지\xa0[블랙박스] 사고 유발하는 갑작스런 불법 유턴좋아요0훈훈해요0슬퍼요0화나요0후속기사 원해요0기사제공 :']"
