,회사명,날짜,언론사,기사제목,링크,본문
5,삼성전자, 2017-09-2811:01,헤럴드경제 ,삼성전자-SK텔레콤…세계 최초 4G-5G 이동통신 연동 성공,https://finance.naver.com/news/news_read.nhn?article_id=0001296762&office_id=016&mode=search&query=삼성전자&page=6,"['       삼성전자-SK텔레콤…세계 최초 4G-5G 이동통신 연동 성공      기사입력2017-09-28 11:01기사원문좋아요훈훈해요좋아요 평가하기공감좋아요0훈훈해요0슬퍼요0화나요0후속기사 원해요0댓글- 4G-5G 넘나드는 데이터 통신 서비스 이용 기대- 5G 상용화 가속도[헤럴드경제=박세정 기자] 4세대(4G)와 5세대(5G)를 넘나드는 이동통신 연동 기술이 등장했다. 이동 기술 간 연동이 가능해지면 5G 네트워크가 전국적으로 구축되지 않아도 사용자들은 4G와 5G 네트워크를 오가면서 데이터 통신서비스를 이용할 수 있게 될 전망이다.28일 삼성전자는 SK텔레콤과 함께 세계 최초로 이동 중인 차량에서 4G, 5G 이동통신 연동 시연에 성공했다고 밝혔다.2.6㎓ 주파수 대역을 사용하는 4G 롱텀에볼루션(LTE)과 28㎓, 3.5㎓ 주파수 대역의 5G 통신망을 넘나들며 통신에 성공한 것은 세계 최초다.두 회사는 최근 서울 을지로에 각각 다른 주파수 대역을 지원하는 4G, 5G 통신 기지국과 차세대 가상화 코어 네트워크를 구축하고, 4G와 5G를 동시에 지원하는 통합 단말기를 차량에 설치해 주행 중에도 기지국과 단말 사이에 끊김 없이 통신 서비스 시연에 성공했다.주행 중인 차량과 SK텔레콤 본사 사이에서 360도 가상현실(VR) 라이브 스트리밍을 시연했으며, 실제 차량에서 선명하고 깨끗한 스트리밍을 구현했다.삼성전자 측은 이번 시연 성공으로 5G 기술 상용화에 필요한 이종 기술, 주파수 대역 간의 연동을 실제 네트워크에 적용할 수 있다는 점을 확인했다고 평가했다.이로써 5G 네트워크가 전국적으로 구축되지 않아도 4G, 5G 네트워크를 오가면서 통신 서비스를 이용할 수 있게 될 것이라는 기대다.다양한 5G 주파수 대역 간의 연동이 가능해지면 밀리미터파 대역 뿐 아니라 6㎓ 이하 대역도 5G 기술에 동시에 활용할 수 있을 것으로 전망된다. 밀리미터파는 대량 데이터 전송이 필요한 증강현실, 가상현실 등에 활용하고 6㎓ 대역은 커넥티트카, 차량통신 등에 활용할 수 있다.박진효 SK텔레콤 네트워크기술원장은 “이번 시연은 5G, 4G 간 상호 연동을 시연한 세계 최초의 사례로 향후에도 SK텔레콤은 5G 상용 기술 확보를 위해 매진할 것”라고 말했다.박동수 삼성전자 네트워크사업부 부사장은 “SK텔레콤과 진행한 이번 시연의 성공으로 5G 이동통신 도입이 더욱 가속도가 붙을 것”이라고 말했다.sjpark@heraldcorp.com▶ 생활용품 알뜰하게 사는 법 럭비(LUCK BE)▶앞서가는 젊은 경제신문 친구맺기 ▶오늘의 운세 날씨 - Copyrights ⓒ 헤럴드경제 & heraldbiz.com, 무단 전재 및 재배포 금지 -헤럴드경제 관련뉴스해당 언론사에서 선정하며 언론사 페이지(아웃링크)로 이동해 볼 수 있습니다.북한에 준 1조500억 차관, 한푼도 받지 못했다\'한끼줍쇼\' 삼성동편, 초인종 눌렀더니 김남주 집철원 피격 병사 유가족 "" 총알 깨끗. 도비탄 말 안 돼""김광석 부검의 ""타살? 말도 안된다…경찰이 바보냐""""김정은, 지는 전쟁 시작 않을 것…北美전쟁은 양자패배""좋아요0훈훈해요0슬퍼요0화나요0후속기사 원해요0기사제공 :']"
6,삼성전자, 2017-09-2811:01,한국경제 ,"삼성전자, 블랙메탈 적용한 '프리미엄 전자레인지' 2종 출시",https://finance.naver.com/news/news_read.nhn?article_id=0003829990&office_id=015&mode=search&query=삼성전자&page=6,"['       삼성전자, 블랙메탈 적용한 \'프리미엄 전자레인지\' 2종 출시      기사입력2017-09-28 11:01기사원문좋아요훈훈해요좋아요 평가하기공감좋아요0훈훈해요0슬퍼요0화나요0후속기사 원해요0댓글최대 1000W까지 7단계 출력 조절삼성전자가 강력한 출력과 블랙메탈 컬러를 적용한 프리미엄 전자레인지 2종을 출시했다.삼성전자가 이번에 내놓은 제품은 조리 용도에 따라 출력을 100~1000W(와트)까지 7단계로 조절할 수 있다. 기존 제품(700W 단일 출력)과 비교해 조리 시간을 최대 30%까지 단축시킬 수 있다.밥, 국 등 일반 식품을 데울 때는 최대 출력을 사용하고 냉동 생선과 과일, 버터와 빙과류를 녹일 때는 100~180W 출력을 사용할 수 있다. 조리물이 타거나 과하게 조리되는 경우를 방지할 수 있다.세 곳에서 고주파가 나오는 3면 입체 가열 방식으로 빠르고 고르게 조리할 수 있다. 탈취 기능이 탑재되어 조리 후 남아있는 냄새와 연기도 간편히 제거된다.제품 외관에 고급스러운 ‘블랙 메탈’을 적용했다. 고품격 주방과 잘 어울리며 조리실 내부에 적용된 항균 세라믹 재질은 세균 번식과 흠집에 강하고 청소도 간편하다.  신제품의 용량은 23ℓ로 소비자 가격은 20만~22만원이다.김하나 한경닷컴 기자 hana@hankyung.com기사제보 및 보도자료 open@hankyung.com[한경닷컴 바로가기] [글방] [모바일한경 구독신청] ⓒ 한국경제 & hankyung.com, 무단전재 및 재배포 금지한국경제 관련뉴스해당 언론사에서 선정하며 언론사 페이지(아웃링크)로 이동해 볼 수 있습니다.(출발)삼성전자 260만원…0.66%↑""서울대 석학 강연료 30만원인데 개그맨은 무려…""日 ""불가능"" 난색…LG 연구원과 2년 사투 벌인 회사""中 사드 보복에도 매출 사상최대"" 면세점 반응이""신입 연봉 4000만원도 최저임금 미달이라는데…""좋아요0훈훈해요0슬퍼요0화나요0후속기사 원해요0기사제공 :']"
7,삼성전자, 2017-09-2811:01,파이낸셜뉴스 ,"삼성-SK텔레콤, 4G-5G 연동 세계최초 성공...5G 상용화 가속도",https://finance.naver.com/news/news_read.nhn?article_id=0003881821&office_id=014&mode=search&query=삼성전자&page=6,"['       삼성-SK텔레콤, 4G-5G 연동 세계최초 성공...5G 상용화 가속도      기사입력2017-09-28 11:01기사원문좋아요훈훈해요좋아요 평가하기공감좋아요0훈훈해요0슬퍼요0화나요0후속기사 원해요0댓글  삼성전자와 SK텔레콤이 4세대(4G)와 5세대(5G) 이동통신의 연동 시연에 성공했다. 앞으로 5G 이동통신망이 구축될 때 4G와의 연동은 필수다. 5G 전국망이 한번에 완료될 수 없기 때문이다. 이용자가 5G가 가능한 곳에서 5G로 통신하다가, 4G 지역으로 이동할 때 통화 등이 끊기지 않고 이어지도록 해야하기 때문이다.  2.6GHz 주파수 대역을 사용하는 4G 롱텀에볼루션(LTE) 이동통신망과 28GHz, 3.5GHz 주파수 대역을 쓰는 5G 이동통신망을 오가며 통신에 성공한 것은 세계 최초다. 국내에서 5G 상용화에 가속도가 붙을 전망이다.  삼성전자와 SK텔레콤은 최근 서울 을지로 지역에 각각 다른 주파수 대역을 지원하는 4G, 5G 통신 기지국을 설치하고, 4G와 5G를 동시에 지원하는 통합 단말기를 차량에 설치해 주행 중 통합 단말기가 4G와 5G를 오가며 끊김없이 통신 서비스를 시연하는 데에 성공했다고 28일 밝혔다.  해당 통합 단말기는 SK텔레콤 본사에서 송출한 360도 가상현실(VR) 동영상을 스트리밍으로 수신했다. 차량 내에서 이동 중 4G 기지국과 5G 기지국을 번갈아 가며 이용했을 때도 선명하고 깨끗하게 스트리밍이 가능했다.  향후 5G 상용화를 위해선 4G와의 연동이 필수적이다. 5G 이동통신 네트워크를 동시에 구축할 수 없기 때문에 5G 전국망이 구축되기 전 4G 네트워크를 오가며 고속의 데이터 통신이 가능하도록 해야 하기 때문이다.  특히 이번 시연은 5G 이동통신의 주요 주파수로 거론되고 있는 고주파의 28GHz와 저주파의 3.5GHz 모두에서 4G와 연동에 성공했다는 점에서 의미가 있다. 고주파와 저주파는 전파 특성상 5G로 가능한 다양한 가운데 다른 특성을 가진 서비스에 적용될 가능성이 높다.  예를 들어 고주파의 경우 동시에 대량 데이터 전송이 필요한 증강현실(AR)이나 VR, 홀로그램 등 서비스를 이용할 때 활용되고, 저주파는 도달거리가 길어 커넥티드카나 차량통신 등에 활용될 수 있다.  SK텔레콤 박진효 네트워크기술원장은 ""5G는 넓은 커버리지를 제공하는 3.5GHz와 초고속 전송이 가능한 28GHz 대역 기지국과 이미 전국망이 구축된 4G와 연동해 어디에서나 끊김 없는 최고의 통신 서비스를 제공하게 될 것""이라며 ""금번 시연은 5G 서비스 관점에서 4G와 연동한 세계 최초의 사례로 향후에도 SK텔레콤은 5G 상용 기술 확보를 위해 매진할 것""라고 말했다.  삼성전자 네트워크사업부 박동수 부사장은 ""서비스 연속성과 신규 통신서비스 출현을 위해 주파수간 연동이 필수적""이라며 ""SK텔레콤과 진행한 이번 시연의 성공으로 5G 이동통신 도입에 더욱 가속도가 붙을 것""이라고 말했다.   ronia@fnnews.com 이설영 기자   ▶ 세상의 모든 골 때리는 이야기 \'fn파스\'▶ 속보이는 연예뉴스 fn스타  ※ 저작권자 ⓒ  파이낸셜뉴스. 무단 전재-재배포 금지파이낸셜뉴스 관련뉴스해당 언론사에서 선정하며 언론사 페이지(아웃링크)로 이동해 볼 수 있습니다.관사서 아내 불륜 목격한 남편, 참지 못하고 내연남에게..남성 2명과 모텔 갔다가 딱걸린 여자친구.. 최후의 선택흰머리 많은 남성이 조심해야 하는 질환남편 살해한 아내, 다음날 새벽 내연남과 공터에서..교통 법규위반하다 BMW와 접촉사고낸 SM5..뜻밖의 반전좋아요0훈훈해요0슬퍼요0화나요0후속기사 원해요0기사제공 :']"
8,삼성전자, 2017-09-2811:01,한국경제 ,"5G 기술 상용화 '성큼'…삼성전자·SK텔레콤, 4G-5G 이동통신 연동 성공",https://finance.naver.com/news/news_read.nhn?article_id=0003829991&office_id=015&mode=search&query=삼성전자&page=6,"['       5G 기술 상용화 \'성큼\'…삼성전자·SK텔레콤, 4G-5G 이동통신 연동 성공      기사입력2017-09-28 11:01기사원문좋아요훈훈해요좋아요 평가하기공감좋아요0훈훈해요0슬퍼요0화나요0후속기사 원해요0댓글삼성전자는 SK텔레콤와 함께 4G와 5G 이동통신 연동 시연에 성공했다고 28일 밝혔다. 2.6GHz 주파수 대역을 사용하는 4G LTE와 28GHz, 3.5GHz 주파수 대역의 5G 통신망을 넘나들며 통신에 성공한 것은 세계 최초다. 양사는 최근 서울 을지로에 각각 다른 주파수 대역을 지원하는 4G, 5G 통신 기지국과 차세대 가상화 코어 네트워크를 구축하고, 4G와 5G를 동시에 지원하는 통합 단말기를 차량에 설치해 주행 중에도 기지국과 단말 사이에 끊김 없이 통신 서비스 시연에 성공했다.주행 중인 차량과 SK텔레콤 본사 회의실 사이에서 360도 가상현실 라이브 스트리밍을 시연했으며, 실제 차량에서 4G와 5G 통신 기술과 주파수 대역이 변경돼도 선명하고 깨끗한 스트리밍이 가능했다.이번 시연 성공으로 5G 기술 상용화에 필수적인 이종(異種) 기술·주파수 대역 간의 연동(Multi-RAT Interworking)이 실제 네트워크에 적용 가능함을 확인했다.이종 기술간 연동이 가능해지면 5G 이동통신 네트워크가 전국적으로 구축되지 않아도 사용자들은 4G와 5G 네트워크를 오가며 고속의 데이터 통신 서비스를 이용할 수 있다.또 다양한 5G 주파수 대역 간의 연동이 가능해지면 보다 넓은 주파수 대역 확보에 유리한 밀리미터파 대역뿐 아니라 넓은 도달거리로 네트워크 구축에 유리한 6GHz 이하 대역을 5G 기술에 동시에 활용할 수 있다. 예를 들어 밀리미터파는 수십 기가비트(Gigabit)의 대량 데이터 전송이 필요한 증강현실이나 가상현실, 홀로그램 등에 활용하고, 6GHz 이하 대역은 커넥티드카, 차량통신(Vehicle to X) 등에 활용이 가능하다.박진효 SK텔레콤 Network 기술원장은 “5G는 넓은 커버리지를 제공하는 3.5GHz와 초고속 전송이 가능한 28GHz 대역 기지국과 함께 전국망 커버리지를 이미 확보한 4G와의 연동을 통해 어디에서나 끊김 없는 최고의 통신 서비스를 제공할 것”이라며 ""이번 시연은 5G 서비스 관점에서 5G/4G간 상호 연동을 시연한 세계 최초의 사례로 향후에도 SK텔레콤은 5G 상용 기술 확보를 위해 매진할 계획""이라고 말했다.박동수 삼성전자 네트워크사업부 부사장은 ""새로운 이동통신 서비스와 현재 이동통신 서비스의 연동은 서비스 연속성과 신규 통신서비스 출현에 필수적”이라며 “SK텔레콤과 진행한 이번 시연의 성공으로 5G 이동통신 도입이 더욱 가속도가 붙을 것”이라고 말했다.이진욱 한경닷컴 기자 showgun@hankyung.com기사제보 및 보도자료 open@hankyung.com[한경닷컴 바로가기] [글방] [모바일한경 구독신청] ⓒ 한국경제 & hankyung.com, 무단전재 및 재배포 금지한국경제 관련뉴스해당 언론사에서 선정하며 언론사 페이지(아웃링크)로 이동해 볼 수 있습니다.삼성 QLED TV, 미국서 잇단 호평… ""최고 성능·화질""온몸으로 만나는 \'아이언맨\' 세상…SKT ICT체험관 가보니""서울대 석학 강연료 30만원인데 개그맨은 무려…""日 ""불가능"" 난색…LG 연구원과 2년 사투 벌인 회사""中 사드 보복에도 매출 사상최대"" 면세점 반응이좋아요0훈훈해요0슬퍼요0화나요0후속기사 원해요0기사제공 :']"
9,삼성전자, 2017-09-2811:01,스포츠서울 ,"삼성전자-SK텔레콤, 세계 최초 4G-5G 이동통신 연동 성공",https://finance.naver.com/news/news_read.nhn?article_id=0000306775&office_id=468&mode=search&query=삼성전자&page=6,"[""       삼성전자-SK텔레콤, 세계 최초 4G-5G 이동통신 연동 성공      기사입력2017-09-28 11:01기사원문좋아요훈훈해요좋아요 평가하기공감좋아요0훈훈해요0슬퍼요0화나요0후속기사 원해요0댓글[스포츠서울 이선율기자]삼성전자와 SK텔레콤이 4G와 5G 이동통신 연동 시연에 성공했다. 2.6GHz 주파수 대역을 사용하는 4G LTE와 28GHz, 3.5GHz 주파수 대역의 5G 통신망을 넘나들며 통신에 성공한 것은 세계 최초다. 삼성전자와 SK텔레콤은 최근 서울 을지로에 각각 다른 주파수 대역을 지원하는 4G, 5G 통신 기지국과 차세대 가상화 코어 네트워크를 구축하고, 4G와 5G를 동시에 지원하는 통합 단말기를 차량에 설치해 주행 중에도 기지국과 단말 사이에 끊김 없이 통신 서비스 시연에 성공했다.주행 중인 차량과 SK텔레콤 본사 회의실 사이에서 360도 가상현실 라이브 스트리밍을 시연했으며, 실제 차량에서 4G와 5G 통신 기술과 주파수 대역이 변경되어도 선명하고 깨끗한 스트리밍이 가능했다.이번 시연 성공으로 5G 기술 상용화에 필수적인 이종 기술·주파수 대역 간의 연동이 실제 네트워크에 적용 가능함을 확인했다. 이종 기술간 연동이 가능해지면 5G 이동통신 네트워크가 전국적으로 구축되지 않아도, 사용자들은 4G와 5G 네트워크를 오가며 고속의 데이터 통신 서비스를 이용할 수 있다.또한 다양한 5G 주파수 대역 간의 연동이 가능해지면 보다 넓은 주파수 대역 확보에 유리한 밀리미터파 대역뿐 아니라 넓은 도달거리로 네트워크 구축에 유리한 6GHz 이하 대역을 5G 기술에 동시에 활용할 수 있다.예를 들어, 밀리미터파는 수십 기가비트의 대량 데이터 전송이 필요한 증강현실이나 가상현실, 홀로그램 등에 활용하고, 6GHz 이하 대역은 커넥티드카, 차량통신 등에 활용이 가능하다.박진효 SK텔레콤 Network 기술원장은 “5G는 넓은 커버리지를 제공하는 3.5GHz와 초고속 전송이 가능한 28GHz 대역 기지국과 함께 전국망 커버리지를 이미 확보한 4G와의 연동을 통해 어디에서나 끊김 없는 최고의 통신 서비스를 제공하게 될 것”이라며, “금번 시연은 5G 서비스 관점에서 5G/4G간 상호 연동을 시연한 세계 최초의 사례로 향후에도 SK텔레콤은 5G 상용 기술 확보를 위해 매진할 것”라고 말했다.박동수 삼성전자 네트워크사업부 부사장은 “새로운 이동통신 서비스와 현재 이동통신 서비스의 연동은 서비스 연속성과 신규 통신서비스 출현에 필수적”이라며 “SK텔레콤과 진행한 이번 시연의 성공으로 5G 이동통신 도입이 더욱 가속도가 붙을 것”이라고 말했다.한편, 삼성전자와 SK텔레콤은 이번 시연을 위해 범용 서버에 4G LTE 코어 장비와 5G 코어 장비를 구성하고 SDN 기술로 이를 연결하는 가상화 네트워크를 구축했다. 또한 네트워크 슬라이싱 기능을 적용해 각각의 기술·통신 대역에 따라 슬라이스를 구성하고 슬라이스별 서비스 품질을 제어하는 기술도 검증했다.melody@sportsseoul.com▶스포츠서울 공식 페이스북▶팟캐스트 '스포츠서울 야구 X파일'▶스포츠서울 공식 유튜브 채널[기사제보 news@sportsseoul.com]  Copyright ⓒ 스포츠서울&sportsseoul.com스포츠서울 관련뉴스해당 언론사에서 선정하며 언론사 페이지(아웃링크)로 이동해 볼 수 있습니다.교복 패션으로 '꿀렁 웨이브' 선보인 걸그룹'골반 깡패'로 불리는 여가수의 완벽 뒤태김기태 감독 당황하게 만든 중계사의 촌극'비키니 퀸' 등극한 필라테스女의 자신감남자 탓에 공연 망칠 뻔한 여가수의 사연좋아요0훈훈해요0슬퍼요0화나요0후속기사 원해요0기사제공 :""]"
10,삼성전자, 2017-09-2811:01,이데일리 ,"삼성전자-SKT, 세계 최초 4G·5G 통신 연동 시연 성공",https://finance.naver.com/news/news_read.nhn?article_id=0003934357&office_id=018&mode=search&query=삼성전자&page=6,"[""       삼성전자-SKT, 세계 최초 4G·5G 통신 연동 시연 성공      기사입력2017-09-28 11:01기사원문좋아요훈훈해요좋아요 평가하기공감좋아요0훈훈해요0슬퍼요0화나요0후속기사 원해요0댓글 [이데일리 정병묵 기자] 삼성전자(005930)와 SK텔레콤(017670)이 4G와 5G 이동통신 연동 시연에 성공했다. 2.6GHz 주파수 대역을 사용하는 4G LTE와 28GHz, 3.5GHz 주파수 대역의 5G 통신망을 넘나들며 통신에 성공한 것은 세계 최초이다.삼성전자와 SK텔레콤은 최근 서울 을지로에 각각 다른 주파수 대역을 지원하는 4G, 5G 통신 기지국과 차세대 가상화 코어 네트워크를 구축하고 4G와 5G를 동시에 지원하는 통합 단말기를 차량에 설치해 주행 중에도 기지국과 단말 사이에 끊김 없이 통신 서비스 시연에 성공했다고 28일 밝혔다. 주행 중인 차량과 SK텔레콤 본사 회의실 사이에서 360도 가상현실 라이브 스트리밍을 시연했으며, 실제 차량에서 4G와 5G 통신 기술과 주파수 대역이 변경되어도 선명하고 깨끗한 스트리밍이 가능했다. 이번 시연 성공으로 5G 기술 상용화에 필수인 이종 기술·주파수 대역 간의 연동이 실제 네트워크에 적용 가능함을 확인했다. 이종 기술간 연동이 가능해지면 5G 이동통신 네트워크가 전국적으로 구축되지 않아도, 사용자들은 4G와 5G 네트워크를 오가며 고속의 데이터 통신 서비스를 이용할 수 있다.또한 다양한 5G 주파수 대역 간의 연동이 가능해지면 보다 넓은 주파수 대역 확보에 유리한 밀리미터파 대역뿐 아니라 넓은 도달거리로 네트워크 구축에 유리한 6GHz 이하 대역을 5G 기술에 동시에 활용할 수 있다.예를 들어, 밀리미터파는 수십 기가비트의 대량 데이터 전송이 필요한 증강현실이나 가상현실, 홀로그램 등에 활용하고, 6GHz 이하 대역은 커넥티드카, 차량통신 등에 활용이 가능하다.SK텔레콤 박진효 네크워크기술원장은 “5G는 넓은 커버리지를 제공하는 3.5GHz와 초고속 전송이 가능한 28GHz 대역 기지국과 함께 전국망 커버리지를 이미 확보한 4G와의 연동을 통해 어디에서나 끊김 없는 최고의 통신 서비스를 제공하게 될 것”이라며 “이번 시연은 5G 서비스 관점에서 5G, 4G간 상호 연동을 시연한 세계 최초의 사례로 향후에도 SK텔레콤은 5G 상용 기술 확보를 위해 매진할 것”라고 말했다.삼성전자 네트워크사업부 박동수 부사장은 “새로운 이동통신 서비스와 현재 이동통신 서비스의 연동은 서비스 연속성과 신규 통신서비스 출현에 필수적”이라며 “SK텔레콤과 진행한 이번 시연의 성공으로 5G 이동통신 도입이 더욱 가속도가 붙을 것”이라고 말했다.정병묵 (honnezo@edaily.co.kr)▶사진으로 보는 핫이슈▶[페이스북] 보러가기~♥ | [카카오톡] 플친 맺기~♥＜ⓒ종합 경제정보 미디어 이데일리 - 무단전재 & 재배포 금지＞이데일리 관련뉴스해당 언론사에서 선정하며 언론사 페이지(아웃링크)로 이동해 볼 수 있습니다.'60세 정년의 덫'…59세 경비원 정규직 되면 1년 뒤 퇴직[김영란법 1년]판관비 줄어 영업익 늘고...의사만나기 하늘의 별따기현대건설, 강남 한강변 첫 입성.. 압구정 재건축까지 노린다文대통령 파격행보, 인사 유감 표명에서 靑지하벙커 안내까지어깨만 부딧쳐도…학폭위 소집 남발에 재심청구 급증좋아요0훈훈해요0슬퍼요0화나요0후속기사 원해요0기사제공 :""]"
11,삼성전자, 2017-09-2811:01,헤럴드경제 ,"삼성전자, 프리미엄 전자레인지 2종 출시",https://finance.naver.com/news/news_read.nhn?article_id=0001296763&office_id=016&mode=search&query=삼성전자&page=6,"['       삼성전자, 프리미엄 전자레인지 2종 출시      기사입력2017-09-28 11:01기사원문좋아요훈훈해요좋아요 평가하기공감좋아요0훈훈해요0슬퍼요0화나요0후속기사 원해요0댓글 [헤럴드경제=정순식 기자] 삼성전자가 1000W(와트)의 강력한 출력과 블랙메탈 컬러를 적용한 프리미엄 전자레인지 2종을 출시했다.이번 제품은 조리 용도에 따라 출력을 100~1000W(와트)까지 7단계로 조절할 수 있으며, 기존 제품(700W 단일 출력)과 비교해 조리 시간을 최대 30%까지 단축시켰다.밥,국 등 일반 식품을 데울 때는 최대 출력을 사용하고 냉동 생선과 과일, 버터와 빙과류를 녹일 때는 100~180W 출력을 사용하면 조리물이 타거나 과하게 조리되는 경우를 방지할 수 있다.또한 세곳에서 고주파가 나오는 3면 입체 가열 방식으로 빠르고 고르게 조리할 수 있으며, 탈취 기능이 탑재돼 조리 후 남아있는 냄새와 연기도 간편히 제거된다.제품 외관에 고급스러운 ‘블랙 메탈’을 적용해 고품격 주방과 잘 어울리며 조리실 내부에 적용된 항균 세라믹 재질은 세균 번식과 흠집에 강하고 청소도 간편하다.신제품의 용량은 23 ℓ로 소비자 가격은 20만원~22만원이다. sun@heraldcorp.com▶ 생활용품 알뜰하게 사는 법 럭비(LUCK BE)▶앞서가는 젊은 경제신문 친구맺기 ▶오늘의 운세 날씨 - Copyrights ⓒ 헤럴드경제 & heraldbiz.com, 무단 전재 및 재배포 금지 -헤럴드경제 관련뉴스해당 언론사에서 선정하며 언론사 페이지(아웃링크)로 이동해 볼 수 있습니다.북한에 준 1조500억 차관, 한푼도 받지 못했다\'한끼줍쇼\' 삼성동편, 초인종 눌렀더니 김남주 집철원 피격 병사 유가족 "" 총알 깨끗. 도비탄 말 안 돼""김광석 부검의 ""타살? 말도 안된다…경찰이 바보냐""""김정은, 지는 전쟁 시작 않을 것…北美전쟁은 양자패배""좋아요0훈훈해요0슬퍼요0화나요0후속기사 원해요0기사제공 :']"
