,회사명,날짜,언론사,기사제목,링크,본문
8,삼성전자, 2017-04-2115:38,뉴스1 ,"[시황종합] 돌아온 외국인, 코스피 2165 마감",https://finance.naver.com/news/news_read.nhn?article_id=0002688276&office_id=421&mode=search&query=삼성전자&page=3,"['       [시황종합] 돌아온 외국인, 코스피 2165 마감      기사입력2017-04-21 15:38기사원문좋아요훈훈해요좋아요 평가하기공감좋아요0훈훈해요0슬퍼요0화나요0후속기사 원해요0댓글6일 만에 반등한 삼성전자 204만4000원달러/원 환율, 5.4원 내린 1134.4원 마감(서울=뉴스1) 김태헌 기자 = 외국인이 돌아오자 코스피가 웃었다. 외국인은 21일 코스피 시장에서 2400억원 넘게 순매수했다. 코스피는 16일 만에 2160선을 회복했다. 삼성전자가 6일 만에 반등했다. 트럼프 정부의 세재개편안에 대한 시장의 기대감이 살아나면서 달러가 약세를 보였다. 달러/원 환율은 전날보다 5.4원 내린 1134.4원에 마쳤다.코스피는 21일 전날보다 15.89포인트(0.74%) 오른 2165.04에 마감했다. 이틀째 상승세다. 코스피는 지난 5일(2160.85) 이후 16일 만에 2160선 위에서 장을 마쳤다.외국인은 이날 2413억원을 순매수하며 지수 상승을 이끌었다. 기관도 908억원 순매수하며 힘을 보탰다. 개인은 홀로 3133억원을 팔아치웠다.대장주 삼성전자는 5일째 이어온 하락세를 끊고 반등했다. 삼성전자는 전날보다 3만원(1.49%) 오른 204만4000원에 장을 마쳤다.시총 상위주들도 대부분 상승했다. 삼성전자와 SK하이닉스, 네이버, 삼성물산, 포스코가 올랐다. 현대차와 한국전력, 신한지주는 하락했다.코스닥은 이틀째 약보합세로 장을 끝냈다. 코스닥은 전날보다 0.84포인트(0.13%) 떨어진 634.96로 장을 마쳤다.개인과 외국인은 각각 96억원, 64억원을 순매수했고 기관은 128억원을 순매도했다.시총 상위주 대부분 하락했다. 셀트리온과 카카오, 로엔, 코미팜, 바이로메드 등이 떨어졌다. CJ E&M과 휴젤, 파라다이스는 강세였다.달러/원 환율은 전날보다 5.4원 내린 1134.4원으로 마감했다. 금융 시장에서 위험자산 선호심리가 높아져 달러/원 환율이 떨어졌다. 스티브 므누신 미국 재무장관이 20일(현지시간) 미국 정부가 조만간 조세개혁안을 내놓을 것이고 연말까지 의회 통과도 이뤄질 수 있다고 말한 게 시장에 영향을 줬다.solidarite4u@▶ 놓치면 후회! 최신 만화 보기 / 2017년 나의 운세 보기▶ 여러분의 제보를 기다립니다. 제보하기(클릭!)[© 뉴스1코리아(news1.kr), 무단 전재 및 재배포 금지]뉴스1 관련뉴스해당 언론사에서 선정하며 언론사 페이지(아웃링크)로 이동해 볼 수 있습니다.문재인 41% vs 안철수 30%…安 7%p 급락 왜?박근혜 자택 67억에 산 홍성열 ""朴 사돈의 팔촌과도 인연 없다""무엇에 쓰는 물건?…부지깽이로 파마하는 이발사""황소개구리인줄 알고""…두꺼비 먹은 50대 사망14개월 딸 울고 보챈다고 때려 죽인 20대 아빠좋아요0훈훈해요0슬퍼요0화나요0후속기사 원해요0기사제공 :']"
9,삼성전자, 2017-04-2115:34,조세일보 ,"우리은행, 금융거래에 '음성인식+갤럭시S8 홍채인증' 무장",https://finance.naver.com/news/news_read.nhn?article_id=0002158561&office_id=123&mode=search&query=삼성전자&page=3,"['        우리은행, 금융거래에 \'음성인식+갤럭시S8 홍채인증\' 무장      기사입력2017-04-21 15:34기사원문좋아요훈훈해요좋아요 평가하기공감좋아요0훈훈해요0슬퍼요0화나요0후속기사 원해요0댓글◆…사진=우리은행 제공우리은행은 삼성전자의 갤럭시S8·갤럭시S8+ 시판에 맞춰 말로 금융거래를 할 수 있는 음성인식 AI뱅킹 \'소리 (SORi)\'에다가 홍채인증서비스 \'Samsung Pass\'를 넣었다고 21일 밝혔다.적용 대상은 공인인증서와 보안카드를 사용하던 모든 금융거래 서비스다. 삼성패스를 이용해 스마트폰 내 안전 공간에 공인인증서를 보관하며 모든 공인인증서/보안카드 입력 없이 홍채인증만으로 금융거래를 할 수 있다.이용대상은 홍채인증이 가능한 단말기 (갤럭시S8·갤럭시 S8+)로 우리은행 스마트뱅킹을 이용하는 모든 개인 고객. 최초 스마트뱅킹 (원터치개인)에 로그인 후 생체 (홍채)인증서비스 이용 등록을 하면 끝난다.지난달 금융권 최초로 출시한 소리 (SORi)는 음성과 생체인증만으로 조회/송금/환전/공과금 납부가 가능한 음성인식 AI뱅킹이다. 그동안 지문 생체인증서비스만 제공됐으나 이번에 홍채인증이 추가됨으로써 통장 비밀번호, 공인인증서 비밀번호, 보안카드 뿐 아니라 PIN번호 입력 없이 쉽고 빠르게 금융거래를 할 수 있다.우리은행 관계자는 “4월말 원터치개인에 이어 위비톡과 위비뱅크에도 홍채인증이 적용된 음성인식 AI뱅킹 소리(SORi)를 내놔 지금까지 보지 못한 가장 안전하고 간편한 금융거래를 선보일 예정”이라고 말했다. 앞으로 “위비플랫폼과 음성인식, 홍채인증 등 다양한 생체인증 도입으로 고객 중심의 생활밀착형 금융서비스를 제공할 것”이라고 그는 덧붙였다.우리은행의 홍채인증 서비스는 본점영업부, 연세금융센터, 중앙대학교지점, 숭실대학교지점, 국민대학교지점, 삼성타운금융센터 6개 영업점의 갤럭시S8·갤럭시S8+ 체험존에서 시연이 가능하다.▶ [HOT]당신의 10분 몸 만들기...황현정기자의 쭉쭉빵빵▶ [HOT]세무·회계 실무, 맞춤형 교육 \'조세일보 재무교육원\'..윤진식(yourjeen@joseilbo.com)저작권자 ⓒ 조세일보(http://www.joseilbo.com). 무단전재 및 재배포 금지조세일보 관련뉴스해당 언론사에서 선정하며 언론사 페이지(아웃링크)로 이동해 볼 수 있습니다.야수를 사랑한 미녀, 시대를 초월한 인기…엠마왓슨 버전 관객몰이 중비♥김태희·원빈♥이나영 ""서로의 풍경이 되었다""…연예계 스몰웨딩 확산봄바람에 실려…Lets 댄스·트로트·록~비욘세, 쌍둥이 임신 사진 공개…""사랑·행복 공유할 수 있어 기쁘다""[보배드림 영상] 신호위반의 무서움…승용차·버스·신호등 잇달아 쾅쾅좋아요0훈훈해요0슬퍼요0화나요0후속기사 원해요0기사제공 :']"
10,삼성전자, 2017-04-2115:31,한국경제 ,(마감)삼성전자 203만8000원…1.19%↑,https://finance.naver.com/news/news_read.nhn?article_id=0003759085&office_id=015&mode=search&query=삼성전자&page=3,"['       (마감)삼성전자 203만8000원…1.19%↑      기사입력2017-04-21 15:31기사원문좋아요훈훈해요좋아요 평가하기공감좋아요0훈훈해요0슬퍼요0화나요0후속기사 원해요0댓글 한경닷컴[한경닷컴 바로가기] [스내커] [모바일한경 구독신청] ⓒ 한국경제 & hankyung.com, 무단전재 및 재배포 금지한국경제 관련뉴스해당 언론사에서 선정하며 언론사 페이지(아웃링크)로 이동해 볼 수 있습니다.(마감)삼성전자 201만4000원…1.52%↓(마감)삼성전자 204만5000원…1.45%↓베트남서 한국산 과일 팔았더니…놀라운 결과""깁스 때문에 샤워 못했는데…"" 반전 사실""고영태, 구속 후 4일 동안…"" 무슨 일이?좋아요0훈훈해요0슬퍼요0화나요0후속기사 원해요0기사제공 :']"
11,삼성전자, 2017-04-2115:30,머니투데이 ,"[스팟]삼성전자, 3만원(1.49%) 오른 204만4000원 마감",https://finance.naver.com/news/news_read.nhn?article_id=0003860975&office_id=008&mode=search&query=삼성전자&page=3,"['       [스팟]삼성전자, 3만원(1.49%) 오른 204만4000원 마감      기사입력2017-04-21 15:30기사원문좋아요훈훈해요좋아요 평가하기공감좋아요0훈훈해요0슬퍼요0화나요0후속기사 원해요0댓글 [머니투데이 진경진 기자] 21일 삼성전자 마감.[▶깊이있는 투자정보 \'TOM칼럼\'][▶트렌드 리더의 스타일 지침서 \'스타일M\'][▶빵빵한 차&레이싱걸]진경진 기자 jkjin@mt.co.kr머니투데이 관련뉴스해당 언론사에서 선정하며 언론사 페이지(아웃링크)로 이동해 볼 수 있습니다.서지혜, 모노키니 입고 뽐낸 바디라인…우아함이 \'물씬\'[단독] 최태원 회장 보러온 \'딸\' 최민정 중위…사회적기업에 \'관심\'""14년 7월생-15년 9월생이 친구"" 安 학제개편 논란클라라, 해변에서 뽐낸 비키니 자태…볼륨 몸매 \'아찔\'문재인 ""가만 서있는데 스탠딩 무슨 의미…답변시간도 부족""좋아요0훈훈해요0슬퍼요0화나요0후속기사 원해요0기사제공 :']"
12,삼성전자, 2017-04-2115:27,연합뉴스TV ,"[비즈&] 현대차, 화물차 운전자에 졸음방지물품 지원 外",https://finance.naver.com/news/news_read.nhn?article_id=0000252780&office_id=422&mode=search&query=삼성전자&page=3,"['       [비즈&] 현대차, 화물차 운전자에 졸음방지물품 지원 外      기사입력2017-04-21 15:27기사원문좋아요훈훈해요좋아요 평가하기공감좋아요0훈훈해요0슬퍼요0화나요0후속기사 원해요0댓글 [비즈&] 현대차, 화물차 운전자에 졸음방지물품 지원 外경제계 소식을 알아보는 \'비즈&\' 시간입니다. 오늘은 어떤 소식들이 올라와 있는지 살펴보겠습니다.▶ 현대차, 화물차 운전자에 졸음방지물품 지원현대자동차는 서해안고속도로 화성휴게소에서 열린 교통사고 예방활동 발대식에 참석해 화물차 운전자를 위한 후원 활동을 벌였습니다.이 자리에서 현대차는 졸음방지 껌, 비타민, 아로마 오일 등이 담긴 졸음방지 물품 5천개를 후원 물품으로 전달했습니다.또 화성휴게소 안에 부스를 마련해 조항계 등 안전장치에 대한 무상점검도 벌였습니다.▶ 티웨이항공, 부산~오사카·제주~오사카 신설티웨이항공이 제주∼오사카 노선과 부산∼오사카 노선을 신설합니다.제주∼오사카 노선은 6월 30일부터 매일, 부산∼오사카 노선은 7월 1일부터 주 4회 운항할 계획입니다. 티웨이항공은 신규 취항을 기념해 편도기준, 부산 출발 오사카행 티켓을 최저 6만4천원에 판매하는 등 특가 행사를 벌이기로 했습니다.▶ 우리은행, 갤럭시 S8 홍채인증 서비스 출시우리은행이 삼성전자의 갤럭시 S8 시리즈 출시에 맞춰 홍채인증 서비스를 시작합니다.우리은행 스마트뱅킹을 이용하는 고객들은 홍채인증이 가능한 스마트폰이 있으면 공인인증서와 보안카드를 사용하던 모든 금융거래를 홍채인증으로 대체할 수 있습니다.▶ 현대로템, 부산 지하철에 스마트 전동차 투입현대로템이 제작한 스마트 전동차가 지하철로는 국내 처음으로 부산 1호선에 투입됩니다.현대로템은 부산도시철도 1호선 연장 다대 구간 개통에 맞춰 스마트 전동차 48량을 새롭게 투입한다고 밝혔습니다.스마트 전동차는 내외부 환경에 따라 밝기와 공기 질, 방송 음량 등이 자동 조절되는데 지금까지는 KTX 등 일부 고속철에서만 운행됐습니다.▶ 빙그레, 2번째 옐로우 카페 제주점 개점빙그레는 바나나맛우유를 본따 만든 옐로우 카페가 제주도 중문관광단지에서 문을 열었다고 밝혔습니다.  옐로우 카페 제주점은 동대문점에 이은 2호점입니다.옐로우 카페에서는 바나나맛우유를 활용한 음료와 디저트는 물론 관련 캐릭터 상품 등도 판매합니다.연합뉴스TV : 02-398-4441(기사문의) 4409(제보), 카톡/라인 jebo23 ▶ 연합뉴스TV 생방송 시청\xa0\xa0 ▶ 뉴스스탠드 구독 ▶ 대한민국 뉴스의 시작, 연합뉴스TV 앱 다운받기연합뉴스TV 관련뉴스해당 언론사에서 선정하며 언론사 페이지(아웃링크)로 이동해 볼 수 있습니다.\xa0검찰과 호흡 맞췄던 고영태 \'매관매직\' 구속되자 묵비권\xa0트럼프, 북한·중국 언급하던중 ""2~3시간전 특이한 움직임""\xa0박 전 대통령, 삼성동 자택 매각…내곡동 새 집 구매\xa0홍준표 \'대학 때 성범죄 모의\' 논란…""관여 안했다""\xa03초 만에…70대 2인조 버스 \'소매치기 대부\' 덜미좋아요0훈훈해요0슬퍼요0화나요0후속기사 원해요0기사제공 :']"
13,삼성전자, 2017-04-2115:26,뉴시스 ,갤럭시S8 정식 출시 첫 날,https://finance.naver.com/news/news_read.nhn?article_id=0007908476&office_id=003&mode=search&query=삼성전자&page=3,"['       갤럭시S8 정식 출시 첫 날      기사입력2017-04-21 15:26기사원문좋아요훈훈해요좋아요 평가하기공감좋아요0훈훈해요0슬퍼요0화나요0후속기사 원해요0댓글【서울=뉴시스】고범준 기자 = 삼성전자 스마트폰 갤럭시 S8 시리즈가 정식 출시된 21일 서울 종로구 KT 광화문지사에서 고객들이 갤럭시 S8과 S8+ 제품의 개통을 위해 통신사 직원과 상담을 하고 있다. 2017.04.21. bjko@newsis.com[사진 영상 제보받습니다] 공감언론 뉴시스가 독자 여러분의 소중한 제보를 기다립니다. 뉴스 가치나 화제성이 있다고 판단되는 사진 또는 영상을 뉴시스 사진영상부(n-photo@newsis.com, 02-721-7470)로 보내주시면 적극 반영하겠습니다.뉴시스 관련뉴스해당 언론사에서 선정하며 언론사 페이지(아웃링크)로 이동해 볼 수 있습니다.조카들과 잠자던 처제 추행한 형부 집행유예현직 40대 경찰이 20대 여성과 \'조건만남\' 성매매?""재혼 못할까봐""…2살 아들 터미널에 버린 엄마""감히 전화를 끊어?""…여친 칼로 찌른 50대 징역4년섬마을 여교사 성폭행범들 2심서 감형…징역 7∼10년좋아요0훈훈해요0슬퍼요0화나요0후속기사 원해요0기사제공 :']"
14,삼성전자, 2017-04-2115:26,뉴시스 ,갤럭시S8 정식 개통,https://finance.naver.com/news/news_read.nhn?article_id=0007908479&office_id=003&mode=search&query=삼성전자&page=3,"['       갤럭시S8 정식 개통      기사입력2017-04-21 15:26기사원문좋아요훈훈해요좋아요 평가하기공감좋아요0훈훈해요0슬퍼요0화나요0후속기사 원해요0댓글【서울=뉴시스】고범준 기자 = 삼성전자 스마트폰 갤럭시 S8 시리즈가 정식 출시된 21일 서울 종로구 KT 광화문지사에서 고객들이 갤럭시 S8과 S8+ 제품의 개통을 위해 통신사 직원과 상담을 하고 있다. 2017.04.21. bjko@newsis.com[사진 영상 제보받습니다] 공감언론 뉴시스가 독자 여러분의 소중한 제보를 기다립니다. 뉴스 가치나 화제성이 있다고 판단되는 사진 또는 영상을 뉴시스 사진영상부(n-photo@newsis.com, 02-721-7470)로 보내주시면 적극 반영하겠습니다.뉴시스 관련뉴스해당 언론사에서 선정하며 언론사 페이지(아웃링크)로 이동해 볼 수 있습니다.조카들과 잠자던 처제 추행한 형부 집행유예현직 40대 경찰이 20대 여성과 \'조건만남\' 성매매?""재혼 못할까봐""…2살 아들 터미널에 버린 엄마""감히 전화를 끊어?""…여친 칼로 찌른 50대 징역4년섬마을 여교사 성폭행범들 2심서 감형…징역 7∼10년좋아요0훈훈해요0슬퍼요0화나요0후속기사 원해요0기사제공 :']"
15,삼성전자, 2017-04-2115:25,뉴시스 ,삼성전자 갤럭시 S8 정식 출시,https://finance.naver.com/news/news_read.nhn?article_id=0007908472&office_id=003&mode=search&query=삼성전자&page=3,"['       삼성전자 갤럭시 S8 정식 출시      기사입력2017-04-21 15:25기사원문좋아요훈훈해요좋아요 평가하기공감좋아요0훈훈해요0슬퍼요0화나요0후속기사 원해요0댓글【서울=뉴시스】고범준 기자 = 삼성전자 스마트폰 갤럭시 S8 시리즈가 정식 출시된 21일 서울 종로구 KT 광화문지사에서 고객들이 갤럭시 S8과 S8+ 제품의 개통을 위해 통신사 직원과 상담을 하고 있다. 2017.04.21. bjko@newsis.com[사진 영상 제보받습니다] 공감언론 뉴시스가 독자 여러분의 소중한 제보를 기다립니다. 뉴스 가치나 화제성이 있다고 판단되는 사진 또는 영상을 뉴시스 사진영상부(n-photo@newsis.com, 02-721-7470)로 보내주시면 적극 반영하겠습니다.뉴시스 관련뉴스해당 언론사에서 선정하며 언론사 페이지(아웃링크)로 이동해 볼 수 있습니다.조카들과 잠자던 처제 추행한 형부 집행유예현직 40대 경찰이 20대 여성과 \'조건만남\' 성매매?""재혼 못할까봐""…2살 아들 터미널에 버린 엄마""감히 전화를 끊어?""…여친 칼로 찌른 50대 징역4년섬마을 여교사 성폭행범들 2심서 감형…징역 7∼10년좋아요0훈훈해요0슬퍼요0화나요0후속기사 원해요0기사제공 :']"
16,삼성전자, 2017-04-2115:25,뉴시스 ,갤럭시S8 정식 개통,https://finance.naver.com/news/news_read.nhn?article_id=0007908468&office_id=003&mode=search&query=삼성전자&page=3,"['       갤럭시S8 정식 개통      기사입력2017-04-21 15:25기사원문좋아요훈훈해요좋아요 평가하기공감좋아요0훈훈해요0슬퍼요0화나요0후속기사 원해요0댓글【서울=뉴시스】고범준 기자 = 삼성전자 스마트폰 갤럭시 S8 시리즈가 정식 출시된 21일 서울 종로구 KT 광화문지사에서 고객들이 갤럭시 S8과 S8+ 제품의 개통을 위해 통신사 직원과 상담을 하고 있다. 2017.04.21. bjko@newsis.com[사진 영상 제보받습니다] 공감언론 뉴시스가 독자 여러분의 소중한 제보를 기다립니다. 뉴스 가치나 화제성이 있다고 판단되는 사진 또는 영상을 뉴시스 사진영상부(n-photo@newsis.com, 02-721-7470)로 보내주시면 적극 반영하겠습니다.뉴시스 관련뉴스해당 언론사에서 선정하며 언론사 페이지(아웃링크)로 이동해 볼 수 있습니다.조카들과 잠자던 처제 추행한 형부 집행유예현직 40대 경찰이 20대 여성과 \'조건만남\' 성매매?""재혼 못할까봐""…2살 아들 터미널에 버린 엄마""감히 전화를 끊어?""…여친 칼로 찌른 50대 징역4년섬마을 여교사 성폭행범들 2심서 감형…징역 7∼10년좋아요0훈훈해요0슬퍼요0화나요0후속기사 원해요0기사제공 :']"
17,삼성전자, 2017-04-2115:25,뉴시스 ,삼성전자 갤럭시 S8 정식 출시,https://finance.naver.com/news/news_read.nhn?article_id=0007908469&office_id=003&mode=search&query=삼성전자&page=3,"['       삼성전자 갤럭시 S8 정식 출시      기사입력2017-04-21 15:25기사원문좋아요훈훈해요좋아요 평가하기공감좋아요0훈훈해요0슬퍼요0화나요0후속기사 원해요0댓글【서울=뉴시스】고범준 기자 = 삼성전자 스마트폰 갤럭시 S8 시리즈가 정식 출시된 21일 서울 종로구 KT 광화문지사에서 고객들이 갤럭시 S8과 S8+ 제품의 개통을 위해 통신사 직원과 상담을 하고 있다. 2017.04.21. bjko@newsis.com[사진 영상 제보받습니다] 공감언론 뉴시스가 독자 여러분의 소중한 제보를 기다립니다. 뉴스 가치나 화제성이 있다고 판단되는 사진 또는 영상을 뉴시스 사진영상부(n-photo@newsis.com, 02-721-7470)로 보내주시면 적극 반영하겠습니다.뉴시스 관련뉴스해당 언론사에서 선정하며 언론사 페이지(아웃링크)로 이동해 볼 수 있습니다.조카들과 잠자던 처제 추행한 형부 집행유예현직 40대 경찰이 20대 여성과 \'조건만남\' 성매매?""재혼 못할까봐""…2살 아들 터미널에 버린 엄마""감히 전화를 끊어?""…여친 칼로 찌른 50대 징역4년섬마을 여교사 성폭행범들 2심서 감형…징역 7∼10년좋아요0훈훈해요0슬퍼요0화나요0후속기사 원해요0기사제공 :']"
18,삼성전자, 2017-04-2115:24,뉴시스 ,삼성전자 갤럭시 S8 정식 출시,https://finance.naver.com/news/news_read.nhn?article_id=0007908465&office_id=003&mode=search&query=삼성전자&page=3,"['       삼성전자 갤럭시 S8 정식 출시      기사입력2017-04-21 15:24기사원문좋아요훈훈해요좋아요 평가하기공감좋아요0훈훈해요0슬퍼요0화나요0후속기사 원해요0댓글【서울=뉴시스】고범준 기자 = 삼성전자 스마트폰 갤럭시 S8 시리즈가 정식 출시된 21일 서울 종로구 KT 광화문지사에서 고객들이 갤럭시 S8과 S8+ 제품의 개통을 위해 통신사 직원과 상담을 하고 있다. 2017.04.21. bjko@newsis.com[사진 영상 제보받습니다] 공감언론 뉴시스가 독자 여러분의 소중한 제보를 기다립니다. 뉴스 가치나 화제성이 있다고 판단되는 사진 또는 영상을 뉴시스 사진영상부(n-photo@newsis.com, 02-721-7470)로 보내주시면 적극 반영하겠습니다.뉴시스 관련뉴스해당 언론사에서 선정하며 언론사 페이지(아웃링크)로 이동해 볼 수 있습니다.조카들과 잠자던 처제 추행한 형부 집행유예현직 40대 경찰이 20대 여성과 \'조건만남\' 성매매?""재혼 못할까봐""…2살 아들 터미널에 버린 엄마""감히 전화를 끊어?""…여친 칼로 찌른 50대 징역4년섬마을 여교사 성폭행범들 2심서 감형…징역 7∼10년좋아요0훈훈해요0슬퍼요0화나요0후속기사 원해요0기사제공 :']"
19,삼성전자, 2017-04-2115:20,머니S ,"[특징주] 이엘케이, 삼성전자 갤럭시S8 정식 출시에 '상승세'",https://finance.naver.com/news/news_read.nhn?article_id=0000246229&office_id=417&mode=search&query=삼성전자&page=3,"['       [특징주] 이엘케이, 삼성전자 갤럭시S8 정식 출시에 \'상승세\'      기사입력2017-04-21 15:20기사원문좋아요훈훈해요좋아요 평가하기공감좋아요0훈훈해요0슬퍼요0화나요0후속기사 원해요0댓글 삼성전자의\xa0갤럭시S8이 21일 정식 출시하면서 삼성전자 TSP(터치스크린패널) 협력사인 이엘케이가 상승세다.이날 코스닥시장에서\xa0오후 3시19분 기준 이엘케이는 전장 대비 14.09% 오른 1660원에 거래됐다.업계에 따르면 이엘케이는 다음달부터 갤럭시S8에 포스터치부품을 공급한다. 이 부품은 갤럭시S8 디스플레이의 홈버튼 기능이 작동하도록 지원하는 부품이다.갤럭시S8이 이날 정식 출시하면서 삼성전자가 포스터치부품을 다른 스마트폰 모델에도 도입할 것이란 기대감이 이엘케이의 상승 모멘텀으로 작용한 것으로 풀이된다.실시간 재테크 경제뉴스│창업정보의 모든 것김수정 기자 superb@mt.co.kr머니S 관련뉴스해당 언론사에서 선정하며 언론사 페이지(아웃링크)로 이동해 볼 수 있습니다.[대선 TV 토론] 심상정, 문재인 비판 ""증세계획 아무 것도 없다""누군 게워내고 누군 돌려받고… \'건보료 폭탄\' 희비[머니포커S] LH 임대아파트 살 자격 없다고요?[불황민국] 뽑기방·로또·드러그스토어의 공통점[대선 TV 토론] 심상정, 안철수 \'최저임금 공약\' 평가 ""아무것도 안하겠다는 얘기""좋아요0훈훈해요0슬퍼요0화나요0후속기사 원해요0기사제공 :']"
