,회사명,날짜,언론사,기사제목,링크,본문
15,삼성전자, 2017-04-2109:12,아시아경제 ,"[특징주]삼성전자, 6거래일 만에 반등",https://finance.naver.com/news/news_read.nhn?article_id=0003979615&office_id=277&mode=search&query=삼성전자&page=9,"['       [특징주]삼성전자, 6거래일 만에 반등      기사입력2017-04-21 09:12기사원문좋아요훈훈해요좋아요 평가하기공감좋아요0훈훈해요0슬퍼요0화나요0후속기사 원해요0댓글 [아시아경제 박나영 기자]삼성전자가 6거래일 만에 반등하고 있다. 21일 오전 9시 3분 삼성전자는 전 거래일 대비 1만5000원(0.74%) 오른 202만9000원에 거래 중이다. 이 시각 매수창구 상위에 메릴린치, 미래대우, 신한금융, CLSA 등의 증권사가 이름을 올리고 있다. 삼성전자는 지난 13일 이달 최고치인 212만1000원(종가 기준)까지 올랐지만 14일부터 5거래일 연속 하락해 201만원대까지 떨어졌다. 증권가에서는 1분기 실적호조와 갤럭시S8 출시에 대한 기대감이 선반영되면서 주가가 상승세를 지속하자, 단기간 차익실현 매물이 나왔던 것으로 보고 있다. 박나영 기자 bohena@asiae.co.kr▶ 뉴스가 재밌다! 세상의 모든 재미 [티잼]▶ 인기최신만화  ▶ 오늘의 띠별, 별자리 운세아시아경제 관련뉴스해당 언론사에서 선정하며 언론사 페이지(아웃링크)로 이동해 볼 수 있습니다.[속보]\'청문회 토론\' 겪은 문재인, 놀라운 지지율[속보]집중공격 받은 문재인, 토론 끝나자마자…[속보]""대구 심상찮다"" 안철수 지지 급격히…[속보]심상정의 문재인 공격에 정의당 당원들이…\'문재인은 제2의 박근혜?\'…조국 교수 직격탄좋아요0훈훈해요0슬퍼요0화나요0후속기사 원해요0기사제공 :']"
16,삼성전자, 2017-04-2109:09,데일리안 ,"코스피, 12.09p(0.56%) 오른 2161.24 출발",https://finance.naver.com/news/news_read.nhn?article_id=0002180824&office_id=119&mode=search&query=삼성전자&page=9,"['       코스피, 12.09p(0.56%) 오른 2161.24 출발      기사입력2017-04-21 09:09기사원문좋아요훈훈해요좋아요 평가하기공감좋아요0훈훈해요0슬퍼요0화나요0후속기사 원해요0댓글 21일 코스피지수는 전장 대비 12.09p(0.56%) 오른 2161.24로 출발했다. 업종별로는 금융업(0.77%), 전기전자(0.68%), 철강금속(0.65%) 등이 상승세를 보이고 있는 반면, 섬유의복(-0.24%), 운수장비(-0.09%) 등은 하락세를 보이고 있다. 시총 상위권에 있는 롯데제과(4.55%), 포스코(POSCO)(1.14%), 삼성전자(0.89%) 등은 강세를 보이고 있는 반면, 농심(-1.07%), 유한양행(-0.83%), 한샘(-0.64%) 등은 약세를 보이고 있다. 한편, 이날 외환시장에서 원·달러 환율은 전날보다 1.30원 하락한 1138.50원에 출발했다.데일리안 박선영 기자ⓒ (주)데일리안 - 무단전재, 변형, 무단배포 금지좋아요0훈훈해요0슬퍼요0화나요0후속기사 원해요0기사제공 :']"
17,삼성전자, 2017-04-2109:09,한국경제 ,"[특징주]삼성전자, 엿새 만에 반등",https://finance.naver.com/news/news_read.nhn?article_id=0003758932&office_id=015&mode=search&query=삼성전자&page=9,"['       [특징주]삼성전자, 엿새 만에 반등      기사입력2017-04-21 09:09기사원문좋아요훈훈해요좋아요 평가하기공감좋아요0훈훈해요0슬퍼요0화나요0후속기사 원해요0댓글 [ 오정민 기자  ] 삼성전자가 신제품 스마트폰 \'갤럭시S8\' 시리즈의 공식 출시일인 21일 엿새 만에 반등에 나섰다.21일 오전 9시1분 현재 삼성전자는 전날보다 2만원(0.99%) 오른 203만4000원에 거래되고 있다.여전히 외국계 증권사 창구에서 매물이 쏟아지고 있지만 이날은 매수세도 유입되며 주가를 뒷받침하고 있는 모습이다. 도이치증권, 유비에스증권, CS증권 등이 매도 창구 상위에 올라 있다. 메릴린치, 도이치 증권 등을 통해 매수세가 들어오고 있다. 증권가에서는 삼성전자 주가가 단기 상승한 만큼 숨고르기 구간에 돌입한 것으로 풀이하고 있다. 삼성전자 주가는 이재용 부회장 구속등 악재에도 불구하고 반도체 업황 정점 논란이 일단락되면서 지난달 장중 213만4000원까지 올라 최고가를 경신했다. 이후 국내 증권사 평균추정치(컨센서스)를 훌쩍 웃돈 1분기 실적을 발표한 이달 7일 이후에도 게걸음을 이어가고 있다. 김동원 KB투자증권 연구원은 ""최근 삼성전자 주가 하락은 단기 숨고르기로, 향후 주가의 상승 전환이 기대된다""며 ""삼성전자 주가는 올해 실적 전망치 기준 주가수익비율(PER) 9.1배에 거래돼 글로벌 동종업체(PER 13배) 대비 저평가 상태""라고 분석했다.삼성전자가 2분기부터 IT·모바일(IM) 사업부 실적 개선과 더불어 하만 실적이 본격적으로 반영되면 영업이익이 늘어나는 효과(9000억원)가 발생할 것으로 김 연구원은 예상했다.아울러 1분기부터 분기 배당이 새롭게 시작되고, 실적 컨퍼런스 콜(27일) 이후 자사주 매입도 재개돼 주가가 상승 전환할 것으로 기대했다.갤럭시S8 시리즈의 판매도 양호할 것이란 관측이다.그는 ""현재까지 국내 갤럭시S8 개통 건수는 예약 판매분(100만대)의 50% 수준으로 추정돼 양호하다""며 ""갤럭시S8 출하량은 4600만대로 추정되며, 갤럭시S 시리즈의 최대 판매량 수준(5300만대)에 근접할 것""이라고 전망했다.오정민 한경닷컴 기자 blooming@hankyung.com[한경닷컴 바로가기] [스내커] [모바일한경 구독신청] ⓒ 한국경제 & hankyung.com, 무단전재 및 재배포 금지한국경제 관련뉴스해당 언론사에서 선정하며 언론사 페이지(아웃링크)로 이동해 볼 수 있습니다.삼성전자, 닷새 연속 하락…외국인 \'팔자\'삼성전자, 나흘째 하락…외국인 매물 출회""삼겹살 원가 얼만지 아세요?"" 이상한 진실""이 회사 절대 가지마세요"" 익명글…기업들 \'발칵\'\'골초·술고래\' 가장 많이 사는 곳 어디?좋아요0훈훈해요0슬퍼요0화나요0후속기사 원해요0기사제공 :']"
18,삼성전자, 2017-04-2109:08,연합뉴스 ,"삼성전자서비스, '베이비키트'후원",https://finance.naver.com/news/news_read.nhn?article_id=0009206461&office_id=001&mode=search&query=삼성전자&page=9,"['       삼성전자서비스, \'베이비키트\'후원      기사입력2017-04-21 09:08기사원문좋아요훈훈해요좋아요 평가하기공감좋아요0훈훈해요0슬퍼요0화나요0후속기사 원해요0댓글    (서울=연합뉴스) 지난 20일 수원 초록우산 어린이재단 경기지역본부에서 삼성전자서비스 임직원들이 사회복지시설의 영유아들을 위해 직접 만든 베이비키트를 재단에 전달하고 있다. 2017.4.21 [삼성전자 제공=연합뉴스]     photo@yna.co.kr최신 유행 트렌드 총집결 #흥(클릭!)연합뉴스 관련뉴스해당 언론사에서 선정하며 언론사 페이지(아웃링크)로 이동해 볼 수 있습니다.\xa0\'성희롱\' 앵커, 방송국에서 쫓겨난거 맞아? 퇴직금이…\xa0\'너도 선수?\' 2인조 결성한 70대 소매치기들\xa0\'썸남썸녀\'가 풍등 날리기에 열광하는 이유는\xa0""日경찰, 현금 40억원 강도사건에 한국인 포함 관련성 조사""\xa0경산 농협에 총 든 복면강도…5분만에 2천만원 털어좋아요0훈훈해요0슬퍼요0화나요0후속기사 원해요0기사제공 :']"
19,삼성전자, 2017-04-2109:06,이데일리 ,"KT, LG전자 가전제품과 연동되는 '홈IoT 서비스' 출시",https://finance.naver.com/news/news_read.nhn?article_id=0003805293&office_id=018&mode=search&query=삼성전자&page=9,"['       KT, LG전자 가전제품과 연동되는 \'홈IoT 서비스\' 출시      기사입력2017-04-21 09:06기사원문좋아요훈훈해요좋아요 평가하기공감좋아요0훈훈해요0슬퍼요0화나요0후속기사 원해요0댓글- 에어컨, 공기청정기를 포함한 전체 6종의 통신-가전 융합 서비스- 기가지니를 통한 음성인식 서비스[이데일리 김현아 기자] KT모델들이 KT가 LG전자와 함께 선보이는 ‘GiGA IoT 홈매니저’ 서비스를 소개하는 모습LG유플러스가 KT 자회사였던 KT지니(지니뮤직으로 사명변경)에 지분을 투자해서 2대 주주가 된 데 이어 KT가 LG전자 가전제품과 연동되는 ‘GiGA IoT 홈매니저’ 서비스 6종을 선보이며, ‘홈 IoT(Internet Of Things)’ 확산을 위한 협력을 강화해 관심이다.이번에 연동되는 6종의 가전제품은 에어컨, 공기청정기, 로봇청소기, 오븐, 냉장고, 세탁기로 양사의 IoT 플랫폼을 연동하여, 가정 내 와이파이(WiFi)로 연결된 무선 공유기(AP)를 통해 보다 편리한 서비스를 고객에게 제공할 수 있게 됐다.특히 최근 KT(030200)가 출시한 인공지능 TV ‘기가지니’와도 연동하여 사용할 수 있는데, 예를 들면 음성으로 ‘지니야, 에어컨 켜!’로 제품을 작동시키고, ON/OFF 기능뿐만 아니라 제습 모드처럼 세부 설정 및 제어까지 가능하다.KT와 LG전자는 6종 가전제품별로 기기 상태 확인, 원격 제어, 상태 통보 기능 등을 제공하는데, 예를 들어 언제 어디서나 GiGA IoT 홈매니저 APP을 통해 세탁기 작동 시간을 확인하고, 집에 도착하기 전에 세탁기가 종료되면 구김방지를 동작 시킬 수 있다. 제품의 리모컨을 찾지 않고 어디서든 에어컨이나 공기청정기를 작동시킬 수 있다. 서비스를 원하는 고객은 LG전자 베스트샵 등 온-오프라인 매장에서 Wi-Fi 통신이 가능한 가전제품을 구입한 후, LG전자 스마트홈 서비스인 ‘스마트씽큐’(SmartThinQ™) 계정을 가진 고객이 KT ‘GiGA IoT 홈매니저’ 서비스에 가입하면 된다.생활가전 6종 가운데 보유 중인 LG전자 생활가전 기기를 추가하는 방식으로 ‘GiGA IoT 홈매니저’ 이용이 가능하며, 올해 말까지 LG가전 연동 서비스 사용에 대한 기기 추가 시 발생하는 1,100원의 이용료(부가세 포함)를 기본으로 제공해 추가 요금이 부과되지 않는다.KT는 ‘GiGA IoT 홈매니저’ 서비스로 댁내 IoT 기기들을 고객 상황이나 라이프 스타일에 맞게 자동으로 복합제어 할 수 있도록 설정을 도와주는 서비스인 ‘레시피’ 기능을 제공 중이다. 사용자는 ‘레시피’ 기능을 통해 GiGA IoT 에어닥터에서 일정 수준 이상 실내 미세먼지 수치를 감지하면 LG전자 공기청정기를 자동으로 동작시킬 수 있는 등 다양한 자동 복합제어 서비스를 누릴 수 있다.KT GiGA IoT 사업단 김준근 단장은 “KT와 LG전자 간 홈 IoT 사업협력으로 편리하고, 차별화된 가전-통신 융합형 서비스를 선보이게 됐다”며, “고객들이 더욱 윤택한 삶을 누릴 수 있도록 LG전자와의 협력 외에도 기가지니와 연동된 다양한 홈 IoT 서비스를 선보일 계획이다”고 밝혔다.KT 는 이번 LG전자와 홈 IoT 사업협력으로 국내 대표 가전사인 LG전자와 삼성전자 주요 가전제품들과 연동하게 되었다.김현아 (chaos@edaily.co.kr)＜ⓒ종합 경제정보 미디어 이데일리 - 무단전재 & 재배포 금지＞이데일리 관련뉴스해당 언론사에서 선정하며 언론사 페이지(아웃링크)로 이동해 볼 수 있습니다.\'직주근접\' 서대문·광진 아파트, 경매시장서도 콧대 세[재벌공약 분석]너도나도 \'재벌개혁\'..총수일가 견제 강화조국 ""대통령이 \'북한주적\' 말하면 한반도 위기 고조""송민순, \'쪽지\' 공개..\'썰전\' 문재인 주장으로 내가 거짓말 한 게 돼최규선, 도주 14일 만에 순천서 체포..열흘 전 자수 의사 밝혀좋아요0훈훈해요0슬퍼요0화나요0후속기사 원해요0기사제공 :']"
0,삼성전자, 2017-04-2109:05,디지털타임스 ,"삼성전자서비스, 영유아 위해 ‘베이비키트’ 200개 지원",https://finance.naver.com/news/news_read.nhn?article_id=0002398879&office_id=029&mode=search&query=삼성전자&page=10,"['       삼성전자서비스, 영유아 위해 ‘베이비키트’ 200개 지원      기사입력2017-04-21 09:05기사원문좋아요훈훈해요좋아요 평가하기공감좋아요0훈훈해요0슬퍼요0화나요0후속기사 원해요0댓글 [디지털타임스 박슬기 기자] 삼성전자서비스는 사회복지시설에서 생활하고 있는 영유아를 위해 이달부터 130여명의 임직원과 그의 가족이 만든 \'베이비키트\' 200개를 초록우산 어린이재단에 기증했다고 20일 밝혔다. 베이비키트는 꼭지 모자, 턱받이, 속싸개,  딸랑이 인형 등 4가지로 구성했다.최예숙 초록우산 어린이재단 팀장은 ""삼성전자서비스 임직원의 정성으로 만든 베이비키트가 영유아들이 건강하게 성장하는데 밀알이 될 것으로 기대한다""고 말했다.오지상 삼성전자서비스 사원협의회 대표는 ""임직원과 가족들의 따뜻한 마음이 전해져 영유아들이 건강하고 밝게 자랐으면 좋겠다""며 ""앞으로도 영유아와 아동들이 꿈을 키워나가는 데 도움을 되는 활동을 지속할 계획""이라고 말했다.한편 삼성전자서비스는 청각장애아동의 인공와우 수술과 언어재활치료를 후원하고 사회복지시설에서 생활하고 있는 학생들을 위해 교복 구매비를 지원하는 등 사회공헌 활동을 이어가고 있다.박슬기기자 seul@dt.co.kr전병인(왼쪽에서 두 번째) 삼성전자서비스 상무와 최예숙(왼쪽에서 세 번째) 초록우산 어린이재단 팀장이 지난 20일 수원 초록우산 어린이재단 경기지역본부에서 베이비키트 200개 전달식을 가진 뒤 기념 촬영을 하고 있다.디지털타임스 홈페이지 바로가기/SNS 바로가기확바뀐 디지털타임스 연예·스포츠 섹션 바로가기< Copyrights ⓒ 디지털타임스 & dt.co.kr, 무단 전재 및 재배포 금지 >박슬기 seul@디지털타임스 관련뉴스해당 언론사에서 선정하며 언론사 페이지(아웃링크)로 이동해 볼 수 있습니다.\xa0순익격차 줄어든 \'신한 vs 국민\'… 리딩뱅크 경쟁 \'안갯속\'\xa0이통 4G LTE 속도경쟁 재점화…SKT, 800Mbps \'선공\'\xa0벤츠 7번째 SUV \'GLC쿠페\'…\'디자인·고성능\' 매력 발산\xa0""어라? 왜 이러지""…삼성 실적호조에도 주가 떨어지는 이유\xa0SK 1분기 최대영업익 예고…이노·하이닉스가 이끌었다좋아요0훈훈해요0슬퍼요0화나요0후속기사 원해요0기사제공 :']"
1,삼성전자, 2017-04-2109:04,이데일리 ,"“가전제품, 미리 배치해보고 산다”…AR 쇼핑시대 활짝",https://finance.naver.com/news/news_read.nhn?article_id=0003805289&office_id=018&mode=search&query=삼성전자&page=10,"['       “가전제품, 미리 배치해보고 산다”…AR 쇼핑시대 활짝      기사입력2017-04-21 09:04기사원문좋아요훈훈해요좋아요 평가하기공감좋아요0훈훈해요0슬퍼요0화나요0후속기사 원해요0댓글- 롯데하이마트, 스마트폰 앱 활용한 ‘AR쇼룸’ 서비스 출시- 증강현실 활용해 구매 전 인테리어와의 조화 확인 가능- AR쇼룸 론칭 기념, 인증샷 보내면 엘포인트 증정(자료=롯데하이마트)[이데일리 강신우 기자] 롯데하이마트가 스마트폰 앱을 이용해 가전제품을 배치해보면서 바로 살 수 있는 ‘AR쇼룸’ 서비스를 내놨다고 21일 밝혔다. ‘증강현실(AR·Augmented reality)’이란 현실 배경에 가상 이미지를 결합해 실제와 가상세계를 동시에 체험할 수 있는 기술이다. 최근 유명세를 탔던 포켓몬고(Pokemon Go)도 증강현실을 이용한 대표적인 사례이다.롯데하이마트가 출시한 ‘AR쇼룸’ 서비스는 최신 하이마트 앱을 다운 받아 사용할 수 있다. 하이마트 앱을 업데이트하면 바로 사용할 수 있다. 앱을 켜고 검색창을 터치하면 쇼룸 메뉴가 나온다. 쇼룸 메뉴를 터치해서 제품을 고르면, 스마트폰 화면에 카메라가 비춘 현실공간이 보이고 그 위에 제품이 배치된다. 상세 정보를 누르면 하이마트 쇼핑몰로 연결되어 선택한 상품을 바로 구입할 수 있다.롯데하이마트가 현재 ‘AR 쇼룸’에 운영하는 품목은 에어컨, TV, 냉장고, 김치냉장고, 세탁기, 의류건조기 6개 품목 50여개 모델이다. 매달 운영 모델을 50여개 추가하여 구매 선택의 폭을 넓힐 예정이다.롯데하이마트는 ‘AR 쇼룸’ 서비스 출시를 기념해, 하이마트쇼핑몰(www.e-himart.co.kr)에서 ‘AR 쇼룸 론칭’ 기념전을 진행한다. 에어컨, TV, 냉장고, 김치냉장고, 세탁기, 의류건조기 6가지 대표 가전제품 중 인기 모델을 총5억원 물량으로 준비했다. 행사 카드 결제 시 제품에 따라 최대 10%까지 할인 한다. LG전자 17kg 드럼세탁기 130만원대, 삼성전자 9kg 전기건조기를 100만원대, 대유위니아 15평형 투인원(벽걸이형·스탠드형) 에어컨을 160만원대에 판매한다.롯데하이마트는 오는 28일부터 다음 달 14일까지 ‘AR 쇼룸 인증 이벤트’도 진행한다. 행사 기간 ‘AR 쇼룸’을 이용해 가전 배치 사진을 본인 SNS에 올리고 인증샷(화면캡처)을 하이마트쇼핑몰(www.e-himart.co.kr)에 응모하면 된다. 선착순 1000명에게 엘포인트(L.Point) 3000점을 증정한다. 하이마트와 엘포인트(L.Point)를 모두 가입한 회원만 응모 가능하며 중복 응모는 불가능하다.한편 롯데하이마트는 고객 만족을 위해 새롭고 다양한 서비스를 지속적으로 도입해 선보이고 있다. 스마트픽과 옴니세일즈 서비스를 통해 온·오프라인을 아우르는 서비스를 제공하는 한편 플러스원 서비스, 홈케어 서비스 등 가전구매 고객을 위한 차별화된 서비스를 제공해 오고 있다.강신우 (yeswhy@edaily.co.kr)＜ⓒ종합 경제정보 미디어 이데일리 - 무단전재 & 재배포 금지＞이데일리 관련뉴스해당 언론사에서 선정하며 언론사 페이지(아웃링크)로 이동해 볼 수 있습니다.\'직주근접\' 서대문·광진 아파트, 경매시장서도 콧대 세[재벌공약 분석]너도나도 \'재벌개혁\'..총수일가 견제 강화조국 ""대통령이 \'북한주적\' 말하면 한반도 위기 고조""송민순, \'쪽지\' 공개..\'썰전\' 문재인 주장으로 내가 거짓말 한 게 돼최규선, 도주 14일 만에 순천서 체포..열흘 전 자수 의사 밝혀좋아요0훈훈해요0슬퍼요0화나요0후속기사 원해요0기사제공 :']"
2,삼성전자, 2017-04-2109:01,한국경제 ,(출발)삼성전자 202만4000원…0.50%↑,https://finance.naver.com/news/news_read.nhn?article_id=0003758923&office_id=015&mode=search&query=삼성전자&page=10,"['       (출발)삼성전자 202만4000원…0.50%↑      기사입력2017-04-21 09:01기사원문좋아요훈훈해요좋아요 평가하기공감좋아요0훈훈해요0슬퍼요0화나요0후속기사 원해요0댓글 한경닷컴[한경닷컴 바로가기] [스내커] [모바일한경 구독신청] ⓒ 한국경제 & hankyung.com, 무단전재 및 재배포 금지한국경제 관련뉴스해당 언론사에서 선정하며 언론사 페이지(아웃링크)로 이동해 볼 수 있습니다.""삼성전자, 단기 조정 후 추가 상승 전망""-KB파운드리에 힘주는 삼성전자""삼겹살 원가 얼만지 아세요?"" 이상한 진실""이 회사 절대 가지마세요"" 익명글…기업들 \'발칵\'\'골초·술고래\' 가장 많이 사는 곳 어디?좋아요0훈훈해요0슬퍼요0화나요0후속기사 원해요0기사제공 :']"
3,삼성전자, 2017-04-2109:00,머니투데이 ,"[스팟]삼성전자, 1만원(0.5%) 오른 202만4000원 출발",https://finance.naver.com/news/news_read.nhn?article_id=0003860725&office_id=008&mode=search&query=삼성전자&page=10,"['       [스팟]삼성전자, 1만원(0.5%) 오른 202만4000원 출발      기사입력2017-04-21 09:00기사원문좋아요훈훈해요좋아요 평가하기공감좋아요0훈훈해요0슬퍼요0화나요0후속기사 원해요0댓글 [머니투데이 진경진 기자] 21일 삼성전자 출발.[▶깊이있는 투자정보 \'TOM칼럼\'][▶트렌드 리더의 스타일 지침서 \'스타일M\'][▶빵빵한 차&레이싱걸]진경진 기자 jkjin@mt.co.kr머니투데이 관련뉴스해당 언론사에서 선정하며 언론사 페이지(아웃링크)로 이동해 볼 수 있습니다.서지혜, 모노키니 입고 뽐낸 바디라인…우아함이 \'물씬\'최화정 홈쇼핑 하더니… 연매출 960억 \'대박\'""14년 7월생-15년 9월생이 친구"" 安 학제개편 논란[단독]최태원 회장 보러온 \'딸\' 최민정 중위…사회적기업에 \'관심\'문재인 ""가만 서있는데 스탠딩 무슨 의미…답변시간도 부족""좋아요0훈훈해요0슬퍼요0화나요0후속기사 원해요0기사제공 :']"
4,삼성전자, 2017-04-2108:59,매일경제 ,"삼성전자 `클럽 드 셰프 코리아`, 리치몬드 제과점 권형준 셰프 영입",https://finance.naver.com/news/news_read.nhn?article_id=0003927923&office_id=009&mode=search&query=삼성전자&page=10,"['       삼성전자 `클럽 드 셰프 코리아`, 리치몬드 제과점 권형준 셰프 영입      기사입력2017-04-21 08:59기사원문좋아요훈훈해요좋아요 평가하기공감좋아요0훈훈해요0슬퍼요0화나요0후속기사 원해요0댓글(왼쪽부터) 강민구 셰프, 임기학 셰프, 새롭게 합류한 리치몬드 제과점 대표 권형준 셰프, 임정식 셰프, 이충후 셰프 [사진 제공 : 삼성전자]삼성전자는 \'클럽 드 셰프 코리아(Club des Chefs Korea)\'에 리치몬드 제과점 대표인 권형준 셰프가 합류했다고 21일 밝혔다.삼성전자 클럽 드 셰프는 프리미엄 주방 가전에 셰프들의 살아있는 아이디어와 생각을 접목하고 가정에 새로운 식문화를 전파하기 위해 결성된 팀이다. \'셰프컬렉션\' 제품 개발 단계부터 참여해 프리미엄 주방 가전에 맞는 차별화된 가치를 제공해왔다.지난 2013년 세계적 미슐랭 스타 셰프 8명으로 구성된 글로벌 그룹을 시작으로, 2015년 국내 프리미엄 가전 소비자들의 요구에 부응하기 위해 대한민국 최정상 셰프들로 구성된 클럽 드 셰프 코리아가 출범했다. 기존 구성원은 강민구, 이충후, 임기학, 임정식 셰프다. 클럽 드 셰프 코리아는 최근 홈 베이킹에 대한 소비자의 관심이 증가하고 수요가 늘어남에 따라 오븐 제품에 더욱 독창적이고 전문적인 아이디어를 더하기 위해 권형준 패스트리 셰프를 추가 영입했다.권형준 셰프는 1979년부터 이어져 온 한국 제과제빵의 산실로 서울 3대 제과점으로 불리는 \'리치몬드 제과점\'의 대표다. 선대 셰프였던 아버지의 가업을 2007년부터 이어받았다. 전통을 고수하되 이를 넘어서는 새로움으로 리치몬드 제과점의 명성을 더욱 높여가고 있다.삼성전자는 이번 권형준 셰프의 합류로 요리부터 베이킹까지 식문화 전반에 대한 전문성을 제품에 확대 적용할 방침이다. 또 향후 다양한 이벤트를 통해 새로운 홈베이킹 문화를 선도할 예정이다.삼성전자는 클럽 드 셰프와의 협업을 통해 ▲식재료의 맛과 향을 그대로 간직하게 해주는 셰프컬렉션의 \'미세정온기술\' ▲육류 조리 시 겉은 바삭하고 속은 부드럽게 익혀주는 직화오븐의 \'직화열풍\' 등 새로운 혁신 기술들을 잇따라 선보인 바 있다.삼성전자 관계자는 ""클럽 드 셰프 코리아 출범 2년 간 삼성전자 프리미엄 주방 가전은 세계 시장을 깜짝 놀라게 하는 혁신 기술들을 지속 선보였다""며 ""권형준 패스트리 셰프의 합류를 통해 앞으로 더 발전된 주방 가전 제품들과 새로운 기술을 선보일 것""이라고 말했다.[디지털뉴스국 박진형 기자][매일경제 공식 페이스북] [오늘의 인기뉴스] [매경 프리미엄][ⓒ 매일경제 & mk.co.kr, 무단전재 및 재배포 금지]매일경제 관련뉴스해당 언론사에서 선정하며 언론사 페이지(아웃링크)로 이동해 볼 수 있습니다.\'51살\' 김성령, 20대도 울고 갈 우월 각선미 \'입이 쩍\'인구절벽 \'발등의 불\'…의성·고흥 사라진다착시 효과 걷혔나? 롯데, \'봄\'이 저물고 있다미신·탐욕에 희귀동물 보르네오섬 천산갑 결국…이하늬, 아찔한 명품 몸매로 한껏 \'성난 애플힙\' 뽐내좋아요0훈훈해요0슬퍼요0화나요0후속기사 원해요0기사제공 :']"
