,회사명,날짜,언론사,기사제목,링크,본문
0,삼성전자, 2017-06-0423:30,한국일보 ,삼성전자의 최고급 TV 시장 승부수는 초대형 화면,https://finance.naver.com/news/news_read.nhn?article_id=0000206647&office_id=469&mode=search&query=삼성전자&page=1,"['       삼성전자의 최고급 TV 시장 승부수는 초대형 화면      기사입력2017-06-04 23:30기사원문좋아요훈훈해요좋아요 평가하기공감좋아요0훈훈해요0슬퍼요0화나요0후속기사 원해요0댓글 OLED보다 가격 경쟁력 있어 화면 키우기에 집중지난달 말 국내에 출시된 75인치 초대형 QLED TV. 삼성전자 제공삼성전자가 80형(인치) 이상 화면을 적용한 TV로 최고급 TV 시장에 승부수를 띄운다. 유기발광다이오드(OLED)보다 가격 경쟁력에서 앞서는 액정표시장치(LCD)의 이점을 극대화하는 전략이다.4일 가전업계에 따르면 삼성전자는 이달 말 화면 크기가 82인치인 초고화질(UHD) TV를 국내에 출시한다. 이어 오는 8월에 나노m급 발광형 반도체 결정체(퀀텀닷) 시트를 백라이트 앞에 적용해 컬러볼륨(색조) 100%를 구현한 ‘QLED TV’의 88인치 모델을 선보일 예정이다. 삼성전자는 올해 1월 미국 라스베이거스에서 열린 ‘국제전자제품박람회(CES) 2017’에서 “올 하반기에 88인치 QLED TV를 내놓겠다”고 밝힌 바 있다.현재 삼성전자의 UHD TV인 ‘뮤 시리즈’는 75인치가 가장 크고 QLED TV도 지난달 29일 출시한 75인치가 최대다. 75인치 QLED TV 중 곡면형 모델(Q8) 가격은 삼성전자 TV 중 가장 비싼 1,190만원이다. 88인치는 이보다도 가격이 더 뛰겠지만 삼성전자는 최고급 TV 시장에서 겨루는 LG전자의 OLED TV보다는 가격 경쟁력이 있다고 판단한다.유기발광다이오드(OLED) TV 중 가장 큰 77인치 초대형 제품. LG전자 제공LG전자 OLED TV는 지난달 중순 출시한 77인치 ‘시그니처 W’가 현재 가장 크다. OLED는 소재 자체가 비싸 이 제품의 출고가격은 3,300만원이다. 캐시백 400만원을 감안해도 실구매가는 2,900만원이다. OLED TV가 80인치대로 진입할 경우 QLED TV와의 가격 차이는 더 벌어지게 된다.가격은 비싸도 OLED TV는 백라이트가 필요 없어 제품 두께를 4㎜까지 얇게 만들 수 있는 큰 장점이 있다. 반면에 QLED TV는 별도 광원인 백라이트가 필요한 LCD 기반이라 두께를 줄이는 데는 한계가 있다. 삼성전자로서는 두께 대결 대신 화면 크기 대결로 승부를 거는 셈이다.삼성전자 관계자는 “88인치 QLED TV 가격은 아직 미정이지만 지상파 UHD 본방송이 시작돼 초고화질을 초대형 화면으로 즐기려는 수요가 분명히 있을 것”이라고 예상했다.김창훈 기자 chkim@hankookilbo.com▶한국일보 [페이스북] [카카오 친구맺기]▶자동차의 모든 것! [모클][ⓒ 한국일보(hankookilbo.com), 무단 전재 및 재배포 금지]한국일보 관련뉴스해당 언론사에서 선정하며 언론사 페이지(아웃링크)로 이동해 볼 수 있습니다.쓰레기 분리수거ㆍ재활용에 눈뜨는 중국말 듣지 않는다고 친딸 차로 친 40대 가장 실형이재명 ""문재인 정부 개혁 국민이 밀어줘야""박지원, 연일 여권 지원 발언… 왜?미스코리아 일본 진 김진앙좋아요0훈훈해요0슬퍼요0화나요0후속기사 원해요0기사제공 :']"
1,삼성전자, 2017-06-0420:46,세계일보 ,코스피 강세장에도 개미는 울었다,https://finance.naver.com/news/news_read.nhn?article_id=0003179348&office_id=022&mode=search&query=삼성전자&page=1,"['       코스피 강세장에도 개미는 울었다      기사입력2017-06-04 20:46기사원문좋아요훈훈해요좋아요 평가하기공감좋아요0훈훈해요0슬퍼요0화나요0후속기사 원해요0댓글5월 기관매수 수익률 13%/외인 매수 종목도 평균 4%/개인 매수 종목만 -0.45%주식시장에서 코스피가 급등한 5월 개인 투자자들이 매수한 종목은 마이너스 수익률을 기록한 것으로 나타났다.4일 금융정보업체 에프앤가이드에 따르면 지난달 코스피가 6.44% 상승했으나, 코스피시장(유가증권시장) 개인 순매수 상위 10종목의 평균 수익률은 마이너스 0.45%를 기록했다.지난달 개인 순매수 1위 종목 삼성전자가 0.18% 상승한 것을 제외하면 넷마블게임즈(-7.88%·12일 상장 시초가대비), 한국전력(-5.84%), 코스맥스(-9.89%), 두산인프라코어(-15.57%), SK이노베이션(-1.17%) 등 개인 순매수 상위 종목들이 대거 마이너스 수익률을 나타냈다. 같은 기간 개인이 집중적으로 팔아치운 종목은 코스피보다 2배가 넘는 13.80%의 평균 수익률을 거둬 대조를 보였다.반면 기관 순매수 상위 10종목의 평균 수익률은 12.97%로 코스피 상승률의 2배를 넘었다. 기관이 가장 많이 팔아치운 10종목의 평균 수익률은 1.46%에 그쳤다. 외국인이 가장 많이 사들인 10종목의 상승률도 평균 10.77%로 코스피 상승률을 크게 웃돌았다. 외국인 순매도 상위 10종목은 평균 4.03% 올랐다.증권업계 관계자는 “정보 접근성이나 기업의 기초여건과 시장 전체의 흐름 변화를 분석해 주가를 예측하는 데 개인이 외국인·기관보다 훨씬 떨어진다”고 말했다.신동주 기자 ranger@segye.comⓒ 세상을 보는 눈, 글로벌 미디어 세계일보세계일보 관련뉴스해당 언론사에서 선정하며 언론사 페이지(아웃링크)로 이동해 볼 수 있습니다.정유라 임신에 \'40년지기\' 우정 금 갔다?차유람""이지성과 첫키스 6시간, 배고팠다""""돈 빌려주면 만날게""…의사에게 사기친 女프로골퍼""아들 인생 망치지 마라"" 수저로 이마 때린 남친 어머니하룻밤에 수천만원…\'연예인\'을 산 남자들좋아요0훈훈해요0슬퍼요0화나요0후속기사 원해요0기사제공 :']"
2,삼성전자, 2017-06-0420:10,파이낸셜뉴스 ,[주간 금융상품 돋보기] 주간 금융상품 돋보기,https://finance.naver.com/news/news_read.nhn?article_id=0003824541&office_id=014&mode=search&query=삼성전자&page=1,"['       [주간 금융상품 돋보기] 주간 금융상품 돋보기      기사입력2017-06-04 20:10기사원문좋아요훈훈해요좋아요 평가하기공감좋아요0훈훈해요0슬퍼요0화나요0후속기사 원해요0댓글  휴대폰 음성인식 기능이 강화되면서 은행들이 음성인식을 통한 금융거래 서비스를 잇따라 선보이고 있다. KEB하나은행이 문자메시지(SMS) 를 통해 간편하게 송금할 수 있는 텍스트 뱅킹에 삼성전자의 지능형 인터페이스 기술인 \'빅스비(Bixby)\' 를 적용, 음성 명령으로도 금융거래를 할 수 있도록 만들었다. 신한은행도 음성인식 모바일 뱅킹서비스인 \'신한S뱅크 미니+\'를 출시했다. 아울러 은행들은 안정적인 수신고 증대를 위해 금리 우대형 적금 상품 출시에도 적극적이다.                ■KEB하나은행 \'음성인식 텍스트뱅킹\'텍스트뱅킹은 KEB하나은행이 지난해 11월 국내 최초로 문자메시지를 통해 간편하게 송금할 수 있는 신개념 대화형 금융플랫폼이다. \'음성인식 텍스트뱅킹\'은 여기에 삼성전자의 지능형 인터페이스 기술인 빅스비 를 적용, 음성 명령으로도 금융거래를 할 수 있도록 만들었다. 지난 2일 출시된 \'빅스비\' 기반의 이 서비스는 텍스트뱅킹을 통해 입금계좌를 \'별칭\'으로 미리 등록만 해 놓으면 된다.특히 KEB하나은행은 기존의 복잡한 보안매체 입력 프로세스를 대폭 정리했다. 등록된 입금계좌에 이체 시 지문 혹은 홍채를 통한 생체인증 한번만으로 끝나며 사전에 등록되지 않은 계좌로 이체 시에는 계좌비밀번호만 추가로 입력해주면 된다.현재는 삼성 갤럭시S8, S8+ 스마트폰을 사용하는 손님들은 해당 기종의 삼성페이 앱을 통해 KEB하나은행의 음성인식 텍스트뱅킹을 설치 및 이용할 수 있으며, 빅스비가 서비스되지 않는 삼성 갤럭시S7, S7엣지 기종에서는 음성이 아닌 터치 기반으로 앱을 이용할 수 있다 .                ■신한은행 \'두배드림 적금\'최고 연 2.6% 금리를 부여하는 적금이다. 적금 가입기간(24개월) 중 신한은행 입출금 통장으로 매월 10만원 이상을 12개월 이상 입금하면 기본금리 연 1.3%의 2배인 2.6%를 적용해준다.이 상품은 100만원, 300만원, 500만원 중 하나를 목표금액으로 선택해 매월 정해진 금액을 납입하는 방식이다. 상품 출시 기념 이벤트도 진행한다. 오는 7월 말까지 신한 판(FAN)클럽과 \'신한 두배 드림 적금\'을 동시에 가입하고 신한 판클럽 애플리케이션(앱)에서 응모하면 응모자 전원에게 적금 목표금액에 따라 1000, 3000, 5000 마이신한포인트를 제공한다.                ■우리은행 \'위비 짠테크 적금\'이 상품은 모바일 전용 적금상품으로 매일 저축액을 늘려 자동이체하거나, 남은 생활비를 간편이체하는 방식으로 구성된 것이 특징이다. 하루 단위로 저축을 늘리는 \'캘린더 강제저축\'과 생활비를 하루 단위로 쪼개 봉투에 넣어 사용하는 \'봉투 살림법\'에서 아이디어를 얻었다는 것이 우리은행 측의 설명이다.위비뱅크 전용 적금상품으로 1년제, 2년제, 3년제 중 선택할 수 있으며 월 최대 50만원까지 자유롭게 적립 가능하다. 1년제 기준으로 기본금리는 연 1.0%이고 우대금리 포함 시 금리는 최대 연 2.3%다.우대금리는 최대 연 1.3%포인트가 제공되며, 가입기간 중 매주 1000원씩 더 넣는 \'52주 짠플랜\'이나 한달 주기로 매일 1000원씩 입금액이 늘어나는 \'매일매일 캘린더플랜\', 절약한 하루 생활비를 바로바로 입금하는 \'1데이 절약플랜\'을 통해 일정 횟수 이상 입금된 실적이 있을 경우 연 1.0%포인트의 우대금리를 받을 수 있다.                ■\'NH스마트뱅킹 신규고객 꿀템득템 이벤트\'NH농협은행은 농협상호금융과 공동으로 NH스마트뱅킹 신규가입 후 로그인하는 고객을 대상으로 \'NH스마트뱅킹 신규고객 꿀템득템 이벤트\'를 진행한다. 이 이벤트 대상은 신규가입하고 로그인한 고객이다.응모고객 중 추첨을 통해 1등(2명) 갤럭시S8, 2등(60명) 신세계 모바일상품권 3만원권, 3등(438명) 스타벅스 모바일쿠폰 등 총 500명에게 경품을 제공한다.농협 관계자는 ""스마트뱅킹 신규가입 고객에게 감사한 마음으로 이벤트를 마련했다""며 ""고객들이 더욱 편리하고 차별화된 모바일 금융서비스를 받을 수 있도록 지속적으로 서비스를 개선해 나가겠다""고 말했다.                ■케이뱅크 \'GS25 모바일 상품권 제공 이벤트\'케이뱅크가 자동화기기(ATM) 어디에서나 수수료 없는 입금서비스를 시작한다. 케이뱅크 고객은 오는 8월 31일까지 3개월간 모든 ATM 입금서비스를 수수료 부담 없이 이용할 수 있다. 또 국내 전 은행권 및 우체국, 지하철역과 터미널 등 공공장소에 설치된 ATM에서 입금서비스를 이용한 고객을 대상으로 GS25 모바일 상품권 제공 이벤트도 시작한다. 이번 이벤트는 전국 16개 은행과 저축은행 등 전 금융기관은 물론 우체국과 지하철역, 터미널 등 공공장소에 설치된 ATM에 해당된다. 케이뱅크 체크카드를 사용해 유료로 케이뱅크 계좌에 입금한 고객에 한해 입금 건당 1000원 상당의 GS25 모바일 상품권이 제공된다.seilee@fnnews.com 이세경 기자     ▶ 세상의 모든 골 때리는 이야기 \'fn파스\'▶ 속보이는 연예뉴스 fn스타  ※ 저작권자 ⓒ  파이낸셜뉴스. 무단 전재-재배포 금지파이낸셜뉴스 관련뉴스해당 언론사에서 선정하며 언론사 페이지(아웃링크)로 이동해 볼 수 있습니다.벤츠 앞에 드러누운 주차요원, 운전자 엑셀 밟더니..JTBC 뉴스룸 굴욕, \'노룩취재\' 패러디 당하며 뭇매 맞더니 결국..웃는 모습 보이던 정유라, 수갑 채우자 하는 말이..SNS \'관심집중\' 女 간호사 사표.. 딱 붙는 유니폼 때문에?폭발 직전 한국당, \'그만큼 해먹었으면..\' 발언까지 나오더니 급기야좋아요0훈훈해요0슬퍼요0화나요0후속기사 원해요0기사제공 :']"
3,삼성전자, 2017-06-0420:03,파이낸셜뉴스 ,[주간 추천 종목] 삼성전자·현대미포조선·가온미디어,https://finance.naver.com/news/news_read.nhn?article_id=0003824540&office_id=014&mode=search&query=삼성전자&page=1,"[""       [주간 추천 종목] 삼성전자·현대미포조선·가온미디어      기사입력2017-06-04 20:03기사원문좋아요훈훈해요좋아요 평가하기공감좋아요0훈훈해요0슬퍼요0화나요0후속기사 원해요0댓글삼성전자- 자사주 소각이슈 주가 뒷받침현대미포조선- 원화강세로 수주 기대감↑가온미디어- 실적대비 주가 저평가 매력                     코스피지수의 상승세가 다소 주춤한 모습을 보인 가운데 증권가는 기존 증시를 주도하던 대형주들과 함께 실적 대비 저평가되고 있는 중소형주를 이번주의 추천종목으로 꼽았다.4일 증권업계에 따르면 이번주 국내 증시는 중국의 유동성 경색 우려, 국제유가 추가 하락 우려, 하드 브렉시트(영국의 유럽연합 탈퇴) 현실화 우려 등과 아울러 단기 급등에 따른 차익실현 욕구 확대가 예상된다. 이에 따라 주가가 조정을 받는 경우 추가 매수의 기회가 될 가능성이 높다는 증권사들의 분석이다.삼성증권은 삼성전자를 꾸준히 추천종목으로 제시하고 있다. 인수합병(M&A)을 통한 성장기대감 확대와 자사주 소각 이슈가 주가를 뒷받침할 것이라는 분석이다. 삼성증권은 또 한국은행 기준금리 인하 사이클의 종료로 KB금융을 추천하고, 현대중공업, 롯데케미칼, GS건설, 코스맥스, 파라다이스 등을 선호주로 꼽았다.하나금융투자는 NH투자증권, 엔씨소프트, 대한항공, 현대미포조선 등을 추천주로 들었다. 엔씨소프트는 리니지M 흥행 기대 고조, 대한항공은 단거리 경쟁이 심화되는데 비해 장거리에서는 경쟁력이 충분하다는 것이 추천사유다. 현대미포조선은 원화 강세 지속으로 수주 기대감이 증가하고 있다는 평가와 함께 추천종목에 이름을 올렸다.신한금융투자는 자회사 적자가 축소됐는 이유를 들어 모두투어를 추천하고, 보톨리눔톡신 국내 점유율 1위가 예상되는 휴젤도 선호주로 제시했다. 또 CJ CGV의 경우 올해 해외영업이익이 320% 성장할 것으로 예상하고 추천종목으로 들었다.KB증권은 로체시스템, 싸이맥스, 가온미디어를 추천종목으로 꼽았다. 로체시스템은 2.4분기 이후 실적 정상화 기대되고, 싸이맥스는 삼성전자, SK하이닉스 등 최종 고객사들의 설비투자 확대로 올해 사상 최대실적을 전망했으며, 가온미디어는 실적 대비 주가가 저평가 상태라는 분석과 함께 추천종목으로 제시했다.ahnman@fnnews.com 안승현 기자     ▶ 세상의 모든 골 때리는 이야기 'fn파스'▶ 속보이는 연예뉴스 fn스타  ※ 저작권자 ⓒ  파이낸셜뉴스. 무단 전재-재배포 금지파이낸셜뉴스 관련뉴스해당 언론사에서 선정하며 언론사 페이지(아웃링크)로 이동해 볼 수 있습니다.벤츠 앞에 드러누운 주차요원, 운전자 엑셀 밟더니..JTBC 뉴스룸 굴욕, '노룩취재' 패러디 당하며 뭇매 맞더니 결국..웃는 모습 보이던 정유라, 수갑 채우자 하는 말이..SNS '관심집중' 女 간호사 사표.. 딱 붙는 유니폼 때문에?폭발 직전 한국당, '그만큼 해먹었으면..' 발언까지 나오더니 급기야좋아요0훈훈해요0슬퍼요0화나요0후속기사 원해요0기사제공 :""]"
4,삼성전자, 2017-06-0420:03,파이낸셜뉴스 ,"[Money & Money] 외국인만 따라갔어도… 코스피 흐름 못 쫓아가는 개인,...",https://finance.naver.com/news/news_read.nhn?article_id=0003824539&office_id=014&mode=search&query=삼성전자&page=1,"['       [Money & Money] 외국인만 따라갔어도… 코스피 흐름 못 쫓아가는 개인, 왜      기사입력2017-06-04 20:03기사원문좋아요훈훈해요좋아요 평가하기공감좋아요0훈훈해요0슬퍼요0화나요0후속기사 원해요0댓글장기 가치투자 기반한 외국인, 개인들이 따라가기 쉽지 않아5월 외국인 최다 순매수 종목 코웨이 3096억원어치 담아.. 삼성바이오로직스 최고 수익개인, 외국인이 집중 매도한 삼성전자 가장 많이 사들여엔씨소프트.넷마블.오리온 등 반대매매 여전 강세장서 소외                     외국인투자자들이 올해 들어 사상 최고 수준까지 오른 코스피지수에 힘입어 짭짤한 수익을 거두고 있다. 반대로 개인은 여전히 상대적으로 저조한 성과에 머물고 있는 것으로 나타났다. 개인의 매매패턴이 외국인과 반대 경향을 보이면서 코스피 흐름과 동조되는 외국인이 수익을 거둬도 손실을 보고 있다는 분석이다.■외국인 상위 순매수 종목 모두 수익4일 에프앤가이드 및 금융투자업계에 따르면 지난 5월 한 달 간 외국인이 가장 많이 사들인 주식은 코웨이로 모두 3096억원의 순매수를 기록했다. 그 다음으로 현대중공업(2800억원), 현대모비스(2264억원), LG전자(1862억원), SK텔레콤(1401억원) 등의 순이었다.외국인 순매수 상위 10종목 가운데 가장 높은 주가상승률을 기록한 것은 삼성바이오로직스로 5월 초 17만5000원에서 마지막 날 22만원으로 25.71%가 올랐다. 현대모비스(23.65%), LG전자(19.39%), 현대차(13.19%) 등의 수익률도 두 자릿수를 넘는 등 주가가 떨어진 종목은 없었다.기관의 경우도 순매수 상위 10종목에서 모두 플러스 수익률을 보였다. 현대모비스(23.65%), 삼성SDI(20.36%) 등이 20% 넘게 상승했고, 현대차(13.19%), 기아차(12.05%), 오리온(18.05%) 등도 월초 대비 높은 상승률을 나타냈다.개별 종목 기준으로 기관은 지난 한 달 간 현대차를 2044억원어치 순매수한 것을 비롯해 SK(1404억원), 포스코(1232억원), 현대모비스(1172억원) 등을 집중적으로 사들였다.반면, 같은 기간 개인은 삼성전자 7564억원을 비롯해 넷마블게임즈(3285억원), 한국전력(2903억원), 엔씨소프트(2238억원) 등에 집중 투자했다.상위 10개 종목 가운데 오리온(18.05%) 정도가 두드러진 상승세를 나타냈을 뿐 한국전력(-5.84%), 코스맥스(-9.86%), 삼성전자우선주(-0.23%), SK이노베이션(-1.17%) 등의 주가는 오히려 하락했다. 특히 개인이 5월 한 달 간 730억원어치를 사들인 STX중공업의 경우 주가가 2만1000원에서 1만550원으로 49.76% 급락했다.■개인 외국인과 반대매매 여전개인들은 외국인이 순매도한 종목을 집중적으로 매수했던 것으로 나타났다. 5월 한 달 간 외국인이 가장 많이 팔아치운 종목은 삼성전자로 5815억원의 순매도를 기록했다. 이어 엔씨소프트(3090억원), 넷마블게임즈(3057억원), 오리온(1827억원) 등의 순매도 규모가 컸다.이들 종목은 모두 5월 중 개인이 가장 많이 사들인 10개 종목에 포함됐다. 외국인이 팔아치운 종목을 개인이 받는 모습이 지속적으로 나타났다는 뜻이다. 금융투자업계 관계자는 ""일반적으로 개인들은 외국인이 매도에 나서면 주식을 매수하고 외국인이 매수하면 매도하는 경향을 보이고 있다""며 ""하지만 주가 흐름이 외국인 매매동향에 따라 움직이는 만큼 개인이 성과를 내기는 쉽지 않은 상황""이라고 설명했다.이 때문에 일각에서는 개인들이 외국인의 투자매매 패턴을 따라가면 최소한의 수익을 얻을 수 있다는 전망을 내놓고 있다. 선제적인 투자를 통한 고수익보다는 상대적으로 안정적인 수익을 추구하는 방식에 나서야 한다는 것이다.하지만 외국인의 투자패턴을 개인이 따라가기는 현실적으로 불가능하다는 지적도 제기된다. 다른 금융투자업계 관계자는 ""코스피 상승장에서 개인들이 번번이 투자에 실패하면서 외국인이 선호하는 실적 향상 종목에 대한 투자 관심이 높아지고 있는게 사실""이라며 ""그러나 주식의 내재가치를 분석한 장기투자를 기본으로 하는 외국인 투자방식을 개인들이 따라가기는 쉽지 않을 것""이라고 강조했다.kim091@fnnews.com 김영권 기자     ▶ 세상의 모든 골 때리는 이야기 \'fn파스\'▶ 속보이는 연예뉴스 fn스타  ※ 저작권자 ⓒ  파이낸셜뉴스. 무단 전재-재배포 금지파이낸셜뉴스 관련뉴스해당 언론사에서 선정하며 언론사 페이지(아웃링크)로 이동해 볼 수 있습니다.벤츠 앞에 드러누운 주차요원, 운전자 엑셀 밟더니..JTBC 뉴스룸 굴욕, \'노룩취재\' 패러디 당하며 뭇매 맞더니 결국..웃는 모습 보이던 정유라, 수갑 채우자 하는 말이..SNS \'관심집중\' 女 간호사 사표.. 딱 붙는 유니폼 때문에?폭발 직전 한국당, \'그만큼 해먹었으면..\' 발언까지 나오더니 급기야좋아요0훈훈해요0슬퍼요0화나요0후속기사 원해요0기사제공 :']"
