,회사명,날짜,언론사,기사제목,링크,본문
6,삼성전자, 2017-06-0410:00,뉴스1 ,"공정위원장 ""시장 충격 덜한 500만주 선택"" 삼성 사건의 재구성",https://finance.naver.com/news/news_read.nhn?article_id=0002768468&office_id=421&mode=search&query=삼성전자&page=4,"['       공정위원장 ""시장 충격 덜한 500만주 선택"" 삼성 사건의 재구성      기사입력2017-06-04 10:00기사원문좋아요훈훈해요좋아요 평가하기공감좋아요0훈훈해요0슬퍼요0화나요0후속기사 원해요0댓글이재용 삼성전자 부회장이 2일 서울 서초구 중앙지법에서 열린 \'최순실 국정농단 사건\' 뇌물공여 등 23회 공판에 출석하기 위해 호송차에 내려 법정으로 향하고 있다. 2017.6.2/뉴스1 © News1 김명섭 기자특검 ""외압과 로비 때문"" VS 변호인 ""통상 업무·로비 없었다"" 증인들 ""공정위 자체 판단, 법 개정 후 첫 사례라 생긴 혼란""(서울=뉴스1) 장은지 기자 = ""청와대 외압과 삼성 로비 때문"" VS ""통상적인 업무협의, 로비 관계 없는 공정위 자체 판단""두 달 가까이 진행되고 있는 이재용 삼성전자 부회장 등에 대한 공판중 삼성물산 주식처분조치와 관련된 논란은 이렇게 요약된다. 특검은 삼성물산 합병 당시 처분해야 할 주식수가 1000만주에서 500만주로 줄어든 이유를 청와대의 외압과 삼성의 로비 때문으로 보고 있다. 반면 삼성 측 변호인은 외압이나 로비는 없었고 공정거래위원회의 자체적인 판단에 따른 것이라고 맞서고 있다. 최근 진행된 공판에서는 정재찬 공정위 위원장과 김학현 전 부위원장, 최상목 전 청와대 경제금융비서관이 증인으로 출석, 당시 상황에 대해 증언했다.공정위 수장의 증언을 바탕으로 사건을 재구성하면 이런 그림이 그려진다. 진실게임은 2015년 12월16일 있었던 공정위 전원회의 전후로 거슬러 올라간다.◇ 정 위원장 ""지금도 무엇이 신규 순환출자에 해당되는지 모르겠다""당시 정 위원장은 삼성의 처분주식수 규모를 놓고 공정위 내부에서 해석이 갈리자 법률전문가들의 의견을 광범위하게 들어보라고 김학현 부위원장에 지시했다. 공정위의 법 해석에 중대한 오류가 있는것이라면 고쳐야 하지 않겠느냐는 취지였다는 것이다.공정위 내부에선 삼성 순환출자건을 담당한 실무자인 석동수 사무관이 해석한 1000만주 처분에 대해 이견이 있었다. 당시 상황에 대해 정 위원장은 ""김 부위원장이 재검토해야 한다고 하길래 김 부위원장이 전문가지만 그가 아무리 잘 알아도 무조건 확신하고 추진할 수는 없으니 전문가들의 의견을 들어보라고 했다""며 ""그런 차원에서 전원회의에 토의안건으로 올리라 한 것""이라고 설명했다. 정 위원장은 ""솔직히 내가 해본 분야가 아니라 잘 모르는 사안이었고 지금도 어떤게 순환출자 고리 \'형성\'이고 \'강화\'인지 모르겠다""고 했다. 정 위원장은 해당부서 국장에게 법률전문가들의 얘기를 광범위하게 들어보라 했지만 현실적 한계가 있었다. 유명 로펌들은 대기업들을 고객으로 두는 등 이해가 상충할 소지가 있어 로펌에 의견을 구하는 것이 어려웠다. 이에 공정위 내부에 파견온 법원과 검찰 출신 전문가 두 명에게만 의견을 구했다. 이처럼 의견이 폭넓게 수렴되지 못하자 전원회의를 열어 더 다양한 의견을 듣고자 한 것이다. 정 위원장은 ""당시 실무자들도 자신들의 안에 대해 아주 자신이 있지는 않았기 때문에 전원회의에 올린 것이지 삼성의 처분주식수를 변경하겠다는 의도를 갖고 회의를 연 것이 아니다""라고 특검 측 주장을 반박했다.◇공정위원장 ""개정법 첫 적용 사례라 명확한 가이드라인이 필요했다""삼성이 처분해야 하는 물산 주식수는 처음 1000만주(삼성전기 500만+삼성SDI 500만)에서 500만주(삼성SDI 보유)로 줄었다. 삼성물산-제일모직 합병으로 문제가 된 삼성전기가 포함된 순환출자고리에 대한 공정위 해석이 \'형성\'에서 \'적용제외\'로 변경됐다. 이에 따라 삼성전기가 보유한 물산 주식 500만주는 순환출자 금지대상에서 제외됐다. 이에 대해 삼성은 법의 첫 적용 당사자로서 주무부처에 정당한 의견개진을 했을 뿐 청탁은 없었다는 입장으로 맞서고 있다. 그러나 특검은 공정위 부위원장과 삼성 측이 외부에서 만나 식사를 하고, 청와대 비서관이 이 사안을 두고 부위원장과 수차례 통화를 했다는 점 등을 들어 청탁이 오갔다고 보고 있다.공정위는 삼성 뿐 아니라 앞으로 법 적용을 받게될 다른 대기업을 위해서 가이드라인이 필요했다고 주장하고 있다. 전원회의가 열리는 등 재검토가 이뤄진 것이 꼭 삼성 때문만은 아니었다는 것이다.정 위원장은 ""가이드라인을 정확히 만들어서 삼성 한 건을 위해서가 아니라 합리적인 것을 만들어서 하자는 취지였다""고 설명했다. 명확한 가이드라인이 필요했던 이유는 삼성 건이 개정 공정거래법이 적용되는 첫 사례였기 때문이다. 개정 공정거래법 9조2항은 상호출자제한 기업집단 소속회사의 순환출자를 형성하는 계열출자를 금지하고 있다. 기존 순환출자 고리는 인정하지만 추가적인 계열출자는 금지하고 있다. 다만 합병에 의한 경우는 곧바로 순환출자 금지 위반에 해당하는 것이 아니라 유예 또는 적용제외 사유에 해당한다.삼성이 법 개정 후 첫 타깃이 되면서 경제계는 물론 법조계와 학계에 논쟁을 불러일으킨 사안이다. 2014년 7월25일 법이 개정됐지만 이후 1년이 지나도록 적용사례가 없어 주무부처인 공정위도 이 법 해석에 대한 가이드라인을 정하지 못하고 있었다. 삼성이 이에 대한 의견을 요청하자 부랴부랴 검토에 들어갔고, 법 개정 이후 1년 5개월만인 2015년 12월24일 가이드라인을 발표하기에 이른다.정재찬 공정거래위원장이 11일 서울 여의도 국회에서 열린 정무위원회 전체회의에서 의원들의 질의에 답변하고 있다. 2017.1.11/뉴스1 © News1 송원영 기자◇개정 공정거래법 적용 첫 사례…""소신과 양심에 따라 결정한 것""사안이 복잡하고 선례가 없다보니 전원회의에서도 결론을 내지 못했다. 공정위 수장인 정 위원장 조차 이 분야는 전문가가 아니라 어느 해석이 맞는지 갈피를 잡지못했다. 정 위원장은 ""전원회의에 토의안건으로 올려 전문가들의 의견을 들었지만 전문가들조차 \'너무 어렵다\', \'무슨 말인지 모르겠다\' 는 중구난방으로 말이 많아 어떤 게 다수가 지지하는 것인지도 파악할 수 없었다""며 ""이후 다시 검토해 500만주안과 900만주안 모두 법리적으로 가능하다고 하길래 국회와 언론에서 비판할 것을 알았지만 금융시장에 충격이 덜한 500만주로 결정하게 된 것""이라고 증언했다. 정 위원장은 당시 전원회의까지 열며 첫 1000만주 보고서를 재검토했던 이유에 대해 ""첫 가이드라인을 만드는 것이다 보니 삼성이 됐든 현대차가 됐든 합리적인 안을 만들자는 것이었다""며 ""삼성만 놓고 보면 바이어스(편견)가 들어가서 안된다고 생각했고 앞으로 기업들에 적용될 가이드라인을 만들자는 취지에서 전원회의가 열린 것""이라고 해명했다.김종중 전 삼성 미래전략실 사장과 저녁식사를 해 청탁의 통로로 지목된 김학현 전 공정위 부위원장도 ""순환출자 고리 해석에 있어 전문가로서 소신과 양심에 따라 실무진의 오류를 바로잡은 것일 뿐 삼성과는 무관하다""고 증언했다. 청와대의 외압을 공정위에 전달한 연결고리로 지목된 최상목 전 청와대 경제금융비서관과의 통화에 대해서는 ""당시 최 비서관은 내게 \'법과 원칙대로 하고 기업 입장을 봐줄 필요는 없다\'고 했고 나 역시 내가 기업 입장을 왜 봐주냐고 답했다""고 주장했다. 위 사안에 대한 특검과 삼성의 온도차도 상당하다. 특검은 순환출자 사안이 삼성이 대통령에 로비를 할 정도로 중대한 사안이었다고 판단, 대가성 청탁이 오갔다고 보고 있다. 그러나 삼성은 ""법무법인 등을 통해 의견을 구한 결과 순환출자 강화에 해당하지 않아 처분해야 할 주식이 없다는 의견을 받고 안심하고 있었던 상황""이라며 ""이미 합병 이후 통합물산에 대한 지배력은 오너일가 지분이 30%가 넘는 등 충분한 상태라 처분주식수가 500만주 늘고 줄어드는 것은 중요하지 않았다""고 항변하고 있다. 더욱이 어차피 지주회사로 이행할 경우 전량 처분했어야 하는 주식이라 처분주식수를 줄이겠다고 청와대에 청탁을 넣을 사안이 될수도 없었다는 입장이다.seeit@▶ 놓치면 후회! 최신 만화 보기 / 2017년 나의 운세 보기▶ 여러분의 제보를 기다립니다. 제보하기(클릭!)[© 뉴스1코리아(news1.kr), 무단 전재 및 재배포 금지]뉴스1 관련뉴스해당 언론사에서 선정하며 언론사 페이지(아웃링크)로 이동해 볼 수 있습니다.\'대마초 흡연\' 탑, 사과문 ""돌이킬수 없는 상처 드려 죄송""아동 음란물 수백여개 보관·공유 20대…\'초등학생\' 의심 파일도 수두룩""성관계 여부 검사하는거야"" 의붓딸 성추행""인격모독·폭행 당해""…조카가 외삼촌 둔기 살해정신질환 노인 감금·폭행해 50억 뜯은 일당좋아요0훈훈해요0슬퍼요0화나요0후속기사 원해요0기사제공 :']"
7,삼성전자, 2017-06-0409:56,이데일리 ,집안풍경까지 바꿔놓은 미세먼지…하이마트 4개월새 70% `쑥',https://finance.naver.com/news/news_read.nhn?article_id=0003842010&office_id=018&mode=search&query=삼성전자&page=4,"['       집안풍경까지 바꿔놓은 미세먼지…하이마트 4개월새 70% `쑥\'      기사입력2017-06-04 09:56기사원문좋아요훈훈해요좋아요 평가하기공감좋아요0훈훈해요0슬퍼요0화나요0후속기사 원해요0댓글- 롯데하이마트, 백색가전 판매 증가로 1분기 실적 개선- \'\'제2의 김치냉장고\'\' 빨래건조기, 미세먼지 문제로 필수가전 등극 기대- 올 2분기부터 갤럭시S8 효과 가세…실적 개선 지속[이데일리 박형수 기자]?미세먼지 탓에 실내에 머무르는 시간이 길어진 가운데 롯데하이마트가 최대 수혜주로 떠올랐다. 공기 청정기는 물론이고 빨래건조기와 에어컨 판매량이 급증한 덕분이다. 실적이 좋아질 것이라는 전망에 무게가 실리면서 주가는 올 들어 빠르게 상승하고 있다.?4일 마켓포인트에 따르면 롯데하이마트 주가는 지난 2월6일 연중 최저가 4만350원을 기록한 뒤로 4개월 만에 70% 상승했다. 지난 2일 장 중 한때 7만100원을 기록하며 52주 신고가를 다시 썼다. 이 기간 기관 투자가 누적 순매수 규모는 115만주에 달했다. 외국인 보유 지분율도 10.47%에서 12.12%로 1.65%포인트 높아졌다. 기관과 외국인은 각각 61억원, 318억원어치 주식을 순매수했다.롯데하이마트는 지난 1분기에 매출액 8970억원, 영업이익 364억원을 기록했다. 지난해 같은 기간보다 각각 1.0%, 30.1% 늘었다. 영업이익은 시장 기대치 310억원을 17.0% 웃돌았다. 건조기와 에어컨, 공기청정기 등 백색가전 매출이 전년 동기 대비 14.5% 늘면서 수익성 개선을 이끌었다.남옥진 삼성증권 연구원은 “미세먼지 문제가 심각해지면서 빨래건조기, 공기청정기, 스타일러, 에어컨 등이 잘 팔리고 있다”며 “특히 빨래건조기는 과거 김치냉장고 보급률 상승기와 비슷한 흐름을 보이고 있다”고 설명했다.미세먼지 탓에 창문을 열어두지 못하는 날이 많아지면서 가정 내 백색가전 종류가 다양해지고 있다. 이전까지 필수 가전 제품으로 분류하지 않았던 공기청정기와 빨래건조기, 제습기 등을 구비하는 가정이 늘고 있다. 게다가 기온까지 올라가면서 에어컨을 설치하려는 수요도 늘고 있다.임영주 흥국증권 연구원은 “올 2분기는 백색가전이 실적개선을 이끌 것”이라며 “에어컨은 지난달까지 전년 대비 100% 성장했고 공기청정기와 빨래건조기 판매량도 200%이상 늘었다”고 분석했다.게다가 삼성전자가 새로운 스마트폰 갤럭시S8을 지난 4월 출시하면서 2분기에는 롯데하이마트 휴대폰 부문 실적 개선도 더해질 것으로 보인다. 손효주 하이투자증권 연구원은 “지난해 부진했던 모바일 매출이 늘어날 것”이라며 “갤럭시 S8에 이어 올 하반기 출시하는 갤럭시노트8도 실적 개선에 도움을 줄 것”이라고 내다봤다.?박형수 (parkhs@edaily.co.kr)＜ⓒ종합 경제정보 미디어 이데일리 - 무단전재 & 재배포 금지＞이데일리 관련뉴스해당 언론사에서 선정하며 언론사 페이지(아웃링크)로 이동해 볼 수 있습니다.최재원 부회장, SK그룹 배터리 드라이브 건다카드 수수료 인하 후폭풍 논란.. 4000억원 수익 감소 vs \'공포 마케팅\'미혼男 41% ""동거경험 있어도 이상형이면 결혼 가능""돌싱, 냉전 중 부부간 의사소통 男 \'카톡\' vs 女 \'뚱\'757회 로또 1등 21명 쏟아져..충북선 수동 2개 1등 동시당첨좋아요0훈훈해요0슬퍼요0화나요0후속기사 원해요0기사제공 :']"
8,삼성전자, 2017-06-0409:43,한국경제 ,"삼성전자, 리모콘 달린 '전기 건조기' 출시",https://finance.naver.com/news/news_read.nhn?article_id=0003777533&office_id=015&mode=search&query=삼성전자&page=4,"['       삼성전자, 리모콘 달린 \'전기 건조기\' 출시      기사입력2017-06-04 09:43기사원문좋아요훈훈해요좋아요 평가하기공감좋아요0훈훈해요0슬퍼요0화나요0후속기사 원해요0댓글삼성전자가 삼성 전기 건조기에 리모컨을 추가해 편리성을 강화한 신규 모델을 출시했다. 건조기를 드럼세탁기 위에 두고 쓰는 사용 패턴을 고려해 손이 닿지 않아 조작이 다소 불편할 수 있다는 점을 개선하기 위해 리모콘을 추가했다. 실버, 화이트 컬러로 출고가는 129만9000원부터 139만9000원이다.리모콘에 디스플레이창이 있어 어떤 코스를 선택하는지 높이 있는 제품을 직접 보지 않아도 리모컨의 창으로 바로 확인할 수 있다.삼성 건조기는 전기 건조기로 저온건조와 제습 과정을 반복하는 히트펌프(Heat-Pump) 기술을 적용했다. 고온열풍으로 건조하는 기존 방식 대비 옷감 손상을 최소화하고 전기료를 절약할 수 있는 것이 특징이다.김하나 한경닷컴 기자 hana@hankyung.com기사제보 및 보도자료 open@hankyung.com[한경닷컴 바로가기] [글방] [모바일한경 구독신청] ⓒ 한국경제 & hankyung.com, 무단전재 및 재배포 금지한국경제 관련뉴스해당 언론사에서 선정하며 언론사 페이지(아웃링크)로 이동해 볼 수 있습니다.文 정부 장관 후보자 4인…평균 재산이20대女 승무원 · 대기업 관두고 운동 택한 이유가""대형평수 필요없다"" 싸진 33평, 지금이 기회?미세먼지 마스크 귀찮아서 안썼는데…\'충격 사실\'""쏘나타 믿었는데…"" 현대자동차에 무슨 일이좋아요0훈훈해요0슬퍼요0화나요0후속기사 원해요0기사제공 :']"
9,삼성전자, 2017-06-0409:41,KBS ,"급증하던 D램 가격, 지난달엔 숨 고르기…전달 수준 유지",https://finance.naver.com/news/news_read.nhn?article_id=0010463927&office_id=056&mode=search&query=삼성전자&page=4,"['       급증하던 D램 가격, 지난달엔 숨 고르기…전달 수준 유지      기사입력2017-06-04 09:41기사원문좋아요훈훈해요좋아요 평가하기공감좋아요0훈훈해요0슬퍼요0화나요0후속기사 원해요0댓글 가파르게 오르던 D램 가격이 5월에는 숨 고르기에 들어가며 전달 수준을 유지했다. 4일 시장조사업체 D램익스체인지에 따르면 D램의 대표 제품인 \'DDR4 4Gb(기가비트) 512Mx8 2133㎒\'의 평균 계약가격(고정거래가격)은 5월 26일 기준 3.09달러로 집계됐다. 이는 약 한 달 전인 4월 28일의 가격과 똑같은 것이다. D램익스체인지는 ""1분기에 D램의 가격이 40%나 급등하면서 PC 제조업체들의 분위기가 바뀌었다""며 ""예전에는 매달 가격을 협상하기를 원했으나 점차 분기에 한 번씩 D램 제조사와 협상하는 것을 선호하는 쪽으로 바뀌고 있다""고 설명했다. 대다수의 PC 제조사들이 4월에 이미 가격 협상을 마무리하면서 5월에는 추가 협상이 별로 없었다는 것이다. D램익스체인지는 하반기에는 D램 가격이 하락하거나 오르더라도 소폭 오르는 데 그칠 것으로 전망했다. 스마트폰 등 모바일 기기의 저장장치 등에 쓰이는 낸드플래시 가격도 비슷했다. 범용제품인 \'128Gb 16Gx8 MLC\' 평균 계약가격은 같은 날 기준 5.52달러로 전달(5.51달러)보다 0.2% 오르는 데 그쳤다. D램익스체인지는 ""낸드플래시의 공급이 충분하지 않은 가운데, 고객사들이 주문을 늘리는 대신 다소 보수적인 태도를 유지했다""고 풀이했다. 하지만 앞으로의 가격 전망에 대해서는 ""여전히 강세를 보일 것""이라고 D램익스체인지는 예측했다. 한편 1분기 낸드플래시 시장에서 삼성전자는 35.4%의 시장 점유율로 1위 자리를 지켰다. D램익스체인지 집계에 따르면 삼성전자는 낸드플래시 시장에서 42억1천560만 달러의 매출을 올리며 1위를 유지했다. 작년 4분기(37.4%)보다는 점유율이 소폭 낮아졌다. 2위는 웨스턴 디지털(17.9%)로 21억3천370만 달러를 벌었다. 3∼5위는 차례대로 도시바(16.5%), 마이크론(11.9%), SK하이닉스(11.0%) 순이었다.지형철기자 (ican@kbs.co.kr)▶ [저작권자ⓒ KBS 무단복제-재배포 금지]KBS 관련뉴스해당 언론사에서 선정하며 언론사 페이지(아웃링크)로 이동해 볼 수 있습니다.지워져야 살아남는 \'사초\'…\'정태제 사초\'는 예외인 이유드라마 \'김씨네 편의점\', 북미 성공 비결은?[영상] 한편의 동화 같은 캥거루 구조 현장[영상] 자동차 클랙슨 댄스 빵!빵!빵![영상] 교통사고 현장에서 빛난 반려견의 \'충성심\'좋아요0훈훈해요0슬퍼요0화나요0후속기사 원해요0기사제공 :']"
10,삼성전자, 2017-06-0409:31,한국경제 ,[시선+] 드디어 출시된 'LG 페이'…집나간 LG팬심 돌아올까,https://finance.naver.com/news/news_read.nhn?article_id=0003777530&office_id=015&mode=search&query=삼성전자&page=4,"['       [시선+] 드디어 출시된 \'LG 페이\'…집나간 LG팬심 돌아올까      기사입력2017-06-04 09:31기사원문좋아요훈훈해요좋아요 평가하기공감좋아요0훈훈해요0슬퍼요0화나요0후속기사 원해요0댓글LG페이, 모바일 오프라인 결제시장 진입…2년 빠른 삼성 페이 대비 고전할 듯LG전자, ""페이 기능 도입으로 고객 이탈 방지""LG 페이가 우여곡절 끝에 드디어 시장에 나왔다. 당초 예상보다 9개월 정도 늦은 출시다.원래 LG 페이는 지난해 9월 출시한 \'LG V20\'에 탑재될 계획이었지만 \'화이트카드\' 테스트 과정에서 예기치 않은 문제가 발생해 무산됐다. 곧바로 LG전자는 화이트카드 방식을 포기하고 자체 기술 개발에 매진했다. 그러나 LG 페이는 \'LG G6\' 출시일에도 나오지 못했고 결국 출시 3개월이 지난 최근에서야 빛을 보게 됐다.LG 페이는 기기를 일반 신용카드 단말기에 갖다대면 결제되는 삼성 페이의 \'MST(Magnetic Secure Transmission)\' 방식과 유사한 ‘WMC(Wireless Magnetic Communication)’기술을 적용했다. 두 페이는 기능면에서 비슷하지만 이용자수와 적용 범위는 비교가 되지 않을 정도다.국내 모바일 간편결제 시장은 네이버(네이버 페이)·삼성전자(삼성 페이)·카카오(카카오 페이)·NHN엔터테인먼트(페이코) 등이 각축을 벌이고 있지만, 신용카드 기반의 오프라인 결제 시장은 삼성전자의 독무대다.삼성 페이는 서비스 출시 1년만인 지난해 8월 누적 거래건수 1억건을 돌파한 데 이어 지난 3월 기준으로 누적 거래 2억4000만건을 기록했다. LG 페이의 가세로 양자 경쟁 구도가 형성됐지만 LG로선 버거운 상황이다.출시한지 2년이 다 된 삼성 페이는 이제 막 시작한 LG 페이에게 골리앗 같은 존재다. 여기에 삼성 페이는 스마트폰 뿐만 아니라 스마트워치‘기어S3’ 를 통해서도 결제할 수 있도록 하는 등 영토 확장에 적극적이다.LG 페이는 삼성 페이에 밀려 고전할 것으로 예상되지만 출시 자체만으로도 큰 의미가 있다. 바로 충성 고객들을 지킬 수 있는 장치가 마련됐다는 점에서다.업계에선 그동안 LG가 삼성에 충성 고객을 뺏겼을 것으로 보고 있다. LG 스마트폰만을 구매했던 상당수의 고객들이 페이 사용을 위해 삼성 스마트폰으로 갈아탔다는 설명이다. LG로선 간편한 결제 방식을 찾아 돌아서는 충성 고객들을 막을 방도가 없었다. LG엔 없는게 삼성엔 있었으니 말이다.LG에게 이번 LG 페이 출시는 각별하다. 적어도 페이가 없어서 고객을 뺏기는 경우는 방지할 수 있게 돼서다. 충성 고객들이 다시 돌아올 여지가 생겼다는 점도 긍정적이다. 스마트폰 자체 문제가 아니라 단지 페이 부재로 이탈했다면 충분히 LG 제품으로 유턴할 수 있다는 얘기다. 전문가들이 LG 페이를 LG MC(모바일)사업부의 새로운 마케팅 수단으로 평가하는 것도 이 때문이다.IT업계 관계자는 ""LG 페이는 누적 거래액, 거래 건수 실적도 중요하겠지만, 스마트폰의 충성 고객을 지킨다는 의미가 더 크다""며 ""변심하려 했거나 이미 변심한 LG의 충성 고객들을  다시 결집시킬 수 있는 계기가 될 것으로 본다""고 말했다.현재 LG 페이는 신한, KB, BC, 롯데 등 4개 카드사가 지원중이지만 오는 9월에는 모든 카드사로 확대된다. LG는 G6 외에도 LG 페이 지원 제품을 계속 늘릴 계획이다. LG 페이가 집나간 충성 고객들의 \'팬심\'을 돌릴수 있을지 기대된다.이진욱 한경닷컴 기자 showgun@hankyung.com[한경닷컴 바로가기] [글방] [모바일한경 구독신청] ⓒ 한국경제 & hankyung.com, 무단전재 및 재배포 금지한국경제 관련뉴스해당 언론사에서 선정하며 언론사 페이지(아웃링크)로 이동해 볼 수 있습니다.삼성, 인도에 7000억 투자…휴대전화·냉장고 생산량 2배로삼성전자, 인도에 7000억 투자…휴대전화 생산 규모 2배로베란다 매달린 딸 잡고 15분 버틴 어머니, 그 후몸짱녀, 승무원·대기업 비서 그만두고 택한 직업이…""새 아파트 저렴하게…"" 동작구에 무슨 일이?좋아요0훈훈해요0슬퍼요0화나요0후속기사 원해요0기사제공 :']"
