,회사명,날짜,언론사,기사제목,링크,본문
0,삼성전자, 2018-01-1722:34,국민일보 ,갤노트8 올림픽 에디션 평창 간다,https://finance.naver.com/news/news_read.nhn?article_id=0001065668&office_id=005&mode=search&query=삼성전자&page=1,"['       갤노트8 올림픽 에디션 평창 간다      기사입력2018-01-17 22:34기사원문좋아요훈훈해요좋아요 평가하기공감좋아요0훈훈해요0슬퍼요0화나요0후속기사 원해요0댓글평창 동계올림픽 무선통신 분야 공식 파트너인 삼성전자는 국제올림픽위원회(IOC) 관계자 전원 및 참가 선수단에게 제공할 ‘갤럭시 노트8 올림픽 에디션’(사진)을 17일 공개했다. 삼성전자는 갤럭시 노트8 올림픽 에디션에 기존 갤럭시 노트8의 최신 기능인 인피니티 디스플레이, 듀얼 카메라, S펜 외에 겨울을 상징하는 샤이니 화이트 색상과 금색의 오륜기 디자인을 입혔다. 평창올림픽을 테마로 한 전용 월페이퍼와 올림픽 게임 관련 정보를 확인할 수 있는 애플리케이션도 함께 제공할 예정이다. 이영희 삼성전자 부사장은 “올림픽 참가 선수들과 관계자들이 평창올림픽에서 누리는 경험을 가족, 친구, 팬들과 생생하게 공유하고 소통하기를 바란다”고 밝혔다.김현길 기자 hgkim@kmib.co.kr[카카오 친구맺기] [페이스북][취재대행소 왱!(클릭)]GoodNews paper ⓒ 국민일보(www.kmib.co.kr), 무단전재 및 재배포금지국민일보 관련뉴스해당 언론사에서 선정하며 언론사 페이지(아웃링크)로 이동해 볼 수 있습니다.MB 입에서 나온 \'盧 죽음\' 10초 뒤부터 기침 연발변희재 ""청렴한 박근혜 대통령님"" 생일 축하 광고 한다김어준 ""가상화폐 폭락, 정부 탓하지 말라""박유천, 반려견에 물린 지인으로부터 고소 당해대장암 소년원생 父 ""암덩어리 가득해 내시경 힘들어""좋아요0훈훈해요0슬퍼요0화나요0후속기사 원해요0기사제공 :']"
1,삼성전자, 2018-01-1719:45,한국경제 ,[산업 포커스] 갤럭시노트8 평창 한정판,https://finance.naver.com/news/news_read.nhn?article_id=0003880548&office_id=015&mode=search&query=삼성전자&page=1,"['       [산업 포커스] 갤럭시노트8 평창 한정판      기사입력2018-01-17 19:45기사원문좋아요훈훈해요좋아요 평가하기공감좋아요0훈훈해요0슬퍼요0화나요0후속기사 원해요0댓글 평창동계올림픽 무선통신 분야 공식 파트너인 삼성전자가 ‘갤럭시노트8 올림픽 에디션’을 공개했다. 삼성전자는 이 제품 4000대를 올림픽 참가 선수단과 국제올림픽위원회(IOC) 관계자 전원에게 제공하기로 했다. 올림픽 에디션은 겨울 느낌이 나는 샤이니 화이트 색상과 금색의 오륜기 디자인이 특징이다.[한경닷컴 바로가기] [글방] [모바일한경 구독신청] ⓒ 한국경제 & hankyung.com, 무단전재 및 재배포 금지한국경제 관련뉴스해당 언론사에서 선정하며 언론사 페이지(아웃링크)로 이동해 볼 수 있습니다.작년 친환경차 판매 10만대 육박 역대 최대LG·삼성 냉장고, 4개 부문 \'최고\'현대차, 5년간 \'23조\' 통 큰 투자 결정한 곳이…""비트코인, 17만원으로 1억원 벌어"" 실체 알고보니18억 주고 산 잠실주공5단지 아파트, 일주일 새…좋아요0훈훈해요0슬퍼요0화나요0후속기사 원해요0기사제공 :']"
2,삼성전자, 2018-01-1719:43,한국경제 ,외국인 핫플레이스 된 삼성 딜라이트,https://finance.naver.com/news/news_read.nhn?article_id=0003880545&office_id=015&mode=search&query=삼성전자&page=1,"['       외국인 핫플레이스 된 삼성 딜라이트      기사입력2018-01-17 19:43기사원문좋아요훈훈해요좋아요 평가하기공감좋아요0훈훈해요0슬퍼요0화나요0후속기사 원해요0댓글삼성전자 브랜드 체험관누적 방문객 500만명 넘어57%가 외국인… IT 명소로[ 고재연 기자  ] 17일 서울 서초동 삼성 딜라이트를 방문한 외국인 관람객들이 누적 방문객 500만 명 돌파를 축하하고 있다. 삼성전자 제공삼성전자의 대표적 브랜드 체험관인 삼성 딜라이트(SAMSUNG d’light)가 17일 누적 방문객 500만 명을 넘어섰다. 2008년 12월 개관한 이후 하루평균 1900명이 방문한 셈이다. 전체 방문객의 절반 이상인 56.9%가 해외 방문객이었다. 해외 국빈급 2500여 명이 방문할 정도로 ‘글로벌 정보기술(IT) 명소’로 자리매김했다는 평가다.서울 강남역 인근에 있는 삼성 딜라이트는 삼성전자의 기업 비전을 체험할 수 있는 복합 전시공간이다. 제품 중심 전시에서 벗어나 개인 성향을 알아보는 체험 요소와 가상현실을 이용한 미래 주거생활 체험 등 관람객이 적극적으로 삼성전자의 최신 제품을 경험할 수 있도록 한 것이 특징이다.삼성전자는 지난 9일부터 13일까지 방문객 500만 명 돌파를 기념해 ‘내일의 희망을 나누다(Share Your Tomorrow)’라는 행사를 했다. 삼성 딜라이트를 방문한 국내외 관람객이 나눔이 필요한 아동·청소년에게 전하는 응원 카드를 작성해 전달했다. 삼성전자는 17일 학용품 목도리 등 선물이 담긴 응원 박스와 응원카드를 서초구와 관악구의 소외계층 아동·청소년 500명에게 전달했다.삼성 딜라이트는 2010년부터 초·중·고교생을 대상으로 교육기부 프로그램을 운영하고 있다. 그동안 최신 IT·반도체 기술과 친환경 교육을 체험하기 위해 4600여 개 학교에서 20만여 명이 이곳을 찾았다. 청소년을 대상으로 한 다양한 IT 체험 프로그램을 운영해 2011년 교육부로부터 우수 교육기부기관으로 지정됐다. 2012년 2016년 2017년 세 차례에 걸쳐 대한민국 교육기부대상도 받았다.삼성전자 관계자는 “최신 IT 프로그램을 추가로 개설해 청소년 대상 맞춤 교육을 강화할 계획”이라며 “다양한 행사와 전시를 통해 국내외 관람객이 즐겨 찾는 IT 명소로 만들겠다”고 강조했다.고재연 기자 yeon@hankyung.com[한경닷컴 바로가기] [글방] [모바일한경 구독신청] ⓒ 한국경제 & hankyung.com, 무단전재 및 재배포 금지한국경제 관련뉴스해당 언론사에서 선정하며 언론사 페이지(아웃링크)로 이동해 볼 수 있습니다.(마감)삼성전자 248만1000원…0.76%↓""적과의 동침""… LG디스플레이 탑재한 삼성TV 출시 임박현대차, 5년간 \'23조\' 통 큰 투자 결정한 곳이…""비트코인, 17만원으로 1억원 벌어"" 실체 알고보니18억 주고 산 잠실주공5단지 아파트, 일주일 새…좋아요0훈훈해요0슬퍼요0화나요0후속기사 원해요0기사제공 :']"
3,삼성전자, 2018-01-1719:22,서울신문 ,‘갤노트8 올림픽 에디션’ 공개,https://finance.naver.com/news/news_read.nhn?article_id=0002885797&office_id=081&mode=search&query=삼성전자&page=1,"['       ‘갤노트8 올림픽 에디션’ 공개      기사입력2018-01-17 19:22기사원문좋아요훈훈해요좋아요 평가하기공감좋아요0훈훈해요0슬퍼요0화나요0후속기사 원해요0댓글 [서울신문]‘갤럭시 노트8 올림픽 에디션’2018 평창동계올림픽 무선 통신 분야 공식 파트너인 삼성전자가 스마트폰 ‘갤럭시 노트8 올림픽 에디션’을 17일 공개했다. 삼성전자는 4000여대를 참가 선수단과 국제올림픽위원회(IOC) 관계자 전원에게 제공한다.갤럭시 노트8 올림픽 에디션은 6.3인치의 테두리 없는(베젤리스) 인피니티 디스플레이, 듀얼 카메라, 움직이는 사진 파일을 직접 그려 보낼 수 있는(라이브 메시지) S펜 등을 갖췄다. 겨울을 상징하는 샤이니 화이트 색상에 올림픽을 상징하는 금색 오륜기 디자인을 입혔다. 평창동계 올림픽을 테마로 한 전용 배경화면, 올림픽 관련 정보를 확인할 수 있는 애플리케이션도 들어간다.이재연 기자 oscal@seoul.co.kr▶  재미있는 세상[나우뉴스] ▶ [인기 무료만화] [페이스북]ⓒ 서울신문(www.seoul.co.kr), 무단전재 및 재배포금지서울신문 관련뉴스해당 언론사에서 선정하며 언론사 페이지(아웃링크)로 이동해 볼 수 있습니다.김흥국, 박원순 시장에 ""난 정몽준 라인인데""문 대통령, 홍은동 집 팔아…누가 얼마에 샀나보니이명박, 직접 말한 ""노무현 죽음""···그리곤 기침MBC 사장 ""배현진, 뉴스출연 없을 것, 김성주는…""손석희, 아이유 인터뷰에 ""새해선물 느낌""좋아요0훈훈해요0슬퍼요0화나요0후속기사 원해요0기사제공 :']"
4,삼성전자, 2018-01-1719:17,한국경제 ,'미세먼지 제로 카페' 도전하는 스타벅스,https://finance.naver.com/news/news_read.nhn?article_id=0003880510&office_id=015&mode=search&query=삼성전자&page=1,"['       \'미세먼지 제로 카페\' 도전하는 스타벅스      기사입력2018-01-17 19:17기사원문좋아요훈훈해요좋아요 평가하기공감좋아요0훈훈해요0슬퍼요0화나요0후속기사 원해요0댓글LG 공기청정설비 도입… 매장 2곳 시범 운영""스벅에선 미세먼지 해방""[ 김보라 기자  ] 스타벅스코리아가 ‘미세먼지 청정구역 만들기’에 나섰다.스타벅스는 17일 서울 마포구 신촌대로점과 홍대공항철도역점 지하 1층에 공기청정 시스템(사진)을 설치하고 시범 가동에 들어갔다. 앞으로 1140여 개 점포에 확대 적용하겠다는 계획이다. 대형 상업공간과 식음료 시설에 천장 매립형 공기청정 시스템이 적용된 건 처음이다. 지금까지는 일반 냉난방기만 설치돼 있어 온도와 풍량 조절만 할 수 있었다.스타벅스가 ‘미세먼지 프로젝트’를 시작한 건 1년여 전이다. 이석구 스타벅스코리아 대표가 봄 황사뿐 아니라 사계절 미세먼지 농도가 높아지는 것을 보면서 “스타벅스를 찾는 소비자만이라도 깨끗한 공기 속에 커피를 즐기다 갔으면 좋겠다”고 아이디어를 내면서 시작됐다. 스타벅스를 찾는 소비자는 하루 평균 50만 명이다.스타벅스는 LG전자 삼성전자 등에 연구개발과 기술 협력 등을 의뢰했고, 작년 말 LG전자와 두 개 점포에 시범 설치를 마쳤다. 스타벅스 관계자는 “2주간 다섯 차례에 걸쳐 두 개 점포에서 가동했다”며 “미세먼지 초미세먼지 극초미세먼지 3단계로 나눠 확인한 결과 최대 54% 미세먼지가 줄어드는 것을 확인했다”고 말했다. 매장을 찾는 사람들이 바깥 미세먼지와 실내 미세먼지 농도를 실시간으로 체크할 수 있도록 했다.스타벅스가 이 시스템을 전체 매장으로 확대 적용하려면 필터 교체를 쉽게, 자주 할 수 있는 유지 보수 방안을 찾는 게 과제다. 윤경일 스타벅스코리아 인테리어팀 파트장은 “공기 정화 효과는 이미 검증됐고, 필터 교체 등의 기술적인 부분에서 해결해야 할 과제가 남아 있다”며 “시범 매장에서의 결과를 바탕으로 더 많은 매장에 확대 적용할 것”이라고 말했다.스타벅스의 이 같은 실험은 ‘단지 커피만 마시는 공간을 넘어서야 한다’는 기업 철학을 바탕으로 하고 있다. 모바일 주문결제, 무료 와이파이 도입 등을 선제적으로 해왔다. 업계는 스타벅스가 공동 개발한 공기청정 기술이 다른 외식 프랜차이즈 등으로 확산될지 주목하고 있다. 업계 관계자는 “미세먼지가 심해질수록 많은 사람이 이용하는 상업 공간에 빠르게 도입될 것”이라고 말했다.김보라 기자 destinybr@hankyung.com[한경닷컴 바로가기] [글방] [모바일한경 구독신청] ⓒ 한국경제 & hankyung.com, 무단전재 및 재배포 금지한국경제 관련뉴스해당 언론사에서 선정하며 언론사 페이지(아웃링크)로 이동해 볼 수 있습니다.불황 모르는 스타벅스코리아… 작년 영업익 1000억원 첫 돌파현대차, 5년간 \'23조\' 통 큰 투자 결정한 곳이…""비트코인, 17만원으로 1억원 벌어"" 실체 알고보니18억 주고 산 잠실주공5단지 아파트, 일주일 새…현대차 노조원, 매출 4000억 날리고 손에 쥔 돈이좋아요0훈훈해요0슬퍼요0화나요0후속기사 원해요0기사제공 :']"
5,삼성전자, 2018-01-1719:16,파이낸셜뉴스 ,"""두 번 실패는 없다""… 삼성, 인도공략 재정비",https://finance.naver.com/news/news_read.nhn?article_id=0003946257&office_id=014&mode=search&query=삼성전자&page=1,"['       ""두 번 실패는 없다""… 삼성, 인도공략 재정비      기사입력2018-01-17 19:16기사원문좋아요훈훈해요좋아요 평가하기공감좋아요0훈훈해요0슬퍼요0화나요0후속기사 원해요0댓글中제조사와 치열한 경쟁2배 이상 차이나던 점유율.. 샤오미 폭발적인 성장세에 1년 만에 1위 자리 내 줄판온라인판매 적극 나설 듯                     삼성전자가 인도시장 재정비에 나선다. 빠르게 치고 올라오는 중국 제조사들의 공세에 맞서 인도 현지 사정에 맞춰 온라인으로 판매하는 제품의 라인업을 새롭게 선보이는 것이다. 삼성전자는 세계 최대 스마트폰 시장인 중국에서 1위를 차지했지만 지금은 5위 밖으로 밀려난 아픈 경험이 있다. 인도에서만큼은 같은 상황을 반복하지 않겠다는 각오다.17일 관련 업계에 따르면 전세계에서 2번째로 큰 스마트폰 시장인 인도에서 삼성전자와 중국 샤오미 간 경쟁이 격화되는 가운데, 삼성전자가 온라인 판매 시장의 패권을 잡기 위해 새로운 스마트폰 라인업을 선보일 예정이다.온라인 판매용으로 기획되고 있는 이 제품은 하드웨어 사양이 높지만 합리적인 가격대로 선보여 \'가성비\'를 앞세울 것으로 보인다. 젊은세대를 공략하기 위해 출고가는 5000~1만5000루피(약 8만3000~25만원) 정도로 책정될 전망이다.현재 삼성전자는 인도에서 \'갤럭시온\' 제품을 온라인용으로 독점 공급하고 있다. 또 최근 \'갤럭시A8 플러스\'를 아마존에 독점 공급해 출시했다. 갤럭시A8플러스는 출고가가 3만2990루피(약 55만원)로, 샤오미의 \'미믹스2\'와 직접 경쟁한다.삼성전자는 인도시장에서 중국 제조사들과 치열한 경쟁을 펼치고 있다.2016년 4.4분기만 해도 시장점유율은 삼성전자가 25%, 샤오미가 11%로 2배 이상 차이가 났지만, 1년도 채 지나지 않아 지난해 3.4분기에 삼성전자와 샤오미가 24% 점유율로 공동 1위를 차지했다.1~5위까지를 차지한 상위업체 중 삼성전자를 제외하고 2~5위는 모두 중국업체(샤오미, 레노버, 비보, 오포)다. 특히 이 기간에 가장 많이 판매된 스마트폰 1~3위는 모두 샤오미 제품이었다.시장조사업체인 카운터포인트리서치는 ""샤오미는 인도 온라인 스마트폰 판매의 50%를 점유하고 있으며, 온라인 시장에서는 마땅한 경쟁자가 없다""면서 ""이런 이유로 샤오미가 인도에서 급부상한 것""이라고 분석했다. 이에 따라 삼성전자도 인도 스마트폰 시장에서 승기를 잡기 위해 올해 온라인 판매에 주력할 것으로 예상된다.앞서 삼성전자는 세계 최대 규모인 중국 스마트폰 시장에서 뼈 아픈 추락을 경험했다. 2014년 1.4분기까지만 해도 삼성전자는 출하량 기준 시장점유율 19%로 중국 시장에서 1위를 달렸다. 그러나 2017년 4.4분기에 시장점유율이 2%대로 떨어질 것이라는 전망이 나오고 있다.삼성전자의 중국 내 시장점유율 하락은 현지화 실패에 따른 것이다. 중국 시장은 도농 간 격차가 크기 때문에 각 지역에 맞는 유통전략을 세우고, 마케팅을 해야 한다. 또한 중국 현지의 서비스 및 콘텐츠 업체들과 적극 제휴해 갤럭시 스마트폰으로 이용할 수 있는 특화 콘텐츠를 지속적으로 선보여야 한다. 중국 기업들이 이에 발빠르게 대응한 반면, 삼성전자는 그러지 못한 것이 패착으로 지적된다.업계 한 전문가는 ""스마트폰 시장이 아직 성장하고 있는 중국, 인도 등에서는 현지의 오랜 문화적 습성을 감안해 스마트폰을 내놓고, 판매전략을 세워야 한다""면서 ""중국과 인도 스마트폰 시장이 지금은 저가 모델 위주로 형성돼 있지만 향후 제품 가격대가 올라가고 수익성이 좋아질 것에 대비해 특화된 판매전략을 검토해야 한다""고 말했다.ronia@fnnews.com 이설영 기자     ▶ 세상의 모든 골 때리는 이야기 \'fn파스\'▶ 속보이는 연예뉴스 fn스타  ※ 저작권자 ⓒ  파이낸셜뉴스. 무단 전재-재배포 금지파이낸셜뉴스 관련뉴스해당 언론사에서 선정하며 언론사 페이지(아웃링크)로 이동해 볼 수 있습니다.해열·진통제 \'이부프로펜\'.. 男 생식 능력 저하 ""매너는 어디에?"" 공연장 꼴불견 \'관크족\'의 습격""주말에는 대기 2시간""...점(占)에 의존하는 청춘들나만 할인 못받는 자동차보험료?박지원 ""안철수, 한국당 원내1당 만드는 도우미""좋아요0훈훈해요0슬퍼요0화나요0후속기사 원해요0기사제공 :']"
6,삼성전자, 2018-01-1719:16,파이낸셜뉴스 ,삼성 '갤노트8 올림픽 에디션' 공개,https://finance.naver.com/news/news_read.nhn?article_id=0003946255&office_id=014&mode=search&query=삼성전자&page=1,"['       삼성 \'갤노트8 올림픽 에디션\' 공개      기사입력2018-01-17 19:16기사원문좋아요훈훈해요좋아요 평가하기공감좋아요0훈훈해요0슬퍼요0화나요0후속기사 원해요0댓글선수단.관계자 등에 4000대 쏜다                     2018 평창동계올림픽 무선 통신 분야 공식 파트너인 삼성전자가 \'갤럭시노트8 올림픽 에디션(사진)\'을 17일 공개했다. 일반 판매용이 아니라 올림픽 선수단과 관계자들에게 나눠주는 용도다.삼성전자는 국제올림픽위원회(IOC)와 협력해 4000여대의 갤럭시노트8 올림픽 에디션을 올림픽 참가 선수단과 국제 올림픽위원회 관계자 전원에게 제공해 2018 평창 동계올림픽의 추억을 기록하고 전 세계인과 공유할 수 있도록 할 예정이다.갤럭시노트8 올림픽 에디션은 6.3인치의 베젤을 최소화한 \'인피니티 디스플레이\', 한 단계 더 진화한 \'S펜\', 최고 성능의 듀얼 카메라 등 갤럭시노트8의 최신 기능에 겨울을 상징하는 샤이니 화이트 색상과 올림픽을 상징하는 금색의 오륜기 디자인을 더했다. 2018 평창동계올림픽을 테마로 한 전용 월페이퍼와 올림픽 게임 관련 다양한 정보를 한 눈에 확인할 수 있는 애플리케이션(앱)이 함께 제공될 예정이다.삼성전자 글로벌마케팅센터장 이영희 부사장은 ""갤럭시노트8 올림픽 에디션을 통해 모든 올림픽 참가 선수들과 관계자들이 2018 평창동계올림픽에서 누리는 특별한 경험을 가족, 친구, 팬들과 생생하게 공유하고 소통하기를 바란다""고 말했다.토마스 바흐 IOC 위원장은 ""지난 20년간 삼성전자의 혁신적인 모바일 기술은 전세계에 올림픽 정신을 전파하는데 많은 역할을 해왔다""면서 ""이번 2018 평창동계올림픽에서도 갤럭시노트8 올림픽 에디션을 통해 올림픽의 잊을 수 없는 경험들이 전세계에 생생하게 전달될 것""이라고 말했다.ronia@fnnews.com 이설영 기자     ▶ 세상의 모든 골 때리는 이야기 \'fn파스\'▶ 속보이는 연예뉴스 fn스타  ※ 저작권자 ⓒ  파이낸셜뉴스. 무단 전재-재배포 금지파이낸셜뉴스 관련뉴스해당 언론사에서 선정하며 언론사 페이지(아웃링크)로 이동해 볼 수 있습니다.해열·진통제 \'이부프로펜\'.. 男 생식 능력 저하 ""매너는 어디에?"" 공연장 꼴불견 \'관크족\'의 습격""주말에는 대기 2시간""...점(占)에 의존하는 청춘들나만 할인 못받는 자동차보험료?박지원 ""안철수, 한국당 원내1당 만드는 도우미""좋아요0훈훈해요0슬퍼요0화나요0후속기사 원해요0기사제공 :']"
7,삼성전자, 2018-01-1719:12,파이낸셜뉴스 ,"삼성 ""아동 노동 문제는 무관용""",https://finance.naver.com/news/news_read.nhn?article_id=0003946246&office_id=014&mode=search&query=삼성전자&page=1,"['       삼성 ""아동 노동 문제는 무관용""      기사입력2018-01-17 19:12기사원문좋아요훈훈해요좋아요 평가하기공감좋아요0훈훈해요0슬퍼요0화나요0후속기사 원해요0댓글佛 NGO, 中공장 제소에 ""국제 노동기준 엄격히 준수""     최근 삼성의 중국 공장에서 일하는 현지 아동들이 열악한 근로 환경에 노출돼 있다며 프랑스 시민단체가 제소한 것과 관련 삼성이 무관용(zero tolerance) 정책을 지지한다는 입장을 내놨다.17일 재계에 따르면 지난 13일 삼성전자는 자체 인터넷 커뮤니티인 뉴스룸 영문 사이트에 올린 \'프랑스 비정부기구(NGO)의 의혹에 대한 성명(Statement on French NGO\'s allegations)\'이란 제목의 글에서 ""전 세계 모든 공장의 직원들을 소중하게 생각하고 있다""며 이같이 밝혔다.삼성전자는 ""최고 수준의 노동 관례를 유지하기 위해 현지 노동법과 국제 노동 기준을 엄격히 준수하는 것이 우리의 책임""이라면서 ""삼성은 자체 공장은 물론 공급업체의 아동 노동에 대해 무관용 정책을 지지한다""고 전했다.최근 프랑스 NGO인 셰르파(Sherpa), 액션에이드프랑스(ActionAid France) 등 2개 단체는 파리 법원에 삼성 글로벌, 삼성전자 프랑스 자회사를 상대로 소송을 냈다. 이들 단체는 삼성이 중국 공장에서 16세 이하 어린이 노동 착취, 화학 물질 사용에 따른 근로자 질환 등을 포함해 인권 침해 자료들을 수집했다고 주장했다. 셰르파는 지난 2013년에도 중국에 있는 삼성전자 협력업체 직원들의 근로 여건이 열악하다며 삼성전자를 상대로 소송을 제기한 바 있다.이와 관련 중국 외교부는 ""당국은 노동자 합법적인 권리를 일관되게 중요시하고 있다""고 말했다.km@fnnews.com 김경민 기자     ▶ 세상의 모든 골 때리는 이야기 \'fn파스\'▶ 속보이는 연예뉴스 fn스타  ※ 저작권자 ⓒ  파이낸셜뉴스. 무단 전재-재배포 금지파이낸셜뉴스 관련뉴스해당 언론사에서 선정하며 언론사 페이지(아웃링크)로 이동해 볼 수 있습니다.해열·진통제 \'이부프로펜\'.. 男 생식 능력 저하 ""매너는 어디에?"" 공연장 꼴불견 \'관크족\'의 습격""주말에는 대기 2시간""...점(占)에 의존하는 청춘들나만 할인 못받는 자동차보험료?박지원 ""안철수, 한국당 원내1당 만드는 도우미""좋아요0훈훈해요0슬퍼요0화나요0후속기사 원해요0기사제공 :']"
