,회사명,날짜,언론사,기사제목,링크,본문
0,삼성전자, 2018-07-0521:50,경향신문 ,"‘삼성 총수’ 이재용, 경영 복귀 첫 무대는 ‘대통령과 함께’",https://finance.naver.com/news/news_read.nhn?article_id=0002880281&office_id=032&mode=search&query=삼성전자&page=1,"['       ‘삼성 총수’ 이재용, 경영 복귀 첫 무대는 ‘대통령과 함께’      기사입력2018-07-05 21:50기사원문좋아요훈훈해요좋아요 평가하기공감좋아요0훈훈해요0슬퍼요0화나요0후속기사 원해요0댓글ㆍ인도 공장 준공식 동반 참석 예상…재계 이목 집중, 삼성은 ‘신중’문재인 대통령이 인도 방문 기간 중 삼성전자 현지 공장 준공식에 참석할 것으로 예상되면서 이재용 삼성전자 부회장(사진)의 경영 복귀 첫 무대가 ‘대통령과의 만남’으로 시작할 가능성이 높아졌다. 문 대통령이 삼성 행사에 참석은 처음인 데다 이 부회장 입장에서도 출소 뒤 첫 공식일정이어서 재계의 이목이 쏠리고 있다.5일 재계에 따르면 청와대와 삼성전자 측은 두 사람의 만남을 최종적으로 확인해주지는 않고 있지만 현재로서는 가능성이 크다는 게 대체적인 관측이다. 이럴 경우 삼성으로서는 이 회동의 의미가 적지 않다. 일단 현 정부 출범 이후 문 대통령은 물론 정부 고위 관계자의 삼성 사업장 방문은 처음이다. 삼성은 국정농단 사태에 얽혀 이 부회장이 구속과 석방 등을 거쳤고, 이후에도 각종 이슈로 검찰 조사 등을 받아왔다. 따라서 이 부회장이 문 대통령과 나란히 행사에 참석할 경우 그 자체가 상당한 메시지를 줄 수 있다. 경영 일선 복귀의 공식 ‘신호탄’인 셈이다.동시에 이 행사는 이 부회장이 지난 2월 항소심에서 집행유예로 풀려난 이후 치르는 첫 번째 행사다. 공정거래위원회의 대기업집단 동일인 지정을 통해 ‘삼성 총수’가 된 이후 맞이하는 첫 공식 일정이기도 하다. 그동안 임원진으로부터 수시로 현안 보고를 받고 몇 차례 해외출장을 다녀오기도 했지만 모두 삼성 측에서 공식적으로 발표하지 않았고, 언론에도 노출되지 않은 비공개 일정이었다. 결국 이번 행사가 그에게는 삼성그룹 총수로서의 행보를 본격화하는 계기가 될 것으로 보인다.이 밖에 삼성 측은 국내 기업들과 중국 기업들의 인도 시장 경쟁이 격화되는 상황에서 문 대통령이 직접 준공식에 참여하면 국내 기업들의 사업 의지에 힘을 실어주는 효과도 있을 것으로 조심스레 기대하고 있다.그러나 삼성은 이날 이 사안에 대한 공식적인 반응을 내놓지 않았다. 대통령과 관련된 민감한 사안이어서 섣불리 입장을 내놓을 경우 자칫 불필요한 논란에 휩싸일 수도 있고, 여전히 재벌개혁 등에서 자유롭지 못한 여론을 의식한 것으로 풀이된다. 한 재계 관계자는 “만나기도 전에 만나서는 안된다는 여론이 형성되는 등 삼성으로서는 조심스러울 수밖에 없을 것”이라고 말했다.▶ [경향비즈 바로가기], 경향비즈 SNS [페이스북]  ▶ [인기 무료만화 보기][©경향신문(www.khan.co.kr), 무단전재 및 재배포 금지]경향신문 관련뉴스해당 언론사에서 선정하며 언론사 페이지(아웃링크)로 이동해 볼 수 있습니다.민주당 초선 토론회에 \'한국당 초선\' 강효상이 왜 왔지?靑, 문 대통령의 이재용 만남 여부에 적극 옹호재일교포 여배우 ""조재현, 화장실 성폭행 후…""[아시아나]""기내식 대란, 투자유치 연관 오해 딸 낙하산 채용은 예쁘게 봐달라""조명균 찾아온 북한 김영철 ""김정은 위원장, 불참한 이유가···""좋아요0훈훈해요0슬퍼요0화나요0후속기사 원해요0기사제공 :']"
1,삼성전자, 2018-07-0521:46,매일경제 ,[코스닥 공시] 아이씨디 / 강스템바이오텍 / 셀바스AI 등,https://finance.naver.com/news/news_read.nhn?article_id=0004180081&office_id=009&mode=search&query=삼성전자&page=1,"[""       [코스닥 공시] 아이씨디 / 강스템바이오텍 / 셀바스AI 등      기사입력2018-07-05 21:46기사원문좋아요훈훈해요좋아요 평가하기공감좋아요0훈훈해요0슬퍼요0화나요0후속기사 원해요0댓글 ◇아이씨디=일본 캐논 토키와 156억원 규모 FPD 제조장비 공급계약.◇강스템바이오텍=말·동물 양수 유래 다분화능 줄기세포 관련 특허 취득.◇셀바스AI=코드 데이터 전송 방법 특허권 취득. ◇메디포스트=탈모 예방 조성물 일본 특허 취득.◇제이엔케이히터=229억원 규모 가열로 공급계약.◇에이스침대=225억원 규모 자기주식 처분 결정.◇유니셈=삼성전자와 50억원 규모 반도체장비 공급계약.▶뉴스 이상의 무궁무진한 프리미엄 읽을거리 ▶아나운서가 직접 읽어주는 오늘의 주요 뉴스[ⓒ 매일경제 & mk.co.kr, 무단전재 및 재배포 금지]매일경제 관련뉴스해당 언론사에서 선정하며 언론사 페이지(아웃링크)로 이동해 볼 수 있습니다.'2018 미코 진' 김수민, 압도적 비키니 몸매 드러내다김수민 外 2018 미스코리아 부·울 진 손희주도 인기유라 화끈한 시스루 수영복…아찔한 볼륨감하늘을 나는 고래? 에어버스 '벨루가XL''만찢녀' 손희주, 2018 미코眞도 울고갈 '美친 각선미'좋아요0훈훈해요0슬퍼요0화나요0후속기사 원해요0기사제공 :""]"
2,삼성전자, 2018-07-0521:45,매일경제 ,"경총, 회계투명성 강화…현금상여금 없앤다",https://finance.naver.com/news/news_read.nhn?article_id=0004180078&office_id=009&mode=search&query=삼성전자&page=1,"['       경총, 회계투명성 강화…현금상여금 없앤다      기사입력2018-07-05 21:45기사원문좋아요훈훈해요좋아요 평가하기공감좋아요0훈훈해요0슬퍼요0화나요0후속기사 원해요0댓글손경식 회장 특별 지시 한국경영자총협회가 지난 3일 열린 임시총회 결과를 바탕으로 회계 투명성 강화 조치에 나섰다.손경식 경총 회장(사진)은 총회에서 ""앞으로 공정한 경총 사무국 인사체제를 확립할 것""이라며 ""회계의 투명성을 강화하고 업무 절차·제도·규정을 정비하는 등 사무국 내 일대 혁신을 일으키겠다""고 밝혔다. 손 회장 지시로 마련된 회계 투명성 강화 조치에 따라 경총은 우선 삼성전자서비스 협력사 단체교섭 관련 지원 등 특별회비로 입금돼 회원사에 보고되지 않은 사업은 차기 총회부터 용역사업계정으로 명확히 보고키로 했다. 임직원에 대한 연 200~300%의 특별상여금은 과거 법인 통장에서 수표 및 현금을 인출해 갑근세 등을 공제하고 지급했지만 일체의 논란을 없애기 위해 임직원 개인 계좌로 모두 지급하기로 결정했다. 중소·영세기업인 협력사는 노사관계 지원 차원에서 별도 위임교섭비용을 받지 않고 협력사들이 납부한 회비 내에서 교섭을 진행해 왔는데, 이 부분도 외부 용역사업으로 이관해 투명하게 관리하기로 방향을 정했다.과거 회계에 문제가 있었는지도 들여다보기로 했다. 이에 따라 조속한 시일 내 외부 전문가를 포함한 특별감사팀을 구성해 그간의 회계 처리에 대해 불투명한 부분이 있는지 살펴보고 개선방안까지 도출할 계획이다. [문지웅 기자]▶뉴스 이상의 무궁무진한 프리미엄 읽을거리 ▶아나운서가 직접 읽어주는 오늘의 주요 뉴스[ⓒ 매일경제 & mk.co.kr, 무단전재 및 재배포 금지]매일경제 관련뉴스해당 언론사에서 선정하며 언론사 페이지(아웃링크)로 이동해 볼 수 있습니다.\'2018 미코 진\' 김수민, 압도적 비키니 몸매 드러내다김수민 外 2018 미스코리아 부·울 진 손희주도 인기유라 화끈한 시스루 수영복…아찔한 볼륨감하늘을 나는 고래? 에어버스 \'벨루가XL\'\'만찢녀\' 손희주, 2018 미코眞도 울고갈 \'美친 각선미\'좋아요0훈훈해요0슬퍼요0화나요0후속기사 원해요0기사제공 :']"
3,삼성전자, 2018-07-0520:01,이데일리 ,이데일리 ‘내일의 경제일정’-삼성전자·LG전자 2분기 실적 발표,https://finance.naver.com/news/news_read.nhn?article_id=0004143051&office_id=018&mode=search&query=삼성전자&page=1,"['       이데일리 ‘내일의 경제일정’-삼성전자·LG전자 2분기 실적 발표      기사입력2018-07-05 20:01기사원문좋아요훈훈해요좋아요 평가하기공감좋아요0훈훈해요0슬퍼요0화나요0후속기사 원해요0댓글 [이데일리 강경훈 기자] 삼성전자(005930)와 LG전자(066570)가 6일 나란히 2분기 잠정 실적을 발표한다. 삼성전자는 반도체가, LG전자는 가전과 TV가 매출을 이끈 가운데 두 회사 모두 1분기 대비 다소 주춤할 것이라는 전망이 우세한 상황. 하지만 업계에서는 3분기에는 양사 모두 최대 매출을 기대하고 있다.◇정치·사회7:30 환경부장관 수도권지자체 단체장 간담회(서울)8:40 행정안전부장관 실국장 회의(정부서울청사)10:00 과학기술정보통신부 1차관, 과학기술부서장협의회(정부과청청사 과기정통부 온누리 소통방)14:00 과학기술정보통신부장관·환경부장관 환경산업연구단지 현장방문(인천 환겅산업연구단지)14:00 국토교통부장관 제27회 도로의날 기념식(건설회관)20:30 행정안전부장관 정부조직 국민참여단 현장진단(서울시내)◇경제·금융10:30 금융위원회 정책조정회의(정부서울청사 금융위 대회의실)12:00 금융위원회 금융위·한은 부기관장 간담회(서울 명동 은행회관)14:00 중소벤처기업부장관 유관기관 정책협의회(서울 광화문 일자리위원회)14:00 공정거래위원회 공정거래법 전면개편 기업집단분과 토론회(서울 대한상의)◇산업·증권9:00 금호타이어 임시주주총회(서울 중구 브라운스톤 서울)삼성전자(005930), 2분기 잠정실적 발표LG전자(066570), 2분기 잠정실적 발표강경훈 (kwkang@edaily.co.kr)20~30대를 위한 취업, 금융, 생활 정보가 가득 [스냅타임▶]네이버 홈에서 ‘이데일리’ 기사 보려면 [구독하기▶]최신 웹툰이 매일 공짜... 꿀잼 \'웹툰\' [감상하기▶]＜ⓒ종합 경제정보 미디어 이데일리 - 무단전재 & 재배포 금지＞이데일리 관련뉴스해당 언론사에서 선정하며 언론사 페이지(아웃링크)로 이동해 볼 수 있습니다.첫 4조원 흑자 낸 화장품…\'中사드 갈등\'에도 2조 팔아혹시나 했는데…\'미·중 혈투\'에 벌벌 떠는 금융시장\'전스트라다무스\' 전원책 한국당 스스로 깨우쳐야..\'명의\'도 손사래""상상 이상의 욕과 험난한 말 참으며 탑승객에게 빈다""\'통 큰\' 국회…특활비로 3년간 240억원 용돈처럼 써좋아요0훈훈해요0슬퍼요0화나요0후속기사 원해요0기사제공 :']"
4,삼성전자, 2018-07-0519:37,연합뉴스 ,"삼성전자 CEO 3인, 임직원들에 '혁신가 딜레마' 경계 당부",https://finance.naver.com/news/news_read.nhn?article_id=0010193409&office_id=001&mode=search&query=삼성전자&page=1,"['       삼성전자 CEO 3인, 임직원들에 \'혁신가 딜레마\' 경계 당부      기사입력2018-07-05 19:37기사원문좋아요훈훈해요좋아요 평가하기공감좋아요0훈훈해요0슬퍼요0화나요0후속기사 원해요0댓글삼성전자 CEO 3인 (PG)(서울=연합뉴스) 배영경 기자 = 삼성전자의 최고경영자(CEO) 3인이 하반기를 맞아 최근 임직원들에게 \'혁신가의 딜레마\'를 경계하자는 내용의 메시지를 보냈다.    삼성전자 관계자는 5일 연합뉴스와의 통화에서 ""이번 주 월요일(지난 2일) 삼성전자 CEO 3명이 공동명의로 임직원들에게 혁신 필요성을 강조하는 메시지를 보냈다""고 밝혔다.    CEO 3명은 김기남 디바이스솔루션(DS) 부문장, 김현석 소비자가전(CE) 부문장, 고동진 IT&모바일(IM) 부문장이다.    이들은 ""혁신가의 딜레마에 빠지지 말아야 한다""는 점을 강조하면서 ""급변하는 경영 환경에 대응하기 위해 혁신의 딜레마를 극복할 수 있는 자기 혁신과 실행력이 필요하다""는 취지로 임직원들을 독려한 것으로 전해졌다.     \'혁신가의 딜레마\'란 시장을 선도하는 기술을 가진 대형 기업이 더 이상 혁신하지 못하고 후발주자들의 기술에 시장 지배력을 빼앗긴다는 것이다. 클레이턴 크리스텐슨 하버드 경영대학원 교수가 1997년 출간한 저서 \'혁신가의 딜레마\'에서 주장한 개념이다.    또 이들 CEO의 메시지에는 이달부터 시행된 주 52시간 근무제와 관련해 업무 몰입도를 높일 것을 당부하는 내용도 포함됐던 것으로 알려졌다.     ykbae@yna.co.kr▶2018 러시아 월드컵의 모든 것▶뉴스가 보여요 - 연합뉴스 유튜브\xa0\xa0▶기사제보 및 문의연합뉴스 관련뉴스해당 언론사에서 선정하며 언론사 페이지(아웃링크)로 이동해 볼 수 있습니다.\xa0\'운전대가 갑자기 휙\'…5톤 트럭-아반떼 충돌 사망 왜?\xa0""칼이 도와줬음 됐을텐데…"" 박삼구 말에 대한항공 \'발끈\'\xa0하석주 ""차범근 피해 20년간 도망다녀"" 눈물로 사과\xa0의붓딸 6년간 성폭행해 임신시킨 계부에 징역 20년\xa060대 할아버지, 차 뒷좌석에 3살 외손자 방치해서 그만…좋아요0훈훈해요0슬퍼요0화나요0후속기사 원해요0기사제공 :']"
5,삼성전자, 2018-07-0519:20,한국경제 ,LG전자 '올레드 매직'… TV 영업이익률 10% 돌파,https://finance.naver.com/news/news_read.nhn?article_id=0003974380&office_id=015&mode=search&query=삼성전자&page=1,"['       LG전자 \'올레드 매직\'… TV 영업이익률 10% 돌파      기사입력2018-07-05 19:20기사원문좋아요훈훈해요좋아요 평가하기공감좋아요0훈훈해요0슬퍼요0화나요0후속기사 원해요0댓글""수익성 떨어지면 개발 말라""커브드TV 등 제품 구조조정돈 되는 OLED TV 집중품질 경쟁력서 확고한 우위올 영업이익률 10% 웃돌 듯삼성·소니도 벤치마킹 나서[ 좌동욱 기자  ] “도대체 어떤 마법을 부렸길래….”LG전자의 TV 제조사업부인 HE사업본부가 지난 4월 1분기(1~3월) 영업이익을 발표하자 삼성전자와 소니 등 경쟁사 임원 사이에선 탄식이 흘러나왔다. LG전자의 매출은 4조1178억원인데 영업이익은 5773억원으로 영업이익률이 14%에 달했기 때문이다. 5~7% 수준에 그친 경쟁사들보다 두 배 이상 높았다. HE사업본부는 2분기(4~6월)에도 10%를 웃도는 영업이익률을 기록한 것으로 알려졌다. 증권가에서는 LG전자의 올해 연간 영업이익률도 10%를 넘을 것으로 전망하고 있다. 업계 관계자는 “TV 제조업체가 두 자릿수 영업이익률을 올리는 것은 드문 일”이라며 “삼성과 소니가 그동안 한 수 아래로 봤던 LG전자를 벤치마킹하고 있다”고 전했다.◆‘선택과 집중’ 먹혀들어LG전자 HE사업본부의 영업이익률을 끌어올린 주인공은 2014년 12월부터 본부장(당시 부사장)을 맡고 있는 권봉석 사장이다. 2015년만 하더라도 HE사업본부는 1, 2분기에 각각 60억원, 830억원의 영업적자를 냈다. 2011년 23조9030억원이던 매출은 2015년 17조4000억원대로 급감했다. 이 기간 최고 영업이익률은 2014년에 거둔 2.6%였다.권 사장이 HE사업본부를 탈바꿈시킨 첫 번째 원동력은 ‘선택과 집중’ 전략이다. “불필요한 제품은 개발하지 말라”는 게 권 사장이 본부장으로 취임한 뒤 내놓은 첫 일성이었다. 당시 전자업체들은 30인치부터 60인치까지 모든 TV 제품을 개발했다. 디자인도 여러 종류였다. 마케팅과 영업부서 관계자들은 “모델이 많아야 소비자를 끌어모을 수 있다”며 다양한 제품 개발을 요청했다.권 사장의 생각은 정반대였다. 치밀한 시장 조사를 통해 전략 제품 수를 줄이고, 여기에 마케팅을 집중했다. 수익성이 떨어지는 중저가 모델은 과감하게 정리했다. 연구개발(R&D)과 제조 비용이 줄어든 것은 물론 부품 대량 생산에 따라 납품 단가도 낮출 수 있었다. 2014년 말 200개 안팎에 달하던 TV 제조 플랫폼을 지난해 말 절반 수준으로 줄였다.화면 몰입감을 높이기 위해 중심부를 움푹 들어가게 한 ‘커브드 TV’를 포기한 것도 권 사장의 결단에서 나왔다. 2013년 초 삼성전자와 LG전자가 “차세대 TV”라며 동시에 출시했지만 권 사장은 사업본부장을 맡은 뒤 커브드 TV 판매를 중단시켰다. TV는 거실에서 가족이 함께 보기 때문에 한 명의 시청자에게만 초점을 맞춘 커브드 TV가 주력 제품이 될 수 없다고 판단했다. 그의 예상대로 커브드 TV는 중국 등 일부 시장에서만 만들어졌다.◆고급 제품으로 차별화‘제품 구조조정’으로 실탄을 아낀 LG전자는 OLED(올레드) TV에 화력을 집중했다.삼성과 LG는 2013년 초 OLED TV를 함께 선보였지만 곧바로 다른 길을 걸었다. 삼성전자는 TV에 잔상이 남는 ‘번인’ 현상 탓에 OLED TV를 포기했지만 LG전자는 차세대 TV로 밀어붙였다. LCD TV보다 화질이 좋고 여러 형태로 쉽게 바꿀 수 있는 장점 때문이었다. 번인 현상이나 수율(정상 제품 비율)이 떨어지는 문제는 기술 혁신으로 극복할 수 있다고 판단했다. 2015년 31만 대였던 올레드 TV 판매량은 2016년 67만 대, 2017년 118만 대로 연평균 100%가량씩 늘었다. 올해 예상 판매량은 180만 대에 이른다.LG전자 관계자는 “올레드 TV는 중국 등의 저가 TV와 차별화돼 불필요한 가격 경쟁을 벌일 필요가 없다”고 말했다. 미국에서 파는 65인치 최고급 TV 기준으로 LG전자의 올레드 TV 가격(홈페이지 기준)은 3999달러로 소니(3799달러), 삼성(3499달러)보다 5~14% 비싸다.좌동욱 기자 leftking@hankyung.com[한경닷컴 바로가기] [글방] [모바일한경 구독신청] ⓒ 한국경제 & hankyung.com, 무단전재 및 재배포 금지한국경제 관련뉴스해당 언론사에서 선정하며 언론사 페이지(아웃링크)로 이동해 볼 수 있습니다.13억이던 대치동 아파트, 2개월 만에 집값이…""아이 좀 잠깐 봐달라"" 카페에 맡기고 가 버린 엄마은퇴자, 퇴직금 5000만원 투자했는데… \'분통\'분양가 7억원 고덕래미안, 9호선 개통소식에…""편의점서 타이레놀 팔았더니…"" 약사들 \'몽니\'좋아요0훈훈해요0슬퍼요0화나요0후속기사 원해요0기사제공 :']"
6,삼성전자, 2018-07-0519:02,국민일보 ,"文 대통령, 삼성전자 인도 공장 방문… 이재용과 조우할 듯",https://finance.naver.com/news/news_read.nhn?article_id=0001112007&office_id=005&mode=search&query=삼성전자&page=1,"['       文 대통령, 삼성전자 인도 공장 방문… 이재용과 조우할 듯      기사입력2018-07-05 19:02기사원문좋아요훈훈해요좋아요 평가하기공감좋아요0훈훈해요0슬퍼요0화나요0후속기사 원해요0댓글文, 8일부터 5박6일 인도·싱가포르 국빈방문문재인 대통령이 8일부터 5박6일 인도·싱가포르 국빈방문 기간 중 삼성전자 인도 현지 공장 준공식에 참석한다. 이재용(사진) 삼성전자 부회장도 준공식에 올 것으로 알려졌다. 행사 과정에서 자연스럽게 문 대통령과 이 부회장의 만남이 이뤄질 것으로 보인다. 청와대 고위 관계자는 5일 “문 대통령이 오는 9일 삼성전자의 인도 노이다 스마트폰 신공장 준공식에 참석할 예정”이라며 “이 부회장도 참석할 가능성이 높다”고 말했다. 문 대통령이 취임 후 삼성그룹 관련 일정에 참석하는 것은 처음이다. 청와대는 다른 기업의 현안이 있을 때도 대통령이 참석했던 만큼 경제적인 것 외에 다른 의미는 없다며 과도한 해석을 경계했다. 하지만 삼성은 이번 만남이 그동안 안 좋았던 정부와 불편했던 관계를 개선하는 전환점이 되지 않을까 내심 기대하는 분위기다. 그동안 적폐청산을 우선순위에 두고 재벌개혁에 초점을 맞춰온 문재인정부가 경제살리기로 무게중심을 옮기면서 기업과 거리 좁히기에 나서지 않겠느냐는 전망이다. 문 대통령은 최근 청와대에서 열린 정책기조점검회의에서 “청와대와 정부가 기업과 소통하는 것도 중요하다”면서 “자주 소통하고 기업 애로를 청취해 해소해주는 게 중요하다”고 말한 것으로 알려졌다. 이 부회장이 준공식에 참석하면 지난 2월 석방된 이후 처음으로 공식 행사에 모습을 드러내는 셈이다. 또 삼성 총수로서 첫 번째 공식 일정이기도 하다. 공정거래위원회는 5월 삼성의 총수가 이 부회장이라고 발표했다. 한 재계 관계자는 “다른 기업과 동일한 선상에서 대하는 것만으로도 삼성에는 의미가 있을 것”이라면서 “경제살리기 차원에서 고용, 투자 등에 적극 나서 달라는 신호로 받아들일 수도 있다”고 말했다. 삼성은 이 부회장 참석 여부에 대해 별다른 언급을 하지 않고 있다. 이 부회장에 대한 대법원 판결도 남아 있는 만큼 섣불리 움직일 수 있는 상황이 아니라는 것이다. 삼성전자 노이다 신공장은 6억5000만 달러(약 7270억원)가 투자된 인도 최대 휴대전화 공장이다. 삼성전자는 현지 휴대전화 시장점유율 1위를 지키고 있지만 후발 중국 기업이 맹추격 중이다. 대한상공회의소는 문 대통령 인도 순방에 동행할 경제사절단으로 박용만 대한상의 회장과 윤부근 삼성전자 부회장, 정진행 현대차 사장, 지동섭 SK루브리컨츠 대표이사, 안승권 LG전자 사장 등이 참가한다고 밝혔다. 문 대통령은 10일 나렌드라 모디 인도 총리와 정상회담을 가진 뒤 한·인도 최고경영자(CEO) 라운드테이블에 참석한다. 이 자리에서 쌍용자동차 대주주인 마힌드라 그룹 회장을 만나 쌍용차 해고자 문제 해결에 협조해 달라고 당부할 것으로 예상된다.김준엽 박세환 기자  snoopy@kmib.co.kr[카카오 친구맺기] [페이스북][취재대행소 왱!(클릭)]GoodNews paper ⓒ 국민일보(www.kmib.co.kr), 무단전재 및 재배포금지국민일보 관련뉴스해당 언론사에서 선정하며 언론사 페이지(아웃링크)로 이동해 볼 수 있습니다.호신용품 열전…""내 몸은 내가 지킨다""""폼페이오 때문에 바쁘실텐데…"" 인사에 김영철 반응2018 미스코리아 진 김수민 \'외신들도 감탄\'80대 남성 애완견 참진드기에 물려 사망[포착] 부축 받는 낯빛 어두운 이명박 전 대통령좋아요0훈훈해요0슬퍼요0화나요0후속기사 원해요0기사제공 :']"
