,회사명,날짜,언론사,기사제목,링크,본문
0,삼성전자, 2018-10-1413:17,헤럴드경제 ,"삼성전자, 포르쉐 고성능 車행사에 ‘홈시네마’ 솔루션 전시",https://finance.naver.com/news/news_read.nhn?article_id=0001451471&office_id=016&mode=search&query=삼성전자&page=3,"['       삼성전자, 포르쉐 고성능 車행사에 ‘홈시네마’ 솔루션 전시      기사입력2018-10-14 13:17기사원문좋아요훈훈해요좋아요 평가하기공감좋아요0훈훈해요0슬퍼요0화나요0후속기사 원해요0댓글- 말레이시아 세팡 경기장에 ‘LED포홈’ 선봬- 109인치 프리미엄 홈시네마 경험 제공[헤럴드경제=천예선 기자] 삼성전자가 포르쉐 고성능 자동차 체험 행사에 ‘홈시네마’ 솔루션을 전시하며 프리미엄 고객 대상 마케팅을 강화했다. 삼성전자는 17일까지 말레이시아 세팡 국제 자동차 경기장에서 개최되는 ‘포르쉐 익스피리언스’ 행사에 홈 시네마 시장을 겨냥한 109형(인치) 초대형 LED 사이니지 ‘LED 포 홈’ IF P1.2 시리즈를 전시한다고 14일 밝혔다 IF P1.2시리즈는 픽셀 간격 1.2㎜ 수준의 ‘미세 피치’ LED 기술이 적용된 실내형 고급 사이니지다. ‘LED 포 홈’은 지난 9월 미국 샌디에이고에서 열린 영상기기 전시회 ‘CEDIA 2018’에서 공개됐다.삼성전자가 17일까지 말레이시아 세팡 국제 자동차 경기장에서 개최되는 ‘포르쉐 익스피리언스’ 행사에 홈 시네마 시장을 겨냥한 109형 초대형 LED 사이니지 ‘LED 포 홈’ IF P1.2 시리즈를 전시하고 프리미엄 고객 대상으로 차별화된 홈 시네마 경험을 제공한다.[제공=삼성전자]아시아태평양 지역에서 최초로 개최되는 ‘포르쉐 익스피리언스’ 행사는 포르쉐의 주요 고객들이 고성능 스포츠카를 실제 국제 자동차 경주장인 서킷에서 시승할 수 있는 행사다. 삼성전자는 이번 행사의 하이라이트 공간에 ‘LED 포 홈’을 설치해 시승 참가자 전원에게 초대형 스크린을 활용한 사전 주행 브리핑 교육을 지원하고 프리미엄 홈 시네마 경험을 제공한다. 이를 통해 참가자들은 실제 차량에 탑승하지 않아도 차량에 대한 정보를 사전에 숙지하고 동일한 코스를 경험할 수 있도록 했다.이 제품은 베젤이 없는 모듈러 방식의 LED 디스플레이로 109형(풀HD)과 219형(UHD) 크기로도 초대형화가 가능하며, 화면 사이즈와 해상도를 고객이 취향에 맞게 주문할 수 있는 프리미엄 홈 시네마 전문 솔루션이다. 특히, LED 미세 피치 기술과 HDR의 선명한 화질로 고급 주택, 별장, 고급 리조트 등에서 개인을 위한 소규모 극장 시스템을 원하는 고객들에게 차별화된 시청 경험을 선사한다. 또한 이날 행사에는 디지털 플립차트 ‘삼성 플립’, 65형 스마트 사이니지, 49형 커브드 모니터 등도 함께 전시돼 참가자들의 호평을 받았다. /cheon@heraldcorp.com▶리얼로 보여주마! 헤럴드 리얼라이프▶헤럴드경제 구독하고 GS기프티콘 받자! ▶한입뉴스 ‘타파스’ 페이스북 친구맺기 - Copyrights ⓒ 헤럴드경제 & heraldbiz.com, 무단 전재 및 재배포 금지 -헤럴드경제 관련뉴스해당 언론사에서 선정하며 언론사 페이지(아웃링크)로 이동해 볼 수 있습니다.강용석 ""이재명 머리 쓰고 있다, 신체 비밀 \'젼 말고도…""주윤발 ""한달 11만원 생활…전재산 8000억원 사회 환원""배정남 ""절친 강동원, 만화에서 튀어나온 줄""이재명 ""점 없다, 레이저 시술도 안해…의사 참석 시킬 것""\'비리\' 환희유치원 원장 줄행랑...학부모 항의에 119구급차로 피해좋아요0훈훈해요0슬퍼요0화나요0후속기사 원해요0기사제공 :']"
1,삼성전자, 2018-10-1413:11,스포츠조선 ,"르노삼성, 28일까지 전국 영업점에서 SM6· QM6 시승 이벤트 진행",https://finance.naver.com/news/news_read.nhn?article_id=0003328675&office_id=076&mode=search&query=삼성전자&page=3,"['       르노삼성, 28일까지 전국 영업점에서 SM6· QM6 시승 이벤트 진행      기사입력2018-10-14 13:11기사원문좋아요훈훈해요좋아요 평가하기공감좋아요0훈훈해요0슬퍼요0화나요0후속기사 원해요0댓글르노삼성자동차는 \'SM6 프라임\' 출시를 기념해 10월 28일까지 풍부한 혜택으로 SM6와 QM6를 경험해볼 수 있는 \'6ix in the CITY(식스 인 더 시티)\' 전국 시승 이벤트를 실시한다.이번 \'6ix in the CITY\' 시승 이벤트는 전국 르노삼성자동차 217개 영업점에서 진행되며, 신규 모델인 \'SM6 프라임\', 국내 중형 가솔린 SUV 판매 1위 \'QM6 GDe\' 등 다양한 SM6 및 QM6 모델들을 고객들이 두루 경험할 수 있도록 마련되었다. 특히 지난 4일 새롭게 출시된 SM6 프라임은 인기 사양을 탑재하고도 합리적인 가격을 갖춰 \'최고의 선택을 위한 새로운 기준\'으로서 완벽한 밸런스를 지닌 모델이다. 최고 출력 140마력의 2.0 가솔린 엔진과 세계 최대 무단변속기 제조사인 자트코(JATCO)사의 최신 \'X-tronic\'을 결합해 부드럽고 안정적인 주행 성능을 선사하는 점이 특징이다. 주력인 SE 트림의 경우 운전석 파워 시트를 비롯해 뒷좌석 열선시트, 전자식 파킹 브레이크, 크루즈 컨트롤 및 스피드 리미터, 하이패스 기능을 담은 전자식 룸미러, 좌우 독립 풀오토 에어컨, 레인 센싱 와이퍼, 매직트렁크, 열선 스티어링 휠 등 다양한 편의 사양을 기본 탑재했다.\'6ix in the CITY\' 전국 시승 이벤트 참여는 르노삼성자동차 홈페이지 또는 각 영업점에서 신청 후 가능하며, 시승 후 10월 28일까지 차량을 출고하는 고객에게는 추첨을 통해 푸짐한 경품이 제공된다. 하와이 2인 왕복 항공권과 힐튼 하와이언 빌리지 4박 숙박권으로 구성된 \'하와이 4박6일 여행권\'(총1명)과 삼성전자의 의류청정기 \'에어드레서\'(총3명)가 경품으로 준비돼 있다. (제세공과금 본인 부담) 추첨 결과는 11월 9일 르노삼성자동차 홈페이지에 공지되며, 당첨자에게도 개별 통보된다. 르노삼성자동차 김태준 영업본부장은 ""이번 이벤트는 르노삼성자동차의 대표 차종인 SM6와 QM6를 푸짐한 경품과 함께 시승할 수 있는 기회""라며, ""이번 시승 이벤트 외에도 르노삼성자동차가 10월에 제공 중인 파격적인 구매 혜택에 대해서도 많은 소비자들이 관심을 가져 주시길 바란다""고 말했다. 10월 한 달 간 SM6 및 QM6 구매 시 최대 300만원의 현금 지원이 제공되며, QM3는 200만원 현금 지원 또는 특정 컬러의 경우 최장 60개월 무이자 할부가 가능하다. 이 밖에 온라인 구매상담 및 출고 고객을 위한 \'슈퍼 세일 페스타2\' 특별 이벤트도 함께 진행 중이다.한편, 르노삼성자동차는 2022 비전의 핵심 가치인 \'고객을 위한 가치 추구\' 및 \'다함께 즐기는 혁신\' 실현의 일환으로 시승 이벤트 등 다양한 고객 체험 기회를 마련 중에 있다.이정혁 기자 jjangga@sportschosun.com[스포츠조선 바로가기]- Copyrightsⓒ 스포츠조선(http://sports.chosun.com/), 무단 전재 및 재배포 금지좋아요0훈훈해요0슬퍼요0화나요0후속기사 원해요0기사제공 :']"
2,삼성전자, 2018-10-1413:04,한국일보 ,말레이시아 포르쉐 행사 찾아간 삼성 초대형 사이니지,https://finance.naver.com/news/news_read.nhn?article_id=0000333801&office_id=469&mode=search&query=삼성전자&page=3,"['       말레이시아 포르쉐 행사 찾아간 삼성 초대형 사이니지      기사입력2018-10-14 13:04기사원문좋아요훈훈해요좋아요 평가하기공감좋아요0훈훈해요0슬퍼요0화나요0후속기사 원해요0댓글‘홈 시네마’ 시장 겨냥 LED 사이니지 등 전시말레이시아 세팡 국제자동차경기장 내 포르쉐 익스피리언스 행사장에 삼성전자의 초대형 LED 사이니지가 설치돼 있다. 삼성전자 제공삼성전자는 오는 17일까지 말레이시아 세팡 국제자동차경기장에서 열리는 ‘포르쉐 익스피리언스’에 109형(인치) 초대형 발광다이오드(LED) 사이니지를 제공했다고 14일 밝혔다.아시아태평양에서 처음 열린 포르쉐 익스피리언스는 포르쉐 고객들이 국제 기준의 서킷에서 고성능 스포츠카를 시승하는 행사다. 삼성전자 LED 사이니지는 시승 참가자들의 사전 주행 브리핑 등에 사용됐다. 초대형 사이니지 이외에 65인치 스마트 사이니지와 49인치 커브드 모니터 등이 함께 전시됐고, 디지털 플립차트 ‘삼성 플립(Samsung Flip)’은 참가자 교육에 활용됐다.109인치 LED 사이니지는 삼성전자가 ‘홈 시네마’ 시장을 위해 만든 ‘LED 포 홈(LED for Home)’ IF P1.2 시리즈다. 실내형 고급 사이니지인 IF P1.2 시리즈에는 픽셀 간격이 1.2㎜ 수준인 ‘미세 피치(Fine Pixel Pitch)\' LED 기술이 적용됐다. 지난달 미국 샌디에이고에서 열린 영상기기 전시회 \'CEDIA 2018’에서 처음 공개돼 호평을 받았다.LED 포 홈은 베젤(테두리)이 없는 모듈러 방식의 LED 디스플레이다. 풀HD 해상도의 109인치는 물론 UHD 해상도의 219인치까지 초대형화가 가능하다.김창훈 기자 chkim@hankookilbo.com▶[개편이벤트] 참여하면 화장품세트와 블루투스 스피커를 드려요!▶네이버 채널에서 한국일보를 구독하세요!\xa0한국일보 관련뉴스해당 언론사에서 선정하며 언론사 페이지(아웃링크)로 이동해 볼 수 있습니다.이재명 ""동그랗고 까만점 없다"" 신체검증 예고오죽했으면… ""상습폭행 아들, 이번엔 처벌해달라""밀워키 졌지만, 12연승 공짜 햄버거는 \'전통대로\'교통사고 빈번… 하이패스 운전 불편한 이유 있었네""집을 왜 할인해 파나"" 중국서 반발 시위좋아요0훈훈해요0슬퍼요0화나요0후속기사 원해요0기사제공 :']"
3,삼성전자, 2018-10-1412:35,디지털타임스 ,"국내 10대 그룹 상장사, 이달 들어 시총 65조원 증발",https://finance.naver.com/news/news_read.nhn?article_id=0002486726&office_id=029&mode=search&query=삼성전자&page=3,"['       국내 10대 그룹 상장사, 이달 들어 시총 65조원 증발      기사입력2018-10-14 12:35기사원문좋아요훈훈해요좋아요 평가하기공감좋아요0훈훈해요0슬퍼요0화나요0후속기사 원해요0댓글 [디지털타임스 김민주 기자] 외국인 이탈 가속화로 국내 증시가 부진한 가운데 국내 10대 그룹의 상장사 시가총액이 10월 들어서만 65조원 가까이 준 것으로 나타났다.14일 재벌닷컴에 따르면 자산 상위 10대 그룹 95개 상장사의 시가총액(우선주 포함)은 지난 12일 현재 864조9670억원(이하 종가 기준)으로 집계됐다. 이는 9월말의 929조4060억원보다 64조4380억원(6.9%) 감소한 수준이다.같은 기간 국내 주식시장(코스피+코스닥)의 시총은 1840조8830억원에서 1691조6840억원으로 149조1990억원(8.1%) 줄었다.그룹별로는 삼성그룹의 시총이 498조8530억원에서 467조3880억원으로 31조4650억원(6.3%)이나 줄어 10대 그룹 중 시총 감소액이 가장 컸다.특히 삼성전자(우선주 제외) 시총이 298조1780억원에서 282조4500억원으로 15조7270억원 줄었다.현대차그룹도 현대차와 현대모비스 등 주력사를 중심으로 시총이 94조6030억원에서 83조5340억원으로 11조690억원(11.7%) 감소했다.LG그룹은 LG화학 시총이 지난달 말보다 3조5300억원 줄고, LG생활건강도 2조5610억원 감소한 영향으로 그룹 시총이 10조5150억원(11.2%) 사라졌다.SK그룹도 SK, SK텔레콤, SK하이닉스, SK이노베이션 등 주력회사를 중심으로 시총이 126조4090억원에서 122조7050억원으로 3조7040억원(2.9%) 증발했다.이밖에 포스코그룹의 시총이 3조2010억원 줄었고 한화그룹(1조2760억원)과 롯데그룹(1조1340억원)도 각각 1조원 넘게 시총이 감소했다.그다음으로 현대중공업그룹(9920억원), 농협그룹(7080억원), GS그룹(3730억원) 등 순으로 시총 감소액이 컸다.10대 그룹 모두 조정 장세를 피하지 못한 채 일제히 시총이 감소했다.김민주기자 stella2515@dt.co.kr 디지털타임스 홈페이지 바로가기 / 디지털타임스 뉴스 더보기네이버 채널에서 \'디지털타임스\'를 구독해주세요.디지털타임스 관련뉴스해당 언론사에서 선정하며 언론사 페이지(아웃링크)로 이동해 볼 수 있습니다.휘발유 가격 또 15.4원 올라…1년 9개월 만에 최대문대통령, 오늘 프랑스 파리로…7박9일 유럽 순방 돌입중고차, 1020세대 \'실속\', 3040세대 \'승차감\' 선호전국 2천668가구 분양…위례·판교 연기""편의점이 좋아""...청소년 4명중 1명 편의점서 끼니 해결좋아요0훈훈해요0슬퍼요0화나요0후속기사 원해요0기사제공 :']"
4,삼성전자, 2018-10-1412:35,디지털타임스 ,100대 기업 영업익 40%은 삼성·SK 반도체…다가오는 한국경제 `비상등`,https://finance.naver.com/news/news_read.nhn?article_id=0002486728&office_id=029&mode=search&query=삼성전자&page=3,"['       100대 기업 영업익 40%은 삼성·SK 반도체…다가오는 한국경제 `비상등`      기사입력2018-10-14 12:35기사원문좋아요훈훈해요좋아요 평가하기공감좋아요0훈훈해요0슬퍼요0화나요0후속기사 원해요0댓글 [디지털타임스 박정일 기자] 국내 시가총액 100대 기업의 영업이익 가운데 40%가 삼성전자 반도체와 SK하이닉스로부터 나온 것으로 집계됐다. 세계 반도체 시장의 영업이익 절반 이상을 책임지는 양사의 위상을 보여주는 대목이지만, 메모리반도체 가격이 내림세로 돌아서고 있어 우리 경제 전반의 침체를 우려하는 목소리도 나오고 있다.14일 업계와 기업 경영성과 평가사이트 CEO스코어에 따르면 올해 상반기 기준으로 시가총액 상위 100대 기업의 전체 영업이익에서 삼성전자 반도체 사업부와 SK하이닉스의 영업이익이 차지하는 비중은 40.2%로 집계됐다. 시총 100대 기업의 전체 영업이익(약 82조2820억원) 중 삼성전자 반도체 사업부의 영업이익은 약 23조1563억원, SK하이닉스는 약 9조9413억원이었다.두 회사의 실적은 최근 2년 동안 급상승했다. 2013년부터 2016년까지 100대 기업 영업이익의 15~20% 수준이었던 두 회사의 비중은 지난해 34.3%로 급증한 데 이어 올해는 40%까지 넘어섰다. 메모리반도체 수요가 크게 늘면서 가격이 급등했기 때문이다. 시장조사업체 D램익스체인지에 따르면 대표 품목인 D램 기준제품의 경우 지난달 말 기준 2016년 6월 말과 비교해 무려 179%나 가격이 상승했고, 낸드플래시 역시 같은 기간 41% 가량 올랐다.이로 인해 세계 D램 시장의 4분의 3 가량을 차지하는 삼성전자와 SK하이닉스의 실적은 수직 상승했다. 세계 반도체 1위 기업으로 도약했고, 작년 기준 이들 상위 10개사의 전체 영업이익 가운데 삼성전자가 차지하는 비중은 38.8%, SK하이닉스가 15.1%로, 이 둘을 합쳐 한국 기업이 세계 반도체 시장 영업이익에서 차지하는 비중은 53.9%에 달했다. 매출 기준으로도 삼성전자는 인텔을 제치고 세계 1위, SK하이닉스는 3위를 각각 차지했다.하지만 올해 하반기부터 메모리반도체 가격이 점차 하락할 것이라는 전망이 나오면서, 반도체에 쏠린 한국 경제 전반의 침체에 대한 우려가 커지고 있다. D램익스체인지는 내년 D램 가격이 올해보다 15∼20% 하락하고, 낸드플래시는 25∼30%나 떨어질 것으로 내다보고 있다. 업계에서도 내년 상반기까지는 가격 조정이 불가피할 것으로 전망하고 있다.반도체를 이어갈 다음 성장동력도 보이지 않는다. 주력 수출품목인 스마트폰과 가전은 중국의 공세, 자동차와 철강 등은 글로벌 보호무역 등의 영향으로 큰 폭의 성장을 기대하기 어렵다. 화장품과 바이오, 이차전지 배터리 등이 주목받고 있지만, 반도체를 대체할 만한 수준은 아니다.재계 관계자는 ""반도체 코리아의 위상은 자랑할 만한 일이지만, 특정 업종에 대한 쏠림이 너무 크다는 것은 부담""이라며 ""반도체의 경우 중국의 성장과 보호무역 등 수많은 견제를 극복해야 하고, 동시에 새로운 성장동력도 찾아야 한다는 게 한국 산업의 숙제""라고 말했다.박정일기자 comja77@dt.co.kr 디지털타임스 홈페이지 바로가기 / 디지털타임스 뉴스 더보기네이버 채널에서 \'디지털타임스\'를 구독해주세요.디지털타임스 관련뉴스해당 언론사에서 선정하며 언론사 페이지(아웃링크)로 이동해 볼 수 있습니다.휘발유 가격 또 15.4원 올라…1년 9개월 만에 최대문대통령, 오늘 프랑스 파리로…7박9일 유럽 순방 돌입중고차, 1020세대 \'실속\', 3040세대 \'승차감\' 선호전국 2천668가구 분양…위례·판교 연기""편의점이 좋아""...청소년 4명중 1명 편의점서 끼니 해결좋아요0훈훈해요0슬퍼요0화나요0후속기사 원해요0기사제공 :']"
5,삼성전자, 2018-10-1412:15,아시아경제 ,"김동연 부총리 ""대기업 간담회 재개할 것…2~3곳 후보 압축""",https://finance.naver.com/news/news_read.nhn?article_id=0004333446&office_id=277&mode=search&query=삼성전자&page=3,"['       김동연 부총리 ""대기업 간담회 재개할 것…2~3곳 후보 압축""      기사입력2018-10-14 12:15기사원문좋아요훈훈해요좋아요 평가하기공감좋아요0훈훈해요0슬퍼요0화나요0후속기사 원해요0댓글[아시아경제 김민영 기자, 이지은 기자]김동연 경제부총리 겸 기획재정부 장관은 ""앞으로도 대기업과 만나겠다""며 ""2~3곳 정도 압축된 후보 리스트를 갖고 준비 중""이라고 밝혔다. 김 부총리는 13일(현지시간) 인도네시아 발리에서 동행기자단과 가진 간담회에서 기자들의 질문에 답해 ""혁신성장은 중소, 중견, 벤처뿐 아니라 대기업과 정부도 함께 주체가 되어야 하는 것""이라며 이같이 밝혔다. 김 부총리는 지난 8월 삼성전자 방문을 두고 \'투자 구걸\' 논란이 일어난 이후 대기업 방문을 진행하지 않고 있다. 김 부총리는 ""소위 대기업이라고 불리는 곳을 다섯 군데 갔는데 그보다 훨씬 많은 중소기업과 중견기업을 만났다""며 ""혁신성장은 시장에서 보면 창조적 파괴고 국가경제로 보면 전반적인 시스템 개혁이기 때문에 구심점은 민간이 되어야 하고 정부는 도와줘야 하는 것""이라고 말했다. 이어 ""지난번 (삼성전자) 만남 이후 그간 (대기업 방문이) 없던 건 여러가지로 일정도 여유롭지 못했고 사정 때문""이라며 ""앞으로 국감도 있지만 일정을 봐서 계속 할 거고, 실무자들이 두세개 정도 압축된 후보를 갖고 준비하고 있다""고 덧붙였다. 향후 경제동향과 관련해서는 ""단기간 내에 고용 문제가 회복되기엔 쉽지 않을 것""이라면서도 ""실제 어려운 부분이 있지만 우리 경제를 전체적으로 봐선 그렇게 비관적인 상황이 아니""라고 진단했다. 그는 ""금년 거시경제 운영, 성장을 더 봐야겠지만 잠재성장률 수준에서 크게 벗어나지 않는 범위 내 트랙에 있고 수출이나 내수 소비 비교적 견고한 모습 보이고 있다""며 ""그렇게 비관적인 모습은 절대 아니다""라고 덧붙였다. 김 부총리는 ""우리 경제 어렵다 위기다 하는 건 아니라고 생각한다""며 ""설령 그로 인한 어려움이 있는 걸 부인하는 건 아니지만 우리 경제가 언제 안 어려운 적이 있었나. 그런 어려움을 극복하면서 다져진 게 우리 경제의 모습""이라고 강조했다. 일부 투자나 고용 문제에서 어려움이 있지만 크게 봐선 경제 자체에 문제가 있지는 않다는 것이다. 김 부총리는 ""여러 노력과 생태계 조성, 시장, 기업 기살리기 통해 우리경제가 빠른 시간 내에 정말 좋은 모습 보이도록 최대한 노력할 것""이라며 ""우리 경제의 견고한 기반이나 경제주체들의 적극적인 문제를 해결하려는 DNA가 단연코 우리 경제를 단기간 내에 좋은 모멘텀으로 만들 것이고 우리 경제도 좋은 쪽으로 갈 수 있다""고 말했다.김민영 기자 argus@asiae.co.kr이지은 기자 leezn@asiae.co.kr▶ 아시아경제 친구 맺고 \'휴대폰, LED마스크\' 받자▶ 재미와 신기 \'과학을읽다\' ▶ 놀라운 \'군사이야기\'<ⓒ세계를 보는 창 경제를 보는 눈, 아시아경제 무단전재 배포금지>아시아경제 관련뉴스해당 언론사에서 선정하며 언론사 페이지(아웃링크)로 이동해 볼 수 있습니다.동료 아내 강간하려고…입 담기 민망한 경찰 사례들서울·수도권 방어할 \'비상한 무기\'""음경 길이 짧으면 불임 가능성 높다""동덕여대 음란행위 파문…""제발 도와주세요""딱 걸린 아내의 불륜 현장…아이러니하게도 장소가좋아요0훈훈해요0슬퍼요0화나요0후속기사 원해요0기사제공 :']"
6,삼성전자, 2018-10-1412:13,뉴시스 ,"르노삼성, SM6 출시 전국 시승 이벤트",https://finance.naver.com/news/news_read.nhn?article_id=0008853515&office_id=003&mode=search&query=삼성전자&page=3,"['       르노삼성, SM6 출시 전국 시승 이벤트      기사입력2018-10-14 12:13기사원문좋아요훈훈해요좋아요 평가하기공감좋아요0훈훈해요0슬퍼요0화나요0후속기사 원해요0댓글28일까지 전국 217개 영업점에서 SM6 및 QM6 시승 이벤트 진행시승 후 출고하면 추첨 통해 하와이 4박6일 여행권 등 경품 제공【서울=뉴시스】김지은 기자 = 르노삼성자동차는 \'SM6 프라임\' 출시를 기념해 28일까지 SM6와 QM6를 경험해볼 수 있는 \'6ix in the CITY(식스 인 더 시티)\' 전국 시승 이벤트를 실시한다고 14일 밝혔다. 전국 르노삼성자동차 217개 영업점에서 진행되며, 신규 모델인 \'SM6 프라임\', 국내 중형 가솔린 SUV 판매 1위 \'QM6 GDe\' 등 SM6 및 QM6 모델들을 고객들이 두루 경험할 수 있도록 마련됐다. 지난 4일 출시된 SM6 프라임은 최고 출력 140마력의 2.0 가솔린 엔진과 세계 최대 무단변속기 제조사인 자트코(JATCO)사의 최신 \'X-tronic\'을 결합해 부드럽고 안정적인 주행 성능을 선사하는 점이 특징이다. 주력인 SE 트림의 경우 운전석 파워 시트를 비롯해 뒷좌석 열선 시트, 전자식 파킹 브레이크, 하이패스 기능을 담은 전자식 룸미러, 좌우 독립 풀오토 에어컨 등 다양한 편의 사양을 기본 탑재했다. 참여는 르노삼성자동차 홈페이지 또는 각 영업점에서 신청 후 가능하다. 시승 후 28일까지 차량을 출고하는 고객에게는 추첨을 통해 경품을 준다.하와이 2인 왕복 항공권과 힐튼 하와이언 빌리지 4박 숙박권으로 구성된 \'하와이 4박 6일 여행권\'(총 1명)과 삼성전자의 의류청정기 \'에어드레서\'(총 3명)가 경품으로 준비돼 있다. 추첨 결과는 다음 달 9일 르노삼성자동차 홈페이지에 공지되며, 당첨자에게도 개별 통보된다.아울러 르노삼성은 이달 한 달간 SM6 및 QM6 구매 시 최대 300만원의 현금을 지원한다. QM3는 200만원 현금 지원 또는 특정 컬러의 경우 최장 60개월 무이자 할부 프로모션을 벌인다.kje1321@newsis.com▶ 뉴시스 빅데이터 MSI 주가시세표 바로가기 ▶ 뉴시스 SNS [페이스북] [트위터]<저작권자ⓒ 공감언론 뉴시스통신사. 무단전재-재배포 금지.>뉴시스 관련뉴스해당 언론사에서 선정하며 언론사 페이지(아웃링크)로 이동해 볼 수 있습니다.\'최소 10명 살해\' 연쇄살인마 ""여성 혐오…풀려나면 또 죽일것""장인 살해 뒤 처가에 불지른 60대 사위 징역 30년 선고""아버지 칠순 여행비 마련하려고…"" 여비 가로챈 공무원동덕여대 교내서 알몸男 음란행위…경찰, 경위 파악소방관이 대낮 만취 음주운전하다 6중 추돌…3명 부상좋아요0훈훈해요0슬퍼요0화나요0후속기사 원해요0기사제공 :']"
