,회사명,날짜,언론사,기사제목,링크,본문
18,삼성전자, 2018-02-2114:14,뉴시스 ,박용만 서울상의 회장 연임…대한상의 회장 연임도 유력,https://finance.naver.com/news/news_read.nhn?article_id=0008452576&office_id=003&mode=search&query=삼성전자&page=4,"['       박용만 서울상의 회장 연임…대한상의 회장 연임도 유력      기사입력2018-02-21 14:14기사원문좋아요훈훈해요좋아요 평가하기공감좋아요0훈훈해요0슬퍼요0화나요0후속기사 원해요0댓글【서울=뉴시스】단독 추천 받아 만장일치로 연임 의결【서울=뉴시스】심동준 기자 = 서울상공회의소 회장에 박용만(63) 두산인프라코어 대표가 재선임됐다. 서울상의 회장이 대체로 대한상공회의소 회장직을 겸임하는 관례에 따라 대한상의 회장직도 연임할 가능성이 커졌다. 서울상의는 21일 오전 서울 중구 상의회관에서 총회를 열어 박 회장을 23대 회장으로 연임키로 결의했다. 박 회장은 지난 2015년부터 서울상의 회장직을 맡아오고 있다. 서울상의 회장은 총회 자리에서 의장이 추천자를 받고, 단독 후보일 경우에는 거수 등의 방식으로 가부를 정하는 방식으로 선출된다. 후보자가 다수일 경우에는 비공개 투표를 거쳐 회장을 선임하게 된다. 이번 총회에서는 박 회장이 단독 추천을 받아 참석자의 만장일치로 회장 선임 결의가 이뤄진 것으로 전해졌다. 서울상의 회장 임기는 3년이다. 박 회장이 서울상의 회장을 연임하게 되면서 대한상의 회장직도 유지할 가능성이 커졌다. 박 회장의 대한상의 회장 연임 여부는 내달 22일 예정된 대한상의 의원 총회에서 결정된다. 재계 일각에서는 박 회장이 대한상의·서울상의 수장으로 정치권과 노동계와 적극적으로 소통하려는 모습을 보이는 점이 높게 평가받아 연임 결정이 이뤄진 것으로 보고 있다. 서울상의는 또 총회에서 부회장 3명을 신규 선임, 회장단을 23명으로 확대하는 내용의 결의도 했다. 서울상의 신임 비상근부회장으로는 황각규(63) 롯데지주 부회장, 김준(57) SK이노베이션 사장, 허기호(52) 한일시멘트 회장 등이 선임됐다. 서울상의 비상근 부회장으로는 이번에 선임된 황 부회장 등 이외에 현정은(63) 현대그룹 회장, 윤부근(65) 삼성전자 부회장, 박진수(66) LG화학 부회장, 정용진(50) 신세계 부회장 등이 있다. s.won@newsis.com▶ 뉴시스 빅데이터 MSI 주가시세표 바로가기 ▶ 뉴시스 SNS [페이스북] [트위터]뉴시스 관련뉴스해당 언론사에서 선정하며 언론사 페이지(아웃링크)로 이동해 볼 수 있습니다.여동생 2명 수년간 성폭행…인면수심 10대 오빠 \'징역형\'인도, 5살 여아 강간살해 용의자들 주민들이 구타 살해임신부 등 여직원 23명 성추행 장애인 복지관장 구속""이윤택, 사과 기자회견 리허설 했다"" 내부자 폭로""적화통일 문제없어요"" 文대통령 비방 낙서 50대 붙잡혀좋아요0훈훈해요0슬퍼요0화나요0후속기사 원해요0기사제공 :']"
19,삼성전자, 2018-02-2114:08,아이뉴스24 ,"이병래 예탁원 사장 ""예탁결제 업무에 블록체인 적용""",https://finance.naver.com/news/news_read.nhn?article_id=0000438960&office_id=031&mode=search&query=삼성전자&page=4,"['       이병래 예탁원 사장 ""예탁결제 업무에 블록체인 적용""      기사입력2018-02-21 14:08기사원문좋아요훈훈해요좋아요 평가하기공감좋아요0훈훈해요0슬퍼요0화나요0후속기사 원해요0댓글[아이뉴스24 김다운 기자] 이병래 한국예탁결제원 사장이 ""예탁결제 업무 전반에 걸쳐 블록체인, 빅데이터, 인공지능 등 혁신기술의 접목 가능성을 적극 검토해 단계적으로 확장해 나갈 계획""이라고 말했다.이 사장은 21일 신년 기자간담회를 열고 올해 예탁결제원 업무계획 등에 대해 발표했다.예탁결제원은 오는 4월부터 12월까지 전자투표를 시스템에 블록체인 기술을 접목한 시범운영체계를 구축하고 테스트를 수행하기로 했다. 빅데이터 산업 지원을 위한 서비스 플랫폼 시범사업도 시작할 계획이다.예탁결제원 대내외 정보를 빅데이터 형식으로 저장하고, 이를 분석한 결과를 핀테크 업체 등이 활용할 수 있도록 제공하겠다는 것이다.권리행사 정보, 파생결합증권(ELS) 발행 동향 등 정보상품을 신규 개발해 상품화에도 나서기로 했다.또한 예탁결제원은 2019년 9월로 다가온 \'전자증권\' 시대를 대비해 전사적 대응체계를 구축할 계획이다.실물 종이로 증권을 바행하지 않고 증권을 전자문서화하는 전자증권이 2019년 도입된다. 예탁원은 이를 위해 전자증권 구축 프로젝트 사업관리 전문업체(PMO) 및 전산관리업체를 지난해 11월 선정한 바 있다.이 사장은 ""실물증권이 디지털화되는 전자증권이 4차 산업혁명 기술과 결합해 새로운 금융혁신을 촉발할 수 있도록 노력하겠다""고 말했다.예탁결제원은 전자증권을 대비해 조직체계 및 수수료 체계를 개편하고, 하위법규 및 제도도 정비할 계획이다.오는 9월까지 수수료 항목 신설과 요율 결정 등을 완료하고, 오는 8월 공포될 시행령과 더불어 하위 법규 개정 지원, 내부규정 개정안 등을 마련하기로 했다.상장회사와 비상장회사 등 발행회사를 대상으로 홍보를 강화하고, 정관 변경사항 등에 대한 설명회를 개최한다.◆""삼성전자, 액면분할 시 거래정지 없애는 것은 힘들어""한편 이 사장은 ""삼성전자 액면분할과 관련된 주식시장 혼란을 최소화하기 위해 한국거래소를 중심으로 유관기관 태스크포스(TF)를 구성했는데 TF 논의를 기본으로 삼성전자와 거래소가 최종적으로 결정해 진행할 것""이라고 말했다.하지만 거래정지 기간이 없는 액면분할은 현실적으로 어렵다는 설명이다.그는 ""증권시장 관련 기관들이 전산으로 연결돼 있는데 진행 과정에 오차가 없이 이뤄져야 하는데, 거래정지 없이 거래가 이뤄진다는 것은 기술적인 측면에서 리스크가 있을 것으로 보인다""고 전했다.이 사장은 ""TF에서도 이런 측면에서 논의가 이뤄지는 것으로 안다""며 ""단 시장혼란과 투자자 피해를 최소화하기 위해 기간을 단축시키는 것에 대해 논의중""이라고 답했다.통상 주식 액면분할의 경우 2~3주 정도의 거래정지 기간을 두며, 삼성전자도 이를 감안해 오는 5월15일 거래가 정지될 것이라고 예고했었다.유관기관 TF 회의에서는 삼성전자가 시장에 미치는 영향에 대해 증권사와 자산운용사 등의 의견을 취합했는데, 3주 간의 거래정지 기간은 너무 길다는 의견이 지배적인 것으로 알려졌다.TF는 오는 3월23일 예정된 삼성전자 주주총회 전까지는 액면분할 절차에 대한 방침을 결정할 계획이다.또한 이 사장은 ""이 회장의 차명계좌에 대해 금융감독원으로부터 실명제 실시 전후한 삼성그룹 관계사의 실제 증권계좌를 제출해달라는 요구를 받았다""고 전했다.그는 ""실명제가 실시된지 25년 이상 시간이 흘렀는데 금감원의 자료요구를 받고 관련 부서에서 자료에 대해 수집하고 있다""고 말했다./김다운기자 kdw@inews24.com▶네이버 채널에서 \'아이뉴스24\'를 구독해주세요.▶블록체인이 만드는 비즈니스 신세계[ⓒ 아이뉴스24 무단전재 및 재배포 금지]아이뉴스24 관련뉴스해당 언론사에서 선정하며 언론사 페이지(아웃링크)로 이동해 볼 수 있습니다.[평창]다급해진 도쿄 ""평창이 부럽다""김성태 ""맞춤형 기획수사 음모 계속된다면 중대 결심""[단독]갤럭시S9 출고가 95만7천원네이버-카카오, 같은 듯 다른 광폭 투자 행보조금 비싸진 갤럭시S9, 흥행 키포인트는?좋아요0훈훈해요0슬퍼요0화나요0후속기사 원해요0기사제공 :']"
0,삼성전자, 2018-02-2114:07,뉴시스 ,"이병래 예탁결제원 사장 ""3월 주총 전 삼성전자 거래정지 기간 확정""",https://finance.naver.com/news/news_read.nhn?article_id=0008452542&office_id=003&mode=search&query=삼성전자&page=5,"['       이병래 예탁결제원 사장 ""3월 주총 전 삼성전자 거래정지 기간 확정""      기사입력2018-02-21 14:07기사원문좋아요훈훈해요좋아요 평가하기공감좋아요0훈훈해요0슬퍼요0화나요0후속기사 원해요0댓글삼성전자 거래정지 기간 최소화 방침기술적 제약으로 무정차거래는 어려워이건희 차명계좌 관련 증권계좌 확인 중 【서울=뉴시스】김지은 기자 = 이병래 한국예탁결제원 사장은 21일 ""삼성전자의 거래정지 없는 \'무정차거래\'는 현실적으로 어렵다""고 말했다.이 사장은 이날 열린 신년 간담회에서 액면분할 결정이 내려진 삼성전자의 거래정지 기간을 묻는 질문에 ""삼성전자 액면분할과 관련된 주식시장 혼란을 최소화하기 위해 한국거래소를 중심으로 유관기관 태스크포스(TF)를 구성해 거래정지 기간을 단축하는 방안을 논의 중""이라면서도 ""거래정지 기간이 없는 무정차거래는 어렵다""고 말했다.그는 ""무정차거래에 대한 논의도 있었지만 법상 구주권 제출 기간을 두는 등 제도적 제약이 있고 증권시장 관련 기관들이 전산으로 연결돼 있는데 거래정지 없이 거래가 이뤄지면 오차가 발생할 수 있는 등 기술적인 측면에서 리스크가 있다""고 설명했다. 이어 ""삼성전자 주주총회가 3월23일에 예정돼 있는데 그 전에 액면분할에 따른 거래정지 기간에 대한 방침을 결정할 것""이라고 보충했다. 앞서 삼성전자는 50:1 액면분할 결정을 공시하면서 4월25일부터 5월15일(신주변경상장일 전날)까지 거래가 정지된다고 발표했다. 이 사장은 ""시장 혼란과 투자자 피해를 줄이기 위해 거래정지 기간은 이보다는 줄어들 것""이라며 ""거래소가 최종 결정을 하게 된다""고 전했다.이 사장은 또 금융감독원이 이건희 삼성그룹 회장의 차명계좌에 과징금을 부과하기 위해 자료 제출을 요구한 것에 대해 ""확인 작업을 진행 중""이라고 답했다.그는 ""이 회장의 차명계좌에 대해 금감원으로부터 실명제 실시 전후한 삼성그룹 관계사의 실제 증권계좌를 제출해달라는 요구를 받았다""며 ""실명제가 실시된지 25년 이상 시간이 흘렀는데 관련 부서에서 확인 작업을 거쳐서 자료 제출 등 협조할 것이다""고 강조했다. 다만 ""1998년과 2010년에 전산시스템을 대대적으로 개편했다""며 ""이에 따라 자료를 찾는데시간이 꽤 걸릴 것으로 보고 있다""고 덧붙였다. kje1321@newsis.com▶ 뉴시스 빅데이터 MSI 주가시세표 바로가기 ▶ 뉴시스 SNS [페이스북] [트위터]뉴시스 관련뉴스해당 언론사에서 선정하며 언론사 페이지(아웃링크)로 이동해 볼 수 있습니다.여동생 2명 수년간 성폭행…인면수심 10대 오빠 \'징역형\'인도, 5살 여아 강간살해 용의자들 주민들이 구타 살해임신부 등 여직원 23명 성추행 장애인 복지관장 구속""이윤택, 사과 기자회견 리허설 했다"" 내부자 폭로""적화통일 문제없어요"" 文대통령 비방 낙서 50대 붙잡혀좋아요0훈훈해요0슬퍼요0화나요0후속기사 원해요0기사제공 :']"
1,삼성전자, 2018-02-2114:06,뉴스1 ,"이병래 예탁원 사장 ""삼성전자 무정차 액분은 어렵다""",https://finance.naver.com/news/news_read.nhn?article_id=0003219317&office_id=421&mode=search&query=삼성전자&page=5,"['       이병래 예탁원 사장 ""삼성전자 무정차 액분은 어렵다""      기사입력2018-02-21 14:06기사원문좋아요훈훈해요좋아요 평가하기공감좋아요0훈훈해요0슬퍼요0화나요0후속기사 원해요0댓글""제도·기술적 제약 많아…기술적 오차도 허용 못해""""이건희 회장 차명계좌 확인 중…자료제출 협조""(서울=뉴스1) 김민성 기자 = 이병래 예탁결제원 사장이 삼성전자 액면분할 과정에서 거래정지 기간 없이 진행(무정차 거래)하기는 현실적으로 어렵다는 견해를 밝혔다. 이건희 삼성전자 회장 차명계좌 관련해선 ""금융감독원에서 제출 요구를 받고 계좌 확인 중이고 구체적인 것은 말할 수 없다""며 선을 그었다.© News1이병래 예탁원 사장은 21일 서울 여의도에서 열린 신년 기자간담회에서 ""(삼성전자 무정차 거래는) 제도상으로 어려울 뿐 아니라 한 치의 오차도 없어야 해서 기술적으로도 어려운 부분이 많다""고 말했다.삼성전자 액면분할 태스크포스(TF) 유관기관으로서 무정차 거래에 대한 사실상 반대 견해를 내놓은 것이다. 이병래 사장은 ""기본으로 삼성전자와 거래소가 최종적으로 결정해 진행할 것""이라며 ""시장 혼란과 투자자 피해를 최소화하기 위해 기간을 단축하는 것에 대해 논의 중""이라고 했다. 주식 액면분할은 2~3주 정도의 거래정지 기간이 필요하다. 삼성전자도 오는 4월25일부터 5월15일까지 거래를 정지한다고 밝혔었다.최경렬 예탁결제원 투자지원본부장은 ""다음 달 23일에 열리는 삼성전자 주주총회 이전에는 결정될 것""이라며 ""3주보다는 단축되지 않겠나""고 말했다.또 이건희 삼성전자 회장의 차명계좌 관련 자료도 파악하고 있다고 했다. 이 사장은 ""금융감독원에서 실명제 실시(1993년) 전후로 삼성그룹 관계사의 증권계좌를 제출해달라는 요구를 받았고, 확인하고 있다""고 말했다.ms@▶ \'평창2018\' 관련 뉴스·포토 보기▶ 네이버메인에 ‘뉴스1채널’ 설정하기!▶ 여러분의 제보를 기다립니다.제보하기![© 뉴스1코리아(news1.kr), 무단 전재 및 재배포 금지]뉴스1 관련뉴스해당 언론사에서 선정하며 언론사 페이지(아웃링크)로 이동해 볼 수 있습니다.연희단거리패 내부자 ""이윤택 \'성폭행 부인\' 사전연습""""왕따 스캔들이 한국 대표팀 흔들고 있다""…외신도 주목6세 딸 목졸라 살해한 母…""TV 퇴마의식 모방""\'문재인과 함께라면 적화통일\'…낙서 범인은안방서 50대 백골화 시신 발견…고독사 추정좋아요0훈훈해요0슬퍼요0화나요0후속기사 원해요0기사제공 :']"
2,삼성전자, 2018-02-2114:04,파이낸셜뉴스 ,"[fn 오후시황]코스피, 개인-외국인 힘겨루기에 보합세",https://finance.naver.com/news/news_read.nhn?article_id=0003969030&office_id=014&mode=search&query=삼성전자&page=5,"['       [fn 오후시황]코스피, 개인-외국인 힘겨루기에 보합세      기사입력2018-02-21 14:04기사원문좋아요훈훈해요좋아요 평가하기공감좋아요0훈훈해요0슬퍼요0화나요0후속기사 원해요0댓글  코스피가 개인과 외국인의 힘겨루기에 보합세를 보이고 있다.  21일 오후 2시 기준 코스피 지수는 2422.32로 전장 대비 7.20포인트(0.30%) 오른채 거래되고 있다. 이날 코스피는 전장 대비 2.61포인트(0.11%) 오른 2417.73으로 출발했다.  외국인은 1411억원을 순매도했다. 하지만 개인과 기관이 각각 991억원, 575억원을 순매수하며 지수를 끌어올렸다.  시가총액 상위종목별로 SK하이닉스(1.32%), 셀트리온(0.82%), 현대차(3.91%)는 상승세를 보였다. 하지만 삼성전자(-0.80%), 포스코(-0.82%), KB금융(-1.65%) 등은 하락세를 보였다.  규모별로 대형주(0.22%), 중형주(0.50%), 소형주(0.57%) 등 모두 오름세를 보였다. 업종별로는 음식료품(1.48%) 등이 강세를 보였다.  코스닥 지수는 873.64로 전장 대비 9.23포인트(1.07%) 오른채 거래되고 있다.   ggg@fnnews.com 강구귀 기자   ▶ 세상의 모든 골 때리는 이야기 \'fn파스\'▶ 속보이는 연예뉴스 fn스타  ※ 저작권자 ⓒ  파이낸셜뉴스. 무단 전재-재배포 금지파이낸셜뉴스 관련뉴스해당 언론사에서 선정하며 언론사 페이지(아웃링크)로 이동해 볼 수 있습니다.된장찌개 먹방 사진으로 스타된 20대 러시아女영국에서 주목받는 평창 올림픽 미녀 선수 3인방경유차에 휘발유 넣은 주유소 직원..""차주도 30% 책임""운동으로 완벽한 \'S라인\' 만든 인스타그램 스타매일 초콜릿 먹는 여성의 성생활 만족도 조사해보니좋아요0훈훈해요0슬퍼요0화나요0후속기사 원해요0기사제공 :']"
3,삼성전자, 2018-02-2114:00,SBS Biz ,[5스타전략] 자연스러운 조정으로 인식,https://finance.naver.com/news/news_read.nhn?article_id=0000151934&office_id=374&mode=search&query=삼성전자&page=5,"['       [5스타전략] 자연스러운 조정으로 인식      기사입력2018-02-21 14:00기사원문좋아요훈훈해요좋아요 평가하기공감좋아요0훈훈해요0슬퍼요0화나요0후속기사 원해요0댓글프레지던트데이로 인해 연휴를 보낸 미증시는 월마트 등 필수소비재업종의 부진과 채권 금리 상승에 동반 하락했습니다. 다우지수는 254포인트 나스닥지수 5포인트 각각 하락하였고, 특히 다우지수는 7거래일 만에 하락하였습니다.금일 연방준비제도 통화정책 의사록 발표을 앞두고 있으며, 기존 정책 유지 및 이번년도 3차례 금리인상 유지될 것으로 보여집니다. 다우지수는 기술적으로 자연스러운 이격조정의 흐름이며 10일 이평선 중심으로 지지라인 형성 중 입니다.전일 우리증시는 기관들의 공격적인 매도 속에 코스피지수가 5일만에 하락 전환 2,410선대로 내려왔고, 삼성전자의 하락세가 이틀 연속 이어졌습니다.특히 외국인들은 1,400억원 매도에 나서면서 지수 하락을 주도 시가상위 종목들이 대부분 하락하고, 분석대로 지난주 상승세가 이어진 후 이번 주 들어 단기상승에 따른 조정을 보였습니다.특히 양시장 단기급락한 하락폭에 50%이내 반등이 연출된 후 조정이 진행되는 등 자연스러운 모습이였고, 금일은 베이시스 즉 백워데이션에 따른 프로그램매도 및 미증시 하락 여파 속에 동시가 약세 출발이 예상되나 코스피 지수 2,400이하에서는 대기매수세가 포진하고 있어 하락폭은 제한적 일 것으로 보여집니다.■ 주목해야 할 관심종목군디에이테크(196490) 서울옥션(063170) 에이프로젠kic(007460) 에너토크(019990)평화정공(010770) 현대아이비티(048410) 현대통신(039010) 바이로메드(084990) 등SBSCNBC 5STAR 이상원 파트너의 추천종목 및 투자전략은 5스타 홈페이지 모바일 주식상담을 통해 무료 상담 받을수 있으며, 증권사 MTS(하나금융투자, 키움증권, 유진투자증권, 대신증권, 신한금융투자, 한국투자증권)를 통해서도 신청 후 이용할 수 있다. 자세한 사항은 5스타 홈페이지 및 주거래 증권사에서 5스타 서비스를 확인하시고 고객센터로 문의하시기 바랍니다. CNBCbiz팀 기자(kimdh@sbs.co.kr) ☞ 의견 있는 경제채널 SBSCNBC [홈페이지] [뉴스스탠드]☞ 공식 SNS [페이스북] 저작권자 SBS플러스 & SBS I&M 무단전재-재배포 금지SBS Biz 관련뉴스해당 언론사에서 선정하며 언론사 페이지(아웃링크)로 이동해 볼 수 있습니다.재건축 안전기준 강화…서울시 10만여 가구 영향군산 \'고용위기지역\' 지정…한국GM 사태 내일 담판?\'근로시간 단축\' 입법 대안, 경영계 요구 반영 안 돼평창 폐막식에 맞춰 이방카 방한…\'정상급 예우\' 고려""올림픽 가장 실망스러운 장면""…외신도 女팀추월 질타좋아요0훈훈해요0슬퍼요0화나요0후속기사 원해요0기사제공 :']"
4,삼성전자, 2018-02-2114:00,한국경제TV ,[이 시각 코스피] 코스피 현재 2422.32p 상승세 지속,https://finance.naver.com/news/news_read.nhn?article_id=0000604577&office_id=215&mode=search&query=삼성전자&page=5,"['       [이 시각 코스피] 코스피 현재 2422.32p 상승세 지속      기사입력2018-02-21 14:00기사원문좋아요훈훈해요좋아요 평가하기공감좋아요0훈훈해요0슬퍼요0화나요0후속기사 원해요0댓글[한국경제TV 라이온봇 기자][코스피 장중 시황]2월 21일 14시 0분 코스피는 전일 대비 7.2p(0.3%) 상승한 2422.32p를 기록하고 있다.규모별로는 대형주(0.2%), 중형주(0.48%), 소형주(0.58%) 모두 강세를 나타내고 있다.[업종동향][그림 1] 업종별 상위 TOP5 (단위 : %)[그림 2] 업종별 하위 TOP5 (단위 : %)업종별로는 상승이 우세하다.운수장비(1.72%), 음식료품(1.52%), 서비스업(1.43%), 보험(1.17%), 의료정밀(0.91%), 화약(0.86%), 섬유의복(0.83%), 종이,목재(0.65%), 유통업(0.59%), 증권(0.58%), 운수창고(0.48%), 비금속광물(0.46%), 의약품(0.34%), 통신업(0.23%), 제조업(0.22%), 금융업(0.19%), 기계(0.06%) 등은 상승세를 나타냈다. 반면, 철강,금속(-0.48%), 전기,전자(-0.48%), 전기가스업(-0.71%), 건설업(-0.94%), 은행(-1.45%) 등은 하락세를 나타냈다. [시가총액 상위 종목 동향]시가총액 상위 10개 기업은 하락이 우세하다.""대장주"" 삼성전자는 전일(2,370,000원) 대비 20,000원(-0.84%) 내린 2,350,000원에 거래되고 있다.현대차(3.58%), NAVER(2.85%), SK하이닉스(1.46%), 셀트리온(0.66%) 등은 상승세를 나타냈다. 반면에, 삼성바이오로직스(-0.24%), 삼성물산(-0.38%), LG화학(-0.53%), POSCO(-0.82%), KB금융(-1.8%) 등은 약세를 보이고 있다. 라이온봇 기자 -한국경제TV※ 본 기사는 한국경제TV와 \'거장들의 투자공식이\'자체 개발한 \'라이온봇 기자\'가 실시간으로 작성한 기사입니다.라이온봇기자 ⓒ 한국경제TV, 무단 전재 및 재배포 금지한국경제TV 관련뉴스해당 언론사에서 선정하며 언론사 페이지(아웃링크)로 이동해 볼 수 있습니다.고속도로 교통상황 아직 원활, 인천공항 출국장은 \'북적\'홍진영 근황, 물오른 미모…""30대 몸매 비결은""박지헌만의 성교육 ""야동 보는 게 나쁜 거 아냐""김수희 누구?…서태지 제치고 가요대상 받은 전설윤정수 다이어트, \'홀쭉해진\' 비결은?좋아요0훈훈해요0슬퍼요0화나요0후속기사 원해요0기사제공 :']"
