,회사명,날짜,언론사,기사제목,링크,본문
9,삼성전자, 2018-10-2817:51,머니투데이 ,'반도체 고점론'에 고개 젓는 업계..메모리 반도체 수요↑,https://finance.naver.com/news/news_read.nhn?article_id=0004124265&office_id=008&mode=search&query=삼성전자&page=2,"['       \'반도체 고점론\'에 고개 젓는 업계..메모리 반도체 수요↑      기사입력2018-10-28 17:51기사원문좋아요훈훈해요좋아요 평가하기공감좋아요0훈훈해요0슬퍼요0화나요0후속기사 원해요0댓글 [머니투데이 박소연 기자] [""4~5년 주기 사이클로 업황 분석하는 패러다임 바꿔야"" 지적] 박성욱 한국반도체산업협회장(SK하이닉스 부회장)과 권오현 삼성전자 회장(왼쪽)이 25일 오후 서울 코엑스 인터컨티넨탈 호텔에서 열린 \'제11회 반도체의 날\' 기념식에서 대화하고 있다.  /사진=뉴스1반도체 업계가 미국 월가를 중심으로 제기되는 \'반도체 고점론\'에 적극 반박하고 나섰다. 메모리 반도체 시장을 중심으로 신규 수요가 지속적으로 증가하고 있다는 점을 근거로 들고 있다.반도체 업계는 일단 D램 가격의 상승세가 올 4분기나 내년 1분기에 다소 주춤하며 숨을 고를 수 있지만 내년 하반기에 다시 상승 반전할 것이라고 전망하고 있다.이와 관련해 장준덕 SK하이닉스 수석은 지난 24일 서울 코엑스에서 열린 반도체 시장 전망 세미나에서 ""반도체 시장 업황을 4~5년 주기 사이클로 분석하는 패러다임을 바꿔야 한다""고 말했다. ""과거 400억달러를 왔다갔다하는 변동성을 가진 시장으로 반도체 업계를 바라봐서는 안 된다""는 게 그의 설명이다. 장 수석은 ""전통적인 D램의 수요처인 PC에 이어 2007년 애플 \'아이폰\'을 중심으로 스마트폰이란 신규 애플리케이션이 등장했고, 2015년부터는 구글과 아마존 등을 통해 엄청난 데이터 수요가 발생하면서 D램 시장에선 스마트폰과 서버라는 새로운 드라이브가 걸렸다""고 설명했다.  그러면서 ""수요와 공급의 패러다임이 바뀌고 있다""며 ""지난해부터 급성장한 D램 시장 규모가 과거 수준으로 하락할 가능성은 낮다""고 분석했다. 아울러 ""반도체 고점론의 근거인 가격 하락이 오히려 수요 증가를 가져올 것""이라며 ""D램과 낸드 시장이 앞으로 우상향할 것""이라고 전망했다.이석희 SK하이닉스 사장도 다음날인 25일 코엑스에서 진행된 \'제20회 반도체대전(SEDEX)\' 키노트 스피치(기조연설)를 통해 ""올해 반도체의 성장을 견인한 것은 데이터의 폭발적인 성장과 데이터센터의 성장""이라고 강조했다.실제로 SK하이닉스는 \'반도체 고점론\'이 지속적으로 제기되고 있는 상황에서도 올해 3분기 역대 최대 실적을 거뒀다. 지난해 같은 기간 대비 매출액(11조4168억원)은 40.9%, 영업이익(6조4724억원)은 73.2% 증가했다. 역대 최고 기록이었던 전분기 실적 경신은 물론 창사 이후 처음으로 분기 매출 11조원과 영업이익 6조원을 기록했다. 오는 31일 부문별 확정실적을 발표하는 삼성전자도 3분기 반도체 영업이익이 13조원 중반대를 기록하며 호실적을 이어갈 것으로 추정하고 있다. SK하이닉스는 특히 반도체 업황과 관련해 ""D램 가격 급락 가능성은 절대 없다""고 자신했다. 인터넷 데이터센터 사업의 거시적인 상황과 전세계적인 클라우드 전환율 등을 감안할 때 중장기적 상승세에 의심의 여지가 없단 것이다. 미국 투자은행을 중심으로 제기되는 반도체 고점론의 주요 근거는 메모리 반도체의 공급 과잉과 수요 감소에 따른 가격 하락이다. 반면 반도체 업계는 서버시장의 수요가 탄탄하고 차량용 반도체 등 신규 사용차가 늘고 있어 급격한 가격 하락은 없을 것이라는 입장이다. 지난달 모간스탠리의 숀 킴 애널리스트는 메모리시장의 악화를 예고하며 ""당장 3분기부터 반도체 가격이 떨어질 것""이라고 예상했다. 하지만 미국 반도체산업협회(SIA)에 따르면 3분기의 전세계 반도체 판매는 전년 대비 13.8% 증가한 1227억달러로, 9월엔 역대 최고 월간 매출을 기록했다. 모간스탠리는 지난해 11월 ""메모리 반도체 경기가 곧 정점을 찍을 것""이란 보고서를 내놓아 삼성전자 주가가 하루 만에 5% 이상 곤두박질치기도 했다.▶바람 피우는 남편들의 징후?▶빨간날-요즘 10대들의 성(性) ▶\'AAA 티켓\', \'배라 아이스크림\' 받는 법 박소연 기자 soyunp@mt.co.kr<저작권자 ⓒ \'돈이 보이는 리얼타임 뉴스\' 머니투데이, 무단전재 및 재배포 금지> 머니투데이 관련뉴스해당 언론사에서 선정하며 언론사 페이지(아웃링크)로 이동해 볼 수 있습니다.\'5600억원\' 로또 당첨금, 어디다 투자하면 좋을까요창원 어린이집 원장, 극단적 선택…""감사 앞두고 심적 고통""[빨간날]""손님이 때려도 어쩔 수 없죠, 시급이 높잖아요""공짜 술 먹는데… 회식, 왜 싫냐고요? (영상)서울 우박…놀란 시민들 ""손톱만한 우박 쏟아져""좋아요0훈훈해요0슬퍼요0화나요0후속기사 원해요0기사제공 :']"
10,삼성전자, 2018-10-2817:37,매일경제 ,"삼성, 갤S10부터 5G 탑재…구글과 폴더블폰 OS 개발",https://finance.naver.com/news/news_read.nhn?article_id=0004242648&office_id=009&mode=search&query=삼성전자&page=2,"['       삼성, 갤S10부터 5G 탑재…구글과 폴더블폰 OS 개발      기사입력2018-10-28 17:37기사원문좋아요훈훈해요좋아요 평가하기공감좋아요0훈훈해요0슬퍼요0화나요0후속기사 원해요0댓글갤럭시S10 콘셉트 이미지. [사진 제공 = 유튜브 캡처] 삼성전자가 내년 상반기에 내놓을 갤럭시S10에 5G 통신을 지원할 것으로 예상돼 주목된다.외신에 따르면 삼성전자는 내년 5G 칩셋을 탑재한 갤럭시S10을 출시하기 위해 미국 통신사인 버라이즌과 협의하고 있는 것으로 알려졌다. 블룸버그는 26일(현지시간) ""삼성전자가 내년에 갤럭시S10과 폴더블폰을 출시할 것""이라고 전했다. 고동진 삼성전자 IM부문장도 최근 갤럭시노트9 출시 기자간담회에서 내년 3~4월을 목표로 5G폰을 개발 중이라며 ""한정된 지역에서 한정된 수량으로 하는 경우 대규모 물량의 플래그십 모델(갤럭시S10)이 아닌 다른 모델이 될 것""이라고 밝혀 갤럭시S10의 5G 지원 예측에 힘이 실리고 있다. 외신에 따르면 갤럭시S10은 세 가지 모델로 출시될 것으로 보인다. 이 매체는 ""갤럭시S10은 5G 통신을 지원할 것이며, 세 가지 버전으로 출시될 것""이라면서 ""화면에 지문인식센서가 내장될 것""이라고 예상했다. 이 중 한 모델은 사양을 약간 낮춘 \'보급형\' 모델이 될 전망이다. 갤럭시S10은 6.1인치, 플러스 모델은 6.4인치, 보급형 모델은 5.8인치 디스플레이를 탑재할 것으로 알려졌다. 또한 갤럭시S10은 후면 \'트리플 카메라\'와 전면 듀얼 카메라를 갖출 예정이며 전면 카메라가 화면 아래 내장되는 \'풀스크린\'을 구현할 가능성도 점쳐진다. 보급형 모델은 \'엣지\' 화면이 아니라 \'플랫\' 디자인으로, 내장 지문인식센서 없이 나올 가능성이 높다. 애플 아이폰처럼 이어폰 단자가 없어질 가능성도 거론된다. 한 IT트위터리안은 갤럭시S10이 블랙·그레이·블루·레드·그린·옐로 색상으로 나올 것이라고 관측했다.블룸버그는 ""삼성전자가 폴더블폰을 가로로 접을지, 세로로 접을지 고민하고 있다""며 ""삼성전자와 구글이 폴더블폰을 위한 안드로이드 운영체제를 개발 중""이라고 전했다. 매체는 ""휴대폰을 접으면 4인치 화면이 될 것""이라며 ""어느 휴대폰보다도 큰 화면이 들어가다 보니 시제품 무게는 200g이 넘는다""고 말했다. 201g인 갤럭시노트9보다도 더 무거워지는 셈이다.다음달 미국 샌프란시스코에서 열리는 \'삼성 개발자 콘퍼런스(SDC)\'에서 일부 사양과 유저 인터페이스 등이 공개될 것으로 예상되는 폴더블폰에 대한 루머도 속속 나오고 있다. 삼성전자는 최근 이 행사 티저 영상에서 반으로 접힌 직선이 펴지는 애니메이션을 선보였다. 폴더블폰을 암시한다는 해석이 나온다. 삼성전자 폴더블폰은 안으로 접은 인폴딩 방식을 적용한 것으로 알려졌다. 폈을 때 7인치, 접었을 때 4인치 정도의 크기가 될 것으로 보인다. 접힌 디스플레이 부분에는 소형 화면이 적용돼 알림, 메시지 등을 확인할 수 있다. 20만회 이상 접었다 펴는 내구성 테스트를 통과한 것으로 알려졌다. 삼성전자는 내년 초 이 제품을 공개할 예정이다. 고 사장은 앞서 ""폴더블폰 \'세계 최초\'를 뺏기고 싶지 않다""고 밝힌 바 있다. 화웨이는 내년 6월 5G를 지원하는 폴더블폰을 내놓겠다고 공언했다.   [이선희 기자]▶뉴스 이상의 무궁무진한 프리미엄 읽을거리▶제4회 전국직장대항 당구대회 접수중 (~10.28)[ⓒ 매일경제 & mk.co.kr, 무단전재 및 재배포 금지]매일경제 관련뉴스해당 언론사에서 선정하며 언론사 페이지(아웃링크)로 이동해 볼 수 있습니다.\'美친\' 나르샤, 해변서 뽐낸 \'역대급 S라인 육감 뒤태\'[추락하는 증시] ② 빚낸 개미 어쩌나…반대매매 \'쪽박\' 경고음낸시 \'섹시한 핫팬츠 각선미\'마치 갤러리에 간듯…미술관 같은 호텔로 \'감성 여행\'\'김민기♥\'와 결혼 앞둔 홍윤화, 30kg 감량…\'입이 쩍\'좋아요0훈훈해요0슬퍼요0화나요0후속기사 원해요0기사제공 :']"
11,삼성전자, 2018-10-2817:24,서울경제 ,"[이슈&워치] 위기의 韓제조업, 가전 성공서 배워라",https://finance.naver.com/news/news_read.nhn?article_id=0003428243&office_id=011&mode=search&query=삼성전자&page=2,"['       [이슈&워치] 위기의 韓제조업, 가전 성공서 배워라      기사입력2018-10-28 17:24기사원문좋아요훈훈해요좋아요 평가하기공감좋아요0훈훈해요0슬퍼요0화나요0후속기사 원해요0댓글북미서 팔린 TV 70%가 韓제품삼성·LG 냉장고, 유럽서 1·2위제조능력·마케팅 벤치마킹해야[서울경제] 올해 북미에서 팔린 2,500달러 이상 프리미엄 TV 중 삼성전자와 LG전자 제품은 10대 중 7대꼴(IHS마킷, 올 상반기 기준)이다. 최고급 사양인 양문형 냉장고도 유럽 시장에서 삼성과 LG가 나란히 1~2위(올 8월 누적 기준, 업계 추산)에 올랐다. 프리미엄 가전에서 한국의 승승장구는 이뿐이 아니다. 삼성은 영국·프랑스 등 유럽 14개국에서 냉장고 점유율 1위, LG는 미국 드럼세탁기(900달러 이상) 부문에서 정점에 있다. 이제는 전통의 가전 명가라는 GE·밀레·보쉬 등이 바짝 긴장할 정도다. 고가임에도 아이폰 광신도를 만든 애플처럼 우리 기업들이 뛰어난 품질로 글로벌 팬덤을 다져나가고 있다는 분석이 나온다. 8일 업계에 따르면 미국·캐나다 등 북미에서 판매된 프리미엄급 TV 가운데 삼성의 비중은 48.4%로 1위였다. LG(24.5%)까지 합치면 한국 제품 비중이 전체의 72.9%에 달했다. 2년 전보다 13.4%포인트나 오른 것. 삼성 냉장고는 유럽에서 14%의 점유율(올 8월 누적 기준)로 보쉬(8%), 립헬(7%)을 제친 것으로 업계는 추산했다. 세탁기도 11%의 점유율(2위)로 보쉬(12%) 턱밑까지 추격하고 있다. LG는 이달 미국 컨슈머리포트의 제품평가에서 드럼 및 통돌이세탁기·건조기  부문 등에서 1~5위를 싹쓸이했다. 특히 최근 가전이 융복합의 매개이자 데이터 플랫폼으로서 역량을 평가받으며 삼성과 LG의 존재감은 더 도드라지는 양상이다. 전자 업계의 한 임원은 “프리미엄 가전의 성공전략을 한국 제조업이 벤치마킹할 필요가 있다”며 “부품제조 능력, 소비자의 마음을 읽는 마케팅 등 질적인 차원에서 혁신을 지속해야 한다”고 말했다.  /이상훈·박효정기자 shlee@sedaily.com[서울경제 바로가기]프리미엄 미디어 Signal이 투자의 바른 길을 안내합니다 [바로가기▶]서울경제ㆍ서울시 주최 블록체인 이벤트 ‘ABF in Seoul’ [바로가기▶]저작권자 ⓒ 서울경제, 무단 전재 및 재배포 금지서울경제 관련뉴스해당 언론사에서 선정하며 언론사 페이지(아웃링크)로 이동해 볼 수 있습니다.일산의 굴욕...이젠 산본에도 집값 위협당해車실적 최악인데 외유성 연수...산업붕괴 자초하는 勞8타차 대역전극 쓰고···울어버린 \'필드 위 인형\'日 독주에 韓·獨 제동···하이브리드 뜨거운 경쟁""국민연금 손실에 노후 불안""...퇴직연금 폭풍 가입좋아요0훈훈해요0슬퍼요0화나요0후속기사 원해요0기사제공 :']"
12,삼성전자, 2018-10-2817:21,이데일리 ,"""해외 나가니 찰칵소리 없어지네""..삼성폰의 흥미로운 기능",https://finance.naver.com/news/news_read.nhn?article_id=0004237137&office_id=018&mode=search&query=삼성전자&page=2,"['       ""해외 나가니 찰칵소리 없어지네""..삼성폰의 흥미로운 기능      기사입력2018-10-28 17:21기사원문좋아요훈훈해요좋아요 평가하기공감좋아요0훈훈해요0슬퍼요0화나요0후속기사 원해요0댓글오레오 업데이트와 함께 진행..네트워크망 인지·적용[이데일리 김혜미 기자] A(46)씨는 얼마 전 미국 출장을 갔다가 신기한 경험을 했다. 삼성전자의 갤럭시S8으로 사진을 촬영하는데 카메라 셔터음이 울리지 않았던 것. 혹시나 하고 이곳 저곳에서 계속 사진을 촬영해보았으나 역시나였다. A씨는 “해외에서 사진을 촬영하면 셔터음 때문에 시선을 끌어 민망했는데, 그러지 않아도 돼서 편리했다”고 말했다.삼성전자(005930) 스마트폰의 카메라 셔터음이 해외에 나갔을 때 자동으로 무음처리된다는 사실이 실사용자들에게 호평을 받고 있다. 28일 삼성전자에 따르면 갤럭시S7·S7엣지, 갤럭시S8·S8+(플러스), 갤럭시 노트8, 갤럭시A7·A8(2016·2018년형), 갤럭시J3·J5(2017년형) 등은 올해 안드로이드 오레오OS와 함께 해당 기능이 업데이트돼 해외에 나갔을 때 카메라 셔터음을 자동으로 무음 처리하거나 음량을 조절할 수 있다.해당 기능은 올 상반기부터 적용됐지만, 삼성전자가 적극 홍보한 것은 아니어서 일부 이용자들에게만 알려져있었다. 클리앙 등 일부 커뮤니티에서는 실사용자들이 직접 경험을 공유하기도 했다.자동 셔터음 무음처리는 해당 스마트폰이 셔터음이 법적으로 규정돼 있지 않은 해외 이동통신사 서비스망을 인지하는 방식으로 이뤄진다. 예를 들어 SK텔레콤(017670)이나 KT(030200)를 사용하던 국내 여행객이 미국이나 프랑스에 가서 현지 이동통신사 네트워크에 접속하면 이를 인식하고 자동으로 셔터음을 조절해준다.삼성전자는 추후 갤럭시 와이드2와 갤럭시탭A 위드 S펜, 갤럭시J7(2017년형), 갤럭시온7(2017년형) 등의 모델로 오레오 업데이트를 확대, 적용할 계획이다.카메라 셔터음은 지난 2004년부터 ‘몰카 범죄’를 막기 위한 권고사항으로 제시, 적용된 기능이다. 당시 몰카가 사회적 문제로 대두되면서 한국정보통신기술협회(TTA)가 안(案)을 제시했는데, 이동통신사들이 제조사에 이를 요구하면서 지금까지 이어지고 있다. 의도는 좋지만 한국과 일본에만 적용되므로 그밖의 국가에서는 공공장소에서 매너가 부족한 사람처럼 보이기 일쑤여서 사용자들이 불만을 호소해왔다. 카메라 셔터음이 상당히 큰 경우가 많아 일부러 해외에서 스마트폰을 구매하는 이용자들도 종종 눈에 띈다.삼성전자 관계자는 “오레오 업데이트와 함께 사용자들의 편의를 확대하는 여러가지 기능이 도입됐다”며 “상당히 긴 이미지도 한 장으로 캡처할 수 있게 하는 ‘스크롤 캡처’와 동영상을 볼 때면 홈 화면을 가로로 볼 수 있는 ‘홈화면 가로모드’ 등도 사용자들에게 잘 알려져있지 않은 기능”이라고 설명했다.안드로이드 오레오 OS 업데이트를 실시했거나 실시예정인 삼성전자 스마트폰. 삼성멤버스 캡처김혜미 (pinnster@edaily.co.kr)‘이데일리’ 채널 구독하고~ \'갤럭시 워치\' [받아가세요▶]빡침해소! 청춘뉘우스~ [스냅타임▶]스냅타임 좋아요 하고 스벅 커피 [마시러 가기▶]＜ⓒ종합 경제정보 미디어 이데일리 - 무단전재 & 재배포 금지＞이데일리 관련뉴스해당 언론사에서 선정하며 언론사 페이지(아웃링크)로 이동해 볼 수 있습니다.주가·집값 하락→ 소비침체 악순환 … \'잃어버린 20년\' 오나[줌인]민주당의 \'천덕꾸러기\' 박용진은 어떻게 국감 스타가 됐나공지영 ""이재명, 거짓말 더미에 압사당할 것…이 지사 극렬지지 신문 친구 삭제""김부선, 이재명 \'거짓말\' 주장… 점 빼느라 수고하셨다이언주 ""나라꼴이 7080 독재시대로…그땐 경제라도 좋았는데""좋아요0훈훈해요0슬퍼요0화나요0후속기사 원해요0기사제공 :']"
13,삼성전자, 2018-10-2817:20,한국경제 ,"임박한 5대 그룹 경영진 인사…""세대교체냐 조직안정이냐""",https://finance.naver.com/news/news_read.nhn?article_id=0004034340&office_id=015&mode=search&query=삼성전자&page=2,"['       임박한 5대 그룹 경영진 인사…""세대교체냐 조직안정이냐""      기사입력2018-10-28 17:20기사원문좋아요훈훈해요좋아요 평가하기공감좋아요0훈훈해요0슬퍼요0화나요0후속기사 원해요0댓글삼성 - 큰 폭 물갈이 인사 가능성 낮아현대차 - 고강도 쇄신 인사 이어질 전망SK - 인사보다 조직개편에 힘 실릴 듯 LG - 40세 총수 \'새 판 짜기\' 나설지 주목롯데 - 임기 만료된 CEO 연임 여부 관심[ 오상헌/장창민/박상익/류시훈 기자  ] 구광모 LG그룹 회장은 29일 박진수 LG화학 부회장을 시작으로 다음달 20일까지 계열사 최고경영자(CEO)를 순차적으로 만난다. 올해 사업 실적을 점검하고 내년 계획을 조율하기 위해서다. 구 회장은 사업보고회에서 각 계열사가 제출한 성적표를 토대로 다음달 말 CEO 교체 여부를 결정한다. 5대 그룹이 연말 임원인사를 앞두고 일제히 업적 평가 작업에 들어갔다. 전망은 그룹에 따라 엇갈린다. 삼성과 SK는 주요 계열사 CEO를 교체한 지 얼마 안 된 만큼 현 경영진에게 다시 한번 기회를 줄 가능성이 큰 것으로 알려졌다. 반면 40대 총수로 사령탑이 바뀐 LG와 정의선 총괄수석 부회장이 사실상 처음 인사를 주도하게 된 현대자동차는 큰 폭의 ‘세대교체 인사’를 할 것으로 재계는 예상하고 있다.● 삼성삼성이 큰 폭의 물갈이 인사를 할 가능성은 높지 않다는 게 재계의 일반적인 관측이다. 지난해 60세 이상 ‘고참 경영진’을 후선으로 보내는 세대교체를 단행했기 때문이다. 그룹의 ‘맏형’인 삼성전자는 통상 3대 사업 부문 수장들에게 역량을 충분히 발휘할 수 있도록 가능한 한 3~4년 이상 기회를 준다. 권오현 회장, 윤부근 부회장, 신종균 부회장 등이 ‘장기 집권’할 수 있었던 배경이다.그런 만큼 지난해 선임된 김기남(반도체·부품), 김현석(소비자가전), 고동진(IT·모바일) 등 ‘50대 트로이카 사장 체제’는 당분간 유지될 것으로 재계는 관측하고 있다. 삼성카드를 제외한 금융계열사들도 올초 50대로 교체된 만큼 큰 폭의 변화는 없을 것이란 예상이 지배적이다. 삼성중공업 제일기획 삼성경제연구소도 지난해 CEO를 교체했다.● 현대자동차고강도 쇄신 인사를 단행할 것이란 게 현대차그룹 안팎의 대체적 전망이다. 지난달 승진한 정 부회장이 실질적 인사권을 쥐게 된 만큼 일부 경영진에 대한 인사에 나설 가능성이 높다는 분석이다. 올 들어 현대·기아차 실적이 추락한 것도 ‘인사 태풍’ 가능성에 힘을 실어주고 있다.재계는 올해 말 또는 내년 초 현대차의 부회장 및 사장단 인사가 이뤄질 것으로 내다보고 있다. 정 부회장을 제외한 6명의 부회장과 20여 명의 사장 가운데 일부에 대한 인사 가능성이 거론되고 있다.현대차그룹 부회장단은 정태영(현대카드), 김용환(그룹 기획조정), 윤여철(노무·국내생산), 양웅철(연구개발총괄), 권문식(연구개발본부장), 우유철(현대제철) 부회장 등으로 구성돼 있다. 부사장급 이하 임원인사는 12월 말 이뤄질 예정이다.● SKSK의 ‘물갈이 인사’ 가능성은 극히 낮을 것으로 재계는 내다보고 있다. 주요 계열사 CEO를 대거 교체한 지 2년밖에 안 됐기 때문이다. 최태원 회장은 당시 장동현 SK(주) 사장, 박정호 SK텔레콤 사장, 김준 SK이노베이션 사장 등을 핵심 계열사에 배치한 데 이어 작년에는 그룹의 최고 협의기구인 수펙스추구협의회도 개편했다.“올해 말 SK그룹의 관전 포인트는 인사가 아니라 조직개편”이란 얘기가 나오는 이유다. 최 회장은 지난 6월 확대경영회의에서 “계열사별로 경영 목표를 재설정하고 조직·제도도 다시 설계하라”고 지시했다. 지난 17일부터 2박3일간 열린 CEO세미나에서도 조직 개편 문제가 테이블에 올랐던 것으로 알려졌다.● LG올해 임원인사에서 가장 큰 스포트라이트를 받는 곳이 LG다. 23년 만에 총수가 바뀐 데다 구본준 LG그룹 부회장 일가의 계열분리 가능성도 열려 있다.포인트는 구 회장을 보좌하는 6명의 부회장 가운데 몇 명이 교체되느냐다. LG그룹 부회장단은 권영수((주)LG), 박진수(LG화학), 차석용(LG생활건강), 조성진(LG전자), 한상범(LG디스플레이), 하현회(LG유플러스) 부회장 등으로 꾸려져 있다. 일각에선 이들 가운데 절반가량이 교체될 것으로 전망하고 있다. 구 부회장 일가가 계열분리하면 인사 규모는 한층 더 커질 수 있다. 구 회장이 변화보다는 안정을 선택할 가능성도 있다. 구 회장이 ‘자기 목소리’를 내려면 조금 더 시간이 필요하다고 판단할 경우 현 CEO에게 한 번 더 경영을 맡길 수 있다는 얘기다.● 롯데올해 임원인사는 지난해보다 한 달 정도 이른 12월 초에 실시될 전망이다. 최순실 국정농단 사태 여파로 8개월간 수감생활을 한 신동빈 회장이 이달 초 복귀한 만큼 인사를 통해 ‘분위기 쇄신’에 나설 것이란 얘기가 나오고 있다. 최대 관심사는 임기가 만료된 주요 계열사 CEO들의 연임 및 승진 여부다. 롯데 계열사 대표 임기는 2년이다. 강희태 롯데쇼핑 대표, 김정환 호텔롯데 대표, 이동우 롯데하이마트 대표 등의 임기가 내년 3월 만료된다. 신 회장이 4대 사업부문장(이원준 유통·허수영 화학·송용덕 호텔·이재혁 식품) 가운데 일부를 교체하면 연쇄효과로 인해 임원 인사 폭은 더 커질 수 있다.오상헌/장창민/박상익/류시훈 기자 ohyeah@hankyung.com[한경닷컴 바로가기] [모바일한경 구독신청] 한국경제 채널 구독하고, 선물 받자!! <이벤트 자세히 보기> ⓒ 한국경제 & hankyung.com, 무단전재 및 재배포 금지한국경제 관련뉴스해당 언론사에서 선정하며 언론사 페이지(아웃링크)로 이동해 볼 수 있습니다.""文정부, 경제 망가뜨려"" 황교안 드디어 입 열어20년 다닌 건설회사 그만두고 귀농 1년 만에 \'대박\'""월 수익 1억4000만원"" 신세경도 뛰어든 사업이153만원 쓰고 팬사인회 갔다가 실망감에 결국…택시 기사 1인당 월수입 얼마인지 봤더니…좋아요0훈훈해요0슬퍼요0화나요0후속기사 원해요0기사제공 :']"
