,회사명,날짜,언론사,기사제목,링크,본문
9,삼성전자, 2018-11-2315:38,조선일보 ,"삼성전자, '반도체 백혈병' 사태 공식 사과",https://finance.naver.com/news/news_read.nhn?article_id=0003411986&office_id=023&mode=search&query=삼성전자&page=4,"['       삼성전자, \'반도체 백혈병\' 사태 공식 사과      기사입력2018-11-23 15:38기사원문좋아요훈훈해요좋아요 평가하기공감좋아요0훈훈해요0슬퍼요0화나요0후속기사 원해요0댓글 삼성전자가 \'반도체 백혈병\' 문제에 대해 사과문을 발표하고 피해자 보상안 합의 이행을 약속했다. 이로써 삼성전자 반도체 사업장의 직업병 보상 문제가 11년 만에 종지부를 찍었다.삼성전자와 반올림(반도체 노동자의 건강과 인권지킴이)은 23일 서울 한국프레스센터에서 열린 \'삼성전자·반올림 중재판정 합의이행 협약식\'에서 조정위원회가 제시한 중재판정에 모두 합의하고, 합의이행 협약을 체결했다. 이어 김기남 삼성전자 대표이사(사장)가 반올림에 공식 사과했다.김 사장은 ""소중한 동료와 그 가족들이 오랫동안 고통 받으셨는데 삼성전자는 이를 일찍부터 성심껏 보살펴드리지 못했다""며 ""병으로 고통 받은 근로자와 그 가족분들께 진심으로 사과드린다""고 말했다.이번 삼성전자의 공식사과는 이달 1일 삼성전자 반도체 등 사업장에서 발생한 백혈병 등 질환 발병과 관련한 문제 해결을 위한 조정위원회(이하 조정위)가 내놓은 중재안에 포함된 사항이다. 앞서 지난 7월 삼성전자와 반올림은 중재안을 무조건 수용하기로 합의한 바 있다. 이날 삼성전자는 조정위의 중재안을 조건없이 수용하고 이행하겠다는 뜻도 재확인했다.이날 삼성전자가 발표한 세부 이행계획에 따르면 보상업무는 반올림과의 합의에 따라 제3의 독립기관인 ‘법무법인 지평’이 맡는다. 지원보상위원회 위원장은 김지형 지평 대표 변호사가 맡는다.삼성전자는 30일까지 회사 홈페이지에 사과의 주요내용과 지원보상 안내문을 게재하고, 중재 판정에 명시된 산업안전보건 발전기금 500억원을 한국산업안전보건공단에 기탁하기로 했다.황상기 반올림 피해자 대표는 ""이번 보상안이 대상을 대폭 넓혀 반올림 피해자들뿐 아니라 다른 피해자들도 포함돼 다행이다""면서 ""사외협력업체 등 이번 보상범위에 들지 못한 피해자들에 대해서도 앞으로 보상방안을 마련해줄 것을 부탁한다""고 말했다.이날 협약식에는 정부 관계자와 국회의원 등도 참석했다. 정부에서는 이재갑 고용노동부 장관, 박두용 안전보건공단 이사장 등이 참석했고, 국회에서는 더불어민주당 전 원내대표인 우원식 의원과 환경노동위원회 여당 간사를 맡고 있는 한정애 의원, 정의당 전 원내대표 심상정 의원, 현 원내대표인 이정미 의원 등이 참석했다.심상정 의원은 ""산업재해예방에 정치권의 책임이 큰 만큼 국회에서 노동안전 강화를 위해 제도개선에 최선을 다하겠다""고 말했다.[심민관 기자 bluegragon@chosunbiz.com] [조선닷컴 바로가기][조선일보 구독신청하기] - Copyrights ⓒ 조선일보 & chosun.com, 무단 전재 및 재배포 금지 -조선일보 관련뉴스해당 언론사에서 선정하며 언론사 페이지(아웃링크)로 이동해 볼 수 있습니다.[팩트체크] ""車, 물 들어올 때 노젓자""는 대통령 말 맞나법관회의 참여한 부장판사 ""법관회의를 탄핵하라""\'이재명 지키기\' 나선 이해찬… ""재판 보고 얘기하자""미얀마 감독, 박항서 맹비난 ""부끄럽고 프로답지 못한""경찰 ""마이크로닷母, 韓입국해 조사? 연락온 바 없다""좋아요0훈훈해요0슬퍼요0화나요0후속기사 원해요0기사제공 :']"
10,삼성전자, 2018-11-2315:35,서울경제 ,"[마감 시황] 기관의 '팔자' 기조.. 코스피 2057.48(▼12.47, -0....",https://finance.naver.com/news/news_read.nhn?article_id=0003450330&office_id=011&mode=search&query=삼성전자&page=4,"['       [마감 시황]  기관의 \'팔자\' 기조.. 코스피 2057.48(▼12.47, -0.60%) 하락 마감      기사입력2018-11-23 15:35기사원문좋아요훈훈해요좋아요 평가하기공감좋아요0훈훈해요0슬퍼요0화나요0후속기사 원해요0댓글 [서울경제] 오전 상승 출발했던 코스피가 상승세를 이어가지 못하고, 전 거래일(2069.95)보다 12.47p(-0.60%) 내린 2057.48로 하락 마감했다.투자자별 동향을 살펴보면 개인은 983억, 외국인은 319억을 각각 순매수 했으나, 기관은 1,383억을 순매도하며 하락장을 주도했다.업종별로는 화학업(-1.81%), 의료정밀업(-1.77%), 철강금속업(-1.64%) 등 대부분의 업종이 하락 마감했고, 유통업(+0.64%), 건설업(+0.36%), 서비스업(+0.17%) 일부 업종만이 강세를 보였다.종목별로는 삼성전자가 0.12% 내린 4만 2400원에 장을 마감한 가운데, 아시아나IDT(267850)(-12.94%), 일성신약(003120)(-12.24%), 일진머티리얼즈(020150)(-10.39%) 도 내림세를 보였다. 반면 현대비앤지스틸우(004565)(+21.95%), 부산산업(011390)(+17.13%), 남선알미우(008355)(+10.90%) 등은 상승 마감했다.금일 하락종목은 595개, 상승종목은 233개를 기록했다.[이 기사는 증시분석 전문기자 서경뉴스봇(newsbot@sedaily.com)이 실시간으로 작성했습니다.]/서경뉴스봇 newsbot@sedaily.com[서울경제 바로가기]서울경제 네이버 채널 구독하면 풍성한 선물이 펑펑! [바로가기▶]프리미엄 미디어 Signal이 투자의 바른 길을 안내합니다 [바로가기▶]저작권자 ⓒ 서울경제, 무단 전재 및 재배포 금지서울경제 관련뉴스해당 언론사에서 선정하며 언론사 페이지(아웃링크)로 이동해 볼 수 있습니다.6주만에 올랐다···文대통령 지지도 반등한 진짜 이유최강 명품무기라더니···창고에 쌓였던 \'K2 전차\' 드디어""SUV 모두 꿇어"" 전격 출격 \'람보르기니 우르스\' 가격이""\'혜경궁 김씨\' 논란은···"" 말 아끼던 이해찬 꺼낸 \'첫마디\'이번엔 靑비서관 만취운전···보고받은 文대통령 곧바로좋아요0훈훈해요0슬퍼요0화나요0후속기사 원해요0기사제공 :']"
11,삼성전자, 2018-11-2315:35,한국경제TV ,[마감 시황] 코스피 전일 대비 12.47p 하락한 2057.48p에 마감,https://finance.naver.com/news/news_read.nhn?article_id=0000707567&office_id=215&mode=search&query=삼성전자&page=4,"['       [마감 시황] 코스피 전일 대비 12.47p 하락한 2057.48p에 마감      기사입력2018-11-23 15:35기사원문좋아요훈훈해요좋아요 평가하기공감좋아요0훈훈해요0슬퍼요0화나요0후속기사 원해요0댓글[한국경제TV 라이온봇 기자][코스피 마감 시황]11월 23일 코스피는 전일 대비 12.47p(-0.6%) 하락한 2057.48p에 거래를 마감했다.[그림 1] 현재 시각 코스피, 상승 및 하락 종목 수현재 코스피는 전체 상장 종목 중 233개 종목이 상승세를 보였으며, 595개 종목은 하락했다. 67개 종목은 보합세를 나타냈다.규모별로는 대형주(-0.56%), 중형주(-0.83%), 소형주(-0.84%) 모두 약세를 나타냈다.금일 유가증권시장 투자자별 매매동향을 살펴보면 외인과 개인동반 매수세가 이어졌다. 각각 319억원, 983억원 순매수를 기록했다. 반면, 기관은 -1383억원 순매도했다.[업종동향][그림 2] 업종별 상위 TOP5 (단위 : %)[그림 3] 업종별 하위 TOP5 (단위 : %)업종별로는 하락이 우세했다.유통업(0.64%), 건설업(0.36%), 은행(0.17%), 서비스업(0.17%) 등은 상승세를 나타냈다.  반면, 운수장비(-0.01%), 운수창고(-0.05%), 기계(-0.16%), 음식료품(-0.21%), 전기,전자(-0.35%), 비금속광물(-0.59%), 제조업(-0.67%), 통신업(-0.79%), 의약품(-0.84%), 금융업(-1.05%), 종이,목재(-1.15%), 섬유의복(-1.29%), 증권(-1.31%), 전기가스업(-1.39%), 철강,금속(-1.64%), 의료정밀(-1.77%), 화학(-1.81%), 보험(-1.85%) 등은 하락세를 나타냈다. [시가총액 상위 종목 동향]시가총액 상위 10개 기업은 대부분 기업이 하락세를 기록했다.""대장주"" 삼성전자는 전일(42,450원) 대비 50원(-0.12%) 내린 42,400원에 마감했다.현대차(0.97%) 등은 상승세를 나타냈다. SK하이닉스 종목은 보합세를 보였다.  반면에, KB금융(-0.11%), 신한지주(-0.35%), SK(-0.55%), SK텔레콤(-0.87%), 셀트리온(-0.9%), POSCO(-2.76%), LG화학(-2.81%) 등은 약세를 보였다. 라이온봇 기자 -한국경제TV※ 본 기사는 한국경제TV와 \'거장들의 투자공식이\'자체 개발한 \'라이온봇 기자\'가 실시간으로 작성한 기사입니다.라이온봇기자 ▶ No1. 경제/증권방송 보며 채팅하기 [유튜브][페이스북]▶ 대한민국 재테크 총집결 [한국경제TV 사이트 바로가기]ⓒ 한국경제TV, 무단 전재 및 재배포 금지한국경제TV 관련뉴스해당 언론사에서 선정하며 언론사 페이지(아웃링크)로 이동해 볼 수 있습니다.문 대통령 지지도 취임 후 최저…""이영자 때문""한·중 냉장고 전쟁...""키우겠다""vs""없애겠다""주력산업까지 공매도...\'삼성전자·현대차\' 타깃[한입경제] 삼성은 접는데 애플은 안 접나요?이재명의 위기...""역린을 건드린 대가""좋아요0훈훈해요0슬퍼요0화나요0후속기사 원해요0기사제공 :']"
12,삼성전자, 2018-11-2315:32,연합뉴스 ,"[그래픽] 삼성ㆍ반올림, '반도체 백혈병 분쟁' 종지부",https://finance.naver.com/news/news_read.nhn?article_id=0010486459&office_id=001&mode=search&query=삼성전자&page=4,"[""       [그래픽] 삼성ㆍ반올림, '반도체 백혈병 분쟁' 종지부      기사입력2018-11-23 15:32기사원문좋아요훈훈해요좋아요 평가하기공감좋아요0훈훈해요0슬퍼요0화나요0후속기사 원해요0댓글(서울=연합뉴스) 김토일 기자 = 삼성전자[005930]는 23일 이른바 '반도체 백혈병' 분쟁과 관련, 조속한 해결을 위한 노력과 작업장 관리 등이 충분하지 못했다고 공식 사과했다.    kmtoil@yna.co.kr    페이스북 tuney.kr/LeYN1 트위터 @yonhap_graphics▶놓치면 아쉬운 '핫뉴스'  ▶뉴스가 보여요 - 연합뉴스 유튜브 ▶네이버 홈에서 [연합뉴스] 채널 구독하기연합뉴스 관련뉴스해당 언론사에서 선정하며 언론사 페이지(아웃링크)로 이동해 볼 수 있습니다.\xa0의전비서관 청와대 부근서 음주운전 적발 …면허취소 수준\xa0국회서 알몸으로 활보…무슨 사연?\xa0원룸 열어보니…군인 등 3명 숨진 채 발견\xa050㎝아귀 배 가르니…플라스틱 생수병이 통째로\xa0장난전화 했다가 징역 10년…20살 청년의 '통화 내역'은?좋아요0훈훈해요0슬퍼요0화나요0후속기사 원해요0기사제공 :""]"
13,삼성전자, 2018-11-2315:17,MBN ,"한솔테크닉스 대표에 박현순…한솔그룹, 임원인사 단행",https://finance.naver.com/news/news_read.nhn?article_id=0001303677&office_id=057&mode=search&query=삼성전자&page=4,"['       한솔테크닉스 대표에 박현순…한솔그룹, 임원인사 단행      기사입력2018-11-23 15:17기사원문좋아요훈훈해요좋아요 평가하기공감좋아요0훈훈해요0슬퍼요0화나요0후속기사 원해요0댓글 한솔그룹이 2019년 정기 임원인사에서 박현순 한솔테크닉스 베트남법인장, 황규호 한솔로지스틱스 글로벌사업본부장, 고광선 한솔인티큐브 솔루션사업본부장을 각각 대표이사로 승진 임명했습니다.  기존 한솔인티큐브 박상준 대표이사는 한솔시큐어 대표이사로 이동했고, 강병윤 한솔페이퍼텍 대표이사를 상무에서 부사장으로 승진시켰습니다.  박현순 한솔테크닉스 신임 대표는 1961년생으로 경북대 전자공학과를 졸업하고, 현 삼성SDI의 전신인 삼성전관과 삼성전자 글로벌제조혁신그룹장을 거쳐 2013년 한솔테크닉스에 입사, 신사업팀장과 베트남법인장 등을 역임했습니다.  황규호 한솔로지스틱스 대표는 1964년생으로 서울대 무역학과를 졸업하고 SK 재무관리실을 거쳐 한솔로 옮긴 후, 한솔이엠이 경영지원본부장·한솔로지스틱스 지원혁신본부장과 글로벌사업본부장 등을 역임했습니다.  또 한솔그룹은 기존 한솔인티큐브 박상준 대표이사는 한솔시큐어 대표이사로 이동했고, 강병윤 한솔페이퍼텍 대표이사를 상무에서 부사장으로 승진시켰습니다.  아울러 한솔그룹은 신규 임원 9명을 새롭게 승진 임명했습니다.  새로 임명된 임원은 ▲ 오홍석 한솔제지 신탄진공장장 ▲ 오준균 한솔제지 대전공장장 ▲ 박형석 한솔제지 패키징소재고객담당 ▲ 김대영 한솔페이퍼텍 영업담당 ▲ 오승욱 한솔테크닉스 인사담당 ▲ 조남철 한솔PNS IT 부문 대표 ▲ 박정우 한솔케미칼 박막재료사업본부장 ▲ 곽상효 한솔홀딩스 HMES팀장 ▲ 전훈 한솔홀딩스 재무RM팀장 등입니다.  [ 이상범 기자 / boomsang@daum.net ]< Copyright ⓒ MBN(www.mbn.co.kr) 무단전재 및 재배포 금지 >MBN 관련뉴스해당 언론사에서 선정하며 언론사 페이지(아웃링크)로 이동해 볼 수 있습니다.[영상] \'혜경궁 김씨=김혜경\' 정황 또 드러나…이번엔곤약젤리의 새빨간 거짓말…""다이어트에 좋다더니""몸값 오르는 연탄값…얼마나 오르나 살펴보니신아영, 품절녀 대열 합류…하버드서 만난 운명의 상대유주 탈퇴설에 잠적설까지…여자친구 측 ""사실무근, 문제無""좋아요0훈훈해요0슬퍼요0화나요0후속기사 원해요0기사제공 :']"
14,삼성전자, 2018-11-2315:08,뉴시스 ,"美 블프 오늘 시작…국내 유통가, 패션·전자 할인' 활발'",https://finance.naver.com/news/news_read.nhn?article_id=0008927380&office_id=003&mode=search&query=삼성전자&page=4,"['       美 블프 오늘 시작…국내 유통가, 패션·전자 할인\' 활발\'      기사입력2018-11-23 15:08기사원문좋아요훈훈해요좋아요 평가하기공감좋아요0훈훈해요0슬퍼요0화나요0후속기사 원해요0댓글이날부터 미국 블랙프라이데이 시작해외직구 많은 패션·전자 부문에서 각종 할인【서울=뉴시스】 \'블랙프라이데이\'를 하루 앞둔 22일(현지시각) 브라질 상파울루에 위치한 대형 매장 \'엑스트라(extra)\'에 삼성전자 TV를 구입하기 위해 수많은 소비자들이 몰리고 있다. 2018.11.23. (사진=삼성전자 제공) photo@newsis.com 【서울=뉴시스】표주연 기자 = 미국 쇼핑 축제인 블랙프라이데이(블프)가 시작됐다. 국내 유통가에서도 이날을 맞아 해외직구를 찾는 소비자들을 상대로 각종 할인 행사를 벌인다. 특히 블프 시즌에 소비자들이 많이 찾는 전자, 패션 부문의 움직임이 활발하다. 23일 유통업계에 따르면 패션, 전자 부문 유통업계는 블프에 해외직구를 노리는 소비자들을 겨냥해 각종 할인 이벤트를 기획하고 있다. 휠라(FILA)는 25일까지 디스럽터2, 휠라레이 등 브랜드 인기 제품을 반값에 판매하는 \'휠라 블랙 프라이데이\'를 실시한다. 이 기간 동안 휠라는 \'디스럽터2\'를 비롯해 휠라 대표 어글리 슈즈인 \'휠라레이(블랙 스웨이드)\' 등을 3만9000원(정가 6만9000원)에 판매한다. 슈즈 브랜드 알도(ALDO)는 오는 24일까지 ‘블랙 프라이데이’ 할인 이벤트를 진행한다. 알도 오프라인 전 매장과 공식 홈페이지를 통해 진행되는 이번 이벤트는 FW시즌을 위한 첼시 부츠, 하이힐, 스니커즈 등 다양한 슈즈를 포함해 백, 액세서리까지 전 패션잡화를 40% 할인된 가격으로 판매한다.    코오롱인더스트리FnC 부문(코오롱FnC)의 온라인몰 ‘코오롱몰도 26일까지 다운 재킷, 코트 등을 최대 75%까지 할인 판매한다. 이번 행사에서는 코오롱FnC는 1000여개의 의류 및 잡화 아이템을 최대 75% 할인한다.  하이마트쇼핑몰은 ’하이마트쇼핑몰 블랙프라이데이’ 행사를  26~30일 진행한다. 다이슨 무선청소기, 발뮤다 토스터 등 해외직구 인기 상품과 더불어 삼성전자와 LG전자의 TV, 냉장고, 공기청정기 등 300가지 제품을 모아 최대 15% 할인판매한다. 또 삼성전자 일반 냉장고(615L)를 70만원대에, 발뮤다 전기주전자를 10만원대에 한정수량 판매한다. 이외에도 11번가는 국내 소비자들이 주로 직구로 많이 구매하는 상품 코너를 따로 마련했다. 30일까지 ‘해외직구 블랙프라이데이’를 열고 직구 인기상품을 최대 40% 할인해 판매한다. 특히 23~30일 ‘노비스’ 등 인기브랜드 겨울 아우터’와 독일 직구 인기품목인 ‘압타밀 분유’, ‘LG 55인치/65인치 TV’, ‘GNC 영양제’, ‘랄프로렌 패딩’, ‘나이키 패딩’ 등을 특가로 판매한다.pyo000@newsis.com▶ 뉴시스 빅데이터 MSI 주가시세표 바로가기 ▶ 뉴시스 SNS [페이스북] [트위터]<저작권자ⓒ 공감언론 뉴시스통신사. 무단전재-재배포 금지.>뉴시스 관련뉴스해당 언론사에서 선정하며 언론사 페이지(아웃링크)로 이동해 볼 수 있습니다.""눈 감을 때마다 떠올려라""…딸과 두 손녀 살해한 사위 사형 반대""콩팥 팔아라""…5년 간 친구 돈 8300만원 빼앗은 20대\'인천 중학생 추락사\' 자살로 말 맞춰 범행 은폐 시도한 가해자들\'前대통령 부인 사칭\' 40대 여성, 전직 시장에 4.5억 뜯어내""\'카풀앱\' 운전자가 강제로 입 맞췄다…성폭행 불안감 몰려와""좋아요0훈훈해요0슬퍼요0화나요0후속기사 원해요0기사제공 :']"
15,삼성전자, 2018-11-2315:01,한국경제TV ,[이 시각 코스피] 코스피 현재 2050.61p 하락 반전,https://finance.naver.com/news/news_read.nhn?article_id=0000707536&office_id=215&mode=search&query=삼성전자&page=4,"['       [이 시각 코스피] 코스피 현재 2050.61p 하락 반전      기사입력2018-11-23 15:01기사원문좋아요훈훈해요좋아요 평가하기공감좋아요0훈훈해요0슬퍼요0화나요0후속기사 원해요0댓글[한국경제TV 라이온봇 기자][코스피 장중 시황]11월 23일 15시 0분 코스피는 전일 대비 19.34p(-0.93%) 하락한 2050.61p를 기록하고 있다.[그림 1] 현재 시각 코스피, 상승 및 하락 종목 수현재 코스피는 전체 상장 종목 중 209개 종목이 상승세를 보이고 있으며, 614개 종목은 하락중이다. 71개 종목은 보합세를 나타내고 있다.규모별로는 대형주(-0.95%), 중형주(-0.89%), 소형주(-0.95%) 모두 약세를 나타내고 있다.현재시각 유가증권시장 투자자별 매매동향을 살펴보면 개인이 홀로 1482억원 순매수 하고 있다. 반면, 외인과 기관은 각각 -341억원, -1205억원 순매도 중이다.[업종동향][그림 2] 업종별 상위 TOP5 (단위 : %)[그림 3] 업종별 하위 TOP5 (단위 : %)업종별로는 하락이 우세하다.유통업(0.41%), 서비스업(0.21%), 건설업(0.1%) 등은 상승세를 나타냈다.  반면, 운수장비(-0.23%), 음식료품(-0.26%), 기계(-0.29%), 운수창고(-0.33%), 은행(-0.35%), 비금속광물(-0.39%), 통신업(-0.7%), 의약품(-0.96%), 제조업(-1.07%), 전기,전자(-1.08%), 의료정밀(-1.11%), 종이,목재(-1.15%), 증권(-1.37%), 섬유의복(-1.38%), 금융업(-1.41%), 화학(-1.79%), 전기가스업(-1.86%), 철강,금속(-1.99%), 보험(-2.24%) 등은 하락세를 나타냈다. [시가총액 상위 종목 동향]시가총액 상위 10개 기업은 대부분 기업이 하락세를 기록하고 있다.""대장주"" 삼성전자는 전일(42,450원) 대비 350원(-0.82%) 내린 42,100원에 거래되고 있다.현대차(0.97%) 등은 상승세를 나타냈다. 반면에, KB금융(-0.32%), SK하이닉스(-0.58%), 신한지주(-0.58%), SK텔레콤(-0.87%), SK(-1.1%), 셀트리온(-1.12%), LG화학(-2.66%), POSCO(-3.15%) 등은 약세를 보이고 있다. 라이온봇 기자 -한국경제TV※ 본 기사는 한국경제TV와 \'거장들의 투자공식이\'자체 개발한 \'라이온봇 기자\'가 실시간으로 작성한 기사입니다.라이온봇기자 ▶ No1. 경제/증권방송 보며 채팅하기 [유튜브][페이스북]▶ 대한민국 재테크 총집결 [한국경제TV 사이트 바로가기]ⓒ 한국경제TV, 무단 전재 및 재배포 금지한국경제TV 관련뉴스해당 언론사에서 선정하며 언론사 페이지(아웃링크)로 이동해 볼 수 있습니다.문 대통령 지지도 취임 후 최저…""이영자 때문""한·중 냉장고 전쟁...""키우겠다""vs""없애겠다""주력산업까지 공매도...\'삼성전자·현대차\' 타깃[한입경제] 삼성은 접는데 애플은 안 접나요?이재명의 위기...""역린을 건드린 대가""좋아요0훈훈해요0슬퍼요0화나요0후속기사 원해요0기사제공 :']"
