,회사명,날짜,언론사,기사제목,링크,본문
17,삼성전자, 2018-02-2110:08,이데일리 ,"코스피, 기관·개인 `사자` 상승전환…2420선 회복",https://finance.naver.com/news/news_read.nhn?article_id=0004039874&office_id=018&mode=search&query=삼성전자&page=6,"['       코스피, 기관·개인 `사자` 상승전환…2420선 회복      기사입력2018-02-21 10:08기사원문좋아요훈훈해요좋아요 평가하기공감좋아요0훈훈해요0슬퍼요0화나요0후속기사 원해요0댓글개인·기관 동반매수…증권 등 대다수 업종 강세시총상위株 엇갈려…삼성전자 3일째↓[이데일리 이후섭 기자] 코스피지수가 상승 전환하며 2420선을 회복하고 있다. 개인과 기관이 동반 매수에 나선 가운데 증권 등 대다수 업종이 강세를 보이고 있다.21일 오전 9시55분 현재 코스피지수는 전날대비 7.10포인트(0.29%) 오른 2422.22를 기록 중이다. 소폭 상승 출발한 이날 지수는 외국인 매도세가 유입되며 하락 전환했다. 그러나 기관이 순매수로 돌아서면서 다시 상승세를 보이고 있다.유가증권시장에서 개인과 기관은 각각 535억원, 97억원 순매수하고 있다. 외국인은 602억원어치 주식을 팔아치우며 5거래일 만에 매도세를 보이고 있다. 프로그램 매매는 차익과 비차익을 합쳐 330억원 순매도를 기록하고 있다. 업종별로는 증권과 음식료업이 1% 넘게 오르고 있다. 서비스업, 섬유의복, 운수장비, 의약품, 비금속광물, 기계, 통신업 등 대부분의 업종이 상승 중이다. 은행, 건설업, 철강금속, 전기가스업 등은 약세를 면치 못하고 있다.시가총액 상위종목은 엇갈린 행보를 보이고 있다. SK하이닉스(000660) 셀트리온(068270) 현대차(005380) 삼성바이오로직스(207940) NAVER(035420) 등은 오름세다. 반면 3거래일 연속 하락세를 보이고 있는 삼성전자(005930)를 비롯해 삼성전자우(005935) POSCO(005490) KB금융(105560) LG화학(051910) 신한지주(055550) 등은 내림세다.이후섭 (dlgntjq@edaily.co.kr)▶ 하나된 열정! PASSION! 평창 동계올림픽 특집▶ 네이버 메인에서 ‘이데일리’ 구독하기▶ \'이데일리\'의 카톡 친구가 되어주세요~♥＜ⓒ종합 경제정보 미디어 이데일리 - 무단전재 & 재배포 금지＞이데일리 관련뉴스해당 언론사에서 선정하며 언론사 페이지(아웃링크)로 이동해 볼 수 있습니다.韓에 1조원 손벌린 GM, 美공장엔 2850억원 투자""피해자, 조민기 처벌 원해""…청주대 회의록 살펴보니노선영, 심한 몸살? 순위전 나갈 것..1년 전 호흡 다시 볼 수 없나700만 낚시인 반발에..해수부, \'낚시 부담금\' 발표 연기(종합)페이팔 CFO 비트코인, 주요 결제수단 될 가능성 매우 높다좋아요0훈훈해요0슬퍼요0화나요0후속기사 원해요0기사제공 :']"
18,삼성전자, 2018-02-2110:06,파이낸셜뉴스 ,"[fn 오전시황]코스피, 개인 및 기관 순매수에 소폭 상승",https://finance.naver.com/news/news_read.nhn?article_id=0003968750&office_id=014&mode=search&query=삼성전자&page=6,"['       [fn 오전시황]코스피, 개인 및 기관 순매수에 소폭 상승       기사입력2018-02-21 10:06기사원문좋아요훈훈해요좋아요 평가하기공감좋아요0훈훈해요0슬퍼요0화나요0후속기사 원해요0댓글  코스피가 개인과 기관의 매수세에 힘입어 소폭 상승세다.  21일 오전 10시 기준 코스피 지수는 2422.66으로 전장 대비 7.54포인트(0.31%) 오른채 거래되고 있다. 이날 코스피는 전장 대비 2.61포인트(0.11%) 오른 2417.73으로 출발했다.  외국인은 620억원을 순매도했다. 하지만 개인과 기관이 각각 507억원, 141억원을 순매수하며 지수를 끌어올렸다.  시가총액 상위종목별로 SK하이닉스(1.46%), 셀트리온(1.15%), 현대차(1.63%)는 상승세를 보였다. 하지만 삼성전자(-0.34%), 포스코(-1.10%), KB금융(-1.65%) 등은 하락세를 보였다.  규모별로 대형주(0.07%), 중형주(0.49%), 소형주(0.51%) 등 모두 오름세를 보였다. 업종별로는 음식료품(1.23%) 등이 강세를 보였다.  코스닥 지수는 874.71으로 전장 대비 10.30포인트(1.19%) 오른채 거래되고 있다.   ggg@fnnews.com 강구귀 기자   ▶ 세상의 모든 골 때리는 이야기 \'fn파스\'▶ 속보이는 연예뉴스 fn스타  ※ 저작권자 ⓒ  파이낸셜뉴스. 무단 전재-재배포 금지파이낸셜뉴스 관련뉴스해당 언론사에서 선정하며 언론사 페이지(아웃링크)로 이동해 볼 수 있습니다.된장찌개 먹방 사진으로 스타된 20대 러시아女영국에서 주목받는 평창 올림픽 미녀 선수 3인방경유차에 휘발유 넣은 주유소 직원..""차주도 30% 책임""운동으로 완벽한 \'S라인\' 만든 인스타그램 스타매일 초콜릿 먹는 여성의 성생활 만족도 조사해보니좋아요0훈훈해요0슬퍼요0화나요0후속기사 원해요0기사제공 :']"
19,삼성전자, 2018-02-2110:00,한국경제TV ,[이 시각 코스피] 코스피 현재 2422.66p 상승세 지속,https://finance.naver.com/news/news_read.nhn?article_id=0000604426&office_id=215&mode=search&query=삼성전자&page=6,"['       [이 시각 코스피] 코스피 현재 2422.66p 상승세 지속      기사입력2018-02-21 10:00기사원문좋아요훈훈해요좋아요 평가하기공감좋아요0훈훈해요0슬퍼요0화나요0후속기사 원해요0댓글[한국경제TV 라이온봇 기자][코스피 장중 시황]2월 21일 10시 0분 코스피는 전일 대비 7.54p(0.31%) 상승한 2422.66p를 기록하고 있다.규모별로는 대형주(0.2%), 중형주(0.54%), 소형주(0.49%) 모두 강세를 나타내고 있다.[업종동향][그림 1] 업종별 상위 TOP5 (단위 : %)[그림 2] 업종별 하위 TOP5 (단위 : %)업종별로는 상승이 우세하다.음식료품(1.24%), 서비스업(1.17%), 증권(1.09%), 운수장비(1.08%), 섬유의복(0.93%), 비금속광물(0.81%), 의약품(0.61%), 기계(0.58%), 통신업(0.44%), 제조업(0.34%), 운수창고(0.31%), 화약(0.28%), 종이,목재(0.23%), 유통업(0.14%), 전기,전자(0.08%), 금융업(0.02%) 등은 상승세를 나타냈다. 반면, 의료정밀(-0.05%), 보험(-0.07%), 전기가스업(-0.13%), 철강,금속(-0.31%), 건설업(-0.59%), 은행(-1.12%) 등은 하락세를 나타냈다. [시가총액 상위 종목 동향]시가총액 상위 10개 기업은 상승이 우세하다.""대장주"" 삼성전자는 전일(2,370,000원) 대비 4,000원(-0.17%) 내린 2,366,000원에 거래되고 있다.NAVER(1.98%), SK하이닉스(1.85%), 현대차(1.63%), 셀트리온(0.99%), 삼성바이오로직스(0.24%) 등은 상승세를 나타냈다. 삼성물산 종목은 보합세를 보이고 있다.  반면에, LG화학(-0.27%), POSCO(-0.82%), KB금융(-1.5%) 등은 약세를 보이고 있다. 라이온봇 기자 -한국경제TV※ 본 기사는 한국경제TV와 \'거장들의 투자공식이\'자체 개발한 \'라이온봇 기자\'가 실시간으로 작성한 기사입니다.라이온봇기자 ⓒ 한국경제TV, 무단 전재 및 재배포 금지한국경제TV 관련뉴스해당 언론사에서 선정하며 언론사 페이지(아웃링크)로 이동해 볼 수 있습니다.고속도로 교통상황 아직 원활, 인천공항 출국장은 \'북적\'홍진영 근황, 물오른 미모…""30대 몸매 비결은""박지헌만의 성교육 ""야동 보는 게 나쁜 거 아냐""김수희 누구?…서태지 제치고 가요대상 받은 전설윤정수 다이어트, \'홀쭉해진\' 비결은?좋아요0훈훈해요0슬퍼요0화나요0후속기사 원해요0기사제공 :']"
0,삼성전자, 2018-02-2109:48,조선비즈 ,외인·기관 '사자'에 코스닥 1%대 상승세…코스피는 강보합,https://finance.naver.com/news/news_read.nhn?article_id=0000399373&office_id=366&mode=search&query=삼성전자&page=7,"['       외인·기관 \'사자\'에 코스닥 1%대 상승세…코스피는 강보합      기사입력2018-02-21 09:48기사원문좋아요훈훈해요좋아요 평가하기공감좋아요0훈훈해요0슬퍼요0화나요0후속기사 원해요0댓글 코스피지수가 등락을 반복하며 강보합권에 머물러 있다. 밤 사이 뉴욕 증시가 흔들린 가운데 외국인의 순매도와 기관·개인의 순매수가 힘겨루기를 벌이고 있다. 외국인과 기관이 사들이고 있는 코스닥시장은 1% 이상의 오름세를 나타내고 있다.21일 오전 9시 37분 현재 코스피지수는 전날보다 0.21%(5.18포인트) 오른 2420.30에 거래되고 있다. 외국인이 539억원 순매도 중이다. 기관과 개인은 각각 42억원, 517억원어치를 사들이고 있다.네이버금융 제공20일(현지시각) 뉴욕증권거래소(NYSE)에서 다우존스30산업평균지수는 전거래일보다 254.63포인트(1.01%) 하락한 2만4964.75에 장을 마쳤다. 앞서 6거래일 연속 상승 마감했던 다우지수는 이날 약세로 2만5000 고지를 다시 내줬다. 스탠더드앤드푸어스(S&P)500지수와 나스닥지수도 각각 0.58%, 0.07% 하락 마감했다.뉴욕 증시는 특히 장 후반에 하락폭을 키웠다. 최근 글로벌 증시를 뒤흔든 장기 국채 금리가 다시 상승하며 투자심리를 위축시켰기 때문이다. 이날 재무부는 510억달러 규모의 3개월물 국채를 1.64%에 발행했다. 이는 지난 12일 발행한 국채 수익률보다 6bp(1bp=0.01%포인트) 상승한 것이다.이 소식이 전해지자 10년물 국채 금리는 2.9% 수준까지 치솟았다. 다음날로 예정된 연방준비제도(연준)의 1월 연방공개시장위원회(FOMC) 의사록 공개도 국채 금리 상승에 영향을 끼친 것으로 풀이된다.서상영 키움증권 연구원은 “FOMC 의사록 공개와 연준 위원들의 발언을 앞두고 미 국채금리가 상승세를 이어가고 있다”며 “이를 감안할 때 한국 증시의 상승도 제한될 수 있다”고 분석했다.업종별로는 섬유·의복, 음식료품, 의약품, 서비스, 운송 등이 전날보다 오르고 있다. 반면 은행, 철강·금속, 건설, 보험, 전기·전자 등은 지지부진한 흐름을 보이고 있다.시가총액 상위 종목 중에서는 SK하이닉스(000660)와 현대차(005380), 삼성바이오로직스(207940), NAVER(035420)가 상승세다. 삼성전자(005930), POSCO(005490), KB금융(105560), LG화학(051910), 삼성생명(032830), 신한지주(055550)등은 하락세다.같은 시각 코스닥지수는 전날보다 1.23%(10.62포인트) 상승한 875.03에 거래되고 있다. 전날 하락 마감한 코스닥지수는 하루 만에 상승 전환에 성공했다.외국인과 기관이 유가증권시장에서 매도 물량을 쏟아내는 대신 코스닥시장에서는 각각 115억원, 242억원 순매수하며 지수를 끌어올리고 있다. 개인은 347억원 순매도 중이다.외인·기관의 쌍끌이 매수에 코스닥 시총 상위 종목들도 대부분 오르고 있다. 다만 상승폭은 크지 않다. 대장주 셀트리온헬스케어(091990)와 신라젠(215600), 바이로메드(084990), 휴젤(145020), 코미팜(041960)등이 1%대의 상승 흐름을 나타내고 있다.[전준범 기자 bbeom@chosunbiz.com]chosunbiz.com조선비즈 관련뉴스해당 언론사에서 선정하며 언론사 페이지(아웃링크)로 이동해 볼 수 있습니다.""내가 미쳤지…"" 땅 치고 후회하는 증권맨들그랜저만큼 팔리는 이 車…서민들은 쓴웃음日·中, 삼성 OLED 넘겠다더니…6년전 한국 수준""역시 한국""…베트남 인구 절반이 매료된 \'이것\'""3억짜리 집, 5억됐다"" 세종시 공무원들 웃음 꾹좋아요0훈훈해요0슬퍼요0화나요0후속기사 원해요0기사제공 :']"
1,삼성전자, 2018-02-2109:47,데일리안 ,'수원 인계동 동문굿모닝힐' 25일 견본주택서 ‘박나래 쿠킹쇼’ 개최,https://finance.naver.com/news/news_read.nhn?article_id=0002241542&office_id=119&mode=search&query=삼성전자&page=7,"['       \'수원 인계동 동문굿모닝힐\' 25일 견본주택서 ‘박나래 쿠킹쇼’ 개최      기사입력2018-02-21 09:47기사원문좋아요훈훈해요좋아요 평가하기공감좋아요0훈훈해요0슬퍼요0화나요0후속기사 원해요0댓글동문건설은 오는 25일 박나래 쿠킹쇼를 진행할 예정이다. 사진은 개그우먼 박나래 모습. ⓒ동문건설동문건설은 수원 인계동 동문굿모닝힐 견본주택 오픈 기념 행사로 인기 연예인 박나래 씨가 진행하는 쿠킹쇼를 연다.이번 행사는 이다 25일오후 2시 수원 KBS드라마 제작센터 인근에 마련된 수원 인계동 동문굿모닝힐 견본주택에서 1시간 가량 진행된다. 참여 신청은 수원 인계동 동문굿모닝힐 홈페이지에서 할 수 있다. 당첨자 50여 명은 개별 통보 할 예정이다. 참가자 가운데는 쿠킹쇼에서 만든 음식 시식이 가능하며, 쿠킹쇼 이후 단체 사진 촬영 및 사은품도 증정할 계획이다.박나래 씨는 예능프로그램 ‘나혼자 산다’에서 집 한 쪽을 바(bar) 형태로 꾸민 ‘나래바’를 통해 훌륭한 요리 솜씨를 보여줬다.박 씨는 에세이에 요리•인테리어 노하우 등을 더한 책인 \'웰컴 나래바!’를 펴내기도 했다. 출연하는 예능 프로그램마다 시청자들의 인기를 한 몸에 받고 있어 최근 가장 바쁜 일정을 소화하고 있다.동문건설 관계자는 “소비자와 유대관계 강화를 위해 견본주택을 단순히 아파트 모형을 보고 상담을 받는 곳이 아닌 즐거움을 나눌 수 있는 공간으로 꾸미기 위해 이번 행사를 열게 됐다”며 “박나래씨는 매체에서 평소 털털하고, 꾸밈없는 웃음을 선사하고 있는 만큼 견본주택 방문객들에게도 특별한 볼거리를 제공할 것으로 기대한다”고 말했다.한편 23일 견본주택을 오픈하는 수원 인계동 동문굿모닝힐은 수원시 팔달구 인계동 153-2 일대 들어선다. 아파트는 전용면적 63·71·79㎡ 총 298가구다. 약 24만㎡ 규모의 인계 3호공원과 접한데다 매화초가 도보 3분 거리에 위치한다. 지하철 1호선과 KTX가 정차하는 수원역과 분당선 수원시청역, 신분당선 광교중앙역을 이용할 수 있다.홈플러스, 갤러리아백화점, 뉴코아아울렛, 롯데백화점, 아주대병원, 가톨릭대병원, 수원월드컵경기장 등이 가깝다. 수원시청, 수원지방법원, 경기도신청사(예정), 광교법조타운(예정) 등 관공서도 인접하다. 삼성디지털시티, 삼성전자 나노시티, 광교테크노밸리 등 산업단지로 출퇴근도 편리하다.견본주택은 팔달구 인계동 947-10에 있다. 입주는 2020년 11월 예정이다.데일리안 권이상 기자 (kwonsgo@dailian.co.kr)ⓒ (주)데일리안 - 무단전재, 변형, 무단배포 금지데일리안 관련뉴스해당 언론사에서 선정하며 언론사 페이지(아웃링크)로 이동해 볼 수 있습니다.\'뉴스룸\' 조민기 ""가슴으로 연기하라고 툭 친 것""중국 실격 이유는 판커신 ""베이징은 공정할 것""[D-인터뷰] 임창정 ""배우 \'제2의 전성기\' 꼭 올 것""8부 능선 넘은 바르셀로나, 8강행 확률은?강화된 재건축 대안 \'리모델링\'...단지별 희비좋아요0훈훈해요0슬퍼요0화나요0후속기사 원해요0기사제공 :']"
2,삼성전자, 2018-02-2109:42,전자신문 ,[ET투자뉴스]SK하이닉스_대형주들이 약세를 보이지만 동종목 현재 +2.12%,https://finance.naver.com/news/news_read.nhn?article_id=0002685702&office_id=030&mode=search&query=삼성전자&page=7,"['       [ET투자뉴스]SK하이닉스_대형주들이 약세를 보이지만 동종목 현재 +2.12%      기사입력2018-02-21 09:42기사원문좋아요훈훈해요좋아요 평가하기공감좋아요0훈훈해요0슬퍼요0화나요0후속기사 원해요0댓글 코스피 대형주지수가 하락하고 있지만 SK하이닉스는 상대적으로 강세를 유지하고 있다. 21일 오전 9시 38분 현재 1600원(2.12%) 올라 77,100원을 기록중인 SK하이닉스는 약세장에서의 강세가 더욱 눈에 띄는 모습이다.    [종목동향]     * 1월25일에 SK하이닉스의 4/4분기(2017년 10월 ~ 12월) 실적 발표됨매출액 9조0276.0억, 영업이익 4조4658.0억, 당기순이익 3조2195.0억 *전년동기대비 매출액 68.5%증가,영업이익 190.7%증가,당기순이익 97.7%증가 *전분기대비 매출액 11.5%증가,영업이익 19.5%증가,당기순이익 5.4%증가    [포인트검색]     1월25일 :에스케이하이닉스(주) 현금ㆍ현물 배당 결정    [주가/수급동향]     기관이 2일연속 주식을 팔고 있는 반면 외국인은 9일연속 주식을 사고 있다. 최근 한달간 SK하이닉스의 상장주식수 대비 거래량을 비교해보니 일별 매매회전율이 0.66%로 집계됐다.  그리고 동기간 장중 저점과 고점의 차이인 일평균 주가변동률을 2.91%를 나타내고 있다.  그리고 최근 5일간 거래비중은 개인 비중이 45.58%로 가장 높았고, 외국인이 29.77%로 그 뒤를 이었다.  기관은 24.63%를 나타냈다.     [차트신호]     최근 주가변동폭을 기준으로 한 현재 주가는 상승추세를 유지하고 있고,거래량을 적용해볼 때는 매수 에너지를 강하게 결집하고 있다.실리적인 측면에서는 뚜렷한 심리변화가 나타나지 않고 있고 이동평균선들의 배열도를 분석을 해보면 단기, 중기, 장기 이동평균선이 정배열을 이루는 전형적인 상승국면에 있다.     [투자의견]     최근 한달간 제시된 증권사 투자의견을 종합해보면  SK하이닉스의 평균 목표주가는 100,100원이다. 현재 주가는 77,100원으로 23,000원(29%)까지 추가상승 여력이 존재한다.   [업종내 종목흐름]     이 시각 현재 관련종목들은 혼조세를 보이고 있으나 전기전자업종은    0.07% 상승중이다. 삼성전자 2,363,000원▼7000(-0.30%) 삼성SDI 179,500원0 (0.00%)  삼성전기 96,100원▲200(+0.21%) LG전자 103,000원▼1000(-0.96%)    [재무특징]     영업이익률 현재 40.82%로 업종평균 상회. PER은 6.15로 업종평균보다 낮으며, PBR은 1.8임.  증시분석 전문기자 로봇 ET etbot@etnews.com전자신문과 씽크풀의 증시분석 전문기자 로봇 ET가 쓴 기사입니다▶ 전자신문 포스트 바로가기▶ 전자신문 바로가기 [Copyright ⓒ 전자신문 & 전자신문인터넷, 무단전재 및 재배포 금지]전자신문 관련뉴스해당 언론사에서 선정하며 언론사 페이지(아웃링크)로 이동해 볼 수 있습니다.바이오메트릭(Biometric)카드, 애플·구글에 도전장국내 전기차 충전소 3400개 돌파...전기차 7대당 충전소 1곳 쓴다필리핀·인도에 첫 고해상도 위성 영상 수출…600만달러 규모부담금 면제 제도 5년 더 연장...파행 2주만에 재개된 국회, 66건 법안 처리IoT 보안 위협 분석·대응 기술 개발에 66억원 투자좋아요0훈훈해요0슬퍼요0화나요0후속기사 원해요0기사제공 :이 기사는 뉴스제휴평가위원회 \'뉴스제휴 및 제재 심사 규정\'에 따라노출 중단된 기사입니다.이전페이지목록보기인쇄하기목록보기증시 주요뉴스[오전시황]돌아온 외국인 코스피 소폭 올라 3..[외환브리핑]美 물가지표 최고치에도 달러화 약..존슨앤존슨 여파에도 S&P 최고치...""韓 기..[굿모닝 증시]美증시 J&J 백신 우려속 혼조..[원자재시황] 국제유가, 中경제지표 개선·수요..[유럽증시] J&J 코로나19 백신 우려에도 ..[모닝브리핑] 미 보건당국 ""J&J 백신 사용..[일일펀드동향] 국내 채권형펀드 3거래일간 2..이전 페이지로 돌아가기|맨위로더보기돌아온 배당 시즌…내 배당금 지급일은존슨앤존슨 여파에도 S&P 최고치...""韓 기술주, 실적 개선주 주목해야""美반도체 \'강력 드라이브\'…소부장株엔 어떤 영향?[당신의 돈] 국민연금이 국내 주식 비중 늘린다는데... 주가 오를까요?[오전시황]돌아온 외국인 코스피 소폭 올라 3,170선...천스닥 안착[외환브리핑]美 물가지표 최고치에도 달러화 약세..""환율 하락 전망""[특징주]비덴트, 코인베이스 나스닥 상장 기대에 강세[특징주]엑세스바이오, 무증상 코로나19 美 FDA 긴급승인…기술력 입증더보기인기검색어삼성전자83,600남양유업383,000이트론765대원미디어39,750동방7,050이용약관금융게시판 운영원칙개인정보처리방침책임의 한계와 법적고지금융 고객센터네이버(주)가 제공하는 금융 정보는 각 콘텐츠 제공업체로부터 받는 투자 참고사항이며, 오류가 발생하거나 지연될 수 있습니다.네이버(주)와 콘텐츠 제공업체는 제공된 정보에 의한 투자 결과에 법적인 책임을 지지 않습니다. 게시된 정보는 무단으로 배포할 수 없습니다.콘텐츠 제공업체코스콤 : 실시간 주가정보 및 국내시세정보에프앤가이드 : 기업 및 재무정보KG제로인 : 해외 시세, 시장지표 및 펀드 정보한국예탁결제원 : 주주총회일 및 전자투표 정보인포스탁 : 국내 테마 정보Copyright ©NAVER Corp.All Rights Reserved.']"
3,삼성전자, 2018-02-2109:40,서울경제 ,[오전시황]코스피 미국 증시 부진에 장초반 약보합,https://finance.naver.com/news/news_read.nhn?article_id=0003227144&office_id=011&mode=search&query=삼성전자&page=7,"['       [오전시황]코스피 미국 증시 부진에 장초반 약보합      기사입력2018-02-21 09:40기사원문좋아요훈훈해요좋아요 평가하기공감좋아요0훈훈해요0슬퍼요0화나요0후속기사 원해요0댓글 삼성전자 3거래일 연속 하락코스닥 지수는 상승세[서울경제] 코스피 지수각 미국 증시 부진에 21일 장초반 동반 하락세를 보이고 있다.이날 9시 29분 현재 코스피 지수는 전거래일 대비 0.19%(4.68포인트) 하락한 2,410.44를 기록하고 있다. 이날 2,417.73으로 상승 출발한 코스피 지수는 시간이 지나면서 하락세로 전환했다.전날 미국 증시가 부진한 것이 코스피 지수에 악재로 작용한 것으로 분석된다. 20일 미국 뉴욕증권거래소(NYSE)에서 다우존스30 산업평균지수는 전거래일보다 1.01%(254.63포인트) 하락한 2만4,964.75로 장을 마감했다. 스탠더드앤드푸어스(S&P)500지수는 직전거래일보다 0.58%(15.96포인트) 하락한 2,716.26, 나스닥지수는 0.07%(5.16포인트) 떨어진 7,234.31로 거래를 마쳤다. 투자주체 중에서는 개인 홀로 매수세다. 이 시간 현재 개인은 코스피 시장에서 632억원 순매수 중이다. 외국인과 기관은 각각 405억원, 208억원 순매도했다.시가총액 상위주 중에서는 대장주 삼성전자(005930)가 0.38% 하락한 236만 1,000원을 기록하고 있다. 삼성전자는 3거래일 연속 하락세다. 이외에 NAVER(1.86%), SK하이닉스(000660)(1.72%), 현대차(005380)(1.63%), 셀트리온(068270)(1.48%) 삼성바이오로직스(207940)(0.47%)는 상승세다. 반면 POSCO(005490)(-1.37%), KB금융(-1.35%), LG화학(051910) (-0.53%), 삼성물산(028260)(-0.38%)는 하락세다.업종별로는 의약품(1.07%), 서비스업(0.99%), 섬유의복(0.88%)가 오르고 있다. 반면 은행(-1.38%), 철강금속(-0.85%), 건설업(-0.64%)은 하락세다.코스닥 지수는 전거래일 대비 0.97%(8.27포인트) 오른 872.68에 거래 중이다. 코스닥 지수는 이날 867.92에 거래를 시작했다.서울외환시장에서 원달러 환율은 전거래일 대비 1원 60전 오른 1,075.1원에 거래되고 있다./이경운기자 cloud@sedaily.com[서울경제 바로가기]이제 주식시세도 서울경제에서 확인하세요 [바로가기▶]블록체인의 모든 것, 서울경제 Decenter [바로가기▶]저작권자 ⓒ 서울경제, 무단 전재 및 재배포 금지서울경제 관련뉴스해당 언론사에서 선정하며 언론사 페이지(아웃링크)로 이동해 볼 수 있습니다.""나중에 갚을게"" 학자금 먹고 튄 \'돌아오지 않는 그들\'해외로 놀러가는 사람들 얼마나 많길래 이런 식으로\'문재인과 함께라면···\' 수상한 낙서 발견된 그곳은?""내수 끝장낸다"" 신차 쏟아내는 현대·기아차 \'승부수\'여섯살 딸 목 졸라 살해한 친모···\'퇴마의식\' 따라했다?좋아요0훈훈해요0슬퍼요0화나요0후속기사 원해요0기사제공 :']"
