,회사명,날짜,언론사,기사제목,링크,본문
0,삼성전자, 2018-03-1421:39,동아일보 ,꼭 한잔 같이해야 친근?…‘술’ 없이 친해지는 방법은,https://finance.naver.com/news/news_read.nhn?article_id=0003133913&office_id=020&mode=search&query=삼성전자&page=1,"['       꼭 한잔 같이해야 친근?…‘술’ 없이 친해지는 방법은      기사입력2018-03-14 21:39기사원문좋아요훈훈해요좋아요 평가하기공감좋아요0훈훈해요0슬퍼요0화나요0후속기사 원해요0댓글 [동아일보]대기업에 다니는 50대 A부장과 밀레니얼 세대 B대리. 회식을 놓고 벌이는 두 사람의 가상 설전을 소개한다.   A:  “젊은 직원들은 일만 하고 퇴근하는 걸 생산성 제고라고 생각하는 건 착각. 소통하고 친밀해져야 서로 원하는 걸 찾을 수 있죠.”    B:  “회사가 무슨 동아리인가요? 꼭 친해져야 하는 이유가 뭔지……. 평소에 일할 때 말이 안 통하는 게 문제죠.”  A: “회의 시간에 그렇게 말해보라고 해도 조용하지 않았나. 술 마시면 그래도 좀 말하기 편하잖아요.”  B: “…. 회식 때도 부장님 혼자 얘기하시던데요. 설마 몇 시간 훈시하시고선, 소통했다고 착각하시는 거 아닌가요?”  술을 둘러싼 세대갈등은 현재 진행형이다. 지나친 회식이 워라밸(일과 삶의 균형)을 해친다는 데는 이의가 없다. 그래서 기업들은 2010년대 이후부터 회식문화 근절 캠페인 실험을 해왔다. 지나친 과음이 업무효율을 떨어뜨리고 피로를 높인다는 판단 때문이다. 2010년 경은 기업에 밀레니얼 세대(1980년대 초반에서 2000년대 초반 출생)가 물밀 듯이 입사하던 시기이기도 하다.   웬만한 기업마다 하루 일찍 퇴근하게 해주는 ‘가정의 날’을 만들고 회식은 1차 까지만 마시자는 캠페인을 벌여 왔다. 삼성전자나 LG디스플레이는 ‘112(한 가지 술로, 1차에서, 2시간 이내에)’처럼 구체적인 가이드도 발표했다. 119(한 가지 술로, 1차에서 9시 이전까지)캠페인에도 많은 기업들이 참여하고 있다.   캠페인 효과는 어땠을까. 지난달 본보가 대한상의와 대·중소기업 336곳을 대상으로 진행한 설문조사에서 ‘우리 회사는 회식을 자주 한다’에 대한 긍정 응답율은 25%, 보통은 39.0%, 부정이 36.0%에 달했다. 많은 기업들이 회식을 잦게 느끼지 않았다는 의미다.    공공기업 차장급인 김모 씨(37·여)는 “처음 회사에서 119 캠페인을 할 때 저게 뭐냐고 웃었는데, 부서장끼리 서로 캠페인 잘 지키기 경쟁에 나서면서 진짜로 회식이 줄었다. 10년 전에 2차 노래방이 기본이었다가 요즘엔 2차도 안가고 가더라도 커피숍에 갈 때도 있다”고 전했다.   워라밸(일과 삶의 균형)이 중시되는 최근에는 좀더 강제적인 조치들도 나온다. LG유플러스는 올해부터 월수금 회식을 금지한다고 발표했다. 노래방에서는 이 회사의 법인카드가 긁어지지 않는다. 강제 조치가 효과는 있다.    LG유플러스 관계자는 “월수금 회식을 금지했는데 이날 법인카드를 긁으면 나중에 조사 나올 수도 있다 보고 다들 조심한다. 요즘은 점심에도 회식 하고, 영화관람으로 대체하기도 한다”고 말했다.   문제는 술이 빠지니 조직 내 세대간 소통방법을 모르겠다는 호소가 곳곳에서 나온다는 점. 회식이 줄어든 기업의 한 임원은 “젊은 세대와 우리(40~50대)가 생각하는 ‘스킨십’ ‘소통’ 방식이 다른 것 같다. 솔직히 영화보고 차 마시고는 우리 스타일 아니다. 어색하고 친해지기 어렵다”고 말했다. 또 다른 부장은 “평소에도 말 안하고 회식도 싫어하는 사원들 보면 진짜 교류 자체가 싫은 건가 싶기도 하다”고 한숨을 쉬었다.     조직 간부들 말처럼 친해지는 게 일하는데 도움이 되긴 할까. 전문가들은 ‘그렇다’고 답한다. 조직문화 전문가 정은지 이머징 리더십 인터벤션츠 대표는 “경영환경이 매우 급박하게 돌아가는 4차산업혁명 시대에 대응하려면 조직원들의 심리적인 안정감이 더 중요하다. 조직원 간 연대가 안정감을 줄 수 있다”고 말했다.    하지만 장 대표는 “조직원 간 연대와 술자리에서의 끈끈함이 같다고 착각하는 것은 문제다. 업무에 대한 공평한 칭찬 격려가 친밀성을 높일 수 있다. 회식은 다소 위계질서와 고 조직 충성도를 확인하는 자리가 되기 쉽다”고 말했다.   아예 업무 시간내에 ‘술 자리’를 마련하는 것도 세대간 갈등을 피할 수 있다고 전문가들은 지적한다. 미국 기업에서 일하는 이모 씨(37·여)는 “부서에서 오후 4시에 스탠딩 와인 모임을 열기도 한다. 한국식 끈끈함이 그리울 때도 있긴 하지만  퇴근 후 스케줄을 존중하는 사고방식은 배울 만 하다” 고 말했다.   ‘술 없어도 친해지기’의 대안으로 등장한 제도 중 하나는 ‘호칭 파괴’다. 부장님, 과장님 대신 ‘영수님’이나 ‘김 프로’ 등으로 통일해 수평적으로 소통해 보자는 것이다. 2002년 CJ그룹을 시작으로 지난해 삼성전자, 올해 LG유플러스, SK텔레콤에 이르기까지 많은 기업이 호칭 통일에 동참하는 추세다. 카카오는 설립 초기부터 ‘영어 호칭’을 도입해 사용하고 있다. 창업자인 김범수 의장을 ‘브라이언(Brian)~’하고 부르는 식이다.   이 또한 반론도 있다. 님 호칭이 이미 정착한 회사에 경력으로 입사한 한 과장은 “처음에는 어색했지만 자꾸 이름을 부르다 보면 편하게 느껴질 때도 있다. 그래도 위계질서는 여전히 어렵다”고 말했다. 실제로 호칭 파괴를 도입했다가 포기하는 기업도 적지 않다. 호칭만 바꾼다고 회사 문화가 바뀌지 않는다는 걸 확인했기 때문이다.   그래서 소통 실험은 여전히 현재 진행형이다.김현수 기자kimhs@donga.com변종국 기자bjk@donga.com▶ 동아일보 단독 / 동아일보 공식 페이스북▶ 핫한 경제 이슈와 재테크 방법 총집결(클릭!)ⓒ 동아일보 & donga.com, 무단 전재 및 재배포 금지동아일보 관련뉴스해당 언론사에서 선정하며 언론사 페이지(아웃링크)로 이동해 볼 수 있습니다.보도블록 아래서 별안간 \'불기둥\' 치솟아 2명 화상…이게 웬 날벼락?김보름, 심리치료차 병원 입원 母 ""사람들 앞에 서는 걸 무서워해""바다에서 \'수중분만\' 인근 아파트서 포착 물에서 낳으면 덜 운다고?승무원 강요로…여객기 짐칸 선반에 반려견, 착륙후 열어보니다리 절단 응급 환자 머리에 베개 대신 잘린 다리를…가족 충격좋아요0훈훈해요0슬퍼요0화나요0후속기사 원해요0기사제공 :']"
1,삼성전자, 2018-03-1421:28,경향신문 ,대미 무역수지 흑자 규모 2년째 감소…한·미 FTA 3차 협상 ‘방어논리’ 될까,https://finance.naver.com/news/news_read.nhn?article_id=0002857605&office_id=032&mode=search&query=삼성전자&page=1,"['       대미 무역수지 흑자 규모 2년째 감소…한·미 FTA 3차 협상 ‘방어논리’ 될까      기사입력2018-03-14 21:28기사원문좋아요훈훈해요좋아요 평가하기공감좋아요0훈훈해요0슬퍼요0화나요0후속기사 원해요0댓글ㆍ오늘 ‘철강 관세 협상’과 동시 진행한·미 자유무역협정(FTA) 3차 개정협상이 15일 미국 워싱턴DC에서 열린다. 산업통상자원부 유명희 통상교섭실장과 미 무역대표부(USTR) 마이클 비먼 대표보가 수석대표로 참석한다. 이번 협상은 오는 23일 미국의 수입 철강 25% 관세 부과를 앞두고 한국을 대상국에서 제외하기 위한 협상과 동시에 진행된다. 협상 창구도 USTR로 동일하다는 점에서 정부가 미국으로부터 다른 분야에 대한 양보를 요구받는 상황에 직면할 수도 있다. 이에 한국 정부는 지난해 대미 무역수지 흑자 규모가 대폭 감소한 점 등을 들어 미국이 문제 삼는 양국 간 무역불균형 문제가 해소되고 있음을 강조할 방침이다.실제로 산업통상자원부가 14일 발표한 ‘한·미 FTA 발효 6년차 교역 동향’을 보면 지난해 상품 분야 수출과 수입이 각각 686억달러와 507억달러를 기록, 대미 무역수지 흑자 규모가 전년 대비 23.2% 감소한 179억달러로 집계됐다. 대미 무역수지는 1998년 이후 줄곧 흑자를 기록해오다 2016년 들어 처음 감소세로 전환된 뒤 2년 연속 마이너스 성장을 기록했다. 한국의 무역수지 흑자 중 미국이 차지하는 비중도 2014년 53.0%까지 올랐다가 지난해 18.8%로 하락했다. 최근 10년 이래 최저치다.특히 주력 수출품이 감소세를 보였다. 대미 수출의 30%를 차지하는 자동차(-6.4%)와 자동차부품(-16.1%) 감소폭이 컸다. 대미 수입은 반도체장비(119.3%)와 LPG(55.9%), 육류(20.4%) 수입이 대폭 늘었다. 반도체장비는 삼성전자와 SK하이닉스의 대규모 국내 투자에 따른 장비 도입으로 수입이 증가한 측면이 있다. LPG는 미국 셰일가스 생산 증가로 수입이 늘었고, 육류는 미국산 쇠고기가 호주산을 제치고 시장점유율 1위로 부상한 점이 주효했다.지난해 대미 서비스 수지는 139억달러 적자를 기록해 2016년과 비슷한 규모를 유지했다. 같은 기간 대미 투자는 152억9000만달러로 전년 대비 18.5% 증가한 반면 미국의 대한 투자는 12억1000만달러로 전년 대비 9.9% 감소했다.▶ [경향비즈 바로가기], 경향비즈 SNS [페이스북]  ▶ [인기 무료만화 보기][©경향신문(www.khan.co.kr), 무단전재 및 재배포 금지]경향신문 관련뉴스해당 언론사에서 선정하며 언론사 페이지(아웃링크)로 이동해 볼 수 있습니다.배현진, 한국당 입당 후 첫 임무가···홍준표, MB출석에 ""노무현처럼 개인비리 혐의···꼭 들춰내야 했을까""\'보험설계사 성폭행 의혹\' 김흥국 측 ""2년전 만난적 있지만 미투급 아니다""빨리 타려면 \\\'웃돈\\\' 내라는 카카오택시이명박, \'6문장 대국민 입장문\'에 밑줄 친 2곳은···좋아요0훈훈해요0슬퍼요0화나요0후속기사 원해요0기사제공 :']"
2,삼성전자, 2018-03-1420:30,국민일보 ,[여의도 stock] 코스피 5거래일 만에 소폭 하락,https://finance.naver.com/news/news_read.nhn?article_id=0001080830&office_id=005&mode=search&query=삼성전자&page=1,"['       [여의도 stock] 코스피 5거래일 만에 소폭 하락      기사입력2018-03-14 20:30기사원문좋아요훈훈해요좋아요 평가하기공감좋아요0훈훈해요0슬퍼요0화나요0후속기사 원해요0댓글상승세를 탔던 코스피지수가 5거래일 만에 숨고르기에 들어갔다. 다만 전기·전자업종은 외국인 순매수에 힘입어 오름세를 이어갔다. 코스피지수는 14일 0.34% 내린 2486.08에 장을 마쳤다. 외국인은 1298억원을 순매도하며 3거래일 만에 ‘팔자’로 돌아섰다. 기관도 1420억원을 순매도했다. 개인은 2830억원을 순매수했다. 이날 새벽 마감한 미국 뉴욕증시가 미·중 무역분쟁 우려로 부진했던 것이 투자심리를 위축시켰다. 하지만 전기·전자업종은 업황 개선 기대감을 타고 0.33% 올랐다. 외국인은 전기·전자업종에서 657억원을 순매수했다. SK하이닉스는 0.78% 오른 9만700원에 마감하며 전날 세운 종가 기준 사상 최고가(9만원) 기록을 하루 만에 갈아치웠다. 삼성전자도 0.19% 오른 258만8000원에 거래를 마치며 6거래일 연속 상승했다. 코스닥지수는 0.08% 오른 886.92에 마감했다.  국내 최대 연예기획사 SM이 인수한다는 소식에도 불구하고 키이스트 주가는 6.07% 떨어졌다. 키이스트는 배우 배용준씨가 대표로 있는 연예기획사다. 금융감독원은 인수 공시가 나오기 전인 지난 13일 키이스트 주가가 20.21%나 급등한 점에 주목하고 있다. 금감원 관계자는 “해당 종목의 최근 주식 매매 동향을 살펴보는 중”이라고 말했다. 한편 국민연금공단은 앞으로 공매도 과열 종목으로 지정된 종목에 대해서는 주식 대여를 중지하겠다고 밝혔다. 국민연금의 보유 주식이 투기 목적의 공매도에 활용되지 않도록 하기 위한 조치다. 개인투자자들은 공매도를 주가 하락의 주범으로 지목하고 있다.안규영 기자 kyu@kmib.co.kr[카카오 친구맺기] [페이스북][취재대행소 왱!(클릭)]GoodNews paper ⓒ 국민일보(www.kmib.co.kr), 무단전재 및 재배포금지국민일보 관련뉴스해당 언론사에서 선정하며 언론사 페이지(아웃링크)로 이동해 볼 수 있습니다.[포착] 안희정 두번째 성폭행 피해자 고소장 제출\'불륜설\' 영향…박수현, 충남지사 선거 예비후보 사퇴SM 주주 된 배용준, 키이스트 팔고 400억 차익""세상은 각하를 잊지 않았다"" 손석희 앵커브리핑 \'시끌\'정용진 부회장 6세 쌍둥이딸 해윤이가 그린 그림좋아요0훈훈해요0슬퍼요0화나요0후속기사 원해요0기사제공 :']"
3,삼성전자, 2018-03-1418:47,한국경제 ,다시 뛰는 반도체 장비주,https://finance.naver.com/news/news_read.nhn?article_id=0003907332&office_id=015&mode=search&query=삼성전자&page=1,"['       다시 뛰는 반도체 장비주      기사입력2018-03-14 18:47기사원문좋아요훈훈해요좋아요 평가하기공감좋아요0훈훈해요0슬퍼요0화나요0후속기사 원해요0댓글원익홀딩스·테스·피에스케이 등 강세업황 호황 지속… 삼성전자 등 투자 확대[ 강영연 기자  ] ‘고점 논란’에 휩싸였던 반도체 업종이 반등하자 관련주들도 상승세를 보이고 있다. 특히 삼성전자와 SK하이닉스 투자 확대로 반도체 장비주가 빠르게 오르고 있다.14일 코스닥시장에서 원익홀딩스는 주당 110원(1.39%) 오른 8030원에 마감했다. 삼성전자와 352억원 규모의 공급계약을 맺었다는 소식에 강세를 나타냈다. 최근 한 주간(3월8~14일) 6.50% 올랐다. 같은 기간 테스(5.78%), 피에스케이(7.45%) 등도 오름세였다.반도체 장비주들은 지난해 11월부터 지난달까지 고전을 면치 못했다. 반도체 경기가 정점을 찍었다는 분석이 잇따라 나왔기 때문이다.이달 들어 분위기가 바뀌고 있다. 비수기로 꼽히는 1분기에도 D램 가격이 견조하게 상승하며 반도체 업황에 대한 기대가 살아나서다. 박유악 키움증권 연구원은 “지난해 11월부터 중국 알리바바, 텐센트, 바이두가 중국 내 데이터센터 건립에 나서면서 수요가 급증했다”며 “스마트폰의 메모리 탑재량이 늘고, 가상화폐 등 신규 수요처가 생긴 것도 가격 상승의 원인”이라고 설명했다.반도체 기업들은 늘어나는 수요를 충당하기 위해 투자를 확대하고 있다. 최도연 신한금융투자 연구원은 “반도체 공정 난도가 높아지면서 일부 장비를 교체해 공정을 전환하는 대신 신규라인을 증설해 생산량을 늘리는 추세”라며 “그만큼 신규 장비 수요가 늘어 장비주들의 수익성이 높아지고 있다”고 평가했다.미국 주식시장에서도 반도체 장비회사의 상승세가 이어지고 있다. 미국 램리서치는 지난 2월 이후 16.94% 올랐다. 어플라이드머티리얼즈 역시 같은 기간 11.30% 상승했다.실적 전망도 밝다. 금융정보업체인 에프앤가이드에 따르면 테스의 지난해 영업이익은 633억원으로 전년 대비 73.90% 증가하며 사상 최고치를 기록했다. 올해도 25.73% 늘어난 796억원으로 최대 실적을 경신할 전망이다. 피에스케이도 올해 처음으로 800억원대 영업이익을 기록할 것으로 예상된다.강영연 기자 yykang@hankyung.com[한경닷컴 바로가기] [글방] [모바일한경 구독신청] ⓒ 한국경제 & hankyung.com, 무단전재 및 재배포 금지한국경제 관련뉴스해당 언론사에서 선정하며 언론사 페이지(아웃링크)로 이동해 볼 수 있습니다.제2공장 짓는 \'반도체 설비 재정비 강자\' 진천 러셀원익홀딩스, 삼성전자와 351억 TGS 관련제품 공급계약""2억에 산 구미 아파트, 지금은…"" 집주인 \'눈물\'배용준, 254억 넣은 키이스트 팔아 손에 쥔 돈이…\'효도 계약서\' 쓰고 10억 아파트 물려줬더니…좋아요0훈훈해요0슬퍼요0화나요0후속기사 원해요0기사제공 :']"
4,삼성전자, 2018-03-1418:06,디지털타임스 ,"삼성전자·신라젠 등 766개사, 넷째주에 주총",https://finance.naver.com/news/news_read.nhn?article_id=0002453058&office_id=029&mode=search&query=삼성전자&page=1,"['       삼성전자·신라젠 등 766개사, 넷째주에 주총      기사입력2018-03-14 18:06기사원문좋아요훈훈해요좋아요 평가하기공감좋아요0훈훈해요0슬퍼요0화나요0후속기사 원해요0댓글23일 슈퍼주총데이… 549곳 몰려오는 18일부터 24일까지 삼성전자를 비롯한 766사가 정기 주주총회를 개최한다.14일 한국예탁결제원에 따르면 12월 결산상장법인 2147사 중 3월 넷째주에 정기주총을 개최하는 회사는 총 766사로 집계됐다.유가증권시장에서는 삼성전자와 SK이노베이션, 대한항공 등 377사, 코스닥시장에서는 신라젠, 퓨쳐켐 등 379사, 코넥스 시장에서는 툴젠, 에프앤가이드 등 10사가 주총을 연다.특히 23일은 유가증권시장 301사, 코스닥시장 245사, 코넥스시장 3사 등 549사가 정기주총을 개최하는 \'슈퍼주총데이\'다.한편 한국예탁결제원은 상장사의 주주총회 활성화를 위해 시스템·제도 개선, 홍보활동, 합동 설명회 개최 등을 추진하고 있다. 지난해 결산법인의 정기 주주총회에서 전자투표·전자위임장을 이용한 주주 3만1000명에게는 모바일 기프티콘과 추첨을 통한 경품을 지급하고 있다. 김민수기자 minsu@ 디지털타임스 홈페이지 바로가기 디지털타임스 영문뉴스 바로가기 / 카드뉴스 바로가기김민수디지털타임스 관련뉴스해당 언론사에서 선정하며 언론사 페이지(아웃링크)로 이동해 볼 수 있습니다.[현장] 굳게 닫힌 군산 지엠공장… 곳곳 \'폐쇄철회\' 현수막만소상공인을 위한 \'노란우산공제\', 얼마나 알고 계십니까?해외이통 정부주도 5G 추격… 한국 주도권 위협5G-와이파이 등 통신망 바뀌어도… ""동영상 안 끊겨요""\'주차하면 로봇이 자동충전\'… 폭스바겐 ""테슬라, 보고 있나""좋아요0훈훈해요0슬퍼요0화나요0후속기사 원해요0기사제공 :']"
5,삼성전자, 2018-03-1417:57,매일경제 ,"[포토] 삼성전자, 평창 패럴림픽에 시각장애인 초청…`릴루미노` 체험",https://finance.naver.com/news/news_read.nhn?article_id=0004115445&office_id=009&mode=search&query=삼성전자&page=1,"['       [포토] 삼성전자, 평창 패럴림픽에 시각장애인 초청…`릴루미노` 체험      기사입력2018-03-14 17:57기사원문좋아요훈훈해요좋아요 평가하기공감좋아요0훈훈해요0슬퍼요0화나요0후속기사 원해요0댓글 삼성전자가 평창동계패럴림픽에 초청한 서울 하상장애인복지관 시각장애인들이 지난 13일 \'삼성 패럴림픽 쇼케이스\'를 방문해 삼성이 개발한 저시각장애인 시각보조 애플리케이션 \'릴루미노\'를 체험하고 있다. 삼성전자는 또 선수촌에 인공지능 기반 음성인식 \'플렉스워시\' 등 장애인이 사용하기 편한 세탁기와 건조기 150여 대를 무상 공급하는 등 패럴림픽의 성공적인 개최를 위해 다양한 지원 활동을 벌이고 있다. [사진 제공 = 삼성전자]▶뉴스 이상의 무궁무진한 프리미엄 읽을거리 ▶아나운서가 직접 읽어주는 오늘의 주요 뉴스[ⓒ 매일경제 & mk.co.kr, 무단전재 및 재배포 금지]매일경제 관련뉴스해당 언론사에서 선정하며 언론사 페이지(아웃링크)로 이동해 볼 수 있습니다.김새론, 비키니에 뽐낸 볼륨 ""더이상 소녀가 아니에요""[뉴스&분석] 대기업도 中企도 앞다퉈 脫한국카일리 제너, 감탄만 나오는 몸매…글래머 그 자체프리우스C, 주유·주차비 아껴주는 하이브리드카\'美친\' 안소미, 웨딩화보에 \'압도적 육감몸매\' 드러내다좋아요0훈훈해요0슬퍼요0화나요0후속기사 원해요0기사제공 :']"
6,삼성전자, 2018-03-1417:42,연합뉴스 ,"홍종학 ""젊은이들 혁신 창업하면 경제 다시 반석에 오른다""",https://finance.naver.com/news/news_read.nhn?article_id=0009957678&office_id=001&mode=search&query=삼성전자&page=1,"['       홍종학 ""젊은이들 혁신 창업하면 경제 다시 반석에 오른다""      기사입력2018-03-14 17:42기사원문좋아요훈훈해요좋아요 평가하기공감좋아요0훈훈해요0슬퍼요0화나요0후속기사 원해요0댓글 서울대 공대 강연…""창업가 얘기 들을 수 있는 한국형 테드 만들겠다""(서울=연합뉴스) 박성진 기자 = 홍종학 중소벤처기업부 장관은 14일 ""대학생들이 졸업해 혁신창업 등 개방형 혁신을 하면 한국 경제를 다시 반석 위에 올려놓을 수 있다""고 청년들의 혁신 창업을 권유했다.     홍 장관은 이날 서울 관악구 서울대에서 열린 서울대 공대 초청 특강에서 ""대학을 졸업하면 대기업이나 정부에 들어가거나 대학에 남거나 창업을 할 것이다""며 이같이 말했다.    홍 장관은 ""부모님 세대와 선배들은 삼성전자, 현대차와 같이 맨땅에서 세계적 혁신기업을 만들어 한국 경제를 성장시켰다""고 평가했다.    하지만 ""그 이후 30년간 한국 경제는 대기업이 폐쇄적인 혁신모형을 고수하고 있으며 구글과 아마존, 알리바바와 같은 세계적 혁신기업도 배출하지 못했다""고 진단했다.    그는 ""이에 따라 한국 경제는 미국이나 일본 등 선진국과 달리 경제성장률이 떨어지기만 하며 추락하고 있다""고 말했다.    홍 장관은 ""우리 젊은이들이 기술력이 충분하지만, 한국의 생태계가 척박하다는 게 제 생각이다""며 ""어느 위치에 있든 우리 한계를 인식하고 개방형 혁신을 해달라""고 부탁했다.    특강에 참석한 학생이 ""창업을 장려하기 위해서는 창업으로 얻을 수 있는 결과를 더욱 잘 알릴 필요가 있다""고 제안하자 홍 장관은 ""제 생각도 똑같다""고 동의했다.     홍 장관은 ""제가 아니라 뛰어난 창업가들이 오늘 여러분과 얘기를 해야 한다""면서 ""이런 창업가들이 이야기할 수 있도록 중기부는 한국형 테드(TED)를 만들려고 한다""고 밝혔다.    테드는 미국의 비영리 재단에서 운영하는 유명 강연회다. 홍종학 중소벤처기업부 장관[연합뉴스 자료사진]    sungjinpark@yna.co.kr▶기사제보 및 문의▶로봇기자가 쓰는 패럴림픽 뉴스\xa0\xa0▶사진구매 문의연합뉴스 관련뉴스해당 언론사에서 선정하며 언론사 페이지(아웃링크)로 이동해 볼 수 있습니다.\xa0검찰 수뇌부, MB 진술 하나하나 실시간 시청\xa0\'야구 스타\' 양준혁도 일자리 안정자금 지원받는다\xa0미술관서 나체로 감상하고 알몸 식사하는 사람들\xa0\'HPV 감염\' 편도암 급증…""건전한 성생활 중요""\xa0""17년간 착취""…잠실 쓰레기장서 지적장애 60대 구조좋아요0훈훈해요0슬퍼요0화나요0후속기사 원해요0기사제공 :']"
