,회사명,날짜,언론사,기사제목,링크,본문
0,삼성전자, 2018-10-1722:50,서울경제 ,"""대기업 금융사 비금융계열 지분 매각 명문화""",https://finance.naver.com/news/news_read.nhn?article_id=0003419369&office_id=011&mode=search&query=삼성전자&page=1,"['       ""대기업 금융사 비금융계열 지분 매각 명문화""      기사입력2018-10-17 22:50기사원문좋아요훈훈해요좋아요 평가하기공감좋아요0훈훈해요0슬퍼요0화나요0후속기사 원해요0댓글한국금융학회 주최 세미나""금융그룹 통합감독법 제정때 반영""[서울경제] 금융그룹 통합감독법을 제정할 때 그룹 내 금융회사는 비금융계열사 지분을 중장기적으로 매각하도록 유도해야 한다는 주장이 나왔다.17일 한국금융학회가 주최한 금융그룹 통합감독 제도 법제화의 주요 쟁점 세미나에서 이재연 금융연구원 선임연구위원은 “금융 부문과 비금융 부문 회사가 혼재한 복합금융그룹의 경우 그룹 차원의 자본적정량 평가 등이 어려우므로 궁극적으로 비금융사 지분을 처분하도록 해야 한다”고 밝혔다. 금융회사가 그룹 내 비금융계열사 지분을 가졌을 경우 비금융계열사의 리스크가 전이될 수 있기 때문에 장기적으로 매각을 강제하는 장치를 둬야 한다는 것이다. 금융그룹 통합감독법은 비은행금융지주사인 미래에셋과 교보생명, 금융자본과 비금융자본이 혼재된 금산결합그룹인 삼성·현대차·한화·DB·롯데를 감독하기 위해 정부가 제정하려는 법이다. 이 연구원의 주장대로라면 삼성생명 등 대기업그룹 소속 금융사들은 삼성전자나 삼성물산 등 비금융계열사의 지분을 처분해야 한다. 금융당국이 금융회사의 비금융계열사 지분 매각을 압박해온 만큼 이의 연장선으로 해석되지만 최소지분마저 법으로 강제할 경우 논란이 불가피할 것으로 전망된다. 이 연구원은 보유지분을 몇%까지 매각하도록 할지에 대한 구체적인 수치는 제시하지 않았다. 이 연구원은 이어 금융그룹 간 규제 형평성 제고도 주장했다. 그는 “은행지주회사·비은행지주회사·복합금융그룹에 대한 그룹 차원의 자본 적정성 평가 산정방식이 상이하기 때문에 이를 보완할 필요가 있다”고 말했다. 은행지주사는 국제결제은행(BIS) 기준 자기자본비율을 이용하지만 비은행지주사는 필요자본에 대한 자기자본비율을 산정한다는 점을 지적하고 금융그룹 간 규제의 형평성을 제고해야 한다고 주장한 것이다. 그는 또 “집중위험 산정 시 산업별·지역별 등으로 그룹 내 자회사별 특성을 고려할 필요가 있다”며 “금융자회사의 유형에 따라 특정 부문에 편중될 수 있다”고 했다. 보험사의 경우 유가증권투자, 여신전문사는 소비자금융, 금융투자회사는 유가증권 매매중개 등 특징을 감안해야 한다는 것이다./손구민기자 kmsohn@sedaily.com[서울경제 바로가기]프리미엄 미디어 Signal이 투자의 바른 길을 안내합니다 [바로가기▶]서울경제ㆍ서울시 주최 블록체인 이벤트 ‘ABF in Seoul’ [바로가기▶]저작권자 ⓒ 서울경제, 무단 전재 및 재배포 금지서울경제 관련뉴스해당 언론사에서 선정하며 언론사 페이지(아웃링크)로 이동해 볼 수 있습니다.[단독]사업하기 참 힘든 나라···71년 가업 접는 \'독립문\'[단독] 혈세 풀어 만든 공공고용 증가율, 민간 60배쩍쩍 금 간 50년된 단지도 재건축 규제···주민들 결국글로벌 사모펀드 제치고 케이뱅크 잡은 토종펀드 비결은\'MB 소유\' 다스, 중국시장서 철수하는 진짜 이유는좋아요0훈훈해요0슬퍼요0화나요0후속기사 원해요0기사제공 :']"
1,삼성전자, 2018-10-1721:26,경향신문 ,“새싹기업 키워드려요” 비법 전하는 삼성전자,https://finance.naver.com/news/news_read.nhn?article_id=0002899782&office_id=032&mode=search&query=삼성전자&page=1,"['       “새싹기업 키워드려요” 비법 전하는 삼성전자      기사입력2018-10-17 21:26기사원문좋아요훈훈해요좋아요 평가하기공감좋아요0훈훈해요0슬퍼요0화나요0후속기사 원해요0댓글사내 스타트업 육성 ‘C랩’ 개방 5년간 사내외 500개 과제 지원 신생·예비창업자도 신청 가능 1억 개발비·캠퍼스 입주 등 혜택“경영 무간섭, 창업 생태계 이바지”‘에바’는 고정식 전기차 충전 장치의 불편을 해소하기 위해 개발된 이동식 충전 장치다. 아파트 지하 주차장에 전기차를 주차한 뒤 귀가하면 자율주행 로봇 에바가 자동으로 충전을 수행한다. 에바에 장착된 충전 배터리는 전기차의 폐배터리를 재활용한 것이다.‘숨쉬GO’는 전신마취 수술 후 폐합병증을 예방하는 호흡재활운동 솔루션이다. 수술 후 쪼그라든 폐를 펴주기 위해서는 호흡 운동을 반복해야 한다. 숨쉬GO는 환자들이 재미있고 올바르게 호흡 훈련을 따라 할 수 있고, 의료진이 회복 상황을 원격으로 모니터링할 수 있는 모바일 디바이스와 앱을 제공한다.삼성전자는 사내 벤처 육성 프로그램 ‘C랩’에서 개발한 에바와 숨쉬GO가 이달 말 스타트업으로 창업한다고 17일 밝혔다. 2012년 12월 시작된 C랩에서는 지난 6년간 228개 과제에 917명의 임직원이 참여했다. 이 가운데 34개 과제는 창업에 성공해 170여명을 고용하고 있다.삼성전자 관계자는 “34개 회사에 16~25%의 지분을 갖고 있지만 최대주주는 스타트업 최고경영자”라면서 “계약서에 ‘경영에 일절 간섭하지 않는다’는 내용이 명시돼 있다”고 말했다.‘관리의 삼성’에서 ‘창의의 삼성’으로 도약하기 위해 올해부터는 이 같은 스타트업 육성 문호를 회사 바깥에도 개방하기로 했다. 향후 5년간 500개의 사내·외 과제를 육성하는데, 300개가 사외 스타트업 대상이다. 이 중 100개는 삼성전자 서울R&D캠퍼스에서, 200개는 대구·경북 창조경제센터에서 운영한다.삼성전자는 매년 정기 공모전을 열어 육성할 스타트업을 선발하기로 했다. 상시 선발도 병행한다. 육성 분야는 기존 모바일에서 정보기술(IT) 전체로 확대한다. 또 2~3년차 스타트업뿐 아니라 아이디어만 있는 예비 창업자, 1년 미만의 신생 스타트업도 지원할 수 있다.지원자는 매년 6~7월 ‘삼성전자와 함께할 스타트업을 찾습니다’를 주제로 열리는 공모전에 아이디어를 접수할 수 있다. 올해에도 331개 제출 과제에 대한 서류·발표심사를 거쳐 신규 과제 15개가 선발됐다. 원거리 물체를 원격으로 가상 터치해 움직임을 인식하는 ‘브이터치’, 스스로 학습해 발전하는 인공지능 챗봇을 개발하는 ‘데이터리퍼블릭’, 발달장애를 진단하고 치료하는 ‘두브레인’ 등이다.이들은 다음달부터 서울R&D캠퍼스에 마련된 공간에 1년간 무상 입주한다. 캠퍼스 내 회의실과 임직원 식당을 자유롭게 이용할 수 있다. 또 최대 1억원의 개발 지원금, 디자인·기술·특허·세무 등 창업을 위한 사내·외 전문가 멘토링, CES·MWC 등 해외 IT 전시회 참가 기회 등을 지원받는다.삼성전자 창의개발센터장 이재일 상무는 “성과를 잘 내는 ‘고성과자’는 아니지만 5% 정도의 ‘창의인재’가 존재한다”면서 “본인이 꽂힌 일에 엄청난 몰입도를 보이는 이들이 회사와 사회의 미래를 바꾸는 선봉장 역할을 할 것”이라고 말했다.구교형 기자 wassup01@kyunghyang.com▶ [경향비즈 바로가기], 경향비즈 SNS [페이스북]  ▶ [인기 무료만화 보기][©경향신문(www.khan.co.kr), 무단전재 및 재배포 금지]경향신문 관련뉴스해당 언론사에서 선정하며 언론사 페이지(아웃링크)로 이동해 볼 수 있습니다.50명 먹을 국에 달랑 두부 2모···새 에어컨은 원장 집으로이정미, 한국당 \'보수대통합\'에 ""어중이떠중이 끌어들인 하수종말처리장""\'오늘습관\' 생리대에서 대진침대보다 많은 라돈 검출… 누리꾼 \'경악\'태어나니 13억원이 통장에···미성년자 \'금수저 계좌\' 수두룩""유산하고 사흘 만에 나와 일해, 고객이 던진 손거울에 트라우마 시달려""좋아요0훈훈해요0슬퍼요0화나요0후속기사 원해요0기사제공 :']"
2,삼성전자, 2018-10-1720:55,세계일보 ,"“신성장 동력 확보”… 삼성, 망 분석 기업 ‘지랩스’ 인수",https://finance.naver.com/news/news_read.nhn?article_id=0003311135&office_id=022&mode=search&query=삼성전자&page=1,"['       “신성장 동력 확보”… 삼성, 망 분석 기업 ‘지랩스’ 인수      기사입력2018-10-17 20:55기사원문좋아요훈훈해요좋아요 평가하기공감좋아요0훈훈해요0슬퍼요0화나요0후속기사 원해요0댓글車 반도체 확대 이어 5G 역량 강화 착수/“시장 폭발전 브랜드 선보여 입지 다지기”/ 이재용 부회장 출소 후 분위기 확 달라져/ 업계 “반도체 집중하며 미래 준비 본격화”이재용 부회장 석방 이후 삼성전자가 차세대 성장동력 확보에 전방위로 나서고 있다. 삼성전자가 급부상하고 있는 차량용 반도체 사업을 확대한 데 이어 이번엔 5G(세대) 통신 관련 업체를 인수했다. 삼성전자는 17일 차세대 네트워크 트래픽 서비스 품질 분석 전문 기업인 ‘지랩스’ 지분 100%를 확보했다고 밝혔다. 삼성전자가 네트워크사업 관련 업체와 인수합병(M&A)한 것은 이번이 처음이다. 지랩스는 2008년 스페인에서 설립된 기업으로 통신 상태와 성능 등을 서비스별로 분석해 사용자가 실제 느끼는 서비스 품질을 측정하고 네트워크 자동운영 솔루션을 제공하는 회사다. 지랩스의 서비스는 영국의 보다폰 등 세계 50여개 통신사에 제공되고 있다.삼성전자는 5G 이동통신 시대를 맞아 기존의 기술과 지랩스의 망 분석 노하우를 결합해 기술력을 끌어올릴 계획이다. 5G는 삼성전자가 지난 8월 인공지능(AI)과 전자장비, 바이오와 함께 4대 미래 성장사업으로 꼽은 분야다. 삼성전자는 그동안 이동통신 장비 분야에서 화웨이와 노키아, 에릭슨 등에 밀린 4위에 있었다. 하지만 1위 사업자인 화웨이의 보안 이슈가 불거졌고, 정부가 내년 3월 세계 최초의 5G 상용화를 선언했다. 이에 삼성전자는 처음으로 미디어를 상대로 5G 장비를 소개하며 사업 확대에 공을 들이고 있다. 김영기 삼성전자 네트워크사업부장(사장)은 “5G는 4차 산업혁명 플랫폼으로 스마트폰뿐만 아니라 새로운 서비스로 무한히 확장될 것”이라며 “지랩스와 협력을 바탕으로 글로벌 통신사업자들과 5G 인프라 확장에 나서겠다”고 말했다.삼성전자는 전날 미래 자동차 사업 강화를 위해 자동차 전용 반도체 브랜드인 ‘엑시노스 오토’와 자동차 카메라에 적용될 이미지 센서 브랜드 ‘아이소셀 오토’를 공개했다. 차량용 반도체는 향후 자율주행차의 핵심 부품으로 꼽힌다. 업계 관계자는 “이 부회장 출소 이후 삼성전자가 잘할 수 있는 분야인 반도체에 집중함과 동시에 미래를 위한 준비에 나선 것”이라며 “5G 및 자동차 반도체 시장이 폭발하기 직전에 전문 브랜드와 부품을 선보여 입지를 다지려는 전략”이라고 평가했다.이 부회장 구속 이후 삼성전자는 대규모 투자를 자제하며 소극적인 자세로 내실 경영에 주력하는 모습이었다. 하지만 이 부회장이 출소한 이후 삼성전자의 분위기는 확 달라졌다. 이 부회장이 글로벌 AI시장을 탐색하기 위해 캐나다 등으로 떠난 이후 삼성전자는 2020년까지 1000명의 AI 전문가를 육성하겠다는 방안을 발표했다. 삼성전자는 이달 중 캐나다 몬트리올에 7번째 AI 센터 문을 열 계획이다. 또 이 부회장이 문재인 대통령과 김동연 부총리를 만난 이후에는 삼성은 미래를 위해 180조원 규모의 투자 계획과 함께 4만명을 직접 고용하겠다고 발표하기도 했다.업계 관계자는 “삼성전자가 레드오션이라 불리는 가전과 성장이 정체되고 있는 스마트폰 시장, 부정적 전망이 나오는 반도체를 중심으로 사업을 끝까지 끌고 가기 어려울 것”이라며 “컨트롤 타워의 복귀 이후 삼성전자의 색깔이 서서히 드러나기 시작했고 미래를 위한 준비도 빨라지고 있다”고 평가했다.정필재 기자 rush@segye.comⓒ 세상을 보는 눈, 글로벌 미디어 세계일보세계일보 관련뉴스해당 언론사에서 선정하며 언론사 페이지(아웃링크)로 이동해 볼 수 있습니다.""北 리선권 따까리인가?""…한국당, 조명균 퇴진 촉구섹스리스는 \'한국문화\'?…바람 피우는 아내 급증 이유짐승같은 日 군인 ""조선 처녀의 고기로 만든 국""""누군가 집에 들어와 동태찌개에 농약을 타놓고 사라졌다""아이 여드름에서 튀어나온 구더기의 \'정체\'?좋아요0훈훈해요0슬퍼요0화나요0후속기사 원해요0기사제공 :']"
3,삼성전자, 2018-10-1720:55,세계일보 ,삼성 “5년간 스타트업 과제 500개 발굴”,https://finance.naver.com/news/news_read.nhn?article_id=0003311133&office_id=022&mode=search&query=삼성전자&page=1,"['       삼성 “5년간 스타트업 과제 500개 발굴”      기사입력2018-10-17 20:55기사원문좋아요훈훈해요좋아요 평가하기공감좋아요0훈훈해요0슬퍼요0화나요0후속기사 원해요0댓글사내벤처 육성 프로그램 C랩 통해 육성/ 선발 업체엔 최대 1억원·사무실 등 지원“어떡해…너무 잘 보여요.”한 시각장애인이 시각 보조 기기인 릴루미노를 착용한 뒤 떨리는 목소리로 소리쳤다. 손을 뻗어 사물을 인식한 이 이용자의 눈물이 가상현실(VR) 기기 바깥까지 흘렀다. 삼성전자가 사내벤처 육성프로그램 C랩을 소개하는 영상에서 등장한 릴루미노의 기술은 보는 사람에게 감동을 선사했다. 릴루미노는 시각장애인의 시야를 확보해주는 기술을 개발한 업체로, 삼성전자의 C랩을 통해 탄생했다. 삼성전자는 17일 서울대에 있는 ‘삼성전자-서울대 공동연구소’에 C랩의 성과와 향후 운영 방향에 대해 소개하는 자리를 가졌다. C랩은 2013년부터 시작된 삼성전자의 사내벤처 육성 프로그램이다. 삼성전자는 앞으로 사외에서 탄생한 스타트업까지 C랩을 통해 육성할 방침이다. C랩을 통해 5년간 모두 500개의 스타트업 과제를 발굴하는 것이 삼성전자의 목표다. 삼성전자는 앞서 공모전을 진행해 현재 15개의 외부 스타트업을 선발했다. 선발된 회사는 △원거리 물체를 원격으로 가상 터치해 움직임을 인식하는 ‘브이터치’ △스스로 학습해 발전하는 인공지능(AI) 챗봇을 개발하는 ‘데이터리퍼블릭’ △유아용 발달장애를 진단하고 치료하는 ‘두브레인’ 등이다. 이 회사들은 다음 달부터 서울 서초구 우면동 삼성전자 서울R&D(연구개발) 캠퍼스에 마련된 보육 공간에 1년간 무상 입주해 회의실과 임직원 식당을 자유롭게 이용할 수 있다.삼성전자는 매년 하반기 공모전을 개최해 육성할 스타트업을 선발하고, 상시 선발도 함께 진행할 계획이다. 삼성전자가 선발한 업체들에는 개발 지원금 최대 1억원이 지원된다. 또 기술이나 특허 등에 대한 실질적인 멘토링도 받을 수 있다. 이재일 삼성전자 창의개발센터장(상무)은 “직원들의 창의적인 아이디어를 현실로 만들어줄 수 있는 회사로 만들겠다”며 “청년들이 창업에 도전하는 문화 확산에도 기여하고 싶다”고 말했다. 삼성전자가 육성하려는 벤처가 하드웨어 업체에 집중돼 있다는 우려에 대해서는 “소프트웨어 관련 스타트업이 차지하는 비중이 30% 수준”이라며 “AI나 딥러닝을 적용해 여러 이슈를 해결할 수 있는 아이디어를 가진 회사도 탄생하게 될 것”이라고 설명했다.정필재 기자ⓒ 세상을 보는 눈, 글로벌 미디어 세계일보세계일보 관련뉴스해당 언론사에서 선정하며 언론사 페이지(아웃링크)로 이동해 볼 수 있습니다.""北 리선권 따까리인가?""…한국당, 조명균 퇴진 촉구섹스리스는 \'한국문화\'?…바람 피우는 아내 급증 이유짐승같은 日 군인 ""조선 처녀의 고기로 만든 국""""누군가 집에 들어와 동태찌개에 농약을 타놓고 사라졌다""아이 여드름에서 튀어나온 구더기의 \'정체\'?좋아요0훈훈해요0슬퍼요0화나요0후속기사 원해요0기사제공 :']"
4,삼성전자, 2018-10-1720:36,MBC ,"""삼성바이오 분식회계 맞다""…이재용 승계 연관?",https://finance.naver.com/news/news_read.nhn?article_id=0000883592&office_id=214&mode=search&query=삼성전자&page=1,"['       ""삼성바이오 분식회계 맞다""…이재용 승계 연관?      기사입력2018-10-17 20:36기사원문좋아요훈훈해요좋아요 평가하기공감좋아요0훈훈해요0슬퍼요0화나요0후속기사 원해요0댓글 [뉴스데스크]◀ 앵커 ▶금융감독원이 삼성바이오로직스의 회계 처리에 대해 재감리를 벌인 경우 1차 감리 때와 마찬가지로 고의적인 분식회계라고 결론 내렸습니다.이재용 부회장의 경영권 승계 정당성이 다시 휘청거리게 됐습니다.노경진 기자가 설명해 드립니다.◀ 리포트 ▶지난 7월, 증권선물위원회는 삼성바이오로직스가 중요 공시를 \'고의로\' 누락했다며 검찰에 고발했습니다.하지만 혐의가 더 무거운 \'분식 회계\' 부분은 자료가 부족하다며 판단을 유보하고 금융감독원에 다시 감리를 해줄 것을 요청했습니다. [김용범/증선위원장]""(금감원의 재감리로) 다소 시일이 걸리더라도 추후에 명확하고 구체적인 처분을 내리기로 선택하였습니다.""석달여 동안 재감리를 진행한 금감원은 \'분식 회계\'가 맞다는 결론에 도달했습니다.1차 감리에서 확인한 2015년 분식회계 외에, 2012년부터 14년까지의 중대한 회계기준위반 혐의까지 추가로 확인한 겁니다. 게다가 금감원은 고의성을 입증할 새로운 증거도 확보한 것으로 전해졌습니다. 삼성바이오 문제는 이재용 삼성전자 부회장 경영권 승계의 핵심 과정인 삼성물산-제일모직 합병과 직결돼있습니다. 제일모직이 보유한 삼성바이오가 분식회계로 비싸게 평가됐다면, 이 부회장이 대주주인 제일모직의 기업가치도 그만큼 부풀려졌을 수 있기 때문입니다. 금감원의 이같은 재감리 결과가 그대로 증선위에서 받아들여지면, 추가 검찰 고발과 과징금이 불가피해집니다.삼성바이오로직스 주가는 오늘 4% 가까이 급락했습니다.MBC뉴스 노경진입니다.노경진 기자 (mbckija35@gmail.com)[저작권자(c) MBC (http://imnews.imbc.com) 무단복제-재배포 금지]▶ [엠빅비디오] 한국유치원총연합은 억울합니다.▶ [마리뉴 엑기스] 지코와 김정은 위원장의 만남은?▶ 20~30대를 위한 젊은 뉴스 \'14F\'Copyright(c) Since 1996, MBC&iMBC All rights reserved.MBC 관련뉴스해당 언론사에서 선정하며 언론사 페이지(아웃링크)로 이동해 볼 수 있습니다.[연구비①] \'형·아내·선배도 동원\'…\'엉터리\' 보고서 수두룩\'물죽에 잔멸치 세 마리\'…\'싸구려 급식\'에 또 분통\'한유총 비대위원장도 \'부적절\' 지출로 감사 적발\'\'인사처장 아내도 정규직 전환\'…\'특혜 없었다\'\'플라스틱 오염, 아시아산 소금 가장 심각\'…국산도 검출좋아요0훈훈해요0슬퍼요0화나요0후속기사 원해요0기사제공 :']"
