,회사명,날짜,언론사,기사제목,링크,본문
14,삼성전자, 2018-10-1713:57,전자신문 ,"[ET투자뉴스]삼성전기_거래비중 기관 17.43%, 외국인 34.08%",https://finance.naver.com/news/news_read.nhn?article_id=0002749078&office_id=030&mode=search&query=삼성전자&page=6,"['       [ET투자뉴스]삼성전기_거래비중 기관 17.43%, 외국인 34.08%      기사입력2018-10-17 13:57기사원문좋아요훈훈해요좋아요 평가하기공감좋아요0훈훈해요0슬퍼요0화나요0후속기사 원해요0댓글     위험대비수익률 -4.0, 업종지수보다 낮아 17일 오후 1시50분 현재 전일대비 2.21% 오른 138,500원을 기록하고 있는 삼성전기는 지난 1개월간 10.13% 하락했다.  동기간 동안에 주가움직임의 위험지표인 표준편차는 2.5%를 기록했다.  이는 전기전자 업종내에서 주요종목들과 비교해볼 때 삼성전기의 월간 주가등락률은 마이너스에 머물고 있지만, 변동성은 상대적으로 높은 수준을 유지했다는 뜻이다.  최근 1개월을 기준으로 삼성전기의 위험을 고려한 수익률은 -4.0을 기록했는데, 변동성은 높은 편이나 상대적으로 주가하락률이 낮아서 위험대비 수익률은 중간수준을 유지했다.  다만 전기전자업종의 위험대비수익률 -2.1보다는 낮았기 때문에 업종대비 성과는 긍정적으로 보기 어렵다. 다음으로 업종과 시장을 비교해보면 삼성전기가 속해 있는 전기전자업종은 코스피지수보다 변동성과 등락률이 모두 높은 모습이다.  업종등락률이 마이너스지만 시장보다는 탄력이 있고,  흐름도 좋다.      \xa0 표준편차 수익율  위험대비 수익율   삼성SDI 2.6% -0.2% 0.1   삼성전기 2.5% -10.1% -4.0   LG이노텍 2.4% -7.6% -3.1   LG디스플레이 2.3% -10.7% -4.6   LG전자 2.1% -11.3% -5.3   코스피 1.2% -5.2% -4.3   전기전자 1.7% -3.7% -2.1    관련종목들 상승 우위, 전기전자업종 +1.43%   이 시각 현재 관련종목들도 상승이 우세한 가운데 전기전자업종은 1.43% 상승중이다.  LG전자 64,600원▲1100(+1.73%) LG이노텍 127,500원▲2500(+2.00%)  삼성SDI 249,000원▲5500(+2.26%) LG디스플레이 18,000원▼50(-0.28%)    증권사 목표주가 211,800원, 현재주가 대비 54% 추가 상승여력    최근 한달간 제시된 증권사 투자의견을 종합해보면 삼성전기의 평균 목표주가는 211,800원이다.  현재 주가는 138,500원으로 73,300원(54%)까지 추가상승 여력이 존재한다.  증권사별로 보면  한국투자증권의 조철희 에널리스트가 "" 카메라모듈도 합세하는 서프라이즈 , 3분기 추정실적은 매출액 2조 3,060억원, 영업이익 3,780억원(컨센서스 3,374억원)이다. 전년 대비 매출액은 25.3% 늘어나는 것이고, 영업이익은 266.6% 증가하는 것이다. 영업이익은 전분기 대비로 82.9% 늘어나는 것이다. 기판사업부의 부진에도 실적 서프라이즈를 기록하는 주요인은 MLCC 호실적에 이어 카메라 모듈 사업부도 깜짝 이익률을 기록한 것으로 추정되기 때문이다…"" (이)라며 투자의견 매수(유지)에 목표주가:     210,000원을 제시했고, KB증권의 김동원, 황고운 에널리스트가 "" 4분기 가격인상은 서프라이즈, 최근 삼성전기 MLCC 사업부는 4분기 MLCC 고정가격을 평균 15% 인상한 것으로 추정되며, 시장 예상 (가격 인상 5%)을 3배 상회하는 서프라이즈로 판단된다. 이는 ① 글로벌 스마트 폰 수요가 침체된 상황에서 삼성전자, 애플 및 중화권 스마트 폰 업체들이 15% 수준의 MLCC 가격인상을 수용한 것으로 추정되고, ② 4분기 저가 (로우엔드: low-end)용 MLCC 가격하락을 우려하는 대만 MLCC 업체 전망과 상반되기 때문이다…"" (이)라며 투자의견 BUY(유지)에 목표주가:     220,000원을 제시했다.   8월1일에 삼성전기 2/4분기(2018년4월~6월)실적 발표됨  <발표치> 매출액 영업이익 당기순이익   2/4분기 1조8098.0억 2,068.0억 1,313.0억   직전분기 대비 10.4% 감소 34.3% 증가 13.4% 증가   전년동기 대비 5.8% 증가 192.6% 증가 246.8% 증가    [재무분석 특징]  영업이익률 현재 5.97%로 업종평균 상회. PER은 34.28로 업종평균보다 높으며, PBR은 2.18임.     업종내 시가총액 규모가 가장 비슷한 4개 종목과 비교해보면 삼성전기는 자산가치대비 현재의 주가수준을 나타내는 PBR과 순이익대비 현재의 주가수준을 보여주는 PER이 상대적으로 높은 상태를 보이고 있다.     삼성전기 LG전자 LG이노텍 LG디스플레이 삼성SDI   ROE 6.4 11.2 6.5 8.3 6.1   PER 34.3 6.0 23.0 5.2 23.2   PBR 2.2 0.7 1.5 0.4 1.4   기준년월 2018년6월 2018년6월 2018년6월 2018년6월 2018년6월 기관/개인 순매수, 외국인은 순매도(한달누적)기관이 9일연속 순매수를 보이고 있는 반면에 외국인은 17일연속 순매도를 보이고 있다.  4주간을 기준으로 보면 기관이 순매도를 기록하다가 다시 순매수로 돌아서면서 1,890,547주를 순매수했고, 개인들도 순매수량을 늘리며 3,907,696주를 순매수했다.  반면 그 동안 외국인은 매도 우위를 지속하면서 5,798,243주를 순매도했다.   투자주체별 누적순매수  상장주식수 대비 거래량은 1.86%로 적정수준최근 한달간 삼성전기의 상장주식수 대비 거래량을 비교해보니 일별 매매회전율이 1.86%로 집계됐다.  그리고 동기간 장중 저점과 고점의 차이인 일평균 주가변동률을 4.38%를 나타내고 있다. 거래비중 기관 17.43%, 외국인 34.08%최근 한달간 주체별 거래비중을 살펴보면 개인이 48.48%로 가장 높은 참여율을 보였고, 외국인이 34.08%를 보였으며 기관은 17.43%를 나타냈다.  그리고 최근 5일간 거래비중은 개인 비중이 51.19%로 가장 높았고, 외국인이 32.03%로 그 뒤를 이었다.  기관은 16.76%를 나타냈다.   투자주체별 매매비중  ＊기관과 외국인을 제외한 개인 및 기타법인 등의 주체는 모두 개인으로 간주하였음   주가와 투자심리는 약세, 거래량은 침체   현주가를 최근의 주가변화폭을 기준으로 본다면 하락폭이 상대적으로 큰 특징을 보이고 있고, 거래량 지표로 볼 때는 침체국면에 머물러 있다.  실리적인 측면에서는 약세흐름에 투자자들은 불안감을 느끼고 있고 이동평균선들의 배열도를 분석을 해보면 단기적으로나마 반등이 나올 수 있지만 추세하락은 이어지고 있는 실정이다.      현재주가 근처인 138,500원대에 주요매물대가 존재.   최근 세달동안의 매물대 분포를 살펴보면, 현주가대 근방에 138,500원대의 대형매물대가 눈에 뜨이고, 이중에서 138,500원대는 전체 거래의 16.1%선으로 가격대에서 뚜렷하게 크게 발생한 것은 아니지만 상대적으로 거래규모가 큰 구간이 되고 지금부터 주가가 어느 한방향으로 방향을 잡으면 강한 추세적 지지 또는 저항대가 될 가능성을 고려할 필요가 있고, 그리고 154,000원대의 매물대 또한 규모가 약하기는하지만 향후 주가상승시에 저항대로 작용할 수 있다.       [포인트검색]   10월10일 :삼성전기(주) 기업설명회(IR) 개최(안내공시)10월10일 :삼성전기(주) 결산실적공시 예고(안내공시) 증시분석 전문기자 로봇 ET etbot@etnews.com전자신문과 씽크풀의 증시분석 전문기자 로봇 ET가 쓴 기사입니다▶ 코리아 UX를 리드하는 담론의 현장 - HCI & UX 코리아 2019▶ 네이버 모바일에서 [전자신문] 채널 구독하기▶ 전자신문 바로가기 [Copyright ⓒ 전자신문 & 전자신문인터넷, 무단전재 및 재배포 금지]전자신문 관련뉴스해당 언론사에서 선정하며 언론사 페이지(아웃링크)로 이동해 볼 수 있습니다.중국 전기차·배터리 공장 한국에 짓는다...""中공세 신호탄""LG디스플레이, 中 레노버와 폴더블 태블릿 만든다…13인치 패널 공급 추진세단·SUV·디젤 PHEV 국내 출격 준비 中…""내년 PHEV 시장 뜨겁다""SBA, \'2018 해외바이어 초청 수출 상담회@G밸리\' 성료한국지엠 R&D 법인 설립 두고 커지는 노사갈등…파업 가능성↑좋아요0훈훈해요0슬퍼요0화나요0후속기사 원해요0기사제공 :이 기사는 뉴스제휴평가위원회 \'뉴스제휴 및 제재 심사 규정\'에 따라노출 중단된 기사입니다.이전페이지목록보기인쇄하기목록보기증시 주요뉴스[Asia오전]얀센發 코로나 백신 수급 우려에..[오전시황]돌아온 외국인 코스피 소폭 올라 3..[외환브리핑]美 물가지표 최고치에도 달러화 약..존슨앤존슨 여파에도 S&P 최고치...""韓 기..[굿모닝 증시]美증시 J&J 백신 우려속 혼조..[원자재시황] 국제유가, 中경제지표 개선·수요..[유럽증시] J&J 코로나19 백신 우려에도 ..[모닝브리핑] 미 보건당국 ""J&J 백신 사용..이전 페이지로 돌아가기|맨위로더보기돌아온 배당 시즌…내 배당금 지급일은존슨앤존슨 여파에도 S&P 최고치...""韓 기술주, 실적 개선주 주목해야""[당신의 돈] 국민연금이 국내 주식 비중 늘린다는데... 주가 오를까요?美반도체 \'강력 드라이브\'…소부장株엔 어떤 영향?[오전시황]돌아온 외국인 코스피 소폭 올라 3,170선...천스닥 안착하반기도 대어급 IPO 줄서네…\'카뱅·현대엔지니어링\' 시장 입성 예고[Asia오전]얀센發 코로나 백신 수급 우려에 日증시 하락세캐시 우드 ""전기차 잇는 혁신 트렌드는 디지털 지갑·유전체""더보기인기검색어한화투자증권우33,800삼성전자84,000한화투자증권5,830두산중공업14,350남양유업360,500이용약관금융게시판 운영원칙개인정보처리방침책임의 한계와 법적고지금융 고객센터네이버(주)가 제공하는 금융 정보는 각 콘텐츠 제공업체로부터 받는 투자 참고사항이며, 오류가 발생하거나 지연될 수 있습니다.네이버(주)와 콘텐츠 제공업체는 제공된 정보에 의한 투자 결과에 법적인 책임을 지지 않습니다. 게시된 정보는 무단으로 배포할 수 없습니다.콘텐츠 제공업체코스콤 : 실시간 주가정보 및 국내시세정보에프앤가이드 : 기업 및 재무정보KG제로인 : 해외 시세, 시장지표 및 펀드 정보한국예탁결제원 : 주주총회일 및 전자투표 정보인포스탁 : 국내 테마 정보Copyright ©NAVER Corp.All Rights Reserved.']"
15,삼성전자, 2018-10-1713:54,한국일보 ,"삼성전자 네트워크 기업 지랩스 인수, 5G 경쟁력 높인다",https://finance.naver.com/news/news_read.nhn?article_id=0000334616&office_id=469&mode=search&query=삼성전자&page=6,"['       삼성전자 네트워크 기업 지랩스 인수, 5G 경쟁력 높인다      기사입력2018-10-17 13:54기사원문좋아요훈훈해요좋아요 평가하기공감좋아요0훈훈해요0슬퍼요0화나요0후속기사 원해요0댓글삼성전자가 네트워크 트래픽과 서비스 품질 분석 등에 강점을 가진 스페인의 솔루션기업지랩스(Zhilabs) 지분을 100% 인수했다고 17일 밝혔다. 내년 본격화하는 5세대(G) 이동통신 시대에 기술 경쟁력을 높이기 위해서다. 삼성전자가 네트워크 기술 기업을 인수한 것은 처음이다.2008년 설립된 지랩스는 통신 네트워크 상태와 성능, 트래픽 등을 분석해 서비스 품질을 측정하고 네트워크 운영 자동화 솔루션을 전 세계 50여 통신사에 제공 중이다. 직원 수는 40명 안팎에 불과하지만 글로벌 시장에서 기술력을 인정 받고 있다. 지랩스는 주인이 바뀌었어도 현 경영진이 계속 독자적으로 운영한다.5G 시대에는 사물인터넷(IoT)과 커넥티드카(Connected Car) 등 다양한 통신서비스 별 가상화된 네트워크(Network Slice) 운영이 요구된다. 현재는 특정 지역 가입자들의 통신속도 합계나 지연 시간 등을 바탕으로 통신 네크워크 품질을 측정하지만, 앞으로는 개별 네트워크 서비스의 품질 측정과 분석 수요도 커질 전망이다. 삼성전자는 네트워크 장비 기술에 지랩스의 분석 노하우를 결합, 사용자 중심의 5G 네트워크 기술 혁신을 도모할 계획이다. 삼성전자 네트워크사업부 김영기 사장은 “4차 산업혁명의 플랫폼인 5G는 새로운 서비스로 무한히 확장될 것”이라며 “지랩스와 협력해 글로벌 통신사업자들의 5G 인프라 구축을 지원하겠다”고 밝혔다. 후안 레반토스 지랩스 최고경영자(CEO)는 “삼성전자의 일원으로 기술 협력을 통한 사업 시너지를 극대화하겠다”고 말했다.김창훈 기자 chkim@hankookilbo.com▶[개편이벤트] 참여하면 화장품세트와 블루투스 스피커를 드려요!▶네이버 채널에서 한국일보를 구독하세요!\xa0한국일보 관련뉴스해당 언론사에서 선정하며 언론사 페이지(아웃링크)로 이동해 볼 수 있습니다.이낙연 ""文 인기에 얹혀간다? 놀고 있는 내각 아냐""""옷 태 안 난다"" 김정숙 여사 패션 지적한 강용석3년간 건보 청구 0건 보험 환자 안 받는 수상한 병원들공유, 영화 \'82년생 김지영\'서 정유미 남편 역 캐스팅연기생활 26년 커리어에 오점 남긴 배우 김지수는 누구?좋아요0훈훈해요0슬퍼요0화나요0후속기사 원해요0기사제공 :']"
16,삼성전자, 2018-10-1713:51,디지털타임스 ,"㈜엠씨넥스 민동욱 대표이사 장내 추가매수, 2018년 지속적인 실적개선 기대",https://finance.naver.com/news/news_read.nhn?article_id=0002487420&office_id=029&mode=search&query=삼성전자&page=6,"['       ㈜엠씨넥스 민동욱 대표이사 장내 추가매수, 2018년 지속적인 실적개선 기대      기사입력2018-10-17 13:51기사원문좋아요훈훈해요좋아요 평가하기공감좋아요0훈훈해요0슬퍼요0화나요0후속기사 원해요0댓글10월 17일 전자공시에 의하면 ㈜엠씨넥스의 최대주주인 민동욱 대표이사가 장내 매수한 것으로 공시됐다. 이로써 엠씨넥스 민동욱 ㈜엠씨넥스 대표이사 및 특수관계인은 2018년 장내에서 20억이 넘는 금액의 주식을 매수하며 전방시장과 대외경기 요소의 불안감으로 하락중인 주가를 지속적으로 방어하고 있다.최근 대한민국 주가지수는 미국 연방준비위원회의 금리인상, 중미 무역전쟁 등의 대외적인 요소들로 코스피와 코스닥 모두 지속적인 하락세에 있다. 하지만 ㈜엠씨넥스는 어려운 대외상황에도 2018년 실적개선에 대한 자신감을 보이고 있으며, 2017년에 이어 2018년도 삼성전자 프리미엄급 제품부터 중저가 라인업까지 스마트폰 카메라모듈, 생체인식모듈, 구동계 등을 안정적으로 공급하고 있다. 특히 2018년은 구동계 사업의 매출 증가와 듀얼, 트리플, 쿼드 등의 카메라모듈의 매출 증가가 예상되며 이를 통한 수익성 개선이 추가적으로 전망되고 있다. 엠씨넥스 관계자는 ""최근 듀얼, 트리플, 쿼드 등의 카메라 수량확대와 전면부 카메라의 구동계 탑재 등으로 구동계 매출이 증가될 것으로 예상된다""라며 시장변화에 따른 구동계 사업의 확대에 대해 말했다.엠씨넥스는 지난 2016년부터 지속적인 수익구조 개선으로 수익률을 개선하며 2017년 약 197억의 영업이익을 기록, 흑자전환에 성공했고 2018년 반기보고서에 의하면 누적기준 약 142억의 영업이익(이익율 4.45%)을 기록하며 지속적인 이익개선 추세를 보여주고 있다. 민동욱 대표이사는 ""이익구조 개선과 신규사업(생체인식, 구동계)의 안정화를 이어나가며 시장 변화에 발맞출 수 있게 더욱 노력하겠다""라고 말했다.imkt@dt.co.kr 디지털타임스 홈페이지 바로가기 / 디지털타임스 뉴스 더보기네이버 채널에서 \'디지털타임스\'를 구독해주세요.디지털타임스 관련뉴스해당 언론사에서 선정하며 언론사 페이지(아웃링크)로 이동해 볼 수 있습니다.남양유업, 우유 가격 4.5% 인상…1ℓ→900㎖로 용량 줄여""2018 10월 모의고사, 나는 몇 등급?""1회충전 600km 주행 현대 수소車… 국내외 주문 쇄도김포맘카페 \'충격\'...교사 극단적 선택에 추모 물결""밤하늘 불꽃도 선명""… DSLR 뺨치는 LG \'V40 씽큐\' 펜타 카메라좋아요0훈훈해요0슬퍼요0화나요0후속기사 원해요0기사제공 :']"
17,삼성전자, 2018-10-1713:48,뉴스1 ,“CO₂누출사고 골든타임 놓친 것은 삼성의 오만”,https://finance.naver.com/news/news_read.nhn?article_id=0003642366&office_id=421&mode=search&query=삼성전자&page=6,"['       “CO₂누출사고 골든타임 놓친 것은 삼성의 오만”      기사입력2018-10-17 13:48기사원문좋아요훈훈해요좋아요 평가하기공감좋아요0훈훈해요0슬퍼요0화나요0후속기사 원해요0댓글이재명, 페이스북서 강조…“모든 조치 취해 재발 막겠다”이재명 경기도지사/뉴스1 © News1 오장환 기자(경기=뉴스1) 진현권 기자 = 이재명 경기도지사는 17일 “삼성전자 CO₂누출사고, 반복되는 비극을 반드시 막겠다”고 밝혔다.이 지사는 이날 오후 자신의 페이스북에 “삼성전자 CO₂누출사고 발생 직후 다섯 차례에 걸쳐 경기도 자체 긴급조사를 실시했다. 그 결과를 살펴보니 이번 사고가 더욱 안타깝다”면서 이같이 말했다.이 지사는 “소방시설 점검결과를 거짓으로 보고하지만 않았더라면, 안전성이 확실히 담보된 밸브가 달려있었더라면, 맥없이 파손돼버린 석고보드 벽만 아니었더라면, 경보설비가 작동 중지된 상태가 아니었더라면, 사상자들에 대한 응급처치 골든타임을 놓치지만 않았더라면 안전을 담보로 목숨 내놓고 일하던 하청업체 노동자들이 희생되는 이 비극을 막을 수 있었다”고 주장했다.이 지사는 “이미  오방출 사망사고의 전례가 있음에도 불구, 안전관리를 이토록 태만히 하면서도  CO₂사고 후 긴급 상황에 자체적으로 대응해 골든타임을 놓친 것은 명백한 삼성의 오만”이라며 “반복되는 비극의 씨앗을 뿌리 뽑기 위해 할 수 있는 모든 법적, 행정적 조치를 취하겠다”고 밝혔다.이 지사는 이어 “국민의 안전과 생명을 위협하는 행위에 관용이란 없을 것이다. 그러나 제 권한 내에서 할 수 있는 모든 것을 다 해봐도 여전히 ‘위험의 외주화’라는 부당한 노동환경에서 죽음을 맞은 희생자들의 억울함을 다 해소할 길이 없어 참담한 심정이다. 반드시 재발을 막아 희생자의 넋을 위로하겠다”고 약속했다.김기도는 앞서 이날 오전 경기도청에서 ‘삼성전자 이산화탄소 누출사고에 대한 경기도 긴급조사 중간 결과’를 발표하고, 삼성전자를 소방시설법 위반으로 검찰에 송치하고, 응급의료법 위반, 소방안전관리자의 업무 태만 등을 이유로 과태료 처분키로 했다고 밝혔다.중간조사 결과, 삼성전자가 사고 당일인 지난달 4일 경보설비를 연동정지 상태로 관리해 소방시설이 정상작동하지 않았고, 시공업체도 소방기술자를 배치하지 않은 것으로 드러났다.이로 인해 작업자가 배선 철거 중 정상배선을 노후 배선으로 오인 절단하면서 이산화탄소가 누출돼 사상자가 발생한 것으로 확인됐다. 이 사고로 협력업체 직원 2명이 사망하고, 1명이 중상을 입었다.jhk102010@news1.kr▶ 진짜 블록체인을 만나는 곳 \'크립토허브\' 오픈! ▶ 글로벌바이오포럼 2018 참가하기▶ 네이버 메인에서 [뉴스1]을 구독해주세요[© 뉴스1코리아(news1.kr), 무단 전재 및 재배포 금지]뉴스1 관련뉴스해당 언론사에서 선정하며 언론사 페이지(아웃링크)로 이동해 볼 수 있습니다.""심야 택시잡기 별따기""…카풀반대 택시파업 여론 \'싸늘\'""100만원 훌쩍 넘는 프리미엄 패딩 매출 300% 증가""""나 특수부대 나왔다""…전 여친 치마에 오줌싸아내 제왕절개 안해준 의사 3명 폭행한 남편반신불수 부친 방치…父 사망 전 40여㎏ 빠져좋아요0훈훈해요0슬퍼요0화나요0후속기사 원해요0기사제공 :']"
18,삼성전자, 2018-10-1713:37,KBS ,"삼성, 네트워크 솔루션기업 ‘지랩스’ 인수…“5G 경쟁력 강화”",https://finance.naver.com/news/news_read.nhn?article_id=0010630355&office_id=056&mode=search&query=삼성전자&page=6,"['       삼성, 네트워크 솔루션기업 ‘지랩스’ 인수…“5G 경쟁력 강화”      기사입력2018-10-17 13:37기사원문좋아요훈훈해요좋아요 평가하기공감좋아요0훈훈해요0슬퍼요0화나요0후속기사 원해요0댓글 삼성전자는 오늘(17일) 차세대 네트워크 트래픽, 서비스 품질 분석 전문 솔루션 기업 지랩스(Zhilabs) 지분을 100% 인수했다고 밝혔습니다.  삼성전자가 네트워크 사업 관련 업체를 인수한 것은 이번이 처음입니다. 삼성전자는 이번 인수로 인공지능(AI), 전장, 바이오와 함께 4대 미래 성장 사업으로 꼽은 5G 경쟁력이 강화될 것으로 기대하고 있습니다. 인수 금액은 알려지지 않은 가운데 지랩스는 삼성전자 인수 이후에도 현재 경영진에 의해 독자적인 경영을 이어가게 된다고 삼성전자는 설명했습니다. 지랩스는 2008년 스페인에서 설립됐다. 통신 네트워크의 상태, 성능, 데이터 트래픽 등을 서비스별로 분석해 사용자가 실제로 느끼는 서비스 품질을 측정하고 네트워크 운영을 자동화하는 솔루션을 영국 보다폰, 스페인 텔레포니카 등 전 세계 50여개 통신사에 제공하고 있습니다. 삼성전자는 또 지랩스가 네트워크 트래픽 분석에 인공지능 기술을 도입해 기저 원인 분석(Root Cause Analysis), 자동 장애복구와 최적화(Auto trouble shooting & Optimization) 등을 효과적으로 수행할 수 있는 기술을 보유하고 있다고 설명했습니다.[사진 출처 : 연합뉴스]최영철기자 (julio@kbs.co.kr)[저작권자ⓒ KBS 무단복제-재배포 금지]▶ 네이버 채널 KBS뉴스 구독! 시원하게 털어드립니다▶ ‘TV보다 리얼’한 색다른 뉴스!KBS 관련뉴스해당 언론사에서 선정하며 언론사 페이지(아웃링크)로 이동해 볼 수 있습니다.유튜브 서버 복구…1시간 이상 먹통에 이용자 원성 빗발캠핑카에서 일가족 참변…기온 \'뚝\' 안전 주의보""무혐의 걱정마"" 우병우, \'몰래변론\' 수임료 10억 5천만 원""실종 사우디 언론인 영사관에서 살해 뒤 시신 훼손""""대마초 피워도 안잡혀가요"" 캐나다 오늘부터 합법화좋아요0훈훈해요0슬퍼요0화나요0후속기사 원해요0기사제공 :']"
