,회사명,날짜,언론사,기사제목,링크,본문
2,삼성전자, 2018-03-1414:02,시사저널 ,"김홍국 하림 회장, 대표직 사임해도 여전히 ‘대주주’",https://finance.naver.com/news/news_read.nhn?article_id=0000000820&office_id=586&mode=search&query=삼성전자&page=3,"['       김홍국 하림 회장, 대표직 사임해도 여전히 ‘대주주’      기사입력2018-03-14 14:02기사원문좋아요훈훈해요좋아요 평가하기공감좋아요0훈훈해요0슬퍼요0화나요0후속기사 원해요0댓글김 회장, ‘대주주’ 책임까지 피할 순 없어…하림, 담합 등 혐의로 조사 받는 중 대기업 창업자들이 잇따라 등기이사직을 내려놓고 있다. 지난달엔 네이버가 그랬고, 이번엔 하림이다. 하림식품은 3월12일 “김홍국 회장이 2월27일부로 대표이사직에서 사임했다”고 공시했다. 이를 바라보는 외부의 시선은 곱지 않다. 하림이 공정위의 타깃이 된 상황에서 내려진 결정이기 때문이다. 김 회장이 개인 지분까지 내려놓지 않으면 달라질 게 없다는 분석도 나온다.\xa0김홍국 하림그룹 회장이 2017년 3월16일 경기 성남시 분당구 판교로 NS홈쇼핑 별관에서 열린 나폴레옹 갤러리 오픈행사에서 인사말을 하고 있다. NS홈쇼핑은 김홍국 하림그룹 회장이 경매를 통해 소장하고 있는 나폴레옹 이각모와 관련 유물 8점을 전시하는 \'나폴레옹 갤러리\'를 이날부터 공식 운영한다. © 사진= 연합뉴스하림 김홍국 회장, 하림식품 대표이사직 사임하림을 설립한 김홍국 회장은 그야말로 닭 팔아 떼돈을 번 인물이다. 양계업체로 시작한 하림은 육가공 과정을 수직계열화하면서 국내 관련업계 1위 기업으로 성장했다. 2015년엔 해상운송업체 팬오션을 인수하면서 단숨에 자산 10조원 이상의 대기업 그룹으로 뛰어올랐다. 이는 지난해 공정위로부터 ‘상호출자제한 기업집단(대기업집단)’으로 지정된 배경이 됐다.\xa0하림을 향한 공정위의 집중 감시가 시작된 것도 이때부터다. 지난해 6월 김상조 공정위원장이 취임한 뒤 올 3월 초까지 하림은 총 7번의 현장조사를 받았다. 담합과 일감 몰아주기 등의 혐의였다.\xa0편법 증여 의혹도 있다. 지난 2012년 김 회장이 장남 김준영씨에게 계열사 올품의 지분 100%를 물려준 과정이 문제였다. 올품은 하림그룹의 지배구조 꼭대기에 있는 알짜기업이다. 지난해 7월엔 “하림이 중소기업을 헐값에 사들였다”는 의혹이 시사저널 단독보도로 알려진 적도 있다. (☞ 2017년 7월6일 )각종 의혹에 ‘공정위 타깃’ 된 하림…“김 회장 사임과 무관치 않아”일련의 불미스러운 일 때문에 업계에선 “김 회장의 등기이사 사임이 공정위 조사와 무관치 않다”는 분석을 내놓고 있다. 단 이사직에서 물러난다고 해도, 과거 등기이사로 재직하던 중에 일어났던 불법 행위에 대한 책임까지 사라지는 건 아니다. 이사회 구성원인 등기이사는 회사에 대한 법적 책임을 지기 때문이다.\xa0영향력이 사라진다고 단정하기도 어렵다. 김경률 참여연대 집행위원장(회계사)은 “이건희 삼성그룹 회장이 삼성전자 이사직에서 사퇴했을 때도 여전히 지배력을 행사했다”며 “등기이사가 아니더라도 ‘사실상의 이사’로서 실질적으로 이사직을 수행하는 걸 법적으로 막을 순 없다”고 했다. 법무법인 김앤장 소속의 한 변호사는 “사실상의 이사는 등기이사가 아니라도 법적 책임을 질 수 있다”고 설명했다. 게다가 김 회장은 여전히 하림그룹의 대주주다.\xa0하림그룹의 중간지주회사인 하림홀딩스 관계자는 “김 회장의 하림식품 등기이사 사임과 지분구조는 상관이 없다”면서 “김 회장의 지분율은 그대로다”고 했다. 지금도 강한 입김을 미치고 있다는 뜻이다.\xa02017년 3월16일 경기 성남시 분당구 판교로 NS홈쇼핑 별관 나폴레옹 갤러리에서 관람객들이 전시장을 둘러보고 있다. NS홈쇼핑은 김홍국 하림그룹 회장이 경매를 통해 소장하고 있는 나폴레옹 이각모와 관련 유물 8점을 전시하는 \'나폴레옹 갤러리\'를 이날부터 공식 운영한다. © 사진=연합뉴스대표 사임하면 끝?…‘대주주’ 지위엔 변동 없어또 김홍국 회장은 하림식품을 제외한 ㈜하림, NS홈쇼핑, 팬오션 등 11개 계열사에서 계속 등기이사를 맡고 있다고 한다. 하림 관계자는 “앞으로 김 회장이 역할을 다했다고 판단한 계열사들의 이사직을 순차적으로 내려놓을 것”이라고 했다.\xa0창업주가 등기이사 명패를 내린 건 네이버도 마찬가지다. 이해진 네이버 창업자 겸 글로벌투자책임자(GIO)는 2월26일 이사회에서 사내이사직 사임을 결정했다. 나아가 이 GIO는 주식 매각까지 발표했다. 2월28일 공시를 통해 “주식 19만 5000주를 팔았다”고 밝힌 것. 이에 따라 그의 지분율은 기존 4.31%에서 3.72%로 떨어졌다.\xa0하지만 의심의 눈초리는 이어지고 있다. “공정위의 대기업 총수 지정을 피하려고 주식을 처분한 것 아니냐”는 추측이 있기 때문이다. 공정위는 지난해 9월 이 GIO의 지분율과 영향력을 근거로 그를 네이버 총수로 지정했다. 총수가 되면 기업과 동일인으로 간주되는 동시에 일감 몰아주기 규제를 받는다.\xa0공성윤 기자  niceball@sisajournal.com시사저널 관련뉴스해당 언론사에서 선정하며 언론사 페이지(아웃링크)로 이동해 볼 수 있습니다.""김정은, 호탕하고 자신감 넘치는 유학파 느낌""포토라인 앞에 설 MB 전략은? \'모르쇠\' 일관시진핑의, 시진핑에 의한, 시진핑을 위한 中전인대정부 재건축 규제 강화에 \'목동 아줌마\'들 뿔났다[뉴스브리핑] 검찰 소환된 MB ""하고 싶은 말 많지만···""좋아요0훈훈해요0슬퍼요0화나요0후속기사 원해요0기사제공 :']"
3,삼성전자, 2018-03-1414:00,한국경제TV ,[이 시각 코스피] 코스피 현재 2484.58p 하락세 지속,https://finance.naver.com/news/news_read.nhn?article_id=0000611126&office_id=215&mode=search&query=삼성전자&page=3,"['       [이 시각 코스피] 코스피 현재 2484.58p 하락세 지속      기사입력2018-03-14 14:00기사원문좋아요훈훈해요좋아요 평가하기공감좋아요0훈훈해요0슬퍼요0화나요0후속기사 원해요0댓글[한국경제TV 라이온봇 기자][코스피 장중 시황]3월 14일 14시 0분 코스피는 전일 대비 9.91p(-0.4%) 하락한 2484.58p를 기록하고 있다.규모별로는 소형주(0.06%)만 홀로 상승세를 나타냈다. 대형주(-0.36%)와 중형주(-0.85%)는 약세 흐름을 나타내고 있다.[업종동향][그림 1] 업종별 상위 TOP5 (단위 : %)[그림 2] 업종별 하위 TOP5 (단위 : %)업종별로는 하락이 우세하다.운수창고(1.52%), 의료정밀(0.68%), 전기,전자(0.5%), 운수장비(0.16%), 기계(0.08%) 등은 상승세를 나타냈다.  반면, 보험(-0.01%), 섬유의복(-0.07%), 제조업(-0.1%), 종이,목재(-0.15%), 화약(-0.64%), 의약품(-0.72%), 음식료품(-0.72%), 금융업(-0.8%), 서비스업(-0.89%), 전기가스업(-0.89%), 통신업(-1%), 비금속광물(-1.13%), 유통업(-1.3%), 증권(-1.5%), 은행(-1.51%), 건설업(-2.13%), 철강,금속(-2.59%) 등은 하락세를 나타냈다. [시가총액 상위 종목 동향]시가총액 상위 10개 기업은 하락이 우세하다.""대장주"" 삼성전자는 전일(2,583,000원) 대비 14,000원(0.54%) 오른 2,597,000원에 거래되고 있다.현대차(1.3%), LG화학(0.37%), SK하이닉스(0.33%) 등은 강세를 보이고 있다. 반면에, 셀트리온(-0.16%), 삼성물산(-0.37%), KB금융(-1.13%), NAVER(-1.34%), 삼성바이오로직스(-1.77%), POSCO(-3.96%) 등은 약세를 보이고 있다. 라이온봇 기자 -한국경제TV※ 본 기사는 한국경제TV와 \'거장들의 투자공식이\'자체 개발한 \'라이온봇 기자\'가 실시간으로 작성한 기사입니다.라이온봇기자 ⓒ 한국경제TV, 무단 전재 및 재배포 금지한국경제TV 관련뉴스해당 언론사에서 선정하며 언론사 페이지(아웃링크)로 이동해 볼 수 있습니다.김종국 집 공개…못 말리는 \'블랙\' 사랑, \'검종국\' 등극배우 김혜선, 20살 때 \'삭발\'하고 다녀…이유는?정재성 사망, ""아내가 시신 발견""기성용, 왼손 국기에 대한 경례…이유가?구하라 집 공개, 영&리치의 논현동 자수성가하우스 \'입이 쩍\'좋아요0훈훈해요0슬퍼요0화나요0후속기사 원해요0기사제공 :']"
4,삼성전자, 2018-03-1413:58,한국경제TV ,[11시 시황]지수 숨고르기에도 2차전지섹터 수혜 기대에 강세,https://finance.naver.com/news/news_read.nhn?article_id=0000611123&office_id=215&mode=search&query=삼성전자&page=3,"['       [11시 시황]지수 숨고르기에도 2차전지섹터 수혜 기대에 강세      기사입력2018-03-14 13:58기사원문좋아요훈훈해요좋아요 평가하기공감좋아요0훈훈해요0슬퍼요0화나요0후속기사 원해요0댓글[한국경제TV 오세인 기자]11시 시장분위기 전해드리겠습니다.2차전지섹터가 폭스바겐 투자 수혜 기대감에 강세를 보이고 있습니다.폭스바겐은 2030년까지 전기차 배터리 생산 공장에 68조원을 투자할 계획이라고 밝혔는데요. 이에 따라 삼성SDI, 코스모화학, 씨아이에스, 에코프로 등 전반적으로 대부분의 종목들이 강한 상승을 시현중에 있습니다.그러나 시장은 대조적입니다.국내시장 힘을 내지 못하며 쉬어가는 모습인데요. 5거래일 만에 하락 전환한 양 시장, 오전장 내내 하락권에서 벗어나지 못하고 있습니다.현재 이 시각 코스피지수 2,477.19P(-0.69%)지나가고 있습니다.코스닥지수도 0.50% 하락한 881.83P입니다.지수 조정에는 수급이 받쳐주지 못하고 있는데요. 코스피에서 외국인과 기관의 쌍끌이 매도가 나타나고 있습니다.외국인 709억원, 기관 697억원 팔고 있습니다.코스닥에서도 외국인과 기관 동반 매도 중입니다. 외국인 610억원, 기관 486억원 순매도입니다. 매도금액이 조금씩 늘어나고 있는 상황입니다.코스피시가총액도 확인하겠습니다.외국인이 1달 동안 삼성전자와 SK하이닉스를 큰 폭으로 매수하며 주가가 상승했는데요. 오늘은 쉬어가는 모습입니다.다만 SK하이닉스 등락 거듭 반복하며 강보합권에 머무르고 있습니다.2차전지 섹터 강세를 보여주는 가운데 LG화학은 전기차배터리부문에 포부를 밝히기도 했습니다. 현재 이 시각, 0.85% 오름세입니다.코스닥 시가총액 상위도 확인합니다.포스코켐텍 외국인과 기관 동반 매수로 3.30% 오름세입니다.제약바이오주 소폭 반등에 나선 가운데 네이처셀이 어제에 이어 오늘도 52주 신고가를 경신했습니다.네이처셀은 FTSE지수 편입 기대감에 7거래일 연속으로 올랐습니다.오늘 화장품주와 면세점주가 조정보이고 있습니다.북미정상회담 기대감에 중국소비주 최근 상승했는데요.이 가운데 화장품주와 면세점주는 하락을 면치 못하는 상황입니다.조선주도 조정입니다.업황 회복 기대감에 강세를 보였던 조선주에 차익실현에 밀리는 모습으로 삼성중공업, 한진중공업, 현대중공업, 현대미포조선 등 일제히 파란불을 켜고 있습니다.두산그룹주는 전반적으로 오르고 있습니다. 두산엔진 분할 매각 소식인데요. 두산엔진이 분할을 통해 사업 부문은 사모펀드에 매각되고 투자 부문은 두산중공업에 합병될 예정이라는 소식이 투자심리를 자극했습니다.이와 관련해 두산중공업은 두산엔진 지분 전량(42.66%)을 국내 사모펀드 소시어스 웰투시 컨소시엄에 매각하기로 계약을 체결했다고 전날 장 마감 후 공시했습니다.현재 이 시각, 두산엔진 27.01% 급등입니다.알리코제약, 지난해 호실적에 8.80% 오르고 있습니다.전날 알리코제약은 지난해 개별기준 영업이익이 전년 보다 119.32% 증가한 89억원, 매출액은 전년 대비 48.27% 증가한 714억원으로 공시했습니다.키이스트는 에스엠 피인수 소식에 하락하며 7.10% 내림세입니다.키이스트 최대주주인 탤런트 배용준씨가 보유 지분  25.12% 전량을 에스엠에 넘긴다고 전일 공시했습니다. 이 소식이 전해지며 에스엠과 함께 동반으로 하락 중입니다.오세인기자 ⓒ 한국경제TV, 무단 전재 및 재배포 금지한국경제TV 관련뉴스해당 언론사에서 선정하며 언론사 페이지(아웃링크)로 이동해 볼 수 있습니다.김종국 집 공개…못 말리는 \'블랙\' 사랑, \'검종국\' 등극배우 김혜선, 20살 때 \'삭발\'하고 다녀…이유는?정재성 사망, ""아내가 시신 발견""기성용, 왼손 국기에 대한 경례…이유가?구하라 집 공개, 영&리치의 논현동 자수성가하우스 \'입이 쩍\'좋아요0훈훈해요0슬퍼요0화나요0후속기사 원해요0기사제공 :']"
5,삼성전자, 2018-03-1413:58,한국경제TV ,"[수급탑픽]2차전지 관련주, 쌍끌이 매수에 강세",https://finance.naver.com/news/news_read.nhn?article_id=0000611122&office_id=215&mode=search&query=삼성전자&page=3,"['       [수급탑픽]2차전지 관련주, 쌍끌이 매수에 강세      기사입력2018-03-14 13:58기사원문좋아요훈훈해요좋아요 평가하기공감좋아요0훈훈해요0슬퍼요0화나요0후속기사 원해요0댓글[한국경제TV 권다영 기자]실시간으로 외국인과 기관이 어떤 종목에 매수를 집중하고있는지 살펴보자.수급우수종목이다. 주가를 고려했을때 강도면에서 강한 수급이 들어오는 종목이다.거래소에서 외국인이 전체적으로 매도하고있지만 업종별로는 대형주를 필두로 전기전자, 화학주, 의약품에 매수를 하는 모습이다. 하지만 2차전지 관련주 이외에 어떤 업종에 매수가 몰리는 것은 아닌 흐름이다.두산엔진의 인적분할과 매각이 두산엔진과 두산중공업 모두에게 호재라는 분석이 나오면서 두산중공업이 상단에 올라왔다. 외국인과 개인 모두 매수에 나서면서 주가를 끌어올리고있다. 두산중공업과 함께 두산엔진도 18%가량 급등중이다.시총 상위 대부분 조정세인 가운데 2차전지 관련주들이 눈에 띈다. 특히나 LG화학의 경우 중국시장으로 더 집증할 예정이라는 뉴스가 나오기도 했다. 1%대의 상승폭을 지켜내가는 힘은 역시나 외국인 매수세다. 누적금액으로 봐도 50억원 넘게 매수하고, 기관도 함께 매수에 나서면서 빨간불을 켰다.삼성SDI도 2차전지 관련주들이 반도체호조와 중국 해빙무드에 힘입어 흐름이 좋다. 조정장세에서도 강세 기록중이다. 고용량 ESS전용 배터리로 글로벌시장 공략에 나선다는 소식이 전해지기도했다. 장초반에 외국인이 매도에 나섰지만 9시 30분을 기점으로 매수로 돌아서고 기관이 5거래일째 사들이면서 주가도 탄력적이다.SK하이닉스는 하락출발했지만 점차 낙폭을 키워가고있다. 역시나 외국인 수급의 힘을 받는 종목이다. 미국시장에서 퀄컴을 필두로 반도체주들이 조정을 받으면서 삼성전자는 조정세이지만 SK하이닉스는 낙폭을 줄여내며 보합권에서 흐름을 유지하고있다. 장 초반부터 외국인이 210억원 넘게, 기관도 70억원 가까이 매수하고 있다.일진머티리얼즈는 전기차 시장 성장 수혜 기대감이 커지고있다. 4분기 아쉬운 성적이었지만 펀더멘털에 문제 없다는 증권사 분석이 나왔고, 기관이 20억원 넘게 사들이면서 5%넘게 강세를 기록하고있다.코스닥시장에서는 바이오주와 반도체 관련주, 2차전지 관련주에 역시나 수급이 몰리고있다.텔콘은 자회사 비보존이 진통제 신약 임상2b상을 종료할 것이란 소식에 어제도 8% 넘게 급등했는데 오늘도 기관 매수에 힘입어 상승세를 지켜가고있다.이외의 오스코텍, JW신약, 테라젠이텍스, 바이오니아 등 바이오주들에도 수급이 몰리고있다.2차전지 관련주인 에코프로, 상아프론테크, 엘앤에프에는 기관의 매수세가 몰리면서 주가를 끌어올리고있다. 반도체 관련주 SKC 솔믹스, SKC코오롱PI에도 외국인의 매수가 들어가고있다.오늘 화장품주들은 종목별 장세가 펼쳐지는 가운데, 코스온은 장초반부터 기관이 매수에 나서고있다.수급탑픽종목이다. 주가, 상승률,  수급강도를 고려했을때 오늘 주목해보면 좋을만한 종목들이 선정이 된다. 오늘은 텔콘이 코스닥시장에서 선정되었다. 자회사 비보존의 모멘텀이 점차 부각되고있다.제공하는 정보는 추정치이기 때문에 지연과 오차가 있을수 있다. 투자에 유의하시기 바란다.권다영기자 ⓒ 한국경제TV, 무단 전재 및 재배포 금지한국경제TV 관련뉴스해당 언론사에서 선정하며 언론사 페이지(아웃링크)로 이동해 볼 수 있습니다.김종국 집 공개…못 말리는 \'블랙\' 사랑, \'검종국\' 등극배우 김혜선, 20살 때 \'삭발\'하고 다녀…이유는?정재성 사망, ""아내가 시신 발견""기성용, 왼손 국기에 대한 경례…이유가?구하라 집 공개, 영&리치의 논현동 자수성가하우스 \'입이 쩍\'좋아요0훈훈해요0슬퍼요0화나요0후속기사 원해요0기사제공 :']"
6,삼성전자, 2018-03-1413:58,뉴시스 ,"원익홀딩스, 삼성전자와 352억원 규모 제품 공급계약",https://finance.naver.com/news/news_read.nhn?article_id=0008485779&office_id=003&mode=search&query=삼성전자&page=3,"['       원익홀딩스, 삼성전자와 352억원 규모 제품 공급계약       기사입력2018-03-14 13:58기사원문좋아요훈훈해요좋아요 평가하기공감좋아요0훈훈해요0슬퍼요0화나요0후속기사 원해요0댓글 【서울=뉴시스】김지은 기자 = 코스닥 상장 반도체 장비업체 원익홀딩스(030530)는 삼성전자와 352억 규모 TGS(Total Gas Solution) 관련 제품 공급계약을 체결했다고 14일 공시했다. 이는 2016년 매출의 11.93%에 해당한다. kje1321@newsis.com▶ 뉴시스 빅데이터 MSI 주가시세표 바로가기 ▶ 뉴시스 SNS [페이스북] [트위터]뉴시스 관련뉴스해당 언론사에서 선정하며 언론사 페이지(아웃링크)로 이동해 볼 수 있습니다.""아랫배를 계속…""…모 대학교수, 제자 상습 성추행 의혹외국인 처제 성폭행에도 무죄 선고 받은 30대, 결국…검찰 출석한 이명박 ""바라건데, 마지막이길"" 원고 낭독성추행 카톡 메시지로 아이스크림 광고를?신안 여교사·한샘 이어 또… 성범죄 피해자 신상털이 극성좋아요0훈훈해요0슬퍼요0화나요0후속기사 원해요0기사제공 :']"
7,삼성전자, 2018-03-1413:52,뉴스1 ,삼성 '김기남 매직' 잇는다…반도체 1Q 영업익 10조 훌쩍,https://finance.naver.com/news/news_read.nhn?article_id=0003257284&office_id=421&mode=search&query=삼성전자&page=3,"['       삼성 \'김기남 매직\' 잇는다…반도체 1Q 영업익 10조 훌쩍      기사입력2018-03-14 13:52기사원문좋아요훈훈해요좋아요 평가하기공감좋아요0훈훈해요0슬퍼요0화나요0후속기사 원해요0댓글1Q 영업이익 14.6조원 예상…반도체가 75% 담당김기남 DS부문장, 23일 주총에서 사내이사 선임김기남 삼성전자 디바이스솔루션(DS)부문장(삼성전자 제공)/뉴스1 © News1(서울=뉴스1) 주성호 기자 = 김기남 사장이 이끌고 있는 삼성전자 디바이스솔루션(DS)부문 산하의 반도체 사업부가 올 1분기에도 10조원이 넘는 영업이익을 내며 \'효자\' 노릇을 톡톡히 할 것으로 전망된다. 2017년 4분기 역대 최대 실적을 냈던 \'김기남 매직\'이 올해도 이어질 수 있을지 관심이 쏠린다.14일 반도체업계 및 금융정보업체 와이즈리포트에 따르면 삼성전자의 올 1분기 매출액과 영업이익 컨센서스(전망치)는 각각 62조3114억원, 14조6028억원으로 집계됐다. 각각 전년 동기 대비 23.3%, 47.5% 증가한 수준이다.역대 최대 분기 실적을 기록한 지난해 4분기 매출액 65조9800억원, 영업이익 15조1500억원과 견주면 각각 5.6%, 3.6% 하회하는 수치다.올 1분기 사업 부문별 영업이익 전망은 지난해와 유사한 흐름을 보일 것으로 예상된다. 메모리 초호황의 힘을 받은 반도체가 전체 이익의 70%를 넘는 10조원 이상을 기록할 것이라는 전망이다. 반도체를 제외한 주요 사업 이익 예상치는 소비자가전(CE)부문은 3182억원, IT모바일(IM)부문은 2조8800억원, 디스플레이 4570억원 등이다.특히 증권업계에서 추정한 삼성전자의 1분기 반도체 사업 영업이익은 10조9800억원에 달한다. 지난해 4분기 기록한 최대 이익 10조9000억원을 넘을 것이라는 분석이다. 이승우 유진투자증권 연구원은 ""원/달러 환율 하락과 중국의 스마트폰 수요 부진 우려에도 불구하고 데이터센터 및 서버 수요의 호조 지속으로 메모리 부문 실적은 양호한 흐름이 지속될 것""이라고 밝혔다.삼성전자의 분기별 실적 추이 © News1 최진모 디자이너D램 가격 상승세가 계속되고 있다는 점도 호재로 작용할 것으로 분석된다. 시장조사기관 D램익스체인지에 따르면 서버용 D램(DDR4 16GB RDIMM) 제품의 2월 평균 고정거래가격은 161달러로 전월에 비해 1.3% 올랐다. 1년 전과 비교할 경우 34% 급증했다. 삼성전자는 지난해 4분기말 기준으로 D램 시장에서 점유율 46%로 1위를 유지했다.1분기를 지나 올해 연간으로도 반도체 사업의 승승장구는 계속될 것으로 보인다. 업계에서도 올해 삼성전자 반도체 전체 영업이익은 최소 43조원에서 최대 45조원에 달할 것으로 추산하고 있다. 예상 영업이익률만 50%에 달한다.박유악 키움증권 연구원은 ""2분기에도 삼성전자는 매출액 65조9000억원, 영업이익 16조4000억원으로 사상 최대 실적을 기록할 것으로 전망된다""며 ""D램 가격 상승과 낸드플래시의 수요 개선, 갤럭시S9의 판매 호조 등이 예상된다""고 했다.삼성전자는 지난해 10월 DS·IM·CE 등 3개 사업부문의 부문장 인사를 발표하고 세대교체를 단행했다. 권오현 회장 아래에서 반도체 사업총괄을 맡았던 김기남 사장이 DS부문장으로 낙점됐고 고동진 IM부문장, 김현석 CE부문장 등도 새로운 수장으로 등장했다.김 부문장이 전면에 나선 이후 삼성전자의 반도체 \'초격차\' 전략에도 한층 속도가 붙었다는 평가다. 삼성전자는 지난 2월 세계 최대 규모의 반도체 생산단지인 평택캠퍼스에 두번째 공장을 건설하기로 결정한 데 이어 6조5000억원을 들여 화성에 EUV(극자외선) 라인을 갖춘 파운드리 공장 기공식도 진행했다.삼성전자는 오는 23일 정기주주총회를 열고 김기남, 고동진, 김현석 등 3명의 부문장을 새 사내이사로 선임할 예정이다.전자업계 한 관계자는 ""올해는 삼성이 그룹 창립 80주년을 맞이한다는 점에서 핵심 계열사인 삼성전자의 3대 사업부문을 이끄는 부문장들의 행보에 더욱 많은 관심이 쏠린다""고 말했다.sho218@▶ [뉴스1] 채널설정하기 ▶ 제보하기▶ [페이스북] 바로가기![© 뉴스1코리아(news1.kr), 무단 전재 및 재배포 금지]뉴스1 관련뉴스해당 언론사에서 선정하며 언론사 페이지(아웃링크)로 이동해 볼 수 있습니다.\'스위스 유학파\' 김정은, 통역없이 트럼프와 1대1 대화?홍준표 ""文정부 복수위해 MB포토라인에…부메랑될것""""출소뒤 두고 보자""…결별 통보 옛연인 협박포경수술로 보험금을? 보험사기 일당 덜미""아내에 알리겠다"" 내연녀 목 졸라 살해좋아요0훈훈해요0슬퍼요0화나요0후속기사 원해요0기사제공 :']"
