,회사명,날짜,언론사,기사제목,링크,본문
15,삼성전자, 2018-02-2116:36,연합뉴스 ,전자정보통신산업진흥회 신임 회장에 김기남 삼성전자 사장,https://finance.naver.com/news/news_read.nhn?article_id=0009911215&office_id=001&mode=search&query=삼성전자&page=2,"['       전자정보통신산업진흥회 신임 회장에 김기남 삼성전자 사장      기사입력2018-02-21 16:36기사원문좋아요훈훈해요좋아요 평가하기공감좋아요0훈훈해요0슬퍼요0화나요0후속기사 원해요0댓글 (서울=연합뉴스) 정성호 기자 = 한국전자정보통신산업진흥회(KEA)는 22일 서울 상암동 전자회관에서 정기총회를 열고 김기남 삼성전자 DS(디바이스솔루션)부문 사장을 회장으로 선임한다고 21일 밝혔다.    김 회장은 취임사에서 전자·IT(정보기술) 산업의 지속적인 성장을 위해 ▲ 신(新)산업 분야 규제 완화와 지원정책 방안 제시 ▲ 4차 산업혁명 시대의 미래 신산업 활성화 주도 ▲ 대·중소기업 간 상생협력 기반 조성 ▲ 기업 경쟁력 강화와 전문인력 양성 ▲ 정부와 산업계의 원활한 소통 확대 등에 주력하겠다고 밝힐 예정이다.    전자정보통신산업진흥회는 이에 따라 올해 주요사업으로 융합 신산업 선도, 미래 산업에 대비한 규제 완화와 정책 지원 등에 조직 역량을 집중한다는 계획이다.    이날 총회에서는 또 신규 이사사(社)로 스마트홈 전문기업인 \'코맥스\'를 선출할 예정이다.sisyphe@yna.co.kr▶기사제보 및 문의▶로봇이 쓰는 올림픽 속보\xa0\xa0▶올림픽 챗봇 체험하기연합뉴스 관련뉴스해당 언론사에서 선정하며 언론사 페이지(아웃링크)로 이동해 볼 수 있습니다.\xa0\'노선영 의도된 왕따? 작전 실패?\'…팀추월 진실공방\xa0中시골마을 장례식서 벌어지는 스트립쇼…무슨일?\xa0친동생 2명에 \'몹쓸짓\'한 \'나쁜\' 10대 오빠\xa0신인배우 송하늘 ""조민기, 오피스텔로 여학생들 불러…""\xa0""TV 보다가 영화서 퇴마의식이 나와 딸에게 따라했는데…""좋아요0훈훈해요0슬퍼요0화나요0후속기사 원해요0기사제공 :']"
16,삼성전자, 2018-02-2116:36,아이뉴스24 ,"삼성 사장 3인방, 전자업계 협회장 감투 쓴다",https://finance.naver.com/news/news_read.nhn?article_id=0000438988&office_id=031&mode=search&query=삼성전자&page=2,"['       삼성 사장 3인방, 전자업계 협회장 감투 쓴다      기사입력2018-02-21 16:36기사원문좋아요훈훈해요좋아요 평가하기공감좋아요0훈훈해요0슬퍼요0화나요0후속기사 원해요0댓글[아이뉴스24 강민경 기자] 삼성전자 신임 사장 3인방이 전자업계 협회 수장직을 맡게 됐다.21일 업계에 따르면 김기남 DS부문장은 한국전자정보통신산업진흥회(KEA), 한종희 영상디스플레이사업부장(사장)은 한국스마트홈산업협회(KASHI), 이동훈 삼성디스플레이 사장은 한국디스플레이산업협회(KDIA) 회장직 임명을 앞두고 있다.KEA는 22일 제42회 정기총회를 열고 김기남 사장을 차기 회장으로 추대한다고 밝혔다. 김기남 사장은 2013년부터 KEA 회장직을 수행한 권오현 삼성전자 종합기술원 회장의 자리를 물려받는다. 권오현 회장은 아직 KEA 회장 임기가 1년 남았지만 자리에서 물러나겠다는 뜻을 밝힌 것으로 알려졌다.이날 한종희 사장도 KASHI 정기총회에서 회장으로 선임될 예정이다. 현재 회장은 서병삼 삼성전자 부사장이다. 서병삼 부사장 또한 임기가 1년 남긴 상황에서 사임 의사를 표했다. 서병삼 부사장은 앞서 김현석 CE부문장에게 생활가전사업부장직을 넘겨준 뒤 고문으로 재직 중이다.이동훈 삼성디스플레이 사장의 경우 3월 5일 KDIA 총회에서 협회장으로 추대된다. KDIA 협회장직은 앞서 한상범 LG디스플레이 부회장이 맡은 바 있으며, 삼성디스플레이와 LG디스플레이가 번갈아 가면서 협회장직을 맡고 있다.이들은 향후 각 업계를 대변해 목소리를 내는 대변인 역할을 할 전망이다. 전 세계로 확산되고 있는 보호무역주의와 경기침체 분위기 속에서 한국 전자산업 성장을 위해 정부·업계간 상호 협력을 주도한다./강민경기자 spotlight@inews24.com▶네이버 채널에서 \'아이뉴스24\'를 구독해주세요.▶블록체인이 만드는 비즈니스 신세계[ⓒ 아이뉴스24 무단전재 및 재배포 금지]아이뉴스24 관련뉴스해당 언론사에서 선정하며 언론사 페이지(아웃링크)로 이동해 볼 수 있습니다.[평창]다급해진 도쿄 ""평창이 부럽다""김성태 ""맞춤형 기획수사 음모 계속된다면 중대 결심""조금 비싸진 갤럭시S9, 흥행 키포인트는?[단독]갤럭시S9 출고가 95만7천원신동빈 회장, 日 롯데홀딩스 대표 자진 사퇴…롯데 ""확인 중""좋아요0훈훈해요0슬퍼요0화나요0후속기사 원해요0기사제공 :']"
17,삼성전자, 2018-02-2116:32,아시아경제 ,"전자진흥회, 회장에 김기남 삼성전자 사장 선임",https://finance.naver.com/news/news_read.nhn?article_id=0004184008&office_id=277&mode=search&query=삼성전자&page=2,"['       전자진흥회, 회장에 김기남 삼성전자 사장 선임      기사입력2018-02-21 16:32기사원문좋아요훈훈해요좋아요 평가하기공감좋아요0훈훈해요0슬퍼요0화나요0후속기사 원해요0댓글[아시아경제 원다라 기자] 한국전자정보통신산업진흥회(KEA)는 22일 상암동 전자회관에서 개최하는 정기총회에서 김기남 삼성전자 디바이스솔루션(DS) 부문장(사장)을 KEA회장으로 선임한다고 21일 밝혔다.KEA는 부회장 4개사(LG전자 ·남성 ·KEC ·삼성전기), 이사 6개사(대덕전자 · 삼영전자공업 ·삼화콘덴서공업 ·한국단자공업 ·인터엠 ·우주일렉트로닉스), 감사사(화남전자)를 재선임할 예정이다. 신규 이사사로는 스마트홈 전문기업인 \'코맥스\'를 선출한다.김기남 회장은 취임사에서 신산업분야 규제 완화와 지원정책 방안 제시, 4차 산업혁명 시대 미래 신산업 활성화 주도, 대 ·중소기업 간 상생협력 기반조성, 기업 경쟁력 강화와 전문인력 양성, 정부-산업계 간 소통 역할 확대를 강조할 예정이다.원다라 기자 supermoon@asiae.co.kr▶ 네이버 홈에서 \'아시아경제\' 뉴스 확인하기▶ 양낙규의 \'군사이야기\' ▶ #아시아경제 페이스북아시아경제 관련뉴스해당 언론사에서 선정하며 언론사 페이지(아웃링크)로 이동해 볼 수 있습니다.\'노선영 논란\' 외국인 코치 가세 ""놀랍지 않다""""위원장 권능에 도전하나"" 김성태 결국 터졌다\'플레이보이\' 모델급? 평창의 진짜 미녀들 보니""한반도 상황 위험"" 英, 美 보다 먼저 나섰다조민기, 딸과 비키니 매장에서…""이것도 성추행""좋아요0훈훈해요0슬퍼요0화나요0후속기사 원해요0기사제공 :']"
18,삼성전자, 2018-02-2116:29,한국경제 ,"[유망 분양현장] 수원 인계동 동문굿모닝힐, 인계 3호공원을 정원으로 … '숲세권...",https://finance.naver.com/news/news_read.nhn?article_id=0003896785&office_id=015&mode=search&query=삼성전자&page=2,"[""       [유망 분양현장] 수원 인계동 동문굿모닝힐, 인계 3호공원을 정원으로 … '숲세권 아파트'      기사입력2018-02-21 16:29기사원문좋아요훈훈해요좋아요 평가하기공감좋아요0훈훈해요0슬퍼요0화나요0후속기사 원해요0댓글 [ 민경진 기자  ] 동문건설은 경기 수원시 인계동 153의 2에 들어서는 ‘수원 인계동 동문굿모닝힐’ 모델하우스를 23일 열고 분양에 나선다. 중도금의 60%까지 무이자 혜택이 제공되고 계약 후 6개월 뒤 전매가 가능한 아파트다.이 단지는 지하 2층~지상 33층, 3개 동, 총 298가구 규모로 조성된다. 수요자들의 선호도가 높은 중소형(전용 63~79㎡)으로 구성된다.중소형 틈새 면적에 4베이, 팬트리(식품저장소)가 일부 가구에 적용된다. 드레스룸도 설치돼 수납이 편리하다. 주차장은 모두 지하에 마련한다. 지상에는 산책로, 소나무 숲 등을 조성할 계획이다. 남향 위주의 단지 배치로 햇볕이 잘 든다. 동간 가림이 없는 설계로 조망이 좋다.지하철 근접성이 장점이다. 지하철 1호선·한국고속철도(KTX) 수원역이 가깝다. 분당선 수원시청역과 신분당선 광교중앙역을 이용할 수 있다. 차량으로 용인서울고속도로와 영동고속도로에 진입하기 쉽다. 인덕원~수원 복선전철(계획)이 개통되면 안양 의왕 화성 등 주변 지역으로 이동하기 편해질 전망이다.인근에 생활편의시설도 많다. 홈플러스 갤러리아백화점 뉴코아아울렛 롯데백화점 아주대병원 가톨릭대병원 수원월드컵경기장 등이 가깝다. 삼성디지털시티 삼성전자나노시티 광교테크노밸리 등 산업단지로 출·퇴근하기 쉽다. 매화초교가 도보 3분 거리에 있고 원천중 유신고 창현고 아주대 등이 단지에 인접해 있다.인계 3호공원(총면적 24만㎡)이 가까운 도심 속 공원 아파트다. 공원 일대에 청소년문화공원 어린이문화공원 산책로 등이 먼저 조성됐다. 공원 개발은 2020년까지 진행될 예정이다.이 단지는 1차 계약금을 1000만원 정액제로 정했다. 중도금 60%까지 무이자 혜택이 제공된다. 단지가 들어서는 수원시는 비(非)조정대상 지역이다. 청약통장 가입 뒤 1년이 지나면 가구주 주택소유 여부 등을 따지지 않아도 1순위로 청약할 수 있다. 계약 후 6개월(민간택지 기준)이 지나면 분양권 전매도 가능하다. 모델하우스는 팔달구 인계동 947의 10에 마련된다. 2020년 11월 입주할 예정이다.민경진 기자 min@hankyung.com[한경닷컴 바로가기] [글방] [모바일한경 구독신청] ⓒ 한국경제 & hankyung.com, 무단전재 및 재배포 금지한국경제 관련뉴스해당 언론사에서 선정하며 언론사 페이지(아웃링크)로 이동해 볼 수 있습니다.수원~구로디지털단지 BRT 연말 착공'수원 인계동 동문굿모닝힐' 전가구 중소형… 광교신도시 인프라 누려수원·안양·의왕 상반기 7100여 가구 나온다동문건설 '수원 인계동 동문굿모닝힐' 분양좋아요0훈훈해요0슬퍼요0화나요0후속기사 원해요0기사제공 :""]"
19,삼성전자, 2018-02-2116:17,파이낸셜뉴스 ,"연휴이후 외국인, SK하이닉스 쓸어담고, 삼성전자 내다팔고",https://finance.naver.com/news/news_read.nhn?article_id=0003969212&office_id=014&mode=search&query=삼성전자&page=2,"['       연휴이후 외국인, SK하이닉스 쓸어담고, 삼성전자 내다팔고      기사입력2018-02-21 16:17기사원문좋아요훈훈해요좋아요 평가하기공감좋아요0훈훈해요0슬퍼요0화나요0후속기사 원해요0댓글        3/19~21일간 외국인의 SK하이닉스와 삼성전자 순매수 추이   (백만원)         19 20 21   SK하이닉스 6624 37200 23056   삼성전자 -55142 -23576 -85882      (한국거래소)       외국인들이 SK하이닉스와 삼성전자에 대해 서로 다른 투자전략을 보이고 있어 눈길을 끈다. 설 연휴 이후 외국인들은 SK하이닉스를 집중적으로 매입하고있는 반면 삼성전자는 팔고 있기 때문이다. 전문가들은 삼성전자 액면분할을 앞두고 거래정지 기간 여부 등을 놓고 조정에 들어간 것으로 보고 있다.  21일 한국거래소에 따르면 이날 SK하이닉스는 전일대비 1.85% 상승한 7만6900원에 거래를 마쳤다. SK하이닉스는 설 연휴 이후 첫 거래일인 19일 부터 이틀간 각각 1.42%, 1.31% 조정을 받았지만 이날 반등에 성공했다. 반면 삼성전자는 19일 이후 3거래일 연속 하락중이다. 이날 전일대비 0.25% 하락한 236만4000원으로 마감했다.  지난 19일 이후 외국인들은 SK하이닉스를 668억8100만원 어치 순매수 했다. 외국인은 지난 6일 이후 이날까지 SK하이닉스를 10거래일 연속 순매수 중이다. 외국인은 삼성전자에 대해 최근 3거래일 연속 매도 우위다. 설 연휴 이후 외국인의 삼성전자 순매도 규모는 1646억300만원 수준이다.  증권업계는 반도체 업황 호조와 소재 가격 상승을 예상하고 있다. 올해 반도체 소재 업체의 실적이 출하량과 가격 상승 동반으로 호조를 보일 것으로 보여서다. 이는 전방산업인 D램 공급을 제한으로 이어지면서 가격을 올릴 것이라는 분석이다.  하지만 삼성전자는 반도체 업황의 중기적 전망과 별개로 액면 분할에 따른 변수가 존재한다. 액면 분할 자체는 이미 시장에 공표돼 있는 사실이다. 단기적으로는 주가에 긍정적이지만, 기업가치의 변화는 없다는 분석들도 나와 있다.  투자자 입장에서 단기적으로 봐야할 부분은 액면 분할을 위한 거래 정지 기간이 얼마나 되는 것이냐다. 한국예탁결제원은 거래정지 기간이 없이 삼성전자의 액면 분할을 진행하는 것은 현실적으로 어렵다는 입장이다.  이중호 KB증권 연구원은 ""문제는 시장에 공식적으로 알려져 있는 거래 정지 기간을 어떻게 산출 할수 있을지 여부""라며 ""SK텔레콤의 경우 거래 정지가 이틀이었는데, 해당 기간 직전에 매도가 나온 것으로 알려졌다""라고 말했다. 이 연구원은 ""삼성전자의 액면분할이 시장에서 일정한 충격을 줄 수 있다는 측면을 고려할 필요가 있다""고 진단했다.  ahnman@fnnews.com 안승현 기자   ▶ 세상의 모든 골 때리는 이야기 \'fn파스\'▶ 속보이는 연예뉴스 fn스타  ※ 저작권자 ⓒ  파이낸셜뉴스. 무단 전재-재배포 금지파이낸셜뉴스 관련뉴스해당 언론사에서 선정하며 언론사 페이지(아웃링크)로 이동해 볼 수 있습니다.된장찌개 먹방 사진으로 스타된 20대 러시아女영국에서 주목받는 평창 올림픽 미녀 선수 3인방경유차에 휘발유 넣은 주유소 직원..""차주도 30% 책임""운동으로 완벽한 \'S라인\' 만든 인스타그램 스타매일 초콜릿 먹는 여성의 성생활 만족도 조사해보니좋아요0훈훈해요0슬퍼요0화나요0후속기사 원해요0기사제공 :']"
0,삼성전자, 2018-02-2116:17,연합뉴스 ,"코스피, 기관·개인 매수에 반등…코스닥 1%대 상승(종합)",https://finance.naver.com/news/news_read.nhn?article_id=0009911130&office_id=001&mode=search&query=삼성전자&page=3,"['       코스피, 기관·개인 매수에 반등…코스닥 1%대 상승(종합)      기사입력2018-02-21 16:17기사원문좋아요훈훈해요좋아요 평가하기공감좋아요0훈훈해요0슬퍼요0화나요0후속기사 원해요0댓글코스피 상승 (PG)  [제작 조혜인](서울=연합뉴스) 권수현 기자 = 코스피가 21일 기관과 개인이 함께 \'사자\'에 나서면서 하루 만에 반등해 2,420선을 되찾았다.    코스닥지수도 1% 넘게 상승하며 870선을 회복했다.     이날 코스피는 전날보다 14.53포인트(0.60%) 오른 2,429.65로 거래를 마쳤다.     전날 5거래일 만에 하락해 2,410대로 밀렸던 지수는 이날 전장보다 2.61포인트(0.11%) 오른 2,417.73으로 출발해 한동안 보합권에서 오르내리며 혼조 흐름을 보였다.     이후 기관이 장중 \'사자\'로 돌아선 뒤 매수 규모를 키우면서 상승 반전해 2,420선을 회복했다. 장 막판에 오름폭을 키워 2,430선 턱밑까지 올라섰다.     미국 뉴욕증시 주요 지수가 기업 실적 부진과 미국 국채금리 상승 등으로 일제히 하락했으나 국내 증시에서는 기관을 중심으로 매수세가 살아났다.     유가증권시장에서 기관이 1천144억원어치를 사들여 상승 동력을 제공했고 개인도 73억원어치를 담았다. 외국인만 992억원어치를 순매도했다.     이영곤 하나금융투자 연구원은 ""미국 증시 부진에도 불확실성이 다소 완화하면서 국내 증시는 소폭 반등했다. 지수가 박스권 흐름을 이어가는 가운데 실적에 따라 종목별로 등락이 엇갈리는 모습""이라고 말했다.     시가총액 상위주 가운데 시총 2위 SK하이닉스(1.85%)를 비롯해 현대차(4.23%), NAVER(3.22%), 삼성생명(1.25%), 셀트리온(1.15%) 등이 올랐다.     이에 비해 \'대장주\' 삼성전자(-0.25%)와 KB금융(-1.80%), LG화학(-0.53%), 현대모비스(-0.22%), 한국전력(-0.15%), POSCO(-0.14%), 신한지주(-0.10%) 등은 떨어졌다.    업종별로는 운송장비(2.05%), 서비스(1.74%), 음식료품(1.72%), 보험(1.51%), 의료정밀(1.24%), 증권(1.13%), 화학(1.04%), 종이·목재(0.93%), 섬유·의복(0.81%) 등이 강세를 보였다.    은행(-1.50%), 건설(-0.95%), 전기가스(-0.17%), 철강·금속(-0.04%), 전기·전자(-0.01%) 등은 내렸다.     프로그램 매매는 차익거래와 비차익거래 모두 매도 우위였고 전체적으로 596억원 순매도로 나타났다. 코스피 코스닥 (CG)  [연합뉴스TV 제공]    유가증권시장 거래량은 4억2천647만주, 거래대금은 5조9천653억원이었다.    이날 종가 기준 코스피 시가총액은 1천612조7천510억원으로 집계됐다.     코스피 종목 중 513개가 상승 마감했고 293개는 내렸다. 79개 종목은 보합세였고 상·하한가로 마감한 종목은 없었다.     코스닥지수도 동반 상승해 전 거래일보다 11.17포인트(1.29%) 오른 875.58에 장을 마감했다.     전날 1% 넘게 떨어졌던 지수는 전날보다 3.51포인트(0.41%) 오른 867.92로 개장한 뒤 상승 폭을 키워 870선을 회복했다.     코스닥시장에서도 기관이 1천461억원을 순매수해 지수를 밀어 올렸다. 외국인도 754억원어치를 사들였고 개인만 1천979억원어치를 내다 팔았다.    코스닥 시총 1위 셀트리온헬스케어(1.27%)를 비롯해 신라젠(4.29%), 바이로메드(2.88%), 코미팜(2.39%), 로엔(1.70%), 포스코켐텍(1.62%), 컴투스(1.60%) 등 시총 상위주 대부분이 올랐다.     스튜디오드래곤(-2.06%), 메디톡스(-0.80%), 휴젤(-0.49%) 등은 내렸다.     코스닥시장 거래량은 8억48만주, 거래대금은 5조2천124억원으로 각각 집계됐다. 코스닥 시총은 280조6천280억원이었다.     코넥스 시장에서는 124개 종목이 거래됐고, 거래량은 33만6천여주, 거래대금은 약 38억원이었다.     서울 외환시장에서 원/달러 환율은 글로벌 달러 강세 영향으로 전장보다 2.7원 오른 1,076.2원에 마감했다.     inishmore@yna.co.kr▶기사제보 및 문의▶로봇이 쓰는 올림픽 속보\xa0\xa0▶올림픽 챗봇 체험하기연합뉴스 관련뉴스해당 언론사에서 선정하며 언론사 페이지(아웃링크)로 이동해 볼 수 있습니다.\xa0\'노선영 의도된 왕따? 작전 실패?\'…팀추월 진실공방\xa0중국, 女쇼트트랙 계주 실격에 \'부글\'…제소 예정\xa0中시골마을 장례식서 벌어지는 스트립쇼…무슨일?\xa0친동생 2명에 \'몹쓸짓\'한 \'나쁜\' 10대 오빠\xa0""TV 보다가 영화서 퇴마의식이 나와 딸에게 따라했는데…""좋아요0훈훈해요0슬퍼요0화나요0후속기사 원해요0기사제공 :']"
1,삼성전자, 2018-02-2116:17,머니투데이 ,"'지던' 소니, 프리미엄TV서 어떻게 韓 추월했나?",https://finance.naver.com/news/news_read.nhn?article_id=0004012775&office_id=008&mode=search&query=삼성전자&page=3,"['       \'지던\' 소니, 프리미엄TV서 어떻게 韓 추월했나?      기사입력2018-02-21 16:17기사원문좋아요훈훈해요좋아요 평가하기공감좋아요0훈훈해요0슬퍼요0화나요0후속기사 원해요0댓글 [머니투데이 이정혁 기자] [소니, 2500불 이상 OLED TV 전략…프리미엄 OLED 진영 확대]소니가 지난해 글로벌 프리미엄 TV 시장에서 눈에 띄는 성장세를 보이며 고가형 부문에서 LG전자와 삼성전자를 추월한 것으로 나타났다. 소니는 LG전자가 강세를 보이고 있는 OLED(유기발광다이오드) TV를 내세워 2500달러(약 268만원) 이상 시장에서 1위를 차지한 만큼 업계 안팎에서는 소니의 약진에 비상한 관심을 보이고 있다.글로벌 TV시장에서 \'한물갔다\'는 평가를 받아온 소니가 LG전자를 어떻게 역전한 것일까.21일 글로벌 IT(정보·기술)전문 시장조사업체 IHS마킷에 따르면, 소니는 작년 2500달러 이상 프리미엄 TV 시장에서 점유율 36.9%를 기록해 1위를 차지했다. LG전자는 33.2%로 2위를 기록한 데 이어 삼성전자는 18.5%로 3위에 그쳤다.같은 카테고리에서 2016년의 경우 LG전자는 40.8%의 점유율로 압도적 1위를 과시했다. 점유율 24.6%의 소니(2위)는 23.4%에 머문 삼성전자(3위)보다 다소 앞서는 수준이었다. 그런데 소니는 불과 1년 만에 LG전자와 삼성전자를 한꺼번에 따돌렸다.소니가 2500불 이상 프리미엄 TV시장에서 높은 점유율을 찍은 배경은 OLED TV 덕분이다. 소니는 LG디스플레이로부터 OLED 패널을 공급받아 작년부터 본격적으로 OLED TV를 대대적으로 선보이기 시작했다.특히 소니는 수익성을 극대화하기 위해 OLED TV 라인업 자체를 2500불 이상으로만 구성했다. 실제 이날 소니 미국 홈페이지를 보면, 인치(55~77)에 따라 가격 차이는 있으나 OLED TV 55인치(모델명 브라비아 A1E)가 2799.99달러(약 300만원)부터 시작한다.한 마디로 비싼 TV만 팔겠다는 전략이다. 일단 업계에서는 소니가 TV사업 적자가 이어지자 OLED TV 등 프리미엄으로만 포트폴리오를 재정비한 전략이 어느 정도 통한 것으로 보는 분위기다.LG전자의 경우 OLED TV 시장 확대 차원에서 가격대를 중가부터 고가, 초고가까지 형성한 일종의 3단계다보니 2500불 이상 카테고리에서는 소니에 밀리는 것으로 나타난 모양새다. 북미 시장에서 LG전자 OLED TV는 인치에 따라 보통 1500달러(약 161만원)부터 1만5000달러(약 1612만원)까지 구성돼있다.LG전자 입장에서는 소니의 선전이 그렇게 나쁘지 만은 않다. 한때 이름을 날린 소니가 \'OLED 연합\'에 합류함에 따라 시장 파이가 커지는 등 OLED TV가 글로벌 프리미엄 TV시장에서 이른바 \'대세\'로 자리 잡는데 적잖은 역할을 하기 때문이다.업계의 한 관계자는 ""이번 통계는 2500~3000불 이상 OLED TV만 만드는 소니와 가격 스펙트럼이 다양한 LG전자의 대결""이라면서 ""프리미엄 시장의 영토 확장 과정으로 보면 된다""고 말했다.▶빵~ 뜨는 따끈한 기사▶무료 만화 보고 선물도 받고~ ▶치어리더 vs 레이싱걸 이정혁 기자 utopia@mt.co.kr 머니투데이 관련뉴스해당 언론사에서 선정하며 언론사 페이지(아웃링크)로 이동해 볼 수 있습니다.\'노선영 왕따설?\'…김보름·박지우 인터뷰 찾아보니[평창] 빙상연맹, 팀추월 관련 긴급 기자회견.. 노선영은 불참""김보름·박지우 나라망신""…국대박탈 국민청원 12만 돌파GM, 한국GM 부채 출자전환 대신 韓정부 1조 지원 요청장수지, SNS 논란에 사과…""선수 입장서 안쓰러웠다""좋아요0훈훈해요0슬퍼요0화나요0후속기사 원해요0기사제공 :']"
