,회사명,날짜,언론사,기사제목,링크,본문
5,삼성전자, 2018-11-2311:56,한국경제 ,삼성전자 '반도체' 백혈병 사태…11년만에 마무리,https://finance.naver.com/news/news_read.nhn?article_id=0004050100&office_id=015&mode=search&query=삼성전자&page=9,"['       삼성전자 \'반도체\' 백혈병 사태…11년만에 마무리      기사입력2018-11-23 11:56기사원문좋아요훈훈해요좋아요 평가하기공감좋아요0훈훈해요0슬퍼요0화나요0후속기사 원해요0댓글반올림과 \'직업병 분쟁\' 합의김기남 삼성전자 사장 ""중재안 조건없이 이행""[ 윤진우 기자  ] 삼성전자 반도체 백혈병 사태가 삼성전자의 공식 사과로 11년 만에 마무리됐다. 삼성은 피해자 측과 합의한 보상 및 지원을 적극 이행하겠다고 밝혔다.김기남 삼성전자 대표이사는 23일 서울 중구 프레스센터에서 열린 \'삼성-반올림 중재판정이행합의 협약식\'에서 ""소중한 동료와 그 가족들이 오랫동안 고통 받았는데 삼성전자는 이를 일찍부터 성심껏 보살피지 못했다""며 ""그 아픔을 충분히 배려하고 조속하게 해결하기 위한 노력이 부족했다. 조정위가 발표한 중재안을 조건 없이 수용해 이행하겠다""고 말했다. 이날 협약식에는 삼성전자 관계자와 피해자단체 \'반올림(반도체 노동자의 건강과 인권지킴이)\'의 황상기 대표, 피해자 및 가족 등 20여명이 참석했다. 고용노동부·한국산업안전보건공단 등 정부 및 공공기관 관계자와 심상정 정의당 의원, 이정미 정의당 대표, 우원식, 한정애 더불어 민주당 의원 등도 함께 했다. 삼성전자 반도체 사업장에서 일하다 2007년 3월 6일 세상을 떠난 故황유미씨의 부친인 황상기 반올림 대표는 ""제 딸 유미에게 했던 약속을 지키게 되어 기쁘지만 그간의 아픔을 잊을 수는 없다""며 ""노동자 혼자서 회사의 안전보건을 살펴보고 다른 의견을 내기는 어렵기에 대기업들은 솔선해서 안전보건에 대해 책임져야 한다""고 말했다. 삼성전자는 협약식에서 \'반도체 등 사업장에서 발생한 백혈병 등 질환 발병과 관련한 문제 해결을 위한 조정위원회(이하 조정위)\'가 내놓은 중재안을 성실히 이행하겠다고 약속했다. 보상업무를 위탁할 제3의 기관은 양측이 합의한 법무법인 \'지평\'으로 정했고, 지원보상위원회 위원장은 조정위원장을 맡은 김지형 전 대법관이 맡는다. 삼성전자가 별도로 출연하는 산업안전보건 발전기금 500억원을 기탁할 기관은 \'한국산업안전보건공단\'으로 정했다. 보상 범위를 확대하면서 중재안이 극적으로 타결됐다. 보상 대상은 삼성전자는 최초의 반도체 양산라인인 기흥사업장의 제1라인이 준공된 1984년 5월17일 이후 1년 이상 일한 삼성전자 현직자 및 퇴직자 전원과 사내협력업체 현직자 및 퇴직자 전원을 대상으로 정했다. 보상 기간은 2028년 10월31일까지다. 그 이후는 10년 후 별도로 정하기로 했다. 지원보상 범위는 백혈병, 비호지킨림프종, 다발성골수종, 폐암 등 16종의 암으로 결론났다. 갑상선암을 제외한 거의 모든 암을 포함하기로 했다. 보상액은 백혈병은 최대 1억5000만원, 사산과 유산은 각각 1회당 300만원과 100만원으로 정해졌다. 김지형 조정위원장은 ""고통과 갈등이 없는 사회가 아니라, 고통과 갈등을 치유할 수 있는 힘을 가진 사회가 건강한 사회""라며 ""서로 다른 입장과 가치에 대해 닫혀 있던 마음의 문을 열어나가면서 화해를 위한 불씨를 키워 나갈 때 우리는 치유에 이를 수 있으며, 이번 조정과 중재절차가 바로 그것을 보여준 하나의 전형이 됐다""고 평가했다.윤진우 한경닷컴 기자 jiinwoo@hankyung.com기사제보 및 보도자료 open@hankyung.com[한경닷컴 바로가기] [모바일한경 구독신청] 전문가들의 내년 투자전략이 알고 싶다면? <자세히 보기> ⓒ 한국경제 & hankyung.com, 무단전재 및 재배포 금지한국경제 관련뉴스해당 언론사에서 선정하며 언론사 페이지(아웃링크)로 이동해 볼 수 있습니다.8억이던 마포 전세값이 2개월새…집주인 \'날벼락\'""핵심 인재들 한국 떠나 UAE서 받는 연봉이…""잘나가는 \'차이슨\' 믿고 \'차이팟\' 샀는데…\'이럴줄은\'""임원 35% 퇴임"" 두산重, 탈원전 직격탄에 결국\'대한민국 청년\' 채용 4순위로 밀어낸 곳이…충격좋아요0훈훈해요0슬퍼요0화나요0후속기사 원해요0기사제공 :']"
6,삼성전자, 2018-11-2311:54,머니S ,[머니S포토] 발언하는 황상기 반올림 대표,https://finance.naver.com/news/news_read.nhn?article_id=0000358218&office_id=417&mode=search&query=삼성전자&page=9,"['       [머니S포토] 발언하는 황상기 반올림 대표      기사입력2018-11-23 11:54기사원문좋아요훈훈해요좋아요 평가하기공감좋아요0훈훈해요0슬퍼요0화나요0후속기사 원해요0댓글삼성전자반도체백혈병문제해결을위한조정위원회가 23일 서울 중구 한국프레스센터 국제회의장에서 \'삼성전자-반올림 중재판정서 합의 이행을 위한 협약식\'을 진행한 가운데\xa0황상기 반올림 대표가 협약 체결 후\xa0인사말을 하고 있다.임한별 기자 <저작권자 ⓒ \'성공을 꿈꾸는 사람들의 경제 뉴스\' 머니S, 무단전재 및 재배포 금지>▶ 머니S 페이스북 ▶ 동영상으로 만나는 머니S 머니S 관련뉴스해당 언론사에서 선정하며 언론사 페이지(아웃링크)로 이동해 볼 수 있습니다.황미나, 김종민 고백에 \'눈물\'… ""헤어지는 줄""\'골프장 성관계 동영상\' 촬영지는 일본?\'여자친구\' 유주는 어디에?… ""한달째 행방묘연""\'얼굴천재\' 차은우, 성형외과 전문의 ""100점짜리""백종원 분노 ""이럴거면 하지마"" vs 홍탁집 아들 ""안 해""좋아요0훈훈해요0슬퍼요0화나요0후속기사 원해요0기사제공 :']"
7,삼성전자, 2018-11-2311:52,머니S ,[머니S포토] 사과문 발표하는 김기남 대표,https://finance.naver.com/news/news_read.nhn?article_id=0000358217&office_id=417&mode=search&query=삼성전자&page=9,"['       [머니S포토] 사과문 발표하는 김기남 대표      기사입력2018-11-23 11:52기사원문좋아요훈훈해요좋아요 평가하기공감좋아요0훈훈해요0슬퍼요0화나요0후속기사 원해요0댓글삼성전자반도체백혈병문제해결을위한조정위원회가 23일 서울 중구 한국프레스센터 국제회의장에서 \'삼성전자-반올림 중재판정서 합의 이행을 위한 협약식\'을 진행한 가운데\xa0김기남 대표이사가\xa0사과문 및 이행계획 발표를 하고 있다.임한별 기자 <저작권자 ⓒ \'성공을 꿈꾸는 사람들의 경제 뉴스\' 머니S, 무단전재 및 재배포 금지>▶ 머니S 페이스북 ▶ 동영상으로 만나는 머니S 머니S 관련뉴스해당 언론사에서 선정하며 언론사 페이지(아웃링크)로 이동해 볼 수 있습니다.황미나, 김종민 고백에 \'눈물\'… ""헤어지는 줄""\'골프장 성관계 동영상\' 촬영지는 일본?\'여자친구\' 유주는 어디에?… ""한달째 행방묘연""\'얼굴천재\' 차은우, 성형외과 전문의 ""100점짜리""백종원 분노 ""이럴거면 하지마"" vs 홍탁집 아들 ""안 해""좋아요0훈훈해요0슬퍼요0화나요0후속기사 원해요0기사제공 :']"
8,삼성전자, 2018-11-2311:52,머니S ,[머니S포토] 이행계획 발표하는 김기남 삼성전자 대표이사,https://finance.naver.com/news/news_read.nhn?article_id=0000358216&office_id=417&mode=search&query=삼성전자&page=9,"['       [머니S포토] 이행계획 발표하는 김기남 삼성전자 대표이사      기사입력2018-11-23 11:52기사원문좋아요훈훈해요좋아요 평가하기공감좋아요0훈훈해요0슬퍼요0화나요0후속기사 원해요0댓글 삼성전자반도체백혈병문제해결을위한조정위원회가 23일 서울 중구 한국프레스센터 국제회의장에서 \'삼성전자-반올림 중재판정서 합의 이행을 위한 협약식\'을 진행한 가운데\xa0김기남 대표이사가\xa0사과문 및 이행계획 발표를 갖고 있다.임한별 기자 <저작권자 ⓒ \'성공을 꿈꾸는 사람들의 경제 뉴스\' 머니S, 무단전재 및 재배포 금지>▶ 머니S 페이스북 ▶ 동영상으로 만나는 머니S 머니S 관련뉴스해당 언론사에서 선정하며 언론사 페이지(아웃링크)로 이동해 볼 수 있습니다.황미나, 김종민 고백에 \'눈물\'… ""헤어지는 줄""\'골프장 성관계 동영상\' 촬영지는 일본?\'여자친구\' 유주는 어디에?… ""한달째 행방묘연""\'얼굴천재\' 차은우, 성형외과 전문의 ""100점짜리""백종원 분노 ""이럴거면 하지마"" vs 홍탁집 아들 ""안 해""좋아요0훈훈해요0슬퍼요0화나요0후속기사 원해요0기사제공 :']"
9,삼성전자, 2018-11-2311:51,문화일보 ,"“AI 전문가 환영” 삼성전자, 인재 영입 팔걷어",https://finance.naver.com/news/news_read.nhn?article_id=0002373142&office_id=021&mode=search&query=삼성전자&page=9,"[""       “AI 전문가 환영” 삼성전자, 인재 영입 팔걷어      기사입력2018-11-23 11:51기사원문좋아요훈훈해요좋아요 평가하기공감좋아요0훈훈해요0슬퍼요0화나요0후속기사 원해요0댓글내달 7일까지 공개 채용인공지능(AI) 기술을 ‘4대 미래 성장사업’으로 집중 육성하고 있는 삼성전자가 국내외에서 관련 전문인력 영입에 적극적으로 나서고 있다.23일 업계에 따르면 삼성전자 디바이스솔루션(DS) 사업부는 AI 분야 경력사원을 채용하기로 하고 전날부터 다음달 7일까지 인터넷 채용 홈페이지(www.samsungcareers.com) 등을 통해 공개 채용을 진행한다. 모집 분야는 △머신러닝·딥러닝 △컴퓨터 비전 △가상현실(AR) △컴퓨터 플랫폼 △데이터 지능 △ 보안 등으로, 채용되면 메모리 사업부나 시스템 LSI 사업부, 파운드리 사업부, 반도체 연구소 등에서 근무하게 된다.  박사 학위 소지자(예정자 포함)와 함께 관련 분야에서 일정 기간 경력을 갖춘 석사(6년 이상) 및 학사(8년 이상)를 대상으로 한다.서류 전형을 시작으로 면접과 건강 검진에 이어 내년 1월말 최종 합격자를 발표할 예정이다.  회사 관계자는 “딥러닝, 음성·영상 인식, 신경망 알고리즘 연구 등 AI 기술을 통해 또 다른 미래를 실현하기 위해 각 사업부와 연구소에서 일할 전문가를 확보하기 위한 취지”라고 설명했다. 권도경 기자 kwon@munhwa.com[ 문화닷컴 바로가기 | 문화일보가 직접 편집한 뉴스 채널 | 모바일 웹 ][Copyrightⓒmunhwa.com '대한민국 오후를 여는 유일석간 문화일보' 무단 전재 및 재배포 금지(구독신청:02)3701-5555)]문화일보 관련뉴스해당 언론사에서 선정하며 언론사 페이지(아웃링크)로 이동해 볼 수 있습니다.마이크로닷 부모 사건 피해 규모 얼마나 되기에인천서 여중생 투신…유족 '성폭력 의혹' 가해학생 고소'혜경궁 김씨' 트위터·김혜경 카스 1분새 같은글 리트윗외계인 두개골 발견?…中서 아마추어 UFO학자 주장20대 축구심판, 청소년 300명 유혹해 '몹쓸짓'좋아요0훈훈해요0슬퍼요0화나요0후속기사 원해요0기사제공 :""]"
10,삼성전자, 2018-11-2311:51,머니S ,"[머니S포토] 삼성전자-반올림 합의이행 협약, 목 축이는 김기남 대표",https://finance.naver.com/news/news_read.nhn?article_id=0000358215&office_id=417&mode=search&query=삼성전자&page=9,"['       [머니S포토] 삼성전자-반올림 합의이행 협약, 목 축이는 김기남 대표      기사입력2018-11-23 11:51기사원문좋아요훈훈해요좋아요 평가하기공감좋아요0훈훈해요0슬퍼요0화나요0후속기사 원해요0댓글삼성전자반도체백혈병문제해결을위한조정위원회가 23일 서울 중구 한국프레스센터 국제회의장에서 \'삼성전자-반올림 중재판정서 합의 이행을 위한 협약식\'을 진행한 가운데\xa0김기남 대표이사가 목을 축이고 있다.임한별 기자 <저작권자 ⓒ \'성공을 꿈꾸는 사람들의 경제 뉴스\' 머니S, 무단전재 및 재배포 금지>▶ 머니S 페이스북 ▶ 동영상으로 만나는 머니S 머니S 관련뉴스해당 언론사에서 선정하며 언론사 페이지(아웃링크)로 이동해 볼 수 있습니다.황미나, 김종민 고백에 \'눈물\'… ""헤어지는 줄""\'골프장 성관계 동영상\' 촬영지는 일본?\'여자친구\' 유주는 어디에?… ""한달째 행방묘연""\'얼굴천재\' 차은우, 성형외과 전문의 ""100점짜리""백종원 분노 ""이럴거면 하지마"" vs 홍탁집 아들 ""안 해""좋아요0훈훈해요0슬퍼요0화나요0후속기사 원해요0기사제공 :']"
11,삼성전자, 2018-11-2311:50,머니S ,[머니S포토] 악수 나누는 삼성전자-반올림,https://finance.naver.com/news/news_read.nhn?article_id=0000358213&office_id=417&mode=search&query=삼성전자&page=9,"['       [머니S포토] 악수 나누는 삼성전자-반올림      기사입력2018-11-23 11:50기사원문좋아요훈훈해요좋아요 평가하기공감좋아요0훈훈해요0슬퍼요0화나요0후속기사 원해요0댓글삼성전자반도체백혈병문제해결을위한조정위원회가 23일 서울 중구 한국프레스센터 국제회의장에서 \'삼성전자-반올림 중재판정서 합의 이행을 위한 협약식\'을 진행한 가운데\xa0김기남 대표이사가 사과문 발표 후\xa0황상기 반올림 대표와\xa0악수를 나누고 있다.임한별 기자 <저작권자 ⓒ \'성공을 꿈꾸는 사람들의 경제 뉴스\' 머니S, 무단전재 및 재배포 금지>▶ 머니S 페이스북 ▶ 동영상으로 만나는 머니S 머니S 관련뉴스해당 언론사에서 선정하며 언론사 페이지(아웃링크)로 이동해 볼 수 있습니다.황미나, 김종민 고백에 \'눈물\'… ""헤어지는 줄""\'골프장 성관계 동영상\' 촬영지는 일본?\'여자친구\' 유주는 어디에?… ""한달째 행방묘연""\'얼굴천재\' 차은우, 성형외과 전문의 ""100점짜리""백종원 분노 ""이럴거면 하지마"" vs 홍탁집 아들 ""안 해""좋아요0훈훈해요0슬퍼요0화나요0후속기사 원해요0기사제공 :']"
12,삼성전자, 2018-11-2311:50,머니S ,[머니S포토] 합의 이행 악수 나누는 삼성전자와 반올림,https://finance.naver.com/news/news_read.nhn?article_id=0000358214&office_id=417&mode=search&query=삼성전자&page=9,"['       [머니S포토] 합의 이행 악수 나누는 삼성전자와 반올림      기사입력2018-11-23 11:50기사원문좋아요훈훈해요좋아요 평가하기공감좋아요0훈훈해요0슬퍼요0화나요0후속기사 원해요0댓글삼성전자반도체백혈병문제해결을위한조정위원회가 23일 서울 중구 한국프레스센터 국제회의장에서 \'삼성전자-반올림 중재판정서 합의 이행을 위한 협약식\'을 진행한 가운데\xa0김기남 대표이사, 김지형 조정위원장, 황상기 반올림 대표가\xa0협약 체결후 악수를 나누고 있다.임한별 기자 <저작권자 ⓒ \'성공을 꿈꾸는 사람들의 경제 뉴스\' 머니S, 무단전재 및 재배포 금지>▶ 머니S 페이스북 ▶ 동영상으로 만나는 머니S 머니S 관련뉴스해당 언론사에서 선정하며 언론사 페이지(아웃링크)로 이동해 볼 수 있습니다.황미나, 김종민 고백에 \'눈물\'… ""헤어지는 줄""\'골프장 성관계 동영상\' 촬영지는 일본?\'여자친구\' 유주는 어디에?… ""한달째 행방묘연""\'얼굴천재\' 차은우, 성형외과 전문의 ""100점짜리""백종원 분노 ""이럴거면 하지마"" vs 홍탁집 아들 ""안 해""좋아요0훈훈해요0슬퍼요0화나요0후속기사 원해요0기사제공 :']"
13,삼성전자, 2018-11-2311:49,뉴스1 ,"코스피, 외인·기관 '팔자'에 하락 전환…2060선 내줘",https://finance.naver.com/news/news_read.nhn?article_id=0003706821&office_id=421&mode=search&query=삼성전자&page=9,"['       코스피, 외인·기관 \'팔자\'에 하락 전환…2060선 내줘      기사입력2018-11-23 11:49기사원문좋아요훈훈해요좋아요 평가하기공감좋아요0훈훈해요0슬퍼요0화나요0후속기사 원해요0댓글중국 증시 약세에 동반 하락…코스닥도 하락달러/원 환율, 0.8원 오른 1130.0원에 거래 중© News1 DB(서울=뉴스1) 전민 기자 = 코스피가 외국인과 기관의 순매도에 하락 전환해 2060선을 내줬다. 중국 증시가 장 개장 직후 약세를 보이자 동반 하락 중이다.23일 오전 11시43분 기준으로 코스피는 전날보다 14.23포인트(0.69%) 내린 2055.72을 보이고 있다. 이날 코스피는 3.31포인트(0.16%) 오른 2073.26에 출발했지만 장 초반 등락을 반복하며 혼조세를 보였다.그러나 중국 개장 직후 상해종합지수가 1% 이상 하락하자 동반 하락했다. 현재까지 외국인과 기관은 각각 196억원, 471억원씩 순매도했다. 개인은 666억원 순매수했다.서상영 키움증권 연구원은 ""국내 주가는 전날 유럽증시와 미국의 시간외 선물 부진의 여파로 하락하고 있다""면서 ""미국이 동맹국들에게 중국 화웨이 제품을 사용하지 말라고 설득하고 있다는 보도도 투자심리 위축에 영향을 줬다""고 밝혔다.시총상위 종목 중 삼성전자, SK하이닉스, LG화학, SK텔레콤, POSCO, 신한지주가 하락했다. 셀트리온과 현대차는 주가가 상승했다.장 초반 상승세였던 코스닥도 하락 전환했다. 코스닥은 전날보다 2.63포인트(-0.38%) 하락한 689.76에 거래 중이다. 이날 1.85포인트(0.27%) 오른 694.24에 출발했지만 기관의 매도에 하락 전환했다.현재까지 개인이 4억원, 외국인이 98억원 순매수했다. 기관은 80억원 순매도했다.달러/원 환율은 0.8원 오른 1130원에 거래 중이다.min785@news1.kr▶ 진짜 블록체인을 만나는 곳 \'크립토허브\' 오픈! ▶ [페이스북] 바로가기! ▶ 갤럭시워치행운&기프티콘 무조건 받기![© 뉴스1코리아(news1.kr), 무단 전재 및 재배포 금지]뉴스1 관련뉴스해당 언론사에서 선정하며 언론사 페이지(아웃링크)로 이동해 볼 수 있습니다.""권양숙입니다""…윤장현 前시장, 보이스피싱 4.5억 뜯겨공무원이 \'일자리 도둑\'…자기가 공고 낸 자리에 \'셀프취업\'""암이 전염병 아니었어?"" 학생 격리시킨 선생\'결혼반대\' 엄마 불태워 죽이고 자살 신고군기 빠진 중국 축구?…3주간 군사훈련좋아요0훈훈해요0슬퍼요0화나요0후속기사 원해요0기사제공 :']"
