,회사명,날짜,언론사,기사제목,링크,본문
18,삼성전자, 2018-01-1716:34,머니투데이 ,"""SK하이닉스 지금 살까 말까"" 고민 빠진 개미들",https://finance.naver.com/news/news_read.nhn?article_id=0003994275&office_id=008&mode=search&query=삼성전자&page=2,"['       ""SK하이닉스 지금 살까 말까"" 고민 빠진 개미들      기사입력2018-01-17 16:34기사원문좋아요훈훈해요좋아요 평가하기공감좋아요0훈훈해요0슬퍼요0화나요0후속기사 원해요0댓글 [머니투데이 김주현 기자] [""올해는 영업익 20조원까지 간다"" vs ""DRAM 가격 둔화 우려, 박스권 전망""]SK하이닉스가 지난해 사상 처음 영업이익 10조원을 돌파했지만 주가가 반등하지 않아 개인 투자자들의 고민이 깊어지고 있다. SK하이닉스가 지난해에 이어 올해도 사상 최대 실적을 이어갈 수 있을지를 두고 증권업계 전망도 엇갈리고 있다. 17일 금융정보업체 에프앤가이드에 따르면 SK하이닉스의 지난해 영업이익은 13조5820억원으로 추정된다. 2016년 영업이익 3조2767억원에서 314.5% 급증한 수치다. 지난해 4분기 영업이익 추정치는 4조4100억원으로 분기 기준으로 최대 실적이 기대된다. 상장사 가운데 지난해 영업이익 컨센서스가 10조원을 넘는 곳은 삼성전자와 SK하이닉스 두 곳뿐이다. 하지만 이 같은 호실적에도 불구하고 주가는 지난해 10월을 기점으로 내려앉는 중이다. SK하이닉스는 지난해 10월11일 장 중 한 때 9만300원으로 사상 최고치를 기록한 후 하락세를 이어오고 있다. 이날 0.4% 하락한 7만4100원에 마감해 3개월만에 주가가 약 18% 하락했다. 특히 외국인 매도가 주가 하락을 부추겼다. 외국인은 최근 한 달 동안 2847억원 어치를 팔아치웠다. 반면 개인은 2779억원 어치를 순매수했다. 사상 최대 실적 발표를 앞두고도 주가가 반등하지 않자 개인 투자자들은 고민에 빠졌다. 실적 대비 저평가된 주가를 고려해 추가 매수에 나서야 할지 말아야 할지 갈팡질팡하고 있다. 반도체 슈퍼사이클(호황)이 끝물에 접어들었다는 부정적인 예측도 꾸준히 제기되고 있어서다. 또 최근 원/달러 환율 하락으로 올해 실적 추정치가 내려간다는 우려도 있다. 전문가들의 전망도 엇갈린다. 박유악 키움증권 연구원은 올해 하이닉스 영업이익이 20조원을 돌파할 것으로 전망했다. 그는 ""원/달러 환율 하락에도 불구하고 D램 가격 강세가 이어지고 있어 실적 우려는 없다""고 말했다. 또 ""낸드 부문 실적도 1분기 약세를 딛고 2분기부터 개선세를 보일 것""이라고 분석했다. 최도연 신한금융투자 연구원은 ""메모리 반도체 시장은 제4차산업혁명 영향으로 수요 확장이 예상된다""면서 ""달러 약세 흐름에도 불구하고 D램 공급 부족이 이어져 올해도 사상 최대 실적을 경신할 것""이라고 전망했다. 반면 올해 주가가 박스권에서 횡보할 것이라는 전망도 있다. 이재윤 유안타증권 연구원은 ""반도체 호황이 이어질 수 있는지에 대한 의문이 주가를 누르고 있다""며 ""올해는 D램 공급량이 늘어나면서 가격이 둔화될 가능성이 있다""고 지적했다. 그는 ""SK하이닉스의 현재 PER(주가수익비율)는 4~5배 수준으로 저평가 상태가 맞지만 DRAM 가격이 떨어지기 시작하면 지금보다 높은 평가를 받기 어렵다""며 ""반도체 가격 조정으로 실적이 기대에 못미친다면 지난해 기록한 주가 고점을 넘기는 힘들고 박스권 횡보가 이어질 수 있다""고 전망했다. ▶지금 옆사람이 보는 기사들▶무료 만화 보고 선물도 받고~ ▶치어리더 vs 레이싱걸 김주현 기자 naro@ 머니투데이 관련뉴스해당 언론사에서 선정하며 언론사 페이지(아웃링크)로 이동해 볼 수 있습니다.[친절한 판례氏] 강원랜드서 230억 날린 남자 ""물어내라""유류할증료 다음달 더 오른다…최대 4만5100원""집값이 미쳤어요, 잡아주세요""…靑 국민청원 \'봇물\'강남 오피스텔서 남녀 8명 혼숙…30대女 사망공무원 봉급 2.6%↑ 9급 1호봉 144만8800원…직무수당 합치면 월 157만3800원좋아요0훈훈해요0슬퍼요0화나요0후속기사 원해요0기사제공 :']"
19,삼성전자, 2018-01-1716:32,한국경제 ,"[유망 분양현장] 평택드림테크 일반산업단지, '착한 분양가' 주변 시세 70%에 ...",https://finance.naver.com/news/news_read.nhn?article_id=0003880362&office_id=015&mode=search&query=삼성전자&page=2,"['       [유망 분양현장] 평택드림테크 일반산업단지, \'착한 분양가\' 주변 시세 70%에 분양      기사입력2018-01-17 16:32기사원문좋아요훈훈해요좋아요 평가하기공감좋아요0훈훈해요0슬퍼요0화나요0후속기사 원해요0댓글 [ 양길성 기자  ] 드림테크개발이 최근 경기 평택시 청북면 율북리 365의 3 일원에서 ‘평택드림테크 일반산업단지’ 착공에 나섰다. 면적은 134만5000㎡ 규모다. 분양 가격은 3.3㎡당 170만원 선으로 주변 시세보다 30% 이상 저렴한 것으로 알려졌다.입주 가능한 업종은 전자부품, 의료정밀, 자동차 및 트레일러, 전기 장비, 창고 및 운송 관련 서비스업, 연구개발업 등이다. 수도권 내 산업단지 입주가 제한되는 대기업도 입주할 수 있다.단지가 들어설 예정지인 평택은 개발 호재가 많다. 정부는 2020년까지 1조1258억원을 쏟아 평택항을 동북아 거점항구로 조성하겠다고 밝혔다. 단지에서 4㎞ 떨어진 고덕면 일대에는 고덕국제도시(1743만㎡)가 조성되고 있다. 주변에 황해경제자유구역과 평택호관광단지도 개발되고 있다. 삼성전자는 최근 고덕산업단지를 가동하기 시작했고 LG전자는 진위산업단지에 투자를 추진하고 있다. 국토교통부에 따르면 지난해 3분기까지 평택시 지가 상승률은 5.81%로 부산 해운대구(6.86%)에 이어 전국 2위를 기록했다. 분양 관계자는 “각종 개발 호재로 지역 가치가 높아지면서 자산가치 상승효과도 누릴 수 있다”고 전했다.이 단지는 편리한 교통망을 갖췄다. 경부고속도로 서해안고속도로 국도43호선 등이 옆을 지나고 인천공항 김포공항이 반경 60㎞ 안에 있다. 단지 인근 수서고속철도(SRT) 지제역을 이용하면 서울 수서역까지 20분대에 도착한다. 2020년에는 서해안 복선전철 안중역이 개통될 예정이다. 평택~익산 간 제2서해안 고속도로, 포승~평택 간 간선철도도 건설을 앞두고 있다. 쇼핑 병원 관공서 등 풍부한 주거환경을 갖춘 것도 장점이다. 분양 관계자는 “중국 동남아 등 주요 항만과 연결되는 평택항을 끼고 있어 국내외 기업의 관심이 높다”고 전했다. 시공은 현대엔지니어링이 맡았다. 입주는 2019년 하반기 예정이다.양길성 기자 vertigo@hankyung.com[한경닷컴 바로가기] [글방] [모바일한경 구독신청] ⓒ 한국경제 & hankyung.com, 무단전재 및 재배포 금지한국경제 관련뉴스해당 언론사에서 선정하며 언론사 페이지(아웃링크)로 이동해 볼 수 있습니다.평택 국제대교 붕괴사고 원인…\'설계·시공·관리 총체적 부실\'[유망 분양현장] 제주 씨사이드아덴, 쇼핑·교통·자연 \'3박자\' 리조트""비트코인, 17만원으로 1억원 벌어"" 실체 알고보니18억 주고 산 잠실주공5단지 아파트, 일주일 새…현대차 노조원, 매출 4000억 날리고 손에 쥔 돈이좋아요0훈훈해요0슬퍼요0화나요0후속기사 원해요0기사제공 :']"
0,삼성전자, 2018-01-1716:20,머니투데이 ,"3년만에 유가는 최고치인데, 정유株는 시들?",https://finance.naver.com/news/news_read.nhn?article_id=0003994258&office_id=008&mode=search&query=삼성전자&page=3,"['       3년만에 유가는 최고치인데, 정유株는 시들?      기사입력2018-01-17 16:20기사원문좋아요훈훈해요좋아요 평가하기공감좋아요0훈훈해요0슬퍼요0화나요0후속기사 원해요0댓글 [머니투데이 김훈남 기자] [美中 정제설비 가동률 상승으로 정제마진 배럴당 6$ 수준으로 하락, 고배당 성향 탓 시기적 조정영향도]국제유가가 배럴당 70달러선에 임박, 2014년 말 이후 3년여 만에 최고가 행진을 이어가고 있다. 통상 유가 상승은 정유업종 주가 상승을 부르는 호재 중 하나이지만 최근 정유주(株)들이 지수대비 부진해 화제다.16일(현지시간) 뉴욕 상업거래소에서 거래된 WTI(서부텍사스산원유) 선물은 배럴당 63.73달러에 거래를 마쳤다. 지난해 말 배럴당 60달러선을 넘어선 이후 보름여 만에 5.6% 상승한 금액이다. WTI는 이날 장중 한때 배럴당 64.89달러까지 상승하며 2014년 12월 이후 최고가를 기록했다.지난해 6월 배럴당 40달러 초반을 기록한 이후 국제유가는 지난해 11월 OPEC(석유수출국기구) 감산합의 연장과 세계 경기회복에 따른 수요 회복, 이례적 한파 영향으로 꾸준히 상승 중이다. 국제유가 상승은 원유 비축분 재고평가와 석유제품 가격상승으로 이어지는 만큼 정유업계의 전통적인 호재 중 하나다.하지만 최근 정유주 주가는 국제유가 상승이 무색하게 부진하다. SK이노베이션은 17일 증시에서 주당 19만8000원에 거래를 마쳤다. 지난해 말 20만4500원에서 3.2% 하락한 금액이다. 이날 11만3500원에 거래를 마친 S-Oil도 올 들어 3% 약세다. 연초 5%대 상승한 국제유가와 반대 흐름을 보인 셈이다. 시가총액 1·2위 삼성전자와 SK하이닉스의 부진에도 2% 남짓 상승, 2500대에 안착한 코스피 지수와도 반대 흐름이다. 코스피 지수 상승세가 철강과 화학 등 시클리컬(경기민감주) 업종의 강세에서 나온 점을 고려하면 대표적 시클리컬 업종인 정유주 부진이 상대적으로 부각된다.증권업계는 최근 정유업계 주가 부진 원인을 지난해 말 강세를 보였던 정제마진(원유를 석유제품으로 정제할 때 발생하는 마진)이 약세로 돌아섰기 때문으로 보고 있다. 싱가포르 정제마진은 배럴당 5.9달러로 8개월래 최저치를 기록했다. 계절적 비수기인 지난해 3분기에도 배럴당 8달러 수준으로 강세를 보였던 정제마진은 최근 미국, 중국의 정유설비 가동률 상승에 약세로 돌아섰다. 난방 수요 등으로 계절적 성수기에도 정제마진이 되레 낮아지면서 나온 올해 1분기 수익성 둔화 전망이 주가 약세로 이어졌다는 해석이 나온다.여기에 SK이노베이션과 S-Oil의 높은 배당성향도 주가 조정 원인 중 하나로 꼽힌다. 배당 기준일인 지난해 말까지 매수세가 몰리며 올랐던 주가가 소폭 조정기에 들어갔다는 설명이다. 이달 하순으로 예정된 실적발표에서 유가 상승에 따른 실적 개선 효과와 배당액 증액 여부를 확인하기 전까진 주가 등락이 이어질 것이란 전망도 나온다.황규원 유안타증권 연구원은 ""계절적 성수기인 1월에도 정제마진이 배럴당 5달러대로 떨어져 수익성 우려가 주가에 반영됐다""며 ""미국과 중국 공장 가동률이 낮아지고 2~3월 주요 정유업체 설비보수가 예정된 점을 고려하면 마진이 바닥을 통과하는 것으로 예상된다""고 말했다.▶지금 옆사람이 보는 기사들▶무료 만화 보고 선물도 받고~ ▶치어리더 vs 레이싱걸 김훈남 기자 hoo13@mt.co.kr 머니투데이 관련뉴스해당 언론사에서 선정하며 언론사 페이지(아웃링크)로 이동해 볼 수 있습니다.[친절한 판례氏] 강원랜드서 230억 날린 남자 ""물어내라""유류할증료 다음달 더 오른다…최대 4만5100원""집값이 미쳤어요, 잡아주세요""…靑 국민청원 \'봇물\'강남 오피스텔서 남녀 8명 혼숙…30대女 사망공무원 봉급 2.6%↑ 9급 1호봉 144만8800원…직무수당 합치면 월 157만3800원좋아요0훈훈해요0슬퍼요0화나요0후속기사 원해요0기사제공 :']"
1,삼성전자, 2018-01-1716:13,연합뉴스 ,차익실현 매물 쏟아진 코스닥 880대로 후퇴(종합),https://finance.naver.com/news/news_read.nhn?article_id=0009819486&office_id=001&mode=search&query=삼성전자&page=3,"['       차익실현 매물 쏟아진 코스닥 880대로 후퇴(종합)      기사입력2018-01-17 16:13기사원문좋아요훈훈해요좋아요 평가하기공감좋아요0훈훈해요0슬퍼요0화나요0후속기사 원해요0댓글코스피-코스닥, 동반 하락(서울=연합뉴스) 신준희 기자 = 17일 코스피가 전일보다 6.31p(0.25%) 내린 2,515.43에 거래를 마쳤다.     코스닥도 전날보다 14.65p(1.63%) 내린 886.58로 장을 마감했다. 16일 16년 만에 900선을 돌파하한지 하루만에 다시 떨어졌다.      사진은 이날 서울 명동 KEB하나은행 본점 딜링룸.  hama@yna.co.kr셀트리온 \'3형제\' 동반 급락…코스피도 기관 \'팔자\'에 내려(서울=연합뉴스) 권수현 기자 = 코스피가 17일 미국발 악재와 기관의 매도 공세에 2,520선 아래로 물러났다.    코스닥은 차익실현 매물이 쏟아지면서 880대로 뒷걸음질했다.     이날 코스피는 전 거래일보다 6.31포인트(0.25%) 내린 2,515.43으로 장을 마쳤다.     앞서 3거래일 연속 오르며 2,520선을 회복했던 지수는 이날 전장보다 4.55포인트(0.18%) 내린 2,517.19로 출발해 우하향 흐름을 이었다.    기관을 중심으로 대거 차익실현 매물이 나오면서 지수 하락 요인을 제공했다.     이날 유가증권시장에서 기관은 2천881억원어치를 팔았다.     개인은 1천672억원을 순매수했고 외국인도 장중 매수 우위로 전환해 685억원어치를 담았다.     간밤 미국 뉴욕 증시에서 주요 지수가 미국 연방정부 폐쇄 우려로 일제히 하락 마감한 것도 부담으로 작용했다.    16일(미국시간) 뉴욕증권거래소(NYSE)에서 다우존스 30 산업평균지수(-0.04%)는 장중 26,000을 찍었고 스탠더드앤드푸어스(S&P) 500 지수(-0.35%), 나스닥 지수(-0.08%)도 장중 최고치를 경신했으나 이후 내림세로 돌아섰다.    이영곤 하나금융투자 연구원은 ""오늘 코스피는 차익 실현성 매물이 나오면서 소폭 내렸다. 의약품과 삼성전자를 비롯한 전기·전자 업종 등이 약세 흐름을 보였다""고 설명했다.     시가총액 상위 종목 가운데 \'대장주\' 삼성전자(-0.80%)와 시총 2위 SK하이닉스(-0.54%)가 동반 하락했다.    삼성바이오로직스(-3.62%), LG화학(-1.97%), NAVER(-1.44%), 현대차(-0.63%), 삼성물산(-0.37%) 등도 떨어졌다.     오른 종목은 POSCO(1.72%), 현대모비스(1.38%), 신한지주(0.77%), SK텔레콤(0.56%) 등이다.     업종별로는 의약품(-3.31%), 섬유·의복(-1.24%), 운수창고(-1.15%), 기계(-1.10%), 화학(-0.76%), 제조(-0.54%), 전기·전자(-0.52%), 비금속광물(-0.38%) 등이 하락했다.     은행(1.90%), 의료정밀(1.53%), 철강·금속(0.85%), 유통(0.68%), 서비스(0.59%) 등은 올랐다.     프로그램 매매에서 차익거래와 비차익거래 모두 매수 우위였고 전체적으로 487억원 순매수로 집계됐다.     유가증권시장 거래량은 3억3천350만주, 거래대금은 6조2천139억원이었다.     코스피 종목 중 481개가 하락 마감했고 340개가 상승했다. 63개 종목은 보합세였고 상·하한가 마감 종목은 없었다.      코스닥도 개인과 외국인이 바이오 업종을 중심으로 대거 차익 실현에 나선 영향으로 880대 중반으로 밀렸다.    코스닥 지수는 전 거래일보다 14.65포인트(1.63%) 내린 886.58로 거래를 종료했다.    전날 15년 10개월 만에 900선에 오른 지수는 이날도 1.14포인트(0.13%) 오른 902.37로 개장했으나 개인과 외국인의 매도 규모가 커지면서 뒷걸음질했다.     코스닥시장에서 개인은 1천460억원, 외국인은 1천197억원어치를 각각 순매도해 지수를 끌어내렸다.     기관만 2천787억원어치를 사들였다.     코스닥 시총 1위 셀트리온(-9.76%)과 2위 셀트리온헬스케어(-13.97%), 셀트리온제약(-10.11%) 등 연초 이후 랠리를 이어온 \'셀트리온 3총사\'가 일본계 노무라 증권의 \'매도\' 의견 제시 영향으로 큰 폭으로 내렸다.      이에 비해 파라다이스(11.16%), 바이로메드(8.49%), 신라젠(3.89%), 로엔(3.66%), CJ E&M(3.16%), 포스코켐텍(3.15%) 등은 상승했다.     코스닥시장 거래량은 11억9천978만주, 거래대금은 10조3천677억원이었다.    코스닥 종목 중 544개가 내렸고 622개는 상승 마감했다. 83개 종목은 보합세였고 정보기술(IT) 보안 관련 업체인 드림시큐리티와 한국전자인증 등 7개 종목이 상한가로 마감했다.     코넥스 시장에서는 125개 종목이 거래됐고 거래대금은 약 88억원이었다.     서울 외환시장에서 원/달러 환율은 전 거래일보다 달러당 6.6원 오른 1,069.3원에 마감했다.    inishmore@yna.co.kr▶기사제보 및 문의▶기자와 1:1 채팅\xa0\xa0▶평창동계올림픽 영상 공모전연합뉴스 관련뉴스해당 언론사에서 선정하며 언론사 페이지(아웃링크)로 이동해 볼 수 있습니다.\xa0""박유천 반려견에 얼굴 물려서…"" 뒤늦게 고소한 지인\xa0[사진오늘] 첫새벽의 경악…사망자만 6천4백34명\xa0""25살 전엔 연애 안돼"" 훈계하던 목사가 되레 성추행\xa0멸종위기 오랑우탄, 하천서 고문끝 참수된 채 발견\xa0""승무원이 라면 쏟아 주요부위 화상"" 승객에 1억 배상좋아요0훈훈해요0슬퍼요0화나요0후속기사 원해요0기사제공 :']"
2,삼성전자, 2018-01-1716:02,뉴시스 ,"[마감시황]코스피, 기관 매도에 2510선 후퇴…코스닥, 900선 내줘",https://finance.naver.com/news/news_read.nhn?article_id=0008398647&office_id=003&mode=search&query=삼성전자&page=3,"['       [마감시황]코스피, 기관 매도에 2510선 후퇴…코스닥, 900선 내줘      기사입력2018-01-17 16:02기사원문좋아요훈훈해요좋아요 평가하기공감좋아요0훈훈해요0슬퍼요0화나요0후속기사 원해요0댓글【서울=뉴시스】【서울=뉴시스】김지은 기자 = 코스피와 코스닥이 함께 하락했다. 코스피는 기관의 매도세에 떨어졌고 코스닥은 셀트리온 그룹주의 급락세에 하루 만에 900선을 내줬다.17일 코스피지수는 전 거래일(2521.74)보다 6.31포인트(0.25%) 내린 2515.43으로 마감했다. 2517.19로 출발한 지수는 장 내내 약보합권에서 움직였다.유가증권시장에서 기관은 2881억원 순매도했다. 개인과 외국인은 각각 1679억원, 679억원 어치 사들였다.업종별로는 은행(1.90%), 의료정밀(1.53%), 철강금속(0.85%), 유통업(0.68%), 서비스업(0.59%), 운수장비(0.17%)등은 올랐다.의약품(-3.31%), 섬유의복(-1.24%), 운수창고(-1.15%), 기계(-1.10%), 화학(-0.76%) 등은 내렸다. 시가총액 상위 종목도 대체로 떨어졌다.삼성전자는 1만9000원(0.76%) 내린 248만1000원에 거래를 마쳤다.SK하이닉스(-0.40%), 현대차(-0.32%), LG화학(-2.55%), 네이버(-1.66%), KB금융(-0.61%), 삼성바이오로직스(-3.99%), 삼성물산(-0.37%) 등도 주가가 아래로 향했다.이와 반대로 포스코(1.98%), 신한지주(0.96%), 현대모비스(1.38%), SK텔레콤(0.19%) 등은 상승했다. 코스닥지수는 1% 이상 하락해 890선 아래로 밀려났다. 이날 코스닥지수는 전 거래일(901.23)보다 14.65포인트(1.63%) 내린 886.58로 마감했다. 900선 위에서 장을 시작한 코스닥은 한때 905.95까지 올랐으나 차익실현 매물이 나오며 하락 전환했다. 코스닥 시가총액 상위 종목인 셀트리온 삼형제가 크게 하락한 것이 지수를 끌어내린 것으로 분석된다셀트리온은 이날 3만3900원(9.76%) 내린 31만3500원에 거래를 마쳤다.셀트리온헬스케어와 셀트리온제약은 각각 13.97%, 10.11% 급락했다. kje1321@newsis.com▶ 뉴시스 빅데이터 MSI 주가시세표 바로가기 ▶ 뉴시스 SNS [페이스북] [트위터]뉴시스 관련뉴스해당 언론사에서 선정하며 언론사 페이지(아웃링크)로 이동해 볼 수 있습니다.6년간 지속된 호흡곤란…폐에서 3cm 고추 발견멀쩡한 주민 37명 사망처리…면사무소 황당 실수지적장애 여신도 상습 추행 승려 집행유예…""범행 인정하고 반성""[단독]서울대 자율주행차 \'스누비\', 3월부터 도심 상시 주행법원 ""지인끼리 \'짜장면값 내기\' 마작…도박죄 무죄""좋아요0훈훈해요0슬퍼요0화나요0후속기사 원해요0기사제공 :']"
3,삼성전자, 2018-01-1716:01,한겨레 ,"삼성전자, 갤노트8 ‘올림픽 에디션’ 선수단 전원에 제공",https://finance.naver.com/news/news_read.nhn?article_id=0002395135&office_id=028&mode=search&query=삼성전자&page=3,"['        삼성전자, 갤노트8 ‘올림픽 에디션’ 선수단 전원에 제공       기사입력2018-01-17 16:01기사원문좋아요훈훈해요좋아요 평가하기공감좋아요0훈훈해요0슬퍼요0화나요0후속기사 원해요0댓글  [한겨레] IOC 관계자와 선수들에 4000여대…일반 판매는 안해  삼성전자가 국제올림픽위원회(IOC)와 협력해 ’갤럭시노트8 올림픽 에디션’ 4000여대를 올림픽 참가 선수단과 국제올림픽위원회 관계자 전원에게 제공한다고 17일 밝혔다. 올림픽 에디션은 갤럭시노트8에 겨울 느낌이 나는 화이트 색상과 올림픽을 상징하는 금색 오륜기 디자인을 입혔다. 올림픽 에디션에는 평창 동계올림픽을 테마로 한 전용 월페이퍼와 올림픽 게임 관련 다양한 정보를 한눈에 확인할 수 있는 애플리케이션을 함께 제공한다. 일반 판매는 하지 않는다. 이영희 삼성전자 글로벌마케팅센터장(부사장)은 “갤럭시노트8 올림픽 에디션을 통해 모든 올림픽 참가 선수와 관계자들이 올림픽의 특별한 경험을 가족, 친구, 팬들과 생생하게 공유하고 소통하기를 바란다”고 말했다. 최현준 기자 haojune@hani.co.kr    ▶ 한겨레 절친이 되어 주세요! [신문구독] [사람과 동물을 잇다 : 애니멀피플] [카카오톡][ⓒ한겨레신문 : 무단전재 및 재배포 금지] 한겨레 관련뉴스해당 언론사에서 선정하며 언론사 페이지(아웃링크)로 이동해 볼 수 있습니다.자고 일어났더니 폭락…비트코인 투자자 \'피의 수요일\'\'남북 탁구여왕\' 현정화-리분희 27년 만에 상봉할까대화의 품격, 정우성이 말 잘하는 이유이재명, 서울 미세먼지 비판한 남경필에 ""경기도나 잘 챙기라""\'세월호는 북한 지령\' 펼침막…결국 고발당한 극우단체좋아요0훈훈해요0슬퍼요0화나요0후속기사 원해요0기사제공 :']"
