,회사명,날짜,언론사,기사제목,링크,본문
18,삼성전자, 2018-03-0811:11,파이낸셜뉴스 ,"삼성카드, 가전제품 구매시 혜택 '삼성 디지털프라자 삼성카드' 출시",https://finance.naver.com/news/news_read.nhn?article_id=0003978514&office_id=014&mode=search&query=삼성전자&page=5,"['       삼성카드, 가전제품 구매시 혜택 \'삼성 디지털프라자 삼성카드\' 출시      기사입력2018-03-08 11:11기사원문좋아요훈훈해요좋아요 평가하기공감좋아요0훈훈해요0슬퍼요0화나요0후속기사 원해요0댓글          삼성카드는 가전제품 구매 시 유용한 혜택을 제공하는 \'삼성 디지털프라자 삼성카드\'( 사진)를 출시했다고 8일 밝혔다.  \'삼성 디지털프라자 삼성카드\'는 \'삼성 디지털프라자\'에서 가전제품 구매 시 24개월, 36개월 라이트할부 서비스를 제공한다.  라이트할부 서비스는 24만원 이상 결제 시 1회 이용 가능하고, 라이트할부 금액 완납 시 다시 이용할 수 있다. 할부수수료율은 연 6.5%가 적용된다.  또 라이트할부를 이용할 경우 매월 1만1000원, 이용하지 않을 경우 매월 4000원 결제대금 할인 혜택을 제공한다. 할인 혜택은 전월 이용실적이 50만원 이상 시 가능하다.  이밖에도 전월 이용실적이 50만원 이상 시 대중교통·택시 5%, 10대 커피전문점 5%, 삼성닷컴 3%, 삼성전자 서비스센터 10% 결제일 할인 등 혜택을 제공한다. 각 업종별 할인 한도는 삼성카드 홈페이지에서 확인할 수 있다.  삼성카드 관계자는 ""새롭게 출시한 상품을 통해 상대적으로 높은 가격의 가전제품에 대한 부담을 낮추고, 고객들은 실용적인 혜택을 누릴 수 있을것으로 기대한다""고 말했다.   gloriakim@fnnews.com 김문희 기자   ▶ 세상의 모든 골 때리는 이야기 \'fn파스\'▶ 속보이는 연예뉴스 fn스타  ※ 저작권자 ⓒ  파이낸셜뉴스. 무단 전재-재배포 금지파이낸셜뉴스 관련뉴스해당 언론사에서 선정하며 언론사 페이지(아웃링크)로 이동해 볼 수 있습니다.된장찌개 먹방 사진으로 스타된 20대 러시아女안희정 파문... 추미애 딸이 퇴근한 엄마를 보고 한 질문\'성추행 의혹\' 정봉주, 서울시장 출마 회견 돌연 \'취소\'잠 부족하면 살찐다.. 허리둘레 4cm 더 길어""김기덕 감독, 숙소 안에 밀어넣고 성관계 요구""좋아요0훈훈해요0슬퍼요0화나요0후속기사 원해요0기사제공 :']"
19,삼성전자, 2018-03-0811:11,헤럴드경제 ,[오전시황] 外人 매수세에 코스피 2410선 회복…코스닥 850선 재진입,https://finance.naver.com/news/news_read.nhn?article_id=0001363170&office_id=016&mode=search&query=삼성전자&page=5,"['       [오전시황] 外人 매수세에 코스피 2410선 회복…코스닥 850선 재진입      기사입력2018-03-08 11:11기사원문좋아요훈훈해요좋아요 평가하기공감좋아요0훈훈해요0슬퍼요0화나요0후속기사 원해요0댓글-삼성전자 사흘째 상승…셀트리온도 6%대 반등-현대중공업ㆍ삼성중공업 등 조선주도 상승세[헤럴드경제=김현일 기자] 선물ㆍ옵션 동시 만기일인 8일 오전 코스피 시장은 기관의 매도 속에 소폭 반등하며 지수를 2410선으로 끌어올렸다.코스닥 지수도 1% 넘는 상승률을 보이며 850선에 재진입했다.이날 오전 11시 현재 코스피 지수는 전날보다 12.66포인트(0.53%) 오른 2414.48를 가리키고 있다.개인과 외국인이 각각 1148억원, 309억원 어치를 매수했지만 기관이 1486억원 어치를 팔아치우며 차익실현에 나섰다.의약품(2.34%), 철강금속(1.29%), 서비스업(1.03%) 등이 강세를 보인 반면 운수창고(-0.87%), 전기가스(-0.25%), 증권(-0.12%) 등은 약세다.반도체 업종에 대한 시장 기대감이 높아지면서 삼성전자는 이날에도 상승세를 이어갔다.삼성전자는 전일 대비 0.16% 오른 243만5000원에 거래 중이다. 반면 SK하이닉스는 외국인과 기관의 매도가 집중되며 0.12% 하락 반전했다.전날 테마섹의 지분 매각으로 급락했던 셀트리온 주가는 6.77% 치고 오르며 34만원대를 회복했다.현대차는 외국인과 기관이 각각 매수와 매도가 나뉘어 공방을 벌이는 가운데 0.33%의 상승세를 기록 중이다.POSCO(2.01%)와 삼성바이오로직스(0.56%), NAVER(0.13%), KB금융(0.81%)도 반등했다. 반면 LG화학(-1.30%)은 이틀 연속 하락세다.한편 정부가 이날 STX조선과 성동조선의 구조조정 방안을 발표하기로 한 가운데 코스피 시장 조선주들은 일제히 상승세를 보였다.현대중공업이 LNG선 수요증가에 힘입어 4.38% 급등했고, 삼성중공업(3.94%), 현대미포조선(2.35%)도 오름세다.코스닥 지수는 전일 대비 10.68포인트(1.28%) 올라 851.87을 기록했다.개인과 기관이 각각 276억원, 32억원을 매도했지만 외국인이 335억원 어치를 사들이며 지수 상승에 기여했다.시가총액 상위 종목들도 대부분 오름세다. ‘대장주’ 셀트리온헬스케어(2.47%)와 셀트리온제약(4.47%)이 큰 폭으로 반등하는 데 성공했고, 신라젠(3.45%)과 바이로메드(3.62%)도 전날 부진을 털고 상승 중이다.반면 전날 7%대 상승률을 기록한 메디톡스는 2.62% 하락하며 하루 만에 내림세로 전환했다.이밖에 티슈진(0.97%), CJ E&M(2.18%), 포스코켐텍(0.72%), 펄어비스(0.38%), 로엔(0.94%)도 1~2%의 상승률을 보이고 있다.같은 시각 서울 외환시장에서 원ㆍ달러 환율은 0.1원 올라 1069.20원대를 기록하고 있다.joze@heraldcorp.com▶10만원대 수량한정 프랑스 명품 커트러리 세트!▶헤럴드경제 채널 구독하기 ▶한입뉴스 ‘타파스’ 페이스북 친구맺기 - Copyrights ⓒ 헤럴드경제 & heraldbiz.com, 무단 전재 및 재배포 금지 -헤럴드경제 관련뉴스해당 언론사에서 선정하며 언론사 페이지(아웃링크)로 이동해 볼 수 있습니다.문정인 ""한미동맹 해한 적 없다…주한미군 철수론자 아냐""박수현 ""내연녀 공천? 치졸한 정치공작…법적대응""홍준표 ""안희정 사건, 임종석이 기획했다고 하더라""안희정 성폭행 추가 피해자 등장…""김지은씨 보고 폭로 결심""안희정 측근 ""안희정 성폭력, 도청내 추가 피해자는 없다""좋아요0훈훈해요0슬퍼요0화나요0후속기사 원해요0기사제공 :']"
0,삼성전자, 2018-03-0811:02,한국경제 ,"삼성전자, '삼성 노트북 Pen'으로 작업한 헤이즈 신곡 공개",https://finance.naver.com/news/news_read.nhn?article_id=0003904096&office_id=015&mode=search&query=삼성전자&page=6,"['       삼성전자, \'삼성 노트북 Pen\'으로 작업한 헤이즈 신곡 공개      기사입력2018-03-08 11:02기사원문좋아요훈훈해요좋아요 평가하기공감좋아요0훈훈해요0슬퍼요0화나요0후속기사 원해요0댓글헤이즈, 섬세한 작업에 특화된 \'S펜\' 호평싱어송라이터 헤이즈가 \'삼성 노트북 Pen\'을 활용해 작사 작곡하는 모습삼성전자가 2018년형 노트북 신제품 ‘삼성 노트북 Pen’을 활용해 국내 유명 싱어송라이터 헤이즈와 제작한 음원을 발표한다고 8일 밝혔다. 헤이즈는 이날 저녁 6시에 공개하는 미니앨범 ‘바람’의 타이틀곡 ‘젠가’를 삼성 노트북 Pen으로 직접 작사·작곡했다.헤이즈는 “평소 이동시간이 많아 이동 중에 녹음과 메모를 할 수 있는 기기가 필요했다”며 “삼성 노트북 Pen은 가벼워 어디에나 들고 다니며 작업하기 편했고, 특히 섬세한 작업이 필요한 작곡에 S펜이 유용했다”고 말했다.삼성 노트북 Pen은 노트북 최초로 S펜을 탑재하고, 360도 회전 터치 디스플레이를 탑재해 차별화된 사용성을 제공한다. 특히 33.7cm 모델은 1Kg이 넘지 않는 초경량으로 편의성과 휴대성을 극대화한 제품으로 소비자들에게 호평받고 있다.삼성전자는 홍콩 출신 아티스트 마크 알란테(Marc Allente)와 헤이즈의 신곡을 시각적으로 표현하는 일러스트레이션도 함께 공개한다. S펜을 활용해 전통적인 방식의 수채화 물감이나 잉크 등의 질감을 디지털로 표현한 것이 가장 큰 특징이다. 삼성전자가 2명의 아티스트와 협업한 음원과 일러스트레이션, 비하인드 영상은 캠페인 공식 홈페이지와 삼성전자 유튜브, 페이스북 등 소셜네트워크서비스(SNS) 채널에서 확인할 수 있다.오세성 한경닷컴 기자 sesung@hankyung.com기사제보 및 보도자료 open@hankyung.com[한경닷컴 바로가기] [글방] [모바일한경 구독신청] ⓒ 한국경제 & hankyung.com, 무단전재 및 재배포 금지한국경제 관련뉴스해당 언론사에서 선정하며 언론사 페이지(아웃링크)로 이동해 볼 수 있습니다.백종원, \'빽다방\'으로 돈방석에 앉더니 이제는…""안희정, 女 공무원들 사이서…"" 도청 직원들 반응""LG·삼성 \'무선청소기\' 잘나가자…"" 다이슨 결국안희정 성추문 \'된서리\'… 발칵 뒤집힌 기업들제71회 \'바담 풍\' 선생님 뱁새 8 - 소 잡는 칼 따로, 쇠고기 써는 칼 따로 2좋아요0훈훈해요0슬퍼요0화나요0후속기사 원해요0기사제공 :']"
1,삼성전자, 2018-03-0811:02,매일경제 ,"가수 헤이즈 ""삼성 노트북 Pen, 작사·작곡 작업 편리해""",https://finance.naver.com/news/news_read.nhn?article_id=0004111872&office_id=009&mode=search&query=삼성전자&page=6,"['       가수 헤이즈 ""삼성 노트북 Pen, 작사·작곡 작업 편리해""      기사입력2018-03-08 11:02기사원문좋아요훈훈해요좋아요 평가하기공감좋아요0훈훈해요0슬퍼요0화나요0후속기사 원해요0댓글싱어송라이터 헤이즈가 \'삼성 노트북 Pen\'을 활용해 작사 작곡하는 모습 [사진 제공 : 삼성전자] 삼성전자가 국내 유명 싱어송라이터 헤이즈와 협업해 2018년형 노트북 신제품 \'삼성 노트북 Pen\'을 활용해 제작한 음원을 발표한다.헤이즈는 8일 오후 6시에 공개하는 미니앨범 \'바람\'의 타이틀곡 \'젠가\'를 삼성 노트북 Pen으로 직접 작사·작곡 작업을 진행했다.헤이즈 ""평소 이동시간이 많아 이동 중에 녹음과 메모를 할 수 있는 기기가 필요했다""며 ""삼성 노트북 Pen은 가벼워 어디에나 들고 다니며 작업하기 편했고 특히 작곡에 필요한 섬세한 작업에 S 펜이 유용했다""고 말했다. 삼성전자는 또 홍콩 출신의 아티스트 마크 알란테(Marc Allente)와 헤이즈의 \'젠가\'를 시각적으로 표현하는 일러스트레이션도 함께 공개한다. 전통적인 방식의 수채화 물감이나 잉크 등의 질감을 삼성 노트북 펜을 활용해 디지털 방식으로 표현한 작품이다.홍콩 출신 아티스트 마크 알란테가 \'삼성 노트북 Pen\'을 활용해 헤이즈의 신곡 \'젠가\'를 시각적으로 표현한 일러스트레이션 [사진 제공 : 삼성전자]\'Inspirational Connection\' 캠페인의 일환으로 삼성전자가 두 명의 아티스트와 협업한 음원과 일러스트레이션, 비하인드 영상은 캠페인 공식 홈페이지와 삼성전자 유투브, 페이스북 등 소셜채널에서 확인할 수 있다.삼성 노트북 Pen은 노트북 최초로 S 펜을 탑재하고 터치 디스플레이의 360도 회전을 지원해 기존 노트북과 차별화된 사용성을 제공한다. 특히 33.7㎝ 모델은 1㎏이 넘지 않는 초경량으로 편의성과 휴대성을 극대화한 제품이다.[디지털뉴스국 박진형 기자]▶뉴스 이상의 무궁무진한 프리미엄 읽을거리 ▶아나운서가 직접 읽어주는 오늘의 주요 뉴스[ⓒ 매일경제 & mk.co.kr, 무단전재 및 재배포 금지]매일경제 관련뉴스해당 언론사에서 선정하며 언론사 페이지(아웃링크)로 이동해 볼 수 있습니다.\'17세 연하남\' 류필립과 결혼한 \'46세\' 미나, \'핫보디\'MBC 측 ""김태호 PD 연출하는 \'무한도전\', 31일 종영""(공식)이효리 볼륨감 넘치는 화보…육감적인 몸매\'갈릭걸스\' 여자컬링팀 의성마늘햄 모델 됐다""49세 맞아?"" 김혜리, 신이 내린 \'美친 볼륨\' 드러내다좋아요0훈훈해요0슬퍼요0화나요0후속기사 원해요0기사제공 :']"
2,삼성전자, 2018-03-0811:02,헤럴드경제 ,"삼성전자, ‘삼성 노트북 Pen’으로 작사-작곡한 음원 발표",https://finance.naver.com/news/news_read.nhn?article_id=0001363135&office_id=016&mode=search&query=삼성전자&page=6,"['       삼성전자, ‘삼성 노트북 Pen’으로 작사-작곡한 음원 발표      기사입력2018-03-08 11:02기사원문좋아요훈훈해요좋아요 평가하기공감좋아요0훈훈해요0슬퍼요0화나요0후속기사 원해요0댓글- ‘삼성 노트북 Pen’으로 작사 작곡 한 헤이즈의 신곡 ‘젠가’ 공개- 아티스트 마크 알란테와 음원 일러스트레이션 작업도 진행[헤럴드경제=박세정 기자] 삼성전자는 국내 싱어송라이터 헤이즈와 협업해 2018년형 노트북 신제품 ‘삼성 노트북 Pen’을 활용해 제작한 음원을 발표한다고 8일 밝혔다.헤이즈는 이날 저녁 6시에 공개하는 미니앨범 ‘바람’의 타이틀곡 ‘젠가’를 ‘삼성 노트북 Pen’으로 직접 작사ㆍ작곡했다. 국내 가수 헤이즈가 삼성전자 ’삼성 노트북 Pen‘로 음원 제작 작업을 하고 있다. [제공=삼성전자]헤이즈 “평소 이동시간이 많아 이동 중에 녹음과 메모를 할 수 있는 기기가 필요했다”며 “‘삼성 노트북 Pen’은 가벼워 어디에나 들고 다니며 작업하기 편했고, 특히, 작곡에 필요한 섬세한 작업에 S펜이 유용했다”고 말했다.삼성전자는 홍콩 출신의 아티스트 마크 알란테(Marc Allente)와 헤이즈의 ‘젠가’를 시각적으로 표현하는 일러스트레이션도 함께 공개한다.수채화 물감이나 잉크 등의 질감을 ‘삼성 노트북 펜’을 활용해 디지털 방식으로 표현한 것이 특징이다.‘인스피레이셔널 코넥션(Inspirational Connection)’ 캠페인의 일환으로 삼성전자가 두 명의 아티스트와 협업한 음원과 일러스트레이션, 비하인드 영상은 캠페인 공식 홈페이지와 삼성전자 유튜브, 페이스북 등 소셜채널에서 확인할 수 있다.한편, ‘삼성 노트북 Pen’은 노트북 최초로 S펜을 탑재하고, 360도 회전 터치 디스플레이를 탑재했다. 특히 33.7㎝ 모델은 1㎏이 넘지 않는 초경량으로 편의성과 휴대성을 높였다는 평가다.sjpark@heraldcorp.com▶10만원대 수량한정 프랑스 명품 커트러리 세트!▶헤럴드경제 채널 구독하기 ▶한입뉴스 ‘타파스’ 페이스북 친구맺기 - Copyrights ⓒ 헤럴드경제 & heraldbiz.com, 무단 전재 및 재배포 금지 -헤럴드경제 관련뉴스해당 언론사에서 선정하며 언론사 페이지(아웃링크)로 이동해 볼 수 있습니다.문정인 ""한미동맹 해한 적 없다…주한미군 철수론자 아냐""박수현 ""내연녀 공천? 치졸한 정치공작…법적대응""홍준표 ""안희정 사건, 임종석이 기획했다고 하더라""안희정 성폭행 추가 피해자 등장…""김지은씨 보고 폭로 결심""안희정 측근 ""안희정 성폭력, 도청내 추가 피해자는 없다""좋아요0훈훈해요0슬퍼요0화나요0후속기사 원해요0기사제공 :']"
3,삼성전자, 2018-03-0811:02,헤럴드경제 ,"원료 이력관리부터 판매량 예측까지…삼성SDS, AI-블록체인 스마트물류 사업 박차",https://finance.naver.com/news/news_read.nhn?article_id=0001363145&office_id=016&mode=search&query=삼성전자&page=6,"['       원료 이력관리부터 판매량 예측까지…삼성SDS, AI-블록체인 스마트물류 사업 박차      기사입력2018-03-08 11:02기사원문좋아요훈훈해요좋아요 평가하기공감좋아요0훈훈해요0슬퍼요0화나요0후속기사 원해요0댓글- AI로 매장 판매량 예측, 재고 줄이고, 효율성 높여- 원료, 제조, 유통 전과정 블록체인 기술로 공유. 고객 신뢰도↑[헤럴드경제=박세정 기자]삼성SDS가 인공지능(AI), 블록체인 기술을 접목한 ‘지능형 물류 서비스’를 확대하기 위해 전자상거래(이커머스, e-Commerce) 사업 분야를 집중 공략한다.소비자들은 QR코드만 찍으면 내가 먹는 식품의 원산지, 제조, 유통과정을 확인할 수 있다. AI가 유통 매장의 판매량을 예측해 재고를 줄이는 서비스가 더욱 활발해질 전망이다.8일 삼성SDS는 경기도 성남시에 위치한 삼성SDS 판교 캠퍼스에서 가진 기자간담회에서 스마트 물류 서비스 사례를 소개하고 이같은 계획을 밝혔다. 삼성SDS 관계자들이 ‘글로벌 컨트롤 센터’에서 서비스를 모니터링하고 있다. [제공=삼성SDS]삼성SDS의 ‘지능형 물류 서비스’는 AI와 블록체인 기술을 물류 과정 전반에 접목한 것이 핵심이다.실제 삼성전자 오스트리아 가전 유통 매장에서는 삼성SDS의 AI 기반 빅데이터 플랫폼인 ‘브라이틱스(Brightics) AI’가 접목된 물류 시스템이 활용되고 있다.이 기술은 날씨, 지역 상황, 매장의 최근 판매량 등 30여 가지가 넘는 요소를 AI가 분석해 각 매장별 판매량을 예측한다. 재고를 최소화해 판매 효율화를 높이기 위한 취지다.이곳에 지난 1년 반 동안 삼성SDS의 지능형 물류 서비스를 적용한 결과, 실제 판매 예측 정확도가 기존보다 25%포인트 이상 향상됐다고 회사 측은 설명했다.전 매장의 통합관리가 가능한 배송센터를 구축해 효율성을 높인 점도 특징이다.기존에는 각 매장별로 재고가 부족할 경우, 배송센터에서 재고가 남은 매장을 찾아 판매 매장으로 물건을 보내고, 소비자가 매장에서 이를 다시 받아가는 과정으로 구매가 이뤄졌다.삼성SDS가 구축한 통합 배송센터를 통해 매장에 재고가 부족할 경우, 배송센터에서 매장을 거치지 않고 소비자에게 바로 전송이 가능한 물류 서비스도 가능해졌다.이와 함께 삼성SDS는 블록체인 기술을 접목한 물류 서비스도 현재 부산 삼진어묵 제조 과정에서 시범 적용해 활용 중이다.삼진어묵에 적용된 블록체인 기반 ‘유통이력 관리 시스템’은 원료의 입고부터 가공, 포장, 판매에 이르는 생산과 유통 과정의 모든 정보를 소비자에게 공유한다.소비자는 스마트폰으로 제품 포장지에 있는 QR코드를 찍으면 원산지, 제조사, 제조일, 유통기한, 판매점 등 모든 정보를 한 눈에 확인할 수 있게 된다.회사는 위조, 변조가 불가능한 블록체인 기술을 적용해 식품의 제조, 유통 과정에서 소비자 신뢰를 높일 수 있다고 설명했다.삼성SDS는 자체 물류 서비스 플랫폼인 ‘첼로(Cello)’를 기반으로 앞으로 제조를 넘어 이커머스 분야를 핵심 먹거리로 삼고 집중적으로 공략한다는 목표다. 온라인 상으로 이뤄지는 구매와 배송 등의 물류 과정이 AI, 블록체인 기술을 활용할 여지가 많다는 판단에서다. 국내 뿐 아니라 해외 시장 진출도 힘을 싣는다. 김형태 삼성SDS 물류사업부문장(부사장)은 “혁신적인 물류 서비스를 지속적으로 추진할 것”이라며 “물류 생태계를 확대하기 위해 관련 업계와 협업할 수 있는 지능형 물류 플랫폼 서비스를 본격적으로 선보일 계획”이라고 말했다.sjpark@heraldcorp.com▶10만원대 수량한정 프랑스 명품 커트러리 세트!▶헤럴드경제 채널 구독하기 ▶한입뉴스 ‘타파스’ 페이스북 친구맺기 - Copyrights ⓒ 헤럴드경제 & heraldbiz.com, 무단 전재 및 재배포 금지 -헤럴드경제 관련뉴스해당 언론사에서 선정하며 언론사 페이지(아웃링크)로 이동해 볼 수 있습니다.문정인 ""한미동맹 해한 적 없다…주한미군 철수론자 아냐""박수현 ""내연녀 공천? 치졸한 정치공작…법적대응""홍준표 ""안희정 사건, 임종석이 기획했다고 하더라""안희정 성폭행 추가 피해자 등장…""김지은씨 보고 폭로 결심""안희정 측근 ""안희정 성폭력, 도청내 추가 피해자는 없다""좋아요0훈훈해요0슬퍼요0화나요0후속기사 원해요0기사제공 :']"
4,삼성전자, 2018-03-0811:00,한국경제TV ,[이 시각 코스피] 코스피 현재 2414.98p 상승세 지속,https://finance.naver.com/news/news_read.nhn?article_id=0000609092&office_id=215&mode=search&query=삼성전자&page=6,"['       [이 시각 코스피] 코스피 현재 2414.98p 상승세 지속      기사입력2018-03-08 11:00기사원문좋아요훈훈해요좋아요 평가하기공감좋아요0훈훈해요0슬퍼요0화나요0후속기사 원해요0댓글[한국경제TV 라이온봇 기자][코스피 장중 시황]3월 8일 11시 0분 코스피는 전일 대비 13.16p(0.55%) 상승한 2414.98p를 기록하고 있다.규모별로는 대형주(0.36%), 중형주(0.36%), 소형주(0.64%) 모두 강세를 나타내고 있다.[업종동향][그림 1] 업종별 상위 TOP5 (단위 : %)[그림 2] 업종별 하위 TOP5 (단위 : %)업종별로는 상승이 우세하다.의약품(3.11%), 종이,목재(1.85%), 철강,금속(1.31%), 서비스업(1.12%), 음식료품(1.1%), 건설업(0.98%), 섬유의복(0.76%), 기계(0.74%), 유통업(0.66%), 제조업(0.65%), 운수장비(0.6%), 은행(0.42%), 전기,전자(0.22%), 화약(0.17%), 금융업(0.16%), 증권(0.04%) 등은 상승세를 나타냈다.  반면, 전기가스업(-0.14%), 통신업(-0.19%), 보험(-0.28%), 비금속광물(-0.59%), 운수창고(-0.76%), 의료정밀(-1.25%) 등은 하락세를 나타냈다. [시가총액 상위 종목 동향]시가총액 상위 10개 기업은 대부분 기업이 상승세를 기록하고 있다.""대장주"" 삼성전자는 전일(2,431,000원) 대비 5,000원(0.21%) 오른 2,436,000원에 거래되고 있다.셀트리온(6.62%), POSCO(2.01%), KB금융(0.81%), 삼성바이오로직스(0.45%), 삼성물산(0.39%), NAVER(0.38%), SK하이닉스(0.12%) 등은 상승세를 나타냈다. 현대차 종목은 보합세를 보이고 있다.  반면에, LG화학(-1.17%) 등은 약세를 보이고 있다. 라이온봇 기자 -한국경제TV※ 본 기사는 한국경제TV와 \'거장들의 투자공식이\'자체 개발한 \'라이온봇 기자\'가 실시간으로 작성한 기사입니다.라이온봇기자 ⓒ 한국경제TV, 무단 전재 및 재배포 금지한국경제TV 관련뉴스해당 언론사에서 선정하며 언론사 페이지(아웃링크)로 이동해 볼 수 있습니다.""배현진 아나운서는 \'공주병\'""…과거 동료기자 폭로 무엇?서진호 남편 김형석, 임재범 몸 더듬는 사연은?미나 류필립 결혼, 혼인신고도 이미 완료 \'속전속결\'NRG 문성훈 ""아버지 간 80% 이식 후유증"" 눈길여성 BJ 투신, 생방송 중 강아지 안고 8층서 뛰어내려좋아요0훈훈해요0슬퍼요0화나요0후속기사 원해요0기사제공 :']"
