,회사명,날짜,언론사,기사제목,링크,본문
0,삼성전자, 2018-10-1423:01,뉴스1 ,"'넥쏘' 타고 파리 시내 달린 文대통령, 한-불 수소경제 손잡았다",https://finance.naver.com/news/news_read.nhn?article_id=0003636784&office_id=421&mode=search&query=삼성전자&page=1,"['       \'넥쏘\' 타고 파리 시내 달린 文대통령, 한-불 수소경제 손잡았다      기사입력2018-10-14 23:01기사원문좋아요훈훈해요좋아요 평가하기공감좋아요0훈훈해요0슬퍼요0화나요0후속기사 원해요0댓글유럽순방 文대통령, 현대차 프랑스 수출 1호 수소전기차 시승현대차-에어리퀴드-엔지, 수소차·충전인프라 확대 MOU문재인 대통령이 지난2월2일 오전 서울 서초구 만남의 광장 휴게소에서 신형 수소 자율차량인 넥쏘를 시승하고 있다. (청와대 제공) 2018.2.2/뉴스1 © News1 김명섭 기자(서울=뉴스1) 오상헌 기자 = 유럽 5개국을 순방 중인 문재인 대통령이 14일(현지시간) 오후 첫 방문지 프랑스에서 현대자동차의 현지 1호 수출 수소전기차인 \'넥쏘\'를 직접 시승했다. 지난 8월 삼성전자 인도 스마트폰 생산시설인 노이다공장, 지난 5일 SK하이닉스 청주 M15 공장 준공식 참석에 이어 기업 \'기 살리기\'를 위한 현장 방문에 또다시 나선 것이다. 현대차는 문 대통령의 프랑스 방문 기간에 세계적 산업용 가스회사인 에어리퀴드, 다국적 에너지기업 엔지와 수소전기차·수소충전 인프라 확대를 위한 공동 양해각서(MOU)를 체결한다.◇한-프 \'수소경제\' 신산업 협력 현장 방문 \'넥쏘 시승\'문 대통령 내외는 이날 현대차가 프랑스에 수출한 첫 번째 차세대 수소전기차 \'넥쏘\'에 직접 탑승했다. 도심의 수소 충전소를 활용해 파리 시내를 달리는 한국의 수소차를 직접 시승하고, 한국과 프랑스 양국의 신산업 협력사업을 우회 지원하는 현장 방문의 하나다. 문 대통령은 앞서 지난 2월 현대차의 자율주행 최신 기술을 접목한 \'넥쏘\'를 타고 경부고속도로 만남의광장에서 판교 나들목까지 이르는 7㎞가량을 달린 적이 있다. 궁극의 에너지이자 친환경차로 불리는 수소차 기반 경제 활성화와 세계 최초로 수소차를 양산한 현대차의 수출 확대에 힘을 싣는 행보를 국내외에서 잇따라 가진 셈이다.시승 후 문 대통령은 파리 도심 알마광장의 수소충전소에서 투싼 수소전기차 택시를 직접 운전하는 현지 운전사의 충전 시연도 직접 참관했다. 이 충전소는 에어리퀴드가 파리 시내에 설치한 첫 번째 충전 시설이다. 급속 충전에 30여분이 소요되는 배터리 전기차의 10분의 1인 3분이면 충전이 끝난다. 현대차 투싼 수소전기차 택시는 현지에서 \'파란 하늘\'의 래핑 이미지로 유명하다. 오염물질 배출이 전혀없는 친환경 도심 대중교통으로 주목받아 2016년 5대에서 지금은 62대가 파리 시내를 달린다. 문 대통령은 현대차와 에어리퀴드 관계자들로부터 수소전기차 기술개발 동향과 충전 인프라 활성화 방안 등에 대한 설명을 들었다. 정진행 현대차 사장은 ""파리는 수소충전소가 도심에 위치하고 있지만 한국은 수소에 대한 오해와 안전기준 등으로 도시 외곽에 주로 설치되고 있다""며 ""프랑스 사례를 벤치마킹 할 필요가 있다""고 했다.◇현대차-에어리퀴드-엔지와 3자 MOU \'수소 협력\'현대차는 2025년까지 프랑스에 승용차, 버스, 트럭 등을 합해 5000대의 수소전기차를 보급할 계획이다. 이를 위해 오는 16일 에어리퀴드, 엔지와 수소전기차 및 수소충전소 보급 확대를 위한 3자 MOU를 체결한다. 전 지구적 과제인 온난화를 방지하고 대기오염을 줄이기 위해 에어리퀴드와 엔지는 2025년까지 충분한 수소충전 인프라를 구축한다. 3사는 수소충전 인프라 구축과 새 비즈니스 모델 공동 개발에도 나선다. 친환경차 본고장인 유럽 각국 정부의 재정적 지원을 끌어내고, 수송용 수소 연료 활용도 제고 방안도 마련한다. 세계 최고 수준의 수소 기술 경쟁력을 갖춘 에어리퀴드는 한국에서도 수소 충전 및 생산 인프라 확대 노력을 강화한다. 국내에 연말 설립되는 특수목적법인(SPC)에 참여한다. SPC는 자본금 2000억원을 마련해 2022년까지 국내에 100기의 수소충전소를 구축할 계획이다. 에어리퀴드는 최근 여수국가산업단지에 수소·일산화탄소 등 산업용 가스를 생산하는 제4공장 건립을 위해 전라남도·여수시와 1300억원 규모의 투자협약도 체결했다. 현대차는 이번 3자 MOU가 수소전기차 제조, 수소 생산 및 충전소 구축, 에너지 생산과 인프라 구축 분야의 세계적인 전문기업들이 손을 잡았다는 점에서 의미가 크다고 강조했다. 정진행 현대차 사장은 ""글로벌 수소전기차 기술 리더십을 지속적으로 확보하는 것은 물론 수소전기차 대중화를 위한 혁신적인 협력모델 제시 노력도 계속 해나갈 것""이라고 말했다.bborirang@news1.kr▶ 진짜 블록체인을 만나는 곳 \'크립토허브\' 오픈! ▶ 제보하기▶ 네이버 메인에서 [뉴스1]을 구독해주세요[© 뉴스1코리아(news1.kr), 무단 전재 및 재배포 금지]뉴스1 관련뉴스해당 언론사에서 선정하며 언론사 페이지(아웃링크)로 이동해 볼 수 있습니다.자기 가게 놔두고…편의점 야간알바 뛰는 스킨푸드 점주홍준표 ""얼치기좌파에 경제정책 안 바뀌어…경질하라""온라인으로 치명적 독사 구입해 자살 시도쇼핑백에 구멍 뚫어…정류장서 치마속 촬영""일 못나가 화나서""…행인 흉기위협한 일용근로자좋아요0훈훈해요0슬퍼요0화나요0후속기사 원해요0기사제공 :']"
1,삼성전자, 2018-10-1419:17,국민일보 ,스마트폰 출고가 ‘100만원 저항선’ 무너졌다,https://finance.naver.com/news/news_read.nhn?article_id=0001139248&office_id=005&mode=search&query=삼성전자&page=1,"[""       스마트폰 출고가 ‘100만원 저항선’ 무너졌다      기사입력2018-10-14 19:17기사원문좋아요훈훈해요좋아요 평가하기공감좋아요0훈훈해요0슬퍼요0화나요0후속기사 원해요0댓글갤 노트9와 LG V40, 아이폰Xs는 200만원?프리미엄 스마트폰 출고가에 대한 심리적 저항선인 100만원이 무너졌다. 스마트폰 교체 주기가 길어지면서 수요가 점차 줄자 가격을 올려 실적을 만회하려는 기업들의 전략이 자리를 잡아가고 있다는 분석이다. 사용자 입장에서도 이왕 오래 쓴다면 비싸더라도 좋은 제품을 사겠다는 계산이 깔려 있다. 하반기 국내에 출시되는 주요 프리미엄 스마트폰의 출고가는 모두 100만원을 넘는다. LG전자는 V40 출고가를 104만9400원으로 결정했다고 14일 밝혔다. 지난해 V30의 경우 출고가가 94만9300원이었다. V35 등 일부 파생 모델을 제외하고 V 시리즈 출고가가 100만원을 넘어간 것은 이번이 처음이다. 앞서 삼성전자는 갤럭시 노트9 출고가를 128GB 109만4500원, 512GB 135만3000원으로 결정했다. 128GB 모델은 지난해 노트8 64GB와 같은 가격에 나왔지만 512GB 모델은 노트8 256GB 모델(125만4000원)보다 10만원가량 비싸졌다. 다음 달 2일 국내 출시가 유력한 애플 아이폰Xs의 경우 가장 비싼 모델이 200만원에 육박할 것이라는 예상이 나온다. 애플은 올해 아이폰Xs와 아이폰Xs 두 가지 모델을 출시했는데 가장 저렴한 아이폰Xs 64GB 모델이 999달러(약 113만원)부터 시작된다. 지난해 아이폰X의 경우 국내 출고가가 136만원부터였다. 올해는 이보다 더 비싸질 것으로 예상된다. 업체들이 스마트폰 출고가를 올리는 것은 지난해 아이폰X으로 사상 최대 실적을 달성한 애플의 전략이 주효했다고 판단했기 때문으로 해석된다. 아이폰X는 비싸다는 비판을 받고 실제 판매량도 이전 모델보다 줄었지만 가격 인상 덕분에 애플의 사상 최대 매출을 견인했다. 시장조사 업체 카운터포인트리서치는 “스마트폰은 자기 전까지 이용하고, 일어나자마자 본다. 일과 중에도 손이 닿는 곳에 늘 있다. 또 자동차나 집처럼 자신을 과시하는 역할도 한다”면서 “이런 이유로 사람들은 1000달러 이상을 지불하는 것도 과하다고 생각하지 않는 것 같다”고 설명했다. 스마트폰 가격이 비싸지는 건 국내뿐만 아니라 전 세계적인 경향이다. 올해 2분기 스마트폰 평균 판매가격(ASP)은 미국이 457달러로 지난해보다 27% 올랐다. 중국은 290달러로 미국보다 낮았지만 증가율은 20%로 높은 편이었다. 스마트폰 가격이 오르면서 보상판매, 중고보상 등 구매 지원 프로그램도 등장하고 있다. 삼성전자는 11월 30일까지 노트9 구매 고객이 갤럭시S, 노트 시리즈 스마트폰을 반납할 경우 중고 시세에 최대 10만원을 추가 보상하는 프로그램을 실시한다. LG전자는 V40 구매 고객이 2년 후 새로운 LG전자 스마트폰을 구입할 경우 최대 40%의 가격을 보상하는 업그레이드 프로그램을 마련했다. 또 V40을 구매하면서 V20 등 기존 LG전자 스마트폰을 반납하면 보상하는 ‘LG 고객 안심 보상 프로그램’도 선보인다.김준엽 기자 snoopy@kmib.co.kr[네이버 메인에서 채널 구독하기] [페이스북][취재대행소 왱!(클릭)]GoodNews paper ⓒ 국민일보(www.kmib.co.kr), 무단전재 및 재배포금지국민일보 관련뉴스해당 언론사에서 선정하며 언론사 페이지(아웃링크)로 이동해 볼 수 있습니다.김성태TV '한 놈만 팬다' 첫회…'싫어요' 8322개, '좋아요' 67개 (영상)수상한 MB 광복절 특별 사면…살인범 320명?'고약하다'의 어원, 세종에게 목숨 걸고 직언한 '고약해'90대 할머니 전동휠체어 타고 고속도로 역주행다투던 친구 찌른 뒤… 인천 아파트 13층서 벌어진 일좋아요0훈훈해요0슬퍼요0화나요0후속기사 원해요0기사제공 :""]"
2,삼성전자, 2018-10-1419:15,국민일보 ,"[포토] 삼성전자, ‘포르쉐 익스피리언스’ 행사에 ‘LED 포 홈’ 전시",https://finance.naver.com/news/news_read.nhn?article_id=0001139246&office_id=005&mode=search&query=삼성전자&page=1,"[""       [포토] 삼성전자, ‘포르쉐 익스피리언스’ 행사에 ‘LED 포 홈’ 전시      기사입력2018-10-14 19:15기사원문좋아요훈훈해요좋아요 평가하기공감좋아요0훈훈해요0슬퍼요0화나요0후속기사 원해요0댓글삼성전자가 17일까지 말레이시아 세팡 국제자동차경기장에서 개최되는 '포르쉐 익스피리언스' 행사의 하이라이트 공간에 설치한 'LED 포 홈'과 디지털 플립차트 '삼성 플립'을 통해 시승 참가자들이 사전 주행 브리핑을 듣고 있다. 삼성전자 제공[네이버 메인에서 채널 구독하기] [페이스북][취재대행소 왱!(클릭)]GoodNews paper ⓒ 국민일보(www.kmib.co.kr), 무단전재 및 재배포금지국민일보 관련뉴스해당 언론사에서 선정하며 언론사 페이지(아웃링크)로 이동해 볼 수 있습니다.김성태TV '한 놈만 팬다' 첫회…'싫어요' 8322개, '좋아요' 67개 (영상)수상한 MB 광복절 특별 사면…살인범 320명?'고약하다'의 어원, 세종에게 목숨 걸고 직언한 '고약해'90대 할머니 전동휠체어 타고 고속도로 역주행다투던 친구 찌른 뒤… 인천 아파트 13층서 벌어진 일좋아요0훈훈해요0슬퍼요0화나요0후속기사 원해요0기사제공 :""]"
3,삼성전자, 2018-10-1418:22,디지털타임스 ,영업익 40.2% 삼성·SK 반도체서 나왔다 … 고점 현실화 우려,https://finance.naver.com/news/news_read.nhn?article_id=0002486817&office_id=029&mode=search&query=삼성전자&page=1,"['       영업익 40.2% 삼성·SK 반도체서 나왔다 … 고점 현실화 우려      기사입력2018-10-14 18:22기사원문좋아요훈훈해요좋아요 평가하기공감좋아요0훈훈해요0슬퍼요0화나요0후속기사 원해요0댓글하반기 메모리반도체값 내림세쏠림 심각한 한국경제 \'비상등\'스마트폰 등 큰폭 성장 어려워재계 ""새로운 성장동력 찾아야""반도체 빼면 우울한 한국[디지털타임스 박정일 기자] 국내 시가총액 100대 기업의 영업이익 가운데 40%가 삼성전자 반도체와 SK하이닉스로부터 나온 것으로 집계됐다. 세계 반도체 시장의 영업이익 절반 이상을 책임지는 양사의 위상을 보여주는 대목이지만, 메모리반도체 가격이 내림세로 돌아서고 있어 우리 경제 전반의 침체를 우려하는 목소리도 커지고 있다.14일 관련 업계와 기업 경영성과 평가사이트 CEO스코어에 따르면 올해 상반기 기준으로 시가총액 상위 100대 기업의 전체 영업이익에서 삼성전자 반도체 사업부와 SK하이닉스의 영업이익이 차지하는 비중은 40.2%로 집계됐다. 시총 100대 기업의 전체 영업이익(약 82조2820억원) 중 삼성전자 반도체 사업부의 영업이익은 약 23조1563억원, SK하이닉스는 약 9조9413억원이었다.두 회사의 실적은 최근 2년 동안 급상승했다. 2013년부터 2016년까지 100대 기업 영업이익의 15~20% 수준이었던 두 회사의 비중은 지난해 34.3%로 급증한 데 이어 올해는 40%까지 넘어섰다. 메모리반도체 수요가 크게 늘면서 가격이 급등했기 때문이다. 시장조사업체 D램익스체인지에 따르면 대표 품목인 D램 기준제품의 경우 지난달 말 기준 2016년 6월 말과 비교해 무려 179%나 가격이 상승했고, 낸드플래시 역시 같은 기간 41% 가량 올랐다.이로 인해 세계 D램 시장의 4분의 3 가량을 차지하는 삼성전자와 SK하이닉스의 실적은 수직 상승했다. 세계 반도체 1위 기업으로 도약했고, 작년 기준 이들 상위 10개사의 전체 영업이익 가운데 삼성전자가 차지하는 비중은 38.8%, SK하이닉스가 15.1%로, 이 둘을 합쳐 한국 기업이 세계 반도체 시장 영업이익에서 차지하는 비중은 53.9%에 달했다. 매출 기준으로도 삼성전자는 인텔을 제치고 세계 1위, SK하이닉스는 3위를 각각 차지했다.하지만 올해 하반기부터 메모리반도체 가격이 점차 하락할 것이라는 전망이 나오면서, 반도체에 쏠린 한국 경제 전반의 침체에 대한 우려가 커지고 있다. D램익스체인지는 내년 D램 가격이 올해보다 15∼20% 하락하고, 낸드플래시는 25∼30%나 떨어질 것으로 내다보고 있다. 업계에서도 내년 상반기까지는 가격 조정이 불가피할 것으로 전망하고 있다.반도체를 이어갈 다음 성장동력도 보이지 않는다. 주력 수출품목인 스마트폰과 가전은 중국의 공세, 자동차와 철강 등은 글로벌 보호무역 등의 영향으로 큰 폭의 성장을 기대하기 어렵다. 화장품과 바이오, 이차전지 배터리 등이 주목받고 있지만, 반도체를 대체할 만한 수준은 아니다.재계 관계자는 ""반도체 코리아의 위상은 자랑할 만한 일이지만, 특정 업종에 대한 쏠림이 너무 크다는 것은 부담""이라며 ""반도체의 경우 중국의 성장과 보호무역 등 수많은 견제를 극복해야 하고, 동시에 새로운 성장동력도 찾아야 한다는 게 한국 산업의 숙제""라고 말했다.박정일기자 comja77@dt.co.kr                                                                                                                                                                                                                                                                                                                                                                                                                                                                                                                                                                                                                                                                                                                                                                                                                                                                                                                                                                                                                                    디지털타임스 홈페이지 바로가기 / 디지털타임스 뉴스 더보기네이버 채널에서 \'디지털타임스\'를 구독해주세요.디지털타임스 관련뉴스해당 언론사에서 선정하며 언론사 페이지(아웃링크)로 이동해 볼 수 있습니다.지하철역 곳곳에 붙어있는 이통사 표식들 뭔가했더니…에쓰오일, 5조 대형프로젝트 상업가동 계속 연기되는 이유가글로벌 금융 \'슈퍼위크\'… 증시 불안감 커진다부동산 \'단타족\'전성시대… 5년간 26조 챙겼다위풍당당 수입차? \'불자동차\'등 여파 고꾸라졌다좋아요0훈훈해요0슬퍼요0화나요0후속기사 원해요0기사제공 :']"
4,삼성전자, 2018-10-1418:21,디지털타임스 ,外資 이탈 충격… 10대그룹도 이달만 65兆 빠졌다,https://finance.naver.com/news/news_read.nhn?article_id=0002486805&office_id=029&mode=search&query=삼성전자&page=1,"[""       外資 이탈 충격… 10대그룹도 이달만 65兆 빠졌다      기사입력2018-10-14 18:21기사원문좋아요훈훈해요좋아요 평가하기공감좋아요0훈훈해요0슬퍼요0화나요0후속기사 원해요0댓글 [디지털타임스 김민주 기자]미국의 추가 금리인상 이후 외국인 이탈 가속화로 국내 증시가 부진한 가운데, 국내 10대 그룹의 상장사 시가총액이 10월 들어서만 65조원 가까이 준 것으로 나타났다.14일 재벌닷컴에 따르면 자산 상위 10대 그룹 95개 상장사의 시가총액(우선주 포함)은 지난 12일 현재 864조9670억원(이하 종가 기준)으로 집계됐다. 이는 9월말의 929조4060억원보다 64조4380억원(6.9%) 감소한 수준이다.같은 기간 국내 주식시장(코스피+코스닥)의 시총은 1840조8830억원에서 1691조6840억원으로 149조1990억원(8.1%) 줄었다.그룹별로는 삼성그룹의 시총이 498조8530억원에서 467조3880억원으로 31조4650억원(6.3%)이나 줄어 10대 그룹 중 시총 감소액이 가장 컸다. 특히 삼성전자(우선주 제외) 시총이 298조1780억원에서 282조4500억원으로 15조7270억원 줄었다.현대차그룹도 현대차와 현대모비스 등 주력사를 중심으로 시총이 94조6030억원에서 83조5340억원으로 11조690억원(11.7%) 감소했다. LG그룹은 LG화학 시총이 지난달 말보다 3조5300억원 줄고, LG생활건강도 2조5610억원 감소한 영향으로 그룹 시총이 10조5150억원(11.2%) 사라졌다.SK그룹도 SK, SK텔레콤, SK하이닉스, SK이노베이션 등 주력회사를 중심으로 시총이 126조4090억원에서 122조7050억원으로 3조7040억원(2.9%) 증발했다.이밖에 포스코그룹의 시총이 3조2010억원 줄었고 한화그룹(1조2760억원)과 롯데그룹(1조1340억원)도 각각 1조원 넘게 시총이 감소했다.그다음으로 현대중공업그룹(9920억원), 농협그룹(7080억원), GS그룹(3730억원) 등 순으로 시총 감소액이 컸다.10대 그룹 모두 조정 장세를 피하지 못한 채 일제히 시총이 감소했다.김민주기자 stella2515@dt.co.kr                                                                                                                                                                                                                                                                                                                                                                                                                                                                                                                         디지털타임스 홈페이지 바로가기 / 디지털타임스 뉴스 더보기네이버 채널에서 '디지털타임스'를 구독해주세요.디지털타임스 관련뉴스해당 언론사에서 선정하며 언론사 페이지(아웃링크)로 이동해 볼 수 있습니다.지하철역 곳곳에 붙어있는 이통사 표식들 뭔가했더니…에쓰오일, 5조 대형프로젝트 상업가동 계속 연기되는 이유가글로벌 금융 '슈퍼위크'… 증시 불안감 커진다부동산 '단타족'전성시대… 5년간 26조 챙겼다위풍당당 수입차? '불자동차'등 여파 고꾸라졌다좋아요0훈훈해요0슬퍼요0화나요0후속기사 원해요0기사제공 :""]"
