,회사명,날짜,언론사,기사제목,링크,본문
0,삼성전자, 2018-07-0516:52,한국경제 ,삼성전자 갤럭시·QLED TV·셰프컬렉션 등 9개 제품 14년간 '1위',https://finance.naver.com/news/news_read.nhn?article_id=0003974216&office_id=015&mode=search&query=삼성전자&page=4,"['       삼성전자 갤럭시·QLED TV·셰프컬렉션 등 9개 제품 14년간 \'1위\'      기사입력2018-07-05 16:52기사원문좋아요훈훈해요좋아요 평가하기공감좋아요0훈훈해요0슬퍼요0화나요0후속기사 원해요0댓글2018 글로벌고객만족도글로벌고객만족도(GCSI)는 글로벌 시대에 기업들이 세계수준의 고객만족도를 얼마나 충족시키는지 판단하는 지수다. 각 기업의 수준 높은 고객만족 경영을 지원하기 위해 2005년 제정된 평가 제도로 올해 14년차를 맞았다.글로벌 관점에서 고객만족도 평가 시스템을 개발해 이를 개별 국가별로 측정했다. 고객만족경영에 대한 인식을 높이면서 국가별 글로벌 산업경쟁력 지표를 제공한다. 각 산업군을 대표하는 고객만족 경영 우수기업을 발굴해 성장 기반을 조성하고 고객만족경영 역량을 강화하는 데 기여하고 있다.GCSI는 글로벌 경영을 목표로 하는 기업에 고객만족 경영의 척도가 된다. 동시에 고객이 만족할 만한 요소를 발굴하면서 전략을 수립하고 이를 실천할 방안도 제시하고 있다. 이를 통해 궁극적으로 기업가치 개선, 고객가치 관점의 경영전략 수립에 기여한다는 평가를 받고 있다.삼성전자는 스마트폰 부문의 갤럭시 외에 삼성 QLED TV, 삼성 노트북, 삼성 플렉스워시, 삼성 셰프컬렉션, 삼성 청소기 등 9개 상품으로 14년간 각 부문에서 지속적으로 1위 자리에 올랐다. 아파트 부문의 GS건설 자이, 항공여객운송서비스 부문의 대한항공, 자동차보험의 현대해상 하이카, 은행 부문의 신한은행 등 6개 제품·서비스도 조사 시행 이후 14년 연속 1위를 유지했다.삼성 공기청정기, 삼성 김치냉장고, 하이카 다이렉트 등 3개 상품은 13년 연속 정상에 올랐다. 청호나이스의 이과수 얼음정수기와 현대해상의 하이라이프 등은 각각 11년과 10년 연속 1위로 선정됐다. CJ CGV와 티웨이항공, 넥센타이어, 롯데월드 어드벤처, 쌍방울은 각 부문에서 고객 만족역량이 높은 상품으로 1위를 차지했다.전체 186개 조사 부문 중 88개 부문의 상품이 14년간 5회 이상 1위로 선정됐다. 고객만족역량이 우수한 상품들이 소비자의 꾸준한 사랑을 받는 선순환이 이뤄지는 것으로 분석됐다. 올해 글로벌경영협회는 지난 4월 5차 글로벌 브랜드부가가치(GBVA) 조사 평가 제도를 시행했다. 10여 년간의 GCSI 빅데이터를 기반으로 고객부가가치평가제도(CVA: Customer Value Added) 프로그램을 추진하고 있다. 이를 통해 무형자산 가치 평가 제도를 지속적으로 확대 추진할 계획이다.2018 GCSI 글로벌 고객만족역량 조사결과2018 GCSI 글로벌 고객만족역량 조사결과2018 GCSI 글로벌 고객만족역량 조사결과[한경닷컴 바로가기] [글방] [모바일한경 구독신청] ⓒ 한국경제 & hankyung.com, 무단전재 및 재배포 금지한국경제 관련뉴스해당 언론사에서 선정하며 언론사 페이지(아웃링크)로 이동해 볼 수 있습니다.13억이던 대치동 아파트, 2개월 만에 집값이…""아이 좀 잠깐 봐달라"" 카페에 맡기고 가 버린 엄마은퇴자, 퇴직금 5000만원 투자했는데… \'분통\'분양가 7억원 고덕래미안, 9호선 개통소식에…""편의점서 타이레놀 팔았더니…"" 약사들 \'몽니\'좋아요0훈훈해요0슬퍼요0화나요0후속기사 원해요0기사제공 :']"
1,삼성전자, 2018-07-0516:50,한국경제TV ,"삼성전자, '삼성 파운드리 포럼 2018 코리아' 개최",https://finance.naver.com/news/news_read.nhn?article_id=0000657585&office_id=215&mode=search&query=삼성전자&page=4,"['       삼성전자, \'삼성 파운드리 포럼 2018 코리아\' 개최      기사입력2018-07-05 16:50기사원문좋아요훈훈해요좋아요 평가하기공감좋아요0훈훈해요0슬퍼요0화나요0후속기사 원해요0댓글[한국경제TV 정재홍 기자]삼성전자가 오늘(5일) 서울 그랜드 인터컨티넨탈 파르나스 호텔에서 \'삼성 파운드리 포럼 2018 코리아\'를 개최하고 국내 팹리스(반도체 설계 전문 회사)를 위한 최첨단 파운드리 솔루션을 선보였다고 밝혔습니다.이날 포럼에서 삼성전자는 2020년 3나노에 이르는 첨단 공정 로드맵을 소개하고 앞선 파운드리 솔루션을 통해 국내 팹리스 고객의 사업 성장을 전폭 지원하겠다고 설명했습니다.삼성전자는 12인치(300mm) 웨이퍼 기반의 공정 설계 자산(IP) 포트폴리오와 MP(Multi Project Wafer) 프로그램의 지원을 확대해 고객의 제품 완성도와 편의성을 향상시킬 계획입니다.특히 7나노와 5나노 극자외선(EUV) 공정에서 Arm의 \'Artisan® physical IP 플랫폼\'을 제공함으로써 팹리스 고객들이 동작속도 3GHz 수준의 고성능 SoC 제품 개발을 할 수 있도록 지원한다고 설명했습니다.이어 팹리스 고객에게 최적의 솔루션을 제공하고자 \'SAFE(Samsung Advanced Foundry Ecosystem)\' 파트너로 국내 반도체 디자인 서비스 전문 기업인 알파홀딩스, 가온칩스, 하나텍을 추가해 MPW 프로그램의 지원을 확대한다고 덧붙였습니다.SAFE(Samsung Advanced Foundry Ecosystem)는 삼성 파운드리와 에코시스템 파트너, 고객 사이의 협력을 강화해 제품을 효과적으로 설계할 수 있도록 돕는 프로그램을 말합니다.고객들은 삼성전자의 다양한 파운드리 공정 설계 자산을 이용해 보다 쉽고 빠르게 설계를 할 수 있으며, 파트너사들의 디자인 설계 정보와 설계 인력을 SAFE 프로그램을 통해 지원받을 수 있습니다.이상현 삼성전자 파운드리사업부 상무는""작년 파운드리사업부 독립 이후 국내 팹리스 고객과의 협력이 대폭 강화되어 국내 고객 수가 2배로 확대되는 성과가 있었다""라며 ""올해는 고객이 원하는 설계 인프라를 더욱 강화해 국내 팹리스 고객의 성장을 위해 노력할 것""이라고 말했습니다.삼성전자는 오는 9월 일본 도쿄, 10월 독일 뮌헨에서도 \'삼성 파운드리 포럼\'을 개최하고 글로벌 고객들과 협력을 강화해 나갈 방침입니다.정재홍기자 jhjeong@wowtv.co.krⓒ 한국경제TV, 무단 전재 및 재배포 금지한국경제TV 관련뉴스해당 언론사에서 선정하며 언론사 페이지(아웃링크)로 이동해 볼 수 있습니다.""지금이 주식 살 때""…가치투자 3인 포트폴리오 보니1분기 수익률 -0.2%…내 국민연금에 무슨 일이이혜영, 남편부터 워너원까지 \'솔직+당당\' 매력 발산1988년 김성령 vs 2018년 김수민...20년차 미스코리아 진\'4천억 밥 전쟁\'...햇반에 도전장 낸 이마트좋아요0훈훈해요0슬퍼요0화나요0후속기사 원해요0기사제공 :']"
2,삼성전자, 2018-07-0516:48,이데일리 ,"""원투 펀치는 옛말""..시총 6위로 밀린 현대車",https://finance.naver.com/news/news_read.nhn?article_id=0004142732&office_id=018&mode=search&query=삼성전자&page=4,"['       ""원투 펀치는 옛말""..시총 6위로 밀린 현대車      기사입력2018-07-05 16:48기사원문좋아요훈훈해요좋아요 평가하기공감좋아요0훈훈해요0슬퍼요0화나요0후속기사 원해요0댓글[이데일리 윤종성 기자] 한때 삼성전자와 함께 국내 증시의 ‘원투 펀치’로 불렸던 현대자동차(005380)가 시가총액 6위까지 밀렸다. 판매 부진에 노조 파업, 미·중 무역전쟁, 지배구조 개편 문제까지 ‘겹겹이 악재’에 휩싸여 좀처럼 힘을 쓰지 못하고 있다.   5일 한국거래소에 따르면 이날 12만1500원에 거래를 마친 현대차의 시가총액(5일 종가기준)은  26조7636억원으로, 코스피 시가총액 순위 6위(우선주 제외 기준)를 기록했다. 2010년 4월 이후 8년 여만에 11만원대로 떨어졌던 전날의 충격에선 벗어났지만, 여전히 시총은 26조원대에 머물렀다. 현대차의 시총은 연고점(4월25일·36조1253억원)과 비교하면 9조3617억원이나 쪼그라든 것이다. 삼성전자(297조원) SK하이닉스(62조원)는 물론 셀트리온(37조원), 삼성바이오로직스(28조원), 포스코(27조원) 등에도 뒤졌다. 지난달 22일 처음 시총 6위로 떨어졌던 현대차는 하루 만에 5위 자리를 뺏어 왔지만, 이달 2일 다시 시총 순위 6위로 밀려난 뒤로는 ‘톱 5’에 드는 것이 버거워 보인다. 게다가 시총 순위 7위인 네이버의 시가총액은 25조2164억원으로 현대차와 격차는 약 1조5400억원에 불과하다. 자칫 하다간 6위 자리마저 네이버에 내어줄 판이다. 삼성전자와 함께 ‘강력한 투톱’을 구축했던 현대차는 지난 2015년 5월 27일 SK하이닉스에 밀려 시총 순위 3위로 떨어졌다. 같은 해 6월 22일에는 한국전력에도 뒤지면서 시총 4위로 하락했다. 이후 SK하이닉스, 한전 등과 2~4위를 다퉜던 현대차는 셀트리온, 삼성바이오로직스의 부상으로 지난달 7일 5위로 밀린 데 이어, 이제 포스코에게도 뒤진 것이다. 6위라는 현대차의 시총 순위는 어색하지만, 당분간 주가가 고전할 가능성이 커 시총 순위 상승을 기대하기 힘들다는 관측이 많다.   글로벌 차량 판매 부진이 이어지고 있는 데다, 지배구조 개편 무산, G2(미국· 중국) 무역전쟁, 노조 파업 등이 주가에 부담요인으로 작용하고 있기 때문이다. 공정거래위원회 전 간부의 취업 특혜 의혹에 대한 검찰 수사가 현대차로 확대되는 국면도 부담스럽다. 금융정보업체 에프앤가이드에 따르면 6월말 기준 증권사들이 제시한 2분기 현대차 영업이익 전망치는 1조원으로 석달 전(1조3000억원)보다 21.5% 하향 조정했다. 신영증권은 이날 현대차의 목표주가를 기존 18만원에서 16만원으로 낮춰 잡았다. 출하대비 부진한 중국 현지 판매, 임금협상 난항에 따른 국내 생산 차질 리스크 등을 반영한 결과다.윤종성 (jsyoon@edaily.co.kr)20~30대를 위한 취업, 금융, 생활 정보가 가득 [스냅타임▶]네이버 홈에서 ‘이데일리’ 기사 보려면 [구독하기▶]최신 웹툰이 매일 공짜... 꿀잼 \'웹툰\' [감상하기▶]＜ⓒ종합 경제정보 미디어 이데일리 - 무단전재 & 재배포 금지＞이데일리 관련뉴스해당 언론사에서 선정하며 언론사 페이지(아웃링크)로 이동해 볼 수 있습니다.[밥상 혁명]①나 떨고 있니…흔들리는 지위 \'쿠쿠\'의 푸념中 마이크론 D램 판매금지에…韓 반도체도 가시방석노회찬 ""한국당은 재벌 편"" vs 안상수 ""재벌들과 밥도 안 먹어""최태원·노소영, 오늘 이혼소송 첫 재판.. \'재벌가와 대통령의 딸 결혼\' 그 끝은대법 식사·휴식에 쓴 버스운전사 대기시간, 일부만 근로시간좋아요0훈훈해요0슬퍼요0화나요0후속기사 원해요0기사제공 :']"
3,삼성전자, 2018-07-0516:43,부산일보 ,"현대렌탈케어, 의류건조기 2종 선봬…대형가전 시장 진출",https://finance.naver.com/news/news_read.nhn?article_id=0000818565&office_id=082&mode=search&query=삼성전자&page=4,"['       현대렌탈케어, 의류건조기 2종 선봬…대형가전 시장 진출      기사입력2018-07-05 16:43기사원문좋아요훈훈해요좋아요 평가하기공감좋아요0훈훈해요0슬퍼요0화나요0후속기사 원해요0댓글    현대백화점그룹 계열 토탈홈케어 기업 현대렌탈케어가 의류건조기(사진)를 출시하며 본격적으로 대형 생활가전 렌탈시장에 뛰어든다.현대렌탈케어는 \'삼성 의류건조기(모델명 : DS-30SW)\'와 \'캐리어 의류건조기(모델명 : DC-30S)\'를 출시한다고 5일 밝혔다.현대렌탈케어가 대형 생활가전 렌탈상품을 판매하는 것은 이번이 처음이다. 현대렌탈케어는 이제까지 정수기·공기청정기·비데 등 소형 생활가전 제품 20여 종을 판매해 왔다.의류건조기는 국내에서 공기청정기와 더불어 미세먼지 여파로 판매량이 급증하고 있는 제품군 중 하나다. 가전업계에 따르면 국내 의류건조기 시장은 2014년 5만 대 수준에서 지난해 60만 대로 늘어났고 올해는 100만 대 수준에 이를 것으로 예상하고 있다.현대렌탈케어는 국내 최고 수준의 제품 성능과 브랜드 인지도를 자랑하는 삼성전자와 캐리어의 최신 제품 판매를 통해 국내 의류건조기 렌탈 시장에 빠르게 안착한다는 계획이다.이번에 판매에 들어 가는 의류건조기 2종은 히트펌프 방식을 채택했다. 히트펌프 방식이란 세탁물에 직접 고열을 불어넣지 않고 저온의 열로 습기를 제거해 옷을 말리는 방식을 말한다. 고온의 열풍을 사용하지 않아 옷감의 손상을 최소화할 수 있다는 게 큰 장점이다.두 의류건조기의 건조 용량은 각각 9㎏(삼성), 10㎏(캐리어)이며 구김방지, 냄새 제거, 건조 알림 기능 등의 다양한 편의기능을 갖추고 있다. 의무 사용기간은 48개월이며 사용 기간 동안 삼성전자와 캐리어에서 직영으로 무상 A/S 서비스가 제공된다.제품별 렌탈료는 삼성 의류건조기가 2만 7900원(화이트 색상), 캐리어 의류건조기가 2만 4900원(실버 색상)이다. 오는 7월 31일까지 큐밍-롯데카드를 신규 발급한 뒤, 전월 30만 원을 이용하면 렌탈료가 월 1만 5000원 할인돼 각각 1만 2900원과 9900원에 이용 가능하다. 여기에 현대백화점카드를 신규 발급 받은 고객은 전월 1만 원만 이용하면 추가로 5000원을 할인해준다. 모든 할인 혜택을 받으면 삼성·캐리어 의류건조기를 각각 월 7900원과 4900원에 이용할 수 있다.현대렌탈케어는 이번 의류건조기 출시를 시작으로 오는 8월까지 대형 공기청정기, 에어컨 등 다양한 생활가전 제품을 순차적으로 출시할 계획이다.박성수 현대렌탈케어 영업전략실장은 ""의류건조기 판매를 시작으로 다양한 생활가전 제품을 지속적으로 출시할 계획""이라며 ""이르면 하반기 주방가전과 가구 렌탈사업 전개를 통해 사업 다각화에 나설 것""이라고 말했다.황상욱 기자 eyes@좋아요0훈훈해요0슬퍼요0화나요0후속기사 원해요0기사제공 :']"
4,삼성전자, 2018-07-0516:41,머니투데이 ,미·중 무역전쟁 총성 울린 반도체…삼성·SK하이닉스도 압박,https://finance.naver.com/news/news_read.nhn?article_id=0004074772&office_id=008&mode=search&query=삼성전자&page=4,"['       미·중 무역전쟁 총성 울린 반도체…삼성·SK하이닉스도 압박      기사입력2018-07-05 16:41기사원문좋아요훈훈해요좋아요 평가하기공감좋아요0훈훈해요0슬퍼요0화나요0후속기사 원해요0댓글 [머니투데이 심재현 기자] [단기 반사이익 수혜 가능성 제한적…D램 가격압박 여지 커]중국이 미국 반도체업체 마이크론에 대해 자국 내 판매금지 예비조치를 내리면서 삼성전자와 SK하이닉스도 중국 정부의 움직임에 촉각을 곤두세우고 있다.단기적으로 국내 기업이 반사이익을 볼 수 있다는 기대감도 나오지만 중국의 칼 끝이 삼성전자와 SK하이닉스를 향할 수 있다는 우려가 적잖다. 5일 관련 업계에 따르면 중국 푸저우 지방법원의 예비 명령으로 중국 내 판매가 금지되는 미국 마이크론의 제품은 D램과 낸드플래시 관련 26개 제품이다. 푸저우 지방법원은 마이크론이 대만 반도체 기업인 UMC의 기술 특허를 베꼈다는 이유로 이같이 조치했다.업계에선 연초부터 이어진 미·중 무역갈등이 이번 조치로 이어졌다고 보는 분위기다. 올 초 미국이 중국 IT업체인 화웨이·ZTE 등에 제재를 가하자 중국은 미국 반도체업체인 퀄컴의 네덜란드 NXP 인수 승인을 보류하는 등 신경전을 벌였다. 마이크론은 지난해 매출의 50% 이상을 중국에서 벌었다. 중국은 지난해 전세계 반도체 물량의 65%를 수입한 세계 최대 반도체 소비국으로 D램이나 낸드플래시 시장에선 자국 내 생산량이 전무한 상황이다.시장 관계자는 ""마이크론의 중국 판매가 금지되면 단기적으로는 삼성전자나 SK하이닉스의 시장점유율이 올라갈 수 있을 것""이라고 말했다.문제는 중국의 다음 행보가 미국만이 아닌 글로벌 반도체 산업 전반을 향할 경우 얘기가 달라진다는 점이다. 삼성전자와 SK하이닉스도 이런 시나리오를 배제하지 않는 분위기다. 삼성전자나 SK하이닉스의 중국 수출량이 늘면 중국 정부가 가격인하를 압박할 가능성도 크다.중국 반독점국은 지난 5월 가격담합 혐의로 삼성전자와 SK하이닉스, 마이크론의 중국 사무실을 예고 없이 방문해 조사를 벌였다. 중국의 경제정책 총괄부서인 국가발전개혁위원회는 지난 2월 삼성전자에 반도체 가격 인상 자제와 중국 기업에 대한 메모리 반도체 우선 공급을 요청한 것으로 알려진다.중국은 지난해 \'반도체 굴기(일어섬)\'를 선언하면서 현재 13% 수준인 반도체 자급률을 2025년까지 70%로 끌어올리겠다고 밝혔다. 이르면 올 하반기부터 자국 내 메모리반도체 양산을 시작할 예정이다.업계 관계자는 ""중국이 판매를 금지한 마이크론의 제품이 대부분 보급형의 저가 제품이라는 점에서 국내 업체가 볼 수 있는 수혜는 단기적이고 제한적이라는 분석도 있다""며 ""이럴 경우 국내에서도 결코 만만하게 볼 상황은 아니다""고 말했다.시장조사업체 IHS에 따르면 삼성전자 반도체의 매출 중 중국 비중은 35.2%에 달한다. SK하이닉스는 36.7%다.▶더 많은 머니투데이 기사보기▶실시간 급상승 기사 ▶\'MT리포트\'가 새로 발행되었습니다 심재현 기자 urme@mt.co.kr 머니투데이 관련뉴스해당 언론사에서 선정하며 언론사 페이지(아웃링크)로 이동해 볼 수 있습니다.中 재벌 HNA 왕젠 회장, 프랑스서 추락 사망만 1세 미만 의료비 \'제로화\'…저출산대책에 9천억 더 투입미스코리아 진 김수민…상금 1억원반성문 쓰는 펀드매니저…급락장이 불러온 증시풍경한정판 페라리, 9만원어치 사시겠어요?좋아요0훈훈해요0슬퍼요0화나요0후속기사 원해요0기사제공 :']"
5,삼성전자, 2018-07-0516:40,연합뉴스 ,"코스피 2,250대 후퇴…'G2관세부과 D-1'에 관망심리 팽배(종합2보)",https://finance.naver.com/news/news_read.nhn?article_id=0010193095&office_id=001&mode=search&query=삼성전자&page=4,"['       코스피 2,250대 후퇴…\'G2관세부과 D-1\'에 관망심리 팽배(종합2보)      기사입력2018-07-05 16:40기사원문좋아요훈훈해요좋아요 평가하기공감좋아요0훈훈해요0슬퍼요0화나요0후속기사 원해요0댓글코스피 2,250대 후퇴(서울=연합뉴스) 한종찬 기자 = 미국과 중국이 서로 고율 관세를 부과하겠다고 예고한 날이 코앞으로 다가온 5일 코스피가 또다시 하락했다. 관망심리가 퍼지면서 코스닥시장의 거래는 연중 최저 수준으로 위축됐다. 이날 코스피는 전 거래일보다 7.91포인트(0.35%) 내린 2,257.55로 거래를 마감했다. 이로써 지수는 종가 기준으로 작년 5월4일(2,241.24) 이후 약 14개월 만의 최저가 됐다. 사진은 이날 오후 서울 종로구 연합인포맥스의 주식 현황판.     saba@yna.co.kr코스닥시장 거래는 연중 최저 위축(서울=연합뉴스) 전명훈 기자 = 미국과 중국이 서로 고율 관세를 부과하겠다고 예고한 날이 코앞으로 다가온 5일 코스피가 또다시 하락했다. 관망심리가 퍼지면서 코스닥시장의 거래는 연중 최저 수준으로 위축됐다.    이날 코스피는 전 거래일보다 7.91포인트(0.35%) 내린 2,257.55로 거래를 마감했다.     이로써 지수는 종가 기준으로 작년 5월4일(2,241.24) 이후 약 14개월 만의 최저가 됐다.    전날보다 0.72포인트(0.03%) 내린 2,264.74로 출발한 코스피는 등락을 거듭하며 외국인의 \'팔자\'에 장중 한때 2,240대까지 떨어지기도 했다. 코스피가 장중 2,250선 아래로 떨어진 것 역시 작년 5월 8일 이후 처음이다.    이영곤 하나금융투자 연구원은 ""미중 관세부과 예고 시점인 6일이 하루 앞으로 다가오면서 시장 불안감이 커지고 투자심리는 위축된 상태""라며 ""외국인 중심으로 매도세가 나오면서 약세 흐름을 면치 못했다""고 분석했다.    이 연구원은 ""양국이 강력하게 대응할 것이라는 우려감이 가라앉지 않고 있다""며 ""실제 관세부과나 중국의 반응 등이 확인돼야 시장이 변화할 계기가 생길 것인 만큼 이번 주말이나 다음주 초까지는 변동성이 커질 수 있다""고 말했다.    유가증권시장에서 외국인은 953억원을 순매도했다. 반면 기관과 개인은 455억원과 319억원을 순매수했다.    시가총액 상위주 가운데는 삼성전자(-0.65%), 셀트리온(-3.26%), 삼성바이오로직스(-2.02%), NAVER(-0.39%) 등이 하락하고 SK하이닉스(1.41%), 포스코(1.31%), 현대차(1.67%), LG화학(0.94%), KB금융(1.54%) 등은 올랐다.    업종별로는 종이목재(-3.01%), 건설(-2.33%), 의약품(-2.11%), 비금속광물(-1.67%), 음식료품(-1.62%), 전기가스(-1.04%), 서비스(-0.9%), 섬유의복(-0.8%), 유통(-0.60%), 제조(-0.33%) 등이 약세였고 운송장비(0.64%), 운수창고(0.32%), 철강금속(0.29%), 증권(0.20%) 등은 올랐다.    프로그램매매는 차익거래가 매수 우위, 비차익거래가 매도 우위로 전체적으로는 529억원의 순매도로 집계됐다.코스닥 하락 (PG)    내린 종목은 578개에 달했으나 오른 종목은 240개에 그쳤고 70개 종목은 보합세로 마감했다.     거래량은 3억4천만주, 거래대금은 5조원 수준에 그쳤다.    코스닥지수는 전날보다 5.05포인트(0.63%) 내린 794.05로 장을 마쳤다.    지수는 0.67포인트(0.08%) 오른 799.77로 출발해 한때 800선 위를 넘기도 했으나 곧 힘을 잃었다.    시총 상위주는 셀트리온헬스케어(-1.37%), 메디톡스(-1.74%), 바이로메드(-2.92%), 스튜디오드래곤(-2.94%), 셀트리온제약(-1.51%), 포스코켐텍(-0.11%), 펄어비스(-4.08%) 등 대부분 하락했다.    시총 10위 내에서 상승한 종목은 신라젠(7.97%)과 에이치엘비(2.02%) 정도였다.    특히 이날 코스닥시장의 거래대금은 2조9천934억원에 그쳤다. 거래대금이 3조원 밑으로 떨어진 건 작년 10월11일(2조9천803억원) 이후 처음이다. 거래량도 6억3천만주로 작년 11월10일(6억주) 이후 가장 적었다.    코넥스시장에서는 117개 종목이 거래됐다. 거래량은 23만주, 거래대금은 27억원 수준이었다.    서울 외환시장에서 원/달러 환율은 달러당 4.1원 오른 1,118.6원에 거래를 마쳤다.     id@yna.co.kr▶2018 러시아 월드컵의 모든 것▶뉴스가 보여요 - 연합뉴스 유튜브\xa0\xa0▶기사제보 및 문의연합뉴스 관련뉴스해당 언론사에서 선정하며 언론사 페이지(아웃링크)로 이동해 볼 수 있습니다.\xa060대 할아버지, 차 뒷좌석에 3살 외손자 방치해서 그만…\xa0하석주 ""차범근 피해 20년간 도망다녀"" 눈물로 사과\xa0의붓딸 6년간 성폭행해 임신시킨 계부에 징역 20년\xa0""칼이 도와줬음 됐을텐데…"" 박삼구 말에 대한항공 \'발끈\'\xa0\'상금 1억\' 2018 미스코리아 진 23세 김수민은 누구?좋아요0훈훈해요0슬퍼요0화나요0후속기사 원해요0기사제공 :']"
