,회사명,날짜,언론사,기사제목,링크,본문
19,삼성전자, 2018-10-1709:21,파이낸셜뉴스 ,"[특징주]에스모, 삼성 38조원 차량용 반도체 '도전장' 자율주행 본격화 소식에 ...",https://finance.naver.com/news/news_read.nhn?article_id=0004109768&office_id=014&mode=search&query=삼성전자&page=9,"[""       [특징주]에스모, 삼성 38조원 차량용 반도체 '도전장' 자율주행 본격화 소식에 '강세'      기사입력2018-10-17 09:21기사원문좋아요훈훈해요좋아요 평가하기공감좋아요0훈훈해요0슬퍼요0화나요0후속기사 원해요0댓글  에스모가 강세를 보이고 있다. 삼성전자가 차량용 반도체 시장에 본격 대응하기 위해 차량용 반도체 전용 브랜드를 출시, 자율주행 시장 진출을 본격화하고 있는 것으로 해석되서다.  17일 오전 9시 16분 현재 에스모는 전 거래일 대비 3.08% 상승한 8370원에 거래되고 있다. 삼성전자는 지난 16일 독일 볼프스부르크에서 개막한 ‘국제 자동차부품 박람회’에서 자동차용 프로세서 브랜드 ‘엑시노스 오토’와 자동차용 이미지 센서 브랜드 ‘아이소셀 오토’를 선보이고 차세대 부품 라인업을 공개했다.  차량용 반도체는 2020년쯤 본격 상용화될 자율주행차의 눈과 두뇌 역할을 담당하는 주요 부품이다. 특히 전방 추돌 경보, 차선 이탈 경보 등 핵심 기능을 관장하는 첨단 운전자 보조 시스템(ADAS)에서 차량용 반도체는 센서로부터 주행 환경, 탑승자 정보 등을 감지해 구동 장치에 전달하는 역할을 한다. 현재 일반적인 자동차 한 대에도 반도체가 약 300개 정도 쓰이는데, 자율주행차에는 차량 한 대당 약 2000개 이상의 반도체가 들어갈 것으로 전망된다. 시장조사업체 IHS에 따르면 지난해 340억 달러(약 38조원) 규모인 전 세계 차량용 반도체 시장은 2022년에 553억 달러(약 62조원)까지 이를 것으로 예측되고 있다. kjw@fnnews.com 강재웅 기자   ▶ [이벤트] 파이낸셜뉴스 구독하고 푸짐한 선물 받으세요▶ 세상의 모든 골 때리는 이야기 'fn파스'  ※ 저작권자 ⓒ 파이낸셜뉴스. 무단 전재-재배포 금지파이낸셜뉴스 관련뉴스해당 언론사에서 선정하며 언론사 페이지(아웃링크)로 이동해 볼 수 있습니다.공항 사무실 맨바닥에 누워 취침한 승무원들, 이튿날에는..시골 농장 50cm 땅속에 묻힌 바이킹배, 크기가..동덕여대서 알몸으로 음란행위..남성의 범행 동기'샤넬 한글 재킷' 입은 김정숙 여사, 마크롱 여사 반응이..'경쟁률 4.6대1' 뚫어야 만들 수 있는 통장, 3년 후 받는 금액좋아요0훈훈해요0슬퍼요0화나요0후속기사 원해요0기사제공 :""]"
0,삼성전자, 2018-10-1709:20,이데일리 ,"[특징주]삼성전기, MLCC 가격 추가 인상에 '강세'",https://finance.naver.com/news/news_read.nhn?article_id=0004226144&office_id=018&mode=search&query=삼성전자&page=10,"['       [특징주]삼성전기, MLCC 가격 추가 인상에 \'강세\'      기사입력2018-10-17 09:20기사원문좋아요훈훈해요좋아요 평가하기공감좋아요0훈훈해요0슬퍼요0화나요0후속기사 원해요0댓글 [이데일리 윤종성 기자] 삼성전기(009150)가 4분기 적층세라믹콘덴서(MLCC) 고정가격 15% 인상과 3분기 깜짝 실적 기대감에 17일 장초반 강세다. 이날 오전 9시15분 현재 삼성전기는 전거래일대비 5500원(4.06%) 상승한 14만1000원에 거래되고 있다. 최근 한달간 외국인 투자자들의 1조원 공매도 인해 직전 고점(16만3000원) 대비 17% 급락했던 삼성전기는 지난 12일 이후 4거래일 연속 상승세를 보이고 있다. 이날 김동원 KB증권 연구원은 “글로벌 스마트 폰 수요가 침체된 상황에서 삼성전자, 애플, 중화권 스마트 폰 업체들이 15% 수준의 MLCC 가격인상을 수용한 것으로 추정된다”며 “이는  약 5% 수준의 가격 인상을 예상했던 시장 기대치를 훌쩍 뛰어넘는 것”이라고 밝혔다. 이에 따라 삼성전기의 하반기 영업이익은 전년(2100억원) 대비 4배 가량 증가한 7786억원(3분기 3676억원· 4분기 4110억원)을 예상했다. 이는 시장 컨센서스(6704억원)를 16% 상회하는 수치다. 또 조철희 한국투자증권 연구원은 “삼성전기의 3분기 영업이익은 3780억원으로 시장 컨센서스(3374억원)를 웃돌 것”이라며 “비수기인 4분기에도 양호한 실적이 이어질 것”이라고 전망했다.윤종성 (jsyoon@edaily.co.kr)네이버 모바일에서 ‘이데일리’ [구독하기▶]빡침해소! 청춘뉘우스~ [스냅타임▶]꿀잼 \'웹툰\'이 매일 매일 공짜...[웹툰보기▶]＜ⓒ종합 경제정보 미디어 이데일리 - 무단전재 & 재배포 금지＞이데일리 관련뉴스해당 언론사에서 선정하며 언론사 페이지(아웃링크)로 이동해 볼 수 있습니다.그땐 경기 좋았고 지금은 나쁘다..부동산發 금리인상론 우려 큰 이유하태경, \'친박 단체 끌어안기\' 전원책 맹비난…""\'태극기부대\'와 잘해보라""낸시랭 남편 왕진진, \'리벤지 포르노\' 협박...분명히 같이 지웠는데강용석 이재명 신체 검증에 ""셀프 \'생쇼\'..선정적 증거 넘쳐""\'뉴스공장\' 김어준, 회당 출연료 100만원 받아…\'라디오 진행자 중 최고 수준\'좋아요0훈훈해요0슬퍼요0화나요0후속기사 원해요0기사제공 :']"
1,삼성전자, 2018-10-1709:19,조선비즈 ,개인 매수에 코스피·코스닥 장 초반 상승…2170선 회복,https://finance.naver.com/news/news_read.nhn?article_id=0000417662&office_id=366&mode=search&query=삼성전자&page=10,"['       개인 매수에 코스피·코스닥 장 초반 상승…2170선 회복      기사입력2018-10-17 09:19기사원문좋아요훈훈해요좋아요 평가하기공감좋아요0훈훈해요0슬퍼요0화나요0후속기사 원해요0댓글 코스피지수와 코스닥지수가 모두 개인의 매수에 힘입어 상승 개장했다. 2170선을 회복했다.17일 오전 9시 15분 현재 코스피지수는 전날보다 32.79포인트(1.53%) 오른 2178.00에 거래되고 있다. 이날 코스피지수는 전장보다 24.32포인트 오른 2169.44에 거래를 시작해 상승폭을 키우고 있다.장 초반부터 개인이 순매수세를 보이고 있다. 개인은 181억원을 순매수 중이다. 반면 외국인과 기관은 각각 130억원, 49억원을 매도하고 있다. 프로그램에서는 361억원의 자금이 나오고 있다. 차익거래에서 65억원, 비차익거래에서 292억원의 자금이 유출되고 있다.업종별로는 코스피200헬스케어지수가 1.44% 오르고 있다. 대웅제약(069620)은 3.22%, 한미사이언스(008930)는 3.00% 오르고 있다. 부광약품(003000)과 일양약품(007570)은 2.5%대 상승률을 기록 중이다. 코스피200건설지수, 종이목재업지수도 1.4~1.6% 상승세를 기록 중이다. 하락중인 업종은 통신업이다. 0.16% 하락하고 있다.시가총액 상위 종목들은 1~2%대 오르고 있다. 삼성전자(005930)는 1.72% 오른 4만4350원, SK하이닉스(000660)는 2.30% 오른 7만1300원에 거래되고 있다.  액면분할한 네이버만 0.75% 하락하고 있다. 네이버는 3일 연속 하락세를 타고 있다.코스닥지수는 전날보다 14.16포인트(1.94%) 오른 745.75에 거래되고 있다. 개인이 201억원 순매수세를 보이고 있다 외국인과 기관은 각각 179억원, 24억원을 순매도하고 있다.시가총액 상위 종목 모두 상승세를 기록 중이다. 셀트리온헬스케어(091990)가 2.41% 오른 8만800원에, 신라젠(215600)이 2.95% 오른 9만800원에 거래되고 있다. 스튜디오드래곤(253450)은 8.25% 상승 중이다.[연지연 기자 actress@chosunbiz.com]chosunbiz.com조선비즈 관련뉴스해당 언론사에서 선정하며 언론사 페이지(아웃링크)로 이동해 볼 수 있습니다.알뜰주유소, 옆가게 기름값 인상 막았다[금융포커스] 꼬이는 한국GM, 구겨진 이동걸의 공로""공공·민간 여윳돈 잡아라""…외부위탁운용 경쟁 격화[국감 2018] 재산 121억 한전 사장 ""나도 전기요금 보조금 받아""이주 코앞에서 조합설립 무효 판결…방배13구역에 무슨 일이?좋아요0훈훈해요0슬퍼요0화나요0후속기사 원해요0기사제공 :']"
2,삼성전자, 2018-10-1709:19,한국경제TV ,[시황점검] 9시 18분 코스피 1% 대 상승폭 기록 - 개인 순매수(181억원),https://finance.naver.com/news/news_read.nhn?article_id=0000692387&office_id=215&mode=search&query=삼성전자&page=10,"['       [시황점검] 9시 18분 코스피 1% 대 상승폭 기록 - 개인 순매수(181억원)      기사입력2018-10-17 09:19기사원문좋아요훈훈해요좋아요 평가하기공감좋아요0훈훈해요0슬퍼요0화나요0후속기사 원해요0댓글[한국경제TV 라이온봇 기자][코스피 시황점검]10월 17일 9시 18분 코스피는 전일 대비 34.53p(1.61%) 큰 폭으로 상승한 2179.65p를 기록하고 있다.[그림 1] 현재 시각 코스피, 상승 및 하락 종목 수현재 코스피는 전체 상장 종목 중 752개 종목이 상승세를 보이고 있으며, 62개 종목은 하락중이다. 61개 종목은 보합세를 나타내고 있다.[그림 2] 최근 한달간 투자자별 매매동향투자자별 매매동향을 살펴보면 기관과 개인의 동반 매수세가 이어졌다. 각각 6억원, 181억원 순매수 중이다. 반면, 외인은 -133억원 순매도 하고 있다.[업종동향]모든 업종이 하락하고 있다.[시가총액 상위 종목 동향]시가총액 상위 10개 기업은 대부분 기업이 상승세를 기록하고 있다.""대장주"" 삼성전자는 전일(43,600원) 대비 750원(1.72%) 오른 44,350원에 거래되고 있다.LG화학(2.35%), SK하이닉스(2.01%), 현대차(1.72%), 삼성물산(1.72%), POSCO(1.69%), KB금융(1.54%), 셀트리온(1.53%), 삼성바이오로직스(0.43%) 등은 상승세를 나타냈다. NAVER 종목은 보합세를 보이고 있다.라이온봇 기자 -한국경제TV※ 본 기사는 한국경제TV와 \'거장들의 투자공식이\'자체 개발한 \'라이온봇 기자\'가 실시간으로 작성한 기사입니다.라이온봇기자 ▶ No1. 경제/증권방송 보며 채팅하기 [유튜브][페이스북]▶ 대한민국 재테크 총집결 [한국경제TV 사이트 바로가기]ⓒ 한국경제TV, 무단 전재 및 재배포 금지한국경제TV 관련뉴스해당 언론사에서 선정하며 언론사 페이지(아웃링크)로 이동해 볼 수 있습니다.""스타렉스 나와""…상용차도 수입차 바람주택연금 가입 적기 라는데...이유는이번엔 라돈 생리대?...""대진침대 보다 검출량↑""빚내서 투자한 코스닥…깡통 계좌 속출""엄마를 잡아라""...돈 되는 키즈 콘텐츠좋아요0훈훈해요0슬퍼요0화나요0후속기사 원해요0기사제공 :']"
3,삼성전자, 2018-10-1709:16,아이뉴스24 ,"코스피, 美 증시 반등에 동반 상승",https://finance.naver.com/news/news_read.nhn?article_id=0000468234&office_id=031&mode=search&query=삼성전자&page=10,"['       코스피, 美 증시 반등에 동반 상승      기사입력2018-10-17 09:16기사원문좋아요훈훈해요좋아요 평가하기공감좋아요0훈훈해요0슬퍼요0화나요0후속기사 원해요0댓글 <아이뉴스24>[아이뉴스24 김다운 기자] 코스피지수가 미국증시 반등에 힘입어 동반 상승세다.17일 오전 9시10분 현재 코스피는 전날보다 1.54%(33.10포인트) 오른 2178.22를 기록 중이다.뉴욕증시에서 16일(현지시간) 다우존스산업지수는 2.17% 상승했고, S&P500지수와 나스닥종합지수는 각각 2.15%, 2.89% 급등 마감했다.넷플릭스, 모건스탠리, 골드만삭스 등의 주요 기업들이 호실적을 발표한 데 힘입은 것이다. 미국 10년물 국채금리도 3.10%로 안정됐다.코스피 시장에서는 개인이 216억원 순매수로 지수를 견인하고 있다. 외국인과 기관은 각각 137억원, 21억원 매도우위다.삼성전자, SK하이닉스, 셀트리온, 삼성바이오로직스, 현대차, 포스코 등 시가총액 상위 종목들이 대부분 오름세다.액면분할 후 약세를 보이고 있는 네이버는 0.37% 하락하며 사흘 연속 하락하고 있다.코스닥지수는 1.97%(14.41포인트) 상승한 745.88을 기록 중이다.역시 개인이 229억원 매수우위로 상승세를 주도 중이며, 외국인과 기관은 각각 213억원, 18억원 어치를 순매도하고 있다.한편 서울 외환시장에서 원/달러 환율은 전날보다 0.36%(4.10원) 하락한 1123.80원에 거래 중이다./김다운기자 kdw@inews24.com▶네이버 채널에서 \'아이뉴스24\'를 구독해주세요.▶ 클라우드로 실현하는 새로운 미래[ⓒ 아이뉴스24 무단전재 및 재배포 금지]아이뉴스24 관련뉴스해당 언론사에서 선정하며 언론사 페이지(아웃링크)로 이동해 볼 수 있습니다.손수레 할머니 돕다 \'과속 차량\'에 사고, ""아버지 부담 덜기 위해 아르바이트""오늘습관 생리대, 라돈 검출 보도에 강력 반발…""손해배상 법적대응""국내 패션·뷰티, 줄줄이 中 매장 철수…왜?오늘습관 생리대, 알고보니 \'라돈 생리대\'…대진침대보다 검출량 많아2018 10월 모의고사, 작년 \'불 난이도\' 어려워, 등급컷은? 국어 91-85-77좋아요0훈훈해요0슬퍼요0화나요0후속기사 원해요0기사제공 :']"
4,삼성전자, 2018-10-1709:15,한국경제 ,"[특징주]삼성전자 SK하이닉스, 美 훈풍에 '반등'",https://finance.naver.com/news/news_read.nhn?article_id=0004027478&office_id=015&mode=search&query=삼성전자&page=10,"['       [특징주]삼성전자 SK하이닉스, 美 훈풍에 \'반등\'      기사입력2018-10-17 09:15기사원문좋아요훈훈해요좋아요 평가하기공감좋아요0훈훈해요0슬퍼요0화나요0후속기사 원해요0댓글 [ 정형석 기자  ] 삼성전자와 SK하이닉스가 모처럼 큰 폭으로 반등하고 있다.17일 오전 9시 12분 현재 삼성전자는 전날보다 750원(1.72%) 오른 4만4350원에 거래되고 있다. 사흘만에 반등이다. SK하이닉스도 2%대 오름세를 보이고 있다.간밤 미국 뉴욕증시에서 마이크론, 인텔 등 반도체 종목들이 상승한 점이 투자심리에 도움이 된 것으로 풀이된다.지난해 11월 반도체 업황 피크 논란을 불러왔던 모건스탠리가 최근 반도체주 매도세가 과도할 수 있다고 언급했다. 다만 여전히 위기에서 벗어난 것은 아니라는 주장은 이어갔다.정형석 한경닷컴 기자 chs8790@hankyung.com[한경닷컴 바로가기] [모바일한경 구독신청] 글로벌 블록체인 프론티어 코리아! 2018 코리아 블록체인 엑스포 [바로가기] ⓒ 한국경제 & hankyung.com, 무단전재 및 재배포 금지한국경제 관련뉴스해당 언론사에서 선정하며 언론사 페이지(아웃링크)로 이동해 볼 수 있습니다.""김상조가 망쳐놨다""…현직 간부의 폭로 \'파장\'""중국도 예전같지 않다""…국내 대기업들 중대 결정""한국 떠나겠습니다""…핵심인력들 내쫓더니 \'비상\'\'맘카페\' 이젠 하다하다…결혼 앞둔 30대 女교사 결국""나라면 장하성처럼 안 했을 것""…통계청장의 고백좋아요0훈훈해요0슬퍼요0화나요0후속기사 원해요0기사제공 :']"
5,삼성전자, 2018-10-1709:14,한국경제 ,"코스피, 미국발 훈풍에 상승…삼성전자·SK하이닉스 1%↑",https://finance.naver.com/news/news_read.nhn?article_id=0004027476&office_id=015&mode=search&query=삼성전자&page=10,"['       코스피, 미국발 훈풍에 상승…삼성전자·SK하이닉스 1%↑      기사입력2018-10-17 09:14기사원문좋아요훈훈해요좋아요 평가하기공감좋아요0훈훈해요0슬퍼요0화나요0후속기사 원해요0댓글 [ 한민수 기자  ] 코스피지수가 앞서 마감한 미국 증시의 급등에 힘입어 상승하고 있다. 17일 오전 9시8분 현재 코스피지수는 전날보다 24.29포인트(1.13%) 오른 2169.41을 기록 중이다. 간밤 미국 증시는 기업들의 호실적으로 주요 3대 지수가 2% 이상 올랐다. 이날 코스피도 오름세로 시작했다.   서상영 키움증권 연구원은 ""미중 무역분쟁 여파로 실적부진 우려가 높아진 가운데 발표된 기업들의 양호한 실적은 투자심리 개선에 긍정적인 영향을 줬다""며 ""한국 증시도 글로벌 증시의 상승에 힘입어 반등할 것""이라고 전망했다. 개인이 369억원의 순매수다. 외국인과 기관은 218억원과 98억원의 매도 우위다. 프로그램은 차익과 비차익이 모두 순매도로 362억원의 매도 우위를 나타내고 있다. 통신을 제외한 대부분의 업종이 상승하는 가운데 증권과 의약품의 오름폭이 크다. 시가총액 상위종목들도 네이버 SK텔레콤 SK이노베이션 등을 빼고 대체로 강세다.  반도체 관련주가 과도하게 하락했다는 모건스탠리의 분석에 삼성전자와 SK하이닉스가 1%대 상승세다. 코스닥지수는 이틀째 오르고 있다. 12.95포인트(1.77%) 상승한 744.45다. 개인이 175억원의 순매수다. 외국인과 기관이 각각 147억원과 26억원의 매도 우위다.  원·달러 환율은 이틀째 하락세다. 서울 외환시장에서 원·달러 환율은 4.00원 내린 1124.00원에 거래되고 있다. 한민수 한경닷컴 기자 hms@hankyung.com[한경닷컴 바로가기] [모바일한경 구독신청] 글로벌 블록체인 프론티어 코리아! 2018 코리아 블록체인 엑스포 [바로가기] ⓒ 한국경제 & hankyung.com, 무단전재 및 재배포 금지한국경제 관련뉴스해당 언론사에서 선정하며 언론사 페이지(아웃링크)로 이동해 볼 수 있습니다.""김상조가 망쳐놨다""…현직 간부의 폭로 \'파장\'""중국도 예전같지 않다""…국내 대기업들 중대 결정""한국 떠나겠습니다""…핵심인력들 내쫓더니 \'비상\'\'맘카페\' 이젠 하다하다…결혼 앞둔 30대 女교사 결국""나라면 장하성처럼 안 했을 것""…통계청장의 고백좋아요0훈훈해요0슬퍼요0화나요0후속기사 원해요0기사제공 :']"
6,삼성전자, 2018-10-1709:14,뉴스1 ,에이스침대-삼성전자 손잡고 하이마트쇼핑몰서 콜라보 행사,https://finance.naver.com/news/news_read.nhn?article_id=0003641672&office_id=421&mode=search&query=삼성전자&page=10,"['       에이스침대-삼성전자 손잡고 하이마트쇼핑몰서 콜라보 행사      기사입력2018-10-17 09:14기사원문좋아요훈훈해요좋아요 평가하기공감좋아요0훈훈해요0슬퍼요0화나요0후속기사 원해요0댓글건강한 침실공간 등 테마별 가전,침대 등을 선봬혼수장만 이들 공략…테마별 구매시 사은품 증정도(서울=뉴스1) 곽선미 기자 = 대한민국 대표 침대 브랜드인 에이스침대는 10월 혼수 장만을 고민하는 신혼부부를 위해 글로벌 가전 브랜드 삼성전자와 함께 온라인 하이마트쇼핑몰에서 콜라보레이션 행사를 진행한다고 17일 밝혔다. 이번 콜라보 행사는 \'건강한 침실 공간\', \'우리 아이를 위한 침실\', \'프리미엄 힐링\' 등 총 세가지 테마로 기획됐다. 건강한 침실 공간 테마에서는 \'쾌적한 공기를 마시며 편안한 숙면을 취하다\'라는 콘셉트로 에이스침대의 대표 침대 모델 HT-RED와 HT-LIME을 비롯한 HT 시리즈 3종과 함께 삼성전자의 공기청정기, 에어드레서를 콜라보레이션 제품으로 선보인다.자녀를 위한 공간을 꾸미는 부부를 위해 \'우리 아이를 위한 침실\' 테마에서는 편의성을 강조한 에이스침대 1인용 수납 침대 10종을 선보인다. 가정에서 누리는 안락한 휴식을 구현한 \'프리미엄 힐링\' 테마에서는 에이스침대가 단독 수입하는 노르웨이 명품 리클라이너 \'스트레스리스\'사의 리클라이너 10종과 함께 삼성 LED TV 등을 구성했다. 행사기간동안 에이스침대와 삼성전자 제품을 테마별로 동시 구매할 경우 금액대별로 자이글 핸썸, 백화점 상품권 등 사은품이 증정된다. 브랜드 합산 구매금액이 200만원을 넘으면 백화점 상품권을 중복 증정한다.이번 행사는 하이마트쇼핑몰에서 오는 31일까지 진행되며 더 자세한 내용은 하이마트쇼핑몰을 통해 확인할 수 있다. 에이스침대 관계자는 ""최근 소확행(작지만 확실한 행복) 유행과 함께 자신에게 가치 있다고 생각하는 제품에 과감히 투자하는 가치 소비 트렌드가 신혼부부의 혼수 구매 스타일""이라며 ""이번 콜라보 행사를 통해 프리미엄 혼수 제품을 합리적으로 구매하길 바란다""고 말했다. gsm@news1.kr▶ 진짜 블록체인을 만나는 곳 \'크립토허브\' 오픈! ▶ 글로벌바이오포럼 2018 참가하기▶ 네이버 메인에서 [뉴스1]을 구독해주세요[© 뉴스1코리아(news1.kr), 무단 전재 및 재배포 금지]뉴스1 관련뉴스해당 언론사에서 선정하며 언론사 페이지(아웃링크)로 이동해 볼 수 있습니다.정유미 측 ""나영석PD 관련 악성 루머, 사실무근…불쾌""하태경 ""유승민·오세훈·황교안·원희룡, 태극기에 움찔""부산 도난차 18km 추격전…순찰차 13대 투입엄마가 휴대폰 집중한 사이 여아 철로 떨어져돈 안 빌려준다고 80대 이웃 잔혹살해 60대女좋아요0훈훈해요0슬퍼요0화나요0후속기사 원해요0기사제공 :']"
