,회사명,날짜,언론사,기사제목,링크,본문
5,삼성전자, 2018-10-1410:05,뉴시스 ,"삼성전자, '포르쉐' 행사장서 프리미엄 '홈 시네마' 전시",https://finance.naver.com/news/news_read.nhn?article_id=0008853297&office_id=003&mode=search&query=삼성전자&page=4,"['       삼성전자, \'포르쉐\' 행사장서 프리미엄 \'홈 시네마\' 전시      기사입력2018-10-14 10:05기사원문좋아요훈훈해요좋아요 평가하기공감좋아요0훈훈해요0슬퍼요0화나요0후속기사 원해요0댓글말레이시아 세팡 자동차 경기장에 \'LED 포 홈(IF P1.2)\' 선보여【서울=뉴시스】김지은 기자 = 삼성전자가 17일까지 말레이시아 세팡 국제 자동차 경기장에서 열리는 \'포르쉐 익스피리언스\' 행사에서 홈 시네마 시장을 겨냥한 109형 초대형 LED 사이니지를 전시한다고 14일 밝혔다.LED 포 홈(LED for Home) IF P1.2 시리즈로 픽셀 간격이 1.2㎜ 수준인 \'미세 피치(Fine Pixel Pitch)\' LED 기술이 적용된 실내형 고급 사이니지다. LED 포 홈은 베젤이 없는 모듈러 방식의 LED 디스플레이로 109형(풀HD)과 219형(UHD) 크기로도 초대형화가 가능하다. 화면 사이즈와 해상도를 고객이 취향에 맞게 주문할 수 있다.특히 LED 미세 피치 기술과 HDR의 선명한 화질로 고급 주택, 별장, 고급 리조트 등에서개인을 위한 소규모 극장 시스템을 원하는 고객들에게 적합하다고 회사 측은 전했다.아시아태평양 지역에서 최초로 개최되는 \'포르쉐 익스피리언스\' 행사는 포르쉐의 주요 고객들이 고성능 스포츠카를 실제 국제 자동차 경주장인 서킷에서 시승할 수 있는 행사다.삼성전자는 이번 행사의 하이라이트 공간에 LED 포 홈을 설치해 시승 참가자 전원에게 초대형 스크린을 활용한 사전 주행 브리핑 교육을 지원하고 프리미엄 홈 시네마 경험을 제공한다. 참가자들은 실제 차량에 탑승하지 않아도 차량에 대한 정보를 사전에 숙지하고 동일한 코스를 경험할 수 있도록 했다.행사에는 디지털 플립차트 삼성 플립, 65형 스마트 사이니지, 49형 커브드 모니터 등도 함께 전시됐다.kje1321@newsis.com▶ 뉴시스 빅데이터 MSI 주가시세표 바로가기 ▶ 뉴시스 SNS [페이스북] [트위터]<저작권자ⓒ 공감언론 뉴시스통신사. 무단전재-재배포 금지.>뉴시스 관련뉴스해당 언론사에서 선정하며 언론사 페이지(아웃링크)로 이동해 볼 수 있습니다.\'최소 10명 살해\' 연쇄살인마 ""여성 혐오…풀려나면 또 죽일것""장인 살해 뒤 처가에 불지른 60대 사위 징역 30년 선고""아버지 칠순 여행비 마련하려고…"" 여비 가로챈 공무원동덕여대 교내서 알몸男 음란행위…경찰, 경위 파악소방관이 대낮 만취 음주운전하다 6중 추돌…3명 부상좋아요0훈훈해요0슬퍼요0화나요0후속기사 원해요0기사제공 :']"
6,삼성전자, 2018-10-1410:02,KBS ,10대 그룹 상장사 시총 10월 들어 65조 원 증발,https://finance.naver.com/news/news_read.nhn?article_id=0010629107&office_id=056&mode=search&query=삼성전자&page=4,"[""       10대 그룹 상장사 시총 10월 들어 65조 원 증발      기사입력2018-10-14 10:02기사원문좋아요훈훈해요좋아요 평가하기공감좋아요0훈훈해요0슬퍼요0화나요0후속기사 원해요0댓글 글로벌 증시가 조정 장세를 보이고 있는 가운데 국내 10대 그룹의 상장사 시가총액이 10월 들어서만 65조원 가까이 준 것으로 나타났습니다. 재벌닷컴에 따르면 자산 상위 10대 그룹 95개 상장사의 시가총액(우선주 포함)은 지난 12일 현재 864조 9천670억 원(이하 종가 기준)으로 집계됐습니다. 이는 9월말의 929조 4천60억 원보다 64조 4천380억 원(6.9%) 감소한 수준입니다. 같은 기간 국내 주식시장(코스피+코스닥)의 시총은 1천840조 8천830억 원에서 1천691조 6천840억 원으로 149조 1천990억 원, 8.1% 줄었습니다. 감소액 기준으로는 삼성그룹의 시총이 31조 4천650억 원, 6.3%나 줄어 10대 그룹 중 가장 많이 감소했습니다. 특히 삼성전자(우선주 제외) 시총이 이 가운데 절반 가량인 15조 7천270억 원 줄었습니다. 다음이 현대차그룹과 LG그룹, SK그룹, 포스코그룹 등의 순이었습니다. 감소율 기준으로는 농협이 -13.8%(-7,080억 원)이 가장 컸고, 다음으로 현대차그룹과 LG그룹, 한화그룹, 포스코그룹 등이 뒤따랐습니다.박일중기자 (baikal@kbs.co.kr)[저작권자ⓒ KBS 무단복제-재배포 금지]▶ 네이버 채널 KBS뉴스 구독! 시원하게 털어드립니다▶ ‘TV보다 리얼’한 색다른 뉴스!KBS 관련뉴스해당 언론사에서 선정하며 언론사 페이지(아웃링크)로 이동해 볼 수 있습니다.집주인한테 방범창 달아달라고 전화해도 될까요대장내시경, '용종' 제거 시 암 발생 절반 '뚝'![고현장] 30층 난간에 있는 여성, 극적으로 구출하기'곰탕집 성추행' 법정구속 남성 38일 만에 보석으로 석방국내 최초 '14좌 무산소 정복'…'스타 산악인'의 마지막 도전좋아요0훈훈해요0슬퍼요0화나요0후속기사 원해요0기사제공 :""]"
7,삼성전자, 2018-10-1409:46,SBS ,정부 이달 고용대책…단기 일자리 만들고 투자 지원 계획도,https://finance.naver.com/news/news_read.nhn?article_id=0000681181&office_id=055&mode=search&query=삼성전자&page=4,"['       정부 이달 고용대책…단기 일자리 만들고 투자 지원 계획도      기사입력2018-10-14 09:46기사원문좋아요훈훈해요좋아요 평가하기공감좋아요0훈훈해요0슬퍼요0화나요0후속기사 원해요0댓글3분기 실업과 고용률 지표가 동시에 악화하면서 정부가 일자리 대책 마련을 서두르고 있습니다.정부는 김동연 부총리 겸 기획재정부 장관이 주요20개국(G20) 재무장관회의 겸 국제통화기금(IMF)·세계은행(WB) 총회를 마치고 귀국하면 이달 안에 경제관계장관회의를 거쳐 고용대책을 발표할 예정입니다.정부 고위관계자는 ""각 정부 부처와 지방자치단체, 중앙과 지방 공공기관 등 일자리를 만들 여력이 있는 곳을 전방위로 찾으면서 수요조사를 하고 있다""면서 ""특정한 목표치는 없으며 최대한 노력 중""이라고 밝혔습니다.정부는 특히 최근 5년간 12월과 1월, 2월의 취업자 수가 다른 기간에 비해 월평균 82만 개 감소하는 등 겨울철 일자리 공급이 크게 감소하는 점을 감안, 올해 안에 5천 명 안팎의 체험형 인턴을 추가로 채용할 계획입니다.이는 채용 기간이 1∼5개월인 단기일자리입니다.정부는 글로벌 금융위기 여파로 고용 한파가 거셌던 2008년 말부터 공공기관에 청년인턴제를 도입한 바 있습니다.공공기관들은 올해 들어 9월 말까지 청년인턴 1만 명 안팎을 채용했고, 올해 안에 5천 명 내외의 체험형 인턴을 포함해 청년인턴을 추가로 채용하기로 했습니다.공공기관 인턴제는 2∼7개월짜리 채용형 인턴제와 1∼5개월짜리 체험형 인턴제로 나뉩니다.채용형 인턴제는 채용자격과 절차를 신규채용에 준해 운영하고 원칙적으로 70% 이상을 정규직으로 전환하는 제도이며, 체험형 인턴제는 고교나 대학 재학생을 상대로 직장체험 기회제공 취지에서 운영하는 제도입니다.338개 중앙공공기관의 임직원 수는 32만 4천여 명, 399개 지방 직영기업과 공사·공단 임직원 수는 9만 7천916 명으로, 이 중 5%는 2만 명가량 됩니다.노동시장 은퇴를 준비하는 신중년과 어르신을 위한 맞춤형 일자리도 확대합니다.이를 위해 불용이 예상되거나 이·전용 가능 예산을 적극적으로 활용하기로 했습니다.정부는 일자리 창출을 위해 기업 투자를 활성화할 방안도 고심하고 있습니다.세제 등으로 추가 유인을 부여하거나 규제나 절차상 걸림돌을 풀어 주요 대기업 투자에 물꼬를 튼다는 계획입니다.현대차의 강남구 삼성동 105층 신사옥 건립과 관련, 국토교통부의 수도권 정비위원회 심의에 속도를 내거나 삼성전자나 SK하이닉스의 반도체 공장 신설이나 추가 생산라인 구축에 차질이 빚어지지 않도록 하는 방안 등이 검토대상으로 거론됩니다.(사진=연합뉴스)\xa0송욱 기자(songxu@sbs.co.kr)▶[SDF2018] 새로운 상식 - 개인이 바꾸는 세상 참가신청 바로 가기▶[보이스V] 당신을 위한 비디오 콘텐츠※ ⓒ SBS & SBS Digital News Lab. : 무단복제 및 재배포 금지SBS 관련뉴스해당 언론사에서 선정하며 언론사 페이지(아웃링크)로 이동해 볼 수 있습니다.""히말라야 엄청난 눈폭풍, 나무 통째 뽑혀…시신들 봤다""[포토] ""여러분이 대한민국 입니다""…재프랑스 동포들 만난 문 대통령[영상] 달아난 \'알몸 남성\', 시민이 추적…잡고 보니 \'수배자\'대진침대 현금자산 바닥…""라돈침대 배상액 많아야 18만 원""차인표, \'신애라 가짜 학위 의혹\' 제기에…내놓은 해명은?좋아요0훈훈해요0슬퍼요0화나요0후속기사 원해요0기사제공 :']"
8,삼성전자, 2018-10-1409:35,이데일리 ,슈퍼카 포르쉐와 만난 삼성 LED 홈시네마,https://finance.naver.com/news/news_read.nhn?article_id=0004223568&office_id=018&mode=search&query=삼성전자&page=4,"[""       슈퍼카 포르쉐와 만난 삼성 LED 홈시네마      기사입력2018-10-14 09:35기사원문좋아요훈훈해요좋아요 평가하기공감좋아요0훈훈해요0슬퍼요0화나요0후속기사 원해요0댓글말레이시아 세팡 경기장에 109형 LED 사이니지 설치포르쉐 익스피리언스 행사에 참가한 고객들이 하이라이트 공간에 설치된 ‘LED 포 홈’과 디지털 플립차트 ‘삼성 플립’을 통해 사전 주행 브리핑 교육을 듣고 있다. 사진=삼성전자[이데일리 김겨레 기자] 삼성전자(005930)가 오는 17일까지 말레이시아 세팡 국제 자동차 경기장에서 열리는 포르쉐 익스피리언스 행사에 홈 시네마 시장을 겨냥한 109형 초대형 LED(발광다이오드) 사이니지 ‘LED 포 홈’ IF P1.2 시리즈를 전시한다고 14일 밝혔다. 디지털 플립차트 ‘삼성 플립’, 65형 스마트 사이니지, 49형 커브드 모니터 등도 함께 전시한다. IF P1.2시리즈는 픽셀 간격이 1.2㎜ 수준인 미세 피치 LED 기술이 적용된 실내형 고급 사이니지다.‘LED 포 홈’은 지난 9월 미국 샌디에이고에서 열린 영상기기 전시회 ‘CEDIA 2018’에서 공개돼 업계 관계자들과 AV전문매체로부터 호평을 받았다.아시아태평양 지역에서 최초로 개최되는 포르쉐 익스피리언스 행사는 포르쉐의 주요 고객이 고성능 스포츠카를 실제 국제 자동차 경주장인 서킷에서 시승할 수 있는 행사다. 삼성전자는 이번 행사의 하이라이트 공간에 ‘LED 포 홈’을 설치해 시승 참가자 전원에게 초대형 스크린을 활용한 사전 주행 브리핑 교육을 지원한다. 참가자들은 실제 차량에 탑승하지 않아도 차량에 대한 정보를 사전에 숙지하고 동일한 코스를 경험할 수 있다.이 제품은 베젤이 없는 모듈러 방식의 LED 디스플레이로 109형(풀HD)과 219형(UHD) 크기로도 초대형화할 수 있다. 화면 사이즈와 해상도를 고객이 취향에 맞게 주문할 수 있는 프리미엄 홈 시네마 전문 솔루션이다. LED 미세 피치 기술과 HDR의 선명한 화질로 고급 주택, 별장, 고급 리조트 등에서 개인을 위한 소규모 극장을 원하는 소비자를 겨냥한다.김겨레 (re9709@edaily.co.kr)네이버 모바일에서 ‘이데일리’ [구독하기▶]빡침해소! 청춘뉘우스~ [스냅타임▶]꿀잼 '웹툰'이 매일 매일 공짜...[웹툰보기▶]＜ⓒ종합 경제정보 미디어 이데일리 - 무단전재 & 재배포 금지＞이데일리 관련뉴스해당 언론사에서 선정하며 언론사 페이지(아웃링크)로 이동해 볼 수 있습니다.세입자가 동대표를 한다면..문제 없을까김창호 원정대, 히말라야 신루트 개척하려다...엄홍길 충격적섹스 중독증과 타이거 우즈'구글'에서 바람난 아내 발견한 남성...그야말로 '탄식의 다리'백종원, 회사 말아먹은 적 있죠? 웃다가 너무한 것 아니냐 발끈한 이유좋아요0훈훈해요0슬퍼요0화나요0후속기사 원해요0기사제공 :""]"
9,삼성전자, 2018-10-1409:34,KBS ,"삼성전자 ‘사회적 책임’ 평가, 2년 연속 50위권 밖",https://finance.naver.com/news/news_read.nhn?article_id=0010629097&office_id=056&mode=search&query=삼성전자&page=4,"['       삼성전자 ‘사회적 책임’ 평가, 2년 연속 50위권 밖      기사입력2018-10-14 09:34기사원문좋아요훈훈해요좋아요 평가하기공감좋아요0훈훈해요0슬퍼요0화나요0후속기사 원해요0댓글 삼성전자가 전 세계 주요 기업들을 대상으로 한 \'사회적 책임\' 평가에서 2년 연속 50위권 밖으로 밀린 것으로 나타났습니다. 재계에 따르면 미국 보스턴에 본부를 둔 글로벌 컨설팅업체 레퓨테이션 인스티튜트(RI·Reputation Institute)가 최근 발표한 \'2018년 글로벌 CR 100대 기업\'(2018 Global CR RepTrak 100) 순위에서 삼성전자는 64위에 올랐습니다. RI가 매년 발표하는 \'글로벌 CR 순위\'는 기업 지배구조, 사회적 영향, 근로자 대우 등을 기준으로 기업의 사회적 책임을 점수로 매긴 것으로, 올해는 15개국에서 약 23만 명을 대상으로 실시한 여론조사 결과 등을 토대로 작성됐습니다. 지난해 100점 만점에 64.5점으로 89위에 올랐던 삼성전자는 올해 64.9점을 얻으며 25계단 상승했습니다.  삼성전자는 2013년 26위(66.5점), 2014년 16위(68.3점), 2015년 20위(68.8점), 2016년 20위(69.8점) 등으로 꾸준히 30위권 내에 이름을 올렸으나 지난해는 갤럭시노트7 발화 문제와 이재용 부회장의 뇌물 스캔들 연루 혐의 등의 악재로 인해 89위(64.5점)로 급락했었습니다.  올해는 기술(Technology) 분야의 업체들이 대체로 부진한 가운데 삼성전자는 작년보다 0.4점 오르면서 비교적 선전한 것으로 평가됐습니다. RI는 보고서에서 ""기술 분야 업체들 가운데 삼성전자가 유일하게 점수가 하락하지 않았다""면서 ""지난 2017년 \'제품 위기\' 직후 즉각 사과한 것이 회복에 긍정적인 영향을 미쳤다""고 설명했습니다. 올해 전 세계에서 사회적 책임을 가장 잘 구현한 기업으로는 미국 구글(71.9점)이 꼽혔습니다. 미국 월트디즈니와 덴마크 완구업체 레고가 그 뒤를 이었고, 브라질 제조업체 나투라와 덴마크의 생명공학 전문기업 노보노디스크, 미국 마이크로소프트(MS), 독일 보쉬, 일본 캐논, 프랑스 미셸린, 스웨덴 이케아 등이 10위 내에 포함됐습니다.오대성기자 (ohwhy@kbs.co.kr)[저작권자ⓒ KBS 무단복제-재배포 금지]▶ 네이버 채널 KBS뉴스 구독! 시원하게 털어드립니다▶ ‘TV보다 리얼’한 색다른 뉴스!KBS 관련뉴스해당 언론사에서 선정하며 언론사 페이지(아웃링크)로 이동해 볼 수 있습니다.집주인한테 방범창 달아달라고 전화해도 될까요대장내시경, \'용종\' 제거 시 암 발생 절반 \'뚝\'![고현장] 30층 난간에 있는 여성, 극적으로 구출하기\'곰탕집 성추행\' 법정구속 남성 38일 만에 보석으로 석방국내 최초 \'14좌 무산소 정복\'…\'스타 산악인\'의 마지막 도전좋아요0훈훈해요0슬퍼요0화나요0후속기사 원해요0기사제공 :']"
10,삼성전자, 2018-10-1409:33,데일리안 ,"삼성전자, 포르쉐 익스피리언스 행사에 프리미엄 '홈 시네마' 솔루션 전시",https://finance.naver.com/news/news_read.nhn?article_id=0002287010&office_id=119&mode=search&query=삼성전자&page=4,"[""       삼성전자, 포르쉐 익스피리언스 행사에 프리미엄 '홈 시네마' 솔루션 전시      기사입력2018-10-14 09:33기사원문좋아요훈훈해요좋아요 평가하기공감좋아요0훈훈해요0슬퍼요0화나요0후속기사 원해요0댓글삼성전자 모델들이 17일 말레이시아 세팡 국제 자동차 경기장에서 개최되는 '포르쉐 익스피리언스' 행사에 홈 시네마 시장을 겨냥한 109형 초대형 발광다이오드(LED) 사이니지 'LED 포 홈(LED for Home)' IF P1.2 시리즈를 소개하고 있다.ⓒ삼성전자말레이시아 세팡 자동차 경기장에 'LED 포 홈' 선봬프리미엄 고객 대상 차별화된 홈 시네마 경험 제공 삼성전자는 오는 17일까지 말레이시아 세팡 국제 자동차 경기장에서 개최되는 '포르쉐 익스피리언스' 행사에 홈 시네마 시장을 겨냥한 109형 초대형 발광다이오드(LED) 사이니지 'LED 포 홈(LED for Home)' IF P1.2 시리즈를 전시한다고 14일 밝혔다.IF P1.2시리즈는 픽셀 간격 1.2㎜ 수준의 '미세 피치(Fine Pixel Pitch)' LED 기술이 적용된 실내형 고급 사이니지로 프리미엄 고객 대상으로 차별화된 홈 시네마 경험을 제공한다.'LED 포 홈'은 지난 9월 미국 샌디에이고에서 열린 영상기기 전시회 'CEDIA 2018'에서 공개된 제품으로 당시 업계 관계자들과 오디오비디오(AV)전문 매체들의 큰 호평을 받았다.아시아태평양 지역에서 최초로 개최되는 '포르쉐 익스피리언스' 행사는 포르쉐의 주요 고객들이 고성능 스포츠카를 실제 국제 자동차 경주장인 서킷에서 시승할 수 있는 특별한 행사다. 삼성전자는 이번 행사의 하이라이트 공간에 'LED 포 홈'을 설치해 시승 참가자 전원에게 초대형 스크린을 활용한 사전 주행 브리핑 교육을 지원하고 프리미엄 홈 시네마 경험을 제공한다. 이를 통해 참가자들은 실제 차량에 탑승하지 않아도 차량에 대한 정보를 사전에 숙지하고 동일한 코스를 경험할 수 있도록 했다.행사 참가자들은 'LED 포 홈'이 제공하는 초대형 화면과 생생한 화질에 큰 관심을 보였다. 이 제품은 베젤이 없는 모듈러 방식의 LED 디스플레이로 109형(풀HD)과 219형(UHD) 크기로도 초대형화가 가능하며, 화면 사이즈와 해상도를 고객이 취향에 맞게 주문할 수 있는 프리미엄 홈 시네마 전문 솔루션이다. 특히 LED 미세 피치 기술과 HDR의 선명한 화질로 고급 주택·별장·고급 리조트 등에서 개인을 위한 소규모 극장 시스템을 원하는 고객들에게 차별화된 시청 경험을 선사한다. 한편 이번 행사에서는 디지털 플립차트 '삼성 플립(Samsung Flip)'과 65형 스마트 사이니지, 49형 커브드 모니터 등도 함께 전시돼 행사 참가자들에게 좋은 평가를 받았다.데일리안 이홍석 기자 (redstone@dailian.co.kr)ⓒ (주)데일리안 - 무단전재, 변형, 무단배포 금지데일리안 관련뉴스해당 언론사에서 선정하며 언론사 페이지(아웃링크)로 이동해 볼 수 있습니다.내년 메모리 가격 하락, 삼성전자 반도체 1위 수성 가능할까삼성전자, 말레이시아서 '쿼드 카메라' 갤럭시A9 공개삼성전자, 태국서 자연 생태계 재건 위한 봉사활동 펼쳐삼성전자, 전 임직원이 AI 아이디어 발굴 나섰다삼성전자, 네트워크 장비 사업 '기지개'...4위로 껑충좋아요0훈훈해요0슬퍼요0화나요0후속기사 원해요0기사제공 :""]"
11,삼성전자, 2018-10-1409:32,아이뉴스24 ,"삼성전자, '포르쉐 익스피리언스' 행사에 'LED 포 홈' 전시",https://finance.naver.com/news/news_read.nhn?article_id=0000467669&office_id=031&mode=search&query=삼성전자&page=4,"['       삼성전자, \'포르쉐 익스피리언스\' 행사에 \'LED 포 홈\' 전시      기사입력2018-10-14 09:32기사원문좋아요훈훈해요좋아요 평가하기공감좋아요0훈훈해요0슬퍼요0화나요0후속기사 원해요0댓글 <아이뉴스24>[아이뉴스24 윤선훈 기자] 삼성전자가 오는 17일까지 말레이시아 세팡 국제 자동차 경기장에서 열리는 \'포르쉐 익스피리언스\' 행사에 홈시네마 시장을 겨냥한 109형 초대형 LED 사이니지 \'LED 포 홈(LED for Home)\' IF P1.2 시리즈를 전시했다고 14일 발표했다. \'LED 포 홈\'은 지난 9월 미국 샌디에이고에서 열린 영상기기 전시회 \'CEDIA 2018\'에서 공개된 제품이다. 프리미엄 고객 대상으로 차별화된 홈시네마 경험을 제공할 목적으로 출시됐다. 픽셀 간격 1.2㎜ 수준의 \'미세 피치(Fine Pixel Pitch)\' LED 기술이 적용된 실내형 고급 사이니지다.아시아·태평양 지역에서 최초로 개최되는 \'포르쉐 익스피리언스\' 행사는 포르쉐의 주요 고객들이 고성능 스포츠카를 실제 국제 자동차 경주장인 서킷에서 시승할 수 있는 행사다.삼성전자는 이번 행사의 하이라이트 공간에 \'LED 포 홈\'을 설치해 시승 참가자 전원에게 초대형 스크린을 활용한 사전 주행 브리핑 교육을 지원하고 프리미엄 홈 시네마 경험을 제공한다.이를 통해 참가자들은 실제 차량에 탑승하지 않아도 차량에 대한 정보를 사전에 숙지하고 동일한 코스를 경험할 수 있도록 했다.이 제품은 베젤이 없는 모듈러 방식의 LED 디스플레이로 109형(풀HD)과 219형(UHD) 크기로도 초대형화가 가능하며, 화면 사이즈와 해상도를 고객이 취향에 맞게 주문할 수 있는 프리미엄 홈 시네마 전문 솔루션이다.LED 미세 피치 기술과 HDR의 선명한 화질로 고급 주택, 별장, 고급 리조트 등에서 개인을 위한 소규모 극장 시스템을 원하는 고객들을 대상으로 했다.한편 이 행사에는 디지털 플립차트 \'삼성 플립(Samsung Flip)\', 65형 스마트 사이니지, 49형 커브드 모니터 등도 함께 전시됐다,/윤선훈기자 krel@inews24.com▶네이버 채널에서 \'아이뉴스24\'를 구독해주세요.▶ 클라우드로 실현하는 새로운 미래[ⓒ 아이뉴스24 무단전재 및 재배포 금지]아이뉴스24 관련뉴스해당 언론사에서 선정하며 언론사 페이지(아웃링크)로 이동해 볼 수 있습니다.이재명 ""신체 공개하겠다…불필요한 논란 끝내고 도정 매진""블리자드 \'콜오브듀티: 블랙옵스4\' 출시…연타 흥행할까\'동덕여대 알몸男 사건\' 경찰 현장조사 착수…""교내 CCTV 분석""[게임리뷰]명성에 걸맞는 품질 \'콜오브듀티: 블랙옵스4\'페이스북, 2천900만 개인정보 뚫렸다좋아요0훈훈해요0슬퍼요0화나요0후속기사 원해요0기사제공 :']"
