,회사명,날짜,언론사,기사제목,링크,본문
0,삼성전자, 2018-02-2123:30,서울경제 ,[단독]삼성-中 텐센트 손잡는다,https://finance.naver.com/news/news_read.nhn?article_id=0003227989&office_id=011&mode=search&query=삼성전자&page=1,"['       [단독]삼성-中 텐센트 손잡는다      기사입력2018-02-21 23:30기사원문좋아요훈훈해요좋아요 평가하기공감좋아요0훈훈해요0슬퍼요0화나요0후속기사 원해요0댓글 한·중 대표 IT 기업 연합 AI·게임 첫 공동투자삼성 HW-텐센트 SW 이상적 결합연합 최종 목적지는 스마트홈 시장[서울경제] 삼성전자(005930)가 중국 최대 정보기술(IT) 기업이자 세계 최대 온라인 게임 회사인 텐센트와 인공지능(AI)·게임 분야를 대상으로 첫 공동 투자에 나선다. 글로벌 시장에서 애플과 구글이 주도권을 가지고 있는 인공지능 기기 분야에서 한국과 중국의 대표 IT 기업이 연합체를 꾸리는 것이다.21일 투자은행(IB) 업계에 따르면 삼성전자와 텐센트는 인공지능 스피커와 게임 개발에 관한 공동 투자를 진행한다. IB 업계의 한 관계자는 “올해 초부터 삼성전자와 텐센트가 인공지능 스피커와 게임 솔루션에 관한 공동 투자를 결정하고 실무논의를 진행하고 있다”며 “조인트벤처(JV) 또는 개발 후 공동소유의 형태가 될 것으로 보인다”고 전했다. 삼성전자는 텐센트를 파트너로 삼아 3%까지 떨어진 중국 내 스마트폰 시장 점유율 회복을 꾀할 것으로 전망된다. 텐센트도 매출의 70% 이상을 차지하고 있는 온라인 게임의 새로운 돌파구를 찾겠다는 전략이다. 텐센트는 지난해 2,394억위안(약 40조6,300억원) 예상 매출 중 70%가 넘는 1,675억위안을 온라인 게임에서 벌어들였다. 텐센트 중국 현지 고위관계자는 “지난 1월 미국 라스베이거스 가전전시회(CES)에서 삼성전자와 접촉했다”며 “구체적으로 밝힐 수는 없지만 중국 시장에서의 협력을 시작으로 삼성전자와 협력을 강화할 계획”이라고 말했다. 삼성전자와 텐센트의 협력은 양사가 현재 가장 필요한 부분을 채워준다. 삼성전자는 인공지능 비서 ‘빅스비(Bixby)’ 서비스를 모바일은 물론 가전·디스플레이 등으로 확대하고 있다. 텐센트는 삼성전자가 취약한 인터넷 플랫폼에서 중국은 물론 전 세계 시장의 주도권을 쥐고 있다. 모바일 메신저 위챗의 월간활성이용자(MAU)는 9억8,000만명에 달한다. 텐센트는 현재 자체 인공지능 기술을 뉴스 분야에서 활용하고 있으며 향후 자율주행차 분야로도 확대할 계획이다.삼성전자와 텐센트 연합의 최종 목적지는 스마트홈 시장이다. 특히 스마트홈 분야의 핵심인 인공지능(AI) 스피커 개발은 정보기술(IT) 기업들이 최근 사활을 걸고 있는 분야다. 스마트폰과 함께 향후 실내외 각종 가전기기의 허브 역할을 할 것으로 기대되기 때문에 초기 시장 선점이 가장 중요하다. 세계 최대 IT 기업인 삼성전자와 텐센트의 협력은 스마트홈 시장에서 후발주자라는 공동 인식 아래 출발했다.텐센트가 삼성전자와 협력하는 것은 중국 내 라이벌인 바이두·알리바바에 비해 인공지능 기술이 다소 부족한 평가를 받기 때문으로 풀이된다. 텐센트는 세계 최대 게임 회사이자 중국 최대 인터넷 플랫폼 기업이지만 지난해 2·4분기 재무보고서에서야 인공지능 전략을 제시했을 정도로 두 경쟁사에 비해 속도가 더딘 편이다. 지난해 공식적으로 텐센트는 “지속적이고 장기적으로 인내심을 갖고 인공지능 분야 투자를 진행할 것”이라고 밝혔다. 텐센트는 현재 미국 내 5개 인공지능 기업에 투자하고 있다. 텐센트의 한 관계자는 “삼성전자가 스마트폰에서 보여준 기술력과 텐센트의 인터넷 플랫폼 간 결합은 가장 이상적인 인공지능 관련 제품과 서비스를 내놓게 될 것”이라고 말했다. 삼성전자는 올해 인공지능 스피커에 음성인식 서비스 빅스비를 탑재한다. 기기 제조에 강점이 있는 삼성전자 역시 인공지능 스피커 시장 진출이 다소 늦었다는 평가를 받는다. 특히 중국 스마트폰 시장에서 하향 곡선을 그리고 있는 삼성전자로서는 스마트폰과 인공지능 스피커 간 결합 부문을 텐센트와 협력한다면 다시 시장 점유율 회복을 꾀할 수 있다는 분석이다. 삼성전자는 2014년까지만 해도 중국 스마트폰 시장 점유율(출하량 기준) 20%대로 1위였지만 지난해 4·4분기 점유율 3%대로 떨어졌다. 양국을 대표하는 IT 기업인 삼성전자와 텐센트의 협력은 이번이 처음이다. IB 업계의 한 관계자는 “텐센트는 인공지능 소프트웨어를 꾸준히 개발했지만 아직 하드웨어 제조는 전무한 상황”이라며 “인공지능 소프트웨어와 기기 제조에 강점이 있는 삼성전자와의 협력도 이 같은 필요성에서 추진됐다”고 밝혔다.양사는 한국과 중국을 넘어 전 세계 시장 진출도 염두에 두고 있다. 세계 최대 IT 기업 구글도 이미 안드로이드 기반 인공지능 스피커 ‘구글홈’ 공급에 열을 올리고 있다. 이 밖에 홈팟(애플), 에코(아마존) 역시 초기 시장 지배력 확보를 위해 고군분투 중이다. 국내의 경우 네이버와 카카오가 인공지능 스피커 시장 선점을 위해 치열하게 경쟁하고 있다. 백승혜 신한금융투자 연구원은 “현재 알리바바와 바이두 모두 인공지능 스피커를 출시해 시장을 확장하고 있는데 텐센트는 이들 경쟁사보다 다소 느린 모습”이라며 “특히 기기 제조에 있어 약점으로 평가돼 삼성전자와의 협력을 통해 ‘BAT(바이두·알리바바·텐센트)’ 내 인공지능 주도권을 차지할 수 있을 것”이라고 분석했다.  /박호현기자 greenlight@sedaily.com  [서울경제 바로가기]이제 주식시세도 서울경제에서 확인하세요 [바로가기▶]블록체인의 모든 것, 서울경제 Decenter [바로가기▶]저작권자 ⓒ 서울경제, 무단 전재 및 재배포 금지서울경제 관련뉴스해당 언론사에서 선정하며 언론사 페이지(아웃링크)로 이동해 볼 수 있습니다.고객돈 17조 쌓인 암호화폐 거래소 참 \'불편한\' 진실\'문의 실종\' 목동·상계동 집주인들 ""어떻게하나"" 한숨한때 잘 나갔던 \'GM 스파크\' 단종 얘기 나오는 이유가리봉서 활개 치는 조선족의 기막힌 \'불법 숙박영업\'잠잠하던 \'김치 프리미엄\' 슬금슬금 다시 오른다는데···좋아요0훈훈해요0슬퍼요0화나요0후속기사 원해요0기사제공 :']"
1,삼성전자, 2018-02-2123:30,서울경제 ,삼성 HW-텐센트 SW 이상적 결합...연합 최종 목적지는 스마트홈 시장,https://finance.naver.com/news/news_read.nhn?article_id=0003227990&office_id=011&mode=search&query=삼성전자&page=1,"['       삼성 HW-텐센트 SW 이상적 결합...연합 최종 목적지는 스마트홈 시장      기사입력2018-02-21 23:30기사원문좋아요훈훈해요좋아요 평가하기공감좋아요0훈훈해요0슬퍼요0화나요0후속기사 원해요0댓글 삼성-中 텐센트 손잡는다[서울경제] 삼성전자(005930)와 텐센트 연합의 최종 목적지는 스마트홈 시장이다. 특히 스마트홈 분야의 핵심인 인공지능(AI) 스피커 개발은 정보기술(IT) 기업들이 최근 사활을 걸고 있는 분야다. 스마트폰과 함께 향후 실내외 각종 가전기기의 허브 역할을 할 것으로 기대되기 때문에 초기 시장 선점이 가장 중요하다. 세계 최대 IT 기업인 삼성전자와 텐센트의 협력은 스마트홈 시장에서 후발주자라는 공동 인식 아래 출발했다.텐센트가 삼성전자와 협력하는 것은 중국 내 라이벌인 바이두·알리바바에 비해 인공지능 기술이 다소 부족한 평가를 받기 때문으로 풀이된다. 텐센트는 세계 최대 게임 회사이자 중국 최대 인터넷 플랫폼 기업이지만 지난해 2·4분기 재무보고서에서야 인공지능 전략을 제시했을 정도로 두 경쟁사에 비해 속도가 더딘 편이다. 지난해 공식적으로 텐센트는 “지속적이고 장기적으로 인내심을 갖고 인공지능 분야 투자를 진행할 것”이라고 밝혔다. 텐센트는 현재 미국 내 5개 인공지능 기업에 투자하고 있다. 텐센트의 한 관계자는 “삼성전자가 스마트폰에서 보여준 기술력과 텐센트의 인터넷 플랫폼 간 결합은 가장 이상적인 인공지능 관련 제품과 서비스를 내놓게 될 것”이라고 말했다. 삼성전자는 올해 인공지능 스피커에 음성인식 서비스 빅스비를 탑재한다. 기기 제조에 강점이 있는 삼성전자 역시 인공지능 스피커 시장 진출이 다소 늦었다는 평가를 받는다. 특히 중국 스마트폰 시장에서 하향 곡선을 그리고 있는 삼성전자로서는 스마트폰과 인공지능 스피커 간 결합 부문을 텐센트와 협력한다면 다시 시장 점유율 회복을 꾀할 수 있다는 분석이다. 삼성전자는 2014년까지만 해도 중국 스마트폰 시장 점유율(출하량 기준) 20%대로 1위였지만 지난해 4·4분기 점유율 3%대로 떨어졌다. 양국을 대표하는 IT 기업인 삼성전자와 텐센트의 협력은 이번이 처음이다. IB 업계의 한 관계자는 “텐센트는 인공지능 소프트웨어를 꾸준히 개발했지만 아직 하드웨어 제조는 전무한 상황”이라며 “인공지능 소프트웨어와 기기 제조에 강점이 있는 삼성전자와의 협력도 이 같은 필요성에서 추진됐다”고 밝혔다.양사는 한국과 중국을 넘어 전 세계 시장 진출도 염두에 두고 있다. 세계 최대 IT 기업 구글도 이미 안드로이드 기반 인공지능 스피커 ‘구글홈’ 공급에 열을 올리고 있다. 이 밖에 홈팟(애플), 에코(아마존) 역시 초기 시장 지배력 확보를 위해 고군분투 중이다. 국내의 경우 네이버와 카카오가 인공지능 스피커 시장 선점을 위해 치열하게 경쟁하고 있다. 백승혜 신한금융투자 연구원은 “현재 알리바바와 바이두 모두 인공지능 스피커를 출시해 시장을 확장하고 있는데 텐센트는 이들 경쟁사보다 다소 느린 모습”이라며 “특히 기기 제조에 있어 약점으로 평가돼 삼성전자와의 협력을 통해 ‘BAT(바이두·알리바바·텐센트)’ 내 인공지능 주도권을 차지할 수 있을 것”이라고 분석했다. /박호현기자 greenlight@sedaily.com[서울경제 바로가기]이제 주식시세도 서울경제에서 확인하세요 [바로가기▶]블록체인의 모든 것, 서울경제 Decenter [바로가기▶]저작권자 ⓒ 서울경제, 무단 전재 및 재배포 금지서울경제 관련뉴스해당 언론사에서 선정하며 언론사 페이지(아웃링크)로 이동해 볼 수 있습니다.고객돈 17조 쌓인 암호화폐 거래소 참 \'불편한\' 진실\'문의 실종\' 목동·상계동 집주인들 ""어떻게하나"" 한숨한때 잘 나갔던 \'GM 스파크\' 단종 얘기 나오는 이유가리봉서 활개 치는 조선족의 기막힌 \'불법 숙박영업\'잠잠하던 \'김치 프리미엄\' 슬금슬금 다시 오른다는데···좋아요0훈훈해요0슬퍼요0화나요0후속기사 원해요0기사제공 :']"
2,삼성전자, 2018-02-2121:39,국민일보 ,"[여의도 stock] 금감원, 정상적 가상화폐 거래 지원에 관련株 ‘쑥’",https://finance.naver.com/news/news_read.nhn?article_id=0001075718&office_id=005&mode=search&query=삼성전자&page=1,"['       [여의도 stock] 금감원, 정상적 가상화폐 거래 지원에 관련株 ‘쑥’      기사입력2018-02-21 21:39기사원문좋아요훈훈해요좋아요 평가하기공감좋아요0훈훈해요0슬퍼요0화나요0후속기사 원해요0댓글암호화폐(가상화폐) 관련주들이 정상적인 가상화폐 거래는 지원하겠다는 금융 당국 입장에 급등했다. 금융감독원은 무늬만 가상화폐 관련주인 업체들을 주의해야 한다며 투자주의보를 발령했다. 21일 코스닥시장에선 가상화폐 관련주로 분류되는 우리기술투자(6.15%) SCI평가정보(4.6%) 등이 올랐다. 최흥식 금감원장은 전날 “은행이 시스템을 구축했으면 당국 눈치를 보지 말고 (계좌 제공을) 해야 한다”고 말했다. 금감원은 거래소 사업을 하거나 추진 중인 20여개 상장사를 점검한 결과 사업의 진위 여부가 의심되는 사례를 다수 발견했다고 밝혔다. 가상화폐 사업 진출을 발표한 뒤 유상증자를 추진하고 사업개시는 연기한 사례 등이 발견됐다. 코스닥지수는 전날 급락을 딛고 1.29% 오른 875.58에 장을 마쳤다. 외국인과 기관이 각각 726억원, 1463억원을 순매수했다. 신라젠(4.29%) 등 바이오·제약주들이 올랐다. 코스피지수는 0.60% 오른 2429.65에 마감했다. 외국인이 1014억원을 순매도했지만 개인과 기관이 각각 73억원 1144억원을 순매수했다. 롯데그룹의 경영권 분쟁이 재점화될 가능성이 커진 가운데 롯데지주(1.28%) 롯데쇼핑(1.66%)이 올랐다. 삼성전자는 0.25% 떨어진 236만4000원에 마감했다. 중국 반도체 업체가 애플과 납품 협상을 진행한다는 소식에 3거래일째 하락세다. 이병래 한국예탁결제원 사장은 기자간담회에서 “삼성전자 액면분할을 거래정지 없이 하기엔 현실적으로 어렵다”고 말했다. 전날 CJ제일제당과 CJ헬스케어 인수 본계약을 체결한 한국콜마는 6.57% 올랐다.나성원 기자 naa@kmib.co.kr[카카오 친구맺기] [페이스북][취재대행소 왱!(클릭)]GoodNews paper ⓒ 국민일보(www.kmib.co.kr), 무단전재 및 재배포금지국민일보 관련뉴스해당 언론사에서 선정하며 언론사 페이지(아웃링크)로 이동해 볼 수 있습니다.안경 선배 김은정의 \'영미~\'와 \'영미!!!\'의 차이는?""선거 움직이는 사람들"" 홍준표, 자영업자에 끝없는 \'구애\'최민정과 찍은 사진으로 트위터 배경화면 바꾼 킴부탱가마골소극장 출신 \'유명 코믹 배우도 성추행 공범\'[포착] 머플러로 얼굴 가린채 출근하는 이명박좋아요0훈훈해요0슬퍼요0화나요0후속기사 원해요0기사제공 :']"
3,삼성전자, 2018-02-2120:18,한국경제 ,조정장서도 '꿋꿋'… 중소형주 펀드가 돌아왔다,https://finance.naver.com/news/news_read.nhn?article_id=0003897009&office_id=015&mode=search&query=삼성전자&page=1,"['       조정장서도 \'꿋꿋\'… 중소형주 펀드가 돌아왔다      기사입력2018-02-21 20:18기사원문좋아요훈훈해요좋아요 평가하기공감좋아요0훈훈해요0슬퍼요0화나요0후속기사 원해요0댓글올 수익률 평균 1.59%…연초 이후 3327억 \'뭉칫돈\' 유입\'KTB리틀빅스타\' 올 8% 수익전체 주식형펀드는 0.28% 손실""개별종목 차별화 장세 가능성중소형주 펀드 명암 갈릴 수도""[ 박종서 기자  ] 이달 들어 본격화된 증시 조정으로 펀드 ‘성적표’가 급격히 나빠진 가운데 중소형주 펀드의 성과가 돋보이고 있다. 국내 주식형 펀드의 연초 이후 평균 수익률이 마이너스로 돌아섰지만, 중소형주 펀드는 꿋꿋하게 플러스를 지켜냈다. 중소형주 장세 기대감이 여전한 데다 손실방어 능력까지 확인되면서 개인투자자는 물론 기관투자가도 ‘뭉칫돈’을 밀어넣고 있다.◆급락장서 개인·기관 베팅21일 금융정보업체인 에프앤가이드에 따르면 올 들어 국내 주식형 펀드(825개)의 평균 손익률(20일 기준)은 -0.28%로 집계됐다. 지난달 증시가 급등하면서 연초 이후 지난달 말까지 평균 수익률은 5.21%에 달했다. 하지만 지난 1일부터 9일까지 코스피지수가 7.89% 하락하는 등 큰 폭으로 조정받으면서 수익률이 곤두박질쳤다.하지만 중소형주 펀드(49개)는 달랐다. 연초 이후 평균 1.59% 수익률을 기록했다. 분야별 조사 대상 펀드 중 최상위권이다. 중소형주 펀드 중 KTB자산운용의 ‘리틀빅스타펀드’의 연초 이후 수익률은 8.01%에 달했다.중소형주 펀드가 선전하면서 투자금도 늘어나고 있다. 올해 액티브펀드 전체로는 1042억원이 빠져나갔지만, 중소형주 펀드에는 3327억원이 순유입됐다. 증시가 출렁였던 이달 들어서도 1052억원이 들어왔다.전경대 맥쿼리투자신탁운용 상무는 “증시가 고공행진하는 기간에도 조정이 오기만 하면 투자하겠다는 개인과 기관이 많았다”며 “이들 투자자가 중소형주 투자에 나서고 있다”고 설명했다.금융투자업계에서는 정부의 코스닥시장과 벤처기업 활성화 대책 호재가 남아있는 데다 유가증권시장 시가총액 1, 2위 종목인 삼성전자와 SK하이닉스의 조정이 이어지면서 대형주보다 중소형주에 대한 기대가 커졌다는 분석이 나온다.자산운용사들은 이달 들어 코스닥시장에서 608억원을 순매수하며 코스닥시장 반등을 주도하고 있다. 코스닥지수는 13일 663.92로 저점을 찍고 반등해 21일 727.17로 마감했다. 이 기간에 9.52% 올랐다.이달 들어 자산운용사가 많이 사들인 종목은 코스닥 시가총액 상위권에 포진한 바이오주다. 셀트리온헬스케어를 891억원 순매수해 가장 많이 사들였다. 신라젠(491억원 순매수) 메디톡스(340억원) CJ E&M(246억원) 바이로메드(219억원) 등이 뒤를 이었다.◆주도株 전망은 엇갈려자산운용업계에선 펀드매니저의 역량 등에 따라 조만간 중소형주 펀드 간 명암이 갈릴 것이란 전망이 나온다. 민수아 삼성액티브자산운용 밸류본부장은 “지금까지는 중소형주 시장에서 차별화 장세가 나타나지 않았지만 앞으로는 다를 것”이라며 “개별 종목 위주로 차별 장세가 연출될 가능성이 크다”고 말했다.주도주 전망 또한 달랐다. 특히 의견이 갈리는 업종은 정보기술(IT) 업종이다. 민 본부장은 “IT라고 해도 일률적으로 좋다, 나쁘다를 말하기 어려운 국면”이라며 “휴대폰, 유기발광다이오드(OLED) 관련 종목보다는 액정표시장치(LCD)에 대한 관심을 늘릴 필요가 있다”고 했다.김진성 트러스톤자산운용 펀드매니저는 “사드(고고도 미사일방어체계) 피해에 따른 낙폭과대주나 엔터테인먼트주, 게임주 등을 주목해야 한다”는 의견을 내놨다.자산운용업계 관계자는 “미국 현지시간으로 다음달 20, 21일 열리는 연방공개시장위원회(FOMC) 회의에서 미국 금리정책 방향을 확인하기까지 눈치 보기 장세가 이어질 가능성이 크다”며 “금리정책의 불확실성이 해소되면 이때를 기점으로 중소형주의 상승 속도가 빨라질 가능성이 높다”고 말했다.박종서 기자 cosmos@hankyung.com[한경닷컴 바로가기] [글방] [모바일한경 구독신청] ⓒ 한국경제 & hankyung.com, 무단전재 및 재배포 금지한국경제 관련뉴스해당 언론사에서 선정하며 언론사 페이지(아웃링크)로 이동해 볼 수 있습니다.중소형주 펀드 석달째 \'뭉칫돈\'… 살벌한 조정장에도 수익률 \'꿋꿋\'코스닥 투자 \'셀트리온 쏠림\' 부담된다면… 업종지수 ETF·중소형주 펀드가 대안코스닥 열기 타고 다시 뜨는 중소형주 펀드코스닥 랠리 기대감… 되살아나는 \'중소형주 펀드\'성과 좋으니 대접 달라진 중소형주 펀드좋아요0훈훈해요0슬퍼요0화나요0후속기사 원해요0기사제공 :']"
4,삼성전자, 2018-02-2120:15,한국경제 ,"LG전자, 9년 만에 분기 영업이익 '1조원 클럽' 복귀할까",https://finance.naver.com/news/news_read.nhn?article_id=0003897000&office_id=015&mode=search&query=삼성전자&page=1,"['       LG전자, 9년 만에 분기 영업이익 \'1조원 클럽\' 복귀할까      기사입력2018-02-21 20:15기사원문좋아요훈훈해요좋아요 평가하기공감좋아요0훈훈해요0슬퍼요0화나요0후속기사 원해요0댓글""에어컨 판매 좋으면 1조 넘을 듯휴대폰·자동차 전장 사업이 변수""[ 강영연 기자  ] LG전자가 분기 영업이익 ‘1조 클럽’ 재가입에 도전한다. 증권업계에선 이르면 1분기에 재가입할 수 있을 것이란 전망이 나온다.21일 유가증권시장에서 LG전자는 3000원(2.88%) 내린 10만1000원에 마감했다. 지난달 말부터 이달 초까지 이어진 조정장에서 LG전자는 정보기술(IT)주 가운데 선방한 축에 속한다는 평가를 받는다. 이달 들어 1.46% 떨어지는 데 그쳐 삼성SDI(-9.64%), 삼성전자(-5.25%), LG디스플레이(-4.50%)보다 하락폭이 작았다. 주가가 본격적으로 상승세를 타기 시작한 작년 4분기 이후 상승률은 22.57%다.LG전자가 이 같은 성과를 낸 건 실적 개선 덕분이다. LG전자는 지난해 4분기 3669억원의 영업이익을 내 전년 동기 대비 흑자 전환했다. 올레드 TV를 앞세운 TV사업부가 반전을 이끌었다. 김지산 키움증권 연구원은 “연말 성수기를 맞아 올레드 TV가 54만 대 판매되는 등 기대 이상의 실적을 냈다”며 “패널 가격이 안정화되면서 수익성도 높아졌다”고 설명했다.증권업계는 올해도 LG전자의 실적 개선 흐름이 이어질 것으로 보고 있다. 미래에셋대우는 LG전자의 1분기 영업이익이 9229억원에 달할 것으로 전망했다. 박원재 미래에셋대우 연구원은 “TV, 가전 등에서 고가 제품 비중이 확대되고 있는 게 긍정적”이라며 “1분기 말부터 본격적으로 늘어날 것으로 예상되는 에어컨 판매 성적에 따라 분기 영업이익 1조 클럽 재가입도 가능할 것”이라고 했다.LG전자의 1분기 영업이익이 1조원을 넘으면 2009년 2분기 이후 35분기 만에 분기 영업이익 1조 클럽에 재가입하게 된다. 현재 분기 영업이익이 1조원을 넘는 상장사는 삼성전자, SK하이닉스, SK(주), 포스코 4곳이다.변수는 휴대폰 사업과 자동차 전자장비(전장) 사업이다. 휴대폰 사업은 적자가 이어지고 있고, 자동차 전장 사업은 이익 증가 속도가 예상보다 느리다는 평가가 나온다. 어규진 이베스트투자증권 연구원은 “스마트폰 G7 출시 지연에 따른 휴대폰 사업부 매출 하락으로 1분기 수익이 작년 같은 기간보다 감소할 것”이라고 전망했다.강영연 기자 yykang@hankyung.com[한경닷컴 바로가기] [글방] [모바일한경 구독신청] ⓒ 한국경제 & hankyung.com, 무단전재 및 재배포 금지한국경제 관련뉴스해당 언론사에서 선정하며 언론사 페이지(아웃링크)로 이동해 볼 수 있습니다.삼성 1위·LG 2위...인도가 신뢰하는 IT제목없음스마트폰, 듣도 보도 못한 \'컬러\'에 꽂히다LG전자 \'퓨리케어 공기청정기·제습기\' 30개국으로 출시 확대LG전자, 스마트폰 차기 모델에 LCD 탑재…LGD에 \'긍정적\'-하나좋아요0훈훈해요0슬퍼요0화나요0후속기사 원해요0기사제공 :']"
