,회사명,날짜,언론사,기사제목,링크,본문
12,삼성전자, 2018-11-2310:30,뉴스1 ,[전문] 김기남 삼성전자 사장 '반도체 백혈병' 사과문,https://finance.naver.com/news/news_read.nhn?article_id=0003706641&office_id=421&mode=search&query=삼성전자&page=14,"['       [전문] 김기남 삼성전자 사장 \'반도체 백혈병\' 사과문      기사입력2018-11-23 10:30기사원문좋아요훈훈해요좋아요 평가하기공감좋아요0훈훈해요0슬퍼요0화나요0후속기사 원해요0댓글 (서울=뉴스1) 오상헌 기자 = 안녕하십니까? 삼성전자 대표이사 김기남 사장입니다.10여년 동안 저희가 해결하지 못한 문제를 사회적 합의라는 방식으로 해결을 이끌어 주신 김지형 조정위원장님과 백도명, 정강자 위원님께 감사의 말씀을 드립니다.또한, 어려움 속에서도 끝까지 문제를 풀어내기 위해 성심껏 논의에 참여해 주신 반올림 관계자 분들께도 감사드립니다.소중한 동료와 그 가족들이 오랫동안 고통 받으셨는데삼성전자는 이를 일찍부터 성심껏 보살펴드리지 못했습니다. 그 아픔을 충분히 배려하고 조속하게 해결하기 위한 노력이 부족했습니다.또한, 삼성전자는 그 동안 반도체 및 LCD 사업장에서 건강유해인자에 의한 위험에 대해, 충분하고 완전하게 관리하지 못했습니다. 오늘 이 자리를 빌어 병으로 고통 받은 근로자와 그 가족분들께 진심으로 사과드립니다. 이번 일을 계기로 삼성전자는 더욱 건강하고 안전한 일터로 거듭나겠습니다. 오랫동안 풀기 어려웠던 문제를 해결하는데 관심을 가지고 충고와 조언을 해 주신 우원식 의원님, 심상정 의원님,한정애 의원님, 이정미 의원님, 안경덕 정책실장님 및노동부 관계자 여러분들께 감사드립니다.다시 한번 고통을 겪으신 모든 분들께 깊은 사과의 말씀을 드립니다.다음으로 조정위원회의 중재안에 따른 삼성전자의 이행계획을 말씀드리겠습니다.삼성전자는 2018년 11월 1일 발표된 중재안을 조건없이 수용하여 이행할 것을 약속 드립니다. 이를 위해 다음과 같이 세부 이행계획을 수립하여 실행하고자 합니다.보상 업무는 중재 판정에서 정한대로 반올림과의 합의에 따라 제 3의 독립기관인\'법무법인 지평\'에 위탁하겠습니다.또한, 지원보상위원회 위원장은 법무법인 지평의 김지형 대표 변호사님으로 반올림과 합의했습니다.삼성전자는 중재안에서 정한 지원보상안과 지원보상위원회 위원장이 정하시는 세부 사항에 따라, 2028년까지 보상이 차질없이 이뤄지도록 최대한의 지원을 다하겠습니다.삼성전자는 중재 판정에 규정된 바와 같이 2018년 11월 30일까지 회사 홈페이지에 사과의 주요 내용과 지원보상 안내문을 게재하겠습니다.또한, 삼성전자는 새롭게 구성되는 지원보상위원회를 통해보상 결정을 받은 분들에게 사과문을 보내 위로의 마음을 전하겠습니다.삼성전자는 중재 판정에 명시된 산업안전보건 발전기금 500억원을 전문성과 공정성을 갖춘 한국산업안전보건공단에 기탁하기로 반올림과 합의했습니다.삼성전자는 여러분들의 노력으로 만들어진 사회적 합의가 좋은 결실을 맺을수 있도록 최선의 노력을 다하겠습니다. 감사합니다.bborirang@news1.kr▶ 진짜 블록체인을 만나는 곳 \'크립토허브\' 오픈! ▶ [페이스북] 바로가기! ▶ 갤럭시워치행운&기프티콘 무조건 받기![© 뉴스1코리아(news1.kr), 무단 전재 및 재배포 금지]뉴스1 관련뉴스해당 언론사에서 선정하며 언론사 페이지(아웃링크)로 이동해 볼 수 있습니다.공무원이 \'일자리 도둑\'…자기가 공고 낸 자리에 \'셀프취업\'""300억 주식, 기사 보고 알아"" 오뚜기 3세 함연지는 누구?\'결혼반대\' 엄마 불태워 죽이고 자살 신고""암이 전염병 아니었어?"" 학생 격리시킨 선생군기 빠진 중국 축구?…3주간 군사훈련좋아요0훈훈해요0슬퍼요0화나요0후속기사 원해요0기사제공 :']"
13,삼성전자, 2018-11-2310:30,뉴스1 ,"김기남 삼성전자 사장 ""반도체 직업병 직원에 사과""(속보)",https://finance.naver.com/news/news_read.nhn?article_id=0003706643&office_id=421&mode=search&query=삼성전자&page=14,"['       김기남 삼성전자 사장 ""반도체 직업병 직원에 사과""(속보)      기사입력2018-11-23 10:30기사원문좋아요훈훈해요좋아요 평가하기공감좋아요0훈훈해요0슬퍼요0화나요0후속기사 원해요0댓글 sho218@news1.kr▶ 진짜 블록체인을 만나는 곳 \'크립토허브\' 오픈! ▶ [페이스북] 바로가기! ▶ 갤럭시워치행운&기프티콘 무조건 받기![© 뉴스1코리아(news1.kr), 무단 전재 및 재배포 금지]뉴스1 관련뉴스해당 언론사에서 선정하며 언론사 페이지(아웃링크)로 이동해 볼 수 있습니다.""권양숙입니다""…윤장현 前시장, 보이스피싱 4.5억 뜯겨공무원이 \'일자리 도둑\'…자기가 공고 낸 자리에 \'셀프취업\'\'결혼반대\' 엄마 불태워 죽이고 자살 신고""암이 전염병 아니었어?"" 학생 격리시킨 선생군기 빠진 중국 축구?…3주간 군사훈련좋아요0훈훈해요0슬퍼요0화나요0후속기사 원해요0기사제공 :']"
14,삼성전자, 2018-11-2310:29,연합뉴스 ,"반올림 ""삼성전자 외 다른 전자계열사 직업병도 보상해야""",https://finance.naver.com/news/news_read.nhn?article_id=0010485621&office_id=001&mode=search&query=삼성전자&page=14,"['       반올림 ""삼성전자 외 다른 전자계열사 직업병도 보상해야""      기사입력2018-11-23 10:29기사원문좋아요훈훈해요좋아요 평가하기공감좋아요0훈훈해요0슬퍼요0화나요0후속기사 원해요0댓글 노조 탄압 사과·노조활동 권리 보장 약속 등도 촉구인사말하는 황상기 반올림 대표(서울=연합뉴스) 김도훈 기자 = 황상기 반올림 대표가 23일 오전 서울 중구 프레스센터에서 열린 삼성전자-반올림 중재판정 이행합의 협약식에서 인사말하고 있다.     superdoo82@yna.co.kr(끝)    (서울=연합뉴스) 이승관 배영경 기자 = \'삼성 반도체 백혈병\' 피해자들을 대변하는 시민단체인 \'반올림\'은 23일 삼성에 대해 삼성전자 외 다른 전자계열사들에서 발생한 직업병에 대해서도 보상해야 한다고 주장했다.    반올림의 황상기 대표는 이날 서울 프레스센터에서 열린 \'중재 판정 이행 합의 협약식\'에서 ""직업병 피해는 삼성전자 반도체·LCD 부문에서만 있는 게 아니다""며 ""삼성전기, 삼성SDS, 삼성SDI 등 다른 계열사에서도 유해 물질을 사용하다가 병든 노동자들이 있다""고 지적했다.삼성 \'반도체 백혈병\' ""고통받은 근로자·가족에 진심 사과"" / 연합뉴스 (Yonhapnews)    그는 또 ""국내뿐 아니라 해외 사업장에서도 비슷한 피해자들이 있다""면서 ""삼성은 이 모든 직업병 노동자들을 위한 폭넓은 보상을 마련하기 바란다""고 촉구했다.    \'반도체 사업장에서의 백혈병 등 질환 발병과 관련한 문제 해결을 위한 조정위원회\'(위원장 김지형 전 대법관)가 내놓은 중재인에 대해서도 ""사외협력업체 소속이라서 혹은 보상 대상 질환이 아니라서 보상에 포함되지 못하는 분들이 계시다는 점이 안타깝다""며 아쉬움을 나타냈다.삼성전자-반올림 중재판정 이행합의 협약식(서울=연합뉴스) 김도훈 기자 = 23일 오전 서울 중구 프레스센터에서 열린 삼성전자-반올림 중재판정 이행합의 협약식에서 삼성전자 김기남 대표이사(왼쪽부터), 김지형 조정위원장, 반올림 황상기 대표가 협약서에 서명한 후 기념촬영을 하고 있다.     superdoo82@yna.co.kr(끝)    황 대표는 지난 2007년 삼성전자 기흥공장에서 근무하던 중 급성 백혈병으로 숨져 \'반도체 백혈병\' 분쟁의 계기를 제공했던 근로자 황유미 씨의 부친이다.    이어 황 대표는 ""삼성은 국내와 해외에서 노동조합을 탄압해 왔다""고 비판한 뒤 ""이제라도 사과하고, 노동조합을 할 권리를 존중하겠다고 약속해야 한다""고 주장했다.    그는 정부와 근로복지공단에 대해서도 산재 노동자 권리를 보호하는 역할이 부족했다고 지적하면서 산재보험제도 개혁, 직업병 예방을 위한 산업안전보건법 강화 등을 건의했다.    이밖에 황 대표는 삼성전자의 이날 공식 사과에 대해 ""지난 11년간 수없이 속고 모욕당했던 일이나 직업병의 고통, 사랑하는 가족을 잃은 아픔을 생각하면 그 어떤 사과도 충분할 순 없다""면서 ""제 딸 유미에게 했던 약속을 지키게 돼 기쁘지만 유미와 제 가족이 겪었던 아픔은 잊을 수 없다""고 덧붙였다.악수하는 삼성 김기남 대표이사와 반올림 황상기 대표(서울=연합뉴스) 김도훈 기자 = 삼성전자 김기남 대표이사(오른쪽)가 23일 오전 서울 중구 프레스센터에서 열린 삼성전자-반올림 중재판정 이행합의 협약식에서 반도체 백혈병 문제에 대해 공식 사과 및 이행계획 발표를 마치고 반올림 황상기 대표와 악수하고 있다.     superdoo82@yna.co.kr(끝)    humane@yna.co.kr▶놓치면 아쉬운 \'핫뉴스\'  ▶뉴스가 보여요 - 연합뉴스 유튜브 ▶네이버 홈에서 [연합뉴스] 채널 구독하기연합뉴스 관련뉴스해당 언론사에서 선정하며 언론사 페이지(아웃링크)로 이동해 볼 수 있습니다.\xa0김종천 靑의전비서관 음주운전 적발…사직 처리\xa0원룸 열어보니…군인 등 3명 숨진 채 발견\xa0\'마닷 부모 사기\' 신고 잇달아…경찰에 피해액 물어보니\xa0조두순 포항교도소로 이감…이유는?\xa0\'저 영부인인데요\'…전 시장도 속아넘어간 사칭 사기좋아요0훈훈해요0슬퍼요0화나요0후속기사 원해요0기사제공 :']"
15,삼성전자, 2018-11-2310:28,조선비즈 ,코스피지수 보합권서 등락 거듭…외국인은 9일만에 '사자',https://finance.naver.com/news/news_read.nhn?article_id=0000420642&office_id=366&mode=search&query=삼성전자&page=14,"['       코스피지수 보합권서 등락 거듭…외국인은 9일만에 \'사자\'      기사입력2018-11-23 10:28기사원문좋아요훈훈해요좋아요 평가하기공감좋아요0훈훈해요0슬퍼요0화나요0후속기사 원해요0댓글 앞서 3거래일 연속 하락 마감한 코스피지수가 23일 오전에는 등락을 거듭하며 보합권에 머물러 있다. 외국인이 9일만에 매수 우위로 돌아섰지만 기관과 개인이 순매도하며 지수의 상승 의지를 방해하고 있다.조선DB23일 오전 10시 26분 현재 코스피지수는 전날보다 0.07%(1.51포인트) 하락한 2068.44를 기록하고 있다. 코스피지수는 기분 좋게 상승 출발했으나 17분만에 하락 전환한 후 상승과 하락을 반복하며 횡보 흐름을 나타내고 있다. 외국인과 개인이 각각 66억원, 3억원 순매수 중이고 기관은 65억원어치를 팔고 있다.같은 시각 코스닥지수는 전거래일 대비 0.34%(2.36포인트) 상승한 694.75를 기록 중이다. 코스닥시장에서는 외국인만 172억원 순매수하고 개인과 기관은 각각 138억원, 19억원 순매도하고 있다. 기관은 코스닥시장에서 18거래일 연속 ‘팔자’ 기조를 유지하고 있다.서상영 키움증권 연구원은 오는 29일 열릴 미·중 정상회담을 앞두고 시장 참여자들의 관망세가 이어질 것으로 전망했다. 서 연구원은 ""중국 상무부가 22일 ‘미·중 관계자들이 밀접한 접촉을 유지하고 있다’고 말한 것은 한국 증시에 긍정적인 요소""라고 분석했다.코스피 업종별로는 금융업이 0.42%, 통신업이 0.33% 하락 중이다. 반면 비금속광물은 1.11%, 건설업은 1.02% 상승 중이다.코스피 시가총액 상위 종목들은 혼조세를 보이고 있다. 삼성전자(005930)와 SK하이닉스(000660)는 각각 0.12%, 0.72% 하락하고 있다. 반면 셀트리온(068270)과 현대차(005380)는 각각 1.12%, 0.54% 상승 중이다. 코스닥시장에서는 셀트리온헬스케어(091990)가 0.88%, 신라젠(215600)이 1.54% 강세를 나타내고 있다.한편 22일(현지시간) 뉴욕 증시는 추수감사절로 휴장했다. 23일에는 미국 동부시간으로 오후 1시에 조기 폐장할 예정이다. 미국은 이날 블랙프라이데이를 시작으로 26일 사이버 먼데이까지 연말 쇼핑 시즌에 돌입한다.[김민정 기자 mjkim@chosunbiz.com]chosunbiz.com조선비즈 관련뉴스해당 언론사에서 선정하며 언론사 페이지(아웃링크)로 이동해 볼 수 있습니다.지금도 최악인데… 22일 나올 \'소득 지표\' 주목저임금·저숙련·저학력 근로자부터… 최저임금 과속에 치였다가격은 빠지고, 중국은 칼빼고… 반도체 \'시련의 계절\'쥬라기 공원 공룡 복원하듯, 멸종된 꽃 향기 살려냈다개미는 거래정지 직전까지 \'삼바춤\'을 췄다좋아요0훈훈해요0슬퍼요0화나요0후속기사 원해요0기사제공 :']"
16,삼성전자, 2018-11-2310:24,디지털타임스 ,"삼성전자, `반도체 백혈병` 사과문 발표…10년 갈등 매듭",https://finance.naver.com/news/news_read.nhn?article_id=0002493945&office_id=029&mode=search&query=삼성전자&page=14,"['       삼성전자, `반도체 백혈병` 사과문 발표…10년 갈등 매듭      기사입력2018-11-23 10:24기사원문좋아요훈훈해요좋아요 평가하기공감좋아요0훈훈해요0슬퍼요0화나요0후속기사 원해요0댓글 [디지털타임스 강해령 기자] ""병으로 고통 받은 근로자와 그 가족분들께 진심으로 사과드린다.""삼성전자가 \'반도체 백혈병\' 문제에 대해 사과문을 발표했다.23일 삼성전자 반도체 등 사업장에서의 백혈병 등 질환 발병과 관련한 문제 해결을 위한 조정위원회(이하 조정위)에 따르면 삼성전자와 반올림은 중재판정 이행합의 협약식을 열고, 김기남 삼성전자 대표이사가 직접 사과하면서 10년 갈등을 매듭지었다. 김 대표는 ""소중한 동료와 그 가족들이 오랫동안 고통 받으셨는데 삼성전자는 이를 일찍부터 성심껏 보살펴드리지 못했고, 조속히 해결하기 위한 노력도 부족했다""고 말했다. 또 그는 ""그 동안 반도체·LCD(액정표시장치) 사업장에서 건강위험에 대해 충분한 관리 를 하지 못했다""며 ""병으로 고통 받은 근로자와 그 가족분들께 진심으로 사과드린다""고 밝혔다.삼성전자는 중재안에 따라 회사 홈페이지에도 사과문과 지원보상 안내문을 게재하고, 지원보상을 받은 반올림 피해자에게는 개별적으로 대표이사 명의로 사과문을 전달할 예정이다.피해자 대변 시민단체인 \'반올림\' 피해자 대표 황상기 씨는 ""삼성전자 대표이사의 사과는 솔직히 직업병 피해가족들에게 충분하지는 않지만 받아들이겠다""고 했다. 그러면서 ""이번 보상안이 대상을 대폭 넓혀서 반올림 피해자들뿐만 아니라 다른 피해자들도 포함되어 다행""이라면서 ""이번에 보상범위에 들지 못한 피해자들에게도 보상방안을 마련해 줄 것을 부탁드린다""고 말했다. 중재를 담당했던 김지형 조정위 위원장은 ""그동안의 관심과 성원에 감사드린다""면서 ""반올림과 삼성전자가 보내준 신뢰를 거울 삼아 지원보상을 실행해 나가는 일에 소홀함이 없도록 하겠다""고 말했다.삼성전자는 이번 협약에서 재발방지와 사회공헌의 일환으로 출연하기로 한 산업안전보건 발전기금 500억원을 안전보건공단에 기탁할 예정이다. 이는 전자산업안전보건센터 건립 등 안전보건 연구개발과 기술지원서비스를 위한 인프라 구축 등 산재예방 사업에 쓰일 예정이다. 고용노동부 이재갑 장관은 ""정부를 믿고 막중한 임무를 맡겨 주신 점에 감사드린다""며, ""삼성전자와 반올림 피해자 여러분의 숭고한 뜻에 어긋나지 않게 기금이 잘 쓰이도록 하겠다""고 했다. 삼성전자와 법무법인 지평은 조속한 시일 내에 피해자 지원보상을 위한 업무협약을 맺고, 곧바로 지원보상 사무국을 개설할 것으로 알려졌다. 법무법인 지평 관계자는 ""지원보상 준비와 사무국 개소에는 최소한 2, 3주가 필요하지만, 최대한 서둘러 12월 초에 사무국을 개설할 예정""이라고 설명했다. 이날 협약식에는 당사자 뿐 아니라 정부 관계자·국회의원 등도 참석했다. 정부에서는 이재갑 고용노동부 장관, 박두용 안전보건공단 이사장 등이 참석했고, 국회에서는 더불어민주당 전 원내대표인 우원식 의원과 환경노동위원회 여당 간사를 맡고 있는 한정애 의원, 정의당 전 원내대표 심상정 의원, 현 원내대표인 이정미 의원 등이 자리했다. 심상정 의원은 ""산업재해예방 에 정치권의 책임이 큰 만큼 국회에서 노동안전 강화를 위한 제도개선에 최선을 다하겠다""고 밝혔다.강해령기자 strong@dt.co.kr삼성전자가 \'반도체 백혈병\' 문제에 대해 사과했다. 지난 7월 24일 김선식 삼성전자 전무(맨 오른쪽), 김지형 조정위원회 위원장(가운데), 황상기 반올림 대표가 중재합의서에 서명하고 있다. <연합뉴스 제공>     디지털타임스 홈페이지 바로가기 / 디지털타임스 뉴스 더보기네이버 채널에서 \'디지털타임스\'를 구독해주세요.디지털타임스 관련뉴스해당 언론사에서 선정하며 언론사 페이지(아웃링크)로 이동해 볼 수 있습니다.마이크로닷 통편집, 초대형 자막으로 널 지운다..""안녕 마닷""베일 벗은 3세대 쏘울... 하이테크 입고 더 독해졌다변희봉 췌장암, \'미스터 션샤인\' 출연 직전 건강검진서 발견 ""호전中""허민 정인욱, 야구시즌 중 혼전임신 사실 숨겨 ""너무 괴로웠다!""올 겨울엔 김밥 말고 \'구스근육\' 입어봐요좋아요0훈훈해요0슬퍼요0화나요0후속기사 원해요0기사제공 :']"
17,삼성전자, 2018-11-2310:22,이데일리 ,'반도체 백혈병' 사과한 삼성전자 “2028년까지 차질 없는 보상” (전문),https://finance.naver.com/news/news_read.nhn?article_id=0004258063&office_id=018&mode=search&query=삼성전자&page=14,"['       \'반도체 백혈병\' 사과한 삼성전자 “2028년까지 차질 없는 보상” (전문)      기사입력2018-11-23 10:22기사원문좋아요훈훈해요좋아요 평가하기공감좋아요0훈훈해요0슬퍼요0화나요0후속기사 원해요0댓글23일 \'삼성-반올림 중재판정서 합의의행 협약식\' 열어김기남 삼성전자 DS부문 대표가 직접 사과문 낭독""이번 일 계기로 더욱 건강하고 안전한 일터 거듭""삼성전자 서초 사옥 [사진=이데일리DB][이데일리 김종호 기자] 김기남 삼성전자 DS부문 대표는 23일 “소중한 동료와 그 가족들의 고통을 일찍부터 성심껏 보살펴드리지 못했다”면서 “병으로 고통 받은 직원들과 그 가족분들께 진심으로 사과드린다”고 말했다.김 대표는 이날 오전 10시 30분 서울 중구 세종대로 한국프레스센터 국제회의장에서 ‘삼성-반올림 중재판정서 합의의행 협약식’에서 이같은 사과문을 발표했다. 그는 “삼성전자는 과거 반도체 및 LCD 사업장에서 건강유해인자에 의한 위험에 대해 충분하고 완벽하게 관리하지 못했다”고 인정하면서 “이번 일을 계기로 삼성전자는 더욱 건강하고 안전한 일터로 거듭날 것”이라고 약속했다.이어 김 대표는 “삼성전자는 반올림과의 합의 중재안을 조건 없이 수용해 이행할 것”이라며 “세부 이행계획을 수립해 실행해 나가겠다”고 말했다.이날 발표된 중재안에 따르면 삼성전자는 보상 업무를 반올림과의 합의에 따라 제3의 독립기관인 ‘법무법인 지평’에 위탁한다. 지원보상위원회 위원장은 법무법인 지평의 김지형 대표 변호사로 합의했으며, 위원장이 정하는 세부사항에 따라 오는 2028년까지 차질 없는 보상을 추진한다.또 삼성전자는 오는 30일까지 회사홈페이지에 사과 내용과 지원 보상 안내문을 게재하고, 보상 결정을 받은 환자에게 사과문을 보낼 예정이다.이와 함께 삼성전자는 중재 판정에 명시된 산업안전보건 발전기금 500억원을 전문성과 공정성을 갖춘 한국산업안전보건공단에 기탁하기로 했다.마지막으로 김 대표는 “삼성전자는 이번 사회적 합의가 좋은 결실을 맺을 수 있도록 최선의 노력을 다하겠다”고 언급했다.아래는 김 대표의 사과문 전문.10여년 동안 저희가 해결하지 못한 문제를 사회적 합의라는 방식으로 해결을 이끌어 주신 김지형 조정위원장님과 백도명, 정강자 위원님께 감사의 말씀을 드립니다.또한, 어려움 속에서도 끝까지 문제를 풀어내기 위해 성심껏 논의에 참여해주신 반올림 관계자 분들께도 감사드립니다.소중한 동료와 그 가족들이 오랫동안 고통 받으셨는데 삼성전자는 이를 일찍부터 성심껏 보살펴드리지 못했습니다. 그 아픔을 충분히 배려하고 조속하게 해결하기 위한 노력이 부족했습니다.또한, 삼성전자는 과거 반도체 및 LCD 사업장에서 건강유해인자에 의한 위험에 대해, 충분하고 완벽하게 관리하지 못했습니다.오늘 이 자리를 빌어 병으로 고통 받은 직원들과 그 가족분들께 진심으로 사과드립니다. 이번 일을 계기로 삼성전자는 더욱 건강하고 안전한 일터로 거듭나겠습니다.오랫동안 풀기 어려웠던 문제를 해결하는데 관심을 가지고 충고와 조언을 해 주신 우원식 의원님, 심상정 의원님, 한정애 의원님, 이정미 의원님, 안경덕 노동정책실장님 및 노동부 관계자 여러분들께 감사드립니다.다시 한번 고통을 겪으신 모든 분들께 깊은 사과의 말씀을 드립니다.다음으로 조정위원회의 중재안에 따른 삼성전자의 이행계획을 말씀드리겠습니다.삼성전자는 2018년 11월 1일 발표된 중재안을 조건없이 수용하여 이행할 것을 약속 드립니다.이를 위해 다음과 같이 세부 이행계획을 수립하여 실행하고자 합니다.보상 업무는 중재 판정에서 정한대로 반올림과의 합의에 따라 제 3의 독립기관인 ‘법무법인 지평’에 위탁하겠습니다.또한, 지원보상위원회 위원장은 법무법인 지평의 김지형 대표 변호사님으로 반올림과 합의했습니다. 삼성전자는 중재안에서 정한 지원보상안과 지원보상위원회 위원장이 정하시는 세부 사항에 따라, 지금부터 2028년에 이르기까지 보상이 차질 없이 이뤄지도록 하겠습니다.삼성전자는 중재 판정에 규정된 바와 같이 2018년 11월 30일까지 회사 홈페이지에 사과 내용과 지원보상 안내문을 게재하겠습니다.또한, 삼성전자는 새롭게 구성되는 지원보상위원회를 통해 보상 결정을 받은 분들에게도 사과문을 보내 위로의 마음을 전하겠습니다.삼성전자는 중재 판정에 명시된 산업안전보건 발전기금 500억원을 전문성과 공정성을 갖춘 한국산업안전보건공단에 기탁하기로 반올림과 합의했습니다.삼성전자는 여러분들의 노력으로 만들어진 사회적 합의가 좋은 결실을 맺을 수 있도록 최선의 노력을 다하겠습니다.감사합니다.김종호 (kona@edaily.co.kr)선착순 \'5만명\' 한정, KFC 쿠폰이 공짜~ [오만한 이벤트▶]빡침해소! 청춘뉘우스~ [스냅타임▶]마감 D-1, ‘갤럭시 워치’ 경품 이벤트~ [경품 타가세요▶]＜ⓒ종합 경제정보 미디어 이데일리 - 무단전재 & 재배포 금지＞이데일리 관련뉴스해당 언론사에서 선정하며 언론사 페이지(아웃링크)로 이동해 볼 수 있습니다.구조조정 없이 지원만…또 혈세로 부실기업 생명연장 우려요즘 어떻게 지내나 질문에 안희정 제가 무슨 할 말이 있겠나\'연락 두절\' 마이크로닷, 뉴질랜드 체류 중?… 부모 적색수배이재명, 증거 공개=독? ""차라리 혜경궁 김씨한테 호소하길"" 누리꾼 반격김신조 지나간 우이령길…41년만에 열리나좋아요0훈훈해요0슬퍼요0화나요0후속기사 원해요0기사제공 :']"
