,회사명,날짜,언론사,기사제목,링크,본문
9,삼성전자, 2018-07-0511:00,연합뉴스 ,"삼성전자, 페루 쇼핑몰에 '중남미 최대' LED사이니지 설치",https://finance.naver.com/news/news_read.nhn?article_id=0010191850&office_id=001&mode=search&query=삼성전자&page=11,"['       삼성전자, 페루 쇼핑몰에 \'중남미 최대\' LED사이니지 설치      기사입력2018-07-05 11:00기사원문좋아요훈훈해요좋아요 평가하기공감좋아요0훈훈해요0슬퍼요0화나요0후속기사 원해요0댓글삼성전자, 페루 쇼핑몰에 \'중남미 최대\' LED사이니지 설치(서울=연합뉴스) 삼성전자가 페루 리마의 프리미엄 쇼핑몰 \'플라자 노르떼\'에 고화질 LED 사이니지 옥외 전광판을 설치했다고 5일 전했다.    경차 85대를 동시 주차할 수 있는 넓이인 가로 63ｍ, 세로 7.7ｍ 크기로, 중남미에서 가장 큰 LED 사이니지다.     페루 시민들이 삼성전자의 초대형 LED 사이니지를 통해 야외에서도 선명한 화질로 축구 경기를 시청하고 있다.  [삼성전자 제공=연합뉴스]    photo@yna.co.kr리마 도심 \'플라자 노르떼\'에 가로 63ｍ·세로 7.7ｍ 옥외 전광판(서울=연합뉴스) 이승관 기자 = 삼성전자는 페루 리마의 프리미엄 쇼핑몰 \'플라자 노르떼\'에 고화질 LED 사이니지 옥외 전광판을 설치했다고 5일 밝혔다.    경차 85대를 동시 주차할 수 있는 넓이인 가로 63ｍ, 세로 7.7ｍ 크기로, 중남미에서 가장 큰 LED 사이니지다.     최대 7천700니트의 밝기를 구현해 야외에서도 화질이 선명하고, \'IP65\' 등급의 방수·방진 규격을 획득해 눈비·햇볕에 지속적으로 노출되거나 지진이 발생해도 문제가 없다고 회사 측은 설명했다.    이 사이니지에는 상업용 광고뿐 아니라 스포츠 경기, 뉴스 등 다양한 콘텐츠를 담을 예정이어서 영국 런던 피커딜리, 미국 뉴욕 타임스스퀘어의 전광판과 같이 중남미의 랜드마크로 주목받을 것으로 보인다.    삼성전자 관계자는 ""플라자 노르떼는 월 400만명이 방문하는 페루 최대의 쇼핑몰 가운데 하나""라면서 ""이번 전광판 수주를 계기로 중남미 LED 사이니지 시장에서 입지를 확대할 것""이라고 말했다.    humane@yna.co.kr▶2018 러시아 월드컵의 모든 것▶뉴스가 보여요 - 연합뉴스 유튜브\xa0\xa0▶기사제보 및 문의연합뉴스 관련뉴스해당 언론사에서 선정하며 언론사 페이지(아웃링크)로 이동해 볼 수 있습니다.\xa0하석주 ""차범근 피해 20년간 도망다녀"" 눈물로 사과\xa0의붓딸 6년간 성폭행해 임신시킨 계부에 징역 20년\xa0\'상금 1억\' 2018 미스코리아 진 23세 김수민은 누구?\xa0말거는 정신병력자 지팡이로 \'툭\' 친 치매 노인 봉변\xa0훔쳐보려 창문 여는데 방안으로 넘어간 손…죄목은?좋아요0훈훈해요0슬퍼요0화나요0후속기사 원해요0기사제공 :']"
10,삼성전자, 2018-07-0511:00,머니S ,"삼성전자, 페루에 중남미 최대 LED 사이니지 설치",https://finance.naver.com/news/news_read.nhn?article_id=0000327882&office_id=417&mode=search&query=삼성전자&page=11,"['       삼성전자, 페루에 중남미 최대 LED 사이니지 설치      기사입력2018-07-05 11:00기사원문좋아요훈훈해요좋아요 평가하기공감좋아요0훈훈해요0슬퍼요0화나요0후속기사 원해요0댓글/사진=삼성전자삼성전자는 4일(현지시간) 페루 리마에 위치한 프리미엄 쇼핑몰 플라자 노르떼에 중남미 최대 크기의 고화질 LED 사이니지 옥외 전광판을 설치했다고 밝혔다.이 사이니지는 가로 63m, 세로 7.7m로 경차 85대를 동시 주차할 수 있는 크기를 자랑하며 최대 7700니트 밝기를 구현해 야외에서도 선명한 화질을 제공한다.또한 IP65등급의 방수·방진 규격을 획득해 눈비가 오거나 뜨거운 햇볕에 지속적으로 노출되는 환경에서도 사용할 수 있고 지진 발생이 잦은 특성을 고려해 내구성을 대폭 강화했다.플라자 노르떼는 월 4백만명이 방문하는 페루 최대 쇼핑몰 중 하나로 주변에 버스터미널과 음식점, 패션 상가 등이 밀집해 있는 번화가에 위치한다.이 곳에 설치한 LED사이니지는 런던 피카딜리·뉴욕 타임스퀘어 등의 전광판과 같이 중남미의 랜드마크로 자리매김 할 것으로 기대된다.이 사이니지는 상업용 광고뿐 아니라 스포츠 경기·뉴스 등 다양한 콘텐츠를 담아 방문객들에게 유용한 정보를 제공하는 다목적 스크린으로서의 역할을 할 예정이다.김석기 삼성전자 영상디스플레이사업부 부사장은 “삼성전자가 LED사이니지 분야에서 차별화된 기술력을 바탕으로 전 세계 시장에서 인정받고 있다”며 “이번 수주를 계기로 중남미 LED사이니지 시장을 지속 확대해 나가겠다”고 말했다.이한듬 기자 ▶ 머니S 페이스북 ▶ 최신 웹툰이 매일 공짜 머니S 관련뉴스해당 언론사에서 선정하며 언론사 페이지(아웃링크)로 이동해 볼 수 있습니다.김이나, 저작권 등록곡만 420건… 매달 받는 돈 얼마?폴킴, 협박 폭로 ""억울하고 분해""… 무슨 일?마이크로닷♥홍수현, 열애 시작한 예능프로 장면은?\'임신\' 한채아 포착, 차범근·박지성 등과 즐거운 한때조재현 ""성폭행 아닌 외도였다""… 여배우 A씨 \'발끈\'좋아요0훈훈해요0슬퍼요0화나요0후속기사 원해요0기사제공 :']"
11,삼성전자, 2018-07-0511:00,아시아경제 ,삼성전자·현대차 등 최대 규모 경제사절단 인도 방문,https://finance.naver.com/news/news_read.nhn?article_id=0004271442&office_id=277&mode=search&query=삼성전자&page=11,"['       삼성전자·현대차 등 최대 규모 경제사절단 인도 방문      기사입력2018-07-05 11:00기사원문좋아요훈훈해요좋아요 평가하기공감좋아요0훈훈해요0슬퍼요0화나요0후속기사 원해요0댓글 [아시아경제 안하늘 기자] 문재인 대통령의 인도 방문길에 삼성전자, 현대차 등 100여명의 \'경제 사절단\'이 동행한다대한상공회의소는 5일 문재인 대통령의 인도 방문에 동행하는 경제사절단 명단을 발표했다.박용만 대한상의 회장을 비롯해 윤부근 삼성전자 부회장, 정진행 현대차 사장, 지동섭 SK루브리컨츠 대표이사, 안승권 LG전자 사장, 이재혁 롯데그룹 식품BU 부회장, 김형국 GS칼텍스 사장, 이성수 한화디펜스 사장, 동현수 두산 부회장, 박근태 CJ대한통운 대표이사, 김진현 CJ제일제당 부사장, 명노현 LS전선 대표이사, 김도진 IBK기업은행 은행장, 윤종규 KB금융지주 회장, 위성호 신한은행 은행장, 손태승 우리은행 은행장, 김병원 농협중앙회 회장, 박진회 한국씨티은행 은행장 등 총 100여개사가 참석한다.기업규모별로는 대기업 14개사, 중견기업 12개사, 중소기업 55개사, 기관·단체 23개사로 구성, 실질적인 인도 사업을 담당하는 전문경영인들 중심으로 사절단이 꾸려져 구체적인 성과가 기대된다.대한상의는 경제사절단 선정 주관기관으로서 공정한 참가 기업인 선정을 위해 주요 협회 대표, 연구기관, 전문가 등으로 구성된 심사위원회를 지난달 29일 개최했다.안하늘 기자 ahn708@asiae.co.kr▶ 네이버 채널 설정하고, 룰렛 당첨 확인 GO ▶ 양낙규의 \'군사이야기\' ▶ 재미와 신기 \'과학을 읽다아시아경제 관련뉴스해당 언론사에서 선정하며 언론사 페이지(아웃링크)로 이동해 볼 수 있습니다.진중권 ""김부선 오랜 만남 했다면서…"" 밀회설 언급검찰, 하루 만에 돌연 안희정 관련 \'사과문\' 발표김지은 앞에서…안희정, 흔들리는 모습 노출이틀 내내 빈소 지킨 유재석…지석진 ""너무 고맙다""""김광석 타살 99%"" 이상호, 경찰 심문서… \'반전\'좋아요0훈훈해요0슬퍼요0화나요0후속기사 원해요0기사제공 :']"
12,삼성전자, 2018-07-0511:00,뉴시스 ,"삼성전자, 페루에 중남미 최대 LED 사이니지 설치",https://finance.naver.com/news/news_read.nhn?article_id=0008689934&office_id=003&mode=search&query=삼성전자&page=11,"['       삼성전자, 페루에 중남미 최대 LED 사이니지 설치      기사입력2018-07-05 11:00기사원문좋아요훈훈해요좋아요 평가하기공감좋아요0훈훈해요0슬퍼요0화나요0후속기사 원해요0댓글월 400만명 방문하는 리마 쇼핑몰 플라자 노르떼에 설치런던 피카딜리·뉴욕 타임스퀘어 등과 같이 랜드마크 자리매김 기대【서울=뉴시스】삼성전자가  4일(현지시간) 페루 리마에 위치한 프리미엄 쇼핑몰 플라자 노르떼(Plaza Norte)에 중남미 최대 크기의 고화질 LED 사이니지 옥외 전광판을 설치했다고 밝혔다. 이 사이니지는 가로 63미터, 세로 7.7미터로 경차 85대를 동시 주차할 수 있는 크기이며 최대 7700니트 밝기를 구현해 야외에서도 선명한 화질을 제공한다. 2018.07.05 (사진 = 삼성전자 제공) photo@newsis.com【서울=뉴시스】이종희 기자 = 삼성전자는 4일(현지시간) 페루 리마에 위치한 프리미엄 쇼핑몰 플라자 노르떼(Plaza Norte)에 중남미 최대 크기의 고화질 LED 사이니지 옥외 전광판을 설치했다고 5일 밝혔다. 삼성전자에 따르면 이 사이니지는 가로 63미터, 세로 7.7미터로 경차 85대를 동시 주차할 수 있는 크기를 자랑하며 최대 7700니트 밝기를 구현해 야외에서도 선명한 화질을 제공한다.또한, IP65등급의 방수·방진 규격을 획득해 눈비가 오거나 뜨거운 햇볕에 지속적으로 노출되는 환경에서도 사용할 수 있고 지진 발생이 잦은 특성을 고려해 내구성을 대폭 강화했다.플라자 노르떼는 월 4백만명이 방문하는 페루 최대 쇼핑몰 중 하나로 주변에 버스터미널과 음식점, 패션 상가 등이밀집해 있는 번화가에 위치한다.삼성전자는 이 곳에 설치한 LED사이니지가 런던 피카딜리·뉴욕 타임스퀘어 등의 전광판과 같이 중남미의 랜드마크로 자리매김 할 것으로 기대하고 있다.아울러, 이 사이니지는 상업용 광고뿐 아니라 스포츠 경기·뉴스 등 다양한 콘텐츠를 담아 방문객들에게 유용한 정보를 제공하는 다목적 스크린으로서의 역할을 할 예정이다.김석기 삼성전자 영상디스플레이사업부 부사장은 ""삼성전자가 LED사이니지 분야에서 차별화된 기술력을 바탕으로 전 세계 시장에서 인정받고 있다""며 ""이번 수주를 계기로 중남미 LED사이니지 시장을 지속 확대해 나가겠다""고 말했다.2papers@newsis.com▶ 뉴시스 빅데이터 MSI 주가시세표 바로가기 ▶ 뉴시스 SNS [페이스북] [트위터]뉴시스 관련뉴스해당 언론사에서 선정하며 언론사 페이지(아웃링크)로 이동해 볼 수 있습니다.\'37년 가정폭력 남편 살해\' 60대, 징역 4년 확정92살 모친, ""요양원 보내겠다""는 72살 아들 살해뒷좌석에 태운 손자 깜빡…차에 방치된 3살 아이 열사병 사망""왜 이렇게 가슴이 작아?""…여성 근로자 성추행한 현장소장강남 노린 \'보유세\', 자산 불평등 해소하고 집값 잡을까좋아요0훈훈해요0슬퍼요0화나요0후속기사 원해요0기사제공 :']"
13,삼성전자, 2018-07-0511:00,뉴시스 ,"대한상의, 인도 경제사절단 참가 기업 발표...삼성·현대 등 100여개사",https://finance.naver.com/news/news_read.nhn?article_id=0008689939&office_id=003&mode=search&query=삼성전자&page=11,"['       대한상의, 인도 경제사절단 참가 기업 발표...삼성·현대 등 100여개사      기사입력2018-07-05 11:00기사원문좋아요훈훈해요좋아요 평가하기공감좋아요0훈훈해요0슬퍼요0화나요0후속기사 원해요0댓글대기업 14개사, 중견기업 12개사, 중소기업 55개사, 기관·단체 23개사 등 100여개사로 구성박용만 대한상의 회장, 윤부근 삼성전자 부회장, 정진행 현대차 사장 등 참석【서울=뉴시스】이종희 기자 = 대한상공회의소는 문재인 대통령의 인도 방문에 동행하는 경제사절단 명단을 5일 발표했다.참가 기업인은 박용만 대한상의 회장을 비롯해 윤부근 삼성전자 부회장, 정진행 현대차 사장, 지동섭 SK루브리컨츠 대표이사, 안승권 LG전자 사장, 이재혁 롯데그룹 식품BU 부회장, 김형국 GS칼텍스 사장, 이성수 한화디펜스 사장, 동현수 두산 부회장, 박근태 CJ대한통운 대표이사, 김진현 CJ제일제당 부사장, 명노현 LS전선 대표이사, 김도진 IBK기업은행 은행장, 윤종규 KB금융지주 회장, 위성호 신한은행 은행장, 손태승 우리은행 은행장, 김병원 농협중앙회 회장, 박진회 한국씨티은행 은행장 등 총 100여개사가 참석한다.기업규모별로는 대기업 14개사, 중견기업 12개사, 중소기업 55개사, 기관·단체 23개사로 구성해 실질적인 인도 사업을 담당하는 전문경영인들 중심으로 사절단이 꾸려졌다. 앞서 대한상의는 경제사절단 선정 주관기관으로서 공정한 참가 기업인 선정을 위해 주요 협회 대표, 연구기관, 전문가 등으로 구성된 심사위원회를 지난달 29일 개최했다.2papers@newsis.com▶ 뉴시스 빅데이터 MSI 주가시세표 바로가기 ▶ 뉴시스 SNS [페이스북] [트위터]뉴시스 관련뉴스해당 언론사에서 선정하며 언론사 페이지(아웃링크)로 이동해 볼 수 있습니다.\'37년 가정폭력 남편 살해\' 60대, 징역 4년 확정92살 모친, ""요양원 보내겠다""는 72살 아들 살해뒷좌석에 태운 손자 깜빡…차에 방치된 3살 아이 열사병 사망""왜 이렇게 가슴이 작아?""…여성 근로자 성추행한 현장소장강남 노린 \'보유세\', 자산 불평등 해소하고 집값 잡을까좋아요0훈훈해요0슬퍼요0화나요0후속기사 원해요0기사제공 :']"
14,삼성전자, 2018-07-0511:00,아시아경제 ,"삼성, 페루에 중남미 최대 LED 사이니지 설치",https://finance.naver.com/news/news_read.nhn?article_id=0004271439&office_id=277&mode=search&query=삼성전자&page=11,"['       삼성, 페루에 중남미 최대 LED 사이니지 설치      기사입력2018-07-05 11:00기사원문좋아요훈훈해요좋아요 평가하기공감좋아요0훈훈해요0슬퍼요0화나요0후속기사 원해요0댓글삼성전자가  4일(현지시간) 페루 리마에 위치한 프리미엄 쇼핑몰 플라자 노르떼(Plaza Norte)에 중남미 최대 크기의 고화질 LED 사이니지 옥외 전광판을 설치했다.  이 사이니지는 가로 63미터, 세로 7.7미터로 경차 85대를 동시 주차할 수 있는 크기이며 최대 7700니트 밝기를 구현해 야외에서도 선명한 화질을 제공한다. / 사진제공=삼성전자[아시아경제 안하늘 기자] 삼성전자는 4일(현지시간) 페루 리마에 위치한 프리미엄 쇼핑몰 플라자 노르떼(Plaza Norte)에중남미 최대 크기의 고화질 LED 사이니지 옥외 전광판을 설치했다.이 사이니지는 가로 63미터, 세로 7.7미터로 경차 85대를 동시 주차할 수 있는 크기다. 최대 7700니트 밝기를 구현해 야외에서도 선명한 화질을 제공한다. 또 IP65등급의 방수·방진 규격을 획득해 눈비가 오거나 뜨거운 햇볕에 지속적으로 노출되는 환경에서도 사용할 수 있고 지진 발생이 잦은 특성을 고려해 내구성을 대폭 강화했다.플라자 노르떼는 월 400만명이 방문하는 페루 최대 쇼핑몰 중 하나로 주변에 버스터미널과 음식점, 패션 상가 등이 밀집해 있는 번화가에 있다. 삼성전자는 이 곳에 설치한 LED사이니지는 런던 피카딜리· 뉴욕 타임스퀘어 등의 전광판과 같이 중남미의 랜드마크로 자리매김 할 것으로 기대하고 있다. 또 이 사이니지는 상업용 광고뿐 아니라 스포츠 경기·뉴스 등 다양한 콘텐츠를 담아 방문객들에게 유용한 정보를 제공하는 다목적 스크린으로서의 역할을 할 예정이다.김석기 삼성전자 영상디스플레이사업부 부사장은 “삼성전자가 LED사이니지 분야에서 차별화된 기술력을 바탕으로 전 세계 시장에서 인정받고 있다”며 “이번 수주를 계기로 중남미 LED사이니지 시장을 지속 확대해 나가겠다”고 말했다.안하늘 기자 ahn708@asiae.co.kr▶ 네이버 채널 설정하고, 룰렛 당첨 확인 GO ▶ 양낙규의 \'군사이야기\' ▶ 재미와 신기 \'과학을 읽다아시아경제 관련뉴스해당 언론사에서 선정하며 언론사 페이지(아웃링크)로 이동해 볼 수 있습니다.진중권 ""김부선 오랜 만남 했다면서…"" 밀회설 언급검찰, 하루 만에 돌연 안희정 관련 \'사과문\' 발표김지은 앞에서…안희정, 흔들리는 모습 노출이틀 내내 빈소 지킨 유재석…지석진 ""너무 고맙다""""김광석 타살 99%"" 이상호, 경찰 심문서… \'반전\'좋아요0훈훈해요0슬퍼요0화나요0후속기사 원해요0기사제공 :']"
15,삼성전자, 2018-07-0511:00,뉴스1 ,"삼성전자, 페루에 '가로 63m' 대형 LED 사이니지 설치",https://finance.naver.com/news/news_read.nhn?article_id=0003466278&office_id=421&mode=search&query=삼성전자&page=11,"['       삼성전자, 페루에 \'가로 63m\' 대형 LED 사이니지 설치      기사입력2018-07-05 11:00기사원문좋아요훈훈해요좋아요 평가하기공감좋아요0훈훈해요0슬퍼요0화나요0후속기사 원해요0댓글삼성전자는 4일(현지시간) 페루 리마에 위치한 프리미엄 쇼핑몰 \'플라자 노르떼(Plaza Norte)\'에 설치한 중남미 최대 크기의 고화질 LED(발광다이오드) 사이니지 옥외 전광판의 모습.(삼성전자 제공) 2018.7.5/뉴스1 © News1(서울=뉴스1) 주성호 기자 = 삼성전자는 4일(현지시간) 페루 리마에 위치한 프리미엄 쇼핑몰 \'플라자 노르떼(Plaza Norte)\'에 중남미 최대 크기의 고화질 LED(발광다이오드) 사이니지 옥외 전광판을 설치했다고 밝혔다. 사이즈는 가로 63m, 세로 7.7m로 경차 75대를 동시에 주차할 수 있는 크기다. 최대 7700니트 밝기를 구현해 야외에서도 밝고 선명한 화질을 보여준다. 또 IP65 등급의 방수·방진 규격을 획득해 눈비가 오거나 뜨거운 햇볕에 지속적으로 노출되는 환경에서도 사용할 수 있다. 지진 발생이 잦은 특성을 고려해 내구성도 대폭 강화했다. 플라자 노르떼는 월 400만명이 방문하는 페루 최대 쇼핑몰 중 하나다. 주변에 버스터미널, 음식점, 패션상가 등이 밀집한 번화가에 있다. 상업용 광고뿐 아니라 스포츠 경기, 각종 뉴스 등의 콘텐츠를 담아 방문객들에게 유용한 정보를 알리는 다목적 스크린의 역할을 할 예정이다. 김석기 영상디스플레이사업부 부사장은 ""삼성전자가 LED 사이니지 분야에서 차별화된 기술력을 바탕으로 전 세계 시장에서 인정받고 있다""며 ""이번 수주를 계기로 중남미 LED사이니지 시장을 지속 확대해 나갈 것""이라고 말했다.sho218@news1.kr▶ [뉴스1] 채널설정하기 ▶ 제보하기▶ 2018 러시아 월드컵 기사보기[© 뉴스1코리아(news1.kr), 무단 전재 및 재배포 금지]뉴스1 관련뉴스해당 언론사에서 선정하며 언론사 페이지(아웃링크)로 이동해 볼 수 있습니다.""서울시민 월 143만원 썼다""…소비 가장 높은 동은?국민 절반 \'예멘 난민 수용\' 반대…찬성은 37.4%\'깜빡\' 차에 4시간 방치한 외손자 열사병 숨져""이민자 아이 석방""…자유의 여신상 오른 여성숨겨둔 공용열쇠 찾아 경로당 14차례 턴 30대좋아요0훈훈해요0슬퍼요0화나요0후속기사 원해요0기사제공 :']"
16,삼성전자, 2018-07-0510:59,뉴시스 ,"현대엔지니어링, '힐스테이트 지제역’ 견본주택 개관",https://finance.naver.com/news/news_read.nhn?article_id=0008689931&office_id=003&mode=search&query=삼성전자&page=11,"['       현대엔지니어링, \'힐스테이트 지제역’ 견본주택 개관      기사입력2018-07-05 10:59기사원문좋아요훈훈해요좋아요 평가하기공감좋아요0훈훈해요0슬퍼요0화나요0후속기사 원해요0댓글현대엔지니어링이 6일 경기 평택시에서 개관하는 ‘힐스테이트 지제역’ 견본주택 투시도(자료제공=현대엔지니어링)【서울=뉴시스】박영환 기자 = 현대엔지니어링이 6일 경기 평택시에서 ‘힐스테이트 지제역’ 견본주택을 개관하고 아파트 분양에 나선다.‘힐스테이트 지제역’은 지하 1층 ~ 지상 27층, 16개 동 규모로 총 1519세대다. 전용면적 기준으로 ▲59㎡A 206세대 ▲59㎡B 214세대 ▲74㎡ 479세대 ▲84㎡A 312세대 ▲84㎡B 308세대로 구성돼 있다. 이 가운데 ▲59㎡A 18세대 ▲59㎡B 24세대 ▲74㎡ 77세대 ▲84㎡A 57세대 ▲84㎡B 59세대 등 235세대가 일반에 공급된다‘힐스테이트 지제역’은 역세권 단지다. 단지는 지제역과 가장 가까운 영신도시개발구역 1블록에 위치했다.  지제역은 SRT를 이용하면 강남(수서역)까지 20분대에 갈 수 있다. 수원발 KTX가  2021년 개통되면 지제역은 수도권에서 유일하게 SRT와 KTX가 동시에 정차한다. 평택시도 올해부터 지제역을 광역 복합환승센터로 개발하는 사업 구상에 착수할 예정이라고 회사측은 설명했다. 단지는 경부고속도로, 평택제천고속도로, 1번국도, 45번국도 등과 가깝다. 지난해부터는 평택 시내를 오가는 간선급행버스(BRT)와 지제역과 강남역을 오가는 M버스(광역급행버스)도 운행 중이다. 또 반도체 단일 공정라인으로 세계 최대 규모인 삼성전자 평택 캠퍼스가 차량으로 2~3분 거리다. 고덕국제화첨단 산업단지가 위치해 있다. 각 세대는  홈 네트워크 시스템(Hi-oT)을 탑재해 외부에서도 여러 기기를 제어할 수 있다.  지하주차장에는 사각지대가 거의 없는 전방위 카메라를 설치했다. 최근 사용자가 빠르게 늘어나는 전기차 충전설비도 설치된다.‘힐스테이트 지제역’은 12일 특별공급 청약을 시작으로 13일 1순위, 16일  2순위 청약 신청을 받는다. 당첨자는 20일 발표하고 8월 1~3일까지 사흘간 계약이 진행될 예정이다. 단지가 들어서는 평택시는 청약 통장 가입 후 1년이 지나면 세대주, 주택소유 여부 등에 관계없이 1순위 청약이 가능하다 계약 후 6개월이면 전매도 할 수 있다.견본주택은 경부고속도로 안성IC 인근(경기도 평택시 용이동 493-3 )에 위치해 있다.yunghp@newsis.com▶ 뉴시스 빅데이터 MSI 주가시세표 바로가기 ▶ 뉴시스 SNS [페이스북] [트위터]뉴시스 관련뉴스해당 언론사에서 선정하며 언론사 페이지(아웃링크)로 이동해 볼 수 있습니다.\'37년 가정폭력 남편 살해\' 60대, 징역 4년 확정92살 모친, ""요양원 보내겠다""는 72살 아들 살해뒷좌석에 태운 손자 깜빡…차에 방치된 3살 아이 열사병 사망""왜 이렇게 가슴이 작아?""…여성 근로자 성추행한 현장소장강남 노린 \'보유세\', 자산 불평등 해소하고 집값 잡을까좋아요0훈훈해요0슬퍼요0화나요0후속기사 원해요0기사제공 :']"
