,회사명,날짜,언론사,기사제목,링크,본문
5,삼성전자, 2018-03-1411:00,경향신문 ,“대미 상품 무역수지 흑자 지난해 23.2% 급감”…내일 한·미 FTA 3차 개정...,https://finance.naver.com/news/news_read.nhn?article_id=0002857433&office_id=032&mode=search&query=삼성전자&page=5,"['       “대미 상품 무역수지 흑자 지난해 23.2% 급감”…내일 한·미 FTA 3차 개정협상      기사입력2018-03-14 11:00기사원문좋아요훈훈해요좋아요 평가하기공감좋아요0훈훈해요0슬퍼요0화나요0후속기사 원해요0댓글 지난해 한국의 대미 상품 무역수지 흑자 규모가 전년 대비 23.2% 급감했다. 자동차와 자동차 부품, 무선통신기기 수출이 감소하고, 반도체제조용장비와 액화석유가스(LPG), 육류 수입이 증가한 탓이다.도널드 트럼프 미국 대통령이 양국간 무역불균형 문제를 제기해 한·미 자유무역협정(FTA) 개정협상이 진행 중인 상황에서 최근의 교역 흐름이 한국 측에 방어논리로 활용될지 주목된다. 한·미 FTA 3차 개정협상은 15일 유명희 산업통상자원부 통상교섭실장과 미 무역대표부(USTR) 마이클 비먼 대표보가 각각 수석대표로 참석한 가운데 미국 워싱턴D.C.에서 열린다.■무역수지 흑자 미국 비중 역대 최저치산업통상자원부는 14일 발표한 ‘한·미 FTA 발효 6년차 교역 동향’을 통해 지난해 상품 분야의 수출과 수입이 각각 686억달러와 507억달러를 기록해 무역수지 흑자 규모가 전년 대비 23.2% 감소한 179억달러로 집계됐다고 밝혔다.2012년 3월 한·미 FTA 발효 첫 해 152억달러 흑자에 이어 2015년 288억달러 흑자 등 4년간 규모가 증가하다가 2016년 들어 처음 감소세로 전환한 뒤 2년 연속 흑자 규모가 줄었다. 특히 한국의 전체 무역수지 흑자 중 미국 비중이 한때 50%를 상회했으나 지난해는 20% 이하로 하락하면서 최근 10년 사이 최저치를 기록했다.한국의 미국시장 점유율도 지난해 3.0%를 기록해 전년 대비 0.2%포인트 감소했다. 반면 미국의 한국시장 점유율은 한·미 FTA 발효 후 지속적으로 상승해 2위인 일본과 시장점유율 격차가 줄었다. 미국 통계를 기준으로 보더라도 한국이 미국의 전체 무역적자에서 차지하는 비중이 2016년 3.8%에서 지난해 2.9%로 떨어졌다. 국가별 순위도 8위에서 10위로 하락했다.■자동차 수출 감소…반도체장비 수입 증가대미 수출은 686억달러로 전년 대비 3.2% 증가했다. 그러나 수출 상위 3개 품목인 자동차는(-6.4%)와 무선통신기기(-17.4%), 자동차부품(-16.1%)의 수출이 큰 폭으로 줄었다. 트럼프 대통령이 무역불균형의 대표 사례로 언급한 자동차와 자동차 부품의 경우 미국시장의 성장 둔화와 국내 브랜드의 판매 부진 여파가 컸다. 무선통신기기는 해외 생산비중 확대와 미국 내 경쟁심화가 수출 감소 요인으로 작용했다.대미 수입은 507억달러로 전년 대비 17.4% 증가했다. 반도체 제조용장비(119.3%)와 반도체(7.8%), LPG(55.9%), 육류(20.4%)를 중심으로 수입이 늘어났기 때문이다. 반도체 제조용장비와 반도체의 경우 삼성전자와 SK하이닉스의 대규모 국내투자에 따른 장비 도입으로 수입이 증가한 측면이 있다.LPG는 미국 셰일가스 생산 증가로 미국산 LPG 수입이 늘어난 게 주효했다. 육류는 지난해 한국 쇠고기 수입시장에서 미국산이 호주산을 제치고 1위로 부상했으며, 돼지고기 시장에서는 미국산이 최근 10년 간 1위를 유지하고 있다.■서비스 수지 적자…미국 직접투자 증가지난해 대미 서비스 수지는 139억달러 적자를 기록해 전년과 비슷한 규모를 유지했다. 서비스 수지 적자폭은 FTA 발효 후(2012~2016년) 평균 14.1% 증가했다. 이는 지식재산권사용료 지급 증가가 주된 요인으로 분석됐다.또 지난해 한국의 대미 투자는 152억9000만달러로 전년 대비 18.5% 증가했고, 미국의 대한 투자는 12억1000만달러로 전년 대비 9.9% 감소했다. 산업부 당국자는 “지난해 수출보다 수입이 큰 폭으로 증가해 무역수지 흑자가 감소했다”면서 “한·미 FTA효과로 인한 수입 증가와 미국의 수입규제로 인한 수출 부진이 당분간 지속될 것 같다”고 말했다.▶ [경향비즈 바로가기], 경향비즈 SNS [페이스북]  ▶ [인기 무료만화 보기][©경향신문(www.khan.co.kr), 무단전재 및 재배포 금지]경향신문 관련뉴스해당 언론사에서 선정하며 언론사 페이지(아웃링크)로 이동해 볼 수 있습니다.이명박, \'6문장 대국민 입장문\'에 밑줄 친 2곳은···홍준표, MB출석에 ""노무현처럼 개인비리 혐의···꼭 들춰내야 했을까""""기사 난다면 업보로 생각"" 조재현, 이번엔 기자 성추행 논란채용비리 의혹 은행, 어디 \'하나\'뿐일까변호인 살 돈도 없다는 MB, \'전 재산 사회환원\' 어떻게 됐나 보니좋아요0훈훈해요0슬퍼요0화나요0후속기사 원해요0기사제공 :']"
6,삼성전자, 2018-03-1411:00,뉴스1 ,'음성인식돼 사용이 편한 삼성 플렉스워시 세탁기',https://finance.naver.com/news/news_read.nhn?article_id=0003256650&office_id=421&mode=search&query=삼성전자&page=5,"['       \'음성인식돼 사용이 편한 삼성 플렉스워시 세탁기\'      기사입력2018-03-14 11:00기사원문좋아요훈훈해요좋아요 평가하기공감좋아요0훈훈해요0슬퍼요0화나요0후속기사 원해요0댓글삼성전자가 \'2018 평창 동계 패럴림픽대회\' 선수들의 다양한 세탁 패턴을 고려해 인공지능(AI) 기반 음성인식 기술을 탑재한 \'플렉스워시\' 세탁기와 건조기 등 총 150여대를 공급했다고 14일 밝혔다. 특히 음성인식으로 작동되는 플렉스워시 세탁기는 시각장애를 가진 사용자도 편리하게 세탁할 수 있다. 이번 동계패럴림픽대회에 지원된 \'플렉스워시\'는 기존 제품에 \'빅스비\'를 탑재해 음성만으로 복잡한 기능을 작동시킬 수 있다. 크로스컨트리 국가대표 이도연(오른쪽)이 \'플렉스워시\' 세탁기의 사용법을 배우고 있다. (삼성전자 제공) 2018.3.14/뉴스1photo@news1.kr▶ [뉴스1] 채널설정하기 ▶ 제보하기▶ [페이스북] 바로가기![© 뉴스1코리아(news1.kr), 무단 전재 및 재배포 금지]뉴스1 관련뉴스해당 언론사에서 선정하며 언론사 페이지(아웃링크)로 이동해 볼 수 있습니다.\'스위스 유학파\' 김정은, 통역없이 트럼프와 1대1 대화?홍준표 ""文정부 복수위해 MB포토라인에…부메랑될것""""아내에 알리겠다"" 내연녀 목 졸라 살해""사기도박 대가 안줘"" 해상콘도서 살인 미수""악귀 나가라""…목사·친모가 5시간 때려 사망좋아요0훈훈해요0슬퍼요0화나요0후속기사 원해요0기사제공 :']"
7,삼성전자, 2018-03-1411:00,한국경제TV ,[이 시각 코스피] 코스피 현재 2476.89p 하락세 지속,https://finance.naver.com/news/news_read.nhn?article_id=0000610997&office_id=215&mode=search&query=삼성전자&page=5,"['       [이 시각 코스피] 코스피 현재 2476.89p 하락세 지속      기사입력2018-03-14 11:00기사원문좋아요훈훈해요좋아요 평가하기공감좋아요0훈훈해요0슬퍼요0화나요0후속기사 원해요0댓글[한국경제TV 라이온봇 기자][코스피 장중 시황]3월 14일 11시 0분 코스피는 전일 대비 17.6p(-0.71%) 하락한 2476.89p를 기록하고 있다.규모별로는 대형주(-0.71%), 중형주(-0.85%), 소형주(-0.22%) 모두 약세를 나타내고 있다.[업종동향][그림 1] 업종별 상위 TOP5 (단위 : %)[그림 2] 업종별 하위 TOP5 (단위 : %)업종별로는 하락이 우세하다.운수창고(0.77%), 의료정밀(0.34%), 기계(0.23%), 운수장비(0%) 등은 상승세를 나타냈다.  반면, 보험(-0.17%), 종이,목재(-0.22%), 전기,전자(-0.23%), 화약(-0.41%), 섬유의복(-0.45%), 제조업(-0.51%), 음식료품(-0.74%), 금융업(-0.82%), 전기가스업(-0.88%), 통신업(-0.99%), 비금속광물(-1.09%), 서비스업(-1.2%), 증권(-1.25%), 은행(-1.51%), 유통업(-1.66%), 의약품(-1.72%), 건설업(-1.88%), 철강,금속(-2.2%) 등은 하락세를 나타냈다. [시가총액 상위 종목 동향]시가총액 상위 10개 기업은 하락이 우세하다.""대장주"" 삼성전자는 전일(2,583,000원) 대비 13,000원(-0.5%) 내린 2,570,000원에 거래되고 있다.현대차(0.98%), LG화학(0.98%), SK하이닉스(0.33%) 등은 상승세를 나타냈다. 반면에, 삼성물산(-1.12%), KB금융(-1.13%), NAVER(-1.83%), 셀트리온(-2.09%), 삼성바이오로직스(-2.1%), POSCO(-3.39%) 등은 약세를 보이고 있다. 라이온봇 기자 -한국경제TV※ 본 기사는 한국경제TV와 \'거장들의 투자공식이\'자체 개발한 \'라이온봇 기자\'가 실시간으로 작성한 기사입니다.라이온봇기자 ⓒ 한국경제TV, 무단 전재 및 재배포 금지한국경제TV 관련뉴스해당 언론사에서 선정하며 언론사 페이지(아웃링크)로 이동해 볼 수 있습니다.김종국 집 공개…못 말리는 \'블랙\' 사랑, \'검종국\' 등극배우 김혜선, 20살 때 \'삭발\'하고 다녀…이유는?정재성 사망, ""아내가 시신 발견""기성용, 왼손 국기에 대한 경례…이유가?구하라 집 공개, 영&리치의 논현동 자수성가하우스 \'입이 쩍\'좋아요0훈훈해요0슬퍼요0화나요0후속기사 원해요0기사제공 :']"
8,삼성전자, 2018-03-1411:00,뉴스1 ,"삼성전자, 평창 패럴림픽 선수촌에 음성인식 세탁기·건조기 공급",https://finance.naver.com/news/news_read.nhn?article_id=0003256652&office_id=421&mode=search&query=삼성전자&page=5,"['       삼성전자, 평창 패럴림픽 선수촌에 음성인식 세탁기·건조기 공급      기사입력2018-03-14 11:00기사원문좋아요훈훈해요좋아요 평가하기공감좋아요0훈훈해요0슬퍼요0화나요0후속기사 원해요0댓글국제 패럴림픽 위원회(International Paralympic Committee, IPC) 운영진들(우측 두명)이 13일 평창 동계패럴림픽 선수촌에서 인공지능(AI) 기반 음성인식 기술로 접근성을 대폭 강화한 \'플렉스워시\' 세탁기를 체험해보고 있다.(삼성전자 제공)© News1(서울=뉴스1) 장은지 기자 = 삼성전자가 \'2018 평창 동계 패럴림픽대회\' 선수촌에 인공지능(AI) 기반 음성인식 기술을 탑재한 \'플렉스워시\' 세탁기와 건조기를 설치했다. 삼성전자는 선수들의 다양한 세탁 패턴을 고려해 애드워시 드럼세탁기, 플렉스워시 세탁기, 저온제습 건조기 등 총 150여대를 공급했다고 14일 밝혔다.특히 음성인식으로 작동되는 플렉스워시 세탁기는 시각장애를 가진 사용자도 편리하게 세탁할 수 있다. 이번 동계패럴림픽대회에 지원된 \'플렉스워시\'는 기존 제품에 \'빅스비\'를 탑재해 음성만으로 복잡한 기능을 작동시킬 수 있다. 삼성전자 생활가전사업부 정호진 상무는 ""접근성을 대폭 개선한 플렉스워시 등 삼성전자의 다양한 세탁기와 건조기가 \'평창 동계패럴럼픽대회\'에 참가하는 선수들의 생활과 경기에 조금이라도 보탬이 되길 바란다""고 말했다.한편 삼성전자는 \'2018 평창 동계패럴림픽대회\' 선수촌에 지원한 \'플렉스워시\' 신모델을 이달 말 국내에 출시할 계획이다.seeit@▶ [뉴스1] 채널설정하기 ▶ 제보하기▶ [페이스북] 바로가기![© 뉴스1코리아(news1.kr), 무단 전재 및 재배포 금지]뉴스1 관련뉴스해당 언론사에서 선정하며 언론사 페이지(아웃링크)로 이동해 볼 수 있습니다.\'스위스 유학파\' 김정은, 통역없이 트럼프와 1대1 대화?홍준표 ""文정부 복수위해 MB포토라인에…부메랑될것""""아내에 알리겠다"" 내연녀 목 졸라 살해""사기도박 대가 안줘"" 해상콘도서 살인 미수""악귀 나가라""…목사·친모가 5시간 때려 사망좋아요0훈훈해요0슬퍼요0화나요0후속기사 원해요0기사제공 :']"
9,삼성전자, 2018-03-1411:00,뉴스1 ,음성인식 ‘플렉스워시’ 세탁기 사용해요,https://finance.naver.com/news/news_read.nhn?article_id=0003256645&office_id=421&mode=search&query=삼성전자&page=5,"['       음성인식 ‘플렉스워시’ 세탁기 사용해요      기사입력2018-03-14 11:00기사원문좋아요훈훈해요좋아요 평가하기공감좋아요0훈훈해요0슬퍼요0화나요0후속기사 원해요0댓글삼성전자가 \'2018 평창 동계 패럴림픽대회\' 선수들의 다양한 세탁 패턴을 고려해 인공지능(AI) 기반 음성인식 기술을 탑재한 \'플렉스워시\' 세탁기와 건조기 등 총 150여대를 공급했다고 14일 밝혔다. 특히 음성인식으로 작동되는 플렉스워시 세탁기는 시각장애를 가진 사용자도 편리하게 세탁할 수 있다. 이번 동계패럴림픽대회에 지원된 \'플렉스워시\'는 기존 제품에 \'빅스비\'를 탑재해 음성만으로 복잡한 기능을 작동시킬 수 있다. 크로스컨트리 국가대표 이도연(오른쪽)이 \'플렉스워시\' 세탁기의 음성 명령어를 사용해보고 있다. (삼성전자 제공) 2018.3.14/뉴스1photo@news1.kr▶ [뉴스1] 채널설정하기 ▶ 제보하기▶ [페이스북] 바로가기![© 뉴스1코리아(news1.kr), 무단 전재 및 재배포 금지]뉴스1 관련뉴스해당 언론사에서 선정하며 언론사 페이지(아웃링크)로 이동해 볼 수 있습니다.\'스위스 유학파\' 김정은, 통역없이 트럼프와 1대1 대화?홍준표 ""文정부 복수위해 MB포토라인에…부메랑될것""""아내에 알리겠다"" 내연녀 목 졸라 살해""사기도박 대가 안줘"" 해상콘도서 살인 미수""악귀 나가라""…목사·친모가 5시간 때려 사망좋아요0훈훈해요0슬퍼요0화나요0후속기사 원해요0기사제공 :']"
10,삼성전자, 2018-03-1411:00,뉴스1 ,"삼성전자, 평창 패럴림픽 선수촌에 음성인식 세탁기·건조기 공급",https://finance.naver.com/news/news_read.nhn?article_id=0003256648&office_id=421&mode=search&query=삼성전자&page=5,"['       삼성전자, 평창 패럴림픽 선수촌에 음성인식 세탁기·건조기 공급      기사입력2018-03-14 11:00기사원문좋아요훈훈해요좋아요 평가하기공감좋아요0훈훈해요0슬퍼요0화나요0후속기사 원해요0댓글삼성전자가 \'2018 평창 동계 패럴림픽대회\' 선수들의 다양한 세탁 패턴을 고려해 인공지능(AI) 기반 음성인식 기술을 탑재한 \'플렉스워시\' 세탁기와 건조기 등 총 150여대를 공급했다고 14일 밝혔다. 특히 음성인식으로 작동되는 플렉스워시 세탁기는 시각장애를 가진 사용자도 편리하게 세탁할 수 있다. 이번 동계패럴림픽대회에 지원된 \'플렉스워시\'는 기존 제품에 \'빅스비\'를 탑재해 음성만으로 복잡한 기능을 작동시킬 수 있다. 크로스컨트리 국가대표 이도연(오른쪽)이 \'플렉스워시\' 세탁기의 사용법을 배우고 있다. (삼성전자 제공) 2018.3.14/뉴스1photo@news1.kr▶ [뉴스1] 채널설정하기 ▶ 제보하기▶ [페이스북] 바로가기![© 뉴스1코리아(news1.kr), 무단 전재 및 재배포 금지]뉴스1 관련뉴스해당 언론사에서 선정하며 언론사 페이지(아웃링크)로 이동해 볼 수 있습니다.\'스위스 유학파\' 김정은, 통역없이 트럼프와 1대1 대화?홍준표 ""文정부 복수위해 MB포토라인에…부메랑될것""""아내에 알리겠다"" 내연녀 목 졸라 살해""사기도박 대가 안줘"" 해상콘도서 살인 미수""악귀 나가라""…목사·친모가 5시간 때려 사망좋아요0훈훈해요0슬퍼요0화나요0후속기사 원해요0기사제공 :']"
11,삼성전자, 2018-03-1411:00,서울경제 ,삼성 패럴림픽 선수촌에 음성인식 세탁기 선물,https://finance.naver.com/news/news_read.nhn?article_id=0003243505&office_id=011&mode=search&query=삼성전자&page=5,"['       삼성 패럴림픽 선수촌에 음성인식 세탁기 선물      기사입력2018-03-14 11:00기사원문좋아요훈훈해요좋아요 평가하기공감좋아요0훈훈해요0슬퍼요0화나요0후속기사 원해요0댓글플렉스워시·건조기 등 150대크로스컨트리 국가대표 이도연(오른쪽) 선수가 지난 13일 평창 동계패럴림픽 선수촌에서 인공지능(AI) 기반 음성인식 기술로 접근성을 대폭 강화한 ‘플렉스워시’ 세탁기의 사용법을 배우고 있다./사진제공=삼성전자[서울경제] 삼성전자가 오는 18일까지 열리는 2018 평창 동계패럴림픽대회 선수촌에 인공지능(AI) 기반 음성인식 기술이 탑재된 ‘플렉스워시’ 세탁기를 제공했다. 삼성전자는 선수촌에 에드워시 드럼세탁기와 플렉스워시 세탁기, 저온제습 건조기 등 150여대의 세탁기와 건조기를 제공했다. 정호진 삼성전자 생활가전사업부 상무는 “접근성을 대폭 개선한 플렉스워시 등 삼성전자의 다양한 세탁기와 건조기가 평창 동계패럴럼픽대회에 참가하는 선수들의 생활과 경기에 조금이라도 보탬이 되기를 희망한다”고 말했다. 삼성전자에 따르면 소재와 색상에 따라 분리 및 동시 세탁이 가능하고 인체공학 설계를 적용해 신체 부담을 최소화한 플렉스워시가 큰 인기를 끌고 있다. 이번 동계패럴림픽대회에 지원되는 플렉스워시는 기존 제품에 ‘빅스비’를 탑재해 음성만으로 복잡한 기능을 작동시킬 수 있어 일반 사용자뿐 아니라 손 사용이 불편하거나 시각장애를 가진 사용자들이 편리하게 세탁을 할 수 있다./한재영기자 jyhan@sedaily.com[서울경제 바로가기]이제 주식시세도 서울경제에서 확인하세요 [바로가기▶]블록체인의 모든 것, 서울경제 Decenter [바로가기▶]저작권자 ⓒ 서울경제, 무단 전재 및 재배포 금지서울경제 관련뉴스해당 언론사에서 선정하며 언론사 페이지(아웃링크)로 이동해 볼 수 있습니다.되면 6억 번다? \'디에이치자이 개포\' 분양가 전격공개""고용쇼크, 최저임금 아닌 한파·연휴 탓"" 황당한 정부관세조치에 자산매각 맞불···美-中 \'錢의 전쟁\' 시작?차 정말 좋다는 \'아반떼·쏘렌토\' 인정 받더니 생긴 일""부가가치 증가가 투자"" GM의 황당한 투자계획서좋아요0훈훈해요0슬퍼요0화나요0후속기사 원해요0기사제공 :']"
12,삼성전자, 2018-03-1411:00,이데일리 ,"삼성전자, `2018 평창 동계패럴림픽` AI 세탁기·건조기 공급",https://finance.naver.com/news/news_read.nhn?article_id=0004056036&office_id=018&mode=search&query=삼성전자&page=5,"[""       삼성전자, `2018 평창 동계패럴림픽` AI 세탁기·건조기 공급      기사입력2018-03-14 11:00기사원문좋아요훈훈해요좋아요 평가하기공감좋아요0훈훈해요0슬퍼요0화나요0후속기사 원해요0댓글- 선수촌 세탁실에 세탁기·건조기 등 150여대 설치- 음성인식 가능한 ''플렉스워시'' 신제품도 지원삼성전자가 2018 평창 동계패럴림픽 선수촌에 공급한 인공지능 플렉스워시 세탁기의 사용법에 대해 선수들이 설명을 듣고 있다. [삼성전자 제공][이데일리 양희동 기자] 삼성전자(005930)가 오는 18일까지 진행되는 ‘2018 평창 동계패럴림픽대회’ 선수촌에 인공지능(AI) 기반 음성인식 기술로 접근성을 대폭 강화한 ‘플렉스워시’ 등 선수들의 세탁을 도울 세탁기 및 건조기를 설치했다고 14일 밝혔다.삼성전자는 선수들의 다양한 세탁 패턴을 고려해 애드워시 드럼세탁기, 플렉스워시 세탁기, 저온 제습 건조기 등 총 150여 대를 공급했다. 이 중 플렉스워시는 단연 선수들의 인기를 얻고 있다고 전했다.플렉스워시는 세탁물의 소재·색상 등에 따라 분리 또는 동시 세탁이 가능하고 인체공학적 설계로 신체 부담을 최소화한 ‘3도어 올인원 세탁기’이다. 이번 동계패럴림픽대회에 지원되는 신제품은 AI 플랫폼인 ‘빅스비’를 탑재해 음성만으로 복잡한 기능을 작동시킬 수 있어, 일반 사용자뿐 아니라 손 사용이 불편하거나 시각 장애를 가진 선수들도 편리하게 세탁할 수 있다.사용자는 제품의 기본 작동뿐 아니라 △각 세탁물에 대한 적절한 코스 추천 △세탁 진행 상황과 남은 시간에 대한 정보 제공 △문제 상황 발생 시 원인과 대처 방안 가이드 등을 음성으로 쉽게 묻고 전달 받을 수 있다. 또 와이파이(WiFi) 기반 사물인터넷(IoT) 기능도 탑재돼 ‘스마트 싱스(Smart Things)’ 앱을 통해 원격으로 다양한 작업을 수행할 수 있다.정호진 삼성전자 생활가전사업부 상무는 “접근성을 대폭 개선한 플렉스워시 등 삼성전자의 다양한 세탁기 및 건조기가 평창 동계패럴럼픽에 참가하는 선수들의 생활과 경기에 조금이라도 보탬이 되길 희망한다”고 말했다.한편 삼성전자는 이번에 선수촌에 지원한 플렉스워시 신모델을 이달 말 국내에 출시할 계획이다.양희동 (eastsun@edaily.co.kr)＜ⓒ종합 경제정보 미디어 이데일리 - 무단전재 & 재배포 금지＞이데일리 관련뉴스해당 언론사에서 선정하며 언론사 페이지(아웃링크)로 이동해 볼 수 있습니다.성폭행Vs합의한 성관계 진실공방에 멍드는 '#미투'MB, 21시간 마라톤 조사 후 귀가…檢 혐의 부인에 영장 청구할 듯한국 제조업, 베트남 경제 먹여살린다[식품박물관]①국내 최초·현존 최고의 삼양라면 탄생 주역은 금융인?!견제없는 '제왕적 대통령'의 비극…前 대통령 5명 뇌물죄로 檢 앞에좋아요0훈훈해요0슬퍼요0화나요0후속기사 원해요0기사제공 :""]"
13,삼성전자, 2018-03-1410:53,스포츠조선 ,韓 스마트폰 도매 평균판매단가 세계 2위…'고가' 모델 선호 뚜렷,https://finance.naver.com/news/news_read.nhn?article_id=0003227080&office_id=076&mode=search&query=삼성전자&page=5,"['       韓 스마트폰 도매 평균판매단가 세계 2위…\'고가\' 모델 선호 뚜렷      기사입력2018-03-14 10:53기사원문좋아요훈훈해요좋아요 평가하기공감좋아요0훈훈해요0슬퍼요0화나요0후속기사 원해요0댓글 한국에서 판매되는 스마트폰의 도매 평균판매단가가 세계에서 두 번째로 높은 것으로 조사됐다. 1위는 일본이다. 한국과 일본의 스마트폰 도매 평균판매단가가 높게 조사된 것은 현지 소비자들이 애플 아이폰, 삼성전자 갤럭시 등 고가의 플래그십 모델을 선호 현상에 따른 결과다. 14일 시장조사업체 스트래티지애널리틱스(SA)에 따르면 작년 한국에서 팔린 스마트폰의 도매 평균판매단가(Wholesale ASP)는 466달러(약 49만7000원)다. 일본은 557달러(약 59만4000원)으로 가장 높았다. 도매 평균판매단가는 제조사가 이동통신사에 공급하는 가격을 말한다. 소비자가(출고가)는 이 가격에 국가별 유통마진 20∼30%가 붙는다. 국가별로 유통마진이 거의 비슷하기 때문에 소비자가도 해당 순서대로 높다고 보면 된다.세계 1위 프리미엄폰 시장인 미국이 도매 평균단가는 425달러(약 45만3000원)로 3위를 기록했고, 호주(420달러·44만7000원), 스위스(415달러·44만2000원)가 뒤를 이었다. 수량 기준 세계 스마트폰 시장 1위인 중국은 209달러(22만3000원)로 41위, 인도는 128달러(13만6000원)로 77위였다.일본과 한국의 스마트폰 도매 평균판매단가가 높은 것은 애플의 아이폰과 삼성전자의 갤럭시 등 고가의 플래그십 모델을 판매량이 많기 때문이다. 일본 스마트폰 시장에서는 애플이 50% 안팎의 점유율로 독보적인 1위를 차지하고 있고, 소니가 15% 내외 점유율을 보이고 있다. 국내 스마트폰 시장 점유율은 작년 기준 삼성 56.2%, 애플 17.7%, LG 17.4%다.SA 측은 ""2023년까지 스마트폰 도매 평균판매단가의 1∼5위까지 순서가 변동이 없을 것으로 보인다""며 ""한국의 스마트폰 도매 평균판매단가는 올해 481달러(51만3000원), 2019년 491달러(52만3000원) 수준으로 상승할 것으로 전망하고 있다""고 밝혔다. 김세형 기자 fax123@sportschosun.com[스포츠조선 바로가기] [스포츠조선 페이스북]- Copyrightsⓒ 스포츠조선(http://sports.chosun.com/), 무단 전재 및 재배포 금지좋아요0훈훈해요0슬퍼요0화나요0후속기사 원해요0기사제공 :']"
