,회사명,날짜,언론사,기사제목,링크,본문
0,삼성전자, 2018-11-2323:05,한겨레 ,"삼성전자, 11년만에 ‘반도체 작업장 안전 관리 소홀’ 사과",https://finance.naver.com/news/news_read.nhn?article_id=0002433590&office_id=028&mode=search&query=삼성전자&page=1,"['        삼성전자, 11년만에 ‘반도체 작업장 안전 관리 소홀’ 사과       기사입력2018-11-23 23:05기사원문좋아요훈훈해요좋아요 평가하기공감좋아요0훈훈해요0슬퍼요0화나요0후속기사 원해요0댓글  [한겨레] 4년 전 “피해자 아픔과 어려움에 대해 소홀” 두루뭉술 사과  “삼성전자는 건강유해인자에 의한 위험을 충분하고 완벽하게 관리하지 못했다. 진심으로 사과한다.”  삼성전자가 23일 반도체 백혈병 피해 노동자와 가족들에게 한 사과에는 작업장 안전관리 소홀에 관한 내용이 담겼다. 2014년 문제 해결 노력이 부족했던 부분에 대해서만 사과했던 것보다 한발 더 나아간 것이다. 피해자 및 가족들은 “부족하지만 수용한다”고 밝혔다.  이날 김기남 삼성전자 반도체(DS) 부문장(사장)은 삼성전자를 대표해 작성한 A4용지 2장 분량의 본인 명의 사과문을 직접 낭독했다. 사과 대상은 ‘뒤늦은 문제 해결’과 ‘미숙한 작업장 관리’ 등 두 가지였다.  김 사장은 “소중한 동료와 그 가족들이 오랫동안 고통받으셨는데, 삼성전자는 이를 일찍부터 성심껏 보살피지 못했다”며 “그 아픔을 충분히 배려하고 조속하게 해결하기 위한 노력이 부족했다”고 말했다. 이어 김 사장은 “삼성전자는 과거 반도체 및 엘시디(LCD) 사업장에서 건강유해인자에 의한 위험에 대해, 충분하고 완벽하게 관리하지 못했다”며 “오늘 이 자리를 빌려 병으로 고통받은 직원들과 그 가족분들께 진심으로 사과드린다”고 말했다.  앞서 2014년 5월에는 권오현 당시 반도체 부문장(부회장)이 반도체 백혈병 문제에 대해 한 차례 사과했다. 당시 권 부회장은 “이분들(피해자들)과 가족의 아픔과 어려움에 대해 저희가 소홀한 부분이 있었다”며 “진작 이 문제를 해결했어야 하는데 그렇지 못한 점 마음 아프게 생각하며 이 자리를 빌려 진심으로 사과드린다”고 말했다. ‘반도체 백혈병’ 문제 해결 노력이 부족했던 부분은 사과했지만, 작업장 안전을 제대로 관리하지 못한 부분에 대한 사과는 당시 이뤄지지 않았다. 최현준 기자 haojune@hani.co.kr ▶ 한겨레 절친이 되어 주세요! [오늘의 추천 뉴스] [▶ 블록체인 미디어 : 코인데스크] [신문구독][ⓒ한겨레신문 : 무단전재 및 재배포 금지] 한겨레 관련뉴스해당 언론사에서 선정하며 언론사 페이지(아웃링크)로 이동해 볼 수 있습니다.""싸움박질도 해본 놈이 잘한다""는 김성태, 11월 바쁜 까닭유승준은 왜 돌아오지 못할까?김나영 ""남편 구속 당혹스러워…직업 잘 몰라""[단독] 김진호 향군회장 ""난 강경 보수지만, 남북군사합의는 비핵화 과정""\'목숨 끊은 여경\' 음해성 투서 보낸 동료 여경 구속수감좋아요0훈훈해요0슬퍼요0화나요0후속기사 원해요0기사제공 :']"
1,삼성전자, 2018-11-2322:00,YTN ,"""딸 유미와 약속 지켰다""...11년 恨과 눈물",https://finance.naver.com/news/news_read.nhn?article_id=0001220342&office_id=052&mode=search&query=삼성전자&page=1,"['       ""딸 유미와 약속 지켰다""...11년 恨과 눈물      기사입력2018-11-23 22:00기사원문좋아요훈훈해요좋아요 평가하기공감좋아요0훈훈해요0슬퍼요0화나요0후속기사 원해요0댓글 [앵커]거대 재벌기업 삼성을 상대로 기나 긴 세월 끝에 사과를 받아낸 반도체 백혈병 피해자와 가족들은 결국 눈물을 흘렸습니다.고 황유미 씨의 아버지 황상기 씨도 딸과의 약속을 11년 만에 비로소 지켰다며 다시는 이런 아픔이 없기를 바랐습니다.최아영 기자입니다.[기자]故 황유미 씨는 지난 2003년, 삼성전자 기흥공장에 입사해 반도체 세정작업 맡았습니다.그리고 2005년 한창 꽃다울 나이 스무 살에 급성백혈병 진단을 받았고, 2년 뒤 세상을 떠났습니다.[故 황유미 / 삼성 반도체 백혈병 피해자 (지난 2007년 2월) : 멍이 자주 들었고요. 그리고 먹으면 토했어요. 큰 병원에 갔더니 백혈병 판정받고 엄청나게 울었고 죽는 줄 알았어요. 제가.]이렇게 삼성전자에서 일하다가 병들거나 삶과 이별한 노동자는 유미 씨뿐만이 아니었습니다.하지만 피해자와 가족들에게 대기업 삼성은 너무도 커다란 벽이었습니다.[황상기 / 故 황유미 씨 아버지 (지난 2007년 2월) : 나 개인이 이렇게 큰 회사를 어떻게 이깁니까. 회사가 백혈병 걸린 사람을 알아서 해주는 게 대기업이고 회사의 임무지….]게다가 지난 2009년 근로복지공단도 유미 씨에 대한 산업재해 받아들이지 않았습니다.법정공방 끝에 2014년 산재를 인정받자 결국, 삼성 측도 태도를 바꾸기 시작했습니다.그해 양측이 조정위원회 구성에 합의했지만, 삼성이 자체 보상안을 내놓으면서 피해자와 가족들은 1,000일 넘게 천막 농성을 벌였습니다.그렇게 제자리걸음을 걷던 협상은 올 7월 2차 조정을 시작으로 급물살을 탔습니다.삼성을 상대로 11년의 긴 싸움 끝에 첫 산재인정을 받아 낸 황상기 씨는 비로소 딸 유미와의 약속을 지키게 됐다며 소회를 밝혔습니다.[황상기 / 故 황유미 씨 아버지 : 우리는 삼성으로부터 상당히 억울한 일을 당하고 있는데 억울한 일을 꼭 밝히겠다고 약속한 적 있습니다. 그런데 가장 중요한 유미의 목숨을 지키지 못한, 그것에 대한 미안함은 그대로 남아있습니다.]삼성전자에서 일하다 장애 1급을 받은 피해자 한혜경 씨와 어머니는 끝내 눈물을 흘리며, 다시는 같은 일이 반복되지 않기를 바랐습니다.[한혜경 / 삼성전자 LCD 공장 피해자 : 그냥 슬프더라고요. 조금만, 그냥 진실하게 말해줘요. 저 같은 사람 다시 나오면 안 되잖아요.]YTN 최아영[cay24@ytn.co.kr]입니다.▶ 12월 3일 24시간 YTN 방송이 새로워집니다!   ▶ 네이버 메인에서 YTN을 구독해주세요! [저작권자(c) YTN & YTN PLUS 무단전재 및 재배포 금지]YTN 관련뉴스해당 언론사에서 선정하며 언론사 페이지(아웃링크)로 이동해 볼 수 있습니다.9살 아동, 숙제 안 했다가 가족에게 구타당해 사망\'중학생 추락사\' CCTV 확인…충격적인 사실 발견""방정오 대표 측, 딸 녹음파일 지우라고 한 뒤 해고""애플, 출시 한 달 아이폰XR 일본에서 이례적 할인\'다시 일어서는\' 피사의 사탑…17년 동안 4cm 섰다좋아요0훈훈해요0슬퍼요0화나요0후속기사 원해요0기사제공 :']"
2,삼성전자, 2018-11-2322:00,YTN ,삼성 '반도체 백혈병' 11년 만에 마침표,https://finance.naver.com/news/news_read.nhn?article_id=0001220341&office_id=052&mode=search&query=삼성전자&page=1,"['       삼성 \'반도체 백혈병\' 11년 만에 마침표      기사입력2018-11-23 22:00기사원문좋아요훈훈해요좋아요 평가하기공감좋아요0훈훈해요0슬퍼요0화나요0후속기사 원해요0댓글 [앵커]삼성전자 반도체 공장에서 일하다 숨지거나 병에 걸린 노동자들에 대한 보상 문제가 11년 만에 마무리됐습니다.이르면 올해 안에 실질적인 보상 작업이 시작될 예정입니다.홍선기 기자가 보도합니다.[기자]삼성전자와 반도체 공장 피해자 단체 반올림이 조정위가 마련한 보상안에 공식 서명했습니다.중재안을 모두 받아들이고, 이행 절차도 그대로 따르겠다는데 양측이 동의한 겁니다.양측이 피해 보상에 합의한 건 지난 2007년, 삼성전자 기흥공장 반도체 생산 라인에서 일하던 황유미 씨가 급성 백혈병으로 숨진 지 11년 만입니다.중재안은 지난 1984년 이후 삼성전자 반도체 공장에서 1년 이상 일한 사람을 대상으로 하고, 백혈병 등 질병 유형별 보상액을 규정하고 있습니다.개인별 보상액은 낮추되 피해 가능성이 있는 사람은 최대한 포함하기 위해 보상 범위를 대폭 확대했다는 게 조정위의 설명입니다.삼성전자는 협약식 서명 직후 대표이사가 직접 피해자와 가족들에게 사과했습니다.[김기남 / 삼성전자 대표이사 : 삼성전자는 과거 반도체 및 LCD 사업장에서 건강유해인자에 의한 위험에 대해 충분하고 완벽하게 관리하지 못했습니다.]반올림 측도 삼성의 사과를 받아들였습니다.[황상기 / 반올림 대표 : 사랑하는 가족을 잃은 아픔을 생각하면 사실 그 어떤 사과도 충분할 수는 없을 겁니다. 그러나 저는 오늘의 사과를 삼성전자의 다짐으로 받아들이겠습니다.]삼성과 반올림은 보상 업무를 제3의 독립기관인 법무법인 지평에 위탁하는 데 합의했습니다.삼성이 내기로 한 기금 5백억 원은 한국산업안전보건공단에 기탁 하기로 했습니다.양측의 합의를 바탕으로 한 실질적인 보상은 지원보상위원회가 꾸려지는 대로 이르면 올해 안에 시작될 수 있을 것으로 보입니다.YTN 홍선기입니다.▶ 12월 3일 24시간 YTN 방송이 새로워집니다!   ▶ 네이버 메인에서 YTN을 구독해주세요! [저작권자(c) YTN & YTN PLUS 무단전재 및 재배포 금지]YTN 관련뉴스해당 언론사에서 선정하며 언론사 페이지(아웃링크)로 이동해 볼 수 있습니다.9살 아동, 숙제 안 했다가 가족에게 구타당해 사망\'중학생 추락사\' CCTV 확인…충격적인 사실 발견""방정오 대표 측, 딸 녹음파일 지우라고 한 뒤 해고""애플, 출시 한 달 아이폰XR 일본에서 이례적 할인\'다시 일어서는\' 피사의 사탑…17년 동안 4cm 섰다좋아요0훈훈해요0슬퍼요0화나요0후속기사 원해요0기사제공 :']"
3,삼성전자, 2018-11-2321:31,TV조선 ,삼성전자 '반도체 백혈병' 공식 사과…11년 갈등 '종지부',https://finance.naver.com/news/news_read.nhn?article_id=0000258620&office_id=448&mode=search&query=삼성전자&page=1,"['       삼성전자 \'반도체 백혈병\' 공식 사과…11년 갈등 \'종지부\'      기사입력2018-11-23 21:31기사원문좋아요훈훈해요좋아요 평가하기공감좋아요0훈훈해요0슬퍼요0화나요0후속기사 원해요0댓글 [앵커]11년 넘게 이어져 온 이른바 \'삼성전자 백혈병 갈등\'에 마침표가 찍혔습니다. 삼성전자가 산업재해로 인정하며 사과했고, 반도체 질병 근로자와 유가족들은 사과를 받아들이고, 보상안도 수용하기로 했습니다. 정준영 기자입니다.[리포트]김기남 삼성전자 사장이 90도로 허리를 숙입니다. 그리고 반도체 근로자의 직업병을 인정하고 사과하며, 보상을 약속합니다. 김기남 / 삼성전자 사장 ""건강유해 인자에 의한 위험에 대해 충분하고 완벽하게 관리하지 못했습니다."" 이를 보는 반도체 근로자 가족들의 얼굴엔 만감이 교차하고, 시민단체 활동가들 눈시울도 붉어집니다. 2007년 고 황유미 씨가 급성 백혈병으로 숨진 뒤, 11년간 이어져 온 반도체 근로자 직업병 갈등에 이로써 종지부가 찍혔습니다.황상기 / 반올림 대표 (고 황유미씨 부친) ""미진하지만 사과도 받았습니다. 유미하고 약속했던 것은 지켜졌다고 생각합니다."" 삼성과 반올림 양측 모두 조정위원회의 중재안을 수용했습니다.  이에 따라 1984년 이래 반도체와 LCD 공장에서 1년 이상 일하다가 병에 걸린 근로자 전원이 보상 대상이 됩니다.금액은 백혈병이 최대 1억 5000만 원, 파킨슨병, 유산, 자녀질환 등도 정도에 따라 보상 받을 수 있습니다.""삼성전자의 보상안을 거부한 채 이곳 서초사옥 앞에서 1000일 넘게 이어지던 반올림의 천막농성도 이제는 모두 사라진 상태입니다"" 보상은 2028년까지 10년 동안 이어집니다. 보상 업무는 법무법인 지평이 담당하고, 대표변호사이자 조정위원장을 맡았던 김지형 전 대법관이 보상위원장이 됩니다. TV조선 정준영입니다. ☞ TV조선 뉴스 유튜브 실시간 시청하기☞ 모바일 웹으로 TV조선 보기 * 뉴스제보 : 이메일(tvchosun@chosun.com), 카카오톡(tv조선제보), 전화(1661-0190)정준영 기자(jun88@chosun.com)- Copyrights ⓒ TV조선. 무단전재 및 재배포 금지 -TV조선 관련뉴스해당 언론사에서 선정하며 언론사 페이지(아웃링크)로 이동해 볼 수 있습니다.\'음주\' 확인 경찰, 靑 비서관 동승자 조사도 안 해…봐주기 \'의혹\'이재명 부부 교회 홈피에도 \'khk631000\' ID…소유주는 \'김혜경\'\'영부인인데…\' 문자에 4억 사기당한 윤장현 前 광주시장김경수 前 보좌관 ""드루킹 요구 뿌리치지 못할 뭔가 있었을 것""동해 조업중이던 어선, 北에 나포됐다 풀려나…정부 ""유감""좋아요0훈훈해요0슬퍼요0화나요0후속기사 원해요0기사제공 :']"
4,삼성전자, 2018-11-2321:28,경향신문 ,"황상기 대표 “오늘의 사과, 삼성의 다짐으로 알겠다”",https://finance.naver.com/news/news_read.nhn?article_id=0002907469&office_id=032&mode=search&query=삼성전자&page=1,"['       황상기 대표 “오늘의 사과, 삼성의 다짐으로 알겠다”      기사입력2018-11-23 21:28기사원문좋아요훈훈해요좋아요 평가하기공감좋아요0훈훈해요0슬퍼요0화나요0후속기사 원해요0댓글ㆍ삼성전자·반올림, 중재판정 이행합의 협약식서울 중구 한국프레스센터에서 23일 열린 삼성전자-반올림 중재판정 이행합의 협약식에서 반올림 황상기 대표가 생각에 잠겨 있다(왼쪽 사진). 협약식에서 삼성전자 김기남 대표이사가 고개 숙여 사과하고 있다.  연합뉴스·김창길 기자 cut@kyunghyang.com김기남 DS부문 사장 “위험관리 소홀”…이르면 연내 지원보상 시작재발방지 기금 500억, 안전보건공단에 기탁…활용 방식 합의 못해“소중한 동료와 그 가족들이 오랫동안 고통받았는데 그 아픔을 충분히 배려하고 조속하게 해결하기 위한 노력이 부족했다.” “그동안 반도체 및 LCD 사업장에서 건강유해인자에 의한 위험에 대해 충분하고 완전하게 관리하지 못했다.” “병으로 고통받은 근로자와 그 가족분들께 진심으로 사과드린다.”김기남 삼성전자 디바이스솔루션(DS) 부문 대표이사 사장이 23일 서울 중구 한국프레스센터에서 열린 ‘중재 판정 이행 합의 협약식’에서 피해자와 가족에게 사과문을 발표하던 도중 연단 앞으로 나와 허리를 숙였다. 김 사장은 삼성전자 반도체와 디스플레이 사업을 총괄하고 있다.맨 앞자리에 앉은 황상기 반올림(반도체 노동자의 건강과 인권 지킴이) 대표, 삼성전자 LCD 공장에서 일하다 뇌종양에 걸린 한혜경씨(39), 한씨의 어머니 김시녀씨 등은 만감이 교차하는 듯한 표정으로 단상의 김 사장을 바라봤다. 김씨는 협약식 내내 휠체어에 앉은 딸의 오른손을 꼭 잡고 쓰다듬었다. 김 사장은 사과문을 다 읽은 뒤 피해자 가족이 앉은 테이블로 다가가 먼저 악수를 청했고, 황 대표가 손을 맞잡았다.딸인 고 황유미씨를 비롯해 반도체공장 직업병 피해자의 모습이 그려진 검정 티셔츠를 입고 나온 황 대표는 손으로 직접 써온 인사말을 읽었다. 그는 “지난 11년간 반올림 활동을 하면서 수없이 속고 모욕당했던 일이나 직업병의 고통, 사랑하는 가족을 잃은 아픔을 생각하면 사실 그 어떤 사과도 충분할 순 없을 것이지만 저는 오늘의 사과를 삼성전자의 다짐으로 받아들이겠다”고 말했다. 이어 “삼성전기, 삼성SDS, 삼성SDI 등 다른 계열사에서도 유해물질을 사용하다가 병든 노동자들이 있기 때문에 삼성이 모든 직업병 노동자들을 위한 폭넓은 보상안을 마련하기 바란다”고 촉구했다.‘반도체 백혈병’ 논쟁은 2007년 3월 삼성전자 기흥공장에서 근무하던 황유미씨가 급성 백혈병으로 숨지면서 시작됐다. 1년 후 시민단체 반올림이 발족하면서 분쟁이 본격화했다. 올해 조정위원회가 삼성전자, 반올림 양측에 ‘합의 의사가 있다’는 점을 확인하면서 논의는 급물살을 탔다. 이날 협약식 서명으로 이 문제는 11년8개월 만에 사실상 ‘종지부’를 찍었다.삼성전자 김기남 대표이사(왼쪽)와 김지형 조정위원장(가운데), 반올림 황상기 대표(오른쪽)가 23일 삼성전자-반올림 중재판정 이행합의 협약식에서 악수를 하고 있다. 김창길 기자삼성전자는 중재안에 따라 회사 홈페이지에도 사과문과 지원보상 안내문을 게재하기로 했다. 또 재발방지와 사회공헌의 일환으로 출연하기로 한 산업안전보건발전기금 500억원을 한국산업안전보건공단에 기탁한다. 삼성전자와 법무법인 지평은 조속한 시일 내에 피해자 지원보상을 위한 업무협약을 맺고, 곧바로 지원보상위원회와 사무국 구성에 착수하기로 했다. 조정위원회 위원장을 맡아 중재안을 도출한 김지형 전 대법관이 지원보상위 위원장도 맡는다.지원보상 질병은 반도체·LCD와 관련해 논란이 된 암 중 갑상샘암을 제외한 백혈병, 비호지킨림프종, 다발성골수증, 폐암 등 16종의 암이다. 보상액은 백혈병이 최대 1억5000만원, 뇌종양 1억3500만원 등이다. 삼성전자 관계자는 이르면 올해 안에 지원보상이 시작돼 2028년쯤 마무리될 것으로 보인다고 전했다.이번 중재안 도출로 삼성전자는 기업의 사회적 책임에 대한 의문점을 일부 해소했다는 평가를 받는다. 올 들어 삼성전자서비스의 협력사 직원 직접 채용, 노동조합 활동 보장, 그룹 계열사 간 순환출자 고리를 해소했고 백혈병 분쟁 문제를 해결하면서 남은 숙제를 하나 더 덜어낸 것이다. 그러나 여전히 과제는 남아 있다. 구체적인 보상 과정에 들어갈 경우 갈등이 재연될 가능성이 남아 있고 500억원 규모의 산업안전보건발전기금의 활용 방식도 아직 완전한 합의가 이뤄지지 않은 상태다. 특히 해외 사업장으로 직업병 이슈가 확산된다면 삼성으로서는 큰 부담에 직면할 것으로 보인다.임아영·남지원 기자  layknt@kyunghyang.com▶ [경향비즈 바로가기], 경향비즈 SNS [페이스북]  ▶ [인기 무료만화 보기][©경향신문(www.khan.co.kr), 무단전재 및 재배포 금지]좋아요0훈훈해요0슬퍼요0화나요0후속기사 원해요0기사제공 :']"
5,삼성전자, 2018-11-2321:28,경향신문 ,"삼성, ‘반도체 백혈병’ 11년 만에 사과",https://finance.naver.com/news/news_read.nhn?article_id=0002907470&office_id=032&mode=search&query=삼성전자&page=1,"['       삼성, ‘반도체 백혈병’ 11년 만에 사과      기사입력2018-11-23 21:28기사원문좋아요훈훈해요좋아요 평가하기공감좋아요0훈훈해요0슬퍼요0화나요0후속기사 원해요0댓글ㆍ삼성전자·반올림, 중재이행 협약ㆍ유족들 “개별 보상 등 숙제 여전”뒤늦게 피해자 손잡은 삼성 한국프레스센터에서 23일 열린 삼성전자-반올림 중재판정 이행합의 협약식을 마친 뒤 기념촬영을 하기 전 김기남 대표이사(앞줄 왼쪽에서 첫번째)가 황상기 반올림 대표(두번째)의 중재로 피해자 한혜경씨(세번째)와 악수를 하고 있다. 김창길 기자 cut@kyunghyang.com삼성전자가 23일 “병으로 고통받은 근로자와 그 가족분들께 진심으로 사과드린다”며 ‘반도체 백혈병’ 문제에 대해 공식 사과했다. 2007년 삼성전자 기흥공장에서 일하던 황유미씨(당시 23세)가 백혈병으로 사망하면서 산업재해 여부를 놓고 논란을 벌인 지 11년 만이다. 시민단체 ‘반도체 노동자의 건강과 인권 지킴이’(반올림)가 파악한 삼성그룹 내 직업병 피해자 중 사망자는 118명이다. 백혈병 등의 질환을 반도체·LCD 제조와 관련된 직업병으로 볼 것인지를 놓고 10년 넘게 지속했던 삼성전자·반올림 양측의 분쟁은 사실상 마침표를 찍었다. 갈등을 조정하기 위해 전문가 집단이 중재안을 마련하고 이를 양측이 받아들여 사회적 합의를 도출한 것은 성과로 평가받는다.그러나 황상기 반올림 대표는 “제 딸 유미에게 했던 약속을 지키게 돼 기쁘지만 유미와 제 가족이 겪었던 아픔은 잊을 수 없다”며 “여전히 남은 숙제들이 있다”고 밝혔다.         앞으로 개별 보상 과정에 들어가면 갈등이 재연될 우려가 있고, 산업안전보건기금 500억원 활용방안도 합의하지 못했다. 피해자 가족은 “다른 계열사와 해외 사업장에서도 직업병 피해를 보상하라”고 요구했다.임아영 기자 layknt@kyunghyang.com▶ [경향비즈 바로가기], 경향비즈 SNS [페이스북]  ▶ [인기 무료만화 보기][©경향신문(www.khan.co.kr), 무단전재 및 재배포 금지]좋아요0훈훈해요0슬퍼요0화나요0후속기사 원해요0기사제공 :']"
