,회사명,날짜,언론사,기사제목,링크,본문
0,삼성전자, 2018-03-0809:13,JTBC ,이건희 차명계좌 주식 처분 과정 밝힌다…공시 위반 등 조사,https://finance.naver.com/news/news_read.nhn?article_id=0000176620&office_id=437&mode=search&query=삼성전자&page=9,"['       이건희 차명계좌 주식 처분 과정 밝힌다…공시 위반 등 조사      기사입력2018-03-08 09:13기사원문좋아요훈훈해요좋아요 평가하기공감좋아요0훈훈해요0슬퍼요0화나요0후속기사 원해요0댓글 [앵커]금융당국이 이건희 삼성전자 회장의 차명 계좌에 과징금을 매기기로 한 데 이어서 계좌에 들어있던 주식을 처분한 과정에 대해서도 조사하고 있습니다. 계열사 주식을 실명으로 전환하면서 공시를 제대로 하지 않았다는 의혹을 확인하는 것입니다. 주식을 팔면서 미공개 내부 정보를 이용하지 않았는지도 조사 대상입니다.이주찬 기자입니다.[기자]2008년 삼성 특검팀은 이건희 삼성전자 회장이 차명계좌로 계열사 주식을 운영하고 있던 사실을 적발했습니다.금융감독원이 들여다보고 있는 것은 이 차명계좌에 들어있던 계열사 주식을 실명전환하고, 일부 처분하는 과정에서 공시를 제대로 했느냐입니다.자본시장법은 상장기업의 5% 이상 지분을 보유한 대주주가 그 지분이 1% 이상 줄거나 늘 때 반드시 공시를 하도록 하고 있습니다.하지만 석연치 않은 부분이 있어 조사가 필요하다는 것입니다.   예컨대 2008년말 차명계좌에서 삼성전자 주식이 인출됐는데 실명전환 공시는 2~3달 뒤에나 이뤄졌고, 공시된 주식 수도 당초 차명으로 보유했던 것보다 적었습니다.공시 위반이 확인될 경우 과징금이 부과되거나 검찰 고발이 뒤따를 수 있습니다.금감원은 또 이 회장이 주식 처분 과정에서 기업 내부 정보를 이용하지 않았는지도 들여다 볼 예정입니다.금융당국이 일부나마 이 회장의 차명계좌에 과징금을 매기기로 한데 이어 이후 처분 과정도 추적하고 나선 것입니다.  하지만 이 역시 10년 가까이 지난 \'뒷북조사\'여서 관련 의혹을 제대로 규명할 수 있을지 우려하는 목소리가 나옵니다.(영상디자인 : 이창환)이주찬(jcbond@jtbc.co.kr) [영상편집: 강한승]▶ 라이브 시청은 유튜브로, 제보는 뉴스룸으로!▶ 스토리, 라이브, 비하인드! JTBC 소셜스토리Copyright by JTBC(http://jtbc.joins.com) and JTBC Content Hub Co., Ltd. All Rights Reserved. 무단 전재 및 재배포 금지JTBC 관련뉴스해당 언론사에서 선정하며 언론사 페이지(아웃링크)로 이동해 볼 수 있습니다.\'안희정 성폭행\' 또 다른 피해자 ""대선주자 때도…""""남궁연, 여성 신체 사진 보여줘"" 男 목격자의 증언홍준표 ""미투 무사하네"" 임종석 ""대표님이 무사하신데""BJ 생방송 중 투신 장면 그대로…지난번엔 변사체가\'뉴스룸을 놓쳤다면?\' ☞ 3월 7일 (수) 다시보기좋아요0훈훈해요0슬퍼요0화나요0후속기사 원해요0기사제공 :']"
1,삼성전자, 2018-03-0809:13,전자신문 ,"[ET투자뉴스]삼성전자, ""Rebound!…"" BUY(유지)-DB금융투자",https://finance.naver.com/news/news_read.nhn?article_id=0002689492&office_id=030&mode=search&query=삼성전자&page=9,"['       [ET투자뉴스]삼성전자, ""Rebound!…"" BUY(유지)-DB금융투자      기사입력2018-03-08 09:13기사원문좋아요훈훈해요좋아요 평가하기공감좋아요0훈훈해요0슬퍼요0화나요0후속기사 원해요0댓글DB금융투자에서 8일 삼성전자(005930)에 대해 ""Rebound!""라며 투자의견을 \'BUY(유지)\'로 제시하였고, 아울러 목표주가로는 3,200,000원을 내놓았다. DB금융투자 권성률 애널리스트가 동종목에 대하여 이번에 제시한 \'BUY(유지)\'의견은 DB금융투자의 직전 매매의견과 동일한 것이고 전년도말의 매매의견을 기준으로  볼때도 역시 \'매수\'의견이 계속 유지되고 있는 상태이다. 그리고 최근 분기내 발표된 전체 증권사 리포트의 컨센서스와 비교를 해볼 경우에 오늘 발표된 투자의견은 전체의견에 수렴하고 있어, 이번 의견은 시장의 평균적인 기대감이 객관적으로 표현된 것으로 분석되고 있다. 목표주가의 추이를 살펴보면 최근 장기간 목표가가 같은 수준에 머물고 있는 모습이다. 또한 전일 종가 기준으로 볼때 동종목의 현주가는 이번에 제시된 목표가 대비 31.6%의 저평가 요인이 존재한다는 해석이 제시되고 있다. ◆ Report briefingDB금융투자에서 삼성전자(005930)에 대해 ""반도체는 견조하다. 특히 디램은 서버쪽 수요가 워낙 강하고 PC, 모바일이 계 절적 강세 패턴을 여전히 보이고 있어 예상과 달리 하반기에도 가격이 빠지기 어려운 상황으로 가 고 있다. IM은 갤럭시S9 공개 이후 Sell-in이 순조롭게 진행되고 있다. 1Q18 물량이 1천만대로 예상과 비슷한 추세를 보이고 있고, 연 간 출하량을 우리는 4100만대로 보고 있는데 교체주기, 경쟁 제품 등을 감안할 때 이 이상도 가능해 보인다.디스플레이는 예상보다 훨씬 부진하다. 그나마 가격경쟁력이 있는 Rigid OLED가 부진을 일정부분 상쇄하고 있다.""라고 분석했다.  또한 DB금융투자에서 ""반도체에서 1Q18에 11.2조원, 연간 45.4조원의 영업이익을 기대. IM에서 1Q18 2.8조원, 연간 10.7조원을 기대""라고 밝혔다.  한편 ""이를 감안하면 1Q18 전사 영업이익이 상향 조정될 가능성은 없지만, 내용상으 로는 나쁘지 않다. 디스플레이發 악재는 이미 몇 달간 노출이 되어서 내성이 생긴 반면, 반도체는 시장의 우려를 깨 나가는 국면이며, IM도 시작이 기대 이상이기 때문이다. 반등의 계기로 충분할 것.""라고 전망했다. ◆ Report statisticsDB금융투자의 동종목에 대한 최근 1년동안의 투자의견은 전체적으로 큰 변화없이 유지되고 있다. 목표주가는 2017년3월 2,200,000원이 저점으로 제시된 이후 이번에 발표된 3,200,000원까지 꾸준하게 상향조정되어 왔다. 한편 증권정보제공 업체인 씽크풀에 따르면 동사에 대한 컨센서스는 \'매수\'이고 목표주가는 최근 2회연속 목표가가 높아지가 이번에는 직전보다 소폭 낮은 수준으로 하향반전되는 추세이다. \xa0컨센서스최고최저투자의견매수매수매수목표주가3,317,3683,800,0003,000,000*최근 분기기준오늘 DB금융투자에서 발표된 \'BUY(유지)\'의견 및 목표주가 3,200,000원은 전체의견에 수렴하면서 시장의 평균적인 기대감이 비교적 객관적으로 표현된 것으로 풀이되며 목표가평균 대비 3.5%정도 미달하고 있는 것으로 집계되었다.  참고로 최근에 목표주가를 가장 공격적으로 제시한 유안타증권에서 투자의견 \'매수(유지)\'에 목표주가 3,800,000원을 제일 보수적인 의견을 제시한 KB증권에서 투자의견 \'BUY(유지)\'에 목표주가 3,000,000원을 제시한 바 있다. \xa0의견제시일자투자의견목표가격20180308BUY(유지)3,200,00020180201매수(유지)3,200,00020180115매수3,200,00020180110매수(유지)3,200,00020171228매수(유지)3,200,000의견제시일자증권사투자의견목표가20180308DB금융투자BUY(유지)3,200,00020180307이베스트투자증권BUY (MAINTAIN)3,500,00020180307KB증권BUY(유지)3,000,00020180307키움증권BUY(MAINTAIN)3,400,000(씽크풀에서 제공하는 컨센서스는 국내 전증권사에서 발표되는 기업분석 리포트 및 코멘트를 실시간으로 통계/분석처리되고 있습니다.)증시분석 전문기자 로봇 ET etbot@etnews.com전자신문과 씽크풀의 증시분석 전문기자 로봇 ET가 쓴 기사입니다▶ ICT 패러다임의 변화, Block Chain Innovation Conference 2018▶ 전자신문 포스트 바로가기▶ 전자신문 바로가기 [Copyright ⓒ 전자신문 & 전자신문인터넷, 무단전재 및 재배포 금지]전자신문 관련뉴스해당 언론사에서 선정하며 언론사 페이지(아웃링크)로 이동해 볼 수 있습니다.민간 충전사업자 로밍 합의...""전국 전기차 충전소 자유롭게 이용한다""과기정통부·이통사, 2G 서비스 종료 착수...2G폰→LTE폰 교체 지원D램값 급등 \'부메랑 효과\' 경고음……수율 낮은 中 기업 진입 쉬워져중국, 우주비행선 쓰일 \'극초음속 드론\' 시험발사 성공구글, 미 국방부에 AI 기술 제공 논란좋아요0훈훈해요0슬퍼요0화나요0후속기사 원해요0기사제공 :']"
2,삼성전자, 2018-03-0809:11,한국경제 ,워렌 버핏과 한국의 또 다른 인연,https://finance.naver.com/news/news_read.nhn?article_id=0003904021&office_id=015&mode=search&query=삼성전자&page=9,"['       워렌 버핏과 한국의 또 다른 인연      기사입력2018-03-08 09:11기사원문좋아요훈훈해요좋아요 평가하기공감좋아요0훈훈해요0슬퍼요0화나요0후속기사 원해요0댓글 [03월 08일(09:10) \'모바일한경\'에 게재된 기사입니다]\xa0모바일한경 기사 더보기 ▶워런버핏 벅셔해서웨이 회장(송종현 증권부 기자) 미국 국채금리 상승으로부터 촉발된 글로벌 조정장세가 이어지고 있습니다. 변동성 장세가 한창이던 지난달 26일 워런 버핏 벅셔해서웨이 회장이 미국 경제전문 방송 CNBC와 인터뷰를 가졌습니다.투자자들의 불안감이 극에 달할 때 이뤄진 인터뷰였던 만큼 한국의 주식 투자자들에게도 이 인터뷰는 화제가 됐었는데요. 방송에서 버핏 회장이 다시 한번 설파한 평소 지론들(“가격만 쳐다보고 있는 건 투자가 아니다”“좋은 회사에 장기 투자해야한다”…)은 불안에 떠는 투자자들에게도 큰 위안이 됐습니다.버핏 회장은 삼성전자의 구형 플립폰을 사용하고, 과거 포스코에도 투자하는 등 한국과 인연이 있는 인물입니다. 이날 방송에서도 그는 한국과의 작은 인연을 한두가지 추가로 공개했습니다.“미국 네브래스카주 오마하에 있는 그의 집에 삼성전자의 벽걸이 TV를 걸어두고 다양한 방송 프로그램을 시청한다”는 사회자와의 대화는 “삼성과 한국시장에 대해 어떻게 생각하느냐”라는 질문으로 이어졌습니다.버핏 회장은 “삼성전자가 100만원 하던 시절에 투자를 한 적이 있다”고 답변했습니다. 과거형 답변이었던 것을 보면, 지금은 보유하고 있지 않다는 뉘앙스로 해석됐습니다. 그는 “1997년 외환위기 직후 한국시장은 말도 안되게(ridiculously) 쌌다”고 설명했습니다. 좋은 주식을 싼 값에 싸 장기 보유하는 가치투자자 입장에서 볼 때 외환위기 직후 한국시장은 (한국 국민들에게는 고통스러운 현실이었지만) 훌륭한 투자처였음이 또 한번 확인된 셈입니다.흥미로왔던 건 “삼성전자가 100만원할 때…”라는 답변을 할 때 한국의 화폐단위인 ‘원(Won)’을 영어로 정확히 언급했다는 점이었습니다. 미국인으로서 원을 달러로 환산해 답하는 게 편했을텐데… 돈에 대한 그의 탁월한 감각을 느껴볼 수 있는 짧은 순간이었습니다.버핏 회장은 현재 한국 증시에 대한 견해는 방송에서 따로 밝히지 않았습니다. 버핏이 한국과 인연을 맺었던 외환위기 직후와는 또 달라진 지금의 한국을 ‘오마하의 현인’은 어떻게 보고 있을 지 궁금합니다. (끝) / scream@hankyung.com모바일한경은 PC·폰·태블릿에서 읽을 수 있는 프리미엄 뉴스 서비스입니다. [모바일한경 기사 더보기] [모바일한경 구독신청] ⓒ \'성공을 부르는 습관\' 한국경제신문, 무단 전재 및 재배포 금지한국경제 관련뉴스해당 언론사에서 선정하며 언론사 페이지(아웃링크)로 이동해 볼 수 있습니다.백종원, \'빽다방\'으로 돈방석에 앉더니 이제는…""안희정, 女 공무원들 사이서…"" 도청 직원들 반응""심상치 않다""…우리은행에 대체 무슨 일이?""LG·삼성 \'무선청소기\' 잘나가자…"" 다이슨 결국[영화, 영어를 만나다] 하버드의 \'공부벌레\'들좋아요0훈훈해요0슬퍼요0화나요0후속기사 원해요0기사제공 :']"
3,삼성전자, 2018-03-0809:10,데일리안 ,[개장]코스피 2420.67(18.85p↑)…외인 홀로 ‘순매수’,https://finance.naver.com/news/news_read.nhn?article_id=0002244771&office_id=119&mode=search&query=삼성전자&page=9,"[""       [개장]코스피 2420.67(18.85p↑)…외인 홀로 ‘순매수’      기사입력2018-03-08 09:10기사원문좋아요훈훈해요좋아요 평가하기공감좋아요0훈훈해요0슬퍼요0화나요0후속기사 원해요0댓글8일 코스피가 전 거래일보다 18.85포인트(0.78%) 오른 2420.67로 개장했다.ⓒ게티이미지8일 코스피가 전 거래일보다 18.85포인트(0.78%) 오른 2420.67로 개장했다. 이날 오전 9시 2분 현재 개인과 기관이 각각 134억원, 254억원을 팔아치우고 있지만 외국인이 393억원을 사들이면서 지수를 상승세로 이끌고 있다. 시가총액 상위권은 대체로 상승세다. 시총 1위 삼성전자는 전날보다 1.11% 오른 245만8000원에 거래되고 있으며, SK하이닉스(1.09%), 셀트리온(4.00%), 현대차(0.66%), 포스코(0.58%), 삼성바이오로직스(0.33%) 등도 상승 출발했다. 코스닥도 전날보다 6.28포인트(0.75%) 오른 847.31로 장을 시작했다. 오전 9시 5분 현재 개인과 기관이 각각 30억원, 17억원을 팔아치우고 있지만 외국인이 31억원을 사들이면서 지수를 견인하고 있다. 한편 이날 외환시장에서 원달러 환율은 전 거래일보다 2.20원 내린 1067.00원에 거래를 시작했다. 데일리안 배상철 기자 (chulcho@dailian.co.kr)ⓒ (주)데일리안 - 무단전재, 변형, 무단배포 금지데일리안 관련뉴스해당 언론사에서 선정하며 언론사 페이지(아웃링크)로 이동해 볼 수 있습니다.[마감]코스피 2401.82(9.58↓)…삼성전자 240만원 회복[개장]코스피 2413.39(1.98p↑)…코스닥은 약세[마감]코스피 2400선 안착…외인·기관 동반 '사자'[개장]코스피 2400.67(25.61p↑)…기관 홀로 '사자'[마감]코스피 2400선 붕괴…2375.06(27.10p↓)좋아요0훈훈해요0슬퍼요0화나요0후속기사 원해요0기사제공 :""]"
4,삼성전자, 2018-03-0809:05,한국경제 ,"[특징주]삼성전자 SK하이닉스,강세…""D램 가격, 3분기까지 상승""",https://finance.naver.com/news/news_read.nhn?article_id=0003904009&office_id=015&mode=search&query=삼성전자&page=9,"['       [특징주]삼성전자 SK하이닉스,강세…""D램 가격, 3분기까지 상승""      기사입력2018-03-08 09:05기사원문좋아요훈훈해요좋아요 평가하기공감좋아요0훈훈해요0슬퍼요0화나요0후속기사 원해요0댓글 삼성전자와 SK하이닉스가 강세를 이어가고 있다.8일 오전 9시 2분 현재 삼성전자는 전날보다 2만4000원(0.99%) 오른 245만5000원에 거래되고 있다. SK하이닉스도 1%대 강세다.현대차투자증권은 8일 D램 가격이 3분기까지는 매분기 상승할 것이라며 한국 메모리 반도체업체들의 실적 모멘텀이 이어질 것이라고 전망했다.이 증권사 노근창 연구원은 ""1분기 D램 가격은 PC D램이 전기대비 6.9%, 모바일 D램 2.9%, 서버 D램 3% 상승할 것으로 예상된다""며 ""계절적인 비수기에도 불구하고 HPC(High Performance Computing) 서버용 32GB/64GB D램 모듈 수요가 증가하면서 공급부족이 이어지고 있다""고 설명했다.그는 ""모바일 D램의 경우 여전히 서버 D램 대비 20% 이상 저렴한 상태""라며 ""D램 업체들도 모바일 D램 대비 서버 D램 비중을 높이고 있기 때문에 모바일 D램 가격이 하락하기는 어려울 전망""이라고 했다.한편 중국 메모리 업체 위험은 2020년 이후에나 고민해야 할 사안이라고 지적했다.노 연구원은 ""칭화유니그룹의 자회사인 YMTC와 애플이 스마트폰용 낸드 제품 공급 협상 가능성이 부각되면서 중국 업체들에 대한 리스크를 우려하는 시각이 있다""며 ""하지만, 이미 공급업체가 많은 낸드 시장에 기술력이 검증 안된 신규 업체 진입은 의미 있는 리스크도 아니며 그 시기는 2020년 이후가 될 것""이라고 진단했다.그는 ""D램의 경우 이노트론은 마이크론 특허에서 자유롭지 못하며, 진화 제품은 컨슈머 D램이라는 점에서 전혀 위험이 되지 못할 것으로 보인다""고 지적했다.이어 ""1분기에 계절적 비수기 영향으로 삼성전자와 SK하이닉스의 메모리 출하량이 전기대비 감소할 것으로 예상되지만, 2분기에는 D램 가격 상승과 출하량 증가가 동시에 나타나면서 실적 모멘텀이 재차 부각될 것""이라고 덧붙였다.정형석 한경닷컴 기자 chs8790@hankyung.com[한경닷컴 바로가기] [글방] [모바일한경 구독신청] ⓒ 한국경제 & hankyung.com, 무단전재 및 재배포 금지한국경제 관련뉴스해당 언론사에서 선정하며 언론사 페이지(아웃링크)로 이동해 볼 수 있습니다.""D램 가격, 3분기까지 상승…中 우려는 아직""-현대차삼성·SK, 모바일 D램 시장 \'넘사벽\'… 3분기 점유율 85.6%백종원, \'빽다방\'으로 돈방석에 앉더니 이제는…""안희정, 女 공무원들 사이서…"" 도청 직원들 반응""심상치 않다""…우리은행에 대체 무슨 일이?좋아요0훈훈해요0슬퍼요0화나요0후속기사 원해요0기사제공 :']"
5,삼성전자, 2018-03-0809:03,한국경제 ,(출발)삼성전자 246만0000원…1.19%↑,https://finance.naver.com/news/news_read.nhn?article_id=0003904008&office_id=015&mode=search&query=삼성전자&page=9,"['       (출발)삼성전자 246만0000원…1.19%↑      기사입력2018-03-08 09:03기사원문좋아요훈훈해요좋아요 평가하기공감좋아요0훈훈해요0슬퍼요0화나요0후속기사 원해요0댓글 한경닷컴[한경닷컴 바로가기] [글방] [모바일한경 구독신청] ⓒ 한국경제 & hankyung.com, 무단전재 및 재배포 금지한국경제 관련뉴스해당 언론사에서 선정하며 언론사 페이지(아웃링크)로 이동해 볼 수 있습니다.삼성전자 1분기 실적, 14조원대로 주춤할 듯""모바일 콘텐츠 사업 어렵네""…삼성전자 잇단 철수백종원, \'빽다방\'으로 돈방석에 앉더니 이제는…""안희정, 女 공무원들 사이서…"" 도청 직원들 반응""심상치 않다""…우리은행에 대체 무슨 일이?좋아요0훈훈해요0슬퍼요0화나요0후속기사 원해요0기사제공 :']"
6,삼성전자, 2018-03-0809:03,한국경제 ,(출발)삼성전자 246만0000원…1.19%↑,https://finance.naver.com/news/news_read.nhn?article_id=0003904007&office_id=015&mode=search&query=삼성전자&page=9,"['       (출발)삼성전자 246만0000원…1.19%↑      기사입력2018-03-08 09:03기사원문좋아요훈훈해요좋아요 평가하기공감좋아요0훈훈해요0슬퍼요0화나요0후속기사 원해요0댓글 한경닷컴[한경닷컴 바로가기] [글방] [모바일한경 구독신청] ⓒ 한국경제 & hankyung.com, 무단전재 및 재배포 금지한국경제 관련뉴스해당 언론사에서 선정하며 언론사 페이지(아웃링크)로 이동해 볼 수 있습니다.삼성전자 1분기 실적, 14조원대로 주춤할 듯""모바일 콘텐츠 사업 어렵네""…삼성전자 잇단 철수백종원, \'빽다방\'으로 돈방석에 앉더니 이제는…""안희정, 女 공무원들 사이서…"" 도청 직원들 반응""심상치 않다""…우리은행에 대체 무슨 일이?좋아요0훈훈해요0슬퍼요0화나요0후속기사 원해요0기사제공 :']"
7,삼성전자, 2018-03-0809:01,한국경제TV ,"삼성전자, 29,000원(1.19%) 오른 2,460,000원에 거래 시작",https://finance.naver.com/news/news_read.nhn?article_id=0000608976&office_id=215&mode=search&query=삼성전자&page=9,"['       삼성전자, 29,000원(1.19%) 오른 2,460,000원에 거래 시작      기사입력2018-03-08 09:01기사원문좋아요훈훈해요좋아요 평가하기공감좋아요0훈훈해요0슬퍼요0화나요0후속기사 원해요0댓글[한국경제TV 라이온봇 기자]3월 8일 삼성전자는 전일(2,431,000원) 대비 29,000원(1.19%) 오른 2,460,000원에 거래를 시작했다.라이온봇 기자 -한국경제TV※ 본 기사는 한국경제TV와 \'거장들의 투자공식이\'자체 개발한 \'라이온봇 기자\'가 실시간으로 작성한 기사입니다.라이온봇기자 ⓒ 한국경제TV, 무단 전재 및 재배포 금지한국경제TV 관련뉴스해당 언론사에서 선정하며 언론사 페이지(아웃링크)로 이동해 볼 수 있습니다.이상호 2억원, 여자컬링 0원…경기단체 포상금 \'천차만별\'이하늬 ""살찌면 외삼촌""…문희상 의원과 닮은꼴 \'깜짝\'전현무♥한혜진 열애, 티격태격 하다가 정 들었다스텔라 해체, 선정성 논란 부담됐나 ""갓 스무살에...""이윤미, 주영훈 몰카논란 사과 ""많이 생각하고 반성""좋아요0훈훈해요0슬퍼요0화나요0후속기사 원해요0기사제공 :']"
8,삼성전자, 2018-03-0809:01,디지털타임스 ,"튜터링, 갤럭시 S9 사전 예약 시 1:1 영어회화 6개월 무료 이벤트",https://finance.naver.com/news/news_read.nhn?article_id=0002451877&office_id=029&mode=search&query=삼성전자&page=9,"['       튜터링, 갤럭시 S9 사전 예약 시 1:1 영어회화 6개월 무료 이벤트      기사입력2018-03-08 09:01기사원문좋아요훈훈해요좋아요 평가하기공감좋아요0훈훈해요0슬퍼요0화나요0후속기사 원해요0댓글에듀테크 스타트업 튜터링이 삼성전자와 제휴하여 \'갤럭시 S9 사전 예약 이벤트\'를 진행한다고 8일 밝혔다. 8일 19시 전까지 사전 예약을 하면 삼성전자 기본 사은품과 더불어 1:1 영어회화 튜터링 6개월 수강권을 무료로 받을 수 있다.튜터링은 언제 어디서나 30초 만에 해외에 있는 원어민과 연결하여 실시간 레슨을 제공하는 모바일 원어민 회화 학습 어플리케이션이다. 런칭 후 입소문을 타며 현재까지 30만 명의 수강생을 모아 화제를 일으켰다. 현재 중국어회화를 추가 런칭해 서비스 중이다. 이번 \'튜터링 갤럭시 S9 사전 예약 이벤트\'는 삼성전자와 튜터링의 제휴를 통해 진행되는 특별 이벤트로 60만 원 상당의 혜택을 제공한다.사전 예약을 통해 제공되는 삼성전자의 혜택은 하만 AKG 유무선헤드폰, DeX Pad, 디스플레이 파손 교체 비용 50% 지원, 검은 사막 게임 아이템, 왓챠플레이 3개월 이용권 등이 있다.여기에 추가로 해외의 원어민 튜터와 6개월간 영어회화 수업을 할 수 있는 30만 원 상당의 튜터링 Global 6개월 수강권을 증정한다.튜터링의 박희철 마케팅 매니저는 ""스마트폰으로 해외에 있는 원어민과 실시간 학습을 할 수 있는 튜터링과 스마트폰의 혁신이라고 할 수 있는 갤럭시 S9의 제휴를 통해 더 많은 고객분들이 혜택을 누리기 바란다.""라고 전했다. 사전 예약 관련 모든 문의 및 신청은 사전예약 센터를 통해 진행된다. 자세한 사항은 튜터링 갤럭시S9 사전 예약 이벤트 페이지를 통해 확인할 수 있다.kyh@dt.co.kr 디지털타임스 홈페이지 바로가기 디지털타임스 영문뉴스 바로가기 / 카드뉴스 바로가기인터넷마케팅팀디지털타임스 관련뉴스해당 언론사에서 선정하며 언론사 페이지(아웃링크)로 이동해 볼 수 있습니다.초과이익 내줄바엔… 강남지역 \'1대1 재건축\' 붐유럽선 \'퇴출신세\' 디젤차, 한국선 인기 식지않는 이유AI음성인식 \'키즈워치\' … 불붙는 통신·포털 \'키즈폰 대전\'국회, 내달 \'합산규제\' 원포인트 논의·결론글 쓰면 알아서 \'웹툰\' 제작… 삼성 C랩 최신기술 눈길좋아요0훈훈해요0슬퍼요0화나요0후속기사 원해요0기사제공 :']"
