,회사명,날짜,언론사,기사제목,링크,본문
18,삼성전자, 2018-10-1417:12,서울신문 ,르노삼성 SM6 프라임 타고 “내가 간다 하와이~”,https://finance.naver.com/news/news_read.nhn?article_id=0002948775&office_id=081&mode=search&query=삼성전자&page=1,"[""       르노삼성 SM6 프라임 타고 “내가 간다 하와이~”      기사입력2018-10-14 17:12기사원문좋아요훈훈해요좋아요 평가하기공감좋아요0훈훈해요0슬퍼요0화나요0후속기사 원해요0댓글 [서울신문]르노삼성자동차가 ‘SM6 프라임’ 출시를 기념해 SM6와 QM6 전국 시승 이벤트를 연다. 시승 후 차량을 출고하는 고객에게는 하와이 왕복 항공권 등 풍성한 혜택도 마련돼있다.르노삼성자동차는 오는 28일까지 SM6와 QM6를 경험할 수 있는 ‘6ix in the CITY(식스 인 더 시티)’ 전국 시승 이벤트를 실시한다고 14일 밝혔다. 이번 이벤트는 전국 르노삼성자동차 217개 영업점에서 진행되며, 신규 모델인 ‘SM6 프라임’과 국내 중형 가솔린 SUV 판매 1위 ‘QM6 GDe’ 등 다양한 SM6 및 QM6 모델들을 대상으로 한다. SM6 프라임은 최고 출력 140마력의 2.0 가솔린 엔진과 세계 최대 무단변속기 제조사인 자트코(JATCO)사의 최신 ‘X-tronic’을 결합해 부드럽고 안정적인 주행 성능을 선사하고, 합리적인 가격에 다양한 편의사양을 기본 탑재했다.‘6ix in the CITY’ 전국 시승 이벤트 참여는 르노삼성자동차 홈페이지(www.renaultsamsungM.com) 또는 각 영업점에서 신청 후 가능하다. 시승 후 10월 28일까지 차량을 출고하는 고객에게는 추첨을 통해 하와이 2인 왕복 항공권과 힐튼 하와이언 빌리지 4박 숙박권으로 구성된 ‘하와이 4박6일 여행권’(총1명)과 삼성전자의 의류청정기 ‘에어드레서’(총3명)를 증정한다.김소라 기자 sora@seoul.co.kr▶  재미있는 세상[나우뉴스] ▶ [인기 무료만화] [페이스북]ⓒ 서울신문(www.seoul.co.kr), 무단전재 및 재배포금지서울신문 관련뉴스해당 언론사에서 선정하며 언론사 페이지(아웃링크)로 이동해 볼 수 있습니다.교비로 명품백에 성인용품까지…사립유치원 운영 '가관'일본, 제주 관함식 이순신 상징기 게양에 항의임우재, 장자연과 통화할 때 쓴 휴대폰 명의자가…정신나간 어린이집 원장 남편, 7살 여아에 포르노를이번엔 동영상…판빙빙에 악재 자꾸 불거지는 이유좋아요0훈훈해요0슬퍼요0화나요0후속기사 원해요0기사제공 :""]"
19,삼성전자, 2018-10-1417:10,서울경제 ,[사진] 고성능 포르쉐와 만난 삼성전자 'LED 포 홈',https://finance.naver.com/news/news_read.nhn?article_id=0003415768&office_id=011&mode=search&query=삼성전자&page=1,"[""       [사진] 고성능 포르쉐와 만난 삼성전자 'LED 포 홈'      기사입력2018-10-14 17:10기사원문좋아요훈훈해요좋아요 평가하기공감좋아요0훈훈해요0슬퍼요0화나요0후속기사 원해요0댓글[서울경제] 삼성전자 모델들이 14일 초대형 스크린의 감동을 집에서 느낄 수 있도록 해주는 ‘LED 포 홈(LED for Home)’을 포르쉐 고성능차인 ‘911 GT3’ 앞에서 소개하고 있다. 삼성전자는 오는 17일까지 말레이시아 세팡 국제 자동차 경기장에서 개최되는 ‘포르쉐 익스피리언스’ 행사에 109형 초대형 발광다이오드(LED) 사이니지 LED 포 홈 IF P1.2 시리즈를 전시한다. /사진제공=삼성전자 [서울경제 바로가기]프리미엄 미디어 Signal이 투자의 바른 길을 안내합니다 [바로가기▶]서울경제ㆍ서울시 주최 블록체인 이벤트 ‘ABF in Seoul’ [바로가기▶]저작권자 ⓒ 서울경제, 무단 전재 및 재배포 금지좋아요0훈훈해요0슬퍼요0화나요0후속기사 원해요0기사제공 :""]"
0,삼성전자, 2018-10-1417:08,스포츠동아 ,"르노삼성자동차, SM6 & QM6 전국 시승이벤트",https://finance.naver.com/news/news_read.nhn?article_id=0000680665&office_id=382&mode=search&query=삼성전자&page=2,"['       르노삼성자동차, SM6 & QM6 전국 시승이벤트      기사입력2018-10-14 17:08기사원문좋아요훈훈해요좋아요 평가하기공감좋아요0훈훈해요0슬퍼요0화나요0후속기사 원해요0댓글르노삼성자동차는 ‘SM6 프라임’ 출시를 기념해 28일까지 풍부한 혜택으로 SM6와 QM6를 경험해볼 수 있는 ‘6ix in the CITY(식스 인 더 시티)’ 전국 시승 이벤트를 실시한다. SM6 프라임은 인기 사양을 탑재하고도 합리적인 가격을 갖춘 모델이다. 시승 후 28일까지 차량을 출고하면 추첨을 통해 하와이 4박6일 여행권(총 1명), 삼성전자 의류청정기 ‘에어드레서’(총 3명) 경품을 증정한다. 또한 10월 한 달간 SM6 및 QM6 구매 시 최대 300만원의 현금 지원을 제공한다.스포츠동아 원성열 기자 sereno@donga.com▶ 연예현장 진짜 이야기  / 후방주의! 스타들의 아찔한 순간▶ 너만 볼 수 있는 스타들의 짤 ‘봇.덕.방’ GOGO- Copyrights ⓒ 스포츠동아(http://sports.donga.com) 무단 전재 및 재배포 금지 -스포츠동아 관련뉴스해당 언론사에서 선정하며 언론사 페이지(아웃링크)로 이동해 볼 수 있습니다.임성민, 결혼 8년만에 왜…남편 충격 고백옥소리, 전남편 불륜 이혼 후 충격 근황\'김민희 남친\' 홍상수, 아내와 또다시…세상에이재명, 김부선 반격 ""주요부위 점? 공개…참담""유승준, 예상하지 못한 근황…대박 사건좋아요0훈훈해요0슬퍼요0화나요0후속기사 원해요0기사제공 :']"
1,삼성전자, 2018-10-1417:04,서울경제 ,"김기문 제이에스티나 회장 ""엄중한 시기···중소기업계 위기 타개 앞장설 것""",https://finance.naver.com/news/news_read.nhn?article_id=0003415760&office_id=011&mode=search&query=삼성전자&page=2,"['       김기문 제이에스티나 회장 ""엄중한 시기···중소기업계 위기 타개 앞장설 것""      기사입력2018-10-14 17:04기사원문좋아요훈훈해요좋아요 평가하기공감좋아요0훈훈해요0슬퍼요0화나요0후속기사 원해요0댓글""주어진 역할 다해 중심 잡을것개성공단기업협회장 경험살려남북관계 변화에도 힘 쓰겠다제이에스티나 中매출 성장 기대""김기문 제이에스티나 회장이 지난 11일 베이징 시내의 한 호텔에서 서울경제신문과 만나 중국 진출에 대한 포부를 밝히고 있다.   /베이징=홍병문기자[서울경제] “남북관계가 급변하고 미중 무역분쟁이 격화되는 지금 같은 시기에 중견·중소기업들이 중심을 잡고 제 역할을 해야 합니다. 중소기업계로서는 한치 앞도 내다볼 수 없는 엄중한 시기인 만큼 이러한 시대적 부름 속에서 저 역시 제게 주어진 역할을 다하고자 합니다.”김기문(63·사진) 제이에스티나(026040) 회장은 지난 11일(현지시간) 주중 한국대사관 주최로 베이징대사관에서 열린 ‘2018년 대한민국 국경일 및 국군의 날 기념 리셉션’에서 서울경제신문과 단독으로 만나 “중소기업계에 몸담고 계신 수많은 기업인들이 여러 어려움을 성토하면서 우리 앞에 닥친 위기를 타개하기 위해서는 제가 앞에 나서 역할을 해야 한다는 권유가 많았다”며 “중소기업계가 당면한 현실이 엄중한 만큼 뒤늦게라도 결심을 하고 제게 주어진 역할에 최선을 다하고자 한다”고 말했다. 김 회장이 우회적으로 중소기업중앙회장 선거 출마를 밝힌 것으로 현재 공식·비공식적으로 출마를 밝힌 후보군은 김 회장(진해마천주물공단사업조합 이사장, 이하 가나다 순)을 비롯해 곽기영 보국전기공업 대표(전기조합 이사장), 원재희 프럼파스트 대표(폴리부틸렌조합 이사장), 이재광 광명전기 회장(전기에너지산업조합 이사장), 이재한 한용산업 대표(주차설비조합 이사장),주대철 세진텔레시스 대표(방송통신산업조합 이사장) 등이다. 김기문 제이에스티나 회장이날 주중대사관에서 열린 ‘2018년 대한민국 국경일 및 국군의 날 기념 리셉션’에는 쿵쉬안유 중국 외교부 부부장(차관급) 겸 한반도사무 특별대표가 중국 측 주빈으로 참석해 이목을 끌었다. 고고도미사일방어체계(THAAD·사드)의 한반도 배치 이슈로 한중 간 갈등이 한창이던 지난 2016년에는 중국 측 주빈이 참석하지 않았고 지난해에도 관례였던 차관급 이상 인사 대신 차관보가 참석했던 것과 비교하면 분위기가 확연히 달라졌다는 게 외교가의 공통된 해석이다. 쿵 부부장 등 중국 각계의 주요 인사와 중국 주재 외교단 등 1,000여명이 참석한 이날 행사에는 중국인들에게 크게 사랑받는 한류 기업들이 초청됐는데 중견·중소기업으로는 유일하게 주얼리 브랜드인 ‘제이에스티나’가 삼성전자·LG전자·현대차·아모레퍼시픽 등 쟁쟁한 대기업들과 어깨를 나란히 했다. 1대 개성공단기업협회장(2006~2008)에 이어 중소기업중앙회장을 두 차례(2007~2011, 2011~2015) 지낸 김 회장은 “남북 화해 무드와 한중관계 회복 시기를 맞아 가까운 장래에 개성공단이 다시 가동될 것을 확신한다”면서 “개성공단에 시계 부문(로만손) 조립생산 공장에 이어 새롭게 주얼리 합작 공장을 세우겠다”고 밝혔다. 개성공단에서 생산된 제품은 ‘메이드 인 코리아’ 상표를 붙이고 중국에 수출할 수 있어 가격 경쟁력을 바탕으로 한류 브랜드에 친숙한 중국 고객들에게 한층 더 가깝게 다가설 수 있다는 이유에서다. 김 회장은 “중국이 장막을 완전히 걷어내고 있지는 않지만 우리 기업들에 중국은 여전히 큰 기회의 시장”이라며 “사드라는 부담 요인에도 불구하고 중국인들이 선호하는 한국 브랜드의 인기가 많고 판매도 꾸준하다는 것은 브랜드 가치가 그만큼 중요하다는 방증”이라고 강조했다. 올해 창립 30주년을 맞은 제이에스티나는 미래 성장동력 중 하나로 중국 시장을 내세우고 있다. 중국 시장에서의 성공을 발판으로 동남아시아와 중동 시장 등으로 영토를 확장하겠다는 전략이다. ‘태양의 후예’ 제작 지원을 통해 중국 시장에서 브랜드 파워를 높인 제이에스티나는 올해 온라인 마케팅을 강화해 중국 광군제(11월11일)에서 하루 매출 8억원 달성을 목표로 삼았다. 지난해까지만 해도 알리바바나 징둥 온라인 매장 운영을 위해 대행사를 활용했지만 올해는 오너십을 가지고 플래그숍에 제품을 선보일 수 있기 때문에 수익성은 물론 브랜드 경쟁력도 끌어올릴 것으로 기대하고 있다.김 회장은 “알리바바에서도 아시아 주얼리 업체 가운데 제이에스티나가 최고 가치의 브랜드라는 사실을 인정하고 있다”면서 “올해는 온라인 마케팅 등을 강화해 중국 매출 50억~60억원을 달성할 수 있을 것”이라고 기대감을 내비쳤다. 이런 추세라면 내년에는 중국 시장에서 100억원 매출 달성이 가능하다는 전망이다. 그는 “중국 시장에서 매출이 100억원 규모로 성장한다면 자연스럽게 현지 투자자들의 관심도 커지는 만큼 내후년께 현지 합작법인 설립도 기대할 수 있다”고 내다봤다.      /베이징=홍병문특파원 hbm@sedaily.com[서울경제 바로가기]프리미엄 미디어 Signal이 투자의 바른 길을 안내합니다 [바로가기▶]서울경제ㆍ서울시 주최 블록체인 이벤트 ‘ABF in Seoul’ [바로가기▶]저작권자 ⓒ 서울경제, 무단 전재 및 재배포 금지좋아요0훈훈해요0슬퍼요0화나요0후속기사 원해요0기사제공 :']"
2,삼성전자, 2018-10-1416:44,한국경제 ,"증시 반등, 실적 호전株에 달려…삼성전자·SK하이닉스 유망",https://finance.naver.com/news/news_read.nhn?article_id=0004025594&office_id=015&mode=search&query=삼성전자&page=2,"['       증시 반등, 실적 호전株에 달려…삼성전자·SK하이닉스 유망      기사입력2018-10-14 16:44기사원문좋아요훈훈해요좋아요 평가하기공감좋아요0훈훈해요0슬퍼요0화나요0후속기사 원해요0댓글방송에서 못다한 이야기 - 안인기 파트너18일 美 FOMC 의사록 촉각글로벌 시장의 단기 하락폭이 크다. 금리 인상에 따라 주식시장 자금이 채권시장으로 옮겨가고 있다. 채권금리 급등과 경기 둔화 우려감, 그리고 미·중 무역분쟁 지속이 시장 분위기를 악화시켰다. 예상을 뛰어넘는 채권금리 상승이 글로벌 증시 급락을 불러온 만큼 오는 18일 발표될 연방공개시장위원회(FOMC) 의사록에서 미국 금리 인상 경로에 대한 불확실성이 해소된다면 단기 저점 확인에 도움이 될 것이란 전망이다. 심리나 수급적으로 국내 주식시장이 바닥 또는 V자 반등을 확신하기엔 주변 여건이 불안하지만 이대로 시장이 끝나지는 않을 것으로 보인다.향후 미국과 중국의 갈등이 해소되려는 모습이 나타나거나 미국의 추가 금리 인상에 대한 우려가 완화될 경우 지수는 의미 있는 반등이 나타날 것이다. 미국 중앙은행(Fed)은 올 12월 금리를 인상한 뒤 내년에도 추가로 3회 금리 인상을 예고하고 있어 투자심리가 쉽게 회복하긴 어렵다는 판단이지만 단기적 급락이 연출된 만큼 지지력이 발휘될 수 있는 구간이다. 미국과 중국이 다음달 주요 20개국(G20) 정상회의에서 따로 만날 계획을 추진 중인 것으로 알려졌지만, 무역갈등이 해소 국면에 들어가긴 어려울 것이라는 관측이 지배적이다. 지난 11일 워싱턴포스트는 도널드 트럼프 미국 대통령과 시진핑 중국 국가주석이 다음달 아르헨티나에서 열리는 G20 정상회의에서 미·중 무역갈등 해소를 위한 회담을 할 것이라고 보도했다.기술주들의 밸류에이션 부담 완화에 따른 나스닥시장의 안정은 한국 시장에서 외국인 수급 안정에 필요 조건이라고 생각된다. 전통적으로 10월에는 약세장이 연출되는 경우가 많았지만, 시장 에너지는 개선될 수 있을 것으로 전망한다. 최근 우리 시장은 고점에서 230포인트 이상 급락이 연출됐지만 조정 이후 시장이 기술적인 되반등을 기대할 수 있는 구간이다. 코스피지수는 2222선까지의 회복, 코스닥지수는 747포인트까지의 단기적 반등이 예상된다. 시가총액 상위주와 업종대표주, 그리고 외국인과 기관 비중이 큰 실적호전주가 반등을 이끌 것으로 보인다.3분기에 17조5000억원의 영업이익을 기록한 삼성전자를 중심으로 SK하이닉스가 지수 상승을 리드할 것으로 보인다. 두 종목 모두 외국인과 기관의 선호주고, 실적개선주, 그리고 업종을 대표하는 지수 관련주다. 3분기 실적 개선은 4분기까지 이어질 전망이고, 내년 1분기까지는 실적 향상 가능성이 높기 때문에 외국인과 기관 매수가 가담한다면 이 두 종목에 대한 적극적인 매수가 이어질 수 있다. 제약, 바이오에서도 낙폭 과대주에서의 반등이 연출될 수 있다.에이치엘비, 신라젠 등 임상을 완료하고 있는 볼륨 있는 종목들의 되반등이 연출될 수 있고, 2차전지·전기차에서는 삼성SDI, 포스코켐텍이 상승 중심에 있다. 남북한 경제협력주는 단기적으로 상승 모멘텀이 약하지만, 11월 이후 미·북 정상회담 기대와 향후 남북 경제협력의 모멘텀이 분명한 만큼 조정 이후 상승을 기대할 수 있다. 일부 이슈주, 뉴스주도 탄력적인 움직임을 예상할 수 있다.단기적 매매전략으로는 장초반부터 외국인과 기관이 동시에 매매하는 종목으로 집중하는 것이 좋다. 필자는 최근 매매기법으로 ‘돈맥기법’을 강조하고 있다. 외국인·기관 동반 매수주, 상승추세주, 업종 대표주, 실적 호전주, 상승 모멘텀주, 거래량 수반 및 양봉주로 매매하는 전략만 취하면 오랫동안 시장에서 계좌 상승을 만들 수 있다.향후 시장이 개선된다면 SK하이닉스가 반등의 중심에 있을 것으로 본다. 최근 미국 기술주 급락과 반도체업황 우려 속에 하락추세가 연출되면서 지난 2월 이후 8개월 만에 7만원 선을 내줬던 SK하이닉스는 악재가 대부분 반영됐기 때문에 반등할 기회를 포착할 수 있다고 판단한다. SK하이닉스 주가는 12개월 선행 주가순자산비율(PBR) 1배로, D램 가격 하락 가능성에 대한 우려가 시장에 충분히 반영됐다는 것을 의미한다. 올 4분기와 내년 1분기 실적도 낮아진 시장 눈높이를 웃돌 가능성이 높아진 상황이다.최근 외국인·기관 매수세가 유입되는 구간이므로 7만원 전후의 매수 전략이 바람직하고, 중기적 상승의 목표치는 7만7000원대까지 회복을 기대할 수 있다.안인기 프로필(수상경력)-2018년 2분기, 3분기 수익률 베스트-2018년 6월, 7월, 8월, 9월 월간 수익률 베스트-2018년 베스트파트너 총 20회[한경닷컴 바로가기] [모바일한경 구독신청] 글로벌 블록체인 프론티어 코리아! 2018 코리아 블록체인 엑스포 [바로가기] ⓒ 한국경제 & hankyung.com, 무단전재 및 재배포 금지한국경제 관련뉴스해당 언론사에서 선정하며 언론사 페이지(아웃링크)로 이동해 볼 수 있습니다.""서울 청약 사실상 물 건너갔다""…1주택자 \'눈물\'""너무 예뻐서 연락했어요""…낯선 남자 문자에 경악차값만 1억 넘는데…\'뉴 레인지로버 스포츠\' 타보니천냥 김밥이 사라졌다…외식비 얼마나 올랐길래""반차내고 쉬는데 엉망됐다""…靑 인근 주민의 \'호소\'좋아요0훈훈해요0슬퍼요0화나요0후속기사 원해요0기사제공 :']"
3,삼성전자, 2018-10-1416:38,한국일보 ,"‘LG V40 씽큐’ 104만9,400원에 24일 국내 출시",https://finance.naver.com/news/news_read.nhn?article_id=0000333840&office_id=469&mode=search&query=삼성전자&page=2,"['       ‘LG V40 씽큐’ 104만9,400원에 24일 국내 출시      기사입력2018-10-14 16:38기사원문좋아요훈훈해요좋아요 평가하기공감좋아요0훈훈해요0슬퍼요0화나요0후속기사 원해요0댓글1년여 만에 프리미엄 폰의 기준이 된 100만원후면 3개에 전면 2개 카메라가 탑재된 LG V40 씽큐. LG전자 제공LG전자의 하반기 전략 스마트폰 ‘LG V40 씽큐(ThinQ)’ 국내 가격이 104만9,400원으로 정해졌다. 지난해 상반기 삼성전자가 갤럭시S8플러스를 출시한 이후 프리미엄 스마트폰의 가격대가 100만원대로 굳어지는 모습이다.LG전자는 오는 17일부터 23일까지 1주일간 이동통신 3사 전 매장에서 V40 씽큐 예약 판매를 진행하고 24일 공식 출시한다고 14일 밝혔다.LG전자는 예약 고객에게 1년간 전면 디스플레이와 후면 커버 각각 1회 무상 교체 혜택을 제공한다. 후면 커버는 파손되지 않아도 1년 안에 색상을 한번 바꿀 수 있다.예약을 포함해 모든 V40 씽큐 고객은 18개월이나 24개월 뒤 구매 가격의 최대 40%까지 보상받는 ‘업그레이드 프로그램’ 이용이 가능하다. 기기를 반납하고 최신 스마트폰을 사면 최대 42만원을 보상받는다. LG전자 안병덕 모바일마케팅담당은 “사용하면서 체감하는 혜택을 늘리고, 사후 지원도 강화해 V40 씽큐를 부담 없이 즐길 기회를 넓혀 나가겠다”고 밝혔다.모델이 후면 트리플 카메라가 적용된 LG V40 씽큐를 소개하고 있다. LG전자 제공지난해 하반기 V30를 내놓을 때까지도 출고가를 100만원 미만으로 유지한 LG전자는 올해 3월 V30S 씽큐(104만8,300원)와 V30S플러스 씽큐(109만7,800원)를 선보이며 100만원대 프리미엄 스마트폰 대열에 합류했다. 지난 7월 출시한 V35 씽큐도 104만8,300원이었다.지난해 초까지 스마트폰 제조사들에 100만원은 소비자의 심리적 저항선으로 여겨졌지만, 갤럭시S8플러스가 115만5,000원에 출시돼 인기를 끌자 분위기가 달라졌다. 작년 하반기 삼성 갤럭시노트8은 기본 모델이 109만4,500원에 출시됐고, 애플 아이폰X(텐)은 142만원부터 시작했다. 올해 나온 삼성 갤럭시S9플러스와 갤럭시노트9도 100만원 이상이다. 심지어 다음 달 초 국내 출시 예정인 아이폰XS맥스는 200만원에 육박할 것으로 전망된다.100만원 이상 가격으로 올해 출시된 삼성 갤럭시S9플러스(왼쪽)와 갤럭시노트9(가운데), 200만원에 이르는 초고가 스마트폰 애플 아이폰XS맥스. 각 사 제공방송통신위원회가 박광온 더불어민주당 의원에게 제출한 자료에 따르면 지난해 이후 이동통신 3사가 출시한 프리미엄 스마트폰 67개 중 34개가 100만원 이상이었다. SK텔레콤의 가격대별 판매량 자료에서도 100만원 이상 스마트폰 비중은 지난해 1분기 13.5%에서 4분기 39.9%로 세 배 가까이 늘었다. 반면 80만원대 스마트폰은 같은 기간 26.3%에서 1.8%로 급감했다. 박 의원은 “80만원대 스마트폰이 자취를 감춘 것은 제조사가 출시를 줄였기 때문”이라며 “지난해 이후 출시된 67개 프리미엄 모델 중 80만원대 스마트폰은 7종에 불과했다”며 휴대폰 제조사들의 가격 올리기를 비판했다.김창훈 기자 chkim@hankookilbo.com▶[개편이벤트] 참여하면 화장품세트와 블루투스 스피커를 드려요!▶네이버 채널에서 한국일보를 구독하세요!\xa0한국일보 관련뉴스해당 언론사에서 선정하며 언론사 페이지(아웃링크)로 이동해 볼 수 있습니다.이재명 ""동그랗고 까만점 없다"" 신체검증 예고오죽했으면… ""상습폭행 아들, 이번엔 처벌해달라""밀워키 졌지만, 12연승 공짜 햄버거는 \'전통대로\'교통사고 빈번… 하이패스 운전 불편한 이유 있었네""집을 왜 할인해 파나"" 중국서 반발 시위좋아요0훈훈해요0슬퍼요0화나요0후속기사 원해요0기사제공 :']"
