,회사명,날짜,언론사,기사제목,링크,본문
2,삼성전자, 2018-03-0815:53,이데일리 ,"[마감]코스피, 2430선 회복…셀트리온 9% 급등",https://finance.naver.com/news/news_read.nhn?article_id=0004051908&office_id=018&mode=search&query=삼성전자&page=3,"['       [마감]코스피, 2430선 회복…셀트리온 9% 급등      기사입력2018-03-08 15:53기사원문좋아요훈훈해요좋아요 평가하기공감좋아요0훈훈해요0슬퍼요0화나요0후속기사 원해요0댓글기관 집중매수…의약품·철강 등 업종 강세시총상위株↑…삼성전자 3일째 상승[이데일리 이후섭 기자] 코스피지수가 `네 마녀의 날`에 1% 넘게 오르며 2430선을 회복했다. 기관이 집중 매수에 나선 가운데 의약품·철강 등의 업종이 강세를 보였다. 셀트리온(068270)은 코스피200지수 특례 편입을 앞두고 급등했다.8일 마켓포인트에 따르면 코스피지수는 전날대비 31.26포인트(1.30%) 오른 2433.08로 장을 마감했다. 2420선 초반에서 상승 출발한 이날 지수는 줄곧 강세를 이어갔다. 간밤 미국 뉴욕증시는 무역전쟁 우려 속에 혼조세를 보였다. 다우존스30 산업평균지수와 스탠더드앤드푸어스(S&P) 500지수가 전날대비 각각 0.33%, 0.05% 하락한 반면 나스닥지수는 0.33% 올랐다. 유가증권시장에서 기관이 5822억원어치 주식을 사들이며 하루만에 순매수로 돌아섰다. 금융투자(4820억원), 보험(806억원), 연기금(615억원), 사모펀드(348억원) 국가·지자체(220억원) 등이 매수 우위를 보였다. 개인과 기관은 각각 4114억원, 1770억원 순매도했다. 올해 첫 선물옵션동시 만기일로 최근 외국인 투자자의 선물 매도에 따라 장 후반 변동성이 커질 우려가 제기됐으나 프로그램 매매 수급은 1028억원 순매도에 그쳤다.업종별로 살펴보면 의약품이 4% 넘게 뛰었으며 철강금속, 건설업, 기계, 음식료업, 섬유의복, 종이목재, 운수장비, 서비스업 등도 상승 마감했다. 반면 의료정밀, 통신업, 운수창고, 전기가스업, 은행 등은 약세를 면치 못했다.시가총액 상위종목도 대다수 강세를 보였다. 전날 대규모 블록딜 소식에 12% 넘게 하락했던 셀트리온은 하루만에 반등에 나서며 9% 가까이 올랐다. 삼성전자(005930) SK하이닉스(000660) 삼성전자우(005935) 현대차(005380) POSCO(005490) 삼성바이오로직스(207940) LG화학(051910) NAVER(035420) KB금융(105560) 등도 상승했다. 개별종목별로는 골든브릿지증권(001290) 부산주공(005030) 삼일제약(000520) 무림페이퍼(009200) 송원산업(004430) 삼성중공업(010140) 고려산업(002140) 등의 주가 상승세가 두드러졌다. 신원우(009275) 대한해운(005880) 광명전기(017040) 부국증권우(001275) 신원(009270) 신화실업(001770) 흥국화재우(000545) 일성건설(013360) 등은 상대적으로 큰 낙폭을 보였다.이날 거래량은 3억9066만주, 거래대금은 8조8746억원으로 집계됐다. 상·하한가 없이 544개 종목이 올랐으며 267개 종목은 내렸다. 74개 종목은 보합권에 머물렀다.이후섭 (dlgntjq@edaily.co.kr)▶ 암호(가상)화폐에 대한 모든 것!▶ 네이버 메인에서 ‘이데일리’ 구독하기▶ \'이데일리\'의 카톡 친구가 되어주세요~♥＜ⓒ종합 경제정보 미디어 이데일리 - 무단전재 & 재배포 금지＞이데일리 관련뉴스해당 언론사에서 선정하며 언론사 페이지(아웃링크)로 이동해 볼 수 있습니다.""검찰, 빨리 소환해달라"" 안희정, 기자회견 전격 취소[세모뉴스] \'펜스룰\' 확산에 여성들 또 눈물 흘린다박수현 내연녀 아냐 공주시의원, 檢고소..경쟁후보 지지자 소행?\'안희정 성폭력\' 추가 폭로… 대선 기간에도 성폭행남궁연이 수차례 성폭행.. 거부하면 욕설 다섯 번째 미투 폭로좋아요0훈훈해요0슬퍼요0화나요0후속기사 원해요0기사제공 :']"
3,삼성전자, 2018-03-0815:52,머니투데이 ,네 마녀 심술 없었다… 코스피·코스닥 1% 상승,https://finance.naver.com/news/news_read.nhn?article_id=0004020429&office_id=008&mode=search&query=삼성전자&page=3,"['       네 마녀 심술 없었다… 코스피·코스닥 1% 상승       기사입력2018-03-08 15:52기사원문좋아요훈훈해요좋아요 평가하기공감좋아요0훈훈해요0슬퍼요0화나요0후속기사 원해요0댓글 [머니투데이 송선옥 기자] [[시황종합]기관, 장 막판 코스피 순매수 강화… 셀트리온, 외인 매도에도 8% 급등 ]3월 선물옵션 동시만기일을 맞은 8일 코스피 시장은 장 막판 기관의 대규모 순매수에 힘입어 2430대를 회복했다. 코스닥도 바이오 업종의 강세로 상승마감했다. 게리 콘 미국 백악관 국제경제위원회(NEC) 위원장의 사임에도 미 뉴욕증시가 비교적 크게 떨어지지 않았다는 소식에 상승 개장한 코스피는 한때 삼성전자와 SK하이닉스의 선전으로 2420선을 돌파했으나 기관의 매도 공세에 상승폭을 줄였다. 그러나 장 마감을 앞두고 기관이 대규모 순매수를 기록하면서 1% 넘게 올랐다. 코스닥도 장 막판 외국인의 순매수 확대로 1% 이상 올라 850대에 안착했다.  ◇셀트리온, 기관 매수에 8% 급등=코스피 지수는 전일대비 31.26포인트(1.30%) 오른 2433.08로 장을 마쳤다. 코스피 시장에서는 외국인이 장중 ‘팔자’로 전환, 1742억원 순매도했다. 개인이 4289억원 순매도인 반면 기관이 5968억원 순매수다. 프로그램 매매는 차익거래 112억원 순매도, 비차익거래 773억원 순매수 등 전체 660억원 매수 우위다. 지수선물 시장에서는 외국인이 6317계약 순매수다. 개인과 기관이 각각 1186계약, 5352계약 순매도다. 대부분의 업종이 상승했다. 의약품이 4.10% 올랐으며 철강금속 섬유의복 종이목재 기계 전기전자 운송장비 유통업 건설업 증권 보험 등이 상승마감했다. 의료정밀 전기가스업 운수창고 통신업 은행  등이 내렸다. 시총 상위종목 상당수가 상승마감했다. 삼성전자는 외국인 매수세에 힘입어 1.19% 상승한 246만원으로 마감했다. 사흘 연속 상승이다. 이는 지난달 1일(종가 249만1000원) 이후 최고가다. SK하이닉스가 기관의 매도에도 외국인 매수에 0.97% 올라 8만3500원으로 장을 마쳤다. 5거래일 연속 상승이다. 셀트리온이 전일 급락에 따른 저가매수세 유입과 코스피200 특례편입 기대감에 8.92% 올랐다. 외국인이 5129억원 순매도한 반면 기관이 8530억원 순매수했다. 현대차가 1.31% 올랐으며 POSCO가 3.02% 상승마감했다. 삼성바이오로직스 LG화학 NAVER KB금융 삼성물산 삼성생명 신한지주 현대모비스 SK 등이 올랐다. 오뚜기가 4분기 어닝 서프라이즈로 6.80% 상승마감했다. 6거래일만의 반등이다. 조선업 관련주들이 업황 회복 기대감에 동반 강세다. 삼성중공업이 8.79% 올랐으며 현대중공업이 5.47% 상승했다. 현대미포조선 대우조선해양 등도 상승마감했다. 삼일제약이 지방간 치료제가 미국 임상2b상 결과를 바탕으로 연내 국내 임상3상에 돌입할 계획이라는 소식에 13.37% 급등했다. 545개 종목이 상승, 267개 종목이 하락했다. ◇코스닥, 외인 \'사자\'에 850대 안착=코스닥 지수는 전일대비 12.91포인트(1.54%) 하락한 853.94로 마감했다. 코스닥 시장에서는 외국인이 1300억원 순매수다. 개인과 기관이 각각 1115억원, 48억원 순매도다. 업종 중에서는 인터넷이 4.21% 올랐으며 오락문화 컴퓨터서비스 운송 등이 내렸다. 셀트리온헬스케어와 셀트리온제약이 각각 3.33%, 6.34% 상승했다. 신라젠 바이로메드 CJ E&M 티슈진 로엔 코미팜 등이 오른 반면 메디톡스 휴젤 스튜디오드래곤 등이 내렸다. 컴투스가 올 하반기 북미와 유럽 출시 신작 기대감에 6.19% 상승마감했다. 차바이오텍이 탯줄 유래 급성뇌졸중 치료제 개발 기대감에 8.49% 급등했다. 파라다이스는 중국인 관광객 실적 회복세가 예상보다 부진하다는 지적에도 0.77% 상승했다. 텔콘이 비상장 자회사 텔콘제약을 흡수합병한다는 소식에 6.70% 상승마감했다. 행남자기 이디 호성밸브 에스티큐브 삼원테크 매직마이크로 등 6개 종목이 상한가다. 844개 종목이 상승, 318개 종목이 하락했다. 한편 원/달러 환율은 서울 외국환 시장에서 전일대비 1.10원(0.10%) 오른 1070.20원을 기록했다. 코스피200 지수선물 3월물은 3.15포인트(1.01%) 상승한 314.10으로 마감했다.  ▶빵~ 뜨는 따끈한 기사▶무료 만화 보고 선물도 받고~ ▶치어리더 vs 레이싱걸 송선옥 기자 oops@mt.co.kr 머니투데이 관련뉴스해당 언론사에서 선정하며 언론사 페이지(아웃링크)로 이동해 볼 수 있습니다.사흘째 사라진 안희정, 왜? ""공황 상태, 오래 안 가""""영미~"" 여자 컬링팀 LG 무선청소기 잡았다女컬링팀 청소기 광고 찍기까지…LG전자 \'삼고초려\'[르포]\'우리 지사님\'·\'충남의 아들\'이 패륜아로…들끓는 충남 민심도지사 정무비서와 수행비서 차이?…""손발과 머리 역할""좋아요0훈훈해요0슬퍼요0화나요0후속기사 원해요0기사제공 :']"
4,삼성전자, 2018-03-0815:50,연합뉴스 ,"'네 마녀 심술' 없었다…코스피, 2,430선 탈환",https://finance.naver.com/news/news_read.nhn?article_id=0009944509&office_id=001&mode=search&query=삼성전자&page=3,"['       \'네 마녀 심술\' 없었다…코스피, 2,430선 탈환      기사입력2018-03-08 15:50기사원문좋아요훈훈해요좋아요 평가하기공감좋아요0훈훈해요0슬퍼요0화나요0후속기사 원해요0댓글코스피 상승 (PG)  [제작 조혜인]코스닥도 1.54% 오르며 850선 회복(서울=연합뉴스) 임은진 기자 = 3월 선물·옵션 동시 만기일로 이른바 \'네 마녀의 날\'인 8일 코스피가 반등에 성공해 2,430선을 회복했다.     이날 코스피는 전날보다 31.26포인트(1.30%) 오른 2,433.08로 장을 마쳤다.    지수는 18.85포인트(0.78%) 오른 2,420.67로 출발한 이후 장중 2,407.59까지 주저앉기도 했으나, 저가 매수세가 유입되면서 상승 마감했다.    유가증권시장에서 기관은 5천822억원 순매수했고, 개인과 외국인이 각각 4천113억원, 1천770억원 순매도했다.    이영곤 하나금융투자 연구원은 ""미국의 게리 콘 백악관 국가경제위원회(NEC) 위원장 사임으로 보호무역 우려가 있었으나, 어제 미국 증시가 견조한 흐름을 보이면서 국내 증시에도 저가 매수세가 유입됐다""고 설명했다.    그는 ""선물·옵션 동시 만기일이었지만 오히려 동시호가 때 주가가 더 올라가는 모습을 보였다""며 ""최근 매수 차익거래 잔고가 많이 줄면서 무게 부담이 많이 약해진 영향으로 보인다""고 덧붙였다.    업종별로 의약품(4.10%), 철강금속(2.11%), 건설업(2.07%) 등이 올랐고, 의료정밀(-1.03%), 통신업(-0.59%), 운수창고(-0.47%) 등은 내렸다.    시가총액 상위주 모두 올랐다.    삼성전자(1.19%), SK하이닉스(0.97%), 현대차(1.31%), POSCO(3.02%), 삼성바이오로직스(0.67%), LG화학(0.52%), NAVER(0.50%), KB금융(0.49%), 삼성물산(0.78%) 등이 강세를 보였다.    특히 오는 9일 코스피200 지수 편입을 앞둔 셀트리온은 8.92%나 급등했다.    코스닥지수도 올라 12.91포인트(1.54%) 오른 853.94로 장을 마쳤다.    6.28포인트(0.75%) 오른 847.31로 장을 시작한 지수는 우상향 그래프를 그리며 850선을 탈환했다.    코스닥시장에서 외국인은 1천300억원을 순매수했고, 개인은 1천116억원, 기관은 46억원 각각 순매도했다.    시총 상위주 가운데 셀트리온헬스케어(3.33%)와 셀트리온제약(6.34%) 등 \'셀트리온 형제주\'가 크게 올랐다.    또 신라젠(2.97%), 바이로메드(4.74%), CJ E&M(1.03%), 포스코켐텍(0.10%), 펄어비스(0.04%), 티슈진(0.11%), 로엔(1.22%) 등도 상승했다.    10위권 내에서는 메디톡스(-2.75%) 하나만 내렸다.    engine@yna.co.kr▶기사제보 및 문의▶최신 유행 트렌드\xa0\xa0▶사진구매 문의연합뉴스 관련뉴스해당 언론사에서 선정하며 언론사 페이지(아웃링크)로 이동해 볼 수 있습니다.\xa0안희정 캠프 성명서 ""노래방서 끌어안거나 노래·춤 강요""\xa0한국당, 재선거 공천에 배현진 전 아나운서 영입한다\xa0정치권 연이은 \'미투\' 폭로…왜 민주당에 집중되나\xa0아들의 다리가 잘려나가던 날 \'엄마는 울지 않았다\'\xa0경찰 피해 달아나다 자기 차에 치인 음주 운전자좋아요0훈훈해요0슬퍼요0화나요0후속기사 원해요0기사제공 :']"
5,삼성전자, 2018-03-0815:47,조선비즈 ,"네 마녀의 선물…코스피 예상밖 1.3% 상승, 셀트리온 9% 급등",https://finance.naver.com/news/news_read.nhn?article_id=0000400715&office_id=366&mode=search&query=삼성전자&page=3,"['       네 마녀의 선물…코스피 예상밖 1.3% 상승, 셀트리온 9% 급등      기사입력2018-03-08 15:47기사원문좋아요훈훈해요좋아요 평가하기공감좋아요0훈훈해요0슬퍼요0화나요0후속기사 원해요0댓글 8일 국내 증시가 3월 선물옵션동시만기일을 무사히 넘어섰다. 코스피지수는 1.30% 오른 2433.08을 기록했고, 코스피200과 코스닥지수는 각각 1.17%, 1.54% 상승했다.코스피200은 오후 1시 30분부터 2시 정도까지는 동시만기에 대한 부담으로 하락 전환하기도 했으나 금세 반등했다.외국인 매도 물량이 예고됐고, 셀트리온(068270)코스피200 편입 이슈로 인해 코스피200 주요 종목들이 하락할 것이란 예상이 있었지만 미리 대응해왔기 때문인지 도리어 장 마감 동시호가 때 주요 종목 대부분이 상승했다. 기관 매수 자금 유입 효과가 컸다.오후 3시 20분까지 6%대 상승률을 기록하던 셀트리온은 8.92% 상승 마감했고, 0.9% 오름세였던 삼성전자도 1.19% 상승 마감했다. SK하이닉스도 장 마감 동시호가에서 500원 더 올랐다.셀트리온의 경우 패시브 자금 유입 효과를 톡톡히 누렸다. 투신 5720억원, 연기금 1219억원, 보험 1731억원 등 기관에서만 8530억원 유입됐다.셀트리온 외에도 롯데케미칼(011170), 신라젠(215600), 현대중공업(009540), 호텔신라(008770), 바이로메드(084990)(코스닥 상장사) 등에 프로그램 매수세가 유입됐는데, 롯데케미칼을 제외하곤 모두 급등 마감했다. 현대중공업이 5.47% 상승했고, 호텔신라와 바이로메드가 4% 안팎 올랐다.장 내내 숨을 죽이던 기관은 장 마감 동시호가 때 시원하게 매수 주문을 쏟아냈다. 오후 3시 20분까지 600억원 매도하던 기관은 막판 5967억원 매수로 돌아섰다. 외국인은 예상대로 주식을 팔았다. 유가증권시장에서 1736억원 팔았다.[안재만 기자 hoonpa@chosunbiz.com]chosunbiz.com조선비즈 관련뉴스해당 언론사에서 선정하며 언론사 페이지(아웃링크)로 이동해 볼 수 있습니다.中서 대박난 SK화학… 최태원의 비결은?""베트남 월세 쏠쏠"" 투자여행 나서는 큰손들재건축 규제에… 도리어 강남 집값 더 뛴다?""영미는 비행기표 공짜"" 항공사, 깜짝 이벤트부동산 가치만 1조원…\'땅 부자\' 기업은 어디?좋아요0훈훈해요0슬퍼요0화나요0후속기사 원해요0기사제공 :']"
6,삼성전자, 2018-03-0815:47,뉴시스 ,"대기업들, '미투 확산'에 긴장…예방조치 '고삐'",https://finance.naver.com/news/news_read.nhn?article_id=0008476020&office_id=003&mode=search&query=삼성전자&page=3,"['       대기업들, \'미투 확산\'에 긴장…예방조치 \'고삐\'      기사입력2018-03-08 15:47기사원문좋아요훈훈해요좋아요 평가하기공감좋아요0훈훈해요0슬퍼요0화나요0후속기사 원해요0댓글【서울=뉴시스】고승민 기자 = 한국여성연극협회 회원들이 8일 오전 서울 대학로 마로니에공원에서 연극계 성폭력 사태 규탄 미투 운동 지지 기자회견을 마친 뒤 가두행진하고 있다. 2018.03.08. kkssmm99@newsis.com 대기업, 내부적으로 성희롱·성폭행 예방 조치 더욱 강화하고 있는 분위기""예방 시스템 있지만 기업 이미지 실추·불매운동 등 최악 상황은 막아야""【서울=뉴시스】 산업부 = 최근 성폭력 피해자 중심의 \'미투\' 운동이 사회 각 분야로 확산되면서 커다란 파장을 낳고 있는 가운데 주요 기업들도 긴장하는 모습이 역력하다.   임직원이 수 천에서 많게는 수 십만명에 달해 일률적으로 통제하기도 쉽지 않은 상황에서 불미스러운 사건이 발생하거나 외부로 알려질 경우 브랜드 이미지 타격은 물론이고 심각한 매출 타격이 불가피한 상황이기 때문이다.  이에 따라 다양한 방식으로 임직원 교육 확대, 건전한 회식 문화 권장 등을 진행하면서 혹시 모를 사내 성희롱·성폭력에 대한 예방 조치를 더욱 강화하고 있다. 이와 관련, 재계 고위 관계자는 8일 ""웬만한 대기업들은 이미 성희롱이나 성폭력 예방과 관련된 엄격한 징계기준 등의 시스템을 가지고 있지만 이번 미투 운동 파장에서 보듯, 한번 터지면 걷잡을 수 없어 미리 조심하자는 분위기가 팽배해 있다""고 말했다. 그는 ""직원이 성폭행에 연루됐다는 소식이 온라인이나 뉴스 등을 통해 삽시간에 퍼지면 기업 및 브랜드 이미지 실추는 물론 불매 운동으로까지 확산되는 분위기라 특히 조심할 수밖에 없다""고 덧붙였다. 앞서 여성가족부는 이날 공공기관과 기업, 문화예술계, 법조계, 종교계, 의료계, 언론계 등 사회에 만연한 성범죄에 대한 처벌을 대폭 강화하고, 피해자들에 대한 2차 피해 방지와 신변보호를 강화하는 대책을 발표했다. 특히 사업주의 성희롱 행위, 성희롱 행위자에 대한 징계 미조치 등 일부 행위에 대해선 징역형까지 가능하도록 형사처벌 규정으로 강화키로 했다.  현행법상 사업주의 성희롱은 1000만원 이하의 과태료, 성희롱 징계 미조치는 500만원 이하의 과태료가 부과된다.  또 고용부 홈페이지에 직장 내 성희롱 익명 신고시스템을 개설·운영해 익명 신고만으로도 행정지도에 착수해 피해자 신분노출 없이 소속 사업장에 대한 예방차원의 지도 감독이 가능하도록 한다.  상황이 이렇다 보니 대기업에서는 성희롱이나 성폭력 문제에 대한 엄격한 잣대를 적용하고 있다. 혹시 모를 일이 터져 사업에 악영향을 받는 것을 피하자는 분위기다. 지난해 국내 가구 업계 1위 한샘의 경우, 사내 성폭력 사건이 온라인상에서 알려지면서 불매운동이 확산하고 홈쇼핑에서는 퇴출당한 바 있다.   재계 맏형인 삼성전자는 불미스러운 사건이 발생하는 것을 사전에 방지하기 위해 매년 1회 이상 성 관련 온·오프라인 교육을 임직원을 대상으로 진행 중이다. 사내 성희롱 예방교육과 오후 9시를 넘기지 않는 회식 문화 캠페인을 벌이고 있다. 사내 인트라넷과 별도의 애플리케이션으로 성희롱·음주사고 등을 제보할 수 있는 창구도 마련해 운영해 왔다. 제보 내용은 비공개로 처리되며 사실 관계가 확인될 경우 무관용 원칙에 따라 조치하고 있다. SK그룹도 모든 임직원을 대상으로 1년에 2회에 걸쳐 온오프라인 방식으로 성희롱 예방 교육을 시행하고 있다. 온라인 교육은 임직원들의 필수 이수 항목이기도 하다.  LG그룹은 성희롱, 성추행 등 성추문을 \'LG 윤리규범\' 위반행위로 규정, 진상조사와 징계위원회 개최 등에 따라 최대한 신속하게 진행하고 있으며 계열사별로 관련 전담조직을 갖추고 있다. 또 LG전자는 윤리사무국 등 성 관련 피해에 대응하기 위한 조직을 마련해 두고 온라인과 유선 등을 통한 사례 접수, 조치 등을 진행하고 있다. 매년 성폭력 등에 관한 의무교육을 전직원을 대상으로 매년 필수적으로 이수하도록 하고 있다. 현대·기아차는 남녀평등과 일, 가정 양립 지원에 관한 법률에 의거, 연 1회 이상 성희롱 예방교육을 실시하고 있으며 온라인 고충상담 페이지를 마련해 상시로 성희롱 관련 고충도 상담할 수 있는 창구를 운영 중이다. 현대·기아차 관계자는 ""모든 사건에 대해 직급과 직책에 상관없이 \'무관용·무자비 원칙\'을 적용해 중징계하고 있다""고 밝혔다. 한화는 연 1회 이상 성희롱 예방교육을 실시하고 있으며, 남녀평등 일가정양립을 위해 매주 수요일과 금요일에는 저녁 회식을 금지하고 이른 퇴근을 실시하고 있다. KT는 권력형 성범죄를 미연에 차단하기 위해 매년 전사 임직원에 대한 온라인 예방교육 및 직책자 대상 오프라인 교육을 실시 중이다. 올해에는 사내전문강사를 활용, 예방전문가를 양성해 전사 임직원 대상 오프라인 교육을 확대할 예정이다.   또한 피해직원 입장에서 편리하게 신고접수를 할 수 있도록 다양한 채널을 운영중이다. 익명 온라인 접수가 가능한 KT119, 심리상담센터, 기관별 고충상담원 등을 두고 있다.  KT 관계자는 ""정부가 추진하는 권력형 성범죄를 예방하기 위해 다각적인 방법을 마련했다""고 설명했다.   LG유플러스는 정기적으로 사내 성범죄 방지 교육을 실시하고 있으며 사내에 피해접수 신고 센터를 운영하고 있다. LG유플러스 관계자는 ""이전부터 회사는 매주 월·수·금요일 회식을 금지하고 있다. 게다가 이번 사건을 계기로 서로 조심스러워하는 분위기""라고 전했다 두산은 매년 전 임직원이 성희롱 예방교육과 자체 윤리규범 교육 의무적으로 받고 있고, 그룹 홈페이지 내 사이버신고센터 운영해 윤리규범 위반이나 부당행위 신고가 가능하다.  여성 인력이 많은 대한항공은 현장 관리자들의 지속적 관리와 함께 매년 성희롱 예방교육 실시하고 있다. 관련 문제가 발생할 경우 인사부에 바로 신고할 수 있는 이메일 계정을 상시 운영하고 있으며, 사실이 확인되면 엄중처벌하고 있다. 한 대기업 관계자는 ""직장 내 성희롱은 남성이 가장 조심해야 하는 문제 중 하나""라며 ""사회적으로 파장이 커지면서 더 조심하자는 분위기가 형성되고 있다""고 말했다. forgetmenot@newsis.com▶ 뉴시스 빅데이터 MSI 주가시세표 바로가기 ▶ 뉴시스 SNS [페이스북] [트위터]뉴시스 관련뉴스해당 언론사에서 선정하며 언론사 페이지(아웃링크)로 이동해 볼 수 있습니다.직장 동료 숨지고 남겨진 지적장애 아내 성폭행수행 경호원과 간통·공금 횡령…여성시장 사퇴인도 老배우 47년전 성폭행 혐의로 사촌에게 고소당해 구류\'간통죄 위헌\'에 재심했더니…돌아온 건 상해죄 벌금형군부대 앞에서 \'장송곡\' 틀고 시위…집행유예 선고좋아요0훈훈해요0슬퍼요0화나요0후속기사 원해요0기사제공 :']"
