,회사명,날짜,언론사,기사제목,링크,본문
10,삼성전자, 2018-10-2815:09,동아일보 ,“2022년 스마트 에너지 매출 1조 원”…에너지판 ‘황의 법칙 ’ 먹힐까,https://finance.naver.com/news/news_read.nhn?article_id=0003177336&office_id=020&mode=search&query=삼성전자&page=3,"['       “2022년 스마트 에너지 매출 1조 원”…에너지판 ‘황의 법칙 ’ 먹힐까      기사입력2018-10-28 15:09기사원문좋아요훈훈해요좋아요 평가하기공감좋아요0훈훈해요0슬퍼요0화나요0후속기사 원해요0댓글26일(현지시간) 미국 보스턴 하버드대 경영대학원 강의실에서 황창규 KT 회장이 70여 명의 학생들을 상대로 KT의 ‘스마트  에너지 사업’진출 경험을 소개하고 있다. 이날 특강은 KT의 스마트 에너지 사업이 하버드대 경영대학원 교재로 쓰이는 사례 연구  논문으로 발간된 것을 기념해 마련됐다. 보스턴=박용특파원 parky@donga.com  26일(현지시간) 미국 보스턴 하버드대 경영대학원 강의실. 마서 크로퍼드 교수가 80분간 진행한 ‘21세기 에너지’ 과목의 사례 연구 주제는 한국 기업 KT의 ‘스마트 에너지 사업’이었다. 교재는 에너지, 환경 등 지속가능 경영 분야의 석학인 포레스트 라인하트 하버드대 경영대학원 교수가 집필한 사례 연구(Case study) 논문인 ‘새로운 에너지 시장의 KT’. 이날 황창규 KT 회장(65)은 70여 명의 학생들 앞에서 특강 연사로 나섰다. KT 회장으로서는 3년 연속으로, 다른 강연들까지 합치면 총 9차례 하버드 강단에 선 것이다.   ● “2022년 스마트 에너지 매출 1조 원”   황 회장은 이날 30분간 영어로 인공지능(AI)과 빅데이터 등 정보통신기술(ICT)을 활용해 추진하고 있는 KT의 스마트 에너지 사업을 설명했다. 학생들은 통신회사 KT가 왜 에너지 사업에 진출했는지에 대해 질문을 쏟아냈다. 그는 “에너지 사업을 가장 잘할 수 있는 기업이 KT”라며 “AI, 빅데이터 등의 정보통신기술(ICT)을 활용한 ‘에너지 플랫폼’이 비결”이라고 대답했다.   KT는 세계 최초로 지능형 통합에너지 관리 플랫폼인 ‘KT-Meg(Micro Energy Grid)’과 AI기술을 이용한 에너지 빅데이터 분석 엔진인 ‘e-브레인’을 선보이며 에너지 사업에 진출했다. 에너지를 소비하거나 생산할 때 발생하는 고유패턴을 ICT 기술로 분석하고 에너지의 생산, 소비, 거래를 최적화하는 통합관리 솔루션을 들고 나온 것이다.    황 회장은 “이 플랫폼을 이용해 올 여름 두 달 간 KT 연구개발(R&D) 센터의 에너지 비용을 약 12% 줄였다”며 “관리 플랫폼과 빅데이터 분석, 설비 교체, 에너지저장시스템(ESS), 최적 자동제어 등을 모두 활용하면 75%까지 에너지비용을 절감할 수 있을 것”이라고 설명했다. 이어 “향후 블록체인과 5G 기술을 에너지 사업을 접목하고 2022년 스마트 에너지 시장에서 매출 1조 원을 달성할 것”이라고 말했다. 올해 매출액 2000억 원인 스마트 에너지 사업을 2020년 5000억 원으로 키우고 2년 뒤엔 1조 원대 사업으로 만들겠다는 ‘에너지판 황의 법칙’을 예고한 것이다.  ● 에너지판 황의 법칙 먹힐까  미 매사추세츠주립대 전자공학과 박사 출신의 황 회장은 삼성전자 반도체 총괄사장으로 재직하며 ‘반도체 메모리 용량이 1년에 두 배씩 증가한다’는 ‘황의 법칙’을 주장하며 반도체 산업 혁신을 이끌었다. 하버드대 경영대학원생들은 “통신회사가 에너지 등 다양한 영역으로 공격적 전략을 펼치고 있는 것이 놀랍다”고 말했다. 문제는 규제가 많고 전력회사 등 기존 경쟁자들이 버티고 있는 에너지 시장에서 통신회사의 혁신이 얼마나 승산이 있느냐다. 황 회장은 “글로벌 시장에 에너지 사업으로 진출하는 건 규제, 기술, 국가별 표준 때문에 당연히 어렵지만 KT는 플랫폼 역량으로 이를 극복하려고 한다”고 말했다.   KT 스마트 에너지 사업을 분석한 라인하트 교수는 “앞으로 10년 내에 에너지 생산과 판매 등의 모든 분야가 바뀔 것”이라며 “KT가 하고자 하는 서비스가 표준이 될 수 있다”고 전망했다. 그는 “햄버거와 스테이크를 같은 가격에 판매한다면 다들 미쳤다고 생각하지만, 에너지 분야에서는 목요일 오후나 토요일 새벽 시간대나 모두 똑같은 전기요금이 적용된다”며 “천연자원보다 정보와 인적 자원을 더 소비하는 변화가 일어날 것이며 천연자원은 적지만 인재와 교육 인프라가 뛰어난 한국이 앞서 나갈 수 있다”고 말했다. ● “5G 킬러서비스는 보안 분야”  황 회장은 이날 강연에 앞서 기자들과 만나 내년 상용화를 준비하고 있는 5G 사업과 관련해 “자율주행, B2B(기업간거래), B2G(정부거래) 대용량 트래픽이 발생하는 분야에서 연말과 내년 초 하나하나씩 5G 킬러서비스를 발표할 것”이라며 “보안 분야의 킬러 서비스가 제일 중요하다”고 강조했다. 아프리카 케냐에서 5G 컨설팅과 네트워크 디자인을 해달라는 요청도 들어왔다고 소개했다.   미국이 보안 문제를 제기한 중국 화웨이 장비 채택 여부 등으로 관심을 5G 통신장비 선정과 관련해서는 “관련 발표는 1주일 내에 가능할 것”이라고 말했다. 이어 “(화웨이 장비도) 다른 회사 장비와 함께 선정 여부를 검토했으며 KT는 물론 정부가 제시하는 기준 등을 엄격히 적용해 최종 결정이 내려질 것”이라고 덧붙였다.   KT는 지난해 ‘기가네트워크’에 이어 2년 연속 하버드대 경영대학원의 사례 연구 소재로 채택됐다. 하버드대 경영대학원이 발간하는 사례 연구는 전 세계의 다른 경영대학원에도 판매될 정도로 인기 있는 경영학 강의 교재로 꼽힌다. 황 회장은 “하버드대가 배우면 세계의 학교가 배우고 기업들도 배우게 되는 것”이라며 “하버드를 통해 혁신 사례로 알려지면 사업에도 도움이 될 것으로 기대한다”고 말했다.  뉴욕=박용 특파원 parky@donga.com▶ 동아일보 단독 / 동아일보 공식 페이스북▶ 네이버 홈에서 [동아일보] 채널 구독하기ⓒ 동아일보 & donga.com, 무단 전재 및 재배포 금지동아일보 관련뉴스해당 언론사에서 선정하며 언론사 페이지(아웃링크)로 이동해 볼 수 있습니다.서울·경기 우박 세례 \'화들짝\' ""날씨 실화?"" ""카페로 피신""\'대장암 투병\' 유상무 결혼 ""몸 아파서 장가 못 갈 줄""\'초속 20m\' 인천 강풍 피해 잇따라 컨테이너 추락해 50대 사망목숨 건 묘기 뒤엔 1mm단위 치밀함이…삼성전자, NBA 경기장 최초 \'360도 LED 스크린\' 설치좋아요0훈훈해요0슬퍼요0화나요0후속기사 원해요0기사제공 :']"
11,삼성전자, 2018-10-2815:00,파이낸셜뉴스 ,"박정호 SK텔레콤 사장 ""5G 스마트폰 상용화 한달 앞당긴다""",https://finance.naver.com/news/news_read.nhn?article_id=0004116140&office_id=014&mode=search&query=삼성전자&page=3,"['       박정호 SK텔레콤 사장 ""5G 스마트폰 상용화 한달 앞당긴다""      기사입력2018-10-28 15:00기사원문좋아요훈훈해요좋아요 평가하기공감좋아요0훈훈해요0슬퍼요0화나요0후속기사 원해요0댓글  박정호 SK텔레콤 사장이 5G(5세대) 통신 스마트폰 상용화 시기를 한달 정도 앞당기겠다는 포부를 밝혔다. 당초 스마트폰을 통한 5G 상용화는 내년 3월에 가능할 것으로 예상됐다. 하지만 박 사장은 이같은 일정을 앞당겨 세계 최초 5G 상용화를 통한 시장 주도권을 잡아 나가겠다는 의지를 나타낸 것으로 풀이된다.         박정호 SK텔레콤 사장이 26일 국회에서 열린 과학기술정보방송통신위원회 종합감사에서 답변하고 있다.    박 사장은 지난 26일 국회 과학기술정보방송통신위원회의 과학기술정보통신부 국정감사에 증인으로 출석하기 앞서 기자들과 만나 5G 상용화 준비 상황에 대해 ""잘 준비하고 있다""며 ""(상용화 일정이) 한달에서 두달 앞당겨질 것 같다""고 말했다. 뒤이어 5G 스마트폰 상용화를 의미하냐는 질문에 박 사장은 ""(5G 스마트폰) 상용화가 한달 정도 앞당겨질 것 같다""고 답했다.  정부는 세계 최초 5G 스마트폰 상용화 시기를 내년 3월로 잡고 있다. 앞서 모바일라우터를 통한 5G 상용화는 오는 12월 1일로 계획을 세우고 있다. 모바일라우터 역시 5G 상용화 단말 초기 모델로 인정할 수 있다는 의미에서다. 12월 1일은 5G 주파수를 사용할 수 있는 시점이다.  전성배 과기정통부 기획조정실장은 ""가장 쉽게 생각하는 상용화는 휴대폰인데, (내년 3월에 맞춰) 휴대폰이 들어오면 좋겠지만 단말이 (출시되는 시점이) 딱 끊어지지 않는다""며 ""(기술은) 쉬운 모델에서부터 진화를 하는 것이니 초기 모델을 5G가 아니라고 할 일은 없다""고 설명했다.  모바일라우터를 통한 5G 상용화는 이동통신 3사 모두 동일한 시점에 가능할 것으로 예상된다. 이런 상황에서 박 사장이 5G 스마트폰 상용화 일정을 한달 앞당기겠다고 밝힌 것은 SK텔레콤의 5G 상용화 과정에 대한 자신감으로 분석된다. 실제 SK텔레콤은 5G 상용화에 속도를 높이고 있다. SK텔레콤은 국내 이동통신 3사 가운데 가장 먼저 5G 장비사 선정을 완료하고 연동에도 성공했다. 연동은 삼성전자 5G NSA 교환기와 노키아·에릭슨 5G 기지국 사이에 이뤄졌다.  통상 데이터 통신은 \'단말기-기지국-교환기-인터넷\' 단계를 거친다. 기지국과 교환기의 제조사가 다를 경우에는 이통사에서 서로의 장비를 연동해 품질을 최적화하는 과정이 필요하다. 이를 위해 SK텔레콤은 서로 다른 제조사 5G 장비의 연동 품질을 높이는 기술과 규격을 AT&T, 오렌지 등 글로벌 통신사들과 함께 개발해 왔다.  5G 장비 연동 성공으로 SK텔레콤은 노키아·에릭슨 5G 기지국을 삼성전자 교환기 관할 범위 내에 설치할 수 있게 됐다. 박진효 SK텔레콤 ICT기술원장은 ""같은 제조사 장비를 쓰더라도 통신사의 기술 수준과 준비 속도에 따라 상용 품질 차이가 크게 날 수 있다""며 ""여러 단계에서 앞서 가고 있는 만큼 상용화 전까지 품질 최적화에 더 많은 노력을 기울일 것""이라고 했다.  박 사장의 5G 스마트폰 상용화 시기 언급에 대해 SK텔레콤 관계자는 ""주요 제조사의 스마트폰 출시가 상반기쯤으로 알려져 있다""며 ""제조사와 협력을 강화해 한두달이라도 빨리 상용화를 할 수 있도록 하겠다는 의미로 이해해 달라""고 말했다.   syj@fnnews.com 서영준 기자   ▶ 세상의 모든 골 때리는 이야기 \'fn파스\'▶ 속보이는 연예뉴스 fn스타  ※ 저작권자 ⓒ 파이낸셜뉴스. 무단 전재-재배포 금지파이낸셜뉴스 관련뉴스해당 언론사에서 선정하며 언론사 페이지(아웃링크)로 이동해 볼 수 있습니다.상견례 앞둔 아들 연락 안돼 사는 집에 가보니 여자친구가..9개월 동안 23만건 음란물 올린 20대男, 2층 가정집에서..봉사활동 증빙서류 조작한 장현수, 하태경 압박에 결국..""장모님 연락이 안돼서.."" 경찰과 찾아간 사위..\'참혹한 현장\'가뭄에 다뉴브 강 수위 낮아지면서 중세 금화 무더기 발견좋아요0훈훈해요0슬퍼요0화나요0후속기사 원해요0기사제공 :']"
12,삼성전자, 2018-10-2814:52,전자신문 ,"[국제]리플, 구글서 무선메시지 개발 담당한 아미르 사란지 부사장으로 영입",https://finance.naver.com/news/news_read.nhn?article_id=0002752334&office_id=030&mode=search&query=삼성전자&page=3,"['       [국제]리플, 구글서 무선메시지 개발 담당한 아미르 사란지 부사장으로 영입      기사입력2018-10-28 14:52기사원문좋아요훈훈해요좋아요 평가하기공감좋아요0훈훈해요0슬퍼요0화나요0후속기사 원해요0댓글 리플이 구글에서 무선메시지 개발을 담당한 아미르 사란지를 제품 담당 부사장으로 영입했다.로이터는 27일(현지시간) 블록체인 기반 글로벌 결제 네트워크를 개발하는 리플의 제품담당부사장으로 아미르 사란지를 채용했다고 전했다.아미르 사란지는 차세대 모바일 서비스(RCS·Rich Communication Services) 관련 무선 통신 기술을 개발한 자이브 모바일 창업자로 2015년 인수합병으로 구글에 합류했다. 구글은 미래 수익창출 기술로 RCS를 주목하고 다양한 디바이스 제조사 및 무선통신사 등과 파트너 관계를 맺고 기술을 소개해 왔다.다만 애플 아이폰이 RCS를 지원하지 않고 삼성전자도 지난 9월 제한적인 지원 방침을 밝히면서 보급에 어려움을 겪고 있다.박정은기자 jepark@etnews.com▶ 데이터를 세상에서 가장 잘 다루는 나라 - 데이터 코리아 빅뱅 2019▶ 네이버 모바일에서 [전자신문] 채널 구독하기▶ 전자신문 바로가기 [Copyright ⓒ 전자신문 & 전자신문인터넷, 무단전재 및 재배포 금지]전자신문 관련뉴스해당 언론사에서 선정하며 언론사 페이지(아웃링크)로 이동해 볼 수 있습니다.불산 공급난에 반도체 업계 \'비상\'유영민 ""완전자급제, 법제화보단 시장에 맡겨야""KT ""아이폰XS·아이폰XR 예약가입 10분만에 3만대""[국제]노키아 ""수익성높이기 위해 수천명 감원할 것""삼성엔지니어링, 3분기 영업이익 845억좋아요0훈훈해요0슬퍼요0화나요0후속기사 원해요0기사제공 :']"
13,삼성전자, 2018-10-2814:47,스포츠조선 ,증시 급락에 올해 10대 그룹 상장사 시총 150조원 이상 증발,https://finance.naver.com/news/news_read.nhn?article_id=0003336018&office_id=076&mode=search&query=삼성전자&page=3,"[""       증시 급락에 올해 10대 그룹 상장사 시총 150조원 이상 증발      기사입력2018-10-28 14:47기사원문좋아요훈훈해요좋아요 평가하기공감좋아요0훈훈해요0슬퍼요0화나요0후속기사 원해요0댓글 최근 국내 증시가 급락하면서, 올들어 10대 그룹 상장사 시가총액이 150조원 넘게 증발한 것으로 나타났다.28일 재벌닷컴에 따르면, 자산 상위 10대 그룹 계열 94개 상장사의 시가총액(우선주 포함)은 지난 26일 현재 811조2860억원(이하 종가 기준)으로 지난해 말의 968조290억원보다 156조7430억원(16.2%)이나 감소했다. 이는 같은 기간 1888조5610억원에서 1579조5030억원으로 309조580억원(16.4%) 줄어든 국내 주식시장(코스피+코스닥) 시총 감소분의 절반이 넘는 수치다. 그룹별로 보면, 삼성그룹의 시총이 514조2920억원에서 81조1780억원(15.8%)이나 줄어든 433조1140억원으로 집계됐다. 지난해 말 367조870억원이었던 삼성전자(우선주 포함) 시총이 293조6900억원으로 73조3970억원(20.0%) 감소한 영향이 컸다.현대차그룹도 시총이 102조2400억원에서 76조2000억원으로 26조400억원(25.5%) 줄었다. 특히 올해 3분기 '어닝쇼크'(실적충격)를 낸 현대차의 시총이 40조7660억원에서 27조2710억원으로 13조4950억원(32.8%)이나 감소했다.SK그룹 시총도 10조2920억원(8.1%) 사라졌는데, 계열사 중 사상 최대 실적 행진을 이어간 SK하이닉스의 시총마저 6조9160억원(12.4%)이나 감소했다. LG그룹도 주력인 LG전자 시총이 42.4%인 7조3480억원이나 줄었고, LG화학·LG·LG디스플레이 등의 시총 감소에 그룹 시총이 25조6620억원(23.8%)이나 줄었다.한화그룹은 시총이 18조2760억원에서 11조8750억원으로 6조4010억원(35.0%) 줄어 10대 그룹 중 감소율이 가장 높았다. 이밖에 포스코그룹의 시총이 4조4660억원(12.7%) 줄었고 롯데그룹(2조4740억원), 농협그룹(5900억원), GS그룹(3030억원) 등도 감소했다.다만 현대중공업그룹은 16조3070억원이던 시총이 16조9700억원으로 6630억원(4.1%) 늘어 10대 그룹 중 유일하게 증가했다. 김소형기자 compact@sportschosun.com[스포츠조선 바로가기] [스포츠조선 남북교류 특별페이지]- Copyrightsⓒ 스포츠조선(http://sports.chosun.com/), 무단 전재 및 재배포 금지좋아요0훈훈해요0슬퍼요0화나요0후속기사 원해요0기사제공 :""]"
14,삼성전자, 2018-10-2814:12,파이낸셜뉴스 ,9년만에 순매도하는 연기금…개미와는 '반대매매'?,https://finance.naver.com/news/news_read.nhn?article_id=0004116117&office_id=014&mode=search&query=삼성전자&page=3,"['       9년만에 순매도하는 연기금…개미와는 \'반대매매\'?      기사입력2018-10-28 14:12기사원문좋아요훈훈해요좋아요 평가하기공감좋아요0훈훈해요0슬퍼요0화나요0후속기사 원해요0댓글  우리 증시의 \'구원투수\' 역할을 하던 연기금이 이제는 매도에 앞장 서고 있는 것으로 나타났다. 특히 코스피시장에서 개인투자자와 정반대 매매성향을 보이면서 일부 정보기술(IT) 대형주를 팔아치우고 있다.  올해 들어 연기금은 삼성전자 주식을 1조3600억원가량 순매도했다. 반대로 개인은 삼성전자 주식을 순매수하면서 주가가 떨어진 종목을 개인이 떠안는 상황이 연출됐다.  28일 한국거래소에 따르면 코스피시장에서 연기금은 올해 들어 총 4671억원어치를 순매도한 것으로 나타났다.  지난 2009년 이후 9년 만의 순매도 전환이다. 연기금은 2010년부터 지난해까지 코스피시장에서 연평균 7조원가량을 순매수해왔다. 글로벌 금융위기가 닥친 지난 2008년에도 연기금은 시장에 9조원을 투자하면서 지수 하락을 방어했다. 연기금이 증시의 \'구원투수\'로 불리는 이유다.  그러나 올해는 순매도로 전환하면서 심상치 않은 기류를 보이고 있다. 다른 기관과도 매매 양상이 다르다. 이달 들어 코스피시장에서 기관은 1조원 가량 순매수했으나 연기금은 반대로 1505억원어치를 팔았다. 올해 국내 주식 비중을 줄이겠다고 밝힌 국민연금 영향도 있겠으나 낮아진 국내주식 수익률에 따른 위험 회피 요인이 더욱 크다는 분석이다.  실제 지난 7월 말까지 국민연금의 국내주식 운용 수익률은 마이너스(-)6.11%에 그쳤다. 지난 2015년~2017년의 3년 평균 11.58%의 수익률을 올린 것과는 정반대의 모습이다. 악화된 수익성에 우선 국내주식에서 손을 빼고 있다는 지적이다. 증권업계 관계자는 ""국내 주식의 하락과 조정이 불가피하다고 생각해 일단 주식을 던져서 몸집을 줄이고 있는 것으로 보인다""며 ""이전과는 다르게 (연기금이) 시장 전체를 보는 견해가 많이 나빠진 것으로 판단된다""고 설명했다.  특히 연기금은 개인이 집중적으로 매수한 일부 종목에 대해 매도 성향을 보였다. 특히 삼성전자는 개인과 연기금의 투자가 정반대였다는 얘기다. 연기금은 삼성전자를 1조3674억원으로 가장 많이 순매도했다. 반면 개인은 삼성전자가 순매수 1위(7조2542억원) 였다. 연기금과 외국인(4조5548억원 순매도)이 넘기는 삼성전자 주식을 개인이 떠안는 모양새다. 이 기간 삼성전자의 주가는 19.64% 하락했다.  특히 연기금 순매도 종목 1~3위가 모두 코스피 내 시총 비중이 높은 정보기술(IT) 대형주에 집중돼 있다. 연기금은 올해 들어 삼성전자에 이어 SK하이닉스(5916억원), NAVER(3107억원)을 각각 순매도 상위에 올렸다.  다만 순매도 폭이 크지는 않은 만큼 포트폴리오상 연말에는 매수를 확대할 가능성이 높다는 의견도 나왔다. 다른 증권업계 관계자는 ""연간으로 포트폴리오가 나오기 때문에 10월까지 매도 우위더라도 연말께 순매수를 맞추는 형태가 나올 수 있다""고 내다봤다.   bhoon@fnnews.com 이병훈 기자   ▶ 세상의 모든 골 때리는 이야기 \'fn파스\'▶ 속보이는 연예뉴스 fn스타  ※ 저작권자 ⓒ 파이낸셜뉴스. 무단 전재-재배포 금지파이낸셜뉴스 관련뉴스해당 언론사에서 선정하며 언론사 페이지(아웃링크)로 이동해 볼 수 있습니다.상견례 앞둔 아들 연락 안돼 사는 집에 가보니 여자친구가..9개월 동안 23만건 음란물 올린 20대男, 2층 가정집에서..봉사활동 증빙서류 조작한 장현수, 하태경 압박에 결국..""장모님 연락이 안돼서.."" 경찰과 찾아간 사위..\'참혹한 현장\'가뭄에 다뉴브 강 수위 낮아지면서 중세 금화 무더기 발견좋아요0훈훈해요0슬퍼요0화나요0후속기사 원해요0기사제공 :']"
