,회사명,날짜,언론사,기사제목,링크,본문
9,삼성전자, 2018-01-1712:04,헤럴드경제 ,‘셀트리온 3총사’ 시총 67조 재계 5위 규모 ‘기세등등’,https://finance.naver.com/news/news_read.nhn?article_id=0001341955&office_id=016&mode=search&query=삼성전자&page=5,"['       ‘셀트리온 3총사’ 시총 67조  재계 5위 규모 ‘기세등등’      기사입력2018-01-17 12:04기사원문좋아요훈훈해요좋아요 평가하기공감좋아요0훈훈해요0슬퍼요0화나요0후속기사 원해요0댓글전체 20% 넘어 코스닥 ‘좌지우지’셀트리온 주가 올 상승률만 60%올해도 바이오주 강세 ‘바람탈듯지난 해에 이어 올 해 초에도 무서운 상승세를 이어오던 셀트리온그룹(이하 셀트리온 3총사)이 결국 시총 규모로 재계 5위까지 올라섰다. 셀트리온 3총사의 시총은 코스닥 시장 전체 시장의 20%를 넘어서며 코스닥 시장을 좌지우지 할 정도로 몸집이 커졌다. 다만 셀트리온이 2월 코스피로 이전 상장된 후 코스닥 시장에 혼란이 올 수도 있다는 전망도 나오고 있다.17일 제약업계에 따르면 15일 종가 기준 셀트리온(42조9332억원), 셀트리온헬스케어(21조1226억원), 셀트리온제약(3조6507억원) 등 셀트리온 3총사의 시가 총액의 합은 무려 67조7065억원으로 파악됐다. 이는 그룹 시총으로 봤을 때 삼성그룹(468조원대), SK그룹(123조원대), LG그룹(106조원대), 현대차그룹(93조원대)에 이어 5위에 해당하는 규모다. 셀트리온 3총사의 시가 총액은 67조원을 돌파하며 재계 5위까지 올라섰다.셀트리온그룹 시총이 포스코그룹(40조원대), 롯데그룹(30조원대), CJ그룹(22조원대) 등 국내 주요 대기업들보다 높은 것이다.코스닥 대장주 셀트리온은 올 해 22만3000원의 주가로 시작해 지난 주 30만원을 넘어 15일 종가 35만원까지 올라가며 상승률이 60%를 넘었다. 셀트리온 시총은 단일 규모로 삼성전자, SK하이닉스에 이어 3위로 현대차(33조원대)까지 제치기도 했다.특히 셀트리온 3총사는 코스닥 시장을 주도하고 있다. 셀트리온 3총사의 코스닥 시장 비중은 21%를 넘었다. 코스피 시장의 시총 20%를 차지하는 삼성전자와 비슷한 영향력을 행사하고 있다. 셀트리온 3총사의 영향으로 16일 코스닥 시장은 16년만에 900 고지를 밟는데 성공했다. 한국거래소에 따르면 지난 해 11월부터 코스닥 시장 상승분 중 절반은 셀트리온 3총사의 상승에 따른 것이다. 때문에 셀트리온이 2월 코스피로 이전 상장되면 코스닥 시장에 혼란이 올 수도 있다는 얘기가 나오고 있다. 코스닥 대장주인 셀트리온이 코스닥 시장을 떠나게 되면 코스닥 시총 규모가 크게 줄어들고 계열사인 셀트리온헬스케어와 셀트리온제약도 성장이 주춤해지지 않을까 하는 우려다.다만 바이오주의 강세는 올 해도 여전할 것이라는 예측도 있다. 제약업계 관계자는 “셀트리온 3총사를 제외하더라도 신라젠, 바이로메드, 메디톡스 등 코스닥 시장 상위에 많은 바이오기업들이 포진해 있다”며 “오히려 한 그룹에 의존하지 않고 여러 기업이 시장을 형성하는 것이 구조적으로 더 튼튼해지는 계기가 되지 않을까 기대한다”고 말했다.손인규 기자/ikson@heraldcorp.com▶ 생활용품 또 떨어졌어? 마트 가지 말고 한번에 쓱~▶헤럴드경제 채널 설정하기 ▶FNC 한성호 대표, 강원국 작가 강연 신청! - Copyrights ⓒ 헤럴드경제 & heraldbiz.com, 무단 전재 및 재배포 금지 -헤럴드경제 관련뉴스해당 언론사에서 선정하며 언론사 페이지(아웃링크)로 이동해 볼 수 있습니다.가상화폐 폭락에 패닉…""美 선물거래 탓?"" 설왕설래현송월, 北 아이돌서 정권 실세로…""수석대표 동급""가상화폐 이틀째 폭락 …비트코인 1400만원대로 뚝고현정, 조인성에 청혼했다가 거절당했다고?""최순실 \'소리소문 없이 죽을 수 있다\'며 고영태 협박""좋아요0훈훈해요0슬퍼요0화나요0후속기사 원해요0기사제공 :']"
10,삼성전자, 2018-01-1712:02,파이낸셜뉴스 ,한국 최저임금 수준 선진국보다 높아...1만원 시 기업 추가 부담 75.6조원에 ...,https://finance.naver.com/news/news_read.nhn?article_id=0003945710&office_id=014&mode=search&query=삼성전자&page=5,"['       한국 최저임금 수준 선진국보다 높아...1만원 시 기업 추가 부담 75.6조원에 달해      기사입력2018-01-17 12:02기사원문좋아요훈훈해요좋아요 평가하기공감좋아요0훈훈해요0슬퍼요0화나요0후속기사 원해요0댓글-산입 범위에 고정상여금과 숙식수당 포함해야- 해고제 등 노동 유연성 확보해야  우리나라의 최저임금은 선도국과 비교했을 때 이미 적정 수준을 크게 상회하고 있으며, 문재인 정부의 최저임금 1만원 정책은 기업의 생존력을 저해한다는 분석 보고서가 나왔다. 특히 2020년 최저임금이 1만원이 될 경우 기업의 추가 부담금액은 75조6000억에 달하는 것으로 조사됐다.  17일 중소기업일자리위원회는 서울 여의도 중소기업중앙회관에서 \'일자리창출을 위한 노동시장 구조개혁 정책 제언 보고회\'를 개최했다.  이날 독일 컨설팅업체 롤랜드버거의 이수성 서울사무소 대표는 ""2020년 최저임금이 1만원이 될 경우 기업의 추가 부담금액은 75조6000억원에 달한다""고 말했다.  지난 1967년 설립된 롤랜드버거는 유럽 최대 수준의 독일 컨설팅업체다.  자동차, 인프라 구축, 에너지, 국가전략 등 다양한 분야의 컨설팅을 수행하고 있다. 지난 2016년 삼성전자가 미국의 전장전문기업인 하만 인수시 컨설팅을 수행한 회사로 잘 알려져 있다.         자료:롤랜드버거    롤랜드버거는 한국의 현 노동정책은 기업의 막대한 비용증가와 매출감소를 초래한다고 밝혔다.  특히, 중소제조기업의 47%가 대기업에 납품하는 한국의 산업구조를 감안할 때 대기업의 부담이 하청 중소기업에 전가될 수 있어 중소기업의 현실을 고려한 노동정책이 필요하다고 주장했다.  최저임금에 대해서는 최저임금 1만원 정책은 기업의 생존력을 저해할 것이라는 점을 지적했다.  이 대표는 2020년 최저임금이 1만원으로 올라갔을 경우, 기업들의 추가 부담액은 75조6000억원에 달한 것이라고 내다봤으며, 우리나라의 최저임금은 이미 선도국 대비 적정 최저임금 수준을 크게 상회하고 있다고 설명했다.  제도개선책으로 최저임금 산정기준을 소비자 물가지수와 근로자 생계비, 임금상승률로 명확화하는 한편, 연령·산업·지역·직능별 차등적용과 함께, 산입범위도 기본급 이외에 고정상여금과 숙식수당을 포함해야 한다고 주장했다.             근로시간 단축 역시 속도 조절이 필요하다는 입장을 내놨다.  이 대표는 ""한국 정부가 추진하고 있는 근로시간 단축 속도는 세계적으로도 찾아 볼 수 없는 경우""라면서 ""근로시간 단축을 통해 고용을 늘릴 수 있을 지 의문이 든다""고 단언했다.  이어 ""선도국은 연평균 1시간 내외 단축 속도를 가지고 있는데 비해 한국의 근로시간 단축은 너무 빨라 중소기업의 인력난을 악화시킬 수 있다""며, ""근로시간 단축의 연착륙을 위해 전체 부족인력의 55%를 차지하는 30인 미만의 영세사업장에 대해서는 노사합의시 주 최대 8시간의 특별연장 근로를 허용해야 한다""고 말했다.  특히, 최저임금, 근로시간 단축 등 현안 외에 해고 유연화 등 법체계 개선이 함께 이루어져야 한다는 점을 강조하며, 주요 노동정책들을 개별적으로 접근할 것이 아니라 사회적 대화를 통해 한 테이블에서 함께 논의할 것을 제안했다.  이날 박성택 중소기업중앙회장은 ""그 동안 최저임금 논의가 충분치 않았고, 노조의 입장만이 강조돼 왔다""고 지적하며 ""정부의 방향성은 맞지만 연착률 할 수 있는 대안을 마련하고자 이 자리를 마련했다""고 말했다.  중소기업일자리위원회는 이날 발표한 ‘노동시장 구조개혁 정책제언서’를 여야 대표, 국회 환경노동위원회, 고용노동부, 중소벤처기업부 등에 전달할 예정이다.   yutoo@fnnews.com 최영희 중소기업전문기자   ▶ 세상의 모든 골 때리는 이야기 \'fn파스\'▶ 속보이는 연예뉴스 fn스타  ※ 저작권자 ⓒ  파이낸셜뉴스. 무단 전재-재배포 금지파이낸셜뉴스 관련뉴스해당 언론사에서 선정하며 언론사 페이지(아웃링크)로 이동해 볼 수 있습니다.해열·진통제 \'이부프로펜\'.. 男 생식 능력 저하 ""매너는 어디에?"" 공연장 꼴불견 \'관크족\'의 습격가상통화거래소 전방위 규제에도 신규업체 더욱 늘어나만 할인 못받는 자동차보험료?박지원 ""안철수, 한국당 원내1당 만드는 도우미""좋아요0훈훈해요0슬퍼요0화나요0후속기사 원해요0기사제공 :']"
11,삼성전자, 2018-01-1712:01,이데일리 ,"""노동정책, 균형 필요"" 기업·근로자 함께 고려해야",https://finance.naver.com/news/news_read.nhn?article_id=0004013366&office_id=018&mode=search&query=삼성전자&page=5,"['       ""노동정책, 균형 필요"" 기업·근로자 함께 고려해야      기사입력2018-01-17 12:01기사원문좋아요훈훈해요좋아요 평가하기공감좋아요0훈훈해요0슬퍼요0화나요0후속기사 원해요0댓글- 중소기업, 노동시장 연착륙을 위한 정책제언- ""정부 노동정책, 막대한 비용..매출 감소 초래""롤랜드버거 제공.[이데일리 정태선 기자] “급변하는 4차 산업혁명 시대를 선도하기 위해서는 사용자와 근로자가 함께 고려된 노동정책 수립이 필수적이다”롤랜드버거(RolandBerger Strategy Consultants)는 17일 중소기업일자리위원회 주최로 개최된 ‘노동시장 구조개혁 정책제언 보고회’에서 대한민국 노동정책의 현주소와 선도국의 노동개혁 사례를 비교 분석해 ‘일자리 창출을 위한 노동시장 구조개혁 정책제언’을 발표했다.롤랜드버거는 1967년 설립된 유럽 최대 수준의 독일 컨설팅업체로 자동차, 인프라 구축, 에너지, 국가전략 등 다양한 분야의 컨설팅을 수행하고 있으며, 2016년 삼성전자가 미국의 전장전문기업인 하만 인수시 컨설팅을 수행한 회사로 잘 알려져 있다.이날 발표를 맡은 이수성 롤랜드버거 서울사무소 대표는 “4차 산업혁명이라는 시대적 변화를 선도하고 양극화라는 사회적 이슈 해결을 위해서는 노동정책의 ‘시스템적 균형’이 필요하다”며 “근로안정성과 노동유연성의 균형을 통해 사용자와 근로자가 함께 윈윈할 수 있는 노동정책이 필수적”이라고 제언했다.롤랜드버거는 한국의 현 노동정책은 기업의 막대한 비용증가와 매출감소를 초래한다고 진단했다. 특히, 중소제조기업의 47%가 대기업에 납품하는 한국의 산업구조를 감안할 때 대기업의 부담이 하청 중소기업에 전가될 수 있어 중소기업 현실을 고려한 노동정책이 필요하다고 주장했다.최저임금에 대해서는 최저임금 1만원 정책은 기업의 생존력을 저해할 것이라는 점을 지적하고, 제도개선책으로 최저임금 산정기준을 소비자 물가지수와 근로자 생계비, 임금상승률로 명확화하는 한편, 연령·산업·지역·직능별 차등적용과 함께 산입범위도 기본급 이외에 고정상여금과 숙식수당을 포함해야 한다고 주장했다.또, 주당 최대 68시간인 근로시간을 2021년 7월 1일까지 52시간으로 단축하는 것은 선도국의 연평균 1시간 내외 단축속도에 비해 너무 빨라 중소기업의 인력난을 악화시킬 수 있다고 봤다. 이에 근로시간 단축의 연착륙을 위해선 전체 부족인력의 55%를 차지하는 30인 미만의 영세사업장에는 노사합의시 주 최대 8시간의 특별연장 근로를 허용해야 한다고 강조했다.특히 최저임금, 근로시간 단축 등 현안 외에 해고 유연화 등 법체계 개선이 함께 이뤄져야 한다는 점도 언급했다. 주요 노동정책들을 개별적으로 접근할 것이 아니라 사회적 대화를 통해 한 테이블에서 함께 논의해야 한다는 지적이다. 박성택 중소기업중앙회 회장은 “올해는 혁신성장과 소득주도 성장의 균형을 바탕으로 일자리 개혁을 이루어내야 할 도전의 해”라며 “갈등과 논쟁의 대상이 되고 있는 노동문제의 해법을 찾고 의미있는 대화를 나누고자 이 자리를 마련했다”고 설명했다. 중소기업일자리위원회는 이날 발표한 ‘노동시장 구조개혁 정책제언서’를 여야대표, 국회 환경노동위원회, 고용노동부, 중소벤처기업부 등에 전달할 예정이다.정태선 (windy@edaily.co.kr)▶[가상화폐 열풍] 시장분석과 투자 정보를 한눈에...▶[네이버 채널]에서 ‘이데일리’ 구독하기 | ▶[카카오톡] 플친 맺기~♥＜ⓒ종합 경제정보 미디어 이데일리 - 무단전재 & 재배포 금지＞이데일리 관련뉴스해당 언론사에서 선정하며 언론사 페이지(아웃링크)로 이동해 볼 수 있습니다.[최저임금인상의 역설]⑤\'취지는 좋은데…\' 점주도 알바도 \'울상\'폭락해도 \'존버\'…널뛰는 가상화폐에 \'시체\' 된 2030""단축근무요? 휴가도 못가요""…공무원 근무혁신대책 실효성 논란\'국정원 뇌물\' 김백준·김진모 구속…MB 턱밑까지 간 檢(종합)희망연봉 4035만원..기대연봉 수준 좌우하는 조건 1순위?좋아요0훈훈해요0슬퍼요0화나요0후속기사 원해요0기사제공 :']"
12,삼성전자, 2018-01-1712:00,연합뉴스 ,"""최저임금 인상·근로시간 단축·정규직화 비용 465조원""",https://finance.naver.com/news/news_read.nhn?article_id=0009818537&office_id=001&mode=search&query=삼성전자&page=5,"['       ""최저임금 인상·근로시간 단축·정규직화 비용 465조원""      기사입력2018-01-17 12:00기사원문좋아요훈훈해요좋아요 평가하기공감좋아요0훈훈해요0슬퍼요0화나요0후속기사 원해요0댓글노동시장 구조개혁 정책제언 보고대회(서울=연합뉴스) 신준희 기자 = 17일 서울 여의도 중소기업중앙회에서 열린 \'노동시장 구조개혁 정책제언 보고대회\'에서 이수성 롤랜드버거 대표가 정책제언 보고를 하고 있다. 2018.1.17    hama@yna.co.kr세계 4대 컨설팅사 롤랜드버거 보고서…정부 1년치 예산보다 많아""최저임금 산정 기준 개편·8시간 특별연장 근로 허용 필요""(서울=연합뉴스) 박성진 기자 = ""최저임금 1만원 인상 정책이 중소기업의 생존력을 저해하고 근로시간 단축 속도는 너무 빨라 중소기업의 인력난을 악화시킬 수 있다""    세계 4대 컨설팅회사로 꼽히는 독일 컨설팅 회사인 롤랜드버거가 17일 한국 정부의 노동정책에 대해 비판적 내용을 담은 컨설팅 보고서를 내놓았다.     롤랜드버거는 이날 서울 여의도 중소기업중앙회에서 중소기업일자리위원회 주최로 열린 \'노동시장 구조개혁 정책제언 보고회\'에서 보고서를 발표했다.    발제자로 나선 이수성 롤랜드버거 서울사무소 대표는 ""한국 정부의 현 노동정책은 기업의 막대한 비용증가와 매출감소를 초래한다""고 지적했다.     롤랜드버거는 최저임금 인상과 근로시간 단축, 비정규직의 정규직화로 발생하는 추가 인건비와 매출감소 예상액을 총 464조7천억원이 될 것으로 추산했다.     이는 정부의 올해 예산 428조8천원보다 훨씬 많은 규모다.     2020년까지 최저임금을 1만원으로 인상하겠다는 정부 목표에 대해서는 ""기업의 생존력을 저해한다""고 이 대표는 주장했다.     이 대표는 최저임금이 1만원으로 인상될 때 기업의 추가 부담액이 75조6천억원에 달할 것으로 추산하며 최저임금 산정기준 개편을 제안했다.    그는 ""최저임금 산정기준을 소비자 물가지수와 근로자 생계비, 임금상승률로 명확히 하는 한편 연령·산업·지역·직능별 차등적용과 함께 산입범위도 기본급 이외에 고정상여금과 숙식수당을 포함해야 한다""고 밝혔다. [그래픽] 최저임금 인상·근로시간 단축·정규직화 비용 465조원    이 대표는 정부와 국회가 주당 최장 근로시간을 현재 68시간에서 52시간으로 16시간 단축하면 중소기업 매출이 109조원 줄어드는 등 전체 기업 매출이 323조원이나 감소할 것으로 예상했다.    그러면서 ""근로시간을 2021년 7월까지 52시간으로 단축하는 것은 선진국이 연평균 1시간 안팎으로 근로시간을 단축했던 것과 비교해 너무 빨라 중소기업의 인력난을 악화시킬 수 있다""고 우려했다.    이 대표는 중소기업계에서 요구하는 것처럼 ""근로시간 단축 연착륙을 위해 전체 부족인력의 55%를 차지하는 종업원 30인 미만 영세사업장에 대해서는 노사합의 시 주당 최대 8시간의 특별연장 근로를 허용해야 한다""고 제시했다.    고용과 해고 문제에 대해서는 근로 안정성뿐 아니라 노동 유연성을 균형 있게 추진하고, 임금체계는 연공제 중심의 경직된 임금체계에서 성과급·직무급 중심의 임금체계로 개선하라고 권고했다.    박성택 중소기업중앙회장은 보고회 인사말에서 ""우리 사회가 노동시간 단축, 최저임금 인상으로 속앓이를 하고 있다""며 정책 방향에는 동의하지만, 인력 수급 등 여러 가지를 고려해 정책이 연착륙하도록 정책제언을 마련했다고 말했다.    중소기업중앙회는 중기중앙회 의뢰로 작성한 롤랜드버거의 이 정책제언을 국회, 고용노동부, 중소벤처기업부 등에 전달할 예정이다.    롤랜드버거는 1967년 설립된 유럽 최대 독일 컨설팅업체로 자동차, 인프라 구축, 에너지, 국가전략 등 다양한 분야의 컨설팅을 수행하고 있다. 2016년 삼성전자가 미국의 전장전문기업인 하만을 인수할 때 컨설팅을 맡았다. 박성택 중소기업중앙회장[연합뉴스 자료사진]sungjinpark@yna.co.kr▶기사제보 및 문의▶기자와 1:1 채팅\xa0\xa0▶평창동계올림픽 영상 공모전연합뉴스 관련뉴스해당 언론사에서 선정하며 언론사 페이지(아웃링크)로 이동해 볼 수 있습니다.\xa0""박유천 반려견에 얼굴 물려서…"" 뒤늦게 고소한 지인\xa0이대 주치의 ""내 책임 아냐""…간호사·병원에 책임 돌려\xa0""25살 전엔 연애 안돼"" 훈계하던 목사가 되레 성추행\xa0[사진오늘] 첫새벽의 경악…사망자만 6천4백34명\xa0""승무원이 라면 쏟아 주요부위 화상"" 승객에 1억 배상좋아요0훈훈해요0슬퍼요0화나요0후속기사 원해요0기사제공 :']"
13,삼성전자, 2018-01-1712:00,뉴스1 ,"""최저임금 인상·근로시간 단축, 비용↑매출↓…韓기업 생존력 저해""",https://finance.naver.com/news/news_read.nhn?article_id=0003154195&office_id=421&mode=search&query=삼성전자&page=5,"['       ""최저임금 인상·근로시간 단축, 비용↑매출↓…韓기업 생존력 저해""      기사입력2018-01-17 12:00기사원문좋아요훈훈해요좋아요 평가하기공감좋아요0훈훈해요0슬퍼요0화나요0후속기사 원해요0댓글중소기업중앙회© News1유럽 최대 컨설팅업체 롤랜드버거 ""현실 고려한 노동정책 필요""(서울=뉴스1) 이승환 기자 = 유럽 최대 컨설팅 업체가 한국의 \'최저임금 1만원\'과 \'근로시간 단축\' 정책이 기업 생존력을 저해할 것이라고 지적했다. 정부의 현 노동정책이 막대한 비용 증가와 매출 감소의 부담을 기업에 안긴다는 것이다.독일 컨설팅업체 롤랜드버거의 서울사무소 이수성 대표는 17일 여의도 중소기업중앙회에서 중소기업일자리위원회가 주최한 \'노동시장 구조개혁 정책제언 보고회\'에서 이 같이 주장했다.이수성 대표는 ""4차 산업혁명이라는 시대적 변화를 선도하고, 양극화라는 사회적 현안을 해결하기 위해선 노동정책의 \'시스템적 균형\'이 필요하다""며 ""근로안정성과 노동유연성의 균형으로 사용자와 근로자가 함께 윈윈할 수 있는 노동정책이 필수적""이라고 제언했다.특히 전체 중소제조기업 중 47%가 대기업에 납품하는 한국 산업구조상 대기업의 부담이 수급(하청) 중소기업에 전가될 수 있어 현실을 고려한 노동 정책이 필요하다고 강조했다.이 대표는 ""소비자 물가지수·근로자 생계비·임금상승률에 따라 최저임금 산정 기준을 명확하게 마련해야 한다""며 ""연령·산업·지역·직능별 차등 적용은 물론 최저임금 산입 범위에 기본급과 함께 고정상여금·숙식수당을 포함해야 한다""고 말했다. 중소기업계가 최저임금 인상과 관련해 정부에 요구하는 내용과 사실상 같은 것이다. 국회 논의 중인 근로시간 단축에 대해서도 중기업계와 비슷한 의견을 내놨다.이 대표는 ""현행 주당 최대 68시간 근로시간을 국회 단축안대로 52시간으로 줄이면 중소기업의 인력난을 심화할 수 있다""며 ""선도국의 연평균 1시간 내외 단축속도에 비해 너무 빠르다""고 지적했다. 이어 ""전체 부족인력의 55%를 차지하는 30인 미만의 영세사업장에 대해 노사 합의시 주 최대 8시간의 특별연장 근로를 허용해야 한다""고 강조했다.아울러 산업계의 해고 유연화, 연공제 중심 임금체계, 노동자 중심 불분명한 노사관계도 개선해야 한다고 주문했다. 그는 ""주요 노동정책들을 개별적으로 접근할 것이 아니라 사회적 대화로 한 테이블에서 논의해야 한다""고 제언했다. 롤랜드버거는 1967년 설립된 유럽 최대 규모의 컨설팅 업체다. 2016년 삼성전자가 미국의 전장 전문기 업인 하만을 인수할 당시 컨설팅을 수행해 국내 산업계에도 잘 알려져 있다.중소기업일자리위원회는 이날 발표된 노동시장 구조개혁 정책제언서를 여야대표, 국회 환경노동위원회, 고용노동부, 중소벤처기업부 등에 전달할 계획이다. 문성현 노사정위원장은 예정과 달리 이날 보고회에 참석하지 않았다. 박성택 중소기업중앙회 회장은 ""올해는 혁신성장과 소득주도 성장의 균형을 바탕으로 일자리 개혁을 도모하는 도전의 해""이라며 ""갈등과 논쟁의 대상이 되고 있는 노동문제 해법을 찾고자 이 자리를 마련했다""고 밝혔다.mrlee@▶ \'평창2018\' 관련 뉴스·포토 보기▶ 네이버메인에 ‘뉴스1채널’ 설정하기!▶ 여러분의 제보를 기다립니다.제보하기![© 뉴스1코리아(news1.kr), 무단 전재 및 재배포 금지]뉴스1 관련뉴스해당 언론사에서 선정하며 언론사 페이지(아웃링크)로 이동해 볼 수 있습니다.\'대세\' 손흥민 EPL 파워랭킹 2위…시즌 랭킹은 22위면접 안가고 박사과정 합격한 경희대 아이돌…경찰 수사아들과 40일 금식기도 70대 노모 안방서 숨져""엄마에게 알리지마""…어린 딸 6년간 성폭행""나는 네 영적아비""…여신도들 강제추행 목사좋아요0훈훈해요0슬퍼요0화나요0후속기사 원해요0기사제공 :']"
