,회사명,날짜,언론사,기사제목,링크,본문
0,삼성전자, 2019-03-2417:58,매일경제 ,삼성 주방가전 美·佛매체서 호평,https://finance.naver.com/news/news_read.nhn?article_id=0004325479&office_id=009&mode=search&query=삼성전자&page=2,"['       삼성 주방가전 美·佛매체서 호평      기사입력2019-03-24 17:58기사원문좋아요훈훈해요좋아요 평가하기공감좋아요0훈훈해요0슬퍼요0화나요0후속기사 원해요0댓글쿡톱·월오븐 6개 `베스트 모델`로삼성전자의 프리미엄 주방가전이 미국·프랑스 소비자 전문매체로부터 잇달아 호평을 받았다.24일 전자 업계에 따르면 삼성전자 제품은 미국 유력 소비자 전문지 컨슈머리포트(CR)가 시중에서 판매하는 가스·전기·인덕션 쿡톱과 전기 월오븐을 대상으로 한 성능 평가에서 총 8개 부문 중 6개 부문이 \'베스트 모델\'에 올랐다. 가스 쿡톱에서는 30인치와 36인치 부문에서 모두 평점 92점을 차지해 동시 1위에 올랐다.또 전기 쿡톱에서는 30인치 부문의 경우 추천 제품에 포함되지 못했으나 36인치 부문에서 고온·저온 성능 테스트에서 최고 등급을 받았다. 평점 91점으로 LG전자 제품(90점)과 함께 최우수 인증을 받았다.인덕션 쿡톱의 경우 30인치 부문에서 삼성이 인수한 미국의 럭셔리 가전 브랜드인 데이코 제품이, 36인치 부문에서 삼성전자 제품이 각각 3위와 2위를 차지하며 \'베스트 모델\' 명단에 나란히 이름을 올려 눈길을 끌었다.이 밖에 전기 월오븐의 경우 모두 6개 모델이 추천 제품에 선정됐는데, 삼성전자 모델이 더블 오븐 부문에 선정됐다. 아울러 프랑스 소비자연맹이 발간하는 전문지 \'크 슈아지르\'가 인덕션 191개 모델을 대상으로 실시한 평가에서 삼성전자는 프랑스 사우터, 스웨덴 일렉트로룩스와 함께 공동 1위에 올랐다. 또 식기세척기 평가에서는 평점 73점으로, 독일 밀레(74.5점)에 다소 뒤졌지만 동시에 \'최고 추천\' 제품으로 선정됐다.삼성전자 관계자는 ""지난해 컨슈머리포트가 선정한 \'올해의 쿡톱\'에도 4개 부문 가운데 3개나 포함됐으며, 인덕션은 프랑스 IT 매체 \'레 뉘메리크\'의 성능 평가에서 만점을 차지했다""고 말했다. 또 이 관계자는 ""사용성과 조리성, 소음, 에너지 등에서 모두 좋은 평가를 받으면서 프리미엄 입지를 굳히고 있다""고 말했다. [이상덕 기자]▶매경 뉴스레터 \'매콤달콤\'을 지금 구독하세요▶뉴스 이상의 무궁무진한 프리미엄 읽을거리[ⓒ 매일경제 & mk.co.kr, 무단전재 및 재배포 금지]매일경제 관련뉴스해당 언론사에서 선정하며 언론사 페이지(아웃링크)로 이동해 볼 수 있습니다.회계감사 대란…\'비적정\' 벌써 22곳[부동산 알쏭달쏭] 성냥갑 아파트 이제 그만…특별건축구역 지정 확산버닝썬, 삼합회 연루 의혹…린사모 거론靑, 경호원 기관총 사진… ""교과서적 대응""이미숙, 故장자연 연이은 의혹에…마침내 입 열었다좋아요0훈훈해요0슬퍼요0화나요0후속기사 원해요0기사제공 :']"
1,삼성전자, 2019-03-2417:43,한국경제 ,"""기업이 투자하면 나머진 우리가"" 항구 지어주고, 공장 건설비 페이백",https://finance.naver.com/news/news_read.nhn?article_id=0004113112&office_id=015&mode=search&query=삼성전자&page=2,"['       ""기업이 투자하면 나머진 우리가"" 항구 지어주고, 공장 건설비 페이백      기사입력2019-03-24 17:43기사원문좋아요훈훈해요좋아요 평가하기공감좋아요0훈훈해요0슬퍼요0화나요0후속기사 원해요0댓글기업하기 참 힘든 나라세계 각국, 기업 유치에 사활거는데…한국기업 유치 위해 내건 \'파격혜택\'[ 고재연/김재후 기자  ] 지난 19일 미국 조지아주 커머스시에서  열린 SK이노베이션  배터리 공장 기공식.2017년 초 삼성전자가 중국에 두 번째 낸드플래시 반도체 공장을 짓기 위해 장소를 물색할 때였다. 이미 1공장이 있는 시안뿐만 아니라 상하이, 충칭 등 중국의 각 지방자치단체들이 각종 인센티브를 내걸며 ‘러브콜’을 보냈다. 여러 지역과 ‘밀당(밀고 당기기)’을 이어가던 삼성전자는 같은해 8월 시안에 두 번째 공장을 짓기로 결정했다. 투자 규모는 1공장과 같은 70억달러(약 7조9000억원). 1인당 국민소득이 1만달러를 밑도는 데다 주변이 온통 밀밭뿐이었던 시안시는 그렇게 ‘삼성 타운’으로서의 입지를 굳혔다. 당시 투자에 관여했던 삼성전자 관계자는 “중국 공무원들의 변화에 깜짝 놀랐다”고 배경을 설명했다.“공무원이 달라졌어요”2012년 1공장 건설을 준비할 때만 해도 산시성과 시안시 공무원들은 반도체가 무엇인지 제대로 알지 못했다. 반도체 생산을 위해 필요한 인프라와 해결해야 할 규제 및 법령 등에 대한 지식도 전무했다. 삼성전자 임직원들이 나서 일일이 법규를 열거해 가며 필요한 부분을 먼저 고쳐달라고 알려줘야 했다. 하지만 5년 뒤 2공장 건설을 논의할 때는 분위기가 180도 달라져 있었다. 현지 공무원들은 모든 법령을 ‘마스터’하고 있었다. 어떤 절차를 통해 규제를 풀고 지원을 해줘야 하는지를 낱낱이 파악하고 있었다.다른 도시에 삼성 반도체 공장을 뺏길 수 없다는 ‘위기감’ 때문이었다. 삼성 관계자는 “아침에 고위 공무원들을 만나 요구 사항을 전달한 뒤 저녁에 한국행 비행기를 타러 가는데 시장이 보낸 승인 서류가 이메일로 날아왔다”고 떠올렸다. 그는 “다른 나라였다면 최소 1주일은 걸렸을 것”이라며 “반도체산업 육성과 지역 경제 활성화를 위해 중국이 그만큼 필사적이라는 인상을 받았다”고 설명했다.세계 주요국들은 기업 유치에 사활을 걸고 있다. 일자리와 세수를 창출하는 것은 결국 기업의 투자라는 판단 때문이다. 공장 부지 무상제공은 기본이고 전력, 용수, 도로 등 인프라를 ‘원스톱’으로 해결해 준다. 삼성전자를 위해 고속도로를 건설하고, 현대자동차를 위해 항구를 만들어주겠다고 약속할 정도다. 각종 세제혜택은 물론 투자액의 일정 비율을 현금으로 ‘페이백’해주는 사례도 적지 않다.맞춤형 인센티브 제공최근 전기자동차 시대를 맞아 ‘증설 경쟁’이 한창인 배터리 제조업체들은 해외 주요 지자체들이 앞다퉈 모시기에 혈안이 돼 있는 대상이다. 2017년 5월 ‘SK이노베이션, 동유럽에 전기차 배터리 공장 설립 검토’라는 외신기사가 나가자 체코, 폴란드, 슬로바키아, 헝가리 등 동유럽 국가의 각 지자체가 SK이노베이션 공식 이메일로 각종 인센티브를 약속하며 러브콜을 보냈다. 6개월에 걸친 검토 끝에 SK이노베이션이 선택한 곳은 헝가리 북부 코마롬이었다. 이 회사 관계자는 “헝가리투자청에는 한국을 담당하는 전담직원이 상주하고 있다”며 “한국 기업이 동유럽에 공장 건설을 검토한다는 보도가 나오면 유치를 위해 발벗고 나선다”고 설명했다.이미 공장을 지은 기업에도 세제 혜택을 중단하지 않는다. 유럽연합위원회(EC)는 LG화학 브로츠와프 배터리 공장 건설비의 11%에 해당하는 3600만달러를 현금으로 되돌려주기로 했다. EU는 “보조금 지급으로 인한 시장 경쟁 왜곡 우려보다는 지역 경제 발전에 미칠 긍정적인 효과가 훨씬 크다”고 배경을 설명했다. LG화학은 유럽 내 2공장 건설을 고려 중이다. 각종 지원 덕분에 폴란드 브로츠와프에 2공장을 설립할 가능성이 높은 것으로 알려졌다.파격적인 기업 친화 정책에 힘입어 자동차, 배터리 업체들을 빨아들인 동유럽 국가들은 경제난에서 벗어나 ‘일자리 천국’으로 변하고 있다. 도로변 광고판의 상당수는 ‘사람 구합니다’라는 내용으로 채워질 정도다. 헝가리와 폴란드의 지난 1월 실업률은 각각 3.6%, 3.7%로 사실상 완전고용 상태다. 유럽연합(EU) 회원국 중에서도 실업률이 가장 낮은 국가에 속한다.숙련공 교육까지 지원해외 주요국 지자체들은 맞춤형 인력 육성을 돕는 일에도 적극적이다. SK이노베이션 전기차 배터리 공장을 유치한 미국 조지아주가 대표적이다. 2000명이 넘는 배터리 숙련공이 필요한데, 최저 실업률을 자랑하는 미국에서 이렇게 많은 인원을 구하기는 쉽지 않았다. 주 정부는 해외 투자 기업을 위한 인력지원 프로그램 ‘퀵스타트’를 가동해 인력 육성에 나서기로 했다. 2006년 기아자동차가 조지아주에 투자했을 때도 이 프로그램이 효과를 발휘했다. 김준 SK이노베이션 총괄사장은 “퀵스타트 시스템이 워낙 잘 갖춰져 있기 때문에 SK의 인력양성 프로그램을 그냥 얹으면 된다”며 “인센티브는 다른 주와 큰 차이가 없었지만 주 공무원들의 기업 친화적 역량과 열정에 감동했다”고 말했다.하림이 2011년 미국 메릴랜드주 닭 가공회사 알렌패밀리푸즈(현 알렌하림푸즈)를 인수했을 때는 주 정부 공무원이 찾아와 먼저 교육비 지원을 제안하기도 했다. 당시 사업 확장을 위해 450명의 직원을 새로 뽑았는데, 주 정부 공무원이 “신규 직원들은 현장 교육이 필요하다”며 교육 프로그램과 교육비를 지원했다. 당시 폐수 처리 문제가 논란이 됐을 때는 메릴랜드 주지사가 직접 식수를 마시며 지역주민들을 설득하기도 했다.CJ제일제당은 2015년 6월 말레이시아 테렝가누주에 8만t 규모의 사료용 필수아미노산 공장을 건설한 뒤 잦은 발전기 고장으로 어려움을 겪었다. 사정을 전해 들은 말레이시아 정부는 “전력 문제는 전적으로 정부 책임”이라며 2500만달러의 발전기 교체 비용을 모두 부담했다. 평택 반도체 공장에 전력을 공급하기 위해 750억원이라는 ‘값비싼 통행료’를 지급해야 하는 삼성전자의 사례와 극명하게 비교된다는 지적이 나온다.고재연/김재후 기자 yeon@hankyung.com[한경닷컴 바로가기] [모바일한경 구독신청] 네이버에서 한국경제 채널 구독하기 <자세히 보기> ⓒ 한국경제 & hankyung.com, 무단전재 및 재배포 금지한국경제 관련뉴스해당 언론사에서 선정하며 언론사 페이지(아웃링크)로 이동해 볼 수 있습니다.""아파트, 지하철 5분 거리? 그게 중요한게 아니고…""문 대통령 경호관 기관단총에…""섬뜩""양현석 꼬리 밟혔나…국세청, 대규모 인력 투입\'이부진 프로포폴\' 병원서 나온 장부가…""샤넬 뺨치는 북한 화장품""좋아요0훈훈해요0슬퍼요0화나요0후속기사 원해요0기사제공 :']"
2,삼성전자, 2019-03-2417:34,매일경제 ,갤S10 5G폰 150만원 육박,https://finance.naver.com/news/news_read.nhn?article_id=0004325455&office_id=009&mode=search&query=삼성전자&page=2,"['       갤S10 5G폰 150만원 육박      기사입력2019-03-24 17:34기사원문좋아요훈훈해요좋아요 평가하기공감좋아요0훈훈해요0슬퍼요0화나요0후속기사 원해요0댓글갤럭시S10 5G. [사진제공 = 삼성전자] 24일 정보기술(IT) 업계에 따르면 다음달 5일 출시될 삼성전자 갤럭시S10 5G는 140만원을 넘어 150만원에 육박할 것으로 관측된다. 갤럭시S10 5G가 150만원에 출시되면 3년 전 96만8000원에 출시됐던 갤럭시S7 최고 사양 모델(에지 64GB)보다 55%(53만원)가량 높아진다. 할부금은 24개월 기준 월 6만2500원에 달한다. 만약 출고가가 105만원인 갤럭시S10 LTE 128GB를 사용하는 고객이 5G 단말로 변경하면 월 2만원가량 할부금이 증가한다. 5G 상용화 시점에 맞춰 5G 서비스를 이용하려는 고객은 150만원에 달하는 갤럭시S10 5G 단말을 무조건 선택해야 해 고객 선택권이 제한된다는 지적도 나온다.  [이동인 기자]▶매경 뉴스레터 \'매콤달콤\'을 지금 구독하세요▶뉴스 이상의 무궁무진한 프리미엄 읽을거리[ⓒ 매일경제 & mk.co.kr, 무단전재 및 재배포 금지]매일경제 관련뉴스해당 언론사에서 선정하며 언론사 페이지(아웃링크)로 이동해 볼 수 있습니다.회계감사 대란…\'비적정\' 벌써 22곳[부동산 알쏭달쏭] 성냥갑 아파트 이제 그만…특별건축구역 지정 확산버닝썬, 삼합회 연루 의혹…린사모 거론靑, 경호원 기관총 사진… ""교과서적 대응""이미숙, 故장자연 연이은 의혹에…마침내 입 열었다좋아요0훈훈해요0슬퍼요0화나요0후속기사 원해요0기사제공 :']"
3,삼성전자, 2019-03-2417:32,파이낸셜뉴스 ,[심상찮은 반도체 경기] '반도체 쇼크' 영업익 절반 날아갔다,https://finance.naver.com/news/news_read.nhn?article_id=0004198586&office_id=014&mode=search&query=삼성전자&page=2,"['       [심상찮은 반도체 경기] \'반도체 쇼크\' 영업익 절반 날아갔다      기사입력2019-03-24 17:32기사원문좋아요훈훈해요좋아요 평가하기공감좋아요0훈훈해요0슬퍼요0화나요0후속기사 원해요0댓글1분기 실적 전망 비관적D램 · 낸드플래시값 급락 여파..삼성 영업익 48.1% 감소 예고하이닉스는 57% 가까이 줄듯                   삼성전자와 SK하이닉스 등 반도체 기업들의 올 1·4분기 실적이 전년의 반토막으로 \'어닝쇼크\' 수준일 것이라는 전망이 나오고 있다. 지난해 말부터 시작된 시황둔화 여파로 실적부진은 전망됐지만 하락 폭이 예상을 뛰어넘을 것이란 관측이 지배적이다. 하반기 수요 회복에 힘입어 시황이 개선될 것이란 기대도 나오지만 가격이 급변하는 메모리 반도체 시장의 구조적 한계는 여전하다는 지적이다. 이에 변동성이 적고 경쟁력이 뒤처진 비메모리 사업을 육성해야 한다는 목소리가 점차 커지고 있다.24일 금융정보업체인 에프앤가이드에 따르면 반도체 기업들의 1·4분기 영업이익은 지난해 같은 기간에 비해 절반가량 줄어들 것으로 예상된다.삼성전자의 올 1·4분기 영업이익 전망치는 8조1177억원으로 전년(15조6422억원)보다 48.1% 감소할 것으로 추정됐다. SK하이닉스는 같은 기간 1조8847억원의 영업이익을 거둬 전년(4조3673억원)에 비해 56.8% 급감할 것으로 전망됐다.실적 감소는 전 세계 반도체 경기둔화에 따른 결과로 풀이된다. 지난해 반도체 시장의 \'슈퍼사이클\'에 힘입어 최대 실적을 달성했지만 올해는 경기둔화와 기저효과도 겹쳐 실적이 크게 줄어들 것으로 보인다.특히 D램과 낸드플래시 등 메모리 반도체 가격이 올 들어 단기간에 급락하면서 예상보다 시황 약세 폭이 크다는 게 업계의 분석이다.실제 주력 제품인 D램 가격이 올 들어 사상 처음으로 두 달 연속 두자릿수대 하락폭을 나타냈다. 반도체 시장조사기관인 D램익스체인지는 지난달 D램 고정거래가격이 개당(DDR4 8Gb 기준) 5.13달러로 전월 대비 14.5% 하락했다고 발표했다. 지난 1월엔 전달에 비해 17.24% 하락한 바 있다. 지난해 고점을 기록했던 9월(8.19달러)에 비해 37.4%나 급락했다. 낸드플래시 가격도 하락했다. 지난달 128Gb MLC 기준으로 개당 4.22달러를 기록, 전월 대비 6.64% 하락했다. 지난해 6월 가격(5.6달러)보다 24.6% 떨어졌다.업계 관계자는 ""가격 하락세가 예상보다 가파르다""면서도 ""하락폭이 점차 둔화되고 있어 하반기 수요회복과 공급과잉 해소에 대비하고 있다""고 설명했다.gmin@fnnews.com 조지민 기자     ▶ 세상의 모든 골 때리는 이야기 \'fn파스\'▶ 속보이는 연예뉴스 fn스타  ※ 저작권자 ⓒ 파이낸셜뉴스. 무단 전재-재배포 금지파이낸셜뉴스 관련뉴스해당 언론사에서 선정하며 언론사 페이지(아웃링크)로 이동해 볼 수 있습니다.\'성관계를 할 만한 대상이냐\' 졸업한 현직교사 카톡방에는..지독한 입냄새, 이닦아도 계속 나 병원갔더니만취해 침대에 누워있던 여성에게 동의없이 수차례..아내 살해 후 논두렁에 유기한 男, 한다는 말이..신형 쏘나타 출고 지연…갑자기 무슨 일?좋아요0훈훈해요0슬퍼요0화나요0후속기사 원해요0기사제공 :']"
4,삼성전자, 2019-03-2417:32,매일경제 ,최신 휴대폰 60% 할인…백화점 29일부터 세일,https://finance.naver.com/news/news_read.nhn?article_id=0004325452&office_id=009&mode=search&query=삼성전자&page=2,"['       최신 휴대폰 60% 할인…백화점 29일부터 세일      기사입력2019-03-24 17:32기사원문좋아요훈훈해요좋아요 평가하기공감좋아요0훈훈해요0슬퍼요0화나요0후속기사 원해요0댓글웨딩·이사철 생활용품 특가나들이철 스포츠의류도 눈길백화점 봄 정기 세일이 29일부터 일제히 시작된다. 최신형 휴대폰, 무선 이어폰 등 전자기기를 절반 이하 가격에 파는가 하면 봄을 맞아 스포츠 의류 등 할인도 본격화했다. 웨딩·이사철 맞이 생활용품 특가도 눈에 띈다.롯데백화점은 29일부터 다음달 14일까지 온·오프라인 봄 정기세일에 들어간다. 백화점 애플리케이션 가입 고객을 대상으로 일별 40명에 한해 나흘간 삼성 갤럭시S10을 정상가(105만6000원)보다 60% 저렴한 44만원에 판다. 앱에서 \'특가 구매 쿠폰\'을 내려받아 롯데백화점 삼성전자 매장을 방문해 구매하면 된다.나이키·푸마 등 스포츠 제품도 최대 30% 할인한다. 잠실점 \'코스메틱 페어\'에서는 화장품 단일 브랜드를 일정 금액 이상 구매하면 백화점 모바일 상품권도 받을 수 있다. 골프 관련 상품전은 본점 4월 2일, 강남점은 이달 말까지 열어 다양한 제품을 70% 이상 할인해준다.현대백화점도 같은 기간 \'사월의 봄\'에 착안한 \'사봄제\'를 테마로 정기세일에 들어간다. 상대적으로 할인 폭이 작았던 리빙 상품을 직매입해 할인율을 높였다. \'뱅앤올룹슨 베오플레이 무선이어폰\'을 56% 할인한 19만9000원, \'블루에어 공기청정기\'를 65%나 저렴한 9만9000원, \'필립스 에어프라이어\'를 47% 할인된 19만9000원에 선보인다.다음달 5~7일 띠어리·산드로·클럽모나코 등 50여 개 수입의류 브랜드는 구매 금액대별로 5~10% 할인 혜택을 준다. 톰브라운·꼼데가르송 등 20여 개 남성 컨템퍼러리 브랜드도 금액 할인과 사은품 증정 혜택을 준다. 무역센터점은 오는 31일까지 \'봄맞이 골프대전\'에서 이월상품을 절반가량 저렴하게 팔고, 압구정본점은 아테스토니·브로이어 등 10여 개 브랜드 이월 상품을 최대 50% 싸게 판다. 목동점은 \'인덕션·가전 할인전\'에서 진열 상품을 60% 할인 판매한다.신세계백화점은 다음달 7일까지 정기세일이다. 다양한 와인을 30~80% 할인한 \'와인 창고 대방출전\'이 대표적이다. 이탈리아 고급 와인 \'오르넬라이아 1.5ℓ 14\'를 정가의 절반인 60만원에 판다. 지난해 판매량이 높았던 스파클링 와인 100품목을 선정해 팔고, 375㎖의 소용량 와인도 다수 선보여 야외활동을 즐기는 \'아웃도어족\'이나 \'혼술족\'을 정조준할 예정이다.갤러리아백화점과 AK플라자도 다음달 14일까지 봄 정기세일을 진행해 다양한 경품 이벤트와 할인행사를 벌인다. [강인선 기자]▶매경 뉴스레터 \'매콤달콤\'을 지금 구독하세요▶뉴스 이상의 무궁무진한 프리미엄 읽을거리[ⓒ 매일경제 & mk.co.kr, 무단전재 및 재배포 금지]매일경제 관련뉴스해당 언론사에서 선정하며 언론사 페이지(아웃링크)로 이동해 볼 수 있습니다.회계감사 대란…\'비적정\' 벌써 22곳[부동산 알쏭달쏭] 성냥갑 아파트 이제 그만…특별건축구역 지정 확산버닝썬, 삼합회 연루 의혹…린사모 거론靑, 경호원 기관총 사진… ""교과서적 대응""이미숙, 故장자연 연이은 의혹에…마침내 입 열었다좋아요0훈훈해요0슬퍼요0화나요0후속기사 원해요0기사제공 :']"
