,회사명,날짜,언론사,기사제목,링크,본문
0,삼성전자, 2019-03-2422:36,이데일리 ,"[미리보는 이데일리 신문]“회계사 검증 분기보고제, 확대 방안 검토해봐야”",https://finance.naver.com/news/news_read.nhn?article_id=0004337395&office_id=018&mode=search&query=삼성전자&page=1,"['       [미리보는 이데일리 신문]“회계사 검증 분기보고제, 확대 방안 검토해봐야”      기사입력2019-03-24 22:36기사원문좋아요훈훈해요좋아요 평가하기공감좋아요0훈훈해요0슬퍼요0화나요0후속기사 원해요0댓글 [이데일리 김미경 기자] 다음은 25일자 이데일리신문 주요 기사다.△1면-“회계사 검증 분기보고제, 확대 방안 검토해봐야”-1더하기 1은 ‘2+α’ 숍인숍 마법이 뜬다…위기의 오프라인 유통 새 트렌드-33세 일본 공무원의 ‘플라잉카’ 산업 도전기-新남방 정책 성과, 민간 중심 네트워크 확대에 달렸다-[사설]북한은 미국이 내미는 손 뿌리치면 안된다-[사설]OCED 하위권에 멈춘 한국 수출실적△줌인&-[ZooM In]주총 시즌…찻잔 속 태풍 그친 행동주의 펀드의 교훈-늑장 국회에…스텝 꼬인 최저임금 결정체계 개편안-올 경제성장률 2.4% 전망…전년比 0.3%p↓△아시아나항공 거래정지 파문-해마다 되풀이 되는 ‘감사 포비아’…쫓기듯 진행, 해명할 새도 없이 ‘비적정’, ‘연중감사’ 도입 서둘러야-그룹 매출 60% ‘핵심’ 재무구조 개선작업 비상…금호아시아나그룹 영향은-금호고속 상장 카드 꺼내나…그룹 유동성 위기 탈출, 장기적 성장 실탄 확보 ‘일석이조’△적극행정으로 날개 펼친 日 플라잉카-만화가 현실로…‘재팬드론 2019’서 본 미래 교통수단-‘하늘 택시’ 양산 준비 한창인데…이제야 시제품 만들겠다는 한국-이낙연 총리 “적극행정 실천 공무원에 인센티브”△숍인숍서 해법 찾는 위기의 오프라인 매장-주유소와 손잡은 택배…편의점으로 들어온 세탁소-이마트24 전담팀이 말하는 숍인숍 확장 가능성-日 신주쿠에 유니클로·빅 카메라 결합 ‘빅클로’ 등장…해외이색 숍인숍△IEFC 제8회 국제경제·금융컨퍼런스-핀테크산업 내년께 10조원 규모로 성장…韓 선진금융 지원 절실-“전자실명인증·P2P금융 집중…올초 핀테크랩도 설치”-새로운 기회, 베트남 국영기업 지분투자 “비상장기업 사고파는 ‘업콤’ 시장 주목해야”-“보험시장 성장 가팔라…정체기 韓보호사들엔 기회”-“국영은행 빚 600조 동 달해…부채절감 가장 급해”-“베트남 금융시장 견고…블록체인 서비스 전망 밝아”-제조업 직접투자 넘어…‘현지기업 주식 취득’ M&A 주목해야-베트남 젊은 인적자원 풍부, 비자발급 요건 등 완화 절실-‘반쪽’ 한·베 FTA…서비스·투자업 추가 협상해야-투자자-창업자 만남의 장 스타트업 타운 만들어야-베트남 M&A 규모 매년 증가세…작년에만 6500건 진행-또렷한 한국어 발음으로 K팝 부르고 퍼포먼스…“아이돌 꿈을 향해”-쉬는시간 명함 주고받으며 “씬짜오”…한베 기업인 ‘비즈니스 기회의 장’△한반도 이슈 안개 속으로-북핵 문제는 중장기 이슈…안보 운전대 내려놓고 경제 운전대 잡아야-트럼프, 대북 추가 제재 취소 지시…김정은, 화답할까-통일부 “南 공동연락사무소 인력, 오늘 정상 출경”△정치-“친위대 개각, MRI 검증” VS “낙마자 예단 말라”-[파워 초선] 자유한국당 대변인 전희경 의원 “강성? 원칙 신념에 충실할 뿐…누군가는 진실 이야기해야”-하태경 “기관단총 경호, 섬뜩”…靑 “정당한 직무수행”-윤종원 “부동산으로 경기 부양 안할 것”△경제·금융-비과세종합저축·주택청약저축 폐지 검토…어르신·무주택자 어쩌나-[팩트 체크]“포항지진은 지열발전 탓”…지열 냉난방은 괜찮을까-수상 태양광, 해상 풍력발전 등…남동발전, 신재생에너지에 힘 실어-창업벤처중기 성장지원 위해 ‘신한 혁신금융 추진위원회’ 출범△산업&기업-꺾이는 업황…석유화학 ‘新대표’ 승부수-합병 태클 거는 글로벌 선사…현대重·대우조선 ‘조선빅딜’ 험로-서울모터쇼, 7개 테마관 ‘모빌리티쇼’ 탈바꿈…29일 개막-“LG그룹, 4년내 IT시스템 90% 클라우드로 전환”-사전예약자에 ‘TJ쿠폰’…리니지 아이콘 된 김택진△산업·소비자생활-스마트폰 앱만 있으면…커피·치킨도 ‘미리’ 주문·결제 OK-신세계푸드 ‘대박라면’ 말레이시아 입맛 ‘올킬’-소스·과자·건강식품도 ‘TPO’ 맞게 드세요-KT, VR 플랫폼·콘텐츠 유통사업 본격화…해외진출도 추진△중소기업·;바이오-엄태관 오스테임플란트 대표 “가르쳐서 쓰게 한다…150곳 임상교육센터가 글로벌 경쟁력 원천”-직방 같은 부동산 중개앱, 韓모델 들고 印尼 간 K-스타트업 승승장구-여성경제인협회 ‘TV홈쇼핑 입점지원’ 사업△증권&마켓-이번주 상장사 1611곳 무더기 주총…‘분산 당근책’에도 막판 쏠림, 왜-연준이 날린 비둘기 타고 코스피 2200선 다시 노려-장사 못했다는 美 마이크론의 ‘이익률 34%’…삼성전자도 웃을까△증권-오피스 벗어나…경기 덜 타는 美日 고급아파트 투자할 것, 장동헌 행정공제회 CIO-과학기술인공제회 CIO 5파전…내달 중순 인선-다시 열리는 中 전기차 시장…배터리株 반등할까-‘남북경협주’ 아난티 주가, 겹악재에 한 달 새 반토막△문화-한국영화 100주년 기념사업추진위원장 맡은 이장호 감독 “100인이 만든 100색 영화…한국영화의 역사·미래 담아낼 것”-최초의 韓영화 광화문서 부활…영화 ‘의리적 구토’ 10월 재연 계획-천하의 이병헌도 UFC선수 앞에선 ‘아, 안돼’…광고의 무기는 스토리텔링, 화제의 모바일게임 광고 만든 돌고래유괴단 신우석 감독△스포츠-‘반갑다 야구야’…꽃샘추위에도 프로야구 개막 이틀째 구름관중, 개막 2연전 21만4340명 몰려-일당 1억원 메이저리거 vs 월급 120만원 마이너리거-구자철·기성용 공백은 없다…권창훈·주세종 벤투호 새희망△피플-김태환 농협 축산경제 대표 “한우 생산·판매·컨설팅 ‘전방위’ 지원…수입산 공세에 맞설 것”-“암센터 환자들에 건강한 물” LG, 퓨리케어 정수기 기증-KT·연세의료원 ‘꿈품교실’ 개소-유준상 “막장 비판엔 속상했지만…촬영 내내 풍상역에 푹 빠졌죠”-이상직 중소기업진흥공단 이사장 한국경영학회 ‘최우수경영 대상’△오피니언-[목멱칼럼]유럽은 어떻게 출산율을 끌어올렸나-[전문기자칼럼]감정평가 안하는 한국감정원-[e갤러리]홍정희 ‘나노’-[기자수첩]예술의전당 사장 임명을 둘러싼 논란△부동산-입주대란 우려 9510가구 대단지 입주마감 일주일 전 가보니 ‘헬리오시티’ 80% 입주 착착…“5억대 후반 갔던 전셋값 7억대로 회복”-‘용산 한강삼익’ 건축심의 통과…재건축 속도 낸다-봄 이사철에도…서울 아파트 ‘거래절벽’△사회-김학의 사건, 성접대 뇌물·靑 외압부터 살필 듯…‘특임검사 임명’ 무게-가습기살균제 재수사 ‘최고위층’ 수사 탄력-‘국민연금=용돈연금’ 불명예 벗는다-1회용 봉투 무상제공땐 과태료 최대 300만원-아이돌 탈덕, 클럽 공포증, 내기 금지…‘버닝썬게이트’가 바꾼 일상-국내서 가장 오래된 식당 상표 ‘우래옥’김미경 (midory@edaily.co.kr)총상금 1050만원, 사진 공모전 [나도 사진 기자다▶]이데일리 [구독하기▶] , 청춘뉘우스~ [스냅타임▶]＜ⓒ종합 경제정보 미디어 이데일리 - 무단전재 & 재배포 금지＞이데일리 관련뉴스해당 언론사에서 선정하며 언론사 페이지(아웃링크)로 이동해 볼 수 있습니다.김학의 사건 재수사 급물살…특임검사 임명에 무게(종합)文대통령 경호원, 대구 칠성시장서 기관총 노출 논란\'그알\' 측 ""지창욱, 린사모 설명 위해 사용…사건과 무관""3년간 사랑했던 남자친구가 제 알몸을 찍어 유포했습니다부천서 현직 경찰관이 음주단속 걸려…소주 2병 마셨다좋아요0훈훈해요0슬퍼요0화나요0후속기사 원해요0기사제공 :']"
1,삼성전자, 2019-03-2421:25,경향신문 ,중국 저가 공세에 “프리미엄TV로 승부”,https://finance.naver.com/news/news_read.nhn?article_id=0002930360&office_id=032&mode=search&query=삼성전자&page=1,"['       중국 저가 공세에 “프리미엄TV로 승부”      기사입력2019-03-24 21:25기사원문좋아요훈훈해요좋아요 평가하기공감좋아요0훈훈해요0슬퍼요0화나요0후속기사 원해요0댓글2019년형 QLED TV시그니처 올레드 TV W글로벌 TV 시장에서 영원한 맞수인 삼성전자와 LG전자가 중국 업체의 저가 공세에 맞서 프리미엄 TV를 내세우며 치열한 경쟁을 펼치고 있다.24일 글로벌 시장조사기관 IHS마킷의 최근 1분기 전망 자료를 보면, 삼성전자는 올해 1분기 전 세계 TV 시장에서 19.2%의 점유율로 1위를 기록할 것으로 분석됐다. 삼성전자는 지난해 1분기 점유율(19.2%)과 같은 수준을 유지하긴 했지만 TCL, 하이센스, 스카이워스 등 중국 업체들의 급성장으로 지난해 7년 만에 20%대 점유율이 무너진 뒤 다시 회복하지 못하고 있다. LG전자의 올 1분기 점유율은 13.5%로 글로벌 시장에서 2위를 기록할 것으로 전망했다. 이는 전년 동기(13.2%)보다 0.3%포인트 높아진 수치이긴 하나 뚜렷한 상승세를 보여주지는 못했다.삼성·LG 모두 1년 전과 비슷한 수준을 유지하고 있는 사이 중국 업체들의 추격은 거세지고 있다. 중국 정부가 디스플레이 산업을 키우기 위해 자국 업체들에 보조금을 지원하는 등 다양한 지원을 확대하면서 중국 업체들의 점유율은 갈수록 높아지고 있다.TLC의 올 1분기 점유율은 8.8%로 1년 전보다 1%포인트가량 높아졌다. 하이센스는 같은 기간 6.8%로 1년 전보다 0.6%포인트 확대됐다. 특히 이들 업체는 프리미엄 시장의 격전지인 북미·유럽 지역에서 빠르게 점유율을 늘려가고 있다. TLC는 2017년 9.9%였으나 지난해 12.7%로 높아졌고 하이센스 역시 같은 기간 5.6%에서 8.3%로 높아졌다. 반면 삼성전자는 이 지역에서 2017년 27.9%에서 지난해 23.8%로 점유율이 떨어졌다. LG전자는 2017년 12.3%에서 지난해 13.3%로 올랐다.삼성전자, 세계 TV시장 점유율 올 1분기 19.2% 전망중 업체 급성장에 20%대 점유율 회복 못하고 있지만QLED 라인업 확대 ‘초대형은 삼성’ 전략으로 차별화국내 업체들은 프리미엄 전략을 더욱 강화하면서 중국 업체들과 차별화 전략을 세우고 있다. 삼성전자는 ‘퀀텀닷 디스플레이 양자점발광다이오드(QLED) TV’, ‘초대형화’ 등으로 프리미엄 TV 라인을 확대하고 있다. 김현석 삼성전자 CE(소비자가전)부문 사장은 지난 20일 주주총회에서 “초대형 TV는 기존 75인치와 82인치에서 98인치까지 라인업을 확대하고, QLED TV 라인업의 절반을 초대형으로 구성해 ‘초대형은 삼성’이라는 이미지를 확고히 하겠다”고 설명했다. 지난달 미국에 이어 유럽 42개국에 QLED TV를 순차적으로 출시하고 있다. 국내 출시는 이달 말 예정돼 있다. 삼성의 QLED TV는 스스로 빛을 내는 퀀텀닷 필름을 LCD TV에 덧대 원하는 색을 표현하는 방식이다.  LG전자, 세계 TV시장 점유율 올 1분기 13.5% 전망전년보다 0.3%P ↑…뚜렷한 상승세 보여주지 못해시장 확대된 OLED TV 주력…내달 해외 공략 나서LG전자는 유기발광다이오드(OLED) TV을 주력으로 내세우고 있다. 전체 TV 판매 중 올레드 TV의 비중을 지난해 20%에서 올해 25%까지 늘린다는 목표다. 2013년만에도 LG전자 혼자 올레드 TV를 만들었지만 지난해 하이센스 등 15개 브랜드가 참여하며 시장이 커졌다. LG전자는 지난달 말 2019년형 올레드 TV 신제품을 한국에 첫 출시했으며 다음달 미국을 시작으로 해외 주요국에 순차 출시한다. 지난 1월 미국 소비자가전전시회(CES)에 출품했던 둘둘 말리는 롤러블 TV는 올 하반기에 국내에서 가장 먼저 선보일 예정이다.임지선 기자 vision@kyunghyang.com▶ 네이버 메인에서 경향신문 받아보기 ▶ 두고 두고 읽는 뉴스 ▶ 인기 무료만화©경향신문(www.khan.co.kr), 무단전재 및 재배포 금지경향신문 관련뉴스해당 언론사에서 선정하며 언론사 페이지(아웃링크)로 이동해 볼 수 있습니다.나경원 ""반민특위 아닌 반문특위 비판""···여야 3당 ""국민 우롱 궤변""\'장자연, 10년 전처럼 외면 않겠다\'···연예계 연대 확산승리가 말한 경찰복 대여업체 ""촬영 용도로만 대여""…승리 \'또\' 거짓말?""현대차 쏘나타, 너 떨고 있니?""\'이부진 프로포폴 의혹\' 병원 진료기록 확보좋아요0훈훈해요0슬퍼요0화나요0후속기사 원해요0기사제공 :']"
2,삼성전자, 2019-03-2421:20,SBS ,세계 최초 5G 시대 눈앞…요금제 논란은 진행 중,https://finance.naver.com/news/news_read.nhn?article_id=0000719340&office_id=055&mode=search&query=삼성전자&page=1,"['       세계 최초 5G 시대 눈앞…요금제 논란은 진행 중      기사입력2019-03-24 21:20기사원문좋아요훈훈해요좋아요 평가하기공감좋아요0훈훈해요0슬퍼요0화나요0후속기사 원해요0댓글 <앵커>지금도 통신요금이 비싸다 싶은 분들 많으실 텐데 5G가 되면 얼마나 또 오를까, 이 문제가 다시 논란입니다. 열흘쯤 뒤에 서비스가 시작되는데 이 요금제를 놓고 통신사와 시민단체들 사이에 신경전이 치열합니다.정혜경 기자입니다.<기자>최근 삼성전자의 5G 스마트폰 모델이 국립전파연구원의 적합 인증을 통과하면서 한국의 5G 상용화 시점은 다음 달 5일로 정해졌습니다.미국 통신사 버라이즌이 계획을 앞당겨 다음 달 11일에 5G 스마트폰을 내놓겠다고 나섰지만 6일 차이로 \'세계최초 5G 서비스\' 타이틀을 지킬 수 있게 된 겁니다.이제 중요한 건 소비자들이 수용할 수 있는 5G 요금제입니다.최근 7만 원에서 12만 원대의 요금제를 제시했다가 좌절된 SKT는 정부 자문위원회의 권고대로 중저가의 5만 원대 요금제를 추가할 것으로 보입니다.하지만 소비자 단체가 구성한 \'5G 요금 내리는 시민 행동\'은 출근길 캠페인을 벌이며 통신사들을 압박하고 나섰습니다.기존의 LTE처럼 3~4만 원대의 요금제와 함께 현재 80배 정도나 차이 나는 최고 최저 구간의 데이터양 차이도 20배 이하로 줄여야 한다는 겁니다.[김주호/참여연대 민생팀장 : 와이파이라던가 다양한 방법을 통해 5G를 충분히 활용하실 수 있습니다. 저가 요금제를 일단 만들어야 선택의 폭이 훨씬 넓어질 수 있다고 생각합니다.]저가 요금제는 대용량 데이터를 이용하는 5G 통신에선 의미가 약하고 미국의 경우 한국보다 더 비싼 요금제를 내놨다는 게 통신사들의 항변입니다.하지만 서울 등 대도시에 많은 이용자가 몰려 있는 한국은 기지국 구축 등 통신사들의 비용 부담이 훨씬 적다는 지적이 나옵니다.특히 가계지출의 통신비 비중이 특히 큰 한국에서는 요금제가 사실상의 \'생계 비용\'인 만큼 시작 단계부터 이용자들의 편익을 우선해야 한다는 목소리가 높습니다.(영상취재 : 설민환, 영상편집 : 김종태, VJ : 한승민)\xa0정혜경 기자(choice@sbs.co.kr)▶[핫이슈] \'승리·정준영 카톡방\' 전방위 수사▶[핫이슈] 김학의·장자연 사건▶네이버 메인에서 SBS뉴스 구독하기※ ⓒ SBS & SBS Digital News Lab. : 무단복제 및 재배포 금지SBS 관련뉴스해당 언론사에서 선정하며 언론사 페이지(아웃링크)로 이동해 볼 수 있습니다.김학의 출국금지 이유도 \'뇌물 혐의\'…특수강간 수사는?""쇼크로 쓰러져 죽을 뻔""…헬스장에 퍼진 \'위험한 주사기\'본질은 연예계-공권력 유착…소문만 무성, 수사 성과 \'0\'기관총 든 文 경호원…野 ""섬뜩"" vs 靑 ""전 정부도 그랬다""[영상] ""옥상에 검은 연기가""…인천 특급호텔 화재 현장좋아요0훈훈해요0슬퍼요0화나요0후속기사 원해요0기사제공 :']"
3,삼성전자, 2019-03-2421:13,한국경제 ,김진한 스탠다임 대표 “AI로 난치병 신약 개발…빅파마와 공동 연구 중”,https://finance.naver.com/news/news_read.nhn?article_id=0004113231&office_id=015&mode=search&query=삼성전자&page=1,"['       김진한 스탠다임 대표 “AI로 난치병 신약 개발…빅파마와 공동 연구 중”      기사입력2019-03-24 21:13기사원문좋아요훈훈해요좋아요 평가하기공감좋아요0훈훈해요0슬퍼요0화나요0후속기사 원해요0댓글AI로 기존 의약품 적응증 확대하고 파이프라인 발굴“獨·日 유수 제약회사와 협력해 개발 역량 다지겠다”[ 양병훈 기자  ] 김진한 스탠다임 대표가 AI를 활용한 회사의 신약 후보물질 발굴 과정에 대해 설명하고 있다. 양병훈 기자바이오기업 스탠다임은 비알콜성지방간(NASH), 파킨슨병, 자폐증 치료제를 개발 중이다. 자체 연구인력으로 신약 후보물질(파이프라인)을 발굴한 뒤 현재 외부기관에 맡겨 전임상시험을 하고 있다. 올해 내로 미토콘드리아(세포 호흡에 관여하는 세포 내 소기관) 이상으로 인한 질병, 고형암, 결핵 파이프라인도 추가로 발굴해 전임상시험을 시작하려고 한다. 그런데 이 회사에는 실험실이 없다. 실험을 하지 않고 어떻게 파이프라인을 발굴하는 걸까.김진한 스탠다임 대표(43)는 “자체 개발한 컴퓨터 인공지능(AI) 프로그램 ‘스탠다임 인사이트’와 ‘스탠다임 베스트’를 활용해 파이프라인을 발굴하고 있다”고 소개했다. 스탠다임 인사이트는 이미 시장에 나와 있는 의약품이 다른 적응증에도 효능이 있는지를 탐색하는 AI다. 의약품에는 생각지 못했던 치료 효과가 있는 경우도 많기 때문이다. 스탠다임 베스트는 기존 물질의 분자구조 등을 바꿔 새로운 파이프라인을 만들어낼 수 있다.김 대표는 “스탠다임 인사이트를 이용해 NASH, 파킨슨병, 자폐증 파이프라인을 발굴했고 연내 미토콘드리아 이상 질병 파이프라인도 추가 발굴할 수 있을 것”이라며 “스탠다임 베스트로는 고형암과 결핵 파이프라인 1개씩을 새로 도출해 연내 전임상을 시작할 계획”이라고 말했다. 두 AI로 파이프라인을 이미 도출했거나 연내 도출할 예정인 것 외에 한창 연구중인 것까지 합치면 연구중인 물질 수는 약 50개에 이른다.김 대표는 2001년 서울대 응용생물화학부를 졸업했다. 2008년 서울대에서 전기컴퓨터공학 석사학위를, 2012년 영국 애딘버러대에서 인공지능 박사학위를 취득했다. 창업하고 싶다는 생각을 처음 한 건 약 20년 전이다. 당시 한 벤처 소프트웨어 업체에서 일하며 ‘나도 이런 회사를 만들고 싶다’는 생각을 했다. 이런 생각을 구체화한 건 2012~2015년 근무했던 삼성전자 종합기술원에서 일할 때였다.김진한 스탠다임 대표가 AI를 활용한 회사의 신약 후보물질 발굴 과정에 대해 설명하고 있다. 양병훈 기자김 대표는 “삼성전자 종합기술원에서 DNA 손상을 컴퓨터 알고리즘적으로 접근해 복구하는 연구를 했다”며 “회사 사정으로 연구가 중단됐는데 이를 계속 발전시켜보고 싶다는 생각이 들어 당시 함께 일했던 송상옥 스탠다임 이사, 윤소정 스탠다임 이사와 함께 2015년 창업했다”고 말했다. 그는 “질병 치료와 관련된 연구를 생물학 실험이 아닌 컴퓨터로 접근한다는 점에서 당시와 현재 스탠다임의 연구가 일맥상통한다”고 설명했다.이들 AI는 어떻게 작동하는 걸까. 스탠다임 인사이트는 약물이 특정 세포나 유전자에 어떻게 반응하는지에 대한 정보를 150만건 학습했다. 이를 바탕으로 새로운 약물 정보가 입력되면 해당 약물이 어떤 질병에 치료 효과를 가질 수 있을지를 예측한다.스탠다임 베스트는 220만건에 달하는 물질의 구조와 기능을 딥러닝으로 학습했다. 이를 바탕으로 ‘물질 구조를 이렇게 바꾸면 이 질병에 대한 새로운 치료 효과를 가질 수 있다’는 식의 예측을 한다.스탠다임은 글로벌 빅파마와 공동 연구를 한 경험이 있다. 스탠다임 인사이트로는 세계 50위권 안에 드는 독일·일본 업체 4곳과 폐암, 에이즈 등의 치료제 개발을 연구했다. 국내 기업 및 연구소 3곳과도 공동 연구를 했다. 스탠다임 베스트로는 아직 공동연구를 한 적이 없지만 국내 업체 3곳과 논의를 진행 중이다. 김 대표는 “스탠다임 베스트는 새 파이프라인 발굴 외에 물질 개량이나 특허장벽 설치(비슷한 물질을 여러개 만들어 전부 특허를 내놓는 것)에도 활용할 수 있다”고 말했다.스탠다임은 지금까지 모두 167억원의 투자를 유치했다. 공동연구로 일부 매출을 올린 적은 있지만 아직 많지 않다. 회사 직원 수는 21명이고 이 가운데 19명이 연구인력이다. 김 대표는 “국내외 유수 제약기업 및 연구기관들과의 협업을 통해 보다 발전된 신약개발 절차를 완성해 나가겠다”고 말했다.양병훈 기자 hun@hankyung.com[한경닷컴 바로가기] [모바일한경 구독신청] 네이버에서 한국경제 채널 구독하기 <자세히 보기> ⓒ 한국경제 & hankyung.com, 무단전재 및 재배포 금지한국경제 관련뉴스해당 언론사에서 선정하며 언론사 페이지(아웃링크)로 이동해 볼 수 있습니다.문 대통령 경호관 기관단총에…""섬뜩""양현석 꼬리 밟혔나…국세청, 대규모 인력 투입\'이부진 프로포폴\' 병원서 나온 장부가…""샤넬 뺨치는 북한 화장품""공유가 선택한 SUV \'르반떼 GTS\'…코너 돌 땐 \'아찔\'좋아요0훈훈해요0슬퍼요0화나요0후속기사 원해요0기사제공 :']"
