,회사명,날짜,언론사,기사제목,링크,본문
0,삼성전자, 2019-10-1121:13,경향신문 ,"국내 기업들, 핵심 품목 국산화·수입 다변화 성과 ‘가시화’",https://finance.naver.com/news/news_read.nhn?article_id=0002967906&office_id=032&mode=search&query=삼성전자&page=1,"['       국내 기업들, 핵심 품목 국산화·수입 다변화 성과 ‘가시화’      기사입력2019-10-11 21:13기사원문좋아요훈훈해요좋아요 평가하기공감좋아요0훈훈해요0슬퍼요0화나요0후속기사 원해요0댓글ㆍ일 규제 조치로 생산 차질 없어ㆍ중국 등서 대체 수입처 확보도일본의 반도체 소재 수출규제 조치 이후 100일 만에 한국 기업들이 대상 품목을 국산화하거나 대체 수입처를 찾는 데 어느 정도 성과를 내고 있는 것으로 나타났다. 일부 반도체 대기업들은 해외에서 대체 소재를 확보했고, 국내 소재기업들은 자체 생산량을 늘리고 있다.정부는 11일 열린 ‘제1차 소재·부품·장비 경쟁력위원회’에 “일본 수출규제 3대 품목은 수입국 다변화와 국내 생산 등 민관 합동으로 발 빠르게 대체 물량을 확보 중이며 기본적인 공급 안정성을 유지하고 있다”고 보고했다. 일본은 지난 7월4일 반도체·디스플레이 제조용 핵심 소재인 고순도 불화수소와 포토레지스트, 플루오린폴리이미드를 한국에 수출할 경우 ‘포괄허가’ 대신 ‘개별허가’를 받도록 규제를 강화했다. 이후 일본은 총 7건의 개별 수출허가만 내준 상태다. 그러나 아직 실제 생산 차질로 연결된 사례가 없고, 앞으로 쓸 대체 물량도 확보했다는 게 정부 설명이다.반도체 세정·식각 공정에 사용되는 액체 불화수소(불산액)의 경우 중국 등에서 생산한 제품이 이미 일부 생산공정에 쓰이고 있다. 불화수소와 극자외선(EUV)용 포토레지스트는 미국과 유럽 등에서 대체 수입처를 확보해 제품 테스트 중이다. 국내 반도체 소재 생산량은 더 늘어난다. 삼성전자와 SK하이닉스는 반도체 일부 공정에 솔브레인 등 국내 기업이 생산한 불산액을 사용하기 시작했다. 솔브레인은 충남 공주에 제2공장을 증설하고, SKC가 플루오린폴리이미드 생산을 준비하는 등 국내 소재기업들도 증산에 나섰다. 정부 당국은 “이번 수출규제를 계기로 공급망 안정성을 위해 국내 중소·중견기업과의 협력관계를 재정립해야 한다는 인식이 대기업들에 커졌고, 독립적으로 정책을 추진하던 정부부처들이 협력하는 계기도 됐다”고 밝혔다.또한 일본은 3대 품목 규제 외에도 한국을 화이트리스트(수출절차 우대국)에서 배제했지만 아직 추가 수출규제는 하지 않았다.문병기 무역협회 수석연구원은 “수출규제에 대한 대응은 어느 정도 잘되고 있기 때문에 지금 수준으로 일본의 수출허가가 나고 수입처 다변화와 국산화가 이뤄진다면 큰 문제는 없을 것”이라고 말했다. 다만 “일본이 추가로 점유율 높은 품목에 수출규제를 한다면 문제가 된다”며 “한국과 일본이 앞으로 신성장이나 첨단산업 경쟁력을 확보하려면 협력하는 방향으로 가는 게 양쪽 모두에게 바람직하다”고 말했다.남지원 기자 somnia@kyunghyang.com▶ 네이버 메인에서 경향신문 받아보기 ▶ 두고 두고 읽는 뉴스 ▶ 인기 무료만화©경향신문(www.khan.co.kr), 무단전재 및 재배포 금지경향신문 관련뉴스해당 언론사에서 선정하며 언론사 페이지(아웃링크)로 이동해 볼 수 있습니다.조국 ""윤석열 접대 보도 사실 아니다""···윤석열, 한겨레 고소박지원 ""내가 갖고 있던 김학의 동영상·녹음파일에 \'윤석열\' 없어""\'나체\' 오토바이 질주, 이유가 기막혀""日 화장품 방사능 검출, 적발되고도 5.1톤 한국에 수출""청와대, \'윤석열 별장 접대 의혹\'에 ""모른다""좋아요0훈훈해요0슬퍼요0화나요0후속기사 원해요0기사제공 :']"
1,삼성전자, 2019-10-1120:10,MBC ,"9천억 들여 결함 '정면돌파'…""폐차 때까지 책임""",https://finance.naver.com/news/news_read.nhn?article_id=0000985751&office_id=214&mode=search&query=삼성전자&page=1,"['       9천억 들여 결함 \'정면돌파\'…""폐차 때까지 책임""      기사입력2019-10-11 20:10기사원문좋아요훈훈해요좋아요 평가하기공감좋아요0훈훈해요0슬퍼요0화나요0후속기사 원해요0댓글 [뉴스데스크]◀ 앵커 ▶현대 기아차가 그동안 결함 논란을 불러온 \'쎄타2 GDi 엔진\'을 장착한 차량들에 대해서 엔진 결함을 인정하고 수리 비용을 포함해 평생 보증을 해주기로 했습니다.대상 차량이 국내에서 50만 대, 미국에서는 4백만 대가 넘는데 현대 기아차가 치를 비용은 9천억 원에 정도로 예상됩니다.김경호 기자가 보도합니다.◀ 리포트 ▶차량 엔진에서 요란한 쇳소리가 납니다.심한 차량은 엔진벽에 구멍이 나면서 차가 멈추기도 하고, 불이 나기까지 합니다.현대기아차의 쎄타2 GDi 엔진이 장착된 일부 차량에서 벌어진 일들입니다.그동안 국내 소비자들의 항의가 잇따르고, 미국에서 대규모 리콜과 함께 집단소송까지 벌어졌습니다.[제이슨 레빈/미국 집단소송 소비자단체 책임자]""현대기아차는 차량에서 불이 나는 등의 위험한 결함이 있다는 걸 알면서도 미국에 들여와 도로를 달리게 했다.""현대기아차는 오늘 이 엔진이 쓰인 우리나라와 미국의 모든 차량을 대상으로 평생 보증을 실시하겠다고 밝혔습니다.엔진 고장으로 인한 수리비용을 보상하고 엔진결함을 겪은 고객이 현대기아차를 재구매할때도 보상해 주기로 했습니다.쏘나타와 그랜저, 싼타페 등의 현대차와 K5, K7, 쏘렌토, 스포티지 등의 기아차가 대상으로, 국내 차량 52만 대, 미국에서 판매된 차량은 417만 대에 달합니다.이번 조치로 현대차가 6천억 원, 기아차는 3천억 원의 비용이 들 것으로 보입니다.이에 앞서 현대기아차는 미국에서 집단 소송을 낸 고객들에게 따로 보상금을 주고 화해했습니다.현대기아차의 패소 가능성이 제기된 가운데 분쟁이 계속될 경우 판매에 악영향을 줄 것으로 판단한 것으로 보입니다.[김준명/현대기아차 책임매니저]""고객 만족도를 높이기 위한 여러 방안을 검토한 뒤, 한국과 미국에서 이같은 평생 보증프로그램 및 보상 방안을 마련하게 되었습니다.""하지만 현대기아차는 법적책임을 고려해서인듯 엔진 결함이라고 공식 인정하지는 않았습니다.이에따라 결함을 고의로 숨겼는지 등의 여부는 미국 정부의 수사와 국내에서의 재판을 통해 가려질 것으로 보입니다.MBC뉴스 김경호입니다.(영상편집: 김선천)김경호 기자 (forpeople@imbc.com)[저작권자(c) MBC (http://imnews.imbc.com) 무단복제-재배포 금지]▶ 네이버 홈에서 [MBC뉴스] 채널 구독하기▶ [엠빅뉴스] 이재용 삼성전자 부회장의 사회생활...""오늘 말씀은 저에게 정말 큰 힘이 되었습니다""▶ [14F] 아이돌 사진 속 눈동자에 비친 풍경으로 집 찾아가 성추행한 사생;(교사촌지, 플라잉카)Copyright(c) Since 1996, MBC&iMBC All rights reserved.MBC 관련뉴스해당 언론사에서 선정하며 언론사 페이지(아웃링크)로 이동해 볼 수 있습니다.파업 돌입 \'대부분 매진\'…주말 KTX 32% 멈춘다윤석열 접대?…조국 \'사실무근\'·尹 \'기자 고소\'[단독] \'너 죽이는 건 일도 아냐\' 협박…담 넘는 시늉까지[단독] 故 김용균 월급이 520만 원?…\'하청이 절반 빼가\'\'여성 바짝男\' 검거…접촉 없다고 \'주거침입\'만?좋아요0훈훈해요0슬퍼요0화나요0후속기사 원해요0기사제공 :']"
2,삼성전자, 2019-10-1120:09,MBC ,'상폐 위기' 코오롱티슈진 시간 벌어…개선기간 1년 부여,https://finance.naver.com/news/news_read.nhn?article_id=0000985750&office_id=214&mode=search&query=삼성전자&page=1,"['       \'상폐 위기\' 코오롱티슈진 시간 벌어…개선기간 1년 부여      기사입력2019-10-11 20:09기사원문좋아요훈훈해요좋아요 평가하기공감좋아요0훈훈해요0슬퍼요0화나요0후속기사 원해요0댓글성분이 뒤바뀐 신약 \'인보사\'로 파문을 일으킨 코오롱티슈진이 상장폐지 위기를 일단 모면했습니다.한국거래소 코스닥시장본부는 오늘(11일) 코스닥시장위원회 회의 결과, 코오롱티슈진에 개선기간 12개월을 주기로 했다고 공시했습니다.코오롱티슈진이 내년 10월 중순까지 개선계획 이행 내역 등 관련 서류를 제출하면 거래소는 코스닥시장위원회를 다시 열어 상장폐지 여부를 다시 심의하게 됩니다.앞서 거래소는 코오롱티슈진이 상장심사 당시 중요사항을 허위 기재하거나 누락했다고 보고 이 회사를 상장 적격성 실질심사 대상으로 결정했습니다.이는 코오롱티슈진의 골관절염 치료제인 \'인보사\'의 성분이 당초 알려진 연골세포가 아닌 신장세포로 밝혀진 데 따른 것입니다.이학수 기자 (tchain@mbc.co.kr)[저작권자(c) MBC (www.imnews.com) 무단복제-재배포 금지]▶ 네이버 홈에서 [MBC뉴스] 채널 구독하기▶ [엠빅뉴스] 이재용 삼성전자 부회장의 사회생활...""오늘 말씀은 저에게 정말 큰 힘이 되었습니다""▶ [14F] 아이돌 사진 속 눈동자에 비친 풍경으로 집 찾아가 성추행한 사생;(교사촌지, 플라잉카)Copyright(c) Since 1996, MBC&iMBC All rights reserved.MBC 관련뉴스해당 언론사에서 선정하며 언론사 페이지(아웃링크)로 이동해 볼 수 있습니다.파업 돌입 \'대부분 매진\'…주말 KTX 32% 멈춘다윤석열 접대?…조국 \'사실무근\'·尹 \'기자 고소\'[단독] \'너 죽이는 건 일도 아냐\' 협박…담 넘는 시늉까지[단독] 故 김용균 월급이 520만 원?…\'하청이 절반 빼가\'\'여성 바짝男\' 검거…접촉 없다고 \'주거침입\'만?좋아요0훈훈해요0슬퍼요0화나요0후속기사 원해요0기사제공 :']"
3,삼성전자, 2019-10-1120:01,세계일보 ,"중소·중견기업 소재부품, 대기업 생산라인에서 테스트한다",https://finance.naver.com/news/news_read.nhn?article_id=0003404819&office_id=022&mode=search&query=삼성전자&page=1,"['       중소·중견기업 소재부품, 대기업 생산라인에서 테스트한다      기사입력2019-10-11 20:01기사원문좋아요훈훈해요좋아요 평가하기공감좋아요0훈훈해요0슬퍼요0화나요0후속기사 원해요0댓글    게티이미지뱅크     중소·중견기업이 생산한 반도체, 디스플레이 관련 소재·부품·장비를 수요기업인 대기업 생산라인에서 성능을 시험하고 수요·공급 간 비즈니스를 수월하게 할 수 있는 방안이 추진된다.    산업통상자원부와 한국산업기술평가관리원은 11일 올해 추가경정예산안에 포함된 반도체·디스플레이 성능평가지원사업의 효과적 추진을 위해 업계 및 관계기관과 간담회를 개최했다고 밝혔다. 간담회는 서울 강남구 역삼동 한 음식점에서 반도체 소자기업, 디스플레이 패널기업, 반도체장비기업 임직원 등 20여명이 참석한 가운데 열렸다.   350억원이 투입되는 이 사업은 반도체·디스플레이 산업 경쟁력의 핵심요소인 소재·부품·장비에 대해 수요기업이 성능을 평가하고 개선할 수 있도록 지원하는 사업이다. 이번 간담회는 사업의 성공적 추진을 위해 중요한 역할을 하는 수요기업 의견을 듣고 효과적인 사업추진 방안을 논의하기 위해 마련했다.   반도체에선 삼성전자, SK하이닉스, DB하이텍, 무진전자 등 10개사가, 디스플레이에선 삼성디스플레이, LG디스플레이 등 2개사가 각각 성능을 평가하고 인증하는 수요기업이 된다.    이들 12개 수요기업이 평가 대상 제품을 테스트해 일정 기준 이상 성능이 나올 경우 해당 제품에 대해 수요기업 명의의 인증서를 발급한다. 또 소자기업(삼성전자, SK하이닉스, DB하이텍)및 패널기업(삼성디스플레이, LG디스플레이)의 자문을 통해 성능개선 기술개발에도 나선다.    산업부는 이 사업을 통해 국내 중소·중견 소재·부품·장비 기업은 개발 제품의 신뢰성 확보와 사업화, 글로벌 시장 진출 기회를 제고할 수 있고 수요기업은 경쟁력 있는 국내 우수 공급선 확보를 바탕으로 안정적인 제품 생산이 가능할 것으로 기대했다.   이도형 기자 scope@segye.comⓒ 세상을 보는 눈, 세계일보세계일보 관련뉴스해당 언론사에서 선정하며 언론사 페이지(아웃링크)로 이동해 볼 수 있습니다.김어준 ""취재 결과 \'윤석열 접대\' 없었다… 윤중천이 거짓말""""애 딸린 이혼녀와 결혼했는데, 바람났습니다""""이춘재, 살인의 추억 3번 넘게 봤을 것""베컴, 기다리게 하고 사과 안한 \'블랙핑크\' 뭇매""수학여행 버스서 대변 지린 교사입니다""좋아요0훈훈해요0슬퍼요0화나요0후속기사 원해요0기사제공 :']"
4,삼성전자, 2019-10-1119:56,MBC ,최강 태풍 후쿠시마 '정조준'…'오염수' 괜찮을까,https://finance.naver.com/news/news_read.nhn?article_id=0000985743&office_id=214&mode=search&query=삼성전자&page=1,"['       최강 태풍 후쿠시마 \'정조준\'…\'오염수\' 괜찮을까      기사입력2019-10-11 19:56기사원문좋아요훈훈해요좋아요 평가하기공감좋아요0훈훈해요0슬퍼요0화나요0후속기사 원해요0댓글 [뉴스데스크]◀ 앵커 ▶19호 태풍 하기비스가 일본 열도를 향해서 북상 하고 있습니다.보시는 것처럼 붉은 빛으로 둘러싸인 태풍이 눈이 증명하듯 올해 발생한 태풍 중에 가장 강력 합니다.태풍은 내일 밤 늦게 도쿄 인근으로 상륙할 예정인데, 그 위력 만큼, 일본 전역에 큰 피해가 우려되는 상황입니다.그런데 더 걱정되는게 있습니다.바로 하기비스의 예상 경로에 후쿠시마가 들어가 있는건데요.아시겠지만 후쿠시마 원전엔 거대한 양의 방사능 오염수가 저장 돼 있다보니 태풍이 어떤 타격을 줄지 지켜 봐야 할 상황입니다. 보도에 김윤미 기자입니다.◀ 리포트 ▶제19호 태풍 \'하기비스\'가 맹렬한 기세로 일본 수도권을 겨냥해 시시각각 북상하고 있습니다.중심기압 930헥토파스칼로 중심부근에서는 시속 180km에 이르는 폭풍이 휘몰아치고 있습니다.태풍의 거대한 눈과 회오리 구름이 압도적입니다.이 태풍은 내일 밤 늦게 수도권에 상륙해 도쿄를 강타하고 모레 새벽 후쿠시마를 관통할 전망입니다.일본 기상청은,  90년대 이후 이렇게 위력적인 태풍이 내습한 건 3번 밖에 없었다고 말합니다.일본 최악의 태풍 참사 중 하나로 기록된 1958년 태풍 \'아이다\'에 버금갈거라는 우려도 나왔습니다.[일본 기상청 관계자]""1958년 카노가와 태풍(아이다)에 맞먹는 기록적인 폭우를 일으킬 수 있습니다.""당시 일본은 700밀리미터가 넘는 폭우와 강풍으로 곳곳에서 하천이 범람하고 산사태가 덮쳐 1200여 명이 죽거나 실종됐습니다.이번에도 최대 800밀리미터의 물폭탄이 예고됐고, 초속 45미터가 넘는 강풍도 불어닥칠 전망입니다.태풍 중심이 지나는 후쿠시마도 긴장하고 있습니다.후쿠시마 농민들은 태풍이 오기 전 추수를 서두르고 어민들은 선박을 단단히 묶느라 바빴습니다.[日 후쿠시마 주민]""태풍은 정말 (어떻게 올지) 모르니까요. 매우 걱정하고 있습니다.""국내 전문가들은 후쿠시마에 폭우가 쏟아질 경우 방사능 오염토가 바다로 흘러들고 처리해야 할 오염수도 늘어나 문제가 될 수 있다고 말합니다.기상청은 태풍의 간접 영향으로 내일부터 월요일까지 남해와 동해는 최대 7m의 높은 파도와 초속 30m의 돌풍이 예상된다며 주의를 당부했습니다.MBC뉴스 김윤미입니다.김윤미 기자 (yoong@mbc.co.kr)[저작권자(c) MBC (http://imnews.imbc.com) 무단복제-재배포 금지]▶ 네이버 홈에서 [MBC뉴스] 채널 구독하기▶ [엠빅뉴스] 이재용 삼성전자 부회장의 사회생활...""오늘 말씀은 저에게 정말 큰 힘이 되었습니다""▶ [14F] 아이돌 사진 속 눈동자에 비친 풍경으로 집 찾아가 성추행한 사생;(교사촌지, 플라잉카)Copyright(c) Since 1996, MBC&iMBC All rights reserved.MBC 관련뉴스해당 언론사에서 선정하며 언론사 페이지(아웃링크)로 이동해 볼 수 있습니다.파업 돌입 \'대부분 매진\'…주말 KTX 32% 멈춘다윤석열 접대?…조국 \'사실무근\'·尹 \'기자 고소\'[단독] \'너 죽이는 건 일도 아냐\' 협박…담 넘는 시늉까지[단독] 故 김용균 월급이 520만 원?…\'하청이 절반 빼가\'\'여성 바짝男\' 검거…접촉 없다고 \'주거침입\'만?좋아요0훈훈해요0슬퍼요0화나요0후속기사 원해요0기사제공 :']"
5,삼성전자, 2019-10-1118:55,MBC ,경기 연천도 모든 돼지 없앤다…우선 수매후 전체 살처분,https://finance.naver.com/news/news_read.nhn?article_id=0000985727&office_id=214&mode=search&query=삼성전자&page=1,"['       경기 연천도 모든 돼지 없앤다…우선 수매후 전체 살처분      기사입력2019-10-11 18:55기사원문좋아요훈훈해요좋아요 평가하기공감좋아요0훈훈해요0슬퍼요0화나요0후속기사 원해요0댓글정부가 최근 아프리카돼지열병이 추가로 발생한 경기도 연천 지역의 모든 돼지를 도축하거나 살처분합니다.농림축산식품부는 지난 9일 연천에서 14번째 돼지열병 확진 농가가 나옴에 따라, 바이러스 확산 방지를 위해 특단의 조치를 내렸다고 밝혔습니다.이에따라 연천 지역내 5개월 이상 된 출하 가능한 돼지에 대해선 우선 수매하고, 나머지는 전량 살처분하게 됩니다.경기 북부 접경지역에서 돼지열병이 집중 발생하고 있는데다, 전파 원인 역시 아직 불분명한 만큼 불가피한 조치라고 농식품부는 설명했습니다.앞서 돼지열병이 잇달아 발생한 경기도 파주와 김포에서도 모든 돼지에 대한 수매와 살처분 작업이 이뤄지고 있습니다.황의준 기자 (hej@mbc.co.kr)[저작권자(c) MBC (www.imnews.com) 무단복제-재배포 금지]▶ 네이버 홈에서 [MBC뉴스] 채널 구독하기▶ [엠빅뉴스] 이재용 삼성전자 부회장의 사회생활...""오늘 말씀은 저에게 정말 큰 힘이 되었습니다""▶ [14F] 아이돌 사진 속 눈동자에 비친 풍경으로 집 찾아가 성추행한 사생;(교사촌지, 플라잉카)Copyright(c) Since 1996, MBC&iMBC All rights reserved.MBC 관련뉴스해당 언론사에서 선정하며 언론사 페이지(아웃링크)로 이동해 볼 수 있습니다.파업 돌입 \'대부분 매진\'…주말 KTX 32% 멈춘다윤석열 접대?…조국 \'사실무근\'·尹 \'기자 고소\'[단독] \'너 죽이는 건 일도 아냐\' 협박…담 넘는 시늉까지[단독] 故 김용균 월급이 520만 원?…\'하청이 절반 빼가\'\'여성 바짝男\' 검거…접촉 없다고 \'주거침입\'만?좋아요0훈훈해요0슬퍼요0화나요0후속기사 원해요0기사제공 :']"
