,회사명,날짜,언론사,기사제목,링크,본문
0,삼성전자, 2019-02-2715:48,연합뉴스 ,"'북미회담 주시' 코스피 기관 매수에 2,230대 재진입(종합2보)",https://finance.naver.com/news/news_read.nhn?article_id=0010662450&office_id=001&mode=search&query=삼성전자&page=3,"['       \'북미회담 주시\' 코스피 기관 매수에 2,230대 재진입(종합2보)      기사입력2019-02-27 15:48기사원문좋아요훈훈해요좋아요 평가하기공감좋아요0훈훈해요0슬퍼요0화나요0후속기사 원해요0댓글코스피 기관 매수에 2,230선 회복(서울=연합뉴스) 이지은 기자 = 코스피가 기관 매수에 상승한 27일 오후 서울 중구 KEB하나은행 딜링룸에서 직원이 전광판 앞을 지나고 있다. 이날 코스피는 전 거래일보다 8.19포인트(0.37%) 오른 2,234.79로 거래를 마쳤다.   jieunlee@yna.co.kr    (서울=연합뉴스) 김아람 기자 = 코스피가 27일 기관 매수에 힘입어 상승 마감했다.    이날 코스피는 전 거래일보다 8.19포인트(0.37%) 오른 2,234.79로 거래를 마쳤다.    지수는 전장보다 7.86포인트(0.35%) 오른 2,234.46으로 출발해 강세 흐름을 유지했다.    유가증권시장에서는 기관이 1천520억원어치를 순매수했다. 반면 개인과 외국인은 각각 1천119억원, 565억원을 순매도했다.    이영곤 하나금융투자 연구원은 ""증시는 2차 북미 정상회담을 주시하는 가운데 상승세를 보였다""며 ""매물을 소화하면서 추가 상승을 모색하는 흐름이 전개됐다""고 설명했다.    김정은 북한 국무위원장과 도널드 트럼프 미국 대통령은 이날 베트남 현지시간으로 오후 6시 30분(한국시간 오후 8시 30분)부터 단독회담과 친교 만찬을 한다.    시가총액 상위 종목 가운데는 LG화학(1.55%), 현대차(5.31%), 삼성바이오로직스(0.81%), 한국전력(0.43%), 현대모비스(3.76%) 등이 올랐다. 삼성전자와 삼성물산은 보합 마감했다.    SK하이닉스(-1.99%), 셀트리온(-0.98%), POSCO(-2.74%) 등은 내렸다.    업종별로는 운송장비(2.78%), 통신(1.03%), 종이·목재(0.77%), 화학(0.72%) 등이 강세를 보였고 철강·금속(-1.41%), 운수창고(-1.34%), 의료정밀(-0.74%), 건설(-0.71%) 등은 약세였다.    오른 종목은 498개였고 내린 종목은 323개였으며 76개 종목은 보합 마감했다.    프로그램 매매는 차익거래는 매수 우위, 비차익거래는 매도 우위로 전체적으로는 363억원의 순매도로 집계됐다.     유가증권시장의 거래량은 약 2억9천만주, 거래대금은 4조8천억원이었다.코스피 상승 마감(서울=연합뉴스) 이지은 기자 = 코스피가 기관 매수에 상승한 27일 오후 서울 중구 KEB하나은행 딜링룸에서 직원들이 업무를 보고 있다. 이날 코스피는 전 거래일보다 8.19포인트(0.37%) 오른 2,234.79로 거래를 마쳤다. 코스닥지수는 5.07포인트(0.68%) 오른 752.16으로 종료했다.  jieunlee@yna.co.kr    코스닥지수는 5.07포인트(0.68%) 오른 752.16으로 종료했다.    지수는 1.02포인트(0.14%) 오른 748.11로 개장해 상승 폭을 키웠다.    코스닥시장에서는 개인과 외국인이 각각 78억원, 468억원을 순매수했다. 기관은 334억원을 순매도했다.    시총 상위주 중에서는 셀트리온헬스케어(0.14%), CJ ENM(0.17%), 신라젠(0.96%), 에이치엘비(1.33%), 메디톡스(1.81%), 코오롱티슈진(1.84%) 등이 올랐다.     바이로메드(-1.49%), 포스코켐텍(-2.46%), 스토디오드래곤(-1.34%), 펄어비스(-4.48%) 등은 내렸다.    코스닥시장의 거래량은 약 8억2천만주, 거래대금은 3조8천억원이었다.     코넥스 시장에서는 117개 종목이 거래됐고 거래량은 약 24만주, 거래대금은 22억원가량이었다.    이날 서울 외환시장에서 원/달러 환율은 전장보다 0.5원 오른 달러당 1,119.1원에 마감했다.    rice@yna.co.kr▶네이버 홈에서 [연합뉴스] 채널 구독하기▶뭐 하고 놀까? #흥  ▶기사보다 생생한 북미회담 소식 \'뉴스라이브\'연합뉴스 관련뉴스해당 언론사에서 선정하며 언론사 페이지(아웃링크)로 이동해 볼 수 있습니다.\xa0\'마약혐의 구속\' 버닝썬 직원, 김무성 사위와도 투약\xa0김여정도, 통역관도, 방탄경호단도 \'달려라 달려\'\xa0""오빠는 연쇄살인범입니다"" 여동생의 고백\xa0日관광객, 한국 재래시장 뒤져 사가는 아이템 1위는?\xa0리조트 18층서 알수 없는 이유로 매달린 20대 결국…좋아요0훈훈해요0슬퍼요0화나요0후속기사 원해요0기사제공 :']"
1,삼성전자, 2019-02-2715:45,서울경제 ,[장중 기업공시]2월 27일,https://finance.naver.com/news/news_read.nhn?article_id=0003512567&office_id=011&mode=search&query=삼성전자&page=3,"['       [장중 기업공시]2월 27일      기사입력2019-02-27 15:45기사원문좋아요훈훈해요좋아요 평가하기공감좋아요0훈훈해요0슬퍼요0화나요0후속기사 원해요0댓글 [서울경제] <유가증권>▲삼성전자(005930)=국제기능올림픽에 150만 유로(약 19억5,000만원) 후원, 충남삼성학원에 기부금 29억9,100만원 출연 결정 ▲현금배당 결정=하나제약(293480) 1주당 280원, 롯데지주(004990) 자회사 롯데카드 450원, 보령제약(003850) 60원, SK이노베이션(096770) 자회사 SK인천석유화학 우선주 2만8,490원, 조광페인트(004910) 100원, 미원홀딩스(107590) 400원, 혜인(003010) 30원, 송원산업(004430) 160원 ▲한라(014790)=621억 규모 고속국도 제400호선 김포~파주간 건설공사(제4공구) 수주 ▲코스맥스(192820)=스프레이형 클렌징 조성물, 화장품 콤팩트 용기로 각각 특허 취득 ▲남광토건(001260)=455억9,477만원 규모 영종 랜드마크 블루오션(2차) 신축공사 수주 ▲S&T중공업(003570)=한화디펜스와 233억5,675만원 규모 K21 경구난 차량 3차 양산 외 28 항목 공급계약 <27일><코스닥>▲에이치엔티(176440)=100억원 규모 제3자배정 유상증자 결정 ▲대화제약(067080)=천연물 치매치료제 임상2상 시험 종료 ▲현금배당 결정=엠에스오토텍(123040) 1주당 50원, 삼양옵틱스(225190) 700원, 씨앤지하이테크(264660) 200원, 한국정보인증(053300) 80원, 에스에이티(060540) 50원, 뉴프렉스(085670) 60원, 대림통상(006570) 150원 ▲동일기연(032960)=300만주(359억원) 규모 주식소각 결정 ▲바이오제네틱스(044480)=아슬란 파마슈티컬즈와 78억원 규모 바리티닙 독점 라이선스 도입 계약 체결 ▲에스아이리소스(065420)=48억6,461만원 규모 3.8MW 태양광발전소 건설공사 수주 ▲티앤알바이오팹(246710)=심근조직재생용 3차원구조체 제조방법으로 일본 특허 취득 ▲미래SCI(028040)=미국 소이벤티스와 25억원 규모 석유, 화학제품 공급계약 <27일>/유주희기자 ginger@sedaily.com[서울경제 바로가기]네이버 메인에서 \'No. 1 뉴스\' 서울경제를 만나보세요 [바로가기▶]프리미엄 미디어 Signal이 투자의 바른 길을 안내합니다 [바로가기▶]저작권자 ⓒ 서울경제, 무단 전재 및 재배포 금지서울경제 관련뉴스해당 언론사에서 선정하며 언론사 페이지(아웃링크)로 이동해 볼 수 있습니다.\'#하노이#만찬#성공적\' 북미 정상 무슨 대화 나눴을까""이런 SUV 처음"" 초대박 예감 \'쌍용 코란도\' 나오자마자\'압도적 당선\'에도 쓴 웃음 짓는 황교안, 대체 왜\'성접대·해피벌룬 의혹\' 승리, 자진 출석해 던진 한 말이옥상엔 스나이퍼·거리엔 장갑차···하노이는 \'비상사태\'좋아요0훈훈해요0슬퍼요0화나요0후속기사 원해요0기사제공 :']"
2,삼성전자, 2019-02-2715:44,헤럴드경제 ,"정의석 삼성전자 부사장 “갤럭시 폴드 8년의 결과물, 장벽 허무는 과정”",https://finance.naver.com/news/news_read.nhn?article_id=0001504570&office_id=016&mode=search&query=삼성전자&page=3,"['       정의석 삼성전자 부사장 “갤럭시 폴드 8년의 결과물, 장벽 허무는 과정”      기사입력2019-02-27 15:44기사원문좋아요훈훈해요좋아요 평가하기공감좋아요0훈훈해요0슬퍼요0화나요0후속기사 원해요0댓글-“기본재료부터 애플리케이션 호환성까지 재창조”-“폴더블은 시작, 롤러블폰, 화면 늘리는 폰도 먼 미래 아냐” 정의석 삼성전자 무선사업부 부사장이 삼성전자 뉴스룸과 인터뷰에서 ‘갤럭시 폴드’에 대해 설명하고 있다. [삼성전자 뉴스룸 제공][헤럴드경제=박세정 기자] “갤럭시 폴드를 만드는 과정은 하나 하나 장벽을 허무는 것과 같았다”정의석 삼성전자 무선사업부 부사장이 8년의 개발 끝에 선보인 ‘갤럭시 폴드’의 탄생에 대해 이같은 소감을 남겼다. 정 부사장은 27일 삼성전자 뉴스룸 인터뷰를 통해 “우리는 기본 재료부터 하드웨어, 소프트웨어, 애플리케이션 호환성까지 모든 것을 재창조했다”며 “소비자들에게 의미 있는 사용 환경을 제공하기 위한 개발에 8년이 걸렸고 모든 역량을 이번 제품에 집중시켰다”고 설명했다.이어 그는 “8년의 개발 과정 끝에 확장할 수 있는 화면, 다재 다능한 카메라 기술 등을 호주머니에 쏙 들어가는 크기에 스마트폰에 집약했다”며 “갤럭시 폴드는 더 큰 화면을 원하지만 투박하고 육중한 제품을 바라지 않는 소비자들을 위한, 스마트폰 그 이상의 가치를 지닌 제품”이라고 평가했다.갤럭시 폴드 개발 과정에서 파트너사들과의 긴밀한 협약도 주요했다고 그는 설명했다.정 부사장은 “갤럭시 폴드에 적합한 앱과 서비스를 제공하기 위해 구글을 비롯, 업계를 선도하는 회사들과 협력할 수 있는 테스트 랩도 만들었다”며 “갤럭시 폴드의 우수한 사용환경은 개발자들로부터 나온다는 생각으로, 그들과 긴밀한 협업을 이어갈 것”이라고 전했다.정 부사장은 갤럭시 폴드의 강점으로는 다양한 ‘멀티태스킹’을 꼽았다.그는 “지금까지 스마트폰에서 두 개 앱을 동시에 이용하는데 그쳤지만 갤럭시 폴드에서는 콘텐츠 감상, 웹서핑, 문자메시지 등 여러 개 앱을 한꺼번에 쓸 수 있다”며 “제품을 접었을 때나 폈을 때 하던 작업을 자연스럽게 이어갈 수 있다는 것도 갤럭시 폴드 사용 방식의 강점”이라고 설명했다.폴더블폰에서 더 나아가 폼팩터의 계속되는 진화도 예고했다.정 부사장은 “접는 방식, 돌돌 말아서 보관할 수 있는 롤러블 방식, 화면을 늘릴 수 있는 형태까지 더 이상 미래 얘기가 아니다”며 “삼성전자는 소비자들이 더 많은 것을 열정적으로 할 수 있도록 차세대 스마트기기 개발에 계속해서 매진할 것”이라고 밝혔다.박세정기자/sjpark@heraldcorp.com▶네이버에서 헤럴드경제 채널 구독하기▶초특가 타임딜 득템찬스, 헤럴드 리얼라이프 ▶헤럴드경제 사이트 바로가기 - Copyrights ⓒ 헤럴드경제 & heraldbiz.com, 무단 전재 및 재배포 금지 -헤럴드경제 관련뉴스해당 언론사에서 선정하며 언론사 페이지(아웃링크)로 이동해 볼 수 있습니다.김정은 보안 뚫려 무방비 촬영…김여정 재떨이 시중박한별 남편 \'X녀 카톡\' 일파만파\'조선공산당 이력\' 손혜원 父 유공자 선정, 檢 수사서효림, 드라마 촬영중 실신…""곧 회복 될 것""미혼여성 3명에 ""여기가 우리 신혼집""…4억 사기 30대좋아요0훈훈해요0슬퍼요0화나요0후속기사 원해요0기사제공 :']"
3,삼성전자, 2019-02-2715:43,연합뉴스 ,"'북미회담 주시' 코스피 기관 매수에 2,230선 회복(종합)",https://finance.naver.com/news/news_read.nhn?article_id=0010662420&office_id=001&mode=search&query=삼성전자&page=3,"['       \'북미회담 주시\' 코스피 기관 매수에 2,230선 회복(종합)      기사입력2019-02-27 15:43기사원문좋아요훈훈해요좋아요 평가하기공감좋아요0훈훈해요0슬퍼요0화나요0후속기사 원해요0댓글코스피, 기관 매수에 상승(서울=연합뉴스) 이지은 기자 = 코스피가 기관 매수에 상승한 27일 오후 서울 중구 KEB하나은행 딜링룸에서 직원들이 업무를 보고 있다. 이날 코스피는 전 거래일보다 8.19포인트(0.37%) 오른 2,234.79로 거래를 마쳤다.  jieunlee@yna.co.kr    (서울=연합뉴스) 김아람 기자 = 코스피가 27일 기관 매수에 힘입어 상승 마감했다.    이날 코스피는 전 거래일보다 8.19포인트(0.37%) 오른 2,234.79로 거래를 마쳤다.    지수는 전장보다 7.86포인트(0.35%) 오른 2,234.46으로 출발해 강세 흐름을 유지했다.    유가증권시장에서는 기관이 1천548억원어치를 순매수했다. 반면 개인과 외국인은 각각 1천119억원, 587억원을 순매도했다.    이영곤 하나금융투자 연구원은 ""증시는 2차 북미 정상회담을 주시하는 가운데 상승세를 보였다""며 ""매물을 소화하면서 추가 상승을 모색하는 흐름이 전개됐다""고 설명했다.    김정은 북한 국무위원장과 도널드 트럼프 미국 대통령은 이날 베트남 현지시간으로 오후 6시 30분(한국시간 오후 8시 30분)부터 단독회담과 친교 만찬을 한다.    시가총액 상위 종목 가운데는 LG화학(1.55%), 현대차(5.31%), 삼성바이오로직스(0.81%), 한국전력(0.43%), 현대모비스(3.76%) 등이 올랐다. 삼성전자와 삼성물산은 보합 마감했다.    SK하이닉스(-1.99%), 셀트리온(-0.98%), POSCO(-2.74%) 등은 내렸다.코스피 상승 마감(서울=연합뉴스) 이지은 기자 = 코스피가 기관 매수에 상승한 27일 오후 서울 중구 KEB하나은행 딜링룸에서 직원들이 업무를 보고 있다. 이날 코스피는 전 거래일보다 8.19포인트(0.37%) 오른 2,234.79로 거래를 마쳤다. 코스닥지수는 5.07포인트(0.68%) 오른 752.16으로 종료했다.  jieunlee@yna.co.kr    코스닥지수는 5.07포인트(0.68%) 오른 752.16으로 종료했다.    지수는 1.02포인트(0.14%) 오른 748.11로 개장해 상승 폭을 키웠다.    코스닥시장에서는 개인과 외국인이 각각 78억원, 469억원을 순매수했다. 기관은 334억원을 순매도했다.    시총 상위주 중에서는 셀트리온헬스케어(0.14%), CJ ENM(0.17%), 신라젠(0.96%), 에이치엘비(1.33%), 메디톡스(1.81%), 코오롱티슈진(1.84%) 등이 올랐다.     바이로메드(-1.49%), 포스코켐텍(-2.46%), 스토디오드래곤(-1.34%), 펄어비스(-4.48%) 등은 내렸다.    rice@yna.co.kr▶네이버 홈에서 [연합뉴스] 채널 구독하기▶뭐 하고 놀까? #흥  ▶기사보다 생생한 북미회담 소식 \'뉴스라이브\'연합뉴스 관련뉴스해당 언론사에서 선정하며 언론사 페이지(아웃링크)로 이동해 볼 수 있습니다.\xa0\'마약혐의 구속\' 버닝썬 직원, 김무성 사위와도 투약\xa0김여정도, 통역관도, 방탄경호단도 \'달려라 달려\'\xa0""오빠는 연쇄살인범입니다"" 여동생의 고백\xa0日관광객, 한국 재래시장 뒤져 사가는 아이템 1위는?\xa0리조트 18층서 알수 없는 이유로 매달린 20대 결국…좋아요0훈훈해요0슬퍼요0화나요0후속기사 원해요0기사제공 :']"
4,삼성전자, 2019-02-2715:42,아이뉴스24 ,"[마감] 코스피, 북미정상회담 기대감…2230선 회복",https://finance.naver.com/news/news_read.nhn?article_id=0000483142&office_id=031&mode=search&query=삼성전자&page=3,"['       [마감] 코스피, 북미정상회담 기대감…2230선 회복      기사입력2019-02-27 15:42기사원문좋아요훈훈해요좋아요 평가하기공감좋아요0훈훈해요0슬퍼요0화나요0후속기사 원해요0댓글남북경협주 상승[아이뉴스24 김다운 기자] 2차 북미정상회담 개최를 앞두고 국내 증시가 상승으로 마감했다.27일 코스피지수는 전날보다 0.37%(8.19포인트) 오른 2234.79로 장을 마쳤다.김정은 북한 국무위원장과 도널드 트럼프 미국 대통령은 이날 오후 6시30분(한국시간 8시30분)부터 단독회담 등 정상회담 일정을 시작할 예정이다.1차 북미정상회담 당시 김정은 국무위원장(왼쪽)과 도널드 트럼프 미국 대통령 [사진=뉴시스]김형렬 교보증권 애널리스트는 ""이번 북미 정상회담이 투자심리 안정 측면에 도움을 줄 것""이라고 기대했다.코스피 시장에서는 기관이 1천549억원 순매수로 지수를 끌어올렸다. 개인과 외국인은 각각 1천119억원, 587억원 매도우위였다.시가총액 상위 종목은 혼조세였다. 현대차, LG화학, 삼성바이오로직스, 한국전력이 상승했고 SK하이닉스, 삼성전자우, 셀트리온, 포스코는 하락했다. 삼성전자와 삼성물산은 보합으로 마쳤다.전날 주주환원 정책을 발표한 현대모비스를 비롯해 현대차그룹주들이 동반 상승했다. 현대차가 5.31%, 현대모비스가 3.76%, 기아차가 1.51% 올랐다.코스닥지수도 0.68%(5.07포인트) 상승한 752.16으로 하루 만에 상승반전했다.외국인이 469억원, 개인이 78억원 순매수를 기록했고 기관은 335억원 매도우위였다.북미정상회담 기대에 남광토건이 4.12%, 제이에스티나가 4.04%, 좋은사람들이 2.91% 오르는 등 남북 경제협력 관련주가 강세였다.한편 서울 외환시장에서 원/달러 환율은 전날보다 0.04%(0.50원) 오른 1119.10원에 거래됐다.김다운기자 kdw@inews24.com▶네이버 채널에서 \'아이뉴스24\'를 구독해주세요.▶디지털 마케팅의 미래 - 아이포럼 2019[ⓒ 아이뉴스24 무단전재 및 재배포 금지]아이뉴스24 관련뉴스해당 언론사에서 선정하며 언론사 페이지(아웃링크)로 이동해 볼 수 있습니다.YG·유리홀딩스 ""승리 카톡 성접대 의혹 대화 조작된 것…수사의뢰 등 법적 대응""\'현실과 맞서라는\' 방시혁 서울대 졸업식 축사…""부조리함과 싸워달라""김정훈, 전 여자친구에 피소…소속사 ""어떤 상황인 지 확인 중""\'여혐 논란\' 부른 김정훈 전 여친 조롱 글…""임신공격 당했다""대한항공, 아시아나 \'몽골 추가 운수권\'에 ""특혜·부당회수"" 주장좋아요0훈훈해요0슬퍼요0화나요0후속기사 원해요0기사제공 :']"
5,삼성전자, 2019-02-2715:39,머니투데이 ,D램 가격 14.5%↓ '역대 두번째 낙폭'…수출 경기 빨간불,https://finance.naver.com/news/news_read.nhn?article_id=0004180800&office_id=008&mode=search&query=삼성전자&page=3,"['       D램 가격 14.5%↓ \'역대 두번째 낙폭\'…수출 경기 빨간불      기사입력2019-02-27 15:39기사원문좋아요훈훈해요좋아요 평가하기공감좋아요0훈훈해요0슬퍼요0화나요0후속기사 원해요0댓글 [머니투데이 심재현 기자] [낸드 가격도 내림세 지속…""하반기에도 시장 회복에 한계""]국내 반도체업계 주력 수출품목인 D램과 낸드플래시 가격이 올 들어 2달 연속 큰 폭으로 떨어졌다. 반도체 가격 하락 폭이 커져 수출 경제에도 빨간불이 켜졌다. 27일 시장조사업체 D램익스체인지에 따르면 PC용 DDR4 8기가비트(Gb) D램 고정거래가격이 지난 1월(6.00달러)보다 14.5% 하락한 5.13달러를 기록했다. D램익스체인지가 2016년 6월 이 제품 고정거래가격을 발표하기 시작한 이후 지난달에 이어 낙폭이 두 번째로 크다.올 들어 가격하락 폭이 29.24%에 달한다. 반도체 경기가 하락세로 돌아서기 직전인 지난해 9월(8.19달러)과 비교하면 5개월만에 37.35% 떨어졌다.고정거래가격은 삼성전자 등 메모리반도체 제조사가 대형 거래처에 제품을 공급할 때 계약하는 거래가격이다. 전체 D램의 90% 이상이 고정거래가격으로 거래된다. 삼성전자와 SK하이닉스의 메모리반도체 수출 실적이 고정거래가격과 직결되는 구조다.지난해 7월부터 하락세로 돌아선 낸드플래시(128Gb MLC 기준) 고정거래가격은 6.64% 떨어진 4.22달러를 기록했다. 지난해 12월부터 3개월 연속 하락세를 보이면서 이 기간에만 10.97% 떨어졌다.단가하락으로 반도체 업계의 수출 실적도 쪼그라들고 있다. 반도체 수출액은 지난해 12월과 올해 1월 마이너스를 기록했다. 지난 1월 수출 감소율은 23.3%로 글로벌 금융위기 당시인 2009년 4월(-26.2%) 이후 가장 컸다. 전체 수출의 20%를 차지하는 반도체가 부진한 탓이다.업계에선 메모리반도체 가격 하락이 당분간 계속될 것으로 봤다. D램익스체인지는 최근 보고서에서 3월에도 D램 가격이 추가 하락하면서 올 1분기 평균으로 PC용 제품은 20% 이상, 서버용 제품은 30% 가까이 급락할 것으로 내다봤다. 또 2분기에도 수요 부진이 이어져 D램 가격이 1분기보다 15% 안팎 하락할 것으로 예상했다. D램익스체인지는 ""2분기 수요가 일부 살아나겠지만 공급 과잉이 계속될 것""이라며 ""하반기에도 글로벌 정치·경제 불확실성이 지속되면서 신규 수요가 시장을 회복시키기엔 한계가 있을 것""이라고 진단했다.일각에선 메모리반도체 가격 하락세가 새로운 수요로 이어지면서 전체 반도체 시장에 미치는 영향은 크지 않을 것이라는 전망도 나온다.또 다른 시장조사업체인 가트너는 최근 보고서에서 메모리 제품의 가격이 떨어지면 PC, 스마트폰 생산업체기 메모리 용량을 늘리고 고사양 모델에 더 집중적으로 투자하면서 전체 시장은 성장세를 유지할 것이라고 예상했다.심재현 기자 urme@mt.co.kr▶주식, 나도 더 잘할 수 있을까?▶조 변호사의 가정상담소 ▶머투가 봄맞이 선물 주나봄 <저작권자 ⓒ \'돈이 보이는 리얼타임 뉴스\' 머니투데이, 무단전재 및 재배포 금지>머니투데이 관련뉴스해당 언론사에서 선정하며 언론사 페이지(아웃링크)로 이동해 볼 수 있습니다.\'연애의 맛\' 김진아, 가상 연애 김정훈 피소에 ""괜찮아요""42억에 산 땅 237억에 되파는 고승덕 변호사 부부\'박한별 남편\' 또 논란, 유리홀딩스는 어떤 회사?승리, 흡입 의혹 받고 있는 환각제 \'해피벌룬\' 뭐길래""4·11 휴일 맞아?""…임시공휴일 기대감에 4월 여행예약 급증좋아요0훈훈해요0슬퍼요0화나요0후속기사 원해요0기사제공 :']"
