,회사명,날짜,언론사,기사제목,링크,본문
0,삼성전자, 2019-03-2414:44,SBS ,백화점 봄세일 29일부터…의류·가전 최대 80% 할인,https://finance.naver.com/news/news_read.nhn?article_id=0000719291&office_id=055&mode=search&query=삼성전자&page=3,"['       백화점 봄세일 29일부터…의류·가전 최대 80% 할인      기사입력2019-03-24 14:44기사원문좋아요훈훈해요좋아요 평가하기공감좋아요0훈훈해요0슬퍼요0화나요0후속기사 원해요0댓글주요 백화점이 오는 29일부터 순차적으로 봄 정기세일에 들어갑니다.롯데백화점은 29일부터 다음 달 14일까지 17일간 롯데쇼핑 창립 40주년을 기념한 봄 정기세일을 한다고 오늘(24일) 밝혔습니다.롯데백화점은 세일 시작일부터 다음 달 1일까지 나흘간 삼성 갤럭시 S10을 초특가에 선보입니다.롯데백화점 애플리케이션에서 특가 구매 쿠폰을 내려받아 백화점 내 삼성전자 매장을 찾은 고객에게 하루 40명 한정으로 갤럭시 S10을 정상가보다 60% 저렴한 44만 원에 팝니다.서울 소공동 본점은 나이키와 푸마 등 스포츠 브랜드 상품을 최대 30%, 금강제화와 탠디 등 잡화 상품을 20% 각각 싸게 선보입니다.골프용품도 본점에서 29일부터 다음 달 2일까지 최대 70% 할인 판매됩니다.강남점에서 25일부터 31일까지 열리는 20억 원 규모의 골프 대전도 테일러메이드 등 유명 골프 클럽의 가격을 최대 78% 할인된 수준으로 낮춥니다.노원점은 144평 규모의 \'나이키 스포트 메가샵\'을 새로 엽니다.현대백화점도 같은 기간 정기세일을 엽니다.7백여 개 브랜드가 봄 신상품을 10∼40% 할인 판매합니다.오는 29일부터 31일까지는 뱅앤드올룹슨과 드롱기, 블루에어 등 리빙 상품이 직매입을 통해 최대 70% 저렴하게 나옵니다.다음 달 5일부터 7일까지는 봄 세일에 참여하지 않은 띠어리와 산드로, 톰브라운 등 2백여 개 브랜드 의류 구매 고객에게 금액대별로 5∼10% 할인 혜택을 제공합니다.무역센터점은 31일까지 봄맞이 골프 대전을 열고 이월 상품을 최대 50% 할인 판매하며, 압구정본점도 테스코니 등 10여 개 남성 브랜드 이월 상품을 50% 할인 판매합니다.목동점은 인덕션과 가전제품 진열상품을 60% 할인 판매할 예정입니다.신세계백화점의 정기세일은 29일부터 다음 달 7일까지입니다.다음 달 4일까지는 전 점에서 와인을 최대 80% 할인된 가격에 내놓는 \'창고 대방출전\'을 합니다.총 68만 병의 와인이 준비됐는데, 지금까지 가격 할인을 한 적이 없거나 할인 폭이 작았던 프리미엄 와인을 반값에 판매하는 기획전도 준비돼 있다고 백화점 측은 전했습니다.또 다음 달 14일까지는 가구와 주방용품, 침구, 가전, 인테리어 소품을 한데 모은 \'메종드 신세계\' 행사를 열고 총 23억 원 규모의 물량을 특가에 내놓습니다.강남점과 경기점에서는 이색적인 생활용품을 플리마켓 형식으로 판매하는 \'일상마켓\'도 함께 엽니다.갤러리아백화점은 29일부터 다음 달 14일까지 정기세일을 하는데, 보라카이행 여행 경품 이벤트, 인테리어 특집전, 에코백 증정 등 다양한 행사로 고객을 맞이합니다.명품관에서는 4월 5∼18일 이탈리아 브랜드를 중심으로 한 \'비바! 이탈리아\' 시즌 3 상품전을 개최하며, 대전에 있는 타임월드는 각각 3월 29일∼4월 4일에 \'아이리스·스위트홈\', 4월 4∼11일 \'템퍼\' 창립기념 특집전을 엽니다.AK플라자도 같은 기간 정기세일에 돌입합니다.일부 브랜드를 제외하고 기본 10∼30% 할인하고, 이월 상품 기획전을 통해 최대 70% 할인 판매합니다.제주도와 협업해 \'제주를 담다\'로 세일의 주제를 정했습니다.전 점포에 제주도의 풍경을 담은 포토존이 운영되고 제주 특산물 판매, 제주도 관련 경품행사도 열릴 예정입니다.\xa0(사진=롯데백화점, 연합뉴스)\xa0진송민 기자(mikegogo@sbs.co.kr)▶[핫이슈] \'승리·정준영 카톡방\' 전방위 수사▶[핫이슈] 김학의·장자연 사건▶네이버 메인에서 SBS뉴스 구독하기※ ⓒ SBS & SBS Digital News Lab. : 무단복제 및 재배포 금지SBS 관련뉴스해당 언론사에서 선정하며 언론사 페이지(아웃링크)로 이동해 볼 수 있습니다.""삼합회 대장까지…"" 버닝썬 투자자 \'린사모\'는 누구?지창욱, 린사모와 얼굴 맞대고 사진…""팬이라서 찍어준 것""\'아동 성추행 의혹\' 마이클 잭슨을 옹호한 여배우포항만 몰랐다, 학술지엔 \'상세히\'…국제실험장 된 포항강경화 ""한국 미세먼지도 중국 간다""…전문가들 입장은?좋아요0훈훈해요0슬퍼요0화나요0후속기사 원해요0기사제공 :']"
1,삼성전자, 2019-03-2414:35,SBS ,"한국, 인도에 지난해 10억 달러 투자…역대 최대",https://finance.naver.com/news/news_read.nhn?article_id=0000719288&office_id=055&mode=search&query=삼성전자&page=3,"['       한국, 인도에 지난해 10억 달러 투자…역대 최대      기사입력2019-03-24 14:35기사원문좋아요훈훈해요좋아요 평가하기공감좋아요0훈훈해요0슬퍼요0화나요0후속기사 원해요0댓글지난해 한국이 인도에 투자한 돈이 사상 처음으로 10억 달러를 넘어섰습니다.불과 1년 만에 배가량 급증했습니다.중국 시장 등에서 부진을 겪는 한국 기업이 차세대 신흥 유망시장으로 떠오른 인도 시장에 뭉칫돈을 들고 몰려드는 셈입니다.오늘(24일) 한국수출입은행 뉴델리사무소와 코트라 뉴델리무역관 등에 따르면, 지난해 한국이 인도에 투자한 금액은 10억 5,300만 달러를 기록했습니다.이는 종전 최대 기록인 2017년 5억 1,600만 달러보다 배 이상 증가한 수치입니다.한국의 대인도 투자액은 2011년 4억 5,600만 달러를 기록했지만, 2012∼2016년 5년 연속 3억 달러대로 주춤하다가 지난해부터 증가세로 돌아섰습니다.지난해 한국의 대인도 투자는 삼성전자와 기아차가 주도한 것으로 분석됩니다.삼성전자는 지난해 7월 뉴델리 인근 노이다 공장 규모를 배로 확대, 이곳에서만 연간 1억 2천만 대의 휴대전화를 생산할 예정입니다.기아차도 현재 남부 안드라프라데시주 아난타푸르 지역에 30만 대 규모의 생산공장을 건설하고 있습니다.업계 관계자는 ""삼성전자와 기아차가 인도에 대규모 투자를 집행하면서 전체 투자금액이 크게 확대됐다""고 말했습니다.부문별 투자 상황을 살펴보면 전체 투자금액의 88.3%(9억 3천만 달러)가 제조업에 집중됐습니다.도·소매업(4,100만 달러, 3.9%), 운수·창고업(2,600만 달러, 2.5%)이 뒤를 이었습니다.인도에 신규 진출한 한국 기업의 수도 증가하는 분위기입니다.지난해 인도 시장에 새롭게 발을 디딘 법인 수는 118개로 2017년 113개에 이어 2년 연속으로 100개를 넘었습니다.이전 2012∼2016년 5년 동안에는 인도 진출 신규법인 수가 연간 50개 안팎에 머물렀습니다.(사진=연합뉴스)진송민 기자(mikegogo@sbs.co.kr)▶[핫이슈] \'승리·정준영 카톡방\' 전방위 수사▶[핫이슈] 김학의·장자연 사건▶네이버 메인에서 SBS뉴스 구독하기※ ⓒ SBS & SBS Digital News Lab. : 무단복제 및 재배포 금지SBS 관련뉴스해당 언론사에서 선정하며 언론사 페이지(아웃링크)로 이동해 볼 수 있습니다.""삼합회 대장까지…"" 버닝썬 투자자 \'린사모\'는 누구?지창욱, 린사모와 얼굴 맞대고 사진…""팬이라서 찍어준 것""\'아동 성추행 의혹\' 마이클 잭슨을 옹호한 여배우포항만 몰랐다, 학술지엔 \'상세히\'…국제실험장 된 포항강경화 ""한국 미세먼지도 중국 간다""…전문가들 입장은?좋아요0훈훈해요0슬퍼요0화나요0후속기사 원해요0기사제공 :']"
2,삼성전자, 2019-03-2414:01,연합뉴스 ,작년 對 인도 한국 투자 역대 최대…10억 달러 첫 돌파,https://finance.naver.com/news/news_read.nhn?article_id=0010714162&office_id=001&mode=search&query=삼성전자&page=3,"['       작년 對 인도 한국 투자 역대 최대…10억 달러 첫 돌파      기사입력2019-03-24 14:01기사원문좋아요훈훈해요좋아요 평가하기공감좋아요0훈훈해요0슬퍼요0화나요0후속기사 원해요0댓글 전년 比 2배↑…신규 진출 법인 수 2년 연속 100개 넘어삼성전자, 인도서 \'갤럭시 S10\' 출시 행사    (서울=연합뉴스) 6일(현지시간) 인도 뉴델리에서 열린 스마트폰의 새로운 기준을 제시하는 \'갤럭시 S10\' 출시 행사에서 삼성전자 IM부문장 고동진 사장이 \'갤럭시 S10\'을 소개하고 있다. 2019.3.6 [삼성전자 제공=연합뉴스](뉴델리=연합뉴스) 김영현 특파원 = 지난해 한국의 대(對)인도 투자액이 처음으로 연간 10억 달러를 돌파했다.    불과 1년 만에 배가량 급증한 수치다. 중국 시장 등에서 부진을 겪는 한국 기업이 차세대 신흥 유망시장으로 떠오른 거대 인도 시장에 뭉칫돈을 들고 몰려드는 분위기다.    24일 한국수출입은행 뉴델리사무소와 코트라(KOTRA) 뉴델리무역관 등에 따르면 지난해 한국이 인도에 투자한 금액은 10억5천300만 달러를 기록했다.    이는 종전 최대 기록인 2017년 5억1천600만 달러보다 배 이상 증가한 수치다.    한국의 대인도 투자액은 2011년 4억5천600만 달러를 기록했지만, 2012∼2016년 5년 연속 3억 달러대로 주춤하다가 지난해부터 증가세로 돌아섰다.    지난해 한국의 대인도 투자는 삼성전자와 기아차가 주도한 것으로 분석된다.    삼성전자는 지난해 7월 뉴델리 인근 노이다 공장 규모를 배로 확대, 이곳에서만 연간 1억2천만대의 휴대전화를 생산할 예정이다.기아차 인도 첫 공장, 시험생산 기념식 개최    (아난타푸르[인도]=연합뉴스) 기아차는 29일 인도 안드라프라데시주(州) 아난타푸르 현지 첫 공장에서 시험생산 기념식을 열었다. 왼쪽부터 심국현 기아차 인도법인장, 신봉길 주인도 한국대사, 찬드라바부 나이두 안드라프라데시주 총리, 박한우 기아차 사장. 2019.1.29 [기아차 인도법인 제공=연합뉴스]    기아차도 현재 남부 안드라프라데시주 아난타푸르 지역에 30만대 규모의 생산공장을 건설하고 있다.    업계 관계자는 ""삼성전자와 기아차가 인도에 대규모 투자를 집행하면서 전체 투자금액이 크게 확대됐다""고 말했다.    부문별 투자 상황을 살펴보면 전체 투자금액의 88.3%(9억3천만 달러)가 제조업에 집중됐다.    도매·소매업(4천100만 달러, 3.9%), 운수·창고업(2천600만 달러, 2.5%)이 뒤를 이었다.    인도에 신규 진출한 한국 기업의 수도 증가하는 분위기다.    지난해 인도 시장에 새롭게 발을 디딘 법인 수는 118개로 2017년 113개에 이어 2년 연속으로 100개를 넘었다.    이전 2012∼2016년 5년 동안에는 인도 진출 신규법인 수가 연간 50개 안팎에 머물렀다.    cool@yna.co.kr▶네이버 홈에서 [연합뉴스] 채널 구독하기▶뭐 하고 놀까? #흥  ▶쇼미더뉴스! 오늘 많이 본 뉴스영상연합뉴스 관련뉴스해당 언론사에서 선정하며 언론사 페이지(아웃링크)로 이동해 볼 수 있습니다.\xa0문대통령 시장방문 경호관 기관단총 노출 \'논란\'\xa0버닝썬 다룬 \'그것이 알고 싶다\'에 관심 폭발 왜?\xa0지창욱 측 ""버닝썬 린사모와 무관, 사진요청에…""\xa0포승줄 묶여 포토라인 선 정준영…피의자 인권 논란\xa0아들이 말대꾸하자 화장대 다리 뽑아 휘둘렀는데…좋아요0훈훈해요0슬퍼요0화나요0후속기사 원해요0기사제공 :']"
3,삼성전자, 2019-03-2413:57,서울신문 ,‘세계 최초 5G 상용화’ 타이틀에도…아직 갈 길은 멀다,https://finance.naver.com/news/news_read.nhn?article_id=0002985710&office_id=081&mode=search&query=삼성전자&page=3,"['       ‘세계 최초 5G 상용화’ 타이틀에도…아직 갈 길은 멀다      기사입력2019-03-24 13:57기사원문좋아요훈훈해요좋아요 평가하기공감좋아요0훈훈해요0슬퍼요0화나요0후속기사 원해요0댓글[뉴스 분석] 새달 5일 갤럭시S10 출시로 첫 상용화[서울신문]초기 지하 유선 케이블은 LTE망 이용 5G 장점 활용할 서비스·콘텐츠도 부족 완벽한 5G 체감하려면 수 년 더 걸려 이동통신사 중저가 요금제 내놓을 듯세계 최초 5G(5세대) 이동통신이 다음달부터 국내에서 상용화된다. 당초 이달로 예정됐던 상용화가 미뤄진 것이지만 삼성전자가 다음달 5일 ‘갤럭시S10’을 출시하기로 하면서 다음달 11일로 예정된 미국 통신사 버라이즌을 앞서며 ‘세계 최초’라는 타이틀을 일주일 차이로 빼앗기지 않게 됐다. 5G 스마트폰이 상용화되면 어떤 세상이 될까. 그동안 오락가락했던 5G 상용화 일정과 치열해지고 있는 5G 스마트폰 선점 경쟁 등을 짚어 봤다.●초기 5G폰 기술적으로 보완할 부분 많아5G 상용화 선언은 지난해 12월 1일 거창하게 했다. 하지만 5G 표준이 정해진 것조차도 지난해 6월로 아직 1년도 채 안 됐다. 소비자용 서비스는 여전히 상용화된 것이 없다. 아직 국내 전 지역에 5G 망이 다 깔린 것도 아니고, 그마저도 상용화 초기엔 논스탠드얼론(NSA) 방식을 사용한다. NSA는 기지국까지 연결된 지하 유선 케이블은 LTE 망이고, 기지국에서 단말로 연결된 전파만 5G로 쓴다고 생각하면 쉽다. 처음부터 끝까지 5G인 스탠드얼론(SA) 방식으로 전환되려면 수 년이 더 걸릴 전망이다.무엇보다 5G의 빠른 속도를 활용할 만한 서비스와 콘텐츠를 갖추지 못하고 있다. 이동통신사들이 각 업체와 콘텐츠, 서비스 제작을 위한 업무협약(MOU)을 맺었다고 홍보하고 있지만, 그렇게 서둘러 몇 개 추가한다고 금방 풍성해지지 않는다. 수많은 업체들이 서비스나 콘텐츠를 개발해 내놓기까지는 절대적인 시간이 필요하기 때문이다. 이런 이유로 일반인들은 큰 돈을 들여 5G폰을 구매해도 당장 실감할 수 있는 것은 많지 않다. 게다가 초기 5G 폰은 아직 기술적으로 보완할 여지가 많이 남아 있기 때문에 여기에 너무 큰 기대를 걸지 않는 게 좋다.어찌 됐든 우여곡절 끝에 5G는 다음주 세계 최초 상용화를 앞두고 있다. 단순한 이동통신 서비스가 아니라 산업 전반을 업그레이드할 동력이 될 것으로 보이는 5G를 세계 최초로 상용화한다는 건 분명 큰 의미가 있다. 세계 시장에서 관련 산업을 선점해야 하기 때문에 도널드 트럼프 미국 대통령이 지난달 트위터에 “나는 미국에서 최대한 빨리 5G, 심지어 6G를 원한다”고 쓴 것도 그럴 만하다. 업계 관계자는 “특히 우리나라는 내수시장이 작아 중국이나 미국에 시장을 선점당하면 따라가기가 어렵다”고 말했다.스마트폰 상용화는 미국과 최초를 두고 경쟁해 왔다. 한국은 당초 이달 말 상용화를 목표로 달려왔지만, 삼성전자가 ‘갤럭시S10 5G’를 안정화하는 데 시간이 더 필요해 모든 일정이 미뤄졌다. 미국 버라이즌은 다음달 11일 모토로라 ‘모토Z3’에 5G 모듈을 다는 방식으로 출시한다는 소식이 들려오면서 한국이 세계 최초 상용화를 놓치는 게 아니냐는 우려도 나왔다. SK텔레콤이 5G 요금제 안을 과학기술정보통신부에 제출했지만 “대용량 고가 구간만으로 구성됐다”는 이유로 반려됐다는 소식도 들려왔다.●요금제 반려, 새달 5일 상용화에 영향 없어과기정통부가 통신사의 요금제를 반려한 것은 ‘5G에 중·저가 요금제를 두라’는 의미로 보면 된다. SK텔레콤이 심의에 제출했던 요금제는 월 5G 데이터 150GB를 제공하고 소진 시 LTE 무제한 이용이 가능한 7만원대로 알려졌다. 이번 주 중 SK텔레콤이 가격을 낮춘 요금제를 추가해 재심의에서 통과하면 끝나는 문제다. 나머지 2개사는 이를 참고해 적절한 수준으로 준비한 요금제를 출시할 것으로 보여 다음달 5일 상용화하는 데 문제는 없어 보인다.다만 이동통신사들은 5G 네트워크 구축을 위해 막대한 투자를 했으며, 7만원대 요금제도 투입 비용을 감안하면 ‘밑지는 장사’라고 볼멘소리를 하고 있다. 하지만 당장 초기 투입 비용에 대비해 요금제를 책정하는 것은 무리이며, 그런 논리라면 이미 투자 비용을 모두 회수하고 장기간 이익을 남긴 3G 요금제는 무료에 가까워야 한다는 주장도 있다. 김주호 참여연대 민생팀장은 “3G 초창기 투자 비용을 다 뽑고 흑자 전환한 지 10년이 됐는데 그동안 시설투자비, 인건비, 마케팅비 등을 다 제하고도 통신사에 6조원이 남았다”면서 “3G보다 흑자 전환 속도가 더 빨랐던 LTE로 가져간 수익은 더 많을 것으로 본다”고 말했다. 김민석 기자 shiho@seoul.co.kr홍희경 기자 saloo@seoul.co.kr▶ 서울신문 추천하면 우리집에도 공기청정기가? ▶ 재미있는 세상[나우뉴스] [인기 무료만화]ⓒ 서울신문(www.seoul.co.kr), 무단전재 및 재배포금지서울신문 관련뉴스해당 언론사에서 선정하며 언론사 페이지(아웃링크)로 이동해 볼 수 있습니다.""김학의 성접대 피해 여성, 윤중천의 꼭두각시였다""국회 찾은 101세 독립유공자…""나경원은 사퇴하라""승리 인터뷰 반박한 발렌시아 구단주 딸 ""그날 밤…""문 대통령 경호원, 시장서 \'기관단총\' 노출…왜?나이트 불 났는데 ""키스타임!"" 일제히 환호성좋아요0훈훈해요0슬퍼요0화나요0후속기사 원해요0기사제공 :']"
4,삼성전자, 2019-03-2413:51,디지털타임스 ,‘이변은 없었지만’…변화하는 대기업 주총,https://finance.naver.com/news/news_read.nhn?article_id=0002516037&office_id=029&mode=search&query=삼성전자&page=3,"['       ‘이변은 없었지만’…변화하는 대기업 주총      기사입력2019-03-24 13:51기사원문좋아요훈훈해요좋아요 평가하기공감좋아요0훈훈해요0슬퍼요0화나요0후속기사 원해요0댓글 [디지털타임스 박정일 기자] ""이변은 없었지만 변화의 조짐은 보였다."" 올해 삼성전자와 LG전자, 현대자동차 등 국내 주요 대기업들의 정기 주주총회를 지켜본 재계 인사들은 대체로 이 같은 평가를 내놓았다.올해 주총시즌은 어느 때보다 주목을 받았다. 현대차그룹과 엘리엇 간 힘 겨루기, 조양호 한진그룹 회장의 사내이사 연임 여부, 구광모 LG그룹 회장의 첫 주총 등 관전 포인트가 많았기 때문이다.아직까진 큰 이변은 없었다. 현대차그룹은 엘리엇과의 대결에서 완승했고, LG그룹은 이사회와 대표이사 분리 운영 등으로 구광모 체제를 견고히 다졌다. 삼성전자의 경우 논란이 있었던 박재완(성균관대 교수) 전 기획재정부 장관에 대한 사외이사 재선임 안건을 통과시켰다.하지만 이는 대기업들이 선제 노력을 했기 때문이라는 분석도 나온다. 우선 가장 큰 변화는 전자투표를 도입하는 기업들이 빠르게 늘고 있다는 것이다. 공정거래위원회에 따르면, 지난 7일 기준으로 공시대상기업집단(자산 5조원 이상) 소속 248개 상장사 중 전자투표제를 자발적으로 도입한 회사는 86개로 집계됐다. 현대차와 SK, 포스코, 한화, 두산그룹 일부 계열사 등이 이 흐름에 동참했다. 이 같은 흐름은 더 확산할 것으로 보인다. 지난해 50대1의 액면분할을 해 실질주주가 5배 가량 늘어난 삼성전자 역시 소액주주들이 대거 몰리면서 어려움을 겪었고, 주주들의 항의에 ""장소와 운영방식 등 모든 면에서 보다 철저히 준비하겠다""며 공식 사과문을 내놓은 만큼 내년 전자투표제 도입이 유력하다. SK그룹 역시 지난해 SK㈜, SK이노베이션, SK텔레콤에 이어 올해 SK하이닉스 등으로 전자투표 도입 범위를 늘리고 있다.대표이사와 이사회 의장을 분리해 경영 투명성을 더 높이는 대기업도 늘고 있다. 삼성전자는 이미 지난해 대표이사와 이사회 의장을 분리했고, LG전자와 LG디스플레이 등 LG그룹 일부 계열사들도 CEO(최고경영자)와 이사회 의장을 분리하는 안건을 처리했다.SK이노베이션과 SK네트웍스 등 SK그룹 계열사들도 이 같은 흐름에 동참했다. 이는 이사회의 독립성과 실질적 기능을 강화하겠다는 최태원 회장의 의지가 담긴 것으로 풀이된다. 최 회장 역시 오는 27일 주총에서 정관 개정을 하고 이사회 의장 직을 염재호 전 고려대 총장에게 맡길 것으로 알려졌다.주주친화 경영 강화 움직임도 눈에 띄는 변화 중 하나다. 삼성바이오로직스는 지난 22일 주총에서 바이오시밀러에 대해 한눈에 볼 수 있는 홍보관을 마련했고, IR(기업설명) 담당자를 주총장 뒤에 배치하는 등 주주와의 소통을 강화했다.삼성전자 역시 분기 배당을 포함해 연간 9조6000억원을 배당으로 지급할 예정이고, 현대모비스 역시 지난해 주당 3500원이었던 배당금을 4000원으로 상향 조정하기로 했다. 금융정보업체 에프엔가이드에 따르면 주요 5대 그룹(삼성·현대차·SK·LG·롯데) 전체 상장사 53곳의 배당금총액은 지난 2014년과 비교해 2배 이상(138.7%↑)으로 늘었다.한 재계 관계자는 ""국민연금의 의결권 행사 움직임에 엘리엇 등 외부 헤지펀드의 공세까지 더해지면서, 소액주주들의 지지를 얻으려는 경영진의 움직임도 빨라지고 있다""며 ""스튜어드십 코드 등 \'주주 행동주의 시대\'가 본격 도래하면서 주주들의 눈높이에 맞춘 소액주주 친화 정책은 앞으로도 계속될 것""이라고 말했다.한편 24일 한국예탁결제원에 따르면 이번주(25~29일)에는 12월 결산법인 상장사 2216개사 중 1592개사(71.8%)가 정기주총을 개최할 예정이다.박정일기자 comja77@dt.co.kr지난 22일 서울 역삼동 현대해상화재보험에서 열린 현대모비스 정기 주주총회에서 박정국 현대모비스 사장(맨 위)이 인사말을 하고 있다. <현대모비스 제공>     디지털타임스 홈페이지 바로가기 / 디지털타임스 뉴스 더보기네이버 채널에서 \'디지털타임스\'를 구독해주세요.디지털타임스 관련뉴스해당 언론사에서 선정하며 언론사 페이지(아웃링크)로 이동해 볼 수 있습니다.박정아 성형설 ""아이 낳고 열흘 만에? 말도 안 돼""YG 탈세의혹→세무조사 착수…국세청 ""혐의 드러나면 검·경 협조""정준영 법원출석 ""모든 혐의 인정..평생 반성할 것""장범준 저작권료, \'벚꽃 엔딩\'으로 첫 해 5억?..\'벚꽃연금\' 맞네한혜진 딸 공개 ""딸바보 될 만하네!"" 아빠 기성용 뽀뽀♥좋아요0훈훈해요0슬퍼요0화나요0후속기사 원해요0기사제공 :']"
