,회사명,날짜,언론사,기사제목,링크,본문
12,삼성전자, 2019-02-2709:17,뉴시스 ,"ETRI, 태국·말레이어 등 5개국 음성DB 제공",https://finance.naver.com/news/news_read.nhn?article_id=0009082993&office_id=003&mode=search&query=삼성전자&page=8,"['       ETRI, 태국·말레이어 등 5개국 음성DB 제공      기사입력2019-02-27 09:17기사원문좋아요훈훈해요좋아요 평가하기공감좋아요0훈훈해요0슬퍼요0화나요0후속기사 원해요0댓글대화체 200만 발화 음성DB ․ 대역 300만 문장DB 제공 13년 간 네이버, 삼성, SKT 등에 367건 배포, 550억 절감 효과 기술 해외 의존도 낮추고 관련 기술 활용 및 수출 증진 기대【서울=뉴시스】다국어 언어음성DB의 역할 및 활용.(표/한국전자통신연구원 제공)  photo@newsis.com【서울=뉴시스】이국현 기자 = 한국전자통신연구원(ETRI)은 국내에서 처음으로 태국어, 말레이어, 인도네시아어의 음성 데이터베이스(DB)와 영어대역문장 데이터베이스(DB)를 일반에 배포한다고 27일 밝혔다. 음성 DB는 인공지능(AI) 스피커, 내비게이션, 사물인터넷(IoT) 등 음성인식 및 번역 소프트웨어(SW) 개발에 기초가 되는 자료다. 가능한 품질이 좋고, 많은 언어의 DB를 구축하는 것이 서비스 다양화와 부가가치 창출의 핵심이다. 현재 해외 업체에서 외국어 음성 DB를 구입할 수 있지만 언어당 1~2억원 가량의 비용이 소요된다. 관련 자료가 없는 나라의 언어는 자체적으로 수집하는 수밖에 없다. 이에 전자통신연구원은 ▲태국어 ▲말레이어 ▲인도네시아어 ▲아랍어 ▲베트남어 \'대화체 음성DB 200만 발화\'와 ▲영어–태국어 ▲영어–말레이어 ▲영어–인도네시아어 ▲영어–아랍어 ▲영어–베트남어 \'대화체 대역 문장DB 300만 문장\'을 배포키로 했다.  태국어, 말레이어, 인도네시아어 자료는 국내 최초로 제공하며, 아랍어와 베트남어는 데이터양을 늘렸다. 구매 비용은 해외 음성 DB의 5% 수준이다. 특히 연구원은 최대한 많은 사람들의 언어 데이터를 얻기 위해 크라우드 소싱(Crowd sourcing) 기법을 도입했다. 포인트를 제공해 일반 사용자들의 참여를 유도한 결과, 2만5000여명이 발화에 참여했다. 같은 예산으로 기존보다 최대 8배 많은 데이터를 수집했다. 많은 양의 데이터를 토대로 집단 지성에 의한 검증 시스템을 도입해 정확도 역시 높였다. 외부 감리 업체 측정 결과 99% 이상의 높은 품질을 인증 받았다. 앞서 연구원은 2011년에는 한·영·일·중 등 다국어 언어음성DB를, 2014년에는 프랑스어, 2015년에는 독일어, 러시아어, 아랍어, 베트남어를 구축 및 배포했다. 삼성전자, LG전자, KT, 네이버, 카카오, 엔씨소프트 등 국내 60개 기관에 367건의 DB를 배포해 550억원 가량의 비용 절감 성과를 얻었다. 윤승 음성지능연구그룹 박사는 ""DB를 활용해 언어음성기술을 개발할 경우 다양한 외국 신규시장 진출은 물론 국가 경쟁력 강화에도 기여할 것으로 보인다""며 ""향후 언어의 정확도 및 데이터 품질을 개선하고, 영어, 중국어, 일본어 음성 데이터 구축을 위해 노력할 예정""이라고 밝혔다. lgh@newsis.com▶ 네이버에서 뉴시스 채널 구독하기▶ 뉴시스 빅데이터 MSI 주가시세표 바로가기 <저작권자ⓒ 공감언론 뉴시스통신사. 무단전재-재배포 금지.>뉴시스 관련뉴스해당 언론사에서 선정하며 언론사 페이지(아웃링크)로 이동해 볼 수 있습니다.오피스텔서 외국 여성 성매매…1년에 8억원 번 일당""통화 시끄럽다"" 꾸짖는 노인에 흉기 들이댄 10대""왜 이 길로 가!"" 운전 중인 70대 택시기사 폭행한 50대美언론 ""영변 폐쇄·제재완화·평화선언 등 잠정합의""트럼프, 김정은 만나기 위해 33.5억원짜리 비행좋아요0훈훈해요0슬퍼요0화나요0후속기사 원해요0기사제공 :']"
13,삼성전자, 2019-02-2709:16,이데일리 ,"삼성전자, ‘러시아 카잔 국제기능올림픽’ 후원",https://finance.naver.com/news/news_read.nhn?article_id=0004319169&office_id=018&mode=search&query=삼성전자&page=8,"[""       삼성전자, ‘러시아 카잔 국제기능올림픽’ 후원      기사입력2019-02-27 09:16기사원문좋아요훈훈해요좋아요 평가하기공감좋아요0훈훈해요0슬퍼요0화나요0후속기사 원해요0댓글전세계 기술인재 양성 위해 2007년부터 7회 연속 후원2013년부터 ‘최상위 타이틀 후원사’ 자격으로 참여[이데일리 김종호 기자] 삼성전자(005930)가 전세계 우수한 기술인재를 육성하고 산업발전에 기여하기 위해 오는 8월 러시아 카잔에서 열리는 ‘제45회 카잔 국제기능올림픽대회(WorldSkills Kazan 2019)’를 후원한다.삼성전자는 이번 카잔 국제기능올림픽에 약 19억5000만원(150만 유로)을 후원하기로 결정했다고 27일 공시했다.삼성전자는 2007년 일본 시즈오카 대회 후원을 시작으로 격년마다 열리는 국제기능올림픽을 7회 연속으로 후원해 오고 있다. 특히 2013년 독일 라이프치히 대회와 2015년 브라질 상파울루 대회, 2017년 UAE 아부다비 대회에 이어 4연속 단독 ‘최상위 타이틀 후원사(OEP)’로 참여한다. 삼성전자는 다음달 러시아에서 주최측과 후원 체결식을 가질 예정이다.장동섭 삼성기능올림픽 사무국장은 “삼성전자는 그간 국제기능올림픽을 통해 전세계 기능 장려 활동에 꾸준히 참여해 왔다”며 “앞으로도 지속적으로 글로벌 기술인재 양성에 힘쓸 것”이라고 말했다.한편, 이번 카잔 국제기능올림픽은 오는 8월 22일부터 27일까지 러시아 타타르스탄 자치공화국의 수도 카잔에서 개최된다. 전 세계 67개국, 1401명의 선수가 56개 종목에서 세계 최고의 기량을 겨룬다. 한국은 47개 직종에 52명의 선수가 출전할 예정이다.김종호 (kona@edaily.co.kr)네이버 홈에서 ‘이데일리’ 기사 보려면 [구독하기▶]꿀잼가득 [영상보기▶] , 빡침해소!청춘뉘우스~ [스냅타임▶]＜ⓒ종합 경제정보 미디어 이데일리 - 무단전재 & 재배포 금지＞이데일리 관련뉴스해당 언론사에서 선정하며 언론사 페이지(아웃링크)로 이동해 볼 수 있습니다.'화웨이·샤오미·오포'…중국은 어떻게 스마트폰 강국이 됐나?'버닝썬' 이문호 대표, 마약 양성반응...'마지막 인사'도 거짓말?'버닝썬 고발' 김상교씨, '깡패같은 놈들'이 어머니에 합의 요구'선두다툼' 없는 쇼트트랙 결승전, 승부조작 의혹… 미리 짜고 나온 것'횡성 임신부 사망사고' 가해 운전자 구속…도주 우려있어좋아요0훈훈해요0슬퍼요0화나요0후속기사 원해요0기사제공 :""]"
14,삼성전자, 2019-02-2709:15,서울경제 ,[아침시황]주요 암호화폐 하락..스마트폰 관련 코인 강세,https://finance.naver.com/news/news_read.nhn?article_id=0003512204&office_id=011&mode=search&query=삼성전자&page=8,"[""       [아침시황]주요 암호화폐 하락..스마트폰 관련 코인 강세      기사입력2019-02-27 09:15기사원문좋아요훈훈해요좋아요 평가하기공감좋아요0훈훈해요0슬퍼요0화나요0후속기사 원해요0댓글BTC 0.51% ↓423만 3,000원ETH 1.62% ↓15만1,300원XRP 3.03% ↓352원[서울경제] 27일 오전 8시 30분 주요 암호화폐 가격은 하락세를 보이고 있다. 시가총액 상위 10위권의 암호화폐들은 일제히 하락했으며 비트코인 가격은 423만 원을 기록하고 있다. 이날 빗썸 기준 국내 비트코인(BTC) 가격은 전날 같은 시간보다 0.51% 내린 423만 3,000원을, 이더리움(ETH)은 1.62% 하락한 15만 1,300원을 기록했다. 리플(XRP)은 3.03% 떨어진 352원을 기록했으며, 이오스(EOS)는 전날에 이어 5% 대의 낙폭을 보이며 3,762원에 거래되고 있다. 라이트코인(LTC)은 1.78% 오른 4만 9,600원, 비트코인캐시(BCH)는 1.74% 오른 14만6,500원이다. 같은 시간 코인마켓캡 기준 국제 BTC 가격은 0.68% 떨어진 3,855.31달러다. ETH은 1.40% 내린 137.84달러, XRP는 2.56% 내린 0.31달러다. EOS는 4.31%가 떨어진 3.43달러, LTC는 2.01%내린 45.35달러, BCH는 2.04% 내린 134.07달러다.몇몇 암호화폐들은 대기업과의 협업 발표로 가격이 40% 가까이 급상승하기도 했다. 삼성전자 갤럭시 S10에 탑재될 것으로 기대되는 엔진(Enjin) 프로젝트의 엔진 코인(ENJ)은 전일 대비(27일 오전 7시30분 기준) 23.77% 급상승했다. 대만 HTC의 블록체인 스마트폰 엑소더스(Exodus)와 협력하는 디앱 디센트럴랜드(Decentraland)의 토큰(MANA)는 전일 대비 39.88% 상승했다. 암호화폐 전반의 하락세에도 불구하고 결제 플랫폼을 지향하는 XRP에는 긍정적인 소식이 이어졌다. 영국 국제환전서비스 머큐리FX(MercuryFX)는 올해 중반기 리플의 x래피드(xRapid)를 사용해 리플 기반의 국제 송금을 제공하는 결제 채널 10개를 구축할 예정이라고 밝혔다. 현재 대형 금융기관에 보급된 x커런트(xCurrent)와 달리 x래피드는 XRP 사용이 의무화되는 송금서비스다. 앨러스테어 콘스턴스 머큐리FX 대표는 “해당 채널은 영국에서 캐나다, 중동, 멕시코, 필리핀까지 확장될 것”이라며 “중동과 캐나다를 대상으로 마케팅을 시작할 것”이라고 밝혔다. 전날 XRP는 미국 대형 암호화폐 거래소 코인베이스에 정식 상장되며 투자자들의 이목을 끌었다. 다국적 컨설팅 그룹 KPMG가 실시한 설문에 따르면 48%의 임원들이 “향후 3년 간 블록체인이 업무방식을 바꿀 수 있다”고 답했다. 블록체인 기술의 장단점에 대해 응답자 중 23%는 블록체인을 통해 비즈니스 효율성을 향상시킬 수 있다고 답했으나, 입증된 비즈니스 사례가 없다는 것을 가장 큰 문제점으로 꼽았다. KPMG에 블록체인 적용 가능성을 묻는 질문에는 응답자의 41%가 “사용할 수 있을 것”이라고 답했고, 31%는 직접적인 답을 제시하지 않았으며 28%는 “가능성이 낮다”고 답했다. /민서연기자  minsy@decenter.kr[서울경제 바로가기]네이버 메인에서 'No. 1 뉴스' 서울경제를 만나보세요 [바로가기▶]프리미엄 미디어 Signal이 투자의 바른 길을 안내합니다 [바로가기▶]저작권자 ⓒ 서울경제, 무단 전재 및 재배포 금지서울경제 관련뉴스해당 언론사에서 선정하며 언론사 페이지(아웃링크)로 이동해 볼 수 있습니다.미국 최대 암호화폐 거래소 코인베이스, 리플 상장한다[아침시황]리플 8% 상승...코인베이스 상장[아침시황]암호화폐 하락세···비트코인 주말 한때 450만원[아침시황]암호화폐 전반 하락···비트코인 3,950달러[아침시황]비트코인 4천달러선 안착 여부 주시...스텔라루멘, IBM과 협력좋아요0훈훈해요0슬퍼요0화나요0후속기사 원해요0기사제공 :""]"
15,삼성전자, 2019-02-2709:14,파이낸셜뉴스 ,"[fn오전시황]코스피, 개인 매수에 2230선 회복",https://finance.naver.com/news/news_read.nhn?article_id=0004184367&office_id=014&mode=search&query=삼성전자&page=8,"[""       [fn오전시황]코스피, 개인 매수에 2230선 회복      기사입력2019-02-27 09:14기사원문좋아요훈훈해요좋아요 평가하기공감좋아요0훈훈해요0슬퍼요0화나요0후속기사 원해요0댓글  코스피가 개인 매수에 2230선을 회복했다.  27일 오전 9시 10분 코스피는 전거래일 대비 4.26포인트(0.19%) 오른 2230.86을 기록하고 있다.  이날 코스피는 전거래일 대비 7.86포인트(0.35%) 오른 2234.46에 개장했다.  외국인, 기관, 연기금 등은 각각 63억원, 81억원, 131억원을 순매도했다. 하지만 개인은 141억원을 순매수하며 지수를 끌어올렸다.  규모별로 대형주(0.19%), 중형주(0.09%), 소형주(0.19%) 모두 상승했다. 업종별로 섬유 및 의복(0.69%) 등이 상승했다. 반면 화학(-0.27%) 등은 하락했다.  시가총액 상위종목별로 삼성전자(0.75%), LG화학(0.26%), 현대차(3.67%) 등이 상승했다. 반면 SK하이닉스(-0.40%), 셀트리온(-0.49%) 등이 하락했다.  코스닥은 전거래일 대비 4.26포인트(0.19%) 오른 2230.86을 기록하고 있다.   ggg@fnnews.com 강구귀 기자   ▶ 세상의 모든 골 때리는 이야기 'fn파스'▶ 속보이는 연예뉴스 fn스타  ※ 저작권자 ⓒ 파이낸셜뉴스. 무단 전재-재배포 금지파이낸셜뉴스 관련뉴스해당 언론사에서 선정하며 언론사 페이지(아웃링크)로 이동해 볼 수 있습니다.임신한 아내 옷 벗기고 수차례 때린 남편, 4개월 전에는..재떨이 들고 오빠에게 간 김여정, 김정은의 반응은?입사 2년 만에 이사로 승진한 '33살' 남성의 화려한 스펙'세계서 가장 건강한 나라' 스페인의 놀라운 식단'세계 최저체중' 268ｇ 男, 손바닥 위에 올려보니좋아요0훈훈해요0슬퍼요0화나요0후속기사 원해요0기사제공 :""]"
16,삼성전자, 2019-02-2709:13,아시아경제 ,"삼성전자, ‘러시아 카잔 국제기능올림픽’ 후원",https://finance.naver.com/news/news_read.nhn?article_id=0004420025&office_id=277&mode=search&query=삼성전자&page=8,"['       삼성전자, ‘러시아 카잔 국제기능올림픽’ 후원      기사입력2019-02-27 09:13기사원문좋아요훈훈해요좋아요 평가하기공감좋아요0훈훈해요0슬퍼요0화나요0후속기사 원해요0댓글 [아시아경제 박소연 기자] 삼성전자가 전세계 우수한 기술인재를 육성하고 산업발전에 기여하기 위해 8월 러시아 카잔에서 열리는‘제 45회 카잔 국제기능올림픽대회(WorldSkills Kazan 2019)’를 후원한다고 27일 밝혔다.삼성전자는 지난 2007년 일본 시즈오카 대회 후원을 시작으로 격년마다 열리는 국제기능올림픽을 7회 연속으로 후원해 오고 있다.특히 지난 2013년 독일 라이프치히 대회, 2015년 브라질 상파울루 대회, 2017년 아랍에미리트(UAE) 아부다비 대회에 이어 4연속 단독 ‘최상위 타이틀 후원사(OEP, Overall Event Presenter)’로 참여한다.삼성전자는 이번 대회 최상위 후원사로 150만유로(약 19억5000만원)를 지원하며, 3월 중 러시아에서 후원 체결식을 가질 예정이다.이번 대회는 8월 22일부터 27일까지 러시아 타타르스탄 자치공화국의 수도 카잔에서 개최된다.박소연 기자 muse@asiae.co.kr▶ 아시아경제 채널 추가하고 에어팟, 해외여행비 받자!▶ 재미와 신기 \'과학을읽다\' ▶ 꿀잼 \'인기만화\'<ⓒ경제를 보는 눈, 세계를 보는 창 아시아경제 무단전재 배포금지>아시아경제 관련뉴스해당 언론사에서 선정하며 언론사 페이지(아웃링크)로 이동해 볼 수 있습니다.""더이상 정치쇼는 필요없다""…日, 북미회담에 찬물파리바게트 회장님, 북미회담 기자들에 \'통큰 선물\'경매 부쳐진 한 23세 모델의 처녀성, 낙찰가 무려""인류 파괴하겠다""던 AI로봇 또 등장해…박항서 열풍에…삼성, 세계 최초로 \'특별한 선택\'좋아요0훈훈해요0슬퍼요0화나요0후속기사 원해요0기사제공 :']"
17,삼성전자, 2019-02-2709:08,서울경제 ,"삼성전자, 국제기능올림픽·충남삼성학원 기부금 49억원 출연",https://finance.naver.com/news/news_read.nhn?article_id=0003512193&office_id=011&mode=search&query=삼성전자&page=8,"['       삼성전자, 국제기능올림픽·충남삼성학원 기부금 49억원 출연      기사입력2019-02-27 09:08기사원문좋아요훈훈해요좋아요 평가하기공감좋아요0훈훈해요0슬퍼요0화나요0후속기사 원해요0댓글 [서울경제] 삼성전자(005930)가 국제기능올림픽에 150만 유로(약 19억5,000만원)을 후원하고 충남삼성학원에 29억9,100만원의 기부금을 출연키로 했다고 27일 공시했다. 삼성전자는 제45회 러시아 카잔 국제기능올림픽대회 최상위 스폰서 기업으로 주관기관인 국제기능올림픽위원회를 후원한다. /유주희기자 ginger@sedaily.com [서울경제 바로가기]네이버 메인에서 \'No. 1 뉴스\' 서울경제를 만나보세요 [바로가기▶]프리미엄 미디어 Signal이 투자의 바른 길을 안내합니다 [바로가기▶]저작권자 ⓒ 서울경제, 무단 전재 및 재배포 금지서울경제 관련뉴스해당 언론사에서 선정하며 언론사 페이지(아웃링크)로 이동해 볼 수 있습니다.또 1억6,000만원 추락···은마 전용 76㎡ 14억원 \'급급매\'\'하노이 입성\' 트럼프, 호텔에 가자마자 한 일은 역시나어서와, 자본주의 처음이지? 김정은, 베트남을 만나다""SUV 다 꿇어"" 확 바뀐 \'쌍용 코란도\' 첨단성능 대공개\'현대차그룹 선장\' 정의선, 자율차·수소차 방향타 잡는다좋아요0훈훈해요0슬퍼요0화나요0후속기사 원해요0기사제공 :']"
18,삼성전자, 2019-02-2709:07,뉴시스 ,"[2019 라이징Biz리더]신기영 디자이노블 대표 '혁신'에 답하다…""AI가 패션...",https://finance.naver.com/news/news_read.nhn?article_id=0009082973&office_id=003&mode=search&query=삼성전자&page=8,"['       [2019 라이징Biz리더]신기영 디자이노블 대표 \'혁신\'에 답하다…""AI가 패션디자인?""       기사입력2019-02-27 09:07기사원문좋아요훈훈해요좋아요 평가하기공감좋아요0훈훈해요0슬퍼요0화나요0후속기사 원해요0댓글삼성전자·IBM 거치며 전문 지식과 실무 쌓아""패션 분야는 노동집약적…IT 접목하면 혁신 가능성 높아""【서울=뉴시스】추상철 기자 = 패션 AI 서비스를 제공하는 스타트업 기업 신기영 디자이노블 대표가 18일 오후 서울 강남구 위워크에서 뉴시스와 인터뷰하고 있다. 2019.02.27.  scchoo@newsis.com【서울=뉴시스】김지은 기자 = 지난해 말 현대백화점그룹 계열 패션기업 한섬이 인공지능(AI)을 활용해 디자인한 의류를 선보여 주목을 받았다. 옷 뒷면에 한섬이 운영하는 패션브랜드 SJYP 캐릭터 \'디노\'와 요즘 유행하는 블록(레고) 문양의 공룡 캐릭터가 새겨져 있는 아이보리색 후드티다. 국내에서 AI를 활용해 디자인한 옷이 실제 출시되는 것은 처음이다. 유통 과정에서 드러나지는 않았지만 이런 AI 기술을 구현한 곳이 바로 패션 IT 스타트업 \'디자이노블\'이다. 디자이노블은 패션 트렌드 정보를 분석해 잘 팔릴 디자인을 생성하거나 찾아서 추천하는 디자인 AI, 패션 기술 등의 솔루션을 패션 회사에 공급한다.수작업이 익숙한 패션 분야에 IT 기술을 입힌 신선한 시도로 업계 내에서 서서히 이름을 알리고 있다. 신기영(34) 디자이노블 공동대표는 최근 뉴시스와의 인터뷰에서 ""패션 분야는 IT 기술이 접목된 부분이 한정돼 있다. 굉장히 노동집약적인 산업군""이라며 ""산업의 혁신이 정체돼 있던 패션 시장에 AI을 적용해 부가가치를 창출해 보고자 도전했다""고 말했다.신 대표는 포항공대 \'지식 및 언어공학\' 연구실 선후배 사이인 연구원 2명과 의기투합해 공동 창업했다. 대학에서 경영학을 배운 그는 창업과 기술에 대한 갈망으로 포항공대 창의IT융합공학과 석·박사 통합과정에 진학해 주요 AI 기술인 자연언어처리를 전공했다.법인 설립일 하나 허투루 하는 법이 없다. \'빨리 사\'라는 의미를 담아 2017년 \'8월24일\'에 회사를 차렸다.85년생, 30대 중반의 젊은 대표로 이전과는 다른 \'넥스트 리더\'를 자처한다. 삼성전자 모바일사업부 전략마케팅팀, IBM 데이터 애널리틱스팀을 거쳐 전문 지식과 실무를 쌓았다. 평소 창업에 관심이 많던 그는 대기업을 마다하고 \'혁신\'을 쫓으며 가보지 않은 길을 걷기로 결정했다.신 대표는 ""경영학에서 배운 가치를 실제로 창출하는 일을 하고 싶었다. 종교나 국가보다 강력한 게 기업이라고 생각한다""며 ""국내 대기업의 데이터 분석 전략을 수립하거나 실제 데이터를 분석해 의사결정을 진행하는 일들을 겪으면서 기술적 역량과 사업화 역량을 함께 기를 수 있었다""고 돌아봤다. 특히 삼성전자 무선사업부에서의 마케팅 업무는 기술의 중요성을 깨닫는 계기가 됐다.그는 ""삼성전자 무선사업부 전략마케팅팀에 입사해 벨기에·네덜란드·룩셈부르크 지역 공급망관리(SCM) 등 마케팅 업무를 지원하게 됐는데 당초 생각했던 경영(마케팅, 재무) 지식과 경험만으로는 앞으로 30년, 50년을 이끌어 갈 수 있는 경쟁력은 부족하겠다는 생각을 하게 됐다""며 ""메디컬·바이오, 전자·통신, 컴퓨터 세 가지 기술 중에 하나는 알아야겠다는 생각이 들었고, 다양한 산업계에 적용되는 인공지능(자연언어 처리)을 전공하며 파고들게 됐다""고 했다.배움과 도전은 멈추지 않았다. 대학 졸업 후에는 프랑스 최고 고등교육기관인 그랑제콜에 1년 동안 교환학생으로 전문가 양성 과정을 밟았다. 한국투자공사(KIC)의 한국형 아이코어 프로그램, 네이버 D2SF의 CTA 프로그램, 포스코 아이디어마켓 플레이스, 미국 KIC와 할사이온(Halcyon) 재단의 인텐시브 프로그램, 구글 캠퍼스 등 해외 진출 및 창업에 도움이 되는 프로그램에 참여하며 기반을 다졌다. 이러한 수많은 경험과 시도 끝에 정착한 곳이 패션 IT다. 신 대표는 천재의 번뜩이는 아이디어가 아닌 현장에서 직면하는 무수히 많은 시행착오가 밑거름이 돼 혁신이 탄생한다고 믿는다. 그래서 방대한 양의 학습을 거친 인공지능이 손이 많이 가는 패션 분야에 도움을 줄 수 있다고 자신한다. 현재 디자이노블은 패션 특화 검색 엔진, 디자인 AI, 추천 시스템 등의 기술을 서비스 또는 상품으로 제공하고 있다. AI가 자유자재로 새로운 의상을 디자인하는 수준에 이르지 못했지만, 패션 디자이너의 일을 지원하는 조력자로서 패션 산업에 다양하게 활용되고 있는 셈이다.신 대표는 ""디자이너가 수작업으로 하던 최신 유행 파악, 패션쇼 자료 열람 등은 디자인 작업의 기초 과정이지만 그만큼 데이터가 방대해 시간이 오래 걸린다""며 ""새로운 아이디어와 영감 수집 등을 인공지능이 대신해 효율성을 높여줄 수 있다""고 설명했다.이어 ""기능적인 패턴이나 즉각 반응 생산처럼 트렌드에 대응하기 위한 상품을 만들어내는 작업은 AI가 조금 더 빨리, 많은 작업을 할 수 있도록 크게 도움을 줄 수 있다""며 ""패션 AI가 아무리 발전해도 모든 것이 자동화될 수는 없지만 디자이너와 상호 보완 관계로 협업하다 보면 시너지를 극대화할 수 있다고 생각한다""고 보충했다. 디자이너블은 디자인 AI 적용군을 넓혀 사업 포트폴리오를 다각화하는 방안을 모색 중이다. 가시적인 성과도 내고 있다. 한섬 외에 스포츠 브랜드, 캐주얼 브랜드 등과 함께 협업 중으로 올해 상품 출시를 앞두고 있다. ""지난해가 인지도를 쌓아 업계에 존재를 알리는 시기였다면 올해는 AI가 만든 옷이 잘 팔린다는 것을 증명해야 하는 중요한 한 해다. 다양한 기업들과 함께 생각하고 하나씩 실행에 옮기다보면 몇몇 기업들이 시장 전체의 매출과 이익을 가져가는 구조를 바꿔 건강한 산업 생태계를 조성하는 데에도 일조하지 않을까 기대한다.""kje1321@newsis.com▶ 네이버에서 뉴시스 채널 구독하기▶ 뉴시스 빅데이터 MSI 주가시세표 바로가기 <저작권자ⓒ 공감언론 뉴시스통신사. 무단전재-재배포 금지.>뉴시스 관련뉴스해당 언론사에서 선정하며 언론사 페이지(아웃링크)로 이동해 볼 수 있습니다.""통화 시끄럽다"" 꾸짖는 노인에 흉기 들이댄 10대프로스포츠 여자선수 37.7% ""성폭력 피해 경험있다""""정신병원 가려고""…구급차 훔쳐 달아난 30대 검거美언론 ""영변 폐쇄·제재완화·평화선언 등 잠정합의""트럼프, 김정은 만나기 위해 33.5억원짜리 비행좋아요0훈훈해요0슬퍼요0화나요0후속기사 원해요0기사제공 :']"
