,회사명,날짜,언론사,기사제목,링크,본문
15,삼성전자, 2019-07-0719:05,뉴시스 ,이재용 삼성전자 부회장 일본 수출 규제 풀 수 있을까,https://finance.naver.com/news/news_read.nhn?article_id=0009328973&office_id=003&mode=search&query=삼성전자&page=3,"['       이재용 삼성전자 부회장 일본 수출 규제 풀 수 있을까      기사입력2019-07-07 19:05기사원문좋아요훈훈해요좋아요 평가하기공감좋아요0훈훈해요0슬퍼요0화나요0후속기사 원해요0댓글【김포공항=뉴시스】배훈식 기자 = 이재용 삼성전자 부회장이 7일 오후 김포국제공항을 통해 반도체 필수 소재 수출 규제 해결 방안 모색 차 일본으로 출국하고 있다.  2019.07.07.photo@newsis.com<저작권자ⓒ 공감언론 뉴시스통신사. 무단전재-재배포 금지.>뉴시스 관련뉴스해당 언론사에서 선정하며 언론사 페이지(아웃링크)로 이동해 볼 수 있습니다.성범죄자 등록 억만장자 엡스타인, 또 성범죄로 체포7살 딸 목 졸라 죽인 엄마 \'심신 미약\' 주장\'게임에 방해\' 70일 된 아기 학대해 숨지게 한 아버지하와이 법원, 술 취해 기내 난동 한국인 징역 6월·2억원 배상법원 ""남이섬은 친일재산 보도 잘못…기사 삭제해야""좋아요0훈훈해요0슬퍼요0화나요0후속기사 원해요0기사제공 :']"
16,삼성전자, 2019-07-0719:05,TV조선 ,"김상조·홍남기, 기업 총수 만나 대책 논의…이재용 일본行",https://finance.naver.com/news/news_read.nhn?article_id=0000277479&office_id=448&mode=search&query=삼성전자&page=3,"['       김상조·홍남기, 기업 총수 만나 대책 논의…이재용 일본行      기사입력2019-07-07 19:05기사원문좋아요훈훈해요좋아요 평가하기공감좋아요0훈훈해요0슬퍼요0화나요0후속기사 원해요0댓글[앵커]일본의 이런 노골적이고 전방위적인 공세에 우리 정부와 기업은 대응책 마련에 고심하고 있습니다. 휴일인 오늘, 김상조 청와대 정책실장은 당장 소재 확보에 비상이 걸린 주요 대기업 총수들을 만났습니다. 삼성전자 이재용 부회장은 직접 일본으로 날아가 관계 회복에 나섰습니다. 박상현 기자입니다.[리포트]일본의 경제보복 조치 4일 만에 김상조 청와대 정책실장과 홍남기 경제부총리가 대기업 총수들과 오찬을 함께했습니다. 이 자리에는 현대차 정의선 부회장과 SK 최태원 회장 LG그룹 구광모 회장이 참석했습니다. 오늘 만남은 김 실장 측이 기업 총수들에게 직접 연락해 성사됐습니다. 김상조 / 청와대 정책실장""주요기업들에 직접 연락을해서 국익을 위해선 정부와 재계가 소통하고 협력해야한다는 뜻을 전달하고…."" 회동에선 일본의 수출 규제에 따른 각 기업의 상황을 듣고, 대처방안을 논의했습니다. 일본의 경제 보복에 직격탄을 맞은 삼성전자 이재용 부회장은 불참했습니다. 대신 일본 정제계 인사들을 직접 만나기 위해 일본으로 건너갔습니다. 재계에선 선대 부터 일본과 소통해온 이 부회장이 직접 문제해결을 위해 나섰다는 평가가 나옵니다. 성태윤 / 연세대 경제학부 교수""감정적인 대응은 우리에게 큰 도움이 된다고 보긴 어렵고요. 결국 상호 신뢰를 위한 원만한 관계를 회복하는…."" 문재인 대통령은 이번주 30대 그룹 총수들을 청와대로 초청해 간담회를 갖습니다. 이 자리에서 문 대통령이 직접 일본의 보복 조치에 대한 입장을 밝힐지 주목됩니다. TV조선 박상현입니다. ☞ 네이버 메인에서 TV조선 구독하기☞ 더 많은 TV조선 뉴스 보기☞ TV조선 뉴스 홈페이지 바로가기* 뉴스제보 : 이메일(tvchosun@chosun.com), 카카오톡(tv조선제보), 전화(1661-0190)박상현 기자(pshyun@chosun.com)- Copyrights ⓒ TV조선. 무단전재 및 재배포 금지 -TV조선 관련뉴스해당 언론사에서 선정하며 언론사 페이지(아웃링크)로 이동해 볼 수 있습니다.北 ""호주 유학생, 간첩행위로 억류…관용 베풀어 추방""성리학 산실 \'한국의 서원\' 9곳 유네스코 세계유산 등재조국, 벌써 청문회 준비하나…여당 의원들에 해명글 논란달궈진 놀이시설에 2도 화상…폭염 속 놀이터 안전 \'비상\'\'광화문 천막\' 재설치…서울시 ""오늘까지 철거하라""좋아요0훈훈해요0슬퍼요0화나요0후속기사 원해요0기사제공 :']"
17,삼성전자, 2019-07-0719:03,연합뉴스 ,"이재용, 반도체 소재 '재고 비상'에 일본으로 출국",https://finance.naver.com/news/news_read.nhn?article_id=0010937453&office_id=001&mode=search&query=삼성전자&page=3,"['       이재용, 반도체 소재 \'재고 비상\'에 일본으로 출국      기사입력2019-07-07 19:03기사원문좋아요훈훈해요좋아요 평가하기공감좋아요0훈훈해요0슬퍼요0화나요0후속기사 원해요0댓글일본으로 출국하는 이재용 부회장 (서울=연합뉴스) 강민지 기자 = 이재용 삼성전자 부회장이 일본 정부의 대(對)한국 수출 규제에 대한 대책 논의를 위해 7일 오후 서울 김포공항을 통해 출국하고 있다. 2019.7.7     (서울=연합뉴스) 최재서 기자 = 이재용 삼성전자 부회장이 일본 수출 규제에 대응하기 위해 7일 저녁 일본으로 출국했다.    복수의 재계 관계자에 따르면 이 부회장은 일본 현지의 경제인들과 직접 만나 관련 대책을 논의할 것으로 알려졌다.    이번 \'긴급 출국\'은 최근 반도체 소재 재고가 몇주를 버틸 정도밖에 남지 않은 것으로 알려지면서 예상보다 사태가 심각해질 수 있다는 판단에 따른 것으로 보인다.    앞서 반도체 업계 관계자는 ""3일까지 추가 재고 확보를 위해 노력했으나 어려운 상황""이라고 밝힌 바 있으며 이날부터는 재고가 며칠 분 밖에 남지 않았다는 얘기까지 나오고 있다.    또한 김상조 청와대 정책실장이 이날 5대 그룹 총수를 만나 일본 규제 대책을 논의하는 간담회를 가지려 했으나 이재용 부회장은 출장으로 인해 참석이 어려울 것이란 예상이 나왔다.    하지만 이 부회장의 출국 시간이 당초보다 미뤄지면서 김 실장과의 간담회에 정의선 현대차그룹 수석부회장, 최태원 SK그룹 회장, 구광모 LG그룹 회장 등과 함께 참석했을 가능성도 배제할 수 없다.    이 부회장은 지난해 최소 2차례 일본을 방문했고, 올해 들어서도 지난 5월 도쿄(東京)에서 현지 양대 이동통신 사업자인 NTT도코모, KDDI의 경영진을 만나는 등 일본 재계와 탄탄한 네트워크를 구축하고 있다.     특히 지난 4일 방한한 일본 소프트뱅크 그룹 손정의(孫正義·일본 이름 손 마사요시) 회장과 만난 자리에서도 일본 수출 규제에 대해 장시간 동안 논의한 것으로 알려졌다.    삼성전자 관계자는 ""일본 출장의 구체적인 일정은 확인해줄 수 없다""고 밝혔다.출국하는 이재용 부회장(서울=연합뉴스) 강민지 기자 =  이재용 삼성전자 부회장이 일본 정부의 대(對)한국 수출 규제에 대한 대책 논의를 위해 7일 오후 서울 김포공항을 통해 출국하고 있다. 2019.7.7     acui721@yna.co.kr▶확 달라진 연합뉴스 웹을 만나보세요▶네이버 [연합뉴스] 채널 구독   ▶뭐 하고 놀까? #흥연합뉴스 관련뉴스해당 언론사에서 선정하며 언론사 페이지(아웃링크)로 이동해 볼 수 있습니다.\xa060대 대만 할머니, 불륜 상대 수면제 먹여 살해\xa0태국 경찰, \'SBS 정글의 법칙\' 대왕조개 사건 조사 착수\xa0""실종자 남았는데 먼저 귀국하는 게 가장 힘들었다""\xa0\'한국말 서툴다\'며 베트남 출신 아내 무차별 폭행\xa0배우 이기우-이청아, 6년 만에 결별좋아요0훈훈해요0슬퍼요0화나요0후속기사 원해요0기사제공 :']"
18,삼성전자, 2019-07-0719:01,서울신문 ,돌파구 찾는 이재용… 日 고객사·재계 만나,https://finance.naver.com/news/news_read.nhn?article_id=0003012188&office_id=081&mode=search&query=삼성전자&page=3,"['       돌파구 찾는 이재용… 日 고객사·재계 만나      기사입력2019-07-07 19:01기사원문좋아요훈훈해요좋아요 평가하기공감좋아요0훈훈해요0슬퍼요0화나요0후속기사 원해요0댓글 [서울신문]반도체·디스플레이 3대 핵심 소재에 대한 일본의 수출제한 조치 표적으로 지목된 삼성전자의 이재용 부회장이 7일 오후 6시 40분 비행기로 일본 출장에 나섰다. 일본의 조치 발표 이후 삼성전자가 ‘납품에 차질이 없게 하겠다’는 서한을 고객사에 발송한 데 이어 이 부회장이 직접 수습 전면에 나서는 모습이다. 이날 김상조 청와대 정책실장, 홍남기 경제부총리와 주요 기업 총수 간 오찬이 있었는데, 저녁 비행기를 탄 이 부회장이 오찬에 참석했을 가능성도 배제할 수 없다는 추측이 나왔다.이 부회장은 일본의 규제 조치가 시행된 지난 4일 손정의 소프트뱅크 회장과 만나 일본 현지 상황에 대해 전해 듣고 조언을 얻었다. 이어 직접 일본으로 건너가 사업 파트너를 만나는 등 기업 차원에서 ‘돌파구’를 모색하고 있다. 이 부회장이 광폭 행보에 나선 것은 그만큼 사정이 다급하다는 방증이다.포토레지스트, 고순도 불화수소, 플루오린 폴리이미드 등 일본이 발표한 수출 제한품 중 포토레지스트는 일본에 대한 수입 의존율이 90%가 넘는 소재로 삼성전자가 적극 육성 중인 시스템반도체의 파운드리(반도체 위탁생산) 핵심 소재다. 삼성전자의 2분기 파운드리 시장 글로벌 점유율은 18.0%로, 점유율 49.2%로 1위인 대만의 TSMC에 뒤진다. 삼성전자는 퀄컴, IBM, 엔비디아 등의 팹리스(반도체 설계) 업체들로부터 위탁 물량을 수주하며 추격 중이었다. 특히 올해 초 삼성전자는 업계 최초로 EUV 공정을 적용한 7나노(㎚) 제품을 양산하는 등 초격차 기술 전략을 펴며 점유율을 높여 가던 중이었는데 일본산 포토레지스트 없이는 해당 공정 가동이 어렵다. 우리 기업과 정부는 일본 외 제3국을 경유한 우회 수출, 일본 기업의 해외공장에 소재 생산을 의뢰하는 방안을 타진했지만 어떤 경우든 한국 수출을 위해선 일본에서 수출 심사를 받아야 해 실효를 거두기 어려운 방안으로 판명됐다.이 부회장은 일본 게이오대에서 유학해 일본어에 능통하고 지난 5월 도쿄에서 일본 양대 이동통신 사업자인 NTT도코모, KDDI 경영진을 만나는 등 일본 재계와 관계를 맺어 왔다. 하지만 두 달 전 방일이 5G(5세대 이동통신) 장비 수요 생태계 구축을 위한 출장이었다면, 이번엔 일본 정부의 반도체 공급망 관련 규제 강화 조치를 방어하기 위한 출장이어서 기업인이 독자적으로 풀기엔 버거운 상황이란 진단이 많다.홍희경 기자 saloo@seoul.co.kr▶ 네이버에서 서울신문 구독하기 ▶ 재미있는 세상[나우뉴스] [인기 무료만화]ⓒ 서울신문(www.seoul.co.kr), 무단전재 및 재배포금지서울신문 관련뉴스해당 언론사에서 선정하며 언론사 페이지(아웃링크)로 이동해 볼 수 있습니다.[단독] 위장이혼으로 연금 수억 더 챙긴 공무원\'베트남 아내 폭행\'에 분노한 베트남 ""한국은…""빅뱅 탑, 구름팬에 90도 인사 사진 공개 ""반성…""""북한에서 영원히 살겠다"" 무단 월북…대체 왜?홍문종 ""한국당 의원들 \'살려 달라\'고 줄섰다""좋아요0훈훈해요0슬퍼요0화나요0후속기사 원해요0기사제공 :']"
19,삼성전자, 2019-07-0719:00,이데일리 ,정부와 사전 교감한 이재용 부회장..제재 해결책 찾아 日긴급 출장(종합),https://finance.naver.com/news/news_read.nhn?article_id=0004419889&office_id=018&mode=search&query=삼성전자&page=3,"['       정부와 사전 교감한 이재용 부회장..제재 해결책 찾아 日긴급 출장(종합)      기사입력2019-07-07 19:00기사원문좋아요훈훈해요좋아요 평가하기공감좋아요0훈훈해요0슬퍼요0화나요0후속기사 원해요0댓글- 7일 오후 6시 40분 비행기로 김포서 일본 출국- 홍남기 부총리, 김상조 정책실장 회동 불참- 김기남 부회장 통해 충분한 사전 소통 추정- 文대통령 오는 10일 간담회서 출장 결과 전할듯[이데일리 방인권 기자] 이재용 삼성전자 부회장이 7일 오후 6시 20분께 서울 강서구 김포공항을 통해 일본으로 출국하고 있다.이 부회장 일본행은 지난 4일부터 시작된 일본 정부의 반도체 핵심소재 수출 규제 강화에 따른 해결방안을 모색하기 위한 것으로 알려졌다.[이데일리 양희동 기자] 이재용 삼성전자(005930) 부회장이 7일 오후 6시 40분, 서울 강서구 김포공항에서 출발해 도쿄 하네다 공항으로 가는 비행기를 타고 일본으로 긴급 출장을 떠났다. 이재용 부회장은 이날 6시 20분께 넥타이를 매지 않은 정장 차림으로 수행원을 대동하지 않고 혼자서 김포공항 출국장으로 들어섰다. 그는 검은색 여행 가방 하나와 오른손에 여권을 든 단출한 모습으로 비행기에 올랐다. 이 부회장은 이번 출장에서 일본 정부가 지난 4일부터 시행에 들어간 한국에 대한 반도체 소재 수출 규제와 관련해 현지 경제인들을 직접 만나 관련 대책을 논의할 것으로 알려졌다. 삼성전자는 얼마 전부터 사장단과 임원을 포함한 관련 임직원들이 비상근무 체제에 돌입한 상태다. 이 부회장은 이날 홍남기 경제부총리 겸 기획재정부 장관과 김상조 청와대 정책실장과의 오찬 회동 일정에 참석하지 않다. 일각에선 이 부회장이 김기남 부회장을 통해 정부 측과 충분한 사전 교감을 한 상태이고, 반도체 소재 수급이 절박한 상황이라 곧바로 일본 출장길에 올랐다는 해석이 나온다.재계에 따르면 이 부회장은 지난 4일 손정의 소프트뱅크 회장과 일본 현지 상황에 대한 다양한 의견을 전달받았고, DS(디바이스솔루션)부문장인 김기남 부회장 등 반도체 사업 경영진과 여러 차례 대책회의를 거쳐 일본 출장을 결정한 것으로 전해졌다.일본이 △플루오린 폴리이미드 △리지스트 △에칭가스(고순도 불화수소) 등 3개 품목에 대한 수출 제재에 들어가자, 삼성전자는 관련 품목 수급에 비상이 걸린 상황이다. 반도체 제조 전 과정에 사용되는 리지스트와 에칭가스 등의 재고 확보 분량이 1주일 분에 불과하고, 완성품 생산까지 3개월이 걸리는 제조공정의 특성상 1~2개월 분의 재고는 턱없이 부족하기 때문이다. 일각에서는 유독 물질로 장기 보관이 어려운 에칭가스 등의 실제 재고는 사나흘 수준에 불과하다는 소식도 들린다.이 부회장은 일본으로 떠나기 전 김기남 부회장으로부터 정부 측의 메시지를 전달받고 관련 내용을 일본 출장 중 파악, 오는 10일 문재인 대통령과의 청와대 간담회에서 전달할 것으로 알려지고 있다. 앞서 김 부회장은 지난 2일과 3일 이틀에 걸쳐 김상조 정책실장과 홍남기 부총리, 김현종 청와대 국가안보실장 등을 각각 만나 일본 수출 제재와 관련해 삼성전자는 물론 반도체 업계 전반의 의견을 전달했다. 이 과정에서 정부측 요청이 김 부회장을 통해 이 부회장에게 충분히 전달 됐을 것으로 업계는 판단하고 있다.재계 한 관계자는 “이 부회장이 홍 부총리와 김 정책실장과의 회동에 참석하지 않고 곧바로 일본 출장을 떠난 것은 사전 조율을 거쳤을 가능성 높다”며 “이 부회장이 출장 전 정부 측 요청을 김 부회장을 통해 전달받아 상호 충분한 교감이 있었고 문 대통령과의 간담회에서 출장 결과 등을 전할 것으로 본다”고 말했다.삼성 측은 이에 대해 “이 부회장의 일정과 회동 참석 여부에 대해서는 확인된 것이 없다”고 답했다.한편 이 부회장은 지난해 일본을 두 차례 방문했고, 올 들어서도 지난 5월 도쿄에서 현지 양대 이동통신사인 NTT도코모, KDDI 등의 경영진을 만나 5G(5세대 이동통신)서비스 등을 논의하는 등 탄탄한 현지 인맥을 갖고 있다. 또 일본 게이오기주쿠대에서 경영학 석사 학위를 받아 일본어에 능하다. 2016년 1월, 게이오대 경영대학원 시절 지도교수였던 고(故) 야나기하라 카즈오(柳原一夫) 교수가 별세했을 당시엔 직접 도쿄로 날아가 빈소를 찾기도 했다.양희동 (eastsun@edaily.co.kr)＜ⓒ종합 경제정보 미디어 이데일리 - 무단전재 & 재배포 금지＞이데일리 관련뉴스해당 언론사에서 선정하며 언론사 페이지(아웃링크)로 이동해 볼 수 있습니다.끝없는 수렁 美中 무역전쟁…1년만에 50조 날렸다정글, 규정 몰랐다고? ""사냥 촬영 않겠다"" 사전공문日경제제재에 깊어지는 韓정부의 고민베트남 아내 ""남편 폭행 참다못해 몰래 영상 찍었다""\'정법\' 대왕조개 연출 의혹..김병만·제작진, 몰랐나?좋아요0훈훈해요0슬퍼요0화나요0후속기사 원해요0기사제공 :']"
0,삼성전자, 2019-07-0719:00,이데일리 ,정부와 사전 교감한 이재용 부회장..제재 해결책 찾아 日긴급 출장(종합),https://finance.naver.com/news/news_read.nhn?article_id=0004419889&office_id=018&mode=search&query=삼성전자&page=4,"['       정부와 사전 교감한 이재용 부회장..제재 해결책 찾아 日긴급 출장(종합)      기사입력2019-07-07 19:00기사원문좋아요훈훈해요좋아요 평가하기공감좋아요0훈훈해요0슬퍼요0화나요0후속기사 원해요0댓글- 7일 오후 6시 40분 비행기로 김포서 일본 출국- 홍남기 부총리, 김상조 정책실장 회동 불참- 김기남 부회장 통해 충분한 사전 소통 추정- 文대통령 오는 10일 간담회서 출장 결과 전할듯[이데일리 방인권 기자] 이재용 삼성전자 부회장이 7일 오후 6시 20분께 서울 강서구 김포공항을 통해 일본으로 출국하고 있다.이 부회장 일본행은 지난 4일부터 시작된 일본 정부의 반도체 핵심소재 수출 규제 강화에 따른 해결방안을 모색하기 위한 것으로 알려졌다.[이데일리 양희동 기자] 이재용 삼성전자(005930) 부회장이 7일 오후 6시 40분, 서울 강서구 김포공항에서 출발해 도쿄 하네다 공항으로 가는 비행기를 타고 일본으로 긴급 출장을 떠났다. 이재용 부회장은 이날 6시 20분께 넥타이를 매지 않은 정장 차림으로 수행원을 대동하지 않고 혼자서 김포공항 출국장으로 들어섰다. 그는 검은색 여행 가방 하나와 오른손에 여권을 든 단출한 모습으로 비행기에 올랐다. 이 부회장은 이번 출장에서 일본 정부가 지난 4일부터 시행에 들어간 한국에 대한 반도체 소재 수출 규제와 관련해 현지 경제인들을 직접 만나 관련 대책을 논의할 것으로 알려졌다. 삼성전자는 얼마 전부터 사장단과 임원을 포함한 관련 임직원들이 비상근무 체제에 돌입한 상태다. 이 부회장은 이날 홍남기 경제부총리 겸 기획재정부 장관과 김상조 청와대 정책실장과의 오찬 회동 일정에 참석하지 않다. 일각에선 이 부회장이 김기남 부회장을 통해 정부 측과 충분한 사전 교감을 한 상태이고, 반도체 소재 수급이 절박한 상황이라 곧바로 일본 출장길에 올랐다는 해석이 나온다.재계에 따르면 이 부회장은 지난 4일 손정의 소프트뱅크 회장과 일본 현지 상황에 대한 다양한 의견을 전달받았고, DS(디바이스솔루션)부문장인 김기남 부회장 등 반도체 사업 경영진과 여러 차례 대책회의를 거쳐 일본 출장을 결정한 것으로 전해졌다.일본이 △플루오린 폴리이미드 △리지스트 △에칭가스(고순도 불화수소) 등 3개 품목에 대한 수출 제재에 들어가자, 삼성전자는 관련 품목 수급에 비상이 걸린 상황이다. 반도체 제조 전 과정에 사용되는 리지스트와 에칭가스 등의 재고 확보 분량이 1주일 분에 불과하고, 완성품 생산까지 3개월이 걸리는 제조공정의 특성상 1~2개월 분의 재고는 턱없이 부족하기 때문이다. 일각에서는 유독 물질로 장기 보관이 어려운 에칭가스 등의 실제 재고는 사나흘 수준에 불과하다는 소식도 들린다.이 부회장은 일본으로 떠나기 전 김기남 부회장으로부터 정부 측의 메시지를 전달받고 관련 내용을 일본 출장 중 파악, 오는 10일 문재인 대통령과의 청와대 간담회에서 전달할 것으로 알려지고 있다. 앞서 김 부회장은 지난 2일과 3일 이틀에 걸쳐 김상조 정책실장과 홍남기 부총리, 김현종 청와대 국가안보실장 등을 각각 만나 일본 수출 제재와 관련해 삼성전자는 물론 반도체 업계 전반의 의견을 전달했다. 이 과정에서 정부측 요청이 김 부회장을 통해 이 부회장에게 충분히 전달 됐을 것으로 업계는 판단하고 있다.재계 한 관계자는 “이 부회장이 홍 부총리와 김 정책실장과의 회동에 참석하지 않고 곧바로 일본 출장을 떠난 것은 사전 조율을 거쳤을 가능성 높다”며 “이 부회장이 출장 전 정부 측 요청을 김 부회장을 통해 전달받아 상호 충분한 교감이 있었고 문 대통령과의 간담회에서 출장 결과 등을 전할 것으로 본다”고 말했다.삼성 측은 이에 대해 “이 부회장의 일정과 회동 참석 여부에 대해서는 확인된 것이 없다”고 답했다.한편 이 부회장은 지난해 일본을 두 차례 방문했고, 올 들어서도 지난 5월 도쿄에서 현지 양대 이동통신사인 NTT도코모, KDDI 등의 경영진을 만나 5G(5세대 이동통신)서비스 등을 논의하는 등 탄탄한 현지 인맥을 갖고 있다. 또 일본 게이오기주쿠대에서 경영학 석사 학위를 받아 일본어에 능하다. 2016년 1월, 게이오대 경영대학원 시절 지도교수였던 고(故) 야나기하라 카즈오(柳原一夫) 교수가 별세했을 당시엔 직접 도쿄로 날아가 빈소를 찾기도 했다.양희동 (eastsun@edaily.co.kr)＜ⓒ종합 경제정보 미디어 이데일리 - 무단전재 & 재배포 금지＞이데일리 관련뉴스해당 언론사에서 선정하며 언론사 페이지(아웃링크)로 이동해 볼 수 있습니다.끝없는 수렁 美中 무역전쟁…1년만에 50조 날렸다정글, 규정 몰랐다고? ""사냥 촬영 않겠다"" 사전공문日경제제재에 깊어지는 韓정부의 고민베트남 아내 ""남편 폭행 참다못해 몰래 영상 찍었다""\'정법\' 대왕조개 연출 의혹..김병만·제작진, 몰랐나?좋아요0훈훈해요0슬퍼요0화나요0후속기사 원해요0기사제공 :']"
