,회사명,날짜,언론사,기사제목,링크,본문
15,삼성전자, 2019-02-2711:15,아시아경제 ,삼성전자-아부다비 왕가 '3대에 걸친 약속',https://finance.naver.com/news/news_read.nhn?article_id=0004420178&office_id=277&mode=search&query=삼성전자&page=5,"['       삼성전자-아부다비 왕가 \'3대에 걸친 약속\'      기사입력2019-02-27 11:15기사원문좋아요훈훈해요좋아요 평가하기공감좋아요0훈훈해요0슬퍼요0화나요0후속기사 원해요0댓글이재용 삼성전자 부회장이 삼성전자 경기도 화성사업장을 방문한 모하메드 빈 자이드 알-나흐얀 아랍에미리트(UAE) 왕세제(오른쪽 앞줄 다섯번째) 및 그 가족들과 함께 기념촬영을 하고 있다.[사진=왕세제 트위터][아시아경제 유인호 기자, 박소연 기자] 이재용 삼성전자 부회장과 모하메드 빈 자이드 알 나흐얀(Mohammed bin Zayed bin Sultan Al Nahyan) 아랍에미리트(UAE) 아부다비 왕세제의 3대에 걸친 인연이 화제가 되고 있다. 이건희 삼성 회장으로부터 시작된 아부다비 왕가와의 각별한 인연이 건설에서 반도체, 5세대 통신(5G) 등 첨단 산업에 대한 협력 관계 강화로 이어지고 있는 것이다.27일 재계에 따르면 모하메드 왕세제는 전날 삼성전자 화성사업장에 딸, 손주들과 함께 방문했다. 이 부회장이 모하메드 왕세제 가족 일행을 직접 안내, 5G 전시관과 반도체 생산라인 등을 둘러봤다. 이날 모하메드 왕세제 손주들은 드론, 인공지능, VR 등을 체험한 것으로 전해졌다.UAE는 석유 자원에 대한 의존도를 낮추고 4차 산업혁명을 선도하는 글로벌 허브를 목표로 2017년 \'UAE 4차 산업혁명 전략\'을 수립해 추진하고 있으며, 5G 네트워크 구축을 위한 대규모 투자를 앞두고 있다.이번 방문에서 모하메드 왕세제가 삼성전자 5G 전시관과 반도체 생산라인을 직접 지목한 점도 이를 방증한다. 삼성전자는 드론을 띄워 모하메드 왕세제가 착용한 VR 기기에 화성사업장의 360도 전경을 5세대(5G) 통신장비를 통해 초고화질로 스트리밍하는 첨단 기술을 선보였다.모하메드 왕세제는 빅데이터, AI, 센서 기술, 차세대 통신 등 첨단 기술을 접목해 스마트 팩토리로 구축한 삼성의 반도체 제조 공정 소개에 특히 관심을 나타냈다는 후문이다.그는 방명록에 ""더 나은 삶을 위해 이곳에서 이뤄지고 있는 혁신과 최신 기술에 깊은 인상을 받았다""면서 ""UAE는 새로운 기술을 도입하는 데 큰 관심이 있으며, 사회에 기여하는 기업들을 지원한다""는 글을 남겼다. 이어 사업장을 직접 안내한 이 부회장에게 ""나와 우리 방문단에 대한 환대에 대해 감사한다""고 말했으며, 이 부회장은 모하메드 왕세제에게 기념 문구가 새겨진 12인치 반도체 웨이퍼를 선물했다고 회사 관계자는 전했다.재계 관계자는 ""삼성은 과거 부르즈 칼리파(삼성물산)와 정유 플랜트(삼성엔지니어링) 등 건설ㆍ플랜트 분야를 중심으로 UAE와 파트너를 맺어왔다""면서 ""앞으로는 4차 산업혁명의 화두인 5G, 반도체 등 정보통신기술(ICT) 분야로 협력을 확대할 것으로 보인다""고 말했다.유인호 기자 sinryu007@asiae.co.kr박소연 기자 muse@asiae.co.kr▶ 아시아경제 채널 추가하고 에어팟, 해외여행비 받자!▶ 재미와 신기 \'과학을읽다\' ▶ 꿀잼 \'인기만화\'<ⓒ경제를 보는 눈, 세계를 보는 창 아시아경제 무단전재 배포금지>아시아경제 관련뉴스해당 언론사에서 선정하며 언론사 페이지(아웃링크)로 이동해 볼 수 있습니다.중국 없으면 밖에 못나가는 김정은""더이상 정치쇼는 필요없다""…日, 북미회담에 찬물경매 부쳐진 한 23세 모델의 처녀성, 낙찰가 무려파리바게뜨 회장님, 북미회담 기자들에 \'통큰 선물\'""버닝썬 대표 딱 걸렸다""…승리도 내사좋아요0훈훈해요0슬퍼요0화나요0후속기사 원해요0기사제공 :']"
16,삼성전자, 2019-02-2711:14,전자신문 ,"[ET투자뉴스]삼성전자, ""OLED 전방 수요…"" BUY(MAINTAIN)-키움증...",https://finance.naver.com/news/news_read.nhn?article_id=0002788425&office_id=030&mode=search&query=삼성전자&page=5,"['       [ET투자뉴스]삼성전자, ""OLED 전방 수요…"" BUY(MAINTAIN)-키움증권      기사입력2019-02-27 11:14기사원문좋아요훈훈해요좋아요 평가하기공감좋아요0훈훈해요0슬퍼요0화나요0후속기사 원해요0댓글키움증권에서 27일 삼성전자(005930)에 대해 ""OLED 전방 수요 확대""라며 투자의견을 \'BUY(MAINTAIN)\'로 제시하였고, 아울러 목표주가로는 52,000원을 내놓았다. 키움증권 박유악, 김소원 애널리스트가 동종목에 대하여 이번에 제시한 \'BUY(MAINTAIN)\'의견은 키움증권의 직전 매매의견에서 큰 변화없이 그대로 유지되는 것이고  전년도말의 매매의견을 기준으로  볼때도 역시 \'매수\'의견이 계속 유지되고 있는 상태이다. 그리고 최근 분기내 발표된 전체 증권사 리포트의 컨센서스와 비교를 해볼 경우에 오늘 발표된 투자의견은 대체적으로 평균치에 해당하는 수준으로, 이번 의견은 동종목에 대한 전체적인 흐름에서 크게 벗어나지 않은 것으로 분석되고 있다. 목표주가의 추이를 살펴보면 과거 상향/하향조정을 각각 한차례씩 격은 후에 이번에는 직전과 같은 수준을 유지하고 있는 모습이다. 또한 전일 종가 기준으로 볼때 동종목의 현주가는 이번에 제시된 목표가 대비 11.2%의 추가상승여력이 있다는 해석이 제시되고 있다. ◆ Report briefing키움증권에서 삼성전자(005930)에 대해 ""삼성전자의 실적은 2Q19를 저점으로 턴어라운드 할 것이다. 1Q19는 IM 부문의 수익성 개선이 메모리 반도체의 가격 하락 영향을 상쇄하며, 시장 컨센서스를 소폭 상회하는실적을 기록할 것이다. 다만 2Q19는 IM 부문의 마케팅비용 증가와 반도체 부문의 가격 하락 영향이 겹치며, 전 분기 대비 -11%QoQ 하락한 7.8조원의 영업이익을 기록할것이다""라고 분석했다.  또한 키움증권에서 ""OLED TV 패널의 투자 재원은 기존 LCD장비를 매각함으로써 조달할 것으로 보이며, 적자를 기록중인 LCD TV패널 출하량이 감소하며 단기적인 영업적자의 폭도 축소될 것이다. 삼성전자의 LCD 부문은 2016년부터 테블릿 PC, 노트북, TV패널 시장에서 물러나고 있어, 향후 OLED 패널을 중심으로 해당 시장의 점유율 상승을 재차 꾀할 것으로 판단된다""라고 밝혔다.  한편 ""2Q19를 기점으로 NAND의 업황 턴어라운드와 DRAM의재고 감소가 나타날 것으로 보이고, OLED 패널의 신규 시장 진입(TV, 테블릿, 노트북 시장 진입)도 가시화될 것이기때문이다. 단기 실적 부진에 따른 주가 조정 시기를 비중확대의 기회로 활용하는 전략을 추천한다""라고 전망했다. ◆ Report statistics키움증권의 동종목에 대한 최근 1년동안의 투자의견은 전체적으로 큰 변화없이 유지되고 있다. 목표주가는 2018년2월 68,000원까지 높아졌다가 2019년1월 50,000원을 최저점으로 목표가가 제시된 이후 최근에 52,000원으로 새롭게 조정되고 있다. 한편 증권정보제공 업체인 씽크풀에 따르면 동사에 대한 컨센서스는 \'매수\'이고 목표주가의 추이를 살펴보면 최근 3회이상 지속적으로 낮아지고 있는데, 이번에는 목표가의 하락폭이 다소 완화되는 추세이다. <컨센서스 하이라이트>\xa0컨센서스최고최저투자의견매수매수(유지)매수(유지)목표주가52,66758,00040,000*최근 분기기준오늘 키움증권에서 발표된 \'BUY(MAINTAIN)\'의견 및 목표주가 52,000원은 전체 컨센서스 대비해서 대체적으로 평균치에 해당하는 수준으로, 이번 의견은 동종목에 대한 전체적인 흐름에서 크게 벗어나지 않은 것으로 파악되며 목표가평균과 대비해서 미미한 차이가 나는 것으로 집계되었다.  참고로 최근에 목표주가를 가장 공격적으로 제시한 이베스트투자증권에서 투자의견 \'BUY(유지)\'에 목표주가 58,000원을 제일 보수적인 의견을 제시한 신영증권에서 투자의견 \'매수(유지)\'에 목표주가 40,000원을 제시한 바 있다. <키움증권 투자의견 추이>\xa0의견제시일자투자의견목표가격20190227BUY(MAINTAIN)52,00020190211BUY (MAINTAIN)52,00020190109BUY(MAINTAIN)50,00020181214BUY(MAINTAIN)56,00020181126BUY58,000<최근 리포트 동향>의견제시일자증권사투자의견목표가20190227키움증권BUY(MAINTAIN)52,00020190219삼성증권BUY53,00020190219하나금융투자BUY56,00020190201BNK투자증권매수51,000(씽크풀에서 제공하는 컨센서스는 국내 전증권사에서 발표되는 기업분석 리포트 및 코멘트를 실시간으로 통계/분석처리되고 있습니다.)증시분석 전문기자 로봇 ET etbot@etnews.com전자신문과 금융AI전문기업 씽크풀의 증시분석 전문기자 로봇 ET가 쓴 기사입니다▶ ""미래에 영감을 주다 - HCI & UI/UX Summit 2019"" 개최▶ 네이버 모바일에서 [전자신문] 채널 구독하기▶ 전자신문 바로가기 [Copyright ⓒ 전자신문 & 전자신문인터넷, 무단전재 및 재배포 금지]전자신문 관련뉴스해당 언론사에서 선정하며 언론사 페이지(아웃링크)로 이동해 볼 수 있습니다.[MWC19 바르셀로나]5G에 꽂힌 글로벌 반도체 경쟁 \'후끈\'한국서 대규모 경력 구인 나선 구글, 고민에 빠져 드는 국내 IT업계현대차, 경형 SUV \'베뉴\' 막바지 품질 점검…상반기 조기 투입삼성, 구글과 파트너십···기업용 통합 안드로이드 솔루션 공개 예정\'AI 국제표준\' 쏟아지는데…美·中·日에 종속 우려좋아요0훈훈해요0슬퍼요0화나요0후속기사 원해요0기사제공 :']"
17,삼성전자, 2019-02-2711:12,데일리안 ,"삼성전자, 세계 최초 '512GB eUFS 3.0' 양산...프리미엄 시장 선점",https://finance.naver.com/news/news_read.nhn?article_id=0002313798&office_id=119&mode=search&query=삼성전자&page=5,"['       삼성전자, 세계 최초 \'512GB eUFS 3.0\' 양산...프리미엄 시장 선점      기사입력2019-02-27 11:12기사원문좋아요훈훈해요좋아요 평가하기공감좋아요0훈훈해요0슬퍼요0화나요0후속기사 원해요0댓글512GB eUFS 3.0 제품 이미지.ⓒ삼성전자\'5세대 V낸드\' 기반 최고 성능...2배 높은 속도용량별 라인업 확대, 프리미엄 메모리 시장 성장 견인삼성전자는 역대 최고 속도의 차세대 모바일 메모리 \'512기가바이트(GB) eUFS(embedded Universal Flash Storage) 3.0\'을 양산하며 차세대 플래그십 스마트폰 메모리 시장 선점에 나섰다고 27일 밝혔다.\'eUFS 3.0\' 제품은 기존 \'eUFS 2.1\' 보다 2배 이상 빠른 2100MB/s의 연속읽기 속도를 구현한다.이는 SATA SSD보다 약 4배, 마이크로SD 카드보다는 20배 이상 빠른 속도로 모바일 기기에 저장한 데이터를 PC(eUFS 3.0→NVMe SSD 기준)로 전송 시 풀(Full)HD급 영화 1편(3.7GB)을 3초 안에 보낼 수 있다.초고속 \'NVMe SSD\' 수준의 성능을 가진 이 제품으로 소비자들은 초고해상도의 차세대 모바일 기기에서도 울트라 슬림 노트북 수준의 성능을 체감할 수 있게 됐다.삼성전자는 이번 제품에 5세대 512기가비트(Gb) V낸드를 8단으로 적층하고 고성능 컨트롤러를 탑재해 이같은 성능을 구현했다.또 연속쓰기 속도도 410MB/s로 기존 eUFS 2.1 제품보다 1.5배 이상 높였고 임의 읽기·쓰기 속도도 최대 1.3배 빠른 6만3000·6만8000 IOPS(Input/Output Operations Per Second)를 구현했다.특히 임의읽기·쓰기 속도는 마이크로SD 카드(100 IOPS)보다 630배 이상 향상돼 대화면의 초고해상도 디스플레이에서 다양하고 복잡한 작업을 동시에 실행하더라도 빠르고 원활하게 처리할 수 있다.최철 삼성전자 메모리사업부 전략마케팅팀 부사장은 ""eUFS 3.0 제품을 본격 양산함으로써 소비자들이 모바일 기기에서도 최고급 노트북 수준의 사용 편의성과 만족감을 체감할 수 있게 됐다""며 ""올해 1테라바이트(TB)까지 라인업을 늘려 글로벌 모바일 제조사들이 프리미엄 시장에서 새로운 성장 분야로 도약하는 데 기여해 나갈 것""이라고 밝혔다.삼성전자는 이달 512GB와 128GB eUFS 3.0 제품 공급을 시작으로 하반기에는 1TB와 256GB 용량도 제공해 글로벌 IT고객들의 선택의 폭을 넓히고 차세대 모바일 기기를 적기에 출시할 수 있도록 적극 지원할 계획이다.삼성전자는 지난 2015년 기존 \'eMMC(embedded MultiMediaCard)\' 대비 1.4배 이상 빠른 모바일 내장 메모리 \'eUFS 2.0\'을 양산하며 UFS 시장을 창출했으며 2017년에는 \'eUFS 2.1\'에 이어 올해 \'eUFS 3.0\' 시대를 열었다.내장형 메모리 성능 비교.ⓒ삼성전자데일리안 이홍석 기자 (redstone@dailian.co.kr)ⓒ (주)데일리안 - 무단전재, 변형, 무단배포 금지데일리안 관련뉴스해당 언론사에서 선정하며 언론사 페이지(아웃링크)로 이동해 볼 수 있습니다.삼성전자, \'러시아 카잔 국제기능올림픽\' 후원삼성전자, 내달 20일 주총...김한조 · 안규리 신임 사외이사 추천[MWC2019] 삼성전자, \'갤럭시A50\' \'갤럭시A30\' 공개삼성전자, 13년 연속 TV 시장 1위 달성삼성전자, \'갤럭시 스튜디오\'서 5G 스마트폰 체험존 마련좋아요0훈훈해요0슬퍼요0화나요0후속기사 원해요0기사제공 :']"
18,삼성전자, 2019-02-2711:09,한국경제TV ,KB금융-삼성 맞손…금융특화 ‘갤럭시 S10’ 출시,https://finance.naver.com/news/news_read.nhn?article_id=0000742172&office_id=215&mode=search&query=삼성전자&page=5,"['       KB금융-삼성 맞손…금융특화 ‘갤럭시 S10’ 출시      기사입력2019-02-27 11:09기사원문좋아요훈훈해요좋아요 평가하기공감좋아요0훈훈해요0슬퍼요0화나요0후속기사 원해요0댓글[한국경제TV 고영욱 기자]KB금융그룹이 삼성전자와 제휴해 금융특화 스마트폰인 ‘갤럭시 KB Star S10’을 출시한다고 27일 밝혔습니다.‘갤럭시 KB Star’는 KB금융그룹의 금융서비스가 탑재된 고객 맞춤형 스마트폰으로 은행, 증권, 손해보험, 카드, 생명, 캐피탈, 저축은행 등 7개 금융서비스를 이용할 수 있는 제품입니다.또 KB전용 금융 서비스 공간인 ‘KB 스퀘어’를 탑재하여 자주 사용하는 계좌를 바로 볼 수 있는 계좌뷰, 퀵 메뉴 등을 제공합니다.예약판매로 구매하는 고객에게는 KB국민카드를 통한 통신요금 자동이체 선택시 청구할인 혜택을 받고, KB국민은행 리브똑똑 앱을 통한 송금 거래시 KB 멤버십 포인트를 제공합니다.고영욱기자 yyko@wowtv.co.kr▶ 네이버 홈에서 [한국경제TV] 채널 구독하기 [생방송보기]▶ 대한민국 재테크 총집결! - [증권 / 주식상담 / 부동산]ⓒ 한국경제TV, 무단 전재 및 재배포 금지한국경제TV 관련뉴스해당 언론사에서 선정하며 언론사 페이지(아웃링크)로 이동해 볼 수 있습니다.코란도의 귀환...""이름 빼고 다 바꿨다""경기 나쁜데 원화 강세...환율 더 떨어지나사전예약 들어간 갤S10...직접 만져본 고객 말이국민연금 매달 200만원 받는 22명...얼마 냈나""대장암 위험 79% 낮추는 채소 있다""…中 의대 규명좋아요0훈훈해요0슬퍼요0화나요0후속기사 원해요0기사제공 :']"
19,삼성전자, 2019-02-2711:08,머니투데이 ,"풀HD 영화 1편 전송에 3초..삼성전자, 차세대 모바일 메모리 세계 첫 양산",https://finance.naver.com/news/news_read.nhn?article_id=0004180503&office_id=008&mode=search&query=삼성전자&page=5,"['       풀HD 영화 1편 전송에 3초..삼성전자, 차세대 모바일 메모리 세계 첫 양산       기사입력2019-02-27 11:08기사원문좋아요훈훈해요좋아요 평가하기공감좋아요0훈훈해요0슬퍼요0화나요0후속기사 원해요0댓글 [머니투데이 최석환 기자] [역대 최고 속도 구현 \'512GB eUFS 3.0\' 출시..스마트폰 메모리 시장 선점 나서] 삼성전자가 세계 최초로 양산한 512GB eUFS 3.0 제품/사진제공=삼성전자삼성전자가 역대 최고 속도의 모바일 메모리 \'512GB(기가바이트) eUFS 3.0\'을 세계 최초로 양산하며 차세대 스마트폰 메모리 시장 선점에 나섰다고 27일 밝혔다. \'eUFS 3.0\' 제품은 기존 \'eUFS 2.1\' 보다 2배 이상 빠른 초당 2100메가바이트(MB/s)의 연속읽기 속도를 구현한다. 이는 SATA SSD(솔리드스테이트드라이브)보다 약 4배, 마이크로SD 카드보다는 20배 이상 빠른 속도로 모바일 기기에 저장한 데이터를 PC로 전송 시 풀HD(FHD)급 영화 1편(3.7GB)을 3초 안에 보낼 수 있다. 삼성전자는 이번 제품에 5세대 512Gb(기가비트) V낸드를 8단으로 적층하고 고성능 컨트롤러를 탑재해 이같은 성능을 선보였다. 연속쓰기 속도는 410MB/s로 기존 eUFS 2.1 제품보다 1.5배 이상 높였고, 임의 읽기·쓰기 속도도 최대 1.3배 빠른 6만3000·6만8000 IOPS(초당 입출력 작업 처리 속도)를 구현했다.   특히 임의읽기·쓰기 속도는 마이크로SD 카드(100 IOPS)보다 630배 이상 빨라져 대화면의 초고해상도 디스플레이에서 다양하고 복잡한 작업을 동시에 실행하더라도 원활하게 처리할 수 있다. 최철 메모리사업부 전략마케팅팀 부사장은 ""eUFS 3.0 제품을 본격 양산함으로써 소비자들이 모바일 기기에서도 최고급 노트북 수준의 사용 편의성과 만족감을 체감할 수 있게 됐다""고 설명했다. 이어 ""올해 1TB(테라바잍)까지 라인업을 늘려 글로벌 모바일 제조사들이 프리미엄 시장에서 새로운 성장 분야로 도약하는데 기여해 나갈 것""이라며 ""이달 512GB, 128GB eUFS 3.0 제품 공급을 시작으로 하반기엔 1TB, 256GB 용량도 제공할 것""이라고 말했다. 한편 삼성전자는 2015년 기존 \'eMMC(embedded MultiMediaCard)\' 대비 1.4배 이상 빠른 모바일 내장 메모리 \'eUFS 2.0\'을 양산하며 UFS 시장을 창출했으며, 2017년 \'eUFS 2.1\'에 이어 올해 \'eUFS 3.0\' 시대를 열었다.최석환 기자 neokism@mt.co.kr▶주식, 나도 더 잘할 수 있을까?▶조 변호사의 가정상담소 ▶머투가 봄맞이 선물 주나봄 <저작권자 ⓒ \'돈이 보이는 리얼타임 뉴스\' 머니투데이, 무단전재 및 재배포 금지>머니투데이 관련뉴스해당 언론사에서 선정하며 언론사 페이지(아웃링크)로 이동해 볼 수 있습니다.\'박한별 남편\' 또 논란, 유리홀딩스는 어떤 회사?42억에 산 땅 237억에 되파는 고승덕 변호사 부부버닝썬 이문호, SNS 돌연 \'삭제\'\'김상혁♥\' 송다예, 웨딩드레스 뭐 입었나 보니…경찰 ""승리 \'성접대 의혹 카톡\' 내사 착수""좋아요0훈훈해요0슬퍼요0화나요0후속기사 원해요0기사제공 :']"
0,삼성전자, 2019-02-2711:08,경향신문 ,"풀HD급 영화 1편, 3초 안에 전송 ‘최고 속도’ 삼성전자, 차세대 모바일 내장...",https://finance.naver.com/news/news_read.nhn?article_id=0002925043&office_id=032&mode=search&query=삼성전자&page=6,"[""       풀HD급 영화 1편, 3초 안에 전송 ‘최고 속도’ 삼성전자, 차세대 모바일 내장 메모리 양산      기사입력2019-02-27 11:08기사원문좋아요훈훈해요좋아요 평가하기공감좋아요0훈훈해요0슬퍼요0화나요0후속기사 원해요0댓글삼성전자가 역대 최고 속도의 차세대 모바일 메모리 ‘512GB eUFS 3.0(embedded Universal Flash Storage 3.0·사진)’을 양산한다고 27일 밝혔다.  이 제품은 기존 ‘eUFS 2.1’보다 2배 이상 빠른 초당 2100MB(메가바이트)의 속도를 구현한다. 이는 SATA SSD(솔리드스테이트드라이브)보다 약 4배, 마이크로SD 카드보다는 20배 이상 빠른 속도다. 풀HD급 영화 1편(3.7GB)을 3초 안에 보낼 수 있는 수준이다. 초고속 ‘NVMe SSD’ 수준의 성능을 가진 이 제품으로 소비자들은 초고해상도의 차세대 모바일 기기에서도 울트라 슬림 노트북 수준의 성능을 체감할 수 있게 됐다.삼성전자 메모리사업부 전략마케팅팀 최철 부사장은 “eUFS 3.0 제품을 양산함으로써 소비자들이 모바일 기기에서도 최고급 노트북 수준의 사용 편의성과 만족감을 체감할 수 있게 되었다”라며 “올해 1TB까지 라인업을 늘려 글로벌 모바일 제조사들이 프리미엄 시장에서 새로운 성장 분야로 도약하는 데 기여해 나갈 것”이라고 밝혔다. 삼성전자는 이달 512GB, 128GB eUFS 3.0 제품 공급을 시작으로 하반기에는 1TB, 256GB 용량도 제공해 글로벌 IT 고객들의 선택의 폭을 넓힐 계획이다.임지선 기자 vision@kyunghyang.com▶ 최신 뉴스  ▶ 두고 두고 읽는 뉴스  ▶ 인기 무료만화©경향신문(www.khan.co.kr), 무단전재 및 재배포 금지경향신문 관련뉴스해당 언론사에서 선정하며 언론사 페이지(아웃링크)로 이동해 볼 수 있습니다.전주 이어 서울에도 김현미 장관 비방 '공개처형' 벽보 등장한국당 결국 '어대황'···'탄핵 부정' 황교안호 어디로 가나'다 거짓말' 마약 혐의 드러난 버닝썬 이문호 대표의 '말말말'[공감]이효리는 57㎏이다[단독]신입만 별도 취업규칙 '두 얼굴의 기업'좋아요0훈훈해요0슬퍼요0화나요0후속기사 원해요0기사제공 :""]"
