,회사명,날짜,언론사,기사제목,링크,본문
10,삼성전자, 2019-09-0311:01,파이낸셜뉴스 ,"삼성, 추석 협력사 자금 지원 1.4조 푼다",https://finance.naver.com/news/news_read.nhn?article_id=0004287578&office_id=014&mode=search&query=삼성전자&page=8,"['       삼성, 추석 협력사 자금 지원 1.4조 푼다      기사입력2019-09-03 11:01기사원문좋아요훈훈해요좋아요 평가하기공감좋아요0훈훈해요0슬퍼요0화나요0후속기사 원해요0댓글      3일 삼성전자 평택사업장에서 열린 추석맞이 직거래 장터에서 임직원들이 자매마을에서 생산된 상품들을 둘러보고 있다.   [파이낸셜뉴스] 삼성이 1조4000억원 규모의 협력사 자금 지원 등 \'추석 상생경영\'에 나선다.  삼성은 이번 추석 협력사들의 자금 운영에 돕기 위해 1조4000억원 규모의 물품 대금을 조기 지급하기로 했다고 3일 밝혔다. 이는 지난해보다 4000억원 증액된 규모다.  이번 물품 대금 조기 지급에는 삼성전자, 삼성디스플레이, 삼성SDI, 삼성전기, 삼성SDS, 삼성바이오로직스, 삼성물산, 삼성엔지니어링, 제일기획, 웰스토리 등 10개 계열사가 참여한다.  삼성전자는 자금 부담 완화를 위해 지난 2011년부터 협력사 물품 대금을 월 4회 지급하고 있다.  삼성 관계자는 ""이번 추석을 맞아 회사별로 최대 1~2주일 이상 물품 대금을 앞당겨 지급해 협력사의 일시적인 자금 부담이 완화될 것으로 기대된다""고 밝혔다.  또, 삼성은 전국의 계열사 임직원들에게 자매마을 등에서 생산한 각종 농축산품을 구입할 기회를 제공하고 농어촌 소득 증대를 돕는 온∙오프라인 직거래 장터를 운영한다.  직거래 장터는 삼성전자와 삼성디스플레이, 삼성SDI, 삼성중공업, 삼성물산 등 19개 계열사가 참여해 역대 최대 규모로 진행된다.  삼성전자 수원∙평택사업장에서는 3~4일까지 자매마을, 농업진흥청 협력마을 등 농민들과 함께 직거래 장터를 열어 도라지, 한우, 한과, 배 등 품질좋은 농축산품을 판매한다.  기흥∙화성 사업장에서도 2~5일까지 자매마을, 농촌진흥청, 사회적기업 등이 참여한 직거래 장터를 열고 한우, 굴비, 젓갈, 벌꿀, 곡물 등 300여개의 농축산품을 판매한다. 아울러, 최대 80%까지 할인 판매하는 유∙아동 도서 특가전도 마련한다.  특히, 이번 장터에는 삼성전자 스마트공장 구축 지원을 받은 인제군장애인보호작업장(황태), 쿠키아(두부과자), 헵시바F&B(과일건조칩 제조업체) 등 34개 업체도 참여했다.  삼성SDI는 5~6일까지 기흥, 수원, 울산, 천안, 구미, 청주 등 전국 6개 사업장에서 추석 직거래 장터를 운영해 자매마을을 비롯한 지역사회의 과일, 정육, 수산물 등 다양한 특산품을 판매할 예정이다. 삼성중공업은 4일 거제사업장에서 지역 농∙특산품 소비 촉진과 판로확보를 위해 75개 업체가 참가한 가운데 지역에서 생산되는 다양한 농·수·특산품과 먹거리를 5~10% 저렴하게 판매한다. 삼성물산은 지난 달 26~30일까지 건설, 상사, 리조트 등 각 부문별로 자매결연을 맺은 마을과 함께 거봉, 블루베리즙, 참기름, 아카시아꿀, 감자, 옥수수 등 특산품 직거래 장터와 온라인 장터를 운영했다.   cgapc@fnnews.com 최갑천 기자   ▶ 헉! 소리나는 스!토리 뉴스 [헉스]▶ 클릭해, 뉴스 들어간다 [뉴스쿨] ▶ 세상에 이런일이 [fn파스]  ※ 저작권자 ⓒ 파이낸셜뉴스. 무단 전재-재배포 금지파이낸셜뉴스 관련뉴스해당 언론사에서 선정하며 언론사 페이지(아웃링크)로 이동해 볼 수 있습니다.조국 기자간담회 지켜 본 이언주 폭격 ""이제..""\'동생 위장이혼 의혹\'에 조국이 날린 묵직한 한 방특집기사로 한국 저격한 日주간지, 한국인 10명 중 1명은..결혼식 날짜·장소가 없는 청첩장, 사연 알고보니..탈모 예방에 좋은 검은콩, 여성이 먹으면 나타나는 놀라운 효능좋아요0훈훈해요0슬퍼요0화나요0후속기사 원해요0기사제공 :']"
11,삼성전자, 2019-09-0311:01,서울경제 ,"삼성, 최초 보급형 5G폰 ‘갤럭시A90’ 출시...89만 9,800원",https://finance.naver.com/news/news_read.nhn?article_id=0003613075&office_id=011&mode=search&query=삼성전자&page=8,"[""       삼성, 최초 보급형 5G폰 ‘갤럭시A90’ 출시...89만 9,800원      기사입력2019-09-03 11:01기사원문좋아요훈훈해요좋아요 평가하기공감좋아요0훈훈해요0슬퍼요0화나요0후속기사 원해요0댓글6.7인치 인피니티-U 디스플레이후면 트리플 카메라 적용삼성전자의 보급형 5G폰 ‘갤럭시 A90 5G’/사진제공=삼성전자[서울경제] 삼성전자(005930)가 갤럭시 A 시리즈 최초 5세대(5G) 이동통신을 지원하는 갤럭시 A90 5G를 4일 국내 출시한다고 3일 밝혔다. 갤럭시 A90 5G는 6.7인치 슈퍼 아몰레드 인피니티-U 디스플레이에 후면엔 체크 패턴 디자인을 적용했다. 카메라는 4,800만 화소 기본 카메라와 123도 초광각 카메라, 심도 카메라까지 트리플 렌즈를 탑재하고 있다. 전문엔 3,200만 화소 카메라를 적용해 누구나 전문가급 사진을 촬영할 수 있도록 했다. 또 6GB 램·128GB 저장용량을 갖추고 있으며 4,500mAh 대용량 배터리에 25W 급속 충전을 지원한다. 색상은 화이트와 블랙 2가지이며 가격은 89만 9,800원이다. 삼성전자는 갤럭시 A90 5G 출시를 기념해 연말까지 갤럭시 A90을 개통하고 5G 클라우드 게임 플랫폼 ‘해치’를 다운로드 받는 고객들에게 100종 이상의 게임을 무료로 할 수 있는 ‘해치 프리미엄’ 3개월 이용권을 제공한다. 또 내년 2월 29일까지 프리미엄 동영상 스트리밍 멤버십 ‘유튜브 프리미엄’ 서비스에 신규 가입한 고객은 최대 2개월 동안 무료로 이용할 수 있다. 삼성전자는 “갤럭시 A90 5G는 합리적인 가격의 5G폰을 기다리던 스마트 컨슈머를 위한 최적의 제품”이라고 밝혔다./권경원기자 nahere@sedaily.com삼성전자의 보급형 5G폰 ‘갤럭시 A90 5G’/사진제공=삼성전자[서울경제 바로가기]▶ 한눈에 보는 시그널 '기업 재무정보'  | ▶ 네이버TV로 서울경제썸 구독하기▶ 네이버 메인에서 'No. 1 뉴스' 서울경제를 만나보세요저작권자 ⓒ 서울경제, 무단 전재 및 재배포 금지서울경제 관련뉴스해당 언론사에서 선정하며 언론사 페이지(아웃링크)로 이동해 볼 수 있습니다.80만원대 5G폰 '갤럭시A90' 내일 출시삼성, 갤노트10 이어 첫 중저가 5G폰 '갤럭시 A90'도 출격출시되도 사긴 어렵다?...'한정판' 등극한 갤럭시 폴드무신사 갤럭시 워치 액티브2 '알루미늄 모델' 사전판매, 스테인레스 모델은?취향따라 고르는 12종류 스마트워치...삼성 '갤럭시 워치 액티브2' 출시좋아요0훈훈해요0슬퍼요0화나요0후속기사 원해요0기사제공 :""]"
12,삼성전자, 2019-09-0311:01,아이뉴스24 ,"삼성전자, 보급형 5G 스마트폰 '갤럭시A90' 내일 출격",https://finance.naver.com/news/news_read.nhn?article_id=0000507471&office_id=031&mode=search&query=삼성전자&page=8,"['       삼성전자, 보급형 5G 스마트폰 \'갤럭시A90\' 내일 출격      기사입력2019-09-03 11:01기사원문좋아요훈훈해요좋아요 평가하기공감좋아요0훈훈해요0슬퍼요0화나요0후속기사 원해요0댓글출고가 89만9천800원…해치 프리미엄 이용권 등 특별한 혜택 제공[아이뉴스24 윤선훈 기자] 삼성전자는 갤럭시 A 시리즈 첫 5G 이동통신을 지원하는 \'갤럭시 A90 5G\'를 오는 4일 국내에 출시한다고 3일 밝혔다.\'갤럭시 A90 5G\'는 6.7인치 슈퍼 아몰레드 인피니티-U 디스플레이와 갤럭시 A 시리즈에 새롭게 선보이는 체크 패턴을 매치한 트렌디한 디자인, 최신 5G 이동통신, 트리플 카메라, 고성능 모바일 AP 등 스마트폰 필수 기능을 한층 업그레이드한 것이 특징이다. [출처=삼성전자]\'갤럭시 A90 5G\'는 4천800만화소의 기본 카메라와 123도 초광각 카메라, 심도 카메라 등 후면 트리플 카메라와 3천200만화소 전면 카메라를 탑재했다. 퀄컴의 프리미엄 모바일 플랫폼인 스냅드래곤 855와 6GB 램, 128GB 내장 메모리, 4천500mAh 대용량 배터리, 25W 급속 충전을 지원한다.이 밖에도 삼성 페이, 온스크린 지문 인식, 빅스비를 지원해 편의성을 극대화했다. 화이트·블랙 2가지 색상으로 출시하며 가격은 89만9천800원이다.\'갤럭시 A90 5G\'는 4일부터 삼성전자 홈페이지, 전국 디지털프라자, 각 이동통신 3사 온∙오프라인 매장, 하이마트, 전자랜드 등에서 구입할 수 있다.삼성전자는 \'갤럭시 A90 5G\' 국내 출시를 기념해 구매 고객을 위한 특별한 혜택을 제공한다. 오는 12월 31일까지 \'갤럭시 A90 5G\'를 개통하고 5G 클라우드 게임 플랫폼 \'해치(Hatch)\'를 다운받는 고객에게 100종 이상의 게임을 무료로 즐길 수 있는 \'해치 프리미엄\' 3개월 이용권을 증정한다.또 2020년 2월 29일까지 개통 후 프리미엄 동영상 스트리밍 멤버십 \'유튜브 프리미엄\' 서비스에 신규 가입한 고객은 최대 2개월 동안 무료로 이용할 수 있다.삼성전자 관계자는 ""트렌디한 디자인과 프리미엄급 성능, 5G속도까지 모두 갖춘 \'갤럭시 A90 5G\'는 합리적인 가격의 5G 스마트폰을 기다리던 스마트 컨슈머를 위한 최적의 제품""이라며, ""앞으로도 다양한 소비자들의 니즈를 만족시킬 수 있는 라인업으로 새로운 모바일 환경에 최적화된 제품들을 선보일 것""이라고 전했다.윤선훈기자 krel@inews24.com▶네이버 채널에서 \'아이뉴스24\'를 구독해주세요.▶아이뉴스TV에서 부동산 고수를 만나보세요.[ⓒ 아이뉴스24 무단전재 및 재배포 금지]아이뉴스24 관련뉴스해당 언론사에서 선정하며 언론사 페이지(아웃링크)로 이동해 볼 수 있습니다.조국 기자회견 이후, 실검 오른 \'근조한국언론\'·\'한국기자질문수준\'""저는 금수저·강남좌파…"" 조국 기자회견 \'논란의 발언\'[개장시황] 코스피, 미‧중 무역분쟁 격화 양상에 약보합 출발ETRI,\xa0소리나면 센서반응…침입 화재 감지""유튜브에서 답해요""…SKT, 맞춤형 채용설명회좋아요0훈훈해요0슬퍼요0화나요0후속기사 원해요0기사제공 :']"
13,삼성전자, 2019-09-0311:01,한국경제 ,"삼성, 추석 맞아 협력사 대금 1조4000억 '조기 지급'",https://finance.naver.com/news/news_read.nhn?article_id=0004202963&office_id=015&mode=search&query=삼성전자&page=8,"['       삼성, 추석 맞아 협력사 대금 1조4000억 \'조기 지급\'      기사입력2019-09-03 11:01기사원문좋아요훈훈해요좋아요 평가하기공감좋아요0훈훈해요0슬퍼요0화나요0후속기사 원해요0댓글삼성전자 등 10개 계열사 참여협력사 자금지원 프로그램 4조협력사 지원 펀드도 3.4조 확대삼성 기흥사업장삼성전자와 계열사들이 추석을 맞아 협력사들 자금 운영에 도움을 주기 위해 1조4000억원 규모의 협력사 물품 대금을 조기 지급한다고 3일 밝혔다.이번 물품 대금 조기 지급에는 삼성전자 삼성디스플레이 삼성SDI 삼성전기 삼성SDS 삼성바이오로직스 삼성물산 삼성엔지니어링 제일기획 웰스토리 등 10개 계열사가 참여한다. 삼성전자는 협력사 자금 부담 완화를 위해 2011년부터 물품 대금을 월 4회로 나눠 지급하고 있다. 이번 추석을 ㄷ앞두고 회사별로 최대 1~2주 이상 물품 대금을 앞당겨 지급한다.삼성은 협력사 자금 유동성 확보를 위해 다양한 지원 프로그램을 운영하고 있다. 지난해 8월 협력사 자금을 지원하는 \'경제 활성화와 일자리 창출 지원 방안\' 프로그램을 총 4조원 규모로 확대했다.2010년부터 2조3000억원 규모의 협력사 지원 펀드를 조성, 운영해왔으며 작년에는 1조1000억원을 추가 조성해 총 3조4000억원 규모로 운영하고 있다. 또 1차 협력사 대상으로 운영해온 \'우수 협력사 인센티브\'를 지난해 2차 협력사까지 확대하고 인센티브 규모도 1000억원으로 2배 증액했다. 삼성은 협력사 최저임금제 정착을 위해 지난해 1월부터 최저임금 인상에 따른 인건비 인상분을 납품단가에 반영해 지급하고 있다. 노정동 한경닷컴 기자 dong2@hankyung.com▶ 네이버에서 한국경제 뉴스를 받아보세요▶ 한경닷컴 바로가기  ▶ 모바일한경 구독신청 ⓒ 한국경제 & hankyung.com, 무단전재 및 재배포 금지한국경제 관련뉴스해당 언론사에서 선정하며 언론사 페이지(아웃링크)로 이동해 볼 수 있습니다.속절없이 떨어지는 세종시 집값…""심각한 상황""日소재 수출허가 물량 삼성으로…몰랐던 사실""한국, 이 속도로 간다면 25년 뒤엔…"" 충격 전망자녀 9명 외벌이, 근로·자녀장려금 수령액수가""푸대접 받더니…"" 시세차익까지 \'반전 드라마\'좋아요0훈훈해요0슬퍼요0화나요0후속기사 원해요0기사제공 :']"
14,삼성전자, 2019-09-0311:01,아이뉴스24 ,"삼성, 최대 2주 앞당겨 1.4조 협력사 물품대금 조기지급",https://finance.naver.com/news/news_read.nhn?article_id=0000507472&office_id=031&mode=search&query=삼성전자&page=8,"['       삼성, 최대 2주 앞당겨 1.4조 협력사 물품대금 조기지급      기사입력2019-09-03 11:01기사원문좋아요훈훈해요좋아요 평가하기공감좋아요0훈훈해요0슬퍼요0화나요0후속기사 원해요0댓글추석맞이 상생 차원, 지역 사업장 농축산물 \'상생 장터\'도 오픈[아이뉴스24 조석근 기자] 삼성전자와 삼성디스플레이, 삼성SDI 등 주요 삼성 계열사들이 추석을 앞두고 명절맞이 협력사 상생방안을 추진한다.삼성전자는 3일 자사를 비롯 10여개 삼성 계열가 추석을 맞아 1조4천억원 규모 협력사 물품대금을 조기 지급하고, 전국 주요 사업장에서 협력사 및 자매마을과 농축산물 직거래 장터를 열기로 했다고 밝혔다.협력사 대상 물품대금 조기 지급은 현금 집행이 몰리는 명절 시기에 맞춰 자금 운영에 도움을 준다는 차원이다. 삼성전자, 삼성디스플레이, 삼성SDI, 삼성전기, 삼성SDS, 삼성바이오로직스, 삼성물산, 삼성엔지니어링, 제일기획, 웰스토리 등이 참여한다.2일 삼성전자 화성사업장에서 열린 추석맞이 직거래 장터에서 임직원들이 삼성전자 자매마을에서 생산된 상품들을 둘러보고 있다. [사진=삼성전자]삼성전자의 경우 지난 2011년부터 협력사 물품대금을 월 4회 지급하고 있다. 이번 추석을 맞아 회사별로 최대 1~2주일 이상 지급 시기를 앞당긴다.삼성은 협력사의 자금 유동성 확보를 위해 지난해 8월 \'경제 활성화와 일자리 창출 지원 방안\'으로 협력사 지원 프로그램을 총 4조원 규모로 확대했다. 삼성은 2010년부터 2조3천억원 규모 협력사 지원 펀드를 조성했다. 또한 협력사의 최저임금제 정착을 위해 지난해 1월부터 최저임금 인상에 따른 인건비 인상분을 납품단가에 반영해 지급하고 있다는 입장이다.삼성은 전국에 있는 각 계열사 임직원들에게 자매마을 등에서 생산한 각종 농축산품을 구입할 기회를 제공하고 농어촌 소득 증대를 돕기 위한 추석맞이 온·오프라인 직거래 장터를 운영한다. 이번 직거래 장터는 삼성전자와 삼성중공업, 삼성물산 등 19개 계열사가 참여하는 역대 최대 규모다.삼성전자 수원·평택사업장에서는 3일부터 4일까지 자매마을, 농업진흥청 협력마을 등 농민들과 함께 직거래 장터를 열어, 도라지, 한우, 한과, 배 등 품질좋은 농축산품을 판매한다.기흥·화성 사업장에서도 2일부터 5일까지 자매마을, 농촌진흥청, 사회적기업 등이 참여한 직거래 장터를 열고 한우, 굴비, 젓갈, 벌꿀, 곡물 등 300여개의 농축산품을 판매하며, 최대 80%까지 할인 판매하는 유·아동 도서 특가전도 진행한다.삼성SDI의 경우 5일부터 6일까지 기흥, 수원, 울산, 천안, 구미, 청주 등 전국 6개 사업장에서 지역 사회의 과일, 정육, 수산물 등 다양한 특산품을 판매하며 삼성중공업은 4일 거제사업장에서 지역 농·특산품 판매할 예정이다.한편 삼성은 1995년 농어촌 60개 마을과 자매결연을 맺은 것을 시작으로, 지난해 500여 마을과 자매결연을 맺었다. 이들 지역 대상 일손돕기, 농촌체험, 직거래 장터 운영 등 상생방안을 추진하는 차원이다.조석근기자 mysun@inews24.com▶네이버 채널에서 \'아이뉴스24\'를 구독해주세요.▶아이뉴스TV에서 부동산 고수를 만나보세요.[ⓒ 아이뉴스24 무단전재 및 재배포 금지]아이뉴스24 관련뉴스해당 언론사에서 선정하며 언론사 페이지(아웃링크)로 이동해 볼 수 있습니다.조국 기자회견 이후, 실검 오른 \'근조한국언론\'·\'한국기자질문수준\'""저는 금수저·강남좌파…"" 조국 기자회견 \'논란의 발언\'[개장시황] 코스피, 미‧중 무역분쟁 격화 양상에 약보합 출발ETRI,\xa0소리나면 센서반응…침입 화재 감지""유튜브에서 답해요""…SKT, 맞춤형 채용설명회좋아요0훈훈해요0슬퍼요0화나요0후속기사 원해요0기사제공 :']"
15,삼성전자, 2019-09-0311:01,노컷뉴스 ,"삼성, 추석맞아 1.4조원 물품 대금 협력사에 조기 지급",https://finance.naver.com/news/news_read.nhn?article_id=0003265983&office_id=079&mode=search&query=삼성전자&page=8,"['       삼성, 추석맞아 1.4조원 물품 대금 협력사에 조기 지급      기사입력2019-09-03 11:01기사원문좋아요훈훈해요좋아요 평가하기공감좋아요0훈훈해요0슬퍼요0화나요0후속기사 원해요0댓글자매마을 온∙오프라인 직거래 장터도 운영[CBS노컷뉴스 최인수 기자]2일 삼성전자 화성사업장에서 열린 추석맞이 직거래 장터에서 임직원들이 삼성전자 자매마을에서 생산된 상품들을 둘러보고 있다.(사진=삼성전자 제공)삼성전자와 계열사들이 추석을 맞아 협력사들의 자금 운영 도움을 위해 1조4천원 규모의 물품 대금을 조기 지급하기로 했다고 3일 밝혔다. 이번 물품 대금 조기 지급에는 삼성전자, 삼성디스플레이, 삼성SDI, 삼성전기, 삼성SDS, 삼성바이오로직스, 삼성물산, 삼성엔지니어링, 제일기획, 웰스토리 등 10개 계열사가 참여한다.삼성전자의 경우 자금 부담 완화를 위해 지난 2011년부터 협력사 물품 대금을 월 4회 지급하고 있다. 이번 추석을 맞아 회사별로 최대 1~2주일 이상 물품 대금을 앞당겨 지급해 협력사의 일시적인 자금 부담이 완화될 것으로 삼성전자 측은 기대했다. 삼성은 이와 함께 자매마을 등에서 생산한 각종 농축산품을 구입할 기회를 제공하고 농어촌 소득 증대를 돕기 위해 추석맞이 온∙오프라인 직거래 장터를 운영한다고 밝혔다.▶ 확 달라진 노컷뉴스▶ 인싸들의 선택, 노컷뉴스 구독 서비스▶ 노컷이 못한 일, 돈컷은 한다apple@cbs.co.kr저작권자 © CBS 노컷뉴스 무단전재 및 재배포 금지노컷뉴스 관련뉴스해당 언론사에서 선정하며 언론사 페이지(아웃링크)로 이동해 볼 수 있습니다.김종민 ""조국 사모펀드, 내가 봐도 의심…하지만 몰랐을것""조국 논문저자 교수 \'스펙품앗이\'는 부인, 딸 칭찬은 인용조국, 주요의혹 ""몰랐다·檢수사중""…사퇴설은 일축2분기 성장률 전분기 대비 1.0%…0.1%p 하향 수정이인영 ""조국, 적잖은 의혹 해소…국민 눈높이 따라 판단""좋아요0훈훈해요0슬퍼요0화나요0후속기사 원해요0기사제공 :']"
