,회사명,날짜,언론사,기사제목,링크,본문
10,삼성전자, 2019-07-0718:24,머니투데이 ,[속보]이재용 삼성전자 부회장 7일 저녁 6시40분 일본 출국,https://finance.naver.com/news/news_read.nhn?article_id=0004244637&office_id=008&mode=search&query=삼성전자&page=7,"['       [속보]이재용 삼성전자 부회장 7일 저녁 6시40분 일본 출국      기사입력2019-07-07 18:24기사원문좋아요훈훈해요좋아요 평가하기공감좋아요0훈훈해요0슬퍼요0화나요0후속기사 원해요0댓글 [머니투데이 김포공항=심재현 기자] 이재용 삼성전자 부회장이 7일 오후 6시40분 비행기로 일본으로 출국했다. 이 부회장은 일본 현지 경제인들과 일본 정부의 반도체 핵심소재 수출규제에 대한 대책을 논의할 것으로 알려졌다. 반도체 핵심소재 수입에 문제가 생길 경우 생산 차질이 불가피한 상황에서 한일 정부간 사태 해결 조짐이 보이지 않자 물밑 해법 모색을 고민하는 것으로 보인다.김포공항=심재현 기자 urme@mt.co.kr▶이코노미스트들의 투자칼럼▶조 변호사의 가정상담소 ▶더 많은 기사 보러가기  <저작권자 ⓒ \'돈이 보이는 리얼타임 뉴스\' 머니투데이, 무단전재 및 재배포 금지>머니투데이 관련뉴스해당 언론사에서 선정하며 언론사 페이지(아웃링크)로 이동해 볼 수 있습니다.日보복 나흘째..""폭탄 터지나"" 삼성·SK 진짜 두려운 것은남편에 무차별 폭행당한 베트남 여성, 제일 잘하던 한국말은…베트남 이주 여성 무차별 폭행 영상 확산…남편 긴급체포모두 손들 때, 아베 혼자 ""NO""…日서 논란된 장면이열음 잘못일까, 아닐까좋아요0훈훈해요0슬퍼요0화나요0후속기사 원해요0기사제공 :']"
11,삼성전자, 2019-07-0718:22,매일경제 ,"""조기해결 안되면 반도체 쇼크, 他분야로 확산 않게 관리해야""",https://finance.naver.com/news/news_read.nhn?article_id=0004387465&office_id=009&mode=search&query=삼성전자&page=7,"['       ""조기해결 안되면 반도체 쇼크, 他분야로 확산 않게 관리해야""      기사입력2019-07-07 18:22기사원문좋아요훈훈해요좋아요 평가하기공감좋아요0훈훈해요0슬퍼요0화나요0후속기사 원해요0댓글 ◆ 일본의 경제보복 / 靑-재계총수 긴급회동 ◆   김상조 청와대 정책실장과 홍남기 경제부총리 겸 기획재정부 장관이 7일 정의선 현대차그룹 수석부회장, 최태원 SK그룹 회장, 구광모 LG그룹 회장과 서울 성북동 모처에서 오찬을 하고 일본의 수출규제에 대한 대응 방안 등을 논의했다. 일본의 보복성 조치에 대응하기 위한 사실상의 민관회의가 가동된 셈이다.당초 김 실장은 이재용 삼성전자 부회장과 신동빈 롯데그룹 회장 측에도 함께 만나자고 제안했다. 하지만 신 회장은 일본 출장 일정이 잡혀 있어 참석하지 못했다. 이 부회장은 회의 이후인 이날 저녁 일본으로 출국했지만 회의 참석 여부는 확인되지 않았다.다만 삼성전자와 롯데그룹의 경우 총수를 대신해 전문경영인이 참석했을 가능성도 있는 것으로 알려졌다. 이날 회동이 일본 반도체 수출규제 대응 논의가 주목적인 만큼 삼성전자가 빠질 경우 모임 취지가 무색해지기 때문이다. 또 롯데그룹은 국내 대기업 중 일본 내 네트워크가 가장 광범위하다.이번 재계 총수와의 회동은 김 실장 취임 후 첫 번째로, 일본의 반도체 수출규제 조치에 따른 대응책 관련 논의가 중점적으로 이뤄졌다. 이날 회동에선 SK하이닉스가 속한 SK그룹의 최태원 회장이 적극적으로 의견을 개진한 것으로 알려졌다.참석자들은 반도체 분야와 관련해 ""일본 수출규제가 단기 이슈일 경우 어느 정도 버텨낼 순 있지만 장기로 갈 경우 상당한 충격이 있을 수 있다""는 우려의 메시지를 전달한 것으로 알려졌다.아울러 이날 자리에선 일본의 보복성 수출규제가 전방위적으로 확산될 가능성에 대비한 논의도 이뤄졌다. 이날 회동에 참석한 총수들이 이끄는 현대차, LG, SK그룹은 자동차, 2차전지, 석유화학, 철강 등 다양한 수출산업을 영위하고 있는 만큼 일본의 추가 보복 조치가 있을 경우 영향을 받을 수 있다.참석자들은 ""현재 사정권 바깥인 업종까지 확전되지 않도록 정부가 상황 관리를 해 달라""는 취지의 의견을 전달했다고 한다. 이번 회동에선 오는 10일 문재인 대통령과 30대 그룹 총수 회동에 앞서 의견을 수렴하고, 의제 조율도 이뤄진 것으로 알려졌다.청와대와 해당 기업들은 이날 회동에 대해 일체 함구하고 있다. 상황 타개를 위해 개별 기업들이 일본 측과 접촉하고 있는 상황에서 정부와 기업 간 논의 내용이 알려질 경우 기업들의 협상력이 약화될 수 있다는 판단 때문으로 풀이된다. 실제 김 실장은 지난 4일 한 방송에서 ""\'상승작용\'을 원하는 아베 신조 일본 총리 의도에 말려드는 것은 바람직하지 않다""며 ""저희가 준비한 것을 자세하게 국민에게 설명하는 것은 \'게임이론\'에 따르면 상대에게 패를 다 보여주는 것이어서 일본을 상대로 한 협상력을 떨어뜨린다""고 말했다.이런 맥락에서 문 대통령 역시 당장 직접 대일(對日) 메시지를 내진 않을 것으로 알려졌다. 청와대는 아베 총리가 방송 인터뷰에서 한국에 대한 \'수출규제 강화\' 이유로 \'부적절한 사안\'을 들며 한국이 북한에 대한 제재를 제대로 지켜야 한다고 말한 데 대해서도 별도 입장을 내지 않았다.  [오수현 기자]▶네이버 메인에서 \'매일경제\'를 받아보세요▶뉴스레터 \'매콤달콤\' 구독 ▶무궁무진한 프리미엄 읽을거리[ⓒ 매일경제 & mk.co.kr, 무단전재 및 재배포 금지]매일경제 관련뉴스해당 언론사에서 선정하며 언론사 페이지(아웃링크)로 이동해 볼 수 있습니다.[단독] 아웃도어 침체에…\'밀레\' 한국법인 매물로국토부 ""서울 아파트값 주간단위로 0.3% 이상 오르면 추가대책""제니, 필라테스로 만든 몸매두살배기 인질로 잡은 3인조 강도 검거송혜교, 中행사 참석…송중기와 이혼 후 첫 공식석상좋아요0훈훈해요0슬퍼요0화나요0후속기사 원해요0기사제공 :']"
12,삼성전자, 2019-07-0718:20,시사저널 ,"이재용 삼성전자 부회장 부랴부랴 일본행, 왜?",https://finance.naver.com/news/news_read.nhn?article_id=0000007457&office_id=586&mode=search&query=삼성전자&page=7,"['       이재용 삼성전자 부회장 부랴부랴 일본행, 왜?      기사입력2019-07-07 18:20기사원문좋아요훈훈해요좋아요 평가하기공감좋아요0훈훈해요0슬퍼요0화나요0후속기사 원해요0댓글반도체 위기, 우리 경제 위기로 이어질 수도 있어이재용 삼성전자 부회장이 일본 정부의 첨단소재 수출 규제에 대한 해법 마련을 위해 지난 7일 현지를 방문한 것으로 알려졌다. 그의 일본 출장 사실은 홍남기 경제부총리 겸 기획재정부 장관과 김상조 청와대 정책실장이 5대 기업 총수와의 회동을 조율하는 과정에서 외부로 알려졌다. 일본 출장 계획으로 회동 불참 의사를 밝히면서다.이재용 삼성전자 부회장 ⓒ연합뉴스삼성전자 반도체 생산라인 중단 가능성도이처럼 이 부회장이 부랴부랴 일본행을 결정한 데는 그만한 이유가 있다. 일본 정부가 지난 4일 수출을 규제한 포토레지스트와 고순도 불화수소, 플루오린 폴리이미드 등 세 품목이 반도체와 올레드(OLED) 디스플레이의 핵심 소재이기 때문이다. 그동안 반도체와 올레드 디스플레이로 세계시장을 주름 잡아온 삼성전자로선 직격탄을 맞은 셈이다.이 부회장은 앞서 일본의 수출 규제와 관련해 반도체와 디스플레이를 총괄하는 김기남 삼성전자 부회장을 비롯, 반도체사업부 임원들과 수차례 비상경영회의를 가진 후 일본 출장을 결정한 것으로 전해졌다. 일본 정부의 수출 규제 영향이 예상보다 심각할 수 있다고 판단한 것이다.문제는 일본이 수출을 규제한 품목을 대체할 시장이 없다는 데 있다. 수출 규제가 걸린 품목의 일본 글로벌 생산 점유율이 90%에 달하기 때문이다. 삼성전자는 현재 포토레지스트와 고순도 불화수소 재고를 한 두 달치 밖에 확보하지 못한 것으로 전해졌다. 이 때문에 수출 규제가 장기화돼 제고가 소진될 경우 공장 가동이 중단될 수도 있다는 우려마저 나오고 있다. 업계에선 삼성전자 반도체 생산라인이 하루 중단될 경우 1000억원에 달하는 피해가 발생할 것으로 추산하고 있다.이를 단순히 \'삼성의 위기\'로만 치부하긴 어렵다. 반도체가 국내 전체 수출에서 차지하는 비중이 20%에 달하기 때문이다. 반도체 생산에 차질이 생기면 하반기 국내 경제 성장률에도 악영향이 불가피하다. 이는 우리 정부에게도 상당히 부담스러울 수밖에 없다. 전문가들은 일본 정부가 이런 점을 노리고 수출 규제 품목을 정한 것이란 해석이 지배적이다.이를 의식한 듯 정부도 대응 마련에 고심하고 있다. 문재인 대통령은 7월10일 청와대에서 30대 그룹 총수들과 간담회를 갖는 방안을 검토하고 있다. 문 대통령은 이날 간담회에서 일본 수출 규제에 따른 기업의 어려움을 듣고, 이를 극복하기 위한 정부 대책에 대한 의견을 교환할 것으로 보인다.\xa0송응철 기자 sec@sisajournal.com<저작권자 ⓒ 시사저널, 무단 전재 및 재배포 금지>시사저널 관련뉴스해당 언론사에서 선정하며 언론사 페이지(아웃링크)로 이동해 볼 수 있습니다.엽기살인 뒤에 숨겨진 범인의 두 얼굴수사 피해 비행기 탄 회장님들""일본 제품 사지 말자"" 불 지펴진 불매운동여름 휴가, 이 약만은 챙겨라갈 데까지 간 야구계…유소년에 약물 투여까지좋아요0훈훈해요0슬퍼요0화나요0후속기사 원해요0기사제공 :']"
13,삼성전자, 2019-07-0718:12,파이낸셜뉴스 ,"최대규모 삼성전자 프리미엄 스토어.. 12일, 롯데백화점 노원점에 오픈",https://finance.naver.com/news/news_read.nhn?article_id=0004257299&office_id=014&mode=search&query=삼성전자&page=7,"[""       최대규모 삼성전자 프리미엄 스토어.. 12일, 롯데백화점 노원점에 오픈      기사입력2019-07-07 18:12기사원문좋아요훈훈해요좋아요 평가하기공감좋아요0훈훈해요0슬퍼요0화나요0후속기사 원해요0댓글  롯데백화점 노원점에 서울·수도권 백화점에 운영중인 삼성가전 매장 중 최대 규모의 '삼성전자 프리미엄 스토어'가 오는 12일 문을 연다.  이번에 오픈하는 '삼성전자 프리미엄 스토어'는 서울·수도권 최대 규모인 370㎥(112평)으로 고객 체험 콘텐츠를 강화했으며, 쾌적하게 꾸며진 상담공간에서 여유로운 상담이 가능하도록 했다.  또한, 2019년 '뉴 라이프 스타일 TV'와 고객 개인별 취향을 반영해 제작이 가능한 '비스포크 냉장고', 'QLED 8K', '에어드레서' 등의 프리미엄 제품들을 소개할 계획이다. 롯데백화점 노원점은 '삼성전자 프리미엄 스토어' 오픈을 기념해 오는 12일부터 25일까지 가전 전 품목 최대 8%할인에 3%추가 할인을 더 해 최대 11%할인을 받을 수 있는 프로모션을 진행한다.   padet80@fnnews.com 박신영 기자 ▶ 헉! 소리나는 스!토리 뉴스 [헉스]▶ 클릭해, 뉴스 들어간다 [뉴스쿨] ▶ 세상에 이런일이 [fn파스]  ※ 저작권자 ⓒ 파이낸셜뉴스. 무단 전재-재배포 금지파이낸셜뉴스 관련뉴스해당 언론사에서 선정하며 언론사 페이지(아웃링크)로 이동해 볼 수 있습니다.호랑이 4마리에게 물어 뜯긴 조련사, 구급대원 도착할때까지.. '처참'남편에 폭행 당하던 베트남女, 자주하던 한국 말조국 수석, 與 의원들에 보낸 1200자 문자 논란술 1주 당 2~8잔 마셨더니.. 몸에 나타난 의외의 효과외국인이 살기 좋은 나라 2위는 싱가포르, 1위는?좋아요0훈훈해요0슬퍼요0화나요0후속기사 원해요0기사제공 :""]"
14,삼성전자, 2019-07-0718:08,서울경제 ,[일본 배워서 일본을 이기자] 多能보다 한 분야서 1등 기술 확보,https://finance.naver.com/news/news_read.nhn?article_id=0003582164&office_id=011&mode=search&query=삼성전자&page=7,"['       [일본 배워서 일본을 이기자] 多能보다 한 분야서 1등 기술 확보      기사입력2019-07-07 18:08기사원문좋아요훈훈해요좋아요 평가하기공감좋아요0훈훈해요0슬퍼요0화나요0후속기사 원해요0댓글■니치톱 전략특정분야 선택 최고기업으로 키워스마트폰 가공기계 등 시장 선도[서울경제] ‘다능은 군자의 수치다.’ 산업용 로봇 분야에서 세계 최강으로 꼽히는 일본 ‘화낙’의 회의실에는 이 같은 문구가 걸려 있다. 회사가 성장하면 사업 다각화를 꾀하는 다른 기업과는 달리 로봇에만 집중한다는 의지를 나타낸다. 이 때문에 화낙은 작은 연못에서 큰 잉어를 낚는다는 ‘니치톱’ 전략의 대표 사례로 꼽힌다. 사내벤처로 출발해 지난 1972년 후지쓰로부터 분사한 화낙은 컴퓨터수치제어(CNC) 공작기계에 천착했고 현재는 스마트폰 가공 기계 산업의 80%를 점유한 기업으로 올라섰다. 이렇다 보니 주요 고객은 애플과 삼성전자다. 애플과 폭스콘은 한 대당 1억원에 달하는 화낙의 절삭로봇을 10만대, 삼성전자는 2만대가량 도입한 것으로 알려졌다. 2011년 대지진으로 무너질 뻔한 일본 경제를 뒷받침한 것 역시 니치톱 전략을 구사하는 일본의 강소기업이었다. 물론 대지진 이후 각국이 일본으로부터의 기계와 부품·소재 수입 의존도를 줄이려는 노력을 펼쳤지만 압도적인 기술력을 보유한 일본 제품의 대체재를 쉽게 찾을 수 없었다.틈새시장 공략에 나서는 일본 기업들의 지원은 정부가 맡았다. 일본 정부는 2014년 ‘글로벌 니치톱 100(GNT 100)’ 정책을 발표하고 기업들을 지원하기 시작했다. 한일경상학회는 “한국의 중소기업 육성정책과 달리 일본의 글로벌 니치톱 100은 특정 분야를 선택해 세계적인 기업으로 성장시키겠다는 전략이 담긴 것이 특징”이라고 밝혔다. 우리나라의 강소기업 전략인 ‘월드클래스 300’ 정책은 선정기업의 분야가 제각각이고, 한번에 100개 기업을 선정한 일본과 달리 8년여에 걸쳐 300개 기업을 선정하고 지원하다 보니 정책의 일관성이 부족하다는 설명이다.이지평 LG경제연구원 수석연구위원은 “우리나라는 일본만큼 지역 생산기반이 강하지 않기 때문에 무리하게 일본을 따라 하기는 어려운 면이 있다”며 “시장이 크지 않더라도 필수적이며 자신의 장점이 발휘되고 유지될 수 있는 분야를 발굴하고 개척해나가는 것은 기술력이 어느 정도 있는 중소기업들에는 상당히 유효한 전략”이라고 설명했다./박형윤기자 manis@sedaily.com[서울경제 바로가기]▶ 텔레그램으로 서울경제 구독하기  | ▶ 네이버TV로 서울경제썸 구독하기▶ 네이버 메인에서 \'No. 1 뉴스\' 서울경제를 만나보세요저작권자 ⓒ 서울경제, 무단 전재 및 재배포 금지서울경제 관련뉴스해당 언론사에서 선정하며 언론사 페이지(아웃링크)로 이동해 볼 수 있습니다.박원순 서울시장 ""더 큰 권한에 목마르다"" 대권 도전 시사해외도피 부정축재자 집중추적···축재액 1,300억 달해일본은 왜 강할까? 일본 이기려면 일본을 배워라아베 \'헛다리\' 짚었나...韓 경제보복에도 지지율은 추락\'살짝 밟으니 야수가 깨어났다\' 마세라티 르반떼 트로페오좋아요0훈훈해요0슬퍼요0화나요0후속기사 원해요0기사제공 :']"
15,삼성전자, 2019-07-0718:07,매일경제 ,北제재 못믿어 韓규제한다는 아베,https://finance.naver.com/news/news_read.nhn?article_id=0004387448&office_id=009&mode=search&query=삼성전자&page=7,"['       北제재 못믿어 韓규제한다는 아베      기사입력2019-07-07 18:07기사원문좋아요훈훈해요좋아요 평가하기공감좋아요0훈훈해요0슬퍼요0화나요0후속기사 원해요0댓글""한국, 징용 약속 안지키는데대북 무역관리 의심은 당연""경제보복, 안보이슈 핑계대홍남기부총리·김상조실장주요그룹과 만나 대응 논의◆ 일본의 경제보복 ◆  참의원 선거 유세에 나선 아베 신조 일본 총리가 6일 오사카 상점가에서 유권자들과 인사하고 있다. 아베 총리는 7일 여야 당대표 방송 토론회에 참석해 한국의 대북제재 위반이 이번 수출 규제 조치의 배경이라 고 주장하고 나섰다. [연합뉴스] 아베 신조 일본 총리가 한국에 대한 반도체 소재 수출 통제 조치와 관련해 북한 연관성을 시사하면서 파장이 커지고 있다. 아베 총리가 이번 조치 배경으로 \'한국과 신뢰관계 훼손\'과 함께 언급했던 \'부적절한 사안\'이 한국의 대북제재 위반이란 점을 내비쳤다. 사실상 추가 수출 규제에 대한 \'선전포고\'를 한 셈이다. 7일 아베 총리는 BS후지TV에 출연해 ""한국은 대북제재를 지키고 북한에 대한 무역 관리를 하고 있다고 하지만 강제징용 문제에 대해서도 국제적인 약속을 지키지 않는 상황에서 무역 관리도 지키지 않을 것이라고 생각하는 것은 당연하다""고 밝혔다. 다만 아베 총리는 구체적인 내용에 대해선 ""개별 사안에 대해서는 밝히지 않겠다""며 언급을 피했다.  아베 총리와 주요 인사들 발언을 종합해보면 일본에서 한국으로 수출한 무기 개발에 사용될 수도 있는 물자가 북한으로 흘러들 가능성이 있어 규제에 나설 수밖에 없다는 것이다. 앞서 지난 5일 아베 총리 측근으로 꼽히는 하기우다 고이치 자민당 간사장 대행도 ""(화학물질의) 행선지를 알 수 없는 상황이 발생했다""며 ""이에 대한 조치를 취하는 것은 당연하다""고 말했다. 일본 언론에서는 이 발언이 북한으로 흘러 들어갔다는 의미라고 평가했다. 한국 정부가 일본의 수출 통제 조치를 세계무역기구(WTO) 협정 위반이라고 반발하는 가운데 이를 무력화할 수 있는 카드를 던진 것이다. 사실관계가 모호한 대북제재 위반 가능성을 \'핑계\'로 일본이 1차 조치의 정당성을 확보하는 한편 2차 무역 보복으로 추진 중인 전략물자 화이트리스트 한국 배제 조치를 밀어붙일 명분을 마련하려는 의도로 풀이된다.정부도 연일 긴급대책회의를 열며 대응책 마련에 나섰다. 이날 오후 김상조 청와대 정책실장과 홍남기 경제부총리 겸 기획재정부 장관은 서울 성북동 모처에서 정의선 현대차그룹 수석부회장, 최태원 SK그룹 회장, 구광모 LG그룹 회장 등을 만나 일본 수출 통제 조치와 관련한 대응 방안을 논의했다. 5대 그룹 총수 중 이재용 삼성전자 부회장의 참석 여부는 확인되지 않았고, 신동빈 롯데그룹 회장은 일본 출장 때문에 불참한 것으로 알려졌다. 고민정 청와대 대변인은 ""대외 경제 상황의 불확실성에 대한 의견을 교환하고 향후 적극적으로 긴밀한 소통을 이어가기로 했다""고 밝혔다. 이재용 부회장은 이날 저녁 일본을 찾았다.두 달 만에 다시 일본을 방문한 이 부회장은 일본 경제계 인사들과 만나 일본 수출 규제에 대한 해결책을 모색할 것으로 전해졌다. 앞서 지난 6일에는 이낙연 국무총리 주재로 홍 부총리, 강경화 외교부 장관, 성윤모 산업통상자원부 장관 등이 비공개 간담회를 열기도 했다. 오는 10일에는 문재인 대통령이 청와대에서 30대 그룹 총수들과 간담회를 열어 일본 무역 보복에 대한 첫 입장을 내놓을 예정이다. [도쿄 = 정욱 특파원 / 서울 = 오수현 기자]▶네이버 메인에서 \'매일경제\'를 받아보세요▶뉴스레터 \'매콤달콤\' 구독 ▶무궁무진한 프리미엄 읽을거리[ⓒ 매일경제 & mk.co.kr, 무단전재 및 재배포 금지]매일경제 관련뉴스해당 언론사에서 선정하며 언론사 페이지(아웃링크)로 이동해 볼 수 있습니다.[단독] 아웃도어 침체에…\'밀레\' 한국법인 매물로국토부 ""서울 아파트값 주간단위로 0.3% 이상 오르면 추가대책""제니, 필라테스로 만든 몸매두살배기 인질로 잡은 3인조 강도 검거송혜교, 中행사 참석…송중기와 이혼 후 첫 공식석상좋아요0훈훈해요0슬퍼요0화나요0후속기사 원해요0기사제공 :']"
16,삼성전자, 2019-07-0718:02,매일신문 ,천덕꾸러기에서 효자로? 달라진 백화점 가전제품 매장,https://finance.naver.com/news/news_read.nhn?article_id=0000601643&office_id=088&mode=search&query=삼성전자&page=7,"['       천덕꾸러기에서 효자로? 달라진 백화점 가전제품 매장      기사입력2019-07-07 18:02기사원문좋아요훈훈해요좋아요 평가하기공감좋아요0훈훈해요0슬퍼요0화나요0후속기사 원해요0댓글매출 신통치 않던 가전 매장, 최근 \'신(新)가전\' 열풍에 매출 급등""백화점 상품 프리미엄, 낮아진 백화점 VIP 문턱 등 효과""        [김윤기 기자 yoonki@imaeil.com] 롯데백화점 대구점 8층 삼성전자 프리미엄스토어에서 무선 청소기 제품을 선보이고 있다. 롯데백화점 대구점 제공.백화점 가전매장이 천덕꾸러기에서 효자로 거듭나고 있다. 주요 백화점마다 기존보다 규모와 기능을 강화한 가전 \'프리미엄 스토어\'를 선보이는 추세이다. 통상 백화점에서 가전매장은 계륵처럼 여겨졌다. 덩치 큰 제품을 갖춰야 해 넓은 면적이 필요하지만 찾는 사람은 많지 않고, 신혼부부나 VIP 고객들을 놓칠까봐 없앨 수도 없는 노릇이었기 때문이다.하지만 최근에는 위상이 달라졌다. 가전기업들은 체험기능을 강화한 프리미엄 스토어를 늘리고 있다.삼성전자는 롯데백화점 대구점, 신세계백화점 센텀점 등 10여 개 주요 백화점 매장을 프리미엄 스토어로 전환했다. 삼성전자 관계자는 ""오디오를 청음하는 공간이나 키즈존 등을 마련해 가족 단위 고객들이 더 편하게 제품을 체험하고 상담할 수 있는 공간을 만드는 데 주력했다""고 설명했다.롯데백화점 대구점의 삼성전자와 LG전자 매장은 지난달 프리미엄 스토어로 새단장한 이후 전월에 비해 매출이 각각 210%, 202% 늘었다고 밝혔다. 올 상반기 들어 지난해 같은 기간에 비해 무선청소기는 154%, 공기청정기는 64%, 의류관리기는 22% 판매가 늘며 상승세를 이끌었다.현대백화점도 올 1~5월 가전 매출이 지난해 같은 기간에 비해 29.6%, 신세계·롯데백화점도 25.6% 늘어났다고 밝혔다. 백화점 가전 매장의 부활은 공기청정기, 의류관리기 등 \'신(新) 가전\' 열풍에다 소비자들의 백화점 선호가 더해지면서 나타난 현상으로 풀이된다. 롯데백화점 대구점 관계자는 ""백화점 제품에는 온라인이나 가전양판점에서 팔리는 모델보다 고급 기능이 탑재된 경우가 많고 백화점에 따라 연간 400만원 수준의 금액으로도 낮은 등급의 VIP 등급을 부여받을 수 있는 곳도 생겼기 때문""이라고 설명했다.ⓒ매일신문 - www.imaeil.com좋아요0훈훈해요0슬퍼요0화나요0후속기사 원해요0기사제공 :']"
