,회사명,날짜,언론사,기사제목,링크,본문
14,삼성전자, 2019-09-0316:07,디지털타임스 ,"코스피·코스닥 약보합 마감…""美 증시 휴장으로 방향성 오리무중""",https://finance.naver.com/news/news_read.nhn?article_id=0002550669&office_id=029&mode=search&query=삼성전자&page=4,"['       코스피·코스닥 약보합 마감…""美 증시 휴장으로 방향성 오리무중""      기사입력2019-09-03 16:07기사원문좋아요훈훈해요좋아요 평가하기공감좋아요0훈훈해요0슬퍼요0화나요0후속기사 원해요0댓글 [디지털타임스 김민주 기자] 코스피가 간밤 미국 증시가 휴장한 3일 약보합으로 마감했다. 이날 코스피는 전 거래일보다 3.50포인트(0.18%) 내린 1965.69에 거래를 마쳤다. 지수는 전장보다 2.69포인트(0.14%) 내린 1966.50에서 출발해 등락을 거듭하다가 우하향 곡선을 그렸다.이날 코스피시장에서 외국인이 3031억원어치를 순매도했다. 반면 기관과 개인은 각각 2480억원, 400억원을 순매수했다.노동길 NH투자증권 연구원은 ""밤사이 미국 증시가 휴장해 방향성을 알 수 없는 상황에서 브렉시트와 미중 무역분쟁 불확실성에 달러 강세가 이어지면서 외국인 수급이 부정적으로 변하는 모습을 보였다""고 설명했다.시가총액 상위주 가운데 삼성전자(-1.26%), SK하이닉스(-0.77%), 현대차(-1.91%), 현대모비스(-1.39%) 등이 내렸다. NAVER(0.33%), LG화학(0.16%), 셀트리온(2.56%), 신한지주(0.12%), LG생활건강(4.77%) 등은 올랐다. SK텔레콤은 보합 마감했다.업종별로는 화학(1.30%), 의약품(1.28%), 유통(0.89%), 음식료품(0.80%) 등이 강세를 보였고 증권(-1.47%), 운수창고(-1.09%), 전기·전자(-0.92%), 보험(-0.83%) 등은 약세였다.이날 코스닥지수는 전장보다 0.21포인트(0.03%) 오른 620.02로 마감했다. 지수는 전장보다 0.05포인트(0.01%) 오른 619.86에서 출발해 보합권에서 오르내림을 반복했다.코스닥시장에서는 개인이 1182억원을 순매수했다. 반면 외국인과 기관은 각각 531억원, 590억원을 순매도했다.이날 서울 외환시장에서 원·달러 환율은 전날보다 달러당 4.8원 오른 1215.6원에 마감했다.김민주기자 stella2515@dt.co.kr 디지털타임스 기획 : [ ] 에게 고견을 듣는다 / [연중기획] 풀뿌리상권 살려내자네이버 채널에서 \'디지털타임스\'를 구독해주세요.디지털타임스 관련뉴스해당 언론사에서 선정하며 언론사 페이지(아웃링크)로 이동해 볼 수 있습니다.이수근-은지원, 20일 \'아이슬란드 간 세끼\' 첫방..역대급 편성 시간 5분박지선 일본일침 ""싸가지 없는 것들, 명치를 끊어치겠다""한예슬, 노출 어깨 위 \'플라워 타투\' 장착..""고혹미 물씬""이승기 ""아빠 보고 싶다"" 고백 장면, \'리틀 포레스트\' 최고의 1분 등극이상민 오열, 20년 만에 바비킴 마주하며 ""너는 좋은 기억만 남겨준 친구""좋아요0훈훈해요0슬퍼요0화나요0후속기사 원해요0기사제공 :']"
15,삼성전자, 2019-09-0316:06,아시아경제 ,"코스피, 외인 ‘팔자’에 약보합 마감… 코스닥 620선 회복",https://finance.naver.com/news/news_read.nhn?article_id=0004530290&office_id=277&mode=search&query=삼성전자&page=4,"['       코스피, 외인 ‘팔자’에 약보합 마감… 코스닥 620선 회복      기사입력2019-09-03 16:06기사원문좋아요훈훈해요좋아요 평가하기공감좋아요0훈훈해요0슬퍼요0화나요0후속기사 원해요0댓글[이미지출처=연합뉴스][아시아경제 구은모 기자] 코스피가 외국인 투자가의 ‘팔자’에 상승세를 이어가지 못하고 1960선에서 하락 마감했다. 반면 코스닥 지수는 개인 투자자의 순매수에 3거래일 연속 상승하며 620선을 회복했다.3일 하락 출발한 코스피는 장 초반 기관 투자자의 매수세에 상승 전환해 강보합세를 보였다. 그러다 오전 11시20분께 외국인의 매수세가 확대되며 하락 전환했고 이후 약보합을 유지하다 전일 대비 3.50포인트(0.18%) 하락한 1965.69로 마감했다.거래 주체별 매매 동향을 보면 외국인 투자가가 3031억원 순매도하며 지수 상승을 막았다. 반면 기관과 개인 투자자는 각각 2475억원, 406억원 순매수했다. 특히 기관은 이날까지 8거래일 연속 순매수를 이어갔다.업종별로는 화학(1.30%), 의약품(1.28%), 유통업(0.89%) 등이 올랐고, 증권(-1.47%), 운수창고(-1.09%), 전기,전자(-0.92%) 등은 내렸다.시가총액 상위 종목들 중에선 LG생활건강(4.77%), 셀트리온(2.56%), 삼성바이오로직스(1.87%) 등이 상승한 반면 현대차(-1.91%), 현대모비스(-1.39%), 삼성전자(-1.26%) 등은 하락했다.이날 코스피 시장에서는 상한가를 기록한 1종목을 포함해 440종목이 올랐고, 하한가 종목 없이 364종목은 내렸다. 85종목은 보합을 기록했다.코스닥 지수는 소폭 상승하면 620선을 회복했다. 이날 상승 출발한 코스닥 지수는 장중 620선 안팎에서 움직이다 전 거래일 대비 0.05포인트(0.01%) 오른 619.86으로 마감했다.거래 주체별 매매 동향을 보면 개인 투자자가 1182억원 순매수했고, 기관과 외국인 투자자는 각각 590억원, 531억원 순매수했다.업종별로는 오락,문화(2.15%), 통신서비스(2.15%), 화학(1.16%) 등이 올랐고, 종이,목재(-1.76%), 운송장비,부품(-1.03%), 음식료,담배(-0.72%) 등은 내렸다.시가총액 상위 종목들 중에서는 파라다이스(4.83%), 스튜디오드래곤(4.13%), 케이엠더블유(1.38%) 등이 상승했다. 반면 컴투스(-3.51%), 에이치엘비(-2.31%), 메디톡스(-2.21%), 에스에프에이(-1.88%) 등은 하락했다.이날 코스닥시장에서는 상한가를 기록한 종목을 3종목을 포함해 676종목이 올랐고, 하한가를 기록한 1종목을 포함해 536종목은 내렸다. 98종목은 보합을 기록했다.구은모 기자 gooeunmo@asiae.co.kr▶ 신강재강(身强財强) 해야 부자사주라고? 나는?▶ 경제 감각을 키우고 싶다면?  ▶ 재미와 지식이 가득한 \'과학을읽다\'<ⓒ경제를 보는 눈, 세계를 보는 창 아시아경제 무단전재 배포금지>아시아경제 관련뉴스해당 언론사에서 선정하며 언론사 페이지(아웃링크)로 이동해 볼 수 있습니다.""이혼한 며느리와 산다는 조국 엄마 집"" 강용석 또…""600만원 준 여교사, 아들과 부적절 관계에…"" 충격코딩 오류난 섹스로봇, 주인 껴안기만 해도…\'경고\'유명 여배우, 동영상 속 대형 정치인과의 루머에…\'혹하게\' 브라질여성들 데려와선 200만원에 \'몹쓸짓\'좋아요0훈훈해요0슬퍼요0화나요0후속기사 원해요0기사제공 :']"
16,삼성전자, 2019-09-0316:05,뉴시스 ,"[마감시황]코스피, 1960선 하락세…외국인 3000억 순매도",https://finance.naver.com/news/news_read.nhn?article_id=0009434778&office_id=003&mode=search&query=삼성전자&page=4,"['       [마감시황]코스피, 1960선 하락세…외국인 3000억 순매도      기사입력2019-09-03 16:05기사원문좋아요훈훈해요좋아요 평가하기공감좋아요0훈훈해요0슬퍼요0화나요0후속기사 원해요0댓글【서울=뉴시스】김병문 기자 = 코스피지수가 기관 매수세에 전 거래일(1967.79) 대비 1.40포인트(0.07%) 오른 1969.19로 장을 마감한 2일 오후 서울 중구 KEB하나은행 딜링룸에서 직원들이 업무를 보고 있다. 이날 코스닥지수는 전 거래일(610.55) 대비 9.26포인트(1.52%) 오른 619.81에 마감했다. 서울 외환시장에서 원·달러 환율은 전 거래일(1211.2원) 대비 0.4원 내린 1210.8원에 마감했다. 2019.09.02.   dadazon@newsis.com【서울=뉴시스】하종민 기자 = 코스피가 외국인 순매도에 1960선 하락세로 마감했다.3일 한국거래소에 따르면 코스피지수는 전 거래일(1969.19) 대비 3.50포인트(0.18%) 내린 1965.69에 마감했다. 이날 코스피지수는 전 거래일보다 2.69포인트(0.14%) 하락한 1966.50에 개장한 후 등락을 반복하다 1960선 하락세로 거래를 마쳤다.외국인 투자자가 3030억원어치를 순매도하며 지수를 끌어내렸고 기관과 개인이 각각 2480억원어치, 410억원어치를 순매수했지만 역부족이었다.곽현수 신한금융투자 연구원은 ""8월 수출 부진으로 코스피 기업이익은 3분기에도 만만치 않은 상황을 이어갈 것""이라며 ""코스피의 12개월 선행 주당순이익(EPS)의 전년 대비 증가율은 리먼사태 때만큼 내려앉은 상황""이라고 분석했다.그는 ""추가 낙폭은 제한적일 것""이라며 ""반도체 이익 추정치 조정 마무리되고 있고 일본 수출 규제 관련 불확실성도 완화되는 분위기""라고 덧붙였다.업종별로는 증권(-1.47%)과 운수창고(-1.09%), 전기전자(-0.92%), 보험(-0.83%), 은행(-0.80%), 건설업(-0.78%), 전기가스업(-0.73%), 운송장비(-0.68%), 종이목재(-0.64%), 의료정밀(-0.58%), 금융업(-0.37%) 등이 하락했다.화학(1.30%)과 의약품(1.28%), 유통업(0.89%), 음식료품(0.80%), 기계(0.69%) 등은 상승세를 기록했다.시가총액 상위주들은 삼성전자(-1.26%)와 SK하이닉스(-0.77%), 현대차(-1.91%), 현대모비스(-1.39%) 등이 하락세로 장을 마쳤다.네이버(0.33%)와 LG화학(0.16%), 셀트리온(2.56%), 신한지주(0.12%), LG생활건강(4.77%) 등은 상승했다.이날 코스닥지수는 전 거래일(619.81) 대비 0.21포인트(0.03%) 상승한 620.02에 마감했다. 코스닥지수는 전 거래일보다 0.05포인트(0.01%) 오른 619.86에 개장한 후 등락을 반복하다 620선으로 장을 마쳤다.코스닥시장에서는 개인이 홀로 1180억원어치를 순매수했다. 기관과 외국인은 각각 590억원어치, 530억원어치를 순매도했다.코스닥 시총 상위주 가운데서는 헬릭스미스(0.28%), 케이엠더블유(1.38%), 펄어비스(0.21%), 스튜디오드래곤(4.13%) 등이 올랐다.셀트리온헬스케어(-0.33%)와 CJ ENM(-0.38%), 메디톡스(-2.21%), SK머티리얼즈(-1.71%), 휴젤(-1.18%), 에이치엘비(-2.31%) 등은 하락세로 거래를 마쳤다.hahaha@newsis.com▶ 네이버에서 뉴시스 채널 구독하기▶ 뉴시스 빅데이터 MSI 주가시세표 바로가기 <저작권자ⓒ 공감언론 뉴시스통신사. 무단전재-재배포 금지.>뉴시스 관련뉴스해당 언론사에서 선정하며 언론사 페이지(아웃링크)로 이동해 볼 수 있습니다.""여학생이 어디 남학교서 춤을"" 꿈 좌절시킨 교사들친딸 성추행한 남편 감싸주려 거짓증언한 엄마…벌금 500만원""너 정자 좀 보자""…대학교수, 수업중 성희롱·막말 논란차량 3대 연쇄 충돌 사고…운전자는 9살 초등학생러시아, 평화시위 강경진압…종이컵 던졌다고 8년형좋아요0훈훈해요0슬퍼요0화나요0후속기사 원해요0기사제공 :']"
17,삼성전자, 2019-09-0315:57,뉴스1 ,"[시황종합] 코스피 사흘째 1960선, 코스닥 620선 회복",https://finance.naver.com/news/news_read.nhn?article_id=0004178279&office_id=421&mode=search&query=삼성전자&page=4,"['       [시황종합] 코스피 사흘째 1960선, 코스닥 620선 회복      기사입력2019-09-03 15:57기사원문좋아요훈훈해요좋아요 평가하기공감좋아요0훈훈해요0슬퍼요0화나요0후속기사 원해요0댓글코스피 0.18% 내린 1965.69 코스닥 0.03% 오른 620.02달러/원 환율 4.8원 오른 1215.6원© News1 DB(서울=뉴스1) 박응진 기자 = 코스피는 사흘째 1960선을 유지했다. 코스닥은 소폭 상승하며 한달여 만에 620선을 회복했다. 3일 국내 증시는 노동절을 맞은 뉴욕증시가 2일(현지시간) 하루 휴장하면서 대체로 보합권에 머물렀다.코스피는 전날(2일)과 비교해 3.50포인트(0.18%) 내린 1965.69로 마감했다. 코스피는 지난달 30일(종가 기준 1967.79) 이후 사흘째 1960선을 지키고 있다. 기관과 개인이 각각 2480억원, 400억원 순매수했고 외국인이 홀로 3031억원 순매도했다. 이날로 기관은 8거래일 연속 순매수했고 외국인은 2거래일 연속 순매도했다. 개인은 이날 순매수 전환했다. 코스피 시가총액 상위 10개 종목 중 셀트리온(2.56%), NAVER(0.33%), LG화학(0.16%), 신한지주(0.12%)는 상승했고 현대차(-1.91%), 현대모비스(-1.39%), 삼성전자(-1.26%), SK하이닉스(-0.77%), 삼성전자우(-0.55%)는 하락했다. 업종별로 보면 화학(1.30%), 의약품(1.28%), 유통업(0.89%) 등은 상승했고 증권(-1.47%), 운수창고(-1.09%), 전기전자(-0.92%) 등은 하락했다. 코스닥은 전날 대비 0.21포인트(0.03%) 오른 620.02로 마감했다. 3거래일 연속 상승 마감으로, 종가 기준 620선을 회복한 것은 지난달 1일 (622.26) 이후 22거래일 만이다. 기관과 외국인이 각각 590억원, 532억원 순매도했고, 개인이 홀로 1182억원 순매수했다. 코스닥 시가총액 상위 10개 종목 중 스튜디오드래곤(4.13%), 케이엠더블유(1.38%), 헬릭스미스(0.28%), 펄어비스(0.21%)는 상승했고, 에이치엘비(-2.31%), 메디톡스(-2.21%), SK머티리얼즈(-1.71%), 휴젤(-1.18%), CJ ENM(-0.38%), 셀트리온헬스케어(-0.33%)는 하락했다. 업종별로는 통신서비스(2.15%), 오락문화(2.15%), 정보기기(1.68%), 화학(1.16%), 통신장비(0.97%) 등은 상승했고, 종이목재(-1.76%), 운송장비(-1.03%), 음식료·담배(-0.72%) 등은 하락했다.서울외환시장에서 달러/원 환율은 4.8원 오른 1215.6원으로 마감했다.pej86@news1.kr▶ [ 크립토허브 ] ▶ [ 해피펫 ]▶ 네이버 메인에서 [뉴스1] 구독하기![© 뉴스1코리아(news1.kr), 무단 전재 및 재배포 금지]뉴스1 관련뉴스해당 언론사에서 선정하며 언론사 페이지(아웃링크)로 이동해 볼 수 있습니다.홍준표 ""조국, 내려오면 檢 내달리면 국민에 죽어…딱해""하태경 ""조국 모른다 아니다, 우병우 능가하는 법꾸라지""\'시속 490km\' 세계에서 가장 빠른차 부가티홍준표 ""조국 청문회, 왜 야당이 구걸하는 형국 만드나""조국 ""딸아이 혼자사는 집 찾지 말아달라""…울먹이며 호소좋아요0훈훈해요0슬퍼요0화나요0후속기사 원해요0기사제공 :']"
18,삼성전자, 2019-09-0315:56,머니S ,"[마감] 코스피, 외인 '팔자'에 약보합… 코스닥은 강보합",https://finance.naver.com/news/news_read.nhn?article_id=0000445432&office_id=417&mode=search&query=삼성전자&page=4,"['       [마감] 코스피, 외인 \'팔자\'에 약보합… 코스닥은 강보합      기사입력2019-09-03 15:56기사원문좋아요훈훈해요좋아요 평가하기공감좋아요0훈훈해요0슬퍼요0화나요0후속기사 원해요0댓글/사진=머니S DB코스피는 3일 장중 혼조세를 보이다가 결국 약보합세로 마감했다.코스피지수는 이날 전 거래일 대비 3.50포인트(0.18%) 내린 1965.69에 거래를 마쳤다. 개인과 기관이 각각 400억원, 2480억원 순매수하고 외국인이 3036억원 순매도했다.앞서 코스피지수는 전 거래일보다 2.69포인트(0.14%) 내린 1966.50에 거래를 시작했다. 장 직후 1970선을 회복하는 등 상승세 흐름을 보였지만 외국인의 매도폭이 커지면서 하락 반전했다.시총 상위종목에서는 보합세를 보인 SK텔레콤(0.00%)을 제외하고 NAVER(0.33%), LG화학(0.16%), 셀트리온(2.56%), 신한지주(0.12%) 등이 상승세인 반면 삼성전자(-1.26%), SK하이닉스(-0.77%), 삼성전자우(-0.55%), 현대차(-1.91%), 현대모비스(-1.39%) 등이 하락세로 거래를 마쳤다.같은 시간 코스닥지수는 전 거래일 대비 0.21포인트(0.03%) 오른 620.02에 거래됐다. 개인이 1183억원 순매수했으며 외국인과 기관이 각각 533억원, 590억원 순매도했다.헬릭스미스(0.28%), 케이엠더블유(1.38%), 펄어비스(0.21%), 스튜디오드래곤(4.13%) 등이 강세인 반면 셀트리온헬스케어(-0.33%), CJ ENM(-0.38%), 메디톡스(-2.21%), SK머티리얼즈(-1.71%), 휴젤(-1.18%), 에이치엘비(-2.31%) 등이 약세로 장을 끝냈다.류은혁 기자 ehryu@mt.co.kr▶ 고수들의 재테크 비법 ▶ 박학다식 \'이건희칼럼\' <저작권자 ⓒ \'성공을 꿈꾸는 사람들의 경제 뉴스\' 머니S, 무단전재 및 재배포 금지>머니S 관련뉴스해당 언론사에서 선정하며 언론사 페이지(아웃링크)로 이동해 볼 수 있습니다.임원희 세면대 어떻길래… ""여기다 소변 보니?""이상민 오열, 바비킴과 어떤 사이길래?신민아 김우빈 근황, ""눈꼴 시릴 정도로 달달해♥""박지선 일본일침 ""코에서 초고추장 나와 스시 먹일 것""숙주탕수육, 바삭한 식감 비결은 바로 OOO?좋아요0훈훈해요0슬퍼요0화나요0후속기사 원해요0기사제공 :']"
19,삼성전자, 2019-09-0315:56,이데일리 ,2019 에너지대전 개막…“에너지효율 혁신은 에너지 전환 필수 과제”,https://finance.naver.com/news/news_read.nhn?article_id=0004461342&office_id=018&mode=search&query=삼성전자&page=4,"['       2019 에너지대전 개막…“에너지효율 혁신은 에너지 전환 필수 과제”      기사입력2019-09-03 15:56기사원문좋아요훈훈해요좋아요 평가하기공감좋아요0훈훈해요0슬퍼요0화나요0후속기사 원해요0댓글6일까지 고양 킨텍스 개최370개 에너지기업 한곳에주영준 산업통상자원부 에너지자원실장이 3일 경기도 고양 킨텍스에서 열린 ‘2019 대한민국 에너지대전’ 개막식에서 축사하고 있다. 산업부 제공[이데일리 김형욱 기자] “에너지 효율 혁신은 깨끗하고 안전한 에너지로의 전환을 위해 반드시 거쳐야 할 과제다.”주영준 산업통상자원부 에너지자원실장은 3일 경기도 고양 킨텍스에서 열린 ‘2019 대한민국 에너지대전’ 개막식에서 이렇게 말했다. 대한민국 에너지대전은 올해로 39회째를 맞는 국내 최대 에너지 전시회다. 6일까지 역대 최대 규모인 307개 에너지기업이 참석해 에너지 효율 혁신을 주제로 자사 제품과 서비스를 소개한다.정부는 지난달 21일 에너지 효율 혁신전략을 발표하고 2030년까지 산업·건물·수송분야 에너지 소비를 현재보다 14% 줄이겠다는 목표를 세웠다. 이 과정에서 연관산업을 키워 6만9000명의 일자리도 창출한다는 계획이다.이번 전시회에서는 다양한 에너지 효율 제품이 모습을 드러냈다. 삼성전자(005930)와 LG전자(066570), 오텍케리어 등은 정보통신기술(ICT)을 접목한 에어컨, 공기청정기 등 고효율 가전을 소개했다. KT(030200)는 자사 최신 통합 에너지 솔루션을 선보였다. 3~6일 경기도 고양시 킨텍스에서 열리는 ‘2019 대한민국 에너지대전’ LG전자 부스에 전시된 토탈 에너지 솔루션. LG전자는 이 자리에서 멀티브이(Multi V)와 에너지저장시스템(ESS; Energy Storage System) 등 종합 공조 제품을 소개했다. LG전자 제공녹색건축 특별관에선 한국토지주택공사(LH) 등 9개 녹색건축 인증기관이 건축물 에너지 효율등급 인증제도를 소개한다. 한국광기술원 등은 스마트조명 특별관에서 고효율 조명기기를 선보였다.참여 중소기업의 수출 확대의 장도 마련했다. 주관사인 한국에너지공단은 국내 중소기업의 수출 지원을 위해 26개국 100여명의 해외 에너지기업 구매담당자를 초청해 상담과 수출 양해각서(MOU) 체결을 추진한다. 지난해 행사 때도 594억원 규모의 수출 계약 9건과 3건의 양해각서(MOU) 체결, 186건의 수출상담이 이뤄졌다. 현대에너지솔루션이나 신성이엔지, 두산퓨얼셀, 유니슨 등 친환경 에너지 기업들은 신·재생에너지관에서 태양광과 풍력발전, 수소와 연료전지 등 에너지원별 제품·기술을 소개한다. 업계 관계자를 위한 각종 세미나와 포럼, 교육행사, 자전거 발전(發戰) 같은 일반 참관객을 위한 체험행사도 준비돼 있다.16개 광역 지방자치단체가 참여해 자사 제품과 에너지 정책을 소개하는 지역 엑스포관과 한국남동발전을 비롯한 6개 발전사와 한국자지역난방공사, 인천국제공항공사 등이 참여한 공공에너지관도 마련됐다. 이날 개막식에는 주영준 실장을 비롯해 김창섭 에너지공단 이사장, 이감규 LG전자 부사장, 이재환 삼성전자 상무, 정필경 오텍캐리어 사장 등 관계자 200여명이 참석했다. 주영준 산업부 에너지자원실장은 “일방적 규제 대신 기업·소비자의 자발적 참여와 실천으로 고효율 제품·시설이 늘어나는 새 소비문화를 유도할 것”이라고 말했다.주영준 산업통상자원부 에너지자원실장(왼쪽 앞 2번째)을 비롯한 관ㄱ{ㅖ자가 3일 경기도 고양 킨텍스에서 열린 ‘2019 대한민국 에너지대전’에서 전시관을 둘러보고 있다. 산업부 제공김형욱 (nero@edaily.co.kr)네이버 홈에서 ‘이데일리’ 뉴스 [구독하기▶]꿀잼가득 [영상보기▶] , 청춘뉘우스~ [스냅타임▶]＜ⓒ종합 경제정보 미디어 이데일리 - 무단전재 & 재배포 금지＞이데일리 관련뉴스해당 언론사에서 선정하며 언론사 페이지(아웃링크)로 이동해 볼 수 있습니다.박훈 ""조국 딸 문제, 보고 있을 수 없어→이제 지지""홍준표 ""무기력한 야당 기대접어..윤석열檢 뿐""""보고있다정치검찰"" 조국 압수수색 맞선 새 검색어서경덕 교수 ""도쿄올림픽서 욱일기? 절호의 찬스"" 이유는?장동민 또..이번엔 미성년 출연자에 ""전화번호 달라""좋아요0훈훈해요0슬퍼요0화나요0후속기사 원해요0기사제공 :']"
