,회사명,날짜,언론사,기사제목,링크,본문
0,삼성전자, 2019-07-0723:59,노컷뉴스 ,"이재용, 오늘 일본 출국…현지 기업인들과 수출 규제 협의",https://finance.naver.com/news/news_read.nhn?article_id=0003246139&office_id=079&mode=search&query=삼성전자&page=1,"['       이재용, 오늘 일본 출국…현지 기업인들과 수출 규제 협의      기사입력2019-07-07 23:59기사원문좋아요훈훈해요좋아요 평가하기공감좋아요0훈훈해요0슬퍼요0화나요0후속기사 원해요0댓글[CBS노컷뉴스 최인수 기자]삼성전자 이재용 부회장이 일본의 한국 수출 규제 대응방안을 현지 업체들과 협의하기 위해 7일 오후 일본으로 출국했다.핵심소재 수입 차질과 재고 문제 등으로 반도체 생산 차질이 불가피한 상황에서 직접 사태의 진원지로 향한 것이다.일본의 규제 강도와 기간이 심각할 수 있다는 판단에 따라 현지 공급업체들과 구체적인 협력방안을 논의할 것으로 보인다.이 부회장은 이날 오후 김포공항에 도착해 취재진의 질문에 아무런 답변도 없이 하네다행에 올랐고, 도착 뒤 현지 공항에서도 무거운 표정만 지었던 것으로 전해졌다.앞서 이 부회장은 지난 5월 일본 도쿄를 찾아 현지 주요 이동통신사들과 5G 사업을 논의한 적이 있다.지난 4일 방한한 일본 소프트뱅크 그룹 손정의 회장과 만난 자리에서도 상당 시간 수출 규제 문제에 대해 의견을 주고받은 것으로 알려졌다.삼성전자 측은 이 부회장의 일본 출장 일정은 확인해줄 수 없다는 입장이다.한편, 이 부회장이 출국길에 오르기 전 이날 청와대 김상조 정책실장과 대기업 총수 간담회 일정에 참석했는지는 확인되지 않았다.청와대는 오는 10일 문재인 대통령과 30대 그룹 기업인 간담회를 계획하고 있다.▶ 확 달라진 노컷뉴스▶ 100만의 선택, 노컷뉴스 무료 구독 서비스▶ 어른들은 모르는 10대들의 이야기 apple@cbs.co.kr저작권자 © CBS 노컷뉴스 무단전재 및 재배포 금지노컷뉴스 관련뉴스해당 언론사에서 선정하며 언론사 페이지(아웃링크)로 이동해 볼 수 있습니다.황교안 ""이민 급증"" 주장에 민주 ""또 가짜뉴스""아베, 이번엔 수출규제 조치 이유로 \'대북 제재\' 거론인천 \'붉은 수돗물\', 발암물질 사태로 번지나(종합)베트남 여성 폭행사건…경찰 30대 한국인 남편 구속영장 신청靑 ""홍남기 부총리·김상조 정책실장, 대기업 총수 만나 日수출규제 논의""좋아요0훈훈해요0슬퍼요0화나요0후속기사 원해요0기사제공 :']"
1,삼성전자, 2019-07-0723:29,뉴스1 ,"닛케이 ""이재용 삼성전자 부회장 거래처와 협의차 방일""",https://finance.naver.com/news/news_read.nhn?article_id=0004080316&office_id=421&mode=search&query=삼성전자&page=1,"['       닛케이 ""이재용 삼성전자 부회장 거래처와 협의차 방일""      기사입력2019-07-07 23:29기사원문좋아요훈훈해요좋아요 평가하기공감좋아요0훈훈해요0슬퍼요0화나요0후속기사 원해요0댓글""반도체 소재 거래처에 일본 외 공장서 출하 요청할 듯""이재용 삼성전자 부회장이 7일 오후 서울 강서구 김포공항을 통해 일본으로 출국하고 있다. 이 부회장의 일본행은 지난 4일부터 시작된 일본 정부의 반도체 핵심소재 수출 규제 강화에 따른 해결 방안을 모색하기 위한 것으로 알려졌다. 2019.7.7/뉴스1 © News1 민경석 기자(서울=뉴스1) 김윤경 기자 = 일본 정부의 수출 규제와 관련한 논의를 위해 이재용 삼성전자 부회장이 7일 오후 일본을 방문했다고 니혼게이자이신문이 보도했다. 일본 정부는 지난 1일 플루오린 폴리이미드, 포토 레지스트, 불화수소 등 반도체 및 디스플레이용 핵심 소재 품목의 한국 수출 규제 강화를 예고했고 4일 이를 실시했다. 일본 경제산업성은 이들 품목을 한국으로 수출하는 것이 그동안은 포괄적 허가 대상(일명 화이트 국가)이었지만 앞으론 개별 심사를 받아야 한다고 발표했다. 삼성전자는 이들 소재의 조달이 어려워지면 감산할 수밖에 없는 상황이다. 닛케이는 이재용 부회장이 이처럼 생산에 영향을 받는 것을 피하기 위해 거래처 기업 간부를 만나 일본 외의 공장에서 한국으로 소재를 출하할 것을 요청할 것으로 보인다고 전했다. 이에 앞서 청와대는 이날 주요 기업 관계자를 불러 한국 경제를 둘러싼 불확실성에 대해서 의견을 교환했다. 현대자동차그룹, SK그룹, LG그룹 등의 총수들이 참석, 김상조 청와대 정책실장과 홍남기 경제부총리 겸 기획재정부 장관과 일본의 수출 규제에 대한 대책을 물색했으며 닛케이는 일본을 방문한 이재용 부회장이 참석하지 않았다고 전했으나 이 부회장이 탄 비행기 시간이 오후 6시40분으로 알려진 점을 감안할 때 회동에 참석한 뒤 출국했다는데 무게가 쏠리고 있다.  이 부회장이 참석했다면 이날 오찬에는 5대 그룹 총수 중 신동빈 롯데그룹 회장을 제외하고 이 부회장을 비롯해 정의선 현대차그룹 수석부회장, 최태원 SK그룹 회장, 구광모 LG그룹 회장 등 4대 그룹 총수가 모인 것이다.s914@news1.kr▶ [ 크립토허브 ] ▶ [ 해피펫 ]▶ 네이버 메인에서 [뉴스1] 구독하기![© 뉴스1코리아(news1.kr), 무단 전재 및 재배포 금지]뉴스1 관련뉴스해당 언론사에서 선정하며 언론사 페이지(아웃링크)로 이동해 볼 수 있습니다.불매운동에도…아사히·기린·삿포로 日맥주 무풍지대박원순 ""대통령, 호칭부터 바꿔야…대권경쟁자? 나자신""15년만에 DNA검사로 7차례 성폭행 들통보행자 치고 달아난뒤 ""감기약 먹어 몰랐다""도난 車에 받힌 SUV 다리밑 추락 3명 부상좋아요0훈훈해요0슬퍼요0화나요0후속기사 원해요0기사제공 :']"
2,삼성전자, 2019-07-0723:02,세계일보 ,증권시장서 저평가된 대형주 ‘수두룩’,https://finance.naver.com/news/news_read.nhn?article_id=0003378469&office_id=022&mode=search&query=삼성전자&page=1,"['       증권시장서 저평가된 대형주 ‘수두룩’      기사입력2019-07-07 23:02기사원문좋아요훈훈해요좋아요 평가하기공감좋아요0훈훈해요0슬퍼요0화나요0후속기사 원해요0댓글상위 60개 순자산비율 1배 이하 / 삼성전자 1.29·현대차 0.55배 불과 / 미·중 무역분쟁 따른 증시 부진 탓 / 주식형 펀드 수익률도 3.49% 그쳐   국내 주식시장의 대형주 중 절반 이상의 주가가 자산가치 이하로 떨어진 것으로 나타났다. 미·중 무역분쟁 장기화로 국내 증시가 둔화한 것이 원인으로 꼽힌다. 덩달아 국내 주식형 펀드 수익률도 주변국보다 낮게 나타나면서 부진한 흐름을 보이고 있다.  7일 금융정보업체 에프앤가이드 등에 따르면 지난주 기준 코스피 시장 시가총액 100위 이내의 종목 중 60개 종목이 주가순자산비율(PBR)이 1배 이하인 것으로 나타났다.  PBR는 주가가 순자산에 비해 주당 몇 배로 거래되고 있는지를 보여주는 지표다. PBR가 1배 미만이면 주가가 기업의 자산가치(청산가치)에 못 미친다는 것을 의미한다. 반대로 PBR가 몇 배이면 주식이 자산가치에 비해 고평가 되는 것으로 추정할 수 있다.  시가총액 상위 10개 종목을 분석하면 지난 5일 장마감 기준 PBR가 가장 낮은 기업은 POSCO로 0.45배였다. 그 다음은 SK텔레콤(0.84배), 현대모비스 (0.72배), 신한지주(0.58배), 현대차(0.55배)로 나타났다.  국내 핵심산업인 반도체 분야 대표주자도 고전을 면치 못했다. 하이닉스가 1배로 나타났고, 삼성전자는 1.29배였다.  금융사 중에서는 신한지주를 제외하고 하나금융지주(0.42배), 기업은행(0.43배), KB금융(0.49배) 등이 부진을 면치 못했다.  국내 코스피 시가총액 상위종목 100위 중 PBR가 가장 높은 기업은 셀트리온으로 10.47배에 달했다.  코스피 시장 내 종목들의 PBR가 낮은 이유로는 국내 증시 둔화가 거론되고 있다. 경기둔화 여파로 기업의 수익성이 나빠진 탓이다.  일각에서는 코스피 시장 전체 PBR가 글로벌 금융위기 당시 저점인 0.80배를 밑돌 수 있다고 우려를 나타냈다.  국내 증시가 둔화되면서 덩달아 국내 주식형 펀드 수익률도 고전 중이다.  펀드정보업체 에프앤가이드에 따르면 지난주 중 903개 국내 주식형 펀드의 올해 평균 수익률은 3.49%로 나타났다. 주변국보다 수익률이 낮다.  같은 기간 중국 펀드의 수익률이 27.72%로 가장 높았고, 러시아 편드(27.34%), 미국(20.94%), 브라질(16.85%), 일본(9.79%), 베트남(4.94%)이 뒤를 이었다.  정명지 삼성증권 연구원은 “최근에 글로벌 증시가 올랐지만 국내 증시가 같이 오르지 못하면서 현재 코스피지수의 실적 대비 주가 수준은 2008년 금융위기 수준으로 떨어졌다”고 말했다.   김범수 기자 sway@segye.comⓒ 세상을 보는 눈, 세계일보세계일보 관련뉴스해당 언론사에서 선정하며 언론사 페이지(아웃링크)로 이동해 볼 수 있습니다.""경찰공무원 좋아요 현장출동은 못해요, 공대는 싫어요 직장은 원해요""""뼛조각 하나 안 나와...고유정, 집유로 풀려날 수도""""여행 가서 \'각방\' 쓰자고 했다가 남친에게 차였습니다""\'송송 커플\' 이혼하는데 왜 \'송중기 父\'가 주목받나?""文정부, 주 36시간 취업자 20만명 줄어""좋아요0훈훈해요0슬퍼요0화나요0후속기사 원해요0기사제공 :']"
3,삼성전자, 2019-07-0722:49,MBC ,"이재용, 수출규제 대응 논의차 日방문…질문엔 답 안 해",https://finance.naver.com/news/news_read.nhn?article_id=0000962021&office_id=214&mode=search&query=삼성전자&page=1,"[""       이재용, 수출규제 대응 논의차 日방문…질문엔 답 안 해      기사입력2019-07-07 22:49기사원문좋아요훈훈해요좋아요 평가하기공감좋아요0훈훈해요0슬퍼요0화나요0후속기사 원해요0댓글일본 정부가 최근 한국에 대한 수출규제에 나선 가운데, 이재용 삼성전자 부회장이 오늘 저녁 김포공항을 출발해 밤 9시쯤 일본 하네다 공항에 도착했습니다.지난 4일 일본이 반도체 제조 등에 필요한 핵심 소재 등의 수출 규제에 나선지 사흘만입니다.일본에 도착한 이 부회장은 한국 취재진의 방문 일정과 누굴 만난지에 대한 질문에 대해 일절 답하지 않았습니다.업계에서는 이 부회장이 일본 현지 인맥과 경제인들을 만나 수출 규제를 풀 해결책을 찾아보려는 것으로 해석하고 있습니다.이 부회장은 지난 4일 방한한 일본 소프트뱅크 그룹의 손정의 회장과 만난 자리에서도 일본 수출 규제에 대해 논의한 것으로 알려졌습니다.강연섭 기자 (deepriver@mbc.co.kr)[저작권자(c) MBC (www.imnews.com) 무단복제-재배포 금지]▶ 네이버 홈에서 [MBC뉴스] 채널 구독하기▶ [엠빅뉴스] '유네스코 세계유산' 먼저 된 '한국 서원', '중국 서원'과 뭐가 다르길래..  ▶ [14F] 광주 '데이트폭력' 사건의 충격적인 진실Copyright(c) Since 1996, MBC&iMBC All rights reserved.MBC 관련뉴스해당 언론사에서 선정하며 언론사 페이지(아웃링크)로 이동해 볼 수 있습니다.김상조·홍남기 재벌 총수들 회동…이재용은 일본行日 아베도 '북한' 관련 시사…야당은 반발윤석열 청문회 '수사 개입 의혹' 여야 격돌 예고北 '최인국 월북'…분단 국가 굴절된 가족사'말 잘 못 알아들어서'…수차례 폭언·폭행좋아요0훈훈해요0슬퍼요0화나요0후속기사 원해요0기사제공 :""]"
4,삼성전자, 2019-07-0722:36,서울경제 ,"이재용, 日하네다 공항 도착...""수출 규제 대응 논의""",https://finance.naver.com/news/news_read.nhn?article_id=0003582198&office_id=011&mode=search&query=삼성전자&page=1,"['       이재용, 日하네다 공항 도착...""수출 규제 대응 논의""      기사입력2019-07-07 22:36기사원문좋아요훈훈해요좋아요 평가하기공감좋아요0훈훈해요0슬퍼요0화나요0후속기사 원해요0댓글반도체 소재 \'재고 비상\'에 7일 저녁 긴급 출국신동빈도 일본行···금융권·재계 관계자들 만나이재용 삼성전자 부회장(가운데)이 일본 정부의 대(對)한국 수출 규제에 대한 대책 논의를 위해 7일 밤 일본 하네다공항에 도착하고 있다. /도쿄=연합뉴스[서울경제] 이재용 삼성전자 부회장이 일본 정부의 한국 수출 규제 강화에 대응하기 위해 7일 저녁 일본을 방문했다. 이번 ‘긴급 출국’은 최근 반도체 소재 재고가 몇 주를 버틸 정도밖에 남지 않은 것으로 알려지면서 예상보다 사태가 심각해질 수 있다는 판단에 따른 것으로 보인다.이 부회장은 이날 오후 9시께 별도의 수행원 없이 하네다공항에 도착했다. 일본 방문 일정과 누구를 만날지 등에 대한 기자들의 질문에는 일절 답하지 않았다.또 이 부회장은 이날 앞서 진행된 김상조 청와대 정책실장 등과 주요 기업 총수와의 만남에 참석했는지에 대한 질문에도 대답하지 않았다. 이후 그는 대기하던 차량에 탑승한 채 공항을 떠났다. 일본 재계와 네트워크를 구축한 것으로 알려진 이 부회장은 일본 현지의 경제인들과 만나 일본 정부의 이번 조치에 대한 대응책을 논의할 것으로 전해졌다. 이 부회장은 지난해 최소 2차례 일본을 방문했고, 올해 들어서도 지난 5월 도쿄에서 현지 양대 이동통신 사업자인 NTT도코모, KDDI의 경영진을 만나는 등 일본 재계와 탄탄한 네트워크를 구축하고 있다. 또 지난 4일 방한한 일본 소프트뱅크 그룹의 손정의 회장과 만난 자리에서도 일본 수출 규제에 대해 논의한 것으로 알려졌다. 삼성전자 관계자는 “일본 출장의 구체적인 일정은 확인해줄 수 없다”고 밝혔다.한편, 신동빈 롯데그룹 회장도 지난 5일 일본으로 출국한 것으로 알려졌다. 이 같은 해외 출장 일정 때문에 신 회장은 7일 홍남기 경제부총리, 김상조 청와대 정책실장과 주요 기업 총수들과의 간담회에 참석하지 않았다. 신 회장은 주말과 일요일을 일본에서 머물며 금융권과 재계 관계자 등을 만난 것으로 전해졌다. 롯데의 경우, 일본의 이번 대(對)한국 수출규제와 직접 연관된 품목이 없어 신 회장이 이 문제를 논의하지는 않았겠지만, 일본 관계자들을 만난 자리에서 자연스럽게 이와 관련된 이야기가 오갔을 것이라는 관측이 나오고 있다.  /박민주기자 parkmj@sedaily.com[서울경제 바로가기]▶ 텔레그램으로 서울경제 구독하기  | ▶ 네이버TV로 서울경제썸 구독하기▶ 네이버 메인에서 \'No. 1 뉴스\' 서울경제를 만나보세요저작권자 ⓒ 서울경제, 무단 전재 및 재배포 금지서울경제 관련뉴스해당 언론사에서 선정하며 언론사 페이지(아웃링크)로 이동해 볼 수 있습니다.물증 있나...아베 \'경제보복 = 北관련\' 시사아베 최측근, 한국 수출 화학물질 \'북한행\' 암시 발언 논란日 참의원 선거전 돌입···아베, 개헌선 확보 사활아베, 한국 상대 경제보복에 ""신뢰관계 조치 수정한 것""···강제징용 후속 조치 시사日 아베, 韓 반도체 경제보복 조치에 ""WTO 규칙에 맞다···신뢰관계 조치 수정한 것""좋아요0훈훈해요0슬퍼요0화나요0후속기사 원해요0기사제공 :']"
5,삼성전자, 2019-07-0722:21,KBS ,"이재용, 수출규제 대응 논의차 日방문",https://finance.naver.com/news/news_read.nhn?article_id=0010719468&office_id=056&mode=search&query=삼성전자&page=1,"['       이재용, 수출규제 대응 논의차 日방문      기사입력2019-07-07 22:21기사원문좋아요훈훈해요좋아요 평가하기공감좋아요0훈훈해요0슬퍼요0화나요0후속기사 원해요0댓글 일본 정부가 최근 한국에 대한 수출 규제에 나선 가운데 이재용 삼성전자 부회장이 오늘 밤 항공기 편으로 하네다공항에 도착했습니다. 이날 오후 9시쯤 한국 취재진들 앞에 모습을 드러낸 이재용 부회장은 일본 방문 일정과 누구를 만날지 등에 대한 질문에 답하지 않았습니다.  또 김상조 청와대 정책실장 등과 주요 기업 총수와의 만남 참석 여부에 대해서도 대답하지 않은 채 공항을 떠났습니다. 이재용 부회장의 이날 방문은 일본이 지난 4일부터 반도체 제조 등에 필요한 핵심 소재 등의 수출 규제 조치를 취하며 한국에 대해 본격적인 보복에 나선 가운데 이뤄져 관심을 끌고 있습니다.  일본 재계와 네트워크를 구축한 것으로 알려진 이 부회장은 일본 현지의 경제인들과 만나 일본 정부의 이번 조치에 대한 대응책을 논의할 것으로 전해졌습니다. 이 부회장은 지난 4일 방한한 일본 소프트뱅크 그룹의 손정의 회장과 만난 자리에서도 일본 수출 규제에 대해 논의한 것으로 알려졌습니다. [사진 출처 : 연합뉴스]정아연 기자 (niche@kbs.co.kr)▶ 남·북·미 정상, 역사적 첫 만남▶ 네이버 채널 KBS뉴스 구독! 시원하게 털어드립니다▶ ‘TV보다 ㄹㅇ’ 당신의 진짜 뉴스 ‘케이야’KBS 관련뉴스해당 언론사에서 선정하며 언론사 페이지(아웃링크)로 이동해 볼 수 있습니다.[인사청문 20년] \'도덕성 검증\' 잣대 손바닥 뒤집듯일본 규제, 비메모리 분야 영향 불가피…대응 방안은?인천서 \'붉은 수돗물\' 이어 \'비린내 수돗물\'…주민 분통""한국어 서툴다""…베트남인 아내 \'무차별 폭행\' 긴급체포""우리가 가족입니다""…위탁 부모들의 \'친권\' 설움좋아요0훈훈해요0슬퍼요0화나요0후속기사 원해요0기사제공 :']"
6,삼성전자, 2019-07-0722:15,경향신문 ,"홍남기·김상조, 현대차·SK·LG 총수와 회동…정부 총력 대응",https://finance.naver.com/news/news_read.nhn?article_id=0002950179&office_id=032&mode=search&query=삼성전자&page=1,"['       홍남기·김상조, 현대차·SK·LG 총수와 회동…정부 총력 대응      기사입력2019-07-07 22:15기사원문좋아요훈훈해요좋아요 평가하기공감좋아요0훈훈해요0슬퍼요0화나요0후속기사 원해요0댓글ㆍ‘경제 투톱’, 10일 문 대통령과 총수 회동 앞서 의견 교환ㆍ이낙연 총리, 장관들 소집…‘강제징용 TF’도 잇단 회의ㆍ청, 대통령 메시지를 ‘최종 카드’로 삼고 시점·수위 고심이낙연 국무총리, 홍남기 부총리, 김상조 정책실장(왼쪽부터)정부가 일본 정부의 수출규제 조치에 맞서 총력 대응을 펴고 있다. 이낙연 국무총리와 홍남기 부총리 겸 기획재정부 장관 등 내각은 주말을 반납한 채 지난 6일 머리를 맞댔고, 홍 부총리와 김상조 청와대 정책실장 등은 7일 주요 기업 총수 등과 전후 상황을 공유하며 대응 전략을 논의했다. 오는 10일 문재인 대통령과 대기업 총수의 회동을 앞두고 범정부 차원의 행보가 본격화하고 있다.청와대는 이날 홍 부총리와 김 실장이 주요 기업 관계자들과 일본의 수출규제 대책 논의를 위한 간담회를 가졌다고 밝혔다.고민정 청와대 대변인은 기자들에게 문자메시지를 보내 이같이 밝히며 “대외 경제상황의 불확실성에 대한 의견을 교환하고 향후 적극적으로 긴밀한 소통을 이어가기로 했다”고 설명했다. 이날 간담회에는 정의선 현대차그룹 수석부회장, 최태원 SK그룹 회장, 구광모 LG그룹 회장 등이 참석했다. 당초 면담에 참석할 것으로 예상됐던 5대 그룹 총수 중 이재용 삼성전자 부회장과 신동빈 롯데그룹 회장은 출장 일정 등으로 불참한 것으로 전해졌다.문 대통령의 대기업 총수 간담회에 앞서 홍 부총리와 김 실장 등 ‘경제 투톱’이 재계 리더들과 긴급 회동을 가진 것은 상황이 급박하다는 방증으로 해석된다. 아베 신조(安倍晋三) 일본 총리가 연일 ‘정치적 도발’ 의도가 있는 메시지를 내놓고 있는 데 대한 맞대응이 불가피하지만, 한편으로는 불안감에 휩싸인 시장·기업과 협력할 필요성도 더욱 커지고 있기 때문이다.청와대는 지난 4일 국가안전보장회의(NSC) 상임위원회 개최에 이어 문 대통령의 대기업 총수 간담회 일정 예고, 홍 부총리·김 실장의 움직임 등을 통해 일본의 수출규제 사태를 최우선 현안으로 다루고 있다. 하지만 이와 관련한 문 대통령의 공식적이고 직접적인 언급은 아직 한 차례도 나오지 않았다. 일본의 정치적 공세에 성급한 정면 대응 대신 대통령 메시지를 ‘마지막 카드’로 삼고 적절한 시점과 수위를 고심 중인 것으로 분석된다. 이날 청와대가 홍 부총리·김 실장과 대기업 관계자의 긴급 간담회 사실을 알리면서도, 참석 기업과 논의한 내용 등을 구체적으로 설명하지 않은 것도 이 같은 고민이 반영된 것으로 풀이된다.앞서 6일에는 이 총리가 정부서울청사에서 일본의 수출규제 사태 관계장관을 소집해 정부 대응 방안을 집중 검토했다.홍 부총리를 비롯해 강경화 외교부·성윤모 산업통상자원부 장관 등이 참석한 ‘주요 현안 간담회’에서 이 총리는 9일부터 11일까지 사흘간 실시되는 국회 대정부질문에 대비해 현안을 점검했다. 특히 정부는 일본의 반도체 핵심 부품·소재 수출규제 사태가 경제 분야는 물론 외교·안보, 사회·문화 분야에까지 파급력이 큰 만큼 대정부질문에서도 이 문제가 핵심 쟁점이 될 것으로 보고 있다. 이례적으로 주말에 부처 장관을 소집해 범정부 차원의 대응 원칙과 전망을 공유한 것도 이 때문이다.지난해 대법원의 ‘강제징용 배상 판결’ 이후 총리실과 외교부, 산업부, 행정안전부, 법무부 등 관계부처가 참여하는 강제징용 관련 태스크포스(TF)도 최근 잇달아 리스크 대응 회의 등을 열어 일본의 수출규제 대응 방안을 논의한 것으로 알려졌다.정환보 기자 botox@kyunghyang.com▶ 네이버 메인에서 경향신문 받아보기 ▶ 두고 두고 읽는 뉴스 ▶ 인기 무료만화©경향신문(www.khan.co.kr), 무단전재 및 재배포 금지경향신문 관련뉴스해당 언론사에서 선정하며 언론사 페이지(아웃링크)로 이동해 볼 수 있습니다.한·일 갈등 \'소방수\'로 나선 이재용최종구 ""일 보복조치, 금융분야 확대돼도 대처에 어려움 없다""""감정적 대응보다 상황 악화 막는 데 힘 모아야""""일 보복조치는 쇼크요법…효과 의문, 대립 더 확대되기 전 양국 협의 필요""""한국, 징용문제도 국제 약속 안 지키는데…"" 아베, 대북제재 이행 문제까지 끌어들여좋아요0훈훈해요0슬퍼요0화나요0후속기사 원해요0기사제공 :']"
