,회사명,날짜,언론사,기사제목,링크,본문
17,삼성전자, 2019-06-2016:40,한국경제 ,"[마켓인사이트]사업모델 특례상장 1호 플리토 “언어 빅데이터 수요 무궁무진, MS...",https://finance.naver.com/news/news_read.nhn?article_id=0004162730&office_id=015&mode=search&query=삼성전자&page=2,"['       [마켓인사이트]사업모델 특례상장 1호 플리토 “언어 빅데이터 수요 무궁무진, MS·텐센트가 고객”      기사입력2019-06-20 16:40기사원문좋아요훈훈해요좋아요 평가하기공감좋아요0훈훈해요0슬퍼요0화나요0후속기사 원해요0댓글7월 17일 코스닥 상장, 사업모델 특례상장 1호스마트 스피커, 액션 카메라 등 AI 딥러닝 위한 언어 빅데이터 생성 및 판매마이크로소프트, 텐센트, 삼성전자, 카카오 등 고객사로 확보  ≪이 기사는 06월20일(14:48) 자본시장의 혜안 ‘마켓인사이트’에 게재된 기사입니다≫“스마트 스피커, 액션 카메라, 동시통역기 등 인공지능(AI)으로 음성을 인식해 서비스하는 여러 기기가 우리의 생활 곳곳에 자리잡고 있습니다. AI의 음성인식 기능을 높이는데 필수인 언어 빅데이터를 생성·판매하는 플리토가 성장할 수 있는 기반입니다.” 코스닥시장 상장을 앞둔 플리토의 이정수 대표이사(사진)는 20일 한국경제신문과의 인터뷰에서 “미국 마이크로소프트, 중국 텐센트와 바이두, 일본의 엔티티 도코모 등 외국기업을 상대로 회사 매출의 절반 가까이를 올리고 있다”며 “국내에서는 삼성전자, 현대자동차, 네이버, 카카오 등을 고객사로 확보했다”고 말했다. 국내에서 유일한 언어 빅데이터 기업인 플리토는 독창적인 사업을 하는 회사에게 상장 문턱을 낮춰주는 ‘사업모델 특례상장’ 1호로 다음달 17일 코스닥에 입성하게 된다. 회사 이름은 나비처럼 가볍게 날아다닌다(flit)는 뜻의 동사에 어디로 향한다는 뜻의 전치사 to를 합쳐 만들었는데, 언어의 장벽을 넘어 자유롭게 소통하는 데 기여하겠다는 회사 목표를 반영했다.  플리토는 집단지성을 활용해 25개국 언어의 빅데이터를 생성, AI 사업을 하는 국내외 기업들에게 판매하는 사업에 주력하고 있다. AI가 더 정교하게 음성을 인식하게 하려면, 언어 빅데이터를 활용해 AI를 ‘교육’시켜야 한다. 이 대표는 “AI의 음성인식 기능 향상은 얼마나 많은 언어 빅데이터를 학습했는지에 달려있기 때문에, 무궁무진한 영역에 걸친 빅데이터가 계속 필요하다”며 “AI 기반 음성인식 산업이 급속도로 성장한 2017년부터 현재까지, 호주의 언어 빅데이터 기업인 에이펜(Appen)의 주가는 20~30배 뛰었다”고 말했다. 다수의 참여자(누적 가입자 수 1030만명)가 소정의 보상을 받고 언어 빅데이터를 생성·검수하는데 참여하도록 유도하는 집단지성 기반 사업모델도 장점으로 내세웠다. 이 대표는 “집단지성을 활용하면 빅데이터 생성 속도가 빠르고, 드는 비용도 비교적 저렴한 편”이라고 말했다.  2012년 8월 이 대표가 창업한 플리토는 그 다음달에 기업가치 30억원을 전제로 첫 투자를 유치했고, 이제는 최대 기업가치 1190억원(희망 공모가 범위의 최상단 기준)을 목표로 코스닥 상장에 도전하고 있다. 창립 7년만에 시장에서 인정하는 기업가치가 40배 뛰었다. 이 대표는 최근 문재인 대통령의 북유럽 순방에 경제사절단으로 동행하기도 했다. 초고속으로 성장한 스타트업 중 하나로 꼽히지만, 늘 순탄한 길만 걷지는 않았다는게 이 대표의 설명이다. 그는 “한국의 작은 스타트업이 고객사를 확보하기란 쉽지 않았다”며 “AI 관련 행사를 돌아다니며 참가자들의 명찰을 유심히 보다가, 고객사가 될 만하다 싶으면 붙들고 말을 붙이는게 일이었던 때도 있었다”고 말했다.   회사는 지난해 매출 35억원에 영업적자 17억원, 순적자 38억원을 냈다. 이 대표는 “늦어도 내년에는 흑자전환을 목표로 하고 있다”며 “공모로 조달한 자금은 미국 시장 공략을 위한 지사 설립에 쓰겠다”고 말했다.  플리토의 희망 공모가 범위는 1만9000~2만3000원으로 다음달 1~2일 수요예측(기관투자가 대상 사전청약)을 거쳐 확정한다. 같은달 8~9일 일반 청약을 받으며, 기업공개(IPO) 대표주관사는 한국투자증권이다. 이고운 기자 ccat@hankyung.com▶ 네이버에서 한국경제 뉴스를 받아보세요▶ 한경닷컴 바로가기  ▶ 모바일한경 구독신청 ⓒ 한국경제 & hankyung.com, 무단전재 및 재배포 금지한국경제 관련뉴스해당 언론사에서 선정하며 언론사 페이지(아웃링크)로 이동해 볼 수 있습니다.술 먹은 다음 날 효과 제대로…5천만개 \'대박\'났다""좋은 시절 다 갔다""…삼성전자 직원들 \'비상\'""서울대 나오면 뭐하나, 기대에 못 미치는데…"" 저격""경제위기 때 집 산다고?"" …\'내 집 마련\' 현실 조언""정책 실패해놓고 이제 와서 우리 탓""…불만 폭발좋아요0훈훈해요0슬퍼요0화나요0후속기사 원해요0기사제공 :']"
18,삼성전자, 2019-06-2016:36,파이낸셜뉴스 ,"[fn마감시황]코스피, 기관 매수세에 2130선 회복...코스닥 1.34%↑",https://finance.naver.com/news/news_read.nhn?article_id=0004248477&office_id=014&mode=search&query=삼성전자&page=2,"['       [fn마감시황]코스피, 기관 매수세에 2130선 회복...코스닥 1.34%↑      기사입력2019-06-20 16:36기사원문좋아요훈훈해요좋아요 평가하기공감좋아요0훈훈해요0슬퍼요0화나요0후속기사 원해요0댓글  코스피가 기관의 매수세에 2130선을 회복했다.  20일 코스피는 전일대비 6.51포인트(0.31%) 오른 2131.29를 기록했다. 코스피는 전일대비 3.0포인트(0.14%) 내린 2121.78에 개장해 오름폭을 확대했다. 간밤 뉴욕증시에서 주요지수는 연방준비제도(Fed·연준)가 향후 기준금리를 인하할 수 있다는 가능성을 시사하면서 소폭 상승했다.  이날 코스피에서 기관은 1601억원을 순매수 했다. 반면 외국인과 개인은 각각 128억원, 1485억원을 순매도 했다.  시가총액 상위종목은 대부분 올랐다. 삼성전자, SK하이닉스, 현대차, 셀트리온, LG화학은 1% 안팎 상승했다. 신한지주, LG생활건강, SK텔레콤은 하락 마감했다. 업종별로도 오름세가 강했다. 전기·전자, 기계, 의약품, 유통, 증권, 의료정밀, 운수장비 등이 상승한 반면 통신, 금융, 건설 등은 약세를 보였다.  코스닥지수는 1%대 상승했다. 이날 코스닥지수는 전일대비 9.61포인트(1.34%) 상승한 727.32를 기록했다. 코스닥시장에서 외국인과 기관은 각각 838억원, 523억원을 순매수 했다. 반면 개인은 1247억원을 순매도 했다.  한편, 서울외환시장에서 원·달러환율은 전일대비 14.0원 내린 1162.1원에 거래를 마쳤다. mjk@fnnews.com 김미정 기자   ▶ 헉! 소리나는 스!토리 뉴스 [헉스]▶ 클릭해, 뉴스 들어간다 [뉴스쿨] ▶ 세상에 이런일이 [fn파스]  ※ 저작권자 ⓒ 파이낸셜뉴스. 무단 전재-재배포 금지파이낸셜뉴스 관련뉴스해당 언론사에서 선정하며 언론사 페이지(아웃링크)로 이동해 볼 수 있습니다.\'제주 전 남편 살해\' 고유정, 구치소에서 수감된 뒤 행동이..남편이 죽자 정자 채취한 아내, 7개월만에 돌연..사고로 사망한 예비신부.. 친엄마 30년만에 나타나 한 말이직장 여성동료의 시스루 패션보다 꼴불견인 옷 1위나경원 \'보수통합\' 발언에 폭발한 바른미래당 ""감히..""좋아요0훈훈해요0슬퍼요0화나요0후속기사 원해요0기사제공 :']"
19,삼성전자, 2019-06-2016:23,아이뉴스24 ,"[마감] 코스피, 美 금리인하 기대에 한달반 來 '최고치'",https://finance.naver.com/news/news_read.nhn?article_id=0000497743&office_id=031&mode=search&query=삼성전자&page=2,"['       [마감] 코스피, 美 금리인하 기대에 한달반 來 \'최고치\'      기사입력2019-06-20 16:23기사원문좋아요훈훈해요좋아요 평가하기공감좋아요0훈훈해요0슬퍼요0화나요0후속기사 원해요0댓글코스닥도 1% 상승[아이뉴스24 한수연 기자] 코스피가 무역분쟁 완화 시그널과 미국 금리인하 기대감에 2130선까지 오르며 40여일 만에 최고치를 또 경신했다. 원화 가치 급등으로 원/달러 환율은 1160원대까지 떨어졌다.20일 코스피 지수는 전 거래일 대비 0.31%(6.51포인트) 오른 2131.29에 거래를 마쳤다. 전일에 이어 종가 기준 지난 5월8일(2168.01) 이후 40여일 만의 최고치를 또 경신한 것이다.20일 코스피가 무역분쟁 완화 시그널과 미국 금리인하 기대감에 2130선까지 오르며 40여일 만에 최고치를 또 경신했다. 서울 여의도 증권시장 시황판. [사진=아이뉴스24DB]장 초반 차익 실현 매물에 이날 코스피는 하락 출발했지만 오전 11시를 기점으로 상승 전환해 장 마감까지 강세를 지속했다.19일(현지시간) 미국 중앙은행인 연방준비제도(연준·Fed)는 금리를 동결했다. 그러나 통화정책 성명에서 금리동결 기조를 뜻하는 \'인내\'(patient)란 표현을 삭제하며 향후 금리인하를 예고했다.이경민 대신증권 연구원은 ""미국 연방공개시장위원회(FOMC) 회의 결과 발표로 미국의 금리인하에 기대감이 반영된 가운데 중국 증시까지 강세를 보이면서 투자심리가 개선됐다""고 설명했다.이날 유가증권시장에서 기관은 1천595억원 순매수를 기록하며 지수를 견인했다. 반면 개인과 외국인은 각각 1천483억원, 외국인은 123억원어치의 주식을 내다 팔았다.업종별로는 대부분이 상승했다. 의료정밀이 3% 가까이 오른 가운데 의약품도 1% 강세를 보였다. 전기가스업, 서비스업, 유통업, 전기전자, 제조업, 섬유의복, 화학, 운수장비, 기계 등은 강보합세를 기록했다. 반면 금융업, 통신업, 보험, 은행, 종이목재와 건설업은 약보합권에 머물렀다.시가총액 상위종목에서는 셀트리온과 LG화학이 1% 이상 오른 가운데 삼성전자, SK하이닉스, 현대차 등이 강보합세를 나타냈다. 반면 신한지주는 2% 이상 떨어졌고 LG생활건강과 SK텔레콤, KB금융 등은 약보합세를 보였다.코스닥도 1% 넘게 뛰었다. 이날 코스닥 지수는 전 거래일 대비 1.34%(9.61포인트) 상승한 727.32에 장을 종료했다. 719.54로 상승 출발한 코스닥은 강세 흐름을 지속했다.코스닥 시장에서는 기관이 838억원, 외국인이 523억원을 각각 순매수했다. 개인은 1천248억원어치의 주식을 내던졌다.한편 이날 서울 외환시장에서 원/달러 환율은 전일보다 1.19%(14.0원) 내린 1162.1원에 거래를 마감했다.한수연기자 papyrus@inews24.com▶네이버 채널에서 \'아이뉴스24\'를 구독해주세요.▶아이뉴스TV에서 부동산 고수를 만나보세요.[ⓒ 아이뉴스24 무단전재 및 재배포 금지]아이뉴스24 관련뉴스해당 언론사에서 선정하며 언론사 페이지(아웃링크)로 이동해 볼 수 있습니다.방통위, 2019 방송 공동제작 국제 콘퍼런스 개최디지털 성범죄 피해, ICT로 방지한다[스톡Why] 매직마이크로, 블록체인 투자 지연… 상장도 \'아슬아슬\'넥슨, 이강인 선수와 \'피파온라인4\' 홍보모델 계약[핫클립]직접 윈도 태블릿 노트북PC 만들기좋아요0훈훈해요0슬퍼요0화나요0후속기사 원해요0기사제공 :']"
0,삼성전자, 2019-06-2016:19,디지털타임스 ,"코스피, 美 FOMC 금리인하 기대에 2130선 회복…코스닥, 1% 이상 ↑",https://finance.naver.com/news/news_read.nhn?article_id=0002534854&office_id=029&mode=search&query=삼성전자&page=3,"['       코스피, 美 FOMC 금리인하 기대에 2130선 회복…코스닥, 1% 이상 ↑      기사입력2019-06-20 16:19기사원문좋아요훈훈해요좋아요 평가하기공감좋아요0훈훈해요0슬퍼요0화나요0후속기사 원해요0댓글 [디지털타임스 김민주 기자] 코스피가 미국 연방시장공개위원회(FOMC) 회의 결과 발표로 금리 인하 기대가 커지면서 2130선을 회복했다. 20일 코스피는 전 거래일보다 6.51포인트(0.31%) 오른 2131.29로 거래를 마쳤다. 종가 기준으로 지난 5월 8일(2168.01) 이후 40여일 만의 최고치다.지수는 전장보다 3.00포인트(0.14%) 내린 2121.78로 출발해 우상향 곡선을 그렸다. 이날 코스피시장에서는 기관이 1595억원어치를 순매수했다. 반면 외국인은 122억원, 개인은 1483억원을 각각 순매도했다.이경민 대신증권 연구원은 ""미국의 연방공개시장위원회(FOMC) 회의 결과 발표로 미국의 금리 인하에 대한 기대감이 반영된 가운데 중국 증시가 강세를 보이면서 투자심리가 개선됐다""고 말했다.시가총액 상위 종목 중에서는 삼성전자(0.33%), SK하이닉스(0.15%), 현대차(0.36%), 셀트리온(1.18%), LG화학(1.00%) 등이 올랐다. 신한지주(-2.17%), LG생활건강(-0.80%), SK텔레콤(-0.95%), KB금융(-0.55%) 등은 내렸다.업종별로는 전기·전자(0.49%), 기계(0.20%), 의약품(1.00%), 유통(0.70%), 증권(0.25%) 등이 강세였고 통신(-0.43%), 금융(-0.31%), 건설(-0.87%) 등은 약세를 보였다. 이날 코스닥지수는 9.61포인트(1.34%) 오른 727.32로 장을 종료했다. 지수는 1.83포인트(0.25%) 오른 719.54로 개장해 강세 흐름을 이어갔다.코스닥시장에서는 기관이 838억원, 외국인이 523억원을 각각 순매수했다. 개인은 1248억원을 순매도했다. 이날 서울 외환시장에서 원·달러 환율은 전장보다 14.0원 내린 달러당 1162.1원에 마감했다. 김민주기자 stella2515@dt.co.kr 디지털타임스 기획 : [ ] 에게 고견을 듣는다 / [연중기획] 풀뿌리상권 살려내자네이버 채널에서 \'디지털타임스\'를 구독해주세요.디지털타임스 관련뉴스해당 언론사에서 선정하며 언론사 페이지(아웃링크)로 이동해 볼 수 있습니다.한혜진, 이게 바로 ""올 블랙의 정석"" [화보][포토] 3억 8천만 원대 슈퍼카, 맥라렌 720S 스파이더김영희 합의…\'부모 빚투 논란\' 6개월 만 변제 ""죄송한 마음뿐""\'미스 트롯\', 송가인 교통사고 당했지만 큰 외상은 없어 다행건강한 강유미, 면사포 쓰기 전까지 다이어트 돌입좋아요0훈훈해요0슬퍼요0화나요0후속기사 원해요0기사제공 :']"
1,삼성전자, 2019-06-2016:16,매일경제 ,"코스피, 美FOMC 통화완화 기조에도 `무덤덤`…강보합 마감",https://finance.naver.com/news/news_read.nhn?article_id=0004377302&office_id=009&mode=search&query=삼성전자&page=3,"['       코스피, 美FOMC 통화완화 기조에도 `무덤덤`…강보합 마감      기사입력2019-06-20 16:16기사원문좋아요훈훈해요좋아요 평가하기공감좋아요0훈훈해요0슬퍼요0화나요0후속기사 원해요0댓글[이미지 출처 = iStockphoto] 코스피가 미국 연방공개시장위원회(FOMC) 회의록이 통화 완화 기조를 나타냈는데도 무덤덤한 반응을 보이며 강보합 마감했다. 금리 인하에 대한 기대감이 이미 선반영된 영향으로 보인다. 20일 코스피는 전일 대비 0포인트(0%) 상승한 2123.56에 마감됐다. 이날 0.14% 하락 출발한 코스피는 오전 10시 52분께 상승전환했다. 기관의 매수세 덕이다. 다만 거래량이 많지 않아 상승폭은 제한됐다. 간밤에 뉴욕증시도 FOMC 결과와 미·중 무역협상 관련 소식을 주시하며 소폭 상승으로 마감됐다. 연방준비제도는 FOMC에서 금리를 동결했지만, 향후 인하 가능성을 시사했다. 통화정책 성명에서 그동안 유지했던 금리 변경에 인내심을 보이겠다는 문구를 삭제한 대신 경기 확장 유지를 위해 적절하게 행동하겠다는 문구를 넣었다. 삽입했다.제롬 파월 연준 의장은 기자회견을 통해 ""최근 경제 상황 일부에 대해 우려하고 있으며, 정책을 더 완화해야 할 늘어나는 근거를 보고 있다""고 말했다. 연준 위원들이 향후 금리 경로를 전망한 \'점도표\'는 올해 말 금리 중간값을 3월 점도표와 같은 2.4%로 제시했다. 다만 세부적으로는 한차례 이상 금리 인하를 예상하는 위원이 8명으로 늘어나는 등변화가 있었다. 3월 점도표에서는 인하 전망이 없었다. 또 올해 성장률 전망치는 2.1%로 유지됐지만, 물가 전망치는 1.8%에서 1.5%로 큰 폭으로 하향됐다. 다우지수는 이후 연준이 금리 인하를 시사했다는 평가가 우위를 점하면서 곧바로 상승했다. 다만 금리 인하 기대가 이미 시장에 충분히 반영됐던 만큼 주가 상승 폭은 크지 않았다.미국과 중국 정상이 이달 말 일본에서 열리는 주요 20개국(G20) 정상회의에서 별도 회담을 열기로 하면서 무역협상 기대도 부상했다. 로버트 라이트하이저 미국 무역대표부(USTR) 대표는 이날 양국 정상회담 전에 류허중국 부총리를 만날 방침이라며 곧 전화 통화도 할 예정이라고 밝혔다. 서상영 키움증권 연구원은 FOMC 결과에 대해 ""연준이 미 경기에 대한 자신감을 표명하며 올해 금리 동결을 시사했다""면서 ""그러나 인플레이션 압력이 낮아지고 있다는 점을 감안해 내년에는 2번의 금리 인하를 전망했다""고 풀이했다. 그러면서 ""연준이 미국 경기에 대한 자신감 표며 lc 향후 금리인하를 시사한 점은 한국 증시에 긍정적""이라며 ""다만 관련 내용은 이미 시장에 반영됐다는 점을 감안하면 한국 증시에 미치는 영향력은 제한될 것""이라고 전망했다.이날 코스피에서 주요 업종은 대체로 상승세였다. 의료정밀, 의약품, 전기가스업, 유통업, 전기·전자, 섬유·의복, 화학, 운송장비, 운수창고, 증권 등이 올랐다. 반면 건설업, 종이·목재, 은행, 금융업 등은 내렸다.매매주체별로는 기관이 1595억원어치 주식을 샀고, 개인과 외국인은 각각 1483억원어치와 122억원어치를 팔았다. 프로그램매매는 336억원 매도 우위였다. 시가총액 상위 종목들은 대체로 올랐다. 삼성물산, 셀트리온, NAVER, 삼성바이오로직스, 현대차, 삼성전자, 현대모비스, SK하이닉스 등이 상승했다. 반면 신한지주, SK텔레콤, LG생활건강, KB금융 등은 내렸다.이날 코스피에서는 540개 종목이 올랐고, 264개 종목이 내렸다. 코스닥은 9.61포인트(1.34%) 오른 727.32에 거래를 마쳤다. [디지털뉴스국 한경우 기자]▶네이버에서 \'매일경제\' 뉴스 구독하고 경품 받아가세요▶뉴스레터 \'매콤달콤\' 구독 ▶무궁무진한 프리미엄 읽을거리[ⓒ 매일경제 & mk.co.kr, 무단전재 및 재배포 금지]매일경제 관련뉴스해당 언론사에서 선정하며 언론사 페이지(아웃링크)로 이동해 볼 수 있습니다.수상한 단체문자…샘코, 두달새 6배로 폭등30억 넘는 초고가 주택까지 속속 팔린다한혜진 파격 누드 화보 공개…""영광스럽다""\'고작 탁자 만들려고\' 수령 120년 느티나무 잘라신우식이 극찬한 \'이효리 하객룩\'…\'시선올킬\' 비주얼좋아요0훈훈해요0슬퍼요0화나요0후속기사 원해요0기사제공 :']"
2,삼성전자, 2019-06-2016:07,머니투데이 ,"SKT, 5G 스마트폰 공시지원금 낮췄다…8만원대 요금제 63만→43만원으로",https://finance.naver.com/news/news_read.nhn?article_id=0004236344&office_id=008&mode=search&query=삼성전자&page=3,"['       SKT, 5G 스마트폰 공시지원금 낮췄다…8만원대 요금제 63만→43만원으로      기사입력2019-06-20 16:07기사원문좋아요훈훈해요좋아요 평가하기공감좋아요0훈훈해요0슬퍼요0화나요0후속기사 원해요0댓글 [머니투데이 김주현 기자] [지난달 19일 공시지원금 상향한 이후 한 달만에 다시 하향…KT·LGU+은 아직] SK텔레콤이 갤럭시S10 5G와 LG V50 씽큐 등 5G(5세대 이동통신) 스마트폰 공시지원금을 하향 조정했다. 100만 가입자 돌파 이후 공격적인 공시지원금 전략과 가입자 유치 전쟁이 숨고르기 국면에 들어선 것으로 풀이된다. 20일 이동통신업계에 따르면, SK텔레콤은 전날 삼성전자 갤럭시S10 5G 모델과 LG전자의 V50 씽큐 모델의 공시지원금을 평균 10만원 가량 낮췄다. 지난달 19일 갤럭시S10 5G 모델 공시지원금을 최대 63만원으로 상향한 이후 한달만에 공시지원금을 출시 당시보다도 더 낮게 조정했다. 갤럭시S10 5G 256GB(기가바이트) 모델 공시지원금은 기존 42만5000원~63만원에서 29만5000원~51만4000원으로 낮아졌다. V50 씽큐는 47만3000원~59만8000원에서 29만5000원~51만4000원으로 조정됐다. 갤럭시S10 5G 모델의 경우 가장 고가 요금제인 5GX 플래티넘(월 12만5000원) 공시지원금은 기존 63만원에서 51만4000원으로 낮아졌다. 또 5GX 프라임(월 8만9000원) 요금제는 63만원에서 43만원으로 20만원이나 지원금이 줄었다. 업계에서는 SK텔레콤이 공시지원금을 낮추면서 당분간 가입자 유치 경쟁이 완화될 것으로 보고 있다. 아직까지 KT와 LG유플러스는 공시지원금을 유지하고 있다. 업계 관계자는 ""SK텔레콤이 먼저 공시지원금을 하향한 만큼 뒤따라 지원금을 줄일 가능성도 있다""고 설명했다. KT는 현재 갤럭시S10 5G 모델에 40만~78만원 규모의 공시지원금을 제공하고 있다. LG유플러스의 갤럭시S10 5G 공시지원금은 40만~76만5000원이다. 김주현 기자 naro@▶이코노미스트들의 투자칼럼▶조 변호사의 가정상담소 ▶더 많은 기사 보러가기  <저작권자 ⓒ \'돈이 보이는 리얼타임 뉴스\' 머니투데이, 무단전재 및 재배포 금지>머니투데이 관련뉴스해당 언론사에서 선정하며 언론사 페이지(아웃링크)로 이동해 볼 수 있습니다.""조현병 역주행사고 예비신부 친모, 30년만에 보험금 받으러 왔다""한혜진 \'올블랙 누드 화보\'... ""두달간 몸 만들어""김주하 ""방송 22년만에 이게 뭔 민폐…오늘 뉴스는 제가 진행""""외국인근로자에 왜 국민연금까지 대줘야하나요""""10억이면 부자""…변함없는 한국인 부자의 기준좋아요0훈훈해요0슬퍼요0화나요0후속기사 원해요0기사제공 :']"
