,회사명,날짜,언론사,기사제목,링크,본문
0,삼성전자, 2019-02-2721:22,국민일보 ,"삼성, 최고 속도 모바일 메모리 세계 첫 양산",https://finance.naver.com/news/news_read.nhn?article_id=0001176578&office_id=005&mode=search&query=삼성전자&page=1,"['       삼성, 최고 속도 모바일 메모리 세계 첫 양산      기사입력2019-02-27 21:22기사원문좋아요훈훈해요좋아요 평가하기공감좋아요0훈훈해요0슬퍼요0화나요0후속기사 원해요0댓글풀HD 영화 한 편 3초만에 전송삼성전자가 스마트폰용 메모리 중 가장 빠른 ‘eUFS 3.0’을 폴더블폰 ‘갤럭시 폴드’에 탑재할 전망이다.  삼성전자는 최고 속도의 차세대 모바일 메모리 512GB eUFS 3.0을 양산한다고 27일 밝혔다(사진). eUFS 3.0은 이전 세대 eUFS 2.1보다 배 이상 빠른 연속읽기 속도를 낸다. 최근 컴퓨터에 많이 쓰이는 솔리드스테이트드라이브의 4배, 스마트폰 외장 메모리 카드로 사용되는 마이크로SD보다는 20배 이상 빠르다. 풀HD 화질 영화 한 편(약 3.7GB)을 3초 만에 보낼 수 있다는 속도다. 삼성전자는 eUFS 3.0을 갤럭시 폴드에 적용할 예정이다. 갤럭시 폴드는 한 화면에 3개의 앱을 동시에 띄워서 사용하는 등 기존 스마트폰보다 고사양 작업이 필요하기 때문에 eUFS 3.0 탑재가 중요한 사양이 될 수 있다.  이달 512GB, 128GB eUFS 3.0 제품 공급을 시작으로 하반기에는 1TB, 256GB 용량도 제공해 글로벌 IT 고객들의 선택 폭을 넓힌다는 계획이다. 삼성전자는 2015년 기존 eMMC 대비 1.4배 이상 빠른 모바일 내장 메모리 eUFS 2.0을 양산하며, UFS 시장을 창출했으며 2017년 eUFS 2.1에 이어 올해 eUFS 3.0을 출시했다.김준엽 기자 snoopy@kmib.co.kr[네이버 메인에서 채널 구독하기][취향저격 뉴스는 여기] [의뢰하세요 취재대행소 왱]GoodNews paper ⓒ 국민일보(www.kmib.co.kr), 무단전재 및 재배포금지국민일보 관련뉴스해당 언론사에서 선정하며 언론사 페이지(아웃링크)로 이동해 볼 수 있습니다.\'성접대 의혹\' 승리, 밤 9시 경찰 출두…""모발검사 할 것""""문희상 삶으면 맛있겠다"" 기타노 다케시 \'막말\'""월세 비싼데 기숙사 막다니… 학생이 돈줄입니까?""정부에 땅 팔아 \'억\' 소리 낸 고승덕 변호사 근황\'승리에 앙심 품은 누군가\' 박한별 남편 입장문좋아요0훈훈해요0슬퍼요0화나요0후속기사 원해요0기사제공 :']"
1,삼성전자, 2019-02-2720:31,한국경제 ,"반도체 D램값, 두 달새 30% 하락",https://finance.naver.com/news/news_read.nhn?article_id=0004100043&office_id=015&mode=search&query=삼성전자&page=1,"['       반도체 D램값, 두 달새 30% 하락      기사입력2019-02-27 20:31기사원문좋아요훈훈해요좋아요 평가하기공감좋아요0훈훈해요0슬퍼요0화나요0후속기사 원해요0댓글낸드플래시는 5년 만에 최대폭↓[ 좌동욱 기자  ] 삼성전자와 SK하이닉스의 주력 반도체 제품인 D램 가격이 두 달 연속 두 자릿수로 떨어졌다. 낸드플래시 가격도 5년 만에 가장 큰 폭으로 하락했다.27일 시장조사기관인 D램익스체인지에 따르면 2월 PC용 DDR4 8기가비트(Gb) D램 고정거래가격은 개당 5.13달러로 전월보다 14.5% 하락했다. 2016년 6월 D램 고정거래가격이 발표되기 시작한 후 지난 1월(17.24%)에 이어 두 번째로 큰 하락폭이다. 올 들어 불과 두 달 만에 D램 가격이 30% 가까이 하락한 셈이다. 낸드플래시도 가격 하락폭을 키웠다. 2월 낸드플래시 가격(128Gb MLC 기준)은 4.22달러로 1월 대비 6.64% 내렸다. 2014년 2월(-11.14%) 이후 5년 만에 가장 크게 떨어졌다.PC용 D램 고정거래가격은 삼성전자와 SK하이닉스 등 메모리 제조업체들이 대형 PC 거래처에 제품을 대량 공급할 때 매기는 가격이다. 전체 D램 거래량의 20% 안팎을 차지하고 있어 가격 동향을 알려주는 ‘바로미터’다.업계는 가격 하락폭이 예상 범위를 벗어나지 않았다는 반응이다. 세계 1위 메모리 제조업체인 삼성전자는 지난달 말 분기 실적 콘퍼런스콜에서 “1분기엔 주요 서버용 D램 고객이 재고를 털어내면서 수요 약세가 이어질 것”이라며 “2분기 이후 D램 수요가 늘어날 것”이라고 내다봤다. 하지만 향후 전망에 대해선 의견이 엇갈린다. 삼성전자뿐 아니라 SK하이닉스도 하반기엔 D램과 낸드플래시 수요가 살아날 것으로 봤다. 하지만 증권가 일각에선 미국과 중국의 무역분쟁 등 여파로 반도체 가격 약세가 더 오래갈 수 있다고 예상하고 있다.좌동욱 기자 leftking@hankyung.com[한경닷컴 바로가기] [모바일한경 구독신청] 네이버에서 한국경제 채널 구독하기 <자세히 보기> ⓒ 한국경제 & hankyung.com, 무단전재 및 재배포 금지한국경제 관련뉴스해당 언론사에서 선정하며 언론사 페이지(아웃링크)로 이동해 볼 수 있습니다.""4대강 해체가 더 이익?"" 드러난 진실 보니…18억5000만원 주고 산 은마아파트, 5개월 만에…""난 화났는데…"" LG폰 만져본 외국인 반응 \'반전\'\'삼성전자 하락\' 1조 베팅…투자자 \'멘붕\'100만원 넘는 \'갤럭시S10+\' 20만원대 된 사연좋아요0훈훈해요0슬퍼요0화나요0후속기사 원해요0기사제공 :']"
2,삼성전자, 2019-02-2719:13,SBS Biz ,[MWC 2019] 5G 표준 선점 전쟁 시작…정부 지원 나선다,https://finance.naver.com/news/news_read.nhn?article_id=0000178050&office_id=374&mode=search&query=삼성전자&page=1,"['       [MWC 2019] 5G 표준 선점 전쟁 시작…정부 지원 나선다      기사입력2019-02-27 19:13기사원문좋아요훈훈해요좋아요 평가하기공감좋아요0훈훈해요0슬퍼요0화나요0후속기사 원해요0댓글삼성전자 “5G 경쟁, 졸면 죽는다”…정부, ‘5G 플러스’ 지원책 곧 발표[앵커]정부도 세계 5G 표준을 선점하기 위해 지원을 아끼지 않기로 했습니다.우리나라가 다음달 5G 상용화 서비스를 가장 먼저 시작합니다만, 이번 MWC에서 보듯이 외국 기업들, 특히 중국 기업들이 그 성과는 뺏앗을 지 모른다는 우려가 커지고 있기 때문입니다. 김현우 기자가 전해드립니다.[기자]""우리나라가 상용화로 일군 5G 시장을 다른 나라에 넘겨줄 것 같다""MWC을 둘러본 유영민 과학기술정보통신부 장관이 다른 나라들이 5G를 많이 쫓아왔다며 우려를 나타냈습니다.기업들의 경계감은 더 큽니다.유 장관을 만난 고동진 삼성전자 사장은 5G 상황에 대해 경쟁에서 졸면 죽는다는 표현까지 했습니다.가장 큰 위협은 중국, 그중에서도 화웨이입니다.올해 MWC에서 가장 큰 부스를 만들고 5G를 홍보했습니다.이런 도전에 대해 유 장관은 5G를 선점할 수 있도록 정부가 기업들을 지원하겠다고 약속했습니다.당장 5G 상용화 서비스가 시작되는 다음달 말에 범정부 차원의 5G 플러스 전략을 내놓겠다고 밝혔습니다.또 정부는 세계이동통신 사업자협회, GSMA와 5G 상호협력 MOU를 체결했습니다.정부는 이번 MOU를 통해 우리나라가 5G 플랫폼 표준을 세우는데 유리한 고지를 차지할 것으로 기대하고 있습니다.SBSCNBC 김현우입니다. 김현우 기자(khwcnbc@sbs.co.kr) ☞ 의견 있는 경제채널 SBSCNBC [홈페이지]☞ 경제를 실험한다~ #머니랩 [네이버 TV] 저작권자 SBS플러스 & SBS I&M 무단전재-재배포 금지SBS Biz 관련뉴스해당 언론사에서 선정하며 언론사 페이지(아웃링크)로 이동해 볼 수 있습니다.지난해 출산율 0.98명 \'역대 최저\'…1명대 사상 첫 붕괴서울시 ""20곳 아파트 단지에서 비리·부실 338건 적발""난항속 전경련 회장 구인…GS 허창수 네 번째 연임 확정현대차, 5년간 연구개발 45조 투자…영업이익률 7% 목표 제시재계는 불만?…최저임금 인상 사실상 속도 조절 전망좋아요0훈훈해요0슬퍼요0화나요0후속기사 원해요0기사제공 :']"
3,삼성전자, 2019-02-2718:29,KBS ,[글로벌 경제] ‘5G 스마트폰 시장’ 선점 싸움 시작,https://finance.naver.com/news/news_read.nhn?article_id=0010675452&office_id=056&mode=search&query=삼성전자&page=1,"['       [글로벌 경제] ‘5G 스마트폰 시장’ 선점 싸움 시작      기사입력2019-02-27 18:29기사원문좋아요훈훈해요좋아요 평가하기공감좋아요0훈훈해요0슬퍼요0화나요0후속기사 원해요0댓글 [앵커] 세계를 한눈에 보는 <글로벌 경제> 조항리 아나운서와 함께 하겠습니다.  어서 오세요, 오늘 준비한 소식은 뭔가요? [답변] 지난해였죠, 중국의 한 기업이 접을 수 있는 스마트폰을 내놔 화제를 모았는데요. 최근 삼성과 화웨이 등도 화면을 접고, 펼치는 일명 \'폴더블폰\'을 잇따라 공개하면서 전 세계의 관심이 쏠리고 있습니다.  스페인 바르셀로나에서 열린 세계 최대 모바일 전시회, MWC 현장으로  함께 가보시죠. 직사각형, 우리가 잘 알고 있는 스마트폰의 형태죠. 하지만 이렇게 펼치면, 마치 태블릿처럼 화면이 커집니다. 중국 화웨이가 내놓은 5세대 폴더블폰입니다. 이 제품엔 자사 5G 모뎀 칫셉인 \'발롱 5000\'이  탑재됐는데요. 화웨이는  이를 통해 사용자에게 새로운 인터페이스 경험을 제공할 수 있다고 밝혔습니다. [월터 지/화웨이 유럽지사장 : ""(5G가) 4G보다 속도가 10배나 빠릅니다. 예를 들면, 1GB 이상 크기의 영화를 3초에서 5초 만에 내려받기할 수 있습니다.""] [앵커] 앞서 삼성도 폴더블폰을 공개했는데요. 두 제품을 비교했을 때 다른 점이 있나요? [답변] 가장 큰 차이점은, 안으로 접히는 삼성과 달리 화웨이는 바깥으로 접히는 \'아웃 폴딩\' 방식입니다. 현재까진 삼성의 \'인 폴딩\' 방식이 구현하기 어려운 기술로 평가받고 있습니다. 또한, 크기에서도 차이가 있습니다. 화웨이는 접었을 때 6.6인치, 펼쳤을 때 8인치로 삼성과 비교하면 더 큽니다. [저스틴 데니슨/삼성전자 부사장 : ""접었을 때, 4.6인치 크기 화면이 됩니다. 작고 휴대하기 좋습니다.""] 제품의 무게는 양측 모두 공개하지 않았는데, 외신들은 사용자 편의를 고려했을 때 300g을 넘지 않을 것이라고 전했습니다. [앵커] 소비자 관점에서 사실 제일 궁금한 건 가격이거든요. 어떻습니까? [답변] 두 제품 모두 출고가가 2백만 원이 넘을 전망입니다. 화웨이의 \'메이트 X\'는 290만 원, 삼성의 \'갤럭시 폴드\'는 220만 원으로 책정됐습니다.[앵커]역시 가격이 만만치 않군요.[답변] 그렇습니다. 가격도 문제지만, 화웨이의 \'메이트 X\'의 경우 완성도 면에서 부족하다는 지적이 일고 있습니다. 미국의 한 IT 매체는 \'메이트 X\'를 접었다 폈다 했을 때 화면이 고르지 않고 약간의 주름이 생긴다고 설명했는데요. 또, 화면 가운데가 볼록 일어난 모습도 발견했다고 전했습니다. [빅토르 디아즈/블로거 : ""(출시는) 아직 이른 것 같아요. 여러 크고 작은 문제점이 많아요.""] [앵커] 핵심은 결국 내구성이라는 얘긴데요. 일단 화웨이는 폴더블폰을 출시하겠다는 계획을 밝힌 상태죠? [답변] 그렇습니다. 화웨이와 삼성 모두 올해 상반기에 신제품을 내놓을 예정입니다. [앵커] 앞으로 폴더블폰 경쟁이 본격화될 텐데, 다른 기업들은 어떻습니까? LG도 새 스마트폰을 선보였죠? [답변] 네, LG전자는 접는 방식이 아니라 듀얼 스크린을 지원하는 5G 스마트폰을 내놨습니다. LG는 화면을 접는 대신 \'붙이는\' 방식을 선택했습니다.디스플레이 두 개를 마음대로  붙였다 뗐다 할 수 있는 건데요. 영화를 보면서 메시지를 보낼 수 있고, 스포츠 중계를 보면서 게임도 할 수 있습니다. [데이비드 몬타냐/\'V50 씽큐\' 제품 발표자/LG전자 유럽지부 : ""화면을 만지거나 버튼을 누르지 않고도 음량 조절이나 스크린 캡처가 가능합니다.""] 중국의 IT 기업, 샤오미는 가성비를 앞세워 5G 스마트폰 시장 선점을 노립니다. 오는 5월에 \'미믹스3\'을 출시할 예정인데, 76만 원 선입니다.  소니는 엔터테인먼트에 최적화된 새 스마트폰을 공개했습니다. 세계 최초로 4K 올레드를 탑재, 영상을 촬영할 때 영화와 같은 연출이 가능하게 만들었고요. 화면 역시 21대 9의 비율이 적용돼 영화의 원본 포맷 그대로 시청할 수 있습니다. [앵커] 기업들이 잇따라 신제품을 쏟아내고 있는데요. 사용자들의 스마트폰 교체 주기가 길어지면서 어려움을 겪고 있기 때문이죠? [답변] 그렇습니다. 지난해 전 세계 스마트폰 출하량은 2017년에 비해 5% 감소한 14억 3천만 대입니다. 비싼 가격도 문제지만, 더는 새로울 것이 없어 소비자들의 지갑이 열리지 않는 건데요. 올해도 0.6%에서 3.3%까지 역성장할 것이란 전망이 지배적입니다. 폴더블폰 출시에 대한 시장의 반응은 대체로 긍정적인 편입니다. 다만 화면이 두 배로 커진 만큼 여기에 적합한 소프트웨어 환경과 콘텐츠 개발이 반드시 필요하다는  목소리가 나오고 있습니다. [브라이언 쉔/중국 스마트폰 제조기업 \'오포\' 부사장 : ""5G 시대가 오면 클라우드에 연결된, 화면만 있는 휴대폰으로 바뀔 것입니다. 또한, 매우 얇고 가벼워질 것입니다. 앞으로 나올 스마트폰은 화면과 배터리만 탑재될 것입니다.""] 5G 시대가 열리면서 스마트폰 시장에 새로운 기회가 열린 것은 분명해 보이는데요. 과연 누가 먼저 사람들의 마음을 사로잡을 수 있을지는 지켜봐야 할 것 같네요. [앵커] 결국엔 우리와 중국 기업 간의  주도권 다툼이 치열해질 수밖에 없겠군요. 어떤 승부수를 던질지 기대가 됩니다. 오늘 소식 잘 들었습니다.KBS▶ 한반도 평화의 여정! 2019 북미 정상회담▶ [만세 지도] 우리 동네 3.1운동 현장은?▶ 네이버 채널 KBS뉴스 구독! 시원하게 털어드립니다KBS 관련뉴스해당 언론사에서 선정하며 언론사 페이지(아웃링크)로 이동해 볼 수 있습니다.사이 좋은 북미는 악몽…안절부절 일본의 미국 바라기서해상에서 공군 KF-16D 전투기 추락…조종사 2명 구조\'김정은 특별열차\'의 그녀…프랑스 언론 속 김여정자문기구vs유착창구?…버닝썬 문제된 \'경찰발전위\' 뭐기에현송월, 북한 예술단원(추정)과 할롱베이에서 \'셀카\' 포착좋아요0훈훈해요0슬퍼요0화나요0후속기사 원해요0기사제공 :']"
4,삼성전자, 2019-02-2718:26,디지털타임스 ,이재용의 기술인재 사랑,https://finance.naver.com/news/news_read.nhn?article_id=0002511223&office_id=029&mode=search&query=삼성전자&page=1,"['       이재용의 기술인재 사랑      기사입력2019-02-27 18:26기사원문좋아요훈훈해요좋아요 평가하기공감좋아요0훈훈해요0슬퍼요0화나요0후속기사 원해요0댓글국제기능올림픽에 19.5억 후원이재용   삼성전자 부회장[디지털타임스 박정일 기자] 삼성전자가 우수 기술인재 육성을 위해 국제기능올림픽에 150만 유로(약19억5000만원)를 후원한다.삼성전자는 오는 8월 러시아 카잔에서 열리는 제45회 국제기능올림픽대회 최상위 스폰서 기업으로 주관기관인 국제기능올림픽위원회(WorldSkills International)를 후원한다고 27일 밝혔다. 삼성전자는 지난 2007년 일본 시즈오카 대회를 시작으로 격년마다 열리는 이 행사에 7회 연속 후원하고 있다.특히 지난 2013년 이후에는 4회 연속 단독 \'최상위 타이틀 후원사(OEP)\'로 참여하고 있다. 이번 후원 체결식은 3월 중 러시아에서 열릴 예정이다. 이번 대회는 오는 8월 22일부터 27일까지 러시아 타타르스탄 자치공화국의 수도 카잔에서 열리고, 세계 67개국 1401명의 선수들이 참여해 56개 종목에서 기량을 겨룬다. 우리나라에서는 삼성전자·전기·중공업·바이오로직스 직원 19명을 비롯해 47개 직종에서 52명의 선수가 출전한다.삼성전자는 이에 앞서 지난 2월 국제기능올림픽 한국 국가대표팀을 위해 후원금 7억2000만원을 전달한 적이 있다. 한편 삼성전자는 우수 기능 인력 양성을 위해 2006년 고용노동부와 \'기능장려협약\'을 체결한 뒤 2007년부터 지속해서 전국 기능경기대회를 후원하고 있다. 임직원을 대상으로 매년 삼성국제기능경기대회도 개최하고 있다.장동섭 삼성기능올림픽 사무국장은 ""삼성전자는 국제기능올림픽을 통해 전 세계 기능 장려 활동에 꾸준히 참여해 왔다""며 ""앞으로도 지속해서 글로벌 기술인재 양성에 힘쓸 것""이라고 말했다. 박정일기자 comja77@ 디지털타임스 홈페이지 바로가기 / 디지털타임스 뉴스 더보기네이버 채널에서 \'디지털타임스\'를 구독해주세요.디지털타임스 관련뉴스해당 언론사에서 선정하며 언론사 페이지(아웃링크)로 이동해 볼 수 있습니다.김정훈 피소…前여친에 낙태 종용? ""공식입장 없다""승리 카톡 대화에서 누군가 사라졌다 ""가수 C씨는 누구?""박상민 재혼…11세 연하 여자친구와 ""새 출발""이문호 마약검출…까면 깔수록 ""양파 버닝썬""박나래 하차, 홍콩편이 마지막…\'짠내투어\' 新멤버는 누구?좋아요0훈훈해요0슬퍼요0화나요0후속기사 원해요0기사제공 :']"
5,삼성전자, 2019-02-2718:26,디지털타임스 ,3초만에 풀HD 영화 전송 … 삼성 울트라급 모바일 메모리,https://finance.naver.com/news/news_read.nhn?article_id=0002511232&office_id=029&mode=search&query=삼성전자&page=1,"['       3초만에 풀HD 영화 전송 … 삼성 울트라급 모바일 메모리      기사입력2019-02-27 18:26기사원문좋아요훈훈해요좋아요 평가하기공감좋아요0훈훈해요0슬퍼요0화나요0후속기사 원해요0댓글기존 \'eUFS 2.1\' 대비 2배 속도마이크로SD카드보다 20배 빨라하반기 1TB 제품까지 양산 확대[디지털타임스 박정일 기자] 삼성전자가 5G(5세대 통신)과 폴더블폰 시대에 맞춰 고화질 영화 한 편을 3초 안에 보낼 수 있는 역대 최고 속도의 차세대 모바일 메모리를 출시했다. 업계에서는 올해 출시 예정인 \'갤럭스 폴드\'에 이 메모리를 탑재해 울트라 슬림 노트북 급의 성능을 구현할 것으로 보고 있다.삼성전자는 차세대 플래그십 스마트폰 메모리 시장 선점을 위해 세계 최초로 내장형 모바일 메모리 \'512GB eUFS 3.0(embedded Universal Flash Storage 3.0)\'을 양산한다고 27일 밝혔다. 이 제품은 기존 \'eUFS 2.1\' 보다 2배 이상 빠른 초당 2100MB의 연속읽기 속도를 구현한다.이는 기존 SATA SSD(솔리드스테이트드라이브)보다 약 4배, 마이크로SD카드보다는 20배 이상 빠른 속도다. 모바일 기기에 저장한 풀HD급 영화 한 편(3.7GB)을 3초 안에 PC(eUFS 3.0→NVMe SSD 기준)로 보낼 수 있다. 삼성전자 측은 ""소비자들이 초고해상도의 차세대 모바일 기기에서도 울트라 슬림 노트북 수준의 성능을 체감할 수 있을 것""이라고 설명했다.삼성전자는 이번 제품에 5세대 512Gb V낸드를 8단으로 적층하고 고성능 컨트롤러를 탑재해 성능을 강화했다. 연속쓰기 속도는 초당 410MB로 기존 eUFS 2.1 제품보다 1.5배 이상 빠르다.임의 읽기·쓰기 속도도 최대 1.3배 빠른 6만3000·6만8000 IOPS(초당 입출력 속도)를 구현했다. 이는 마이크로SD 카드(100 IOPS)보다 630배 이상 빠른 것으로, 대화면의 초고해상도 디스플레이에서 다양하고 복잡한 작업을 동시에 실행하더라도 빠르고 원활하게 처리할 수 있다.최철 삼성전자 메모리사업부 전략마케팅팀 부사장은 ""올해 1TB까지 라인업을 늘려 글로벌 모바일 제조사들이 프리미엄 시장에서 새로운 성장 분야로 도약하는 데 이바지할 것""이라고 말했다. 삼성전자는 이달 512GB, 128GB eUFS 3.0 제품 공급을 시작으로 하반기에는 1TB, 256GB 용량도 양산할 계획이다.박정일기자 comja77@dt.co.kr                                                                                                                                                                                                                                                                                                                                                                                                                                                                                                                                                                                                                                      디지털타임스 홈페이지 바로가기 / 디지털타임스 뉴스 더보기네이버 채널에서 \'디지털타임스\'를 구독해주세요.디지털타임스 관련뉴스해당 언론사에서 선정하며 언론사 페이지(아웃링크)로 이동해 볼 수 있습니다.김정훈 피소…前여친에 낙태 종용? ""공식입장 없다""승리 카톡 대화에서 누군가 사라졌다 ""가수 C씨는 누구?""박상민 재혼…11세 연하 여자친구와 ""새 출발""이문호 마약검출…까면 깔수록 ""양파 버닝썬""박나래 하차, 홍콩편이 마지막…\'짠내투어\' 新멤버는 누구?좋아요0훈훈해요0슬퍼요0화나요0후속기사 원해요0기사제공 :']"
