,회사명,날짜,언론사,기사제목,링크,본문
14,삼성전자, 2019-06-2010:02,전자신문 ,"[ET투자뉴스]삼성물산, ""견조한 자산가치와 …"" BUY(유지)-KB증권",https://finance.naver.com/news/news_read.nhn?article_id=0002821929&office_id=030&mode=search&query=삼성전자&page=6,"['       [ET투자뉴스]삼성물산, ""견조한 자산가치와 …"" BUY(유지)-KB증권      기사입력2019-06-20 10:02기사원문좋아요훈훈해요좋아요 평가하기공감좋아요0훈훈해요0슬퍼요0화나요0후속기사 원해요0댓글KB증권에서 19일 삼성물산(028260)에 대해 ""견조한 자산가치와 삼성전자 주주친화정책이라는 투자포인트""라며 투자의견을 \'BUY(유지)\'로 제시하였고, 아울러 목표주가로는 135,000원을 내놓았다. KB증권 김준섭 애널리스트가 동종목에 대하여 이번에 제시한 \'BUY(유지)\'의견은 KB증권의 직전 매매의견에서 큰 변화없이 그대로 유지되는 것이고  올해 초반의 시장컨센서스와 비교해 볼때도 역시 \'매수\'의견이 계속 유지되고 있는 상태이다. 그리고 최근 분기내 발표된 전체 증권사 리포트의 컨센서스와 비교를 해볼 경우에 오늘 발표된 투자의견은 전체의견에 수렴하고 있어, 이번 의견은 시장의 평균적인 기대감이 객관적으로 표현된 것으로 분석되고 있다. 목표주가의 추이를 살펴보면 최근 두차례 연속 하향조정되다가 이번에는 직전 목표가와 동일한 수준을 유지하는 모습이다. 또한 전일 종가 기준으로 볼때 동종목의 현주가는 이번에 제시된 목표가 대비 43.6%의 저평가 요인이 존재한다는 해석이 제시되고 있다. ◆ Report briefingKB증권에서 삼성물산(028260)에 대해 ""삼성물산이 보유하고 있는 자산 가치가 견조하다는 점, 삼성전자의 주주친화 정책 강화 시 수혜가 예상된다는 점, 바이오사업부문의 논란 해소 시 리스크 요인 축소를 감안하여 투자의견 Buy를 유지한다""라고 분석했다.  또한 KB증권에서 ""삼성물산의 2Q19 영업이익은 컨센서스 (2,611억원)에 부합한 2,648억원 수준으로 전망한다. 하이테크 사업의 실적 호조세가 건설사업의 호실적을 견인하고 있는 가운데, 전분기 인식했던 일회성 비용의 기저효과로 전분기 대비 이익이 개선되는 모습을 보일 것 (1Q19 1,042억원 → 2Q19 1,529억원)으로 예상한다""라고 밝혔다. ◆ Report statisticsKB증권의 동종목에 대한 최근 9개월 동안의 투자의견은 전체적으로 큰 변화없이 유지되고 있다. 목표주가는 2018년7월 170,000원까지 높아졌다가 2019년6월 135,000원을 최저점으로 목표가가 제시된 이후 최근에도 135,000원으로 제시되고 있다. 한편 증권정보제공 업체인 씽크풀에 따르면 동사에 대한 컨센서스는 \'매수\'이고 목표주가의 추이를 살펴보면 최근 3회이상 지속적으로 하향조정되고 있고 목표가의 하락폭 또한 더욱 커지는 추세이다. <컨센서스 하이라이트>\xa0컨센서스최고최저투자의견매수BUYBUY목표주가160,778200,000135,000*최근 분기기준오늘 KB증권에서 발표된 \'BUY(유지)\'의견 및 목표주가 135,000원은 전체의견에 수렴하면서 시장의 평균적인 기대감이 비교적 객관적으로 표현된 것으로 풀이되며 목표가평균 대비 16%정도 미달하고 있는 것으로 집계되었다.  참고로 최근에 목표주가를 가장 공격적으로 제시한 NH투자증권에서 투자의견 \'BUY(유지)\'에 목표주가 200,000원을 제시한 바 있다.<KB증권 투자의견 추이>\xa0의견제시일자투자의견목표가격20190619BUY(유지)135,00020190416BUY(유지)160,00020181116BUY(유지)170,00020181108BUY(유지)170,000<최근 리포트 동향>의견제시일자증권사투자의견목표가20190619KB증권BUY(유지)135,00020190531유진투자증권BUY(유지)142,00020190425DB금융투자BUY(유지)160,00020190425NH투자증권BUY(유지)200,000(씽크풀에서 제공하는 컨센서스는 국내 전증권사에서 발표되는 기업분석 리포트 및 코멘트를 실시간으로 통계/분석처리되고 있습니다.)증시분석 전문기자 로봇 ET etbot@etnews.com전자신문과 금융AI전문기업 씽크풀의 증시분석 전문기자 로봇 ET가 쓴 기사입니다▶ ""밀레니얼 세대에게 팔아라""  밀레니얼/Z세대 쇼크 & 패러다임 시프트 콘서트 2019▶ 네이버 모바일에서 [전자신문] 채널 구독하기▶ 전자신문 바로가기 [Copyright ⓒ 전자신문 & 전자신문인터넷, 무단전재 및 재배포 금지]전자신문 관련뉴스해당 언론사에서 선정하며 언론사 페이지(아웃링크)로 이동해 볼 수 있습니다.삼성, \'TOF 모듈\' 공급망 확대…엠씨넥스 등 신규 벤더 진입\'월드 베스트 5G 코리아 목표로 민관, 하이파이브\'…5G+ 전략위원회 가동""소형 SUV 시장 다시 불 붙는다""…티볼리-코나-셀토스 \'3파전\'AI-핀테크 모험투자 나선 VC, 연이어 회수 \'대박\'제각각 \'병원 진료 정보 서식\' 표준화한다좋아요0훈훈해요0슬퍼요0화나요0후속기사 원해요0기사제공 :']"
15,삼성전자, 2019-06-2010:02,서울경제 ,[오전시황] 외국인·개인 매도세에 코스피 등락 거듭,https://finance.naver.com/news/news_read.nhn?article_id=0003573027&office_id=011&mode=search&query=삼성전자&page=6,"['       [오전시황] 외국인·개인 매도세에 코스피 등락 거듭      기사입력2019-06-20 10:02기사원문좋아요훈훈해요좋아요 평가하기공감좋아요0훈훈해요0슬퍼요0화나요0후속기사 원해요0댓글 [서울경제] 국내 증시가 미국 연준의 금리 인하 기대감이 고조되는 가운데 보합세를 보이고 있다.20일 오전 9시 23분 현재 코스피 지수는 0.30포인트(0.01%) 오른 2,125.08을 나타냈다. 이날 지수는 3.00포인트(0.14%) 내린 2,121.78에 출발했다. 하락 출발한 코스피는 보합권에서 등락을 거듭하고 있다.같은 시간 외국인 투자자와 개인은 각각 82억원, 93억원 순매도 했고, 기관은 167억원 순매수하며 상반된 모습을 보였다.간밤 미국 연준이 “경기확장 유지를 위해 적절히 대응할 것”이라며 금리 인하를 시사하는 발언을 하자 보합세를 보이던 뉴욕증시는 오후 2시 이후 오름세로 돌아섰다. 스탠더드앤드푸어스(S&P) 500 지수는 8.71포인트(0.30%) 오른 2,926.46에, 기술주 중심의 나스닥 지수는 33.44포인트(0.42%) 오른 7,987.32에 장을 마감했다. 코스피 시가총액 상위 종목들은 대부분 하락세다. 삼성전자(-0.55%), SK하이닉스(-0.89%), 현대차(-0.36&), 신한지주(-0.33%), 현대모비스(-0.22%), LG생활건강(-1.46%), SK텔레콤(-1.14%) 등이 약세다. 반면 셀트리온(0.47%), 포스코(0.41%), 삼성바이오로직스(0.32%) 등이 오름세다.업종별로는 의약품(0.59%), 유통업(0.65%), 전기가스업(0.91%) 등이 강세를 보이고 있다.코스닥 지수는 같은 시간 3.85포인트(0.54%) 오른 721.56을 나타냈다. 이날 지수는 1.83포인트(0.25%) 오른 719.54에 출발했다. 개인만 52억원 순매수했고, 외국인과 기관은 각각 21억, 16억원 씩 순매도했다.한편 이날 개장 시 환율은 3.2원 내린 1,172.9원이었다./신한나기자 hanna@sedaily.com[서울경제 바로가기]▶ 내가 살 아파트, 실거래가 News봇으로  | ▶ 네이버TV로 서울경제썸 구독하기▶ 네이버 메인에서 \'No. 1 뉴스\' 서울경제를 만나보세요저작권자 ⓒ 서울경제, 무단 전재 및 재배포 금지서울경제 관련뉴스해당 언론사에서 선정하며 언론사 페이지(아웃링크)로 이동해 볼 수 있습니다.文대통령 지지율 47%...3%P↓ ""손혜원·北어선·붉은 수돗물 영향""시진핑, 오늘 北 국빈방문...1박2일 일정 뜯어보니황교안 ""北어선에 무장공비 탔으면 어쩔 뻔했나""法, \'이언주 의원 불륜설\' 유포 대학원생 100만원 벌금형 선고상산고 자사고 재지정 점수 미달 유력, 16년 만에 일반고 전환 가능성좋아요0훈훈해요0슬퍼요0화나요0후속기사 원해요0기사제공 :']"
16,삼성전자, 2019-06-2010:01,뉴시스 ,"SKT, 5G폰 지원금 첫 하향 조정…통신사 출혈경쟁 속도조절 신호?",https://finance.naver.com/news/news_read.nhn?article_id=0009296682&office_id=003&mode=search&query=삼성전자&page=6,"['       SKT, 5G폰 지원금 첫 하향 조정…통신사 출혈경쟁 속도조절 신호?      기사입력2019-06-20 10:01기사원문좋아요훈훈해요좋아요 평가하기공감좋아요0훈훈해요0슬퍼요0화나요0후속기사 원해요0댓글전일 갤럭시S10 5G·V50 씽큐 공시지원금 낮춰【서울=뉴시스】박주성 기자 = 박정호 SK텔레콤 사장이 19일 오전 서울 여의도 전경련회관에서 열린 ‘제1차 민·관 합동 5G+ 전략위원회’에 참석해 유영민 과학기술정보통신부 장관의 모두발언을 경청하고 있다. 2019.06.19. park7691@newsis.com【서울=뉴시스】이진영 기자 = SK텔레콤이 5G폰에 대한 공시지원금을 처음으로 하향 조정했다. 지난 10일 국내 5G 서비스 가입자가 100만명을 돌파한 가운데 이번 이동통신 1위 사업자의 지원금 인하가 그간 통신사 간에 벌여온 치열한 출혈경쟁의 속도 조절 신호가 될지 이목이 집중된다.  20일 이통통신업계에 따르면 SK텔레콤은 국내 첫 출시된 5G 폰인 삼성전자 갤럭시S10 5G의 공시지원금을 전일 29만5000원~51만4000원 수준으로 변경했다. 지난 5월 18일에 인상한 공시지원금 42만5000원~63만원에서 10만원가량 낮춘 것이다. 동시에 또 다른 5G폰인 LG전자의 V50 씽큐의 공시지원금 수준도 29만5000~51만4000원으로 바꿨다. 이 또한 기존의 47만3000~59만8000원에서 줄어든 것이다. 현재 KT와 LG유플러스는 갤럭시S10에 대해 각각 지난 11일과 17일에 인상한 공시지원금을 유지하고 있다. KT의 갤럭시S10에 대한 공시지원금은 40만~78만원이다. LG유플러스는 갤럭시S10 512G에 50만~76만5000원, 갤럭시S10 256G에 대해서는 40만~61만5000원으로 공시지원금을 설계했다. 마찬가지로 V50 씽큐에 대한 공시지원금도 KT(5월 10일)와 LG유플러스(5월 8일) 지난 5월 인상한 공시지원금을 고수하고 있다. 이동통신사가 지난 4월 3일 세계 최초 5G 서비스 상용화에 성공한 후 69일 만인 지난 10일 5G 가입자가 100만명을 넘은 만큼 보조금 출혈경쟁에서 일단 속도 조절에 들어간 것이라는 분석이 나온다. 그간 이통사들은 5G 시장 선점을 위해 이례적으로 70만원대 공시지원금을 제공하는 등 치열한 경쟁을 벌여왔다. 통신업계 관계자는 ""아직 전국에 5G망이 안정적으로 깔리지 않아 초기 가입자가 부진할 것으로 걱정됐으나 우려가 무색하게 가입자가 빠르게 늘었다""며 ""가입자가 100만명대에 진입한 만큼 SK텔레콤을 시작으로 통신사들이 초반 경쟁에서 일단 숨고르기에 들어갈 것으로 보인다""라고 풀이했다. SK텔레콤 관계자는 ""기존에 5G폰에 대한 공시지원금이 높은 수준임에 따라 정책상 낮췄다""며 ""이번 인하로 5G 시장이 안정화되는 효과가 있을 것으로 기대한다""라고 덧붙였다.mint@newsis.com▶ 네이버에서 뉴시스 채널 구독하기▶ 뉴시스 빅데이터 MSI 주가시세표 바로가기 <저작권자ⓒ 공감언론 뉴시스통신사. 무단전재-재배포 금지.>뉴시스 관련뉴스해당 언론사에서 선정하며 언론사 페이지(아웃링크)로 이동해 볼 수 있습니다.""오빠라 불러라""·""짧은치마 입고 출근해""…직장내 성희롱 백태비행기 안에서 10대와 성행위한 남성 7년형 선고알고지내던 20대여성 유흥업소에 팔아넘기려던 5명 검거8년간 시각장애인 행세하며 억대 보조금 꿀꺽…\'운전\' 드러나 들통\'다시 만나줘\' 전 여친에 간장 뿌리고 차량·전화 훔친 40대좋아요0훈훈해요0슬퍼요0화나요0후속기사 원해요0기사제공 :']"
17,삼성전자, 2019-06-2010:01,연합뉴스 ,"삼성전자, '2019 광주 국제 IoT·로봇박람회' 참가",https://finance.naver.com/news/news_read.nhn?article_id=0010902430&office_id=001&mode=search&query=삼성전자&page=6,"['       삼성전자, \'2019 광주 국제 IoT·로봇박람회\' 참가      기사입력2019-06-20 10:01기사원문좋아요훈훈해요좋아요 평가하기공감좋아요0훈훈해요0슬퍼요0화나요0후속기사 원해요0댓글    (서울=연합뉴스) 삼성전자가 오는 22일까지 광주광역시 김대중컨벤션센터에서 개최되는 \'2019 광주 국제 IoT·로봇박람회\'에 참가해 삼성 홈 IoT와 AI 관련 체험형 전시 부스를 운영한다고 20일 밝혔다. 2019.6.20     [삼성전자 제공. 재판매 및 DB 금지]    photo@yna.co.kr▶네이버 홈에서 [연합뉴스] 채널 구독하기▶뭐 하고 놀까? #흥  ▶쇼미더뉴스! 오늘 많이 본 뉴스영상연합뉴스 관련뉴스해당 언론사에서 선정하며 언론사 페이지(아웃링크)로 이동해 볼 수 있습니다.\xa0검찰 ""그녀 불러 YG 내사하려했지만 계속 울기만 해""\xa0MLB닷컴 ""류현진은 슈퍼맨, 에이스 내준 커쇼는…""\xa01급 시각장애인이 ""여기 경치 좋다""…이웃이 신고\xa0\'살상게임\' 접속한 병역거부 여호와의 증인 신도 무죄\xa0김주하, 뉴스 진행 중 땀이 \'줄줄\'…돌연 앵커 교체좋아요0훈훈해요0슬퍼요0화나요0후속기사 원해요0기사제공 :']"
18,삼성전자, 2019-06-2010:00,연합뉴스 ,'2019 광주 국제 IoT·로봇박람회',https://finance.naver.com/news/news_read.nhn?article_id=0010902427&office_id=001&mode=search&query=삼성전자&page=6,"['       \'2019 광주 국제 IoT·로봇박람회\'      기사입력2019-06-20 10:00기사원문좋아요훈훈해요좋아요 평가하기공감좋아요0훈훈해요0슬퍼요0화나요0후속기사 원해요0댓글    (서울=연합뉴스) 삼성전자가 오는 22일까지 광주광역시 김대중컨벤션센터에서 개최되는 \'2019 광주 국제 IoT·로봇박람회\'에 참가해 삼성 홈 IoT와 AI 관련 체험형 전시 부스를 운영한다고 20일 밝혔다. 2019.6.20     [삼성전자 제공. 재판매 및 DB 금지]    photo@yna.co.kr▶네이버 홈에서 [연합뉴스] 채널 구독하기▶뭐 하고 놀까? #흥  ▶쇼미더뉴스! 오늘 많이 본 뉴스영상연합뉴스 관련뉴스해당 언론사에서 선정하며 언론사 페이지(아웃링크)로 이동해 볼 수 있습니다.\xa0검찰 ""그녀 불러 YG 내사하려했지만 계속 울기만 해""\xa0MLB닷컴 ""류현진은 슈퍼맨, 에이스 내준 커쇼는…""\xa01급 시각장애인이 ""여기 경치 좋다""…이웃이 신고\xa0\'살상게임\' 접속한 병역거부 여호와의 증인 신도 무죄\xa0김주하, 뉴스 진행 중 땀이 \'줄줄\'…돌연 앵커 교체좋아요0훈훈해요0슬퍼요0화나요0후속기사 원해요0기사제공 :']"
19,삼성전자, 2019-06-2010:00,뉴시스 ,"삼성전자, ‘광주국제 IoT·로봇 박람회’서 홈 loT 시연",https://finance.naver.com/news/news_read.nhn?article_id=0009296678&office_id=003&mode=search&query=삼성전자&page=6,"['       삼성전자, ‘광주국제 IoT·로봇 박람회’서 홈 loT 시연      기사입력2019-06-20 10:00기사원문좋아요훈훈해요좋아요 평가하기공감좋아요0훈훈해요0슬퍼요0화나요0후속기사 원해요0댓글음성명령 한마디로 거실·주방·세탁실 등 제어""홈 loT 기술, 실질적으로 소비자 일상에 녹아""【서울=뉴시스】 삼성전자 모델이 20일부터 22일까지 광주광역시 김대중컨벤션센터에서 개최되는 ‘2019 광주국제 IoT·로봇박람회’에서 삼성전자 홈 IoT·AI 체험형 전시 부스를 소개하고 있다. (사진 삼성전자)【서울=뉴시스】 김종민 기자 = 삼성전자가 20일부터 22일까지 광주광역시 김대중컨벤션센터에서 개최되는 ‘2019 광주국제 IoT·로봇박람회’에 참가해 삼성 홈IoT와 AI 관련 체험형 전시 부스를 운영한다.광주광역시가 주최하는 ‘2019 광주국제 IoT·로봇박람회’는 전 세계 20개국 150여 개 업체가 참가하고 2만 명 이상의 관람객이 방문한다.삼성전자는 이번 행사에서 거실과 주방, 세탁실 등 소비자의 일상생활 공간을 구현하고, 패밀리허브 냉장고·무풍에어컨·에어드레서 등 삼성 혁신 가전제품으로 경험 가능한 ‘홈 IoT’ 서비스들을 다채로운 시나리오로 시연한다.삼성 ‘홈 IoT’는 인텔리전스 플랫폼 ‘빅스비’와 ‘스마트싱스’를 통해 다양한 기기들을 연동해 편리한 사용자 경험을 제공하는 것이 특징이다.예를 들어 ▲음성 명령을 내려 스마트 TV 화면을 통해 냉장고 속 식재료를 확인하거나 ▲주방에서 패밀리허브 냉장고를 통해 전화 통화를 하고 ▲스마트 TV나 패밀리허브를 통해 거실과 주방 등에서 세탁실에 위치한 세탁기의 세탁 완료 알림을 받을 수 있다.음성 명령 한마디로 상황에 맞게 다양한 기기를 한꺼번에 제어하는 것도 가능하다.집에 돌아왔을 때 “하이 빅스비, 나 집에 왔어”라고 말하면 집 안 조명과 에어컨, 공기청정기가 한 번에 켜지고 집안을 청소 중이던 로봇청소기는 충전도크로 복귀하는 작동을 수행한다.삼성전자 구성기 상무는 “불과 얼마 전까지만 해도 미래 기술로 여겨 지던 홈IoT 기술이 이제는 실질적으로 소비자들의 일상에 녹아 들고 있다”며 “삼성전자는 소비자들에게 차별화된 가치와 더욱 편리한 사용자 경험을 제공하기 위해 지속 노력할 것”이라고 말했다.jmkim@newsis.com▶ 네이버에서 뉴시스 채널 구독하기▶ 뉴시스 빅데이터 MSI 주가시세표 바로가기 <저작권자ⓒ 공감언론 뉴시스통신사. 무단전재-재배포 금지.>뉴시스 관련뉴스해당 언론사에서 선정하며 언론사 페이지(아웃링크)로 이동해 볼 수 있습니다.""오빠라 불러라""·""짧은치마 입고 출근해""…직장내 성희롱 백태비행기 안에서 10대와 성행위한 남성 7년형 선고알고지내던 20대여성 유흥업소에 팔아넘기려던 5명 검거시진핑 방북…""평양 준전시상태처럼 삼엄""[단독]관리 허술 국비해외유학…학위 절반도 못따고 학생 증발좋아요0훈훈해요0슬퍼요0화나요0후속기사 원해요0기사제공 :']"
0,삼성전자, 2019-06-2010:00,연합뉴스 ,'2019 광주 국제 IoT·로봇박람회',https://finance.naver.com/news/news_read.nhn?article_id=0010902426&office_id=001&mode=search&query=삼성전자&page=7,"['       \'2019 광주 국제 IoT·로봇박람회\'      기사입력2019-06-20 10:00기사원문좋아요훈훈해요좋아요 평가하기공감좋아요0훈훈해요0슬퍼요0화나요0후속기사 원해요0댓글    (서울=연합뉴스) 삼성전자가 오는 22일까지 광주광역시 김대중컨벤션센터에서 개최되는 \'2019 광주 국제 IoT·로봇박람회\'에 참가해 삼성 홈 IoT와 AI 관련 체험형 전시 부스를 운영한다고 20일 밝혔다. 2019.6.20     [삼성전자 제공. 재판매 및 DB 금지]    photo@yna.co.kr▶네이버 홈에서 [연합뉴스] 채널 구독하기▶뭐 하고 놀까? #흥  ▶쇼미더뉴스! 오늘 많이 본 뉴스영상연합뉴스 관련뉴스해당 언론사에서 선정하며 언론사 페이지(아웃링크)로 이동해 볼 수 있습니다.\xa0검찰 ""그녀 불러 YG 내사하려했지만 계속 울기만 해""\xa0MLB닷컴 ""류현진은 슈퍼맨, 에이스 내준 커쇼는…""\xa01급 시각장애인이 ""여기 경치 좋다""…이웃이 신고\xa0\'살상게임\' 접속한 병역거부 여호와의 증인 신도 무죄\xa0김주하, 뉴스 진행 중 땀이 \'줄줄\'…돌연 앵커 교체좋아요0훈훈해요0슬퍼요0화나요0후속기사 원해요0기사제공 :']"
1,삼성전자, 2019-06-2010:00,연합뉴스 ,"삼성전자, '2019 광주 국제 IoT·로봇박람회' 참가",https://finance.naver.com/news/news_read.nhn?article_id=0010902429&office_id=001&mode=search&query=삼성전자&page=7,"['       삼성전자, \'2019 광주 국제 IoT·로봇박람회\' 참가      기사입력2019-06-20 10:00기사원문좋아요훈훈해요좋아요 평가하기공감좋아요0훈훈해요0슬퍼요0화나요0후속기사 원해요0댓글    (서울=연합뉴스) 삼성전자가 오는 22일까지 광주광역시 김대중컨벤션센터에서 개최되는 \'2019 광주 국제 IoT·로봇박람회\'에 참가해 삼성 홈 IoT와 AI 관련 체험형 전시 부스를 운영한다고 20일 밝혔다. 2019.6.20     [삼성전자 제공. 재판매 및 DB 금지]    photo@yna.co.kr▶네이버 홈에서 [연합뉴스] 채널 구독하기▶뭐 하고 놀까? #흥  ▶쇼미더뉴스! 오늘 많이 본 뉴스영상연합뉴스 관련뉴스해당 언론사에서 선정하며 언론사 페이지(아웃링크)로 이동해 볼 수 있습니다.\xa0검찰 ""그녀 불러 YG 내사하려했지만 계속 울기만 해""\xa0MLB닷컴 ""류현진은 슈퍼맨, 에이스 내준 커쇼는…""\xa01급 시각장애인이 ""여기 경치 좋다""…이웃이 신고\xa0\'살상게임\' 접속한 병역거부 여호와의 증인 신도 무죄\xa0김주하, 뉴스 진행 중 땀이 \'줄줄\'…돌연 앵커 교체좋아요0훈훈해요0슬퍼요0화나요0후속기사 원해요0기사제공 :']"
2,삼성전자, 2019-06-2010:00,한국경제TV ,[이 시각 코스피] 코스피 현재 2121.39p 하락세 지속,https://finance.naver.com/news/news_read.nhn?article_id=0000784664&office_id=215&mode=search&query=삼성전자&page=7,"['       [이 시각 코스피] 코스피 현재 2121.39p 하락세 지속      기사입력2019-06-20 10:00기사원문좋아요훈훈해요좋아요 평가하기공감좋아요0훈훈해요0슬퍼요0화나요0후속기사 원해요0댓글[한국경제TV 라이온봇 기자][코스피 장중 시황]6월 20일 10시 0분 코스피는 전일 대비 3.39p(-0.16%) 하락한 2121.39p를 기록하고 있다.[그림 1] 현재 시각 코스피, 상승 및 하락 종목 수현재 코스피는 전체 상장 종목 중 404개 종목이 상승세를 보이고 있으며, 365개 종목은 하락중이다. 115개 종목은 보합세를 나타내고 있다.규모별로는 대형주(-0.23%)만 홀로 하락세를 나타냈다. 중형주(0.18%)와 소형주(0.1%)는 강세 흐름을 나타내고 있다.현재시각 유가증권시장 투자자별 매매동향을 살펴보면 기관이 홀로 230억원 순매수 하고 있다. 반면, 외인과 개인은 각각 -204억원, -29억원 순매도 중이다.[업종동향][그림 2] 업종별 상위 TOP5 (단위 : %)[그림 3] 업종별 하위 TOP5 (단위 : %)업종별로는 하락이 우세하다.의료정밀(1.73%), 전기가스업(0.94%), 유통업(0.45%), 증권(0.36%), 섬유의복(0.35%), 의약품(0.35%), 기계(0.16%), 서비스업(0.16%), 운수장비(0.15%), 음식료품(0.03%), 철강,금속(0.02%) 등은 상승세를 나타냈다.  반면, 종이,목재(-0.08%), 보험(-0.17%), 운수창고(-0.17%), 제조업(-0.22%), 비금속광물(-0.26%), 통신업(-0.37%), 금융업(-0.37%), 화학(-0.4%), 건설업(-0.41%), 전기,전자(-0.52%), 은행(-0.69%) 등은 하락세를 나타냈다. [시가총액 상위 종목 동향]시가총액 상위 10개 기업은 하락이 우세하다.""대장주"" 삼성전자는 전일(45,350원) 대비 300원(-0.66%) 내린 45,050원에 거래되고 있다.셀트리온(0.24%), POSCO(0.21%) 등은 강세를 보이고 있다. 현대모비스, 현대차 등 종목은 보합세를 보이고 있다.  반면에, LG화학(-0.14%), SK텔레콤(-1.14%), 신한지주(-1.2%), SK하이닉스(-1.49%), LG생활건강(-1.68%) 등은 약세를 보이고 있다. 라이온봇 기자 -한국경제TV※ 본 기사는 한국경제TV와 \'거장들의 투자공식이\'자체 개발한 \'라이온봇 기자\'가 실시간으로 작성한 기사입니다.라이온봇기자 ▶ 네이버 홈에서 [한국경제TV] 채널 구독하기 [생방송보기]▶ 대한민국 재테크 총집결! - [증권 / 주식상담 / 부동산]ⓒ 한국경제TV, 무단 전재 및 재배포 금지한국경제TV 관련뉴스해당 언론사에서 선정하며 언론사 페이지(아웃링크)로 이동해 볼 수 있습니다.송가인 교통사고...화물차에 추돌 ""병원 行""""폐경 늦으면 장수 가능성""…무려 4배까지\'이효리 하객룩\' 8년 만에 소환...""시대가 변해도""\'소비자 요청\' KFC 닭껍질 튀김...첫날 \'잭팟\'\'방송 중 식은땀\' 사라진 김주하 앵커좋아요0훈훈해요0슬퍼요0화나요0후속기사 원해요0기사제공 :']"
