,회사명,날짜,언론사,기사제목,링크,본문
0,삼성전자, 2019-03-2409:51,이데일리 ,"삼성전자, 주방 가전 해외 소비자매체서 잇딴 최고 평가",https://finance.naver.com/news/news_read.nhn?article_id=0004337182&office_id=018&mode=search&query=삼성전자&page=4,"['       삼성전자, 주방 가전 해외 소비자매체서 잇딴 최고 평가      기사입력2019-03-24 09:51기사원문좋아요훈훈해요좋아요 평가하기공감좋아요0훈훈해요0슬퍼요0화나요0후속기사 원해요0댓글美·佛 매체에게 베스트 평가쿡탑·월오븐 컨슈머리포트 1위크 슈아지르, 인덕션 \'추천\'삼성전자의 프리미엄 주방가전이 미국과 프랑스 등에서 최고 평가를 받았다. 삼성전자가 최근 선보인 셰프컬렉션 인덕션 올플렉스. (사진=삼성전자)[이데일리 양희동 기자] 삼성전자(005930)가 미국과 프랑스 등의 소비자 전문매체로부터 프리미엄 주방 가전에서 최고 평가를 받았다.24일 업계에 따르면 미국 소비자 전문지 컨슈머리포트(CR)는 가스·전기·인덕션 쿡탑과 전기 월오븐 등의 성능 평가 결과 삼성전자 제품 6개(총 8개 부문)가 ‘베스트 모델’로 선정했다. 가스 쿡탑은 30·36인치 부문에서 모두 평점 92점을 차지해 나란히 1위에 올랐다. 전기 쿡탑은 고온·저온 성능 테스트에서 36인치 제품이 평점 91점으로 최고 등급을 받았다. 인덕션 쿡탑은 삼성전자가 인수한 럭셔리 가전 브랜드 데이코(Dacor) 제품(30인치)과 36인치 제품 등이 ‘베스트 모델’에 포함됐다.프랑스 소비자연맹의 전문지 ‘크 슈아지르’는 인덕션 191개 제품을 대상으로 실시한 평가에서 삼성전자를 프랑스 ‘사우터’, 스웨덴 ‘일렉트로룩스’ 등과 함께 공동 1위로 발표했다. 또 식기세척기는 평점 73점으로 ‘최고 추천’ 제품으로 선정됐다.양희동 (eastsun@edaily.co.kr)총상금 1050만원, 사진 공모전 [나도 사진 기자다▶]이데일리 [구독하기▶] , 청춘뉘우스~ [스냅타임▶]＜ⓒ종합 경제정보 미디어 이데일리 - 무단전재 & 재배포 금지＞이데일리 관련뉴스해당 언론사에서 선정하며 언론사 페이지(아웃링크)로 이동해 볼 수 있습니다.린사모 추정 SNS 삭제…발렌시아 구단주 딸은 ""난 관련 없다""[2030 소비 NEW] 돈보다 내가 중요...아낌없이 지갑 여는 2030모텔 \'몰카\' 공포…""몰카 점검? 전원 플러그 체크·폰 손전등 비춰라""[정기자의 신기방기]버리지 말아야 할 것을 알려주는 쓰레기통\'그것이 알고싶다\'에 제보...승리·정준영 단톡방 김씨, 나 알지?좋아요0훈훈해요0슬퍼요0화나요0후속기사 원해요0기사제공 :']"
1,삼성전자, 2019-03-2409:38,이데일리 ,[주간증시전망]연준이 날린 비둘기…증시 봄바람 불까,https://finance.naver.com/news/news_read.nhn?article_id=0004337176&office_id=018&mode=search&query=삼성전자&page=4,"['       [주간증시전망]연준이 날린 비둘기…증시 봄바람 불까      기사입력2019-03-24 09:38기사원문좋아요훈훈해요좋아요 평가하기공감좋아요0훈훈해요0슬퍼요0화나요0후속기사 원해요0댓글- 유동성 환경 개선…코스피 2200선 재진입 모색- 반도체 수요 회복 모멘텀…순환매 장세 예상[이데일리 김정훈 기자][이데일리 이명철 기자] 미국 연방준비제도(Fed·연준)가 날린 비둘기가 증시 상승을 이끌까. 이번 주 증시는 긍정적인 대외 여건이 조성되는 가운데 코스피지수 2200선 재진입을 모색할 전망이다. 1분기 상장사 실적 눈높이가 낮아지고 있지만 미국과 중국의 무역협상 재개와 마이크론 감산 호재가 위험자산 선호 현상을 지지할 것이라는 판단이다.24일 마켓포인트에 따르면 지난 22일 코스피지수는 전주(15일)대비 0.50% 오른 2186.95로 거래를 마쳤다. 미·중 무역협상 진통에 투자자들이 관망세를 보였지만 연방공개시장위원회(FOMC)가 기준금리 동결과 함께 통화정책에서 시장 예상보다 완화적인 모습을 보이면서 견조한 흐름을 보였다. 외국인은 한주간 8000억원대 순매수를 나타내며 수급을 주도했다.연준의 금리 인상과 보유자산 축소 중단으로 유동성 환경이 개선되면서 단기 증시에는 긍정적 분위기가 조성될 전망이다. 25일(현지시간)부터 주요 연준 위원들의 연설이 예정됐는데 대체로 비둘기파적인 언급이 예상되는 점도 증시에는 우호적인 요소다.백찬규 한국투자증권 연구원은 “금리 조절을 통한 유동성 공급으로 시장 자금흐름과 기업 실적 측면에 도움이 될 것”이라며 “위험자산 선호심리가 나타나고 경기지표와 기업 실적 예측에도 민감하게 반응할 것”이라고 예상했다.다만 연준의 통화 완화적인 입장에도 시장이 큰 폭으로 오르지 않은 것에 주목해야 한다는 지적이다. 경기 둔화에 대한 우려가 불확실성으로 작용하고 있는 상황이어서 경기를 부양할 수 있는 추가 카드가 나와야 유동성 장세를 향유할 수 있다는 판단이다. 미·중 무역협상에 시장의 관심이 지속되는 이유다.이달 28일부터는 미·중 고위급 무역협상이 재개된다. 양국은 4월 말 협상 타결을 목표로 하고 있어 이번 회담에서 성과가 나올지 기대를 모은다. 약달러 기조가 나타나는 가운데 중국에서 발표 예정인 구매자관리지수(PMI) 등 경제지표도 주목해야 할 부분이다. 김윤서 신한금융투자 연구원은 “약달러 자체만으로 효과가 미약하겠지만 미·중 협상 불확실성이 해소되고 경기 바닥 신호가 나오면 위안화 절상 속도는 가팔라질 수 있다”며 “중국 소비주에 계속해서 관심을 가져야 할 때”라고 조언했다.시장 예측에 비해 성과가 부진할 경우에도 대비해야 한다. 김영환 KB증권 연구원은 “아직 핵심 쟁점에서 논란의 여지가 많아 협상 타결시점의 추가 지연 가능성도 배제할 수 없다”며 “협상 변수는 증시 변동성을 키우는 요인”이라고 지적했다.서버 수요 회복 전망이 제기된 반도체 업종 등 경기민감주의 모멘텀은 당분간 계속될 전망이다. 마이크론은 지난 21일 실적 발표에서 D램과 낸드 재고가 해결될 때까지 감산을 시작한다고 발표했다. 이후 외국인의 매수세가 반도체에 집중되면서 삼성전자(005930)와 SK하이닉스(000660)는 한 주 간 5.32%, 11.75% 각각 올랐다. 모멘텀이 확산될 경우 바이오에서 정보기술(IT)로의 순환매 장세가 이어질 것으로 예상된다. 김병연 NH투자증권 연구원은 “1분기 실적 추정치의 추가 하향과 밸류에이션 부담 등 상승 여력이 높지 않다”면서도 “각국 통화정책이 효과를 볼 경우 경기민감주 중심으로 종목 장세가 나타날 것”이라고 내다봤다.이명철 (twomc@edaily.co.kr)＜ⓒ종합 경제정보 미디어 이데일리 - 무단전재 & 재배포 금지＞이데일리 관련뉴스해당 언론사에서 선정하며 언론사 페이지(아웃링크)로 이동해 볼 수 있습니다.재무 비상등 켜진 아시아나항공, 금호아시아나그룹 영향은""기자가 출세하려고 보도..우린 힘없다"" 승리가 \'그알\'에 보낸 문자빗나간 \'父心\'…자식에 대나무·화장대 다리 휘두른 아버지들김학의 부인 도피? 안 가겠다는 사람 억지로 보낸 것홍준표 4대강 보 해체? 文 정부, 국가기반시설 파괴에만 열중좋아요0훈훈해요0슬퍼요0화나요0후속기사 원해요0기사제공 :']"
2,삼성전자, 2019-03-2409:05,뉴시스 ,"이통사 주총시즌...스톡옵션, 사내이사 안건 등에 관심 집중",https://finance.naver.com/news/news_read.nhn?article_id=0009130459&office_id=003&mode=search&query=삼성전자&page=4,"['       이통사 주총시즌...스톡옵션, 사내이사 안건 등에 관심 집중      기사입력2019-03-24 09:05기사원문좋아요훈훈해요좋아요 평가하기공감좋아요0훈훈해요0슬퍼요0화나요0후속기사 원해요0댓글LGU+, 지난 15일 주총...에너지 사업 추가SKT, KT는 각각 26일과 29일에 주총 나서【서울=뉴시스】최선윤 기자 = 15일 LG유플러스의 주주총회를 시작으로 이동통신 3사가 본격적인 주총 시즌에 돌입했다. SK텔레콤과 KT는 각각 26일과 29일 주총이 예정돼있다.24일 통신업계에 따르면 이통 3사는 이달 주총을 통해 미래사업에 대한 방향을 구체화하고 최고경영자(CEO)를 중심으로 역량을 끌어올린다는 계획이다.◇LG유플러스, 15일 주총...에너지사업 추가가장 먼저 주총에 나선 LG유플러스는 15일 사업목적에 에너지 사업을 추가하며 이를 신성장동력으로 육성하겠다는 방침을 알렸다. 케이블TV 사업자 CJ헬로 인수를 통해 5G에서 우위를 점하겠다는 포부도 재차 강조했다.하현회 LG유플러스 부회장은 ""케이블TV 사업자 CJ헬로 인수를 통해 확대된 고객기반을 바탕으로 차별화된 서비스를 제공하고 업그레이드된 미디어 경쟁력으로 5G에서도 우위를 점하겠다""며 ""5G 서비스는 고객의 기대를 뛰어넘는 수준으로 고객의 일상의 변화를 일으키고 B2C 사업뿐만 아니라 자율주행, 스마트팩토리, 스마트시티 등 B2B 영역에서도 사업기회를 창출해 나가겠다""고 말했다.◇SK텔레콤, 26일 주총...7개 안건 의결SK텔레콤은 26일 재무제표 승인의 건, 정관 일부 변경의 건, 주식매수선택권 부여 승인의 건, 주식매수선택권 부여의 건, 사외이사 선임의 건, 감사위원회 위원 선임의 건, 이사 보수한도 승인의 건 등 7개 안건을 의결한다.하성호 CR센터장, 하형일 Corporate Development센터장, 박진효 ICT기술센터장, 윤풍영 Corporate센터장 등 총 4명의 핵심임원에게 합계 5477주의 주식매수선택권을, 유영상 MNO사업부장에게 1734주의 주식매수선택권을 부여하는 안건도 포함됐다.SK텔레콤은 주식매수선택권 부여해야 할 필요성에 대해 ""기업가치 극대화를 위해 중요 역할을 담당하는 핵심임원에게 주식매수선택권을 부여해 회사의 장기적 기업가치 제고를 추진하고자 한다""고 밝혔다. 또 ""경영진에게 주식매수선택권을 줘 회사의 장기적 기업가치 제고를 추진하겠다""고 덧붙였다.이와 함께 관심을 끄는 안건으로는 김석동 전 금융위원장 사외이사 선임의 건이 꼽힌다. SK텔레콤은 현재 하나금융그룹과 키움증권과 손잡고 제3인터넷은행 예비인가 신청 준비에 착수한 상태다.◇KT, 29일 주총...5개 안건 의결KT는 29일 재무제표 승인의 건, 정관 일부 변경의 건, 이사 선임의 건, 감사위원회 위원 선임의 건, 이사 보수한도 승인의 건 등 5개 안건의 의결한다.특히 사내이사 건임의 건이 이목을 끌 전망이다. 이번 KT 주총에서는 김인회 경영기획부문장(사장)과 이동면 KT 미래플랫폼사업부문장(사장)을 신규 사내이사에 선임하는 안건이 의결된다. 이 둘은 황창규 대표이사 회장의 추천을 받았다.업계에서는 내년 3월 임기가 끝나는 황창규 KT 회장이 차기 CEO의 내부 승계 의지를 밝한 만큼 사내이사 교체가 사실상 차기 CEO 경쟁으로 이어질 수 있다는 점에서 주목하고 있다. 김 사장은 삼성전자 출신으로 2014년 경영기획부문 재무실장으로 KT에 합류한 뒤 비서실장 등을 지냈다. 이 사장은 2003년부터 KT 기술전략팀장, 신사업개발TFT장, 융합기술원장 등을 역임했고 현재 미래플랫폼사업부문장을 맡고 있다.csy625@newsis.com▶ 네이버에서 뉴시스 채널 구독하기▶ 뉴시스 빅데이터 MSI 주가시세표 바로가기 <저작권자ⓒ 공감언론 뉴시스통신사. 무단전재-재배포 금지.>뉴시스 관련뉴스해당 언론사에서 선정하며 언론사 페이지(아웃링크)로 이동해 볼 수 있습니다.\'내 이야기에 집중해\' 휴대폰 보는 여친 때린 30대 실형""어, 한국 모텔 같은데""…제보로 몰카 생중계 잡았다""경적 시끄럽다"" 항의하는 행인 목검으로 살해…2심도 징역 6년차량 이동 요청에 \'30m 음주운전\'…징역 8개월아내 살해한 뒤 시신 논두렁에 유기한 50대 긴급체포좋아요0훈훈해요0슬퍼요0화나요0후속기사 원해요0기사제공 :']"
3,삼성전자, 2019-03-2409:01,연합뉴스TV ,[기업기상도] 맑을 조짐 보인 기업 vs 미세먼지 덮힌 기업,https://finance.naver.com/news/news_read.nhn?article_id=0000366946&office_id=422&mode=search&query=삼성전자&page=4,"['       [기업기상도] 맑을 조짐 보인 기업 vs 미세먼지 덮힌 기업      기사입력2019-03-24 09:01기사원문좋아요훈훈해요좋아요 평가하기공감좋아요0훈훈해요0슬퍼요0화나요0후속기사 원해요0댓글 [기업기상도] 맑을 조짐 보인 기업 vs 미세먼지 덮힌 기업 [명품리포트 맥]한 주 기업뉴스 리뷰 주간 기업기상도입니다.겨우내 미세먼지에 시달렸지만 이제 미세먼지 더 짙어지는 봄입니다. 경기사정이 기상과 비슷할 것 같아 걱정스러운데요. 주중 내린 비처럼, 경제 미세먼지 씻어낼 호재 기대하며 기업기상도 출발합니다.먼저 현대자동차입니다. 올해도 실적 우려 크지만 내수에선 새 쏘나타로 두 번째 안타쳤습니다.출시 100일만에 5만5,000대나 계약돼 반년 넘게 기다려야 받는 대형 SUV 팰리세이드에 이어 신형 쏘나타도 닷새만에 사전예약 1만대 넘었습니다. 기존 제품 두 달치 판매분입니다. 커지고 첨단화하고 \'아저씨차\' 소리듣던 디자인도 젊어진 덕입니다.하지만 해외서도 통할지 더 봐야 하고요. 미·중 양대시장 부진과 각종 고발, 소송악재도 뚫어야 합니다, 정의선 부회장님.다음은 작년 최고 스타기업 빅히트 엔터테인먼트입니다.실적 집계해보니 방탄소년단 덕에 말 그대로 \'빅히트\'였습니다.월드스타 방탄소년단 덕에 1년새 매출은 2.3배, 이익은 2배 됐습니다. 매출 2,100억원대에 영업이익 641억원,,이익률이 30%를 넘고 매출 2배가 넘는 업계 1위 SM보다 이익이 많고요. 규모로는 JYP 제치고 \'빅3\' 됐습니다.부조리에 대한 분노가 에너지였다는 방시혁 대표님.그 분노로 연예계 만연한 부조리들 깨고 더 큰 실적 기대하겠습니다.이제 흐린 기업입니다. 먼저 YG 엔터테인먼트입니다.지난주 내내 정부와 여론의 집중 타깃이 됐습니다.소속 연예인중 으뜸 빅뱅의 멤버 승리 사건으로도 대형 악재인데, 양현석 대표가 홍대쪽 클럽 실소유주란 말 나오더니 끝내 국세청의 칼 서울청 조사4국이 특별세무조사에 나섰습니다. 작년 실적도 매출이 18% 넘게 줄고 영업이익은 62% 급감했습니다.사건은 이제 YG를 넘어 다른 연예인, 또다른 클럽으로 번졌습니다.하지만 사건 초반 양 대표의 적극 방어에도 악재 탈출은 쉽지 않다는 게 문제입니다.이번엔 삼성전자입니다. 작년 실적은 대박인데 올해는 양대 핵심 반도체와 스마트폰에서 모두 우울한 전망이 나왔습니다.반도체 경기가 작년 말부터 꺾였다는 것은 다 알려졌습니다만 증권가 전망 종합해보니 1분기 삼성전자 영업이익 평균 전망이 8조3,000억원대.1년 전보다 40% 넘게 줄 것 같답니다.스마트폰 매출액은 올해 중국 화웨이에 역전될 수 있다는 전망이 미국에서 나왔습니다.물론, 반도체경기는 언젠가는 살 겁니다. 새 스마트폰 갤럭시 S10 각국 반응, 특히 중국의 반응이 이전과 다르다는 긍정적 보도도 나옵니다. 이재용 부회장님. 어느 전망이 맞을지 1분기 성적표 지켜보겠습니다. 다음은 SK케미칼,현 SK디스커버리입니다. 가습기 살균제 사건 다시 수사 시작됐는데 조짐이 썩 좋지 않습니다.검찰 수사가 예사롭지 않습니다. 지지난주 증거 인멸혐의로 부사장 구속되더니 지난 주엔 가습기 살균제 납품처 애경과 제품 관련 모든 피해 책임진다는 계약을 맺은 사실이 알려졌습니다.SK는 일단 제조물책임법 따른 통상적 계약이라며 선을 그었습니다.하지만 자기상표 붙여 판 애경도 책임이 있다는 해석이 있는데, 굳이 이런 계약 맺은 것 때문에 제품 안전성 등 다른 이유가 있는게 아니냐는 의심을 받고 있습니다.마지막은 KT입니다. 정치권 관련 특혜채용 논란이 갈수록 태산입니다.검찰이 지난 주 김성태 자유한국당 의원 딸의 특혜채용을 확인했다며 당시 KT 임원을 구속했습니다. 이걸로 일단락되나 했지만 다음엔 노조가 한국당 황교안 대표, 정갑윤 의원 자제도 KT에 근무했다며 수사 확대를 요구했고 그 다음엔 홍문종 의원 보좌관, 비서관 4명의 특혜채용설까지 불거졌습니다.당사자, 경영진들은 이를 적극 반박, 부인하고 있습니다. KT는 엄연히 상장사입니다. 검찰, 법원은 이 문제 빨리 밝혀내 다른 주주들 피해를 막을 필요가 있습니다.지난해 대기업들이 앞다퉈 거창한 투자, 일자리 창출 계획 내놨죠. 그런데 지난주 대통령은 ""민간기업 일자리 창출이 부진하다""고 평했습니다. 이유야 있겠죠. 하지만 보여주기식 투자, 일자리 계획은 그만 접을 때도 됐습니다. 지금까지 주간 기업기상도였습니다.연합뉴스TV 기사문의 및 제보 : 카톡/라인 jebo23 ▶ 연합뉴스TV 네이버 채널 구독\xa0\xa0 ▶ 생방송 시청 ▶ 대한민국 뉴스의 시작, 연합뉴스TV 앱 다운받기연합뉴스TV 관련뉴스해당 언론사에서 선정하며 언론사 페이지(아웃링크)로 이동해 볼 수 있습니다.\xa01초만 늦었다면…억세게 운 좋은 사내\xa0\'승차거부 안하면 3,000원\'…소비자 부담 가중\xa0맥주 1병 훔친 미군 난동 부리다 벌금 700만원 선고\xa0급한 불 끈 YG…양민석 대표이사 재선임\xa0\'우유주사\' 프로포폴 투약 왜 문제?…처벌 사례는좋아요0훈훈해요0슬퍼요0화나요0후속기사 원해요0기사제공 :']"
4,삼성전자, 2019-03-2408:58,아시아경제 ,"외국인, 코스피 사고 코스닥 팔고",https://finance.naver.com/news/news_read.nhn?article_id=0004435683&office_id=277&mode=search&query=삼성전자&page=4,"['       외국인, 코스피 사고 코스닥 팔고      기사입력2019-03-24 08:58기사원문좋아요훈훈해요좋아요 평가하기공감좋아요0훈훈해요0슬퍼요0화나요0후속기사 원해요0댓글 [아시아경제 송화정 기자]외국인이 2주 연속 매수세를 지속했다. 코스피에서는 순매수를 지속했으나 코스닥에서는 \'팔자\'세로 돌아섰다.24일 한국거래소에 따르면 외국인은 지난 18일부터 22일까지 한 주간 국내 주식시장에서 약 7039억원을 사들였다. 코스피 시장에서는 8062억원을 순매수했으나 코스닥 시장에서는 1003억원을 팔아 매도세로 돌아섰다.외국인이 지난 주 가장 많이 사들인 종목은 우리금융지주였다. 외국인은 지난 한 주간 우리금융지주를 2353억원 순매수했다. 뒤이어 SK하이닉스를 1948억원 사들였다. 이밖에 삼성전자(1606억원), 호텔신라(916억원), LG화학(587억원), 아모레퍼시픽(387억원), 휠라코리아(336억원), KT&G(319억원), 포스코(205억원), LG생활건강(183억원) 등을 사들였다.지난 주 외국인이 가장 많이 판 종목은 아난티였다. 외국인은 지난주 아난티를 712억원 팔아치웠다. 이어 한국전력을 503억원 순매도했다. 이밖에 KB금융(428억원), 삼성바이오로직스(395억원), SK텔레콤(358억원), 신한지주(331억원), 메디톡스(224억원), 롯데케미칼(222억원), 셀트리온(215억원), 바이로메드(190억원) 등이 외국인 순매도 상위에 올랐다.우리금융지주와 아난티가 각각 외국인 순매수와 순매도 1위에 오른 것은 지난 주 블록딜 영향이 있는 것으로 보인다. 우리은행은 지난 22일 블록딜로 보유 중인 우리금융지주 주식 1834만6782주(지분 2.7%)를 해외 기관투자자들에게 전량 매각했다고 밝혔다. 아난티는 2대 주주인 중국민생투자유한공사(CMIG)의 보유 지분 매각 소식에 지난 22일 주가가 15% 하락했다. CMIG는 아난티 주식 1206만주(14.6%)를 블록딜(시간외 대량매매) 방식으로 처분한 것으로 알려졌다.외국인들이 한국 시장을 선호할 요인이 눈에 띄지 않으면서 순환매 장세가 이어질 것이란 전망이다. 김영환 KB증권 애널리스트는 ""미국의 통화정책이 글로벌 증시 상승을 이끌거나 미·중 무역협상이 타결되기까지는 시간이 더 필요하다""면서 ""단기적으로 글로벌 증시 전반에 걸친 상승보다는 경기와 실적이 양호한 지역과 그렇지 않은 지역 간의 차별화가 나타날 공산이 큰데 글로벌 투자자들에게 한국이 선호될 여지는 적은 상황""이라고 분석했다. 김 연구원은 ""4월까지는 순환매 장세가 연장될 것""이라고 덧붙였다.송화정 기자 pancake@asiae.co.kr▶ 아시아경제 채널 추가하고 에어팟, 해외여행비 받자!▶ 재미와 신기 \'과학을읽다\' ▶ 꿀잼 \'인기만화\'<ⓒ경제를 보는 눈, 세계를 보는 창 아시아경제 무단전재 배포금지>아시아경제 관련뉴스해당 언론사에서 선정하며 언론사 페이지(아웃링크)로 이동해 볼 수 있습니다.안희정 부인, 김지은씨 병원 진단서 공개했다가…서울대 합격하고도 100명 넘게 안 갔다니…정두언, 성추문 김학의에 ""친구인데, 옛날엔…""삼성 이재용 \'진짜 실력\' 나왔다…\'신의 영역\' 개발""연봉 1억은 가뿐""…우리가 몰랐던 고소득 전문직좋아요0훈훈해요0슬퍼요0화나요0후속기사 원해요0기사제공 :']"
