,회사명,날짜,언론사,기사제목,링크,본문
4,NC soft, 2017-12-1916:28,매일경제 ,한중 관계 개선에 커지는 판호 기대감…주목되는 게임주는?,https://finance.naver.com/news/news_read.nhn?article_id=0004069067&office_id=009&mode=search&query=엔씨&page=1,"[""       한중 관계 개선에 커지는 판호 기대감…주목되는 게임주는?      기사입력2017-12-19 16:28기사원문좋아요훈훈해요좋아요 평가하기공감좋아요0훈훈해요0슬퍼요0화나요0후속기사 원해요0댓글 최근 문재인 대통령의 중국 방문으로 한중 관계가 회복 조짐을 보이면서 게임업계에도 훈풍이 예상되고 있다. 중국 내 게임 서비스를 위한 허가인 ‘판호’ 발급이 이뤄질 것이라는 기대감이다. 이에 따라 판호를 대기 중인 게임주에도 시선이 쏠린다.현재 중국 출시를 확정하고 판호 발급을 대기 중인 게임업체는 엔씨소프트, 넷마블게임즈, 펄어비스, 웹젠 등이 꼽힌다.  엔씨소프트의 경우 지난해 일찍부터 알파게임즈와 모바일게임 ‘리니지 레드나이츠’의 중국 수출계약을 체결하고 현지 시장 진출을 준비해왔다. 이미 지난해 현지 사전예약도 진행했다. 그러나 판호 발급이 이뤄지지 않으면서 서비스가 지연되고 있는 상황이다. 최근 대만 시장에 진출한 ‘리니지M’의 향후 중국 시장 진출도 기대할만하다.넷마블게임즈도 지난해 ‘리니지2 레볼루션’의 판호를 신청하고 중국 서비스를 타진해왔다. 올해 소규모 테스트도 진행했다. 현지 퍼블리셔가 중국 최대 IT·게임 기업 텐센트라는 점에서 흥행 기대감도 높다. 사실상 중국 버전 개발이 완료됐다는 점에서 최우선 순위 중국 진출작으로 평가된다.펄어비스도 대표작 ‘검은사막’을 스네일게임즈를 통해 중국 시장에 선보일 예정이다. 최근 김대일 의장이 문재인 대통령의 중국 방문 경제사절단과 함께 한중 비즈니스포럼에 참석해 화제를 모으기도 했다. 특히 펄어비스는 ‘검은사막’의 모바일 버전 ‘검은사막 모바일’의 출시도 앞두고 있어 향후 이 게임의 중국 진출 기대감도 높다.‘뮤’ 지식재산권(IP) 제휴 사업으로 주가를 높인 웹젠도 또 다른 대표 IP ‘썬’을 활용한 모바일게임의 중국 출시를 준비 중이다. 중국 인터넷 업체 치후360이 준비 중인 모바일 MMORPG로 판호 문제가 해결되지 않아 중국 내 출시가 미뤄지고 있다. 웹젠 작품 중 중국 내에서 ‘뮤’ 다음으로 인지도가 높은 IP라는 점에서 또 다시 제휴 사업의 성공 사례가 될지 주목된다.이외 액션스퀘어도 모바일게임 ‘삼국블레이드’의 중국 서비스를 준비 중이며 바른손이앤에이의 경우 자회사 엔투스튜디오가 개발 중인 모바일게임 ‘프로젝트B’의 중국 서비스 계약을 지난 2월 창유와 체결한바 있다.장외 거래 시장에서는 블루홀도 주목할만하다. 블루홀은 자회사 펍지의 ‘배틀그라운드’가 중국 텐센트와 퍼블리싱 계약이 이뤄진 상황이며 룽투게임과 라인의 합작법인 ‘란투게임즈’가 블루홀의 대표작 ‘테라’ IP를 활용한 모바일 MMORPG도 제작하고 있다.이와관련 업계 한 관계자는 “최근 한중 외교관계가 우호적으로 변하면서 판호 문제 등의 해소 기대감이 높은 것이 사실”이라며 “내년 한국업체들의 활발한 중국 사업이 기대되는 상황”이라고 설명했다.[임영택기자 ytlim@mkinternet.com]▶뉴스 이상의 무궁무진한 프리미엄 읽을거리 ▶아나운서가 직접 읽어주는 오늘의 주요 뉴스[ⓒ 매일경제 & mk.co.kr, 무단전재 및 재배포 금지]매일경제 관련뉴스해당 언론사에서 선정하며 언론사 페이지(아웃링크)로 이동해 볼 수 있습니다.'뇌섹녀 볼륨몸매甲' 유인영, '아찔 비키니 자태' 자랑유명 아이돌 '샤이니' 종현 숨진 채 발견샤이니 종현, 청담동 자택서 숨진 채 발견'밤새 사라진 타이어' 알고보니 네 짝을 모두…'레전드 뒤태' 장윤주, '숨 막히는 완벽 몸매' 드러내다좋아요0훈훈해요0슬퍼요0화나요0후속기사 원해요0기사제공 :""]"
5,NC soft, 2017-12-1915:49,이데일리 ,"[마감]코스피, 멀어진 ‘산타랠리’ 꿈…연이틀 하락",https://finance.naver.com/news/news_read.nhn?article_id=0003995426&office_id=018&mode=search&query=엔씨&page=1,"['       [마감]코스피, 멀어진 ‘산타랠리’ 꿈…연이틀 하락      기사입력2017-12-19 15:49기사원문좋아요훈훈해요좋아요 평가하기공감좋아요0훈훈해요0슬퍼요0화나요0후속기사 원해요0댓글- 기관·외국인 동반 매수세에도 2500선 탈환 무산- SK하이닉스 등 기술주 상승…암호화폐·화장품株↓[이데일리 이명철 기자] 코스피지수가 이틀 연속 하락 마감했다. 세제 개편 기대감이 반영된 미국 뉴욕 증시가 연일 상승하는 것과는 다른 양상이다. 일부 기술주를 제외하고는 대부분 업종이 부진했다. 외국인은 순매수로 전환하긴 했지만 소규모에 그쳐 수급에 숨통을 틔워주지는 못했다.19일 마켓포인트에 따르면 코스피지수는 전일대비 0.13%, 3.35포인트 내린 2478.53으로 거래를 마쳤다. 장 초반 상승 출발했지만 이내 하락 전환하며 2500선 탈환에 실패했다.간밤 뉴욕증시는 사상 최고치를 경신했지만 뉴욕발(發) 훈풍이 국내까지 불어오지 않는 상황이다. 곽현수 신한금융투자 연구원은 “미국과 달리 국내 증시는 모멘텀이 뚜렷하지 않은 상태여서 조정을 겪는 상황”이라며 “연말 산타 랠리는 사실상 사라진 상태로 내년초 실적 시즌을 기대해야 한다”고 진단했다.수급 측면에서 외국인은 646억원 순매수해 3거래일만에 매수세로 전환했다. 전기·전자와 철강및금속을 각각 236억원, 235억원어치 사들였다. 기관은 2824억원을 순매수했다. 금융투자는 2524억원, 투신 316억원, 국가 295억원, 연기금등 173억원, 사모펀드 114억원을 각각 순매수했고 은행은 582억원 순매도했다. 개인은 3574억원을 내다팔았다. 프로그램 매매는 차익과 비차익을 합쳐 2345억원 순매수를 기록했다.업종별로는 0.93% 오른 전기·전자와 은행(0.75%), 보험, 증권 등 일부만 오르는 데 그쳤다. 기계와 섬유·의복은 각각 2.70%, 2.63% 하락했고 이어 음식료품, 비금속광물, 서비스업, 유통업, 건설업, 화학 등 순으로 떨어졌다.시가총액 상위종목 중에서는 웅진 피인수설이 나온 코웨이(021240), 세무조사 관련 보도가 나온 엔씨소프트(036570) 등을 비롯해 한온시스템(018880) 강원랜드(035250) 이마트(139480) KT(030200) LG생활건강(051900) 넷마블게임즈(251270) 한국타이어(161390) 등이 하락했다. 반면 대장주 삼성전자(005930)를 포함해 SK하이닉스(000660) 삼성전기(009150) 삼성SDI(006400) 등 정보기술(IT) 관련주는 상승했다. 개별 기업별로는 암호화폐 관련주로 분류된 주연테크(044380) 엔케이물산(009810) 등이 급락했고 화장품업체인 제이준코스메틱(025620) 에이블씨앤씨 한국화장품제조(003350), 대규모 유상증자를 발표한 CJ제일제당(097950) 등도 크게 내렸다. 실적 개선 기대감이 반영된 코스모화학(005420)과 금호석유(011780), 코웨이 인수설이 불거진 웅진(016880) 등은 상승했다.이날 거래량과 거래대금은 각각 3억489만주, 5조773억원으로 집계됐다. 172개 종목이 오른 반면 647개는 하락했다. 상한가와 하한가는 없었다. 63개 종목은 보합권에서 거래됐다.이명철 (twomc@edaily.co.kr)▶네이버 채널에서 ‘이데일리’를 구독해주세요▶[페이스북] 보러가기~ ▶[카카오톡] 플친 맺기~♥＜ⓒ종합 경제정보 미디어 이데일리 - 무단전재 & 재배포 금지＞이데일리 관련뉴스해당 언론사에서 선정하며 언론사 페이지(아웃링크)로 이동해 볼 수 있습니다.北 생화학무기도 개발‥압도적 힘으로 대응(종합)""주담대 금리 5%대 코앞, 당장은 변동금리·3년 이상은 고정금리""[맹모의 귀환] 대치·목동 주택시장 \'핫 뜨거\'종현 유서 속 \'의사\'..김현철 제 동료로 인정할 수 없다세계적 경제 전문가들이 비트코인은 버블 외치는 이유좋아요0훈훈해요0슬퍼요0화나요0후속기사 원해요0기사제공 :']"
6,NC soft, 2017-12-1915:10,부산일보 ,엔씨 '파이널 블레이드' 콘텐츠 업데이트,https://finance.naver.com/news/news_read.nhn?article_id=0000764610&office_id=082&mode=search&query=엔씨&page=1,"[""       엔씨 '파이널 블레이드' 콘텐츠 업데이트      기사입력2017-12-19 15:10기사원문좋아요훈훈해요좋아요 평가하기공감좋아요0훈훈해요0슬퍼요0화나요0후속기사 원해요0댓글     엔씨소프트는 모바일 RPG(역할수행게임) '파이널 블레이드'에 대한 콘텐츠 업데이트를 진행했다고 19일 밝혔다.\xa0구체적으로 보면 이번 업데이트를 통해 신규 영웅으로 초월 영웅 '발라스'가 추가됐다. 초월 영웅 '적랑'과 강림 영웅 '은월 적오'의 새로운 코스튬도 확인할 수 있다.\xa0\xa0신규 콘텐츠 '시련의 탑'도 공개됐다. 최대 5인(70레벨 이상) 편성으로 입장할 수 있는 시련의 탑은 모두 30층으로 구성되며 이용자는 각 층 정복 뒤 다음 층에 도전할 수 있다.연말 맞이 이벤트도 진행한다. 다음달 11일까지 성탄목 미니게임 이벤트를 통해 하늘에서 내리는 아이콘을 클릭하면 점수(1점 당 눈꽃결정 1개 획득)를 받을 수 있다. 교환소에서 눈꽃결정을 교환하면 '영혼 호리병', '천년호리 정수' 등의 아이템을 획득할 수 있다.다음 업데이트 전까지 '검은돈에 나타난 산타를 만나보세요' 이벤트도 펼쳐진다. '검은돈 추격' 난이도에서 받은 '산타의 선물상자'를 사용하면 '청옥', '공깃밥', '영혼 호리병' 등의 보상을 받을 수 있다고 한다.\xa0민지형 기자 oasis@    좋아요0훈훈해요0슬퍼요0화나요0후속기사 원해요0기사제공 :""]"
7,NC soft, 2017-12-1915:03,매일경제 ,투자기업의 금융투자 실력 재무제표에서 확인하려면,https://finance.naver.com/news/news_read.nhn?article_id=0004068970&office_id=009&mode=search&query=엔씨&page=1,"[""       투자기업의 금융투자 실력 재무제표에서 확인하려면      기사입력2017-12-19 15:03기사원문좋아요훈훈해요좋아요 평가하기공감좋아요0훈훈해요0슬퍼요0화나요0후속기사 원해요0댓글/사진=게티이미지뱅크 [직장인들이여 회계하라-91] 일반 기업들도 금융자산에 투자를 한다. 본래의 영업활동에서 벌어들인 순현금 중 사업을 위한 재투자, 차입금 상환, 배당금 지급 등 필수적인 지출 후에 남는 잉여자금을 운용해야 하기 때문이다.기업들이 금융자산을 취득할 때에는 위험과 기대수익률, 현금이 묶이는 기간 등을 고려하여 채권, 주식, 간접투자상품 등에 골고루 투자하고 재무제표도 이런 근거로 작성한다.재무제표에서 자금 운용과 관련된 계정과목을 찾아보면 해당 기업의 투자철학이 얼마나 보수적인지 적극적인지에 대한 판단도 가능하고, 그들은 주식을 언제 사서 언제 파는지에 대한 것도 확인할 수 있다.기업들이 금융자산을 취득하면 재무제표에 당기손익 인식 금융자산, 만기 보유 금융자산, 매도 가능 금융자산으로 나누어 분류한다. 당기손익 인식 금융자산은 단기간에 매각할 목적으로 취득한 금융자산을 의미한다. 빈번하게 사고파는 주식 거래를 연상하면 된다. 그러나 실제로 기업이 고유의 영업활동을 하기도 바쁘기 때문에 주식 매수·매도를 빈번하게 할 수 없어서 주로 주가연계증권, 수익증권 같은 간접상품에 투자하는 경우가 많고 이들 상품이 당기손익 인식 금융자산으로 분류되는 편이다. 만기 보유 금융자산은 만기까지 보유할 적극적인 의도와 능력이 있는 경우에만 분류하도록 되어 있고 보통 국공채가 여기에 해당된다. 주식은 만기가 없기 때문에 당연히 만기 보유 금융자산이 될 수 없다. 만약 기업이 사정상 국공채를 만기까지 보유하지 않고 중간에 매도할 예정이라면 매도 가능 금융자산으로 분류하면 된다. 재무제표상 매도 가능 금융자산은 당기손익 인식 금융자산과 만기 보유 금융자산으로 지정되지 않는 경우에 분류되며 주로 상장·비상장 주식과 만기 전에 처분 가능성이 있는 국공채가 여기에 해당된다.다시 한 번 정리하면 기업이 주식에 투자하면 재무상태표에서 당기손익 인식 금융자산 또는 매도 가능 금융자산으로 표시되고, 국공채는 주로 만기 보유 금융자산과 매도 가능 금융자산으로 분류된다. 재무상태표에는 이들 금융자산에 대하여 금액 한 줄로만 표시되기 때문에 채권인지 주식인지, 주식이라면 어떤 종목인지 확인하려면 재무제표 주석 사항에서 찾아봐야 한다.유가증권시장에 상장되어 있는 가죽 원단 제조사인 조광피혁의 2017년 3분기 재무상태표를 보면 총자산이 2458억원인데 그중 41%인 1018억원이 매도 가능 금융자산으로 되어 있다. 매도 가능 금융자산 주석 사항을 펼쳐보면 아래 그림과 같다.  회사가 보유한 상장 주식 내역만 캡처하였다. 취득원가 칸을 보면 회사는 무려 816억원어치의 주식을 매입했고, 3분기 말 현재 주식의 공정가치가 약 1005억원이 되었다. 주식 투자로 약 23%의 수익률을 올린 것으로 계산된다. 가장 눈에 띄는 종목은 역시 오마하의 현인 워런 버핏이 최대주주이자 CEO로 있는 버크셔해서웨이(Berkshire Hathaway Inc.) 주식이다. 주당 3억원이 넘는 주식을 이 회사는 무려 113주나 갖고 있다. 그 밖에 다른 종목들을 보면 투자 시점에 따라 큰 이익을 낸 종목도 있고, 손실 중인 종목들도 일부 있지만 이 표를 통해 우리는 회사의 투자 방식을 대략 짐작할 수 있다. 회사는 높은 자산가치 기반하에 안정적인 사업모델을 갖춘 기업들에 대한 투자를 선호한다는 것이다. 회사는 매도 가능 금융자산으로 분류된 주식을 아직 처분하지 않고 보유하고 있기 때문에 발생된 미실현 손익에 대하여는 당기손익에 반영하지 않고, 자본에 가감한다. 이를 재무제표상 포괄손익이라고 한다.모바일 게임으로 큰돈을 벌고 있는 컴투스 같은 경우에도 매도 가능 금융자산이 3007억원에 달한다. 이는 2017년 3분기 회사의 총자산 8035억원 대비 37%에 해당하는 금액이다. 매도 가능 금융자산 주석 사항을 보면 회사는 상장 주식과 비상장 주식으로는 187억원 정도밖에 갖고 있지 않고, 국공채만 2820억원어치 보유한 것으로 나온다. 그리고 다른 잉여 현금 모두 장단기 예·적금에만 가입해 놓았다. 회사는 공격적인 자금 운용보다는 안정성을 택한 것으로 추정된다. 게임 대장주 엔씨소프트 역시 컴투스와 유사한 자금 운용 방식이다. 총자산 3조1600억원 중 66%인 2조710억원을 매도 가능 금융자산으로 갖고 있는 엔씨소프트의 경우 국공채만 무려 1조602억원어치나 보유 중이고 잉여 현금의 많은 부분을 역시 예·적금 위주로 보관 중이다. 개발한 게임 하나가 성공하면 큰돈을 벌어들이지만 실패할 경우에는 기업의 현금 흐름이 어려워질 수 있기 때문에 만일에 대비하여 자금 운용을 공격적으로 하지 못하는 것이라는 생각이 든다.이렇게 기업들의 금융자산 관련 주석 사항을 보면 기업들이 어떻게 자금을 운용하는지, 어떤 투자철학을 갖고 있는지 확인할 수 있다. 필자가 많은 기업들의 재무제표를 찾아본 결과 기업들은 금융자산에 투자할 때 생각보다 많이 보수적이고 안정적으로 자금을 운용한다. 사업에서 힘들게 번 돈이기 때문에 잃으면 안 된다는 생각이 깔려 있을 것이다. 우리 개인투자자도 마찬가지다. 피땀 흘려 번 돈을 투자하는 만큼 지키면서 투자해야 한다. 가끔씩 투자에 대한 아이디어가 떠오르지 않거나 투자 원칙이 흔들릴 때 전자공시시스템을 열어 기업들은 어떻게 투자하는지 찾아보는 것도 투자 힌트를 얻는 하나의 방법이 될 것이다.   [박동흠 현대회계법인 회계사] ※박동흠 회계사는 삼정회계법인을 거쳐 지금은 현대회계법인에서 근무하고 있는 15년 차 회계사이며 왕성하게 주식 투자를 하고 있는 개인투자자입니다. 회계사로서의 업무뿐만 아니라 투자 블로그 운영, 책 저술, 강의, 칼럼 기고 같은 일을 하면서 투자를 위한 회계 교육에 앞장서고 있습니다. 저서로는 '박 회계사의 재무제표 분석법' '박 회계사처럼 공모주 투자하기' '박 회계사의 사업보고서 분석법' '박 회계사의 재무제표로 보는 업종별 투자전략' 등이 있습니다.▶뉴스 이상의 무궁무진한 프리미엄 읽을거리 ▶아나운서가 직접 읽어주는 오늘의 주요 뉴스[ⓒ 매일경제 & mk.co.kr, 무단전재 및 재배포 금지]매일경제 관련뉴스해당 언론사에서 선정하며 언론사 페이지(아웃링크)로 이동해 볼 수 있습니다.'뇌섹녀 볼륨몸매甲' 유인영, '아찔 비키니 자태' 자랑유명 아이돌 '샤이니' 종현 숨진 채 발견샤이니 종현, 청담동 자택서 숨진 채 발견'밤새 사라진 타이어' 알고보니 네 짝을 모두…'레전드 뒤태' 장윤주, '숨 막히는 완벽 몸매' 드러내다좋아요0훈훈해요0슬퍼요0화나요0후속기사 원해요0기사제공 :""]"
8,NC soft, 2017-12-1915:01,파이낸셜뉴스 ,"[올해 게임결산] 글로벌 시장 '정조준', 본고장까지 게임한류 확산",https://finance.naver.com/news/news_read.nhn?article_id=0003927357&office_id=014&mode=search&query=엔씨&page=1,"['       [올해 게임결산] 글로벌 시장 \'정조준\', 본고장까지 게임한류 확산      기사입력2017-12-19 15:01기사원문좋아요훈훈해요좋아요 평가하기공감좋아요0훈훈해요0슬퍼요0화나요0후속기사 원해요0댓글  국내 주요 게임업체들이 본격적으로 글로벌 게임기업으로의 도약에 나서고 있어 주목된다. 중국 등 아시아 지역을 중심으로 확산된 \'게임한류\'를 북미, 유럽 등 게임 본고장까지 확산시키겠다는 것이다. 특히 올해는 중국과의 사드(SHAAD·노고고도미사일방어체계) 갈등으로 텃밭이던 중국 수출길이 막히는 악재가 발생했음에도 북미, 유럽 등 신흥시장을 개척해 성과를 이뤘다. 내년에는 중국 수출길도 다시 열릴 것으로 전망되는 만큼 \'게임한류\'가 전 세계로 확산될 것으로 기대된다.  19일 게임업계에 따르면 올해 국내 주요 게임사들의 해외 매출이 3조원을 훌쩍 넘어설 것으로 예상된다. 넥슨과 넷마블게임즈, 엔씨소프트 이른바 게임 \'빅3\'로 불리는 게임사들의 3·4분기까지 누적 해외 매출은 2조4400억원 수준으로 여기에 4·4분기까지 더하면 3조원을 넘어설 것이 확실시 된다.         넷마블게임즈가 북미, 유럽 시장에 선보여 인기를 끌고 있는 \'리니지2 레볼루션\'   올해는 국내 게임사들이 해외에서 잇딴 낭보를 전해왔다.  넥슨과 넷마블은 해외에서 선전을 이어가고 있다. 넥슨의 경우 중국 시장을 장악한 \'던전앤파이터\'의 인기가 견고하다. 모바일게임 \'히트\' 등이 일본 시장에서 의미있는 성과를 냈다. 넷마블은 북미 개발자회사인 카밤을 통해 선보인 \'마블 올스타 배틀\'이 지난 7월 미국 앱스토어 매출 순위 1위를 기록하는 등 선전하고 있다. 모바일게임 \'리니지2 레볼루션\' 역시 북미, 유럽 시장에서 매출 확대의 1등 공신 역할을 하고 있다.  게임 개발사 블루홀의 선전도 빛났다. 블루홀은 신작 온라인게임 \'배틀그라운드\'를 글로벌 게임 플랫폼 스팀을 통해 선보여 동시 접속자 수 300만명을 돌파하는 성과를 냈다. 이는 스팀 내에서도 최고 기록이다. 배틀그라운드가 한국은 물론, 북미와 유럽, 아시아 등 전세계에서 게임한류의 첨병으로 활약했다. 이 외에도 컴투스의 \'서머너즈워\'와 펄어비스의 \'검은사막\' 등도 북미와 유럽 시장에서 인기게임 스테디셀러로 자리잡았다.  내년은 \'게임한류\'의 전성시대가 될 것으로 예상된다. 중국과의 사드 갈등이 해소되면서 수출길이 다시 열릴 것으로 전망된다. \'리니지2 레볼루션\', \'리니지M\', \'배틀그라운드\' 등 올해 게임시장을 수놓았던 인기게임들이 줄줄이 중국 시장 입성을 눈앞에 두고 있다.          게임 빅3(넥슨, 넷마블게임즈, 엔씨소프트) 해외 매출 현황   (원)       구분 1분기 해외매출 2분기 해외매출 3분기 해외매출 누적   넥슨 5518억 3174억 3747억 1조2481억   넷마블게임즈 2106억 2791억 4102억 8998억   엔씨소프트 1119억 846억 963억 2928억         특히 엔씨소프트의 \'리니지M\'의 경우 중국 성적표를 가늠할 수 있는 대만시장에서 돌풍을 일으키고 있다. 사전예약 첫 날에만 54만명의 예악자를 모집했다. 출시 첫 날부터 주요 앱마켓 순위 1위를 휩쓸면서 대만 최고 인기게임으로 부상했다. 엔씨소프트가 인기 온라인게임 \'아이온\'을 기반으로 한 모바일게임을 준비중인데 이 게임은 북미와 유럽을 겨냥한 것으로 알려졌다. 컴투스는 서머너즈워 지식재산권(IP)을 활용한 새로운 게임으로 다시 한번 북미, 유럽 시장 평정에 나선다.  게임업계 한 관계자는 ""올해 중국 수출길이 막혔음에도 불모지라고 불리던 북미와 유럽에서 성공한 게임들이 등장하면서 또 한번의 게임한류 전성기의 토대를 다졌다""며 ""내년에는 과감한 인수합병(M&A)과 글로벌 게이머들을 겨냥한 게임 개발 등을 통한 게임한류 전성시대가 기대된다""고 말했다.  jjoony@fnnews.com 허준 기자   ▶ 세상의 모든 골 때리는 이야기 \'fn파스\'▶ 속보이는 연예뉴스 fn스타  ※ 저작권자 ⓒ  파이낸셜뉴스. 무단 전재-재배포 금지파이낸셜뉴스 관련뉴스해당 언론사에서 선정하며 언론사 페이지(아웃링크)로 이동해 볼 수 있습니다.유흥업소 접대부는 여성만 인정된다?\'거침없는 질주\' 비트코인에 대한 모든 것[재테크 Q&A] 40대부부 빚청산·노후 준비 가능?""먼지쌓인 옷·책 당장 기부하세요, 세액공제 짭짤합니다""유방암 진단받고 가슴절제했는데...알고보니 오진좋아요0훈훈해요0슬퍼요0화나요0후속기사 원해요0기사제공 :']"
