,회사명,날짜,언론사,기사제목,링크,본문
6,NC soft, 2017-09-0412:13,MBC ,"코스피, 지정학적 리스크 부담으로 하락세",https://finance.naver.com/news/news_read.nhn?article_id=0000786771&office_id=214&mode=search&query=엔씨&page=1,"[""       코스피, 지정학적 리스크 부담으로 하락세      기사입력2017-09-04 12:13기사원문좋아요훈훈해요좋아요 평가하기공감좋아요0훈훈해요0슬퍼요0화나요0후속기사 원해요0댓글 [정오뉴스]오늘 코스피는 외국인과 기관이 매수에 나서고 있지만 지정학적 리스크에 대한 부담으로 하락세를 이어가고 있습니다.이 시각 현재 코스피는 지난주보다 18.25포인트 하락한 2339.44포인트를 코스닥 지수는 7.93포인트 하락한 654.06포인트를 기록하고 있습니다.투자주체별 매매 동향을 보면 거래소시장에서는 개인이 매도에 나서고 있습니다.지난 주말 뉴욕 증시는 미국 고용지표 부진에 따라 기준금리 인상 기대감이 낮아진 영향으로 3대 지수 모두 소폭 상승하며 장을 마쳤습니다.시가총액 상위 종목에서는 네이버와 삼성물산이 2% 넘게 밀리고 있고 현대차와 우리은행도 하락세를 보이고 있습니다.반면 엔씨소프트와 롯데케미칼은 상승 흐름을 이어가는 가운데 업종별로는 대부분 내리고 있고 은행, 의류 정밀업이 2% 대 하락폭을 기록하고 있습니다.이 시각 현재 중국 증시는 오름세고  일본 증시는 하락하고 있습니다.신유리/삼성증권기자 [저작권자(c) MBC (www.imnews.com) 무단복제-재배포 금지]Copyright(c) Since 1996, MBC&iMBC All rights reserved.MBC 관련뉴스해당 언론사에서 선정하며 언론사 페이지(아웃링크)로 이동해 볼 수 있습니다.軍, 동해안서 대북 경고성 무력 시위 실시美 '北 위협, 엄청난 군사대응 직면할 것'김동연 '시장 불안 시 신속 안정화 조치'환경부, 사드 환경영향평가서 '조건부 동의' 결론트럼프 '한·미 FTA 폐기 이번 주 논의'좋아요0훈훈해요0슬퍼요0화나요0후속기사 원해요0기사제공 :""]"
7,NC soft, 2017-09-0411:15,파이낸셜뉴스 ,"[fnRASSI]엔씨소프트, 3.54% 오르며 거래량 증가",https://finance.naver.com/news/news_read.nhn?article_id=0003868622&office_id=014&mode=search&query=엔씨&page=1,"['       [fnRASSI]엔씨소프트, 3.54% 오르며 거래량 증가      기사입력2017-09-04 11:15기사원문좋아요훈훈해요좋아요 평가하기공감좋아요0훈훈해요0슬퍼요0화나요0후속기사 원해요0댓글엔씨소프트(036570)의 현재 거래량이 최근 5거래일 거래량의 최고치를 넘어섰다. 그리고 엔씨소프트는 4일 연속 상승흐름을 보이며, 11시 11분 현재 3.54% 증가한 410,000원에 거래중이다.   상장주식수 대비 거래량은 0.92%로 적정수준 최근 한달간 엔씨소프트의 상장주식수 대비 거래량을 비교해보니 일별 매매회전율이 0.92%로 집계됐다. 그리고 동기간 장중 저점과 고점의 차이인 일평균 주가변동률을 2.91%를 나타내고 있다.   외국인/기관 순매수, 개인은 순매도(한달누적)  전일까지 기관이 3일 연속, 외국인이 6일 연속 각각 동종목을 순매수 했다. 4주간을 기준으로 보면 외국인이 순매수량을 늘리며 307,136주를 순매수했고, 기관도 초반에 동종목을 순매수한 이후에 기세를 이어가며 248,065주를 순매수했다. 반면 개인들은 매도 관점으로 접근하면서 555,201주를 순매도한 것으로 나타났다. \'fnRASSI\'는 증권전문 기업 씽크풀과 파이낸셜뉴스의 협업으로 로봇기자가 실시간으로 생산하는 기사입니다.   fnRASSI@fnnews.com fnRASSI ▶ 세상의 모든 골 때리는 이야기 \'fn파스\'▶ 속보이는 연예뉴스 fn스타  ※ 저작권자 ⓒ  파이낸셜뉴스. 무단 전재-재배포 금지파이낸셜뉴스 관련뉴스해당 언론사에서 선정하며 언론사 페이지(아웃링크)로 이동해 볼 수 있습니다.별장에서 벌거벗은 男 웃는 사진, 꽃뱀의 최후불에 탄 주택서 남녀 숨진 채 발견, 이웃주민 하는말이..한국당 결국 폭발, 文 대통령 향해 ""5년 뒤에..""불륜녀로 찍힌 걸그룹 출신 여성의 최후커피 마시면 우리 몸에서 일어나는 무서운 변화좋아요0훈훈해요0슬퍼요0화나요0후속기사 원해요0기사제공 :']"
8,NC soft, 2017-09-0411:11,한국경제 ,"펀엔씨, 은광여고 학생들과 펀(Fun)한 기업 탐방 프로그램 진행",https://finance.naver.com/news/news_read.nhn?article_id=0003818575&office_id=015&mode=search&query=엔씨&page=1,"['       펀엔씨, 은광여고 학생들과 펀(Fun)한 기업 탐방 프로그램 진행      기사입력2017-09-04 11:11기사원문좋아요훈훈해요좋아요 평가하기공감좋아요0훈훈해요0슬퍼요0화나요0후속기사 원해요0댓글‘한경 청소년 경제체험대회’에 참여 중인 은광여자고등학교 학생들이 주식회사 펀엔씨 본사를 방문해 창업 계획을 세워보는 등 의미있는 시간을 보냈다.펀엔씨는 국내 애완용품 쇼핑몰 1위 사이트 \'강아지대통령\'을 운영 중인 회사로, 새롭고 창의적인 사고를 바탕으로 새로운 시장 패러다임을 만들어가고 있는 기업이다. 해당 업체는 강아지대통령에 이어 오픈한 고양이 용품 쇼핑몰인 \'고양이대통령\'도 크게 성공시키며 업계에서 펫 전문몰의 위치를 공고히하고 있다.이번 은광여고 학생들의 펀엔씨 본사 방문은 그들이 참여하고 있는 \'한경 청소년 경제체험대회\' 기업탐방 프로그램의 일환이다.올해로 12회째를 맞은 체험식 경제교육 프로그램인 \'한경 청소년 경제체험대회\'는 한국경제신문사의 후원으로 지난달 15일 서울 삼성동 코엑스 콘퍼런스룸에서 설명회를 열고 본격 일정을 시작했다. 주요 프로그램 중 하나인 기업탐방은 교사와 학생이 팀을 이뤄 주제를 선정하고 기업을 탐방하는 프로그램이다.올해는 전국 100개 고교팀과 중국에서 선발된 1개 특별팀 등 101개 팀 505명이 참여했다. 이들은 주제에 맞는 기업을 탐방하고 창업 계획을 세워보는 등의 과정을 통해 실물경제를 체험하게 된다.이날 펀엔씨를 방문한 여고생들은 특히 펫 사업분야에 관심이 많아 회사관계자들과 의미있는 질문을 주고 받았다. 학생들은 창업규모와 시장 상황, 특징, 홍보 방안 등 다양한 질문을 통해 미래의 창업계획을 설계했으며, 회사 내부 투어도 진행했다.특히 다양한 복지제도와 문화행사로 직원들이 즐겁게 일할 수 있는 회사를 만들고 있는 펀엔씨에서 학생들은 긍정적인 기운을 많이 얻어갔다는 후문이다.펀엔씨 관계자는 ""평소 미래의 인재들을 위해 사회적으로 기여할 수 있는 일이 없을까를 생각하던 중 경제체험대회라는 좋은 기회를 얻게 됐다""며 ""앞으로도 사회 기여 관련 프로그램에의 참여를 더욱 늘려 펀엔씨가 갖고 있는 노하우를 꿈나무들에게 전해주고 싶다""고 밝혔다.한경닷컴 뉴스팀 newsinfo@hankyung.com[한경닷컴 바로가기] [글방] [모바일한경 구독신청] ⓒ 한국경제 & hankyung.com, 무단전재 및 재배포 금지한국경제 관련뉴스해당 언론사에서 선정하며 언론사 페이지(아웃링크)로 이동해 볼 수 있습니다.""용산에 北 핵무기 떨어지면 수원까지…"" 초토화기아차 연봉 1억 넘나… 직원들 ""사실은""""미국에 오히려 손해"" 美 의원의 소신발언네이버 창업자 ""대기업 총수 싫다"" 이유가 \'깜짝\'거꾸로 수박바 #인간의욕심은끝이없다 [편의점 신상털기]좋아요0훈훈해요0슬퍼요0화나요0후속기사 원해요0기사제공 :']"
9,NC soft, 2017-09-0410:37,KBS ,개인투자자 8월 매수 상위 20종목 모두 ‘-’ 수익률,https://finance.naver.com/news/news_read.nhn?article_id=0010501557&office_id=056&mode=search&query=엔씨&page=1,"['       개인투자자 8월 매수 상위 20종목 모두 ‘-’ 수익률      기사입력2017-09-04 10:37기사원문좋아요훈훈해요좋아요 평가하기공감좋아요0훈훈해요0슬퍼요0화나요0후속기사 원해요0댓글 개인투자자들의 8월 주식시장 성적표가 부진한 것으로 나타났다. 금융투자업계에 따르면 지난달(8월 1∼31일) 개인투자자들이 가장 많이 사들인 주식 상위 20종목이 모조리 마이너스 수익률을 기록한 것으로 집계됐다. 개인투자자들이 4천267억 원어치를 사들여 가장 많이 순매수한 삼성전자는 8월에 3.90% 떨어졌다. 개인이 그다음으로 많이 매수한 코덱스(KODEX)레버리지(-4.48%), 한국항공우주(-10.54%), LG디스플레이(-1.58%), 현대중공업(-14.90%) 등 개인 순매수 상위종목이 모두 지난달 약세로 마감했다. 개인 순매수 상위 20종목의 평균 수익률은 -8.77%를 기록했다. 코스피의 월간 수익률(-1.64%)보다도 한참 떨어지는 성적표다. 반면 개인이 가장 많이 팔아치운 종목 중에서는 주가가 떨어진 종목이 거의 없었다.  개인이 2천514억 원어치를 팔아 순매도 1위를 기록한 엔씨소프트는 8월 한 달 동안 6.51% 올랐다. 삼성SDI(16.62%), LG전자(21.46%), LG화학(15.55%), 롯데케미칼(8.27%) 등도 개인의 순매도 상위를 차지했지만 주가는 크게 상승했다. 개인 순매도 상위 20종목 내에서 월간 마이너스 수익률을 기록한 종목은 한국전력(-3.70%)이 유일했다. 개인이 가장 많이 팔아치운 상위 20종목의 지난달 평균 수익률은 8.34%로 집계됐다. 임승창기자 (sclim@kbs.co.kr)▶ [저작권자ⓒ KBS 무단복제-재배포 금지]KBS 관련뉴스해당 언론사에서 선정하며 언론사 페이지(아웃링크)로 이동해 볼 수 있습니다.트럼프 ""北과 거래하는 모든 국가와 거래중단 고려""北·中 접경도 \'흔들\'…학생 긴급 대피 \'공포 확산\'[고현장] 브레이크 고장 났을 때…사람이 직접? \'황당\'[고봉순] 개 성대모사 능력자 앵무새트럼프 ""대북 유화책 효과없어"", \'대북 공격\' 질문엔…좋아요0훈훈해요0슬퍼요0화나요0후속기사 원해요0기사제공 :']"
10,NC soft, 2017-09-0410:31,머니투데이 ,"원종준 라임운용 대표 ""북핵 이슈 달라진것 없다…기업실적에 주목""",https://finance.naver.com/news/news_read.nhn?article_id=0003929343&office_id=008&mode=search&query=엔씨&page=1,"['       원종준 라임운용 대표 ""북핵 이슈 달라진것 없다…기업실적에 주목""      기사입력2017-09-04 10:31기사원문좋아요훈훈해요좋아요 평가하기공감좋아요0훈훈해요0슬퍼요0화나요0후속기사 원해요0댓글 [머니투데이 한은정 기자] [""실적 호전주 차별적 상승세""]원종준 라임자산운용 대표는 4일 북한의 6차 핵실험과 관련, ""과거와 달라진 건 없으며 매수의 기회로 봐야 한다""고 밝혔다. 원 대표는 ""이날 외국인이 매수하고 있고 환율 역시 큰 폭으로 오른게 아니다""라며 ""협상 과정이 길어질 수 있으나 과거 주식시장 지지선이었던 주가순자산비율(PBR) 1배, 2300선은 지킬 것""이라고 분석했다.상장 기업들의 하반기 실적 추정치가 다시 상향되고 있다는 점도 긍정적으로 봤다. 그는 ""하반기 실적 증가율이 상반기에 못 미칠것이란 우려가 있었지만 최근 정유, 화학, 철강 등 소재업종의 이익 추정치가 올라오고 있다""며 ""중소형주 역시 이익증가율이 개선되는 분위기""라고 설명했다.이어 ""상반기에는 시가총액 규모별로는 대형주만 좋았고 업종별로는 정보기술(IT), 금융 업종만 주목받았다면 최근엔 온기가 확산되는 분위기""라고 덧붙였다.원 대표는 ""대북 이슈에도 롯데케미칼, 엔씨소프트 등 실적 호전주들은 차별적으로 오르고 있다""며 ""한미 FTA 우려가 있던 자동차주들도 영향이 없어보인다""고 말했다.TOM칼럼-깊이있는 투자정보▶무료 만화 즐기고~ 선물타자!▶ 빵빵한 차&레이싱걸▶ 한은정 기자 rosehans@mt.co.kr머니투데이 관련뉴스해당 언론사에서 선정하며 언론사 페이지(아웃링크)로 이동해 볼 수 있습니다.2만원짜리 치킨 만드는데 원가는 2600원대\'55세 발레리나\' 서정희, 믿기지 않는 몸매""제네시스 \'G70\', 마세라티급 성능""…가격 3750만원부터\'우이신설선\' 타보니…""북한산 가자"" 등산객으로 \'북적\'""한 관에 넣어 화장해주세요""…일가족 3명 숨진 채 발견좋아요0훈훈해요0슬퍼요0화나요0후속기사 원해요0기사제공 :']"
11,NC soft, 2017-09-0410:16,아시아경제 ,"[특징주]엔씨소프트, 3Q 최고 실적 전망에 3% ↑",https://finance.naver.com/news/news_read.nhn?article_id=0004067757&office_id=277&mode=search&query=엔씨&page=1,"['       [특징주]엔씨소프트, 3Q 최고 실적 전망에 3% ↑      기사입력2017-09-04 10:16기사원문좋아요훈훈해요좋아요 평가하기공감좋아요0훈훈해요0슬퍼요0화나요0후속기사 원해요0댓글 [아시아경제 박나영 기자]북한의 6차 핵실험 여파로 장 초반 코스피가 하락세를 이어가고 있는 가운데 엔씨소프트의 상승세가 두드러진다. 3분기 최대 실적 전망이 나오면서 3% 가까이 상승 중이다. 4일 오전 10시8분 현재 엔씨소프트는 전 거래일 대비 1만1000원(2.78%) 오른 40만7000원에 거래 중이다. 4거래일 연속 이어지는 상승세다. 문지현 미래에셋대우 연구원은 이날 보고서를 통해 ""엔씨소프트는 3분기 최고 실적을 달성할 것으로 예상되며 \'B&S 모바일\' 등 신작 게임과 로열티 매출 증가로 실적개선세가 내년까지 이어질 전망""이라고 내다봤다. 박나영 기자 bohena@asiae.co.kr▶ 뉴스가 재밌다! 세상의 모든 재미 [티잼]▶ 고수가 추천하는 종목은?아시아경제 관련뉴스해당 언론사에서 선정하며 언론사 페이지(아웃링크)로 이동해 볼 수 있습니다.70명 농락한 \'한국의 카사노바\' 얼굴이…\'진흙 묻을라\'…朴 전 대통령은 더 심했다초등생 제자와 성관계 9번, 그 여교사 알고보니""노리갯감이 되던가…"" 홍준표 작심했다한국 축구 \'최악의 잔디\' 논란, 알고보니…좋아요0훈훈해요0슬퍼요0화나요0후속기사 원해요0기사제공 :']"
12,NC soft, 2017-09-0409:30,데일리안 ,"코스피, 北리스크에 급락…시총 상위 종목 '하락'",https://finance.naver.com/news/news_read.nhn?article_id=0002208255&office_id=119&mode=search&query=엔씨&page=1,"['       코스피, 北리스크에 급락…시총 상위 종목 \'하락\'      기사입력2017-09-04 09:30기사원문좋아요훈훈해요좋아요 평가하기공감좋아요0훈훈해요0슬퍼요0화나요0후속기사 원해요0댓글코스피가 전날 북한의 6차 학샐험 영향에 2300선에서 하락 출발했다.ⓒ게티이미지뱅크코스피가 전날 북한의 6차 학샐험 영향에 1%포인트 이상 급락한 2300선에서 출발했다. 4일 코스피지수는 전 거래일 대비 40.80포인트(1.73%) 내린 2316.89에 장을 시작했다.오전 9시 15분 현재 코스피지수는 2330.82를 기록하고 있다. 같은 시간 외국인과 기관은 각각 776억원 1051억원씩 순매수한 반면 개인은 1954억원 순매도하고 있다.북한은 지난 3일 함경북도 길주군 풍계리에서 6차 핵실험을 단행했다. 북한 조선중앙TV는 3일 발표한 중대보도에서 ""대륙간탄도미사일(ICBM) 장착용 수소탄 시험에서 완전 성공했다""고 밝혔다. 북한의 이번 핵실험은 6번째로 지난해 9월 9일 감행한 5차 핵실험 이후 약 1년 만이며 문재인 정부 출범 이후 첫 핵실험이다.이에 전문가들은 국내 증권시장에 단기적인 충격은 불가피할 것으로 분석했다. 시가총액 상위종목도 일제히 약세다. 삼성전자는 전 거래일 대비 3만6000원(1.55%)하락한 228만8000원을 기록 중이다. SK하이닉스도 전일대비 1300원(-1.89%)내린 6만7400원을 기록했다.  이어 현대차(-1.05%), POSCO(-0.72%), 한국전력(-1.04%), LG화학(-1.34%), 신한지주(-0.39%), NAVER(-1.74%), 삼성물산(-2.32%), KB금융(-0.55%), 삼성생명(-0.88%), SK텔레콤(-0.40%), SK(-1.48%), 삼성바이오로직스(-1.43%), SK이노베이션(-1.06%), 아모레퍼시픽(-1.38%), KT&G(-0.44%), LG생활건강(-0.42%)등도 하락세다. 반면 현대모비스(1.04%), 삼성화재(0.19%), 엔씨소프트(0.13%)등은 상승했다.  업종별지수도 대부분 큰 폭으로 하락했다. 의료정밀(-1.82%), 의약품(-1.91%), 증권(-1.68%), 은행(-1.81%), 운수창고(-1.61%), 유통(-1.54%), 전기전자(-1.56%), 기계(-1.60%), 건설(-1.29%), 서비스(-1.35%), 종이목재(-1.10%), 금융(-1.21%), 제조(-1.19%), 전기가스(-1.39%), 섬유의복(-0.87%)등이 내렸다.코스닥도 전일대비 18.00포인트(2.72%) 내린 643.99에 개장했다. 같은 시간 코스닥 시장에 외국인과 기관은 431억원 102억원씩 순매수한 반면 개인은 534억원 순매도한 것으로 나타났다.한편, 이날 외환시장에서 원·달러 환율은 6.2원 오른 1129.0원에 시작했다.데일리안 한성안 기자ⓒ (주)데일리안 - 무단전재, 변형, 무단배포 금지좋아요0훈훈해요0슬퍼요0화나요0후속기사 원해요0기사제공 :']"
13,NC soft, 2017-09-0409:27,서울경제 ,"삼성전자, 현대차 등 시총 상위주 줄줄이 하락",https://finance.naver.com/news/news_read.nhn?article_id=0003104626&office_id=011&mode=search&query=엔씨&page=1,"['       삼성전자, 현대차 등 시총 상위주 줄줄이 하락      기사입력2017-09-04 09:27기사원문좋아요훈훈해요좋아요 평가하기공감좋아요0훈훈해요0슬퍼요0화나요0후속기사 원해요0댓글 [서울경제] 코스피가 북한의 6차 핵실험으로 급락하면서 삼성전자(005930), 현대차(005380) 등 대형주가 4일 줄줄이 하락하고 있다. 오전 9시 21분 현재 코스피 시장에서 시가총액 1위인 삼성전자는 전날보다 1.38%(3만 3,000원)떨어진 229만 2,000원에 거래되고 있다. 삼성전자는 현재 금액기준 외국인 매도 1위 종목이다. 시총 2위 현대차도 전날보다 0.70%(1,000원) 내린 14만 2,000원을 기록하고 있으며 SK하이닉스(000660)도 전날보다 0.87%(600원) 하락한 6만 8,200원에 거래중이다.그 밖에 삼성화재(000810)는 0.37% 엔씨소프트(036570)는 1.01%떨어져 거래되고 있다.  /임세원기자 why@sedaily.com  [서울경제 바로가기]1997년 이래 대한민국 최고의 과학자 DB [바로가기]서울경제의 모든 연재물!... 서경Cube [바로가기▶]저작권자 ⓒ 서울경제, 무단 전재 및 재배포 금지서울경제 관련뉴스해당 언론사에서 선정하며 언론사 페이지(아웃링크)로 이동해 볼 수 있습니다.靑 ""北지진, 6차 핵실험 따른 것으로 추정""\'文대통령 잘한다\' 응답한 사람 줄어든 결정적 이유는?[北 6차 핵실험] ""북한은 깡패국가"" 트럼프, 군사조치 포함 \'모든옵션\' 동원할듯총리 부인 주재 오찬 \'김정숙 여사\' 건배사 안한 사연""제정신이냐?"" 멜라니아의 \'하이힐 홍수패션\' 그 후좋아요0훈훈해요0슬퍼요0화나요0후속기사 원해요0기사제공 :']"
