,회사명,날짜,언론사,기사제목,링크,본문
9,NC soft, 2017-12-1914:49,파이낸셜뉴스 ,[올해 게임결산] 축포 쏜 게임산업 ′퀀텀점프′ 기반 다졌다,https://finance.naver.com/news/news_read.nhn?article_id=0003927338&office_id=014&mode=search&query=엔씨&page=1,"['       [올해 게임결산] 축포 쏜 게임산업 ′퀀텀점프′ 기반 다졌다      기사입력2017-12-19 14:49기사원문좋아요훈훈해요좋아요 평가하기공감좋아요0훈훈해요0슬퍼요0화나요0후속기사 원해요0댓글  올해 국내 게임산업은 대작 온라인게임의 지식재산권(IP)을 활용해 재탄생한 모바일게임이 주도했다. 넷마블게임즈의 \'리니지2 레볼루션\'을 시작으로 엔씨소프트의 \'리니지M\'이 바통을 이어 받아 현재까지도 인기를 끌고 있다. 이를 반영하듯 사상 처음으로 모바일게임 시장 규모가 온라인게임을 넘어섰다.  하지만 온라인게임이 여전히 건재함을 입증하는 해이기도 했다. 블루홀이 선보인 온라인게임 \'배틀그라운드\'는 글로벌 시장에서 호응을 얻으면서 2017 게임대상에서 대상을 수상했다. 국내 최대 게임 전시회인 지스타에서도 \'배틀그라운드\'가 영향력을 발휘하며 전시회를 장악했다는 평가를 받았다.   ■모바일게임 시장 주도          엔씨소프트의 모바일게임 \'리니지M\' 대만 서비스 홍보 이미지    19일 한국콘텐츠진흥원에 따르면 올해 국내 게임 시장 규모는 11조5703억원으로 지난해 보다 6.2% 증가했다. 이 중 모바일게임 시장 규모는 4조8800억원으로 전년 대비 12.7% 증가할 것으로 예측됐다. 온라인게임 시장 규모가 4조7207억원으로 예상되는 것을 감안하면 모바일게임 시장이 처음으로 온라인을 앞질렀다.  올해 주목할 점은 대작 온라인게임의 모바일 게임으로의 재탄생이다. 온라인게임 \'리니지\' 시리즈는 모바일에서도 충분한 영향력을 발휘했다. 엔씨소프트가 지난 6월 출시한 모바일게임 \'리니지M\'은 출시 초반 하루 매출이 130억원을 기록했다. \'리니지M\'은 지금도 구글 플레이 최고 매출 순위에서 1위 자리를 지키고 있다.  넷마블의 \'리니지2 레볼루션\'과 \'테라M\' 역시 대작 온라인게임을 모바일로 재해석한 작품이다. \'리니지2 레볼루션\'의 경우 사상 처음으로 한 달 매출이 2000억원을 넘어서며 모바일게임도 수익을 낼 수 있다는 가능성을 제시했다. 지금도 \'리니지2 레볼루션\'과 \'테라M\'은 구글 플레이 최고 매출 순위에서 각각 2위와 3위를 기록하고 있다.  모바일게임의 흥행은 실적에도 반영됐다. 넷마블은 3·4분기 누적 매출이 1조8090억원을 기록해 국내 게임사 1위인 넥슨을 거의 따라 잡았다. 넥슨의 3·4분기 누적 매출은 1조8559억원으로 4·4분기 실적에 따라 국내 게임사 1위 자리가 결정될 것으로 예상된다. 엔씨소프트도 3·4분기 누적 매출이 1조2254억원으로 역대 최대치를 써내려가고 있다.   ■온라인게임 아직 살아있다          배틀그라운드 소개 이미지.    올해 모바일게임이 시장을 주도했지만 온라인게임도 여전히 영향력을 미쳤다.  그 주인공은 블루홀의 \'배틀그라운드\'다. \'배틀그라운드\'는 글로벌 게임 플랫폼인 스팀에서 동시접속자 수가 300만명을 넘어서며 역대 최고 기록을 세웠다. \'배틀그라운드\'에 대한 관심은 지스타에서도 확인할 수 있다. 지스타 기간에 열린 2017 게임대상에서 \'배틀그라운드\'는 대상을 비롯 △인기게임상 국내부문 △우수개발자상 프로그래밍 부문 △우수개발자상 기획 디자인부문 △게임비즈니스 혁신상 △기술 창작상 사운드 분야 등 총 6관왕에 올랐다.  지스타 현장에서는 전시장 곳곳에서 \'배틀그라운드\'를 활용한 e스포츠 대회가 열렸다. 고품질 그래픽을 자랑하는 \'배틀그라운드\'를 PC나 그래픽카드 성능을 과시하기 위해 활용한 것이다, 때문에 올해 지스타는 \'배틀그라운드\'가 없었다면 흥행을 보장할 수 없었을 것이라는 말까지 나오기도 했다.   ■글로벌 진출은 숙제 하지만 이같은 성과에도 불구하고 글로벌 진출이라는 숙제도 남겼다. \'배틀그라운드\'가 세계적인 인기를 얻으며 이목을 집중시켰지만 아직은 초기 단계에 그치고 있는 것이 사실이다.  특히 중국 시장에 대한 갈증은 여전하다. 중국은 전 세계에서 게임 시장 규모가 가장 큰 곳이지만 한한령(限韓令)에 의해 게임 수출이 중단된 상태다. 모바일게임 \'리니지2 레볼루션\'과 \'리니지 레드나이츠\'의 경우 중국에서도 충분히 성공할 가능성이 높은 것으로 평가받고 있으나 게임을 서비스할 수 있는 권한인 판호가 발급되지 않고있다. 북미와 유럽 시장을 개척하는 것도 과제다. 북미와 유럽은 온라인게임이나 모바일게임 보다 여전히 비디오게임이 주를 이루고 있다. 그나마 컴투스의 모바일게임 \'서머너즈워\'가 북미를 중심으로 흥행에 성공하면서 글로벌 공략의 가능성을 엿볼 수 있게 만들었다.  게임업계의 또다른 관계자는 ""지난해 국산 모바일게임 수출이 크게 증가하면서 글로벌 시장에서도 국산 게임의 성공 가능성을 확인할 수 있는 기회가 됐다""면서도 ""중국 정부의 제재와 북미와 유럽 시장의 오래된 게임 문화 등은 여전히 국내 게임사들이 풀어야할 숙제로 남아있다""고 말했다.   syj@fnnews.com 서영준 기자   ▶ 세상의 모든 골 때리는 이야기 \'fn파스\'▶ 속보이는 연예뉴스 fn스타  ※ 저작권자 ⓒ  파이낸셜뉴스. 무단 전재-재배포 금지파이낸셜뉴스 관련뉴스해당 언론사에서 선정하며 언론사 페이지(아웃링크)로 이동해 볼 수 있습니다.유흥업소 접대부는 여성만 인정된다?\'거침없는 질주\' 비트코인에 대한 모든 것[재테크 Q&A] 40대부부 빚청산·노후 준비 가능?""먼지쌓인 옷·책 당장 기부하세요, 세액공제 짭짤합니다""유방암 진단받고 가슴절제했는데...알고보니 오진좋아요0훈훈해요0슬퍼요0화나요0후속기사 원해요0기사제공 :']"
10,NC soft, 2017-12-1911:34,파이낸셜뉴스 ,[올해 게임결산] '하는 게임에서 보는 게임으로,https://finance.naver.com/news/news_read.nhn?article_id=0003927198&office_id=014&mode=search&query=엔씨&page=1,"['       [올해 게임결산] \'하는 게임에서 보는 게임으로      기사입력2017-12-19 11:34기사원문좋아요훈훈해요좋아요 평가하기공감좋아요0훈훈해요0슬퍼요0화나요0후속기사 원해요0댓글e스포츠 새로운 수익모델로 자리잡아  e스포츠가 게임업계의 새로운 수익모델로 부상하고 있다. 올해를 강타한 온라인게임 \'배틀그라운드\'가 e스포츠 열풍을 다시 한번 일으키면서 주요 게임업체들이 e스포츠를 바라보는 시선이 달라지고 있다.  특히 내년에는 e스포츠가 게임업체들의 본격적인 수익사업으로 자리잡을 수 있을지가 관심이 모아지고 있다. 그동안 e스포츠는 게임 흥행을 위한 마케팅 수단 정도로 인식됐지만, 1인 게임방송 등을 통해 게임을 하는 것보다 보는 것을 즐기는 이용자들이 늘면서 이를 수익과 연결시키려는 시도가 더욱 활발해질 전망이다.  19일 관련 업계에 따르면 게임을 직접 즐기지는 않지만 다른 게이머의 게임을 보는 이용자들이 많아지면서 e스포츠가 게임업계 핵심 수익모델로 부상하고 있다. 특히 블루홀의 \'배틀그라운드\'가 e스포츠 열풍을 주도 하고 있다. 유튜브, 트위치, 아프리카TV 등 1인 방송 플랫폼에서 \'배틀그라운드\' 방송이 인기 방송으로 자리잡았다. \'배틀그라운드\'의 흥행 요인 중 하나가 e스포츠였다는 분석도 나온다. 아프리카TV, 게임방송 OGN 등은 \'배틀그라운드\' 공식 리그도 개최하며 e스포츠 열풍을 이어가고 있다.         지난달 25일 서울 넥슨아레나에서 열린 \'피파온라인3\' e스포츠 대회 결승전에서 관람객들이 선수들의 경기를 지켜보고 있다.   e스포츠로 새로운 수익모델을 찾겠다고 발표한 회사도 등장했다.  액토즈소프트는 다양한 게임들의 e스포츠 대회를 개최하는 글로벌 e스포츠 브랜드 \'WEGL\'을 선보였다. 지난달 열린 게임전시회 지스타에서 첫 선을 보인 \'WEGL\'은 스타크래프트 리마스터와 오버워치, 하스스톤, 철권7, 마인크래프트 등 다양한 게임을 활용한 e스포츠 대회다.  국내 대표 게임사 넥슨은 e스포츠에 꾸준히 투자해온 게임사다. 자체적으로 e스포츠 대회를 진행하기 위해 서울 강남역 인근에 e스포츠 전용 경기장인 \'넥슨 아레나\'를 구축하면서 e스포츠에 집중해왔다. 피파온라인3, 던전앤파이터, 카트라이더 등의 인기게임들이 e스포츠와 함께 성장해왔다. 넥슨이 내년 주요 신작게임으로 준비하고 있는 온라인게임 \'배틀라이트\'도 e스포츠에 최적화된 게임이라는 평가를 받고 있다. 이미 e스포츠로 성공한 리그오브레전드와 비슷한 장르의 게임인만큼 넥슨은 e스포츠로 \'배틀라이트\'의 성공방정식을 써내려간다는 계획이다.  넷마블게임즈와 엔씨소프트도 e스포츠를 게임과 접목시키고 있다.  엔씨소프트는 \'블레이드앤소울\' 등 인기 온라인게임의 e스포츠 대회를 꾸준히 개최하면서 게이머들의 관심을 받고 있다. 지난 9월에는 e스포츠 대회와 문화축제를 연계하는 대규모 축제를 서울 광장에서 선보여 업계의 이목을 집중시킨 바 있다. 넷마블게임즈는 모바일게임도 e스포츠로 성공할 수 있다는 점을 증명하고 있다. 5대5 적진점령 모바일게임 \'펜타스톰\' 대회를 꾸준히 열고 있다. 지난달에는 펜타스톰 아시아 지역 최강자를 결정하는 \'펜타스톰 아시아 인터내셔널 챔피언십\'도 개최했다.  게임업계 한 전문가는 ""게임을 직접 즐기는 이용자 만큼이나 게임을 보면서 즐기는 이용자들이 늘고 있어 e스포츠가 게임업계의 새로운 수익모델로 부상하고 있다""며 ""내년에는 단순한 마케팅 차원으로 e스포츠에 접근하는 것이 아니라 새로운 수익모델로 접근하는 모습을 보게 될 것""이라고 말했다.   jjoony@fnnews.com 허준 기자   ▶ 세상의 모든 골 때리는 이야기 \'fn파스\'▶ 속보이는 연예뉴스 fn스타  ※ 저작권자 ⓒ  파이낸셜뉴스. 무단 전재-재배포 금지파이낸셜뉴스 관련뉴스해당 언론사에서 선정하며 언론사 페이지(아웃링크)로 이동해 볼 수 있습니다.유흥업소 접대부는 여성만 인정된다?\'거침없는 질주\' 비트코인에 대한 모든 것[재테크 Q&A] 40대부부 빚청산·노후 준비 가능?""먼지쌓인 옷·책 당장 기부하세요, 세액공제 짭짤합니다""유방암 진단받고 가슴절제했는데...알고보니 오진좋아요0훈훈해요0슬퍼요0화나요0후속기사 원해요0기사제공 :']"
11,NC soft, 2017-12-1911:13,아시아경제 ,"엔씨소프트, 북미·유럽 시장 맞춤 게임으로 승부",https://finance.naver.com/news/news_read.nhn?article_id=0004142883&office_id=277&mode=search&query=엔씨&page=1,"['       엔씨소프트, 북미·유럽 시장 맞춤 게임으로 승부      기사입력2017-12-19 11:13기사원문좋아요훈훈해요좋아요 평가하기공감좋아요0훈훈해요0슬퍼요0화나요0후속기사 원해요0댓글모바일 RPG \'아이온 레기온즈 오브 워\' 내년 북미 ·유럽 출시현지 인력 중심 ·지역 최적화PC ·콘솔 넘나드는 게임 개발엔씨소프트의 \'아이온 레기온즈 오브 워\' [아시아경제 한진주 기자] 엔씨소프트가 북미ㆍ유럽 시장 공략을 위해 지역별 특성에 맞는 게임을 개발하고 콘솔ㆍ가상현실(VR) 등 새로운 플랫폼에 도전한다. 19일 엔씨소프트에 따르면 회사 측은 내년 중 \'아이온 레기온즈 오브 워\'를 북미ㆍ유럽 지역에 출시할 예정이다. PC온라인게임 \'아이온\'을 기반으로 하는 모바일 RPG다. 2015년 설립한 미국 실리콘밸리의 모바일 게임 개발 스튜디오 \'아이언 타이거 스튜디오\'가 국내 개발부서와 협업해 \'아이온 레기온즈 오브 워\' 출시에 박차를 가하고 있다. 엔씨소프트는 현지 인력을 중심으로 각 시장에 최적화된 게임을 개발해 성공 가능성을 높인다는 계획이다. 해외 시장 트렌드를 직접 반영하고, 현지 인력을 중심으로 글로벌 지역 특성에 맞게 서비스하겠다는 것이다.새로운 플랫폼과 신기술을 접목한 게임 연구개발도 병행하고 있다. 엔씨소프트는 지난 2월 미국 샌프란시스코에서 열린 게임개발자컨퍼런스(GDC)에서 VR 헤드셋 개발업체 오큘러스와 함께 VR 게임 \'블레이드 & 소울 테이블 아레나(이하 블소 테이블 아레나)\'를 공개했다. 엔씨소프트가 선보인 첫 VR게임이다.\'블레이드&소울 테이블 아레나\'를 시연하는 모습블소 테이블 아레나는 PC온라인 블레이드 & 소울 IP를 활용한 실시간 전략 VR게임이다. VR 컨트롤러로 캐릭터를 전장에 소환해 상대의 진영을 파괴하는 방식이다.  엔씨소프트는 오큘러스 외에도 다양한 VR 플랫폼으로의 확장도 검토 중이다.엔씨소프트는 주력 플랫폼인 PC온라인과 모바일 외 PC와 콘솔을 넘나드는 게임도 개발중이다. 콘솔 컨트롤러로도 게임을 즐길 수 있도록 개발해 북미ㆍ일본 등으로 진출을 꾀하고 있다. 엔씨소프트는 지난달 신작발표회에서 차기 PC온라인 MMORPG \'프로젝트 TL\'을 콘솔 등 여러 플랫폼에서 즐길 수 있게 만들겠다고 발표했다. 북미에서는 PC온라인 MMORPG 블레이드 & 소울을 콘솔게임으로 만드는 작업도 진행하고 있다. 한진주 기자 truepearl@asiae.co.kr▶ 양낙규의 \'군사이야기\'▶ #아시아경제 채널 구독 ▶ #아시아경제 페이스북아시아경제 관련뉴스해당 언론사에서 선정하며 언론사 페이지(아웃링크)로 이동해 볼 수 있습니다.조현아, 어떻게 지내나 했더니…21일 전격""한반도 오늘 밤 당장 전쟁 날수도"" 초강력 경고""北, 한국 북부 지역에 대규모 공격을…""중국도 김정숙 여사에 반했다? ""귀족 외모에…""상대방 바람 피울 가능성 \'3가지\' 보면 알수 있다좋아요0훈훈해요0슬퍼요0화나요0후속기사 원해요0기사제공 :']"
12,NC soft, 2017-12-1908:37,뉴시스 ,[빅데이터MSI]19일 빅데이터 '핫 키워드'…매수·외국인·상승·지수·중국,https://finance.naver.com/news/news_read.nhn?article_id=0008349609&office_id=003&mode=search&query=엔씨&page=1,"[""       [빅데이터MSI]19일 빅데이터 '핫 키워드'…매수·외국인·상승·지수·중국      기사입력2017-12-19 08:37기사원문좋아요훈훈해요좋아요 평가하기공감좋아요0훈훈해요0슬퍼요0화나요0후속기사 원해요0댓글【서울=뉴시스】 김지은 기자 = 19일 빅데이터 시장심리지수(MSI)의 핫 키워드는 매수·외국인·상승·지수·중국 등인 것으로 나타났다.  뉴시스와 코스콤(구 한국증권전산)이 공동 분석한 MSI(http://m.newsis.com/stock.html, 모바일 전용)에 따르면 전 거래일 오후 4시부터 이날 오전 8시까지 온라인과 소셜네트워크서비스(SNS), 블로그, 증권 관련 사이트에서 집계된 주요 상위 키워드는 이같이 조사됐다.전날 코스피지수와 코스닥지수가 동반 하락한 가운데 증시 관련 키워드가 상위권에 올랐다.코스피는 전 거래일(2482.07)보다 0.19포인트(0.01%) 내린 2481.88에 장을 마쳤다. 앞서 미 증시 훈풍을 타고 전일 대비 6.76포인트(0.27%) 오른 2488.83에 출발한 지수는 장 초반 보합권에서 등락을 반복하다 오후 들어 상승세를 이어갔지만, 외국인에 이어 개인들의 매도세까지 확대되며 결국 약보합으로 마감했다.이날 유가증권시장에서는 개인과 외국인 모두 '팔자' 기조를 나타냈다.개인(-1290억원)과 외국인(-1653억원)은 순매도했고, 기관(2653억원)만 '나홀로' 순매수하며 지수를 방어했다. 코스닥지수는 전 거래일(771.82)보다 1.32포인트(0.17%) 내린 770.50에 장을 마쳤다. 외국인(523억원)과 기관(954억원)은 순매수했지만, 개인(-1417억원)이 순매도하며 지수를 끌어내렸다.지난주 한중 정상회담이 원론적 합의 수준에 그치자 중국 관련주들은 약세로 돌아서거나 소폭 상승하는데 그쳤다.중국 광저우 유기발광다이오드(OLED) 공장 승인을 기다리고 있는 LG디스플레이는 주가가 2.3% 빠졌고, 엔씨소프트도 2% 가까이 하락했다. 호텔신라(-0.47%)와 롯데쇼핑(-0.25%)도 소폭 하락하며 장을 마쳤다. 아모레퍼시픽과 현대차는 상승 폭이 크지 않았다. 아모레퍼시픽은 1.12% 올랐고 문재인 대통령이 충칭 공장을 방문한 현대차는 보합권에 머물렀다. 한편 8월1일부터 선보인 빅데이터 MSI 모바일 전용 버전은 구글플레이 또는 애플 앱스토어에서 '뉴시스'앱을 내려받거나 뉴시스 모바일 홈페이지(m.newsis.com)에 접속한 뒤 메인화면의 '빅데이터 MSI'를 클릭해 이용하면 된다. kje1321@newsis.com ※ 빅데이터MSI는 투자 참고용이며, 투자 결과에 책임을 지지 않습니다. 주식시장에서는 다양한 국내외 변수가 존재하기 때문에 한 지표로만 판단하면 뜻하지 않은 결과를 초래할 수 있습니다.▶ 뉴시스 빅데이터 MSI 주가시세표 바로가기 ▶ 네이버 채널에서 뉴시스를 구독해주세요뉴시스 관련뉴스해당 언론사에서 선정하며 언론사 페이지(아웃링크)로 이동해 볼 수 있습니다.[빅데이터MSI]19일 오전 주식시장 심리 1단계 '매우 나쁨'18일 빅데이터 '핫 키워드'…중국·매수·시장·투자·상승시장심리 톱5…대웅제약·금호타이어·현대중공업·현대모비스·현대상선은행권 주담대 금리 일제히↑…4.5% 넘긴 곳도7.4조 '숨은 보험금' 통합조회시스템서 한 번에 확인좋아요0훈훈해요0슬퍼요0화나요0후속기사 원해요0기사제공 :""]"
13,NC soft, 2017-12-1907:23,조선비즈 ,[투자노트] 인구구조를 보면 황금株가 보인다,https://finance.naver.com/news/news_read.nhn?article_id=0000393051&office_id=366&mode=search&query=엔씨&page=1,"['       [투자노트] 인구구조를 보면 황금株가 보인다      기사입력2017-12-19 07:23기사원문좋아요훈훈해요좋아요 평가하기공감좋아요0훈훈해요0슬퍼요0화나요0후속기사 원해요0댓글 최근 ‘인구 구조’의 변화를 기반으로 한 투자전략이 인기를 끌고 있다. 인구 구조가 변화하면 라이프 스타일과 소비 패턴 등 경제와 밀접한 연관이 있는 요소들도 함께 바뀐다. 이런 변화는 확실하면서 예측 가능한 형태로 나타나기 때문에 이를 잘 분석하고 수혜 기업을 골라내면 성공 확률이 상대적으로 높다는 것이 전문가들의 설명이다.우리나라에서 ‘1코노미’가 확산되면서 가정 간편식, 편의점 등의 관련주가 부상했던 것을 떠올려보면 된다. 시야를 해외로 넓히면 투자 아이디어는 더 많아진다. 예컨대 중국의 경우 단신족(單身族)이 급격히 늘고 있다. 홀로사는 싱글족을 뜻하는 말인데 한 통계에 따르면 중국의 독거청년이 5000만명에 이를만큼 상당한 규모의 시장을 형성하고 있다. 중국 내 이혼은 10년전 대비 두 배 이상 증가했고, 결혼은 고점대비 20% 감소했다.김병연 NH투자증권 연구원은 “음식료, 편의점, 유통, 소형가전 등의 분야에서는 중국 로컬 기업이 더 유리할 것 같다”며 “MMORPG(다중접속역할수행게임) 게임, 한류스타를 동반한 드라마·엔터테인먼트, 가치소비 성격의 잠재적 수요가 확실한 고가 기초 화장품, K-뷰티 등이 수혜를 입을 것”이라고 분석했다. 종목으로는 넷마블게임즈(251270), 엔씨소프트(036570), 펄어비스, CJ E&M(130960), 제이콘텐트리(036420), JYP Ent. 에스엠(041510), LG생활건강(051900), 아모레퍼시픽(090430), 삼양식품(003230)등을 추천했다.인구구조 변화에 따른 수혜 기업 투자는 성공 확률이 높은 투자 전략이다. 인구 증가는 한 국가의 경제 성장에 있어 가장 강력한 동력이고, 기업 차원에서도 사업 확대를 위해 최우선시 되는 환경 요인이다. 즉, 여러 매크로 요인 중에서도 인구구조 변화는 가장 확실하고 변수가 적은 투자 아이디어인 것이다.우리가 글로벌 투자로 시야를 넓혀야 하는 이유도 여기에 있다. 서로 다른 인구성장 단계에 놓여 있는 국가와 지역에서 인구구조 변화의 수혜를 누릴 수 있는 다양한 기업에 투자 가능하기 때문이다. 또한, 글로벌 기업 중에는 단순 인구 증가 이외 세부적으로 인종 및 세대 구성 변화가 수혜로 이어지거나, 오히려 인구 감소 현상이 사업의 기회로 작용하는 기업들이 다수 존재한다.미국 시장에서도 이 같은 수혜주를 찾아볼 수 있다. 정희석·장환영 한국투자증권 연구원은 미국 시장에서 밀레니얼 세대의 부상으로 RV(Recreational Vehicle, 캠핑용 자동차) 산업이 빠르게 성장하고 있다고 분석했다. 밀레니얼 세대는 1980~1990년대 출생한 18~35세 연령대의 인구로 전체 인구 중 22%를 차지한다. 이들은 2020년 미국 전체 소비의 3분의 1을 차지할 만큼 소비 주도층으로 입지를 키우고 있다. 이들은 과거 청년층 인구보다 여가나 문화 생활에 지출을 아끼지 않는 특징을 보이는 것으로 분석된다.정희석·장환영 연구원은 “지난 2016년 미국의 연간 RV 출하량은 43만대로 전년 대비 15% 증가했고, 2017년에도 11% 증가한 48만대를 기록할 전망”이라며 “지난 5년 동안 미국 RV 시장의 출하량 기준 연평균 성장률은 11%로 추정된다”고 설명했다. 여기에 흑인, 히스패닉, 아시안 등 비(非) 백인 인구의 소득 수준이 전반적으로 상승하면서 캠핑 수요가 빠르게 증가하는 것도 RV 시장 성장 요인이 되고 있다고 분석했다.여기에 더해 최근 극심해진 일본의 구인난 현상도 좋은 투자 기회를 제공한다고 분석했다. 일본 내 구인난이 심화됨에 따라 기업과 인력 간의 취업 중개 및 정보 제공 사업자에게 수혜가 나타나고 있다고 두 연구원은 설명했다. 일본의 인력 부족은 주력 취업활동 연령대인 40대 이하 인구가 급감하는 인구절벽 현상 때문으로 단기적으로 해결되기 어려운 문제임을 보여준다. 대다수 업종 내 기업들이 구인난을 겪고 있는 가운데, 인력 중개 및 파견 기업과 인력 정보 제공 기업들에 대한 수요가 지속적으로 증가하고 있다.추천 종목으로는 퍼솔홀딩스(Persol Holdings, 종합 인력 파견 사업), SMS(간호 서비스 인력 중개), 메이텍(Meitec, 엔지니어 파견), 트러스트텍(Trust Tech, 엔지니어 파견), 알텍(Altech, 엔지니어 파견) 등 매출이 안정적으로 증가하고 있는 인력 중개기업을 추천했다.[김유정 기자 kyj@chosunbiz.com]chosunbiz.com조선비즈 관련뉴스해당 언론사에서 선정하며 언론사 페이지(아웃링크)로 이동해 볼 수 있습니다.차관보가 영접? 문대통령 심상찮은 中 의전문재인 대통령 청와대서 격노한 이유[단독] 현대차 야심작 \'상무님차\' 비참한 최후""10년 만에 돈 벌 기회 왔다""…들뜬 부동산 업계일본 교수의 일침…""한국, 잘못하고 있다""좋아요0훈훈해요0슬퍼요0화나요0후속기사 원해요0기사제공 :']"
