,회사명,날짜,언론사,기사제목,링크,본문
0,NC soft, 2017-08-1818:22,파이낸셜뉴스 ,"5년전 '카톡게임' 성공 확신 남궁훈, 미래도 책임",https://finance.naver.com/news/news_read.nhn?article_id=0003860610&office_id=014&mode=search&query=엔씨&page=1,"['       5년전 \'카톡게임\' 성공 확신 남궁훈, 미래도 책임      기사입력2017-08-18 18:22기사원문좋아요훈훈해요좋아요 평가하기공감좋아요0훈훈해요0슬퍼요0화나요0후속기사 원해요0댓글카카오게임즈, 카카오 게임 사업 총괄.. 게임 전문 회사로서 경쟁력 확보2012년 위메이드 대표시절 카카오톡 게임플랫폼에 모바일게임 앞장서 공급애니팡.바이킹아일랜드 등 큰 인기 끌며 성공 견인                   카카오게임즈가 카카오의 게임사업부문을 흡수, 카카오 게임사업 전반을 총괄하게 되면서 이 회사 수장인 남궁훈 대표(사진)와 카카오의 인연이 업계에 다시 회자되고 있다.    남궁훈 대표가 5년 전인 2012년 위메이드엔터테인먼트 대표로 재직할 때부터 카카오의 게임사업 가능성을 일찌감치 꿰뚫어보고 있었다는 것이다.    당시 남궁 대표는 누구도 주목하지 않던 카카오톡 게임하기 플랫폼에 위메이드의 게임을 앞장서서 공급하고, 모바일게임으로 시장전환을 정확히 예측했다. 5년이 지난 지금 직접 카카오의 게임사업 방향키를 잡은 남궁 대표의 행보에 업계 관심이 집중되는 이유다.    ■남궁훈, 5년 전 카카오톡 가능성 \'확신\'    18일 관련업계에 따르면 남궁 대표는 지난 2012년 위메이드 대표 시절 앞장서서 카카오톡 게임플랫폼(당시 서비스명 \'게임하기\')에 모바일게임 공급을 추진했다. 당시 카카오는 카카오톡 게임플랫폼 론칭을 준비하고 있었지만 시장의 주목을 전혀 받지 못하고 있었다.    당시 카카오 게임플랫폼을 담당했던 책임자는 ""카카오톡을 게임 플랫폼으로 발전시키려고 게임을 찾아다녔지만, 성공 가능성에 대한 의문이 많아 게임 개발사가 쉽사리 게임을 주려고 하지 않았다""며 ""위메이드가 게임 3종 출시를 확정하면서 카카오톡 게임하기에 대한 관심이 높아졌다""고 언급하기도 했다.    당시 카카오톡은 가입자는 많았지만 뚜렷한 수익모델을 찾지 못한 서비스였다. 남궁 대표는 카카오톡이 게임 플랫폼으로 성공할 수 있다는 확신을 가졌고, \'바이킹아일랜드\' 등 게임 3종 공급을 결정했다. 카카오에 250억원가량을 투자해 지분 일부를 확보하기도 했다.    ■남궁훈, 카카오톡 게임 전폭 지원    당시 남궁훈 위메이드 대표가 얼마나 카카오톡 게임플랫폼의 성공을 확신했는지는 기자간담회 장소에서도 잘 알 수 있다. 당시 남궁 대표는 취임 1개월여 만에 모바일게임 사업 발표회를 열었는데 사업발표회 장소가 카카오 본사(당시 서울 역삼동)였다. 이 자리에서 남궁 대표는 카카오톡 게임플랫폼에 공급할 게임 3종을 처음 공개했다.    카카오톡 게임플랫폼은 남궁 대표의 예상대로 대성공을 거뒀다. 카카오톡 게임플랫폼은 게임업계 전반을 뒤흔들었다. 공전의 히트작 \'애니팡\'과 \'바이킹아일랜드\' 등이 큰 인기를 끌면서 게임은 카카오의 주요 매출원으로 자리매김했다.    이후 남궁 대표는 위메이드에서 모바일게임 히트작을 여럿 키워냈다. 바이킹아일랜드를 필두로 \'캔디팡\' \'윈드러너\' \'에브리타운\' 등이 남궁 대표의 손을 거쳐간 모바일게임이다.    이후 위메이드를 떠난 남궁 대표는 게임인재단을 설립하며 게임업계와 연을 이어오다 지난 2015년 엔진이라는 게임 퍼블리싱(배급) 업체를 설립, 게임사업에 복귀했다. 남궁 대표의 엔진은 카카오게임즈의 전신이다. 카카오는 엔진을 인수, 남궁 대표에게 카카오게임즈를 맡겼다.    ■\'구원투수\' 남궁훈, 카카오톡 게임 미래 책임진다    남궁 대표가 카카오게임즈를 처음 맡았을 당시 카카오 게임플랫폼은 성장이 정체돼 있었다. 2012년만 해도 카카오톡 게임플랫폼 입점이 곧 성공이라는 공식이 성립됐지만 2015년에는 굳이 카카오톡에 입점해야 하느냐는 분위기가 게임업계에 팽배했다. 남궁 대표를 두고 \'카카오의 구원투수\'라는 평가가 나온 이유다.    지난 2년여간 남궁 대표는 카카오톡의 4번째 탭 \'게임별\' 오픈, 게임 퍼블리싱 사업 진출, 가상현실(VR) 게임 출시, 설치 없이 바로 즐길 수 있는 스낵게임 출시 등으로 카카오게임즈의 성장을 진두지휘했다. 이제 카카오의 게임사업부문까지 흡수, 명실상부한 카카오 게임사업의 최고의사결정권자가 됐다.    남궁 대표는 ""이번 통합으로 카카오게임즈는 모바일과 PC 온라인, VR와 증강현실(AR) 등을 아우르는 게임 전문기업으로서 독보적 경쟁력을 갖추게 됐다""며 ""좋은 콘텐츠로 게임산업 발전과 게임시장 활성화에 기여하는 리딩기업이 되겠다""고 강조했다.    5년 전 모바일게임 시대를 정확히 예측하고 카카오톡 게임플랫폼으로서의 성공 가능성을 꿰뚫어본 그의 혜안이 카카오게임즈를 넥슨이나 넷마블게임즈, 엔씨소프트 등과 어깨를 견줄 유력 게임사로 도약시킬 수 있을지 관심이 집중된다.    jjoony@fnnews.com 허준 기자    남궁훈 카카오게임즈 대표는 삼성SDS에서 직장 생활을 시작해 한게임 창업멤버로 게임업계에 뛰어들었다. 한게임 사업부장과 한국게임 총괄을 거쳐 NHN USA 대표이사, CJ인터넷(현 넷마블게임즈) 대표이사, 위메이드엔터테인먼트 대표이사 등을 역임했다. 게임업계 대표적인 전문가 중 한 명으로 손꼽힌다. 이번에 카카오게임즈 대표이사 및 카카오 게임사업 총괄부사장을 맡았다. 페이스북을 통해 자신의 의견을 가감없이 전달하고 업계 전문가들과 소통하는 것으로 유명하다.       ▶ 세상의 모든 골 때리는 이야기 \'fn파스\'▶ 속보이는 연예뉴스 fn스타  ※ 저작권자 ⓒ  파이낸셜뉴스. 무단 전재-재배포 금지파이낸셜뉴스 관련뉴스해당 언론사에서 선정하며 언론사 페이지(아웃링크)로 이동해 볼 수 있습니다.세계서 가장 예쁜 기상캐스터, 몸매 때문에 시청률이..불륜녀로 찍힌 걸그룹 출신 여성의 최후\'위암 발병률 세계 1위\' 한국인, 원인 알고보니..대왕 여드름인 줄 알고 짰다가 1시간만에..유흥가서 알몸으로 춤춘 女 촬영, CCTV 보니..좋아요0훈훈해요0슬퍼요0화나요0후속기사 원해요0기사제공 :']"
1,NC soft, 2017-08-1817:49,파이낸셜뉴스 ,[게임 맞수 열전]모바일서 재탄생한 온라인게임,https://finance.naver.com/news/news_read.nhn?article_id=0003860545&office_id=014&mode=search&query=엔씨&page=1,"[""       [게임 맞수 열전]모바일서 재탄생한 온라인게임      기사입력2017-08-18 17:49기사원문좋아요훈훈해요좋아요 평가하기공감좋아요0훈훈해요0슬퍼요0화나요0후속기사 원해요0댓글돌아온 달리기 게임 '테일즈런너R', 퍼즐 맞추는 재미 '아라미 퍼즈벤처'                테일즈런너R 대표 이미지.                  아라미 퍼즈벤처 대표 이미지.       PC온라인게임의 지적재산권(IP)를 활용한 모바일게임이 잇따라 출시되고 있다. PC온라인게임을 통해 이미 인기가 검증된 작품은 모바일게임으로 재탄생해도 이용자들의 선택을 얻기가 한결 쉬운 것이 사실이다.PC온라인게임 '리니지'가 대표적인 사례로, 모바일게임으로 나온 '리니지M'은 국내 애플리케이션(앱) 마켓(장터)에서 최고매출 1위 자리를 굳건히 지키고 있다. PC온라인게임 '테일즈런너'와 'MXM'도 제2의 '리니지'를 꿈꾸고 있다. 각각의 IP를 활용해 모바일게임으로 출시된 '테일즈런너R'과 '아라미 퍼즈벤처'가 그 주인공이다.■모바일 달리기 게임 부활 이끈다넥슨의 '테일즈런너R'은 12년째 꾸준히 사랑 받고 있는 PC온라인게임 '테일즈런너'를 모바일 플랫폼에서 구현했다. 원작 고유의 감성과 세계관, 게임성 등은 그대로 계승해 원작의 재미를 최대한 살렸다. 다만 캐릭터들은 모바일 환경에 맞게 손을 봤다.'테일즈런너R'은 국내에서 모바일게임이 인기를 얻던 초기 대세를 형성했던 달리기 게임 장르를 표방하고 있다. 과거 '쿠키런', '윈드러너'와 같은 달리기 게임은 초기 모바일게임 시장을 대표하는 작품으로 꼽힌다. 하지만 모바일게임 시장의 주도권이 다중접속역할수행게임(MMORPG)으로 옮겨가며 최근에는 인기가 시들해졌다.'테일즈런너R'은 달리기 게임 장르의 부활을 이끄는 신호탄으로 작용하고 있다. 실제 '테일즈런너R'은 출시 초반 구글 플레이 스토어 국내 전체 카테고리 인기 앱 1위, 국내 게임 부문 인기 1위를 기록했다. 애플 앱스토어에서도 국내 전체 카테고리 무료 앱 1위, 국내 무료 게임 부문 인기 1위를 차지했다.■퍼즐 게임으로 장르 다변화 시도엔씨소프트는 PC온라인게임 'MXM'의 IP를 활용해 모바일게임 '아라미 퍼즈벤처'를 선보였다. 진지점령전 장르의 'MXM' 속 주인공인 아라미 캐릭터를 가져와 퍼즐 장르의 모바일게임으로 새롭게 변환시킨 것이 눈에 띈다.'아라미 퍼즈벤처'는 3매치(Match) 퍼즐 게임이다. 동일한 색깔의 블록을 3개 이상 배치하면 길을 열 수 있다. 이용자는 퍼즐(Puzzle)과 어드벤처(Adventure) 게임의 재미를 동시에 즐길 수 있다. 여기다 엔씨코믹스의 웹툰인 '엄마, 나 그리고 꼬미'에서 등장하는 아라미 캐릭터 외에도 꼬미, 꼬꼬미 등도 게임에 등장한다.'아라미 퍼즈벤처'는 엔씨소프트가 자체 개발한 모바일 퍼즐 장르라는 점에서 의미가 있다. 엔씨소프트는 전통적으로 '리니지M'과 같은 MMORPG 장르에서 강점을 보여왔다. 하지만 퍼즐 장르와 같은 소프트한 분야에서도 신작을 선보이면서 장르의 다양화를 꾀하고 있는 셈이다. 모바일게임에서 본격적인 시동을 건 엔씨소프트의 도전이 주목되고 있다.syj@fnnews.com 서영준 기자     ▶ 세상의 모든 골 때리는 이야기 'fn파스'▶ 속보이는 연예뉴스 fn스타  ※ 저작권자 ⓒ  파이낸셜뉴스. 무단 전재-재배포 금지파이낸셜뉴스 관련뉴스해당 언론사에서 선정하며 언론사 페이지(아웃링크)로 이동해 볼 수 있습니다.세계서 가장 예쁜 기상캐스터, 몸매 때문에 시청률이..불륜녀로 찍힌 걸그룹 출신 여성의 최후'위암 발병률 세계 1위' 한국인, 원인 알고보니..대왕 여드름인 줄 알고 짰다가 1시간만에..유흥가서 알몸으로 춤춘 女 촬영, CCTV 보니..좋아요0훈훈해요0슬퍼요0화나요0후속기사 원해요0기사제공 :""]"
2,NC soft, 2017-08-1817:49,한국경제 ,"수익률 상위 중소형주 펀드, 테스·이녹스첨단소재 많이 담아",https://finance.naver.com/news/news_read.nhn?article_id=0003811587&office_id=015&mode=search&query=엔씨&page=1,"['       수익률 상위 중소형주 펀드, 테스·이녹스첨단소재 많이 담아      기사입력2017-08-18 17:49기사원문좋아요훈훈해요좋아요 평가하기공감좋아요0훈훈해요0슬퍼요0화나요0후속기사 원해요0댓글 [ 김우섭 기자  ] 올해 수익률 상위권에 올라있는 중소형주펀드의 투자 바구니(포트폴리오)에 반도체 관련주 비중이 절대적으로 높은 것으로 나타났다. 절반가량이 반도체 장비 제작 기업인 테스와 반도체 소재주인 이녹스첨단소재를 담고 있는 것으로 조사됐다.18일 펀드평가사 제로인에 따르면 올해 수익률 상위 14개 중소형주펀드 가운데 7개 펀드(상위 10개 종목 기준)가 테스와 이녹스첨단소재를 보유하고 있다. 14개 중 11개 펀드가 담고 있는 삼성전자에 이어 두 번째로 많다.연초 이후 지난 17일까지 수익률 1위(19.94%)를 달리고 있는 대신성장중소형주펀드를 비롯해 3위인 맥쿼리뉴그로쓰, 유리스몰뷰티 등이 테스를 들고 있다. 3D낸드플래시 장비업체인 이 회사는 반도체 공정이 복잡해지면서 수혜를 입고 있다는 분석이다.이녹스첨단소재도 중소형주 펀드매니저들이 선호하는 종목이다. 이 회사는 연성회로기판(FPCB)과 디스플레이 유기발광다이오드(OLED)에 들어가는 필름 등을 만드는 국내 유일한 상장사다.업종별로 보면 정보기술(IT) 비중이 높았다. 삼성전자와 SK하이닉스, 엔씨소프트, SK, 비에이치 등이 상당수 펀드의 포트폴리오 상위를 차지했다.김우섭 기자 duter@hankyung.com[한경닷컴 바로가기] [글방] [모바일한경 구독신청] ⓒ 한국경제 & hankyung.com, 무단전재 및 재배포 금지한국경제 관련뉴스해당 언론사에서 선정하며 언론사 페이지(아웃링크)로 이동해 볼 수 있습니다.헌재 ""다른 펀드 손실 감안 않고 이익 난 펀드에만 과세는 합헌""펀드 판매잔고 \'사상 최대\' 수준… 증권사 70% 판매복숭아, 냉장고에 넣어뒀다가는…깜짝 사실의사들 ""살충제 계란, 하루 2개씩 먹으면…""중국 큰 손, 뭉칫돈 들고 한국서 찾아간 곳이좋아요0훈훈해요0슬퍼요0화나요0후속기사 원해요0기사제공 :']"
3,NC soft, 2017-08-1815:48,이데일리 ,"엔씨소프트, '블소 토너먼트 2017' 韓와일드카드전 접수 시작",https://finance.naver.com/news/news_read.nhn?article_id=0003901295&office_id=018&mode=search&query=엔씨&page=1,"['       엔씨소프트, \'블소 토너먼트 2017\' 韓와일드카드전 접수 시작      기사입력2017-08-18 15:48기사원문좋아요훈훈해요좋아요 평가하기공감좋아요0훈훈해요0슬퍼요0화나요0후속기사 원해요0댓글 [이데일리 김혜미 기자] 엔씨소프트(036570)가 ‘블레이드 앤 소울 토너먼트 2017’ 한국 와일드카드전 참가 신청을 23일부터 시작한다.18일 엔씨에 따르면 와일드카드전은 ‘블소 토너먼트 2017 월드 챔피언십’에 참가할 한국 대표팀을 뽑는 마지막 대회로 9월3일까지 누구나 참가 신청을 할 수 있다.와일드카드전은 예선과 본선으로 진행된다. 신청자는 9월2일 13시부터 18시까지 블소 게임 내에서 열리는 ‘대회 비무’를 플레이해야 한다. 오프라인 예선에는 ‘대회 비무’ 점수 상위 8개팀이 진출한다.이후 오프라인 예선을 통과한 4개팀과 ‘블소 토너먼트 2017 코리아’의 대회점수 상위 4개팀이 본선에서 실력을 겨룬다. 본선 및 결선은 9월17일 ‘서울 OGN e스타디움’에서 열린다. 우승팀은 코리아 파이널 우승 및 준우승팀과 함께 9월에 열리는 월드 챔피언십에 참가한다.월드 챔피언십은 9월20일부터 29일까지 한국에서 열리며 총 상금 규모는 1억8000만원이다. 한국을 비롯해 중국과 대만, 일본, 북미, 유럽, 러시아, 태국, 베트남 등 9개 지역 대표팀이 참가한다.현재 태국과 중국, 러시아 대표팀이 확정됐으며 나머지 해외 경기는 월드 챔피언십 공식 홈페이지와 블소 토너먼트 트위치 채널에서 볼 수 있다.김혜미 (pinnster@edaily.co.kr)▶심쿵유발 스타 화보 [핫포토]▶[페이스북] 보러가기~♥ | [카카오톡] 플친 맺기~♥＜ⓒ종합 경제정보 미디어 이데일리 - 무단전재 & 재배포 금지＞이데일리 관련뉴스해당 언론사에서 선정하며 언론사 페이지(아웃링크)로 이동해 볼 수 있습니다.아빠, 휴직서 내밀자 ""회사에 불만 있어?""中로켓군, 긴급 \'방사능 훈련\' 실시..韓핵전쟁 대비하나제발 살려달라...\'살충제 계란\' 엉터리 명단 발표에 두번 운 농장주들일본 호주서 살인개미 등장...국내 유입 비상[살충제 계란]여기서 생산된 계란 먹지마세요(45곳 난각코드)좋아요0훈훈해요0슬퍼요0화나요0후속기사 원해요0기사제공 :']"
4,NC soft, 2017-08-1815:36,파이낸셜뉴스 ,"5년전 '카톡게임' 열풍 예측했던 남궁훈, 결국 방향키 잡았다",https://finance.naver.com/news/news_read.nhn?article_id=0003860448&office_id=014&mode=search&query=엔씨&page=1,"['       5년전 \'카톡게임\' 열풍 예측했던 남궁훈, 결국 방향키 잡았다      기사입력2017-08-18 15:36기사원문좋아요훈훈해요좋아요 평가하기공감좋아요0훈훈해요0슬퍼요0화나요0후속기사 원해요0댓글카카오톡 게임플랫폼 성공, 모바일게임 시장전환 꿰뚫어본 전문가  카카오게임즈가 카카오의 게임사업부문을 흡수, 카카오 게임사업 전반을 총괄하게 되면서 이 회사의 수장인 남궁훈 대표와 카카오의 인연이 업계에 다시 회자되고 있다.  남궁훈 대표가 5년전인 2012년, 위메이드엔터테인먼트 대표로 재직할 때부터 카카오의 게임사업 가능성을 일찌감치 꿰뚫어보고 있었다는 것이다.  당시 남궁훈 대표는 누구도 주목하지 않던 카카오톡 게임하기 플랫폼에 위메이드의 게임을 앞장서서 공급하고, 모바일게임으로의 시장전환을 정확히 예측했다. 5년이 지난 지금, 직접 카카오의 게임사업 방향키를 잡은 남궁 대표의 행보에 업계 관심이 집중되는 이유다.   ■남궁훈, 5년전 카카오톡 가능성 \'확신\' 18일 관련업계에 따르면 남궁훈 대표는 지난 2012년 위메이드 대표 시절, 앞장서서 카카오톡 게임플랫폼(당시 서비스명 \'게임하기\')에 모바일게임 공급을 추진했다. 당시 카카오는 카카오톡 게임플랫폼 론칭을 준비하고 있었지만 시장의 주목을 전혀 받지 못하고 있는 상황이었다.         남궁훈 카카오게임즈 대표   당시 카카오 게임플랫폼을 담당했던 책임자는 ""카카오톡을 게임 플랫폼으로 발전시키려고 게임을 찾아 다녔지만, 성공 가능성에 대한 의문이 많아 게임 개발사가 쉽사리 게임을 주려고 하지 않았다""며 ""위메이드가 게임 3종 출시를 확정하면서 카카오톡 게임하기에 대한 관심이 높아졌다""고 언급하기도 했다.  당시 카카오톡은 가입자는 많았지만 뚜렷한 수익모델을 찾지 못하고 있던 서비스였다. 남궁훈 대표는 카카오톡이 게임 플랫폼으로 성공할 수 있다는 확신을 가졌고, \'바이킹아일랜드\' 등 게임 3종 공급을 결정했다. 카카오에 250억원 가량을 투자해 지분 일부를 확보하기도 했다.   ■남궁훈, 카카오톡 게임 전폭 지원 당시 남궁훈 위메이드 대표가 얼마나 카카오톡 게임플랫폼의 성공을 확신했는지는 기자간담회 장소에서도 잘 알 수 있다. 남궁훈 당시 위메이드 대표는 취임 1달여만에 모바일게임 사업 발표회를 열었는데, 사업발표회 장소가 카카오 본사(당시 서울 역삼동 위치)였다. 이 자리에서 남궁 대표는 카카오톡 게임플랫폼에 공급할 게임 3종을 처음 공개했다.  카카오톡 게임플랫폼은 남궁 대표의 예상대로 대성공을 거뒀다. 카카오톡 게임플랫폼은 게임업계 전반을 뒤흔들었다. 공전의 히트작 \'애니팡\'과 \'바이킹아일랜드\' 등이 큰 인기를 끌면서 게임은 카카오의 주요 매출원으로 자리매김했다.  이후 남궁 대표는 위메이드에서 모바일게임 히트작을 여럿 키워냈다. 바이킹아일랜드를 필두로, \'캔디팡\', \'윈드러너\', \'에브리타운\' 등이 남궁 대표의 손을 거쳐간 모바일게임이다.  이후 위메이드를 떠난 남궁 대표는 게임인재단을 설립하며 게임업계와 연을 이어오다 지난 2015년 엔진이라는 게임 퍼블리싱(배급) 업체를 설립, 게임사업에 복귀했다. 남궁 대표의 엔진은 카카오게임즈의 전신이다. 카카오는 엔진을 인수, 남궁훈 대표에게 카카오게임즈를 맡겼다.   ■\'구원투수\' 남궁훈, 카카오톡 게임 미래 책임진다 남궁훈 대표가 카카오게임즈를 처음 맡았을 당시 카카오 게임플랫폼은 성장이 정체돼 있었다. 2012년만해도 카카오톡 게임플랫폼 입점이 곧 성공이라는 공식이 성립됐지만 2015년에는 굳이 카카오톡에 입점해야 하느냐는 분위기가 게임업계에 팽배했다. 남궁훈 대표를 두고 \'카카오의 구원투수\'라는 평가가 나온 이유다.  지난 2년여간 남궁 대표는 카카오톡의 4번째 탭 \'게임별\' 오픈, 게임 퍼블리싱 사업 진출, 가상현실(VR) 게임 출시, 설치없이 바로 즐길 수 있는 스낵게임 출시 등으로 카카오게임즈의 성장을 진두지휘했다. 이제 카카오의 게임사업부문까지 흡수, 명실상부한 카카오 게임사업의 최고 의사결정권자가 됐다.  남궁훈 대표는 ""이번 통합으로 카카오게임즈는 모바일과 PC 온라인, VR와 증강현실(AR) 등을 아우르는 게임 전문 기업으로서 독보적인 경쟁력을 갖추게 됐다""며 ""좋은 콘텐츠로 게임 산업 발전과 게임 시장 활성화에 기여하는 리딩 기업이 되겠다""고 강조했다.  5년 전, 모바일게임 시대를 정확히 예측하고 카카오톡 게임플랫폼으로서의 성공 가능성을 꿰뚫어 본 그의 혜안이 카카오게임즈를 넥슨이나 넷마블게임즈, 엔씨소프트 등과 어깨를 견줄 수 있는 유력 게임사로 도약시킬 수 있을지 관심이 집중된다.          남궁훈 카카오게임즈 대표는       삼성SDS에서 직장생활을 시작해 한게임 창업멤버로 게임업계에 뛰어들었다. 한게임 사업부장과 한국게임 총괄 자리를 거쳐 NHN USA 대표이사, CJ인터넷(현 넷마블게임즈) 대표이사, 위메이드엔터테인먼트 대표이사 등을 거쳐 카카오게임즈 대표이사 이자 카카오 게임사업 총괄 부사장을 맡고 있는 게임업계 대표적인 전문가 중 한명으로 손꼽힌다. 페이스북을 통해 자신의 의견을 가감없이 전달하고 업계 전문가들과 소통하는 것으로 유명하다. 게임인재단을 설립, 중소 게임 개발사와 인디게임 개발사를 지원하는데도 신경쓰고 있다. 미래 게임인 육성을 위한 게임고등학교 설립이 오랜 꿈이다. 자전거 라이딩과 스키를 즐긴다.           jjoony@fnnews.com 허준 기자   ▶ 세상의 모든 골 때리는 이야기 \'fn파스\'▶ 속보이는 연예뉴스 fn스타  ※ 저작권자 ⓒ  파이낸셜뉴스. 무단 전재-재배포 금지파이낸셜뉴스 관련뉴스해당 언론사에서 선정하며 언론사 페이지(아웃링크)로 이동해 볼 수 있습니다.세계서 가장 예쁜 기상캐스터, 몸매 때문에 시청률이..불륜녀로 찍힌 걸그룹 출신 여성의 최후\'위암 발병률 세계 1위\' 한국인, 원인 알고보니..대왕 여드름인 줄 알고 짰다가 1시간만에..유흥가서 알몸으로 춤춘 女 촬영, CCTV 보니..좋아요0훈훈해요0슬퍼요0화나요0후속기사 원해요0기사제공 :']"
