,회사명,날짜,언론사,기사제목,링크,본문
0,NC soft, 2017-12-1918:04,파이낸셜뉴스 ,[게임결산] 모바일게임 국내 게임시장 주도… 온라인게임 영향력 여전,https://finance.naver.com/news/news_read.nhn?article_id=0003927619&office_id=014&mode=search&query=엔씨&page=1,"['       [게임결산] 모바일게임 국내 게임시장 주도… 온라인게임 영향력 여전      기사입력2017-12-19 18:04기사원문좋아요훈훈해요좋아요 평가하기공감좋아요0훈훈해요0슬퍼요0화나요0후속기사 원해요0댓글엔씨소프트 \'리니지M\' 출시 초반 일매출 130억 기록넷마블 \'리니지2 레볼루션\' 월매출 2000억원 넘어모바일게임 시장 규모 4조8800억원 전년比 12.7% 증가블루홀 \'배틀그라운드\' 동접자 300만명 넘어 역대 최고中 제재 해결, 북미.유럽 시장 개척은 풀어야 할 숙제                     올해 국내 게임산업은 대작 온라인게임의 지식재산권(IP)을 활용해 재탄생한 모바일게임이 주도했다. 넷마블게임즈의 \'리니지2 레볼루션\'을 시작으로 엔씨소프트의 \'리니지M\'이 바통을 이어 받아 현재까지도 인기를 끌고 있다. 이를 반영하듯 사상 처음으로 모바일게임 시장 규모가 온라인게임을 넘어섰다.하지만 온라인게임이 여전히 건재함을 입증하는 해이기도 했다. 블루홀이 선보인 온라인게임 \'배틀그라운드\'는 글로벌 시장에서 호응을 얻으면서 2017 게임대상에서 대상을 수상했다.국내 최대 게임 전시회인 지스타에서도 \'배틀그라운드\'가 영향력을 발휘하며 전시회를 장악했다는 평가를 받았다.■모바일게임 시장 주도19일 한국콘텐츠진흥원에 따르면 올해 국내 게임 시장 규모는 11조5703억원으로 지난해 보다 6.2% 증가했다. 이 중 모바일게임 시장 규모는 4조8800억원으로 전년 대비 12.7% 증가할 것으로 예측됐다. 온라인게임 시장 규모가 4조7207억원으로 예상되는 것을 감안하면 모바일게임 시장이 처음으로 온라인을 앞질렀다.올해 주목할 점은 대작 온라인게임의 모바일 게임으로의 재탄생이다. 온라인게임 \'리니지\' 시리즈는 모바일에서도 충분한 영향력을 발휘했다. 엔씨소프트가 지난 6월 출시한 모바일게임 \'리니지M\'은 출시 초반 하루 매출이 130억원을 기록했다. \'리니지M\'은 지금도 구글 플레이 최고 매출 순위에서 1위 자리를 지키고 있다.넷마블의 \'리니지2 레볼루션\'과 \'테라M\' 역시 대작 온라인게임을 모바일로 재해석한 작품이다. \'리니지2 레볼루션\'의 경우 사상 처음으로 한 달 매출이 2000억원을 넘어서며 모바일게임도 수익을 낼 수 있다는 가능성을 제시했다. 지금도 \'리니지2 레볼루션\'과 \'테라M\'은 구글 플레이 최고 매출 순위에서 각각 2위와 3위를 기록하고 있다.모바일게임의 흥행은 실적에도 반영됐다. 넷마블은 3.4분기 누적 매출이 1조8090억원을 기록해 국내 게임사 1위인 넥슨을 거의 따라 잡았다. 넥슨의 3.4분기 누적 매출은 1조8559억원으로 4.4분기 실적에 따라 국내 게임사 1위 자리가 결정될 것으로 예상된다. 엔씨소프트도 3.4분기 누적 매출이 1조2254억원으로 역대 최대치를 써내려가고 있다.■온라인게임 아직 살아있다올해 모바일게임이 시장을 주도했지만 온라인게임도 여전히 영향력을 미쳤다.그 주인공은 블루홀의 \'배틀그라운드\'다. \'배틀그라운드\'는 글로벌 게임 플랫폼인 스팀에서 동시접속자 수가 300만명을 넘어서며 역대 최고 기록을 세웠다. \'배틀그라운드\'에 대한 관심은 지스타에서도 확인할 수 있다. 지스타 기간에 열린 2017 게임대상에서 \'배틀그라운드\'는 대상을 비롯 △인기게임상 국내부문 △우수개발자상 프로그래밍 부문 △우수개발자상 기획 디자인부문 △게임비즈니스 혁신상 △기술 창작상 사운드 분야 등 총 6관왕에 올랐다.지스타 현장에서는 전시장 곳곳에서 \'배틀그라운드\'를 활용한 e스포츠 대회가 열렸다. 고품질 그래픽을 자랑하는 \'배틀그라운드\'를 PC나 그래픽카드 성능을 과시하기 위해 활용한 것이다, 때문에 올해 지스타는 \'배틀그라운드\'가 없었다면 흥행을 보장할 수 없었을 것이라는 말까지 나오기도 했다.■글로벌 진출은 숙제하지만 이같은 성과에도 불구하고 글로벌 진출이라는 숙제도 남겼다. \'배틀그라운드\'가 세계적인 인기를 얻으며 이목을 집중시켰지만 아직은 초기 단계에 그치고 있는 것이 사실이다.특히 중국 시장에 대한 갈증은 여전하다. 중국은 전 세계에서 게임 시장 규모가 가장 큰 곳이지만 한한령(限韓令)에 의해 게임 수출이 중단된 상태다. 모바일게임 \'리니지2 레볼루션\'과 \'리니지M\'의 경우 중국에서도 충분히 성공할 가능성이 높은 것으로 평가받고 있으나 게임을 서비스할 수 있는 권한인 판호가 발급되지 않고있다.북미와 유럽 시장을 개척하는 것도 과제다. 북미와 유럽은 온라인게임이나 모바일게임 보다 여전히 비디오게임이 주를 이루고 있다. 그나마 컴투스의 모바일게임 \'서머너즈워\'가 북미를 중심으로 흥행에 성공하면서 글로벌 공략의 가능성을 엿볼 수 있게 만들었다.게임업계의 또다른 관계자는 ""지난해 국산 모바일게임 수출이 크게 증가하면서 글로벌 시장에서도 국산 게임의 성공 가능성을 확인할 수 있는 기회가 됐다""면서도 ""중국 정부의 제재와 북미와 유럽 시장의 오래된 게임 문화 등은 여전히 국내 게임사들이 풀어야할 숙제로 남아있다""고 말했다.syj@fnnews.com 서영준 기자     ▶ 세상의 모든 골 때리는 이야기 \'fn파스\'▶ 속보이는 연예뉴스 fn스타  ※ 저작권자 ⓒ  파이낸셜뉴스. 무단 전재-재배포 금지파이낸셜뉴스 관련뉴스해당 언론사에서 선정하며 언론사 페이지(아웃링크)로 이동해 볼 수 있습니다.유흥업소 접대부는 여성만 인정된다?\'거침없는 질주\' 비트코인에 대한 모든 것[재테크 Q&A] 40대부부 빚청산·노후 준비 가능?""먼지쌓인 옷·책 당장 기부하세요, 세액공제 짭짤합니다""유방암 진단받고 가슴절제했는데...알고보니 오진좋아요0훈훈해요0슬퍼요0화나요0후속기사 원해요0기사제공 :']"
1,NC soft, 2017-12-1918:04,파이낸셜뉴스 ,[게임결산] 美·유럽 등 게임 본고장 공략,https://finance.naver.com/news/news_read.nhn?article_id=0003927620&office_id=014&mode=search&query=엔씨&page=1,"['       [게임결산] 美·유럽 등 게임 본고장 공략      기사입력2017-12-19 18:04기사원문좋아요훈훈해요좋아요 평가하기공감좋아요0훈훈해요0슬퍼요0화나요0후속기사 원해요0댓글넥슨.넷마블게임즈.엔씨소프트 게임사 \'빅3\' 해외 매출 3兆텃밭이던 中 아닌 북미 등 글로벌 시장서 성과 나와     국내 주요 게임업체들이 본격적으로 글로벌 게임기업으로의 도약에 나서고 있어 주목된다. 중국 등 아시아 지역을 중심으로 확산된 \'게임한류\'를 북미, 유럽 등 게임 본고장까지 확산시키겠다는 것이다. 특히 올해는 중국과의 사드(THAAD.고고도미사일방어체계) 갈등으로 텃밭이던 중국 수출길이 막히는 악재가 발생했음에도 북미, 유럽 등 신흥시장을 개척해 성과를 이뤘다. 내년에는 중국 수출길도 다시 열릴 것으로 전망되는 만큼 \'게임한류\'가 전 세계로 확산될 것으로 기대된다.19일 게임업계에 따르면 올해 국내 주요 게임사들의 해외 매출이 3조원을 훌쩍 넘어설 것으로 예상된다. 넥슨과 넷마블게임즈, 엔씨소프트 이른바 게임 \'빅3\'로 불리는 게임사들의 3.4분기까지 누적 해외 매출은 2조4400억원 수준으로 여기에 4.4분기까지 더하면 3조원을 넘어설 것이 확실시 된다.올해는 국내 게임사들이 해외에서 잇딴 낭보를 전해왔다.넥슨과 넷마블은 해외에서 선전을 이어가고 있다. 넥슨의 경우 중국 시장을 장악한 \'던전앤파이터\'의 인기가 견고하다. 모바일게임 \'히트\' 등이 일본 시장에서 의미있는 성과를 냈다. 넷마블은 북미 개발자회사인 카밤을 통해 선보인 \'마블 올스타 배틀\'이 지난 7월 미국 앱스토어 매출 순위 1위를 기록하는 등 선전하고 있다. 모바일게임 \'리니지2 레볼루션\' 역시 북미, 유럽 시장에서 매출 확대의 1등 공신 역할을 하고 있다.게임 개발사 블루홀의 선전도 빛났다. 블루홀은 신작 온라인게임 \'배틀그라운드\'를 글로벌 게임 플랫폼 스팀을 통해 선보여 동시 접속자 수 300만명을 돌파하는 성과를 냈다. 이는 스팀 내에서도 최고 기록이다. 배틀그라운드가 한국은 물론, 북미와 유럽, 아시아 등 전세계에서 게임한류의 첨병으로 활약했다. 이 외에도 컴투스의 \'서머너즈워\'와 펄어비스의 \'검은사막\' 등도 북미와 유럽 시장에서 인기게임 스테디셀러로 자리잡았다.내년은 \'게임한류\'의 전성시대가 될 것으로 예상된다. 중국과의 사드 갈등이 해소되면서 수출길이 다시 열릴 것으로 전망된다. \'리니지2 레볼루션\', \'리니지M\', \'배틀그라운드\' 등 올해 게임시장을 수놓았던 인기게임들이 줄줄이 중국 시장 입성을 눈앞에 두고 있다.특히 엔씨소프트의 \'리니지M\'의 경우 중국 성적표를 가늠할 수 있는 대만시장에서 돌풍을 일으키고 있다. 사전예약 첫 날에만 54만명의 예악자를 모집했다. 출시 첫 날부터 주요 앱마켓 순위 1위를 휩쓸면서 대만 최고 인기게임으로 부상했다. 엔씨소프트가 인기 온라인게임 \'아이온\'을 기반으로 한 모바일게임을 준비중인데 이 게임은 북미와 유럽을 겨냥한 것으로 알려졌다. 컴투스는 서머너즈워 지식재산권(IP)을 활용한 새로운 게임으로 다시 한번 북미, 유럽 시장 평정에 나선다.게임업계 한 관계자는 ""올해 중국 수출길이 막혔음에도 불모지라고 불리던 북미와 유럽에서 성공한 게임들이 등장하면서 또 한번의 게임한류 전성기의 토대를 다졌다""며 ""내년에는 과감한 인수합병(M&A)과 글로벌 게이머들을 겨냥한 게임 개발 등을 통한 게임한류 전성시대가 기대된다""고 말했다.허준 기자     ▶ 세상의 모든 골 때리는 이야기 \'fn파스\'▶ 속보이는 연예뉴스 fn스타  ※ 저작권자 ⓒ  파이낸셜뉴스. 무단 전재-재배포 금지파이낸셜뉴스 관련뉴스해당 언론사에서 선정하며 언론사 페이지(아웃링크)로 이동해 볼 수 있습니다.유흥업소 접대부는 여성만 인정된다?\'거침없는 질주\' 비트코인에 대한 모든 것[재테크 Q&A] 40대부부 빚청산·노후 준비 가능?""먼지쌓인 옷·책 당장 기부하세요, 세액공제 짭짤합니다""유방암 진단받고 가슴절제했는데...알고보니 오진좋아요0훈훈해요0슬퍼요0화나요0후속기사 원해요0기사제공 :']"
2,NC soft, 2017-12-1918:02,파이낸셜뉴스 ,"[게임결산] 게임관전 인기 급증… e스포츠, 新수익모델 급부상",https://finance.naver.com/news/news_read.nhn?article_id=0003927618&office_id=014&mode=search&query=엔씨&page=1,"['       [게임결산] 게임관전 인기 급증… e스포츠, 新수익모델 급부상      기사입력2017-12-19 18:02기사원문좋아요훈훈해요좋아요 평가하기공감좋아요0훈훈해요0슬퍼요0화나요0후속기사 원해요0댓글배틀그라운드 등 게임 방송 유튜브.아프리카TV 등서 인기넥슨.넷마블.엔씨소프트 등 업계, e스포츠-게임 접목단순한 마케팅 차원 아닌 수익과 연결 시도 활발                지난달 25일 서울 넥슨아레나에서 열린 \'피파온라인3\' e스포츠 대회 결승전에서 관람객들이 선수들의 경기를 지켜보고 있다.        e스포츠가 게임업계의 새로운 수익모델로 부상하고 있다.올해를 강타한 온라인게임 \'배틀그라운드\'가 e스포츠 열풍을 다시 한번 일으키면서 주요 게임업체들이 e스포츠를 바라보는 시선이 달라지고 있다.특히 내년에는 e스포츠가 게임업체들의 본격적인 수익사업으로 자리잡을 수 있을지가 관심이 모아지고 있다.그동안 e스포츠는 게임 흥행을 위한 마케팅 수단 정도로 인식됐지만, 1인 게임방송 등을 통해 게임을 하는 것보다 보는 것을 즐기는 이용자들이 늘면서 이를 수익과 연결시키려는 시도가 더욱 활발해질 전망이다.19일 관련 업계에 따르면 게임을 직접 즐기지는 않지만 다른 게이머의 게임을 보는 이용자들이 많아지면서 e스포츠가 게임업계 핵심 수익모델로 부상하고 있다.특히 블루홀의 \'배틀그라운드\'가 e스포츠 열풍을 주도 하고 있다.유튜브, 트위치, 아프리카TV 등 1인 방송 플랫폼에서 \'배틀그라운드\' 방송이 인기 방송으로 자리잡았다. \'배틀그라운드\'의 흥행 요인 중 하나가 e스포츠였다는 분석도 나온다.아프리카TV, 게임방송 OGN 등은 \'배틀그라운드\' 공식 리그도 개최하며 e스포츠 열풍을 이어가고 있다.e스포츠로 새로운 수익모델을 찾겠다고 발표한 회사도 등장했다.액토즈소프트는 다양한 게임들의 e스포츠 대회를 개최하는 글로벌 e스포츠 브랜드 \'WEGL\'을 선보였다. 지난달 열린 게임전시회 지스타에서 첫 선을 보인 \'WEGL\'은 스타크래프트 리마스터와 오버워치, 하스스톤, 철권7, 마인크래프트 등 다양한 게임을 활용한 e스포츠 대회다.국내 대표 게임사 넥슨은 e스포츠에 꾸준히 투자해온 게임사다. 자체적으로 e스포츠 대회를 진행하기 위해 서울 강남역 인근에 e스포츠 전용 경기장인 \'넥슨 아레나\'를 구축하면서 e스포츠에 집중해왔다. 피파온라인3, 던전앤파이터, 카트라이더 등의 인기게임들이 e스포츠와 함께 성장해왔다.넥슨이 내년 주요 신작게임으로 준비하고 있는 온라인게임 \'배틀라이트\'도 e스포츠에 최적화된 게임이라는 평가를 받고 있다. 이미 e스포츠로 성공한 리그오브레전드와 비슷한 장르의 게임인만큼 넥슨은 e스포츠로 \'배틀라이트\'의 성공방정식을 써내려간다는 계획이다.넷마블게임즈와 엔씨소프트도 e스포츠를 게임과 접목시키고 있다.엔씨소프트는 \'블레이드앤소울\' 등 인기 온라인게임의 e스포츠 대회를 꾸준히 개최하면서 게이머들의 관심을 받고 있다.지난 9월에는 e스포츠 대회와 문화축제를 연계하는 대규모 축제를 서울 광장에서 선보여 업계의 이목을 집중시킨 바 있다.넷마블게임즈는 모바일게임도 e스포츠로 성공할 수 있다는 점을 증명하고 있다. 5대5 적진점령 모바일게임 \'펜타스톰\' 대회를 꾸준히 열고 있다.지난달에는 펜타스톰 아시아 지역 최강자를 결정하는 \'펜타스톰 아시아 인터내셔널 챔피언십\'도 개최했다.게임업계 한 전문가는 ""게임을 직접 즐기는 이용자 만큼이나 게임을 보면서 즐기는 이용자들이 늘고 있어 e스포츠가 게임업계의 새로운 수익모델로 부상하고 있다""며 ""내년에는 단순한 마케팅 차원으로 e스포츠에 접근하는 것이 아니라 새로운 수익모델로 접근하는 모습을 보게 될 것""이라고 말했다.jjoony@fnnews.com 허준 기자     ▶ 세상의 모든 골 때리는 이야기 \'fn파스\'▶ 속보이는 연예뉴스 fn스타  ※ 저작권자 ⓒ  파이낸셜뉴스. 무단 전재-재배포 금지파이낸셜뉴스 관련뉴스해당 언론사에서 선정하며 언론사 페이지(아웃링크)로 이동해 볼 수 있습니다.유흥업소 접대부는 여성만 인정된다?\'거침없는 질주\' 비트코인에 대한 모든 것[재테크 Q&A] 40대부부 빚청산·노후 준비 가능?""먼지쌓인 옷·책 당장 기부하세요, 세액공제 짭짤합니다""유방암 진단받고 가슴절제했는데...알고보니 오진좋아요0훈훈해요0슬퍼요0화나요0후속기사 원해요0기사제공 :']"
3,NC soft, 2017-12-1917:46,한국경제 ,기초체력 튼튼한 우량주로 길목 지켜라,https://finance.naver.com/news/news_read.nhn?article_id=0003867420&office_id=015&mode=search&query=엔씨&page=1,"['       기초체력 튼튼한 우량주로 길목 지켜라      기사입력2017-12-19 17:46기사원문좋아요훈훈해요좋아요 평가하기공감좋아요0훈훈해요0슬퍼요0화나요0후속기사 원해요0댓글""시총상위주 차익실현 나선 외국인들, 내년 초엔 돌아올 것""외국인 지분 많은 종목 \'주목\'글로벌 증시 폐장 앞두고 최근 한 달 간 2조3000억 매도전문가들 ""연말 매도 현상 일시적"" 올해 빛난 외국인들의 \'선구안\'지분 꾸준히 늘린 대형·중소형주코스피 상승률 크게 웃돌아지분 증가 코스닥 상위 10곳 주가↑[ 윤정현 기자  ] 외국인 투자자들이 올해 국내 유가증권시장과 코스닥시장에서 시가총액 상위 종목을 중심으로 지분율을 크게 끌어올린 것으로 나타났다. 연말이 다가오면서 외국인들이 차익실현에 나서자 해당 종목은 조정을 받고 있다.이와 관련, “최근 하락한 종목 중 외국인 지분 비율이 높은 종목에 대한 투자 비중을 늘리는 역발상 투자전략을 구사해볼 만하다”는 전문가들이 많다. “외국인이 연말 장부 마감(북 클로징)을 앞두고 올해 많이 오른 한국 증시 시총 상위 종목을 집중 매도하고 있지만, 내년 초 장이 재개되면 이들 종목 중 유망 종목부터 우선 되사들일 것”이란 게 이들의 논리다.◆수확 나선 외국인19일 한국거래소에 따르면 지난달 20일부터 이달 18일까지 한 달간 외국인은 유가증권시장에서 2조2984억원어치를 팔아치웠다. 11월 중순까지 8조원을 웃돌았던 외국인의 연초 이후 누적 순매수 규모는 6조9313억원으로 줄었다.올해 외국인이 보유 지분을 대거 늘린 종목들의 ‘성적’이 우수했기 때문에 다른 연말 때보다 차익실현 움직임이 뚜렷한 것이라는 분석이 나온다. 금융정보제공업체 와이즈에프엔에 따르면 올 들어 유가증권시장 대형주 100개 종목 중 71개가 외국인 지분율이 늘었다.외국인 지분율 증가폭이 큰 10개 종목 중 두산밥캣(올해 주가 4.04% 하락)을 제외하고 모두 올 들어 주가가 크게 상승했다. 외국인이 지분을 11.47%포인트 늘린 LG전자의 상승률(101.55%)이 가장 컸다. 삼성SDI(90.83%) 호텔신라(76.32%) OCI(65.82%) LS산전(62.77%) 등의 상승률도 올해 코스피지수 상승률(22.47%)을 크게 웃돌았다.코스닥시장에서도 외국인의 ‘선구안’은 돋보였다. 외국인 지분율 증가폭 상위 10개 회사 모두 주가가 30% 이상 올랐다. 30개 종목으로 범위를 넓혀도 주가가 하락한 것은 안랩(-1.90%)뿐이었다.올해 3배 넘게 뛴 SKC코오롱PI(245.71%)는 연초 2.61%에 불과했던 외국인 지분율이 13.22%까지 늘었다. 2배 이상 오른 웹젠(156.86%)도 연초 4.08%에 그쳤던 외국인 지분율이 26.15%까지 증가했다. 외국인은 올해 코스닥시장에서 2조7622억원을 순매수해 개인(2조1721억원 순매수)보다 더 많이 사들였다.◆“외국인 돌아올 길목 지켜야”전문가들은 “최근 외국인이 매도하는 종목 중에서 내년 초 되살 만한 종목을 선별해 투자할 필요가 있다”고 강조했다. 기초체력(펀더멘털)이 탄탄한 종목은 외국인이 밸류에이션(실적 대비 주가 수준) 매력을 평가한 뒤 연초에 다시 사들일 수 있기 때문이다.작년 12월 외국인의 집중 매도 목록에 올랐던 삼성SDI(올 1~2월 주가 상승률 20.00%) 유한양행(12.28%) 엔씨소프트(11.61%) 등은 연초에 곧바로 반등 추세를 보였다. 삼성SDI는 올 1분기까지 6분기 연속 영업적자에서 벗어나 2분기부터 흑자전환에 성공했다. 삼성SDI는 올해 연간 1000억원 이상의 영업이익을 낼 것으로 전망되고 있다.엔씨소프트와 유한양행은 올해 사상 최대 영업이익을 올릴 것이란 게 증권업계의 예상이다. 고승희 미래에셋대우 연구원은 “전 세계적으로 주식형 펀드로의 자금 유입이 지속되고 있고, 국내 기업들의 실적 증가, 안정적인 외환시장 환경 등을 고려할 때 외국인의 순매도는 일시적인 현상에 그칠 것”이라며 “외국인의 매매 흐름이 바뀔 때를 대비해 실적이 양호한 종목들을 중심으로 길목을 지켜야 한다”고 말했다.최근 한 달간 외국인의 순매도 규모가 컸던 종목 중 올해뿐 아니라 내년까지 실적 개선세를 이어갈 것으로 예상되는 종목은 삼성전자와 SK하이닉스 등 정보기술(IT) 대표주를 비롯해 LG유플러스 LG이노텍 넷마블게임즈 등이다.지난달 초 280만원을 넘었던 삼성전자 주가는 최근 한 달 새 외국인이 2조원 가까이 순매도하면서 250만원대로 뒷걸음질쳤다. 조승빈 대신증권 연구원은 “내년 한국 상장사들의 주당순이익(EPS) 전망치는 꾸준히 상향 조정되고 있고, 그 중심에는 IT가 있다”며 “실적 전망을 기반으로 외국인의 관심도 다시 돌아올 것”이라고 말했다.윤정현 기자 hit@hankyung.com[한경닷컴 바로가기] [글방] [모바일한경 구독신청] ⓒ 한국경제 & hankyung.com, 무단전재 및 재배포 금지한국경제 관련뉴스해당 언론사에서 선정하며 언론사 페이지(아웃링크)로 이동해 볼 수 있습니다.(마감)코스피 외국인 1652억 순매도\'스타트업 천국\' 꿈꾸는 일본… 외국인 창업비자 1년으로 연장""강남까지 20분대""…3억7천이던 파주 아파트값이7만7000원짜리 중고나라서 49만원에 팔리는 게""동네가 \'엉망\'이 됐다""…청와대 앞 상인들의 호소좋아요0훈훈해요0슬퍼요0화나요0후속기사 원해요0기사제공 :']"
