,회사명,날짜,언론사,기사제목,링크,본문
14,NC soft, 2017-09-0408:39,전자신문 ,"[ET투자뉴스]엔씨소프트, ""IP의 저력, 모바…"" 매수(유지)-미래에셋대우",https://finance.naver.com/news/news_read.nhn?article_id=0002638215&office_id=030&mode=search&query=엔씨&page=1,"['       [ET투자뉴스]엔씨소프트, ""IP의 저력, 모바…"" 매수(유지)-미래에셋대우      기사입력2017-09-04 08:39기사원문좋아요훈훈해요좋아요 평가하기공감좋아요0훈훈해요0슬퍼요0화나요0후속기사 원해요0댓글미래에셋대우에서 4일 엔씨소프트(036570)에 대해 ""IP의 저력, 모바일과 로열티를 모두 잡는다""라며 투자의견을 \'매수(유지)\'로 제시하였다. 아울러 12개월 목표주가를 600,000원으로 내놓았다. 미래에셋대우 문지현 애널리스트가 동종목에 대하여 이번에 제시한 \'매수(유지)\'의견은 미래에셋대우의 직전 매매의견과 동일한 것이고 올해 초반의 시장컨센서스와 비교해 볼때도 역시 \'매수\'의견이 계속 유지되고 있는 상태이다. 그리고 최근 분기내 발표된 전체 증권사 리포트의 컨센서스와 비교를 해볼 경우에 오늘 발표된 투자의견은 전체의견에 수렴하고 있어, 이번 의견은 시장의 평균적인 기대감이 객관적으로 표현된 것으로 분석되고 있다. 한편 12개월 목표주가로 제시한 600,000원은 직전에 발표된 목표가와 대비해서 큰 변화는 없고, 목표주가의 추이를 살펴보면 최근 장기간 목표가가 같은 수준에 머물고 있는 모습이다. 또한 전일 종가 기준으로 볼때 동종목의 현주가는 이번에 제시된 목표가 대비 51.5%의 저평가 요인이 존재한다는 해석이 제시되고 있다. ◆ Report briefing미래에셋대우에서 엔씨소프트(036570)에 대해 ""모바일 게임 시장의 경쟁이 계속 치열하기 때문에 인지도가 높은 IP에 대한 수요는 지속적일 전망이다. 사전 인지도가 높은 IP를 활용한 게임은 홍보와 이용자 선점에 유리하기 때문이다. ‘L2R’의 해외 성과도 ‘리니지’ IP에 대한 현지 사용자의 인지도가 작용한 것으로 판단된다""라고 분석했다.  또한 미래에셋대우에서 ""‘리니지’를 비롯한 주요 온라인 게임의 PC방 사용량은 3분기에 전분기와 유사한 수준으로 유지되고 있다. 동사의 ‘리니지’는 ‘배틀그라운드’와 관련한 영향은 미미한 것으로 보이며, 그 전의 ‘리니지M’ 영향이 더 컸던 것으로 판단된다. ‘길드워2’는 가을에 북미/유럽 지역의 확장팩 출시가 예정되어 하반기 실적 개선이 예상된다""라고 밝혔다.  한편 ""3분기는 최고 실적이 예상되며, 내년에도 ‘B&S 모바일’ 등 게임 신작과 로열티 매출 증가 등을 통해 실적 개선이 지속될 것""라고 전망했다. ◆ Report statistics미래에셋대우의 동종목에 대한 최근 1년동안의 투자의견은 전체적으로 큰 변화없이 유지되고 있다. 목표주가는 2016년8월 420,000원이 저점으로 제시된 이후 이번에 발표된 600,000원까지 꾸준하게 상향조정되어 왔다. 해당기간 동안 순이익 증가폭이 매우 컸던 것으로 보아 동사에 대한 투자의견은 그동안 시장이 침체권이었음에도 불구하고 높아지고 있어 주로 기업의 내부요인, 특히 수익성 증가에 큰 영향을 받는 것으로 해석되고 있다. 한편 증권정보제공 업체인 씽크풀에 따르면 동사에 대한 컨센서스는 \'매수\'이고 목표주가는 꾸준히 상향조정되고 있고 더욱이 최근에는 목표가의 상승폭 또한 더욱 커지는 추세이다. \xa0컨센서스최고최저투자의견매수매수(유지)HOLD(M)목표주가528,519650,000400,000*최근 분기기준오늘 미래에셋대우에서 발표된 \'매수(유지)\'의견 및 목표주가 600,000원은 전체의견에 수렴하면서 시장의 평균적인 기대감이 비교적 객관적으로 표현된 것으로 풀이되며 목표가평균 대비 13.5% 초과하고 있는 것으로 집계되었다.  참고로 최근에 목표주가를 가장 공격적으로 제시한 유화증권에서 투자의견 \'매수\'에 목표주가 650,000원을 제일 보수적인 의견을 제시한 유안타증권에서 투자의견 \'HOLD(M)\'에 목표주가 400,000원을 제시한 바 있다. \xa0의견제시일자투자의견목표가격20170904매수(유지)600,00020170808매수(유지)600,00020170726매수(유지)600,00020170710매수(유지)600,00020170621매수500,000의견제시일자증권사투자의견목표가20170904미래에셋대우매수(유지)600,00020170830동부증권매수(유지)540,00020170825KTB투자증권BUY520,00020170814부국증권매수(유지)500,000(씽크풀에서 제공하는 컨센서스는 국내 전증권사에서 발표되는 기업분석 리포트 및 코멘트를 실시간으로 통계/분석처리되고 있습니다.)증시분석 전문기자 로봇 ET etbot@etnews.com전자신문과 씽크풀의 증시분석 전문기자 로봇 ET가 쓴 기사입니다▶ 전자신문 인기 포스트▶ 전자신문 공식 페이스북▶ 전자신문 바로가기 [Copyright ⓒ 전자신문 & 전자신문인터넷, 무단전재 및 재배포 금지]전자신문 관련뉴스해당 언론사에서 선정하며 언론사 페이지(아웃링크)로 이동해 볼 수 있습니다.글로벌 가전 스마트홈 겨냥 \'커넥티드\' 전쟁...개방형 합종연횡도 확산트럼프 ""한미 FTA 폐기 논의하겠다""…정부 ""모든 가능성 대비""\'벤처 1세대\' 이해진·김범수·김정주, 나란히 총수 반열에北, 6차 핵실험 감행...5차보다 5~6배 위력보편요금제 \'무제한 요금\' 논란 일 듯···주파수 부족도좋아요0훈훈해요0슬퍼요0화나요0후속기사 원해요0기사제공 :']"
15,NC soft, 2017-09-0408:33,이데일리 ,변동성 확대 구간에도 경기는 회복세..2300이 단단한 지지선,https://finance.naver.com/news/news_read.nhn?article_id=0003914481&office_id=018&mode=search&query=엔씨&page=1,"[""       변동성 확대 구간에도 경기는 회복세..2300이 단단한 지지선      기사입력2017-09-04 08:33기사원문좋아요훈훈해요좋아요 평가하기공감좋아요0훈훈해요0슬퍼요0화나요0후속기사 원해요0댓글 [이데일리 최정희 기자] 북한의 여섯 번째 핵실험으로 대북 리스크가 시장의 변동성을 확대할 것으로 전망된다. 가뜩이나 새 정부 들어 부동산 규제, 주식 양도차익 과세 강화, 법인세 인상, 통상임금 판결 등으로 증시에 부정적인 이슈가 터지면서 증시 상승세가 주춤해진 터라 대북 리스크는 투자 심리를 더욱 위축시키는 요인이 되고 있다. 그러나 이런 변동성 국면을 포트폴리오 재편 기회로 활용해야 한다는 주장이 제기되고 있다. 글로벌 경기회복은 변동성 국면 속에서도 지속되고 있기 때문이다. 박소연 한국투자증권 연구원은 4일 보고서에서 “도널드 트럼프 미국 대통령의 정책 혼선에도 불구하고 미국의 핵심 자본재 주문, 제조업 가동률은 계속해서 우상향할 것”이라며 “원자재 가격 상승과 구조개혁으로 인한 펀더멘털 개선으로 신흥국 경기도 견조하게 회복하고 있다”고 설명했다. 대다수 투자자들이 9월 미국 의회의 예산안 통과 불발로 연방정부 셧다운과 부채한도 상향 등을 걱정하고 있지만 오히려 문제가 빠르게 풀려나갈 경우 안도랠리가 나타날 가능성이 있다는 게 박 연구원의 설명이다. 미국이 좋아지면 통화 긴축 우려가 불거지고 신흥국에서 자금이 이탈할 가능성이 있지만 대다수 신흥국은 펀더멘털이 크게 개선되면서 자금 유출 우려가 줄어들고 있단 점도 다행스러운 부분으로 평가된다. 박 연구원은 “지금은 경기를 믿고 가야 하는 구간”이라며 “극심했던 IT 대형주 쏠림이 완화되고 경기민감주 또는 중소형주 등으로 포트폴리오 재편이 이뤄질 것으로 기대한다”고 설명했다. 코스피 지수는 12개월 선행 주가수익비율 1배 수준인 2300선 부근에서 단단한 지지선을 형성할 것이란 전망이다. 성장성과 밸류에이션 매력을 갖춘 종목으로 삼성전자, 포스코, 셀트리온, 고려아연, 엔씨소프트 등이 꼽혔다.최정희 (jhid0201@edaily.co.kr)▶사진으로 보는 핫이슈▶[페이스북] 보러가기~♥ | [카카오톡] 플친 맺기~♥＜ⓒ종합 경제정보 미디어 이데일리 - 무단전재 & 재배포 금지＞이데일리 관련뉴스해당 언론사에서 선정하며 언론사 페이지(아웃링크)로 이동해 볼 수 있습니다.[기자수첩]KAI 흑자도산 설까지 나도는데…손놓고 있는 당국[단독]테이크아웃 일회용 컵 보증금 받는다…10년만에 부활최태원 SK 회장 장녀 윤정씨, 10월 벤처기업 대표와 결혼로또 770회 1등 22억 당첨자 8명 중 5명 '자동'..배출점은?실수요자 위한 청약제도 개편?… 더 멀어진 내집 마련에 3040 '한숨'좋아요0훈훈해요0슬퍼요0화나요0후속기사 원해요0기사제공 :""]"
16,NC soft, 2017-09-0408:33,머니투데이 ,"엔씨소프트, 3Q '리니지2 레볼루션' 로열티 증가-미래에셋대우",https://finance.naver.com/news/news_read.nhn?article_id=0003929226&office_id=008&mode=search&query=엔씨&page=1,"['       엔씨소프트, 3Q \'리니지2 레볼루션\' 로열티 증가-미래에셋대우      기사입력2017-09-04 08:33기사원문좋아요훈훈해요좋아요 평가하기공감좋아요0훈훈해요0슬퍼요0화나요0후속기사 원해요0댓글 [머니투데이 박계현 기자] 미래에셋대우가 4일 엔씨소프트에 대해 "" 3분기는 최고 실적이 예상되며, 내년에도 \'블레이드앤소울(B&S) 모바일\' 등 게임 신작과 로열티 매출 증가 등을 통해 실적 개선이 지속될 전망""이라며 투자의견 \'매수\'와 목표주가 60만원을 유지했다.문지현 연구원은 ""IP(지적재산권)를 활용한 로열티 매출은 비용이 수반되지 않아 영업이익에 긍정적인 영향을 준다""며 ""엔씨소프트의 로열티 매출과 영업이익률은 대체로 유사한 흐름을 보여주고 있다""고 설명했다.이어 ""넷마블게임즈가 \'리니지2 레볼루션\'을 6월 동남아, 8월 일본에 이어 4분기 북미·유럽, 중국에 추가 출시하면서 로열티 매출 역시 확대될 것""이라고 덧붙였다. 미래에셋대우는 엔씨소프트 실적의 핵심 변수인 \'리니지M\'이 8월 들어 주간 상승량에서 재상승세를 타고 있는 것으로 추정했다.문 연구원은 ""엔씨소프트가 모바일게임의 \'월초 효과\'(모바일 소액 결제 금액 한도가 초기화되는 1일을 기준으로 매출이 오르는 경향)를 겨냥해 \'판도라의 유물 상자(커츠)\' 판매 이벤트를 진행 중""이라고 설명했다.TOM칼럼-깊이있는 투자정보▶무료 만화 즐기고~ 선물타자!▶ 빵빵한 차&레이싱걸▶ 박계현 기자 unmblue@머니투데이 관련뉴스해당 언론사에서 선정하며 언론사 페이지(아웃링크)로 이동해 볼 수 있습니다.2만원짜리 치킨 만드는데 원가는 2600원대[시승기]패밀리카 끌판왕 \'카니발 하이리무진\' 타보니\'55세 발레리나\' 서정희, 믿기지 않는 몸매\'우이신설선\' 타보니…""북한산 가자"" 등산객으로 \'북적\'""제네시스 \'G70\', 마세라티급 성능""…가격 3750만원부터좋아요0훈훈해요0슬퍼요0화나요0후속기사 원해요0기사제공 :']"
17,NC soft, 2017-09-0408:13,매일경제 ,"[Hot-Line] ""엔씨소프트, 로열티 매출 증가 가능성…리니지M 지표도 재상승...",https://finance.naver.com/news/news_read.nhn?article_id=0004007648&office_id=009&mode=search&query=엔씨&page=1,"['       [Hot-Line] ""엔씨소프트, 로열티 매출 증가 가능성…리니지M 지표도 재상승""      기사입력2017-09-04 08:13기사원문좋아요훈훈해요좋아요 평가하기공감좋아요0훈훈해요0슬퍼요0화나요0후속기사 원해요0댓글[제공 : 미래에셋대우]미래에셋대우는 4일 엔씨소프트에 대해 넷마블게임즈의 \'리니지2 레볼루션\' 해외 출시, \'블레이드앤소울\' 모바일 신작 출시 등으로 로열티 매출이 증가할 가능성이 높아지고 있다며 투자의견 매수, 목표주가 60만원을 유지했다.미래에셋대우는 엔씨소프트의 수익성에 도움을 주는 중요 변수 중 하나로 \'로열티 매출\'도 빼놓을 수 없다고 밝혔다. IP(지적재산권)를 활용한 로열티 매출은 비용이 수반되지 않는 고수익성 성격으로서, 영업이익에 긍정적인 영향을 준다는 설명이다. 엔씨소프트의 로열티 매출은 작년까지 중국 텐센트를 통한 PC 온라인 게임 \'블레이드&소울\' 퍼블리싱 로열티의 기여가 높았다. 올해부터는 넷마블게임즈의 \'리니지2 레볼루션\'의 성과가 로열티 매출의 주요 변수로 작용하고 있다고 미래에셋대우는 분석했다. 넷마블게임즈는 \'리니지2 레볼루션\'을 6월 동남아, 8월 일본에 이어 4분기 북미·유럽, 중국에 추가 출시할 예정이다. \'블레이드앤소울\' IP를 활용한 넷마블게임즈의 모바일 신작 또한 엔씨소프트 로열티 매출에 기여할 전망이라고 미래에셋대우는 밝혔다.또 미래에셋대우는 \'리니지M\'의 주간 사용량 추이가 8월 들어 재상승세를 기록한 것으로 파악했다. 엔씨소프트는 모바일 게임의 \'월초 효과\'를 적극 활용하고 있다. \'월초 효과\'는 모바일 소액 결제금액 한도가 초기화되는 1일을 기준으로 매출이 오르는 경향을 지칭한다. 현재 8월 30일부터 9월 6일 기간에는 \'판도라의 유물 상자(커츠)\' 판매 이벤트가 진행 중이다. 기본 상품에다 보너스 상품을 확률적으로 추가 획득하는 방식으로서 아이템 매출에 긍정적으로 기여할 것으로 예상했다.문지현 미래에셋대우 연구원은 ""최근 블루홀의 \'배틀그라운드\'의 인기로 인해 PC방 게임 순위에 변동이 많지만 엔씨소프트의 \'리니지\'는 \'배틀그라운드\'와 관련한 영향이 미미한 것으로 보인다""라며 ""3분기는 최고 실적이 예상되며 내년에도 \'블레이드앤소울 모바일\' 등 게임 신작과 로열티 매출 증가 등을 통해 실적 개선이 지속될 전망""이라고 말했다. [디지털뉴스국 고득관 기자][매일경제 공식 페이스북] [오늘의 인기뉴스] [매경 프리미엄][ⓒ 매일경제 & mk.co.kr, 무단전재 및 재배포 금지]매일경제 관련뉴스해당 언론사에서 선정하며 언론사 페이지(아웃링크)로 이동해 볼 수 있습니다.\'미키정과 10년만에 이혼\' 하리수, 남성 품에 안겨서…[뉴스 & 분석] 김정은, 수소탄 核폭주…한반도 절체절명한국 복귀 앞둔 황재균 ""아쉽지만, 미련은 없다""오지현 ""나도 메이저 퀸"" 3억5천만원 잭팟\'47살\' 이일화, 20대도 울고 갈 \'美친 몸매\' 드러내다좋아요0훈훈해요0슬퍼요0화나요0후속기사 원해요0기사제공 :']"
18,NC soft, 2017-09-0408:00,조선비즈 ,"""엔씨소프트, IP 로열티 매출 증가 기대"" - 미래대우",https://finance.naver.com/news/news_read.nhn?article_id=0000381845&office_id=366&mode=search&query=엔씨&page=1,"['       ""엔씨소프트, IP 로열티 매출 증가 기대"" - 미래대우      기사입력2017-09-04 08:00기사원문좋아요훈훈해요좋아요 평가하기공감좋아요0훈훈해요0슬퍼요0화나요0후속기사 원해요0댓글 미래에셋대우는 엔씨소프트(036570)에 대해 지적재산권(IP) 로열티 매출이 증가할 것이라고 4일 내다봤다. 투자의견은 ‘매수’, 목표주가는 60만원을 각각 유지했다.문지현 연구원은 “엔씨소프트 실적의 주요 핵심 변수는 여전히 ‘리니지M’”이라며 “그러나 수익성에 도움을 주는 중요 변수 중의 하나로 ‘로열티 매출’도 빼놓을 수 없다”고 말했다.문 연구원은 “지적재산권(IP)를 활용한 로열티 매출은 비용이 수반되지 않는 고수익성 성격으로, 영업이익에 긍정적인 영향을 준다”며 “엔씨소프트의 로열티 매출과 영업이익률은 대체로 유사한 흐름을 보여주고 있다”고 설명했다.그는 “엔씨소프트의 로열티 매출은 작년까지 중국 텐센트를 통한 PC 온라인 게임 ‘블레이드&소울’ 퍼블리싱(서비스·유통) 로열티의 기여가 높았다”며 “올해부터는 넷마블게임즈의 ‘리니지2: 레볼루션’의 성과가 로열티 매출의 주요 변수로 작용하고 있다”고 말했다.문 연구원은 “넷마블게임즈는 리니지2: 레볼루션을 6월 동남아, 8월 일본에 이어 4분기 북미와 유럽, 중국에 추가 출시할 예정”이라며 “블레이드&소울 IP를 활용한 넷마블게임즈의 모바일 신작 또한 엔씨소프트 로열티 매출에 기여할 전망”이라고 내다봤다.그는 이어 “모바일 게임 시장의 경쟁이 계속 치열하기 때문에 인지도가 높은 IP에 대한 수요는 계속될 것으로 보이는데, 사전 인지도가 높은 IP를 활용한 게임은 홍보와 이용자 선점에 유리하기 때문”이라고 덧붙였다.[이선목 기자 letswin@chosunbiz.com]chosunbiz.com조선비즈 관련뉴스해당 언론사에서 선정하며 언론사 페이지(아웃링크)로 이동해 볼 수 있습니다.""오고 싶으면 돈 내""…중국인 떠난 제주 급기야""한 달 500만원 벌어요""…시골로 향하는 장년층""한국버스 타보고 깜짝""…세계가 인정한 기술력""현대차, 中 노동자 당장 해고해라""…작심 발언다주택자 투기꾼 몰던 김현미, 등기부등본 봤더니좋아요0훈훈해요0슬퍼요0화나요0후속기사 원해요0기사제공 :']"
19,NC soft, 2017-09-0408:00,파이낸셜뉴스 ,"엔씨소프트, '리니지M'과 로열티 모두 긍정적",https://finance.naver.com/news/news_read.nhn?article_id=0003868413&office_id=014&mode=search&query=엔씨&page=1,"['       엔씨소프트, \'리니지M\'과 로열티 모두 긍정적      기사입력2017-09-04 08:00기사원문좋아요훈훈해요좋아요 평가하기공감좋아요0훈훈해요0슬퍼요0화나요0후속기사 원해요0댓글  미래에셋대우가 4일 엔씨소프트에 대해 모바일 게임 \'리니지M\'과 로열티 매출 증가 가능성이 예상된다며 목표가 60만원, 투자의견 매수를 제시했다.  미래에셋대우에 따르면 엔씨소프트 실적의 주요 핵심 변수는 리니지M이다. 문지현 미래에셋대우 연구원은 ""리니지M 주간 사용량 추이가 지난달 들어 재상승세를 기록한 것으로 파악된다""며 ""리니지M의 다음 일정은 국내는 개인 간 거래 도입, 공성전 등 콘텐츠 추가이고, 해외 출시는 대만, 일본, 중국 등의 순서가 될 전망""이라고 말했다.  문 연구원은 수익성에 도움을 주는 또 다른 중요 변수 중 하나로 로열티 매출을 언급했다. 그는 ""지적재산권(IP)을 활용한 로열티 매출은 비용이 수반되지 않는 고수익성 성격으로 영업이익에 긍정적인 영향을 준다""며 ""엔씨소프트의 로열티 매출은 지난해까지 중국 텐센트를 통한 개인용컴퓨터(PC) 온라인 게임 \'블레이드&소울\' 퍼블리싱 로열티의 기여가 높았다""고 설명했다. 그러면서 ""올해부터는 넷마블게임즈의 \'리니지2: 레볼루션\'의 성과가 로열티 매출의 주요 변수로 작용하고 있다""고 덧붙였다.   ethica@fnnews.com 남건우 기자   ▶ 세상의 모든 골 때리는 이야기 \'fn파스\'▶ 속보이는 연예뉴스 fn스타  ※ 저작권자 ⓒ  파이낸셜뉴스. 무단 전재-재배포 금지파이낸셜뉴스 관련뉴스해당 언론사에서 선정하며 언론사 페이지(아웃링크)로 이동해 볼 수 있습니다.별장에서 벌거벗은 男 웃는 사진, 꽃뱀의 최후불에 탄 주택서 남녀 숨진 채 발견, 이웃주민 하는말이..한국당 결국 폭발, 文 대통령 향해 ""5년 뒤에..""불륜녀로 찍힌 걸그룹 출신 여성의 최후커피 마시면 우리 몸에서 일어나는 무서운 변화좋아요0훈훈해요0슬퍼요0화나요0후속기사 원해요0기사제공 :']"
0,NC soft, 2017-09-0407:42,서울경제 ,"[오늘의 종목]엔씨소프트, PC게임 수익도 계속 탄탄하게 유지",https://finance.naver.com/news/news_read.nhn?article_id=0003104497&office_id=011&mode=search&query=엔씨&page=2,"['       [오늘의 종목]엔씨소프트, PC게임 수익도 계속 탄탄하게 유지      기사입력2017-09-04 07:42기사원문좋아요훈훈해요좋아요 평가하기공감좋아요0훈훈해요0슬퍼요0화나요0후속기사 원해요0댓글 [서울경제] 미래에셋대우는 4일 엔씨소프트(036570)에 대해 “모바일 게임 ‘리니지M’ 상승세뿐 아니라 PC 온라인 게임도 안정적인 편이라 앞으로 전망이 긍정적이다”고 밝혔다. 목표가와 투자의견은 각각 기존의 60만원, ‘매수’를 유지했다. 문지현 연구원은 “꾸준히 사랑 받고 있는 ‘리니지’를 비롯한 주요 온라인 게임의 PC방 사용량은 전분기와 3·4분기가 유사한 수준으로 유지되고 있다”며 “최근 블루홀의 ‘배틀그라운드’의 인기로 인해 PC방 게임 순위에 변동이 많지만 엔씨소프트의 ‘리니지’는 ‘배틀그라운드’와 관련한 영향은 미미하며, 그 전의 ‘리니지M’ 영향이 더 컸다”고 봤다. ‘길드워2’는 가을에 북미·유럽 지역의 확장팩 출시가 예정되어 하반기 실적 개선이 예상된다. 한편 지적재산권(IP) 부문 수익도 증가 추세다. 문 연구원은 “IP를 활용한 로열티 매출은 비용이 수반되지 않는 고수익성 성격으로서, 영업이익에 긍정적인 영향을 준다”며 “엔씨소프트의 로열티 매출과 영업이익률은 대체로 유사한 흐름”이라고 덧붙였다. /조양준기자 mryesandno@sedaily.com[서울경제 바로가기]1997년 이래 대한민국 최고의 과학자 DB [바로가기]서울경제의 모든 연재물!... 서경Cube [바로가기▶]저작권자 ⓒ 서울경제, 무단 전재 및 재배포 금지서울경제 관련뉴스해당 언론사에서 선정하며 언론사 페이지(아웃링크)로 이동해 볼 수 있습니다.靑 ""北지진, 6차 핵실험 따른 것으로 추정""\'文대통령 잘한다\' 응답한 사람 줄어든 결정적 이유는?[北 6차 핵실험] ""북한은 깡패국가"" 트럼프, 군사조치 포함 \'모든옵션\' 동원할듯총리 부인 주재 오찬 \'김정숙 여사\' 건배사 안한 사연""제정신이냐?"" 멜라니아의 \'하이힐 홍수패션\' 그 후좋아요0훈훈해요0슬퍼요0화나요0후속기사 원해요0기사제공 :']"
