,회사명,날짜,언론사,기사제목,링크,본문
0,NC soft, 2017-09-0417:42,한국경제 ,[Hot Stock] 엔씨소프트,https://finance.naver.com/news/news_read.nhn?article_id=0003818778&office_id=015&mode=search&query=엔씨&page=1,"['       [Hot Stock] 엔씨소프트      기사입력2017-09-04 17:42기사원문좋아요훈훈해요좋아요 평가하기공감좋아요0훈훈해요0슬퍼요0화나요0후속기사 원해요0댓글 4일 유가증권시장에서 1만5500원(3.91%) 오른 41만1500원에 마감했다. 지난 7월 이후 두 달 만에 40만원대를 회복했다. 3분기 영업이익이 지난해 동기보다 네 배 이상 증가할 것으로 예상되는 등 실적개선 기대감이 주가를 끌어올렸다. 이준규 부국증권 연구원은 “7월 선보인 리니지M 성장세가 이어지고 있다”고 말했다.[한경닷컴 바로가기] [글방] [모바일한경 구독신청] ⓒ 한국경제 & hankyung.com, 무단전재 및 재배포 금지한국경제 관련뉴스해당 언론사에서 선정하며 언론사 페이지(아웃링크)로 이동해 볼 수 있습니다.애경유화휴온스글로벌중국 사드 보복에 결국…현대차 \'중대 결단\'""몇 년 뒤 집값 더 뛴다"" 부동산 전문가의 조언北 핵폭탄…용산에 떨어지면 안전한 지역은?좋아요0훈훈해요0슬퍼요0화나요0후속기사 원해요0기사제공 :']"
1,NC soft, 2017-09-0417:21,매일경제 ,"펄어비스, 게임 `검은사막` 100개국 출시…순익 3배",https://finance.naver.com/news/news_read.nhn?article_id=0004008167&office_id=009&mode=search&query=엔씨&page=1,"['       펄어비스, 게임 `검은사막` 100개국 출시…순익 3배      기사입력2017-09-04 17:21기사원문좋아요훈훈해요좋아요 평가하기공감좋아요0훈훈해요0슬퍼요0화나요0후속기사 원해요0댓글대만선 국민게임으로 대접中진출도 추진…시총 1조 예상단일 게임 지나친 의존 부담◆ 공모주 투자노트 / 펄어비스 ◆  시가총액이 1조원대에 달하는 게임 개발업체 펄어비스가 이달 14일 코스닥 시장에 입성한다. 올 상반기 최대 기업공개(IPO)인 넷마블게임즈에 이어 또다시 대형 게임주가 주식시장에 등장하면서 공모주 투자자들의 관심이 모아지고 있다. 온라인 다중접속역할수행게임(MMORPG) \'검은사막\'을 해외에서 잇달아 흥행시킨 펄어비스는 이번 상장을 발판 삼아 글로벌 시장으로 도약하겠다는 복안이다. 2010년 설립된 펄어비스 대표작은 검은사막이다. 2015년 5월 일본을 시작으로 러시아 북미 유럽 등에 순차적으로 게임을 출시했다. 출시와 동시에 검은사막은 현지 게임 순위 상위권을 차지할 정도로 큰 인기를 얻고 있다. 현재 100여 개 국가에 서비스 중이다.  실적도 빠르게 늘고 있다. 검은사막 출시 첫해인 2015년 217억원이었던 매출액은 지난해 621억원까지 증가했다. 같은 기간 영업이익은 281% 오른 454억원, 순이익은 304% 상승한 413억원을 기록했다. 업계는 올해에도 이와 비슷한 성장률을 이어갈 것으로 기대하고 있다. 펄어비스는 올해 세계 최대 게임시장인 중국 진출을 앞두고 있다. 이를 위해 현지 게임회사와 퍼블리싱 계약도 맺었다. 올해 초 출시한 대만에서 검은사막이 \'국민게임\'으로 자리 잡자 중화권에서 상품성을 충분히 인정받을 수 있겠다는 판단에서다. 이와 함께 펄어비스는 검은사막을 모바일과 콘솔용으로도 내놓을 예정이다. 상품 포트폴리오 다변화를 통해 수익성을 높이겠다는 것이다. 펄어비스의 기업가치도 급격히 오르고 있다. 펄어비스는 공모가를 확정하기 위해 지난달 말 국내외 기관투자가를 대상으로 수요예측을 실시했다. 그 결과 공모가는 희망가 최상단인 10만3000원으로 결정됐다. 당시 수요예측에 참여한 기관 신청 물량의 절반 이상이 희망가 상단부에 몰렸다. 그만큼 성장성을 높이 평가했다는 의미다. 이에 따른 상장 후 시가총액은 1조2428억원에 달한다. 당초 펄어비스는 공모희망가로 8만~10만3000원을 제시했다. 대표주간사인 한국투자증권은 주가수익비율(PER)을 활용해 기업가치를 산정했다. 지난해 7월부터 올해 3월까지 최근 3분기 순이익을 연환산한 수치(416억원)에 비교 기업들의 평균 PER 35.39배를 적용한 뒤 8.7~29%의 할인율을 매긴 것이다. 비교 기업은 사업구조 등을 고려해 엔씨소프트, 넥슨지티, 웹젠, 엠게임 등 4곳을 선정했다. 높은 성장세에도 불구하고 온라인게임 산업이 예전과 달리 침체되고 있다는 점은 부담으로 꼽힌다. 전 세계적으로 대형 온라인게임 개발회사들이 모바일게임 시장으로 옮겨가면서 산업 자체가 크게 위축됐다고 업계 관계자들은 말한다. 실제 온라인게임 전체 성장률은 2014년 9.3%를 기록한 이후 지난해 6.7%로 하락했다. 2018년에는 성장률이 4.7%까지 떨어질 것으로 추정된다. 펄어비스 측은 ""온라인게임 시장이 예년에 비해 크게 위축된 것은 맞지만, 모바일게임 시장에 비해 유행에 민감하지 않다는 게 특징""이라며 ""다시 말해 진입장벽이 예전보다 높아져서 게임 하나가 흥행에 성공하면 \'롱런\'하는 경우가 많아졌다""고 전했다.  게임 포트폴리오가 검은사막 하나에 불과하다는 점도 투자 위험으로 꼽힌다. MMORPG 장르 특성상 호흡이 길다는 점은 긍정적이나, 단일 게임으로는 향후 수익성이 불투명하다는 지적이다. 현재 펄어비스의 매출은 전부 검은사막에서 발생하고 있다. 펄어비스는 이번 상장에서 180만주를 공모하며, 전체 공모금액은 1854억원이다. 5~6일 공모주 청약을 거쳐 이달 14일 코스닥 시장에 상장한다. [송광섭 기자][매일경제 공식 페이스북] [오늘의 인기뉴스] [매경 프리미엄][ⓒ 매일경제 & mk.co.kr, 무단전재 및 재배포 금지]매일경제 관련뉴스해당 언론사에서 선정하며 언론사 페이지(아웃링크)로 이동해 볼 수 있습니다.이용대 부인 변수미, 훈남 남편 사로잡은 미모 \'깜짝\'베일벗은 야심작 \'제네시스 G70\'허지웅 무성욕자 아니다? ""조미령 내 스타일""해인사에 모셔진 \'임진왜란 3화상\' 정체\'50대\' 채시라, 믿기 힘든 \'동안 외모+S라인 몸매\'좋아요0훈훈해요0슬퍼요0화나요0후속기사 원해요0기사제공 :']"
2,NC soft, 2017-09-0416:47,뉴시스 ,北 핵실험에도 한국 주식 사들인 外人...향배는?,https://finance.naver.com/news/news_read.nhn?article_id=0008158735&office_id=003&mode=search&query=엔씨&page=1,"['       北 핵실험에도 한국 주식 사들인 外人...향배는?      기사입력2017-09-04 16:47기사원문좋아요훈훈해요좋아요 평가하기공감좋아요0훈훈해요0슬퍼요0화나요0후속기사 원해요0댓글【양구=뉴시스】김경목 기자 = 합동참모본부가 북한 풍계리 일대에서 발생한 규모 5.7의 인공지진이 6차 핵실험으로 추정된다고 발표한 3일 오후 중부전선 강원도 양구군 해안면 현리 민간인출입통제선 검문소 주변 일대가 인적이 드물어 적막한 분위기다. 2017.09.03. photo31@newsis.com외인 순매수 1위 종목 \'엔씨소프트\'【서울=뉴시스】 이진영 기자 = 북한이 전날 단행한 6차 핵실험으로 인한 충격으로 코스피가 4일 30포인트 가까이 급락 마감했다. 하지만 한국 증시 \'큰손\' 외국인이 최근 외면해왔던 한국 주식을 다시 담아 눈에 띈다.문재인 정부가 지난 5월 10일 출범한 후 북한은 수차례 미사일 도발을 감행하는 등 북한 리스크가 고조됐지만 본격적인 외국인의 자금 유출을 일어나지 않았다. 그러나 5차 핵실험에 비해 폭발력이 10배에 이른다는 북한 6차 핵실험 소식으로 외국인들이 국내 증시에서 자금을 빼 선진국 증시나 채권 등 안전자산으로 옮길 것이라는 우려가 고조됐으나 외국인은 오히려 국내 주식을 사들이며 무덤덤한 반응을 나타낸 것이다. 한국거래소에 따르면 코스피는 이날 전 거래일(2357.69)보다 28.04포인트(1.19%) 내린 2329.65로 마감했다.북한이 2016년 9월 9일에 이어 약 1년 만인 전날 6차 핵 실험을 감행한 영향이다. 또 북한이 같은 날 대륙간탄도로켓(ICBM) 장착용 수소탄 시험이 ""완전히 성공했다""고 발표한 것도 악재로 작용했다. 주목할 점은 북핵 리스크 고조에도 국내 증시 향배의 리트머스 시험지 역할을 하는 외국인 투자자들이 매수 기조를 유지했다는 것이다. 앞서 지난 7월 25일 장중 코스피 역대 최고치인 2453.17까지 높이는 것을 주도한 것은 외국인이다. 외국인은 지난해 12월부터 올 7월까지 7개월 연속 순매수 행진을 이어갔으나 지난 7월(-5658억원), 8월(-1조8752억원) 순매도세로 전환했다. 이에 따라 외국인이 \'바이 코리아\'에서 \'셀 코리아\'로 기조를 변화시킬 것이라는 가능성이 제기됐으나 9월 첫날인 1일 140억원 순매수한데 이어 북한 돌발 리스크에도 이날도 사자 기조를 유지했다. 이날 투자자별 매매 동향을 보면 코스피에서 외국인은 67억원 순매수세를 나타냈다. 기관도 3168억원 순매수세를 나타내며 증시를 떠받쳤다. 반면 개인은 3437억원 순매도했다. 종목별로 보면 외국인은 이날 게임 대장주인 엔씨소프트를 451억원 순매수, 가장 많이 바구니에 담았다. 이에 따라 엔씨소프트는 이날 전 거래일보다 3.91%(1만5500원) 뛴 41만1500원에 장을 마쳤다.   이어 SK하이닉스(322억원), LG이노텍(102억원), 카카오(68억원), 아모레퍼시픽(62억원), 현대중공업(61억원), 코덱스 인버스(59억원), 롯데케미칼(59억원), 미래에셋대우(45억원), S-Oil(42억원) 등 순으로 외국인이 코스피에서 많이 샀다. \'코스피 대장주\'인 삼성전자는 이날 외국인이 38억원 순매수해 외국인 순매수 상위 11위 종목에 이름을 올렸다.  중소형주 중심의 코스닥에서도 외국인은 한국 주식을 내다 팔기는커녕 담았다. 코스닥지수는 이날 전 거래일(661.99)보다 11.10포인트(1.68%) 내린 650.89로 마감했다.코스닥에서 이날 개인(366억원)은 순매도했으나 외국인(197억원)과 기관(155억원)은 순매수했다.  종목별로 보면 외국인은 코스닥에서 CJ E&M을 56억원 순매수, 가장 많이 샀다. 다음으로 셀트리온헬스케어(30억원), 에코프로(30억원), 메디포스트(28억원), 셀트리온(27억원), 포스코켐텍(22억원), 테스(22억원), 지트리비앤티(20억원), 하이비젼시스템(16억원), 더블유게임즈(12억원) 등이 외국인 순매수 상위 10위권에 이름을 올렸다. 대북 리스크 고조 속 외국인들의 자금 흐름 전망에 이목이 쏠린다. 전문가들은 대체로 외국인들이 한국 증시에서 자금을 대규모 뺄 가능성을 제한적으로 예상했다. 이종우 IBK투자증권 리서치센터장은 ""과거 북핵 리스크 발발 후 증시가 잠깐 빠졌다가 다시 회복하는 패턴을 외국인도 겪을 만큼 겪어 국내 증시에서 어떻게 대응해야 하는지 알고 있다""며 ""오늘 외국인 매도 물량이 많지 않아 매수가 조금만 나와도 순매수세를 띠는 흐름을 나타냈다""고 설명했다. 이종우 센터장은 또 ""국내 증시 펀터멘털을 고려해 보면 이미 외국인이 올 들어 살만큼 샀다""며 ""당분간 어지간한 변화가 있지 않고서야 외국인이 의미있게 사거나 팔거나 하지 않을 것""이라고 내다봤다.   고승희 미래에셋대우 연구원은 ""북한 핵실험에도 외국인은 오늘 국내 증시에서 중립적인 흐름을 보였다""며 ""글로벌 증시 환경을 보면 경제지표 및 기업 실적이 개선되고 있는 가운데 국내 증시 상장사의 전년동기와 비교한 실적 증감률은 글로벌 최상위 수준인 만큼 외국인 입장에서 중장기적으로 국내 증시를 버리기 어려울 것""이라고 말했다. 다만 고 연구원은 ""하루 만의 반응을 가지고 당장 외국인이 \'셀 코리아\'가 \'바이 코리아\' 기조로 바뀌었다라고 말하기는 힘들다""며 ""오늘 외국인의 매수 강도가 세지 않고, 북한 리스크가 끝난 것도 아니기 때문에 추가적으로 단기 순매도세가 나올 수 있다""고 분석했다. 이와 달리 외국인의 대규모 매출 출회 가능성도 제기됐다. 이경민 대신증권 연구원은 ""오는 9일 북한 건국절까지 북한 리스크로 인한 위기감이 당분간 고조될 가능성이 높다""며 ""이 경우 외국인 투자심리 위축, 이로 인한 대규모 매물 출회 가능성이 높다""고 지적했다. 또한 ""한·미 자유무역협정(FTA) 폐기 이슈, 미국·유럽 통화정책회의를 앞둔데 따른 불확실성이 가세할 경우 IT뿐만 아니라 소재·산업재에도 하락 압력이 가중될 전망""이라며 ""코스피 2300 이탈 가능성을 열어 놓고 봐야 한다""라고 강조했다. 대북 리스크로 인한 외국인 매도 가능성이 국내 투자자들의 매수 기회라는 관측도 나왔다. 곽현수 신한금융투자 연구원은 ""북한의 6번째 핵실험이 한국 주식시장에 부정적 요소로 작용하는 가운데 기대 수익률 악화에 환 변동성 확대라는 두가지 악재가 더해지므로 외국인 입장에서는 차익실현 심리가 더욱 거세질 수 있다""며 ""국내 투자자들은 이러한 외국인 투자자의 이탈을 활용해 주식 비중을 확대하는 기회로 활용하는 전략이 바람직하다""라고 제안했다. mint@newsis.com▶ 뉴시스 빅데이터 MSI 주가시세표 바로가기 ▶ 뉴시스 SNS [페이스북] [트위터]뉴시스 관련뉴스해당 언론사에서 선정하며 언론사 페이지(아웃링크)로 이동해 볼 수 있습니다.[빅데이터MSI]4일 빅데이터 심리 1→1→1→1단계…\'매우 나쁨\'[MSI급락주]삼성SDI, 북핵發 IT주 하락에 시장심리↓[MSI급등주]후성, 반도체 증설 수혜 기대감에 시장심리↑코스피 2320선으로 밀려나…외인·기관 \'사자\'에 낙폭 축소글로벌 시총 500사 중 韓기업 고작 3개···삼성전자 13위좋아요0훈훈해요0슬퍼요0화나요0후속기사 원해요0기사제공 :']"
3,NC soft, 2017-09-0416:00,머니투데이 ,"펀드매니저 ""北위협에도 산다… 결국 실적따라 오를것""",https://finance.naver.com/news/news_read.nhn?article_id=0003929696&office_id=008&mode=search&query=엔씨&page=1,"['       펀드매니저 ""北위협에도 산다… 결국 실적따라 오를것""      기사입력2017-09-04 16:00기사원문좋아요훈훈해요좋아요 평가하기공감좋아요0훈훈해요0슬퍼요0화나요0후속기사 원해요0댓글 [머니투데이 한은정 기자, 진경진 기자] [""코스피 2350 이하 분할매수…IT·정유·화학·철강주 유망""]북한의 수소탄 도발에도 불구하고 펀드매니저들은 국내 주식에 대한 매수세를 이어가고 있다. 당분간 북한 관련 불확실성은 이어질 수 있지만 국내 증시의 펀더멘털이 견조해 \'분할매수 기회\'라는 의견을 재차 확인했다. 4일 코스피 지수는 28.04포인트(1.19%) 하락한 2329.65에 거래를 마쳤다. 이날 코스피지수는 장 출발과 동시에 2316.89(-1.73%)으로 떨어졌지만 외국인 투자자들의 매수에 힙입어 빠른 속도로 30포인트 가까이 회복, 2344선까지 올라섰다. 하지만 장 마감 30분 전 국방부가 북한의 ICBM(대륙간탄도미사일)급 탄도미사일 발사 준비활동을 식별했다는 소식에 다시 낙폭을 늘린 채로 마감했다.그럼에도 펀드 자금을 의미하는 투신권은 7월 말부터 본격적으로 국내 주식을 사들이기 시작해 지난달 9일 도널드 트럼프 미국 대통령의 \'화염과 분노\' 발언 이후에도 단 3거래일을 제외하고 이날까지 매수세를 지속했다. 국민연금을 포함한 연기금 역시 지난달 9일 2481억원 규모로 코스피 주식을 대거 사들인데 이어 이날도 469억원 순매수를 기록하는 등 꾸준히 국내 주식을 사모으고 있다.최광욱 J&J자산운용 대표는 ""코스피 2350선 이하는 분할 매수하기에 좋은 시기""라며 ""북한 이슈는 결국 어떤 형태로든 풀려야 한다고 보는데 시장 체력도 강해져 과거 북한의 핵실험 단행 때 공포로 인한 투매가 나왔던 것과는 달라진 모습""이라고 설명했다. 허남권 신영자산운용 대표도 ""북한의 행태가 상당히 위협적이지만 우리가 해결할 수 있는 대안이 없기는 예나 지금이나 마찬가지""라며 ""기본적으로 깔려있는 위험을 안고 분산투자를 하면 더 좋은 기회를 잡을 수 있다""고 조언했다.장봉영 키움자산운용 상무(CIO)는 ""단기간에 끝날 일이 아니기 때문에 이런 위협이 한 두 번은 더 있을 거라고 짐작해 왔으며 이번 사태도 새삼 놀랍진 않다""며  ""이런 때일수록 공포에 휩싸이지 말고 각 기업들의 펀더멘털과 정부 정책의 방향 등에 집중해야 한다""고 말했다.펀드매니저들은 최근 국내 기업의 하반기 이익 추정치가 상향되고 있다는 점에 주목했다. 금융정보회사 와이즈에프엔이 상장기업 193개를 분석한 결과 2분기 영업이익이 45조525억원을 기록한데 이어 3분기 영업이익 추정치는 49조1337억원으로 집계됐다.허필석 마이다스에셋자산운용 대표는 ""9월은 상승 재료가 없는 시기로 판단해 보수적으로 대응할 계획""이라면서도 ""다만 10월에는 3분기 실적 이슈로 상승 모멘텀이 생길 것""이라고 기대했다. 최 대표는 ""올 상반기 상장 기업들이 사상 최대 실적을 기록했지만 정점이라고 보지는 않는다""며 ""사상 최대 실적에 사상 최대 주가라는 공식은 시장의 진리이기 때문에 자주 오지 않는 저가매수 기회를 놓쳐서는 안 된다""고 말했다.특히 실적 추정치가 상향되고 있는 정보기술(IT) 업종을 비롯해 철강, 화학, 정유 등 소재업종이 유망할 것이란 의견이다. 실제로 최근 한 달간 투신권 매수상위 10개 종목에는 삼성전자(1678억원), SK하이닉스(627억원), LG전자(525억원)을 비롯해 SK이노베이션(458억원)과 현대오일뱅크를 자회사로 두고 있는 현대로보틱스(423억원), LG화학(352억원), 롯데케미칼(227억원) 등이 포함됐다.최 대표는 ""IT 업종의 경우 반도체 수출이 여전히 견조하고 유기발광다이오드(OLED) 디스플레이의 수출도 확대되고 있어 긍정적""이라며 ""정유, 화학 등의 스프레드(원료와 제품가격 차이)도 좋아지고 있다""고 설명했다.원종준 라임자산운용 대표는 ""오늘 대북 이슈에도 불구하고 롯데케미칼, 엔씨소프트 등 실적 호전주들은 주가가 올랐다""며 ""상반기에 시가총액 대형주와 IT, 금융 업종만 주목받았다면 하반기부터는 온기가 확산되면서 중소형주 역시 이익증가율이 개선되는 분위기""라고 말했다.TOM칼럼-깊이있는 투자정보▶무료 만화 즐기고~ 선물타자!▶ 빵빵한 차&레이싱걸▶ 한은정 기자 rosehans@mt.co.kr, 진경진 기자 jkjin@mt.co.kr머니투데이 관련뉴스해당 언론사에서 선정하며 언론사 페이지(아웃링크)로 이동해 볼 수 있습니다.\'55세 발레리나\' 서정희, 믿기지 않는 몸매""제네시스 \'G70\', 마세라티급 성능""…가격 3750만원부터유한킴벌리 ""생리대, 먹는 물보다 더 엄격한 기준으로 관리""中 \'잔칫날\'에 핵실험한 北…""중국, 석유공급 끊을지도""1억원 준다면 셋째 아이 낳으시겠습니까?좋아요0훈훈해요0슬퍼요0화나요0후속기사 원해요0기사제공 :']"
4,NC soft, 2017-09-0414:38,머니S ,"광주·전남, 8월 주식 거래량·대금 '감소'",https://finance.naver.com/news/news_read.nhn?article_id=0000268332&office_id=417&mode=search&query=엔씨&page=1,"['       광주·전남, 8월 주식 거래량·대금 \'감소\'      기사입력2017-09-04 14:38기사원문좋아요훈훈해요좋아요 평가하기공감좋아요0훈훈해요0슬퍼요0화나요0후속기사 원해요0댓글정부의 세법 개정안과 부동산 과열 대책 발표에 따른 투자심리 위축 및 북한의 미사일 발사 영향 등으로 지난달 광주·전남지역 주식\xa0거래량과 거래대금이 감소한 것으로 나타났다.4일 한국거래소 광주사무소가 내놓은 ‘2017년 8월 광주·전남 주식거래동향’에 따르면 지역 투자자의 유가증권시장 및 코스닥 시장을 합친 주식\xa0거래량은 3억3526만주로 전월 3억4240만주보다 2.09% 감소했다.주식 거래대금도 2조4566억원으로 전월 2884억원보다 10.51% 감소했다. 광주·전남지역 투자자들이 전체 거래에서 차지한\xa0거래량 비중은 1.72%로 전월( 1.81%)보다 0.09% 감소했고, 거래대금도 1.31%로 전월(1.43%)대비 0.12% 감소했다.유가증권시장 거래량 상위종목으로는 KEC, 페이퍼코리아, 미래산업, 성문전자, KODEX레버리지, 씨아이테크 등이었고, 거래대금 상위종목으로는 SK하이닉스, 삼성전자, 한국항공우주, 카카오, 엔씨소프트, 삼성전기\xa0등이었다.코스닥시장 거래량 상위 종목으로는 KD건설, 세종텔레콤, 파루, 이화전기, 빅텍, 이에스브이, 리켐 등의 순이었고 거래대금 상위종목으로는 \xa0셀트리온, 파루, 에코프로, 내츄럴엔도텍, 빅텍, 셀트리온헬스케어 순으로 나타났다.광주=이재호 기자 머니S 관련뉴스해당 언론사에서 선정하며 언론사 페이지(아웃링크)로 이동해 볼 수 있습니다.채시라 딸 ""벌써 17세, 아빠 닮아 키가 172cm""\'부산 여중생 폭행\', 청와대 홈페이지에 청원글 잇따라송중기♥송혜교, 결혼 앞두고 미국 동반출국…""개인 일정""[부동산S토리] 황금연휴 전에 털자… 9월 분양시장 큰 장 선다[머니포커S] 먹구름 몰려오는 건설사좋아요0훈훈해요0슬퍼요0화나요0후속기사 원해요0기사제공 :']"
5,NC soft, 2017-09-0412:48,한국경제TV ,"[특징주]현대차, 중국·미국 판매부진 ... 8월 실적 부진",https://finance.naver.com/news/news_read.nhn?article_id=0000571519&office_id=215&mode=search&query=엔씨&page=1,"['       [특징주]현대차, 중국·미국 판매부진 ... 8월 실적 부진      기사입력2017-09-04 12:48기사원문좋아요훈훈해요좋아요 평가하기공감좋아요0훈훈해요0슬퍼요0화나요0후속기사 원해요0댓글[한국경제TV 이가은 기자]출발증시[특징주]한화테크윈, 북한 핵 실험 ... 지정학적 리스크 우려 확대s-oil, 정제마진 초강세 기대 ... 실적 개선 전망롯데케미칼, 업스트림 스프레드 확대 수혜 기대엔씨소프트, 로열티 매출 증가 전망현대차, 중국·미국 판매부진 ... 8월 실적 부진현대모비스, 친환경차 부품 매출 성장세 전망이가은기자 ⓒ 한국경제TV, 무단 전재 및 재배포 금지한국경제TV 관련뉴스해당 언론사에서 선정하며 언론사 페이지(아웃링크)로 이동해 볼 수 있습니다.서태지 아내 이은성, 부내나는 근황 셀카…출산 후 물오른 미모""김생민 덕에 돈 번 연예인 많아""...10억 모은 비결은?하리수, \'의문의 男\' 커플사진 해명 ""20년지기 일본인 친구""신주아, 재벌2세 남편과 결혼 후 악플 세례...""태국으로 팔려갔다""이수만 조카 써니 ""삼촌이 큰 회사 하신다""는 말에 이경규 \'깜짝\'좋아요0훈훈해요0슬퍼요0화나요0후속기사 원해요0기사제공 :']"
