,회사명,날짜,언론사,기사제목,링크,본문
0,NC soft, 2017-01-2017:52,서울경제 ,[펀드줌인-KB액티브배당] '성장+배당' 종목 투자...5년 수익률 45%,https://finance.naver.com/news/news_read.nhn?article_id=0002961256&office_id=011&mode=search&query=엔씨&page=1,"['       [펀드줌인-KB액티브배당] \'성장+배당\' 종목 투자...5년 수익률 45%      기사입력2017-01-20 17:52기사원문좋아요훈훈해요좋아요 평가하기공감좋아요0훈훈해요0슬퍼요0화나요0후속기사 원해요0댓글 고성장주 중 고배당주 선택시장영향 적어 꾸준한 수익안정적 수익을 확보할 수 있는 배당주펀드가 올해도 증권사들의 추천 상품 목록을 독차지하고 있다. 도널드 트럼프 미국 대통령 취임부터 브렉시트(영국의 유럽연합(EU) 탈퇴, Brexit) 협상 시작, 프랑스 대선 등 시장 변동성을 확대할 만한 이벤트가 연중 예정돼 있어 안정적인 배당주 투자 매력이 올해도 계속될 것이라는 판단이다.‘KB액티브배당’ 펀드는 전통적인 고배당 기업을 우선 담는 일반 배당주펀드와 달리 좋은 주식을 선정한 후 이 중에서 배당수익률이 높은 기업을 골라 투자한다. 이에 따라 배당주 주가가 좋은 시기나 지금처럼 금리 인상으로 상대적으로 배당주 주가가 약한 시기에도 꾸준한 성적을 낼 수 있다는 게 담당 펀드매니저의 설명이다. 윤태환 KB자산운용 펀드매니저는 “좋은 주식은 적정한 가격에 거래되고 있는 성장주를 의미한다”며 “성장률이 높은 기업이나 저성장에서 성장률이 반등하는 기업에 투자한다”고 말했다.실제 펀드 성과도 안정적이다. 지난 2010년 8월 초 설정된 후 18일 기준 3개월 5.16%, 1년 11.07%, 3년 34.05%, 5년 45.5%의 수익률을 기록하고 있다. 설정액(클래스 합산)은 1,850억원 수준이다. 지난해 11월 기준 펀드 내 가장 비중이 높은 투자 종목은 삼성전자(15.78%)로 나타났다. 윤 매니저는 “당장 지배구조 개선이 이뤄지기는 어렵지만 삼성전자의 주가는 부품사업 실적 개선에 기반해 올해 최소 200만원까지는 올라갈 것으로 전망한다”고 말했다. 이밖에 효성과 엔씨소프트 등 최근 주주친화정책을 통해 배당을 꾸준히 늘리고 있고 사업성장을 지속하는 기업도 펀드 내 상위 10종목 안에 포함하고 있다. 또 현대자동차2우선주(4.65%), 삼성전자1우선주(4.27%) 등 우선주의 편입 비중도 높다.KB액티브배당 펀드의 목표수익률은 연 7~10%다. 배당수익률로 연 2~2.5% 수익을 내고 주가차익으로 연 5~7% 수익을 내겠다는 전략이다. 윤 매니저는 “단순히 배당만 많이 주는 고배당주가 아니라 이익 성장을 바탕으로 하는 배당주에 투자해 시장금리에 영향을 받지 않을 것”이라며 “성장주가 좋을 때나 가치주가 좋을 때나 변함없이 꾸준한 수익률을 내는 것이 목표”라고 말했다. /박민주기자 parkmj@sedaily.com[서울경제 바로가기]나와 찰떡 궁합인 대선 후보는? [설문 바로가기]서울경제와 친해지는 가장 확실한 방법 [페이스북]저작권자 ⓒ 서울경제, 무단 전재 및 재배포 금지서울경제 관련뉴스해당 언론사에서 선정하며 언론사 페이지(아웃링크)로 이동해 볼 수 있습니다.[모닝브리핑]한국투자증권 ""1월에는 배당주, 상반기에는 반도체""코스피, 배당락 매물폭탄은 없었다배당락일 이후에도 안전한 고배당주는[투자 스타일별 수익률 성과] 고배당주>저평가주>변동성 낮은 종목 順외국인 지분 70%이상! 기관 320만주 순매수한 고배당주는!좋아요0훈훈해요0슬퍼요0화나요0후속기사 원해요0기사제공 :']"
1,NC soft, 2017-01-2017:50,파이낸셜뉴스 ,코스피 달굴 실적개선주 찾아볼까,https://finance.naver.com/news/news_read.nhn?article_id=0003765715&office_id=014&mode=search&query=엔씨&page=1,"['       코스피 달굴 실적개선주 찾아볼까      기사입력2017-01-20 17:50기사원문좋아요훈훈해요좋아요 평가하기공감좋아요0훈훈해요0슬퍼요0화나요0후속기사 원해요0댓글작년 4분기 실적발표 본격화.. 목표주가 상향 보고서 쏟아져현대차·엔씨소프트·LG화학, SK이노베이션 등 주목할 만               상장기업들의 지난해 4.4분기 실적발표기간이 본격적으로 개막되면서 이익이 좋아진 기업들에 대한 기대치가 코스피를 달구고 있다.지난해 4.4분 상장기업 실적은 대체로 상승할 것이라는게 증권가의 관측이다. 구조조정 끝에 턴어라운에 성공한 기업들이 많기 때문이다. 증권업계는 본격적인 실적 개선 종목들에 대해 목표주가를 잇달아 상향조정하고 있다.20일 증권업계에 따르면 다음주 약 29개의 기업들이 실적을 발표한다. NH투자증권은 순이익 개선 예상종목으로 LG생활건강(0.24%), LG디스플레이(10.74%), SK하이닉스(10.64%), 현대모비스(0.59%), LG화학(17.73%) 등을 꼽았다. 시장 기대치 보다 낮아질 종목은 하나금융지주(-28.51%), 포스코(-14.29%), 네이버(-1.34%) 등을 지목했다. 김병연 NH투자증권 연구원은 ""트럼프 취임식 등으로 불확실성이 확대되겠지만 기업들의 작년 4.4분기 실적과 올 1.4분기 실적 기대치가 완만한 상승을 그릴 것으로 예상된다""며 ""박스권에서 업종별로 등락과 투자자들의 순환매매가 예상된다""고 진단했다.증권사들은 실적발표시즌에 앞서 성장이 예상되는 종목들에 대해 목표주가 상향 보고서를 쏟아 내고 있다. 삼성증권은 포스코대우에 대해 신규광구의 가치가 점차 높아질 것이라고 분석하고 목표가를 기존 3만원에서 3만2000원으로 높였으며, 엔씨소프트는 신작 게임의 로열티 수입이 늘 것이라는 분석으로 35만원에서 40만원으로 조정했다.신한금융투자는 현대차의 북미투자 확대 발표가 향후 성장동력이 될 것으로 보고 목표주가를 18만원에서 20만원으로 높였다. 또 현대로템(2만원), CJ CVG(10만5000원), 뷰웍스(8만3000원) 등에 대해 목표가를 조정했다.한국투자증권은 비츠로셀에 대해 사상최대 분기 매출을 달성할 것이라며, 목표주가를 19만원으로 조정했으며, 유안타증권은 유가가 구조적인 상승세에 접어들었다고 보고 SK이노베이션의 목표가는 20만원에서 24만원으로 올렸다.김광현 유안타증권 연구원은 4.4분기는 계절적으로 어닝쇼크가 빈번하고, 기업들이 전망치를 달성하는 확율도 적은 편이라고 분석했다. 그러나 지난해의 경우 4.4분기 실적에 대한 눈높이를 낮추더라도 한해 전체 이익은 사상 최대치를 기록할 것이라고 설명했다. 이 때문에 실적 개선이 아직 주가에 반영되지 않은 업종을 중심으로 매수에 나설 것을 조언했다.김 연구원은 ""2016년 이익이 높아지는 업종으로는 건설, 정유, 전기, 화학, 지주회사, 의료기기, ?터넷, 화장품 등이 꼽힌다""며 ""이중 건설, 지주회사, 기계, 증권, 은행 업종은 이익의 성장(혹은 턴어라?드)에 비해 주가 움직임이 상대적으로 부진해 향후 상승이 기대된다""고 지목했다.ahnman@fnnews.com 안승현 기자     ▶ 세상의 모든 골 때리는 이야기 \'fn파스\'▶ 속보이는 연예뉴스 fn스타  ※ 저작권자 ⓒ  파이낸셜뉴스. 무단 전재-재배포 금지파이낸셜뉴스 관련뉴스해당 언론사에서 선정하며 언론사 페이지(아웃링크)로 이동해 볼 수 있습니다.남편 집에서 다른남자와 뜨거운 점심 보낸 아내월 학원비 500만원 감당 못한 청담동 주부, 결국..\'등 돌린 혈연\' 장시호와 최순실, 카메라 철수하자 웃음지으며..이재용 구속영장 기각한 조의연 판사, 법원 내 평가는..92세 노모를 돼지우리에 수년간 가둔 패륜 부부좋아요0훈훈해요0슬퍼요0화나요0후속기사 원해요0기사제공 :']"
2,NC soft, 2017-01-2015:53,파이낸셜뉴스 ,"증권가, 어닝시즌 목전..우수기업 목표주가 줄줄이 상향",https://finance.naver.com/news/news_read.nhn?article_id=0003765647&office_id=014&mode=search&query=엔씨&page=1,"['       증권가, 어닝시즌 목전..우수기업 목표주가 줄줄이 상향      기사입력2017-01-20 15:53기사원문좋아요훈훈해요좋아요 평가하기공감좋아요0훈훈해요0슬퍼요0화나요0후속기사 원해요0댓글        목표주가 상향종목               삼성증권 포스코대우  3만원-> 3만2000원      엔씨소프트  35만원-> 40만원    신한금융투자 현대차  18만원-> 20만원       현대로템 1만9000원-> 2만원     한국투자증권  비츠로셀 1만5000원-> 1만9000원     유안타증권  SK이노베이션 20만원-> 24만원     KTB투자증권 CJ E&M  10만원-> 12만원    키움증권  제일기획   1만9500원-> 2만1000원         상장기업들의 지난해 4·4분기 실적발표기간이 본격적으로 개막되면서 이익이 좋아진 기업들에 대한 기대치가 코스피를 달구고 있다.  지난해 4·4분 상장기업 실적은 대체로 상승할 것이라는게 증권가의 관측이다. 구조조정 끝에 턴어라운에 성공한 기업들이 많기 때문이다. 증권업계는 본격적인 실적 개선 종목들에 대해 목표주가를 잇달아 상향조정하고 있다.  20일 증권업계에 따르면 다음주 약 29개의 기업들이 실적을 발표한다. NH투자증권은 순이익 개선 예상종목으로 LG생활건강(0.24%), LG디스플레이(10.74%), SK하이닉스(10.64%), 현대모비스(0.59%), LG화학(17.73%) 등을 꼽았다. 시장 기대치 보다 낮아질 종목은 하나금융지주(-28.51%), 포스코(-14.29%), 네이버(-1.34%) 등을 지목했다.  김병연 NH투자증권 연구원은 ""트럼프 취임식 등으로 불확실성이 확대되겠지만 기업들의 작년 4·4분기 실적과 올 1·4분기 실적 기대치가 완만한 상승을 그릴 것으로 예상된다""며 ""박스권에서 업종별로 등락과 투자자들의 순환매매가 예상된다""고 진단했다.  증권사들은 실적발표시즌에 앞서 성장이 예상되는 종목들에 대해 목표주가 상향 보고서를 쏟아 내고 있다. 삼성증권은 포스코대우에 대해 신규광구의 가치가 점차 높아질 것이라고 분석하고 목표가를 기존 3만원에서 3만2000원으로 높였으며, 엔씨소프트는 신작 게임의 로열티 수입이 늘 것이라는 분석으로 35만원에서 40만원으로 조정했다.  신한금융투자는 현대차의 북미투자 확대 발표가 향후 성장동력이 될 것으로 보고 목표주가를 18만원에서 20만원으로 높였다. 또 현대로템(2만원), CJ CVG(10만5000원), 뷰웍스(8만3000원) 등에 대해 목표가를 조정했다.  한국투자증권은 비츠로셀에 대해 사상최대 분기 매출을 달성할 것이라며, 목표주가를 19만원으로 조정했으며, 유안타증권은 유가가 구조적인 상승세에 접어들었다고 보고 SK이노베이션의 목표가는 20만원에서 24만원으로 올렸다.  김광현 유안타증권 연구원은 4·4분기는 계절적으로 어닝쇼크가 빈번하고, 기업들이 전망치를 달성하는 확율도 적은 편이라고 분석했다. 그러나 지난해의 경우 4·4분기 실적에 대한 눈높이를 낮추더라도 한해 전체 이익은 사상 최대치를 기록할 것이라고 설명했다. 이 때문에 실적 개선이 아직 주가에 반영되지 않은 업종을 중심으로 매수에 나설 것을 조언했다.  김 연구원은 ""2016년 이익이 높아지는 업종으로는 건설, 정유, 전기, 화학, 지주회사, 의료기기, ?터넷, 화장품 등이 꼽힌다""며 ""이중 건설, 지주회사, 기계, 증권, 은행 업종은 이익의 성장(혹은 턴어라?드)에 비해 주가 움직임이 상대적으로 부진해 향후 상승이 기대된다""고 지목했다.  ahnman@fnnews.com 안승현 기자   ▶ 세상의 모든 골 때리는 이야기 \'fn파스\'▶ 속보이는 연예뉴스 fn스타  ※ 저작권자 ⓒ  파이낸셜뉴스. 무단 전재-재배포 금지파이낸셜뉴스 관련뉴스해당 언론사에서 선정하며 언론사 페이지(아웃링크)로 이동해 볼 수 있습니다.남편 집에서 다른남자와 뜨거운 점심 보낸 아내월 학원비 500만원 감당 못한 청담동 주부, 결국..\'등 돌린 혈연\' 장시호와 최순실, 카메라 철수하자 웃음지으며..이재용 구속영장 기각한 조의연 판사, 법원 내 평가는..92세 노모를 돼지우리에 수년간 가둔 패륜 부부좋아요0훈훈해요0슬퍼요0화나요0후속기사 원해요0기사제공 :']"
3,NC soft, 2017-01-2015:46,서울경제 ,"[마감시황]코스피, 개인·기관 매수세에 2,060선 사수",https://finance.naver.com/news/news_read.nhn?article_id=0002961108&office_id=011&mode=search&query=엔씨&page=1,"[""       [마감시황]코스피, 개인·기관 매수세에 2,060선 사수      기사입력2017-01-20 15:46기사원문좋아요훈훈해요좋아요 평가하기공감좋아요0훈훈해요0슬퍼요0화나요0후속기사 원해요0댓글 약세로 출발한 코스피가 결국 하락한 채 장을 끝냈다. 2,060선에서 장을 시작한 코스피는 등락을 거듭하다 결국 보합권으로 마감했다. 20일 코스피지수는 전 거래일 대비 7.18포인트(0.35%) 내린 2,065.61에 거래를 끝냈다. 이날 지수는 전 거래일 대비 7.25포인트(0.35%) 내린 2,065.54에 출발했다. 전일 미국의 S&P500, 다우지수는 트럼프 대통령 당선인의 취임식을 하루 앞두고 관망세가 지속됐다. S&P500 지수는 전일대비 8.20포인트(0.36%) 내린 2,263.69에, 나스닥지수는 15.57포인트(0.28%) 낮은 5,540.08에 거래를 마감했다. 이날 개인과 기관이 51억원, 407억원어치를 사들이며 지수 상승을 꾀했지만, 외국인이 484억원어치를 팔아치우며 이를 제한한 것으로 나타났다. 업종별로는 음식료품(2.11%), 운수창고(0.75%), 의약품(0.69%) 등의 주가가 올랐다. 의료정밀(-2.07%), 철강·금속(-1.56%), 건설업(-1.03%), 증권(-0.92%) 등은 하락한 채 장을 끝냈다. 시가총액 상위 종목 중에서는 롯데 지주사 전환에 따라 롯데쇼핑이 5.08%로 가장 큰 폭의 상승세를 보였고, 엔씨소프트(4.67%), 아모레퍼시픽(2.57%), LG디스플레이(034220)(2.56%) 등이 상승했다. 반면 LG화학(051910)(-3.51%), 기아차(-2.57%), 한국타이어(-2.65%), 고려아연(-2.33%) 등은 하락했다.이날 코스닥지수는 전 거래일보다 4.07포인트(0.65%) 내린 622.12에 마감했다.서울외환시장에서 원·달러 환율은 전 거래일 대비 8원80전 내린 1,169원20전에 거래를 마쳤다. /박시진기자 see1205@sedaily.com[서울경제 바로가기]나와 찰떡 궁합인 대선 후보는? [설문 바로가기]서울경제와 친해지는 가장 확실한 방법 [페이스북]저작권자 ⓒ 서울경제, 무단 전재 및 재배포 금지서울경제 관련뉴스해당 언론사에서 선정하며 언론사 페이지(아웃링크)로 이동해 볼 수 있습니다.온주완, 조보아 과거 최태준과의 사이 질투? 애정 댓글에도 결국 결별···SNS 계정 삭제비♥김태희 피로연, 드레스 입고 비와 함께 있는 김태희···'새신부 다운 미모''썰전' 반기문 귀국 행보 분석과 정청래·박형준 전 의원 출연에 시청률 소폭 상승'푸른 바다의 전설' 이지훈, 마지막까지 명품 열연 '악역 그 이상의 존재감'김기춘·조윤선 운명 쥔 그 '판사' 이제보니 과거에좋아요0훈훈해요0슬퍼요0화나요0후속기사 원해요0기사제공 :""]"
4,NC soft, 2017-01-2014:59,파이낸셜뉴스 ,"[fnRASSI]엔씨소프트(036570), 52주 신고가...3% ↑",https://finance.naver.com/news/news_read.nhn?article_id=0003765608&office_id=014&mode=search&query=엔씨&page=1,"[""       [fnRASSI]엔씨소프트(036570), 52주 신고가...3% ↑      기사입력2017-01-20 14:59기사원문좋아요훈훈해요좋아요 평가하기공감좋아요0훈훈해요0슬퍼요0화나요0후속기사 원해요0댓글엔씨소프트(036570)는 52주신고가를 기록하고 있어 주목할만하다. 동종목의 현재 주가는 309,000원 선에서 이루어지고 있다. 거래일을 기준으로 최근 3일간 평균 거래량은 36만 주이다. 이는 60일 일 평균 거래량 15만 주와 비교해보면 최근 거래량이 급격히 늘어났다는 것을 알 수 있다. 거래비중 기관 26.93%, 외국인 33.14%최근 한달간 주체별 거래비중을 살펴보면 개인이 39.92%로 가장 높은 참여율을 보였고, 외국인이 33.14%를 보였으며 기관은 26.93%를 나타냈다. 그리고 최근 5일간 거래비중은 외국인이 40.34%, 개인이 33.33%, 기관은 26.32%를 기록했다. 외국인/기관 순매수, 개인은 순매도(한달누적) 전일까지 기관이 2일 연속, 외국인이 13일 연속 각각 동종목을 순매수 했다. 4주간을 기준으로 보면 외국인이 195,578주를 순매수했고, 기관도 순매수량을 늘리며 75,337주를 순매수했다. 반면 개인들은 매도 우위를 지속하면서 270,915주를 순매도한 것으로 나타났다.    'fnRASSI'는 증권전문 기업 씽크풀과 파이낸셜뉴스의 협업으로 로봇기자가 실시간으로 생산하는 기사입니다.   fnRASSI@fnnews.com fnRASSI ▶ 세상의 모든 골 때리는 이야기 'fn파스'▶ 속보이는 연예뉴스 fn스타  ※ 저작권자 ⓒ  파이낸셜뉴스. 무단 전재-재배포 금지파이낸셜뉴스 관련뉴스해당 언론사에서 선정하며 언론사 페이지(아웃링크)로 이동해 볼 수 있습니다.남편 집에서 다른남자와 뜨거운 점심 보낸 아내월 학원비 500만원 감당 못한 청담동 주부, 결국..'등 돌린 혈연' 장시호와 최순실, 카메라 철수하자 웃음지으며..이재용 구속영장 기각한 조의연 판사, 법원 내 평가는..92세 노모를 돼지우리에 수년간 가둔 패륜 부부좋아요0훈훈해요0슬퍼요0화나요0후속기사 원해요0기사제공 :""]"
5,NC soft, 2017-01-2013:39,서울경제 ,"[1시 주식시장은]코스피, 외인·기관 매도세에 2,060선 등락 반복",https://finance.naver.com/news/news_read.nhn?article_id=0002960976&office_id=011&mode=search&query=엔씨&page=1,"['       [1시 주식시장은]코스피, 외인·기관 매도세에 2,060선 등락 반복      기사입력2017-01-20 13:39기사원문좋아요훈훈해요좋아요 평가하기공감좋아요0훈훈해요0슬퍼요0화나요0후속기사 원해요0댓글 약세로 출발한 코스피가 여전히 보합권에 머물러 있다. 2,060선까지 후퇴한 코스피는 등락을 거듭하고 있다. 트럼프 미국 대통령 취임을 하루 앞두며 관망세를 보이고 있다는 분석이다. 20일 오후 1시 32분 현재 코스피지수는 5.36포인트(0.26%) 내린 2,067.43에 거래 중이다. 이날 지수는 전 거래일 대비 7.25포인트(0.35%) 내린 2,065.54에 출발했다. 전일 미국의 S&P500, 다우지수는 트럼프 대통령 당선인의 취임식을 하루 앞두고 관망세가 지속됐다. S&P500 지수는 전일대비 8.20포인트(0.36%) 내린 2,263.69에, 나스닥지수는 15.57포인트(0.28%) 낮은 5,540.08에 거래를 마감했다. 현재 개인이 92억원 규모로 사들이고 있는 데 비해 외국인과 기관은 각각 74억원, 19억원어치를 팔고 있다. 업종별로는 음식료품(2.05%), 은행(0.71%), 운수창고(0.55%), 보험(0.84%) 등이 오르고 있다. 철강·금속(-1.51%), 건설업(-1.24%), 화학(-0.98%), 증권(-1.08%) 등은 하락세다. 시가총액 상위 종목 중에서는 롯데 지주사 전환에 따라 롯데쇼핑(023530)이 5.54%로 가장 큰 폭의 상승세를 보였고, 아모레퍼시픽(2.25%), LG유플러스(032640)(2.19%), 엔씨소프트(2%) 등이 상승 중이다. 반면 LG화학(051910)(-3.51%), 한국타이어(-2.82%), 고려아연(010130)(-2.33%) 등은 하락하고 있다. 현재 코스닥지수는 전 거래일보다 3.18포인트(-0.51%) 내린 623.01을 기록 중이다. 이날 지수는 전 거래일 대비 0.31포인트(0.05%) 오른 626.50에 출발했다.이 시각 현재 서울외환시장에서 원·달러 환율은 전 거래일 대비 7원90전 내린 1,170원10전에 거래되고 있다. /박시진기자 see1205@sedaily.com[서울경제 바로가기]나와 찰떡 궁합인 대선 후보는? [설문 바로가기]서울경제와 친해지는 가장 확실한 방법 [페이스북]저작권자 ⓒ 서울경제, 무단 전재 및 재배포 금지서울경제 관련뉴스해당 언론사에서 선정하며 언론사 페이지(아웃링크)로 이동해 볼 수 있습니다.온주완, 조보아 과거 최태준과의 사이 질투? 애정 댓글에도 결국 결별···SNS 계정 삭제\'썰전\' 반기문 귀국 행보 분석과 정청래·박형준 전 의원 출연에 시청률 소폭 상승\'푸른 바다의 전설\' 이지훈, 마지막까지 명품 열연 \'악역 그 이상의 존재감\'2NE1 \'안녕\', 21일 자정 공개···""추후 방송 활동·프로모션 안한다""김기춘·조윤선 운명 쥔 그 \'판사\' 이제보니 과거에좋아요0훈훈해요0슬퍼요0화나요0후속기사 원해요0기사제공 :']"
