,회사명,날짜,언론사,기사제목,링크,본문
0,NC soft, 2017-01-0210:21,전자신문 ,"[로봇뉴스]엔씨소프트, ""1H17까지 쏟아지…"" 매수(유지)-바로투자증권",https://finance.naver.com/news/news_read.nhn?article_id=0002568942&office_id=030&mode=search&query=엔씨&page=1,"['       [로봇뉴스]엔씨소프트, ""1H17까지 쏟아지…"" 매수(유지)-바로투자증권      기사입력2017-01-02 10:21기사원문좋아요훈훈해요좋아요 평가하기공감좋아요0훈훈해요0슬퍼요0화나요0후속기사 원해요0댓글바로투자증권에서 2일 엔씨소프트(036570)에 대해 ""1H17까지 쏟아지는 싞작모멘텀 Ⅱ""라며 투자의견을 \'매수(유지)\'로 제시하였고, 아울러 목표주가로는 340,000원을 내놓았다. 바로투자증권 이경일 애널리스트가 동종목에 대하여 이번에 제시한 \'매수(유지)\'의견은 바로투자증권의 직전 매매의견과 동일한 것이고 전년도말의 매매의견을 기준으로  볼때도 역시 \'매수\'의견이 계속 유지되고 있는 상태이다. 그리고 최근 분기내 발표된 전체 증권사 리포트의 컨센서스와 비교를 해볼 경우에 오늘 발표된 투자의견은 대체적으로 평균치에 해당하는 수준으로, 이번 의견은 동종목에 대한 전체적인 흐름에서 크게 벗어나지 않은 것으로 분석되고 있다. 목표주가의 추이를 살펴보면 최근 두차례 연속 상향조정되다가 이번에는 직전 목표가와 동일한 수준을 유지하는 모습이다. 또한 전일 종가 기준으로 볼때 동종목의 현주가는 이번에 제시된 목표가 대비 37.4%의 추가상승여력이 있다는 해석이 제시되고 있다. ◆ Report briefing바로투자증권에서 엔씨소프트(036570)에 대해 ""동사는 국내에서 유저 트래픽에 대한 데이터마이닝을 가장 잘하는 기업이며 그 능력을 리니지RK를 통해 모바일에서 보여줄 시점. 리니지RK는 1~2주 단위로 신규 소환수 및 아이템 추가 업데이트가 진행될 예정이고 4주 단위로 대규모 업데이트를 계획. 향후 공성전 등 주요 콘텐츠가 추가되면서 흥행세가 지속될 것""라고 분석했다.  또한 바로투자증권에서 ""내년 상반기까지 리니지M을 포함한 모바일 신작들과 PC온라인 신작 MXM의 출시 집중되어 있어 또 한번의 계단식 외형성장이 시현할 전망""라고 밝혔다.  한편 ""알파게임즈의 天堂：红骑士는 1차 CBT에서 92.6% 수준의 Retention 기록했고 B&S모바일은 충분한 로컬라이징을 통해 국내 및 대만에 출시될 전망. 중국 웹게임 시장의 Top-tier 37게임즈가 개발중인 리니지2 IP 기반 웹게임도 흥행이 기대된다""라고 전망했다. ◆ Report statistics바로투자증권의 동종목에 대한 최근 6개월 동안의 투자의견은 전체적으로 큰 변화없이 유지되고 있다. 목표주가는 2015년12월 250,000원이 저점으로 제시된 이후 이번에 발표된 340,000원까지 꾸준하게 상향조정되어 왔다. 한편 증권정보제공 업체인 씽크풀에 따르면 동사에 대한 컨센서스는 \'매수\'이고 목표주가의 추이를 살펴보면 직전에 한차례 상향조정된 후에 이번에 다시 목표가가 하향조정되는 모습인데, 이번 목표가의 하락폭은 다소 줄어든 추세이다. <컨센서스 하이라이트>\xa0컨센서스최고최저투자의견매수매수(유지)매수(유지)목표주가356,800420,000300,000*최근 분기기준오늘 바로투자증권에서 발표된 \'매수(유지)\'의견 및 목표주가 340,000원은 전체 컨센서스 대비해서 대체적으로 평균치에 해당하는 수준으로, 이번 의견은 동종목에 대한 전체적인 흐름에서 크게 벗어나지 않은 것으로 파악되며 목표가평균 대비 4.7%정도 미달하고 있는 것으로 집계되었다.  참고로 최근에 목표주가를 가장 공격적으로 제시한 미래에셋대우에서 투자의견 \'매수(유지)\'에 목표주가 420,000원을 제일 보수적인 의견을 제시한 부국증권에서 투자의견 \'매수(유지)\'에 목표주가 300,000원을 제시한 바 있다. <바로투자증권 투자의견 추이>\xa0의견제시일자투자의견목표가격20170102매수(유지)340,00020161017매수(유지)340,00020160919매수(유지)320,00020160509매수275,00020151228매수(신규)250,000<최근 리포트 동향>의견제시일자증권사투자의견목표가20170102바로투자증권매수(유지)340,00020161222NH투자증권매수(유지)400,00020161221LIG투자증권매수(유지)310,00020161220한화투자증권매수(유지)360,000(씽크풀에서 제공하는 컨센서스는 국내 전증권사에서 발표되는 기업분석 리포트 및 코멘트를 실시간으로 통계/분석처리되고 있습니다.)증시분석 전문기자 로봇 ET etbot@etnews.com전자신문과 씽크풀의 증시분석 전문기자 로봇 ET가 쓴 기사입니다▶ 전자신문 인기 포스트▶ 전자신문 공식 페이스북▶ 전자신문 바로가기 [Copyright ⓒ 전자신문 & 전자신문인터넷, 무단전재 및 재배포 금지]전자신문 관련뉴스해당 언론사에서 선정하며 언론사 페이지(아웃링크)로 이동해 볼 수 있습니다.[신년기획]성장동력 컨트롤타워 세워 대한민국 새 아침 맞자이통사, 새해 망 구축에 1조3000억원 투자···설비투자 7조원 육박 전망中에 초대형 LCD 투자 광풍 분다덴마크 경찰, 정유라 긴급 체포…곧 송환친박 이정현 전 대표, 새누리 탈당…""모든 책임 안고 가겠다""좋아요0훈훈해요0슬퍼요0화나요0후속기사 원해요0기사제공 :']"
1,NC soft, 2017-01-0209:54,전자신문 ,"[로봇뉴스]컴투스, ""주당배당금 1,40…"" 매수(유지)-이베스트투자증권",https://finance.naver.com/news/news_read.nhn?article_id=0002568921&office_id=030&mode=search&query=엔씨&page=1,"['       [로봇뉴스]컴투스, ""주당배당금 1,40…"" 매수(유지)-이베스트투자증권      기사입력2017-01-02 09:54기사원문좋아요훈훈해요좋아요 평가하기공감좋아요0훈훈해요0슬퍼요0화나요0후속기사 원해요0댓글이베스트투자증권에서 2일 컴투스(078340)에 대해 ""주당배당금 1,400원은 당사 전망치를 대폭 초과하는 수준""라며 투자의견을 \'매수(유지)\'로 제시하였고, 아울러 목표주가로는 120,000원을 내놓았다. 이베스트투자증권 성종화 애널리스트가 동종목에 대하여 이번에 제시한 \'매수(유지)\'의견은 이베스트투자증권의 직전 매매의견에서 큰 변화없이 그대로 유지되는 것이고  전년도말의 매매의견을 기준으로  볼때도 역시 \'매수\'의견이 계속 유지되고 있는 상태이다. 그리고 최근 분기내 발표된 전체 증권사 리포트의 컨센서스와 비교를 해볼 경우에 오늘 발표된 투자의견은 대체적으로 평균치에 해당하는 수준으로, 이번 의견은 동종목에 대한 전체적인 흐름에서 크게 벗어나지 않은 것으로 분석되고 있다. 목표주가의 추이를 살펴보면 과거 목표가가 하향조정된 후에 지금까지 두차례 같은 수준을 지속하면서 뚜렷한 변화요인을 모색하지 못하는 모습이다. 또한 전일 종가 기준으로 볼때 동종목의 현주가는 이번에 제시된 목표가 대비 37.6%의 추가상승여력이 있다는 해석이 제시되고 있다. ◆ Report briefing이베스트투자증권에서 컴투스(078340)에 대해 ""3Q16 실적발표 컨콜에서 현금배당 계획을 강하게 시사하여 사상 첫 현금배당 가능성은 예측되었던 부분. 실제 결과는 주당배당금 1,400원(자기주식 제외 기준), 배당성향 12.1%, 배당수익률 1.6%로서 당사 추정치를 6배 이상 대폭 초과하는 파격적 수준""라고 분석했다.  또한 이베스트투자증권에서 ""2016년 결산연도에 대해 사상 첫 현금배당 실시. 주요 배당지표는 당사 전망치는 크게 초과하고 게임업종 대장주인 엔씨소프트 배당지표와 유사한 수준. 첫 배당 치고는 큰 규모. 의미있는 수준의 배당수익률""라고 밝혔다. ◆ Report statistics이베스트투자증권의 동종목에 대한 최근 1년동안의 투자의견은 전체적으로 큰 변화없이 유지되고 있다. 목표주가는 2016년5월 210,000원까지 높아졌다가 2016년11월 120,000원을 최저점으로 목표가가 제시된 이후 최근에도 120,000원으로 제시되고 있다. 한편 증권정보제공 업체인 씽크풀에 따르면 동사에 대한 컨센서스는 \'매수\'이고 목표주가의 추이를 살펴보면 과거 상향/하향조정을 각각 한차례씩 격은 후에 이번에는 직전과 같은 수준을 유지하고 있는 추세이다. <컨센서스 하이라이트>\xa0컨센서스최고최저투자의견매수매수(유지)HOLD목표주가128,421190,000100,000*최근 분기기준오늘 이베스트투자증권에서 발표된 \'매수(유지)\'의견 및 목표주가 120,000원은 전체 컨센서스 대비해서 대체적으로 평균치에 해당하는 수준으로, 이번 의견은 동종목에 대한 전체적인 흐름에서 크게 벗어나지 않은 것으로 파악되며 목표가평균 대비 6.6%정도 미달하고 있는 것으로 집계되었다.  참고로 최근에 목표주가를 가장 공격적으로 제시한 키움증권에서 투자의견 \'매수(유지)\'에 목표주가 190,000원을 제일 보수적인 의견을 제시한 삼성증권에서 투자의견 \'HOLD\'에 목표주가 100,000원을 제시한 바 있다. <이베스트투자증권 투자의견 추이>\xa0의견제시일자투자의견목표가격20170102매수(유지)120,00020161219매수(유지)120,00020161109매수(유지)120,00020161017매수(유지)125,00020161005매수(유지)150,000<최근 리포트 동향>의견제시일자증권사투자의견목표가20170102이베스트투자증권매수(유지)120,00020161229KTB투자증권매수(유지)120,00020161212유진투자증권HOLD(유지)110,00020161124한화투자증권매수(신규)120,000(씽크풀에서 제공하는 컨센서스는 국내 전증권사에서 발표되는 기업분석 리포트 및 코멘트를 실시간으로 통계/분석처리되고 있습니다.)증시분석 전문기자 로봇 ET etbot@etnews.com전자신문과 씽크풀의 증시분석 전문기자 로봇 ET가 쓴 기사입니다▶ 전자신문 인기 포스트▶ 전자신문 공식 페이스북▶ 전자신문 바로가기 [Copyright ⓒ 전자신문 & 전자신문인터넷, 무단전재 및 재배포 금지]전자신문 관련뉴스해당 언론사에서 선정하며 언론사 페이지(아웃링크)로 이동해 볼 수 있습니다.[신년기획]성장동력 컨트롤타워 세워 대한민국 새 아침 맞자이통사, 새해 망 구축에 1조3000억원 투자···설비투자 7조원 육박 전망中에 초대형 LCD 투자 광풍 분다[카드뉴스]톡톡 튀는 아이디어가 돋보이네…새해 선물 \'이색 ICT상품 7選\'""4500년전에도 아사가···16세 소녀 유골 발견""좋아요0훈훈해요0슬퍼요0화나요0후속기사 원해요0기사제공 :']"
2,NC soft, 2017-01-0208:51,머니투데이 ,"컴투스, 파격 배당...주주가치 제고 의지 확인-이베스트",https://finance.naver.com/news/news_read.nhn?article_id=0003799306&office_id=008&mode=search&query=엔씨&page=1,"['       컴투스, 파격 배당...주주가치 제고 의지 확인-이베스트      기사입력2017-01-02 08:51기사원문좋아요훈훈해요좋아요 평가하기공감좋아요0훈훈해요0슬퍼요0화나요0후속기사 원해요0댓글 [머니투데이 오정은 기자] 이베스트투자증권은 2일 컴투스에 대해 파격적인 사상 첫 현금 배당 실시가 돋보인다고 판단했다. 투자의견 매수, 목표주가 12만원을 유지했다. 성종화 이베스트투자증권 연구원은 ""컴투스는 주당 1400원의 현금 배당을 결의했고 이는 지난해 순이익 전망치를 감안할 때 예상 배당성향은 12.1%다""며 ""배당 수익률은 2016년 종가 대비 1.6%""라고 밝혔다. 이어 ""주당 배당금 1400원은 당시 예상치를 대폭 초과하는 수준""이라며 ""게임 업종 대장주 엔씨소프트와 유사한 수준의 배당 지표로 매년 점진적 배당을 상향할 것으로 보여 주주가치 제고 의지를 확인했다""고 평가했다. [이코노미스트들의 깊이있는 투자정보 \'TOM칼럼\'][부자들에게 배우는 성공 노하우 \'줄리아 투자노트\'  ][내 삶을 바꾸는 정치뉴스 \'the 300\']오정은 기자 agentlittle@mt.co.kr머니투데이 관련뉴스해당 언론사에서 선정하며 언론사 페이지(아웃링크)로 이동해 볼 수 있습니다.탈북 청년들 ""박근혜 대통령 탄핵 반대""…2만 참여\'충격패\' 론다 로우지, 48초 만에 누네즈에 1R TKO패 \'수모\'김인식 감독 ""오승환, 본인이 WBC 뛰길 간절히 원해""조윤선, \'대통령 검진 동행의혹\' 증언 컨설팅업체 대표 고소\'엄마 욕한 친구\' 살해시도 20대, 항소심도 \'징역 5년\'좋아요0훈훈해요0슬퍼요0화나요0후속기사 원해요0기사제공 :']"
3,NC soft, 2017-01-0208:31,이데일리 ,"컴투스, 사상 첫 현금배당…주주가치 제고 의지 확인-이베스트",https://finance.naver.com/news/news_read.nhn?article_id=0003715796&office_id=018&mode=search&query=엔씨&page=1,"[""       컴투스, 사상 첫 현금배당…주주가치 제고 의지 확인-이베스트      기사입력2017-01-02 08:31기사원문좋아요훈훈해요좋아요 평가하기공감좋아요0훈훈해요0슬퍼요0화나요0후속기사 원해요0댓글 [이데일리 송이라 기자] 컴투스(078340)가 사상 첫 현금배당을 실시했다. 이베스트투자증권은 전망치를 대폭 초과하는 배당규모를 보였다며 향후 주주가치 제고 의지를 확인했다고 평가했다. 투자의견 ‘매수’와 목표주가 12만원을 유지했다. 성종화 이베스트투자증권 연구원은 2일 “2016년 결산연도에 주당 1400원의 현금배당을 실시했다”며 “순익 전망치 1442억원 감안시 예상 배당성향은 12.1%이며 배당수익률은 지난달 29일 종가 8만7200원 대비 1.6% 수준”이라고 말했다. 3분기 실적발표에서 현금배당 계획을 강하게 시사해 사상 첫 현금배당 가능성은 예측됐던 부분이지만 배당금액은 전망치를 대폭 초과했다고 봤다. 그는 “당사 추정치는 주당 배당금 224원, 배당성향 2%, 배당수익률 0.3%였는데 이를 크게 웃돌았다”며 “파격적 수준”이라고 말했다. 게임업종 대장주 엔씨소프트(036570)와 유사한 수준의 배당지표다. 그는 “첫 배당 치고는 의미 있는 수준의 배당수익률”이라며 “향후 매년 배당 실시, 배당금액 점진적 상향 계획 등 주주가치 제고 의지를 확인할 수 있다”고 강조했다.송이라 (rassong@edaily.co.kr)＜ⓒ종합 경제정보 미디어 이데일리 - 무단전재 & 재배포 금지＞이데일리 관련뉴스해당 언론사에서 선정하며 언론사 페이지(아웃링크)로 이동해 볼 수 있습니다.한 남자와 동시에 결혼하는 쌍둥이 자매…현실판 '일부다처제'로또 735회 1등 18억 당첨자 10명 중 7명 자동..배출점은?영화 속 '엘프'가 되고 싶었던 소녀… 결국 130만원에 귀 성형군장병 모두 올 여름부터 에어컨 바람 쐰다예고없이 이뤄진 朴의 신년티타임..담담히 50여분간 의혹 적극반박좋아요0훈훈해요0슬퍼요0화나요0후속기사 원해요0기사제공 :""]"
4,NC soft, 2017-01-0208:04,서울경제 ,"[이번주 추천주] 연말장세 끝난 코스피, 상승 예상···포스코·엔씨소프트 유망",https://finance.naver.com/news/news_read.nhn?article_id=0002948514&office_id=011&mode=search&query=엔씨&page=1,"['       [이번주 추천주] 연말장세 끝난 코스피, 상승 예상···포스코·엔씨소프트 유망      기사입력2017-01-02 08:04기사원문좋아요훈훈해요좋아요 평가하기공감좋아요0훈훈해요0슬퍼요0화나요0후속기사 원해요0댓글  증권사 추천주 추천이유   KB증권 포스코 철강부문,\xa0E&C부문의\xa0실적\xa0개선\xa0기대   엔씨소프트(036570) 리니지\xa0레드나이츠\xa0성공\xa0등\xa0양호한\xa0실적\xa0성장   대신증권 롯데케미칼 에틸렌\xa0체인\xa0강세\xa0등\xa0올해\xa0수요\xa0증가가\xa0이어질\xa0전망   한솔케미칼 퀀텀닷\xa0재료\xa0독점\xa0공급\xa0수혜   SK증권 동부하이텍(000990) 8인치\xa0파운드리\xa0시장\xa0호조\xa0지속\xa0등\xa0재무구조\xa0개선   비츠로셀 수요\xa0증가로\xa0외형성장에\xa0기여할\xa0것으로\xa0예상   신한금융투자 SKC(011790) 필름부문\xa0구조조정\xa0종료로\xa0실적\xa0정상화   SK하이닉스(000660) 모바일용\xa0DRAM\xa0탑재량\xa0증가\xa0등\xa0가격\xa0상승세\xa0지속   유안타증권 포스코 중국\xa0철강산업\xa0공급\xa0개혁에\xa0따른\xa0수혜   KB금융 자사주\xa0매입과\xa0배당확대\xa0등\xa0주주가치\xa0제고\xa0정책\xa0이어질\xa0전망  이번 주 국내 증시는 수출 개선에 따라 상승할 것으로 예상된다. 연말 장세가 마무리됨에 따라 코스피 거래량도 늘어날 것으로 보인다. 지난 주 코스피는 전 주말보다 0.46% 하락한 2,026.46으로 마감했다. 일부 대형주를 중심으로 외국인들이 매수세를 보였지만, 국내기관의 매도로 하락했다. 또 연말장세에 따라 거래량도 대폭 감소했다. 하지만 이번 주 코스피지수는 외국인 매수세가 지속됨에 따라 상승할 것으로 내다봤다. 또한 오는 3일 미국 12월 마르키트 제조업 구매관리지수(PMI)를 시작으로 12월 자동차판매, 비농업부문 고용지표 등 경제지표 발표에 따라 국내 증시도 영향을 받을 것으로 예측됐다. KB증권은 추천종목으로 포스코와 엔씨소프트를 제시했다. 포스코는 지난해 하반기부터 시작된 주요 원재료 가격 상승에 따라 원가부담이 이어졌지만, 올해 제품가격 인상을 통해 상쇄될 것으로 예상됐다. 또 철강부문, E&C부문 등 실적 개선이 두드러질 것으로 전망됐다. 리니지2로 성공세를 보인 엔씨소프트는 리니지M 출시가 예정돼 있어 주가 흐름에 긍정적인 영향을 미칠 것이라는 설명이다. KB증권 측은 “리니지2, 리니지 레드나이츠가 각각 앱스토어 매출순위 1,2위를 유지하며 실적에 크게 기여할 것”이라며 “리니지 레드나이츠의 성공으로 리니지M에 대한 기대감을 주기에 충분하다”고 말했다. 대신증권은 롯데케미칼과 한솔케미칼에 주목하고 있다. 롯데케미칼은 미국 업체들의 에틸렌 설비 증설이 지연되면서 에틸렌 및 관련 제품 시장에서 강세를 이어가고 있다. 한솔케미칼 역시 이달 중 공개될 삼성전자의 QLED TV에 퀀텀닷 재료를 독점으로 공급하고 있어 수혜가 예상된다고 설명했다. SK증권은 동부하이텍과 비츠로셀을 추천주로 꼽았다. 동부하이텍은 8인치 파운드리 시장의 호조가 지속되며, 실적 역시 개선될 것으로 내다봤다. 비츠로셀은 수요 증가로 인해 외형성장이 이뤄질 뿐 아니라 전지 제품 라인업 판매가 양호해 주가가 상승할 것으로 예상했다.신한금융투자는 SK하이닉스와 SKC를 제안했다.SK하이닉스는 4·4분기 5개 분기 만에 영업이익 1조원 복귀에 성공할 것으로 기대된다. SKC 역시 4분기 영업이익이 전 분기보다 148% 급증할 것으로 관측되는 등 실적 기대감이 높다.유안타증권은 포스코와 KB금융을 제안했다. 포스코는 중국 철강산업 공급개혁이 강화됨에 따라 실적이 좋아질 것이라고 설명했다. 또 KB금융의 경우 자사주 매입과 배당확대 등 주주가치 제고 정책이 이어질 것으로 예상, 이번 주 추천주로 꼽았다. /박시진기자 see1205@sedaily.com[서울경제 바로가기] [인기포토로 보는 오늘]서울경제와 친해지는 가장 확실한 방법 [페이스북]저작권자 ⓒ 서울경제, 무단 전재 및 재배포 금지서울경제 관련뉴스해당 언론사에서 선정하며 언론사 페이지(아웃링크)로 이동해 볼 수 있습니다.이휘재, 사과에도 논란 커지자 SNS 비공개 전환···""욕심이 과했다""[SBS 연기대상] 이변 없는 \'한석규의 대상\'...수상남발-PPL-이휘재는 아쉬워(종합)송중기-송혜교 2016 KBS 연기대상 대상 수상···""혜교 누나에게 이 모든 영광 돌리겠다"" 눈물 보인 \'유 대위\'이휘재,성동일에 ""배우 맞죠"" 무례 진행 사과···""입이 몇개라도 드릴 말씀 없다. 욕심이 과했다""박지만 수행비서 사망 소식에 주진우 ""저는 절대 자살하지 않습니다""좋아요0훈훈해요0슬퍼요0화나요0후속기사 원해요0기사제공 :']"
5,NC soft, 2017-01-0206:09,헤럴드경제 ,"[주간추천주] 새해 첫 코스피, 철강ㆍ금속과 화학株 기대",https://finance.naver.com/news/news_read.nhn?article_id=0001177742&office_id=016&mode=search&query=엔씨&page=1,"['       [주간추천주] 새해 첫 코스피, 철강ㆍ금속과 화학株 기대      기사입력2017-01-02 06:09기사원문좋아요훈훈해요좋아요 평가하기공감좋아요0훈훈해요0슬퍼요0화나요0후속기사 원해요0댓글 [헤럴드경제=김지헌 기자] 지난주 배당락 영향에 코스피(KOSPI)가 2020선에서 마무리된 가운데, 새해 첫 개장을 앞둔 증시에 각 증권사들은 철강ㆍ금속과 화학 업종을 중심으로 대응할 것을 주문했다.유가증권시장에서 증권사들은 POSCO 등 철강ㆍ금속 업종과 SKC, 롯데케미칼, 한솔케미칼 등 화학 업종을 추천했다.POSCO는 내년에 중국 철강산업 공급개혁(과잉능력축소)이 전년보다 강화될 것으로 판단된다. 지난해 하반기부터 시작된 주요 원재료 가격 상승에 따른 원가부담은 2017년 제품가격 인상을 통해 상쇄될 것으로 판단된다. 내년 철강부문(별도, 해외자회사)와 E&C부문(포스코건설 등)의 실적개선이 두드러질 전망이다.SKC는 4분기 영업이익이 455억원으로 전분기 대비 148% 증가할 전망이다. 필름 부문 구조조정 종료로 실적 정상화가 기대된다. 중국 업체 환경규제로 인한 가동률 하락으로 PO(프로필렌 옥사이드) 가격이 급등해 국내 PO 업황에 긍정적이다.롯데케미칼은 유가하락에 따른 에틸렌 사이클 지속이 예상된다. 지난해 12월 BD가격이 톤당 2000달러에 육박해 벤젠가격이 급등하고 지난해 2분기부터 반영되는 롯데첨단소재 실적 호조도 긍정적이다. 내년부터는 컨덴세이트 스플리터가 반영된다.한솔케미칼은 최근 인수한 자회사 Tapex의 이익이 반영되기 시작해 수익성이 강화되고 있다. 삼성전자의 QLED TV가 이달 공개될 예정이다. 또 퀀텀닷 재료 독점 공급으로 가장 큰 수혜를 입을 것으로 예상된다.코스닥시장에서는 평화정공 등 운송장비ㆍ부품 업종, 비츠로셀 등 IT업종, 디엔에프 등 화학 업종이 추천됐다.평화정공은 매출처 확대가 지속되면서 중국과 인도법인이 성장하고 있다. 신제품 매출 확대 지속과 현대차 국내공장 가동률 회복도 긍정적이다. 신제품 관련 자회사 성장에 따른 지분법이익 증가 역시 기대된다.비츠로셀은 수요 증가를 통한 설비 증설로 외형성장이 기대된다. 전지 제품 라인업 판매가 고루 양호해 전망치에 부합한다.디엔에프는 전방산업의 DRAM 및 NAND 업황 호조로 내년에 특히 NAND향 매출이 늘어날 것으로 기대된다. 프리커서 연매출이 500억원 이상인 소재기업은 디엔에프와 유피케피칼(비상장사)뿐이기 때문에 관심은 지속될 것으로 예상된다.raw@heraldcorp.com증권사 추천종목(1.2~1.6)▶신한금융투자○SKC○SK하이닉스○AP시스템▶대신증권○롯데케미칼○한솔케미칼○디엔에프▶SK증권○동부하이텍○비츠로셀○평화정공▶KB증권○POSCO○엔씨소프트○에스에프에이▶유안타증권○POSCO○KB금융○SK머티리얼즈▶부국증권○롯데케미칼○농심○테스▶초등영어 대세, 헤럴드 큐빅(Qbig)▶오늘의 띠별 운세 ▶나만의 변호사 찾기 - Copyrights ⓒ 헤럴드경제 & heraldbiz.com, 무단 전재 및 재배포 금지 -헤럴드경제 관련뉴스해당 언론사에서 선정하며 언론사 페이지(아웃링크)로 이동해 볼 수 있습니다.박지만 회장 수행비서 의문의 변사체 발견주진우, 박지만 수행비서 사망 소식에 ""나는 자살하지 않는다""\'박사모\' 계엄령 촉구에 분노한 이상호 기자 ""보수단체는 친박단체""이휘재 비매너 논란, 성동일 패딩에 ""의상이 그게…""반기문, 日 왕세자 부부에게 90도 인사좋아요0훈훈해요0슬퍼요0화나요0후속기사 원해요0기사제공 :']"
