,회사명,날짜,언론사,기사제목,링크,본문
0,NC soft, 2017-10-1617:57,한국경제TV ,[국고처 최승욱] 종목상담 - 엔씨소프트(036570),https://finance.naver.com/news/news_read.nhn?article_id=0000577588&office_id=215&mode=search&query=엔씨&page=1,"['       [국고처 최승욱] 종목상담 - 엔씨소프트(036570)      기사입력2017-10-16 17:57기사원문좋아요훈훈해요좋아요 평가하기공감좋아요0훈훈해요0슬퍼요0화나요0후속기사 원해요0댓글[한국경제TV 김현경 PD][국고처 최승욱] 종목상담 - 엔씨소프트(036570)10월 14일 방송된 `국민주식고충처리반`에 출연한 최승욱파트너가 엔씨소프트(036570)에 대한 시세와 전망을 이야기하고 있다.▶대한민국 대표 증권방송 `국민주식고충처리반` 매주 토 오전 9시스마트폰 앱 `주식창`에 시청자 의견 남겨주세요.김현경 PD hkkim@wowtv.co.krⓒ 한국경제TV, 무단 전재 및 재배포 금지한국경제TV 관련뉴스해당 언론사에서 선정하며 언론사 페이지(아웃링크)로 이동해 볼 수 있습니다.문재인 굴짬뽕 \'이런 대통령 처음\'...한국당 반응은?오지은, \'속옷\' 때문에 첫사랑과 이뤄질 수 없었던 사연2세대 걸그룹 마지막 자존심 \'소녀시대\'도 무너졌다어금니 아빠 딸도 범행 가담, CCTV에 찍힌 \'충격\'적인 진실김원준, 아빠야? 오빠야? ""이런 동안 처음이야""좋아요0훈훈해요0슬퍼요0화나요0후속기사 원해요0기사제공 :']"
1,NC soft, 2017-10-1616:30,머니투데이 ,"코스피, 사상 최대 영업익 또 깬다..3Q 50조 육박 기대",https://finance.naver.com/news/news_read.nhn?article_id=0003948252&office_id=008&mode=search&query=엔씨&page=1,"['       코스피, 사상 최대 영업익 또 깬다..3Q 50조 육박 기대      기사입력2017-10-16 16:30기사원문좋아요훈훈해요좋아요 평가하기공감좋아요0훈훈해요0슬퍼요0화나요0후속기사 원해요0댓글 [머니투데이 오정은 기자] [전문가 ""3Q 사상 최대 이익에 4Q·2018년도 호실적 예상...반도체 다음은 소재]삼성전자의 잠정 실적 발표로 실적 시즌이 막 오른 가운데 3분기 코스피 영업이익이 50조원에 육박하며 사상 최대를 기록할 전망이다. 전문가들은 역대급 실적을 기록한 반도체의 뒤를 이을 업종으로 철강·화학·정유 등 소재를 지목했다. 16일 금융정보업체 에프앤가이드, 와이즈에프엔, NH투자증권 리서치본부에 따르면 2013년부터 올해까지 분기별 영업이익 확정치와 전망치 데이터가 존재하는 코스피 246개 기업의 3분기 영업이익은 전년 동기 대비 44.1% 증가한 49조7000억원으로 추정되고 있다. 1·2분기(45조7000억원)에 세운 기록을 깨뜨리며 또 한 번의 사상 최대 기록을 세울 것이 확실시 된다.전망치가 존재하는 코스피 225개 기업의 3분기 당기순이익 추정치도 34조7000억원으로 2분기(34조원) 기록을 넘어서며 역대 최대 성적이 기대된다. 이는 전년비 45.2% 증가한 수치로 영업이익과 더불어 사상 최대치 경신을 예고하고 있다. 3분기 사상 최대 이익 전망에 코스피도 10월 황금연휴가 끝나자마자 사상 최고치 경신을 이어갔다. 이는 상반기 급등한 코스피가 하반기 조정에 돌입할 거란 시장의 우려를 넘어선 것이다. 이날 코스피 지수는 장중 2487.71포인트의 사상 최고치를 기록한 뒤 전일대비 6.43포인트(0.26%) 오른 2480.05에 마감, 장중·장 마감 기준 역대 최고치를 동시 경신했다. 홍춘욱 키움증권 투자전략팀장은 ""3분기도 사상 최대 이익이 예상되면서 코스피의 견고한 이익 체력을 확인시켜주고 있다""며 ""양호한 수출 지표 덕분에 4분기도 호실적이 예상되고 2018년 전망도 밝아지고 있어 코스피 사상 최고가 행진은 계속되겠다""고 관측했다. 3분기 역대급 실적을 이끄는 일등 공신은 반도체다. 지난 13일 3분기 잠정 실적을 공개한 삼성전자의 영업이익은 14조5000억원을 기록하며 전망치(14조3000억원)를 웃돌았다. SK하이닉스도 4조원에 육박하는 영업이익이 예상돼, 1·2분기에 이어 3분기에도 반도체가 사상 최대 실적의 견인차가 될 전망이다. 그밖에 소프트웨어(엔씨소프트, NAVER) 항공(대한한공 제주항공) 담배(KT&G) 미디어(로엔 제이콘텐트리 쇼박스) 등도 사상 최대 분기 실적을 예고 중이다. 김재은 NH투자증권 연구원은 ""3분기와 4분기 실적 전망치가 모두 상향 조정 중인 업종은 반도체 게임 에너지 기계 헬스케어 화학 증권 비철금속 은행 철강""이라며 ""이들 업종의 실적 모멘텀이 3분기 사상 최대 실적을 견인하겠다""고 분석했다. 전문가들은 삼성전자 확정 실적 발표 후 차익실현 때문에 펀드매니저들의 주도주 손바뀜이 나타날 수 있다고 봤다. 실제로 이날 주식시장에서는 POSCO가 6.15% 급등하고 은행주가 약세를 보이는 등 매매회전이 가파르게 나타났다. 반도체의 뒤를 잇는 이익 모멘텀 업종에 수급이 쏠린 것이다. 홍춘욱 팀장은 ""견고한 수출이 코스피 이익을 견인하고 있어 수출에 따른 이익 민감도가 높은 소재, 에너지 업종이 유망할 것""이라며 ""이익모멘텀이 강한 대형주로는 LG화학 POSCO 삼성물산 롯데케미칼 S-Oil 등이 있다""고 언급했다. 한편 4분기 코스피 영업이익은 계절적 특성으로 3분기 대비 감익이 예상되나 지난해 4분기와 비교하면 이익이 급증할 전망이다. 4분기 코스피 영업이익 전망치는 48조1000억원으로 전년비 60.6% 늘고 순이익은 33조3000억원으로 전년비 119% 증가하는 것으로 집계됐다. ▶옆사람이 지금 보는 기사들▶무료만화 즐기고~선물타자! ▶치어리더 vs 레이싱걸 오정은 기자 agentlittle@mt.co.kr머니투데이 관련뉴스해당 언론사에서 선정하며 언론사 페이지(아웃링크)로 이동해 볼 수 있습니다.성추행 남배우, 집행유예 2년…네티즌 ""TV서 안봤으면""\'17살 맘\' 이영학 아내, 17년간 어떻게 살았을까공효진 ""통으로 짜장면 다 주시면""에 文대통령 ""나는 굴짬뽕""사라진 삼성전자…\'세계 최고 직장 톱10\'에 LG 유일\'올해의 한옥\'대상에 서울 서대문구 \'천연동 한옥\'좋아요0훈훈해요0슬퍼요0화나요0후속기사 원해요0기사제공 :']"
2,NC soft, 2017-10-1613:12,매일경제 ,월곶판교선·GTX 호재 업은 서판교 `산운13단지휴먼시아데시앙`,https://finance.naver.com/news/news_read.nhn?article_id=0004030086&office_id=009&mode=search&query=엔씨&page=1,"[""       월곶판교선·GTX 호재 업은 서판교  `산운13단지휴먼시아데시앙`      기사입력2017-10-16 13:12기사원문좋아요훈훈해요좋아요 평가하기공감좋아요0훈훈해요0슬퍼요0화나요0후속기사 원해요0댓글 뛰어난 서울 강남 접근성을 자랑하는 판교에 교통 호재가 이어지고 있다. 경기 시흥시 월곶과 연결되는 월판선 서판교역이 오는 2019년 착공될 예정이다. 국토부는 기본계획안을 수립해 노선이 경유하는 시흥, 광명, 안양, 의왕, 성남지역 의견을 수렴한 후 2024년 완공을 목표로 사업을 추진할 계획이다. 삼성~수서~판교~용인~동탄을 연결하는 GTX 판교역(2021년 개통) 개발도 예정돼 향후 이 곳은 강남 접근뿐 아니라 수도권 동서부를 연결하는 교통의 핵심 축으로 거듭날 예정이다. [사진제공 : 판교태영공인중개사] 특히 서판교 일대는 교통이 뛰어나면서도 녹지가 풍부해 조용하고 자연친화적인 주거환경을 누리고 싶은 수요자들에게 인기가 많다. '산운13단지휴먼시아데시앙'도 배산임수의 입지로 문의가 꾸준한 아파트다. 경기도 성남시 분당구 운중동에 위치한 이 단지는 2010년 6월 입주한 최고 35층, 12개동, 총 587가구 규모다. 두밀공원이 단지를 감싸고 있고 태봉산, 응달산이 배후에 자리해 에코 프리미엄을 누릴 수 있다. 단지 앞으로는 운중천이 흘러 도심 속 전원 생활을 누릴 수 있다.삼성물산 건설부문, 삼성중공업, 한화테크윈 등 대기업과 NHN, 엔씨소프트, 넥슨 등 IT 기업이 들어선 판교테크노밸리가 가까운 직주근접 단지다. 현재 개발이 한창인 창조경제밸리가 올해부터 입주를 시작하면 800여개 기업이 추가로 들어올 예정이다.중산운사거리를 중심으로 마트, 은행, 병원, 주민센터, 보건소, 지구대 등 생활 편의시설과 관공서가 모여있다. 롯데백화점, AK플라자, 롯데마트, 현대백화점 등을 차량으로 이용할 수 있다. 교육시설로는 운중초, 운중중, 운중고, 산운초 등이 가까워 자녀의 편리한 도보 통학이 가능하다. [지도출처 : 네이버] [매경 부동산센터 이다연 기자]▶직장인 당구왕은 바로 당신! 지금 신청하세요▶뉴스 이상의 무궁무진한 프리미엄 읽을거리매일경제 관련뉴스해당 언론사에서 선정하며 언론사 페이지(아웃링크)로 이동해 볼 수 있습니다.'이세창 13세연하 신부' 정하나, '美친 인형미모' 뽐내[단독] 韓~中~러 '新북방 실크로드' 만든다김연아 '배구장에서 힘찬 시구' [MK화보]몽골 고분서 2천년 전 중국옷 입은 미라 발견이상우, 없는게 없는 대관령 6평 주택 공개 '입이 쩍!'좋아요0훈훈해요0슬퍼요0화나요0후속기사 원해요0기사제공 :""]"
3,NC soft, 2017-10-1610:36,전자신문 ,"[ET투자뉴스]엔씨소프트, ""리니지M, 그 이후…"" 매수(유지)-부국증권",https://finance.naver.com/news/news_read.nhn?article_id=0002647864&office_id=030&mode=search&query=엔씨&page=1,"['       [ET투자뉴스]엔씨소프트, ""리니지M, 그 이후…"" 매수(유지)-부국증권      기사입력2017-10-16 10:36기사원문좋아요훈훈해요좋아요 평가하기공감좋아요0훈훈해요0슬퍼요0화나요0후속기사 원해요0댓글부국증권에서 16일 엔씨소프트(036570)에 대해 ""리니지M, 그 이후도 이미 준비 중""라며 투자의견을 \'매수(유지)\'로 제시하였고, 아울러 목표주가로는 530,000원을 내놓았다. 부국증권 이준규 애널리스트가 동종목에 대하여 이번에 제시한 \'매수(유지)\'의견은 부국증권의 직전 매매의견에서 큰 변화없이 그대로 유지되는 것이고  올해 초반의 매매의견을 기준으로  볼때도 역시 \'매수\'의견이 계속 유지되고 있는 상태이다. 그리고 최근 분기내 발표된 전체 증권사 리포트의 컨센서스와 비교를 해볼 경우에 오늘 발표된 투자의견은 대체적으로 평균치에 해당하는 수준으로, 이번 의견은 동종목에 대한 전체적인 흐름에서 크게 벗어나지 않은 것으로 분석되고 있다. 목표주가의 추이를 살펴보면 과거 상향조정되어오던 패턴이 한차례 정체구간을 보낸 후에 이번에 다시 상향조정되는 모습이다. 또한 전일 종가 기준으로 볼때 동종목의 현주가는 이번에 제시된 목표가 대비 24.1%의 추가상승여력이 있다는 해석이 제시되고 있다. ◆ Report briefing부국증권에서 엔씨소프트(036570)에 대해 ""국내 ‘리니지M’은 연말까지 평균 일매출 42억원 수준이 유지될 것. 그리고 대만 ‘리니지M’ 역시 현재 사전예약자 50만명이 넘어가면서 11월 론칭시 초기흥행에 따른 매출이 기대되는 상황. 따라서 4Q17 예상실적은 매출액 5,411억원(+90.1% YoY), 영업이익 2,299억원(+126.1% YoY)으로 호실적이 이어질 것""라고 분석했다.  또한 부국증권에서 ""동사의 3Q17 예상실적은 매출액 6,482억원(+197.9% YoY), 영업이익 3,114억원(+378.3% YoY)으로 역대 최대 분기실적을 기록할 것으로 추정된다. 이는 7월부터 현재까지 ‘리니지M’의 역대급 흥행에 힘입어 모바일 라인업 매출 대폭 증가가 유력하고, ‘길드워2’ 확장팩 발매로 PC부문 매출도 소폭 증가할 것으로 예상되기 때문""라고 밝혔다.  한편 ""현재 ‘아이온’, ‘B&S’ 등 동사의 IP를 활용하여 모바일 게임 개발 중이며 내년에도 5 ~ 8종 정도 신작발매가 기대되는 상황. 특히 2018년 상반기까지 ‘B&S 모바일 MMORPG’와 ‘아이온 레기온즈’ 등의 발매가 예정되어 있어 신작 모멘텀은 내년에도 계속될 것""라고 전망했다. ◆ Report statistics부국증권의 동종목에 대한 최근 1년동안의 투자의견은 전체적으로 큰 변화없이 유지되고 있다. 목표주가는 500,000원이 고점으로, 반대로 300,000원이 저점으로 제시된 이후 이번에 530,000수준으로 새롭게 조정되고 있다. 한편 증권정보제공 업체인 씽크풀에 따르면 동사에 대한 컨센서스는 \'매수\'이고 목표주가의 추이를 살펴보면 직전에 한차례 상향조정된 후에 이번에 다시 목표가가 전저점보다 더 낮게 조정되면서 전체적으로는 하향추세가 계속 진행되는 추세이다. \xa0컨센서스최고최저투자의견매수매수(유지)매수(유지)목표주가573,846650,000450,000*최근 분기기준오늘 부국증권에서 발표된 \'매수(유지)\'의견 및 목표주가 530,000원은 전체 컨센서스 대비해서 대체적으로 평균치에 해당하는 수준으로, 이번 의견은 동종목에 대한 전체적인 흐름에서 크게 벗어나지 않은 것으로 파악되며 목표가평균 대비 7.6%정도 미달하고 있는 것으로 집계되었다.  참고로 최근에 목표주가를 가장 공격적으로 제시한 하나금융투자에서 투자의견 \'매수\'에 목표주가 650,000원을 제일 보수적인 의견을 제시한 케이프투자증권에서 투자의견 \'매수(상향)\'에 목표주가 450,000원을 제시한 바 있다. \xa0의견제시일자투자의견목표가격20171016매수(유지)530,00020170814매수(유지)500,00020170619매수(유지)500,00020170206매수(유지)380,00020161212매수(유지)300,000의견제시일자증권사투자의견목표가20171016부국증권매수(유지)530,00020171012신영증권매수(유지)560,00020171012메리츠종금증권매수550,00020171011이베스트투자증권매수(유지)650,000(씽크풀에서 제공하는 컨센서스는 국내 전증권사에서 발표되는 기업분석 리포트 및 코멘트를 실시간으로 통계/분석처리되고 있습니다.)증시분석 전문기자 로봇 ET etbot@etnews.com전자신문과 씽크풀의 증시분석 전문기자 로봇 ET가 쓴 기사입니다▶ 전자신문 인기 포스트▶ 전자신문 공식 페이스북▶ 전자신문 바로가기 [Copyright ⓒ 전자신문 & 전자신문인터넷, 무단전재 및 재배포 금지]전자신문 관련뉴스해당 언론사에서 선정하며 언론사 페이지(아웃링크)로 이동해 볼 수 있습니다.[권오현 퇴진] 삼성 인사 임박…시기 빨라지고 폭 커진다고가 수입 공기청정기 정부 인증없이 시장 유통…단속 사각지대중국 \'모바일핀테크 新동북공정\' 세계로...머니그램까지 집어삼킨다기아차 \'보증 중고차\' 미국서 인기…3분기 역대 2위 판매""中企 육성"" 외치면서…혁신R&D예산은 부처 쌈짓돈?좋아요0훈훈해요0슬퍼요0화나요0후속기사 원해요0기사제공 :']"
4,NC soft, 2017-10-1609:07,헤럴드경제 ,‘리니지2 레볼루션’ 최단기간 단일게임 1조 매출 신화 다시 쓴다,https://finance.naver.com/news/news_read.nhn?article_id=0001301773&office_id=016&mode=search&query=엔씨&page=1,"['       ‘리니지2 레볼루션’ 최단기간 단일게임 1조 매출 신화 다시 쓴다      기사입력2017-10-16 09:07기사원문좋아요훈훈해요좋아요 평가하기공감좋아요0훈훈해요0슬퍼요0화나요0후속기사 원해요0댓글- ‘리니지2 레볼루션’, 3분기 예상 매출 2800억, 누적 1조 육박- 컴투스 ‘서머너즈 워’이어 단일게임 1조 매출 고지 오를까 주목[헤럴드경제=박세정 기자] 넷마블게임즈의 ‘리니지2 레볼루션’이 올 3분기 누적매출 1조원 기록을 달성할 것이 유력해지고 있다. 출시 1년 만에 꿈의 기록인 1조원 기록을 넘보면서, 최단기간에 단일게임 1조원 고지를 달성한 매출 신화를 새로 쓸 수 있을지 주목된다.16일 관련업계에 따르면 다음달 초 넷마블의 3분기 실적발표를 앞두고, ‘리니지2 레볼루션’의 매출 1조원 달성 여부가 최대 관심사로 떠오르고 있다. 당장 증권가에서는 올 3분기 ‘리니지2 레볼루션’의 매출이 2800억원을 넘어선 것으로 보고 있다. 넷마블 ’리니지2 레볼루션‘ 이미지 [제공=넷마블]이 경우 출시 첫 분기인 작년 4분기(1400억원), 올 1분기(3800억원), 2분기(2000억원)을 포함해 누적 매출이 1조원에 육박하게 된다.현재까지 모바일 게임 중 단일게임으로 1조원 매출을 넘어선 것은 컴투스의 ‘서머너즈 워’가 유일하다.출시 기간까지 고려하면 ‘서머너즈 워’ 이상의 기록이다.‘서머너즈 워’가 1조원 매출을 달성하는데 걸린 기간은 약 3년이다. ‘리니지2 레볼루션’은 최단 기간인 출시 1년 만에 ‘1조원 명예의 전당’에 오르는 게임 신화를 쓰게 된다.특히 ‘리니지2 레볼루션’은 일본 출시 등 해외 공략을 본격화하면서 해외 매출 증가세가 더욱 속도를 낼 것으로 전망된다.일본 출시 영향으로 올 3분기 해외매출은 전분기 대비 약 15% 증가가 예상된다. 여기에 북미, 유럽 등에도 공략 채비를 서두르면서 해외 매출이 더욱 가파르게 상승할 가능성이 커졌다. 넷마블은 올 연말까지 오세아니아, 중동 등 54개국에 출시할 예정이다.엔씨소프트의 ‘리니지M’도 1조원 매출 달성에 청신호를 보이고 있다.지난 2분기 출시 후 올 3분기까지 ‘리니지M’의 누적 매출 예상액은 6000억원에 육박한다. 3분기에만 5000억원이 넘는 매출을 올린 것으로 증권가는 추정하고 있다. 4분기 예상 매출은 4000억원 수준으로, 오는 4분기에 누적 1조원 매출 달성이 유력하다.게임업계 관계자는 “리니지 형제의 인기가 돌풍에 가까운 수준이어서 두 게임 모두 연내 1조원 매출 달성이 가능할 것으로 보인다”며 “모바일 게임에서 1조원 매출이 넘는 단일 게임이 속속 등장한다는 것은 게임업계의 경쟁력 측면에서도 반가운 일”이라고 말했다. sjpark@heraldcorp.com▶ 생활용품 알뜰하게 사는 법 럭비(LUCK BE)▶앞서가는 젊은 경제신문 친구맺기 ▶오늘의 운세 날씨 - Copyrights ⓒ 헤럴드경제 & heraldbiz.com, 무단 전재 및 재배포 금지 -헤럴드경제 관련뉴스해당 언론사에서 선정하며 언론사 페이지(아웃링크)로 이동해 볼 수 있습니다.日 오키나와 불시착한 美 헬기서 방사성물질 유출 \'파장\'프로야구 롯데-NC 준PO 5차전 사직구장에 폭발물 소동\'성추행 남배우\' 피해자 여배우 기자회견 연다케이트 업튼, SI 수영복 촬영 중 바다에 빠질 뻔 \'아찔\'설리 ""최자와 다시 안 사귄다, 그거 다 뻥이다""좋아요0훈훈해요0슬퍼요0화나요0후속기사 원해요0기사제공 :']"
5,NC soft, 2017-10-1607:58,머니투데이 ,"엔씨소프트 3분기 최대 실적 예상, 내년에도…-부국증권",https://finance.naver.com/news/news_read.nhn?article_id=0003947790&office_id=008&mode=search&query=엔씨&page=1,"['       엔씨소프트 3분기 최대 실적 예상, 내년에도…-부국증권      기사입력2017-10-16 07:58기사원문좋아요훈훈해요좋아요 평가하기공감좋아요0훈훈해요0슬퍼요0화나요0후속기사 원해요0댓글 [머니투데이 이태성 기자] 부국증권은 16일 엔씨소프트에 대해 ""2018년에도 다양한 작품 출시 예정으로 신작 모멘텀은 내년에도 이어진다""고 밝혔다. 투자의견 매수 유지, 목표주가는 53만원으로 상향했다.이준규 연구원은 ""3분기 예상실적은 매출액 6482억원, 영업이익 3114억원으로 역대 최대 분기실적을 기록할 것으로 추정한다""며 ""이는 7월부터 현재까지 ‘리니지M’의 역대급 흥행에 힘입어 모바일 라인업 매출 대폭 증가가 유력하고, ‘길드워2’ 확장팩 발매로 PC부문 매출도 소폭 증가할 것으로 예상되기 때문""이라고 설명했다.그는 ""국내 ‘리니지M’은 연말까지 평균 일매출 42억원 수준이 유지될 것으로 추정되며 대만 ‘리니지M’ 역시 현재 사전예약자 50만명이 넘어가면서 11월 론칭시 초기흥행에 따른 매출이 기대되는 상황""이라며 ""4분기 예상실적은 매출액 5411억원, 영업이익 2,299억원으로 호실적이 이어질 것으로 보인다""고 판단해다.아울러 ""‘아이온’, ‘B&S’ 등 동사의 IP를 활용하여 모바일 게임 개발 중이며 내년에도 5 ~ 8종 정도 신작발매가 기대되는 상황""이라며 ""특히 2018년 상반기까지 ‘B&S 모바일 MMORPG’와 ‘아이온 레기온즈’ 등의 발매가 예정되어 있어 신작 모멘텀은 내년에도 계속될 전망""이라고 덧붙였다.▶옆사람이 지금 보는 기사들▶무료만화 즐기고~선물타자! ▶치어리더 vs 레이싱걸 이태성 기자 lts320@mt.co.kr머니투데이 관련뉴스해당 언론사에서 선정하며 언론사 페이지(아웃링크)로 이동해 볼 수 있습니다.성추행 남배우, 집행유예 2년…네티즌 ""TV서 안봤으면""공효진 ""통으로 짜장면 다 주시면""에 文대통령 ""나는 굴짬뽕""""힘내세요 김이수""… 포털·SNS 누리꾼 응원 \'봇물\'사라진 삼성전자…\'세계 최고 직장 톱10\'에 LG 유일\'올해의 한옥\'대상에 서울 서대문구 \'천연동 한옥\'좋아요0훈훈해요0슬퍼요0화나요0후속기사 원해요0기사제공 :']"
6,NC soft, 2017-10-1607:37,파이낸셜뉴스 ,"엔씨소프트, 4·4분기까지 좋은 실적 흐름 이어질 전망-부국증권",https://finance.naver.com/news/news_read.nhn?article_id=0003888968&office_id=014&mode=search&query=엔씨&page=1,"['       엔씨소프트, 4·4분기까지 좋은 실적 흐름 이어질 전망-부국증권      기사입력2017-10-16 07:37기사원문좋아요훈훈해요좋아요 평가하기공감좋아요0훈훈해요0슬퍼요0화나요0후속기사 원해요0댓글  부국증권이 16일 엔씨소프트에 대해 올해 3·4분기 역대 최대 분기 실적이 기대되며, 좋은 흐름이 4·4분기까지 이어질 것이라며 목표가 53만원, 투자의견 매수를 유지했다.  엔씨소프트의 3·4분기 예상실적은 매출액 6482억원, 영업이익 3114억원을 기록할 것으로 추정된다. 이준규 부국증권 연구원은 ""지난 7월부터 현재까지 \'리니지M\'의 역대급 흥행에 힘입어 모바일 라인업 매출 대폭 증가가 유력하다""며 ""\'길드워2\' 확장팩 발매로 개인용 컴퓨터(PC) 부문 매출도 소폭 증가할 것""이라고 말했다.  이 연구원은 리니지M의 평균 일매출이 연말까지 42억원 수준으로 유지될 것으로 내다봤다. 그는 ""대만 리니지M 역시 현재 사전예약자 50만명이 넘어가면서 11월 론칭 시 초기 흥행에 따른 매출이 기대되는 상황""이라며 ""4·4분기 실적은 매출액 5411억원, 영업이익 2299억원으로 예상한다""고 설명했다.   ethica@fnnews.com 남건우 기자   ▶ 세상의 모든 골 때리는 이야기 \'fn파스\'▶ 속보이는 연예뉴스 fn스타  ※ 저작권자 ⓒ  파이낸셜뉴스. 무단 전재-재배포 금지파이낸셜뉴스 관련뉴스해당 언론사에서 선정하며 언론사 페이지(아웃링크)로 이동해 볼 수 있습니다.화장실서 볼일 보던 女경찰, 위를 쳐다봤다가.. ""꺄아악""남성 2명과 모텔 갔다가 딱걸린 여자친구.. 최후의 선택9억 명품차 롤스로이스, 신호대기중 도로가 꺼지더니남편 살해한 아내, 다음날 새벽 내연남과 공터에서..매일 1일 1회 복용하면 심혈관질환 예방할 수 있는 약좋아요0훈훈해요0슬퍼요0화나요0후속기사 원해요0기사제공 :']"
