,회사명,날짜,언론사,기사제목,링크,본문
0,NC soft, 2018-10-1915:48,이데일리 ,"[마감]코스피, 롤러코스터 장세..中 증시에 동화되며 상승",https://finance.naver.com/news/news_read.nhn?article_id=0004228812&office_id=018&mode=search&query=엔씨&page=1,"['       [마감]코스피, 롤러코스터 장세..中 증시에 동화되며 상승      기사입력2018-10-19 15:48기사원문좋아요훈훈해요좋아요 평가하기공감좋아요0훈훈해요0슬퍼요0화나요0후속기사 원해요0댓글장중 1%대 하락하며 연중 최저치 경신외국인·개인 동반 순매도 흐름[이데일리 최정희 기자] 코스피 지수가 롤러코스터 장세를 연출했다. 오전까지만 해도 중국의 3분기 경제성장률이 둔화될 것이란 우려에 1%대 하락하며 연중 최저치를 경신했으나 오후 들어 중국 증시가 반등하자 이에 동조하며 상승했다. 중국 당국은 “중국 경제가 안정 속에 발전하는 추세에 변함이 없다”며 증시 부양 의지를 드러냈다. 19일 마켓포인트에 따르면 코스피 지수는 전 거래일보다 7.95포인트, 0.37% 오른 2156.26에 거래를 마쳤다. 하루만에 상승세다. 이날 코스피 고점과 저점은 41포인트에 달할 정도로 변동폭이 컸다. 장중엔 2117.62까지 하락해 작년 3월 이후 최저치를 기록했을 뿐 아니라 연중 최저점을 경신했다. 그러나 오후 들어 상승세로 전환돼 2150선을 회복한 후 마감했다. 중국은 한국 시각으로 이날 오전 11시경 3분기 경제성장률이 6.5%로 2009년 1분기 이후 최저치를 기록했다고 밝혔다. 시장 예상치 6.6%도 하회한 것이다. 이에 중국 상하이종합지수 등이 4년만에 최저 수준으로 하락하자 중국 당국자들은 불안감을 차단하기 위한 발언들을 쏟아냈다. 궈수칭 은행보험감독관리위원회 주석은 “최근 금융시장에 다양한 원인으로 이상 파동이 나타나고 있지만 중국 경제는 안정 속에 발전하는 추세에 변함이 없다”고 밝혔다. 은행이 판매하는 자산관리상품(WMP)의 주식 투자를 허용하는 등의 증시 부양책도 강조했다. 이에 상하이종합지수가 2%대 상승 거래되자 코스피 지수가 이에 동조하며 상승세로 마감한 것으로 풀이된다. 수급을 보면 외국인과 개인투자자가 각각 1700억원, 165억원 동반 순매도 흐름을 보였다. 기관만 1800억원 순매수를 기록했다. 외국인은 선물 시장에서도 300개 매도 계약을 했다. 원·달러 환율은 장 초반엔 상승했으나 3.1원 하락한 1132.1원에 마감했다. 시가총액 상위 종목들은 희비가 갈렸다. 삼성전자(005930)는 0.34% 하락하고 현대차(005380)는 0.43% 떨어졌다. KB금융(105560)은 0.58% 하락했다. 신한지주(055550)도 0.80% 떨어졌다. SK이노베이션(096770)과 S-Oil은 각각 3%대, 4%대 하락했다. 기아차(000270)는 1%대 하락세를 보였다. 현대중공업지주(267250)는 3%대, 한국타이어(161390)는 2%대 떨어졌다. 반면 SK하이닉스(000660)는 3%대, 셀트리온(068270)은 4%대 상승했다. 삼성바이오로직스(207940), POSCO(005490), NAVER(035420), 한국전력(015760)은 2%대 올랐다. SK텔레콤(017670), LG전자(066570), 엔씨소프트(036570)는 1%대 상승했다. 업종별로는 상승 우위 흐름을 보였다. 의약품, 전기가스업, 운수창고 업종은 2%대 올랐고 철강금속은 1%대 상승했다. 음식료품, 기계, 전기전자, 건설, 유통, 통신, 은행, 보험 등도 올랐다. 반면 의료정밀은 2%대 하락하고 섬유의복, 종이목재는 1%대 하락했다. 이날 거래량은 3억4365만7000주, 거래대금은 4조7229억1300만원으로 집계됐다. 상한가 1개 종목을 포함해 396개 종목이 올랐고 하한가 없이 418개가 하락했다. 89개는 보합권에서 거래를 마쳤다.최정희 (jhid0201@edaily.co.kr)네이버 모바일에서 ‘이데일리’ [구독하기▶]빡침해소! 청춘뉘우스~ [스냅타임▶]꿀잼 \'웹툰\'이 매일 매일 공짜...[웹툰보기▶]＜ⓒ종합 경제정보 미디어 이데일리 - 무단전재 & 재배포 금지＞이데일리 관련뉴스해당 언론사에서 선정하며 언론사 페이지(아웃링크)로 이동해 볼 수 있습니다.[노다지 신재생]24시간 에어콘 틀어도 월 9만원..자급자족 미래주택키즈카페서 \'구더기떼 케첩\' 먹고 구토..식약처 ""구더기, 뱃속에서 죽어""강서구 PC방 살인 15분 전...나중에 다시 찾아오겠다고 했다""오늘 맛있는 거 먹을까?"" 김진태, 법원서 570만원 받았다 자랑 왜?강용석, 이재명 무고죄로 고소 ""이재명 때문에 징역 산 J씨 변호""좋아요0훈훈해요0슬퍼요0화나요0후속기사 원해요0기사제공 :']"
1,NC soft, 2018-10-1914:42,한국경제 ,최근 5년 이익 지속 증가한 게임주는 넷마블,https://finance.naver.com/news/news_read.nhn?article_id=0004029489&office_id=015&mode=search&query=엔씨&page=1,"['       최근 5년 이익 지속 증가한 게임주는 넷마블      기사입력2018-10-19 14:42기사원문좋아요훈훈해요좋아요 평가하기공감좋아요0훈훈해요0슬퍼요0화나요0후속기사 원해요0댓글 [한경탐사봇] 스마트폰으로 게임을 즐기는 이용자가 증가하면서 게임주가 뜨고 있다. 지하철이나 거리에서 스마트폰을 조작하는 게이머를 손쉽게 볼 수 있다. \xa0한경탐사봇의 탐사 결과 최근 5년간 지속적으로 EPS(주당순이익)가 증가한 게임주로는\xa0넷마블(251270)이 유일했다.\xa0넷마블은 엔씨소프트와 더불어 게임 ‘대장주’ 자리를 놓고\xa0경쟁하고 있다. EPS란 주당순이익으로, 기업이 벌어들인 당기순이익을 기업이 발행한 총 주식 수로 나눈 값이다. 즉 EPS가 꾸준히 증가했다는 것은 그 기업의 경영 실적이 양호하다는 것으로 해석된다. 즉 넷마블의 EPS가 5년간 꾸준히 증가한 것은 넷마블이 최근 5년간 경영 실적을 꾸준히 개선했다는 것으로 풀이할 수 있다.넷마블 최근 EPS 및 예상 EPS◆3분기 실적, 컨센서스 부합넷마블은\xa03분기 매출액 4942억원, 영업이익 712억원으로 전분기 대비 매출액은 1% 감소하지만 영업이익은 15% 증가할 것으로 예상된다.\xa0경쟁사인 엔씨소프트의 ‘리니지2 레볼루션’ 실적이 개선되면서 넷마블 매출은 다소 감소했다.\xa0반면 넷마블의 수익성이 높은 ‘해리포터 호그와트 미스터리’의 318억원에 달하는 대규모 결제액이 3분기로 이연되면서\xa0영업이익이 증가할 것으로 보인다.\xa0넷마블 최근 실적 및 예상 실적◆\'블레이드앤소울 레볼루션\' 출시 임박넷마블은 10월 11일 미디어 쇼케이스를 통해 블레이드앤소울 레볼루션(이하 블소 레볼루션)의 12월 6일 정식 출시를 발표했다. 블소 레볼루션은 PC게임 블레이드앤소울의 원작을 계승하며 독자적인 콘텐츠를 제공할 것으로 보인다. 넷마블의 자회사인 체리벅스가 언리얼엔진4를 기반으로 개발하여 최상의 그래픽과 이펙트를 구현했으며 원작과 동일한 성우진으로 150종 이상의 시네마틱한 연출을 구현한다. 대전 전투액션과 PvP 시스템과 4인 파티 던전, 레이드 등 풍부한 콘텐츠 제공 또한 강점으로 기대된다.최근 이슈가 된 확률형 아이템에 대한 부정적 인식도 충분히 고려했다.\xa0경쟁 MMORPG의 확률형 아이템이 사행성이 짙다는 지적이 제기되자\xa0넷마블은\xa0블소 레볼루션의 확률형 아이템 비중이 20% 이하로 낮다고 밝혔다. 또,\xa0 확률형 아이템에 의존하지 않고 게임 내용에 충실하게 수익모델을 개선하겠다고 설명했다.블레이드앤소울 레볼루션블레이드앤소울 레볼루션. [출처 = 넷마블 홈페이지]◆게임 대장주 경쟁은 오리무중넷마블의 시가총액은 엔씨소프트의 시가총액을 넘보고 있다. 17일\xa0넷마블의 시가총액 9조8897억원은 엔씨소프트 시가총액 9조2254억원보다 6000억원이 많다.\xa0블소 레볼루션 출시라는 기대감이 주가를 반등시키고 있다는 분석이다.\xa0반면 엔씨소프트는 김택진 대표가 확률형 아이템 관련 국정감사 증인으로 채택되면서\xa0악재로 작용하고 있다.한경탐사봇이 기사는 한경닷컴과 버핏연구소가 공동 개발한 탐사봇 알고리즘에 기반해 작성된 것입니다.  - 기사오류문의 02-6071-1112▶ 네이버에서 한국경제 뉴스를 받아보세요▶ 한경닷컴 바로가기  ▶ 모바일한경 구독신청 ⓒ 한국경제 & hankyung.com, 무단전재 및 재배포 금지한국경제 관련뉴스해당 언론사에서 선정하며 언론사 페이지(아웃링크)로 이동해 볼 수 있습니다.""좋은 시절 다 갔다""…삼성전자 직원들 \'비상\'""서울대 나오면 뭐하나, 기대에 못 미치는데…"" 저격""정책 실패해놓고 이제 와서 우리 탓""…불만 폭발강남서 경찰관, 조사 대상 女와…""합의 하에 했다""""40년 기업 운영했지만 지금이 최악이다"" 분통좋아요0훈훈해요0슬퍼요0화나요0후속기사 원해요0기사제공 :']"
2,NC soft, 2018-10-1910:11,한국경제TV ,"문피아, 250억원 투자 유치 성공… '글로벌 진출 본격화'",https://finance.naver.com/news/news_read.nhn?article_id=0000693352&office_id=215&mode=search&query=엔씨&page=1,"['       문피아, 250억원 투자 유치 성공… \'글로벌 진출 본격화\'      기사입력2018-10-19 10:11기사원문좋아요훈훈해요좋아요 평가하기공감좋아요0훈훈해요0슬퍼요0화나요0후속기사 원해요0댓글웹소설 연재 플랫폼 \'문피아\'가 18일 중국 최대 웹소설 플랫폼 \'CLL(China Literature Limited)\'과 국내 게임개발사 \'엔씨소프트\'로부터 250억 원의 지분 투자를 유치했다.문피아는 이번 투자 유치를 통해 공격적인 브랜드 마케팅을 비롯하여, 웹소설 IP를 기반으로 한 OSMU(One Source Multi Use) 사업에 박차를 가해 보다 다양한 종류의 콘텐츠를 제공하는 기업으로 발돋움할 예정이다. 이와 관련하여 문피아의 김환철 대표는 ""이번 투자유치는 단순한 지분 투자가 아닌 비즈니스 협업을 위한 투자""라며, ""문피아 플랫폼과 콘텐츠의 글로벌 진출과 OSMU 사업을 본격화할 터닝포인트가 될 것""이라고 밝혔다.문피아는 2015년에 설립되어, 2017년 홍콩 증권 거래소에 상장된 CLL은 중국 최고의 온라인 문학 플랫폼으로 QQ Reading 등 온라인 콘텐츠와 관련된 9개 플랫폼을 서비스하고 있다. 현재 730만 명의 작가, 200개가 넘는 콘텐츠 카테고리 내 1,000만 개 이상의 디지털 저작물을 보유하고 있다.투자 참여사들은 문피아가 국내 대표 웹소설 플랫폼으로서 판타지, 무협 장르에서 독보적인 위치를 선점하고 있으며, 견조한 사업 성과를 내는 등 앞으로의 성장성이 높다고 판단해 투자를 결정했다고 설명했다. 이번 투자를 통해 CLL과 엔씨소프트는 문피아의 각 2, 3대 주주로 이름을 올렸다.이번 투자에 참여한 \'엔씨소프트\'는 리니지, 아이온 등 대규모 온라인 MMORPG(다중접속역할수행게임)를 개발한 국내 대표 게임 개발사로, 웹툰 및 웹소설 등 다양한 미디어 콘텐츠 투자를 통해  파트너십 및 협력모델을 구축하고 있다. \'엔씨소프트\' 유주동 투자실장은 ""엔씨소프트는 높은 성장성을 갖춘 업체와 새로운 협력 모델을 구축하는 일환으로 지속적인 투자를 진행하고 있다""며, ""앞으로 웹소설 플랫폼을 넘어 종합 콘텐츠 기업으로의 성장 가능성을 가진 문피아와 전략적 시너지 효과를 기대한다. 다양한 협력 방안을 모색할 예정""이라고 밝혔다.이와 함께 또 다른 투자사인 \'CLL\'의 공동대표 량샤오동(Xiaodong Liang)은 ""한국 콘텐츠 산업은 다양한 고퀄리티의 콘텐츠를 끊임없이 생산하는 것이 특징""이라며 ""CLL은 한국의 온라인 문화 산업을 오랫동안 연구해왔으며, 한국 콘텐츠 시장의 특성이 해외 비즈니스 전략에 중요하게 작용할 것이라 생각한다. CLL은 문피아를 통해 한국의 온라인 콘텐츠 플랫폼 및 제작자와 장기적인 관계를 맺길 희망한다""고 밝혔다.문피아는 지난 2월에 이미 CLL에 웹소설 \'환생좌\', \'던전메이커\' 등 총 9개의 작품을 수출했으며, 해당 작품들은 영어권 국가를 대상으로 서비스 중인 CLL의 웹소설 플랫폼 Webnovel을 통해 판매할 계획이다. 더불어 문피아에서 제작 중인 것으로 알려진 웹툰 10개 작품도 CLL을 통해 중국 전역에 유통될 전망이다.▶ No1. 경제/증권방송 보며 채팅하기 [유튜브][페이스북]▶ 대한민국 재테크 총집결 [한국경제TV 사이트 바로가기]ⓒ 한국경제TV, 무단 전재 및 재배포 금지한국경제TV 관련뉴스해당 언론사에서 선정하며 언론사 페이지(아웃링크)로 이동해 볼 수 있습니다.美 복권당첨금 \'1조\' 돌파…한국서 \'원격구매\' 가능할까이광기, 7살에 천사된 아들 ""주민등록 말소하며 오열""소주에 고춧가루?...감기에 대한 속설들 사실일까\'13조\' 치매치료제 시장 열렸다…최종 승자는""문재인 효과?""...시동거는 수소차 주가 \'들썩\'좋아요0훈훈해요0슬퍼요0화나요0후속기사 원해요0기사제공 :']"
3,NC soft, 2018-10-1909:13,이데일리 ,"中 GDP 대기모드..코스피, 2130선도 하회",https://finance.naver.com/news/news_read.nhn?article_id=0004228495&office_id=018&mode=search&query=엔씨&page=1,"['       中 GDP 대기모드..코스피, 2130선도 하회      기사입력2018-10-19 09:13기사원문좋아요훈훈해요좋아요 평가하기공감좋아요0훈훈해요0슬퍼요0화나요0후속기사 원해요0댓글이틀째 하락세..원·달러 환율도 3원 가량 상승 거래시가총액 20위권 중 19개 종목 하락[이데일리 최정희 기자] 코스피 지수가 이틀째 하락하면 2130선으로 내려앉았다. 미국과 중국간 갈등에 중국 경기둔화 우려까지 번지면서 글로벌 시장이 악재에 민감해진 모습이다. 특히 이날 오전 11시경 중국의 3분기 경제성장률이 발표되는 만큼 성장률이 시장 기대에 못 미칠 경우 증시의 추가 하락이 예상된다. 19일 마켓포인트에 따르면 코스피 지수는 이날 오전 9시 3분 현재 전 거래일보다 18.85포인트, 0.88% 하락한 2129.46에 거래되고 있다. 간밤 뉴욕증시는 1~2% 가량 하락했다. 미국과 중국간 갈등 확산, 중국 경기둔화 우려, 미국과 사우디아라비아와의 갈등, 이탈리아 재정위기 등의 각종 리스크 요인이 증시를 짓눌렀던 영향이다. 이런 분위기에 달러인덱스는 95.9까지 상승했다. 안전자산 선호심리에 엔화, 금 등이 강세를 보였다. 장 초반이라 수급은 약하다. 외국인과 기관투자가들은 각각 5억원씩 순매수중이다. 개인투자자들은 7억원 순매도하고 있다. 프로그램 매매로는 178억원 가량 순매수가 들어오고 있다. 11시 중국 경제지표 발표를 대기하고 있는 만큼 시장 거래 자체가 활발하지 않은 편이다. 최근 원·달러 환율은 위안화에 동조화되고 있는 만큼 전일 8.7원 상승한데 이어 이날도 2.8원 올라 1138원대에 거래되고 있다. 달러화 대비 신흥국 통화가 전반적인 약세를 보이고 있는 터라 이러한 상승세는 계속될 것으로 예상된다. 시가총액 상위 종목들은 대부분 파란색이다. 시총 상위 20위권 종목 중 한국전력(015760)(1%대 상승중)만 제외하고 나머지 종목이 모두 하락세다. 삼성전자(005930), SK하이닉스(000660)는 각각 0.45%, 0.73% 하락중이다. 셀트리온(068270)와 삼성바이오로직스(207940)도 0.58%, 0.90% 하락하고 있다. POSCO(005490)는 1%대 하락하고, SK이노베이션(096770)은 2%대 약세다. KB금융(105560), 신한지주(055550), 현대차(005380), 현대모비스(012330), 기아차(000270) 모두 하락중이다. S-Oil은 3%대 떨어지고 있다. 반면 삼성전기(009150), 엔씨소프트(036570), KT&G(033780) 등은 강세다. 업종별로도 전기가스업을 제외한 나머지 업종이 일제히 하락세다. 화학, 철강금속, 의료정밀, 운송장비 등이 1%대 오르고 종이목재, 섬유의복, 의약품, 비금속광물, 기계, 전기전자, 유통업, 운수창고, 건설업, 통신업 등이 하락하고 있다. 은행, 증권, 보험 등도 약세다.최정희 (jhid0201@edaily.co.kr)네이버 모바일에서 ‘이데일리’ [구독하기▶]빡침해소! 청춘뉘우스~ [스냅타임▶]꿀잼 \'웹툰\'이 매일 매일 공짜...[웹툰보기▶]＜ⓒ종합 경제정보 미디어 이데일리 - 무단전재 & 재배포 금지＞이데일리 관련뉴스해당 언론사에서 선정하며 언론사 페이지(아웃링크)로 이동해 볼 수 있습니다.[노다지 신재생]24시간 에어콘 틀어도 월 9만원..자급자족 미래주택[줌인]제발등 찍은 민노총…대의원대회 무산 김명환 리더십 \'흔들\'강서구 PC방 살인 15분 전...나중에 다시 찾아오겠다고 했다김동연 초강수 ""카풀 정면돌파..원격의료·제조업 구조조정""(종합)호가 뛰고 매물 실종…규제 비켜간 부천 주택시장 들썩좋아요0훈훈해요0슬퍼요0화나요0후속기사 원해요0기사제공 :']"
4,NC soft, 2018-10-1908:54,전자신문 ,"[ET투자뉴스]넷마블, ""블레이드앤소울 레볼…"" HOLD(유지)-KB증권",https://finance.naver.com/news/news_read.nhn?article_id=0002749714&office_id=030&mode=search&query=엔씨&page=1,"['       [ET투자뉴스]넷마블, ""블레이드앤소울 레볼…"" HOLD(유지)-KB증권      기사입력2018-10-19 08:54기사원문좋아요훈훈해요좋아요 평가하기공감좋아요0훈훈해요0슬퍼요0화나요0후속기사 원해요0댓글KB증권에서 18일 넷마블(251270)에 대해 ""블레이드앤소울 레볼루션 출시 임박""라며 투자의견을 \'HOLD(유지)\'로 제시하였고, 아울러 목표주가로는 135,000원을 내놓았다. KB증권 이동륜, 손정훈 애널리스트가 동종목에 대하여 이번에 제시한 \'HOLD(유지)\'의견은 KB증권의 직전 매매의견을 그대로 유지하는 것이고 반면에 연초반의 매매의견을 기준으로 본다면 \'매수\'의견에서 \'HOLD(유지)로\' 레벨다운된 것이다. 그리고 최근 분기내 발표된 전체 증권사 리포트의 컨센서스와 비교를 해볼 경우에 오늘 발표된 투자의견은 전체의견 대비해서 비교적 낮은 수준으로 평가되는데,  이는 동종목에 대한 기대감을 다소 약하게 표현한 것으로 분석되고 있다. 목표주가의 추이를 살펴보면 최근 두차례 연속 하향조정되다가 이번에는 직전 목표가와 동일한 수준을 유지하는 모습이다. 또한 전일 종가 기준으로 볼때 동종목의 현주가는 이번에 제시된 목표가 대비 17.9%의 추가상승여력이 있다는 해석이 제시되고 있다. ◆ Report briefingKB증권에서 넷마블(251270)에 대해 ""넷마블의 3Q18 실적은 매출액 5,091억원 (+2% QoQ, -13% YoY), 영업이익 698억원 (+12% QoQ, -38% YoY)을 기록할 전망이다. ① 리니지2 레볼루션을 비롯한 기존 게임들의 매출 하락세가 지속된 가운데, ② 더킹오브파이터즈올스타 일본지역 출시효과와 ③ 해리포터: 호그워트 미스터리 관련 이연수익 (200억원 추정) 인식으로 매출액과 영업이익 모두 전분기대비 개선될 전망이다""라고 분석했다.  또한 KB증권에서 ""2018년 최대 기대작 중 하나인 블레이드앤소울 레볼루션의 출시일정이 12월 6일로 확정되면서 신작 리스크는 일부 해소될 전망이다. 블소 레볼루션은 출시일정이 당초 예상보다 1년 가까이 지연되면서 넷마블의 최대 기대요인이자 리스크 요인으로 작용해왔다. 해당 게임은 넷마블이 자체 개발했고 (자회사 체리벅스 개발), 한국, 중국 등 지역에서 인지도가 높은 블레이드&소울 IP를 활용한 만큼 흥행 기대감이 높다""라고 밝혔다.  한편 ""넷마블의 12개월 fwd. PER은 22배 수준으로, 국내외 주요 퍼블리셔인 ATVI, EA, 넷이즈, 넥슨, 엔씨소프트의 평균인 19배를 상회하고 있다. 밸류에이션 프리미엄이 정당화되기 위해서는 블소 레볼루션을 비롯한 신작게임의 성공과 매출 지속가능 여부가 확인되어야 한다고 판단한다""라고 전망했다. ◆ Report statisticsKB증권의 동종목에 대한 최근 1년동안의 투자의견은 전체적으로 조금 하향조정되고 있다. 목표주가는 2017년11월 215,000원까지 높아졌다가 2018년10월 135,000원을 최저점으로 목표가가 제시된 이후 최근에도 135,000원으로 제시되고 있다. 한편 증권정보제공 업체인 씽크풀에 따르면 동사에 대한 컨센서스는 \'트레이딩매수\'이고 목표주가의 추이를 살펴보면 최근 3회이상 지속적으로 낮아지고 있는데, 이번에는 목표가의 하락폭이 다소 완화되는 추세이다. <컨센서스 하이라이트>\xa0컨센서스최고최저투자의견트레이딩매수BUY (M)MARKETPERFORM목표주가162,813220,000120,000*최근 분기기준오늘 KB증권에서 발표된 \'HOLD(유지)\'의견 및 목표주가 135,000원은 전체 컨센서스 대비해서 비교적 낮은 수준으로 동종목에 대한 기대감을 다소 약하게 표현한 것으로 풀이되며 목표가평균 대비 17.1%정도 미달하고 있는 것으로 집계되었다.  참고로 최근에 목표주가를 가장 공격적으로 제시한 메리츠종금증권에서 투자의견 \'BUY\'에 목표주가 220,000원을 제일 보수적인 의견을 제시한 KTB투자증권에서 투자의견 \'HOLD\'에 목표주가 120,000원을 제시한 바 있다. <KB증권 투자의견 추이>\xa0의견제시일자투자의견목표가격20181018HOLD(유지)135,00020180809HOLD(하향)155,00020180502매수(유지)170,00020180417매수(유지)170,000<최근 리포트 동향>의견제시일자증권사투자의견목표가20181018KB증권HOLD(유지)135,00020181015IBK투자증권매수(유지)148,00020181010메리츠종금증권BUY220,00020181010교보증권BUY170,000(씽크풀에서 제공하는 컨센서스는 국내 전증권사에서 발표되는 기업분석 리포트 및 코멘트를 실시간으로 통계/분석처리되고 있습니다.)증시분석 전문기자 로봇 ET etbot@etnews.com전자신문과 씽크풀의 증시분석 전문기자 로봇 ET가 쓴 기사입니다▶ 코리아 UX를 리드하는 담론의 현장 - HCI & UX 코리아 2019▶ 네이버 모바일에서 [전자신문] 채널 구독하기▶ 전자신문 바로가기 [Copyright ⓒ 전자신문 & 전자신문인터넷, 무단전재 및 재배포 금지]전자신문 관련뉴스해당 언론사에서 선정하며 언론사 페이지(아웃링크)로 이동해 볼 수 있습니다.삼성, 세계 첫 7나노 EUV 생산 착수...초미세 공정 벽 넘어 70조 파운드리 시장 \'진격\'이동통신 가입자 1만명당 유통점 8.2개 ··· 미국은 0.6개, 일본은 0.8개누더기 예산으로 삐걱거리는 HPC 개발 사업...HW-SW 개발도 따로ETRI R&D 지원사업 일몰되나... 기관 인건비 수급 비상의료기기 개발해도 인허가 담당할 사람이 없다좋아요0훈훈해요0슬퍼요0화나요0후속기사 원해요0기사제공 :']"
