,회사명,날짜,언론사,기사제목,링크,본문
0,NC soft, 2018-10-0816:35,머니S ,"장병규·임재현, 10일 문체위 국감 출석",https://finance.naver.com/news/news_read.nhn?article_id=0000347236&office_id=417&mode=search&query=엔씨&page=1,"['       장병규·임재현, 10일 문체위 국감 출석      기사입력2018-10-08 16:35기사원문좋아요훈훈해요좋아요 평가하기공감좋아요0훈훈해요0슬퍼요0화나요0후속기사 원해요0댓글장병규 4차 산업혁명위원회 위원장(블루홀 의장). /사진=뉴시스오는 10일 열리는 국회 문화체육관광위원회(문체위)의 문화체육관광부 국정감사에 장병규 4차 산업혁명위원회 위원장(블루홀 의장)과 임재현 구글코리아 전무가 출석한다.장병규 의장에게는 블루홀의 자회사 펍지가 개발한 PC온라인 슈팅게임 ‘배틀그라운드’내 불법 핵 프로그램과 관련된 문제와 게임산업 전반에 대한 질의와 정부의 4차 산업혁명위원회 활동에 대한 질의를 받을 예정이다.임 전무에게는 최근 불거진 구글 앱마켓 플레이스토어 내 수수료 문제와 갑질관련에 대해 질의한다. 최근 게임업계를 중심으로 구글 플레이 스토어의 운영정책에 반감이 형성된 만큼 관련 질문이 쏟아질 것으로 예상된다. 당초 국회는 임 전무가 아닌 민경환 상무를 증인으로 신청했지만 민 상무가 해외출장을 가게 돼 임 전무가 대신 출석하게 됐다. 한편 오는 10일 열리는 과방위 국정감사에는 이해진 네이버(NAVER)\xa0GIO와 김범수 카카오 의장이, 18일 열리는 문체위의 게임물관리위원회 국정감사에는 김택진 엔씨소프트 대표가 증인으로 채택됐다.박흥순 기자 soonn@mt.co.kr<저작권자 ⓒ \'성공을 꿈꾸는 사람들의 경제 뉴스\' 머니S, 무단전재 및 재배포 금지>▶ 머니S 페이스북 ▶ 동영상으로 만나는 머니S 머니S 관련뉴스해당 언론사에서 선정하며 언론사 페이지(아웃링크)로 이동해 볼 수 있습니다.\'음성파일 유출\' 김부선·공지영 ""주요 부위에 동그란 점""""합의된 성관계""… 15세 디아크 전 여친, 루머 해명판빙빙 벌금 완납? ""1450억원 이미 갚았다""박주미 ""길에서 둘째 혼내다 유희열에게 들켰다""클라라, 뚱뚱한 모습 \'눈길\'… 섹시몸매 어디로 갔나좋아요0훈훈해요0슬퍼요0화나요0후속기사 원해요0기사제공 :']"
1,NC soft, 2018-10-0813:33,전자신문 ,"[ET투자뉴스]엔씨소프트, ""‘리니지M’의 장기…"" BUY(MAINTAIN)-하이...",https://finance.naver.com/news/news_read.nhn?article_id=0002746338&office_id=030&mode=search&query=엔씨&page=1,"['       [ET투자뉴스]엔씨소프트, ""‘리니지M’의 장기…"" BUY(MAINTAIN)-하이투자증권      기사입력2018-10-08 13:33기사원문좋아요훈훈해요좋아요 평가하기공감좋아요0훈훈해요0슬퍼요0화나요0후속기사 원해요0댓글하이투자증권에서 8일 엔씨소프트(036570)에 대해 ""‘리니지M’의 장기 독주""라며 투자의견을 \'BUY(MAINTAIN)\'로 제시하였고, 아울러 목표주가로는 555,000원을 내놓았다. 하이투자증권 김민정 애널리스트가 동종목에 대하여 이번에 제시한 \'BUY(MAINTAIN)\'의견은 하이투자증권의 직전 매매의견을 그대로 유지하는 것이고 올해 초반의 매매의견을 기준으로  볼때도 역시 \'매수\'의견이 계속 유지되고 있는 상태이다. 그리고 최근 분기내 발표된 전체 증권사 리포트의 컨센서스와 비교를 해볼 경우에 오늘 발표된 투자의견은 전체의견에 수렴하고 있어, 이번 의견은 시장의 평균적인 기대감이 객관적으로 표현된 것으로 분석되고 있다. 목표주가의 추이를 살펴보면 과거 목표가가 하향조정된 후에 한동안 같은 수준으로 유지되었고 이번에 다시 상향조정되었는데, 이번의 조정된 상승폭은 이전의 하락조정폭보다 강한 모습이다. 또한 전일 종가 기준으로 볼때 동종목의 현주가는 이번에 제시된 목표가 대비 33.1%의 저평가 요인이 존재한다는 해석이 제시되고 있다. ◆ Report briefing하이투자증권에서 엔씨소프트(036570)에 대해 ""엔씨소프트의 3분기 매출액은 3,988억원 (-45.2% YoY, -8.6% QoQ), 영업이익은 1,393억원 (-57.5% YoY, -12.7% QoQ)으로 시장 컨센서스를 상회하는 실적을 기록할 것으로 예상한다. 지난2분기에 일매출액 22억원 수준을 기록했던 ‘리니지M’의 일매출액은 3분기에도 견조하게 유지 되어 전분기대비 7.0% 감소한 1,908억원을 기록할 것으로 추정한다""라고 분석했다.  또한 하이투자증권에서 ""출시된지 2년이 되어가는 ‘리니지M’의 국내 매출 순위는 꾸준히 1위를 유지하고 있으며 경쟁사의 신작 출시에 따른 매출 잠식 또한 거의 없는 상황이다. ‘총사’에 이어 지난 9월 28일 ‘투사’업데이트를 진행하여 온라인게임 ‘리니지’에는 없는 클래스를 추가하면서 DAU 등 이용자 지표및 매출액은 견조한 흐름을 유지하고 있다""라고 밝혔다.  한편 ""내년에는 모바일 MMORPG 신작이 출시될 예정으로 신작에 기대감이 본격적으로 주가에 반영될 것으로 예상한다. \'리니지2M\', \'블레이드앤소울2\', \'아이온텐페스트\' 모두 내년에 출시가 가능할 정도로 개발이 진전된 것으로 파악되며, 흥행 결과에 따라 내년 중에는 1~2개의 모바일 신작이 출시될 예정이다""라고 전망했다. ◆ Report statistics하이투자증권의 동종목에 대한 최근 6개월 동안의 투자의견은 전체적으로 큰 변화없이 유지되고 있다. 목표주가는 2018년2월 605,000원까지 높아졌다가 2018년5월 505,000원을 최저점으로 목표가가 제시된 이후 최근에 555,000원으로 새롭게 조정되고 있다. 한편 증권정보제공 업체인 씽크풀에 따르면 동사에 대한 컨센서스는 \'매수\'이고 목표주가의 추이를 살펴보면 최근 2회연속 목표가가 낮아지다 이번에는 직전목표가보다 높은 수준으로 크게 상향반전하는 추세이다. <컨센서스 하이라이트>\xa0컨센서스최고최저투자의견매수BUY(유지)HOLD(유지)목표주가480,000580,000420,000*최근 분기기준오늘 하이투자증권에서 발표된 \'BUY(MAINTAIN)\'의견 및 목표주가 555,000원은 전체의견에 수렴하면서 시장의 평균적인 기대감이 비교적 객관적으로 표현된 것으로 풀이되며 목표가평균 대비 15.6% 초과하고 있는 것으로 집계되었다.  참고로 최근에 목표주가를 가장 공격적으로 제시한 이베스트투자증권에서 투자의견 \'BUY (MAINTAIN)\'에 목표주가 580,000원을 제일 보수적인 의견을 제시한 신한금융투자에서 투자의견 \'TRADING BUY (하향)\'에 목표주가 420,000원을 제시한 바 있다. <하이투자증권 투자의견 추이>\xa0의견제시일자투자의견목표가격20181008BUY(MAINTAIN)555,00020180716BUY(MAINTAIN)505,00020180511매수(유지)505,00020180208매수(유지)605,000<최근 리포트 동향>의견제시일자증권사투자의견목표가20181008하이투자증권BUY(MAINTAIN)555,00020180927KTB투자증권BUY510,00020180921이베스트투자증권BUY (MAINTAIN)580,00020180816삼성증권BUY430,000(씽크풀에서 제공하는 컨센서스는 국내 전증권사에서 발표되는 기업분석 리포트 및 코멘트를 실시간으로 통계/분석처리되고 있습니다.)증시분석 전문기자 로봇 ET etbot@etnews.com전자신문과 씽크풀의 증시분석 전문기자 로봇 ET가 쓴 기사입니다▶ 전자신문 바로가기 [Copyright ⓒ 전자신문 & 전자신문인터넷, 무단전재 및 재배포 금지]전자신문 관련뉴스해당 언론사에서 선정하며 언론사 페이지(아웃링크)로 이동해 볼 수 있습니다.블록체인으로 비상장주권 거래 상용화재도전한 \'반도체 R&D 예타\' 1차 관문 통과현대·기아차, 美 전기차 \'빅3\' 노린다...쏘울·아이오닉·코나·니로EV 집중 투입SBA, \'2018 외국인 취업박람회\' 성료…면접 및 취업관련 정보 공유로 호평배터리 업계 3분기 호실적 전망..전기차 배터리 흑자전환 가시화좋아요0훈훈해요0슬퍼요0화나요0후속기사 원해요0기사제공 :']"
2,NC soft, 2018-10-0811:45,한국경제 ,"[한경로보뉴스] 전일, 기관 거래소에서 KODEX 코스닥150 레버리지(-4.42...",https://finance.naver.com/news/news_read.nhn?article_id=0004022222&office_id=015&mode=search&query=엔씨&page=1,"['       [한경로보뉴스] 전일, 기관 거래소에서 KODEX 코스닥150 레버리지(-4.42%), 현대건설(-4.07%) 등 순매도      기사입력2018-10-08 11:45기사원문좋아요훈훈해요좋아요 평가하기공감좋아요0훈훈해요0슬퍼요0화나요0후속기사 원해요0댓글 기관 투자자는 05일 거래소에서 KODEX 코스닥150 레버리지, 현대건설, 아모레퍼시픽 등을 중점적으로 매도한 것으로 나타났다.기관 투자자의 순매도 상위 20개 종목은 KODEX 코스닥150 레버리지, 현대건설, 아모레퍼시픽, 삼성SDI, S-Oil, KODEX 레버리지, 금호석유, 엔씨소프트, 세아제강, 호텔신라등이다.이중에 화학 업종에 속한 종목이 3개 포함되어 있다.S-Oil, 호텔신라, 하나금융지주 등은 전일 대비 주가가 상승했고, KODEX 코스닥150 레버리지, 현대건설, 아모레퍼시픽 등은 주가가 하락했다.[10월05일]거래소 기관 순매도 상위 종목한경로보뉴스이 기사는 한국경제신문과 씽크풀이 공동 개발한 기사 자동생성 알고리즘에 의해 실시간으로 작성된 것입니다.  - 기사오류문의 02-3277-9940[한경닷컴 바로가기] [모바일한경 구독신청] 글로벌 블록체인 프론티어 코리아! 2018 코리아 블록체인 엑스포 [바로가기] ⓒ 한국경제 & hankyung.com, 무단전재 및 재배포 금지한국경제 관련뉴스해당 언론사에서 선정하며 언론사 페이지(아웃링크)로 이동해 볼 수 있습니다.""통장에 꽂히는 돈 보면…부동산 관심 없어요""""3조7000억 날아갈 수도""…자동차 업계 \'초비상\'""집값 폭등? 몰라서 하는 말"" 여의도 족집게의 전망연금이 무려 720만원…어떤 공무원인가 봤더니삼성 또 일낼까…이재용, 집중 투자 나서더니좋아요0훈훈해요0슬퍼요0화나요0후속기사 원해요0기사제공 :이 기사는 뉴스제휴평가위원회 \'뉴스제휴 및 제재 심사 규정\'에 따라노출 중단된 기사입니다.이전페이지목록보기인쇄하기목록보기증시 주요뉴스[클릭! 해외증시 이 종목] 드라이브 스루 확..[마켓뷰] 코스피, 3200선 겨우 지켜.....[마감시황]코스피, 개인 3조 매수에도 1.2..[Asia마감]美 기술주 급락에 일본·홍콩 줄..[시황종합] 코스피 1.23% 하락 3209 ..[외환마감]환율 2거래일만 상승..1110원 ..[코스닥 마감]인플레 우려에 \'970선\'까지 ..[Asia오전] 美 기술주 급락 여파…닛케이·..이전 페이지로 돌아가기|맨위로']"
3,NC soft, 2018-10-0810:51,매일경제 ,"판교 ‘라스트리트 윙’ 상가, ‘글로벌R&D센터` 건립 호재 품어 인기",https://finance.naver.com/news/news_read.nhn?article_id=0004230666&office_id=009&mode=search&query=엔씨&page=1,"[""       판교 ‘라스트리트 윙’ 상가, ‘글로벌R&D센터` 건립 호재 품어 인기      기사입력2018-10-08 10:51기사원문좋아요훈훈해요좋아요 평가하기공감좋아요0훈훈해요0슬퍼요0화나요0후속기사 원해요0댓글판교 라스트리트 윙 상가가 분양에 순항 중으로 일대 부동산 관계자들의 이목이 집중된다. 이 상업시설은 판교 일대에 예정된 다양한 호재의 수혜효과를 직접 누릴 수 있는 최적의 입지를 선점해 좋은 평을 받는다. SK케미칼, 포스코ICT, 한화 테크윈, LIG e 넥스원, 안랩, NHN 등과 같은 국내 유수의 대기업들이 입지한 판교는 국내 최대 비즈니스 지역으로 빠르게 성장 중이다. 최근 기업의 비즈니스 시설 건립, 사업단지 확충과 같은 다양한 개발이 활발하게 추진 중으로 일대의 부동산 가치가 상승세에 있어 부동산 관계자들의 관심이 상당하다. 다양한 호재 중 손꼽히는 호재로 엔씨소프트(NC Soft)의 글로벌R&D센터 건립이 거론된다. 글로벌R&D센터는 엔씨소프트의 글로벌 연구 개발 허브로 활용된다. 전국 각지에 분산된 엔씨소프트의 R&D센터들이 글로벌R&D센터에 통합될 예정으로, ICT 산업과 게임산업의 거점으로 성장이 주목된다. 이 사업은 경기도 성남시와 엔씨소프트가 사업을 위한 양해각서(MOU)를 체결해 본격적으로 가시화됐다. 글로벌R&D센터 건립으로 상당한 경제적 효과가 창출될 것으로 전망된다. 관계자들은 글로벌R&D센터가 연간 2만명의 고용 창출 효과와 1조 5천억원 규모의 경제유발 효과를 일으킬 것으로 예견한다. 수백억원 대에 달하는 세수 증대 역시 기대할 수 있다. 판교 지역에 상당한 수혜효과가 선사될 것으로 예측돼, 일대 부동산 시장이 연일 들썩이고 있다. 미래에셋금융그룹이 판교 내 초대형 4차산업 플랫폼 기반 복합시설 개발 사업 추진을 확정한 것도 판교 일대 부동산 가치의 주요 요인이다. 미래에셋금융그룹은 1조 8천억원의 대규모 부동산 펀드를 조성, 투자금 유치가 한창이다. 얼마 전, 네이버가 2천억원의 펀드 투자를 결정한 사실이 전해지기도 했다. 판교 최고 입지로 평가되는 알파돔시티가 사업 부지다. 제1판교테크노밸리, 제2판교테크노밸리에 이어 제3판교테크노밸리 사업 부지가 국토부 승인을 받은 것도 판교 지역의 부동산 가치를 높여준다. 2023년 완공 예정인 제3판교테크노밸리는 약 500개 기업이 입주하게 된다. 현재 판교에는 제2판교테크노밸리 조성도 한창으로 내년 완공을 예정하고 있다. 제2판교테크노밸리가 완공되면 43만㎡ 규모에 약 2,000개의 기업이 입주한다. 제1~3판교테크노밸리 조성사업이 모두 완료될 경우, 판교 지역에는 엄청난 경제적 수혜효과를 누릴 수 있을 것으로 기대된다. 판교 라스트리트 윙 상가는 판교 일대 수혜효과를 누리기 좋은 위치해 자리하는 상업시설로 부동산 관계자들의 관심이 상당하다. 판교 역세권 상가로 3,500만원대부터 시작하는 최저 분양가와 임대료를 책정한 것도 호평 된다. 탄탄한 수요와 집객력이 우수한 상업시설로 성공적인 분양의 기대감이 높다. 알파돔시티에서 이미 준공이 완료돼 즉시 입점이 가능한 것도 장점으로 평가된다. 판교역에 연결된 첨단 도심복합센터로 철도를 이용한 사람들의 편리한 방문이 가능하며, 주목도 확보에 용이해 투자가치가 높은 상업시설이다. 역 주변을 찾는 유동 인구 역시 수요로 확보가 가능해 인기가 좋다. 판교 라스트리트 윙 상가는 판교 역세권 스트리트형 상가로 산책과 쇼핑, 식사를 동시에 즐길 수 있는 복합상가로 조성된다. 1층과 2층에 총 69개의 점포가 입점 예정으로, 저층을 중심으로 상가들이 자연스럽게 나열돼 건물 내 상가 대비 개방감과 가시성이 뛰어난 것이 특징이다. 거리와 연결된 상업시설로 인근을 지나는 사람들을 자연스럽게 상가로 유입시킨다. 나열식으로 배열된 상가 간의 시너지 효과로 고객 체류 시간이 긴 것도 경쟁력을 더한다.이 상업시설은 길이 300m, 폭 17m로 조성된다. 상업시설 전체에 유럽풍 인테리어가 도입, 마치 유럽의 골목길을 산책하는 것과 같은 느낌을 선사한다. 오피스텔 입주민을 비롯한 지역 주민의 생활 편의를 위해 다양한 생활밀착형 MD가 구성될 예정이며, 1층은 전면 100%로 조성된다. 2층은 엘리베이터와 브릿지를 연결해 접근성을 강화했다. 쇼핑 동선이 편리해 쇼핑으로 인한 피로감이 적은 상업시설로 많은 방문객 유입이 예상된다. 이 상업시설은 사통팔달의 광역 도로망을 갖춰 교통편의가 우수하다. 경부고속도로, 용인-서울 고속도로가 상업시설과 가깝고, 분당-내곡간 고속도로, 분당-수서간 고속도로도 상업시설 인근을 지나 서울을 비롯한 경기 남부권, 인근 대도시로의 이동이 편리하다. 경강선 판교역(여주-성남) 복선전철도 개통을 앞두고 있다. 2021년에는 GTX 성남역(삼성-동탄) 개통도 예정돼 수도권 주요 도시들이 1시간 내로 연결된다. 판교역 신분당선을 이용하면 강남역까지 14분대 진입이 가능하다. 다양한 교통망이 빠르게 확충되면서 일대 교통편의 개선은 물론, 부동산 미래가치 상승까지 기대해 볼 만하다. 상업시설 주변에 풍부한 수요가 자리한 것도 돋보이는 장점이다. 수요는 임대수익과 직결되는 주요한 요소로, 안정적이고 높은 수익 실현의 기대감이 높다. 알파리움 931세대의 입주민을 이미 고정수요로 확보했고, 1,300여개 입주기업에 종사 중인 약 7만 5천여명의 근로자를 배후수요로 갖춘 제1판교테크노밸리도 가깝다. 제2, 3판교테크노밸리 확장도 박차를 가하고 있어 상당한 그로자 수요 확보가 예상된다. 인근 지역의 수요를 더하면 약 20만명 이상의 수요가 상업시설 주변에 자리할 것으로 추산된다. 엔씨소프트의 글로벌R&D센터 건립과 카카오 주요 계열사들의 입주, 현대백화점의 입주 등의 지역 호재도 있어 약 12만명의 근로자 고정수요와 주거 인구를 추가 배후수요로 품게 된다. 상업시설의 성공이 예견되는 이유다. 분양관계자는 “판교 지역의 입지적 장점, 역세권 상가의 장점, 합리적 분양가의 장점이 결합된 판교 랜드마크 상업시설로 미래가치 상승이 예상된다”며 “프리미엄 상승에 대한 기대감이 높은 상권으로 즉시 입점 및 임대가 가능한 상업시설이다”라고 말했다. 이어 “37만평 판교 최대 알파돔시티의 중심상가를 좋은 가격에 소유 또는 임대가 가능하고, 권리금이 없어 초기 부담을 덜 수 있는 좋은 기회를 놓치지 않기 바란다”고 덧붙였다. 한편, 상가 계약은 현장 방문을 통해 직접 확인 후 진행 가능하다. 현장홍보관은 경기도 성남시 분당구 백현동 530 알파리움제타워2동 118호에 자리한다. [매경닷컴]▶세계지식포럼 오픈세션, 영국남자 보러가자▶직장인 당구왕은 바로 당신! 지금 신청하세요[ⓒ 매일경제 & mk.co.kr, 무단전재 및 재배포 금지]매일경제 관련뉴스해당 언론사에서 선정하며 언론사 페이지(아웃링크)로 이동해 볼 수 있습니다.봉태규 아내 하시시박, 상의탈의 한 채 '모유수유' 중권아솔 666일째 결장…맥그리거 욕할 자격 없다 [강대호의 인사이드]낸시 '섹시한 핫팬츠 각선미'평양의 동물원 '북한의 일상 속으로''100kg 거구' 된 클라라…그녀에게 무슨 일이? '충격'좋아요0훈훈해요0슬퍼요0화나요0후속기사 원해요0기사제공 :""]"
4,NC soft, 2018-10-0810:28,스포츠경향 ,넷마블 새 모바일게임 ‘블레이드&소울 레볼루션’ 기대감에 주가 상승,https://finance.naver.com/news/news_read.nhn?article_id=0000576440&office_id=144&mode=search&query=엔씨&page=1,"['       넷마블 새 모바일게임 ‘블레이드&소울 레볼루션’ 기대감에 주가 상승      기사입력2018-10-08 10:28기사원문좋아요훈훈해요좋아요 평가하기공감좋아요0훈훈해요0슬퍼요0화나요0후속기사 원해요0댓글 게임사 넷마블이 새 모바일 게임 ‘블레이드&소울 레볼루션’ 출시에 대한 기대감으로 8일 유가증권 시장에서 초반 강세를 나타냈다.이날 8일 오전 9시 34분 현재 넷마블은 전 거래일 대비 5000원(4.26%) 오른 12만 2500원에 거래되고 있다.앞서 지난 5일 넷마블은 오는 11일 서울 구로구 신도림 쉐라톤호텔에서 ‘블레이드&소울 레볼루션’ 기자간담회를 개최한다고 밝혔다. 넷마블 제공 이미지‘블레이드앤소울 레볼루션’은 엔씨소프트 간판 무협 PC온라인 기반게임 MMORPG ‘블레이드앤소울’의 방대한 세계관을 기반한 콘텐츠로 2017년 시연 버전 공개 후 기대작으로서 관심을 받고 있다.넷마블은 올해 출시한 다른 게임들의 성과 부진, 기존 게임의 실적 감소와 맞물려 주가가 하락을 했었다. 넷마블 2분기 영업이익(622억원)은 지난해 동기대비 40.8% 감소했다.  넷마블은 내수 시장 기준으론 2016년 ‘리니지2 레볼루션’을 제외하면 큰 히트작을 배출하지 못했다.손봉석 기자 paulsohn@kyunghyang.com▶ [스포츠경향 인기 무료만화 보기]▶ [지금 옆사람이 보고있는 뉴스]©스포츠경향(sports.khan.co.kr), 무단전재 및 재배포 금지스포츠경향 관련뉴스해당 언론사에서 선정하며 언론사 페이지(아웃링크)로 이동해 볼 수 있습니다.[단독] 서동주 썸남 알고보니…\'IT 억만장자\' 찰리 치버권아솔, 맥그리거 또 맹비난 ""끝까지 쓰레기""…왜?\'사고로 친구 인생 박살\' 음주운전 처벌 강화 여론 확대[화보] \'머슬마니아 새로운 꽃\'으로 핀 우정원[아는 변호사] \'숨바꼭질\' 남자 목욕탕 쳐들어간 이유리, 실제라면 어떤 처벌 받을까?좋아요0훈훈해요0슬퍼요0화나요0후속기사 원해요0기사제공 :']"
5,NC soft, 2018-10-0809:45,아시아경제 ,"[특징주]넷마블, 신작 출시 기대감에 강세",https://finance.naver.com/news/news_read.nhn?article_id=0004329663&office_id=277&mode=search&query=엔씨&page=1,"['       [특징주]넷마블, 신작 출시 기대감에 강세      기사입력2018-10-08 09:45기사원문좋아요훈훈해요좋아요 평가하기공감좋아요0훈훈해요0슬퍼요0화나요0후속기사 원해요0댓글 [아시아경제 구은모 기자] 넷마블이 강세다. 신작 출시 기대감이 반영된 것으로 보인다.8일 오전 9시43분 현재 넷마블은 전 거래일 대비 5.11%(6000원) 오른 12만3500원에 거래되고 있다.넷마블은 오는 11일 서울 구로구 신도림 쉐라톤호텔에서 ‘블레이드&소울 레볼루션’의 기자간담회를 개최한다고 밝혔다. ‘블레이드&소울 레볼루션’은 엔씨소프트의 PC MMORPG ‘블레이드&소울’의 지적재산권(IP)를 활용한 모바일게임이다.김민정 하이투자증권 연구원은 이날 “‘블레이드&소울 레볼루션’이 출시되면 2016년 12월 ‘L2R’이 출시된 이후 2년만에 MMORPG 신작이 출시되는 것으로 주가 상승 요인으로 작용하기에 충분하다”고 평가했다.구은모 기자 gooeunmo@asiae.co.kr▶ 네이버 홈에서 \'아시아경제\' 뉴스 확인하기▶ 재미와 신기 \'과학을읽다\' ▶ 놀라운 \'군사이야기\'<ⓒ세계를 보는 창 경제를 보는 눈, 아시아경제 무단전재 배포금지>아시아경제 관련뉴스해당 언론사에서 선정하며 언론사 페이지(아웃링크)로 이동해 볼 수 있습니다.\'섹스로봇의 성매매\' 불법일까? \'논란\'로또 1등, 한 판매점에서 5건…어디길래?""성관계 영상 있으면 평생 내꺼지?""…협박 논란""북한이 지금 우리 핵공격하는 것이냐"" 美 발칵""대통령 얼굴 넣은 우표, 독재정권 이후 처음""좋아요0훈훈해요0슬퍼요0화나요0후속기사 원해요0기사제공 :']"
