,회사명,날짜,언론사,기사제목,링크,본문
0,NC soft, 2018-01-0419:41,서울경제 ,[서울경제TV][투데이포커스] 올해 유망한 증시 종목·펀드는,https://finance.naver.com/news/news_read.nhn?article_id=0003189834&office_id=011&mode=search&query=엔씨&page=1,"['       [서울경제TV][투데이포커스] 올해 유망한 증시 종목·펀드는      기사입력2018-01-04 19:41기사원문좋아요훈훈해요좋아요 평가하기공감좋아요0훈훈해요0슬퍼요0화나요0후속기사 원해요0댓글 “삼성전자 연간 기준 사상 최대 실적 달성할 것”네이버 유망… 클라우드 컴퓨팅·AI 플랫폼 사업 등모험자본 육성 정책에 중소형 내수주 펀드 주목[서울경제TV] [앵커]올 들어 우리 증시가 오름세를 이어가면서 새해 새로운 재테크로 주식 투자를 생각하는 분들이 계실 텐데요. 오늘 투데이포커스에서는 증권가에서 꼽은 2018년 유망 증시 종목과 펀드에 대해 금융증권부 김성훈기자와 이야기 나눠보겠습니다. [앵커]김기자, 지난해부터 우리 증시가 호황을 보이면서 주식 투자에 대한 관심도 늘고 있는데요. 올해 유망주로 떠오르는 종목에는 어떤 것들이 있을까요.[기자]네 증권가에서 한목소리로 추천하는 올해 유망 종목은 삼성전자입니다.매번 유망주로 꼽히는 삼성전자이지만 실제로 삼성전자 주가는 지난해 말 기준으로 1년 만에 40% 이상 올랐습니다. 미래에셋대우는 “올해 반도체 시장 공급 과잉에 대한 걱정은 기우”라며 “삼성전자가 연간 기준 사상 최대 실적을 무난히 달성할 것”이라고 내다봤습니다.IBK투자증권도 “반도체 부문에서 10% 넘게 이익이 늘고, OLED 부문 수익성도 본격적으로 개선될 것”이라고 전망했습니다. 자사주 소각·배당확대 등 적극적인 주주 환원책도 삼성전자의 매력을 높이는 요인입니다.삼성전자를 필두로 올해도 IT 종목이 강세를 보일 것이라는 의견이 많습니다.네이버도 전망이 밝은 종목으로 꼽힙니다. 삼성증권은 “올해부터 클라우드 컴퓨팅 사업이 본격화되고, 인공지능 음성 플랫폼 ‘클로바’의 생태계가 확대될 것”이라며 네이버를 유망 종목으로 추천했습니다.광고 매출도 크게 늘 것으로 예상돼 증권가에선 올해 네이버의 영업이익이 지난해에 비해 20% 이상 오를 것이라는 분석이 나옵니다.이 외에도 SK텔레콤·삼성전기·엔씨소프트가 IT업종 유망주로 떠오르고 있습니다.특히 SK텔레콤의 경우 5G 상용화에 대한 기대감과 SK하이닉스·SK플래닛 등 자회사의 실적 개선으로 주가 상승이 예상된다는 것이 전문가들의 의견입니다.[앵커]그렇군요. IT 외에 주목해야 할 종목을 꼽는다면 어떤 것들이 있을까요?[기자]IT가 견인한 경기 개선과 증시 호황이 다른 업종으로 확대될 가능성도 제기되고 있는데요.한국투자증권은 자율주행차의 핵심 기술인 첨단운전자보조시스템(ADAS) 시장의 성장세와 A/S 사업부의 수익성 개선을 들며 ‘현대모비스’를 유망 종목으로 꼽았습니다. NH투자증권은 ‘현대건설기계’를 추천하면서 “신흥국에서 대형 굴착기 노후화로 신제품 수요가 급증하고 있기 때문”이라고 밝혔습니다. 이밖에는 ‘포스코’가 유망주로 꼽혔고 화학·철강 업종도 전망이 밝을 것으로 예상됩니다.[앵커]문재인 정부의 기조에 영향을 받는 정책 수혜주도 주목할 만 하다고요? [기자]그렇습니다. 문재인 정부의 내수 활성화·4차산업 혁명 기조로 수혜를 받을 가능성이 높은 종목들도 강세를 보일 것으로 예상되는데요.투자 전문가들은 “실적 개선이 확실한 중소형 내수주에도 관심을 기울여야 한다”면서 대표적으로 콘텍트렌즈 제조사인 ‘인터로조’를 유망주로 추천했습니다.제약바이오주 중에서는 한미약품과 LG화학 주가가 오를 것으로 예측됩니다.특히 한미약품의 경우 실적 안정성과 R&D분야의 성과에 대한 기대감이 상승 전망의 근거로 제시되고 있습니다. 아모레퍼시픽도 유망주로 꼽히는데, 북미·유럽 등 선진국 시장 진출로 실적이 빠르게 개선되고 있고, 중국과의 관계가 개선되면서 수익성이 더 커질 것이라는 분석입니다.[앵커]정부에 대한 기대가 큰 만큼 올해는 정책 수혜주가 큰 관심을 받는 것 같은데요. 이 정책 수혜주를 중심으로 구성한 펀드도 유망하다고요?[기자]그렇습니다. 정부의 모험자본 육성 정책과 이달 중 발표될 코스닥 활성화 방안에 대한 기대로 중소형 내수주 중심의 펀드가 주목을 받고 있습니다. 중소형주에 70% 이상 투자하는 ‘NH Amundi Allset 성장중소형주’의 경우 1,000억원 이상 중소형주 펀드 중에서 3년 이상 수익률이 가장 좋습니다. 또 ‘신영마라톤중소형주펀드’와 ‘하이 중소형주플러스증권자1호’도 유망 펀드로 꼽힙니다.4차산업 관련 펀드로는 ‘피델리티글로벌테크놀로지’가 있습니다. 이 펀드는 반도체·인공지능·자율주행차·증강현실·가상현실·소프트웨어 등 전 세계 4차 산업 관련 기업에 투자하는 펀드로 최근 1년 수익률이 30%에 달합니다. 한국투자신탁운용의 ‘한국의제4차산업혁명증권자1호’ 펀드도 미래 자동차·의료산업·인공지능 등 국내 4차 산업 기업에 투자하는 펀드입니다./김성훈기자 bevoice@sedaily.com[영상편집 이한얼][서울경제 바로가기]이제 주식시세도 서울경제에서 확인하세요 [바로가기▶]서울경제의 모든 연재물!... 서경Cube [바로가기▶]저작권자 ⓒ 서울경제, 무단 전재 및 재배포 금지서울경제 관련뉴스해당 언론사에서 선정하며 언론사 페이지(아웃링크)로 이동해 볼 수 있습니다.""냉정히 생각해봤는데···"" 제명 당한 류여해 \'대반격\'\'주 35시간 근무 돌입\' 신세계, 흡연실 몽땅 없앤 사연\'라디오스타\' 정주리 남편 비포 앤 애프터 공개...""사기 결혼""태양 집 매입 가격 42억, 티비만 3700만 원 ""승리가 음악 크게 틀어 독립"" 민효린과 신혼집은?[SE★이슈] 낸시랭-전준주, 계속되는 의혹···전자발찌에 주거침입까지좋아요0훈훈해요0슬퍼요0화나요0후속기사 원해요0기사제공 :']"
1,NC soft, 2018-01-0419:12,파이낸셜뉴스 ,'게임 빅3' 대항마로 떠오른 카카오게임즈,https://finance.naver.com/news/news_read.nhn?article_id=0003937224&office_id=014&mode=search&query=엔씨&page=1,"['       \'게임 빅3\' 대항마로 떠오른 카카오게임즈      기사입력2018-01-04 19:12기사원문좋아요훈훈해요좋아요 평가하기공감좋아요0훈훈해요0슬퍼요0화나요0후속기사 원해요0댓글신작 \'프렌즈마블\' 인기몰이.. 보드게임 \'브루마블\'과 비슷친숙한 캐릭터가 흥행 코드.. 구글플레이스토어 매출 8위빅3가 장악한 톱10 중 유일                     넥슨과 넷마블게임즈, 엔씨소프트 등 게임 \'빅3\'가 모바일게임 시장을 독식하고 있는 가운데 카카오게임즈가 \'빅3\'를 견제할 수 있는 대항마로 부상하고 있다.카카오게임즈가 지난달 출시한 신작게임 \'프렌즈마블\'이 \'빅3\' 게임들과 어깨를 나란히하며 흥행궤도에 진입했다. 게임 퍼블리싱(배급) 사업을 강화하고 올해 잇따라 신작게임을 선보일 예정인 카카오게임즈가 \'빅4\'로 진입할 수 있을지 관심이 집중되고 있다.4일 구글플레이스토어에 따르면 국내 게임 매출 순위 톱10 가운데 9개 게임이 \'빅3\'의 게임이다. 나머지 1개가 카카오게임즈의 \'프렌즈마블\'이다. 이 게임은 이날 기준 매출 순위 8위를 기록하고 있다.1~3위는 \'빅3\'가 모두 차지했다. 1위가 엔씨소프트의 \'리니지M\', 2위가 넷마블의 \'리니지2 레볼루션\', 3위는 넥슨의 \'오버히트\'다. 나머지 순위도 대부분 넷마블과 넥슨 등의 게임으로 채워졌다. 특히 넷마블은 톱10에 5개 게임이 진입해 모바일게임 강자임을 증명하고 있다.이 중 눈에 띄는 게임이 카카오게임즈의 \'프렌즈마블\'이다.이 게임은 지난달 출시된 신작게임인데 꾸준히 이용자가 늘면서 톱10에 진입했다. 주사위를 던져서 나온 숫자만큼 이동한 뒤 도착한 나라의 건물을 산 뒤, 상대방이 내 나라에 도착하면 통행료를 받는 보드게임 \'브루마블\'과 비슷한 방식의 모바일게임이다. \'프렌즈마블\'만의 특징은 카카오프렌즈의 대표 캐릭터들이 총출동한다는 점이다. 라이언, 어피치, 무지 등 카카오프렌즈 캐릭터들이 이용자들에게 익숙하게 다가온다.앞으로 카카오게임즈는 이같은 \'카카오프렌즈\' 캐릭터들을 활용한 다양한 게임들을 선보일 계획이다. 이미 프렌즈팝, 프렌즈팝콘, 프렌즈사천성 등 프렌즈 캐릭터를 활용한 게임을 서비스 중이며 올해는 레이싱게임인 \'프렌즈레이싱\' 출시도 준비하고 있다. 남궁훈 카카오게임즈 대표는 ""프렌즈 지식재산권(IP)을 활용한 다양한 시도들을 앞으로도 활발히 보여줄 것""이라며 ""향후 프렌즈게임들을 연계한 패키지 방식의 수익모델 도입 등도 고민하고 있다""고 전했다.아울러 카카오게임즈는 올해 다양한 퍼블리싱(배급) 게임들도 선보일 계획이다. \'그랜드체이스\', \'드래곤네스트M\', \'블레이드2\', \'앙상블스타즈\' 등 다양한 퍼블리싱 게임들이 줄줄이 출시를 기다리고 있다. 올해 4000억원 가량의 매출을 기록한 것으로 추산되는 카카오게임즈가 PC온라인게임 \'배틀그라운드\' 매출과 출시하는 모바일게임들의 매출까지 더해지면 내년에는 연매출 5000억원 돌파도 무난할 것이라는 전망도 나오고 있다. 연내 상장작업까지 마무리되면 인수합병(M&A) 등을 추진할 수 있는 여력도 생길 것으로 예상된다.jjoony@fnnews.com 허준 기자     ▶ 세상의 모든 골 때리는 이야기 \'fn파스\'▶ 속보이는 연예뉴스 fn스타  ※ 저작권자 ⓒ  파이낸셜뉴스. 무단 전재-재배포 금지파이낸셜뉴스 관련뉴스해당 언론사에서 선정하며 언론사 페이지(아웃링크)로 이동해 볼 수 있습니다.먹다보니, 지방간.. 당뇨 등 만성질환자 더 위험새해 통신비 절감 원한다면...이것만은 체크해보세요2018년 4대기업 운세는? 재미로 보는 \'기업 토정비결\'\'청와대 오역 논란\' 확인해보니…""청와대 해석 맞다"" 더디플로맷유방암 진단받고 가슴절제했는데...알고보니 오진좋아요0훈훈해요0슬퍼요0화나요0후속기사 원해요0기사제공 :']"
2,NC soft, 2018-01-0414:48,파이낸셜뉴스 ,"게임 '빅3' 독식 모바일게임 시장, 카카오게임즈 두각",https://finance.naver.com/news/news_read.nhn?article_id=0003936978&office_id=014&mode=search&query=엔씨&page=1,"['       게임 \'빅3\' 독식 모바일게임 시장, 카카오게임즈 두각      기사입력2018-01-04 14:48기사원문좋아요훈훈해요좋아요 평가하기공감좋아요0훈훈해요0슬퍼요0화나요0후속기사 원해요0댓글  넥슨과 넷마블게임즈, 엔씨소프트 등 게임 \'빅3\'가 모바일게임 시장을 독식하고 있는 가운데 카카오게임즈가 \'빅3\'를 견제할 수 있는 대항마로 부상하고 있다.  카카오게임즈가 지난달 출시한 신작게임 \'프렌즈마블\'이 \'빅3\' 게임들과 어깨를 나란히하며 흥행궤도에 진입했다. 게임 퍼블리싱(배급) 사업을 강화하고 올해 잇따라 신작게임을 선보일 예정인 카카오게임즈가 \'빅4\'로 진입할 수 있을지 관심이 집중되고 있다.  4일 구글플레이스토어에 따르면 국내 게임 매출 순위 톱10 가운데 9개 게임이 \'빅3\'의 게임이다. 나머지 1개가 카카오게임즈의 \'프렌즈마블\'이다. 이 게임은 이날 기준 매출 순위 8위를 기록하고 있다.  1~3위는 \'빅3\'가 모두 차지했다. 1위가 엔씨소프트의 \'리니지M\', 2위가 넷마블의 \'리니지2 레볼루션\', 3위는 넥슨의 \'오버히트\'다. 나머지 순위도 대부분 넷마블과 넥슨 등의 게임으로 채워졌다. 특히 넷마블은 톱10에 5개 게임이 진입해 모바일게임 강자임을 증명하고 있다.         1월 4일 기준 구글 플레이스토어 게임 매출 순위. 톱10에 카카오게임즈의 프렌즈마블을 제외한 9개 게임이 게임업계 \'빅3\'의 게임으로 채워져 있다.   이 중 눈에 띄는 게임이 카카오게임즈의 \'프렌즈마블\'이다.  이 게임은 지난달 출시된 신작게임인데 꾸준히 이용자가 늘면서 톱10에 진입했다. 주사위를 던져서 나온 숫자만큼 이동한 뒤 도착한 나라의 건물을 산 뒤, 상대방이 내 나라에 도착하면 통행료를 받는 보드게임 \'브루마블\'과 비슷한 방식의 모바일게임이다. \'프렌즈마블\'만의 특징은 카카오프렌즈의 대표 캐릭터들이 총출동한다는 점이다. 라이언, 어피치, 무지 등 카카오프렌즈 캐릭터들이 이용자들에게 익숙하게 다가온다.  앞으로 카카오게임즈는 이같은 \'카카오프렌즈\' 캐릭터들을 활용한 다양한 게임들을 선보일 계획이다. 이미 프렌즈팝, 프렌즈팝콘, 프렌즈사천성 등 프렌즈 캐릭터를 활용한 게임을 서비스 중이며 올해는 레이싱게임인 \'프렌즈레이싱\' 출시도 준비하고 있다. 남궁훈 카카오게임즈 대표는 ""프렌즈 지식재산권(IP)을 활용한 다양한 시도들을 앞으로도 활발히 보여줄 것""이라며 ""향후 프렌즈게임들을 연계한 패키지 방식의 수익모델 도입 등도 고민하고 있다""고 전했다.  아울러 카카오게임즈는 올해 다양한 퍼블리싱(배급) 게임들도 선보일 계획이다. \'그랜드체이스\', \'드래곤네스트M\', \'블레이드2\', \'앙상블스타즈\' 등 다양한 퍼블리싱 게임들이 줄줄이 출시를 기다리고 있다. 올해 4000억원 가량의 매출을 기록한 것으로 추산되는 카카오게임즈가 PC온라인게임 \'배틀그라운드\' 매출과 출시하는 모바일게임들의 매출까지 더해지면 내년에는 연매출 5000억원 돌파도 무난할 것이라는 전망도 나오고 있다. 연내 상장작업까지 마무리되면 인수합병(M&A) 등을 추진할 수 있는 여력도 생길 것으로 예상된다.   jjoony@fnnews.com 허준 기자   ▶ 세상의 모든 골 때리는 이야기 \'fn파스\'▶ 속보이는 연예뉴스 fn스타  ※ 저작권자 ⓒ  파이낸셜뉴스. 무단 전재-재배포 금지파이낸셜뉴스 관련뉴스해당 언론사에서 선정하며 언론사 페이지(아웃링크)로 이동해 볼 수 있습니다.먹다보니, 지방간.. 당뇨 등 만성질환자 더 위험새해 통신비 절감 원한다면...이것만은 체크해보세요2018년 4대기업 운세는? 재미로 보는 \'기업 토정비결\'\'청와대 오역 논란\' 확인해보니…""청와대 해석 맞다"" 더디플로맷유방암 진단받고 가슴절제했는데...알고보니 오진좋아요0훈훈해요0슬퍼요0화나요0후속기사 원해요0기사제공 :']"
3,NC soft, 2018-01-0413:00,프레시안 ,"익산시, 제3일반산단 분양계약 체결 잇따라",https://finance.naver.com/news/news_read.nhn?article_id=0002048265&office_id=002&mode=search&query=엔씨&page=1,"['       익산시, 제3일반산단 분양계약 체결 잇따라      기사입력2018-01-04 13:00기사원문좋아요훈훈해요좋아요 평가하기공감좋아요0훈훈해요0슬퍼요0화나요0후속기사 원해요0댓글대성메디칼, 디에스티홀릭, 비앤디네트웍스, 신안창호산업  투자 협약\xa0[배종윤 기자(=익산)]\xa0ⓒ익산시2018년 연초부터 전북 익산시 제3일반산단에 분양계약이 잇따라 체결돼 익산시 경제활성화에 청신호가 켜졌다.익산시는 4일 시청 상황실에서 정헌율 익산시장, 소병홍 익산시의회 의장, 대성메디칼 양용호 대표, 디에스티홀릭 문익주 대표, 비앤디네트웍스 김영 대표, 신안창호산업 서숙영 이사가 참석한 가운데 익산 제3일반산업단지 투자를 위한 분양계약 및 투자협약을 체결했다.이날 분양계약을 체결한 대성메디칼은 국내 최초로 ‘알콜솜’을 개발한 업체로 화장솜, 탈지면, 알콜솜을 화장품 회사와 의료기관 등에 납품하고 있는 강소기업이다. 제3산단 6254㎡ 부지에 20여억원을 투자해 의약외품 제조, 제단가공 제조설비 및 목화재배연구실을 구축 원단 가공해 사업효율화 및 물류비 절감을 통해 기 입주업체이자 자회사인 엔씨와의 시너지효과를 극대화한다는 계획이다. 디에스티홀릭은 LED조명 전문제조업체로서 제3산단 3,300㎡ 부지에 20여억원을 투자할 계획이다. 전주비전대학교 창업보육센터에 입주해 다년간 LED 평판조명, 다운라이트 등 기술개발에 집중하고 작년 중소기업청 창업성장기술개발사업을 완료했다. 특히 아파트 등 생활조명과 공장조명, 식물공장컨설팅에 까지 사업영역을 확장하기 위해 익산제3산단 투자를 결정하게 되었다.또한, 비앤디네트웍스는 아스팔트, 건물외벽 등에 도포해 태양광과 반응해 각종 오염물질을 무해한 물질로 변화시켜주는 친환경 소재인 국내최초 \'1액형 광촉매(이산화티타늄,TiO2)\' 제조업체다. 제3산단 기 투자(6600㎡) 외에 추가로 인접 3300㎡ 부지에 30여억원을 투자, 광민감제 투여 후 레이저를 조사해 치주염을 치료하는 광치료 연고제 및 치료기기를 생산할 계획이다. 특히 현재 동물테스트를 완료하고 임상실험 준비중이다. 기존 물리적인 치료법 대비 빠르고 쉽게 치료가 가능하고 관리가 용이해 상업화를 통해 국내 및 해외 시장 개척에 나설 계획이다.신안창호산업은 제3산단 3,300㎡ 부지에 12억원을 투자할 예정으로 PVC, 알루미늄 창호를 제작, 조립해 건축물 건설현장에 가격경쟁력을 갖춘 창호를 공급한다는 계획이다. 30여명의 신규 고용 창출이 기대된다. 특히 기반시설을 완비하고도 상대적으로 저렴한 분양가 등 입지여건이 우수한 산업단지 투자를 통해 지역경제발전에 이바지 한다는 계획이다.이들 4개 업체는 총 80여억원을 투자해 90여개의 신규 일자리 창출이 예상된다. 올해 상반기 착공해 하반기에는 가동을 계획하고 있어 업체의 신속한 투자를 통해 산업단지 활성화에도 큰 도움이 될 것으로 전망된다.정헌율 시장은 “어려운 경제 상황에도 불구하고 익산의 발전가능성을 보고 투자를 결정해 주신데 대해 진심으로 감사를 드린다”며 “앞으로도 다양한 행정적 지원으로 더 많은 기업들이 익산시에 투자할 수 있도록 노력, 인구증대와 지역경제 활성화로 이어질 수 있도록 최선을 다하겠다”고 말했다.배종윤 기자(=익산) (baejy1113@daum.net)▶독자가 프레시안을 지킵니다[프레시안 조합원 가입하기]▶네이버 모바일 메인화면에서 프레시안을 만나세요[프레시안 채널 설정하기]▶성역 없는 언론 프레시안에 제보하기Copyrightsⓒ PRESSian.com 무단전재 및 재배포금지프레시안 관련뉴스해당 언론사에서 선정하며 언론사 페이지(아웃링크)로 이동해 볼 수 있습니다.북한 선수단이 평창행 KTX 타는 걸 상상한다""15살만 됐어도, 시신이 불에 타는 걸 막았을 텐데…\'새해 첫날, 수문 연 낙동강에서 수달을 만나다그들이 빨간불을 켰다...반월공단은 누가 움직이는가?朴정권 황태자 최경환, \'할복하겠다\'더니 결국 구속좋아요0훈훈해요0슬퍼요0화나요0후속기사 원해요0기사제공 :']"
