,회사명,날짜,언론사,기사제목,링크,본문
0,NC soft, 2018-02-1414:34,부산일보 ,"엔씨 '리니지M', 설 이벤트 2종 진행…'아이템 컬렉션' 콘텐츠 추가",https://finance.naver.com/news/news_read.nhn?article_id=0000780648&office_id=082&mode=search&query=엔씨&page=1,"['       엔씨 \'리니지M\', 설 이벤트 2종 진행…\'아이템 컬렉션\' 콘텐츠 추가      기사입력2018-02-14 14:34기사원문좋아요훈훈해요좋아요 평가하기공감좋아요0훈훈해요0슬퍼요0화나요0후속기사 원해요0댓글    리니지M, 설 이벤트 2종 진행.(엔씨소프트 제공) 엔씨소프트의 모바일 MMORPG(다중접속역할수행게임) 리니지M이 설 이벤트 2종을 시작한다고 14일 밝혔다.리니지M을 즐기는 모든 이용자는 설 이벤트 2종에 참여해 다양한 아이템을 받을 수 있다. 이날부터 새로운 게임 콘텐츠 \'아이템 컬렉션\'도 즐길 수 있다.엔씨는 \'설 연휴, 리니지M과 달리자!\' 이벤트를 오는 21일까지 진행한다. 매일 오전 10시 리니지M에 접속한 이용자는 우편함에서 다양한 아이템(드래곤의 다이아몬드 조각, 버림받은 자들의 땅 충전석 등)을 받을 수 있다.\'새해 복 수집 대소동\' 이벤트는 오는 28일까지 열린다. 이용자는 특수 던전 3종(버림받은 자들의 땅, 몽환의 섬, 고대 정령의 무덤)에서 몬스터를 사냥하고 \'복 주머니\'를 얻을 수 있다. 복 주머니는 이벤트 아이템(큰집의 솥뚜껑, 작은집의 뒤집개, 우리집 보자기 등)으로 교환할 수 있다.리니지M은 새로운 콘텐츠 \'아이템 컬렉션\'을 추가했다. 이용자는 지정된 아이템을 등록해 캐릭터의 능력치(데미지 리덕션, 근/원거리 데미지 등)를 높일 수 있다. 아이템 컬렉션은 70여 종이다. 강화 효과는 계정 내 모든 캐릭터에 적용된다. 이용자는 \'새해 복 수집 대소동\'에서 모은 이벤트 아이템으로 \'작은집 용사 세트\', \'우리집 용사 세트\' 등 특별한 아이템 컬렉션 10종을 제작할 수 있다.자세한 내용은 리니지M 홈페이지에서 확인할 수 있다.\xa0박철중 기자 cjpark@ 부산일보 관련뉴스해당 언론사에서 선정하며 언론사 페이지(아웃링크)로 이동해 볼 수 있습니다.워너원 소속사 ""강다니엘 관련 허위사실, 강경대응 할 것""(공식)신동욱 ""밸런타인 데이, 안중근 의사 사형선고 받은날...초콜릿 상술에 속지 말자""고속도로교통상황, 귀성행렬 시작...부산 5시간40분·광주4시간20분""고통 받는 분들께 위로를"" 현직 간호사 음원 발표 \'천사의 손\'靑, \'암호화폐\' 청원 답변...""거래 불법 막고, 블록체인 육성""좋아요0훈훈해요0슬퍼요0화나요0후속기사 원해요0기사제공 :']"
1,NC soft, 2018-02-1413:38,머니투데이 ,설 이후 증시 무게 잡아줄 상장사 1분기 실적은?,https://finance.naver.com/news/news_read.nhn?article_id=0004009766&office_id=008&mode=search&query=엔씨&page=1,"['       설 이후 증시 무게 잡아줄 상장사 1분기 실적은?      기사입력2018-02-14 13:38기사원문좋아요훈훈해요좋아요 평가하기공감좋아요0훈훈해요0슬퍼요0화나요0후속기사 원해요0댓글 [머니투데이 반준환 기자] [1분기 영업이익 전망치 ""전년동기比 11.25% 개선""…반도체·IT·금융·철강·유통·증권 \'쾌청\']설 이후 증시 향방에 시장의 관심이 집중된다. 시장은 안정을 찾아가고 있으나 미국 기준금리 인상 등 변수가 많고, 연휴 기간 예정된 이벤트도 많다. 외풍에 흔들리지 않으려면 무게추가 있어야 하는데 상장기업의 1분기 실적이 그 역할을 할 것으로 보인다. 일단 전망은 나쁘지 않은데 원/달러 환율변동이 변수로 거론된다.◇상장사 194곳 1분기 영업이익 50.8조…전년比 11.25%↑= 14일 금융정보분석업체 와이즈에프엔에 따르면 삼성 코스피 상장사 194곳의 1분기 영업이익 전망치는 50조8187억원으로 집계됐다. 전년 동기대비 11.25% 증가한 수치다. 이번 분석은 증권사 3곳 이상에서 내놓은 실적전망이 있는 기업을 대상으로 했다. 삼성전자, SK하이닉스, 한국전력, 포스코, KB금융, 현대차, SK이노베이션, LG화학 등 주요 기업이 포함됐다. 139개 기업이 지난해 1분기보다 영업이익이 개선되고 55곳은 감소할 것으로 전망됐다. 상장사 10곳 중 7곳은 실적이 좋다는 얘기다. 업종별로는 IT하드웨어 실적개선이 두드러지고 반도체와 소프트웨어, 헬스케어, 운송, 산업재, 기계, 미디어·교육, 필수소비재, 호텔레저, 증권 등이 어닝서프라이즈(깜짝실적)를 기록할 것으로 전망됐다. 반면 조선과 보험, 디스플레이, 자동차, 소매유통, 에너지, 비철목재 업종은 전망이 좋지 않았다. 삼성전자 1분기 영업이익은 지난해보다 48% 증가한 14조6857억원으로 예상됐고 SK하이닉스는 76% 늘어난 4조3633억원으로 전망됐다. 반도체 성장세가 둔화되고 있지만 아직 추세가 꺾이지는 않았다는 것이다. ◇반도체·IT·금융·철강·유통·증권 \'쾌청\' vs 조선·보험·디스플레이·車 \'흐림\' = 삼성바이오로직스는 대규모 의약품 수출계약에 힘입어 어닝 서프라이즈가 발생할 것으로 예상됐고 게임 신작흥행이 기대되는 엔씨소프트, 면세점 수익구조 개선과 외국인 관광객 유입 수혜 가능성이 있는 호텔신라도 어닝 서프라이즈 군으로 분류됐다. 이밖에 신세계인터내셔널, 롯데정밀화학, 셀트리온, CJ CGV, GS건설, 하나투어, 아시아나항공, 휠라코리아, 화승엔터프라이즈, OCI, 잇츠한불, 삼양식품, 코스맥스, 코오롱인더, KB금융, 신세계푸드, CJ제일제당, 한화손해보험, 한국타이어월드와이드, 종근당, F&F, 락앤락, 오뚜기 등도 실적개선이 예상됐다. 반면 현대자동차와 현대중공업, LG전자, LG디스플레이, SK이노베이션, 대우조선해양, LIG넥스원, 현대로템, 대우건설, 풍산, 롯데쇼핑, 현대백화점, 우리은행, 한국금융지주 등은 실적이 좋지 않을 것으로 전망됐다. 전반적인 상황은 나쁘지 않지만, 1분기 실적이 증시에 얼마나 힘을 불어넣을지 두고 봐야 한다. 기업들이 지난해 분기별로 사상 최고 수준의 성적표를 내놓은 탓에 올해는 웬만한 실적이 아니면 긍정적인 평가를 받기 어려워졌기 때문이다. 삼성전자는 지난해 4분기 15조1469억원이라는 사상 최대의 영업이익을 올렸지만, 시장 눈높이(15조8340억원)에 미치지 못했다는 평가를 받으며 \'어닝 서프라이즈\'가 아닌 \'쇼크\'의 멍에를 썼다. 올해 1분기도 상황이 비슷할 수 있다. ◇실적 좋지만 높아진 눈높이 맞출지…환율 변수도 살펴봐야= 또 다른 문제점은 1분기 영업이익에 대한 시장 기대치가 낮아지고 있다는 점이다. 와이즈에프엔을 통해 집계된 상장사 194곳의 1분기 영업이익 컨센서스는 1월 초 53조5280억원에서 1월 말에는 51조4257억원으로 내려갔고 2월 들어서는 50조8187억원으로 더 떨어졌다. 올 들어 원/달러 환율이 한때 1060원을 깨고 내려가는 등 수출에 부정적 영향을 미칠 수 있는 변수가 커졌고, 미국 금리인상이 본격화되면서 세계 경기도 성장속도가 늦춰질 수 있다는 우려가 제기됐다.허필석 마이다스에셋자산운용 대표는 ""1분기 실적전망에는 환율변동이 아직 반영되지 않았다""며 ""기업마다 환율영향과 환헤지 전략이 달라 증권사들이 전망에 어려움을 겪는데, 최종 실적은 뚜껑을 열어봐야 할 것""이라고 말했다. ▶빵~ 뜨는 따끈한 기사▶무료 만화 보고 선물도 받고~ ▶치어리더 vs 레이싱걸 반준환 기자 abcd@ 머니투데이 관련뉴스해당 언론사에서 선정하며 언론사 페이지(아웃링크)로 이동해 볼 수 있습니다.제주 게스트하우스 20대女 살해 용의자 공개수배""흠잡을 것 없어 문제""… 전세계 쏟아지는 평창 찬사[단독]日 쇼트트랙 선수, 불시검문서 도핑 양성 반응GM 사장 ""군산外 나머지 공장 3곳도 조만간 결정""LG화학 1조원 규모 회사채 발행좋아요0훈훈해요0슬퍼요0화나요0후속기사 원해요0기사제공 :']"
2,NC soft, 2018-02-1408:28,헤럴드경제 ,게임 수출 ‘40억달러 시대’…신시장 ‘태국’ 정조준,https://finance.naver.com/news/news_read.nhn?article_id=0001354367&office_id=016&mode=search&query=엔씨&page=1,"['       게임 수출 ‘40억달러 시대’…신시장 ‘태국’ 정조준      기사입력2018-02-14 08:28기사원문좋아요훈훈해요좋아요 평가하기공감좋아요0훈훈해요0슬퍼요0화나요0후속기사 원해요0댓글- 태국 2020년 10억달러 게임시장. 유료결제 이용자 비중도 높아- 중국 ‘한한령’ 막힌 게임사들…신흥시장 태국 대안으로[헤럴드경제=박세정 기자] 수출 효자 산업으로 자리매김한 게임업계의 수출규모가 올해 첫 40억 달러를 넘어설 것으로 예상되는 가운데, 신흥 시장 태국이 급부상하고 있다. 중국 시장 문턱이 좀처럼 낮아지지 않고 있는 상황에서 동남아시아가 대안으로 부상하고 있는데 따른 것이다. 동남아 최대 시장인 태국을 공략하기 위한 주요 게임사들의 움직임도 본격화되고 있다.14일 관련업계에 따르면 주요 게임사들이 수출 신흥 시장으로 태국을 주시하고 있다.무엇보다 시장에서는 태국의 게임산업 성장세에 주목하고 있다.미국 시장조사업체 뉴주(Newzoo)는 2016년 4억8600만달러 규모였던 태국 시장이 올해 7억3100만달러로 성장할 것으로 내다봤다. 2020년에는 10억달러를 넘어설 것으로 전망됐다.게임에 지갑을 여는 구매 의사를 가진 이용자 비중이 높다는 점도 게임업계가 태국 시장에 눈독을 들이는 이유다.태국의 게임이용자 수는 전체 인구의 약 27%인 1830만명이다. 모바일게임의 유료결제 이용자 수가 약 900만명으로 전체 게임 이용자 수의 절반에 달한다. 지난해 국내의 경우 모바일게임 유료 결제 이용자 비중은 25%다.특히 국내 게임사들은 한한령(限韓令, 중국 내 한류 금지) 여파로 중국 시장 진입이 여전히 녹록치 않으면서 태국을 필두로 한 신흥시장을 대안으로 삼고 있다.현재 국내 주요 게임사들은 대표작의 중국 판호(서비스 허가)가 통과되지 못해 중국 진입에 속도를 내지 못하고 있는 상태다.넷마블의 경우 ‘리니지2 레볼루션’이 단일게임 1조원 매출을 기록하며 흥행했지만 지난 2016년 12월 중국 시장 판호를 신청한지 1년이 넘도록 허가가 나지 않아 중국 진출길이 막혀있다. 엔씨소프트도 작년 1월 ‘리니지 레드나이츠’의 중국 판호를 신청했으나 아직 통과하지 못했다.중국의 대안으로 태국을 공략하기 위한 국내 게임사의 공략도 더욱 속도를 낼 전망이다.넥슨은 일찌감치 태국 현지 게임 유통사를 인수한 후 ‘넥슨 타일랜드’를 설립, 태국을 동남아 신흥시장의 거점으로 삼고 있다. 엔씨소프트는 이달부터 캐주얼 모바일 게임 ‘팡야 모바일’을 태국에 출시하는 등 신규 게임 진입을 본격화한다.지난해 태국 최대 게임쇼(TGS)에서 ‘리니지2 레볼루션’으로 모바일 게임상을 수상한 넷마블도 태국 양대 마켓의 상위권을 유지해가며 인기몰이를 이어간다는 계획이다.게임업계 관계자는 “태국은 중국에 비해 규모는 훨씬 작지만 성장 잠재력이 풍부한 신흥시장이라는 점이 매력적”이라며 “대만 등과 함께 아시아 주요 시장으로 부상하고 있어 태국 시장의 역할이 더욱 커질 것으로 기대하고 있다”고 말했다.sjpark@heraldcorp.com▶10만원대 수량한정 프랑스 명품 커트러리 세트!▶헤럴드경제 채널 구독하기 ▶카카오플러스 친구맺기 - Copyrights ⓒ 헤럴드경제 & heraldbiz.com, 무단 전재 및 재배포 금지 -헤럴드경제 관련뉴스해당 언론사에서 선정하며 언론사 페이지(아웃링크)로 이동해 볼 수 있습니다.고현정, 강의실에서 흡연하는 사진 SNS 확산JYP ""준케이 음주운전 책임 통감…향후 모든 활동 중지""[2018 평창] ""깜짝이야"" 김민석, 빙속 1500m 동메달…아시아에 빛난 별검찰 \'MB차명재산 리스트\' 확보했다\'국정농단 재판\' 형량 못 듣겠다며 자리 비운 최순실좋아요0훈훈해요0슬퍼요0화나요0후속기사 원해요0기사제공 :']"
3,NC soft, 2018-02-1408:03,한국경제 ,[분석플러스] '잘 키운 IP' 열 게임 안 부럽다,https://finance.naver.com/news/news_read.nhn?article_id=0003894091&office_id=015&mode=search&query=엔씨&page=1,"['       [분석플러스] \'잘 키운 IP\' 열 게임 안 부럽다      기사입력2018-02-14 08:03기사원문좋아요훈훈해요좋아요 평가하기공감좋아요0훈훈해요0슬퍼요0화나요0후속기사 원해요0댓글인기 IP 게임사 수익성에 한몫…글로벌 사업 용이넷마블·넥슨, 자체 IP 육성에 총력 컴투스·위메이드, 영화·완구 등으로 IP 확장사진=게티이미지뱅크 제공# 지난해 엔씨소프트 매출 1조7587억원 중 2027억원은 지적재산권(IP) 로열티(사용료)에서 나왔다. 로열티로만 웬만한 중소게임사 연매출 이상의 돈을 번 셈이다. 특히 넷마블게임즈가 \'리니지2\' IP를 활용해 만든 \'리니지2: 레볼루션(이하 레볼루션)\'이 흥행하면서 엔씨소프트 로열티 매출에 큰 보탬이 됐다. # 위메이드는 지난해 \'미르의 전설2(이하 미르2)\' IP 사업 호조로 수익성이 개선됐다. 매출은 1% 증가하는 데 그쳤지만, 영업이익은 45%나 늘었다. 영업비용이 전년 수준을 유지한 가운데 중국발(發) 로열티 매출이 늘어 이익 성장을 견인했다. 게임 퍼블리싱(유통) 사업은 매출과 함께 마케팅 등 비용이 발생하지만, IP 사업은 로열티 매출이 고스란히 이익으로 반영된다.  국내 게임 업계에서 IP 육성 경쟁이 활발하다. 지난해 실적을 통해 IP의 힘과 수익성이 다시 한 번 검증되면서 올해 게임사들은 일제히 IP 키우기에 총력을 기울이고 있다. 외부 IP 의존도가 높았던 곳은 자체 IP 개발과 육성에 사업 전략의 방점을 찍고 있다. 기존 인기 IP를 보유한 회사는 웹툰과 애니메이션, 완구 등 이종 산업으로 세를 넓힌다는 전략이다.넷마블의 \'세븐나이츠2\'(위쪽), 넥슨의 \'야생의 땅: 듀랑고\'. / 사진=양사 제공◆올해 게임 왕좌 IP로 승부날까새로운 \'게임 왕좌\' 넷마블은 지난해 IP의 중요성을 실감했다. 레볼루션으로 1조원이 넘는 매출을 올리고, 이 중 10% 수준인 1000억원 이상을 로열티 명목으로 엔씨소프트에 떼줬다. 리니지2가 자체 IP였다면 쓰지 않아도 될 비용인 만큼 넷마블 입장에서는 아쉬움이 남는 대목이다.넷마블은 올해 경쟁력 강화 방안으로 자체 IP 육성을 강조하고 있다. 이를 위해 자체 게임 IP \'세븐나이츠\' \'모두의 마블\' \'마구마구\' \'야채부락리\' 등을 활용한 신작 게임을 국내외에서 대거 선보일 계획이다. 방준혁 넷마블 이사회 의장은 ""과거엔 넷마블 내부에 상대적으로 좋은 IP가 없었고, 해외에서 IP 인지도도 떨어졌다""며 ""이제는 그동안 잘 성장해온 자체 IP를 본격적으로 육성해나갈 것""이라고 말했다. 넥슨은 최근 신규 IP 개발에서 성과를 내고 있다. 지난달 선보인 \'야생의 땅: 듀랑고\'는 기존 모바일게임에서 볼 수 없었던 참신한 세계관과 콘셉트로 이용자들의 호평을 받고 있다. 지난해 9월 출시한 \'액스\'도 5개월 넘게 모바일게임 매출 상위권을 유지하며 시장에 안착했다. 두 게임 모두 넥슨이 온전히 새로 만든 IP다. 넥슨은 올해 자사 대표 PC온라인게임인 \'메이플스토리\'와 \'마비노기\' IP를 모바일게임도 각각 계승할 예정이다.컴투스의 \'서머너즈워\'(왼쪽), 위메이드의 미르2 IP 기반 모바일게임 \'열화뇌정\'. / 사진=양사 제공◆인기 IP 글로벌에서 무한 변신잘 키운 IP를 더 키우려는 회사들도 있다. 컴투스는 자사 스테디셀러인 \'서머너즈워: 천공의 아레나(이하 서머너즈워)\' IP를 글로벌 시장에서 확장시키고 있다. 컴투스는 미국 드라마 \'워킹데드\'의 원작자가 설립한 콘텐츠 제작사와 서머너즈워 만화 애니메이션을 제작할 계획이다. 미국 유명 완구업체 펀코와 손잡고 서머너즈워 캐릭터 피규어와 의류 액세서리 출시도 준비 중이다.위메이드는 올해 중국에서 미르2 IP 보호와 확장을 동시에 진행한다. 미르2는 중국 서비스권을 두고 위메이드가 중국 샨다게임즈와 법정 분쟁을 벌이고 있는 게임 IP다. IP 보호 차원에서는 중국에서 위메이드와 계약 없이 서비스되는 미르 게임을 단속하고, 불법 사설 서버의 정식 서비스를 지원한다는 계획이다. 현재 중국엔 수만대의 미르2 사설 서버가 불법으로 운영되고 있다. 위메이드는 이들 사설 서버 운영 주체과 계약을 통해 로열티를 받고 시장을 양성화한다는 방침이다. 중국에서 미르2 IP를 총괄하는 합작법인(JV) \'전기유한회사\'는 중국 상라오시 정부 차원의 지원을 받으며 게임 영화 가상현실(VR) 콘텐츠 제작 등을 추진한다.올해 위메이드는 미르2 기반의 신규 게임 및 콘텐츠 매출, 미지급된 저작권료 회수 등을 감안해 로열티 매출로만 최대 2000억원을 올리는 게 목표다. 지난해에는 약 520억원이 로열티 매출에서 발생했다. 카카오게임즈의 \'프렌즈마블 for kakao\'. / 사진=카카오게임즈 제공카카오게임즈는 성장 발판이 됐던 카카오프렌즈 게임을 집중 육성한다. 카카오프렌즈 캐릭터 IP를 활용해 틈새시장인 캐주얼 게임 장르를 공략한다는 전략이다. 이를 위해 최근 통합 개발 자회사 \'프렌즈게임즈\'를 출범했다. 프렌즈게임즈는 올 상반기 \'프렌즈 레이싱\', 하반기 \'프렌즈타운\' \'프렌즈골프\' 등을 내놓을 계획이다. 카카오게임즈는 전날 텐센트와 넷마블을 비롯한 5개 회사로부터 총 1400억원 규모의 투자를 유치해 추가 게임 개발이나 IP 확보를 위한 실탄도 마련했다.   박건영 골든브릿지투자증권 연구원은 ""게임 업계는 2016년 \'포켓몬고\', 지난해 리니지 모바일 게임 등을 통해 IP의 힘을 확인해왔다""며 ""절대적인 IP 보유 여부는 생존의 필수 조건이 된 상황""이라고 말했다. 박희진 한경닷컴 기자 hotimpact@hankyung.com[한경닷컴 바로가기] [글방] [모바일한경 구독신청] ⓒ 한국경제 & hankyung.com, 무단전재 및 재배포 금지한국경제 관련뉴스해당 언론사에서 선정하며 언론사 페이지(아웃링크)로 이동해 볼 수 있습니다.넥슨, \'파워레인저\' 모바일게임 글로벌 판권 계약\'채널 넷마블\' 대한민국 블로그 어워드 최우수상\'더 빨리\' 넷마블 vs \'신중에 신중\' 엔씨소프트게임 3N \'왕좌의 게임\'… 작년 역대 최대실적 올렸다넷마블, 넥슨 제치고 \'게임 왕좌\' 등극좋아요0훈훈해요0슬퍼요0화나요0후속기사 원해요0기사제공 :']"
4,NC soft, 2018-02-1407:28,아시아경제 ,"[굿모닝 증시]""국내 증시, 단기 조정에 불과…추가 매수""",https://finance.naver.com/news/news_read.nhn?article_id=0004179681&office_id=277&mode=search&query=엔씨&page=1,"['       [굿모닝 증시]""국내 증시, 단기 조정에 불과…추가 매수""      기사입력2018-02-14 07:28기사원문좋아요훈훈해요좋아요 평가하기공감좋아요0훈훈해요0슬퍼요0화나요0후속기사 원해요0댓글 [아시아경제 조호윤 기자]증시 전문가들이 최근 조정이 단기적일 것으로 판단한다면서 매수 의견을 유지하고 있다. 현재의 조정 국면은 향후 오버슈팅의 전조 증상으로 보면서 외국인 매수세가 강하게 나타나는 점을 근거로 들었다.◆노동길 ·곽현수 신한금융투자 연구원=최근 증시 조정은 장기 금리가 상승한 영향이 크다. 1월 미국 고용 지표 발표 이후 장기 금리가 하락 추세선을 상향 돌파하면서 밸류에이션 부담이 커졌다. 장기 금리는 2.8%대에 안착하고 미국 임금은 올해 2~3분기까지 상승할 가능성이 높다. 그럼에도 매수 관점을 유지하는 이유는 1990년 이후 증시 랠리에서 장기 금리 상승 이후 오버슈팅 패턴이 반복됐기 때문이다. \'통화정책 정상화 초기 국면 조정→강한 랠리→장기 금리 상승 초기 국면 조정→마지막 오버슈팅\' 패턴이다. 지금은 장기 금리 상승 초기 국면의 조정 단계라고 판단한다. 한 차례 오버슈팅 가능성이 남아 있다.시중 금리 상승은 부진했던 실물경기 회복의 본격화를 의미한다. 실물경기 회복은 증시에 우호적이다. 이번 조정은 장기 금리 상승 초기 국면에서 경험했던 단기 조정으로 판단한다. 최근 미국 경기 호조에 따른 장기 금리 상승은 과거에 있었던 증시 오버슈팅의 전조라고 판단한다. 과거의 패턴대로라면 증시는 단기 조정을 거치고 한 차례 더 고점을 높일 수 있다. 1~2개월 변동성 확대 국면에서 조정 시 매수 전략을 유지한다.◆고경범 유안타증권 연구원=미국 금리 이슈가 제기된 2/2 이후, KOSPI는 -6.7%, KOSDAQ은 -8.7%까지 하락했다. 전일 반등에도 삼성전자도 -4.6%까지 하락한 수준임을 감안하면, 개별종목 수익률은 더 부진한 흐름을 보였다. 지난해 4분기 실적발표는 금액 기준 91.2%가 진행됐고, 발표된 종목의 달성률은 88.8%를 기록하고 있다. 1회성 비용 시현으로 전망치 달성률이 하회하는 계절적 특성이 이번 분기에서도 발견되고 있다.주목할 점은  발표된 실적에 투자자가 어떻게 반응했는 지에 대한 부분이다. 실적 확인을 통해 바닥이나 이익 모멘텀을 인식하고,다른 모멘텀이 부각되지 않는 이상 기존의 스탠스를 이어나갈 가능성이 높기 때문이다. 실적 발표 이후 외국인 수급이 대폭 유입된 종목을 확인해 보았다. 종목별 발표시간이 상이한 관계로, 잠정치 발표일과 T+1일 평균 순매수 비중을 조사했다. 외국인 매수유입 강도가 높았던 종목은 엔씨소프트, CJ CGV, 호텔신라, SK하이닉스, 포스코대우, 와이솔 등으로, 최근에도 매수세가 유지되는 것으로 확인된다. 조호윤 기자 hodoo@asiae.co.kr▶ 채널 설정하고 골프장 무료권, 상품권 받자!▶ 양낙규의 \'군사이야기\' ▶ #아시아경제 페이스북아시아경제 관련뉴스해당 언론사에서 선정하며 언론사 페이지(아웃링크)로 이동해 볼 수 있습니다.최민정, 충격적인 실격…무엇이 문제였나""동맹 NO"" 전면전 선언한 트럼프..뒤통수 맞은 韓홍준표에 \'반기\'든 나경원…""비호감·욕심"" 독설\'김여정 南고위 접촉\' 파악한 김정은 \'예상 밖 반응\'""자리 양보하는 北 김여정 손 자세히 살펴보면…""좋아요0훈훈해요0슬퍼요0화나요0후속기사 원해요0기사제공 :']"
