,회사명,날짜,언론사,기사제목,링크,본문
0,NC soft, 2019-08-0517:44,한국경제 ,"2분기 好실적 거둔 엔씨소프트, 하반기 신작이 주가상승 이끈다",https://finance.naver.com/news/news_read.nhn?article_id=0004187287&office_id=015&mode=search&query=엔씨&page=1,"['       2분기 好실적 거둔 엔씨소프트, 하반기 신작이 주가상승 이끈다      기사입력2019-08-05 17:44기사원문좋아요훈훈해요좋아요 평가하기공감좋아요0훈훈해요0슬퍼요0화나요0후속기사 원해요0댓글IBK투자證 등 7개 증권사목표주가 일제히 상향증권사들이 엔씨소프트의 목표주가를 잇따라 올리고 있다. 2분기 호실적을 거둔 가운데 하반기 출시하는 신작 게임 ‘리니지2M’이 주가 상승의 촉매제가 될 수 있다는 점을 근거로 들고 있다.5일 유가증권시장에서 엔씨소프트는 2000원(0.38%) 오른 52만2000원에 마감했다. 외국인 투자자가 이달 들어 146억원 규모를 순매수해 상승세를 견인했다. 이달 주가 상승률은 8.41%다.엔씨소프트가 지난 2일 발표한 2분기 영업이익은 1294억원이었다. 전년 동기보다 18.9% 줄었지만 컨센서스(증권사 추정치 평균)보다는 많아 투자자의 우려가 줄어들었다는 분석이다. 황승택 하나금융투자 연구원은 “리니지1과 리니지M 등 기존 게임이 대대적으로 업데이트된 이후 트래픽이 급증하면서 실적 개선을 견인했다”며 “신작 게임 출시가 없었음에도 질적으로 양호한 실적을 올렸다”고 분석했다.엔씨소프트가 2분기 실적을 발표한 직후 7개 증권사가 엔씨소프트의 목표주가를 일제히 높였다. IBK투자증권은 60만원에서 68만원으로 13.3% 상향 조정했다. 키움증권, 신한금융투자 등은 목표주가로 65만원을 제시했다. NH투자증권은 5월부터 엔씨소프트의 목표주가를 75만원으로 유지하고 있다.리니지2M 출시 예정 시점이 올해 4분기로 구체화된 것도 주가에 호재로 작용할 것이란 관측이다.김기만 기자 mgk@hankyung.com▶ 네이버에서 한국경제 뉴스를 받아보세요▶ 한경닷컴 바로가기  ▶ 모바일한경 구독신청 ⓒ 한국경제 & hankyung.com, 무단전재 및 재배포 금지한국경제 관련뉴스해당 언론사에서 선정하며 언론사 페이지(아웃링크)로 이동해 볼 수 있습니다.""일본 잘못이지만…한국이 빌미 제공"" 폭탄 발언일본 여행 급감했다고? 알고보니…""문재인 아니면 박원순으로…"" 은밀한 제안입법고시 합격자 발표…사상 처음으로 \'깜짝\'중국 ""지금이 삼성 뺏을 기회""…\'호시탐탐\'좋아요0훈훈해요0슬퍼요0화나요0후속기사 원해요0기사제공 :']"
1,NC soft, 2019-08-0515:39,한국경제 ,견고한 실적에 하반기 신작 출시 예고…엔씨소프트 목표가 줄줄이 상향,https://finance.naver.com/news/news_read.nhn?article_id=0004187137&office_id=015&mode=search&query=엔씨&page=1,"['       견고한 실적에 하반기 신작 출시 예고…엔씨소프트 목표가 줄줄이 상향      기사입력2019-08-05 15:39기사원문좋아요훈훈해요좋아요 평가하기공감좋아요0훈훈해요0슬퍼요0화나요0후속기사 원해요0댓글 증권사들이 엔씨소프트의 목표주가를 잇따라 올리고 있다. 2분기 호실적을 거둔 가운데 하반기 출시하는 신작 게임 ‘리지니2M’이 주가 상승의 촉매제가 될 수 있다는 점을 근거로 들고 있다.5일 유가증권시장에서 엔씨소프트는 2000원(0.38%) 오른 52만2000원에 마감했다. 외국인투자자들이 이달 들어 146억원을 순매수해 상승세를 견인했다. 이번달 주가상승률은 8.41%다.엔씨소프트가 지난 2일 발표한 2분기 영업이익은 1294억원이었다. 전년 동기보다는 18.9% 줄었지만, 컨센서스(증권사 추정치 평균)보다는 많아 투자자들의 우려가 줄어들었다는 분석이다. 황승택 하나금융투자 연구원은 “리니지1과 리니지M 등이 기존 게임이 대대적으로 업데이트된 이후 트래픽이 급증하면서 실적개선을 견인했다”며 “신작게임 출시가 없었음에도 질적으로 양호한 실적을 올렸다”고 분석했다.엔씨소프트가 2분기 실적을 발표한 직후 7개 증권사가 엔씨소프트의 목표주가를 일제히 높였다. IBK투자증권은 60만원에서 68만원으로 13.3% 상향조정했다. 키움증권, 신한금융투자 등은 목표주가로 65만원을 제시했다. NH투자증권은 지난 5월부터 엔씨소프트의 목표주가를 75만원으로 유지하고 있다.리니지2M 출시예정 시점이 올해 4분기로 구체화된 것도 주가에 호재로 작용할 것이란 관측이다. 김소혜 한화투자증권 연구원은 “엔씨소프트는 2017년 리니지M 출시 이후 2년 동안 신작 출시가 없었지만, 기존에 선보인 게임만으로 이례적인 성과를 보여줬다“며 “리니지2의 지적재산권(IP) 경쟁력은 이미 해외 시장에서 입증된만큼 신작에 대한 흥행 기대가 시간이 갈수록 커질 것”이라고 말했다.김기만 기자 mgk@hankyung.com▶ 네이버에서 한국경제 뉴스를 받아보세요▶ 한경닷컴 바로가기  ▶ 모바일한경 구독신청 ⓒ 한국경제 & hankyung.com, 무단전재 및 재배포 금지한국경제 관련뉴스해당 언론사에서 선정하며 언론사 페이지(아웃링크)로 이동해 볼 수 있습니다.""일본 잘못이지만…한국이 빌미 제공"" 폭탄 발언일본 여행 급감했다고? 알고보니…""문재인 아니면 박원순으로…"" 은밀한 제안입법고시 합격자 발표…사상 처음으로 \'깜짝\'중국 ""지금이 삼성 뺏을 기회""…\'호시탐탐\'좋아요0훈훈해요0슬퍼요0화나요0후속기사 원해요0기사제공 :']"
2,NC soft, 2019-08-0511:31,헤럴드경제 ,"기관·연기금, 경영참여 확대 길 ‘활짝’",https://finance.naver.com/news/news_read.nhn?article_id=0001565363&office_id=016&mode=search&query=엔씨&page=1,"['       기관·연기금, 경영참여 확대 길 ‘활짝’      기사입력2019-08-05 11:31기사원문좋아요훈훈해요좋아요 평가하기공감좋아요0훈훈해요0슬퍼요0화나요0후속기사 원해요0댓글금융위, 5%·10%룰 완화 추진반쪽짜리 권리행사 벗어날 기회스튜어드십 코드 실효성 커질듯한진칼·에스엠 등 격전지 부상금융위원회가 5%·10%룰 완화를 추진하면서 향후 기관투자자의 경영참여가 강화될 전망이다. 특히, 업계에선 한진칼에 이어 에스엠이 주주권 행사의 주된 격전지가 될 것으로 보고 있다.5일 금융당국 및 업계에 따르면, 금융위는 5%룰 적용대상인 ‘경영참여’에서 배당, 임원 해임이나 직무정지, 이사 등 임원 후보 추천정관변경 등을 위한 주주제안 등은 제외하는 안을 추진 중이다. 주주권리 강화 등으로 스튜어드십 코드 실효성도 높아진다. 미국에서도 경영참여는 주주총회 표 대결을 통해 이사회의 과반수를 확보할 가능성이 상당한 경우로 한정하고 있다.현재보다 경영참여 목적이 한층 세밀하게 적용되면, 국민연금은 물론 자산운용사 등 기관투자자가 주주권을 행사할 범위도 한층 확대된다. 이사 등 임원후보 추천을 주주제안할 때에도 굳이 투자 목적을 ‘경영참여’로 변경할 필요가 없게 된다.최근 에스엠은 운용사와 사 측 간 주주권 행사 범위를 두고 치열한 공방이 진행 중이다. KB자산운용을 비롯, 현재 에스엠 주요주주인 운용사들도 주주제안 등을 통해 내년 주주총회 때 꺼낼 압박 카드가 대폭 확대될 수 있다. 에스엠은 내년 주총 때 사내이사 임기만료 및 연임, 신규이사 선임 등의 안건이 예정돼 있다. 에스엠 측이 명확한 답변을 내놓지 않는 배당 요구 역시 주주제안으로 꺼낼 수 있다.10%룰 완화는 최근 한진가를 둘러싼 경영권 분쟁 여파가 컸다. 국민연금은 지난 2월 한진칼에 제한적 범위의 경영참여 주주권을 행사한 반면 10% 이상 보유하고 있는 대한항공에 대해 ‘경영참여’ 주주권을 행사하지 않았다. 국민연금이 ‘10%룰’이 사실상 걸림돌이었다.금융위는 복지부와 협의해 10%룰 시행령을 조금 더 구체화할 예정이다. 현재 자본시장법 시행령 제198조 ‘단기매매차익 반환의 예외’ 13항엔 “미공개중요정보를 이용할 염려가 없는 경우로서 증권선물위원회(증선위)가 인정하는 경우”가 있다. 이에 맞춰 향후 국민연금이 미공개중요정보를 이용하지 않는다는 걸 입증할 수 있게 국민연금 주식운용 내부 업무 처리 시스템을 금융위와 공유, 10%룰을 그 범위 내에서 조율할 예정이다.금융위 관계자는 “시행령 해석을 국민연금이 얼마나 활용하고, 증선위에게 입증하느냐에 따라 관련 내용을 조정할수 있다”고 밝혔다. 김상조 청와대 정책실장이 청와대에 입성한 이후 주주권 강화는 한층 강화될 것이란 게 업계의 전망이다.한편, 지난해 말 시가총액 기준 국내 100대 기업 중 국민연금이 10% 이상 지분을 갖고 있는 기업은 포스코, 엔씨소프트, KT, 삼성전기,현대건설, 현대중공업지주, CJ제일제당, GS, NH투자증권, 대림산업, GS건설, KCC, 대한항공 호텔신라 등이다.김나래 기자/ticktock@heraldcorp.co▶네이버에서 헤럴드경제 채널 구독하기▶단 3일 특별한 구성 한번 더 할인, 헤럴드 리얼라이프 ▶헤럴드경제 사이트 바로가기 - Copyrights ⓒ 헤럴드경제 & heraldbiz.com, 무단 전재 및 재배포 금지 -헤럴드경제 관련뉴스해당 언론사에서 선정하며 언론사 페이지(아웃링크)로 이동해 볼 수 있습니다.이이경, 이국주와 공개 연애 인정한 이유홍준표 ""文정권, 축구경기 아닌 데도 일본 이기자고 선동""8호 태풍 프란시스코 경로, 한반도 관통…폭염 변수 떠올라배현진 ""北에 전략물자 안 준 것 입증하면 日 코 납작하게 할 수 있어""김남길과 뜬금포 결혼설…장나라 ""참담""좋아요0훈훈해요0슬퍼요0화나요0후속기사 원해요0기사제공 :']"
3,NC soft, 2019-08-0511:12,헤럴드경제 ,"[단독]'반쪽 권리' 기관·연기금 주주권, 대폭 강화된다",https://finance.naver.com/news/news_read.nhn?article_id=0001565322&office_id=016&mode=search&query=엔씨&page=1,"['       [단독]\'반쪽 권리\' 기관·연기금 주주권, 대폭 강화된다      기사입력2019-08-05 11:12기사원문좋아요훈훈해요좋아요 평가하기공감좋아요0훈훈해요0슬퍼요0화나요0후속기사 원해요0댓글김상조 실장 입문 후 스튜어드십 코드 탄력주주권 강화, 한진칼 이어 에스엠 주목[헤럴드경제=김나래 기자] 금융위원회가 5%·10%룰 완화를 추진하면서 향후 기관투자자의 경영참여가 강화될 전망이다. 특히, 업계에선 한진칼에 이어 에스엠이 주주권 행사의 주된 격전지가 될 것으로 보고 있다.5일 금융당국 및 업계에 따르면, 금융위는 5%룰 적용대상인 ‘경영참여’에서 배당, 임원 해임이나 직무정지, 이사 등 임원 후보 추천정관변경 등을 위한 주주제안 등은 제외하는 안을 추진 중이다. 주주권리 강화 등으로 스튜어드십 코드 실효성도 높아진다. 미국에서도 경영참여는 주주총회 표 대결을 통해 이사회의 과반수를 확보할 가능성이 상당한 경우로 한정하고 있다.현재보다 경영참여 목적이 한층 세밀하게 적용되면, 국민연금은 물론 자산운용사 등 기관투자자가 주주권을 행사할 범위도 한층 확대된다. 이사 등 임원후보 추천을 주주제안할 때에도 굳이 투자 목적을 ‘경영참여’로 변경할 필요가 없게 된다.최근 에스엠은 운용사와 사 측 간 주주권 행사 범위를 두고 치열한 공방이 진행 중이다. KB자산운용을 비롯, 현재 에스엠 주요주주인 운용사들도 주주제안 등을 통해 내년 주주총회 때 꺼낼 압박 카드가 대폭 확대될 수 있다. 에스엠은 내년 주총 때 사내이사 임기만료 및 연임, 신규이사 선임 등의 안건이 예정돼 있다. 에스엠 측이 명확한 답변을 내놓지 않는 배당 요구 역시 주주제안으로 꺼낼 수 있다.10%룰 완화는 최근 한진가를 둘러싼 경영권 분쟁 여파가 컸다. 국민연금은 지난 2월 한진칼에 제한적 범위의 경영참여 주주권을 행사한 반면 10% 이상 보유하고 있는 대한항공에 대해 ‘경영참여’ 주주권을 행사하지 않았다. 국민연금이 ‘10%룰’이 사실상 걸림돌이었다.금융위는 복지부와 협의해 10%룰 시행령을 조금 더 구체화할 예정이다. 현재 자본시장법 시행령 제198조 ‘단기매매차익 반환의 예외’ 13항엔 “미공개중요정보를 이용할 염려가 없는 경우로서 증권선물위원회(증선위)가 인정하는 경우”가 있다. 이에 맞춰 향후 국민연금이 미공개중요정보를 이용하지 않는다는 걸 입증할 수 있게 국민연금 주식운용 내부 업무 처리 시스템을 금융위와 공유, 10%룰을 그 범위 내에서 조율할 예정이다.금융위 관계자는 “시행령 해석을 국민연금이 얼마나 활용하고, 증선위에게 입증하느냐에 따라 관련 내용을 조정할수 있다”고 밝혔다. 김상조 청와대 정책실장이 청와대에 입성한 이후 주주권 강화는 한층 강화될 것이란 게 업계의 전망이다.한편, 지난해 말 시가총액 기준 국내 100대 기업 중 국민연금이 10% 이상 지분을 갖고 있는 기업은 포스코, 엔씨소프트, KT, 삼성전기,현대건설, 현대중공업지주, CJ제일제당, GS, NH투자증권, 대림산업, GS건설, KCC, 대한항공 호텔신라 등이다.ticktock@heraldcorp.com▶네이버에서 헤럴드경제 채널 구독하기▶단 3일 특별한 구성 한번 더 할인, 헤럴드 리얼라이프 ▶헤럴드경제 사이트 바로가기 - Copyrights ⓒ 헤럴드경제 & heraldbiz.com, 무단 전재 및 재배포 금지 -헤럴드경제 관련뉴스해당 언론사에서 선정하며 언론사 페이지(아웃링크)로 이동해 볼 수 있습니다.이이경, 이국주와 공개 연애 인정한 이유홍준표 ""文정권, 축구경기 아닌 데도 일본 이기자고 선동""8호 태풍 프란시스코 경로, 한반도 관통…폭염 변수 떠올라배현진 ""北에 전략물자 안 준 것 입증하면 日 코 납작하게 할 수 있어""김남길과 뜬금포 결혼설…장나라 ""참담""좋아요0훈훈해요0슬퍼요0화나요0후속기사 원해요0기사제공 :']"
4,NC soft, 2019-08-0510:03,머니S ,코스피 1970선까지 밀려… 시총 상위주 ‘전멸’,https://finance.naver.com/news/news_read.nhn?article_id=0000435536&office_id=417&mode=search&query=엔씨&page=1,"['       코스피 1970선까지 밀려… 시총 상위주 ‘전멸’      기사입력2019-08-05 10:03기사원문좋아요훈훈해요좋아요 평가하기공감좋아요0훈훈해요0슬퍼요0화나요0후속기사 원해요0댓글사진=이미지투데이코스피지수가 1970선까지 밀린 가운데 시가총액 상위 종목도 모두 약세를 보이고 있다.코스피는 5일 오전 9시53분 현재 전 거래일 대비 26.64포인트(1.33%) 내린 1971.49에 거래되며 1970선마저 위협받고 있다.개인과 외국인은 237억원, 645억원 각각 순매도 중이다. 기관이 885억원 순매수하며 방어에 나서고 있지만 녹록지 못한 상황이다.이날 약세는 미국의 덜 비둘기파적 금리정책 방향, 미중 무역분쟁 확산에 더해 일본 정부가 우리나라를 화이트리스트(수출절차 간소화 국가명단)에서 제외한 여파로 분석된다.삼성전자는 전일보다 1.45% 하락한 4만4300원에 거래되고 있고 SK하이닉스(-1.31%), 현대모비스(-0.61%), LG화학(-2.11%), 네이버(-3.17%), 셀트리온(-4.89%) 등 시가총액 상위 10개 종목이 모두 약세를 보이고 있다.이 밖에 포스코(-2.07%), 삼성바이오로직스(-3.59%), 삼성SDI(-1.79%), 삼성물산(-2.00%), 삼성SDS(-2.15%), SK(-0.96%), 삼성생명(-2.32%), LG전자(-1.89%), 하나금융지주(-1.62%), 롯데케미칼(-3.30%), 아모레퍼시픽(-3.83%), 한국조선해양(-0.98%), 현대제철(-2.12%), LG디스플레이(-5.88%) 등 시총 ‘톱50’ 종목도 업종을 가리지 않고 약세를 보이고 있다.시총 상위 50개 중 약세 중인 종목은 38개로 76%에 달한다. 강세인 종목은 KT&G(0.10%), 엔씨소프트(0.19%), 강원랜드(1.64%), LG유플러스(0.38%) 등 7개(14%)에 불과하며 이중 KT&G를 제외하면 상승폭은 모두 1% 미만이다.조승빈 대신증권 애널리스트는 “글로벌 중앙은행들의 통화완화 정책에 대한 기대감으로 안정되는 모습을 보여주던 글로벌 금융시장이 흔들리기 시작했다”며 “이달 1일엔 도널드 트럼프 미국 대통령이 3000억달러 규모의 중국 수입품에 10% 관세를 부과하겠다고 결정하는 등 불확실성이 더욱 확대됐다”고 밝혔다.장우진 기자 jwj17@mt.co.kr▶ 고수들의 재테크 비법 ▶ 박학다식 \'이건희칼럼\' <저작권자 ⓒ \'성공을 꿈꾸는 사람들의 경제 뉴스\' 머니S, 무단전재 및 재배포 금지>머니S 관련뉴스해당 언론사에서 선정하며 언론사 페이지(아웃링크)로 이동해 볼 수 있습니다.우주안 ""열애 인정? 정리"" 강타 심경 보니…""보고싶었어~"" 이민정, 이병헌 아들 준후에 애교♥송가인, 보톡스 의혹 해명 ""어머니께 물려받은 것""오창석, 과거 지연과 동거?… 이채은 \'씁쓸\'정유미, 강타 양다리설 의식?… SNS 내용 수정좋아요0훈훈해요0슬퍼요0화나요0후속기사 원해요0기사제공 :']"
5,NC soft, 2019-08-0508:52,이데일리 ,"엔씨소프트, `리니지2M` 출시 기대 고조…목표가↑-신한",https://finance.naver.com/news/news_read.nhn?article_id=0004438501&office_id=018&mode=search&query=엔씨&page=1,"['       엔씨소프트, `리니지2M` 출시 기대 고조…목표가↑-신한      기사입력2019-08-05 08:52기사원문좋아요훈훈해요좋아요 평가하기공감좋아요0훈훈해요0슬퍼요0화나요0후속기사 원해요0댓글[이데일리 이후섭 기자] 신한금융투자는 5일 엔씨소프트(036570)에 대해 올해 2분기 실적이 시장예상치를 웃돌았으며, 최대 기대작인 `리니지2M` 출시 기대가 커지고 있다고 진단했다. 목표가를 종전 60만원에서 65만원으로 8.3%(5만원) 상향 조정했고 투자의견은 `매수`를 유지했다.이문종 신한금융투자 연구원은 “엔씨소프트의 2분기 매출액은 전분기대비 14.5% 증가한 4108억원, 영업이익은 62.7% 늘어난 1294억원을 기록해 매출액과 영업이익 모두 시장예상치를 상회했다”며 “리니지(PC) 매출은 리마스터 및 부분유료화 효과에 전분기대비 141.8% 증가하며 정상화됐고, 모바일 매출도 `리니지M` 2주년 업데이트 효과에 힘입어 12.6% 늘어나면서 호조세를 이어갔다”고 분석했다. 일회성 인센티브 및 북미 법인 구조조정 비용 제거 영향으로 2분기 인건비가 전분기대비 20.1% 감소하면서 영업이익도 대폭 개선됐다.이 연구원은 “리니지(PC)는 리마스터 및 부분유료화 이후 트래픽과 매출이 급증하는 트렌드를 보여줬고, `리니지2`의 올해 상반기 매출도 전년동기대비 55% 증가했다”며 “최근 부분유료화 이후 이달 신규클래스 업데이트를 앞두고 있다. PC 결제한도 완화에 맞춰 주요 PC게임 모두 부분유료화로 전환된 점이 긍정적”이라고 진단했다.올해 4분기 리니지2M 출시가 유력해지면서 유일한 리스크였던 기대작 지연에 대한 불안감도 해소됐다는 판단이다. 이 연구원은 “회사는 2분기 실적 발표를 통해 4분기 리니지2M 출시 일정에 이상이 없으며 사전 마케팅도 조만간 진행 예정임을 밝혔다”며 “리니지2M의 해외 출시도 국내 출시 이후 6개월 이내 출시를 목표로 하고있는 만큼 추후의 모멘텀 공백기도 길지 않을 것”이라고 내다봤다.이후섭 (dlgntjq@edaily.co.kr)네이버 홈에서 ‘이데일리’ 뉴스 [구독하기▶]꿀잼가득 [영상보기▶] , 청춘뉘우스~ [스냅타임▶]＜ⓒ종합 경제정보 미디어 이데일리 - 무단전재 & 재배포 금지＞이데일리 관련뉴스해당 언론사에서 선정하며 언론사 페이지(아웃링크)로 이동해 볼 수 있습니다.""수소차 시대 오지 않는다"" 머스크의 장담 사실?\'부상-불운-경쟁자\' 류현진, 사이영상 경고등 켜지나김남길·장나라 11월 결혼?…디스패치 기사 삭제설이효리 ""응어리 풀고 싶어..날 싫어하는 줄 알았다""""이 볼펜은 국산입니다""…KBS 뉴스 클로징 \'화제\'좋아요0훈훈해요0슬퍼요0화나요0후속기사 원해요0기사제공 :']"
6,NC soft, 2019-08-0508:51,매일경제 ,"[Hot-Line] ""엔씨소프트, 리니지2M의 기대감…목표가↑""",https://finance.naver.com/news/news_read.nhn?article_id=0004404366&office_id=009&mode=search&query=엔씨&page=1,"['       [Hot-Line] ""엔씨소프트, 리니지2M의 기대감…목표가↑""      기사입력2019-08-05 08:51기사원문좋아요훈훈해요좋아요 평가하기공감좋아요0훈훈해요0슬퍼요0화나요0후속기사 원해요0댓글 현대차증권은 5일 엔씨소프트에 대해 리니지2M에 대한 기대감으로 주가가 지속 상승할 것이라며 투자의견 \'매수\' 유지, 목표주가는 기존 58만원에서 62만원으로 상향했다.2분기 엔씨소프트의 연결기준 매출액은 4108억원, 영업이익은 1294억원으로 시장 기대치를 웃돌았다. 온라인·모바일의 매출의 상승과 일회성 비용 제거가 주요 원인으로 꼽힌다.최진성 현대차증권 연구원은 ""리니지M의 2주년 업데이트와 대규모 업데이트에 따른 모바일 호실적과 더불어 리니지1과 리니지2의 흥행이 주요 원인""이라며 ""비용에서는 전분기 대비 일회성 인건비 제거되며 영업이익률 개선됐다""고 분석했다.특히 모바일 부문은 지난 분기와 마찬가지로 대규모 업데이트 통해 지난해 이후 최고 수준 트래픽 유지하고 있다. 이미 이번 컨퍼런스 콜을 통해 리니지2M의 출시를 4분기로 밝히면서 3분기 중 사전 예약이 시작될 것으로 보인다.최 연구원은  ""리니지M사전예약 당시와 유사하게 리니지2M의 사전 예약이 시작되면 사전예약자 증가에 맞춰주가는 추세적인 상승을 기록할 전망""이라며 ""현재 높은 유저 지표와 추가 업데이트를 고려하면 하반기에도 견조한 매출 유지할 수 있을 것""이라고 내다봤다.[디지털뉴스국 김규리 기자]▶네이버 메인에서 \'매일경제\'를 받아보세요▶뉴스레터 \'매콤달콤\' 구독 ▶무궁무진한 프리미엄 읽을거리[ⓒ 매일경제 & mk.co.kr, 무단전재 및 재배포 금지]매일경제 관련뉴스해당 언론사에서 선정하며 언론사 페이지(아웃링크)로 이동해 볼 수 있습니다.성급한 매수 자제…당분간 안전자산으로저금리에…\'오피스텔 무덤\' 여의도도 26대1강유미 결혼식 당일 화보 공개…부케는 안영미일본 불매 운동에도 자유여행족은 늘었다고?송가인 ""보톡스 의혹 억울, 엄마와 똑같이 생겼다""좋아요0훈훈해요0슬퍼요0화나요0후속기사 원해요0기사제공 :']"
