,회사명,날짜,언론사,기사제목,링크,본문
0,NC soft, 2019-01-2217:19,머니투데이 ,"인터넷·게임 ""안 좋을 때 바닥에 대한 고민이 필요""",https://finance.naver.com/news/news_read.nhn?article_id=0004163894&office_id=008&mode=search&query=엔씨&page=1,"['       인터넷·게임 ""안 좋을 때 바닥에 대한 고민이 필요""      기사입력2019-01-22 17:19기사원문좋아요훈훈해요좋아요 평가하기공감좋아요0훈훈해요0슬퍼요0화나요0후속기사 원해요0댓글 [머니투데이 신아름 기자] [[베스트리포트]]2박건영 연구원/사진제공=교보증권2일 머니투데이 증권부가 선정한 오늘의 베스트리포트는 박건영 교보증권 연구원이 인터넷·게임 산업에 대해 작성한 \'안 좋을 때일수록 바닥에 대한 고민이 필요\'입니다.박 연구원은 지난해 글로벌 인터넷, 게임들의 주가가 저조한 흐름을 이어간 원인과 향후 산업 트렌드 변화, 국내 기업들에 미칠 영향에 대해 52페이이지에 달하는 심도 깊은 분석을 보여줘 이목을 끌었습니다. 구체적으로 삼성에스디에스, NAVER, 카카오, 엔씨소프트, 펄어비스, 아프리카TV에 대한 향후 영향 등을 분석했습니다.박 연구원은 이번 보고서를 통해 올해 들어 글로벌 인터넷·게임 기업들의 주가가 반등하고 있지만 아직 주가가 바닥이라고 단정짓기는 이르다고 분석했습니다. 따라서 국내도 공격적인 투자 구간에 있는 인터넷 산업보다는 상대적으로 안정적이고 성장동력을 보유한 소프트웨어 산업이 투자할 것을 권고했습니다. 게임 산업 또한 독보적인 1위 사업자의 매력도가 높다고 판단했습니다. 이에 따라 삼성에스디에스와 엔씨소프트가 \'톱픽\'(최선호주)로 꼽혔습니다.다음은 리포트를 요약한 내용입니다. (☞원문보기)2018년은 글로벌 인터넷 기업들에 가혹했던 해였다. Facebook, Cambridge Analytica 데이터스캔들 이후 미중 무역 분쟁, 정치인들의 기술 대기업들에 대한 비난 이어졌다. 대표 \'Tech ETF\'인 QQQ의 인버스 ETF \'SQQQ(-3x 인버스)\' 수익률 10~12월 사이에 100% 수익률을 기록했다. 연말 변동성이 확대된 모습이다. 연초 글로벌 인터넷 기업들의 주가가 반등하고 있지만 향후 이러한 흐름을 계속 유지할지는 미지수다. 이번 보고서에서는 글로벌 인터넷 산업 트렌드를 예상한 후 이를 바탕으로 Google, Facebook, Amazon의 실적을 추정했다. 추정된 실적을 근거로 \'Bottom Value\'와 주가 흐름을 분석하고 국내 산업 트렌드와 기업들에게 미칠 영향을 파악했다.2018년 상반기 eSports에 대한 기대감으로 게임 산업이 상승세를 이어가는 듯했으나 하반기 중국 판호 발급 중단, 중국 정부 규제 강화로 게임 산업 투자 심리가 악화됐다. 12월 중국 내자 판호 발급 소식이 나오면서 목마른 게임 산업에 한줄기 단비처럼 작용했다. 2018년 게임 산업 트렌드를 뒤돌아 봤을 때 2019년 전망에 대해 몇 가지 질문이 가능하다. 첫번째는 \'eSports는 단순히 일시적인 투자 모멘텀이었는가\'이고, 두번째는 \'중국 판호에 대해 우리는 어디까지 기대감을 가져야 하는가\'다. 두 가지 질문에 대한 답을 이어나가고 향후 글로벌 게임 산업에서 새로운 트렌드가 될 수 있는 \'클라우드 게이밍\'에 대해 간략히 분석해봤다.결론은 글로벌 인터넷 기업들의 주가가 바닥이라고 단정짓기는 이르다는 점이다. 매크로 변수에 따라 글로벌 인터넷 기업들의 주가 변동성 확대될 전망이다. 따라서 국내도 공격적인 투자 구간에 있는 인터넷 산업보다 상대적으로 안정적이고 성장동력을 보유한 소프트웨어 산업이 투자매력도가 더 높다고 판단된다. 게임 산업 또한 외자 판호 기대감보다는 독보적인 1위 사업자를 선호한다. 따라서 삼성에스디에스, 엔씨소프트를 톱픽으로 제시한다.▶창립20주년 기획 \'영리더\'▶남기자의 체헐리즘 모아보기 ▶뉴스는 머니투데이 신아름 기자 peut@<저작권자 ⓒ \'돈이 보이는 리얼타임 뉴스\' 머니투데이, 무단전재 및 재배포 금지> 머니투데이 관련뉴스해당 언론사에서 선정하며 언론사 페이지(아웃링크)로 이동해 볼 수 있습니다.박환희, 섬유근육통 고백…""이겨내고 싶다""홍석천 거듭 해명…""이태원 폐업, 최저임금 직접적 이유 아냐""""토요일, 새벽 3시, 열린 창문으로 그놈이 들어왔다""""심석희 황제훈련"" 주장돌아…심석희 측 ""2차 가해""김영주 의원, ""유도한 내 조카도 맞고 고막이 터졌다""좋아요0훈훈해요0슬퍼요0화나요0후속기사 원해요0기사제공 :']"
1,NC soft, 2019-01-2213:30,한국경제 ,"[마켓인사이트]엔씨소프트, 회사채 1500억 발행에 9500억 몰려",https://finance.naver.com/news/news_read.nhn?article_id=0004082526&office_id=015&mode=search&query=엔씨&page=1,"['       [마켓인사이트]엔씨소프트, 회사채 1500억 발행에 9500억 몰려      기사입력2019-01-22 13:30기사원문좋아요훈훈해요좋아요 평가하기공감좋아요0훈훈해요0슬퍼요0화나요0후속기사 원해요0댓글  ≪이 기사는 01월22일(13:27) 자본시장의 혜안 ‘마켓인사이트’에 게재된 기사입니다≫엔씨소프트가 3년 만에 발행하는 회사채에 모집액의 여섯 배가 넘는 투자 수요가 몰렸다.22일 투자은행(IB) 업계에 따르면 엔씨소프트가 1500억원어치의 회사채를 발행하기 위해 전날 기관투자가들을 대상으로 실시한 수요예측에 총 9500억원의 매수 주문이 들어왔다. 1000억어치를 발행하는 3년물에는 4600억원, 500억원 규모를 계획한 5년물에는 4900억원의 주문이 각각 들어왔다.높은 온라인 및 모바일 시장 지배력을 앞세운 탄탄한 재무 안정성이 흥행 비결로 꼽힌다. 엔씨소프트는 지난해 3분기(누적) 연결 기준으로 매출 1조3155억원, 영업이익 5024억원을 각각 달성했다. 전년 동기 대비 매출은 7.3%, 영업이익은 26.9% 증가했다. 대표작인 리니지를 비롯한 아이온, 블레이드앤소울 등 온라인 게임들이 연간 5000억원이 넘는 서비스 수입을 창출하고 있는 게 원동력이다. 작년 9월 말 기준으로 5248억원 상당의 현금성 자산 및 단기금융상품과 시가 4278억원 규모의 자기주식도 보유하고 있다. 한국신용평가는 이런 점을 반영해 엔씨소프트의 신용등급 전망을 최근 ‘안정적’에서 ‘긍정적’으로 상향 조정했다. 엔씨소프트는 넉넉한 투자 수요를 감안해 회사채 발행 금액을 2500억원으로 늘리는 방안을 검토하고 있다. 회사채 발행을 통해 마련하는 자금 중 1500억원은 회사채 상환에 쓰고 나머지는 신규 게임 개발 및 마케팅 등 재원으로 활용할 전망이다. 발행일은 오는 28일이다. NH투자증권과 KB증권이 대표 주관사다.김병근 기자 bk11@hankyung.com[한경닷컴 바로가기] [모바일한경 구독신청] 네이버에서 한국경제 채널 구독하기 <자세히 보기> ⓒ 한국경제 & hankyung.com, 무단전재 및 재배포 금지한국경제 관련뉴스해당 언론사에서 선정하며 언론사 페이지(아웃링크)로 이동해 볼 수 있습니다.은행에 \'5000만원\' 넣었더니…벌어진 일초고가 \'몽클레어\' 패딩 알고보니…\'깜짝\'11억2000만원 하던 신길 아파트…지금은""문 대통령, 현실 너무 모른다"" 경고13억 아파트 보유세…\'공동명의\'로 바꿨더니좋아요0훈훈해요0슬퍼요0화나요0후속기사 원해요0기사제공 :']"
2,NC soft, 2019-01-2211:34,뉴시스 ,"회사채 시장에 뭉칫돈 몰려…IB업계, 가뭄에 단비될까",https://finance.naver.com/news/news_read.nhn?article_id=0009024170&office_id=003&mode=search&query=엔씨&page=1,"['       회사채 시장에 뭉칫돈 몰려…IB업계, 가뭄에 단비될까      기사입력2019-01-22 11:34기사원문좋아요훈훈해요좋아요 평가하기공감좋아요0훈훈해요0슬퍼요0화나요0후속기사 원해요0댓글지난해 1월 회사채 발행사 15곳 중 1조원 수요는 2곳…올해는 벌써 5곳AA·AAA등급을 비롯해 BBB등급 회사채 발행에도 오버부킹 현상 나타나""1월 회사채 발행규모 4조 이상 전망도 제기돼""…증권사, 수수료 수입↑【서울=뉴시스】김동현 기자 = 연초부터 회사채 발행시장에 뭉칫돈이 몰려 국내 증권사 투자은행(IB)의 회사채 수수료 수입이 크게 늘어날 전망이다. 지난해 1월에는 전체 발행사 15곳 중 현대제철, KT 등 2곳에서만 1조원 이상의 수요를 확보했지만 올해 1월의 경우 회사채 발행 기업 중 벌써 5곳이 1조원 청약금을 끌어모았다.  증시 부진의 여파로 국내 증권사들의 올해 일평균 거래량과 거래대금이 지난해보다 감소할 것으로 전망되는 가운데 회사채 수수료 수입이 가뭄에 단비 역할을 할 수 있을 지 주목된다. 22일 금융투자업계에 따르면 올해 초 회사채를 발행한 신용등급 AA등급 이상 기업들은 대부분 오버부킹(모집금액 초과 청약)을 기록했으며 최근에는 신용등급 BBB+ 기업이 발행하는 회사채에도 자금이 몰리고 있는 중이다. . 1조원 이상 청약금이 몰린 기업을 살펴보면 LG유플러스(AA) 1조7100억원, SK인천석유화학(AA-) 1조4400억원, CJ제일제당(AA) 1조4800억원, KT(AAA) 1조4600억원, 현대제철(AA) 1조2900억원 등이다.   LG유플러스는 회사채 3000억원 모집에 1조7300억원의 수요가 몰렸다. 이에 LG유플러스는 회사채 발행 금액을 5000억원 수준으로 상향 조정할 것으로 알려졌다. 한국투자증권, 미래에셋대우, IBK투자증권, KB증권이 발행 실무를 맡았으며 회사채 발행 규모가 늘어날 경우 이들 기업에게 돌아가는 수수료도 더욱 커질 전망이다. SK인천석유화학의 경우 회사채 3000억원 모집에 수요가 몰려 최종 조달액을 6000억원으로 늘렸다. 인수수수료율이 30bp로 설정 돼 주관사인 KB증권에 지급되는 수수료는 18억원 수준이다. 미국 냉동식품 가공업체 쉬완스컴퍼니 인수자금을 마련하기 위해 회사채 발행에 나선 CJ제일제당의 경우 회사채 6000억원 모집에 1조4800억원의 수요가 몰렸다. NH투자증권, 한화투자증권, 신한금융투자가 대표 주관을 맡았다. KT는 지난 8일 회사채 3000억원을 발행하기 위한 수요예측에서 총 1조4600억원의 매수 주문을 받은 이후 발행 금액을 5000억원으로 증액키로 했다. NH투자증권, 한국투자증권, 삼성증권이 주관을 맡았다.  현대제철은 3500억원 규모 회사채를 발행하기 위해 실시한 수요예측에서 1조2900억원의 수요를 확보했다. 발행사와 주관사단은 수요를 고려해 7000억원으로 조달액을 늘리기로 했다. A급, BBB급 회사채 발행 기업들도 최근 오버부킹 현상에 함박웃음을 짓고 있다.대상(A+)은 두산인프라코어(BBB0)도 1100억원, 500억원 모집에 각각 3400억원, 1790억원의 숭요가 몰렸다. 대상은 수요예측 후 회사채 발행 금액을 1900억원으로 두산인프라코어는 880억원으로 늘렸다. 이외에도 롯데쇼핑, GS칼텍스, CJ프레시웨이, 한솔제지, 엔씨소프트, 현대오일뱅크, LS전선, 한솔케미칼, 미래에셋대우, 삼양사 등이 1~2월에 회사채 발행을 준비 또는 완료한다는 계획이다.이들 기업의 모집 예정액은 대부분 2000~3000억원대로 알려졌다. 회사채 발행수수료가 20~30bp(1bp=0.01%) 정도인 것을 감안할 때 오버부킹 현상이 지속될 경우 증권사 IB의 회사채 수수료 수입은 더욱 늘어날 것으로 관측된다. DB금융투자 이혁재 연구원은 ""회사채시장에 본격적인 발행 재개 모습이 나타났다""며 ""당분간 발행시장 흥행이 이어질 것""으로 관측했다. 미래에셋대우 이경록 연구원은 ""현재 예정된 수요예측들과 트렌드로 자리잡은 증액 발행을 감안할 때 올해 1월 회사채 발행규모는 4조원을 가뿐히 넘어설 것""이라고 예상했다.oj1001@newsis.com▶ 네이버에서 뉴시스 채널 구독하기▶ 뉴시스 빅데이터 MSI 주가시세표 바로가기 <저작권자ⓒ 공감언론 뉴시스통신사. 무단전재-재배포 금지.>뉴시스 관련뉴스해당 언론사에서 선정하며 언론사 페이지(아웃링크)로 이동해 볼 수 있습니다.\'두 딸 학대 의혹\' 30대 엄마, 재판서 반전…무죄 확정살인·살인미수 17년 징역 살고 또 지인 살해한 60대에 사형 구형10대 학생에 욕하며 뺨 수차례 때리고 경찰까지 폭행한 50대[단독]일본 ""징용재판 방치땐 파탄""…박근혜 압박美 시카고서 12세 한국계 여아 눈더미에 깔려 사망좋아요0훈훈해요0슬퍼요0화나요0후속기사 원해요0기사제공 :']"
3,NC soft, 2019-01-2211:27,전자신문 ,"[ET투자뉴스]엔씨소프트, ""안정성을 바탕으로 …"" BUY(MAINTAIN)-키움...",https://finance.naver.com/news/news_read.nhn?article_id=0002777578&office_id=030&mode=search&query=엔씨&page=1,"['       [ET투자뉴스]엔씨소프트, ""안정성을 바탕으로 …"" BUY(MAINTAIN)-키움증권      기사입력2019-01-22 11:27기사원문좋아요훈훈해요좋아요 평가하기공감좋아요0훈훈해요0슬퍼요0화나요0후속기사 원해요0댓글키움증권에서 22일 엔씨소프트(036570)에 대해 ""안정성을 바탕으로 점진적 성장 기대 ""라며 투자의견을 \'BUY(MAINTAIN)\'로 제시하였고, 아울러 목표주가로는 600,000원을 내놓았다. 키움증권 김학준 애널리스트가 동종목에 대하여 이번에 제시한 \'BUY(MAINTAIN)\'의견은 키움증권의 직전 매매의견에서 큰 변화없이 그대로 유지되는 것이고  전년도말의 매매의견을 기준으로  볼때도 역시 \'매수\'의견이 계속 유지되고 있는 상태이다. 그리고 최근 분기내 발표된 전체 증권사 리포트의 컨센서스와 비교를 해볼 경우에 오늘 발표된 투자의견은 대체적으로 평균치에 해당하는 수준으로, 이번 의견은 동종목에 대한 전체적인 흐름에서 크게 벗어나지 않은 것으로 분석되고 있다. 목표주가의 추이를 살펴보면 정체구간을 한동안 보낸 후에 최근 2회 연속 목표가가 높아졌는데 이번에 조정된 상승폭은 이전보다 다소 둔화된 모습이다. 또한 전일 종가 기준으로 볼때 동종목의 현주가는 이번에 제시된 목표가 대비 20.5%의 추가상승여력이 있다는 해석이 제시되고 있다. ◆ Report briefing키움증권에서 엔씨소프트(036570)에 대해 ""엔씨소프트의 4Q실적은 매출액 3,985억원(QoQ, -1.3%), 영업이익 1,209억원(QoQ, -13.1%)으로 전망된다. 리니지M의 12월 업데이트 및 연말 성수기/패키지 효과로 안정적 성과를 거둔 것으로 판단된다. 경쟁작의 출시가 있었으나 큰 변동이 없는 모습을 보였기 때문에 안정성은 상당기간 걱정할 필요가 없을 것으로 보인다""라고 분석했다.  또한 키움증권에서 ""작년에 1차 테스트를 진행했던 리마스터는 1/29~2/20일에 2차 테스트를 진행한다. 1차 테스트의 피드백을 반영하기 위한 것으로 그래픽 미세 조정 및 자동사냥의 개선 등이 주요 목적이다. 이에 따라 리마스터 출시는 3월에 진행될 것으로 예상되며 이에 따라 1Q에도 리니지의 매출은 긍정적 흐름을 나타낼 것으로 전망된다""라고 밝혔다.  한편 ""목표주가는 2019년 예상 EPS에 Target PER 25.7배를 적용하였다. 예전에 비해 신작들에 대한 기대치가 낮아진 현 시장 상황에서는 실적 안정성과 더불어 신작/해외 모멘텀을 보유한 동사가 가장 매력적이다""라고 전망했다. ◆ Report statistics키움증권의 동종목에 대한 최근 1년동안의 투자의견은 전체적으로 큰 변화없이 유지되고 있다. 목표주가는 550,000원이 고점으로, 반대로 470,000원이 저점으로 제시된 이후 이번에 600,000수준으로 새롭게 조정되고 있다. 한편 증권정보제공 업체인 씽크풀에 따르면 동사에 대한 컨센서스는 \'매수\'이고 목표주가의 추이를 살펴보면 과거 한차례 하향조정된 후에 최근 2회 연속 상향조정되고 있는데, 이번에 조정된 상승폭은 다소 줄어든 추세이다. <컨센서스 하이라이트>\xa0컨센서스최고최저투자의견매수매수(유지)매수(유지)목표주가601,667700,000510,000*최근 분기기준오늘 키움증권에서 발표된 \'BUY(MAINTAIN)\'의견 및 목표주가 600,000원은 전체 컨센서스 대비해서 대체적으로 평균치에 해당하는 수준으로, 이번 의견은 동종목에 대한 전체적인 흐름에서 크게 벗어나지 않은 것으로 파악되며 목표가평균과 대비해서 미미한 차이가 나는 것으로 집계되었다.  참고로 최근에 목표주가를 가장 공격적으로 제시한 미래에셋대우에서 투자의견 \'매수\'에 목표주가 700,000원을 제일 보수적인 의견을 제시한 유진투자증권에서 투자의견 \'BUY(유지)\'에 목표주가 510,000원을 제시한 바 있다. <키움증권 투자의견 추이>\xa0의견제시일자투자의견목표가격20190122BUY(MAINTAIN)600,00020181112BUY(MAINTAIN)550,00020180816BUY(MAINTAIN)470,00020180712BUY(MAINTAIN)470,00020180523매수(유지)470,000<최근 리포트 동향>의견제시일자증권사투자의견목표가20190122키움증권BUY(MAINTAIN)600,00020190122한화투자증권BUY(유지)650,00020190122교보증권BUY610,00020190121신한금융투자BUY(유지)550,000(씽크풀에서 제공하는 컨센서스는 국내 전증권사에서 발표되는 기업분석 리포트 및 코멘트를 실시간으로 통계/분석처리되고 있습니다.)증시분석 전문기자 로봇 ET etbot@etnews.com전자신문과 금융AI전문기업 씽크풀의 증시분석 전문기자 로봇 ET가 쓴 기사입니다▶ 내 USB가 산업제어시스템 보안을 흔들고 있다?▶ 네이버 모바일에서 [전자신문] 채널 구독하기▶ 전자신문 바로가기 [Copyright ⓒ 전자신문 & 전자신문인터넷, 무단전재 및 재배포 금지]전자신문 관련뉴스해당 언론사에서 선정하며 언론사 페이지(아웃링크)로 이동해 볼 수 있습니다.카카오페이·KT·11번가, 제로페이 합류...이통사·유통·핀테크까지 가세삼성·애플 LCD 스마트폰 전략 \'동상이몽\' 왜?삼성전자, 조기 실적 반등 기대감…2분기 회복하나K-팝 한류 \'K-에듀\'로 잇는다... 부산외대 \'글로벌 연합 사이버대\' 구축 추진에어워터코리아, 공기 수분을 물로 만드는 에어워터시스템 개발좋아요0훈훈해요0슬퍼요0화나요0후속기사 원해요0기사제공 :']"
4,NC soft, 2019-01-2211:10,이데일리 ,"엔씨소프트, 대만 게임쇼 참가..리니지M 신규 클래스 공개",https://finance.naver.com/news/news_read.nhn?article_id=0004296814&office_id=018&mode=search&query=엔씨&page=1,"['       엔씨소프트, 대만 게임쇼 참가..리니지M 신규 클래스 공개      기사입력2019-01-22 11:10기사원문좋아요훈훈해요좋아요 평가하기공감좋아요0훈훈해요0슬퍼요0화나요0후속기사 원해요0댓글현지 서비스사 감마니아, 140부스 마련리니지M. 엔씨소프트 제공[이데일리 노재웅 기자] 엔씨소프트(036570)는 모바일 MMORPG(다중접속역할수행게임) ‘리니지M’으로 ‘2019 타이페이 게임쇼(Taipei Game Show)’에 2년 연속 참가한다고 22일 밝혔다.타이페이 게임쇼는 2003년 시작해 올해로 17회를 맞이한 대만 최대 규모 게임쇼다. 올해는 1월 25일부터 28일까지 4일간 대만 타이페이 세계무역센터에서 열린다. 리니지M의 대만 서비스사인 감마니아는 올해 타이페이 게임쇼에 최대 규모 부스(140 부스)를 꾸린다.엔씨와 감마니아는 타이페이 게임쇼 현장에서 리니지M의 신규 클래스(Class, 직업) ‘용투사’를 최초 공개한다. 용투사는 2018년 11월 공개한 ‘총사’에 이은 7번째 클래스로, 한국 리니지M의 ‘투사’와 동일하다.엔씨와 감마니아는 B2C관 개막일인 1월 25일 용투사 출시 미디어 쇼케이스도 개최한다. 타이페이 게임쇼를 취재하는 글로벌 취재진에게 용투사 정보를 공개하고 인터뷰를 진행한다.아울러 리니지M 부스를 찾은 관람객들은 용투사 클래스에 대한 다양한 정보를 확인할 수 있으며, AR(Augmented Reality, 증강현실) 미니게임, 혈맹 던전 이벤트 등에도 참여할 수 있다. 한편 리니지M은 2017년 12월 11일 대만 서비스를 시작했다. 출시 직후부터 현재까지 대만 구글 플레이에서 57주 연속 최고 매출 1위를 기록 중이다. 출시 당시 40개였던 서버는 현재 76개로 늘어났다.노재웅 (ripbird@edaily.co.kr)네이버에서 이데일리 [구독하기▶], 꿀잼가득 [영상보기▶]빡침해소! 청춘뉘우스~ [스냅타임▶]＜ⓒ종합 경제정보 미디어 이데일리 - 무단전재 & 재배포 금지＞이데일리 관련뉴스해당 언론사에서 선정하며 언론사 페이지(아웃링크)로 이동해 볼 수 있습니다.[몸값 높아지는 회계사]인력 유치전에 연봉 \'껑충\'…증원 논란까지\'친모 청부살해 여교사\' 내연남으로 지목받은 김동성..진실은?\'오뚜기 3세\' 함연지, 남편 포함 가족사진 공개...정략결혼설 \'훌훌\'황교안 최순실 몰랐다 vs 오세훈 검증해야...洪 밥 지어놨더니빙상연대 ""전명규에게 직접 폭행 당한 올림픽 메달리스트 제보 있다""좋아요0훈훈해요0슬퍼요0화나요0후속기사 원해요0기사제공 :']"
