,회사명,날짜,언론사,기사제목,링크,본문
5,NC soft, 2019-01-2211:00,뉴시스 ,"게임株, 4분기 실적 부진 우려↑…엔씨소프트만 독야청청",https://finance.naver.com/news/news_read.nhn?article_id=0009024050&office_id=003&mode=search&query=엔씨&page=1,"['       게임株, 4분기 실적 부진 우려↑…엔씨소프트만 독야청청      기사입력2019-01-22 11:00기사원문좋아요훈훈해요좋아요 평가하기공감좋아요0훈훈해요0슬퍼요0화나요0후속기사 원해요0댓글""올해 다수 신작 출시 앞두고 반등 전망도""【서울=뉴시스】권현구 기자 = 15일 오전 서울 강남구 더라움에서 열린 리니지M 서비스 1주년 미디어 행사 \'YEAR ONE\'에 참석한 김택진 엔씨소프트 대표가 인사말을 하고 있다. 2018.05.15. stoweon@newsis.com【서울=뉴시스】이진영 기자 = 게임주의 지난해 4분기 실적이 엔씨소프트를 제외하고 기대를 하회할 것이라는 전망이다. 22일 금융정보업체 에프앤가이드에 따르면 엔씨소프트의 작년 10~12월 영업이익 시장 전망치는 전일 기준 1317억원으로 3개월여 전인 9월 말의 1251억원에 비해 5.2% 확대됐다. 그러나 엔씨소프트를 제외하고 대다수 게임사들의 실적 전망치는 하향 조정됐다. 넷마블의 4분기 영업이익 추정치는 현 611억원으로 지난해 9월 말의 1241억원에 비해 50.8% 하락했다. 넷마블의 4분기 실적 전망치는 작년 9월만 해도 엔씨소프트 비슷한 수준이었으나 신작 블소 레볼루션의 부진으로 반토막 난 것이다. 같은 기간 펄어비스(665억→401억) 39.7%↓, 컴투스(502억→ 386억) 23.1%↓ 등도 4분기 영업이익 전망치가 크게 감소했다. 이런 분위기를 반영해 엔씨소프트는 주가는 상승했지만 다른 게임사들의 주가는 뒷걸음질 쳤다. 지난 21일 기준 엔씨소프트 주가는 49만8000원에 마감, 지난 3분기 말에 비해 12.5% 올랐다. 또한 증권사들의 엔씨소프트에 대한 투자 시각은 더욱 긍정적으로 바뀌고 있다. 키움증권도 이날 엔씨소프트 목표주가를 기존 55만원에서 60만원으로 높였다. 같은 날 교보증권은 엔씨소프트 목표주가를 54만원에서 61만원으로 상향했다.  양사 모두 엔씨소프트에 대한 투자의견은 \'매수\'이다. 박건영 교보증권 연구원은 ""국내 모바일 MMORPG 시장이 레드오션화가 진행 중인 가운데 엔씨소프트의 리니지M이 독보적인 1위를 유지하고 있다""며 ""또한 올해 상반기 리니지2M 출시를 고려하면 게임사 중 증익 가능성이 가장 높다""라고 판단했다.동일 기간 넷마블 -10.0%, 펄어비스 -13.1%, 컴투스 -23.9% 등은 주가가 후퇴했다. 이문종 신한금융투자 연구원은 ""엔씨소프트를 제외한 대부분 게임사의 4분기 실적이 부진할 것""이라면서 ""넷마블은 신작이 부진했고, 펄어비스는 경쟁작 출시로 자사 게임 검은사막 모바일 매출이 하락했으며 컴투스도 연말 마케팅비 증가가 부담 요인으로 작용하고 있다""라고 설명했다. 그렇지만 올해 다수의 신작 출시를 앞두고 게임주의 반등 여지가 크다는 시각이 제기된다. 가령 올해 ▲엔씨소프트: 리니지2M, 블레이드앤소울2 ▲넷마블: 블레이드앤소울 레볼루션 ▲펄어비스: 검은사막 콘솔·모바일 ▲컴투스: 스카이랜더스 링 어브 히어로즈 등이 있다. 이문종 연구원은 ""출시가 지연된 게임들이 나오고 있고 중국 정부가 작년 12월에 판호를 재개한다고 발표했다""며 ""작년 하반기보다 게임주 관련 모멘텀이 풍부하다""라고 말했다. 또한 ""실적 부진이 반영돼 주가가 하락한 것도 매력적인 투자 포인트다""라고 덧붙였다.mint@newsis.com▶ 네이버에서 뉴시스 채널 구독하기▶ 뉴시스 빅데이터 MSI 주가시세표 바로가기 <저작권자ⓒ 공감언론 뉴시스통신사. 무단전재-재배포 금지.>뉴시스 관련뉴스해당 언론사에서 선정하며 언론사 페이지(아웃링크)로 이동해 볼 수 있습니다.승무원에 ""용변 보게 하의 벗겨달라""…엉덩이 뒤처리까지 맡겨처지 비관 분풀이…길 가던 여중생에 \'묻지마\' 흉기 공격\'식물인간 여성 출산\' 요양원 의사 2명 사임·직무정지면허증 위조해 약국 취업·조제한 \'가짜 약사\' 구속美 시카고서 12세 한국계 여아 눈더미에 깔려 사망좋아요0훈훈해요0슬퍼요0화나요0후속기사 원해요0기사제공 :']"
6,NC soft, 2019-01-2210:09,전자신문 ,"[ET투자뉴스]엔씨소프트, ""클라우드 게임은 또…"" BUY(유지)-한화투자증권",https://finance.naver.com/news/news_read.nhn?article_id=0002777529&office_id=030&mode=search&query=엔씨&page=1,"['       [ET투자뉴스]엔씨소프트, ""클라우드 게임은 또…"" BUY(유지)-한화투자증권      기사입력2019-01-22 10:09기사원문좋아요훈훈해요좋아요 평가하기공감좋아요0훈훈해요0슬퍼요0화나요0후속기사 원해요0댓글한화투자증권에서 22일 엔씨소프트(036570)에 대해 ""클라우드 게임은 또 하나의 중장기 성장 요인""라며 투자의견을 \'BUY(유지)\'로 제시하였고, 아울러 목표주가로는 650,000원을 내놓았다. 한화투자증권 김소혜 애널리스트가 동종목에 대하여 이번에 제시한 \'BUY(유지)\'의견은 한화투자증권의 직전 매매의견과 동일한 것이고 전년도말의 매매의견을 기준으로  볼때도 역시 \'매수\'의견이 계속 유지되고 있는 상태이다. 그리고 최근 분기내 발표된 전체 증권사 리포트의 컨센서스와 비교를 해볼 경우에 오늘 발표된 투자의견은 전체의견에 수렴하고 있어, 이번 의견은 시장의 평균적인 기대감이 객관적으로 표현된 것으로 분석되고 있다. 목표주가의 추이를 살펴보면 최근 두차례 연속 상향조정되다가 이번에는 직전 목표가와 동일한 수준을 유지하는 모습이다. 또한 전일 종가 기준으로 볼때 동종목의 현주가는 이번에 제시된 목표가 대비 30.5%의 저평가 요인이 존재한다는 해석이 제시되고 있다. ◆ Report briefing한화투자증권에서 엔씨소프트(036570)에 대해 ""최근 글로벌 게임 산업에서는 크로스플레이와 클라우드 게임이 새로운트렌드로 부상하고 있다. 구글, 마이크로소프트에 이어 아마존까지2020년 클라우드 게임 플랫폼 론칭을 밝히면서 정체되어 있는 게임 시장을 한 단계 성장시킬 것으로 판단된다. 엔씨소프트는 하반기 베타테스트가 진행될 프로젝트TL을 PC와 콘솔을 통합하는 게임으로 개발 중이며, 향후 개발되는 모든 게임은 여러 플랫폼에서 동시 플레이가 가능하도록 개발한다는 계획을 공개했다""라고 분석했다.  또한 한화투자증권에서 ""우리는 동사의 2019년 실적으로 매출액 2.1조 원, 영업이익 8015억 원을 전망한다. 이는 전년 대비 각각 21%, 19% 성장하는 것으로 지속적인 고성장이 유지될 것으로 기대된다. 기존 게임의 라이프사이클이 유지되고 신작이 더해지면서 국내 게임 시장 내에 유례없는 성장 스토리를 보여주고 있다""라고 밝혔다.  한편 ""동사에 대해 투자의견과 목표주가를 그대로 유지한다. 동사는 매크로 불확실성에도 불구하고 국내외 게임사 중에서 가장 견조한 주가를 기록 중이다. 향후 주가 향방은 새롭게 출시될 리니지2M의 흥행 성과에 따라 결정될 것이다. 리니지M을 통해 증명했던 동사의 MMORPG 운영 능력을 감안할 때 흥행 가능성은 여전히 높다고 판단한다""라고 전망했다. ◆ Report statistics한화투자증권의 동종목에 대한 최근 1년동안의 투자의견은 전체적으로 큰 변화없이 유지되고 있다. 목표주가는 2018년2월 500,000원이 저점으로 제시된 이후에 최근에는 650,000원까지 상향조정되고 있다. 한편 증권정보제공 업체인 씽크풀에 따르면 동사에 대한 컨센서스는 \'매수\'이고 목표주가의 추이를 살펴보면 과거 한차례 하향조정된 후에 최근 2회 연속 상향조정되고 있는데, 이번에 조정된 상승폭은 다소 줄어든 추세이다. <컨센서스 하이라이트>\xa0컨센서스최고최저투자의견매수BUY(MAINTAIN)BUY(MAINTAIN)목표주가598,889700,000510,000*최근 분기기준오늘 한화투자증권에서 발표된 \'BUY(유지)\'의견 및 목표주가 650,000원은 전체의견에 수렴하면서 시장의 평균적인 기대감이 비교적 객관적으로 표현된 것으로 풀이되며 목표가평균 대비 8.5% 초과하고 있는 것으로 집계되었다.  참고로 최근에 목표주가를 가장 공격적으로 제시한 미래에셋대우에서 투자의견 \'매수\'에 목표주가 700,000원을 제일 보수적인 의견을 제시한 유진투자증권에서 투자의견 \'BUY(유지)\'에 목표주가 510,000원을 제시한 바 있다. <한화투자증권 투자의견 추이>\xa0의견제시일자투자의견목표가격20190122BUY(유지)650,00020181128BUY(유지)650,00020181112BUY(유지)550,00020180816BUY(유지)500,00020180511매수(유지)500,000<최근 리포트 동향>의견제시일자증권사투자의견목표가20190122한화투자증권BUY(유지)650,00020190122교보증권BUY610,00020190121신한금융투자BUY(유지)550,00020190118현대차증권BUY610,000(씽크풀에서 제공하는 컨센서스는 국내 전증권사에서 발표되는 기업분석 리포트 및 코멘트를 실시간으로 통계/분석처리되고 있습니다.)증시분석 전문기자 로봇 ET etbot@etnews.com전자신문과 금융AI전문기업 씽크풀의 증시분석 전문기자 로봇 ET가 쓴 기사입니다▶ 내 USB가 산업제어시스템 보안을 흔들고 있다?▶ 네이버 모바일에서 [전자신문] 채널 구독하기▶ 전자신문 바로가기 [Copyright ⓒ 전자신문 & 전자신문인터넷, 무단전재 및 재배포 금지]전자신문 관련뉴스해당 언론사에서 선정하며 언론사 페이지(아웃링크)로 이동해 볼 수 있습니다.카카오페이·KT·11번가, 제로페이 합류...이통사·유통·핀테크까지 가세삼성·애플 LCD 스마트폰 전략 \'동상이몽\' 왜?삼성전자, 조기 실적 반등 기대감…2분기 회복하나K-팝 한류 \'K-에듀\'로 잇는다... 부산외대 \'글로벌 연합 사이버대\' 구축 추진에어워터코리아, 공기 수분을 물로 만드는 에어워터시스템 개발좋아요0훈훈해요0슬퍼요0화나요0후속기사 원해요0기사제공 :']"
7,NC soft, 2019-01-2209:43,매일경제 ,"엔씨소프트, 증권사 호평…잇단 목표가 60만원대 상향",https://finance.naver.com/news/news_read.nhn?article_id=0004292828&office_id=009&mode=search&query=엔씨&page=1,"['       엔씨소프트, 증권사 호평…잇단 목표가 60만원대 상향      기사입력2019-01-22 09:43기사원문좋아요훈훈해요좋아요 평가하기공감좋아요0훈훈해요0슬퍼요0화나요0후속기사 원해요0댓글 엔씨소프트에 대한 증권가의 호평이 이어지고 있다. 현재 엔씨소프트의 주가는 40만원 후반대에 머무르고 있지만 증권사는 목표주가를 60만원대로 상향조정하는 상황이다.22일 교보증권은 엔씨소프트에 대해 투자의견 ‘매수’를 유지하고 목표주가를 54만원에서 61만원으로 상향조정했다. 경쟁작 출시에도 리니지M이 1위를 유지하고 있는 점과 상반기 신작 출시로 인한 성장세를 기대했다.  교보증권 박건영 연구원은 “국내 모바일 MMORPG 시장이 레드오션화 진행 중인 가운데 리니지M이 독보적인 1위를 유지하고 있다는 점과 2019년 상반기 리니지2M 출시를 고려하면 게임사 중 증익 가능성이 가장 높다고 판단한다”고 설명했다.이날 키움증권도 목표주가를 기존 55만원에서 60만원으로 높였다. 역시 리니지M이 안정적인 매출을 유지하는 가운데 리니지 리마스터, 리니지2M 등이 더해지는 것을 근거로 꼽았다.키움증권 김학준 연구원은 “예전에 비해 신작들에 대한 기대치가 낮아진 현 시장 상황에서는 실적 안정성과 더불어 신작, 해외 모멘텀을 보유한 엔씨소프트가 가장 매력적”이라고 강조했다.다만 4분기 실적은 전분기 및 전년동기 대비 하향세가 예상된다. 교보증권은 4분기 매출 3897억원, 영업이익 1212억원으로 컨센서스를 하회할 것으로 내다봤다. 키움증권은 3985억원, 영업이익 1209억원이다.[임영택기자 ytlim@mkinternet.com]▶매경 뉴스레터 \'매콤달콤\'을 지금 구독하세요▶뉴스 이상의 무궁무진한 프리미엄 읽을거리[ⓒ 매일경제 & mk.co.kr, 무단전재 및 재배포 금지]매일경제 관련뉴스해당 언론사에서 선정하며 언론사 페이지(아웃링크)로 이동해 볼 수 있습니다.\'글래머 몸매 끝판왕\' 유승옥, 비현실적 S라인 \'입이쩍\'손혜원, 전 보좌관의 문대통령 홍은동 사저매입 보도에 ""처음 듣는 얘기""""교묘한 목격담"" 현빈-손예진, 열애설 부인軍, 적 항공기 탐지·대응 3분→30초로 단축한다美친 옥주현, 아찔한 앞트임 드레스 각선미 드러내다좋아요0훈훈해요0슬퍼요0화나요0후속기사 원해요0기사제공 :']"
8,NC soft, 2019-01-2209:31,전자신문 ,"[ET투자뉴스]엔씨소프트, ""리니지 걱정은 사치…"" BUY-교보증권",https://finance.naver.com/news/news_read.nhn?article_id=0002777501&office_id=030&mode=search&query=엔씨&page=1,"['       [ET투자뉴스]엔씨소프트, ""리니지 걱정은 사치…"" BUY-교보증권      기사입력2019-01-22 09:31기사원문좋아요훈훈해요좋아요 평가하기공감좋아요0훈훈해요0슬퍼요0화나요0후속기사 원해요0댓글교보증권에서 22일 엔씨소프트(036570)에 대해 ""리니지 걱정은 사치 ""라며 투자의견을 \'BUY\'로 제시하였고, 아울러 목표주가로는 610,000원을 내놓았다. 교보증권 박건영 애널리스트가 동종목에 대하여 이번에 제시한 \'BUY\'의견은 교보증권의 직전 매매의견을 그대로 유지하는 것이고 전년도말의 매매의견을 기준으로  볼때도 역시 \'매수\'의견이 계속 유지되고 있는 상태이다. 그리고 최근 분기내 발표된 전체 증권사 리포트의 컨센서스와 비교를 해볼 경우에 오늘 발표된 투자의견은 대체적으로 평균치에 해당하는 수준으로, 이번 의견은 동종목에 대한 전체적인 흐름에서 크게 벗어나지 않은 것으로 분석되고 있다. 목표주가의 추이를 살펴보면 최근 3회이상 지속적으로 상향조정되고 있고 목표가의 상승폭 또한 더욱 커지는 모습이다. 또한 전일 종가 기준으로 볼때 동종목의 현주가는 이번에 제시된 목표가 대비 22.5%의 추가상승여력이 있다는 해석이 제시되고 있다. ◆ Report briefing교보증권에서 엔씨소프트(036570)에 대해 ""엔씨소프트 4Q18 매출액 3,897억원(YoY -26.9%), 영업이익 2,684억원(YoY -36.3%)으로 추정. 컨센서스 매출 4,060억원, 영업이익 1,319억원 하회할 것으로 전망. 리니지M 3Q18 국내 일매출 수준 유지, 분기 평균 일매출 22억원으로 전망. 4Q18 마케팅비용은 리니지 리마스터과 관련 광고로 전 분기 대비 증가했을 것""라고 분석했다.  또한 교보증권에서 ""리니지M은 출시 후 20개월 가까이 1위를 유지 중. 리니지M 주요 유저층은 30대~50대(전체 비중 중 94% 예상)이고 게임에 대한 충섬심이 높은 고객으로 이루어져있기 때문에 2019년에도 일매출 하락세 완만할 것으로 전망. 또한 블레이드앤소울 레볼루션과 같은 대작 출시에도 리니지M은 흔들림 없는 모습을 보여줌""라고 밝혔다.  한편 ""기존 RIM(Residual Income Model)에 적용한 영구성장률 +1%를 +1.5%으로 상향. 2018년 신작 모멘텀 부재 구간에도 리니지M을 통해 안정적인 실적을 보여주었다고 판단. 2019년은 리니지2M를 시작으로 블소 시리즈으로 이어지는 신작 랠리는 향후 주가 상승의 모멘텀으로 작용할 것""라고 전망했다. ◆ Report statistics목표주가는 540,000원이 고점으로, 반대로 430,000원이 저점으로 제시된 이후 이번에 610,000수준으로 새롭게 조정되고 있다. 한편 증권정보제공 업체인 씽크풀에 따르면 동사에 대한 컨센서스는 \'매수\'이고 목표주가의 추이를 살펴보면 과거 한차례 하향조정된 후에 최근 2회 연속 상향조정되고 있는데, 이번에 조정된 상승폭은 다소 줄어든 추세이다. <컨센서스 하이라이트>\xa0컨센서스최고최저투자의견매수BUY(MAINTAIN)BUY(MAINTAIN)목표주가598,889700,000510,000*최근 분기기준오늘 교보증권에서 발표된 \'BUY\'의견 및 목표주가 610,000원은 전체 컨센서스 대비해서 대체적으로 평균치에 해당하는 수준으로, 이번 의견은 동종목에 대한 전체적인 흐름에서 크게 벗어나지 않은 것으로 파악되며 목표가평균과 대비해서 미미한 차이가 나는 것으로 집계되었다.  참고로 최근에 목표주가를 가장 공격적으로 제시한 미래에셋대우에서 투자의견 \'매수\'에 목표주가 700,000원을 제일 보수적인 의견을 제시한 유진투자증권에서 투자의견 \'BUY(유지)\'에 목표주가 510,000원을 제시한 바 있다. <교보증권 투자의견 추이>\xa0의견제시일자투자의견목표가격20190122BUY610,00020181112BUY540,00020181010BUY490,00020180704BUY(유지)430,00020180515매수(유지)430,000<최근 리포트 동향>의견제시일자증권사투자의견목표가20190122교보증권BUY610,00020190121신한금융투자BUY(유지)550,00020190118현대차증권BUY610,00020190117미래에셋대우매수700,000(씽크풀에서 제공하는 컨센서스는 국내 전증권사에서 발표되는 기업분석 리포트 및 코멘트를 실시간으로 통계/분석처리되고 있습니다.)증시분석 전문기자 로봇 ET etbot@etnews.com전자신문과 금융AI전문기업 씽크풀의 증시분석 전문기자 로봇 ET가 쓴 기사입니다▶ 내 USB가 산업제어시스템 보안을 흔들고 있다?▶ 네이버 모바일에서 [전자신문] 채널 구독하기▶ 전자신문 바로가기 [Copyright ⓒ 전자신문 & 전자신문인터넷, 무단전재 및 재배포 금지]전자신문 관련뉴스해당 언론사에서 선정하며 언론사 페이지(아웃링크)로 이동해 볼 수 있습니다.카카오페이·KT·11번가, 제로페이 합류...이통사·유통·핀테크까지 가세삼성·애플 LCD 스마트폰 전략 \'동상이몽\' 왜?삼성전자, 조기 실적 반등 기대감…2분기 회복하나K-팝 한류 \'K-에듀\'로 잇는다... 부산외대 \'글로벌 연합 사이버대\' 구축 추진에어워터코리아, 공기 수분을 물로 만드는 에어워터시스템 개발좋아요0훈훈해요0슬퍼요0화나요0후속기사 원해요0기사제공 :']"
9,NC soft, 2019-01-2209:01,뉴시스 ,"유화증권 ""엔씨소프트, PC와 모바일 모두 기대감 상승""",https://finance.naver.com/news/news_read.nhn?article_id=0009023646&office_id=003&mode=search&query=엔씨&page=1,"['       유화증권 ""엔씨소프트, PC와 모바일 모두 기대감 상승""      기사입력2019-01-22 09:01기사원문좋아요훈훈해요좋아요 평가하기공감좋아요0훈훈해요0슬퍼요0화나요0후속기사 원해요0댓글【서울=뉴시스】김제이 기자 = 유화증권은 22일 엔씨소프트(036570)에 대해 모바일 신작 출시 임박과 더불어 리니지1 리마스터와 규제 완화까지 더해지며 실적 모멘텀이 기대된다며 목표주가를 기존 60만원에서 63만원으로 상향했다. 투자의견은 매수를 유지했다.홍종모 연구원은 ""리니지M, 상반기 출시할 리니지 2M에 이어 이번에는 리니지1이 리마스터로 다시 한 번 \'린저씨\'(리니지와 아저씨 합성어)들을 불러모을 예정""이라면서 ""10년만의 결제한도 규제완화까지 맞물리면서 지금까지 잊고 있었던 온라인게임에서도 실적 상승 모멘텀이 기다리고 있다""고 평가했다.이어 ""앞으로 출시할 모바일게임들의 지식재산권(IP) 파워는 더 이상 설명도 필요 없고, 중국시장에서도 훈풍이 기대된다""며 ""신작출시와 시장상황 개선이 기다리고 있어 다시 한 번 주목할 시점""이라고 강조했다.1분기 말에 리니지1의 리마스터가 정식 서비스에 들어갈 것으로 추정된다. 리마스터를 통해 그래픽 리메이크, 엔드유저를 대상으로 한 대규모 콘텐츠 업데이트가 있다고 알려졌다. 지난 10년내 최대규모의 업데이트로 휴면유저 복귀와 기존유저의 모네타이제이션 모두 가능하다고 홍 연구원은 판단했다.10년만에 온란인 게임의 규제완화 훈풍까지 불어오면 엔씨소프트에 대한 기대감은 더욱 상승 중이다.그는 ""공정거래위원회는 월 50만원 이상 결제가 불가능한 현행 온라인게임 결제한도가 형평성 문제가 있다고 보고 개선방안을 논의 중으로, 이르면 올해 상반기내 조치가 이뤄질 것으로 예상된다"" ""이는 2009년 이후 10년만의 규제완화""라고 설명했다.모바일 게임의 신작 출시도 몰려있다. 또한 게임업종의 주가에 큰 영향을 주는 중국 판호도 발급이 재개되면서 해외시장 진출에 대한 기대감도 다시 살아날 전망이다.홍 연구원은 ""올해 엔씨소프트는 리니지2M, 아이온2와 블레이드앤소울 IP를 활용한 게임 3종까지 총 5종의 대규모 다중 사용자 온라인 롤 플레잉 게임(MMORPG)을 출시할 예정이다""며 ""3개 IP 모두 다년간 서비스하며 코어 팬 층을 보유한만큼 흥행가능성은 높다""고 판단했다.이어 ""보수적으로 일부 게임 출시가 내년으로 지연된다고 가정해도 2년간 5종의 MMORPG를 출시하는 건 창사 이래 최초""라면서 ""해외에서 경쟁력을 가진 IP인 만큼 해외매출도 확대될 것으로 보인다""고 평가했다.jey@newsis.com▶ 네이버에서 뉴시스 채널 구독하기▶ 뉴시스 빅데이터 MSI 주가시세표 바로가기 <저작권자ⓒ 공감언론 뉴시스통신사. 무단전재-재배포 금지.>뉴시스 관련뉴스해당 언론사에서 선정하며 언론사 페이지(아웃링크)로 이동해 볼 수 있습니다.\'두 딸 학대 의혹\' 30대 엄마, 재판서 반전…무죄 확정살인·살인미수 17년 징역 살고 또 지인 살해한 60대에 사형 구형10대 학생에 욕하며 뺨 수차례 때리고 경찰까지 폭행한 50대[단독]일본 ""징용재판 방치땐 파탄""…박근혜 압박[단독] \'하트시그널2\' 오영주, 미스틱 전속…연예활동 본격화좋아요0훈훈해요0슬퍼요0화나요0후속기사 원해요0기사제공 :']"
