,회사명,날짜,언론사,기사제목,링크,본문
0,NC soft, 2019-03-2214:36,SBS Biz ,"앱스플라이어 ‘퍼포먼스 인덱스’, 글로벌 매체 순위 공개",https://finance.naver.com/news/news_read.nhn?article_id=0000179796&office_id=374&mode=search&query=엔씨&page=1,"['       앱스플라이어 ‘퍼포먼스 인덱스’, 글로벌 매체 순위 공개      기사입력2019-03-22 14:36기사원문좋아요훈훈해요좋아요 평가하기공감좋아요0훈훈해요0슬퍼요0화나요0후속기사 원해요0댓글 성공적인 마케팅이란 한정된 자원을 이용해 최대한의 성과를 내는 것이다. 주어진 자원으로 성과를 극대화하기 위해서는 마케팅 목적에 맞는 적합한 채널을 선정하고, 이를 효과적으로 활용하는 것이 중요하다.실제로 마케팅 현장에서는 새로운 글로벌 매체를 탐색하고 실험하는 등 보다 효과적인 미디어 플랜을 수립하기 위한 노력이 이어지고 있다.그 중에서도 세계적인 모바일 어트리뷰션 분석업체 앱스플라이어(AppsFlyer)가 제공하는 퍼포먼스 인덱스는 글로벌 매체의 성과를 순위별로 제시함으로써 마케터들에게 폭넓은 인사이트를 제공하고 있다.분석 카테고리는 쇼핑, 유틸리티, 라이프스타일, 게임 등으로 다양하며, 특히 게임의 경우 캐주얼, 미드코어 & 전략, 소셜 카지노 등으로 세부 장르 랭킹도 함께 제공해 마케팅 현장에서의 활용도를 더욱 높였다. 아울러 높은 성과를 보인 매체를 주요 권역별로 확인할 수 있으므로 글로벌 진출을 노리는 회사들에게 유용한 정보를 제공할 것으로 보인다.퍼포먼스 인덱스의 주요 내용을 살펴보면, 여전히 글로벌 플랫폼의 파워가 막강함을 확인할 수 있다. 페이스북(Facebook)은 특히 향상된 타게팅 및 최적화를 통해 게임 유저 유입 부문에서 좋은 성과를 보였다. 반면, 구글(Google)은 검색의도 모델을 기반으로 비게임 분야에서 점유율을 늘렸으며, 앱 리타게팅 부문에서 190 퍼센트 성장이라는 빠른 성장세를 보였다.2018년 상반기 대비 하반기 성과를 비교한 성장 지수(Growth Index)에는 각 권역별 로컬 매체가 다수 포함되었으며, 중국의 민티그럴(Mintegral)과 웨이보(Weibo), 일본의 디그웰(digwell), 한국의 버즈빌(Buzzvil) 등이 차트 상위권에 이름을 올렸다.앱스플라이어 한국지사 정대훈 고객성공팀장은 “다양한 지역에서 앱 카테고리별로 어떤 애드 네트워크가 어떤 측면에서 우수한 퍼포먼스를 보이는지를 분석할 때, 분석의 모수와 신뢰도는 굉장히 밀접하게 연결된다. 높은 글로벌 점유율과 방대한 데이터를 바탕으로 한 앱스플라이어의 퍼포먼스 인덱스는 마케터들에게 미디어 플래닝의 나침반과 같다""고 전했다.2015년 발간을 시작한 앱스플라이어 퍼포먼스 인덱스는 이번 8차 에디션에서 사상 최초로 중동 및 아프리카 지역을 포함했으며, 대상 권역 수를 11개로 늘렸다. 분석 대상 네트워크는 370개, 분석 앱 수 11,500개로 역대 최대치를 경신했으며, 200억 건의 앱 설치와 390억 건의 앱 실행으로부터 얻은 데이터를 담았다.한편, 2011년 창립한 앱스플라이어는 선도적인 어트리뷰션 기술을 바탕으로 전세계 12,000여개 브랜드를 지원하고 있다. 한국에는 2015년 진출했으며, 주요 고객사로는 비트망고, 토스, 엔씨소프트, 쏘카, 타다, 마켓컬리, 스타일쉐어, 넥스트매치, 29cm, 버드뷰 등이 있다. 온라인 뉴스팀 기자(sbscnbcnews@sbs.co.kr) ☞ 의견 있는 경제채널 SBSCNBC [홈페이지]☞ 경제를 실험한다~ #머니랩 [네이버 TV] 저작권자 SBS플러스 & SBS I&M 무단전재-재배포 금지SBS Biz 관련뉴스해당 언론사에서 선정하며 언론사 페이지(아웃링크)로 이동해 볼 수 있습니다.\'국민연금 1000억 투자\' 청풍리조트 5년간 32억 적자""왜 우리만 덜 내렸지?""…카드수수료 인하 정부발표와 달라토스뱅크 \'좌초\' 위기…신한금융·현대해상·직방 줄이탈오늘 한국vs볼리비아…손흥민·이강인 \'환상 콤비\' 보나삼성, 세계 최초 \'5G 폰\' 판다…이통사도 요금제 개편나서좋아요0훈훈해요0슬퍼요0화나요0후속기사 원해요0기사제공 :']"
1,NC soft, 2019-03-2214:01,한국경제TV ,"엔씨소프트, 5거래일 연속 상승... 전일 대비 3% 상승",https://finance.naver.com/news/news_read.nhn?article_id=0000751405&office_id=215&mode=search&query=엔씨&page=1,"['       엔씨소프트, 5거래일 연속 상승... 전일 대비 3% 상승      기사입력2019-03-22 14:01기사원문좋아요훈훈해요좋아요 평가하기공감좋아요0훈훈해요0슬퍼요0화나요0후속기사 원해요0댓글[한국경제TV 라이온봇 기자][그림 1] 최근 3개월 간 주가 추세 및 기간별 수익률엔씨소프트는 현재 5거래일 연속 상승세를 기록하고 있어 주목할 만하다. 엔씨소프트는 3월 22일 14시 0분 전일 대비 약 3% 상승한 477,000원에 거래되고 있다. 엔씨소프트는 코스피 상장 기업으로 서비스업 업종에 속해 있다. 시가총액은 10조 1,577억원으로 코스피 상장기업 중 29위에 위치 해 있다.[종목 성향 진단][그림 2] 종목 성향 진단엔씨소프트의 투자 스타일은 성장주에 가깝다. 주가 고평가 우려가 공존하지만 높은 성장성이 기대되는 기업이다.주가 모멘텀은 평범한 수준이었다. 최근 1개월 수익률이 4.28%, 3개월 수익률은 -3.54%, 6개월 수익률은 3.12%를 기록했다.엔씨소프트 종목에 대한 투자자의 관심도는 굉장히 높은 편이다.[투자 점수 진단][그림 3] 투자 점수 진단엔씨소프트는 어느 측면에서 투자 매력도가 높은 종목일까?AI 인공지능 종목 분석 시스템을 이용해 성장성, 수익성, 효율성, 안전성, 저평가성, 추세 등 주가 수익률에 영향을 줄 수 있는 6가지 핵심 투자 지표를 점수화하여 종목의 투자 매력도를 계산해보았다.  그 결과 엔씨소프트는 상대적으로 효율성 측면에서 두각을 드러내고 있었다.효율성 점수는 기업의 자산 활용이 얼마나 효율적으로 이뤄지고 있는가를 나타낸다.엔씨소프트는 특히 재고자산회전율 측면에서 가장 높은 점수는 기록했는데, 전체 시장 내 16위를 기록하며 상위 0.81%에 위치했다. 업종별로는 7위를 기록하며 상위 1.13%에 위치했다.그러나 기업의 이익 성장 추세를 나타내는 성장성 측면에서는 아쉬움을 나타냈다.(위의 AI인공지능 점수는 재무 데이터를 기반으로 전체 상장 종목과 비교/분석하여 도출한 점수로 높은 점수가 반드시 높은 수익률을 보장하지 않습니다. 위의 자료는 당사의 추천 종목이 아니며, 투자 시 참고용으로 제시해드리는 것입니다. 핵심투자지표를 결합해 종목의 투자매력도를 종합 계산한 ""인공지능 투자점수""는 ""거장들의 투자공식"" 앱에서 확인하실 수 있습니다.)라이온봇 기자 -한국경제TV※ 본 기사는 한국경제TV와 \'거장들의 투자공식이\'자체 개발한 \'라이온봇 기자\'가 실시간으로 작성한 기사입니다.라이온봇기자 ▶ 네이버 홈에서 [한국경제TV] 채널 구독하기 [생방송보기]▶ 대한민국 재테크 총집결! - [증권 / 주식상담 / 부동산]ⓒ 한국경제TV, 무단 전재 및 재배포 금지한국경제TV 관련뉴스해당 언론사에서 선정하며 언론사 페이지(아웃링크)로 이동해 볼 수 있습니다.60도 이상 뜨거우면...""식도암 위험 매우 높인다""한혜진 기성용 딸, \'엄마 반 아빠 반\' 최강 유전자\'출산 11일\' 박정아...""아가 낳고 인상 변해""\'아빠차\' 쏘나타의 변신...스마트폰으로 주차봄철 냉이는 보약…\'식초\' 넣으면좋아요0훈훈해요0슬퍼요0화나요0후속기사 원해요0기사제공 :']"
2,NC soft, 2019-03-2213:52,파이낸셜뉴스 ,"[fnRASSI]엔씨소프트, 3.02% 오르며 거래량 증가",https://finance.naver.com/news/news_read.nhn?article_id=0004197927&office_id=014&mode=search&query=엔씨&page=1,"['       [fnRASSI]엔씨소프트, 3.02% 오르며 거래량 증가      기사입력2019-03-22 13:52기사원문좋아요훈훈해요좋아요 평가하기공감좋아요0훈훈해요0슬퍼요0화나요0후속기사 원해요0댓글엔씨소프트는 투자자들의 관심으로 현재 거래량이 최근 5거래일 거래량의 최고치를 넘어섰다. 그리고 엔씨소프트는 6일 연속 상승흐름을 보이며, 11시 32분 현재 3.02% 증가한 477,000원에 거래중이다.   퀀트 재무분석, 종합점수 66점                     지표               항목               값               종합점수                 성장성               매출액증가율               0.22               7.25                 자기자본증가율               0.01                 안정성               부채비율               21.74               10                 유동비율               382.71                 이익안정성               10                 수익성               ROA               15.64               9.76                 ROE               19.04                 영업이익율               37.41           엔씨소프트의 퀀트 재무 점수는 27.01점으로 3개월 이전과 동일하다. 상장주식수 대비 거래량은 0.38%로 적정수준 최근 한달간 엔씨소프트의 상장주식수 대비 거래량을 비교해보니 일별 매매회전율이 0.38%로 집계됐다. 그리고 동기간 장중 저점과 고점의 차이인 일평균 주가변동률을 2.4%를 나타내고 있다. \'fnRASSI\'는 금융 AI 전문기업 씽크풀과 파이낸셜뉴스의 협업으로 로봇기자가 실시간으로 생산하는 기사입니다.   fnRASSI@fnnews.com fnRASSI ▶ 세상의 모든 골 때리는 이야기 \'fn파스\'▶ 속보이는 연예뉴스 fn스타  ※ 저작권자 ⓒ 파이낸셜뉴스. 무단 전재-재배포 금지파이낸셜뉴스 관련뉴스해당 언론사에서 선정하며 언론사 페이지(아웃링크)로 이동해 볼 수 있습니다.\'휴가 때마다 XX랑 성관계..\' 예비 초등교사들의 카톡방에는..정준영 ""처분 따르겠다""며 눈물 글썽이더니 돌연..아내에게 보이는 이 행동, 男 성기능이 저하됐다는 신호?외식 후 집에 돌아온 남편, 아내부터 살해하고..이정미 대표, 창원서 ""70만원 월세 오피스텔에..""좋아요0훈훈해요0슬퍼요0화나요0후속기사 원해요0기사제공 :']"
3,NC soft, 2019-03-2209:40,매일경제 ,"엔씨소프트, 리니지 리마스터 출시 앞두고 6거래일째 상승",https://finance.naver.com/news/news_read.nhn?article_id=0004324695&office_id=009&mode=search&query=엔씨&page=1,"['       엔씨소프트, 리니지 리마스터 출시 앞두고 6거래일째 상승      기사입력2019-03-22 09:40기사원문좋아요훈훈해요좋아요 평가하기공감좋아요0훈훈해요0슬퍼요0화나요0후속기사 원해요0댓글 엔씨소프트가 6거래일 연속 오름세다. 오는 27일 서비스를 시작하는 ‘리니지 리마스터’ 기대감이 작용하는 것으로 풀이된다.22일 오전 9시 32분 엔씨소프트는 전거래일 대비 2.92% 오른 47만6500원에 거래되고 있다. 지난 15일부터 6거래일째 상승흐름이다.  엔씨소프트는 오는 27일 대표작 ‘리니지’의 업그레이드 버전인 ‘리니지 리마스터’를 출시한다. 풀HD급 그래픽을 적용하고 자동사냥과 아이템 구매 등 35가지 기능을 제공하는 플레이서포트 시스템, 각 서버의 이용자가 모여 격돌하는 월드공성전 등 다양한 신기능이 더해진다.또 엔씨소프트는 오는 2분기에는 ‘리니지M’의 일본 서비스도 진행할 예정이다. 이미 현지 사전예약을 시작했다.[임영택기자 ytlim@mkinternet.com]▶매경 뉴스레터 \'매콤달콤\'을 지금 구독하세요▶뉴스 이상의 무궁무진한 프리미엄 읽을거리[ⓒ 매일경제 & mk.co.kr, 무단전재 및 재배포 금지]매일경제 관련뉴스해당 언론사에서 선정하며 언론사 페이지(아웃링크)로 이동해 볼 수 있습니다.""감사대란""…대기업마저 보고서 제때못내""못 버티겠다""…분양권도 곳곳서 급매물진경, 이혼사실 고백 ""사실 한 번 갔다왔다""美해안경비함 \'버솔프\' 25일 제주 입항노현정, 정대선 팔짱끼고 \'故정주영 18주기\' 제사 참석좋아요0훈훈해요0슬퍼요0화나요0후속기사 원해요0기사제공 :']"
4,NC soft, 2019-03-2209:10,전자신문 ,"[ET투자뉴스]엔씨소프트_거래비중 기관 37.38%, 외국인 42.28%",https://finance.naver.com/news/news_read.nhn?article_id=0002794726&office_id=030&mode=search&query=엔씨&page=1,"['       [ET투자뉴스]엔씨소프트_거래비중 기관 37.38%, 외국인 42.28%      기사입력2019-03-22 09:10기사원문좋아요훈훈해요좋아요 평가하기공감좋아요0훈훈해요0슬퍼요0화나요0후속기사 원해요0댓글     관련종목들 가운데 변동폭 작아도 수익율은 높아 22일 오전 9시5분 현재 전일대비 1.94% 오른 472,000원을 기록하고 있는 엔씨소프트는 지난 1개월간 6.91% 상승했다.  같은 기간동안 변동성의 크기를 말해주는 표준편차는 1.6%를 기록했다.  이는 코스피 업종내에서 주요종목들과 비교해볼 때 엔씨소프트의 월간 주가수익률은 가장 높았지만 변동성은 상대적으로 낮은 수준을 유지했다는 뜻이다.  최근 1개월을 기준으로 엔씨소프트의 위험을 고려한 수익률은 4.3을 기록했는데, 변동성이 낮은 상태에서 주가흐름 또한  양호했기 때문에 위험대비 수익률은 가장 높은 수준을 유지했다.   뿐만아니라 코스피업종의 위험대비수익률인 -2.6보다도 높기 때문에 업종대비 성과도 좋았다고 할 수 있다. 다음으로 업종과 시장을 비교해보면 엔씨소프트가 속해 있는 코스피업종은 서비스업지수보다 변동성은 높고, 등락률은 낮은 모습이다.   하락할 때 지수보다 탄력을 받고 있다는 의미이다.      \xa0 표준편차 수익율  위험대비 수익율   카카오 2.2% 3.8% 1.7   NAVER 1.9% 0.4% 0.2   넷마블 1.8% 1.3% 0.7   엔씨소프트 1.6% 6.9% 4.3   삼성에스디에스 1.5% -1.7% -1.1   서비스업 0.6% 0.7% 1.1   코스피 0.7% -1.6% -2.6    관련종목들 혼조세, 서비스업업종 +0.02%   이 시각 현재 관련종목들은 혼조세를 보이고 있으나 서비스업업종은 0.02% 상승중이다.  삼성에스디에스 231,500원▼1500(-0.64%) 카카오 103,500원▲1000(+0.98%)  NAVER 127,500원▼500(-0.39%) 넷마블 116,500원▲1000(+0.87%)    증권사 목표주가 605,000원, 현재주가 대비 28% 추가 상승여력    최근 한달간 제시된 증권사 투자의견을 종합해보면 엔씨소프트의 평균 목표주가는 605,000원이다.  현재 주가는 472,000원으로 133,000원(28%)까지 추가상승 여력이 존재한다.  증권사별로 보면  키움증권의 김학준 에널리스트가 "" 양질의 IP들과 탄탄한 실적, 국내에서 가장 양질의 IP를 보유…"" (이)라며 투자의견 BUY(유지)에 목표주가:     600,000원을 제시했고, 이베스트투자증권의 성종화 에널리스트가 "" 리니지2 M 일정 연기 노이즈 일단락. 이제 앞만 보자, 리니지 M 일본, 리니지2 M 국내 모멘텀 가동 전 양념 모멘텀: 1) 2/15(금)부터 사전예약 시작. 2Q19 론칭 예상2) 리니지2 M 국내 모멘텀 가동 전 의미 있는 양념 모멘텀 역할 기대…"" (이)라며 투자의견 Buy (maintain)에 목표주가:     610,000원을 제시했다.   3월14일에 엔씨소프트 4/4분기(2018년10월~12월)실적 발표됨  <발표치> 매출액 영업이익 당기순이익   4/4분기 3,997.0억 1,126.0억 676.0억   직전분기 대비 1.0% 감소 19.0% 감소 28.4% 감소   전년동기 대비 25.1% 감소 40.5% 감소 44.0% 감소    [재무분석 특징]  영업이익률 현재 38.03%로 업종평균 상회. PER은 17.73으로 업종평균보다 낮으며, PBR은 3.88로 다소 높은편.     업종내 시가총액 규모가 가장 비슷한 4개 종목과 비교해보면 엔씨소프트는 순이익대비 현재의 주가수준을 보여주는 PER은 가장 낮은 수준을 보이고 있는 반면에, 자산가치대비 현재의 주가수준을 나타내는 PBR은 가장 높은 수준을 보이고 있다.     엔씨소프트 넷마블 NAVER 카카오 삼성에스디에스   ROE 21.9 6.3 12.1 1.5 9.7   PER 17.7 33.1 30.2 101.2 30.0   PBR 3.9 2.1 3.7 1.6 2.9   기준년월 2018년9월 2018년9월 2018년9월 2018년9월 2018년9월 외국인/기관 순매수, 개인은 순매도(한달누적)3월15일부터 전일까지 기관이 5거래일 연속 동종목을 사들였다.  4주간을 기준으로 보면 외국인이 매매관점을 매도에서 매수로 전환하면서 4,389주를 순매수했고, 기관도 방향성있는 매매를 하면서 54,357주를 순매수했다.  반면 개인들은 매도 우위로 반전되면서 58,023주를 순매도한 것으로 나타났다.   투자주체별 누적순매수  상장주식수 대비 거래량은 0.38%로 적정수준최근 한달간 엔씨소프트의 상장주식수 대비 거래량을 비교해보니 일별 매매회전율이 0.38%로 집계됐다.  그리고 동기간 장중 저점과 고점의 차이인 일평균 주가변동률을 2.4%를 나타내고 있다. 거래비중 기관 37.38%, 외국인 42.28%최근 한달간 주체별 거래비중을 살펴보면 외국인이 42.28%로 가장 높은 참여율을 보였고, 기관이 37.38%를 보였으며 개인은 20.26%를 나타냈다.  그리고 최근 5일간 거래비중은 기관 비중이 41.29%로 가장 높았고, 외국인이 39.12%로 그 뒤를 이었다.  개인은 19.37%를 나타냈다.   투자주체별 매매비중  ＊기관과 외국인을 제외한 개인 및 기타법인 등의 주체는 모두 개인으로 간주하였음   주가와 투자심리는 강세, 거래량은 보통   현주가를 최근의 주가변화폭을 기준으로 본다면 상승추세를 유지하고 있고, 거래량 지표로 볼 때는 적정한 수준에서 특별한 변화는 포착되지 않고 있다.  실리적인 측면에서는 주가흐름처럼 투자심리도 개선되고 있고 이동평균선들의 배열도를 분석을 해보면 지속됐던 하락국면을 마무리하면서 상승국면으로의 전환가능성이 높아지고 있다.      주요 매물구간인 445,000원선이 지지대로 작용.   최근 세달동안의 매물대 분포를 살펴보면, 현주가 아래로 445,000원대의 대형매물대가 눈에 뜨이고, 이중에서 445,000원대는 전체 거래의 18%선으로 가격대에서 뚜렷하게 크게 발생한 것은 아니지만 상대적으로 거래규모가 큰 구간이 되고 향후 주가가 조정받을때 수급적인 강력한 지지대가 될 가능성을 고려할 필요가 있고, 그리고 468,000원대의 매물대 또한 규모가 약하기는하지만 향후 주가가 방향을 잡으면 어느쪽으로도 지지 또는 저항매물대로 힘을 발휘할 수있다.  따라서 주가가 단기적인 상승을 전개하고 있는 현재 상황에서는, 제2매물대인 468,000원대의 지지가능성에 보다 더 큰 비중을 두는 시각이 합리적이고, 아직은 제2매물가격대까지는 거리가 꽤 남아있고, 당분간 물량적인 부담이 없기 때문에 추가상승시에 큰 걸림돌은 없을듯 하고, 468,000원대의 지지대 역할은 좀더 기다릴 필요가 있다.       [포인트검색]   3월21일 :(주)엔씨소프트 감사보고서 제출 증시분석 전문기자 로봇 ET etbot@etnews.com전자신문과 금융AI전문기업 씽크풀의 증시분석 전문기자 로봇 ET가 쓴 기사입니다▶ 네이버 모바일에서 [전자신문] 채널 구독하기▶ 전자신문 바로가기 [Copyright ⓒ 전자신문 & 전자신문인터넷, 무단전재 및 재배포 금지]전자신문 관련뉴스해당 언론사에서 선정하며 언론사 페이지(아웃링크)로 이동해 볼 수 있습니다.8세대 \'쏘나타\' 출시...""이름 빼고 다 바꿨다""중국업체, 국산 배터리 탑재 전기차 5대 형식승인 신청SK 신약 FDA 첫 허가...나스닥까지 간다작년 석탄발전 비중 42% 여전히 압도적…각계 ""LNG 전환 서둘러야""신한금융은 왜 비바리퍼블리카를 버렸나?...\'토스뱅크\' 위기좋아요0훈훈해요0슬퍼요0화나요0후속기사 원해요0기사제공 :이 기사는 뉴스제휴평가위원회 \'뉴스제휴 및 제재 심사 규정\'에 따라노출 중단된 기사입니다.이전페이지목록보기인쇄하기목록보기증시 주요뉴스[클릭! 해외증시 이 종목] 드라이브 스루 확..[마켓뷰] 코스피, 3200선 겨우 지켜.....[마감시황]코스피, 개인 3조 매수에도 1.2..[Asia마감]美 기술주 급락에 일본·홍콩 줄..[시황종합] 코스피 1.23% 하락 3209 ..[외환마감]환율 2거래일만 상승..1110원 ..[코스닥 마감]인플레 우려에 \'970선\'까지 ..[Asia오전] 美 기술주 급락 여파…닛케이·..이전 페이지로 돌아가기|맨위로더보기“공매도 별거 없네”… 공격받은 ‘톱5’ 모두 주가 올라[마켓뷰] 코스피, 3200선 겨우 지켜...SKIET는 시총 11조 마감날아간 \'따상 꿈\'장 마감 후 기업공시[5월 11일][특징주] 삼아알미늄, 국제 알루미늄 가격 상승에 강세코스피 강세장 올까…성장주보다는 경기민감주[株포트라이트][이종우 증시 맥짚기] \'원자재 가격 급등\'이 주가에 미칠 영향은?KT, 1분기 영업이익 4442억원…""디지코 성장 속도""(종합)더보기인기검색어SK아이이테크놀로지154,500삼성전자81,200포스코강판74,000HMM44,400SK하이닉스123,000이용약관금융게시판 운영원칙개인정보처리방침책임의 한계와 법적고지금융 고객센터네이버(주)가 제공하는 금융 정보는 각 콘텐츠 제공업체로부터 받는 투자 참고사항이며, 오류가 발생하거나 지연될 수 있습니다.네이버(주)와 콘텐츠 제공업체는 제공된 정보에 의한 투자 결과에 법적인 책임을 지지 않습니다. 게시된 정보는 무단으로 배포할 수 없습니다.콘텐츠 제공업체코스콤 : 실시간 주가정보 및 국내시세정보에프앤가이드 : 기업 및 재무정보KG제로인 : 해외 시세, 시장지표 및 펀드 정보한국예탁결제원 : 주주총회일 및 전자투표 정보인포스탁 : 국내 테마 정보Copyright ©NAVER Corp.All Rights Reserved.']"
