,회사명,날짜,언론사,기사제목,링크,본문
10,NC soft, 2019-01-2208:59,서울경제 ,"엔씨소프트, 올해 나올 신작만 5개...“신작모멤텀과 실적안정성”",https://finance.naver.com/news/news_read.nhn?article_id=0003490947&office_id=011&mode=search&query=엔씨&page=1,"['       엔씨소프트, 올해 나올 신작만 5개...“신작모멤텀과 실적안정성”      기사입력2019-01-22 08:59기사원문좋아요훈훈해요좋아요 평가하기공감좋아요0훈훈해요0슬퍼요0화나요0후속기사 원해요0댓글 [서울경제] 키움증권은 22일 엔씨소프트(036570)에 대해 지난해 4·4분기 매출액은 3,985억원, 영업이익이 1,209억원으로 시장기대치에 부합할 것으로 봤다. 경쟁작의 등장에도 리니지M매출이 안정적으로 유지된가운데 야구단 등 일부 비용부분에서 확대가 이익을 소폭 감소하게 할 것으로 추정했다. 김학준 키움증권 연구원은 “올해는 리마스터 출시오 리니지2M 등의 신작효과가 더해져 기대치가 점차 확대될 것”이라고 설명했다.작년 하반기에 박힌 올해 신작은 5개다. 리지니2M을 비롯, 아아온2 블소3종의 모바일게임이 나올 예정이다. 김 연구원은 “2·4분기에 리니지M의 신작 출시 이후 반기에 1~2개의 게임들이 이어질 것”으로 “상저하고의 실적 흐름이 전망된다”고 말했다. 투자의견은 매수, 목표가는 60만원을 제시했다.  /김보리기자 boris@sedaily.com [서울경제 바로가기]Telegram으로 서울경제 뉴스를 실시간으로 받아보세요 [바로가기▶]프리미엄 미디어 Signal이 투자의 바른 길을 안내합니다 [바로가기▶]저작권자 ⓒ 서울경제, 무단 전재 및 재배포 금지서울경제 관련뉴스해당 언론사에서 선정하며 언론사 페이지(아웃링크)로 이동해 볼 수 있습니다.""월14만원이면 되는데"" 무인화 쓰나미에 잘리는 직원""더 떨어지면···"" 시세 수억씩 빠진 \'마용성\' 그곳은 지금너무 안 팔리는 \'아이폰SE\' 때문에···다급한 애플의 선택[단독] 현대차, 사드이후 中에 첫 \'친환경 변속기\' 공장김태우 ""반부패실 회식 건배사는 \'조국\'을 위하여였다""좋아요0훈훈해요0슬퍼요0화나요0후속기사 원해요0기사제공 :']"
11,NC soft, 2019-01-2208:38,이데일리 ,"엔씨소프트, 실적·신작 모멘텀 기대…목표가↑-유화",https://finance.naver.com/news/news_read.nhn?article_id=0004296580&office_id=018&mode=search&query=엔씨&page=1,"[""       엔씨소프트, 실적·신작 모멘텀 기대…목표가↑-유화      기사입력2019-01-22 08:38기사원문좋아요훈훈해요좋아요 평가하기공감좋아요0훈훈해요0슬퍼요0화나요0후속기사 원해요0댓글[이데일리 이후섭 기자] 유화증권은 22일 엔씨소프트(036570)에 대해 올해 온라인게임 실적 모멘텀과 더불어 모바일게임 신작 출시가 기대된다고 진단했다. 목표가를 종전 60만원에서 63만원으로 상향 조정했으며, 투자의견은 `매수`를 유지했다.홍종모 유화증권 연구원은 “올해 1분기 말 리니지1의 대규모 업데이트 버전인 `리니지:리마스터`가 정식 서비스에 들어갈 것으로 예상된다”며 “지난 10년 내 최대 규모의 업데이트이며, 이를 통해 휴면 유저 복귀와 기존 유저의 모네타이제이션 모두 가능할 것”이라고 판단했다. 지난해 3분기 기준 엔씨소프트의 온라인게임 매출 비중이 30%로 주요 게임사 중 가장 높으며, 향후 온라인게임 부문 모네타이제이션 모델 도입으로 전체적인 가격 상승이 기대된다는 평가다.온라인게임 규제완화도 기대된다. 홍 연구원은 “공정위는 월 50만원 이상 결제가 불가능한 현행 온라인게임 결제한도가 형평성 문제가 있다고 보고 개선방안을 논의 중”이라며 “이르면 올해 상반기내 조치가 이뤄질 것”이라고 내다봤다.모바일게임 신작 출시와 중국시장 진출 기대도 높다. 엔씨소프트는 올해 `리니지2M` `아이온2`와 `블레이드앤소울` 지적재산권(IP)을 활용한 게임 3종까지 총 5종의 다중접속역할수행게임(MMORPG)을 출시할 예정이다. 홍 연구원은 “IP를 활용한 3개의 게임 모두 다년간 서비스하며 핵심 팬 층을 보유한 만큼 흥행 가능성은 높다”며 “리니지2는 일본, 블레이드앤소울은 중국, 아이온은 북미시장에서 성과를 거둔 IP인 만큼 해외 매출도 확대될 것”이라고 판단했다.이어 그는 “중국 정부가 지난해 말 판호 발급을 재개하면서 해외 IP를 사용한 게임 판호도 발급한 만큼 향후 외자판호 발급 가능성도 높아 보인다”며 “판호 발급 재개시 리니지2 레볼루션, 블레이드앤소울 레볼루션 로열티 수익을 기대할 수 있으며, 중장기적으로는 중국에서 인기가 높은 블레이드앤소울 IP 기반의 MMORPG 3종 중국 진출이 기대된다”고 덧붙였다.이후섭 (dlgntjq@edaily.co.kr)네이버에서 이데일리 [구독하기▶], 꿀잼가득 [영상보기▶]빡침해소! 청춘뉘우스~ [스냅타임▶]＜ⓒ종합 경제정보 미디어 이데일리 - 무단전재 & 재배포 금지＞이데일리 관련뉴스해당 언론사에서 선정하며 언론사 페이지(아웃링크)로 이동해 볼 수 있습니다.[몸값 높아지는 회계사]인력 유치전에 연봉 '껑충'…증원 논란까지XXX 박아라… 학생들 '원산폭격' 시키고 폭행한 교수'오뚜기 3세' 함연지, 남편 포함 가족사진 공개...정략결혼설 '훌훌'황교안 최순실 몰랐다 vs 오세훈 검증해야...洪 밥 지어놨더니'건강 챙기자'…치맥 대신 샐러드 찾는 아재들좋아요0훈훈해요0슬퍼요0화나요0후속기사 원해요0기사제공 :""]"
12,NC soft, 2019-01-2208:04,이데일리 ,"엔씨소프트, 신작 효과로 올해도 성장 전망…목표가↑-키움",https://finance.naver.com/news/news_read.nhn?article_id=0004296547&office_id=018&mode=search&query=엔씨&page=1,"[""       엔씨소프트, 신작 효과로 올해도 성장 전망…목표가↑-키움      기사입력2019-01-22 08:04기사원문좋아요훈훈해요좋아요 평가하기공감좋아요0훈훈해요0슬퍼요0화나요0후속기사 원해요0댓글[이데일리 김성훈 기자] 키움증권은 22일 엔씨소프트(036570)에 대해 리마스터 출시 및 리니지2M 등의 신작 효과로 올해 실적 기대치가 점차 확대될 것으로 전망했다. 투자의견은 매수를 유지하고 목표주가는 55만원에서 60만원으로 9%(5만원) 상향 조정했다. 김학준 키움증권 연구원은 “엔씨소프트의 지난해 4분기 매출은 3985억원, 영업이익은 1209억원으로 시장 기대치에 부합할 것으로 보인다”며 “리니지M의 12월 업데이트, 연말 성수기 패키지 효과로 안정적 성과를 거둔 것으로 판단된다”고 말했다. 키움증권에 따르면 지난해 1차 테스트를 진행한 리마스터는 이달 29일부터 내달 20일까지 2차 테스트를 진행한다. 1차 테스트의 피드백 반영을 위한 것으로 그래픽 미세 조정 및 자동사냥의 개선 등이 주요 목적이다. 이에 따라 리마스터 출시는 3월에 이뤄질 것으로 보이며 1분기에도 리니지의 매출은 긍정적 흐름을 나타낼 것이라는 게 김 연구원의 설명이다. 그는 “리니지는 통상적으로 1분기에 이벤트가 부재한 경우가 많아 매출이 감소하는 특성을 있었지만 리마스터 출시가 1분기에 이뤄진다면 반대로 매출이 증가할 수 있다”며 “2분기에는 리니지2M을 비롯해 아이온2, 블소 3종이 출시될 계획으로 상저하고의 실적 흐름이 전망된다”고 분석했다.김성훈 (sk4he@edaily.co.kr)네이버에서 이데일리 [구독하기▶], 꿀잼가득 [영상보기▶]빡침해소! 청춘뉘우스~ [스냅타임▶]＜ⓒ종합 경제정보 미디어 이데일리 - 무단전재 & 재배포 금지＞이데일리 관련뉴스해당 언론사에서 선정하며 언론사 페이지(아웃링크)로 이동해 볼 수 있습니다.[몸값 높아지는 회계사]인력 유치전에 연봉 '껑충'…증원 논란까지XXX 박아라… 학생들 '원산폭격' 시키고 폭행한 교수'오뚜기 3세' 함연지, 남편 포함 가족사진 공개...정략결혼설 '훌훌'황교안 최순실 몰랐다 vs 오세훈 검증해야...洪 밥 지어놨더니'건강 챙기자'…치맥 대신 샐러드 찾는 아재들좋아요0훈훈해요0슬퍼요0화나요0후속기사 원해요0기사제공 :""]"
13,NC soft, 2019-01-2207:57,머니투데이 ,"엔씨소프트, 안정성 바탕으로 점진적 성장 기대-키움증권",https://finance.naver.com/news/news_read.nhn?article_id=0004163372&office_id=008&mode=search&query=엔씨&page=1,"['       엔씨소프트, 안정성 바탕으로 점진적 성장 기대-키움증권      기사입력2019-01-22 07:57기사원문좋아요훈훈해요좋아요 평가하기공감좋아요0훈훈해요0슬퍼요0화나요0후속기사 원해요0댓글 [머니투데이 진경진 기자] 키움증권은 엔씨소프트에 대해 안정성을 바탕으로 점진적 성장이 기대된다고 밝혔다. 이에 투자의견 매수와 목표가 60만원을 유지했다.김학준 연구원은 22일 ""엔씨소프트의 4분기 실적은 매출액 3985억원, 영업이익 1209억원으로 전 분기 대비 각각 1.3%, 13.1% 줄어들 것""이라며 ""경쟁작의 등장에도 리니지M의 매출이 안정적으로 유지된 가운데 야구단 등 일부 비용부분에서의 확대가 이익을 소폭 감소하게 했다""고 설명했다.김 연구원은 ""올해는 리마스터 출시 및 리니지2M 등의 5개의 신작 효과가 더해질 예정""이라며 ""리니지2M의 출시가 2분기로 전망되고, 하반기에 1~2개 게임들이 이어져 상저하고의 실적 흐름이 전망된다""고 기대했다.그러면서 ""현 게임시장은 예전에 비해 신작에 대한 기대치가 많이 낮아졌다""며 ""하지만 실적 안정성과 함께 신작과 해외 모멘텀을 보유한 엔씨소프트는 가장 매력적""이라고 평가했다.▶창립20주년 기획 \'영리더\'▶남기자의 체헐리즘 모아보기 ▶뉴스는 머니투데이 진경진 기자 jkjin@mt.co.kr<저작권자 ⓒ \'돈이 보이는 리얼타임 뉴스\' 머니투데이, 무단전재 및 재배포 금지> 머니투데이 관련뉴스해당 언론사에서 선정하며 언론사 페이지(아웃링크)로 이동해 볼 수 있습니다.""7년동안 집값 200만원 올랐는데""… 목포주민들 \'손혜원 논란\' 시각은""영하 10도, 거리가 일터""…추워도 치마입고 \'덜덜\'""토요일, 새벽 3시, 열린 창문으로 그놈이 들어왔다""전세계 조선사 절반 문닫는다..韓 1위 \'장기집권\' 간다""한국이 싫어서""… 이민 왜 가셨어요? (영상)좋아요0훈훈해요0슬퍼요0화나요0후속기사 원해요0기사제공 :']"
14,NC soft, 2019-01-2207:56,아이뉴스24 ,"[I-리포트] 엔씨소프트, 신작+해외 모멘텀 보유… 목표가↑ -키움證",https://finance.naver.com/news/news_read.nhn?article_id=0000478937&office_id=031&mode=search&query=엔씨&page=1,"['       [I-리포트] 엔씨소프트, 신작+해외 모멘텀 보유… 목표가↑ -키움證      기사입력2019-01-22 07:56기사원문좋아요훈훈해요좋아요 평가하기공감좋아요0훈훈해요0슬퍼요0화나요0후속기사 원해요0댓글2분기부터 신작 이어질 전망[아이뉴스24 장효원 기자] 키움증권은 22일 엔씨소프트에 대해 실적 안정성과 신작, 해외 모멘텀을 보유했다며 목표주가를 60만원으로 상향 조정했다.김학준 키움증권 애널리스트는 이날 보고서에서 ""엔씨소프트의 지난해 4분기 매출은 3천985억원, 영업이익 1천209억원이 예상된다""며 ""리니지M의 12월 업데이트, 연말 성수기 패키지 효과로 안정적 성과를 거둔 것으로 판단된다. 안정성은 상당기간 걱정할 필요가 없을 것으로 보인다""고 분석했다.지난해 1차 테스트를 진행한 \'리니지: 리마스터\'에 대한 기대감도 드러냈다. 3월에 출시해 1분기에도 리니지의 매출은 긍정적 흐름을 나타낼 수 있다는 것이다.김 애널리스트는 ""리니지는 통상적으로 1분기에 이벤트가 부재한 경우가 많아 매출이 감소하는 특성을 있었지만 리마스터 출시가 1분기에 이뤄진다면 반대로 매출이 증가할 수 있다""며 ""2분기에는 리니지2M을 비롯해 아이온2, 블소 3종이 출시될 계획이다. 상저하고의 실적 흐름이 전망된다""고 분석했다.장효원기자 specialjhw@inews24.com▶네이버 채널에서 \'아이뉴스24\'를 구독해주세요.▶아이뉴스TV에서 부동산 고수를 만나보세요.[ⓒ 아이뉴스24 무단전재 및 재배포 금지]아이뉴스24 관련뉴스해당 언론사에서 선정하며 언론사 페이지(아웃링크)로 이동해 볼 수 있습니다.SIEK, 플레이스테이션4 기간 한정 특가 판매""반도체 호황 끝 아니다…잠시 주춤, 3분기 반등""[백종원 인터뷰①] ""방송 활동으로 사업 확장?…사실 아냐""SK·KT·한화·GS·대성 경제인 다보스行[핫클립]30만개 블록으로 만든 쉐보레 트럭좋아요0훈훈해요0슬퍼요0화나요0후속기사 원해요0기사제공 :']"
15,NC soft, 2019-01-2207:13,한국경제 ,"""엔씨소프트, 리니지M 굳건…점진적 성장 기대""-키움",https://finance.naver.com/news/news_read.nhn?article_id=0004082278&office_id=015&mode=search&query=엔씨&page=1,"['       ""엔씨소프트, 리니지M 굳건…점진적 성장 기대""-키움      기사입력2019-01-22 07:13기사원문좋아요훈훈해요좋아요 평가하기공감좋아요0훈훈해요0슬퍼요0화나요0후속기사 원해요0댓글 [ 윤진우 기자  ] 키움증권은 22일 엔씨소프트에 대해 ""지난 4분기 실적은 시장 기대치에 부합할 것으로 전망된다""며 목표주가 60만원, 투자의견 \'매수\'를 제시했다.김학준 연구원은 ""엔씨소프트의 지난해 4분기 매출은 3985억원, 영업이익 1209억원이 예상된다""며 ""리니지M의 12월 업데이트, 연말 성수기 패키지 효과로 안정적 성과를 거둔 것으로 판단된다. 안정성은 상당기간 걱정할 필요가 없을 것으로 보인다""고 평가했다.지난해 1차 테스트를 진행한 \'리니지: 리마스터\'에 대한 기대감도 드러냈다. 3월에 출시해 1분기에도 리니지의 매출은 긍정적 흐름을 나타낼 수 있다는 것이다.김 연구원은 ""리니지는 통상적으로 1분기에 이벤트가 부재한 경우가 많아 매출이 감소하는 특성을 있었지만 리마스터 출시가 1분기에 이뤄진다면 반대로 매출이 증가할 수 있다""며 ""2분기에는 리니지2M을 비롯해 아이온2, 블소 3종이 출시될 계획이다. 상저하고의 실적 흐름이 전망된다""고 분석했다.윤진우 한경닷컴 기자 jiinwoo@hankyung.com[한경닷컴 바로가기] [모바일한경 구독신청] 네이버에서 한국경제 채널 구독하기 <자세히 보기> ⓒ 한국경제 & hankyung.com, 무단전재 및 재배포 금지한국경제 관련뉴스해당 언론사에서 선정하며 언론사 페이지(아웃링크)로 이동해 볼 수 있습니다.""문 대통령, 현실 너무 모른다"" 전문가의 경고""현대차랑 기아차랑 사둘 걸"" 두 달 만에…\'7억\'하던 고덕아파트, 지금 얼만가 보니태국 불법체류자, 강원도 농장에서 일하고 받는 돈이""28년 만에 처음""…공포 휩싸인 중국좋아요0훈훈해요0슬퍼요0화나요0후속기사 원해요0기사제공 :']"
