,회사명,날짜,언론사,기사제목,링크,본문
7,NC soft, 2019-08-0508:13,뉴시스 ,"하이투자證 ""엔씨소프트, 4분기 '리니지 2M' 출시…상승동력↑""",https://finance.naver.com/news/news_read.nhn?article_id=0009383621&office_id=003&mode=search&query=엔씨&page=1,"['       하이투자證 ""엔씨소프트, 4분기 \'리니지 2M\' 출시…상승동력↑""      기사입력2019-08-05 08:13기사원문좋아요훈훈해요좋아요 평가하기공감좋아요0훈훈해요0슬퍼요0화나요0후속기사 원해요0댓글【서울=뉴시스】류병화 기자 = 하이투자증권은 5일 엔씨소프트(036570)에 대해 신작 \'리니지 2M\'을 연기 없이 출시할 예정으로 신작 상승동력을 받게 될 것이라고 전망했다. 투자의견은 매수, 목표주가는 75만원을 유지했다. 엔씨소프트는 올해 2분기 매출이 4108억원으로 전년 동기 대비 5.9% 감소한 것으로 집계됐다. 영업이익은 1294억원으로 18.9% 줄었다.김민정 하이투자증권 연구원은 ""영업이익은 시장 예상치를 대폭 상회했다""며 ""개인용 컴퓨터(PC)와 모바일게임 모두 견조한 성장을 기록한 가운데 해외 자회사 조직 개편에 따른 퇴직금 등 일회성 요인 제거되면서 인건비 또한 효율화됐다""고 설명했다.엔씨소프트는 모바일 다중접속역할수행게임(MMORPG) 신작 리니지 2M을 연기 없이 올해 4분기 중 출시한다. 3분기 중 사전예약을 시작할 것으로 예상돼 신작 모멘텀 본격화될 예정이다.김민정 연구원은 ""리니지 2M은 PC 원작과 차별화된 콘텐츠를 구현할 것으로 예상돼 흥행 기대감이 높다""며 ""\'리니지M\'과 PC \'리니지 2\'의 매출 잠식은 제한적일 전망""이라고 설명했다.이어 ""리니지 2M은 리니지 M과 달리 고사양 그래픽을 기반으로 다양한 해외 지역에도 출시할 예정""이라며 ""리니지 M보다 국내 매출액은 낮더라도 글로벌 매출액은 더 높을 것""이라고 예상했다.hwahwa@newsis.com▶ 네이버에서 뉴시스 채널 구독하기▶ 뉴시스 빅데이터 MSI 주가시세표 바로가기 <저작권자ⓒ 공감언론 뉴시스통신사. 무단전재-재배포 금지.>뉴시스 관련뉴스해당 언론사에서 선정하며 언론사 페이지(아웃링크)로 이동해 볼 수 있습니다.""내 얼굴 본뜬 성인용품?""…리얼돌 논란, 남녀갈등 비화홍준표, 文대통령 겨냥 ""말은 이순신 행동은 선조""헬스클럽서 여성 회원들 추행 30대 트레이너 집행유예여고생과 원조교제하던 소령, 만남 거부하자 돌연…""방송 못해""…법원, 김성재 前여친 손 들어준 3가지 이유좋아요0훈훈해요0슬퍼요0화나요0후속기사 원해요0기사제공 :']"
8,NC soft, 2019-08-0508:09,아이뉴스24 ,"[I-리포트] 엔씨소프트, 리니지 시리즈 효과에 시장 컨센서스 상회-한투",https://finance.naver.com/news/news_read.nhn?article_id=0000503755&office_id=031&mode=search&query=엔씨&page=1,"['       [I-리포트] 엔씨소프트, 리니지 시리즈 효과에 시장 컨센서스 상회-한투      기사입력2019-08-05 08:09기사원문좋아요훈훈해요좋아요 평가하기공감좋아요0훈훈해요0슬퍼요0화나요0후속기사 원해요0댓글목표주가 65만원 유지[아이뉴스24 한수연 기자] 한국투자증권은 5일 엔씨소프트에 대해 리니지 시리즈의 업데이트 효과로 올해 2분기 실적이 시장 컨센서스를 상회했다며 투자의견 \'매수\'와 목표주가는 65만원을 모두 유지했다.엔씨소프트의 올해 2분기 매출액과 영업이익은 각각 4천108억원, 1천294억원으로 모두 시장 컨센서스를 웃돌았다.정호윤 한국투자증권 연구원은 ""리니지1과 리니지M이 대규모 업데이트 효과가 반영된 덕분""이라며 ""리니지1 매출액은 501억원으로 전년 동기대비 19.1%, 전기 대비 141.9%로 크게 늘었고 모바일게임 매출액 또한 2천238억원으로 전년 동기대비 6.6%, 전기 대비 12.6% 증가했다""고 분석했다.투자자들이 우려하던 리니지2M과 관련된 다양한 불확실성이 이번 컨퍼런스콜에서 해소됐다는 점 또한 중요했다는 평가다.정 연구원은 ""리니지2M의 국내 출시 시기는 4분기 중으로 추정되는데 곧 마케팅 등이 시작될 예정으로 출시 시기와 관련한 불확실성은 현재로서는 대부분 사라진 상황""이라며 ""리니지2M은 해외시장 진출을 중요한 목표로 개발한 작품인 만큼 내년부터는 리니지2M을 시작으로 엔씨소프트의 해외 매출 비중이 늘어날 것""이라고 전망했다.그러면서 ""리니지M의 매출이 견조하게 이어지는 가운데 하반기 리니지2M이 출시되면서 엔씨소프트는 새로운 성장 국면에 접어들 것""이라며 ""2020년부터도 리니지2M의 해외 진출을 통한 매출처의 다변화 및 새로운 신작 출시가 이어지며 성장세가 지속될 것""이라고 설명했다.한수연기자 papyrus@inews24.com▶네이버 채널에서 \'아이뉴스24\'를 구독해주세요.▶아이뉴스TV에서 부동산 고수를 만나보세요.[ⓒ 아이뉴스24 무단전재 및 재배포 금지]아이뉴스24 관련뉴스해당 언론사에서 선정하며 언론사 페이지(아웃링크)로 이동해 볼 수 있습니다.""모든 가능성 열어뒀다"" 라인게임즈, 中 진출 출사표H&B스토어 1위 올리브영, 납품업체에 불공정행위…10억원 과징금 제재일본 자동차부품 제조사 4곳 담합행위 적발[8월 1주 분양동향] 잠시 쉬어가는 분양시장…견본주택 3곳 개관삼성전자 상반기 스마트폰 1억4800만대 출하…年 3억대 회복할까좋아요0훈훈해요0슬퍼요0화나요0후속기사 원해요0기사제공 :']"
9,NC soft, 2019-08-0507:46,한국경제 ,"""엔씨소프트, 리니지2M 4분기 출시 확정…목표가↑""-KTB",https://finance.naver.com/news/news_read.nhn?article_id=0004186840&office_id=015&mode=search&query=엔씨&page=1,"['       ""엔씨소프트, 리니지2M 4분기 출시 확정…목표가↑""-KTB      기사입력2019-08-05 07:46기사원문좋아요훈훈해요좋아요 평가하기공감좋아요0훈훈해요0슬퍼요0화나요0후속기사 원해요0댓글 KTB증권은 5일 엔씨소프트에 대해 ""리니지M 매출이 예상대비 큰 폭으로 반등했다""고 분석하며 목표주가를 기존 60만원에서 62만원으로 올렸다. 투자의견은 \'매수\'를 유지했다.엔씨소프트는 올해 2분기 매출액 4108억원(전년비 -5.9%, 전분기비 14.5%), 영업이익 1294억원(전년비 -18.9%, 전분기비 62.7%) 기록했다고 발표했다.이 증권사 이민아 연구원은 ""기대치를 상회한 실적은 리니지M 매출이 예상대비 큰 폭으로 반등했기 때문""이라며 ""2분기 리니지M 국내 일평균 매출액은 24.1억원으로 전분기 22억원 대비 증가했을 것으로 추정된다""고 말했다.엔씨소프트는 2분기 실적발표 이후 진행된 컨퍼런스콜에서 리니지M의 트래픽은 2018년 이래 최대 수준이라고 밝힌 바 있따.이 연구원은 ""리니지(PC)의 리마스터 업데이트 효과와 요금제 개편 영향도 확인했다""며 ""2분기 리니지(PC) 매출액은 501억원(전년비 19%, 전분기비 142%)으로 대폭 증가했다. 리니지(PC) 유저 지표는 업데이트 이후 2배 수준으로 증가했고 3분기는 전분기대비 소폭 감소하겠으나 통상적인 성수기 효과가 나타나는 4분기 매출은 514억원(전년비 32%, 전분기비 18%)으로 증가할 것""이라고 전망했따.이어 ""리니지2M 출시 일정은 4분기로 확정됐고, 근시일 내 마케팅 활동과 사전 예약이 시작될 것""이라며 ""심리스 오픈월드, 그래픽 등 리니지2M의 차별화 포인트와 출시 시점의 대형 경쟁작 부재 등을 고려하면 흥행 가능성 높다""고 판단했다. 최수진 한경닷컴 기자 naive@hankyung.com▶ 네이버에서 한국경제 뉴스를 받아보세요▶ 한경닷컴 바로가기  ▶ 모바일한경 구독신청 ⓒ 한국경제 & hankyung.com, 무단전재 및 재배포 금지한국경제 관련뉴스해당 언론사에서 선정하며 언론사 페이지(아웃링크)로 이동해 볼 수 있습니다.""전국 일식집 다 망해야 하나"" 조국 작심발언""일본 차 타고 온 손님은…"" 음식점 사장의 돌직구CJ회장보다 연봉 높은 나영석…얼마나 받길래""여기 투자하면 망한다"" 부동산 고수의 조언""몸수색하며 성폭행""…탈북女 \'충격 증언\'좋아요0훈훈해요0슬퍼요0화나요0후속기사 원해요0기사제공 :']"
10,NC soft, 2019-08-0507:43,머니투데이 ,"엔씨소프트, 연말 리니지2M 출시로 모멘텀 확대-한화투자증권",https://finance.naver.com/news/news_read.nhn?article_id=0004258784&office_id=008&mode=search&query=엔씨&page=1,"['       엔씨소프트, 연말 리니지2M 출시로 모멘텀 확대-한화투자증권      기사입력2019-08-05 07:43기사원문좋아요훈훈해요좋아요 평가하기공감좋아요0훈훈해요0슬퍼요0화나요0후속기사 원해요0댓글 [머니투데이 조준영 기자] 한화투자증권이 5일 엔씨소프트에 대해 연말 리니지2M 출시를 시작으로 신작 모멘텀이 확대될 것이라고 전망했다. 투자의견은 \'매수\'를 유지했고 목표주가는 66만원으로 상향했다.엔씨소프트의 2분기 실적은 매출액 4108억원, 영업이익 1294억원을 기록하며 PC와 모바일 모두 전분기 대비 성장이 나타났다. 김소혜 한화투자증권 연구원은 ""(엔씨소프트는) 금번 컨퍼런스콜에서 리니지2M은 4분기에 출시, 블레이드&소울2와 아이온2도 순조롭게 개발 중이라고 언급했다""며 ""과거 해외시장에서 리니지2 IP의 경쟁력이 입증된 바 있기 때문에 흥행 기대감은 충분히 높일만 하다""고 평가했다.조준영 기자 cho@mt.co.kr▶이코노미스트들의 투자칼럼▶조 변호사의 가정상담소 ▶더 많은 기사 보러가기  <저작권자 ⓒ \'돈이 보이는 리얼타임 뉴스\' 머니투데이, 무단전재 및 재배포 금지>머니투데이 관련뉴스해당 언론사에서 선정하며 언론사 페이지(아웃링크)로 이동해 볼 수 있습니다.[日, 경제도발]""직원 13만명이 한국인""…\'한국기업\' 호소하는 롯데8호 태풍 프란시스코, 6일 밤 한반도 상륙…예상 경로는?[日, 경제도발]중국이 한국에 우호적인 이유\'고점 대비 70% 하락\' 아모레퍼시픽, 투자해도 될까요?\'문콕\' 사고에 치료비 500만원…\'나이롱환자들\'좋아요0훈훈해요0슬퍼요0화나요0후속기사 원해요0기사제공 :']"
11,NC soft, 2019-08-0507:25,이데일리 ,"엔씨소프트, 리니지2 모바일 관련 불확실성 해소-한국",https://finance.naver.com/news/news_read.nhn?article_id=0004438438&office_id=018&mode=search&query=엔씨&page=1,"['       엔씨소프트, 리니지2 모바일 관련 불확실성 해소-한국      기사입력2019-08-05 07:25기사원문좋아요훈훈해요좋아요 평가하기공감좋아요0훈훈해요0슬퍼요0화나요0후속기사 원해요0댓글[이데일리 김무연 기자] 한국투자증권은 5일 엔씨소프트(036570)의 올해 2분기 실적이 리니지 시리즈의 업데이트 효과로 반등에 성공했다고 짚었다. 이어 리니지2 모바일(이하 리니지2M)과 관련한 우려가 상당 부분 해소됐으며 하반기 신작 모멘텀 또한 보유하고 있다고 분석했다. 목표주가는 65만원, 투자의견은 ‘매수’를 유지했다.엔씨소프트의 2분기 매출액과 영업이익은 각각 전기대비 14.5%, 62.7% 늘어난 4108억원, 1294억원으로 컨센서스를 상회했다.  호실적의 이유는 리니지1과 리니지M이 대규모 업데이트 효과가 반영됐기 때문이다. 리니지1 매출액은 501억원으로 전년 동기대비 19.1%, 전기 대비 141.9%로 크게 늘었고 모바일게임 매출액 또한 2238억원으로 전년 동기대비 6.6%, 전기 대비 12.6% 증가했다.또한 투자자들이 우려하던 리니지2M과 관련된 다양한 불확실성이 이번 컨퍼런스콜에서 해소됐다는 점 또한 중요하다는 평가다. 리니지2M의 국내 출시 시기는 4분기 중으로 추정된다. 곧 마케팅 등이 시작될 예정으로 출시 시기와 관련한 불확실성은 현재로서는 대부분 사라진 상황이다. 리니지2M은  해외시장 진출을 중요한 목표로 개발한 작품인 만큼 내년부터는 리니지2M을 시작으로 엔씨소프트의 해외 매출 비중이 늘어날 것이라고 한국투자증권은 전망했다.정호윤 한국투자증권 연구원은 “리니지M의 매출이 견조하게 이어지는 가운데 하반기 리니지2M이 출시되면서 엔씨소프트는 새로운 성장 국면에 접어들 것”이라며 “2020년부터도 리니지2M의 해외 진출을 통한 매출처의 다변화 및 새로운 신작 출시가 이어지며 성장세가 지속될 것”이라고 설명했다.김무연 (nosmoke@edaily.co.kr)네이버 홈에서 ‘이데일리’ 뉴스 [구독하기▶]꿀잼가득 [영상보기▶] , 청춘뉘우스~ [스냅타임▶]＜ⓒ종합 경제정보 미디어 이데일리 - 무단전재 & 재배포 금지＞이데일리 관련뉴스해당 언론사에서 선정하며 언론사 페이지(아웃링크)로 이동해 볼 수 있습니다.文대통령은 \'저도\'에서 왜 朴대통령을 언급했을까日 억지 되풀이한 배현진, ""文정부 봉창 두드린다""""성폭행에 공개처형"" 北, 女 수감자 인권유린 \'심각\'로또 870회…광주 광산구에 무슨일이? 1등이 무려한국당 ""日기술 따라 잡자면 50年"" 당정청회의 혹평좋아요0훈훈해요0슬퍼요0화나요0후속기사 원해요0기사제공 :']"
12,NC soft, 2019-08-0506:01,데일리안 ,인터넷은행 재도전 정조준하는 재수생들…과제 해결 물음표,https://finance.naver.com/news/news_read.nhn?article_id=0002344443&office_id=119&mode=search&query=엔씨&page=1,"['       인터넷은행 재도전 정조준하는 재수생들…과제 해결 물음표      기사입력2019-08-05 06:01기사원문좋아요훈훈해요좋아요 평가하기공감좋아요0훈훈해요0슬퍼요0화나요0후속기사 원해요0댓글인터넷은행 재도전 놓고 절치부심 키움증권신한금융도 저울질…네이버 나타나면 도전?ⓒ데일리안하반기 다시 치러질 제3 인터넷전문은행 재인가에서 키움증권이 다시 도전에 나설 지 그 귀추가 주목된다.5일 금융권에 따르면 키움증권은 지난 5월 예비인가 탈락 이후 \'키움뱅크(가칭)\' 설립 추진 태스크포스(TF)를 중단한 상태로 내부에서는 인가 시기에 맞춰 재도전 여부를 결정한다는 방침이다.당시 TF를 주도했던 키움증권 고위 관계자는 ""선뜻 의사를 결정하기 어려운 문제들이 있어 내부 검토를 이어가는 중""이라며 ""최대주주로서 30%의 지분을 획득하는 문제에 대해 주주들 간 재논의가 필요한 상황에다 최근 인터넷은행에 여러 변화가 있는 만큼 가능성을 면밀히 살펴보는 중""이라고 말했다.인가 탈락 이후 주주사와의 교류 중단에 대해서는 ""재도전 결정이 나지 않아 소통에 나서지 못한 것으로 도전을 포기한 것은 아니다""며 ""재인가가 치러지기 이전 결정이 나지 않겠냐. 9월 안에는 내부적으로 결론을 낼 것""이라고 말했다.금융당국은 오는 10월 10일부터 15일까지 제3 인터넷은행 예비인가의 신청서를 접수한 뒤 최대 2개사를 신규 인가한다는 방침이지만 재도전에 나설 참여자가 보이지 않는다. 토스뱅크로 인가에 도전했던 비바리퍼블리카(토스) 또한 여전히 신중론을 펼치고 있다. 기존에 자본 조달에 문제로 지적받은 상환우선주 처리 문제를 풀어가느라 바쁜 시기를 보내고 있다.지난해 토스와 손잡고 인터넷은행 추진을 준비했다가 결별을 선언한 신한금융의 경우 재인가 참여에 흥미를 보이고 있다.신한금융은 오는 10월 다시 치뤄질 인가에 재도전할 수 있다는 의사를 밝혔다. 그러나 실상은 혁신 정보통신기술(ICT) 기업을 찾지 못해 사업계획을 확정하지 않았다는 입장을 거듭 중이다. 금융당국이 신한금융의 인터넷은행 참여를 기대한 바 있어 사실상 정부의 보폭을 맞추려는 의도로 풀이된다.신한금융 관계자는 ""혁신 기업이 참여한다면 같이 동참할 의사가 있지만 최대주주가 될 만한 자금력을 갖춘 곳이 보이지 않는 게 문제""라며 ""현재로선 네이버와 엔씨소프트 등과 같은 대형 ICT 기업이 나서지 않는 한 참여를 확정하기란 어려울 것으로 판단 중""이라고 말했다.금융권에서는 자회사인 라인 등으로 해외에서 인터넷은행 설립을 추진 중인 네이버가 참여할 것을 기대 중인데 진출 의사가 없다는 의견을 명확히 하고 있다.최인혁 네이버 최고운영책임자(COO)는 지난 25일 상반기 컨퍼런스콜을 개최한 뒤 ""케이뱅크나 카카오뱅크가 은행업에 진출해 사업을 안정적으로 잘 운영하고 있지만, 네이버는 기본적으로 은행업에 관심을 두고 있지 않다""고 밝혔다.금융당국은 오는 10월 재인가까지 인가 절차 모든 과정에 걸쳐 신청자에게 컨설팅을 제공해 합격률을 높인다는 방침이다. 그러나 재도전에 나서겠다는 업체가 보이지 않아 벌써부터 2차 경쟁에 흥행 부진이 예상되고 있다.금융권 관계자는 ""최근 김범수 카카오 의장의 대주주 적격성 심사 문제 해소로 인터넷은행 업계 1위인 카카오뱅크의 숨통이 트인 상황이라 뒤늦게 진출하는 사업자로선 부담을 느낄 수 있다""며 ""경쟁이 치열해진 만큼 플랫폼과 재무력이 탄탄한 기업이 나서야 인가 가능성이 높기 때문에 업체마다 신중론을 펼치고 있는 것""이라고 말했다.데일리안 박유진 기자 (rorisang@dailian.co.kr)ⓒ (주)데일리안 - 무단전재, 변형, 무단배포 금지데일리안 관련뉴스해당 언론사에서 선정하며 언론사 페이지(아웃링크)로 이동해 볼 수 있습니다.머슬매니아 이연화, 수중 영상 공개 \'인어공주?\'\'신입사관 구해령\' 신세경, 맞춤 옷 입었다설리, 365일 다이어트 ""옷 사이즈에 내 몸 맞췄다""커쇼 살린 스미스, 이틀 연속 결승홈런""오는 10월 재도전""…\'제3인터넷은행 인가심사\' 개입 여지 남긴 금융위좋아요0훈훈해요0슬퍼요0화나요0후속기사 원해요0기사제공 :']"
