,회사명,날짜,언론사,기사제목,링크,본문
5,NC soft, 2020-11-2415:34,노컷뉴스 ,"넷마블, 자체 IP 효과 톡톡…세븐나이츠2 앱스토어 매출 1위",https://finance.naver.com/news/news_read.nhn?article_id=0003435320&office_id=079&mode=search&query=엔씨&page=1,"['       넷마블, 자체 IP 효과 톡톡…세븐나이츠2 앱스토어 매출 1위      기사입력2020-11-24 15:34기사원문좋아요훈훈해요좋아요 평가하기공감좋아요0훈훈해요0슬퍼요0화나요0후속기사 원해요0댓글올해 A3-마구마구-세븐나이츠 자체 IP게임 연달아 출시지난 18일 출시한 \'세븐나이츠2\' 양대마켓 매출 최상위권 안착 \'흥행돌풍\'이달 초 출시한 닌텐도 스위치 게임 \'세븐나이츠 타임원더러\'도 \'호평\'[CBS노컷뉴스 조혜령 기자](사진=넷마블 제공) 넷마블이 지난 18일 출시한 모바일 수집형 MMORPG \'세븐나이츠2\'가 출시 6시간 만에 애플 앱스토어 매출 1위에 오르면서 돌풍을 일으키고 있다. 구글 플레이는 출시 3일만인 지난 21일 2위를 기록했고 23일 현재도 순위를 유지하며 최상위권 안착에 성공한 것으로 보인다. 이 게임은 출시 하루 전인 지난 17일 사전 다운로드를 시작해 4시간만에 애플 앱스토어 인기 1위를 달성하여 흥행 신호탄을 쏘아올렸다.세븐나이츠2는 넷마블의 대표 IP \'세븐나이츠\'의 정통후속작으로, 캐릭터성을 기반으로 한 전략 전투와 국내외 이용자에게 큰 반응을 얻은 스토리, 화려한 연출 등 전작의 특장점을 한 단계 발전한 모습으로 선보였다.지난 5일에는 세븐나이츠 IP를 기반으로 한 닌텐도 스위치 게임 \'세븐나이츠-타임원더러(Time Wanderer)\'를 출시하기도 했다. 이 게임은 넷마블의 첫 콘솔게임 데뷔작으로 닌텐도 스위치 이숍(eShop)의 예약 판매에서 다운로드 1위에 이어, 출시 후 국내 닌텐도 이숍 DL(다운로드) 게임 순위에서 인기 1위에 올랐다. 특히, 세븐나이츠는 국내뿐만 아니라, 일본, 태국, 대만, 인도네시아 등 아시아 전역에서 사랑을 받고 있어 세븐나이츠2 등 IP활용 라인업이 해외에서 긍정적 성과를 거둘 수 있을 것으로 전망된다. 올해 3월 넷마블은 \'A3: 스틸얼라이브\'를 출시했다. 이 게임은 지난 2002년 PC온라인게임으로 출시해 많은 사랑을 받은 넷마블 자체 IP(지식재산권) PC온라인 RPG \'A3\'를 모바일 MMORPG로 재해석한 게임이다.\'A3: 스틸얼라이브\'는 국내 출시 이후 애플 앱스토어 매출 2위, 구글플레이 매출 3위를 기록하면서 양대마켓 순위 최상위권에 올랐다. 이어 지난 4월에는 문화체육관광부가 e스포츠 시범종목으로 선정한 바 있다.또한, 지난 7월 출시된 \'마구마구\'를 활용한 모바일 게임 \'마구마구2020 모바일\' 역시 출시 이후 구글, 애플 매출 9위 기록하고 서비스 3개월만에 가입자수 100만명을 돌파하며 국내 대표 모바일 야구게임 중 하나로 자리매김했다. 업계 관계자는 ""넥슨, 엔씨 등 경쟁사에 비해 자체 IP가 약하다는 지적을 받아 온 넷마블이 올 해 A3, 마구마구, 세븐나이츠 등의 잇따른 흥행으로 가능성을 확인한 것은 의미가 있다""며 ""내년 기대작 중 하나인 \'세븐나이츠 레볼루션\'이 어떤 성과를 내느냐가 IP강화 전략의 지속성을 판단하는 가늠자가 될 것""이라고 말했다.▶ 확 달라진 노컷뉴스▶ 클릭 한 번이면 노컷뉴스 구독!▶ 보다 나은 세상, 노컷브이와 함께tooderigirl@cbs.co.kr저작권자 © CBS 노컷뉴스 무단전재 및 재배포 금지노컷뉴스 관련뉴스해당 언론사에서 선정하며 언론사 페이지(아웃링크)로 이동해 볼 수 있습니다.秋 지시 한달만에 윤석열 장모 기소…尹 \'사건 무마\' 의혹은 각하유은혜 ""대학 면접평가, 비대면 방식전환 검토해야""""조국이 북 지령 이행"" 탈북단체 대표, 명예훼손 혐의 송치코로나19 신규확진 349명…""어렵고 힘든 겨울 예고""[단독]경찰, \'채용 비리 혐의\' 조광한 남양주시장 등 7명 송치좋아요0훈훈해요0슬퍼요0화나요0후속기사 원해요0기사제공 :']"
6,NC soft, 2020-11-2413:43,이데일리 ,"2단계 격상에 엔씨, 다시 재택으로…‘블소2’ ‘아이온2’ 어쩌나",https://finance.naver.com/news/news_read.nhn?article_id=0004793058&office_id=018&mode=search&query=엔씨&page=1,"['       2단계 격상에 엔씨, 다시 재택으로…‘블소2’ ‘아이온2’ 어쩌나      기사입력2020-11-24 13:43기사원문좋아요훈훈해요좋아요 평가하기공감좋아요0훈훈해요0슬퍼요0화나요0후속기사 원해요0댓글전사원 유급 특별휴가 줬던 택진이형“직원 건강이 최우선…게임 준비도 착실히”이전 경험 살려 최대한 지연 방지 목표엔씨소프트 판교 R&D센터 전경. 엔씨 제공[이데일리 노재웅 기자] 코로나19 확진자 증가로 수도권의 사회적 거리두기가 2단계로 격상되면서 엔씨소프트(036570)가 다시 재택근무를 확대한다. ‘리니지2M’의 대만 진출과 ‘블레이드 앤 소울2(이하 블소2)’ 출시 등 주요 게임 일정이 애초 계획보다 또다시 늦춰질 수 있을 전망이다.24일 엔씨에 따르면 엔씨는 이날부터 주 3회 출근, 주 2회 재택근무 체제로 전환해 시행한다. 내년 초 출시 기대작 준비로 한창 바쁠 연말을 앞두고 재택근무가 다시 시행됨에 따라 신작 출시 연기에 대한 우려도 다시 나오고 있다. 엔씨는 애초 블소2를 비롯해 올해 출시를 목표로 한 신규 게임들의 출시 일정을 코로나19로 인한 재택근무 영향으로 미룬 바 있다.엔씨는 리니지 IP(지식재산권) 게임과 국내 매출에 쏠린 포트폴리오를 다각화하고자 내년부터 신작 출시 주기를 짧게 가져가는 한편, 해외 진출에도 힘쓸 것을 목표로 하고 있다. 이전까지는 평균 5년 간격으로 신작을 선보였던 반면, 내년에는 최소 3종 이상의 다작 출시를 예고한 상태다.연내 ‘트릭스터M’ 출시를 시작으로 ‘블소2’ ‘아이온2’ ‘프로젝트 TL’ 등의 게임을 내년 1분기부터 국내외에 차례로 선보일 계획이다. ‘팡야M’과 ‘H3’ 등도 내년 출시 후보작이다. 이와 함께 내년 1분기 리니지2M의 대만 진출도 계획 중이다.이장욱 IR 실장은 지난 16일 열린 3분기 컨퍼런스 콜에서 블소2와 리니지2M 대만 출시 일정과 관련해 “출시 일정 지연 이유는 명확하다”며 “코로나19 때문에 재택근무를 계속 이어왔고, 정상근무로 전환된 것은 불과 10월부터였다. 밀도 있는 협업이 필요한 시기에 물리적으로 떨어져 있기도 했고, 이런 점들 때문에 지연이 된 것”이라고 코로나19로 인한 어려움을 토로한 바 있다.그는 또 “코로나19 확산 추이가 겨울에 달라진다면 추가 지연 가능성이 있다”며 “별다른 외부 변수가 없다면 지연 없이 출시할 것이다. 다만 블소2가 크게 지연된다면 아이온2 역시 지연될 것”이라고 전망했다. 코로나19 영향을 받을 경우 게임 출시 연기가 불가피할 수도 있다는 뜻으로, 최근 확진자 증가세에 따라 우려가 곧 현실로 다가왔다.하지만 엔씨는 게임 매출보단 직원 건강을 최우선으로 삼고, 무리해서 개발 일정을 밀어붙이진 않겠다는 입장이다.엔씨 관계자는 “코로나19 관련 정부의 지침과 상황 변화를 지속적으로 모니터링하고 있으며, 안전한 근무 환경을 유지하기 위해 최선을 다하고 있다. 직원들의 건강을 최우선으로, 게임 일정에도 최대한 차질이 없도록 노력하겠다”고 말했다.실제 김택진 엔씨 대표는 앞서 지난 3월 두 차례에 걸쳐 전사 유급 특별휴가를 진행하고, 8월 출퇴근 시간 혼잡도 및 근무 밀도 완화를 위한 ‘완전 자율 출퇴근제’를 운영하는 등 코로나19 사태가 심각해질 때마다 직원들을 위한 정책을 모범적으로 시행한 바 있다.한편 엔씨뿐 아니라 판교에 위치한 다른 게임사들도 이날을 기점으로 재택근무를 확대한다. 넥슨과 스마일게이트는 엔씨와 마찬가지로 ‘3+2 체제’로 전환했고, 카카오게임즈와 네오위즈, 웹젠은 이번 주까지 전사 재택근무를 시행한다.노재웅 (ripbird@edaily.co.kr)▶ #24시간 빠른 #미리보는 뉴스 #eNews+▶ 네이버에서 \'이데일리 뉴스\'를 만나보세요▶ 빡침해소, 청춘뉘우스 \'스냅타임\'＜ⓒ종합 경제정보 미디어 이데일리 - 무단전재 & 재배포 금지＞이데일리 관련뉴스해당 언론사에서 선정하며 언론사 페이지(아웃링크)로 이동해 볼 수 있습니다.청정에너지 \'핵융합\' 성큼···韓 \'인공태양\' 세계신기록\'냉정하라\'던 정세균 ""秋 잘하고 있어..해임 생각없다""\'폐암 투병\' 김철민, 간절한 기도 ""제발 고통에서 벗어나길""고유정 의붓아들 친부 ""그 여자와 자꾸 얽혀 고통스러워""박범계 ""尹, 정치적 야망 품은 듯..검사들만 멍든다""좋아요0훈훈해요0슬퍼요0화나요0후속기사 원해요0기사제공 :']"
7,NC soft, 2020-11-2413:19,매일경제 ,막 오른 모바일게임 공성전…‘리니지 형제’를 공략하라,https://finance.naver.com/news/news_read.nhn?article_id=0004702003&office_id=009&mode=search&query=엔씨&page=1,"['       막 오른 모바일게임 공성전…‘리니지 형제’를 공략하라      기사입력2020-11-24 13:19기사원문좋아요훈훈해요좋아요 평가하기공감좋아요0훈훈해요0슬퍼요0화나요0후속기사 원해요0댓글 세나2·미르4 신작 경쟁 점화…리니지M·2M은 업데이트  모바일게임 시장 매출 최상위권을 노린 경쟁이 본격화됐다. 2017년 6월부터 이어진 엔씨소프트(대표 김택진)의 ‘리니지M’의 장기 독주 체제와 그 뒤를 차지한 동생 ‘리니지2M’의 자리를 위협하는 신작들이 속속 등장하는 모습이다. 이미 넷마블(대표 권영식, 이승원)의 ‘세븐나이츠2’가 구글 플레이 매출 2위에 올라서며 최상위권 경쟁에 불을 지폈다. 위메이드(대표 장현국)의 야심작 ‘미르4’는 25일 0시 출격한다. 이에 맞서 ‘리니지M’과 ‘리니지2M’도 수성에 나섰다. 각각 24일과 25일 대규모 업데이트를 적용하며 이용자 몰이에 집중한다. 향후 최상위권 순위의 변화 흐름이 주목되는 상황이다.◆매출 최상위권 지킨다…‘리니지M·2M’ 대규모 업데이트엔씨소프트는 24일 ‘리니지M’에 ‘기사도’ 업데이트를 적용했다. ‘리니지M’의 대표 클래스인 ‘기사’를 대폭 개선하는 내용을 담고 있다. 최상위 마스터 등급 기술을 추가하고 기본 베테랑 등급과 기본 등급 기술을 보다 쉽게 배울 수 있도록 개편했다. 원작 ‘리니지’의 로망인 ‘기사’ 클래스의 상향으로 이용자의 유입이 예상되고 있다. 엔씨소프트는 ‘리니지M’의 대표 보상인 TJ 쿠폰도 5종을 마련해 이용자에게 제공한다.25일에는 ‘리니지2M’의 1주년 업데이트 ‘크로니클 IV. 피로 맺은 결의’가 적용된다. ‘크로니클 IV. 피로 맺은 결의’는 ‘리니지2M’의 네 번째 대규모 업데이트다. 신규 클래스 ‘대검’, 첫 신화 등급 클래스 ‘라울’, 신규 월드던전 ‘각성의 섬’의 추가가 이뤄진다. 특히 첫 특화 서버인 ‘안타라스’도 함께 선보여 눈길을 끈다. 일부 콘텐츠를 비활성화해 새롭게 도전하는 이용자를 배려했다. ‘아인하사드의 은총’ 충전량 증가, 경험치 추가 획득, 서버 전용 미션과 쿠폰 등의 혜택도 마련했다.  ◆‘리니지 형제’ 독주 깬다…‘세븐나이츠2’·‘미르4’ 출격도전자들도 속속 등장한다. 이미 지난 18일 출시된 넷마블의 신작 ‘세븐나이츠2’가 ‘리니지2M’을 밀어내고 구글 플레이 매출 2위에 등극했다. 누적 6000만 다운로드를 기록한 인기작 ‘세븐나이츠’의 후속작으로 기대를 모았던 작품으로 명성에 버금가는 성과를 내고 있다는 평가다. ‘리니지M’과 ‘리니지2M’의 등장 이후 두 게임의 자리를 넘본 게임은 드물었기 때문이다.실제 지난 7월 넥슨의 ‘바람의나라:연’이 처음으로 두 게임 사이를 비집고 들어가 매출 2위 기록을 세웠을 당시 시장에서는 매우 이례적인 결과로 받아들였다. ‘리니지M’과 ‘리니지2M’의 기존 성과가 독보적이었던 탓이다.25일에는 위메이드의 신작 ‘미르4’도 경쟁에 뛰어든다. 위메이드가 내심 1위 자리까지 넘보는 야심작이다. 위메이드의 대표작 ‘미르의전설2’를 계승했다. 언리얼엔진 기반의 고품질 그래픽, 사냥과 정치, 경제까지 아우르는 짜임새 높은 콘텐츠 구성, 각종 이용자간 협력 및 경쟁 콘텐츠 등이 특장점이다.엔씨소프트가 준비 중인 신작들도 주목된다. 자회사 엔트리브소프트가 제작한 ‘트릭스터M’이 연내 출시를 앞뒀다. 엔트리브소프트의 PC온라인게임 ‘트릭스터M’을 모바일로 옮기면서 엔씨소프트의 MMORPG 노하우를 모두 활용했다. 빠르게 사전예약자 200만명을 모으며 엔씨소프트 내부에서도 기대감이 커진 게임이다. 상위권 경쟁에 한축을 담당할 전망이다. 엔씨소프트는 내년 1분기 ‘블레이드&소울2’도 내놓는다.[임영택기자 ytlim@mkinternet.com]▶ 네이버 메인에서 \'매일경제\'를 받아보세요▶ 궁금한 제조과정 영상으로 보세요. \'이렇게 만들죠\'▶ 매일매일 색다른 뉴스레터 \'매콤달콤\' 구독하세요[ⓒ 매일경제 & mk.co.kr, 무단전재 및 재배포 금지]매일경제 관련뉴스해당 언론사에서 선정하며 언론사 페이지(아웃링크)로 이동해 볼 수 있습니다.\'故최진실 아들\' 최환희 ""母 그늘에서 벗어나…""""아이 낳지 못한다고"" 며느리 학대해 숨지게 한 시부모BJ이슬이, 완벽한 허리·골반+시선 집중 볼륨박찬호 ""사람 배신감으로 극단적 생각 한 적 있다""오지호 ""장모 이예원, 첫 만남에 재산 물어봐""좋아요0훈훈해요0슬퍼요0화나요0후속기사 원해요0기사제공 :']"
8,NC soft, 2020-11-2411:37,매일경제 ,"엔씨의 ‘리지니2M’, 1주년 앞두고 판 키운다…‘크로니클IV’ 적용 임박",https://finance.naver.com/news/news_read.nhn?article_id=0004701969&office_id=009&mode=search&query=엔씨&page=1,"['       엔씨의 ‘리지니2M’, 1주년 앞두고 판 키운다…‘크로니클IV’ 적용 임박      기사입력2020-11-24 11:37기사원문좋아요훈훈해요좋아요 평가하기공감좋아요0훈훈해요0슬퍼요0화나요0후속기사 원해요0댓글 신규 클래스 ‘대검’·첫 신화 ‘라울’…새로운 도전거리 즐비  엔씨소프트(대표 김택진)의 인기 모바일 MMORPG ‘리니지2M’이 25일 1주년 대규모 업데이트 ‘크로니클 IV. 피로 맺은 결의’를 통해 또 한 번 판을 키운다. 오는 27일 1주년에 앞서 진행되는 이번 업데이트로 신규 서버 ‘안타라스’를 추가하고 신규 클래스 ‘대검’과 첫 신화 등급 클래스 ‘아덴의 통일왕 라울’, 새로운 월드 던전 ‘각성의 섬’을 선보이며 이용자들에게 새로운 도전을 제시한다. 지난 1년간 이어온 최고 인기게임의 명성을 이번에도 과시할지 주목된다.25일 예정된 ‘크로니클 IV. 피로 맺은 결의’ 업데이트는 ‘리니지2M’의 네 번째 대규모 판올림이다. 엔씨소프트는 올해 1월 22일 ‘크로니클Ⅰ, 상아탑의 현자들’을 시작으로 4월 29일 ‘크로니클II 베오라의 유적’, 6월 24일 ‘크로니클III 풍요의 시대’ 등 총 세 번의 대규모 업데이트 ‘크로니클’을 적용했다. 이중 ‘크로니클III 풍요의 시대’의 경우 6월 24일 에피소드1에 이어 7월 8일 에피소드2, 8월 12일 에피소드3 등 세차례에 걸쳐 신규 클래스 ‘창’과 신규 영지 ‘아덴’, 디온성과 기란성, 아덴성으로 이러지는 대규모 공성전을 선보여 호응을 얻었다.이 같은 업데이트에 힘입어 엔씨소프트는 지난 1년간 최고 인기게임 자리를 유지할 수 있었다. 최근 공개한 헌정 영상에 따르면 모든 이용자의 총 누적 게임 이용시간은 30억2219만4650시간에 달했다. 이는 일수로는 1억2592만4777일, 햇수로는 34만4999년이다. 게임을 시작하면 처음 접하는 장소인 ‘말하는 섬’을 다녀간 캐릭터의 숫자는 2672만4375명, 전체 지역에서의 이용자간 PvP 횟수는 4784만4845회였다. 이용자들이 이야기를 만들어가는 MMORPG 장르답게 이용자들간의 경쟁과 협력도 활발하다. 실제 ‘의’ 연합과 ‘PK’ 연합의 전투는 현재까지 1만1000여명 이상의 캐릭터가 참여해 84만회 이상의 전투가 벌어지기도 했다.25일 업데이트는 ‘리니지2M’의 재미를 더욱 끌어올린다. 새로운 클래스 대검과 첫 번째 신화 등급 클래스의 등장이다.‘대검’은 연속 공격을 통해 확률적으로 상대를 움직이지 못하게 만들 수 있는 고유 콤보 스킬 ‘배쉬’를 보유한 것이 특징이다. ‘가디언 실드’, ‘리플렉스 스턴’, ‘드레인’ 등의 기술도 보유했다. 엔씨소프트는 ‘대검’ 클래스 등장과 함께 전설 클래스 ‘자나크’와 영웅 클래스 ‘아그문’, ‘리진’, ‘로티’, ‘크세르스’를 우선 선보인다.다른 무기 클래스를 사용해온 이용자를 위해 ‘클래스 체인지’ 기능도 더한다. 이를 통해 ‘대검’으로 클래스를 전환할 수 있다. 영웅 등급 이상 클래스만 전환이 가능하며 희귀 등급 이상 무기, 룬, 아인하사드 티셔츠와 희귀 등급 이상 스킬도 전환할 수 있다. 능력치는 포인트로 초기화가 되어 다시 설정할 수 있다.첫번째 신화 등급 클래스 ‘아덴의 통일왕 라울’도 만날 수 있다. ‘라울’은 모든 계열의 무기를 주무기로 사용할 수 있으며 모든 무기 계열의 각성 스킬과 신화 클래스 전용 스킬인 ‘어쏘리티’도 습득할 수 있다. 엔씨소프트는 이에 발맞춰 각 무기별 신화 등급 스킬도 1종씩 추가한다. 최고를 원하는 이용자가 도전해볼 클래스다.신규 월드 던전 ‘각성의 섬’도 추가된다. ‘각성의 섬’은 월드 내 10개 서버 이용자들이 모여 경쟁하는 전장이다. 각성 보스 몬스터가 던전 곳곳에서 출현하며 처음으로 등장하는 진 각성 보스 몬스터인 여왕 개미, 코어 수스켑터, 드래곤 비스트, 오르펜 등도 공략할 수 있다.여기에 신규 서버 ‘안타라스’도 선보인다. ‘안타라스’ 서버는 신화 등급 클래스와 아가시온, 유료 장신구, 연금술, 각성, 집혼 등 일부 콘텐츠를 비활성화한 상태에서 운영되는 것이 특징이다. 이후 이용자 성장 상황에 따라 콘텐츠가 순차 개방돼 새롭게 도전하고자 하는 이용자에게 적합하다. ‘아인하사드의 은총’ 충전량 증가, 경험치 추가 획득, 서버 전용 미션과 쿠폰 등의 혜택도 주어져 캐릭터 육성이 용이하다.이외에도 엔씨소프트는 복구, 강화, 클래스, 아가시온, 히든 등 TJ의 쿠폰 5종도 마련해 이용자 유입을 독려한다.[임영택기자 ytlim@mkinternet.com]▶ 네이버 메인에서 \'매일경제\'를 받아보세요▶ 궁금한 제조과정 영상으로 보세요. \'이렇게 만들죠\'▶ 매일매일 색다른 뉴스레터 \'매콤달콤\' 구독하세요[ⓒ 매일경제 & mk.co.kr, 무단전재 및 재배포 금지]매일경제 관련뉴스해당 언론사에서 선정하며 언론사 페이지(아웃링크)로 이동해 볼 수 있습니다.\'故최진실 아들\' 최환희 ""母 그늘에서 벗어나…""티구안·제타 돌풍에…폭스바겐 부활\'서울교대 석사\' 박소현, 미스맥심 우승자다운 노출박찬호 ""사람 배신감으로 극단적 생각 한 적 있다""오지호 ""장모 이예원, 첫 만남에 재산 물어봐""좋아요0훈훈해요0슬퍼요0화나요0후속기사 원해요0기사제공 :']"
9,NC soft, 2020-11-2411:03,아시아경제 ,"증시 최고치 경신날…엔씨, 나홀로 '머쓱'",https://finance.naver.com/news/news_read.nhn?article_id=0004797461&office_id=277&mode=search&query=엔씨&page=1,"['       증시 최고치 경신날…엔씨, 나홀로 \'머쓱\'      기사입력2020-11-24 11:03기사원문좋아요훈훈해요좋아요 평가하기공감좋아요0훈훈해요0슬퍼요0화나요0후속기사 원해요0댓글[아시아경제 고형광 기자] 주당 100만원을 목전에 뒀던 엔씨소프트 주가가 박스권에 갇혀 좀처럼 힘을 쓰지 못하고 있다. 외국인 투자자의 매도가 집중되며 주가 하방 요인으로 작용한 것으로 풀이된다.24일 한국거래소에 따르면 엔씨소프트는 전날 코스피시장에서 전 거래일 대비 0.7% 하락한 82만2000원에 거래를 마감했다. 지난 20일 보합에 이어 이날도 주가가 밀렸다. 전날은 외국인 투자자들의 대규모 매수에 힘입어 코스피가 2600선을 돌파하며 사상 최고 기록을 갈아 치우는 등 업종을 불문하고 상승세가 두드러졌다. 그러나 엔씨소프트는 코스피내 시총 상위 1~20위 중 유일하게 하락하며 장을 마쳤다.최근 엔씨소프트 주가는 박스권에 갇힌 모습이다. 신종 코로나바이러스감염증(코로나19) 여파로 증시가 크게 출렁이던 지난 3월 저점(53만원)을 찍은 후 비대면(언택트) 관련주로 관심을 받으며 오름세를 타기 시작했다. 연저점 이후 3개월여 만인 지난 6월 중순 90만원을 터치했고 한 달 뒤인 7월엔 99만7000원까지 오르며 주당 100만원 목전에 두기도 했다. 그러나 이후 상승 탄력이 약화되며 밀리기 시작했고 최근 넉 달간 70만~80만원대에서 벗어나지 못하고 있다.엔씨소프트가 힘을 쓰지 못하는 것은 외국인의 관심에서 멀어진 탓이 크다. 외국인은 최근 넉 달간 엔씨소프트 주식을 4100억원 넘게 팔아치우며 주가 상승의 발목을 잡았다. 3월 연저점 이후 90만원까지 가파르게 올랐던 6월까지 2000억원 넘게 사들인 것과는 대조적인 모습이다. 최근 한달 동안 순매도 금액도 1000억원에 달한다.기존 모바일 게임의 매출 둔화와 신작 게임 출시가 지연된 영향이 반영된 것으로 분석된다. 리니지2M의 하루 평균 매출액은 올해 2분기 22억원에서 3분기 18억원으로 20% 정도 줄었다. 이문종 신한금융투자 책임연구원은 ""엔씨소프트는 리니지2M의 매출이 줄어든 데다 연내로 예상했던 리니지2M의 대만 출시, 신작 게임인 블레이드&소울2의 출시가 불투명해지며 주가도 하락세가 지속하고 있다""면서 ""최근 실적발표에서도 신작 게임의 사전예약 일자나 출시 월 등 구체적인 스케줄이 나오기를 기대했으나 내년 1분기로만 언급돼 출시가 계속 지연될 수 있다는 점이 부담 요인""이라고 진단했다.다만 신작 출시가 가시화할 경우 매출 증가 기대와 함께 주가 흐름도 다시 반등할 수 있다는 의견도 나온다. 김민정 하이투자증권 연구원은 ""넷마블의 \'블소 레볼루션\'의 출시 초기 일매출액이 10억원 이상, 지난 3분기 기준 6억원을 기록한 점을 고려하면 내년 \'블소2\'의 평균 일매출액을 10억원으로 가정할 수 있다""며 ""블소2 사전예약이 시작되면 주가의 추세적인 상승세는 본격화될 것""이라고 전망했다.고형광 기자 kohk0101@asiae.co.kr▶ 2021년 신축년(辛丑年) 신년운세와 토정비결은?▶ 발 빠른 최신 뉴스, 네이버 메인에서 바로 보기▶ 요즘 트렌드 모아보고 싶을 땐 \'드링킷\'<ⓒ경제를 보는 눈, 세계를 보는 창 아시아경제 무단전재 배포금지>아시아경제 관련뉴스해당 언론사에서 선정하며 언론사 페이지(아웃링크)로 이동해 볼 수 있습니다.""사진 내리면 되지 XX이냐"" 욕설…김성주, 결국 폭발""영어로 해"" 해외팬에…""네가 한국어 배워"" 일침한 스타""중병 앓던 부모 병세 악화"" 홍정욱 큰 딸 사건 회고말 한마디에 \'39조 증발\'…정부에 미운털 박힌 억만장자""151만원 내던 세금 291만원으로"" 폭탄 터졌다좋아요0훈훈해요0슬퍼요0화나요0후속기사 원해요0기사제공 :']"
