,회사명,날짜,언론사,기사제목,링크,본문
0,NC soft, 2020-11-2422:41,조선비즈 ,"'택진이형 리더십' 통했다… 코시 전경기 직관에 대규모 투자까지, 신흥명문 올라선...",https://finance.naver.com/news/news_read.nhn?article_id=0000624723&office_id=366&mode=search&query=엔씨&page=1,"['       \'택진이형 리더십\' 통했다… 코시 전경기 직관에 대규모 투자까지, 신흥명문 올라선 NC      기사입력2020-11-24 22:41기사원문좋아요훈훈해요좋아요 평가하기공감좋아요0훈훈해요0슬퍼요0화나요0후속기사 원해요0댓글 NC 다이노스가 2011년 창단 이후 9년 만에 첫 우승을 거머쥐었다. 1군 진입 이후 성적만 놓고 보면 7년 만이다. NC는 7년간 평균 순위가 4.25등으로, 두산과 키움에 이어 가장 높다. 신흥 명문으로 불릴만하다는 평가를 받고 있다. 그리고 그 배경에 김택진 엔씨소프트(036570)대표이사(NC 다이노스 구단주)가 있다는 분석이다.김 대표는 일단 대규모 투자를 아끼지 않고 있다. 2012년부터 외부 FA(자유계약선수) 영입에 적극적인 NC는 2013년 이호준, 2016년 박석민 등을 영입했다. 그리고 2019년, FA 최대어 양의지를 4년 125억원이라는 파격적인 조건으로 영입에 성공했다. 사실 김 대표의 전폭적 지지는 예고돼 있었다. 출범 당시부터 약속했었기 때문이다. 2010년 12월 NC가 KBO에 아홉번째 프로야구단 창단 의향서를 낼 때만 해도 반대 목소리가 높았다. 유명한 대기업이 아니라느니 하는 비아냥이 잇따랐다. 실제 당시 엔씨소프트 연매출은 6000억원대에 불과했다. 그러자 김 대표는 ""내 재산만 갖고도 프로야구단을 100년은 운영할 수 있다""고 반박했다. 17일 오후 서울 구로구 고척스카이돔에서 열린 2020 KBO리그 한국시리즈 1차전 두산 베어스와 NC 다이노스의 경기. NC 선수들이 5-3 승리를 거두자 엔씨소프트 김택진 대표가 기뻐하고 있다. /연합뉴스NC 관계자들은 그러나 김 대표 리더십은 막강한 자금 지원보다는 애정어린 관심이라고 설명한다. 김 대표는 한국시리즈 내내 엔씨소프트 직원 130여명을 대동하고 경기장을 찾았다. 정규시즌 막판에는 NC의 창단 첫 정규시즌 우승의 순간을 함께 하려고 광주와 대전, 창원 등을 연이어 찾았다. NC 한 관계자는 ""구단주가 전폭적인 지지를 하고 있으니 선수들도 힘이 날 수밖에 없는 것 같다""면서 ""본사 직원들도 최고의 순간을 함께 할 수 있어 무척 좋았다""고 말했다.팀 간판스타 나성범은 ""응원해주시니까 정말 감사하다""고 말했다. 박민우도 ""구단주께서 야구단에 큰 관심을 갖고 계신 걸 잘 알고 있다. 물심양면으로 선수단을 지원해주신다""며 고마움을 전한 바 있다.2018년 NC가 처음 꼴찌를 기록한 뒤 감독으로 선임된 이동욱 감독도 구단주에 대해 감사의 뜻을 밝혔다. 이 감독은 2019년 성적이 5위에 그쳤지만 재신임됐다. 그는 ""구단주의 방문은 힘이 된다. 항상 옆에 있기 때문에 선수들도 부담을 느끼거나 하지는 않는다""고 했다.한편 NC는 24일 서울 고척스카이돔에서 열린 2020시즌 KBO리그 한국시리즈 6차전에서 두산에 4대 2로 승리했다. 시리즈 전적은 4승 2패를 기록, 우승 트로피를 거머쥐었다. NC는 1승 2패에서 내리 3연승해 우승의 축포를 터뜨렸다. 두산은 이 과정에서 25이닝 연속 무득점을 기록, 단일시즌 최장 한국시리즈 및 포스트시즌 연속 이닝 무득점의 불명예를 떠안았다.[안재만 기자 hoonpa@chosunbiz.com] ▶네이버에서 조선비즈를 구독 하세요 ▶코로나 시대 신혼여행지로 뜬 이곳, 백만명 맞을 하늘길 연다 ▶올해 \'이 기업들\' 투자 안 하면 영영 기회 없다 저작권자 ⓒ 조선비즈, 무단 전재 및 재배포 금지 조선비즈 관련뉴스해당 언론사에서 선정하며 언론사 페이지(아웃링크)로 이동해 볼 수 있습니다.""2억도 안되는 우리집이 왜…"" 억울함에 잠 못 드는 사람들중국산 코로나 백신, 아스트라제네카보다 18배 더 비싸네""한국 고맙습니다"" 역대급 호황에 세계 TV업계 웃음꽃""이제껏 경험 못했던 일"" 美·日·中 제치고 신기록 세운 한국셀트리온 코로나 항체치료제 세계 3번째 승인 눈앞좋아요0훈훈해요0슬퍼요0화나요0후속기사 원해요0기사제공 :']"
1,NC soft, 2020-11-2422:21,파이낸셜뉴스 ,'빠던 열풍' 부터 우승까지..택진이형 '야구사랑' 결실,https://finance.naver.com/news/news_read.nhn?article_id=0004534780&office_id=014&mode=search&query=엔씨&page=1,"['       \'빠던 열풍\' 부터 우승까지..택진이형 \'야구사랑\' 결실      기사입력2020-11-24 22:21기사원문좋아요훈훈해요좋아요 평가하기공감좋아요0훈훈해요0슬퍼요0화나요0후속기사 원해요0댓글23일 오후 서울 구로구 고척스카이돔에서 열린 프로야구 2020 신한은행 SOL KBO 포스트시즌 한국시리즈 5차전 경기 후 NC 김택진 구단주가 카메라를 보며 포즈를 취하고 있다./사진=뉴스1[파이낸셜뉴스] 김택진 엔씨소프트 대표의 각별한 \'야구 사랑\'이 결국 결실을 맺었다.   24일 NC다이노스가 한국시리즈 우승의 영광을 안았다. 10년도 안된 NC다이노스가 정규리그 우승에 이어 한국시리즈 우승까지 거머쥔 것은 놀라운 일이라는 평가다.   NC다이노스는 이미 올해 한국 프로야구 시작 부터 선전했다. 일명 \'빠던 열풍\'을 일으킨 장본인이다.   코로나19로 모든 프로 스포츠가 중단된 미국에서 올 봄 국내 KBO리그가 화제가 됐다. NC 다이노스와 삼성의 프로야구 개막전을 KBO리그 중계권을 확보한 미국 스포츠채널 ESPN이 미국 전역에 생중계했다. \'실시간 경기\'에 갈증을 느낀 미국 현지 야구팬들을 사로잡았고 특히 미국 야구팬들은 한국 특유의 \'빠던\'(방망이 던지기)에 매료되며 미국 시간으로 새벽임에도 SNS 등지에서 관전평을 이어 나갔다.   미국 커뮤니티사이트 레딧에서는 삼성보다 상대적으로 모기업 브랜드 인지도가 낮은 NC의 생산품을 묻는 질문에 ""온라인게임을 제작한다""는 댓글이 달렸고 ""e스포츠 강국인 한국의 게임회사라면 응원할 이유가 더 분명하다""는 평가를 받았다.   NC다이노스의 우승 뒤에는 구단주인 김택진 대표의 남다른 노고가 있었다. 김 대표는 어렸을 때 만화를 보면서 야구에 대한 꿈을 키웠고 중학교 때는 빠른 볼을 던지기 위해서 팔과 다리에 모래주머니를 차고 다닐 정도로 뛰어난 야구에 대한 열정을 보였다고 한다. NC가 야구 구단을 설립할 때 내부 반대 목소리에 ""내 재산만으로 100년간 야구단을 운영할 수 있다""고 일축했다는 일화는 유명하다.    24일 오후 서울 구로구 고척스카이돔에서 열린 프로야구 2020 신한은행 SOL KBO 포스트시즌 한국시리즈 6차전 두산 베어스와 NC 다이노스의 경기에서 NC가 4대2 완승을 거두며 우승을 차지했다. 승리를 확정 지은 NC 원종현-양의지 배터리가 기쁨을 함께 나누고 있다. 사진=뉴스1지난 2011년 창단 기자회견에서는 ""나한테 야구는 내 마음대로 즐길 수 있는 영화이자 삶의 지혜서""라며 ""야구 자체가 목적인 구단을 만들고 싶다. 사람들의 가슴이 두근거리는 구단을 만들고 싶다""는 명언을 남기기도 했다.   김 대표는 이날 우승 현장도 직원 130여명과 직관했다. 김 대표는 이번 한국시리즈 모든 경기에 현장을 방문, NC 선수들을 응원한 것으로 알려졌다.   한편 NC다이노스를 창단하며 \'사회적 약자에게 희망을 주는 구단\'을 가치로 내세운 엔씨소프트는 연고지인 창원의 지역사회와 함께 성장할 수 있는 다양한 사회공헌 활동을 꾸준히 진행하고 있다.  사진출처=레딧  true@fnnews.com 김아름 기자   ▶ 헉! 소리나는 스!토리 뉴스 [헉스]▶ \'아는 척\'하고 싶은 당신을 위한 [두유노우]▶ 날로먹고 구워먹는 금융이슈 [파인애플]  ※ 저작권자 ⓒ 파이낸셜뉴스. 무단 전재-재배포 금지파이낸셜뉴스 관련뉴스해당 언론사에서 선정하며 언론사 페이지(아웃링크)로 이동해 볼 수 있습니다.배우 오지호 장모의 놀라운 정체, 무려 40년간..이혼 하루 전 생일날 자살한 남편, 아내 ""남편이..""男고생과 사귄 30대 女교사 요구 ""남편처럼 해주려면..""\'폐알 말기\' 김철민 ""내가 쓰러졌을때 박명수가..""남자가 결혼 꺼리는 이유 2위 \'돈\', 1위 ""女의..""좋아요0훈훈해요0슬퍼요0화나요0후속기사 원해요0기사제공 :']"
2,NC soft, 2020-11-2417:50,파이낸셜뉴스 ,코로나에 실적 줄었지만… 배당 더 늘리는 기업들,https://finance.naver.com/news/news_read.nhn?article_id=0004534656&office_id=014&mode=search&query=엔씨&page=1,"['       코로나에 실적 줄었지만… 배당 더 늘리는 기업들      기사입력2020-11-24 17:50기사원문좋아요훈훈해요좋아요 평가하기공감좋아요0훈훈해요0슬퍼요0화나요0후속기사 원해요0댓글코스피\xa0상장사\xa0현금배당\xa029조\xa0예상8월\xa0전망치보다\xa09000억가량\xa0늘어ESG\xa0중요성\xa0커지며\xa0주주친화\xa0행보삼성전자·LG화학·금호산업\xa0등\xa0주목 상장사들이 코로나19 직격탄을 맞았음에도 연말 배당을 확대할 움직임을 보이고 있다. 최근 전세계적으로 ESG(환경·사회·지배구조)에 대한 중요성이 커지면서 기업들이 주주친화적인 움직임을 보이고 있는 것이다. 증시 전문가들은 3·4분기 예상밖 호실적 속에 주당배당금(DPS) 추정치가 전년 대비 증가한 기업에 주목할 것을 조언하고 있다.     수익은 줄어도 배당은 확대    24일 한국거래소에 따르면 지난해 말 코스피, 코스닥 상장기업 1085개사의 결산 배당금 총액은 22조4000억원으로 집계됐다. 2017년 말 기준 23조2000억원 수준이던 배당금 총액은 2018년 말 22조8000억원에서 보합세를 보였다.   주목할 점은 배당수익률이다. 코스피의 2019년 배당수익률은 2.02%로 전년도 1.93% 대비 0.09%포인트 상승했다. 2017년 1.36%와 비교하면 상승률은 0.66%포인트에 달한다.   올해 코스피 상장사의 현금배당 규모는 29조2000억원 수준으로 추정되고 있다. 연초 예상치 31조6000억원에 비해서는 1조4000억원 가량 줄어든 수준이지만 지난 8월 말 전망치 28조3000억원에 비해서는 9000억원 가량 증가한 규모다. 영업이익 대비 현금배당액 비율도 22%로 사상 최고치 경신이 전망된다.   증가폭은 크지 않지만 올해 상장사들의 수익성이 전년에 비해 악화된 것을 고려하면 상대적인 배당규모는 더 큰 셈이다.   한국거래소가 지난 18일 내놓은 12월 결산 상장사 590개사의 실적을 분석한 결과에 따르면 올해 들어 지난 3·4분기까지 당기순이익은 51조249억원으로 전년 동기에 비해 9.44%나 감소했다. 수익은 9% 이상 급감했지만 책임경영 차원에서 배당은 확대할 계획이다.   유안타증권의 김후정 연구원은 ""지배구조 측면에서 긍정적인 평가를 내릴 수 있는 기업들의 경우 평가 당해 연도나 그 다음 연도의 배당 성향이 상대적으로 높은 경향이 도출된다""면서 ""연말이 다가오면서 배당주 투자에 대한 관심이 높아질 수 있는 시점에서 지배구조 점수가 높은 기업들을 고려해 보는 것도 활용 가능한 한 가지 전술이 될 수 있을 듯 하다""고 말했다.     삼성전자·LG화학 등 확대 예상    금융정보업체 에프앤가이드와 하나금융투자에 따르면 주당배당금이 전년에 비해 증가할 것으로 기대되는 종목으로는 삼성전자와 LG화학, 삼성물산, KB금융, SK, LG, 고려아연 등이 있다.   삼성전자의 경우 지난해 1416원에서 올해는 1561억원으로 예상되고 지난해 2000원의 현금배당을 실시한 LG화학의 경우는 올해는 6282원의 배당이 추정됐다. 그러나 LG화학 경영진이 LG에너지솔루션 분할을 결정하면서 주주를 달래기 위해 3년간 주당 1만원 이상의 현금배당을 약속, 1만원선을 넘어설 것으로 예상된다.   삼성물산의 경우에는 지난해 2000원에서 올해는 2330원으로 늘어날 것으로 추정되고 엔씨소프트의 경우에는 5220원에서 6641원으로 늘어날 것으로 예상되고 있다.   이외 매출이 개선될 것으로 보이는 고배당주로 금호산업, 포스코인터내셔널, E1, 현대상사, 제일기획, 골프존 등이 거론되고 있다. 이들은 최근 10년동안 주당배당금이 감소한 전력이 2회 이하인 기업이다.   이재만 하나금융투자 연구원은 ""2015년부터 2019년까지 평균치를 볼 때 계절적으로도 코스피 고배당 지수 수익률은 11월 셋째주를 저점으로 12월 셋째주에 정점을 형성하는 경향이 있다""면서 ""연말이니까 한번쯤은 고배당주에도 관심을 가질 필요가 있는 시기다""라고 판단했다.   이은택 KB증권 연구원은 ""올해 연말 배당주 성과가 압도적일 것이라고 생각하진 않지만, 흔들리는 시장은 넉넉히 이길 수 있는 전략이라고 판단한다""며 ""배당 전 자본차익이 크다면 배당 수령과 상관없이 배당락 전에 파는 것이 낫고 별로 크지 않다면 배당을 받고 연초에 파는 것이 더 나은 전략이다""라고 말했다.    dschoi@fnnews.com 최두선 기자   ▶ 헉! 소리나는 스!토리 뉴스 [헉스]▶ \'아는 척\'하고 싶은 당신을 위한 [두유노우]▶ 날로먹고 구워먹는 금융이슈 [파인애플]  ※ 저작권자 ⓒ 파이낸셜뉴스. 무단 전재-재배포 금지파이낸셜뉴스 관련뉴스해당 언론사에서 선정하며 언론사 페이지(아웃링크)로 이동해 볼 수 있습니다.배우 오지호 장모의 놀라운 정체, 무려 40년간..이혼 하루 전 생일날 자살한 남편, 아내 ""남편이..""男고생과 사귄 30대 女교사 요구 ""남편처럼 해주려면..""\'폐알 말기\' 김철민 ""내가 쓰러졌을때 박명수가..""남자가 결혼 꺼리는 이유 2위 \'돈\', 1위 ""女의..""좋아요0훈훈해요0슬퍼요0화나요0후속기사 원해요0기사제공 :']"
3,NC soft, 2020-11-2417:44,조선비즈 ,"KCGI, 한진칼 새 사내이사에 김신배 전 SK 부회장, 사외이사에 서윤석 전 이...",https://finance.naver.com/news/news_read.nhn?article_id=0000624678&office_id=366&mode=search&query=엔씨&page=1,"['       KCGI, 한진칼 새 사내이사에 김신배 전 SK 부회장, 사외이사에 서윤석 전 이화여대 교수 추천      기사입력2020-11-24 17:44기사원문좋아요훈훈해요좋아요 평가하기공감좋아요0훈훈해요0슬퍼요0화나요0후속기사 원해요0댓글 사모펀드 KCGI(강성부펀드) 등 3자 연합이 한진칼 임시주주총회에서 신규 선임을 추진하는 사내·외 이사 후보 명단에 김신배 전 SK그룹 부회장과 서윤석 전 이화여대 교수가 다시 한번 포함된 것으로 전해졌다. KCGI는 지난 3월 한진칼 주총에서 이들을 이사회 일원으로 선임하자는 안건을 제안했지만 표 대결에 밀려 이뤄지지 않았다..(왼쪽부터) 김신배 전 SK 부회장, 서윤석 전 이화여대 교수. /조선DB24일 재계 관계자는 ""사내이사로는 김신배 전 SK 부회장, 사외이사로는 서윤석 전 이화여대 교수가 후보 명단에 오른 것으로 알고 있다""고 말했다. 3자 연합 측은 지난 20일 한진칼 이사회에 신규 이사 선임을 위한 임시 주총 소집을 요구했다.삼성전자 출신인 김 전 부회장은 한국이동통신(지금 SK텔레콤)에 영입된 이후 SK텔레콤 사장, SK C&C 대표이사, SK그룹 부회장, 포스코 이사회 의장 등을 지냈다. 이화여대 경영대 학장을 지낸 서 교수는 LG텔레콤, SK, 포스코, 엔씨소프트 사외이사를 역임했다. 두 사람은 지난 3월 한진칼 주총에서 KCGI가 추천했던 사내이사 2인(김신배·배경태)·사외이사 4인(서윤석·여은정·이형석·구본주) 명단에 포함됐던 인물들이다. 그러나 당시 선임안은 모두 부결됐다. 업계 관계자는 ""두 후보는 지난 3월 주총에서 3자연합이 사내·외 이사 후보로 추천했던 인물들인데, 이런 배경 탓에 이번 후보 명단에도 포함된 것으로 보인다""고 설명했다.KCGI는 지난 20일 신규 이사 선임을 위한 임시 주총을 한진칼 이사회에 요구했다. 현재 한진칼 이사회는 조원태 회장을 비롯해 사내이사 3명과, 김석동 전 금융위원장 등 사외이사 8명으로 구성돼 있다. KCGI 관계자는 이사 후보 명단과 관련해 ""확정된 바 없다""고 했다.[김우영 기자 young@chosunbiz.com] ▶네이버에서 조선비즈를 구독 하세요 ▶코로나 시대 신혼여행지로 뜬 이곳, 백만명 맞을 하늘길 연다 ▶올해 \'이 기업들\' 투자 안 하면 영영 기회 없다 저작권자 ⓒ 조선비즈, 무단 전재 및 재배포 금지 조선비즈 관련뉴스해당 언론사에서 선정하며 언론사 페이지(아웃링크)로 이동해 볼 수 있습니다.""2억도 안되는 우리집이 왜…"" 억울함에 잠 못 드는 사람들""한국 고맙습니다"" 역대급 호황에 세계 TV업계 웃음꽃셀트리온 코로나 항체치료제 세계 3번째 승인 눈앞""이제껏 경험 못했던 일"" 美·日·中 제치고 신기록 세운 한국올해만 111조원 벌었다… 세계 부호 2위 오른 이 남자좋아요0훈훈해요0슬퍼요0화나요0후속기사 원해요0기사제공 :']"
4,NC soft, 2020-11-2415:43,스포츠서울 ,"거리두기 2단계 타격…의자 엎은 카페, 점심부터 문 여는 술집들",https://finance.naver.com/news/news_read.nhn?article_id=0000718501&office_id=468&mode=search&query=엔씨&page=1,"['       거리두기 2단계 타격…의자 엎은 카페, 점심부터 문 여는 술집들      기사입력2020-11-24 15:43기사원문좋아요훈훈해요좋아요 평가하기공감좋아요0훈훈해요0슬퍼요0화나요0후속기사 원해요0댓글거리두기 강화로 매장 내 취식이 금지된 카페의 외부 전경. 사진| 동효정 기자[스포츠서울 동효정 기자] “매장 취식 금지로 배달 및 테이크아웃만 주문 가능합니다.” 서울의 대형 프랜차이즈 카페들은 24일 일제히 출입문에 안내 문구를 써붙이고 테이블과 의자를 모두 정리해 카운터에서 주문만 할 수 있도록 했다. 서울의 한 개인카페 운영자는 “거리두기로 인한 방역 지침이며 단속이 나와 매장 내 취식이 불가하다는 안내를 해도 카페를 찾는 손님들 중에 외부에 자리가 있는데 왜 못 앉게 하냐며 항의를 하는 경우가 있어 아예 의자를 엎어두기로 했다”면서 “테이크아웃과 배달 주문은 가능하다고 붙여놨지만 매장 모습 때문에 운영을 안하는 줄 아시는 분들도 많은 것 같다”고 푸념했다. 서울과 수도권의 ‘사회적 거리두기’가 24일 오전 0시부터 2단계로 격상되면서 다중이용시설을 중심으로 방역 조치가 대폭 강화됐다. 프랜차이즈는 물론 동네 소규모 매장까지 모든 카페에서는 포장과 배달 주문만 할 수 있고 음식점도 오후 9시까지만 정상 영업이 가능하다. 클럽과 헌팅포차 등 유흥시설은 영업이 전면 금지됐다.마포구 홍대새교회에서도 관련 확진자가 무더기로 나오면서 인근 상권도 타격을 입었다. 홍대새교회 관련 확진자는 총 71명이다. 이중 서울시 확진자는 65명이다. 활력이 넘치던 홍대 젊음의 거리와 합정, 상수 인근 매장들은 모두 한산했다. 오후 9시 이후 영업이 어려워지자 저녁 장사를 하던 술집들은 오픈 시간을 앞당겨 점심부터 문을 여는 곳도 생겼다. 홍대 젊음의 거리의 한 식당 관계자는 “관련 확진자가 나오면서 주말에도 인적이 뜸해졌다. 방역 강화를 앞두고 저녁 장사가 힘들어 오픈 시간을 앞당겨 점심 장사를 운영하는데 오늘부터 거리두기가 강화되면서 점심에도 발길이 뚝 끊겼다. 지난 여름의 악몽이 되살아나는 것 같다”고 말했다. 한동안 축소했던 재택근무를 다시 확대하자 을지로, 명동, 판교 등의 상권도 한산해졌다. 삼성전자는 지난 16일부터 가전과 모바일 등 사업부를 중심으로 소규모의 재택근무를 시범 운영하고 있다. LG그룹은 계열사 임직원의 70%가 재택근무에 돌입하는 3단계 방역 지침을 비상 가동 중이다. SK그룹도 외부인 출입을 제한하는 등 사내 방역 지침 강화에 나섰고 부서 재량에 따라 재택근무 인원을 확대하고 대면회의와 보고는 가능한 자제하도록 했다.네이버는 이날부터 전사 원격 근무로 전환한다. 카카오는 이달 18일부터 전원 재택근무에 돌입했다. 넥슨은 이날부터 일주일에 사흘만 출근하고 이틀은 재택근무를 하는 ‘3＋2 체제’로 전환했다. 지난주까지 일주일 중 하루만 재택근무를 하는 ‘4＋1 체제’였는데 재택근무 일수를 늘렸다. 엔씨소프트도 일주일에 이틀 재택근무를 하는 ‘3＋2 체제’를 시행한다.외식업 관계자는 “올 여름 거리두기 격상으로 인한 영업 제한 당시 매출은 평소보다 70% 감소했다. 그 정도의 타격이 다시 이어질 것으로 예상된다. 송년회를 앞두고 알바생 채용 공고를 올렸는데 이 것도 철회해야할 것 같다”고 말했다. vivid@sportsseoul.com[기사제보 news@sportsseoul.com]  Copyright ⓒ 스포츠서울&sportsseoul.com스포츠서울 관련뉴스해당 언론사에서 선정하며 언론사 페이지(아웃링크)로 이동해 볼 수 있습니다.라이관린, 길거리서 흡연 후 침 \'퉤\' 논란""부디 편히 쉬길"" 윤지오, 느닷없는 사망설곰 농락한 여우, 어쩔 수 없는 \'양의지 시리즈\'임신 알린 \'예비맘\' 강소라, 근황 봤더니…\'패승승패패\' 순서…두산, 어게인 1995?좋아요0훈훈해요0슬퍼요0화나요0후속기사 원해요0기사제공 :']"
