,회사명,날짜,언론사,기사제목,링크,본문
0,NC soft, 2020-09-1617:46,매일경제 ,"배그에 몰린 개미들…""상장전 미리 찜하자""",https://finance.naver.com/news/news_read.nhn?article_id=0004657159&office_id=009&mode=search&query=엔씨&page=1,"['       배그에 몰린 개미들…""상장전 미리 찜하자""      기사입력2020-09-16 17:46기사원문좋아요훈훈해요좋아요 평가하기공감좋아요0훈훈해요0슬퍼요0화나요0후속기사 원해요0댓글카겜 공모주 못 건진 투자자장외시장서 유망종목에 관심배그 개발사 크래프톤 166만원카카오게임즈 시총 3배 육박2분기 영업익 5배 올라 1612억연말 신작 흥행 여부는 변수 개미들이 비상장 주식에 줄지어 몰려들고 있다. SK바이오팜과 카카오게임즈의 치열한 청약 경쟁을 목격한 개인투자자들이 장외에서 상장 유망주 선점에 나선 것이다. 대표적인 예가 \'배틀그라운드\'로 유명한 게임업체 크래프톤이다. 이 회사는 카카오게임즈의 뒤를 이을 기업공개(IPO) 대어로 꼽힌다. 이 때문인지 주가가 반년 만에 4배나 급등했다. 일각에서는 카카오게임즈가 상장 직전 장외에서 8만원 가까이 치솟았지만 상장 뒤 6만원대까지 하락한 점을 들어 장외시장 과열을 우려하는 목소리도 나온다.16일 증권플러스비상장 등 비상장 주식 거래 플랫폼에 따르면 이날 크래프톤은 전 거래일 대비 6만5000원(4.08%) 오른 주당 166만원에 거래되고 있다. 이 가격을 기준으로 총 발행 주식 수(808만5285주)를 곱해 산출한 시가총액은 13조4216억원이다.이달 상장한 카카오게임즈 시가총액(4조8535억원)의 3배에 육박하며, 국내 게임주 3대장 가운데 엔씨소프트, 넷마블과 어깨를 나란히 하는 수준이다. 16일 엔씨소프트 시가총액은 18조462억원, 넷마블은 15조6597억원, 넥슨은 6137억원이다. 이대로라면 상장과 동시에 국내 게임업계 3위로 단숨에 치고 오르게 되는 셈이다.크래프톤 주가는 올 3월까지 40만원대에 머물렀지만 반년 만에 4배 급등했다. 양호한 1분기 실적, 동종 업체인 카카오게임즈의 상장 추진이 맞물려 주가가 상승 시동을 걸었다. 결정적으로 주가를 밀어올린 것은 SK바이오팜과 카카오게임즈가 연달아 쓴 상장 신화다. 두 회사 모두 공모주의 꿈으로 여겨지는 \'따상\'을 기록했다.그러나 공모주 투자를 통해 짭짤한 수익을 거둔 투자자는 많지 않았다. 어지간한 거금을 넣지 않고서야 의미 있는 수량을 배정받기 어려웠기 때문이다. 장내에서 치인 투자자들은 장외로 눈을 돌렸다. 상장 후 \'따상\'을 기록할 만한 대어를 장외시장에서 선점하겠다는 계획이다. 이 같은 맥락에서 점찍은 종목이 크래프톤이다. 크래프톤은 지난해부터 상장 얘기가 흘러나왔다. 아직 주간사나 상장 일정이 정해지지는 않았지만 회사 측도 상장 계획이 있다고 밝혔다. 소영주 장외주식연구소 소장은 ""일부 투자자는 카카오게임즈를 판 돈을 동종 업체이면서 상장이 유력한 크래프톤에 투자한 것으로 보인다""고 말했다.크래프톤은 1인칭 슈팅 게임 \'배틀그라운드\'(배그)로 잘 알려진 게입업체다. 사실상 배그에서 대부분 매출이 창출된다. 올해 2분기 연결 기준 매출 3790억원, 영업이익 1612억원을 기록했다. 지난해 같은 기간보다 매출(1994억원)은 약 2배, 영업이익(321억원)은 약 5배 수준으로 늘어났다. 한 자산운용사 관계자는 ""크래프톤이 하반기에도 호실적을 이어 간다면 올해 영업이익이 1조원에 달할 수 있다""며 ""게임회사에 적용되는 주가수익비율(PER)은 30배에서 40배 사이인데, 후하게 40배를 적용할 경우 크래프톤의 기업 가치는 40조원에 달한다는 계산이 나온다""고 평가했다. 그러나 우려도 만만치 않다. 상장 일정이 구체화된 것도 아닌데 기대감만으로 주가가 단기간에 너무 올랐다는 것이다. 배그 모바일 다운로드 건수의 약 25%를 차지하는 인도 시장에서 타격을 입을 수 있다는 우려도 제기된다. 중국과 갈등을 겪고 있는 인도 정부가 배그 모바일을 유통하는 중국 텐센트를 퇴출시키겠다고 밝혔기 때문이다. 또 연말 출시를 앞둔 신작 엘리온도 주가 불확실성을 키운다. 흥행할 경우 기업 가치가 한층 올라갈 수 있지만 예상보다 성과가 부진하다면 IPO를 앞둔 시점에서 주가 하방 압력을 높일 수 있다.  [홍혜진 기자]▶ 팬데믹위기 해법 찾는다! - 제21회 세계지식포럼▶ 궁금한 제조과정 영상으로 보세요. \'이렇게 만들죠\'▶ 데일리 뉴스 브리핑 \'매경이 전하는 세상의 지식[ⓒ 매일경제 & mk.co.kr, 무단전재 및 재배포 금지]매일경제 관련뉴스해당 언론사에서 선정하며 언론사 페이지(아웃링크)로 이동해 볼 수 있습니다.서정진 ""이달 항체치료제 임상 2·3상 기대…5개국가에 신청""배그에 몰린 개미들…""상장전 미리 찜하자""클라라, 갈수록 대단해지는 섹시한 볼륨 몸매[배한철 역사의 더께/조선국]""대포 몇방이면 조선해군은 궤멸된다""장기중, 31세 연하 아내와 재혼…69세에 딸 출산좋아요0훈훈해요0슬퍼요0화나요0후속기사 원해요0기사제공 :']"
1,NC soft, 2020-09-1617:31,파이낸셜뉴스 ,[fn마켓워치]구글 대항마 '원스토어' 상장 대표주관에 NH·KB,https://finance.naver.com/news/news_read.nhn?article_id=0004495817&office_id=014&mode=search&query=엔씨&page=1,"['       [fn마켓워치]구글 대항마 \'원스토어\' 상장 대표주관에 NH·KB      기사입력2020-09-16 17:31기사원문좋아요훈훈해요좋아요 평가하기공감좋아요0훈훈해요0슬퍼요0화나요0후속기사 원해요0댓글공동주간에\xa0SK증권..내년\xa01兆\xa0밸류\xa0상장\xa0목표\xa0구글\xa0인앱결제\xa0수수료\xa0확대에\xa0\'원스토어\'\xa0가치↑KT,\xa0프리IPO\xa0등으로\xa0투자\xa0검토\xa0  [파이낸셜뉴스] \'원스토어\' 상장 대표주관사에 NH투자증권, KB증권이 선정되면서 내년 상장(IPO)에 청신호가 켜졌다. 원스토어는 구글 플레이스토어의 대항마로 꼽히는 안드로이드 기반 스마트폰과 태블릿PC에서 이용할 수 있는 종합 앱스토어다.   17일 투자은행(IB) 업계에 따르면 원스토어는 최근 IPO 대표주관사에 NH투자증권, KB증권을 선정했다. 공동주간사에는 SK증권을 선정했다.   앞서 이들 외 한국투자증권, 삼성증권, 키움증권 등 국내 대형 증권사들이 대표주관사로 선정되기 위해 참여했다.   원스토어의 2대 주주인 네이버가 7.34%의 지분을 보유한 미래에셋대우는 이해관계인으로 분류돼 주관사 경합에는 참여하지 못했다.   원스토어는 2016년 SK텔레콤, KT, LG유플러스 등 이동통신 3사와 네이버가 합작해 글로벌 앱 마켓에 대항하기 위해 선보인 국내 토종 앱스토어다.   안드로이드를 기반으로 게임과 이북, 웹툰, 커머스, 음악, 주문형비디오(VOD) 등의 서비스를 제공하고 있다.   원스토어가 상장하게 되면 SK텔레콤 계열사 중 첫번째 상장회사가 된다. SK브로드밴드와 ADT캡스, 11번가 등도 상장을 준비에 들어갈 것으로 알려진 상황에서 행보다.   원스토어는 지난해 11월 SKS PE-키움인베스트먼트 컨소시엄의 약 1000억원 투자를 받으면서, 포스트밸류(투자 후 가치) 5000억원을 인정받았다. 상장에 성공하면 전체 시총은 1조원을 넘을 것이라는 것이 IB업계의 평가다.   현재 원스토어는 SK텔레콤이 52.7%로 최대주주이며, 네이버가 27.7%, SKS-키움 컨소시엄이 19.6%를 보유하고 있다.   구글이 게임 앱에만 적용했던 ‘인앱결제’(구글이 결제대금의 30%를 수수료로 떼는 것)를 다른 앱까지 확대하는 방안을 추진해 원스토어의 가치는 우상향 중이다. 유일한 대항마 성격이기 때문이다.   구글 플레이스토어와 애플 앱스토어는 게임 내 결제 금액의 30%를 수수료로 부과한다.   원스토어는 2018년 7월부터 수수료를 20%로 내리고, 자체 결제 시스템을 운영하면 5%까지 낮출 수 있도록 했다.   낮은 수수료율에 힘입어 원스토어는 넥슨 \'바람의 나라:연\'과 펄어비스 \'검은사막\', 엔씨소프트 \'프로야구H2\' 등의 게임을 입점시키며 입지를 확대했다.   이에 올해 상반기에는 영업이익 흑자 전환에 성공하며 사업을 본궤도에 올렸다.   매출은 지난해 1351억원에 이어 올해 상반기 801억원을 거뒀다. 지난해 54억원의 연 순손실은 올 상반기 흑자 전환해 30억원의 영업이익으로 개선됐다.   구글의 행보에 맞서 KT도 원스토어 지분투자를 검토하고 있다. IPO를 준비하고 있는 만큼 프리IPO 형태가 유력하다. KT, LG유플러스의 지분이 없었던 만큼 투자가 이뤄지면 자금 확보는 물론 기본 설치 단말기 확대가 가능해져 윈-윈이 될 것으로 보인다.   IB업계 관계자는 ""원스토어는 토종 앱으로 키워야 한다는 사명감을 가지고 임하고 있다""며 ""제값을 인정받기 위해 제대로 준비하겠다""고 말했다.  ggg@fnnews.com 강구귀 기자   ▶ 헉! 소리나는 스!토리 뉴스 [헉스]▶ \'아는 척\'하고 싶은 당신을 위한 [두유노우]  ※ 저작권자 ⓒ 파이낸셜뉴스. 무단 전재-재배포 금지파이낸셜뉴스 관련뉴스해당 언론사에서 선정하며 언론사 페이지(아웃링크)로 이동해 볼 수 있습니다.\'이혼\' 황정음, 부동산 자산만 120억인데 월 임대수익은 무려..심정지로 사망한 배우 오인혜, 경찰에 신고한 사람 알고보니..\'추미애 아들 폭로\' 당직사병 소속 알고보니.. 대반전故설리 친구의 묵직한 한 방 ""설리 어머니는..""스킨십 싫어하는 남편, 아내 뜻밖의 고백 ""애인이..""좋아요0훈훈해요0슬퍼요0화나요0후속기사 원해요0기사제공 :']"
2,NC soft, 2020-09-1616:02,시사저널 ,"""백신 개발부터 비대면 쇼핑까지 AI 활용 가능""",https://finance.naver.com/news/news_read.nhn?article_id=0000016663&office_id=586&mode=search&query=엔씨&page=1,"['       ""백신 개발부터 비대면 쇼핑까지 AI 활용 가능""      기사입력2020-09-16 16:02기사원문좋아요훈훈해요좋아요 평가하기공감좋아요0훈훈해요0슬퍼요0화나요0후속기사 원해요0댓글[인터뷰] 윤석찬 아마존웹서비스 수석테크에반젤리스트코로나19 위기를 겪으면서 인공지능(AI)에 대한 관심은 더욱 높아졌다. 디지털뉴딜 등 향후 먹거리와 경쟁력 향상을 위한 도구를 넘어 진단, 백신물질 개발, 비대면 업무 등 직접적인 연관 분야에서도 활용되고 있다. 국내 지자체에서는 자가격리자 관리를 인공지능이 대신 하는 사례까지 나왔다. 대면 면접이 어려워지자 인공지능 역량검사를 활용해 비대면 면접 대상을 선발하고 있는 것이다.인공지능 전문가인 윤석찬 아마존웹서비스(AWS) 수석테크에반젤리스트는 ""코로나 팬데믹 이후 인공지능과 클라우드 기술의 활용은 더욱 늘어날 것""이라고 전망했다.ⓒ아마존웹서비스 제공최근 코로나19가 유행하면서 클라우드와 인공지능 활용에 대한 관심이 높아졌다.""인공지능과 클라우드의 결합으로 코로나19 백신, 진단기술, 치료법 개발뿐 아니라 비대면 비즈니스 확대 등 팬데믹 현상 대응에 큰 도움을 줄 것으로 예상한다. 저커버그재단은 현재 AWS 진단 개발 이니셔티브(DDI)로 인공지능 기술을 사용해 코로나 증상에 도움이 되는 치료제 개발을 지원한다. 클라우드에 코로나19에 대한 각종 자료와 데이터를 저장·공유해 학계나 연구자, 의료진 등이 데이터를 빨리 찾고 바로 클라우드로 분석하고 있다.캐나다 스타트업 블루닷의 경우 AWS 기반 자연어 처리 기술로 65개국 뉴스기사 정보를 분석해 기업에 사업정보를 제공하고 있다. 블루닷은 중국 우한에서 신종 바이러스가 나타났다는 것을 최초로 파악하고 발견한 기관들 가운데 하나였다. 농업 스타트업 맨틀랩은 컴퓨터 비전과 아마존 세이지메이커 서비스를 사용해 작물의 현재 상태나 다양한 곳의 작황 등을 확인하고 공급망 문제가 어디서 발생할지를 예측하는 기술을 개발해 제공하고 있다. 마켓컬리는 코로나19로 인해 이용이 늘었지만 클라우드를 활용해 쉽게 IT 시스템을 확장할 수 있어 별다른 문제 없이 고객 주문을 처리할 수 있었다.""클라우드와 인공지능은 어떤 관계가 있나.""똑똑한 인공지능을 만들기 위해서는 엄청난 컴퓨팅 인프라와 방대한 데이터가 필요한데, 클라우드 컴퓨팅을 통해 그 기반을 마련할 수 있다. 과거에는 수개월 이상의 시간과 거액의 자금이 필요했다. 사업도 미리 대규모 컴퓨팅 인프라 투자가 가능한 기업만 할 수 있었지만 지금은 클라우드를 이용해 누구나 몇 분 안에 원하는 컴퓨팅 용량을 사용할 수 있게 됐다.특히, 최근에 각광받는 딥러닝 알고리즘은 소스코드를 누구나 쓸 수 있도록 공개한 오픈소스 소프트웨어로 쉽게 활용될 수 있게 됐다. 거대한 기술 기업이나 자금이 풍부한 연구소가 아니라 단 두 명이 시작하는 스타트업이라도 최고 성능의 최신 기술을 활용할 수 있게 된 것이다. AWS와 같은 클라우드 서비스 제공자들은 쌓아온 컴퓨팅, 스토리지 기술을 통해 대용량 데이터에서 똑똑한 모델을 학습하는 인공지능 관련 서비스를 가장 빠르게 제공함으로써 소수의 연구자들뿐만 아니라 모든 사람이 인공지능에 접근해 활용할 수 있는 세상을 열고 있다.""AWS를 소개해 달라.""AWS는 지난 2006년 시작된 아마존의 클라우드 컴퓨팅 사업부다. 수백만 명의 개발자와 스타트업, 대기업, 정부 기관 등 175개 이상 기업과 단체에 클라우드 서비스를 제공하고 있다. 당시 아마존은 방대한 규모의 기술 인프라 및 데이터센터 운영을 통해 핵심 역량을 구축했는데, 이를 웹 서비스 플랫폼을 통해 개발자와 기업이라는 새로운 고객군을 대상으로 서비스를 시작했다. AWS 클라우드 서비스를 이용하면 자체 데이터센터 구축, 운영이 필요 없다. 직접 소프트웨어를 개발하거나 구매하지 않더라도 클라우드 인프라를 원하는 시기에 종량제 요금제에 따라 이용할 수 있다.넷플릭스가 대표적이다. 넷플릭스는 현재 전 세계에 동영상 서비스를 제공하는데 자체 데이터센터 없이 AWS를 기반으로 서비스를 구축하고 운영한다. 스트리밍뿐만 아니라 데이터 분석, 동영상 변환, 추천 엔진 등 거의 모든 서비스에 AWS를 적용했다. 국내의 경우 우아한형제들, 마켓컬리, 뱅크샐러드, 직방 등 스타트업과 넥슨, 엔씨소프트, 넷마블 등 게임업계가 이 서비스를 이용하고 있다. 삼성전자와 LG전자도 전 세계를 대상으로 한 모바일 서비스와 가전 사물인터넷 등에 AWS 클라우드를 이용한다. 최근 국민은행과 신한은행, 현대카드 등 금융권과 대한항공, 두산중공업, GS칼텍스 등 전통 대기업들도 AWS 클라우드를 통한 디지털 전환에 박차를 가하고 있다.""아마존 생태계가 커지고 있는데 어디까지 확장될 것으로 보는가.""아마존은 쇼핑몰로 유명하다. 인공지능 기술이 뛰어난 곳이라고 생각하는 사람은 많지 않을 것이다. 하지만 아마존닷컴은 서비스 초기부터 상품 추천 엔진을 통해 제품을 소개하고, 더 빠르게 배송하기 위해 배송 경로를 예측하는 인공지능 기술을 20년 전부터 개발했다. 물류센터에서 잘 학습된 인공지능 로봇을 통해 상품 포장에 드는 시간을 줄이는가 하면, 최근에는 드론을 이용해 30분 거리 내 농촌 지역에 상품을 배송하는 서비스를 시작했다. 로봇이나 드론 같은 소형 CPU를 탑재한 기기에서 똑똑한 서비스를 제공하려면, 비행 및 운행 안전을 위한 예측 모델을 클라우드로 학습하고 테스트해 안정성을 높이는 작업은 필수적이다. 일상생활의 불편을 클라우드와 인공지능으로 간단히 풀어내는 기술 발명의 사례도 많다. 예를 들어 아마존고(Amazon Go) 매장은 계산대에서 줄을 서서 기다릴 필요 없이 그냥 나가면 계산이 된다.""지난해 9월19일 시사저널이코노미 주최로 열린 인공지능 포럼 모습 ⓒ시사저널e.인공지능 기술현황과 전망을 한눈에 볼 수 있는 행사가 열린다. 시사저널이코노미는 오는 9월15일 \'인공지능포럼(Artificial Intelligence Forum, AIF) 2020\'을 통해 업계나 국내외 전문가들의 인공지능 혜안을 들어본다. 기조연설은 루크 레몽 슈나이더일렉트릭 부회장과 김진형 중앙대학교 석좌교수가 맡았다. LG전자, 자동차연구소, 한국IBM, AWS, 와이즈넛, 라온피플, 오토노머스에이투지 등이 세션발표를 한다.행사는 코로나19를 감안해 비대면으로 열린다. 유튜브 \'시사저널e\' 채널에서 오전 10시부터 생중계할 예정이다.\xa0송주영 시사저널e 기자 jysong@sisajournal-e.com<저작권자 ⓒ 시사저널, 무단 전재 및 재배포 금지>☞ 네이버에서 시사저널 뉴스를 받아 보세요 ▶ 시사저널 최신호 보기 시사저널 관련뉴스해당 언론사에서 선정하며 언론사 페이지(아웃링크)로 이동해 볼 수 있습니다.2년만에 10배 불어난 의원 자녀 재산의 비밀""7% 이자줄게""…전 거제 별정우체국장, 고객 예금 \'꿀꺽\'BMW·벤츠 한국 시장 선두 경쟁의 이면평당 1억 넘는 금싸라기 아파트, 몇 개나 될까대면예배 강행하더니 또 교회發 집단감염좋아요0훈훈해요0슬퍼요0화나요0후속기사 원해요0기사제공 :']"
3,NC soft, 2020-09-1615:29,매일경제 ,SK바팜·카겜 대박 지켜본 개미들…비상장 `크래프톤` 띄워올린다,https://finance.naver.com/news/news_read.nhn?article_id=0004657004&office_id=009&mode=search&query=엔씨&page=1,"['       SK바팜·카겜 대박 지켜본 개미들…비상장 `크래프톤` 띄워올린다      기사입력2020-09-16 15:29기사원문좋아요훈훈해요좋아요 평가하기공감좋아요0훈훈해요0슬퍼요0화나요0후속기사 원해요0댓글게임회사 크래프톤, IPO기대감에 반년새 주가 4배 올라카겜 시총 3배 육박…국내 엔씨소프트, 넷마블과 시총 맞먹어크래프톤 로고 [사진 제공 = 크래프톤]  개미들이 비상장 주식시장으로 줄지어 가고 있다. SK바이오팜과 카카오게임즈의 치열한 청약경쟁을 목격한 개인투자자들이 장외에서 상장 유망주 선점에 나선 것이다. 게임회사 크래프톤은 카카오게임즈 뒤를 이을 기업공개(IPO) 대어로 꼽히면서 주가가 반년만에 4배 급등했다. 빅히트는 장외시장에서 매도 물량 씨가 말라 기준가가 나오지 않을 정도로 투자 열기가 뜨겁다. 16일 증권플러스비상장 등 비상장 주식거래 플랫폼에 따르면 이날 크래프톤 비상장 주식은 전 거래일 대비 6만5000원(4.08%) 오른 주당 166만원에 거래되고 있다. 이 가격을 기준으로 산출한 시가총액은 13조4216억원이다. 주가에 총 발행주식수인 808만5285주를 곱한 수치다.이는 이달 상장한 카카오게임즈 시가총액(4조9267억원)의 3배에 육박하며, 국내 게임주 3대장 가운데 엔씨소프트, 넷마블과 어깨를 나란히 하는 수준이다. 16일 장중 엔씨소프트 시가총액은 18조1999억원, 넷마블은 15조7455억원, 넥슨은 6279억원으로 크래프톤의 시가총액은 넷마블을 바짝 뒤쫓고 있다.크래프톤 주가는 반년새 4배 급등했다. 지난 3월만 해도 주당 40만원대에 머물렀지만 SK바이오팜과 카카오게임즈가 연달아 상장 후 주가 폭등을 기록하자 기업공개를 추진하고 있는 크래프톤으로 투자 열기가 번졌다. 크래프톤은 1인칭 슈팅 게임 \'배틀그라운드\'로 잘 알려진 게입업체다. 올해 2분기 연결 기준 매출 3790억원, 영업이익 1612억원을 기록했다. 지난해 같은 기간보다 매출(1994억원)은 약 2배, 영업익(321억원)은 약 5배 수준으로 늘어났다. 영업익 기준으로 국내 게임업체 중에선 넥슨(3025억원)과 엔씨소프트(2090억원) 다음이며 넷마블(817억원)보다 많다. 크래프톤은 상장 준비 작업을 꾸준히 진행해왔다. 크래프톤 관계자는 ""IPO를 추진하고 있지만 주간사과 상장 일정 등은 아직 정해진 바가 없다""고 말했다. [홍혜진 기자]▶ 팬데믹위기 해법 찾는다! - 제21회 세계지식포럼▶ 궁금한 제조과정 영상으로 보세요. \'이렇게 만들죠\'▶ 데일리 뉴스 브리핑 \'매경이 전하는 세상의 지식[ⓒ 매일경제 & mk.co.kr, 무단전재 및 재배포 금지]매일경제 관련뉴스해당 언론사에서 선정하며 언론사 페이지(아웃링크)로 이동해 볼 수 있습니다.\'제보자 실명공개\' 황희 ""軍휴가 전화연장 3천건 넘어""…秋 옹호[세계지식포럼] 메이 전 英 총리 ""중국없이 살아갈 수 없어…더 큰 국제질서로 포용해야""클라라, 갈수록 대단해지는 섹시한 볼륨 몸매남현희 ""박세리, 집에 남자 후배만 데려가"" 폭로장기중, 31세 연하 아내와 재혼…69세에 딸 출산좋아요0훈훈해요0슬퍼요0화나요0후속기사 원해요0기사제공 :']"
