,회사명,날짜,언론사,기사제목,링크,본문
12,NC soft, 2020-09-0912:55,스포츠조선 ,"KT&G·SK텔레콤·현대모비스 등 13개 기업, 82분기 연속 흑자 기록",https://finance.naver.com/news/news_read.nhn?article_id=0003627539&office_id=076&mode=search&query=엔씨&page=1,"['       KT&G·SK텔레콤·현대모비스 등 13개 기업, 82분기 연속 흑자 기록      기사입력2020-09-09 12:55기사원문좋아요훈훈해요좋아요 평가하기공감좋아요0훈훈해요0슬퍼요0화나요0후속기사 원해요0댓글 코로나19로 인한 기업활동 위축에도, KT&G·SK텔레콤·현대모비스 등 13곳이 국내 500대 기업 중 2000년부터 올해 2분기까지 82분기 연속 흑자를 이어온 기업으로 기록됐다. 9일 기업평가사이트 CEO스코어에 따르면, 국내 500대 기업중 2000년 이후 금융감독원 전자공시시스템에 분기보고서를 제출한 345개 사의 영업이익(개별 기준) 추이 조사 결과 82분기 연속 흑자 기업은 총 13곳으로 집계됐다.KT&G, SK텔레콤, 현대모비스, 유한양행을 비롯해 GS홈쇼핑, CJ ENM, 신세계, 고려아연, 에스원, 농심, 한섬, 국도화학, 이지홀딩스 등이 82분기 연속 흑자 기업 명단에 이름을 올렸다. 이 가운데 평균 영업이익률이 가장 높은 회사는 35.5%를 기록한 KT&G였다. 이어 SK텔레콤(19.3%), 한섬(15.5%), 고려아연(13.3%), 이지홀딩스(12.8%), 에스원(12.6%), CJ ENM(11.8%), GS홈쇼핑(11.2%), 현대모비스(10.8%), 유한양행·신세계(각 10.0%) 등의 영업이익률이 10%를 넘었다. 지난해 2분기까지 78분기 연속 흑자였던 19개 기업 중 포스코와 현대제철, 솔브레인홀딩스, SKC, 호텔신라, 넥센타이어 등 6곳은 지난해 3분기부터 올해 2분기까지 분기 적자를 기록하면서 연속 흑자 기업 명단에서 빠졌다.금호석유화학과 광동제약, LG생활건강, 한샘, 엔씨소프트, 네이버, 카카오, 현대건설 등 17개 사는 70분기 이상 장기 흑자 기업으로 조사됐다. 60~69분기 연속 흑자 기업에는 GS리테일·오뚜기 등 9개사가 포함됐고, 아모레퍼시픽·현대글로비스 등 9곳은 50~59분기 연속 흑자를 기록했다.50분기 이상 연속 흑자를 낸 기업은 총 49개였다. 삼성전자는 2008년 4분기 적자 이후 46분기 연속 흑자를 기록 중이다. 김소형기자 compact@sportschosun.com▶무료로 보는 오늘의 운세▶""아직 대어는 없다"" 7파전 신인왕 경합...팀성적도 고려대상?- Copyrightsⓒ 스포츠조선(http://sports.chosun.com/), 무단 전재 및 재배포 금지좋아요0훈훈해요0슬퍼요0화나요0후속기사 원해요0기사제공 :']"
13,NC soft, 2020-09-0912:21,문화일보 ,금융위기도 코로나도 이겨내고… SKT 등 13社 82분기 연속 흑자,https://finance.naver.com/news/news_read.nhn?article_id=0002441847&office_id=021&mode=search&query=엔씨&page=1,"['       금융위기도 코로나도 이겨내고… SKT 등 13社 82분기 연속 흑자      기사입력2020-09-09 12:21기사원문좋아요훈훈해요좋아요 평가하기공감좋아요0훈훈해요0슬퍼요0화나요0후속기사 원해요0댓글- CEO스코어 조사KT&G 평균 영업이익률 35%삼성화재는 81분기 흑자 행진10분기미만 연속 흑자는170곳KT&G, SK텔레콤, 현대모비스 등 13개 기업이 분기보고서를 제출하기 시작한 2000년 이후 올 2분기까지 82분기 연속 흑자를 이어 온 것으로 파악됐다. 글로벌 금융위기와 올 들어 경제와 산업 전반을 강타하고 있는 신종 코로나바이러스 감염증(코로나19) 확산에도 불구, 20여 년 굳건히 경영 위기를 선방해온 것이다.9일 기업평가사이트 CEO스코어가 금융감독원 전자공시시스템에 기업들이 분기보고서를 제출하기 시작한 2000년 이후 국내 500대 기업 345개 사의 영업이익(개별 기준) 추이를 조사한 결과, 13개 기업이 82분기 연속 흑자를 거뒀다. 82분기 연속 흑자 기업은 KT&G, SK텔레콤, 현대모비스, GS홈쇼핑, CJ ENM, 신세계, 고려아연, 에스원, 유한양행, 농심, 한섬, 국도화학, 이지홀딩스 등이다.평균 영업이익률은 KT&G가 35.5%로 가장 높았다. 이어 SK텔레콤(19.3%), 한섬(15.5%), 고려아연(13.3%), 이지홀딩스(12.8%), 에스원(12.6%), CJ ENM(11.8%), GS홈쇼핑(11.2%), 현대모비스(10.8%), 유한양행·신세계(각 10.0%) 등이 10%를 넘었다. 농심과 국도화학의 평균 영업이익률은 각각 6.2%와 5.1%였다.삼성화재는 2000년 2분기부터 분기보고서를 제출, 81분기 연속 흑자를 기록했다. 70분기 이상 장기 흑자 기업은 금호석유화학과 광동제약, LG생활건강, 한샘, 엔씨소프트, 네이버, 카카오, 현대건설, 포스코인터내셔널, ㈜한화, SK㈜, SPC삼립, 현대백화점, 삼성SDS, 고려제강, 에스앤아이코퍼레이션, LS일렉트릭 등 17개 사로 조사됐다. 반면 지난해 2분기까지 78분기 연속 흑자를 이어오던 19곳 중 포스코와 현대제철, 솔브레인홀딩스, SKC, 호텔신라, 넥센타이어 등 6곳은 지난해 3분기부터 올 2분기까지 분기 적자를 기록하면서 연속 흑자 기업 명단에서 제외됐다.60∼69분기 연속 흑자인 기업은 GS리테일, 오뚜기, KG이니시스 등 9곳이며, 50∼59분기 연속 흑자 기업은 아모레퍼시픽, 현대글로비스 등 9곳이었다. 삼성전자는 2008년 4분기 적자를 기록한 이후 46분기 연속 흑자를 이어가는 중이다. 분기 연속 흑자 기록이 10분기 미만인 기업은 총 170곳(49.3%)으로, 전체 조사대상 절반에 가까웠다. 이는 지난해 2분기 말 기준 155곳에서 15곳 늘어난 숫자다.김온유 기자 kimonu@munhwa.com[ 문화닷컴 바로가기 | 문화일보가 직접 편집한 뉴스 채널 | 모바일 웹 ][Copyrightⓒmunhwa.com \'대한민국 오후를 여는 유일석간 문화일보\' 무단 전재 및 재배포 금지(구독신청:02)3701-5555)]문화일보 관련뉴스해당 언론사에서 선정하며 언론사 페이지(아웃링크)로 이동해 볼 수 있습니다.\'부모찬스\' 거부 송영길 子, 특혜논란 우려 인천시장 낙선 뒤 입대김홍걸, \'10억대 분양권\' 재산 누락 의혹…보좌진 ""실수""\'애로부부\' 무성욕자 최영완 ""5년째 부부관계 無""윤영찬 \'카카오\' 문자에 ""文, 언론장악까지 독재 5관왕""""文정부, 그 높은 지지율 갖고 3년간 \'개혁\' 씹어먹어… 염치없다""좋아요0훈훈해요0슬퍼요0화나요0후속기사 원해요0기사제공 :']"
14,NC soft, 2020-09-0911:23,헤럴드경제 ,개미 ‘1일 1조 쇼핑’ 올해만 10번…삼성전자 ‘톱픽’ 재탈환,https://finance.naver.com/news/news_read.nhn?article_id=0001723027&office_id=016&mode=search&query=엔씨&page=1,"['       개미 ‘1일 1조 쇼핑’ 올해만 10번…삼성전자 ‘톱픽’ 재탈환      기사입력2020-09-09 11:23기사원문좋아요훈훈해요좋아요 평가하기공감좋아요0훈훈해요0슬퍼요0화나요0후속기사 원해요0댓글개인순매수 1조원 돌파하는 날10번 중 8번 삼성전자가 ‘톱픽’언택트·레버리지ETF 순위 하락“언택트보다 콘택트 주목할 때”올들어 개인 투자자들이 코스피 시장에서 일일 순매수 1조원을 돌파한 횟수가 최근 10회차에 도달했다. 개인 순매수 1위 종목 자리를 잠시 내줬던 삼성전자가 다시 톱픽을 탈환한 것으로 나타났다. 반면 증시 상승 기대감으로 개인들의 1조원 장바구니 속 상위 종목에 자리했던 레버리지 ETF의 비중은 대폭 줄었다.9일 코스콤에 따르면, 올들어 코스피 개인 순매수가 1조원을 돌파한 날은 총 10회다. 이 가운데 삼성전자는 최근 일자인 8월 20일과 9월 2일 양일에 개인 순매수 톱픽 자리를 꿰찼다. 이같은 순위는 앞선 6월 25일과 7월10일에 두 차례 톱픽 자리를 내어준 뒤 재탈환한 것이라는 점에서 눈길을 끈다.삼성전자는 연초 개미들의 일일 순매수 규모가 1조원을 돌파할 때부터 톱픽 종목으로 부상한 뒤, 총 여덟차례 톱픽에 랭크됐다. 삼성전자가 1위에서 물러난 것은 6월 25일과 7월10일 단 두번이 전부다. 해당 시기는 언택트 대표 종목인 네이버와 카카오가 30만원선을 넘보고, 6월 이후 2200선까지 터치했던 코스피 상승세가 한풀 꺾이던 구간이다.한때나마 삼성전자를 밀어낸 자리는 레버리지 ETF와 네이버, 카카오가 차지했다. 삼성전자는 6월 25일 개인 순매수 1·2위를 KODEX레버리지와 카카오에 내주며 3순위까지 밀려났다. 뒤이은 7월 10일엔 1위를 카카오에 내주고, 2위를 기록했다.톱픽을 탈환한 삼성전자와 달리, 최근 개인 순매수 상위 종목에서 밀려나게 된 단골 종목도 있다. 레버리지 ETF다.개인들이 1조원 순매수에 나섰던 지난 9일, 레버리지 ETF 종목은 개인 순매수 상위 10위 내에 이름을 올리지 못했다. 개미들의 1조원 쇼핑날 레버리지ETF 종목이 순매수 10위권 밖으로 밀려난 건 올들어 처음이다.불과 8월 20일까지도 삼성전자 다음인 두번째로 KODEX 레버리지를 많이 매수했지만, 이달엔 순위가 11위로 떨어졌다. 개미 투자자들이 증시 상승랠리 기대감을 반영한 레버리지 매수를 줄이고 대신 사들인 종목들은 엔씨소프트, 넷마블 등 게임주와 유한양행, 녹십자, 셀트리온 등 제약주, 한화솔루션 등이다.발빠른 개미들의 변화는 최근 전문가들이 제시하고 있는 투자 방향과 일치한다. 업계는 국내외 증시가 숨고르기에 나섰다는 판단하에, 언택트보다 콘택트 업종에 주목하라고 조언한다.김유겸 케이프증권 리서치센터장은 “국내외 시장 주도주 추이에 주목해보면, 주가가 오르는 모습들이 조금씩 달라고 있다”며 “계속해서 기대감을 반영해 온 업종 등을 추격매수하는 것은 지양할 때”라고 분석했다. “긴 호흡에서 콘택트 주식에 관심을 가질 타이밍이 언제일지 견줘봐야 할 시기”라는 것이다. 김유진 기자▶엄마들이 꼽은 NO.1 화상영어..무료체험▶헤럴드경제 네이버 채널 구독 ▶농수축산물 소비캠페인 - Copyrights ⓒ 헤럴드경제 & heraldbiz.com, 무단 전재 및 재배포 금지 -헤럴드경제 관련뉴스해당 언론사에서 선정하며 언론사 페이지(아웃링크)로 이동해 볼 수 있습니다.[단독] 경찰, 디지털교도소 운영자 인터폴 수배 요청윤영찬 \'카카오 들어왓\' 후폭풍…이낙연 ""엄중 주의""이언주 ""曺 아빠 \'딸 사랑\'에 秋 엄마 \'아들 사랑\', 국민은 머슴이냐""음주운전 탓…햄버거 매장 드라이브스루 들이받은 40대테슬라 연일 급락…1.8조 폭풍매수 개미들 어쩌나좋아요0훈훈해요0슬퍼요0화나요0후속기사 원해요0기사제공 :']"
15,NC soft, 2020-09-0911:07,아시아경제 ,숨고르기 들어간 BBIG,https://finance.naver.com/news/news_read.nhn?article_id=0004752040&office_id=277&mode=search&query=엔씨&page=1,"['       숨고르기 들어간 BBIG      기사입력2020-09-09 11:07기사원문좋아요훈훈해요좋아요 평가하기공감좋아요0훈훈해요0슬퍼요0화나요0후속기사 원해요0댓글[아시아경제 고형광 기자] 신종 코로나바이러스감염증(코로나19) 확산 이후 국내 증시를 이끌던 이른바 \'BBIG(바이오ㆍ배터리ㆍ인터넷ㆍ게임)\'가 이달 들어 숨고르기에 들어간 모습이다. 전문가들은 중장기 추가 상승 가능성은 충분하다면서도 단기 밸류에이션(실적 대비 주가 수준) 부담에는 우려를 나타내고 있다.9일 한국거래소에 따르면 이날 오전 9시30분 기준 코스피는 전 거래일 대비 1.04% 내린 2376.97을 기록했다. 이날 오전 1% 넘는 하락을 보였지만 지난달 말 코스피(2326.17)와 비교하면 2.2%(50.8) 오른 수치다.코스피가 이달 들어 2% 넘게 오른 것과 달리 국내 증시의 주도주 역할을 했던 이른바 \'BBIG7\' 종목(네이버, 삼성바이오로직스, LG화학, 셀트리온, 카카오, 삼성SDI, 엔씨소프트)은 하락 반전하며 단기 조정에 들어간 모습이다. 네이버는 지난달 말 32만2500원에서 이날 오전 30만3000원으로 6.0% 떨어졌고, 카카오 또한 40만7000원에서 38만4500원으로 5.5% 밀렸다. LG화학(-5.3%), 삼성SDI(-5.0%), 엔씨소프트(-3.3%), 삼성바이오로직스(-2.2%) 등도 2~5%대 조정을 받았다. BBIG7 가운데 이달 들어 오른 종목은 셀트리온(5.2%)이 유일했다.BBIG의 최근 조정에 대해 전문가들은 실적과 주가 간 괴리가 커지면서 밸류에이션이 높아진 때문으로 분석했다. 이경민 대신증권 연구원은 ""단기적으로는 과열, 밸류에이션 부담이 커진 상황에서 불안심리를 자극할 변수들이 많아지고 있다는 것을 경계할 필요가 있다""며 ""이번 실적시즌에서 예상보다 부진한 결과가 나올 경우 투자자들의 실망감, 경기회복 속도에 대한 불안감으로 변동성이 커질 수 있다""고 말했다.미국에서 기술주가 조정받은 것도 영향을 미쳤다. 조연주 NH투자증권 연구원은 ""나스닥의 이번 급락은 기술주 쏠림 현상이 계속될 수 없다는 것을 보여주는 것""이라며 ""최근 기술주의 밸류에이션은 과도했기 때문에 일부 조정이 나타난 것인 만큼 향후 비중을 줄이고 저평가된 경기 방어 가치주 비중을 늘리는 등 포트폴리오를 다변화할 필요가 있다""고 전했다.이 같은 이유로 그동안 BBIG 종목을 위주로 투자에 나섰던 외국인투자가들도 이달 들어 BBIG 7개 종목 모두에 대해 매도세로 전환했다. LG화학에 대해선 최근 일주일 새 1929억원어치나 팔아치웠고, 셀크리온과 카카오 주식도 각각 811억원, 598억원 순매도했다. 삼성SDI(561억원), 네이버(544억원), 엔씨소프트(505억원), 삼성바이오로직스(432억원) 등도 수백억원씩 내다팔았다.BBIG7이 잠시 조정을 거친 뒤 상승세가 당분간 더 이어질 것이란 전망도 적지 않다. 최근 한국과 미국의 고용률 등 경제지표가 기대에 못 미치는 수준으로 나오면서 이들 종목의 밸류에이션 부담이 부각됐을 뿐 대세 상승 분위기가 달라진 것은 아니라는 것이다. 안소은 IBK투자증권 연구원은 ""코로나19 재확산 등 전반적인 경제 여건이 우호적이지는 않다""면서도 ""통화와 재정 측면에서 확장 정책이 이어지고 있고, BBIG7의 중장기 성장성도 유효하다""고 내다봤다. 신승진 삼성증권 연구원은 ""BBIG는 여전히 매력적인 산업이고 주도주라는 게 그렇게 쉽게 꺾이지 않는다""며 ""주도주들의 상승 랠리는 실적 성장이 둔화되기 전까지는 계속될 확률이 높다""고 예상했다.BBIG 등 최근 상승장을 주도한 분야에 추가로 투자하기 보다 그동안 덜 오른 분야에 관심을 두고 분산 투자해야 한다는 의견도 있다. 유망 분야로는 자동차, 화학 등 중후장대 업종을 꼽았다. 이 분야는 주가 회복이 제대로 안 됐지만 실적 전망은 좋은 종목이 많다는 이유에서다. 이재만 하나금융투자 연구원은 ""중국의 수출보다 수입증가율이 높다는 점, 생산자와 소비자 물가 스프레드가 반전했다는 점, 국내 기업 이익추정치 하향 조정이 마무리되고 있다는 점을 감안할 때 언택(비대면 관련주)에서 컨택(경기민감주, 가치주)으로 이전되는 초기 상황으로 해석할 수 있다""며 ""외국인 순매수 전환 초기 국면에서 관심이 높았던 자동차, 화학, 조선, 건설 등 중후장대업종에 관심을 가질 필요가 있다""고 설명했다.고형광 기자 kohk0101@asiae.co.kr▶ 2020년 하반기, 재물운·연애운·건강운 체크!▶ 네이버에서 아시아경제 뉴스를 받아보세요▶ 요즘 트렌드 모아보고 싶을 땐 \'드링킷\'<ⓒ경제를 보는 눈, 세계를 보는 창 아시아경제 무단전재 배포금지>아시아경제 관련뉴스해당 언론사에서 선정하며 언론사 페이지(아웃링크)로 이동해 볼 수 있습니다.""걸어 다니던 내 딸 계획살해 당해"" 아버지 울분중복 수령 논란…2차 재난지원금 미취업청년에 \'50만원\'은퇴 후 돈 걱정없다…\'金퇴족\'으로 사는 법만점 통장 또 나왔다…치솟는 청약 당첨 가점""진단서 없는데""…秋 \'엄마찬스\'에 난감해진 군좋아요0훈훈해요0슬퍼요0화나요0후속기사 원해요0기사제공 :']"
16,NC soft, 2020-09-0910:40,서울경제 ,금융위기·코로나도 막을 수 없었던 ‘13개 기업’...20년 연속 흑자,https://finance.naver.com/news/news_read.nhn?article_id=0003795246&office_id=011&mode=search&query=엔씨&page=1,"['       금융위기·코로나도 막을 수 없었던 ‘13개 기업’...20년 연속 흑자      기사입력2020-09-09 10:40기사원문좋아요훈훈해요좋아요 평가하기공감좋아요0훈훈해요0슬퍼요0화나요0후속기사 원해요0댓글CEO스코어 조사 결과KT&G·SK텔레콤 등82분기 동안 영업이익삼성전자는 46분기 흑자2000년 이후 분기 연속 영업이익 흑자를 달성한 500대 기업./사진제공=CEO스코어[서울경제] ‘KT&G(033780), SK텔레콤(017670), 현대모비스(012330)...’ 이들의 공통점은 분기보고서 제출이 의무화된 2000년부터 지금까지 금융위기와 코로나19에도 아랑곳하지 않고 82분기 연속 흑자를 내왔다는 것이다.  9일 기업평가사이트 CEO스코어가 국내 500대 기업중 2000년 이후 금융감독원 전자공시시스템에 분기보고서를 제출한 345개 사의 영업이익(개별 기준) 추이를 조사한 결과 82분기 연속 흑자 행진을 이어온 기업은 총 13곳이었다. KT&G, SK텔레콤, 현대모비스, 유한양행을 비롯해 GS홈쇼핑, CJ ENM, 신세계, 고려아연, 에스원, 농심, 한섬(020000), 국도화학, 이지홀딩스 등이 82분기 연속 흑자 기업 명단에 이름을 올렸다.삼성화재는 2000년 2분기부터 분기보고서를 제출해 81분기 연속 흑자를 기록했다. 이 가운데 평균 영업이익률이 가장 높은 회사는 KT&G로, 35.5%에 달했다.이어 SK텔레콤(19.3%), 한섬(15.5%), 고려아연(13.3%), 이지홀딩스(12.8%), 에스원(12.6%), CJ ENM(11.8%), GS홈쇼핑(11.2%), 현대모비스(10.8%), 유한양행·신세계(각 10.0%) 등의 영업이익률이 10%를 넘었다. 또 70분기 이상 장기 흑자 기업은 금호석유화학과 광동제약, LG생활건강, 한샘, 엔씨소프트, 네이버, 카카오, 현대건설 등 17개 사로 조사됐다. 조사 대상 가운데 50분기 이상 연속 흑자를 낸 기업은 총 49개였고, 최대 기업인 삼성전자(005930)는 2008년 4분기에 적자를 냄에 따라 연속 흑자 기록이 46분기로 집계됐다. 지난해 2분기까지 78분기 연속 흑자였던 19개 기업 가운데 포스코와 현대제철, 솔브레인홀딩스, 호텔신라, 넥센타이어 등 6곳은 작년 3분기부터 올해 2분기중에 일부 분기 적자를 기록하면서 연속 흑자 기업 명단에서 빠졌다. 분기 연속 흑자 기록이 10분기 미만인 기업도 조사 대상 기업의 절반에 가까운(49.3%) 170곳에 달했다. 지난해 2분기 말 기준 155곳에서 15곳 증가했다./변수연기자 diver@sedaily.com[서울경제 바로가기]▶ 산업이슈 알기쉽게 [양철민의 인더스트리]▶ 네이버 채널에서 \'서울경제\' 구독해주세요!저작권자 ⓒ 서울경제, 무단 전재 및 재배포 금지서울경제 관련뉴스해당 언론사에서 선정하며 언론사 페이지(아웃링크)로 이동해 볼 수 있습니다.\'추미애 아들\' 논란에 전여옥 ""文, 추미애에겐 빚 없어···손절 고민중""서동주, \'파란 비키니\'로 섹시 폭발···누구나 부러워할 S라인 몸매""김치찌개 빨리 달란 게 청탁?"" 정청래 직격한 진중권 ""잘못하고 인정 안해""이하늬, 탱크탑·트레이닝 팬츠로 \'완벽한 S라인\' 눈을 뗄 수 없어[단독] \'가족돌봄휴가\' 유급지원 기존 10일→15일로 상향추진좋아요0훈훈해요0슬퍼요0화나요0후속기사 원해요0기사제공 :']"
