,회사명,날짜,언론사,기사제목,링크,본문
0,NC soft, 2020-09-0917:39,한국일보 ,"'금융위기도, 코로나도 이겨낸'... 20년 연속 흑자 낸 기업은?",https://finance.naver.com/news/news_read.nhn?article_id=0000533985&office_id=469&mode=search&query=엔씨&page=1,"['       \'금융위기도, 코로나도 이겨낸\'... 20년 연속 흑자 낸 기업은?      기사입력2020-09-09 17:39기사원문좋아요훈훈해요좋아요 평가하기공감좋아요0훈훈해요0슬퍼요0화나요0후속기사 원해요0댓글CEO스코어, 2000년부터 올 2분기 영업이익\xa0 조사KT&G 등 13개 기업이 2000년부터 올 2분기까지 82분기 연속 흑자를 낸 것으로 나타났다. 사진은 부산 서면에 개관하는 KT&G의 \'상상마당 부산\' 건물 전경. KT&G 제공국내 500대 기업 중 13곳이 분기보고서 제출이 의무화된 2000년 이후 올해 2분기까지 82분기 연속 흑자를 지켜낸 것으로 집계됐다. 과거 세계 금융위기부터 최근 신종 코로나바이러스 감염증(코로나19) 확산까지 영업 활동이 위축되는 악조건 속에도 20년 연속 흑자를 이어간 것이다.  9일 기업평가사이트 CEO스코어가 국내 500대 기업중 2000년 이후 금융감독원 전자공시시스템에 분기보고서를 제출한 345개 사의 영업이익(개별 기준) 추이를 조사한 결과에 따르면  82분기 연속 흑자 행진을 한 기업은 KT&G, SK텔레콤, 현대모비스, GS홈쇼핑, CJ ENM, 신세계, 고려아연, 에스원, 유한양행, 농심, 한섬, 국도화학, 이지홀딩스까지 13개였다. 이 밖에 2000년 2분기부터 분기보고서를 제출한 삼성화재가 81분기 연속 흑자였다.이 가운데 평균 영업이익률이 가장 높은 회사는 KT&G로 35.5%에 달했다.이어 SK텔레콤(19.3%), 한섬(15.5%), 고려아연(13.3%), 이지홀딩스(12.8%), 에스원(12.6%), CJ ENM(11.8%), GS홈쇼핑(11.2%), 현대모비스(10.8%), 유한양행ㆍ신세계(각 10.0%) 등의 영업이익률이 10%를 넘었다.또 70분기 이상 장기 흑자 기업은 금호석유화학과 광동제약, LG생활건강, 한샘, 엔씨소프트, 네이버, 카카오, 현대건설 등 17개 사로 조사됐다.조사 대상 가운데 50분기 이상 연속 흑자를 낸 기업은 49개였다. 국내 최대 기업인 삼성전자는 2008년 4분기에 적자를 내면서 연속 흑자 기록이 46분기로 나타났다. 지난 해 2분기까지 78분기 연속 흑자였던 19개 기업 가운데 포스코와 현대제철, 솔브레인홀딩스, 호텔신라, 넥센타이어 등은 작년 3분기부터 올해 2분기까지 분기 적자를 기록하면서 연속 흑자 기업 명단에서 빠졌다.분기 연속 흑자 기록이 10분기 미만인 기업도 조사 대상 기업의 절반에 가까운(49.3%) 170곳에 달했다. 지난 해 2분기 말 기준 155곳에서 15곳 증가했다.윤태석 기자 sportic@hankookilbo.com▶ 네이버 채널에서 한국일보를 구독하세요!▶ [정치채널X] [뉴스보야쥬] [넷따잡] [뷰잉] 영상보기▶ 한국일보닷컴 바로가기한국일보 관련뉴스해당 언론사에서 선정하며 언론사 페이지(아웃링크)로 이동해 볼 수 있습니다.추미애 아들 의혹 제보자, \'비상연락망에 없는 장교에게 휴가 신청?\'\'어른들이 먼저 오지 말라 해주세요\' 귀성 고민하는 젊은 부부들\'내부고발 보호하자\'더니 제보자 입 막는 추미애\'여행에 미치다\' 대표, 극단선택 시도 8일 만에 사망\'카카오 들어오라\' 윤영찬, 하루만에 ""잘못했다\'좋아요0훈훈해요0슬퍼요0화나요0후속기사 원해요0기사제공 :']"
1,NC soft, 2020-09-0917:35,뉴시스 ,"리니지2M, 첫번째 '월드 공성전' 13일 저녁 8시 시작",https://finance.naver.com/news/news_read.nhn?article_id=0010067210&office_id=003&mode=search&query=엔씨&page=1,"['       리니지2M, 첫번째 \'월드 공성전\' 13일 저녁 8시 시작      기사입력2020-09-09 17:35기사원문좋아요훈훈해요좋아요 평가하기공감좋아요0훈훈해요0슬퍼요0화나요0후속기사 원해요0댓글각 월드의 10개 서버 이용자들이 \'아덴성\'에서 대결첫 승리하는 혈맹의 군주에게 \'승리의 신탁 상자\' 선물[서울=뉴시스] 오동현 기자 = 엔씨소프트가 9일 모바일 MMORPG(다중접속역할수행게임) ‘리니지2M’의 ‘크로니클III 풍요의 시대 에피소드4’ 업데이트를 통해 ‘월드 공성전’을 공개했다.월드 공성전은 각 월드의 10개 서버 이용자들이 한 공간에 모여 성을 차지하기 위해 대결하는 대형 콘텐츠다. 첫 번째 월드 공성전은 이달 13일 저녁 8시부터 진행되고, 이후 격주 일요일 같은 시간에 열린다. 월드 공성전이 열리는 날에는 ‘디온’, ‘기란’ 공성전이 진행되지 않는다. 월드 공성전이 펼쳐질 전장은 ‘아덴성’이다. 좌측과 우측, 중앙 세 방향으로 진입할 수 있는 외성문 5개과 내성 게이트 4개 등 거대한 전장이 마련돼 있다. 전장이 넓기 때문에 혈맹 및 연맹원들과의 협력, 다양한 전술, 전략이 요구된다.진행 방식은 앞서 선보인 ‘디온’, ‘기란’ 공성전과 동일하다. 월드 공성전 시작 한 시간 전인 저녁 7시부터 참가 의사를 밝히는 ‘공성 선포’가 가능하다. 이미 \'디온성\' 또는 \'기란성\'을 보유하고 있는 혈맹도 월드 공성전에 참여할 수 있다. 월드 공성전이 시작되면 외성문과 수호석을 차례로 파괴하고, 내성 게이트를 통해 성안으로 진입한 뒤 왕좌를 각인해야 한다. 왕좌 각인 후 20분간 수성에 성공하거나,  종료 시점에 왕좌를 차지하고 있는 혈맹이 승리한다.엔씨는 첫번째 월드 공성전에서 승리하는 혈맹의 군주에게 ‘승리의 신탁 상자’ 아이템을 선물한다. ‘승리의 신탁 상자’ 사용 시, 주변 50명의 혈맹원에게 ‘영광의 상징 신탁서’가 5개씩 지급된다. ‘영광의 상징 신탁서’를 통해 ‘경험치’, ‘아인하사드의 은총’, ‘신탁의 증표’, ‘명예의 훈장’ 등을 획득할 수 있다.첫 월드 공성전에 참여하는 모든 혈맹원들은 ‘영광의 증표 III’ 아이템을 받는다. 이 아이템은 ‘아덴성의 영원한 영광’ 이벤트 컬렉션에 등록해 전투에 필요한 능력치를 높일 수 있다.이 밖에도 ▲이벤트 던전 ‘운디네의 사원’에 참여해 이벤트 컬렉션 재료 등 다양한 아이템을 획득할 수 있는 ‘운디네의 사원 수색령’ ▲필드 사냥으로 ‘단단한 암석 조각’을 모은 뒤, 각종 아이템 교환 및 강화를 통해 보상 아이템을 제작할 수 있는 ‘성벽 보강 작전’ ▲매일 낮 12시에 유용한 아이템을 지급하는 ‘사원 탐험대’ 등의 이벤트가 앞으로 2주간 동시에 진행된다.☞공감언론 뉴시스 odong85@newsis.com▶ 네이버에서 뉴시스 구독하기▶ K-Artprice, 유명 미술작품 가격 공개▶ 뉴시스 빅데이터 MSI 주가시세표 바로가기<ⓒ 공감언론 뉴시스통신사. 무단전재-재배포 금지>뉴시스 관련뉴스해당 언론사에서 선정하며 언론사 페이지(아웃링크)로 이동해 볼 수 있습니다.할머니 목에 ""도둑X"" 팻말 걸어 길바닥 세워놔술 취한 여성 끌고가던 男, 지인 맞닥뜨리자 태연히동명이인 얼굴 내놓고 밀양 여중생 성폭행 김OO 딱지모텔 침대 밑에 녹음기…대실 손님 은밀 대화 노려채리나 ""시험관 시술 또 실패…임신 관련 수술 많이 했다""좋아요0훈훈해요0슬퍼요0화나요0후속기사 원해요0기사제공 :']"
2,NC soft, 2020-09-0916:45,더팩트 ,"[TF매매동향] 외국인 '삼성전자' 담고, '신한지주' 팔았다",https://finance.naver.com/news/news_read.nhn?article_id=0000041506&office_id=629&mode=search&query=엔씨&page=1,"['       [TF매매동향] 외국인 \'삼성전자\' 담고, \'신한지주\' 팔았다      기사입력2020-09-09 16:45기사원문좋아요훈훈해요좋아요 평가하기공감좋아요0훈훈해요0슬퍼요0화나요0후속기사 원해요0댓글9일 외국인투자자의 코스피시장 최대매수는 삼성전자로 향했다. 외인은 삼성전자 1349억 원을 순매수했다. /더팩트 DB삼성전자 1349억 원 매수·신한지주 656억 원 매도[더팩트ㅣ정소양 기자] 9일 국내증시는 일제히 하락 마감했다. 코스피와 코스닥 모두 외국인과 기관 매도에 약세 마감했다.코스피 시장에서는 외국인과 기관이 각각 1175억 원, 4307억 원을 팔아치웠으며, 코스닥 시장에서는 326억 원, 1023억 원을 순매도 했다.이날 외국인투자자의 코스피시장 최대매수는 삼성전자로 향했다. 외인은 삼성전자 1349억 원, LG전자 445억 원, SK하이닉스 369억 원, SK케미칼 210억 원, LG이노텍 158억 원을 사들였다.반면 신한지주는 656억 원을 팔았다. 이어 셀트리온 447억 원, 엔씨소프트 286억 원, 삼성전자우선주 266억 원 LG화학 197억 원 순으로 순매도했다.코스닥시장에서는 케이엠더블유(175억 원), 제넥신(79억 원), 바이넥스(61억 원), 알서포트(43억 원)를 사고 셀트리온헬스케어(134억 원), 셀트리온제약(110억 원), 피엔케이(91억 원), JYP엔터(56억 원)는 팔았다.이날 기관투자자는 이날 삼성 SDS를 583억 원을 사들여 가장 많이 매수했으며 이어 LG전자 531억 원, 삼성전자 206억 원, 롯데케미칼 130억 원, 삼성전기 123억 원 순으로 사들였다./한국거래소 제공기관투자자는 이날 삼성 SDS를 583억 원을 사들여 가장 많이 매수했다. 이어 LG전자 531억 원, 삼성전자 206억 원, 롯데케미칼 130억 원, 삼성전기 123억 원 순으로 매수했다.반면 SK하이닉스는 592억 원을 팔아치웠다. 또한 셀트리온 560억 원, 카카오 507억 원, 현대차 336억 원, SK케미칼 287억 원을 순매도했다.한편, 이날 시가총액 상위종목은 모두 하락했다. 삼성전자(-0.51%), SK하이닉스(-2.64%), 삼성바이오로직스(-1.94%), 네이버(-2.09%), LG화학(-1.41%), 삼성전자우(-1.00%), 셀트리온(-6.13%), 현대차(-0.30%), 카카오(-1.54%), 삼성SDI(-1.38%) 등은 모두 하락세로 마감했다.jsy@tf.co.kr- TMA 티켓 얻는 방법? [팬버십 가입하기▶]  - 내 아이돌 응원하기 [팬앤스타▶]  저작권자 ⓒ 특종에 강한 더팩트 & tf.co.kr 무단 전재 및 재배포 금지더팩트 관련뉴스해당 언론사에서 선정하며 언론사 페이지(아웃링크)로 이동해 볼 수 있습니다.[TF확대경] 추미애에 발목 잡힌 \'검찰개혁\'…민주당, 밀어붙이나[TF초점] 추미애 아들 논란, 文 국정동력 발목 잡을까[TF현장] 동양대 원어민 교수 ""조국 딸 봉사활동 확실히 기억""\'군 복무 D-1\' 김호중, 마지막까지 팬들 위해 \'열일\'[오늘의 날씨] 태풍 갔지만…흐리고 천둥·번개 강한 비좋아요0훈훈해요0슬퍼요0화나요0후속기사 원해요0기사제공 :']"
3,NC soft, 2020-09-0916:40,매일경제 ,"넷마블, 잇단 호재에 신작 출시까지 ‘눈길’",https://finance.naver.com/news/news_read.nhn?article_id=0004652494&office_id=009&mode=search&query=엔씨&page=1,"['       넷마블, 잇단 호재에 신작 출시까지 ‘눈길’      기사입력2020-09-09 16:40기사원문좋아요훈훈해요좋아요 평가하기공감좋아요0훈훈해요0슬퍼요0화나요0후속기사 원해요0댓글 넷마블이 카카오게임즈와 빅히트엔터테인먼트의 상장이라는 호재에 더해 신작 출시 준비에도 박차를 가하며 성장 기대감을 이어가고 있다. ‘세븐나이츠2’, ‘BTS유니버스 스토리’ 등 하반기 시작 출시에 속도를 내는 모습이다.넷마블은 전일 하반기 기대작 ‘세븐나이츠2’의 티저 사이트를 공개하고 4분기 출시를 예고했다. ‘세븐나이츠2’는 넷마블의 대표 인기 모바일 RPG ‘세븐나이츠’를 계승하는 대작이다. 전작은 2014년 출시돼 한국은 물론 일본과 태국, 인도네시아 등에서 인기를 끌며 1000만명 이상이 즐겼다. ‘세븐나이츠2’는 언리얼엔진을 활용한 고품질 그래픽과 전작의 20년 뒤의 세계관을 바탕으로 색다를 재미를 줄 전망이다. 특히 전작의 수집 요소를 계승하면서 장르를 MMORPG로 변경해 차별화했다. 지난 2017년과 2018년 지스타를 통해 선보였던 버전에서 대대적인 변화를 준 것도 특징이다.넷마블은 지난달에는 방탄소년단(BTS)을 활용한 신작 ‘BTS유니버스 스토리’의 공식 사이트를 개설하고 글로벌 사전등록도 시작했다. ‘몬스터길들이기’, ‘마블퓨처파이트’ 등의 히트작을 제작한 넷마블몬스터가 개발했다. 최근 방탄소년단의 신곡이 2주 연속 빌보드 싱글차트 핫100 1위를 유지하면서 기대감이 커지는 상황이다. 넷마블은 이 게임의 출시 시기를 3분기로 제시한바 있다.최근에는 내년 출시 예정인 신작 ‘제2의나라’의 브랜드 사이트도 선보였다. ‘제2의나라’는 일본의 유명 게임 제작사 레벨5와 애니메이션 기업 스튜디오지브리가 협업해 제작한 ‘니노쿠니’를 모바일로 계승한 MMORPG다. 지난해 지스타를 통해 원작 특유의 그래픽 감성을 살린 모습을 선보여 호응을 얻은바 있다. 넷마블은 이 게임의 서포터즈로 활동한 팬들도 이달 중 모집한다.넷마블은 이외에도 닌텐도 스위치 플랫폼 게임 ‘세븐나이츠: 타임원더러’와 북미 자회사 카밤의 신작 ‘마블 렐름오브챔피언스’도 연내 출시를 계획 중이다. ‘제2의 나라’ 외에 ‘세븐나이츠 레볼루션’도 내년 상반기 출시를 예정했다.넷마블은 최근 카카오게임즈와 빅히트엔터테인먼트 상장 소식에 주가가 우상향했다. 특히 카카오게임즈의 일반투자자 대상 공모주 청약이 진행된 이달 1일과 2일을 거치면서 주가가 크게 상승했다. 1일부터 4일까지 나흘간 18.61% 올랐다. 최근 사흘간은 약세를 보였으나 10일 카카오게임즈 코스닥 상장, 오는 24일과 25일 빅히트엔터테인먼트 수요예측, 10월 5일과 6일 공모주 청약 등 이벤트가 잇따른다. 넷마블은 카카오게임즈(321만8320주, 상장 후 4.39%)와 빅히트엔터테인먼트(713만4112주, 25.04%) 외에도 코웨이(25.51%)와 엔씨소프트(8.88%). 카카오뱅크(3.94%)의 지분도 보유했다. 이중 카카오뱅크도 상장을 준비 중이다.이날 ktb투자증권은 넷마블에 대해 가장 적극적으로 신작을 출시하는 회사라고 평가하며 목표주가를 20만원에서 22만5000원으로 상향하기도 했다. 올해 실적은 매출 2조6930억원, 영업이익 2990억원을 예상했다.[임영택기자 ytlim@mkinternet.com]▶ 팬데믹위기 해법 찾는다! - 제21회 세계지식포럼▶ 궁금한 제조과정 영상으로 보세요. \'이렇게 만들죠\'▶ 데일리 뉴스 브리핑 \'매경이 전하는 세상의 지식[ⓒ 매일경제 & mk.co.kr, 무단전재 및 재배포 금지]매일경제 관련뉴스해당 언론사에서 선정하며 언론사 페이지(아웃링크)로 이동해 볼 수 있습니다.\'4억원 도박인정\' 양현석, 판사가 현재 직업 묻자[속보] \'게시물 논란\' 여행에미치다 조준기 대표 결국 사망오또맘 깊게 파인 수영복…명품 몸매 과시이지연 美음식점, 조지아주 최고 바비큐 식당 선정양소영 변호사 ""남편, 고생 많았다는 말 끝내 안해줘""좋아요0훈훈해요0슬퍼요0화나요0후속기사 원해요0기사제공 :']"
4,NC soft, 2020-09-0916:39,매일경제 ,"‘리니지2M’, 가장 거대한 전쟁 ‘월드 공성전’ 13일 첫 개최",https://finance.naver.com/news/news_read.nhn?article_id=0004652488&office_id=009&mode=search&query=엔씨&page=1,"['       ‘리니지2M’, 가장 거대한 전쟁 ‘월드 공성전’ 13일 첫 개최      기사입력2020-09-09 16:39기사원문좋아요훈훈해요좋아요 평가하기공감좋아요0훈훈해요0슬퍼요0화나요0후속기사 원해요0댓글 엔씨소프트(대표 김택진)는 9일 모바일 MMORPG ‘리니지2M’에 ‘크로니클III 풍요의 시대 에피소드4’ 업데이트를 적용하고 ‘월드 공성전’을 추가했다.월드 공성전은 각 월드의 10개 서버 이용자들이 한 공간에 모여 성을 차지하기 위해 대결하는 대규모 전쟁 콘텐츠다. 첫 번째 월드 공성전은 이달 13일 오후 8시부터 시작된다. 이후 격주 일요일 같은 시간에 열린다. 월드 공성전이 열리는 날에는 ‘디온’, ‘기란’ 공성전이 진행되지 않는다.월드 공성전이 펼쳐질 전장은 ‘아덴성’이다. 좌측과 우측, 중앙 세 방향으로 진입할 수 있는 외성문 5개과 내성 게이트 4개 등 대형 콘텐츠에 걸맞은 거대한 전장이 마련됐다. 전장이 넓기 때문에 혈맹 및 연맹원들과의 협력, 다양한 전술, 전략이 요구된다.진행 방식은 앞서 선보인 ‘디온’, ‘기란’ 공성전과 동일하다. 월드 공성전 시작 한 시간 전인 오후 7시부터 참가 의사를 밝히는 ‘공성 선포’가 가능하다. 이미 ‘디온성’ 또는 ‘기란성’을 보유하고 있는 혈맹도 월드 공성전에 참여할 수 있다. 월드 공성전이 시작되면 외성문과 수호석을 차례로 파괴하고 내성 게이트를 통해 성안으로 진입한 뒤 왕좌를 각인해야 한다. 왕좌 각인 후 20분간 수성에 성공하거나 종료 시점에 왕좌를 차지하고 있는 혈맹이 승리한다.엔씨소프트는 첫번째 월드 공성전에서 승리하는 혈맹의 군주에게 ‘승리의 신탁 상자’ 아이템을 선물한다. ‘승리의 신탁 상자’ 사용 시 주변 50명의 혈맹원에게 ‘영광의 상징 신탁서’가 5개씩 지급된다. ‘영광의 상징 신탁서’를 통해 ‘경험치’, ‘아인하사드의 은총’, ‘신탁의 증표’, ‘명예의 훈장’ 등을 획득할 수 있다.첫 월드 공성전에 참여하는 모든 혈맹원들에게는 ‘영광의 증표 III’ 아이템도 주어진다. ‘영광의 증표 III’ 아이템은 ‘아덴성의 영원한 영광’ 이벤트 컬렉션에 등록해 전투에 필요한 능력치를 높일 수 있다.이외에도 이벤트 던전 ‘운디네의 사원’에 참여해 이벤트 컬렉션 재료 등의 아이템을 획득할 수 있는 ‘운디네의 사원 수색령’, 필드 사냥으로 ‘단단한 암석 조각’을 모은 뒤 각종 아이템 교환 및 강화를 통해 보상 아이템을 제작할 수 있는 ‘성벽 보강 작전’, 매일 낮 12시에 유용한 아이템을 지급하는 ‘사원 탐험대’ 등의 이벤트가 2주간 진행된다.[임영택기자 ytlim@mkinternet.com]▶ 팬데믹위기 해법 찾는다! - 제21회 세계지식포럼▶ 궁금한 제조과정 영상으로 보세요. \'이렇게 만들죠\'▶ 데일리 뉴스 브리핑 \'매경이 전하는 세상의 지식[ⓒ 매일경제 & mk.co.kr, 무단전재 및 재배포 금지]매일경제 관련뉴스해당 언론사에서 선정하며 언론사 페이지(아웃링크)로 이동해 볼 수 있습니다.\'4억원 도박인정\' 양현석, 판사가 현재 직업 묻자[속보] \'게시물 논란\' 여행에미치다 조준기 대표 결국 사망오또맘 깊게 파인 수영복…명품 몸매 과시이지연 美음식점, 조지아주 최고 바비큐 식당 선정양소영 변호사 ""남편, 고생 많았다는 말 끝내 안해줘""좋아요0훈훈해요0슬퍼요0화나요0후속기사 원해요0기사제공 :']"
5,NC soft, 2020-09-0916:26,중앙일보 ,美기술주 폭락에…韓 바이오·배터리·인터넷·게임 줄줄이 하락,https://finance.naver.com/news/news_read.nhn?article_id=0003033699&office_id=025&mode=search&query=엔씨&page=1,"['       美기술주 폭락에…韓 바이오·배터리·인터넷·게임 줄줄이 하락      기사입력2020-09-09 16:26기사원문좋아요훈훈해요좋아요 평가하기공감좋아요0훈훈해요0슬퍼요0화나요0후속기사 원해요0댓글 \'나스닥 쇼크\'로 글로벌 증시가 전반적으로 하락세인 가운데 우리 증시도 하락 마감했다.      9일 코스피는 전날보다 26.10포인트(1.09%) 내린 2375.81로 마감했다. 29.38포인트(1.22%) 내린 2372.53으로 출발했던 것보다는 지수가 약간 올라왔다.      9일 오후 서울 중구 하나은행 딜링룸. 연합뉴스       그나마 낙폭을 줄일 수 있었던 건 개인 투자자들의 매수세 덕이다. 이날 기관과 외국인은 각각 4288억원과 1183억원어치를 순매도했는데, 개인이 홀로 5137억원어치를 사들였다.        한국거래소는 이날 장 마감 후 증시 브리프를 통해 ""기술주 고평가 우려 속 해외증시가 급락하고, 백신 개발 지연 소식 등으로 아시아 증시와 통화가치가 전반적으로 약세인 가운데 기관과 외국인이 매도세를 보이며 3일 만에 코스피가 하락했다""고 했다.      8일(현지시간) 나스닥 지수는 4.11% 떨어졌고 스탠더드앤드푸어스(S&P)500지수와 다우존스산업평균지수도 각각 2.78%, 2.25% 하락했다. 대형 기술주들의 주가가 크게 빠졌다. 테슬라는 상장 이래 가장 큰 폭(21.06%)으로 추락했고, 애플(-6.7%)·마이크로소프트(-5.4%)·아마존(-4.4%)·페이스북(-4.1%)·알파벳(-3.7%)도 많이 내렸다. S&P500 종목 중에선 IT·에너지 쪽이 지수 하락을 주도했다.      국내서도 그동안 주도주 역할 했던 \'BBIG(바이오·배터리·인터넷·게임)\' 종목이 하락세를 보였다. 네이버(-2.09%)·삼성바이오로직스(-1.94%)·LG화학(-1.41%)·셀트리온(-6.13%)·카카오(-1.54%)·삼성SDI(-1.38%)·엔씨소프트(-2.74%) 모두 하락했다. 이날 외국인 투자자의 순매도 규모가 가장 컸던 종목은 네이버(967억원)다. LG화학(898억원)·카카오(239억원)·삼성SDI(175억원)·엔씨소프트(121억원)에서도 외국인 순매도가 많았다.      코스닥지수는 전날보다 8.82포인트(1%) 떨어진 869.47에 장을 마쳤다. IT주 중심으로 약세를 보였다. 외국인과 기관이 353억원과 1014억원어치를 팔았고, 개인이 1580억원어치를 샀다. 원화가치는 전날보다 2.7원 내린(환율은 오름) 달러당 1189.1원에 거래를 마쳤다.      유승민·박혜란 삼성증권 연구원은 ""최근 미국 기술주의 하락은 포트폴리오 재편의 결과물""이라고 봤다. 지난 몇 달간은 경기가 부진하고 금리가 낮다 보니 ‘성장주+경기방어주’ 결합이 유리했는데, 최근에는 백신 출시나 경기회복에 대한 기대감이 커지며 ‘성장주+경기민감주’로 구성을 바꿔보려는 움직임이 생겼다. 이 과정에서 그동안 기술주에 쏠린 과도한 관심이 빠져나오게 됐단 것이다. 두 연구원은 ""그래도 성장주라는 핵심조건은 놓기 어려워 기술주 선호는 여전히 유지되겠지만, 지나치게 기술주 위주의 포트폴리오라면 조정하는 것이 합리적""이라고 말했다.      문현경 기자 moon.hk@joongang.co.kr    ▶ 넌 뉴스를 찾아봐? 난 뉴스가 찾아와!▶ 그래서, 팩트가 뭐야? 궁금하면 \'팩플\'▶ 세상 쉬운 내 돈 관리 \'그게머니\'ⓒ중앙일보(https://joongang.co.kr), 무단 전재 및 재배포 금지중앙일보 관련뉴스해당 언론사에서 선정하며 언론사 페이지(아웃링크)로 이동해 볼 수 있습니다.\'여행에 미치다\' 대표 사망···""극단 선택 한듯""당직병 반격 ""엄마믿고 秋아들 거짓말, 국회 가겠다""생후1일 딸 우유에 살충제···CCTV속 비정한 아빠우상호 ""카투사 자체 편한 곳, 秋아들 논란 의미없다""박대출, 김영란법에 포털 포함 \'윤영찬 방지법\' 발의좋아요0훈훈해요0슬퍼요0화나요0후속기사 원해요0기사제공 :']"
