,회사명,날짜,언론사,기사제목,링크,본문
12,NC soft, 2020-08-1315:25,서울경제 ,"M&A실사, 언택트 지원하는 국내 유일 국산 가상데이터룸 솔루션 리걸테크VDR 주...",https://finance.naver.com/news/news_read.nhn?article_id=0003782742&office_id=011&mode=search&query=엔씨&page=1,"['       M&A실사, 언택트 지원하는 국내 유일 국산 가상데이터룸 솔루션 리걸테크VDR 주목      기사입력2020-08-13 15:25기사원문좋아요훈훈해요좋아요 평가하기공감좋아요0훈훈해요0슬퍼요0화나요0후속기사 원해요0댓글 [서울경제] 미국과 중국간 심화되는 무역 분쟁, 코로나19 장기화로 인한 경기침체 등의 요인으로 경영난을 호소하 는 기업이 늘어나고 있는 가운데 M&A 시장은 여느 때보다 활발한 분위기가 이어지고 있다. 경영 안정을 위해 사업 분야를 좁히고, 계열사를 매각하는 기업이 많아지자 인수합병을 통해 신사업을 개척하려 는 기업이 증가하고 있다.최근 코로나19 여파로 비대면 서비스 수요가 급증하면서 M&A 시장에서는 ‘언택트’가 주목받고 있다. 한국거래소에 따르면 올 상반기 국내 증시에서 시가총액이 가장 많이 증가한 기업은 삼성바이오로직스, 셀트리온, LG화학, 삼성SDI, 엔씨소프트, 네이버, 카카오 등이다. 바이오, 배터리, 인터넷, 게임 등 모두 언택트 서비스와 직간접적인 연관이 있다는 공통점이 있다. 포스트 코로나 시대 새 먹거리 발굴을 노리 는 기업도 언택트 관련 기업 매각 소식에 주목하고 있는 것이다.국내뿐만 아니라 해외에서도 코로나19 사태 속에서 M&A가 활발히 이뤄지고 있다. 애플은 가상현실 생 중계 서비스 기업 넥스트VR을 인수했고, 마이크로소프트는 통신 소프트웨어 기업 메타스위치네트워크를 인수했다. 바이오 제약업계도 인수합병 소식이 이어지고 있는데 미국 제약사 애브비는 보톡스 제조사로 유명한 엘러간을 인수했는데, 두 회사의 연간 통합 매출은 약 500억 달러, 한국 돈으로 61조원 수준으 로 알려지며 업계 주목을 받은 바 있다.4차산업혁명으로 산업분야의 경계가 허물어지면서 신사업 개척을 위한 M&A 소식은 앞으로도 계속될 것으로 보인다. 이러한 가운데 M&A 업계에서는 업무 효율성 향상을 목적으로 한 가상데이터룸 솔루션 도입이 확산되고 있다.가상데이터룸은 기업 M&A, IPO 과정에 활발히 사용되고 있는 서비스다. 인수합병을 위해 이뤄지는 기 업간 기밀문서 공유 과정에서 가상데이터룸은 강도 높은 보안환경으로 안전한 문서 공유가 이뤄질 수 있도록 지원해 기술유출 사고를 예방하는 역할을 한다.코로나19 확산 이후로 비대면 업무 비중이 증가하면서 바이오, 제약, 금융권 등 여러 산업분야에서도 가상데이터룸 도입이 확산되고 있는데, 국내는 리걸테크VDR이 유일하게 국산 가상데이터룸 솔루션을 제공한다.리걸테크(주) 유명진 영업부장은 “세계적으로 가상데이터룸 수요가 증가하고 있는 상황에서 국내에서도 이러한 분위기가 계속 이어질 것으로 보인다”며 “국산 유일 가상솔루션 리걸테크VDR은 외산 서비스보다 합리적인 비용으로 보다 빠른 업로드, 다운로드 속도를 제공하고 신속한 기술지원이 가능해 유지보 수차원에서도 효과적이라는 평을 듣고 있다”고 밝혔다.리걸테크VDR은 영어, 일본어, 중국어, 독일어, 프랑스어 등 다국어를 지원해 글로벌 기업간 접근성이 높고, 화면캡쳐 방지, 워터마크, 2차 인증, IP접속 제한 등의 기능으로 강도 높은 보안환경을 제공한다. 또한 사용자 편의성을 고려한 UI 설계로 교육 없이 도입 즉시 사용이 가능하며 MS오피스, HWP 한글 파일, PDF, 도면 등 다양한 파일을 검토할 수 있어 편리하다.게임업계 M&A 및 투자유치 실사를 위해 리걸테크VDR을 사용해본 법무법인 관계자는 “스캔 이미지로 만들어진 PDF의 문자도 검색할 수 있어 편리했고 검색기능이 강력하여 원하는 자료를 쉽게 리뷰 가능 했다. 또한 파일 요청 기능과 업무에 따라 파일을 모아보거나 따로 관리할 수 있는 중요/태그기능, 타사 대비 빠른 업/다운로드 속도로 업무 효율도 높아졌다.”고 호평했다./김동호 기자 dongho@sedaily.com[서울경제 바로가기]▶ 산업이슈 알기쉽게 [양철민의 인더스트리]▶ 네이버 채널에서 \'서울경제\' 구독해주세요!저작권자 ⓒ 서울경제, 무단 전재 및 재배포 금지서울경제 관련뉴스해당 언론사에서 선정하며 언론사 페이지(아웃링크)로 이동해 볼 수 있습니다.\'목숨\' 건다던 손혜원 실형에 진중권 ""추미애 할 일 많아···사법적폐 심각""서지혜, 변함없는 여신 비주얼로 시선 강탈···""숨 막히는 우월하 미모""""클래스가 달라"" 김정숙 여사 \'몰래 봉사\'에 멜라니아도 소환한 노웅래기안84 \'복학왕\' 여혐논란 일파만파에···""연재 중단"" 靑청원 5만명 돌파""집값 진정세"" 文대통령에 안철수 ""달나라 대통령···서민 집 마련 꿈 못 꿔""좋아요0훈훈해요0슬퍼요0화나요0후속기사 원해요0기사제공 :']"
13,NC soft, 2020-08-1314:51,SBS Biz ,엔씨·펄어비스 2Q 기대 못 미쳐…모바일 매출 감소 영향,https://finance.naver.com/news/news_read.nhn?article_id=0000218263&office_id=374&mode=search&query=엔씨&page=1,"['       엔씨·펄어비스 2Q 기대 못 미쳐…모바일 매출 감소 영향      기사입력2020-08-13 14:51기사원문좋아요훈훈해요좋아요 평가하기공감좋아요0훈훈해요0슬퍼요0화나요0후속기사 원해요0댓글 엔씨소프트가 올 2분기 지난해보다 31% 늘어난 매출 5386억원, 영업이익은 61% 오른 2090억원을 기록했습니다.하지만 2400억원대 영업익을 기대했던 시장 전망에는 못 미쳤습니다.리니지 모바일 시리즈 매출이 1분기보다 줄었기 때문입니다.펄어비스도 \'검은사막 모바일\' 매출 하락세 영향으로 1년 전보다 소폭 감소한 2분기 매출 1317억원, 영업이익 506억원을 기록했습니다.오수영 기자(oh@sbs.co.kr) ▶ 언제어디서나 SBSCNBC  [온에어click]▶ 경제를 실험한다~ 머니랩 [네이버TV]저작권자 SBS미디어넷 & SBS I&M 무단전재-재배포 금지SBS Biz 관련뉴스해당 언론사에서 선정하며 언론사 페이지(아웃링크)로 이동해 볼 수 있습니다.코스피 2500선 향해 달린다…공매도 금지 두고 토론회홍남기 ""50여개 新직업 발굴…수출형 서비스업 지원""서울에 36만가구 공급…올해 고덕강일·수서역세권 나온다의사 총파업 예정대로 내일 진행…응급환자 생기면?은성수 ""주택시장 안정 때까지 대출규제 위반 점검""좋아요0훈훈해요0슬퍼요0화나요0후속기사 원해요0기사제공 :']"
14,NC soft, 2020-08-1314:43,뉴시스 ,"엔씨소프트, 성장세 '주춤'…리니지2M 매출 감소 영향(종합)",https://finance.naver.com/news/news_read.nhn?article_id=0010019949&office_id=003&mode=search&query=엔씨&page=1,"['       엔씨소프트, 성장세 \'주춤\'…리니지2M 매출 감소 영향(종합)      기사입력2020-08-13 14:43기사원문좋아요훈훈해요좋아요 평가하기공감좋아요0훈훈해요0슬퍼요0화나요0후속기사 원해요0댓글2분기 매출 5386억원, 영업익 2090억원1분기 대비 매출, 영업익 26%↓, 13%↓""리니지2M 지속적인 업데이트로 반등할 것""[서울=뉴시스] 이재은 기자 = 엔씨소프트가 2분기에도 호실적을 기록했다. 다만 주력 모바일 게임 리니지2M 매출이 감소해 1분기 대비 상승세를 이어가지는 못했다.엔씨소프트는 2020년 2분기 매출 5386억원, 영업이익 2090억원, 당기순이익 1584억원을 기록했다고 13일 공시했다.전년 동기 대비 매출과 영업이익은 31%, 61% 상승했다. 당기순이익은 36% 상승했다. PC 온라인 게임 매출은 \'리니지\' 343억원, \'리니지2\' 258억원, \'아이온\' 82억원, \'블레이드 앤 소울\' 198억원, \'길드워2\' 156억원 등의 순이었다. 지난 1분기 대비 매출, 영업이익, 당기순이익은 각각 26%, 13%, 19% 감소했다. 리니지2M 매출이 감소한 점이 결정적인 요인으로 작용했다. 리니지2M 2분기 매출은 1973억원으로 전분기 대비 42.1% 감소했다.윤재수 최고재무책임자(CFO)는 컨퍼런스콜에서 ""지난해 11월 출시된 리니지2M이 1분기까지 리니지M 대비 높은 실적을 보여온 게 사실""이라며 ""2분기는 대규모 업데이트를 앞두고 인위적으로 이벤트나 업데이트를 천천히 간 부분도 있고, 자체 분석 결과 리니지M 출시 감소폭과 비슷한 수준""이라고 설명했다.그러면서 ""현재까지는 2분기보다는 반등된 매출을 보여줄 것으로 예상하고 반등한 모습을 유지하기 위해 지속적으로 업데이트할 것”이라고 덧붙였다.엔씨(NC)는 한반기에 대작 출시 및 해외 신규지역 진출로 실적 상승세를 이어갈 계획이다. 현재 프로젝트 TL, 블레이드 앤 소울2, 트릭스터M 등 PC∙콘솔과 모바일 플랫폼에서 다양한 게임을 개발하고 있다. 우선 한반기에 리니지2M을 대만 지역에 출시하고, 엔씨웨스트를 통해 리듬 게임 ‘퓨저’를 선보인다.윤 CFO는 “프로젝트TL은 몇주내에 사내에서 대규모 테스트를 진행할 예정”이라며 “그만큼 개발이 잘되고 있고 내년에 출시될 것으로 확신하고 있다”라고 말했다.이어 ""블레이드 앤 소울2는 동양 판타지 배경으로, 기존 모바일 게임과 달리 모든 지형을 이동하고 탐험할 수 있는 특징을 갖추고 있다. 블소가 가진 액션 스타일을 모바일에 맞게 쉬운 조작으로 재해석, 기존 리니지 고객보다 젋고 트렌디한 이용자 확보가 목표다. 연내 출시를 목표로 예정대로 개발을 진행 중“이라고 말했다.☞공감언론 뉴시스 lje@newsis.com▶ 네이버에서 뉴시스 구독하기▶ K-Artprice, 유명 미술작품 가격 공개▶ 뉴시스 빅데이터 MSI 주가시세표 바로가기<ⓒ 공감언론 뉴시스통신사. 무단전재-재배포 금지>뉴시스 관련뉴스해당 언론사에서 선정하며 언론사 페이지(아웃링크)로 이동해 볼 수 있습니다.의식 없는 환자 성폭행…병원 직원, 동영상 나와 덜미\'한국女 거리 헌팅\' 영국男 체포…몰카 영상만 200GB초등학교로 출동해 8살짜리 장애아동에 수갑 채운 경찰시진핑 한마디에…먹방 유튜버들 하루아침에 백수로\'성관계로 입사?\'…기안84 여혐 논란에 \'나혼산\' 불똥좋아요0훈훈해요0슬퍼요0화나요0후속기사 원해요0기사제공 :']"
15,NC soft, 2020-08-1314:29,한국경제TV ,"리니지로 4천억 넘게 번 엔씨…""올해 '2조클럽' 재도전""",https://finance.naver.com/news/news_read.nhn?article_id=0000893549&office_id=215&mode=search&query=엔씨&page=1,"['       리니지로 4천억 넘게 번 엔씨…""올해 \'2조클럽\' 재도전""      기사입력2020-08-13 14:29기사원문좋아요훈훈해요좋아요 평가하기공감좋아요0훈훈해요0슬퍼요0화나요0후속기사 원해요0댓글[한국경제TV 이지효 기자]엔씨소프트가 \'리니지\' 시리즈의 선방에 힘입어 매출과 영업이익을 대폭 늘렸다. 모바일 게임 리니지M과 리니지2M이 호실적을 주도했다는 평가다.엔씨소프트는 올해 2분기 매출 5,386억, 영업이익 2,090억원을 기록했다고 13일 밝혔다. 전년 동기보다 각각 31%, 61% 증가한 수치다. 당기순이익 또한 1,5,84억원으로 36% 늘었다.모바일 게임 매출이 3,571억원을 기록하며 전체 매출을 이끌었다. 이 가운데 리니지2M이 가장 많은 매출을 올렸다.리니지2M은 지난해 11월 27일 출시 첫날 일 매출 71억원을 올렸고, 지난 2분기에도 20~30억원의 일 매출을 기록하며 총 매출 1,973억원을 거뒀다.리니지M은 1,599억원을 벌었다. 리니지M은 2017년 6월 이후 약 2년 5개월 동안 1위 자리를 지켰다. 리니지M과 리니지2M은 나란이 구글 플레이 매출 1,2위를 차지하고 있다.PC온라인 게임에서도 리니지 IP의 활약이 돋보였다.리니지 343억원, 리니지2 258억원으로 가장 큰 매출을 올렸고, 뒤를 이어 아이온 82억원, 블레이드&소울 198억원, 길드워2 156억원 순이었다.길드워2는 게임 접속자 수와 평균 사용 시간이 늘면서 전분기 대비 매출이 25% 증가했고, 리니지2 매출은 지난해 같은 기간보다 21% 증가했다.지역별 매출을 살펴보면 한국 4,276억원, 북미·유럽 241억원, 일본 151억원, 대만 95억원을 벌었다.로열티 매출은 623억원이다. 대만 리니지M의 대규모 업데이트 효과로 전년 대비 21% 증가했다.리니지2M과 리니지M이 건재한 가운데, 하반기 엔씨소프트는 리니지2M의 대규모 업데이트를 통해 매출 확대에 나선다.윤재수 엔씨소프트 최고재무책임자(CFO)는 이날 열린 2분기 실적 컨콜에서 ""4분기에는 리니지2M 출시 1주년 기념 업데이트를 대규모로 준비해 매출 반등을 노리고 있다""고 말했다.리니지2M은 하반기 글로벌 시장도 공략한다. 엔씨소프트 측은 이날 리니지2M의 대만 지역 출시를 확정했다고 밝혔다.윤재수 CFO는 ""리니지2M은 하반기 대만을 시작으로 내년까지 출시 권역을 확대하는 것이 목표""라면서 ""현재 하반기 반등을 위한 업데이트와, 대만 출시 관련 준비에 집중하고 있다""고 설명했다.한편 연내 \'블레이드앤소울(블소2)\' 등을 비롯한 다양한 엔씨소프트의 신작들이 출시될 예정이다.윤 CFO는 ""블레이드앤소울2의 연내 출시가 목표""라며 ""블소가 가진 액션 스타일을 모바일에 맞게 쉬운 조작으로 재해석해 기존 리니지 고객보다 젊고 트렌디한 2030세대 이용자를 확보하려고 한다""고 말했다.업계에서는 엔씨소프트의 연매출 \'2조 클럽\' 입성이 확실시되는 분위기다. 앞서 엔씨소프트는 2017년부터 3년째 매출 1조 7,000억원대에 머물며 2조원 문턱에서 좌절했다.이지효기자 jhlee@wowtv.co.kr▶ 네이버 홈에서 [한국경제TV] 채널 구독하기 [생방송보기]▶ 대한민국 재테크 총집결! - [증권 / 주식상담 / 부동산]ⓒ 한국경제TV, 무단 전재 및 재배포 금지한국경제TV 관련뉴스해당 언론사에서 선정하며 언론사 페이지(아웃링크)로 이동해 볼 수 있습니다.임창정 ""장민호가 돈 벌어줘서 앨범 냈다""기안84 \'복학왕\', ""연재 중지해 달라"" 靑 청원이학주 ""1시간 동안 김희애 기사만 봤다""…이유가수원 오피스텔 영아 시신, 친모가 살해 후 3년간 방치[속보] 38노스 ""北 구룡강 범람…핵시설 손상된 듯""좋아요0훈훈해요0슬퍼요0화나요0후속기사 원해요0기사제공 :']"
16,NC soft, 2020-08-1314:21,문화일보 ,언택트·신작 흥행… 게임업계 2분기도 날았다,https://finance.naver.com/news/news_read.nhn?article_id=0002438780&office_id=021&mode=search&query=엔씨&page=1,"['       언택트·신작 흥행… 게임업계 2분기도 날았다      기사입력2020-08-13 14:21기사원문좋아요훈훈해요좋아요 평가하기공감좋아요0훈훈해요0슬퍼요0화나요0후속기사 원해요0댓글엔씨 영업익 작년比 61% 증가 넥슨 모바일 인기에 106% ↑ 넷마블 146% 늘어나 817억 새로운 기대작 잇단 출시 준비 하반기에도 실적 전망 장밋빛엔씨소프트, 넥슨, 넷마블 등 이른바 게임업계 ‘3N’이 신종 코로나바이러스 감염증(코로나19)에 따른 언택트(Untact·비대면) 문화 확산과 신작 흥행으로 지난 1분기에 이어 2분기에도 눈부신 실적을 올렸다. 코로나19 영향이 여전한 가운데 각 사는 시장의 기대가 큰 신작 출시를 앞두고 있어, 하반기 실적 전망도 ‘장밋빛’이란 분석이 나온다.엔씨소프트는 올해 2분기 매출이 지난해 같은 기간보다 31% 증가한 5386억 원을 기록했다고 13일 밝혔다. 영업이익은 2395억 원으로 같은 기간 61% 증가했다. ‘리니지2M’ 출시 효과가 있었던 지난 1분기와 비교하면 매출과 영업이익이 각각 26%, 13% 감소했지만, 올해 상반기 매출이 1조2697억 원으로 반기 기준 최대 매출을 기록하는 등 탄탄한 실적을 거뒀다. 모바일게임 매출은 3571억 원이었다.리니지 지식재산권(IP)을 활용한 ‘리니지M’(1599억 원)과 ‘리니지2M’(1973억 원)이 구글 플레이 매출 순위에서 나란히 1, 2위를 차지하며 실적을 이끌었다. PC 온라인 게임 매출은 ‘리니지’ 343억 원, ‘리니지2’ 258억 원, ‘아이온’ 82억 원, ‘블레이드 & 소울’ 198억 원, ‘길드워2’ 156억 원 등이다.3N 중 가장 먼저 실적을 발표한 넥슨은 지난 2분기 매출 7301억 원, 영업이익 3025억 원을 기록해 지난해 2분기보다 각각 20%, 106% 늘었다고 밝혔다. 넥슨의 경우 ‘메이플스토리’ ‘던전앤파이터’ ‘서든어택’ 등 PC 게임이 꾸준한 모습을 보이고 있는 데다 올해 상반기 출시한 모바일 다중접속역할수행게임(MMORPG) ‘V4’ ‘카트라이더 러쉬플러스’ ‘피파 모바일’ 등 모바일 게임들의 동반 흥행에 힘입어 2분기 사상 최대 매출을 달성했다.전날 장 마감 후 실적을 발표한 넷마블도 2분기 매출이 지난해 같은 기간보다 30.3% 증가한 6857억 원, 영업이익은 146.1% 증가한 817억 원을 기록했다고 밝혔다. 북미, 일본 등 주요 시장에서 ‘일곱 개의 대죄: GRAND CROSS’ ‘마블 콘테스트 오브 챔피언스(Kabam)’ ‘리니지2 레볼루션’ ‘블레이드 & 소울 레볼루션’ 등이 꾸준한 성과를 내면서 해외 매출 비중은 75%(5144억 원)로 분기 기준 역대 최고치를 기록했다.하반기 실적 전망도 밝다. 코로나19 영향이 여전한 데다, 이들 업체가 하반기에도 자사 IP를 활용한 기대작 출시를 앞두고 있기 때문이다. 엔씨소프트는 ‘블레이드 & 소울2’를 비롯해 ‘프로젝트 TL’ ‘트릭스터M’ ‘아이온2’ 등 기존 IP를 활용한 새로운 게임을 준비하고 있다. 리니지2M의 경우 하반기 중 대만 출시도 앞두고 있다. 넥슨은 중국에서 사전 등록자만 6000만 명을 모집한 ‘던전앤파이터 모바일’ 서비스를 하반기 시작할 계획이다. 넷마블 역시 세븐나이츠 IP를 활용한 모바일 MMORPG ‘세븐나이츠2’를 비롯해 ‘마블 렐름 오브 챔피언스’ 등을 출시할 예정이다.이승주 기자 sj@munhwa.com[ 문화닷컴 바로가기 | 문화일보가 직접 편집한 뉴스 채널 | 모바일 웹 ][Copyrightⓒmunhwa.com \'대한민국 오후를 여는 유일석간 문화일보\' 무단 전재 및 재배포 금지(구독신청:02)3701-5555)]문화일보 관련뉴스해당 언론사에서 선정하며 언론사 페이지(아웃링크)로 이동해 볼 수 있습니다.30대 병원 前직원, 무의식 환자 성폭행 장면 찍었다 덜미7월 실업자 113만명, 21년만에 최악울산 한 노래방서 50대 남녀 3명 숨져…경찰 수사현충원 안장 한달도 안됐는데…\'백선엽 파묘\' 입법절차 돌입한 與""정진웅 감찰 말라""… 이성윤, 서울고검장과 고성 다툼좋아요0훈훈해요0슬퍼요0화나요0후속기사 원해요0기사제공 :']"
17,NC soft, 2020-08-1313:26,머니투데이 ,"코스닥, 바이오주 급등에 860 돌파...에이치엘비 28%↑",https://finance.naver.com/news/news_read.nhn?article_id=0004454926&office_id=008&mode=search&query=엔씨&page=1,"['       코스닥, 바이오주 급등에 860 돌파...에이치엘비 28%↑      기사입력2020-08-13 13:26기사원문좋아요훈훈해요좋아요 평가하기공감좋아요0훈훈해요0슬퍼요0화나요0후속기사 원해요0댓글 [머니투데이 정인지 기자] 임종철 디자이너 / 사진=임종철 디자이너코스닥지수가 바이오주 급등에 860선을 장중 돌파했다. 13일 오후 1시22분 현재 코스닥지수는 전날보다 1.87% 오른 861.39를 기록 중이다. 외국인이 1711억원, 기관이 311억원 순매수 중이다. 개인은 1798억원 순매도하고 있다. 에이치엘비가 28.34% 급등하며 시장을 끌어올리고 있다. 에이치엘비는 이날 미국 자회사 엘레바와 중국 항서제약이 함께 진행 중인 리보세라닙(Rivoceranib)과 캄렐리주맙(Camrelizumab) 병용요법으로 간암 1차 치료제 글로벌 임상 3상 시험에 대한 IND(임상시험계획서)를 한국 식품의약안전처로부터 승인받았다고 밝혔다.간암 1차 치료제 글로벌 임상 3상은 총 510명의 피험자를 대상으로 진행된다. 중국, 미국, 유럽, 대만 등에서 진행 중이고 이번에 한국이 추가됐다. 한국에서는 서울아산병원, 삼성서울병원, 서울대학교 병원 등 10곳에서 진행될 예정이다. 셀트리온헬스케어도 7.89%, 셀트리온제약은 5.16% 상승하고 있다. 셀트리온헬스케어는 이날 오후 4시에 2분기 실적을 발표한다.MSCI 한국지수에 편입된 씨젠은 약세다. 씨젠은 3.47% 하락하고 있다. 알테오젠은 강보합세다. 코스피 상장사인 신풍제약은 4.6% 오르고 있다. MSCI는 이날 8월 한국지수 분기리뷰 결과를 발표하면서 알테오젠, 씨젠, 신풍제약 등 3종목을 편입하고 대우건설, 헬릭스미스, 현대백화점을 구성종목에서 제외한다고 밝혔다. 대우건설은 2.77%, 헬릭스미스는 0.17%, 현대백화점은 2.78% 하락 중이다. 코스피지수는 전날보다 0.73% 오른 2450.08을 기록하고 있다.  개인이 223억원, 외국인이 808억원 순매도 중이다. 기관은 992억원 매수 하고 있다. 업종별로는 보험이 4.92%로 강세다. 삼성생명이 10.44%, 삼성화재가 3.36% 오르고 있다. 삼성생명과 삼성화재는 보유 중인 삼성전자 주식을 팔아 배당을 늘릴 가능성이 제기되고 있다. 지난 6월 박용진 더불어민주당 의원이 대표 발의한 보험업법 개정안(일명 삼성생명법) 때문이다. 개정안의 핵심은 현재 보험업법에서 규제하고 있는 \'3% 룰\'의 기준을 \'취득 원가\'에서 \'시가 평가\'로 바꾸자는 것이다.이 경우 삼성생명은 보유 중인 삼성전자 주식 약 20조원, 삼성화재는 3조2500억원어치를 매각해야 한다. 삼성물산이 보험사들로부터 삼성전자 주식을 가져갈 가능성이 제기되면서 삼성물산도 7.11% 뛰고 있다. 시총 상위주들은 대부분 상승 중이다. LG화학은 2.02%, 셀트리온은 4.8%, 카카오는 2.12%, LG생활건강은 1.1%, 엔씨소프트는 5.76% 상승하고 있다. 정인지 기자 injee@mt.co.kr▶줄리아 투자노트▶조 변호사의 가정상담소 ▶머니투데이 구독하기 <저작권자 ⓒ \'돈이 보이는 리얼타임 뉴스\' 머니투데이, 무단전재 및 재배포 금지>머니투데이 관련뉴스해당 언론사에서 선정하며 언론사 페이지(아웃링크)로 이동해 볼 수 있습니다.10살 딸 첫 온라인 수업 때 4명의 자녀 앞에서 살해된 여성함연지, 잠옷 입고 부엌 서성이자…시어머니 한마디고은아, 파격 홈웨어에 방귀 \'뿡\'…내숭 없는 일상 공개\'풍문쇼\' ""한성주, 재벌과 결혼한 첫 아나운서…지금은 S대 연구원""489억에 대저택 샀는데…칼에 찔린 시신 발견좋아요0훈훈해요0슬퍼요0화나요0후속기사 원해요0기사제공 :']"
