,회사명,날짜,언론사,기사제목,링크,본문
4,NC soft, 2020-08-1310:59,이데일리 ,"넷마블, 본업보다 투자?…빅히트엔터 등에 `好好`",https://finance.naver.com/news/news_read.nhn?article_id=0004712982&office_id=018&mode=search&query=엔씨&page=2,"[""       넷마블, 본업보다 투자?…빅히트엔터 등에 `好好`      기사입력2020-08-13 10:59기사원문좋아요훈훈해요좋아요 평가하기공감좋아요0훈훈해요0슬퍼요0화나요0후속기사 원해요0댓글2018년 빅히트 지분 25% 2014억에 매입…현재 1.2조로 6.2배↑엔씨소프트도 4.2배…카카오뱅크는 무려 43배 급증주가 가파르게 올라 밸류에이션 부담…투자의견 `중립` 힘실려[이데일리 김재은 기자] 2분기 시장기대치를 웃돈 호실적을 발표한 넷마블(251270)의 투자 지분 가치가 부각되고 있다. 하반기 상장을 앞둔 빅히트엔터를 비롯해 엔씨소프트, 카카오뱅크 등이 취득가액보다 크게 상승한 탓이다. 다만 그동안 주가가 가파르게 올라온 만큼 밸류에이션 부담이 커졌다며 증권가에선 투자의견을 `중립( Hold)`으로 낮추고 있다.자료:금융감독원, 삼성증권 (단위:억원, 주)13일 금융감독원에 따르면 넷마블은 현재 기업가치 3조~5조원으로 추정되는 빅히트엔터테인먼트 지분 25.04%(44만5882주)를 보유하고 있다. 5조원 추정시 보유지분 가치는 1조2520억원에 달한다. 넷마블은 지난 2018년 5월 2014억3100만원을 들여 이 지분을 사들였다. 취득가액에 비하면 무려 6.2배나 불어난 것이다. 방탄소년단(BTS) 소속사인 빅히트엔터테인먼트는 지난 7일 유가증권시장 상장예비심사를 통과해 상장 작업을 본격화하고 있다. 빅히트엔터는 이날 오후 빅히트 공식 유튜브 채널에서 ‘2020년 하반기 빅히트 회사 설명회’ 개최한다. 2015년 2월 3911억원을 들여 사들인 엔씨소프트(036570) 지분 8.88%(195만주) 역시 현재(12일 종가) 1조6575억원이나 된다. 취득가보다 4.2배 뛰었다. 2016년 4월 40억원에 취득한 카카오뱅크 지분 3.94%(1440만주)는 카뱅 기업가치 4조4000억원(삼성증권 추정치) 적용시 1730억원 수준이다. 43배가량 가치가 높아졌다. 다만 지난 2월 1조7401억원에 인수한 코웨이(021240) 지분 25.53%(1851만1446주)는 현재 가치(12일종가)가 1조6420억원으로 5.6%가량 떨어졌다.넷마블이 보유한 4개사의 지분가치의 합은 현재 4조7245억원에 달한다. 이는 현재 넷마블의 시가총액 (12조9000억원)의 36%가량 차지하는 수준이다. 오동환 삼성증권 연구원은 “넷마블이 전략적, 투자적 관점에서 지분을 매수한 엔씨소프트, 빅히트엔터테인먼트, 코웨이, 카카오뱅크 등의 시장가치가 빠르게 상승중”이라며 “투자기업들의 성공적인 IPO는 넷마블의 기업가치에 최대 변수로 작용하고 있다”고 짚었다. 특히 1조원 가치에 지분을 인수한 빅히트엔터테인먼트는 시장에서 3조~5조원으로 평가되고 있으며, 카카오뱅크 역시 시장의 기업가치 평가가 지속적으로 상승하고 있다는 설명이다. 자료:마켓포인트한편 넷마블은 2분기 매출 6857억원, 영업이익 817억원으로 컨센서스를 각각 15.3%, 27.9% 가량 웃돌았다. 북미 등 글로벌 흥행에 성공한 일곱개의 대죄 매출이 온기에 반영됐고, 마블 컨테스트오브 챔피언과 블소 레볼루션 등의 업데이터, 출시 지역 확대 영향이다. 3분기에는 7월 출시된 마구마구2020에 더해 BTS유니버스 스토리가 출시될 예정이나 BTS 월드 흥행성과를 고려하면 큰 기대를 갖기 어렵다는 분석이 지배적이다. 차기 기대작인 세븐나이츠2, 마블렐름오브챔피언스는 4분기에 출시될 예정이다. 오 연구원은 “신작 흥행에 따른 이익개선을 반영해 목표주가를 12만원으로 33.3% 상향한다”면서도 “최근 주가 급등으로 자회사 상장 기대감이 충분히 반영됐고, 상장 이후 자회사 기업가치의 높은 변동성이 예상돼 추가적 주가상승은 제한적”이라며 투자의견 `중립(Hold)`을 유지했다. 한화투자증권도 넷마블이 동종업종 대비 고평가돼 있다며 투자의견을 `매수`에서 `중립(Hold)`으로 낮췄다.김재은 (aladin@edaily.co.kr)▶또 하나의 뉴스로 시작하는 하루 'News+'  #궁금하냥? 바로오시개!▶네이버에서 '이데일리 뉴스'를 만나보세요▶빡침해소, 청춘뉘우스 '스냅타임'＜ⓒ종합 경제정보 미디어 이데일리 - 무단전재 & 재배포 금지＞이데일리 관련뉴스해당 언론사에서 선정하며 언론사 페이지(아웃링크)로 이동해 볼 수 있습니다.민주·통합 지지율 첫 역전…文대통령 40%서 위태기안84, '복학왕' 여혐 논란…'나혼자산다' 하차 요구 빗발손혜원 억울 정도가 아니라 어이없다, 세상 수상해서 걱정김조원 가정파탄 지경...잘 안다던 野의원 재혼은 아닌 듯조국 초선 김웅 '기승전-조국' 공격...내 아파트 '3수' 재건축좋아요0훈훈해요0슬퍼요0화나요0후속기사 원해요0기사제공 :""]"
5,NC soft, 2020-08-1310:51,연합뉴스 ,엔씨 2분기 실적 괜찮았지만…주력 '리니지2M' 매출 급감(종합2보),https://finance.naver.com/news/news_read.nhn?article_id=0011811838&office_id=001&mode=search&query=엔씨&page=2,"['       엔씨 2분기 실적 괜찮았지만…주력 \'리니지2M\' 매출 급감(종합2보)      기사입력2020-08-13 10:51기사원문좋아요훈훈해요좋아요 평가하기공감좋아요0훈훈해요0슬퍼요0화나요0후속기사 원해요0댓글매출 5천386억원·영업익 2천90억…리니지2M 매출 전분기 58% 수준 그쳐""하반기·내년 신작 발표 추진 중…해외 투자·M&A 기회도 적극 모색""엔씨소프트[엔씨소프트 제공. 재판매 및 DB 금지]    (서울=연합뉴스) 이효석 기자 = 엔씨소프트가 2분기에도 \'리니지\' 시리즈의 선방에 기대어 실적 호조를 이어나갔다.    다만 올해 1분기에 분기 기준 역대 최고 실적을 이끌었던 주력 게임 \'리니지2M\' 매출은 한 분기 만에 절반 가까이 줄어들었다.    엔씨소프트는 올해 2분기 연결 기준 매출 5천386억원, 영업이익 2천90억원을 올렸다고 13일 공시했다.    지난해 2분기와 비교해 매출은 31.11%, 영업이익은 61.49% 증가했다.    2분기 당기순이익은 1천584억원으로 전년 동기 대비 35.54% 늘었다.    매출이 가장 많이 나온 게임은 지난 분기처럼 모바일게임 \'리니지2M\'이었다. 2분기 매출 1천973억원이었다.    \'리니지M\'은 1천599억원의 매출을 올려 뒤를 이었다.    엔씨소프트는 모바일게임 매출이 총 3천571억원으로 전체 매출의 66%가량을 차지했다.    다만 전 분기 모바일게임 매출 약 5천532억원과 비교하면 2분기 모바일게임 매출은 35% 이상 감소한 모습을 보였다.    전 분기에 리니지2M 매출만 3천411억원, 리니지M 매출이 2천120억원이었는데 두 게임 매출이 모두 대폭 줄어들었다. 리니지2M 매출은 지난 분기의 57.8% 수준에 그쳤다.    이런 여파로 엔씨소프트는 전 분기 대비 매출, 영업이익, 당기순이익이 각각 26%, 13%, 19% 감소했다.리니지2M [엔씨소프트 제공. 재판매 및 DB 금지]    윤재수 엔씨소프트 최고재무책임자(CFO)는 실적발표 후 컨퍼런스콜(전화회의)에서 리니지2M 매출 감소에 관해 ""지난해 11월 출시 후 시일이 지나면서 자연스럽게 매출이 감소했다""면서 ""대규모 업데이트를 앞두고 2분기 중에 사업 강도를 조정하기도 했다""고 설명했다.    그는 ""6월 말 실시한 업데이트가 기대한 효과에 못 미쳐 매출이 감소한 측면이 있으며, 유저 트래픽도 하향 추세가 있었다""면서 ""대만 진출 및 출시 1주년 기념 대규모 업데이트를 준비하고 있으며, 하반기에는 매출 안정화에 주력할 계획""이라고 말했다.    엔씨의 PC 온라인 게임 매출은 \'리니지\' 343억원, \'리니지2\' 258억원, \'아이온\' 82억원, \'블레이드 앤 소울\' 198억원, \'길드워2\' 156억원 등의 순이었다.    엔씨소프트 측은 ""리니지2 매출이 전년 동기 대비 21% 증가하며 견조한 실적을 유지했다""며 ""길드워2는 게임 접속자 수와 평균 사용 시간이 늘어나며 매출이 전 분기 대비 25% 증가했다""고 밝혔다.    엔씨소프트 측은 시장 기대가 큰 \'프로젝트TL\', \'블레이드 앤 소울 2\', \'아이온 2\', \'트릭스터 M\' 등 신작들도 차질 없이 개발 중이라고 강조했다.    윤 CFO는 ""프로젝트 TL의 경우 몇 주 내에 대규모 사내 테스트(CBT)를 할 예정이고, PC 버전은 내년 출시를 확신하고 있다""며 ""블레이드 앤 소울 2는 리니지보다 젊고 트렌디한 연령대가 타깃으로 목표대로 연내 출시를 계획 중""이라고 예고했다.    그는 ""\'아이온 2\'의 경우 블레이드 앤 소울 2를 먼저 런칭하기로 하면서 폴리싱 작업을 강화하고 있다""며 ""PC 아이온과는 테마 정도만 공유되고 거의 새로운 게임이라고 할 수 있을 것""이라고 말했다.    엔씨소프트의 2분기 지역별 매출은 한국 4천276억원, 북미·유럽 241억원, 일본 151억원, 대만 95억원 등이었다. 로열티 매출은 623억원이었다.    윤 CFO는 엔씨의 해외 진출 전략에 관해 ""지사(엔씨웨스트홀딩스)에 연초에 투자·인큐베이션 담당을 만들고 해외 시장, 특히 미국·유럽에 투자 기회나 인수합병(M&A) 기회를 포착하려고 적극적으로 준비하고 있다""고 덧붙였다.    hyo@yna.co.kr▶집중호우 속보는 네이버 연합뉴스[구독 클릭]▶[팩트체크]금배지 너무 오래 달지 말자?▶제보하기 연합뉴스 관련뉴스해당 언론사에서 선정하며 언론사 페이지(아웃링크)로 이동해 볼 수 있습니다.\xa0기안84 웹툰 여혐 논란…\'나 혼자 산다\' 하차요구도\xa0울산 한 노래방서 50대 남녀 3명 숨져\xa0사탕 2개 먹다 쓰러진 20대女, 지나가던 해병대가 살렸다\xa0""의사가운 입고 해변 가라?"" 그녀들의 비키니 반격\xa030년간 못 찾은 아버지 시신이 지하실에…경찰 수사좋아요0훈훈해요0슬퍼요0화나요0후속기사 원해요0기사제공 :']"
6,NC soft, 2020-08-1310:24,세계일보 ,"코웨이, 인터브랜드 ‘베스트 코리아 브랜드’ 6년 연속 선정…‘Top Growin...",https://finance.naver.com/news/news_read.nhn?article_id=0003493424&office_id=022&mode=search&query=엔씨&page=2,"['       코웨이, 인터브랜드 ‘베스트 코리아 브랜드’ 6년 연속 선정…‘Top Growing 브랜드’ 선정 영예      기사입력2020-08-13 10:24기사원문좋아요훈훈해요좋아요 평가하기공감좋아요0훈훈해요0슬퍼요0화나요0후속기사 원해요0댓글 라이프케어기업 코웨이(대표 이해선)가 글로벌 브랜드 컨설팅 그룹인 인터브랜드가 실시한 ‘제 8회 베스트 코리아 브랜드 2020(Best Korea Brands 2020)’에서 26위를 기록하며 대한민국을 대표하는 50대 브랜드에 6년 연속 선정됐다고 13일 밝혔다. 특히 코웨이는 전년 대비 높은 브랜드 가치 성장률을 기록한 Top Growing 브랜드에도 선정되며 그 의미를 더했다.   인터브랜드는 글로벌 Top 100 브랜드를 선정하는 세계적인 브랜드 컨설팅 전문업체다. 지난 2013년부터는 국내 브랜드들의 브랜드 가치를 평가하고 선정하는 ‘베스트 코리아 브랜드’를 통해 대한민국을 대표하는 최상위 50대 브랜드를 발표하며 국내 기업들의 브랜드 가치 극대화는 물론 비즈니스 성장에 기여하고 있다.   코웨이는 금년 ‘베스트 코리아 브랜드 2020’에서 지난 해보다 다섯 계단 순위 상승한 26위를 차지하며 국내를 대표하는 강력한 브랜드 파워를 입증했다.   특히 코웨이 브랜드 가치는 전년 대비 17.4% 상승한 1조 422억 원을 기록하며 높은 성장률을 보인Top Growing 브랜드에 선정되는 영예를 안았다. 금년 Top Growing 브랜드에는 코웨이를 포함해 카카오, LG생활건강, 엔씨소프트가 함께 언급됐다. 코웨이는 리테일 산업분야에서도 브랜드 가치 1위를 차지했으며, CJ ENM, 롯데쇼핑, 이마트 등이 그 뒤를 이었다.   코웨이는 그 어느 때 보다 빠르게 진화하는 시장 환경 속에서 탁월한 고객 경험을 제공하기 위해 혁신적인 제품 출시와 고객과의 끊임 없는 소통을 통해 고객 니즈에 선제적으로 대응한 결과 지난 해 매출 3조원을 돌파하며 업계 리더로서의 위치를 더욱 공고히 했다.   또한 코웨이는 국내에 이어 해외시장에서의 브랜드 가치 향상에 주력하고 있다. 코웨이 정수기는 말레이시아에서 시장 점유율 1위를 수성하고 있다. 금년 1월부터는 매트리스 맞춤 케어 렌탈을 론칭 하는 등 카테고리 확장을 통해 금년 2분기 기준 고객 총 계정수 152만 계정을 돌파하며 시장 지배력을 전략적으로 강화하고 있다.   송현주 코웨이 상품개발센터장은 “끊임없는 혁신을 통한 경쟁력 확보와 시장 상황 변화에 따른 민첩한 대응의 결과로 코웨이 브랜드 가치는 매년 높은 성장률을 보이며 향상되고 있다”며 “이제는 국내를 넘어 글로벌 시장에서도 경쟁 우위를 확보 할 수 있도록 브랜드 리더십 강화에 최선을 노력을 다하겠다”고 말했다.   김현주 기자 hjk@segye.com    ⓒ 세상을 보는 눈, 세계일보세계일보 관련뉴스해당 언론사에서 선정하며 언론사 페이지(아웃링크)로 이동해 볼 수 있습니다.문 대통령 ""제가 39사단 출신""… 특전사 아니었어?\'46세\' 추성훈, 은퇴 안 하는 이유…""딸 사랑이 위해""""그 몸매에 짧은 치마는 아니지 않냐""전월세 매물 \'뚝\'…집주인만 \'최강자\' 됐다""이태임, 남편 구속…현재 홀로 육아에 전념""좋아요0훈훈해요0슬퍼요0화나요0후속기사 원해요0기사제공 :']"
7,NC soft, 2020-08-1310:16,이데일리 ,“‘바람의나라’ 등 경쟁작 출시 영향 미미”-엔씨소프트 컨콜,https://finance.naver.com/news/news_read.nhn?article_id=0004712937&office_id=018&mode=search&query=엔씨&page=2,"[""       “‘바람의나라’ 등 경쟁작 출시 영향 미미”-엔씨소프트 컨콜      기사입력2020-08-13 10:16기사원문좋아요훈훈해요좋아요 평가하기공감좋아요0훈훈해요0슬퍼요0화나요0후속기사 원해요0댓글 [이데일리 노재웅 기자] “‘바람의나라: 연’ 등 경쟁작들의 출시로 인한 매출 영향은 크게 없었다. 바람의나라가가 출시된 한주 동안만 리니지2M의 경우 매출이 소폭 감소되는 영향이 있었다. 리니지M은 오히려 업데이트 이후 상승하는 모습이었고, 리니지2M만 약간의 영향이 있었다. 현재는 두 게임 모두 다시 반등해서 수치 유지하고 있다. 어떻게 업데이트하고 운영하느냐에 따라 하반기 기조 이어질 것으로 본다.”-13일 엔씨소프트(036570) 2분기 실적 컨퍼런스 콜노재웅 (ripbird@edaily.co.kr)▶또 하나의 뉴스로 시작하는 하루 'News+'  #궁금하냥? 바로오시개!▶네이버에서 '이데일리 뉴스'를 만나보세요▶빡침해소, 청춘뉘우스 '스냅타임'＜ⓒ종합 경제정보 미디어 이데일리 - 무단전재 & 재배포 금지＞이데일리 관련뉴스해당 언론사에서 선정하며 언론사 페이지(아웃링크)로 이동해 볼 수 있습니다.민주·통합 지지율 첫 역전…文대통령 40%서 위태기안84, '복학왕' 여혐 논란…'나혼자산다' 하차 요구 빗발손혜원 억울 정도가 아니라 어이없다, 세상 수상해서 걱정김조원 가정파탄 지경...잘 안다던 野의원 재혼은 아닌 듯조국 초선 김웅 '기승전-조국' 공격...내 아파트 '3수' 재건축좋아요0훈훈해요0슬퍼요0화나요0후속기사 원해요0기사제공 :""]"
8,NC soft, 2020-08-1310:15,매일경제 ,"[엔씨소프트 컨콜] “프로젝트TL, 수주내 대규모 사내 테스트…내년 출시 ‘확신’...",https://finance.naver.com/news/news_read.nhn?article_id=0004634519&office_id=009&mode=search&query=엔씨&page=2,"['       [엔씨소프트 컨콜] “프로젝트TL, 수주내 대규모 사내 테스트…내년 출시 ‘확신’”      기사입력2020-08-13 10:15기사원문좋아요훈훈해요좋아요 평가하기공감좋아요0훈훈해요0슬퍼요0화나요0후속기사 원해요0댓글 13일 엔씨소프트 윤재수 최고재무책임자(CFO)는 2분기 실적발표 컨퍼런스콜을 통해 “프로젝트TL은 몇주내에 사내에서 대규모 테스트를 진행할 예정”이라며 “그만큼 개발이 잘되고 있고 내년에 출시될 것으로 확신하고 있다”라고 말했다.이어 “플랫폼별 출시 일정은 PC 버전이 내년에 먼저 출시되고 콘솔은 넥스트제너레이션(차세대기종) 타깃이어 출시 시점이 좀 차이가 있을 것”이라고 덧붙였다.또 ‘아이온2’와 관련해서는 “블소2 출시가 확정된 이후 좀 더 폴리싱 작업을 진행 중이고 내년 중에는 발표할 수 있을 것”이라며 “PC 아이온과 비교해서는 느낌과 테마 정도만 공유돼 아이온 테마의 새로운 게임이라고 말씀 드릴 수 있다”라고 설명했다.[임영택기자 ytlim@mkinternet.com]▶네이버 메인에서 \'매일경제\'를 받아보세요▶\'매일경제\' 바로가기\xa0▶뉴스레터 \'매콤달콤\' 구독[ⓒ 매일경제 & mk.co.kr, 무단전재 및 재배포 금지]매일경제 관련뉴스해당 언론사에서 선정하며 언론사 페이지(아웃링크)로 이동해 볼 수 있습니다.""상사와 잠자리 후 취업"" 기안84 \'복학왕\' 논란수해 현장 \'몰래\' 봉사 나선 김정숙 여사봄수연, 스폰·임신 고백 거짓…SNS 사칭 피해봄수연, 스폰·조건+임신 고백?…소속사 다급히박원숙 ""빚쟁이들 방송국 찾아와…김창숙 돈빌려줘""좋아요0훈훈해요0슬퍼요0화나요0후속기사 원해요0기사제공 :']"
9,NC soft, 2020-08-1310:15,파이낸셜뉴스 ,"엔씨소프트, 집중호우 피해 복구 성금 10억 기부",https://finance.naver.com/news/news_read.nhn?article_id=0004476588&office_id=014&mode=search&query=엔씨&page=2,"['       엔씨소프트, 집중호우 피해 복구 성금 10억  기부      기사입력2020-08-13 10:15기사원문좋아요훈훈해요좋아요 평가하기공감좋아요0훈훈해요0슬퍼요0화나요0후속기사 원해요0댓글 [파이낸셜뉴스]엔씨소프트가 집중호우 피해 복구 성금 10억원을 희망브리지 전국재해구호협회에 기부한다고 13일 밝혔다.   기부금은 집중호우로 피해를 입은 지역과 수재민들을 위해 사용된다.   엔씨소프트는 “수해를 입은 지역 사회의 안정과 신속한 피해 복구를 기원한다”며 “어려움을 겪고 있는 모든 분들께 위로와 도움이 되기를 바란다”고 말했다.  #엔씨소프트 #집중호우피해   gogosing@fnnews.com 박소현 기자   ▶ 헉! 소리나는 스!토리 뉴스 [헉스]▶ \'아는 척\'하고 싶은 당신을 위한 [두유노우]  ※ 저작권자 ⓒ 파이낸셜뉴스. 무단 전재-재배포 금지파이낸셜뉴스 관련뉴스해당 언론사에서 선정하며 언론사 페이지(아웃링크)로 이동해 볼 수 있습니다.홍상수 김민희 결별? ""영화 관계자, 헤어진 것 같다며..""공지영의 충격 폭로 ""김부선한테 협박 받아. 내 전남편과..""추성훈이 찬 시계, 금액 얼마길래? \'화들짝\'많은 연예인들에 대시 받은 이다영 누구길래? 남자들이..참지못한 이재명 ""조선일보에 묻는다, 만약..""좋아요0훈훈해요0슬퍼요0화나요0후속기사 원해요0기사제공 :']"
10,NC soft, 2020-08-1310:15,이데일리 ,"[이데일리N] 공매도 ‘금지 연장’ vs ‘재개’…거래소, 오늘 토론회 개최 外",https://finance.naver.com/news/news_read.nhn?article_id=0004712935&office_id=018&mode=search&query=엔씨&page=2,"[""       [이데일리N] 공매도 ‘금지 연장’ vs ‘재개’…거래소, 오늘 토론회 개최 外      기사입력2020-08-13 10:15기사원문좋아요훈훈해요좋아요 평가하기공감좋아요0훈훈해요0슬퍼요0화나요0후속기사 원해요0댓글 [이데일리N]1. 공매도 ‘금지 연장’ vs ‘재개’…거래소, 오늘 토론회 개최2. 콘텐츠·헬스케어 등 6대 산업에 4.6조 공급…“수출 확대”  3. 대출 회수 시작된 쌍용차…외국계 은행 차입금 상환 비상4. 제조中企 공장가동률 5개월째 70%미달…금융위기 후 처음 5. 한경연 “中 R&D 정책지원에 성과…韓도 제도 개선 필요” -간추린 소식엔씨소프트 2Q 영업익 2090억원…전년比 61.5% 증가 ‘뉴딜펀드’ 3억원까지 5% 저율과세…여당 법안 발의 美월풀, 세탁기 수입제한 연장 청원…삼성·LG “영향 없다”“코로나19 시대, 공공 R&D 확대해 취약계층 소외 막아야” 강상원 (won3191@edaily.co.kr)▶또 하나의 뉴스로 시작하는 하루 'News+'  #궁금하냥? 바로오시개!▶네이버에서 '이데일리 뉴스'를 만나보세요▶빡침해소, 청춘뉘우스 '스냅타임'＜ⓒ종합 경제정보 미디어 이데일리 - 무단전재 & 재배포 금지＞이데일리 관련뉴스해당 언론사에서 선정하며 언론사 페이지(아웃링크)로 이동해 볼 수 있습니다.민주·통합 지지율 첫 역전…文대통령 40%서 위태기안84, '복학왕' 여혐 논란…'나혼자산다' 하차 요구 빗발손혜원 억울 정도가 아니라 어이없다, 세상 수상해서 걱정김조원 가정파탄 지경...잘 안다던 野의원 재혼은 아닌 듯조국 초선 김웅 '기승전-조국' 공격...내 아파트 '3수' 재건축좋아요0훈훈해요0슬퍼요0화나요0후속기사 원해요0기사제공 :""]"
11,NC soft, 2020-08-1310:14,매일경제 ,"[엔씨소프트 컨콜] “리니지2M, 해외는 대만 우선…내년 상반기 추가 진출 힘들 ...",https://finance.naver.com/news/news_read.nhn?article_id=0004634518&office_id=009&mode=search&query=엔씨&page=2,"['       [엔씨소프트 컨콜] “리니지2M, 해외는 대만 우선…내년 상반기 추가 진출 힘들 듯”      기사입력2020-08-13 10:14기사원문좋아요훈훈해요좋아요 평가하기공감좋아요0훈훈해요0슬퍼요0화나요0후속기사 원해요0댓글 13일 엔씨소프트 윤재수 최고재무책임자(CFO)는 2분기 실적발표 컨퍼런스콜을 통해 “리니지2M은 대만 지역만 확정해 놓았다”라며 “하반기 반등을 위한 대규모 업데이트도 준비하고 대만 출시도 준비해야하기에 두가지에 집중하기로 했다”라고 설명했다.이어 “내년 상반기에 추가 진출하기에는 힘들 것 같다”라며 “다만 대만 지사를 통해 직접 서비스하기에 기존 서드파티를 통하던 것과는 매출, 영업이익 기여도는 훨씬 클것이라고 말할 수 있다”라고 덧붙였다.[임영택기자 ytlim@mkinternet.com]▶네이버 메인에서 \'매일경제\'를 받아보세요▶\'매일경제\' 바로가기\xa0▶뉴스레터 \'매콤달콤\' 구독[ⓒ 매일경제 & mk.co.kr, 무단전재 및 재배포 금지]매일경제 관련뉴스해당 언론사에서 선정하며 언론사 페이지(아웃링크)로 이동해 볼 수 있습니다.""상사와 잠자리 후 취업"" 기안84 \'복학왕\' 논란수해 현장 \'몰래\' 봉사 나선 김정숙 여사봄수연, 스폰·임신 고백 거짓…SNS 사칭 피해봄수연, 스폰·조건+임신 고백?…소속사 다급히박원숙 ""빚쟁이들 방송국 찾아와…김창숙 돈빌려줘""좋아요0훈훈해요0슬퍼요0화나요0후속기사 원해요0기사제공 :']"
