,회사명,날짜,언론사,기사제목,링크,본문
0,NC soft, 2020-03-1318:36,한국경제 ,"13일, 기관 거래소에서 삼성전자(-1.67%), SK하이닉스(-0.36%) 등 ...",https://finance.naver.com/news/news_read.nhn?article_id=0004306170&office_id=015&mode=search&query=엔씨&page=1,"['       13일, 기관 거래소에서 삼성전자(-1.67%), SK하이닉스(-0.36%) 등 순매수      기사입력2020-03-13 18:36기사원문좋아요훈훈해요좋아요 평가하기공감좋아요0훈훈해요0슬퍼요0화나요0후속기사 원해요0댓글 기관 투자자는 13일 거래소에서 삼성전자, SK하이닉스, KODEX 200선물인버스2X 등을 중점적으로 사들인 것으로 나타났다.기관 투자자의 순매수 상위 20개 종목은 삼성전자, SK하이닉스, KODEX 200선물인버스2X, NAVER, KODEX 인버스, 엔씨소프트, 삼성SDI, KODEX 코스닥150선물인버스, 카카오, 삼성전기등이다.이중에 전기,전자 업종에 속한 종목이 5개 포함되어 있다.KODEX 200선물인버스2X, KODEX 인버스, KODEX 코스닥150선물인버스 등은 전일 대비 주가가 상승했고, 삼성전자, SK하이닉스, NAVER 등은 주가가 하락했다.[03월13일]거래소 기관 순매수 상위 종목한경로보뉴스이 기사는 한국경제신문과 금융 AI 전문기업 씽크풀이 공동 개발한 기사 자동생성 알고리즘에 의해 실시간으로 작성된 것입니다.▶ 네이버에서 한국경제 뉴스를 받아보세요▶ 한경닷컴 바로가기  ▶ 모바일한경 구독신청 ⓒ 한국경제 & hankyung.com, 무단전재 및 재배포 금지한국경제 관련뉴스해당 언론사에서 선정하며 언론사 페이지(아웃링크)로 이동해 볼 수 있습니다.이재명, 신천지 강경대응한 결과가…반전""한 번도 경험 못한 위기 온다""…전문가 전망29억5000만원이던 대치동 아파트, 3개월만에""이럴 때 오른다더니…"" 300만원 넘게 폭락""금속 손잡이에 묻은 바이러스는…"" 깜짝결과좋아요0훈훈해요0슬퍼요0화나요0후속기사 원해요0기사제공 :']"
1,NC soft, 2020-03-1318:36,한국경제 ,"13일, 외국인 거래소에서 삼성전자(-1.67%), 현대차(-8.21%) 등 순매...",https://finance.naver.com/news/news_read.nhn?article_id=0004306172&office_id=015&mode=search&query=엔씨&page=1,"['       13일, 외국인 거래소에서 삼성전자(-1.67%), 현대차(-8.21%) 등 순매도      기사입력2020-03-13 18:36기사원문좋아요훈훈해요좋아요 평가하기공감좋아요0훈훈해요0슬퍼요0화나요0후속기사 원해요0댓글 외국인 투자자는 13일 거래소에서 삼성전자, 현대차, SK하이닉스 등을 중점적으로 매도한 것으로 나타났다.외국인 투자자의 순매도 상위 20개 종목은 삼성전자, 현대차, SK하이닉스, 삼성SDI, 삼성전자우, NAVER, 엔씨소프트, 셀트리온, SK이노베이션, 신한지주등이다.이중에 전기,전자 업종에 속한 종목이 5개 포함되어 있다.KODEX 200선물인버스2X 등은 전일 대비 주가가 상승했고, 삼성전자, 현대차, SK하이닉스 등은 주가가 하락했다.[03월13일]거래소 외국인 순매도 상위 종목한경로보뉴스이 기사는 한국경제신문과 금융 AI 전문기업 씽크풀이 공동 개발한 기사 자동생성 알고리즘에 의해 실시간으로 작성된 것입니다.▶ 네이버에서 한국경제 뉴스를 받아보세요▶ 한경닷컴 바로가기  ▶ 모바일한경 구독신청 ⓒ 한국경제 & hankyung.com, 무단전재 및 재배포 금지한국경제 관련뉴스해당 언론사에서 선정하며 언론사 페이지(아웃링크)로 이동해 볼 수 있습니다.이재명, 신천지 강경대응한 결과가…반전""한 번도 경험 못한 위기 온다""…전문가 전망29억5000만원이던 대치동 아파트, 3개월만에""이럴 때 오른다더니…"" 300만원 넘게 폭락""금속 손잡이에 묻은 바이러스는…"" 깜짝결과좋아요0훈훈해요0슬퍼요0화나요0후속기사 원해요0기사제공 :']"
2,NC soft, 2020-03-1317:09,머니투데이 ,삼성전자 향한 외국인의 공습…1.2조 순매도 중 절반 차지,https://finance.naver.com/news/news_read.nhn?article_id=0004375618&office_id=008&mode=search&query=엔씨&page=1,"['       삼성전자 향한 외국인의 공습…1.2조 순매도 중 절반 차지      기사입력2020-03-13 17:09기사원문좋아요훈훈해요좋아요 평가하기공감좋아요0훈훈해요0슬퍼요0화나요0후속기사 원해요0댓글 [머니투데이 조준영 기자]  미국 증시 대폭락의 영향으로 코스피-코스닥에 사이드카와 서킷 브레이커가 사상 초유로 동시 발동된 13일 오후 서울 중구 하나은행 딜링룸에 3대 하락 마감한 코스피 지수가 표시돼 있다. 코스피는 장중 한 때 1700선이 붕괴됐다. / 사진=이동훈 기자 photoguy@그야말로 \'13일의 금요일\'이었다. 외국인들의 투매행렬에 국내 증시는 크게 흔들렸다. 코스피 지수가 장중 전일 대비 8.38% 내린 1680.60까지 떨어졌고 코스닥지수도 13.56% 내린 487.07까지 하락해 시장이 패닉에 빠졌다.주가폭락에는 외국인들의 순매도가 주원인이었다. 이날 외국인들은 코스피 시장에서 1조2392억원을 팔아치웠다. 장 초반부터 투매가 쏟아지며 일정시간 거래가 중단되는 서킷브레이커가 발동됐다. 다행히 오후 들어 연기금이 등판하며 6700억원을 코스피시장에서 순매수했고 개인도 4428억원을 순매수하며 지수하락을 방어했다.외국인들의 순매도 주요종목을 살펴보면 삼성전자가 5747억원으로 전체 순매도의 절반에 달했다. 이에 장초반 전일종가 대비 3950원이나 하락(8.43%↓)한 4만6850원을 찍기도 했다.삼성전자를 이어 △현대차, 1025억원 △SK하이닉스, 716억원 △삼성SDI, 544억원 △삼성전자우, 395억원 △NAVER, 381억원 △엔씨소프트, 319억원 순이었다.한편 외국인들은 코로나19가 실물경제로 전이될 것이라는 우려에 증시가 급락하기 시작한 지난달 24일 이후 하루를 제외하고 연일 국내 증시에서 돈을 빼가고 있다.이에 지난 2월 24일부터 이날까지 외국인 순매도 금액은 코스피 시장에서만 10조원을 훌쩍 넘는다. 지난 2008년 글로벌 금융위기와 2011년 유럽 재정위기 당시를 뛰어넘는 기록이다.조준영 기자 cho@mt.co.kr▶줄리아 투자노트▶조 변호사의 가정상담소 ▶머니투데이 구독하기 <저작권자 ⓒ \'돈이 보이는 리얼타임 뉴스\' 머니투데이, 무단전재 및 재배포 금지>머니투데이 관련뉴스해당 언론사에서 선정하며 언론사 페이지(아웃링크)로 이동해 볼 수 있습니다.차비까지 얹어준다…갤S10, 어쩌다 \'공짜폰\' 됐나""10년 주식투자해서 번 돈 다 까먹었어요""폭락장서 IT·대형주 쓸어담았다…연기금, 12년여만에 최대 순매수""지금이 바닥"" 길어지는 개미 \'빚투\' 행렬코에서 대장까지…코로나 바이러스, 이렇게 퍼진다좋아요0훈훈해요0슬퍼요0화나요0후속기사 원해요0기사제공 :']"
3,NC soft, 2020-03-1316:20,한국경제TV ,1800 내준 코스피…서킷브레이커·사이드카 발동,https://finance.naver.com/news/news_read.nhn?article_id=0000855515&office_id=215&mode=search&query=엔씨&page=1,"['       1800 내준 코스피…서킷브레이커·사이드카 발동      기사입력2020-03-13 16:20기사원문좋아요훈훈해요좋아요 평가하기공감좋아요0훈훈해요0슬퍼요0화나요0후속기사 원해요0댓글[한국경제TV 박준식 기자]13일 코스피가 3% 넘게 하락하며 1800선이 무너지는 패닉 장세를 보였다.이날 코스피는 전일 대비 62.89포인트(3.43%) 내린 1771.44에 거래를 마쳤다.전일 보다 6.09% 하락한 1722.68로 시작한 뒤 지수가 가파르게 수직 하락하며 오전 9시 6분 프로그램 매매의 매도호가의 효력을 5분간 무효화하는 사이트카가 발동됐다.10시 43분에는 모든 거래를 20분동안 정지시키는 서킷브레이커마져 발동됐다.이 과정에서 지수는 1700선이 붕괴돼 1680.60까지 빠지기도 했다.코스피에서 주요 업종은 모두 하락했는데 종이·목재, 운송장비, 기계, 운수창고, 의료정밀 등의 낙폭이 컸다.투자 주체 별로는 개인과 기관이 각각 4435억원어치와 6658억원어치의 주식을 샀고, 외국인은 1조2396억원어치의 주식을 팔았다.이날 기관 중에서는 연기금 등이 5730억원어치를 매수하며 지수를 방어했다. 프로그램 매매는 4709억원 매도 우위였다.시가총액 상위 종목 중에서는 엔씨소프트만 보합세로 장을 마쳤고, 나머지는 모두 내렸다. 현대차가 8% 이상 빠졌고, SK텔레콤과 삼성바이오로직스의 낙폭도 컸다.전일보다 39.49포인트(7.01%) 빠진 524.00으로 마감된 코스닥도 오전 9시 4분 모든 매매거래를 20분동안 정지시키는 서킷브레이커가 발동된 데 이어 9시 38분 사이드카까지 발동됐다.하루 동안 코스피와 코스닥에서 각각 서킷브레이커와 사이드카가 모두 발동된 건 사상 처음이다.오후 들어 청와대에서 열린 \'경제·금융 상황 특별 점검 회의\'와 한국은행이 임시 금융통화위원회 개최를 논의한다는 소식에 낙폭을 줄일 수 있었다.이날 한국 증시의 폭락은 미국 증시가 11년 만에 베어 마켓(약세장)으로 진입했고 18년 만에 서킷브레이커(일시매매정지)가 발동되면서 예견됐다.먼저 마감한 유럽의 증시도 10% 무너지면서 글로벌 증시는 도미노 패닉 현상을 연출하게 됐다.(사진=연합뉴스)박준식기자 parkjs@wowtv.co.kr▶ 네이버 홈에서 [한국경제TV] 채널 구독하기 [생방송보기]▶ 대한민국 재테크 총집결! - [증권 / 주식상담 / 부동산]ⓒ 한국경제TV, 무단 전재 및 재배포 금지한국경제TV 관련뉴스해당 언론사에서 선정하며 언론사 페이지(아웃링크)로 이동해 볼 수 있습니다.차비까지 얹어주는 \'갤럭시S10\'…""\'공짜폰\' 대란 오나""국가부도위험 2배↑+외국인 9조 이탈…제2 외환위기 신호탄인가송대관, 500억 재산 잃은 사연…""출연정지까지""원주 칼국수 사장님, 건강 적신호?…백종원 눈물의사협회 ""면 마스크 사용 권고하지 않는다""...정부 논리 \'반박\'좋아요0훈훈해요0슬퍼요0화나요0후속기사 원해요0기사제공 :']"
4,NC soft, 2020-03-1316:16,머니투데이 ,"폭락장서 IT·대형주 쓸어담았다…연기금, 12년여만에 최대 순매수",https://finance.naver.com/news/news_read.nhn?article_id=0004375548&office_id=008&mode=search&query=엔씨&page=1,"['       폭락장서 IT·대형주 쓸어담았다…연기금, 12년여만에 최대 순매수      기사입력2020-03-13 16:16기사원문좋아요훈훈해요좋아요 평가하기공감좋아요0훈훈해요0슬퍼요0화나요0후속기사 원해요0댓글 [머니투데이 황국상 기자] [ 5700억 순매수…13일 하루에만 삼성전자 1931억, SK하이닉스 627억 순매수]미국 증시 대폭락의 영향으로 코스피-코스닥에 사이드카와 서킷 브레이커가 사상 초유로 동시 발동된 13일 오후 서울 중구 하나은행 딜링룸에 3대 하락 마감한 코스피 지수가 표시돼 있다. 코스피는 장중 한 때 1700선이 붕괴됐다. / 사진=이동훈 기자 photoguy@3월 폭락증시의 골이 깊어지는 가운데 연기금이 13일 5700억원 이상의 자금을 증시에 투입했다. 이날 연기금 순매수는 2007년 12월 이후 최대 규모라는 점에서 눈에 띈다. 연기금의 매수세는 IT 대형주 등 국내 증시 주요 업종의 대표주에 집중됐다.이날 한국거래소에 따르면 이날 오후 3시 30분 정규장 종료 시점까지 연기금은 코스피에서 5730억원을 순매수했다. 이날 연기금의 코스피 순매수 규모는 2007년 12월 13일 5965억원 이후 최대 규모다. 이날 오후 6시까지 시간 외 거래가 이어지는 동안 추가 매수세가 유입될 경우 현 수준(5730억원)보다 더 늘어날 가능성도 있다. 지난 9일 코스피가 4% 이상 하락했던 날에도 연기금은 3932억원을 순매수한 바 있다.이날 코스피는 전일 대비 3.43% 내린 1771.44로 거래를 마쳤다. 코스피가 종가 기준으로 1800 아래로 밀린 것은 2013년 6월 이후 약 7년 만에 처음이다. 장중 낙폭은 더욱 가팔랐다. 이날 코스피는 장중 8.38% 내린 1680.60까지 밀리기도 했다. 장중 저점 기준으로 코스피가 1700 아래로 밀렸던 것은 2011년 10월 이후 약 9년만에 처음이었다.이날 장 초반까지만 해도 연기금의 매수세는 미미했다. 오전 11시까지만 해도 외국인이 4692억원을 코스피에서 순매도하며 낙폭을 키우는 와중에서도 연기금은 216억원을 순매수하는 데 그쳤었다. 하지만 이날 낮 12시 30분을 즈음해 연기금의 순매수 규모가 1000억원을 넘어서며 본격적으로 매수 폭이 커졌다. 오후 1시 30분 2000억원을 넘어선 연기금 순매수 규모는 오후 2시 7분께 3000억원으로 늘었고 정규장 종료 시점이 다가오면서 그 폭을 확대해 나가며 2007년 12월 이후 최대치까지 달했다.연기금이 급락장세에서 우군 역할을 담당한 것은 이번이 처음이 아니다. 2008년 9월 글로벌 IB(투자은행) 리먼브라더스가 파산 선언을 하면서 촉발된 글로벌 금융위기 당시 코스피는 2008년 8월 말 1474.24에서 같은 해 11월 말 914.02로 불과 3개월 만에 38% 급락했다. 이 기간 연기금은 코스피에서 5조9519억원을 사들이며 하락장 방어에 나선 바 있다. 지난해 8월 이후 미국·중국 무역분쟁이 격화되면서 초래된 약세장에서도 연기금은 하루 최대 5000억원 이상을 순매수하며 지수 방어에 나서기도 했다.이날 연기금의 순매수 규모가 가장 큰 종목은 국내 증시 시가총액 1위인 삼성전자로 그 규모가 1931억원에 달했다. SK하이닉스에도 627억원 규모의 연기금 순매수세가 몰렸다. 이외에 NAVER(+276억원) 엔씨소프트(+173억원) 카카오(+148억원) SK텔레콤(+147억원) 삼성SDI(+143억원) LG화학(+142억원) 현대모비스(+143억원) 삼성전기(+130억원) 등이 연기금 순매수 상위 10개 종목에 이름을 올렸다.한편 연기금의 순매수세가 본격화되고 있음에도 약세장을 완전히 방어하기에는 역부족이었다. 이날 하루에만 코스피에서 외국인은 1조2393억원을 순매도하며 개인(4429억원) 및 연기금을 포함한 기관 전체(6650억원)의 순매수 규모를 압도했다. 이날 삼성전자는 장중 7.78% 하락한 4만6850원까지 밀렸다가 장중 한 때 5만1600원(+1.57%)으로 오르며 상승 반전을 시도했지만 끝내 4만9950원(-1.67%)으로 거래를 마쳤다. SK하이닉스도 8% 이상 낙폭을 키우며 한 때 7만6000원까지 밀렸다가 장 후반에 8만4700원(+2.29%)까지 상승폭을 키웠으나 장 마감 시점에 0.36% 하락한 8만2500원으로 마감했다. 황국상 기자 gshwang@mt.co.kr▶줄리아 투자노트▶조 변호사의 가정상담소 ▶머니투데이 구독하기 <저작권자 ⓒ \'돈이 보이는 리얼타임 뉴스\' 머니투데이, 무단전재 및 재배포 금지>머니투데이 관련뉴스해당 언론사에서 선정하며 언론사 페이지(아웃링크)로 이동해 볼 수 있습니다.차비까지 얹어준다…갤S10, 어쩌다 \'공짜폰\' 됐나""10년 주식투자해서 번 돈 다 까먹었어요""폭락장서 IT·대형주 쓸어담았다…연기금, 12년여만에 최대 순매수코에서 대장까지…코로나 바이러스, 이렇게 퍼진다\'이혼\'했단 말에 속아 재혼, 알고보니 다 \'거짓말\'…저 어떡하죠?좋아요0훈훈해요0슬퍼요0화나요0후속기사 원해요0기사제공 :']"
5,NC soft, 2020-03-1315:48,매일경제 ,`롤러코스터 증시` 코스피 하루 7% 급등락 후 1770선 마감,https://finance.naver.com/news/news_read.nhn?article_id=0004536071&office_id=009&mode=search&query=엔씨&page=1,"['       `롤러코스터 증시` 코스피 하루 7% 급등락 후 1770선 마감      기사입력2020-03-13 15:48기사원문좋아요훈훈해요좋아요 평가하기공감좋아요0훈훈해요0슬퍼요0화나요0후속기사 원해요0댓글[이미지 출처 = iStockphoto] 코로나19의 글로벌 팬데믹 공포와 이에 대응하려 한 미국과 유럽의 헛발질에 코스피가 13일 패닉 장세를 보이며 사이트카와 서킷브레이커가 연달아 발동된 결과 하루동안에만 지수가 7%의 변동폭을 보였다. 코스닥 역시 개장 후 한 시간만에 서킷브레이커와 사이드카가 모두 발동되며 9% 가량의 급등락세가 연출됐다. 13일 코스피는 전일 대비 62.89포인트(3.43%) 내린 1771.44에 거래를 마쳤다. 이날 코스피는 전일 대비 6.09% 하락한 1722.68로 시작한 뒤 지수가 급전직하하며 오전 9시 6분 프로그램 매매의 매도호가의 효력을 5분간 무효화하는 사이트카가, 10시 43분 모든 거래를 20분동안 정지시키는 서킷브레이커가 각각 발동됐다. 이 과정에서 지수는 1700선이 붕괴돼 1680.60까지 빠지기도 했다. 전일보다 39.49포인트(7.01%) 빠진 524.00으로 마감된 코스닥도 오전 9시 4분 모든 매매거래를 20분동안 정지시키는 서킷브레이커가 발동된 데 이어 9시 38분 사이드카까지 발동됐다. 그러나 오전 10시 16분께 코스닥의 낙폭은 전일 대비 8%를 넘어선 뒤 하락세가 가속화되기 시작해 10시 45분께 500선을 내줬다. 하루 동안 코스피와 코스닥에서 각각 서킷브레이커와 사이드카가 모두 발동된 건 사상 처음이다. 그러나 오후 들어 연기금을 중심으로 한 기관이 매수량을 늘리며 두 지수가 급반등했다. 이날 오전 문재인 대통령이 홍남기 경제부총리와 이주열 한은 총재를 청와대로 불러 \'경제·금융 상황 특별 점검 회의\'를 열었고, 한국은행이 임시 금융통화위원회 개최를 논의한다는 소식이 전해진 점도 낙폭 축소에 힘을 보탰다. 문 대통령은 이날 경제·금융 상황 특별 점검 회의에서  ""경제 정책을 하는 분들은 과거의 비상상황에 준해서 대책을 생각하는 경우가 있으나 지금은 메르스, 사스와는 비교가 안 되는 비상 경제시국""이라며 ""과거 사례와 비교는 할 수 있으나 그때와는 양상이 다르고 특별하니 전례 없는 일을 해야 할 상황이다. 정부는 과거에 하지 않았던 대책을, 전례없는 대책을 최선을 다해 만들어내야 할 것""고 말했다고 강민석 청와대 대변인이 전했다. 이에 시장 안팎에서는 향후 정부가 시장 기대를 뛰어 넘는 강도의 금융지원책을 내놓을 것이란 기대가 커지고 있다. 실제 이날 홍남기 부총리 겸 기획재정부 장관, 이주열 한국은행 총재, 은성수 금융위원장, 윤석헌 금융감독원장은 긴급 거시경제금융회의를 열고 공매도 과열종목 지정 제도에 이은 추가 대책을 신속하게 준비하겠다는 데 뜻을 모았다. 이날 한국 증시의 패닉은 지난 11일(현지시간) 도널드 트럼프 미국 대통령이 영국과 아일랜드를 제외한 유럽 사람의 미국 입국을 30일동안 금지시키면서도 적극적인 경기 대응책은 제시하지 않은 연설을 한 충격이 이틀째 이어진 가운데, 유럽중앙은행(ECB)까지 금리를 동결한 데서 비롯됐다. 이 영향으로 간밤에 뉴욕증시 역시 패닉장세를 보이며 다우지수가 9.99% 폭락했고, 유럽의 주요국 지수도 10% 넘게 내렸다. 서상영 키움증권 연구원은 ""(간밤 미국·유럽 증시의) 공포 심리 이면에는 우호적 내용도 있었다""며 ""비록 금리를 동결했으나 ECB는 자산매입 규모를 확대하는 등 추가적 유동성을 공급한다고 발표했으며 미 연준 또한 장중에 레포를 운용해 이틀간 1조5000억달러 규모의 유동성을 공급한다고 발표했다""고 말했다. 이어 ""이러한 각국 중앙은행들의 유동성 공급은 언제든 (증시에) 영향을 줄 수 있다는 점에 주목할 필요가 있다""고 덧붙였다. 이날 코스피에서 주요 업종은 모두 하락했다. 종이·목재, 운송장비, 기계, 운수창고, 의료정밀 등의 낙폭이 컸다. 투자 주체 별로는 개인과 기관이 각각 4435억원어치와 6658억원어치의 주식을 샀고, 외국인은 1조2396억원어치의 주식을 팔았다. 특히 기관 중에서는 연기금 등이 5730억원어치를 매수하며 지수를 방어했다. 프로그램 매매는 4709억원 매도 우위였다. 시가총액 상위 종목 중에서는 엔씨소프트만 보합세로 장을 마쳤고, 나머지는 모두 내렸다. 현대차가 8% 이상 빠졌고, SK텔레콤과 삼성바이오로직스의 낙폭도 컸다. 이날 코스피에서는 30개 종목이 올랐고 867개 종목이 내렸다.[디지털뉴스국 한경우 기자]▶\'M코인\' 지금 가입하면 5000코인 드려요▶네이버 메인에서 \'매일경제\'를 받아보세요\xa0▶뉴스레터 \'매콤달콤\' 구독[ⓒ 매일경제 & mk.co.kr, 무단전재 및 재배포 금지]매일경제 관련뉴스해당 언론사에서 선정하며 언론사 페이지(아웃링크)로 이동해 볼 수 있습니다.중국 외교부 대변인 ""어쩌면 미군이 우한에 코로나19를…""감염병 전문가 ""코로나19는 숨을 쉬면 바이러스가…""오채원 파격 패션…비키니 챔피언의 우월한 볼륨출산장려금 기부한 해병대 간부 부부伊 배우, 코로나로 숨진 누나와 한집에 ""살려주세요""좋아요0훈훈해요0슬퍼요0화나요0후속기사 원해요0기사제공 :']"
