,회사명,날짜,언론사,기사제목,링크,본문
0,NC soft, 2020-05-2018:37,한국경제 ,"20일, 거래소 외국인 순매수상위에 전기,전자 업종 6종목",https://finance.naver.com/news/news_read.nhn?article_id=0004344567&office_id=015&mode=search&query=엔씨&page=1,"['       20일, 거래소 외국인 순매수상위에 전기,전자 업종 6종목      기사입력2020-05-20 18:37기사원문좋아요훈훈해요좋아요 평가하기공감좋아요0훈훈해요0슬퍼요0화나요0후속기사 원해요0댓글 외국인 투자자는 20일 거래소에서 SK하이닉스, 삼성전자우, 삼성SDI 등을 중점적으로 사들인 것으로 나타났다.외국인 투자자의 순매수 상위 20개 종목은 SK하이닉스, 삼성전자우, 삼성SDI, 셀트리온, LG화학, 엔씨소프트, 강원랜드, 휠라홀딩스, 삼성전자, KODEX 코스닥 150등이다.이중에 전기,전자 업종에 속한 종목이 6개 포함되어 있다.SK하이닉스, 삼성전자우, 삼성SDI 등은 전일 대비 주가가 상승했고, 삼성전자, KODEX 200선물인버스2X 등은 주가가 하락했다.[05월20일]거래소 외국인 순매수 상위 종목한경로보뉴스이 기사는 한국경제신문과 금융 AI 전문기업 씽크풀이 공동 개발한 기사 자동생성 알고리즘에 의해 실시간으로 작성된 것입니다.▶ 네이버에서 한국경제 뉴스를 받아보세요▶ 한경닷컴 바로가기  ▶ 모바일한경 구독신청 ⓒ 한국경제 & hankyung.com, 무단전재 및 재배포 금지한국경제 관련뉴스해당 언론사에서 선정하며 언론사 페이지(아웃링크)로 이동해 볼 수 있습니다.[속보] 삼성서울병원 간호사 감염경로가…발칵""진단키트에 이어…"" 한국, 또 해냈다""한국이 더이상 찾지 않아""…日 \'패닉\'1인당 성과급 무려 50억…뭐하는 회사길래""한국, 이대로 가다간…"" 초토화 조짐좋아요0훈훈해요0슬퍼요0화나요0후속기사 원해요0기사제공 :']"
1,NC soft, 2020-05-2018:01,MBN ,배틀그라운드 개발사 1분기 영업익 3천524억원…엔씨소프트 추월,https://finance.naver.com/news/news_read.nhn?article_id=0001456803&office_id=057&mode=search&query=엔씨&page=1,"['       배틀그라운드 개발사 1분기 영업익 3천524억원…엔씨소프트 추월      기사입력2020-05-20 18:01기사원문좋아요훈훈해요좋아요 평가하기공감좋아요0훈훈해요0슬퍼요0화나요0후속기사 원해요0댓글 크래프톤이 올해 1분기에 주력 게임 \'배틀그라운드 모바일\'의 호조에 사상 최대 실적을 올렸습니다.오늘(20일) 금융감독원에 공시된 분기보고서에 따르면 크래프톤의 올해 1분기 연결기준 매출 5천82억원, 영업이익은 3천524억원으로 각각 집계됐습니다.이는 지난해보다 각각 99%, 256% 늘어난 것입니다.1분기 영업익 기준으로는 국내 게임 업체 가운데 엔씨소프트(2천414억)보다 많고 넥슨(4천540억원)보다는 적습니다.실적 호조로 현재 추진 중인 기업공개(IPO)도 더욱 탄력을 받을 전망입니다.부문별로는 모바일게임 매출이 4천215억원으로 지난해 같은 기간보다 509% 늘었습니다. 2018년 3월 전 세계에 출시한 \'배틀그라운드 모바일\'이 선전한 것으로 분석됩니다. 이밖에 온라인 719억원, 콘솔 113억원 등입니다.지역별로는 아시아가 4천518억원, 북미·유럽 308억원, 한국 214억원 등입니다.회사 측은 ""배틀그라운드의 지적재산(IP)을 활용한 신규 게임을 출시할 예정""이라며 ""다양한 모바일 및 콘솔 게임을 개발 중""이라고 밝혔습니다.[MBN 온라인뉴스팀]▶ 네이버 메인에서 MBN뉴스를 만나보세요!▶ MBN 무료 고화질 온에어 서비스 GO!▶ 김주하의 \'이 한 장의 사진\'< Copyright ⓒ MBN(www.mbn.co.kr) 무단전재 및 재배포 금지 >MBN 관련뉴스해당 언론사에서 선정하며 언론사 페이지(아웃링크)로 이동해 볼 수 있습니다.식약처 ""공적마스크 판매 6월말 종료…시행방안 협의 중""김현아, ""민주당, 윤미향 지키는 고집불통""서울 고3 확진자…강동 상일미디어고 재학생윤미향 의혹 놓고 여성단체 입장차 \'뚜렷\'김영민 별세, 외화→예능까지 활약했던 성우…향년 61세좋아요0훈훈해요0슬퍼요0화나요0후속기사 원해요0기사제공 :']"
2,NC soft, 2020-05-2017:48,매일경제 ,희비갈린 개미…`일개미` 웃고 `불개미` 울다,https://finance.naver.com/news/news_read.nhn?article_id=0004578951&office_id=009&mode=search&query=엔씨&page=1,"['       희비갈린 개미…`일개미` 웃고 `불개미` 울다      기사입력2020-05-20 17:48기사원문좋아요훈훈해요좋아요 평가하기공감좋아요0훈훈해요0슬퍼요0화나요0후속기사 원해요0댓글동학개미 투자 성적표 분석삼성전자·현대차·LG화학 등우량주 3월중 연중저점 찍어이때 매수한 투자자는 `방긋`곱버스 올라탄 개미는 -48%원유불개미들도 일제히 손실개인이 이끈 코스닥 700 돌파 \'동학개미운동\'이라는 신조어를 낳을 정도로 코로나19 국면에서 외국인의 대량 매도에 맞서는 개인투자자들의 주식 순매수가 거셌다. 같은 \'동학개미\'라도 어떤 스타일로 투자했는지에 따라 수익률은 달랐던 것으로 나타났다. 20일 매일경제와 SK증권이 올해 폭락장이 시작된 3월부터 현재까지 개인투자자들이 코스피에서 집중 순매수한 종목들의 수익률을 계산해본 결과 우량주 위주로 베팅한 개인투자자들은 수익률이 대체로 플러스를 기록한 반면, 원유선물이나 레버리지 종목에 베팅한 개인들은 수익률이 마이너스로 떨어진 경우가 많았다. 3월 초부터 5월 2주차까지 주간 단위로 개인이 많이 사들인 상위 종목과 주간·월간 단위 수익률을 보면 우량주에 투자한 \'스마트개미\'들은 대체로 좋은 성과를 낸 것으로 파악됐다. 개인들은 코스피가 연중 저점을 찍은 3월 3주차에 삼성전자와 현대차, LG화학 등을 집중 매수했는데, 이들이 5월 19일 현재까지 보유하고 있다고 가정하면 수익률은 모두 플러스를 기록했다. 반면 같은 날 매수했다고 해도 소위 \'곱버스\'로 불리는 KODEX 200선물인버스2X 상장지수펀드(ETF)는 5월 19일까지 보유했을 경우 손실률이 48.8%에 달했다. KODEX WTI원유선물(H)도 코스피 저점인 3월 19일 매수해 5월 19일까지 보유했다고 가정하면 손실률이 33.5%, 개인 매수세가 집중됐던 4월 첫 거래일에 매수해 5월 19일까지 수익을 계산하면 -22.3%였다.   SK증권은 보고서에서 ""주식투자에서 저점을 잡는 것은 쉽지 않지만, 코스피가 저점(1457.64)을 기록한 주간에 주식을 매수한 개인투자자들은 대부분 누적수익이 플러스를 기록했을 것""이라면서 ""3월 둘째주 삼성전자를 산 사람은 수익을 냈겠지만, 원유선물이나 인버스 상품에 투자한 사람들은 모두 손실을 기록했다""고 설명했다.굳이 저점이 아니라 코스피가 저점에서 30% 이상 회복한 뒤 박스권을 그리던 4월 중순~5월 중순 기간을 비교해도 우량주에 투자한 개인들은 대체로 투자 수익을 올릴 수 있었다. 4월 2주차 개인 순매수 4~5위에 오른 SK하이닉스, 현대차의 5월 2주까지 수익률은 각각 0.6%, 12.2%를 기록해 횡보 구간에서도 상승했다. 4월 4주차에 접어든 시점에서 개인이 많이 사들인 엔씨소프트, 카카오의 당시 대비 5월 19일 현재 수익률을 보면 각각 18.3%, 20.4%였다.5월 들어 개인들이 꾸준히 매수하고 있는 네이버, 카카오, 엔씨소프트 등 \'언택트\' \'디지털\' 관련 우량주 성과는 시점과 관계없이 꾸준히 잘 나오고 있다. 결국 중요한 것은 고위험 상품보다는 우량주 위주로 투자하되 한 종목에 올인하기보다는 코로나19와 같은 국면에 맞춰 분산 투자하는 것이다. 코스피 대형 우량주에서도 \'코로나 수혜주\'에 개인 매수세가 몰린 것처럼 상대적으로 코로나19로 인한 반사이익이 기대되는 헬스케어·미디어·게임·IT 관련주 비중이 높은 코스닥에서도 개인들이 투자 성과를 올리고 있다.20일 코스닥지수는 \'코로나19 사태\' 이전 수준을 넘어서 지난해 6월 26일(709.37) 이후 11개월 만에 700선을 돌파했다. 특히 코스피가 박스권에 진입한 4월 중순 이후 1개월간 개인은 코스닥에서 9000억원 넘는 주식을 순매수한 뒤 이날 900억원 넘게 순매도하며 차익 실현에 나서는 모습을 보여주고 있다.  [박인혜 기자 / 안갑성 기자 / 신유경 기자]▶네이버 메인에서 \'매일경제\'를 받아보세요▶매부리TV 구독하고 에어팟프로 득템!!\xa0▶뉴스레터 \'매콤달콤\' 구독[ⓒ 매일경제 & mk.co.kr, 무단전재 및 재배포 금지]매일경제 관련뉴스해당 언론사에서 선정하며 언론사 페이지(아웃링크)로 이동해 볼 수 있습니다.[매부리TV] 3억에 30억 한강변 아파트 \'줍줍\'기회아우디, 2세대 Q3 출시…""연비 14.7km/ℓ의 소형 SUV""f(x)루나, 시스루 치마 사이로 아찔한 노출文대통령 이어 이효리도…\'이 구두\' 신은 이유가최불암 ""아내 김민자, 얼굴만 봐도 여전히 설렌다""좋아요0훈훈해요0슬퍼요0화나요0후속기사 원해요0기사제공 :']"
3,NC soft, 2020-05-2016:54,서울경제 ,'배그 모바일'에 크래프톤 영업익 2배↑···IPO 탄력받나,https://finance.naver.com/news/news_read.nhn?article_id=0003740418&office_id=011&mode=search&query=엔씨&page=1,"['       \'배그 모바일\'에 크래프톤 영업익 2배↑···IPO 탄력받나      기사입력2020-05-20 16:54기사원문좋아요훈훈해요좋아요 평가하기공감좋아요0훈훈해요0슬퍼요0화나요0후속기사 원해요0댓글[서울경제] 크래프톤이 ‘배틀그라운드 모바일’ 호조에 힘입어 올해 1·4분기 사상 최대 실적을 올렸다. 배틀그라운드 모바일은 MAU(월간 활성 사용자 수) 기준 글로벌 1위를 유지하고 있는 게임이다.20일 공시에 따르면 크래프톤은 올해 1·4분기 연결기준 매출 5,082억원, 영업이익은 3,524억원을 올린 것으로 나타났다. 이는 지난해 같은 기간에 비해 각각 99%, 256% 증가한 수치다. 엔씨소프트(2,414억원) 영업이익을 뛰어넘은 호실적이다.부문별로는 모바일게임 매출이 4,215억원으로 지난해 같은 기간보다 509% 늘었다. 2018년 3월 글로벌 출시된 배틀그라운드 모바일이 매출을 견인할 것으로 분석된다. 이외 온라인 매출은 719억원, 콘솔 매출이 113억원이다. 지역별로는 아시아가 4,518억원, 북미와 유럽이 308억원 등이다.1·4분기 실적 호조로 크래프톤 기업공개(IPO)는 더욱 탄력을 받을 전망이다. 크래프톤 측은 “배틀그라운드의 지적재산(IP)을 활용한 신규 게임을 출시할 예정”이라며 “다양한 모바일 및 콘솔 게임을 개발 중”이라고 밝혔다. /오지현기자 ohjh@sedaily.com[서울경제 바로가기]▶ 네이버 채널에서 \'서울경제\' 구독해주세요!▶ 세상 모든 것에 대해 던지는 질문, 왜(WHY)?저작권자 ⓒ 서울경제, 무단 전재 및 재배포 금지서울경제 관련뉴스해당 언론사에서 선정하며 언론사 페이지(아웃링크)로 이동해 볼 수 있습니다.\'아크로서울포레\' 줍줍 ···2시 기준 16만 명 육박관련 확진자 벌써 25명···""무직"" 학원강사 거짓말에 \'n차 감염\' 일파만파이유비 \'20년은 어려보이는 상큼함\' 그럼 유치원생이야?송영길, \'쉼터 논란\' 윤미향 파문에 ""부친 컨테이너에 살아···최소한의 예의 있어야""한소희, 이렇게 섹시할 수 있나? 보기만 해도 빠져드는 매력덩어리좋아요0훈훈해요0슬퍼요0화나요0후속기사 원해요0기사제공 :']"
4,NC soft, 2020-05-2011:37,헤럴드경제 ,장병규의 ‘화려한 컴백!’… 택진이형도 뛰어넘었다.,https://finance.naver.com/news/news_read.nhn?article_id=0001675868&office_id=016&mode=search&query=엔씨&page=1,"['       장병규의 ‘화려한 컴백!’… 택진이형도 뛰어넘었다.      기사입력2020-05-20 11:37기사원문좋아요훈훈해요좋아요 평가하기공감좋아요0훈훈해요0슬퍼요0화나요0후속기사 원해요0댓글1분기 영업익 3524억원…엔씨보다 1000억 높아 텐센트 \'화평정영\' 로열티 수익이 실적 견인올해 신작 \'엘리온\' 출시…\'2조 클럽\' 가입 눈앞 장 의장 최대 목표 IPO 내년 하반기 예상장병규 크래프톤 의장 (사진=크래프톤)[헤럴드경제=채상우 기자] ""택진이형(엔씨소프트) 위에 병규형(크래프톤)""전 4차산업혁명위원회 위원장 장병규 크래프톤 의장이 사상 최대 분기 실적으로 화려한 경영 복귀 신고식을 했다. 크래프톤을 2위(영업이익 기준)로 끌어올렸다. \'더블\' 실적으로 대박을 친 엔씨소프트마저 넘어섰다. 국내 게임 톱3 \'3N\' 중 넷마블, 엔씨소프트를 꺾으며 국내 최대 게임업체 넥슨 정조준에 나섰다. 장 의장의 목표인 기업공개(IPO)에도 더욱 탄력을 받을 전망이다.출처=금융감독원 전자공시시스템▶게임 업계 파란!=크래프톤 올해 1분기 실적은 장 의장 경영 복귀 첫 성적표라는 점에서 큰 주목을 받았다. 장 의장은 2017년부터 4차산업혁명위원회 위원장으로 활동하다 올해 2월 경영 일선에 복귀했다.크래프톤의 올해 1분기 영업이익은 3524억원이다. 전년 동기 대비 255% 증가했다. 매출액과 순이익도 5081억원, 2939억원으로 각각 98%, 215% 올랐다.영업이익 기준으로 엔씨소프트(2414억원)보다 1000억원 이상 높다. 엔씨소프트도 리니지2M 성공으로 역대 두 번째로 높은 성적을 거뒀지만 크래프톤은 이를 뛰어넘었다. 크래프톤이 영업이익으로 엔씨소프트를 꺾은 것은 이번이 처음이다.넷마블 영업이익(204억원)보다 크래프톤이 17배 더 높다.남은 건 부동의 1위인 넥슨뿐이다. 넥슨의 1분기 영업이익은 4540억원으로 크래프톤과의 격차는 1000억원 수준이다.출처=금융감독원 전자공시시스템크래프톤은 하반기 신작 PC MMORPG(다중접속역할수행게임) \'엘리온\'으로 승부수를 띄운다는 전략이다. 특정 상대 없이 무차별로 공격하는 \'논타깃팅\' 액션과 \'몰이사냥\' 등 다양한 즐길거리를 담았다. 크래프톤은 \'배틀그라운드\'를 이을 대작으로 전사적 역량을 집중하고 있다.올해는 매출 \'2조 클럽\' 가입도 노리고 있다. 김동희 메리츠증권 연구원은 ""올해 하반기 신작 엘리온으로 탄탄한 성장세를 이어갈 것으로 예상된다""며 ""올해 예상 매출액은 2조원을 상회할 것""이라고 전망했다.▶ 든든한 지원군 \'텐센트\'=크래프톤의 성공 배경에는 크래프톤의 2대 주주인 텐센트가 있다. 텐센트는 지난해 11월 크래프톤의 지분 2.9%를 추가로 매입했다. 텐센트의 크래프톤 지분은 13.3%다. 업계는 텐센트가 향후에도 크래프톤의 지분을 지속 확대할 것으로 전망하고 있다.텐센트가 서비스하는 \'배틀그라운드 모바일\'의 중국 버전 \'화평정영\'(和平精英)이 실적을 견인했다. 지난해 5월 출시한 \'화평정영\'은 배틀그라운드 IP(지식재산)를 기반으로 텐센트에서 개발한 게임이다. 크래프톤과 텐센트의 로열티 배분 비율은 20대 80으로 알려졌다. 크래프톤이 판호 발급이 안되는 중국에 우회 진출한 것으로 업계는 분석하고 있다.\'화평정영\'이 출시 후 7개월 간 벌어들인 수익만 1조원이 넘는다. \'화평정영\'의 일간 사용자 수(DAU)는 5000만명을 넘어섰다. 모바일 앱 분석업체 아이지에이웍스에 따르면 국내 최고 인기 게임인 \'리니지2M\'의 DAU는 2만명이 채 되지 않는다.▶장의장의 목표 IPO \'청신호’ …기업 가치는 얼마?= 대박 실적에 장 의장의 목표인 IPO도 가속화될 것으로 예상된다. 장 의장은 경영에 복귀한 직후 ""단기간에 반드시 IPO를 실현하겠다""고 밝혔다.장외에서 지난해 30만원 대까지 떨어졌던 크래프톤의 주가는 실적 발표 후 70만원대까지 치솟았다. 엔씨소프트의 시가총액은 현재 16조원 수준. 호실적이 계속 이어진다면 크래프톤의 시가총액도 최소 10조원대에 달할 전망이다.IB업계에서는 크래프톤의 IPO 시점을 내년께로 예상하고 있다. 상장 준비기간에만 6개월에서 1년이 걸리고, 신청 후 20일에서 45일의 시간이 더 걸린다. 크래프톤은 조만간 주관사를 선정, IPO 절차에 나설 예정이다.123@heraldcorp.com▶[디;콘] 우리동네 젠트리피케이션 위험도는?▶코로나 19 현황보기 ▶전국 농수축산물 소비 캠페인 - Copyrights ⓒ 헤럴드경제 & heraldbiz.com, 무단 전재 및 재배포 금지 -헤럴드경제 관련뉴스해당 언론사에서 선정하며 언론사 페이지(아웃링크)로 이동해 볼 수 있습니다.""이용수 할머니, 윤미향 무릎 꿇고 사과하자 눈물""\'리얼돌 FC서울\'에 제재금 1억 중징계한 이유씨름 꿈나무→연쇄살인범으로 전락한 31세 최신종\'나눔의 집\' 후원금 논란…유재석 측 ""가슴 아파해""전두환 아들 전재국, 본인 월급만 44% 인상…주주 지적에 ""무례하다""좋아요0훈훈해요0슬퍼요0화나요0후속기사 원해요0기사제공 :']"
5,NC soft, 2020-05-2011:27,헤럴드경제 ,"[데스크칼럼] 코로나19 지원, 미래를 내다보자",https://finance.naver.com/news/news_read.nhn?article_id=0001675825&office_id=016&mode=search&query=엔씨&page=1,"['       [데스크칼럼] 코로나19 지원, 미래를 내다보자      기사입력2020-05-20 11:27기사원문좋아요훈훈해요좋아요 평가하기공감좋아요0훈훈해요0슬퍼요0화나요0후속기사 원해요0댓글‘닷컴 버블’, ‘서브프라임모기지 사태’, 그리고 ‘코로나19 쇼크’. 21세기 들어 세계 경제를 강타한 주요 위기 들이다.‘인터넷’, ‘스마트폰’ 코로나19 이전 주요 위기와 함께 이뤄진 혁신들이다.위기가 가져 온 충격은 짧았지만, 인터넷과 스마트폰이 몰고 온 변화는 위기 이후 10여년간 세계경제의 성장동력이었다. 인터넷이 촉발한 글로벌화는 중국 등 신흥국 경제를 부흥시켰고 우리 중화학 공업이 큰 수혜를 입었다. 애플과 페이스북이 이끈 스마트폰 혁신은 모바일 기기의 폭발적 수요로 이어졌고 우리 반도체 산업도 큰 돈을 벌었다. 그렇게 지난 20년 우리 경제는 글로벌 혁신 흐름에 참여해왔다.코로나19 이후 세계 경제를 이끌 혁신은 뭘까? 이에 대한 답이 앞으로 10년간 우리 경제의 운명을 결정할지 모른다. 최근 반등한 글로벌 증시의 내용을 살펴보면 힌트를 찾아보자.주가 지수 자체는 코로나19가 대유행(pandemic) 단계 이전 수준에 근접했다. 하지만 시장 지도를 보면 판세가 달라졌다. 개인들이 믿고 샀던 삼성전자나 SK하이닉스 등 기존의 간판주들의 반등은 상대적으로 미약했다. 대신 삼성바이오, 네이버, LG생활건강, 카카오, 엔씨소프트 등의 주가 상승이 눈에 띈다. 헬스케어와 ‘언택트(Untact)’ 관련주들이다. 미국에서도 기존 FAANG(페이스북, 애플, 아마존, 넷플릭스, 구글)의 선전과 함께 생명공학 관련주들의 반등이 두드러진다.스토리를 입혀보자. 글로벌화로 질병 전염의 범위와 속도가 빨라지면서 의학과 위생관리가 중요해진다. 인간 간 접촉이 최소화되면서 사이버 공간에서의 경제활동이 활발해진다. 신흥국의 값싼 인건비를 활용한 대량생산 체제보다는, 소비시장에 근접한 곳에서 로봇을 활용한 최적 생산 체제가 선호된다. 데이터와 이를 인공지능(AI)을 기반으로 한 플랫폼이 경제의 새로운 운영체제(OS)로 작동한다.우리 경제는 이 같은 스토리에 얼마나 준비돼 있을까? 바이오 주가가 많이 올랐지만, 여전히 신뢰는 낮다. 신약 개발보다는 ‘기대감’을 미끼로 주가를 끌어올려 뱃속을 채우려는 곳들이 적지 않아 보인다. 데이터 경제는 여전히 ‘육성’보다는 ‘개인정보 보호’에 무게가 실리면서 각종 규제에 덜컥거리고 있다. 데이터 관련 분야인 AI 연구도 취약하다. 게임이나 인터넷서비스, 위생관리 부분은 경쟁력이 있어 보이지만 장래를 낙관하기 어렵다. 미국은 금융위기 이후 모바일과 AI, 자율주행, 셰일가스 분야에서 창업과 도전이 잇따랐다. 양적완화로 풀린 돈 상당 부분이 이 같은 도전의 밑바탕이 됐다. 우리의 경우 저금리로 풀린 돈은 주로 부동산에 흘러갔다. 기업들은 현업을 유지하는 수준의 투자에만 머물렀다.코로나19로 다들 어렵다고 난리다. 그래서 정부 주도로 천문학적 자금이 풀리고 있다. 정부 재정이 튼튼한 편이라지만 ‘화수분’은 아니다. 코로나19 때문인지, 아니면 경쟁력 자체가 없어서인지 구분할 때다. 한계기업에 대한 지원은 ‘밑빠진 독’이 될 가능성이 크다. 일자리가 아무리 중요해도 세금으로 허상을 유지할 수는 없다. 아무리 급하지만 새로운 혁신을 이끌 수 있는 도전에 더 많은 자원이 배분되도록 애를 써야 한다.▶[디;콘] 우리동네 젠트리피케이션 위험도는?▶코로나 19 현황보기 ▶전국 농수축산물 소비 캠페인 - Copyrights ⓒ 헤럴드경제 & heraldbiz.com, 무단 전재 및 재배포 금지 -헤럴드경제 관련뉴스해당 언론사에서 선정하며 언론사 페이지(아웃링크)로 이동해 볼 수 있습니다.\'나눔의 집\' 후원금 논란…유재석 측 ""가슴 아파해""\'탈옥수\' 신창원 감시용 CCTV 철거…""인권 침해"" 의견 수용전두환 아들 전재국, 본인 월급만 44% 인상…주주 지적에 ""무례하다""\'토트넘 복귀\' 손흥민, 깜찍 \'V 인증\'…""누가 돌아왔는지 보세요""한국, WHO 집행이사국 선출…""코로나19 적극 공유""좋아요0훈훈해요0슬퍼요0화나요0후속기사 원해요0기사제공 :']"
