,회사명,날짜,언론사,기사제목,링크,본문
13,NC soft, 2020-05-2009:58,서울경제 ,엔씨소프트 '될성 부른' AI 인재 키운다,https://finance.naver.com/news/news_read.nhn?article_id=0003740010&office_id=011&mode=search&query=엔씨&page=1,"['       엔씨소프트 \'될성 부른\' AI 인재 키운다      기사입력2020-05-20 09:58기사원문좋아요훈훈해요좋아요 평가하기공감좋아요0훈훈해요0슬퍼요0화나요0후속기사 원해요0댓글대학동아리 대상 \'펠로우십\' 운영[서울경제] 엔씨소프트(036570)가 AI(인공지능) 인재를 육성하기 위해 대학 동아리를 대상으로 펠로우십 과정을 운영한다.엔씨소프트(대표 김택진)는 20일 AI 인재 육성 프로그램 ‘2020 NC Fellowship(2020 엔씨 펠로우십)’을 진행한다고 밝혔다.지난 2018년부터 진행해 3회째인 엔씨 펠로우십은 국내 주요 대학의 AI·전산 관련 동아리가 참여해 교육, 과제수행 등을 통해 AI 연구에 대한 경험과 지식을 쌓을 수 있는 프로그램이다. 올해는 국내 대학 8개 동아리에서 16개 팀이 참가한다.참가자들은 1년간 엔씨의 AI 전문연구원들과 함께 과제를 수행하게 된다. 여름·겨울방학 시기를 거쳐 사전과제, 온라인 AI 교육, AI 개발 과제 등을 진행한다. 딥러닝을 포함한 최신 AI 알고리즘을 적용해 미니게임 AI를 개발하는 과제를 수행한다. 게임 내 유닛을 생산하고 컨트롤해 상대를 제압하는 전략 RTS(Real Time Strategy) 게임 AI 개발 훈련이 목표다.프로그램 마지막에는 최종 결과물을 발표하고 각 팀이 개발한 게임 AI의 리그 대결을 펼쳐 순위를 결정하는 대회를 연다. 1위 우승팀과 2위 준우승팀에게는 총 1,000만 원 규모의 상금이 주어진다. 우수 참가자에게는 엔씨 AI 센터에서 근무할 수 있는 인턴십 기회를 제공한다.이경종 엔씨 AI센터 게임AI랩 실장은 “NC Fellowship은 AI 기술을 체계적으로 학습하고 경험해 AI 인재로 성장할 수 있는 프로그램”이라며 “참가자들이 직접 게임 AI를 개발하는 경험을 통해 전문성을 키울 수 있는 시작을 함께하길 바란다”고 말했다.엔씨는 지난 2011년부터 AI 연구개발을 시작해 현재 약 150명 이상의 전문 연구인력을 보유하고 있다. 현재 AI 센터와 NLP(Natural Language Processing·자연어처리) 센터 산하에 5개 연구소를 운영 중이다./오지현기자 ohjh@sedaily.com[서울경제 바로가기]▶ 네이버 채널에서 \'서울경제\' 구독해주세요!▶ 세상 모든 것에 대해 던지는 질문, 왜(WHY)?저작권자 ⓒ 서울경제, 무단 전재 및 재배포 금지서울경제 관련뉴스해당 언론사에서 선정하며 언론사 페이지(아웃링크)로 이동해 볼 수 있습니다.\'10억 로또\' 아크로서울포레스트···\'줍줍\' 26만명 몰렸다관련 확진자 벌써 25명···""무직"" 학원강사 거짓말에 \'n차 감염\' 일파만파이유비 \'20년은 어려보이는 상큼함\' 그럼 유치원생이야?송영길, \'쉼터 논란\' 윤미향 파문에 ""부친 컨테이너에 살아···최소한의 예의 있어야""한소희, 이렇게 섹시할 수 있나? 보기만 해도 빠져드는 매력덩어리좋아요0훈훈해요0슬퍼요0화나요0후속기사 원해요0기사제공 :']"
14,NC soft, 2020-05-2009:55,뉴시스 ,"엔씨, AI 인재 육성 프로그램 진행…인턴십 기회 제공",https://finance.naver.com/news/news_read.nhn?article_id=0009870962&office_id=003&mode=search&query=엔씨&page=1,"['       엔씨, AI 인재 육성 프로그램 진행…인턴십 기회 제공      기사입력2020-05-20 09:55기사원문좋아요훈훈해요좋아요 평가하기공감좋아요0훈훈해요0슬퍼요0화나요0후속기사 원해요0댓글국내 대학의 AI·전산 관련 동아리 참여엔씨 AI 연구원들과 \'게임 AI 개발 과제\' 등 수행[서울=뉴시스] 오동현 기자 = 엔씨소프트가 인공지능(AI) 인재 육성 프로그램 \'2020 NC Fellowship\'을 진행한다.\'NC Fellowship\'은 국내 주요 대학의 AI·전산 관련 동아리가 참여해 교육, 과제수행 등을 통해 AI 연구에 대한 경험과 지식을 쌓을 수 있는 엔씨의 AI 인재 육성 프로그램이다. 한해동안 엔씨의 AI 전문연구원들과 함께 과제를 수행하면서 참가자들이 AI 인재로 성장할 수 있도록 지원한다. 지난 2018년부터 진행해 올해로 3회를 맞이했다.올해는 국내 대학 8개의 동아리에서 총 16개 팀이 참가한다. 참가자들은 딥러닝을 포함한 최신 AI 알고리즘을 적용해 미니게임 AI를 개발하는 과제를 수행한다. 게임 내 유닛을 생산하고 컨트롤해 상대를 제압하는 전략 RTS(Real Time Strategy)  게임 AI 개발 훈련이 목표다.프로그램 마지막에는 최종 결과물을 발표하고, 각 팀이 개발한 게임 AI의 리그 대결을 펼쳐 순위를 결정하는 대회를 연다. 1위 우승팀과 2위 준우승팀에는 총 1000만 원 규모의 상금이 주어진다. 우수 참가자에게는 엔씨 AI 센터에서 근무할 수 있는 인턴십 기회가 주어진다.엔씨 AI센터 게임AI랩(Lab) 이경종 실장은 “NC Fellowship은 AI 기술을 체계적으로 학습하고 경험해 AI 인재로 성장할 수 있는 프로그램”이라며 “참가자들이 직접 게임 AI를 개발하는 경험을 통해 전문성을 키울 수 있는 시작을 함께하길 바란다”고 말했다. 엔씨는 지난 2011년부터 AI 연구개발을 시작해 현재 약 150명 이상의 전문 연구인력이 근무 중이다. 현재 AI 센터와 NLP(Natural Language Processing, 자연어처리) 센터 산하에 5개 연구소(Lab)를 운영 중이다.☞공감언론 뉴시스 odong85@newsis.com▶ 네이버에서 뉴시스 구독하기▶ K-Artprice, 유명 미술작품 가격 공개▶ 뉴시스 빅데이터 MSI 주가시세표 바로가기<ⓒ 공감언론 뉴시스통신사. 무단전재-재배포 금지>뉴시스 관련뉴스해당 언론사에서 선정하며 언론사 페이지(아웃링크)로 이동해 볼 수 있습니다.육군 장교, 가족 동반 회식서 여군 부하를 강제로…27세男 \'마스크 쓰라\'는 와플가게 직원에 총 들더니…""文대통령 암살계획"" 허위신고에 경찰 폭행…2심도 징역형전쟁게임 즐기면서 ""양심적 병역거부"", 유죄…징역형\'갤럭시노트20\' 디자인 유출…전작과 비교해보니좋아요0훈훈해요0슬퍼요0화나요0후속기사 원해요0기사제공 :']"
15,NC soft, 2020-05-2009:23,머니투데이 ,1년만에 700선 복귀한 코스닥…코스피는 숨고르기,https://finance.naver.com/news/news_read.nhn?article_id=0004411634&office_id=008&mode=search&query=엔씨&page=1,"['       1년만에 700선 복귀한 코스닥…코스피는 숨고르기      기사입력2020-05-20 09:23기사원문좋아요훈훈해요좋아요 평가하기공감좋아요0훈훈해요0슬퍼요0화나요0후속기사 원해요0댓글 [머니투데이 김사무엘 기자] (서울=뉴스1) 이동해 기자 = 19일 서울 중구 하나은행 명동점 딜링룸 전광판에 코스피 지수가 전 거래일보다 43.50포인트 오른 1,980.61, 코스닥은 전 거래일보다 5.51포인트 오른 696.36, 원/달러 환율은 76.1원 내린 1225.3원을 나타내고 있다. 2020.5.19/뉴스1코스피 지수가 2000선 회복을 눈앞에 두고 숨고르기 중인 반면 코스닥 지수는 약 1년만에 700선을 돌파했다. 전날 급등에 따른 차익실현 매물 출회와 코로나19(COVID-19) 백신에 대한 의문 등은 부정적 요인이지만 외국인과 기관의 수급이 유입되면서 증시는 혼조세를 나타내고 있다.20일 오전 9시20분 기준 코스피 지수는 전일 대비 0.09포인트(0%) 내린 1980.52를 기록 중이다. 시작은 0.43% 하락으로 출발했지만 외국인과 기관의 매수세 덕분에 하락폭을 줄이고 있다.외국인은 전날에 이어 이날도 66억원 어치 순매수 중이다. 기관도 569억원 어치 순매수다. 개인은 차익실현에 나서며 621억원 어치 순매도 하고 있다.업종별로는 음식료품이 1%대 강세고 보험, 서비스업, 통신업 등도 상승 중이다. 반면 운수장비와 운수창고, 건설업, 은행 등은 약세다.시가총액 상위 주요 종목 중에서는 삼성전자가 1%대 미만 하락률을 나타내고 있다. SK하이닉스도 약보합세다. NAVER, 삼성SDI, LG생활건강, 엔씨소프트 등은 1% 안팎 상승률을 기록 중이다.코스닥 지수는 전일 대비 9.41포인트(1.35%) 오른 705.77을 기록하고 있다. 코스닥 지수가 장중 700선을 넘은 것은 지난해 6월28일 이후 11개월만이다. 외국인이 161억원 순매도 중인 가운데 개인이 152억원, 기관이 29억원 순매수하며 지수를 끌어올리고 있다.코스닥 시총 상위 종목 중에서는 셀트리온제약이 3%대 강세고, 셀트리온헬스케어 역시 1% 이상 상승 중이다. 씨젠, 케이엠더블유, 스튜디오드래곤, 에코프로비엠 등도 강세를 보이고 있다.김사무엘 기자 samuel@mt.co.kr▶줄리아 투자노트▶조 변호사의 가정상담소 ▶머니투데이 구독하기 <저작권자 ⓒ \'돈이 보이는 리얼타임 뉴스\' 머니투데이, 무단전재 및 재배포 금지>머니투데이 관련뉴스해당 언론사에서 선정하며 언론사 페이지(아웃링크)로 이동해 볼 수 있습니다.정준영 구치소 근황 ""형님들이 시키면 일어나 노래""이태원 클럽 터진 후… 연예계 또 \'생일 파티\' 논란나사 ""거대 소행성, 지구로 날아오는중…21일 접근""""연봉 3배에 아파트까지"" 뿌리칠 수 없는 유혹에 중국 갔지만…中 ""D램 개발"" 자신감…알고보니 삼성 인력 빼내기좋아요0훈훈해요0슬퍼요0화나요0후속기사 원해요0기사제공 :']"
16,NC soft, 2020-05-2008:53,서울경제 ,"엔씨소프트, 신작 모멘텀 내년까지···5~6월이 매수 적기",https://finance.naver.com/news/news_read.nhn?article_id=0003739924&office_id=011&mode=search&query=엔씨&page=1,"['       엔씨소프트, 신작 모멘텀 내년까지···5~6월이 매수 적기      기사입력2020-05-20 08:53기사원문좋아요훈훈해요좋아요 평가하기공감좋아요0훈훈해요0슬퍼요0화나요0후속기사 원해요0댓글 [서울경제] 미래에셋대우 리포트엔씨소프트(036570)의 신작 모멘텀이 하반기부터 내년까지 이어질 전망이다. 미래에셋대우는 “5월 중순까지 상황을 판단하면 엔씨소프트는 2·4분기에 기대치를 상회하는 실적을 기록할 것”이라며 투자의견 ‘매수’ 목표주가 97만원을 유지했다. 김창권 미래에셋대우 연구원은 20일 “지난달 다소 부진했던 리니지2M 일매출액 흐름은 이달 들어 회복한 것으로 분석된다”라고 설명했다. 실제로  지난 1·4분기 실적발표 당시 리니지2M의 일매출액은 지난해 4·4분기 42억원, 올해 1·4분기 38억원 수준으로 집계됐다. 전작인 리니지M도 2020년 들어 가장 양호한 일매출액을 기록 중이다. 최근의 글로벌 게임주 랠리는 엔씨소프트, 액티비전 블리자드와 같은 초대형 게임 콘텐츠 지적재산권(IP)를 보유한 대형 게임 기업에 대한 투자자들의 관심으로 해석된다. 김 연구원은 “미국 액티비전 블리자드는 올 하반기 ‘콜오브듀티’ 신작, ‘월드오브워크래프트’ 확장팩, ‘디아블로 이모탈’ 등의 출시가 예정돼 신작 모멘텀이 기대되고 있다”라며“엔씨소프트도 올 하반기 리니지2M의 일본, 대만 등 해외 진출을 앞두고 있다”라고 설명했다. 또한 “신작 프로젝트 TL의 베타테스트, 블레이드앤소울2 국내 출시 등 신작 일정도 구체화된 상황”이라며 “인건비 등 비용지출이 2분기에는 1분기보다 급감할 것으로 예상되는 점도 호재”라고 말했다. 외국인 매수세가 주가의 중요한 변수다. 그는 “리니지M과 리니지2M 등 주력 게임 매출 흐름이 안정되고 인건비 등 비용지출이 2·4분기에는 1·4분기보다 급감할 것”이라며 “2·4분기 실적 기대감이 높아지고 있다”고 말했다. 또한 “하반기 리니지2M 일본과 대만 등 해외진출, 블래이드앤소울2 국내 출시 등 신작 일정이 구체화되면서 주가 모멘텀이 이어질 것”이라며 “5월과 6월이 하반기 주가 레벨업 구간을 염두에 둔 좋은 진입 시점으로 판단된다”고 밝혔다./서지혜기자 wise@sedaily.com[서울경제 바로가기]▶ 네이버 채널에서 \'서울경제\' 구독해주세요!▶ 세상 모든 것에 대해 던지는 질문, 왜(WHY)?저작권자 ⓒ 서울경제, 무단 전재 및 재배포 금지서울경제 관련뉴스해당 언론사에서 선정하며 언론사 페이지(아웃링크)로 이동해 볼 수 있습니다.관련 확진자 벌써 25명···""무직"" 학원강사 거짓말에 \'n차 감염\' 일파만파이유비 \'20년은 어려보이는 상큼함\' 그럼 유치원생이야?송영길, \'쉼터 논란\' 윤미향 파문에 ""부친 컨테이너에 살아···최소한의 예의 있어야""한소희, 이렇게 섹시할 수 있나? 보기만 해도 빠져드는 매력덩어리술취해 112에 ""문재인 대통령 암살계획 있다"" 허위신고한 50대 2심도 실형좋아요0훈훈해요0슬퍼요0화나요0후속기사 원해요0기사제공 :']"
17,NC soft, 2020-05-2008:49,아이뉴스24 ,"[I-리포트] 엔씨소프트, 5~6월 좋은 매수 타이밍-미래에셋대우",https://finance.naver.com/news/news_read.nhn?article_id=0000539103&office_id=031&mode=search&query=엔씨&page=1,"['       [I-리포트] 엔씨소프트, 5~6월 좋은 매수 타이밍-미래에셋대우      기사입력2020-05-20 08:49기사원문좋아요훈훈해요좋아요 평가하기공감좋아요0훈훈해요0슬퍼요0화나요0후속기사 원해요0댓글투자의견 \'매수\'·목표주가 97만원 유지[아이뉴스24 류은혁 기자] 미래에셋대우는 20일 엔씨소프트에 대해 5~6월이 좋은 매수 타이밍이라며 투자의견 \'매수\'와 목표주가 97만원을 유지했다.미래에셋대우는 올해 하반기부터 내년까지 신작 모멘텀이 이어지면서 게임시장 변혁기로 엔씨소프트와 같은 대형 멀티플랫폼 RPG 게임 개발사에 관심이 쏠릴 것으로 전망했다. 실제로 나스닥 게임주, 특히 액티비전 블리자드와 엔씨소프트의 주가가 동조화 되는 현상이 관찰되고 있다.김창권 미래에셋대우 연구원은 ""외국인 매수세가 엔씨소프트 주가에 중요한 결정 변수""라며 ""액티비전 블리자드는 엔씨소프트와 비슷하게 2020년 하반기에 콜오브듀티 신작과 월드오브워크래프트 확장팩, 디아블로 이모탈 출시가 예정돼 있어 신작 모멘텀이 기대되는데다 디아블로4, 오버워치2 등의 대작 출시 가능성도 회자되고 있다""고 말했다.이어 ""리니지M과 리니지2M 등 주력 게임 매출 흐름이 안정되고 인건비 등 비용지출이 2분기에는 1분기보다 급감할 것""이라며 ""2분기 실적 기대감이 높아지고 있다""고 덧붙였다.김 연구원은 ""하반기 리니지2M 일본과 대만 등 해외진출, 블래이드앤소울2 국내 출시 등 신작 일정이 구체화되면서 주가 모멘텀이 이어질 것""이라며 ""5월과 6월이 하반기 주가 레벨업 구간을 염두에 둔 좋은 진입 시점으로 판단된다""고 밝혔다.류은혁기자 ehryu@inews24.com▶네이버 채널에서 \'아이뉴스24\'를 구독해주세요.▶재밌는 아이뉴스TV 영상보기  ▶아이뉴스24 바로가기[ⓒ 아이뉴스24 무단전재 및 재배포 금지]아이뉴스24 관련뉴스해당 언론사에서 선정하며 언론사 페이지(아웃링크)로 이동해 볼 수 있습니다.애플, 코로나19에 아이폰 價 자존심 접었다\'차이나는 클라스\' 문정인 교수 ""코로나 이후 세계질서의 주인공은…""펄어비스 ""섀도우 아레나, 종합격투기 같은 게임 될 것""[반포3주구戰 ②] 대우건설, 위법 OS요원 동원…음식배달부터 물품·향응까지홈앤쇼핑, 개운치 않은 새 수장…결국 朴 정권 KB지주 출신 김옥찬좋아요0훈훈해요0슬퍼요0화나요0후속기사 원해요0기사제공 :']"
18,NC soft, 2020-05-2008:34,아시아경제 ,[클릭 e종목] 2분기도 기대치 뛰어넘을 엔씨소프트,https://finance.naver.com/news/news_read.nhn?article_id=0004681631&office_id=277&mode=search&query=엔씨&page=1,"['       [클릭 e종목] 2분기도 기대치 뛰어넘을 엔씨소프트      기사입력2020-05-20 08:34기사원문좋아요훈훈해요좋아요 평가하기공감좋아요0훈훈해요0슬퍼요0화나요0후속기사 원해요0댓글건재한 리니지M, 회복하는 리니지2M…하반기 신작 출시도 호재[아시아경제 이민우 기자] 엔씨소프트가 2분기에도 기대치를 웃도는 실적을 기록할 것으로 전망됐다. 리니지M, 리니지2M 등 주력 게임 매출 흐름이 안정되고 인건비 등 비용지출이 1분기 대비 급감하면서 양호한 성과를 달성할 것이라는 분석이다.20일 미래에셋대우는 엔씨소프트에 대해 투자의견 \'매수\'를 유지하고 목표주가를 97만원으로 6.6% 올렸다. 이달 중순까지의 상황을 고려하면 2분기에는 기대치를 웃도는 실적을 기록할 것이라는 판단에서다.실제로 지난달 다소 부진했던 리니지2M 일매출액 흐름은 이달 들어 회복한 것으로 분석된다. 지난 1분기 실적발표 당시 리니지2M의 일매출액은 지난해 4분기 42억원, 올해 1분기 38억원 수준으로 나타났다. 전작인 리니지M도 2020년 들어 가장 양호한 일매출액을 기록 중이다. 지난해 4분기 일매출액으로 23억9000만원, 1분기 일매출액은 23억6000만원으로 큰 변화 없는 수준이다.미국 나스닥 시장의 게임주와 주가 동조화 현상도 나타나고 있다. 지난해 4분기 이후 특히 액티비전 블리자드의 주가와 유사한 흐름을 보이고 있다. 액티비전 블리자드는 올 하반기 \'콜오브듀티\' 신작, \'월드오브워크래프트\' 확장팩, \'디아블로 이모탈\' 등의 출시가 예정돼 신작 모멘텀이 기대되고 있다. 엔씨소프트도 올 하반기 리니지2M의 일본, 대만 등 해외 진출을 앞두고 있다. 신작 프로젝트 TL의 베타테스트, 블레이드앤소울2 국내 출시 등 신작 일정도 구체화된 상황이다. 그 밖에도 인건비 등 비용지출이 2분기에는 1분기보다 급감할 것으로 예상되는 점도 호재다. 이에 따라 미래에셋대우는최근의 글로벌 게임주 랠리는 엔씨소프트, 액티비전 블리자드와 같은 초대형 게임 콘텐츠 지적재산권(IP)를 보유한 대형 게임 기업에 대한 투자자들의 관심으로 해석된다. 김창권 미래에셋대우 연구원은 ""지난해 구글, 아마존 등 글로벌 기업들이 클라우드 게임 서비스를 시작하는 한편 올해 하반기 온라인 연결과 멀티플랫폼 기능이 강화된 소니의 플레이스테이션5, 마이크로소프의 엑스박스 X 등이 출시된다""며 ""이 같은 상황 속에서 엔씨소프트와 액티비전 블리자드는 올해 하반기부터 내년까지 수년 만에 신작 모멘텀이 이어질 것으로 기대된다""고 설명했다.이민우 기자 letzwin@asiae.co.kr▶ 2020년 하반기, 재물운·연애운·건강운 체크!▶ 네이버에서 아시아경제 뉴스를 받아보세요 ▶ 놀 준비 되었다면 드루와!  드링킷!<ⓒ경제를 보는 눈, 세계를 보는 창 아시아경제 무단전재 배포금지>아시아경제 관련뉴스해당 언론사에서 선정하며 언론사 페이지(아웃링크)로 이동해 볼 수 있습니다.정준영 구치소 근황 ""노래 해봐라 시키면 일어서서…""""韓 라면은 필수로 쟁여놔야"" 전세계 사재기 열풍""서세원 외도 당시…"" 서정희 뒤늦은 고백北 전투 태세 돌입…주민 수만명 논밭으로 출격획기적 백신이라더니…\'모더나\' 부정적 주장에 \'추락\'좋아요0훈훈해요0슬퍼요0화나요0후속기사 원해요0기사제공 :']"
19,NC soft, 2020-05-2008:18,이데일리 ,"엔씨소프트, 지금이 진입 타이밍…신작 모멘텀 기대-미래",https://finance.naver.com/news/news_read.nhn?article_id=0004644567&office_id=018&mode=search&query=엔씨&page=1,"['       엔씨소프트, 지금이 진입 타이밍…신작 모멘텀 기대-미래      기사입력2020-05-20 08:18기사원문좋아요훈훈해요좋아요 평가하기공감좋아요0훈훈해요0슬퍼요0화나요0후속기사 원해요0댓글 [이데일리 이광수 기자] 미래에셋대우는 엔씨소프트(036570)에 대해 하반기부터 내년까지 수년 만에 신작 모멘텀이 이어질 것이라며 5~6월이 좋은 매수 타이밍이라고 설명했다. 투자의견은 ‘매수’, 목표가는 97만원을 각각 유지했다. 김창권 미래에셋대우 연구원은 20일 “최근의 글로벌 게임주 랠리는 엔씨소프트, 액티비전 블리자드와 같은 초대형 게임 콘텐츠 지적재산권(IP)을 가진 대형 게임 기업에 대한 투자자들의 관심”이라며 이같이 분석했다. 김 연구원은 “구글과 아마존 등 글로벌 빅테크들이 클라우드 게임 서비스를 작년부터 시작했다”며 “올해 하반기 온라인 연결과 멀티플랫폼 기능이 강화된 소니의 플레이스테이션5, 마이크로소프트의 엑스박스 X가 출시된다”고 설명했다. 올해 하반기는 엔씨소프트와 액티비전 블리자드 등은 내년까지 신작 모멘텀이 이어지는 등 게임시장 변혁기로 엔씨소프트와 같은 대형 멀티플랫폼 RPG 게임 개발사에 관심이 쏠리고 있다는 게 그의 설명이다. 실제로 나스닥 게임주, 특히 액티비전 블리자드와 엔씨소프트의 주가가 동조화 되는 현상이 관찰되고 있다. 김 연구원은 “외국인 매수세가 엔씨소프트 주가에 중요한 결정 변수”라며 “액티비전 블리자드는 엔씨소프트와 비슷하게 2020년 하반기에 콜오브듀티 신작과 월드오브워크래프트 확장팩, 디아블로 이모탈 출시가 예정돼 있어 신작 모멘텀이 기대되는데다 디아블로4, 오버워치2 등의 대작 출시 가능성도 회자되고 있다”고 말했다. 이어 그는 “리니지M과 리니지2M 등 주력 게임 매출 흐름이 안정되고 인건비 등 비용지출이 2분기에는 1분기보다 급감할 것”이라며 “2분기 실적 기대감이 높아지고 있다”고 말했다. 그는 “하반기 리니지2M 일본과 대만 등 해외진출, 블래이드앤소울2 국내 출시 등 신작 일정이 구체화되면서 주가 모멘텀이 이어질 것”이라며 “5월과 6월이 하반기 주가 레벨업 구간을 염두에 둔 좋은 진입 시점으로 판단된다”고 밝혔다.이광수 (gs88@edaily.co.kr)네이버에서 ‘이데일리’ 구독하기▶청춘뉘우스~ 스냅타임▶＜ⓒ종합 경제정보 미디어 이데일리 - 무단전재 & 재배포 금지＞이데일리 관련뉴스해당 언론사에서 선정하며 언론사 페이지(아웃링크)로 이동해 볼 수 있습니다.쉼없이 오르는 서울 전셋값…전월세 상한제 카드 꺼내나""송영길, 윤미향 아닌 이용수 할머니께 예의 갖춰야""""감정 일깨워준 사람"" 구본승♥안혜경, 속마음 고백전두환 아들, 본인 월급만 \'파격 인상\' 지적에 ""무례하다""\'대통령 비하, 살인 희화\' 또 일베..아프리카 BJ 어쩌나좋아요0훈훈해요0슬퍼요0화나요0후속기사 원해요0기사제공 :']"
