,회사명,날짜,언론사,기사제목,링크,본문
7,NC soft, 2020-01-0714:30,전자신문 ,"[투데이 포커스]엔씨소프트 주가 사흘째 상한가...""리니지2M 흥행덕""",https://finance.naver.com/news/news_read.nhn?article_id=0002861150&office_id=030&mode=search&query=엔씨&page=1,"['       [투데이 포커스]엔씨소프트 주가 사흘째 상한가...""리니지2M 흥행덕""      기사입력2020-01-07 14:30기사원문좋아요훈훈해요좋아요 평가하기공감좋아요0훈훈해요0슬퍼요0화나요0후속기사 원해요0댓글 엔씨소프트 주가가 \'리니지2M\' 흥행과 함께 사흘째 오름세를 보이고 있다.7일 오후 2시 기준 엔씨소프트는 전거래일 대비 2.59% 오른 59만4000원에 거래되고 있다. 지난 3일부터 최근 3거래일 동안 오름세다. 전일에 이어 이날도 장중 한때 52주 신고가를 경신했다.최근 출시된 리니지2M이 좋은 반응을 보이면서 주가가 더 오를 것이라는 낙관론이 우세하다.이베스트투자증권은 엔씨소프트 4분기 매출이 5381억원, 영업이익은 1855억원을 기록할 것이라고 전망했다.이베스트투자증권은 엔씨소프트에 대해 “단기 및 중장기 모멘텀이 모두 우수하고 밸류에이션도 저평가 상태로서 게임주 중 단연 톱픽”이라며 목표주가 70만원과 투자의견 \'매수\'를 유지했다.성종화 이베스트투자증권 연구원은 “리니지2M은 론칭 후 줄곧 구글, 애플 매출순위 1위를 유지하는 등 빅히트와 롱런을 시현하고 있다”며 “\'리니지2M\'의 4분기 일평균 매출을 30억원 중반 정도로 추정하고 있으며 \'리니지M\' \'리니지\' 등은 \'리니지2M\' 빅히트에 따른 카니발 영향이 전혀 없는 것으로 파악된다”고 분석했다.이어 “올해 1분기까지 강력한 실적모멘텀이 지속될 것”이라며 “1분기 연결실적은 매출 6182억원, 영업이익 2390억원으로 추정한다”고 덧붙였다.한국투자증권도 목표주가 72만원, 투자의견 \'매수\'를 유지했다. 기존 게임의 안정된 매출 위에 \'리니지2M\'이 안착했다고 평가했다.정호윤 한국투자증권 연구원은 “리니지M과 2M의 연속 흥행 성공으로 엔씨소프트가 보유한 IP의 영향력뿐 아니라 개발력까지 입증됐다”며 “신작이 출시될 때마다 이익규모 또한 크게 레벨업 된다는 점이 확인됐기 때문에 향후 아이온2, 블소2 등 신작이 여전히 대기 중인 엔씨소프트는 장기적으로 이익 및 주가 상승여력이 크게 남아 있는 상태”라고 말했다.<자료: 엔씨소프트, 이베스트투자증권 리서치센터>김지혜기자 jihye@etnews.com▶ 네이버 홈에서 [전자신문] 구독하기▶ 전자신문 바로가기 [Copyright ⓒ 전자신문 & 전자신문인터넷, 무단전재 및 재배포 금지]전자신문 관련뉴스해당 언론사에서 선정하며 언론사 페이지(아웃링크)로 이동해 볼 수 있습니다.금융권 \'정맥인증\' 독식...일본 기술종속 우려기아차, ""받지 못하는 \'쏘렌토 하이브리드\' 세제혜택 우리가 부담할 것""성윤모 장관 ""일본 주장한 수출규제 사유 모두 해소…원상회복 촉구""AI로 \'코로나19\' 잡는다...국내에서 \'캐글\'에 데이터셋 제공정부, ""원가 후려쳐 생산중단"" 이덴트와 협의...공적물량 95% 계약완료좋아요0훈훈해요0슬퍼요0화나요0후속기사 원해요0기사제공 :']"
8,NC soft, 2020-01-0714:12,이데일리 ,"엔씨소프트, 신규 CI 공개",https://finance.naver.com/news/news_read.nhn?article_id=0004550485&office_id=018&mode=search&query=엔씨&page=1,"['       엔씨소프트, 신규 CI 공개      기사입력2020-01-07 14:12기사원문좋아요훈훈해요좋아요 평가하기공감좋아요0훈훈해요0슬퍼요0화나요0후속기사 원해요0댓글엔씨소프트 CI 슬로건 하단형. 엔씨 제공[이데일리 노재웅 기자] 엔씨소프트(036570)는 CI(기업 이미지)를 리뉴얼했다고 7일 밝혔다.NC의 컷팅된 모서리는 최첨단 기술력을 상징하고, N과 C를 연결함으로써 회사의 고유 과제인 ‘즐거움으로 연결된 새로운 세상’을 표현했다.CI는 또 브랜드 슬로건 ‘Window to the Future(미래를 보는 창)’와 함께 슬로건 하단형, 슬로건 우측형, 기본 로고형으로 제작됐다.엔씨 측은 “새로운 CI는 진지함이 깃든 장인정신과 열정, 끊임없는 도전의 의미를 담고 있다. 브랜드 슬로건은 미래에 대한 비전을 제시하겠다는 의지를 나타낸다”고 설명했다.노재웅 (ripbird@edaily.co.kr)네이버 홈에서 ‘이데일리’ 뉴스 [구독하기▶]꿀잼가득 [영상보기▶] , 청춘뉘우스~ [스냅타임▶]＜ⓒ종합 경제정보 미디어 이데일리 - 무단전재 & 재배포 금지＞이데일리 관련뉴스해당 언론사에서 선정하며 언론사 페이지(아웃링크)로 이동해 볼 수 있습니다.펜벤다졸 이어 아스피린 품절?...암세포 자살 유도고유정 ""쟤 죽여버릴까"" 극언 공개..\'짜증\' 헛웃음\'블랙 아이스\' 사고 영상..""빨리 내려, 또 온다!"" 아찔폭탄선언 예고한 곤 ""日정부가 쿠데타 개입""박은혜 ""이혼 결사반대한 母, 아직도 화낸다"" 눈물좋아요0훈훈해요0슬퍼요0화나요0후속기사 원해요0기사제공 :']"
9,NC soft, 2020-01-0713:59,한국경제TV ,"엔씨소프트, 새로운 CI·슬로건 공개…""미래를 보는 창""",https://finance.naver.com/news/news_read.nhn?article_id=0000836938&office_id=215&mode=search&query=엔씨&page=1,"['       엔씨소프트, 새로운 CI·슬로건 공개…""미래를 보는 창""      기사입력2020-01-07 13:59기사원문좋아요훈훈해요좋아요 평가하기공감좋아요0훈훈해요0슬퍼요0화나요0후속기사 원해요0댓글[한국경제TV 이지효 기자]엔씨소프트는 새 기업 이미지(CI)와 브랜드 슬로건을 7일 발표했다.새 CI는 깎아낸 모서리로 최첨단 기술력을 상징하고, N과 C를 연결해 \'즐거움으로 연결된 새로운 세상\'을 표현했다.엔씨 측은 ""새로운 CI는 진지함이 깃든 장인정신과 열정, 그리고 끊임없는 도전의 의미를 담고 있다""고 의미를 설명했다.한편 엔씨는 브랜드 슬로건을 \'Window to the Future(미래를 보는 창)\'로 정했다.이번에 바뀐 브랜드 슬로건은 미래에 대한 비전을 제시하겠다는 의지를 나타낸다고 회사 측은 전했다.이지효기자 jhlee@wowtv.co.kr▶[이벤트] 한국경제TV 채널설정하면 LG노트북·안마의자 쏩니다! ▶ 대한민국 재테크 총집결! - [증권 / 주식상담 / 부동산]ⓒ 한국경제TV, 무단 전재 및 재배포 금지한국경제TV 관련뉴스해당 언론사에서 선정하며 언론사 페이지(아웃링크)로 이동해 볼 수 있습니다.송가인 공연취소 사과, 칭찬 쏟아지는 이유는?아스피린, 대장암 잡는다? ""암세포 자살 유도""브래드 피트, 송강호 손 덥석 잡으며 ""당신의 팬""한예슬 \'코피어싱\' 파격 비주얼…누리꾼 깜짝화천 산천어축제 겨울비에 \'초비상\'…강원 곳곳 축제 중단좋아요0훈훈해요0슬퍼요0화나요0후속기사 원해요0기사제공 :']"
10,NC soft, 2020-01-0710:57,연합뉴스 ,"엔씨소프트, 새 CI·슬로건 공개…""미래를 보는 창""",https://finance.naver.com/news/news_read.nhn?article_id=0011319246&office_id=001&mode=search&query=엔씨&page=1,"['       엔씨소프트, 새 CI·슬로건 공개…""미래를 보는 창""      기사입력2020-01-07 10:57기사원문좋아요훈훈해요좋아요 평가하기공감좋아요0훈훈해요0슬퍼요0화나요0후속기사 원해요0댓글[엔씨소프트 제공]    (서울=연합뉴스) 홍지인 기자 = 엔씨소프트는 7일 새 기업 이미지(CI)와 브랜드 슬로건을 발표했다.    새 CI는 깎아낸 모서리(Cutting Edge)로 최첨단 기술력을 상징하고, N과 C를 연결해 \'즐거움으로 연결된 새로운 세상\'을 표현했다.    회사 측은 ""새로운 CI는 진지함이 깃든 장인정신과 열정, 그리고 끊임없는 도전의 의미를 담고 있다""고 설명했다.    브랜드 슬로건은 \'Window to the Future(미래를 보는 창)\'로 정했다. 이는 미래에 대한 비전을 제시하겠다는 의지를 나타낸다고 회사 측은 전했다.    ljungberg@yna.co.kr▶확 달라진 연합뉴스 웹을 만나보세요▶네이버 [연합뉴스] 채널 구독   ▶뭐 하고 놀까? #흥연합뉴스 관련뉴스해당 언론사에서 선정하며 언론사 페이지(아웃링크)로 이동해 볼 수 있습니다.\xa0영국 사상최다 성폭행범 체포…범행대상은 남성\xa0설특집 \'전국노래자랑\'에 \'대체 MC\'…송해 건강은\xa0""피트 형님이 뭐라 했는지""…골든글로브 수상 인터뷰\xa0\'컬링 돌풍\' 송유진의 신중한 투구…미모 돋보여\xa01년에 레드카드 3장 손흥민 ""첼시전 퇴장 고통""…이유는좋아요0훈훈해요0슬퍼요0화나요0후속기사 원해요0기사제공 :']"
11,NC soft, 2020-01-0710:56,아시아경제 ,'韓게임 중국 판호' 팔짱낀 외교부,https://finance.naver.com/news/news_read.nhn?article_id=0004601349&office_id=277&mode=search&query=엔씨&page=1,"['       \'韓게임 중국 판호\' 팔짱낀 외교부      기사입력2020-01-07 10:56기사원문좋아요훈훈해요좋아요 평가하기공감좋아요0훈훈해요0슬퍼요0화나요0후속기사 원해요0댓글게임학회 ""수출길 열어달라"" 3년째 호소에 외교부 ""공감한다"" 여전히 말뿐[아시아경제 이진규 기자] 한국게임학회가 한국 게임의 중국 판호(유통허가권) 발급 문제와 관련해 외교부에 적극적인 개입을 요청했지만 별다른 소득을 거두지 못한 것으로 알려졌다. 외교 채널을 가동해 3년째 이어지는 중국 판호 발급 제한을 풀어보려 했지만 이마저도 여의치 않은 상황에 처한 것이다. 이처럼 국내 게임의 중국 수출길이 막힌 사이 중국 게임의 국내 시장 장악력은 확대되면서 국내 게임 업계는 위기감을 호소하고 있다.7일 게임 업계에 따르면 한국게임학회는 최근 외교부 관계자들을 만나 판호 문제 현황과 우리측 입장을 설명하고, 중국 정부에 판호 발급을 강하게 요청해줄 것을 건의했다. 지난해에도 4차례에 걸쳐 강경화 외교부 장관에게 판호 문제에 관한 견해와 대책을 묻는 공문을 발송했다. 이 같은 노력에도 지난해 12월23일 열린 한중 정상회담에서 판호 발급에 대한 논의는 끝내 이뤄지지 않았다. 마땅한 입장을 밝히지 않던 외교부는 최근에서야 ""판호 문제 해결 필요성에 공감하고, 노력하고 있다""는 의사를 학회 측에 전달한 것으로 전해졌다.한국게임학회장을 맡고 있는 위정현 중앙대 교수는 ""외교부가 나서야 판호 문제가 해결될 수 있다""고 설명했다. 그동안 민간 차원에서 문제 해결에 노력했지만 한계가 있었던 만큼 정부가 적극 개입해야 한다는 점을 강조한 것이다. 업계 관계자는 ""그동안 정부는 판호 문제에 별다른 관심을 보이지 않았다""며 서운한 감정을 내비쳤다. 한국게임학회는 지난해 초에도 문화체육관광부를 통해 중국 내 학계와 민간 차원에서 교류하며 중국 정부 측에 판호 발급 재개 필요성을 전달하려 했지만, 문체부는 1년 동안 이에 대한 명확한 답변을 내지 않고 있는 것으로 전해졌다.판호 발급이 중단되면서 국내 게임업체들의 중국 수출 규모는 급감했다. 한국콘텐츠진흥원의 \'2019 대한민국 게임백서\'에 따르면 국내 게임업체들의 중화권 지역(대만ㆍ홍콩 포함) 수출 비중은 2017년 60.5%에서 2018년 46.5%으로 14%포인트 감소했다. 판호 발급을 기다리고 있는 한국 게임은 엔씨소프트의 \'리니지 레드나이츠\'를 비롯해 넷마블의 \'리니지2 레볼루션\', 펄어비스의 \'검은사막 모바일\' 등이다. 반면 중국 게임업체들은 한국 시장에서 지난해 2조원가량의 매출을 올리며 국내 시장을 잠식하고 있다. 중국 시청각디지털출판협회 게임위원회의 \'2019년 중국 게임산업 보고서\'에 따르면 중국 게임업체들은 지난해 한국에서 1조9160억원대 매출을 기록했다. 국내 앱 마켓 매출 상위권도 릴리스게임즈의 \'라이즈 오브 킹덤즈\' 등 중국산 모바일 게임들이 장악하고 있다. 업계 관계자는 ""중국 판호 발급 제한은 정부 차원에서 해결해야 하는 사안""이라며 ""정부가 기존의 소극적인 입장에서 벗어나 보다 적극적으로 중국 정부에 협조를 요청해야 한다""고 지적했다.이진규 기자 jkme@asiae.co.kr▶ 2020년 경자년(庚子年), 나의 신년운세와 토정비결은?▶ 네이버에서 아시아경제 뉴스를 확인하세요. ▶ 놀 준비 되었다면 드루와! 드링킷!<ⓒ경제를 보는 눈, 세계를 보는 창 아시아경제 무단전재 배포금지>아시아경제 관련뉴스해당 언론사에서 선정하며 언론사 페이지(아웃링크)로 이동해 볼 수 있습니다.장지연 ""강용석 부인이 김건모 소개, 명품백은…""진중권에 한방 날린 정봉주 ""공부 안해, 대학때…""이본 ""납치범, 나에게 슈퍼카 프로포즈""北 자폭형 무인공격기 100여대 배치…우리는 고작제주 간 포방터 돈가스에 경찰 출동…반전좋아요0훈훈해요0슬퍼요0화나요0후속기사 원해요0기사제공 :']"
12,NC soft, 2020-01-0710:39,서울경제 ,"""미래를 보는 창"" 엔씨소프트 CI 리뉴얼",https://finance.naver.com/news/news_read.nhn?article_id=0003676651&office_id=011&mode=search&query=엔씨&page=1,"['       ""미래를 보는 창"" 엔씨소프트 CI 리뉴얼      기사입력2020-01-07 10:39기사원문좋아요훈훈해요좋아요 평가하기공감좋아요0훈훈해요0슬퍼요0화나요0후속기사 원해요0댓글 [서울경제] 엔씨소프트(036570)가 기업이미지(CI)를 리뉴얼 했다고 7일 밝혔다. 새 CI는 진지함이 깃든 장인정신과 열정, 그리고 끊임없는 도전의 의미를 담았다고 엔씨소프트는 설명했다. 잘린 모서리는 최첨단 기술력을 상징하며, N과 C가 연결돼 회사의 고유 미션인 ‘즐거움으로 연결된 새로운 세상’을 표현했다.새 CI는 브랜드 슬로건 ‘미래를 보는 창(Window to the Future)’과 함께 슬로건 하단형, 슬로건 우측형, 기본 로고형으로 제작됐다. 또한 미래에 대한 비전을 제시하겠다는 의지를 담아냈다고 회사측은 설명했다. /백주원기자 jwpaik@sedaily.com엔씨소프트의 신규 CI ‘슬로건 우측형’/사진제공=엔씨소프트[서울경제 바로가기]▶ 세계 최대 가전박람회 CES2020, 서울경제와 함께 하세요!▶ 네이버 채널에서 \'서울경제\' 채널 구독해주세요! 저작권자 ⓒ 서울경제, 무단 전재 및 재배포 금지서울경제 관련뉴스해당 언론사에서 선정하며 언론사 페이지(아웃링크)로 이동해 볼 수 있습니다.""송가인도 안타까워"" 역대 최악 호주 산불···칠레·아르헨까지 도달음란행위 동영상 유출된 말라가CF 감독 직무정지 ""성추행 당하고 있다""모텔생활 하다 ""계속 울어서"" 2개월 아이 폭행···의식불명 만든 20대父오늘도 \'섹시발랄\' 홍진영 ""고등학생 같아, 어떻게 봐도 예쁘네""7개월 아기 \'영하 20도\'에 방치해 숨지게 한 비정한 엄마좋아요0훈훈해요0슬퍼요0화나요0후속기사 원해요0기사제공 :']"
13,NC soft, 2020-01-0710:36,아시아경제 ,"엔씨, 신규 CI 공개…""장인정신과 열정, 도전 의미""",https://finance.naver.com/news/news_read.nhn?article_id=0004601762&office_id=277&mode=search&query=엔씨&page=1,"['       엔씨, 신규 CI 공개…""장인정신과 열정, 도전 의미""      기사입력2020-01-07 10:36기사원문좋아요훈훈해요좋아요 평가하기공감좋아요0훈훈해요0슬퍼요0화나요0후속기사 원해요0댓글[아시아경제 이진규 기자] 엔씨소프트는 기업 이미지(CI)를 새롭게 변경했다고 7일 밝혔다.엔씨 관계자는 ""새로운 CI는 진지함이 깃든 장인정신과 열정, 끊임없는 도전의 의미를 담고 있다""고 설명했다. 또 ""NC의 컷팅된 모서리는 최첨단 기술력을 상징하고. N과 C를 연결함으로써 회사의 고유 미션인 \'즐거움으로 연결된 새로운 세상\'을 표현했다""고 전했다.새로운 CI는 브랜드 슬로건 \'미래를 보는 창(Window to the Future)\'과 함께 슬로건 하단형, 슬로건 우측형, 기본 로고형 등 3가지로 제작됐다.이진규 기자 jkme@asiae.co.kr▶ 2020년 경자년(庚子年), 나의 신년운세와 토정비결은?▶ 네이버에서 아시아경제 뉴스를 확인하세요. ▶ 놀 준비 되었다면 드루와! 드링킷!<ⓒ경제를 보는 눈, 세계를 보는 창 아시아경제 무단전재 배포금지>아시아경제 관련뉴스해당 언론사에서 선정하며 언론사 페이지(아웃링크)로 이동해 볼 수 있습니다.장지연 ""강용석 부인이 김건모 소개, 명품백은…""진중권에 한방 날린 정봉주 ""공부 안해, 대학때…""이본 ""납치범, 나에게 슈퍼카 프로포즈""北 자폭형 무인공격기 100여대 배치…우리는 고작제주 간 포방터 돈가스에 경찰 출동…반전좋아요0훈훈해요0슬퍼요0화나요0후속기사 원해요0기사제공 :']"
14,NC soft, 2020-01-0710:26,파이낸셜뉴스 ,"엔씨소프트, CI 리뉴얼",https://finance.naver.com/news/news_read.nhn?article_id=0004353717&office_id=014&mode=search&query=엔씨&page=1,"['       엔씨소프트, CI 리뉴얼      기사입력2020-01-07 10:26기사원문좋아요훈훈해요좋아요 평가하기공감좋아요0훈훈해요0슬퍼요0화나요0후속기사 원해요0댓글[파이낸셜뉴스] ㈜엔씨소프트가 기업 이미지(CI)를 리뉴얼 했다고 7일 밝혔다.  새로운 CI는 진지함이 깃든 장인정신과 열정, 그리고 끊임없는 도전의 의미를 담고 있다.  NC의 컷팅된 모서리는 최첨단 기술력을 상징한다. N과 C를 연결함으로써 회사의 고유 미션인 ‘즐거움으로 연결된 새로운 세상’을 표현했다.  CI는 브랜드 슬로건 ‘Window to the Future(미래를 보는 창)’와 함께 슬로건 하단형, 슬로건 우측형, 기본 로고형으로 제작됐다. 미래에 대한 비전을 제시하겠다는 의지를 나타낸다는 설명이다.   true@fnnews.com 김아름 기자   ▶ 헉! 소리나는 스!토리 뉴스 [헉스]▶ 클릭해, 뉴스 들어간다 [뉴스쿨] ▶ 세상에 이런일이 [fn파스]  ※ 저작권자 ⓒ 파이낸셜뉴스. 무단 전재-재배포 금지파이낸셜뉴스 관련뉴스해당 언론사에서 선정하며 언론사 페이지(아웃링크)로 이동해 볼 수 있습니다.전광훈 목사 주도 집회 간 김구라, 험악해진 분위기에..역술인 김효성 ""대통령은 타고난 사주도 좋지만..""심혈관 질환 예방하려면 먹어야 할 음식, 매일 꼭..김진태 충격 폭로 ""지난 2017년 대선 후보 경선 때..""100억원대 오징어 싹쓸이한 일당 21명, 4년간..좋아요0훈훈해요0슬퍼요0화나요0후속기사 원해요0기사제공 :']"
