,회사명,날짜,언론사,기사제목,링크,본문
19,NC soft, 2020-01-0709:02,뉴시스 ,"[빅데이터MSI]시장심리 톱5, LG전자·SKC·LG생활건간·기업은행·엔씨소프트",https://finance.naver.com/news/news_read.nhn?article_id=0009641530&office_id=003&mode=search&query=엔씨&page=1,"['       [빅데이터MSI]시장심리 톱5, LG전자·SKC·LG생활건간·기업은행·엔씨소프트      기사입력2020-01-07 09:02기사원문좋아요훈훈해요좋아요 평가하기공감좋아요0훈훈해요0슬퍼요0화나요0후속기사 원해요0댓글시장심리 워스트5, 삼성카드·한국가스공사·대림산업·한온시스템·대한항공[서울=뉴시스] 김제이 기자 = 7일 빅데이터 시장심리지수(MSI)가 가장 높은 \'톱5\'에 LG전자·SKC·LG생활건간·기업은행·엔씨소프트가 선정됐다.이는 뉴시스와 코스콤이 주요 상장기업 250곳에 대해 공동 분석해 산출해 낸 빅데이터 MSI(http://m.newsis.com/stock.html, 모바일 전용)로 전 거래일 오후 4시부터 이날 오전 8시까지 데이터를 취합한 결과다.LG전자의 시장심리지수는 전 거래일에서 4단계 오른 7단계 \'매우 좋음\'을 나타냈다. 관련 키워드로는 인공지능, 라스베이거스, 올레, 기술, 사장, 가전, 세계, 현지시간 등이 뽑혔다.SKC의 시장심리지수는 전 거래일과 같은 7단계로 집계됐다. 연관 키워드로는 배터리, 기술, 모빌리티, 세계, 인수, 기술력, 사장, 서비스 등이 꼽혔다.LG생활건강의 시장심리지수는 7단계 \'매우 좋음\'으로 전 거래일에서 4단계 상승했다. 온라인에서는 프로폴리스, 화장품, 고객, 중동, 상품, 신라, 피부, 크림 등이 주로 검색됐다.기업은행의 MSI지수는 전 거래일에서 6단계 급등한 7단계를 나타냈다. 핵심 키워드로는 행장, 노조, 출근, 은행, 저지, 블록체인, 본점, 은행장 등이 선정됐다.엔씨소프트의 MSI지수는 7단계 \'매우 좋음\'으로 전 거래일과 같았다. 주요 키워드로는 코덱스, 등락률, 레버리지, 은행, 모바일게임, 섹터, 시장심리지수, 리니지 등이 꼽혔다.시장심리가 낮은 \'워스트5\'에는 삼성카드·한국가스공사·대림산업·한온시스템·대한항공이 꼽혔다.삼성카드의 시장심리지수는 전 거래일 대비 두 단계 내린 1단계 \'매우 나쁨\'을 기록했다. 관련 키워드로는 토스, 카드, 카드사, 고객, 사장, 발급, 다운사이징, 수수료 등이 꼽혔다.한국가스공사의 시장심리지수는 1단계로 전 거래일 대비 5단계 내렸다. 연관 키워드로는 석유, 가스, 수급, 중동, 원유, 비축유, 동향, 산업통상자원부 등이 뽑혔다.대림산업의 시장심리지수는 전 거래일 대비 2단계 하락한 1단계를 나타냈다. 온라인에서는 등락률, 조합, 입찰, 자동차, 연초, 시공사, 단지, 건설사 등이 주로 검색됐다.한온시스템의 MSI지수는 1단계로 전 거래일 대비 2단계 내렸다. 핵심 키워드로는 등락률, 개발, 증권플러스, 조선비즈, 자체, 연관, 날짜, 단위 등이 선정됐다.대한항공의 MSI지수는 전 거래일과 동일한 1단계 \'매우 나쁨\'을 기록했다. 인터넷에서는 마일리지, 사단급, 델타, 무인정찰기, 부대, 남편, 항공사, 항공 등이 주로 검색됐다.MSI는 총 7단계로 나뉜다. 1단계 \'매우 나쁨\', 2단계 \'나쁨\', 3단계 \'약간 나쁨\', 4단계 \'보통\', 5단계 \'약간 좋음\', 6단계 \'좋음\', 7단계 \'매우 좋음\' 등으로 분류된다.MSI 레벨이 가장 낮은 수준인 1단계에서 가장 높은 수준인 7단계 쪽으로 바뀌면 해당 종목에 대해 온라인상에서의 반응이 부정에서 긍정으로 바뀌고 있다는 뜻으로 풀이할 수 있다.한편 2017년 8월1일부터 선보인 빅데이터 MSI 모바일 전용 버전은 구글플레이 또는 애플 앱스토어에서 \'뉴시스\' 앱을 내려받거나 뉴시스 모바일 홈페이지(m.newsis.com)에 접속한 뒤 메인화면의 \'빅데이터 MSI\'를 클릭해 이용하면 된다.※ 빅데이터MSI는 투자 참고용이며, 투자 결과에 책임을 지지 않습니다. 주식시장에서는 다양한 국내외 변수가 존재하기 때문에 한 지표로만 판단하면 뜻하지 않은 결과를 초래할 수 있습니다.☞공감언론 뉴시스 jey@newsis.com▶ K-Artprice 모바일 오픈! 미술작품 가격을 공개합니다▶ 뉴시스 채널 구독하고 에어팟 프로 받아가세요▶ 뉴시스 빅데이터 MSI 주가시세표 바로가기 <저작권자ⓒ 공감언론 뉴시스통신사. 무단전재-재배포 금지.>뉴시스 관련뉴스해당 언론사에서 선정하며 언론사 페이지(아웃링크)로 이동해 볼 수 있습니다.""돈 들어온다"" 속설에 몸값 높아진 은행 달력일하다 만난 고객 딸 꾀어내 4년간 성폭행""쟤 죽여버릴까"" 고유정 통화내역 공개여행 가방에 가둬 숨진 5세 딸…국과수 1차 소견은?""왜 다른 X한테 전화번호 줘"" 창문 뜯고 들어간 男 결국좋아요0훈훈해요0슬퍼요0화나요0후속기사 원해요0기사제공 :']"
0,NC soft, 2020-01-0708:54,이데일리 ,한국 게임산업 10년째 성장세…글로벌 게임 점유율 4위 유지,https://finance.naver.com/news/news_read.nhn?article_id=0004550127&office_id=018&mode=search&query=엔씨&page=2,"['       한국 게임산업 10년째 성장세…글로벌 게임 점유율 4위 유지      기사입력2020-01-07 08:54기사원문좋아요훈훈해요좋아요 평가하기공감좋아요0훈훈해요0슬퍼요0화나요0후속기사 원해요0댓글문체부·콘진원 ‘2019 대한민국 게임백서’ 발간국내 게임시장 전체 규모 및 성장 추이. 한국콘텐츠진흥원 제공[이데일리 노재웅 기자] 한국 게임산업이 10년째 성장세를 이어온 것으로 나타났다. 세계 게임시장에서도 미국, 중국, 일본에 이어 4위 자리를 공고히 했다.7일 문화체육관광부와 한국콘텐츠진흥원이 최근 발간한 ‘2019 대한민국 게임백서’에 따르면 2018년 국내 게임산업 매출액은 전년대비 8.7% 증가한 14조2902억원으로 집계됐다. 수출액 또한 64억1149만달러(약 7조546억원)로 전년대비 8.2% 증가했다.◇한국 게임산업 주력 부문은 모바일모바일게임은 지난 2017년 처음 PC게임 시장의 규모를 넘어선 후, 2018년에도 한국 게임 산업에서 지배적인 위치를 유지했다.2018년 모바일게임 매출액은 6조6558억원으로 전체 게임산업 매출액의 46.6%를 차지했으며, 전년대비 7.2%의 성장률을 보였다.엔씨소프트(036570) ‘리니지M’, 넷마블(251270) ‘리니지2 레볼루션’ 등 2017년에 출시돼 큰 인기를 얻었던 게임들이 안정적인 운영을 지속한 동시에 펄어비스(263750) ‘검은사막 모바일’ 등 2018년 출시된 게임 또한 성공을 이어가며 2018년 모바일 게임시장의 성장을 뒷받침한 것으로 파악된다.이어 PC게임 매출액은 5조236억원(점유율 35.1%), 콘솔게임 매출액은 5485억원(3.7%), 아케이드게임 매출액은 1854억원(1.3%)을 각각 기록하며 모든 게임 플랫폼에서 전년대비 매출이 증가한 것으로 나타났다.PC게임은 전년대비 10.6% 성장했다. 성장요인은 모바일게임과 유사하게 펍지 ‘배틀그라운드’, 넥슨 ‘던전앤파이터’ 등 기존 인기 게임들의 안정적인 운영과 스마일게이트 ‘로스트아크’ 등 신작의 초반 흥행에 의한 것으로 풀이된다.특히 콘솔게임은 41.5%로 전년대비 큰 성장률을 보였다. 닌텐도 스위치의 판매 호조로 인해 콘솔게임 타이틀 구매가 늘어나고, ‘배틀그라운드’, ‘테라’ 등 기존 게임 IP(지식재산권)의 콘솔버전 출시가 성장에 힘을 더한 것으로 보인다.  ◇한국 PC게임 세계 2위 차지..특히 강세2018년 세계 게임시장 규모는 전년대비 7.1% 증가한 1783억6800만달러(약 196조2583억원)로 나타났다. 세계 시장에서 한국의 점유율은 6.3%로 상위 10개국 중 미국, 중국, 일본에 이어 지난해와 동일하게 4위를 지켰다.플랫폼별로 살펴보면 PC게임의 점유율은 13.9%로 상위 10개국 중 중국에 이어 2위를 차지하며, 2017년 잠시 미국에 내주었던 순위를 다시 회복했다. 모바일게임의 점유율은 9.5%로 상위 10개국 중 중국, 일본, 미국에 이어 지난해와 같이 4위를 기록했다.2018년 한국 게임산업의 수출액 규모는 전년대비 8.2% 증가한 64억1149만달러(7조546억 원)로 집계됐다. 수출액 비중은 중국(30.8%), 미국(15.9%), 대만·홍콩(15.7%), 일본(14.2), 동남아(10.3%), 유럽(6.5%)의 순서로 나타났다. 수입액 규모 또한 전년대비 16.3% 증가한 3억 578만달러(3365억원)로 집계됐다.다양한 게임산업 정보들을 수록한 ‘2019 대한민국 게임백서’는 올해부터 유상판매 대신 웹상에서 무료로 찾아볼 수 있게 됐다. 게임산업에 관심이 있는 사람은 누구나 콘진원 누리집에서 게임백서를 받을 수 있다.노재웅 (ripbird@edaily.co.kr)네이버 홈에서 ‘이데일리’ 뉴스 [구독하기▶]꿀잼가득 [영상보기▶] , 청춘뉘우스~ [스냅타임▶]＜ⓒ종합 경제정보 미디어 이데일리 - 무단전재 & 재배포 금지＞이데일리 관련뉴스해당 언론사에서 선정하며 언론사 페이지(아웃링크)로 이동해 볼 수 있습니다.""유튜브가 뭐라고""…아임뚜렛의 \'일장춘몽\'""정도껏 멍청해야 XX"" 의사들 폭언·성희롱까지...\'블랙 아이스\' 사고 영상..""빨리 내려, 또 온다!"" 아찔현빈·손예진, 결혼·결별설에 사실무근\'보니하니\' 폭행 논란 최영수, BJ 복귀→""또 욕먹고""좋아요0훈훈해요0슬퍼요0화나요0후속기사 원해요0기사제공 :']"
1,NC soft, 2020-01-0708:26,이데일리 ,"엔씨소프트, 리니지2M 흥행에 호실적 기대…목표가↑-한국",https://finance.naver.com/news/news_read.nhn?article_id=0004550095&office_id=018&mode=search&query=엔씨&page=2,"['       엔씨소프트, 리니지2M 흥행에 호실적 기대…목표가↑-한국      기사입력2020-01-07 08:26기사원문좋아요훈훈해요좋아요 평가하기공감좋아요0훈훈해요0슬퍼요0화나요0후속기사 원해요0댓글[이데일리 박정수 기자] 한국투자증권은 7일 엔씨소프트(036570)에 대해 모바일 게임 리니지2M 흥행에 호실적이 기대된다며 목표주가를 65만원에서 72만원으로 10.8% 상향 조정했다. 투자의견은 매수를 유지했다.정호윤 한국투자증권 연구원은 “엔씨소프트의 작년 4분기 영업이익은 1766억원으로 지난해 같은 때보다 56.9% 증가할 것”이라며 “리니지2M의 4분기 평균 예상 일매출액은 40억원 수준으로 예상돼 모바일게임 매출액이 큰 폭으로 늘어날 것으로 예상하기 때문”이라고 설명했다.정 연구원은 특히 “출시 초기 특유의 다양한 노이즈에도 불구하고 리니지2M은 국내 모바일게임 시장의 대세로 자리 잡았다”며 “많은 인기 크리에이터들이 리니지2M으로 넘어와 게임을 플레이하고 있고 일반 유저들 사이에서도 게임에 대한 긍정적인 평가가 이어지고 있다”고 전했다.그는 “리니지M과 리니지2M의 흥행 장기화가 이어지는 가운데 하반기 새로운 신작의 출시와 리니지2M의 해외 진출이 예정대로 이루어질 경우 올해 엔씨소프트의 이익 규모가 크게 올라가는 새로운 원년이 될 가능성이 크다”고 강조했다.한편 엔씨소프트의 올해 영업이익은 9530억원으로 전년 대비 85.4% 증가할 것으로 전망됐다.박정수 (ppjs@edaily.co.kr)네이버 홈에서 ‘이데일리’ 뉴스 [구독하기▶]꿀잼가득 [영상보기▶] , 청춘뉘우스~ [스냅타임▶]＜ⓒ종합 경제정보 미디어 이데일리 - 무단전재 & 재배포 금지＞이데일리 관련뉴스해당 언론사에서 선정하며 언론사 페이지(아웃링크)로 이동해 볼 수 있습니다.""유튜브가 뭐라고""…아임뚜렛의 \'일장춘몽\'""정도껏 멍청해야 XX"" 의사들 폭언·성희롱까지...\'블랙 아이스\' 사고 영상..""빨리 내려, 또 온다!"" 아찔현빈·손예진, 결혼·결별설에 사실무근\'보니하니\' 폭행 논란 최영수, BJ 복귀→""또 욕먹고""좋아요0훈훈해요0슬퍼요0화나요0후속기사 원해요0기사제공 :']"
2,NC soft, 2020-01-0708:25,서울경제 ,"“엔씨소프트, 리니지2M 빅히트로 실적 모멘텀 계속될 것”",https://finance.naver.com/news/news_read.nhn?article_id=0003676535&office_id=011&mode=search&query=엔씨&page=2,"['       “엔씨소프트, 리니지2M 빅히트로 실적 모멘텀 계속될 것”      기사입력2020-01-07 08:25기사원문좋아요훈훈해요좋아요 평가하기공감좋아요0훈훈해요0슬퍼요0화나요0후속기사 원해요0댓글이베스트투자증권 리포트[서울경제] 이베스트투자증권(078020)이 7일 엔씨소프트(036570)에 대해 지난해 4분기 실적이 전 분기 대비 큰 폭의 호전을 보일 것이라고 예상했다. 이에 목표주가 70만원, 투자의견 ‘매수’를 각각 유지했다.성종화 연구원은 “지난해 11월 27일 론칭한 리니지2M은 줄곧 구글, 애플 매출순위 1위를 유지하는 등 빅히트와 롱런을 시현하고 있다”며 “국내 리니지2M의 지난해 4분기 일평균 매출을 30억원 중반 정도로 추정된다”고 설명했다.그는 이어 “이에 엔씨소프트 지난해 4분기 연결영업실적은 매출의 경우 전 분기 대비 35% 증가한 5,381억원, 영업이익은 44% 늘어난 1,855억원으로 전 분기 대비 대폭 호전될 것”이라며 “리니지2M 론칭 인센티브나 리니지2M 관련 마케팅비 급증 등 영업비용도 급증하나 리니지2M 빅히트에 따른 매출 급증이 이를 훨씬 초과할 것으로 예상한다”고 했다. 성 연구원은 또 “지난해 4분기에 이어 올해 1분기까지 강력한 실적 모멘텀을 지속할 것”이라며 “‘리니지2 M’ 매출이 올해 1분기에도 일평균 매출은 하향셋업하나 영업일수의 대폭 증가로 전 분기 대비 대폭 증가할 것으로 예상하기 때문”이라고 강조했다. /이완기기자 kingear@sedaily.com[서울경제 바로가기]▶ 세계 최대 가전박람회 CES2020, 서울경제와 함께 하세요!▶ 네이버 채널에서 \'서울경제\' 채널 구독해주세요! 저작권자 ⓒ 서울경제, 무단 전재 및 재배포 금지서울경제 관련뉴스해당 언론사에서 선정하며 언론사 페이지(아웃링크)로 이동해 볼 수 있습니다.김희선 \'20대 뺨치고 남는 미모\' 양준일 못지 않은 뱀파이어 매력고유정 \'베게 살인사건\' 검색한 뒤 남편에 ""쟤를 죽여버릴까"" 말했다진중권, \'까방권\' 있다는 이종걸에 ""역사왜곡까지 하나···옆으로 좀 빠져라""한예슬, 시상식서 파격 스타일링 \'깜짝\'..스모키 메이크업·코걸이 피어싱\'마약 혐의\' 보람상조 장남 ""잘못했다""···검찰, 징역 4년 구형좋아요0훈훈해요0슬퍼요0화나요0후속기사 원해요0기사제공 :']"
3,NC soft, 2020-01-0707:57,아시아경제 ,"[클릭 e종목]""엔씨소프트, 리니지2M 덕에 호실적 전망""",https://finance.naver.com/news/news_read.nhn?article_id=0004601063&office_id=277&mode=search&query=엔씨&page=2,"['       [클릭 e종목]""엔씨소프트, 리니지2M 덕에 호실적 전망""      기사입력2020-01-07 07:57기사원문좋아요훈훈해요좋아요 평가하기공감좋아요0훈훈해요0슬퍼요0화나요0후속기사 원해요0댓글한국투자증권, 투자의견 \'매수\'·목표주가 72만원 제시…6일 종가 57만9000원[아시아경제 금보령 기자] \'리니지2M\' 덕분에 엔씨소프트가 호실적을 나타낼 것으로 분석됐다.7일 한국투자증권에 따르면 엔씨소프트의 지난해 4분기 매출액과 영업이익은 각각 5274억원, 1766억원으로 예상된다. 전년과 비교하면 각각 32.%, 56.9% 증가한 수치다.정호윤 한국투자증권 연구원은 ""출시 초기 특유의 다양한 노이즈에도 불구하고 리니지2M은 국내 모바일게임 시장의 대세로 자리잡았다. 많은 인기 BJ들이 리니지2M으로 넘어와 게임을 플레이하고 있으며, 일반 유저들 사이에서도 게임에 대한 긍정적인 평가가 이어지며 장기 흥행을 위한 긍정적인 분위기가 조성되고 있다""며 ""리니지M과 리니지2M의 흥행 장기화가 이어지는 가운데 하반기 새로운 신작의 출시와 리니지2M의 해외 진출이 예정대로 이뤄질 경우 올해가 엔씨소프트의 이익 규모가 크게 올라가는 새로운 원년이 될 가능성이 높다""고 설명했다.한국투자증권은 엔씨소프트에 대해 투자의견 \'매수\', 목표주가 72만원을 제시했다. 목표주가는 기존 65만원에서 10% 상향조정했다. 6일 종가는 57만9000원이다.금보령 기자 gold@asiae.co.kr▶ 2020년 경자년(庚子年), 나의 신년운세와 토정비결은?▶ 네이버에서 아시아경제 뉴스를 확인하세요. ▶ 놀 준비 되었다면 드루와! 드링킷!<ⓒ경제를 보는 눈, 세계를 보는 창 아시아경제 무단전재 배포금지>아시아경제 관련뉴스해당 언론사에서 선정하며 언론사 페이지(아웃링크)로 이동해 볼 수 있습니다.장지연 ""강용석 부인이 김건모 소개, 명품백은…""진중권에 한방 날린 정봉주 ""공부 안해, 대학때…""스타의 15세 연하 아내 ""평생 배변주머니"" 고백 왜?北 자폭형 무인공격기 100여대 배치…우리는 고작제주 간 포방터 돈가스에 경찰 출동…반전좋아요0훈훈해요0슬퍼요0화나요0후속기사 원해요0기사제공 :']"
4,NC soft, 2020-01-0707:52,한국경제 ,"""엔씨소프트, '리니지2M' 일평균 매출 30억원 추정""-이베스트",https://finance.naver.com/news/news_read.nhn?article_id=0004269254&office_id=015&mode=search&query=엔씨&page=2,"['       ""엔씨소프트, \'리니지2M\' 일평균 매출 30억원 추정""-이베스트      기사입력2020-01-07 07:52기사원문좋아요훈훈해요좋아요 평가하기공감좋아요0훈훈해요0슬퍼요0화나요0후속기사 원해요0댓글 이베스트투자증권은 7일 엔씨소프트에 대해 ""리니지2M이 빅히트를 쳤다""며 목표주가 70만원 투자의견 \'매수\'를 각각 유지했다.이 증권사 성종화 연구원은  ""리니지2M은 론칭 후 줄곧 구글, 애플 매출순위 1위를 유지하는 등 빅히트와 롱런을 시현하고 있다""며 ""국내 리니지2M의 지난해 4분기 일평균 매출은 30억원 중반 정도로 추정된다""고 예측했다.이어 ""이에 따라 엔씨소프트 지난해 4분기 연결영업실적은 매출 5381억원(qoq 35%), 영업이익 1855억원(qoq44%)으로 전분기 대비 대폭 호전될 것""이라고 전망했다.성 연구원은 또 ""리니지2M 론칭 인센티브(100억원 정도)나 리니지2M 관련 마케팅비 급증 등 영업비용도 급증하나 리니지2M 빅히트에 따른 매출 급증이 이를 훨씬 초과할 것""이라며 ""지난해 4분기에 이어 올해 1분기까지 강력한 실적모멘텀이 지속될 것""이라고 예상했다.최수진 한경닷컴 기자 naive@hankyung.com▶ 네이버에서 한국경제 뉴스를 받아보세요▶ 한경닷컴 바로가기  ▶ 모바일한경 구독신청 ⓒ 한국경제 & hankyung.com, 무단전재 및 재배포 금지한국경제 관련뉴스해당 언론사에서 선정하며 언론사 페이지(아웃링크)로 이동해 볼 수 있습니다.""냄비 아니다""…日, 식을줄 모르는 불매에 \'날벼락\'""한국, 위기탈출 \'큰 기회\' 온다""…파격 전망""68세 1억 잃었지만…"" 77세 할머니 \'대박\'""중국, 한국의 7배나 더…"" 삼성·LG전자 \'초비상\'9억이던 부산 수영구 아파트, 한 달새 집값이좋아요0훈훈해요0슬퍼요0화나요0후속기사 원해요0기사제공 :']"
5,NC soft, 2020-01-0707:47,머니투데이 ,"엔씨소프트, 리니지 쌍두마차 출발-한국투자증권",https://finance.naver.com/news/news_read.nhn?article_id=0004335732&office_id=008&mode=search&query=엔씨&page=2,"['       엔씨소프트, 리니지 쌍두마차 출발-한국투자증권      기사입력2020-01-07 07:47기사원문좋아요훈훈해요좋아요 평가하기공감좋아요0훈훈해요0슬퍼요0화나요0후속기사 원해요0댓글 [머니투데이 조준영 기자] 한국투자증권이 7일 엔씨소프트에 대해 ""리니지M과 리니지2M의 흥행 장기화가 이어지는 가운데 하반기 새로운 신작출시와 리니지2M의 해외진출이 예정대로 이뤄질 경우 2020년이 엔씨소프트의 이익규모가 크게 올라가는 새로운 원년이 될 가능성이 높다""고 전망했다. 이에 투자의견 \'매수\', 목표주가는 72만원으로 상향조정했다.정호윤 한국투자증권 CFA는 ""4분기 매출액과 영업이익은 각각 5274억원(+32%, YoY), 1766억원(+56.9%, YoY)을 기록할 것으로 예상된다""며 ""리니지2M의 4분기 평균 예상 일매출액은 40억원 수준으로 추정했으며 이에 따라 모바일게임 매출액은 3549억원으로 크게 증가할 것으로 추정된다""고 밝혔다.정 CFA는 ""출시 초기 특유의 다양한 노이즈에도 불구하고 리니지2M은 국내 모바일게임 시장의 대세로 자리잡았다""며 ""많은 인기 BJ들이 리니지2M으로 넘어와 게임을 플레이하고 있으며 일반 유저들 사이에서도 게임에 대한 긍정평가가 이어지며 장기흥행을 위한 긍정적인 분위기가 조성되고 있다""고 밝혔다.조준영 기자 cho@mt.co.kr▶\'부의 운명\' 바꾸고 싶다면 7가지 바꿔라▶장모 명의로 바뀐 집, 이혼하면… ▶네이버 구독하기 <저작권자 ⓒ \'돈이 보이는 리얼타임 뉴스\' 머니투데이, 무단전재 및 재배포 금지>머니투데이 관련뉴스해당 언론사에서 선정하며 언론사 페이지(아웃링크)로 이동해 볼 수 있습니다.이본 ""과거 납치당해… 납치범이 프러포즈까지""\'美보복\' 예고한 이란, 군사력 알아보니日최대 마라톤서 사라진 \'국뽕\'…아식스의 눈물트와이스 지효, \'웅앵웅\' 논란 사과 ""무대 두려워""(전문)\'언니네쌀롱\' 안현모, 에스닉룩으로 바캉스 패션 연출좋아요0훈훈해요0슬퍼요0화나요0후속기사 원해요0기사제공 :']"
6,NC soft, 2020-01-0707:12,한국경제 ,"""엔씨소프트, 높은 장기투자 매력…목표주가 72만원""",https://finance.naver.com/news/news_read.nhn?article_id=0004269240&office_id=015&mode=search&query=엔씨&page=2,"['       ""엔씨소프트, 높은 장기투자 매력…목표주가 72만원""      기사입력2020-01-07 07:12기사원문좋아요훈훈해요좋아요 평가하기공감좋아요0훈훈해요0슬퍼요0화나요0후속기사 원해요0댓글 한국투자증권은 7일 엔씨소프트에 대해 ""지난해 4분기 매출 5274억원, 영업이익 1766억원으로 호실적이 기대된다""면서 목표주가 \'72만원\', 투자의견 \'매수\'를 제시했다.정호윤 한국투자증권 연구원은 ""기대작 리니지2M의 4분기 일평균 예상 매출은 40억원 수준으로 모바일게임 매출은 3549억원이 추정된다""면서 ""리니지M과 리니지2M의 흥행 장기화가 이어지는 가운데 하반기 새로운 신작의 출시와 리니지2M의 해외 진출이 예정대로 이루어질 경우 올해 엔씨의 이익 규모는 크게 성장할 것""이라 분석했다.정 연구원은 ""리니지M과 2M의 연속 흥행 성공으로 엔씨소프트가 보유한 IP의 영향력뿐만이 아니라 개발력까지 입증됐다""면서 ""신작이 출시될 때마다 이익 규모가 크게 오른다는 점이 확인되면서 장기적으로 이익 및 주가 상승여력이 남아 있는 상태""라고 판단했다.윤진우 한경닷컴 기자 jiinwoo@hankyung.com▶ 네이버에서 한국경제 뉴스를 받아보세요▶ 한경닷컴 바로가기  ▶ 모바일한경 구독신청 ⓒ 한국경제 & hankyung.com, 무단전재 및 재배포 금지한국경제 관련뉴스해당 언론사에서 선정하며 언론사 페이지(아웃링크)로 이동해 볼 수 있습니다.""냄비 아니다""…日, 식을줄 모르는 불매에 \'날벼락\'""한국, 위기탈출 \'큰 기회\' 온다""…파격 전망""68세 1억 잃었지만…"" 77세 할머니 \'대박\'""중국, 한국의 7배나 더…"" 삼성·LG전자 \'초비상\'9억이던 부산 수영구 아파트, 한 달새 집값이좋아요0훈훈해요0슬퍼요0화나요0후속기사 원해요0기사제공 :']"
