,회사명,날짜,언론사,기사제목,링크,본문
0,NC soft, 2020-01-0721:09,이데일리 ,[미리보는 이데일리신문]신용카드처럼…페이도 할부 가능해진다,https://finance.naver.com/news/news_read.nhn?article_id=0004550769&office_id=018&mode=search&query=엔씨&page=1,"['       [미리보는 이데일리신문]신용카드처럼…페이도 할부 가능해진다      기사입력2020-01-07 21:09기사원문좋아요훈훈해요좋아요 평가하기공감좋아요0훈훈해요0슬퍼요0화나요0후속기사 원해요0댓글 [이데일리 노재웅 기자] 다음은 8일자 이데일리 신문 주요 기사다.△1면-신용카드처럼…페이도 할부 가능해진다-정의선 “하늘길 열어 이동 혁신”..2028년 개인비행체 상용화-“투기와의 전쟁, 지지 않겠다” 文대통령, 다주택자 정조준-금융시장 ‘왕좌의 주인’을 찾습니다-[사설]문 대통령의 새해 다짐, 실천으로 뒷받침해야-[사설]규제개혁 필요성 확인시켜 준 CES 전시장△2면 줌인&-트럼프 움직인 ‘슈퍼 매파’..상원 출마 접고 외교·안보 ‘원톱’ 굳혀-기업 10곳 중 6곳 “올해 노사관계 지난해보다 불안”△3면 간편결제 ‘할부 시대’-새 수익원 확보 준비 나선 페이업계..한국판 알리페이로 거듭나나-中선 아이폰도 페이로 할부 구입, 사용자 4억명..신용카드의 1.5배-신용카드업계 “핀테크사 여신 관리 취약..신용 리스크 확대 우려”△4면 세계 최대 ICT 전시회 CES 2020-“헤이 볼리” 외치자..김사장 따라다니며 명령 수행한 ‘공 비서’-사람모습 꼭 빼닮은 디지털 아바타..감정까지 표현하는 인공인간 ‘네온’-방대한 데이터 정복하라..SK하이닉스, 반도체 솔루션 제시△5면 세계 최대 ICT 전시회 CES 2020-하늘·땅 잇는 토털 모빌리티..정의선이 꿈꾼 ‘이동수단 혁신’ 현실로-“올레드에 승부수..하반기 경영정상화 전망”-피부상태 보여주는 AI 거울..K스타트업 기술 시선집중△6면 국제·경제-美, B-52 폭격기 6대 인도양 배치..금융시장은 ‘폭풍전야’-이란 사태에 일·유럽 울고 중·러 웃고-‘대재앙’ 맞은 호주..대한민국 면적만큼 불탔다△8면 文대통령 신년사-총선 핵심 쟁점 된 ‘집값’..지금보다 더 센 부동산 규제 꺼내드나-“이젠 핀셋규제 아닌 전방위 압박 나설 것”-김정은 답방·접경지 협력..北에 구체적 제안-“올해 성장률 상승”..규제 개혁·고용 질 개선 숙제△9면 정치-‘격’ 두고 티격대격..丁 “민생위해 결단”vs野 “국회 위상 깎아”-보수통합 지지부진..새보수당 만난 黃 ‘3대 원칙’ 수용 확답 피해-美 보란 듯..김정은 경제시찰 나서..대북제재 ‘정면돌파’ 신호인 듯-정의용 한·미·일 안보협의차 방미..“한반도 정세 논의”△10면 경제-집값 잡으려면 금융규제가 가장 효과적..보유세 인상은 약발 떨어져-中企·소상공인에 91조 자금 지원..근로·자녀장려금 1200억 조기 집행-경상수지 9개월 만에 늘었지만..수출보다 수입 더 준 ‘불황형 흑자’△11면 금융-소비자 보호 강화 압박에..조직개편 나선 은행-카드사·인터넷은행도 가세..뜨거워지는 해외송금 시장-올해 ‘디지털 손보사’ 잇따라 출범..시장 선점경쟁 예고-우리금융, 사내 벤처제도 ‘우리 어드벤처’ 도입△12면 도전 2020 미래 향해 뛰는 기업들⑤포스코-작업 노하우 데이터화해 IoT로 현장 파악..스마트 기술로 제조업 미래 주도-中맹추격에..고부가가치 제품 ‘新성장동력’ 육성△14면 신차로 반등 노리는 車업계..문제는 노사갈등-‘자유로운 소통’ 강조한 신동빈..새해 첫 행보 ‘구내식당 스킨십’-한화시스템, 사상 최대 실적..오너 3세 승계작업 탄력 받을까-그러지 않아도 어수선한데..항공 빅2, 이란발 악재에 흔들-커지는 OLED패널 시장..삼성·LG 미소△15면 산업·바이오-정부 지원 발맞춰..인도네시아·베트남 주목하는 핀테크 업계-대웅제약·메디톡스 ‘보톡스 전쟁’ 6월께 판결..둘 중 하나는 치명타-“배민 수수료 개편으로 비용 부담 늘 것”..소상공인 반발△16면 소비자생활-집앞이라고 꼭 나와야 하나요..편의점도 ‘배달 전쟁’ 가세-신세계백화점 강남점 국내 첫 연매출 2조 달성-[현장에서]정부 보조금 축내는 물가정보서비스, 1년 넘도록 원가 분석조차 하지 않아-더반찬 ‘프리미엄 차례상’ 19일까지 예약 한정판매△18면 증권&마켓-국민연금이 지분 늘린 17곳 중 15곳 ‘소·부·장’ 기업-작년 ETF 순자산 50조..역대 최고기록 또 깼다-국제 유가 급등에..손실 나던 원유펀드 플러스로 돌아서△19면 증권-2019 최고 해외리츠 펀드 비결..“부지런히 뛰며 누빈 현장에 있죠”-은성수 “IB 신용공여 대상서 SPC·부동산법인 제외 추진”-리니지2M 빅히트에..엔씨소프트 주가 연일 신고가△20면 엔터테인먼트-캐도 캐도 끝없는 ‘영상박물관’ 유튜브..30년 시간여행자를 소환하다-그 시절 미달이 보며 하이킥..‘옛드·옛능’ 다시보기 열풍-“엑스원 해체 죄송합니다”..남도현·이한결 심경 밝혀△22면 Book-“서울 집값 폭락만 바라지 말고..정부에 집 더 지어달라고 요구해야”-‘GDP’ 오르면 잘사는 건가요?-‘시장 큰손’ 2030 여성의 지갑을 열어라-세계 분쟁지역서 펼치는 의사의 ‘인류애’△24면 피플-“‘슈퍼울트라광어’ 개발..국산 횟감 판로 뚫겠다”-‘방송인 서장훈, ARS로 고객인사’..라이나생명 ‘행운드림전화 캠페인’-‘희망 울려 퍼지길’..조수미·임동혁, 화합의 무대-‘내가 회사의 얼굴’..JB금융, 사내 홍보모델 선방-김승미·이혜진 검사 등 5명 ‘2019 따뜻한 검찰인상’-국가인권委 인권위원에 이준일 고려대 로스쿨 교수△25면 오피니언-[목멱칼럼]채권시장이 보내는 경기수축 시그널-[데스크의 눈]위기의 금융 ‘혁신의 시간’ 필요하다-[기자수첩]서울시의 주택공급 통계 뻥튀기△26면 부동산-‘7억 서초 아파트’ 경매 따내려 2억 웃돈 불사-주택임대소득 2000만원 이하도 과세..5월 한달간 세무서에 신고·납부해야-‘이름값이 집값’ 아파트 개명 바람 다시 분다-이르면 3월부터 주택 구입 자금 조달계획서 꼼꼼히 본다△27면 사회-여의도 ‘너구리굴’ 막고, 용산 학교 주변 ‘금연거리’..흡연자 몰아낸다-추미애·윤석열 35분 상견례..“檢개혁 놓고 덕담 주고 받아”-스쿨존 불법 주·정차 땐 벌금 12만원-‘가난하면 못받던’ 청년수당, 중복수급 길 열린다-교육부, 사립대 등록금 인상 요구에 “NO”-감염환자 격리 안하면 산후조리원 업무 정지노재웅 (ripbird@edaily.co.kr)네이버 홈에서 ‘이데일리’ 뉴스 [구독하기▶]꿀잼가득 [영상보기▶] , 청춘뉘우스~ [스냅타임▶]＜ⓒ종합 경제정보 미디어 이데일리 - 무단전재 & 재배포 금지＞이데일리 관련뉴스해당 언론사에서 선정하며 언론사 페이지(아웃링크)로 이동해 볼 수 있습니다.윰댕, 이혼·아들 고백…대도서관 알고 있었다20대 남성 배우, 클럽서 폭행 혐의로 입건…누구?주진모 측 ""휴대전화 해킹 당해…협박 받고 있어""고유정 ""쟤 죽여버릴까"" 극언 공개..\'짜증\' 헛웃음박은혜 ""이혼 결사반대한 母, 아직도 화낸다"" 눈물좋아요0훈훈해요0슬퍼요0화나요0후속기사 원해요0기사제공 :']"
1,NC soft, 2020-01-0720:38,이데일리 ,영업익 1조 클럽 넘보는 엔씨소프트…연초부터 달리는 주가,https://finance.naver.com/news/news_read.nhn?article_id=0004550764&office_id=018&mode=search&query=엔씨&page=1,"['       영업익 1조 클럽 넘보는 엔씨소프트…연초부터 달리는 주가      기사입력2020-01-07 20:38기사원문좋아요훈훈해요좋아요 평가하기공감좋아요0훈훈해요0슬퍼요0화나요0후속기사 원해요0댓글리니지2M 빅히트 + 신작 기대에 \'사상 최고가\'올해 영업익 컨센서스 9790억…1조 돌파 전망도 다수엔씨소프트 주가 추이(표=김다은 기자)[이데일리 김대웅 기자] 게임 대장주 엔씨소프트(036570)가 리니지2M 흥행에 힘입어 연일 상승하며 사상 최고가 행진을 이어가고 있다. 외국인 투자자의 거센 매수세 속에 숏커버링(공매도한 물량을 되사는 것)이 이뤄지며 대차잔고비율도 뚝 떨어졌다. 창사 이후 처음으로 올해 영업이익이 1조원을 넘을 것이란 전망이 나온다.7일 마켓포인트에 따르면 이날 엔씨소프트의 주가는 전일 대비 2.59% 상승한 59만4000원을 기록했다. 지난달 26일부터 두 차례의 보합을 포함해 7거래일 연속 상승 흐름이 이어지며 연일 신고가를 경신하고 있다. 중동발 리스크에 코스피 지수가 출렁이고 있지만 이에 아랑곳하지 않고 고공 행진을 지속하고 있다.지난달 9.74%의 상승률을 기록한데 이어 이달 들어서도 10% 가까이 오른 상태다. 시가총액은 13조원대로 커졌고 외국인 지분율도 두 달 만에 다시 50%대로 높아졌다.특히 가파른 주가 상승에 숏커버링이 함께 나타나며 대차잔고비율이 지난 2015년 7월 이후 4년 반 만에 처음으로 4%대로 낮아졌다. 작년 초만 해도 8%를 넘나들던 비율이 절반 수준으로 뚝 떨어진 것이다. 주가가 연일 고공행진을 펼치자 공매도 투자자 측이 서둘러 숏커버링에 나선 것으로 풀이된다.리니지2M의 빅히트로 실적 고성장이 점쳐지는데다 올해 대기 중인 다수의 신작도 기대를 높이며 엔씨소프트의 주가 강세의 배경으로 작용하는 모습이다. 증권가에서는 신작 모멘텀과 실적 모멘텀이 동시에 작용하고 있는 상황이라며 추가 상승에 무게를 싣고 있다.지난해 11월 말 국내 시장에서 론칭한 리니지2M은 줄곧 구글과 애플 매출 순위 1위를 유지하고 있다. 국내 리니지2M의 작년 4분기 일평균 매출이 30억원 중반 수준에 달할 것으로 이베스트투자증권은 추정했다. 엔씨소프트의 4분기 영업이익 컨센서스는 1844억원으로 전년동기 대비 63.7% 증가할 것으로 전망되고 있다.올해 연간 영업이익 컨센서스는 전년대비 88% 급증한 9790원이다. 유안타증권, 이베스트투자증권, 신영증권 등 다수의 증권사는 영업이익이 1조원을 넘을 것으로 점치고 있다. 이창영 유안타증권 연구원은 “기대했던 신작 리니지2M의 출시 직후 게임 흥행과 관련해 과도한 과금방식 등 여러가지 노이즈가 있었으나, 시장 우려와는 달리 사용자 지표가 견조하게 나타나고 있다”며 “특히 가입자당평균매출(ARPU)이 역대 최고 게임인 리니지M보다 높은 것으로 보인다”고 분석했다.리니지2M가 성공 가도를 달리자 엔씨소프트의 차기 신작에 대한 기대감도 높아지고 있다. 다수의 신작게임 출시가 예정돼 있는 만큼 올해 실적이 고성장하며 영업이익 1조원도 가능하다는 전망도 나온다.성종화 이베스트투자증권 연구원은 “리니지2 M 해외, 블소2, 아이온2, 리니지 W 등 기대신작 일정을 다수 보유하고 있다”며 “단기와 중장기 모멘텀이 모두 우수하고 밸류에이션도 저평가 상태로서 게임주 중 단연 톱픽(최선호 종목)”이라고 밝혔다.김대웅 (daxiong@edaily.co.kr)네이버 홈에서 ‘이데일리’ 뉴스 [구독하기▶]꿀잼가득 [영상보기▶] , 청춘뉘우스~ [스냅타임▶]＜ⓒ종합 경제정보 미디어 이데일리 - 무단전재 & 재배포 금지＞이데일리 관련뉴스해당 언론사에서 선정하며 언론사 페이지(아웃링크)로 이동해 볼 수 있습니다.윰댕, 이혼·아들 고백…대도서관 알고 있었다20대 남성 배우, 클럽서 폭행 혐의로 입건…누구?주진모 측 ""휴대전화 해킹 당해…협박 받고 있어""고유정 ""쟤 죽여버릴까"" 극언 공개..\'짜증\' 헛웃음박은혜 ""이혼 결사반대한 母, 아직도 화낸다"" 눈물좋아요0훈훈해요0슬퍼요0화나요0후속기사 원해요0기사제공 :']"
2,NC soft, 2020-01-0718:37,한국경제 ,"07일, 거래소 기관 순매수상위에 화학 업종 5종목",https://finance.naver.com/news/news_read.nhn?article_id=0004269896&office_id=015&mode=search&query=엔씨&page=1,"['       07일, 거래소 기관 순매수상위에 화학 업종 5종목      기사입력2020-01-07 18:37기사원문좋아요훈훈해요좋아요 평가하기공감좋아요0훈훈해요0슬퍼요0화나요0후속기사 원해요0댓글 기관 투자자는 07일 거래소에서 TIGER 200, 카카오, KODEX 코스닥150 레버리지 등을 중점적으로 사들인 것으로 나타났다.기관 투자자의 순매수 상위 20개 종목은 TIGER 200, 카카오, KODEX 코스닥150 레버리지, LG생활건강, 아모레퍼시픽, SK하이닉스, KODEX 레버리지, 엔씨소프트, 한화케미칼, 신세계인터내셔날등이다.이중에 화학 업종에 속한 종목이 5개 포함되어 있다.TIGER 200, 카카오, KODEX 코스닥150 레버리지 등은 전일 대비 주가가 상승했고, SK하이닉스 등은 주가가 하락했다.[01월07일]거래소 기관 순매수 상위 종목한경로보뉴스이 기사는 한국경제신문과 금융 AI 전문기업 씽크풀이 공동 개발한 기사 자동생성 알고리즘에 의해 실시간으로 작성된 것입니다.▶ 네이버에서 한국경제 뉴스를 받아보세요▶ 한경닷컴 바로가기  ▶ 모바일한경 구독신청 ⓒ 한국경제 & hankyung.com, 무단전재 및 재배포 금지한국경제 관련뉴스해당 언론사에서 선정하며 언론사 페이지(아웃링크)로 이동해 볼 수 있습니다.""선물하기 좋다"" 미국서 인기 폭발한 韓제품""분위기 좋았는데…"" 이란 분노에 한국車 \'스톱\'""100억 돌파""…베트남서 돌풍 일으킨 과자○○○ 덕분에 한국서 대박난 운동복이…""월급 모아선 집 못 산다""…투자 고수의 비법좋아요0훈훈해요0슬퍼요0화나요0후속기사 원해요0기사제공 :']"
3,NC soft, 2020-01-0718:36,한국경제 ,"07일, 거래소 외국인 순매수상위에 화학 업종 5종목",https://finance.naver.com/news/news_read.nhn?article_id=0004269895&office_id=015&mode=search&query=엔씨&page=1,"['       07일, 거래소 외국인 순매수상위에 화학 업종 5종목      기사입력2020-01-07 18:36기사원문좋아요훈훈해요좋아요 평가하기공감좋아요0훈훈해요0슬퍼요0화나요0후속기사 원해요0댓글 외국인 투자자는 07일 거래소에서 TIGER 200TR, LG생활건강, 카카오 등을 중점적으로 사들인 것으로 나타났다.외국인 투자자의 순매수 상위 20개 종목은 TIGER 200TR, LG생활건강, 카카오, 아모레퍼시픽, 삼성전자우, 삼성전기, 호텔신라, NAVER, LG화학, 엔씨소프트등이다.이중에 화학 업종에 속한 종목이 5개 포함되어 있다.이날 외국인 투자자가 순매수한 종목들 중에 TIGER 200TR, LG생활건강, 카카오 등은 전일 대비 주가가 상승했다.[01월07일]거래소 외국인 순매수 상위 종목한경로보뉴스이 기사는 한국경제신문과 금융 AI 전문기업 씽크풀이 공동 개발한 기사 자동생성 알고리즘에 의해 실시간으로 작성된 것입니다.▶ 네이버에서 한국경제 뉴스를 받아보세요▶ 한경닷컴 바로가기  ▶ 모바일한경 구독신청 ⓒ 한국경제 & hankyung.com, 무단전재 및 재배포 금지한국경제 관련뉴스해당 언론사에서 선정하며 언론사 페이지(아웃링크)로 이동해 볼 수 있습니다.""선물하기 좋다"" 미국서 인기 폭발한 韓제품""분위기 좋았는데…"" 이란 분노에 한국車 \'스톱\'""100억 돌파""…베트남서 돌풍 일으킨 과자○○○ 덕분에 한국서 대박난 운동복이…""월급 모아선 집 못 산다""…투자 고수의 비법좋아요0훈훈해요0슬퍼요0화나요0후속기사 원해요0기사제공 :']"
4,NC soft, 2020-01-0718:21,파이낸셜뉴스 ,"엔씨소프트, 새 CI·슬로건 공개",https://finance.naver.com/news/news_read.nhn?article_id=0004354122&office_id=014&mode=search&query=엔씨&page=1,"['       엔씨소프트, 새 CI·슬로건 공개      기사입력2020-01-07 18:21기사원문좋아요훈훈해요좋아요 평가하기공감좋아요0훈훈해요0슬퍼요0화나요0후속기사 원해요0댓글 ㈜엔씨소프트가 기업 이미지(CI)를 리뉴얼 했다고 7일 밝혔다.  새로운 CI는 진지함이 깃든 장인정신과 열정, 그리고 끊임없는 도전의 의미를 담고 있다. NC의 컷팅된 모서리는 최첨단 기술력을 상징한다. N과 C를 연결함으로써 회사의 고유 미션인 \'즐거움으로 연결된 새로운 세상\'을 표현했다.  CI는 브랜드 슬로건 \'Window to the Future(미래를 보는 창)\'와 함께 슬로건 하단형, 슬로건 우측형, 기본 로고형으로 제작됐다. 미래에 대한 비전을 제시하겠다는 의지를 나타낸다는 설명이다.   true@fnnews.com 김아름 기자 ▶ 헉! 소리나는 스!토리 뉴스 [헉스]▶ 클릭해, 뉴스 들어간다 [뉴스쿨] ▶ 세상에 이런일이 [fn파스]  ※ 저작권자 ⓒ 파이낸셜뉴스. 무단 전재-재배포 금지파이낸셜뉴스 관련뉴스해당 언론사에서 선정하며 언론사 페이지(아웃링크)로 이동해 볼 수 있습니다.화장실서 대변 볼 때 절대로 하지 말아야 하는 행동역술인 김효성 ""대통령은 타고난 사주도 좋지만..""하태경 폭탄 발언 ""정세균 이후 총리, 누군지 알고 있다""""온수에 800kg 대변 풀겠다"" 난방 회사의 폭탄 발언""호불호 갈리는 분"" 듣던 김무성 참지 못하고..좋아요0훈훈해요0슬퍼요0화나요0후속기사 원해요0기사제공 :']"
5,NC soft, 2020-01-0716:27,한국경제 ,"엔씨소프트, 새 CI 공개",https://finance.naver.com/news/news_read.nhn?article_id=0004269714&office_id=015&mode=search&query=엔씨&page=1,"['       엔씨소프트, 새 CI 공개      기사입력2020-01-07 16:27기사원문좋아요훈훈해요좋아요 평가하기공감좋아요0훈훈해요0슬퍼요0화나요0후속기사 원해요0댓글엔씨소프트가 새로운 기업 이미지(CI)를 7일 선보였다.새 CI에 대해 엔씨소프트는 ""\'NC\'의 컷팅된 모서리는 최첨단 기술력을 상징하고 N과 C를 연결해 고유 과제인 \'즐거움으로 연결된 새로운 세상\'을 표현했다""고 설명했다.이어 ""새 CI에 진지함이 깃든 장인정신과 열정, 끊임없는 도전의 의미를 담았다. 브랜드 슬로건은 미래에 대한 비전을 제시하겠다는 의지를 나타낸 것""이라고 덧붙였다.최수진 한경닷컴 기자 naive@hankyung.com▶ 네이버에서 한국경제 뉴스를 받아보세요▶ 한경닷컴 바로가기  ▶ 모바일한경 구독신청 ⓒ 한국경제 & hankyung.com, 무단전재 및 재배포 금지한국경제 관련뉴스해당 언론사에서 선정하며 언론사 페이지(아웃링크)로 이동해 볼 수 있습니다.""선물하기 좋다"" 미국서 인기 폭발한 韓제품""월급 모아선 집 못 산다""…투자 고수의 비법""가로막는 한국 못 믿겠다"" 외국인 6년 만에""자주 사먹는 국산약 이젠…"" 文케어 후폭풍○○○ 덕분에 한국서 대박난 운동복이…좋아요0훈훈해요0슬퍼요0화나요0후속기사 원해요0기사제공 :']"
6,NC soft, 2020-01-0715:51,한국경제 ,'신작 게임의 저주' 풀린 엔씨…주가 60만원 향해 맹렬 질주,https://finance.naver.com/news/news_read.nhn?article_id=0004269685&office_id=015&mode=search&query=엔씨&page=1,"['       \'신작 게임의 저주\' 풀린 엔씨…주가 60만원 향해 맹렬 질주      기사입력2020-01-07 15:51기사원문좋아요훈훈해요좋아요 평가하기공감좋아요0훈훈해요0슬퍼요0화나요0후속기사 원해요0댓글리니지2M 흥행에 外人 \'사자\'사상 최고가 연일 갈아치워올해 영업이익 1조 돌파 전망신작 효과에 따른 실적 개선 기대로 엔씨소프트가 사상 최고가를 새로 쓰고 있다. 지난해 11월 출시한 ‘리니지2M’이 흥행하면서 올해 영업이익이 1조원을 돌파할 수 있다는 전망도 나온다.7일 유가증권시장에서 엔씨소프트는 1만5000원(2.59%) 오른 59만4000원에 거래를 마쳤다. 지난 3일(종가 56만5000원)부터 연일 사상 최고가를 갈아치우고 있다. 외국인 투자자가 최근 4거래일 동안 574억원어치 순매수에 나서면서 상승세를 뒷받침했다.리니지2M의 흥행이 실제 매출로 확인되면서 새 게임 출시→공매도 급증→주가 하락으로 이어지는 ‘신작의 저주’에서 벗어났다는 분석이다. 지난해 11월 출시 직전 56만1000원까지 올랐던 엔씨소프트 주가는 출시 이후 하락세를 타면서 48만5000원까지 떨어지기도 했다. 리니지2M 흥행이 기존 게임인 ‘리니지M’ 매출 감소로 이어질지 모른다는 우려가 투자 심리를 위축시켰다.금융투자업계는 리니지2M의 4분기 하루평균 매출을 30억~40억원 수준으로 추정하고 있다. 기존 사용자가 아닌 신규 유입층이 늘어나면서 실적 개선을 이끌고 있다는 관측이다. 이창영 유안타증권 연구원은 “리니지2M은 리니지M과 달리 고화질 그래픽 등으로 젊은 사용자층에게 인기를 끌고 있다”며 “하루 접속자 수(DAU), 가입자당 평균 매출(ARPU) 등 지표가 탄탄하다”고 분석했다.신영증권(1조87억원)과 이베스트투자증권(1조273억원) 등은 연간 영업이익 1조원 돌파를 전망했다. 성종화 이베스트투자증권 연구원은 “실적 개선은 지난해 4분기부터 올해 1분기까지 이어질 수 있다”며 “블레이드앤소울2와 아이온2 등 신작도 향후 상승세에 기여할 가능성이 높다”고 내다봤다.김기만 기자 mgk@hankyung.com▶ 네이버에서 한국경제 뉴스를 받아보세요▶ 한경닷컴 바로가기  ▶ 모바일한경 구독신청 ⓒ 한국경제 & hankyung.com, 무단전재 및 재배포 금지한국경제 관련뉴스해당 언론사에서 선정하며 언론사 페이지(아웃링크)로 이동해 볼 수 있습니다.""선물하기 좋다"" 미국서 인기 폭발한 韓제품""분위기 좋았는데…"" 이란 분노에 한국車 \'스톱\'""100억 돌파""…베트남서 돌풍 일으킨 과자○○○ 덕분에 한국서 대박난 운동복이…""월급 모아선 집 못 산다""…투자 고수의 비법좋아요0훈훈해요0슬퍼요0화나요0후속기사 원해요0기사제공 :']"
