,회사명,날짜,언론사,기사제목,링크,본문
9,NC soft, 2020-08-1309:04,이데일리 ,"넷마블, 실적 흐름 양호하나 동종업 대비 고평가-한화",https://finance.naver.com/news/news_read.nhn?article_id=0004712843&office_id=018&mode=search&query=엔씨&page=3,"['       넷마블, 실적 흐름 양호하나 동종업 대비 고평가-한화      기사입력2020-08-13 09:04기사원문좋아요훈훈해요좋아요 평가하기공감좋아요0훈훈해요0슬퍼요0화나요0후속기사 원해요0댓글\'일곱개의 대죄\' 북미 흥행 등에 2분기 실적 컨센 상회코웨이 지분가치 상승 반영해 목표가↑…투자의견은 낮춰""높은 밸류에이션 정당화되려면 이익 창출 수준 높아져야""[이데일리 고준혁 기자] 한화투자증권은 넷마블(251270)이 2분기 호실적을 기록하고 하반기 신작 출시 등으로 이같은 흐름을 계속 이어나갈 것으로 전망한다면서도, 밸류에이션 매력이 없다고 평가했다. 이에 목표주가는 13만원으로 직전 대비 23.8%(2만5000원) 상향하지만 투자의견은 직전 ‘매수(Buy)’에서 ‘중립(Hold)’로 한 단계 내렸다. 넷마블의 2분기 매출액은 6857억원, 영업이익은 816억원을 기록, 컨센서스를 상회했다. 영업이익률의 경우 큰 폭의 외형성장과 더불어 영업 레버리지 효과로 인해 전 분기 대비 8.1%포인트 상승한 11.9%를 기록한 것으로 나타났다. 김소혜 한화투자증권 연구원은 “‘일곱개의 대죄’와 ‘A3:Still Alive’의 매출이 온기로 반영된 효과와 ‘블레이드앤소울:레볼루션’ 등 기존 게임들의 매출도 예상보다 큰 폭 반등했던 것이 실적 호조의 원인”이라며 “특히 지난 3월 런칭한 일곱개의 대죄는 북미와 유럽 지역 흥행을 기반으로 2분기 일평균 매출액이 약 16억원을 기록했다”고 설명했다. 넷마블의 실적은 3분기 잠시 숨 고르기 한 뒤 4분기부터 다시 개선 흐름을 보일 것으로 전망된다. 2분기 실적 호조를 견인했던 주요 게임들의 매출 성장이 둔화될 것으로 전망되기 때문이다. 김 연구원은 “동사의 3분기 실적으로 매출액 6490억원, 영업이익 723억원을 전망한다”며 “주요 게임들 매출이 하락이 예상되는데 그 폭은 크지 않을 전망”이라고 예상했다. 이어 “7월 론칭한 ‘마구마구2020’과 ‘BTS 유니버스 스토리’의 효과가 3분기에 일부 기여될 것으로 전망된다”며 “기대할 만한 신작인 ‘세븐나이츠2’의 한국 출시와 ‘세븐나이츠-타임원더러’, ‘마블렘름 오브 챔피언스’의 글로벌 출시로 4분기부턴 신작 모멘텀이 반영될 것으로 보인다”고 전했다. 김 연구원은 목표가격은 상향했으나 투자의견은 중립으로 제시한 이유에 대해선 “동종 업체의 밸류에이션 상승을 반영한 영업가치와 코웨이, 엔씨소프트 등 지분가치 상승을 반영해 목표가를 올렸다”며 “다만 올해 예상 실적 기준 주가수익비율(PER)이 45배로 국내외 경쟁업체와 비교하면 밸류에이션 매력이 없는 편으로 투자의견을 낮춰 제시한다”고 설명했다. 이어 “높은 밸류에이션이 정당화되기 위해선 안정적인 이익 창출 수준이 한 단계 높아져야 한다고 판단된다”고 덧붙였다.고준혁 (kotaeng@edaily.co.kr)▶또 하나의 뉴스로 시작하는 하루 \'News+\'  #궁금하냥? 바로오시개!▶네이버에서 \'이데일리 뉴스\'를 만나보세요▶빡침해소, 청춘뉘우스 \'스냅타임\'＜ⓒ종합 경제정보 미디어 이데일리 - 무단전재 & 재배포 금지＞이데일리 관련뉴스해당 언론사에서 선정하며 언론사 페이지(아웃링크)로 이동해 볼 수 있습니다.서울시도 가세한 \'GTX-C\' 신설역…이러다 완행열차될라김구라, \'남희석 태도 지적\' 간접 해명…""얘기 끊는 거 아냐""조국 초선 김웅 \'기승전-조국\' 공격...내 아파트 \'3수\' 재건축김조원 가정파탄 지경...잘 안다던 野의원 재혼은 아닌 듯공지영 ""전남편과 섬싱·음란사진 협박"" vs 김부선 ""사과 요구""좋아요0훈훈해요0슬퍼요0화나요0후속기사 원해요0기사제공 :']"
10,NC soft, 2020-08-1309:02,매일경제 ,"엔씨소프트, 2Q 영업익 2090억…전년比 61%↑",https://finance.naver.com/news/news_read.nhn?article_id=0004634384&office_id=009&mode=search&query=엔씨&page=3,"['       엔씨소프트, 2Q 영업익 2090억…전년比 61%↑      기사입력2020-08-13 09:02기사원문좋아요훈훈해요좋아요 평가하기공감좋아요0훈훈해요0슬퍼요0화나요0후속기사 원해요0댓글 엔씨소프트(대표 김택진)는 지난 2분기에 연결기준 매출 5386억원, 영업이익 2090억원, 당기순이익 1584억원을 기록했다. 이는 전년동기 대비 각각 31%, 61%, 36% 상승한 결과다. 전분기 대비로는 각각 26%, 13%, 19% 감소했다.지역별 매출은 한국 4276억원, 북미 및 유럽 241억원, 일본 151억원, 대만 95억원, 로열티 매출은 623억원이다. 제품별 매출은 모바일게임이 3571억원으로 리니지M 1599억원, 리니지2M 1973억원이다. PC온라인게임 매출은 리니지 343억원, 리니지2 258억원, 아이온 82억원, 블레이드&소울 198억원, 길드워2 156억원이었다.이중 길드워2는 게임 접속자 수와 평균 사용 시간이 늘어나며 전분기 대비 25% 증가한 매출을 기록했다. 리니지2 매출은 전년 동기 대비 21% 증가했고 로열티 매출은 대만 리니지M의 대규모 업데이트 효과로 전년 동기 대비 21% 늘었다.엔씨소프트는 프로젝트 TL, 블레이드&소울2, 트릭스터M 등 의 신작을 준비 중이다. 올해 하반기부터 순차 선보일 계획이다.[임영택기자 ytlim@mkinternet.com]▶네이버 메인에서 \'매일경제\'를 받아보세요▶\'매일경제\' 바로가기\xa0▶뉴스레터 \'매콤달콤\' 구독[ⓒ 매일경제 & mk.co.kr, 무단전재 및 재배포 금지]매일경제 관련뉴스해당 언론사에서 선정하며 언론사 페이지(아웃링크)로 이동해 볼 수 있습니다.""상사와 잠자리 후 취업"" 기안84 \'복학왕\' 논란수해 현장 \'몰래\' 봉사 나선 김정숙 여사봄수연, 스폰·임신 고백 거짓…SNS 사칭 피해구례서 떠내려간 암소, 55㎞ 떨어진 남해서 발견\'학폭 논란\' 김유진 PD, 결혼식 또 연기…무슨 일?좋아요0훈훈해요0슬퍼요0화나요0후속기사 원해요0기사제공 :']"
11,NC soft, 2020-08-1308:57,매일경제 ,"[Hot-Line] ""넷마블, 투자기업 IPO가 기업가치 최대 변수""…목표가↑",https://finance.naver.com/news/news_read.nhn?article_id=0004634377&office_id=009&mode=search&query=엔씨&page=3,"['       [Hot-Line] ""넷마블, 투자기업 IPO가 기업가치 최대 변수""…목표가↑      기사입력2020-08-13 08:57기사원문좋아요훈훈해요좋아요 평가하기공감좋아요0훈훈해요0슬퍼요0화나요0후속기사 원해요0댓글 삼성증권은 13일 넷마블에 대해 투자 기업의 가치 상승이 기대된다며 목표주가를 기존 9만원에서 12만원으로 상향 조정했다. 투자의견은 \'보유(Hold)\'를 유지했다.2분기 넷마블의 매출액은 6857억원으로 전분기대비 28.7% 증가해 시장 전망치를 15%나 웃돌았다. 이는 북미 등 글로벌에서 흥행에 성공한 \'일곱개의 대죄\'의 매출이 온기 반영된 데 더해 \'마블 컨테스트 오브 챔피언\'과 \'블소 레볼루션\' 등 기존 게임들도 컨텐츠 업데이트와 출시 지역 확대로 전분기 대비 매출이 성장했기 때문이라고 삼성증권은 설명했다. 영업이익도 전분기 204억원에서 817억원으로 크게 증가했다. 3분기에는 7월 출시된 \'마구마구 2020\'에 더해 \'BTS 유니버스 스토리\'가 출시될 예정이다. 삼성증권은 \'BTS 유니버스 스토리\'가 BTS 팬층을 타겟으로 하는 샌드박스형 스토리게임으로 제작되고 있으나 \'BTS 월드\'의 흥행 성과를 고려하면 큰 기대를 갖기는 어렵다고 밝혔다. 차기 기대작인 \'세븐나이츠2\'와 \'마블 렐름 오브 챔피언스\'는 4분기에 출시될 예정이다. \'제2의 나라\'와 \'세븐나이츠 레볼루션\'은 출시가 내년 상반기로 연기됐다.삼성증권은 넷마블이 전략적, 투자적 관점에서 지분을 매수한 엔씨소프트, 빅히트엔터테인먼트, 코웨이, 카카오뱅크 등의 시장 가치가 빠르게 상승 중이라고 강조했다. 시총 4조원에 매수한 엔씨소프트는 현재 시총 16조원에 거래되고 있으며, 1조원 가치에 지분을 인수한 빅히트엔터테인먼트는 상장을 앞두고 시장에서 3~5조원에 평가되고 있다. 카카오뱅크 역시 시장에서 기업 가치 평가가 지속적으로 상승하고 있다. 오동환 삼성증권 연구원은 ""투자 기업들의 성공적인 IPO는 넷마블의 기업 가치에 최대 변수로 작용하고 있다""라면서 ""최근 주가 급등으로 자회사 상장 기대감이 주가에 충분히 반영됐고, 상장 이후 자회사 기업 가치의 높은 변동성이 예상되는 만큼 추가적인 주가 상승 여력은 제한적""이라고 말했다. [고득관 기자 kdk@mkinternet.com]▶네이버 메인에서 \'매일경제\'를 받아보세요▶\'매일경제\' 바로가기\xa0▶뉴스레터 \'매콤달콤\' 구독[ⓒ 매일경제 & mk.co.kr, 무단전재 및 재배포 금지]매일경제 관련뉴스해당 언론사에서 선정하며 언론사 페이지(아웃링크)로 이동해 볼 수 있습니다.면목동 새 아파트 \'전셋값 6억 > 분양가 5억\'…""전세 부르는 게 값""개인정보 유출 우려에 \'지워야할 중국앱\' 확산봄수연, 스폰·임신 고백 거짓…SNS 사칭 피해구례서 떠내려간 암소, 55㎞ 떨어진 남해서 발견""상사와 잠자리 후 취업"" 기안84 \'복학왕\' 논란좋아요0훈훈해요0슬퍼요0화나요0후속기사 원해요0기사제공 :']"
12,NC soft, 2020-08-1308:48,뉴시스 ,엔씨소프트 2분기 영업익 2090억…전년比 61% 상승,https://finance.naver.com/news/news_read.nhn?article_id=0010018711&office_id=003&mode=search&query=엔씨&page=3,"['       엔씨소프트 2분기 영업익 2090억…전년比 61% 상승      기사입력2020-08-13 08:48기사원문좋아요훈훈해요좋아요 평가하기공감좋아요0훈훈해요0슬퍼요0화나요0후속기사 원해요0댓글매출 5386억원,  당기순이익 1584억원 기록[서울=뉴시스] 이재은 기자 = 엔씨소프트는 2020년 2분기 매출 5386억원, 영업이익 2090억원, 당기순이익 1584억원을 기록했다고 13일 공시했다.전년 동기 대비 매출과 영업이익은 31%, 61% 상승했다. 당기순이익은 36% 상승했다. 전분기 대비 매출, 영업이익, 당기순이익은 각각 26%, 13%, 19% 감소했다.지역별 매출은 한국 4276억원, 북미/유럽 241억원, 일본 151억원, 대만 95억원이다. 로열티 매출은 623억원이다.제품별로 살펴보면 모바일 게임 매출은 3571억 원을 기록했다. 리니지M 1,599억 원, 리니지2M 1973억 원이다. PC온라인 게임 매출은 리니지 343억원, 리니지2 258억원, 아이온 82억원, 블레이드 & 소울 198억원, 길드워2 156억원이다.길드워2는 게임 접속자 수와 평균 사용 시간이 늘어나며 전분기 대비 25% 증가한 매출을 기록했다. 리니지2 매출은 전년 동기 대비 21% 증가하며 견조한 실적을 유지하고 있다. 로열티 매출은 대만 리니지M의 대규모 업데이트 효과로 전년 동기 대비 21% 증가했다.엔씨(NC)는 프로젝트 TL, 블레이드 & 소울 2, 트릭스터M 등 PC∙콘솔과 모바일 플랫폼에서 다양한 게임을 개발하고 있다. 신작은 하반기부터 순차적으로 선보일 계획이다.☞공감언론 뉴시스 lje@newsis.com▶ 네이버에서 뉴시스 구독하기▶ K-Artprice, 유명 미술작품 가격 공개▶ 뉴시스 빅데이터 MSI 주가시세표 바로가기<ⓒ 공감언론 뉴시스통신사. 무단전재-재배포 금지>뉴시스 관련뉴스해당 언론사에서 선정하며 언론사 페이지(아웃링크)로 이동해 볼 수 있습니다.의식 없는 환자 성폭행, 병원직원 동영상 나와 덜미\'성관계 대가로 취업\'…기안84 웹툰 여성혐오 논란공지영 ""김부선, 내 3번째 남편과 썸씽""…SNS서 폭로전\'한국女 거리 헌팅\' 영국男 체포…몰카 영상만 200GB""남편 며칠 굶기고 살짝 속옷 내려"" 女경찰 성희롱좋아요0훈훈해요0슬퍼요0화나요0후속기사 원해요0기사제공 :']"
13,NC soft, 2020-08-1308:45,한국경제TV ,체급 달라진 네이버·카카오·엔씨…수해성금 50억원 육박,https://finance.naver.com/news/news_read.nhn?article_id=0000893417&office_id=215&mode=search&query=엔씨&page=3,"['       체급 달라진 네이버·카카오·엔씨…수해성금 50억원 육박      기사입력2020-08-13 08:45기사원문좋아요훈훈해요좋아요 평가하기공감좋아요0훈훈해요0슬퍼요0화나요0후속기사 원해요0댓글카카오와 김범수 의장 총 20억원네이버 15억원·엔씨소프트 10억원[한국경제TV 이영호 기자]올해들어 주가가 상승하며 몸집을 키우고 있는 국내 IT 대기업들이 최근 집중호우 피해에 거액의 성금을 잇따라 내놓고 있다.국내 양대 IT 기업으로 꼽히는 네이버와 카카오가 전국을 강타한 집중호우로 피해를 본 수재민을 돕기 위해 한뜻으로 힘을 보탰다.김범수 카카오 이사회 의장은 호우 피해 복구를 위해 희망브리지 전국재해구호협회에 10억원 상당의 개인 보유 주식을 기부했다.카카오 회사 측도 김 의장과 함께 10억원을 기부했다.카카오와 김범수 의장의 총 기부금은 20억원인 셈.네이버도 장기간 폭우로 피해를 본 수재민과 지역 사회를 위해 성금 15억원을 사회복지공동모금회에 기탁했다고 밝혔다.두 기업은 IT 플랫폼 기업답게 각자의 플랫폼을 활용한 대국민 기부 캠페인도 펼치고 있다.카카오는 사회공헌 플랫폼 \'카카오같이가치\'를 통해 전 국민 기부 캠페인 참여를 독려하고 있다.재해구호협회와 함께 지난달 27일 \'호우 피해 긴급 모금\' 모금함을 개설했다.금액 기부 외에도 댓글 작성, 응원, 공유를 통해 참여하면 카카오가 건당 100원을 기부한다. 카카오 \'#탭\'(샵탭)을 통해서도 기부할 수 있다.카카오 관계자는 ""카카오톡 채널, 비즈보드 등 플랫폼을 통해 더 많은 이용자가 집중호우 피해 극복을 위한 후원에 동참하도록 할 계획""이라며 ""카카오 기부금은 기업 재단 \'카카오 임팩트\'를 통해 전달된다""고 말했다.네이버 온라인 기부포털 \'해피빈\'은 전국재해구호협회와 함께 이달 31일까지 호우 피해 구호를 위한 모금 활동을 벌인다.네이버 측은 ""성금뿐 아니라 네이버의 플랫폼·기술 등을 통해 수해 복구에 적극적으로 참여할 방침""이라고 덧붙였다.엔씨소프트는 집중호우 피해 복구 성금을 10억원 기부했다고 13일 밝혔다.엔씨소프트는 성금을 희망브리지 전국재해구호협회에 전달했다.기부금은 집중호우로 피해를 본 지역과 수재민을 위해 사용된다.엔씨소프트 측은 ""수해를 입은 지역 사회의 안정과 신속한 피해 복구를 기원한다""며 ""어려움을 겪는 모든 분께 위로와 도움이 되기를 바란다""고 전했다.(사진=연합뉴스)이영호기자 hoya@wowtv.co.kr▶ 네이버 홈에서 [한국경제TV] 채널 구독하기 [생방송보기]▶ 대한민국 재테크 총집결! - [증권 / 주식상담 / 부동산]ⓒ 한국경제TV, 무단 전재 및 재배포 금지한국경제TV 관련뉴스해당 언론사에서 선정하며 언론사 페이지(아웃링크)로 이동해 볼 수 있습니다.임창정 ""장민호가 돈 벌어줘서 앨범 냈다""홍상수♥김민희 결별설? ""불륜녀 악플에 자책도""이학주 ""1시간 동안 김희애 기사만 봤다""…이유가수원 오피스텔 영아 시신, 친모가 살해 후 3년간 방치기안84 \'복학왕\', ""연재 중지해 달라"" 靑 청원좋아요0훈훈해요0슬퍼요0화나요0후속기사 원해요0기사제공 :']"
14,NC soft, 2020-08-1308:44,한국경제 ,"[속보] 엔씨소프트, 2분기 영업익 2090억···전년비 61%↑",https://finance.naver.com/news/news_read.nhn?article_id=0004397665&office_id=015&mode=search&query=엔씨&page=3,"['       [속보] 엔씨소프트, 2분기 영업익 2090억···전년비 61%↑      기사입력2020-08-13 08:44기사원문좋아요훈훈해요좋아요 평가하기공감좋아요0훈훈해요0슬퍼요0화나요0후속기사 원해요0댓글김택진 엔씨소프트 대표엔씨소프트는 지난 2분기 영업이익 2090억원으로 전년 동기 대비 61% 증가했다고 13일 공시했다. 이 기간 매출액은 31% 늘어난 5386억원으로 집계됐다.지역별 매출은 한국 4276억원, 북미·유럽 241억원, 일본 151억원, 대만 95억원이다. 로열티 매출은 623억원이다.제품별로 살펴보면 모바일 게임 매출은 3571억원으로, 리니지M이 1599억원, 리니지2M이 1973억원으로 집계됐다.PC온라인 게임 매출은 리니지 343억원, 리니지2 258억원, 아이온 82억원, 블레이드 앤 소울 198억원, 길드워2 156억원이다.노정동 한경닷컴 기자 dong2@hankyung.com▶ #믿고 보는 #기자 \'한경 기자 코너\'▶ 네이버에서 한국경제 뉴스를 받아보세요▶ 모바일한경 구독신청 ⓒ 한국경제 & hankyung.com, 무단전재 및 재배포 금지한국경제 관련뉴스해당 언론사에서 선정하며 언론사 페이지(아웃링크)로 이동해 볼 수 있습니다.""삼성전자 말고…"" 334% 급등, 개미들 \'환호\'31억이던 도곡동 아파트, 2개월 만에 집값이…전세 낀 집 팔려고 봤더니…집주인들 \'황당\'잘 나가던 SK하이닉스, 어쩌다가…폭탄 전망""이번엔 중국서 터졌다""…한국, 이대로 가다간좋아요0훈훈해요0슬퍼요0화나요0후속기사 원해요0기사제공 :']"
15,NC soft, 2020-08-1308:40,연합뉴스 ,엔씨 '리니지2M' 2분기 매출 급감…영업익 작년보다는 늘어(종합),https://finance.naver.com/news/news_read.nhn?article_id=0011811312&office_id=001&mode=search&query=엔씨&page=3,"['       엔씨 \'리니지2M\' 2분기 매출 급감…영업익 작년보다는 늘어(종합)      기사입력2020-08-13 08:40기사원문좋아요훈훈해요좋아요 평가하기공감좋아요0훈훈해요0슬퍼요0화나요0후속기사 원해요0댓글매출 5천386억원·영업익 2천90억…리니지2M 매출 전분기 58% 수준 그쳐엔씨소프트[엔씨소프트 제공. 재판매 및 DB 금지]    (서울=연합뉴스) 이효석 기자 = 엔씨소프트가 2분기에도 \'리니지\' 시리즈의 선방에 힘입어 지난해 대비 실적 개선을 이뤘다.    다만 올해 1분기에 분기 기준 역대 최고 실적을 이끌었던 주력 게임 \'리니지2M\' 매출이 한 분기 만에 절반 가까이 줄어들었다.    엔씨소프트는 올해 2분기 연결 기준 매출 5천386억원, 영업이익 2천90억원을 올렸다고 13일 공시했다.    지난해 2분기와 비교해 매출은 31.11%, 영업이익은 61.49% 증가했다.    2분기 당기순이익은 1천584억원으로 전년 동기 대비 35.54% 늘었다.    매출이 가장 많이 나온 게임은 지난 분기처럼 모바일게임 \'리니지2M\'이었다. 2분기 매출 1천973억원이었다.    \'리니지M\'은 1천599억원의 매출을 올려 뒤를 이었다.    엔씨소프트는 모바일게임 매출이 총 3천571억원으로 전체 매출의 66%가량을 차지했다.    다만 전 분기 모바일게임 매출 약 5천532억원과 비교하면 2분기 모바일게임 매출은 35% 이상 감소한 모습을 보였다.    전 분기에 리니지2M 매출만 3천411억원, 리니지M 매출이 2천120억원이었는데 두 게임 매출이 모두 대폭 줄어들었다. 리니지2M 매출은 지난 분기의 57.8% 수준에 그쳤다.    이런 여파로 엔씨소프트는 전 분기 대비 매출, 영업이익, 당기순이익이 각각 26%, 13%, 19% 감소했다.    엔씨의 PC 온라인 게임 매출은 \'리니지\' 343억원, \'리니지2\' 258억원, \'아이온\' 82억원, \'블레이드 앤 소울\' 198억원, \'길드워2\' 156억원 등의 순이었다.    엔씨소프트 측은 ""리니지2 매출이 전년 동기 대비 21% 증가하며 견조한 실적을 유지했다""며 ""길드워2는 게임 접속자 수와 평균 사용 시간이 늘어나며 매출이 전 분기 대비 25% 증가했다""고 밝혔다.    엔씨소프트 관계자는 ""\'프로젝트 TL\', \'블레이드 앤 소울 2\', \'트릭스터 M\' 등 다양한 신작을 개발 중""이라며 ""올해 하반기부터 신작을 차례로 선보일 계획""이라고 예고했다.    hyo@yna.co.kr▶집중호우 속보는 네이버 연합뉴스[구독 클릭]▶[팩트체크]금배지 너무 오래 달지 말자?▶제보하기 연합뉴스 관련뉴스해당 언론사에서 선정하며 언론사 페이지(아웃링크)로 이동해 볼 수 있습니다.\xa0사탕 2개 먹다 쓰러진 20대女, 지나가던 해병대가 살렸다\xa0""의사가운 입고 해변 가라?"" 그녀들의 비키니 반격\xa0사별한 아내 못 잊어…집에 부인 밀랍 인형 만든 남성\xa030년간 못 찾은 아버지 시신이 지하실에…경찰 수사\xa07명이 마시고 사망한 \'기적의 코로나 약\' 알고보니…좋아요0훈훈해요0슬퍼요0화나요0후속기사 원해요0기사제공 :']"
16,NC soft, 2020-08-1308:37,아이뉴스24 ,"""넷마블, 뛰어난 실적에도 숨고르기 필요한 시점""-신영증권",https://finance.naver.com/news/news_read.nhn?article_id=0000552298&office_id=031&mode=search&query=엔씨&page=3,"['       ""넷마블, 뛰어난 실적에도 숨고르기 필요한 시점""-신영증권      기사입력2020-08-13 08:37기사원문좋아요훈훈해요좋아요 평가하기공감좋아요0훈훈해요0슬퍼요0화나요0후속기사 원해요0댓글투자의견 \'매수\'→\'중립\', 목표주가는 25% 상향[아이뉴스24 류은혁 기자] 신영증권은 13일 넷마블에 대해 올해 2분기 뛰어난 실적을 보여줬으나 숨 고르기가 필요한 시점이라며 투자의견은 기존 \'매수\'에서 \'중립\'으로 하향 조정하고 목표주가는 12만원에서 15만원으로 25% 상향 조정했다.윤을정 신영증권 연구원은 ""넷마블의 2분기 연결실적은 매출액 6천857억원, 영업이익 817억원으로 전년 동기 대비 각각 30.3%, 146.1% 증가했다""며 ""시장 기대치인 영업이익 639억원을 크게 상회했다""고 설명했다.이어 ""3월 출시된 신작 게임 \'A3:Stil Alive\'의 성과 온기가 반영 됐으며, \'일곱개의 대죄\' 글로벌 출시 역시 본격적으로 실적에 기여하기 시작했다""면서 ""게임별 매출 비중은 글로벌 출시 후 흥행이 지속되고 있는 \'일곱개의 대죄\'가 21%로 가장 높으며 기존 게임들의 성과 역시 양호하게 지속되고 있다""고 덧붙였다.윤 연구원은 ""적정주가는 실적 호조를 반영해 15만원으로 상향하나, 최근 주가 급등을 고려해 투자의견은 중립으로 하향 조정한다""면서 ""적정주가는 사업가치 6조8천억원, 엔씨소프트 지분가치 1조4천억원, 빅히트엔터테인먼트 지분가치 8천224억원을 합산했다""고 밝혔다.그는 ""중장기적인 주가 상승을 위해서는 사업가치 확대를 위한 추가적인 지적재산권(IP) 확보 또는 기존 게임의 매출 감소를 뛰어넘는 신작의 대박 흥행이 필요한 시점""이라며 ""전분기 기준 텐센트는 넷마블의 지분 17.5%를 보유하고 있는데, 미국과 중국의 갈등이 심화되고 있어 투자심리가 악화될 가능성도 있다""고 말했다.류은혁기자 ehryu@inews24.com▶네이버 채널에서 \'아이뉴스24\'를 구독해주세요.▶재밌는 아이뉴스TV 영상보기 ▶아이뉴스24 바로가기[ⓒ 아이뉴스24 무단전재 및 재배포 금지]아이뉴스24 관련뉴스해당 언론사에서 선정하며 언론사 페이지(아웃링크)로 이동해 볼 수 있습니다.""참 쉽죠?""…\'기안84의 페인트 교실\' 조회수 360만건 돌파생후 1개월 딸 살해후 오피스텔 3년간 방치…비정한 40대 엄마 영장청구 방침""HDC현산, 아시아나에 2兆 추가지원 불가피""…노딜 가능성↑[단독]\'OTT음원갈등\' 중재 나선 과기부, 문화부에 협조 요청의협, 정부 제안 거절…14일 필수인력 제외 파업 강행좋아요0훈훈해요0슬퍼요0화나요0후속기사 원해요0기사제공 :']"
