,회사명,날짜,언론사,기사제목,링크,본문
6,NC soft, 2020-03-1314:39,매일경제 ,"코스피, 오후 들어 낙폭 축소…장중 1800선 회복",https://finance.naver.com/news/news_read.nhn?article_id=0004536003&office_id=009&mode=search&query=엔씨&page=1,"['       코스피, 오후 들어 낙폭 축소…장중 1800선 회복      기사입력2020-03-13 14:39기사원문좋아요훈훈해요좋아요 평가하기공감좋아요0훈훈해요0슬퍼요0화나요0후속기사 원해요0댓글 13일 오전 패닉 장세로 150포인트 넘게 폭락했던 코스피가 오후 들어 낙폭을 급격히 회복하며 장중 1800선을 회복하기도 했다. 13일 오후 2시 30분 현재 코스피는 전일 대비 56.74포인트(3.09%) 하락한 1777.59에 거래되고 있다. 오후 2시 20분께는 낙폭이 1.36%로 축소되며 1809.31까지 오르기도 했다.이날 코스피는 전일 대비 6.09% 하락한 1722.68로 시작한 뒤 지수가 급전직하하며 오전 9시 6분 프로그램 매매의 매도호가의 효력을 5분간 무효화하는 사이트카가, 10시 43분 모든 거래를 20분동안 정지시키는 서킷브레이커가 각각 발동됐다. 이 과정에서 지수는 1700선이 붕괴돼 1680.60까지 빠지기도 했다. 그러나 오후 들어 연기금을 중심으로 한 기관이 매수량을 늘리며 지수가 급반등했다. 오전에문재인 대통령이 홍남기 경제부총리와 이주열 한은 총재를 청와대로 불러 \'경제·금융 상황 특별 점검 회의\'를 열고, 한국은행이 임시 금융통화위원회 개최를 논의한다는 사실을 밝힌 점도 시장 안정에 힘을 보탠 것으로 보인다. 현재 코스피에서 주요 업종 중에서는 전기·전자가 낙폭을 1%대까지 줄였다. 다만 운송장비, 운수창고, 의료정밀 등은 여전히 6~7%대의 낙폭을 기록하고 있다.투자 주체 별로는 개인과 기관이 각각 4177억원어치와 4703억원어치의 주식을 사고 있고, 외국인은 9888억원어치 주식을 팔고 있다. 프로그램 매매는 3614억원 매도 우위다. 시가총액 상위 종목 중에서는 SK하이닉스와 엔씨소프트가 상승세로 돌아섰다. 다만 오전에 크게 하락한 현대차는 여전히 8%대 낙폭을 유지하고 있다. 현재 코스피에서는 28개 종목이 오르고 872개 종목이 내리고 있다.코스닥 역시 오전에 13% 가량 하락해 500선이 무너지기도 했던 데서 낙폭을 절반 이하로 줄이며 전일 대비 31.55포인트(5.60%) 내린 531.94에 거래되고 있다. [디지털뉴스국 한경우 기자]▶\'M코인\' 지금 가입하면 5000코인 드려요▶네이버 메인에서 \'매일경제\'를 받아보세요\xa0▶뉴스레터 \'매콤달콤\' 구독[ⓒ 매일경제 & mk.co.kr, 무단전재 및 재배포 금지]매일경제 관련뉴스해당 언론사에서 선정하며 언론사 페이지(아웃링크)로 이동해 볼 수 있습니다.중국 외교부 대변인 ""어쩌면 미군이 우한에 코로나19를…""감염병 전문가 ""코로나19는 숨을 쉬면 바이러스가…""오채원 파격 패션…비키니 챔피언의 우월한 볼륨출산장려금 기부한 해병대 간부 부부김해현 ""결혼 전, 시어머니가 전원주인 줄 몰랐다""좋아요0훈훈해요0슬퍼요0화나요0후속기사 원해요0기사제공 :']"
7,NC soft, 2020-03-1314:15,머니투데이 ,연기금 구원투수 등장…증시 낙폭 축소 '1770선' 회복,https://finance.naver.com/news/news_read.nhn?article_id=0004375442&office_id=008&mode=search&query=엔씨&page=1,"['       연기금 구원투수 등장…증시 낙폭 축소 \'1770선\' 회복      기사입력2020-03-13 14:15기사원문좋아요훈훈해요좋아요 평가하기공감좋아요0훈훈해요0슬퍼요0화나요0후속기사 원해요0댓글 [머니투데이 정인지 기자] 코스피가 전 거래일 대비 111.65포인트(6.09%) 1722.68, 코스닥이 전 거래일 대비 26.87포인트(4.77%) 536.62로 하락 출발한 13일 오전 서울 영등포구 KB국민은행 딜링룸 전광판에 지수가 표시돼 있다. / 사진=김휘선 기자 hwijpg@연기금이 구원투수로 등장한 가운데 캐나다에서 코로나19 백신 개발에 진전이 있었다는 소식이 전해지며 증시가 낙폭을 축소하고 있다. 13일 오후 2시12분 현재 코스피지수는 전날보다 3.04% 내린 1778.51을 기록 중이다. 코스피지수는 이날 장중 1680대까지 하락하기도 했다. 코스닥지수도 5.88% 내린 530.33으로 낙폭을 줄이고 있다. 코스닥지수는 장중 한 때 500선을 밑돌았다. 미국 선물은 반등했다. 미국 미니나스닥 선물은 1.16% 상승 중이다. 미국 펜타곤의 투자자금을 받은 캐나다 메디카고 바이오 제약사는 이날 코로나19 백신 개발을 위한 양립자(VLP) 제작에 성공했다고 밝혔다. 이 회사는 오는 7~8월에 인체실험을 할 수 있을 것으로 보고 있다. 국내증시에서는 연기금도 구원투수로 등장했다. 현재 연기금은 코스피시장에서 3226억원을 순매수 중이다. 외국인은 8930억원을 순매도 하고 있다. 기관은 4082억원, 개인은 3791억원 순매수 중이다. 시가총액 상위 종목 중에서는 SK하이닉스가 0.85%, 엔씨소프트가 0.47% 상승하고 있다. 삼성전자는 0.59% 하락으로 낙폭을 거의 회복했다. 삼성바이오로직스, 현대모비스, 삼성물산은 4~5% 하락하고 있고 현대차는 8.32% 떨어지고 있다. 코스닥 시장에서는 절반의 시총 상위주들이 상승으로 돌아섰다. 셀트리온헬스케어는 0.15%, 펄어비스는 3.91% 상승 중이다. 정인지 기자 injee@mt.co.kr▶줄리아 투자노트▶조 변호사의 가정상담소 ▶머니투데이 구독하기 <저작권자 ⓒ \'돈이 보이는 리얼타임 뉴스\' 머니투데이, 무단전재 및 재배포 금지>머니투데이 관련뉴스해당 언론사에서 선정하며 언론사 페이지(아웃링크)로 이동해 볼 수 있습니다.연기금 구원투수 등장…증시 낙폭 축소 \'1770선\' 회복차비까지 얹어준다…갤S10, 어쩌다 \'공짜폰\' 됐나""10년 주식투자해서 번 돈 다 까먹었어요""""지금이 바닥"" 길어지는 개미 \'빚투\' 행렬코에서 대장까지…코로나 바이러스, 이렇게 퍼진다좋아요0훈훈해요0슬퍼요0화나요0후속기사 원해요0기사제공 :']"
8,NC soft, 2020-03-1309:32,매일경제 ,코스피 급락에 신저가 무더기 속출…총 676곳,https://finance.naver.com/news/news_read.nhn?article_id=0004535720&office_id=009&mode=search&query=엔씨&page=1,"['       코스피 급락에 신저가 무더기 속출…총 676곳      기사입력2020-03-13 09:32기사원문좋아요훈훈해요좋아요 평가하기공감좋아요0훈훈해요0슬퍼요0화나요0후속기사 원해요0댓글 신종 코로나바이러스 감염증(코로나19) 확산 공포로 증시가 급락세를 이어가면서 신저가 종목이 속출하고 있다.13일 오전 9시 21분 현재 코스피 시장에서는 총 676개 종목이 52주 신저가로 추락했다.이날 시가총액 상위 종목들이 일제히 파란불이 들어왔다. 현대차, NAVER, SK텔레콤이 8%대 급락하고 있고, 반도체 대장주인 SK하이닉스(-6.88%), 삼성전자(-6%) 등도 하락하고 있다. 그외 POSCO, LG화학, 현대모비스, 엔씨소프트도 6%대 약세다.이날 거래중인 코스피 상장사가 총 900곳이라는 점을 감안하면 2곳 중 1곳 꼴로 52주 신저가를 갈아치운 셈이다.코스닥 시장에서는 773개 종목이 52주 신저가로 추락했다.이날 코스피는 전 거래일 대비 108.71포인트(5.87%) 내린 1726.62에 거래 중이다. 코스닥도 8%대 급락하고 있다.[디지털뉴스국 김현정 기자]▶\'M코인\' 지금 가입하면 5000코인 드려요▶네이버 메인에서 \'매일경제\'를 받아보세요\xa0▶뉴스레터 \'매콤달콤\' 구독[ⓒ 매일경제 & mk.co.kr, 무단전재 및 재배포 금지]매일경제 관련뉴스해당 언론사에서 선정하며 언론사 페이지(아웃링크)로 이동해 볼 수 있습니다.박경서 韓赤 회장 ""마스크 100만장 더 있다는…마윈 회장 전화에 뭉클""코로나 사망률 6%대 치솟은 이탈리아의 비극 왜?오채원 파격 패션…비키니 챔피언의 우월한 볼륨[배한철의 역사의 더께/낯선조선1]한양 청계천에 버려진 아이들, 불륜의 씨앗\'워크맨\' 일베 논란 사과 ""정치적 의미 인지 못해""좋아요0훈훈해요0슬퍼요0화나요0후속기사 원해요0기사제공 :']"
9,NC soft, 2020-03-1309:11,아이뉴스24 ,"시총상위株, 시장 패닉에 일제히 '급락'",https://finance.naver.com/news/news_read.nhn?article_id=0000529501&office_id=031&mode=search&query=엔씨&page=1,"['       시총상위株, 시장 패닉에 일제히 \'급락\'      기사입력2020-03-13 09:11기사원문좋아요훈훈해요좋아요 평가하기공감좋아요0훈훈해요0슬퍼요0화나요0후속기사 원해요0댓글전 종목 6~9% 추락[아이뉴스24 한수연 기자] 코스피가 개장 직후 1600대로 추락한 가운데 시가총액 상위종목이 일제히 급락했다.13일 오전 9시3분 현재 유가증권시장에서 시총 1위 삼성전자는 전 거래일 대비 6.99%(3500원) 하락한 4만7250원에 거래되고 있다. NAVER는 9.31% 빠지며 가장 큰 낙폭을 보이고 있다.SK텔레콤(-8.27%) 현대차(-8.00%) POSCO(-7.87%) LG화학(-7.76%) LG생활건강(-7.50%) SK하이닉스(-7.25%) 등 시총 상위 주요 종목이 동반 추락 중이다.현대모비스(-6.67%) 삼성SDI(-6.79%) 삼성물산(-6.47%) 엔씨소프트(-6.40%) 등도 6% 넘게 급락하고 있다.이날 코스피는 개장과 동시에 1700선이 붕괴되며 1600대로 추락했다. 유가증권시장에선 전일에 이어 또 매도 사이드카가 발동됐다.한수연기자 papyrus@inews24.com▶네이버 채널에서 \'아이뉴스24\'를 구독해주세요.▶홍성택과 함께하는 희망찾기 등산·트레킹 교실 ▶아이뉴스24 바로가기[ⓒ 아이뉴스24 무단전재 및 재배포 금지]아이뉴스24 관련뉴스해당 언론사에서 선정하며 언론사 페이지(아웃링크)로 이동해 볼 수 있습니다.금감원 ""현 시장 위기요인은 코로나19·사모펀드""휴업검토에 뿔난 두산重 노조 ""휴업은 곧 해고…동의 못해""이재명 ""\'재난기본소득\' 국민 1인당 100만원 지급해 경제살려야""CJ ENM, 제2의 韓 OTT연합 첫발…\'KT·LG\' 누가 손잡을까5G 기지국 3배 늘었다…민관합동 TF 점검좋아요0훈훈해요0슬퍼요0화나요0후속기사 원해요0기사제공 :']"
10,NC soft, 2020-03-1305:00,데일리안 ,"""금융위원장, 차관, 법원장, 고검장""...기업 신임 사외이사 '역시'관료 대세",https://finance.naver.com/news/news_read.nhn?article_id=0002388757&office_id=119&mode=search&query=엔씨&page=1,"['       ""금융위원장, 차관, 법원장, 고검장""...기업 신임 사외이사 \'역시\'관료 대세      기사입력2020-03-13 05:00기사원문좋아요훈훈해요좋아요 평가하기공감좋아요0훈훈해요0슬퍼요0화나요0후속기사 원해요0댓글신규 사외이사 대거 선임 기업, 사외이사 겸직 사례 잇따를 듯주요 대기업 사외이사 후보에 오른 법조계·관료 출신 인사들. 왼쪽부터 한진칼 사외이사 후보인 김석동 전 금융위원장, 이동명 전 의정부지방법원장, 롯데케미칼 사외이사 후보인 이금로 전 법무부 차관, 효성 사외이사 후보인 정동채 전 문화관광부 장관. ⓒ데일리안DB/연합뉴스사외이사 임기를 6년으로 제한하는 상법 시행령 개정으로 상장기업들이 비상이 걸린 가운데, 상대적으로 사외이사 ‘초빙’이 수월한 대기업들도 이미 다른 기업에 몸담은 인사를 후보로 올리는 등 ‘쟁탈전’이 치열한 것으로 나타났다.통상 기업 리스크 방지를 위해 법무, 세무, 공정거래, 조달 관련 정부 부처 출신 관료들을 선호하는 공통적인 성향을 보이면서 인재 풀이 한계를 나타낸 데 따른 것으로 풀이된다.13일 금융감독원 전자공시시스템 등에 따르면 이달 주주총회를 개최하는 주요 대기업들이 신규 사외이사 후보로 올린 인사들은 대부분 정부 관료나 법조계 출신인 것으로 나타났다.한진칼 금융위원장 출신에 롯데케미칼 법무부 차관 출신까지이번 주총 시즌의 가장 뜨거운 화제로 떠오르고 있는 한진칼만 보더라도 조원태 회장이 이끄는 한진그룹과 이에 맞서는 3자 주주연합(조현아 전 대한항공 부사장, 사모펀드 KCGI, 반도건설)이 각각 내세운 사외이사 후보 진영에 정부 관료나 법조계, 정부 유관 기관 출신이 대거 포진하고 있다.이번 한진칼 이사회에 이사후보로 올라온 인사는 한진그룹과 3자 주주연합측 추천 인사 각각 7명씩 총 14명에 달한다. 이 중 사외이사는 9명으로 모두 신규 선임이다.한진그룹측이 추천한 김석동 SK텔레콤 사외이사는 노무현 정부 시절 재정경제부 제1차관을 지냈고, 이명박 정부 시절 금융위원회 위원장까지 지내는 등 진보와 보수 정권에서 두루 고위직을 거친 인사다.또 다른 한진그룹측 후보인 박영석 SKC 사외이사는 현 정부에서 공적자금관리위원회 위원장을 지냈고, 이동명 (주)동양 사외이사는 의정부지방법원장까지 지낸 판사 출신이다.중앙선거관리위원회에 몸담고 있는 최윤희 위원도 한진그룹측 추천인사에 포함돼 있다. 검사 출신인 그는 사법연구원 교수와 중앙노동위원회 심판위원, 국가인권위원회 비상임위원 등 화려한 이력을 지녔다.3자 연합측 사외이사 후보로는 국무총리실 공정거래위원회 소비자정책위원회 금융분과 위원을 맡고 있는 여은정 위원이 눈에 띈다. 그는 기획재정부 기금평가단 평가위원도 맡고 있다.롯데케미칼은 이번 주총에 무려 5명의 신규 사외이사 후보를 올린 가운데, 다양한 분야의 정부 출신 인사들을 포진시켰다.대표적인 인물이 문재인 정부 초대 법무부 차관이자 장관 직무대행까지 했던 이금로 법무법인 솔 대표변호사다. 그는 수원고검장 시절인 지난해 6월 윤석열 현 검찰총장과 함께 검찰총장 후보에 오를 정도로 법조계에서 명망을 떨치던 인물이다.롯데케미칼은 고용노동부 기획조정실장과 서울지방노동위원회 위원장을 역임한 전운배 법무법인 광장 고문을 사외이사 후보로 올려 노무 관련 전문가도 확보하게 됐다.또, 부산지방국세청장 출신인 최현민 다솔리더스 대표세무사, 공정거래위원회 카르텔조사국장과 상임위원을 역임한 정중원 법무법인 태평양 고문도 사외이사 후보에 올려 다양한 정부 규제기관 인맥을 영입하게 됐다.삼성 계열사들 중에서는 삼성전기가 이명박 정부 초기 대통령실 경제수석실 재정경제2비서관을 역임한 KDI 국제정책 대학원 교수를 신규 사외이사 후보로 올렸다. 그는 박근혜 정부 시절 대통령 직속 통일준비위원회 위원을 역임하기도 했다.삼성SDI는 서울민사지방법원 판사 출신으로 대한변호사협회 부협회장까지 지낸 김덕현 법무법인 진성 변호사를 신규 사외이사 후보로 올렸다.(주)LG는 법무부 기획조정실장과 대전고검 검사장을 역임한 조성욱 법무법인 화우 대표변호사를 이번 주총에서 사외이사 후보로 영입한다.(주)한화는 방산을 주력으로 하는 기업의 특성에 맞게 방위사업청 원가회계검증단장 출신인 김승헌 방위사업연구원 비상근고문을 신규 사외이사 후보에 포함시켰다.효성은 정동채 더불어민주당 고문을 사외이사 후보로 올렸다. 그는 15~17대 국회의원을 지낸 3선 의원 출신이자, 노무현 정부때 문화관광부 장관도 지낸 친 여권 인물이다.이미 사외이사 명함만 두 장인데…또 사외이사 후보 올라신규 사외이사를 한 번에 대거 영입하는 기업들이 나타나면서 기존 다른 기업 사내외 이사가 중복 지명되는 사례도 속출하고 있다.한진그룹이 지명한 김석동 한진칼 사외이사 후보는 현재 SK텔레콤 사외이사와 현대캐피탈 사외이사를 겸직하고 있으며 둘 다 아직 임기가 남아 있다.박영석 사외이사 후보 역시 지난해 SKC 사외이사 및 감사위원장으로 선임된 상태로 임기가 2년이나 남았다. 그는 롯데정보통신 사외이사 및 감사위원장도 맡고 있다.이동명 사외이사 후보는 한진칼 사외이사로 선임되면 (주)동양 사외이사와 DPC(주) 사외이사 자리와 중복된다.3자연합 측이 추천한 서윤석 한진칼 사외이사 후보 역시 우리자산운용 사외이사를 맡고 있다. 그는 엔씨소프트 사외이사 명단에도 올라 있지만 이달로 임기가 끝난다.대한항공 사외이사 후보로 오른 정갑영 연세대 명예특임교수는 아직 CJ대한통운 사외이사 임기가 남아있다. SK브로드밴드 사외이사도 맡고 있지만 임기 만료를 앞두고 있다. 조명현 고려대 교수도 롯데건설 사외이사와 대한항공 사외이사를 겸직하게 될 상황이다.이번에 사외이사 4명을 신규 선임하는 삼성SDI도 최원욱 연세대 교수가 LIG넥스원 사외이사를 맡고 있다.올해 주요 대기업 신규 사외이사 선임에서 유독 SK그룹 계열사의 사외이사 혹은 임직원 출신 인사가 많이 눈에 띄는 것도 특징이다.한진칼 주총에서 한진그룹 측은 SK텔레콤 사외이사를 맡고 있는 김석동 후보와 SKC 사외이사 및 감사위원장을 맡고 있는 박영석 후보를 내세웠다.이에 맞서는 3자연합 측도 SK(주) 사외이사 겸 감사위원 출신인 서윤석 후보를 심규 사외이사 후보 명단에 올렸다.대한항공이 신규 사외이사 후보로 올린 정갑영 연세대 명예특임교수도 SK브로드밴드 사외이사를 맡고 있다.KT의 신규 사외이사 후보 중 하나인 박찬희 중앙대 교수는 지난 2008년부터 2011년까지 지금은 SK(주)와 합병한 SK C&C 사외이사를 맡은 이력이 있다.데일리안 박영국 기자 (24pyk@dailian.co.kr), 이홍석 기자, 박유진 기자, 이도영 기자ⓒ (주)데일리안 - 무단전재, 변형, 무단배포 금지데일리안 관련뉴스해당 언론사에서 선정하며 언론사 페이지(아웃링크)로 이동해 볼 수 있습니다.조현아 \'대놓고 반격\'…조원태 \'밀어내기\'용 한진칼 이사후보 8명 제안[코로나19] \'안전한 주총장 없나요\'...대관 취소에 상장사 \'발 동동\'대한항공, 대표이사-이사회 의장직 분리…사외이사 비중확대한진칼, 사외이사로 김석동 전 금융위원장 등 5명...전문성 \'맞불\'한진칼, 이사회 개최...사외이사진 강화키로좋아요0훈훈해요0슬퍼요0화나요0후속기사 원해요0기사제공 :']"
