,회사명,날짜,언론사,기사제목,링크,본문
0,NC soft, 2020-08-1318:50,한겨레 ,이준용 대림산업 명예회장 ‘수해 성금’ 사재 20억원,https://finance.naver.com/news/news_read.nhn?article_id=0002508726&office_id=028&mode=search&query=엔씨&page=1,"['       이준용 대림산업 명예회장 ‘수해 성금’ 사재 20억원      기사입력2020-08-13 18:50기사원문좋아요훈훈해요좋아요 평가하기공감좋아요0훈훈해요0슬퍼요0화나요0후속기사 원해요0댓글엔씨소프트 10억…케이시시 5억원이준용 대림산업 명예회장 김택진 엔씨소프트 대표  대림산업 이준용 명예회장이 13일 집중호우 피해 지원을 위해 사랑의열매 사회복지공동모금회에 사재 20억원을 기부했다. 이 명예회장은 지난해 12월 사랑의열매에 10억원을 기부해 ‘아너 소사이어티’ 2200호 회원이 됐고, 올 3월에도 코로나19 피해 지원을 위해 써달라며 20억원을 내놓았다.  게임업체 엔씨소프트(대표 김택진)는 13일 수해 복구 성금 10억원을 희망브리지 전국재해구호협회에 기부했다. 케이시시그룹(KCC·회장 정몽진)도 이날 수해 성금 5억원을 전국재해구호협회에 전달했다. 모기업인 케이시시가 3억원, 케이시시글라스와 케이시시건설이 각각 1억원씩 모았다. 한국도로공사와 주택도시보증공사(HUG)는 이날 각각 성금 2억원을, 한국증권금융 꿈나눔재단은 1억원을 전국재해구호협회에 기탁했다.  효성그룹은 이날 대한적십자사에 수해 성금 3억원을 기탁했다. 성금은 지주사인 효성과 효성티앤씨·효성중공업·효성첨단소재·효성화학가 함께 마련했다. 호반건설도 수해 복구 지원을 위해 2억원을 대한적십자사에 기탁했다.최종훈, 김재섭 선임기자 jskim@hani.co.kr▶더불어 행복한 세상을 만드는 언론, 한겨레 구독하세요!▶네이버 채널 한겨레21 구독▶2005년 이전 <한겨레> 기사 보기[ⓒ한겨레신문 : 무단전재 및 재배포 금지]한겨레 관련뉴스해당 언론사에서 선정하며 언론사 페이지(아웃링크)로 이동해 볼 수 있습니다.금요일엔 또 비…폭염특보·열대야도 예상SK바이오사이언스, 노바백스와 \'코로나19 백신 생산\' 계약10대정책 맨앞에 \'기본소득\'…통합당, 중도확장 전략 공식화\'뽀로로 친구\' 루피에겐 죄가 없다검찰 ""조국이 딸 인턴확인서 위조"" 공소장 변경좋아요0훈훈해요0슬퍼요0화나요0후속기사 원해요0기사제공 :']"
1,NC soft, 2020-08-1318:30,매일경제 ,"[컨콜 종합] 엔씨소프트, 숨돌린 2분기…하반기 질주 ‘예고’",https://finance.naver.com/news/news_read.nhn?article_id=0004635109&office_id=009&mode=search&query=엔씨&page=1,"['       [컨콜 종합] 엔씨소프트, 숨돌린 2분기…하반기 질주 ‘예고’      기사입력2020-08-13 18:30기사원문좋아요훈훈해요좋아요 평가하기공감좋아요0훈훈해요0슬퍼요0화나요0후속기사 원해요0댓글 ‘리니지M’ 매출 상승…하반기 ‘리니지2M’ 대만·‘블소2’ 정식 출시  엔씨소프트(대표 김택진)가 예상보다 낮은 2분기 성적표를 제출했다. 예고된 숨돌림이지만 시장 전망치보다 다소 못 미쳤다. 다만 엔씨소프트는 3분기부터 다시 질주가 시작될 것임을 강조했다. ‘리니지M’이 3주년 업데이트 효과로 큰 폭의 매출 증가를 이뤄내고 있고 ‘리니지2M’도 3분기 공성전, 4분기 1주년 대규모 업데이트로 반등을 노리는 상황이다. 여기에 ‘리니지2M’의 대만 출시, 신작 ‘블레이드&소울2’의 출격까지 예고해 실적개선을 기대하게 했다.엔씨소프트는 지난 2분기에 연결기준 매출 5386억원, 영업이익 2090억원, 당기순이익 1584억원을 기록했다. 이는 전년동기 대비 각각 31%, 61%, 36% 상승했지만 전분기에 비해서는 각각 26%, 13%, 19% 감소한 결과다. 당초 에프엔가이드 기준 전망치는 매출 6278억원, 영업이익 2390억원 수준이었다.2분기 부진의 이유는 1분기 호실적을 이끈 리니지 모바일 형제의 매출 감소다. 지난 1분기 2120억원의 매출을 올렸던 ‘리니지M’은 1598억원 수준을 기록했다. ‘리니지2M’의 매출은 1분기 3411억원에서 2분기 1972억원으로 급감했다. 6월 말, 7월 초 대규모 업데이트를 앞두고 프로모션 축소 등을 예고해 매출 감소가 예측됐던 부분이지만 하락 폭이 두드러지게 컸다.하지만 3분기부터는 확실한 실적개선이 가능할 전망이다. ‘리니지2M’이 3주년 업데이트에 힘입어 매출과 이용자 지표가 크게 상승했기 때문이다. 이날 윤재수 엔씨소프트 최고재무책임자(CFO)는 “외부에서 예측한 것 이상으로 크게 상승했다”라고 자신할 정도였다. 최근 7월 ‘리니지M’ 매출이 1분기 월평균 매출보다 30% 증가했다는 분석이 나왔는데 이를 상회한다는 의미다.여기에 ‘리니지2M’도 3분기 공성전과 4분기 1주년 업데이트로 반등을 모색한다. 엔씨소프트는 ‘리니지2M’의 경우 2분기에 의도적으로 프로모션 등을 줄였다. 6월 말 업데이트에 집중하려 했다. 그러나 기대만큼의 반응을 이끌지 못하면서 반등기회를 찾고 있다. 다만 시장에서 보는 것과는 별개로 2분기 ‘리니지2M’의 매출 하락폭은 ‘리니지M’ 초기와 유사한 수준이라고 설명하기도 했다.윤 CFO는 “‘리니지2M’이 1분기까지 리니지M 대비 상당히 높은 실적을 기록했기에 이와 비교해 크게 감소해 보이는 것이지 내부적으로 보면 리니지M 초기 감소폭과 비슷하다”라며 “공성전과 4분기 1주년 업데이트를 준비 중인데 현재 매출 추세를 안정화시키면서 4분기 다시 한번 반등을 노릴 수 있도록 준비하겠다”고 설명했다.‘리니지2M’과 ‘리니지M’의 매출 반등 외에 해외 진출과 신작 출시도 실적개선 기대감을 높이는 부분이다. 하반기 ‘리니지2M’의 대만 지역 출시를 앞뒀다. 엔씨소프트의 자체 서비스로 매출과 영업이익 기여도 긍정적이다.차기작 ‘블레이드&소울2’도 하반기에 내놓는다. 현재 세부 일정을 전략적으로 조율 중이지만 조만간 공식 행사를 통해 발표할 예정이다. 기존 리니지 시리즈와 달리 보다 젊고 트렌디한 20~30대 이용자층을 타깃했다. 모든 지형을 자유롭게 탐험하고 이동할 수 있고 원작의 액션 스타일을 모바일에 맞게 구현했다.콘솔 및 PC 게임 ‘프로젝트 TL’도 조만간 대규모 사내 테스트를 실시한다. 내년 PC 버전으로 우선 출시한다. 콘솔 버전은 이후 선보인다. 엔씨웨스트에서는 북미 및 유럽 시장 공략을 위한 음악게임 ‘퓨저’를 준비 중이다.윤 CFO는 “외부에 알려지지 않은 다양한 PC, 콘솔, 모바일 프로젝트가 있고 여러 파이프라인에서 다양한 시도를 하고 있다”라며 “또 적극적으로 해외 시장에서 투자기회나 M&A 기회도 모색한다”라고 강조했다.[임영택기자 ytlim@mkinternet.com]▶네이버 메인에서 \'매일경제\'를 받아보세요▶\'매일경제\' 바로가기\xa0▶뉴스레터 \'매콤달콤\' 구독[ⓒ 매일경제 & mk.co.kr, 무단전재 및 재배포 금지]매일경제 관련뉴스해당 언론사에서 선정하며 언론사 페이지(아웃링크)로 이동해 볼 수 있습니다.\'폐암 말기\' 김철민, 인공뼈 이식 수술 ""기적 일어나길""노총각 팀장과 성관계 후 입사? 기안84 \'여혐\' 논란…靑청원 5만↑개그우먼 권미진, 엄마 된다…결혼·임신 겹경사봄수연, 스폰·조건+임신 고백?…소속사 다급히\'오뚜기 3세\' 함연지, 독일 시댁서 찍은 영상엔…좋아요0훈훈해요0슬퍼요0화나요0후속기사 원해요0기사제공 :']"
2,NC soft, 2020-08-1317:39,파이낸셜뉴스 ,리니지 IP로 4000억 넘게 벌었다.. 엔씨 올해 '매출 2조 클럽' 청신호,https://finance.naver.com/news/news_read.nhn?article_id=0004477024&office_id=014&mode=search&query=엔씨&page=1,"['       리니지 IP로 4000억 넘게 벌었다.. 엔씨 올해 \'매출 2조 클럽\' 청신호      기사입력2020-08-13 17:39기사원문좋아요훈훈해요좋아요 평가하기공감좋아요0훈훈해요0슬퍼요0화나요0후속기사 원해요0댓글2분기 영업익 2090억… 61%↑  리니지형제가 엔씨소프트의 2·4분기 실적도 훈풍으로 이끌었다. 엔씨소프트의 올해 상반기 매출이 약 1조2000억원을 넘어서면서 올해 매출 2조 클럽에 가입할 것이라는 기대감이 커지고 있다. 엔씨소프트는 핵심 지적재산권(IP)인 리니지형제로 실적 개선을 지속하면서 리니지2M의 해외 진출을 성공하기 위해 박차를 가할 계획이다.   엔씨소프트는 2020년 2·4분기 실적에서 매출 5386억원, 영업이익 2090억원을 기록했다고 13일 공시했다. 지난해 같은 기간보다 매출과 영엽이익은 각각 31%, 61%나 증가했다.   특히 모바일게임 리니지M과 리니지2M이 3571억원의 매출을 올리며 엔씨소프트 2·4분기 전체 매출 66%를 냈다. 지난해 11월 출시된 리니지2M이 2·4분기에 1973억원을 벌며 가장 많은 매출을 기록했다. 구글플레이 매출 1위인 리니지M도 이번 분기에 1599억원을 벌었다. 리니지M은 지난 2017년 6월 출시 이후 2년 5개월 간 구글플레이 매출 1위를 지켰다.   리니지 IP의 힘은 PC온라인 게임에서도 돋보였다. 리니지와 리니지2가 각각 343억원, 258억원의 매출을 냈다. 블레이드앤소울(198억원), 길드워2(156억원), 아이온(82억원) 등이 뒤를 이었다.   엔씨소프트의 하반기 실적은 리니지2M에 달릴 전망이다. 리니지2M의 출시 1주년에 맞춰 대규모 업데이트가 예정돼 있고, 글로벌 진출도 준비하고 있어서다.   이와 관련, 김택진 엔씨소프트 대표가 지난 3월 올해 최대 과제로 글로벌 시장 공략을 꼽으며 선봉장으로 리니지2M을 낙점했다. 리니지2M은 올해 하반기 대만을 시작으로 내년까지 출시 지역을 확대할 계획이다.   아직 건재한 리니지M도 엔씨소프트의 하반기 매출을 책임질 것으로 보인다. 윤재수 엔씨소프트 최고재무책임자(CFO)는 ""리니지M은 사용자 지표와 매출이 눈에 띄게 상승했다""면서 ""업데이트와 신규 서버가 좋은 반응을 얻어 3분기는 2분기보다 확실히 반등된 매출을 보여줄 것""이라고 강조했다.   연내 \'블레이드앤소울(블소)2\'를 비롯한 다양한 신작들도 출시된다. 엔씨소프트는 PC?콘솔과 모바일 플랫폼에서 프로젝트 TL, 블레이드앤소울2, 트릭스터M 등을 개발중이다. 신작은 올 하반기부터 순차적으로 선보인다.  gogosing@fnnews.com 박소현 기자 ▶ 헉! 소리나는 스!토리 뉴스 [헉스]▶ \'아는 척\'하고 싶은 당신을 위한 [두유노우]  ※ 저작권자 ⓒ 파이낸셜뉴스. 무단 전재-재배포 금지파이낸셜뉴스 관련뉴스해당 언론사에서 선정하며 언론사 페이지(아웃링크)로 이동해 볼 수 있습니다.홍상수 김민희 결별? ""영화 관계자, 헤어진 것 같다며..""참지못한 이재명 ""조선일보에 묻는다, 만약..""서울대 \'부끄러운 동문\' 투표 2위는 유시민, 1위는..출산후 구토·설사, 뱃속서 나온 15cm 물건의 정체서울대 나온 女배우의 아버지, 알고보니..좋아요0훈훈해요0슬퍼요0화나요0후속기사 원해요0기사제공 :']"
3,NC soft, 2020-08-1317:36,뉴스1 ,"코웨이, 인터브랜드 '베스트 코리아 브랜드' 6년 연속 선정",https://finance.naver.com/news/news_read.nhn?article_id=0004813137&office_id=421&mode=search&query=엔씨&page=1,"['       코웨이, 인터브랜드 \'베스트 코리아 브랜드\' 6년 연속 선정      기사입력2020-08-13 17:36기사원문좋아요훈훈해요좋아요 평가하기공감좋아요0훈훈해요0슬퍼요0화나요0후속기사 원해요0댓글전년보다 5계단 상승한 26위 기록(코웨이 제공) © 뉴스1(서울=뉴스1) 윤다정 기자 = 코웨이는 글로벌 브랜드 컨설팅 그룹인 인터브랜드가 실시한 \'제8회 베스트 코리아 브랜드 2020\'에서 지난해보다 5계단 오른 26위를 기록하며 대한민국을 대표하는 50대 브랜드에 6년 연속 선정됐다고 13일 밝혔다. 인터브랜드 지난 2013년부터 국내 브랜드 가치를 평가·선정하는 \'베스트 코리아 브랜드\'를 통해 대한민국을 대표하는 최상위 50대 브랜드를 발표해 왔다.코웨이 브랜드 가치는 전년 대비 174% 상승한 1조422억원을 기록, 높은 성장률을 보인 \'탑 그로잉(Top Growing)\' 브랜드에 선정되기도 했다. 올해 탑 그로잉 브랜드에는 카카오, LG생활건강, 엔씨소프트가 함께 언급됐다.또한 리테일 산업분야에서도 브랜드 가치 1위를 차지했으며 CJ ENM, 롯데쇼핑, 이마트 등이 뒤를 이었다.송현주 코웨이 상품개발센터장은 ""국내를 넘어 글로벌 시장에서도 경쟁 우위를 확보 할 수 있도록 브랜드 리더십 강화에 최선을 노력을 다하겠다""고 말했다.maum@news1.kr▶ 네이버 메인에서 [뉴스1] 구독하기!▶  뉴스1 바로가기 ▶  코로나19 뉴스 © 뉴스1코리아(news1.kr), 무단 전재 및 재배포 금지뉴스1 관련뉴스해당 언론사에서 선정하며 언론사 페이지(아웃링크)로 이동해 볼 수 있습니다.김부선 ""뭐 상간녀? 비구니처럼 30년에 벗들은 \'열녀문\' 소리""""홍상수 \'불륜녀 김민희\' 만들어 자책"" 영화계선 결별설 돌았다노래방서 남녀 3명 숨진 채 발견 \'치정 살인\'권민아 ""FNC 한성호 회장 만났다…너무 후회스럽고 죄송""박은영 ""김숙이 준 결혼 축의금에 감동""…금액 봤더니 \'입 쩍\'좋아요0훈훈해요0슬퍼요0화나요0후속기사 원해요0기사제공 :']"
4,NC soft, 2020-08-1317:15,머니투데이 ,값싼 여행·항공 갈아타나…개미들 막판 바이오株 차익실현,https://finance.naver.com/news/news_read.nhn?article_id=0004455128&office_id=008&mode=search&query=엔씨&page=1,"['       값싼 여행·항공 갈아타나…개미들 막판 바이오株 차익실현      기사입력2020-08-13 17:15기사원문좋아요훈훈해요좋아요 평가하기공감좋아요0훈훈해요0슬퍼요0화나요0후속기사 원해요0댓글 [머니투데이 구유나 기자] [내일의 전략]12일 오후 서울 중구 KEB 하나은행 본점 딜링룸 전광판에 코스피지수가 전 거래일 대비 13.68포인트(0.57%) 오른 2,432.35를 나타내고 있다. 이날 원·달러 환율은 0.8원 오른 1,185.3원, 코스닥은 14.63포인트(1.70%) 내린 845.60으로 마감했다. /사진=뉴스1코스피지수가 9거래일 연속 상승 마감했다. 장 마감을 앞두고 2420선까지 밀리는 모습을 보였으나 가까스로 반등에 성공했다. 13일 코스피지수는 전날보다 0.21% 오른 2437.53을 기록했다. 이날 코스피는 선물·옵션 만기일을 맞아 장 마감을 30여분 앞두고 0.7%대까지 하락했다가 반등하며 상승 마감했다. 9거래일 연속이다. 김동완 유진투자증권 연구원은 ""오후 3시 이후 장 마감을 앞두고 동시호가 때 연기금이 매도 주문을 내면서 장중 주가가 떨어진 것으로 파악된다""고 밝혔다. 이날 개인은 1795억원, 기관은 1442억원을 순매수했다. 외국인은 3394억원 순매도했다. 업종별로는 보험이 9.24%로 가장 많이 올랐다. 삼성생명법(보험업법 개정안) 이슈로 삼성생명이 21% 이상 급등한 영향이 컸다. 법안이 통과할 경우 삼성생명이 삼성전자 보유 지분 매각 후 배당을 늘릴 것이라는 기대감이 주가 상승으로 이어졌다. 전기가스, 유통이 2%대 오르고 금융, 기계, 비금속광물이 1%대 상승했다. 시가총액 상위종목들은 혼조세를 보였다. 시총 최상위인 삼성전자, SK하이닉스, 삼성바이오로직스, LG화학은 모두 하락했다. 대표 언택트주인 NAVER, 카카오, 엔씨소프트는 모두 올랐다. 셀트리온도 2%대 상승했다. 이날 코스닥지수는 9.17p(1.08%) 오른 854.77을 기록했다. 바이오주 상승에 힘입어 장중 한때 860선을 돌파했지만 마감을 앞두고 개인들의 차익 실현 매물이 출회된 것으로 풀이된다. 이날 개인은 1790억원어치를 순매도했다. 증권가에서는 미국 증시 호조와 러시아발 코로나19(COVID-19) 백신 개발 소식에 힘입어 바이오 뿐만 아니라 여행, 항공, 화장품 등 그동안 저평가된 업종을 중심으로 순환매가 이뤄질 수 있다고 말한다.다만 증시전문가들은 증시 주도주들이 하루에 10% 가까이 오르는 상승장에서 추격매수는 자제할 필요가 있다고 조언했다. 또 이번 주 2분기 실적 발표 마감을 앞두고 시장 기대치에 못 미치는 결과가 나올 경우 투자심리가 위축될 가능성도 있다. 최석원 SK증권 센터장은 ""코스피지수가 9거래일 연속 상승 마감한 가운데 이 중 5거래일이 1%대 상승한 건 매우 이례적인 일""이라며 ""당분간 개미 주도의 상승장이 계속 되더라도 단기적으로는 조정이 이뤄질 가능성이 높다""고 전망했다. 구유나 기자 yunak@mt.co.kr▶줄리아 투자노트▶조 변호사의 가정상담소 ▶머니투데이 구독하기 <저작권자 ⓒ \'돈이 보이는 리얼타임 뉴스\' 머니투데이, 무단전재 및 재배포 금지>머니투데이 관련뉴스해당 언론사에서 선정하며 언론사 페이지(아웃링크)로 이동해 볼 수 있습니다.\'여혐\' 다음은 유흥업소?…기안84, 전현무·화사 캐릭터 논란\'풍문쇼\' ""한성주, 재벌과 결혼한 첫 아나운서…지금은 S대 연구원""10살 딸 첫 온라인 수업 때 4명의 자녀 앞에서 살해된 여성\'오뚜기\' 함연지, 잠옷 입고 부엌 서성이자…시어머니 한마디489억에 대저택 샀는데…칼에 찔린 시신 발견좋아요0훈훈해요0슬퍼요0화나요0후속기사 원해요0기사제공 :']"
5,NC soft, 2020-08-1317:08,파이낸셜뉴스 ,"코웨이, 대한민국 대표 50대 브랜드에 6년째 선정",https://finance.naver.com/news/news_read.nhn?article_id=0004476976&office_id=014&mode=search&query=엔씨&page=1,"['       코웨이, 대한민국 대표 50대 브랜드에 6년째 선정      기사입력2020-08-13 17:08기사원문좋아요훈훈해요좋아요 평가하기공감좋아요0훈훈해요0슬퍼요0화나요0후속기사 원해요0댓글 코웨이가 대한민국을 대표하는 50대 브랜드에 6년 연속 선정됐다.   코웨이는 글로벌 브랜드 컨설팅 그룹인 인터브랜드가 실시한 \'제 8회 베스트 코리아 브랜드 2020\'에서 26위를 기록했다고 13일 밝혔다. 특히 코웨이는 전년 대비 높은 브랜드 가치 성장률을 기록한 \'Top Growing\' 브랜드에도 선정됐다. 인터브랜드는 글로벌 톱 100 브랜드를 선정하는 세계적인 브랜드 컨설팅 전문업체다.   코웨이는 올해 \'베스트 코리아 브랜드 2020\'에서 지난 해보다 순위가 다섯 계단 상승했다. 코웨이의 브랜드 가치는 전년 대비 17.4% 상승한 1조 422억원으로 추산됐다. 올해 Top Growing 브랜드에는 코웨이를 포함해 카카오, LG생활건강, 엔씨소프트가 함께 언급됐다. 코웨이는 리테일 산업분야에서도 브랜드 가치 1위를 차지했다. CJ ENM, 롯데쇼핑, 이마트 등이 뒤를 이었다.   코웨이는 빠르게 진화하는 시장 환경 속에서 고객 니즈에 선제적으로 대응한 결과 지난 해 매출 3조원을 돌파하며 업계 리더로서의 위치를 더욱 공고히 했다. 말레이시아에서는 시장 점유율 1위를 수성하고 있다.    happyny777@fnnews.com 김은진 기자 ▶ 헉! 소리나는 스!토리 뉴스 [헉스]▶ \'아는 척\'하고 싶은 당신을 위한 [두유노우]  ※ 저작권자 ⓒ 파이낸셜뉴스. 무단 전재-재배포 금지파이낸셜뉴스 관련뉴스해당 언론사에서 선정하며 언론사 페이지(아웃링크)로 이동해 볼 수 있습니다.홍상수 김민희 결별? ""영화 관계자, 헤어진 것 같다며..""참지못한 이재명 ""조선일보에 묻는다, 만약..""서울대 \'부끄러운 동문\' 투표 2위는 유시민, 1위는..서울대 나온 女배우의 아버지, 알고보니..많은 연예인들에 대시 받은 이다영 누구길래? 남자들이..좋아요0훈훈해요0슬퍼요0화나요0후속기사 원해요0기사제공 :']"
6,NC soft, 2020-08-1317:01,더팩트 ,"[TF매매동향] 외국인, '셀트리온' 사고 '현대차' 팔았다",https://finance.naver.com/news/news_read.nhn?article_id=0000037331&office_id=629&mode=search&query=엔씨&page=1,"[""       [TF매매동향] 외국인, '셀트리온' 사고 '현대차' 팔았다      기사입력2020-08-13 17:01기사원문좋아요훈훈해요좋아요 평가하기공감좋아요0훈훈해요0슬퍼요0화나요0후속기사 원해요0댓글코스피가 개인과 기관의 동반 매수에 8거래일 연속 상승 마감했다. 코스닥에서는 외인과 기관의 쌍끌이 매수에 강세 마감했다. /더팩트 DB셀트리온 832억 원 매수·현대차1177억 원 매도[더팩트ㅣ박경현 기자] 코스피가 개인과 기관의 동반 매수에 8거래일 연속 상승 마감했다. 개인과 기관은 각각 1570억 원, 1857억 원을 사들인 반면 외국인은 홀로 3519억 원을 팔아치웠다. 코스닥에서는 외인과 기관의 쌍끌이 매수에 강세 마감했다.외국인투자자의 코스피시장 최대매수는 셀트리온으로 향했다. 외인은 셀트리온 832억 원, 엔씨소프트 581억 원, KB금융 465억 원, SK텔레콤 364억 원, 아모레퍼시픽 263억 원을 사들였다.반면 현대차는1177억 원을 팔았다. 이어 삼성전자 785억 원, LG화학 753억 원, 네이버 483억 원, 삼성바이오로직스 446억 원 순으로 순매도했다.코스닥 시장에서는 셀트리온헬스케어(673억 원), 알테오젠(168억 원), 에이치엘비(156억 원)를 사고, 휴젤(60억 원), 미코(57억 원), 서울반도체(49억 원)는 팔았다.기관투자자는 이날 엔씨소프트 569억 원을 순매수했다. 이어 카카오 512억 원, 삼성물산 457억 원, 한국전력 434억 원 순으로 사들였다. /한국거래소 제공기관투자자는 이날 엔씨소프트 569억 원을 순매수했다. 이어 카카오 512억 원, 삼성물산 457억 원, 한국전력 434억 원 순으로 사들였다.반면 네이버는 208억 원을 순매도했다. 또한 CJ제일제당 185억 원, SK하이닉스 149억 원, 삼성바이오로직스 127억 원 순으로 팔아치웠다.이날 시가총액 상위 종목은 대부분 하락했다. 삼성전자(-0.51%), SK하이닉스(-0.37%), 삼성바이오로직스(-2.73%), LG화학(-0.54%), 현대차(-1.16%), 삼성SDI(-0.95%)가 내림세를 보인 반면 네이버(+0.66%), 셀트리온(+2.15%), 카카오(+1.84%)는 오름세를 나타냈다. 삼성전자우선주는 보합세에 거래를 마쳤다.pkh@tf.co.kr- 더팩트 뮤직어워즈는 언제? [알림받기▶]  - 내 아이돌 응원하기 [팬앤스타▶]  저작권자 ⓒ 특종에 강한 더팩트 & tf.co.kr 무단 전재 및 재배포 금지더팩트 관련뉴스해당 언론사에서 선정하며 언론사 페이지(아웃링크)로 이동해 볼 수 있습니다.'정의연 의혹' 윤미향 의원 검찰 출석…수사 3개월 만[TF사진관] 김연아, '피겨여왕의 미모 클래스!'기안84, 웹툰 일부 수정→연재중지·'나혼산' 하차요구 쇄도'흥행 조짐' 갤럭시노트20, 어떤 모델이 인기 많을까?[TF초첨] '사의→사찰 칩거→지지율↑' 주호영의 롤러코스터 100일좋아요0훈훈해요0슬퍼요0화나요0후속기사 원해요0기사제공 :""]"
